library/src/amd_detail/rocblaslt/src/Tensile/Logic/asm_full/aquavanjaram/gfx942/GridBased/aquavanjaram_Cijk_Alik_Bjlk_S_MX_B_Bias_HAS_SAV_UserArgs.yaml
- {MinimumRequiredVersion: 4.33.0}
- aquavanjaram
- gfx942
- [Device 0049, Device 0050]
    SolutionIndex: 0
    SolutionNameMin: Cijk_Alik_Bjlk_S_MX_B_Bias_HAS_SAV_UserArgs_MT16x16x16_MI16x16x1_SN_LDSB0_CLR1_GSU1_GSUC0_GSUWGMRR0_K1_LBSPPA128_LBSPPB128_LPA2_LRVW2_LSU1_MIWT1_1_NLCA1_PLR1_SU0_SUM0_SUS0_WG16_4_1_WGM8_WGMXCC1_WGMXCCGn1
    SolutionIndex: 1
    SolutionNameMin: Cijk_Alik_Bjlk_S_MX_B_Bias_HAS_SAV_UserArgs_MT16x16x16_MI16x16x1_SN_LDSB0_CLR0_GSU1_GSUC0_GSUWGMRR0_K1_LBSPPA128_LBSPPB128_LPA2_LRVW2_LSU2_MIWT1_1_NLCA1_PLR0_SU0_SUM0_SUS0_WG16_4_2_WGM8_WGMXCC1_WGMXCCGn1
    SolutionIndex: 2
    SolutionNameMin: Cijk_Alik_Bjlk_S_MX_B_Bias_HAS_SAV_UserArgs_MT32x16x16_MI16x16x1_SN_LDSB0_CLR1_GSU1_GSUC0_GSUWGMRR0_K1_LBSPPA128_LBSPPB128_LPA2_LRVW2_LSU1_MIWT1_1_NLCA1_PLR1_SU0_SUM0_SUS0_WG32_4_1_WGM8_WGMXCC1_WGMXCCGn1
    SolutionIndex: 3
    SolutionNameMin: Cijk_Alik_Bjlk_S_MX_B_Bias_HAS_SAV_UserArgs_MT32x16x16_MI16x16x1_SN_LDSB0_CLR0_GSU1_GSUC0_GSUWGMRR0_K1_LBSPPA128_LBSPPB128_LPA2_LRVW2_LSU2_MIWT1_1_NLCA1_PLR0_SU0_SUM0_SUS0_WG32_4_2_WGM8_WGMXCC1_WGMXCCGn1
    SolutionIndex: 4
    SolutionNameMin: Cijk_Alik_Bjlk_S_MX_B_Bias_HAS_SAV_UserArgs_MT64x16x16_MI16x16x1_SN_LDSB0_CLR1_GSU1_GSUC0_GSUWGMRR0_K1_LBSPPA128_LBSPPB128_LPA2_LRVW2_LSU1_MIWT1_1_NLCA1_PLR1_SU0_SUM0_SUS0_WG64_4_1_WGM8_WGMXCC1_WGMXCCGn1
    SolutionIndex: 5
    SolutionNameMin: Cijk_Alik_Bjlk_S_MX_B_Bias_HAS_SAV_UserArgs_MT64x16x16_MI16x16x1_SN_LDSB0_CLR1_GSU1_GSUC0_GSUWGMRR0_K1_LBSPPA128_LBSPPB128_LPA2_LRVW2_LSU1_MIWT2_1_NLCA1_PLR1_SU0_SUM0_SUS0_WG32_4_1_WGM8_WGMXCC1_WGMXCCGn1
    SolutionIndex: 6
    SolutionNameMin: Cijk_Alik_Bjlk_S_MX_B_Bias_HAS_SAV_UserArgs_MT128x16x16_MI16x16x1_SN_LDSB0_CLR1_GSU1_GSUC0_GSUWGMRR0_K1_LBSPPA128_LBSPPB128_LPA2_LRVW2_LSU1_MIWT2_1_NLCA1_PLR1_SU0_SUM0_SUS0_WG64_4_1_WGM8_WGMXCC1_WGMXCCGn1
    SolutionIndex: 7
    SolutionNameMin: Cijk_Alik_Bjlk_S_MX_B_Bias_HAS_SAV_UserArgs_MT256x16x16_MI16x16x1_SN_LDSB1_CLR1_GSU1_GSUC0_GSUWGMRR0_K1_LBSPPA128_LBSPPB128_LPA2_LRVW2_LSU1_MIWT4_1_NLCA1_PLR1_SU0_SUM0_SUS0_WG64_4_1_WGM8_WGMXCC1_WGMXCCGn1
    SolutionIndex: 8
    SolutionNameMin: Cijk_Alik_Bjlk_S_MX_B_Bias_HAS_SAV_UserArgs_MT256x16x16_MI16x16x1_SN_LDSB1_CLR0_GSU1_GSUC0_GSUWGMRR0_K1_LBSPPA128_LBSPPB128_LPA2_LRVW2_LSU2_MIWT8_1_NLCA1_PLR0_SU0_SUM0_SUS0_WG32_4_2_WGM8_WGMXCC1_WGMXCCGn1
    SolutionIndex: 9
    SolutionNameMin: Cijk_Alik_Bjlk_S_MX_B_Bias_HAS_SAV_UserArgs_MT32x16x32_MI16x16x1_SN_LDSB0_CLR1_GSU1_GSUC0_GSUWGMRR0_K1_LBSPPA128_LBSPPB256_LPA8_LRVW4_LSU1_MIWT1_1_NLCA1_PLR1_SU0_SUM0_SUS0_WG32_4_1_WGM8_WGMXCC1_WGMXCCGn1
    SolutionIndex: 10
    SolutionNameMin: Cijk_Alik_Bjlk_S_MX_B_Bias_HAS_SAV_UserArgs_MT64x16x32_MI16x16x1_SN_LDSB0_CLR1_GSU1_GSUC0_GSUWGMRR0_K1_LBSPPA128_LBSPPB256_LPA8_LRVW4_LSU1_MIWT1_1_NLCA1_PLR1_SU0_SUM0_SUS0_WG64_4_1_WGM8_WGMXCC1_WGMXCCGn1
    SolutionIndex: 11
    SolutionNameMin: Cijk_Alik_Bjlk_S_MX_B_Bias_HAS_SAV_UserArgs_MT128x16x32_MI16x16x1_SN_LDSB1_CLR1_GSU1_GSUC0_GSUWGMRR0_K1_LBSPPA128_LBSPPB256_LPA8_LRVW4_LSU1_MIWT2_1_NLCA1_PLR1_SU0_SUM0_SUS0_WG64_4_1_WGM8_WGMXCC1_WGMXCCGn1
    SolutionIndex: 12
    SolutionNameMin: Cijk_Alik_Bjlk_S_MX_B_Bias_HAS_SAV_UserArgs_MT128x16x32_MI16x16x1_SN_LDSB1_CLR1_GSU1_GSUC0_GSUWGMRR0_K1_LBSPPA128_LBSPPB256_LPA8_LRVW4_LSU2_MIWT2_1_NLCA1_PLR1_SU0_SUM0_SUS0_WG64_4_2_WGM8_WGMXCC1_WGMXCCGn1
    SolutionIndex: 13
    SolutionNameMin: Cijk_Alik_Bjlk_S_MX_B_Bias_HAS_SAV_UserArgs_MT256x16x32_MI16x16x1_SN_LDSB1_CLR1_GSU1_GSUC0_GSUWGMRR0_K1_LBSPPA128_LBSPPB256_LPA8_LRVW4_LSU2_MIWT4_1_NLCA1_PLR1_SU0_SUM0_SUS0_WG64_4_2_WGM8_WGMXCC1_WGMXCCGn1
    SolutionIndex: 14
    SolutionNameMin: Cijk_Alik_Bjlk_S_MX_B_Bias_HAS_SAV_UserArgs_MT16x16x64_MI16x16x1_SN_LDSB0_CLR1_GSU1_GSUC0_GSUWGMRR0_K1_LBSPPA256_LBSPPB256_LPA8_LRVW4_LSU4_MIWT1_1_NLCA1_PLR1_SU0_SUM0_SUS0_WG16_4_4_WGM8_WGMXCC1_WGMXCCGn1
    SolutionIndex: 15
    SolutionNameMin: Cijk_Alik_Bjlk_S_MX_B_Bias_HAS_SAV_UserArgs_MT32x16x64_MI16x16x1_SN_LDSB0_CLR1_GSU1_GSUC0_GSUWGMRR0_K1_LBSPPA256_LBSPPB256_LPA8_LRVW4_LSU2_MIWT1_1_NLCA1_PLR1_SU0_SUM0_SUS0_WG32_4_2_WGM8_WGMXCC1_WGMXCCGn1
    SolutionIndex: 16
    SolutionNameMin: Cijk_Alik_Bjlk_S_MX_B_Bias_HAS_SAV_UserArgs_MT64x16x64_MI16x16x1_SN_LDSB1_CLR1_GSU1_GSUC0_GSUWGMRR0_K1_LBSPPA256_LBSPPB256_LPA8_LRVW4_LSU1_MIWT1_1_NLCA1_PLR1_SU0_SUM0_SUS0_WG64_4_1_WGM8_WGMXCC1_WGMXCCGn1
    SolutionIndex: 17
    SolutionNameMin: Cijk_Alik_Bjlk_S_MX_B_Bias_HAS_SAV_UserArgs_MT16x16x128_MI16x16x1_SN_LDSB1_CLR1_GSU1_GSUC0_GSUWGMRR0_K1_LBSPPA512_LBSPPB256_LPA8_LRVW4_LSU4_MIWT1_1_NLCA1_PLR1_SU0_SUM0_SUS0_WG16_4_4_WGM8_WGMXCC1_WGMXCCGn1
    SolutionIndex: 18
    SolutionNameMin: Cijk_Alik_Bjlk_S_MX_B_Bias_HAS_SAV_UserArgs_MT32x16x128_MI16x16x1_SN_LDSB1_CLR1_GSU1_GSUC0_GSUWGMRR0_K1_LBSPPA512_LBSPPB256_LPA8_LRVW4_LSU4_MIWT1_1_NLCA1_PLR1_SU0_SUM0_SUS0_WG32_4_4_WGM8_WGMXCC1_WGMXCCGn1
    SolutionIndex: 19
    SolutionNameMin: Cijk_Alik_Bjlk_S_MX_B_Bias_HAS_SAV_UserArgs_MT16x16x256_MI16x16x1_SN_LDSB1_CLR1_GSU1_GSUC0_GSUWGMRR0_K1_LBSPPA1024_LBSPPB256_LPA8_LRVW4_LSU4_MIWT1_1_NLCA1_PLR1_SU0_SUM0_SUS0_WG16_4_4_WGM8_WGMXCC1_WGMXCCGn1
    SolutionIndex: 20
    SolutionNameMin: Cijk_Alik_Bjlk_S_MX_B_Bias_HAS_SAV_UserArgs_MT16x16x16_MI16x16x1_SN_LDSB0_CLR0_GSU1_GSUC0_GSUWGMRR0_K1_LBSPPA128_LBSPPB128_LPA2_LRVW2_LSU2_MIWT1_1_NLCA1_NLCB1_PLR0_SU0_SUM0_SUS0_WG16_4_2_WGM8_WGMXCC1_WGMXCCGn1
    SolutionIndex: 21
    SolutionNameMin: Cijk_Alik_Bjlk_S_MX_B_Bias_HAS_SAV_UserArgs_MT16x32x16_MI16x16x1_SN_LDSB0_CLR1_GSU1_GSUC0_GSUWGMRR0_K1_LBSPPA128_LBSPPB256_LPA2_LRVW2_LSU1_MIWT1_1_NLCA1_NLCB1_PLR1_SU0_SUM0_SUS0_WG16_8_1_WGM8_WGMXCC1_WGMXCCGn1
    SolutionIndex: 22
    SolutionNameMin: Cijk_Alik_Bjlk_S_MX_B_Bias_HAS_SAV_UserArgs_MT16x16x16_MI16x16x1_SN_LDSB0_CLR1_GSU1_GSUC0_GSUWGMRR0_K1_LBSPPA128_LBSPPB128_LPA2_LRVW2_LSU1_MIWT1_1_NLCA1_NLCB1_PLR1_SU0_SUM0_SUS0_WG16_4_1_WGM8_WGMXCC1_WGMXCCGn1
    SolutionIndex: 23
    SolutionNameMin: Cijk_Alik_Bjlk_S_MX_B_Bias_HAS_SAV_UserArgs_MT16x64x16_MI16x16x1_SN_LDSB0_CLR1_GSU1_GSUC0_GSUWGMRR0_K1_LBSPPA128_LBSPPB512_LPA2_LRVW2_LSU1_MIWT1_1_NLCA1_NLCB1_PLR1_SU0_SUM0_SUS0_WG16_16_1_WGM8_WGMXCC1_WGMXCCGn1
    SolutionIndex: 24
    SolutionNameMin: Cijk_Alik_Bjlk_S_MX_B_Bias_HAS_SAV_UserArgs_MT16x64x16_MI16x16x1_SN_LDSB0_CLR1_GSU1_GSUC0_GSUWGMRR0_K1_LBSPPA128_LBSPPB512_LPA2_LRVW2_LSU1_MIWT1_2_NLCA1_NLCB1_PLR1_SU0_SUM0_SUS0_WG16_8_1_WGM8_WGMXCC1_WGMXCCGn1
    SolutionIndex: 25
    SolutionNameMin: Cijk_Alik_Bjlk_S_MX_B_Bias_HAS_SAV_UserArgs_MT16x128x16_MI16x16x1_SN_LDSB0_CLR1_GSU1_GSUC0_GSUWGMRR0_K1_LBSPPA128_LBSPPB1024_LPA2_LRVW2_LSU1_MIWT1_2_NLCA1_NLCB1_PLR1_SU0_SUM0_SUS0_WG16_16_1_WGM8_WGMXCC1_WGMXCCGn1
    SolutionIndex: 26
    SolutionNameMin: Cijk_Alik_Bjlk_S_MX_B_Bias_HAS_SAV_UserArgs_MT16x256x16_MI16x16x1_SN_LDSB1_CLR1_GSU1_GSUC0_GSUWGMRR0_K1_LBSPPA128_LBSPPB2048_LPA2_LRVW2_LSU1_MIWT1_4_NLCA1_NLCB1_PLR1_SU0_SUM0_SUS0_WG16_16_1_WGM8_WGMXCC1_WGMXCCGn1
    SolutionIndex: 27
    SolutionNameMin: Cijk_Alik_Bjlk_S_MX_B_Bias_HAS_SAV_UserArgs_MT16x128x32_MI16x16x1_SN_LDSB1_CLR1_GSU1_GSUC0_GSUWGMRR0_K1_LBSPPA128_LBSPPB2048_LPA8_LRVW4_LSU1_MIWT1_2_NLCA1_NLCB1_PLR1_SU0_SUM0_SUS0_WG16_16_1_WGM8_WGMXCC1_WGMXCCGn1
    SolutionIndex: 28
    SolutionNameMin: Cijk_Alik_Bjlk_S_MX_B_Bias_HAS_SAV_UserArgs_MT16x16x64_MI16x16x1_SN_LDSB0_CLR1_GSU1_GSUC0_GSUWGMRR0_K1_LBSPPA256_LBSPPB256_LPA8_LRVW4_LSU4_MIWT1_1_NLCA1_NLCB1_PLR1_SU0_SUM0_SUS0_WG16_4_4_WGM8_WGMXCC1_WGMXCCGn1
    SolutionIndex: 29
    SolutionNameMin: Cijk_Alik_Bjlk_S_MX_B_Bias_HAS_SAV_UserArgs_MT16x16x128_MI16x16x1_SN_LDSB1_CLR1_GSU1_GSUC0_GSUWGMRR0_K1_LBSPPA512_LBSPPB256_LPA8_LRVW4_LSU4_MIWT1_1_NLCA1_NLCB1_PLR1_SU0_SUM0_SUS0_WG16_4_4_WGM8_WGMXCC1_WGMXCCGn1
    SolutionIndex: 30
    SolutionNameMin: Cijk_Alik_Bjlk_S_MX_B_Bias_HAS_SAV_UserArgs_MT16x32x64_MI16x16x1_SN_LDSB0_CLR1_GSU1_GSUC0_GSUWGMRR0_K1_LBSPPA256_LBSPPB512_LPA8_LRVW4_LSU4_MIWT1_1_NLCA1_NLCB1_PLR1_SU0_SUM0_SUS0_WG16_8_4_WGM8_WGMXCC1_WGMXCCGn1
    SolutionIndex: 31
    SolutionNameMin: Cijk_Alik_Bjlk_S_MX_B_Bias_HAS_SAV_UserArgs_MT16x64x32_MI16x16x1_SN_LDSB0_CLR1_GSU1_GSUC0_GSUWGMRR0_K1_LBSPPA128_LBSPPB1024_LPA8_LRVW4_LSU1_MIWT1_1_NLCA1_NLCB1_PLR1_SU0_SUM0_SUS0_WG16_16_1_WGM8_WGMXCC1_WGMXCCGn1
    SolutionIndex: 32
    SolutionNameMin: Cijk_Alik_Bjlk_S_MX_B_Bias_HAS_SAV_UserArgs_MT16x32x32_MI16x16x1_SN_LDSB0_CLR1_GSU1_GSUC0_GSUWGMRR0_K1_LBSPPA128_LBSPPB512_LPA8_LRVW4_LSU1_MIWT1_1_NLCA1_NLCB1_PLR1_SU0_SUM0_SUS0_WG16_8_1_WGM8_WGMXCC1_WGMXCCGn1
    SolutionIndex: 33
    SolutionNameMin: Cijk_Alik_Bjlk_S_MX_B_Bias_HAS_SAV_UserArgs_MT16x64x64_MI16x16x1_SN_LDSB1_CLR1_GSU1_GSUC0_GSUWGMRR0_K1_LBSPPA256_LBSPPB1024_LPA8_LRVW4_LSU1_MIWT1_1_NLCA1_NLCB1_PLR1_SU0_SUM0_SUS0_WG16_16_1_WGM8_WGMXCC1_WGMXCCGn1
    SolutionIndex: 34
    SolutionNameMin: Cijk_Alik_Bjlk_S_MX_B_Bias_HAS_SAV_UserArgs_MT16x32x64_MI16x16x1_SN_LDSB0_CLR1_GSU1_GSUC0_GSUWGMRR0_K1_LBSPPA256_LBSPPB512_LPA8_LRVW4_LSU2_MIWT1_1_NLCA1_NLCB1_PLR1_SU0_SUM0_SUS0_WG16_8_2_WGM8_WGMXCC1_WGMXCCGn1
    SolutionIndex: 35
    SolutionNameMin: Cijk_Alik_Bjlk_S_MX_B_Bias_HAS_SAV_UserArgs_MT16x128x32_MI16x16x1_SN_LDSB1_CLR1_GSU1_GSUC0_GSUWGMRR0_K1_LBSPPA128_LBSPPB2048_LPA8_LRVW4_LSU2_MIWT1_2_NLCA1_NLCB1_PLR1_SU0_SUM0_SUS0_WG16_16_2_WGM8_WGMXCC1_WGMXCCGn1
    SolutionIndex: 36
    SolutionNameMin: Cijk_Alik_Bjlk_S_MX_B_Bias_HAS_SAV_UserArgs_MT16x32x64_MI16x16x1_SN_LDSB0_CLR1_GSU1_GSUC0_GSUWGMRR0_K1_LBSPPA256_LBSPPB512_LPA8_LRVW4_LSU1_MIWT1_1_NLCA1_NLCB1_PLR1_SU0_SUM0_SUS0_WG16_8_1_WGM8_WGMXCC1_WGMXCCGn1
    SolutionIndex: 37
    SolutionNameMin: Cijk_Alik_Bjlk_S_MX_B_Bias_HAS_SAV_UserArgs_MT16x16x32_MI16x16x1_SN_LDSB0_CLR1_GSU1_GSUC0_GSUWGMRR0_K1_LBSPPA128_LBSPPB256_LPA8_LRVW4_LSU2_MIWT1_1_NLCA1_NLCB1_PLR1_SU0_SUM0_SUS0_WG16_4_2_WGM8_WGMXCC1_WGMXCCGn1
    SolutionIndex: 38
    SolutionNameMin: Cijk_Alik_Bjlk_S_MX_B_Bias_HAS_SAV_UserArgs_MT16x128x32_MI16x16x1_SN_LDSB1_CLR1_GSU1_GSUC0_GSUWGMRR0_K1_LBSPPA128_LBSPPB2048_LPA8_LRVW4_LSU1_MIWT1_4_NLCA1_NLCB1_PLR1_SU0_SUM0_SUS0_WG16_8_1_WGM8_WGMXCC1_WGMXCCGn1
    SolutionIndex: 39
    SolutionNameMin: Cijk_Alik_Bjlk_S_MX_B_Bias_HAS_SAV_UserArgs_MT16x64x16_MI16x16x1_SN_LDSB0_CLR0_GSU1_GSUC0_GSUWGMRR0_K1_LBSPPA128_LBSPPB512_LPA2_LRVW2_LSU2_MIWT1_2_NLCA1_NLCB1_PLR0_SU0_SUM0_SUS0_WG16_8_2_WGM8_WGMXCC1_WGMXCCGn1
    SolutionIndex: 40
    SolutionNameMin: Cijk_Alik_Bjlk_S_MX_B_Bias_HAS_SAV_UserArgs_MT16x32x128_MI16x16x1_SN_LDSB1_CLR1_GSU1_GSUC0_GSUWGMRR0_K1_LBSPPA512_LBSPPB512_LPA8_LRVW4_LSU2_MIWT1_1_NLCA1_NLCB1_PLR1_SU0_SUM0_SUS0_WG16_8_2_WGM8_WGMXCC1_WGMXCCGn1
    SolutionIndex: 41
    SolutionNameMin: Cijk_Alik_Bjlk_S_MX_B_Bias_HAS_SAV_UserArgs_MT16x128x64_MI16x16x1_SN_LDSB1_CLR1_GSU1_GSUC0_GSUWGMRR0_K1_LBSPPA256_LBSPPB2048_LPA8_LRVW4_LSU2_MIWT1_2_NLCA1_NLCB1_PLR1_SU0_SUM0_SUS0_WG16_16_2_WGM8_WGMXCC1_WGMXCCGn1
    SolutionIndex: 42
    SolutionNameMin: Cijk_Alik_Bjlk_S_MX_B_Bias_HAS_SAV_UserArgs_MT16x256x32_MI16x16x1_SN_LDSB1_CLR1_GSU1_GSUC0_GSUWGMRR0_K1_LBSPPA128_LBSPPB4096_LPA8_LRVW4_LSU2_MIWT1_4_NLCA1_NLCB1_PLR1_SU0_SUM0_SUS0_WG16_16_2_WGM8_WGMXCC1_WGMXCCGn1
    SolutionIndex: 43
    SolutionNameMin: Cijk_Alik_Bjlk_S_MX_B_Bias_HAS_SAV_UserArgs_MT16x16x32_MI16x16x1_SN_LDSB0_CLR1_GSU1_GSUC0_GSUWGMRR0_K1_LBSPPA128_LBSPPB256_LPA8_LRVW4_LSU1_MIWT1_1_NLCA1_NLCB1_PLR1_SU0_SUM0_SUS0_WG16_4_1_WGM8_WGMXCC1_WGMXCCGn1
    SolutionIndex: 44
    SolutionNameMin: Cijk_Alik_Bjlk_S_MX_B_Bias_HAS_SAV_UserArgs_MT128x16x8_MI16x16x1_SN_ASEM8_CLR0_DTVA1_GSU1_GSUC0_GSUWGMRR0_K1_LBSPPA0_LPA0_MIWT8_1_NTA7_NTB0_PGR2_SS0_SU0_SUM0_SUS0_SVW4_VWA4_WG16_4_1_WGM8_WGMXCC1_WGMXCCGn1
- - - [16, 16, 2, 16]
    - [20, 0.0]
  - - [32, 16, 2, 16]
    - [1, 0.0]
  - - [48, 16, 2, 16]
    - [0, 0.01]
  - - [64, 16, 2, 16]
    - [2, 0.01]
  - - [80, 16, 2, 16]
    - [3, 0.01]
  - - [96, 16, 2, 16]
    - [2, 0.01]
  - - [112, 16, 2, 16]
    - [0, 0.02]
  - - [128, 16, 2, 16]
    - [4, 0.02]
  - - [144, 16, 2, 16]
    - [0, 0.02]
  - - [160, 16, 2, 16]
    - [0, 0.02]
  - - [176, 16, 2, 16]
    - [0, 0.03]
  - - [192, 16, 2, 16]
    - [0, 0.03]
  - - [208, 16, 2, 16]
    - [0, 0.03]
  - - [224, 16, 2, 16]
    - [0, 0.03]
  - - [240, 16, 2, 16]
    - [0, 0.04]
  - - [256, 16, 2, 16]
    - [0, 0.04]
  - - [16, 16, 130, 16]
    - [22, 0.13]
  - - [32, 16, 130, 16]
    - [2, 0.27]
  - - [48, 16, 130, 16]
    - [0, 0.39]
  - - [64, 16, 130, 16]
    - [0, 0.54]
  - - [80, 16, 130, 16]
    - [0, 0.62]
  - - [96, 16, 130, 16]
    - [4, 0.77]
  - - [112, 16, 130, 16]
    - [4, 0.84]
  - - [128, 16, 130, 16]
    - [4, 1.03]
  - - [144, 16, 130, 16]
    - [0, 1.01]
  - - [160, 16, 130, 16]
    - [2, 1.18]
  - - [176, 16, 130, 16]
    - [4, 1.21]
  - - [192, 16, 130, 16]
    - [4, 1.44]
  - - [208, 16, 130, 16]
    - [4, 1.38]
  - - [224, 16, 130, 16]
    - [4, 1.57]
  - - [240, 16, 130, 16]
    - [4, 1.57]
  - - [256, 16, 130, 16]
    - [4, 1.83]
  - - [16, 16, 258, 16]
    - [22, 0.27]
  - - [32, 16, 258, 16]
    - [2, 0.52]
  - - [48, 16, 258, 16]
    - [4, 0.73]
  - - [64, 16, 258, 16]
    - [4, 1.02]
  - - [80, 16, 258, 16]
    - [4, 1.09]
  - - [96, 16, 258, 16]
    - [2, 1.37]
  - - [112, 16, 258, 16]
    - [4, 1.47]
  - - [128, 16, 258, 16]
    - [4, 1.82]
  - - [144, 16, 258, 16]
    - [6, 1.7]
  - - [160, 16, 258, 16]
    - [5, 1.94]
  - - [176, 16, 258, 16]
    - [6, 1.99]
  - - [192, 16, 258, 16]
    - [5, 2.39]
  - - [208, 16, 258, 16]
    - [6, 2.25]
  - - [224, 16, 258, 16]
    - [6, 2.48]
  - - [240, 16, 258, 16]
    - [6, 2.44]
  - - [256, 16, 258, 16]
    - [5, 2.94]
  - - [16, 16, 386, 16]
    - [22, 0.39]
  - - [32, 16, 386, 16]
    - [0, 0.76]
  - - [48, 16, 386, 16]
    - [0, 1.01]
  - - [64, 16, 386, 16]
    - [4, 1.41]
  - - [80, 16, 386, 16]
    - [6, 1.47]
  - - [96, 16, 386, 16]
    - [2, 1.83]
  - - [112, 16, 386, 16]
    - [6, 1.92]
  - - [128, 16, 386, 16]
    - [6, 2.39]
  - - [144, 16, 386, 16]
    - [5, 2.18]
  - - [160, 16, 386, 16]
    - [5, 2.54]
  - - [176, 16, 386, 16]
    - [4, 2.48]
  - - [192, 16, 386, 16]
    - [5, 3.08]
  - - [208, 16, 386, 16]
    - [7, 2.66]
  - - [224, 16, 386, 16]
    - [7, 2.83]
  - - [240, 16, 386, 16]
    - [7, 2.88]
  - - [256, 16, 386, 16]
    - [7, 3.36]
  - - [16, 16, 514, 16]
    - [22, 0.52]
  - - [32, 16, 514, 16]
    - [0, 0.99]
  - - [48, 16, 514, 16]
    - [4, 1.29]
  - - [64, 16, 514, 16]
    - [4, 1.79]
  - - [80, 16, 514, 16]
    - [6, 1.86]
  - - [96, 16, 514, 16]
    - [6, 2.19]
  - - [112, 16, 514, 16]
    - [6, 2.35]
  - - [128, 16, 514, 16]
    - [5, 2.86]
  - - [144, 16, 514, 16]
    - [7, 2.53]
  - - [160, 16, 514, 16]
    - [7, 2.76]
  - - [176, 16, 514, 16]
    - [7, 2.86]
  - - [192, 16, 514, 16]
    - [7, 3.1]
  - - [208, 16, 514, 16]
    - [7, 3.16]
  - - [224, 16, 514, 16]
    - [7, 3.34]
  - - [240, 16, 514, 16]
    - [7, 3.35]
  - - [256, 16, 514, 16]
    - [7, 3.92]
  - - [16, 16, 642, 16]
    - [22, 0.63]
  - - [32, 16, 642, 16]
    - [2, 1.17]
  - - [48, 16, 642, 16]
    - [5, 1.48]
  - - [64, 16, 642, 16]
    - [5, 2.06]
  - - [80, 16, 642, 16]
    - [2, 1.88]
  - - [96, 16, 642, 16]
    - [2, 2.42]
  - - [112, 16, 642, 16]
    - [7, 2.38]
  - - [128, 16, 642, 16]
    - [7, 2.72]
  - - [144, 16, 642, 16]
    - [7, 2.79]
  - - [160, 16, 642, 16]
    - [7, 3.04]
  - - [176, 16, 642, 16]
    - [7, 3.15]
  - - [192, 16, 642, 16]
    - [7, 3.43]
  - - [208, 16, 642, 16]
    - [7, 3.47]
  - - [224, 16, 642, 16]
    - [7, 3.7]
  - - [240, 16, 642, 16]
    - [7, 3.62]
  - - [256, 16, 642, 16]
    - [7, 4.29]
  - - [16, 16, 770, 16]
    - [22, 0.74]
  - - [32, 16, 770, 16]
    - [2, 1.36]
  - - [48, 16, 770, 16]
    - [5, 1.71]
  - - [64, 16, 770, 16]
    - [5, 2.34]
  - - [80, 16, 770, 16]
    - [7, 2.1]
  - - [96, 16, 770, 16]
    - [2, 2.73]
  - - [112, 16, 770, 16]
    - [7, 2.67]
  - - [128, 16, 770, 16]
    - [7, 3.06]
  - - [144, 16, 770, 16]
    - [7, 3.15]
  - - [160, 16, 770, 16]
    - [7, 3.4]
  - - [176, 16, 770, 16]
    - [7, 3.49]
  - - [192, 16, 770, 16]
    - [7, 3.77]
  - - [208, 16, 770, 16]
    - [7, 3.76]
  - - [224, 16, 770, 16]
    - [7, 4.0]
  - - [240, 16, 770, 16]
    - [7, 4.06]
  - - [256, 16, 770, 16]
    - [7, 4.61]
  - - [16, 16, 898, 16]
    - [22, 0.85]
  - - [32, 16, 898, 16]
    - [2, 1.54]
  - - [48, 16, 898, 16]
    - [5, 1.91]
  - - [64, 16, 898, 16]
    - [5, 2.62]
  - - [80, 16, 898, 16]
    - [7, 2.35]
  - - [96, 16, 898, 16]
    - [7, 2.7]
  - - [112, 16, 898, 16]
    - [7, 2.93]
  - - [128, 16, 898, 16]
    - [44, 100]
  - - [144, 16, 898, 16]
    - [7, 3.41]
  - - [160, 16, 898, 16]
    - [7, 3.74]
  - - [176, 16, 898, 16]
    - [7, 3.75]
  - - [192, 16, 898, 16]
    - [7, 4.07]
  - - [208, 16, 898, 16]
    - [7, 4.07]
  - - [224, 16, 898, 16]
    - [7, 4.34]
  - - [240, 16, 898, 16]
    - [7, 4.17]
  - - [256, 16, 898, 16]
    - [44, 100]
  - - [16, 16, 2, 144]
    - [28, 0.02]
  - - [32, 16, 2, 144]
    - [14, 0.03]
  - - [48, 16, 2, 144]
    - [14, 0.05]
  - - [64, 16, 2, 144]
    - [14, 0.06]
  - - [80, 16, 2, 144]
    - [14, 0.08]
  - - [96, 16, 2, 144]
    - [14, 0.09]
  - - [112, 16, 2, 144]
    - [14, 0.11]
  - - [128, 16, 2, 144]
    - [14, 0.12]
  - - [144, 16, 2, 144]
    - [14, 0.14]
  - - [160, 16, 2, 144]
    - [14, 0.15]
  - - [176, 16, 2, 144]
    - [14, 0.17]
  - - [192, 16, 2, 144]
    - [14, 0.18]
  - - [208, 16, 2, 144]
    - [17, 0.18]
  - - [224, 16, 2, 144]
    - [17, 0.19]
  - - [240, 16, 2, 144]
    - [17, 0.2]
  - - [256, 16, 2, 144]
    - [17, 0.22]
  - - [16, 16, 130, 144]
    - [29, 0.8]
  - - [32, 16, 130, 144]
    - [14, 1.56]
  - - [48, 16, 130, 144]
    - [14, 2.19]
  - - [64, 16, 130, 144]
    - [14, 2.89]
  - - [80, 16, 130, 144]
    - [15, 3.23]
  - - [96, 16, 130, 144]
    - [15, 3.8]
  - - [112, 16, 130, 144]
    - [15, 4.17]
  - - [128, 16, 130, 144]
    - [15, 4.79]
  - - [144, 16, 130, 144]
    - [9, 4.9]
  - - [160, 16, 130, 144]
    - [9, 5.41]
  - - [176, 16, 130, 144]
    - [9, 5.6]
  - - [192, 16, 130, 144]
    - [9, 6.13]
  - - [208, 16, 130, 144]
    - [9, 6.18]
  - - [224, 16, 130, 144]
    - [9, 6.67]
  - - [240, 16, 130, 144]
    - [10, 6.76]
  - - [256, 16, 130, 144]
    - [10, 7.29]
  - - [16, 16, 258, 144]
    - [28, 1.48]
  - - [32, 16, 258, 144]
    - [14, 2.77]
  - - [48, 16, 258, 144]
    - [15, 3.62]
  - - [64, 16, 258, 144]
    - [15, 4.65]
  - - [80, 16, 258, 144]
    - [9, 5.12]
  - - [96, 16, 258, 144]
    - [9, 5.94]
  - - [112, 16, 258, 144]
    - [10, 6.35]
  - - [128, 16, 258, 144]
    - [10, 7.09]
  - - [144, 16, 258, 144]
    - [4, 7.29]
  - - [160, 16, 258, 144]
    - [4, 7.89]
  - - [176, 16, 258, 144]
    - [4, 8.04]
  - - [192, 16, 258, 144]
    - [4, 8.82]
  - - [208, 16, 258, 144]
    - [2, 7.94]
  - - [224, 16, 258, 144]
    - [2, 8.53]
  - - [240, 16, 258, 144]
    - [6, 8.61]
  - - [256, 16, 258, 144]
    - [6, 9.39]
  - - [16, 16, 386, 144]
    - [28, 2.08]
  - - [32, 16, 386, 144]
    - [15, 3.57]
  - - [48, 16, 386, 144]
    - [9, 4.66]
  - - [64, 16, 386, 144]
    - [9, 5.87]
  - - [80, 16, 386, 144]
    - [2, 6.4]
  - - [96, 16, 386, 144]
    - [2, 7.36]
  - - [112, 16, 386, 144]
    - [4, 7.61]
  - - [128, 16, 386, 144]
    - [4, 8.64]
  - - [144, 16, 386, 144]
    - [4, 8.27]
  - - [160, 16, 386, 144]
    - [4, 8.79]
  - - [176, 16, 386, 144]
    - [4, 8.83]
  - - [192, 16, 386, 144]
    - [4, 9.66]
  - - [208, 16, 386, 144]
    - [7, 8.2]
  - - [224, 16, 386, 144]
    - [7, 8.63]
  - - [240, 16, 386, 144]
    - [7, 8.51]
  - - [256, 16, 386, 144]
    - [7, 9.64]
  - - [16, 16, 514, 144]
    - [28, 2.58]
  - - [32, 16, 514, 144]
    - [15, 4.37]
  - - [48, 16, 514, 144]
    - [10, 5.5]
  - - [64, 16, 514, 144]
    - [2, 6.78]
  - - [80, 16, 514, 144]
    - [6, 7.17]
  - - [96, 16, 514, 144]
    - [6, 7.77]
  - - [112, 16, 514, 144]
    - [6, 8.09]
  - - [128, 16, 514, 144]
    - [4, 9.12]
  - - [144, 16, 514, 144]
    - [7, 8.44]
  - - [160, 16, 514, 144]
    - [7, 8.98]
  - - [176, 16, 514, 144]
    - [7, 9.06]
  - - [192, 16, 514, 144]
    - [7, 9.84]
  - - [208, 16, 514, 144]
    - [7, 9.61]
  - - [224, 16, 514, 144]
    - [7, 9.97]
  - - [240, 16, 514, 144]
    - [7, 10.02]
  - - [256, 16, 514, 144]
    - [7, 10.99]
  - - [16, 16, 642, 144]
    - [37, 2.93]
  - - [32, 16, 642, 144]
    - [9, 4.93]
  - - [48, 16, 642, 144]
    - [4, 6.06]
  - - [64, 16, 642, 144]
    - [4, 7.61]
  - - [80, 16, 642, 144]
    - [2, 7.36]
  - - [96, 16, 642, 144]
    - [2, 8.2]
  - - [112, 16, 642, 144]
    - [7, 7.27]
  - - [128, 16, 642, 144]
    - [7, 7.99]
  - - [144, 16, 642, 144]
    - [4, 8.2]
  - - [160, 16, 642, 144]
    - [4, 8.92]
  - - [176, 16, 642, 144]
    - [4, 8.96]
  - - [192, 16, 642, 144]
    - [4, 9.85]
  - - [208, 16, 642, 144]
    - [2, 8.88]
  - - [224, 16, 642, 144]
    - [2, 9.45]
  - - [240, 16, 642, 144]
    - [7, 9.0]
  - - [256, 16, 642, 144]
    - [7, 9.91]
  - - [16, 16, 770, 144]
    - [37, 3.27]
  - - [32, 16, 770, 144]
    - [9, 5.41]
  - - [48, 16, 770, 144]
    - [4, 6.72]
  - - [64, 16, 770, 144]
    - [4, 8.15]
  - - [80, 16, 770, 144]
    - [2, 7.68]
  - - [96, 16, 770, 144]
    - [2, 8.53]
  - - [112, 16, 770, 144]
    - [7, 8.16]
  - - [128, 16, 770, 144]
    - [7, 9.02]
  - - [144, 16, 770, 144]
    - [7, 9.04]
  - - [160, 16, 770, 144]
    - [7, 9.45]
  - - [176, 16, 770, 144]
    - [7, 9.63]
  - - [192, 16, 770, 144]
    - [7, 10.37]
  - - [208, 16, 770, 144]
    - [7, 9.88]
  - - [224, 16, 770, 144]
    - [7, 10.29]
  - - [240, 16, 770, 144]
    - [7, 10.1]
  - - [256, 16, 770, 144]
    - [7, 11.38]
  - - [16, 16, 898, 144]
    - [37, 3.64]
  - - [32, 16, 898, 144]
    - [9, 5.86]
  - - [48, 16, 898, 144]
    - [4, 7.27]
  - - [64, 16, 898, 144]
    - [4, 8.5]
  - - [80, 16, 898, 144]
    - [7, 7.69]
  - - [96, 16, 898, 144]
    - [7, 8.4]
  - - [112, 16, 898, 144]
    - [7, 8.88]
  - - [128, 16, 898, 144]
    - [7, 9.64]
  - - [144, 16, 898, 144]
    - [7, 9.8]
  - - [160, 16, 898, 144]
    - [7, 10.12]
  - - [176, 16, 898, 144]
    - [7, 9.93]
  - - [192, 16, 898, 144]
    - [7, 10.98]
  - - [208, 16, 898, 144]
    - [7, 10.21]
  - - [224, 16, 898, 144]
    - [7, 10.94]
  - - [240, 16, 898, 144]
    - [7, 10.5]
  - - [256, 16, 898, 144]
    - [7, 11.48]
  - - [16, 16, 2, 272]
    - [29, 0.03]
  - - [32, 16, 2, 272]
    - [17, 0.05]
  - - [48, 16, 2, 272]
    - [17, 0.08]
  - - [64, 16, 2, 272]
    - [17, 0.11]
  - - [80, 16, 2, 272]
    - [17, 0.13]
  - - [96, 16, 2, 272]
    - [17, 0.16]
  - - [112, 16, 2, 272]
    - [17, 0.16]
  - - [128, 16, 2, 272]
    - [17, 0.18]
  - - [144, 16, 2, 272]
    - [17, 0.19]
  - - [160, 16, 2, 272]
    - [17, 0.21]
  - - [176, 16, 2, 272]
    - [19, 0.23]
  - - [192, 16, 2, 272]
    - [19, 0.26]
  - - [208, 16, 2, 272]
    - [19, 0.27]
  - - [224, 16, 2, 272]
    - [17, 0.3]
  - - [240, 16, 2, 272]
    - [17, 0.31]
  - - [256, 16, 2, 272]
    - [17, 0.36]
  - - [16, 16, 130, 272]
    - [29, 1.33]
  - - [32, 16, 130, 272]
    - [17, 2.57]
  - - [48, 16, 130, 272]
    - [18, 3.37]
  - - [64, 16, 130, 272]
    - [15, 4.34]
  - - [80, 16, 130, 272]
    - [15, 4.76]
  - - [96, 16, 130, 272]
    - [16, 5.58]
  - - [112, 16, 130, 272]
    - [16, 6.18]
  - - [128, 16, 130, 272]
    - [16, 6.89]
  - - [144, 16, 130, 272]
    - [9, 6.69]
  - - [160, 16, 130, 272]
    - [9, 7.23]
  - - [176, 16, 130, 272]
    - [10, 7.45]
  - - [192, 16, 130, 272]
    - [10, 8.15]
  - - [208, 16, 130, 272]
    - [12, 8.17]
  - - [224, 16, 130, 272]
    - [12, 8.51]
  - - [240, 16, 130, 272]
    - [12, 8.79]
  - - [256, 16, 130, 272]
    - [10, 9.33]
  - - [16, 16, 258, 272]
    - [29, 2.38]
  - - [32, 16, 258, 272]
    - [18, 4.08]
  - - [48, 16, 258, 272]
    - [16, 5.29]
  - - [64, 16, 258, 272]
    - [15, 6.53]
  - - [80, 16, 258, 272]
    - [9, 6.81]
  - - [96, 16, 258, 272]
    - [9, 7.74]
  - - [112, 16, 258, 272]
    - [10, 8.34]
  - - [128, 16, 258, 272]
    - [10, 9.07]
  - - [144, 16, 258, 272]
    - [4, 8.87]
  - - [160, 16, 258, 272]
    - [4, 9.48]
  - - [176, 16, 258, 272]
    - [4, 9.7]
  - - [192, 16, 258, 272]
    - [4, 10.46]
  - - [208, 16, 258, 272]
    - [13, 9.86]
  - - [224, 16, 258, 272]
    - [11, 10.2]
  - - [240, 16, 258, 272]
    - [11, 10.4]
  - - [256, 16, 258, 272]
    - [6, 11.26]
  - - [16, 16, 386, 272]
    - [29, 3.13]
  - - [32, 16, 386, 272]
    - [15, 5.15]
  - - [48, 16, 386, 272]
    - [10, 6.27]
  - - [64, 16, 386, 272]
    - [9, 7.63]
  - - [80, 16, 386, 272]
    - [9, 7.88]
  - - [96, 16, 386, 272]
    - [2, 8.79]
  - - [112, 16, 386, 272]
    - [4, 9.16]
  - - [128, 16, 386, 272]
    - [4, 10.25]
  - - [144, 16, 386, 272]
    - [4, 9.92]
  - - [160, 16, 386, 272]
    - [4, 10.45]
  - - [176, 16, 386, 272]
    - [4, 10.59]
  - - [192, 16, 386, 272]
    - [4, 11.48]
  - - [208, 16, 386, 272]
    - [11, 10.08]
  - - [224, 16, 386, 272]
    - [7, 10.48]
  - - [240, 16, 386, 272]
    - [12, 10.54]
  - - [256, 16, 386, 272]
    - [7, 11.34]
  - - [16, 16, 514, 272]
    - [28, 3.78]
  - - [32, 16, 514, 272]
    - [15, 6.02]
  - - [48, 16, 514, 272]
    - [10, 7.28]
  - - [64, 16, 514, 272]
    - [10, 8.54]
  - - [80, 16, 514, 272]
    - [6, 8.85]
  - - [96, 16, 514, 272]
    - [6, 9.6]
  - - [112, 16, 514, 272]
    - [6, 9.88]
  - - [128, 16, 514, 272]
    - [4, 10.77]
  - - [144, 16, 514, 272]
    - [7, 10.45]
  - - [160, 16, 514, 272]
    - [7, 10.87]
  - - [176, 16, 514, 272]
    - [7, 10.98]
  - - [192, 16, 514, 272]
    - [7, 11.74]
  - - [208, 16, 514, 272]
    - [7, 11.66]
  - - [224, 16, 514, 272]
    - [7, 12.14]
  - - [240, 16, 514, 272]
    - [7, 11.98]
  - - [256, 16, 514, 272]
    - [7, 12.8]
  - - [16, 16, 642, 272]
    - [43, 4.04]
  - - [32, 16, 642, 272]
    - [9, 6.45]
  - - [48, 16, 642, 272]
    - [4, 7.54]
  - - [64, 16, 642, 272]
    - [4, 9.15]
  - - [80, 16, 642, 272]
    - [2, 8.81]
  - - [96, 16, 642, 272]
    - [2, 9.64]
  - - [112, 16, 642, 272]
    - [7, 8.78]
  - - [128, 16, 642, 272]
    - [7, 9.48]
  - - [144, 16, 642, 272]
    - [4, 9.76]
  - - [160, 16, 642, 272]
    - [4, 10.45]
  - - [176, 16, 642, 272]
    - [4, 10.6]
  - - [192, 16, 642, 272]
    - [4, 11.45]
  - - [208, 16, 642, 272]
    - [11, 10.42]
  - - [224, 16, 642, 272]
    - [2, 10.85]
  - - [240, 16, 642, 272]
    - [11, 10.92]
  - - [256, 16, 642, 272]
    - [11, 11.53]
  - - [16, 16, 770, 272]
    - [37, 4.5]
  - - [32, 16, 770, 272]
    - [9, 6.92]
  - - [48, 16, 770, 272]
    - [4, 8.23]
  - - [64, 16, 770, 272]
    - [4, 9.76]
  - - [80, 16, 770, 272]
    - [2, 9.21]
  - - [96, 16, 770, 272]
    - [2, 10.06]
  - - [112, 16, 770, 272]
    - [12, 10.09]
  - - [128, 16, 770, 272]
    - [11, 10.99]
  - - [144, 16, 770, 272]
    - [7, 11.08]
  - - [160, 16, 770, 272]
    - [7, 11.48]
  - - [176, 16, 770, 272]
    - [7, 11.45]
  - - [192, 16, 770, 272]
    - [7, 12.22]
  - - [208, 16, 770, 272]
    - [7, 11.98]
  - - [224, 16, 770, 272]
    - [8, 12.07]
  - - [240, 16, 770, 272]
    - [8, 12.3]
  - - [256, 16, 770, 272]
    - [7, 13.22]
  - - [16, 16, 898, 272]
    - [37, 4.89]
  - - [32, 16, 898, 272]
    - [9, 7.32]
  - - [48, 16, 898, 272]
    - [4, 8.7]
  - - [64, 16, 898, 272]
    - [4, 10.09]
  - - [80, 16, 898, 272]
    - [7, 9.43]
  - - [96, 16, 898, 272]
    - [7, 10.19]
  - - [112, 16, 898, 272]
    - [7, 10.87]
  - - [128, 16, 898, 272]
    - [7, 11.66]
  - - [144, 16, 898, 272]
    - [7, 11.61]
  - - [160, 16, 898, 272]
    - [7, 12.06]
  - - [176, 16, 898, 272]
    - [7, 12.15]
  - - [192, 16, 898, 272]
    - [7, 12.73]
  - - [208, 16, 898, 272]
    - [7, 12.27]
  - - [224, 16, 898, 272]
    - [8, 12.56]
  - - [240, 16, 898, 272]
    - [8, 12.72]
  - - [256, 16, 898, 272]
    - [8, 13.54]
  - - [16, 32, 2, 16]
    - [21, 0.0]
  - - [16, 48, 2, 16]
    - [22, 0.01]
  - - [16, 64, 2, 16]
    - [21, 0.01]
  - - [16, 80, 2, 16]
    - [22, 0.01]
  - - [16, 96, 2, 16]
    - [22, 0.01]
  - - [16, 112, 2, 16]
    - [22, 0.02]
  - - [16, 128, 2, 16]
    - [22, 0.02]
  - - [16, 144, 2, 16]
    - [22, 0.02]
  - - [16, 160, 2, 16]
    - [22, 0.02]
  - - [16, 176, 2, 16]
    - [22, 0.03]
  - - [16, 192, 2, 16]
    - [22, 0.03]
  - - [16, 208, 2, 16]
    - [22, 0.03]
  - - [16, 224, 2, 16]
    - [22, 0.03]
  - - [16, 240, 2, 16]
    - [22, 0.04]
  - - [16, 256, 2, 16]
    - [22, 0.04]
  - - [16, 32, 130, 16]
    - [21, 0.27]
  - - [16, 48, 130, 16]
    - [22, 0.39]
  - - [16, 64, 130, 16]
    - [23, 0.52]
  - - [16, 80, 130, 16]
    - [22, 0.64]
  - - [16, 96, 130, 16]
    - [22, 0.75]
  - - [16, 112, 130, 16]
    - [23, 0.85]
  - - [16, 128, 130, 16]
    - [23, 0.98]
  - - [16, 144, 130, 16]
    - [22, 1.03]
  - - [16, 160, 130, 16]
    - [21, 1.15]
  - - [16, 176, 130, 16]
    - [23, 1.22]
  - - [16, 192, 130, 16]
    - [23, 1.36]
  - - [16, 208, 130, 16]
    - [23, 1.41]
  - - [16, 224, 130, 16]
    - [23, 1.51]
  - - [16, 240, 130, 16]
    - [23, 1.6]
  - - [16, 256, 130, 16]
    - [23, 1.7]
  - - [16, 32, 258, 16]
    - [21, 0.52]
  - - [16, 48, 258, 16]
    - [22, 0.74]
  - - [16, 64, 258, 16]
    - [23, 0.99]
  - - [16, 80, 258, 16]
    - [23, 1.11]
  - - [16, 96, 258, 16]
    - [23, 1.31]
  - - [16, 112, 258, 16]
    - [23, 1.5]
  - - [16, 128, 258, 16]
    - [23, 1.7]
  - - [16, 144, 258, 16]
    - [24, 1.7]
  - - [16, 160, 258, 16]
    - [21, 1.85]
  - - [16, 176, 258, 16]
    - [25, 2.0]
  - - [16, 192, 258, 16]
    - [24, 2.2]
  - - [16, 208, 258, 16]
    - [25, 2.26]
  - - [16, 224, 258, 16]
    - [25, 2.39]
  - - [16, 240, 258, 16]
    - [25, 2.51]
  - - [16, 256, 258, 16]
    - [25, 2.66]
  - - [16, 32, 386, 16]
    - [22, 0.75]
  - - [16, 48, 386, 16]
    - [21, 1.02]
  - - [16, 64, 386, 16]
    - [23, 1.35]
  - - [16, 80, 386, 16]
    - [24, 1.5]
  - - [16, 96, 386, 16]
    - [24, 1.73]
  - - [16, 112, 386, 16]
    - [24, 1.94]
  - - [16, 128, 386, 16]
    - [25, 2.22]
  - - [16, 144, 386, 16]
    - [24, 2.22]
  - - [16, 160, 386, 16]
    - [21, 2.4]
  - - [16, 176, 386, 16]
    - [23, 2.56]
  - - [16, 192, 386, 16]
    - [23, 2.82]
  - - [16, 208, 386, 16]
    - [26, 2.63]
  - - [16, 224, 386, 16]
    - [26, 2.76]
  - - [16, 240, 386, 16]
    - [26, 2.86]
  - - [16, 256, 386, 16]
    - [26, 3.17]
  - - [16, 32, 514, 16]
    - [21, 0.94]
  - - [16, 48, 514, 16]
    - [23, 1.28]
  - - [16, 64, 514, 16]
    - [23, 1.69]
  - - [16, 80, 514, 16]
    - [25, 1.83]
  - - [16, 96, 514, 16]
    - [25, 2.1]
  - - [16, 112, 514, 16]
    - [24, 2.34]
  - - [16, 128, 514, 16]
    - [25, 2.68]
  - - [16, 144, 514, 16]
    - [26, 2.47]
  - - [16, 160, 514, 16]
    - [26, 2.65]
  - - [16, 176, 514, 16]
    - [26, 2.81]
  - - [16, 192, 514, 16]
    - [26, 3.0]
  - - [16, 208, 514, 16]
    - [26, 3.11]
  - - [16, 224, 514, 16]
    - [26, 3.26]
  - - [16, 240, 514, 16]
    - [26, 3.37]
  - - [16, 256, 514, 16]
    - [26, 3.75]
  - - [16, 32, 642, 16]
    - [21, 1.14]
  - - [16, 48, 642, 16]
    - [24, 1.47]
  - - [16, 64, 642, 16]
    - [24, 1.96]
  - - [16, 80, 642, 16]
    - [21, 2.0]
  - - [16, 96, 642, 16]
    - [21, 2.31]
  - - [16, 112, 642, 16]
    - [27, 2.38]
  - - [16, 128, 642, 16]
    - [27, 2.72]
  - - [16, 144, 642, 16]
    - [26, 2.75]
  - - [16, 160, 642, 16]
    - [26, 2.95]
  - - [16, 176, 642, 16]
    - [26, 3.12]
  - - [16, 192, 642, 16]
    - [26, 3.31]
  - - [16, 208, 642, 16]
    - [26, 3.43]
  - - [16, 224, 642, 16]
    - [26, 3.54]
  - - [16, 240, 642, 16]
    - [26, 3.66]
  - - [16, 256, 642, 16]
    - [26, 3.88]
  - - [16, 32, 770, 16]
    - [21, 1.32]
  - - [16, 48, 770, 16]
    - [24, 1.7]
  - - [16, 64, 770, 16]
    - [24, 2.21]
  - - [16, 80, 770, 16]
    - [21, 2.27]
  - - [16, 96, 770, 16]
    - [21, 2.57]
  - - [16, 112, 770, 16]
    - [27, 2.65]
  - - [16, 128, 770, 16]
    - [27, 3.03]
  - - [16, 144, 770, 16]
    - [26, 3.08]
  - - [16, 160, 770, 16]
    - [26, 3.27]
  - - [16, 176, 770, 16]
    - [26, 3.45]
  - - [16, 192, 770, 16]
    - [26, 3.64]
  - - [16, 208, 770, 16]
    - [26, 3.77]
  - - [16, 224, 770, 16]
    - [26, 3.9]
  - - [16, 240, 770, 16]
    - [26, 4.0]
  - - [16, 256, 770, 16]
    - [26, 4.22]
  - - [16, 32, 898, 16]
    - [21, 1.49]
  - - [16, 48, 898, 16]
    - [24, 1.89]
  - - [16, 64, 898, 16]
    - [24, 2.47]
  - - [16, 80, 898, 16]
    - [27, 2.34]
  - - [16, 96, 898, 16]
    - [27, 2.64]
  - - [16, 112, 898, 16]
    - [27, 2.91]
  - - [16, 128, 898, 16]
    - [27, 3.29]
  - - [16, 144, 898, 16]
    - [26, 3.36]
  - - [16, 160, 898, 16]
    - [26, 3.56]
  - - [16, 176, 898, 16]
    - [26, 3.74]
  - - [16, 192, 898, 16]
    - [26, 3.93]
  - - [16, 208, 898, 16]
    - [26, 4.03]
  - - [16, 224, 898, 16]
    - [26, 4.17]
  - - [16, 240, 898, 16]
    - [26, 4.3]
  - - [16, 256, 898, 16]
    - [26, 4.48]
  - - [16, 32, 2, 144]
    - [28, 0.03]
  - - [16, 48, 2, 144]
    - [28, 0.05]
  - - [16, 64, 2, 144]
    - [28, 0.06]
  - - [16, 80, 2, 144]
    - [28, 0.08]
  - - [16, 96, 2, 144]
    - [28, 0.09]
  - - [16, 112, 2, 144]
    - [28, 0.11]
  - - [16, 128, 2, 144]
    - [28, 0.12]
  - - [16, 144, 2, 144]
    - [28, 0.14]
  - - [16, 160, 2, 144]
    - [28, 0.15]
  - - [16, 176, 2, 144]
    - [28, 0.16]
  - - [16, 192, 2, 144]
    - [28, 0.17]
  - - [16, 208, 2, 144]
    - [29, 0.17]
  - - [16, 224, 2, 144]
    - [29, 0.18]
  - - [16, 240, 2, 144]
    - [29, 0.19]
  - - [16, 256, 2, 144]
    - [28, 0.19]
  - - [16, 32, 130, 144]
    - [28, 1.5]
  - - [16, 48, 130, 144]
    - [30, 2.07]
  - - [16, 64, 130, 144]
    - [30, 2.65]
  - - [16, 80, 130, 144]
    - [31, 2.99]
  - - [16, 96, 130, 144]
    - [32, 3.46]
  - - [16, 112, 130, 144]
    - [31, 3.97]
  - - [16, 128, 130, 144]
    - [33, 4.48]
  - - [16, 144, 130, 144]
    - [23, 4.66]
  - - [16, 160, 130, 144]
    - [23, 5.09]
  - - [16, 176, 130, 144]
    - [23, 5.43]
  - - [16, 192, 130, 144]
    - [31, 5.78]
  - - [16, 208, 130, 144]
    - [23, 5.96]
  - - [16, 224, 130, 144]
    - [23, 6.3]
  - - [16, 240, 130, 144]
    - [23, 6.61]
  - - [16, 256, 130, 144]
    - [27, 7.0]
  - - [16, 32, 258, 144]
    - [34, 2.68]
  - - [16, 48, 258, 144]
    - [33, 3.57]
  - - [16, 64, 258, 144]
    - [33, 4.53]
  - - [16, 80, 258, 144]
    - [35, 4.84]
  - - [16, 96, 258, 144]
    - [35, 5.62]
  - - [16, 112, 258, 144]
    - [35, 6.26]
  - - [16, 128, 258, 144]
    - [27, 6.95]
  - - [16, 144, 258, 144]
    - [26, 6.86]
  - - [16, 160, 258, 144]
    - [26, 7.29]
  - - [16, 176, 258, 144]
    - [26, 7.84]
  - - [16, 192, 258, 144]
    - [26, 8.34]
  - - [16, 208, 258, 144]
    - [26, 8.59]
  - - [16, 224, 258, 144]
    - [26, 8.9]
  - - [16, 240, 258, 144]
    - [26, 9.26]
  - - [16, 256, 258, 144]
    - [26, 9.77]
  - - [16, 32, 386, 144]
    - [34, 3.57]
  - - [16, 48, 386, 144]
    - [33, 4.61]
  - - [16, 64, 386, 144]
    - [31, 5.78]
  - - [16, 80, 386, 144]
    - [27, 6.16]
  - - [16, 96, 386, 144]
    - [25, 6.95]
  - - [16, 112, 386, 144]
    - [25, 7.7]
  - - [16, 128, 386, 144]
    - [25, 8.6]
  - - [16, 144, 386, 144]
    - [26, 8.17]
  - - [16, 160, 386, 144]
    - [26, 8.5]
  - - [16, 176, 386, 144]
    - [26, 8.9]
  - - [16, 192, 386, 144]
    - [26, 9.23]
  - - [16, 208, 386, 144]
    - [26, 9.53]
  - - [16, 224, 386, 144]
    - [26, 9.72]
  - - [16, 240, 386, 144]
    - [26, 9.94]
  - - [16, 256, 386, 144]
    - [26, 10.39]
  - - [16, 32, 514, 144]
    - [36, 4.37]
  - - [16, 48, 514, 144]
    - [31, 5.63]
  - - [16, 64, 514, 144]
    - [31, 6.87]
  - - [16, 80, 514, 144]
    - [25, 7.34]
  - - [16, 96, 514, 144]
    - [25, 8.16]
  - - [16, 112, 514, 144]
    - [25, 8.67]
  - - [16, 128, 514, 144]
    - [25, 9.54]
  - - [16, 144, 514, 144]
    - [26, 9.1]
  - - [16, 160, 514, 144]
    - [26, 9.35]
  - - [16, 176, 514, 144]
    - [26, 9.69]
  - - [16, 192, 514, 144]
    - [26, 10.15]
  - - [16, 208, 514, 144]
    - [26, 10.34]
  - - [16, 224, 514, 144]
    - [26, 10.64]
  - - [16, 240, 514, 144]
    - [26, 10.89]
  - - [16, 256, 514, 144]
    - [26, 11.27]
  - - [16, 32, 642, 144]
    - [32, 4.95]
  - - [16, 48, 642, 144]
    - [23, 6.23]
  - - [16, 64, 642, 144]
    - [23, 7.61]
  - - [16, 80, 642, 144]
    - [38, 7.08]
  - - [16, 96, 642, 144]
    - [38, 7.75]
  - - [16, 112, 642, 144]
    - [27, 8.17]
  - - [16, 128, 642, 144]
    - [38, 8.85]
  - - [16, 144, 642, 144]
    - [26, 8.92]
  - - [16, 160, 642, 144]
    - [26, 9.05]
  - - [16, 176, 642, 144]
    - [26, 9.37]
  - - [16, 192, 642, 144]
    - [26, 9.68]
  - - [16, 208, 642, 144]
    - [26, 9.94]
  - - [16, 224, 642, 144]
    - [26, 10.22]
  - - [16, 240, 642, 144]
    - [26, 10.38]
  - - [16, 256, 642, 144]
    - [26, 10.66]
  - - [16, 32, 770, 144]
    - [32, 5.47]
  - - [16, 48, 770, 144]
    - [23, 6.88]
  - - [16, 64, 770, 144]
    - [23, 8.23]
  - - [16, 80, 770, 144]
    - [27, 7.85]
  - - [16, 96, 770, 144]
    - [27, 8.58]
  - - [16, 112, 770, 144]
    - [27, 9.05]
  - - [16, 128, 770, 144]
    - [27, 9.79]
  - - [16, 144, 770, 144]
    - [26, 9.84]
  - - [16, 160, 770, 144]
    - [26, 10.07]
  - - [16, 176, 770, 144]
    - [26, 10.45]
  - - [16, 192, 770, 144]
    - [26, 10.88]
  - - [16, 208, 770, 144]
    - [26, 11.0]
  - - [16, 224, 770, 144]
    - [26, 11.28]
  - - [16, 240, 770, 144]
    - [26, 11.62]
  - - [16, 256, 770, 144]
    - [26, 11.91]
  - - [16, 32, 898, 144]
    - [32, 5.94]
  - - [16, 48, 898, 144]
    - [39, 7.25]
  - - [16, 64, 898, 144]
    - [23, 8.63]
  - - [16, 80, 898, 144]
    - [27, 8.39]
  - - [16, 96, 898, 144]
    - [27, 9.08]
  - - [16, 112, 898, 144]
    - [27, 9.56]
  - - [16, 128, 898, 144]
    - [27, 10.22]
  - - [16, 144, 898, 144]
    - [26, 10.4]
  - - [16, 160, 898, 144]
    - [26, 10.46]
  - - [16, 176, 898, 144]
    - [26, 10.84]
  - - [16, 192, 898, 144]
    - [26, 11.24]
  - - [16, 208, 898, 144]
    - [26, 11.49]
  - - [16, 224, 898, 144]
    - [26, 11.76]
  - - [16, 240, 898, 144]
    - [26, 12.16]
  - - [16, 256, 898, 144]
    - [26, 12.35]
  - - [16, 32, 2, 272]
    - [29, 0.05]
  - - [16, 48, 2, 272]
    - [29, 0.08]
  - - [16, 64, 2, 272]
    - [29, 0.1]
  - - [16, 80, 2, 272]
    - [29, 0.13]
  - - [16, 96, 2, 272]
    - [29, 0.15]
  - - [16, 112, 2, 272]
    - [29, 0.14]
  - - [16, 128, 2, 272]
    - [29, 0.15]
  - - [16, 144, 2, 272]
    - [29, 0.18]
  - - [16, 160, 2, 272]
    - [29, 0.21]
  - - [16, 176, 2, 272]
    - [29, 0.23]
  - - [16, 192, 2, 272]
    - [29, 0.25]
  - - [16, 208, 2, 272]
    - [29, 0.27]
  - - [16, 224, 2, 272]
    - [29, 0.29]
  - - [16, 240, 2, 272]
    - [29, 0.32]
  - - [16, 256, 2, 272]
    - [29, 0.31]
  - - [16, 32, 130, 272]
    - [40, 2.42]
  - - [16, 48, 130, 272]
    - [33, 3.19]
  - - [16, 64, 130, 272]
    - [33, 4.09]
  - - [16, 80, 130, 272]
    - [41, 4.43]
  - - [16, 96, 130, 272]
    - [41, 5.04]
  - - [16, 112, 130, 272]
    - [33, 5.57]
  - - [16, 128, 130, 272]
    - [33, 6.34]
  - - [16, 144, 130, 272]
    - [23, 5.94]
  - - [16, 160, 130, 272]
    - [23, 6.46]
  - - [16, 176, 130, 272]
    - [31, 7.02]
  - - [16, 192, 130, 272]
    - [31, 7.58]
  - - [16, 208, 130, 272]
    - [35, 7.62]
  - - [16, 224, 130, 272]
    - [35, 8.13]
  - - [16, 240, 130, 272]
    - [27, 8.57]
  - - [16, 256, 130, 272]
    - [27, 9.14]
  - - [16, 32, 258, 272]
    - [34, 4.03]
  - - [16, 48, 258, 272]
    - [33, 5.28]
  - - [16, 64, 258, 272]
    - [33, 6.49]
  - - [16, 80, 258, 272]
    - [41, 6.84]
  - - [16, 96, 258, 272]
    - [35, 7.67]
  - - [16, 112, 258, 272]
    - [35, 8.47]
  - - [16, 128, 258, 272]
    - [27, 9.16]
  - - [16, 144, 258, 272]
    - [42, 8.76]
  - - [16, 160, 258, 272]
    - [26, 9.24]
  - - [16, 176, 258, 272]
    - [26, 10.05]
  - - [16, 192, 258, 272]
    - [26, 10.33]
  - - [16, 208, 258, 272]
    - [26, 10.72]
  - - [16, 224, 258, 272]
    - [26, 10.96]
  - - [16, 240, 258, 272]
    - [26, 11.27]
  - - [16, 256, 258, 272]
    - [26, 11.69]
  - - [16, 32, 386, 272]
    - [34, 5.13]
  - - [16, 48, 386, 272]
    - [31, 6.36]
  - - [16, 64, 386, 272]
    - [31, 7.64]
  - - [16, 80, 386, 272]
    - [27, 7.92]
  - - [16, 96, 386, 272]
    - [27, 8.65]
  - - [16, 112, 386, 272]
    - [25, 9.56]
  - - [16, 128, 386, 272]
    - [25, 10.39]
  - - [16, 144, 386, 272]
    - [26, 9.85]
  - - [16, 160, 386, 272]
    - [26, 10.28]
  - - [16, 176, 386, 272]
    - [26, 10.87]
  - - [16, 192, 386, 272]
    - [26, 11.24]
  - - [16, 208, 386, 272]
    - [26, 11.36]
  - - [16, 224, 386, 272]
    - [26, 11.41]
  - - [16, 240, 386, 272]
    - [26, 11.58]
  - - [16, 256, 386, 272]
    - [26, 12.1]
  - - [16, 32, 514, 272]
    - [36, 5.95]
  - - [16, 48, 514, 272]
    - [31, 7.47]
  - - [16, 64, 514, 272]
    - [31, 8.64]
  - - [16, 80, 514, 272]
    - [25, 9.17]
  - - [16, 96, 514, 272]
    - [25, 9.92]
  - - [16, 112, 514, 272]
    - [25, 10.48]
  - - [16, 128, 514, 272]
    - [25, 11.35]
  - - [16, 144, 514, 272]
    - [26, 11.02]
  - - [16, 160, 514, 272]
    - [26, 11.32]
  - - [16, 176, 514, 272]
    - [26, 11.69]
  - - [16, 192, 514, 272]
    - [26, 11.99]
  - - [16, 208, 514, 272]
    - [26, 12.26]
  - - [16, 224, 514, 272]
    - [26, 12.53]
  - - [16, 240, 514, 272]
    - [26, 12.58]
  - - [16, 256, 514, 272]
    - [26, 12.94]
  - - [16, 32, 642, 272]
    - [32, 6.45]
  - - [16, 48, 642, 272]
    - [23, 7.7]
  - - [16, 64, 642, 272]
    - [23, 9.15]
  - - [16, 80, 642, 272]
    - [38, 8.76]
  - - [16, 96, 642, 272]
    - [38, 9.39]
  - - [16, 112, 642, 272]
    - [38, 10.0]
  - - [16, 128, 642, 272]
    - [38, 10.46]
  - - [16, 144, 642, 272]
    - [26, 10.3]
  - - [16, 160, 642, 272]
    - [26, 10.67]
  - - [16, 176, 642, 272]
    - [26, 11.06]
  - - [16, 192, 642, 272]
    - [26, 11.23]
  - - [16, 208, 642, 272]
    - [26, 11.31]
  - - [16, 224, 642, 272]
    - [26, 11.48]
  - - [16, 240, 642, 272]
    - [35, 11.73]
  - - [16, 256, 642, 272]
    - [27, 12.55]
  - - [16, 32, 770, 272]
    - [32, 6.9]
  - - [16, 48, 770, 272]
    - [23, 8.43]
  - - [16, 64, 770, 272]
    - [23, 9.75]
  - - [16, 80, 770, 272]
    - [38, 9.6]
  - - [16, 96, 770, 272]
    - [27, 10.34]
  - - [16, 112, 770, 272]
    - [27, 10.88]
  - - [16, 128, 770, 272]
    - [27, 11.66]
  - - [16, 144, 770, 272]
    - [26, 11.68]
  - - [16, 160, 770, 272]
    - [26, 12.06]
  - - [16, 176, 770, 272]
    - [26, 12.32]
  - - [16, 192, 770, 272]
    - [26, 12.55]
  - - [16, 208, 770, 272]
    - [26, 12.71]
  - - [16, 224, 770, 272]
    - [26, 12.93]
  - - [16, 240, 770, 272]
    - [26, 13.09]
  - - [16, 256, 770, 272]
    - [26, 13.62]
  - - [16, 32, 898, 272]
    - [32, 7.34]
  - - [16, 48, 898, 272]
    - [23, 8.9]
  - - [16, 64, 898, 272]
    - [23, 10.15]
  - - [16, 80, 898, 272]
    - [27, 10.16]
  - - [16, 96, 898, 272]
    - [27, 10.78]
  - - [16, 112, 898, 272]
    - [27, 11.52]
  - - [16, 128, 898, 272]
    - [27, 12.26]
  - - [16, 144, 898, 272]
    - [26, 11.86]
  - - [16, 160, 898, 272]
    - [26, 12.26]
  - - [16, 176, 898, 272]
    - [26, 12.66]
  - - [16, 192, 898, 272]
    - [26, 12.93]
  - - [16, 208, 898, 272]
    - [26, 13.13]
  - - [16, 224, 898, 272]
    - [26, 13.37]
  - - [16, 240, 898, 272]
    - [26, 13.49]
  - - [16, 256, 898, 272]
    - [26, 14.18]
- null
- null
- DeviceEfficiency
- GridBased
