library/src/amd_detail/rocblaslt/src/Tensile/Logic/asm_full/aquavanjaram/gfx942/GridBased/aquavanjaram_Cijk_Alik_Bjlk_BBS_BH_Bias_HAS_SAV_UserArgs.yaml
- {MinimumRequiredVersion: 4.33.0}
- aquavanjaram
- gfx942
- [Device 0049, Device 0050]
    SolutionIndex: 0
    SolutionNameMin: Cijk_Alik_Bjlk_BBS_BH_Bias_HAS_SAV_UserArgs_MT16x16x32_MI16x16x1_SN_LDSB0_GRVWA4_GSU1_LBSPPA128_LBSPPB128_LPA4_LRVW4_MIWT1_1_SU0_SUM0_SUS0_SVW1_VWA1_WG16_4_1_WGM8
    SolutionIndex: 1
    SolutionNameMin: Cijk_Alik_Bjlk_BBS_BH_Bias_HAS_SAV_UserArgs_MT32x16x64_MI16x16x1_SN_LDSB0_GRVWA8_GSU1_LBSPPA128_LBSPPB256_LPA16_LRVW8_MIWT1_1_SU0_SUM0_SUS0_SVW1_VWA1_WG32_4_1_WGM8
    SolutionIndex: 2
    SolutionNameMin: Cijk_Alik_Bjlk_BBS_BH_Bias_HAS_SAV_UserArgs_MT128x16x64_MI16x16x1_SN_LDSB1_GRVWA8_GSU1_LBSPPA256_LBSPPB256_LPA16_LRVW8_MIWT2_1_SU0_SUM0_SUS0_SVW2_VWA2_WG64_4_1_WGM8
    SolutionIndex: 3
    SolutionNameMin: Cijk_Alik_Bjlk_BBS_BH_Bias_HAS_SAV_UserArgs_MT256x16x64_MI16x16x1_SN_LDSB1_GRVWA8_GSU1_LBSPPA512_LBSPPB256_LPA16_LRVW8_MIWT4_1_SU0_SUM0_SUS0_SVW4_VWA4_WG64_4_1_WGM8
    SolutionIndex: 4
    SolutionNameMin: Cijk_Alik_Bjlk_BBS_BH_Bias_HAS_SAV_UserArgs_MT448x16x64_MI16x16x1_SN_LDSB1_GRVWA4_GSU1_LBSPPA128_LBSPPB128_LPA4_LRVW4_MIWT7_1_SU0_SUM0_SUS0_SVW1_VWA1_WG64_4_1_WGM8
    SolutionIndex: 5
    SolutionNameMin: Cijk_Alik_Bjlk_BBS_BH_Bias_HAS_SAV_UserArgs_MT32x16x128_MI16x16x1_SN_LDSB0_GRVWA8_GSU1_LBSPPA256_LBSPPB256_LPA16_LRVW8_MIWT1_1_SU0_SUM0_SUS0_SVW1_VWA1_WG32_4_1_WGM8
    SolutionIndex: 6
    SolutionNameMin: Cijk_Alik_Bjlk_BBS_BH_Bias_HAS_SAV_UserArgs_MT64x16x128_MI16x16x1_SN_LDSB1_GRVWA8_GSU1_LBSPPA256_LBSPPB256_LPA16_LRVW8_MIWT1_1_SU0_SUM0_SUS0_SVW1_VWA1_WG64_4_1_WGM8
    SolutionIndex: 7
    SolutionNameMin: Cijk_Alik_Bjlk_BBS_BH_Bias_HAS_SAV_UserArgs_MT32x64x32_MI16x16x1_SN_LDSB0_CLR1_GRVWA1_GSU1_GSUC0_GSUWGMRR0_K1_LBSPPA128_LBSPPB512_LPA4_LPB32_LRVW4_LWPM0p27_MIWT1_2_NTD0_NLCB1_PLR1_SU0_SUM0_SUS0_SVW1_ULSGRO1_VWA1_VWB2_WG32_8_1_WGM1_WGMXCC1_WGMXCCG304
    SolutionIndex: 8
    SolutionNameMin: Cijk_Alik_Bjlk_BBS_BH_Bias_HAS_SAV_UserArgs_MT32x64x64_MI16x16x1_SN_LDSB0_CLR1_GRVWA1_GSU1_GSUC0_GSUWGMRR0_K1_LBSPPA128_LBSPPB1024_LPA16_LPB32_LRVW8_LWPMn1_MIWT1_2_NTD4_NLCB1_PLR1_SU0_SUM0_SUS0_SVW1_ULSGRO1_VWA1_VWB2_WG32_8_1_WGM1_WGMXCC1_WGMXCCG304
    SolutionIndex: 9
    SolutionNameMin: Cijk_Alik_Bjlk_BBS_BH_Bias_HAS_SAV_UserArgs_MT32x64x32_MI16x16x1_SN_LDSB0_CLR1_GRVWA4_GSU1_GSUC0_GSUWGMRR0_K1_LBSPPA128_LBSPPB512_LPA4_LPB32_LRVW4_LWPMn1_MIWT1_2_NTD4_NLCB1_PLR1_SU16_SUM0_SUS64_SVW1_ULSGRO0_VWA1_VWB2_WG32_8_1_WGM1_WGMXCC8_WGMXCCG304
    SolutionIndex: 10
    SolutionNameMin: Cijk_Alik_Bjlk_BBS_BH_Bias_HAS_SAV_UserArgs_MT32x64x64_MI16x16x1_SN_LDSB0_CLR1_GRVWA8_GSU1_GSUC0_GSUWGMRR0_K1_LBSPPA128_LBSPPB1024_LPA16_LPB32_LRVW8_LWPM0p50_MIWT1_2_NTD0_NLCB1_PLR1_SU0_SUM0_SUS0_SVW1_ULSGRO0_VWA1_VWB2_WG32_8_1_WGM1_WGMXCC8_WGMXCCG304
    SolutionIndex: 11
    SolutionNameMin: Cijk_Alik_Bjlk_BBS_BH_Bias_HAS_SAV_UserArgs_MT32x64x32_MI16x16x1_SN_LDSB0_CLR1_GRVWA1_GSU1_GSUC0_GSUWGMRR0_K1_LBSPPA128_LBSPPB512_LPA4_LPB32_LRVW4_LWPM0p27_MIWT1_2_NTD4_NLCB1_PLR1_SU0_SUM0_SUS0_SVW1_ULSGRO1_VWA1_VWB2_WG32_8_1_WGM1_WGMXCC8_WGMXCCG304
    SolutionIndex: 12
    SolutionNameMin: Cijk_Alik_Bjlk_BBS_BH_Bias_HAS_SAV_UserArgs_MT32x64x32_MI16x16x1_SN_LDSB0_CLR1_GRVWA1_GSU1_GSUC0_GSUWGMRR0_K1_LBSPPA128_LBSPPB512_LPA4_LPB32_LRVW4_LWPM0p27_MIWT1_2_NTD4_NLCB1_PLR1_SU16_SUM1_SUS64_SVW1_ULSGRO1_VWA1_VWB2_WG32_8_1_WGM1_WGMXCC8_WGMXCCG304
    SolutionIndex: 13
    SolutionNameMin: Cijk_Alik_Bjlk_BBS_BH_Bias_HAS_SAV_UserArgs_MT32x64x32_MI16x16x1_SN_LDSB0_CLR1_GRVWA4_GSU1_GSUC0_GSUWGMRR0_K1_LBSPPA128_LBSPPB512_LPA4_LPB32_LRVW4_LWPMn1_MIWT1_2_NTD0_NLCB1_PLR1_SU16_SUM1_SUS64_SVW1_ULSGRO0_VWA1_VWB2_WG32_8_1_WGM1_WGMXCC8_WGMXCCG304
    SolutionIndex: 14
    SolutionNameMin: Cijk_Alik_Bjlk_BBS_BH_Bias_HAS_SAV_UserArgs_MT32x64x32_MI16x16x1_SN_LDSB0_CLR1_GRVWA1_GSU1_GSUC0_GSUWGMRR0_K1_LBSPPA128_LBSPPB512_LPA4_LPB32_LRVW4_LWPM0p25_MIWT1_2_NTD0_NLCB1_PLR1_SU0_SUM0_SUS0_SVW1_ULSGRO1_VWA1_VWB2_WG32_8_1_WGM1_WGMXCC1_WGMXCCG304
    SolutionIndex: 15
    SolutionNameMin: Cijk_Alik_Bjlk_BBS_BH_Bias_HAS_SAV_UserArgs_MT32x64x32_MI16x16x1_SN_LDSB0_CLR1_GRVWA1_GSU1_GSUC0_GSUWGMRR0_K1_LBSPPA128_LBSPPB512_LPA4_LPB32_LRVW4_LWPM0p27_MIWT1_2_NTD4_NLCB1_PLR1_SU0_SUM0_SUS0_SVW1_ULSGRO1_VWA1_VWB2_WG32_8_1_WGM1_WGMXCC1_WGMXCCG304
    SolutionIndex: 16
    SolutionNameMin: Cijk_Alik_Bjlk_BBS_BH_Bias_HAS_SAV_UserArgs_MT32x64x64_MI16x16x1_SN_LDSB0_CLR1_GRVWA8_GSU1_GSUC0_GSUWGMRR0_K1_LBSPPA128_LBSPPB1024_LPA16_LPB32_LRVW8_LWPM0p27_MIWT1_2_NTD0_NLCB1_PLR1_SU0_SUM0_SUS0_SVW1_ULSGRO0_VWA1_VWB2_WG32_8_1_WGM1_WGMXCC8_WGMXCCG304
    SolutionIndex: 17
    SolutionNameMin: Cijk_Alik_Bjlk_BBS_BH_Bias_HAS_SAV_UserArgs_MT32x64x32_MI16x16x1_SN_LDSB0_CLR1_GRVWA1_GSU1_GSUC0_GSUWGMRR0_K1_LBSPPA128_LBSPPB512_LPA4_LPB32_LRVW4_LWPM0p26_MIWT1_2_NTD4_NLCB1_PLR1_SU0_SUM0_SUS0_SVW1_ULSGRO1_VWA1_VWB2_WG32_8_1_WGM1_WGMXCC8_WGMXCCG304
    SolutionIndex: 18
    SolutionNameMin: Cijk_Alik_Bjlk_BBS_BH_Bias_HAS_SAV_UserArgs_MT32x64x32_MI16x16x1_SN_LDSB0_CLR1_GRVWA1_GSU1_GSUC0_GSUWGMRR0_K1_LBSPPA128_LBSPPB512_LPA4_LPB32_LRVW4_LWPM0p25_MIWT1_2_NTD4_NLCB1_PLR1_SU0_SUM0_SUS0_SVW1_ULSGRO1_VWA1_VWB2_WG32_8_1_WGM1_WGMXCC8_WGMXCCG304
    SolutionIndex: 19
    SolutionNameMin: Cijk_Alik_Bjlk_BBS_BH_Bias_HAS_SAV_UserArgs_MT64x64x32_MI16x16x1_SN_LDSB0_CLR1_GRVWA1_GSU1_GSUC0_GSUWGMRR0_K1_LBSPPA128_LBSPPB512_LPA4_LPB32_LRVW4_LWPM0p27_MIWT2_2_NTD0_NLCB1_PLR1_SU0_SUM0_SUS0_SVW2_ULSGRO1_VWA2_VWB2_WG32_8_1_WGM1_WGMXCC8_WGMXCCG304
    SolutionIndex: 20
    SolutionNameMin: Cijk_Alik_Bjlk_BBS_BH_Bias_HAS_SAV_UserArgs_MT32x64x32_MI16x16x1_SN_LDSB0_CLR1_GRVWA1_GSU1_GSUC0_GSUWGMRR0_K1_LBSPPA128_LBSPPB512_LPA4_LPB32_LRVW4_LWPM0p27_MIWT1_2_NTD0_NLCB1_PLR1_SU0_SUM0_SUS0_SVW1_ULSGRO1_VWA1_VWB2_WG32_8_1_WGM1_WGMXCC8_WGMXCCG304
    SolutionIndex: 21
    SolutionNameMin: Cijk_Alik_Bjlk_BBS_BH_Bias_HAS_SAV_UserArgs_MT64x64x64_MI16x16x1_SN_LDSB1_CLR1_GRVWA8_GSU1_GSUC0_GSUWGMRR0_K1_LBSPPA256_LBSPPB1024_LPA16_LPB32_LRVW8_LWPM0p26_MIWT2_2_NTD4_NLCB1_PLR1_SU0_SUM0_SUS0_SVW2_ULSGRO0_VWA2_VWB2_WG32_8_1_WGM1_WGMXCC8_WGMXCCG304
    SolutionIndex: 22
    SolutionNameMin: Cijk_Alik_Bjlk_BBS_BH_Bias_HAS_SAV_UserArgs_MT64x64x32_MI16x16x1_SN_LDSB0_CLR1_GRVWA1_GSU1_GSUC0_GSUWGMRR0_K1_LBSPPA128_LBSPPB512_LPA4_LPB32_LRVW4_LWPM0p26_MIWT2_2_NTD4_NLCB1_PLR1_SU0_SUM0_SUS0_SVW2_ULSGRO1_VWA2_VWB2_WG32_8_1_WGM1_WGMXCC8_WGMXCCG304
    SolutionIndex: 23
    SolutionNameMin: Cijk_Alik_Bjlk_BBS_BH_Bias_HAS_SAV_UserArgs_MT96x64x32_MI16x16x1_SN_LDSB0_CLR1_GRVWA1_GSU1_GSUC0_GSUWGMRR0_K1_LBSPPA128_LBSPPB512_LPA4_LPB32_LRVW4_LWPM0p25_MIWT3_2_NTD0_NLCB1_PLR1_SU0_SUM0_SUS0_SVW1_ULSGRO1_VWA1_VWB2_WG32_8_1_WGM1_WGMXCC8_WGMXCCG304
    SolutionIndex: 24
    SolutionNameMin: Cijk_Alik_Bjlk_BBS_BH_Bias_HAS_SAV_UserArgs_MT64x128x32_MI16x16x1_SN_LDSB0_CLR1_GRVWA1_GSU1_GSUC0_GSUWGMRR0_K1_LBSPPA128_LBSPPB1024_LPA4_LPB0_LRVW4_LWPM0p27_MIWT2_4_NTD0_NLCB1_PLR1_SU0_SUM0_SUS0_SVW2_ULSGRO1_VWA2_VWB4_WG32_8_1_WGM1_WGMXCC8_WGMXCCG304
    SolutionIndex: 25
    SolutionNameMin: Cijk_Alik_Bjlk_BBS_BH_Bias_HAS_SAV_UserArgs_MT32x128x32_MI16x16x1_SN_LDSB0_CLR1_GRVWA1_GSU1_GSUC0_GSUWGMRR0_K1_LBSPPA128_LBSPPB1024_LPA4_LPB0_LRVW4_LWPMn1_MIWT1_4_NTD4_NLCB1_PLR1_SU0_SUM0_SUS0_SVW1_ULSGRO1_VWA1_VWB4_WG32_8_1_WGM1_WGMXCC8_WGMXCCG304
    SolutionIndex: 26
    SolutionNameMin: Cijk_Alik_Bjlk_BBS_BH_Bias_HAS_SAV_UserArgs_MT64x128x32_MI16x16x1_SN_LDSB0_CLR1_GRVWA4_GSU1_GSUC0_GSUWGMRR0_K1_LBSPPA128_LBSPPB1024_LPA4_LPB0_LRVW4_LWPM0p27_MIWT2_4_NTD4_NLCB1_PLR1_SU16_SUM1_SUS64_SVW2_ULSGRO0_VWA2_VWB4_WG32_8_1_WGM1_WGMXCC8_WGMXCCG304
    SolutionIndex: 27
    SolutionNameMin: Cijk_Alik_Bjlk_BBS_BH_Bias_HAS_SAV_UserArgs_MT64x128x32_MI16x16x1_SN_LDSB0_CLR1_GRVWA1_GSU1_GSUC0_GSUWGMRR0_K1_LBSPPA128_LBSPPB1024_LPA4_LPB0_LRVW4_LWPM0p26_MIWT2_4_NTD0_NLCB1_PLR1_SU0_SUM0_SUS0_SVW2_ULSGRO1_VWA2_VWB4_WG32_8_1_WGM1_WGMXCC8_WGMXCCG304
    SolutionIndex: 28
    SolutionNameMin: Cijk_Alik_Bjlk_BBS_BH_Bias_HAS_SAV_UserArgs_MT96x128x32_MI16x16x1_SN_LDSB0_CLR1_GRVWA4_GSU1_GSUC0_GSUWGMRR0_K1_LBSPPA128_LBSPPB1024_LPA4_LPB0_LRVW4_LWPM0p25_MIWT3_4_NTD4_NLCB1_PLR1_SU16_SUM0_SUS256_SVW1_ULSGRO0_VWA1_VWB4_WG32_8_1_WGM1_WGMXCC8_WGMXCCG304
    SolutionIndex: 29
    SolutionNameMin: Cijk_Alik_Bjlk_BBS_BH_Bias_HAS_SAV_UserArgs_MT64x256x32_MI16x16x1_SN_LDSB1_CLR1_GRVWA1_GSU1_GSUC0_GSUWGMRR0_K1_LBSPPA128_LBSPPB2048_LPA4_LPB0_LRVW4_LWPMn1_MIWT2_8_NTD0_NLCB1_PLR1_SU0_SUM0_SUS0_SVW2_ULSGRO1_VWA2_VWB8_WG32_8_1_WGM1_WGMXCC8_WGMXCCG304
    SolutionIndex: 30
    SolutionNameMin: Cijk_Alik_Bjlk_BBS_BH_Bias_HAS_SAV_UserArgs_MT32x128x32_MI16x16x1_SN_LDSB0_CLR1_GRVWA1_GSU1_GSUC0_GSUWGMRR0_K1_LBSPPA128_LBSPPB1024_LPA4_LPB0_LRVW4_LWPM0p27_MIWT1_4_NTD4_NLCB1_PLR1_SU0_SUM0_SUS0_SVW1_ULSGRO1_VWA1_VWB4_WG32_8_1_WGM1_WGMXCC1_WGMXCCG304
    SolutionIndex: 31
    SolutionNameMin: Cijk_Alik_Bjlk_BBS_BH_Bias_HAS_SAV_UserArgs_MT32x256x32_MI16x16x1_SN_LDSB1_CLR1_GRVWA1_GSU1_GSUC0_GSUWGMRR0_K1_LBSPPA128_LBSPPB2048_LPA4_LPB0_LRVW4_LWPM0p50_MIWT1_8_NTD4_NLCB1_PLR1_SU0_SUM0_SUS0_SVW1_ULSGRO1_VWA1_VWB8_WG32_8_1_WGM1_WGMXCC8_WGMXCCG304
    SolutionIndex: 32
    SolutionNameMin: Cijk_Alik_Bjlk_BBS_BH_Bias_HAS_SAV_UserArgs_MT32x256x32_MI16x16x1_SN_LDSB1_CLR1_GRVWA1_GSU1_GSUC0_GSUWGMRR0_K1_LBSPPA128_LBSPPB2048_LPA4_LPB0_LRVW4_LWPM0p25_MIWT1_8_NTD0_NLCB1_PLR1_SU16_SUM0_SUS64_SVW1_ULSGRO1_VWA1_VWB8_WG32_8_1_WGM1_WGMXCC8_WGMXCCG304
    SolutionIndex: 33
    SolutionNameMin: Cijk_Alik_Bjlk_BBS_BH_Bias_HAS_SAV_UserArgs_MT64x256x32_MI16x16x1_SN_LDSB1_CLR1_GRVWA1_GSU1_GSUC0_GSUWGMRR0_K1_LBSPPA128_LBSPPB2048_LPA4_LPB0_LRVW4_LWPM0p50_MIWT2_8_NTD0_NLCB1_PLR1_SU16_SUM0_SUS64_SVW2_ULSGRO1_VWA2_VWB8_WG32_8_1_WGM1_WGMXCC1_WGMXCCG304
    SolutionIndex: 34
    SolutionNameMin: Cijk_Alik_Bjlk_BBS_BH_Bias_HAS_SAV_UserArgs_MT64x256x32_MI16x16x1_SN_LDSB1_CLR1_GRVWA1_GSU1_GSUC0_GSUWGMRR0_K1_LBSPPA128_LBSPPB2048_LPA4_LPB0_LRVW4_LWPM0p25_MIWT2_8_NTD4_NLCB1_PLR1_SU16_SUM0_SUS64_SVW2_ULSGRO1_VWA2_VWB8_WG32_8_1_WGM1_WGMXCC1_WGMXCCG304
    SolutionIndex: 35
    SolutionNameMin: Cijk_Alik_Bjlk_BBS_BH_Bias_HAS_SAV_UserArgs_MT96x256x32_MI16x16x1_SN_LDSB1_CLR1_GRVWA1_GSU1_GSUC0_GSUWGMRR0_K1_LBSPPA128_LBSPPB2048_LPA4_LPB0_LRVW4_LWPM0p26_MIWT3_8_NTD4_NLCB1_PLR1_SU16_SUM1_SUS64_SVW1_ULSGRO1_VWA1_VWB8_WG32_8_1_WGM1_WGMXCC8_WGMXCCG304
    SolutionIndex: 36
    SolutionNameMin: Cijk_Alik_Bjlk_BBS_BH_Bias_HAS_SAV_UserArgs_MT64x256x32_MI16x16x1_SN_LDSB1_CLR1_GRVWA1_GSU1_GSUC0_GSUWGMRR0_K1_LBSPPA128_LBSPPB2048_LPA4_LPB0_LRVW4_LWPM0p26_MIWT2_8_NTD0_NLCB1_PLR1_SU16_SUM0_SUS64_SVW2_ULSGRO1_VWA2_VWB8_WG32_8_1_WGM1_WGMXCC8_WGMXCCG304
    SolutionIndex: 37
    SolutionNameMin: Cijk_Alik_Bjlk_BBS_BH_Bias_HAS_SAV_UserArgs_MT32x128x64_MI16x16x1_SN_LDSB1_CLR1_GRVWA1_GSU1_GSUC0_GSUWGMRR0_K1_LBSPPA128_LBSPPB2048_LPA16_LPB0_LRVW8_LWPMn1_MIWT1_4_NTD4_NLCB1_PLR1_SU0_SUM0_SUS0_SVW1_ULSGRO1_VWA1_VWB4_WG32_8_1_WGM1_WGMXCC1_WGMXCCG304
    SolutionIndex: 38
    SolutionNameMin: Cijk_Alik_Bjlk_BBS_BH_Bias_HAS_SAV_UserArgs_MT32x256x32_MI16x16x1_SN_LDSB1_CLR1_GRVWA1_GSU1_GSUC0_GSUWGMRR0_K1_LBSPPA128_LBSPPB2048_LPA4_LPB0_LRVW4_LWPMn1_MIWT1_8_NTD4_NLCB1_PLR1_SU0_SUM0_SUS0_SVW1_ULSGRO1_VWA1_VWB8_WG32_8_1_WGM8_WGMXCC8_WGMXCCG304
    SolutionIndex: 39
    SolutionNameMin: Cijk_Alik_Bjlk_BBS_BH_Bias_HAS_SAV_UserArgs_MT32x256x32_MI16x16x1_SN_LDSB1_CLR1_GRVWA1_GSU1_GSUC0_GSUWGMRR0_K1_LBSPPA128_LBSPPB2048_LPA4_LPB0_LRVW4_LWPM0p25_MIWT1_8_NTD0_NLCB1_PLR1_SU16_SUM1_SUS64_SVW1_ULSGRO1_VWA1_VWB8_WG32_8_1_WGM6_WGMXCC8_WGMXCCG304
    SolutionIndex: 40
    SolutionNameMin: Cijk_Alik_Bjlk_BBS_BH_Bias_HAS_SAV_UserArgs_MT64x256x32_MI16x16x1_SN_LDSB1_CLR1_GRVWA1_GSU1_GSUC0_GSUWGMRR0_K1_LBSPPA128_LBSPPB2048_LPA4_LPB0_LRVW4_LWPM0p50_MIWT2_8_NTD0_NLCB1_PLR1_SU0_SUM0_SUS0_SVW2_ULSGRO1_VWA2_VWB8_WG32_8_1_WGM1_WGMXCC1_WGMXCCG304
    SolutionIndex: 41
    SolutionNameMin: Cijk_Alik_Bjlk_BBS_BH_Bias_HAS_SAV_UserArgs_MT64x128x32_MI16x16x1_SN_LDSB0_CLR1_GRVWA1_GSU1_GSUC0_GSUWGMRR0_K1_LBSPPA128_LBSPPB1024_LPA4_LPB0_LRVW4_LWPMn1_MIWT2_4_NTD0_NLCB1_PLR1_SU0_SUM0_SUS0_SVW2_ULSGRO1_VWA2_VWB4_WG32_8_1_WGM1_WGMXCC1_WGMXCCG304
    SolutionIndex: 42
    SolutionNameMin: Cijk_Alik_Bjlk_BBS_BH_Bias_HAS_SAV_UserArgs_MT96x256x32_MI16x16x1_SN_LDSB1_CLR1_GRVWA1_GSU1_GSUC0_GSUWGMRR0_K1_LBSPPA128_LBSPPB2048_LPA4_LPB0_LRVW4_LWPMn1_MIWT3_8_NTD4_NLCB1_PLR1_SU0_SUM0_SUS0_SVW1_ULSGRO1_VWA1_VWB8_WG32_8_1_WGM6_WGMXCC1_WGMXCCG304
    SolutionIndex: 43
    SolutionNameMin: Cijk_Alik_Bjlk_BBS_BH_Bias_HAS_SAV_UserArgs_MT128x128x32_MI16x16x1_SN_LDSB1_CLR1_GRVWA1_GSU1_GSUC0_GSUWGMRR0_K1_LBSPPA256_LBSPPB1024_LPA4_LPB0_LRVW4_LWPMn1_MIWT4_4_NTD0_NLCB1_PLR1_SU16_SUM0_SUS256_SVW4_ULSGRO1_VWA4_VWB4_WG32_8_1_WGM8_WGMXCC8_WGMXCCG304
    SolutionIndex: 44
    SolutionNameMin: Cijk_Alik_Bjlk_BBS_BH_Bias_HAS_SAV_UserArgs_MT32x128x64_MI16x16x1_SN_LDSB1_CLR1_GRVWA1_GSU1_GSUC0_GSUWGMRR0_K1_LBSPPA128_LBSPPB2048_LPA16_LPB0_LRVW8_LWPM0p26_MIWT1_4_NTD4_NLCB1_PLR1_SU0_SUM0_SUS0_SVW1_ULSGRO1_VWA1_VWB4_WG32_8_1_WGM1_WGMXCC1_WGMXCCG304
    SolutionIndex: 45
    SolutionNameMin: Cijk_Alik_Bjlk_BBS_BH_Bias_HAS_SAV_UserArgs_MT32x256x32_MI16x16x1_SN_LDSB1_CLR1_GRVWA1_GSU1_GSUC0_GSUWGMRR0_K1_LBSPPA128_LBSPPB2048_LPA4_LPB0_LRVW4_LWPM0p26_MIWT1_8_NTD4_NLCB1_PLR1_SU0_SUM0_SUS0_SVW1_ULSGRO1_VWA1_VWB8_WG32_8_1_WGM1_WGMXCC8_WGMXCCG304
    SolutionIndex: 46
    SolutionNameMin: Cijk_Alik_Bjlk_BBS_BH_Bias_HAS_SAV_UserArgs_MT32x256x32_MI16x16x1_SN_LDSB1_CLR1_GRVWA1_GSU1_GSUC0_GSUWGMRR0_K1_LBSPPA128_LBSPPB2048_LPA4_LPB0_LRVW4_LWPMn1_MIWT1_8_NTD0_NLCB1_PLR1_SU16_SUM1_SUS256_SVW1_ULSGRO1_VWA1_VWB8_WG32_8_1_WGM6_WGMXCC8_WGMXCCG304
    SolutionIndex: 47
    SolutionNameMin: Cijk_Alik_Bjlk_BBS_BH_Bias_HAS_SAV_UserArgs_MT32x256x32_MI16x16x1_SN_LDSB1_CLR1_GRVWA1_GSU1_GSUC0_GSUWGMRR0_K1_LBSPPA128_LBSPPB2048_LPA4_LPB0_LRVW4_LWPM0p27_MIWT1_8_NTD0_NLCB1_PLR1_SU16_SUM1_SUS256_SVW1_ULSGRO1_VWA1_VWB8_WG32_8_1_WGM8_WGMXCC8_WGMXCCG304
    SolutionIndex: 48
    SolutionNameMin: Cijk_Alik_Bjlk_BBS_BH_Bias_HAS_SAV_UserArgs_MT32x256x32_MI16x16x1_SN_LDSB1_CLR1_GRVWA1_GSU1_GSUC0_GSUWGMRR0_K1_LBSPPA128_LBSPPB2048_LPA4_LPB0_LRVW4_LWPM0p27_MIWT1_8_NTD0_NLCB1_PLR1_SU16_SUM0_SUS256_SVW1_ULSGRO1_VWA1_VWB8_WG32_8_1_WGM1_WGMXCC8_WGMXCCG304
    SolutionIndex: 49
    SolutionNameMin: Cijk_Alik_Bjlk_BBS_BH_Bias_HAS_SAV_UserArgs_MT96x128x32_MI16x16x1_SN_LDSB0_CLR1_GRVWA1_GSU1_GSUC0_GSUWGMRR0_K1_LBSPPA128_LBSPPB1024_LPA4_LPB0_LRVW4_LWPM0p50_MIWT3_4_NTD4_NLCB1_PLR1_SU0_SUM0_SUS0_SVW1_ULSGRO1_VWA1_VWB4_WG32_8_1_WGM1_WGMXCC8_WGMXCCG304
    SolutionIndex: 50
    SolutionNameMin: Cijk_Alik_Bjlk_BBS_BH_Bias_HAS_SAV_UserArgs_MT128x128x32_MI16x16x1_SN_LDSB1_CLR1_GRVWA1_GSU1_GSUC0_GSUWGMRR0_K1_LBSPPA256_LBSPPB1024_LPA4_LPB0_LRVW4_LWPM0p26_MIWT4_4_NTD0_NLCB1_PLR1_SU16_SUM1_SUS64_SVW4_ULSGRO1_VWA4_VWB4_WG32_8_1_WGM1_WGMXCC8_WGMXCCG304
    SolutionIndex: 51
    SolutionNameMin: Cijk_Alik_Bjlk_BBS_BH_Bias_HAS_SAV_UserArgs_MT32x256x32_MI16x16x1_SN_LDSB1_CLR1_GRVWA1_GSU1_GSUC0_GSUWGMRR0_K1_LBSPPA128_LBSPPB2048_LPA4_LPB0_LRVW4_LWPM0p26_MIWT1_8_NTD0_NLCB1_PLR1_SU0_SUM0_SUS0_SVW1_ULSGRO1_VWA1_VWB8_WG32_8_1_WGM1_WGMXCC1_WGMXCCG304
    SolutionIndex: 52
    SolutionNameMin: Cijk_Alik_Bjlk_BBS_BH_Bias_HAS_SAV_UserArgs_MT32x256x32_MI16x16x1_SN_LDSB1_CLR1_GRVWA1_GSU1_GSUC0_GSUWGMRR0_K1_LBSPPA128_LBSPPB2048_LPA4_LPB0_LRVW4_LWPM0p50_MIWT1_8_NTD0_NLCB1_PLR1_SU0_SUM0_SUS0_SVW1_ULSGRO1_VWA1_VWB8_WG32_8_1_WGM1_WGMXCC1_WGMXCCG304
    SolutionIndex: 53
    SolutionNameMin: Cijk_Alik_Bjlk_BBS_BH_Bias_HAS_SAV_UserArgs_MT32x256x32_MI16x16x1_SN_LDSB1_CLR1_GRVWA1_GSU1_GSUC0_GSUWGMRR0_K1_LBSPPA128_LBSPPB2048_LPA4_LPB0_LRVW4_LWPM0p25_MIWT1_8_NTD0_NLCB1_PLR1_SU0_SUM0_SUS0_SVW1_ULSGRO1_VWA1_VWB8_WG32_8_1_WGM1_WGMXCC8_WGMXCCG304
    SolutionIndex: 54
    SolutionNameMin: Cijk_Alik_Bjlk_BBS_BH_Bias_HAS_SAV_UserArgs_MT64x128x32_MI16x16x1_SN_LDSB0_CLR1_GRVWA4_GSU1_GSUC0_GSUWGMRR0_K1_LBSPPA128_LBSPPB1024_LPA4_LPB0_LRVW4_LWPM0p50_MIWT2_4_NTD4_NLCB1_PLR1_SU0_SUM0_SUS0_SVW2_ULSGRO0_VWA2_VWB4_WG32_8_1_WGM1_WGMXCC8_WGMXCCG304
    SolutionIndex: 55
    SolutionNameMin: Cijk_Alik_Bjlk_BBS_BH_Bias_HAS_SAV_UserArgs_MT96x256x32_MI16x16x1_SN_LDSB1_CLR1_GRVWA1_GSU1_GSUC0_GSUWGMRR0_K1_LBSPPA128_LBSPPB2048_LPA4_LPB0_LRVW4_LWPMn1_MIWT3_8_NTD0_NLCB1_PLR1_SU16_SUM1_SUS256_SVW1_ULSGRO1_VWA1_VWB8_WG32_8_1_WGM8_WGMXCC1_WGMXCCG304
    SolutionIndex: 56
    SolutionNameMin: Cijk_Alik_Bjlk_BBS_BH_Bias_HAS_SAV_UserArgs_MT128x128x32_MI16x16x1_SN_LDSB1_CLR1_GRVWA1_GSU1_GSUC0_GSUWGMRR0_K1_LBSPPA256_LBSPPB1024_LPA4_LPB0_LRVW4_LWPM0p26_MIWT4_4_NTD0_NLCB1_PLR1_SU16_SUM0_SUS64_SVW4_ULSGRO1_VWA4_VWB4_WG32_8_1_WGM1_WGMXCC8_WGMXCCG304
    SolutionIndex: 57
    SolutionNameMin: Cijk_Alik_Bjlk_BBS_BH_Bias_HAS_SAV_UserArgs_MT32x128x32_MI16x16x1_SN_LDSB0_CLR1_GRVWA1_GSU1_GSUC0_GSUWGMRR0_K1_LBSPPA128_LBSPPB1024_LPA4_LPB0_LRVW4_LWPM0p25_MIWT1_4_NTD4_NLCB1_PLR1_SU0_SUM0_SUS0_SVW1_ULSGRO1_VWA1_VWB4_WG32_8_1_WGM1_WGMXCC1_WGMXCCG304
    SolutionIndex: 58
    SolutionNameMin: Cijk_Alik_Bjlk_BBS_BH_Bias_HAS_SAV_UserArgs_MT32x256x32_MI16x16x1_SN_LDSB1_CLR1_GRVWA1_GSU1_GSUC0_GSUWGMRR0_K1_LBSPPA128_LBSPPB2048_LPA4_LPB0_LRVW4_LWPM0p27_MIWT1_8_NTD4_NLCB1_PLR1_SU16_SUM1_SUS256_SVW1_ULSGRO1_VWA1_VWB8_WG32_8_1_WGM1_WGMXCC1_WGMXCCG304
    SolutionIndex: 59
    SolutionNameMin: Cijk_Alik_Bjlk_BBS_BH_Bias_HAS_SAV_UserArgs_MT32x256x32_MI16x16x1_SN_LDSB1_CLR1_GRVWA1_GSU1_GSUC0_GSUWGMRR0_K1_LBSPPA128_LBSPPB2048_LPA4_LPB0_LRVW4_LWPMn1_MIWT1_8_NTD4_NLCB1_PLR1_SU0_SUM0_SUS0_SVW1_ULSGRO1_VWA1_VWB8_WG32_8_1_WGM4_WGMXCC8_WGMXCCG304
    SolutionIndex: 60
    SolutionNameMin: Cijk_Alik_Bjlk_BBS_BH_Bias_HAS_SAV_UserArgs_MT64x256x32_MI16x16x1_SN_LDSB1_CLR1_GRVWA1_GSU1_GSUC0_GSUWGMRR0_K1_LBSPPA128_LBSPPB2048_LPA4_LPB0_LRVW4_LWPM0p25_MIWT2_8_NTD0_NLCB1_PLR1_SU16_SUM1_SUS256_SVW2_ULSGRO1_VWA2_VWB8_WG32_8_1_WGM1_WGMXCC1_WGMXCCG304
    SolutionIndex: 61
    SolutionNameMin: Cijk_Alik_Bjlk_BBS_BH_Bias_HAS_SAV_UserArgs_MT96x256x32_MI16x16x1_SN_LDSB1_CLR1_GRVWA1_GSU1_GSUC0_GSUWGMRR0_K1_LBSPPA128_LBSPPB2048_LPA4_LPB0_LRVW4_LWPMn1_MIWT3_8_NTD0_NLCB1_PLR1_SU16_SUM0_SUS64_SVW1_ULSGRO1_VWA1_VWB8_WG32_8_1_WGM8_WGMXCC1_WGMXCCG304
    SolutionIndex: 62
    SolutionNameMin: Cijk_Alik_Bjlk_BBS_BH_Bias_HAS_SAV_UserArgs_MT128x128x32_MI16x16x1_SN_LDSB1_CLR1_GRVWA1_GSU1_GSUC0_GSUWGMRR0_K1_LBSPPA256_LBSPPB1024_LPA4_LPB0_LRVW4_LWPM0p50_MIWT4_4_NTD0_NLCB1_PLR1_SU16_SUM1_SUS256_SVW4_ULSGRO1_VWA4_VWB4_WG32_8_1_WGM1_WGMXCC8_WGMXCCG304
- - - [1024, 1, 1, 256]
    - [0, 81.9512]
  - - [4096, 1, 1, 256]
    - [6, 290.293]
  - - [16384, 1, 1, 256]
    - [6, 1069.21]
  - - [65536, 1, 1, 256]
    - [3, 2220.6]
  - - [262144, 1, 1, 256]
    - [2, 2891.53]
  - - [1024, 1, 1, 1024]
    - [5, 187.547]
  - - [4096, 1, 1, 1024]
    - [5, 728.137]
  - - [16384, 1, 1, 1024]
    - [6, 2177.77]
  - - [65536, 1, 1, 1024]
    - [2, 2970.89]
  - - [262144, 1, 1, 1024]
    - [2, 3382.82]
  - - [1024, 1, 1, 4096]
    - [5, 363.399]
  - - [4096, 1, 1, 4096]
    - [5, 1404.42]
  - - [16384, 1, 1, 4096]
    - [1, 2248.02]
  - - [65536, 1, 1, 4096]
    - [3, 3303.42]
  - - [262144, 1, 1, 4096]
    - [4, 3603.88]
  - - [24, 128, 38, 6]
    - [7, 0.14]
  - - [32, 256, 38, 52]
    - [8, 2.53]
  - - [32, 256, 38, 110]
    - [9, 4.65]
  - - [56, 256, 38, 128]
    - [10, 10.61]
  - - [56, 256, 38, 52]
    - [11, 4.21]
  - - [96, 256, 38, 90]
    - [12, 12.31]
  - - [112, 256, 38, 90]
    - [13, 13.73]
  - - [24, 128, 76, 6]
    - [14, 0.27]
  - - [32, 256, 76, 52]
    - [15, 4.89]
  - - [32, 256, 76, 110]
    - [9, 8.82]
  - - [56, 256, 76, 128]
    - [16, 18.13]
  - - [56, 256, 76, 52]
    - [17, 7.72]
  - - [96, 256, 76, 90]
    - [18, 20.93]
  - - [112, 256, 76, 90]
    - [19, 21.24]
  - - [24, 128, 152, 6]
    - [20, 0.5]
  - - [32, 256, 152, 52]
    - [11, 9.17]
  - - [32, 256, 152, 110]
    - [11, 16.14]
  - - [56, 256, 152, 128]
    - [21, 27.09]
  - - [56, 256, 152, 52]
    - [22, 12.01]
  - - [96, 256, 152, 90]
    - [23, 31.12]
  - - [112, 256, 152, 90]
    - [24, 30.12]
  - - [24, 128, 304, 6]
    - [15, 0.9]
  - - [32, 256, 304, 52]
    - [25, 14.65]
  - - [32, 256, 304, 110]
    - [25, 20.93]
  - - [56, 256, 304, 128]
    - [26, 30.35]
  - - [56, 256, 304, 52]
    - [27, 17.0]
  - - [96, 256, 304, 90]
    - [28, 32.02]
  - - [112, 256, 304, 90]
    - [29, 26.85]
  - - [24, 128, 608, 6]
    - [30, 1.5]
  - - [32, 256, 608, 52]
    - [31, 15.73]
  - - [32, 256, 608, 110]
    - [32, 21.93]
  - - [56, 256, 608, 128]
    - [33, 31.38]
  - - [56, 256, 608, 52]
    - [34, 17.07]
  - - [96, 256, 608, 90]
    - [35, 37.97]
  - - [112, 256, 608, 90]
    - [36, 29.99]
  - - [24, 128, 912, 6]
    - [37, 1.78]
  - - [32, 256, 912, 52]
    - [38, 15.97]
  - - [32, 256, 912, 110]
    - [39, 24.51]
  - - [56, 256, 912, 128]
    - [40, 30.22]
  - - [56, 256, 912, 52]
    - [41, 16.49]
  - - [96, 256, 912, 90]
    - [42, 37.54]
  - - [112, 256, 912, 90]
    - [43, 30.56]
  - - [24, 128, 1287, 6]
    - [44, 1.69]
  - - [32, 256, 1287, 52]
    - [45, 15.93]
  - - [32, 256, 1287, 110]
    - [46, 24.05]
  - - [56, 256, 1287, 128]
    - [47, 31.8]
  - - [56, 256, 1287, 52]
    - [48, 17.88]
  - - [96, 256, 1287, 90]
    - [49, 36.87]
  - - [112, 256, 1287, 90]
    - [50, 31.5]
  - - [24, 128, 1520, 6]
    - [37, 1.81]
  - - [32, 256, 1520, 52]
    - [51, 17.15]
  - - [32, 256, 1520, 110]
    - [52, 24.51]
  - - [56, 256, 1520, 128]
    - [53, 32.36]
  - - [56, 256, 1520, 52]
    - [54, 18.22]
  - - [96, 256, 1520, 90]
    - [55, 37.74]
  - - [112, 256, 1520, 90]
    - [56, 33.72]
  - - [24, 128, 2048, 6]
    - [57, 1.81]
  - - [32, 256, 2048, 52]
    - [58, 18.55]
  - - [32, 256, 2048, 110]
    - [59, 26.48]
  - - [56, 256, 2048, 128]
    - [53, 34.6]
  - - [56, 256, 2048, 52]
    - [60, 18.62]
  - - [96, 256, 2048, 90]
    - [61, 40.16]
  - - [112, 256, 2048, 90]
    - [62, 34.71]
- null
- null
- DeviceEfficiency
- GridBased
