library/src/amd_detail/rocblaslt/src/Tensile/Logic/asm_full/aquavanjaram/gfx942_20cu/Equality/aquavanjaram_Cijk_Alik_Bljk_S_MX_B_Bias_HAS_SAV_UserArgs.yaml
- {MinimumRequiredVersion: 4.33.0}
- aquavanjaram
- {Architecture: gfx942, CUCount: 20}
- [Device 0049, Device 0050]
    SolutionIndex: 0
    SolutionNameMin: Cijk_Alik_Bljk_S_MX_B_Bias_HAS_SAV_UserArgs_MT32x64x32_MI16x16x1_SN_CLR1_GRVWA4_GRVWB4_GSU1_GSUC0_GSUWGMRR0_K1_LBSPPA128_LBSPPB256_LPA8_LPB8_LRVW4_MIWT1_2_NLCA1_NLCB1_PLR1_SU0_SUM0_SUS0_SVW1_VWA1_VWB2_WSGRA0_WSGRB1_WG32_8_1_WGM1_WGMXCC1_WGMXCCGn1
    SolutionIndex: 1
    SolutionNameMin: Cijk_Alik_Bljk_S_MX_B_Bias_HAS_SAV_UserArgs_MT32x64x64_MI16x16x1_SN_CLR1_GRVWA4_GRVWB4_GSU1_GSUC0_GSUWGMRR0_K1_LBSPPA256_LBSPPB512_LPA8_LPB8_LRVW4_MIWT1_2_NLCA1_NLCB1_PLR1_SU0_SUM0_SUS0_SVW1_VWA1_VWB2_WSGRA0_WSGRB0_WG32_8_1_WGM1_WGMXCC1_WGMXCCGn1
    SolutionIndex: 2
    SolutionNameMin: Cijk_Alik_Bljk_S_MX_B_Bias_HAS_SAV_UserArgs_MT32x64x64_MI16x16x1_SN_CLR1_GRVWA4_GRVWB4_GSU1_GSUC0_GSUWGMRR0_K1_LBSPPA256_LBSPPB512_LPA8_LPB8_LRVW4_MIWT1_2_NLCA1_NLCB1_PLR1_SU0_SUM0_SUS0_SVW1_VWA1_VWB2_WSGRA0_WSGRB1_WG32_8_1_WGM1_WGMXCC1_WGMXCCGn1
    SolutionIndex: 3
    SolutionNameMin: Cijk_Alik_Bljk_S_MX_B_Bias_HAS_SAV_UserArgs_MT32x32x16_MI16x16x1_SN_CLR1_GRVWA1_GRVWB1_GSU1_GSUC0_GSUWGMRR0_K1_LBSPPA128_LBSPPB128_LPA2_LPB2_LRVW2_MIWT1_1_NLCA1_NLCB1_PLR1_SU0_SUM0_SUS0_SVW1_VWA1_VWB1_WSGRA0_WSGRB0_WG32_8_1_WGM1_WGMXCC1_WGMXCCGn1
    SolutionIndex: 4
    SolutionNameMin: Cijk_Alik_Bljk_S_MX_B_Bias_HAS_SAV_UserArgs_MT32x32x64_MI16x16x1_SN_CLR1_GRVWA4_GRVWB4_GSU1_GSUC0_GSUWGMRR0_K1_LBSPPA256_LBSPPB256_LPA8_LPB8_LRVW4_MIWT1_1_NLCA1_NLCB1_PLR1_SU0_SUM0_SUS0_SVW1_VWA1_VWB1_WSGRA0_WSGRB0_WG32_8_1_WGM1_WGMXCC1_WGMXCCGn1
    SolutionIndex: 5
    SolutionNameMin: Cijk_Alik_Bljk_S_MX_B_Bias_HAS_SAV_UserArgs_MT16x16x128_MI16x16x1_SN_CLR1_GRVWA4_GRVWB4_GSU1_GSUC0_GSUWGMRR0_K1_LBSPPA512_LBSPPB512_LPA8_LPB8_LRVW4_MIWT1_1_NLCA1_NLCB1_PLR1_SU0_SUM0_SUS0_SVW1_VWA1_VWB1_WSGRA0_WSGRB0_WG16_4_4_WGM1_WGMXCC1_WGMXCCGn1
    SolutionIndex: 6
    SolutionNameMin: Cijk_Alik_Bljk_S_MX_B_Bias_HAS_SAV_UserArgs_MT16x16x16_MI16x16x1_SN_CLR0_GRVWA1_GRVWB1_GSU1_GSUC0_GSUWGMRR0_K1_LBSPPA128_LBSPPB128_LPA2_LPB2_LRVW2_MIWT1_1_NLCA1_NLCB1_PLR0_SU0_SUM0_SUS0_SVW1_VWA1_VWB1_WSGRA0_WSGRB0_WG16_4_2_WGM1_WGMXCC1_WGMXCCGn1
    SolutionIndex: 7
    SolutionNameMin: Cijk_Alik_Bljk_S_MX_B_Bias_HAS_SAV_UserArgs_MT16x16x16_MI16x16x1_SN_CLR1_GRVWA4_GRVWB4_GSU1_GSUC0_GSUWGMRR0_K1_LBSPPA128_LBSPPB128_LPA4_LPB4_LRVW2_MIWT1_1_NLCA1_NLCB1_PLR1_SU0_SUM0_SUS0_SVW1_VWA1_VWB1_WSGRA1_WSGRB0_WG16_4_1_WGM1_WGMXCC1_WGMXCCGn1
    SolutionIndex: 8
    SolutionNameMin: Cijk_Alik_Bljk_S_MX_B_Bias_HAS_SAV_UserArgs_MT16x16x16_MI16x16x1_SN_CLR1_GRVWA4_GRVWB4_GSU1_GSUC0_GSUWGMRR0_K1_LBSPPA128_LBSPPB128_LPA4_LPB4_LRVW2_MIWT1_1_NLCA1_NLCB1_PLR1_SU0_SUM0_SUS0_SVW1_VWA1_VWB1_WSGRA0_WSGRB1_WG16_4_1_WGM1_WGMXCC1_WGMXCCGn1
    SolutionIndex: 9
    SolutionNameMin: Cijk_Alik_Bljk_S_MX_B_Bias_HAS_SAV_UserArgs_MT32x16x32_MI16x16x1_SN_CLR1_GRVWA4_GRVWB4_GSU1_GSUC0_GSUWGMRR0_K1_LBSPPA128_LBSPPB128_LPA8_LPB8_LRVW4_MIWT1_1_NLCA1_NLCB1_PLR1_SU0_SUM0_SUS0_SVW1_VWA1_VWB1_WSGRA1_WSGRB0_WG32_4_1_WGM1_WGMXCC1_WGMXCCGn1
    SolutionIndex: 10
    SolutionNameMin: Cijk_Alik_Bljk_S_MX_B_Bias_HAS_SAV_UserArgs_MT32x16x64_MI16x16x1_SN_CLR1_GRVWA4_GRVWB4_GSU1_GSUC0_GSUWGMRR0_K1_LBSPPA256_LBSPPB256_LPA8_LPB8_LRVW4_MIWT1_1_NLCA1_NLCB1_PLR1_SU0_SUM0_SUS0_SVW1_VWA1_VWB1_WSGRA0_WSGRB0_WG32_4_1_WGM1_WGMXCC1_WGMXCCGn1
    SolutionIndex: 11
    SolutionNameMin: Cijk_Alik_Bljk_S_MX_B_Bias_HAS_SAV_UserArgs_MT32x16x64_MI16x16x1_SN_CLR1_GRVWA4_GRVWB4_GSU1_GSUC0_GSUWGMRR0_K1_LBSPPA256_LBSPPB256_LPA8_LPB8_LRVW4_MIWT1_1_NLCA1_NLCB1_PLR1_SU0_SUM0_SUS0_SVW1_VWA1_VWB1_WSGRA1_WSGRB0_WG32_4_1_WGM1_WGMXCC1_WGMXCCGn1
- - - [50, 36, 8, 24]
    - [7, 0.0]
  - - [50, 37, 8, 24]
    - [7, 0.0]
  - - [50, 38, 3, 42]
    - [6, 0.0]
  - - [50, 37, 3, 42]
    - [6, 0.0]
  - - [50, 36, 1, 128]
    - [5, 0.0]
  - - [50, 37, 1, 128]
    - [5, 0.0]
  - - [50, 36, 3, 42]
    - [6, 0.0]
  - - [50, 38, 8, 24]
    - [7, 0.0]
  - - [50, 50, 1, 48]
    - [8, 0.0]
  - - [50, 64, 3, 42]
    - [6, 0.0]
  - - [50, 64, 8, 24]
    - [7, 0.0]
  - - [50, 271, 1, 128]
    - [4, 0.0]
  - - [50, 315, 1, 128]
    - [11, 0.0]
  - - [50, 384, 1, 128]
    - [10, 0.0]
  - - [50, 425, 1, 128]
    - [11, 0.0]
  - - [50, 672, 1, 128]
    - [4, 0.0]
  - - [50, 768, 1, 128]
    - [4, 0.0]
  - - [50, 512, 1, 128]
    - [2, 0.0]
  - - [150, 64, 8, 32]
    - [9, 0.0]
  - - [150, 512, 1, 128]
    - [1, 0.0]
  - - [150, 315, 1, 128]
    - [4, 0.0]
  - - [150, 768, 1, 128]
    - [0, 0.0]
  - - [200, 38, 4, 24]
    - [7, 0.0]
  - - [200, 64, 4, 24]
    - [3, 0.0]
  - - [200, 36, 4, 24]
    - [3, 0.0]
  - - [200, 37, 4, 24]
    - [3, 0.0]
  - - [1, 200, 38, 24]
    - [7, 0.0]
  - - [1, 200, 37, 24]
    - [7, 0.0]
  - - [1, 200, 36, 24]
    - [7, 0.0]    
- null
- null
- DeviceEfficiency
- Equality
