library/src/amd_detail/rocblaslt/src/Tensile/Logic/asm_full/aquavanjaram/gfx942_80cu/Equality/aquavanjaram_Cijk_Alik_Bljk_HHS_BH_UserArgs.yaml
- {MinimumRequiredVersion: 4.33.0}
- aquavanjaram
- {Architecture: gfx942, CUCount: 80}
- [Device 0049, Device 0050]
    SolutionIndex: 0
    SolutionNameMin: Cijk_Alik_Bljk_HHS_BH_UserArgs_MT256x224x64_MI16x16x1_SN_GRVWA2_GRVWB2_GSU1_LBSPPA1024_LPA4_LPB4_LRVW4_MIWT8_7_SU8_SUM0_SUS256_SVW8_VWA8_WG32_8_1_WGM1_WGMXCC4
    SolutionIndex: 1
    SolutionNameMin: Cijk_Alik_Bljk_HHS_BH_UserArgs_MT256x192x64_MI32x32x1_SN_GRVWA8_GRVWB8_GSU1_LBSPPA512_LPA8_LPB8_LRVW8_MIWT4_3_SU8_SUM0_SUS256_SVW4_VWA4_WG64_4_1_WGM16
    SolutionIndex: 2
    SolutionNameMin: Cijk_Alik_Bljk_HHS_BH_UserArgs_MT128x256x32_MI16x16x1_SN_GRVWA2_GRVWB8_GSU1_LBSPPA512_LPA4_LPB8_LRVW4_MIAV1_MIWT8_4_NTC4_NTD4_SU0_SUM0_SUS0_SPO0_SSO0_SVW8_VWA8_WG16_16_1_WGM1
    SolutionIndex: 3
    SolutionNameMin: Cijk_Alik_Bljk_HHS_BH_UserArgs_MT256x224x64_MI16x16x1_SN_GRVWA2_GRVWB2_GSU1_LBSPPA1024_LPA4_LPB4_LRVW4_MIWT8_7_SU8_SUM0_SUS256_SVW8_VWA8_WG32_8_1_WGM16
    SolutionIndex: 4
    SolutionNameMin: Custom_Cijk_Alik_Bljk_HHS_BH_UserArgs_MT128x16x128_MI16x16x1_SN_K1_MIWT2_1_triple_buffer
    SolutionIndex: 5
    SolutionNameMin: Cijk_Alik_Bljk_HHS_BH_HAS_UserArgs_MT32x32x128_MI16x16x1_SN_GRVWA8_GRVWB8_GSU1_GSUC0_GSUWGMRR0_K1_LBSPPA512_LBSPPB256_LPA16_LPB16_LRVW8_MIWT2_1_SU0_SUM0_SUS0_SVW2_VWA2_VWB1_WG16_8_1_WGM8_WGMXCC4_WGMXCCG80
    SolutionIndex: 6
    SolutionNameMin: Cijk_Alik_Bljk_HHS_BH_HAS_UserArgs_MT16x32x64_MI16x16x1_SN_GRVWA8_GRVWB8_GSU1_GSUC0_GSUWGMRR0_K1_LBSPPA128_LBSPPB128_LPA16_LPB16_LRVW8_MIWT1_1_SU0_SUM0_SUS0_SVW1_VWA1_VWB1_WG16_8_1_WGM8_WGMXCC4_WGMXCCG80
    SolutionIndex: 7
    SolutionNameMin: Cijk_Alik_Bljk_HHS_BH_HAS_UserArgs_MT64x16x32_MI16x16x1_SN_GRVWA4_GRVWB4_GSU1_GSUC0_GSUWGMRR0_K1_LBSPPA256_LBSPPB128_LPA4_LPB4_LRVW4_MIWT4_1_SU0_SUM0_SUS0_SVW4_VWA4_VWB1_WG16_4_1_WGM8_WGMXCC4_WGMXCCG80
    SolutionIndex: 8
    SolutionNameMin: Cijk_Alik_Bljk_HHS_BH_HAS_UserArgs_MT32x32x32_MI16x16x1_SN_GRVWA4_GRVWB4_GSU1_GSUC0_GSUWGMRR0_K1_LBSPPA128_LBSPPB128_LPA4_LPB4_LRVW4_MIWT2_2_SU0_SUM0_SUS0_SVW2_VWA2_VWB2_WG16_4_1_WGM8_WGMXCC4_WGMXCCG80
    SolutionIndex: 9
    SolutionNameMin: Cijk_Alik_Bljk_HHS_BH_HAS_UserArgs_MT64x64x32_MI16x16x1_SN_GRVWA4_GRVWB4_GSU1_GSUC0_GSUWGMRR0_K1_LBSPPA256_LBSPPB128_LPA4_LPB4_LRVW4_MIWT4_2_SU0_SUM0_SUS0_SVW4_VWA4_VWB2_WG16_8_1_WGM8_WGMXCC4_WGMXCCG80
    SolutionIndex: 10
    SolutionNameMin: Cijk_Alik_Bljk_HHS_BH_HAS_UserArgs_MT32x64x32_MI16x16x1_SN_GRVWA4_GRVWB4_GSU1_GSUC0_GSUWGMRR0_K1_LBSPPA128_LBSPPB128_LPA4_LPB4_LRVW4_MIWT2_1_SU0_SUM0_SUS0_SVW2_VWA2_VWB1_WG16_16_1_WGM8_WGMXCC4_WGMXCCG80
    SolutionIndex: 11
    SolutionNameMin: Cijk_Alik_Bljk_HHS_BH_MT192x256x64_MI16x16x1_SN_GSU1_LBSPPA256_LBSPPB256_LPA16_LPB8_MIWT6_8_SVW2_VWA2_VWB4_WG32_8_1_WGM1
    SolutionIndex: 12
    SolutionNameMin: Cijk_Alik_Bljk_HHS_BH_UserArgs_MT256x160x32_MI16x16x1_SN_GRVWA2_GRVWB2_GSU1_GSUC0_GSUWGMRR0_K1_LBSPPA512_LBSPPB128_LPA4_LPB4_LRVW4_MIWT8_5_SU8_SUM0_SUS256_SVW8_VWA8_VWB1_WG32_8_1_WGM16_WGMXCC1_WGMXCCGn1
    SolutionIndex: 13
    SolutionNameMin: Cijk_Alik_Bljk_HHS_BH_Bias_HAS_SAV_UserArgs_MT64x128x32_MI16x16x1_SN_LDSB0_GRVWA4_GRVWB4_GSU1_LBSPPA256_LBSPPB128_LPA4_LPB4_LRVW4_MIWT4_2_SU0_SUM0_SUS0_SVW4_VWA4_WG16_16_1_WGM8
- - - [4096, 4096, 1, 4096]
    - [0, 0.0]
  - - [22016, 12288, 1, 4096]
    - [1, 0.0]
  - - [2048, 2048, 192, 128]
    - [2, 0.0]
  - - [8192, 8192, 1, 8192]
    - [3, 0.0]
  - - [10240, 16, 1, 64640]
    - [4, 0.0]
  - - [32, 32, 512, 768]
    - [5, 28236.5]
  - - [16, 32, 512, 768]
    - [6, 19433.1]
  - - [64, 2, 2560, 32]
    - [7, 1081.56]
  - - [32, 32, 6144, 64]
    - [8, 20305.3]
  - - [64, 64, 2560, 32]
    - [9, 19628.2]
  - - [160, 1024, 1, 160]
    - [10, 9102.22]
  - - [3072, 1024, 16, 768]
    - [11, 157267.0]
  - - [768, 16384, 1, 768]
    - [12, 158188.0]
  - - [640, 1024, 1, 160]
    - [13, 28036.8]
- null
- null
- DeviceEfficiency
- Equality
