library/src/amd_detail/rocblaslt/src/Tensile/Logic/asm_full/aquavanjaram/gfx942_80cu/Equality/aquavanjaram_Cijk_Ailk_Bjlk_HHS_BH_UserArgs.yaml
- {MinimumRequiredVersion: 4.33.0}
- aquavanjaram
- {Architecture: gfx942, CUCount: 80}
- [Device 0049, Device 0050]
    SolutionIndex: 0
    SolutionNameMin: Cijk_Ailk_Bjlk_HHS_BH_MT16x256x32_MI16x16x1_SN_LDSB1_GRVWB8_GSU8_LBSPPB2048_LWPM0p40_MIWT1_4_NTB0_SU0_SUM0_SUS0_SPO0_VWB4_WGM1
    SolutionIndex: 1
    SolutionNameMin: Cijk_Ailk_Bjlk_HHS_BH_MT16x128x32_MI16x16x1_SN_LDSB0_GRVWB8_GSU10_LBSPPB1024_LWPMn1_MIWT1_2_NTB1_SU0_SUM0_SUS0_SPO1_VWB2_WGM1
    SolutionIndex: 2
    SolutionNameMin: Cijk_Ailk_Bjlk_HHS_BH_MT16x64x64_MI16x16x1_SN_LDSB0_GRVWB8_GSU15_LBSPPB512_LWPM0p40_MIWT1_1_NTB1_SU0_SUM0_SUS0_SPO1_VWB1_WGM1
    SolutionIndex: 3
    SolutionNameMin: Cijk_Ailk_Bjlk_HHS_BH_UserArgs_MT256x192x64_MI32x32x1_SN_GSU1_LBSPPA0_LBSPPB0_LPA0_LPB0_MIWT4_3_NLCA1_NLCB3_SU8_SUM0_SUS256_SVW2_VWA2_VWB1_WSGRA1_WSGRB0_WG64_4_1_WGM32_WGMXCC4
    SolutionIndex: 4
    SolutionNameMin: Cijk_Ailk_Bjlk_HHS_BH_UserArgs_MT256x192x64_MI32x32x1_SN_GSU1_LBSPPA0_LBSPPB0_LPA0_LPB0_MIWT4_3_NLCA1_NLCB3_SU16_SUM0_SUS256_SVW2_VWA2_VWB1_WSGRA1_WSGRB0_WG64_4_1_WGM32_WGMXCC4
    SolutionIndex: 5
    SolutionNameMin: Cijk_Ailk_Bjlk_HHS_BH_UserArgs_MT256x192x64_MI32x32x1_SN_GSU1_LBSPPA0_LBSPPB0_LPA0_LPB0_MIWT4_3_NLCA1_NLCB3_SU8_SUM0_SUS512_SVW2_VWA2_VWB1_WSGRA0_WSGRB0_WG64_4_1_WGM32_WGMXCC1
    SolutionIndex: 6
    SolutionNameMin: Cijk_Ailk_Bjlk_HHS_BH_UserArgs_MT256x256x64_MI32x32x1_SN_GSU1_LBSPPA0_LBSPPB0_LPA0_LPB0_MIWT4_4_NLCA1_NLCB1_SU8_SUM0_SUS256_SVW2_VWA2_VWB4_WSGRA0_WSGRB0_WG64_4_1_WGM32_WGMXCC1
    SolutionIndex: 7
    SolutionNameMin: Cijk_Ailk_Bjlk_HHS_BH_UserArgs_MT256x256x64_MI32x32x1_SN_GSU1_LBSPPA0_LBSPPB0_LPA0_LPB0_MIWT4_4_NLCA1_NLCB1_SU16_SUM0_SUS512_SVW2_VWA2_VWB4_WSGRA1_WSGRB1_WG64_4_1_WGM32_WGMXCC4
    SolutionIndex: 8
    SolutionNameMin: Cijk_Ailk_Bjlk_HHS_BH_UserArgs_MT128x256x32_MI32x32x1_SN_GSU1_LBSPPA0_LBSPPB0_LPA0_MIAV0_MIWT2_4_NTB0_NTC3_NTD3_SU0_SUM0_SUS0_SPO0_SVW2_VWA2_VWB4_WSGRA0_WG64_4_1_WGM1_WGMXCC1
    SolutionIndex: 9
    SolutionNameMin: Cijk_Ailk_Bjlk_HHS_BH_HAS_UserArgs_MT80x160x64_MI16x16x1_SN_GRVWA8_GRVWB8_GSU80_GSUC0_GSUWGMRR0_K1_LBSPPA640_LBSPPB1280_LPA16_LPB16_MIWT5_5_NLCA5_NLCB5_SU0_SUM0_SUS0_SVW1_VWA1_VWB1_WG16_8_1_WGM8_WGMXCC4_WGMXCCG80
    SolutionIndex: 10
    SolutionNameMin: Cijk_Ailk_Bjlk_HHS_BH_HAS_UserArgs_MT16x256x64_MI16x16x1_SN_GRVWA4_GRVWB8_GSU26_GSUC0_GSUWGMRR0_K1_LBSPPA128_LBSPPB2048_LPA16_LPB0_MIWT1_4_NLCA1_NLCB1_SU0_SUM0_SUS0_SVW1_VWA1_VWB4_WG16_16_1_WGM8_WGMXCC4_WGMXCCG80
    SolutionIndex: 11
    SolutionNameMin: Cijk_Ailk_Bjlk_HHS_BH_HAS_UserArgs_MT128x192x64_MI16x16x1_SN_GRVWA8_GRVWB8_GSU16_GSUC0_GSUWGMRR0_K1_LBSPPA1024_LBSPPB1536_LPA0_LPB32_MIWT4_6_NLCA1_NLCB3_SU4_SUM0_SUS256_SVW4_VWA4_VWB2_WG32_8_1_WGM8_WGMXCC4_WGMXCCG80
    SolutionIndex: 12
    SolutionNameMin: Cijk_Ailk_Bjlk_HHS_BH_HAS_UserArgs_MT256x32x32_MI16x16x1_SN_GRVWA8_GRVWB4_GSU1_GSUC0_GSUWGMRR0_K1_LBSPPA2048_LBSPPB256_LPA0_LPB16_MIWT8_1_NLCA1_NLCB1_SU0_SUM0_SUS0_SVW8_VWA8_VWB1_WG32_8_1_WGM8_WGMXCC4_WGMXCCG80
    SolutionIndex: 13
    SolutionNameMin: Cijk_Ailk_Bjlk_HHS_BH_HAS_UserArgs_MT32x64x32_MI16x16x1_SN_GRVWA8_GRVWB8_GSU1_GSUC0_GSUWGMRR0_K1_LBSPPA256_LBSPPB512_LPA32_LPB0_MIWT2_4_NLCA1_NLCB1_SU0_SUM0_SUS0_SVW2_VWA2_VWB4_WG16_4_1_WGM8_WGMXCC4_WGMXCCG80
    SolutionIndex: 14
    SolutionNameMin: Cijk_Ailk_Bjlk_HHS_BH_HAS_UserArgs_MT160x128x64_MI16x16x1_SN_GRVWA8_GRVWB8_GSU16_GSUC0_GSUWGMRR0_K1_LBSPPA1280_LBSPPB1024_LPA16_LPB0_MIWT5_4_NLCA5_NLCB1_SU0_SUM0_SUS0_SVW1_VWA1_VWB4_WG32_8_1_WGM8_WGMXCC4_WGMXCCG80
    SolutionIndex: 15
    SolutionNameMin: Cijk_Ailk_Bjlk_HHS_BH_HAS_UserArgs_MT64x32x32_MI16x16x1_SN_GRVWA8_GRVWB8_GSU1_GSUC0_GSUWGMRR0_K1_LBSPPA512_LBSPPB256_LPA0_LPB32_MIWT4_2_NLCA1_NLCB1_SU0_SUM0_SUS0_SVW4_VWA4_VWB2_WG16_4_1_WGM8_WGMXCC4_WGMXCCG80
    SolutionIndex: 16
    SolutionNameMin: Cijk_Ailk_Bjlk_HHS_BH_HAS_UserArgs_MT192x192x32_MI16x16x1_SN_GRVWA8_GRVWB8_GSU5_GSUC0_GSUWGMRR0_K1_LBSPPA1536_LBSPPB1536_LPA32_LPB32_MIWT6_6_NLCA3_NLCB3_SU0_SUM0_SUS0_SVW2_VWA2_VWB2_WG32_8_1_WGM8_WGMXCC4_WGMXCCG80
    SolutionIndex: 17
    SolutionNameMin: Cijk_Ailk_Bjlk_HHS_BH_HAS_UserArgs_MT128x32x32_MI16x16x1_SN_GRVWA8_GRVWB4_GSU1_GSUC0_GSUWGMRR0_K1_LBSPPA1024_LBSPPB256_LPA0_LPB16_MIWT4_1_NLCA1_NLCB1_SU0_SUM0_SUS0_SVW4_VWA4_VWB1_WG32_8_1_WGM8_WGMXCC4_WGMXCCG80
    SolutionIndex: 18
    SolutionNameMin: Cijk_Ailk_Bjlk_HHS_BH_HAS_UserArgs_MT32x256x64_MI16x16x1_SN_GRVWA8_GRVWB8_GSU26_GSUC0_GSUWGMRR0_K1_LBSPPA256_LBSPPB2048_LPA32_LPB0_MIWT2_4_NLCA1_NLCB1_SU0_SUM0_SUS0_SVW2_VWA2_VWB4_WG16_16_1_WGM8_WGMXCC4_WGMXCCG80
    SolutionIndex: 19
    SolutionNameMin: Cijk_Ailk_Bjlk_HHS_BH_HAS_UserArgs_MT32x64x32_MI16x16x1_SN_GRVWA4_GRVWB8_GSU1_GSUC0_GSUWGMRR0_K1_LBSPPA256_LBSPPB512_LPA32_LPB16_MIWT2_1_NLCA1_NLCB1_SU0_SUM0_SUS0_SVW2_VWA2_VWB1_WG16_16_1_WGM8_WGMXCC4_WGMXCCG80
    SolutionIndex: 20
    SolutionNameMin: Cijk_Ailk_Bjlk_HHS_BH_Bias_HAS_SAV_UserArgs_MT32x64x128_MI16x16x1_SN_LDSB0_CLR1_GSU1_LBSPPA256_LBSPPB512_LPA32_LPB32_MIAV1_MIWT2_2_NLCA1_NLCB1_PLR1_SU0_SUM0_SUS0_SVW2_VWA2_VWB2_WG16_8_2_WGM1
    SolutionIndex: 21
    SolutionNameMin: Cijk_Ailk_Bjlk_HHS_BH_Bias_HAS_SAV_UserArgs_MT64x32x128_MI16x16x1_SN_LDSB0_CLR1_GSU1_LBSPPA512_LBSPPB256_LPA32_LPB32_MIAV1_MIWT2_2_NLCA1_NLCB1_PLR1_SU0_SUM0_SUS0_SVW2_VWA2_VWB2_WG32_4_2_WGM1
    SolutionIndex: 22
    SolutionNameMin: Cijk_Ailk_Bjlk_HHS_BH_Bias_HAS_SAV_UserArgs_MT32x16x256_MI16x16x1_SN_LDSB0_CLR1_GSU1_LBSPPA256_LBSPPB128_LPA32_LPB16_MIWT2_1_NLCA1_PLR1_SU0_SUM0_SUS0_SVW2_VWA2_VWB1_WG16_4_4_WGM1
- - - [2, 7168, 1, 8192]
    - [0, 0.0]
  - - [2, 3584, 1, 8192]
    - [1, 0.0]
  - - [2, 1280, 1, 8192]
    - [2, 0.0]
  - - [4096, 4096, 1, 12288]
    - [3, 0.0]
  - - [4096, 12288, 1, 12288]
    - [4, 0.0]
  - - [4096, 22016, 1, 12288]
    - [5, 0.0]
  - - [4096, 32000, 1, 12288]
    - [6, 0.0]
  - - [11008, 4096, 1, 12288]
    - [7, 0.0]
  - - [128, 2048, 192, 2048]
    - [8, 0.0]
  - - [160, 160, 1, 32768]
    - [9, 48335.4]
  - - [16, 768, 1, 16384]
    - [10, 19002.0]
  - - [640, 160, 1, 32768]
    - [11, 99775.3]
  - - [768, 32, 512, 32]
    - [12, 19589.1]
  - - [32, 64, 2560, 64]
    - [13, 23014.0]
  - - [160, 640, 1, 32768]
    - [14, 96323.9]
  - - [64, 32, 6144, 32]
    - [15, 15646.1]
  - - [768, 768, 1, 16384]
    - [16, 145911.0]
  - - [768, 32, 512, 16]
    - [17, 5167.52]
  - - [32, 768, 1, 16384]
    - [18, 34577.3]
  - - [32, 64, 2560, 2]
    - [19, 508.524]
  - - [160, 640, 1, 1024]
    - [20, 19581.3]
  - - [640, 160, 1, 1024]
    - [21, 19617.9]
  - - [160, 160, 1, 1024]
    - [22, 6853.44]
- null
- null
- DeviceEfficiency
- Equality
