library/src/amd_detail/rocblaslt/src/Tensile/Logic/asm_full/aquavanjaram/gfx942_80cu/Equality/aquavanjaram_Cijk_Ailk_Bjlk_BBS_BH_UserArgs.yaml
- {MinimumRequiredVersion: 4.33.0}
- aquavanjaram
- {Architecture: gfx942, CUCount: 80}
- [Device 0049, Device 0050]
    SolutionIndex: 0
    SolutionNameMin: Cijk_Ailk_Bjlk_BBS_BH_MT16x256x32_MI16x16x1_SN_LDSB1_GRVWB8_GSU8_LBSPPB2048_LWPM0p40_MIWT1_4_NTB0_SU0_SUM0_SUS0_SPO0_VWB4_WGM1
    SolutionIndex: 1
    SolutionNameMin: Cijk_Ailk_Bjlk_BBS_BH_MT16x128x32_MI16x16x1_SN_LDSB0_GRVWB8_GSU10_LBSPPB1024_LWPMn1_MIWT1_2_NTB1_SU0_SUM0_SUS0_SPO1_VWB2_WGM1
    SolutionIndex: 2
    SolutionNameMin: Cijk_Ailk_Bjlk_BBS_BH_MT16x64x64_MI16x16x1_SN_LDSB0_GRVWB8_GSU15_LBSPPB512_LWPM0p40_MIWT1_1_NTB1_SU0_SUM0_SUS0_SPO1_VWB1_WGM1
    SolutionIndex: 3
    SolutionNameMin: Cijk_Ailk_Bjlk_BBS_BH_UserArgs_MT256x192x64_MI32x32x1_SN_GSU1_LBSPPA0_LBSPPB0_LPA0_LPB0_MIWT4_3_NLCA1_NLCB3_SU8_SUM0_SUS256_SVW2_VWA2_VWB1_WSGRA1_WSGRB0_WG64_4_1_WGM32_WGMXCC4
    SolutionIndex: 4
    SolutionNameMin: Cijk_Ailk_Bjlk_BBS_BH_UserArgs_MT256x192x64_MI32x32x1_SN_GSU1_LBSPPA0_LBSPPB0_LPA0_LPB0_MIWT4_3_NLCA1_NLCB3_SU16_SUM0_SUS256_SVW2_VWA2_VWB1_WSGRA1_WSGRB0_WG64_4_1_WGM32_WGMXCC4
    SolutionIndex: 5
    SolutionNameMin: Cijk_Ailk_Bjlk_BBS_BH_UserArgs_MT256x192x64_MI32x32x1_SN_GSU1_LBSPPA0_LBSPPB0_LPA0_LPB0_MIWT4_3_NLCA1_NLCB3_SU8_SUM0_SUS512_SVW2_VWA2_VWB1_WSGRA0_WSGRB0_WG64_4_1_WGM32_WGMXCC1
    SolutionIndex: 6
    SolutionNameMin: Cijk_Ailk_Bjlk_BBS_BH_UserArgs_MT256x256x64_MI32x32x1_SN_GSU1_LBSPPA0_LBSPPB0_LPA0_LPB0_MIWT4_4_NLCA1_NLCB1_SU8_SUM0_SUS256_SVW2_VWA2_VWB4_WSGRA0_WSGRB0_WG64_4_1_WGM32_WGMXCC1
    SolutionIndex: 7
    SolutionNameMin: Cijk_Ailk_Bjlk_BBS_BH_UserArgs_MT256x256x64_MI32x32x1_SN_GSU1_LBSPPA0_LBSPPB0_LPA0_LPB0_MIWT4_4_NLCA1_NLCB1_SU16_SUM0_SUS512_SVW2_VWA2_VWB4_WSGRA1_WSGRB1_WG64_4_1_WGM32_WGMXCC4
    SolutionIndex: 8
    SolutionNameMin: Cijk_Ailk_Bjlk_BBS_BH_UserArgs_MT128x256x32_MI32x32x1_SN_GSU1_LBSPPA0_LBSPPB0_LPA0_MIAV0_MIWT2_4_NTB0_NTC3_NTD3_SU0_SUM0_SUS0_SPO0_SVW2_VWA2_VWB4_WSGRA0_WG64_4_1_WGM1_WGMXCC1
    SolutionIndex: 9
    SolutionNameMin: Cijk_Ailk_Bjlk_BBS_BH_HAS_UserArgs_MT64x64x64_MI16x16x1_SN_GRVWA8_GRVWB8_GSU1_GSUC0_GSUWGMRR0_K1_LBSPPA512_LBSPPB512_LPA32_LPB32_MIWT2_2_NLCA1_NLCB1_SU0_SUM0_SUS0_SVW2_VWA2_VWB2_WG32_8_1_WGM1_WGMXCC4_WGMXCCG80
    SolutionIndex: 10
    SolutionNameMin: Cijk_Ailk_Bjlk_BBS_BH_HAS_UserArgs_MT256x128x32_MI32x32x1_SN_GRVWA8_GRVWB8_GSU1_GSUC0_GSUWGMRR0_K1_LBSPPA0_LBSPPB0_LPA0_LPB0_MIWT4_2_NLCA1_NLCB1_SU0_SUM0_SUS0_SVW4_VWA4_VWB2_WG64_4_1_WGM1_WGMXCC4_WGMXCCG80
    SolutionIndex: 11
    SolutionNameMin: Cijk_Ailk_Bjlk_BBS_BH_HAS_UserArgs_MT128x256x32_MI32x32x1_SN_GRVWA8_GRVWB8_GSU1_GSUC0_GSUWGMRR0_K1_LBSPPA0_LBSPPB0_LPA0_LPB0_MIWT4_2_NLCA1_NLCB1_SU0_SUM0_SUS0_SVW4_VWA4_VWB2_WG32_8_1_WGM1_WGMXCC4_WGMXCCG80
    SolutionIndex: 12
    SolutionNameMin: Cijk_Ailk_Bjlk_BBS_BH_HAS_UserArgs_MT256x128x32_MI32x32x1_SN_GRVWA8_GRVWB8_GSU1_GSUC0_GSUWGMRR0_K1_LBSPPA0_LBSPPB0_LPA0_LPB0_MIWT4_2_NLCA1_NLCB1_SU4_SUM0_SUS256_SVW4_VWA4_VWB2_WG64_4_1_WGM1_WGMXCC4_WGMXCCG80
    SolutionIndex: 13
    SolutionNameMin: Cijk_Ailk_Bjlk_BBS_BH_HAS_UserArgs_MT256x96x64_MI16x16x1_SN_GRVWA8_GRVWB8_GSU40_GSUC0_GSUWGMRR0_K1_LBSPPA2048_LBSPPB768_LPA0_LPB32_MIWT4_6_NLCA1_NLCB3_SU0_SUM0_SUS0_SVW4_VWA4_VWB2_WG64_4_1_WGM1_WGMXCC4_WGMXCCG80
    SolutionIndex: 14
    SolutionNameMin: Cijk_Ailk_Bjlk_BBS_BH_HAS_UserArgs_MT128x256x32_MI32x32x1_SN_GRVWA8_GRVWB8_GSU40_GSUC0_GSUWGMRR0_K1_LBSPPA0_LBSPPB0_LPA0_LPB0_MIWT2_4_NLCA1_NLCB1_SU0_SUM0_SUS0_SVW2_VWA2_VWB4_WG64_4_1_WGM1_WGMXCC4_WGMXCCG80
    SolutionIndex: 15
    SolutionNameMin: Cijk_Ailk_Bjlk_BBS_BH_HAS_UserArgs_MT128x128x64_MI16x16x1_SN_GRVWA8_GRVWB8_GSU20_GSUC0_GSUWGMRR0_K1_LBSPPA1024_LBSPPB1024_LPA0_LPB0_MIWT4_4_NLCA1_NLCB1_SU4_SUM0_SUS256_SVW4_VWA4_VWB4_WG32_8_1_WGM1_WGMXCC4_WGMXCCG80
    SolutionIndex: 16
    SolutionNameMin: Cijk_Ailk_Bjlk_BBS_BH_HAS_UserArgs_MT128x192x64_MI16x16x1_SN_GRVWA8_GRVWB8_GSU80_GSUC0_GSUWGMRR0_K1_LBSPPA1024_LBSPPB1536_LPA0_LPB32_MIWT4_6_NLCA1_NLCB3_SU0_SUM0_SUS0_SVW4_VWA4_VWB2_WG32_8_1_WGM1_WGMXCC4_WGMXCCG80
    SolutionIndex: 17
    SolutionNameMin: Cijk_Ailk_Bjlk_BBS_BH_HAS_UserArgs_MT128x128x64_MI16x16x1_SN_GRVWA8_GRVWB8_GSU40_GSUC0_GSUWGMRR0_K1_LBSPPA1024_LBSPPB1024_LPA0_LPB0_MIWT4_4_NLCA1_NLCB1_SU0_SUM0_SUS0_SVW4_VWA4_VWB4_WG32_8_1_WGM1_WGMXCC4_WGMXCCG80
    SolutionIndex: 18
    SolutionNameMin: Cijk_Ailk_Bjlk_BBS_BH_HAS_UserArgs_MT256x128x64_MI32x32x1_SN_GRVWA8_GRVWB8_GSU20_GSUC0_GSUWGMRR0_K1_LBSPPA0_LBSPPB0_LPA0_LPB0_MIWT4_2_NLCA1_NLCB1_SU0_SUM0_SUS0_SVW4_VWA4_VWB2_WG64_4_1_WGM4_WGMXCC4_WGMXCCG80
    SolutionIndex: 19
    SolutionNameMin: Cijk_Ailk_Bjlk_BBS_BH_HAS_UserArgs_MT128x128x64_MI16x16x1_SN_GRVWA8_GRVWB8_GSU1_GSUC0_GSUWGMRR0_K1_LBSPPA1024_LBSPPB1024_LPA0_LPB0_MIWT4_4_NLCA1_NLCB1_SU4_SUM0_SUS256_SVW4_VWA4_VWB4_WG32_8_1_WGM1_WGMXCC4_WGMXCCG80
    SolutionIndex: 20
    SolutionNameMin: Cijk_Ailk_Bjlk_BBS_BH_HAS_UserArgs_MT256x128x32_MI32x32x1_SN_GRVWA8_GRVWB8_GSU5_GSUC0_GSUWGMRR0_K1_LBSPPA0_LBSPPB0_LPA0_LPB0_MIWT2_4_NLCA1_NLCB1_SU4_SUM0_SUS256_SVW2_VWA2_VWB4_WG128_2_1_WGM1_WGMXCC4_WGMXCCG80
    SolutionIndex: 21
    SolutionNameMin: Cijk_Ailk_Bjlk_BBS_BH_HAS_UserArgs_MT128x256x32_MI32x32x1_SN_GRVWA8_GRVWB8_GSU1_GSUC0_GSUWGMRR0_K1_LBSPPA0_LBSPPB0_LPA0_LPB0_MIWT4_2_NLCA1_NLCB1_SU4_SUM0_SUS256_SVW4_VWA4_VWB2_WG32_8_1_WGM1_WGMXCC4_WGMXCCG80
    SolutionIndex: 22
    SolutionNameMin: Cijk_Ailk_Bjlk_BBS_BH_HAS_UserArgs_MT64x32x128_MI16x16x1_SN_GRVWA8_GRVWB8_GSU1_GSUC0_GSUWGMRR0_K1_LBSPPA512_LBSPPB256_LPA32_LPB16_MIWT2_1_NLCA1_NLCB1_SU4_SUM0_SUS256_SVW2_VWA2_VWB1_WG32_8_1_WGM1_WGMXCC4_WGMXCCG80
    SolutionIndex: 23
    SolutionNameMin: Cijk_Ailk_Bjlk_BBS_BH_Bias_HAS_SAV_UserArgs_MT16x16x256_MI16x16x1_SN_LDSB0_GSU1_LBSPPA128_LPA16_MIWT1_1_NLCA1_SU0_SUM0_SUS0_SVW1_VWA1_WG16_4_4_WGM1
    SolutionIndex: 24
    SolutionNameMin: Cijk_Ailk_Bjlk_BBS_BH_Bias_HAS_SAV_UserArgs_MT16x16x256_MI16x16x1_SN_LDSB0_CLR1_GSU1_LBSPPA128_LBSPPB128_LPA16_LPB16_MIWT1_1_NLCA1_PLR1_SU0_SUM0_SUS0_SVW1_VWA1_VWB1_WG16_4_4_WGM1
    SolutionIndex: 25
    SolutionNameMin: Cijk_Ailk_Bjlk_BBS_BH_Bias_HAS_SAV_UserArgs_MT256x96x64_MI16x16x1_SN_GSU1_LBSPPA2048_LBSPPB768_LPA0_LPB32_MIAV0_MIWT4_6_NTA0_NTC3_NTD3_NLCA1_NLCB3_SU0_SUM0_SUS0_SVW4_VWA4_VWB2_WG64_4_1_WGM1
    SolutionIndex: 26
    SolutionNameMin: Cijk_Ailk_Bjlk_BBS_BH_Bias_HAS_SAV_UserArgs_MT128x512x32_MI32x32x1_SN_CLR1_GSU10_LBSPPA0_LBSPPB0_LPA0_LPB0_MIAV0_MIWT4_4_NLCA1_NLCB1_PLR1_SU0_SUM0_SUS0_SVW4_VWA4_VWB4_WG32_8_1_WGM1
    SolutionIndex: 27
    SolutionNameMin: Cijk_Ailk_Bjlk_BBS_BH_Bias_HAS_SAV_UserArgs_MT16x16x256_MI16x16x1_SN_LDSB0_CLR1_GSU1_LBSPPA128_LBSPPB128_LPA16_LPB16_MIWT1_1_NLCA1_NLCB1_PLR1_SU0_SUM0_SUS0_SVW1_VWA1_VWB1_WG16_4_4_WGM1
    SolutionIndex: 28
    SolutionNameMin: Cijk_Ailk_Bjlk_BBS_BH_Bias_HAS_SAV_UserArgs_MT32x32x256_MI16x16x1_SN_LDSB1_CLR1_GSU40_LBSPPA256_LBSPPB256_LPA32_LPB16_MIWT2_1_PLR1_SU0_SUM0_SUS0_SVW2_VWA2_VWB1_WG16_8_2_WGM1
    SolutionIndex: 29
    SolutionNameMin: Cijk_Ailk_Bjlk_BBS_BH_Bias_HAS_SAV_UserArgs_MT16x64x128_MI16x16x1_SN_CLR1_GSU1_LBSPPA128_LBSPPB512_LPA16_LPB0_MIWT1_4_NLCA1_NLCB1_PLR1_SU0_SUM0_SUS0_SVW1_VWA1_VWB4_WG16_4_4_WGM1
    SolutionIndex: 30
    SolutionNameMin: Cijk_Ailk_Bjlk_BBS_BH_Bias_HAS_SAV_UserArgs_MT128x256x32_MI32x32x1_SN_GSU4_LBSPPA0_LBSPPB0_LPA0_LPB0_MIAV0_MIWT2_4_NLCA1_NLCB1_SU0_SUM0_SUS0_SVW2_VWA2_VWB4_WG64_4_1_WGM1
    SolutionIndex: 31
    SolutionNameMin: Cijk_Ailk_Bjlk_BBS_BH_Bias_HAS_SAV_UserArgs_MT32x32x256_MI16x16x1_SN_CLR1_GSU1_LBSPPA256_LBSPPB256_LPA32_LPB32_MIWT2_2_NLCA1_NLCB1_PLR1_SU0_SUM0_SUS0_SVW2_VWA2_VWB2_WG16_4_4_WGM1
    SolutionIndex: 32
    SolutionNameMin: Cijk_Ailk_Bjlk_BBS_BH_Bias_HAS_SAV_UserArgs_MT64x32x128_MI16x16x1_SN_LDSB0_CLR1_GSU1_LBSPPA512_LBSPPB256_LPA32_LPB32_MIAV1_MIWT2_2_NLCA1_NLCB1_PLR1_SU0_SUM0_SUS0_SVW2_VWA2_VWB2_WG32_4_2_WGM1
    SolutionIndex: 33
    SolutionNameMin: Cijk_Ailk_Bjlk_BBS_BH_Bias_AS_SAV_UserArgs_MT256x128x32_MI32x32x1_SN_CLR1_GSU20_GSUC0_GSUWGMRR0_K1_LBSPPA0_LBSPPB0_LPA0_LPB0_MIAV0_MIWT2_4_NLCA1_NLCB1_PLR1_SU0_SUM0_SUS0_SVW2_VWA2_VWB4_WG128_2_1_WGM1_WGMXCC1_WGMXCCGn1
- - - [2, 7168, 1, 8192]
    - [0, 0.0]
  - - [2, 3584, 1, 8192]
    - [1, 0.0]
  - - [2, 1280, 1, 8192]
    - [2, 0.0]
  - - [4096, 4096, 1, 12288]
    - [3, 0.0]
  - - [4096, 12288, 1, 12288]
    - [4, 0.0]
  - - [4096, 22016, 1, 12288]
    - [5, 0.0]
  - - [4096, 32000, 1, 12288]
    - [6, 0.0]
  - - [11008, 4096, 1, 12288]
    - [7, 0.0]
  - - [128, 2048, 192, 2048]
    - [8, 0.0]
  - - [768, 256, 1, 512]
    - [9, 22027.0]
  - - [1536, 896, 32, 1024]
    - [10, 166576.0]
  - - [2048, 1032, 1, 1024]
    - [11, 111646.0]
  - - [1024, 1536, 28, 1024]
    - [12, 166607.0]
  - - [256, 192, 1, 61440]
    - [13, 103297.0]
  - - [3072, 768, 28, 1024]
    - [8, 164280.0]
  - - [1024, 3072, 28, 1024]
    - [11, 167360.0]
  - - [128, 512, 1, 126976]
    - [14, 147977.0]
  - - [512, 98, 1, 20480]
    - [15, 52549.4]
  - - [128, 168, 1, 51200]
    - [16, 56202.4]
  - - [768, 320, 1, 512]
    - [9, 27413.8]
  - - [128, 248, 512, 248]
    - [11, 86034.7]
  - - [256, 88, 1, 61440]
    - [17, 63303.0]
  - - [512, 196, 1, 15360]
    - [18, 69573.8]
  - - [1024, 1536, 32, 1024]
    - [8, 162386.0]
  - - [1024, 248, 512, 248]
    - [10, 101384.0]
  - - [128, 9776, 1, 1024]
    - [19, 103128.0]
  - - [3072, 3072, 32, 1024]
    - [11, 168940.0]
  - - [1024, 3072, 32, 1024]
    - [10, 167018.0]
  - - [1536, 768, 28, 1024]
    - [8, 163080.0]
  - - [3072, 1024, 32, 1024]
    - [8, 167044.0]
  - - [3072, 896, 32, 1024]
    - [10, 167596.0]
  - - [1024, 512, 1, 126976]
    - [20, 175905.0]
  - - [3072, 3072, 28, 1024]
    - [21, 169648.0]
  - - [1024, 128, 1, 512]
    - [22, 16693.7]
  - - [40, 64, 1, 1024]
    - [23, 743.671]
  - - [16, 32, 1, 512]
    - [24, 92.9589]
  - - [1792, 792, 1, 1024]
    - [25, 83428.6]
  - - [32, 128, 1, 512]
    - [23, 692.129]
  - - [512, 1024, 1, 126976]
    - [26, 173690.0]
  - - [128, 128, 1, 1024]
    - [27, 4307.37]
  - - [64, 128, 1, 1024]
    - [27, 2173.21]
  - - [64, 128, 1, 512]
    - [24, 1340.03]
  - - [64, 32, 1, 30720]
    - [28, 8624.34]
  - - [128, 128, 1, 512]
    - [27, 2538.16]
  - - [128, 512, 1, 1024]
    - [29, 12905.6]
  - - [48, 176, 1, 1024]
    - [24, 2409.68]
  - - [768, 768, 1, 16384]
    - [30, 143955.0]
  - - [64, 800, 1, 1024]
    - [31, 12066.5]
  - - [64, 64, 1, 1024]
    - [27, 1150.7]
  - - [32, 32, 1, 1024]
    - [23, 315.836]
  - - [64, 1216, 1, 1024]
    - [31, 17729.0]
  - - [32, 24, 1, 512]
    - [23, 137.248]
  - - [256, 544, 1, 1024]
    - [32, 25834.5]
  - - [512, 200, 1, 20480]
    - [33, 82289.7]
  - - [64, 1184, 1, 1024]
    - [31, 17359.0]
- null
- null
- DeviceEfficiency
- Equality
