library/src/amd_detail/rocblaslt/src/Tensile/Logic/asm_full/aquavanjaram/gfx942_80cu/Equality/aquavanjaram_Cijk_Alik_Bljk_HHS_BH_Bias_HAS_SAV_UserArgs.yaml
- {MinimumRequiredVersion: 4.33.0}
- aquavanjaram
- '{Architecture: gfx942, CUCount: 80}'
- [Device 0049, Device 0050]
    SolutionIndex: 0
    SolutionNameMin: Cijk_Alik_Bljk_HHS_BH_Bias_HAS_SAV_UserArgs_MT16x16x64_MI16x16x1_SN_GRVWA8_GRVWB8_GSU1_GSUC1_GSUWGMRR1_K1_LBSPPA128_LBSPPB128_LPA16_LPB16_LRVW8_MIWT1_1_SU0_SUM0_SUS0_SVW1_ULSGRO1_VWA1_VWB1_WG16_4_1_WGM1_WGMXCC4_WGMXCCG80
    SolutionIndex: 1
    SolutionNameMin: Cijk_Alik_Bljk_HHS_BH_Bias_HAS_SAV_UserArgs_MT128x256x64_MI16x16x1_SN_GRVWA8_GRVWB8_GSU1_GSUC1_GSUWGMRR1_K1_LBSPPA1024_LBSPPB512_LPA16_LPB16_LRVW8_MIWT8_4_SU0_SUM0_SUS0_SVW8_ULSGRO1_VWA8_VWB4_WG16_16_1_WGM5_WGMXCC4_WGMXCCG80
    SolutionIndex: 2
    SolutionNameMin: Cijk_Alik_Bljk_HHS_BH_Bias_HAS_SAV_UserArgs_MT160x192x64_MI16x16x1_SN_GRVWA8_GRVWB8_GSU1_GSUC1_GSUWGMRR1_K1_LBSPPA256_LBSPPB128_LPA16_LPB16_LRVW8_MIWT10_3_SU0_SUM0_SUS0_SVW2_ULSGRO0_VWA2_VWB1_WG16_16_1_WGM5_WGMXCC4_WGMXCCG80
    SolutionIndex: 3
    SolutionNameMin: Cijk_Alik_Bljk_HHS_BH_Bias_HAS_SAV_UserArgs_MT128x96x64_MI16x16x1_SN_GRVWA8_GRVWB8_GSU1_GSUC1_GSUWGMRR1_K1_LBSPPA512_LBSPPB128_LPA16_LPB16_LRVW8_MIWT4_3_SU0_SUM0_SUS0_SVW4_ULSGRO0_VWA4_VWB1_WG32_8_1_WGM1_WGMXCC4_WGMXCCG80
    SolutionIndex: 4
    SolutionNameMin: Cijk_Alik_Bljk_HHS_BH_Bias_HAS_SAV_UserArgs_MT256x192x64_MI16x16x1_SN_GRVWA8_GRVWB8_GSU1_GSUC1_GSUWGMRR1_K1_LBSPPA1024_LBSPPB256_LPA16_LPB16_LRVW8_MIWT8_6_SU0_SUM0_SUS0_SVW8_ULSGRO1_VWA8_VWB2_WG32_8_1_WGM1_WGMXCC4_WGMXCCG80
    SolutionIndex: 5
    SolutionNameMin: Cijk_Alik_Bljk_HHS_BH_Bias_HAS_SAV_UserArgs_MT64x48x128_MI16x16x1_SN_GRVWA8_GRVWB8_GSU1_GSUC1_GSUWGMRR1_K1_LBSPPA256_LBSPPB256_LPA16_LPB16_LRVW8_MIWT1_3_SU0_SUM0_SUS0_SVW1_ULSGRO0_VWA1_VWB1_WG64_4_1_WGM5_WGMXCC4_WGMXCCG80
    SolutionIndex: 6
    SolutionNameMin: Cijk_Alik_Bljk_HHS_BH_Bias_HAS_SAV_UserArgs_MT64x48x128_MI16x16x1_SN_GRVWA8_GRVWB8_GSU1_GSUC1_GSUWGMRR1_K1_LBSPPA256_LBSPPB256_LPA16_LPB16_LRVW8_MIWT1_3_SU0_SUM0_SUS0_SVW1_ULSGRO1_VWA1_VWB1_WG64_4_1_WGM5_WGMXCC4_WGMXCCG80
    SolutionIndex: 7
    SolutionNameMin: Cijk_Alik_Bljk_HHS_BH_Bias_HAS_SAV_UserArgs_MT128x32x128_MI16x16x1_SN_GRVWA8_GRVWB8_GSU1_GSUC1_GSUWGMRR1_K1_LBSPPA512_LBSPPB512_LPA16_LPB16_LRVW8_MIWT2_2_SU0_SUM0_SUS0_SVW2_ULSGRO1_VWA2_VWB2_WG64_4_1_WGM1_WGMXCC4_WGMXCCG80
    SolutionIndex: 8
    SolutionNameMin: Cijk_Alik_Bljk_HHS_BH_Bias_HAS_SAV_UserArgs_MT64x96x128_MI16x16x1_SN_GRVWA8_GRVWB8_GSU1_GSUC1_GSUWGMRR1_K1_LBSPPA512_LBSPPB256_LPA16_LPB16_LRVW8_MIWT2_3_SU0_SUM0_SUS0_SVW2_ULSGRO1_VWA2_VWB1_WG32_8_1_WGM1_WGMXCC4_WGMXCCG80
    SolutionIndex: 9
    SolutionNameMin: Cijk_Alik_Bljk_HHS_BH_Bias_HAS_SAV_UserArgs_MT64x32x128_MI16x16x1_SN_GRVWA8_GRVWB8_GSU3_GSUC1_GSUWGMRR1_K1_LBSPPA512_LBSPPB256_LPA16_LPB16_LRVW8_MIWT2_1_SU0_SUM0_SUS0_SVW2_ULSGRO0_VWA2_VWB1_WG32_8_1_WGM1_WGMXCC4_WGMXCCG80
    SolutionIndex: 10
    SolutionNameMin: Cijk_Alik_Bljk_HHS_BH_Bias_HAS_SAV_UserArgs_MT128x64x128_MI16x16x1_SN_GRVWA8_GRVWB8_GSU4_GSUC1_GSUWGMRR1_K1_LBSPPA1024_LBSPPB512_LPA16_LPB16_LRVW8_MIWT4_2_SU0_SUM0_SUS0_SVW4_ULSGRO1_VWA4_VWB2_WG32_8_1_WGM1_WGMXCC4_WGMXCCG80
    SolutionIndex: 11
    SolutionNameMin: Cijk_Alik_Bljk_HHS_BH_Bias_HAS_SAV_UserArgs_MT16x16x256_MI16x16x1_SN_GRVWA8_GRVWB8_GSU1_GSUC1_GSUWGMRR1_K1_LBSPPA512_LBSPPB512_LPA16_LPB16_LRVW8_MIWT1_1_SU0_SUM0_SUS0_SVW1_ULSGRO0_VWA1_VWB1_WG16_4_1_WGM1_WGMXCC4_WGMXCCG80
    SolutionIndex: 12
    SolutionNameMin: Cijk_Alik_Bljk_HHS_BH_Bias_HAS_SAV_UserArgs_MT16x16x256_MI16x16x1_SN_GRVWA8_GRVWB8_GSU1_GSUC1_GSUWGMRR1_K1_LBSPPA512_LBSPPB512_LPA16_LPB16_LRVW8_MIWT1_1_SU0_SUM0_SUS0_SVW1_ULSGRO1_VWA1_VWB1_WG16_4_1_WGM1_WGMXCC4_WGMXCCG80
    SolutionIndex: 13
    SolutionNameMin: Cijk_Alik_Bljk_HHS_BH_Bias_HAS_SAV_UserArgs_MT16x16x256_MI16x16x1_SN_GRVWA8_GRVWB8_GSU1_GSUC1_GSUWGMRR1_K1_LBSPPA512_LBSPPB512_LPA16_LPB16_LRVW8_MIWT1_1_SU0_SUM0_SUS0_SVW1_ULSGRO0_VWA1_VWB1_WG16_4_1_WGM5_WGMXCC4_WGMXCCG80
    SolutionIndex: 14
    SolutionNameMin: Cijk_Alik_Bljk_HHS_BH_Bias_HAS_SAV_UserArgs_MT16x16x256_MI16x16x1_SN_GRVWA8_GRVWB8_GSU1_GSUC1_GSUWGMRR1_K1_LBSPPA512_LBSPPB512_LPA16_LPB16_LRVW8_MIWT1_1_SU0_SUM0_SUS0_SVW1_ULSGRO1_VWA1_VWB1_WG16_4_1_WGM5_WGMXCC4_WGMXCCG80
    SolutionIndex: 15
    SolutionNameMin: Cijk_Alik_Bljk_HHS_BH_Bias_HAS_SAV_UserArgs_MT64x16x256_MI16x16x1_SN_GRVWA8_GRVWB8_GSU4_GSUC1_GSUWGMRR1_K1_LBSPPA512_LBSPPB512_LPA16_LPB16_LRVW8_MIWT1_1_SU0_SUM0_SUS0_SVW1_ULSGRO0_VWA1_VWB1_WG64_4_1_WGM1_WGMXCC4_WGMXCCG80
    SolutionIndex: 16
    SolutionNameMin: Cijk_Alik_Bljk_HHS_BH_Bias_HAS_SAV_UserArgs_MT32x64x256_MI16x16x1_SN_GRVWA8_GRVWB8_GSU1_GSUC1_GSUWGMRR1_K1_LBSPPA1024_LBSPPB512_LPA16_LPB16_LRVW8_MIWT2_1_SU0_SUM0_SUS0_SVW2_ULSGRO0_VWA2_VWB1_WG16_16_1_WGM1_WGMXCC4_WGMXCCG80
    SolutionIndex: 17
    SolutionNameMin: Cijk_Alik_Bljk_HHS_BH_Bias_HAS_SAV_UserArgs_MT32x32x256_MI16x16x1_SN_GRVWA8_GRVWB8_GSU1_GSUC1_GSUWGMRR1_K1_LBSPPA512_LBSPPB512_LPA16_LPB16_LRVW8_MIWT1_1_SU0_SUM0_SUS0_SVW1_ULSGRO0_VWA1_VWB1_WG32_8_1_WGM1_WGMXCC4_WGMXCCG80
    SolutionIndex: 18
    SolutionNameMin: Cijk_Alik_Bljk_HHS_BH_Bias_HAS_SAV_UserArgs_MT32x32x256_MI16x16x1_SN_GRVWA8_GRVWB8_GSU1_GSUC1_GSUWGMRR1_K1_LBSPPA512_LBSPPB512_LPA16_LPB16_LRVW8_MIWT1_1_SU0_SUM0_SUS0_SVW1_ULSGRO1_VWA1_VWB1_WG32_8_1_WGM1_WGMXCC4_WGMXCCG80
    SolutionIndex: 19
    SolutionNameMin: Cijk_Alik_Bljk_HHS_BH_Bias_HAS_SAV_UserArgs_MT64x32x256_MI16x16x1_SN_GRVWA8_GRVWB8_GSU1_GSUC1_GSUWGMRR1_K1_LBSPPA1024_LBSPPB512_LPA16_LPB16_LRVW8_MIWT2_1_SU0_SUM0_SUS0_SVW2_ULSGRO0_VWA2_VWB1_WG32_8_1_WGM1_WGMXCC4_WGMXCCG80
    SolutionIndex: 20
    SolutionNameMin: Cijk_Alik_Bljk_HHS_BH_Bias_HAS_SAV_UserArgs_MT64x32x256_MI16x16x1_SN_GRVWA8_GRVWB8_GSU1_GSUC1_GSUWGMRR1_K1_LBSPPA1024_LBSPPB512_LPA16_LPB16_LRVW8_MIWT2_1_SU0_SUM0_SUS0_SVW2_ULSGRO1_VWA2_VWB1_WG32_8_1_WGM1_WGMXCC4_WGMXCCG80
    SolutionIndex: 21
    SolutionNameMin: Cijk_Alik_Bljk_HHS_BH_Bias_HAS_SAV_UserArgs_MT64x32x256_MI16x16x1_SN_GRVWA8_GRVWB8_GSU4_GSUC1_GSUWGMRR1_K1_LBSPPA1024_LBSPPB512_LPA16_LPB16_LRVW8_MIWT2_1_SU0_SUM0_SUS0_SVW2_ULSGRO1_VWA2_VWB1_WG32_8_1_WGM1_WGMXCC4_WGMXCCG80
    SolutionIndex: 22
    SolutionNameMin: Cijk_Alik_Bljk_HHS_BH_Bias_HAS_SAV_UserArgs_MT256x192x64_MI32x32x1_SN_GRVWA8_GRVWB8_GSU1_GSUC0_GSUWGMRR0_K1_LBSPPA512_LBSPPB128_LPA8_LPB8_LRVW8_MIWT4_3_SU0_SUM0_SUS0_SVW4_VWA4_VWB1_WG64_4_1_WGM1_WGMXCC1_WGMXCCG80
    SolutionIndex: 23
    SolutionNameMin: Cijk_Alik_Bljk_HHS_BH_Bias_HAS_SAV_UserArgs_MT256x192x64_MI16x16x1_SN_GRVWA8_GRVWB8_GSU1_GSUC0_GSUWGMRR0_K1_LBSPPA1024_LBSPPB256_LPA16_LPB16_LRVW8_MIWT8_6_SU0_SUM0_SUS0_SVW8_VWA8_VWB2_WG32_8_1_WGM1_WGMXCC1_WGMXCCG80
- - - [1280, 1920, 1, 1280]
    - [1, 90.81]
  - - [1280, 77, 1, 1280]
    - [16, 15.12]
  - - [1280, 32, 1, 2048]
    - [14, 10.75]
  - - [640, 7680, 1, 640]
    - [3, 88.12]
  - - [1280, 1920, 1, 5120]
    - [2, 108.64]
  - - [1280, 154, 1, 2048]
    - [6, 30.83]
  - - [5120, 77, 1, 1280]
    - [8, 38.28]
  - - [1280, 77, 1, 5120]
    - [10, 26.87]
  - - [1280, 186, 1, 2048]
    - [5, 35.87]
  - - [768, 77, 1, 768]
    - [18, 7.92]
  - - [640, 32, 1, 2048]
    - [13, 5.54]
  - - [3072, 77, 1, 768]
    - [7, 20.49]
  - - [768, 77, 1, 3072]
    - [17, 17.07]
  - - [1280, 2, 1, 1280]
    - [11, 0.53]
  - - [640, 7680, 1, 2560]
    - [2, 104.39]
  - - [5120, 7680, 1, 640]
    - [4, 106.64]
  - - [640, 154, 1, 2048]
    - [9, 18.99]
  - - [640, 186, 1, 2048]
    - [19, 22.66]
  - - [640, 2, 1, 1280]
    - [12, 0.26]
  - - [320, 2, 1, 1280]
    - [12, 0.14]
  - - [1280, 1, 1, 1280]
    - [12, 0.27]
  - - [1280, 2, 1, 320]
    - [0, 0.18]
  - - [1280, 2, 1, 2816]
    - [15, 0.91]
  - - [1280, 32, 1, 1280]
    - [11, 8.66]
  - - [2560, 34, 1, 1280]
    - [20, 13.35]
  - - [1280, 32, 1, 5120]
    - [21, 18.31]
  - - [5120, 32, 1, 1280]
    - [20, 25.1]
  - - [1280, 2, 1, 512]
    - [12, 0.27]
  - - [2048, 32, 1, 1280]
    - [18, 12.38]
  - - [10240, 1920, 1, 1280]
    - [22, 0.0]
  - - [512, 15360, 1, 512]
    - [23, 0.0]
- null
- null
- DeviceEfficiency
- Equality
