library/src/amd_detail/rocblaslt/src/Tensile/Logic/asm_full/aquavanjaram/gfx942_80cu/Equality/aquavanjaram_Cijk_Ailk_Bljk_BBS_BH_Bias_HAS_SAV_UserArgs.yaml
- {MinimumRequiredVersion: 4.33.0}
- aquavanjaram
- {Architecture: gfx942, CUCount: 80}
- [Device 0049, Device 0050]
    SolutionIndex: 0
    SolutionNameMin: Cijk_Ailk_Bljk_BBS_BH_Bias_HAS_SAV_UserArgs_MT256x224x64_MI16x16x1_SN_GRVWA8_GRVWB8_GSU5_GSUC0_GSUWGMRR0_K1_LBSPPA4096_LBSPPB256_LPA0_LPB16_LRVW8_MIWT4_14_NLCA1_SU0_SUM0_SUS0_SVW4_VWA4_VWB2_WG64_4_1_WGM1_WGMXCC1_WGMXCCG80
    SolutionIndex: 1
    SolutionNameMin: Cijk_Ailk_Bljk_BBS_BH_Bias_HAS_SAV_UserArgs_MT256x192x64_MI16x16x1_SN_GRVWA8_GRVWB8_GSU2_GSUC0_GSUWGMRR0_K1_LBSPPA4096_LBSPPB512_LPA0_LPB16_LRVW8_MIWT4_12_NLCA1_SU0_SUM0_SUS0_SVW4_VWA4_VWB4_WG64_4_1_WGM4_WGMXCC4_WGMXCCG80
    SolutionIndex: 2
    SolutionNameMin: Cijk_Ailk_Bljk_BBS_BH_Bias_HAS_SAV_UserArgs_MT128x224x64_MI16x16x1_SN_GRVWA8_GRVWB8_GSU5_GSUC0_GSUWGMRR0_K1_LBSPPA2048_LBSPPB128_LPA0_LPB16_LRVW8_MIWT4_7_NLCA1_SU0_SUM0_SUS0_SVW4_VWA4_VWB1_WG32_8_1_WGM4_WGMXCC4_WGMXCCG80
    SolutionIndex: 3
    SolutionNameMin: Cijk_Ailk_Bljk_BBS_BH_Bias_HAS_SAV_UserArgs_MT256x128x32_MI16x16x1_SN_CLR1_GRVWA8_GRVWB4_GSU1_GSUC0_GSUWGMRR0_K1_LBSPPA2048_LBSPPB512_LPA0_LPB4_LRVW4_MIWT4_8_NLCA1_PLR1_SU0_SUM0_SUS0_SVW4_VWA4_VWB8_WG64_4_1_WGM1_WGMXCC1_WGMXCCG80
    SolutionIndex: 4
    SolutionNameMin: Cijk_Ailk_Bljk_BBS_BH_Bias_HAS_SAV_UserArgs_MT128x64x128_MI16x16x1_SN_GRVWA8_GRVWB8_GSU1_GSUC0_GSUWGMRR0_K1_LBSPPA2048_LBSPPB512_LPA0_LPB16_LRVW8_MIWT4_2_NLCA1_SU0_SUM0_SUS0_SVW4_ULSGRO0_VWA4_VWB2_WSGRA1_WSGRB1_WG32_8_1_WGM1_WGMXCC1_WGMXCCG80
    SolutionIndex: 5
    SolutionNameMin: Cijk_Ailk_Bljk_BBS_BH_Bias_HAS_SAV_UserArgs_MT128x96x128_MI16x16x1_SN_GRVWA8_GRVWB8_GSU2_GSUC0_GSUWGMRR0_K1_LBSPPA2048_LBSPPB256_LPA0_LPB16_LRVW8_MIWT4_3_NLCA1_SU0_SUM0_SUS0_SVW4_ULSGRO0_VWA4_VWB1_WSGRA0_WSGRB0_WG32_8_1_WGM1_WGMXCC1_WGMXCCG80
    SolutionIndex: 6
    SolutionNameMin: Cijk_Ailk_Bljk_BBS_BH_Bias_HAS_SAV_UserArgs_MT128x256x64_MI16x16x1_SN_GRVWA8_GRVWB8_GSU1_GSUC0_GSUWGMRR0_K1_LBSPPA2048_LBSPPB1024_LPA0_LPB16_LRVW8_MIWT4_8_NLCA1_SU0_SUM0_SUS0_SVW4_ULSGRO0_VWA4_VWB8_WSGRA0_WSGRB1_WG32_8_1_WGM1_WGMXCC1_WGMXCCG80
    SolutionIndex: 7
    SolutionNameMin: Cijk_Ailk_Bljk_BBS_BH_Bias_HAS_SAV_UserArgs_MT256x64x64_MI16x16x1_SN_GRVWA8_GRVWB8_GSU1_GSUC0_GSUWGMRR0_K1_LBSPPA4096_LBSPPB512_LPA0_LPB16_LRVW8_MIWT4_4_NLCA1_SU0_SUM0_SUS0_SVW4_ULSGRO0_VWA4_VWB4_WSGRA0_WSGRB0_WG64_4_1_WGM1_WGMXCC1_WGMXCCG80
    SolutionIndex: 8
    SolutionNameMin: Cijk_Ailk_Bljk_BBS_BH_Bias_HAS_SAV_UserArgs_MT128x96x128_MI16x16x1_SN_GRVWA8_GRVWB8_GSU1_GSUC0_GSUWGMRR0_K1_LBSPPA2048_LBSPPB256_LPA0_LPB16_LRVW8_MIWT4_3_NLCA1_SU0_SUM0_SUS0_SVW4_ULSGRO0_VWA4_VWB1_WSGRA1_WSGRB0_WG32_8_1_WGM4_WGMXCC4_WGMXCCG80
    SolutionIndex: 9
    SolutionNameMin: Cijk_Ailk_Bljk_BBS_BH_Bias_HAS_SAV_UserArgs_MT256x240x64_MI16x16x1_SN_GRVWA8_GRVWB4_GSU1_GSUC0_GSUWGMRR0_K1_LBSPPA2048_LBSPPB128_LPA0_LPB4_LRVW4_MIWT4_15_NLCA1_SU0_SUM0_SUS0_SVW4_ULSGRO0_VWA4_VWB1_WSGRA0_WSGRB0_WG64_4_1_WGM1_WGMXCC1_WGMXCCG80
    SolutionIndex: 10
    SolutionNameMin: Cijk_Ailk_Bljk_BBS_BH_Bias_HAS_SAV_UserArgs_MT256x128x64_MI16x16x1_SN_GRVWA8_GRVWB8_GSU1_GSUC0_GSUWGMRR0_K1_LBSPPA4096_LBSPPB1024_LPA0_LPB16_LRVW8_MIWT4_8_NLCA1_SU0_SUM0_SUS0_SVW4_ULSGRO0_VWA4_VWB8_WSGRA0_WSGRB0_WG64_4_1_WGM1_WGMXCC1_WGMXCCG80
    SolutionIndex: 11
    SolutionNameMin: Cijk_Ailk_Bljk_BBS_BH_Bias_HAS_SAV_UserArgs_MT256x96x64_MI16x16x1_SN_GRVWA8_GRVWB8_GSU1_GSUC0_GSUWGMRR0_K1_LBSPPA4096_LBSPPB256_LPA0_LPB16_LRVW8_MIWT4_6_NLCA1_SU0_SUM0_SUS0_SVW4_ULSGRO0_VWA4_VWB2_WSGRA1_WSGRB0_WG64_4_1_WGM1_WGMXCC1_WGMXCCG80
    SolutionIndex: 12
    SolutionNameMin: Cijk_Ailk_Bljk_BBS_BH_Bias_HAS_UserArgs_MT16x32x64_MI16x16x1_SN_GRVWA8_GRVWB8_GSU1_GSUC0_GSUWGMRR0_K1_LBSPPA256_LBSPPB128_LPA16_LPB16_LRVW8_MIWT1_1_NLCA1_SU0_SUM0_SUS0_SVW1_VWA1_VWB1_WG16_8_1_WGM1_WGMXCC4_WGMXCCG80
    SolutionIndex: 13
    SolutionNameMin: Cijk_Ailk_Bljk_BBS_BH_Bias_HAS_UserArgs_MT128x160x32_MI16x16x1_SN_GRVWA8_GRVWB4_GSU1_GSUC0_GSUWGMRR0_K1_LBSPPA1024_LBSPPB128_LPA0_LPB4_LRVW4_MIWT4_5_NLCA1_SU4_SUM0_SUS256_SVW4_VWA4_VWB1_WG32_8_1_WGM1_WGMXCC4_WGMXCCG80
    SolutionIndex: 14
    SolutionNameMin: Cijk_Ailk_Bljk_BBS_BH_Bias_HAS_UserArgs_MT256x128x32_MI32x32x1_SN_GRVWA8_GRVWB8_GSU1_GSUC0_GSUWGMRR0_K1_LBSPPA0_LBSPPB128_LPA0_LPB8_LRVW8_MIWT2_2_NLCA1_SU4_SUM0_SUS256_SVW2_VWA2_VWB2_WG128_4_1_WGM1_WGMXCC4_WGMXCCG80
    SolutionIndex: 15
    SolutionNameMin: Cijk_Ailk_Bljk_BBS_BH_Bias_HAS_UserArgs_MT128x64x64_MI16x16x1_SN_GRVWA8_GRVWB8_GSU1_GSUC0_GSUWGMRR0_K1_LBSPPA2048_LBSPPB256_LPA0_LPB16_LRVW8_MIWT4_2_NLCA1_SU0_SUM0_SUS0_SVW4_VWA4_VWB2_WG32_8_1_WGM1_WGMXCC4_WGMXCCG80
    SolutionIndex: 16
    SolutionNameMin: Cijk_Ailk_Bljk_BBS_BH_Bias_HAS_UserArgs_MT16x16x64_MI16x16x1_SN_GRVWA8_GRVWB8_GSU1_GSUC0_GSUWGMRR0_K1_LBSPPA256_LBSPPB128_LPA16_LPB16_LRVW8_MIWT1_1_NLCA1_SU0_SUM0_SUS0_SVW1_VWA1_VWB1_WG16_4_1_WGM1_WGMXCC4_WGMXCCG80
    SolutionIndex: 17
    SolutionNameMin: Cijk_Ailk_Bljk_BBS_BH_Bias_HAS_UserArgs_MT16x16x32_MI16x16x1_SN_GRVWA8_GRVWB4_GSU1_GSUC0_GSUWGMRR0_K1_LBSPPA128_LBSPPB128_LPA16_LPB4_LRVW4_MIWT1_1_NLCA1_SU0_SUM0_SUS0_SVW1_VWA1_VWB1_WG16_4_1_WGM1_WGMXCC4_WGMXCCG80
    SolutionIndex: 18
    SolutionNameMin: Cijk_Ailk_Bljk_BBS_BH_Bias_HAS_UserArgs_MT256x128x32_MI32x32x1_SN_GRVWA8_GRVWB8_GSU1_GSUC0_GSUWGMRR0_K1_LBSPPA0_LBSPPB128_LPA0_LPB8_LRVW8_MIWT4_2_NLCA1_SU4_SUM0_SUS256_SVW4_VWA4_VWB2_WG64_4_1_WGM1_WGMXCC4_WGMXCCG80
    SolutionIndex: 19
    SolutionNameMin: Cijk_Ailk_Bljk_BBS_BH_Bias_HAS_UserArgs_MT128x64x64_MI16x16x1_SN_GRVWA8_GRVWB8_GSU1_GSUC0_GSUWGMRR0_K1_LBSPPA2048_LBSPPB256_LPA0_LPB16_LRVW8_MIWT4_2_NLCA1_SU4_SUM0_SUS256_SVW4_VWA4_VWB2_WG32_8_1_WGM1_WGMXCC4_WGMXCCG80
    SolutionIndex: 20
    SolutionNameMin: Cijk_Ailk_Bljk_BBS_BH_Bias_HAS_UserArgs_MT256x128x32_MI32x32x1_SN_GRVWA8_GRVWB8_GSU1_GSUC0_GSUWGMRR0_K1_LBSPPA0_LBSPPB128_LPA0_LPB8_LRVW8_MIWT2_2_NLCA1_SU0_SUM0_SUS0_SVW2_VWA2_VWB2_WG128_4_1_WGM1_WGMXCC4_WGMXCCG80
    SolutionIndex: 21
    SolutionNameMin: Cijk_Ailk_Bljk_BBS_BH_Bias_HAS_UserArgs_MT128x96x64_MI16x16x1_SN_GRVWA8_GRVWB8_GSU7_GSUC0_GSUWGMRR0_K1_LBSPPA2048_LBSPPB128_LPA0_LPB16_LRVW8_MIWT4_3_NLCA1_SU0_SUM0_SUS0_SVW4_VWA4_VWB1_WG32_8_1_WGM1_WGMXCC4_WGMXCCG80
    SolutionIndex: 22
    SolutionNameMin: Cijk_Ailk_Bljk_BBS_BH_Bias_HAS_UserArgs_MT32x32x64_MI16x16x1_SN_GRVWA8_GRVWB8_GSU1_GSUC0_GSUWGMRR0_K1_LBSPPA512_LBSPPB128_LPA32_LPB16_LRVW8_MIWT2_1_NLCA1_SU0_SUM0_SUS0_SVW2_VWA2_VWB1_WG16_8_1_WGM1_WGMXCC4_WGMXCCG80
    SolutionIndex: 23
    SolutionNameMin: Cijk_Ailk_Bljk_BBS_BH_Bias_HAS_UserArgs_MT256x128x32_MI16x16x1_SN_GRVWA8_GRVWB4_GSU1_GSUC0_GSUWGMRR0_K1_LBSPPA2048_LBSPPB256_LPA0_LPB4_LRVW4_MIWT4_4_NLCA1_SU0_SUM0_SUS0_SVW4_VWA4_VWB4_WG64_8_1_WGM1_WGMXCC4_WGMXCCG80
    SolutionIndex: 24
    SolutionNameMin: Cijk_Ailk_Bljk_BBS_BH_Bias_HAS_UserArgs_MT128x128x32_MI32x32x1_SN_GRVWA8_GRVWB8_GSU1_GSUC0_GSUWGMRR0_K1_LBSPPA0_LBSPPB128_LPA0_LPB8_LRVW8_MIWT2_1_NLCA1_SU0_SUM0_SUS0_SVW2_VWA2_VWB1_WG64_8_1_WGM1_WGMXCC4_WGMXCCG80
    SolutionIndex: 25
    SolutionNameMin: Cijk_Ailk_Bljk_BBS_BH_Bias_HAS_UserArgs_MT64x64x64_MI16x16x1_SN_GRVWA8_GRVWB8_GSU1_GSUC0_GSUWGMRR0_K1_LBSPPA1024_LBSPPB256_LPA32_LPB16_LRVW8_MIWT2_2_NLCA1_SU4_SUM0_SUS256_SVW2_VWA2_VWB2_WG32_8_1_WGM1_WGMXCC4_WGMXCCG80
    SolutionIndex: 26
    SolutionNameMin: Cijk_Ailk_Bljk_BBS_BH_Bias_HAS_UserArgs_MT32x16x64_MI16x16x1_SN_GRVWA8_GRVWB8_GSU1_GSUC0_GSUWGMRR0_K1_LBSPPA512_LBSPPB128_LPA16_LPB16_LRVW8_MIWT1_1_NLCA1_SU4_SUM0_SUS256_SVW1_VWA1_VWB1_WG32_4_1_WGM4_WGMXCC4_WGMXCCG80
    SolutionIndex: 27
    SolutionNameMin: Cijk_Ailk_Bljk_BBS_BH_Bias_HAS_UserArgs_MT32x16x32_MI16x16x1_SN_GRVWA8_GRVWB4_GSU1_GSUC0_GSUWGMRR0_K1_LBSPPA256_LBSPPB128_LPA16_LPB4_LRVW4_MIWT1_1_NLCA1_SU0_SUM0_SUS0_SVW1_VWA1_VWB1_WG32_4_1_WGM1_WGMXCC4_WGMXCCG80
    SolutionIndex: 28
    SolutionNameMin: Cijk_Ailk_Bljk_BBS_BH_Bias_HAS_UserArgs_MT32x32x32_MI16x16x1_SN_GRVWA4_GRVWB4_GSU1_GSUC0_GSUWGMRR0_K1_LBSPPA256_LBSPPB128_LPA16_LPB4_LRVW4_MIWT1_1_NLCA1_SU0_SUM0_SUS0_SVW1_VWA1_VWB1_WG32_8_1_WGM1_WGMXCC4_WGMXCCG80
    SolutionIndex: 29
    SolutionNameMin: Cijk_Ailk_Bljk_BBS_BH_Bias_HAS_UserArgs_MT64x32x128_MI16x16x1_SN_GRVWA8_GRVWB8_GSU1_GSUC0_GSUWGMRR0_K1_LBSPPA1024_LBSPPB256_LPA32_LPB16_LRVW8_MIWT2_1_NLCA1_SU4_SUM0_SUS256_SVW2_VWA2_VWB1_WG32_8_1_WGM1_WGMXCC4_WGMXCCG80
    SolutionIndex: 30
    SolutionNameMin: Cijk_Ailk_Bljk_BBS_BH_Bias_HAS_UserArgs_MT32x32x128_MI16x16x1_SN_GRVWA8_GRVWB8_GSU1_GSUC0_GSUWGMRR0_K1_LBSPPA512_LBSPPB256_LPA16_LPB16_LRVW8_MIWT1_1_NLCA1_SU0_SUM0_SUS0_SVW1_VWA1_VWB1_WG32_8_1_WGM1_WGMXCC4_WGMXCCG80
    SolutionIndex: 31
    SolutionNameMin: Cijk_Ailk_Bljk_BBS_BH_Bias_HAS_SAV_UserArgs_MT16x16x32_MI16x16x1_SN_GRVWA8_GRVWB4_GSU1_GSUC0_GSUWGMRR0_K1_LBSPPA128_LBSPPB128_LPA16_LPB4_LRVW4_MIWT1_1_NLCA1_SU0_SUM0_SUS0_SVW1_VWA1_VWB1_WG16_4_1_WGM1_WGMXCC4_WGMXCCG80
    SolutionIndex: 32
    SolutionNameMin: Cijk_Ailk_Bljk_BBS_BH_Bias_HAS_SAV_UserArgs_MT128x224x32_MI16x16x1_SN_GRVWA8_GRVWB4_GSU1_GSUC0_GSUWGMRR0_K1_LBSPPA1024_LBSPPB128_LPA0_LPB4_LRVW4_MIWT4_7_NLCA1_SU0_SUM0_SUS0_SVW4_VWA4_VWB1_WG32_8_1_WGM1_WGMXCC4_WGMXCCG80
    SolutionIndex: 33
    SolutionNameMin: Cijk_Ailk_Bljk_BBS_BH_Bias_HAS_SAV_UserArgs_MT32x16x64_MI16x16x1_SN_GRVWA8_GRVWB8_GSU1_GSUC0_GSUWGMRR0_K1_LBSPPA512_LBSPPB128_LPA16_LPB16_LRVW8_MIWT1_1_NLCA1_SU4_SUM0_SUS256_SVW1_VWA1_VWB1_WG32_4_1_WGM1_WGMXCC4_WGMXCCG80
- - - [128, 3584, 1, 37888]
    - [2, 111.5]
  - - [256, 3584, 1, 37888]
    - [0, 131.82]
  - - [500, 3584, 1, 37888]
    - [1, 122.22]
  - - [256, 3224984, 1, 256]
    - [3, 0.0]
  - - [128, 4608, 1, 3584]
    - [4, 0.0]
  - - [128, 3584, 1, 3584]
    - [5, 0.0]
  - - [128, 18944, 1, 3584]
    - [6, 0.0]
  - - [256, 4608, 1, 3584]
    - [7, 0.0]
  - - [256, 3584, 1, 3584]
    - [8, 0.0]
  - - [256, 18944, 1, 3584]
    - [9, 0.0]
  - - [500, 4608, 1, 3584]
    - [10, 0.0]
  - - [500, 3584, 1, 3584]
    - [11, 0.0]
  - - [500, 18944, 1, 3584]
    - [9, 0.0]
  - - [32, 512, 1, 128]
    - [12, 0.61]
  - - [128, 126976, 1, 512]
    - [13, 72.22]
  - - [1024, 126976, 1, 512]
    - [14, 103.51]
  - - [1024, 512, 1, 128]
    - [15, 12.49]
  - - [768, 512, 1, 320]
    - [15, 18.96]
  - - [64, 512, 1, 128]
    - [16, 1.2]
  - - [16, 512, 1, 32]
    - [31, 0.08]
  - - [128, 32768, 1, 256]
    - [32, 48.35]
  - - [128, 512, 1, 704]
    - [33, 7.74]
  - - [768, 16384, 1, 768]
    - [18, 103.31]
  - - [768, 512, 1, 256]
    - [19, 15.63]
  - - [32, 512, 1, 24]
    - [31, 0.11]
  - - [256, 61440, 1, 192]
    - [20, 66.7]
  - - [128, 1024, 1, 9775]
    - [21, 44.17]
  - - [128, 1024, 1, 128]
    - [22, 4.49]
  - - [256, 61440, 1, 104]
    - [20, 40.47]
  - - [256, 61440, 1, 88]
    - [23, 35.5]
  - - [9775, 1024, 1, 128]
    - [24, 38.35]
  - - [32, 1024, 1, 32]
    - [17, 0.32]
  - - [256, 1024, 1, 544]
    - [25, 17.87]
  - - [64, 1024, 1, 1216]
    - [26, 9.84]
  - - [64, 1024, 1, 128]
    - [16, 2.35]
  - - [48, 1024, 1, 176]
    - [27, 1.99]
  - - [36, 1024, 1, 60]
    - [28, 0.57]
  - - [128, 1024, 1, 512]
    - [29, 11.86]
  - - [64, 1024, 1, 1179]
    - [30, 8.95]
- null
- null
- DeviceEfficiency
- Equality
