library/src/amd_detail/rocblaslt/src/Tensile/Logic/asm_full/aquavanjaram/gfx942_80cu/Equality/aquavanjaram_Cijk_Alik_Bljk_SB_UserArgs.yaml
- {MinimumRequiredVersion: 4.33.0}
- aquavanjaram
- {Architecture: gfx942, CUCount: 80}
- [Device 0049, Device 0050]
    SolutionIndex: 0
    SolutionNameMin: Cijk_Alik_Bljk_SB_HAS_UserArgs_MT64x16x32_MI16x16x1_SN_GRVWA4_GRVWB2_GSU1_GSUC0_GSUWGMRR0_K1_LBSPPA128_LBSPPB128_LPA8_LPB8_LRVW4_MIWT1_1_SU0_SUM0_SUS0_SVW1_VWA1_VWB1_WG64_4_1_WGM8_WGMXCC4_WGMXCCG80
    SolutionIndex: 1
    SolutionNameMin: Cijk_Alik_Bljk_SB_HAS_UserArgs_MT48x32x32_MI16x16x1_SN_GRVWA4_GRVWB4_GSU1_GSUC0_GSUWGMRR0_K1_LBSPPA128_LBSPPB128_LPA8_LPB8_LRVW4_MIWT3_1_SU0_SUM0_SUS0_SVW1_VWA1_VWB1_WG16_8_1_WGM8_WGMXCC4_WGMXCCG80
    SolutionIndex: 2
    SolutionNameMin: Cijk_Alik_Bljk_SB_HAS_UserArgs_MT64x16x32_MI16x16x1_SN_GRVWA4_GRVWB4_GSU1_GSUC0_GSUWGMRR0_K1_LBSPPA256_LBSPPB128_LPA8_LPB8_LRVW4_MIWT2_1_SU0_SUM0_SUS0_SVW2_VWA2_VWB1_WG32_4_1_WGM8_WGMXCC4_WGMXCCG80
    SolutionIndex: 3
    SolutionNameMin: Cijk_Alik_Bljk_SB_HAS_UserArgs_MT32x64x64_MI16x16x1_SN_GRVWA4_GRVWB4_GSU1_GSUC0_GSUWGMRR0_K1_LBSPPA512_LBSPPB256_LPA8_LPB8_LRVW4_MIWT2_1_SU0_SUM0_SUS0_SVW2_VWA2_VWB1_WG16_16_1_WGM8_WGMXCC4_WGMXCCG80
    SolutionIndex: 4
    SolutionNameMin: Cijk_Alik_Bljk_SB_HAS_UserArgs_MT32x16x64_MI16x16x1_SN_GRVWA4_GRVWB4_GSU1_GSUC0_GSUWGMRR0_K1_LBSPPA256_LBSPPB256_LPA8_LPB8_LRVW4_MIWT1_1_SU0_SUM0_SUS0_SVW1_VWA1_VWB1_WG32_4_1_WGM8_WGMXCC4_WGMXCCG80
    SolutionIndex: 5
    SolutionNameMin: Cijk_Alik_Bljk_SB_HAS_UserArgs_MT256x208x32_MI16x16x1_SN_GRVWA2_GRVWB2_GSU1_GSUC0_GSUWGMRR0_K1_LBSPPA512_LBSPPB128_LPA2_LPB2_LRVW2_MIWT4_13_SU4_SUM0_SUS256_SVW4_VWA4_VWB1_WG64_4_1_WGM8_WGMXCC4_WGMXCCG80
    SolutionIndex: 6
    SolutionNameMin: Cijk_Alik_Bljk_SB_HAS_UserArgs_MT64x32x64_MI16x16x1_SN_GRVWA4_GRVWB4_GSU1_GSUC0_GSUWGMRR0_K1_LBSPPA256_LBSPPB512_LPA8_LPB8_LRVW4_MIWT1_2_SU0_SUM0_SUS0_SVW1_VWA1_VWB2_WG64_4_1_WGM8_WGMXCC4_WGMXCCG80
    SolutionIndex: 7
    SolutionNameMin: Cijk_Alik_Bljk_SB_HAS_UserArgs_MT32x32x64_MI16x16x1_SN_GRVWA4_GRVWB4_GSU1_GSUC0_GSUWGMRR0_K1_LBSPPA256_LBSPPB256_LPA8_LPB8_LRVW4_MIWT1_1_SU0_SUM0_SUS0_SVW1_VWA1_VWB1_WG32_8_1_WGM8_WGMXCC4_WGMXCCG80
    SolutionIndex: 8
    SolutionNameMin: Cijk_Alik_Bljk_SB_HAS_UserArgs_MT32x16x128_MI16x16x1_SN_GRVWA4_GRVWB4_GSU1_GSUC0_GSUWGMRR0_K1_LBSPPA512_LBSPPB512_LPA8_LPB8_LRVW4_MIWT1_1_SU0_SUM0_SUS0_SVW1_VWA1_VWB1_WG32_4_1_WGM8_WGMXCC4_WGMXCCG80
    SolutionIndex: 9
    SolutionNameMin: Cijk_Alik_Bljk_SB_HAS_UserArgs_MT64x64x32_MI16x16x1_SN_GRVWA4_GRVWB4_GSU1_GSUC0_GSUWGMRR0_K1_LBSPPA256_LBSPPB256_LPA8_LPB8_LRVW4_MIWT2_2_SU0_SUM0_SUS0_SVW2_VWA2_VWB2_WG32_8_1_WGM8_WGMXCC4_WGMXCCG80
    SolutionIndex: 10
    SolutionNameMin: Cijk_Alik_Bljk_SB_HAS_UserArgs_MT16x32x32_MI16x16x1_SN_GRVWA4_GRVWB4_GSU1_GSUC0_GSUWGMRR0_K1_LBSPPA128_LBSPPB128_LPA8_LPB8_LRVW4_MIWT1_1_SU0_SUM0_SUS0_SVW1_VWA1_VWB1_WG16_8_1_WGM8_WGMXCC4_WGMXCCG80
    SolutionIndex: 11
    SolutionNameMin: Cijk_Alik_Bljk_SB_HAS_UserArgs_MT32x32x32_MI16x16x1_SN_GRVWA4_GRVWB4_GSU1_GSUC0_GSUWGMRR0_K1_LBSPPA256_LBSPPB128_LPA8_LPB8_LRVW4_MIWT2_1_SU0_SUM0_SUS0_SVW2_VWA2_VWB1_WG16_8_1_WGM8_WGMXCC4_WGMXCCG80
    SolutionIndex: 12
    SolutionNameMin: Cijk_Alik_Bljk_SB_HAS_UserArgs_MT32x32x64_MI16x16x1_SN_GRVWA4_GRVWB4_GSU1_GSUC0_GSUWGMRR0_K1_LBSPPA512_LBSPPB256_LPA8_LPB8_LRVW4_MIWT2_1_SU0_SUM0_SUS0_SVW2_VWA2_VWB1_WG16_8_1_WGM8_WGMXCC4_WGMXCCG80
    SolutionIndex: 13
    SolutionNameMin: Cijk_Alik_Bljk_SB_HAS_UserArgs_MT32x32x32_MI16x16x1_SN_GRVWA4_GRVWB4_GSU1_GSUC0_GSUWGMRR0_K1_LBSPPA128_LBSPPB128_LPA8_LPB8_LRVW4_MIWT1_1_SU0_SUM0_SUS0_SVW1_VWA1_VWB1_WG32_8_1_WGM8_WGMXCC4_WGMXCCG80
    SolutionIndex: 14
    SolutionNameMin: Cijk_Alik_Bljk_SB_HAS_UserArgs_MT80x64x32_MI16x16x1_SN_GRVWA2_GRVWB4_GSU1_GSUC0_GSUWGMRR0_K1_LBSPPA128_LBSPPB128_LPA8_LPB8_LRVW4_MIWT5_1_SU0_SUM0_SUS0_SVW1_VWA1_VWB1_WG16_16_1_WGM8_WGMXCC4_WGMXCCG80
    SolutionIndex: 15
    SolutionNameMin: Cijk_Alik_Bljk_SB_HAS_UserArgs_MT64x32x64_MI16x16x1_SN_GRVWA4_GRVWB4_GSU1_GSUC0_GSUWGMRR0_K1_LBSPPA512_LBSPPB256_LPA8_LPB8_LRVW4_MIWT2_1_SU0_SUM0_SUS0_SVW2_VWA2_VWB1_WG32_8_1_WGM8_WGMXCC4_WGMXCCG80
    SolutionIndex: 16
    SolutionNameMin: Cijk_Alik_Bljk_SB_HAS_UserArgs_MT32x64x32_MI16x16x1_SN_GRVWA4_GRVWB4_GSU1_GSUC0_GSUWGMRR0_K1_LBSPPA256_LBSPPB128_LPA8_LPB8_LRVW4_MIWT2_1_SU0_SUM0_SUS0_SVW2_VWA2_VWB1_WG16_16_1_WGM8_WGMXCC4_WGMXCCG80
    SolutionIndex: 17
    SolutionNameMin: Cijk_Alik_Bljk_SB_HAS_UserArgs_MT16x16x32_MI16x16x1_SN_GRVWA4_GRVWB4_GSU1_GSUC0_GSUWGMRR0_K1_LBSPPA128_LBSPPB128_LPA8_LPB8_LRVW4_MIWT1_1_SU0_SUM0_SUS0_SVW1_VWA1_VWB1_WG16_4_1_WGM8_WGMXCC4_WGMXCCG80
    SolutionIndex: 18
    SolutionNameMin: Cijk_Alik_Bljk_SB_HAS_UserArgs_MT128x32x32_MI16x16x1_SN_GRVWA4_GRVWB4_GSU1_GSUC0_GSUWGMRR0_K1_LBSPPA256_LBSPPB256_LPA8_LPB8_LRVW4_MIWT2_2_SU0_SUM0_SUS0_SVW2_VWA2_VWB2_WG64_4_1_WGM8_WGMXCC4_WGMXCCG80
    SolutionIndex: 19
    SolutionNameMin: Cijk_Alik_Bljk_SB_HAS_UserArgs_MT160x32x32_MI16x16x1_SN_GRVWA4_GRVWB4_GSU1_GSUC0_GSUWGMRR0_K1_LBSPPA128_LBSPPB128_LPA8_LPB8_LRVW4_MIWT5_1_SU0_SUM0_SUS0_SVW1_VWA1_VWB1_WG32_8_1_WGM8_WGMXCC4_WGMXCCG80
    SolutionIndex: 20
    SolutionNameMin: Cijk_Alik_Bljk_SB_HAS_UserArgs_MT64x64x32_MI16x16x1_SN_GRVWA4_GRVWB4_GSU1_GSUC0_GSUWGMRR0_K1_LBSPPA512_LBSPPB128_LPA8_LPB8_LRVW4_MIWT4_1_SU4_SUM0_SUS256_SVW4_VWA4_VWB1_WG16_16_1_WGM8_WGMXCC4_WGMXCCG80
    SolutionIndex: 21
    SolutionNameMin: Cijk_Alik_Bljk_SB_HAS_UserArgs_MT96x32x32_MI16x16x1_SN_GRVWA4_GRVWB4_GSU1_GSUC0_GSUWGMRR0_K1_LBSPPA128_LBSPPB128_LPA8_LPB8_LRVW4_MIWT3_1_SU0_SUM0_SUS0_SVW1_VWA1_VWB1_WG32_8_1_WGM8_WGMXCC4_WGMXCCG80
    SolutionIndex: 22
    SolutionNameMin: Cijk_Alik_Bljk_SB_HAS_UserArgs_MT96x64x32_MI16x16x1_SN_GRVWA4_GRVWB4_GSU1_GSUC0_GSUWGMRR0_K1_LBSPPA256_LBSPPB128_LPA8_LPB8_LRVW4_MIWT6_1_SU0_SUM0_SUS0_SVW2_VWA2_VWB1_WG16_16_1_WGM8_WGMXCC4_WGMXCCG80
    SolutionIndex: 23
    SolutionNameMin: Cijk_Alik_Bljk_SB_HAS_UserArgs_MT32x16x64_MI16x16x1_SN_GRVWA4_GRVWB4_GSU1_GSUC0_GSUWGMRR0_K1_LBSPPA256_LBSPPB256_LPA8_LPB8_LRVW4_MIWT1_1_SU4_SUM0_SUS256_SVW1_VWA1_VWB1_WG32_4_1_WGM8_WGMXCC4_WGMXCCG80
    SolutionIndex: 24
    SolutionNameMin: Cijk_Alik_Bljk_SB_HAS_UserArgs_MT96x32x64_MI16x16x1_SN_GRVWA4_GRVWB4_GSU1_GSUC0_GSUWGMRR0_K1_LBSPPA256_LBSPPB256_LPA8_LPB8_LRVW4_MIWT3_1_SU0_SUM0_SUS0_SVW1_VWA1_VWB1_WG32_8_1_WGM8_WGMXCC4_WGMXCCG80
    SolutionIndex: 25
    SolutionNameMin: Cijk_Alik_Bljk_SB_HAS_UserArgs_MT128x208x32_MI16x16x1_SN_GRVWA4_GRVWB2_GSU1_GSUC0_GSUWGMRR0_K1_LBSPPA256_LBSPPB128_LPA8_LPB8_LRVW4_MIWT2_13_SU0_SUM0_SUS0_SVW2_VWA2_VWB1_WG64_4_1_WGM8_WGMXCC4_WGMXCCG80
    SolutionIndex: 26
    SolutionNameMin: Cijk_Alik_Bljk_SB_HAS_UserArgs_MT32x16x32_MI16x16x1_SN_GRVWA4_GRVWB4_GSU1_GSUC0_GSUWGMRR0_K1_LBSPPA128_LBSPPB128_LPA8_LPB8_LRVW4_MIWT1_1_SU0_SUM0_SUS0_SVW1_VWA1_VWB1_WG32_4_1_WGM8_WGMXCC4_WGMXCCG80
    SolutionIndex: 27
    SolutionNameMin: Cijk_Alik_Bljk_SB_HAS_UserArgs_MT32x32x64_MI16x16x1_SN_GRVWA4_GRVWB4_GSU1_GSUC0_GSUWGMRR0_K1_LBSPPA256_LBSPPB256_LPA8_LPB8_LRVW4_MIWT1_1_SU4_SUM0_SUS256_SVW1_VWA1_VWB1_WG32_8_1_WGM8_WGMXCC4_WGMXCCG80
    SolutionIndex: 28
    SolutionNameMin: Cijk_Alik_Bljk_SB_HAS_UserArgs_MT64x32x32_MI16x16x1_SN_GRVWA4_GRVWB4_GSU1_GSUC0_GSUWGMRR0_K1_LBSPPA256_LBSPPB128_LPA8_LPB8_LRVW4_MIWT2_1_SU0_SUM0_SUS0_SVW2_VWA2_VWB1_WG32_8_1_WGM8_WGMXCC4_WGMXCCG80
    SolutionIndex: 29
    SolutionNameMin: Cijk_Alik_Bljk_SB_HAS_UserArgs_MT16x32x64_MI16x16x1_SN_GRVWA4_GRVWB4_GSU1_GSUC0_GSUWGMRR0_K1_LBSPPA256_LBSPPB256_LPA8_LPB8_LRVW4_MIWT1_1_SU0_SUM0_SUS0_SVW1_VWA1_VWB1_WG16_8_1_WGM8_WGMXCC4_WGMXCCG80
    SolutionIndex: 30
    SolutionNameMin: Cijk_Alik_Bljk_SB_HAS_UserArgs_MT128x224x32_MI16x16x1_SN_GRVWA4_GRVWB2_GSU1_GSUC0_GSUWGMRR0_K1_LBSPPA256_LBSPPB128_LPA8_LPB8_LRVW4_MIWT2_7_SU0_SUM0_SUS0_SVW2_VWA2_VWB1_WG64_8_1_WGM8_WGMXCC4_WGMXCCG80
    SolutionIndex: 31
    SolutionNameMin: Cijk_Alik_Bljk_SB_HAS_UserArgs_MT96x16x32_MI16x16x1_SN_GRVWA4_GRVWB4_GSU1_GSUC0_GSUWGMRR0_K1_LBSPPA256_LBSPPB128_LPA8_LPB8_LRVW4_MIWT6_1_SU0_SUM0_SUS0_SVW2_VWA2_VWB1_WG16_4_1_WGM8_WGMXCC4_WGMXCCG80
    SolutionIndex: 32
    SolutionNameMin: Cijk_Alik_Bljk_SB_HAS_UserArgs_MT32x32x32_MI16x16x1_SN_GRVWA4_GRVWB4_GSU1_GSUC0_GSUWGMRR0_K1_LBSPPA256_LBSPPB256_LPA8_LPB8_LRVW4_MIWT2_2_SU0_SUM0_SUS0_SVW2_VWA2_VWB2_WG16_4_1_WGM8_WGMXCC4_WGMXCCG80
    SolutionIndex: 33
    SolutionNameMin: Cijk_Alik_Bljk_SB_HAS_UserArgs_MT16x32x128_MI16x16x1_SN_GRVWA4_GRVWB4_GSU1_GSUC0_GSUWGMRR0_K1_LBSPPA512_LBSPPB512_LPA8_LPB8_LRVW4_MIWT1_1_SU0_SUM0_SUS0_SVW1_VWA1_VWB1_WG16_8_1_WGM8_WGMXCC4_WGMXCCG80
    SolutionIndex: 34
    SolutionNameMin: Cijk_Alik_Bljk_SB_HAS_UserArgs_MT96x16x64_MI16x16x1_SN_GRVWA4_GRVWB4_GSU1_GSUC0_GSUWGMRR0_K1_LBSPPA256_LBSPPB256_LPA8_LPB8_LRVW4_MIWT3_1_SU4_SUM0_SUS256_SVW1_VWA1_VWB1_WG32_4_1_WGM8_WGMXCC4_WGMXCCG80
    SolutionIndex: 35
    SolutionNameMin: Cijk_Alik_Bljk_SB_HAS_UserArgs_MT32x16x32_MI16x16x1_SN_GRVWA4_GRVWB4_GSU1_GSUC0_GSUWGMRR0_K1_LBSPPA256_LBSPPB128_LPA8_LPB8_LRVW4_MIWT2_1_SU0_SUM0_SUS0_SVW2_VWA2_VWB1_WG16_4_1_WGM8_WGMXCC4_WGMXCCG80
    SolutionIndex: 36
    SolutionNameMin: Cijk_Alik_Bljk_SB_HAS_UserArgs_MT64x64x32_MI16x16x1_SN_GRVWA4_GRVWB4_GSU1_GSUC0_GSUWGMRR0_K1_LBSPPA512_LBSPPB128_LPA8_LPB8_LRVW4_MIWT4_1_SU0_SUM0_SUS0_SVW4_VWA4_VWB1_WG16_16_1_WGM8_WGMXCC4_WGMXCCG80
    SolutionIndex: 37
    SolutionNameMin: Cijk_Alik_Bljk_SB_HAS_UserArgs_MT32x80x32_MI16x16x1_SN_GRVWA4_GRVWB4_GSU1_GSUC0_GSUWGMRR0_K1_LBSPPA128_LBSPPB128_LPA8_LPB8_LRVW4_MIWT1_5_SU0_SUM0_SUS0_SVW1_VWA1_VWB1_WG32_4_1_WGM8_WGMXCC4_WGMXCCG80
    SolutionIndex: 38
    SolutionNameMin: Cijk_Alik_Bljk_SB_HAS_UserArgs_MT128x16x32_MI16x16x1_SN_GRVWA4_GRVWB4_GSU1_GSUC0_GSUWGMRR0_K1_LBSPPA512_LBSPPB128_LPA8_LPB8_LRVW4_MIWT4_1_SU0_SUM0_SUS0_SVW4_VWA4_VWB1_WG32_4_1_WGM8_WGMXCC4_WGMXCCG80
    SolutionIndex: 39
    SolutionNameMin: Cijk_Alik_Bljk_SB_HAS_UserArgs_MT128x48x32_MI16x16x1_SN_GRVWA4_GRVWB2_GSU1_GSUC0_GSUWGMRR0_K1_LBSPPA256_LBSPPB128_LPA8_LPB8_LRVW4_MIWT2_3_SU0_SUM0_SUS0_SVW2_VWA2_VWB1_WG64_4_1_WGM8_WGMXCC4_WGMXCCG80
    SolutionIndex: 40
    SolutionNameMin: Cijk_Alik_Bljk_SB_HAS_UserArgs_MT96x32x32_MI16x16x1_SN_GRVWA4_GRVWB4_GSU1_GSUC0_GSUWGMRR0_K1_LBSPPA128_LBSPPB128_LPA8_LPB8_LRVW4_MIWT3_1_SU4_SUM0_SUS256_SVW1_VWA1_VWB1_WG32_8_1_WGM8_WGMXCC4_WGMXCCG80
    SolutionIndex: 41
    SolutionNameMin: Cijk_Alik_Bljk_SB_UserArgs_MT32x32x64_MI16x16x1_SN_GRVWA4_GRVWB4_GSU1_LBSPPA256_LBSPPB256_LPA8_LPB8_LRVW4_MIWT1_1_SU8_SUM0_SUS256_SVW1_VWA1_WG32_8_1_WGM0
    SolutionIndex: 42
    SolutionNameMin: Cijk_Alik_Bljk_SB_UserArgs_MT64x64x64_MI16x16x1_SN_GRVWA4_GRVWB4_GSU1_LBSPPA512_LBSPPB256_LPA8_LPB8_LRVW4_MIWT2_2_SU8_SUM0_SUS256_SVW2_VWA2_WG32_8_1_WGM8
    SolutionIndex: 43
    SolutionNameMin: Cijk_Alik_Bljk_SB_Bias_HAS_SAV_UserArgs_MT32x32x16_MI16x16x1_SN_GRPM1_GRVWA2_GRVWB2_GSU1_GSUC0_GSUWGMRR0_K1_LBSPPB128_LPA2_LPB2_LRVW2_LWPM0p50_MIWT1_1_SU4_SUM0_SUS256_VWB1_WG32_8_1_WGM0_WGMXCC16_WGMXCCG0
    SolutionIndex: 44
    SolutionNameMin: Cijk_Alik_Bljk_SB_Bias_HAS_SAV_UserArgs_MT32x32x16_MI16x16x1_SN_GRPM0p50_GRVWA2_GRVWB2_GSU1_GSUC0_GSUWGMRR0_K1_LBSPPA128_LBSPPB128_LPA2_LPB2_LRVW2_LWPM0p50_MIWT1_1_SU4_SUM0_SUS256_SVW1_VWA1_VWB1_WG32_8_1_WGM0_WGMXCC16_WGMXCCG0
    SolutionIndex: 45
    SolutionNameMin: Cijk_Alik_Bljk_SB_SAV_MT208x64x16_MI16x16x4x1_SN_1LDSB1_GRVW1_GSU1_LPA2_LPB2_LRVW2_NEPBS2_PLR5_SPO1_TT13_16_WG16_16_1
    SolutionIndex: 46
    SolutionNameMin: Cijk_Alik_Bljk_SB_UserArgs_MT16x128x16_MI16x16x1_SN_GRPM1_GRVWB1_GSU1_GSUC0_GSUWGMRR0_K1_LRVW1_LWPM0p26_MIWT1_2_SU4_SUM0_SUS256_SK0_WGM1_WGMXCC1_WGMXCCG8
    SolutionIndex: 47
    SolutionNameMin: Cijk_Alik_Bljk_SB_SAV_MT96x32x32_MI16x16x4x1_SN_1LDSB1_GRVW4_GSU1_LPA8_LPB8_LRVW4_NEPBS2_PLR9_SPO1_TT3_16_WG32_8_1
    SolutionIndex: 48
    SolutionNameMin: Cijk_Alik_Bljk_SB_SAV_MT176x64x16_MI16x16x4x1_SN_1LDSB0_GRVW1_GSU1_LPA2_LPB2_LRVW2_NEPBS2_PLR5_SPO1_TT11_16_WG16_16_1
    SolutionIndex: 49
    SolutionNameMin: Cijk_Alik_Bljk_SB_SAV_MT128x16x16_MI16x16x4x1_SN_1LDSB0_GRVW1_GSU1_LPA2_LPB2_LRVW2_NEPBS2_PLR5_SPO1_TT2_16_WG64_4_1
    SolutionIndex: 50
    SolutionNameMin: Cijk_Alik_Bljk_SB_SAV_MT128x256x16_MI32x32x2x1_SN_1LDSB1_GRVW4_GSU1_LPA4_LPB4_LRVW4_NEPBS2_PLR9_SPO1_TT2_128_WG64_4_1
    SolutionIndex: 51
    SolutionNameMin: Cijk_Alik_Bljk_SB_SAV_MT256x16x16_MI16x16x4x1_SN_1LDSB1_GRVW1_GSU1_LPA2_LPB2_LRVW2_NEPBS2_PLR5_SPO1_TT4_16_WG64_4_1
    SolutionIndex: 52
    SolutionNameMin: Cijk_Alik_Bljk_SB_SAV_MT128x144x16_MI16x16x4x1_SN_1LDSB1_GRVW1_GSU1_LPA2_LPB2_LRVW2_NEPBS2_PLR5_SPO1_TT2_144_WG64_4_1
    SolutionIndex: 53
    SolutionNameMin: Cijk_Alik_Bljk_SB_SAV_MT256x128x16_MI32x32x2x1_SN_1LDSB1_GRVW4_GSU1_LPA4_LPB4_LRVW4_NEPBS2_PLR9_SPO1_TT4_64_WG64_4_1
    SolutionIndex: 54
    SolutionNameMin: Cijk_Alik_Bljk_SB_SAV_MT32x64x32_MI16x16x4x1_SN_1LDSB0_GRVW4_GSU5_LPA8_LPB8_LRVW4_PLR9_TT2_16_WG16_16_1
    SolutionIndex: 55
    SolutionNameMin: Cijk_Alik_Bljk_SB_SAV_MT32x160x16_MI16x16x4x1_SN_1LDSB0_GRVW2_GSU1_LPA2_LPB2_LRVW2_NEPBS2_PLR5_SPO1_TT1_80_WG32_8_1
    SolutionIndex: 56
    SolutionNameMin: Cijk_Alik_Bljk_SB_SAV_MT48x128x16_MI16x16x4x1_SN_1LDSB0_GRVW1_GSU1_LPA2_LPB2_LRVW2_NEPBS2_PLR5_SPO1_TT3_32_WG16_16_1
- - - [256, 1, 13, 1]
    - [0, 1.36955]
  - - [444, 512, 1, 444]
    - [1, 12940.2]
  - - [256, 1, 43, 1]
    - [2, 3.64503]
  - - [1128, 81, 1, 512]
    - [3, 7989.82]
  - - [256, 1, 16, 1]
    - [0, 1.67869]
  - - [512, 27, 1, 256]
    - [4, 1114.63]
  - - [512, 74, 1, 256]
    - [4, 3002.89]
  - - [256, 16384, 1, 128]
    - [5, 18408.1]
  - - [272, 512, 1, 768]
    - [6, 14279.7]
  - - [512, 101, 1, 256]
    - [7, 4023.79]
  - - [256, 1, 14, 1]
    - [0, 1.42789]
  - - [1128, 27, 1, 512]
    - [8, 3739.44]
  - - [1128, 227, 1, 512]
    - [9, 14296.7]
  - - [16, 35, 1, 1]
    - [10, 0.253968]
  - - [1302, 35, 1, 32]
    - [0, 621.851]
  - - [512, 227, 1, 256]
    - [11, 7292.49]
  - - [512, 251, 1, 256]
    - [12, 7927.49]
  - - [512, 92, 1, 256]
    - [7, 3659.67]
  - - [512, 512, 1, 64]
    - [11, 5251.08]
  - - [1128, 44, 1, 512]
    - [7, 5801.73]
  - - [1128, 73, 1, 512]
    - [3, 7225.39]
  - - [1302, 20, 1, 32]
    - [10, 353.085]
  - - [256, 227, 1, 1]
    - [13, 23.2448]
  - - [256, 256, 1, 1]
    - [11, 26.3197]
  - - [16, 24, 1, 1]
    - [10, 0.169163]
  - - [256, 1, 83, 1]
    - [2, 6.00226]
  - - [740, 512, 1, 540]
    - [14, 16034.1]
  - - [1128, 43, 1, 512]
    - [7, 5656.96]
  - - [1128, 13, 1, 512]
    - [8, 1815.71]
  - - [320, 512, 1, 768]
    - [15, 17096.3]
  - - [1236, 512, 1, 128]
    - [9, 12461.9]
  - - [1128, 65, 1, 512]
    - [15, 6461.25]
  - - [1128, 74, 1, 512]
    - [3, 7299.34]
  - - [32, 64, 512, 32]
    - [16, 5049.58]
  - - [256, 1, 23, 1]
    - [2, 2.11039]
  - - [16, 22, 1, 1]
    - [17, 0.157848]
  - - [1168, 512, 1, 256]
    - [18, 16373.5]
  - - [512, 47, 1, 256]
    - [4, 1928.13]
  - - [704, 512, 1, 128]
    - [19, 8915.43]
  - - [776, 512, 1, 256]
    - [14, 14097.3]
  - - [1888, 512, 1, 256]
    - [9, 19175.8]
  - - [1792, 512, 1, 128]
    - [20, 14661.7]
  - - [896, 512, 1, 128]
    - [21, 11206.2]
  - - [444, 512, 1, 128]
    - [1, 7366.58]
  - - [1144, 512, 1, 512]
    - [9, 19354.2]
  - - [256, 1, 31, 1]
    - [2, 2.85982]
  - - [1824, 512, 1, 256]
    - [22, 19133.7]
  - - [1128, 72, 1, 512]
    - [3, 7114.22]
  - - [540, 512, 1, 256]
    - [6, 11875.7]
  - - [256, 1, 19, 1]
    - [0, 1.98937]
  - - [512, 73, 1, 256]
    - [23, 2944.08]
  - - [1128, 190, 1, 512]
    - [24, 14068.2]
  - - [256, 1, 81, 1]
    - [2, 5.87422]
  - - [128, 16384, 1, 256]
    - [25, 20363.0]
  - - [256, 1, 92, 1]
    - [2, 6.46145]
  - - [1128, 101, 1, 512]
    - [6, 9878.26]
  - - [256, 1, 51, 1]
    - [2, 4.16459]
  - - [352, 512, 1, 352]
    - [1, 10734.2]
  - - [256, 1, 48, 1]
    - [2, 3.91338]
  - - [256, 1, 49, 1]
    - [2, 4.13311]
  - - [20, 512, 1, 32]
    - [26, 145.636]
  - - [512, 83, 1, 256]
    - [27, 3266.96]
  - - [1128, 51, 1, 512]
    - [7, 6709.42]
  - - [416, 512, 1, 128]
    - [21, 7017.5]
  - - [896, 512, 1, 256]
    - [28, 15321.7]
  - - [512, 23, 1, 256]
    - [29, 937.685]
  - - [512, 93, 1, 256]
    - [7, 3677.13]
  - - [512, 13, 1, 256]
    - [23, 536.673]
  - - [512, 51, 1, 256]
    - [23, 2108.73]
  - - [512, 86, 1, 256]
    - [7, 3426.2]
  - - [416, 512, 1, 64]
    - [16, 4273.19]
  - - [256, 1, 47, 1]
    - [2, 3.91285]
  - - [1128, 96, 1, 512]
    - [6, 9485.62]
  - - [1128, 62, 1, 512]
    - [7, 8010.57]
  - - [1128, 251, 1, 512]
    - [9, 15731.0]
  - - [64, 512, 1, 160]
    - [10, 1801.68]
  - - [128, 512, 1, 32]
    - [0, 948.938]
  - - [1128, 83, 1, 512]
    - [3, 8194.1]
  - - [512, 50, 1, 256]
    - [4, 2060.88]
  - - [256, 1, 57, 1]
    - [2, 4.63238]
  - - [512, 43, 1, 256]
    - [29, 1744.92]
  - - [1302, 23, 1, 32]
    - [10, 409.518]
  - - [32, 512, 1, 3]
    - [10, 21.1862]
  - - [256, 1, 93, 1]
    - [2, 6.47837]
  - - [1128, 57, 1, 512]
    - [7, 7397.65]
  - - [1128, 47, 1, 512]
    - [7, 6148.17]
  - - [1302, 17, 1, 32]
    - [17, 303.986]
  - - [1128, 49, 1, 512]
    - [7, 6366.54]
  - - [512, 31, 1, 256]
    - [4, 1244.48]
  - - [352, 512, 1, 128]
    - [1, 5892.38]
  - - [512, 15, 1, 256]
    - [29, 609.637]
  - - [704, 512, 1, 64]
    - [21, 5810.75]
  - - [256, 512, 1, 768]
    - [12, 13836.9]
  - - [512, 76, 1, 256]
    - [23, 3084.05]
  - - [16, 17, 1, 1]
    - [17, 0.123918]
  - - [128, 16384, 1, 32]
    - [30, 8393.85]
  - - [1128, 85, 1, 512]
    - [3, 8384.38]
  - - [512, 62, 1, 256]
    - [29, 2496.61]
  - - [1128, 235, 1, 512]
    - [9, 14776.4]
  - - [32, 512, 1, 32]
    - [13, 242.726]
  - - [1128, 125, 1, 512]
    - [3, 12204.9]
  - - [512, 49, 1, 256]
    - [4, 2045.39]
  - - [1302, 24, 1, 32]
    - [10, 429.157]
  - - [512, 235, 1, 256]
    - [11, 7476.19]
  - - [1128, 76, 1, 512]
    - [3, 7503.03]
  - - [512, 65, 1, 256]
    - [23, 2637.67]
  - - [82, 16, 512, 16]
    - [31, 1065.73]
  - - [1302, 22, 1, 32]
    - [26, 385.129]
  - - [1128, 98, 1, 512]
    - [12, 9609.26]
  - - [1128, 86, 1, 512]
    - [3, 8475.78]
  - - [32, 32, 512, 32]
    - [32, 4522.16]
  - - [256, 1, 15, 1]
    - [0, 1.57377]
  - - [256, 1, 98, 1]
    - [2, 7.06704]
  - - [16, 23, 1, 1]
    - [26, 0.162115]
  - - [256, 101, 1, 1]
    - [10, 10.7509]
  - - [16, 20, 1, 1]
    - [10, 0.140659]
  - - [256, 1, 85, 1]
    - [2, 6.12958]
  - - [512, 98, 1, 256]
    - [27, 3892.44]
  - - [512, 19, 1, 256]
    - [4, 790.593]
  - - [1128, 14, 1, 512]
    - [33, 1925.12]
  - - [512, 125, 1, 256]
    - [7, 4957.34]
  - - [16, 512, 1, 8]
    - [10, 27.9471]
  - - [1128, 50, 1, 512]
    - [7, 6503.78]
  - - [1128, 31, 1, 512]
    - [8, 4283.16]
  - - [1128, 203, 1, 512]
    - [34, 14245.4]
  - - [256, 1, 27, 1]
    - [35, 2.54586]
  - - [2968, 512, 1, 256]
    - [36, 19074.4]
  - - [1128, 15, 1, 512]
    - [8, 2097.59]
  - - [1128, 23, 1, 512]
    - [8, 3200.8]
  - - [1128, 19, 1, 512]
    - [8, 2656.95]
  - - [64, 512, 1, 32]
    - [0, 483.215]
  - - [512, 190, 1, 256]
    - [12, 6029.95]
  - - [512, 81, 1, 256]
    - [7, 3231.91]
  - - [512, 14, 1, 256]
    - [4, 578.867]
  - - [256, 1, 44, 1]
    - [2, 3.73599]
  - - [800, 512, 1, 128]
    - [14, 10667.1]
  - - [32, 80, 512, 32]
    - [37, 4301.85]
  - - [512, 85, 1, 256]
    - [7, 3391.51]
  - - [256, 1, 101, 1]
    - [38, 6.9319]
  - - [256, 1, 96, 1]
    - [2, 6.77025]
  - - [512, 44, 1, 256]
    - [4, 1805.06]
  - - [64, 512, 1, 768]
    - [33, 5210.32]
  - - [256, 203, 1, 1]
    - [0, 20.7044]
  - - [2668, 512, 1, 640]
    - [39, 22161.0]
  - - [704, 512, 1, 160]
    - [19, 10234.5]
  - - [1128, 92, 1, 512]
    - [3, 9043.97]
  - - [416, 512, 1, 160]
    - [40, 8085.11]
  - - [256, 1, 86, 1]
    - [2, 6.13259]
  - - [512, 203, 1, 256]
    - [3, 6434.73]
  - - [1128, 93, 1, 512]
    - [3, 9150.06]
  - - [256, 1, 50, 1]
    - [35, 4.21746]
  - - [512, 57, 1, 256]
    - [4, 2334.72]
  - - [288, 512, 1, 256]
    - [3, 9355.32]
  - - [64, 512, 1, 128]
    - [41, 1792.44]
  - - [512, 96, 1, 256]
    - [41, 4361.49]
  - - [1128, 16, 1, 512]
    - [41, 2301.51]
  - - [32, 512, 1, 64]
    - [41, 500.514]
  - - [128, 512, 1, 256]
    - [41, 5509.76]
  - - [128, 512, 1, 128]
    - [41, 3509.88]
  - - [640, 512, 1, 768]
    - [42, 21638.7]
  - - [32, 32, 1, 64]
    - [41, 33.267]
  - - [512, 16, 1, 256]
    - [41, 710.899]
  - - [1128, 256, 1, 512]
    - [42, 16926.1]
  - - [48, 512, 1, 128]
    - [41, 1289.23]
  - - [512, 48, 1, 256]
    - [41, 2129.09]
  - - [320, 512, 1, 128]
    - [41, 6932.73]
  - - [192, 512, 1, 128]
    - [41, 4316.61]
  - - [256, 512, 1, 128]
    - [41, 5611.11]
  - - [128, 512, 1, 1024]
    - [41, 10929.8]
  - - [128, 512, 1, 768]
    - [41, 10116.9]
  - - [16, 512, 1, 128]
    - [41, 421.115]
  - - [128, 512, 1, 64]
    - [41, 1928.42]
  - - [512, 512, 1, 768]
    - [42, 17438.4]
  - - [256, 512, 1, 256]
    - [41, 8581.7]
  - - [512, 256, 1, 256]
    - [41, 8659.21]
  - - [64, 512, 1, 256]
    - [41, 2917.78]
  - - [160, 512, 1, 128]
    - [41, 4306.27]
  - - [256, 512, 1, 64]
    - [41, 3328.81]
  - - [512, 72, 1, 256]
    - [41, 3161.54]
  - - [112, 512, 1, 128]
    - [41, 2977.7]
  - - [1128, 48, 1, 512]
    - [41, 6624.07]
  - - [80, 512, 1, 128]
    - [41, 2109.81]
  - - [32, 23, 1, 16]
    - [43, 5.02175]
  - - [256, 235, 1, 1]
    - [43, 24.1122]
  - - [32, 17, 1, 16]
    - [43, 3.62667]
  - - [32, 35, 1, 16]
    - [43, 7.96444]
  - - [256, 190, 1, 1]
    - [43, 19.5341]
  - - [32, 20, 1, 16]
    - [43, 4.15416]
  - - [32, 512, 1, 16]
    - [43, 119.156]
  - - [32, 24, 1, 16]
    - [44, 5.03607]
  - - [32, 22, 1, 16]
    - [43, 4.72285]
  - - [256, 251, 1, 1]
    - [43, 25.8575]
  - - [5897, 512, 1, 540]
    - [45, 23203.6]
  - - [16, 82, 512, 16]
    - [46, 1840.39]
  - - [1312, 512, 1, 256]
    - [47, 15871.4]
  - - [16, 512, 1, 1]
    - [46, 3.34367]
  - - [3384, 512, 1, 256]
    - [48, 19089.6]
  - - [256, 1, 76, 1]
    - [49, 6.06106]
  - - [256, 1, 62, 1]
    - [49, 4.90634]
  - - [128, 40960, 1, 256]
    - [50, 23055.5]
  - - [256, 1, 125, 1]
    - [51, 8.07062]
  - - [256, 32768, 1, 128]
    - [52, 19150.0]
  - - [128, 32768, 1, 32]
    - [52, 9471.96]
  - - [256, 1, 72, 1]
    - [49, 5.74206]
  - - [128, 32768, 1, 256]
    - [52, 21558.9]
  - - [256, 1, 65, 1]
    - [49, 5.20814]
  - - [5897, 512, 1, 1520]
    - [45, 25582.0]
  - - [256, 40960, 1, 128]
    - [53, 20139.2]
  - - [256, 1, 73, 1]
    - [49, 5.70626]
  - - [64, 512, 1, 1312]
    - [54, 6378.58]
  - - [82, 8192, 1, 16]
    - [55, 2328.91]
  - - [1792, 512, 1, 257]
    - [56, 16711.4]
  - - [1293, 512, 1, 768]
    - [47, 20672.0]
  - - [256, 1, 74, 1]
    - [49, 5.86502]
  - - [128, 40960, 1, 32]
    - [50, 10915.6]
- null
- null
- DeviceEfficiency
- Equality
