library/src/amd_detail/rocblaslt/src/Tensile/Logic/asm_full/aquavanjaram/gfx942_80cu/Equality/aquavanjaram_Cijk_Ailk_Bjlk_SB_UserArgs.yaml
- {MinimumRequiredVersion: 4.33.0}
- aquavanjaram
- {Architecture: gfx942, CUCount: 80}
- [Device 0049, Device 0050]
    SolutionIndex: 0
    SolutionNameMin: Cijk_Ailk_Bjlk_SB_HAS_UserArgs_MT64x32x32_MI16x16x1_SN_GRVWA4_GRVWB4_GSU1_GSUC0_GSUWGMRR0_K1_LBSPPA256_LBSPPB128_LPA0_LPB16_MIWT2_1_NLCA1_NLCB1_SU4_SUM0_SUS256_SVW2_VWA2_VWB1_WG32_8_1_WGM8_WGMXCC4_WGMXCCG80
    SolutionIndex: 1
    SolutionNameMin: Cijk_Ailk_Bjlk_SB_HAS_UserArgs_MT64x32x64_MI16x16x1_SN_GRVWA4_GRVWB4_GSU1_GSUC0_GSUWGMRR0_K1_LBSPPA256_LBSPPB128_LPA0_LPB16_MIWT2_1_NLCA1_NLCB1_SU0_SUM0_SUS0_SVW2_VWA2_VWB1_WG32_8_1_WGM8_WGMXCC4_WGMXCCG80
    SolutionIndex: 2
    SolutionNameMin: Cijk_Ailk_Bjlk_SB_HAS_UserArgs_MT64x48x64_MI16x16x1_SN_GRVWA4_GRVWB4_GSU1_GSUC0_GSUWGMRR0_K1_LBSPPA256_LBSPPB192_LPA16_LPB0_MIWT1_3_NLCA1_NLCB3_SU0_SUM0_SUS0_SVW1_VWA1_VWB1_WG64_4_1_WGM8_WGMXCC4_WGMXCCG80
    SolutionIndex: 3
    SolutionNameMin: Cijk_Ailk_Bjlk_SB_HAS_UserArgs_MT32x16x64_MI16x16x1_SN_GRVWA4_GRVWB4_GSU8_GSUC0_GSUWGMRR0_K1_LBSPPA128_LBSPPB64_LPA16_LPB0_MIWT1_1_NLCA1_NLCB1_SU0_SUM0_SUS0_SVW1_VWA1_VWB1_WG32_4_1_WGM8_WGMXCC4_WGMXCCG80
    SolutionIndex: 4
    SolutionNameMin: Cijk_Ailk_Bjlk_SB_HAS_UserArgs_MT64x64x32_MI16x16x1_SN_GRVWA4_GRVWB4_GSU1_GSUC0_GSUWGMRR0_K1_LBSPPA256_LBSPPB256_LPA0_LPB16_MIWT4_1_NLCA1_NLCB1_SU0_SUM0_SUS0_SVW4_VWA4_VWB1_WG16_16_1_WGM8_WGMXCC4_WGMXCCG80
    SolutionIndex: 5
    SolutionNameMin: Cijk_Ailk_Bjlk_SB_HAS_UserArgs_MT32x64x64_MI16x16x1_SN_GRVWA4_GRVWB4_GSU1_GSUC0_GSUWGMRR0_K1_LBSPPA128_LBSPPB256_LPA0_LPB16_MIWT2_1_NLCA1_NLCB1_SU0_SUM0_SUS0_SVW2_VWA2_VWB1_WG16_16_1_WGM8_WGMXCC4_WGMXCCG80
    SolutionIndex: 6
    SolutionNameMin: Cijk_Ailk_Bjlk_SB_HAS_UserArgs_MT64x96x32_MI16x16x1_SN_GRVWA4_GRVWB4_GSU1_GSUC0_GSUWGMRR0_K1_LBSPPA256_LBSPPB384_LPA0_LPB16_MIWT2_3_NLCA1_NLCB3_SU0_SUM0_SUS0_SVW2_VWA2_VWB1_WG32_8_1_WGM8_WGMXCC4_WGMXCCG80
    SolutionIndex: 7
    SolutionNameMin: Cijk_Ailk_Bjlk_SB_HAS_UserArgs_MT128x112x32_MI16x16x1_SN_GRVWA4_GRVWB2_GSU1_GSUC0_GSUWGMRR0_K1_LBSPPA512_LBSPPB448_LPA0_LPB0_MIWT2_7_NLCA1_NLCB7_SU0_SUM0_SUS0_SVW2_VWA2_VWB1_WG64_4_1_WGM8_WGMXCC4_WGMXCCG80
    SolutionIndex: 8
    SolutionNameMin: Cijk_Ailk_Bjlk_SB_HAS_UserArgs_MT32x32x32_MI16x16x1_SN_GRVWA4_GRVWB4_GSU1_GSUC0_GSUWGMRR0_K1_LBSPPA128_LBSPPB128_LPA0_LPB0_MIWT2_2_NLCA1_NLCB1_SU0_SUM0_SUS0_SVW2_VWA2_VWB2_WG16_4_1_WGM8_WGMXCC4_WGMXCCG80
    SolutionIndex: 9
    SolutionNameMin: Cijk_Ailk_Bjlk_SB_HAS_UserArgs_MT64x64x64_MI16x16x1_SN_GRVWA4_GRVWB4_GSU10_GSUC0_GSUWGMRR0_K1_LBSPPA256_LBSPPB256_LPA0_LPB0_MIWT2_2_NLCA1_NLCB1_SU0_SUM0_SUS0_SVW2_VWA2_VWB2_WG32_8_1_WGM8_WGMXCC4_WGMXCCG80
    SolutionIndex: 10
    SolutionNameMin: Cijk_Ailk_Bjlk_SB_HAS_UserArgs_MT16x16x32_MI16x16x1_SN_GRVWA4_GRVWB4_GSU1_GSUC0_GSUWGMRR0_K1_LBSPPA64_LBSPPB64_LPA0_LPB0_MIWT1_1_NLCA1_NLCB1_SU0_SUM0_SUS0_SVW1_VWA1_VWB1_WG16_4_1_WGM8_WGMXCC4_WGMXCCG80
    SolutionIndex: 11
    SolutionNameMin: Cijk_Ailk_Bjlk_SB_HAS_UserArgs_MT32x64x64_MI16x16x1_SN_GRVWA4_GRVWB4_GSU40_GSUC0_GSUWGMRR0_K1_LBSPPA128_LBSPPB256_LPA0_LPB16_MIWT2_1_NLCA1_NLCB1_SU4_SUM0_SUS256_SVW2_VWA2_VWB1_WG16_16_1_WGM8_WGMXCC4_WGMXCCG80
    SolutionIndex: 12
    SolutionNameMin: Cijk_Ailk_Bjlk_SB_HAS_UserArgs_MT16x128x32_MI16x16x1_SN_GRVWA2_GRVWB4_GSU1_GSUC0_GSUWGMRR0_K1_LBSPPA64_LBSPPB512_LPA0_LPB0_MIWT1_2_NLCA1_NLCB1_SU4_SUM0_SUS256_SVW1_VWA1_VWB2_WG16_16_1_WGM8_WGMXCC4_WGMXCCG80
    SolutionIndex: 13
    SolutionNameMin: Cijk_Ailk_Bjlk_SB_HAS_UserArgs_MT16x16x32_MI16x16x1_SN_GRVWA4_GRVWB4_GSU1_GSUC0_GSUWGMRR0_K1_LBSPPA64_LBSPPB64_LPA0_LPB0_MIWT1_1_NLCA1_NLCB1_SU4_SUM0_SUS256_SVW1_VWA1_VWB1_WG16_4_1_WGM8_WGMXCC4_WGMXCCG80
    SolutionIndex: 14
    SolutionNameMin: Cijk_Ailk_Bjlk_SB_HAS_UserArgs_MT128x176x32_MI16x16x1_SN_GRVWA4_GRVWB2_GSU1_GSUC0_GSUWGMRR0_K1_LBSPPA512_LBSPPB704_LPA0_LPB0_MIWT2_11_NLCA1_NLCB11_SU4_SUM0_SUS256_SVW2_VWA2_VWB1_WG64_4_1_WGM8_WGMXCC4_WGMXCCG80
    SolutionIndex: 15
    SolutionNameMin: Cijk_Ailk_Bjlk_SB_HAS_UserArgs_MT64x64x32_MI16x16x1_SN_GRVWA4_GRVWB4_GSU10_GSUC0_GSUWGMRR0_K1_LBSPPA256_LBSPPB256_LPA0_LPB0_MIWT2_2_NLCA1_NLCB1_SU0_SUM0_SUS0_SVW2_VWA2_VWB2_WG32_8_1_WGM8_WGMXCC4_WGMXCCG80
    SolutionIndex: 16
    SolutionNameMin: Cijk_Ailk_Bjlk_SB_HAS_UserArgs_MT96x64x32_MI16x16x1_SN_GRVWA4_GRVWB4_GSU1_GSUC0_GSUWGMRR0_K1_LBSPPA384_LBSPPB256_LPA0_LPB16_MIWT6_1_NLCA3_NLCB1_SU0_SUM0_SUS0_SVW2_VWA2_VWB1_WG16_16_1_WGM8_WGMXCC4_WGMXCCG80
    SolutionIndex: 17
    SolutionNameMin: Cijk_Ailk_Bjlk_SB_HAS_UserArgs_MT128x64x32_MI16x16x1_SN_GRVWA4_GRVWB4_GSU1_GSUC0_GSUWGMRR0_K1_LBSPPA512_LBSPPB256_LPA0_LPB16_MIWT8_1_NLCA1_NLCB1_SU0_SUM0_SUS0_SVW4_VWA4_VWB1_WG16_16_1_WGM8_WGMXCC4_WGMXCCG80
    SolutionIndex: 18
    SolutionNameMin: Cijk_Ailk_Bjlk_SB_HAS_UserArgs_MT32x32x64_MI16x16x1_SN_GRVWA4_GRVWB4_GSU1_GSUC0_GSUWGMRR0_K1_LBSPPA128_LBSPPB128_LPA0_LPB16_MIWT2_1_NLCA1_NLCB1_SU0_SUM0_SUS0_SVW2_VWA2_VWB1_WG16_8_1_WGM8_WGMXCC4_WGMXCCG80
    SolutionIndex: 19
    SolutionNameMin: Cijk_Ailk_Bjlk_SB_HAS_UserArgs_MT64x32x32_MI16x16x1_SN_GRVWA4_GRVWB4_GSU1_GSUC0_GSUWGMRR0_K1_LBSPPA256_LBSPPB128_LPA16_LPB0_MIWT1_2_NLCA1_NLCB1_SU4_SUM0_SUS256_SVW1_VWA1_VWB2_WG64_4_1_WGM8_WGMXCC4_WGMXCCG80
    SolutionIndex: 20
    SolutionNameMin: Cijk_Ailk_Bjlk_SB_HAS_UserArgs_MT32x64x64_MI16x16x1_SN_GRVWA4_GRVWB4_GSU40_GSUC0_GSUWGMRR0_K1_LBSPPA128_LBSPPB256_LPA0_LPB16_MIWT2_1_NLCA1_NLCB1_SU0_SUM0_SUS0_SVW2_VWA2_VWB1_WG16_16_1_WGM8_WGMXCC4_WGMXCCG80
    SolutionIndex: 21
    SolutionNameMin: Cijk_Ailk_Bjlk_SB_HAS_UserArgs_MT64x80x64_MI16x16x1_SN_GRVWA4_GRVWB4_GSU1_GSUC0_GSUWGMRR0_K1_LBSPPA256_LBSPPB320_LPA16_LPB0_MIWT1_5_NLCA1_NLCB5_SU0_SUM0_SUS0_SVW1_VWA1_VWB1_WG64_4_1_WGM8_WGMXCC4_WGMXCCG80
    SolutionIndex: 22
    SolutionNameMin: Cijk_Ailk_Bjlk_SB_HAS_UserArgs_MT32x32x64_MI16x16x1_SN_GRVWA4_GRVWB4_GSU1_GSUC0_GSUWGMRR0_K1_LBSPPA128_LBSPPB128_LPA16_LPB16_MIWT1_1_NLCA1_NLCB1_SU0_SUM0_SUS0_SVW1_VWA1_VWB1_WG32_8_1_WGM8_WGMXCC4_WGMXCCG80
    SolutionIndex: 23
    SolutionNameMin: Cijk_Ailk_Bjlk_SB_HAS_UserArgs_MT128x32x32_MI16x16x1_SN_GRVWA4_GRVWB4_GSU1_GSUC0_GSUWGMRR0_K1_LBSPPA512_LBSPPB128_LPA0_LPB16_MIWT4_1_NLCA1_NLCB1_SU0_SUM0_SUS0_SVW4_VWA4_VWB1_WG32_8_1_WGM8_WGMXCC4_WGMXCCG80
    SolutionIndex: 24
    SolutionNameMin: Cijk_Ailk_Bjlk_SB_HAS_UserArgs_MT64x64x32_MI16x16x1_SN_GRVWA4_GRVWB4_GSU1_GSUC0_GSUWGMRR0_K1_LBSPPA256_LBSPPB256_LPA0_LPB0_MIWT2_2_NLCA1_NLCB1_SU0_SUM0_SUS0_SVW2_VWA2_VWB2_WG32_8_1_WGM8_WGMXCC4_WGMXCCG80
    SolutionIndex: 25
    SolutionNameMin: Cijk_Ailk_Bjlk_SB_HAS_UserArgs_MT96x32x64_MI16x16x1_SN_GRVWA4_GRVWB4_GSU1_GSUC0_GSUWGMRR0_K1_LBSPPA384_LBSPPB128_LPA16_LPB16_MIWT3_1_NLCA3_NLCB1_SU0_SUM0_SUS0_SVW1_VWA1_VWB1_WG32_8_1_WGM8_WGMXCC4_WGMXCCG80
    SolutionIndex: 26
    SolutionNameMin: Cijk_Ailk_Bjlk_SB_HAS_UserArgs_MT64x64x32_MI16x16x1_SN_GRVWA4_GRVWB4_GSU1_GSUC0_GSUWGMRR0_K1_LBSPPA256_LBSPPB256_LPA0_LPB16_MIWT4_1_NLCA1_NLCB1_SU4_SUM0_SUS256_SVW4_VWA4_VWB1_WG16_16_1_WGM8_WGMXCC4_WGMXCCG80
    SolutionIndex: 27
    SolutionNameMin: Cijk_Ailk_Bjlk_SB_HAS_UserArgs_MT80x64x32_MI16x16x1_SN_GRVWA2_GRVWB4_GSU1_GSUC0_GSUWGMRR0_K1_LBSPPA320_LBSPPB256_LPA0_LPB16_MIWT5_1_NLCA5_NLCB1_SU0_SUM0_SUS0_SVW1_VWA1_VWB1_WG16_16_1_WGM8_WGMXCC4_WGMXCCG80
    SolutionIndex: 28
    SolutionNameMin: Cijk_Ailk_Bjlk_SB_HAS_UserArgs_MT16x32x64_MI16x16x1_SN_GRVWA4_GRVWB4_GSU26_GSUC0_GSUWGMRR0_K1_LBSPPA64_LBSPPB128_LPA0_LPB16_MIWT1_1_NLCA1_NLCB1_SU0_SUM0_SUS0_SVW1_VWA1_VWB1_WG16_8_1_WGM8_WGMXCC4_WGMXCCG80
    SolutionIndex: 29
    SolutionNameMin: Cijk_Ailk_Bjlk_SB_HAS_UserArgs_MT128x80x32_MI16x16x1_SN_GRVWA4_GRVWB2_GSU1_GSUC0_GSUWGMRR0_K1_LBSPPA512_LBSPPB320_LPA0_LPB0_MIWT2_5_NLCA1_NLCB5_SU0_SUM0_SUS0_SVW2_VWA2_VWB1_WG64_4_1_WGM8_WGMXCC4_WGMXCCG80
    SolutionIndex: 30
    SolutionNameMin: Cijk_Ailk_Bjlk_SB_HAS_UserArgs_MT16x32x32_MI16x16x1_SN_GRVWA4_GRVWB4_GSU8_GSUC0_GSUWGMRR0_K1_LBSPPA64_LBSPPB128_LPA0_LPB16_MIWT1_1_NLCA1_NLCB1_SU0_SUM0_SUS0_SVW1_VWA1_VWB1_WG16_8_1_WGM8_WGMXCC4_WGMXCCG80
    SolutionIndex: 31
    SolutionNameMin: Cijk_Ailk_Bjlk_SB_UserArgs_MT32x32x64_MI16x16x1_SN_GRVWA4_GRVWB4_GSU1_LBSPPA128_LBSPPB128_LPA16_LPB16_MIWT1_1_NLCA1_NLCB1_SU0_SUM0_SUS0_SVW1_VWA1_VWB1_WG32_8_1_WGM0
    SolutionIndex: 32
    SolutionNameMin: Cijk_Ailk_Bjlk_SB_UserArgs_MT64x64x32_MI16x16x1_SN_GRVWA4_GRVWB4_GSU1_LBSPPA256_LBSPPB256_LPA0_LPB0_MIWT2_2_NLCA1_NLCB1_SU4_SUM0_SUS256_SVW2_VWA2_VWB2_WG32_8_1_WGM40
    SolutionIndex: 33
    SolutionNameMin: Cijk_Ailk_Bjlk_SB_UserArgs_MT16x16x4_MI16x16x1_SN_DTVA0_DTVB0_GRPM1_GSU1_GSUC0_GSUWGMRR0_K1_LBSPPA64_LBSPPB64_LWPM0p27_MIWT1_1_SU8_SUM0_SUS16_WGM1_WGMXCC1_WGMXCCG0
    SolutionIndex: 34
    SolutionNameMin: Cijk_Ailk_Bjlk_SB_SAV_MT64x48x16_MI16x16x4x1_SN_1LDSB0_GRVW1_GSU1_NEPBS2_NLCA1_NLCB3_PLR5_SPO1_TT1_48_WG64_4_1
    SolutionIndex: 35
    SolutionNameMin: Cijk_Ailk_Bjlk_SB_SAV_MT64x16x16_MI16x16x4x1_SN_1LDSB0_GRVW1_GSU1_NEPBS2_NLCA1_NLCB1_PLR5_SPO1_TT1_16_WG64_4_1
    SolutionIndex: 36
    SolutionNameMin: Cijk_Ailk_Bjlk_SB_SAV_MT64x16x16_MI16x16x4x1_SN_1LDSB0_GRVW1_GSU7_NEPBS2_NLCA1_NLCB1_PLR5_SPO1_TT1_16_WG64_4_1
    SolutionIndex: 37
    SolutionNameMin: Cijk_Ailk_Bjlk_SB_SAV_MT64x64x16_MI32x32x2x1_SN_1LDSB0_GRVW4_GSU1_NEPBS2_NLCA1_NLCB1_PLR9_SPO1_TT1_32_WG64_4_1
    SolutionIndex: 38
    SolutionNameMin: Cijk_Ailk_Bjlk_SB_SAV_MT64x16x16_MI16x16x4x1_SN_1LDSB0_GRVW1_GSU5_NEPBS2_NLCA1_NLCB1_PLR5_SPO1_TT1_16_WG64_4_1
    SolutionIndex: 39
    SolutionNameMin: Cijk_Ailk_Bjlk_SB_SAV_MT16x64x16_MI16x16x4x1_SN_1LDSB0_GRVW1_GSU1_NEPBS2_NLCA1_NLCB1_PLR5_SPO1_TT1_16_WG16_16_1
    SolutionIndex: 40
    SolutionNameMin: Cijk_Ailk_Bjlk_SB_SAV_MT16x256x16_MI16x16x4x1_SN_1LDSB1_GRVW1_GSU1_NEPBS2_NLCA1_NLCB1_PLR5_SPO1_TT1_64_WG16_16_1
    SolutionIndex: 41
    SolutionNameMin: Cijk_Ailk_Bjlk_SB_UserArgs_MT16x16x4_MI16x16x1_SN_DTVA0_DTVB0_GRPM1_GSU1_GSUC0_GSUWGMRR0_K1_LBSPPA64_LBSPPB64_LWPM0p25_MIWT1_1_SU32_SUM0_SUS16_WGM1_WGMXCC1_WGMXCCG0
    SolutionIndex: 42
    SolutionNameMin: Cijk_Ailk_Bjlk_SB_SAV_MT16x128x16_MI16x16x4x1_SN_1LDSB0_GRVW1_GSU1_NEPBS2_NLCA1_NLCB1_PLR5_SPO1_TT1_32_WG16_16_1
    SolutionIndex: 43
    SolutionNameMin: Cijk_Ailk_Bjlk_SB_SAV_MT256x112x16_MI16x16x4x1_SN_1LDSB1_GRVW1_GSU1_NEPBS2_NLCA1_NLCB7_PLR5_SPO1_TT4_112_WG64_4_1
    SolutionIndex: 44
    SolutionNameMin: Cijk_Ailk_Bjlk_SB_SAV_MT112x192x16_MI16x16x4x1_SN_1LDSB1_GRVW1_GSU1_NEPBS2_NLCA7_NLCB3_PLR5_SPO1_TT7_48_WG16_16_1
    SolutionIndex: 45
    SolutionNameMin: Cijk_Ailk_Bjlk_SB_SAV_MT48x64x16_MI16x16x4x1_SN_1LDSB0_GRVW1_GSU7_NEPBS2_NLCA3_NLCB1_PLR5_SPO1_TT3_16_WG16_16_1
    SolutionIndex: 46
    SolutionNameMin: Cijk_Ailk_Bjlk_SB_SAV_MT64x32x16_MI16x16x4x1_SN_1LDSB0_GRVW2_GSU1_NEPBS2_NLCA1_NLCB1_PLR5_SPO1_TT2_16_WG32_8_1
    SolutionIndex: 47
    SolutionNameMin: Cijk_Ailk_Bjlk_SB_SAV_MT32x64x16_MI16x16x4x1_SN_1LDSB0_GRVW2_GSU1_NEPBS2_NLCA1_NLCB1_PLR5_SPO1_TT2_16_WG16_16_1
- - - [256, 512, 1, 235]
    - [0, 6417.07]
  - - [128, 704, 1, 512]
    - [1, 8528.16]
  - - [444, 444, 1, 512]
    - [2, 13099.8]
  - - [32, 32, 1, 512]
    - [3, 130.42]
  - - [512, 1128, 1, 43]
    - [4, 5047.57]
  - - [32, 20, 1, 512]
    - [3, 81.5124]
  - - [1312, 64, 1, 512]
    - [5, 7866.72]
  - - [256, 1824, 1, 512]
    - [6, 20243.5]
  - - [768, 1293, 1, 512]
    - [7, 20032.6]
  - - [128, 1236, 1, 512]
    - [1, 13823.0]
  - - [256, 776, 1, 512]
    - [2, 13304.4]
  - - [32, 64, 1, 512]
    - [3, 259.228]
  - - [32, 32, 512, 32]
    - [8, 4479.9]
  - - [128, 256, 1, 40960]
    - [9, 24996.3]
  - - [256, 1888, 1, 512]
    - [6, 20375.8]
  - - [16, 16, 512, 82]
    - [10, 2289.22]
  - - [768, 272, 1, 512]
    - [2, 13747.4]
  - - [1024, 128, 1, 512]
    - [5, 12223.8]
  - - [32, 128, 1, 32768]
    - [11, 11326.4]
  - - [256, 896, 1, 512]
    - [2, 15242.1]
  - - [257, 1792, 1, 512]
    - [12, 16403.4]
  - - [256, 512, 1, 65]
    - [0, 2451.71]
  - - [512, 1128, 1, 98]
    - [4, 8788.59]
  - - [16, 32, 1, 35]
    - [13, 6.58824]
  - - [512, 1128, 1, 93]
    - [4, 8552.68]
  - - [256, 512, 1, 83]
    - [0, 2800.25]
  - - [512, 1128, 1, 85]
    - [4, 8209.12]
  - - [256, 540, 1, 512]
    - [5, 12373.9]
  - - [640, 2668, 1, 512]
    - [14, 22775.8]
  - - [64, 32, 1, 32]
    - [13, 30.2707]
  - - [256, 128, 1, 16384]
    - [15, 21539.5]
  - - [512, 1128, 1, 203]
    - [4, 12722.7]
  - - [256, 128, 1, 32768]
    - [15, 24246.2]
  - - [256, 512, 1, 73]
    - [0, 2603.61]
  - - [256, 512, 1, 98]
    - [0, 3457.62]
  - - [768, 640, 1, 512]
    - [16, 21263.9]
  - - [128, 896, 1, 512]
    - [5, 10705.6]
  - - [256, 512, 1, 251]
    - [0, 6345.05]
  - - [256, 512, 1, 256]
    - [1, 8581.7]
  - - [160, 704, 1, 512]
    - [5, 10601.4]
  - - [512, 1128, 1, 81]
    - [4, 8037.87]
  - - [256, 640, 1, 512]
    - [5, 15279.8]
  - - [256, 512, 1, 227]
    - [0, 6384.84]
  - - [512, 1128, 1, 65]
    - [4, 6990.66]
  - - [540, 740, 1, 512]
    - [16, 16263.5]
  - - [512, 1128, 1, 235]
    - [17, 13599.3]
  - - [512, 1128, 1, 92]
    - [4, 8639.56]
  - - [256, 512, 1, 74]
    - [0, 2555.82]
  - - [512, 1128, 1, 73]
    - [4, 7610.13]
  - - [352, 352, 1, 512]
    - [18, 11278.0]
  - - [256, 512, 1, 96]
    - [19, 4173.44]
  - - [768, 128, 1, 512]
    - [1, 9277.72]
  - - [128, 256, 1, 32768]
    - [15, 24169.8]
  - - [32, 128, 1, 40960]
    - [20, 12861.0]
  - - [256, 1312, 1, 512]
    - [21, 15541.5]
  - - [128, 444, 1, 512]
    - [22, 6062.08]
  - - [512, 1128, 1, 86]
    - [23, 8298.76]
  - - [256, 512, 1, 72]
    - [0, 2621.44]
  - - [512, 1128, 1, 44]
    - [4, 5133.65]
  - - [512, 1128, 1, 72]
    - [4, 7588.06]
  - - [128, 1792, 1, 512]
    - [2, 15232.2]
  - - [256, 512, 1, 76]
    - [0, 2692.29]
  - - [512, 1128, 1, 47]
    - [24, 5327.61]
  - - [512, 1128, 1, 74]
    - [4, 7721.35]
  - - [32, 128, 1, 16384]
    - [20, 7239.36]
  - - [128, 256, 1, 16384]
    - [15, 21312.9]
  - - [768, 256, 1, 512]
    - [25, 13210.4]
  - - [512, 1128, 1, 101]
    - [26, 8891.94]
  - - [256, 512, 1, 101]
    - [0, 3479.18]
  - - [512, 1128, 1, 76]
    - [4, 7887.28]
  - - [512, 1128, 1, 49]
    - [24, 5426.51]
  - - [256, 512, 1, 203]
    - [19, 5709.79]
  - - [32, 32, 512, 80]
    - [8, 6437.92]
  - - [128, 16, 1, 512]
    - [3, 257.319]
  - - [256, 512, 1, 190]
    - [0, 5145.39]
  - - [768, 512, 1, 512]
    - [27, 18096.8]
  - - [256, 128, 1, 40960]
    - [9, 25080.4]
  - - [512, 1128, 1, 50]
    - [4, 5516.1]
  - - [16, 82, 1, 8192]
    - [28, 1639.65]
  - - [512, 1128, 1, 227]
    - [17, 13727.8]
  - - [256, 2968, 1, 512]
    - [29, 20870.3]
  - - [128, 800, 1, 512]
    - [1, 9709.04]
  - - [512, 1128, 1, 83]
    - [23, 8208.13]
  - - [8, 16, 1, 512]
    - [30, 16.8257]
  - - [32, 32, 512, 64]
    - [8, 7185.1]
  - - [768, 320, 1, 512]
    - [25, 16394.7]
  - - [512, 1128, 1, 51]
    - [4, 5615.7]
  - - [128, 112, 1, 512]
    - [31, 1731.14]
  - - [256, 64, 1, 512]
    - [31, 2026.23]
  - - [128, 80, 1, 512]
    - [31, 1235.07]
  - - [64, 256, 1, 512]
    - [31, 1992.54]
  - - [64, 128, 1, 512]
    - [31, 1025.5]
  - - [64, 32, 1, 512]
    - [31, 259.549]
  - - [512, 1128, 1, 256]
    - [32, 16858.5]
  - - [128, 320, 1, 512]
    - [31, 4951.95]
  - - [128, 352, 1, 512]
    - [31, 5486.01]
  - - [64, 704, 1, 512]
    - [31, 5558.72]
  - - [16, 32, 1, 512]
    - [31, 62.7139]
  - - [128, 64, 1, 512]
    - [31, 1009.46]
  - - [256, 288, 1, 512]
    - [31, 8903.0]
  - - [128, 160, 1, 512]
    - [31, 2499.59]
  - - [512, 1144, 1, 512]
    - [32, 20249.3]
  - - [128, 128, 1, 512]
    - [31, 2004.45]
  - - [256, 1168, 1, 512]
    - [32, 17647.5]
  - - [64, 512, 1, 512]
    - [31, 3980.36]
  - - [256, 256, 1, 512]
    - [31, 7895.16]
  - - [64, 416, 1, 512]
    - [31, 3276.8]
  - - [160, 64, 1, 512]
    - [31, 1278.75]
  - - [32, 128, 1, 512]
    - [31, 517.177]
  - - [256, 128, 1, 512]
    - [31, 4023.31]
  - - [160, 416, 1, 512]
    - [31, 8056.43]
  - - [768, 64, 1, 512]
    - [31, 6027.74]
  - - [128, 48, 1, 512]
    - [31, 733.27]
  - - [128, 192, 1, 512]
    - [31, 2974.68]
  - - [128, 256, 1, 512]
    - [31, 3952.23]
  - - [256, 3384, 1, 512]
    - [32, 20936.9]
  - - [512, 1128, 1, 96]
    - [32, 11338.1]
  - - [128, 416, 1, 512]
    - [31, 6498.92]
  - - [1, 256, 72, 1]
    - [33, 5.52684]
  - - [512, 1128, 1, 19]
    - [34, 2465.88]
  - - [256, 512, 1, 93]
    - [35, 3017.25]
  - - [3, 32, 1, 512]
    - [36, 11.8012]
  - - [256, 512, 1, 92]
    - [35, 3033.62]
  - - [256, 512, 1, 13]
    - [33, 605.306]
  - - [512, 1128, 1, 13]
    - [34, 1725.97]
  - - [512, 1128, 1, 57]
    - [37, 5894.28]
  - - [32, 1302, 1, 17]
    - [33, 257.559]
  - - [1, 256, 1, 227]
    - [38, 14.1392]
  - - [1, 256, 83, 1]
    - [33, 5.51896]
  - - [256, 512, 1, 50]
    - [39, 1864.47]
  - - [1, 256, 125, 1]
    - [40, 8.16327]
  - - [512, 1128, 1, 15]
    - [34, 2014.66]
  - - [512, 1128, 1, 125]
    - [37, 9768.88]
  - - [1, 256, 19, 1]
    - [41, 2.06102]
  - - [1, 256, 74, 1]
    - [42, 5.74061]
  - - [1520, 5897, 1, 512]
    - [43, 24578.4]
  - - [1, 256, 14, 1]
    - [33, 1.61441]
  - - [16, 32, 1, 23]
    - [33, 4.76761]
  - - [256, 512, 1, 43]
    - [39, 1638.4]
  - - [540, 5897, 1, 512]
    - [44, 22790.1]
  - - [512, 1128, 1, 23]
    - [34, 2887.68]
  - - [1, 16, 1, 22]
    - [33, 0.13831]
  - - [256, 512, 1, 44]
    - [39, 1681.39]
  - - [1, 256, 93, 1]
    - [40, 6.11245]
  - - [1, 256, 81, 1]
    - [33, 5.36507]
  - - [1, 256, 50, 1]
    - [33, 4.52297]
  - - [32, 1302, 1, 24]
    - [33, 359.043]
  - - [1, 16, 1, 35]
    - [33, 0.205882]
  - - [256, 512, 1, 47]
    - [39, 1770.23]
  - - [16, 32, 1, 22]
    - [41, 4.51463]
  - - [1, 256, 13, 1]
    - [33, 1.51963]
  - - [256, 512, 1, 125]
    - [39, 3749.2]
  - - [512, 1128, 1, 190]
    - [37, 12172.1]
  - - [256, 512, 1, 23]
    - [39, 960.082]
  - - [32, 1302, 1, 35]
    - [39, 485.271]
  - - [1, 256, 44, 1]
    - [33, 4.03728]
  - - [512, 1128, 1, 48]
    - [37, 5663.27]
  - - [1, 16, 1, 17]
    - [33, 0.111247]
  - - [512, 1128, 1, 251]
    - [37, 13858.7]
  - - [1, 256, 1, 251]
    - [38, 13.8782]
  - - [1, 256, 1, 101]
    - [35, 6.78635]
  - - [1, 256, 1, 190]
    - [38, 11.4852]
  - - [1, 256, 76, 1]
    - [42, 5.83388]
  - - [16, 32, 1, 20]
    - [33, 4.69725]
  - - [1, 256, 47, 1]
    - [33, 4.1135]
  - - [1, 256, 15, 1]
    - [33, 1.7415]
  - - [256, 512, 1, 81]
    - [35, 2750.47]
  - - [1, 16, 1, 23]
    - [33, 0.144597]
  - - [1, 256, 57, 1]
    - [33, 4.91313]
  - - [32, 1302, 1, 20]
    - [33, 317.44]
  - - [1, 16, 1, 20]
    - [33, 0.135881]
  - - [1, 256, 92, 1]
    - [40, 5.91759]
  - - [1, 256, 1, 256]
    - [45, 15.1005]
  - - [1, 256, 101, 1]
    - [40, 6.61279]
  - - [16, 32, 1, 24]
    - [33, 5.43717]
  - - [256, 512, 1, 85]
    - [35, 2831.29]
  - - [1, 256, 16, 1]
    - [33, 1.86182]
  - - [1, 256, 85, 1]
    - [33, 5.63001]
  - - [256, 512, 1, 31]
    - [39, 1246.39]
  - - [1, 256, 1, 203]
    - [38, 12.2422]
  - - [1, 256, 96, 1]
    - [33, 6.12105]
  - - [512, 1128, 1, 31]
    - [34, 3653.8]
  - - [1, 256, 31, 1]
    - [33, 3.13057]
  - - [512, 1128, 1, 62]
    - [34, 6211.14]
  - - [1, 256, 98, 1]
    - [40, 6.43282]
  - - [256, 512, 1, 49]
    - [39, 1829.78]
  - - [256, 512, 1, 14]
    - [33, 655.36]
  - - [1, 256, 51, 1]
    - [33, 4.61343]
  - - [1, 16, 1, 24]
    - [33, 0.154839]
  - - [256, 512, 1, 62]
    - [39, 2214.3]
  - - [1, 256, 65, 1]
    - [42, 5.2]
  - - [1, 256, 73, 1]
    - [42, 5.82181]
  - - [256, 512, 1, 51]
    - [39, 1891.0]
  - - [512, 1128, 1, 14]
    - [34, 1880.35]
  - - [256, 512, 1, 27]
    - [39, 1104.19]
  - - [1, 256, 49, 1]
    - [33, 4.46406]
  - - [256, 512, 1, 57]
    - [39, 2063.84]
  - - [1, 16, 1, 512]
    - [36, 1.90512]
  - - [32, 1302, 1, 22]
    - [39, 318.267]
  - - [32, 1302, 1, 23]
    - [39, 335.06]
  - - [1, 256, 27, 1]
    - [33, 2.69474]
  - - [256, 512, 1, 19]
    - [33, 819.2]
  - - [512, 1128, 1, 27]
    - [34, 3317.76]
  - - [256, 512, 1, 15]
    - [33, 688.644]
  - - [256, 512, 1, 16]
    - [46, 798.915]
  - - [1, 256, 62, 1]
    - [42, 4.96776]
  - - [1, 256, 23, 1]
    - [33, 2.38381]
  - - [16, 32, 1, 17]
    - [33, 3.67257]
  - - [1, 256, 43, 1]
    - [33, 3.90355]
  - - [256, 512, 1, 48]
    - [47, 2059.4]
  - - [1, 256, 1, 235]
    - [38, 14.1387]
  - - [512, 1128, 1, 16]
    - [34, 2287.27]
  - - [1, 256, 48, 1]
    - [33, 4.37295]
  - - [1, 256, 86, 1]
    - [33, 5.68155]
  - - [256, 512, 1, 86]
    - [35, 2860.96]
- null
- null
- DeviceEfficiency
- Equality
