library/src/amd_detail/rocblaslt/src/Tensile/Logic/asm_full/gfx1200/Equality/gfx1200_Cijk_Ailk_Bljk_B8SS_BH_HAS_UserArgs.yaml
- {MinimumRequiredVersion: 4.33.0}
- gfx1200
- gfx1200
- [Device 73f0]
    SolutionIndex: 0
    SolutionNameMin: Cijk_Ailk_Bljk_B8SS_BH_HAS_UserArgs_MT128x128x32_MI16x16x1_SN_EPS0_GRVWA8_GRVWB2_GSU1_GSUC0_GSUWGMRR0_K1_LBSPPA256_LPA8_MIWT8_2_PGR1_SU32_SUM0_SUS256_SVW8_TLDS2_VWA8_VWB2_WG16_8_1_WGM8_WGMXCC1_WGMXCCGn1
    SolutionIndex: 1
    SolutionNameMin: Cijk_Ailk_Bljk_B8SS_BH_HAS_UserArgs_MT128x128x32_MI16x16x1_SN_EPS0_GRVWA8_GRVWB2_GSU1_GSUC0_GSUWGMRR0_K1_LBSPPA256_LPA8_MIWT8_2_PGR1_SU32_SUM0_SUS256_SVW4_TLDS2_VWA8_VWB1_WG16_8_1_WGM8_WGMXCC1_WGMXCCGn1
    SolutionIndex: 2
    SolutionNameMin: Cijk_Ailk_Bljk_B8SS_BH_HAS_UserArgs_MT128x128x32_MI16x16x1_SN_EPS0_GRVWA8_GRVWB8_GSU1_GSUC0_GSUWGMRR0_K1_LBSPPA256_LPA8_MIWT8_2_PGR2_SU32_SUM0_SUS256_SVW8_TLDS2_VWA8_VWB1_WG16_8_1_WGM8_WGMXCC1_WGMXCCGn1
    SolutionIndex: 3
    SolutionNameMin: Cijk_Ailk_Bljk_B8SS_BH_HAS_UserArgs_MT128x128x32_MI16x16x1_SN_EPS1_GRVWA8_GRVWB8_GSU1_GSUC0_GSUWGMRR0_K1_LBSPPA256_LPA8_MIWT8_2_PGR1_SU32_SUM0_SUS256_SVW8_TLDS2_VWA8_VWB2_WG16_8_1_WGM8_WGMXCC1_WGMXCCGn1
    SolutionIndex: 4
    SolutionNameMin: Cijk_Ailk_Bljk_B8SS_BH_HAS_UserArgs_MT128x128x32_MI16x16x1_SN_EPS0_GRVWA8_GRVWB8_GSU1_GSUC0_GSUWGMRR0_K1_LBSPPA1024_LPA64_MIWT4_4_PGR1_SU32_SUM0_SUS256_SVW4_TLDS1_VWA4_VWB2_WG32_4_1_WGM8_WGMXCC1_WGMXCCGn1
    SolutionIndex: 5
    SolutionNameMin: Cijk_Ailk_Bljk_B8SS_BH_HAS_UserArgs_MT32x32x32_MI16x16x1_SN_EPS0_GRVWA1_GRVWB1_GSU1_GSUC0_GSUWGMRR0_K1_LBSPPA256_LPA16_MIWT1_1_PGR1_SU32_SUM0_SUS256_SVW1_TLDS1_VWA1_VWB1_WG32_4_1_WGM8_WGMXCC1_WGMXCCGn1
    SolutionIndex: 6
    SolutionNameMin: Cijk_Ailk_Bljk_B8SS_BH_HAS_UserArgs_MT32x32x32_MI16x16x1_SN_EPS0_GRVWA1_GRVWB4_GSU1_GSUC0_GSUWGMRR0_K1_LBSPPA128_LPA8_MIWT1_1_PGR1_SU32_SUM0_SUS256_SVW1_TLDS2_VWA1_VWB1_WG32_4_1_WGM8_WGMXCC1_WGMXCCGn1
    SolutionIndex: 7
    SolutionNameMin: Cijk_Ailk_Bljk_B8SS_BH_HAS_UserArgs_MT32x32x32_MI16x16x1_SN_EPS0_GRVWA1_GRVWB8_GSU1_GSUC0_GSUWGMRR0_K1_LBSPPA128_LPA8_MIWT1_1_PGR1_SU32_SUM0_SUS256_SVW1_TLDS2_VWA1_VWB1_WG32_4_1_WGM8_WGMXCC1_WGMXCCGn1
    SolutionIndex: 8
    SolutionNameMin: Cijk_Ailk_Bljk_B8SS_BH_HAS_UserArgs_MT32x32x64_MI16x16x1_SN_EPS0_GRVWA4_GRVWB4_GSU1_GSUC0_GSUWGMRR0_K1_LBSPPA128_LPA8_MIWT1_1_PGR2_SU32_SUM0_SUS256_SVW1_TLDS2_VWA1_VWB1_WG32_4_1_WGM8_WGMXCC1_WGMXCCGn1
    SolutionIndex: 9
    SolutionNameMin: Cijk_Ailk_Bljk_B8SS_BH_HAS_UserArgs_MT32x32x64_MI16x16x1_SN_EPS0_GRVWA8_GRVWB4_GSU1_GSUC0_GSUWGMRR0_K1_LBSPPA128_LPA8_MIWT1_1_PGR2_SU32_SUM0_SUS256_SVW1_TLDS2_VWA1_VWB1_WG32_4_1_WGM8_WGMXCC1_WGMXCCGn1
    SolutionIndex: 10
    SolutionNameMin: Cijk_Ailk_Bljk_B8SS_BH_HAS_UserArgs_MT32x32x64_MI16x16x1_SN_EPS0_GRVWA4_GRVWB8_GSU1_GSUC0_GSUWGMRR0_K1_LBSPPA256_LPA16_MIWT1_1_PGR2_SU32_SUM0_SUS256_SVW1_TLDS1_VWA1_VWB1_WG32_4_1_WGM8_WGMXCC1_WGMXCCGn1
    SolutionIndex: 11
    SolutionNameMin: Cijk_Ailk_Bljk_B8SS_BH_HAS_UserArgs_MT32x32x64_MI16x16x1_SN_EPS1_GRVWA1_GRVWB1_GSU1_GSUC0_GSUWGMRR0_K1_LBSPPA128_LPA8_MIWT1_1_PGR1_SU32_SUM0_SUS256_SVW1_TLDS2_VWA1_VWB1_WG32_4_1_WGM8_WGMXCC1_WGMXCCGn1
    SolutionIndex: 12
    SolutionNameMin: Cijk_Ailk_Bljk_B8SS_BH_HAS_UserArgs_MT32x32x64_MI16x16x1_SN_EPS1_GRVWA4_GRVWB1_GSU1_GSUC0_GSUWGMRR0_K1_LBSPPA128_LPA8_MIWT1_1_PGR1_SU32_SUM0_SUS256_SVW1_TLDS2_VWA1_VWB1_WG32_4_1_WGM8_WGMXCC1_WGMXCCGn1
    SolutionIndex: 13
    SolutionNameMin: Cijk_Ailk_Bljk_B8SS_BH_HAS_UserArgs_MT32x32x64_MI16x16x1_SN_EPS1_GRVWA4_GRVWB8_GSU1_GSUC0_GSUWGMRR0_K1_LBSPPA256_LPA16_MIWT1_1_PGR1_SU32_SUM0_SUS256_SVW1_TLDS1_VWA1_VWB1_WG32_4_1_WGM8_WGMXCC1_WGMXCCGn1
- - - [1, 1, 1, 1, 1, 1, 1, 1]
    - [11, 0.0]
  - - [64, 64, 1, 64, 64, 64, 64, 64]
    - [6, 0.01]
  - - [64, 64, 1, 512, 64, 64, 64, 512]
    - [9, 0.04]
  - - [64, 64, 1, 1024, 64, 64, 64, 1024]
    - [8, 0.08]
  - - [64, 64, 1, 2048, 64, 64, 64, 2048]
    - [10, 0.15]
  - - [127, 127, 1, 127, 127, 127, 127, 127]
    - [5, 0.04]
  - - [128, 128, 1, 128, 128, 128, 128, 128]
    - [12, 0.04]
  - - [129, 129, 1, 129, 129, 129, 129, 129]
    - [7, 0.04]
  - - [256, 256, 1, 256, 256, 256, 256, 256]
    - [13, 0.35]
  - - [512, 512, 1, 512, 512, 512, 512, 512]
    - [4, 2.39]
  - - [1024, 1024, 1, 1024, 1024, 1024, 1024, 1024]
    - [2, 13.88]
  - - [4096, 4096, 1, 4096, 4096, 4096, 4096, 4096]
    - [3, 33.99]
  - - [4096, 4096, 1, 4096, 4128, 4128, 4128, 4128]
    - [1, 33.8]
  - - [4096, 4096, 1, 4096, 4160, 4160, 4160, 4160]
    - [0, 33.84]
- null
- null
- DeviceEfficiency
- Equality
