library/src/amd_detail/rocblaslt/src/Tensile/Logic/asm_full/gfx1201/Equality/gfx1201_Cijk_Ailk_Bjlk_BSS_BH_HAS_UserArgs.yaml
- {MinimumRequiredVersion: 4.33.0}
- gfx1201
- gfx1201
- [Device 73f0]
    SolutionIndex: 0
    SolutionNameMin: Cijk_Ailk_Bjlk_BSS_BH_HAS_UserArgs_MT128x128x32_MI16x16x1_SN_LDSB1_EPS0_GRVWA2_GRVWB8_GSU1_GSUC0_GSUWGMRR0_K1_LBSPPA256_LBSPPB256_MIWT4_4_PGR2_SU32_SUM0_SUS256_SVW4_TLDS2_VWA4_VWB4_WGM8_WGMXCC1_WGMXCCGn1
    SolutionIndex: 1
    SolutionNameMin: Cijk_Ailk_Bjlk_BSS_BH_HAS_UserArgs_MT128x128x32_MI16x16x1_SN_LDSB1_EPS0_GRVWA8_GRVWB8_GSU1_GSUC0_GSUWGMRR0_K1_LBSPPA256_LBSPPB256_MIWT4_4_PGR2_SU32_SUM0_SUS256_SVW4_TLDS2_VWA4_VWB4_WGM8_WGMXCC1_WGMXCCGn1
    SolutionIndex: 2
    SolutionNameMin: Cijk_Ailk_Bjlk_BSS_BH_HAS_UserArgs_MT32x32x32_MI16x16x1_SN_LDSB0_EPS0_GRVWA4_GRVWB8_GSU1_GSUC0_GSUWGMRR0_K1_LBSPPA128_LBSPPB512_MIWT1_1_PGR2_SU32_SUM0_SUS256_SVW1_TLDS1_VWA1_VWB1_WGM8_WGMXCC1_WGMXCCGn1
    SolutionIndex: 3
    SolutionNameMin: Cijk_Ailk_Bjlk_BSS_BH_HAS_UserArgs_MT32x32x32_MI16x16x1_SN_LDSB0_EPS1_GRVWA8_GRVWB4_GSU1_GSUC0_GSUWGMRR0_K1_LBSPPA128_LBSPPB128_MIWT1_1_PGR1_SU32_SUM0_SUS256_SVW1_TLDS2_VWA1_VWB1_WGM8_WGMXCC1_WGMXCCGn1
    SolutionIndex: 4
    SolutionNameMin: Cijk_Ailk_Bjlk_BSS_BH_HAS_UserArgs_MT32x32x32_MI16x16x1_SN_LDSB0_EPS1_GRVWA8_GRVWB8_GSU1_GSUC0_GSUWGMRR0_K1_LBSPPA128_LBSPPB512_MIWT1_1_PGR1_SU32_SUM0_SUS256_SVW1_TLDS1_VWA1_VWB1_WGM8_WGMXCC1_WGMXCCGn1
    SolutionIndex: 5
    SolutionNameMin: Cijk_Ailk_Bjlk_BSS_BH_HAS_UserArgs_MT32x32x64_MI16x16x1_SN_LDSB0_EPS0_GRVWA4_GRVWB1_GSU1_GSUC0_GSUWGMRR0_K1_LBSPPA128_LBSPPB128_MIWT1_1_PGR1_SU32_SUM0_SUS256_SVW1_TLDS2_VWA1_VWB1_WGM8_WGMXCC1_WGMXCCGn1
    SolutionIndex: 6
    SolutionNameMin: Cijk_Ailk_Bjlk_BSS_BH_HAS_UserArgs_MT32x32x64_MI16x16x1_SN_LDSB0_EPS0_GRVWA8_GRVWB4_GSU1_GSUC0_GSUWGMRR0_K1_LBSPPA128_LBSPPB128_MIWT1_1_PGR2_SU32_SUM0_SUS256_SVW1_TLDS2_VWA1_VWB1_WGM8_WGMXCC1_WGMXCCGn1
    SolutionIndex: 7
    SolutionNameMin: Cijk_Ailk_Bjlk_BSS_BH_HAS_UserArgs_MT32x32x64_MI16x16x1_SN_LDSB0_EPS0_GRVWA8_GRVWB8_GSU1_GSUC0_GSUWGMRR0_K1_LBSPPA128_LBSPPB512_MIWT1_1_PGR2_SU32_SUM0_SUS256_SVW1_TLDS1_VWA1_VWB1_WGM8_WGMXCC1_WGMXCCGn1
    SolutionIndex: 8
    SolutionNameMin: Cijk_Ailk_Bjlk_BSS_BH_HAS_UserArgs_MT32x32x64_MI16x16x1_SN_LDSB0_EPS0_GRVWA8_GRVWB8_GSU1_GSUC0_GSUWGMRR0_K1_LBSPPA128_LBSPPB128_MIWT1_1_PGR2_SU32_SUM0_SUS256_SVW1_TLDS2_VWA1_VWB1_WGM8_WGMXCC1_WGMXCCGn1
    SolutionIndex: 9
    SolutionNameMin: Cijk_Ailk_Bjlk_BSS_BH_HAS_UserArgs_MT32x32x64_MI16x16x1_SN_LDSB0_EPS1_GRVWA2_GRVWB1_GSU1_GSUC0_GSUWGMRR0_K1_LBSPPA128_LBSPPB512_MIWT1_1_PGR1_SU32_SUM0_SUS256_SVW1_TLDS1_VWA1_VWB1_WGM8_WGMXCC1_WGMXCCGn1
- - - [1, 1, 1, 1, 1, 1, 1, 1]
    - [5, 0.0]
  - - [64, 64, 1, 64, 64, 64, 64, 64]
    - [2, 0.01]
  - - [64, 64, 1, 512, 64, 64, 512, 64]
    - [8, 0.04]
  - - [64, 64, 1, 1024, 64, 64, 1024, 64]
    - [7, 0.08]
  - - [64, 64, 1, 2048, 64, 64, 2048, 64]
    - [7, 0.16]
  - - [127, 127, 1, 127, 127, 127, 127, 127]
    - [3, 0.04]
  - - [128, 128, 1, 128, 128, 128, 128, 128]
    - [6, 0.05]
  - - [129, 129, 1, 129, 129, 129, 129, 129]
    - [7, 0.04]
  - - [256, 256, 1, 256, 256, 256, 256, 256]
    - [9, 0.37]
  - - [512, 512, 1, 512, 512, 512, 512, 512]
    - [4, 2.54]
  - - [1024, 1024, 1, 1024, 1024, 1024, 1024, 1024]
    - [1, 10.77]
  - - [4096, 4096, 1, 4096, 4096, 4096, 4096, 4096]
    - [0, 29.39]
  - - [4096, 4096, 1, 4096, 4128, 4128, 4128, 4128]
    - [0, 29.27]
  - - [4096, 4096, 1, 4096, 4160, 4160, 4160, 4160]
    - [0, 29.3]
- null
- null
- DeviceEfficiency
- Equality
