library/src/amd_detail/rocblaslt/src/Tensile/Logic/asm_full/aquavanjaram/gfx942_38cu/StreamK/aquavanjaram942_Cijk_Ailk_Bjlk_BSS_BH_UserArgs.yaml
- {MinimumRequiredVersion: 4.33.0}
- aquavanjaram942
- {Architecture: gfx942, CUCount: 38}
- [Device 0049, Device 0050]
    SolutionIndex: 0
    SolutionNameMin: Cijk_Ailk_Bjlk_BSS_BH_UserArgs_MT256x256x32_MI16x16x1_SN_LDSB1_CLR1_GSU0_GSUC0_GSUWGMRR0_K1_LBSPPA2048_LBSPPB2048_LPA0_LPB16_MIWT8_8_PLR1_SU32_SUM0_SUS256_VWA4_VWB1_WGM1_WGMXCC1_WGMXCCGn1
    SolutionIndex: 1
    SolutionNameMin: Cijk_Ailk_Bjlk_BSS_BH_UserArgs_MT256x256x32_MI16x16x1_SN_LDSB1_CLR1_GSU0_GSUC0_GSUWGMRR0_K1_LBSPPA2048_LBSPPB2048_LPA0_LPB32_MIWT8_8_PLR1_SU32_SUM0_SUS256_VWA4_VWB2_WGM1_WGMXCC1_WGMXCCGn1
    SolutionIndex: 2
    SolutionNameMin: Cijk_Ailk_Bjlk_BSS_BH_UserArgs_MT256x256x32_MI16x16x1_SN_LDSB1_CLR1_GSU0_GSUC0_GSUWGMRR0_K1_LBSPPA2048_LBSPPB2048_LPA32_LPB0_MIWT8_8_PLR1_SU32_SUM0_SUS256_VWA2_VWB4_WGM1_WGMXCC1_WGMXCCGn1
    SolutionIndex: 3
    SolutionNameMin: Cijk_Ailk_Bjlk_BSS_BH_UserArgs_MT256x256x32_MI16x16x1_SN_LDSB0_CLR1_GSU0_GSUC0_GSUWGMRR0_K1_LBSPPA2048_LBSPPB2048_LPA0_LPB0_MIWT8_8_PLR1_SU32_SUM0_SUS256_VWA4_VWB4_WGM1_WGMXCC1_WGMXCCGn1
    SolutionIndex: 4
    SolutionNameMin: Cijk_Ailk_Bjlk_BSS_BH_UserArgs_MT256x256x32_MI16x16x1_SN_LDSB1_CLR1_GSU0_GSUC0_GSUWGMRR0_K1_LBSPPA2048_LBSPPB2048_LPA32_LPB0_MIWT8_8_PLR1_SU32_SUM0_SUS256_VWA2_VWB8_WGM1_WGMXCC1_WGMXCCGn1
    SolutionIndex: 5
    SolutionNameMin: Cijk_Ailk_Bjlk_BSS_BH_UserArgs_MT256x256x32_MI16x16x1_SN_LDSB0_CLR1_GSU0_GSUC0_GSUWGMRR0_K1_LBSPPA2048_LBSPPB2048_LPA0_LPB0_MIWT8_8_PLR1_SU32_SUM0_SUS256_VWA4_VWB8_WGM1_WGMXCC1_WGMXCCGn1
    SolutionIndex: 6
    SolutionNameMin: Cijk_Ailk_Bjlk_BSS_BH_UserArgs_MT256x256x32_MI16x16x1_SN_LDSB0_CLR1_GSU0_GSUC0_GSUWGMRR0_K1_LBSPPA2048_LBSPPB2048_LPA0_LPB0_MIWT8_8_PLR1_SU32_SUM0_SUS256_VWA8_VWB8_WGM1_WGMXCC1_WGMXCCGn1
    SolutionIndex: 7
    SolutionNameMin: Cijk_Ailk_Bjlk_BSS_BH_UserArgs_MT256x256x32_MI16x16x1_SN_LDSB1_CLR1_GSU0_GSUC0_GSUWGMRR0_K1_LBSPPA2048_LBSPPB2048_LPA0_LPB16_MIWT8_8_PLR1_SU32_SUM0_SUS256_VWA4_VWB1_WGM4_WGMXCC1_WGMXCCGn1
    SolutionIndex: 8
    SolutionNameMin: Cijk_Ailk_Bjlk_BSS_BH_UserArgs_MT256x256x32_MI16x16x1_SN_LDSB1_CLR1_GSU0_GSUC0_GSUWGMRR0_K1_LBSPPA2048_LBSPPB2048_LPA0_LPB32_MIWT8_8_PLR1_SU32_SUM0_SUS256_VWA4_VWB2_WGM4_WGMXCC1_WGMXCCGn1
    SolutionIndex: 9
    SolutionNameMin: Cijk_Ailk_Bjlk_BSS_BH_UserArgs_MT256x256x32_MI16x16x1_SN_LDSB1_CLR1_GSU0_GSUC0_GSUWGMRR0_K1_LBSPPA2048_LBSPPB2048_LPA32_LPB0_MIWT8_8_PLR1_SU32_SUM0_SUS256_VWA2_VWB4_WGM4_WGMXCC1_WGMXCCGn1
    SolutionIndex: 10
    SolutionNameMin: Cijk_Ailk_Bjlk_BSS_BH_UserArgs_MT256x256x32_MI16x16x1_SN_LDSB0_CLR1_GSU0_GSUC0_GSUWGMRR0_K1_LBSPPA2048_LBSPPB2048_LPA0_LPB0_MIWT8_8_PLR1_SU32_SUM0_SUS256_VWA4_VWB4_WGM4_WGMXCC1_WGMXCCGn1
    SolutionIndex: 11
    SolutionNameMin: Cijk_Ailk_Bjlk_BSS_BH_UserArgs_MT256x256x32_MI16x16x1_SN_LDSB1_CLR1_GSU0_GSUC0_GSUWGMRR0_K1_LBSPPA2048_LBSPPB2048_LPA32_LPB0_MIWT8_8_PLR1_SU32_SUM0_SUS256_VWA2_VWB8_WGM4_WGMXCC1_WGMXCCGn1
    SolutionIndex: 12
    SolutionNameMin: Cijk_Ailk_Bjlk_BSS_BH_UserArgs_MT256x256x32_MI16x16x1_SN_LDSB0_CLR1_GSU0_GSUC0_GSUWGMRR0_K1_LBSPPA2048_LBSPPB2048_LPA0_LPB0_MIWT8_8_PLR1_SU32_SUM0_SUS256_VWA4_VWB8_WGM4_WGMXCC1_WGMXCCGn1
    SolutionIndex: 13
    SolutionNameMin: Cijk_Ailk_Bjlk_BSS_BH_UserArgs_MT256x256x32_MI16x16x1_SN_LDSB1_CLR1_GSU0_GSUC0_GSUWGMRR0_K1_LBSPPA2048_LBSPPB2048_LPA0_LPB32_MIWT8_8_PLR1_SU32_SUM0_SUS256_VWA4_VWB2_WGM8_WGMXCC1_WGMXCCGn1
    SolutionIndex: 14
    SolutionNameMin: Cijk_Ailk_Bjlk_BSS_BH_UserArgs_MT256x256x32_MI16x16x1_SN_LDSB0_CLR1_GSU0_GSUC0_GSUWGMRR0_K1_LBSPPA2048_LBSPPB2048_LPA0_LPB0_MIWT8_8_PLR1_SU32_SUM0_SUS256_VWA4_VWB4_WGM8_WGMXCC1_WGMXCCGn1
    SolutionIndex: 15
    SolutionNameMin: Cijk_Ailk_Bjlk_BSS_BH_UserArgs_MT256x256x32_MI16x16x1_SN_LDSB1_CLR1_GSU0_GSUC0_GSUWGMRR0_K1_LBSPPA2048_LBSPPB2048_LPA32_LPB0_MIWT8_8_PLR1_SU32_SUM0_SUS256_VWA2_VWB8_WGM8_WGMXCC1_WGMXCCGn1
    SolutionIndex: 16
    SolutionNameMin: Cijk_Ailk_Bjlk_BSS_BH_UserArgs_MT256x256x32_MI16x16x1_SN_LDSB0_CLR1_GSU0_GSUC0_GSUWGMRR0_K1_LBSPPA2048_LBSPPB2048_LPA0_LPB0_MIWT8_8_PLR1_SU32_SUM0_SUS256_VWA4_VWB8_WGM8_WGMXCC1_WGMXCCGn1
    SolutionIndex: 17
    SolutionNameMin: Cijk_Ailk_Bjlk_BSS_BH_UserArgs_MT256x256x32_MI16x16x1_SN_LDSB0_CLR1_GSU0_GSUC0_GSUWGMRR0_K1_LBSPPA2048_LBSPPB2048_LPA0_LPB0_MIWT8_8_PLR1_SU32_SUM0_SUS256_VWA8_VWB8_WGM8_WGMXCC1_WGMXCCGn1
    SolutionIndex: 18
    SolutionNameMin: Cijk_Ailk_Bjlk_BSS_BH_UserArgs_MT128x256x32_MI16x16x1_SN_LDSB1_CLR1_GSU0_GSUC0_GSUWGMRR0_K1_LBSPPA1024_LBSPPB2048_LPA0_LPB16_MIWT4_8_PLR1_SU32_SUM0_SUS256_VWA4_VWB1_WGM1_WGMXCC1_WGMXCCGn1
    SolutionIndex: 19
    SolutionNameMin: Cijk_Ailk_Bjlk_BSS_BH_UserArgs_MT128x256x32_MI16x16x1_SN_LDSB1_CLR1_GSU0_GSUC0_GSUWGMRR0_K1_LBSPPA1024_LBSPPB2048_LPA0_LPB32_MIWT4_8_PLR1_SU32_SUM0_SUS256_VWA4_VWB2_WGM1_WGMXCC1_WGMXCCGn1
    SolutionIndex: 20
    SolutionNameMin: Cijk_Ailk_Bjlk_BSS_BH_UserArgs_MT128x256x32_MI16x16x1_SN_LDSB1_CLR1_GSU0_GSUC0_GSUWGMRR0_K1_LBSPPA1024_LBSPPB2048_LPA0_LPB0_MIWT4_8_PLR1_SU32_SUM0_SUS256_VWA4_VWB4_WGM1_WGMXCC1_WGMXCCGn1
    SolutionIndex: 21
    SolutionNameMin: Cijk_Ailk_Bjlk_BSS_BH_UserArgs_MT128x256x32_MI16x16x1_SN_LDSB1_CLR1_GSU0_GSUC0_GSUWGMRR0_K1_LBSPPA1024_LBSPPB2048_LPA0_LPB0_MIWT4_8_PLR1_SU32_SUM0_SUS256_VWA4_VWB8_WGM1_WGMXCC1_WGMXCCGn1
    SolutionIndex: 22
    SolutionNameMin: Cijk_Ailk_Bjlk_BSS_BH_UserArgs_MT128x256x32_MI16x16x1_SN_LDSB1_CLR1_GSU0_GSUC0_GSUWGMRR0_K1_LBSPPA1024_LBSPPB2048_LPA0_LPB32_MIWT4_8_PLR1_SU32_SUM0_SUS256_VWA4_VWB2_WGM4_WGMXCC1_WGMXCCGn1
    SolutionIndex: 23
    SolutionNameMin: Cijk_Ailk_Bjlk_BSS_BH_UserArgs_MT128x256x32_MI16x16x1_SN_LDSB1_CLR1_GSU0_GSUC0_GSUWGMRR0_K1_LBSPPA1024_LBSPPB2048_LPA0_LPB0_MIWT4_8_PLR1_SU32_SUM0_SUS256_VWA4_VWB8_WGM4_WGMXCC1_WGMXCCGn1
    SolutionIndex: 24
    SolutionNameMin: Cijk_Ailk_Bjlk_BSS_BH_UserArgs_MT128x256x32_MI16x16x1_SN_LDSB1_CLR1_GSU0_GSUC0_GSUWGMRR0_K1_LBSPPA1024_LBSPPB2048_LPA0_LPB32_MIWT4_8_PLR1_SU32_SUM0_SUS256_VWA4_VWB2_WGM8_WGMXCC1_WGMXCCGn1
    SolutionIndex: 25
    SolutionNameMin: Cijk_Ailk_Bjlk_BSS_BH_UserArgs_MT128x256x32_MI16x16x1_SN_LDSB1_CLR1_GSU0_GSUC0_GSUWGMRR0_K1_LBSPPA1024_LBSPPB2048_LPA0_LPB0_MIWT4_8_PLR1_SU32_SUM0_SUS256_VWA4_VWB4_WGM8_WGMXCC1_WGMXCCGn1
    SolutionIndex: 26
    SolutionNameMin: Cijk_Ailk_Bjlk_BSS_BH_UserArgs_MT128x256x32_MI16x16x1_SN_LDSB1_CLR1_GSU0_GSUC0_GSUWGMRR0_K1_LBSPPA1024_LBSPPB2048_LPA0_LPB0_MIWT4_8_PLR1_SU32_SUM0_SUS256_VWA4_VWB8_WGM8_WGMXCC1_WGMXCCGn1
    SolutionIndex: 27
    SolutionNameMin: Cijk_Ailk_Bjlk_BSS_BH_UserArgs_MT256x128x32_MI16x16x1_SN_LDSB1_CLR1_GSU0_GSUC0_GSUWGMRR0_K1_LBSPPA2048_LBSPPB1024_LPA32_LPB16_MIWT8_4_PLR1_SU32_SUM0_SUS256_VWA2_VWB1_WGM1_WGMXCC1_WGMXCCGn1
    SolutionIndex: 28
    SolutionNameMin: Cijk_Ailk_Bjlk_BSS_BH_UserArgs_MT256x128x32_MI16x16x1_SN_LDSB1_CLR1_GSU0_GSUC0_GSUWGMRR0_K1_LBSPPA2048_LBSPPB1024_LPA0_LPB16_MIWT8_4_PLR1_SU32_SUM0_SUS256_VWA4_VWB1_WGM1_WGMXCC1_WGMXCCGn1
    SolutionIndex: 29
    SolutionNameMin: Cijk_Ailk_Bjlk_BSS_BH_UserArgs_MT256x128x32_MI16x16x1_SN_LDSB1_CLR1_GSU0_GSUC0_GSUWGMRR0_K1_LBSPPA2048_LBSPPB1024_LPA0_LPB32_MIWT8_4_PLR1_SU32_SUM0_SUS256_VWA4_VWB2_WGM1_WGMXCC1_WGMXCCGn1
    SolutionIndex: 30
    SolutionNameMin: Cijk_Ailk_Bjlk_BSS_BH_UserArgs_MT256x128x32_MI16x16x1_SN_LDSB1_CLR1_GSU0_GSUC0_GSUWGMRR0_K1_LBSPPA2048_LBSPPB1024_LPA32_LPB0_MIWT8_4_PLR1_SU32_SUM0_SUS256_VWA2_VWB4_WGM1_WGMXCC1_WGMXCCGn1
    SolutionIndex: 31
    SolutionNameMin: Cijk_Ailk_Bjlk_BSS_BH_UserArgs_MT256x128x32_MI16x16x1_SN_LDSB1_CLR1_GSU0_GSUC0_GSUWGMRR0_K1_LBSPPA2048_LBSPPB1024_LPA0_LPB0_MIWT8_4_PLR1_SU32_SUM0_SUS256_VWA4_VWB4_WGM1_WGMXCC1_WGMXCCGn1
    SolutionIndex: 32
    SolutionNameMin: Cijk_Ailk_Bjlk_BSS_BH_UserArgs_MT256x128x32_MI16x16x1_SN_LDSB1_CLR1_GSU0_GSUC0_GSUWGMRR0_K1_LBSPPA2048_LBSPPB1024_LPA0_LPB16_MIWT8_4_PLR1_SU32_SUM0_SUS256_VWA4_VWB1_WGM8_WGMXCC1_WGMXCCGn1
    SolutionIndex: 33
    SolutionNameMin: Cijk_Ailk_Bjlk_BSS_BH_UserArgs_MT256x128x32_MI16x16x1_SN_LDSB1_CLR1_GSU0_GSUC0_GSUWGMRR0_K1_LBSPPA2048_LBSPPB1024_LPA0_LPB32_MIWT8_4_PLR1_SU32_SUM0_SUS256_VWA4_VWB2_WGM8_WGMXCC1_WGMXCCGn1
    SolutionIndex: 34
    SolutionNameMin: Cijk_Ailk_Bjlk_BSS_BH_UserArgs_MT256x128x32_MI16x16x1_SN_LDSB1_CLR1_GSU0_GSUC0_GSUWGMRR0_K1_LBSPPA2048_LBSPPB1024_LPA0_LPB0_MIWT8_4_PLR1_SU32_SUM0_SUS256_VWA4_VWB4_WGM8_WGMXCC1_WGMXCCGn1
    SolutionIndex: 35
    SolutionNameMin: Cijk_Ailk_Bjlk_BSS_BH_UserArgs_MT128x128x32_MI16x16x1_SN_LDSB1_CLR1_GSU0_GSUC0_GSUWGMRR0_K1_LBSPPA1024_LBSPPB1024_LPA0_LPB16_MIWT4_4_PLR1_SU32_SUM0_SUS256_VWA4_VWB1_WGM1_WGMXCC1_WGMXCCGn1
    SolutionIndex: 36
    SolutionNameMin: Cijk_Ailk_Bjlk_BSS_BH_UserArgs_MT128x128x32_MI16x16x1_SN_LDSB1_CLR1_GSU0_GSUC0_GSUWGMRR0_K1_LBSPPA1024_LBSPPB1024_LPA0_LPB32_MIWT4_4_PLR1_SU32_SUM0_SUS256_VWA4_VWB2_WGM1_WGMXCC1_WGMXCCGn1
    SolutionIndex: 37
    SolutionNameMin: Cijk_Ailk_Bjlk_BSS_BH_UserArgs_MT128x128x32_MI16x16x1_SN_LDSB1_CLR1_GSU0_GSUC0_GSUWGMRR0_K1_LBSPPA1024_LBSPPB1024_LPA0_LPB32_MIWT4_4_PLR1_SU32_SUM0_SUS256_VWA4_VWB2_WGM4_WGMXCC1_WGMXCCGn1
    SolutionIndex: 38
    SolutionNameMin: Cijk_Ailk_Bjlk_BSS_BH_UserArgs_MT128x128x32_MI16x16x1_SN_LDSB1_CLR1_GSU0_GSUC0_GSUWGMRR0_K1_LBSPPA1024_LBSPPB1024_LPA32_LPB16_MIWT4_4_PLR1_SU32_SUM0_SUS256_VWA2_VWB1_WGM8_WGMXCC1_WGMXCCGn1
    SolutionIndex: 39
    SolutionNameMin: Cijk_Ailk_Bjlk_BSS_BH_UserArgs_MT128x128x32_MI16x16x1_SN_LDSB1_CLR1_GSU0_GSUC0_GSUWGMRR0_K1_LBSPPA1024_LBSPPB1024_LPA0_LPB32_MIWT4_4_PLR1_SU32_SUM0_SUS256_VWA4_VWB2_WGM8_WGMXCC1_WGMXCCGn1
    SolutionIndex: 40
    SolutionNameMin: Cijk_Ailk_Bjlk_BSS_BH_UserArgs_MT64x128x32_MI16x16x1_SN_LDSB0_CLR1_GSU0_GSUC0_GSUWGMRR0_K1_LBSPPA512_LBSPPB1024_LPA16_LPB32_MIWT2_4_PLR1_SU32_SUM0_SUS256_VWA1_VWB2_WGM1_WGMXCC1_WGMXCCGn1
    SolutionIndex: 41
    SolutionNameMin: Cijk_Ailk_Bjlk_BSS_BH_UserArgs_MT64x128x32_MI16x16x1_SN_LDSB0_CLR1_GSU0_GSUC0_GSUWGMRR0_K1_LBSPPA512_LBSPPB1024_LPA16_LPB0_MIWT2_4_PLR1_SU32_SUM0_SUS256_VWA1_VWB4_WGM1_WGMXCC1_WGMXCCGn1
    SolutionIndex: 42
    SolutionNameMin: Cijk_Ailk_Bjlk_BSS_BH_UserArgs_MT128x64x32_MI16x16x1_SN_LDSB0_CLR1_GSU0_GSUC0_GSUWGMRR0_K1_LBSPPA1024_LBSPPB512_LPA0_LPB32_MIWT4_2_PLR1_SU32_SUM0_SUS256_VWA4_VWB2_WGM1_WGMXCC1_WGMXCCGn1
    SolutionIndex: 43
    SolutionNameMin: Cijk_Ailk_Bjlk_BSS_BH_UserArgs_MT128x64x32_MI16x16x1_SN_LDSB0_CLR1_GSU0_GSUC0_GSUWGMRR0_K1_LBSPPA1024_LBSPPB512_LPA0_LPB16_MIWT4_2_PLR1_SU32_SUM0_SUS256_VWA4_VWB1_WGM4_WGMXCC1_WGMXCCGn1
    SolutionIndex: 44
    SolutionNameMin: Cijk_Ailk_Bjlk_BSS_BH_UserArgs_MT128x64x32_MI16x16x1_SN_LDSB0_CLR1_GSU0_GSUC0_GSUWGMRR0_K1_LBSPPA1024_LBSPPB512_LPA0_LPB16_MIWT4_2_PLR1_SU32_SUM0_SUS256_VWA4_VWB1_WGM8_WGMXCC1_WGMXCCGn1
    SolutionIndex: 45
    SolutionNameMin: Cijk_Ailk_Bjlk_BSS_BH_UserArgs_MT128x64x32_MI16x16x1_SN_LDSB0_CLR1_GSU0_GSUC0_GSUWGMRR0_K1_LBSPPA1024_LBSPPB512_LPA0_LPB32_MIWT4_2_PLR1_SU32_SUM0_SUS256_VWA4_VWB2_WGM8_WGMXCC1_WGMXCCGn1
    SolutionIndex: 46
    SolutionNameMin: Cijk_Ailk_Bjlk_BSS_BH_UserArgs_MT128x32x32_MI16x16x1_SN_LDSB0_CLR1_GSU0_GSUC0_GSUWGMRR0_K1_LBSPPA1024_LBSPPB256_LPA32_LPB16_MIWT4_1_PLR1_SU32_SUM0_SUS256_VWA2_VWB1_WGM8_WGMXCC1_WGMXCCGn1
    SolutionIndex: 47
    SolutionNameMin: Cijk_Ailk_Bjlk_BSS_BH_UserArgs_MT64x64x32_MI16x16x1_SN_LDSB0_CLR1_GSU0_GSUC0_GSUWGMRR0_K1_LBSPPA512_LBSPPB512_LPA32_LPB32_MIWT2_2_PLR1_SU32_SUM0_SUS256_VWA2_VWB2_WGM4_WGMXCC1_WGMXCCGn1
    SolutionIndex: 48
    SolutionNameMin: Cijk_Ailk_Bjlk_BSS_BH_UserArgs_MT64x64x32_MI16x16x1_SN_LDSB0_CLR0_GSU0_GSUC0_GSUWGMRR0_K1_LBSPPA512_LBSPPB512_LPA32_LPB32_MIWT2_2_PLR0_SU32_SUM0_SUS256_VWA2_VWB2_WGM8_WGMXCC1_WGMXCCGn1
    SolutionIndex: 49
    SolutionNameMin: Cijk_Ailk_Bjlk_BSS_BH_UserArgs_MT256x256x64_MI16x16x1_SN_LDSB1_CLR1_GSU0_GSUC0_GSUWGMRR0_K1_LBSPPA2048_LBSPPB2048_LPA0_LPB0_MIWT8_8_PLR1_SU32_SUM0_SUS256_VWA4_VWB4_WGM1_WGMXCC1_WGMXCCGn1
    SolutionIndex: 50
    SolutionNameMin: Cijk_Ailk_Bjlk_BSS_BH_UserArgs_MT256x256x64_MI16x16x1_SN_LDSB1_CLR1_GSU0_GSUC0_GSUWGMRR0_K1_LBSPPA2048_LBSPPB2048_LPA0_LPB0_MIWT8_8_PLR2_SU32_SUM0_SUS256_VWA4_VWB4_WGM1_WGMXCC1_WGMXCCGn1
    SolutionIndex: 51
    SolutionNameMin: Cijk_Ailk_Bjlk_BSS_BH_UserArgs_MT256x256x64_MI16x16x1_SN_LDSB1_CLR1_GSU0_GSUC0_GSUWGMRR0_K1_LBSPPA2048_LBSPPB2048_LPA0_LPB0_MIWT8_8_PLR1_SU32_SUM0_SUS256_VWA4_VWB4_WGM4_WGMXCC1_WGMXCCGn1
    SolutionIndex: 52
    SolutionNameMin: Cijk_Ailk_Bjlk_BSS_BH_UserArgs_MT256x256x64_MI16x16x1_SN_LDSB1_CLR1_GSU0_GSUC0_GSUWGMRR0_K1_LBSPPA2048_LBSPPB2048_LPA0_LPB0_MIWT8_8_PLR2_SU32_SUM0_SUS256_VWA4_VWB4_WGM4_WGMXCC1_WGMXCCGn1
    SolutionIndex: 53
    SolutionNameMin: Cijk_Ailk_Bjlk_BSS_BH_UserArgs_MT256x256x64_MI16x16x1_SN_LDSB1_CLR1_GSU0_GSUC0_GSUWGMRR0_K1_LBSPPA2048_LBSPPB2048_LPA0_LPB0_MIWT8_8_PLR1_SU32_SUM0_SUS256_VWA4_VWB4_WGM8_WGMXCC1_WGMXCCGn1
    SolutionIndex: 54
    SolutionNameMin: Cijk_Ailk_Bjlk_BSS_BH_UserArgs_MT256x256x64_MI16x16x1_SN_LDSB1_CLR1_GSU0_GSUC0_GSUWGMRR0_K1_LBSPPA2048_LBSPPB2048_LPA0_LPB0_MIWT8_8_PLR1_SU32_SUM0_SUS256_VWA4_VWB8_WGM8_WGMXCC1_WGMXCCGn1
    SolutionIndex: 55
    SolutionNameMin: Cijk_Ailk_Bjlk_BSS_BH_UserArgs_MT256x256x64_MI16x16x1_SN_LDSB1_CLR1_GSU0_GSUC0_GSUWGMRR0_K1_LBSPPA2048_LBSPPB2048_LPA0_LPB0_MIWT8_8_PLR2_SU32_SUM0_SUS256_VWA4_VWB4_WGM8_WGMXCC1_WGMXCCGn1
    SolutionIndex: 56
    SolutionNameMin: Cijk_Ailk_Bjlk_BSS_BH_UserArgs_MT256x256x64_MI16x16x1_SN_LDSB1_CLR1_GSU0_GSUC0_GSUWGMRR0_K1_LBSPPA2048_LBSPPB2048_LPA0_LPB0_MIWT8_8_PLR2_SU32_SUM0_SUS256_VWA4_VWB8_WGM8_WGMXCC1_WGMXCCGn1
    SolutionIndex: 57
    SolutionNameMin: Cijk_Ailk_Bjlk_BSS_BH_UserArgs_MT128x256x64_MI16x16x1_SN_LDSB1_CLR1_GSU0_GSUC0_GSUWGMRR0_K1_LBSPPA1024_LBSPPB2048_LPA0_LPB32_MIWT4_8_PLR1_SU32_SUM0_SUS256_VWA4_VWB2_WGM1_WGMXCC1_WGMXCCGn1
    SolutionIndex: 58
    SolutionNameMin: Cijk_Ailk_Bjlk_BSS_BH_UserArgs_MT128x256x64_MI16x16x1_SN_LDSB1_CLR1_GSU0_GSUC0_GSUWGMRR0_K1_LBSPPA1024_LBSPPB2048_LPA32_LPB0_MIWT4_8_PLR1_SU32_SUM0_SUS256_VWA2_VWB4_WGM1_WGMXCC1_WGMXCCGn1
    SolutionIndex: 59
    SolutionNameMin: Cijk_Ailk_Bjlk_BSS_BH_UserArgs_MT128x256x64_MI16x16x1_SN_LDSB1_CLR1_GSU0_GSUC0_GSUWGMRR0_K1_LBSPPA1024_LBSPPB2048_LPA0_LPB0_MIWT4_8_PLR1_SU32_SUM0_SUS256_VWA4_VWB4_WGM1_WGMXCC1_WGMXCCGn1
    SolutionIndex: 60
    SolutionNameMin: Cijk_Ailk_Bjlk_BSS_BH_UserArgs_MT128x256x64_MI16x16x1_SN_LDSB1_CLR1_GSU0_GSUC0_GSUWGMRR0_K1_LBSPPA1024_LBSPPB2048_LPA32_LPB0_MIWT4_8_PLR2_SU32_SUM0_SUS256_VWA2_VWB4_WGM1_WGMXCC1_WGMXCCGn1
    SolutionIndex: 61
    SolutionNameMin: Cijk_Ailk_Bjlk_BSS_BH_UserArgs_MT128x256x64_MI16x16x1_SN_LDSB1_CLR1_GSU0_GSUC0_GSUWGMRR0_K1_LBSPPA1024_LBSPPB2048_LPA0_LPB0_MIWT4_8_PLR2_SU32_SUM0_SUS256_VWA4_VWB4_WGM1_WGMXCC1_WGMXCCGn1
    SolutionIndex: 62
    SolutionNameMin: Cijk_Ailk_Bjlk_BSS_BH_UserArgs_MT128x256x64_MI16x16x1_SN_LDSB1_CLR1_GSU0_GSUC0_GSUWGMRR0_K1_LBSPPA1024_LBSPPB2048_LPA0_LPB0_MIWT4_8_PLR1_SU32_SUM0_SUS256_VWA4_VWB4_WGM4_WGMXCC1_WGMXCCGn1
    SolutionIndex: 63
    SolutionNameMin: Cijk_Ailk_Bjlk_BSS_BH_UserArgs_MT128x256x64_MI16x16x1_SN_LDSB1_CLR1_GSU0_GSUC0_GSUWGMRR0_K1_LBSPPA1024_LBSPPB2048_LPA0_LPB0_MIWT4_8_PLR2_SU32_SUM0_SUS256_VWA4_VWB4_WGM4_WGMXCC1_WGMXCCGn1
    SolutionIndex: 64
    SolutionNameMin: Cijk_Ailk_Bjlk_BSS_BH_UserArgs_MT128x256x64_MI16x16x1_SN_LDSB1_CLR1_GSU0_GSUC0_GSUWGMRR0_K1_LBSPPA1024_LBSPPB2048_LPA32_LPB0_MIWT4_8_PLR1_SU32_SUM0_SUS256_VWA2_VWB4_WGM8_WGMXCC1_WGMXCCGn1
    SolutionIndex: 65
    SolutionNameMin: Cijk_Ailk_Bjlk_BSS_BH_UserArgs_MT128x256x64_MI16x16x1_SN_LDSB1_CLR1_GSU0_GSUC0_GSUWGMRR0_K1_LBSPPA1024_LBSPPB2048_LPA0_LPB0_MIWT4_8_PLR1_SU32_SUM0_SUS256_VWA4_VWB4_WGM8_WGMXCC1_WGMXCCGn1
    SolutionIndex: 66
    SolutionNameMin: Cijk_Ailk_Bjlk_BSS_BH_UserArgs_MT256x128x64_MI16x16x1_SN_LDSB1_CLR1_GSU0_GSUC0_GSUWGMRR0_K1_LBSPPA2048_LBSPPB1024_LPA0_LPB16_MIWT8_4_PLR1_SU32_SUM0_SUS256_VWA4_VWB1_WGM1_WGMXCC1_WGMXCCGn1
    SolutionIndex: 67
    SolutionNameMin: Cijk_Ailk_Bjlk_BSS_BH_UserArgs_MT256x128x64_MI16x16x1_SN_LDSB1_CLR1_GSU0_GSUC0_GSUWGMRR0_K1_LBSPPA2048_LBSPPB1024_LPA0_LPB32_MIWT8_4_PLR1_SU32_SUM0_SUS256_VWA4_VWB2_WGM1_WGMXCC1_WGMXCCGn1
    SolutionIndex: 68
    SolutionNameMin: Cijk_Ailk_Bjlk_BSS_BH_UserArgs_MT256x128x64_MI16x16x1_SN_LDSB1_CLR1_GSU0_GSUC0_GSUWGMRR0_K1_LBSPPA2048_LBSPPB1024_LPA0_LPB0_MIWT8_4_PLR1_SU32_SUM0_SUS256_VWA4_VWB4_WGM1_WGMXCC1_WGMXCCGn1
    SolutionIndex: 69
    SolutionNameMin: Cijk_Ailk_Bjlk_BSS_BH_UserArgs_MT256x128x64_MI16x16x1_SN_LDSB1_CLR1_GSU0_GSUC0_GSUWGMRR0_K1_LBSPPA2048_LBSPPB1024_LPA0_LPB32_MIWT8_4_PLR2_SU32_SUM0_SUS256_VWA4_VWB2_WGM1_WGMXCC1_WGMXCCGn1
    SolutionIndex: 70
    SolutionNameMin: Cijk_Ailk_Bjlk_BSS_BH_UserArgs_MT256x128x64_MI16x16x1_SN_LDSB1_CLR1_GSU0_GSUC0_GSUWGMRR0_K1_LBSPPA2048_LBSPPB1024_LPA0_LPB32_MIWT8_4_PLR1_SU32_SUM0_SUS256_VWA4_VWB2_WGM4_WGMXCC1_WGMXCCGn1
    SolutionIndex: 71
    SolutionNameMin: Cijk_Ailk_Bjlk_BSS_BH_UserArgs_MT256x128x64_MI16x16x1_SN_LDSB1_CLR1_GSU0_GSUC0_GSUWGMRR0_K1_LBSPPA2048_LBSPPB1024_LPA0_LPB0_MIWT8_4_PLR1_SU32_SUM0_SUS256_VWA4_VWB4_WGM4_WGMXCC1_WGMXCCGn1
    SolutionIndex: 72
    SolutionNameMin: Cijk_Ailk_Bjlk_BSS_BH_UserArgs_MT256x128x64_MI16x16x1_SN_LDSB1_CLR1_GSU0_GSUC0_GSUWGMRR0_K1_LBSPPA2048_LBSPPB1024_LPA0_LPB0_MIWT8_4_PLR1_SU32_SUM0_SUS256_VWA4_VWB4_WGM8_WGMXCC1_WGMXCCGn1
    SolutionIndex: 73
    SolutionNameMin: Cijk_Ailk_Bjlk_BSS_BH_UserArgs_MT128x128x64_MI16x16x1_SN_LDSB1_CLR1_GSU0_GSUC0_GSUWGMRR0_K1_LBSPPA1024_LBSPPB1024_LPA0_LPB32_MIWT4_4_PLR1_SU32_SUM0_SUS256_VWA4_VWB2_WGM1_WGMXCC1_WGMXCCGn1
    SolutionIndex: 74
    SolutionNameMin: Cijk_Ailk_Bjlk_BSS_BH_UserArgs_MT128x128x64_MI16x16x1_SN_LDSB1_CLR1_GSU0_GSUC0_GSUWGMRR0_K1_LBSPPA1024_LBSPPB1024_LPA0_LPB0_MIWT4_4_PLR1_SU32_SUM0_SUS256_VWA4_VWB4_WGM1_WGMXCC1_WGMXCCGn1
    SolutionIndex: 75
    SolutionNameMin: Cijk_Ailk_Bjlk_BSS_BH_UserArgs_MT128x128x64_MI16x16x1_SN_LDSB1_CLR1_GSU0_GSUC0_GSUWGMRR0_K1_LBSPPA1024_LBSPPB1024_LPA0_LPB0_MIWT4_4_PLR2_SU32_SUM0_SUS256_VWA4_VWB4_WGM1_WGMXCC1_WGMXCCGn1
    SolutionIndex: 76
    SolutionNameMin: Cijk_Ailk_Bjlk_BSS_BH_UserArgs_MT128x128x64_MI16x16x1_SN_LDSB1_CLR1_GSU0_GSUC0_GSUWGMRR0_K1_LBSPPA1024_LBSPPB1024_LPA0_LPB0_MIWT4_4_PLR1_SU32_SUM0_SUS256_VWA4_VWB4_WGM4_WGMXCC1_WGMXCCGn1
    SolutionIndex: 77
    SolutionNameMin: Cijk_Ailk_Bjlk_BSS_BH_UserArgs_MT128x128x64_MI16x16x1_SN_LDSB1_CLR1_GSU0_GSUC0_GSUWGMRR0_K1_LBSPPA1024_LBSPPB1024_LPA0_LPB0_MIWT4_4_PLR2_SU32_SUM0_SUS256_VWA4_VWB4_WGM4_WGMXCC1_WGMXCCGn1
    SolutionIndex: 78
    SolutionNameMin: Cijk_Ailk_Bjlk_BSS_BH_UserArgs_MT128x128x64_MI16x16x1_SN_LDSB1_CLR1_GSU0_GSUC0_GSUWGMRR0_K1_LBSPPA1024_LBSPPB1024_LPA0_LPB0_MIWT4_4_PLR1_SU32_SUM0_SUS256_VWA4_VWB4_WGM8_WGMXCC1_WGMXCCGn1
    SolutionIndex: 79
    SolutionNameMin: Cijk_Ailk_Bjlk_BSS_BH_UserArgs_MT128x128x64_MI16x16x1_SN_LDSB1_CLR1_GSU0_GSUC0_GSUWGMRR0_K1_LBSPPA1024_LBSPPB1024_LPA0_LPB32_MIWT4_4_PLR2_SU32_SUM0_SUS256_VWA4_VWB2_WGM8_WGMXCC1_WGMXCCGn1
    SolutionIndex: 80
    SolutionNameMin: Cijk_Ailk_Bjlk_BSS_BH_UserArgs_MT64x128x64_MI16x16x1_SN_LDSB1_CLR1_GSU0_GSUC0_GSUWGMRR0_K1_LBSPPA512_LBSPPB1024_LPA16_LPB32_MIWT2_4_PLR2_SU32_SUM0_SUS256_VWA1_VWB2_WGM8_WGMXCC1_WGMXCCGn1
    SolutionIndex: 81
    SolutionNameMin: Cijk_Ailk_Bjlk_BSS_BH_UserArgs_MT128x64x64_MI16x16x1_SN_LDSB1_CLR1_GSU0_GSUC0_GSUWGMRR0_K1_LBSPPA1024_LBSPPB512_LPA0_LPB32_MIWT4_2_PLR1_SU32_SUM0_SUS256_VWA4_VWB2_WGM1_WGMXCC1_WGMXCCGn1
    SolutionIndex: 82
    SolutionNameMin: Cijk_Ailk_Bjlk_BSS_BH_UserArgs_MT128x64x64_MI16x16x1_SN_LDSB1_CLR1_GSU0_GSUC0_GSUWGMRR0_K1_LBSPPA1024_LBSPPB512_LPA0_LPB32_MIWT4_2_PLR2_SU32_SUM0_SUS256_VWA4_VWB2_WGM1_WGMXCC1_WGMXCCGn1
    SolutionIndex: 83
    SolutionNameMin: Cijk_Ailk_Bjlk_BSS_BH_UserArgs_MT128x64x64_MI16x16x1_SN_LDSB1_CLR1_GSU0_GSUC0_GSUWGMRR0_K1_LBSPPA1024_LBSPPB512_LPA0_LPB16_MIWT4_2_PLR2_SU32_SUM0_SUS256_VWA4_VWB1_WGM4_WGMXCC1_WGMXCCGn1
    SolutionIndex: 84
    SolutionNameMin: Cijk_Ailk_Bjlk_BSS_BH_UserArgs_MT128x64x64_MI16x16x1_SN_LDSB1_CLR1_GSU0_GSUC0_GSUWGMRR0_K1_LBSPPA1024_LBSPPB512_LPA0_LPB32_MIWT4_2_PLR2_SU32_SUM0_SUS256_VWA4_VWB2_WGM4_WGMXCC1_WGMXCCGn1
    SolutionIndex: 85
    SolutionNameMin: Cijk_Ailk_Bjlk_BSS_BH_UserArgs_MT128x64x64_MI16x16x1_SN_LDSB1_CLR1_GSU0_GSUC0_GSUWGMRR0_K1_LBSPPA1024_LBSPPB512_LPA0_LPB32_MIWT4_2_PLR2_SU32_SUM0_SUS256_VWA4_VWB2_WGM8_WGMXCC1_WGMXCCGn1
    SolutionIndex: 86
    SolutionNameMin: Cijk_Ailk_Bjlk_BSS_BH_UserArgs_MT64x64x64_MI16x16x1_SN_LDSB1_CLR1_GSU0_GSUC0_GSUWGMRR0_K1_LBSPPA512_LBSPPB512_LPA32_LPB32_MIWT2_2_PLR1_SU32_SUM0_SUS256_VWA2_VWB2_WGM1_WGMXCC1_WGMXCCGn1
    SolutionIndex: 87
    SolutionNameMin: Cijk_Ailk_Bjlk_BSS_BH_UserArgs_MT64x64x64_MI16x16x1_SN_LDSB1_CLR1_GSU0_GSUC0_GSUWGMRR0_K1_LBSPPA512_LBSPPB512_LPA32_LPB16_MIWT2_2_PLR2_SU32_SUM0_SUS256_VWA2_VWB1_WGM1_WGMXCC1_WGMXCCGn1
    SolutionIndex: 88
    SolutionNameMin: Cijk_Ailk_Bjlk_BSS_BH_UserArgs_MT64x64x64_MI16x16x1_SN_LDSB1_CLR1_GSU0_GSUC0_GSUWGMRR0_K1_LBSPPA512_LBSPPB512_LPA16_LPB32_MIWT2_2_PLR2_SU32_SUM0_SUS256_VWA1_VWB2_WGM1_WGMXCC1_WGMXCCGn1
    SolutionIndex: 89
    SolutionNameMin: Cijk_Ailk_Bjlk_BSS_BH_UserArgs_MT64x64x64_MI16x16x1_SN_LDSB1_CLR1_GSU0_GSUC0_GSUWGMRR0_K1_LBSPPA512_LBSPPB512_LPA32_LPB32_MIWT2_2_PLR2_SU32_SUM0_SUS256_VWA2_VWB2_WGM1_WGMXCC1_WGMXCCGn1
    SolutionIndex: 90
    SolutionNameMin: Cijk_Ailk_Bjlk_BSS_BH_UserArgs_MT64x64x64_MI16x16x1_SN_LDSB1_CLR1_GSU0_GSUC0_GSUWGMRR0_K1_LBSPPA512_LBSPPB512_LPA32_LPB32_MIWT2_2_PLR1_SU32_SUM0_SUS256_VWA2_VWB2_WGM8_WGMXCC1_WGMXCCGn1
    SolutionIndex: 91
    SolutionNameMin: Cijk_Ailk_Bjlk_BSS_BH_UserArgs_MT32x64x64_MI16x16x1_SN_LDSB0_CLR1_GSU0_GSUC0_GSUWGMRR0_K1_LBSPPA256_LBSPPB512_LPA16_LPB16_MIWT1_2_PLR1_SU32_SUM0_SUS256_VWA1_VWB1_WGM1_WGMXCC1_WGMXCCGn1
    SolutionIndex: 92
    SolutionNameMin: Cijk_Ailk_Bjlk_BSS_BH_UserArgs_MT32x64x64_MI16x16x1_SN_LDSB0_CLR1_GSU0_GSUC0_GSUWGMRR0_K1_LBSPPA256_LBSPPB512_LPA16_LPB32_MIWT1_2_PLR1_SU32_SUM0_SUS256_VWA1_VWB2_WGM1_WGMXCC1_WGMXCCGn1
    SolutionIndex: 93
    SolutionNameMin: Cijk_Ailk_Bjlk_BSS_BH_UserArgs_MT32x64x64_MI16x16x1_SN_LDSB0_CLR1_GSU0_GSUC0_GSUWGMRR0_K1_LBSPPA256_LBSPPB512_LPA16_LPB32_MIWT1_2_PLR2_SU32_SUM0_SUS256_VWA1_VWB2_WGM1_WGMXCC1_WGMXCCGn1
    SolutionIndex: 94
    SolutionNameMin: Cijk_Ailk_Bjlk_BSS_BH_UserArgs_MT32x64x64_MI16x16x1_SN_LDSB0_CLR1_GSU0_GSUC0_GSUWGMRR0_K1_LBSPPA256_LBSPPB512_LPA16_LPB32_MIWT1_2_PLR2_SU32_SUM0_SUS256_VWA1_VWB2_WGM4_WGMXCC1_WGMXCCGn1
    SolutionIndex: 95
    SolutionNameMin: Cijk_Ailk_Bjlk_BSS_BH_UserArgs_MT32x64x64_MI16x16x1_SN_LDSB0_CLR1_GSU0_GSUC0_GSUWGMRR0_K1_LBSPPA256_LBSPPB512_LPA16_LPB16_MIWT1_2_PLR1_SU32_SUM0_SUS256_VWA1_VWB1_WGM8_WGMXCC1_WGMXCCGn1
    SolutionIndex: 96
    SolutionNameMin: Cijk_Ailk_Bjlk_BSS_BH_UserArgs_MT64x32x64_MI16x16x1_SN_LDSB0_CLR1_GSU0_GSUC0_GSUWGMRR0_K1_LBSPPA512_LBSPPB256_LPA32_LPB16_MIWT2_1_PLR2_SU32_SUM0_SUS256_VWA2_VWB1_WGM4_WGMXCC1_WGMXCCGn1
    SolutionIndex: 97
    SolutionNameMin: Cijk_Ailk_Bjlk_BSS_BH_UserArgs_MT32x32x64_MI16x16x1_SN_LDSB0_CLR1_GSU0_GSUC0_GSUWGMRR0_K1_LBSPPA256_LBSPPB256_LPA16_LPB16_MIWT1_1_PLR1_SU32_SUM0_SUS256_VWA1_VWB1_WGM1_WGMXCC1_WGMXCCGn1
    SolutionIndex: 98
    SolutionNameMin: Cijk_Ailk_Bjlk_BSS_BH_UserArgs_MT32x32x64_MI16x16x1_SN_LDSB0_CLR1_GSU0_GSUC0_GSUWGMRR0_K1_LBSPPA256_LBSPPB256_LPA16_LPB16_MIWT1_1_PLR2_SU32_SUM0_SUS256_VWA1_VWB1_WGM1_WGMXCC1_WGMXCCGn1
    SolutionIndex: 99
    SolutionNameMin: Cijk_Ailk_Bjlk_BSS_BH_UserArgs_MT32x32x64_MI16x16x1_SN_LDSB0_CLR1_GSU0_GSUC0_GSUWGMRR0_K1_LBSPPA256_LBSPPB256_LPA16_LPB16_MIWT1_1_PLR1_SU32_SUM0_SUS256_VWA1_VWB1_WGM4_WGMXCC1_WGMXCCGn1
    SolutionIndex: 100
    SolutionNameMin: Cijk_Ailk_Bjlk_BSS_BH_UserArgs_MT128x128x128_MI16x16x1_SN_LDSB1_CLR1_GSU0_GSUC0_GSUWGMRR0_K1_LBSPPA1024_LBSPPB1024_LPA0_LPB0_MIWT4_4_PLR1_SU32_SUM0_SUS256_VWA4_VWB4_WGM1_WGMXCC1_WGMXCCGn1
    SolutionIndex: 101
    SolutionNameMin: Cijk_Ailk_Bjlk_BSS_BH_UserArgs_MT128x128x128_MI16x16x1_SN_LDSB1_CLR1_GSU0_GSUC0_GSUWGMRR0_K1_LBSPPA1024_LBSPPB1024_LPA0_LPB0_MIWT4_4_PLR2_SU32_SUM0_SUS256_VWA4_VWB4_WGM1_WGMXCC1_WGMXCCGn1
    SolutionIndex: 102
    SolutionNameMin: Cijk_Ailk_Bjlk_BSS_BH_UserArgs_MT128x128x128_MI16x16x1_SN_LDSB1_CLR1_GSU0_GSUC0_GSUWGMRR0_K1_LBSPPA1024_LBSPPB1024_LPA0_LPB0_MIWT4_4_PLR1_SU32_SUM0_SUS256_VWA4_VWB4_WGM4_WGMXCC1_WGMXCCGn1
    SolutionIndex: 103
    SolutionNameMin: Cijk_Ailk_Bjlk_BSS_BH_UserArgs_MT128x128x128_MI16x16x1_SN_LDSB1_CLR1_GSU0_GSUC0_GSUWGMRR0_K1_LBSPPA1024_LBSPPB1024_LPA0_LPB0_MIWT4_4_PLR1_SU32_SUM0_SUS256_VWA4_VWB4_WGM8_WGMXCC1_WGMXCCGn1
    SolutionIndex: 104
    SolutionNameMin: Cijk_Ailk_Bjlk_BSS_BH_UserArgs_MT64x128x128_MI16x16x1_SN_LDSB1_CLR1_GSU0_GSUC0_GSUWGMRR0_K1_LBSPPA512_LBSPPB1024_LPA32_LPB0_MIWT2_4_PLR2_SU32_SUM0_SUS256_VWA2_VWB4_WGM1_WGMXCC1_WGMXCCGn1
    SolutionIndex: 105
    SolutionNameMin: Cijk_Ailk_Bjlk_BSS_BH_UserArgs_MT128x64x128_MI16x16x1_SN_LDSB1_CLR1_GSU0_GSUC0_GSUWGMRR0_K1_LBSPPA1024_LBSPPB512_LPA0_LPB16_MIWT4_2_PLR2_SU32_SUM0_SUS256_VWA4_VWB1_WGM1_WGMXCC1_WGMXCCGn1
    SolutionIndex: 106
    SolutionNameMin: Cijk_Ailk_Bjlk_BSS_BH_UserArgs_MT128x64x128_MI16x16x1_SN_LDSB1_CLR1_GSU0_GSUC0_GSUWGMRR0_K1_LBSPPA1024_LBSPPB512_LPA32_LPB32_MIWT4_2_PLR2_SU32_SUM0_SUS256_VWA2_VWB2_WGM1_WGMXCC1_WGMXCCGn1
    SolutionIndex: 107
    SolutionNameMin: Cijk_Ailk_Bjlk_BSS_BH_UserArgs_MT128x64x128_MI16x16x1_SN_LDSB1_CLR1_GSU0_GSUC0_GSUWGMRR0_K1_LBSPPA1024_LBSPPB512_LPA0_LPB32_MIWT4_2_PLR2_SU32_SUM0_SUS256_VWA4_VWB2_WGM1_WGMXCC1_WGMXCCGn1
    SolutionIndex: 108
    SolutionNameMin: Cijk_Ailk_Bjlk_BSS_BH_UserArgs_MT128x64x128_MI16x16x1_SN_LDSB1_CLR1_GSU0_GSUC0_GSUWGMRR0_K1_LBSPPA1024_LBSPPB512_LPA0_LPB32_MIWT4_2_PLR2_SU32_SUM0_SUS256_VWA4_VWB2_WGM4_WGMXCC1_WGMXCCGn1
    SolutionIndex: 109
    SolutionNameMin: Cijk_Ailk_Bjlk_BSS_BH_UserArgs_MT64x64x128_MI16x16x1_SN_LDSB1_CLR1_GSU0_GSUC0_GSUWGMRR0_K1_LBSPPA512_LBSPPB512_LPA32_LPB32_MIWT2_2_PLR2_SU32_SUM0_SUS256_VWA2_VWB2_WGM1_WGMXCC1_WGMXCCGn1
    SolutionIndex: 110
    SolutionNameMin: Cijk_Ailk_Bjlk_BSS_BH_UserArgs_MT64x64x128_MI16x16x1_SN_LDSB1_CLR1_GSU0_GSUC0_GSUWGMRR0_K1_LBSPPA512_LBSPPB512_LPA32_LPB32_MIWT2_2_PLR2_SU32_SUM0_SUS256_VWA2_VWB2_WGM4_WGMXCC1_WGMXCCGn1
    SolutionIndex: 111
    SolutionNameMin: Cijk_Ailk_Bjlk_BSS_BH_UserArgs_MT64x64x128_MI16x16x1_SN_LDSB1_CLR1_GSU0_GSUC0_GSUWGMRR0_K1_LBSPPA512_LBSPPB512_LPA32_LPB32_MIWT2_2_PLR2_SU32_SUM0_SUS256_VWA2_VWB2_WGM8_WGMXCC1_WGMXCCGn1
    SolutionIndex: 112
    SolutionNameMin: Cijk_Ailk_Bjlk_BSS_BH_UserArgs_MT32x64x128_MI16x16x1_SN_LDSB1_CLR1_GSU0_GSUC0_GSUWGMRR0_K1_LBSPPA256_LBSPPB512_LPA16_LPB32_MIWT1_2_PLR2_SU32_SUM0_SUS256_VWA1_VWB2_WGM1_WGMXCC1_WGMXCCGn1
    SolutionIndex: 113
    SolutionNameMin: Cijk_Ailk_Bjlk_BSS_BH_UserArgs_MT32x64x128_MI16x16x1_SN_LDSB1_CLR1_GSU0_GSUC0_GSUWGMRR0_K1_LBSPPA256_LBSPPB512_LPA16_LPB32_MIWT1_2_PLR2_SU32_SUM0_SUS256_VWA1_VWB2_WGM4_WGMXCC1_WGMXCCGn1
    SolutionIndex: 114
    SolutionNameMin: Cijk_Ailk_Bjlk_BSS_BH_UserArgs_MT64x32x128_MI16x16x1_SN_LDSB1_CLR1_GSU0_GSUC0_GSUWGMRR0_K1_LBSPPA512_LBSPPB256_LPA16_LPB16_MIWT2_1_PLR1_SU32_SUM0_SUS256_VWA1_VWB1_WGM1_WGMXCC1_WGMXCCGn1
    SolutionIndex: 115
    SolutionNameMin: Cijk_Ailk_Bjlk_BSS_BH_UserArgs_MT64x32x128_MI16x16x1_SN_LDSB1_CLR1_GSU0_GSUC0_GSUWGMRR0_K1_LBSPPA512_LBSPPB256_LPA32_LPB16_MIWT2_1_PLR2_SU32_SUM0_SUS256_VWA2_VWB1_WGM1_WGMXCC1_WGMXCCGn1
    SolutionIndex: 116
    SolutionNameMin: Cijk_Ailk_Bjlk_BSS_BH_UserArgs_MT64x32x128_MI16x16x1_SN_LDSB1_CLR1_GSU0_GSUC0_GSUWGMRR0_K1_LBSPPA512_LBSPPB256_LPA32_LPB16_MIWT2_1_PLR2_SU32_SUM0_SUS256_VWA2_VWB1_WGM4_WGMXCC1_WGMXCCGn1
    SolutionIndex: 117
    SolutionNameMin: Cijk_Ailk_Bjlk_BSS_BH_UserArgs_MT64x32x128_MI16x16x1_SN_LDSB1_CLR1_GSU0_GSUC0_GSUWGMRR0_K1_LBSPPA512_LBSPPB256_LPA32_LPB16_MIWT2_1_PLR2_SU32_SUM0_SUS256_VWA2_VWB1_WGM8_WGMXCC1_WGMXCCGn1
    SolutionIndex: 118
    SolutionNameMin: Cijk_Ailk_Bjlk_BSS_BH_UserArgs_MT32x32x128_MI16x16x1_SN_LDSB1_CLR1_GSU0_GSUC0_GSUWGMRR0_K1_LBSPPA256_LBSPPB256_LPA16_LPB16_MIWT1_1_PLR1_SU32_SUM0_SUS256_VWA1_VWB1_WGM1_WGMXCC1_WGMXCCGn1
    SolutionIndex: 119
    SolutionNameMin: Cijk_Ailk_Bjlk_BSS_BH_UserArgs_MT32x32x128_MI16x16x1_SN_LDSB1_CLR1_GSU0_GSUC0_GSUWGMRR0_K1_LBSPPA256_LBSPPB256_LPA16_LPB16_MIWT1_1_PLR2_SU32_SUM0_SUS256_VWA1_VWB1_WGM1_WGMXCC1_WGMXCCGn1
    SolutionIndex: 120
    SolutionNameMin: Cijk_Ailk_Bjlk_BSS_BH_UserArgs_MT32x32x128_MI16x16x1_SN_LDSB1_CLR1_GSU0_GSUC0_GSUWGMRR0_K1_LBSPPA256_LBSPPB256_LPA16_LPB16_MIWT1_1_PLR1_SU32_SUM0_SUS256_VWA1_VWB1_WGM8_WGMXCC1_WGMXCCGn1
    SolutionIndex: 121
    SolutionNameMin: Cijk_Ailk_Bjlk_BSS_BH_UserArgs_MT32x32x32_MI16x16x1_SN_LDSB0_CLR1_GSU0_GSUC0_GSUWGMRR0_K1_LBSPPA256_LBSPPB256_LPA16_LPB16_MIWT1_1_PLR1_SU32_SUM0_SUS256_VWA1_VWB1_WGM1_WGMXCC1_WGMXCCGn1
- - - [128, 128, 1, 128, 128, 128, 128, 128]
    - [98, 0.076]
  - - [128, 128, 1, 256, 128, 128, 128, 128]
    - [98, 0.13]
  - - [128, 128, 1, 512, 128, 128, 128, 128]
    - [98, 0.226]
  - - [128, 128, 1, 1024, 128, 128, 128, 128]
    - [119, 0.318]
  - - [128, 128, 1, 2048, 128, 128, 128, 128]
    - [99, 0.474]
  - - [128, 128, 1, 4096, 128, 128, 128, 128]
    - [96, 0.775]
  - - [128, 128, 1, 8192, 128, 128, 128, 128]
    - [112, 1.187]
  - - [128, 256, 1, 128, 128, 128, 128, 256]
    - [99, 0.15]
  - - [128, 256, 1, 256, 128, 128, 128, 256]
    - [98, 0.271]
  - - [128, 256, 1, 512, 128, 128, 128, 256]
    - [98, 0.436]
  - - [128, 256, 1, 1024, 128, 128, 128, 256]
    - [99, 0.619]
  - - [128, 256, 1, 2048, 128, 128, 128, 256]
    - [116, 0.874]
  - - [128, 256, 1, 4096, 128, 128, 128, 256]
    - [90, 1.305]
  - - [128, 256, 1, 8192, 128, 128, 128, 256]
    - [109, 1.996]
  - - [128, 512, 1, 128, 128, 128, 128, 512]
    - [91, 0.286]
  - - [128, 512, 1, 256, 128, 128, 128, 512]
    - [93, 0.48]
  - - [128, 512, 1, 512, 128, 128, 128, 512]
    - [115, 0.795]
  - - [128, 512, 1, 1024, 128, 128, 128, 512]
    - [112, 1.16]
  - - [128, 512, 1, 2048, 128, 128, 128, 512]
    - [115, 1.514]
  - - [128, 512, 1, 4096, 128, 128, 128, 512]
    - [83, 2.138]
  - - [128, 512, 1, 8192, 128, 128, 128, 512]
    - [105, 2.901]
  - - [128, 1024, 1, 128, 128, 128, 128, 1024]
    - [87, 0.538]
  - - [128, 1024, 1, 256, 128, 128, 128, 1024]
    - [88, 0.886]
  - - [128, 1024, 1, 512, 128, 128, 128, 1024]
    - [89, 1.398]
  - - [128, 1024, 1, 1024, 128, 128, 128, 1024]
    - [110, 1.929]
  - - [128, 1024, 1, 2048, 128, 128, 128, 1024]
    - [111, 2.447]
  - - [128, 1024, 1, 4096, 128, 128, 128, 1024]
    - [75, 3.402]
  - - [128, 1024, 1, 8192, 128, 128, 128, 1024]
    - [102, 4.686]
  - - [128, 2048, 1, 128, 128, 128, 128, 2048]
    - [42, 0.879]
  - - [128, 2048, 1, 256, 128, 128, 128, 2048]
    - [43, 1.41]
  - - [128, 2048, 1, 512, 128, 128, 128, 2048]
    - [84, 1.994]
  - - [128, 2048, 1, 1024, 128, 128, 128, 2048]
    - [104, 2.774]
  - - [128, 2048, 1, 2048, 128, 128, 128, 2048]
    - [103, 3.417]
  - - [128, 2048, 1, 4096, 128, 128, 128, 2048]
    - [79, 4.388]
  - - [128, 2048, 1, 8192, 128, 128, 128, 2048]
    - [74, 5.906]
  - - [128, 4096, 1, 128, 128, 128, 128, 4096]
    - [38, 1.078]
  - - [128, 4096, 1, 256, 128, 128, 128, 4096]
    - [36, 1.911]
  - - [128, 4096, 1, 512, 128, 128, 128, 4096]
    - [74, 3.008]
  - - [128, 4096, 1, 1024, 128, 128, 128, 4096]
    - [101, 3.966]
  - - [128, 4096, 1, 2048, 128, 128, 128, 4096]
    - [100, 5.194]
  - - [128, 4096, 1, 4096, 128, 128, 128, 4096]
    - [74, 5.992]
  - - [128, 4096, 1, 8192, 128, 128, 128, 4096]
    - [63, 6.891]
  - - [128, 8192, 1, 128, 128, 128, 128, 8192]
    - [21, 1.528]
  - - [128, 8192, 1, 256, 128, 128, 128, 8192]
    - [22, 2.567]
  - - [128, 8192, 1, 512, 128, 128, 128, 8192]
    - [22, 3.814]
  - - [128, 8192, 1, 1024, 128, 128, 128, 8192]
    - [21, 5.112]
  - - [128, 8192, 1, 2048, 128, 128, 128, 8192]
    - [58, 6.002]
  - - [128, 8192, 1, 4096, 128, 128, 128, 8192]
    - [61, 6.91]
  - - [128, 8192, 1, 8192, 128, 128, 128, 8192]
    - [60, 7.669]
  - - [256, 128, 1, 128, 256, 256, 256, 128]
    - [120, 0.16]
  - - [256, 128, 1, 256, 256, 256, 256, 128]
    - [97, 0.27]
  - - [256, 128, 1, 512, 256, 256, 256, 128]
    - [118, 0.438]
  - - [256, 128, 1, 1024, 256, 256, 256, 128]
    - [118, 0.646]
  - - [256, 128, 1, 2048, 256, 256, 256, 128]
    - [116, 0.885]
  - - [256, 128, 1, 4096, 256, 256, 256, 128]
    - [86, 1.347]
  - - [256, 128, 1, 8192, 256, 256, 256, 128]
    - [110, 1.777]
  - - [256, 256, 1, 128, 256, 256, 256, 256]
    - [95, 0.29]
  - - [256, 256, 1, 256, 256, 256, 256, 256]
    - [92, 0.503]
  - - [256, 256, 1, 512, 256, 256, 256, 256]
    - [112, 0.795]
  - - [256, 256, 1, 1024, 256, 256, 256, 256]
    - [113, 1.133]
  - - [256, 256, 1, 2048, 256, 256, 256, 256]
    - [112, 1.496]
  - - [256, 256, 1, 4096, 256, 256, 256, 256]
    - [81, 2.173]
  - - [256, 256, 1, 8192, 256, 256, 256, 256]
    - [107, 2.886]
  - - [256, 512, 1, 128, 256, 256, 256, 512]
    - [109, 0.546]
  - - [256, 512, 1, 256, 256, 256, 256, 512]
    - [87, 0.896]
  - - [256, 512, 1, 512, 256, 256, 256, 512]
    - [109, 1.379]
  - - [256, 512, 1, 1024, 256, 256, 256, 512]
    - [110, 2.001]
  - - [256, 512, 1, 2048, 256, 256, 256, 512]
    - [111, 2.477]
  - - [256, 512, 1, 4096, 256, 256, 256, 512]
    - [73, 3.191]
  - - [256, 512, 1, 8192, 256, 256, 256, 512]
    - [101, 4.62]
  - - [256, 1024, 1, 128, 256, 256, 256, 1024]
    - [44, 0.841]
  - - [256, 1024, 1, 256, 256, 256, 256, 1024]
    - [45, 1.433]
  - - [256, 1024, 1, 512, 256, 256, 256, 1024]
    - [106, 2.094]
  - - [256, 1024, 1, 1024, 256, 256, 256, 1024]
    - [107, 2.905]
  - - [256, 1024, 1, 2048, 256, 256, 256, 1024]
    - [108, 3.506]
  - - [256, 1024, 1, 4096, 256, 256, 256, 1024]
    - [103, 4.767]
  - - [256, 1024, 1, 8192, 256, 256, 256, 1024]
    - [101, 5.473]
  - - [256, 2048, 1, 128, 256, 256, 256, 2048]
    - [36, 1.139]
  - - [256, 2048, 1, 256, 256, 256, 256, 2048]
    - [37, 1.889]
  - - [256, 2048, 1, 512, 256, 256, 256, 2048]
    - [78, 3.029]
  - - [256, 2048, 1, 1024, 256, 256, 256, 2048]
    - [100, 4.214]
  - - [256, 2048, 1, 2048, 256, 256, 256, 2048]
    - [74, 5.223]
  - - [256, 2048, 1, 4096, 256, 256, 256, 2048]
    - [100, 6.13]
  - - [256, 2048, 1, 8192, 256, 256, 256, 2048]
    - [29, 7.05]
  - - [256, 4096, 1, 128, 256, 256, 256, 4096]
    - [22, 1.515]
  - - [256, 4096, 1, 256, 256, 256, 256, 4096]
    - [31, 2.605]
  - - [256, 4096, 1, 512, 256, 256, 256, 4096]
    - [25, 3.858]
  - - [256, 4096, 1, 1024, 256, 256, 256, 4096]
    - [23, 5.092]
  - - [256, 4096, 1, 2048, 256, 256, 256, 4096]
    - [71, 6.092]
  - - [256, 4096, 1, 4096, 256, 256, 256, 4096]
    - [34, 7.033]
  - - [256, 4096, 1, 8192, 256, 256, 256, 4096]
    - [49, 8.212]
  - - [256, 8192, 1, 128, 256, 256, 256, 8192]
    - [3, 1.814]
  - - [256, 8192, 1, 256, 256, 256, 256, 8192]
    - [2, 3.023]
  - - [256, 8192, 1, 512, 256, 256, 256, 8192]
    - [1, 4.479]
  - - [256, 8192, 1, 1024, 256, 256, 256, 8192]
    - [49, 5.899]
  - - [256, 8192, 1, 2048, 256, 256, 256, 8192]
    - [55, 6.87]
  - - [256, 8192, 1, 4096, 256, 256, 256, 8192]
    - [55, 8.131]
  - - [256, 8192, 1, 8192, 256, 256, 256, 8192]
    - [10, 8.876]
  - - [512, 128, 1, 128, 512, 512, 512, 128]
    - [94, 0.31]
  - - [512, 128, 1, 256, 512, 512, 512, 128]
    - [114, 0.507]
  - - [512, 128, 1, 512, 512, 512, 512, 128]
    - [115, 0.85]
  - - [512, 128, 1, 1024, 512, 512, 512, 128]
    - [117, 1.177]
  - - [512, 128, 1, 2048, 512, 512, 512, 128]
    - [115, 1.535]
  - - [512, 128, 1, 4096, 512, 512, 512, 128]
    - [85, 2.217]
  - - [512, 128, 1, 8192, 512, 512, 512, 128]
    - [81, 2.853]
  - - [512, 256, 1, 128, 512, 512, 512, 256]
    - [46, 0.527]
  - - [512, 256, 1, 256, 512, 512, 512, 256]
    - [109, 0.889]
  - - [512, 256, 1, 512, 512, 512, 512, 256]
    - [109, 1.49]
  - - [512, 256, 1, 1024, 512, 512, 512, 256]
    - [109, 2.005]
  - - [512, 256, 1, 2048, 512, 512, 512, 256]
    - [110, 2.56]
  - - [512, 256, 1, 4096, 512, 512, 512, 256]
    - [75, 3.435]
  - - [512, 256, 1, 8192, 512, 512, 512, 256]
    - [100, 4.65]
  - - [512, 512, 1, 128, 512, 512, 512, 512]
    - [82, 0.912]
  - - [512, 512, 1, 256, 512, 512, 512, 512]
    - [80, 1.441]
  - - [512, 512, 1, 512, 512, 512, 512, 512]
    - [84, 2.176]
  - - [512, 512, 1, 1024, 512, 512, 512, 512]
    - [108, 2.983]
  - - [512, 512, 1, 2048, 512, 512, 512, 512]
    - [76, 3.556]
  - - [512, 512, 1, 4096, 512, 512, 512, 512]
    - [74, 4.805]
  - - [512, 512, 1, 8192, 512, 512, 512, 512]
    - [100, 5.82]
  - - [512, 1024, 1, 128, 512, 512, 512, 1024]
    - [39, 1.14]
  - - [512, 1024, 1, 256, 512, 512, 512, 1024]
    - [35, 1.864]
  - - [512, 1024, 1, 512, 512, 512, 512, 1024]
    - [74, 3.034]
  - - [512, 1024, 1, 1024, 512, 512, 512, 1024]
    - [78, 4.191]
  - - [512, 1024, 1, 2048, 512, 512, 512, 1024]
    - [103, 5.241]
  - - [512, 1024, 1, 4096, 512, 512, 512, 1024]
    - [103, 6.195]
  - - [512, 1024, 1, 8192, 512, 512, 512, 1024]
    - [29, 7.049]
  - - [512, 2048, 1, 128, 512, 512, 512, 2048]
    - [27, 1.513]
  - - [512, 2048, 1, 256, 512, 512, 512, 2048]
    - [21, 2.614]
  - - [512, 2048, 1, 512, 512, 512, 512, 2048]
    - [21, 3.913]
  - - [512, 2048, 1, 1024, 512, 512, 512, 2048]
    - [21, 5.148]
  - - [512, 2048, 1, 2048, 512, 512, 512, 2048]
    - [64, 6.149]
  - - [512, 2048, 1, 4096, 512, 512, 512, 2048]
    - [68, 7.128]
  - - [512, 2048, 1, 8192, 512, 512, 512, 2048]
    - [16, 8.178]
  - - [512, 4096, 1, 128, 512, 512, 512, 4096]
    - [4, 1.757]
  - - [512, 4096, 1, 256, 512, 512, 512, 4096]
    - [4, 2.962]
  - - [512, 4096, 1, 512, 512, 512, 512, 4096]
    - [16, 4.418]
  - - [512, 4096, 1, 1024, 512, 512, 512, 4096]
    - [5, 5.876]
  - - [512, 4096, 1, 2048, 512, 512, 512, 4096]
    - [51, 6.993]
  - - [512, 4096, 1, 4096, 512, 512, 512, 4096]
    - [51, 8.149]
  - - [512, 4096, 1, 8192, 512, 512, 512, 4096]
    - [51, 9.046]
  - - [512, 8192, 1, 128, 512, 512, 512, 8192]
    - [28, 1.844]
  - - [512, 8192, 1, 256, 512, 512, 512, 8192]
    - [62, 2.994]
  - - [512, 8192, 1, 512, 512, 512, 512, 8192]
    - [55, 4.665]
  - - [512, 8192, 1, 1024, 512, 512, 512, 8192]
    - [12, 6.372]
  - - [512, 8192, 1, 2048, 512, 512, 512, 8192]
    - [1, 7.825]
  - - [512, 8192, 1, 4096, 512, 512, 512, 8192]
    - [6, 8.634]
  - - [512, 8192, 1, 8192, 512, 512, 512, 8192]
    - [50, 9.472]
  - - [1024, 128, 1, 128, 1024, 1024, 1024, 128]
    - [48, 0.527]
  - - [1024, 128, 1, 256, 1024, 1024, 1024, 128]
    - [47, 0.914]
  - - [1024, 128, 1, 512, 1024, 1024, 1024, 128]
    - [110, 1.415]
  - - [1024, 128, 1, 1024, 1024, 1024, 1024, 128]
    - [109, 2.044]
  - - [1024, 128, 1, 2048, 1024, 1024, 1024, 128]
    - [82, 2.326]
  - - [1024, 128, 1, 4096, 1024, 1024, 1024, 128]
    - [78, 3.446]
  - - [1024, 128, 1, 8192, 1024, 1024, 1024, 128]
    - [78, 4.432]
  - - [1024, 256, 1, 128, 1024, 1024, 1024, 256]
    - [41, 0.911]
  - - [1024, 256, 1, 256, 1024, 1024, 1024, 256]
    - [85, 1.461]
  - - [1024, 256, 1, 512, 1024, 1024, 1024, 256]
    - [81, 2.192]
  - - [1024, 256, 1, 1024, 1024, 1024, 1024, 256]
    - [107, 2.877]
  - - [1024, 256, 1, 2048, 1024, 1024, 1024, 256]
    - [78, 3.509]
  - - [1024, 256, 1, 4096, 1024, 1024, 1024, 256]
    - [100, 4.753]
  - - [1024, 256, 1, 8192, 1024, 1024, 1024, 256]
    - [74, 6.023]
  - - [1024, 512, 1, 128, 1024, 1024, 1024, 512]
    - [36, 1.205]
  - - [1024, 512, 1, 256, 1024, 1024, 1024, 512]
    - [74, 1.928]
  - - [1024, 512, 1, 512, 1024, 1024, 1024, 512]
    - [76, 2.945]
  - - [1024, 512, 1, 1024, 1024, 1024, 1024, 512]
    - [74, 4.265]
  - - [1024, 512, 1, 2048, 1024, 1024, 1024, 512]
    - [100, 5.314]
  - - [1024, 512, 1, 4096, 1024, 1024, 1024, 512]
    - [100, 6.163]
  - - [1024, 512, 1, 8192, 1024, 1024, 1024, 512]
    - [68, 7.085]
  - - [1024, 1024, 1, 128, 1024, 1024, 1024, 1024]
    - [31, 1.578]
  - - [1024, 1024, 1, 256, 1024, 1024, 1024, 1024]
    - [30, 2.624]
  - - [1024, 1024, 1, 512, 1024, 1024, 1024, 1024]
    - [26, 3.944]
  - - [1024, 1024, 1, 1024, 1024, 1024, 1024, 1024]
    - [23, 5.176]
  - - [1024, 1024, 1, 2048, 1024, 1024, 1024, 1024]
    - [59, 6.236]
  - - [1024, 1024, 1, 4096, 1024, 1024, 1024, 1024]
    - [68, 7.091]
  - - [1024, 1024, 1, 8192, 1024, 1024, 1024, 1024]
    - [53, 8.214]
  - - [1024, 2048, 1, 128, 1024, 1024, 1024, 2048]
    - [15, 1.87]
  - - [1024, 2048, 1, 256, 1024, 1024, 1024, 2048]
    - [11, 3.097]
  - - [1024, 2048, 1, 512, 1024, 1024, 1024, 2048]
    - [4, 4.519]
  - - [1024, 2048, 1, 1024, 1024, 1024, 1024, 2048]
    - [5, 5.985]
  - - [1024, 2048, 1, 2048, 1024, 1024, 1024, 2048]
    - [51, 7.037]
  - - [1024, 2048, 1, 4096, 1024, 1024, 1024, 2048]
    - [53, 8.124]
  - - [1024, 2048, 1, 8192, 1024, 1024, 1024, 2048]
    - [5, 8.98]
  - - [1024, 4096, 1, 128, 1024, 1024, 1024, 4096]
    - [54, 1.949]
  - - [1024, 4096, 1, 256, 1024, 1024, 1024, 4096]
    - [65, 2.984]
  - - [1024, 4096, 1, 512, 1024, 1024, 1024, 4096]
    - [14, 4.671]
  - - [1024, 4096, 1, 1024, 1024, 1024, 1024, 4096]
    - [3, 6.431]
  - - [1024, 4096, 1, 2048, 1024, 1024, 1024, 4096]
    - [52, 7.433]
  - - [1024, 4096, 1, 4096, 1024, 1024, 1024, 4096]
    - [5, 8.808]
  - - [1024, 4096, 1, 8192, 1024, 1024, 1024, 4096]
    - [50, 8.998]
  - - [1024, 8192, 1, 128, 1024, 1024, 1024, 8192]
    - [69, 2.08]
  - - [1024, 8192, 1, 256, 1024, 1024, 1024, 8192]
    - [50, 3.389]
  - - [1024, 8192, 1, 512, 1024, 1024, 1024, 8192]
    - [29, 4.976]
  - - [1024, 8192, 1, 1024, 1024, 1024, 1024, 8192]
    - [1, 6.683]
  - - [1024, 8192, 1, 2048, 1024, 1024, 1024, 8192]
    - [10, 8.021]
  - - [1024, 8192, 1, 4096, 1024, 1024, 1024, 8192]
    - [51, 8.923]
  - - [1024, 8192, 1, 8192, 1024, 1024, 1024, 8192]
    - [49, 9.439]
  - - [2048, 128, 1, 128, 2048, 2048, 2048, 128]
    - [40, 0.921]
  - - [2048, 128, 1, 256, 2048, 2048, 2048, 128]
    - [84, 1.51]
  - - [2048, 128, 1, 512, 2048, 2048, 2048, 128]
    - [81, 2.144]
  - - [2048, 128, 1, 1024, 2048, 2048, 2048, 128]
    - [81, 2.886]
  - - [2048, 128, 1, 2048, 2048, 2048, 2048, 128]
    - [82, 3.563]
  - - [2048, 128, 1, 4096, 2048, 2048, 2048, 128]
    - [76, 4.678]
  - - [2048, 128, 1, 8192, 2048, 2048, 2048, 128]
    - [76, 6.021]
  - - [2048, 256, 1, 128, 2048, 2048, 2048, 256]
    - [39, 1.246]
  - - [2048, 256, 1, 256, 2048, 2048, 2048, 256]
    - [36, 2.033]
  - - [2048, 256, 1, 512, 2048, 2048, 2048, 256]
    - [74, 3.072]
  - - [2048, 256, 1, 1024, 2048, 2048, 2048, 256]
    - [74, 4.352]
  - - [2048, 256, 1, 2048, 2048, 2048, 2048, 256]
    - [74, 5.389]
  - - [2048, 256, 1, 4096, 2048, 2048, 2048, 256]
    - [102, 6.069]
  - - [2048, 256, 1, 8192, 2048, 2048, 2048, 256]
    - [23, 7.08]
  - - [2048, 512, 1, 128, 2048, 2048, 2048, 512]
    - [30, 1.586]
  - - [2048, 512, 1, 256, 2048, 2048, 2048, 512]
    - [21, 2.635]
  - - [2048, 512, 1, 512, 2048, 2048, 2048, 512]
    - [23, 3.942]
  - - [2048, 512, 1, 1024, 2048, 2048, 2048, 512]
    - [20, 5.188]
  - - [2048, 512, 1, 2048, 2048, 2048, 2048, 512]
    - [57, 6.179]
  - - [2048, 512, 1, 4096, 2048, 2048, 2048, 512]
    - [59, 7.082]
  - - [2048, 512, 1, 8192, 2048, 2048, 2048, 512]
    - [1, 8.199]
  - - [2048, 1024, 1, 128, 2048, 2048, 2048, 1024]
    - [4, 1.887]
  - - [2048, 1024, 1, 256, 2048, 2048, 2048, 1024]
    - [15, 3.1]
  - - [2048, 1024, 1, 512, 2048, 2048, 2048, 1024]
    - [5, 4.58]
  - - [2048, 1024, 1, 1024, 2048, 2048, 2048, 1024]
    - [5, 6.013]
  - - [2048, 1024, 1, 2048, 2048, 2048, 2048, 1024]
    - [50, 7.05]
  - - [2048, 1024, 1, 4096, 2048, 2048, 2048, 1024]
    - [5, 8.159]
  - - [2048, 1024, 1, 8192, 2048, 2048, 2048, 1024]
    - [1, 8.997]
  - - [2048, 2048, 1, 128, 2048, 2048, 2048, 2048]
    - [56, 1.951]
  - - [2048, 2048, 1, 256, 2048, 2048, 2048, 2048]
    - [68, 3.023]
  - - [2048, 2048, 1, 512, 2048, 2048, 2048, 2048]
    - [1, 4.726]
  - - [2048, 2048, 1, 1024, 2048, 2048, 2048, 2048]
    - [49, 6.458]
  - - [2048, 2048, 1, 2048, 2048, 2048, 2048, 2048]
    - [53, 7.914]
  - - [2048, 2048, 1, 4096, 2048, 2048, 2048, 2048]
    - [5, 8.819]
  - - [2048, 2048, 1, 8192, 2048, 2048, 2048, 2048]
    - [52, 9.326]
  - - [2048, 4096, 1, 128, 2048, 2048, 2048, 4096]
    - [28, 2.073]
  - - [2048, 4096, 1, 256, 2048, 2048, 2048, 4096]
    - [53, 3.472]
  - - [2048, 4096, 1, 512, 2048, 2048, 2048, 4096]
    - [5, 5.012]
  - - [2048, 4096, 1, 1024, 2048, 2048, 2048, 4096]
    - [10, 6.724]
  - - [2048, 4096, 1, 2048, 2048, 2048, 2048, 4096]
    - [3, 7.83]
  - - [2048, 4096, 1, 4096, 2048, 2048, 2048, 4096]
    - [51, 8.922]
  - - [2048, 4096, 1, 8192, 2048, 2048, 2048, 4096]
    - [49, 9.337]
  - - [2048, 8192, 1, 128, 2048, 2048, 2048, 8192]
    - [28, 2.383]
  - - [2048, 8192, 1, 256, 2048, 2048, 2048, 8192]
    - [24, 3.811]
  - - [2048, 8192, 1, 512, 2048, 2048, 2048, 8192]
    - [5, 5.586]
  - - [2048, 8192, 1, 1024, 2048, 2048, 2048, 8192]
    - [16, 7.213]
  - - [2048, 8192, 1, 2048, 2048, 2048, 2048, 8192]
    - [49, 8.424]
  - - [2048, 8192, 1, 4096, 2048, 2048, 2048, 8192]
    - [51, 9.026]
  - - [2048, 8192, 1, 8192, 2048, 2048, 2048, 8192]
    - [55, 9.4]
  - - [4096, 128, 1, 128, 4096, 4096, 4096, 128]
    - [36, 1.215]
  - - [4096, 128, 1, 256, 4096, 4096, 4096, 128]
    - [36, 2.069]
  - - [4096, 128, 1, 512, 4096, 4096, 4096, 128]
    - [74, 3.119]
  - - [4096, 128, 1, 1024, 4096, 4096, 4096, 128]
    - [77, 4.156]
  - - [4096, 128, 1, 2048, 4096, 4096, 4096, 128]
    - [74, 5.308]
  - - [4096, 128, 1, 4096, 4096, 4096, 4096, 128]
    - [74, 6.084]
  - - [4096, 128, 1, 8192, 4096, 4096, 4096, 128]
    - [67, 7.089]
  - - [4096, 256, 1, 128, 4096, 4096, 4096, 256]
    - [31, 1.629]
  - - [4096, 256, 1, 256, 4096, 4096, 4096, 256]
    - [34, 2.637]
  - - [4096, 256, 1, 512, 4096, 4096, 4096, 256]
    - [29, 3.9]
  - - [4096, 256, 1, 1024, 4096, 4096, 4096, 256]
    - [29, 5.171]
  - - [4096, 256, 1, 2048, 4096, 4096, 4096, 256]
    - [62, 6.152]
  - - [4096, 256, 1, 4096, 4096, 4096, 4096, 256]
    - [59, 7.101]
  - - [4096, 256, 1, 8192, 4096, 4096, 4096, 256]
    - [50, 8.174]
  - - [4096, 512, 1, 128, 4096, 4096, 4096, 512]
    - [3, 1.799]
  - - [4096, 512, 1, 256, 4096, 4096, 4096, 512]
    - [1, 2.991]
  - - [4096, 512, 1, 512, 4096, 4096, 4096, 512]
    - [5, 4.472]
  - - [4096, 512, 1, 1024, 4096, 4096, 4096, 512]
    - [13, 5.904]
  - - [4096, 512, 1, 2048, 4096, 4096, 4096, 512]
    - [49, 7.054]
  - - [4096, 512, 1, 4096, 4096, 4096, 4096, 512]
    - [51, 8.145]
  - - [4096, 512, 1, 8192, 4096, 4096, 4096, 512]
    - [12, 8.991]
  - - [4096, 1024, 1, 128, 4096, 4096, 4096, 1024]
    - [31, 1.886]
  - - [4096, 1024, 1, 256, 4096, 4096, 4096, 1024]
    - [1, 3.022]
  - - [4096, 1024, 1, 512, 4096, 4096, 4096, 1024]
    - [0, 4.745]
  - - [4096, 1024, 1, 1024, 4096, 4096, 4096, 1024]
    - [14, 6.46]
  - - [4096, 1024, 1, 2048, 4096, 4096, 4096, 1024]
    - [51, 7.894]
  - - [4096, 1024, 1, 4096, 4096, 4096, 4096, 1024]
    - [49, 8.929]
  - - [4096, 1024, 1, 8192, 4096, 4096, 4096, 1024]
    - [51, 9.471]
  - - [4096, 2048, 1, 128, 4096, 4096, 4096, 2048]
    - [66, 2.07]
  - - [4096, 2048, 1, 256, 4096, 4096, 4096, 2048]
    - [33, 3.337]
  - - [4096, 2048, 1, 512, 4096, 4096, 4096, 2048]
    - [29, 4.982]
  - - [4096, 2048, 1, 1024, 4096, 4096, 4096, 2048]
    - [49, 6.676]
  - - [4096, 2048, 1, 2048, 4096, 4096, 4096, 2048]
    - [16, 7.972]
  - - [4096, 2048, 1, 4096, 4096, 4096, 4096, 2048]
    - [49, 9.017]
  - - [4096, 2048, 1, 8192, 4096, 4096, 4096, 2048]
    - [50, 9.335]
  - - [4096, 4096, 1, 128, 4096, 4096, 4096, 4096]
    - [31, 2.365]
  - - [4096, 4096, 1, 256, 4096, 4096, 4096, 4096]
    - [31, 3.815]
  - - [4096, 4096, 1, 512, 4096, 4096, 4096, 4096]
    - [31, 5.302]
  - - [4096, 4096, 1, 1024, 4096, 4096, 4096, 4096]
    - [1, 7.15]
  - - [4096, 4096, 1, 2048, 4096, 4096, 4096, 4096]
    - [8, 8.089]
  - - [4096, 4096, 1, 4096, 4096, 4096, 4096, 4096]
    - [12, 8.814]
  - - [4096, 4096, 1, 8192, 4096, 4096, 4096, 4096]
    - [49, 9.172]
  - - [4096, 8192, 1, 128, 4096, 4096, 4096, 8192]
    - [32, 2.465]
  - - [4096, 8192, 1, 256, 4096, 4096, 4096, 8192]
    - [24, 3.933]
  - - [4096, 8192, 1, 512, 4096, 4096, 4096, 8192]
    - [12, 5.587]
  - - [4096, 8192, 1, 1024, 4096, 4096, 4096, 8192]
    - [49, 6.8]
  - - [4096, 8192, 1, 2048, 4096, 4096, 4096, 8192]
    - [49, 8.068]
  - - [4096, 8192, 1, 4096, 4096, 4096, 4096, 8192]
    - [49, 8.767]
  - - [4096, 8192, 1, 8192, 4096, 4096, 4096, 8192]
    - [9, 8.681]
  - - [8192, 128, 1, 128, 8192, 8192, 8192, 128]
    - [32, 1.651]
  - - [8192, 128, 1, 256, 8192, 8192, 8192, 128]
    - [28, 2.71]
  - - [8192, 128, 1, 512, 8192, 8192, 8192, 128]
    - [34, 3.94]
  - - [8192, 128, 1, 1024, 8192, 8192, 8192, 128]
    - [29, 5.21]
  - - [8192, 128, 1, 2048, 8192, 8192, 8192, 128]
    - [72, 6.119]
  - - [8192, 128, 1, 4096, 8192, 8192, 8192, 128]
    - [29, 7.073]
  - - [8192, 128, 1, 8192, 8192, 8192, 8192, 128]
    - [70, 7.95]
  - - [8192, 256, 1, 128, 8192, 8192, 8192, 256]
    - [0, 1.84]
  - - [8192, 256, 1, 256, 8192, 8192, 8192, 256]
    - [7, 3.013]
  - - [8192, 256, 1, 512, 8192, 8192, 8192, 256]
    - [0, 4.466]
  - - [8192, 256, 1, 1024, 8192, 8192, 8192, 256]
    - [49, 5.859]
  - - [8192, 256, 1, 2048, 8192, 8192, 8192, 256]
    - [51, 7.064]
  - - [8192, 256, 1, 4096, 8192, 8192, 8192, 256]
    - [53, 8.124]
  - - [8192, 256, 1, 8192, 8192, 8192, 8192, 256]
    - [49, 9.098]
  - - [8192, 512, 1, 128, 8192, 8192, 8192, 512]
    - [49, 1.935]
  - - [8192, 512, 1, 256, 8192, 8192, 8192, 512]
    - [0, 3.003]
  - - [8192, 512, 1, 512, 8192, 8192, 8192, 512]
    - [1, 4.759]
  - - [8192, 512, 1, 1024, 8192, 8192, 8192, 512]
    - [8, 6.466]
  - - [8192, 512, 1, 2048, 8192, 8192, 8192, 512]
    - [1, 7.969]
  - - [8192, 512, 1, 4096, 8192, 8192, 8192, 512]
    - [52, 8.88]
  - - [8192, 512, 1, 8192, 8192, 8192, 8192, 512]
    - [55, 9.38]
  - - [8192, 1024, 1, 128, 8192, 8192, 8192, 1024]
    - [68, 2.121]
  - - [8192, 1024, 1, 256, 8192, 8192, 8192, 1024]
    - [19, 3.381]
  - - [8192, 1024, 1, 512, 8192, 8192, 8192, 1024]
    - [29, 4.94]
  - - [8192, 1024, 1, 1024, 8192, 8192, 8192, 1024]
    - [0, 6.611]
  - - [8192, 1024, 1, 2048, 8192, 8192, 8192, 1024]
    - [51, 8.02]
  - - [8192, 1024, 1, 4096, 8192, 8192, 8192, 1024]
    - [51, 8.977]
  - - [8192, 1024, 1, 8192, 8192, 8192, 8192, 1024]
    - [49, 9.338]
  - - [8192, 2048, 1, 128, 8192, 8192, 8192, 2048]
    - [29, 2.363]
  - - [8192, 2048, 1, 256, 8192, 8192, 8192, 2048]
    - [21, 3.709]
  - - [8192, 2048, 1, 512, 8192, 8192, 8192, 2048]
    - [1, 5.457]
  - - [8192, 2048, 1, 1024, 8192, 8192, 8192, 2048]
    - [14, 7.072]
  - - [8192, 2048, 1, 2048, 8192, 8192, 8192, 2048]
    - [52, 8.269]
  - - [8192, 2048, 1, 4096, 8192, 8192, 8192, 2048]
    - [13, 8.893]
  - - [8192, 2048, 1, 8192, 8192, 8192, 8192, 2048]
    - [50, 9.285]
  - - [8192, 4096, 1, 128, 8192, 8192, 8192, 4096]
    - [18, 2.415]
  - - [8192, 4096, 1, 256, 8192, 8192, 8192, 4096]
    - [7, 3.976]
  - - [8192, 4096, 1, 512, 8192, 8192, 8192, 4096]
    - [29, 5.429]
  - - [8192, 4096, 1, 1024, 8192, 8192, 8192, 4096]
    - [1, 6.85]
  - - [8192, 4096, 1, 2048, 8192, 8192, 8192, 4096]
    - [50, 8.072]
  - - [8192, 4096, 1, 4096, 8192, 8192, 8192, 4096]
    - [16, 8.758]
  - - [8192, 4096, 1, 8192, 8192, 8192, 8192, 4096]
    - [49, 9.376]
  - - [8192, 8192, 1, 128, 8192, 8192, 8192, 8192]
    - [1, 2.175]
  - - [8192, 8192, 1, 256, 8192, 8192, 8192, 8192]
    - [24, 3.718]
  - - [8192, 8192, 1, 512, 8192, 8192, 8192, 8192]
    - [8, 5.504]
  - - [8192, 8192, 1, 1024, 8192, 8192, 8192, 8192]
    - [1, 7.19]
  - - [8192, 8192, 1, 2048, 8192, 8192, 8192, 8192]
    - [49, 8.418]
  - - [8192, 8192, 1, 4096, 8192, 8192, 8192, 8192]
    - [16, 9.147]
  - - [8192, 8192, 1, 8192, 8192, 8192, 8192, 8192]
    - [17, 9.076]
  - - [1, 1, 1, 32, 1, 1, 1, 1]
    - [121, 0.0]
- null
- null
- ExperimentalStreamK
- GridBased
