library/src/amd_detail/rocblaslt/src/Tensile/Logic/asm_full/aquavanjaram/gfx942_38cu/StreamK/aquavanjaram942_Cijk_Ailk_Bjlk_HHS_BH_UserArgs.yaml
- {MinimumRequiredVersion: 4.33.0}
- aquavanjaram942
- {Architecture: gfx942, CUCount: 38}
- [Device 0049, Device 0050]
    SolutionIndex: 0
    SolutionNameMin: Cijk_Ailk_Bjlk_HHS_BH_UserArgs_MT256x256x32_MI16x16x1_SN_LDSB1_CLR1_GSU0_GSUC0_GSUWGMRR0_K1_LBSPPA2048_LBSPPB2048_LPA0_LPB16_MIWT8_8_PLR1_SU32_SUM0_SUS256_VWA4_VWB1_WGM1_WGMXCC1_WGMXCCGn1
    SolutionIndex: 1
    SolutionNameMin: Cijk_Ailk_Bjlk_HHS_BH_UserArgs_MT256x256x32_MI16x16x1_SN_LDSB1_CLR1_GSU0_GSUC0_GSUWGMRR0_K1_LBSPPA2048_LBSPPB2048_LPA0_LPB16_MIWT8_8_PLR1_SU32_SUM0_SUS256_VWA8_VWB1_WGM1_WGMXCC1_WGMXCCGn1
    SolutionIndex: 2
    SolutionNameMin: Cijk_Ailk_Bjlk_HHS_BH_UserArgs_MT256x256x32_MI16x16x1_SN_LDSB1_CLR1_GSU0_GSUC0_GSUWGMRR0_K1_LBSPPA2048_LBSPPB2048_LPA0_LPB32_MIWT8_8_PLR1_SU32_SUM0_SUS256_VWA4_VWB2_WGM1_WGMXCC1_WGMXCCGn1
    SolutionIndex: 3
    SolutionNameMin: Cijk_Ailk_Bjlk_HHS_BH_UserArgs_MT256x256x32_MI16x16x1_SN_LDSB1_CLR1_GSU0_GSUC0_GSUWGMRR0_K1_LBSPPA2048_LBSPPB2048_LPA0_LPB32_MIWT8_8_PLR1_SU32_SUM0_SUS256_VWA8_VWB2_WGM1_WGMXCC1_WGMXCCGn1
    SolutionIndex: 4
    SolutionNameMin: Cijk_Ailk_Bjlk_HHS_BH_UserArgs_MT256x256x32_MI16x16x1_SN_LDSB1_CLR1_GSU0_GSUC0_GSUWGMRR0_K1_LBSPPA2048_LBSPPB2048_LPA32_LPB0_MIWT8_8_PLR1_SU32_SUM0_SUS256_VWA2_VWB4_WGM1_WGMXCC1_WGMXCCGn1
    SolutionIndex: 5
    SolutionNameMin: Cijk_Ailk_Bjlk_HHS_BH_UserArgs_MT256x256x32_MI16x16x1_SN_LDSB0_CLR1_GSU0_GSUC0_GSUWGMRR0_K1_LBSPPA2048_LBSPPB2048_LPA0_LPB0_MIWT8_8_PLR1_SU32_SUM0_SUS256_VWA4_VWB4_WGM1_WGMXCC1_WGMXCCGn1
    SolutionIndex: 6
    SolutionNameMin: Cijk_Ailk_Bjlk_HHS_BH_UserArgs_MT256x256x32_MI16x16x1_SN_LDSB0_CLR1_GSU0_GSUC0_GSUWGMRR0_K1_LBSPPA2048_LBSPPB2048_LPA0_LPB0_MIWT8_8_PLR1_SU32_SUM0_SUS256_VWA8_VWB4_WGM1_WGMXCC1_WGMXCCGn1
    SolutionIndex: 7
    SolutionNameMin: Cijk_Ailk_Bjlk_HHS_BH_UserArgs_MT256x256x32_MI16x16x1_SN_LDSB1_CLR1_GSU0_GSUC0_GSUWGMRR0_K1_LBSPPA2048_LBSPPB2048_LPA32_LPB0_MIWT8_8_PLR1_SU32_SUM0_SUS256_VWA2_VWB8_WGM1_WGMXCC1_WGMXCCGn1
    SolutionIndex: 8
    SolutionNameMin: Cijk_Ailk_Bjlk_HHS_BH_UserArgs_MT256x256x32_MI16x16x1_SN_LDSB0_CLR1_GSU0_GSUC0_GSUWGMRR0_K1_LBSPPA2048_LBSPPB2048_LPA0_LPB0_MIWT8_8_PLR1_SU32_SUM0_SUS256_VWA4_VWB8_WGM1_WGMXCC1_WGMXCCGn1
    SolutionIndex: 9
    SolutionNameMin: Cijk_Ailk_Bjlk_HHS_BH_UserArgs_MT256x256x32_MI16x16x1_SN_LDSB0_CLR1_GSU0_GSUC0_GSUWGMRR0_K1_LBSPPA2048_LBSPPB2048_LPA0_LPB0_MIWT8_8_PLR1_SU32_SUM0_SUS256_VWA8_VWB8_WGM1_WGMXCC1_WGMXCCGn1
    SolutionIndex: 10
    SolutionNameMin: Cijk_Ailk_Bjlk_HHS_BH_UserArgs_MT256x256x32_MI16x16x1_SN_LDSB1_CLR1_GSU0_GSUC0_GSUWGMRR0_K1_LBSPPA2048_LBSPPB2048_LPA0_LPB16_MIWT8_8_PLR1_SU32_SUM0_SUS256_VWA4_VWB1_WGM4_WGMXCC1_WGMXCCGn1
    SolutionIndex: 11
    SolutionNameMin: Cijk_Ailk_Bjlk_HHS_BH_UserArgs_MT256x256x32_MI16x16x1_SN_LDSB1_CLR1_GSU0_GSUC0_GSUWGMRR0_K1_LBSPPA2048_LBSPPB2048_LPA0_LPB16_MIWT8_8_PLR1_SU32_SUM0_SUS256_VWA8_VWB1_WGM4_WGMXCC1_WGMXCCGn1
    SolutionIndex: 12
    SolutionNameMin: Cijk_Ailk_Bjlk_HHS_BH_UserArgs_MT256x256x32_MI16x16x1_SN_LDSB1_CLR1_GSU0_GSUC0_GSUWGMRR0_K1_LBSPPA2048_LBSPPB2048_LPA0_LPB32_MIWT8_8_PLR1_SU32_SUM0_SUS256_VWA4_VWB2_WGM4_WGMXCC1_WGMXCCGn1
    SolutionIndex: 13
    SolutionNameMin: Cijk_Ailk_Bjlk_HHS_BH_UserArgs_MT256x256x32_MI16x16x1_SN_LDSB1_CLR1_GSU0_GSUC0_GSUWGMRR0_K1_LBSPPA2048_LBSPPB2048_LPA0_LPB32_MIWT8_8_PLR1_SU32_SUM0_SUS256_VWA8_VWB2_WGM4_WGMXCC1_WGMXCCGn1
    SolutionIndex: 14
    SolutionNameMin: Cijk_Ailk_Bjlk_HHS_BH_UserArgs_MT256x256x32_MI16x16x1_SN_LDSB1_CLR1_GSU0_GSUC0_GSUWGMRR0_K1_LBSPPA2048_LBSPPB2048_LPA32_LPB0_MIWT8_8_PLR1_SU32_SUM0_SUS256_VWA2_VWB8_WGM4_WGMXCC1_WGMXCCGn1
    SolutionIndex: 15
    SolutionNameMin: Cijk_Ailk_Bjlk_HHS_BH_UserArgs_MT256x256x32_MI16x16x1_SN_LDSB0_CLR1_GSU0_GSUC0_GSUWGMRR0_K1_LBSPPA2048_LBSPPB2048_LPA0_LPB0_MIWT8_8_PLR1_SU32_SUM0_SUS256_VWA4_VWB8_WGM4_WGMXCC1_WGMXCCGn1
    SolutionIndex: 16
    SolutionNameMin: Cijk_Ailk_Bjlk_HHS_BH_UserArgs_MT256x256x32_MI16x16x1_SN_LDSB0_CLR1_GSU0_GSUC0_GSUWGMRR0_K1_LBSPPA2048_LBSPPB2048_LPA0_LPB0_MIWT8_8_PLR1_SU32_SUM0_SUS256_VWA8_VWB8_WGM4_WGMXCC1_WGMXCCGn1
    SolutionIndex: 17
    SolutionNameMin: Cijk_Ailk_Bjlk_HHS_BH_UserArgs_MT256x256x32_MI16x16x1_SN_LDSB1_CLR1_GSU0_GSUC0_GSUWGMRR0_K1_LBSPPA2048_LBSPPB2048_LPA0_LPB16_MIWT8_8_PLR1_SU32_SUM0_SUS256_VWA4_VWB1_WGM8_WGMXCC1_WGMXCCGn1
    SolutionIndex: 18
    SolutionNameMin: Cijk_Ailk_Bjlk_HHS_BH_UserArgs_MT256x256x32_MI16x16x1_SN_LDSB1_CLR1_GSU0_GSUC0_GSUWGMRR0_K1_LBSPPA2048_LBSPPB2048_LPA0_LPB16_MIWT8_8_PLR1_SU32_SUM0_SUS256_VWA8_VWB1_WGM8_WGMXCC1_WGMXCCGn1
    SolutionIndex: 19
    SolutionNameMin: Cijk_Ailk_Bjlk_HHS_BH_UserArgs_MT256x256x32_MI16x16x1_SN_LDSB1_CLR1_GSU0_GSUC0_GSUWGMRR0_K1_LBSPPA2048_LBSPPB2048_LPA32_LPB32_MIWT8_8_PLR1_SU32_SUM0_SUS256_VWA2_VWB2_WGM8_WGMXCC1_WGMXCCGn1
    SolutionIndex: 20
    SolutionNameMin: Cijk_Ailk_Bjlk_HHS_BH_UserArgs_MT256x256x32_MI16x16x1_SN_LDSB1_CLR1_GSU0_GSUC0_GSUWGMRR0_K1_LBSPPA2048_LBSPPB2048_LPA0_LPB32_MIWT8_8_PLR1_SU32_SUM0_SUS256_VWA4_VWB2_WGM8_WGMXCC1_WGMXCCGn1
    SolutionIndex: 21
    SolutionNameMin: Cijk_Ailk_Bjlk_HHS_BH_UserArgs_MT256x256x32_MI16x16x1_SN_LDSB0_CLR1_GSU0_GSUC0_GSUWGMRR0_K1_LBSPPA2048_LBSPPB2048_LPA0_LPB0_MIWT8_8_PLR1_SU32_SUM0_SUS256_VWA4_VWB4_WGM8_WGMXCC1_WGMXCCGn1
    SolutionIndex: 22
    SolutionNameMin: Cijk_Ailk_Bjlk_HHS_BH_UserArgs_MT256x256x32_MI16x16x1_SN_LDSB0_CLR1_GSU0_GSUC0_GSUWGMRR0_K1_LBSPPA2048_LBSPPB2048_LPA0_LPB0_MIWT8_8_PLR1_SU32_SUM0_SUS256_VWA8_VWB4_WGM8_WGMXCC1_WGMXCCGn1
    SolutionIndex: 23
    SolutionNameMin: Cijk_Ailk_Bjlk_HHS_BH_UserArgs_MT256x256x32_MI16x16x1_SN_LDSB0_CLR1_GSU0_GSUC0_GSUWGMRR0_K1_LBSPPA2048_LBSPPB2048_LPA0_LPB0_MIWT8_8_PLR1_SU32_SUM0_SUS256_VWA4_VWB8_WGM8_WGMXCC1_WGMXCCGn1
    SolutionIndex: 24
    SolutionNameMin: Cijk_Ailk_Bjlk_HHS_BH_UserArgs_MT256x256x32_MI16x16x1_SN_LDSB0_CLR1_GSU0_GSUC0_GSUWGMRR0_K1_LBSPPA2048_LBSPPB2048_LPA0_LPB0_MIWT8_8_PLR1_SU32_SUM0_SUS256_VWA8_VWB8_WGM8_WGMXCC1_WGMXCCGn1
    SolutionIndex: 25
    SolutionNameMin: Cijk_Ailk_Bjlk_HHS_BH_UserArgs_MT128x256x32_MI16x16x1_SN_LDSB1_CLR1_GSU0_GSUC0_GSUWGMRR0_K1_LBSPPA1024_LBSPPB2048_LPA32_LPB0_MIWT4_8_PLR1_SU32_SUM0_SUS256_VWA2_VWB4_WGM1_WGMXCC1_WGMXCCGn1
    SolutionIndex: 26
    SolutionNameMin: Cijk_Ailk_Bjlk_HHS_BH_UserArgs_MT128x256x32_MI16x16x1_SN_LDSB1_CLR1_GSU0_GSUC0_GSUWGMRR0_K1_LBSPPA1024_LBSPPB2048_LPA0_LPB0_MIWT4_8_PLR1_SU32_SUM0_SUS256_VWA4_VWB4_WGM1_WGMXCC1_WGMXCCGn1
    SolutionIndex: 27
    SolutionNameMin: Cijk_Ailk_Bjlk_HHS_BH_UserArgs_MT128x256x32_MI16x16x1_SN_LDSB1_CLR1_GSU0_GSUC0_GSUWGMRR0_K1_LBSPPA1024_LBSPPB2048_LPA32_LPB0_MIWT4_8_PLR1_SU32_SUM0_SUS256_VWA2_VWB8_WGM1_WGMXCC1_WGMXCCGn1
    SolutionIndex: 28
    SolutionNameMin: Cijk_Ailk_Bjlk_HHS_BH_UserArgs_MT128x256x32_MI16x16x1_SN_LDSB1_CLR1_GSU0_GSUC0_GSUWGMRR0_K1_LBSPPA1024_LBSPPB2048_LPA0_LPB0_MIWT4_8_PLR1_SU32_SUM0_SUS256_VWA4_VWB8_WGM1_WGMXCC1_WGMXCCGn1
    SolutionIndex: 29
    SolutionNameMin: Cijk_Ailk_Bjlk_HHS_BH_UserArgs_MT128x256x32_MI16x16x1_SN_LDSB1_CLR1_GSU0_GSUC0_GSUWGMRR0_K1_LBSPPA1024_LBSPPB2048_LPA0_LPB32_MIWT4_8_PLR1_SU32_SUM0_SUS256_VWA4_VWB2_WGM4_WGMXCC1_WGMXCCGn1
    SolutionIndex: 30
    SolutionNameMin: Cijk_Ailk_Bjlk_HHS_BH_UserArgs_MT128x256x32_MI16x16x1_SN_LDSB1_CLR1_GSU0_GSUC0_GSUWGMRR0_K1_LBSPPA1024_LBSPPB2048_LPA32_LPB0_MIWT4_8_PLR1_SU32_SUM0_SUS256_VWA2_VWB4_WGM4_WGMXCC1_WGMXCCGn1
    SolutionIndex: 31
    SolutionNameMin: Cijk_Ailk_Bjlk_HHS_BH_UserArgs_MT128x256x32_MI16x16x1_SN_LDSB1_CLR1_GSU0_GSUC0_GSUWGMRR0_K1_LBSPPA1024_LBSPPB2048_LPA0_LPB0_MIWT4_8_PLR1_SU32_SUM0_SUS256_VWA4_VWB8_WGM4_WGMXCC1_WGMXCCGn1
    SolutionIndex: 32
    SolutionNameMin: Cijk_Ailk_Bjlk_HHS_BH_UserArgs_MT128x256x32_MI16x16x1_SN_LDSB1_CLR1_GSU0_GSUC0_GSUWGMRR0_K1_LBSPPA1024_LBSPPB2048_LPA0_LPB0_MIWT4_8_PLR1_SU32_SUM0_SUS256_VWA4_VWB8_WGM8_WGMXCC1_WGMXCCGn1
    SolutionIndex: 33
    SolutionNameMin: Cijk_Ailk_Bjlk_HHS_BH_UserArgs_MT256x128x32_MI16x16x1_SN_LDSB1_CLR1_GSU0_GSUC0_GSUWGMRR0_K1_LBSPPA2048_LBSPPB1024_LPA0_LPB16_MIWT8_4_PLR1_SU32_SUM0_SUS256_VWA4_VWB1_WGM1_WGMXCC1_WGMXCCGn1
    SolutionIndex: 34
    SolutionNameMin: Cijk_Ailk_Bjlk_HHS_BH_UserArgs_MT256x128x32_MI16x16x1_SN_LDSB1_CLR1_GSU0_GSUC0_GSUWGMRR0_K1_LBSPPA2048_LBSPPB1024_LPA0_LPB16_MIWT8_4_PLR1_SU32_SUM0_SUS256_VWA8_VWB1_WGM1_WGMXCC1_WGMXCCGn1
    SolutionIndex: 35
    SolutionNameMin: Cijk_Ailk_Bjlk_HHS_BH_UserArgs_MT256x128x32_MI16x16x1_SN_LDSB1_CLR1_GSU0_GSUC0_GSUWGMRR0_K1_LBSPPA2048_LBSPPB1024_LPA0_LPB32_MIWT8_4_PLR1_SU32_SUM0_SUS256_VWA4_VWB2_WGM1_WGMXCC1_WGMXCCGn1
    SolutionIndex: 36
    SolutionNameMin: Cijk_Ailk_Bjlk_HHS_BH_UserArgs_MT256x128x32_MI16x16x1_SN_LDSB1_CLR1_GSU0_GSUC0_GSUWGMRR0_K1_LBSPPA2048_LBSPPB1024_LPA0_LPB32_MIWT8_4_PLR1_SU32_SUM0_SUS256_VWA8_VWB2_WGM1_WGMXCC1_WGMXCCGn1
    SolutionIndex: 37
    SolutionNameMin: Cijk_Ailk_Bjlk_HHS_BH_UserArgs_MT256x128x32_MI16x16x1_SN_LDSB1_CLR1_GSU0_GSUC0_GSUWGMRR0_K1_LBSPPA2048_LBSPPB1024_LPA0_LPB0_MIWT8_4_PLR1_SU32_SUM0_SUS256_VWA4_VWB4_WGM1_WGMXCC1_WGMXCCGn1
    SolutionIndex: 38
    SolutionNameMin: Cijk_Ailk_Bjlk_HHS_BH_UserArgs_MT256x128x32_MI16x16x1_SN_LDSB1_CLR1_GSU0_GSUC0_GSUWGMRR0_K1_LBSPPA2048_LBSPPB1024_LPA0_LPB0_MIWT8_4_PLR1_SU32_SUM0_SUS256_VWA8_VWB4_WGM1_WGMXCC1_WGMXCCGn1
    SolutionIndex: 39
    SolutionNameMin: Cijk_Ailk_Bjlk_HHS_BH_UserArgs_MT256x128x32_MI16x16x1_SN_LDSB1_CLR1_GSU0_GSUC0_GSUWGMRR0_K1_LBSPPA2048_LBSPPB1024_LPA0_LPB16_MIWT8_4_PLR1_SU32_SUM0_SUS256_VWA8_VWB1_WGM4_WGMXCC1_WGMXCCGn1
    SolutionIndex: 40
    SolutionNameMin: Cijk_Ailk_Bjlk_HHS_BH_UserArgs_MT256x128x32_MI16x16x1_SN_LDSB1_CLR1_GSU0_GSUC0_GSUWGMRR0_K1_LBSPPA2048_LBSPPB1024_LPA0_LPB32_MIWT8_4_PLR1_SU32_SUM0_SUS256_VWA8_VWB2_WGM4_WGMXCC1_WGMXCCGn1
    SolutionIndex: 41
    SolutionNameMin: Cijk_Ailk_Bjlk_HHS_BH_UserArgs_MT256x128x32_MI16x16x1_SN_LDSB1_CLR1_GSU0_GSUC0_GSUWGMRR0_K1_LBSPPA2048_LBSPPB1024_LPA0_LPB16_MIWT8_4_PLR1_SU32_SUM0_SUS256_VWA4_VWB1_WGM8_WGMXCC1_WGMXCCGn1
    SolutionIndex: 42
    SolutionNameMin: Cijk_Ailk_Bjlk_HHS_BH_UserArgs_MT256x128x32_MI16x16x1_SN_LDSB1_CLR1_GSU0_GSUC0_GSUWGMRR0_K1_LBSPPA2048_LBSPPB1024_LPA0_LPB32_MIWT8_4_PLR1_SU32_SUM0_SUS256_VWA4_VWB2_WGM8_WGMXCC1_WGMXCCGn1
    SolutionIndex: 43
    SolutionNameMin: Cijk_Ailk_Bjlk_HHS_BH_UserArgs_MT256x128x32_MI16x16x1_SN_LDSB1_CLR1_GSU0_GSUC0_GSUWGMRR0_K1_LBSPPA2048_LBSPPB1024_LPA0_LPB0_MIWT8_4_PLR1_SU32_SUM0_SUS256_VWA4_VWB4_WGM8_WGMXCC1_WGMXCCGn1
    SolutionIndex: 44
    SolutionNameMin: Cijk_Ailk_Bjlk_HHS_BH_UserArgs_MT128x128x32_MI16x16x1_SN_LDSB1_CLR1_GSU0_GSUC0_GSUWGMRR0_K1_LBSPPA1024_LBSPPB1024_LPA32_LPB16_MIWT4_4_PLR1_SU32_SUM0_SUS256_VWA2_VWB1_WGM1_WGMXCC1_WGMXCCGn1
    SolutionIndex: 45
    SolutionNameMin: Cijk_Ailk_Bjlk_HHS_BH_UserArgs_MT128x128x32_MI16x16x1_SN_LDSB0_CLR1_GSU0_GSUC0_GSUWGMRR0_K1_LBSPPA1024_LBSPPB1024_LPA0_LPB0_MIWT4_4_PLR1_SU32_SUM0_SUS256_VWA4_VWB4_WGM1_WGMXCC1_WGMXCCGn1
    SolutionIndex: 46
    SolutionNameMin: Cijk_Ailk_Bjlk_HHS_BH_UserArgs_MT64x128x32_MI16x16x1_SN_LDSB0_CLR1_GSU0_GSUC0_GSUWGMRR0_K1_LBSPPA512_LBSPPB1024_LPA32_LPB0_MIWT2_4_PLR1_SU32_SUM0_SUS256_VWA2_VWB4_WGM1_WGMXCC1_WGMXCCGn1
    SolutionIndex: 47
    SolutionNameMin: Cijk_Ailk_Bjlk_HHS_BH_UserArgs_MT128x64x32_MI16x16x1_SN_LDSB0_CLR1_GSU0_GSUC0_GSUWGMRR0_K1_LBSPPA1024_LBSPPB512_LPA32_LPB16_MIWT4_2_PLR1_SU32_SUM0_SUS256_VWA2_VWB1_WGM1_WGMXCC1_WGMXCCGn1
    SolutionIndex: 48
    SolutionNameMin: Cijk_Ailk_Bjlk_HHS_BH_UserArgs_MT128x64x32_MI16x16x1_SN_LDSB0_CLR1_GSU0_GSUC0_GSUWGMRR0_K1_LBSPPA1024_LBSPPB512_LPA0_LPB32_MIWT4_2_PLR1_SU32_SUM0_SUS256_VWA4_VWB2_WGM1_WGMXCC1_WGMXCCGn1
    SolutionIndex: 49
    SolutionNameMin: Cijk_Ailk_Bjlk_HHS_BH_UserArgs_MT64x64x32_MI16x16x1_SN_LDSB0_CLR1_GSU0_GSUC0_GSUWGMRR0_K1_LBSPPA512_LBSPPB512_LPA32_LPB32_MIWT2_2_PLR1_SU32_SUM0_SUS256_VWA2_VWB2_WGM1_WGMXCC1_WGMXCCGn1
    SolutionIndex: 50
    SolutionNameMin: Cijk_Ailk_Bjlk_HHS_BH_UserArgs_MT32x32x32_MI16x16x1_SN_LDSB0_CLR1_GSU0_GSUC0_GSUWGMRR0_K1_LBSPPA256_LBSPPB256_LPA16_LPB16_MIWT1_1_PLR1_SU32_SUM0_SUS256_VWA1_VWB1_WGM1_WGMXCC1_WGMXCCGn1
    SolutionIndex: 51
    SolutionNameMin: Cijk_Ailk_Bjlk_HHS_BH_UserArgs_MT256x256x64_MI16x16x1_SN_LDSB1_CLR1_GSU0_GSUC0_GSUWGMRR0_K1_LBSPPA2048_LBSPPB2048_LPA0_LPB0_MIWT8_8_PLR1_SU32_SUM0_SUS256_VWA4_VWB4_WGM1_WGMXCC1_WGMXCCGn1
    SolutionIndex: 52
    SolutionNameMin: Cijk_Ailk_Bjlk_HHS_BH_UserArgs_MT256x256x64_MI16x16x1_SN_LDSB1_CLR1_GSU0_GSUC0_GSUWGMRR0_K1_LBSPPA2048_LBSPPB2048_LPA0_LPB0_MIWT8_8_PLR1_SU32_SUM0_SUS256_VWA8_VWB4_WGM1_WGMXCC1_WGMXCCGn1
    SolutionIndex: 53
    SolutionNameMin: Cijk_Ailk_Bjlk_HHS_BH_UserArgs_MT256x256x64_MI16x16x1_SN_LDSB1_CLR1_GSU0_GSUC0_GSUWGMRR0_K1_LBSPPA2048_LBSPPB2048_LPA0_LPB0_MIWT8_8_PLR2_SU32_SUM0_SUS256_VWA4_VWB4_WGM1_WGMXCC1_WGMXCCGn1
    SolutionIndex: 54
    SolutionNameMin: Cijk_Ailk_Bjlk_HHS_BH_UserArgs_MT256x256x64_MI16x16x1_SN_LDSB1_CLR1_GSU0_GSUC0_GSUWGMRR0_K1_LBSPPA2048_LBSPPB2048_LPA0_LPB0_MIWT8_8_PLR2_SU32_SUM0_SUS256_VWA8_VWB4_WGM1_WGMXCC1_WGMXCCGn1
    SolutionIndex: 55
    SolutionNameMin: Cijk_Ailk_Bjlk_HHS_BH_UserArgs_MT256x256x64_MI16x16x1_SN_LDSB1_CLR1_GSU0_GSUC0_GSUWGMRR0_K1_LBSPPA2048_LBSPPB2048_LPA0_LPB0_MIWT8_8_PLR2_SU32_SUM0_SUS256_VWA8_VWB8_WGM1_WGMXCC1_WGMXCCGn1
    SolutionIndex: 56
    SolutionNameMin: Cijk_Ailk_Bjlk_HHS_BH_UserArgs_MT256x256x64_MI16x16x1_SN_LDSB1_CLR1_GSU0_GSUC0_GSUWGMRR0_K1_LBSPPA2048_LBSPPB2048_LPA0_LPB0_MIWT8_8_PLR1_SU32_SUM0_SUS256_VWA4_VWB4_WGM4_WGMXCC1_WGMXCCGn1
    SolutionIndex: 57
    SolutionNameMin: Cijk_Ailk_Bjlk_HHS_BH_UserArgs_MT256x256x64_MI16x16x1_SN_LDSB1_CLR1_GSU0_GSUC0_GSUWGMRR0_K1_LBSPPA2048_LBSPPB2048_LPA0_LPB0_MIWT8_8_PLR1_SU32_SUM0_SUS256_VWA8_VWB4_WGM4_WGMXCC1_WGMXCCGn1
    SolutionIndex: 58
    SolutionNameMin: Cijk_Ailk_Bjlk_HHS_BH_UserArgs_MT256x256x64_MI16x16x1_SN_LDSB1_CLR1_GSU0_GSUC0_GSUWGMRR0_K1_LBSPPA2048_LBSPPB2048_LPA0_LPB0_MIWT8_8_PLR2_SU32_SUM0_SUS256_VWA4_VWB4_WGM4_WGMXCC1_WGMXCCGn1
    SolutionIndex: 59
    SolutionNameMin: Cijk_Ailk_Bjlk_HHS_BH_UserArgs_MT256x256x64_MI16x16x1_SN_LDSB1_CLR1_GSU0_GSUC0_GSUWGMRR0_K1_LBSPPA2048_LBSPPB2048_LPA0_LPB0_MIWT8_8_PLR1_SU32_SUM0_SUS256_VWA4_VWB4_WGM8_WGMXCC1_WGMXCCGn1
    SolutionIndex: 60
    SolutionNameMin: Cijk_Ailk_Bjlk_HHS_BH_UserArgs_MT256x256x64_MI16x16x1_SN_LDSB1_CLR1_GSU0_GSUC0_GSUWGMRR0_K1_LBSPPA2048_LBSPPB2048_LPA0_LPB0_MIWT8_8_PLR1_SU32_SUM0_SUS256_VWA8_VWB8_WGM8_WGMXCC1_WGMXCCGn1
    SolutionIndex: 61
    SolutionNameMin: Cijk_Ailk_Bjlk_HHS_BH_UserArgs_MT256x256x64_MI16x16x1_SN_LDSB1_CLR1_GSU0_GSUC0_GSUWGMRR0_K1_LBSPPA2048_LBSPPB2048_LPA0_LPB0_MIWT8_8_PLR2_SU32_SUM0_SUS256_VWA4_VWB4_WGM8_WGMXCC1_WGMXCCGn1
    SolutionIndex: 62
    SolutionNameMin: Cijk_Ailk_Bjlk_HHS_BH_UserArgs_MT256x256x64_MI16x16x1_SN_LDSB1_CLR1_GSU0_GSUC0_GSUWGMRR0_K1_LBSPPA2048_LBSPPB2048_LPA0_LPB0_MIWT8_8_PLR2_SU32_SUM0_SUS256_VWA8_VWB8_WGM8_WGMXCC1_WGMXCCGn1
    SolutionIndex: 63
    SolutionNameMin: Cijk_Ailk_Bjlk_HHS_BH_UserArgs_MT128x256x64_MI16x16x1_SN_LDSB1_CLR1_GSU0_GSUC0_GSUWGMRR0_K1_LBSPPA1024_LBSPPB2048_LPA0_LPB32_MIWT4_8_PLR1_SU32_SUM0_SUS256_VWA4_VWB2_WGM1_WGMXCC1_WGMXCCGn1
    SolutionIndex: 64
    SolutionNameMin: Cijk_Ailk_Bjlk_HHS_BH_UserArgs_MT128x256x64_MI16x16x1_SN_LDSB1_CLR1_GSU0_GSUC0_GSUWGMRR0_K1_LBSPPA1024_LBSPPB2048_LPA32_LPB0_MIWT4_8_PLR1_SU32_SUM0_SUS256_VWA2_VWB4_WGM1_WGMXCC1_WGMXCCGn1
    SolutionIndex: 65
    SolutionNameMin: Cijk_Ailk_Bjlk_HHS_BH_UserArgs_MT128x256x64_MI16x16x1_SN_LDSB1_CLR1_GSU0_GSUC0_GSUWGMRR0_K1_LBSPPA1024_LBSPPB2048_LPA0_LPB0_MIWT4_8_PLR1_SU32_SUM0_SUS256_VWA4_VWB4_WGM1_WGMXCC1_WGMXCCGn1
    SolutionIndex: 66
    SolutionNameMin: Cijk_Ailk_Bjlk_HHS_BH_UserArgs_MT128x256x64_MI16x16x1_SN_LDSB1_CLR1_GSU0_GSUC0_GSUWGMRR0_K1_LBSPPA1024_LBSPPB2048_LPA0_LPB0_MIWT4_8_PLR1_SU32_SUM0_SUS256_VWA4_VWB4_WGM4_WGMXCC1_WGMXCCGn1
    SolutionIndex: 67
    SolutionNameMin: Cijk_Ailk_Bjlk_HHS_BH_UserArgs_MT128x256x64_MI16x16x1_SN_LDSB1_CLR1_GSU0_GSUC0_GSUWGMRR0_K1_LBSPPA1024_LBSPPB2048_LPA0_LPB32_MIWT4_8_PLR1_SU32_SUM0_SUS256_VWA4_VWB2_WGM8_WGMXCC1_WGMXCCGn1
    SolutionIndex: 68
    SolutionNameMin: Cijk_Ailk_Bjlk_HHS_BH_UserArgs_MT128x256x64_MI16x16x1_SN_LDSB1_CLR1_GSU0_GSUC0_GSUWGMRR0_K1_LBSPPA1024_LBSPPB2048_LPA32_LPB0_MIWT4_8_PLR1_SU32_SUM0_SUS256_VWA2_VWB4_WGM8_WGMXCC1_WGMXCCGn1
    SolutionIndex: 69
    SolutionNameMin: Cijk_Ailk_Bjlk_HHS_BH_UserArgs_MT128x256x64_MI16x16x1_SN_LDSB1_CLR1_GSU0_GSUC0_GSUWGMRR0_K1_LBSPPA1024_LBSPPB2048_LPA0_LPB0_MIWT4_8_PLR1_SU32_SUM0_SUS256_VWA4_VWB4_WGM8_WGMXCC1_WGMXCCGn1
    SolutionIndex: 70
    SolutionNameMin: Cijk_Ailk_Bjlk_HHS_BH_UserArgs_MT128x256x64_MI16x16x1_SN_LDSB1_CLR1_GSU0_GSUC0_GSUWGMRR0_K1_LBSPPA1024_LBSPPB2048_LPA0_LPB32_MIWT4_8_PLR2_SU32_SUM0_SUS256_VWA4_VWB2_WGM8_WGMXCC1_WGMXCCGn1
    SolutionIndex: 71
    SolutionNameMin: Cijk_Ailk_Bjlk_HHS_BH_UserArgs_MT128x256x64_MI16x16x1_SN_LDSB1_CLR1_GSU0_GSUC0_GSUWGMRR0_K1_LBSPPA1024_LBSPPB2048_LPA32_LPB0_MIWT4_8_PLR2_SU32_SUM0_SUS256_VWA2_VWB4_WGM8_WGMXCC1_WGMXCCGn1
    SolutionIndex: 72
    SolutionNameMin: Cijk_Ailk_Bjlk_HHS_BH_UserArgs_MT256x128x64_MI16x16x1_SN_LDSB1_CLR1_GSU0_GSUC0_GSUWGMRR0_K1_LBSPPA2048_LBSPPB1024_LPA0_LPB32_MIWT8_4_PLR1_SU32_SUM0_SUS256_VWA8_VWB2_WGM1_WGMXCC1_WGMXCCGn1
    SolutionIndex: 73
    SolutionNameMin: Cijk_Ailk_Bjlk_HHS_BH_UserArgs_MT256x128x64_MI16x16x1_SN_LDSB1_CLR1_GSU0_GSUC0_GSUWGMRR0_K1_LBSPPA2048_LBSPPB1024_LPA32_LPB0_MIWT8_4_PLR1_SU32_SUM0_SUS256_VWA2_VWB4_WGM1_WGMXCC1_WGMXCCGn1
    SolutionIndex: 74
    SolutionNameMin: Cijk_Ailk_Bjlk_HHS_BH_UserArgs_MT256x128x64_MI16x16x1_SN_LDSB1_CLR1_GSU0_GSUC0_GSUWGMRR0_K1_LBSPPA2048_LBSPPB1024_LPA0_LPB0_MIWT8_4_PLR1_SU32_SUM0_SUS256_VWA4_VWB4_WGM1_WGMXCC1_WGMXCCGn1
    SolutionIndex: 75
    SolutionNameMin: Cijk_Ailk_Bjlk_HHS_BH_UserArgs_MT256x128x64_MI16x16x1_SN_LDSB1_CLR1_GSU0_GSUC0_GSUWGMRR0_K1_LBSPPA2048_LBSPPB1024_LPA0_LPB32_MIWT8_4_PLR2_SU32_SUM0_SUS256_VWA4_VWB2_WGM1_WGMXCC1_WGMXCCGn1
    SolutionIndex: 76
    SolutionNameMin: Cijk_Ailk_Bjlk_HHS_BH_UserArgs_MT256x128x64_MI16x16x1_SN_LDSB1_CLR1_GSU0_GSUC0_GSUWGMRR0_K1_LBSPPA2048_LBSPPB1024_LPA0_LPB0_MIWT8_4_PLR2_SU32_SUM0_SUS256_VWA8_VWB4_WGM1_WGMXCC1_WGMXCCGn1
    SolutionIndex: 77
    SolutionNameMin: Cijk_Ailk_Bjlk_HHS_BH_UserArgs_MT256x128x64_MI16x16x1_SN_LDSB1_CLR1_GSU0_GSUC0_GSUWGMRR0_K1_LBSPPA2048_LBSPPB1024_LPA0_LPB16_MIWT8_4_PLR1_SU32_SUM0_SUS256_VWA4_VWB1_WGM4_WGMXCC1_WGMXCCGn1
    SolutionIndex: 78
    SolutionNameMin: Cijk_Ailk_Bjlk_HHS_BH_UserArgs_MT256x128x64_MI16x16x1_SN_LDSB1_CLR1_GSU0_GSUC0_GSUWGMRR0_K1_LBSPPA2048_LBSPPB1024_LPA32_LPB0_MIWT8_4_PLR1_SU32_SUM0_SUS256_VWA2_VWB4_WGM4_WGMXCC1_WGMXCCGn1
    SolutionIndex: 79
    SolutionNameMin: Cijk_Ailk_Bjlk_HHS_BH_UserArgs_MT256x128x64_MI16x16x1_SN_LDSB1_CLR1_GSU0_GSUC0_GSUWGMRR0_K1_LBSPPA2048_LBSPPB1024_LPA0_LPB0_MIWT8_4_PLR1_SU32_SUM0_SUS256_VWA4_VWB4_WGM4_WGMXCC1_WGMXCCGn1
    SolutionIndex: 80
    SolutionNameMin: Cijk_Ailk_Bjlk_HHS_BH_UserArgs_MT256x128x64_MI16x16x1_SN_LDSB1_CLR1_GSU0_GSUC0_GSUWGMRR0_K1_LBSPPA2048_LBSPPB1024_LPA0_LPB16_MIWT8_4_PLR1_SU32_SUM0_SUS256_VWA4_VWB1_WGM8_WGMXCC1_WGMXCCGn1
    SolutionIndex: 81
    SolutionNameMin: Cijk_Ailk_Bjlk_HHS_BH_UserArgs_MT256x128x64_MI16x16x1_SN_LDSB1_CLR1_GSU0_GSUC0_GSUWGMRR0_K1_LBSPPA2048_LBSPPB1024_LPA0_LPB32_MIWT8_4_PLR1_SU32_SUM0_SUS256_VWA4_VWB2_WGM8_WGMXCC1_WGMXCCGn1
    SolutionIndex: 82
    SolutionNameMin: Cijk_Ailk_Bjlk_HHS_BH_UserArgs_MT256x128x64_MI16x16x1_SN_LDSB1_CLR1_GSU0_GSUC0_GSUWGMRR0_K1_LBSPPA2048_LBSPPB1024_LPA32_LPB0_MIWT8_4_PLR1_SU32_SUM0_SUS256_VWA2_VWB4_WGM8_WGMXCC1_WGMXCCGn1
    SolutionIndex: 83
    SolutionNameMin: Cijk_Ailk_Bjlk_HHS_BH_UserArgs_MT128x128x64_MI16x16x1_SN_LDSB1_CLR1_GSU0_GSUC0_GSUWGMRR0_K1_LBSPPA1024_LBSPPB1024_LPA0_LPB32_MIWT4_4_PLR1_SU32_SUM0_SUS256_VWA4_VWB2_WGM1_WGMXCC1_WGMXCCGn1
    SolutionIndex: 84
    SolutionNameMin: Cijk_Ailk_Bjlk_HHS_BH_UserArgs_MT128x128x64_MI16x16x1_SN_LDSB1_CLR1_GSU0_GSUC0_GSUWGMRR0_K1_LBSPPA1024_LBSPPB1024_LPA32_LPB0_MIWT4_4_PLR1_SU32_SUM0_SUS256_VWA2_VWB4_WGM1_WGMXCC1_WGMXCCGn1
    SolutionIndex: 85
    SolutionNameMin: Cijk_Ailk_Bjlk_HHS_BH_UserArgs_MT128x128x64_MI16x16x1_SN_LDSB1_CLR1_GSU0_GSUC0_GSUWGMRR0_K1_LBSPPA1024_LBSPPB1024_LPA0_LPB0_MIWT4_4_PLR1_SU32_SUM0_SUS256_VWA4_VWB4_WGM1_WGMXCC1_WGMXCCGn1
    SolutionIndex: 86
    SolutionNameMin: Cijk_Ailk_Bjlk_HHS_BH_UserArgs_MT128x128x64_MI16x16x1_SN_LDSB1_CLR1_GSU0_GSUC0_GSUWGMRR0_K1_LBSPPA1024_LBSPPB1024_LPA0_LPB32_MIWT4_4_PLR2_SU32_SUM0_SUS256_VWA4_VWB2_WGM1_WGMXCC1_WGMXCCGn1
    SolutionIndex: 87
    SolutionNameMin: Cijk_Ailk_Bjlk_HHS_BH_UserArgs_MT128x128x64_MI16x16x1_SN_LDSB1_CLR1_GSU0_GSUC0_GSUWGMRR0_K1_LBSPPA1024_LBSPPB1024_LPA32_LPB0_MIWT4_4_PLR2_SU32_SUM0_SUS256_VWA2_VWB4_WGM1_WGMXCC1_WGMXCCGn1
    SolutionIndex: 88
    SolutionNameMin: Cijk_Ailk_Bjlk_HHS_BH_UserArgs_MT128x128x64_MI16x16x1_SN_LDSB1_CLR1_GSU0_GSUC0_GSUWGMRR0_K1_LBSPPA1024_LBSPPB1024_LPA0_LPB0_MIWT4_4_PLR2_SU32_SUM0_SUS256_VWA4_VWB4_WGM1_WGMXCC1_WGMXCCGn1
    SolutionIndex: 89
    SolutionNameMin: Cijk_Ailk_Bjlk_HHS_BH_UserArgs_MT128x128x64_MI16x16x1_SN_LDSB1_CLR1_GSU0_GSUC0_GSUWGMRR0_K1_LBSPPA1024_LBSPPB1024_LPA0_LPB32_MIWT4_4_PLR1_SU32_SUM0_SUS256_VWA4_VWB2_WGM4_WGMXCC1_WGMXCCGn1
    SolutionIndex: 90
    SolutionNameMin: Cijk_Ailk_Bjlk_HHS_BH_UserArgs_MT128x128x64_MI16x16x1_SN_LDSB1_CLR1_GSU0_GSUC0_GSUWGMRR0_K1_LBSPPA1024_LBSPPB1024_LPA32_LPB0_MIWT4_4_PLR1_SU32_SUM0_SUS256_VWA2_VWB4_WGM4_WGMXCC1_WGMXCCGn1
    SolutionIndex: 91
    SolutionNameMin: Cijk_Ailk_Bjlk_HHS_BH_UserArgs_MT128x128x64_MI16x16x1_SN_LDSB1_CLR1_GSU0_GSUC0_GSUWGMRR0_K1_LBSPPA1024_LBSPPB1024_LPA0_LPB0_MIWT4_4_PLR1_SU32_SUM0_SUS256_VWA4_VWB4_WGM4_WGMXCC1_WGMXCCGn1
    SolutionIndex: 92
    SolutionNameMin: Cijk_Ailk_Bjlk_HHS_BH_UserArgs_MT128x128x64_MI16x16x1_SN_LDSB1_CLR1_GSU0_GSUC0_GSUWGMRR0_K1_LBSPPA1024_LBSPPB1024_LPA0_LPB0_MIWT4_4_PLR2_SU32_SUM0_SUS256_VWA4_VWB4_WGM4_WGMXCC1_WGMXCCGn1
    SolutionIndex: 93
    SolutionNameMin: Cijk_Ailk_Bjlk_HHS_BH_UserArgs_MT128x128x64_MI16x16x1_SN_LDSB1_CLR1_GSU0_GSUC0_GSUWGMRR0_K1_LBSPPA1024_LBSPPB1024_LPA0_LPB0_MIWT4_4_PLR1_SU32_SUM0_SUS256_VWA4_VWB4_WGM8_WGMXCC1_WGMXCCGn1
    SolutionIndex: 94
    SolutionNameMin: Cijk_Ailk_Bjlk_HHS_BH_UserArgs_MT128x128x64_MI16x16x1_SN_LDSB1_CLR1_GSU0_GSUC0_GSUWGMRR0_K1_LBSPPA1024_LBSPPB1024_LPA32_LPB0_MIWT4_4_PLR2_SU32_SUM0_SUS256_VWA2_VWB4_WGM8_WGMXCC1_WGMXCCGn1
    SolutionIndex: 95
    SolutionNameMin: Cijk_Ailk_Bjlk_HHS_BH_UserArgs_MT128x128x64_MI16x16x1_SN_LDSB1_CLR1_GSU0_GSUC0_GSUWGMRR0_K1_LBSPPA1024_LBSPPB1024_LPA0_LPB0_MIWT4_4_PLR2_SU32_SUM0_SUS256_VWA4_VWB4_WGM8_WGMXCC1_WGMXCCGn1
    SolutionIndex: 96
    SolutionNameMin: Cijk_Ailk_Bjlk_HHS_BH_UserArgs_MT64x128x64_MI16x16x1_SN_LDSB1_CLR1_GSU0_GSUC0_GSUWGMRR0_K1_LBSPPA512_LBSPPB1024_LPA32_LPB0_MIWT2_4_PLR2_SU32_SUM0_SUS256_VWA2_VWB4_WGM1_WGMXCC1_WGMXCCGn1
    SolutionIndex: 97
    SolutionNameMin: Cijk_Ailk_Bjlk_HHS_BH_UserArgs_MT128x64x64_MI16x16x1_SN_LDSB1_CLR1_GSU0_GSUC0_GSUWGMRR0_K1_LBSPPA1024_LBSPPB512_LPA32_LPB32_MIWT4_2_PLR2_SU32_SUM0_SUS256_VWA2_VWB2_WGM1_WGMXCC1_WGMXCCGn1
    SolutionIndex: 98
    SolutionNameMin: Cijk_Ailk_Bjlk_HHS_BH_UserArgs_MT128x64x64_MI16x16x1_SN_LDSB1_CLR1_GSU0_GSUC0_GSUWGMRR0_K1_LBSPPA1024_LBSPPB512_LPA0_LPB32_MIWT4_2_PLR2_SU32_SUM0_SUS256_VWA4_VWB2_WGM1_WGMXCC1_WGMXCCGn1
    SolutionIndex: 99
    SolutionNameMin: Cijk_Ailk_Bjlk_HHS_BH_UserArgs_MT128x64x64_MI16x16x1_SN_LDSB1_CLR1_GSU0_GSUC0_GSUWGMRR0_K1_LBSPPA1024_LBSPPB512_LPA0_LPB32_MIWT4_2_PLR2_SU32_SUM0_SUS256_VWA4_VWB2_WGM4_WGMXCC1_WGMXCCGn1
    SolutionIndex: 100
    SolutionNameMin: Cijk_Ailk_Bjlk_HHS_BH_UserArgs_MT128x64x64_MI16x16x1_SN_LDSB1_CLR1_GSU0_GSUC0_GSUWGMRR0_K1_LBSPPA1024_LBSPPB512_LPA0_LPB32_MIWT4_2_PLR1_SU32_SUM0_SUS256_VWA4_VWB2_WGM8_WGMXCC1_WGMXCCGn1
    SolutionIndex: 101
    SolutionNameMin: Cijk_Ailk_Bjlk_HHS_BH_UserArgs_MT128x64x64_MI16x16x1_SN_LDSB1_CLR1_GSU0_GSUC0_GSUWGMRR0_K1_LBSPPA1024_LBSPPB512_LPA0_LPB32_MIWT4_2_PLR2_SU32_SUM0_SUS256_VWA4_VWB2_WGM8_WGMXCC1_WGMXCCGn1
    SolutionIndex: 102
    SolutionNameMin: Cijk_Ailk_Bjlk_HHS_BH_UserArgs_MT64x64x64_MI16x16x1_SN_LDSB1_CLR1_GSU0_GSUC0_GSUWGMRR0_K1_LBSPPA512_LBSPPB512_LPA32_LPB16_MIWT2_2_PLR1_SU32_SUM0_SUS256_VWA2_VWB1_WGM1_WGMXCC1_WGMXCCGn1
    SolutionIndex: 103
    SolutionNameMin: Cijk_Ailk_Bjlk_HHS_BH_UserArgs_MT64x64x64_MI16x16x1_SN_LDSB1_CLR1_GSU0_GSUC0_GSUWGMRR0_K1_LBSPPA512_LBSPPB512_LPA32_LPB32_MIWT2_2_PLR1_SU32_SUM0_SUS256_VWA2_VWB2_WGM1_WGMXCC1_WGMXCCGn1
    SolutionIndex: 104
    SolutionNameMin: Cijk_Ailk_Bjlk_HHS_BH_UserArgs_MT64x64x64_MI16x16x1_SN_LDSB1_CLR1_GSU0_GSUC0_GSUWGMRR0_K1_LBSPPA512_LBSPPB512_LPA32_LPB32_MIWT2_2_PLR2_SU32_SUM0_SUS256_VWA2_VWB2_WGM1_WGMXCC1_WGMXCCGn1
    SolutionIndex: 105
    SolutionNameMin: Cijk_Ailk_Bjlk_HHS_BH_UserArgs_MT32x64x64_MI16x16x1_SN_LDSB0_CLR1_GSU0_GSUC0_GSUWGMRR0_K1_LBSPPA256_LBSPPB512_LPA16_LPB32_MIWT1_2_PLR2_SU32_SUM0_SUS256_VWA1_VWB2_WGM1_WGMXCC1_WGMXCCGn1
    SolutionIndex: 106
    SolutionNameMin: Cijk_Ailk_Bjlk_HHS_BH_UserArgs_MT64x32x64_MI16x16x1_SN_LDSB0_CLR1_GSU0_GSUC0_GSUWGMRR0_K1_LBSPPA512_LBSPPB256_LPA32_LPB16_MIWT2_1_PLR1_SU32_SUM0_SUS256_VWA2_VWB1_WGM1_WGMXCC1_WGMXCCGn1
    SolutionIndex: 107
    SolutionNameMin: Cijk_Ailk_Bjlk_HHS_BH_UserArgs_MT64x32x64_MI16x16x1_SN_LDSB0_CLR1_GSU0_GSUC0_GSUWGMRR0_K1_LBSPPA512_LBSPPB256_LPA32_LPB16_MIWT2_1_PLR2_SU32_SUM0_SUS256_VWA2_VWB1_WGM1_WGMXCC1_WGMXCCGn1
    SolutionIndex: 108
    SolutionNameMin: Cijk_Ailk_Bjlk_HHS_BH_UserArgs_MT32x32x64_MI16x16x1_SN_LDSB0_CLR1_GSU0_GSUC0_GSUWGMRR0_K1_LBSPPA256_LBSPPB256_LPA16_LPB16_MIWT1_1_PLR1_SU32_SUM0_SUS256_VWA1_VWB1_WGM1_WGMXCC1_WGMXCCGn1
    SolutionIndex: 109
    SolutionNameMin: Cijk_Ailk_Bjlk_HHS_BH_UserArgs_MT32x32x64_MI16x16x1_SN_LDSB0_CLR1_GSU0_GSUC0_GSUWGMRR0_K1_LBSPPA256_LBSPPB256_LPA16_LPB16_MIWT1_1_PLR2_SU32_SUM0_SUS256_VWA1_VWB1_WGM1_WGMXCC1_WGMXCCGn1
    SolutionIndex: 110
    SolutionNameMin: Cijk_Ailk_Bjlk_HHS_BH_UserArgs_MT128x128x128_MI16x16x1_SN_LDSB1_CLR1_GSU0_GSUC0_GSUWGMRR0_K1_LBSPPA1024_LBSPPB1024_LPA0_LPB0_MIWT4_4_PLR1_SU32_SUM0_SUS256_VWA4_VWB4_WGM1_WGMXCC1_WGMXCCGn1
    SolutionIndex: 111
    SolutionNameMin: Cijk_Ailk_Bjlk_HHS_BH_UserArgs_MT128x128x128_MI16x16x1_SN_LDSB1_CLR1_GSU0_GSUC0_GSUWGMRR0_K1_LBSPPA1024_LBSPPB1024_LPA0_LPB0_MIWT4_4_PLR1_SU32_SUM0_SUS256_VWA4_VWB4_WGM4_WGMXCC1_WGMXCCGn1
    SolutionIndex: 112
    SolutionNameMin: Cijk_Ailk_Bjlk_HHS_BH_UserArgs_MT128x128x128_MI16x16x1_SN_LDSB1_CLR1_GSU0_GSUC0_GSUWGMRR0_K1_LBSPPA1024_LBSPPB1024_LPA0_LPB0_MIWT4_4_PLR1_SU32_SUM0_SUS256_VWA4_VWB4_WGM8_WGMXCC1_WGMXCCGn1
    SolutionIndex: 113
    SolutionNameMin: Cijk_Ailk_Bjlk_HHS_BH_UserArgs_MT64x128x128_MI16x16x1_SN_LDSB1_CLR1_GSU0_GSUC0_GSUWGMRR0_K1_LBSPPA512_LBSPPB1024_LPA32_LPB0_MIWT2_4_PLR2_SU32_SUM0_SUS256_VWA2_VWB4_WGM1_WGMXCC1_WGMXCCGn1
    SolutionIndex: 114
    SolutionNameMin: Cijk_Ailk_Bjlk_HHS_BH_UserArgs_MT128x64x128_MI16x16x1_SN_LDSB1_CLR1_GSU0_GSUC0_GSUWGMRR0_K1_LBSPPA1024_LBSPPB512_LPA0_LPB32_MIWT4_2_PLR2_SU32_SUM0_SUS256_VWA4_VWB2_WGM1_WGMXCC1_WGMXCCGn1
    SolutionIndex: 115
    SolutionNameMin: Cijk_Ailk_Bjlk_HHS_BH_UserArgs_MT64x64x128_MI16x16x1_SN_LDSB1_CLR1_GSU0_GSUC0_GSUWGMRR0_K1_LBSPPA512_LBSPPB512_LPA32_LPB32_MIWT2_2_PLR2_SU32_SUM0_SUS256_VWA2_VWB2_WGM1_WGMXCC1_WGMXCCGn1
    SolutionIndex: 116
    SolutionNameMin: Cijk_Ailk_Bjlk_HHS_BH_UserArgs_MT64x64x128_MI16x16x1_SN_LDSB1_CLR1_GSU0_GSUC0_GSUWGMRR0_K1_LBSPPA512_LBSPPB512_LPA32_LPB32_MIWT2_2_PLR2_SU32_SUM0_SUS256_VWA2_VWB2_WGM4_WGMXCC1_WGMXCCGn1
    SolutionIndex: 117
    SolutionNameMin: Cijk_Ailk_Bjlk_HHS_BH_UserArgs_MT64x64x128_MI16x16x1_SN_LDSB1_CLR1_GSU0_GSUC0_GSUWGMRR0_K1_LBSPPA512_LBSPPB512_LPA32_LPB32_MIWT2_2_PLR2_SU32_SUM0_SUS256_VWA2_VWB2_WGM8_WGMXCC1_WGMXCCGn1
    SolutionIndex: 118
    SolutionNameMin: Cijk_Ailk_Bjlk_HHS_BH_UserArgs_MT32x64x128_MI16x16x1_SN_LDSB1_CLR1_GSU0_GSUC0_GSUWGMRR0_K1_LBSPPA256_LBSPPB512_LPA16_LPB32_MIWT1_2_PLR2_SU32_SUM0_SUS256_VWA1_VWB2_WGM1_WGMXCC1_WGMXCCGn1
    SolutionIndex: 119
    SolutionNameMin: Cijk_Ailk_Bjlk_HHS_BH_UserArgs_MT64x32x128_MI16x16x1_SN_LDSB1_CLR1_GSU0_GSUC0_GSUWGMRR0_K1_LBSPPA512_LBSPPB256_LPA32_LPB16_MIWT2_1_PLR1_SU32_SUM0_SUS256_VWA2_VWB1_WGM1_WGMXCC1_WGMXCCGn1
    SolutionIndex: 120
    SolutionNameMin: Cijk_Ailk_Bjlk_HHS_BH_UserArgs_MT64x32x128_MI16x16x1_SN_LDSB1_CLR1_GSU0_GSUC0_GSUWGMRR0_K1_LBSPPA512_LBSPPB256_LPA32_LPB16_MIWT2_1_PLR2_SU32_SUM0_SUS256_VWA2_VWB1_WGM1_WGMXCC1_WGMXCCGn1
    SolutionIndex: 121
    SolutionNameMin: Cijk_Ailk_Bjlk_HHS_BH_UserArgs_MT64x32x128_MI16x16x1_SN_LDSB1_CLR1_GSU0_GSUC0_GSUWGMRR0_K1_LBSPPA512_LBSPPB256_LPA32_LPB16_MIWT2_1_PLR2_SU32_SUM0_SUS256_VWA2_VWB1_WGM4_WGMXCC1_WGMXCCGn1
    SolutionIndex: 122
    SolutionNameMin: Cijk_Ailk_Bjlk_HHS_BH_UserArgs_MT32x32x128_MI16x16x1_SN_LDSB1_CLR1_GSU0_GSUC0_GSUWGMRR0_K1_LBSPPA256_LBSPPB256_LPA16_LPB16_MIWT1_1_PLR1_SU32_SUM0_SUS256_VWA1_VWB1_WGM1_WGMXCC1_WGMXCCGn1
    SolutionIndex: 123
    SolutionNameMin: Cijk_Ailk_Bjlk_HHS_BH_UserArgs_MT32x32x128_MI16x16x1_SN_LDSB1_CLR1_GSU0_GSUC0_GSUWGMRR0_K1_LBSPPA256_LBSPPB256_LPA16_LPB16_MIWT1_1_PLR2_SU32_SUM0_SUS256_VWA1_VWB1_WGM1_WGMXCC1_WGMXCCGn1
    SolutionIndex: 124
    SolutionNameMin: Cijk_Ailk_Bjlk_HHS_BH_UserArgs_MT32x32x32_MI16x16x1_SN_LDSB0_CLR1_GSU0_GSUC0_GSUWGMRR0_K1_LBSPPA256_LBSPPB256_LPA16_LPB16_MIWT1_1_PLR1_SU32_SUM0_SUS256_VWA1_VWB1_WGM4_WGMXCC1_WGMXCCGn1
- - - [128, 128, 1, 128, 128, 128, 128, 128]
    - [50, 0.084]
  - - [128, 128, 1, 256, 128, 128, 128, 128]
    - [109, 0.146]
  - - [128, 128, 1, 512, 128, 128, 128, 128]
    - [123, 0.233]
  - - [128, 128, 1, 1024, 128, 128, 128, 128]
    - [122, 0.335]
  - - [128, 128, 1, 2048, 128, 128, 128, 128]
    - [108, 0.502]
  - - [128, 128, 1, 4096, 128, 128, 128, 128]
    - [105, 0.802]
  - - [128, 128, 1, 8192, 128, 128, 128, 128]
    - [118, 1.194]
  - - [128, 256, 1, 128, 128, 128, 128, 256]
    - [50, 0.164]
  - - [128, 256, 1, 256, 128, 128, 128, 256]
    - [109, 0.284]
  - - [128, 256, 1, 512, 128, 128, 128, 256]
    - [108, 0.458]
  - - [128, 256, 1, 1024, 128, 128, 128, 256]
    - [123, 0.659]
  - - [128, 256, 1, 2048, 128, 128, 128, 256]
    - [118, 0.908]
  - - [128, 256, 1, 4096, 128, 128, 128, 256]
    - [104, 1.335]
  - - [128, 256, 1, 8192, 128, 128, 128, 256]
    - [117, 1.963]
  - - [128, 512, 1, 128, 128, 128, 128, 512]
    - [106, 0.308]
  - - [128, 512, 1, 256, 128, 128, 128, 512]
    - [105, 0.536]
  - - [128, 512, 1, 512, 128, 128, 128, 512]
    - [120, 0.839]
  - - [128, 512, 1, 1024, 128, 128, 128, 512]
    - [120, 1.206]
  - - [128, 512, 1, 2048, 128, 128, 128, 512]
    - [116, 1.57]
  - - [128, 512, 1, 4096, 128, 128, 128, 512]
    - [98, 2.275]
  - - [128, 512, 1, 8192, 128, 128, 128, 512]
    - [114, 2.958]
  - - [128, 1024, 1, 128, 128, 128, 128, 1024]
    - [49, 0.577]
  - - [128, 1024, 1, 256, 128, 128, 128, 1024]
    - [103, 0.978]
  - - [128, 1024, 1, 512, 128, 128, 128, 1024]
    - [115, 1.53]
  - - [128, 1024, 1, 1024, 128, 128, 128, 1024]
    - [115, 2.123]
  - - [128, 1024, 1, 2048, 128, 128, 128, 1024]
    - [117, 2.554]
  - - [128, 1024, 1, 4096, 128, 128, 128, 1024]
    - [93, 3.518]
  - - [128, 1024, 1, 8192, 128, 128, 128, 1024]
    - [111, 4.618]
  - - [128, 2048, 1, 128, 128, 128, 128, 2048]
    - [47, 0.98]
  - - [128, 2048, 1, 256, 128, 128, 128, 2048]
    - [96, 1.584]
  - - [128, 2048, 1, 512, 128, 128, 128, 2048]
    - [96, 2.359]
  - - [128, 2048, 1, 1024, 128, 128, 128, 2048]
    - [101, 2.973]
  - - [128, 2048, 1, 2048, 128, 128, 128, 2048]
    - [113, 3.667]
  - - [128, 2048, 1, 4096, 128, 128, 128, 2048]
    - [110, 4.853]
  - - [128, 2048, 1, 8192, 128, 128, 128, 2048]
    - [92, 5.85]
  - - [128, 4096, 1, 128, 128, 128, 128, 4096]
    - [45, 1.56]
  - - [128, 4096, 1, 256, 128, 128, 128, 4096]
    - [88, 2.406]
  - - [128, 4096, 1, 512, 128, 128, 128, 4096]
    - [86, 3.41]
  - - [128, 4096, 1, 1024, 128, 128, 128, 4096]
    - [85, 4.095]
  - - [128, 4096, 1, 2048, 128, 128, 128, 4096]
    - [93, 5.655]
  - - [128, 4096, 1, 4096, 128, 128, 128, 4096]
    - [110, 6.374]
  - - [128, 4096, 1, 8192, 128, 128, 128, 4096]
    - [67, 7.013]
  - - [128, 8192, 1, 128, 128, 128, 128, 8192]
    - [28, 1.963]
  - - [128, 8192, 1, 256, 128, 128, 128, 8192]
    - [27, 3.245]
  - - [128, 8192, 1, 512, 128, 128, 128, 8192]
    - [32, 4.305]
  - - [128, 8192, 1, 1024, 128, 128, 128, 8192]
    - [68, 5.001]
  - - [128, 8192, 1, 2048, 128, 128, 128, 8192]
    - [70, 6.233]
  - - [128, 8192, 1, 4096, 128, 128, 128, 8192]
    - [69, 7.239]
  - - [128, 8192, 1, 8192, 128, 128, 128, 8192]
    - [85, 7.293]
  - - [256, 128, 1, 128, 256, 256, 256, 128]
    - [108, 0.158]
  - - [256, 128, 1, 256, 256, 256, 256, 128]
    - [123, 0.284]
  - - [256, 128, 1, 512, 256, 256, 256, 128]
    - [109, 0.46]
  - - [256, 128, 1, 1024, 256, 256, 256, 128]
    - [122, 0.661]
  - - [256, 128, 1, 2048, 256, 256, 256, 128]
    - [120, 0.906]
  - - [256, 128, 1, 4096, 256, 256, 256, 128]
    - [104, 1.348]
  - - [256, 128, 1, 8192, 256, 256, 256, 128]
    - [104, 1.852]
  - - [256, 256, 1, 128, 256, 256, 256, 256]
    - [107, 0.31]
  - - [256, 256, 1, 256, 256, 256, 256, 256]
    - [107, 0.537]
  - - [256, 256, 1, 512, 256, 256, 256, 256]
    - [120, 0.841]
  - - [256, 256, 1, 1024, 256, 256, 256, 256]
    - [120, 1.215]
  - - [256, 256, 1, 2048, 256, 256, 256, 256]
    - [120, 1.559]
  - - [256, 256, 1, 4096, 256, 256, 256, 256]
    - [100, 2.189]
  - - [256, 256, 1, 8192, 256, 256, 256, 256]
    - [98, 2.921]
  - - [256, 512, 1, 128, 256, 256, 256, 512]
    - [103, 0.568]
  - - [256, 512, 1, 256, 256, 256, 256, 512]
    - [103, 0.961]
  - - [256, 512, 1, 512, 256, 256, 256, 512]
    - [117, 1.472]
  - - [256, 512, 1, 1024, 256, 256, 256, 512]
    - [115, 2.103]
  - - [256, 512, 1, 2048, 256, 256, 256, 512]
    - [115, 2.636]
  - - [256, 512, 1, 4096, 256, 256, 256, 512]
    - [93, 3.293]
  - - [256, 512, 1, 8192, 256, 256, 256, 512]
    - [111, 4.612]
  - - [256, 1024, 1, 128, 256, 256, 256, 1024]
    - [46, 0.998]
  - - [256, 1024, 1, 256, 256, 256, 256, 1024]
    - [97, 1.591]
  - - [256, 1024, 1, 512, 256, 256, 256, 1024]
    - [101, 2.324]
  - - [256, 1024, 1, 1024, 256, 256, 256, 1024]
    - [114, 3.125]
  - - [256, 1024, 1, 2048, 256, 256, 256, 1024]
    - [114, 3.721]
  - - [256, 1024, 1, 4096, 256, 256, 256, 1024]
    - [112, 4.839]
  - - [256, 1024, 1, 8192, 256, 256, 256, 1024]
    - [89, 5.642]
  - - [256, 2048, 1, 128, 256, 256, 256, 2048]
    - [87, 1.521]
  - - [256, 2048, 1, 256, 256, 256, 256, 2048]
    - [95, 2.461]
  - - [256, 2048, 1, 512, 256, 256, 256, 2048]
    - [93, 3.403]
  - - [256, 2048, 1, 1024, 256, 256, 256, 2048]
    - [91, 4.623]
  - - [256, 2048, 1, 2048, 256, 256, 256, 2048]
    - [93, 5.64]
  - - [256, 2048, 1, 4096, 256, 256, 256, 2048]
    - [112, 6.126]
  - - [256, 2048, 1, 8192, 256, 256, 256, 2048]
    - [80, 6.922]
  - - [256, 4096, 1, 128, 256, 256, 256, 4096]
    - [40, 1.907]
  - - [256, 4096, 1, 256, 256, 256, 256, 4096]
    - [30, 3.182]
  - - [256, 4096, 1, 512, 256, 256, 256, 4096]
    - [26, 4.605]
  - - [256, 4096, 1, 1024, 256, 256, 256, 4096]
    - [29, 5.669]
  - - [256, 4096, 1, 2048, 256, 256, 256, 4096]
    - [71, 6.446]
  - - [256, 4096, 1, 4096, 256, 256, 256, 4096]
    - [65, 7.115]
  - - [256, 4096, 1, 8192, 256, 256, 256, 4096]
    - [51, 7.636]
  - - [256, 8192, 1, 128, 256, 256, 256, 8192]
    - [1, 2.614]
  - - [256, 8192, 1, 256, 256, 256, 256, 8192]
    - [6, 3.993]
  - - [256, 8192, 1, 512, 256, 256, 256, 8192]
    - [6, 5.432]
  - - [256, 8192, 1, 1024, 256, 256, 256, 8192]
    - [2, 6.638]
  - - [256, 8192, 1, 2048, 256, 256, 256, 8192]
    - [43, 6.984]
  - - [256, 8192, 1, 4096, 256, 256, 256, 8192]
    - [12, 8.118]
  - - [256, 8192, 1, 8192, 256, 256, 256, 8192]
    - [53, 8.917]
  - - [512, 128, 1, 128, 512, 512, 512, 128]
    - [119, 0.324]
  - - [512, 128, 1, 256, 512, 512, 512, 128]
    - [120, 0.534]
  - - [512, 128, 1, 512, 512, 512, 512, 128]
    - [120, 0.86]
  - - [512, 128, 1, 1024, 512, 512, 512, 128]
    - [121, 1.187]
  - - [512, 128, 1, 2048, 512, 512, 512, 128]
    - [120, 1.562]
  - - [512, 128, 1, 4096, 512, 512, 512, 128]
    - [99, 2.138]
  - - [512, 128, 1, 8192, 512, 512, 512, 128]
    - [114, 2.813]
  - - [512, 256, 1, 128, 512, 512, 512, 256]
    - [102, 0.586]
  - - [512, 256, 1, 256, 512, 512, 512, 256]
    - [115, 0.941]
  - - [512, 256, 1, 512, 512, 512, 512, 256]
    - [115, 1.514]
  - - [512, 256, 1, 1024, 512, 512, 512, 256]
    - [117, 2.111]
  - - [512, 256, 1, 2048, 512, 512, 512, 256]
    - [115, 2.67]
  - - [512, 256, 1, 4096, 512, 512, 512, 256]
    - [93, 3.525]
  - - [512, 256, 1, 8192, 512, 512, 512, 256]
    - [111, 4.631]
  - - [512, 512, 1, 128, 512, 512, 512, 512]
    - [48, 0.994]
  - - [512, 512, 1, 256, 512, 512, 512, 512]
    - [96, 1.569]
  - - [512, 512, 1, 512, 512, 512, 512, 512]
    - [98, 2.357]
  - - [512, 512, 1, 1024, 512, 512, 512, 512]
    - [114, 3.103]
  - - [512, 512, 1, 2048, 512, 512, 512, 512]
    - [85, 3.603]
  - - [512, 512, 1, 4096, 512, 512, 512, 512]
    - [110, 4.938]
  - - [512, 512, 1, 8192, 512, 512, 512, 512]
    - [85, 5.883]
  - - [512, 1024, 1, 128, 512, 512, 512, 1024]
    - [94, 1.501]
  - - [512, 1024, 1, 256, 512, 512, 512, 1024]
    - [84, 2.449]
  - - [512, 1024, 1, 512, 512, 512, 512, 1024]
    - [93, 3.646]
  - - [512, 1024, 1, 1024, 512, 512, 512, 1024]
    - [85, 4.714]
  - - [512, 1024, 1, 2048, 512, 512, 512, 1024]
    - [91, 5.652]
  - - [512, 1024, 1, 4096, 512, 512, 512, 1024]
    - [112, 6.231]
  - - [512, 1024, 1, 8192, 512, 512, 512, 1024]
    - [31, 6.911]
  - - [512, 2048, 1, 128, 512, 512, 512, 2048]
    - [29, 2.015]
  - - [512, 2048, 1, 256, 512, 512, 512, 2048]
    - [40, 3.272]
  - - [512, 2048, 1, 512, 512, 512, 512, 2048]
    - [35, 4.63]
  - - [512, 2048, 1, 1024, 512, 512, 512, 2048]
    - [36, 5.652]
  - - [512, 2048, 1, 2048, 512, 512, 512, 2048]
    - [64, 6.452]
  - - [512, 2048, 1, 4096, 512, 512, 512, 2048]
    - [82, 6.855]
  - - [512, 2048, 1, 8192, 512, 512, 512, 2048]
    - [10, 7.614]
  - - [512, 4096, 1, 128, 512, 512, 512, 4096]
    - [22, 2.41]
  - - [512, 4096, 1, 256, 512, 512, 512, 4096]
    - [7, 3.888]
  - - [512, 4096, 1, 512, 512, 512, 512, 4096]
    - [2, 5.462]
  - - [512, 4096, 1, 1024, 512, 512, 512, 4096]
    - [5, 6.674]
  - - [512, 4096, 1, 2048, 512, 512, 512, 4096]
    - [51, 7.533]
  - - [512, 4096, 1, 4096, 512, 512, 512, 4096]
    - [8, 8.104]
  - - [512, 4096, 1, 8192, 512, 512, 512, 4096]
    - [80, 8.129]
  - - [512, 8192, 1, 128, 512, 512, 512, 8192]
    - [61, 2.61]
  - - [512, 8192, 1, 256, 512, 512, 512, 8192]
    - [81, 3.629]
  - - [512, 8192, 1, 512, 512, 512, 512, 8192]
    - [5, 4.963]
  - - [512, 8192, 1, 1024, 512, 512, 512, 8192]
    - [12, 6.82]
  - - [512, 8192, 1, 2048, 512, 512, 512, 8192]
    - [8, 8.192]
  - - [512, 8192, 1, 4096, 512, 512, 512, 8192]
    - [56, 9.055]
  - - [512, 8192, 1, 8192, 512, 512, 512, 8192]
    - [59, 9.579]
  - - [1024, 128, 1, 128, 1024, 1024, 1024, 128]
    - [103, 0.571]
  - - [1024, 128, 1, 256, 1024, 1024, 1024, 128]
    - [115, 0.99]
  - - [1024, 128, 1, 512, 1024, 1024, 1024, 128]
    - [104, 1.503]
  - - [1024, 128, 1, 1024, 1024, 1024, 1024, 128]
    - [116, 2.079]
  - - [1024, 128, 1, 2048, 1024, 1024, 1024, 128]
    - [99, 2.349]
  - - [1024, 128, 1, 4096, 1024, 1024, 1024, 128]
    - [83, 3.37]
  - - [1024, 128, 1, 8192, 1024, 1024, 1024, 128]
    - [93, 4.538]
  - - [1024, 256, 1, 128, 1024, 1024, 1024, 256]
    - [46, 0.966]
  - - [1024, 256, 1, 256, 1024, 1024, 1024, 256]
    - [98, 1.59]
  - - [1024, 256, 1, 512, 1024, 1024, 1024, 256]
    - [99, 2.326]
  - - [1024, 256, 1, 1024, 1024, 1024, 1024, 256]
    - [98, 3.124]
  - - [1024, 256, 1, 2048, 1024, 1024, 1024, 256]
    - [93, 3.64]
  - - [1024, 256, 1, 4096, 1024, 1024, 1024, 256]
    - [110, 4.857]
  - - [1024, 256, 1, 8192, 1024, 1024, 1024, 256]
    - [85, 6.119]
  - - [1024, 512, 1, 128, 1024, 1024, 1024, 512]
    - [90, 1.556]
  - - [1024, 512, 1, 256, 1024, 1024, 1024, 512]
    - [88, 2.475]
  - - [1024, 512, 1, 512, 1024, 1024, 1024, 512]
    - [85, 3.681]
  - - [1024, 512, 1, 1024, 1024, 1024, 1024, 512]
    - [85, 4.624]
  - - [1024, 512, 1, 2048, 1024, 1024, 1024, 512]
    - [85, 5.591]
  - - [1024, 512, 1, 4096, 1024, 1024, 1024, 512]
    - [112, 6.256]
  - - [1024, 512, 1, 8192, 1024, 1024, 1024, 512]
    - [65, 7.136]
  - - [1024, 1024, 1, 128, 1024, 1024, 1024, 1024]
    - [37, 2.143]
  - - [1024, 1024, 1, 256, 1024, 1024, 1024, 1024]
    - [26, 3.243]
  - - [1024, 1024, 1, 512, 1024, 1024, 1024, 1024]
    - [38, 4.639]
  - - [1024, 1024, 1, 1024, 1024, 1024, 1024, 1024]
    - [25, 5.716]
  - - [1024, 1024, 1, 2048, 1024, 1024, 1024, 1024]
    - [65, 6.569]
  - - [1024, 1024, 1, 4096, 1024, 1024, 1024, 1024]
    - [66, 7.267]
  - - [1024, 1024, 1, 8192, 1024, 1024, 1024, 1024]
    - [56, 8.246]
  - - [1024, 2048, 1, 128, 1024, 1024, 1024, 2048]
    - [7, 2.556]
  - - [1024, 2048, 1, 256, 1024, 1024, 1024, 2048]
    - [9, 3.982]
  - - [1024, 2048, 1, 512, 1024, 1024, 1024, 2048]
    - [9, 5.524]
  - - [1024, 2048, 1, 1024, 1024, 1024, 1024, 2048]
    - [14, 6.631]
  - - [1024, 2048, 1, 2048, 1024, 1024, 1024, 2048]
    - [56, 7.519]
  - - [1024, 2048, 1, 4096, 1024, 1024, 1024, 2048]
    - [20, 8.343]
  - - [1024, 2048, 1, 8192, 1024, 1024, 1024, 2048]
    - [51, 8.971]
  - - [1024, 4096, 1, 128, 1024, 1024, 1024, 4096]
    - [60, 2.505]
  - - [1024, 4096, 1, 256, 1024, 1024, 1024, 4096]
    - [77, 3.507]
  - - [1024, 4096, 1, 512, 1024, 1024, 1024, 4096]
    - [53, 5.042]
  - - [1024, 4096, 1, 1024, 1024, 1024, 1024, 4096]
    - [21, 6.717]
  - - [1024, 4096, 1, 2048, 1024, 1024, 1024, 4096]
    - [20, 8.032]
  - - [1024, 4096, 1, 4096, 1024, 1024, 1024, 4096]
    - [17, 8.651]
  - - [1024, 4096, 1, 8192, 1024, 1024, 1024, 4096]
    - [51, 9.643]
  - - [1024, 8192, 1, 128, 1024, 1024, 1024, 8192]
    - [17, 2.65]
  - - [1024, 8192, 1, 256, 1024, 1024, 1024, 8192]
    - [41, 4.038]
  - - [1024, 8192, 1, 512, 1024, 1024, 1024, 8192]
    - [3, 5.664]
  - - [1024, 8192, 1, 1024, 1024, 1024, 1024, 8192]
    - [56, 7.312]
  - - [1024, 8192, 1, 2048, 1024, 1024, 1024, 8192]
    - [24, 8.632]
  - - [1024, 8192, 1, 4096, 1024, 1024, 1024, 8192]
    - [9, 9.25]
  - - [1024, 8192, 1, 8192, 1024, 1024, 1024, 8192]
    - [5, 9.493]
  - - [2048, 128, 1, 128, 2048, 2048, 2048, 128]
    - [48, 1.002]
  - - [2048, 128, 1, 256, 2048, 2048, 2048, 128]
    - [98, 1.621]
  - - [2048, 128, 1, 512, 2048, 2048, 2048, 128]
    - [98, 2.385]
  - - [2048, 128, 1, 1024, 2048, 2048, 2048, 128]
    - [98, 3.027]
  - - [2048, 128, 1, 2048, 2048, 2048, 2048, 128]
    - [93, 3.616]
  - - [2048, 128, 1, 4096, 2048, 2048, 2048, 128]
    - [83, 4.684]
  - - [2048, 128, 1, 8192, 2048, 2048, 2048, 128]
    - [85, 6.08]
  - - [2048, 256, 1, 128, 2048, 2048, 2048, 256]
    - [85, 1.571]
  - - [2048, 256, 1, 256, 2048, 2048, 2048, 256]
    - [88, 2.473]
  - - [2048, 256, 1, 512, 2048, 2048, 2048, 256]
    - [93, 3.539]
  - - [2048, 256, 1, 1024, 2048, 2048, 2048, 256]
    - [85, 4.753]
  - - [2048, 256, 1, 2048, 2048, 2048, 2048, 256]
    - [85, 5.705]
  - - [2048, 256, 1, 4096, 2048, 2048, 2048, 256]
    - [110, 6.183]
  - - [2048, 256, 1, 8192, 2048, 2048, 2048, 256]
    - [74, 7.174]
  - - [2048, 512, 1, 128, 2048, 2048, 2048, 512]
    - [35, 2.144]
  - - [2048, 512, 1, 256, 2048, 2048, 2048, 512]
    - [36, 3.322]
  - - [2048, 512, 1, 512, 2048, 2048, 2048, 512]
    - [40, 4.596]
  - - [2048, 512, 1, 1024, 2048, 2048, 2048, 512]
    - [42, 5.748]
  - - [2048, 512, 1, 2048, 2048, 2048, 2048, 512]
    - [68, 6.563]
  - - [2048, 512, 1, 4096, 2048, 2048, 2048, 512]
    - [35, 7.279]
  - - [2048, 512, 1, 8192, 2048, 2048, 2048, 512]
    - [51, 8.321]
  - - [2048, 1024, 1, 128, 2048, 2048, 2048, 1024]
    - [23, 2.575]
  - - [2048, 1024, 1, 256, 2048, 2048, 2048, 1024]
    - [16, 4.069]
  - - [2048, 1024, 1, 512, 2048, 2048, 2048, 1024]
    - [9, 5.582]
  - - [2048, 1024, 1, 1024, 2048, 2048, 2048, 1024]
    - [9, 6.811]
  - - [2048, 1024, 1, 2048, 2048, 2048, 2048, 1024]
    - [58, 7.501]
  - - [2048, 1024, 1, 4096, 2048, 2048, 2048, 1024]
    - [59, 8.346]
  - - [2048, 1024, 1, 8192, 2048, 2048, 2048, 1024]
    - [16, 9.124]
  - - [2048, 2048, 1, 128, 2048, 2048, 2048, 2048]
    - [62, 2.756]
  - - [2048, 2048, 1, 256, 2048, 2048, 2048, 2048]
    - [74, 3.609]
  - - [2048, 2048, 1, 512, 2048, 2048, 2048, 2048]
    - [5, 5.21]
  - - [2048, 2048, 1, 1024, 2048, 2048, 2048, 2048]
    - [5, 6.888]
  - - [2048, 2048, 1, 2048, 2048, 2048, 2048, 2048]
    - [9, 8.19]
  - - [2048, 2048, 1, 4096, 2048, 2048, 2048, 2048]
    - [61, 9.104]
  - - [2048, 2048, 1, 8192, 2048, 2048, 2048, 2048]
    - [59, 9.67]
  - - [2048, 4096, 1, 128, 2048, 2048, 2048, 4096]
    - [15, 2.725]
  - - [2048, 4096, 1, 256, 2048, 2048, 2048, 4096]
    - [53, 4.199]
  - - [2048, 4096, 1, 512, 2048, 2048, 2048, 4096]
    - [15, 5.825]
  - - [2048, 4096, 1, 1024, 2048, 2048, 2048, 4096]
    - [9, 7.373]
  - - [2048, 4096, 1, 2048, 2048, 2048, 2048, 4096]
    - [5, 8.31]
  - - [2048, 4096, 1, 4096, 2048, 2048, 2048, 4096]
    - [16, 9.201]
  - - [2048, 4096, 1, 8192, 2048, 2048, 2048, 4096]
    - [15, 9.628]
  - - [2048, 8192, 1, 128, 2048, 2048, 2048, 8192]
    - [54, 3.175]
  - - [2048, 8192, 1, 256, 2048, 2048, 2048, 8192]
    - [12, 4.642]
  - - [2048, 8192, 1, 512, 2048, 2048, 2048, 8192]
    - [58, 6.339]
  - - [2048, 8192, 1, 1024, 2048, 2048, 2048, 8192]
    - [23, 7.745]
  - - [2048, 8192, 1, 2048, 2048, 2048, 2048, 8192]
    - [7, 8.642]
  - - [2048, 8192, 1, 4096, 2048, 2048, 2048, 8192]
    - [9, 9.411]
  - - [2048, 8192, 1, 8192, 2048, 2048, 2048, 8192]
    - [56, 9.78]
  - - [4096, 128, 1, 128, 4096, 4096, 4096, 128]
    - [44, 1.586]
  - - [4096, 128, 1, 256, 4096, 4096, 4096, 128]
    - [91, 2.429]
  - - [4096, 128, 1, 512, 4096, 4096, 4096, 128]
    - [91, 3.548]
  - - [4096, 128, 1, 1024, 4096, 4096, 4096, 128]
    - [85, 4.548]
  - - [4096, 128, 1, 2048, 4096, 4096, 4096, 128]
    - [85, 5.58]
  - - [4096, 128, 1, 4096, 4096, 4096, 4096, 128]
    - [85, 6.196]
  - - [4096, 128, 1, 8192, 4096, 4096, 4096, 128]
    - [75, 7.116]
  - - [4096, 256, 1, 128, 4096, 4096, 4096, 256]
    - [34, 2.144]
  - - [4096, 256, 1, 256, 4096, 4096, 4096, 256]
    - [39, 3.386]
  - - [4096, 256, 1, 512, 4096, 4096, 4096, 256]
    - [29, 4.701]
  - - [4096, 256, 1, 1024, 4096, 4096, 4096, 256]
    - [37, 5.793]
  - - [4096, 256, 1, 2048, 4096, 4096, 4096, 256]
    - [64, 6.543]
  - - [4096, 256, 1, 4096, 4096, 4096, 4096, 256]
    - [35, 7.267]
  - - [4096, 256, 1, 8192, 4096, 4096, 4096, 256]
    - [51, 8.311]
  - - [4096, 512, 1, 128, 4096, 4096, 4096, 512]
    - [9, 2.608]
  - - [4096, 512, 1, 256, 4096, 4096, 4096, 512]
    - [24, 3.98]
  - - [4096, 512, 1, 512, 4096, 4096, 4096, 512]
    - [9, 5.504]
  - - [4096, 512, 1, 1024, 4096, 4096, 4096, 512]
    - [9, 6.775]
  - - [4096, 512, 1, 2048, 4096, 4096, 4096, 512]
    - [51, 7.576]
  - - [4096, 512, 1, 4096, 4096, 4096, 4096, 512]
    - [8, 8.379]
  - - [4096, 512, 1, 8192, 4096, 4096, 4096, 512]
    - [8, 9.191]
  - - [4096, 1024, 1, 128, 4096, 4096, 4096, 1024]
    - [55, 2.741]
  - - [4096, 1024, 1, 256, 4096, 4096, 4096, 1024]
    - [74, 3.6]
  - - [4096, 1024, 1, 512, 4096, 4096, 4096, 1024]
    - [12, 5.111]
  - - [4096, 1024, 1, 1024, 4096, 4096, 4096, 1024]
    - [21, 6.872]
  - - [4096, 1024, 1, 2048, 4096, 4096, 4096, 1024]
    - [2, 8.208]
  - - [4096, 1024, 1, 4096, 4096, 4096, 4096, 1024]
    - [61, 9.084]
  - - [4096, 1024, 1, 8192, 4096, 4096, 4096, 1024]
    - [16, 9.501]
  - - [4096, 2048, 1, 128, 4096, 4096, 4096, 2048]
    - [72, 2.812]
  - - [4096, 2048, 1, 256, 4096, 4096, 4096, 2048]
    - [61, 4.202]
  - - [4096, 2048, 1, 512, 4096, 4096, 4096, 2048]
    - [5, 5.763]
  - - [4096, 2048, 1, 1024, 4096, 4096, 4096, 2048]
    - [5, 7.406]
  - - [4096, 2048, 1, 2048, 4096, 4096, 4096, 2048]
    - [8, 8.587]
  - - [4096, 2048, 1, 4096, 4096, 4096, 4096, 2048]
    - [59, 9.395]
  - - [4096, 2048, 1, 8192, 4096, 4096, 4096, 2048]
    - [51, 9.623]
  - - [4096, 4096, 1, 128, 4096, 4096, 4096, 4096]
    - [57, 3.29]
  - - [4096, 4096, 1, 256, 4096, 4096, 4096, 4096]
    - [78, 4.385]
  - - [4096, 4096, 1, 512, 4096, 4096, 4096, 4096]
    - [19, 6.268]
  - - [4096, 4096, 1, 1024, 4096, 4096, 4096, 4096]
    - [15, 7.864]
  - - [4096, 4096, 1, 2048, 4096, 4096, 4096, 4096]
    - [13, 8.824]
  - - [4096, 4096, 1, 4096, 4096, 4096, 4096, 4096]
    - [56, 9.403]
  - - [4096, 4096, 1, 8192, 4096, 4096, 4096, 4096]
    - [53, 9.663]
  - - [4096, 8192, 1, 128, 4096, 4096, 4096, 8192]
    - [9, 3.736]
  - - [4096, 8192, 1, 256, 4096, 4096, 4096, 8192]
    - [9, 5.423]
  - - [4096, 8192, 1, 512, 4096, 4096, 4096, 8192]
    - [9, 6.777]
  - - [4096, 8192, 1, 1024, 4096, 4096, 4096, 8192]
    - [3, 8.141]
  - - [4096, 8192, 1, 2048, 4096, 4096, 4096, 8192]
    - [9, 9.073]
  - - [4096, 8192, 1, 4096, 4096, 4096, 4096, 8192]
    - [21, 9.353]
  - - [4096, 8192, 1, 8192, 4096, 4096, 4096, 8192]
    - [15, 9.651]
  - - [8192, 128, 1, 128, 8192, 8192, 8192, 128]
    - [34, 2.167]
  - - [8192, 128, 1, 256, 8192, 8192, 8192, 128]
    - [33, 3.389]
  - - [8192, 128, 1, 512, 8192, 8192, 8192, 128]
    - [40, 4.618]
  - - [8192, 128, 1, 1024, 8192, 8192, 8192, 128]
    - [35, 5.725]
  - - [8192, 128, 1, 2048, 8192, 8192, 8192, 128]
    - [73, 6.526]
  - - [8192, 128, 1, 4096, 8192, 8192, 8192, 128]
    - [35, 7.257]
  - - [8192, 128, 1, 8192, 8192, 8192, 8192, 128]
    - [79, 8.119]
  - - [8192, 256, 1, 128, 8192, 8192, 8192, 256]
    - [18, 2.566]
  - - [8192, 256, 1, 256, 8192, 8192, 8192, 256]
    - [2, 3.913]
  - - [8192, 256, 1, 512, 8192, 8192, 8192, 256]
    - [24, 5.446]
  - - [8192, 256, 1, 1024, 8192, 8192, 8192, 256]
    - [9, 6.729]
  - - [8192, 256, 1, 2048, 8192, 8192, 8192, 256]
    - [51, 7.555]
  - - [8192, 256, 1, 4096, 8192, 8192, 8192, 256]
    - [20, 8.358]
  - - [8192, 256, 1, 8192, 8192, 8192, 8192, 256]
    - [24, 9.191]
  - - [8192, 512, 1, 128, 8192, 8192, 8192, 512]
    - [55, 2.668]
  - - [8192, 512, 1, 256, 8192, 8192, 8192, 512]
    - [63, 3.584]
  - - [8192, 512, 1, 512, 8192, 8192, 8192, 512]
    - [2, 5.208]
  - - [8192, 512, 1, 1024, 8192, 8192, 8192, 512]
    - [21, 6.912]
  - - [8192, 512, 1, 2048, 8192, 8192, 8192, 512]
    - [51, 8.255]
  - - [8192, 512, 1, 4096, 8192, 8192, 8192, 512]
    - [9, 9.122]
  - - [8192, 512, 1, 8192, 8192, 8192, 8192, 512]
    - [56, 9.621]
  - - [8192, 1024, 1, 128, 8192, 8192, 8192, 1024]
    - [76, 2.795]
  - - [8192, 1024, 1, 256, 8192, 8192, 8192, 1024]
    - [51, 4.189]
  - - [8192, 1024, 1, 512, 8192, 8192, 8192, 1024]
    - [0, 5.735]
  - - [8192, 1024, 1, 1024, 8192, 8192, 8192, 1024]
    - [2, 7.43]
  - - [8192, 1024, 1, 2048, 8192, 8192, 8192, 1024]
    - [9, 8.627]
  - - [8192, 1024, 1, 4096, 8192, 8192, 8192, 1024]
    - [9, 9.327]
  - - [8192, 1024, 1, 8192, 8192, 8192, 8192, 1024]
    - [51, 9.711]
  - - [8192, 2048, 1, 128, 8192, 8192, 8192, 2048]
    - [52, 3.274]
  - - [8192, 2048, 1, 256, 8192, 8192, 8192, 2048]
    - [2, 4.685]
  - - [8192, 2048, 1, 512, 8192, 8192, 8192, 2048]
    - [4, 6.434]
  - - [8192, 2048, 1, 1024, 8192, 8192, 8192, 2048]
    - [5, 7.893]
  - - [8192, 2048, 1, 2048, 8192, 8192, 8192, 2048]
    - [53, 8.854]
  - - [8192, 2048, 1, 4096, 8192, 8192, 8192, 2048]
    - [9, 9.392]
  - - [8192, 2048, 1, 8192, 8192, 8192, 8192, 2048]
    - [51, 9.752]
  - - [8192, 4096, 1, 128, 8192, 8192, 8192, 4096]
    - [6, 3.737]
  - - [8192, 4096, 1, 256, 8192, 8192, 8192, 4096]
    - [1, 5.219]
  - - [8192, 4096, 1, 512, 8192, 8192, 8192, 4096]
    - [13, 6.833]
  - - [8192, 4096, 1, 1024, 8192, 8192, 8192, 4096]
    - [24, 8.161]
  - - [8192, 4096, 1, 2048, 8192, 8192, 8192, 4096]
    - [16, 8.913]
  - - [8192, 4096, 1, 4096, 8192, 8192, 8192, 4096]
    - [56, 9.379]
  - - [8192, 4096, 1, 8192, 8192, 8192, 8192, 4096]
    - [9, 9.648]
  - - [8192, 8192, 1, 128, 8192, 8192, 8192, 8192]
    - [11, 3.814]
  - - [8192, 8192, 1, 256, 8192, 8192, 8192, 8192]
    - [6, 5.362]
  - - [8192, 8192, 1, 512, 8192, 8192, 8192, 8192]
    - [6, 6.954]
  - - [8192, 8192, 1, 1024, 8192, 8192, 8192, 8192]
    - [24, 8.221]
  - - [8192, 8192, 1, 2048, 8192, 8192, 8192, 8192]
    - [59, 8.958]
  - - [8192, 8192, 1, 4096, 8192, 8192, 8192, 8192]
    - [16, 9.469]
  - - [8192, 8192, 1, 8192, 8192, 8192, 8192, 8192]
    - [15, 9.321]
  - - [1, 1, 1, 32, 1, 1, 1, 1]
    - [124, 0.0]
- null
- null
- ExperimentalStreamK
- GridBased
