library/src/amd_detail/rocblaslt/src/Tensile/Logic/asm_full/aquavanjaram/gfx942_38cu/StreamK/aquavanjaram942_Cijk_Ailk_Bljk_HSS_BH_UserArgs.yaml
- {MinimumRequiredVersion: 4.33.0}
- aquavanjaram942
- {Architecture: gfx942, CUCount: 38}
- [Device 0049, Device 0050]
    SolutionIndex: 0
    SolutionNameMin: Cijk_Ailk_Bljk_HSS_BH_UserArgs_MT256x256x32_MI16x16x1_SN_LDSB1_CLR1_GSU0_GSUC0_GSUWGMRR0_K1_LBSPPA2048_LBSPPB128_LPA32_MIWT8_8_PLR1_SU32_SUM0_SUS256_VWA2_VWB1_WGM1_WGMXCC1_WGMXCCGn1
    SolutionIndex: 1
    SolutionNameMin: Cijk_Ailk_Bljk_HSS_BH_UserArgs_MT256x256x32_MI16x16x1_SN_LDSB1_CLR1_GSU0_GSUC0_GSUWGMRR0_K1_LBSPPA2048_LBSPPB128_LPA0_MIWT8_8_PLR1_SU32_SUM0_SUS256_VWA4_VWB1_WGM1_WGMXCC1_WGMXCCGn1
    SolutionIndex: 2
    SolutionNameMin: Cijk_Ailk_Bljk_HSS_BH_UserArgs_MT256x256x32_MI16x16x1_SN_LDSB1_CLR1_GSU0_GSUC0_GSUWGMRR0_K1_LBSPPA2048_LBSPPB128_LPA0_MIWT8_8_PLR1_SU32_SUM0_SUS256_VWA4_VWB2_WGM1_WGMXCC1_WGMXCCGn1
    SolutionIndex: 3
    SolutionNameMin: Cijk_Ailk_Bljk_HSS_BH_UserArgs_MT256x256x32_MI16x16x1_SN_LDSB1_CLR1_GSU0_GSUC0_GSUWGMRR0_K1_LBSPPA2048_LBSPPB256_LPA32_MIWT8_8_PLR1_SU32_SUM0_SUS256_VWA2_VWB4_WGM1_WGMXCC1_WGMXCCGn1
    SolutionIndex: 4
    SolutionNameMin: Cijk_Ailk_Bljk_HSS_BH_UserArgs_MT256x256x32_MI16x16x1_SN_LDSB1_CLR1_GSU0_GSUC0_GSUWGMRR0_K1_LBSPPA2048_LBSPPB256_LPA0_MIWT8_8_PLR1_SU32_SUM0_SUS256_VWA4_VWB4_WGM1_WGMXCC1_WGMXCCGn1
    SolutionIndex: 5
    SolutionNameMin: Cijk_Ailk_Bljk_HSS_BH_UserArgs_MT256x256x32_MI16x16x1_SN_LDSB1_CLR1_GSU0_GSUC0_GSUWGMRR0_K1_LBSPPA2048_LBSPPB256_LPA0_MIWT8_8_PLR1_SU32_SUM0_SUS256_VWA8_VWB4_WGM1_WGMXCC1_WGMXCCGn1
    SolutionIndex: 6
    SolutionNameMin: Cijk_Ailk_Bljk_HSS_BH_UserArgs_MT256x256x32_MI16x16x1_SN_LDSB1_CLR1_GSU0_GSUC0_GSUWGMRR0_K1_LBSPPA2048_LBSPPB512_LPA32_MIWT8_8_PLR1_SU32_SUM0_SUS256_VWA2_VWB8_WGM1_WGMXCC1_WGMXCCGn1
    SolutionIndex: 7
    SolutionNameMin: Cijk_Ailk_Bljk_HSS_BH_UserArgs_MT256x256x32_MI16x16x1_SN_LDSB1_CLR1_GSU0_GSUC0_GSUWGMRR0_K1_LBSPPA2048_LBSPPB512_LPA0_MIWT8_8_PLR1_SU32_SUM0_SUS256_VWA4_VWB8_WGM1_WGMXCC1_WGMXCCGn1
    SolutionIndex: 8
    SolutionNameMin: Cijk_Ailk_Bljk_HSS_BH_UserArgs_MT256x256x32_MI16x16x1_SN_LDSB1_CLR1_GSU0_GSUC0_GSUWGMRR0_K1_LBSPPA2048_LBSPPB128_LPA32_MIWT8_8_PLR1_SU32_SUM0_SUS256_VWA2_VWB1_WGM4_WGMXCC1_WGMXCCGn1
    SolutionIndex: 9
    SolutionNameMin: Cijk_Ailk_Bljk_HSS_BH_UserArgs_MT256x256x32_MI16x16x1_SN_LDSB1_CLR1_GSU0_GSUC0_GSUWGMRR0_K1_LBSPPA2048_LBSPPB128_LPA0_MIWT8_8_PLR1_SU32_SUM0_SUS256_VWA4_VWB1_WGM4_WGMXCC1_WGMXCCGn1
    SolutionIndex: 10
    SolutionNameMin: Cijk_Ailk_Bljk_HSS_BH_UserArgs_MT256x256x32_MI16x16x1_SN_LDSB1_CLR1_GSU0_GSUC0_GSUWGMRR0_K1_LBSPPA2048_LBSPPB128_LPA0_MIWT8_8_PLR1_SU32_SUM0_SUS256_VWA4_VWB2_WGM4_WGMXCC1_WGMXCCGn1
    SolutionIndex: 11
    SolutionNameMin: Cijk_Ailk_Bljk_HSS_BH_UserArgs_MT256x256x32_MI16x16x1_SN_LDSB1_CLR1_GSU0_GSUC0_GSUWGMRR0_K1_LBSPPA2048_LBSPPB256_LPA32_MIWT8_8_PLR1_SU32_SUM0_SUS256_VWA2_VWB4_WGM4_WGMXCC1_WGMXCCGn1
    SolutionIndex: 12
    SolutionNameMin: Cijk_Ailk_Bljk_HSS_BH_UserArgs_MT256x256x32_MI16x16x1_SN_LDSB1_CLR1_GSU0_GSUC0_GSUWGMRR0_K1_LBSPPA2048_LBSPPB256_LPA0_MIWT8_8_PLR1_SU32_SUM0_SUS256_VWA4_VWB4_WGM4_WGMXCC1_WGMXCCGn1
    SolutionIndex: 13
    SolutionNameMin: Cijk_Ailk_Bljk_HSS_BH_UserArgs_MT256x256x32_MI16x16x1_SN_LDSB1_CLR1_GSU0_GSUC0_GSUWGMRR0_K1_LBSPPA2048_LBSPPB512_LPA32_MIWT8_8_PLR1_SU32_SUM0_SUS256_VWA2_VWB8_WGM4_WGMXCC1_WGMXCCGn1
    SolutionIndex: 14
    SolutionNameMin: Cijk_Ailk_Bljk_HSS_BH_UserArgs_MT256x256x32_MI16x16x1_SN_LDSB1_CLR1_GSU0_GSUC0_GSUWGMRR0_K1_LBSPPA2048_LBSPPB512_LPA0_MIWT8_8_PLR1_SU32_SUM0_SUS256_VWA4_VWB8_WGM4_WGMXCC1_WGMXCCGn1
    SolutionIndex: 15
    SolutionNameMin: Cijk_Ailk_Bljk_HSS_BH_UserArgs_MT256x256x32_MI16x16x1_SN_LDSB1_CLR1_GSU0_GSUC0_GSUWGMRR0_K1_LBSPPA2048_LBSPPB128_LPA0_MIWT8_8_PLR1_SU32_SUM0_SUS256_VWA4_VWB1_WGM8_WGMXCC1_WGMXCCGn1
    SolutionIndex: 16
    SolutionNameMin: Cijk_Ailk_Bljk_HSS_BH_UserArgs_MT256x256x32_MI16x16x1_SN_LDSB1_CLR1_GSU0_GSUC0_GSUWGMRR0_K1_LBSPPA2048_LBSPPB128_LPA0_MIWT8_8_PLR1_SU32_SUM0_SUS256_VWA4_VWB2_WGM8_WGMXCC1_WGMXCCGn1
    SolutionIndex: 17
    SolutionNameMin: Cijk_Ailk_Bljk_HSS_BH_UserArgs_MT256x256x32_MI16x16x1_SN_LDSB1_CLR1_GSU0_GSUC0_GSUWGMRR0_K1_LBSPPA2048_LBSPPB256_LPA0_MIWT8_8_PLR1_SU32_SUM0_SUS256_VWA4_VWB4_WGM8_WGMXCC1_WGMXCCGn1
    SolutionIndex: 18
    SolutionNameMin: Cijk_Ailk_Bljk_HSS_BH_UserArgs_MT256x256x32_MI16x16x1_SN_LDSB1_CLR1_GSU0_GSUC0_GSUWGMRR0_K1_LBSPPA2048_LBSPPB512_LPA0_MIWT8_8_PLR1_SU32_SUM0_SUS256_VWA4_VWB8_WGM8_WGMXCC1_WGMXCCGn1
    SolutionIndex: 19
    SolutionNameMin: Cijk_Ailk_Bljk_HSS_BH_UserArgs_MT128x256x32_MI16x16x1_SN_LDSB1_CLR1_GSU0_GSUC0_GSUWGMRR0_K1_LBSPPA1024_LBSPPB128_LPA0_MIWT4_8_PLR1_SU32_SUM0_SUS256_VWA4_VWB1_WGM1_WGMXCC1_WGMXCCGn1
    SolutionIndex: 20
    SolutionNameMin: Cijk_Ailk_Bljk_HSS_BH_UserArgs_MT256x128x32_MI16x16x1_SN_LDSB1_CLR1_GSU0_GSUC0_GSUWGMRR0_K1_LBSPPA2048_LBSPPB128_LPA0_MIWT8_4_PLR1_SU32_SUM0_SUS256_VWA4_VWB1_WGM1_WGMXCC1_WGMXCCGn1
    SolutionIndex: 21
    SolutionNameMin: Cijk_Ailk_Bljk_HSS_BH_UserArgs_MT256x128x32_MI16x16x1_SN_LDSB1_CLR1_GSU0_GSUC0_GSUWGMRR0_K1_LBSPPA2048_LBSPPB128_LPA0_MIWT8_4_PLR1_SU32_SUM0_SUS256_VWA4_VWB2_WGM1_WGMXCC1_WGMXCCGn1
    SolutionIndex: 22
    SolutionNameMin: Cijk_Ailk_Bljk_HSS_BH_UserArgs_MT256x128x32_MI16x16x1_SN_LDSB1_CLR1_GSU0_GSUC0_GSUWGMRR0_K1_LBSPPA2048_LBSPPB256_LPA32_MIWT8_4_PLR1_SU32_SUM0_SUS256_VWA2_VWB4_WGM1_WGMXCC1_WGMXCCGn1
    SolutionIndex: 23
    SolutionNameMin: Cijk_Ailk_Bljk_HSS_BH_UserArgs_MT256x128x32_MI16x16x1_SN_LDSB1_CLR1_GSU0_GSUC0_GSUWGMRR0_K1_LBSPPA2048_LBSPPB256_LPA0_MIWT8_4_PLR1_SU32_SUM0_SUS256_VWA4_VWB4_WGM1_WGMXCC1_WGMXCCGn1
    SolutionIndex: 24
    SolutionNameMin: Cijk_Ailk_Bljk_HSS_BH_UserArgs_MT256x128x32_MI16x16x1_SN_LDSB1_CLR1_GSU0_GSUC0_GSUWGMRR0_K1_LBSPPA2048_LBSPPB128_LPA0_MIWT8_4_PLR1_SU32_SUM0_SUS256_VWA4_VWB1_WGM4_WGMXCC1_WGMXCCGn1
    SolutionIndex: 25
    SolutionNameMin: Cijk_Ailk_Bljk_HSS_BH_UserArgs_MT256x128x32_MI16x16x1_SN_LDSB1_CLR1_GSU0_GSUC0_GSUWGMRR0_K1_LBSPPA2048_LBSPPB128_LPA0_MIWT8_4_PLR1_SU32_SUM0_SUS256_VWA4_VWB2_WGM4_WGMXCC1_WGMXCCGn1
    SolutionIndex: 26
    SolutionNameMin: Cijk_Ailk_Bljk_HSS_BH_UserArgs_MT256x128x32_MI16x16x1_SN_LDSB1_CLR1_GSU0_GSUC0_GSUWGMRR0_K1_LBSPPA2048_LBSPPB128_LPA32_MIWT8_4_PLR1_SU32_SUM0_SUS256_VWA2_VWB1_WGM8_WGMXCC1_WGMXCCGn1
    SolutionIndex: 27
    SolutionNameMin: Cijk_Ailk_Bljk_HSS_BH_UserArgs_MT256x128x32_MI16x16x1_SN_LDSB1_CLR1_GSU0_GSUC0_GSUWGMRR0_K1_LBSPPA2048_LBSPPB128_LPA0_MIWT8_4_PLR1_SU32_SUM0_SUS256_VWA4_VWB1_WGM8_WGMXCC1_WGMXCCGn1
    SolutionIndex: 28
    SolutionNameMin: Cijk_Ailk_Bljk_HSS_BH_UserArgs_MT256x128x32_MI16x16x1_SN_LDSB1_CLR1_GSU0_GSUC0_GSUWGMRR0_K1_LBSPPA2048_LBSPPB128_LPA0_MIWT8_4_PLR1_SU32_SUM0_SUS256_VWA4_VWB2_WGM8_WGMXCC1_WGMXCCGn1
    SolutionIndex: 29
    SolutionNameMin: Cijk_Ailk_Bljk_HSS_BH_UserArgs_MT256x128x32_MI16x16x1_SN_LDSB1_CLR1_GSU0_GSUC0_GSUWGMRR0_K1_LBSPPA2048_LBSPPB256_LPA0_MIWT8_4_PLR1_SU32_SUM0_SUS256_VWA4_VWB4_WGM8_WGMXCC1_WGMXCCGn1
    SolutionIndex: 30
    SolutionNameMin: Cijk_Ailk_Bljk_HSS_BH_UserArgs_MT256x64x32_MI16x16x1_SN_LDSB1_CLR1_GSU0_GSUC0_GSUWGMRR0_K1_LBSPPA2048_LBSPPB128_LPA0_MIWT8_2_PLR1_SU32_SUM0_SUS256_VWA4_VWB2_WGM1_WGMXCC1_WGMXCCGn1
    SolutionIndex: 31
    SolutionNameMin: Cijk_Ailk_Bljk_HSS_BH_UserArgs_MT128x128x32_MI16x16x1_SN_LDSB1_CLR1_GSU0_GSUC0_GSUWGMRR0_K1_LBSPPA1024_LBSPPB128_LPA0_MIWT4_4_PLR1_SU32_SUM0_SUS256_VWA4_VWB2_WGM1_WGMXCC1_WGMXCCGn1
    SolutionIndex: 32
    SolutionNameMin: Cijk_Ailk_Bljk_HSS_BH_UserArgs_MT128x128x32_MI16x16x1_SN_LDSB1_CLR1_GSU0_GSUC0_GSUWGMRR0_K1_LBSPPA1024_LBSPPB256_LPA0_MIWT4_4_PLR1_SU32_SUM0_SUS256_VWA4_VWB4_WGM1_WGMXCC1_WGMXCCGn1
    SolutionIndex: 33
    SolutionNameMin: Cijk_Ailk_Bljk_HSS_BH_UserArgs_MT128x128x32_MI16x16x1_SN_LDSB1_CLR1_GSU0_GSUC0_GSUWGMRR0_K1_LBSPPA1024_LBSPPB128_LPA0_MIWT4_4_PLR1_SU32_SUM0_SUS256_VWA4_VWB1_WGM8_WGMXCC1_WGMXCCGn1
    SolutionIndex: 34
    SolutionNameMin: Cijk_Ailk_Bljk_HSS_BH_UserArgs_MT128x128x32_MI16x16x1_SN_LDSB1_CLR1_GSU0_GSUC0_GSUWGMRR0_K1_LBSPPA1024_LBSPPB128_LPA0_MIWT4_4_PLR1_SU32_SUM0_SUS256_VWA4_VWB2_WGM8_WGMXCC1_WGMXCCGn1
    SolutionIndex: 35
    SolutionNameMin: Cijk_Ailk_Bljk_HSS_BH_UserArgs_MT128x64x32_MI16x16x1_SN_LDSB0_CLR1_GSU0_GSUC0_GSUWGMRR0_K1_LBSPPA1024_LBSPPB128_LPA0_MIWT4_2_PLR1_SU32_SUM0_SUS256_VWA4_VWB1_WGM1_WGMXCC1_WGMXCCGn1
    SolutionIndex: 36
    SolutionNameMin: Cijk_Ailk_Bljk_HSS_BH_UserArgs_MT128x64x32_MI16x16x1_SN_LDSB0_CLR1_GSU0_GSUC0_GSUWGMRR0_K1_LBSPPA1024_LBSPPB128_LPA0_MIWT4_2_PLR1_SU32_SUM0_SUS256_VWA4_VWB2_WGM4_WGMXCC1_WGMXCCGn1
    SolutionIndex: 37
    SolutionNameMin: Cijk_Ailk_Bljk_HSS_BH_UserArgs_MT128x64x32_MI16x16x1_SN_LDSB0_CLR1_GSU0_GSUC0_GSUWGMRR0_K1_LBSPPA1024_LBSPPB128_LPA0_MIWT4_2_PLR1_SU32_SUM0_SUS256_VWA4_VWB1_WGM8_WGMXCC1_WGMXCCGn1
    SolutionIndex: 38
    SolutionNameMin: Cijk_Ailk_Bljk_HSS_BH_UserArgs_MT128x64x32_MI16x16x1_SN_LDSB0_CLR1_GSU0_GSUC0_GSUWGMRR0_K1_LBSPPA1024_LBSPPB128_LPA0_MIWT4_2_PLR1_SU32_SUM0_SUS256_VWA4_VWB2_WGM8_WGMXCC1_WGMXCCGn1
    SolutionIndex: 39
    SolutionNameMin: Cijk_Ailk_Bljk_HSS_BH_UserArgs_MT128x256x64_MI16x16x1_SN_LDSB1_CLR1_GSU0_GSUC0_GSUWGMRR0_K1_LBSPPA2048_LBSPPB128_LPA0_MIWT4_8_PLR1_SU32_SUM0_SUS256_VWA4_VWB1_WGM1_WGMXCC1_WGMXCCGn1
    SolutionIndex: 40
    SolutionNameMin: Cijk_Ailk_Bljk_HSS_BH_UserArgs_MT128x256x64_MI16x16x1_SN_LDSB1_CLR1_GSU0_GSUC0_GSUWGMRR0_K1_LBSPPA2048_LBSPPB256_LPA32_MIWT4_8_PLR1_SU32_SUM0_SUS256_VWA2_VWB2_WGM1_WGMXCC1_WGMXCCGn1
    SolutionIndex: 41
    SolutionNameMin: Cijk_Ailk_Bljk_HSS_BH_UserArgs_MT128x256x64_MI16x16x1_SN_LDSB1_CLR1_GSU0_GSUC0_GSUWGMRR0_K1_LBSPPA2048_LBSPPB256_LPA0_MIWT4_8_PLR1_SU32_SUM0_SUS256_VWA4_VWB2_WGM1_WGMXCC1_WGMXCCGn1
    SolutionIndex: 42
    SolutionNameMin: Cijk_Ailk_Bljk_HSS_BH_UserArgs_MT128x256x64_MI16x16x1_SN_LDSB1_CLR1_GSU0_GSUC0_GSUWGMRR0_K1_LBSPPA2048_LBSPPB512_LPA0_MIWT4_8_PLR1_SU32_SUM0_SUS256_VWA4_VWB4_WGM1_WGMXCC1_WGMXCCGn1
    SolutionIndex: 43
    SolutionNameMin: Cijk_Ailk_Bljk_HSS_BH_UserArgs_MT128x256x64_MI16x16x1_SN_LDSB1_CLR1_GSU0_GSUC0_GSUWGMRR0_K1_LBSPPA2048_LBSPPB1024_LPA32_MIWT4_8_PLR1_SU32_SUM0_SUS256_VWA2_VWB8_WGM1_WGMXCC1_WGMXCCGn1
    SolutionIndex: 44
    SolutionNameMin: Cijk_Ailk_Bljk_HSS_BH_UserArgs_MT128x256x64_MI16x16x1_SN_LDSB1_CLR1_GSU0_GSUC0_GSUWGMRR0_K1_LBSPPA2048_LBSPPB1024_LPA0_MIWT4_8_PLR1_SU32_SUM0_SUS256_VWA4_VWB8_WGM1_WGMXCC1_WGMXCCGn1
    SolutionIndex: 45
    SolutionNameMin: Cijk_Ailk_Bljk_HSS_BH_UserArgs_MT128x256x64_MI16x16x1_SN_LDSB1_CLR1_GSU0_GSUC0_GSUWGMRR0_K1_LBSPPA2048_LBSPPB128_LPA32_MIWT4_8_PLR1_SU32_SUM0_SUS256_VWA2_VWB1_WGM4_WGMXCC1_WGMXCCGn1
    SolutionIndex: 46
    SolutionNameMin: Cijk_Ailk_Bljk_HSS_BH_UserArgs_MT128x256x64_MI16x16x1_SN_LDSB1_CLR1_GSU0_GSUC0_GSUWGMRR0_K1_LBSPPA2048_LBSPPB256_LPA0_MIWT4_8_PLR1_SU32_SUM0_SUS256_VWA4_VWB2_WGM4_WGMXCC1_WGMXCCGn1
    SolutionIndex: 47
    SolutionNameMin: Cijk_Ailk_Bljk_HSS_BH_UserArgs_MT128x256x64_MI16x16x1_SN_LDSB1_CLR1_GSU0_GSUC0_GSUWGMRR0_K1_LBSPPA2048_LBSPPB512_LPA0_MIWT4_8_PLR1_SU32_SUM0_SUS256_VWA4_VWB4_WGM4_WGMXCC1_WGMXCCGn1
    SolutionIndex: 48
    SolutionNameMin: Cijk_Ailk_Bljk_HSS_BH_UserArgs_MT128x256x64_MI16x16x1_SN_LDSB1_CLR1_GSU0_GSUC0_GSUWGMRR0_K1_LBSPPA2048_LBSPPB1024_LPA0_MIWT4_8_PLR1_SU32_SUM0_SUS256_VWA4_VWB8_WGM4_WGMXCC1_WGMXCCGn1
    SolutionIndex: 49
    SolutionNameMin: Cijk_Ailk_Bljk_HSS_BH_UserArgs_MT128x256x64_MI16x16x1_SN_LDSB1_CLR1_GSU0_GSUC0_GSUWGMRR0_K1_LBSPPA2048_LBSPPB256_LPA0_MIWT4_8_PLR1_SU32_SUM0_SUS256_VWA4_VWB2_WGM8_WGMXCC1_WGMXCCGn1
    SolutionIndex: 50
    SolutionNameMin: Cijk_Ailk_Bljk_HSS_BH_UserArgs_MT128x256x64_MI16x16x1_SN_LDSB1_CLR1_GSU0_GSUC0_GSUWGMRR0_K1_LBSPPA2048_LBSPPB512_LPA0_MIWT4_8_PLR1_SU32_SUM0_SUS256_VWA4_VWB4_WGM8_WGMXCC1_WGMXCCGn1
    SolutionIndex: 51
    SolutionNameMin: Cijk_Ailk_Bljk_HSS_BH_UserArgs_MT128x256x64_MI16x16x1_SN_LDSB1_CLR1_GSU0_GSUC0_GSUWGMRR0_K1_LBSPPA2048_LBSPPB1024_LPA32_MIWT4_8_PLR1_SU32_SUM0_SUS256_VWA2_VWB8_WGM8_WGMXCC1_WGMXCCGn1
    SolutionIndex: 52
    SolutionNameMin: Cijk_Ailk_Bljk_HSS_BH_UserArgs_MT128x256x64_MI16x16x1_SN_LDSB1_CLR1_GSU0_GSUC0_GSUWGMRR0_K1_LBSPPA2048_LBSPPB1024_LPA0_MIWT4_8_PLR1_SU32_SUM0_SUS256_VWA4_VWB8_WGM8_WGMXCC1_WGMXCCGn1
    SolutionIndex: 53
    SolutionNameMin: Cijk_Ailk_Bljk_HSS_BH_UserArgs_MT256x128x64_MI16x16x1_SN_LDSB1_CLR1_GSU0_GSUC0_GSUWGMRR0_K1_LBSPPA4096_LBSPPB128_LPA0_MIWT8_4_PLR1_SU32_SUM0_SUS256_VWA4_VWB1_WGM1_WGMXCC1_WGMXCCGn1
    SolutionIndex: 54
    SolutionNameMin: Cijk_Ailk_Bljk_HSS_BH_UserArgs_MT256x128x64_MI16x16x1_SN_LDSB1_CLR1_GSU0_GSUC0_GSUWGMRR0_K1_LBSPPA4096_LBSPPB256_LPA32_MIWT8_4_PLR1_SU32_SUM0_SUS256_VWA2_VWB2_WGM1_WGMXCC1_WGMXCCGn1
    SolutionIndex: 55
    SolutionNameMin: Cijk_Ailk_Bljk_HSS_BH_UserArgs_MT256x128x64_MI16x16x1_SN_LDSB1_CLR1_GSU0_GSUC0_GSUWGMRR0_K1_LBSPPA4096_LBSPPB256_LPA0_MIWT8_4_PLR1_SU32_SUM0_SUS256_VWA4_VWB2_WGM1_WGMXCC1_WGMXCCGn1
    SolutionIndex: 56
    SolutionNameMin: Cijk_Ailk_Bljk_HSS_BH_UserArgs_MT256x128x64_MI16x16x1_SN_LDSB1_CLR1_GSU0_GSUC0_GSUWGMRR0_K1_LBSPPA4096_LBSPPB512_LPA0_MIWT8_4_PLR1_SU32_SUM0_SUS256_VWA4_VWB4_WGM1_WGMXCC1_WGMXCCGn1
    SolutionIndex: 57
    SolutionNameMin: Cijk_Ailk_Bljk_HSS_BH_UserArgs_MT256x128x64_MI16x16x1_SN_LDSB1_CLR1_GSU0_GSUC0_GSUWGMRR0_K1_LBSPPA4096_LBSPPB128_LPA0_MIWT8_4_PLR1_SU32_SUM0_SUS256_VWA4_VWB1_WGM4_WGMXCC1_WGMXCCGn1
    SolutionIndex: 58
    SolutionNameMin: Cijk_Ailk_Bljk_HSS_BH_UserArgs_MT256x128x64_MI16x16x1_SN_LDSB1_CLR1_GSU0_GSUC0_GSUWGMRR0_K1_LBSPPA4096_LBSPPB256_LPA0_MIWT8_4_PLR1_SU32_SUM0_SUS256_VWA4_VWB2_WGM4_WGMXCC1_WGMXCCGn1
    SolutionIndex: 59
    SolutionNameMin: Cijk_Ailk_Bljk_HSS_BH_UserArgs_MT256x128x64_MI16x16x1_SN_LDSB1_CLR1_GSU0_GSUC0_GSUWGMRR0_K1_LBSPPA4096_LBSPPB512_LPA0_MIWT8_4_PLR1_SU32_SUM0_SUS256_VWA4_VWB4_WGM4_WGMXCC1_WGMXCCGn1
    SolutionIndex: 60
    SolutionNameMin: Cijk_Ailk_Bljk_HSS_BH_UserArgs_MT256x128x64_MI16x16x1_SN_LDSB1_CLR1_GSU0_GSUC0_GSUWGMRR0_K1_LBSPPA4096_LBSPPB128_LPA0_MIWT8_4_PLR1_SU32_SUM0_SUS256_VWA4_VWB1_WGM8_WGMXCC1_WGMXCCGn1
    SolutionIndex: 61
    SolutionNameMin: Cijk_Ailk_Bljk_HSS_BH_UserArgs_MT256x128x64_MI16x16x1_SN_LDSB1_CLR1_GSU0_GSUC0_GSUWGMRR0_K1_LBSPPA4096_LBSPPB256_LPA0_MIWT8_4_PLR1_SU32_SUM0_SUS256_VWA4_VWB2_WGM8_WGMXCC1_WGMXCCGn1
    SolutionIndex: 62
    SolutionNameMin: Cijk_Ailk_Bljk_HSS_BH_UserArgs_MT256x128x64_MI16x16x1_SN_LDSB1_CLR1_GSU0_GSUC0_GSUWGMRR0_K1_LBSPPA4096_LBSPPB512_LPA0_MIWT8_4_PLR1_SU32_SUM0_SUS256_VWA4_VWB4_WGM8_WGMXCC1_WGMXCCGn1
    SolutionIndex: 63
    SolutionNameMin: Cijk_Ailk_Bljk_HSS_BH_UserArgs_MT128x128x64_MI16x16x1_SN_LDSB1_CLR1_GSU0_GSUC0_GSUWGMRR0_K1_LBSPPA2048_LBSPPB128_LPA32_MIWT4_4_PLR1_SU32_SUM0_SUS256_VWA2_VWB1_WGM1_WGMXCC1_WGMXCCGn1
    SolutionIndex: 64
    SolutionNameMin: Cijk_Ailk_Bljk_HSS_BH_UserArgs_MT128x128x64_MI16x16x1_SN_LDSB1_CLR1_GSU0_GSUC0_GSUWGMRR0_K1_LBSPPA2048_LBSPPB128_LPA0_MIWT4_4_PLR1_SU32_SUM0_SUS256_VWA4_VWB1_WGM1_WGMXCC1_WGMXCCGn1
    SolutionIndex: 65
    SolutionNameMin: Cijk_Ailk_Bljk_HSS_BH_UserArgs_MT128x128x64_MI16x16x1_SN_LDSB1_CLR1_GSU0_GSUC0_GSUWGMRR0_K1_LBSPPA2048_LBSPPB256_LPA0_MIWT4_4_PLR1_SU32_SUM0_SUS256_VWA4_VWB2_WGM1_WGMXCC1_WGMXCCGn1
    SolutionIndex: 66
    SolutionNameMin: Cijk_Ailk_Bljk_HSS_BH_UserArgs_MT128x128x64_MI16x16x1_SN_LDSB1_CLR1_GSU0_GSUC0_GSUWGMRR0_K1_LBSPPA2048_LBSPPB512_LPA0_MIWT4_4_PLR1_SU32_SUM0_SUS256_VWA4_VWB4_WGM1_WGMXCC1_WGMXCCGn1
    SolutionIndex: 67
    SolutionNameMin: Cijk_Ailk_Bljk_HSS_BH_UserArgs_MT128x128x64_MI16x16x1_SN_LDSB1_CLR1_GSU0_GSUC0_GSUWGMRR0_K1_LBSPPA2048_LBSPPB128_LPA0_MIWT4_4_PLR1_SU32_SUM0_SUS256_VWA4_VWB1_WGM4_WGMXCC1_WGMXCCGn1
    SolutionIndex: 68
    SolutionNameMin: Cijk_Ailk_Bljk_HSS_BH_UserArgs_MT128x128x64_MI16x16x1_SN_LDSB1_CLR1_GSU0_GSUC0_GSUWGMRR0_K1_LBSPPA2048_LBSPPB256_LPA32_MIWT4_4_PLR1_SU32_SUM0_SUS256_VWA2_VWB2_WGM4_WGMXCC1_WGMXCCGn1
    SolutionIndex: 69
    SolutionNameMin: Cijk_Ailk_Bljk_HSS_BH_UserArgs_MT128x128x64_MI16x16x1_SN_LDSB1_CLR1_GSU0_GSUC0_GSUWGMRR0_K1_LBSPPA2048_LBSPPB256_LPA0_MIWT4_4_PLR1_SU32_SUM0_SUS256_VWA4_VWB2_WGM4_WGMXCC1_WGMXCCGn1
    SolutionIndex: 70
    SolutionNameMin: Cijk_Ailk_Bljk_HSS_BH_UserArgs_MT128x128x64_MI16x16x1_SN_LDSB1_CLR1_GSU0_GSUC0_GSUWGMRR0_K1_LBSPPA2048_LBSPPB512_LPA32_MIWT4_4_PLR1_SU32_SUM0_SUS256_VWA2_VWB4_WGM4_WGMXCC1_WGMXCCGn1
    SolutionIndex: 71
    SolutionNameMin: Cijk_Ailk_Bljk_HSS_BH_UserArgs_MT128x128x64_MI16x16x1_SN_LDSB1_CLR1_GSU0_GSUC0_GSUWGMRR0_K1_LBSPPA2048_LBSPPB512_LPA0_MIWT4_4_PLR1_SU32_SUM0_SUS256_VWA4_VWB4_WGM4_WGMXCC1_WGMXCCGn1
    SolutionIndex: 72
    SolutionNameMin: Cijk_Ailk_Bljk_HSS_BH_UserArgs_MT128x128x64_MI16x16x1_SN_LDSB1_CLR1_GSU0_GSUC0_GSUWGMRR0_K1_LBSPPA2048_LBSPPB128_LPA32_MIWT4_4_PLR1_SU32_SUM0_SUS256_VWA2_VWB1_WGM8_WGMXCC1_WGMXCCGn1
    SolutionIndex: 73
    SolutionNameMin: Cijk_Ailk_Bljk_HSS_BH_UserArgs_MT128x128x64_MI16x16x1_SN_LDSB1_CLR1_GSU0_GSUC0_GSUWGMRR0_K1_LBSPPA2048_LBSPPB128_LPA0_MIWT4_4_PLR1_SU32_SUM0_SUS256_VWA4_VWB1_WGM8_WGMXCC1_WGMXCCGn1
    SolutionIndex: 74
    SolutionNameMin: Cijk_Ailk_Bljk_HSS_BH_UserArgs_MT128x128x64_MI16x16x1_SN_LDSB1_CLR1_GSU0_GSUC0_GSUWGMRR0_K1_LBSPPA2048_LBSPPB256_LPA0_MIWT4_4_PLR1_SU32_SUM0_SUS256_VWA4_VWB2_WGM8_WGMXCC1_WGMXCCGn1
    SolutionIndex: 75
    SolutionNameMin: Cijk_Ailk_Bljk_HSS_BH_UserArgs_MT128x128x64_MI16x16x1_SN_LDSB1_CLR1_GSU0_GSUC0_GSUWGMRR0_K1_LBSPPA2048_LBSPPB512_LPA0_MIWT4_4_PLR1_SU32_SUM0_SUS256_VWA4_VWB4_WGM8_WGMXCC1_WGMXCCGn1
    SolutionIndex: 76
    SolutionNameMin: Cijk_Ailk_Bljk_HSS_BH_UserArgs_MT64x128x64_MI16x16x1_SN_LDSB1_CLR1_GSU0_GSUC0_GSUWGMRR0_K1_LBSPPA1024_LBSPPB128_LPA32_MIWT2_4_PLR1_SU32_SUM0_SUS256_VWA2_VWB1_WGM1_WGMXCC1_WGMXCCGn1
    SolutionIndex: 77
    SolutionNameMin: Cijk_Ailk_Bljk_HSS_BH_UserArgs_MT64x128x64_MI16x16x1_SN_LDSB1_CLR1_GSU0_GSUC0_GSUWGMRR0_K1_LBSPPA1024_LBSPPB256_LPA32_MIWT2_4_PLR1_SU32_SUM0_SUS256_VWA2_VWB2_WGM8_WGMXCC1_WGMXCCGn1
    SolutionIndex: 78
    SolutionNameMin: Cijk_Ailk_Bljk_HSS_BH_UserArgs_MT128x64x64_MI16x16x1_SN_LDSB1_CLR1_GSU0_GSUC0_GSUWGMRR0_K1_LBSPPA2048_LBSPPB128_LPA0_MIWT4_2_PLR1_SU32_SUM0_SUS256_VWA4_VWB1_WGM1_WGMXCC1_WGMXCCGn1
    SolutionIndex: 79
    SolutionNameMin: Cijk_Ailk_Bljk_HSS_BH_UserArgs_MT128x64x64_MI16x16x1_SN_LDSB1_CLR1_GSU0_GSUC0_GSUWGMRR0_K1_LBSPPA2048_LBSPPB256_LPA0_MIWT4_2_PLR1_SU32_SUM0_SUS256_VWA4_VWB2_WGM1_WGMXCC1_WGMXCCGn1
    SolutionIndex: 80
    SolutionNameMin: Cijk_Ailk_Bljk_HSS_BH_UserArgs_MT128x64x64_MI16x16x1_SN_LDSB1_CLR1_GSU0_GSUC0_GSUWGMRR0_K1_LBSPPA2048_LBSPPB128_LPA0_MIWT4_2_PLR1_SU32_SUM0_SUS256_VWA4_VWB1_WGM4_WGMXCC1_WGMXCCGn1
    SolutionIndex: 81
    SolutionNameMin: Cijk_Ailk_Bljk_HSS_BH_UserArgs_MT128x64x64_MI16x16x1_SN_LDSB1_CLR1_GSU0_GSUC0_GSUWGMRR0_K1_LBSPPA2048_LBSPPB256_LPA0_MIWT4_2_PLR1_SU32_SUM0_SUS256_VWA4_VWB2_WGM4_WGMXCC1_WGMXCCGn1
    SolutionIndex: 82
    SolutionNameMin: Cijk_Ailk_Bljk_HSS_BH_UserArgs_MT128x64x64_MI16x16x1_SN_LDSB1_CLR1_GSU0_GSUC0_GSUWGMRR0_K1_LBSPPA2048_LBSPPB128_LPA0_MIWT4_2_PLR1_SU32_SUM0_SUS256_VWA4_VWB1_WGM8_WGMXCC1_WGMXCCGn1
    SolutionIndex: 83
    SolutionNameMin: Cijk_Ailk_Bljk_HSS_BH_UserArgs_MT128x64x64_MI16x16x1_SN_LDSB1_CLR1_GSU0_GSUC0_GSUWGMRR0_K1_LBSPPA2048_LBSPPB256_LPA0_MIWT4_2_PLR1_SU32_SUM0_SUS256_VWA4_VWB2_WGM8_WGMXCC1_WGMXCCGn1
    SolutionIndex: 84
    SolutionNameMin: Cijk_Ailk_Bljk_HSS_BH_UserArgs_MT64x64x64_MI16x16x1_SN_LDSB1_CLR1_GSU0_GSUC0_GSUWGMRR0_K1_LBSPPA1024_LBSPPB128_LPA32_MIWT2_2_PLR1_SU32_SUM0_SUS256_VWA2_VWB1_WGM1_WGMXCC1_WGMXCCGn1
    SolutionIndex: 85
    SolutionNameMin: Cijk_Ailk_Bljk_HSS_BH_UserArgs_MT64x64x64_MI16x16x1_SN_LDSB1_CLR1_GSU0_GSUC0_GSUWGMRR0_K1_LBSPPA1024_LBSPPB256_LPA32_MIWT2_2_PLR1_SU32_SUM0_SUS256_VWA2_VWB2_WGM1_WGMXCC1_WGMXCCGn1
    SolutionIndex: 86
    SolutionNameMin: Cijk_Ailk_Bljk_HSS_BH_UserArgs_MT64x64x64_MI16x16x1_SN_LDSB1_CLR1_GSU0_GSUC0_GSUWGMRR0_K1_LBSPPA1024_LBSPPB128_LPA32_MIWT2_2_PLR2_SU32_SUM0_SUS256_VWA2_VWB1_WGM1_WGMXCC1_WGMXCCGn1
    SolutionIndex: 87
    SolutionNameMin: Cijk_Ailk_Bljk_HSS_BH_UserArgs_MT64x64x64_MI16x16x1_SN_LDSB1_CLR1_GSU0_GSUC0_GSUWGMRR0_K1_LBSPPA1024_LBSPPB256_LPA32_MIWT2_2_PLR2_SU32_SUM0_SUS256_VWA2_VWB2_WGM1_WGMXCC1_WGMXCCGn1
    SolutionIndex: 88
    SolutionNameMin: Cijk_Ailk_Bljk_HSS_BH_UserArgs_MT32x64x64_MI16x16x1_SN_LDSB0_CLR1_GSU0_GSUC0_GSUWGMRR0_K1_LBSPPA512_LBSPPB256_LPA16_MIWT1_2_PLR1_SU32_SUM0_SUS256_VWA1_VWB2_WGM1_WGMXCC1_WGMXCCGn1
    SolutionIndex: 89
    SolutionNameMin: Cijk_Ailk_Bljk_HSS_BH_UserArgs_MT32x64x64_MI16x16x1_SN_LDSB0_CLR1_GSU0_GSUC0_GSUWGMRR0_K1_LBSPPA512_LBSPPB128_LPA16_MIWT1_2_PLR1_SU32_SUM0_SUS256_VWA1_VWB1_WGM8_WGMXCC1_WGMXCCGn1
    SolutionIndex: 90
    SolutionNameMin: Cijk_Ailk_Bljk_HSS_BH_UserArgs_MT64x32x64_MI16x16x1_SN_LDSB0_CLR1_GSU0_GSUC0_GSUWGMRR0_K1_LBSPPA1024_LBSPPB128_LPA32_MIWT2_1_PLR2_SU32_SUM0_SUS256_VWA2_VWB1_WGM1_WGMXCC1_WGMXCCGn1
    SolutionIndex: 91
    SolutionNameMin: Cijk_Ailk_Bljk_HSS_BH_UserArgs_MT64x32x64_MI16x16x1_SN_LDSB0_CLR1_GSU0_GSUC0_GSUWGMRR0_K1_LBSPPA1024_LBSPPB128_LPA32_MIWT2_1_PLR1_SU32_SUM0_SUS256_VWA2_VWB1_WGM4_WGMXCC1_WGMXCCGn1
    SolutionIndex: 92
    SolutionNameMin: Cijk_Ailk_Bljk_HSS_BH_UserArgs_MT64x32x64_MI16x16x1_SN_LDSB0_CLR1_GSU0_GSUC0_GSUWGMRR0_K1_LBSPPA1024_LBSPPB128_LPA16_MIWT2_1_PLR2_SU32_SUM0_SUS256_VWA1_VWB1_WGM8_WGMXCC1_WGMXCCGn1
    SolutionIndex: 93
    SolutionNameMin: Cijk_Ailk_Bljk_HSS_BH_UserArgs_MT32x32x64_MI16x16x1_SN_LDSB0_CLR1_GSU0_GSUC0_GSUWGMRR0_K1_LBSPPA512_LBSPPB128_LPA16_MIWT1_1_PLR1_SU32_SUM0_SUS256_VWA1_VWB1_WGM4_WGMXCC1_WGMXCCGn1
    SolutionIndex: 94
    SolutionNameMin: Cijk_Ailk_Bljk_HSS_BH_UserArgs_MT32x32x64_MI16x16x1_SN_LDSB0_CLR1_GSU0_GSUC0_GSUWGMRR0_K1_LBSPPA512_LBSPPB128_LPA16_MIWT1_1_PLR1_SU32_SUM0_SUS256_VWA1_VWB1_WGM8_WGMXCC1_WGMXCCGn1
    SolutionIndex: 95
    SolutionNameMin: Cijk_Ailk_Bljk_HSS_BH_UserArgs_MT128x64x128_MI16x16x1_SN_LDSB1_CLR1_GSU0_GSUC0_GSUWGMRR0_K1_LBSPPA2048_LBSPPB256_LPA0_MIWT4_2_PLR1_SU32_SUM0_SUS256_VWA4_VWB1_WGM1_WGMXCC1_WGMXCCGn1
    SolutionIndex: 96
    SolutionNameMin: Cijk_Ailk_Bljk_HSS_BH_UserArgs_MT128x64x128_MI16x16x1_SN_LDSB1_CLR1_GSU0_GSUC0_GSUWGMRR0_K1_LBSPPA2048_LBSPPB512_LPA0_MIWT4_2_PLR1_SU32_SUM0_SUS256_VWA4_VWB2_WGM1_WGMXCC1_WGMXCCGn1
    SolutionIndex: 97
    SolutionNameMin: Cijk_Ailk_Bljk_HSS_BH_UserArgs_MT128x64x128_MI16x16x1_SN_LDSB1_CLR1_GSU0_GSUC0_GSUWGMRR0_K1_LBSPPA2048_LBSPPB256_LPA0_MIWT4_2_PLR2_SU32_SUM0_SUS256_VWA4_VWB1_WGM1_WGMXCC1_WGMXCCGn1
    SolutionIndex: 98
    SolutionNameMin: Cijk_Ailk_Bljk_HSS_BH_UserArgs_MT128x64x128_MI16x16x1_SN_LDSB1_CLR1_GSU0_GSUC0_GSUWGMRR0_K1_LBSPPA2048_LBSPPB512_LPA0_MIWT4_2_PLR2_SU32_SUM0_SUS256_VWA4_VWB2_WGM1_WGMXCC1_WGMXCCGn1
    SolutionIndex: 99
    SolutionNameMin: Cijk_Ailk_Bljk_HSS_BH_UserArgs_MT128x64x128_MI16x16x1_SN_LDSB1_CLR1_GSU0_GSUC0_GSUWGMRR0_K1_LBSPPA2048_LBSPPB256_LPA0_MIWT4_2_PLR1_SU32_SUM0_SUS256_VWA4_VWB1_WGM4_WGMXCC1_WGMXCCGn1
    SolutionIndex: 100
    SolutionNameMin: Cijk_Ailk_Bljk_HSS_BH_UserArgs_MT128x64x128_MI16x16x1_SN_LDSB1_CLR1_GSU0_GSUC0_GSUWGMRR0_K1_LBSPPA2048_LBSPPB256_LPA0_MIWT4_2_PLR2_SU32_SUM0_SUS256_VWA4_VWB1_WGM4_WGMXCC1_WGMXCCGn1
    SolutionIndex: 101
    SolutionNameMin: Cijk_Ailk_Bljk_HSS_BH_UserArgs_MT128x64x128_MI16x16x1_SN_LDSB1_CLR1_GSU0_GSUC0_GSUWGMRR0_K1_LBSPPA2048_LBSPPB256_LPA0_MIWT4_2_PLR2_SU32_SUM0_SUS256_VWA4_VWB1_WGM8_WGMXCC1_WGMXCCGn1
    SolutionIndex: 102
    SolutionNameMin: Cijk_Ailk_Bljk_HSS_BH_UserArgs_MT64x64x128_MI16x16x1_SN_LDSB1_CLR1_GSU0_GSUC0_GSUWGMRR0_K1_LBSPPA1024_LBSPPB256_LPA32_MIWT2_2_PLR2_SU32_SUM0_SUS256_VWA2_VWB1_WGM1_WGMXCC1_WGMXCCGn1
    SolutionIndex: 103
    SolutionNameMin: Cijk_Ailk_Bljk_HSS_BH_UserArgs_MT64x64x128_MI16x16x1_SN_LDSB1_CLR1_GSU0_GSUC0_GSUWGMRR0_K1_LBSPPA1024_LBSPPB512_LPA32_MIWT2_2_PLR2_SU32_SUM0_SUS256_VWA2_VWB2_WGM1_WGMXCC1_WGMXCCGn1
    SolutionIndex: 104
    SolutionNameMin: Cijk_Ailk_Bljk_HSS_BH_UserArgs_MT64x64x128_MI16x16x1_SN_LDSB1_CLR1_GSU0_GSUC0_GSUWGMRR0_K1_LBSPPA1024_LBSPPB512_LPA32_MIWT2_2_PLR1_SU32_SUM0_SUS256_VWA2_VWB2_WGM4_WGMXCC1_WGMXCCGn1
    SolutionIndex: 105
    SolutionNameMin: Cijk_Ailk_Bljk_HSS_BH_UserArgs_MT64x64x128_MI16x16x1_SN_LDSB1_CLR1_GSU0_GSUC0_GSUWGMRR0_K1_LBSPPA1024_LBSPPB256_LPA32_MIWT2_2_PLR2_SU32_SUM0_SUS256_VWA2_VWB1_WGM4_WGMXCC1_WGMXCCGn1
    SolutionIndex: 106
    SolutionNameMin: Cijk_Ailk_Bljk_HSS_BH_UserArgs_MT64x64x128_MI16x16x1_SN_LDSB1_CLR1_GSU0_GSUC0_GSUWGMRR0_K1_LBSPPA1024_LBSPPB512_LPA32_MIWT2_2_PLR2_SU32_SUM0_SUS256_VWA2_VWB2_WGM4_WGMXCC1_WGMXCCGn1
    SolutionIndex: 107
    SolutionNameMin: Cijk_Ailk_Bljk_HSS_BH_UserArgs_MT64x64x128_MI16x16x1_SN_LDSB1_CLR1_GSU0_GSUC0_GSUWGMRR0_K1_LBSPPA1024_LBSPPB256_LPA32_MIWT2_2_PLR2_SU32_SUM0_SUS256_VWA2_VWB1_WGM8_WGMXCC1_WGMXCCGn1
    SolutionIndex: 108
    SolutionNameMin: Cijk_Ailk_Bljk_HSS_BH_UserArgs_MT64x64x128_MI16x16x1_SN_LDSB1_CLR1_GSU0_GSUC0_GSUWGMRR0_K1_LBSPPA1024_LBSPPB512_LPA32_MIWT2_2_PLR2_SU32_SUM0_SUS256_VWA2_VWB2_WGM8_WGMXCC1_WGMXCCGn1
    SolutionIndex: 109
    SolutionNameMin: Cijk_Ailk_Bljk_HSS_BH_UserArgs_MT32x64x128_MI16x16x1_SN_LDSB1_CLR1_GSU0_GSUC0_GSUWGMRR0_K1_LBSPPA512_LBSPPB256_LPA16_MIWT1_2_PLR2_SU32_SUM0_SUS256_VWA1_VWB1_WGM1_WGMXCC1_WGMXCCGn1
    SolutionIndex: 110
    SolutionNameMin: Cijk_Ailk_Bljk_HSS_BH_UserArgs_MT32x64x128_MI16x16x1_SN_LDSB1_CLR1_GSU0_GSUC0_GSUWGMRR0_K1_LBSPPA512_LBSPPB512_LPA16_MIWT1_2_PLR2_SU32_SUM0_SUS256_VWA1_VWB2_WGM4_WGMXCC1_WGMXCCGn1
    SolutionIndex: 111
    SolutionNameMin: Cijk_Ailk_Bljk_HSS_BH_UserArgs_MT64x32x128_MI16x16x1_SN_LDSB1_CLR1_GSU0_GSUC0_GSUWGMRR0_K1_LBSPPA1024_LBSPPB256_LPA32_MIWT2_1_PLR1_SU32_SUM0_SUS256_VWA2_VWB1_WGM1_WGMXCC1_WGMXCCGn1
    SolutionIndex: 112
    SolutionNameMin: Cijk_Ailk_Bljk_HSS_BH_UserArgs_MT64x32x128_MI16x16x1_SN_LDSB1_CLR1_GSU0_GSUC0_GSUWGMRR0_K1_LBSPPA1024_LBSPPB256_LPA16_MIWT2_1_PLR2_SU32_SUM0_SUS256_VWA1_VWB1_WGM1_WGMXCC1_WGMXCCGn1
    SolutionIndex: 113
    SolutionNameMin: Cijk_Ailk_Bljk_HSS_BH_UserArgs_MT64x32x128_MI16x16x1_SN_LDSB1_CLR1_GSU0_GSUC0_GSUWGMRR0_K1_LBSPPA1024_LBSPPB256_LPA32_MIWT2_1_PLR2_SU32_SUM0_SUS256_VWA2_VWB1_WGM1_WGMXCC1_WGMXCCGn1
    SolutionIndex: 114
    SolutionNameMin: Cijk_Ailk_Bljk_HSS_BH_UserArgs_MT64x32x128_MI16x16x1_SN_LDSB1_CLR1_GSU0_GSUC0_GSUWGMRR0_K1_LBSPPA1024_LBSPPB256_LPA32_MIWT2_1_PLR2_SU32_SUM0_SUS256_VWA2_VWB1_WGM4_WGMXCC1_WGMXCCGn1
    SolutionIndex: 115
    SolutionNameMin: Cijk_Ailk_Bljk_HSS_BH_UserArgs_MT32x32x128_MI16x16x1_SN_LDSB1_CLR1_GSU0_GSUC0_GSUWGMRR0_K1_LBSPPA512_LBSPPB256_LPA16_MIWT1_1_PLR1_SU32_SUM0_SUS256_VWA1_VWB1_WGM1_WGMXCC1_WGMXCCGn1
    SolutionIndex: 116
    SolutionNameMin: Cijk_Ailk_Bljk_HSS_BH_UserArgs_MT32x32x128_MI16x16x1_SN_LDSB1_CLR1_GSU0_GSUC0_GSUWGMRR0_K1_LBSPPA512_LBSPPB256_LPA16_MIWT1_1_PLR2_SU32_SUM0_SUS256_VWA1_VWB1_WGM1_WGMXCC1_WGMXCCGn1
    SolutionIndex: 117
    SolutionNameMin: Cijk_Ailk_Bljk_HSS_BH_UserArgs_MT32x32x128_MI16x16x1_SN_LDSB1_CLR1_GSU0_GSUC0_GSUWGMRR0_K1_LBSPPA512_LBSPPB256_LPA16_MIWT1_1_PLR2_SU32_SUM0_SUS256_VWA1_VWB1_WGM4_WGMXCC1_WGMXCCGn1
    SolutionIndex: 118
    SolutionNameMin: Cijk_Ailk_Bljk_HSS_BH_UserArgs_MT32x32x32_MI16x16x1_SN_LDSB0_CLR0_GSU0_GSUC0_GSUWGMRR0_K1_LBSPPA256_LBSPPB128_LPA16_MIWT1_1_PLR0_SU32_SUM0_SUS256_VWA1_VWB1_WGM8_WGMXCC1_WGMXCCGn1
- - - [128, 128, 1, 128, 128, 128, 128, 128]
    - [109, 0.077]
  - - [128, 128, 1, 256, 128, 128, 128, 256]
    - [115, 0.145]
  - - [128, 128, 1, 512, 128, 128, 128, 512]
    - [115, 0.245]
  - - [128, 128, 1, 1024, 128, 128, 128, 1024]
    - [116, 0.373]
  - - [128, 128, 1, 2048, 128, 128, 128, 2048]
    - [115, 0.542]
  - - [128, 128, 1, 4096, 128, 128, 128, 4096]
    - [88, 0.838]
  - - [128, 128, 1, 8192, 128, 128, 128, 8192]
    - [113, 1.317]
  - - [128, 256, 1, 128, 128, 128, 128, 128]
    - [89, 0.153]
  - - [128, 256, 1, 256, 128, 128, 128, 256]
    - [115, 0.294]
  - - [128, 256, 1, 512, 128, 128, 128, 512]
    - [93, 0.453]
  - - [128, 256, 1, 1024, 128, 128, 128, 1024]
    - [115, 0.726]
  - - [128, 256, 1, 2048, 128, 128, 128, 2048]
    - [116, 1.009]
  - - [128, 256, 1, 4096, 128, 128, 128, 4096]
    - [113, 1.443]
  - - [128, 256, 1, 8192, 128, 128, 128, 8192]
    - [105, 2.182]
  - - [128, 512, 1, 128, 128, 128, 128, 128]
    - [88, 0.299]
  - - [128, 512, 1, 256, 128, 128, 128, 256]
    - [84, 0.514]
  - - [128, 512, 1, 512, 128, 128, 128, 512]
    - [109, 0.859]
  - - [128, 512, 1, 1024, 128, 128, 128, 1024]
    - [109, 1.303]
  - - [128, 512, 1, 2048, 128, 128, 128, 2048]
    - [110, 1.642]
  - - [128, 512, 1, 4096, 128, 128, 128, 4096]
    - [81, 2.374]
  - - [128, 512, 1, 8192, 128, 128, 128, 8192]
    - [96, 3.404]
  - - [128, 1024, 1, 128, 128, 128, 128, 128]
    - [103, 0.531]
  - - [128, 1024, 1, 256, 128, 128, 128, 256]
    - [107, 0.906]
  - - [128, 1024, 1, 512, 128, 128, 128, 512]
    - [103, 1.459]
  - - [128, 1024, 1, 1024, 128, 128, 128, 1024]
    - [108, 2.185]
  - - [128, 1024, 1, 2048, 128, 128, 128, 2048]
    - [106, 2.709]
  - - [128, 1024, 1, 4096, 128, 128, 128, 4096]
    - [75, 3.51]
  - - [128, 1024, 1, 8192, 128, 128, 128, 8192]
    - [65, 4.595]
  - - [128, 2048, 1, 128, 128, 128, 128, 128]
    - [38, 0.911]
  - - [128, 2048, 1, 256, 128, 128, 128, 256]
    - [76, 1.482]
  - - [128, 2048, 1, 512, 128, 128, 128, 512]
    - [79, 2.236]
  - - [128, 2048, 1, 1024, 128, 128, 128, 1024]
    - [98, 3.213]
  - - [128, 2048, 1, 2048, 128, 128, 128, 2048]
    - [95, 4.128]
  - - [128, 2048, 1, 4096, 128, 128, 128, 4096]
    - [74, 4.923]
  - - [128, 2048, 1, 8192, 128, 128, 128, 8192]
    - [66, 6.335]
  - - [128, 4096, 1, 128, 128, 128, 128, 128]
    - [31, 1.098]
  - - [128, 4096, 1, 256, 128, 128, 128, 256]
    - [63, 1.948]
  - - [128, 4096, 1, 512, 128, 128, 128, 512]
    - [75, 3.051]
  - - [128, 4096, 1, 1024, 128, 128, 128, 1024]
    - [75, 4.282]
  - - [128, 4096, 1, 2048, 128, 128, 128, 2048]
    - [73, 5.425]
  - - [128, 4096, 1, 4096, 128, 128, 128, 4096]
    - [68, 5.856]
  - - [128, 4096, 1, 8192, 128, 128, 128, 8192]
    - [40, 6.742]
  - - [128, 8192, 1, 128, 128, 128, 128, 128]
    - [19, 1.448]
  - - [128, 8192, 1, 256, 128, 128, 128, 256]
    - [51, 2.36]
  - - [128, 8192, 1, 512, 128, 128, 128, 512]
    - [45, 3.652]
  - - [128, 8192, 1, 1024, 128, 128, 128, 1024]
    - [52, 5.005]
  - - [128, 8192, 1, 2048, 128, 128, 128, 2048]
    - [49, 6.166]
  - - [128, 8192, 1, 4096, 128, 128, 128, 4096]
    - [41, 7.203]
  - - [128, 8192, 1, 8192, 128, 128, 128, 8192]
    - [48, 8.211]
  - - [256, 128, 1, 128, 256, 256, 256, 128]
    - [92, 0.155]
  - - [256, 128, 1, 256, 256, 256, 256, 256]
    - [94, 0.286]
  - - [256, 128, 1, 512, 256, 256, 256, 512]
    - [117, 0.484]
  - - [256, 128, 1, 1024, 256, 256, 256, 1024]
    - [116, 0.725]
  - - [256, 128, 1, 2048, 256, 256, 256, 2048]
    - [117, 1.004]
  - - [256, 128, 1, 4096, 256, 256, 256, 4096]
    - [113, 1.405]
  - - [256, 128, 1, 8192, 256, 256, 256, 8192]
    - [107, 2.009]
  - - [256, 256, 1, 128, 256, 256, 256, 128]
    - [112, 0.303]
  - - [256, 256, 1, 256, 256, 256, 256, 256]
    - [90, 0.535]
  - - [256, 256, 1, 512, 256, 256, 256, 512]
    - [88, 0.881]
  - - [256, 256, 1, 1024, 256, 256, 256, 1024]
    - [114, 1.325]
  - - [256, 256, 1, 2048, 256, 256, 256, 2048]
    - [114, 1.755]
  - - [256, 256, 1, 4096, 256, 256, 256, 4096]
    - [80, 2.408]
  - - [256, 256, 1, 8192, 256, 256, 256, 8192]
    - [100, 3.292]
  - - [256, 512, 1, 128, 256, 256, 256, 128]
    - [104, 0.555]
  - - [256, 512, 1, 256, 256, 256, 256, 256]
    - [85, 0.933]
  - - [256, 512, 1, 512, 256, 256, 256, 512]
    - [105, 1.465]
  - - [256, 512, 1, 1024, 256, 256, 256, 1024]
    - [103, 2.164]
  - - [256, 512, 1, 2048, 256, 256, 256, 2048]
    - [103, 2.916]
  - - [256, 512, 1, 4096, 256, 256, 256, 4096]
    - [64, 3.6]
  - - [256, 512, 1, 8192, 256, 256, 256, 8192]
    - [75, 4.599]
  - - [256, 1024, 1, 128, 256, 256, 256, 128]
    - [36, 0.907]
  - - [256, 1024, 1, 256, 256, 256, 256, 256]
    - [35, 1.558]
  - - [256, 1024, 1, 512, 256, 256, 256, 512]
    - [83, 2.345]
  - - [256, 1024, 1, 1024, 256, 256, 256, 1024]
    - [98, 3.37]
  - - [256, 1024, 1, 2048, 256, 256, 256, 2048]
    - [100, 4.106]
  - - [256, 1024, 1, 4096, 256, 256, 256, 4096]
    - [71, 4.888]
  - - [256, 1024, 1, 8192, 256, 256, 256, 8192]
    - [69, 6.257]
  - - [256, 2048, 1, 128, 256, 256, 256, 128]
    - [33, 1.157]
  - - [256, 2048, 1, 256, 256, 256, 256, 256]
    - [72, 1.925]
  - - [256, 2048, 1, 512, 256, 256, 256, 512]
    - [69, 3.128]
  - - [256, 2048, 1, 1024, 256, 256, 256, 1024]
    - [65, 4.344]
  - - [256, 2048, 1, 2048, 256, 256, 256, 2048]
    - [75, 5.484]
  - - [256, 2048, 1, 4096, 256, 256, 256, 4096]
    - [74, 6.14]
  - - [256, 2048, 1, 8192, 256, 256, 256, 8192]
    - [42, 7.247]
  - - [256, 4096, 1, 128, 256, 256, 256, 128]
    - [27, 1.525]
  - - [256, 4096, 1, 256, 256, 256, 256, 256]
    - [23, 2.594]
  - - [256, 4096, 1, 512, 256, 256, 256, 512]
    - [20, 3.892]
  - - [256, 4096, 1, 1024, 256, 256, 256, 1024]
    - [44, 5.164]
  - - [256, 4096, 1, 2048, 256, 256, 256, 2048]
    - [50, 6.279]
  - - [256, 4096, 1, 4096, 256, 256, 256, 4096]
    - [59, 7.249]
  - - [256, 4096, 1, 8192, 256, 256, 256, 8192]
    - [59, 8.232]
  - - [256, 8192, 1, 128, 256, 256, 256, 128]
    - [4, 1.786]
  - - [256, 8192, 1, 256, 256, 256, 256, 256]
    - [4, 2.957]
  - - [256, 8192, 1, 512, 256, 256, 256, 512]
    - [3, 4.346]
  - - [256, 8192, 1, 1024, 256, 256, 256, 1024]
    - [4, 5.837]
  - - [256, 8192, 1, 2048, 256, 256, 256, 2048]
    - [23, 6.971]
  - - [256, 8192, 1, 4096, 256, 256, 256, 4096]
    - [55, 8.02]
  - - [256, 8192, 1, 8192, 256, 256, 256, 8192]
    - [54, 8.521]
  - - [512, 128, 1, 128, 512, 512, 512, 128]
    - [111, 0.334]
  - - [512, 128, 1, 256, 512, 512, 512, 256]
    - [91, 0.569]
  - - [512, 128, 1, 512, 512, 512, 512, 512]
    - [109, 0.918]
  - - [512, 128, 1, 1024, 512, 512, 512, 1024]
    - [113, 1.341]
  - - [512, 128, 1, 2048, 512, 512, 512, 2048]
    - [113, 1.799]
  - - [512, 128, 1, 4096, 512, 512, 512, 4096]
    - [78, 2.408]
  - - [512, 128, 1, 8192, 512, 512, 512, 8192]
    - [97, 3.308]
  - - [512, 256, 1, 128, 512, 512, 512, 128]
    - [87, 0.584]
  - - [512, 256, 1, 256, 512, 512, 512, 256]
    - [85, 0.974]
  - - [512, 256, 1, 512, 512, 512, 512, 512]
    - [103, 1.612]
  - - [512, 256, 1, 1024, 512, 512, 512, 1024]
    - [102, 2.23]
  - - [512, 256, 1, 2048, 512, 512, 512, 2048]
    - [107, 2.91]
  - - [512, 256, 1, 4096, 512, 512, 512, 4096]
    - [65, 3.66]
  - - [512, 256, 1, 8192, 512, 512, 512, 8192]
    - [65, 4.702]
  - - [512, 512, 1, 128, 512, 512, 512, 128]
    - [37, 0.953]
  - - [512, 512, 1, 256, 512, 512, 512, 256]
    - [77, 1.563]
  - - [512, 512, 1, 512, 512, 512, 512, 512]
    - [82, 2.345]
  - - [512, 512, 1, 1024, 512, 512, 512, 1024]
    - [99, 3.433]
  - - [512, 512, 1, 2048, 512, 512, 512, 2048]
    - [95, 4.15]
  - - [512, 512, 1, 4096, 512, 512, 512, 4096]
    - [71, 4.943]
  - - [512, 512, 1, 8192, 512, 512, 512, 8192]
    - [64, 6.157]
  - - [512, 1024, 1, 128, 512, 512, 512, 128]
    - [32, 1.214]
  - - [512, 1024, 1, 256, 512, 512, 512, 256]
    - [71, 1.947]
  - - [512, 1024, 1, 512, 512, 512, 512, 512]
    - [66, 3.152]
  - - [512, 1024, 1, 1024, 512, 512, 512, 1024]
    - [65, 4.31]
  - - [512, 1024, 1, 2048, 512, 512, 512, 2048]
    - [71, 5.536]
  - - [512, 1024, 1, 4096, 512, 512, 512, 4096]
    - [74, 6.293]
  - - [512, 1024, 1, 8192, 512, 512, 512, 8192]
    - [58, 7.276]
  - - [512, 2048, 1, 128, 512, 512, 512, 128]
    - [26, 1.609]
  - - [512, 2048, 1, 256, 512, 512, 512, 256]
    - [20, 2.641]
  - - [512, 2048, 1, 512, 512, 512, 512, 512]
    - [27, 3.993]
  - - [512, 2048, 1, 1024, 512, 512, 512, 1024]
    - [20, 5.232]
  - - [512, 2048, 1, 2048, 512, 512, 512, 2048]
    - [44, 6.376]
  - - [512, 2048, 1, 4096, 512, 512, 512, 4096]
    - [42, 7.293]
  - - [512, 2048, 1, 8192, 512, 512, 512, 8192]
    - [41, 8.212]
  - - [512, 4096, 1, 128, 512, 512, 512, 128]
    - [7, 1.751]
  - - [512, 4096, 1, 256, 512, 512, 512, 256]
    - [6, 2.944]
  - - [512, 4096, 1, 512, 512, 512, 512, 512]
    - [7, 4.418]
  - - [512, 4096, 1, 1024, 512, 512, 512, 1024]
    - [7, 5.839]
  - - [512, 4096, 1, 2048, 512, 512, 512, 2048]
    - [56, 7.016]
  - - [512, 4096, 1, 4096, 512, 512, 512, 4096]
    - [56, 8.093]
  - - [512, 4096, 1, 8192, 512, 512, 512, 8192]
    - [4, 8.959]
  - - [512, 8192, 1, 128, 512, 512, 512, 128]
    - [27, 1.873]
  - - [512, 8192, 1, 256, 512, 512, 512, 256]
    - [56, 3.029]
  - - [512, 8192, 1, 512, 512, 512, 512, 512]
    - [7, 4.594]
  - - [512, 8192, 1, 1024, 512, 512, 512, 1024]
    - [16, 6.346]
  - - [512, 8192, 1, 2048, 512, 512, 512, 2048]
    - [16, 7.798]
  - - [512, 8192, 1, 4096, 512, 512, 512, 4096]
    - [10, 8.845]
  - - [512, 8192, 1, 8192, 512, 512, 512, 8192]
    - [7, 9.317]
  - - [1024, 128, 1, 128, 1024, 1024, 1024, 128]
    - [102, 0.58]
  - - [1024, 128, 1, 256, 1024, 1024, 1024, 256]
    - [86, 0.961]
  - - [1024, 128, 1, 512, 1024, 1024, 1024, 512]
    - [106, 1.543]
  - - [1024, 128, 1, 1024, 1024, 1024, 1024, 1024]
    - [103, 2.284]
  - - [1024, 128, 1, 2048, 1024, 1024, 1024, 2048]
    - [78, 2.579]
  - - [1024, 128, 1, 4096, 1024, 1024, 1024, 4096]
    - [74, 3.679]
  - - [1024, 128, 1, 8192, 1024, 1024, 1024, 8192]
    - [75, 4.542]
  - - [1024, 256, 1, 128, 1024, 1024, 1024, 128]
    - [37, 0.973]
  - - [1024, 256, 1, 256, 1024, 1024, 1024, 256]
    - [37, 1.558]
  - - [1024, 256, 1, 512, 1024, 1024, 1024, 512]
    - [97, 2.365]
  - - [1024, 256, 1, 1024, 1024, 1024, 1024, 1024]
    - [95, 3.305]
  - - [1024, 256, 1, 2048, 1024, 1024, 1024, 2048]
    - [101, 3.953]
  - - [1024, 256, 1, 4096, 1024, 1024, 1024, 4096]
    - [64, 4.94]
  - - [1024, 256, 1, 8192, 1024, 1024, 1024, 8192]
    - [66, 6.261]
  - - [1024, 512, 1, 128, 1024, 1024, 1024, 128]
    - [31, 1.254]
  - - [1024, 512, 1, 256, 1024, 1024, 1024, 256]
    - [75, 1.98]
  - - [1024, 512, 1, 512, 1024, 1024, 1024, 512]
    - [66, 3.118]
  - - [1024, 512, 1, 1024, 1024, 1024, 1024, 1024]
    - [66, 4.507]
  - - [1024, 512, 1, 2048, 1024, 1024, 1024, 2048]
    - [75, 5.613]
  - - [1024, 512, 1, 4096, 1024, 1024, 1024, 4096]
    - [66, 6.326]
  - - [1024, 512, 1, 8192, 1024, 1024, 1024, 8192]
    - [47, 7.284]
  - - [1024, 1024, 1, 128, 1024, 1024, 1024, 128]
    - [22, 1.537]
  - - [1024, 1024, 1, 256, 1024, 1024, 1024, 256]
    - [23, 2.591]
  - - [1024, 1024, 1, 512, 1024, 1024, 1024, 512]
    - [29, 3.965]
  - - [1024, 1024, 1, 1024, 1024, 1024, 1024, 1024]
    - [43, 5.266]
  - - [1024, 1024, 1, 2048, 1024, 1024, 1024, 2048]
    - [42, 6.432]
  - - [1024, 1024, 1, 4096, 1024, 1024, 1024, 4096]
    - [41, 7.239]
  - - [1024, 1024, 1, 8192, 1024, 1024, 1024, 8192]
    - [39, 8.251]
  - - [1024, 2048, 1, 128, 1024, 1024, 1024, 128]
    - [7, 1.878]
  - - [1024, 2048, 1, 256, 1024, 1024, 1024, 256]
    - [18, 3.055]
  - - [1024, 2048, 1, 512, 1024, 1024, 1024, 512]
    - [7, 4.518]
  - - [1024, 2048, 1, 1024, 1024, 1024, 1024, 1024]
    - [14, 5.849]
  - - [1024, 2048, 1, 2048, 1024, 1024, 1024, 2048]
    - [56, 6.988]
  - - [1024, 2048, 1, 4096, 1024, 1024, 1024, 4096]
    - [15, 8.003]
  - - [1024, 2048, 1, 8192, 1024, 1024, 1024, 8192]
    - [16, 9.0]
  - - [1024, 4096, 1, 128, 1024, 1024, 1024, 128]
    - [23, 1.873]
  - - [1024, 4096, 1, 256, 1024, 1024, 1024, 256]
    - [55, 3.085]
  - - [1024, 4096, 1, 512, 1024, 1024, 1024, 512]
    - [18, 4.556]
  - - [1024, 4096, 1, 1024, 1024, 1024, 1024, 1024]
    - [4, 6.294]
  - - [1024, 4096, 1, 2048, 1024, 1024, 1024, 2048]
    - [4, 7.772]
  - - [1024, 4096, 1, 4096, 1024, 1024, 1024, 4096]
    - [11, 8.379]
  - - [1024, 4096, 1, 8192, 1024, 1024, 1024, 8192]
    - [5, 9.151]
  - - [1024, 8192, 1, 128, 1024, 1024, 1024, 128]
    - [55, 2.112]
  - - [1024, 8192, 1, 256, 1024, 1024, 1024, 256]
    - [55, 3.385]
  - - [1024, 8192, 1, 512, 1024, 1024, 1024, 512]
    - [23, 4.987]
  - - [1024, 8192, 1, 1024, 1024, 1024, 1024, 1024]
    - [12, 6.601]
  - - [1024, 8192, 1, 2048, 1024, 1024, 1024, 2048]
    - [12, 7.952]
  - - [1024, 8192, 1, 4096, 1024, 1024, 1024, 4096]
    - [14, 8.94]
  - - [1024, 8192, 1, 8192, 1024, 1024, 1024, 8192]
    - [9, 9.174]
  - - [2048, 128, 1, 128, 2048, 2048, 2048, 128]
    - [81, 0.944]
  - - [2048, 128, 1, 256, 2048, 2048, 2048, 256]
    - [79, 1.591]
  - - [2048, 128, 1, 512, 2048, 2048, 2048, 512]
    - [79, 2.395]
  - - [2048, 128, 1, 1024, 2048, 2048, 2048, 1024]
    - [98, 3.203]
  - - [2048, 128, 1, 2048, 2048, 2048, 2048, 2048]
    - [78, 3.951]
  - - [2048, 128, 1, 4096, 2048, 2048, 2048, 4096]
    - [65, 5.001]
  - - [2048, 128, 1, 8192, 2048, 2048, 2048, 8192]
    - [67, 6.022]
  - - [2048, 256, 1, 128, 2048, 2048, 2048, 128]
    - [34, 1.271]
  - - [2048, 256, 1, 256, 2048, 2048, 2048, 256]
    - [30, 2.002]
  - - [2048, 256, 1, 512, 2048, 2048, 2048, 512]
    - [65, 3.307]
  - - [2048, 256, 1, 1024, 2048, 2048, 2048, 1024]
    - [74, 4.537]
  - - [2048, 256, 1, 2048, 2048, 2048, 2048, 2048]
    - [65, 5.652]
  - - [2048, 256, 1, 4096, 2048, 2048, 2048, 4096]
    - [65, 6.34]
  - - [2048, 256, 1, 8192, 2048, 2048, 2048, 8192]
    - [56, 7.238]
  - - [2048, 512, 1, 128, 2048, 2048, 2048, 128]
    - [20, 1.612]
  - - [2048, 512, 1, 256, 2048, 2048, 2048, 256]
    - [23, 2.665]
  - - [2048, 512, 1, 512, 2048, 2048, 2048, 512]
    - [29, 3.943]
  - - [2048, 512, 1, 1024, 2048, 2048, 2048, 1024]
    - [41, 5.336]
  - - [2048, 512, 1, 2048, 2048, 2048, 2048, 2048]
    - [40, 6.427]
  - - [2048, 512, 1, 4096, 2048, 2048, 2048, 4096]
    - [55, 7.251]
  - - [2048, 512, 1, 8192, 2048, 2048, 2048, 8192]
    - [46, 8.22]
  - - [2048, 1024, 1, 128, 2048, 2048, 2048, 128]
    - [6, 1.868]
  - - [2048, 1024, 1, 256, 2048, 2048, 2048, 256]
    - [18, 3.074]
  - - [2048, 1024, 1, 512, 2048, 2048, 2048, 512]
    - [13, 4.48]
  - - [2048, 1024, 1, 1024, 2048, 2048, 2048, 1024]
    - [18, 5.971]
  - - [2048, 1024, 1, 2048, 2048, 2048, 2048, 2048]
    - [62, 6.966]
  - - [2048, 1024, 1, 4096, 2048, 2048, 2048, 4096]
    - [16, 8.056]
  - - [2048, 1024, 1, 8192, 2048, 2048, 2048, 8192]
    - [4, 9.006]
  - - [2048, 2048, 1, 128, 2048, 2048, 2048, 128]
    - [23, 1.901]
  - - [2048, 2048, 1, 256, 2048, 2048, 2048, 256]
    - [53, 3.055]
  - - [2048, 2048, 1, 512, 2048, 2048, 2048, 512]
    - [16, 4.615]
  - - [2048, 2048, 1, 1024, 2048, 2048, 2048, 1024]
    - [4, 6.397]
  - - [2048, 2048, 1, 2048, 2048, 2048, 2048, 2048]
    - [2, 7.856]
  - - [2048, 2048, 1, 4096, 2048, 2048, 2048, 4096]
    - [16, 8.804]
  - - [2048, 2048, 1, 8192, 2048, 2048, 2048, 8192]
    - [16, 9.41]
  - - [2048, 4096, 1, 128, 2048, 2048, 2048, 128]
    - [56, 2.118]
  - - [2048, 4096, 1, 256, 2048, 2048, 2048, 256]
    - [23, 3.413]
  - - [2048, 4096, 1, 512, 2048, 2048, 2048, 512]
    - [23, 5.004]
  - - [2048, 4096, 1, 1024, 2048, 2048, 2048, 1024]
    - [14, 6.647]
  - - [2048, 4096, 1, 2048, 2048, 2048, 2048, 2048]
    - [7, 7.971]
  - - [2048, 4096, 1, 4096, 2048, 2048, 2048, 4096]
    - [7, 8.944]
  - - [2048, 4096, 1, 8192, 2048, 2048, 2048, 8192]
    - [7, 9.443]
  - - [2048, 8192, 1, 128, 2048, 2048, 2048, 128]
    - [20, 2.518]
  - - [2048, 8192, 1, 256, 2048, 2048, 2048, 256]
    - [61, 3.729]
  - - [2048, 8192, 1, 512, 2048, 2048, 2048, 512]
    - [1, 5.421]
  - - [2048, 8192, 1, 1024, 2048, 2048, 2048, 1024]
    - [10, 7.062]
  - - [2048, 8192, 1, 2048, 2048, 2048, 2048, 2048]
    - [1, 8.248]
  - - [2048, 8192, 1, 4096, 2048, 2048, 2048, 4096]
    - [16, 8.803]
  - - [2048, 8192, 1, 8192, 2048, 2048, 2048, 8192]
    - [62, 8.858]
  - - [4096, 128, 1, 128, 4096, 4096, 4096, 128]
    - [32, 1.226]
  - - [4096, 128, 1, 256, 4096, 4096, 4096, 256]
    - [72, 2.028]
  - - [4096, 128, 1, 512, 4096, 4096, 4096, 512]
    - [64, 3.184]
  - - [4096, 128, 1, 1024, 4096, 4096, 4096, 1024]
    - [70, 4.303]
  - - [4096, 128, 1, 2048, 4096, 4096, 4096, 2048]
    - [64, 5.423]
  - - [4096, 128, 1, 4096, 4096, 4096, 4096, 4096]
    - [65, 6.393]
  - - [4096, 128, 1, 8192, 4096, 4096, 4096, 8192]
    - [61, 7.219]
  - - [4096, 256, 1, 128, 4096, 4096, 4096, 128]
    - [23, 1.645]
  - - [4096, 256, 1, 256, 4096, 4096, 4096, 256]
    - [23, 2.734]
  - - [4096, 256, 1, 512, 4096, 4096, 4096, 512]
    - [21, 4.034]
  - - [4096, 256, 1, 1024, 4096, 4096, 4096, 1024]
    - [20, 5.293]
  - - [4096, 256, 1, 2048, 4096, 4096, 4096, 2048]
    - [41, 6.406]
  - - [4096, 256, 1, 4096, 4096, 4096, 4096, 4096]
    - [47, 7.274]
  - - [4096, 256, 1, 8192, 4096, 4096, 4096, 8192]
    - [41, 8.244]
  - - [4096, 512, 1, 128, 4096, 4096, 4096, 128]
    - [2, 1.795]
  - - [4096, 512, 1, 256, 4096, 4096, 4096, 256]
    - [16, 3.013]
  - - [4096, 512, 1, 512, 4096, 4096, 4096, 512]
    - [18, 4.437]
  - - [4096, 512, 1, 1024, 4096, 4096, 4096, 1024]
    - [16, 5.894]
  - - [4096, 512, 1, 2048, 4096, 4096, 4096, 2048]
    - [41, 7.078]
  - - [4096, 512, 1, 4096, 4096, 4096, 4096, 4096]
    - [56, 8.04]
  - - [4096, 512, 1, 8192, 4096, 4096, 4096, 8192]
    - [4, 8.953]
  - - [4096, 1024, 1, 128, 4096, 4096, 4096, 128]
    - [23, 1.917]
  - - [4096, 1024, 1, 256, 4096, 4096, 4096, 256]
    - [55, 3.08]
  - - [4096, 1024, 1, 512, 4096, 4096, 4096, 512]
    - [2, 4.67]
  - - [4096, 1024, 1, 1024, 4096, 4096, 4096, 1024]
    - [1, 6.407]
  - - [4096, 1024, 1, 2048, 4096, 4096, 4096, 2048]
    - [1, 7.831]
  - - [4096, 1024, 1, 4096, 4096, 4096, 4096, 4096]
    - [4, 8.807]
  - - [4096, 1024, 1, 8192, 4096, 4096, 4096, 8192]
    - [15, 9.389]
  - - [4096, 2048, 1, 128, 4096, 4096, 4096, 128]
    - [53, 2.124]
  - - [4096, 2048, 1, 256, 4096, 4096, 4096, 256]
    - [25, 3.395]
  - - [4096, 2048, 1, 512, 4096, 4096, 4096, 512]
    - [28, 5.005]
  - - [4096, 2048, 1, 1024, 4096, 4096, 4096, 1024]
    - [10, 6.491]
  - - [4096, 2048, 1, 2048, 4096, 4096, 4096, 2048]
    - [17, 7.852]
  - - [4096, 2048, 1, 4096, 4096, 4096, 4096, 4096]
    - [2, 8.851]
  - - [4096, 2048, 1, 8192, 4096, 4096, 4096, 8192]
    - [9, 9.404]
  - - [4096, 4096, 1, 128, 4096, 4096, 4096, 128]
    - [23, 2.381]
  - - [4096, 4096, 1, 256, 4096, 4096, 4096, 256]
    - [58, 3.748]
  - - [4096, 4096, 1, 512, 4096, 4096, 4096, 512]
    - [57, 5.347]
  - - [4096, 4096, 1, 1024, 4096, 4096, 4096, 1024]
    - [4, 7.009]
  - - [4096, 4096, 1, 2048, 4096, 4096, 4096, 2048]
    - [4, 8.259]
  - - [4096, 4096, 1, 4096, 4096, 4096, 4096, 4096]
    - [9, 9.01]
  - - [4096, 4096, 1, 8192, 4096, 4096, 4096, 8192]
    - [0, 9.237]
  - - [4096, 8192, 1, 128, 4096, 4096, 4096, 128]
    - [60, 2.46]
  - - [4096, 8192, 1, 256, 4096, 4096, 4096, 256]
    - [58, 3.883]
  - - [4096, 8192, 1, 512, 4096, 4096, 4096, 512]
    - [58, 5.494]
  - - [4096, 8192, 1, 1024, 4096, 4096, 4096, 1024]
    - [16, 6.777]
  - - [4096, 8192, 1, 2048, 4096, 4096, 4096, 2048]
    - [1, 8.217]
  - - [4096, 8192, 1, 4096, 4096, 4096, 4096, 4096]
    - [8, 8.876]
  - - [4096, 8192, 1, 8192, 4096, 4096, 4096, 8192]
    - [9, 9.357]
  - - [8192, 128, 1, 128, 8192, 8192, 8192, 128]
    - [20, 1.65]
  - - [8192, 128, 1, 256, 8192, 8192, 8192, 256]
    - [21, 2.745]
  - - [8192, 128, 1, 512, 8192, 8192, 8192, 512]
    - [23, 3.963]
  - - [8192, 128, 1, 1024, 8192, 8192, 8192, 1024]
    - [23, 5.177]
  - - [8192, 128, 1, 2048, 8192, 8192, 8192, 2048]
    - [53, 6.342]
  - - [8192, 128, 1, 4096, 8192, 8192, 8192, 4096]
    - [53, 7.247]
  - - [8192, 128, 1, 8192, 8192, 8192, 8192, 8192]
    - [53, 8.206]
  - - [8192, 256, 1, 128, 8192, 8192, 8192, 128]
    - [9, 1.833]
  - - [8192, 256, 1, 256, 8192, 8192, 8192, 256]
    - [1, 3.005]
  - - [8192, 256, 1, 512, 8192, 8192, 8192, 512]
    - [15, 4.468]
  - - [8192, 256, 1, 1024, 8192, 8192, 8192, 1024]
    - [4, 5.849]
  - - [8192, 256, 1, 2048, 8192, 8192, 8192, 2048]
    - [49, 7.042]
  - - [8192, 256, 1, 4096, 8192, 8192, 8192, 4096]
    - [48, 8.072]
  - - [8192, 256, 1, 8192, 8192, 8192, 8192, 8192]
    - [9, 8.936]
  - - [8192, 512, 1, 128, 8192, 8192, 8192, 128]
    - [20, 1.938]
  - - [8192, 512, 1, 256, 8192, 8192, 8192, 256]
    - [53, 3.111]
  - - [8192, 512, 1, 512, 8192, 8192, 8192, 512]
    - [1, 4.778]
  - - [8192, 512, 1, 1024, 8192, 8192, 8192, 1024]
    - [2, 6.436]
  - - [8192, 512, 1, 2048, 8192, 8192, 8192, 2048]
    - [15, 7.877]
  - - [8192, 512, 1, 4096, 8192, 8192, 8192, 4096]
    - [16, 8.824]
  - - [8192, 512, 1, 8192, 8192, 8192, 8192, 8192]
    - [9, 9.428]
  - - [8192, 1024, 1, 128, 8192, 8192, 8192, 128]
    - [53, 2.222]
  - - [8192, 1024, 1, 256, 8192, 8192, 8192, 256]
    - [20, 3.406]
  - - [8192, 1024, 1, 512, 8192, 8192, 8192, 512]
    - [24, 4.971]
  - - [8192, 1024, 1, 1024, 8192, 8192, 8192, 1024]
    - [2, 6.626]
  - - [8192, 1024, 1, 2048, 8192, 8192, 8192, 2048]
    - [12, 7.86]
  - - [8192, 1024, 1, 4096, 8192, 8192, 8192, 4096]
    - [7, 8.908]
  - - [8192, 1024, 1, 8192, 8192, 8192, 8192, 8192]
    - [8, 9.379]
  - - [8192, 2048, 1, 128, 8192, 8192, 8192, 128]
    - [20, 2.444]
  - - [8192, 2048, 1, 256, 8192, 8192, 8192, 256]
    - [24, 3.729]
  - - [8192, 2048, 1, 512, 8192, 8192, 8192, 512]
    - [10, 5.374]
  - - [8192, 2048, 1, 1024, 8192, 8192, 8192, 1024]
    - [1, 7.076]
  - - [8192, 2048, 1, 2048, 8192, 8192, 8192, 2048]
    - [2, 8.295]
  - - [8192, 2048, 1, 4096, 8192, 8192, 8192, 4096]
    - [12, 8.976]
  - - [8192, 2048, 1, 8192, 8192, 8192, 8192, 8192]
    - [16, 9.115]
  - - [8192, 4096, 1, 128, 8192, 8192, 8192, 128]
    - [60, 2.478]
  - - [8192, 4096, 1, 256, 8192, 8192, 8192, 256]
    - [57, 3.944]
  - - [8192, 4096, 1, 512, 8192, 8192, 8192, 512]
    - [61, 5.499]
  - - [8192, 4096, 1, 1024, 8192, 8192, 8192, 1024]
    - [1, 6.737]
  - - [8192, 4096, 1, 2048, 8192, 8192, 8192, 2048]
    - [1, 8.141]
  - - [8192, 4096, 1, 4096, 8192, 8192, 8192, 4096]
    - [16, 8.857]
  - - [8192, 4096, 1, 8192, 8192, 8192, 8192, 8192]
    - [14, 9.428]
  - - [8192, 8192, 1, 128, 8192, 8192, 8192, 128]
    - [2, 2.151]
  - - [8192, 8192, 1, 256, 8192, 8192, 8192, 256]
    - [57, 3.634]
  - - [8192, 8192, 1, 512, 8192, 8192, 8192, 512]
    - [9, 5.47]
  - - [8192, 8192, 1, 1024, 8192, 8192, 8192, 1024]
    - [10, 7.067]
  - - [8192, 8192, 1, 2048, 8192, 8192, 8192, 2048]
    - [9, 8.444]
  - - [8192, 8192, 1, 4096, 8192, 8192, 8192, 4096]
    - [9, 9.127]
  - - [8192, 8192, 1, 8192, 8192, 8192, 8192, 8192]
    - [14, 9.243]
  - - [1, 1, 1, 32, 1, 1, 1, 32]
    - [118, 0.0]
- null
- null
- ExperimentalStreamK
- GridBased
