library/src/amd_detail/rocblaslt/src/Tensile/Logic/asm_full/aquavanjaram/gfx942_38cu/StreamK/aquavanjaram942_Cijk_Alik_Bjlk_BBS_BH_UserArgs.yaml
- {MinimumRequiredVersion: 4.33.0}
- aquavanjaram942
- {Architecture: gfx942, CUCount: 38}
- [Device 0049, Device 0050]
    SolutionIndex: 0
    SolutionNameMin: Cijk_Alik_Bjlk_BBS_BH_UserArgs_MT256x256x32_MI16x16x1_SN_LDSB1_CLR1_GSU0_GSUC0_GSUWGMRR0_K1_LBSPPA512_LBSPPB2048_LPB16_MIWT8_8_PLR1_SU32_SUM0_SUS256_VWA8_VWB1_WGM1_WGMXCC1_WGMXCCGn1
    SolutionIndex: 1
    SolutionNameMin: Cijk_Alik_Bjlk_BBS_BH_UserArgs_MT256x256x32_MI16x16x1_SN_LDSB1_CLR1_GSU0_GSUC0_GSUWGMRR0_K1_LBSPPA256_LBSPPB2048_LPB32_MIWT8_8_PLR1_SU32_SUM0_SUS256_VWA4_VWB2_WGM1_WGMXCC1_WGMXCCGn1
    SolutionIndex: 2
    SolutionNameMin: Cijk_Alik_Bjlk_BBS_BH_UserArgs_MT256x256x32_MI16x16x1_SN_LDSB1_CLR1_GSU0_GSUC0_GSUWGMRR0_K1_LBSPPA512_LBSPPB2048_LPB32_MIWT8_8_PLR1_SU32_SUM0_SUS256_VWA8_VWB2_WGM1_WGMXCC1_WGMXCCGn1
    SolutionIndex: 3
    SolutionNameMin: Cijk_Alik_Bjlk_BBS_BH_UserArgs_MT256x256x32_MI16x16x1_SN_LDSB1_CLR1_GSU0_GSUC0_GSUWGMRR0_K1_LBSPPA128_LBSPPB2048_LPB0_MIWT8_8_PLR1_SU32_SUM0_SUS256_VWA1_VWB4_WGM1_WGMXCC1_WGMXCCGn1
    SolutionIndex: 4
    SolutionNameMin: Cijk_Alik_Bjlk_BBS_BH_UserArgs_MT256x256x32_MI16x16x1_SN_LDSB1_CLR1_GSU0_GSUC0_GSUWGMRR0_K1_LBSPPA128_LBSPPB2048_LPB0_MIWT8_8_PLR1_SU32_SUM0_SUS256_VWA2_VWB4_WGM1_WGMXCC1_WGMXCCGn1
    SolutionIndex: 5
    SolutionNameMin: Cijk_Alik_Bjlk_BBS_BH_UserArgs_MT256x256x32_MI16x16x1_SN_LDSB1_CLR1_GSU0_GSUC0_GSUWGMRR0_K1_LBSPPA256_LBSPPB2048_LPB0_MIWT8_8_PLR1_SU32_SUM0_SUS256_VWA4_VWB4_WGM1_WGMXCC1_WGMXCCGn1
    SolutionIndex: 6
    SolutionNameMin: Cijk_Alik_Bjlk_BBS_BH_UserArgs_MT256x256x32_MI16x16x1_SN_LDSB1_CLR1_GSU0_GSUC0_GSUWGMRR0_K1_LBSPPA512_LBSPPB2048_LPB0_MIWT8_8_PLR1_SU32_SUM0_SUS256_VWA8_VWB4_WGM1_WGMXCC1_WGMXCCGn1
    SolutionIndex: 7
    SolutionNameMin: Cijk_Alik_Bjlk_BBS_BH_UserArgs_MT256x256x32_MI16x16x1_SN_LDSB1_CLR1_GSU0_GSUC0_GSUWGMRR0_K1_LBSPPA256_LBSPPB2048_LPB0_MIWT8_8_PLR1_SU32_SUM0_SUS256_VWA4_VWB8_WGM1_WGMXCC1_WGMXCCGn1
    SolutionIndex: 8
    SolutionNameMin: Cijk_Alik_Bjlk_BBS_BH_UserArgs_MT256x256x32_MI16x16x1_SN_LDSB1_CLR1_GSU0_GSUC0_GSUWGMRR0_K1_LBSPPA512_LBSPPB2048_LPB0_MIWT8_8_PLR1_SU32_SUM0_SUS256_VWA8_VWB8_WGM1_WGMXCC1_WGMXCCGn1
    SolutionIndex: 9
    SolutionNameMin: Cijk_Alik_Bjlk_BBS_BH_UserArgs_MT256x256x32_MI16x16x1_SN_LDSB1_CLR1_GSU0_GSUC0_GSUWGMRR0_K1_LBSPPA512_LBSPPB2048_LPB16_MIWT8_8_PLR1_SU32_SUM0_SUS256_VWA8_VWB1_WGM4_WGMXCC1_WGMXCCGn1
    SolutionIndex: 10
    SolutionNameMin: Cijk_Alik_Bjlk_BBS_BH_UserArgs_MT256x256x32_MI16x16x1_SN_LDSB1_CLR1_GSU0_GSUC0_GSUWGMRR0_K1_LBSPPA256_LBSPPB2048_LPB32_MIWT8_8_PLR1_SU32_SUM0_SUS256_VWA4_VWB2_WGM4_WGMXCC1_WGMXCCGn1
    SolutionIndex: 11
    SolutionNameMin: Cijk_Alik_Bjlk_BBS_BH_UserArgs_MT256x256x32_MI16x16x1_SN_LDSB1_CLR1_GSU0_GSUC0_GSUWGMRR0_K1_LBSPPA512_LBSPPB2048_LPB32_MIWT8_8_PLR1_SU32_SUM0_SUS256_VWA8_VWB2_WGM4_WGMXCC1_WGMXCCGn1
    SolutionIndex: 12
    SolutionNameMin: Cijk_Alik_Bjlk_BBS_BH_UserArgs_MT256x256x32_MI16x16x1_SN_LDSB1_CLR1_GSU0_GSUC0_GSUWGMRR0_K1_LBSPPA128_LBSPPB2048_LPB0_MIWT8_8_PLR1_SU32_SUM0_SUS256_VWA1_VWB4_WGM4_WGMXCC1_WGMXCCGn1
    SolutionIndex: 13
    SolutionNameMin: Cijk_Alik_Bjlk_BBS_BH_UserArgs_MT256x256x32_MI16x16x1_SN_LDSB1_CLR1_GSU0_GSUC0_GSUWGMRR0_K1_LBSPPA128_LBSPPB2048_LPB0_MIWT8_8_PLR1_SU32_SUM0_SUS256_VWA2_VWB4_WGM4_WGMXCC1_WGMXCCGn1
    SolutionIndex: 14
    SolutionNameMin: Cijk_Alik_Bjlk_BBS_BH_UserArgs_MT256x256x32_MI16x16x1_SN_LDSB1_CLR1_GSU0_GSUC0_GSUWGMRR0_K1_LBSPPA256_LBSPPB2048_LPB0_MIWT8_8_PLR1_SU32_SUM0_SUS256_VWA4_VWB4_WGM4_WGMXCC1_WGMXCCGn1
    SolutionIndex: 15
    SolutionNameMin: Cijk_Alik_Bjlk_BBS_BH_UserArgs_MT256x256x32_MI16x16x1_SN_LDSB1_CLR1_GSU0_GSUC0_GSUWGMRR0_K1_LBSPPA512_LBSPPB2048_LPB0_MIWT8_8_PLR1_SU32_SUM0_SUS256_VWA8_VWB4_WGM4_WGMXCC1_WGMXCCGn1
    SolutionIndex: 16
    SolutionNameMin: Cijk_Alik_Bjlk_BBS_BH_UserArgs_MT256x256x32_MI16x16x1_SN_LDSB1_CLR1_GSU0_GSUC0_GSUWGMRR0_K1_LBSPPA128_LBSPPB2048_LPB0_MIWT8_8_PLR1_SU32_SUM0_SUS256_VWA1_VWB8_WGM4_WGMXCC1_WGMXCCGn1
    SolutionIndex: 17
    SolutionNameMin: Cijk_Alik_Bjlk_BBS_BH_UserArgs_MT256x256x32_MI16x16x1_SN_LDSB1_CLR1_GSU0_GSUC0_GSUWGMRR0_K1_LBSPPA256_LBSPPB2048_LPB0_MIWT8_8_PLR1_SU32_SUM0_SUS256_VWA4_VWB8_WGM4_WGMXCC1_WGMXCCGn1
    SolutionIndex: 18
    SolutionNameMin: Cijk_Alik_Bjlk_BBS_BH_UserArgs_MT256x256x32_MI16x16x1_SN_LDSB1_CLR1_GSU0_GSUC0_GSUWGMRR0_K1_LBSPPA512_LBSPPB2048_LPB0_MIWT8_8_PLR1_SU32_SUM0_SUS256_VWA8_VWB8_WGM4_WGMXCC1_WGMXCCGn1
    SolutionIndex: 19
    SolutionNameMin: Cijk_Alik_Bjlk_BBS_BH_UserArgs_MT256x256x32_MI16x16x1_SN_LDSB1_CLR1_GSU0_GSUC0_GSUWGMRR0_K1_LBSPPA256_LBSPPB2048_LPB32_MIWT8_8_PLR1_SU32_SUM0_SUS256_VWA4_VWB2_WGM8_WGMXCC1_WGMXCCGn1
    SolutionIndex: 20
    SolutionNameMin: Cijk_Alik_Bjlk_BBS_BH_UserArgs_MT256x256x32_MI16x16x1_SN_LDSB1_CLR1_GSU0_GSUC0_GSUWGMRR0_K1_LBSPPA512_LBSPPB2048_LPB32_MIWT8_8_PLR1_SU32_SUM0_SUS256_VWA8_VWB2_WGM8_WGMXCC1_WGMXCCGn1
    SolutionIndex: 21
    SolutionNameMin: Cijk_Alik_Bjlk_BBS_BH_UserArgs_MT256x256x32_MI16x16x1_SN_LDSB1_CLR1_GSU0_GSUC0_GSUWGMRR0_K1_LBSPPA128_LBSPPB2048_LPB0_MIWT8_8_PLR1_SU32_SUM0_SUS256_VWA2_VWB4_WGM8_WGMXCC1_WGMXCCGn1
    SolutionIndex: 22
    SolutionNameMin: Cijk_Alik_Bjlk_BBS_BH_UserArgs_MT256x256x32_MI16x16x1_SN_LDSB1_CLR1_GSU0_GSUC0_GSUWGMRR0_K1_LBSPPA256_LBSPPB2048_LPB0_MIWT8_8_PLR1_SU32_SUM0_SUS256_VWA4_VWB4_WGM8_WGMXCC1_WGMXCCGn1
    SolutionIndex: 23
    SolutionNameMin: Cijk_Alik_Bjlk_BBS_BH_UserArgs_MT256x256x32_MI16x16x1_SN_LDSB1_CLR1_GSU0_GSUC0_GSUWGMRR0_K1_LBSPPA512_LBSPPB2048_LPB0_MIWT8_8_PLR1_SU32_SUM0_SUS256_VWA8_VWB4_WGM8_WGMXCC1_WGMXCCGn1
    SolutionIndex: 24
    SolutionNameMin: Cijk_Alik_Bjlk_BBS_BH_UserArgs_MT256x256x32_MI16x16x1_SN_LDSB1_CLR1_GSU0_GSUC0_GSUWGMRR0_K1_LBSPPA256_LBSPPB2048_LPB0_MIWT8_8_PLR1_SU32_SUM0_SUS256_VWA4_VWB8_WGM8_WGMXCC1_WGMXCCGn1
    SolutionIndex: 25
    SolutionNameMin: Cijk_Alik_Bjlk_BBS_BH_UserArgs_MT256x256x32_MI16x16x1_SN_LDSB1_CLR1_GSU0_GSUC0_GSUWGMRR0_K1_LBSPPA512_LBSPPB2048_LPB0_MIWT8_8_PLR1_SU32_SUM0_SUS256_VWA8_VWB8_WGM8_WGMXCC1_WGMXCCGn1
    SolutionIndex: 26
    SolutionNameMin: Cijk_Alik_Bjlk_BBS_BH_UserArgs_MT128x256x32_MI16x16x1_SN_LDSB1_CLR1_GSU0_GSUC0_GSUWGMRR0_K1_LBSPPA256_LBSPPB2048_LPB32_MIWT4_8_PLR1_SU32_SUM0_SUS256_VWA4_VWB2_WGM1_WGMXCC1_WGMXCCGn1
    SolutionIndex: 27
    SolutionNameMin: Cijk_Alik_Bjlk_BBS_BH_UserArgs_MT128x256x32_MI16x16x1_SN_LDSB1_CLR1_GSU0_GSUC0_GSUWGMRR0_K1_LBSPPA256_LBSPPB2048_LPB0_MIWT4_8_PLR1_SU32_SUM0_SUS256_VWA4_VWB4_WGM1_WGMXCC1_WGMXCCGn1
    SolutionIndex: 28
    SolutionNameMin: Cijk_Alik_Bjlk_BBS_BH_UserArgs_MT128x256x32_MI16x16x1_SN_LDSB1_CLR1_GSU0_GSUC0_GSUWGMRR0_K1_LBSPPA256_LBSPPB2048_LPB0_MIWT4_8_PLR1_SU32_SUM0_SUS256_VWA4_VWB8_WGM1_WGMXCC1_WGMXCCGn1
    SolutionIndex: 29
    SolutionNameMin: Cijk_Alik_Bjlk_BBS_BH_UserArgs_MT128x256x32_MI16x16x1_SN_LDSB1_CLR1_GSU0_GSUC0_GSUWGMRR0_K1_LBSPPA256_LBSPPB2048_LPB32_MIWT4_8_PLR1_SU32_SUM0_SUS256_VWA4_VWB2_WGM4_WGMXCC1_WGMXCCGn1
    SolutionIndex: 30
    SolutionNameMin: Cijk_Alik_Bjlk_BBS_BH_UserArgs_MT128x256x32_MI16x16x1_SN_LDSB1_CLR1_GSU0_GSUC0_GSUWGMRR0_K1_LBSPPA256_LBSPPB2048_LPB0_MIWT4_8_PLR1_SU32_SUM0_SUS256_VWA4_VWB4_WGM4_WGMXCC1_WGMXCCGn1
    SolutionIndex: 31
    SolutionNameMin: Cijk_Alik_Bjlk_BBS_BH_UserArgs_MT128x256x32_MI16x16x1_SN_LDSB1_CLR1_GSU0_GSUC0_GSUWGMRR0_K1_LBSPPA128_LBSPPB2048_LPB0_MIWT4_8_PLR1_SU32_SUM0_SUS256_VWA2_VWB8_WGM4_WGMXCC1_WGMXCCGn1
    SolutionIndex: 32
    SolutionNameMin: Cijk_Alik_Bjlk_BBS_BH_UserArgs_MT128x256x32_MI16x16x1_SN_LDSB1_CLR1_GSU0_GSUC0_GSUWGMRR0_K1_LBSPPA128_LBSPPB2048_LPB0_MIWT4_8_PLR1_SU32_SUM0_SUS256_VWA1_VWB4_WGM8_WGMXCC1_WGMXCCGn1
    SolutionIndex: 33
    SolutionNameMin: Cijk_Alik_Bjlk_BBS_BH_UserArgs_MT128x256x32_MI16x16x1_SN_LDSB1_CLR1_GSU0_GSUC0_GSUWGMRR0_K1_LBSPPA256_LBSPPB2048_LPB0_MIWT4_8_PLR1_SU32_SUM0_SUS256_VWA4_VWB4_WGM8_WGMXCC1_WGMXCCGn1
    SolutionIndex: 34
    SolutionNameMin: Cijk_Alik_Bjlk_BBS_BH_UserArgs_MT128x256x32_MI16x16x1_SN_LDSB1_CLR1_GSU0_GSUC0_GSUWGMRR0_K1_LBSPPA128_LBSPPB2048_LPB0_MIWT4_8_PLR1_SU32_SUM0_SUS256_VWA2_VWB8_WGM8_WGMXCC1_WGMXCCGn1
    SolutionIndex: 35
    SolutionNameMin: Cijk_Alik_Bjlk_BBS_BH_UserArgs_MT256x128x32_MI16x16x1_SN_LDSB1_CLR1_GSU0_GSUC0_GSUWGMRR0_K1_LBSPPA512_LBSPPB1024_LPB16_MIWT8_4_PLR1_SU32_SUM0_SUS256_VWA8_VWB1_WGM1_WGMXCC1_WGMXCCGn1
    SolutionIndex: 36
    SolutionNameMin: Cijk_Alik_Bjlk_BBS_BH_UserArgs_MT256x128x32_MI16x16x1_SN_LDSB1_CLR1_GSU0_GSUC0_GSUWGMRR0_K1_LBSPPA256_LBSPPB1024_LPB32_MIWT8_4_PLR1_SU32_SUM0_SUS256_VWA4_VWB2_WGM1_WGMXCC1_WGMXCCGn1
    SolutionIndex: 37
    SolutionNameMin: Cijk_Alik_Bjlk_BBS_BH_UserArgs_MT256x128x32_MI16x16x1_SN_LDSB1_CLR1_GSU0_GSUC0_GSUWGMRR0_K1_LBSPPA512_LBSPPB1024_LPB32_MIWT8_4_PLR1_SU32_SUM0_SUS256_VWA8_VWB2_WGM1_WGMXCC1_WGMXCCGn1
    SolutionIndex: 38
    SolutionNameMin: Cijk_Alik_Bjlk_BBS_BH_UserArgs_MT256x128x32_MI16x16x1_SN_LDSB1_CLR1_GSU0_GSUC0_GSUWGMRR0_K1_LBSPPA512_LBSPPB1024_LPB0_MIWT8_4_PLR1_SU32_SUM0_SUS256_VWA8_VWB4_WGM1_WGMXCC1_WGMXCCGn1
    SolutionIndex: 39
    SolutionNameMin: Cijk_Alik_Bjlk_BBS_BH_UserArgs_MT256x128x32_MI16x16x1_SN_LDSB1_CLR1_GSU0_GSUC0_GSUWGMRR0_K1_LBSPPA512_LBSPPB1024_LPB16_MIWT8_4_PLR1_SU32_SUM0_SUS256_VWA8_VWB1_WGM4_WGMXCC1_WGMXCCGn1
    SolutionIndex: 40
    SolutionNameMin: Cijk_Alik_Bjlk_BBS_BH_UserArgs_MT256x128x32_MI16x16x1_SN_LDSB1_CLR1_GSU0_GSUC0_GSUWGMRR0_K1_LBSPPA512_LBSPPB1024_LPB32_MIWT8_4_PLR1_SU32_SUM0_SUS256_VWA8_VWB2_WGM4_WGMXCC1_WGMXCCGn1
    SolutionIndex: 41
    SolutionNameMin: Cijk_Alik_Bjlk_BBS_BH_UserArgs_MT256x128x32_MI16x16x1_SN_LDSB1_CLR1_GSU0_GSUC0_GSUWGMRR0_K1_LBSPPA512_LBSPPB1024_LPB0_MIWT8_4_PLR1_SU32_SUM0_SUS256_VWA8_VWB4_WGM4_WGMXCC1_WGMXCCGn1
    SolutionIndex: 42
    SolutionNameMin: Cijk_Alik_Bjlk_BBS_BH_UserArgs_MT256x128x32_MI16x16x1_SN_LDSB1_CLR1_GSU0_GSUC0_GSUWGMRR0_K1_LBSPPA512_LBSPPB1024_LPB32_MIWT8_4_PLR1_SU32_SUM0_SUS256_VWA8_VWB2_WGM8_WGMXCC1_WGMXCCGn1
    SolutionIndex: 43
    SolutionNameMin: Cijk_Alik_Bjlk_BBS_BH_UserArgs_MT128x128x32_MI16x16x1_SN_LDSB1_CLR1_GSU0_GSUC0_GSUWGMRR0_K1_LBSPPA128_LBSPPB1024_LPB16_MIWT4_4_PLR1_SU32_SUM0_SUS256_VWA2_VWB1_WGM1_WGMXCC1_WGMXCCGn1
    SolutionIndex: 44
    SolutionNameMin: Cijk_Alik_Bjlk_BBS_BH_UserArgs_MT128x128x32_MI16x16x1_SN_LDSB1_CLR1_GSU0_GSUC0_GSUWGMRR0_K1_LBSPPA128_LBSPPB1024_LPB32_MIWT4_4_PLR1_SU32_SUM0_SUS256_VWA2_VWB2_WGM4_WGMXCC1_WGMXCCGn1
    SolutionIndex: 45
    SolutionNameMin: Cijk_Alik_Bjlk_BBS_BH_UserArgs_MT64x128x32_MI16x16x1_SN_LDSB0_CLR1_GSU0_GSUC0_GSUWGMRR0_K1_LBSPPA128_LBSPPB1024_LPB32_MIWT2_4_PLR1_SU32_SUM0_SUS256_VWA2_VWB2_WGM1_WGMXCC1_WGMXCCGn1
    SolutionIndex: 46
    SolutionNameMin: Cijk_Alik_Bjlk_BBS_BH_UserArgs_MT128x64x32_MI16x16x1_SN_LDSB0_CLR1_GSU0_GSUC0_GSUWGMRR0_K1_LBSPPA256_LBSPPB512_LPB16_MIWT4_2_PLR1_SU32_SUM0_SUS256_VWA4_VWB1_WGM1_WGMXCC1_WGMXCCGn1
    SolutionIndex: 47
    SolutionNameMin: Cijk_Alik_Bjlk_BBS_BH_UserArgs_MT64x64x32_MI16x16x1_SN_LDSB0_CLR0_GSU0_GSUC0_GSUWGMRR0_K1_LBSPPA128_LBSPPB512_LPB32_MIWT2_2_PLR0_SU32_SUM0_SUS256_VWA2_VWB2_WGM1_WGMXCC1_WGMXCCGn1
    SolutionIndex: 48
    SolutionNameMin: Cijk_Alik_Bjlk_BBS_BH_UserArgs_MT64x64x32_MI16x16x1_SN_LDSB0_CLR1_GSU0_GSUC0_GSUWGMRR0_K1_LBSPPA128_LBSPPB512_LPB32_MIWT2_2_PLR1_SU32_SUM0_SUS256_VWA2_VWB2_WGM8_WGMXCC1_WGMXCCGn1
    SolutionIndex: 49
    SolutionNameMin: Cijk_Alik_Bjlk_BBS_BH_UserArgs_MT64x32x32_MI16x16x1_SN_LDSB0_CLR1_GSU0_GSUC0_GSUWGMRR0_K1_LBSPPA128_LBSPPB256_LPB16_MIWT2_1_PLR1_SU32_SUM0_SUS256_VWA1_VWB1_WGM8_WGMXCC1_WGMXCCGn1
    SolutionIndex: 50
    SolutionNameMin: Cijk_Alik_Bjlk_BBS_BH_UserArgs_MT32x32x32_MI16x16x1_SN_LDSB0_CLR1_GSU0_GSUC0_GSUWGMRR0_K1_LBSPPA128_LBSPPB256_LPB16_MIWT1_1_PLR1_SU32_SUM0_SUS256_VWA1_VWB1_WGM8_WGMXCC1_WGMXCCGn1
    SolutionIndex: 51
    SolutionNameMin: Cijk_Alik_Bjlk_BBS_BH_UserArgs_MT128x256x64_MI16x16x1_SN_LDSB1_CLR1_GSU0_GSUC0_GSUWGMRR0_K1_LBSPPA256_LBSPPB4096_LPB0_MIWT4_8_PLR1_SU32_SUM0_SUS256_VWA2_VWB4_WGM1_WGMXCC1_WGMXCCGn1
    SolutionIndex: 52
    SolutionNameMin: Cijk_Alik_Bjlk_BBS_BH_UserArgs_MT128x256x64_MI16x16x1_SN_LDSB1_CLR1_GSU0_GSUC0_GSUWGMRR0_K1_LBSPPA512_LBSPPB4096_LPB0_MIWT4_8_PLR1_SU32_SUM0_SUS256_VWA4_VWB4_WGM1_WGMXCC1_WGMXCCGn1
    SolutionIndex: 53
    SolutionNameMin: Cijk_Alik_Bjlk_BBS_BH_UserArgs_MT128x256x64_MI16x16x1_SN_LDSB1_CLR1_GSU0_GSUC0_GSUWGMRR0_K1_LBSPPA256_LBSPPB4096_LPB0_MIWT4_8_PLR1_SU32_SUM0_SUS256_VWA2_VWB4_WGM4_WGMXCC1_WGMXCCGn1
    SolutionIndex: 54
    SolutionNameMin: Cijk_Alik_Bjlk_BBS_BH_UserArgs_MT128x256x64_MI16x16x1_SN_LDSB1_CLR1_GSU0_GSUC0_GSUWGMRR0_K1_LBSPPA512_LBSPPB4096_LPB0_MIWT4_8_PLR1_SU32_SUM0_SUS256_VWA4_VWB4_WGM4_WGMXCC1_WGMXCCGn1
    SolutionIndex: 55
    SolutionNameMin: Cijk_Alik_Bjlk_BBS_BH_UserArgs_MT128x256x64_MI16x16x1_SN_LDSB1_CLR1_GSU0_GSUC0_GSUWGMRR0_K1_LBSPPA256_LBSPPB4096_LPB32_MIWT4_8_PLR1_SU32_SUM0_SUS256_VWA2_VWB2_WGM8_WGMXCC1_WGMXCCGn1
    SolutionIndex: 56
    SolutionNameMin: Cijk_Alik_Bjlk_BBS_BH_UserArgs_MT128x256x64_MI16x16x1_SN_LDSB1_CLR1_GSU0_GSUC0_GSUWGMRR0_K1_LBSPPA256_LBSPPB4096_LPB0_MIWT4_8_PLR1_SU32_SUM0_SUS256_VWA2_VWB4_WGM8_WGMXCC1_WGMXCCGn1
    SolutionIndex: 57
    SolutionNameMin: Cijk_Alik_Bjlk_BBS_BH_UserArgs_MT128x256x64_MI16x16x1_SN_LDSB1_CLR1_GSU0_GSUC0_GSUWGMRR0_K1_LBSPPA512_LBSPPB4096_LPB0_MIWT4_8_PLR1_SU32_SUM0_SUS256_VWA4_VWB4_WGM8_WGMXCC1_WGMXCCGn1
    SolutionIndex: 58
    SolutionNameMin: Cijk_Alik_Bjlk_BBS_BH_UserArgs_MT256x128x64_MI16x16x1_SN_LDSB1_CLR1_GSU0_GSUC0_GSUWGMRR0_K1_LBSPPA1024_LBSPPB2048_LPB32_MIWT8_4_PLR1_SU32_SUM0_SUS256_VWA8_VWB2_WGM1_WGMXCC1_WGMXCCGn1
    SolutionIndex: 59
    SolutionNameMin: Cijk_Alik_Bjlk_BBS_BH_UserArgs_MT256x128x64_MI16x16x1_SN_LDSB1_CLR1_GSU0_GSUC0_GSUWGMRR0_K1_LBSPPA256_LBSPPB2048_LPB0_MIWT8_4_PLR1_SU32_SUM0_SUS256_VWA2_VWB4_WGM1_WGMXCC1_WGMXCCGn1
    SolutionIndex: 60
    SolutionNameMin: Cijk_Alik_Bjlk_BBS_BH_UserArgs_MT256x128x64_MI16x16x1_SN_LDSB1_CLR1_GSU0_GSUC0_GSUWGMRR0_K1_LBSPPA512_LBSPPB2048_LPB0_MIWT8_4_PLR1_SU32_SUM0_SUS256_VWA4_VWB4_WGM1_WGMXCC1_WGMXCCGn1
    SolutionIndex: 61
    SolutionNameMin: Cijk_Alik_Bjlk_BBS_BH_UserArgs_MT256x128x64_MI16x16x1_SN_LDSB1_CLR1_GSU0_GSUC0_GSUWGMRR0_K1_LBSPPA1024_LBSPPB2048_LPB0_MIWT8_4_PLR1_SU32_SUM0_SUS256_VWA8_VWB4_WGM1_WGMXCC1_WGMXCCGn1
    SolutionIndex: 62
    SolutionNameMin: Cijk_Alik_Bjlk_BBS_BH_UserArgs_MT256x128x64_MI16x16x1_SN_LDSB1_CLR1_GSU0_GSUC0_GSUWGMRR0_K1_LBSPPA1024_LBSPPB2048_LPB16_MIWT8_4_PLR1_SU32_SUM0_SUS256_VWA8_VWB1_WGM4_WGMXCC1_WGMXCCGn1
    SolutionIndex: 63
    SolutionNameMin: Cijk_Alik_Bjlk_BBS_BH_UserArgs_MT256x128x64_MI16x16x1_SN_LDSB1_CLR1_GSU0_GSUC0_GSUWGMRR0_K1_LBSPPA1024_LBSPPB2048_LPB32_MIWT8_4_PLR1_SU32_SUM0_SUS256_VWA8_VWB2_WGM4_WGMXCC1_WGMXCCGn1
    SolutionIndex: 64
    SolutionNameMin: Cijk_Alik_Bjlk_BBS_BH_UserArgs_MT256x128x64_MI16x16x1_SN_LDSB1_CLR1_GSU0_GSUC0_GSUWGMRR0_K1_LBSPPA512_LBSPPB2048_LPB0_MIWT8_4_PLR1_SU32_SUM0_SUS256_VWA4_VWB4_WGM4_WGMXCC1_WGMXCCGn1
    SolutionIndex: 65
    SolutionNameMin: Cijk_Alik_Bjlk_BBS_BH_UserArgs_MT256x128x64_MI16x16x1_SN_LDSB1_CLR1_GSU0_GSUC0_GSUWGMRR0_K1_LBSPPA1024_LBSPPB2048_LPB0_MIWT8_4_PLR1_SU32_SUM0_SUS256_VWA8_VWB4_WGM4_WGMXCC1_WGMXCCGn1
    SolutionIndex: 66
    SolutionNameMin: Cijk_Alik_Bjlk_BBS_BH_UserArgs_MT256x128x64_MI16x16x1_SN_LDSB1_CLR1_GSU0_GSUC0_GSUWGMRR0_K1_LBSPPA1024_LBSPPB2048_LPB16_MIWT8_4_PLR1_SU32_SUM0_SUS256_VWA8_VWB1_WGM8_WGMXCC1_WGMXCCGn1
    SolutionIndex: 67
    SolutionNameMin: Cijk_Alik_Bjlk_BBS_BH_UserArgs_MT256x128x64_MI16x16x1_SN_LDSB1_CLR1_GSU0_GSUC0_GSUWGMRR0_K1_LBSPPA1024_LBSPPB2048_LPB32_MIWT8_4_PLR1_SU32_SUM0_SUS256_VWA8_VWB2_WGM8_WGMXCC1_WGMXCCGn1
    SolutionIndex: 68
    SolutionNameMin: Cijk_Alik_Bjlk_BBS_BH_UserArgs_MT256x128x64_MI16x16x1_SN_LDSB1_CLR1_GSU0_GSUC0_GSUWGMRR0_K1_LBSPPA512_LBSPPB2048_LPB0_MIWT8_4_PLR1_SU32_SUM0_SUS256_VWA4_VWB4_WGM8_WGMXCC1_WGMXCCGn1
    SolutionIndex: 69
    SolutionNameMin: Cijk_Alik_Bjlk_BBS_BH_UserArgs_MT256x128x64_MI16x16x1_SN_LDSB1_CLR1_GSU0_GSUC0_GSUWGMRR0_K1_LBSPPA1024_LBSPPB2048_LPB0_MIWT8_4_PLR1_SU32_SUM0_SUS256_VWA8_VWB4_WGM8_WGMXCC1_WGMXCCGn1
    SolutionIndex: 70
    SolutionNameMin: Cijk_Alik_Bjlk_BBS_BH_UserArgs_MT128x128x64_MI16x16x1_SN_LDSB1_CLR1_GSU0_GSUC0_GSUWGMRR0_K1_LBSPPA128_LBSPPB2048_LPB32_MIWT4_4_PLR1_SU32_SUM0_SUS256_VWA1_VWB2_WGM1_WGMXCC1_WGMXCCGn1
    SolutionIndex: 71
    SolutionNameMin: Cijk_Alik_Bjlk_BBS_BH_UserArgs_MT128x128x64_MI16x16x1_SN_LDSB1_CLR1_GSU0_GSUC0_GSUWGMRR0_K1_LBSPPA256_LBSPPB2048_LPB32_MIWT4_4_PLR1_SU32_SUM0_SUS256_VWA2_VWB2_WGM1_WGMXCC1_WGMXCCGn1
    SolutionIndex: 72
    SolutionNameMin: Cijk_Alik_Bjlk_BBS_BH_UserArgs_MT128x128x64_MI16x16x1_SN_LDSB1_CLR1_GSU0_GSUC0_GSUWGMRR0_K1_LBSPPA512_LBSPPB2048_LPB32_MIWT4_4_PLR1_SU32_SUM0_SUS256_VWA4_VWB2_WGM1_WGMXCC1_WGMXCCGn1
    SolutionIndex: 73
    SolutionNameMin: Cijk_Alik_Bjlk_BBS_BH_UserArgs_MT128x128x64_MI16x16x1_SN_LDSB1_CLR1_GSU0_GSUC0_GSUWGMRR0_K1_LBSPPA256_LBSPPB2048_LPB0_MIWT4_4_PLR1_SU32_SUM0_SUS256_VWA2_VWB4_WGM1_WGMXCC1_WGMXCCGn1
    SolutionIndex: 74
    SolutionNameMin: Cijk_Alik_Bjlk_BBS_BH_UserArgs_MT128x128x64_MI16x16x1_SN_LDSB1_CLR1_GSU0_GSUC0_GSUWGMRR0_K1_LBSPPA512_LBSPPB2048_LPB0_MIWT4_4_PLR1_SU32_SUM0_SUS256_VWA4_VWB4_WGM1_WGMXCC1_WGMXCCGn1
    SolutionIndex: 75
    SolutionNameMin: Cijk_Alik_Bjlk_BBS_BH_UserArgs_MT128x128x64_MI16x16x1_SN_LDSB1_CLR1_GSU0_GSUC0_GSUWGMRR0_K1_LBSPPA256_LBSPPB2048_LPB0_MIWT4_4_PLR2_SU32_SUM0_SUS256_VWA2_VWB4_WGM1_WGMXCC1_WGMXCCGn1
    SolutionIndex: 76
    SolutionNameMin: Cijk_Alik_Bjlk_BBS_BH_UserArgs_MT128x128x64_MI16x16x1_SN_LDSB1_CLR1_GSU0_GSUC0_GSUWGMRR0_K1_LBSPPA512_LBSPPB2048_LPB32_MIWT4_4_PLR1_SU32_SUM0_SUS256_VWA4_VWB2_WGM4_WGMXCC1_WGMXCCGn1
    SolutionIndex: 77
    SolutionNameMin: Cijk_Alik_Bjlk_BBS_BH_UserArgs_MT128x128x64_MI16x16x1_SN_LDSB1_CLR1_GSU0_GSUC0_GSUWGMRR0_K1_LBSPPA256_LBSPPB2048_LPB0_MIWT4_4_PLR1_SU32_SUM0_SUS256_VWA2_VWB4_WGM4_WGMXCC1_WGMXCCGn1
    SolutionIndex: 78
    SolutionNameMin: Cijk_Alik_Bjlk_BBS_BH_UserArgs_MT128x128x64_MI16x16x1_SN_LDSB1_CLR1_GSU0_GSUC0_GSUWGMRR0_K1_LBSPPA512_LBSPPB2048_LPB0_MIWT4_4_PLR1_SU32_SUM0_SUS256_VWA4_VWB4_WGM4_WGMXCC1_WGMXCCGn1
    SolutionIndex: 79
    SolutionNameMin: Cijk_Alik_Bjlk_BBS_BH_UserArgs_MT128x128x64_MI16x16x1_SN_LDSB1_CLR1_GSU0_GSUC0_GSUWGMRR0_K1_LBSPPA512_LBSPPB2048_LPB32_MIWT4_4_PLR1_SU32_SUM0_SUS256_VWA4_VWB2_WGM8_WGMXCC1_WGMXCCGn1
    SolutionIndex: 80
    SolutionNameMin: Cijk_Alik_Bjlk_BBS_BH_UserArgs_MT128x128x64_MI16x16x1_SN_LDSB1_CLR1_GSU0_GSUC0_GSUWGMRR0_K1_LBSPPA128_LBSPPB2048_LPB0_MIWT4_4_PLR1_SU32_SUM0_SUS256_VWA1_VWB4_WGM8_WGMXCC1_WGMXCCGn1
    SolutionIndex: 81
    SolutionNameMin: Cijk_Alik_Bjlk_BBS_BH_UserArgs_MT128x128x64_MI16x16x1_SN_LDSB1_CLR1_GSU0_GSUC0_GSUWGMRR0_K1_LBSPPA256_LBSPPB2048_LPB0_MIWT4_4_PLR1_SU32_SUM0_SUS256_VWA2_VWB4_WGM8_WGMXCC1_WGMXCCGn1
    SolutionIndex: 82
    SolutionNameMin: Cijk_Alik_Bjlk_BBS_BH_UserArgs_MT128x128x64_MI16x16x1_SN_LDSB1_CLR1_GSU0_GSUC0_GSUWGMRR0_K1_LBSPPA512_LBSPPB2048_LPB0_MIWT4_4_PLR1_SU32_SUM0_SUS256_VWA4_VWB4_WGM8_WGMXCC1_WGMXCCGn1
    SolutionIndex: 83
    SolutionNameMin: Cijk_Alik_Bjlk_BBS_BH_UserArgs_MT64x128x64_MI16x16x1_SN_LDSB1_CLR1_GSU0_GSUC0_GSUWGMRR0_K1_LBSPPA256_LBSPPB2048_LPB0_MIWT2_4_PLR1_SU32_SUM0_SUS256_VWA2_VWB4_WGM1_WGMXCC1_WGMXCCGn1
    SolutionIndex: 84
    SolutionNameMin: Cijk_Alik_Bjlk_BBS_BH_UserArgs_MT64x128x64_MI16x16x1_SN_LDSB1_CLR1_GSU0_GSUC0_GSUWGMRR0_K1_LBSPPA256_LBSPPB2048_LPB0_MIWT2_4_PLR1_SU32_SUM0_SUS256_VWA2_VWB4_WGM8_WGMXCC1_WGMXCCGn1
    SolutionIndex: 85
    SolutionNameMin: Cijk_Alik_Bjlk_BBS_BH_UserArgs_MT128x64x64_MI16x16x1_SN_LDSB1_CLR1_GSU0_GSUC0_GSUWGMRR0_K1_LBSPPA256_LBSPPB1024_LPB16_MIWT4_2_PLR1_SU32_SUM0_SUS256_VWA2_VWB1_WGM1_WGMXCC1_WGMXCCGn1
    SolutionIndex: 86
    SolutionNameMin: Cijk_Alik_Bjlk_BBS_BH_UserArgs_MT128x64x64_MI16x16x1_SN_LDSB1_CLR1_GSU0_GSUC0_GSUWGMRR0_K1_LBSPPA256_LBSPPB1024_LPB32_MIWT4_2_PLR1_SU32_SUM0_SUS256_VWA2_VWB2_WGM1_WGMXCC1_WGMXCCGn1
    SolutionIndex: 87
    SolutionNameMin: Cijk_Alik_Bjlk_BBS_BH_UserArgs_MT128x64x64_MI16x16x1_SN_LDSB1_CLR1_GSU0_GSUC0_GSUWGMRR0_K1_LBSPPA512_LBSPPB1024_LPB32_MIWT4_2_PLR1_SU32_SUM0_SUS256_VWA4_VWB2_WGM1_WGMXCC1_WGMXCCGn1
    SolutionIndex: 88
    SolutionNameMin: Cijk_Alik_Bjlk_BBS_BH_UserArgs_MT128x32x64_MI16x16x1_SN_LDSB1_CLR1_GSU0_GSUC0_GSUWGMRR0_K1_LBSPPA256_LBSPPB512_LPB16_MIWT4_1_PLR2_SU32_SUM0_SUS256_VWA2_VWB1_WGM1_WGMXCC1_WGMXCCGn1
    SolutionIndex: 89
    SolutionNameMin: Cijk_Alik_Bjlk_BBS_BH_UserArgs_MT64x64x64_MI16x16x1_SN_LDSB1_CLR1_GSU0_GSUC0_GSUWGMRR0_K1_LBSPPA128_LBSPPB1024_LPB32_MIWT2_2_PLR1_SU32_SUM0_SUS256_VWA1_VWB2_WGM1_WGMXCC1_WGMXCCGn1
    SolutionIndex: 90
    SolutionNameMin: Cijk_Alik_Bjlk_BBS_BH_UserArgs_MT64x64x64_MI16x16x1_SN_LDSB1_CLR1_GSU0_GSUC0_GSUWGMRR0_K1_LBSPPA256_LBSPPB1024_LPB32_MIWT2_2_PLR1_SU32_SUM0_SUS256_VWA2_VWB2_WGM1_WGMXCC1_WGMXCCGn1
    SolutionIndex: 91
    SolutionNameMin: Cijk_Alik_Bjlk_BBS_BH_UserArgs_MT64x64x64_MI16x16x1_SN_LDSB1_CLR1_GSU0_GSUC0_GSUWGMRR0_K1_LBSPPA128_LBSPPB1024_LPB32_MIWT2_2_PLR1_SU32_SUM0_SUS256_VWA1_VWB2_WGM4_WGMXCC1_WGMXCCGn1
    SolutionIndex: 92
    SolutionNameMin: Cijk_Alik_Bjlk_BBS_BH_UserArgs_MT64x64x64_MI16x16x1_SN_LDSB1_CLR1_GSU0_GSUC0_GSUWGMRR0_K1_LBSPPA256_LBSPPB1024_LPB32_MIWT2_2_PLR1_SU32_SUM0_SUS256_VWA2_VWB2_WGM8_WGMXCC1_WGMXCCGn1
    SolutionIndex: 93
    SolutionNameMin: Cijk_Alik_Bjlk_BBS_BH_UserArgs_MT32x64x64_MI16x16x1_SN_LDSB0_CLR1_GSU0_GSUC0_GSUWGMRR0_K1_LBSPPA128_LBSPPB1024_LPB32_MIWT1_2_PLR1_SU32_SUM0_SUS256_VWA1_VWB2_WGM1_WGMXCC1_WGMXCCGn1
    SolutionIndex: 94
    SolutionNameMin: Cijk_Alik_Bjlk_BBS_BH_UserArgs_MT32x64x64_MI16x16x1_SN_LDSB0_CLR1_GSU0_GSUC0_GSUWGMRR0_K1_LBSPPA128_LBSPPB1024_LPB32_MIWT1_2_PLR1_SU32_SUM0_SUS256_VWA1_VWB2_WGM8_WGMXCC1_WGMXCCGn1
    SolutionIndex: 95
    SolutionNameMin: Cijk_Alik_Bjlk_BBS_BH_UserArgs_MT64x32x64_MI16x16x1_SN_LDSB0_CLR1_GSU0_GSUC0_GSUWGMRR0_K1_LBSPPA256_LBSPPB512_LPB16_MIWT2_1_PLR1_SU32_SUM0_SUS256_VWA2_VWB1_WGM1_WGMXCC1_WGMXCCGn1
    SolutionIndex: 96
    SolutionNameMin: Cijk_Alik_Bjlk_BBS_BH_UserArgs_MT64x32x64_MI16x16x1_SN_LDSB0_CLR1_GSU0_GSUC0_GSUWGMRR0_K1_LBSPPA256_LBSPPB512_LPB16_MIWT2_1_PLR1_SU32_SUM0_SUS256_VWA2_VWB1_WGM4_WGMXCC1_WGMXCCGn1
    SolutionIndex: 97
    SolutionNameMin: Cijk_Alik_Bjlk_BBS_BH_UserArgs_MT64x32x64_MI16x16x1_SN_LDSB0_CLR1_GSU0_GSUC0_GSUWGMRR0_K1_LBSPPA256_LBSPPB512_LPB16_MIWT2_1_PLR1_SU32_SUM0_SUS256_VWA2_VWB1_WGM8_WGMXCC1_WGMXCCGn1
    SolutionIndex: 98
    SolutionNameMin: Cijk_Alik_Bjlk_BBS_BH_UserArgs_MT32x32x64_MI16x16x1_SN_LDSB0_CLR1_GSU0_GSUC0_GSUWGMRR0_K1_LBSPPA128_LBSPPB512_LPB16_MIWT1_1_PLR1_SU32_SUM0_SUS256_VWA1_VWB1_WGM1_WGMXCC1_WGMXCCGn1
    SolutionIndex: 99
    SolutionNameMin: Cijk_Alik_Bjlk_BBS_BH_UserArgs_MT32x32x64_MI16x16x1_SN_LDSB0_CLR1_GSU0_GSUC0_GSUWGMRR0_K1_LBSPPA128_LBSPPB512_LPB16_MIWT1_1_PLR1_SU32_SUM0_SUS256_VWA1_VWB1_WGM4_WGMXCC1_WGMXCCGn1
    SolutionIndex: 100
    SolutionNameMin: Cijk_Alik_Bjlk_BBS_BH_UserArgs_MT32x32x64_MI16x16x1_SN_LDSB0_CLR1_GSU0_GSUC0_GSUWGMRR0_K1_LBSPPA128_LBSPPB512_LPB16_MIWT1_1_PLR1_SU32_SUM0_SUS256_VWA1_VWB1_WGM8_WGMXCC1_WGMXCCGn1
    SolutionIndex: 101
    SolutionNameMin: Cijk_Alik_Bjlk_BBS_BH_UserArgs_MT64x128x128_MI16x16x1_SN_LDSB1_CLR1_GSU0_GSUC0_GSUWGMRR0_K1_LBSPPA512_LBSPPB2048_LPB0_MIWT2_4_PLR2_SU32_SUM0_SUS256_VWA2_VWB4_WGM1_WGMXCC1_WGMXCCGn1
    SolutionIndex: 102
    SolutionNameMin: Cijk_Alik_Bjlk_BBS_BH_UserArgs_MT64x128x128_MI16x16x1_SN_LDSB1_CLR1_GSU0_GSUC0_GSUWGMRR0_K1_LBSPPA256_LBSPPB2048_LPB0_MIWT2_4_PLR2_SU32_SUM0_SUS256_VWA1_VWB4_WGM4_WGMXCC1_WGMXCCGn1
    SolutionIndex: 103
    SolutionNameMin: Cijk_Alik_Bjlk_BBS_BH_UserArgs_MT64x128x128_MI16x16x1_SN_LDSB1_CLR1_GSU0_GSUC0_GSUWGMRR0_K1_LBSPPA512_LBSPPB2048_LPB0_MIWT2_4_PLR2_SU32_SUM0_SUS256_VWA2_VWB4_WGM4_WGMXCC1_WGMXCCGn1
    SolutionIndex: 104
    SolutionNameMin: Cijk_Alik_Bjlk_BBS_BH_UserArgs_MT64x128x128_MI16x16x1_SN_LDSB1_CLR1_GSU0_GSUC0_GSUWGMRR0_K1_LBSPPA512_LBSPPB2048_LPB0_MIWT2_4_PLR2_SU32_SUM0_SUS256_VWA2_VWB4_WGM8_WGMXCC1_WGMXCCGn1
    SolutionIndex: 105
    SolutionNameMin: Cijk_Alik_Bjlk_BBS_BH_UserArgs_MT128x64x128_MI16x16x1_SN_LDSB1_CLR1_GSU0_GSUC0_GSUWGMRR0_K1_LBSPPA512_LBSPPB1024_LPB32_MIWT4_2_PLR2_SU32_SUM0_SUS256_VWA2_VWB2_WGM1_WGMXCC1_WGMXCCGn1
    SolutionIndex: 106
    SolutionNameMin: Cijk_Alik_Bjlk_BBS_BH_UserArgs_MT128x64x128_MI16x16x1_SN_LDSB1_CLR1_GSU0_GSUC0_GSUWGMRR0_K1_LBSPPA1024_LBSPPB1024_LPB32_MIWT4_2_PLR2_SU32_SUM0_SUS256_VWA4_VWB2_WGM1_WGMXCC1_WGMXCCGn1
    SolutionIndex: 107
    SolutionNameMin: Cijk_Alik_Bjlk_BBS_BH_UserArgs_MT128x64x128_MI16x16x1_SN_LDSB1_CLR1_GSU0_GSUC0_GSUWGMRR0_K1_LBSPPA512_LBSPPB1024_LPB32_MIWT4_2_PLR2_SU32_SUM0_SUS256_VWA2_VWB2_WGM4_WGMXCC1_WGMXCCGn1
    SolutionIndex: 108
    SolutionNameMin: Cijk_Alik_Bjlk_BBS_BH_UserArgs_MT128x64x128_MI16x16x1_SN_LDSB1_CLR1_GSU0_GSUC0_GSUWGMRR0_K1_LBSPPA1024_LBSPPB1024_LPB32_MIWT4_2_PLR2_SU32_SUM0_SUS256_VWA4_VWB2_WGM4_WGMXCC1_WGMXCCGn1
    SolutionIndex: 109
    SolutionNameMin: Cijk_Alik_Bjlk_BBS_BH_UserArgs_MT128x64x128_MI16x16x1_SN_LDSB1_CLR1_GSU0_GSUC0_GSUWGMRR0_K1_LBSPPA256_LBSPPB1024_LPB32_MIWT4_2_PLR2_SU32_SUM0_SUS256_VWA1_VWB2_WGM8_WGMXCC1_WGMXCCGn1
    SolutionIndex: 110
    SolutionNameMin: Cijk_Alik_Bjlk_BBS_BH_UserArgs_MT128x64x128_MI16x16x1_SN_LDSB1_CLR1_GSU0_GSUC0_GSUWGMRR0_K1_LBSPPA1024_LBSPPB1024_LPB32_MIWT4_2_PLR2_SU32_SUM0_SUS256_VWA4_VWB2_WGM8_WGMXCC1_WGMXCCGn1
    SolutionIndex: 111
    SolutionNameMin: Cijk_Alik_Bjlk_BBS_BH_UserArgs_MT64x64x128_MI16x16x1_SN_LDSB1_CLR1_GSU0_GSUC0_GSUWGMRR0_K1_LBSPPA256_LBSPPB1024_LPB32_MIWT2_2_PLR2_SU32_SUM0_SUS256_VWA1_VWB2_WGM1_WGMXCC1_WGMXCCGn1
    SolutionIndex: 112
    SolutionNameMin: Cijk_Alik_Bjlk_BBS_BH_UserArgs_MT64x64x128_MI16x16x1_SN_LDSB1_CLR1_GSU0_GSUC0_GSUWGMRR0_K1_LBSPPA512_LBSPPB1024_LPB32_MIWT2_2_PLR2_SU32_SUM0_SUS256_VWA2_VWB2_WGM1_WGMXCC1_WGMXCCGn1
    SolutionIndex: 113
    SolutionNameMin: Cijk_Alik_Bjlk_BBS_BH_UserArgs_MT64x64x128_MI16x16x1_SN_LDSB1_CLR1_GSU0_GSUC0_GSUWGMRR0_K1_LBSPPA256_LBSPPB1024_LPB32_MIWT2_2_PLR2_SU32_SUM0_SUS256_VWA1_VWB2_WGM4_WGMXCC1_WGMXCCGn1
    SolutionIndex: 114
    SolutionNameMin: Cijk_Alik_Bjlk_BBS_BH_UserArgs_MT64x64x128_MI16x16x1_SN_LDSB1_CLR1_GSU0_GSUC0_GSUWGMRR0_K1_LBSPPA512_LBSPPB1024_LPB32_MIWT2_2_PLR2_SU32_SUM0_SUS256_VWA2_VWB2_WGM4_WGMXCC1_WGMXCCGn1
    SolutionIndex: 115
    SolutionNameMin: Cijk_Alik_Bjlk_BBS_BH_UserArgs_MT64x64x128_MI16x16x1_SN_LDSB1_CLR1_GSU0_GSUC0_GSUWGMRR0_K1_LBSPPA512_LBSPPB1024_LPB32_MIWT2_2_PLR2_SU32_SUM0_SUS256_VWA2_VWB2_WGM8_WGMXCC1_WGMXCCGn1
    SolutionIndex: 116
    SolutionNameMin: Cijk_Alik_Bjlk_BBS_BH_UserArgs_MT32x64x128_MI16x16x1_SN_LDSB1_CLR1_GSU0_GSUC0_GSUWGMRR0_K1_LBSPPA256_LBSPPB1024_LPB32_MIWT1_2_PLR2_SU32_SUM0_SUS256_VWA1_VWB2_WGM1_WGMXCC1_WGMXCCGn1
    SolutionIndex: 117
    SolutionNameMin: Cijk_Alik_Bjlk_BBS_BH_UserArgs_MT32x64x128_MI16x16x1_SN_LDSB1_CLR1_GSU0_GSUC0_GSUWGMRR0_K1_LBSPPA256_LBSPPB1024_LPB32_MIWT1_2_PLR2_SU32_SUM0_SUS256_VWA1_VWB2_WGM8_WGMXCC1_WGMXCCGn1
    SolutionIndex: 118
    SolutionNameMin: Cijk_Alik_Bjlk_BBS_BH_UserArgs_MT64x32x128_MI16x16x1_SN_LDSB1_CLR1_GSU0_GSUC0_GSUWGMRR0_K1_LBSPPA512_LBSPPB512_LPB16_MIWT2_1_PLR2_SU32_SUM0_SUS256_VWA2_VWB1_WGM1_WGMXCC1_WGMXCCGn1
    SolutionIndex: 119
    SolutionNameMin: Cijk_Alik_Bjlk_BBS_BH_UserArgs_MT32x32x128_MI16x16x1_SN_LDSB1_CLR1_GSU0_GSUC0_GSUWGMRR0_K1_LBSPPA256_LBSPPB512_LPB16_MIWT1_1_PLR1_SU32_SUM0_SUS256_VWA1_VWB1_WGM1_WGMXCC1_WGMXCCGn1
    SolutionIndex: 120
    SolutionNameMin: Cijk_Alik_Bjlk_BBS_BH_UserArgs_MT32x32x128_MI16x16x1_SN_LDSB1_CLR1_GSU0_GSUC0_GSUWGMRR0_K1_LBSPPA256_LBSPPB512_LPB16_MIWT1_1_PLR2_SU32_SUM0_SUS256_VWA1_VWB1_WGM1_WGMXCC1_WGMXCCGn1
    SolutionIndex: 121
    SolutionNameMin: Cijk_Alik_Bjlk_BBS_BH_UserArgs_MT32x32x128_MI16x16x1_SN_LDSB1_CLR1_GSU0_GSUC0_GSUWGMRR0_K1_LBSPPA256_LBSPPB512_LPB16_MIWT1_1_PLR1_SU32_SUM0_SUS256_VWA1_VWB1_WGM4_WGMXCC1_WGMXCCGn1
    SolutionIndex: 122
    SolutionNameMin: Cijk_Alik_Bjlk_BBS_BH_UserArgs_MT32x32x128_MI16x16x1_SN_LDSB1_CLR1_GSU0_GSUC0_GSUWGMRR0_K1_LBSPPA256_LBSPPB512_LPB16_MIWT1_1_PLR2_SU32_SUM0_SUS256_VWA1_VWB1_WGM4_WGMXCC1_WGMXCCGn1
    SolutionIndex: 123
    SolutionNameMin: Cijk_Alik_Bjlk_BBS_BH_UserArgs_MT32x32x32_MI16x16x1_SN_LDSB0_CLR0_GSU0_GSUC0_GSUWGMRR0_K1_LBSPPA128_LBSPPB256_LPB16_MIWT1_1_PLR0_SU32_SUM0_SUS256_VWA1_VWB1_WGM8_WGMXCC1_WGMXCCGn1
- - - [128, 128, 1, 128, 128, 128, 128, 128]
    - [119, 0.079]
  - - [128, 128, 1, 256, 128, 128, 256, 128]
    - [99, 0.147]
  - - [128, 128, 1, 512, 128, 128, 512, 128]
    - [121, 0.255]
  - - [128, 128, 1, 1024, 128, 128, 1024, 128]
    - [122, 0.377]
  - - [128, 128, 1, 2048, 128, 128, 2048, 128]
    - [120, 0.523]
  - - [128, 128, 1, 4096, 128, 128, 4096, 128]
    - [95, 0.844]
  - - [128, 128, 1, 8192, 128, 128, 8192, 128]
    - [116, 1.325]
  - - [128, 256, 1, 128, 128, 128, 128, 256]
    - [50, 0.166]
  - - [128, 256, 1, 256, 128, 128, 256, 256]
    - [119, 0.277]
  - - [128, 256, 1, 512, 128, 128, 512, 256]
    - [119, 0.484]
  - - [128, 256, 1, 1024, 128, 128, 1024, 256]
    - [119, 0.751]
  - - [128, 256, 1, 2048, 128, 128, 2048, 256]
    - [120, 1.001]
  - - [128, 256, 1, 4096, 128, 128, 4096, 256]
    - [117, 1.403]
  - - [128, 256, 1, 8192, 128, 128, 8192, 256]
    - [112, 2.102]
  - - [128, 512, 1, 128, 128, 128, 128, 512]
    - [97, 0.303]
  - - [128, 512, 1, 256, 128, 128, 256, 512]
    - [116, 0.553]
  - - [128, 512, 1, 512, 128, 128, 512, 512]
    - [93, 0.882]
  - - [128, 512, 1, 1024, 128, 128, 1024, 512]
    - [116, 1.343]
  - - [128, 512, 1, 2048, 128, 128, 2048, 512]
    - [116, 1.739]
  - - [128, 512, 1, 4096, 128, 128, 4096, 512]
    - [112, 2.198]
  - - [128, 512, 1, 8192, 128, 128, 8192, 512]
    - [107, 3.363]
  - - [128, 1024, 1, 128, 128, 128, 128, 1024]
    - [47, 0.553]
  - - [128, 1024, 1, 256, 128, 128, 256, 1024]
    - [91, 0.943]
  - - [128, 1024, 1, 512, 128, 128, 512, 1024]
    - [89, 1.53]
  - - [128, 1024, 1, 1024, 128, 128, 1024, 1024]
    - [112, 2.305]
  - - [128, 1024, 1, 2048, 128, 128, 2048, 1024]
    - [113, 2.652]
  - - [128, 1024, 1, 4096, 128, 128, 4096, 1024]
    - [104, 3.306]
  - - [128, 1024, 1, 8192, 128, 128, 8192, 1024]
    - [108, 4.346]
  - - [128, 2048, 1, 128, 128, 128, 128, 2048]
    - [46, 0.982]
  - - [128, 2048, 1, 256, 128, 128, 256, 2048]
    - [85, 1.558]
  - - [128, 2048, 1, 512, 128, 128, 512, 2048]
    - [83, 2.478]
  - - [128, 2048, 1, 1024, 128, 128, 1024, 2048]
    - [106, 3.188]
  - - [128, 2048, 1, 2048, 128, 128, 2048, 2048]
    - [108, 4.218]
  - - [128, 2048, 1, 4096, 128, 128, 4096, 2048]
    - [109, 5.041]
  - - [128, 2048, 1, 8192, 128, 128, 8192, 2048]
    - [74, 5.856]
  - - [128, 4096, 1, 128, 128, 128, 128, 4096]
    - [72, 1.568]
  - - [128, 4096, 1, 256, 128, 128, 256, 4096]
    - [74, 2.458]
  - - [128, 4096, 1, 512, 128, 128, 512, 4096]
    - [77, 3.407]
  - - [128, 4096, 1, 1024, 128, 128, 1024, 4096]
    - [73, 4.897]
  - - [128, 4096, 1, 2048, 128, 128, 2048, 4096]
    - [79, 5.507]
  - - [128, 4096, 1, 4096, 128, 128, 4096, 4096]
    - [77, 6.361]
  - - [128, 4096, 1, 8192, 128, 128, 8192, 4096]
    - [55, 6.493]
  - - [128, 8192, 1, 128, 128, 128, 128, 8192]
    - [30, 1.829]
  - - [128, 8192, 1, 256, 128, 128, 256, 8192]
    - [31, 3.019]
  - - [128, 8192, 1, 512, 128, 128, 512, 8192]
    - [31, 4.388]
  - - [128, 8192, 1, 1024, 128, 128, 1024, 8192]
    - [34, 5.545]
  - - [128, 8192, 1, 2048, 128, 128, 2048, 8192]
    - [55, 6.575]
  - - [128, 8192, 1, 4096, 128, 128, 4096, 8192]
    - [70, 6.386]
  - - [128, 8192, 1, 8192, 128, 128, 8192, 8192]
    - [75, 5.376]
  - - [256, 128, 1, 128, 256, 256, 128, 128]
    - [119, 0.16]
  - - [256, 128, 1, 256, 256, 256, 256, 128]
    - [100, 0.301]
  - - [256, 128, 1, 512, 256, 256, 512, 128]
    - [98, 0.507]
  - - [256, 128, 1, 1024, 256, 256, 1024, 128]
    - [119, 0.785]
  - - [256, 128, 1, 2048, 256, 256, 2048, 128]
    - [119, 1.015]
  - - [256, 128, 1, 4096, 256, 256, 4096, 128]
    - [90, 1.435]
  - - [256, 128, 1, 8192, 256, 256, 8192, 128]
    - [111, 2.162]
  - - [256, 256, 1, 128, 256, 256, 128, 256]
    - [49, 0.322]
  - - [256, 256, 1, 256, 256, 256, 256, 256]
    - [95, 0.563]
  - - [256, 256, 1, 512, 256, 256, 512, 256]
    - [94, 0.884]
  - - [256, 256, 1, 1024, 256, 256, 1024, 256]
    - [116, 1.343]
  - - [256, 256, 1, 2048, 256, 256, 2048, 256]
    - [116, 1.746]
  - - [256, 256, 1, 4096, 256, 256, 4096, 256]
    - [115, 2.287]
  - - [256, 256, 1, 8192, 256, 256, 8192, 256]
    - [106, 3.239]
  - - [256, 512, 1, 128, 256, 256, 128, 512]
    - [88, 0.561]
  - - [256, 512, 1, 256, 256, 256, 256, 512]
    - [112, 0.965]
  - - [256, 512, 1, 512, 256, 256, 512, 512]
    - [112, 1.553]
  - - [256, 512, 1, 1024, 256, 256, 1024, 512]
    - [115, 2.347]
  - - [256, 512, 1, 2048, 256, 256, 2048, 512]
    - [114, 2.933]
  - - [256, 512, 1, 4096, 256, 256, 4096, 512]
    - [108, 3.473]
  - - [256, 512, 1, 8192, 256, 256, 8192, 512]
    - [102, 4.299]
  - - [256, 1024, 1, 128, 256, 256, 128, 1024]
    - [45, 1.026]
  - - [256, 1024, 1, 256, 256, 256, 256, 1024]
    - [83, 1.647]
  - - [256, 1024, 1, 512, 256, 256, 512, 1024]
    - [101, 2.504]
  - - [256, 1024, 1, 1024, 256, 256, 1024, 1024]
    - [106, 3.537]
  - - [256, 1024, 1, 2048, 256, 256, 2048, 1024]
    - [105, 4.353]
  - - [256, 1024, 1, 4096, 256, 256, 4096, 1024]
    - [78, 4.676]
  - - [256, 1024, 1, 8192, 256, 256, 8192, 1024]
    - [76, 5.583]
  - - [256, 2048, 1, 128, 256, 256, 128, 2048]
    - [43, 1.496]
  - - [256, 2048, 1, 256, 256, 256, 256, 2048]
    - [74, 2.422]
  - - [256, 2048, 1, 512, 256, 256, 512, 2048]
    - [77, 3.439]
  - - [256, 2048, 1, 1024, 256, 256, 1024, 2048]
    - [80, 4.745]
  - - [256, 2048, 1, 2048, 256, 256, 2048, 2048]
    - [74, 5.948]
  - - [256, 2048, 1, 4096, 256, 256, 4096, 2048]
    - [78, 6.157]
  - - [256, 2048, 1, 8192, 256, 256, 8192, 2048]
    - [54, 7.088]
  - - [256, 4096, 1, 128, 256, 256, 128, 4096]
    - [30, 1.894]
  - - [256, 4096, 1, 256, 256, 256, 256, 4096]
    - [41, 3.133]
  - - [256, 4096, 1, 512, 256, 256, 512, 4096]
    - [38, 4.453]
  - - [256, 4096, 1, 1024, 256, 256, 1024, 4096]
    - [51, 5.661]
  - - [256, 4096, 1, 2048, 256, 256, 2048, 4096]
    - [58, 6.662]
  - - [256, 4096, 1, 4096, 256, 256, 4096, 4096]
    - [32, 6.887]
  - - [256, 4096, 1, 8192, 256, 256, 8192, 4096]
    - [5, 7.756]
  - - [256, 8192, 1, 128, 256, 256, 128, 8192]
    - [15, 2.401]
  - - [256, 8192, 1, 256, 256, 256, 256, 8192]
    - [6, 3.813]
  - - [256, 8192, 1, 512, 256, 256, 512, 8192]
    - [6, 5.278]
  - - [256, 8192, 1, 1024, 256, 256, 1024, 8192]
    - [8, 6.572]
  - - [256, 8192, 1, 2048, 256, 256, 2048, 8192]
    - [27, 6.992]
  - - [256, 8192, 1, 4096, 256, 256, 4096, 8192]
    - [10, 8.243]
  - - [256, 8192, 1, 8192, 256, 256, 8192, 8192]
    - [7, 9.082]
  - - [512, 128, 1, 128, 512, 512, 128, 128]
    - [93, 0.34]
  - - [512, 128, 1, 256, 512, 512, 256, 128]
    - [116, 0.57]
  - - [512, 128, 1, 512, 512, 512, 512, 128]
    - [96, 0.914]
  - - [512, 128, 1, 1024, 512, 512, 1024, 128]
    - [118, 1.398]
  - - [512, 128, 1, 2048, 512, 512, 2048, 128]
    - [116, 1.817]
  - - [512, 128, 1, 4096, 512, 512, 4096, 128]
    - [114, 2.392]
  - - [512, 128, 1, 8192, 512, 512, 8192, 128]
    - [108, 3.399]
  - - [512, 256, 1, 128, 512, 512, 128, 256]
    - [92, 0.594]
  - - [512, 256, 1, 256, 512, 512, 256, 256]
    - [112, 1.025]
  - - [512, 256, 1, 512, 512, 512, 512, 256]
    - [114, 1.63]
  - - [512, 256, 1, 1024, 512, 512, 1024, 256]
    - [112, 2.399]
  - - [512, 256, 1, 2048, 512, 512, 2048, 256]
    - [112, 2.957]
  - - [512, 256, 1, 4096, 512, 512, 4096, 256]
    - [108, 3.593]
  - - [512, 256, 1, 8192, 512, 512, 8192, 256]
    - [78, 4.563]
  - - [512, 512, 1, 128, 512, 512, 128, 512]
    - [87, 1.026]
  - - [512, 512, 1, 256, 512, 512, 256, 512]
    - [86, 1.696]
  - - [512, 512, 1, 512, 512, 512, 512, 512]
    - [86, 2.553]
  - - [512, 512, 1, 1024, 512, 512, 1024, 512]
    - [101, 3.603]
  - - [512, 512, 1, 2048, 512, 512, 2048, 512]
    - [106, 4.149]
  - - [512, 512, 1, 4096, 512, 512, 4096, 512]
    - [74, 4.898]
  - - [512, 512, 1, 8192, 512, 512, 8192, 512]
    - [80, 5.753]
  - - [512, 1024, 1, 128, 512, 512, 128, 1024]
    - [44, 1.515]
  - - [512, 1024, 1, 256, 512, 512, 256, 1024]
    - [74, 2.617]
  - - [512, 1024, 1, 512, 512, 512, 512, 1024]
    - [74, 3.877]
  - - [512, 1024, 1, 1024, 512, 512, 1024, 1024]
    - [78, 4.904]
  - - [512, 1024, 1, 2048, 512, 512, 2048, 1024]
    - [74, 5.614]
  - - [512, 1024, 1, 4096, 512, 512, 4096, 1024]
    - [80, 6.012]
  - - [512, 1024, 1, 8192, 512, 512, 8192, 1024]
    - [30, 7.079]
  - - [512, 2048, 1, 128, 512, 512, 128, 2048]
    - [35, 1.904]
  - - [512, 2048, 1, 256, 512, 512, 256, 2048]
    - [28, 3.074]
  - - [512, 2048, 1, 512, 512, 512, 512, 2048]
    - [62, 4.358]
  - - [512, 2048, 1, 1024, 512, 512, 1024, 2048]
    - [61, 5.675]
  - - [512, 2048, 1, 2048, 512, 512, 2048, 2048]
    - [69, 6.67]
  - - [512, 2048, 1, 4096, 512, 512, 4096, 2048]
    - [68, 7.061]
  - - [512, 2048, 1, 8192, 512, 512, 8192, 2048]
    - [1, 7.901]
  - - [512, 4096, 1, 128, 512, 512, 128, 4096]
    - [2, 2.47]
  - - [512, 4096, 1, 256, 512, 512, 256, 4096]
    - [23, 3.83]
  - - [512, 4096, 1, 512, 512, 512, 512, 4096]
    - [6, 5.392]
  - - [512, 4096, 1, 1024, 512, 512, 1024, 4096]
    - [0, 6.59]
  - - [512, 4096, 1, 2048, 512, 512, 2048, 4096]
    - [64, 6.873]
  - - [512, 4096, 1, 4096, 512, 512, 4096, 4096]
    - [5, 8.215]
  - - [512, 4096, 1, 8192, 512, 512, 8192, 4096]
    - [21, 9.069]
  - - [512, 8192, 1, 128, 512, 512, 128, 8192]
    - [38, 2.201]
  - - [512, 8192, 1, 256, 512, 512, 256, 8192]
    - [61, 3.42]
  - - [512, 8192, 1, 512, 512, 512, 512, 8192]
    - [7, 4.913]
  - - [512, 8192, 1, 1024, 512, 512, 1024, 8192]
    - [7, 6.637]
  - - [512, 8192, 1, 2048, 512, 512, 2048, 8192]
    - [15, 7.872]
  - - [512, 8192, 1, 4096, 512, 512, 4096, 8192]
    - [17, 8.648]
  - - [512, 8192, 1, 8192, 512, 512, 8192, 8192]
    - [7, 9.421]
  - - [1024, 128, 1, 128, 1024, 1024, 128, 128]
    - [48, 0.593]
  - - [1024, 128, 1, 256, 1024, 1024, 256, 128]
    - [111, 1.015]
  - - [1024, 128, 1, 512, 1024, 1024, 512, 128]
    - [111, 1.582]
  - - [1024, 128, 1, 1024, 1024, 1024, 1024, 128]
    - [114, 2.295]
  - - [1024, 128, 1, 2048, 1024, 1024, 2048, 128]
    - [112, 2.804]
  - - [1024, 128, 1, 4096, 1024, 1024, 4096, 128]
    - [110, 3.526]
  - - [1024, 128, 1, 8192, 1024, 1024, 8192, 128]
    - [82, 4.562]
  - - [1024, 256, 1, 128, 1024, 1024, 128, 256]
    - [87, 1.038]
  - - [1024, 256, 1, 256, 1024, 1024, 256, 256]
    - [83, 1.709]
  - - [1024, 256, 1, 512, 1024, 1024, 512, 256]
    - [83, 2.62]
  - - [1024, 256, 1, 1024, 1024, 1024, 1024, 256]
    - [108, 3.564]
  - - [1024, 256, 1, 2048, 1024, 1024, 2048, 256]
    - [103, 3.995]
  - - [1024, 256, 1, 4096, 1024, 1024, 4096, 256]
    - [74, 4.97]
  - - [1024, 256, 1, 8192, 1024, 1024, 8192, 256]
    - [74, 6.219]
  - - [1024, 512, 1, 128, 1024, 1024, 128, 512]
    - [71, 1.52]
  - - [1024, 512, 1, 256, 1024, 1024, 256, 512]
    - [73, 2.648]
  - - [1024, 512, 1, 512, 1024, 1024, 512, 512]
    - [74, 3.881]
  - - [1024, 512, 1, 1024, 1024, 1024, 1024, 512]
    - [81, 4.654]
  - - [1024, 512, 1, 2048, 1024, 1024, 2048, 512]
    - [74, 5.64]
  - - [1024, 512, 1, 4096, 1024, 1024, 4096, 512]
    - [78, 6.17]
  - - [1024, 512, 1, 8192, 1024, 1024, 8192, 512]
    - [68, 7.081]
  - - [1024, 1024, 1, 128, 1024, 1024, 128, 1024]
    - [27, 1.981]
  - - [1024, 1024, 1, 256, 1024, 1024, 256, 1024]
    - [26, 3.152]
  - - [1024, 1024, 1, 512, 1024, 1024, 512, 1024]
    - [41, 4.497]
  - - [1024, 1024, 1, 1024, 1024, 1024, 1024, 1024]
    - [37, 5.677]
  - - [1024, 1024, 1, 2048, 1024, 1024, 2048, 1024]
    - [57, 6.64]
  - - [1024, 1024, 1, 4096, 1024, 1024, 4096, 1024]
    - [52, 7.439]
  - - [1024, 1024, 1, 8192, 1024, 1024, 8192, 1024]
    - [17, 8.18]
  - - [1024, 2048, 1, 128, 1024, 1024, 128, 2048]
    - [6, 2.446]
  - - [1024, 2048, 1, 256, 1024, 1024, 256, 2048]
    - [6, 3.798]
  - - [1024, 2048, 1, 512, 1024, 1024, 512, 2048]
    - [8, 5.393]
  - - [1024, 2048, 1, 1024, 1024, 1024, 1024, 2048]
    - [25, 6.659]
  - - [1024, 2048, 1, 2048, 1024, 1024, 2048, 2048]
    - [52, 6.947]
  - - [1024, 2048, 1, 4096, 1024, 1024, 4096, 2048]
    - [24, 8.122]
  - - [1024, 2048, 1, 8192, 1024, 1024, 8192, 2048]
    - [17, 9.128]
  - - [1024, 4096, 1, 128, 1024, 1024, 128, 4096]
    - [26, 2.238]
  - - [1024, 4096, 1, 256, 1024, 1024, 256, 4096]
    - [69, 3.349]
  - - [1024, 4096, 1, 512, 1024, 1024, 512, 4096]
    - [22, 4.957]
  - - [1024, 4096, 1, 1024, 1024, 1024, 1024, 4096]
    - [10, 6.492]
  - - [1024, 4096, 1, 2048, 1024, 1024, 2048, 4096]
    - [14, 7.782]
  - - [1024, 4096, 1, 4096, 1024, 1024, 4096, 4096]
    - [21, 8.716]
  - - [1024, 4096, 1, 8192, 1024, 1024, 8192, 4096]
    - [18, 9.021]
  - - [1024, 8192, 1, 128, 1024, 1024, 128, 8192]
    - [65, 2.589]
  - - [1024, 8192, 1, 256, 1024, 1024, 256, 8192]
    - [36, 3.824]
  - - [1024, 8192, 1, 512, 1024, 1024, 512, 8192]
    - [7, 5.545]
  - - [1024, 8192, 1, 1024, 1024, 1024, 1024, 8192]
    - [15, 7.16]
  - - [1024, 8192, 1, 2048, 1024, 1024, 2048, 8192]
    - [17, 8.321]
  - - [1024, 8192, 1, 4096, 1024, 1024, 4096, 8192]
    - [14, 9.012]
  - - [1024, 8192, 1, 8192, 1024, 1024, 8192, 8192]
    - [15, 9.179]
  - - [2048, 128, 1, 128, 2048, 2048, 128, 128]
    - [87, 1.04]
  - - [2048, 128, 1, 256, 2048, 2048, 256, 128]
    - [86, 1.754]
  - - [2048, 128, 1, 512, 2048, 2048, 512, 128]
    - [106, 2.596]
  - - [2048, 128, 1, 1024, 2048, 2048, 1024, 128]
    - [83, 3.289]
  - - [2048, 128, 1, 2048, 2048, 2048, 2048, 128]
    - [84, 3.97]
  - - [2048, 128, 1, 4096, 2048, 2048, 4096, 128]
    - [74, 4.893]
  - - [2048, 128, 1, 8192, 2048, 2048, 8192, 128]
    - [74, 6.249]
  - - [2048, 256, 1, 128, 2048, 2048, 128, 256]
    - [72, 1.61]
  - - [2048, 256, 1, 256, 2048, 2048, 256, 256]
    - [73, 2.61]
  - - [2048, 256, 1, 512, 2048, 2048, 512, 256]
    - [81, 3.546]
  - - [2048, 256, 1, 1024, 2048, 2048, 1024, 256]
    - [81, 4.577]
  - - [2048, 256, 1, 2048, 2048, 2048, 2048, 256]
    - [78, 5.576]
  - - [2048, 256, 1, 4096, 2048, 2048, 4096, 256]
    - [74, 6.431]
  - - [2048, 256, 1, 8192, 2048, 2048, 8192, 256]
    - [54, 7.237]
  - - [2048, 512, 1, 128, 2048, 2048, 128, 512]
    - [37, 2.1]
  - - [2048, 512, 1, 256, 2048, 2048, 256, 512]
    - [29, 3.152]
  - - [2048, 512, 1, 512, 2048, 2048, 512, 512]
    - [27, 4.429]
  - - [2048, 512, 1, 1024, 2048, 2048, 1024, 512]
    - [52, 5.677]
  - - [2048, 512, 1, 2048, 2048, 2048, 2048, 512]
    - [52, 6.657]
  - - [2048, 512, 1, 4096, 2048, 2048, 4096, 512]
    - [30, 7.311]
  - - [2048, 512, 1, 8192, 2048, 2048, 8192, 512]
    - [17, 8.216]
  - - [2048, 1024, 1, 128, 2048, 2048, 128, 1024]
    - [8, 2.458]
  - - [2048, 1024, 1, 256, 2048, 2048, 256, 1024]
    - [8, 3.88]
  - - [2048, 1024, 1, 512, 2048, 2048, 512, 1024]
    - [18, 5.305]
  - - [2048, 1024, 1, 1024, 2048, 2048, 1024, 1024]
    - [6, 6.509]
  - - [2048, 1024, 1, 2048, 2048, 2048, 2048, 1024]
    - [28, 6.891]
  - - [2048, 1024, 1, 4096, 2048, 2048, 4096, 1024]
    - [24, 8.135]
  - - [2048, 1024, 1, 8192, 2048, 2048, 8192, 1024]
    - [5, 9.215]
  - - [2048, 2048, 1, 128, 2048, 2048, 128, 2048]
    - [27, 2.217]
  - - [2048, 2048, 1, 256, 2048, 2048, 256, 2048]
    - [59, 3.307]
  - - [2048, 2048, 1, 512, 2048, 2048, 512, 2048]
    - [17, 4.87]
  - - [2048, 2048, 1, 1024, 2048, 2048, 1024, 2048]
    - [17, 6.419]
  - - [2048, 2048, 1, 2048, 2048, 2048, 2048, 2048]
    - [24, 7.721]
  - - [2048, 2048, 1, 4096, 2048, 2048, 4096, 2048]
    - [13, 8.616]
  - - [2048, 2048, 1, 8192, 2048, 2048, 8192, 2048]
    - [3, 9.309]
  - - [2048, 4096, 1, 128, 2048, 2048, 128, 4096]
    - [61, 2.665]
  - - [2048, 4096, 1, 256, 2048, 2048, 256, 4096]
    - [30, 3.826]
  - - [2048, 4096, 1, 512, 2048, 2048, 512, 4096]
    - [5, 5.505]
  - - [2048, 4096, 1, 1024, 2048, 2048, 1024, 4096]
    - [22, 7.126]
  - - [2048, 4096, 1, 2048, 2048, 2048, 2048, 4096]
    - [21, 8.176]
  - - [2048, 4096, 1, 4096, 2048, 2048, 4096, 4096]
    - [14, 8.935]
  - - [2048, 4096, 1, 8192, 2048, 2048, 8192, 4096]
    - [3, 9.229]
  - - [2048, 8192, 1, 128, 2048, 2048, 128, 8192]
    - [38, 2.927]
  - - [2048, 8192, 1, 256, 2048, 2048, 256, 8192]
    - [7, 4.411]
  - - [2048, 8192, 1, 512, 2048, 2048, 512, 8192]
    - [5, 6.184]
  - - [2048, 8192, 1, 1024, 2048, 2048, 1024, 8192]
    - [6, 7.655]
  - - [2048, 8192, 1, 2048, 2048, 2048, 2048, 8192]
    - [23, 8.426]
  - - [2048, 8192, 1, 4096, 2048, 2048, 4096, 8192]
    - [23, 8.821]
  - - [2048, 8192, 1, 8192, 2048, 2048, 8192, 8192]
    - [18, 8.603]
  - - [4096, 128, 1, 128, 4096, 4096, 128, 128]
    - [73, 1.58]
  - - [4096, 128, 1, 256, 4096, 4096, 256, 128]
    - [72, 2.394]
  - - [4096, 128, 1, 512, 4096, 4096, 512, 128]
    - [78, 3.361]
  - - [4096, 128, 1, 1024, 4096, 4096, 1024, 128]
    - [73, 4.574]
  - - [4096, 128, 1, 2048, 4096, 4096, 2048, 128]
    - [73, 5.537]
  - - [4096, 128, 1, 4096, 4096, 4096, 4096, 128]
    - [77, 6.215]
  - - [4096, 128, 1, 8192, 4096, 4096, 8192, 128]
    - [82, 7.37]
  - - [4096, 256, 1, 128, 4096, 4096, 128, 256]
    - [42, 2.048]
  - - [4096, 256, 1, 256, 4096, 4096, 256, 256]
    - [42, 2.993]
  - - [4096, 256, 1, 512, 4096, 4096, 512, 256]
    - [33, 4.363]
  - - [4096, 256, 1, 1024, 4096, 4096, 1024, 256]
    - [57, 5.558]
  - - [4096, 256, 1, 2048, 4096, 4096, 2048, 256]
    - [53, 6.615]
  - - [4096, 256, 1, 4096, 4096, 4096, 4096, 256]
    - [56, 7.301]
  - - [4096, 256, 1, 8192, 4096, 4096, 8192, 256]
    - [51, 8.382]
  - - [4096, 512, 1, 128, 4096, 4096, 128, 512]
    - [18, 2.458]
  - - [4096, 512, 1, 256, 4096, 4096, 256, 512]
    - [8, 3.755]
  - - [4096, 512, 1, 512, 4096, 4096, 512, 512]
    - [8, 5.261]
  - - [4096, 512, 1, 1024, 4096, 4096, 1024, 512]
    - [15, 6.302]
  - - [4096, 512, 1, 2048, 4096, 4096, 2048, 512]
    - [54, 7.093]
  - - [4096, 512, 1, 4096, 4096, 4096, 4096, 512]
    - [22, 8.163]
  - - [4096, 512, 1, 8192, 4096, 4096, 8192, 512]
    - [14, 9.25]
  - - [4096, 1024, 1, 128, 4096, 4096, 128, 1024]
    - [36, 2.187]
  - - [4096, 1024, 1, 256, 4096, 4096, 256, 1024]
    - [67, 3.354]
  - - [4096, 1024, 1, 512, 4096, 4096, 512, 1024]
    - [1, 4.849]
  - - [4096, 1024, 1, 1024, 4096, 4096, 1024, 1024]
    - [22, 6.438]
  - - [4096, 1024, 1, 2048, 4096, 4096, 2048, 1024]
    - [5, 7.902]
  - - [4096, 1024, 1, 4096, 4096, 4096, 4096, 1024]
    - [22, 8.78]
  - - [4096, 1024, 1, 8192, 4096, 4096, 8192, 1024]
    - [7, 9.447]
  - - [4096, 2048, 1, 128, 4096, 4096, 128, 2048]
    - [58, 2.689]
  - - [4096, 2048, 1, 256, 4096, 4096, 256, 2048]
    - [33, 3.834]
  - - [4096, 2048, 1, 512, 4096, 4096, 512, 2048]
    - [22, 5.499]
  - - [4096, 2048, 1, 1024, 4096, 4096, 1024, 2048]
    - [21, 6.974]
  - - [4096, 2048, 1, 2048, 4096, 4096, 2048, 2048]
    - [20, 8.07]
  - - [4096, 2048, 1, 4096, 4096, 4096, 4096, 2048]
    - [13, 8.793]
  - - [4096, 2048, 1, 8192, 4096, 4096, 8192, 2048]
    - [14, 9.072]
  - - [4096, 4096, 1, 128, 4096, 4096, 128, 4096]
    - [37, 2.9]
  - - [4096, 4096, 1, 256, 4096, 4096, 256, 4096]
    - [9, 4.297]
  - - [4096, 4096, 1, 512, 4096, 4096, 512, 4096]
    - [20, 6.1]
  - - [4096, 4096, 1, 1024, 4096, 4096, 1024, 4096]
    - [25, 7.359]
  - - [4096, 4096, 1, 2048, 4096, 4096, 2048, 4096]
    - [22, 8.38]
  - - [4096, 4096, 1, 4096, 4096, 4096, 4096, 4096]
    - [4, 8.661]
  - - [4096, 4096, 1, 8192, 4096, 4096, 8192, 4096]
    - [12, 8.369]
  - - [4096, 8192, 1, 128, 4096, 4096, 128, 8192]
    - [23, 3.34]
  - - [4096, 8192, 1, 256, 4096, 4096, 256, 8192]
    - [6, 4.845]
  - - [4096, 8192, 1, 512, 4096, 4096, 512, 8192]
    - [15, 6.466]
  - - [4096, 8192, 1, 1024, 4096, 4096, 1024, 8192]
    - [23, 7.584]
  - - [4096, 8192, 1, 2048, 4096, 4096, 2048, 8192]
    - [23, 8.289]
  - - [4096, 8192, 1, 4096, 4096, 4096, 4096, 8192]
    - [25, 8.106]
  - - [4096, 8192, 1, 8192, 4096, 4096, 8192, 8192]
    - [17, 7.705]
  - - [8192, 128, 1, 128, 8192, 8192, 128, 128]
    - [39, 1.881]
  - - [8192, 128, 1, 256, 8192, 8192, 256, 128]
    - [40, 2.911]
  - - [8192, 128, 1, 512, 8192, 8192, 512, 128]
    - [65, 4.072]
  - - [8192, 128, 1, 1024, 8192, 8192, 1024, 128]
    - [64, 5.134]
  - - [8192, 128, 1, 2048, 8192, 8192, 2048, 128]
    - [65, 6.164]
  - - [8192, 128, 1, 4096, 8192, 8192, 4096, 128]
    - [78, 7.138]
  - - [8192, 128, 1, 8192, 8192, 8192, 8192, 128]
    - [60, 8.316]
  - - [8192, 256, 1, 128, 8192, 8192, 128, 256]
    - [11, 2.409]
  - - [8192, 256, 1, 256, 8192, 8192, 256, 256]
    - [15, 3.608]
  - - [8192, 256, 1, 512, 8192, 8192, 512, 256]
    - [23, 5.058]
  - - [8192, 256, 1, 1024, 8192, 8192, 1024, 256]
    - [15, 6.004]
  - - [8192, 256, 1, 2048, 8192, 8192, 2048, 256]
    - [33, 6.98]
  - - [8192, 256, 1, 4096, 8192, 8192, 4096, 256]
    - [24, 8.127]
  - - [8192, 256, 1, 8192, 8192, 8192, 8192, 256]
    - [5, 9.27]
  - - [8192, 512, 1, 128, 8192, 8192, 128, 512]
    - [66, 2.164]
  - - [8192, 512, 1, 256, 8192, 8192, 256, 512]
    - [63, 3.341]
  - - [8192, 512, 1, 512, 8192, 8192, 512, 512]
    - [14, 4.753]
  - - [8192, 512, 1, 1024, 8192, 8192, 1024, 512]
    - [7, 6.547]
  - - [8192, 512, 1, 2048, 8192, 8192, 2048, 512]
    - [2, 7.708]
  - - [8192, 512, 1, 4096, 8192, 8192, 4096, 512]
    - [25, 8.618]
  - - [8192, 512, 1, 8192, 8192, 8192, 8192, 512]
    - [23, 9.461]
  - - [8192, 1024, 1, 128, 8192, 8192, 128, 1024]
    - [62, 2.626]
  - - [8192, 1024, 1, 256, 8192, 8192, 256, 1024]
    - [27, 3.741]
  - - [8192, 1024, 1, 512, 8192, 8192, 512, 1024]
    - [22, 5.37]
  - - [8192, 1024, 1, 1024, 8192, 8192, 1024, 1024]
    - [14, 6.968]
  - - [8192, 1024, 1, 2048, 8192, 8192, 2048, 1024]
    - [22, 8.044]
  - - [8192, 1024, 1, 4096, 8192, 8192, 4096, 1024]
    - [24, 8.815]
  - - [8192, 1024, 1, 8192, 8192, 8192, 8192, 1024]
    - [15, 9.168]
  - - [8192, 2048, 1, 128, 8192, 8192, 128, 2048]
    - [38, 2.839]
  - - [8192, 2048, 1, 256, 8192, 8192, 256, 2048]
    - [24, 4.29]
  - - [8192, 2048, 1, 512, 8192, 8192, 512, 2048]
    - [17, 6.017]
  - - [8192, 2048, 1, 1024, 8192, 8192, 1024, 2048]
    - [23, 7.5]
  - - [8192, 2048, 1, 2048, 8192, 8192, 2048, 2048]
    - [22, 8.331]
  - - [8192, 2048, 1, 4096, 8192, 8192, 4096, 2048]
    - [19, 8.705]
  - - [8192, 2048, 1, 8192, 8192, 8192, 8192, 2048]
    - [11, 8.803]
  - - [8192, 4096, 1, 128, 8192, 8192, 128, 4096]
    - [2, 3.344]
  - - [8192, 4096, 1, 256, 8192, 8192, 256, 4096]
    - [2, 4.753]
  - - [8192, 4096, 1, 512, 8192, 8192, 512, 4096]
    - [18, 6.353]
  - - [8192, 4096, 1, 1024, 8192, 8192, 1024, 4096]
    - [24, 7.487]
  - - [8192, 4096, 1, 2048, 8192, 8192, 2048, 4096]
    - [20, 8.07]
  - - [8192, 4096, 1, 4096, 8192, 8192, 4096, 4096]
    - [8, 8.069]
  - - [8192, 4096, 1, 8192, 8192, 8192, 8192, 4096]
    - [67, 8.235]
  - - [8192, 8192, 1, 128, 8192, 8192, 128, 8192]
    - [20, 3.307]
  - - [8192, 8192, 1, 256, 8192, 8192, 256, 8192]
    - [15, 4.903]
  - - [8192, 8192, 1, 512, 8192, 8192, 512, 8192]
    - [23, 6.454]
  - - [8192, 8192, 1, 1024, 8192, 8192, 1024, 8192]
    - [23, 7.579]
  - - [8192, 8192, 1, 2048, 8192, 8192, 2048, 8192]
    - [18, 8.246]
  - - [8192, 8192, 1, 4096, 8192, 8192, 4096, 8192]
    - [15, 8.831]
  - - [8192, 8192, 1, 8192, 8192, 8192, 8192, 8192]
    - [16, 8.347]
  - - [1, 1, 1, 32, 1, 1, 32, 1]
    - [123, 0.0]
- null
- null
- ExperimentalStreamK
- GridBased
