library/src/amd_detail/rocblaslt/src/Tensile/Logic/asm_full/aquavanjaram/gfx942_38cu/StreamK/aquavanjaram942_Cijk_Alik_Bljk_BSS_BH_UserArgs.yaml
- {MinimumRequiredVersion: 4.33.0}
- aquavanjaram942
- {Architecture: gfx942, CUCount: 38}
- [Device 0049, Device 0050]
    SolutionIndex: 0
    SolutionNameMin: Cijk_Alik_Bljk_BSS_BH_UserArgs_MT128x128x32_MI16x16x1_SN_LDSB1_CLR1_GSU0_GSUC0_GSUWGMRR0_K1_LBSPPA128_LBSPPB128_MIWT4_4_PLR1_SU32_SUM0_SUS256_VWA1_VWB1_WGM1_WGMXCC1_WGMXCCGn1
    SolutionIndex: 1
    SolutionNameMin: Cijk_Alik_Bljk_BSS_BH_UserArgs_MT128x128x32_MI16x16x1_SN_LDSB1_CLR1_GSU0_GSUC0_GSUWGMRR0_K1_LBSPPA256_LBSPPB128_MIWT4_4_PLR1_SU32_SUM0_SUS256_VWA4_VWB2_WGM1_WGMXCC1_WGMXCCGn1
    SolutionIndex: 2
    SolutionNameMin: Cijk_Alik_Bljk_BSS_BH_UserArgs_MT128x128x32_MI16x16x1_SN_LDSB1_CLR1_GSU0_GSUC0_GSUWGMRR0_K1_LBSPPA256_LBSPPB256_MIWT4_4_PLR1_SU32_SUM0_SUS256_VWA4_VWB4_WGM1_WGMXCC1_WGMXCCGn1
    SolutionIndex: 3
    SolutionNameMin: Cijk_Alik_Bljk_BSS_BH_UserArgs_MT128x128x32_MI16x16x1_SN_LDSB1_CLR1_GSU0_GSUC0_GSUWGMRR0_K1_LBSPPA256_LBSPPB128_MIWT4_4_PLR1_SU32_SUM0_SUS256_VWA4_VWB1_WGM4_WGMXCC1_WGMXCCGn1
    SolutionIndex: 4
    SolutionNameMin: Cijk_Alik_Bljk_BSS_BH_UserArgs_MT128x128x32_MI16x16x1_SN_LDSB1_CLR1_GSU0_GSUC0_GSUWGMRR0_K1_LBSPPA256_LBSPPB256_MIWT4_4_PLR1_SU32_SUM0_SUS256_VWA4_VWB4_WGM4_WGMXCC1_WGMXCCGn1
    SolutionIndex: 5
    SolutionNameMin: Cijk_Alik_Bljk_BSS_BH_UserArgs_MT64x128x32_MI16x16x1_SN_LDSB0_CLR1_GSU0_GSUC0_GSUWGMRR0_K1_LBSPPA128_LBSPPB128_MIWT2_4_PLR1_SU32_SUM0_SUS256_VWA1_VWB1_WGM4_WGMXCC1_WGMXCCGn1
    SolutionIndex: 6
    SolutionNameMin: Cijk_Alik_Bljk_BSS_BH_UserArgs_MT64x256x64_MI16x16x1_SN_LDSB1_CLR1_GSU0_GSUC0_GSUWGMRR0_K1_LBSPPA128_LBSPPB128_MIWT2_8_PLR1_SU32_SUM0_SUS256_VWA1_VWB1_WGM1_WGMXCC1_WGMXCCGn1
    SolutionIndex: 7
    SolutionNameMin: Cijk_Alik_Bljk_BSS_BH_UserArgs_MT64x256x64_MI16x16x1_SN_LDSB1_CLR1_GSU0_GSUC0_GSUWGMRR0_K1_LBSPPA256_LBSPPB256_MIWT2_8_PLR1_SU32_SUM0_SUS256_VWA2_VWB2_WGM1_WGMXCC1_WGMXCCGn1
    SolutionIndex: 8
    SolutionNameMin: Cijk_Alik_Bljk_BSS_BH_UserArgs_MT64x256x64_MI16x16x1_SN_LDSB1_CLR1_GSU0_GSUC0_GSUWGMRR0_K1_LBSPPA128_LBSPPB512_MIWT2_8_PLR2_SU32_SUM0_SUS256_VWA1_VWB4_WGM8_WGMXCC1_WGMXCCGn1
    SolutionIndex: 9
    SolutionNameMin: Cijk_Alik_Bljk_BSS_BH_UserArgs_MT256x64x64_MI16x16x1_SN_LDSB1_CLR1_GSU0_GSUC0_GSUWGMRR0_K1_LBSPPA128_LBSPPB128_MIWT8_2_PLR1_SU32_SUM0_SUS256_VWA1_VWB1_WGM1_WGMXCC1_WGMXCCGn1
    SolutionIndex: 10
    SolutionNameMin: Cijk_Alik_Bljk_BSS_BH_UserArgs_MT256x64x64_MI16x16x1_SN_LDSB1_CLR1_GSU0_GSUC0_GSUWGMRR0_K1_LBSPPA512_LBSPPB128_MIWT8_2_PLR1_SU32_SUM0_SUS256_VWA4_VWB1_WGM1_WGMXCC1_WGMXCCGn1
    SolutionIndex: 11
    SolutionNameMin: Cijk_Alik_Bljk_BSS_BH_UserArgs_MT256x64x64_MI16x16x1_SN_LDSB1_CLR1_GSU0_GSUC0_GSUWGMRR0_K1_LBSPPA1024_LBSPPB128_MIWT8_2_PLR1_SU32_SUM0_SUS256_VWA8_VWB1_WGM1_WGMXCC1_WGMXCCGn1
    SolutionIndex: 12
    SolutionNameMin: Cijk_Alik_Bljk_BSS_BH_UserArgs_MT256x64x64_MI16x16x1_SN_LDSB1_CLR1_GSU0_GSUC0_GSUWGMRR0_K1_LBSPPA512_LBSPPB256_MIWT8_2_PLR1_SU32_SUM0_SUS256_VWA4_VWB2_WGM1_WGMXCC1_WGMXCCGn1
    SolutionIndex: 13
    SolutionNameMin: Cijk_Alik_Bljk_BSS_BH_UserArgs_MT256x64x64_MI16x16x1_SN_LDSB1_CLR1_GSU0_GSUC0_GSUWGMRR0_K1_LBSPPA512_LBSPPB256_MIWT8_2_PLR1_SU32_SUM0_SUS256_VWA4_VWB2_WGM4_WGMXCC1_WGMXCCGn1
    SolutionIndex: 14
    SolutionNameMin: Cijk_Alik_Bljk_BSS_BH_UserArgs_MT256x64x64_MI16x16x1_SN_LDSB1_CLR1_GSU0_GSUC0_GSUWGMRR0_K1_LBSPPA512_LBSPPB128_MIWT8_2_PLR1_SU32_SUM0_SUS256_VWA4_VWB1_WGM8_WGMXCC1_WGMXCCGn1
    SolutionIndex: 15
    SolutionNameMin: Cijk_Alik_Bljk_BSS_BH_UserArgs_MT256x64x64_MI16x16x1_SN_LDSB1_CLR1_GSU0_GSUC0_GSUWGMRR0_K1_LBSPPA512_LBSPPB256_MIWT8_2_PLR1_SU32_SUM0_SUS256_VWA4_VWB2_WGM8_WGMXCC1_WGMXCCGn1
    SolutionIndex: 16
    SolutionNameMin: Cijk_Alik_Bljk_BSS_BH_UserArgs_MT128x128x64_MI16x16x1_SN_LDSB1_CLR1_GSU0_GSUC0_GSUWGMRR0_K1_LBSPPA128_LBSPPB128_MIWT4_4_PLR1_SU32_SUM0_SUS256_VWA1_VWB1_WGM1_WGMXCC1_WGMXCCGn1
    SolutionIndex: 17
    SolutionNameMin: Cijk_Alik_Bljk_BSS_BH_UserArgs_MT128x128x64_MI16x16x1_SN_LDSB1_CLR1_GSU0_GSUC0_GSUWGMRR0_K1_LBSPPA256_LBSPPB128_MIWT4_4_PLR1_SU32_SUM0_SUS256_VWA2_VWB1_WGM1_WGMXCC1_WGMXCCGn1
    SolutionIndex: 18
    SolutionNameMin: Cijk_Alik_Bljk_BSS_BH_UserArgs_MT128x128x64_MI16x16x1_SN_LDSB1_CLR1_GSU0_GSUC0_GSUWGMRR0_K1_LBSPPA512_LBSPPB128_MIWT4_4_PLR1_SU32_SUM0_SUS256_VWA4_VWB1_WGM1_WGMXCC1_WGMXCCGn1
    SolutionIndex: 19
    SolutionNameMin: Cijk_Alik_Bljk_BSS_BH_UserArgs_MT128x128x64_MI16x16x1_SN_LDSB1_CLR1_GSU0_GSUC0_GSUWGMRR0_K1_LBSPPA128_LBSPPB256_MIWT4_4_PLR1_SU32_SUM0_SUS256_VWA1_VWB2_WGM1_WGMXCC1_WGMXCCGn1
    SolutionIndex: 20
    SolutionNameMin: Cijk_Alik_Bljk_BSS_BH_UserArgs_MT128x128x64_MI16x16x1_SN_LDSB1_CLR1_GSU0_GSUC0_GSUWGMRR0_K1_LBSPPA256_LBSPPB256_MIWT4_4_PLR1_SU32_SUM0_SUS256_VWA2_VWB2_WGM1_WGMXCC1_WGMXCCGn1
    SolutionIndex: 21
    SolutionNameMin: Cijk_Alik_Bljk_BSS_BH_UserArgs_MT128x128x64_MI16x16x1_SN_LDSB1_CLR1_GSU0_GSUC0_GSUWGMRR0_K1_LBSPPA512_LBSPPB256_MIWT4_4_PLR1_SU32_SUM0_SUS256_VWA4_VWB2_WGM1_WGMXCC1_WGMXCCGn1
    SolutionIndex: 22
    SolutionNameMin: Cijk_Alik_Bljk_BSS_BH_UserArgs_MT128x128x64_MI16x16x1_SN_LDSB1_CLR1_GSU0_GSUC0_GSUWGMRR0_K1_LBSPPA128_LBSPPB512_MIWT4_4_PLR1_SU32_SUM0_SUS256_VWA1_VWB4_WGM1_WGMXCC1_WGMXCCGn1
    SolutionIndex: 23
    SolutionNameMin: Cijk_Alik_Bljk_BSS_BH_UserArgs_MT128x128x64_MI16x16x1_SN_LDSB1_CLR1_GSU0_GSUC0_GSUWGMRR0_K1_LBSPPA256_LBSPPB512_MIWT4_4_PLR1_SU32_SUM0_SUS256_VWA2_VWB4_WGM1_WGMXCC1_WGMXCCGn1
    SolutionIndex: 24
    SolutionNameMin: Cijk_Alik_Bljk_BSS_BH_UserArgs_MT128x128x64_MI16x16x1_SN_LDSB1_CLR1_GSU0_GSUC0_GSUWGMRR0_K1_LBSPPA512_LBSPPB512_MIWT4_4_PLR1_SU32_SUM0_SUS256_VWA4_VWB4_WGM1_WGMXCC1_WGMXCCGn1
    SolutionIndex: 25
    SolutionNameMin: Cijk_Alik_Bljk_BSS_BH_UserArgs_MT128x128x64_MI16x16x1_SN_LDSB1_CLR1_GSU0_GSUC0_GSUWGMRR0_K1_LBSPPA512_LBSPPB128_MIWT4_4_PLR2_SU32_SUM0_SUS256_VWA4_VWB1_WGM1_WGMXCC1_WGMXCCGn1
    SolutionIndex: 26
    SolutionNameMin: Cijk_Alik_Bljk_BSS_BH_UserArgs_MT128x128x64_MI16x16x1_SN_LDSB1_CLR1_GSU0_GSUC0_GSUWGMRR0_K1_LBSPPA128_LBSPPB256_MIWT4_4_PLR2_SU32_SUM0_SUS256_VWA1_VWB2_WGM1_WGMXCC1_WGMXCCGn1
    SolutionIndex: 27
    SolutionNameMin: Cijk_Alik_Bljk_BSS_BH_UserArgs_MT128x128x64_MI16x16x1_SN_LDSB1_CLR1_GSU0_GSUC0_GSUWGMRR0_K1_LBSPPA256_LBSPPB256_MIWT4_4_PLR2_SU32_SUM0_SUS256_VWA2_VWB2_WGM1_WGMXCC1_WGMXCCGn1
    SolutionIndex: 28
    SolutionNameMin: Cijk_Alik_Bljk_BSS_BH_UserArgs_MT128x128x64_MI16x16x1_SN_LDSB1_CLR1_GSU0_GSUC0_GSUWGMRR0_K1_LBSPPA512_LBSPPB256_MIWT4_4_PLR2_SU32_SUM0_SUS256_VWA4_VWB2_WGM1_WGMXCC1_WGMXCCGn1
    SolutionIndex: 29
    SolutionNameMin: Cijk_Alik_Bljk_BSS_BH_UserArgs_MT128x128x64_MI16x16x1_SN_LDSB1_CLR1_GSU0_GSUC0_GSUWGMRR0_K1_LBSPPA128_LBSPPB128_MIWT4_4_PLR1_SU32_SUM0_SUS256_VWA1_VWB1_WGM4_WGMXCC1_WGMXCCGn1
    SolutionIndex: 30
    SolutionNameMin: Cijk_Alik_Bljk_BSS_BH_UserArgs_MT128x128x64_MI16x16x1_SN_LDSB1_CLR1_GSU0_GSUC0_GSUWGMRR0_K1_LBSPPA256_LBSPPB128_MIWT4_4_PLR1_SU32_SUM0_SUS256_VWA2_VWB1_WGM4_WGMXCC1_WGMXCCGn1
    SolutionIndex: 31
    SolutionNameMin: Cijk_Alik_Bljk_BSS_BH_UserArgs_MT128x128x64_MI16x16x1_SN_LDSB1_CLR1_GSU0_GSUC0_GSUWGMRR0_K1_LBSPPA512_LBSPPB128_MIWT4_4_PLR1_SU32_SUM0_SUS256_VWA4_VWB1_WGM4_WGMXCC1_WGMXCCGn1
    SolutionIndex: 32
    SolutionNameMin: Cijk_Alik_Bljk_BSS_BH_UserArgs_MT128x128x64_MI16x16x1_SN_LDSB1_CLR1_GSU0_GSUC0_GSUWGMRR0_K1_LBSPPA128_LBSPPB256_MIWT4_4_PLR1_SU32_SUM0_SUS256_VWA1_VWB2_WGM4_WGMXCC1_WGMXCCGn1
    SolutionIndex: 33
    SolutionNameMin: Cijk_Alik_Bljk_BSS_BH_UserArgs_MT128x128x64_MI16x16x1_SN_LDSB1_CLR1_GSU0_GSUC0_GSUWGMRR0_K1_LBSPPA256_LBSPPB256_MIWT4_4_PLR1_SU32_SUM0_SUS256_VWA2_VWB2_WGM4_WGMXCC1_WGMXCCGn1
    SolutionIndex: 34
    SolutionNameMin: Cijk_Alik_Bljk_BSS_BH_UserArgs_MT128x128x64_MI16x16x1_SN_LDSB1_CLR1_GSU0_GSUC0_GSUWGMRR0_K1_LBSPPA512_LBSPPB256_MIWT4_4_PLR1_SU32_SUM0_SUS256_VWA4_VWB2_WGM4_WGMXCC1_WGMXCCGn1
    SolutionIndex: 35
    SolutionNameMin: Cijk_Alik_Bljk_BSS_BH_UserArgs_MT128x128x64_MI16x16x1_SN_LDSB1_CLR1_GSU0_GSUC0_GSUWGMRR0_K1_LBSPPA128_LBSPPB512_MIWT4_4_PLR1_SU32_SUM0_SUS256_VWA1_VWB4_WGM4_WGMXCC1_WGMXCCGn1
    SolutionIndex: 36
    SolutionNameMin: Cijk_Alik_Bljk_BSS_BH_UserArgs_MT128x128x64_MI16x16x1_SN_LDSB1_CLR1_GSU0_GSUC0_GSUWGMRR0_K1_LBSPPA256_LBSPPB512_MIWT4_4_PLR1_SU32_SUM0_SUS256_VWA2_VWB4_WGM4_WGMXCC1_WGMXCCGn1
    SolutionIndex: 37
    SolutionNameMin: Cijk_Alik_Bljk_BSS_BH_UserArgs_MT128x128x64_MI16x16x1_SN_LDSB1_CLR1_GSU0_GSUC0_GSUWGMRR0_K1_LBSPPA512_LBSPPB512_MIWT4_4_PLR1_SU32_SUM0_SUS256_VWA4_VWB4_WGM4_WGMXCC1_WGMXCCGn1
    SolutionIndex: 38
    SolutionNameMin: Cijk_Alik_Bljk_BSS_BH_UserArgs_MT128x128x64_MI16x16x1_SN_LDSB1_CLR1_GSU0_GSUC0_GSUWGMRR0_K1_LBSPPA512_LBSPPB128_MIWT4_4_PLR2_SU32_SUM0_SUS256_VWA4_VWB1_WGM4_WGMXCC1_WGMXCCGn1
    SolutionIndex: 39
    SolutionNameMin: Cijk_Alik_Bljk_BSS_BH_UserArgs_MT128x128x64_MI16x16x1_SN_LDSB1_CLR1_GSU0_GSUC0_GSUWGMRR0_K1_LBSPPA128_LBSPPB128_MIWT4_4_PLR1_SU32_SUM0_SUS256_VWA1_VWB1_WGM8_WGMXCC1_WGMXCCGn1
    SolutionIndex: 40
    SolutionNameMin: Cijk_Alik_Bljk_BSS_BH_UserArgs_MT128x128x64_MI16x16x1_SN_LDSB1_CLR1_GSU0_GSUC0_GSUWGMRR0_K1_LBSPPA256_LBSPPB128_MIWT4_4_PLR1_SU32_SUM0_SUS256_VWA2_VWB1_WGM8_WGMXCC1_WGMXCCGn1
    SolutionIndex: 41
    SolutionNameMin: Cijk_Alik_Bljk_BSS_BH_UserArgs_MT128x128x64_MI16x16x1_SN_LDSB1_CLR1_GSU0_GSUC0_GSUWGMRR0_K1_LBSPPA512_LBSPPB128_MIWT4_4_PLR1_SU32_SUM0_SUS256_VWA4_VWB1_WGM8_WGMXCC1_WGMXCCGn1
    SolutionIndex: 42
    SolutionNameMin: Cijk_Alik_Bljk_BSS_BH_UserArgs_MT128x128x64_MI16x16x1_SN_LDSB1_CLR1_GSU0_GSUC0_GSUWGMRR0_K1_LBSPPA128_LBSPPB256_MIWT4_4_PLR1_SU32_SUM0_SUS256_VWA1_VWB2_WGM8_WGMXCC1_WGMXCCGn1
    SolutionIndex: 43
    SolutionNameMin: Cijk_Alik_Bljk_BSS_BH_UserArgs_MT128x128x64_MI16x16x1_SN_LDSB1_CLR1_GSU0_GSUC0_GSUWGMRR0_K1_LBSPPA256_LBSPPB256_MIWT4_4_PLR1_SU32_SUM0_SUS256_VWA2_VWB2_WGM8_WGMXCC1_WGMXCCGn1
    SolutionIndex: 44
    SolutionNameMin: Cijk_Alik_Bljk_BSS_BH_UserArgs_MT128x128x64_MI16x16x1_SN_LDSB1_CLR1_GSU0_GSUC0_GSUWGMRR0_K1_LBSPPA512_LBSPPB256_MIWT4_4_PLR1_SU32_SUM0_SUS256_VWA4_VWB2_WGM8_WGMXCC1_WGMXCCGn1
    SolutionIndex: 45
    SolutionNameMin: Cijk_Alik_Bljk_BSS_BH_UserArgs_MT128x128x64_MI16x16x1_SN_LDSB1_CLR1_GSU0_GSUC0_GSUWGMRR0_K1_LBSPPA128_LBSPPB512_MIWT4_4_PLR1_SU32_SUM0_SUS256_VWA1_VWB4_WGM8_WGMXCC1_WGMXCCGn1
    SolutionIndex: 46
    SolutionNameMin: Cijk_Alik_Bljk_BSS_BH_UserArgs_MT128x128x64_MI16x16x1_SN_LDSB1_CLR1_GSU0_GSUC0_GSUWGMRR0_K1_LBSPPA256_LBSPPB512_MIWT4_4_PLR1_SU32_SUM0_SUS256_VWA2_VWB4_WGM8_WGMXCC1_WGMXCCGn1
    SolutionIndex: 47
    SolutionNameMin: Cijk_Alik_Bljk_BSS_BH_UserArgs_MT128x128x64_MI16x16x1_SN_LDSB1_CLR1_GSU0_GSUC0_GSUWGMRR0_K1_LBSPPA512_LBSPPB512_MIWT4_4_PLR1_SU32_SUM0_SUS256_VWA4_VWB4_WGM8_WGMXCC1_WGMXCCGn1
    SolutionIndex: 48
    SolutionNameMin: Cijk_Alik_Bljk_BSS_BH_UserArgs_MT128x128x64_MI16x16x1_SN_LDSB1_CLR1_GSU0_GSUC0_GSUWGMRR0_K1_LBSPPA512_LBSPPB256_MIWT4_4_PLR2_SU32_SUM0_SUS256_VWA4_VWB2_WGM8_WGMXCC1_WGMXCCGn1
    SolutionIndex: 49
    SolutionNameMin: Cijk_Alik_Bljk_BSS_BH_UserArgs_MT128x128x64_MI16x16x1_SN_LDSB1_CLR1_GSU0_GSUC0_GSUWGMRR0_K1_LBSPPA256_LBSPPB512_MIWT4_4_PLR2_SU32_SUM0_SUS256_VWA2_VWB4_WGM8_WGMXCC1_WGMXCCGn1
    SolutionIndex: 50
    SolutionNameMin: Cijk_Alik_Bljk_BSS_BH_UserArgs_MT64x128x64_MI16x16x1_SN_LDSB1_CLR1_GSU0_GSUC0_GSUWGMRR0_K1_LBSPPA128_LBSPPB128_MIWT2_4_PLR1_SU32_SUM0_SUS256_VWA1_VWB1_WGM1_WGMXCC1_WGMXCCGn1
    SolutionIndex: 51
    SolutionNameMin: Cijk_Alik_Bljk_BSS_BH_UserArgs_MT64x128x64_MI16x16x1_SN_LDSB1_CLR1_GSU0_GSUC0_GSUWGMRR0_K1_LBSPPA256_LBSPPB128_MIWT2_4_PLR1_SU32_SUM0_SUS256_VWA2_VWB1_WGM1_WGMXCC1_WGMXCCGn1
    SolutionIndex: 52
    SolutionNameMin: Cijk_Alik_Bljk_BSS_BH_UserArgs_MT64x128x64_MI16x16x1_SN_LDSB1_CLR1_GSU0_GSUC0_GSUWGMRR0_K1_LBSPPA128_LBSPPB512_MIWT2_4_PLR1_SU32_SUM0_SUS256_VWA1_VWB4_WGM1_WGMXCC1_WGMXCCGn1
    SolutionIndex: 53
    SolutionNameMin: Cijk_Alik_Bljk_BSS_BH_UserArgs_MT64x128x64_MI16x16x1_SN_LDSB1_CLR1_GSU0_GSUC0_GSUWGMRR0_K1_LBSPPA128_LBSPPB128_MIWT2_4_PLR1_SU32_SUM0_SUS256_VWA1_VWB1_WGM8_WGMXCC1_WGMXCCGn1
    SolutionIndex: 54
    SolutionNameMin: Cijk_Alik_Bljk_BSS_BH_UserArgs_MT64x128x64_MI16x16x1_SN_LDSB1_CLR1_GSU0_GSUC0_GSUWGMRR0_K1_LBSPPA128_LBSPPB512_MIWT2_4_PLR1_SU32_SUM0_SUS256_VWA1_VWB4_WGM8_WGMXCC1_WGMXCCGn1
    SolutionIndex: 55
    SolutionNameMin: Cijk_Alik_Bljk_BSS_BH_UserArgs_MT128x64x64_MI16x16x1_SN_LDSB1_CLR1_GSU0_GSUC0_GSUWGMRR0_K1_LBSPPA128_LBSPPB128_MIWT4_2_PLR1_SU32_SUM0_SUS256_VWA1_VWB1_WGM1_WGMXCC1_WGMXCCGn1
    SolutionIndex: 56
    SolutionNameMin: Cijk_Alik_Bljk_BSS_BH_UserArgs_MT128x64x64_MI16x16x1_SN_LDSB1_CLR1_GSU0_GSUC0_GSUWGMRR0_K1_LBSPPA256_LBSPPB128_MIWT4_2_PLR1_SU32_SUM0_SUS256_VWA2_VWB1_WGM1_WGMXCC1_WGMXCCGn1
    SolutionIndex: 57
    SolutionNameMin: Cijk_Alik_Bljk_BSS_BH_UserArgs_MT128x64x64_MI16x16x1_SN_LDSB1_CLR1_GSU0_GSUC0_GSUWGMRR0_K1_LBSPPA512_LBSPPB128_MIWT4_2_PLR1_SU32_SUM0_SUS256_VWA4_VWB1_WGM1_WGMXCC1_WGMXCCGn1
    SolutionIndex: 58
    SolutionNameMin: Cijk_Alik_Bljk_BSS_BH_UserArgs_MT128x64x64_MI16x16x1_SN_LDSB1_CLR1_GSU0_GSUC0_GSUWGMRR0_K1_LBSPPA128_LBSPPB256_MIWT4_2_PLR1_SU32_SUM0_SUS256_VWA1_VWB2_WGM1_WGMXCC1_WGMXCCGn1
    SolutionIndex: 59
    SolutionNameMin: Cijk_Alik_Bljk_BSS_BH_UserArgs_MT128x64x64_MI16x16x1_SN_LDSB1_CLR1_GSU0_GSUC0_GSUWGMRR0_K1_LBSPPA512_LBSPPB256_MIWT4_2_PLR1_SU32_SUM0_SUS256_VWA4_VWB2_WGM1_WGMXCC1_WGMXCCGn1
    SolutionIndex: 60
    SolutionNameMin: Cijk_Alik_Bljk_BSS_BH_UserArgs_MT128x64x64_MI16x16x1_SN_LDSB1_CLR1_GSU0_GSUC0_GSUWGMRR0_K1_LBSPPA512_LBSPPB128_MIWT4_2_PLR2_SU32_SUM0_SUS256_VWA4_VWB1_WGM1_WGMXCC1_WGMXCCGn1
    SolutionIndex: 61
    SolutionNameMin: Cijk_Alik_Bljk_BSS_BH_UserArgs_MT128x64x64_MI16x16x1_SN_LDSB1_CLR1_GSU0_GSUC0_GSUWGMRR0_K1_LBSPPA512_LBSPPB128_MIWT4_2_PLR1_SU32_SUM0_SUS256_VWA4_VWB1_WGM4_WGMXCC1_WGMXCCGn1
    SolutionIndex: 62
    SolutionNameMin: Cijk_Alik_Bljk_BSS_BH_UserArgs_MT128x64x64_MI16x16x1_SN_LDSB1_CLR1_GSU0_GSUC0_GSUWGMRR0_K1_LBSPPA128_LBSPPB256_MIWT4_2_PLR1_SU32_SUM0_SUS256_VWA1_VWB2_WGM4_WGMXCC1_WGMXCCGn1
    SolutionIndex: 63
    SolutionNameMin: Cijk_Alik_Bljk_BSS_BH_UserArgs_MT128x64x64_MI16x16x1_SN_LDSB1_CLR1_GSU0_GSUC0_GSUWGMRR0_K1_LBSPPA256_LBSPPB256_MIWT4_2_PLR1_SU32_SUM0_SUS256_VWA2_VWB2_WGM4_WGMXCC1_WGMXCCGn1
    SolutionIndex: 64
    SolutionNameMin: Cijk_Alik_Bljk_BSS_BH_UserArgs_MT128x64x64_MI16x16x1_SN_LDSB1_CLR1_GSU0_GSUC0_GSUWGMRR0_K1_LBSPPA512_LBSPPB256_MIWT4_2_PLR1_SU32_SUM0_SUS256_VWA4_VWB2_WGM8_WGMXCC1_WGMXCCGn1
    SolutionIndex: 65
    SolutionNameMin: Cijk_Alik_Bljk_BSS_BH_UserArgs_MT64x64x64_MI16x16x1_SN_LDSB1_CLR1_GSU0_GSUC0_GSUWGMRR0_K1_LBSPPA128_LBSPPB128_MIWT2_2_PLR1_SU32_SUM0_SUS256_VWA1_VWB1_WGM1_WGMXCC1_WGMXCCGn1
    SolutionIndex: 66
    SolutionNameMin: Cijk_Alik_Bljk_BSS_BH_UserArgs_MT64x64x64_MI16x16x1_SN_LDSB1_CLR1_GSU0_GSUC0_GSUWGMRR0_K1_LBSPPA256_LBSPPB128_MIWT2_2_PLR1_SU32_SUM0_SUS256_VWA2_VWB1_WGM1_WGMXCC1_WGMXCCGn1
    SolutionIndex: 67
    SolutionNameMin: Cijk_Alik_Bljk_BSS_BH_UserArgs_MT64x64x64_MI16x16x1_SN_LDSB1_CLR1_GSU0_GSUC0_GSUWGMRR0_K1_LBSPPA128_LBSPPB256_MIWT2_2_PLR1_SU32_SUM0_SUS256_VWA1_VWB2_WGM1_WGMXCC1_WGMXCCGn1
    SolutionIndex: 68
    SolutionNameMin: Cijk_Alik_Bljk_BSS_BH_UserArgs_MT64x64x64_MI16x16x1_SN_LDSB1_CLR1_GSU0_GSUC0_GSUWGMRR0_K1_LBSPPA256_LBSPPB256_MIWT2_2_PLR1_SU32_SUM0_SUS256_VWA2_VWB2_WGM1_WGMXCC1_WGMXCCGn1
    SolutionIndex: 69
    SolutionNameMin: Cijk_Alik_Bljk_BSS_BH_UserArgs_MT64x64x64_MI16x16x1_SN_LDSB1_CLR1_GSU0_GSUC0_GSUWGMRR0_K1_LBSPPA256_LBSPPB128_MIWT2_2_PLR1_SU32_SUM0_SUS256_VWA2_VWB1_WGM4_WGMXCC1_WGMXCCGn1
    SolutionIndex: 70
    SolutionNameMin: Cijk_Alik_Bljk_BSS_BH_UserArgs_MT64x64x64_MI16x16x1_SN_LDSB1_CLR1_GSU0_GSUC0_GSUWGMRR0_K1_LBSPPA128_LBSPPB128_MIWT2_2_PLR1_SU32_SUM0_SUS256_VWA1_VWB1_WGM8_WGMXCC1_WGMXCCGn1
    SolutionIndex: 71
    SolutionNameMin: Cijk_Alik_Bljk_BSS_BH_UserArgs_MT64x64x64_MI16x16x1_SN_LDSB1_CLR1_GSU0_GSUC0_GSUWGMRR0_K1_LBSPPA256_LBSPPB128_MIWT2_2_PLR1_SU32_SUM0_SUS256_VWA2_VWB1_WGM8_WGMXCC1_WGMXCCGn1
    SolutionIndex: 72
    SolutionNameMin: Cijk_Alik_Bljk_BSS_BH_UserArgs_MT32x64x64_MI16x16x1_SN_LDSB0_CLR1_GSU0_GSUC0_GSUWGMRR0_K1_LBSPPA128_LBSPPB128_MIWT1_2_PLR1_SU32_SUM0_SUS256_VWA1_VWB1_WGM1_WGMXCC1_WGMXCCGn1
    SolutionIndex: 73
    SolutionNameMin: Cijk_Alik_Bljk_BSS_BH_UserArgs_MT32x64x64_MI16x16x1_SN_LDSB0_CLR1_GSU0_GSUC0_GSUWGMRR0_K1_LBSPPA128_LBSPPB256_MIWT1_2_PLR1_SU32_SUM0_SUS256_VWA1_VWB2_WGM1_WGMXCC1_WGMXCCGn1
    SolutionIndex: 74
    SolutionNameMin: Cijk_Alik_Bljk_BSS_BH_UserArgs_MT32x64x64_MI16x16x1_SN_LDSB0_CLR1_GSU0_GSUC0_GSUWGMRR0_K1_LBSPPA128_LBSPPB128_MIWT1_2_PLR1_SU32_SUM0_SUS256_VWA1_VWB1_WGM8_WGMXCC1_WGMXCCGn1
    SolutionIndex: 75
    SolutionNameMin: Cijk_Alik_Bljk_BSS_BH_UserArgs_MT64x32x64_MI16x16x1_SN_LDSB0_CLR1_GSU0_GSUC0_GSUWGMRR0_K1_LBSPPA128_LBSPPB128_MIWT2_1_PLR1_SU32_SUM0_SUS256_VWA1_VWB1_WGM1_WGMXCC1_WGMXCCGn1
    SolutionIndex: 76
    SolutionNameMin: Cijk_Alik_Bljk_BSS_BH_UserArgs_MT64x32x64_MI16x16x1_SN_LDSB0_CLR1_GSU0_GSUC0_GSUWGMRR0_K1_LBSPPA256_LBSPPB128_MIWT2_1_PLR1_SU32_SUM0_SUS256_VWA2_VWB1_WGM1_WGMXCC1_WGMXCCGn1
    SolutionIndex: 77
    SolutionNameMin: Cijk_Alik_Bljk_BSS_BH_UserArgs_MT64x32x64_MI16x16x1_SN_LDSB0_CLR1_GSU0_GSUC0_GSUWGMRR0_K1_LBSPPA256_LBSPPB128_MIWT2_1_PLR2_SU32_SUM0_SUS256_VWA2_VWB1_WGM1_WGMXCC1_WGMXCCGn1
    SolutionIndex: 78
    SolutionNameMin: Cijk_Alik_Bljk_BSS_BH_UserArgs_MT64x32x64_MI16x16x1_SN_LDSB0_CLR1_GSU0_GSUC0_GSUWGMRR0_K1_LBSPPA256_LBSPPB128_MIWT2_1_PLR1_SU32_SUM0_SUS256_VWA2_VWB1_WGM4_WGMXCC1_WGMXCCGn1
    SolutionIndex: 79
    SolutionNameMin: Cijk_Alik_Bljk_BSS_BH_UserArgs_MT64x32x64_MI16x16x1_SN_LDSB0_CLR1_GSU0_GSUC0_GSUWGMRR0_K1_LBSPPA256_LBSPPB128_MIWT2_1_PLR2_SU32_SUM0_SUS256_VWA2_VWB1_WGM8_WGMXCC1_WGMXCCGn1
    SolutionIndex: 80
    SolutionNameMin: Cijk_Alik_Bljk_BSS_BH_UserArgs_MT32x32x64_MI16x16x1_SN_LDSB0_CLR1_GSU0_GSUC0_GSUWGMRR0_K1_LBSPPA128_LBSPPB128_MIWT1_1_PLR1_SU32_SUM0_SUS256_VWA1_VWB1_WGM1_WGMXCC1_WGMXCCGn1
    SolutionIndex: 81
    SolutionNameMin: Cijk_Alik_Bljk_BSS_BH_UserArgs_MT32x32x64_MI16x16x1_SN_LDSB0_CLR1_GSU0_GSUC0_GSUWGMRR0_K1_LBSPPA128_LBSPPB128_MIWT1_1_PLR1_SU32_SUM0_SUS256_VWA1_VWB1_WGM4_WGMXCC1_WGMXCCGn1
    SolutionIndex: 82
    SolutionNameMin: Cijk_Alik_Bljk_BSS_BH_UserArgs_MT64x64x128_MI16x16x1_SN_LDSB1_CLR1_GSU0_GSUC0_GSUWGMRR0_K1_LBSPPA256_LBSPPB256_MIWT2_2_PLR1_SU32_SUM0_SUS256_VWA1_VWB1_WGM1_WGMXCC1_WGMXCCGn1
    SolutionIndex: 83
    SolutionNameMin: Cijk_Alik_Bljk_BSS_BH_UserArgs_MT64x64x128_MI16x16x1_SN_LDSB1_CLR1_GSU0_GSUC0_GSUWGMRR0_K1_LBSPPA512_LBSPPB256_MIWT2_2_PLR1_SU32_SUM0_SUS256_VWA2_VWB1_WGM1_WGMXCC1_WGMXCCGn1
    SolutionIndex: 84
    SolutionNameMin: Cijk_Alik_Bljk_BSS_BH_UserArgs_MT64x64x128_MI16x16x1_SN_LDSB1_CLR1_GSU0_GSUC0_GSUWGMRR0_K1_LBSPPA256_LBSPPB512_MIWT2_2_PLR1_SU32_SUM0_SUS256_VWA1_VWB2_WGM1_WGMXCC1_WGMXCCGn1
    SolutionIndex: 85
    SolutionNameMin: Cijk_Alik_Bljk_BSS_BH_UserArgs_MT64x64x128_MI16x16x1_SN_LDSB1_CLR1_GSU0_GSUC0_GSUWGMRR0_K1_LBSPPA512_LBSPPB512_MIWT2_2_PLR1_SU32_SUM0_SUS256_VWA2_VWB2_WGM1_WGMXCC1_WGMXCCGn1
    SolutionIndex: 86
    SolutionNameMin: Cijk_Alik_Bljk_BSS_BH_UserArgs_MT64x64x128_MI16x16x1_SN_LDSB1_CLR1_GSU0_GSUC0_GSUWGMRR0_K1_LBSPPA256_LBSPPB256_MIWT2_2_PLR2_SU32_SUM0_SUS256_VWA1_VWB1_WGM1_WGMXCC1_WGMXCCGn1
    SolutionIndex: 87
    SolutionNameMin: Cijk_Alik_Bljk_BSS_BH_UserArgs_MT64x64x128_MI16x16x1_SN_LDSB1_CLR1_GSU0_GSUC0_GSUWGMRR0_K1_LBSPPA256_LBSPPB512_MIWT2_2_PLR2_SU32_SUM0_SUS256_VWA1_VWB2_WGM1_WGMXCC1_WGMXCCGn1
    SolutionIndex: 88
    SolutionNameMin: Cijk_Alik_Bljk_BSS_BH_UserArgs_MT64x64x128_MI16x16x1_SN_LDSB1_CLR1_GSU0_GSUC0_GSUWGMRR0_K1_LBSPPA256_LBSPPB256_MIWT2_2_PLR1_SU32_SUM0_SUS256_VWA1_VWB1_WGM4_WGMXCC1_WGMXCCGn1
    SolutionIndex: 89
    SolutionNameMin: Cijk_Alik_Bljk_BSS_BH_UserArgs_MT64x64x128_MI16x16x1_SN_LDSB1_CLR1_GSU0_GSUC0_GSUWGMRR0_K1_LBSPPA256_LBSPPB512_MIWT2_2_PLR2_SU32_SUM0_SUS256_VWA1_VWB2_WGM4_WGMXCC1_WGMXCCGn1
    SolutionIndex: 90
    SolutionNameMin: Cijk_Alik_Bljk_BSS_BH_UserArgs_MT64x64x128_MI16x16x1_SN_LDSB1_CLR1_GSU0_GSUC0_GSUWGMRR0_K1_LBSPPA256_LBSPPB256_MIWT2_2_PLR1_SU32_SUM0_SUS256_VWA1_VWB1_WGM8_WGMXCC1_WGMXCCGn1
    SolutionIndex: 91
    SolutionNameMin: Cijk_Alik_Bljk_BSS_BH_UserArgs_MT64x64x128_MI16x16x1_SN_LDSB1_CLR1_GSU0_GSUC0_GSUWGMRR0_K1_LBSPPA512_LBSPPB512_MIWT2_2_PLR1_SU32_SUM0_SUS256_VWA2_VWB2_WGM8_WGMXCC1_WGMXCCGn1
    SolutionIndex: 92
    SolutionNameMin: Cijk_Alik_Bljk_BSS_BH_UserArgs_MT64x64x128_MI16x16x1_SN_LDSB1_CLR1_GSU0_GSUC0_GSUWGMRR0_K1_LBSPPA256_LBSPPB512_MIWT2_2_PLR2_SU32_SUM0_SUS256_VWA1_VWB2_WGM8_WGMXCC1_WGMXCCGn1
    SolutionIndex: 93
    SolutionNameMin: Cijk_Alik_Bljk_BSS_BH_UserArgs_MT64x32x128_MI16x16x1_SN_LDSB1_CLR1_GSU0_GSUC0_GSUWGMRR0_K1_LBSPPA256_LBSPPB256_MIWT2_1_PLR2_SU32_SUM0_SUS256_VWA1_VWB1_WGM1_WGMXCC1_WGMXCCGn1
    SolutionIndex: 94
    SolutionNameMin: Cijk_Alik_Bljk_BSS_BH_UserArgs_MT64x32x128_MI16x16x1_SN_LDSB1_CLR1_GSU0_GSUC0_GSUWGMRR0_K1_LBSPPA512_LBSPPB256_MIWT2_1_PLR2_SU32_SUM0_SUS256_VWA2_VWB1_WGM1_WGMXCC1_WGMXCCGn1
    SolutionIndex: 95
    SolutionNameMin: Cijk_Alik_Bljk_BSS_BH_UserArgs_MT32x32x128_MI16x16x1_SN_LDSB1_CLR1_GSU0_GSUC0_GSUWGMRR0_K1_LBSPPA256_LBSPPB256_MIWT1_1_PLR1_SU32_SUM0_SUS256_VWA1_VWB1_WGM1_WGMXCC1_WGMXCCGn1
    SolutionIndex: 96
    SolutionNameMin: Cijk_Alik_Bljk_BSS_BH_UserArgs_MT32x32x128_MI16x16x1_SN_LDSB1_CLR1_GSU0_GSUC0_GSUWGMRR0_K1_LBSPPA256_LBSPPB256_MIWT1_1_PLR2_SU32_SUM0_SUS256_VWA1_VWB1_WGM1_WGMXCC1_WGMXCCGn1
    SolutionIndex: 97
    SolutionNameMin: Cijk_Alik_Bljk_BSS_BH_UserArgs_MT32x32x128_MI16x16x1_SN_LDSB1_CLR1_GSU0_GSUC0_GSUWGMRR0_K1_LBSPPA256_LBSPPB256_MIWT1_1_PLR2_SU32_SUM0_SUS256_VWA1_VWB1_WGM4_WGMXCC1_WGMXCCGn1
    SolutionIndex: 98
    SolutionNameMin: Cijk_Alik_Bljk_BSS_BH_UserArgs_MT32x32x128_MI16x16x1_SN_LDSB1_CLR1_GSU0_GSUC0_GSUWGMRR0_K1_LBSPPA256_LBSPPB256_MIWT1_1_PLR2_SU32_SUM0_SUS256_VWA1_VWB1_WGM8_WGMXCC1_WGMXCCGn1
    SolutionIndex: 99
    SolutionNameMin: Cijk_Alik_Bljk_BSS_BH_UserArgs_MT32x32x32_MI16x16x1_SN_LDSB0_CLR1_GSU0_GSUC0_GSUWGMRR0_K1_LBSPPA128_LBSPPB128_MIWT1_1_PLR1_SU32_SUM0_SUS256_VWA1_VWB1_WGM1_WGMXCC1_WGMXCCGn1
- - - [128, 128, 1, 128, 128, 128, 128, 128]
    - [79, 0.085]
  - - [128, 128, 1, 256, 128, 128, 256, 256]
    - [81, 0.17]
  - - [128, 128, 1, 512, 128, 128, 512, 512]
    - [80, 0.304]
  - - [128, 128, 1, 1024, 128, 128, 1024, 1024]
    - [95, 0.479]
  - - [128, 128, 1, 2048, 128, 128, 2048, 2048]
    - [95, 0.641]
  - - [128, 128, 1, 4096, 128, 128, 4096, 4096]
    - [73, 1.005]
  - - [128, 128, 1, 8192, 128, 128, 8192, 8192]
    - [93, 1.48]
  - - [128, 256, 1, 128, 128, 128, 128, 128]
    - [81, 0.182]
  - - [128, 256, 1, 256, 128, 128, 256, 256]
    - [80, 0.35]
  - - [128, 256, 1, 512, 128, 128, 512, 512]
    - [81, 0.56]
  - - [128, 256, 1, 1024, 128, 128, 1024, 1024]
    - [96, 0.947]
  - - [128, 256, 1, 2048, 128, 128, 2048, 2048]
    - [95, 1.324]
  - - [128, 256, 1, 4096, 128, 128, 4096, 4096]
    - [95, 1.644]
  - - [128, 256, 1, 8192, 128, 128, 8192, 8192]
    - [82, 2.341]
  - - [128, 512, 1, 128, 128, 128, 128, 128]
    - [76, 0.355]
  - - [128, 512, 1, 256, 128, 128, 256, 256]
    - [76, 0.635]
  - - [128, 512, 1, 512, 128, 128, 512, 512]
    - [74, 1.036]
  - - [128, 512, 1, 1024, 128, 128, 1024, 1024]
    - [73, 1.537]
  - - [128, 512, 1, 2048, 128, 128, 2048, 2048]
    - [93, 2.039]
  - - [128, 512, 1, 4096, 128, 128, 4096, 4096]
    - [88, 2.534]
  - - [128, 512, 1, 8192, 128, 128, 8192, 8192]
    - [90, 3.213]
  - - [128, 1024, 1, 128, 128, 128, 128, 128]
    - [66, 0.618]
  - - [128, 1024, 1, 256, 128, 128, 256, 256]
    - [71, 1.051]
  - - [128, 1024, 1, 512, 128, 128, 512, 512]
    - [65, 1.744]
  - - [128, 1024, 1, 1024, 128, 128, 1024, 1024]
    - [87, 2.474]
  - - [128, 1024, 1, 2048, 128, 128, 2048, 2048]
    - [82, 2.896]
  - - [128, 1024, 1, 4096, 128, 128, 4096, 4096]
    - [85, 3.626]
  - - [128, 1024, 1, 8192, 128, 128, 8192, 8192]
    - [24, 4.194]
  - - [128, 2048, 1, 128, 128, 128, 128, 128]
    - [50, 0.961]
  - - [128, 2048, 1, 256, 128, 128, 256, 256]
    - [50, 1.606]
  - - [128, 2048, 1, 512, 128, 128, 512, 512]
    - [56, 2.405]
  - - [128, 2048, 1, 1024, 128, 128, 1024, 1024]
    - [63, 3.178]
  - - [128, 2048, 1, 2048, 128, 128, 2048, 2048]
    - [55, 4.103]
  - - [128, 2048, 1, 4096, 128, 128, 4096, 4096]
    - [18, 4.836]
  - - [128, 2048, 1, 8192, 128, 128, 8192, 8192]
    - [19, 5.509]
  - - [128, 4096, 1, 128, 128, 128, 128, 128]
    - [0, 1.117]
  - - [128, 4096, 1, 256, 128, 128, 256, 256]
    - [16, 1.937]
  - - [128, 4096, 1, 512, 128, 128, 512, 512]
    - [39, 3.102]
  - - [128, 4096, 1, 1024, 128, 128, 1024, 1024]
    - [24, 4.327]
  - - [128, 4096, 1, 2048, 128, 128, 2048, 2048]
    - [16, 5.488]
  - - [128, 4096, 1, 4096, 128, 128, 4096, 4096]
    - [16, 6.179]
  - - [128, 4096, 1, 8192, 128, 128, 8192, 8192]
    - [27, 6.2]
  - - [128, 8192, 1, 128, 128, 128, 128, 128]
    - [16, 1.326]
  - - [128, 8192, 1, 256, 128, 128, 256, 256]
    - [16, 1.967]
  - - [128, 8192, 1, 512, 128, 128, 512, 512]
    - [18, 3.168]
  - - [128, 8192, 1, 1024, 128, 128, 1024, 1024]
    - [41, 4.452]
  - - [128, 8192, 1, 2048, 128, 128, 2048, 2048]
    - [16, 5.902]
  - - [128, 8192, 1, 4096, 128, 128, 4096, 4096]
    - [16, 6.773]
  - - [128, 8192, 1, 8192, 128, 128, 8192, 8192]
    - [21, 7.502]
  - - [256, 128, 1, 128, 256, 256, 128, 128]
    - [94, 0.171]
  - - [256, 128, 1, 256, 256, 256, 256, 256]
    - [81, 0.336]
  - - [256, 128, 1, 512, 256, 256, 512, 512]
    - [95, 0.565]
  - - [256, 128, 1, 1024, 256, 256, 1024, 1024]
    - [95, 0.945]
  - - [256, 128, 1, 2048, 256, 256, 2048, 2048]
    - [98, 1.284]
  - - [256, 128, 1, 4096, 256, 256, 4096, 4096]
    - [97, 1.621]
  - - [256, 128, 1, 8192, 256, 256, 8192, 8192]
    - [92, 2.352]
  - - [256, 256, 1, 128, 256, 256, 128, 128]
    - [78, 0.34]
  - - [256, 256, 1, 256, 256, 256, 256, 256]
    - [67, 0.567]
  - - [256, 256, 1, 512, 256, 256, 512, 512]
    - [73, 1.042]
  - - [256, 256, 1, 1024, 256, 256, 1024, 1024]
    - [72, 1.56]
  - - [256, 256, 1, 2048, 256, 256, 2048, 2048]
    - [73, 2.025]
  - - [256, 256, 1, 4096, 256, 256, 4096, 4096]
    - [82, 2.57]
  - - [256, 256, 1, 8192, 256, 256, 8192, 8192]
    - [88, 3.249]
  - - [256, 512, 1, 128, 256, 256, 128, 128]
    - [65, 0.617]
  - - [256, 512, 1, 256, 256, 256, 256, 256]
    - [67, 1.059]
  - - [256, 512, 1, 512, 256, 256, 512, 512]
    - [87, 1.695]
  - - [256, 512, 1, 1024, 256, 256, 1024, 1024]
    - [68, 2.453]
  - - [256, 512, 1, 2048, 256, 256, 2048, 2048]
    - [86, 3.186]
  - - [256, 512, 1, 4096, 256, 256, 4096, 4096]
    - [86, 3.681]
  - - [256, 512, 1, 8192, 256, 256, 8192, 8192]
    - [91, 3.993]
  - - [256, 1024, 1, 128, 256, 256, 128, 128]
    - [5, 0.954]
  - - [256, 1024, 1, 256, 256, 256, 256, 256]
    - [53, 1.656]
  - - [256, 1024, 1, 512, 256, 256, 512, 512]
    - [58, 2.589]
  - - [256, 1024, 1, 1024, 256, 256, 1024, 1024]
    - [59, 3.345]
  - - [256, 1024, 1, 2048, 256, 256, 2048, 2048]
    - [55, 4.199]
  - - [256, 1024, 1, 4096, 256, 256, 4096, 4096]
    - [44, 5.072]
  - - [256, 1024, 1, 8192, 256, 256, 8192, 8192]
    - [47, 5.964]
  - - [256, 2048, 1, 128, 256, 256, 128, 128]
    - [18, 1.192]
  - - [256, 2048, 1, 256, 256, 256, 256, 256]
    - [31, 1.84]
  - - [256, 2048, 1, 512, 256, 256, 512, 512]
    - [41, 3.267]
  - - [256, 2048, 1, 1024, 256, 256, 1024, 1024]
    - [16, 4.539]
  - - [256, 2048, 1, 2048, 256, 256, 2048, 2048]
    - [16, 5.693]
  - - [256, 2048, 1, 4096, 256, 256, 4096, 4096]
    - [34, 5.844]
  - - [256, 2048, 1, 8192, 256, 256, 8192, 8192]
    - [34, 6.455]
  - - [256, 4096, 1, 128, 256, 256, 128, 128]
    - [6, 1.242]
  - - [256, 4096, 1, 256, 256, 256, 256, 256]
    - [35, 1.99]
  - - [256, 4096, 1, 512, 256, 256, 512, 512]
    - [16, 3.109]
  - - [256, 4096, 1, 1024, 256, 256, 1024, 1024]
    - [47, 4.65]
  - - [256, 4096, 1, 2048, 256, 256, 2048, 2048]
    - [14, 5.729]
  - - [256, 4096, 1, 4096, 256, 256, 4096, 4096]
    - [64, 4.292]
  - - [256, 4096, 1, 8192, 256, 256, 8192, 8192]
    - [7, 4.949]
  - - [256, 8192, 1, 128, 256, 256, 128, 128]
    - [18, 1.495]
  - - [256, 8192, 1, 256, 256, 256, 256, 256]
    - [44, 2.6]
  - - [256, 8192, 1, 512, 256, 256, 512, 512]
    - [34, 3.846]
  - - [256, 8192, 1, 1024, 256, 256, 1024, 1024]
    - [33, 4.924]
  - - [256, 8192, 1, 2048, 256, 256, 2048, 2048]
    - [34, 6.486]
  - - [256, 8192, 1, 4096, 256, 256, 4096, 4096]
    - [21, 4.256]
  - - [256, 8192, 1, 8192, 256, 256, 8192, 8192]
    - [13, 6.179]
  - - [512, 128, 1, 128, 512, 512, 128, 128]
    - [77, 0.348]
  - - [512, 128, 1, 256, 512, 512, 256, 256]
    - [75, 0.632]
  - - [512, 128, 1, 512, 512, 512, 512, 512]
    - [72, 1.041]
  - - [512, 128, 1, 1024, 512, 512, 1024, 1024]
    - [93, 1.542]
  - - [512, 128, 1, 2048, 512, 512, 2048, 2048]
    - [93, 2.04]
  - - [512, 128, 1, 4096, 512, 512, 4096, 4096]
    - [84, 2.434]
  - - [512, 128, 1, 8192, 512, 512, 8192, 8192]
    - [85, 3.327]
  - - [512, 256, 1, 128, 512, 512, 128, 128]
    - [70, 0.603]
  - - [512, 256, 1, 256, 512, 512, 256, 256]
    - [67, 1.082]
  - - [512, 256, 1, 512, 512, 512, 512, 512]
    - [68, 1.704]
  - - [512, 256, 1, 1024, 512, 512, 1024, 1024]
    - [68, 2.464]
  - - [512, 256, 1, 2048, 512, 512, 2048, 2048]
    - [84, 3.145]
  - - [512, 256, 1, 4096, 512, 512, 4096, 4096]
    - [89, 3.649]
  - - [512, 256, 1, 8192, 512, 512, 8192, 8192]
    - [24, 4.423]
  - - [512, 512, 1, 128, 512, 512, 128, 128]
    - [57, 0.987]
  - - [512, 512, 1, 256, 512, 512, 256, 256]
    - [57, 1.68]
  - - [512, 512, 1, 512, 512, 512, 512, 512]
    - [55, 2.561]
  - - [512, 512, 1, 1024, 512, 512, 1024, 1024]
    - [57, 3.572]
  - - [512, 512, 1, 2048, 512, 512, 2048, 2048]
    - [57, 3.568]
  - - [512, 512, 1, 4096, 512, 512, 4096, 4096]
    - [21, 4.522]
  - - [512, 512, 1, 8192, 512, 512, 8192, 8192]
    - [49, 5.226]
  - - [512, 1024, 1, 128, 512, 512, 128, 128]
    - [4, 1.197]
  - - [512, 1024, 1, 256, 512, 512, 256, 256]
    - [40, 1.997]
  - - [512, 1024, 1, 512, 512, 512, 512, 512]
    - [22, 3.227]
  - - [512, 1024, 1, 1024, 512, 512, 1024, 1024]
    - [23, 4.395]
  - - [512, 1024, 1, 2048, 512, 512, 2048, 2048]
    - [9, 5.129]
  - - [512, 1024, 1, 4096, 512, 512, 4096, 4096]
    - [46, 5.559]
  - - [512, 1024, 1, 8192, 512, 512, 8192, 8192]
    - [41, 6.428]
  - - [512, 2048, 1, 128, 512, 512, 128, 128]
    - [41, 1.316]
  - - [512, 2048, 1, 256, 512, 512, 256, 256]
    - [37, 2.018]
  - - [512, 2048, 1, 512, 512, 512, 512, 512]
    - [34, 3.302]
  - - [512, 2048, 1, 1024, 512, 512, 1024, 1024]
    - [18, 4.633]
  - - [512, 2048, 1, 2048, 512, 512, 2048, 2048]
    - [44, 5.295]
  - - [512, 2048, 1, 4096, 512, 512, 4096, 4096]
    - [15, 5.358]
  - - [512, 2048, 1, 8192, 512, 512, 8192, 8192]
    - [17, 6.796]
  - - [512, 4096, 1, 128, 512, 512, 128, 128]
    - [64, 1.393]
  - - [512, 4096, 1, 256, 512, 512, 256, 256]
    - [21, 2.419]
  - - [512, 4096, 1, 512, 512, 512, 512, 512]
    - [21, 3.666]
  - - [512, 4096, 1, 1024, 512, 512, 1024, 1024]
    - [24, 5.399]
  - - [512, 4096, 1, 2048, 512, 512, 2048, 2048]
    - [34, 6.005]
  - - [512, 4096, 1, 4096, 512, 512, 4096, 4096]
    - [16, 7.194]
  - - [512, 4096, 1, 8192, 512, 512, 8192, 8192]
    - [44, 7.825]
  - - [512, 8192, 1, 128, 512, 512, 128, 128]
    - [18, 1.934]
  - - [512, 8192, 1, 256, 512, 512, 256, 256]
    - [47, 2.958]
  - - [512, 8192, 1, 512, 512, 512, 512, 512]
    - [47, 4.563]
  - - [512, 8192, 1, 1024, 512, 512, 1024, 1024]
    - [21, 5.869]
  - - [512, 8192, 1, 2048, 512, 512, 2048, 2048]
    - [8, 4.488]
  - - [512, 8192, 1, 4096, 512, 512, 4096, 4096]
    - [48, 5.305]
  - - [512, 8192, 1, 8192, 512, 512, 8192, 8192]
    - [69, 4.092]
  - - [1024, 128, 1, 128, 1024, 1024, 128, 128]
    - [67, 0.617]
  - - [1024, 128, 1, 256, 1024, 1024, 256, 256]
    - [67, 1.155]
  - - [1024, 128, 1, 512, 1024, 1024, 512, 512]
    - [87, 1.705]
  - - [1024, 128, 1, 1024, 1024, 1024, 1024, 1024]
    - [86, 2.487]
  - - [1024, 128, 1, 2048, 1024, 1024, 2048, 2048]
    - [83, 2.959]
  - - [1024, 128, 1, 4096, 1024, 1024, 4096, 4096]
    - [89, 3.617]
  - - [1024, 128, 1, 8192, 1024, 1024, 8192, 8192]
    - [44, 4.285]
  - - [1024, 256, 1, 128, 1024, 1024, 128, 128]
    - [55, 0.979]
  - - [1024, 256, 1, 256, 1024, 1024, 256, 256]
    - [52, 1.685]
  - - [1024, 256, 1, 512, 1024, 1024, 512, 512]
    - [50, 2.604]
  - - [1024, 256, 1, 1024, 1024, 1024, 1024, 1024]
    - [62, 3.075]
  - - [1024, 256, 1, 2048, 1024, 1024, 2048, 2048]
    - [61, 3.379]
  - - [1024, 256, 1, 4096, 1024, 1024, 4096, 4096]
    - [24, 4.752]
  - - [1024, 256, 1, 8192, 1024, 1024, 8192, 8192]
    - [24, 5.946]
  - - [1024, 512, 1, 128, 1024, 1024, 128, 128]
    - [2, 1.222]
  - - [1024, 512, 1, 256, 1024, 1024, 256, 256]
    - [24, 1.94]
  - - [1024, 512, 1, 512, 1024, 1024, 512, 512]
    - [15, 3.021]
  - - [1024, 512, 1, 1024, 1024, 1024, 1024, 1024]
    - [29, 4.194]
  - - [1024, 512, 1, 2048, 1024, 1024, 2048, 2048]
    - [37, 4.834]
  - - [1024, 512, 1, 4096, 1024, 1024, 4096, 4096]
    - [18, 5.827]
  - - [1024, 512, 1, 8192, 1024, 1024, 8192, 8192]
    - [16, 6.393]
  - - [1024, 1024, 1, 128, 1024, 1024, 128, 128]
    - [23, 1.337]
  - - [1024, 1024, 1, 256, 1024, 1024, 256, 256]
    - [18, 2.038]
  - - [1024, 1024, 1, 512, 1024, 1024, 512, 512]
    - [24, 3.329]
  - - [1024, 1024, 1, 1024, 1024, 1024, 1024, 1024]
    - [44, 4.705]
  - - [1024, 1024, 1, 2048, 1024, 1024, 2048, 2048]
    - [47, 5.343]
  - - [1024, 1024, 1, 4096, 1024, 1024, 4096, 4096]
    - [18, 6.234]
  - - [1024, 1024, 1, 8192, 1024, 1024, 8192, 8192]
    - [16, 6.107]
  - - [1024, 2048, 1, 128, 1024, 1024, 128, 128]
    - [2, 1.543]
  - - [1024, 2048, 1, 256, 1024, 1024, 256, 256]
    - [18, 2.629]
  - - [1024, 2048, 1, 512, 1024, 1024, 512, 512]
    - [23, 3.662]
  - - [1024, 2048, 1, 1024, 1024, 1024, 1024, 1024]
    - [47, 5.291]
  - - [1024, 2048, 1, 2048, 1024, 1024, 2048, 2048]
    - [45, 6.105]
  - - [1024, 2048, 1, 4096, 1024, 1024, 4096, 4096]
    - [34, 7.145]
  - - [1024, 2048, 1, 8192, 1024, 1024, 8192, 8192]
    - [44, 6.893]
  - - [1024, 4096, 1, 128, 1024, 1024, 128, 128]
    - [34, 1.738]
  - - [1024, 4096, 1, 256, 1024, 1024, 256, 256]
    - [24, 2.742]
  - - [1024, 4096, 1, 512, 1024, 1024, 512, 512]
    - [18, 4.428]
  - - [1024, 4096, 1, 1024, 1024, 1024, 1024, 1024]
    - [47, 5.549]
  - - [1024, 4096, 1, 2048, 1024, 1024, 2048, 2048]
    - [44, 6.277]
  - - [1024, 4096, 1, 4096, 1024, 1024, 4096, 4096]
    - [16, 7.157]
  - - [1024, 4096, 1, 8192, 1024, 1024, 8192, 8192]
    - [11, 6.228]
  - - [1024, 8192, 1, 128, 1024, 1024, 128, 128]
    - [3, 1.967]
  - - [1024, 8192, 1, 256, 1024, 1024, 256, 256]
    - [24, 3.366]
  - - [1024, 8192, 1, 512, 1024, 1024, 512, 512]
    - [21, 4.582]
  - - [1024, 8192, 1, 1024, 1024, 1024, 1024, 1024]
    - [47, 5.959]
  - - [1024, 8192, 1, 2048, 1024, 1024, 2048, 2048]
    - [45, 6.391]
  - - [1024, 8192, 1, 4096, 1024, 1024, 4096, 4096]
    - [34, 7.832]
  - - [1024, 8192, 1, 8192, 1024, 1024, 8192, 8192]
    - [46, 5.485]
  - - [2048, 128, 1, 128, 2048, 2048, 128, 128]
    - [58, 0.979]
  - - [2048, 128, 1, 256, 2048, 2048, 256, 256]
    - [51, 1.646]
  - - [2048, 128, 1, 512, 2048, 2048, 512, 512]
    - [54, 2.288]
  - - [2048, 128, 1, 1024, 2048, 2048, 1024, 1024]
    - [62, 2.828]
  - - [2048, 128, 1, 2048, 2048, 2048, 2048, 2048]
    - [50, 3.153]
  - - [2048, 128, 1, 4096, 2048, 2048, 4096, 4096]
    - [43, 4.228]
  - - [2048, 128, 1, 8192, 2048, 2048, 8192, 8192]
    - [24, 5.768]
  - - [2048, 256, 1, 128, 2048, 2048, 128, 128]
    - [22, 1.21]
  - - [2048, 256, 1, 256, 2048, 2048, 256, 256]
    - [21, 1.971]
  - - [2048, 256, 1, 512, 2048, 2048, 512, 512]
    - [29, 3.253]
  - - [2048, 256, 1, 1024, 2048, 2048, 1024, 1024]
    - [19, 4.089]
  - - [2048, 256, 1, 2048, 2048, 2048, 2048, 2048]
    - [38, 4.685]
  - - [2048, 256, 1, 4096, 2048, 2048, 4096, 4096]
    - [37, 5.541]
  - - [2048, 256, 1, 8192, 2048, 2048, 8192, 8192]
    - [20, 6.528]
  - - [2048, 512, 1, 128, 2048, 2048, 128, 128]
    - [19, 1.359]
  - - [2048, 512, 1, 256, 2048, 2048, 256, 256]
    - [22, 2.024]
  - - [2048, 512, 1, 512, 2048, 2048, 512, 512]
    - [24, 3.269]
  - - [2048, 512, 1, 1024, 2048, 2048, 1024, 1024]
    - [22, 4.511]
  - - [2048, 512, 1, 2048, 2048, 2048, 2048, 2048]
    - [23, 5.322]
  - - [2048, 512, 1, 4096, 2048, 2048, 4096, 4096]
    - [24, 6.205]
  - - [2048, 512, 1, 8192, 2048, 2048, 8192, 8192]
    - [20, 5.314]
  - - [2048, 1024, 1, 128, 2048, 2048, 128, 128]
    - [57, 1.597]
  - - [2048, 1024, 1, 256, 2048, 2048, 256, 256]
    - [18, 2.671]
  - - [2048, 1024, 1, 512, 2048, 2048, 512, 512]
    - [41, 3.698]
  - - [2048, 1024, 1, 1024, 2048, 2048, 1024, 1024]
    - [42, 5.116]
  - - [2048, 1024, 1, 2048, 2048, 2048, 2048, 2048]
    - [39, 5.804]
  - - [2048, 1024, 1, 4096, 2048, 2048, 4096, 4096]
    - [41, 7.018]
  - - [2048, 1024, 1, 8192, 2048, 2048, 8192, 8192]
    - [20, 7.69]
  - - [2048, 2048, 1, 128, 2048, 2048, 128, 128]
    - [22, 1.786]
  - - [2048, 2048, 1, 256, 2048, 2048, 256, 256]
    - [45, 2.764]
  - - [2048, 2048, 1, 512, 2048, 2048, 512, 512]
    - [34, 4.418]
  - - [2048, 2048, 1, 1024, 2048, 2048, 1024, 1024]
    - [42, 5.332]
  - - [2048, 2048, 1, 2048, 2048, 2048, 2048, 2048]
    - [39, 6.224]
  - - [2048, 2048, 1, 4096, 2048, 2048, 4096, 4096]
    - [39, 7.531]
  - - [2048, 2048, 1, 8192, 2048, 2048, 8192, 8192]
    - [30, 7.76]
  - - [2048, 4096, 1, 128, 2048, 2048, 128, 128]
    - [1, 2.016]
  - - [2048, 4096, 1, 256, 2048, 2048, 256, 256]
    - [21, 3.295]
  - - [2048, 4096, 1, 512, 2048, 2048, 512, 512]
    - [44, 4.771]
  - - [2048, 4096, 1, 1024, 2048, 2048, 1024, 1024]
    - [44, 6.012]
  - - [2048, 4096, 1, 2048, 2048, 2048, 2048, 2048]
    - [42, 6.725]
  - - [2048, 4096, 1, 4096, 2048, 2048, 4096, 4096]
    - [39, 7.639]
  - - [2048, 4096, 1, 8192, 2048, 2048, 8192, 8192]
    - [39, 8.441]
  - - [2048, 8192, 1, 128, 2048, 2048, 128, 128]
    - [48, 2.129]
  - - [2048, 8192, 1, 256, 2048, 2048, 256, 256]
    - [21, 3.519]
  - - [2048, 8192, 1, 512, 2048, 2048, 512, 512]
    - [41, 4.846]
  - - [2048, 8192, 1, 1024, 2048, 2048, 1024, 1024]
    - [29, 5.79]
  - - [2048, 8192, 1, 2048, 2048, 2048, 2048, 2048]
    - [41, 6.846]
  - - [2048, 8192, 1, 4096, 2048, 2048, 4096, 4096]
    - [37, 7.684]
  - - [2048, 8192, 1, 8192, 2048, 2048, 8192, 8192]
    - [20, 6.05]
  - - [4096, 128, 1, 128, 4096, 4096, 128, 128]
    - [3, 1.178]
  - - [4096, 128, 1, 256, 4096, 4096, 256, 256]
    - [40, 1.949]
  - - [4096, 128, 1, 512, 4096, 4096, 512, 512]
    - [32, 2.948]
  - - [4096, 128, 1, 1024, 4096, 4096, 1024, 1024]
    - [18, 3.669]
  - - [4096, 128, 1, 2048, 4096, 4096, 2048, 2048]
    - [25, 4.327]
  - - [4096, 128, 1, 4096, 4096, 4096, 4096, 4096]
    - [30, 5.615]
  - - [4096, 128, 1, 8192, 4096, 4096, 8192, 8192]
    - [21, 6.934]
  - - [4096, 256, 1, 128, 4096, 4096, 128, 128]
    - [12, 1.335]
  - - [4096, 256, 1, 256, 4096, 4096, 256, 256]
    - [28, 1.993]
  - - [4096, 256, 1, 512, 4096, 4096, 512, 512]
    - [21, 3.078]
  - - [4096, 256, 1, 1024, 4096, 4096, 1024, 1024]
    - [16, 4.678]
  - - [4096, 256, 1, 2048, 4096, 4096, 2048, 2048]
    - [18, 6.129]
  - - [4096, 256, 1, 4096, 4096, 4096, 4096, 4096]
    - [18, 6.884]
  - - [4096, 256, 1, 8192, 4096, 4096, 8192, 8192]
    - [18, 7.806]
  - - [4096, 512, 1, 128, 4096, 4096, 128, 128]
    - [60, 1.514]
  - - [4096, 512, 1, 256, 4096, 4096, 256, 256]
    - [24, 2.608]
  - - [4096, 512, 1, 512, 4096, 4096, 512, 512]
    - [44, 3.699]
  - - [4096, 512, 1, 1024, 4096, 4096, 1024, 1024]
    - [41, 4.562]
  - - [4096, 512, 1, 2048, 4096, 4096, 2048, 2048]
    - [19, 5.478]
  - - [4096, 512, 1, 4096, 4096, 4096, 4096, 4096]
    - [44, 6.942]
  - - [4096, 512, 1, 8192, 4096, 4096, 8192, 8192]
    - [31, 7.714]
  - - [4096, 1024, 1, 128, 4096, 4096, 128, 128]
    - [12, 1.915]
  - - [4096, 1024, 1, 256, 4096, 4096, 256, 256]
    - [18, 2.948]
  - - [4096, 1024, 1, 512, 4096, 4096, 512, 512]
    - [44, 4.429]
  - - [4096, 1024, 1, 1024, 4096, 4096, 1024, 1024]
    - [41, 5.693]
  - - [4096, 1024, 1, 2048, 4096, 4096, 2048, 2048]
    - [39, 6.229]
  - - [4096, 1024, 1, 4096, 4096, 4096, 4096, 4096]
    - [42, 6.699]
  - - [4096, 1024, 1, 8192, 4096, 4096, 8192, 8192]
    - [36, 8.067]
  - - [4096, 2048, 1, 128, 4096, 4096, 128, 128]
    - [18, 2.103]
  - - [4096, 2048, 1, 256, 4096, 4096, 256, 256]
    - [21, 3.273]
  - - [4096, 2048, 1, 512, 4096, 4096, 512, 512]
    - [44, 4.753]
  - - [4096, 2048, 1, 1024, 4096, 4096, 1024, 1024]
    - [47, 6.0]
  - - [4096, 2048, 1, 2048, 4096, 4096, 2048, 2048]
    - [46, 6.667]
  - - [4096, 2048, 1, 4096, 4096, 4096, 4096, 4096]
    - [37, 7.449]
  - - [4096, 2048, 1, 8192, 4096, 4096, 8192, 8192]
    - [35, 8.452]
  - - [4096, 4096, 1, 128, 4096, 4096, 128, 128]
    - [10, 2.186]
  - - [4096, 4096, 1, 256, 4096, 4096, 256, 256]
    - [19, 3.38]
  - - [4096, 4096, 1, 512, 4096, 4096, 512, 512]
    - [44, 4.905]
  - - [4096, 4096, 1, 1024, 4096, 4096, 1024, 1024]
    - [45, 5.96]
  - - [4096, 4096, 1, 2048, 4096, 4096, 2048, 2048]
    - [45, 6.899]
  - - [4096, 4096, 1, 4096, 4096, 4096, 4096, 4096]
    - [29, 7.745]
  - - [4096, 4096, 1, 8192, 4096, 4096, 8192, 8192]
    - [47, 8.235]
  - - [4096, 8192, 1, 128, 4096, 4096, 128, 128]
    - [25, 2.209]
  - - [4096, 8192, 1, 256, 4096, 4096, 256, 256]
    - [19, 3.227]
  - - [4096, 8192, 1, 512, 4096, 4096, 512, 512]
    - [39, 4.41]
  - - [4096, 8192, 1, 1024, 4096, 4096, 1024, 1024]
    - [41, 5.601]
  - - [4096, 8192, 1, 2048, 4096, 4096, 2048, 2048]
    - [43, 6.747]
  - - [4096, 8192, 1, 4096, 4096, 4096, 4096, 4096]
    - [33, 6.743]
  - - [4096, 8192, 1, 8192, 4096, 4096, 8192, 8192]
    - [47, 7.504]
  - - [8192, 128, 1, 128, 8192, 8192, 128, 128]
    - [18, 1.36]
  - - [8192, 128, 1, 256, 8192, 8192, 256, 256]
    - [21, 2.012]
  - - [8192, 128, 1, 512, 8192, 8192, 512, 512]
    - [18, 3.176]
  - - [8192, 128, 1, 1024, 8192, 8192, 1024, 1024]
    - [18, 4.504]
  - - [8192, 128, 1, 2048, 8192, 8192, 2048, 2048]
    - [24, 5.582]
  - - [8192, 128, 1, 4096, 8192, 8192, 4096, 4096]
    - [24, 6.694]
  - - [8192, 128, 1, 8192, 8192, 8192, 8192, 8192]
    - [34, 7.61]
  - - [8192, 256, 1, 128, 8192, 8192, 128, 128]
    - [21, 1.544]
  - - [8192, 256, 1, 256, 8192, 8192, 256, 256]
    - [18, 2.624]
  - - [8192, 256, 1, 512, 8192, 8192, 512, 512]
    - [31, 3.704]
  - - [8192, 256, 1, 1024, 8192, 8192, 1024, 1024]
    - [44, 4.696]
  - - [8192, 256, 1, 2048, 8192, 8192, 2048, 2048]
    - [41, 5.475]
  - - [8192, 256, 1, 4096, 8192, 8192, 4096, 4096]
    - [41, 6.903]
  - - [8192, 256, 1, 8192, 8192, 8192, 8192, 8192]
    - [37, 7.954]
  - - [8192, 512, 1, 128, 8192, 8192, 128, 128]
    - [21, 1.895]
  - - [8192, 512, 1, 256, 8192, 8192, 256, 256]
    - [18, 2.882]
  - - [8192, 512, 1, 512, 8192, 8192, 512, 512]
    - [47, 4.273]
  - - [8192, 512, 1, 1024, 8192, 8192, 1024, 1024]
    - [31, 5.411]
  - - [8192, 512, 1, 2048, 8192, 8192, 2048, 2048]
    - [41, 6.179]
  - - [8192, 512, 1, 4096, 8192, 8192, 4096, 4096]
    - [46, 7.356]
  - - [8192, 512, 1, 8192, 8192, 8192, 8192, 8192]
    - [34, 7.32]
  - - [8192, 1024, 1, 128, 8192, 8192, 128, 128]
    - [47, 1.99]
  - - [8192, 1024, 1, 256, 8192, 8192, 256, 256]
    - [31, 3.172]
  - - [8192, 1024, 1, 512, 8192, 8192, 512, 512]
    - [41, 4.754]
  - - [8192, 1024, 1, 1024, 8192, 8192, 1024, 1024]
    - [44, 5.87]
  - - [8192, 1024, 1, 2048, 8192, 8192, 2048, 2048]
    - [47, 6.661]
  - - [8192, 1024, 1, 4096, 8192, 8192, 4096, 4096]
    - [44, 8.033]
  - - [8192, 1024, 1, 8192, 8192, 8192, 8192, 8192]
    - [41, 8.646]
  - - [8192, 2048, 1, 128, 8192, 8192, 128, 128]
    - [28, 2.206]
  - - [8192, 2048, 1, 256, 8192, 8192, 256, 256]
    - [31, 3.34]
  - - [8192, 2048, 1, 512, 8192, 8192, 512, 512]
    - [41, 4.993]
  - - [8192, 2048, 1, 1024, 8192, 8192, 1024, 1024]
    - [41, 6.031]
  - - [8192, 2048, 1, 2048, 8192, 8192, 2048, 2048]
    - [44, 6.774]
  - - [8192, 2048, 1, 4096, 8192, 8192, 4096, 4096]
    - [42, 7.951]
  - - [8192, 2048, 1, 8192, 8192, 8192, 8192, 8192]
    - [34, 7.929]
  - - [8192, 4096, 1, 128, 8192, 8192, 128, 128]
    - [26, 2.159]
  - - [8192, 4096, 1, 256, 8192, 8192, 256, 256]
    - [18, 3.222]
  - - [8192, 4096, 1, 512, 8192, 8192, 512, 512]
    - [34, 4.567]
  - - [8192, 4096, 1, 1024, 8192, 8192, 1024, 1024]
    - [39, 5.665]
  - - [8192, 4096, 1, 2048, 8192, 8192, 2048, 2048]
    - [41, 6.454]
  - - [8192, 4096, 1, 4096, 8192, 8192, 4096, 4096]
    - [32, 7.414]
  - - [8192, 4096, 1, 8192, 8192, 8192, 8192, 8192]
    - [34, 8.033]
  - - [8192, 8192, 1, 128, 8192, 8192, 128, 128]
    - [4, 1.811]
  - - [8192, 8192, 1, 256, 8192, 8192, 256, 256]
    - [24, 2.879]
  - - [8192, 8192, 1, 512, 8192, 8192, 512, 512]
    - [32, 4.356]
  - - [8192, 8192, 1, 1024, 8192, 8192, 1024, 1024]
    - [41, 5.312]
  - - [8192, 8192, 1, 2048, 8192, 8192, 2048, 2048]
    - [32, 6.32]
  - - [8192, 8192, 1, 4096, 8192, 8192, 4096, 4096]
    - [31, 7.589]
  - - [8192, 8192, 1, 8192, 8192, 8192, 8192, 8192]
    - [36, 7.396]
  - - [1, 1, 1, 32, 1, 1, 32, 32]
    - [99, 0.0]
- null
- null
- ExperimentalStreamK
- GridBased
