library/src/amd_detail/rocblaslt/src/Tensile/Logic/asm_full/aquavanjaram/gfx942_38cu/StreamK/aquavanjaram942_Cijk_Alik_Bjlk_BSS_BH_UserArgs.yaml
- {MinimumRequiredVersion: 4.33.0}
- aquavanjaram942
- {Architecture: gfx942, CUCount: 38}
- [Device 0049, Device 0050]
    SolutionIndex: 0
    SolutionNameMin: Cijk_Alik_Bjlk_BSS_BH_UserArgs_MT256x256x32_MI16x16x1_SN_LDSB1_CLR1_GSU0_GSUC0_GSUWGMRR0_K1_LBSPPA128_LBSPPB2048_LPB16_MIWT8_8_PLR1_SU32_SUM0_SUS256_VWA1_VWB1_WGM1_WGMXCC1_WGMXCCGn1
    SolutionIndex: 1
    SolutionNameMin: Cijk_Alik_Bjlk_BSS_BH_UserArgs_MT256x256x32_MI16x16x1_SN_LDSB1_CLR1_GSU0_GSUC0_GSUWGMRR0_K1_LBSPPA128_LBSPPB2048_LPB16_MIWT8_8_PLR1_SU32_SUM0_SUS256_VWA2_VWB1_WGM1_WGMXCC1_WGMXCCGn1
    SolutionIndex: 2
    SolutionNameMin: Cijk_Alik_Bjlk_BSS_BH_UserArgs_MT256x256x32_MI16x16x1_SN_LDSB1_CLR1_GSU0_GSUC0_GSUWGMRR0_K1_LBSPPA128_LBSPPB2048_LPB32_MIWT8_8_PLR1_SU32_SUM0_SUS256_VWA1_VWB2_WGM1_WGMXCC1_WGMXCCGn1
    SolutionIndex: 3
    SolutionNameMin: Cijk_Alik_Bjlk_BSS_BH_UserArgs_MT256x256x32_MI16x16x1_SN_LDSB1_CLR1_GSU0_GSUC0_GSUWGMRR0_K1_LBSPPA256_LBSPPB2048_LPB32_MIWT8_8_PLR1_SU32_SUM0_SUS256_VWA4_VWB2_WGM1_WGMXCC1_WGMXCCGn1
    SolutionIndex: 4
    SolutionNameMin: Cijk_Alik_Bjlk_BSS_BH_UserArgs_MT256x256x32_MI16x16x1_SN_LDSB1_CLR1_GSU0_GSUC0_GSUWGMRR0_K1_LBSPPA128_LBSPPB2048_LPB0_MIWT8_8_PLR1_SU32_SUM0_SUS256_VWA1_VWB4_WGM1_WGMXCC1_WGMXCCGn1
    SolutionIndex: 5
    SolutionNameMin: Cijk_Alik_Bjlk_BSS_BH_UserArgs_MT256x256x32_MI16x16x1_SN_LDSB1_CLR1_GSU0_GSUC0_GSUWGMRR0_K1_LBSPPA128_LBSPPB2048_LPB0_MIWT8_8_PLR1_SU32_SUM0_SUS256_VWA2_VWB4_WGM1_WGMXCC1_WGMXCCGn1
    SolutionIndex: 6
    SolutionNameMin: Cijk_Alik_Bjlk_BSS_BH_UserArgs_MT256x256x32_MI16x16x1_SN_LDSB1_CLR1_GSU0_GSUC0_GSUWGMRR0_K1_LBSPPA256_LBSPPB2048_LPB0_MIWT8_8_PLR1_SU32_SUM0_SUS256_VWA4_VWB4_WGM1_WGMXCC1_WGMXCCGn1
    SolutionIndex: 7
    SolutionNameMin: Cijk_Alik_Bjlk_BSS_BH_UserArgs_MT256x256x32_MI16x16x1_SN_LDSB1_CLR1_GSU0_GSUC0_GSUWGMRR0_K1_LBSPPA128_LBSPPB2048_LPB0_MIWT8_8_PLR1_SU32_SUM0_SUS256_VWA1_VWB8_WGM1_WGMXCC1_WGMXCCGn1
    SolutionIndex: 8
    SolutionNameMin: Cijk_Alik_Bjlk_BSS_BH_UserArgs_MT256x256x32_MI16x16x1_SN_LDSB1_CLR1_GSU0_GSUC0_GSUWGMRR0_K1_LBSPPA128_LBSPPB2048_LPB0_MIWT8_8_PLR1_SU32_SUM0_SUS256_VWA2_VWB8_WGM1_WGMXCC1_WGMXCCGn1
    SolutionIndex: 9
    SolutionNameMin: Cijk_Alik_Bjlk_BSS_BH_UserArgs_MT256x256x32_MI16x16x1_SN_LDSB1_CLR1_GSU0_GSUC0_GSUWGMRR0_K1_LBSPPA256_LBSPPB2048_LPB0_MIWT8_8_PLR1_SU32_SUM0_SUS256_VWA4_VWB8_WGM1_WGMXCC1_WGMXCCGn1
    SolutionIndex: 10
    SolutionNameMin: Cijk_Alik_Bjlk_BSS_BH_UserArgs_MT256x256x32_MI16x16x1_SN_LDSB1_CLR1_GSU0_GSUC0_GSUWGMRR0_K1_LBSPPA256_LBSPPB2048_LPB16_MIWT8_8_PLR1_SU32_SUM0_SUS256_VWA4_VWB1_WGM4_WGMXCC1_WGMXCCGn1
    SolutionIndex: 11
    SolutionNameMin: Cijk_Alik_Bjlk_BSS_BH_UserArgs_MT256x256x32_MI16x16x1_SN_LDSB1_CLR1_GSU0_GSUC0_GSUWGMRR0_K1_LBSPPA256_LBSPPB2048_LPB32_MIWT8_8_PLR1_SU32_SUM0_SUS256_VWA4_VWB2_WGM4_WGMXCC1_WGMXCCGn1
    SolutionIndex: 12
    SolutionNameMin: Cijk_Alik_Bjlk_BSS_BH_UserArgs_MT256x256x32_MI16x16x1_SN_LDSB1_CLR1_GSU0_GSUC0_GSUWGMRR0_K1_LBSPPA128_LBSPPB2048_LPB0_MIWT8_8_PLR1_SU32_SUM0_SUS256_VWA1_VWB4_WGM4_WGMXCC1_WGMXCCGn1
    SolutionIndex: 13
    SolutionNameMin: Cijk_Alik_Bjlk_BSS_BH_UserArgs_MT256x256x32_MI16x16x1_SN_LDSB1_CLR1_GSU0_GSUC0_GSUWGMRR0_K1_LBSPPA128_LBSPPB2048_LPB0_MIWT8_8_PLR1_SU32_SUM0_SUS256_VWA2_VWB4_WGM4_WGMXCC1_WGMXCCGn1
    SolutionIndex: 14
    SolutionNameMin: Cijk_Alik_Bjlk_BSS_BH_UserArgs_MT256x256x32_MI16x16x1_SN_LDSB1_CLR1_GSU0_GSUC0_GSUWGMRR0_K1_LBSPPA256_LBSPPB2048_LPB0_MIWT8_8_PLR1_SU32_SUM0_SUS256_VWA4_VWB4_WGM4_WGMXCC1_WGMXCCGn1
    SolutionIndex: 15
    SolutionNameMin: Cijk_Alik_Bjlk_BSS_BH_UserArgs_MT256x256x32_MI16x16x1_SN_LDSB1_CLR1_GSU0_GSUC0_GSUWGMRR0_K1_LBSPPA512_LBSPPB2048_LPB0_MIWT8_8_PLR1_SU32_SUM0_SUS256_VWA8_VWB4_WGM4_WGMXCC1_WGMXCCGn1
    SolutionIndex: 16
    SolutionNameMin: Cijk_Alik_Bjlk_BSS_BH_UserArgs_MT256x256x32_MI16x16x1_SN_LDSB1_CLR1_GSU0_GSUC0_GSUWGMRR0_K1_LBSPPA128_LBSPPB2048_LPB0_MIWT8_8_PLR1_SU32_SUM0_SUS256_VWA1_VWB8_WGM4_WGMXCC1_WGMXCCGn1
    SolutionIndex: 17
    SolutionNameMin: Cijk_Alik_Bjlk_BSS_BH_UserArgs_MT256x256x32_MI16x16x1_SN_LDSB1_CLR1_GSU0_GSUC0_GSUWGMRR0_K1_LBSPPA128_LBSPPB2048_LPB0_MIWT8_8_PLR1_SU32_SUM0_SUS256_VWA2_VWB8_WGM4_WGMXCC1_WGMXCCGn1
    SolutionIndex: 18
    SolutionNameMin: Cijk_Alik_Bjlk_BSS_BH_UserArgs_MT256x256x32_MI16x16x1_SN_LDSB1_CLR1_GSU0_GSUC0_GSUWGMRR0_K1_LBSPPA256_LBSPPB2048_LPB0_MIWT8_8_PLR1_SU32_SUM0_SUS256_VWA4_VWB8_WGM4_WGMXCC1_WGMXCCGn1
    SolutionIndex: 19
    SolutionNameMin: Cijk_Alik_Bjlk_BSS_BH_UserArgs_MT256x256x32_MI16x16x1_SN_LDSB1_CLR1_GSU0_GSUC0_GSUWGMRR0_K1_LBSPPA256_LBSPPB2048_LPB16_MIWT8_8_PLR1_SU32_SUM0_SUS256_VWA4_VWB1_WGM8_WGMXCC1_WGMXCCGn1
    SolutionIndex: 20
    SolutionNameMin: Cijk_Alik_Bjlk_BSS_BH_UserArgs_MT256x256x32_MI16x16x1_SN_LDSB1_CLR1_GSU0_GSUC0_GSUWGMRR0_K1_LBSPPA128_LBSPPB2048_LPB32_MIWT8_8_PLR1_SU32_SUM0_SUS256_VWA2_VWB2_WGM8_WGMXCC1_WGMXCCGn1
    SolutionIndex: 21
    SolutionNameMin: Cijk_Alik_Bjlk_BSS_BH_UserArgs_MT256x256x32_MI16x16x1_SN_LDSB1_CLR1_GSU0_GSUC0_GSUWGMRR0_K1_LBSPPA256_LBSPPB2048_LPB32_MIWT8_8_PLR1_SU32_SUM0_SUS256_VWA4_VWB2_WGM8_WGMXCC1_WGMXCCGn1
    SolutionIndex: 22
    SolutionNameMin: Cijk_Alik_Bjlk_BSS_BH_UserArgs_MT256x256x32_MI16x16x1_SN_LDSB1_CLR1_GSU0_GSUC0_GSUWGMRR0_K1_LBSPPA128_LBSPPB2048_LPB0_MIWT8_8_PLR1_SU32_SUM0_SUS256_VWA1_VWB4_WGM8_WGMXCC1_WGMXCCGn1
    SolutionIndex: 23
    SolutionNameMin: Cijk_Alik_Bjlk_BSS_BH_UserArgs_MT256x256x32_MI16x16x1_SN_LDSB1_CLR1_GSU0_GSUC0_GSUWGMRR0_K1_LBSPPA128_LBSPPB2048_LPB0_MIWT8_8_PLR1_SU32_SUM0_SUS256_VWA2_VWB4_WGM8_WGMXCC1_WGMXCCGn1
    SolutionIndex: 24
    SolutionNameMin: Cijk_Alik_Bjlk_BSS_BH_UserArgs_MT256x256x32_MI16x16x1_SN_LDSB1_CLR1_GSU0_GSUC0_GSUWGMRR0_K1_LBSPPA256_LBSPPB2048_LPB0_MIWT8_8_PLR1_SU32_SUM0_SUS256_VWA4_VWB4_WGM8_WGMXCC1_WGMXCCGn1
    SolutionIndex: 25
    SolutionNameMin: Cijk_Alik_Bjlk_BSS_BH_UserArgs_MT256x256x32_MI16x16x1_SN_LDSB1_CLR1_GSU0_GSUC0_GSUWGMRR0_K1_LBSPPA512_LBSPPB2048_LPB0_MIWT8_8_PLR1_SU32_SUM0_SUS256_VWA8_VWB4_WGM8_WGMXCC1_WGMXCCGn1
    SolutionIndex: 26
    SolutionNameMin: Cijk_Alik_Bjlk_BSS_BH_UserArgs_MT256x256x32_MI16x16x1_SN_LDSB1_CLR1_GSU0_GSUC0_GSUWGMRR0_K1_LBSPPA128_LBSPPB2048_LPB0_MIWT8_8_PLR1_SU32_SUM0_SUS256_VWA1_VWB8_WGM8_WGMXCC1_WGMXCCGn1
    SolutionIndex: 27
    SolutionNameMin: Cijk_Alik_Bjlk_BSS_BH_UserArgs_MT256x256x32_MI16x16x1_SN_LDSB1_CLR1_GSU0_GSUC0_GSUWGMRR0_K1_LBSPPA256_LBSPPB2048_LPB0_MIWT8_8_PLR1_SU32_SUM0_SUS256_VWA4_VWB8_WGM8_WGMXCC1_WGMXCCGn1
    SolutionIndex: 28
    SolutionNameMin: Cijk_Alik_Bjlk_BSS_BH_UserArgs_MT128x256x32_MI16x16x1_SN_LDSB1_CLR1_GSU0_GSUC0_GSUWGMRR0_K1_LBSPPA128_LBSPPB2048_LPB32_MIWT4_8_PLR1_SU32_SUM0_SUS256_VWA2_VWB2_WGM1_WGMXCC1_WGMXCCGn1
    SolutionIndex: 29
    SolutionNameMin: Cijk_Alik_Bjlk_BSS_BH_UserArgs_MT128x256x32_MI16x16x1_SN_LDSB1_CLR1_GSU0_GSUC0_GSUWGMRR0_K1_LBSPPA256_LBSPPB2048_LPB32_MIWT4_8_PLR1_SU32_SUM0_SUS256_VWA4_VWB2_WGM1_WGMXCC1_WGMXCCGn1
    SolutionIndex: 30
    SolutionNameMin: Cijk_Alik_Bjlk_BSS_BH_UserArgs_MT128x256x32_MI16x16x1_SN_LDSB1_CLR1_GSU0_GSUC0_GSUWGMRR0_K1_LBSPPA256_LBSPPB2048_LPB0_MIWT4_8_PLR1_SU32_SUM0_SUS256_VWA4_VWB4_WGM1_WGMXCC1_WGMXCCGn1
    SolutionIndex: 31
    SolutionNameMin: Cijk_Alik_Bjlk_BSS_BH_UserArgs_MT128x256x32_MI16x16x1_SN_LDSB1_CLR1_GSU0_GSUC0_GSUWGMRR0_K1_LBSPPA128_LBSPPB2048_LPB0_MIWT4_8_PLR1_SU32_SUM0_SUS256_VWA1_VWB8_WGM1_WGMXCC1_WGMXCCGn1
    SolutionIndex: 32
    SolutionNameMin: Cijk_Alik_Bjlk_BSS_BH_UserArgs_MT128x256x32_MI16x16x1_SN_LDSB1_CLR1_GSU0_GSUC0_GSUWGMRR0_K1_LBSPPA128_LBSPPB2048_LPB0_MIWT4_8_PLR1_SU32_SUM0_SUS256_VWA2_VWB8_WGM1_WGMXCC1_WGMXCCGn1
    SolutionIndex: 33
    SolutionNameMin: Cijk_Alik_Bjlk_BSS_BH_UserArgs_MT128x256x32_MI16x16x1_SN_LDSB1_CLR1_GSU0_GSUC0_GSUWGMRR0_K1_LBSPPA256_LBSPPB2048_LPB0_MIWT4_8_PLR1_SU32_SUM0_SUS256_VWA4_VWB8_WGM1_WGMXCC1_WGMXCCGn1
    SolutionIndex: 34
    SolutionNameMin: Cijk_Alik_Bjlk_BSS_BH_UserArgs_MT128x256x32_MI16x16x1_SN_LDSB1_CLR1_GSU0_GSUC0_GSUWGMRR0_K1_LBSPPA128_LBSPPB2048_LPB32_MIWT4_8_PLR1_SU32_SUM0_SUS256_VWA2_VWB2_WGM4_WGMXCC1_WGMXCCGn1
    SolutionIndex: 35
    SolutionNameMin: Cijk_Alik_Bjlk_BSS_BH_UserArgs_MT128x256x32_MI16x16x1_SN_LDSB1_CLR1_GSU0_GSUC0_GSUWGMRR0_K1_LBSPPA256_LBSPPB2048_LPB32_MIWT4_8_PLR1_SU32_SUM0_SUS256_VWA4_VWB2_WGM4_WGMXCC1_WGMXCCGn1
    SolutionIndex: 36
    SolutionNameMin: Cijk_Alik_Bjlk_BSS_BH_UserArgs_MT128x256x32_MI16x16x1_SN_LDSB1_CLR1_GSU0_GSUC0_GSUWGMRR0_K1_LBSPPA256_LBSPPB2048_LPB0_MIWT4_8_PLR1_SU32_SUM0_SUS256_VWA4_VWB4_WGM4_WGMXCC1_WGMXCCGn1
    SolutionIndex: 37
    SolutionNameMin: Cijk_Alik_Bjlk_BSS_BH_UserArgs_MT128x256x32_MI16x16x1_SN_LDSB1_CLR1_GSU0_GSUC0_GSUWGMRR0_K1_LBSPPA256_LBSPPB2048_LPB0_MIWT4_8_PLR1_SU32_SUM0_SUS256_VWA4_VWB8_WGM4_WGMXCC1_WGMXCCGn1
    SolutionIndex: 38
    SolutionNameMin: Cijk_Alik_Bjlk_BSS_BH_UserArgs_MT128x256x32_MI16x16x1_SN_LDSB1_CLR1_GSU0_GSUC0_GSUWGMRR0_K1_LBSPPA256_LBSPPB2048_LPB16_MIWT4_8_PLR1_SU32_SUM0_SUS256_VWA4_VWB1_WGM8_WGMXCC1_WGMXCCGn1
    SolutionIndex: 39
    SolutionNameMin: Cijk_Alik_Bjlk_BSS_BH_UserArgs_MT128x256x32_MI16x16x1_SN_LDSB1_CLR1_GSU0_GSUC0_GSUWGMRR0_K1_LBSPPA256_LBSPPB2048_LPB32_MIWT4_8_PLR1_SU32_SUM0_SUS256_VWA4_VWB2_WGM8_WGMXCC1_WGMXCCGn1
    SolutionIndex: 40
    SolutionNameMin: Cijk_Alik_Bjlk_BSS_BH_UserArgs_MT128x256x32_MI16x16x1_SN_LDSB1_CLR1_GSU0_GSUC0_GSUWGMRR0_K1_LBSPPA128_LBSPPB2048_LPB0_MIWT4_8_PLR1_SU32_SUM0_SUS256_VWA2_VWB4_WGM8_WGMXCC1_WGMXCCGn1
    SolutionIndex: 41
    SolutionNameMin: Cijk_Alik_Bjlk_BSS_BH_UserArgs_MT128x256x32_MI16x16x1_SN_LDSB1_CLR1_GSU0_GSUC0_GSUWGMRR0_K1_LBSPPA256_LBSPPB2048_LPB0_MIWT4_8_PLR1_SU32_SUM0_SUS256_VWA4_VWB4_WGM8_WGMXCC1_WGMXCCGn1
    SolutionIndex: 42
    SolutionNameMin: Cijk_Alik_Bjlk_BSS_BH_UserArgs_MT128x256x32_MI16x16x1_SN_LDSB1_CLR1_GSU0_GSUC0_GSUWGMRR0_K1_LBSPPA256_LBSPPB2048_LPB0_MIWT4_8_PLR1_SU32_SUM0_SUS256_VWA4_VWB8_WGM8_WGMXCC1_WGMXCCGn1
    SolutionIndex: 43
    SolutionNameMin: Cijk_Alik_Bjlk_BSS_BH_UserArgs_MT256x128x32_MI16x16x1_SN_LDSB1_CLR1_GSU0_GSUC0_GSUWGMRR0_K1_LBSPPA256_LBSPPB1024_LPB0_MIWT8_4_PLR1_SU32_SUM0_SUS256_VWA4_VWB4_WGM1_WGMXCC1_WGMXCCGn1
    SolutionIndex: 44
    SolutionNameMin: Cijk_Alik_Bjlk_BSS_BH_UserArgs_MT256x128x32_MI16x16x1_SN_LDSB1_CLR1_GSU0_GSUC0_GSUWGMRR0_K1_LBSPPA256_LBSPPB1024_LPB32_MIWT8_4_PLR1_SU32_SUM0_SUS256_VWA4_VWB2_WGM4_WGMXCC1_WGMXCCGn1
    SolutionIndex: 45
    SolutionNameMin: Cijk_Alik_Bjlk_BSS_BH_UserArgs_MT256x128x32_MI16x16x1_SN_LDSB1_CLR1_GSU0_GSUC0_GSUWGMRR0_K1_LBSPPA256_LBSPPB1024_LPB0_MIWT8_4_PLR1_SU32_SUM0_SUS256_VWA4_VWB4_WGM4_WGMXCC1_WGMXCCGn1
    SolutionIndex: 46
    SolutionNameMin: Cijk_Alik_Bjlk_BSS_BH_UserArgs_MT128x128x32_MI16x16x1_SN_LDSB1_CLR1_GSU0_GSUC0_GSUWGMRR0_K1_LBSPPA256_LBSPPB1024_LPB16_MIWT4_4_PLR1_SU32_SUM0_SUS256_VWA4_VWB1_WGM1_WGMXCC1_WGMXCCGn1
    SolutionIndex: 47
    SolutionNameMin: Cijk_Alik_Bjlk_BSS_BH_UserArgs_MT128x128x32_MI16x16x1_SN_LDSB1_CLR1_GSU0_GSUC0_GSUWGMRR0_K1_LBSPPA256_LBSPPB1024_LPB32_MIWT4_4_PLR1_SU32_SUM0_SUS256_VWA4_VWB2_WGM1_WGMXCC1_WGMXCCGn1
    SolutionIndex: 48
    SolutionNameMin: Cijk_Alik_Bjlk_BSS_BH_UserArgs_MT128x128x32_MI16x16x1_SN_LDSB1_CLR1_GSU0_GSUC0_GSUWGMRR0_K1_LBSPPA256_LBSPPB1024_LPB0_MIWT4_4_PLR1_SU32_SUM0_SUS256_VWA4_VWB4_WGM1_WGMXCC1_WGMXCCGn1
    SolutionIndex: 49
    SolutionNameMin: Cijk_Alik_Bjlk_BSS_BH_UserArgs_MT128x128x32_MI16x16x1_SN_LDSB1_CLR1_GSU0_GSUC0_GSUWGMRR0_K1_LBSPPA256_LBSPPB1024_LPB32_MIWT4_4_PLR1_SU32_SUM0_SUS256_VWA4_VWB2_WGM4_WGMXCC1_WGMXCCGn1
    SolutionIndex: 50
    SolutionNameMin: Cijk_Alik_Bjlk_BSS_BH_UserArgs_MT128x128x32_MI16x16x1_SN_LDSB1_CLR1_GSU0_GSUC0_GSUWGMRR0_K1_LBSPPA256_LBSPPB1024_LPB32_MIWT4_4_PLR1_SU32_SUM0_SUS256_VWA4_VWB2_WGM8_WGMXCC1_WGMXCCGn1
    SolutionIndex: 51
    SolutionNameMin: Cijk_Alik_Bjlk_BSS_BH_UserArgs_MT128x64x32_MI16x16x1_SN_LDSB0_CLR1_GSU0_GSUC0_GSUWGMRR0_K1_LBSPPA256_LBSPPB512_LPB16_MIWT4_2_PLR1_SU32_SUM0_SUS256_VWA4_VWB1_WGM1_WGMXCC1_WGMXCCGn1
    SolutionIndex: 52
    SolutionNameMin: Cijk_Alik_Bjlk_BSS_BH_UserArgs_MT128x64x32_MI16x16x1_SN_LDSB0_CLR1_GSU0_GSUC0_GSUWGMRR0_K1_LBSPPA128_LBSPPB512_LPB32_MIWT4_2_PLR1_SU32_SUM0_SUS256_VWA1_VWB2_WGM1_WGMXCC1_WGMXCCGn1
    SolutionIndex: 53
    SolutionNameMin: Cijk_Alik_Bjlk_BSS_BH_UserArgs_MT64x64x32_MI16x16x1_SN_LDSB0_CLR1_GSU0_GSUC0_GSUWGMRR0_K1_LBSPPA128_LBSPPB512_LPB32_MIWT2_2_PLR1_SU32_SUM0_SUS256_VWA1_VWB2_WGM1_WGMXCC1_WGMXCCGn1
    SolutionIndex: 54
    SolutionNameMin: Cijk_Alik_Bjlk_BSS_BH_UserArgs_MT64x64x32_MI16x16x1_SN_LDSB0_CLR1_GSU0_GSUC0_GSUWGMRR0_K1_LBSPPA128_LBSPPB512_LPB32_MIWT2_2_PLR1_SU32_SUM0_SUS256_VWA2_VWB2_WGM1_WGMXCC1_WGMXCCGn1
    SolutionIndex: 55
    SolutionNameMin: Cijk_Alik_Bjlk_BSS_BH_UserArgs_MT32x32x32_MI16x16x1_SN_LDSB0_CLR0_GSU0_GSUC0_GSUWGMRR0_K1_LBSPPA128_LBSPPB256_LPB16_MIWT1_1_PLR0_SU32_SUM0_SUS256_VWA1_VWB1_WGM1_WGMXCC1_WGMXCCGn1
    SolutionIndex: 56
    SolutionNameMin: Cijk_Alik_Bjlk_BSS_BH_UserArgs_MT128x256x64_MI16x16x1_SN_LDSB1_CLR1_GSU0_GSUC0_GSUWGMRR0_K1_LBSPPA512_LBSPPB4096_LPB32_MIWT4_8_PLR1_SU32_SUM0_SUS256_VWA4_VWB2_WGM1_WGMXCC1_WGMXCCGn1
    SolutionIndex: 57
    SolutionNameMin: Cijk_Alik_Bjlk_BSS_BH_UserArgs_MT128x256x64_MI16x16x1_SN_LDSB1_CLR1_GSU0_GSUC0_GSUWGMRR0_K1_LBSPPA128_LBSPPB4096_LPB0_MIWT4_8_PLR1_SU32_SUM0_SUS256_VWA1_VWB4_WGM1_WGMXCC1_WGMXCCGn1
    SolutionIndex: 58
    SolutionNameMin: Cijk_Alik_Bjlk_BSS_BH_UserArgs_MT128x256x64_MI16x16x1_SN_LDSB1_CLR1_GSU0_GSUC0_GSUWGMRR0_K1_LBSPPA256_LBSPPB4096_LPB0_MIWT4_8_PLR1_SU32_SUM0_SUS256_VWA2_VWB4_WGM1_WGMXCC1_WGMXCCGn1
    SolutionIndex: 59
    SolutionNameMin: Cijk_Alik_Bjlk_BSS_BH_UserArgs_MT128x256x64_MI16x16x1_SN_LDSB1_CLR1_GSU0_GSUC0_GSUWGMRR0_K1_LBSPPA512_LBSPPB4096_LPB0_MIWT4_8_PLR1_SU32_SUM0_SUS256_VWA4_VWB4_WGM1_WGMXCC1_WGMXCCGn1
    SolutionIndex: 60
    SolutionNameMin: Cijk_Alik_Bjlk_BSS_BH_UserArgs_MT128x256x64_MI16x16x1_SN_LDSB1_CLR1_GSU0_GSUC0_GSUWGMRR0_K1_LBSPPA512_LBSPPB4096_LPB0_MIWT4_8_PLR1_SU32_SUM0_SUS256_VWA4_VWB8_WGM1_WGMXCC1_WGMXCCGn1
    SolutionIndex: 61
    SolutionNameMin: Cijk_Alik_Bjlk_BSS_BH_UserArgs_MT128x256x64_MI16x16x1_SN_LDSB1_CLR1_GSU0_GSUC0_GSUWGMRR0_K1_LBSPPA256_LBSPPB4096_LPB32_MIWT4_8_PLR1_SU32_SUM0_SUS256_VWA2_VWB2_WGM4_WGMXCC1_WGMXCCGn1
    SolutionIndex: 62
    SolutionNameMin: Cijk_Alik_Bjlk_BSS_BH_UserArgs_MT128x256x64_MI16x16x1_SN_LDSB1_CLR1_GSU0_GSUC0_GSUWGMRR0_K1_LBSPPA512_LBSPPB4096_LPB0_MIWT4_8_PLR1_SU32_SUM0_SUS256_VWA4_VWB4_WGM4_WGMXCC1_WGMXCCGn1
    SolutionIndex: 63
    SolutionNameMin: Cijk_Alik_Bjlk_BSS_BH_UserArgs_MT128x256x64_MI16x16x1_SN_LDSB1_CLR1_GSU0_GSUC0_GSUWGMRR0_K1_LBSPPA512_LBSPPB4096_LPB0_MIWT4_8_PLR1_SU32_SUM0_SUS256_VWA4_VWB4_WGM8_WGMXCC1_WGMXCCGn1
    SolutionIndex: 64
    SolutionNameMin: Cijk_Alik_Bjlk_BSS_BH_UserArgs_MT256x128x64_MI16x16x1_SN_LDSB1_CLR1_GSU0_GSUC0_GSUWGMRR0_K1_LBSPPA512_LBSPPB2048_LPB16_MIWT8_4_PLR1_SU32_SUM0_SUS256_VWA4_VWB1_WGM1_WGMXCC1_WGMXCCGn1
    SolutionIndex: 65
    SolutionNameMin: Cijk_Alik_Bjlk_BSS_BH_UserArgs_MT256x128x64_MI16x16x1_SN_LDSB1_CLR1_GSU0_GSUC0_GSUWGMRR0_K1_LBSPPA256_LBSPPB2048_LPB32_MIWT8_4_PLR1_SU32_SUM0_SUS256_VWA2_VWB2_WGM1_WGMXCC1_WGMXCCGn1
    SolutionIndex: 66
    SolutionNameMin: Cijk_Alik_Bjlk_BSS_BH_UserArgs_MT256x128x64_MI16x16x1_SN_LDSB1_CLR1_GSU0_GSUC0_GSUWGMRR0_K1_LBSPPA512_LBSPPB2048_LPB32_MIWT8_4_PLR1_SU32_SUM0_SUS256_VWA4_VWB2_WGM1_WGMXCC1_WGMXCCGn1
    SolutionIndex: 67
    SolutionNameMin: Cijk_Alik_Bjlk_BSS_BH_UserArgs_MT256x128x64_MI16x16x1_SN_LDSB1_CLR1_GSU0_GSUC0_GSUWGMRR0_K1_LBSPPA256_LBSPPB2048_LPB0_MIWT8_4_PLR1_SU32_SUM0_SUS256_VWA2_VWB4_WGM1_WGMXCC1_WGMXCCGn1
    SolutionIndex: 68
    SolutionNameMin: Cijk_Alik_Bjlk_BSS_BH_UserArgs_MT256x128x64_MI16x16x1_SN_LDSB1_CLR1_GSU0_GSUC0_GSUWGMRR0_K1_LBSPPA512_LBSPPB2048_LPB0_MIWT8_4_PLR1_SU32_SUM0_SUS256_VWA4_VWB4_WGM1_WGMXCC1_WGMXCCGn1
    SolutionIndex: 69
    SolutionNameMin: Cijk_Alik_Bjlk_BSS_BH_UserArgs_MT256x128x64_MI16x16x1_SN_LDSB1_CLR1_GSU0_GSUC0_GSUWGMRR0_K1_LBSPPA512_LBSPPB2048_LPB0_MIWT8_4_PLR1_SU32_SUM0_SUS256_VWA4_VWB4_WGM4_WGMXCC1_WGMXCCGn1
    SolutionIndex: 70
    SolutionNameMin: Cijk_Alik_Bjlk_BSS_BH_UserArgs_MT256x128x64_MI16x16x1_SN_LDSB1_CLR1_GSU0_GSUC0_GSUWGMRR0_K1_LBSPPA512_LBSPPB2048_LPB32_MIWT8_4_PLR1_SU32_SUM0_SUS256_VWA4_VWB2_WGM8_WGMXCC1_WGMXCCGn1
    SolutionIndex: 71
    SolutionNameMin: Cijk_Alik_Bjlk_BSS_BH_UserArgs_MT256x128x64_MI16x16x1_SN_LDSB1_CLR1_GSU0_GSUC0_GSUWGMRR0_K1_LBSPPA256_LBSPPB2048_LPB0_MIWT8_4_PLR1_SU32_SUM0_SUS256_VWA2_VWB4_WGM8_WGMXCC1_WGMXCCGn1
    SolutionIndex: 72
    SolutionNameMin: Cijk_Alik_Bjlk_BSS_BH_UserArgs_MT256x128x64_MI16x16x1_SN_LDSB1_CLR1_GSU0_GSUC0_GSUWGMRR0_K1_LBSPPA512_LBSPPB2048_LPB0_MIWT8_4_PLR1_SU32_SUM0_SUS256_VWA4_VWB4_WGM8_WGMXCC1_WGMXCCGn1
    SolutionIndex: 73
    SolutionNameMin: Cijk_Alik_Bjlk_BSS_BH_UserArgs_MT128x128x64_MI16x16x1_SN_LDSB1_CLR1_GSU0_GSUC0_GSUWGMRR0_K1_LBSPPA128_LBSPPB2048_LPB32_MIWT4_4_PLR1_SU32_SUM0_SUS256_VWA1_VWB2_WGM1_WGMXCC1_WGMXCCGn1
    SolutionIndex: 74
    SolutionNameMin: Cijk_Alik_Bjlk_BSS_BH_UserArgs_MT128x128x64_MI16x16x1_SN_LDSB1_CLR1_GSU0_GSUC0_GSUWGMRR0_K1_LBSPPA128_LBSPPB2048_LPB0_MIWT4_4_PLR1_SU32_SUM0_SUS256_VWA1_VWB4_WGM1_WGMXCC1_WGMXCCGn1
    SolutionIndex: 75
    SolutionNameMin: Cijk_Alik_Bjlk_BSS_BH_UserArgs_MT128x128x64_MI16x16x1_SN_LDSB1_CLR1_GSU0_GSUC0_GSUWGMRR0_K1_LBSPPA256_LBSPPB2048_LPB0_MIWT4_4_PLR1_SU32_SUM0_SUS256_VWA2_VWB4_WGM1_WGMXCC1_WGMXCCGn1
    SolutionIndex: 76
    SolutionNameMin: Cijk_Alik_Bjlk_BSS_BH_UserArgs_MT128x128x64_MI16x16x1_SN_LDSB1_CLR1_GSU0_GSUC0_GSUWGMRR0_K1_LBSPPA512_LBSPPB2048_LPB0_MIWT4_4_PLR1_SU32_SUM0_SUS256_VWA4_VWB4_WGM1_WGMXCC1_WGMXCCGn1
    SolutionIndex: 77
    SolutionNameMin: Cijk_Alik_Bjlk_BSS_BH_UserArgs_MT128x128x64_MI16x16x1_SN_LDSB1_CLR1_GSU0_GSUC0_GSUWGMRR0_K1_LBSPPA512_LBSPPB2048_LPB32_MIWT4_4_PLR1_SU32_SUM0_SUS256_VWA4_VWB2_WGM4_WGMXCC1_WGMXCCGn1
    SolutionIndex: 78
    SolutionNameMin: Cijk_Alik_Bjlk_BSS_BH_UserArgs_MT128x128x64_MI16x16x1_SN_LDSB1_CLR1_GSU0_GSUC0_GSUWGMRR0_K1_LBSPPA128_LBSPPB2048_LPB0_MIWT4_4_PLR1_SU32_SUM0_SUS256_VWA1_VWB4_WGM4_WGMXCC1_WGMXCCGn1
    SolutionIndex: 79
    SolutionNameMin: Cijk_Alik_Bjlk_BSS_BH_UserArgs_MT128x128x64_MI16x16x1_SN_LDSB1_CLR1_GSU0_GSUC0_GSUWGMRR0_K1_LBSPPA256_LBSPPB2048_LPB0_MIWT4_4_PLR1_SU32_SUM0_SUS256_VWA2_VWB4_WGM4_WGMXCC1_WGMXCCGn1
    SolutionIndex: 80
    SolutionNameMin: Cijk_Alik_Bjlk_BSS_BH_UserArgs_MT128x128x64_MI16x16x1_SN_LDSB1_CLR1_GSU0_GSUC0_GSUWGMRR0_K1_LBSPPA512_LBSPPB2048_LPB0_MIWT4_4_PLR1_SU32_SUM0_SUS256_VWA4_VWB4_WGM4_WGMXCC1_WGMXCCGn1
    SolutionIndex: 81
    SolutionNameMin: Cijk_Alik_Bjlk_BSS_BH_UserArgs_MT128x128x64_MI16x16x1_SN_LDSB1_CLR1_GSU0_GSUC0_GSUWGMRR0_K1_LBSPPA256_LBSPPB2048_LPB32_MIWT4_4_PLR1_SU32_SUM0_SUS256_VWA2_VWB2_WGM8_WGMXCC1_WGMXCCGn1
    SolutionIndex: 82
    SolutionNameMin: Cijk_Alik_Bjlk_BSS_BH_UserArgs_MT128x128x64_MI16x16x1_SN_LDSB1_CLR1_GSU0_GSUC0_GSUWGMRR0_K1_LBSPPA512_LBSPPB2048_LPB32_MIWT4_4_PLR1_SU32_SUM0_SUS256_VWA4_VWB2_WGM8_WGMXCC1_WGMXCCGn1
    SolutionIndex: 83
    SolutionNameMin: Cijk_Alik_Bjlk_BSS_BH_UserArgs_MT128x128x64_MI16x16x1_SN_LDSB1_CLR1_GSU0_GSUC0_GSUWGMRR0_K1_LBSPPA128_LBSPPB2048_LPB0_MIWT4_4_PLR1_SU32_SUM0_SUS256_VWA1_VWB4_WGM8_WGMXCC1_WGMXCCGn1
    SolutionIndex: 84
    SolutionNameMin: Cijk_Alik_Bjlk_BSS_BH_UserArgs_MT128x128x64_MI16x16x1_SN_LDSB1_CLR1_GSU0_GSUC0_GSUWGMRR0_K1_LBSPPA256_LBSPPB2048_LPB0_MIWT4_4_PLR1_SU32_SUM0_SUS256_VWA2_VWB4_WGM8_WGMXCC1_WGMXCCGn1
    SolutionIndex: 85
    SolutionNameMin: Cijk_Alik_Bjlk_BSS_BH_UserArgs_MT128x128x64_MI16x16x1_SN_LDSB1_CLR1_GSU0_GSUC0_GSUWGMRR0_K1_LBSPPA512_LBSPPB2048_LPB0_MIWT4_4_PLR1_SU32_SUM0_SUS256_VWA4_VWB4_WGM8_WGMXCC1_WGMXCCGn1
    SolutionIndex: 86
    SolutionNameMin: Cijk_Alik_Bjlk_BSS_BH_UserArgs_MT64x128x64_MI16x16x1_SN_LDSB1_CLR1_GSU0_GSUC0_GSUWGMRR0_K1_LBSPPA128_LBSPPB2048_LPB0_MIWT2_4_PLR1_SU32_SUM0_SUS256_VWA1_VWB4_WGM1_WGMXCC1_WGMXCCGn1
    SolutionIndex: 87
    SolutionNameMin: Cijk_Alik_Bjlk_BSS_BH_UserArgs_MT64x128x64_MI16x16x1_SN_LDSB1_CLR1_GSU0_GSUC0_GSUWGMRR0_K1_LBSPPA256_LBSPPB2048_LPB0_MIWT2_4_PLR1_SU32_SUM0_SUS256_VWA2_VWB4_WGM1_WGMXCC1_WGMXCCGn1
    SolutionIndex: 88
    SolutionNameMin: Cijk_Alik_Bjlk_BSS_BH_UserArgs_MT64x128x64_MI16x16x1_SN_LDSB1_CLR1_GSU0_GSUC0_GSUWGMRR0_K1_LBSPPA128_LBSPPB2048_LPB0_MIWT2_4_PLR1_SU32_SUM0_SUS256_VWA1_VWB4_WGM4_WGMXCC1_WGMXCCGn1
    SolutionIndex: 89
    SolutionNameMin: Cijk_Alik_Bjlk_BSS_BH_UserArgs_MT128x64x64_MI16x16x1_SN_LDSB1_CLR1_GSU0_GSUC0_GSUWGMRR0_K1_LBSPPA128_LBSPPB1024_LPB32_MIWT4_2_PLR1_SU32_SUM0_SUS256_VWA1_VWB2_WGM1_WGMXCC1_WGMXCCGn1
    SolutionIndex: 90
    SolutionNameMin: Cijk_Alik_Bjlk_BSS_BH_UserArgs_MT128x64x64_MI16x16x1_SN_LDSB1_CLR1_GSU0_GSUC0_GSUWGMRR0_K1_LBSPPA512_LBSPPB1024_LPB32_MIWT4_2_PLR1_SU32_SUM0_SUS256_VWA4_VWB2_WGM1_WGMXCC1_WGMXCCGn1
    SolutionIndex: 91
    SolutionNameMin: Cijk_Alik_Bjlk_BSS_BH_UserArgs_MT64x64x64_MI16x16x1_SN_LDSB1_CLR1_GSU0_GSUC0_GSUWGMRR0_K1_LBSPPA128_LBSPPB1024_LPB32_MIWT2_2_PLR1_SU32_SUM0_SUS256_VWA1_VWB2_WGM1_WGMXCC1_WGMXCCGn1
    SolutionIndex: 92
    SolutionNameMin: Cijk_Alik_Bjlk_BSS_BH_UserArgs_MT32x64x64_MI16x16x1_SN_LDSB0_CLR1_GSU0_GSUC0_GSUWGMRR0_K1_LBSPPA128_LBSPPB1024_LPB32_MIWT1_2_PLR1_SU32_SUM0_SUS256_VWA1_VWB2_WGM1_WGMXCC1_WGMXCCGn1
    SolutionIndex: 93
    SolutionNameMin: Cijk_Alik_Bjlk_BSS_BH_UserArgs_MT64x32x64_MI16x16x1_SN_LDSB0_CLR1_GSU0_GSUC0_GSUWGMRR0_K1_LBSPPA128_LBSPPB512_LPB16_MIWT2_1_PLR1_SU32_SUM0_SUS256_VWA1_VWB1_WGM1_WGMXCC1_WGMXCCGn1
    SolutionIndex: 94
    SolutionNameMin: Cijk_Alik_Bjlk_BSS_BH_UserArgs_MT64x32x64_MI16x16x1_SN_LDSB0_CLR1_GSU0_GSUC0_GSUWGMRR0_K1_LBSPPA256_LBSPPB512_LPB16_MIWT2_1_PLR1_SU32_SUM0_SUS256_VWA2_VWB1_WGM1_WGMXCC1_WGMXCCGn1
    SolutionIndex: 95
    SolutionNameMin: Cijk_Alik_Bjlk_BSS_BH_UserArgs_MT32x32x64_MI16x16x1_SN_LDSB0_CLR1_GSU0_GSUC0_GSUWGMRR0_K1_LBSPPA128_LBSPPB512_LPB16_MIWT1_1_PLR1_SU32_SUM0_SUS256_VWA1_VWB1_WGM1_WGMXCC1_WGMXCCGn1
    SolutionIndex: 96
    SolutionNameMin: Cijk_Alik_Bjlk_BSS_BH_UserArgs_MT32x32x64_MI16x16x1_SN_LDSB0_CLR1_GSU0_GSUC0_GSUWGMRR0_K1_LBSPPA128_LBSPPB512_LPB16_MIWT1_1_PLR2_SU32_SUM0_SUS256_VWA1_VWB1_WGM1_WGMXCC1_WGMXCCGn1
    SolutionIndex: 97
    SolutionNameMin: Cijk_Alik_Bjlk_BSS_BH_UserArgs_MT64x128x128_MI16x16x1_SN_LDSB1_CLR1_GSU0_GSUC0_GSUWGMRR0_K1_LBSPPA512_LBSPPB2048_LPB0_MIWT2_4_PLR2_SU32_SUM0_SUS256_VWA2_VWB4_WGM1_WGMXCC1_WGMXCCGn1
    SolutionIndex: 98
    SolutionNameMin: Cijk_Alik_Bjlk_BSS_BH_UserArgs_MT64x128x128_MI16x16x1_SN_LDSB1_CLR1_GSU0_GSUC0_GSUWGMRR0_K1_LBSPPA256_LBSPPB2048_LPB0_MIWT2_4_PLR2_SU32_SUM0_SUS256_VWA1_VWB4_WGM8_WGMXCC1_WGMXCCGn1
    SolutionIndex: 99
    SolutionNameMin: Cijk_Alik_Bjlk_BSS_BH_UserArgs_MT128x64x128_MI16x16x1_SN_LDSB1_CLR1_GSU0_GSUC0_GSUWGMRR0_K1_LBSPPA256_LBSPPB1024_LPB32_MIWT4_2_PLR2_SU32_SUM0_SUS256_VWA1_VWB2_WGM1_WGMXCC1_WGMXCCGn1
    SolutionIndex: 100
    SolutionNameMin: Cijk_Alik_Bjlk_BSS_BH_UserArgs_MT128x64x128_MI16x16x1_SN_LDSB1_CLR1_GSU0_GSUC0_GSUWGMRR0_K1_LBSPPA512_LBSPPB1024_LPB32_MIWT4_2_PLR2_SU32_SUM0_SUS256_VWA2_VWB2_WGM1_WGMXCC1_WGMXCCGn1
    SolutionIndex: 101
    SolutionNameMin: Cijk_Alik_Bjlk_BSS_BH_UserArgs_MT128x64x128_MI16x16x1_SN_LDSB1_CLR1_GSU0_GSUC0_GSUWGMRR0_K1_LBSPPA1024_LBSPPB1024_LPB32_MIWT4_2_PLR2_SU32_SUM0_SUS256_VWA4_VWB2_WGM1_WGMXCC1_WGMXCCGn1
    SolutionIndex: 102
    SolutionNameMin: Cijk_Alik_Bjlk_BSS_BH_UserArgs_MT128x64x128_MI16x16x1_SN_LDSB1_CLR1_GSU0_GSUC0_GSUWGMRR0_K1_LBSPPA256_LBSPPB1024_LPB32_MIWT4_2_PLR2_SU32_SUM0_SUS256_VWA1_VWB2_WGM4_WGMXCC1_WGMXCCGn1
    SolutionIndex: 103
    SolutionNameMin: Cijk_Alik_Bjlk_BSS_BH_UserArgs_MT128x64x128_MI16x16x1_SN_LDSB1_CLR1_GSU0_GSUC0_GSUWGMRR0_K1_LBSPPA512_LBSPPB1024_LPB32_MIWT4_2_PLR2_SU32_SUM0_SUS256_VWA2_VWB2_WGM4_WGMXCC1_WGMXCCGn1
    SolutionIndex: 104
    SolutionNameMin: Cijk_Alik_Bjlk_BSS_BH_UserArgs_MT128x64x128_MI16x16x1_SN_LDSB1_CLR1_GSU0_GSUC0_GSUWGMRR0_K1_LBSPPA1024_LBSPPB1024_LPB32_MIWT4_2_PLR2_SU32_SUM0_SUS256_VWA4_VWB2_WGM4_WGMXCC1_WGMXCCGn1
    SolutionIndex: 105
    SolutionNameMin: Cijk_Alik_Bjlk_BSS_BH_UserArgs_MT128x64x128_MI16x16x1_SN_LDSB1_CLR1_GSU0_GSUC0_GSUWGMRR0_K1_LBSPPA256_LBSPPB1024_LPB32_MIWT4_2_PLR2_SU32_SUM0_SUS256_VWA1_VWB2_WGM8_WGMXCC1_WGMXCCGn1
    SolutionIndex: 106
    SolutionNameMin: Cijk_Alik_Bjlk_BSS_BH_UserArgs_MT128x64x128_MI16x16x1_SN_LDSB1_CLR1_GSU0_GSUC0_GSUWGMRR0_K1_LBSPPA1024_LBSPPB1024_LPB32_MIWT4_2_PLR2_SU32_SUM0_SUS256_VWA4_VWB2_WGM8_WGMXCC1_WGMXCCGn1
    SolutionIndex: 107
    SolutionNameMin: Cijk_Alik_Bjlk_BSS_BH_UserArgs_MT64x64x128_MI16x16x1_SN_LDSB1_CLR1_GSU0_GSUC0_GSUWGMRR0_K1_LBSPPA256_LBSPPB1024_LPB32_MIWT2_2_PLR1_SU32_SUM0_SUS256_VWA1_VWB2_WGM1_WGMXCC1_WGMXCCGn1
    SolutionIndex: 108
    SolutionNameMin: Cijk_Alik_Bjlk_BSS_BH_UserArgs_MT64x64x128_MI16x16x1_SN_LDSB1_CLR1_GSU0_GSUC0_GSUWGMRR0_K1_LBSPPA256_LBSPPB1024_LPB32_MIWT2_2_PLR2_SU32_SUM0_SUS256_VWA1_VWB2_WGM1_WGMXCC1_WGMXCCGn1
    SolutionIndex: 109
    SolutionNameMin: Cijk_Alik_Bjlk_BSS_BH_UserArgs_MT64x64x128_MI16x16x1_SN_LDSB1_CLR1_GSU0_GSUC0_GSUWGMRR0_K1_LBSPPA512_LBSPPB1024_LPB32_MIWT2_2_PLR2_SU32_SUM0_SUS256_VWA2_VWB2_WGM1_WGMXCC1_WGMXCCGn1
    SolutionIndex: 110
    SolutionNameMin: Cijk_Alik_Bjlk_BSS_BH_UserArgs_MT64x64x128_MI16x16x1_SN_LDSB1_CLR1_GSU0_GSUC0_GSUWGMRR0_K1_LBSPPA256_LBSPPB1024_LPB32_MIWT2_2_PLR2_SU32_SUM0_SUS256_VWA1_VWB2_WGM4_WGMXCC1_WGMXCCGn1
    SolutionIndex: 111
    SolutionNameMin: Cijk_Alik_Bjlk_BSS_BH_UserArgs_MT64x64x128_MI16x16x1_SN_LDSB1_CLR1_GSU0_GSUC0_GSUWGMRR0_K1_LBSPPA512_LBSPPB1024_LPB32_MIWT2_2_PLR2_SU32_SUM0_SUS256_VWA2_VWB2_WGM8_WGMXCC1_WGMXCCGn1
    SolutionIndex: 112
    SolutionNameMin: Cijk_Alik_Bjlk_BSS_BH_UserArgs_MT32x64x128_MI16x16x1_SN_LDSB1_CLR1_GSU0_GSUC0_GSUWGMRR0_K1_LBSPPA256_LBSPPB1024_LPB32_MIWT1_2_PLR2_SU32_SUM0_SUS256_VWA1_VWB2_WGM1_WGMXCC1_WGMXCCGn1
    SolutionIndex: 113
    SolutionNameMin: Cijk_Alik_Bjlk_BSS_BH_UserArgs_MT32x64x128_MI16x16x1_SN_LDSB1_CLR1_GSU0_GSUC0_GSUWGMRR0_K1_LBSPPA256_LBSPPB1024_LPB32_MIWT1_2_PLR2_SU32_SUM0_SUS256_VWA1_VWB2_WGM4_WGMXCC1_WGMXCCGn1
    SolutionIndex: 114
    SolutionNameMin: Cijk_Alik_Bjlk_BSS_BH_UserArgs_MT32x64x128_MI16x16x1_SN_LDSB1_CLR1_GSU0_GSUC0_GSUWGMRR0_K1_LBSPPA256_LBSPPB1024_LPB32_MIWT1_2_PLR2_SU32_SUM0_SUS256_VWA1_VWB2_WGM8_WGMXCC1_WGMXCCGn1
    SolutionIndex: 115
    SolutionNameMin: Cijk_Alik_Bjlk_BSS_BH_UserArgs_MT64x32x128_MI16x16x1_SN_LDSB1_CLR1_GSU0_GSUC0_GSUWGMRR0_K1_LBSPPA512_LBSPPB512_LPB16_MIWT2_1_PLR2_SU32_SUM0_SUS256_VWA2_VWB1_WGM1_WGMXCC1_WGMXCCGn1
    SolutionIndex: 116
    SolutionNameMin: Cijk_Alik_Bjlk_BSS_BH_UserArgs_MT32x32x128_MI16x16x1_SN_LDSB1_CLR1_GSU0_GSUC0_GSUWGMRR0_K1_LBSPPA256_LBSPPB512_LPB16_MIWT1_1_PLR1_SU32_SUM0_SUS256_VWA1_VWB1_WGM1_WGMXCC1_WGMXCCGn1
    SolutionIndex: 117
    SolutionNameMin: Cijk_Alik_Bjlk_BSS_BH_UserArgs_MT32x32x128_MI16x16x1_SN_LDSB1_CLR1_GSU0_GSUC0_GSUWGMRR0_K1_LBSPPA256_LBSPPB512_LPB16_MIWT1_1_PLR2_SU32_SUM0_SUS256_VWA1_VWB1_WGM1_WGMXCC1_WGMXCCGn1
    SolutionIndex: 118
    SolutionNameMin: Cijk_Alik_Bjlk_BSS_BH_UserArgs_MT32x32x32_MI16x16x1_SN_LDSB0_CLR0_GSU0_GSUC0_GSUWGMRR0_K1_LBSPPA128_LBSPPB256_LPB16_MIWT1_1_PLR0_SU32_SUM0_SUS256_VWA1_VWB1_WGM8_WGMXCC1_WGMXCCGn1
- - - [128, 128, 1, 128, 128, 128, 128, 128]
    - [96, 0.086]
  - - [128, 128, 1, 256, 128, 128, 256, 128]
    - [116, 0.157]
  - - [128, 128, 1, 512, 128, 128, 512, 128]
    - [116, 0.266]
  - - [128, 128, 1, 1024, 128, 128, 1024, 128]
    - [116, 0.413]
  - - [128, 128, 1, 2048, 128, 128, 2048, 128]
    - [116, 0.576]
  - - [128, 128, 1, 4096, 128, 128, 4096, 128]
    - [93, 0.874]
  - - [128, 128, 1, 8192, 128, 128, 8192, 128]
    - [112, 1.362]
  - - [128, 256, 1, 128, 128, 128, 128, 256]
    - [117, 0.171]
  - - [128, 256, 1, 256, 128, 128, 256, 256]
    - [95, 0.313]
  - - [128, 256, 1, 512, 128, 128, 512, 256]
    - [117, 0.516]
  - - [128, 256, 1, 1024, 128, 128, 1024, 256]
    - [117, 0.788]
  - - [128, 256, 1, 2048, 128, 128, 2048, 256]
    - [117, 1.051]
  - - [128, 256, 1, 4096, 128, 128, 4096, 256]
    - [112, 1.474]
  - - [128, 256, 1, 8192, 128, 128, 8192, 256]
    - [110, 2.04]
  - - [128, 512, 1, 128, 128, 128, 128, 512]
    - [92, 0.318]
  - - [128, 512, 1, 256, 128, 128, 256, 512]
    - [115, 0.551]
  - - [128, 512, 1, 512, 128, 128, 512, 512]
    - [112, 0.924]
  - - [128, 512, 1, 1024, 128, 128, 1024, 512]
    - [114, 1.361]
  - - [128, 512, 1, 2048, 128, 128, 2048, 512]
    - [112, 1.801]
  - - [128, 512, 1, 4096, 128, 128, 4096, 512]
    - [108, 2.397]
  - - [128, 512, 1, 8192, 128, 128, 8192, 512]
    - [101, 3.475]
  - - [128, 1024, 1, 128, 128, 128, 128, 1024]
    - [53, 0.564]
  - - [128, 1024, 1, 256, 128, 128, 256, 1024]
    - [108, 0.978]
  - - [128, 1024, 1, 512, 128, 128, 512, 1024]
    - [108, 1.607]
  - - [128, 1024, 1, 1024, 128, 128, 1024, 1024]
    - [109, 2.277]
  - - [128, 1024, 1, 2048, 128, 128, 2048, 1024]
    - [111, 2.779]
  - - [128, 1024, 1, 4096, 128, 128, 4096, 1024]
    - [104, 3.491]
  - - [128, 1024, 1, 8192, 128, 128, 8192, 1024]
    - [80, 4.505]
  - - [128, 2048, 1, 128, 128, 128, 128, 2048]
    - [88, 0.912]
  - - [128, 2048, 1, 256, 128, 128, 256, 2048]
    - [86, 1.54]
  - - [128, 2048, 1, 512, 128, 128, 512, 2048]
    - [97, 2.27]
  - - [128, 2048, 1, 1024, 128, 128, 1024, 2048]
    - [99, 3.27]
  - - [128, 2048, 1, 2048, 128, 128, 2048, 2048]
    - [99, 4.253]
  - - [128, 2048, 1, 4096, 128, 128, 4096, 2048]
    - [100, 4.979]
  - - [128, 2048, 1, 8192, 128, 128, 8192, 2048]
    - [76, 6.182]
  - - [128, 4096, 1, 128, 128, 128, 128, 4096]
    - [48, 1.185]
  - - [128, 4096, 1, 256, 128, 128, 256, 4096]
    - [48, 2.011]
  - - [128, 4096, 1, 512, 128, 128, 512, 4096]
    - [76, 3.17]
  - - [128, 4096, 1, 1024, 128, 128, 1024, 4096]
    - [80, 4.393]
  - - [128, 4096, 1, 2048, 128, 128, 2048, 4096]
    - [81, 5.279]
  - - [128, 4096, 1, 4096, 128, 128, 4096, 4096]
    - [60, 5.253]
  - - [128, 4096, 1, 8192, 128, 128, 8192, 4096]
    - [80, 7.33]
  - - [128, 8192, 1, 128, 128, 128, 128, 8192]
    - [33, 1.571]
  - - [128, 8192, 1, 256, 128, 128, 256, 8192]
    - [30, 2.649]
  - - [128, 8192, 1, 512, 128, 128, 512, 8192]
    - [41, 3.89]
  - - [128, 8192, 1, 1024, 128, 128, 1024, 8192]
    - [59, 5.188]
  - - [128, 8192, 1, 2048, 128, 128, 2048, 8192]
    - [61, 6.227]
  - - [128, 8192, 1, 4096, 128, 128, 4096, 8192]
    - [75, 7.086]
  - - [128, 8192, 1, 8192, 128, 128, 8192, 8192]
    - [63, 8.328]
  - - [256, 128, 1, 128, 256, 256, 128, 128]
    - [55, 0.171]
  - - [256, 128, 1, 256, 256, 256, 256, 128]
    - [116, 0.311]
  - - [256, 128, 1, 512, 256, 256, 512, 128]
    - [95, 0.52]
  - - [256, 128, 1, 1024, 256, 256, 1024, 128]
    - [117, 0.771]
  - - [256, 128, 1, 2048, 256, 256, 2048, 128]
    - [117, 1.041]
  - - [256, 128, 1, 4096, 256, 256, 4096, 128]
    - [112, 1.461]
  - - [256, 128, 1, 8192, 256, 256, 8192, 128]
    - [108, 2.224]
  - - [256, 256, 1, 128, 256, 256, 128, 256]
    - [94, 0.317]
  - - [256, 256, 1, 256, 256, 256, 256, 256]
    - [94, 0.559]
  - - [256, 256, 1, 512, 256, 256, 512, 256]
    - [112, 0.934]
  - - [256, 256, 1, 1024, 256, 256, 1024, 256]
    - [114, 1.356]
  - - [256, 256, 1, 2048, 256, 256, 2048, 256]
    - [112, 1.812]
  - - [256, 256, 1, 4096, 256, 256, 4096, 256]
    - [110, 2.347]
  - - [256, 256, 1, 8192, 256, 256, 8192, 256]
    - [101, 3.356]
  - - [256, 512, 1, 128, 256, 256, 128, 512]
    - [54, 0.57]
  - - [256, 512, 1, 256, 256, 256, 256, 512]
    - [91, 0.977]
  - - [256, 512, 1, 512, 256, 256, 512, 512]
    - [108, 1.578]
  - - [256, 512, 1, 1024, 256, 256, 1024, 512]
    - [108, 2.204]
  - - [256, 512, 1, 2048, 256, 256, 2048, 512]
    - [110, 2.929]
  - - [256, 512, 1, 4096, 256, 256, 4096, 512]
    - [76, 3.671]
  - - [256, 512, 1, 8192, 256, 256, 8192, 512]
    - [80, 4.702]
  - - [256, 1024, 1, 128, 256, 256, 128, 1024]
    - [86, 0.935]
  - - [256, 1024, 1, 256, 256, 256, 256, 1024]
    - [90, 1.56]
  - - [256, 1024, 1, 512, 256, 256, 512, 1024]
    - [101, 2.464]
  - - [256, 1024, 1, 1024, 256, 256, 1024, 1024]
    - [99, 3.359]
  - - [256, 1024, 1, 2048, 256, 256, 2048, 1024]
    - [103, 4.178]
  - - [256, 1024, 1, 4096, 256, 256, 4096, 1024]
    - [76, 4.674]
  - - [256, 1024, 1, 8192, 256, 256, 8192, 1024]
    - [77, 5.633]
  - - [256, 2048, 1, 128, 256, 256, 128, 2048]
    - [47, 1.202]
  - - [256, 2048, 1, 256, 256, 256, 256, 2048]
    - [82, 1.965]
  - - [256, 2048, 1, 512, 256, 256, 512, 2048]
    - [80, 3.186]
  - - [256, 2048, 1, 1024, 256, 256, 1024, 2048]
    - [83, 4.391]
  - - [256, 2048, 1, 2048, 256, 256, 2048, 2048]
    - [80, 5.638]
  - - [256, 2048, 1, 4096, 256, 256, 4096, 2048]
    - [78, 6.045]
  - - [256, 2048, 1, 8192, 256, 256, 8192, 2048]
    - [35, 6.592]
  - - [256, 4096, 1, 128, 256, 256, 128, 4096]
    - [34, 1.609]
  - - [256, 4096, 1, 256, 256, 256, 256, 4096]
    - [30, 2.71]
  - - [256, 4096, 1, 512, 256, 256, 512, 4096]
    - [28, 4.011]
  - - [256, 4096, 1, 1024, 256, 256, 1024, 4096]
    - [30, 5.29]
  - - [256, 4096, 1, 2048, 256, 256, 2048, 4096]
    - [59, 6.423]
  - - [256, 4096, 1, 4096, 256, 256, 4096, 4096]
    - [71, 7.156]
  - - [256, 4096, 1, 8192, 256, 256, 8192, 4096]
    - [9, 8.335]
  - - [256, 8192, 1, 128, 256, 256, 128, 8192]
    - [6, 1.857]
  - - [256, 8192, 1, 256, 256, 256, 256, 8192]
    - [24, 3.044]
  - - [256, 8192, 1, 512, 256, 256, 512, 8192]
    - [6, 4.534]
  - - [256, 8192, 1, 1024, 256, 256, 1024, 8192]
    - [0, 5.8]
  - - [256, 8192, 1, 2048, 256, 256, 2048, 8192]
    - [72, 7.108]
  - - [256, 8192, 1, 4096, 256, 256, 4096, 8192]
    - [69, 8.109]
  - - [256, 8192, 1, 8192, 256, 256, 8192, 8192]
    - [7, 9.025]
  - - [512, 128, 1, 128, 512, 512, 128, 128]
    - [115, 0.319]
  - - [512, 128, 1, 256, 512, 512, 256, 128]
    - [94, 0.568]
  - - [512, 128, 1, 512, 512, 512, 512, 128]
    - [112, 0.928]
  - - [512, 128, 1, 1024, 512, 512, 1024, 128]
    - [112, 1.389]
  - - [512, 128, 1, 2048, 512, 512, 2048, 128]
    - [113, 1.786]
  - - [512, 128, 1, 4096, 512, 512, 4096, 128]
    - [108, 2.407]
  - - [512, 128, 1, 8192, 512, 512, 8192, 128]
    - [101, 3.519]
  - - [512, 256, 1, 128, 512, 512, 128, 256]
    - [91, 0.575]
  - - [512, 256, 1, 256, 512, 512, 256, 256]
    - [108, 0.978]
  - - [512, 256, 1, 512, 512, 512, 512, 256]
    - [108, 1.596]
  - - [512, 256, 1, 1024, 512, 512, 1024, 256]
    - [108, 2.295]
  - - [512, 256, 1, 2048, 512, 512, 2048, 256]
    - [108, 2.901]
  - - [512, 256, 1, 4096, 512, 512, 4096, 256]
    - [105, 3.523]
  - - [512, 256, 1, 8192, 512, 512, 8192, 256]
    - [85, 4.546]
  - - [512, 512, 1, 128, 512, 512, 128, 512]
    - [86, 0.943]
  - - [512, 512, 1, 256, 512, 512, 256, 512]
    - [86, 1.553]
  - - [512, 512, 1, 512, 512, 512, 512, 512]
    - [87, 2.438]
  - - [512, 512, 1, 1024, 512, 512, 1024, 512]
    - [99, 3.482]
  - - [512, 512, 1, 2048, 512, 512, 2048, 512]
    - [105, 4.025]
  - - [512, 512, 1, 4096, 512, 512, 4096, 512]
    - [85, 4.829]
  - - [512, 512, 1, 8192, 512, 512, 8192, 512]
    - [79, 5.468]
  - - [512, 1024, 1, 128, 512, 512, 128, 1024]
    - [48, 1.257]
  - - [512, 1024, 1, 256, 512, 512, 256, 1024]
    - [47, 1.985]
  - - [512, 1024, 1, 512, 512, 512, 512, 1024]
    - [78, 3.139]
  - - [512, 1024, 1, 1024, 512, 512, 1024, 1024]
    - [80, 4.51]
  - - [512, 1024, 1, 2048, 512, 512, 2048, 1024]
    - [76, 5.487]
  - - [512, 1024, 1, 4096, 512, 512, 4096, 1024]
    - [84, 5.831]
  - - [512, 1024, 1, 8192, 512, 512, 8192, 1024]
    - [69, 7.301]
  - - [512, 2048, 1, 128, 512, 512, 128, 2048]
    - [37, 1.559]
  - - [512, 2048, 1, 256, 512, 512, 256, 2048]
    - [32, 2.623]
  - - [512, 2048, 1, 512, 512, 512, 512, 2048]
    - [33, 4.037]
  - - [512, 2048, 1, 1024, 512, 512, 1024, 2048]
    - [31, 5.285]
  - - [512, 2048, 1, 2048, 512, 512, 2048, 2048]
    - [59, 6.516]
  - - [512, 2048, 1, 4096, 512, 512, 4096, 2048]
    - [69, 7.25]
  - - [512, 2048, 1, 8192, 512, 512, 8192, 2048]
    - [14, 8.024]
  - - [512, 4096, 1, 128, 512, 512, 128, 4096]
    - [9, 1.79]
  - - [512, 4096, 1, 256, 512, 512, 256, 4096]
    - [7, 2.973]
  - - [512, 4096, 1, 512, 512, 512, 512, 4096]
    - [26, 4.451]
  - - [512, 4096, 1, 1024, 512, 512, 1024, 4096]
    - [1, 5.827]
  - - [512, 4096, 1, 2048, 512, 512, 2048, 4096]
    - [74, 6.496]
  - - [512, 4096, 1, 4096, 512, 512, 4096, 4096]
    - [6, 8.148]
  - - [512, 4096, 1, 8192, 512, 512, 8192, 4096]
    - [25, 8.986]
  - - [512, 8192, 1, 128, 512, 512, 128, 8192]
    - [33, 1.891]
  - - [512, 8192, 1, 256, 512, 512, 256, 8192]
    - [63, 3.085]
  - - [512, 8192, 1, 512, 512, 512, 512, 8192]
    - [6, 4.756]
  - - [512, 8192, 1, 1024, 512, 512, 1024, 8192]
    - [18, 6.173]
  - - [512, 8192, 1, 2048, 512, 512, 2048, 8192]
    - [6, 7.472]
  - - [512, 8192, 1, 4096, 512, 512, 4096, 8192]
    - [6, 8.877]
  - - [512, 8192, 1, 8192, 512, 512, 8192, 8192]
    - [5, 9.486]
  - - [1024, 128, 1, 128, 1024, 1024, 128, 128]
    - [91, 0.581]
  - - [1024, 128, 1, 256, 1024, 1024, 256, 128]
    - [107, 0.993]
  - - [1024, 128, 1, 512, 1024, 1024, 512, 128]
    - [91, 1.553]
  - - [1024, 128, 1, 1024, 1024, 1024, 1024, 128]
    - [110, 2.279]
  - - [1024, 128, 1, 2048, 1024, 1024, 2048, 128]
    - [109, 2.841]
  - - [1024, 128, 1, 4096, 1024, 1024, 4096, 128]
    - [106, 3.585]
  - - [1024, 128, 1, 8192, 1024, 1024, 8192, 128]
    - [80, 4.683]
  - - [1024, 256, 1, 128, 1024, 1024, 128, 256]
    - [86, 0.951]
  - - [1024, 256, 1, 256, 1024, 1024, 256, 256]
    - [51, 1.518]
  - - [1024, 256, 1, 512, 1024, 1024, 512, 256]
    - [86, 2.444]
  - - [1024, 256, 1, 1024, 1024, 1024, 1024, 256]
    - [102, 3.253]
  - - [1024, 256, 1, 2048, 1024, 1024, 2048, 256]
    - [98, 3.958]
  - - [1024, 256, 1, 4096, 1024, 1024, 4096, 256]
    - [76, 4.751]
  - - [1024, 256, 1, 8192, 1024, 1024, 8192, 256]
    - [70, 5.396]
  - - [1024, 512, 1, 128, 1024, 1024, 128, 512]
    - [50, 1.239]
  - - [1024, 512, 1, 256, 1024, 1024, 256, 512]
    - [48, 2.005]
  - - [1024, 512, 1, 512, 1024, 1024, 512, 512]
    - [78, 3.118]
  - - [1024, 512, 1, 1024, 1024, 1024, 1024, 512]
    - [80, 4.507]
  - - [1024, 512, 1, 2048, 1024, 1024, 2048, 512]
    - [76, 5.571]
  - - [1024, 512, 1, 4096, 1024, 1024, 4096, 512]
    - [76, 6.339]
  - - [1024, 512, 1, 8192, 1024, 1024, 8192, 512]
    - [68, 7.238]
  - - [1024, 1024, 1, 128, 1024, 1024, 128, 1024]
    - [37, 1.54]
  - - [1024, 1024, 1, 256, 1024, 1024, 256, 1024]
    - [31, 2.621]
  - - [1024, 1024, 1, 512, 1024, 1024, 512, 1024]
    - [31, 3.972]
  - - [1024, 1024, 1, 1024, 1024, 1024, 1024, 1024]
    - [31, 5.32]
  - - [1024, 1024, 1, 2048, 1024, 1024, 2048, 1024]
    - [59, 6.54]
  - - [1024, 1024, 1, 4096, 1024, 1024, 4096, 1024]
    - [63, 7.313]
  - - [1024, 1024, 1, 8192, 1024, 1024, 8192, 1024]
    - [24, 8.291]
  - - [1024, 2048, 1, 128, 1024, 1024, 128, 2048]
    - [8, 1.87]
  - - [1024, 2048, 1, 256, 1024, 1024, 256, 2048]
    - [27, 3.097]
  - - [1024, 2048, 1, 512, 1024, 1024, 512, 2048]
    - [18, 4.546]
  - - [1024, 2048, 1, 1024, 1024, 1024, 1024, 2048]
    - [18, 5.985]
  - - [1024, 2048, 1, 2048, 1024, 1024, 2048, 2048]
    - [59, 6.99]
  - - [1024, 2048, 1, 4096, 1024, 1024, 4096, 2048]
    - [14, 8.077]
  - - [1024, 2048, 1, 8192, 1024, 1024, 8192, 2048]
    - [12, 9.014]
  - - [1024, 4096, 1, 128, 1024, 1024, 128, 4096]
    - [31, 1.846]
  - - [1024, 4096, 1, 256, 1024, 1024, 256, 4096]
    - [59, 3.048]
  - - [1024, 4096, 1, 512, 1024, 1024, 512, 4096]
    - [27, 4.695]
  - - [1024, 4096, 1, 1024, 1024, 1024, 1024, 4096]
    - [6, 6.147]
  - - [1024, 4096, 1, 2048, 1024, 1024, 2048, 4096]
    - [14, 7.764]
  - - [1024, 4096, 1, 4096, 1024, 1024, 4096, 4096]
    - [6, 8.745]
  - - [1024, 4096, 1, 8192, 1024, 1024, 8192, 4096]
    - [23, 9.546]
  - - [1024, 8192, 1, 128, 1024, 1024, 128, 8192]
    - [64, 2.113]
  - - [1024, 8192, 1, 256, 1024, 1024, 256, 8192]
    - [41, 3.435]
  - - [1024, 8192, 1, 512, 1024, 1024, 512, 8192]
    - [80, 4.902]
  - - [1024, 8192, 1, 1024, 1024, 1024, 1024, 8192]
    - [24, 6.722]
  - - [1024, 8192, 1, 2048, 1024, 1024, 2048, 8192]
    - [22, 8.083]
  - - [1024, 8192, 1, 4096, 1024, 1024, 4096, 8192]
    - [26, 8.922]
  - - [1024, 8192, 1, 8192, 1024, 1024, 8192, 8192]
    - [4, 9.678]
  - - [2048, 128, 1, 128, 2048, 2048, 128, 128]
    - [52, 0.929]
  - - [2048, 128, 1, 256, 2048, 2048, 256, 128]
    - [89, 1.558]
  - - [2048, 128, 1, 512, 2048, 2048, 512, 128]
    - [99, 2.345]
  - - [2048, 128, 1, 1024, 2048, 2048, 1024, 128]
    - [86, 3.072]
  - - [2048, 128, 1, 2048, 2048, 2048, 2048, 128]
    - [98, 3.903]
  - - [2048, 128, 1, 4096, 2048, 2048, 4096, 128]
    - [76, 4.877]
  - - [2048, 128, 1, 8192, 2048, 2048, 8192, 128]
    - [76, 6.068]
  - - [2048, 256, 1, 128, 2048, 2048, 128, 256]
    - [49, 1.233]
  - - [2048, 256, 1, 256, 2048, 2048, 256, 256]
    - [46, 1.942]
  - - [2048, 256, 1, 512, 2048, 2048, 512, 256]
    - [77, 3.196]
  - - [2048, 256, 1, 1024, 2048, 2048, 1024, 256]
    - [74, 4.502]
  - - [2048, 256, 1, 2048, 2048, 2048, 2048, 256]
    - [80, 5.531]
  - - [2048, 256, 1, 4096, 2048, 2048, 4096, 256]
    - [76, 6.122]
  - - [2048, 256, 1, 8192, 2048, 2048, 8192, 256]
    - [72, 7.298]
  - - [2048, 512, 1, 128, 2048, 2048, 128, 512]
    - [43, 1.563]
  - - [2048, 512, 1, 256, 2048, 2048, 256, 512]
    - [32, 2.6]
  - - [2048, 512, 1, 512, 2048, 2048, 512, 512]
    - [39, 4.074]
  - - [2048, 512, 1, 1024, 2048, 2048, 1024, 512]
    - [30, 5.357]
  - - [2048, 512, 1, 2048, 2048, 2048, 2048, 512]
    - [58, 6.407]
  - - [2048, 512, 1, 4096, 2048, 2048, 4096, 512]
    - [59, 7.45]
  - - [2048, 512, 1, 8192, 2048, 2048, 8192, 512]
    - [68, 8.234]
  - - [2048, 1024, 1, 128, 2048, 2048, 128, 1024]
    - [9, 1.875]
  - - [2048, 1024, 1, 256, 2048, 2048, 256, 1024]
    - [9, 3.096]
  - - [2048, 1024, 1, 512, 2048, 2048, 512, 1024]
    - [9, 4.551]
  - - [2048, 1024, 1, 1024, 2048, 2048, 1024, 1024]
    - [4, 6.041]
  - - [2048, 1024, 1, 2048, 2048, 2048, 2048, 1024]
    - [33, 6.863]
  - - [2048, 1024, 1, 4096, 2048, 2048, 4096, 1024]
    - [9, 8.145]
  - - [2048, 1024, 1, 8192, 2048, 2048, 8192, 1024]
    - [17, 8.94]
  - - [2048, 2048, 1, 128, 2048, 2048, 128, 2048]
    - [33, 1.919]
  - - [2048, 2048, 1, 256, 2048, 2048, 256, 2048]
    - [68, 3.021]
  - - [2048, 2048, 1, 512, 2048, 2048, 512, 2048]
    - [6, 4.747]
  - - [2048, 2048, 1, 1024, 2048, 2048, 1024, 2048]
    - [14, 6.371]
  - - [2048, 2048, 1, 2048, 2048, 2048, 2048, 2048]
    - [6, 7.753]
  - - [2048, 2048, 1, 4096, 2048, 2048, 4096, 2048]
    - [4, 8.651]
  - - [2048, 2048, 1, 8192, 2048, 2048, 8192, 2048]
    - [4, 9.373]
  - - [2048, 4096, 1, 128, 2048, 2048, 128, 4096]
    - [56, 2.121]
  - - [2048, 4096, 1, 256, 2048, 2048, 256, 4096]
    - [36, 3.457]
  - - [2048, 4096, 1, 512, 2048, 2048, 512, 4096]
    - [41, 5.129]
  - - [2048, 4096, 1, 1024, 2048, 2048, 1024, 4096]
    - [6, 6.728]
  - - [2048, 4096, 1, 2048, 2048, 2048, 2048, 4096]
    - [62, 7.818]
  - - [2048, 4096, 1, 4096, 2048, 2048, 4096, 4096]
    - [6, 9.002]
  - - [2048, 4096, 1, 8192, 2048, 2048, 8192, 4096]
    - [16, 9.368]
  - - [2048, 8192, 1, 128, 2048, 2048, 128, 8192]
    - [41, 2.422]
  - - [2048, 8192, 1, 256, 2048, 2048, 256, 8192]
    - [30, 3.833]
  - - [2048, 8192, 1, 512, 2048, 2048, 512, 8192]
    - [14, 5.537]
  - - [2048, 8192, 1, 1024, 2048, 2048, 1024, 8192]
    - [14, 7.223]
  - - [2048, 8192, 1, 2048, 2048, 2048, 2048, 8192]
    - [27, 8.329]
  - - [2048, 8192, 1, 4096, 2048, 2048, 4096, 8192]
    - [21, 9.062]
  - - [2048, 8192, 1, 8192, 2048, 2048, 8192, 8192]
    - [22, 9.522]
  - - [4096, 128, 1, 128, 4096, 4096, 128, 128]
    - [46, 1.229]
  - - [4096, 128, 1, 256, 4096, 4096, 256, 128]
    - [73, 1.944]
  - - [4096, 128, 1, 512, 4096, 4096, 512, 128]
    - [76, 3.072]
  - - [4096, 128, 1, 1024, 4096, 4096, 1024, 128]
    - [75, 4.219]
  - - [4096, 128, 1, 2048, 4096, 4096, 2048, 128]
    - [76, 5.304]
  - - [4096, 128, 1, 4096, 4096, 4096, 4096, 128]
    - [76, 6.379]
  - - [4096, 128, 1, 8192, 4096, 4096, 8192, 128]
    - [69, 7.313]
  - - [4096, 256, 1, 128, 4096, 4096, 128, 256]
    - [43, 1.607]
  - - [4096, 256, 1, 256, 4096, 4096, 256, 256]
    - [40, 2.594]
  - - [4096, 256, 1, 512, 4096, 4096, 512, 256]
    - [70, 3.921]
  - - [4096, 256, 1, 1024, 4096, 4096, 1024, 256]
    - [58, 5.088]
  - - [4096, 256, 1, 2048, 4096, 4096, 2048, 256]
    - [57, 6.267]
  - - [4096, 256, 1, 4096, 4096, 4096, 4096, 256]
    - [30, 7.197]
  - - [4096, 256, 1, 8192, 4096, 4096, 8192, 256]
    - [27, 8.237]
  - - [4096, 512, 1, 128, 4096, 4096, 128, 512]
    - [6, 1.809]
  - - [4096, 512, 1, 256, 4096, 4096, 256, 512]
    - [24, 2.964]
  - - [4096, 512, 1, 512, 4096, 4096, 512, 512]
    - [11, 4.641]
  - - [4096, 512, 1, 1024, 4096, 4096, 1024, 512]
    - [30, 5.736]
  - - [4096, 512, 1, 2048, 4096, 4096, 2048, 512]
    - [59, 7.162]
  - - [4096, 512, 1, 4096, 4096, 4096, 4096, 512]
    - [59, 8.044]
  - - [4096, 512, 1, 8192, 4096, 4096, 8192, 512]
    - [6, 9.246]
  - - [4096, 1024, 1, 128, 4096, 4096, 128, 1024]
    - [29, 1.898]
  - - [4096, 1024, 1, 256, 4096, 4096, 256, 1024]
    - [64, 2.958]
  - - [4096, 1024, 1, 512, 4096, 4096, 512, 1024]
    - [3, 4.776]
  - - [4096, 1024, 1, 1024, 4096, 4096, 1024, 1024]
    - [3, 6.449]
  - - [4096, 1024, 1, 2048, 4096, 4096, 2048, 1024]
    - [6, 7.749]
  - - [4096, 1024, 1, 4096, 4096, 4096, 4096, 1024]
    - [4, 8.698]
  - - [4096, 1024, 1, 8192, 4096, 4096, 8192, 1024]
    - [4, 9.416]
  - - [4096, 2048, 1, 128, 4096, 4096, 128, 2048]
    - [29, 2.087]
  - - [4096, 2048, 1, 256, 4096, 4096, 256, 2048]
    - [44, 3.312]
  - - [4096, 2048, 1, 512, 4096, 4096, 512, 2048]
    - [3, 4.961]
  - - [4096, 2048, 1, 1024, 4096, 4096, 1024, 2048]
    - [11, 6.426]
  - - [4096, 2048, 1, 2048, 4096, 4096, 2048, 2048]
    - [22, 7.734]
  - - [4096, 2048, 1, 4096, 4096, 4096, 4096, 2048]
    - [59, 8.423]
  - - [4096, 2048, 1, 8192, 4096, 4096, 8192, 2048]
    - [22, 9.208]
  - - [4096, 4096, 1, 128, 4096, 4096, 128, 4096]
    - [45, 2.327]
  - - [4096, 4096, 1, 256, 4096, 4096, 256, 4096]
    - [30, 3.677]
  - - [4096, 4096, 1, 512, 4096, 4096, 512, 4096]
    - [14, 5.314]
  - - [4096, 4096, 1, 1024, 4096, 4096, 1024, 4096]
    - [59, 6.858]
  - - [4096, 4096, 1, 2048, 4096, 4096, 2048, 4096]
    - [23, 8.095]
  - - [4096, 4096, 1, 4096, 4096, 4096, 4096, 4096]
    - [15, 8.78]
  - - [4096, 4096, 1, 8192, 4096, 4096, 8192, 4096]
    - [6, 9.202]
  - - [4096, 8192, 1, 128, 4096, 4096, 128, 8192]
    - [2, 2.426]
  - - [4096, 8192, 1, 256, 4096, 4096, 256, 8192]
    - [38, 3.667]
  - - [4096, 8192, 1, 512, 4096, 4096, 512, 8192]
    - [19, 5.312]
  - - [4096, 8192, 1, 1024, 4096, 4096, 1024, 8192]
    - [6, 6.675]
  - - [4096, 8192, 1, 2048, 4096, 4096, 2048, 8192]
    - [24, 8.1]
  - - [4096, 8192, 1, 4096, 4096, 4096, 4096, 8192]
    - [6, 8.821]
  - - [4096, 8192, 1, 8192, 4096, 4096, 8192, 8192]
    - [16, 8.968]
  - - [8192, 128, 1, 128, 8192, 8192, 128, 128]
    - [64, 1.517]
  - - [8192, 128, 1, 256, 8192, 8192, 256, 128]
    - [44, 2.426]
  - - [8192, 128, 1, 512, 8192, 8192, 512, 128]
    - [65, 3.573]
  - - [8192, 128, 1, 1024, 8192, 8192, 1024, 128]
    - [67, 4.786]
  - - [8192, 128, 1, 2048, 8192, 8192, 2048, 128]
    - [67, 5.904]
  - - [8192, 128, 1, 4096, 8192, 8192, 4096, 128]
    - [76, 6.945]
  - - [8192, 128, 1, 8192, 8192, 8192, 8192, 128]
    - [69, 8.03]
  - - [8192, 256, 1, 128, 8192, 8192, 128, 256]
    - [14, 1.811]
  - - [8192, 256, 1, 256, 8192, 8192, 256, 256]
    - [5, 2.893]
  - - [8192, 256, 1, 512, 8192, 8192, 512, 256]
    - [21, 4.292]
  - - [8192, 256, 1, 1024, 8192, 8192, 1024, 256]
    - [30, 5.657]
  - - [8192, 256, 1, 2048, 8192, 8192, 2048, 256]
    - [59, 7.103]
  - - [8192, 256, 1, 4096, 8192, 8192, 4096, 256]
    - [63, 8.165]
  - - [8192, 256, 1, 8192, 8192, 8192, 8192, 256]
    - [26, 9.063]
  - - [8192, 512, 1, 128, 8192, 8192, 128, 512]
    - [33, 1.885]
  - - [8192, 512, 1, 256, 8192, 8192, 256, 512]
    - [66, 2.958]
  - - [8192, 512, 1, 512, 8192, 8192, 512, 512]
    - [6, 4.696]
  - - [8192, 512, 1, 1024, 8192, 8192, 1024, 512]
    - [9, 6.404]
  - - [8192, 512, 1, 2048, 8192, 8192, 2048, 512]
    - [6, 7.833]
  - - [8192, 512, 1, 4096, 8192, 8192, 4096, 512]
    - [24, 8.762]
  - - [8192, 512, 1, 8192, 8192, 8192, 8192, 512]
    - [26, 9.408]
  - - [8192, 1024, 1, 128, 8192, 8192, 128, 1024]
    - [59, 2.074]
  - - [8192, 1024, 1, 256, 8192, 8192, 256, 1024]
    - [42, 3.316]
  - - [8192, 1024, 1, 512, 8192, 8192, 512, 1024]
    - [42, 5.0]
  - - [8192, 1024, 1, 1024, 8192, 8192, 1024, 1024]
    - [41, 6.441]
  - - [8192, 1024, 1, 2048, 8192, 8192, 2048, 1024]
    - [14, 7.883]
  - - [8192, 1024, 1, 4096, 8192, 8192, 4096, 1024]
    - [16, 8.746]
  - - [8192, 1024, 1, 8192, 8192, 8192, 8192, 1024]
    - [18, 9.038]
  - - [8192, 2048, 1, 128, 8192, 8192, 128, 2048]
    - [64, 2.307]
  - - [8192, 2048, 1, 256, 8192, 8192, 256, 2048]
    - [10, 3.627]
  - - [8192, 2048, 1, 512, 8192, 8192, 512, 2048]
    - [11, 5.388]
  - - [8192, 2048, 1, 1024, 8192, 8192, 1024, 2048]
    - [21, 6.997]
  - - [8192, 2048, 1, 2048, 8192, 8192, 2048, 2048]
    - [22, 8.084]
  - - [8192, 2048, 1, 4096, 8192, 8192, 4096, 2048]
    - [18, 8.981]
  - - [8192, 2048, 1, 8192, 8192, 8192, 8192, 2048]
    - [6, 8.904]
  - - [8192, 4096, 1, 128, 8192, 8192, 128, 4096]
    - [56, 2.414]
  - - [8192, 4096, 1, 256, 8192, 8192, 256, 4096]
    - [10, 3.769]
  - - [8192, 4096, 1, 512, 8192, 8192, 512, 4096]
    - [23, 5.258]
  - - [8192, 4096, 1, 1024, 8192, 8192, 1024, 4096]
    - [21, 6.686]
  - - [8192, 4096, 1, 2048, 8192, 8192, 2048, 4096]
    - [24, 7.947]
  - - [8192, 4096, 1, 4096, 8192, 8192, 4096, 4096]
    - [27, 8.754]
  - - [8192, 4096, 1, 8192, 8192, 8192, 8192, 4096]
    - [9, 8.605]
  - - [8192, 8192, 1, 128, 8192, 8192, 128, 8192]
    - [1, 2.161]
  - - [8192, 8192, 1, 256, 8192, 8192, 256, 8192]
    - [0, 3.449]
  - - [8192, 8192, 1, 512, 8192, 8192, 512, 8192]
    - [19, 5.379]
  - - [8192, 8192, 1, 1024, 8192, 8192, 1024, 8192]
    - [20, 6.928]
  - - [8192, 8192, 1, 2048, 8192, 8192, 2048, 8192]
    - [6, 8.05]
  - - [8192, 8192, 1, 4096, 8192, 8192, 4096, 8192]
    - [13, 8.595]
  - - [8192, 8192, 1, 8192, 8192, 8192, 8192, 8192]
    - [9, 8.55]
  - - [1, 1, 1, 32, 1, 1, 32, 1]
    - [118, 0.0]
- null
- null
- ExperimentalStreamK
- GridBased
