library/src/amd_detail/rocblaslt/src/Tensile/Logic/asm_full/aquavanjaram/gfx942_38cu/StreamK/aquavanjaram942_Cijk_Ailk_Bljk_BBS_BH_UserArgs.yaml
- {MinimumRequiredVersion: 4.33.0}
- aquavanjaram942
- {Architecture: gfx942, CUCount: 38}
- [Device 0049, Device 0050]
    SolutionIndex: 0
    SolutionNameMin: Cijk_Ailk_Bljk_BBS_BH_UserArgs_MT256x256x32_MI16x16x1_SN_LDSB1_CLR1_GSU0_GSUC0_GSUWGMRR0_K1_LBSPPA2048_LBSPPB128_LPA32_MIWT8_8_PLR1_SU32_SUM0_SUS256_VWA2_VWB1_WGM1_WGMXCC1_WGMXCCGn1
    SolutionIndex: 1
    SolutionNameMin: Cijk_Ailk_Bljk_BBS_BH_UserArgs_MT256x256x32_MI16x16x1_SN_LDSB1_CLR1_GSU0_GSUC0_GSUWGMRR0_K1_LBSPPA2048_LBSPPB128_LPA0_MIWT8_8_PLR1_SU32_SUM0_SUS256_VWA4_VWB1_WGM1_WGMXCC1_WGMXCCGn1
    SolutionIndex: 2
    SolutionNameMin: Cijk_Ailk_Bljk_BBS_BH_UserArgs_MT256x256x32_MI16x16x1_SN_LDSB1_CLR1_GSU0_GSUC0_GSUWGMRR0_K1_LBSPPA2048_LBSPPB128_LPA0_MIWT8_8_PLR1_SU32_SUM0_SUS256_VWA8_VWB1_WGM1_WGMXCC1_WGMXCCGn1
    SolutionIndex: 3
    SolutionNameMin: Cijk_Ailk_Bljk_BBS_BH_UserArgs_MT256x256x32_MI16x16x1_SN_LDSB1_CLR1_GSU0_GSUC0_GSUWGMRR0_K1_LBSPPA2048_LBSPPB128_LPA0_MIWT8_8_PLR1_SU32_SUM0_SUS256_VWA4_VWB2_WGM1_WGMXCC1_WGMXCCGn1
    SolutionIndex: 4
    SolutionNameMin: Cijk_Ailk_Bljk_BBS_BH_UserArgs_MT256x256x32_MI16x16x1_SN_LDSB1_CLR1_GSU0_GSUC0_GSUWGMRR0_K1_LBSPPA2048_LBSPPB128_LPA0_MIWT8_8_PLR1_SU32_SUM0_SUS256_VWA8_VWB2_WGM1_WGMXCC1_WGMXCCGn1
    SolutionIndex: 5
    SolutionNameMin: Cijk_Ailk_Bljk_BBS_BH_UserArgs_MT256x256x32_MI16x16x1_SN_LDSB1_CLR1_GSU0_GSUC0_GSUWGMRR0_K1_LBSPPA2048_LBSPPB256_LPA0_MIWT8_8_PLR1_SU32_SUM0_SUS256_VWA4_VWB4_WGM1_WGMXCC1_WGMXCCGn1
    SolutionIndex: 6
    SolutionNameMin: Cijk_Ailk_Bljk_BBS_BH_UserArgs_MT256x256x32_MI16x16x1_SN_LDSB1_CLR1_GSU0_GSUC0_GSUWGMRR0_K1_LBSPPA2048_LBSPPB256_LPA0_MIWT8_8_PLR1_SU32_SUM0_SUS256_VWA8_VWB4_WGM1_WGMXCC1_WGMXCCGn1
    SolutionIndex: 7
    SolutionNameMin: Cijk_Ailk_Bljk_BBS_BH_UserArgs_MT256x256x32_MI16x16x1_SN_LDSB1_CLR1_GSU0_GSUC0_GSUWGMRR0_K1_LBSPPA2048_LBSPPB512_LPA0_MIWT8_8_PLR1_SU32_SUM0_SUS256_VWA4_VWB8_WGM1_WGMXCC1_WGMXCCGn1
    SolutionIndex: 8
    SolutionNameMin: Cijk_Ailk_Bljk_BBS_BH_UserArgs_MT256x256x32_MI16x16x1_SN_LDSB1_CLR1_GSU0_GSUC0_GSUWGMRR0_K1_LBSPPA2048_LBSPPB512_LPA0_MIWT8_8_PLR1_SU32_SUM0_SUS256_VWA8_VWB8_WGM1_WGMXCC1_WGMXCCGn1
    SolutionIndex: 9
    SolutionNameMin: Cijk_Ailk_Bljk_BBS_BH_UserArgs_MT256x256x32_MI16x16x1_SN_LDSB1_CLR1_GSU0_GSUC0_GSUWGMRR0_K1_LBSPPA2048_LBSPPB128_LPA32_MIWT8_8_PLR1_SU32_SUM0_SUS256_VWA2_VWB1_WGM4_WGMXCC1_WGMXCCGn1
    SolutionIndex: 10
    SolutionNameMin: Cijk_Ailk_Bljk_BBS_BH_UserArgs_MT256x256x32_MI16x16x1_SN_LDSB1_CLR1_GSU0_GSUC0_GSUWGMRR0_K1_LBSPPA2048_LBSPPB128_LPA0_MIWT8_8_PLR1_SU32_SUM0_SUS256_VWA4_VWB1_WGM4_WGMXCC1_WGMXCCGn1
    SolutionIndex: 11
    SolutionNameMin: Cijk_Ailk_Bljk_BBS_BH_UserArgs_MT256x256x32_MI16x16x1_SN_LDSB1_CLR1_GSU0_GSUC0_GSUWGMRR0_K1_LBSPPA2048_LBSPPB128_LPA0_MIWT8_8_PLR1_SU32_SUM0_SUS256_VWA8_VWB1_WGM4_WGMXCC1_WGMXCCGn1
    SolutionIndex: 12
    SolutionNameMin: Cijk_Ailk_Bljk_BBS_BH_UserArgs_MT256x256x32_MI16x16x1_SN_LDSB1_CLR1_GSU0_GSUC0_GSUWGMRR0_K1_LBSPPA2048_LBSPPB128_LPA32_MIWT8_8_PLR1_SU32_SUM0_SUS256_VWA2_VWB2_WGM4_WGMXCC1_WGMXCCGn1
    SolutionIndex: 13
    SolutionNameMin: Cijk_Ailk_Bljk_BBS_BH_UserArgs_MT256x256x32_MI16x16x1_SN_LDSB1_CLR1_GSU0_GSUC0_GSUWGMRR0_K1_LBSPPA2048_LBSPPB128_LPA0_MIWT8_8_PLR1_SU32_SUM0_SUS256_VWA4_VWB2_WGM4_WGMXCC1_WGMXCCGn1
    SolutionIndex: 14
    SolutionNameMin: Cijk_Ailk_Bljk_BBS_BH_UserArgs_MT256x256x32_MI16x16x1_SN_LDSB1_CLR1_GSU0_GSUC0_GSUWGMRR0_K1_LBSPPA2048_LBSPPB128_LPA0_MIWT8_8_PLR1_SU32_SUM0_SUS256_VWA8_VWB2_WGM4_WGMXCC1_WGMXCCGn1
    SolutionIndex: 15
    SolutionNameMin: Cijk_Ailk_Bljk_BBS_BH_UserArgs_MT256x256x32_MI16x16x1_SN_LDSB1_CLR1_GSU0_GSUC0_GSUWGMRR0_K1_LBSPPA2048_LBSPPB256_LPA0_MIWT8_8_PLR1_SU32_SUM0_SUS256_VWA4_VWB4_WGM4_WGMXCC1_WGMXCCGn1
    SolutionIndex: 16
    SolutionNameMin: Cijk_Ailk_Bljk_BBS_BH_UserArgs_MT256x256x32_MI16x16x1_SN_LDSB1_CLR1_GSU0_GSUC0_GSUWGMRR0_K1_LBSPPA2048_LBSPPB256_LPA0_MIWT8_8_PLR1_SU32_SUM0_SUS256_VWA8_VWB4_WGM4_WGMXCC1_WGMXCCGn1
    SolutionIndex: 17
    SolutionNameMin: Cijk_Ailk_Bljk_BBS_BH_UserArgs_MT256x256x32_MI16x16x1_SN_LDSB1_CLR1_GSU0_GSUC0_GSUWGMRR0_K1_LBSPPA2048_LBSPPB512_LPA0_MIWT8_8_PLR1_SU32_SUM0_SUS256_VWA4_VWB8_WGM4_WGMXCC1_WGMXCCGn1
    SolutionIndex: 18
    SolutionNameMin: Cijk_Ailk_Bljk_BBS_BH_UserArgs_MT256x256x32_MI16x16x1_SN_LDSB1_CLR1_GSU0_GSUC0_GSUWGMRR0_K1_LBSPPA2048_LBSPPB512_LPA0_MIWT8_8_PLR1_SU32_SUM0_SUS256_VWA8_VWB8_WGM4_WGMXCC1_WGMXCCGn1
    SolutionIndex: 19
    SolutionNameMin: Cijk_Ailk_Bljk_BBS_BH_UserArgs_MT256x256x32_MI16x16x1_SN_LDSB1_CLR1_GSU0_GSUC0_GSUWGMRR0_K1_LBSPPA2048_LBSPPB128_LPA32_MIWT8_8_PLR1_SU32_SUM0_SUS256_VWA2_VWB1_WGM8_WGMXCC1_WGMXCCGn1
    SolutionIndex: 20
    SolutionNameMin: Cijk_Ailk_Bljk_BBS_BH_UserArgs_MT256x256x32_MI16x16x1_SN_LDSB1_CLR1_GSU0_GSUC0_GSUWGMRR0_K1_LBSPPA2048_LBSPPB128_LPA0_MIWT8_8_PLR1_SU32_SUM0_SUS256_VWA4_VWB1_WGM8_WGMXCC1_WGMXCCGn1
    SolutionIndex: 21
    SolutionNameMin: Cijk_Ailk_Bljk_BBS_BH_UserArgs_MT256x256x32_MI16x16x1_SN_LDSB1_CLR1_GSU0_GSUC0_GSUWGMRR0_K1_LBSPPA2048_LBSPPB128_LPA0_MIWT8_8_PLR1_SU32_SUM0_SUS256_VWA8_VWB1_WGM8_WGMXCC1_WGMXCCGn1
    SolutionIndex: 22
    SolutionNameMin: Cijk_Ailk_Bljk_BBS_BH_UserArgs_MT256x256x32_MI16x16x1_SN_LDSB1_CLR1_GSU0_GSUC0_GSUWGMRR0_K1_LBSPPA2048_LBSPPB128_LPA32_MIWT8_8_PLR1_SU32_SUM0_SUS256_VWA2_VWB2_WGM8_WGMXCC1_WGMXCCGn1
    SolutionIndex: 23
    SolutionNameMin: Cijk_Ailk_Bljk_BBS_BH_UserArgs_MT256x256x32_MI16x16x1_SN_LDSB1_CLR1_GSU0_GSUC0_GSUWGMRR0_K1_LBSPPA2048_LBSPPB128_LPA0_MIWT8_8_PLR1_SU32_SUM0_SUS256_VWA4_VWB2_WGM8_WGMXCC1_WGMXCCGn1
    SolutionIndex: 24
    SolutionNameMin: Cijk_Ailk_Bljk_BBS_BH_UserArgs_MT256x256x32_MI16x16x1_SN_LDSB1_CLR1_GSU0_GSUC0_GSUWGMRR0_K1_LBSPPA2048_LBSPPB128_LPA0_MIWT8_8_PLR1_SU32_SUM0_SUS256_VWA8_VWB2_WGM8_WGMXCC1_WGMXCCGn1
    SolutionIndex: 25
    SolutionNameMin: Cijk_Ailk_Bljk_BBS_BH_UserArgs_MT256x256x32_MI16x16x1_SN_LDSB1_CLR1_GSU0_GSUC0_GSUWGMRR0_K1_LBSPPA2048_LBSPPB256_LPA0_MIWT8_8_PLR1_SU32_SUM0_SUS256_VWA4_VWB4_WGM8_WGMXCC1_WGMXCCGn1
    SolutionIndex: 26
    SolutionNameMin: Cijk_Ailk_Bljk_BBS_BH_UserArgs_MT256x256x32_MI16x16x1_SN_LDSB1_CLR1_GSU0_GSUC0_GSUWGMRR0_K1_LBSPPA2048_LBSPPB256_LPA0_MIWT8_8_PLR1_SU32_SUM0_SUS256_VWA8_VWB4_WGM8_WGMXCC1_WGMXCCGn1
    SolutionIndex: 27
    SolutionNameMin: Cijk_Ailk_Bljk_BBS_BH_UserArgs_MT256x256x32_MI16x16x1_SN_LDSB1_CLR1_GSU0_GSUC0_GSUWGMRR0_K1_LBSPPA2048_LBSPPB512_LPA0_MIWT8_8_PLR1_SU32_SUM0_SUS256_VWA4_VWB8_WGM8_WGMXCC1_WGMXCCGn1
    SolutionIndex: 28
    SolutionNameMin: Cijk_Ailk_Bljk_BBS_BH_UserArgs_MT256x256x32_MI16x16x1_SN_LDSB1_CLR1_GSU0_GSUC0_GSUWGMRR0_K1_LBSPPA2048_LBSPPB512_LPA0_MIWT8_8_PLR1_SU32_SUM0_SUS256_VWA8_VWB8_WGM8_WGMXCC1_WGMXCCGn1
    SolutionIndex: 29
    SolutionNameMin: Cijk_Ailk_Bljk_BBS_BH_UserArgs_MT128x256x32_MI16x16x1_SN_LDSB1_CLR1_GSU0_GSUC0_GSUWGMRR0_K1_LBSPPA1024_LBSPPB512_LPA0_MIWT4_8_PLR1_SU32_SUM0_SUS256_VWA4_VWB8_WGM1_WGMXCC1_WGMXCCGn1
    SolutionIndex: 30
    SolutionNameMin: Cijk_Ailk_Bljk_BBS_BH_UserArgs_MT256x128x32_MI16x16x1_SN_LDSB1_CLR1_GSU0_GSUC0_GSUWGMRR0_K1_LBSPPA2048_LBSPPB128_LPA0_MIWT8_4_PLR1_SU32_SUM0_SUS256_VWA4_VWB1_WGM1_WGMXCC1_WGMXCCGn1
    SolutionIndex: 31
    SolutionNameMin: Cijk_Ailk_Bljk_BBS_BH_UserArgs_MT256x128x32_MI16x16x1_SN_LDSB1_CLR1_GSU0_GSUC0_GSUWGMRR0_K1_LBSPPA2048_LBSPPB128_LPA0_MIWT8_4_PLR1_SU32_SUM0_SUS256_VWA8_VWB1_WGM1_WGMXCC1_WGMXCCGn1
    SolutionIndex: 32
    SolutionNameMin: Cijk_Ailk_Bljk_BBS_BH_UserArgs_MT256x128x32_MI16x16x1_SN_LDSB1_CLR1_GSU0_GSUC0_GSUWGMRR0_K1_LBSPPA2048_LBSPPB128_LPA0_MIWT8_4_PLR1_SU32_SUM0_SUS256_VWA4_VWB2_WGM1_WGMXCC1_WGMXCCGn1
    SolutionIndex: 33
    SolutionNameMin: Cijk_Ailk_Bljk_BBS_BH_UserArgs_MT256x128x32_MI16x16x1_SN_LDSB1_CLR1_GSU0_GSUC0_GSUWGMRR0_K1_LBSPPA2048_LBSPPB128_LPA0_MIWT8_4_PLR1_SU32_SUM0_SUS256_VWA8_VWB2_WGM1_WGMXCC1_WGMXCCGn1
    SolutionIndex: 34
    SolutionNameMin: Cijk_Ailk_Bljk_BBS_BH_UserArgs_MT256x128x32_MI16x16x1_SN_LDSB1_CLR1_GSU0_GSUC0_GSUWGMRR0_K1_LBSPPA2048_LBSPPB256_LPA0_MIWT8_4_PLR1_SU32_SUM0_SUS256_VWA4_VWB4_WGM1_WGMXCC1_WGMXCCGn1
    SolutionIndex: 35
    SolutionNameMin: Cijk_Ailk_Bljk_BBS_BH_UserArgs_MT256x128x32_MI16x16x1_SN_LDSB1_CLR1_GSU0_GSUC0_GSUWGMRR0_K1_LBSPPA2048_LBSPPB128_LPA0_MIWT8_4_PLR1_SU32_SUM0_SUS256_VWA4_VWB1_WGM4_WGMXCC1_WGMXCCGn1
    SolutionIndex: 36
    SolutionNameMin: Cijk_Ailk_Bljk_BBS_BH_UserArgs_MT256x128x32_MI16x16x1_SN_LDSB1_CLR1_GSU0_GSUC0_GSUWGMRR0_K1_LBSPPA2048_LBSPPB128_LPA0_MIWT8_4_PLR1_SU32_SUM0_SUS256_VWA8_VWB1_WGM4_WGMXCC1_WGMXCCGn1
    SolutionIndex: 37
    SolutionNameMin: Cijk_Ailk_Bljk_BBS_BH_UserArgs_MT256x128x32_MI16x16x1_SN_LDSB1_CLR1_GSU0_GSUC0_GSUWGMRR0_K1_LBSPPA2048_LBSPPB128_LPA0_MIWT8_4_PLR1_SU32_SUM0_SUS256_VWA4_VWB2_WGM4_WGMXCC1_WGMXCCGn1
    SolutionIndex: 38
    SolutionNameMin: Cijk_Ailk_Bljk_BBS_BH_UserArgs_MT256x128x32_MI16x16x1_SN_LDSB1_CLR1_GSU0_GSUC0_GSUWGMRR0_K1_LBSPPA2048_LBSPPB128_LPA0_MIWT8_4_PLR1_SU32_SUM0_SUS256_VWA8_VWB2_WGM4_WGMXCC1_WGMXCCGn1
    SolutionIndex: 39
    SolutionNameMin: Cijk_Ailk_Bljk_BBS_BH_UserArgs_MT256x128x32_MI16x16x1_SN_LDSB1_CLR1_GSU0_GSUC0_GSUWGMRR0_K1_LBSPPA2048_LBSPPB256_LPA0_MIWT8_4_PLR1_SU32_SUM0_SUS256_VWA4_VWB4_WGM4_WGMXCC1_WGMXCCGn1
    SolutionIndex: 40
    SolutionNameMin: Cijk_Ailk_Bljk_BBS_BH_UserArgs_MT256x128x32_MI16x16x1_SN_LDSB1_CLR1_GSU0_GSUC0_GSUWGMRR0_K1_LBSPPA2048_LBSPPB128_LPA0_MIWT8_4_PLR1_SU32_SUM0_SUS256_VWA4_VWB1_WGM8_WGMXCC1_WGMXCCGn1
    SolutionIndex: 41
    SolutionNameMin: Cijk_Ailk_Bljk_BBS_BH_UserArgs_MT256x128x32_MI16x16x1_SN_LDSB1_CLR1_GSU0_GSUC0_GSUWGMRR0_K1_LBSPPA2048_LBSPPB128_LPA0_MIWT8_4_PLR1_SU32_SUM0_SUS256_VWA8_VWB1_WGM8_WGMXCC1_WGMXCCGn1
    SolutionIndex: 42
    SolutionNameMin: Cijk_Ailk_Bljk_BBS_BH_UserArgs_MT256x128x32_MI16x16x1_SN_LDSB1_CLR1_GSU0_GSUC0_GSUWGMRR0_K1_LBSPPA2048_LBSPPB128_LPA0_MIWT8_4_PLR1_SU32_SUM0_SUS256_VWA8_VWB2_WGM8_WGMXCC1_WGMXCCGn1
    SolutionIndex: 43
    SolutionNameMin: Cijk_Ailk_Bljk_BBS_BH_UserArgs_MT256x128x32_MI16x16x1_SN_LDSB1_CLR1_GSU0_GSUC0_GSUWGMRR0_K1_LBSPPA2048_LBSPPB256_LPA0_MIWT8_4_PLR1_SU32_SUM0_SUS256_VWA8_VWB4_WGM8_WGMXCC1_WGMXCCGn1
    SolutionIndex: 44
    SolutionNameMin: Cijk_Ailk_Bljk_BBS_BH_UserArgs_MT256x64x32_MI16x16x1_SN_LDSB1_CLR1_GSU0_GSUC0_GSUWGMRR0_K1_LBSPPA2048_LBSPPB128_LPA0_MIWT8_2_PLR1_SU32_SUM0_SUS256_VWA8_VWB2_WGM1_WGMXCC1_WGMXCCGn1
    SolutionIndex: 45
    SolutionNameMin: Cijk_Ailk_Bljk_BBS_BH_UserArgs_MT128x64x32_MI16x16x1_SN_LDSB0_CLR1_GSU0_GSUC0_GSUWGMRR0_K1_LBSPPA1024_LBSPPB128_LPA0_MIWT4_2_PLR1_SU32_SUM0_SUS256_VWA4_VWB2_WGM1_WGMXCC1_WGMXCCGn1
    SolutionIndex: 46
    SolutionNameMin: Cijk_Ailk_Bljk_BBS_BH_UserArgs_MT64x64x32_MI16x16x1_SN_LDSB0_CLR0_GSU0_GSUC0_GSUWGMRR0_K1_LBSPPA512_LBSPPB128_LPA32_MIWT2_2_PLR0_SU32_SUM0_SUS256_VWA2_VWB2_WGM1_WGMXCC1_WGMXCCGn1
    SolutionIndex: 47
    SolutionNameMin: Cijk_Ailk_Bljk_BBS_BH_UserArgs_MT32x32x32_MI16x16x1_SN_LDSB0_CLR0_GSU0_GSUC0_GSUWGMRR0_K1_LBSPPA256_LBSPPB128_LPA16_MIWT1_1_PLR0_SU32_SUM0_SUS256_VWA1_VWB1_WGM1_WGMXCC1_WGMXCCGn1
    SolutionIndex: 48
    SolutionNameMin: Cijk_Ailk_Bljk_BBS_BH_UserArgs_MT128x256x64_MI16x16x1_SN_LDSB1_CLR1_GSU0_GSUC0_GSUWGMRR0_K1_LBSPPA2048_LBSPPB128_LPA32_MIWT4_8_PLR1_SU32_SUM0_SUS256_VWA2_VWB1_WGM1_WGMXCC1_WGMXCCGn1
    SolutionIndex: 49
    SolutionNameMin: Cijk_Ailk_Bljk_BBS_BH_UserArgs_MT128x256x64_MI16x16x1_SN_LDSB1_CLR1_GSU0_GSUC0_GSUWGMRR0_K1_LBSPPA2048_LBSPPB128_LPA0_MIWT4_8_PLR1_SU32_SUM0_SUS256_VWA4_VWB1_WGM1_WGMXCC1_WGMXCCGn1
    SolutionIndex: 50
    SolutionNameMin: Cijk_Ailk_Bljk_BBS_BH_UserArgs_MT128x256x64_MI16x16x1_SN_LDSB1_CLR1_GSU0_GSUC0_GSUWGMRR0_K1_LBSPPA2048_LBSPPB256_LPA0_MIWT4_8_PLR1_SU32_SUM0_SUS256_VWA4_VWB2_WGM1_WGMXCC1_WGMXCCGn1
    SolutionIndex: 51
    SolutionNameMin: Cijk_Ailk_Bljk_BBS_BH_UserArgs_MT128x256x64_MI16x16x1_SN_LDSB1_CLR1_GSU0_GSUC0_GSUWGMRR0_K1_LBSPPA2048_LBSPPB512_LPA0_MIWT4_8_PLR1_SU32_SUM0_SUS256_VWA4_VWB4_WGM1_WGMXCC1_WGMXCCGn1
    SolutionIndex: 52
    SolutionNameMin: Cijk_Ailk_Bljk_BBS_BH_UserArgs_MT128x256x64_MI16x16x1_SN_LDSB1_CLR1_GSU0_GSUC0_GSUWGMRR0_K1_LBSPPA2048_LBSPPB1024_LPA32_MIWT4_8_PLR1_SU32_SUM0_SUS256_VWA2_VWB8_WGM1_WGMXCC1_WGMXCCGn1
    SolutionIndex: 53
    SolutionNameMin: Cijk_Ailk_Bljk_BBS_BH_UserArgs_MT128x256x64_MI16x16x1_SN_LDSB1_CLR1_GSU0_GSUC0_GSUWGMRR0_K1_LBSPPA2048_LBSPPB1024_LPA0_MIWT4_8_PLR1_SU32_SUM0_SUS256_VWA4_VWB8_WGM1_WGMXCC1_WGMXCCGn1
    SolutionIndex: 54
    SolutionNameMin: Cijk_Ailk_Bljk_BBS_BH_UserArgs_MT128x256x64_MI16x16x1_SN_LDSB1_CLR1_GSU0_GSUC0_GSUWGMRR0_K1_LBSPPA2048_LBSPPB128_LPA32_MIWT4_8_PLR1_SU32_SUM0_SUS256_VWA2_VWB1_WGM4_WGMXCC1_WGMXCCGn1
    SolutionIndex: 55
    SolutionNameMin: Cijk_Ailk_Bljk_BBS_BH_UserArgs_MT128x256x64_MI16x16x1_SN_LDSB1_CLR1_GSU0_GSUC0_GSUWGMRR0_K1_LBSPPA2048_LBSPPB512_LPA0_MIWT4_8_PLR1_SU32_SUM0_SUS256_VWA4_VWB4_WGM4_WGMXCC1_WGMXCCGn1
    SolutionIndex: 56
    SolutionNameMin: Cijk_Ailk_Bljk_BBS_BH_UserArgs_MT128x256x64_MI16x16x1_SN_LDSB1_CLR1_GSU0_GSUC0_GSUWGMRR0_K1_LBSPPA2048_LBSPPB1024_LPA0_MIWT4_8_PLR1_SU32_SUM0_SUS256_VWA4_VWB8_WGM4_WGMXCC1_WGMXCCGn1
    SolutionIndex: 57
    SolutionNameMin: Cijk_Ailk_Bljk_BBS_BH_UserArgs_MT128x256x64_MI16x16x1_SN_LDSB1_CLR1_GSU0_GSUC0_GSUWGMRR0_K1_LBSPPA2048_LBSPPB512_LPA0_MIWT4_8_PLR1_SU32_SUM0_SUS256_VWA4_VWB4_WGM8_WGMXCC1_WGMXCCGn1
    SolutionIndex: 58
    SolutionNameMin: Cijk_Ailk_Bljk_BBS_BH_UserArgs_MT256x128x64_MI16x16x1_SN_LDSB1_CLR1_GSU0_GSUC0_GSUWGMRR0_K1_LBSPPA4096_LBSPPB128_LPA0_MIWT8_4_PLR1_SU32_SUM0_SUS256_VWA4_VWB1_WGM1_WGMXCC1_WGMXCCGn1
    SolutionIndex: 59
    SolutionNameMin: Cijk_Ailk_Bljk_BBS_BH_UserArgs_MT256x128x64_MI16x16x1_SN_LDSB1_CLR1_GSU0_GSUC0_GSUWGMRR0_K1_LBSPPA4096_LBSPPB128_LPA0_MIWT8_4_PLR1_SU32_SUM0_SUS256_VWA8_VWB1_WGM1_WGMXCC1_WGMXCCGn1
    SolutionIndex: 60
    SolutionNameMin: Cijk_Ailk_Bljk_BBS_BH_UserArgs_MT256x128x64_MI16x16x1_SN_LDSB1_CLR1_GSU0_GSUC0_GSUWGMRR0_K1_LBSPPA4096_LBSPPB256_LPA0_MIWT8_4_PLR1_SU32_SUM0_SUS256_VWA4_VWB2_WGM1_WGMXCC1_WGMXCCGn1
    SolutionIndex: 61
    SolutionNameMin: Cijk_Ailk_Bljk_BBS_BH_UserArgs_MT256x128x64_MI16x16x1_SN_LDSB1_CLR1_GSU0_GSUC0_GSUWGMRR0_K1_LBSPPA4096_LBSPPB256_LPA0_MIWT8_4_PLR1_SU32_SUM0_SUS256_VWA8_VWB2_WGM1_WGMXCC1_WGMXCCGn1
    SolutionIndex: 62
    SolutionNameMin: Cijk_Ailk_Bljk_BBS_BH_UserArgs_MT256x128x64_MI16x16x1_SN_LDSB1_CLR1_GSU0_GSUC0_GSUWGMRR0_K1_LBSPPA4096_LBSPPB512_LPA0_MIWT8_4_PLR1_SU32_SUM0_SUS256_VWA4_VWB4_WGM1_WGMXCC1_WGMXCCGn1
    SolutionIndex: 63
    SolutionNameMin: Cijk_Ailk_Bljk_BBS_BH_UserArgs_MT256x128x64_MI16x16x1_SN_LDSB1_CLR1_GSU0_GSUC0_GSUWGMRR0_K1_LBSPPA4096_LBSPPB512_LPA0_MIWT8_4_PLR1_SU32_SUM0_SUS256_VWA8_VWB4_WGM1_WGMXCC1_WGMXCCGn1
    SolutionIndex: 64
    SolutionNameMin: Cijk_Ailk_Bljk_BBS_BH_UserArgs_MT256x128x64_MI16x16x1_SN_LDSB1_CLR1_GSU0_GSUC0_GSUWGMRR0_K1_LBSPPA4096_LBSPPB256_LPA0_MIWT8_4_PLR1_SU32_SUM0_SUS256_VWA4_VWB2_WGM4_WGMXCC1_WGMXCCGn1
    SolutionIndex: 65
    SolutionNameMin: Cijk_Ailk_Bljk_BBS_BH_UserArgs_MT256x128x64_MI16x16x1_SN_LDSB1_CLR1_GSU0_GSUC0_GSUWGMRR0_K1_LBSPPA4096_LBSPPB256_LPA0_MIWT8_4_PLR1_SU32_SUM0_SUS256_VWA8_VWB2_WGM4_WGMXCC1_WGMXCCGn1
    SolutionIndex: 66
    SolutionNameMin: Cijk_Ailk_Bljk_BBS_BH_UserArgs_MT256x128x64_MI16x16x1_SN_LDSB1_CLR1_GSU0_GSUC0_GSUWGMRR0_K1_LBSPPA4096_LBSPPB512_LPA0_MIWT8_4_PLR1_SU32_SUM0_SUS256_VWA4_VWB4_WGM4_WGMXCC1_WGMXCCGn1
    SolutionIndex: 67
    SolutionNameMin: Cijk_Ailk_Bljk_BBS_BH_UserArgs_MT256x128x64_MI16x16x1_SN_LDSB1_CLR1_GSU0_GSUC0_GSUWGMRR0_K1_LBSPPA4096_LBSPPB128_LPA32_MIWT8_4_PLR1_SU32_SUM0_SUS256_VWA2_VWB1_WGM8_WGMXCC1_WGMXCCGn1
    SolutionIndex: 68
    SolutionNameMin: Cijk_Ailk_Bljk_BBS_BH_UserArgs_MT256x128x64_MI16x16x1_SN_LDSB1_CLR1_GSU0_GSUC0_GSUWGMRR0_K1_LBSPPA4096_LBSPPB128_LPA0_MIWT8_4_PLR1_SU32_SUM0_SUS256_VWA4_VWB1_WGM8_WGMXCC1_WGMXCCGn1
    SolutionIndex: 69
    SolutionNameMin: Cijk_Ailk_Bljk_BBS_BH_UserArgs_MT256x128x64_MI16x16x1_SN_LDSB1_CLR1_GSU0_GSUC0_GSUWGMRR0_K1_LBSPPA4096_LBSPPB128_LPA0_MIWT8_4_PLR1_SU32_SUM0_SUS256_VWA8_VWB1_WGM8_WGMXCC1_WGMXCCGn1
    SolutionIndex: 70
    SolutionNameMin: Cijk_Ailk_Bljk_BBS_BH_UserArgs_MT256x128x64_MI16x16x1_SN_LDSB1_CLR1_GSU0_GSUC0_GSUWGMRR0_K1_LBSPPA4096_LBSPPB256_LPA0_MIWT8_4_PLR1_SU32_SUM0_SUS256_VWA4_VWB2_WGM8_WGMXCC1_WGMXCCGn1
    SolutionIndex: 71
    SolutionNameMin: Cijk_Ailk_Bljk_BBS_BH_UserArgs_MT256x128x64_MI16x16x1_SN_LDSB1_CLR1_GSU0_GSUC0_GSUWGMRR0_K1_LBSPPA4096_LBSPPB512_LPA0_MIWT8_4_PLR1_SU32_SUM0_SUS256_VWA4_VWB4_WGM8_WGMXCC1_WGMXCCGn1
    SolutionIndex: 72
    SolutionNameMin: Cijk_Ailk_Bljk_BBS_BH_UserArgs_MT256x128x64_MI16x16x1_SN_LDSB1_CLR1_GSU0_GSUC0_GSUWGMRR0_K1_LBSPPA4096_LBSPPB512_LPA0_MIWT8_4_PLR1_SU32_SUM0_SUS256_VWA8_VWB4_WGM8_WGMXCC1_WGMXCCGn1
    SolutionIndex: 73
    SolutionNameMin: Cijk_Ailk_Bljk_BBS_BH_UserArgs_MT256x64x64_MI16x16x1_SN_LDSB1_CLR1_GSU0_GSUC0_GSUWGMRR0_K1_LBSPPA4096_LBSPPB256_LPA0_MIWT8_2_PLR1_SU32_SUM0_SUS256_VWA4_VWB2_WGM1_WGMXCC1_WGMXCCGn1
    SolutionIndex: 74
    SolutionNameMin: Cijk_Ailk_Bljk_BBS_BH_UserArgs_MT256x64x64_MI16x16x1_SN_LDSB1_CLR1_GSU0_GSUC0_GSUWGMRR0_K1_LBSPPA4096_LBSPPB128_LPA0_MIWT8_2_PLR1_SU32_SUM0_SUS256_VWA4_VWB1_WGM8_WGMXCC1_WGMXCCGn1
    SolutionIndex: 75
    SolutionNameMin: Cijk_Ailk_Bljk_BBS_BH_UserArgs_MT128x128x64_MI16x16x1_SN_LDSB1_CLR1_GSU0_GSUC0_GSUWGMRR0_K1_LBSPPA2048_LBSPPB128_LPA32_MIWT4_4_PLR1_SU32_SUM0_SUS256_VWA2_VWB1_WGM1_WGMXCC1_WGMXCCGn1
    SolutionIndex: 76
    SolutionNameMin: Cijk_Ailk_Bljk_BBS_BH_UserArgs_MT128x128x64_MI16x16x1_SN_LDSB1_CLR1_GSU0_GSUC0_GSUWGMRR0_K1_LBSPPA2048_LBSPPB128_LPA0_MIWT4_4_PLR1_SU32_SUM0_SUS256_VWA4_VWB1_WGM1_WGMXCC1_WGMXCCGn1
    SolutionIndex: 77
    SolutionNameMin: Cijk_Ailk_Bljk_BBS_BH_UserArgs_MT128x128x64_MI16x16x1_SN_LDSB1_CLR1_GSU0_GSUC0_GSUWGMRR0_K1_LBSPPA2048_LBSPPB256_LPA32_MIWT4_4_PLR1_SU32_SUM0_SUS256_VWA2_VWB2_WGM1_WGMXCC1_WGMXCCGn1
    SolutionIndex: 78
    SolutionNameMin: Cijk_Ailk_Bljk_BBS_BH_UserArgs_MT128x128x64_MI16x16x1_SN_LDSB1_CLR1_GSU0_GSUC0_GSUWGMRR0_K1_LBSPPA2048_LBSPPB256_LPA0_MIWT4_4_PLR1_SU32_SUM0_SUS256_VWA4_VWB2_WGM1_WGMXCC1_WGMXCCGn1
    SolutionIndex: 79
    SolutionNameMin: Cijk_Ailk_Bljk_BBS_BH_UserArgs_MT128x128x64_MI16x16x1_SN_LDSB1_CLR1_GSU0_GSUC0_GSUWGMRR0_K1_LBSPPA2048_LBSPPB512_LPA0_MIWT4_4_PLR1_SU32_SUM0_SUS256_VWA4_VWB4_WGM1_WGMXCC1_WGMXCCGn1
    SolutionIndex: 80
    SolutionNameMin: Cijk_Ailk_Bljk_BBS_BH_UserArgs_MT128x128x64_MI16x16x1_SN_LDSB1_CLR1_GSU0_GSUC0_GSUWGMRR0_K1_LBSPPA2048_LBSPPB128_LPA0_MIWT4_4_PLR1_SU32_SUM0_SUS256_VWA4_VWB1_WGM4_WGMXCC1_WGMXCCGn1
    SolutionIndex: 81
    SolutionNameMin: Cijk_Ailk_Bljk_BBS_BH_UserArgs_MT128x128x64_MI16x16x1_SN_LDSB1_CLR1_GSU0_GSUC0_GSUWGMRR0_K1_LBSPPA2048_LBSPPB256_LPA0_MIWT4_4_PLR1_SU32_SUM0_SUS256_VWA4_VWB2_WGM4_WGMXCC1_WGMXCCGn1
    SolutionIndex: 82
    SolutionNameMin: Cijk_Ailk_Bljk_BBS_BH_UserArgs_MT128x128x64_MI16x16x1_SN_LDSB1_CLR1_GSU0_GSUC0_GSUWGMRR0_K1_LBSPPA2048_LBSPPB512_LPA0_MIWT4_4_PLR1_SU32_SUM0_SUS256_VWA4_VWB4_WGM4_WGMXCC1_WGMXCCGn1
    SolutionIndex: 83
    SolutionNameMin: Cijk_Ailk_Bljk_BBS_BH_UserArgs_MT128x128x64_MI16x16x1_SN_LDSB1_CLR1_GSU0_GSUC0_GSUWGMRR0_K1_LBSPPA2048_LBSPPB128_LPA32_MIWT4_4_PLR1_SU32_SUM0_SUS256_VWA2_VWB1_WGM8_WGMXCC1_WGMXCCGn1
    SolutionIndex: 84
    SolutionNameMin: Cijk_Ailk_Bljk_BBS_BH_UserArgs_MT128x128x64_MI16x16x1_SN_LDSB1_CLR1_GSU0_GSUC0_GSUWGMRR0_K1_LBSPPA2048_LBSPPB128_LPA0_MIWT4_4_PLR1_SU32_SUM0_SUS256_VWA4_VWB1_WGM8_WGMXCC1_WGMXCCGn1
    SolutionIndex: 85
    SolutionNameMin: Cijk_Ailk_Bljk_BBS_BH_UserArgs_MT128x128x64_MI16x16x1_SN_LDSB1_CLR1_GSU0_GSUC0_GSUWGMRR0_K1_LBSPPA2048_LBSPPB256_LPA0_MIWT4_4_PLR1_SU32_SUM0_SUS256_VWA4_VWB2_WGM8_WGMXCC1_WGMXCCGn1
    SolutionIndex: 86
    SolutionNameMin: Cijk_Ailk_Bljk_BBS_BH_UserArgs_MT128x128x64_MI16x16x1_SN_LDSB1_CLR1_GSU0_GSUC0_GSUWGMRR0_K1_LBSPPA2048_LBSPPB512_LPA32_MIWT4_4_PLR1_SU32_SUM0_SUS256_VWA2_VWB4_WGM8_WGMXCC1_WGMXCCGn1
    SolutionIndex: 87
    SolutionNameMin: Cijk_Ailk_Bljk_BBS_BH_UserArgs_MT128x128x64_MI16x16x1_SN_LDSB1_CLR1_GSU0_GSUC0_GSUWGMRR0_K1_LBSPPA2048_LBSPPB512_LPA0_MIWT4_4_PLR1_SU32_SUM0_SUS256_VWA4_VWB4_WGM8_WGMXCC1_WGMXCCGn1
    SolutionIndex: 88
    SolutionNameMin: Cijk_Ailk_Bljk_BBS_BH_UserArgs_MT128x64x64_MI16x16x1_SN_LDSB1_CLR1_GSU0_GSUC0_GSUWGMRR0_K1_LBSPPA2048_LBSPPB128_LPA0_MIWT4_2_PLR1_SU32_SUM0_SUS256_VWA4_VWB1_WGM1_WGMXCC1_WGMXCCGn1
    SolutionIndex: 89
    SolutionNameMin: Cijk_Ailk_Bljk_BBS_BH_UserArgs_MT128x64x64_MI16x16x1_SN_LDSB1_CLR1_GSU0_GSUC0_GSUWGMRR0_K1_LBSPPA2048_LBSPPB256_LPA0_MIWT4_2_PLR1_SU32_SUM0_SUS256_VWA4_VWB2_WGM1_WGMXCC1_WGMXCCGn1
    SolutionIndex: 90
    SolutionNameMin: Cijk_Ailk_Bljk_BBS_BH_UserArgs_MT128x64x64_MI16x16x1_SN_LDSB1_CLR1_GSU0_GSUC0_GSUWGMRR0_K1_LBSPPA2048_LBSPPB256_LPA0_MIWT4_2_PLR1_SU32_SUM0_SUS256_VWA4_VWB2_WGM4_WGMXCC1_WGMXCCGn1
    SolutionIndex: 91
    SolutionNameMin: Cijk_Ailk_Bljk_BBS_BH_UserArgs_MT128x64x64_MI16x16x1_SN_LDSB1_CLR1_GSU0_GSUC0_GSUWGMRR0_K1_LBSPPA2048_LBSPPB128_LPA0_MIWT4_2_PLR1_SU32_SUM0_SUS256_VWA4_VWB1_WGM8_WGMXCC1_WGMXCCGn1
    SolutionIndex: 92
    SolutionNameMin: Cijk_Ailk_Bljk_BBS_BH_UserArgs_MT64x64x64_MI16x16x1_SN_LDSB1_CLR1_GSU0_GSUC0_GSUWGMRR0_K1_LBSPPA1024_LBSPPB128_LPA32_MIWT2_2_PLR1_SU32_SUM0_SUS256_VWA2_VWB1_WGM1_WGMXCC1_WGMXCCGn1
    SolutionIndex: 93
    SolutionNameMin: Cijk_Ailk_Bljk_BBS_BH_UserArgs_MT64x64x64_MI16x16x1_SN_LDSB1_CLR1_GSU0_GSUC0_GSUWGMRR0_K1_LBSPPA1024_LBSPPB256_LPA32_MIWT2_2_PLR1_SU32_SUM0_SUS256_VWA2_VWB2_WGM1_WGMXCC1_WGMXCCGn1
    SolutionIndex: 94
    SolutionNameMin: Cijk_Ailk_Bljk_BBS_BH_UserArgs_MT64x32x64_MI16x16x1_SN_LDSB0_CLR1_GSU0_GSUC0_GSUWGMRR0_K1_LBSPPA1024_LBSPPB128_LPA32_MIWT2_1_PLR1_SU32_SUM0_SUS256_VWA2_VWB1_WGM1_WGMXCC1_WGMXCCGn1
    SolutionIndex: 95
    SolutionNameMin: Cijk_Ailk_Bljk_BBS_BH_UserArgs_MT32x32x64_MI16x16x1_SN_LDSB0_CLR1_GSU0_GSUC0_GSUWGMRR0_K1_LBSPPA512_LBSPPB128_LPA16_MIWT1_1_PLR1_SU32_SUM0_SUS256_VWA1_VWB1_WGM1_WGMXCC1_WGMXCCGn1
    SolutionIndex: 96
    SolutionNameMin: Cijk_Ailk_Bljk_BBS_BH_UserArgs_MT32x32x64_MI16x16x1_SN_LDSB0_CLR1_GSU0_GSUC0_GSUWGMRR0_K1_LBSPPA512_LBSPPB128_LPA16_MIWT1_1_PLR1_SU32_SUM0_SUS256_VWA1_VWB1_WGM8_WGMXCC1_WGMXCCGn1
    SolutionIndex: 97
    SolutionNameMin: Cijk_Ailk_Bljk_BBS_BH_UserArgs_MT128x64x128_MI16x16x1_SN_LDSB1_CLR1_GSU0_GSUC0_GSUWGMRR0_K1_LBSPPA2048_LBSPPB256_LPA0_MIWT4_2_PLR1_SU32_SUM0_SUS256_VWA4_VWB1_WGM1_WGMXCC1_WGMXCCGn1
    SolutionIndex: 98
    SolutionNameMin: Cijk_Ailk_Bljk_BBS_BH_UserArgs_MT128x64x128_MI16x16x1_SN_LDSB1_CLR1_GSU0_GSUC0_GSUWGMRR0_K1_LBSPPA2048_LBSPPB512_LPA0_MIWT4_2_PLR1_SU32_SUM0_SUS256_VWA4_VWB2_WGM1_WGMXCC1_WGMXCCGn1
    SolutionIndex: 99
    SolutionNameMin: Cijk_Ailk_Bljk_BBS_BH_UserArgs_MT128x64x128_MI16x16x1_SN_LDSB1_CLR1_GSU0_GSUC0_GSUWGMRR0_K1_LBSPPA2048_LBSPPB256_LPA0_MIWT4_2_PLR2_SU32_SUM0_SUS256_VWA4_VWB1_WGM1_WGMXCC1_WGMXCCGn1
    SolutionIndex: 100
    SolutionNameMin: Cijk_Ailk_Bljk_BBS_BH_UserArgs_MT128x64x128_MI16x16x1_SN_LDSB1_CLR1_GSU0_GSUC0_GSUWGMRR0_K1_LBSPPA2048_LBSPPB512_LPA0_MIWT4_2_PLR2_SU32_SUM0_SUS256_VWA4_VWB2_WGM1_WGMXCC1_WGMXCCGn1
    SolutionIndex: 101
    SolutionNameMin: Cijk_Ailk_Bljk_BBS_BH_UserArgs_MT128x64x128_MI16x16x1_SN_LDSB1_CLR1_GSU0_GSUC0_GSUWGMRR0_K1_LBSPPA2048_LBSPPB256_LPA0_MIWT4_2_PLR1_SU32_SUM0_SUS256_VWA4_VWB1_WGM4_WGMXCC1_WGMXCCGn1
    SolutionIndex: 102
    SolutionNameMin: Cijk_Ailk_Bljk_BBS_BH_UserArgs_MT128x64x128_MI16x16x1_SN_LDSB1_CLR1_GSU0_GSUC0_GSUWGMRR0_K1_LBSPPA2048_LBSPPB256_LPA0_MIWT4_2_PLR2_SU32_SUM0_SUS256_VWA4_VWB1_WGM4_WGMXCC1_WGMXCCGn1
    SolutionIndex: 103
    SolutionNameMin: Cijk_Ailk_Bljk_BBS_BH_UserArgs_MT64x64x128_MI16x16x1_SN_LDSB1_CLR1_GSU0_GSUC0_GSUWGMRR0_K1_LBSPPA1024_LBSPPB256_LPA32_MIWT2_2_PLR2_SU32_SUM0_SUS256_VWA2_VWB1_WGM1_WGMXCC1_WGMXCCGn1
    SolutionIndex: 104
    SolutionNameMin: Cijk_Ailk_Bljk_BBS_BH_UserArgs_MT64x64x128_MI16x16x1_SN_LDSB1_CLR1_GSU0_GSUC0_GSUWGMRR0_K1_LBSPPA1024_LBSPPB512_LPA32_MIWT2_2_PLR2_SU32_SUM0_SUS256_VWA2_VWB2_WGM1_WGMXCC1_WGMXCCGn1
    SolutionIndex: 105
    SolutionNameMin: Cijk_Ailk_Bljk_BBS_BH_UserArgs_MT64x64x128_MI16x16x1_SN_LDSB1_CLR1_GSU0_GSUC0_GSUWGMRR0_K1_LBSPPA1024_LBSPPB512_LPA32_MIWT2_2_PLR2_SU32_SUM0_SUS256_VWA2_VWB2_WGM4_WGMXCC1_WGMXCCGn1
    SolutionIndex: 106
    SolutionNameMin: Cijk_Ailk_Bljk_BBS_BH_UserArgs_MT32x64x128_MI16x16x1_SN_LDSB1_CLR1_GSU0_GSUC0_GSUWGMRR0_K1_LBSPPA512_LBSPPB256_LPA16_MIWT1_2_PLR2_SU32_SUM0_SUS256_VWA1_VWB1_WGM1_WGMXCC1_WGMXCCGn1
    SolutionIndex: 107
    SolutionNameMin: Cijk_Ailk_Bljk_BBS_BH_UserArgs_MT64x32x128_MI16x16x1_SN_LDSB1_CLR1_GSU0_GSUC0_GSUWGMRR0_K1_LBSPPA1024_LBSPPB256_LPA32_MIWT2_1_PLR2_SU32_SUM0_SUS256_VWA2_VWB1_WGM1_WGMXCC1_WGMXCCGn1
    SolutionIndex: 108
    SolutionNameMin: Cijk_Ailk_Bljk_BBS_BH_UserArgs_MT32x32x128_MI16x16x1_SN_LDSB1_CLR1_GSU0_GSUC0_GSUWGMRR0_K1_LBSPPA512_LBSPPB256_LPA16_MIWT1_1_PLR1_SU32_SUM0_SUS256_VWA1_VWB1_WGM1_WGMXCC1_WGMXCCGn1
    SolutionIndex: 109
    SolutionNameMin: Cijk_Ailk_Bljk_BBS_BH_UserArgs_MT32x32x128_MI16x16x1_SN_LDSB1_CLR1_GSU0_GSUC0_GSUWGMRR0_K1_LBSPPA512_LBSPPB256_LPA16_MIWT1_1_PLR2_SU32_SUM0_SUS256_VWA1_VWB1_WGM1_WGMXCC1_WGMXCCGn1
    SolutionIndex: 110
    SolutionNameMin: Cijk_Ailk_Bljk_BBS_BH_UserArgs_MT32x32x32_MI16x16x1_SN_LDSB0_CLR0_GSU0_GSUC0_GSUWGMRR0_K1_LBSPPA256_LBSPPB128_LPA16_MIWT1_1_PLR0_SU32_SUM0_SUS256_VWA1_VWB1_WGM1_WGMXCC1_WGMXCCGn1
- - - [128, 128, 1, 128, 128, 128, 128, 128]
    - [47, 0.091]
  - - [128, 128, 1, 256, 128, 128, 128, 256]
    - [95, 0.163]
  - - [128, 128, 1, 512, 128, 128, 128, 512]
    - [95, 0.267]
  - - [128, 128, 1, 1024, 128, 128, 128, 1024]
    - [108, 0.391]
  - - [128, 128, 1, 2048, 128, 128, 128, 2048]
    - [109, 0.562]
  - - [128, 128, 1, 4096, 128, 128, 128, 4096]
    - [94, 0.871]
  - - [128, 128, 1, 8192, 128, 128, 128, 8192]
    - [107, 1.343]
  - - [128, 256, 1, 128, 128, 128, 128, 128]
    - [95, 0.176]
  - - [128, 256, 1, 256, 128, 128, 128, 256]
    - [108, 0.317]
  - - [128, 256, 1, 512, 128, 128, 128, 512]
    - [109, 0.515]
  - - [128, 256, 1, 1024, 128, 128, 128, 1024]
    - [108, 0.79]
  - - [128, 256, 1, 2048, 128, 128, 128, 2048]
    - [109, 1.045]
  - - [128, 256, 1, 4096, 128, 128, 128, 4096]
    - [107, 1.446]
  - - [128, 256, 1, 8192, 128, 128, 128, 8192]
    - [104, 2.154]
  - - [128, 512, 1, 128, 128, 128, 128, 128]
    - [94, 0.336]
  - - [128, 512, 1, 256, 128, 128, 128, 256]
    - [94, 0.59]
  - - [128, 512, 1, 512, 128, 128, 128, 512]
    - [106, 0.939]
  - - [128, 512, 1, 1024, 128, 128, 128, 1024]
    - [107, 1.399]
  - - [128, 512, 1, 2048, 128, 128, 128, 2048]
    - [107, 1.829]
  - - [128, 512, 1, 4096, 128, 128, 128, 4096]
    - [105, 2.338]
  - - [128, 512, 1, 8192, 128, 128, 128, 8192]
    - [98, 3.378]
  - - [128, 1024, 1, 128, 128, 128, 128, 128]
    - [92, 0.601]
  - - [128, 1024, 1, 256, 128, 128, 128, 256]
    - [92, 1.017]
  - - [128, 1024, 1, 512, 128, 128, 128, 512]
    - [104, 1.643]
  - - [128, 1024, 1, 1024, 128, 128, 128, 1024]
    - [103, 2.36]
  - - [128, 1024, 1, 2048, 128, 128, 128, 2048]
    - [103, 2.898]
  - - [128, 1024, 1, 4096, 128, 128, 128, 4096]
    - [97, 3.603]
  - - [128, 1024, 1, 8192, 128, 128, 128, 8192]
    - [84, 4.235]
  - - [128, 2048, 1, 128, 128, 128, 128, 128]
    - [45, 1.012]
  - - [128, 2048, 1, 256, 128, 128, 128, 256]
    - [88, 1.666]
  - - [128, 2048, 1, 512, 128, 128, 128, 512]
    - [88, 2.535]
  - - [128, 2048, 1, 1024, 128, 128, 128, 1024]
    - [99, 3.434]
  - - [128, 2048, 1, 2048, 128, 128, 128, 2048]
    - [100, 4.298]
  - - [128, 2048, 1, 4096, 128, 128, 128, 4096]
    - [81, 4.975]
  - - [128, 2048, 1, 8192, 128, 128, 128, 8192]
    - [102, 5.442]
  - - [128, 4096, 1, 128, 128, 128, 128, 128]
    - [75, 1.534]
  - - [128, 4096, 1, 256, 128, 128, 128, 256]
    - [86, 2.361]
  - - [128, 4096, 1, 512, 128, 128, 128, 512]
    - [83, 3.233]
  - - [128, 4096, 1, 1024, 128, 128, 128, 1024]
    - [78, 4.604]
  - - [128, 4096, 1, 2048, 128, 128, 128, 2048]
    - [82, 5.734]
  - - [128, 4096, 1, 4096, 128, 128, 128, 4096]
    - [76, 6.439]
  - - [128, 4096, 1, 8192, 128, 128, 128, 8192]
    - [84, 6.987]
  - - [128, 8192, 1, 128, 128, 128, 128, 128]
    - [29, 1.794]
  - - [128, 8192, 1, 256, 128, 128, 128, 256]
    - [49, 2.674]
  - - [128, 8192, 1, 512, 128, 128, 128, 512]
    - [48, 3.853]
  - - [128, 8192, 1, 1024, 128, 128, 128, 1024]
    - [50, 5.516]
  - - [128, 8192, 1, 2048, 128, 128, 128, 2048]
    - [53, 6.601]
  - - [128, 8192, 1, 4096, 128, 128, 128, 4096]
    - [56, 7.209]
  - - [128, 8192, 1, 8192, 128, 128, 128, 8192]
    - [84, 7.884]
  - - [256, 128, 1, 128, 256, 256, 256, 128]
    - [96, 0.174]
  - - [256, 128, 1, 256, 256, 256, 256, 256]
    - [95, 0.317]
  - - [256, 128, 1, 512, 256, 256, 256, 512]
    - [95, 0.511]
  - - [256, 128, 1, 1024, 256, 256, 256, 1024]
    - [95, 0.773]
  - - [256, 128, 1, 2048, 256, 256, 256, 2048]
    - [109, 1.028]
  - - [256, 128, 1, 4096, 256, 256, 256, 4096]
    - [107, 1.463]
  - - [256, 128, 1, 8192, 256, 256, 256, 8192]
    - [103, 1.995]
  - - [256, 256, 1, 128, 256, 256, 256, 128]
    - [107, 0.328]
  - - [256, 256, 1, 256, 256, 256, 256, 256]
    - [94, 0.587]
  - - [256, 256, 1, 512, 256, 256, 256, 512]
    - [107, 0.933]
  - - [256, 256, 1, 1024, 256, 256, 256, 1024]
    - [107, 1.419]
  - - [256, 256, 1, 2048, 256, 256, 256, 2048]
    - [107, 1.829]
  - - [256, 256, 1, 4096, 256, 256, 256, 4096]
    - [88, 2.33]
  - - [256, 256, 1, 8192, 256, 256, 256, 8192]
    - [99, 3.318]
  - - [256, 512, 1, 128, 256, 256, 256, 128]
    - [92, 0.6]
  - - [256, 512, 1, 256, 256, 256, 256, 256]
    - [92, 1.027]
  - - [256, 512, 1, 512, 256, 256, 256, 512]
    - [103, 1.636]
  - - [256, 512, 1, 1024, 256, 256, 256, 1024]
    - [103, 2.337]
  - - [256, 512, 1, 2048, 256, 256, 256, 2048]
    - [103, 2.981]
  - - [256, 512, 1, 4096, 256, 256, 256, 4096]
    - [78, 3.526]
  - - [256, 512, 1, 8192, 256, 256, 256, 8192]
    - [73, 4.382]
  - - [256, 1024, 1, 128, 256, 256, 256, 128]
    - [45, 1.004]
  - - [256, 1024, 1, 256, 256, 256, 256, 256]
    - [88, 1.669]
  - - [256, 1024, 1, 512, 256, 256, 256, 512]
    - [99, 2.515]
  - - [256, 1024, 1, 1024, 256, 256, 256, 1024]
    - [97, 3.549]
  - - [256, 1024, 1, 2048, 256, 256, 256, 2048]
    - [99, 4.362]
  - - [256, 1024, 1, 4096, 256, 256, 256, 4096]
    - [82, 4.735]
  - - [256, 1024, 1, 8192, 256, 256, 256, 8192]
    - [82, 6.031]
  - - [256, 2048, 1, 128, 256, 256, 256, 128]
    - [77, 1.532]
  - - [256, 2048, 1, 256, 256, 256, 256, 256]
    - [84, 2.486]
  - - [256, 2048, 1, 512, 256, 256, 256, 512]
    - [76, 3.622]
  - - [256, 2048, 1, 1024, 256, 256, 256, 1024]
    - [78, 4.894]
  - - [256, 2048, 1, 2048, 256, 256, 256, 2048]
    - [76, 5.714]
  - - [256, 2048, 1, 4096, 256, 256, 256, 4096]
    - [73, 5.863]
  - - [256, 2048, 1, 8192, 256, 256, 256, 8192]
    - [57, 7.174]
  - - [256, 4096, 1, 128, 256, 256, 256, 128]
    - [36, 1.921]
  - - [256, 4096, 1, 256, 256, 256, 256, 256]
    - [69, 2.945]
  - - [256, 4096, 1, 512, 256, 256, 256, 512]
    - [64, 4.307]
  - - [256, 4096, 1, 1024, 256, 256, 256, 1024]
    - [34, 5.619]
  - - [256, 4096, 1, 2048, 256, 256, 256, 2048]
    - [57, 6.619]
  - - [256, 4096, 1, 4096, 256, 256, 256, 4096]
    - [30, 7.295]
  - - [256, 4096, 1, 8192, 256, 256, 256, 8192]
    - [27, 7.487]
  - - [256, 8192, 1, 128, 256, 256, 256, 128]
    - [28, 2.345]
  - - [256, 8192, 1, 256, 256, 256, 256, 256]
    - [14, 3.706]
  - - [256, 8192, 1, 512, 256, 256, 256, 512]
    - [2, 5.152]
  - - [256, 8192, 1, 1024, 256, 256, 256, 1024]
    - [24, 6.36]
  - - [256, 8192, 1, 2048, 256, 256, 256, 2048]
    - [70, 7.107]
  - - [256, 8192, 1, 4096, 256, 256, 256, 4096]
    - [1, 8.19]
  - - [256, 8192, 1, 8192, 256, 256, 256, 8192]
    - [0, 8.97]
  - - [512, 128, 1, 128, 512, 512, 512, 128]
    - [107, 0.333]
  - - [512, 128, 1, 256, 512, 512, 512, 256]
    - [94, 0.585]
  - - [512, 128, 1, 512, 512, 512, 512, 512]
    - [107, 0.946]
  - - [512, 128, 1, 1024, 512, 512, 512, 1024]
    - [107, 1.414]
  - - [512, 128, 1, 2048, 512, 512, 512, 2048]
    - [107, 1.844]
  - - [512, 128, 1, 4096, 512, 512, 512, 4096]
    - [89, 2.456]
  - - [512, 128, 1, 8192, 512, 512, 512, 8192]
    - [99, 3.34]
  - - [512, 256, 1, 128, 512, 512, 512, 128]
    - [92, 0.599]
  - - [512, 256, 1, 256, 512, 512, 512, 256]
    - [93, 1.027]
  - - [512, 256, 1, 512, 512, 512, 512, 512]
    - [103, 1.642]
  - - [512, 256, 1, 1024, 512, 512, 512, 1024]
    - [103, 2.362]
  - - [512, 256, 1, 2048, 512, 512, 512, 2048]
    - [103, 2.991]
  - - [512, 256, 1, 4096, 512, 512, 512, 4096]
    - [99, 3.458]
  - - [512, 256, 1, 8192, 512, 512, 512, 8192]
    - [87, 4.358]
  - - [512, 512, 1, 128, 512, 512, 512, 128]
    - [45, 1.003]
  - - [512, 512, 1, 256, 512, 512, 512, 256]
    - [88, 1.668]
  - - [512, 512, 1, 512, 512, 512, 512, 512]
    - [89, 2.536]
  - - [512, 512, 1, 1024, 512, 512, 512, 1024]
    - [101, 3.514]
  - - [512, 512, 1, 2048, 512, 512, 512, 2048]
    - [99, 4.17]
  - - [512, 512, 1, 4096, 512, 512, 512, 4096]
    - [87, 4.651]
  - - [512, 512, 1, 8192, 512, 512, 512, 8192]
    - [85, 5.759]
  - - [512, 1024, 1, 128, 512, 512, 512, 128]
    - [77, 1.518]
  - - [512, 1024, 1, 256, 512, 512, 512, 256]
    - [87, 2.512]
  - - [512, 1024, 1, 512, 512, 512, 512, 512]
    - [87, 3.774]
  - - [512, 1024, 1, 1024, 512, 512, 512, 1024]
    - [78, 4.852]
  - - [512, 1024, 1, 2048, 512, 512, 512, 2048]
    - [82, 5.832]
  - - [512, 1024, 1, 4096, 512, 512, 512, 4096]
    - [80, 5.948]
  - - [512, 1024, 1, 8192, 512, 512, 512, 8192]
    - [71, 7.173]
  - - [512, 2048, 1, 128, 512, 512, 512, 128]
    - [41, 1.975]
  - - [512, 2048, 1, 256, 512, 512, 512, 256]
    - [42, 3.06]
  - - [512, 2048, 1, 512, 512, 512, 512, 512]
    - [30, 4.582]
  - - [512, 2048, 1, 1024, 512, 512, 512, 1024]
    - [33, 5.552]
  - - [512, 2048, 1, 2048, 512, 512, 512, 2048]
    - [54, 6.629]
  - - [512, 2048, 1, 4096, 512, 512, 512, 4096]
    - [66, 7.207]
  - - [512, 2048, 1, 8192, 512, 512, 512, 8192]
    - [68, 8.125]
  - - [512, 4096, 1, 128, 512, 512, 512, 128]
    - [4, 2.47]
  - - [512, 4096, 1, 256, 512, 512, 512, 256]
    - [6, 3.656]
  - - [512, 4096, 1, 512, 512, 512, 512, 512]
    - [4, 5.119]
  - - [512, 4096, 1, 1024, 512, 512, 512, 1024]
    - [26, 6.556]
  - - [512, 4096, 1, 2048, 512, 512, 512, 2048]
    - [62, 6.995]
  - - [512, 4096, 1, 4096, 512, 512, 512, 4096]
    - [27, 7.976]
  - - [512, 4096, 1, 8192, 512, 512, 512, 8192]
    - [67, 8.448]
  - - [512, 8192, 1, 128, 512, 512, 512, 128]
    - [59, 2.144]
  - - [512, 8192, 1, 256, 512, 512, 512, 256]
    - [71, 3.348]
  - - [512, 8192, 1, 512, 512, 512, 512, 512]
    - [30, 4.827]
  - - [512, 8192, 1, 1024, 512, 512, 512, 1024]
    - [3, 6.429]
  - - [512, 8192, 1, 2048, 512, 512, 512, 2048]
    - [13, 7.835]
  - - [512, 8192, 1, 4096, 512, 512, 512, 4096]
    - [20, 8.791]
  - - [512, 8192, 1, 8192, 512, 512, 512, 8192]
    - [12, 9.389]
  - - [1024, 128, 1, 128, 1024, 1024, 1024, 128]
    - [46, 0.614]
  - - [1024, 128, 1, 256, 1024, 1024, 1024, 256]
    - [92, 1.014]
  - - [1024, 128, 1, 512, 1024, 1024, 1024, 512]
    - [103, 1.628]
  - - [1024, 128, 1, 1024, 1024, 1024, 1024, 1024]
    - [103, 2.341]
  - - [1024, 128, 1, 2048, 1024, 1024, 1024, 2048]
    - [99, 2.565]
  - - [1024, 128, 1, 4096, 1024, 1024, 1024, 4096]
    - [78, 3.555]
  - - [1024, 128, 1, 8192, 1024, 1024, 1024, 8192]
    - [79, 4.551]
  - - [1024, 256, 1, 128, 1024, 1024, 1024, 128]
    - [45, 1.008]
  - - [1024, 256, 1, 256, 1024, 1024, 1024, 256]
    - [89, 1.67]
  - - [1024, 256, 1, 512, 1024, 1024, 1024, 512]
    - [88, 2.55]
  - - [1024, 256, 1, 1024, 1024, 1024, 1024, 1024]
    - [99, 3.469]
  - - [1024, 256, 1, 2048, 1024, 1024, 1024, 2048]
    - [100, 4.012]
  - - [1024, 256, 1, 4096, 1024, 1024, 1024, 4096]
    - [78, 5.047]
  - - [1024, 256, 1, 8192, 1024, 1024, 1024, 8192]
    - [84, 5.98]
  - - [1024, 512, 1, 128, 1024, 1024, 1024, 128]
    - [44, 1.535]
  - - [1024, 512, 1, 256, 1024, 1024, 1024, 256]
    - [78, 2.547]
  - - [1024, 512, 1, 512, 1024, 1024, 1024, 512]
    - [76, 3.815]
  - - [1024, 512, 1, 1024, 1024, 1024, 1024, 1024]
    - [76, 4.905]
  - - [1024, 512, 1, 2048, 1024, 1024, 1024, 2048]
    - [78, 5.956]
  - - [1024, 512, 1, 4096, 1024, 1024, 1024, 4096]
    - [78, 6.345]
  - - [1024, 512, 1, 8192, 1024, 1024, 1024, 8192]
    - [62, 7.265]
  - - [1024, 1024, 1, 128, 1024, 1024, 1024, 128]
    - [43, 2.044]
  - - [1024, 1024, 1, 256, 1024, 1024, 1024, 256]
    - [33, 3.152]
  - - [1024, 1024, 1, 512, 1024, 1024, 1024, 512]
    - [34, 4.526]
  - - [1024, 1024, 1, 1024, 1024, 1024, 1024, 1024]
    - [52, 5.63]
  - - [1024, 1024, 1, 2048, 1024, 1024, 1024, 2048]
    - [51, 6.693]
  - - [1024, 1024, 1, 4096, 1024, 1024, 1024, 4096]
    - [50, 7.34]
  - - [1024, 1024, 1, 8192, 1024, 1024, 1024, 8192]
    - [1, 8.13]
  - - [1024, 2048, 1, 128, 1024, 1024, 1024, 128]
    - [6, 2.343]
  - - [1024, 2048, 1, 256, 1024, 1024, 1024, 256]
    - [17, 3.662]
  - - [1024, 2048, 1, 512, 1024, 1024, 1024, 512]
    - [28, 5.19]
  - - [1024, 2048, 1, 1024, 1024, 1024, 1024, 1024]
    - [8, 6.444]
  - - [1024, 2048, 1, 2048, 1024, 1024, 1024, 2048]
    - [62, 6.928]
  - - [1024, 2048, 1, 4096, 1024, 1024, 1024, 4096]
    - [23, 8.139]
  - - [1024, 2048, 1, 8192, 1024, 1024, 1024, 8192]
    - [23, 8.949]
  - - [1024, 4096, 1, 128, 1024, 1024, 1024, 128]
    - [35, 2.168]
  - - [1024, 4096, 1, 256, 1024, 1024, 1024, 256]
    - [72, 3.366]
  - - [1024, 4096, 1, 512, 1024, 1024, 1024, 512]
    - [25, 4.725]
  - - [1024, 4096, 1, 1024, 1024, 1024, 1024, 1024]
    - [20, 6.493]
  - - [1024, 4096, 1, 2048, 1024, 1024, 1024, 2048]
    - [10, 7.717]
  - - [1024, 4096, 1, 4096, 1024, 1024, 1024, 4096]
    - [17, 8.456]
  - - [1024, 4096, 1, 8192, 1024, 1024, 1024, 8192]
    - [1, 8.635]
  - - [1024, 8192, 1, 128, 1024, 1024, 1024, 128]
    - [63, 2.667]
  - - [1024, 8192, 1, 256, 1024, 1024, 1024, 256]
    - [30, 3.727]
  - - [1024, 8192, 1, 512, 1024, 1024, 1024, 512]
    - [27, 5.417]
  - - [1024, 8192, 1, 1024, 1024, 1024, 1024, 1024]
    - [15, 6.993]
  - - [1024, 8192, 1, 2048, 1024, 1024, 1024, 2048]
    - [11, 8.239]
  - - [1024, 8192, 1, 4096, 1024, 1024, 1024, 4096]
    - [28, 9.181]
  - - [1024, 8192, 1, 8192, 1024, 1024, 1024, 8192]
    - [2, 9.345]
  - - [2048, 128, 1, 128, 2048, 2048, 2048, 128]
    - [88, 0.995]
  - - [2048, 128, 1, 256, 2048, 2048, 2048, 256]
    - [88, 1.67]
  - - [2048, 128, 1, 512, 2048, 2048, 2048, 512]
    - [91, 2.516]
  - - [2048, 128, 1, 1024, 2048, 2048, 2048, 1024]
    - [89, 3.275]
  - - [2048, 128, 1, 2048, 2048, 2048, 2048, 2048]
    - [90, 3.989]
  - - [2048, 128, 1, 4096, 2048, 2048, 2048, 4096]
    - [79, 5.003]
  - - [2048, 128, 1, 8192, 2048, 2048, 2048, 8192]
    - [78, 6.078]
  - - [2048, 256, 1, 128, 2048, 2048, 2048, 128]
    - [44, 1.52]
  - - [2048, 256, 1, 256, 2048, 2048, 2048, 256]
    - [79, 2.572]
  - - [2048, 256, 1, 512, 2048, 2048, 2048, 512]
    - [76, 3.65]
  - - [2048, 256, 1, 1024, 2048, 2048, 2048, 1024]
    - [76, 4.857]
  - - [2048, 256, 1, 2048, 2048, 2048, 2048, 2048]
    - [79, 5.67]
  - - [2048, 256, 1, 4096, 2048, 2048, 2048, 4096]
    - [78, 6.476]
  - - [2048, 256, 1, 8192, 2048, 2048, 2048, 8192]
    - [60, 7.247]
  - - [2048, 512, 1, 128, 2048, 2048, 2048, 128]
    - [33, 2.105]
  - - [2048, 512, 1, 256, 2048, 2048, 2048, 256]
    - [37, 3.138]
  - - [2048, 512, 1, 512, 2048, 2048, 2048, 512]
    - [38, 4.461]
  - - [2048, 512, 1, 1024, 2048, 2048, 2048, 1024]
    - [30, 5.642]
  - - [2048, 512, 1, 2048, 2048, 2048, 2048, 2048]
    - [51, 6.722]
  - - [2048, 512, 1, 4096, 2048, 2048, 2048, 4096]
    - [58, 7.335]
  - - [2048, 512, 1, 8192, 2048, 2048, 2048, 8192]
    - [56, 8.302]
  - - [2048, 1024, 1, 128, 2048, 2048, 2048, 128]
    - [8, 2.497]
  - - [2048, 1024, 1, 256, 2048, 2048, 2048, 256]
    - [18, 3.819]
  - - [2048, 1024, 1, 512, 2048, 2048, 2048, 512]
    - [8, 5.28]
  - - [2048, 1024, 1, 1024, 2048, 2048, 2048, 1024]
    - [18, 6.527]
  - - [2048, 1024, 1, 2048, 2048, 2048, 2048, 2048]
    - [71, 7.003]
  - - [2048, 1024, 1, 4096, 2048, 2048, 2048, 4096]
    - [5, 8.247]
  - - [2048, 1024, 1, 8192, 2048, 2048, 2048, 8192]
    - [17, 9.082]
  - - [2048, 2048, 1, 128, 2048, 2048, 2048, 128]
    - [39, 2.169]
  - - [2048, 2048, 1, 256, 2048, 2048, 2048, 256]
    - [60, 3.379]
  - - [2048, 2048, 1, 512, 2048, 2048, 2048, 512]
    - [30, 4.847]
  - - [2048, 2048, 1, 1024, 2048, 2048, 2048, 1024]
    - [20, 6.534]
  - - [2048, 2048, 1, 2048, 2048, 2048, 2048, 2048]
    - [1, 7.952]
  - - [2048, 2048, 1, 4096, 2048, 2048, 2048, 4096]
    - [10, 8.912]
  - - [2048, 2048, 1, 8192, 2048, 2048, 2048, 8192]
    - [18, 9.525]
  - - [2048, 4096, 1, 128, 2048, 2048, 2048, 128]
    - [65, 2.566]
  - - [2048, 4096, 1, 256, 2048, 2048, 2048, 256]
    - [35, 3.75]
  - - [2048, 4096, 1, 512, 2048, 2048, 2048, 512]
    - [35, 5.383]
  - - [2048, 4096, 1, 1024, 2048, 2048, 2048, 1024]
    - [11, 6.922]
  - - [2048, 4096, 1, 2048, 2048, 2048, 2048, 2048]
    - [13, 8.131]
  - - [2048, 4096, 1, 4096, 2048, 2048, 2048, 4096]
    - [7, 8.99]
  - - [2048, 4096, 1, 8192, 2048, 2048, 2048, 8192]
    - [8, 9.344]
  - - [2048, 8192, 1, 128, 2048, 2048, 2048, 128]
    - [42, 2.809]
  - - [2048, 8192, 1, 256, 2048, 2048, 2048, 256]
    - [7, 4.176]
  - - [2048, 8192, 1, 512, 2048, 2048, 2048, 512]
    - [19, 5.821]
  - - [2048, 8192, 1, 1024, 2048, 2048, 2048, 1024]
    - [9, 7.528]
  - - [2048, 8192, 1, 2048, 2048, 2048, 2048, 2048]
    - [28, 8.647]
  - - [2048, 8192, 1, 4096, 2048, 2048, 2048, 4096]
    - [15, 9.257]
  - - [2048, 8192, 1, 8192, 2048, 2048, 2048, 8192]
    - [8, 9.504]
  - - [4096, 128, 1, 128, 4096, 4096, 4096, 128]
    - [75, 1.57]
  - - [4096, 128, 1, 256, 4096, 4096, 4096, 256]
    - [78, 2.49]
  - - [4096, 128, 1, 512, 4096, 4096, 4096, 512]
    - [77, 3.46]
  - - [4096, 128, 1, 1024, 4096, 4096, 4096, 1024]
    - [84, 4.555]
  - - [4096, 128, 1, 2048, 4096, 4096, 4096, 2048]
    - [74, 5.37]
  - - [4096, 128, 1, 4096, 4096, 4096, 4096, 4096]
    - [78, 6.457]
  - - [4096, 128, 1, 8192, 4096, 4096, 4096, 8192]
    - [76, 7.307]
  - - [4096, 256, 1, 128, 4096, 4096, 4096, 128]
    - [35, 2.061]
  - - [4096, 256, 1, 256, 4096, 4096, 4096, 256]
    - [31, 3.223]
  - - [4096, 256, 1, 512, 4096, 4096, 4096, 512]
    - [41, 4.493]
  - - [4096, 256, 1, 1024, 4096, 4096, 4096, 1024]
    - [40, 5.68]
  - - [4096, 256, 1, 2048, 4096, 4096, 4096, 2048]
    - [70, 6.573]
  - - [4096, 256, 1, 4096, 4096, 4096, 4096, 4096]
    - [51, 7.404]
  - - [4096, 256, 1, 8192, 4096, 4096, 4096, 8192]
    - [55, 8.152]
  - - [4096, 512, 1, 128, 4096, 4096, 4096, 128]
    - [14, 2.385]
  - - [4096, 512, 1, 256, 4096, 4096, 4096, 256]
    - [4, 3.727]
  - - [4096, 512, 1, 512, 4096, 4096, 4096, 512]
    - [4, 5.235]
  - - [4096, 512, 1, 1024, 4096, 4096, 4096, 1024]
    - [8, 6.6]
  - - [4096, 512, 1, 2048, 4096, 4096, 4096, 2048]
    - [60, 7.065]
  - - [4096, 512, 1, 4096, 4096, 4096, 4096, 4096]
    - [1, 8.253]
  - - [4096, 512, 1, 8192, 4096, 4096, 4096, 8192]
    - [17, 9.103]
  - - [4096, 1024, 1, 128, 4096, 4096, 4096, 128]
    - [35, 2.181]
  - - [4096, 1024, 1, 256, 4096, 4096, 4096, 256]
    - [59, 3.394]
  - - [4096, 1024, 1, 512, 4096, 4096, 4096, 512]
    - [3, 4.834]
  - - [4096, 1024, 1, 1024, 4096, 4096, 4096, 1024]
    - [10, 6.525]
  - - [4096, 1024, 1, 2048, 4096, 4096, 4096, 2048]
    - [2, 7.928]
  - - [4096, 1024, 1, 4096, 4096, 4096, 4096, 4096]
    - [4, 8.92]
  - - [4096, 1024, 1, 8192, 4096, 4096, 4096, 8192]
    - [21, 9.442]
  - - [4096, 2048, 1, 128, 4096, 4096, 4096, 128]
    - [61, 2.692]
  - - [4096, 2048, 1, 256, 4096, 4096, 4096, 256]
    - [32, 3.878]
  - - [4096, 2048, 1, 512, 4096, 4096, 4096, 512]
    - [25, 5.412]
  - - [4096, 2048, 1, 1024, 4096, 4096, 4096, 1024]
    - [7, 7.072]
  - - [4096, 2048, 1, 2048, 4096, 4096, 4096, 2048]
    - [4, 8.333]
  - - [4096, 2048, 1, 4096, 4096, 4096, 4096, 4096]
    - [11, 9.19]
  - - [4096, 2048, 1, 8192, 4096, 4096, 4096, 8192]
    - [11, 9.63]
  - - [4096, 4096, 1, 128, 4096, 4096, 4096, 128]
    - [40, 2.768]
  - - [4096, 4096, 1, 256, 4096, 4096, 4096, 256]
    - [61, 4.139]
  - - [4096, 4096, 1, 512, 4096, 4096, 4096, 512]
    - [3, 5.962]
  - - [4096, 4096, 1, 1024, 4096, 4096, 4096, 1024]
    - [19, 7.475]
  - - [4096, 4096, 1, 2048, 4096, 4096, 4096, 2048]
    - [8, 8.552]
  - - [4096, 4096, 1, 4096, 4096, 4096, 4096, 4096]
    - [12, 9.226]
  - - [4096, 4096, 1, 8192, 4096, 4096, 4096, 8192]
    - [4, 9.398]
  - - [4096, 8192, 1, 128, 4096, 4096, 4096, 128]
    - [14, 3.265]
  - - [4096, 8192, 1, 256, 4096, 4096, 4096, 256]
    - [4, 4.364]
  - - [4096, 8192, 1, 512, 4096, 4096, 4096, 512]
    - [18, 6.35]
  - - [4096, 8192, 1, 1024, 4096, 4096, 4096, 1024]
    - [23, 7.565]
  - - [4096, 8192, 1, 2048, 4096, 4096, 4096, 2048]
    - [13, 8.728]
  - - [4096, 8192, 1, 4096, 4096, 4096, 4096, 4096]
    - [17, 9.151]
  - - [4096, 8192, 1, 8192, 4096, 4096, 4096, 8192]
    - [11, 9.189]
  - - [8192, 128, 1, 128, 8192, 8192, 8192, 128]
    - [38, 2.026]
  - - [8192, 128, 1, 256, 8192, 8192, 8192, 256]
    - [31, 3.193]
  - - [8192, 128, 1, 512, 8192, 8192, 8192, 512]
    - [41, 4.44]
  - - [8192, 128, 1, 1024, 8192, 8192, 8192, 1024]
    - [31, 5.638]
  - - [8192, 128, 1, 2048, 8192, 8192, 8192, 2048]
    - [58, 6.577]
  - - [8192, 128, 1, 4096, 8192, 8192, 8192, 4096]
    - [79, 7.292]
  - - [8192, 128, 1, 8192, 8192, 8192, 8192, 8192]
    - [70, 8.274]
  - - [8192, 256, 1, 128, 8192, 8192, 8192, 128]
    - [24, 2.418]
  - - [8192, 256, 1, 256, 8192, 8192, 8192, 256]
    - [21, 3.705]
  - - [8192, 256, 1, 512, 8192, 8192, 8192, 512]
    - [11, 5.201]
  - - [8192, 256, 1, 1024, 8192, 8192, 8192, 1024]
    - [11, 6.469]
  - - [8192, 256, 1, 2048, 8192, 8192, 8192, 2048]
    - [53, 7.125]
  - - [8192, 256, 1, 4096, 8192, 8192, 8192, 4096]
    - [1, 8.219]
  - - [8192, 256, 1, 8192, 8192, 8192, 8192, 8192]
    - [1, 9.1]
  - - [8192, 512, 1, 128, 8192, 8192, 8192, 128]
    - [30, 2.195]
  - - [8192, 512, 1, 256, 8192, 8192, 8192, 256]
    - [70, 3.359]
  - - [8192, 512, 1, 512, 8192, 8192, 8192, 512]
    - [3, 4.854]
  - - [8192, 512, 1, 1024, 8192, 8192, 8192, 1024]
    - [1, 6.587]
  - - [8192, 512, 1, 2048, 8192, 8192, 8192, 2048]
    - [7, 7.958]
  - - [8192, 512, 1, 4096, 8192, 8192, 8192, 4096]
    - [23, 8.912]
  - - [8192, 512, 1, 8192, 8192, 8192, 8192, 8192]
    - [24, 9.484]
  - - [8192, 1024, 1, 128, 8192, 8192, 8192, 128]
    - [61, 2.678]
  - - [8192, 1024, 1, 256, 8192, 8192, 8192, 256]
    - [40, 3.832]
  - - [8192, 1024, 1, 512, 8192, 8192, 8192, 512]
    - [7, 5.425]
  - - [8192, 1024, 1, 1024, 8192, 8192, 8192, 1024]
    - [3, 7.064]
  - - [8192, 1024, 1, 2048, 8192, 8192, 8192, 2048]
    - [4, 8.346]
  - - [8192, 1024, 1, 4096, 8192, 8192, 8192, 4096]
    - [28, 9.109]
  - - [8192, 1024, 1, 8192, 8192, 8192, 8192, 8192]
    - [23, 9.531]
  - - [8192, 2048, 1, 128, 8192, 8192, 8192, 128]
    - [33, 2.912]
  - - [8192, 2048, 1, 256, 8192, 8192, 8192, 256]
    - [1, 4.293]
  - - [8192, 2048, 1, 512, 8192, 8192, 8192, 512]
    - [5, 6.071]
  - - [8192, 2048, 1, 1024, 8192, 8192, 8192, 1024]
    - [6, 7.615]
  - - [8192, 2048, 1, 2048, 8192, 8192, 8192, 2048]
    - [21, 8.672]
  - - [8192, 2048, 1, 4096, 8192, 8192, 8192, 4096]
    - [11, 9.41]
  - - [8192, 2048, 1, 8192, 8192, 8192, 8192, 8192]
    - [1, 9.175]
  - - [8192, 4096, 1, 128, 8192, 8192, 8192, 128]
    - [4, 3.26]
  - - [8192, 4096, 1, 256, 8192, 8192, 8192, 256]
    - [2, 4.752]
  - - [8192, 4096, 1, 512, 8192, 8192, 8192, 512]
    - [2, 6.479]
  - - [8192, 4096, 1, 1024, 8192, 8192, 8192, 1024]
    - [4, 7.876]
  - - [8192, 4096, 1, 2048, 8192, 8192, 8192, 2048]
    - [26, 8.855]
  - - [8192, 4096, 1, 4096, 8192, 8192, 8192, 4096]
    - [25, 9.283]
  - - [8192, 4096, 1, 8192, 8192, 8192, 8192, 8192]
    - [16, 9.607]
  - - [8192, 8192, 1, 128, 8192, 8192, 8192, 128]
    - [14, 3.344]
  - - [8192, 8192, 1, 256, 8192, 8192, 8192, 256]
    - [26, 4.877]
  - - [8192, 8192, 1, 512, 8192, 8192, 8192, 512]
    - [24, 6.435]
  - - [8192, 8192, 1, 1024, 8192, 8192, 8192, 1024]
    - [23, 7.771]
  - - [8192, 8192, 1, 2048, 8192, 8192, 8192, 2048]
    - [21, 8.804]
  - - [8192, 8192, 1, 4096, 8192, 8192, 8192, 4096]
    - [22, 9.184]
  - - [8192, 8192, 1, 8192, 8192, 8192, 8192, 8192]
    - [13, 9.248]
  - - [1, 1, 1, 32, 1, 1, 1, 32]
    - [110, 0.0]
- null
- null
- ExperimentalStreamK
- GridBased
