library/src/amd_detail/rocblaslt/src/Tensile/Logic/asm_full/aquavanjaram/gfx942_38cu/StreamK/aquavanjaram942_Cijk_Ailk_Bljk_BSS_BH_UserArgs.yaml
- {MinimumRequiredVersion: 4.33.0}
- aquavanjaram942
- {Architecture: gfx942, CUCount: 38}
- [Device 0049, Device 0050]
    SolutionIndex: 0
    SolutionNameMin: Cijk_Ailk_Bljk_BSS_BH_UserArgs_MT256x256x32_MI16x16x1_SN_LDSB1_CLR1_GSU0_GSUC0_GSUWGMRR0_K1_LBSPPA2048_LBSPPB128_LPA0_MIWT8_8_PLR1_SU32_SUM0_SUS256_VWA4_VWB1_WGM1_WGMXCC1_WGMXCCGn1
    SolutionIndex: 1
    SolutionNameMin: Cijk_Ailk_Bljk_BSS_BH_UserArgs_MT256x256x32_MI16x16x1_SN_LDSB1_CLR1_GSU0_GSUC0_GSUWGMRR0_K1_LBSPPA2048_LBSPPB128_LPA0_MIWT8_8_PLR1_SU32_SUM0_SUS256_VWA4_VWB2_WGM1_WGMXCC1_WGMXCCGn1
    SolutionIndex: 2
    SolutionNameMin: Cijk_Ailk_Bljk_BSS_BH_UserArgs_MT256x256x32_MI16x16x1_SN_LDSB1_CLR1_GSU0_GSUC0_GSUWGMRR0_K1_LBSPPA2048_LBSPPB256_LPA0_MIWT8_8_PLR1_SU32_SUM0_SUS256_VWA4_VWB4_WGM1_WGMXCC1_WGMXCCGn1
    SolutionIndex: 3
    SolutionNameMin: Cijk_Ailk_Bljk_BSS_BH_UserArgs_MT256x256x32_MI16x16x1_SN_LDSB1_CLR1_GSU0_GSUC0_GSUWGMRR0_K1_LBSPPA2048_LBSPPB512_LPA32_MIWT8_8_PLR1_SU32_SUM0_SUS256_VWA2_VWB8_WGM1_WGMXCC1_WGMXCCGn1
    SolutionIndex: 4
    SolutionNameMin: Cijk_Ailk_Bljk_BSS_BH_UserArgs_MT256x256x32_MI16x16x1_SN_LDSB1_CLR1_GSU0_GSUC0_GSUWGMRR0_K1_LBSPPA2048_LBSPPB512_LPA0_MIWT8_8_PLR1_SU32_SUM0_SUS256_VWA4_VWB8_WGM1_WGMXCC1_WGMXCCGn1
    SolutionIndex: 5
    SolutionNameMin: Cijk_Ailk_Bljk_BSS_BH_UserArgs_MT256x256x32_MI16x16x1_SN_LDSB1_CLR1_GSU0_GSUC0_GSUWGMRR0_K1_LBSPPA2048_LBSPPB128_LPA32_MIWT8_8_PLR1_SU32_SUM0_SUS256_VWA2_VWB1_WGM4_WGMXCC1_WGMXCCGn1
    SolutionIndex: 6
    SolutionNameMin: Cijk_Ailk_Bljk_BSS_BH_UserArgs_MT256x256x32_MI16x16x1_SN_LDSB1_CLR1_GSU0_GSUC0_GSUWGMRR0_K1_LBSPPA2048_LBSPPB128_LPA0_MIWT8_8_PLR1_SU32_SUM0_SUS256_VWA4_VWB1_WGM4_WGMXCC1_WGMXCCGn1
    SolutionIndex: 7
    SolutionNameMin: Cijk_Ailk_Bljk_BSS_BH_UserArgs_MT256x256x32_MI16x16x1_SN_LDSB1_CLR1_GSU0_GSUC0_GSUWGMRR0_K1_LBSPPA2048_LBSPPB128_LPA0_MIWT8_8_PLR1_SU32_SUM0_SUS256_VWA8_VWB1_WGM4_WGMXCC1_WGMXCCGn1
    SolutionIndex: 8
    SolutionNameMin: Cijk_Ailk_Bljk_BSS_BH_UserArgs_MT256x256x32_MI16x16x1_SN_LDSB1_CLR1_GSU0_GSUC0_GSUWGMRR0_K1_LBSPPA2048_LBSPPB128_LPA32_MIWT8_8_PLR1_SU32_SUM0_SUS256_VWA2_VWB2_WGM4_WGMXCC1_WGMXCCGn1
    SolutionIndex: 9
    SolutionNameMin: Cijk_Ailk_Bljk_BSS_BH_UserArgs_MT256x256x32_MI16x16x1_SN_LDSB1_CLR1_GSU0_GSUC0_GSUWGMRR0_K1_LBSPPA2048_LBSPPB128_LPA0_MIWT8_8_PLR1_SU32_SUM0_SUS256_VWA4_VWB2_WGM4_WGMXCC1_WGMXCCGn1
    SolutionIndex: 10
    SolutionNameMin: Cijk_Ailk_Bljk_BSS_BH_UserArgs_MT256x256x32_MI16x16x1_SN_LDSB1_CLR1_GSU0_GSUC0_GSUWGMRR0_K1_LBSPPA2048_LBSPPB256_LPA32_MIWT8_8_PLR1_SU32_SUM0_SUS256_VWA2_VWB4_WGM4_WGMXCC1_WGMXCCGn1
    SolutionIndex: 11
    SolutionNameMin: Cijk_Ailk_Bljk_BSS_BH_UserArgs_MT256x256x32_MI16x16x1_SN_LDSB1_CLR1_GSU0_GSUC0_GSUWGMRR0_K1_LBSPPA2048_LBSPPB256_LPA0_MIWT8_8_PLR1_SU32_SUM0_SUS256_VWA4_VWB4_WGM4_WGMXCC1_WGMXCCGn1
    SolutionIndex: 12
    SolutionNameMin: Cijk_Ailk_Bljk_BSS_BH_UserArgs_MT256x256x32_MI16x16x1_SN_LDSB1_CLR1_GSU0_GSUC0_GSUWGMRR0_K1_LBSPPA2048_LBSPPB512_LPA0_MIWT8_8_PLR1_SU32_SUM0_SUS256_VWA4_VWB8_WGM4_WGMXCC1_WGMXCCGn1
    SolutionIndex: 13
    SolutionNameMin: Cijk_Ailk_Bljk_BSS_BH_UserArgs_MT256x256x32_MI16x16x1_SN_LDSB1_CLR1_GSU0_GSUC0_GSUWGMRR0_K1_LBSPPA2048_LBSPPB128_LPA16_MIWT8_8_PLR1_SU32_SUM0_SUS256_VWA1_VWB1_WGM8_WGMXCC1_WGMXCCGn1
    SolutionIndex: 14
    SolutionNameMin: Cijk_Ailk_Bljk_BSS_BH_UserArgs_MT256x256x32_MI16x16x1_SN_LDSB1_CLR1_GSU0_GSUC0_GSUWGMRR0_K1_LBSPPA2048_LBSPPB128_LPA32_MIWT8_8_PLR1_SU32_SUM0_SUS256_VWA2_VWB1_WGM8_WGMXCC1_WGMXCCGn1
    SolutionIndex: 15
    SolutionNameMin: Cijk_Ailk_Bljk_BSS_BH_UserArgs_MT256x256x32_MI16x16x1_SN_LDSB1_CLR1_GSU0_GSUC0_GSUWGMRR0_K1_LBSPPA2048_LBSPPB128_LPA0_MIWT8_8_PLR1_SU32_SUM0_SUS256_VWA4_VWB1_WGM8_WGMXCC1_WGMXCCGn1
    SolutionIndex: 16
    SolutionNameMin: Cijk_Ailk_Bljk_BSS_BH_UserArgs_MT256x256x32_MI16x16x1_SN_LDSB1_CLR1_GSU0_GSUC0_GSUWGMRR0_K1_LBSPPA2048_LBSPPB128_LPA0_MIWT8_8_PLR1_SU32_SUM0_SUS256_VWA4_VWB2_WGM8_WGMXCC1_WGMXCCGn1
    SolutionIndex: 17
    SolutionNameMin: Cijk_Ailk_Bljk_BSS_BH_UserArgs_MT256x256x32_MI16x16x1_SN_LDSB1_CLR1_GSU0_GSUC0_GSUWGMRR0_K1_LBSPPA2048_LBSPPB256_LPA0_MIWT8_8_PLR1_SU32_SUM0_SUS256_VWA4_VWB4_WGM8_WGMXCC1_WGMXCCGn1
    SolutionIndex: 18
    SolutionNameMin: Cijk_Ailk_Bljk_BSS_BH_UserArgs_MT256x256x32_MI16x16x1_SN_LDSB1_CLR1_GSU0_GSUC0_GSUWGMRR0_K1_LBSPPA2048_LBSPPB512_LPA32_MIWT8_8_PLR1_SU32_SUM0_SUS256_VWA2_VWB8_WGM8_WGMXCC1_WGMXCCGn1
    SolutionIndex: 19
    SolutionNameMin: Cijk_Ailk_Bljk_BSS_BH_UserArgs_MT256x256x32_MI16x16x1_SN_LDSB1_CLR1_GSU0_GSUC0_GSUWGMRR0_K1_LBSPPA2048_LBSPPB512_LPA0_MIWT8_8_PLR1_SU32_SUM0_SUS256_VWA4_VWB8_WGM8_WGMXCC1_WGMXCCGn1
    SolutionIndex: 20
    SolutionNameMin: Cijk_Ailk_Bljk_BSS_BH_UserArgs_MT128x256x32_MI16x16x1_SN_LDSB1_CLR1_GSU0_GSUC0_GSUWGMRR0_K1_LBSPPA1024_LBSPPB128_LPA0_MIWT4_8_PLR1_SU32_SUM0_SUS256_VWA4_VWB1_WGM1_WGMXCC1_WGMXCCGn1
    SolutionIndex: 21
    SolutionNameMin: Cijk_Ailk_Bljk_BSS_BH_UserArgs_MT128x256x32_MI16x16x1_SN_LDSB1_CLR1_GSU0_GSUC0_GSUWGMRR0_K1_LBSPPA1024_LBSPPB128_LPA0_MIWT4_8_PLR1_SU32_SUM0_SUS256_VWA4_VWB1_WGM4_WGMXCC1_WGMXCCGn1
    SolutionIndex: 22
    SolutionNameMin: Cijk_Ailk_Bljk_BSS_BH_UserArgs_MT128x256x32_MI16x16x1_SN_LDSB1_CLR1_GSU0_GSUC0_GSUWGMRR0_K1_LBSPPA1024_LBSPPB128_LPA0_MIWT4_8_PLR1_SU32_SUM0_SUS256_VWA4_VWB1_WGM8_WGMXCC1_WGMXCCGn1
    SolutionIndex: 23
    SolutionNameMin: Cijk_Ailk_Bljk_BSS_BH_UserArgs_MT128x256x32_MI16x16x1_SN_LDSB1_CLR1_GSU0_GSUC0_GSUWGMRR0_K1_LBSPPA1024_LBSPPB128_LPA0_MIWT4_8_PLR1_SU32_SUM0_SUS256_VWA4_VWB2_WGM8_WGMXCC1_WGMXCCGn1
    SolutionIndex: 24
    SolutionNameMin: Cijk_Ailk_Bljk_BSS_BH_UserArgs_MT256x128x32_MI16x16x1_SN_LDSB1_CLR1_GSU0_GSUC0_GSUWGMRR0_K1_LBSPPA2048_LBSPPB128_LPA32_MIWT8_4_PLR1_SU32_SUM0_SUS256_VWA2_VWB1_WGM1_WGMXCC1_WGMXCCGn1
    SolutionIndex: 25
    SolutionNameMin: Cijk_Ailk_Bljk_BSS_BH_UserArgs_MT256x128x32_MI16x16x1_SN_LDSB1_CLR1_GSU0_GSUC0_GSUWGMRR0_K1_LBSPPA2048_LBSPPB128_LPA0_MIWT8_4_PLR1_SU32_SUM0_SUS256_VWA4_VWB1_WGM1_WGMXCC1_WGMXCCGn1
    SolutionIndex: 26
    SolutionNameMin: Cijk_Ailk_Bljk_BSS_BH_UserArgs_MT256x128x32_MI16x16x1_SN_LDSB1_CLR1_GSU0_GSUC0_GSUWGMRR0_K1_LBSPPA2048_LBSPPB128_LPA0_MIWT8_4_PLR1_SU32_SUM0_SUS256_VWA4_VWB2_WGM1_WGMXCC1_WGMXCCGn1
    SolutionIndex: 27
    SolutionNameMin: Cijk_Ailk_Bljk_BSS_BH_UserArgs_MT256x128x32_MI16x16x1_SN_LDSB1_CLR1_GSU0_GSUC0_GSUWGMRR0_K1_LBSPPA2048_LBSPPB256_LPA32_MIWT8_4_PLR1_SU32_SUM0_SUS256_VWA2_VWB4_WGM1_WGMXCC1_WGMXCCGn1
    SolutionIndex: 28
    SolutionNameMin: Cijk_Ailk_Bljk_BSS_BH_UserArgs_MT256x128x32_MI16x16x1_SN_LDSB1_CLR1_GSU0_GSUC0_GSUWGMRR0_K1_LBSPPA2048_LBSPPB256_LPA0_MIWT8_4_PLR1_SU32_SUM0_SUS256_VWA4_VWB4_WGM1_WGMXCC1_WGMXCCGn1
    SolutionIndex: 29
    SolutionNameMin: Cijk_Ailk_Bljk_BSS_BH_UserArgs_MT256x128x32_MI16x16x1_SN_LDSB1_CLR1_GSU0_GSUC0_GSUWGMRR0_K1_LBSPPA2048_LBSPPB128_LPA32_MIWT8_4_PLR1_SU32_SUM0_SUS256_VWA2_VWB1_WGM4_WGMXCC1_WGMXCCGn1
    SolutionIndex: 30
    SolutionNameMin: Cijk_Ailk_Bljk_BSS_BH_UserArgs_MT256x128x32_MI16x16x1_SN_LDSB1_CLR1_GSU0_GSUC0_GSUWGMRR0_K1_LBSPPA2048_LBSPPB128_LPA0_MIWT8_4_PLR1_SU32_SUM0_SUS256_VWA4_VWB1_WGM4_WGMXCC1_WGMXCCGn1
    SolutionIndex: 31
    SolutionNameMin: Cijk_Ailk_Bljk_BSS_BH_UserArgs_MT256x128x32_MI16x16x1_SN_LDSB1_CLR1_GSU0_GSUC0_GSUWGMRR0_K1_LBSPPA2048_LBSPPB128_LPA0_MIWT8_4_PLR1_SU32_SUM0_SUS256_VWA4_VWB2_WGM4_WGMXCC1_WGMXCCGn1
    SolutionIndex: 32
    SolutionNameMin: Cijk_Ailk_Bljk_BSS_BH_UserArgs_MT256x128x32_MI16x16x1_SN_LDSB1_CLR1_GSU0_GSUC0_GSUWGMRR0_K1_LBSPPA2048_LBSPPB256_LPA0_MIWT8_4_PLR1_SU32_SUM0_SUS256_VWA4_VWB4_WGM4_WGMXCC1_WGMXCCGn1
    SolutionIndex: 33
    SolutionNameMin: Cijk_Ailk_Bljk_BSS_BH_UserArgs_MT256x128x32_MI16x16x1_SN_LDSB1_CLR1_GSU0_GSUC0_GSUWGMRR0_K1_LBSPPA2048_LBSPPB128_LPA0_MIWT8_4_PLR1_SU32_SUM0_SUS256_VWA4_VWB1_WGM8_WGMXCC1_WGMXCCGn1
    SolutionIndex: 34
    SolutionNameMin: Cijk_Ailk_Bljk_BSS_BH_UserArgs_MT256x128x32_MI16x16x1_SN_LDSB1_CLR1_GSU0_GSUC0_GSUWGMRR0_K1_LBSPPA2048_LBSPPB128_LPA0_MIWT8_4_PLR1_SU32_SUM0_SUS256_VWA4_VWB2_WGM8_WGMXCC1_WGMXCCGn1
    SolutionIndex: 35
    SolutionNameMin: Cijk_Ailk_Bljk_BSS_BH_UserArgs_MT256x128x32_MI16x16x1_SN_LDSB1_CLR1_GSU0_GSUC0_GSUWGMRR0_K1_LBSPPA2048_LBSPPB256_LPA0_MIWT8_4_PLR1_SU32_SUM0_SUS256_VWA4_VWB4_WGM8_WGMXCC1_WGMXCCGn1
    SolutionIndex: 36
    SolutionNameMin: Cijk_Ailk_Bljk_BSS_BH_UserArgs_MT256x64x32_MI16x16x1_SN_LDSB1_CLR1_GSU0_GSUC0_GSUWGMRR0_K1_LBSPPA2048_LBSPPB128_LPA0_MIWT8_2_PLR1_SU32_SUM0_SUS256_VWA4_VWB2_WGM1_WGMXCC1_WGMXCCGn1
    SolutionIndex: 37
    SolutionNameMin: Cijk_Ailk_Bljk_BSS_BH_UserArgs_MT128x128x32_MI16x16x1_SN_LDSB1_CLR1_GSU0_GSUC0_GSUWGMRR0_K1_LBSPPA1024_LBSPPB128_LPA0_MIWT4_4_PLR1_SU32_SUM0_SUS256_VWA4_VWB1_WGM1_WGMXCC1_WGMXCCGn1
    SolutionIndex: 38
    SolutionNameMin: Cijk_Ailk_Bljk_BSS_BH_UserArgs_MT128x128x32_MI16x16x1_SN_LDSB1_CLR1_GSU0_GSUC0_GSUWGMRR0_K1_LBSPPA1024_LBSPPB128_LPA0_MIWT4_4_PLR1_SU32_SUM0_SUS256_VWA4_VWB2_WGM1_WGMXCC1_WGMXCCGn1
    SolutionIndex: 39
    SolutionNameMin: Cijk_Ailk_Bljk_BSS_BH_UserArgs_MT128x128x32_MI16x16x1_SN_LDSB1_CLR1_GSU0_GSUC0_GSUWGMRR0_K1_LBSPPA1024_LBSPPB128_LPA0_MIWT4_4_PLR1_SU32_SUM0_SUS256_VWA4_VWB2_WGM4_WGMXCC1_WGMXCCGn1
    SolutionIndex: 40
    SolutionNameMin: Cijk_Ailk_Bljk_BSS_BH_UserArgs_MT128x128x32_MI16x16x1_SN_LDSB1_CLR1_GSU0_GSUC0_GSUWGMRR0_K1_LBSPPA1024_LBSPPB256_LPA0_MIWT4_4_PLR1_SU32_SUM0_SUS256_VWA4_VWB4_WGM4_WGMXCC1_WGMXCCGn1
    SolutionIndex: 41
    SolutionNameMin: Cijk_Ailk_Bljk_BSS_BH_UserArgs_MT128x128x32_MI16x16x1_SN_LDSB1_CLR1_GSU0_GSUC0_GSUWGMRR0_K1_LBSPPA1024_LBSPPB128_LPA0_MIWT4_4_PLR1_SU32_SUM0_SUS256_VWA4_VWB2_WGM8_WGMXCC1_WGMXCCGn1
    SolutionIndex: 42
    SolutionNameMin: Cijk_Ailk_Bljk_BSS_BH_UserArgs_MT64x128x32_MI16x16x1_SN_LDSB0_CLR1_GSU0_GSUC0_GSUWGMRR0_K1_LBSPPA512_LBSPPB128_LPA16_MIWT2_4_PLR1_SU32_SUM0_SUS256_VWA1_VWB2_WGM1_WGMXCC1_WGMXCCGn1
    SolutionIndex: 43
    SolutionNameMin: Cijk_Ailk_Bljk_BSS_BH_UserArgs_MT128x64x32_MI16x16x1_SN_LDSB0_CLR1_GSU0_GSUC0_GSUWGMRR0_K1_LBSPPA1024_LBSPPB128_LPA0_MIWT4_2_PLR1_SU32_SUM0_SUS256_VWA4_VWB2_WGM1_WGMXCC1_WGMXCCGn1
    SolutionIndex: 44
    SolutionNameMin: Cijk_Ailk_Bljk_BSS_BH_UserArgs_MT128x64x32_MI16x16x1_SN_LDSB0_CLR1_GSU0_GSUC0_GSUWGMRR0_K1_LBSPPA1024_LBSPPB128_LPA0_MIWT4_2_PLR1_SU32_SUM0_SUS256_VWA4_VWB1_WGM8_WGMXCC1_WGMXCCGn1
    SolutionIndex: 45
    SolutionNameMin: Cijk_Ailk_Bljk_BSS_BH_UserArgs_MT32x32x32_MI16x16x1_SN_LDSB0_CLR1_GSU0_GSUC0_GSUWGMRR0_K1_LBSPPA256_LBSPPB128_LPA16_MIWT1_1_PLR1_SU32_SUM0_SUS256_VWA1_VWB1_WGM4_WGMXCC1_WGMXCCGn1
    SolutionIndex: 46
    SolutionNameMin: Cijk_Ailk_Bljk_BSS_BH_UserArgs_MT128x256x64_MI16x16x1_SN_LDSB1_CLR1_GSU0_GSUC0_GSUWGMRR0_K1_LBSPPA2048_LBSPPB128_LPA32_MIWT4_8_PLR1_SU32_SUM0_SUS256_VWA2_VWB1_WGM1_WGMXCC1_WGMXCCGn1
    SolutionIndex: 47
    SolutionNameMin: Cijk_Ailk_Bljk_BSS_BH_UserArgs_MT128x256x64_MI16x16x1_SN_LDSB1_CLR1_GSU0_GSUC0_GSUWGMRR0_K1_LBSPPA2048_LBSPPB128_LPA0_MIWT4_8_PLR1_SU32_SUM0_SUS256_VWA4_VWB1_WGM1_WGMXCC1_WGMXCCGn1
    SolutionIndex: 48
    SolutionNameMin: Cijk_Ailk_Bljk_BSS_BH_UserArgs_MT128x256x64_MI16x16x1_SN_LDSB1_CLR1_GSU0_GSUC0_GSUWGMRR0_K1_LBSPPA2048_LBSPPB256_LPA0_MIWT4_8_PLR1_SU32_SUM0_SUS256_VWA4_VWB2_WGM1_WGMXCC1_WGMXCCGn1
    SolutionIndex: 49
    SolutionNameMin: Cijk_Ailk_Bljk_BSS_BH_UserArgs_MT128x256x64_MI16x16x1_SN_LDSB1_CLR1_GSU0_GSUC0_GSUWGMRR0_K1_LBSPPA2048_LBSPPB512_LPA0_MIWT4_8_PLR1_SU32_SUM0_SUS256_VWA4_VWB4_WGM1_WGMXCC1_WGMXCCGn1
    SolutionIndex: 50
    SolutionNameMin: Cijk_Ailk_Bljk_BSS_BH_UserArgs_MT128x256x64_MI16x16x1_SN_LDSB1_CLR1_GSU0_GSUC0_GSUWGMRR0_K1_LBSPPA2048_LBSPPB1024_LPA32_MIWT4_8_PLR1_SU32_SUM0_SUS256_VWA2_VWB8_WGM1_WGMXCC1_WGMXCCGn1
    SolutionIndex: 51
    SolutionNameMin: Cijk_Ailk_Bljk_BSS_BH_UserArgs_MT128x256x64_MI16x16x1_SN_LDSB1_CLR1_GSU0_GSUC0_GSUWGMRR0_K1_LBSPPA2048_LBSPPB1024_LPA0_MIWT4_8_PLR1_SU32_SUM0_SUS256_VWA4_VWB8_WGM1_WGMXCC1_WGMXCCGn1
    SolutionIndex: 52
    SolutionNameMin: Cijk_Ailk_Bljk_BSS_BH_UserArgs_MT128x256x64_MI16x16x1_SN_LDSB1_CLR1_GSU0_GSUC0_GSUWGMRR0_K1_LBSPPA2048_LBSPPB128_LPA32_MIWT4_8_PLR1_SU32_SUM0_SUS256_VWA2_VWB1_WGM4_WGMXCC1_WGMXCCGn1
    SolutionIndex: 53
    SolutionNameMin: Cijk_Ailk_Bljk_BSS_BH_UserArgs_MT128x256x64_MI16x16x1_SN_LDSB1_CLR1_GSU0_GSUC0_GSUWGMRR0_K1_LBSPPA2048_LBSPPB128_LPA0_MIWT4_8_PLR1_SU32_SUM0_SUS256_VWA4_VWB1_WGM4_WGMXCC1_WGMXCCGn1
    SolutionIndex: 54
    SolutionNameMin: Cijk_Ailk_Bljk_BSS_BH_UserArgs_MT128x256x64_MI16x16x1_SN_LDSB1_CLR1_GSU0_GSUC0_GSUWGMRR0_K1_LBSPPA2048_LBSPPB256_LPA0_MIWT4_8_PLR1_SU32_SUM0_SUS256_VWA4_VWB2_WGM4_WGMXCC1_WGMXCCGn1
    SolutionIndex: 55
    SolutionNameMin: Cijk_Ailk_Bljk_BSS_BH_UserArgs_MT128x256x64_MI16x16x1_SN_LDSB1_CLR1_GSU0_GSUC0_GSUWGMRR0_K1_LBSPPA2048_LBSPPB512_LPA0_MIWT4_8_PLR1_SU32_SUM0_SUS256_VWA4_VWB4_WGM4_WGMXCC1_WGMXCCGn1
    SolutionIndex: 56
    SolutionNameMin: Cijk_Ailk_Bljk_BSS_BH_UserArgs_MT128x256x64_MI16x16x1_SN_LDSB1_CLR1_GSU0_GSUC0_GSUWGMRR0_K1_LBSPPA2048_LBSPPB1024_LPA0_MIWT4_8_PLR1_SU32_SUM0_SUS256_VWA4_VWB8_WGM4_WGMXCC1_WGMXCCGn1
    SolutionIndex: 57
    SolutionNameMin: Cijk_Ailk_Bljk_BSS_BH_UserArgs_MT128x256x64_MI16x16x1_SN_LDSB1_CLR1_GSU0_GSUC0_GSUWGMRR0_K1_LBSPPA2048_LBSPPB512_LPA0_MIWT4_8_PLR1_SU32_SUM0_SUS256_VWA4_VWB4_WGM8_WGMXCC1_WGMXCCGn1
    SolutionIndex: 58
    SolutionNameMin: Cijk_Ailk_Bljk_BSS_BH_UserArgs_MT128x256x64_MI16x16x1_SN_LDSB1_CLR1_GSU0_GSUC0_GSUWGMRR0_K1_LBSPPA2048_LBSPPB1024_LPA0_MIWT4_8_PLR1_SU32_SUM0_SUS256_VWA4_VWB8_WGM8_WGMXCC1_WGMXCCGn1
    SolutionIndex: 59
    SolutionNameMin: Cijk_Ailk_Bljk_BSS_BH_UserArgs_MT128x256x64_MI16x16x1_SN_LDSB1_CLR1_GSU0_GSUC0_GSUWGMRR0_K1_LBSPPA2048_LBSPPB256_LPA0_MIWT4_8_PLR2_SU32_SUM0_SUS256_VWA4_VWB2_WGM8_WGMXCC1_WGMXCCGn1
    SolutionIndex: 60
    SolutionNameMin: Cijk_Ailk_Bljk_BSS_BH_UserArgs_MT256x128x64_MI16x16x1_SN_LDSB1_CLR1_GSU0_GSUC0_GSUWGMRR0_K1_LBSPPA4096_LBSPPB128_LPA0_MIWT8_4_PLR1_SU32_SUM0_SUS256_VWA4_VWB1_WGM1_WGMXCC1_WGMXCCGn1
    SolutionIndex: 61
    SolutionNameMin: Cijk_Ailk_Bljk_BSS_BH_UserArgs_MT256x128x64_MI16x16x1_SN_LDSB1_CLR1_GSU0_GSUC0_GSUWGMRR0_K1_LBSPPA4096_LBSPPB256_LPA0_MIWT8_4_PLR1_SU32_SUM0_SUS256_VWA4_VWB2_WGM1_WGMXCC1_WGMXCCGn1
    SolutionIndex: 62
    SolutionNameMin: Cijk_Ailk_Bljk_BSS_BH_UserArgs_MT256x128x64_MI16x16x1_SN_LDSB1_CLR1_GSU0_GSUC0_GSUWGMRR0_K1_LBSPPA4096_LBSPPB512_LPA0_MIWT8_4_PLR1_SU32_SUM0_SUS256_VWA4_VWB4_WGM1_WGMXCC1_WGMXCCGn1
    SolutionIndex: 63
    SolutionNameMin: Cijk_Ailk_Bljk_BSS_BH_UserArgs_MT256x128x64_MI16x16x1_SN_LDSB1_CLR1_GSU0_GSUC0_GSUWGMRR0_K1_LBSPPA4096_LBSPPB128_LPA0_MIWT8_4_PLR1_SU32_SUM0_SUS256_VWA4_VWB1_WGM4_WGMXCC1_WGMXCCGn1
    SolutionIndex: 64
    SolutionNameMin: Cijk_Ailk_Bljk_BSS_BH_UserArgs_MT256x128x64_MI16x16x1_SN_LDSB1_CLR1_GSU0_GSUC0_GSUWGMRR0_K1_LBSPPA4096_LBSPPB512_LPA0_MIWT8_4_PLR1_SU32_SUM0_SUS256_VWA4_VWB4_WGM4_WGMXCC1_WGMXCCGn1
    SolutionIndex: 65
    SolutionNameMin: Cijk_Ailk_Bljk_BSS_BH_UserArgs_MT256x128x64_MI16x16x1_SN_LDSB1_CLR1_GSU0_GSUC0_GSUWGMRR0_K1_LBSPPA4096_LBSPPB128_LPA0_MIWT8_4_PLR1_SU32_SUM0_SUS256_VWA4_VWB1_WGM8_WGMXCC1_WGMXCCGn1
    SolutionIndex: 66
    SolutionNameMin: Cijk_Ailk_Bljk_BSS_BH_UserArgs_MT256x128x64_MI16x16x1_SN_LDSB1_CLR1_GSU0_GSUC0_GSUWGMRR0_K1_LBSPPA4096_LBSPPB256_LPA0_MIWT8_4_PLR1_SU32_SUM0_SUS256_VWA4_VWB2_WGM8_WGMXCC1_WGMXCCGn1
    SolutionIndex: 67
    SolutionNameMin: Cijk_Ailk_Bljk_BSS_BH_UserArgs_MT256x128x64_MI16x16x1_SN_LDSB1_CLR1_GSU0_GSUC0_GSUWGMRR0_K1_LBSPPA4096_LBSPPB512_LPA0_MIWT8_4_PLR1_SU32_SUM0_SUS256_VWA4_VWB4_WGM8_WGMXCC1_WGMXCCGn1
    SolutionIndex: 68
    SolutionNameMin: Cijk_Ailk_Bljk_BSS_BH_UserArgs_MT128x128x64_MI16x16x1_SN_LDSB1_CLR1_GSU0_GSUC0_GSUWGMRR0_K1_LBSPPA2048_LBSPPB128_LPA0_MIWT4_4_PLR1_SU32_SUM0_SUS256_VWA4_VWB1_WGM1_WGMXCC1_WGMXCCGn1
    SolutionIndex: 69
    SolutionNameMin: Cijk_Ailk_Bljk_BSS_BH_UserArgs_MT128x128x64_MI16x16x1_SN_LDSB1_CLR1_GSU0_GSUC0_GSUWGMRR0_K1_LBSPPA2048_LBSPPB256_LPA0_MIWT4_4_PLR1_SU32_SUM0_SUS256_VWA4_VWB2_WGM1_WGMXCC1_WGMXCCGn1
    SolutionIndex: 70
    SolutionNameMin: Cijk_Ailk_Bljk_BSS_BH_UserArgs_MT128x128x64_MI16x16x1_SN_LDSB1_CLR1_GSU0_GSUC0_GSUWGMRR0_K1_LBSPPA2048_LBSPPB512_LPA0_MIWT4_4_PLR1_SU32_SUM0_SUS256_VWA4_VWB4_WGM1_WGMXCC1_WGMXCCGn1
    SolutionIndex: 71
    SolutionNameMin: Cijk_Ailk_Bljk_BSS_BH_UserArgs_MT128x128x64_MI16x16x1_SN_LDSB1_CLR1_GSU0_GSUC0_GSUWGMRR0_K1_LBSPPA2048_LBSPPB128_LPA0_MIWT4_4_PLR1_SU32_SUM0_SUS256_VWA4_VWB1_WGM4_WGMXCC1_WGMXCCGn1
    SolutionIndex: 72
    SolutionNameMin: Cijk_Ailk_Bljk_BSS_BH_UserArgs_MT128x128x64_MI16x16x1_SN_LDSB1_CLR1_GSU0_GSUC0_GSUWGMRR0_K1_LBSPPA2048_LBSPPB256_LPA0_MIWT4_4_PLR1_SU32_SUM0_SUS256_VWA4_VWB2_WGM4_WGMXCC1_WGMXCCGn1
    SolutionIndex: 73
    SolutionNameMin: Cijk_Ailk_Bljk_BSS_BH_UserArgs_MT128x128x64_MI16x16x1_SN_LDSB1_CLR1_GSU0_GSUC0_GSUWGMRR0_K1_LBSPPA2048_LBSPPB512_LPA32_MIWT4_4_PLR1_SU32_SUM0_SUS256_VWA2_VWB4_WGM4_WGMXCC1_WGMXCCGn1
    SolutionIndex: 74
    SolutionNameMin: Cijk_Ailk_Bljk_BSS_BH_UserArgs_MT128x128x64_MI16x16x1_SN_LDSB1_CLR1_GSU0_GSUC0_GSUWGMRR0_K1_LBSPPA2048_LBSPPB512_LPA0_MIWT4_4_PLR1_SU32_SUM0_SUS256_VWA4_VWB4_WGM4_WGMXCC1_WGMXCCGn1
    SolutionIndex: 75
    SolutionNameMin: Cijk_Ailk_Bljk_BSS_BH_UserArgs_MT128x128x64_MI16x16x1_SN_LDSB1_CLR1_GSU0_GSUC0_GSUWGMRR0_K1_LBSPPA2048_LBSPPB128_LPA32_MIWT4_4_PLR1_SU32_SUM0_SUS256_VWA2_VWB1_WGM8_WGMXCC1_WGMXCCGn1
    SolutionIndex: 76
    SolutionNameMin: Cijk_Ailk_Bljk_BSS_BH_UserArgs_MT128x128x64_MI16x16x1_SN_LDSB1_CLR1_GSU0_GSUC0_GSUWGMRR0_K1_LBSPPA2048_LBSPPB128_LPA0_MIWT4_4_PLR1_SU32_SUM0_SUS256_VWA4_VWB1_WGM8_WGMXCC1_WGMXCCGn1
    SolutionIndex: 77
    SolutionNameMin: Cijk_Ailk_Bljk_BSS_BH_UserArgs_MT128x128x64_MI16x16x1_SN_LDSB1_CLR1_GSU0_GSUC0_GSUWGMRR0_K1_LBSPPA2048_LBSPPB256_LPA0_MIWT4_4_PLR1_SU32_SUM0_SUS256_VWA4_VWB2_WGM8_WGMXCC1_WGMXCCGn1
    SolutionIndex: 78
    SolutionNameMin: Cijk_Ailk_Bljk_BSS_BH_UserArgs_MT128x128x64_MI16x16x1_SN_LDSB1_CLR1_GSU0_GSUC0_GSUWGMRR0_K1_LBSPPA2048_LBSPPB512_LPA0_MIWT4_4_PLR1_SU32_SUM0_SUS256_VWA4_VWB4_WGM8_WGMXCC1_WGMXCCGn1
    SolutionIndex: 79
    SolutionNameMin: Cijk_Ailk_Bljk_BSS_BH_UserArgs_MT64x128x64_MI16x16x1_SN_LDSB1_CLR1_GSU0_GSUC0_GSUWGMRR0_K1_LBSPPA1024_LBSPPB128_LPA32_MIWT2_4_PLR1_SU32_SUM0_SUS256_VWA2_VWB1_WGM1_WGMXCC1_WGMXCCGn1
    SolutionIndex: 80
    SolutionNameMin: Cijk_Ailk_Bljk_BSS_BH_UserArgs_MT64x128x64_MI16x16x1_SN_LDSB1_CLR1_GSU0_GSUC0_GSUWGMRR0_K1_LBSPPA1024_LBSPPB512_LPA32_MIWT2_4_PLR1_SU32_SUM0_SUS256_VWA2_VWB4_WGM1_WGMXCC1_WGMXCCGn1
    SolutionIndex: 81
    SolutionNameMin: Cijk_Ailk_Bljk_BSS_BH_UserArgs_MT128x64x64_MI16x16x1_SN_LDSB1_CLR1_GSU0_GSUC0_GSUWGMRR0_K1_LBSPPA2048_LBSPPB128_LPA0_MIWT4_2_PLR1_SU32_SUM0_SUS256_VWA4_VWB1_WGM1_WGMXCC1_WGMXCCGn1
    SolutionIndex: 82
    SolutionNameMin: Cijk_Ailk_Bljk_BSS_BH_UserArgs_MT128x64x64_MI16x16x1_SN_LDSB1_CLR1_GSU0_GSUC0_GSUWGMRR0_K1_LBSPPA2048_LBSPPB256_LPA0_MIWT4_2_PLR1_SU32_SUM0_SUS256_VWA4_VWB2_WGM1_WGMXCC1_WGMXCCGn1
    SolutionIndex: 83
    SolutionNameMin: Cijk_Ailk_Bljk_BSS_BH_UserArgs_MT128x64x64_MI16x16x1_SN_LDSB1_CLR1_GSU0_GSUC0_GSUWGMRR0_K1_LBSPPA2048_LBSPPB128_LPA0_MIWT4_2_PLR1_SU32_SUM0_SUS256_VWA4_VWB1_WGM4_WGMXCC1_WGMXCCGn1
    SolutionIndex: 84
    SolutionNameMin: Cijk_Ailk_Bljk_BSS_BH_UserArgs_MT128x64x64_MI16x16x1_SN_LDSB1_CLR1_GSU0_GSUC0_GSUWGMRR0_K1_LBSPPA2048_LBSPPB256_LPA0_MIWT4_2_PLR1_SU32_SUM0_SUS256_VWA4_VWB2_WGM4_WGMXCC1_WGMXCCGn1
    SolutionIndex: 85
    SolutionNameMin: Cijk_Ailk_Bljk_BSS_BH_UserArgs_MT128x64x64_MI16x16x1_SN_LDSB1_CLR1_GSU0_GSUC0_GSUWGMRR0_K1_LBSPPA2048_LBSPPB128_LPA0_MIWT4_2_PLR1_SU32_SUM0_SUS256_VWA4_VWB1_WGM8_WGMXCC1_WGMXCCGn1
    SolutionIndex: 86
    SolutionNameMin: Cijk_Ailk_Bljk_BSS_BH_UserArgs_MT128x64x64_MI16x16x1_SN_LDSB1_CLR1_GSU0_GSUC0_GSUWGMRR0_K1_LBSPPA2048_LBSPPB256_LPA0_MIWT4_2_PLR1_SU32_SUM0_SUS256_VWA4_VWB2_WGM8_WGMXCC1_WGMXCCGn1
    SolutionIndex: 87
    SolutionNameMin: Cijk_Ailk_Bljk_BSS_BH_UserArgs_MT128x32x64_MI16x16x1_SN_LDSB1_CLR1_GSU0_GSUC0_GSUWGMRR0_K1_LBSPPA2048_LBSPPB128_LPA0_MIWT4_1_PLR1_SU32_SUM0_SUS256_VWA4_VWB1_WGM1_WGMXCC1_WGMXCCGn1
    SolutionIndex: 88
    SolutionNameMin: Cijk_Ailk_Bljk_BSS_BH_UserArgs_MT64x64x64_MI16x16x1_SN_LDSB1_CLR1_GSU0_GSUC0_GSUWGMRR0_K1_LBSPPA1024_LBSPPB128_LPA16_MIWT2_2_PLR1_SU32_SUM0_SUS256_VWA1_VWB1_WGM1_WGMXCC1_WGMXCCGn1
    SolutionIndex: 89
    SolutionNameMin: Cijk_Ailk_Bljk_BSS_BH_UserArgs_MT64x64x64_MI16x16x1_SN_LDSB1_CLR1_GSU0_GSUC0_GSUWGMRR0_K1_LBSPPA1024_LBSPPB128_LPA32_MIWT2_2_PLR1_SU32_SUM0_SUS256_VWA2_VWB1_WGM1_WGMXCC1_WGMXCCGn1
    SolutionIndex: 90
    SolutionNameMin: Cijk_Ailk_Bljk_BSS_BH_UserArgs_MT64x64x64_MI16x16x1_SN_LDSB1_CLR1_GSU0_GSUC0_GSUWGMRR0_K1_LBSPPA1024_LBSPPB256_LPA32_MIWT2_2_PLR1_SU32_SUM0_SUS256_VWA2_VWB2_WGM1_WGMXCC1_WGMXCCGn1
    SolutionIndex: 91
    SolutionNameMin: Cijk_Ailk_Bljk_BSS_BH_UserArgs_MT64x64x64_MI16x16x1_SN_LDSB1_CLR1_GSU0_GSUC0_GSUWGMRR0_K1_LBSPPA1024_LBSPPB128_LPA32_MIWT2_2_PLR1_SU32_SUM0_SUS256_VWA2_VWB1_WGM8_WGMXCC1_WGMXCCGn1
    SolutionIndex: 92
    SolutionNameMin: Cijk_Ailk_Bljk_BSS_BH_UserArgs_MT32x64x64_MI16x16x1_SN_LDSB0_CLR1_GSU0_GSUC0_GSUWGMRR0_K1_LBSPPA512_LBSPPB256_LPA16_MIWT1_2_PLR1_SU32_SUM0_SUS256_VWA1_VWB2_WGM1_WGMXCC1_WGMXCCGn1
    SolutionIndex: 93
    SolutionNameMin: Cijk_Ailk_Bljk_BSS_BH_UserArgs_MT64x32x64_MI16x16x1_SN_LDSB0_CLR1_GSU0_GSUC0_GSUWGMRR0_K1_LBSPPA1024_LBSPPB128_LPA32_MIWT2_1_PLR1_SU32_SUM0_SUS256_VWA2_VWB1_WGM1_WGMXCC1_WGMXCCGn1
    SolutionIndex: 94
    SolutionNameMin: Cijk_Ailk_Bljk_BSS_BH_UserArgs_MT32x32x64_MI16x16x1_SN_LDSB0_CLR1_GSU0_GSUC0_GSUWGMRR0_K1_LBSPPA512_LBSPPB128_LPA16_MIWT1_1_PLR1_SU32_SUM0_SUS256_VWA1_VWB1_WGM1_WGMXCC1_WGMXCCGn1
    SolutionIndex: 95
    SolutionNameMin: Cijk_Ailk_Bljk_BSS_BH_UserArgs_MT32x32x64_MI16x16x1_SN_LDSB0_CLR1_GSU0_GSUC0_GSUWGMRR0_K1_LBSPPA512_LBSPPB128_LPA16_MIWT1_1_PLR1_SU32_SUM0_SUS256_VWA1_VWB1_WGM4_WGMXCC1_WGMXCCGn1
    SolutionIndex: 96
    SolutionNameMin: Cijk_Ailk_Bljk_BSS_BH_UserArgs_MT32x32x64_MI16x16x1_SN_LDSB0_CLR1_GSU0_GSUC0_GSUWGMRR0_K1_LBSPPA512_LBSPPB128_LPA16_MIWT1_1_PLR1_SU32_SUM0_SUS256_VWA1_VWB1_WGM8_WGMXCC1_WGMXCCGn1
    SolutionIndex: 97
    SolutionNameMin: Cijk_Ailk_Bljk_BSS_BH_UserArgs_MT128x64x128_MI16x16x1_SN_LDSB1_CLR1_GSU0_GSUC0_GSUWGMRR0_K1_LBSPPA2048_LBSPPB256_LPA0_MIWT4_2_PLR1_SU32_SUM0_SUS256_VWA4_VWB1_WGM1_WGMXCC1_WGMXCCGn1
    SolutionIndex: 98
    SolutionNameMin: Cijk_Ailk_Bljk_BSS_BH_UserArgs_MT128x64x128_MI16x16x1_SN_LDSB1_CLR1_GSU0_GSUC0_GSUWGMRR0_K1_LBSPPA2048_LBSPPB256_LPA0_MIWT4_2_PLR2_SU32_SUM0_SUS256_VWA4_VWB1_WGM1_WGMXCC1_WGMXCCGn1
    SolutionIndex: 99
    SolutionNameMin: Cijk_Ailk_Bljk_BSS_BH_UserArgs_MT128x64x128_MI16x16x1_SN_LDSB1_CLR1_GSU0_GSUC0_GSUWGMRR0_K1_LBSPPA2048_LBSPPB512_LPA0_MIWT4_2_PLR2_SU32_SUM0_SUS256_VWA4_VWB2_WGM1_WGMXCC1_WGMXCCGn1
    SolutionIndex: 100
    SolutionNameMin: Cijk_Ailk_Bljk_BSS_BH_UserArgs_MT128x64x128_MI16x16x1_SN_LDSB1_CLR1_GSU0_GSUC0_GSUWGMRR0_K1_LBSPPA2048_LBSPPB512_LPA0_MIWT4_2_PLR1_SU32_SUM0_SUS256_VWA4_VWB2_WGM4_WGMXCC1_WGMXCCGn1
    SolutionIndex: 101
    SolutionNameMin: Cijk_Ailk_Bljk_BSS_BH_UserArgs_MT128x64x128_MI16x16x1_SN_LDSB1_CLR1_GSU0_GSUC0_GSUWGMRR0_K1_LBSPPA2048_LBSPPB256_LPA0_MIWT4_2_PLR2_SU32_SUM0_SUS256_VWA4_VWB1_WGM4_WGMXCC1_WGMXCCGn1
    SolutionIndex: 102
    SolutionNameMin: Cijk_Ailk_Bljk_BSS_BH_UserArgs_MT128x64x128_MI16x16x1_SN_LDSB1_CLR1_GSU0_GSUC0_GSUWGMRR0_K1_LBSPPA2048_LBSPPB256_LPA0_MIWT4_2_PLR1_SU32_SUM0_SUS256_VWA4_VWB1_WGM8_WGMXCC1_WGMXCCGn1
    SolutionIndex: 103
    SolutionNameMin: Cijk_Ailk_Bljk_BSS_BH_UserArgs_MT128x64x128_MI16x16x1_SN_LDSB1_CLR1_GSU0_GSUC0_GSUWGMRR0_K1_LBSPPA2048_LBSPPB256_LPA0_MIWT4_2_PLR2_SU32_SUM0_SUS256_VWA4_VWB1_WGM8_WGMXCC1_WGMXCCGn1
    SolutionIndex: 104
    SolutionNameMin: Cijk_Ailk_Bljk_BSS_BH_UserArgs_MT128x64x128_MI16x16x1_SN_LDSB1_CLR1_GSU0_GSUC0_GSUWGMRR0_K1_LBSPPA2048_LBSPPB512_LPA0_MIWT4_2_PLR2_SU32_SUM0_SUS256_VWA4_VWB2_WGM8_WGMXCC1_WGMXCCGn1
    SolutionIndex: 105
    SolutionNameMin: Cijk_Ailk_Bljk_BSS_BH_UserArgs_MT64x64x128_MI16x16x1_SN_LDSB1_CLR1_GSU0_GSUC0_GSUWGMRR0_K1_LBSPPA1024_LBSPPB256_LPA32_MIWT2_2_PLR2_SU32_SUM0_SUS256_VWA2_VWB1_WGM1_WGMXCC1_WGMXCCGn1
    SolutionIndex: 106
    SolutionNameMin: Cijk_Ailk_Bljk_BSS_BH_UserArgs_MT64x64x128_MI16x16x1_SN_LDSB1_CLR1_GSU0_GSUC0_GSUWGMRR0_K1_LBSPPA1024_LBSPPB512_LPA32_MIWT2_2_PLR2_SU32_SUM0_SUS256_VWA2_VWB2_WGM1_WGMXCC1_WGMXCCGn1
    SolutionIndex: 107
    SolutionNameMin: Cijk_Ailk_Bljk_BSS_BH_UserArgs_MT64x64x128_MI16x16x1_SN_LDSB1_CLR1_GSU0_GSUC0_GSUWGMRR0_K1_LBSPPA1024_LBSPPB256_LPA32_MIWT2_2_PLR2_SU32_SUM0_SUS256_VWA2_VWB1_WGM8_WGMXCC1_WGMXCCGn1
    SolutionIndex: 108
    SolutionNameMin: Cijk_Ailk_Bljk_BSS_BH_UserArgs_MT64x64x128_MI16x16x1_SN_LDSB1_CLR1_GSU0_GSUC0_GSUWGMRR0_K1_LBSPPA1024_LBSPPB512_LPA32_MIWT2_2_PLR2_SU32_SUM0_SUS256_VWA2_VWB2_WGM8_WGMXCC1_WGMXCCGn1
    SolutionIndex: 109
    SolutionNameMin: Cijk_Ailk_Bljk_BSS_BH_UserArgs_MT32x64x128_MI16x16x1_SN_LDSB1_CLR1_GSU0_GSUC0_GSUWGMRR0_K1_LBSPPA512_LBSPPB256_LPA16_MIWT1_2_PLR2_SU32_SUM0_SUS256_VWA1_VWB1_WGM1_WGMXCC1_WGMXCCGn1
    SolutionIndex: 110
    SolutionNameMin: Cijk_Ailk_Bljk_BSS_BH_UserArgs_MT32x64x128_MI16x16x1_SN_LDSB1_CLR1_GSU0_GSUC0_GSUWGMRR0_K1_LBSPPA512_LBSPPB512_LPA16_MIWT1_2_PLR2_SU32_SUM0_SUS256_VWA1_VWB2_WGM1_WGMXCC1_WGMXCCGn1
    SolutionIndex: 111
    SolutionNameMin: Cijk_Ailk_Bljk_BSS_BH_UserArgs_MT64x32x128_MI16x16x1_SN_LDSB1_CLR1_GSU0_GSUC0_GSUWGMRR0_K1_LBSPPA1024_LBSPPB256_LPA32_MIWT2_1_PLR2_SU32_SUM0_SUS256_VWA2_VWB1_WGM1_WGMXCC1_WGMXCCGn1
    SolutionIndex: 112
    SolutionNameMin: Cijk_Ailk_Bljk_BSS_BH_UserArgs_MT64x32x128_MI16x16x1_SN_LDSB1_CLR1_GSU0_GSUC0_GSUWGMRR0_K1_LBSPPA1024_LBSPPB256_LPA32_MIWT2_1_PLR2_SU32_SUM0_SUS256_VWA2_VWB1_WGM4_WGMXCC1_WGMXCCGn1
    SolutionIndex: 113
    SolutionNameMin: Cijk_Ailk_Bljk_BSS_BH_UserArgs_MT64x32x128_MI16x16x1_SN_LDSB1_CLR1_GSU0_GSUC0_GSUWGMRR0_K1_LBSPPA1024_LBSPPB256_LPA32_MIWT2_1_PLR2_SU32_SUM0_SUS256_VWA2_VWB1_WGM8_WGMXCC1_WGMXCCGn1
    SolutionIndex: 114
    SolutionNameMin: Cijk_Ailk_Bljk_BSS_BH_UserArgs_MT32x32x128_MI16x16x1_SN_LDSB1_CLR1_GSU0_GSUC0_GSUWGMRR0_K1_LBSPPA512_LBSPPB256_LPA16_MIWT1_1_PLR1_SU32_SUM0_SUS256_VWA1_VWB1_WGM1_WGMXCC1_WGMXCCGn1
    SolutionIndex: 115
    SolutionNameMin: Cijk_Ailk_Bljk_BSS_BH_UserArgs_MT32x32x128_MI16x16x1_SN_LDSB1_CLR1_GSU0_GSUC0_GSUWGMRR0_K1_LBSPPA512_LBSPPB256_LPA16_MIWT1_1_PLR2_SU32_SUM0_SUS256_VWA1_VWB1_WGM1_WGMXCC1_WGMXCCGn1
    SolutionIndex: 116
    SolutionNameMin: Cijk_Ailk_Bljk_BSS_BH_UserArgs_MT32x32x128_MI16x16x1_SN_LDSB1_CLR1_GSU0_GSUC0_GSUWGMRR0_K1_LBSPPA512_LBSPPB256_LPA16_MIWT1_1_PLR2_SU32_SUM0_SUS256_VWA1_VWB1_WGM4_WGMXCC1_WGMXCCGn1
    SolutionIndex: 117
    SolutionNameMin: Cijk_Ailk_Bljk_BSS_BH_UserArgs_MT32x32x32_MI16x16x1_SN_LDSB0_CLR1_GSU0_GSUC0_GSUWGMRR0_K1_LBSPPA256_LBSPPB128_LPA16_MIWT1_1_PLR1_SU32_SUM0_SUS256_VWA1_VWB1_WGM8_WGMXCC1_WGMXCCGn1
- - - [128, 128, 1, 128, 128, 128, 128, 128]
    - [115, 0.08]
  - - [128, 128, 1, 256, 128, 128, 128, 256]
    - [114, 0.15]
  - - [128, 128, 1, 512, 128, 128, 128, 512]
    - [115, 0.248]
  - - [128, 128, 1, 1024, 128, 128, 128, 1024]
    - [114, 0.38]
  - - [128, 128, 1, 2048, 128, 128, 128, 2048]
    - [114, 0.547]
  - - [128, 128, 1, 4096, 128, 128, 128, 4096]
    - [92, 0.877]
  - - [128, 128, 1, 8192, 128, 128, 128, 8192]
    - [111, 1.344]
  - - [128, 256, 1, 128, 128, 128, 128, 128]
    - [45, 0.162]
  - - [128, 256, 1, 256, 128, 128, 128, 256]
    - [96, 0.294]
  - - [128, 256, 1, 512, 128, 128, 128, 512]
    - [94, 0.488]
  - - [128, 256, 1, 1024, 128, 128, 128, 1024]
    - [114, 0.745]
  - - [128, 256, 1, 2048, 128, 128, 128, 2048]
    - [115, 1.016]
  - - [128, 256, 1, 4096, 128, 128, 128, 4096]
    - [112, 1.448]
  - - [128, 256, 1, 8192, 128, 128, 128, 8192]
    - [107, 2.211]
  - - [128, 512, 1, 128, 128, 128, 128, 128]
    - [93, 0.32]
  - - [128, 512, 1, 256, 128, 128, 128, 256]
    - [93, 0.577]
  - - [128, 512, 1, 512, 128, 128, 128, 512]
    - [110, 0.882]
  - - [128, 512, 1, 1024, 128, 128, 128, 1024]
    - [113, 1.362]
  - - [128, 512, 1, 2048, 128, 128, 128, 2048]
    - [112, 1.742]
  - - [128, 512, 1, 4096, 128, 128, 128, 4096]
    - [83, 2.392]
  - - [128, 512, 1, 8192, 128, 128, 128, 8192]
    - [100, 3.426]
  - - [128, 1024, 1, 128, 128, 128, 128, 128]
    - [108, 0.548]
  - - [128, 1024, 1, 256, 128, 128, 128, 256]
    - [88, 0.936]
  - - [128, 1024, 1, 512, 128, 128, 128, 512]
    - [107, 1.503]
  - - [128, 1024, 1, 1024, 128, 128, 128, 1024]
    - [106, 2.222]
  - - [128, 1024, 1, 2048, 128, 128, 128, 2048]
    - [106, 2.765]
  - - [128, 1024, 1, 4096, 128, 128, 128, 4096]
    - [99, 3.63]
  - - [128, 1024, 1, 8192, 128, 128, 128, 8192]
    - [77, 4.629]
  - - [128, 2048, 1, 128, 128, 128, 128, 128]
    - [42, 0.886]
  - - [128, 2048, 1, 256, 128, 128, 128, 256]
    - [85, 1.487]
  - - [128, 2048, 1, 512, 128, 128, 128, 512]
    - [98, 2.278]
  - - [128, 2048, 1, 1024, 128, 128, 128, 1024]
    - [101, 3.194]
  - - [128, 2048, 1, 2048, 128, 128, 128, 2048]
    - [104, 4.094]
  - - [128, 2048, 1, 4096, 128, 128, 128, 4096]
    - [77, 4.967]
  - - [128, 2048, 1, 8192, 128, 128, 128, 8192]
    - [70, 6.369]
  - - [128, 4096, 1, 128, 128, 128, 128, 128]
    - [37, 1.136]
  - - [128, 4096, 1, 256, 128, 128, 128, 256]
    - [68, 1.971]
  - - [128, 4096, 1, 512, 128, 128, 128, 512]
    - [78, 3.099]
  - - [128, 4096, 1, 1024, 128, 128, 128, 1024]
    - [77, 4.322]
  - - [128, 4096, 1, 2048, 128, 128, 128, 2048]
    - [76, 5.476]
  - - [128, 4096, 1, 4096, 128, 128, 128, 4096]
    - [78, 6.347]
  - - [128, 4096, 1, 8192, 128, 128, 128, 8192]
    - [72, 7.326]
  - - [128, 8192, 1, 128, 128, 128, 128, 128]
    - [22, 1.455]
  - - [128, 8192, 1, 256, 128, 128, 128, 256]
    - [54, 2.369]
  - - [128, 8192, 1, 512, 128, 128, 128, 512]
    - [53, 3.696]
  - - [128, 8192, 1, 1024, 128, 128, 128, 1024]
    - [54, 5.008]
  - - [128, 8192, 1, 2048, 128, 128, 128, 2048]
    - [52, 6.261]
  - - [128, 8192, 1, 4096, 128, 128, 128, 4096]
    - [75, 6.769]
  - - [128, 8192, 1, 8192, 128, 128, 128, 8192]
    - [59, 6.814]
  - - [256, 128, 1, 128, 256, 256, 256, 128]
    - [95, 0.161]
  - - [256, 128, 1, 256, 256, 256, 256, 256]
    - [115, 0.284]
  - - [256, 128, 1, 512, 256, 256, 256, 512]
    - [96, 0.491]
  - - [256, 128, 1, 1024, 256, 256, 256, 1024]
    - [114, 0.741]
  - - [256, 128, 1, 2048, 256, 256, 256, 2048]
    - [116, 1.009]
  - - [256, 128, 1, 4096, 256, 256, 256, 4096]
    - [112, 1.444]
  - - [256, 128, 1, 8192, 256, 256, 256, 8192]
    - [107, 2.028]
  - - [256, 256, 1, 128, 256, 256, 256, 128]
    - [111, 0.308]
  - - [256, 256, 1, 256, 256, 256, 256, 256]
    - [109, 0.561]
  - - [256, 256, 1, 512, 256, 256, 256, 512]
    - [113, 0.908]
  - - [256, 256, 1, 1024, 256, 256, 256, 1024]
    - [111, 1.327]
  - - [256, 256, 1, 2048, 256, 256, 256, 2048]
    - [111, 1.791]
  - - [256, 256, 1, 4096, 256, 256, 256, 4096]
    - [84, 2.394]
  - - [256, 256, 1, 8192, 256, 256, 256, 8192]
    - [104, 3.275]
  - - [256, 512, 1, 128, 256, 256, 256, 128]
    - [89, 0.564]
  - - [256, 512, 1, 256, 256, 256, 256, 256]
    - [90, 0.946]
  - - [256, 512, 1, 512, 256, 256, 256, 512]
    - [106, 1.54]
  - - [256, 512, 1, 1024, 256, 256, 256, 1024]
    - [108, 2.204]
  - - [256, 512, 1, 2048, 256, 256, 256, 2048]
    - [105, 2.839]
  - - [256, 512, 1, 4096, 256, 256, 256, 4096]
    - [76, 3.599]
  - - [256, 512, 1, 8192, 256, 256, 256, 8192]
    - [74, 4.6]
  - - [256, 1024, 1, 128, 256, 256, 256, 128]
    - [43, 0.909]
  - - [256, 1024, 1, 256, 256, 256, 256, 256]
    - [82, 1.549]
  - - [256, 1024, 1, 512, 256, 256, 256, 512]
    - [102, 2.374]
  - - [256, 1024, 1, 1024, 256, 256, 256, 1024]
    - [97, 3.317]
  - - [256, 1024, 1, 2048, 256, 256, 256, 2048]
    - [101, 4.207]
  - - [256, 1024, 1, 4096, 256, 256, 256, 4096]
    - [78, 4.988]
  - - [256, 1024, 1, 8192, 256, 256, 256, 8192]
    - [72, 6.24]
  - - [256, 2048, 1, 128, 256, 256, 256, 128]
    - [39, 1.161]
  - - [256, 2048, 1, 256, 256, 256, 256, 256]
    - [68, 1.951]
  - - [256, 2048, 1, 512, 256, 256, 256, 512]
    - [76, 3.219]
  - - [256, 2048, 1, 1024, 256, 256, 256, 1024]
    - [70, 4.444]
  - - [256, 2048, 1, 2048, 256, 256, 256, 2048]
    - [78, 5.478]
  - - [256, 2048, 1, 4096, 256, 256, 256, 4096]
    - [78, 6.278]
  - - [256, 2048, 1, 8192, 256, 256, 256, 8192]
    - [51, 7.306]
  - - [256, 4096, 1, 128, 256, 256, 256, 128]
    - [20, 1.518]
  - - [256, 4096, 1, 256, 256, 256, 256, 256]
    - [25, 2.606]
  - - [256, 4096, 1, 512, 256, 256, 256, 512]
    - [25, 3.936]
  - - [256, 4096, 1, 1024, 256, 256, 256, 1024]
    - [50, 5.231]
  - - [256, 4096, 1, 2048, 256, 256, 256, 2048]
    - [56, 6.37]
  - - [256, 4096, 1, 4096, 256, 256, 256, 4096]
    - [61, 7.333]
  - - [256, 4096, 1, 8192, 256, 256, 256, 8192]
    - [58, 8.328]
  - - [256, 8192, 1, 128, 256, 256, 256, 128]
    - [16, 1.789]
  - - [256, 8192, 1, 256, 256, 256, 256, 256]
    - [1, 2.951]
  - - [256, 8192, 1, 512, 256, 256, 256, 512]
    - [14, 4.333]
  - - [256, 8192, 1, 1024, 256, 256, 256, 1024]
    - [0, 5.856]
  - - [256, 8192, 1, 2048, 256, 256, 256, 2048]
    - [62, 7.064]
  - - [256, 8192, 1, 4096, 256, 256, 256, 4096]
    - [61, 8.159]
  - - [256, 8192, 1, 8192, 256, 256, 256, 8192]
    - [12, 9.028]
  - - [512, 128, 1, 128, 512, 512, 512, 128]
    - [110, 0.324]
  - - [512, 128, 1, 256, 512, 512, 512, 256]
    - [111, 0.602]
  - - [512, 128, 1, 512, 512, 512, 512, 512]
    - [111, 0.937]
  - - [512, 128, 1, 1024, 512, 512, 512, 1024]
    - [112, 1.417]
  - - [512, 128, 1, 2048, 512, 512, 512, 2048]
    - [111, 1.851]
  - - [512, 128, 1, 4096, 512, 512, 512, 4096]
    - [81, 2.438]
  - - [512, 128, 1, 8192, 512, 512, 512, 8192]
    - [98, 3.383]
  - - [512, 256, 1, 128, 512, 512, 512, 128]
    - [106, 0.585]
  - - [512, 256, 1, 256, 512, 512, 512, 256]
    - [90, 1.005]
  - - [512, 256, 1, 512, 512, 512, 512, 512]
    - [106, 1.623]
  - - [512, 256, 1, 1024, 512, 512, 512, 1024]
    - [105, 2.25]
  - - [512, 256, 1, 2048, 512, 512, 512, 2048]
    - [105, 2.932]
  - - [512, 256, 1, 4096, 512, 512, 512, 4096]
    - [74, 3.697]
  - - [512, 256, 1, 8192, 512, 512, 512, 8192]
    - [70, 4.717]
  - - [512, 512, 1, 128, 512, 512, 512, 128]
    - [80, 0.938]
  - - [512, 512, 1, 256, 512, 512, 512, 256]
    - [83, 1.61]
  - - [512, 512, 1, 512, 512, 512, 512, 512]
    - [81, 2.401]
  - - [512, 512, 1, 1024, 512, 512, 512, 1024]
    - [103, 3.388]
  - - [512, 512, 1, 2048, 512, 512, 512, 2048]
    - [99, 4.166]
  - - [512, 512, 1, 4096, 512, 512, 512, 4096]
    - [69, 4.958]
  - - [512, 512, 1, 8192, 512, 512, 512, 8192]
    - [69, 6.233]
  - - [512, 1024, 1, 128, 512, 512, 512, 128]
    - [40, 1.222]
  - - [512, 1024, 1, 256, 512, 512, 512, 256]
    - [71, 1.984]
  - - [512, 1024, 1, 512, 512, 512, 512, 512]
    - [77, 3.11]
  - - [512, 1024, 1, 1024, 512, 512, 512, 1024]
    - [74, 4.412]
  - - [512, 1024, 1, 2048, 512, 512, 512, 2048]
    - [78, 5.652]
  - - [512, 1024, 1, 4096, 512, 512, 512, 4096]
    - [68, 6.182]
  - - [512, 1024, 1, 8192, 512, 512, 512, 8192]
    - [49, 7.311]
  - - [512, 2048, 1, 128, 512, 512, 512, 128]
    - [24, 1.571]
  - - [512, 2048, 1, 256, 512, 512, 512, 256]
    - [33, 2.698]
  - - [512, 2048, 1, 512, 512, 512, 512, 512]
    - [33, 3.956]
  - - [512, 2048, 1, 1024, 512, 512, 512, 1024]
    - [49, 5.327]
  - - [512, 2048, 1, 2048, 512, 512, 512, 2048]
    - [55, 6.452]
  - - [512, 2048, 1, 4096, 512, 512, 512, 4096]
    - [66, 7.298]
  - - [512, 2048, 1, 8192, 512, 512, 512, 8192]
    - [51, 8.335]
  - - [512, 4096, 1, 128, 512, 512, 512, 128]
    - [3, 1.756]
  - - [512, 4096, 1, 256, 512, 512, 512, 256]
    - [3, 2.971]
  - - [512, 4096, 1, 512, 512, 512, 512, 512]
    - [19, 4.414]
  - - [512, 4096, 1, 1024, 512, 512, 512, 1024]
    - [4, 5.837]
  - - [512, 4096, 1, 2048, 512, 512, 512, 2048]
    - [64, 7.053]
  - - [512, 4096, 1, 4096, 512, 512, 512, 4096]
    - [61, 8.109]
  - - [512, 4096, 1, 8192, 512, 512, 512, 8192]
    - [1, 9.047]
  - - [512, 8192, 1, 128, 512, 512, 512, 128]
    - [33, 1.877]
  - - [512, 8192, 1, 256, 512, 512, 512, 256]
    - [63, 3.046]
  - - [512, 8192, 1, 512, 512, 512, 512, 512]
    - [2, 4.545]
  - - [512, 8192, 1, 1024, 512, 512, 512, 1024]
    - [11, 6.384]
  - - [512, 8192, 1, 2048, 512, 512, 512, 2048]
    - [11, 7.869]
  - - [512, 8192, 1, 4096, 512, 512, 512, 4096]
    - [18, 8.739]
  - - [512, 8192, 1, 8192, 512, 512, 512, 8192]
    - [17, 9.343]
  - - [1024, 128, 1, 128, 1024, 1024, 1024, 128]
    - [87, 0.597]
  - - [1024, 128, 1, 256, 1024, 1024, 1024, 256]
    - [108, 0.949]
  - - [1024, 128, 1, 512, 1024, 1024, 1024, 512]
    - [91, 1.564]
  - - [1024, 128, 1, 1024, 1024, 1024, 1024, 1024]
    - [106, 2.249]
  - - [1024, 128, 1, 2048, 1024, 1024, 1024, 2048]
    - [98, 2.601]
  - - [1024, 128, 1, 4096, 1024, 1024, 1024, 4096]
    - [78, 3.571]
  - - [1024, 128, 1, 8192, 1024, 1024, 1024, 8192]
    - [74, 4.536]
  - - [1024, 256, 1, 128, 1024, 1024, 1024, 128]
    - [85, 0.952]
  - - [1024, 256, 1, 256, 1024, 1024, 1024, 256]
    - [81, 1.623]
  - - [1024, 256, 1, 512, 1024, 1024, 1024, 512]
    - [79, 2.41]
  - - [1024, 256, 1, 1024, 1024, 1024, 1024, 1024]
    - [99, 3.357]
  - - [1024, 256, 1, 2048, 1024, 1024, 1024, 2048]
    - [98, 4.007]
  - - [1024, 256, 1, 4096, 1024, 1024, 1024, 4096]
    - [68, 5.076]
  - - [1024, 256, 1, 8192, 1024, 1024, 1024, 8192]
    - [70, 6.211]
  - - [1024, 512, 1, 128, 1024, 1024, 1024, 128]
    - [37, 1.277]
  - - [1024, 512, 1, 256, 1024, 1024, 1024, 256]
    - [70, 1.964]
  - - [1024, 512, 1, 512, 1024, 1024, 1024, 512]
    - [69, 3.186]
  - - [1024, 512, 1, 1024, 1024, 1024, 1024, 1024]
    - [72, 4.525]
  - - [1024, 512, 1, 2048, 1024, 1024, 1024, 2048]
    - [70, 5.666]
  - - [1024, 512, 1, 4096, 1024, 1024, 1024, 4096]
    - [70, 6.411]
  - - [1024, 512, 1, 8192, 1024, 1024, 1024, 8192]
    - [56, 7.286]
  - - [1024, 1024, 1, 128, 1024, 1024, 1024, 128]
    - [27, 1.565]
  - - [1024, 1024, 1, 256, 1024, 1024, 1024, 256]
    - [29, 2.615]
  - - [1024, 1024, 1, 512, 1024, 1024, 1024, 512]
    - [30, 4.017]
  - - [1024, 1024, 1, 1024, 1024, 1024, 1024, 1024]
    - [49, 5.309]
  - - [1024, 1024, 1, 2048, 1024, 1024, 1024, 2048]
    - [57, 6.405]
  - - [1024, 1024, 1, 4096, 1024, 1024, 1024, 4096]
    - [49, 7.339]
  - - [1024, 1024, 1, 8192, 1024, 1024, 1024, 8192]
    - [61, 8.314]
  - - [1024, 2048, 1, 128, 1024, 1024, 1024, 128]
    - [19, 1.858]
  - - [1024, 2048, 1, 256, 1024, 1024, 1024, 256]
    - [18, 3.045]
  - - [1024, 2048, 1, 512, 1024, 1024, 1024, 512]
    - [12, 4.55]
  - - [1024, 2048, 1, 1024, 1024, 1024, 1024, 1024]
    - [4, 5.977]
  - - [1024, 2048, 1, 2048, 1024, 1024, 1024, 2048]
    - [48, 6.991]
  - - [1024, 2048, 1, 4096, 1024, 1024, 1024, 4096]
    - [11, 8.147]
  - - [1024, 2048, 1, 8192, 1024, 1024, 1024, 8192]
    - [17, 9.106]
  - - [1024, 4096, 1, 128, 1024, 1024, 1024, 128]
    - [23, 1.864]
  - - [1024, 4096, 1, 256, 1024, 1024, 1024, 256]
    - [67, 3.041]
  - - [1024, 4096, 1, 512, 1024, 1024, 1024, 512]
    - [16, 4.547]
  - - [1024, 4096, 1, 1024, 1024, 1024, 1024, 1024]
    - [17, 6.381]
  - - [1024, 4096, 1, 2048, 1024, 1024, 1024, 2048]
    - [19, 7.869]
  - - [1024, 4096, 1, 4096, 1024, 1024, 1024, 4096]
    - [2, 8.883]
  - - [1024, 4096, 1, 8192, 1024, 1024, 1024, 8192]
    - [6, 9.506]
  - - [1024, 8192, 1, 128, 1024, 1024, 1024, 128]
    - [62, 2.109]
  - - [1024, 8192, 1, 256, 1024, 1024, 1024, 256]
    - [61, 3.41]
  - - [1024, 8192, 1, 512, 1024, 1024, 1024, 512]
    - [35, 5.05]
  - - [1024, 8192, 1, 1024, 1024, 1024, 1024, 1024]
    - [19, 6.619]
  - - [1024, 8192, 1, 2048, 1024, 1024, 1024, 2048]
    - [2, 7.928]
  - - [1024, 8192, 1, 4096, 1024, 1024, 1024, 4096]
    - [16, 9.016]
  - - [1024, 8192, 1, 8192, 1024, 1024, 1024, 8192]
    - [16, 9.219]
  - - [2048, 128, 1, 128, 2048, 2048, 2048, 128]
    - [42, 0.956]
  - - [2048, 128, 1, 256, 2048, 2048, 2048, 256]
    - [44, 1.573]
  - - [2048, 128, 1, 512, 2048, 2048, 2048, 512]
    - [103, 2.421]
  - - [2048, 128, 1, 1024, 2048, 2048, 2048, 1024]
    - [85, 3.284]
  - - [2048, 128, 1, 2048, 2048, 2048, 2048, 2048]
    - [86, 4.025]
  - - [2048, 128, 1, 4096, 2048, 2048, 2048, 4096]
    - [76, 4.986]
  - - [2048, 128, 1, 8192, 2048, 2048, 2048, 8192]
    - [70, 6.097]
  - - [2048, 256, 1, 128, 2048, 2048, 2048, 128]
    - [38, 1.303]
  - - [2048, 256, 1, 256, 2048, 2048, 2048, 256]
    - [41, 1.983]
  - - [2048, 256, 1, 512, 2048, 2048, 2048, 512]
    - [68, 3.243]
  - - [2048, 256, 1, 1024, 2048, 2048, 2048, 1024]
    - [70, 4.548]
  - - [2048, 256, 1, 2048, 2048, 2048, 2048, 2048]
    - [72, 5.578]
  - - [2048, 256, 1, 4096, 2048, 2048, 2048, 4096]
    - [69, 6.488]
  - - [2048, 256, 1, 8192, 2048, 2048, 2048, 8192]
    - [49, 7.296]
  - - [2048, 512, 1, 128, 2048, 2048, 2048, 128]
    - [32, 1.582]
  - - [2048, 512, 1, 256, 2048, 2048, 2048, 256]
    - [28, 2.695]
  - - [2048, 512, 1, 512, 2048, 2048, 2048, 512]
    - [28, 4.018]
  - - [2048, 512, 1, 1024, 2048, 2048, 2048, 1024]
    - [49, 5.315]
  - - [2048, 512, 1, 2048, 2048, 2048, 2048, 2048]
    - [46, 6.423]
  - - [2048, 512, 1, 4096, 2048, 2048, 2048, 4096]
    - [60, 7.304]
  - - [2048, 512, 1, 8192, 2048, 2048, 2048, 8192]
    - [55, 8.331]
  - - [2048, 1024, 1, 128, 2048, 2048, 2048, 128]
    - [19, 1.851]
  - - [2048, 1024, 1, 256, 2048, 2048, 2048, 256]
    - [19, 3.039]
  - - [2048, 1024, 1, 512, 2048, 2048, 2048, 512]
    - [12, 4.484]
  - - [2048, 1024, 1, 1024, 2048, 2048, 2048, 1024]
    - [4, 5.953]
  - - [2048, 1024, 1, 2048, 2048, 2048, 2048, 2048]
    - [60, 7.0]
  - - [2048, 1024, 1, 4096, 2048, 2048, 2048, 4096]
    - [15, 8.136]
  - - [2048, 1024, 1, 8192, 2048, 2048, 2048, 8192]
    - [16, 9.005]
  - - [2048, 2048, 1, 128, 2048, 2048, 2048, 128]
    - [32, 1.891]
  - - [2048, 2048, 1, 256, 2048, 2048, 2048, 256]
    - [62, 3.092]
  - - [2048, 2048, 1, 512, 2048, 2048, 2048, 512]
    - [17, 4.66]
  - - [2048, 2048, 1, 1024, 2048, 2048, 2048, 1024]
    - [16, 6.458]
  - - [2048, 2048, 1, 2048, 2048, 2048, 2048, 2048]
    - [2, 7.888]
  - - [2048, 2048, 1, 4096, 2048, 2048, 2048, 4096]
    - [0, 8.934]
  - - [2048, 2048, 1, 8192, 2048, 2048, 2048, 8192]
    - [16, 9.505]
  - - [2048, 4096, 1, 128, 2048, 2048, 2048, 128]
    - [60, 2.187]
  - - [2048, 4096, 1, 256, 2048, 2048, 2048, 256]
    - [26, 3.432]
  - - [2048, 4096, 1, 512, 2048, 2048, 2048, 512]
    - [34, 5.02]
  - - [2048, 4096, 1, 1024, 2048, 2048, 2048, 1024]
    - [0, 6.65]
  - - [2048, 4096, 1, 2048, 2048, 2048, 2048, 2048]
    - [4, 8.028]
  - - [2048, 4096, 1, 4096, 2048, 2048, 2048, 4096]
    - [1, 9.024]
  - - [2048, 4096, 1, 8192, 2048, 2048, 2048, 8192]
    - [10, 9.492]
  - - [2048, 8192, 1, 128, 2048, 2048, 2048, 128]
    - [33, 2.427]
  - - [2048, 8192, 1, 256, 2048, 2048, 2048, 256]
    - [33, 3.767]
  - - [2048, 8192, 1, 512, 2048, 2048, 2048, 512]
    - [9, 5.468]
  - - [2048, 8192, 1, 1024, 2048, 2048, 2048, 1024]
    - [15, 7.133]
  - - [2048, 8192, 1, 2048, 2048, 2048, 2048, 2048]
    - [8, 8.194]
  - - [2048, 8192, 1, 4096, 2048, 2048, 2048, 4096]
    - [6, 8.943]
  - - [2048, 8192, 1, 8192, 2048, 2048, 2048, 8192]
    - [9, 8.874]
  - - [4096, 128, 1, 128, 4096, 4096, 4096, 128]
    - [36, 1.253]
  - - [4096, 128, 1, 256, 4096, 4096, 4096, 256]
    - [68, 2.074]
  - - [4096, 128, 1, 512, 4096, 4096, 4096, 512]
    - [68, 3.173]
  - - [4096, 128, 1, 1024, 4096, 4096, 4096, 1024]
    - [76, 4.3]
  - - [4096, 128, 1, 2048, 4096, 4096, 4096, 2048]
    - [73, 5.101]
  - - [4096, 128, 1, 4096, 4096, 4096, 4096, 4096]
    - [69, 6.467]
  - - [4096, 128, 1, 8192, 4096, 4096, 4096, 8192]
    - [70, 7.346]
  - - [4096, 256, 1, 128, 4096, 4096, 4096, 128]
    - [28, 1.637]
  - - [4096, 256, 1, 256, 4096, 4096, 4096, 256]
    - [31, 2.721]
  - - [4096, 256, 1, 512, 4096, 4096, 4096, 512]
    - [33, 3.982]
  - - [4096, 256, 1, 1024, 4096, 4096, 4096, 1024]
    - [31, 5.3]
  - - [4096, 256, 1, 2048, 4096, 4096, 4096, 2048]
    - [66, 6.376]
  - - [4096, 256, 1, 4096, 4096, 4096, 4096, 4096]
    - [54, 7.396]
  - - [4096, 256, 1, 8192, 4096, 4096, 4096, 8192]
    - [62, 8.352]
  - - [4096, 512, 1, 128, 4096, 4096, 4096, 128]
    - [1, 1.814]
  - - [4096, 512, 1, 256, 4096, 4096, 4096, 256]
    - [16, 3.045]
  - - [4096, 512, 1, 512, 4096, 4096, 4096, 512]
    - [13, 4.512]
  - - [4096, 512, 1, 1024, 4096, 4096, 4096, 1024]
    - [9, 5.882]
  - - [4096, 512, 1, 2048, 4096, 4096, 4096, 2048]
    - [61, 7.082]
  - - [4096, 512, 1, 4096, 4096, 4096, 4096, 4096]
    - [49, 8.147]
  - - [4096, 512, 1, 8192, 4096, 4096, 4096, 8192]
    - [2, 8.988]
  - - [4096, 1024, 1, 128, 4096, 4096, 4096, 128]
    - [33, 1.871]
  - - [4096, 1024, 1, 256, 4096, 4096, 4096, 256]
    - [60, 3.037]
  - - [4096, 1024, 1, 512, 4096, 4096, 4096, 512]
    - [0, 4.758]
  - - [4096, 1024, 1, 1024, 4096, 4096, 4096, 1024]
    - [16, 6.375]
  - - [4096, 1024, 1, 2048, 4096, 4096, 4096, 2048]
    - [12, 7.774]
  - - [4096, 1024, 1, 4096, 4096, 4096, 4096, 4096]
    - [9, 8.904]
  - - [4096, 1024, 1, 8192, 4096, 4096, 4096, 8192]
    - [8, 9.361]
  - - [4096, 2048, 1, 128, 4096, 4096, 4096, 128]
    - [61, 2.165]
  - - [4096, 2048, 1, 256, 4096, 4096, 4096, 256]
    - [26, 3.465]
  - - [4096, 2048, 1, 512, 4096, 4096, 4096, 512]
    - [25, 5.056]
  - - [4096, 2048, 1, 1024, 4096, 4096, 4096, 1024]
    - [2, 6.617]
  - - [4096, 2048, 1, 2048, 4096, 4096, 4096, 2048]
    - [0, 8.063]
  - - [4096, 2048, 1, 4096, 4096, 4096, 4096, 4096]
    - [0, 9.019]
  - - [4096, 2048, 1, 8192, 4096, 4096, 4096, 8192]
    - [1, 9.549]
  - - [4096, 4096, 1, 128, 4096, 4096, 4096, 128]
    - [25, 2.412]
  - - [4096, 4096, 1, 256, 4096, 4096, 4096, 256]
    - [60, 3.807]
  - - [4096, 4096, 1, 512, 4096, 4096, 4096, 512]
    - [61, 5.456]
  - - [4096, 4096, 1, 1024, 4096, 4096, 4096, 1024]
    - [0, 6.963]
  - - [4096, 4096, 1, 2048, 4096, 4096, 4096, 2048]
    - [1, 8.327]
  - - [4096, 4096, 1, 4096, 4096, 4096, 4096, 4096]
    - [6, 8.986]
  - - [4096, 4096, 1, 8192, 4096, 4096, 4096, 8192]
    - [7, 9.337]
  - - [4096, 8192, 1, 128, 4096, 4096, 4096, 128]
    - [33, 2.521]
  - - [4096, 8192, 1, 256, 4096, 4096, 4096, 256]
    - [61, 3.928]
  - - [4096, 8192, 1, 512, 4096, 4096, 4096, 512]
    - [1, 5.511]
  - - [4096, 8192, 1, 1024, 4096, 4096, 4096, 1024]
    - [1, 7.074]
  - - [4096, 8192, 1, 2048, 4096, 4096, 4096, 2048]
    - [11, 8.139]
  - - [4096, 8192, 1, 4096, 4096, 4096, 4096, 4096]
    - [9, 8.977]
  - - [4096, 8192, 1, 8192, 4096, 4096, 4096, 8192]
    - [12, 9.391]
  - - [8192, 128, 1, 128, 8192, 8192, 8192, 128]
    - [31, 1.646]
  - - [8192, 128, 1, 256, 8192, 8192, 8192, 256]
    - [26, 2.743]
  - - [8192, 128, 1, 512, 8192, 8192, 8192, 512]
    - [32, 3.969]
  - - [8192, 128, 1, 1024, 8192, 8192, 8192, 1024]
    - [65, 5.238]
  - - [8192, 128, 1, 2048, 8192, 8192, 8192, 2048]
    - [60, 6.392]
  - - [8192, 128, 1, 4096, 8192, 8192, 8192, 4096]
    - [61, 7.325]
  - - [8192, 128, 1, 8192, 8192, 8192, 8192, 8192]
    - [61, 8.263]
  - - [8192, 256, 1, 128, 8192, 8192, 8192, 128]
    - [13, 1.827]
  - - [8192, 256, 1, 256, 8192, 8192, 8192, 256]
    - [15, 3.05]
  - - [8192, 256, 1, 512, 8192, 8192, 8192, 512]
    - [6, 4.486]
  - - [8192, 256, 1, 1024, 8192, 8192, 8192, 1024]
    - [12, 5.882]
  - - [8192, 256, 1, 2048, 8192, 8192, 8192, 2048]
    - [47, 7.147]
  - - [8192, 256, 1, 4096, 8192, 8192, 8192, 4096]
    - [48, 8.197]
  - - [8192, 256, 1, 8192, 8192, 8192, 8192, 8192]
    - [6, 9.056]
  - - [8192, 512, 1, 128, 8192, 8192, 8192, 128]
    - [25, 1.956]
  - - [8192, 512, 1, 256, 8192, 8192, 8192, 256]
    - [63, 3.072]
  - - [8192, 512, 1, 512, 8192, 8192, 8192, 512]
    - [1, 4.721]
  - - [8192, 512, 1, 1024, 8192, 8192, 8192, 1024]
    - [2, 6.464]
  - - [8192, 512, 1, 2048, 8192, 8192, 8192, 2048]
    - [0, 7.948]
  - - [8192, 512, 1, 4096, 8192, 8192, 8192, 4096]
    - [1, 8.904]
  - - [8192, 512, 1, 8192, 8192, 8192, 8192, 8192]
    - [19, 9.49]
  - - [8192, 1024, 1, 128, 8192, 8192, 8192, 128]
    - [60, 2.162]
  - - [8192, 1024, 1, 256, 8192, 8192, 8192, 256]
    - [26, 3.472]
  - - [8192, 1024, 1, 512, 8192, 8192, 8192, 512]
    - [25, 5.034]
  - - [8192, 1024, 1, 1024, 8192, 8192, 8192, 1024]
    - [16, 6.62]
  - - [8192, 1024, 1, 2048, 8192, 8192, 8192, 2048]
    - [15, 7.993]
  - - [8192, 1024, 1, 4096, 8192, 8192, 8192, 4096]
    - [6, 8.999]
  - - [8192, 1024, 1, 8192, 8192, 8192, 8192, 8192]
    - [5, 9.538]
  - - [8192, 2048, 1, 128, 8192, 8192, 8192, 128]
    - [26, 2.432]
  - - [8192, 2048, 1, 256, 8192, 8192, 8192, 256]
    - [25, 3.751]
  - - [8192, 2048, 1, 512, 8192, 8192, 8192, 512]
    - [2, 5.433]
  - - [8192, 2048, 1, 1024, 8192, 8192, 8192, 1024]
    - [6, 7.129]
  - - [8192, 2048, 1, 2048, 8192, 8192, 8192, 2048]
    - [0, 8.412]
  - - [8192, 2048, 1, 4096, 8192, 8192, 8192, 4096]
    - [6, 8.967]
  - - [8192, 2048, 1, 8192, 8192, 8192, 8192, 8192]
    - [12, 9.418]
  - - [8192, 4096, 1, 128, 8192, 8192, 8192, 128]
    - [63, 2.476]
  - - [8192, 4096, 1, 256, 8192, 8192, 8192, 256]
    - [33, 3.997]
  - - [8192, 4096, 1, 512, 8192, 8192, 8192, 512]
    - [16, 5.405]
  - - [8192, 4096, 1, 1024, 8192, 8192, 8192, 1024]
    - [9, 6.864]
  - - [8192, 4096, 1, 2048, 8192, 8192, 8192, 2048]
    - [11, 8.091]
  - - [8192, 4096, 1, 4096, 8192, 8192, 8192, 4096]
    - [12, 9.0]
  - - [8192, 4096, 1, 8192, 8192, 8192, 8192, 8192]
    - [6, 9.609]
  - - [8192, 8192, 1, 128, 8192, 8192, 8192, 128]
    - [21, 2.156]
  - - [8192, 8192, 1, 256, 8192, 8192, 8192, 256]
    - [63, 3.571]
  - - [8192, 8192, 1, 512, 8192, 8192, 8192, 512]
    - [6, 5.532]
  - - [8192, 8192, 1, 1024, 8192, 8192, 8192, 1024]
    - [6, 7.265]
  - - [8192, 8192, 1, 2048, 8192, 8192, 8192, 2048]
    - [6, 8.483]
  - - [8192, 8192, 1, 4096, 8192, 8192, 8192, 4096]
    - [9, 9.247]
  - - [8192, 8192, 1, 8192, 8192, 8192, 8192, 8192]
    - [12, 9.386]
  - - [1, 1, 1, 32, 1, 1, 1, 32]
    - [117, 0.0]
- null
- null
- ExperimentalStreamK
- GridBased
