library/src/amd_detail/rocblaslt/src/Tensile/Logic/asm_full/aquavanjaram/gfx942_38cu/StreamK/aquavanjaram942_Cijk_Alik_Bjlk_HHS_BH_UserArgs.yaml
- {MinimumRequiredVersion: 4.33.0}
- aquavanjaram942
- {Architecture: gfx942, CUCount: 38}
- [Device 0049, Device 0050]
    SolutionIndex: 0
    SolutionNameMin: Cijk_Alik_Bjlk_HHS_BH_UserArgs_MT256x256x32_MI16x16x1_SN_LDSB1_CLR1_GSU0_GSUC0_GSUWGMRR0_K1_LBSPPA512_LBSPPB2048_LPB16_MIWT8_8_PLR1_SU32_SUM0_SUS256_VWA8_VWB1_WGM1_WGMXCC1_WGMXCCGn1
    SolutionIndex: 1
    SolutionNameMin: Cijk_Alik_Bjlk_HHS_BH_UserArgs_MT256x256x32_MI16x16x1_SN_LDSB1_CLR1_GSU0_GSUC0_GSUWGMRR0_K1_LBSPPA256_LBSPPB2048_LPB32_MIWT8_8_PLR1_SU32_SUM0_SUS256_VWA4_VWB2_WGM1_WGMXCC1_WGMXCCGn1
    SolutionIndex: 2
    SolutionNameMin: Cijk_Alik_Bjlk_HHS_BH_UserArgs_MT256x256x32_MI16x16x1_SN_LDSB1_CLR1_GSU0_GSUC0_GSUWGMRR0_K1_LBSPPA512_LBSPPB2048_LPB32_MIWT8_8_PLR1_SU32_SUM0_SUS256_VWA8_VWB2_WGM1_WGMXCC1_WGMXCCGn1
    SolutionIndex: 3
    SolutionNameMin: Cijk_Alik_Bjlk_HHS_BH_UserArgs_MT256x256x32_MI16x16x1_SN_LDSB1_CLR1_GSU0_GSUC0_GSUWGMRR0_K1_LBSPPA128_LBSPPB2048_LPB0_MIWT8_8_PLR1_SU32_SUM0_SUS256_VWA2_VWB4_WGM1_WGMXCC1_WGMXCCGn1
    SolutionIndex: 4
    SolutionNameMin: Cijk_Alik_Bjlk_HHS_BH_UserArgs_MT256x256x32_MI16x16x1_SN_LDSB1_CLR1_GSU0_GSUC0_GSUWGMRR0_K1_LBSPPA256_LBSPPB2048_LPB0_MIWT8_8_PLR1_SU32_SUM0_SUS256_VWA4_VWB4_WGM1_WGMXCC1_WGMXCCGn1
    SolutionIndex: 5
    SolutionNameMin: Cijk_Alik_Bjlk_HHS_BH_UserArgs_MT256x256x32_MI16x16x1_SN_LDSB1_CLR1_GSU0_GSUC0_GSUWGMRR0_K1_LBSPPA512_LBSPPB2048_LPB0_MIWT8_8_PLR1_SU32_SUM0_SUS256_VWA8_VWB4_WGM1_WGMXCC1_WGMXCCGn1
    SolutionIndex: 6
    SolutionNameMin: Cijk_Alik_Bjlk_HHS_BH_UserArgs_MT256x256x32_MI16x16x1_SN_LDSB1_CLR1_GSU0_GSUC0_GSUWGMRR0_K1_LBSPPA128_LBSPPB2048_LPB0_MIWT8_8_PLR1_SU32_SUM0_SUS256_VWA2_VWB8_WGM1_WGMXCC1_WGMXCCGn1
    SolutionIndex: 7
    SolutionNameMin: Cijk_Alik_Bjlk_HHS_BH_UserArgs_MT256x256x32_MI16x16x1_SN_LDSB1_CLR1_GSU0_GSUC0_GSUWGMRR0_K1_LBSPPA256_LBSPPB2048_LPB0_MIWT8_8_PLR1_SU32_SUM0_SUS256_VWA4_VWB8_WGM1_WGMXCC1_WGMXCCGn1
    SolutionIndex: 8
    SolutionNameMin: Cijk_Alik_Bjlk_HHS_BH_UserArgs_MT256x256x32_MI16x16x1_SN_LDSB1_CLR1_GSU0_GSUC0_GSUWGMRR0_K1_LBSPPA512_LBSPPB2048_LPB0_MIWT8_8_PLR1_SU32_SUM0_SUS256_VWA8_VWB8_WGM1_WGMXCC1_WGMXCCGn1
    SolutionIndex: 9
    SolutionNameMin: Cijk_Alik_Bjlk_HHS_BH_UserArgs_MT256x256x32_MI16x16x1_SN_LDSB1_CLR1_GSU0_GSUC0_GSUWGMRR0_K1_LBSPPA512_LBSPPB2048_LPB16_MIWT8_8_PLR1_SU32_SUM0_SUS256_VWA8_VWB1_WGM4_WGMXCC1_WGMXCCGn1
    SolutionIndex: 10
    SolutionNameMin: Cijk_Alik_Bjlk_HHS_BH_UserArgs_MT256x256x32_MI16x16x1_SN_LDSB1_CLR1_GSU0_GSUC0_GSUWGMRR0_K1_LBSPPA128_LBSPPB2048_LPB32_MIWT8_8_PLR1_SU32_SUM0_SUS256_VWA2_VWB2_WGM4_WGMXCC1_WGMXCCGn1
    SolutionIndex: 11
    SolutionNameMin: Cijk_Alik_Bjlk_HHS_BH_UserArgs_MT256x256x32_MI16x16x1_SN_LDSB1_CLR1_GSU0_GSUC0_GSUWGMRR0_K1_LBSPPA512_LBSPPB2048_LPB32_MIWT8_8_PLR1_SU32_SUM0_SUS256_VWA8_VWB2_WGM4_WGMXCC1_WGMXCCGn1
    SolutionIndex: 12
    SolutionNameMin: Cijk_Alik_Bjlk_HHS_BH_UserArgs_MT256x256x32_MI16x16x1_SN_LDSB1_CLR1_GSU0_GSUC0_GSUWGMRR0_K1_LBSPPA128_LBSPPB2048_LPB0_MIWT8_8_PLR1_SU32_SUM0_SUS256_VWA2_VWB4_WGM4_WGMXCC1_WGMXCCGn1
    SolutionIndex: 13
    SolutionNameMin: Cijk_Alik_Bjlk_HHS_BH_UserArgs_MT256x256x32_MI16x16x1_SN_LDSB1_CLR1_GSU0_GSUC0_GSUWGMRR0_K1_LBSPPA256_LBSPPB2048_LPB0_MIWT8_8_PLR1_SU32_SUM0_SUS256_VWA4_VWB4_WGM4_WGMXCC1_WGMXCCGn1
    SolutionIndex: 14
    SolutionNameMin: Cijk_Alik_Bjlk_HHS_BH_UserArgs_MT256x256x32_MI16x16x1_SN_LDSB1_CLR1_GSU0_GSUC0_GSUWGMRR0_K1_LBSPPA512_LBSPPB2048_LPB0_MIWT8_8_PLR1_SU32_SUM0_SUS256_VWA8_VWB4_WGM4_WGMXCC1_WGMXCCGn1
    SolutionIndex: 15
    SolutionNameMin: Cijk_Alik_Bjlk_HHS_BH_UserArgs_MT256x256x32_MI16x16x1_SN_LDSB1_CLR1_GSU0_GSUC0_GSUWGMRR0_K1_LBSPPA128_LBSPPB2048_LPB0_MIWT8_8_PLR1_SU32_SUM0_SUS256_VWA1_VWB8_WGM4_WGMXCC1_WGMXCCGn1
    SolutionIndex: 16
    SolutionNameMin: Cijk_Alik_Bjlk_HHS_BH_UserArgs_MT256x256x32_MI16x16x1_SN_LDSB1_CLR1_GSU0_GSUC0_GSUWGMRR0_K1_LBSPPA256_LBSPPB2048_LPB0_MIWT8_8_PLR1_SU32_SUM0_SUS256_VWA4_VWB8_WGM4_WGMXCC1_WGMXCCGn1
    SolutionIndex: 17
    SolutionNameMin: Cijk_Alik_Bjlk_HHS_BH_UserArgs_MT256x256x32_MI16x16x1_SN_LDSB1_CLR1_GSU0_GSUC0_GSUWGMRR0_K1_LBSPPA512_LBSPPB2048_LPB0_MIWT8_8_PLR1_SU32_SUM0_SUS256_VWA8_VWB8_WGM4_WGMXCC1_WGMXCCGn1
    SolutionIndex: 18
    SolutionNameMin: Cijk_Alik_Bjlk_HHS_BH_UserArgs_MT256x256x32_MI16x16x1_SN_LDSB1_CLR1_GSU0_GSUC0_GSUWGMRR0_K1_LBSPPA512_LBSPPB2048_LPB16_MIWT8_8_PLR1_SU32_SUM0_SUS256_VWA8_VWB1_WGM8_WGMXCC1_WGMXCCGn1
    SolutionIndex: 19
    SolutionNameMin: Cijk_Alik_Bjlk_HHS_BH_UserArgs_MT256x256x32_MI16x16x1_SN_LDSB1_CLR1_GSU0_GSUC0_GSUWGMRR0_K1_LBSPPA128_LBSPPB2048_LPB32_MIWT8_8_PLR1_SU32_SUM0_SUS256_VWA1_VWB2_WGM8_WGMXCC1_WGMXCCGn1
    SolutionIndex: 20
    SolutionNameMin: Cijk_Alik_Bjlk_HHS_BH_UserArgs_MT256x256x32_MI16x16x1_SN_LDSB1_CLR1_GSU0_GSUC0_GSUWGMRR0_K1_LBSPPA128_LBSPPB2048_LPB32_MIWT8_8_PLR1_SU32_SUM0_SUS256_VWA2_VWB2_WGM8_WGMXCC1_WGMXCCGn1
    SolutionIndex: 21
    SolutionNameMin: Cijk_Alik_Bjlk_HHS_BH_UserArgs_MT256x256x32_MI16x16x1_SN_LDSB1_CLR1_GSU0_GSUC0_GSUWGMRR0_K1_LBSPPA256_LBSPPB2048_LPB32_MIWT8_8_PLR1_SU32_SUM0_SUS256_VWA4_VWB2_WGM8_WGMXCC1_WGMXCCGn1
    SolutionIndex: 22
    SolutionNameMin: Cijk_Alik_Bjlk_HHS_BH_UserArgs_MT256x256x32_MI16x16x1_SN_LDSB1_CLR1_GSU0_GSUC0_GSUWGMRR0_K1_LBSPPA512_LBSPPB2048_LPB32_MIWT8_8_PLR1_SU32_SUM0_SUS256_VWA8_VWB2_WGM8_WGMXCC1_WGMXCCGn1
    SolutionIndex: 23
    SolutionNameMin: Cijk_Alik_Bjlk_HHS_BH_UserArgs_MT256x256x32_MI16x16x1_SN_LDSB1_CLR1_GSU0_GSUC0_GSUWGMRR0_K1_LBSPPA128_LBSPPB2048_LPB0_MIWT8_8_PLR1_SU32_SUM0_SUS256_VWA1_VWB4_WGM8_WGMXCC1_WGMXCCGn1
    SolutionIndex: 24
    SolutionNameMin: Cijk_Alik_Bjlk_HHS_BH_UserArgs_MT256x256x32_MI16x16x1_SN_LDSB1_CLR1_GSU0_GSUC0_GSUWGMRR0_K1_LBSPPA128_LBSPPB2048_LPB0_MIWT8_8_PLR1_SU32_SUM0_SUS256_VWA2_VWB4_WGM8_WGMXCC1_WGMXCCGn1
    SolutionIndex: 25
    SolutionNameMin: Cijk_Alik_Bjlk_HHS_BH_UserArgs_MT256x256x32_MI16x16x1_SN_LDSB1_CLR1_GSU0_GSUC0_GSUWGMRR0_K1_LBSPPA256_LBSPPB2048_LPB0_MIWT8_8_PLR1_SU32_SUM0_SUS256_VWA4_VWB4_WGM8_WGMXCC1_WGMXCCGn1
    SolutionIndex: 26
    SolutionNameMin: Cijk_Alik_Bjlk_HHS_BH_UserArgs_MT256x256x32_MI16x16x1_SN_LDSB1_CLR1_GSU0_GSUC0_GSUWGMRR0_K1_LBSPPA512_LBSPPB2048_LPB0_MIWT8_8_PLR1_SU32_SUM0_SUS256_VWA8_VWB4_WGM8_WGMXCC1_WGMXCCGn1
    SolutionIndex: 27
    SolutionNameMin: Cijk_Alik_Bjlk_HHS_BH_UserArgs_MT256x256x32_MI16x16x1_SN_LDSB1_CLR1_GSU0_GSUC0_GSUWGMRR0_K1_LBSPPA128_LBSPPB2048_LPB0_MIWT8_8_PLR1_SU32_SUM0_SUS256_VWA1_VWB8_WGM8_WGMXCC1_WGMXCCGn1
    SolutionIndex: 28
    SolutionNameMin: Cijk_Alik_Bjlk_HHS_BH_UserArgs_MT256x256x32_MI16x16x1_SN_LDSB1_CLR1_GSU0_GSUC0_GSUWGMRR0_K1_LBSPPA128_LBSPPB2048_LPB0_MIWT8_8_PLR1_SU32_SUM0_SUS256_VWA2_VWB8_WGM8_WGMXCC1_WGMXCCGn1
    SolutionIndex: 29
    SolutionNameMin: Cijk_Alik_Bjlk_HHS_BH_UserArgs_MT256x256x32_MI16x16x1_SN_LDSB1_CLR1_GSU0_GSUC0_GSUWGMRR0_K1_LBSPPA256_LBSPPB2048_LPB0_MIWT8_8_PLR1_SU32_SUM0_SUS256_VWA4_VWB8_WGM8_WGMXCC1_WGMXCCGn1
    SolutionIndex: 30
    SolutionNameMin: Cijk_Alik_Bjlk_HHS_BH_UserArgs_MT256x256x32_MI16x16x1_SN_LDSB1_CLR1_GSU0_GSUC0_GSUWGMRR0_K1_LBSPPA512_LBSPPB2048_LPB0_MIWT8_8_PLR1_SU32_SUM0_SUS256_VWA8_VWB8_WGM8_WGMXCC1_WGMXCCGn1
    SolutionIndex: 31
    SolutionNameMin: Cijk_Alik_Bjlk_HHS_BH_UserArgs_MT128x256x32_MI16x16x1_SN_LDSB1_CLR1_GSU0_GSUC0_GSUWGMRR0_K1_LBSPPA256_LBSPPB2048_LPB32_MIWT4_8_PLR1_SU32_SUM0_SUS256_VWA4_VWB2_WGM1_WGMXCC1_WGMXCCGn1
    SolutionIndex: 32
    SolutionNameMin: Cijk_Alik_Bjlk_HHS_BH_UserArgs_MT128x256x32_MI16x16x1_SN_LDSB1_CLR1_GSU0_GSUC0_GSUWGMRR0_K1_LBSPPA128_LBSPPB2048_LPB0_MIWT4_8_PLR1_SU32_SUM0_SUS256_VWA2_VWB4_WGM1_WGMXCC1_WGMXCCGn1
    SolutionIndex: 33
    SolutionNameMin: Cijk_Alik_Bjlk_HHS_BH_UserArgs_MT128x256x32_MI16x16x1_SN_LDSB1_CLR1_GSU0_GSUC0_GSUWGMRR0_K1_LBSPPA256_LBSPPB2048_LPB0_MIWT4_8_PLR1_SU32_SUM0_SUS256_VWA4_VWB4_WGM1_WGMXCC1_WGMXCCGn1
    SolutionIndex: 34
    SolutionNameMin: Cijk_Alik_Bjlk_HHS_BH_UserArgs_MT128x256x32_MI16x16x1_SN_LDSB1_CLR1_GSU0_GSUC0_GSUWGMRR0_K1_LBSPPA256_LBSPPB2048_LPB0_MIWT4_8_PLR1_SU32_SUM0_SUS256_VWA4_VWB8_WGM1_WGMXCC1_WGMXCCGn1
    SolutionIndex: 35
    SolutionNameMin: Cijk_Alik_Bjlk_HHS_BH_UserArgs_MT128x256x32_MI16x16x1_SN_LDSB1_CLR1_GSU0_GSUC0_GSUWGMRR0_K1_LBSPPA256_LBSPPB2048_LPB32_MIWT4_8_PLR1_SU32_SUM0_SUS256_VWA4_VWB2_WGM4_WGMXCC1_WGMXCCGn1
    SolutionIndex: 36
    SolutionNameMin: Cijk_Alik_Bjlk_HHS_BH_UserArgs_MT128x256x32_MI16x16x1_SN_LDSB1_CLR1_GSU0_GSUC0_GSUWGMRR0_K1_LBSPPA128_LBSPPB2048_LPB0_MIWT4_8_PLR1_SU32_SUM0_SUS256_VWA2_VWB4_WGM4_WGMXCC1_WGMXCCGn1
    SolutionIndex: 37
    SolutionNameMin: Cijk_Alik_Bjlk_HHS_BH_UserArgs_MT128x256x32_MI16x16x1_SN_LDSB1_CLR1_GSU0_GSUC0_GSUWGMRR0_K1_LBSPPA256_LBSPPB2048_LPB0_MIWT4_8_PLR1_SU32_SUM0_SUS256_VWA4_VWB4_WGM4_WGMXCC1_WGMXCCGn1
    SolutionIndex: 38
    SolutionNameMin: Cijk_Alik_Bjlk_HHS_BH_UserArgs_MT128x256x32_MI16x16x1_SN_LDSB1_CLR1_GSU0_GSUC0_GSUWGMRR0_K1_LBSPPA128_LBSPPB2048_LPB0_MIWT4_8_PLR1_SU32_SUM0_SUS256_VWA1_VWB8_WGM4_WGMXCC1_WGMXCCGn1
    SolutionIndex: 39
    SolutionNameMin: Cijk_Alik_Bjlk_HHS_BH_UserArgs_MT128x256x32_MI16x16x1_SN_LDSB1_CLR1_GSU0_GSUC0_GSUWGMRR0_K1_LBSPPA128_LBSPPB2048_LPB0_MIWT4_8_PLR1_SU32_SUM0_SUS256_VWA2_VWB4_WGM8_WGMXCC1_WGMXCCGn1
    SolutionIndex: 40
    SolutionNameMin: Cijk_Alik_Bjlk_HHS_BH_UserArgs_MT128x256x32_MI16x16x1_SN_LDSB1_CLR1_GSU0_GSUC0_GSUWGMRR0_K1_LBSPPA256_LBSPPB2048_LPB0_MIWT4_8_PLR1_SU32_SUM0_SUS256_VWA4_VWB4_WGM8_WGMXCC1_WGMXCCGn1
    SolutionIndex: 41
    SolutionNameMin: Cijk_Alik_Bjlk_HHS_BH_UserArgs_MT128x256x32_MI16x16x1_SN_LDSB1_CLR1_GSU0_GSUC0_GSUWGMRR0_K1_LBSPPA256_LBSPPB2048_LPB0_MIWT4_8_PLR1_SU32_SUM0_SUS256_VWA4_VWB8_WGM8_WGMXCC1_WGMXCCGn1
    SolutionIndex: 42
    SolutionNameMin: Cijk_Alik_Bjlk_HHS_BH_UserArgs_MT256x128x32_MI16x16x1_SN_LDSB1_CLR1_GSU0_GSUC0_GSUWGMRR0_K1_LBSPPA512_LBSPPB1024_LPB32_MIWT8_4_PLR1_SU32_SUM0_SUS256_VWA8_VWB2_WGM1_WGMXCC1_WGMXCCGn1
    SolutionIndex: 43
    SolutionNameMin: Cijk_Alik_Bjlk_HHS_BH_UserArgs_MT256x128x32_MI16x16x1_SN_LDSB1_CLR1_GSU0_GSUC0_GSUWGMRR0_K1_LBSPPA128_LBSPPB1024_LPB0_MIWT8_4_PLR1_SU32_SUM0_SUS256_VWA2_VWB4_WGM1_WGMXCC1_WGMXCCGn1
    SolutionIndex: 44
    SolutionNameMin: Cijk_Alik_Bjlk_HHS_BH_UserArgs_MT256x128x32_MI16x16x1_SN_LDSB1_CLR1_GSU0_GSUC0_GSUWGMRR0_K1_LBSPPA256_LBSPPB1024_LPB0_MIWT8_4_PLR1_SU32_SUM0_SUS256_VWA4_VWB4_WGM1_WGMXCC1_WGMXCCGn1
    SolutionIndex: 45
    SolutionNameMin: Cijk_Alik_Bjlk_HHS_BH_UserArgs_MT256x128x32_MI16x16x1_SN_LDSB1_CLR1_GSU0_GSUC0_GSUWGMRR0_K1_LBSPPA512_LBSPPB1024_LPB0_MIWT8_4_PLR1_SU32_SUM0_SUS256_VWA8_VWB4_WGM1_WGMXCC1_WGMXCCGn1
    SolutionIndex: 46
    SolutionNameMin: Cijk_Alik_Bjlk_HHS_BH_UserArgs_MT256x128x32_MI16x16x1_SN_LDSB1_CLR1_GSU0_GSUC0_GSUWGMRR0_K1_LBSPPA128_LBSPPB1024_LPB32_MIWT8_4_PLR1_SU32_SUM0_SUS256_VWA2_VWB2_WGM4_WGMXCC1_WGMXCCGn1
    SolutionIndex: 47
    SolutionNameMin: Cijk_Alik_Bjlk_HHS_BH_UserArgs_MT256x128x32_MI16x16x1_SN_LDSB1_CLR1_GSU0_GSUC0_GSUWGMRR0_K1_LBSPPA256_LBSPPB1024_LPB32_MIWT8_4_PLR1_SU32_SUM0_SUS256_VWA4_VWB2_WGM4_WGMXCC1_WGMXCCGn1
    SolutionIndex: 48
    SolutionNameMin: Cijk_Alik_Bjlk_HHS_BH_UserArgs_MT256x128x32_MI16x16x1_SN_LDSB1_CLR1_GSU0_GSUC0_GSUWGMRR0_K1_LBSPPA512_LBSPPB1024_LPB32_MIWT8_4_PLR1_SU32_SUM0_SUS256_VWA8_VWB2_WGM4_WGMXCC1_WGMXCCGn1
    SolutionIndex: 49
    SolutionNameMin: Cijk_Alik_Bjlk_HHS_BH_UserArgs_MT256x128x32_MI16x16x1_SN_LDSB1_CLR1_GSU0_GSUC0_GSUWGMRR0_K1_LBSPPA512_LBSPPB1024_LPB0_MIWT8_4_PLR1_SU32_SUM0_SUS256_VWA8_VWB4_WGM4_WGMXCC1_WGMXCCGn1
    SolutionIndex: 50
    SolutionNameMin: Cijk_Alik_Bjlk_HHS_BH_UserArgs_MT256x128x32_MI16x16x1_SN_LDSB1_CLR1_GSU0_GSUC0_GSUWGMRR0_K1_LBSPPA512_LBSPPB1024_LPB16_MIWT8_4_PLR1_SU32_SUM0_SUS256_VWA8_VWB1_WGM8_WGMXCC1_WGMXCCGn1
    SolutionIndex: 51
    SolutionNameMin: Cijk_Alik_Bjlk_HHS_BH_UserArgs_MT256x128x32_MI16x16x1_SN_LDSB1_CLR1_GSU0_GSUC0_GSUWGMRR0_K1_LBSPPA256_LBSPPB1024_LPB32_MIWT8_4_PLR1_SU32_SUM0_SUS256_VWA4_VWB2_WGM8_WGMXCC1_WGMXCCGn1
    SolutionIndex: 52
    SolutionNameMin: Cijk_Alik_Bjlk_HHS_BH_UserArgs_MT128x128x32_MI16x16x1_SN_LDSB1_CLR1_GSU0_GSUC0_GSUWGMRR0_K1_LBSPPA128_LBSPPB1024_LPB32_MIWT4_4_PLR1_SU32_SUM0_SUS256_VWA2_VWB2_WGM1_WGMXCC1_WGMXCCGn1
    SolutionIndex: 53
    SolutionNameMin: Cijk_Alik_Bjlk_HHS_BH_UserArgs_MT128x128x32_MI16x16x1_SN_LDSB1_CLR1_GSU0_GSUC0_GSUWGMRR0_K1_LBSPPA128_LBSPPB1024_LPB0_MIWT4_4_PLR1_SU32_SUM0_SUS256_VWA2_VWB4_WGM8_WGMXCC1_WGMXCCGn1
    SolutionIndex: 54
    SolutionNameMin: Cijk_Alik_Bjlk_HHS_BH_UserArgs_MT64x128x32_MI16x16x1_SN_LDSB0_CLR1_GSU0_GSUC0_GSUWGMRR0_K1_LBSPPA128_LBSPPB1024_LPB0_MIWT2_4_PLR1_SU32_SUM0_SUS256_VWA2_VWB4_WGM1_WGMXCC1_WGMXCCGn1
    SolutionIndex: 55
    SolutionNameMin: Cijk_Alik_Bjlk_HHS_BH_UserArgs_MT128x64x32_MI16x16x1_SN_LDSB0_CLR1_GSU0_GSUC0_GSUWGMRR0_K1_LBSPPA128_LBSPPB512_LPB32_MIWT4_2_PLR1_SU32_SUM0_SUS256_VWA2_VWB2_WGM1_WGMXCC1_WGMXCCGn1
    SolutionIndex: 56
    SolutionNameMin: Cijk_Alik_Bjlk_HHS_BH_UserArgs_MT128x64x32_MI16x16x1_SN_LDSB0_CLR1_GSU0_GSUC0_GSUWGMRR0_K1_LBSPPA256_LBSPPB512_LPB32_MIWT4_2_PLR1_SU32_SUM0_SUS256_VWA4_VWB2_WGM1_WGMXCC1_WGMXCCGn1
    SolutionIndex: 57
    SolutionNameMin: Cijk_Alik_Bjlk_HHS_BH_UserArgs_MT64x64x32_MI16x16x1_SN_LDSB0_CLR1_GSU0_GSUC0_GSUWGMRR0_K1_LBSPPA128_LBSPPB512_LPB32_MIWT2_2_PLR1_SU32_SUM0_SUS256_VWA2_VWB2_WGM1_WGMXCC1_WGMXCCGn1
    SolutionIndex: 58
    SolutionNameMin: Cijk_Alik_Bjlk_HHS_BH_UserArgs_MT128x256x64_MI16x16x1_SN_LDSB1_CLR1_GSU0_GSUC0_GSUWGMRR0_K1_LBSPPA256_LBSPPB4096_LPB32_MIWT4_8_PLR1_SU32_SUM0_SUS256_VWA2_VWB2_WGM1_WGMXCC1_WGMXCCGn1
    SolutionIndex: 59
    SolutionNameMin: Cijk_Alik_Bjlk_HHS_BH_UserArgs_MT128x256x64_MI16x16x1_SN_LDSB1_CLR1_GSU0_GSUC0_GSUWGMRR0_K1_LBSPPA512_LBSPPB4096_LPB32_MIWT4_8_PLR1_SU32_SUM0_SUS256_VWA4_VWB2_WGM1_WGMXCC1_WGMXCCGn1
    SolutionIndex: 60
    SolutionNameMin: Cijk_Alik_Bjlk_HHS_BH_UserArgs_MT128x256x64_MI16x16x1_SN_LDSB1_CLR1_GSU0_GSUC0_GSUWGMRR0_K1_LBSPPA256_LBSPPB4096_LPB0_MIWT4_8_PLR1_SU32_SUM0_SUS256_VWA2_VWB4_WGM1_WGMXCC1_WGMXCCGn1
    SolutionIndex: 61
    SolutionNameMin: Cijk_Alik_Bjlk_HHS_BH_UserArgs_MT128x256x64_MI16x16x1_SN_LDSB1_CLR1_GSU0_GSUC0_GSUWGMRR0_K1_LBSPPA512_LBSPPB4096_LPB0_MIWT4_8_PLR1_SU32_SUM0_SUS256_VWA4_VWB4_WGM1_WGMXCC1_WGMXCCGn1
    SolutionIndex: 62
    SolutionNameMin: Cijk_Alik_Bjlk_HHS_BH_UserArgs_MT128x256x64_MI16x16x1_SN_LDSB1_CLR1_GSU0_GSUC0_GSUWGMRR0_K1_LBSPPA512_LBSPPB4096_LPB0_MIWT4_8_PLR1_SU32_SUM0_SUS256_VWA4_VWB8_WGM1_WGMXCC1_WGMXCCGn1
    SolutionIndex: 63
    SolutionNameMin: Cijk_Alik_Bjlk_HHS_BH_UserArgs_MT128x256x64_MI16x16x1_SN_LDSB1_CLR1_GSU0_GSUC0_GSUWGMRR0_K1_LBSPPA512_LBSPPB4096_LPB32_MIWT4_8_PLR1_SU32_SUM0_SUS256_VWA4_VWB2_WGM4_WGMXCC1_WGMXCCGn1
    SolutionIndex: 64
    SolutionNameMin: Cijk_Alik_Bjlk_HHS_BH_UserArgs_MT128x256x64_MI16x16x1_SN_LDSB1_CLR1_GSU0_GSUC0_GSUWGMRR0_K1_LBSPPA256_LBSPPB4096_LPB0_MIWT4_8_PLR1_SU32_SUM0_SUS256_VWA2_VWB4_WGM4_WGMXCC1_WGMXCCGn1
    SolutionIndex: 65
    SolutionNameMin: Cijk_Alik_Bjlk_HHS_BH_UserArgs_MT128x256x64_MI16x16x1_SN_LDSB1_CLR1_GSU0_GSUC0_GSUWGMRR0_K1_LBSPPA512_LBSPPB4096_LPB0_MIWT4_8_PLR1_SU32_SUM0_SUS256_VWA4_VWB4_WGM4_WGMXCC1_WGMXCCGn1
    SolutionIndex: 66
    SolutionNameMin: Cijk_Alik_Bjlk_HHS_BH_UserArgs_MT128x256x64_MI16x16x1_SN_LDSB1_CLR1_GSU0_GSUC0_GSUWGMRR0_K1_LBSPPA128_LBSPPB4096_LPB0_MIWT4_8_PLR1_SU32_SUM0_SUS256_VWA1_VWB4_WGM8_WGMXCC1_WGMXCCGn1
    SolutionIndex: 67
    SolutionNameMin: Cijk_Alik_Bjlk_HHS_BH_UserArgs_MT128x256x64_MI16x16x1_SN_LDSB1_CLR1_GSU0_GSUC0_GSUWGMRR0_K1_LBSPPA256_LBSPPB4096_LPB0_MIWT4_8_PLR1_SU32_SUM0_SUS256_VWA2_VWB4_WGM8_WGMXCC1_WGMXCCGn1
    SolutionIndex: 68
    SolutionNameMin: Cijk_Alik_Bjlk_HHS_BH_UserArgs_MT128x256x64_MI16x16x1_SN_LDSB1_CLR1_GSU0_GSUC0_GSUWGMRR0_K1_LBSPPA512_LBSPPB4096_LPB0_MIWT4_8_PLR1_SU32_SUM0_SUS256_VWA4_VWB4_WGM8_WGMXCC1_WGMXCCGn1
    SolutionIndex: 69
    SolutionNameMin: Cijk_Alik_Bjlk_HHS_BH_UserArgs_MT128x256x64_MI16x16x1_SN_LDSB1_CLR1_GSU0_GSUC0_GSUWGMRR0_K1_LBSPPA256_LBSPPB4096_LPB0_MIWT4_8_PLR1_SU32_SUM0_SUS256_VWA2_VWB8_WGM8_WGMXCC1_WGMXCCGn1
    SolutionIndex: 70
    SolutionNameMin: Cijk_Alik_Bjlk_HHS_BH_UserArgs_MT256x128x64_MI16x16x1_SN_LDSB1_CLR1_GSU0_GSUC0_GSUWGMRR0_K1_LBSPPA1024_LBSPPB2048_LPB32_MIWT8_4_PLR1_SU32_SUM0_SUS256_VWA8_VWB2_WGM1_WGMXCC1_WGMXCCGn1
    SolutionIndex: 71
    SolutionNameMin: Cijk_Alik_Bjlk_HHS_BH_UserArgs_MT256x128x64_MI16x16x1_SN_LDSB1_CLR1_GSU0_GSUC0_GSUWGMRR0_K1_LBSPPA512_LBSPPB2048_LPB0_MIWT8_4_PLR1_SU32_SUM0_SUS256_VWA4_VWB4_WGM1_WGMXCC1_WGMXCCGn1
    SolutionIndex: 72
    SolutionNameMin: Cijk_Alik_Bjlk_HHS_BH_UserArgs_MT256x128x64_MI16x16x1_SN_LDSB1_CLR1_GSU0_GSUC0_GSUWGMRR0_K1_LBSPPA1024_LBSPPB2048_LPB0_MIWT8_4_PLR1_SU32_SUM0_SUS256_VWA8_VWB4_WGM1_WGMXCC1_WGMXCCGn1
    SolutionIndex: 73
    SolutionNameMin: Cijk_Alik_Bjlk_HHS_BH_UserArgs_MT256x128x64_MI16x16x1_SN_LDSB1_CLR1_GSU0_GSUC0_GSUWGMRR0_K1_LBSPPA256_LBSPPB2048_LPB0_MIWT8_4_PLR1_SU32_SUM0_SUS256_VWA2_VWB4_WGM4_WGMXCC1_WGMXCCGn1
    SolutionIndex: 74
    SolutionNameMin: Cijk_Alik_Bjlk_HHS_BH_UserArgs_MT256x128x64_MI16x16x1_SN_LDSB1_CLR1_GSU0_GSUC0_GSUWGMRR0_K1_LBSPPA512_LBSPPB2048_LPB0_MIWT8_4_PLR1_SU32_SUM0_SUS256_VWA4_VWB4_WGM4_WGMXCC1_WGMXCCGn1
    SolutionIndex: 75
    SolutionNameMin: Cijk_Alik_Bjlk_HHS_BH_UserArgs_MT256x128x64_MI16x16x1_SN_LDSB1_CLR1_GSU0_GSUC0_GSUWGMRR0_K1_LBSPPA1024_LBSPPB2048_LPB0_MIWT8_4_PLR1_SU32_SUM0_SUS256_VWA8_VWB4_WGM4_WGMXCC1_WGMXCCGn1
    SolutionIndex: 76
    SolutionNameMin: Cijk_Alik_Bjlk_HHS_BH_UserArgs_MT256x128x64_MI16x16x1_SN_LDSB1_CLR1_GSU0_GSUC0_GSUWGMRR0_K1_LBSPPA256_LBSPPB2048_LPB32_MIWT8_4_PLR1_SU32_SUM0_SUS256_VWA2_VWB2_WGM8_WGMXCC1_WGMXCCGn1
    SolutionIndex: 77
    SolutionNameMin: Cijk_Alik_Bjlk_HHS_BH_UserArgs_MT256x128x64_MI16x16x1_SN_LDSB1_CLR1_GSU0_GSUC0_GSUWGMRR0_K1_LBSPPA128_LBSPPB2048_LPB0_MIWT8_4_PLR1_SU32_SUM0_SUS256_VWA1_VWB4_WGM8_WGMXCC1_WGMXCCGn1
    SolutionIndex: 78
    SolutionNameMin: Cijk_Alik_Bjlk_HHS_BH_UserArgs_MT256x128x64_MI16x16x1_SN_LDSB1_CLR1_GSU0_GSUC0_GSUWGMRR0_K1_LBSPPA256_LBSPPB2048_LPB0_MIWT8_4_PLR1_SU32_SUM0_SUS256_VWA2_VWB4_WGM8_WGMXCC1_WGMXCCGn1
    SolutionIndex: 79
    SolutionNameMin: Cijk_Alik_Bjlk_HHS_BH_UserArgs_MT256x128x64_MI16x16x1_SN_LDSB1_CLR1_GSU0_GSUC0_GSUWGMRR0_K1_LBSPPA1024_LBSPPB2048_LPB0_MIWT8_4_PLR1_SU32_SUM0_SUS256_VWA8_VWB4_WGM8_WGMXCC1_WGMXCCGn1
    SolutionIndex: 80
    SolutionNameMin: Cijk_Alik_Bjlk_HHS_BH_UserArgs_MT128x128x64_MI16x16x1_SN_LDSB1_CLR1_GSU0_GSUC0_GSUWGMRR0_K1_LBSPPA256_LBSPPB2048_LPB32_MIWT4_4_PLR1_SU32_SUM0_SUS256_VWA2_VWB2_WGM1_WGMXCC1_WGMXCCGn1
    SolutionIndex: 81
    SolutionNameMin: Cijk_Alik_Bjlk_HHS_BH_UserArgs_MT128x128x64_MI16x16x1_SN_LDSB1_CLR1_GSU0_GSUC0_GSUWGMRR0_K1_LBSPPA512_LBSPPB2048_LPB32_MIWT4_4_PLR1_SU32_SUM0_SUS256_VWA4_VWB2_WGM1_WGMXCC1_WGMXCCGn1
    SolutionIndex: 82
    SolutionNameMin: Cijk_Alik_Bjlk_HHS_BH_UserArgs_MT128x128x64_MI16x16x1_SN_LDSB1_CLR1_GSU0_GSUC0_GSUWGMRR0_K1_LBSPPA256_LBSPPB2048_LPB0_MIWT4_4_PLR1_SU32_SUM0_SUS256_VWA2_VWB4_WGM1_WGMXCC1_WGMXCCGn1
    SolutionIndex: 83
    SolutionNameMin: Cijk_Alik_Bjlk_HHS_BH_UserArgs_MT128x128x64_MI16x16x1_SN_LDSB1_CLR1_GSU0_GSUC0_GSUWGMRR0_K1_LBSPPA512_LBSPPB2048_LPB0_MIWT4_4_PLR1_SU32_SUM0_SUS256_VWA4_VWB4_WGM1_WGMXCC1_WGMXCCGn1
    SolutionIndex: 84
    SolutionNameMin: Cijk_Alik_Bjlk_HHS_BH_UserArgs_MT128x128x64_MI16x16x1_SN_LDSB1_CLR1_GSU0_GSUC0_GSUWGMRR0_K1_LBSPPA512_LBSPPB2048_LPB32_MIWT4_4_PLR1_SU32_SUM0_SUS256_VWA4_VWB2_WGM4_WGMXCC1_WGMXCCGn1
    SolutionIndex: 85
    SolutionNameMin: Cijk_Alik_Bjlk_HHS_BH_UserArgs_MT128x128x64_MI16x16x1_SN_LDSB1_CLR1_GSU0_GSUC0_GSUWGMRR0_K1_LBSPPA256_LBSPPB2048_LPB0_MIWT4_4_PLR1_SU32_SUM0_SUS256_VWA2_VWB4_WGM4_WGMXCC1_WGMXCCGn1
    SolutionIndex: 86
    SolutionNameMin: Cijk_Alik_Bjlk_HHS_BH_UserArgs_MT128x128x64_MI16x16x1_SN_LDSB1_CLR1_GSU0_GSUC0_GSUWGMRR0_K1_LBSPPA512_LBSPPB2048_LPB0_MIWT4_4_PLR1_SU32_SUM0_SUS256_VWA4_VWB4_WGM4_WGMXCC1_WGMXCCGn1
    SolutionIndex: 87
    SolutionNameMin: Cijk_Alik_Bjlk_HHS_BH_UserArgs_MT128x128x64_MI16x16x1_SN_LDSB1_CLR1_GSU0_GSUC0_GSUWGMRR0_K1_LBSPPA256_LBSPPB2048_LPB32_MIWT4_4_PLR1_SU32_SUM0_SUS256_VWA2_VWB2_WGM8_WGMXCC1_WGMXCCGn1
    SolutionIndex: 88
    SolutionNameMin: Cijk_Alik_Bjlk_HHS_BH_UserArgs_MT128x128x64_MI16x16x1_SN_LDSB1_CLR1_GSU0_GSUC0_GSUWGMRR0_K1_LBSPPA128_LBSPPB2048_LPB0_MIWT4_4_PLR1_SU32_SUM0_SUS256_VWA1_VWB4_WGM8_WGMXCC1_WGMXCCGn1
    SolutionIndex: 89
    SolutionNameMin: Cijk_Alik_Bjlk_HHS_BH_UserArgs_MT128x128x64_MI16x16x1_SN_LDSB1_CLR1_GSU0_GSUC0_GSUWGMRR0_K1_LBSPPA256_LBSPPB2048_LPB0_MIWT4_4_PLR1_SU32_SUM0_SUS256_VWA2_VWB4_WGM8_WGMXCC1_WGMXCCGn1
    SolutionIndex: 90
    SolutionNameMin: Cijk_Alik_Bjlk_HHS_BH_UserArgs_MT128x128x64_MI16x16x1_SN_LDSB1_CLR1_GSU0_GSUC0_GSUWGMRR0_K1_LBSPPA512_LBSPPB2048_LPB0_MIWT4_4_PLR1_SU32_SUM0_SUS256_VWA4_VWB4_WGM8_WGMXCC1_WGMXCCGn1
    SolutionIndex: 91
    SolutionNameMin: Cijk_Alik_Bjlk_HHS_BH_UserArgs_MT64x128x64_MI16x16x1_SN_LDSB1_CLR1_GSU0_GSUC0_GSUWGMRR0_K1_LBSPPA256_LBSPPB2048_LPB0_MIWT2_4_PLR1_SU32_SUM0_SUS256_VWA2_VWB4_WGM1_WGMXCC1_WGMXCCGn1
    SolutionIndex: 92
    SolutionNameMin: Cijk_Alik_Bjlk_HHS_BH_UserArgs_MT64x128x64_MI16x16x1_SN_LDSB1_CLR1_GSU0_GSUC0_GSUWGMRR0_K1_LBSPPA256_LBSPPB2048_LPB0_MIWT2_4_PLR1_SU32_SUM0_SUS256_VWA2_VWB4_WGM4_WGMXCC1_WGMXCCGn1
    SolutionIndex: 93
    SolutionNameMin: Cijk_Alik_Bjlk_HHS_BH_UserArgs_MT128x64x64_MI16x16x1_SN_LDSB1_CLR1_GSU0_GSUC0_GSUWGMRR0_K1_LBSPPA512_LBSPPB1024_LPB32_MIWT4_2_PLR1_SU32_SUM0_SUS256_VWA4_VWB2_WGM1_WGMXCC1_WGMXCCGn1
    SolutionIndex: 94
    SolutionNameMin: Cijk_Alik_Bjlk_HHS_BH_UserArgs_MT128x64x64_MI16x16x1_SN_LDSB1_CLR1_GSU0_GSUC0_GSUWGMRR0_K1_LBSPPA256_LBSPPB1024_LPB32_MIWT4_2_PLR1_SU32_SUM0_SUS256_VWA2_VWB2_WGM4_WGMXCC1_WGMXCCGn1
    SolutionIndex: 95
    SolutionNameMin: Cijk_Alik_Bjlk_HHS_BH_UserArgs_MT128x64x64_MI16x16x1_SN_LDSB1_CLR1_GSU0_GSUC0_GSUWGMRR0_K1_LBSPPA256_LBSPPB1024_LPB32_MIWT4_2_PLR1_SU32_SUM0_SUS256_VWA2_VWB2_WGM8_WGMXCC1_WGMXCCGn1
    SolutionIndex: 96
    SolutionNameMin: Cijk_Alik_Bjlk_HHS_BH_UserArgs_MT128x64x64_MI16x16x1_SN_LDSB1_CLR1_GSU0_GSUC0_GSUWGMRR0_K1_LBSPPA512_LBSPPB1024_LPB32_MIWT4_2_PLR1_SU32_SUM0_SUS256_VWA4_VWB2_WGM8_WGMXCC1_WGMXCCGn1
    SolutionIndex: 97
    SolutionNameMin: Cijk_Alik_Bjlk_HHS_BH_UserArgs_MT128x32x64_MI16x16x1_SN_LDSB1_CLR1_GSU0_GSUC0_GSUWGMRR0_K1_LBSPPA512_LBSPPB512_LPB16_MIWT4_1_PLR1_SU32_SUM0_SUS256_VWA4_VWB1_WGM1_WGMXCC1_WGMXCCGn1
    SolutionIndex: 98
    SolutionNameMin: Cijk_Alik_Bjlk_HHS_BH_UserArgs_MT64x64x64_MI16x16x1_SN_LDSB1_CLR1_GSU0_GSUC0_GSUWGMRR0_K1_LBSPPA256_LBSPPB1024_LPB32_MIWT2_2_PLR1_SU32_SUM0_SUS256_VWA2_VWB2_WGM1_WGMXCC1_WGMXCCGn1
    SolutionIndex: 99
    SolutionNameMin: Cijk_Alik_Bjlk_HHS_BH_UserArgs_MT64x64x64_MI16x16x1_SN_LDSB1_CLR1_GSU0_GSUC0_GSUWGMRR0_K1_LBSPPA256_LBSPPB1024_LPB32_MIWT2_2_PLR2_SU32_SUM0_SUS256_VWA2_VWB2_WGM4_WGMXCC1_WGMXCCGn1
    SolutionIndex: 100
    SolutionNameMin: Cijk_Alik_Bjlk_HHS_BH_UserArgs_MT64x64x64_MI16x16x1_SN_LDSB1_CLR1_GSU0_GSUC0_GSUWGMRR0_K1_LBSPPA256_LBSPPB1024_LPB32_MIWT2_2_PLR1_SU32_SUM0_SUS256_VWA2_VWB2_WGM8_WGMXCC1_WGMXCCGn1
    SolutionIndex: 101
    SolutionNameMin: Cijk_Alik_Bjlk_HHS_BH_UserArgs_MT32x64x64_MI16x16x1_SN_LDSB0_CLR1_GSU0_GSUC0_GSUWGMRR0_K1_LBSPPA128_LBSPPB1024_LPB32_MIWT1_2_PLR1_SU32_SUM0_SUS256_VWA1_VWB2_WGM1_WGMXCC1_WGMXCCGn1
    SolutionIndex: 102
    SolutionNameMin: Cijk_Alik_Bjlk_HHS_BH_UserArgs_MT64x32x64_MI16x16x1_SN_LDSB0_CLR1_GSU0_GSUC0_GSUWGMRR0_K1_LBSPPA128_LBSPPB512_LPB16_MIWT2_1_PLR1_SU32_SUM0_SUS256_VWA1_VWB1_WGM1_WGMXCC1_WGMXCCGn1
    SolutionIndex: 103
    SolutionNameMin: Cijk_Alik_Bjlk_HHS_BH_UserArgs_MT64x32x64_MI16x16x1_SN_LDSB0_CLR1_GSU0_GSUC0_GSUWGMRR0_K1_LBSPPA256_LBSPPB512_LPB16_MIWT2_1_PLR1_SU32_SUM0_SUS256_VWA2_VWB1_WGM1_WGMXCC1_WGMXCCGn1
    SolutionIndex: 104
    SolutionNameMin: Cijk_Alik_Bjlk_HHS_BH_UserArgs_MT64x32x64_MI16x16x1_SN_LDSB0_CLR1_GSU0_GSUC0_GSUWGMRR0_K1_LBSPPA256_LBSPPB512_LPB16_MIWT2_1_PLR1_SU32_SUM0_SUS256_VWA2_VWB1_WGM4_WGMXCC1_WGMXCCGn1
    SolutionIndex: 105
    SolutionNameMin: Cijk_Alik_Bjlk_HHS_BH_UserArgs_MT64x32x64_MI16x16x1_SN_LDSB0_CLR1_GSU0_GSUC0_GSUWGMRR0_K1_LBSPPA256_LBSPPB512_LPB16_MIWT2_1_PLR1_SU32_SUM0_SUS256_VWA2_VWB1_WGM8_WGMXCC1_WGMXCCGn1
    SolutionIndex: 106
    SolutionNameMin: Cijk_Alik_Bjlk_HHS_BH_UserArgs_MT32x32x64_MI16x16x1_SN_LDSB0_CLR1_GSU0_GSUC0_GSUWGMRR0_K1_LBSPPA128_LBSPPB512_LPB16_MIWT1_1_PLR1_SU32_SUM0_SUS256_VWA1_VWB1_WGM1_WGMXCC1_WGMXCCGn1
    SolutionIndex: 107
    SolutionNameMin: Cijk_Alik_Bjlk_HHS_BH_UserArgs_MT32x32x64_MI16x16x1_SN_LDSB0_CLR1_GSU0_GSUC0_GSUWGMRR0_K1_LBSPPA128_LBSPPB512_LPB16_MIWT1_1_PLR2_SU32_SUM0_SUS256_VWA1_VWB1_WGM1_WGMXCC1_WGMXCCGn1
    SolutionIndex: 108
    SolutionNameMin: Cijk_Alik_Bjlk_HHS_BH_UserArgs_MT32x32x64_MI16x16x1_SN_LDSB0_CLR1_GSU0_GSUC0_GSUWGMRR0_K1_LBSPPA128_LBSPPB512_LPB16_MIWT1_1_PLR1_SU32_SUM0_SUS256_VWA1_VWB1_WGM4_WGMXCC1_WGMXCCGn1
    SolutionIndex: 109
    SolutionNameMin: Cijk_Alik_Bjlk_HHS_BH_UserArgs_MT64x128x128_MI16x16x1_SN_LDSB1_CLR1_GSU0_GSUC0_GSUWGMRR0_K1_LBSPPA512_LBSPPB2048_LPB0_MIWT2_4_PLR1_SU32_SUM0_SUS256_VWA2_VWB4_WGM1_WGMXCC1_WGMXCCGn1
    SolutionIndex: 110
    SolutionNameMin: Cijk_Alik_Bjlk_HHS_BH_UserArgs_MT64x128x128_MI16x16x1_SN_LDSB1_CLR1_GSU0_GSUC0_GSUWGMRR0_K1_LBSPPA512_LBSPPB2048_LPB0_MIWT2_4_PLR2_SU32_SUM0_SUS256_VWA2_VWB4_WGM1_WGMXCC1_WGMXCCGn1
    SolutionIndex: 111
    SolutionNameMin: Cijk_Alik_Bjlk_HHS_BH_UserArgs_MT64x128x128_MI16x16x1_SN_LDSB1_CLR1_GSU0_GSUC0_GSUWGMRR0_K1_LBSPPA256_LBSPPB2048_LPB0_MIWT2_4_PLR2_SU32_SUM0_SUS256_VWA1_VWB4_WGM4_WGMXCC1_WGMXCCGn1
    SolutionIndex: 112
    SolutionNameMin: Cijk_Alik_Bjlk_HHS_BH_UserArgs_MT64x128x128_MI16x16x1_SN_LDSB1_CLR1_GSU0_GSUC0_GSUWGMRR0_K1_LBSPPA512_LBSPPB2048_LPB0_MIWT2_4_PLR2_SU32_SUM0_SUS256_VWA2_VWB4_WGM4_WGMXCC1_WGMXCCGn1
    SolutionIndex: 113
    SolutionNameMin: Cijk_Alik_Bjlk_HHS_BH_UserArgs_MT128x64x128_MI16x16x1_SN_LDSB1_CLR1_GSU0_GSUC0_GSUWGMRR0_K1_LBSPPA512_LBSPPB1024_LPB32_MIWT4_2_PLR1_SU32_SUM0_SUS256_VWA2_VWB2_WGM1_WGMXCC1_WGMXCCGn1
    SolutionIndex: 114
    SolutionNameMin: Cijk_Alik_Bjlk_HHS_BH_UserArgs_MT128x64x128_MI16x16x1_SN_LDSB1_CLR1_GSU0_GSUC0_GSUWGMRR0_K1_LBSPPA512_LBSPPB1024_LPB32_MIWT4_2_PLR2_SU32_SUM0_SUS256_VWA2_VWB2_WGM1_WGMXCC1_WGMXCCGn1
    SolutionIndex: 115
    SolutionNameMin: Cijk_Alik_Bjlk_HHS_BH_UserArgs_MT128x64x128_MI16x16x1_SN_LDSB1_CLR1_GSU0_GSUC0_GSUWGMRR0_K1_LBSPPA1024_LBSPPB1024_LPB32_MIWT4_2_PLR2_SU32_SUM0_SUS256_VWA4_VWB2_WGM1_WGMXCC1_WGMXCCGn1
    SolutionIndex: 116
    SolutionNameMin: Cijk_Alik_Bjlk_HHS_BH_UserArgs_MT128x64x128_MI16x16x1_SN_LDSB1_CLR1_GSU0_GSUC0_GSUWGMRR0_K1_LBSPPA1024_LBSPPB1024_LPB32_MIWT4_2_PLR2_SU32_SUM0_SUS256_VWA4_VWB2_WGM4_WGMXCC1_WGMXCCGn1
    SolutionIndex: 117
    SolutionNameMin: Cijk_Alik_Bjlk_HHS_BH_UserArgs_MT128x64x128_MI16x16x1_SN_LDSB1_CLR1_GSU0_GSUC0_GSUWGMRR0_K1_LBSPPA256_LBSPPB1024_LPB32_MIWT4_2_PLR2_SU32_SUM0_SUS256_VWA1_VWB2_WGM8_WGMXCC1_WGMXCCGn1
    SolutionIndex: 118
    SolutionNameMin: Cijk_Alik_Bjlk_HHS_BH_UserArgs_MT128x64x128_MI16x16x1_SN_LDSB1_CLR1_GSU0_GSUC0_GSUWGMRR0_K1_LBSPPA512_LBSPPB1024_LPB32_MIWT4_2_PLR2_SU32_SUM0_SUS256_VWA2_VWB2_WGM8_WGMXCC1_WGMXCCGn1
    SolutionIndex: 119
    SolutionNameMin: Cijk_Alik_Bjlk_HHS_BH_UserArgs_MT128x64x128_MI16x16x1_SN_LDSB1_CLR1_GSU0_GSUC0_GSUWGMRR0_K1_LBSPPA1024_LBSPPB1024_LPB32_MIWT4_2_PLR2_SU32_SUM0_SUS256_VWA4_VWB2_WGM8_WGMXCC1_WGMXCCGn1
    SolutionIndex: 120
    SolutionNameMin: Cijk_Alik_Bjlk_HHS_BH_UserArgs_MT64x64x128_MI16x16x1_SN_LDSB1_CLR1_GSU0_GSUC0_GSUWGMRR0_K1_LBSPPA512_LBSPPB1024_LPB32_MIWT2_2_PLR1_SU32_SUM0_SUS256_VWA2_VWB2_WGM1_WGMXCC1_WGMXCCGn1
    SolutionIndex: 121
    SolutionNameMin: Cijk_Alik_Bjlk_HHS_BH_UserArgs_MT64x64x128_MI16x16x1_SN_LDSB1_CLR1_GSU0_GSUC0_GSUWGMRR0_K1_LBSPPA256_LBSPPB1024_LPB32_MIWT2_2_PLR2_SU32_SUM0_SUS256_VWA1_VWB2_WGM1_WGMXCC1_WGMXCCGn1
    SolutionIndex: 122
    SolutionNameMin: Cijk_Alik_Bjlk_HHS_BH_UserArgs_MT64x64x128_MI16x16x1_SN_LDSB1_CLR1_GSU0_GSUC0_GSUWGMRR0_K1_LBSPPA512_LBSPPB1024_LPB32_MIWT2_2_PLR2_SU32_SUM0_SUS256_VWA2_VWB2_WGM1_WGMXCC1_WGMXCCGn1
    SolutionIndex: 123
    SolutionNameMin: Cijk_Alik_Bjlk_HHS_BH_UserArgs_MT64x64x128_MI16x16x1_SN_LDSB1_CLR1_GSU0_GSUC0_GSUWGMRR0_K1_LBSPPA256_LBSPPB1024_LPB32_MIWT2_2_PLR2_SU32_SUM0_SUS256_VWA1_VWB2_WGM4_WGMXCC1_WGMXCCGn1
    SolutionIndex: 124
    SolutionNameMin: Cijk_Alik_Bjlk_HHS_BH_UserArgs_MT64x64x128_MI16x16x1_SN_LDSB1_CLR1_GSU0_GSUC0_GSUWGMRR0_K1_LBSPPA512_LBSPPB1024_LPB32_MIWT2_2_PLR2_SU32_SUM0_SUS256_VWA2_VWB2_WGM4_WGMXCC1_WGMXCCGn1
    SolutionIndex: 125
    SolutionNameMin: Cijk_Alik_Bjlk_HHS_BH_UserArgs_MT64x64x128_MI16x16x1_SN_LDSB1_CLR1_GSU0_GSUC0_GSUWGMRR0_K1_LBSPPA512_LBSPPB1024_LPB32_MIWT2_2_PLR1_SU32_SUM0_SUS256_VWA2_VWB2_WGM8_WGMXCC1_WGMXCCGn1
    SolutionIndex: 126
    SolutionNameMin: Cijk_Alik_Bjlk_HHS_BH_UserArgs_MT64x64x128_MI16x16x1_SN_LDSB1_CLR1_GSU0_GSUC0_GSUWGMRR0_K1_LBSPPA256_LBSPPB1024_LPB32_MIWT2_2_PLR2_SU32_SUM0_SUS256_VWA1_VWB2_WGM8_WGMXCC1_WGMXCCGn1
    SolutionIndex: 127
    SolutionNameMin: Cijk_Alik_Bjlk_HHS_BH_UserArgs_MT64x64x128_MI16x16x1_SN_LDSB1_CLR1_GSU0_GSUC0_GSUWGMRR0_K1_LBSPPA512_LBSPPB1024_LPB32_MIWT2_2_PLR2_SU32_SUM0_SUS256_VWA2_VWB2_WGM8_WGMXCC1_WGMXCCGn1
    SolutionIndex: 128
    SolutionNameMin: Cijk_Alik_Bjlk_HHS_BH_UserArgs_MT32x64x128_MI16x16x1_SN_LDSB1_CLR1_GSU0_GSUC0_GSUWGMRR0_K1_LBSPPA256_LBSPPB1024_LPB32_MIWT1_2_PLR2_SU32_SUM0_SUS256_VWA1_VWB2_WGM1_WGMXCC1_WGMXCCGn1
    SolutionIndex: 129
    SolutionNameMin: Cijk_Alik_Bjlk_HHS_BH_UserArgs_MT32x64x128_MI16x16x1_SN_LDSB1_CLR1_GSU0_GSUC0_GSUWGMRR0_K1_LBSPPA256_LBSPPB1024_LPB32_MIWT1_2_PLR2_SU32_SUM0_SUS256_VWA1_VWB2_WGM4_WGMXCC1_WGMXCCGn1
    SolutionIndex: 130
    SolutionNameMin: Cijk_Alik_Bjlk_HHS_BH_UserArgs_MT32x64x128_MI16x16x1_SN_LDSB1_CLR1_GSU0_GSUC0_GSUWGMRR0_K1_LBSPPA256_LBSPPB1024_LPB32_MIWT1_2_PLR2_SU32_SUM0_SUS256_VWA1_VWB2_WGM8_WGMXCC1_WGMXCCGn1
    SolutionIndex: 131
    SolutionNameMin: Cijk_Alik_Bjlk_HHS_BH_UserArgs_MT64x32x128_MI16x16x1_SN_LDSB1_CLR1_GSU0_GSUC0_GSUWGMRR0_K1_LBSPPA512_LBSPPB512_LPB16_MIWT2_1_PLR2_SU32_SUM0_SUS256_VWA2_VWB1_WGM1_WGMXCC1_WGMXCCGn1
    SolutionIndex: 132
    SolutionNameMin: Cijk_Alik_Bjlk_HHS_BH_UserArgs_MT64x32x128_MI16x16x1_SN_LDSB1_CLR1_GSU0_GSUC0_GSUWGMRR0_K1_LBSPPA512_LBSPPB512_LPB16_MIWT2_1_PLR2_SU32_SUM0_SUS256_VWA2_VWB1_WGM4_WGMXCC1_WGMXCCGn1
    SolutionIndex: 133
    SolutionNameMin: Cijk_Alik_Bjlk_HHS_BH_UserArgs_MT64x32x128_MI16x16x1_SN_LDSB1_CLR1_GSU0_GSUC0_GSUWGMRR0_K1_LBSPPA512_LBSPPB512_LPB16_MIWT2_1_PLR2_SU32_SUM0_SUS256_VWA2_VWB1_WGM8_WGMXCC1_WGMXCCGn1
    SolutionIndex: 134
    SolutionNameMin: Cijk_Alik_Bjlk_HHS_BH_UserArgs_MT32x32x128_MI16x16x1_SN_LDSB1_CLR1_GSU0_GSUC0_GSUWGMRR0_K1_LBSPPA256_LBSPPB512_LPB16_MIWT1_1_PLR1_SU32_SUM0_SUS256_VWA1_VWB1_WGM1_WGMXCC1_WGMXCCGn1
    SolutionIndex: 135
    SolutionNameMin: Cijk_Alik_Bjlk_HHS_BH_UserArgs_MT32x32x128_MI16x16x1_SN_LDSB1_CLR1_GSU0_GSUC0_GSUWGMRR0_K1_LBSPPA256_LBSPPB512_LPB16_MIWT1_1_PLR2_SU32_SUM0_SUS256_VWA1_VWB1_WGM1_WGMXCC1_WGMXCCGn1
    SolutionIndex: 136
    SolutionNameMin: Cijk_Alik_Bjlk_HHS_BH_UserArgs_MT32x32x128_MI16x16x1_SN_LDSB1_CLR1_GSU0_GSUC0_GSUWGMRR0_K1_LBSPPA256_LBSPPB512_LPB16_MIWT1_1_PLR1_SU32_SUM0_SUS256_VWA1_VWB1_WGM4_WGMXCC1_WGMXCCGn1
    SolutionIndex: 137
    SolutionNameMin: Cijk_Alik_Bjlk_HHS_BH_UserArgs_MT32x32x128_MI16x16x1_SN_LDSB1_CLR1_GSU0_GSUC0_GSUWGMRR0_K1_LBSPPA256_LBSPPB512_LPB16_MIWT1_1_PLR2_SU32_SUM0_SUS256_VWA1_VWB1_WGM4_WGMXCC1_WGMXCCGn1
    SolutionIndex: 138
    SolutionNameMin: Cijk_Alik_Bjlk_HHS_BH_UserArgs_MT32x32x128_MI16x16x1_SN_LDSB1_CLR1_GSU0_GSUC0_GSUWGMRR0_K1_LBSPPA256_LBSPPB512_LPB16_MIWT1_1_PLR2_SU32_SUM0_SUS256_VWA1_VWB1_WGM8_WGMXCC1_WGMXCCGn1
    SolutionIndex: 139
    SolutionNameMin: Cijk_Alik_Bjlk_HHS_BH_UserArgs_MT32x64x128_MI16x16x1_SN_LDSB1_CLR1_GSU0_GSUC0_GSUWGMRR0_K1_LBSPPA256_LBSPPB512_LPB32_MIWT1_2_PLR1_SU32_SUM0_SUS256_VWA1_VWB2_WGM8_WGMXCC1_WGMXCCGn1
- - - [128, 128, 1, 128, 128, 128, 128, 128]
    - [106, 0.078]
  - - [128, 128, 1, 256, 128, 128, 256, 128]
    - [134, 0.146]
  - - [128, 128, 1, 512, 128, 128, 512, 128]
    - [106, 0.252]
  - - [128, 128, 1, 1024, 128, 128, 1024, 128]
    - [135, 0.376]
  - - [128, 128, 1, 2048, 128, 128, 2048, 128]
    - [138, 0.54]
  - - [128, 128, 1, 4096, 128, 128, 4096, 128]
    - [101, 0.852]
  - - [128, 128, 1, 8192, 128, 128, 8192, 128]
    - [128, 1.327]
  - - [128, 256, 1, 128, 128, 128, 128, 256]
    - [136, 0.154]
  - - [128, 256, 1, 256, 128, 128, 256, 256]
    - [106, 0.282]
  - - [128, 256, 1, 512, 128, 128, 512, 256]
    - [107, 0.497]
  - - [128, 256, 1, 1024, 128, 128, 1024, 256]
    - [134, 0.76]
  - - [128, 256, 1, 2048, 128, 128, 2048, 256]
    - [135, 1.023]
  - - [128, 256, 1, 4096, 128, 128, 4096, 256]
    - [130, 1.419]
  - - [128, 256, 1, 8192, 128, 128, 8192, 256]
    - [121, 2.022]
  - - [128, 512, 1, 128, 128, 128, 128, 512]
    - [100, 0.296]
  - - [128, 512, 1, 256, 128, 128, 256, 512]
    - [104, 0.542]
  - - [128, 512, 1, 512, 128, 128, 512, 512]
    - [129, 0.887]
  - - [128, 512, 1, 1024, 128, 128, 1024, 512]
    - [128, 1.323]
  - - [128, 512, 1, 2048, 128, 128, 2048, 512]
    - [130, 1.728]
  - - [128, 512, 1, 4096, 128, 128, 4096, 512]
    - [92, 2.26]
  - - [128, 512, 1, 8192, 128, 128, 8192, 512]
    - [111, 3.218]
  - - [128, 1024, 1, 128, 128, 128, 128, 1024]
    - [98, 0.588]
  - - [128, 1024, 1, 256, 128, 128, 256, 1024]
    - [120, 0.981]
  - - [128, 1024, 1, 512, 128, 128, 512, 1024]
    - [124, 1.516]
  - - [128, 1024, 1, 1024, 128, 128, 1024, 1024]
    - [122, 2.201]
  - - [128, 1024, 1, 2048, 128, 128, 2048, 1024]
    - [124, 2.76]
  - - [128, 1024, 1, 4096, 128, 128, 4096, 1024]
    - [117, 3.453]
  - - [128, 1024, 1, 8192, 128, 128, 8192, 1024]
    - [113, 4.112]
  - - [128, 2048, 1, 128, 128, 128, 128, 2048]
    - [56, 1.004]
  - - [128, 2048, 1, 256, 128, 128, 256, 2048]
    - [91, 1.699]
  - - [128, 2048, 1, 512, 128, 128, 512, 2048]
    - [112, 2.548]
  - - [128, 2048, 1, 1024, 128, 128, 1024, 2048]
    - [109, 3.363]
  - - [128, 2048, 1, 2048, 128, 128, 2048, 2048]
    - [112, 4.258]
  - - [128, 2048, 1, 4096, 128, 128, 4096, 2048]
    - [118, 5.009]
  - - [128, 2048, 1, 8192, 128, 128, 8192, 2048]
    - [37, 5.373]
  - - [128, 4096, 1, 128, 128, 128, 128, 4096]
    - [53, 1.6]
  - - [128, 4096, 1, 256, 128, 128, 256, 4096]
    - [80, 2.532]
  - - [128, 4096, 1, 512, 128, 128, 512, 4096]
    - [83, 3.529]
  - - [128, 4096, 1, 1024, 128, 128, 1024, 4096]
    - [86, 4.759]
  - - [128, 4096, 1, 2048, 128, 128, 2048, 4096]
    - [81, 5.494]
  - - [128, 4096, 1, 4096, 128, 128, 4096, 4096]
    - [40, 5.901]
  - - [128, 4096, 1, 8192, 128, 128, 8192, 4096]
    - [60, 7.054]
  - - [128, 8192, 1, 128, 128, 128, 128, 8192]
    - [41, 2.147]
  - - [128, 8192, 1, 256, 128, 128, 256, 8192]
    - [68, 2.826]
  - - [128, 8192, 1, 512, 128, 128, 512, 8192]
    - [41, 4.617]
  - - [128, 8192, 1, 1024, 128, 128, 1024, 8192]
    - [58, 5.585]
  - - [128, 8192, 1, 2048, 128, 128, 2048, 8192]
    - [66, 6.345]
  - - [128, 8192, 1, 4096, 128, 128, 4096, 8192]
    - [69, 6.974]
  - - [128, 8192, 1, 8192, 128, 128, 8192, 8192]
    - [38, 5.711]
  - - [256, 128, 1, 128, 256, 256, 128, 128]
    - [137, 0.158]
  - - [256, 128, 1, 256, 256, 256, 256, 128]
    - [108, 0.303]
  - - [256, 128, 1, 512, 256, 256, 512, 128]
    - [106, 0.538]
  - - [256, 128, 1, 1024, 256, 256, 1024, 128]
    - [137, 0.761]
  - - [256, 128, 1, 2048, 256, 256, 2048, 128]
    - [135, 1.025]
  - - [256, 128, 1, 4096, 256, 256, 4096, 128]
    - [129, 1.439]
  - - [256, 128, 1, 8192, 256, 256, 8192, 128]
    - [124, 2.238]
  - - [256, 256, 1, 128, 256, 256, 128, 256]
    - [102, 0.301]
  - - [256, 256, 1, 256, 256, 256, 256, 256]
    - [103, 0.557]
  - - [256, 256, 1, 512, 256, 256, 512, 256]
    - [131, 0.962]
  - - [256, 256, 1, 1024, 256, 256, 1024, 256]
    - [133, 1.327]
  - - [256, 256, 1, 2048, 256, 256, 2048, 256]
    - [128, 1.737]
  - - [256, 256, 1, 4096, 256, 256, 4096, 256]
    - [124, 2.347]
  - - [256, 256, 1, 8192, 256, 256, 8192, 256]
    - [119, 3.392]
  - - [256, 512, 1, 128, 256, 256, 128, 512]
    - [125, 0.572]
  - - [256, 512, 1, 256, 256, 256, 256, 512]
    - [99, 1.006]
  - - [256, 512, 1, 512, 256, 256, 512, 512]
    - [98, 1.609]
  - - [256, 512, 1, 1024, 256, 256, 1024, 512]
    - [122, 2.314]
  - - [256, 512, 1, 2048, 256, 256, 2048, 512]
    - [121, 2.95]
  - - [256, 512, 1, 4096, 256, 256, 4096, 512]
    - [83, 3.66]
  - - [256, 512, 1, 8192, 256, 256, 8192, 512]
    - [83, 4.354]
  - - [256, 1024, 1, 128, 256, 256, 128, 1024]
    - [92, 1.06]
  - - [256, 1024, 1, 256, 256, 256, 256, 1024]
    - [96, 1.663]
  - - [256, 1024, 1, 512, 256, 256, 512, 1024]
    - [110, 2.558]
  - - [256, 1024, 1, 1024, 256, 256, 1024, 1024]
    - [114, 3.498]
  - - [256, 1024, 1, 2048, 256, 256, 2048, 1024]
    - [115, 4.344]
  - - [256, 1024, 1, 4096, 256, 256, 4096, 1024]
    - [118, 4.599]
  - - [256, 1024, 1, 8192, 256, 256, 8192, 1024]
    - [88, 5.787]
  - - [256, 2048, 1, 128, 256, 256, 128, 2048]
    - [83, 1.55]
  - - [256, 2048, 1, 256, 256, 256, 256, 2048]
    - [85, 2.617]
  - - [256, 2048, 1, 512, 256, 256, 512, 2048]
    - [89, 3.617]
  - - [256, 2048, 1, 1024, 256, 256, 1024, 2048]
    - [89, 4.97]
  - - [256, 2048, 1, 2048, 256, 256, 2048, 2048]
    - [90, 5.884]
  - - [256, 2048, 1, 4096, 256, 256, 4096, 2048]
    - [88, 5.956]
  - - [256, 2048, 1, 8192, 256, 256, 8192, 2048]
    - [74, 7.275]
  - - [256, 4096, 1, 128, 256, 256, 128, 4096]
    - [31, 2.13]
  - - [256, 4096, 1, 256, 256, 256, 256, 4096]
    - [32, 3.397]
  - - [256, 4096, 1, 512, 256, 256, 512, 4096]
    - [33, 4.64]
  - - [256, 4096, 1, 1024, 256, 256, 1024, 4096]
    - [44, 5.843]
  - - [256, 4096, 1, 2048, 256, 256, 2048, 4096]
    - [78, 6.697]
  - - [256, 4096, 1, 4096, 256, 256, 4096, 4096]
    - [76, 6.955]
  - - [256, 4096, 1, 8192, 256, 256, 8192, 4096]
    - [65, 8.202]
  - - [256, 8192, 1, 128, 256, 256, 128, 8192]
    - [22, 2.6]
  - - [256, 8192, 1, 256, 256, 256, 256, 8192]
    - [3, 3.937]
  - - [256, 8192, 1, 512, 256, 256, 512, 8192]
    - [26, 5.493]
  - - [256, 8192, 1, 1024, 256, 256, 1024, 8192]
    - [4, 6.717]
  - - [256, 8192, 1, 2048, 256, 256, 2048, 8192]
    - [71, 7.246]
  - - [256, 8192, 1, 4096, 256, 256, 4096, 8192]
    - [21, 8.2]
  - - [256, 8192, 1, 8192, 256, 256, 8192, 8192]
    - [26, 9.081]
  - - [512, 128, 1, 128, 512, 512, 128, 128]
    - [105, 0.331]
  - - [512, 128, 1, 256, 512, 512, 256, 128]
    - [131, 0.559]
  - - [512, 128, 1, 512, 512, 512, 512, 128]
    - [132, 0.936]
  - - [512, 128, 1, 1024, 512, 512, 1024, 128]
    - [131, 1.384]
  - - [512, 128, 1, 2048, 512, 512, 2048, 128]
    - [128, 1.791]
  - - [512, 128, 1, 4096, 512, 512, 4096, 128]
    - [124, 2.394]
  - - [512, 128, 1, 8192, 512, 512, 8192, 128]
    - [115, 3.443]
  - - [512, 256, 1, 128, 512, 512, 128, 256]
    - [57, 0.618]
  - - [512, 256, 1, 256, 512, 512, 256, 256]
    - [122, 1.06]
  - - [512, 256, 1, 512, 512, 512, 512, 256]
    - [122, 1.697]
  - - [512, 256, 1, 1024, 512, 512, 1024, 256]
    - [122, 2.404]
  - - [512, 256, 1, 2048, 512, 512, 2048, 256]
    - [126, 2.944]
  - - [512, 256, 1, 4096, 512, 512, 4096, 256]
    - [110, 3.553]
  - - [512, 256, 1, 8192, 512, 512, 8192, 256]
    - [90, 4.61]
  - - [512, 512, 1, 128, 512, 512, 128, 512]
    - [55, 1.067]
  - - [512, 512, 1, 256, 512, 512, 256, 512]
    - [95, 1.734]
  - - [512, 512, 1, 512, 512, 512, 512, 512]
    - [115, 2.629]
  - - [512, 512, 1, 1024, 512, 512, 1024, 512]
    - [115, 3.672]
  - - [512, 512, 1, 2048, 512, 512, 2048, 512]
    - [116, 4.171]
  - - [512, 512, 1, 4096, 512, 512, 4096, 512]
    - [90, 4.89]
  - - [512, 512, 1, 8192, 512, 512, 8192, 512]
    - [84, 5.656]
  - - [512, 1024, 1, 128, 512, 512, 128, 1024]
    - [82, 1.629]
  - - [512, 1024, 1, 256, 512, 512, 256, 1024]
    - [87, 2.563]
  - - [512, 1024, 1, 512, 512, 512, 512, 1024]
    - [82, 3.997]
  - - [512, 1024, 1, 1024, 512, 512, 1024, 1024]
    - [89, 4.866]
  - - [512, 1024, 1, 2048, 512, 512, 2048, 1024]
    - [90, 5.625]
  - - [512, 1024, 1, 4096, 512, 512, 4096, 1024]
    - [88, 5.869]
  - - [512, 1024, 1, 8192, 512, 512, 8192, 1024]
    - [77, 6.893]
  - - [512, 2048, 1, 128, 512, 512, 128, 2048]
    - [50, 2.046]
  - - [512, 2048, 1, 256, 512, 512, 256, 2048]
    - [34, 3.2]
  - - [512, 2048, 1, 512, 512, 512, 512, 2048]
    - [40, 4.627]
  - - [512, 2048, 1, 1024, 512, 512, 1024, 2048]
    - [46, 5.825]
  - - [512, 2048, 1, 2048, 512, 512, 2048, 2048]
    - [60, 6.748]
  - - [512, 2048, 1, 4096, 512, 512, 4096, 2048]
    - [67, 7.117]
  - - [512, 2048, 1, 8192, 512, 512, 8192, 2048]
    - [75, 7.96]
  - - [512, 4096, 1, 128, 512, 512, 128, 4096]
    - [14, 2.587]
  - - [512, 4096, 1, 256, 512, 512, 256, 4096]
    - [3, 4.016]
  - - [512, 4096, 1, 512, 512, 512, 512, 4096]
    - [24, 5.485]
  - - [512, 4096, 1, 1024, 512, 512, 1024, 4096]
    - [4, 6.739]
  - - [512, 4096, 1, 2048, 512, 512, 2048, 4096]
    - [65, 7.085]
  - - [512, 4096, 1, 4096, 512, 512, 4096, 4096]
    - [13, 8.333]
  - - [512, 4096, 1, 8192, 512, 512, 8192, 4096]
    - [25, 9.213]
  - - [512, 8192, 1, 128, 512, 512, 128, 8192]
    - [35, 2.308]
  - - [512, 8192, 1, 256, 512, 512, 256, 8192]
    - [61, 3.678]
  - - [512, 8192, 1, 512, 512, 512, 512, 8192]
    - [7, 5.14]
  - - [512, 8192, 1, 1024, 512, 512, 1024, 8192]
    - [13, 6.944]
  - - [512, 8192, 1, 2048, 512, 512, 2048, 8192]
    - [17, 7.97]
  - - [512, 8192, 1, 4096, 512, 512, 4096, 8192]
    - [30, 8.788]
  - - [512, 8192, 1, 8192, 512, 512, 8192, 8192]
    - [24, 9.537]
  - - [1024, 128, 1, 128, 1024, 1024, 128, 128]
    - [97, 0.611]
  - - [1024, 128, 1, 256, 1024, 1024, 256, 128]
    - [57, 1.033]
  - - [1024, 128, 1, 512, 1024, 1024, 512, 128]
    - [98, 1.65]
  - - [1024, 128, 1, 1024, 1024, 1024, 1024, 128]
    - [123, 2.274]
  - - [1024, 128, 1, 2048, 1024, 1024, 2048, 128]
    - [127, 2.845]
  - - [1024, 128, 1, 4096, 1024, 1024, 4096, 128]
    - [83, 3.582]
  - - [1024, 128, 1, 8192, 1024, 1024, 8192, 128]
    - [114, 4.421]
  - - [1024, 256, 1, 128, 1024, 1024, 128, 256]
    - [94, 1.062]
  - - [1024, 256, 1, 256, 1024, 1024, 256, 256]
    - [95, 1.725]
  - - [1024, 256, 1, 512, 1024, 1024, 512, 256]
    - [114, 2.67]
  - - [1024, 256, 1, 1024, 1024, 1024, 1024, 256]
    - [115, 3.651]
  - - [1024, 256, 1, 2048, 1024, 1024, 2048, 256]
    - [115, 4.001]
  - - [1024, 256, 1, 4096, 1024, 1024, 4096, 256]
    - [83, 4.888]
  - - [1024, 256, 1, 8192, 1024, 1024, 8192, 256]
    - [86, 6.197]
  - - [1024, 512, 1, 128, 1024, 1024, 128, 512]
    - [89, 1.57]
  - - [1024, 512, 1, 256, 1024, 1024, 256, 512]
    - [87, 2.707]
  - - [1024, 512, 1, 512, 1024, 1024, 512, 512]
    - [82, 4.02]
  - - [1024, 512, 1, 1024, 1024, 1024, 1024, 512]
    - [86, 4.777]
  - - [1024, 512, 1, 2048, 1024, 1024, 2048, 512]
    - [89, 5.6]
  - - [1024, 512, 1, 4096, 1024, 1024, 4096, 512]
    - [86, 6.112]
  - - [1024, 512, 1, 8192, 1024, 1024, 8192, 512]
    - [74, 7.168]
  - - [1024, 1024, 1, 128, 1024, 1024, 128, 1024]
    - [49, 2.174]
  - - [1024, 1024, 1, 256, 1024, 1024, 256, 1024]
    - [36, 3.278]
  - - [1024, 1024, 1, 512, 1024, 1024, 512, 1024]
    - [44, 4.659]
  - - [1024, 1024, 1, 1024, 1024, 1024, 1024, 1024]
    - [43, 5.826]
  - - [1024, 1024, 1, 2048, 1024, 1024, 2048, 1024]
    - [64, 6.749]
  - - [1024, 1024, 1, 4096, 1024, 1024, 4096, 1024]
    - [60, 7.257]
  - - [1024, 1024, 1, 8192, 1024, 1024, 8192, 1024]
    - [71, 8.16]
  - - [1024, 2048, 1, 128, 1024, 1024, 128, 2048]
    - [8, 2.637]
  - - [1024, 2048, 1, 256, 1024, 1024, 256, 2048]
    - [30, 3.921]
  - - [1024, 2048, 1, 512, 1024, 1024, 512, 2048]
    - [17, 5.515]
  - - [1024, 2048, 1, 1024, 1024, 1024, 1024, 2048]
    - [8, 6.747]
  - - [1024, 2048, 1, 2048, 1024, 1024, 2048, 2048]
    - [29, 6.93]
  - - [1024, 2048, 1, 4096, 1024, 1024, 4096, 2048]
    - [13, 8.234]
  - - [1024, 2048, 1, 8192, 1024, 1024, 8192, 2048]
    - [25, 9.185]
  - - [1024, 4096, 1, 128, 1024, 1024, 128, 4096]
    - [44, 2.381]
  - - [1024, 4096, 1, 256, 1024, 1024, 256, 4096]
    - [68, 3.671]
  - - [1024, 4096, 1, 512, 1024, 1024, 512, 4096]
    - [25, 5.218]
  - - [1024, 4096, 1, 1024, 1024, 1024, 1024, 4096]
    - [13, 6.782]
  - - [1024, 4096, 1, 2048, 1024, 1024, 2048, 4096]
    - [4, 7.904]
  - - [1024, 4096, 1, 4096, 1024, 1024, 4096, 4096]
    - [16, 8.836]
  - - [1024, 4096, 1, 8192, 1024, 1024, 8192, 4096]
    - [68, 8.723]
  - - [1024, 8192, 1, 128, 1024, 1024, 128, 8192]
    - [61, 2.763]
  - - [1024, 8192, 1, 256, 1024, 1024, 256, 8192]
    - [31, 4.108]
  - - [1024, 8192, 1, 512, 1024, 1024, 512, 8192]
    - [33, 5.817]
  - - [1024, 8192, 1, 1024, 1024, 1024, 1024, 8192]
    - [25, 7.371]
  - - [1024, 8192, 1, 2048, 1024, 1024, 2048, 8192]
    - [26, 8.561]
  - - [1024, 8192, 1, 4096, 1024, 1024, 4096, 8192]
    - [5, 9.138]
  - - [1024, 8192, 1, 8192, 1024, 1024, 8192, 8192]
    - [6, 9.525]
  - - [2048, 128, 1, 128, 2048, 2048, 128, 128]
    - [54, 1.053]
  - - [2048, 128, 1, 256, 2048, 2048, 256, 128]
    - [93, 1.747]
  - - [2048, 128, 1, 512, 2048, 2048, 512, 128]
    - [114, 2.672]
  - - [2048, 128, 1, 1024, 2048, 2048, 1024, 128]
    - [114, 3.298]
  - - [2048, 128, 1, 2048, 2048, 2048, 2048, 128]
    - [112, 3.987]
  - - [2048, 128, 1, 4096, 2048, 2048, 4096, 128]
    - [86, 4.894]
  - - [2048, 128, 1, 8192, 2048, 2048, 8192, 128]
    - [83, 6.334]
  - - [2048, 256, 1, 128, 2048, 2048, 128, 256]
    - [82, 1.723]
  - - [2048, 256, 1, 256, 2048, 2048, 256, 256]
    - [80, 2.797]
  - - [2048, 256, 1, 512, 2048, 2048, 512, 256]
    - [82, 3.833]
  - - [2048, 256, 1, 1024, 2048, 2048, 1024, 256]
    - [86, 4.685]
  - - [2048, 256, 1, 2048, 2048, 2048, 2048, 256]
    - [82, 5.675]
  - - [2048, 256, 1, 4096, 2048, 2048, 4096, 256]
    - [83, 6.325]
  - - [2048, 256, 1, 8192, 2048, 2048, 8192, 256]
    - [74, 7.344]
  - - [2048, 512, 1, 128, 2048, 2048, 128, 512]
    - [33, 2.21]
  - - [2048, 512, 1, 256, 2048, 2048, 256, 512]
    - [33, 3.33]
  - - [2048, 512, 1, 512, 2048, 2048, 512, 512]
    - [32, 4.665]
  - - [2048, 512, 1, 1024, 2048, 2048, 1024, 512]
    - [67, 5.79]
  - - [2048, 512, 1, 2048, 2048, 2048, 2048, 512]
    - [61, 6.757]
  - - [2048, 512, 1, 4096, 2048, 2048, 4096, 512]
    - [68, 7.533]
  - - [2048, 512, 1, 8192, 2048, 2048, 8192, 512]
    - [1, 8.231]
  - - [2048, 1024, 1, 128, 2048, 2048, 128, 1024]
    - [7, 2.622]
  - - [2048, 1024, 1, 256, 2048, 2048, 256, 1024]
    - [8, 4.04]
  - - [2048, 1024, 1, 512, 2048, 2048, 512, 1024]
    - [5, 5.475]
  - - [2048, 1024, 1, 1024, 2048, 2048, 1024, 1024]
    - [14, 6.64]
  - - [2048, 1024, 1, 2048, 2048, 2048, 2048, 1024]
    - [61, 7.243]
  - - [2048, 1024, 1, 4096, 2048, 2048, 4096, 1024]
    - [61, 8.058]
  - - [2048, 1024, 1, 8192, 2048, 2048, 8192, 1024]
    - [25, 9.01]
  - - [2048, 2048, 1, 128, 2048, 2048, 128, 2048]
    - [44, 2.405]
  - - [2048, 2048, 1, 256, 2048, 2048, 256, 2048]
    - [62, 3.548]
  - - [2048, 2048, 1, 512, 2048, 2048, 512, 2048]
    - [13, 5.161]
  - - [2048, 2048, 1, 1024, 2048, 2048, 1024, 2048]
    - [13, 6.666]
  - - [2048, 2048, 1, 2048, 2048, 2048, 2048, 2048]
    - [13, 7.871]
  - - [2048, 2048, 1, 4096, 2048, 2048, 4096, 2048]
    - [25, 8.811]
  - - [2048, 2048, 1, 8192, 2048, 2048, 8192, 2048]
    - [3, 9.537]
  - - [2048, 4096, 1, 128, 2048, 2048, 128, 4096]
    - [63, 2.771]
  - - [2048, 4096, 1, 256, 2048, 2048, 256, 4096]
    - [40, 4.13]
  - - [2048, 4096, 1, 512, 2048, 2048, 512, 4096]
    - [7, 5.775]
  - - [2048, 4096, 1, 1024, 2048, 2048, 1024, 4096]
    - [6, 7.213]
  - - [2048, 4096, 1, 2048, 2048, 2048, 2048, 4096]
    - [4, 8.363]
  - - [2048, 4096, 1, 4096, 2048, 2048, 4096, 4096]
    - [5, 9.267]
  - - [2048, 4096, 1, 8192, 2048, 2048, 8192, 4096]
    - [14, 9.628]
  - - [2048, 8192, 1, 128, 2048, 2048, 128, 8192]
    - [40, 3.091]
  - - [2048, 8192, 1, 256, 2048, 2048, 256, 8192]
    - [16, 4.695]
  - - [2048, 8192, 1, 512, 2048, 2048, 512, 8192]
    - [3, 6.538]
  - - [2048, 8192, 1, 1024, 2048, 2048, 1024, 8192]
    - [14, 7.928]
  - - [2048, 8192, 1, 2048, 2048, 2048, 2048, 8192]
    - [26, 8.724]
  - - [2048, 8192, 1, 4096, 2048, 2048, 4096, 8192]
    - [23, 9.165]
  - - [2048, 8192, 1, 8192, 2048, 2048, 8192, 8192]
    - [26, 9.493]
  - - [4096, 128, 1, 128, 4096, 4096, 128, 128]
    - [52, 1.647]
  - - [4096, 128, 1, 256, 4096, 4096, 256, 128]
    - [82, 2.552]
  - - [4096, 128, 1, 512, 4096, 4096, 512, 128]
    - [89, 3.541]
  - - [4096, 128, 1, 1024, 4096, 4096, 1024, 128]
    - [86, 4.604]
  - - [4096, 128, 1, 2048, 4096, 4096, 2048, 128]
    - [83, 5.668]
  - - [4096, 128, 1, 4096, 4096, 4096, 4096, 128]
    - [83, 6.364]
  - - [4096, 128, 1, 8192, 4096, 4096, 8192, 128]
    - [83, 7.356]
  - - [4096, 256, 1, 128, 4096, 4096, 128, 256]
    - [48, 2.151]
  - - [4096, 256, 1, 256, 4096, 4096, 256, 256]
    - [39, 3.235]
  - - [4096, 256, 1, 512, 4096, 4096, 512, 256]
    - [40, 4.561]
  - - [4096, 256, 1, 1024, 4096, 4096, 1024, 256]
    - [60, 5.736]
  - - [4096, 256, 1, 2048, 4096, 4096, 2048, 256]
    - [60, 6.723]
  - - [4096, 256, 1, 4096, 4096, 4096, 4096, 256]
    - [61, 7.461]
  - - [4096, 256, 1, 8192, 4096, 4096, 8192, 256]
    - [65, 8.491]
  - - [4096, 512, 1, 128, 4096, 4096, 128, 512]
    - [14, 2.573]
  - - [4096, 512, 1, 256, 4096, 4096, 256, 512]
    - [2, 3.967]
  - - [4096, 512, 1, 512, 4096, 4096, 512, 512]
    - [5, 5.482]
  - - [4096, 512, 1, 1024, 4096, 4096, 1024, 512]
    - [14, 6.437]
  - - [4096, 512, 1, 2048, 4096, 4096, 2048, 512]
    - [61, 7.217]
  - - [4096, 512, 1, 4096, 4096, 4096, 4096, 512]
    - [4, 8.301]
  - - [4096, 512, 1, 8192, 4096, 4096, 8192, 512]
    - [13, 9.128]
  - - [4096, 1024, 1, 128, 4096, 4096, 128, 1024]
    - [44, 2.405]
  - - [4096, 1024, 1, 256, 4096, 4096, 256, 1024]
    - [59, 3.619]
  - - [4096, 1024, 1, 512, 4096, 4096, 512, 1024]
    - [4, 5.165]
  - - [4096, 1024, 1, 1024, 4096, 4096, 1024, 1024]
    - [7, 6.753]
  - - [4096, 1024, 1, 2048, 4096, 4096, 2048, 1024]
    - [3, 7.821]
  - - [4096, 1024, 1, 4096, 4096, 4096, 4096, 1024]
    - [24, 8.765]
  - - [4096, 1024, 1, 8192, 4096, 4096, 8192, 1024]
    - [17, 9.547]
  - - [4096, 2048, 1, 128, 4096, 4096, 128, 2048]
    - [61, 2.803]
  - - [4096, 2048, 1, 256, 4096, 4096, 256, 2048]
    - [34, 4.06]
  - - [4096, 2048, 1, 512, 4096, 4096, 512, 2048]
    - [21, 5.746]
  - - [4096, 2048, 1, 1024, 4096, 4096, 1024, 2048]
    - [29, 7.232]
  - - [4096, 2048, 1, 2048, 4096, 4096, 2048, 2048]
    - [16, 8.153]
  - - [4096, 2048, 1, 4096, 4096, 4096, 4096, 2048]
    - [12, 8.907]
  - - [4096, 2048, 1, 8192, 4096, 4096, 8192, 2048]
    - [29, 9.481]
  - - [4096, 4096, 1, 128, 4096, 4096, 128, 4096]
    - [45, 3.163]
  - - [4096, 4096, 1, 256, 4096, 4096, 256, 4096]
    - [24, 4.683]
  - - [4096, 4096, 1, 512, 4096, 4096, 512, 4096]
    - [24, 6.463]
  - - [4096, 4096, 1, 1024, 4096, 4096, 1024, 4096]
    - [24, 7.775]
  - - [4096, 4096, 1, 2048, 4096, 4096, 2048, 4096]
    - [21, 8.572]
  - - [4096, 4096, 1, 4096, 4096, 4096, 4096, 4096]
    - [27, 9.134]
  - - [4096, 4096, 1, 8192, 4096, 4096, 8192, 4096]
    - [4, 9.469]
  - - [4096, 8192, 1, 128, 4096, 4096, 128, 8192]
    - [26, 3.625]
  - - [4096, 8192, 1, 256, 4096, 4096, 256, 8192]
    - [14, 5.075]
  - - [4096, 8192, 1, 512, 4096, 4096, 512, 8192]
    - [24, 6.831]
  - - [4096, 8192, 1, 1024, 4096, 4096, 1024, 8192]
    - [13, 7.905]
  - - [4096, 8192, 1, 2048, 4096, 4096, 2048, 8192]
    - [25, 8.725]
  - - [4096, 8192, 1, 4096, 4096, 4096, 4096, 8192]
    - [28, 9.249]
  - - [4096, 8192, 1, 8192, 4096, 4096, 8192, 8192]
    - [26, 9.067]
  - - [8192, 128, 1, 128, 8192, 8192, 128, 128]
    - [42, 2.078]
  - - [8192, 128, 1, 256, 8192, 8192, 256, 128]
    - [47, 3.018]
  - - [8192, 128, 1, 512, 8192, 8192, 512, 128]
    - [73, 4.145]
  - - [8192, 128, 1, 1024, 8192, 8192, 1024, 128]
    - [79, 5.281]
  - - [8192, 128, 1, 2048, 8192, 8192, 2048, 128]
    - [72, 6.246]
  - - [8192, 128, 1, 4096, 8192, 8192, 4096, 128]
    - [71, 7.222]
  - - [8192, 128, 1, 8192, 8192, 8192, 8192, 128]
    - [74, 8.309]
  - - [8192, 256, 1, 128, 8192, 8192, 128, 256]
    - [2, 2.601]
  - - [8192, 256, 1, 256, 8192, 8192, 256, 256]
    - [2, 3.865]
  - - [8192, 256, 1, 512, 8192, 8192, 512, 256]
    - [5, 5.284]
  - - [8192, 256, 1, 1024, 8192, 8192, 1024, 256]
    - [26, 6.054]
  - - [8192, 256, 1, 2048, 8192, 8192, 2048, 256]
    - [65, 7.081]
  - - [8192, 256, 1, 4096, 8192, 8192, 4096, 256]
    - [68, 8.292]
  - - [8192, 256, 1, 8192, 8192, 8192, 8192, 256]
    - [23, 8.972]
  - - [8192, 512, 1, 128, 8192, 8192, 128, 512]
    - [47, 2.351]
  - - [8192, 512, 1, 256, 8192, 8192, 256, 512]
    - [61, 3.625]
  - - [8192, 512, 1, 512, 8192, 8192, 512, 512]
    - [4, 5.19]
  - - [8192, 512, 1, 1024, 8192, 8192, 1024, 512]
    - [4, 6.798]
  - - [8192, 512, 1, 2048, 8192, 8192, 2048, 512]
    - [8, 7.852]
  - - [8192, 512, 1, 4096, 8192, 8192, 4096, 512]
    - [8, 8.821]
  - - [8192, 512, 1, 8192, 8192, 8192, 8192, 512]
    - [26, 9.641]
  - - [8192, 1024, 1, 128, 8192, 8192, 128, 1024]
    - [70, 2.845]
  - - [8192, 1024, 1, 256, 8192, 8192, 256, 1024]
    - [51, 4.076]
  - - [8192, 1024, 1, 512, 8192, 8192, 512, 1024]
    - [40, 5.671]
  - - [8192, 1024, 1, 1024, 8192, 8192, 1024, 1024]
    - [14, 7.052]
  - - [8192, 1024, 1, 2048, 8192, 8192, 2048, 1024]
    - [17, 8.144]
  - - [8192, 1024, 1, 4096, 8192, 8192, 4096, 1024]
    - [26, 9.08]
  - - [8192, 1024, 1, 8192, 8192, 8192, 8192, 1024]
    - [12, 9.52]
  - - [8192, 2048, 1, 128, 8192, 8192, 128, 2048]
    - [31, 3.105]
  - - [8192, 2048, 1, 256, 8192, 8192, 256, 2048]
    - [4, 4.595]
  - - [8192, 2048, 1, 512, 8192, 8192, 512, 2048]
    - [20, 6.339]
  - - [8192, 2048, 1, 1024, 8192, 8192, 1024, 2048]
    - [13, 7.707]
  - - [8192, 2048, 1, 2048, 8192, 8192, 2048, 2048]
    - [26, 8.589]
  - - [8192, 2048, 1, 4096, 8192, 8192, 4096, 2048]
    - [22, 9.053]
  - - [8192, 2048, 1, 8192, 8192, 8192, 8192, 2048]
    - [17, 9.549]
  - - [8192, 4096, 1, 128, 8192, 8192, 128, 4096]
    - [0, 3.615]
  - - [8192, 4096, 1, 256, 8192, 8192, 256, 4096]
    - [10, 4.997]
  - - [8192, 4096, 1, 512, 8192, 8192, 512, 4096]
    - [11, 6.695]
  - - [8192, 4096, 1, 1024, 8192, 8192, 1024, 4096]
    - [25, 7.907]
  - - [8192, 4096, 1, 2048, 8192, 8192, 2048, 4096]
    - [12, 8.493]
  - - [8192, 4096, 1, 4096, 8192, 8192, 4096, 4096]
    - [27, 9.078]
  - - [8192, 4096, 1, 8192, 8192, 8192, 8192, 4096]
    - [19, 9.061]
  - - [8192, 8192, 1, 128, 8192, 8192, 128, 8192]
    - [18, 3.811]
  - - [8192, 8192, 1, 256, 8192, 8192, 256, 8192]
    - [9, 5.257]
  - - [8192, 8192, 1, 512, 8192, 8192, 512, 8192]
    - [11, 6.741]
  - - [8192, 8192, 1, 1024, 8192, 8192, 1024, 8192]
    - [22, 7.998]
  - - [8192, 8192, 1, 2048, 8192, 8192, 2048, 8192]
    - [26, 8.807]
  - - [8192, 8192, 1, 4096, 8192, 8192, 4096, 8192]
    - [8, 8.908]
  - - [8192, 8192, 1, 8192, 8192, 8192, 8192, 8192]
    - [15, 8.966]
  - - [1, 1, 1, 32, 1, 1, 32, 1]
    - [139, 0.0]
- null
- null
- ExperimentalStreamK
- GridBased
