library/src/amd_detail/rocblaslt/src/Tensile/Logic/asm_full/aquavanjaram/gfx942_38cu/StreamK/aquavanjaram942_Cijk_Alik_Bljk_BBS_BH_UserArgs.yaml
- {MinimumRequiredVersion: 4.33.0}
- aquavanjaram942
- {Architecture: gfx942, CUCount: 38}
- [Device 0049, Device 0050]
    SolutionIndex: 0
    SolutionNameMin: Cijk_Alik_Bljk_BBS_BH_UserArgs_MT128x128x32_MI16x16x1_SN_LDSB1_CLR1_GSU0_GSUC0_GSUWGMRR0_K1_LBSPPA128_LBSPPB256_MIWT4_4_PLR1_SU32_SUM0_SUS256_VWA2_VWB4_WGM1_WGMXCC1_WGMXCCGn1
    SolutionIndex: 1
    SolutionNameMin: Cijk_Alik_Bljk_BBS_BH_UserArgs_MT32x64x32_MI16x16x1_SN_LDSB0_CLR1_GSU0_GSUC0_GSUWGMRR0_K1_LBSPPA128_LBSPPB128_MIWT1_2_PLR1_SU32_SUM0_SUS256_VWA1_VWB1_WGM1_WGMXCC1_WGMXCCGn1
    SolutionIndex: 2
    SolutionNameMin: Cijk_Alik_Bljk_BBS_BH_UserArgs_MT32x32x32_MI16x16x1_SN_LDSB0_CLR0_GSU0_GSUC0_GSUWGMRR0_K1_LBSPPA128_LBSPPB128_MIWT1_1_PLR0_SU32_SUM0_SUS256_VWA1_VWB1_WGM4_WGMXCC1_WGMXCCGn1
    SolutionIndex: 3
    SolutionNameMin: Cijk_Alik_Bljk_BBS_BH_UserArgs_MT256x64x64_MI16x16x1_SN_LDSB1_CLR1_GSU0_GSUC0_GSUWGMRR0_K1_LBSPPA512_LBSPPB128_MIWT8_2_PLR1_SU32_SUM0_SUS256_VWA4_VWB1_WGM1_WGMXCC1_WGMXCCGn1
    SolutionIndex: 4
    SolutionNameMin: Cijk_Alik_Bljk_BBS_BH_UserArgs_MT256x64x64_MI16x16x1_SN_LDSB1_CLR1_GSU0_GSUC0_GSUWGMRR0_K1_LBSPPA1024_LBSPPB128_MIWT8_2_PLR1_SU32_SUM0_SUS256_VWA8_VWB1_WGM1_WGMXCC1_WGMXCCGn1
    SolutionIndex: 5
    SolutionNameMin: Cijk_Alik_Bljk_BBS_BH_UserArgs_MT256x64x64_MI16x16x1_SN_LDSB1_CLR1_GSU0_GSUC0_GSUWGMRR0_K1_LBSPPA256_LBSPPB256_MIWT8_2_PLR1_SU32_SUM0_SUS256_VWA2_VWB2_WGM1_WGMXCC1_WGMXCCGn1
    SolutionIndex: 6
    SolutionNameMin: Cijk_Alik_Bljk_BBS_BH_UserArgs_MT256x64x64_MI16x16x1_SN_LDSB1_CLR1_GSU0_GSUC0_GSUWGMRR0_K1_LBSPPA1024_LBSPPB256_MIWT8_2_PLR1_SU32_SUM0_SUS256_VWA8_VWB2_WGM1_WGMXCC1_WGMXCCGn1
    SolutionIndex: 7
    SolutionNameMin: Cijk_Alik_Bljk_BBS_BH_UserArgs_MT256x64x64_MI16x16x1_SN_LDSB1_CLR1_GSU0_GSUC0_GSUWGMRR0_K1_LBSPPA512_LBSPPB128_MIWT8_2_PLR1_SU32_SUM0_SUS256_VWA4_VWB1_WGM4_WGMXCC1_WGMXCCGn1
    SolutionIndex: 8
    SolutionNameMin: Cijk_Alik_Bljk_BBS_BH_UserArgs_MT256x64x64_MI16x16x1_SN_LDSB1_CLR1_GSU0_GSUC0_GSUWGMRR0_K1_LBSPPA1024_LBSPPB128_MIWT8_2_PLR1_SU32_SUM0_SUS256_VWA8_VWB1_WGM4_WGMXCC1_WGMXCCGn1
    SolutionIndex: 9
    SolutionNameMin: Cijk_Alik_Bljk_BBS_BH_UserArgs_MT256x64x64_MI16x16x1_SN_LDSB1_CLR1_GSU0_GSUC0_GSUWGMRR0_K1_LBSPPA256_LBSPPB256_MIWT8_2_PLR1_SU32_SUM0_SUS256_VWA2_VWB2_WGM4_WGMXCC1_WGMXCCGn1
    SolutionIndex: 10
    SolutionNameMin: Cijk_Alik_Bljk_BBS_BH_UserArgs_MT256x64x64_MI16x16x1_SN_LDSB1_CLR1_GSU0_GSUC0_GSUWGMRR0_K1_LBSPPA1024_LBSPPB256_MIWT8_2_PLR1_SU32_SUM0_SUS256_VWA8_VWB2_WGM4_WGMXCC1_WGMXCCGn1
    SolutionIndex: 11
    SolutionNameMin: Cijk_Alik_Bljk_BBS_BH_UserArgs_MT256x64x64_MI16x16x1_SN_LDSB1_CLR1_GSU0_GSUC0_GSUWGMRR0_K1_LBSPPA1024_LBSPPB128_MIWT8_2_PLR1_SU32_SUM0_SUS256_VWA8_VWB1_WGM8_WGMXCC1_WGMXCCGn1
    SolutionIndex: 12
    SolutionNameMin: Cijk_Alik_Bljk_BBS_BH_UserArgs_MT256x64x64_MI16x16x1_SN_LDSB1_CLR1_GSU0_GSUC0_GSUWGMRR0_K1_LBSPPA1024_LBSPPB256_MIWT8_2_PLR1_SU32_SUM0_SUS256_VWA8_VWB2_WGM8_WGMXCC1_WGMXCCGn1
    SolutionIndex: 13
    SolutionNameMin: Cijk_Alik_Bljk_BBS_BH_UserArgs_MT128x128x64_MI16x16x1_SN_LDSB1_CLR1_GSU0_GSUC0_GSUWGMRR0_K1_LBSPPA128_LBSPPB128_MIWT4_4_PLR1_SU32_SUM0_SUS256_VWA1_VWB1_WGM1_WGMXCC1_WGMXCCGn1
    SolutionIndex: 14
    SolutionNameMin: Cijk_Alik_Bljk_BBS_BH_UserArgs_MT128x128x64_MI16x16x1_SN_LDSB1_CLR1_GSU0_GSUC0_GSUWGMRR0_K1_LBSPPA256_LBSPPB128_MIWT4_4_PLR1_SU32_SUM0_SUS256_VWA2_VWB1_WGM1_WGMXCC1_WGMXCCGn1
    SolutionIndex: 15
    SolutionNameMin: Cijk_Alik_Bljk_BBS_BH_UserArgs_MT128x128x64_MI16x16x1_SN_LDSB1_CLR1_GSU0_GSUC0_GSUWGMRR0_K1_LBSPPA512_LBSPPB128_MIWT4_4_PLR1_SU32_SUM0_SUS256_VWA4_VWB1_WGM1_WGMXCC1_WGMXCCGn1
    SolutionIndex: 16
    SolutionNameMin: Cijk_Alik_Bljk_BBS_BH_UserArgs_MT128x128x64_MI16x16x1_SN_LDSB1_CLR1_GSU0_GSUC0_GSUWGMRR0_K1_LBSPPA128_LBSPPB256_MIWT4_4_PLR1_SU32_SUM0_SUS256_VWA1_VWB2_WGM1_WGMXCC1_WGMXCCGn1
    SolutionIndex: 17
    SolutionNameMin: Cijk_Alik_Bljk_BBS_BH_UserArgs_MT128x128x64_MI16x16x1_SN_LDSB1_CLR1_GSU0_GSUC0_GSUWGMRR0_K1_LBSPPA256_LBSPPB256_MIWT4_4_PLR1_SU32_SUM0_SUS256_VWA2_VWB2_WGM1_WGMXCC1_WGMXCCGn1
    SolutionIndex: 18
    SolutionNameMin: Cijk_Alik_Bljk_BBS_BH_UserArgs_MT128x128x64_MI16x16x1_SN_LDSB1_CLR1_GSU0_GSUC0_GSUWGMRR0_K1_LBSPPA512_LBSPPB256_MIWT4_4_PLR1_SU32_SUM0_SUS256_VWA4_VWB2_WGM1_WGMXCC1_WGMXCCGn1
    SolutionIndex: 19
    SolutionNameMin: Cijk_Alik_Bljk_BBS_BH_UserArgs_MT128x128x64_MI16x16x1_SN_LDSB1_CLR1_GSU0_GSUC0_GSUWGMRR0_K1_LBSPPA128_LBSPPB512_MIWT4_4_PLR1_SU32_SUM0_SUS256_VWA1_VWB4_WGM1_WGMXCC1_WGMXCCGn1
    SolutionIndex: 20
    SolutionNameMin: Cijk_Alik_Bljk_BBS_BH_UserArgs_MT128x128x64_MI16x16x1_SN_LDSB1_CLR1_GSU0_GSUC0_GSUWGMRR0_K1_LBSPPA256_LBSPPB512_MIWT4_4_PLR1_SU32_SUM0_SUS256_VWA2_VWB4_WGM1_WGMXCC1_WGMXCCGn1
    SolutionIndex: 21
    SolutionNameMin: Cijk_Alik_Bljk_BBS_BH_UserArgs_MT128x128x64_MI16x16x1_SN_LDSB1_CLR1_GSU0_GSUC0_GSUWGMRR0_K1_LBSPPA512_LBSPPB512_MIWT4_4_PLR1_SU32_SUM0_SUS256_VWA4_VWB4_WGM1_WGMXCC1_WGMXCCGn1
    SolutionIndex: 22
    SolutionNameMin: Cijk_Alik_Bljk_BBS_BH_UserArgs_MT128x128x64_MI16x16x1_SN_LDSB1_CLR1_GSU0_GSUC0_GSUWGMRR0_K1_LBSPPA512_LBSPPB128_MIWT4_4_PLR2_SU32_SUM0_SUS256_VWA4_VWB1_WGM1_WGMXCC1_WGMXCCGn1
    SolutionIndex: 23
    SolutionNameMin: Cijk_Alik_Bljk_BBS_BH_UserArgs_MT128x128x64_MI16x16x1_SN_LDSB1_CLR1_GSU0_GSUC0_GSUWGMRR0_K1_LBSPPA256_LBSPPB512_MIWT4_4_PLR2_SU32_SUM0_SUS256_VWA2_VWB4_WGM1_WGMXCC1_WGMXCCGn1
    SolutionIndex: 24
    SolutionNameMin: Cijk_Alik_Bljk_BBS_BH_UserArgs_MT128x128x64_MI16x16x1_SN_LDSB1_CLR1_GSU0_GSUC0_GSUWGMRR0_K1_LBSPPA128_LBSPPB128_MIWT4_4_PLR1_SU32_SUM0_SUS256_VWA1_VWB1_WGM4_WGMXCC1_WGMXCCGn1
    SolutionIndex: 25
    SolutionNameMin: Cijk_Alik_Bljk_BBS_BH_UserArgs_MT128x128x64_MI16x16x1_SN_LDSB1_CLR1_GSU0_GSUC0_GSUWGMRR0_K1_LBSPPA256_LBSPPB128_MIWT4_4_PLR1_SU32_SUM0_SUS256_VWA2_VWB1_WGM4_WGMXCC1_WGMXCCGn1
    SolutionIndex: 26
    SolutionNameMin: Cijk_Alik_Bljk_BBS_BH_UserArgs_MT128x128x64_MI16x16x1_SN_LDSB1_CLR1_GSU0_GSUC0_GSUWGMRR0_K1_LBSPPA512_LBSPPB128_MIWT4_4_PLR1_SU32_SUM0_SUS256_VWA4_VWB1_WGM4_WGMXCC1_WGMXCCGn1
    SolutionIndex: 27
    SolutionNameMin: Cijk_Alik_Bljk_BBS_BH_UserArgs_MT128x128x64_MI16x16x1_SN_LDSB1_CLR1_GSU0_GSUC0_GSUWGMRR0_K1_LBSPPA128_LBSPPB256_MIWT4_4_PLR1_SU32_SUM0_SUS256_VWA1_VWB2_WGM4_WGMXCC1_WGMXCCGn1
    SolutionIndex: 28
    SolutionNameMin: Cijk_Alik_Bljk_BBS_BH_UserArgs_MT128x128x64_MI16x16x1_SN_LDSB1_CLR1_GSU0_GSUC0_GSUWGMRR0_K1_LBSPPA512_LBSPPB256_MIWT4_4_PLR1_SU32_SUM0_SUS256_VWA4_VWB2_WGM4_WGMXCC1_WGMXCCGn1
    SolutionIndex: 29
    SolutionNameMin: Cijk_Alik_Bljk_BBS_BH_UserArgs_MT128x128x64_MI16x16x1_SN_LDSB1_CLR1_GSU0_GSUC0_GSUWGMRR0_K1_LBSPPA128_LBSPPB512_MIWT4_4_PLR1_SU32_SUM0_SUS256_VWA1_VWB4_WGM4_WGMXCC1_WGMXCCGn1
    SolutionIndex: 30
    SolutionNameMin: Cijk_Alik_Bljk_BBS_BH_UserArgs_MT128x128x64_MI16x16x1_SN_LDSB1_CLR1_GSU0_GSUC0_GSUWGMRR0_K1_LBSPPA256_LBSPPB512_MIWT4_4_PLR1_SU32_SUM0_SUS256_VWA2_VWB4_WGM4_WGMXCC1_WGMXCCGn1
    SolutionIndex: 31
    SolutionNameMin: Cijk_Alik_Bljk_BBS_BH_UserArgs_MT128x128x64_MI16x16x1_SN_LDSB1_CLR1_GSU0_GSUC0_GSUWGMRR0_K1_LBSPPA512_LBSPPB512_MIWT4_4_PLR1_SU32_SUM0_SUS256_VWA4_VWB4_WGM4_WGMXCC1_WGMXCCGn1
    SolutionIndex: 32
    SolutionNameMin: Cijk_Alik_Bljk_BBS_BH_UserArgs_MT128x128x64_MI16x16x1_SN_LDSB1_CLR1_GSU0_GSUC0_GSUWGMRR0_K1_LBSPPA256_LBSPPB256_MIWT4_4_PLR2_SU32_SUM0_SUS256_VWA2_VWB2_WGM4_WGMXCC1_WGMXCCGn1
    SolutionIndex: 33
    SolutionNameMin: Cijk_Alik_Bljk_BBS_BH_UserArgs_MT128x128x64_MI16x16x1_SN_LDSB1_CLR1_GSU0_GSUC0_GSUWGMRR0_K1_LBSPPA128_LBSPPB128_MIWT4_4_PLR1_SU32_SUM0_SUS256_VWA1_VWB1_WGM8_WGMXCC1_WGMXCCGn1
    SolutionIndex: 34
    SolutionNameMin: Cijk_Alik_Bljk_BBS_BH_UserArgs_MT128x128x64_MI16x16x1_SN_LDSB1_CLR1_GSU0_GSUC0_GSUWGMRR0_K1_LBSPPA256_LBSPPB128_MIWT4_4_PLR1_SU32_SUM0_SUS256_VWA2_VWB1_WGM8_WGMXCC1_WGMXCCGn1
    SolutionIndex: 35
    SolutionNameMin: Cijk_Alik_Bljk_BBS_BH_UserArgs_MT128x128x64_MI16x16x1_SN_LDSB1_CLR1_GSU0_GSUC0_GSUWGMRR0_K1_LBSPPA512_LBSPPB128_MIWT4_4_PLR1_SU32_SUM0_SUS256_VWA4_VWB1_WGM8_WGMXCC1_WGMXCCGn1
    SolutionIndex: 36
    SolutionNameMin: Cijk_Alik_Bljk_BBS_BH_UserArgs_MT128x128x64_MI16x16x1_SN_LDSB1_CLR1_GSU0_GSUC0_GSUWGMRR0_K1_LBSPPA128_LBSPPB256_MIWT4_4_PLR1_SU32_SUM0_SUS256_VWA1_VWB2_WGM8_WGMXCC1_WGMXCCGn1
    SolutionIndex: 37
    SolutionNameMin: Cijk_Alik_Bljk_BBS_BH_UserArgs_MT128x128x64_MI16x16x1_SN_LDSB1_CLR1_GSU0_GSUC0_GSUWGMRR0_K1_LBSPPA256_LBSPPB256_MIWT4_4_PLR1_SU32_SUM0_SUS256_VWA2_VWB2_WGM8_WGMXCC1_WGMXCCGn1
    SolutionIndex: 38
    SolutionNameMin: Cijk_Alik_Bljk_BBS_BH_UserArgs_MT128x128x64_MI16x16x1_SN_LDSB1_CLR1_GSU0_GSUC0_GSUWGMRR0_K1_LBSPPA512_LBSPPB256_MIWT4_4_PLR1_SU32_SUM0_SUS256_VWA4_VWB2_WGM8_WGMXCC1_WGMXCCGn1
    SolutionIndex: 39
    SolutionNameMin: Cijk_Alik_Bljk_BBS_BH_UserArgs_MT128x128x64_MI16x16x1_SN_LDSB1_CLR1_GSU0_GSUC0_GSUWGMRR0_K1_LBSPPA128_LBSPPB512_MIWT4_4_PLR1_SU32_SUM0_SUS256_VWA1_VWB4_WGM8_WGMXCC1_WGMXCCGn1
    SolutionIndex: 40
    SolutionNameMin: Cijk_Alik_Bljk_BBS_BH_UserArgs_MT128x128x64_MI16x16x1_SN_LDSB1_CLR1_GSU0_GSUC0_GSUWGMRR0_K1_LBSPPA256_LBSPPB512_MIWT4_4_PLR1_SU32_SUM0_SUS256_VWA2_VWB4_WGM8_WGMXCC1_WGMXCCGn1
    SolutionIndex: 41
    SolutionNameMin: Cijk_Alik_Bljk_BBS_BH_UserArgs_MT128x128x64_MI16x16x1_SN_LDSB1_CLR1_GSU0_GSUC0_GSUWGMRR0_K1_LBSPPA512_LBSPPB512_MIWT4_4_PLR1_SU32_SUM0_SUS256_VWA4_VWB4_WGM8_WGMXCC1_WGMXCCGn1
    SolutionIndex: 42
    SolutionNameMin: Cijk_Alik_Bljk_BBS_BH_UserArgs_MT64x128x64_MI16x16x1_SN_LDSB1_CLR1_GSU0_GSUC0_GSUWGMRR0_K1_LBSPPA256_LBSPPB128_MIWT2_4_PLR1_SU32_SUM0_SUS256_VWA2_VWB1_WGM1_WGMXCC1_WGMXCCGn1
    SolutionIndex: 43
    SolutionNameMin: Cijk_Alik_Bljk_BBS_BH_UserArgs_MT64x128x64_MI16x16x1_SN_LDSB1_CLR1_GSU0_GSUC0_GSUWGMRR0_K1_LBSPPA256_LBSPPB512_MIWT2_4_PLR1_SU32_SUM0_SUS256_VWA2_VWB4_WGM1_WGMXCC1_WGMXCCGn1
    SolutionIndex: 44
    SolutionNameMin: Cijk_Alik_Bljk_BBS_BH_UserArgs_MT64x128x64_MI16x16x1_SN_LDSB1_CLR1_GSU0_GSUC0_GSUWGMRR0_K1_LBSPPA256_LBSPPB128_MIWT2_4_PLR1_SU32_SUM0_SUS256_VWA2_VWB1_WGM4_WGMXCC1_WGMXCCGn1
    SolutionIndex: 45
    SolutionNameMin: Cijk_Alik_Bljk_BBS_BH_UserArgs_MT64x128x64_MI16x16x1_SN_LDSB1_CLR1_GSU0_GSUC0_GSUWGMRR0_K1_LBSPPA256_LBSPPB512_MIWT2_4_PLR1_SU32_SUM0_SUS256_VWA2_VWB4_WGM4_WGMXCC1_WGMXCCGn1
    SolutionIndex: 46
    SolutionNameMin: Cijk_Alik_Bljk_BBS_BH_UserArgs_MT64x128x64_MI16x16x1_SN_LDSB1_CLR1_GSU0_GSUC0_GSUWGMRR0_K1_LBSPPA256_LBSPPB128_MIWT2_4_PLR1_SU32_SUM0_SUS256_VWA2_VWB1_WGM8_WGMXCC1_WGMXCCGn1
    SolutionIndex: 47
    SolutionNameMin: Cijk_Alik_Bljk_BBS_BH_UserArgs_MT64x128x64_MI16x16x1_SN_LDSB1_CLR1_GSU0_GSUC0_GSUWGMRR0_K1_LBSPPA256_LBSPPB256_MIWT2_4_PLR1_SU32_SUM0_SUS256_VWA2_VWB2_WGM8_WGMXCC1_WGMXCCGn1
    SolutionIndex: 48
    SolutionNameMin: Cijk_Alik_Bljk_BBS_BH_UserArgs_MT128x64x64_MI16x16x1_SN_LDSB1_CLR1_GSU0_GSUC0_GSUWGMRR0_K1_LBSPPA256_LBSPPB128_MIWT4_2_PLR1_SU32_SUM0_SUS256_VWA2_VWB1_WGM1_WGMXCC1_WGMXCCGn1
    SolutionIndex: 49
    SolutionNameMin: Cijk_Alik_Bljk_BBS_BH_UserArgs_MT128x64x64_MI16x16x1_SN_LDSB1_CLR1_GSU0_GSUC0_GSUWGMRR0_K1_LBSPPA512_LBSPPB128_MIWT4_2_PLR1_SU32_SUM0_SUS256_VWA4_VWB1_WGM1_WGMXCC1_WGMXCCGn1
    SolutionIndex: 50
    SolutionNameMin: Cijk_Alik_Bljk_BBS_BH_UserArgs_MT128x64x64_MI16x16x1_SN_LDSB1_CLR1_GSU0_GSUC0_GSUWGMRR0_K1_LBSPPA128_LBSPPB256_MIWT4_2_PLR1_SU32_SUM0_SUS256_VWA1_VWB2_WGM1_WGMXCC1_WGMXCCGn1
    SolutionIndex: 51
    SolutionNameMin: Cijk_Alik_Bljk_BBS_BH_UserArgs_MT128x64x64_MI16x16x1_SN_LDSB1_CLR1_GSU0_GSUC0_GSUWGMRR0_K1_LBSPPA256_LBSPPB256_MIWT4_2_PLR1_SU32_SUM0_SUS256_VWA2_VWB2_WGM1_WGMXCC1_WGMXCCGn1
    SolutionIndex: 52
    SolutionNameMin: Cijk_Alik_Bljk_BBS_BH_UserArgs_MT128x64x64_MI16x16x1_SN_LDSB1_CLR1_GSU0_GSUC0_GSUWGMRR0_K1_LBSPPA512_LBSPPB256_MIWT4_2_PLR1_SU32_SUM0_SUS256_VWA4_VWB2_WGM1_WGMXCC1_WGMXCCGn1
    SolutionIndex: 53
    SolutionNameMin: Cijk_Alik_Bljk_BBS_BH_UserArgs_MT128x64x64_MI16x16x1_SN_LDSB1_CLR1_GSU0_GSUC0_GSUWGMRR0_K1_LBSPPA512_LBSPPB128_MIWT4_2_PLR2_SU32_SUM0_SUS256_VWA4_VWB1_WGM1_WGMXCC1_WGMXCCGn1
    SolutionIndex: 54
    SolutionNameMin: Cijk_Alik_Bljk_BBS_BH_UserArgs_MT128x64x64_MI16x16x1_SN_LDSB1_CLR1_GSU0_GSUC0_GSUWGMRR0_K1_LBSPPA256_LBSPPB256_MIWT4_2_PLR1_SU32_SUM0_SUS256_VWA2_VWB2_WGM4_WGMXCC1_WGMXCCGn1
    SolutionIndex: 55
    SolutionNameMin: Cijk_Alik_Bljk_BBS_BH_UserArgs_MT128x64x64_MI16x16x1_SN_LDSB1_CLR1_GSU0_GSUC0_GSUWGMRR0_K1_LBSPPA256_LBSPPB128_MIWT4_2_PLR1_SU32_SUM0_SUS256_VWA2_VWB1_WGM8_WGMXCC1_WGMXCCGn1
    SolutionIndex: 56
    SolutionNameMin: Cijk_Alik_Bljk_BBS_BH_UserArgs_MT128x64x64_MI16x16x1_SN_LDSB1_CLR1_GSU0_GSUC0_GSUWGMRR0_K1_LBSPPA512_LBSPPB128_MIWT4_2_PLR1_SU32_SUM0_SUS256_VWA4_VWB1_WGM8_WGMXCC1_WGMXCCGn1
    SolutionIndex: 57
    SolutionNameMin: Cijk_Alik_Bljk_BBS_BH_UserArgs_MT128x64x64_MI16x16x1_SN_LDSB1_CLR1_GSU0_GSUC0_GSUWGMRR0_K1_LBSPPA512_LBSPPB256_MIWT4_2_PLR1_SU32_SUM0_SUS256_VWA4_VWB2_WGM8_WGMXCC1_WGMXCCGn1
    SolutionIndex: 58
    SolutionNameMin: Cijk_Alik_Bljk_BBS_BH_UserArgs_MT128x32x64_MI16x16x1_SN_LDSB1_CLR1_GSU0_GSUC0_GSUWGMRR0_K1_LBSPPA512_LBSPPB128_MIWT4_1_PLR1_SU32_SUM0_SUS256_VWA4_VWB1_WGM1_WGMXCC1_WGMXCCGn1
    SolutionIndex: 59
    SolutionNameMin: Cijk_Alik_Bljk_BBS_BH_UserArgs_MT64x64x64_MI16x16x1_SN_LDSB1_CLR1_GSU0_GSUC0_GSUWGMRR0_K1_LBSPPA128_LBSPPB128_MIWT2_2_PLR1_SU32_SUM0_SUS256_VWA1_VWB1_WGM1_WGMXCC1_WGMXCCGn1
    SolutionIndex: 60
    SolutionNameMin: Cijk_Alik_Bljk_BBS_BH_UserArgs_MT64x64x64_MI16x16x1_SN_LDSB1_CLR1_GSU0_GSUC0_GSUWGMRR0_K1_LBSPPA256_LBSPPB128_MIWT2_2_PLR1_SU32_SUM0_SUS256_VWA2_VWB1_WGM1_WGMXCC1_WGMXCCGn1
    SolutionIndex: 61
    SolutionNameMin: Cijk_Alik_Bljk_BBS_BH_UserArgs_MT64x64x64_MI16x16x1_SN_LDSB1_CLR1_GSU0_GSUC0_GSUWGMRR0_K1_LBSPPA128_LBSPPB256_MIWT2_2_PLR1_SU32_SUM0_SUS256_VWA1_VWB2_WGM1_WGMXCC1_WGMXCCGn1
    SolutionIndex: 62
    SolutionNameMin: Cijk_Alik_Bljk_BBS_BH_UserArgs_MT64x64x64_MI16x16x1_SN_LDSB1_CLR1_GSU0_GSUC0_GSUWGMRR0_K1_LBSPPA256_LBSPPB256_MIWT2_2_PLR1_SU32_SUM0_SUS256_VWA2_VWB2_WGM1_WGMXCC1_WGMXCCGn1
    SolutionIndex: 63
    SolutionNameMin: Cijk_Alik_Bljk_BBS_BH_UserArgs_MT64x64x64_MI16x16x1_SN_LDSB1_CLR1_GSU0_GSUC0_GSUWGMRR0_K1_LBSPPA256_LBSPPB128_MIWT2_2_PLR1_SU32_SUM0_SUS256_VWA2_VWB1_WGM4_WGMXCC1_WGMXCCGn1
    SolutionIndex: 64
    SolutionNameMin: Cijk_Alik_Bljk_BBS_BH_UserArgs_MT64x64x64_MI16x16x1_SN_LDSB1_CLR1_GSU0_GSUC0_GSUWGMRR0_K1_LBSPPA256_LBSPPB128_MIWT2_2_PLR1_SU32_SUM0_SUS256_VWA2_VWB1_WGM8_WGMXCC1_WGMXCCGn1
    SolutionIndex: 65
    SolutionNameMin: Cijk_Alik_Bljk_BBS_BH_UserArgs_MT64x64x64_MI16x16x1_SN_LDSB1_CLR1_GSU0_GSUC0_GSUWGMRR0_K1_LBSPPA256_LBSPPB256_MIWT2_2_PLR1_SU32_SUM0_SUS256_VWA2_VWB2_WGM8_WGMXCC1_WGMXCCGn1
    SolutionIndex: 66
    SolutionNameMin: Cijk_Alik_Bljk_BBS_BH_UserArgs_MT32x64x64_MI16x16x1_SN_LDSB0_CLR1_GSU0_GSUC0_GSUWGMRR0_K1_LBSPPA128_LBSPPB256_MIWT1_2_PLR1_SU32_SUM0_SUS256_VWA1_VWB2_WGM1_WGMXCC1_WGMXCCGn1
    SolutionIndex: 67
    SolutionNameMin: Cijk_Alik_Bljk_BBS_BH_UserArgs_MT32x64x64_MI16x16x1_SN_LDSB0_CLR1_GSU0_GSUC0_GSUWGMRR0_K1_LBSPPA128_LBSPPB256_MIWT1_2_PLR2_SU32_SUM0_SUS256_VWA1_VWB2_WGM1_WGMXCC1_WGMXCCGn1
    SolutionIndex: 68
    SolutionNameMin: Cijk_Alik_Bljk_BBS_BH_UserArgs_MT32x64x64_MI16x16x1_SN_LDSB0_CLR1_GSU0_GSUC0_GSUWGMRR0_K1_LBSPPA128_LBSPPB128_MIWT1_2_PLR1_SU32_SUM0_SUS256_VWA1_VWB1_WGM4_WGMXCC1_WGMXCCGn1
    SolutionIndex: 69
    SolutionNameMin: Cijk_Alik_Bljk_BBS_BH_UserArgs_MT32x64x64_MI16x16x1_SN_LDSB0_CLR1_GSU0_GSUC0_GSUWGMRR0_K1_LBSPPA128_LBSPPB256_MIWT1_2_PLR1_SU32_SUM0_SUS256_VWA1_VWB2_WGM8_WGMXCC1_WGMXCCGn1
    SolutionIndex: 70
    SolutionNameMin: Cijk_Alik_Bljk_BBS_BH_UserArgs_MT32x64x64_MI16x16x1_SN_LDSB0_CLR1_GSU0_GSUC0_GSUWGMRR0_K1_LBSPPA128_LBSPPB256_MIWT1_2_PLR2_SU32_SUM0_SUS256_VWA1_VWB2_WGM8_WGMXCC1_WGMXCCGn1
    SolutionIndex: 71
    SolutionNameMin: Cijk_Alik_Bljk_BBS_BH_UserArgs_MT64x32x64_MI16x16x1_SN_LDSB0_CLR1_GSU0_GSUC0_GSUWGMRR0_K1_LBSPPA128_LBSPPB128_MIWT2_1_PLR1_SU32_SUM0_SUS256_VWA1_VWB1_WGM1_WGMXCC1_WGMXCCGn1
    SolutionIndex: 72
    SolutionNameMin: Cijk_Alik_Bljk_BBS_BH_UserArgs_MT64x32x64_MI16x16x1_SN_LDSB0_CLR1_GSU0_GSUC0_GSUWGMRR0_K1_LBSPPA256_LBSPPB128_MIWT2_1_PLR1_SU32_SUM0_SUS256_VWA2_VWB1_WGM1_WGMXCC1_WGMXCCGn1
    SolutionIndex: 73
    SolutionNameMin: Cijk_Alik_Bljk_BBS_BH_UserArgs_MT64x32x64_MI16x16x1_SN_LDSB0_CLR1_GSU0_GSUC0_GSUWGMRR0_K1_LBSPPA256_LBSPPB128_MIWT2_1_PLR1_SU32_SUM0_SUS256_VWA2_VWB1_WGM8_WGMXCC1_WGMXCCGn1
    SolutionIndex: 74
    SolutionNameMin: Cijk_Alik_Bljk_BBS_BH_UserArgs_MT32x32x64_MI16x16x1_SN_LDSB0_CLR1_GSU0_GSUC0_GSUWGMRR0_K1_LBSPPA128_LBSPPB128_MIWT1_1_PLR1_SU32_SUM0_SUS256_VWA1_VWB1_WGM1_WGMXCC1_WGMXCCGn1
    SolutionIndex: 75
    SolutionNameMin: Cijk_Alik_Bljk_BBS_BH_UserArgs_MT32x32x64_MI16x16x1_SN_LDSB0_CLR1_GSU0_GSUC0_GSUWGMRR0_K1_LBSPPA128_LBSPPB128_MIWT1_1_PLR2_SU32_SUM0_SUS256_VWA1_VWB1_WGM1_WGMXCC1_WGMXCCGn1
    SolutionIndex: 76
    SolutionNameMin: Cijk_Alik_Bljk_BBS_BH_UserArgs_MT32x32x64_MI16x16x1_SN_LDSB0_CLR1_GSU0_GSUC0_GSUWGMRR0_K1_LBSPPA128_LBSPPB128_MIWT1_1_PLR1_SU32_SUM0_SUS256_VWA1_VWB1_WGM4_WGMXCC1_WGMXCCGn1
    SolutionIndex: 77
    SolutionNameMin: Cijk_Alik_Bljk_BBS_BH_UserArgs_MT32x32x64_MI16x16x1_SN_LDSB0_CLR1_GSU0_GSUC0_GSUWGMRR0_K1_LBSPPA128_LBSPPB128_MIWT1_1_PLR2_SU32_SUM0_SUS256_VWA1_VWB1_WGM4_WGMXCC1_WGMXCCGn1
    SolutionIndex: 78
    SolutionNameMin: Cijk_Alik_Bljk_BBS_BH_UserArgs_MT128x32x128_MI16x16x1_SN_LDSB1_CLR1_GSU0_GSUC0_GSUWGMRR0_K1_LBSPPA1024_LBSPPB256_MIWT4_1_PLR1_SU32_SUM0_SUS256_VWA4_VWB1_WGM1_WGMXCC1_WGMXCCGn1
    SolutionIndex: 79
    SolutionNameMin: Cijk_Alik_Bljk_BBS_BH_UserArgs_MT64x64x128_MI16x16x1_SN_LDSB1_CLR1_GSU0_GSUC0_GSUWGMRR0_K1_LBSPPA512_LBSPPB256_MIWT2_2_PLR1_SU32_SUM0_SUS256_VWA2_VWB1_WGM1_WGMXCC1_WGMXCCGn1
    SolutionIndex: 80
    SolutionNameMin: Cijk_Alik_Bljk_BBS_BH_UserArgs_MT64x64x128_MI16x16x1_SN_LDSB1_CLR1_GSU0_GSUC0_GSUWGMRR0_K1_LBSPPA512_LBSPPB512_MIWT2_2_PLR1_SU32_SUM0_SUS256_VWA2_VWB2_WGM1_WGMXCC1_WGMXCCGn1
    SolutionIndex: 81
    SolutionNameMin: Cijk_Alik_Bljk_BBS_BH_UserArgs_MT64x64x128_MI16x16x1_SN_LDSB1_CLR1_GSU0_GSUC0_GSUWGMRR0_K1_LBSPPA256_LBSPPB256_MIWT2_2_PLR2_SU32_SUM0_SUS256_VWA1_VWB1_WGM1_WGMXCC1_WGMXCCGn1
    SolutionIndex: 82
    SolutionNameMin: Cijk_Alik_Bljk_BBS_BH_UserArgs_MT64x64x128_MI16x16x1_SN_LDSB1_CLR1_GSU0_GSUC0_GSUWGMRR0_K1_LBSPPA512_LBSPPB256_MIWT2_2_PLR2_SU32_SUM0_SUS256_VWA2_VWB1_WGM1_WGMXCC1_WGMXCCGn1
    SolutionIndex: 83
    SolutionNameMin: Cijk_Alik_Bljk_BBS_BH_UserArgs_MT64x64x128_MI16x16x1_SN_LDSB1_CLR1_GSU0_GSUC0_GSUWGMRR0_K1_LBSPPA512_LBSPPB512_MIWT2_2_PLR2_SU32_SUM0_SUS256_VWA2_VWB2_WGM1_WGMXCC1_WGMXCCGn1
    SolutionIndex: 84
    SolutionNameMin: Cijk_Alik_Bljk_BBS_BH_UserArgs_MT64x64x128_MI16x16x1_SN_LDSB1_CLR1_GSU0_GSUC0_GSUWGMRR0_K1_LBSPPA512_LBSPPB256_MIWT2_2_PLR1_SU32_SUM0_SUS256_VWA2_VWB1_WGM4_WGMXCC1_WGMXCCGn1
    SolutionIndex: 85
    SolutionNameMin: Cijk_Alik_Bljk_BBS_BH_UserArgs_MT64x64x128_MI16x16x1_SN_LDSB1_CLR1_GSU0_GSUC0_GSUWGMRR0_K1_LBSPPA256_LBSPPB512_MIWT2_2_PLR1_SU32_SUM0_SUS256_VWA1_VWB2_WGM4_WGMXCC1_WGMXCCGn1
    SolutionIndex: 86
    SolutionNameMin: Cijk_Alik_Bljk_BBS_BH_UserArgs_MT64x64x128_MI16x16x1_SN_LDSB1_CLR1_GSU0_GSUC0_GSUWGMRR0_K1_LBSPPA256_LBSPPB512_MIWT2_2_PLR2_SU32_SUM0_SUS256_VWA1_VWB2_WGM4_WGMXCC1_WGMXCCGn1
    SolutionIndex: 87
    SolutionNameMin: Cijk_Alik_Bljk_BBS_BH_UserArgs_MT64x64x128_MI16x16x1_SN_LDSB1_CLR1_GSU0_GSUC0_GSUWGMRR0_K1_LBSPPA512_LBSPPB512_MIWT2_2_PLR2_SU32_SUM0_SUS256_VWA2_VWB2_WGM4_WGMXCC1_WGMXCCGn1
    SolutionIndex: 88
    SolutionNameMin: Cijk_Alik_Bljk_BBS_BH_UserArgs_MT64x64x128_MI16x16x1_SN_LDSB1_CLR1_GSU0_GSUC0_GSUWGMRR0_K1_LBSPPA512_LBSPPB256_MIWT2_2_PLR1_SU32_SUM0_SUS256_VWA2_VWB1_WGM8_WGMXCC1_WGMXCCGn1
    SolutionIndex: 89
    SolutionNameMin: Cijk_Alik_Bljk_BBS_BH_UserArgs_MT64x64x128_MI16x16x1_SN_LDSB1_CLR1_GSU0_GSUC0_GSUWGMRR0_K1_LBSPPA512_LBSPPB512_MIWT2_2_PLR1_SU32_SUM0_SUS256_VWA2_VWB2_WGM8_WGMXCC1_WGMXCCGn1
    SolutionIndex: 90
    SolutionNameMin: Cijk_Alik_Bljk_BBS_BH_UserArgs_MT64x64x128_MI16x16x1_SN_LDSB1_CLR1_GSU0_GSUC0_GSUWGMRR0_K1_LBSPPA512_LBSPPB256_MIWT2_2_PLR2_SU32_SUM0_SUS256_VWA2_VWB1_WGM8_WGMXCC1_WGMXCCGn1
    SolutionIndex: 91
    SolutionNameMin: Cijk_Alik_Bljk_BBS_BH_UserArgs_MT64x64x128_MI16x16x1_SN_LDSB1_CLR1_GSU0_GSUC0_GSUWGMRR0_K1_LBSPPA512_LBSPPB512_MIWT2_2_PLR2_SU32_SUM0_SUS256_VWA2_VWB2_WGM8_WGMXCC1_WGMXCCGn1
    SolutionIndex: 92
    SolutionNameMin: Cijk_Alik_Bljk_BBS_BH_UserArgs_MT32x64x128_MI16x16x1_SN_LDSB1_CLR1_GSU0_GSUC0_GSUWGMRR0_K1_LBSPPA256_LBSPPB256_MIWT1_2_PLR1_SU32_SUM0_SUS256_VWA1_VWB1_WGM1_WGMXCC1_WGMXCCGn1
    SolutionIndex: 93
    SolutionNameMin: Cijk_Alik_Bljk_BBS_BH_UserArgs_MT32x64x128_MI16x16x1_SN_LDSB1_CLR1_GSU0_GSUC0_GSUWGMRR0_K1_LBSPPA256_LBSPPB512_MIWT1_2_PLR2_SU32_SUM0_SUS256_VWA1_VWB2_WGM1_WGMXCC1_WGMXCCGn1
    SolutionIndex: 94
    SolutionNameMin: Cijk_Alik_Bljk_BBS_BH_UserArgs_MT32x64x128_MI16x16x1_SN_LDSB1_CLR1_GSU0_GSUC0_GSUWGMRR0_K1_LBSPPA256_LBSPPB512_MIWT1_2_PLR2_SU32_SUM0_SUS256_VWA1_VWB2_WGM4_WGMXCC1_WGMXCCGn1
    SolutionIndex: 95
    SolutionNameMin: Cijk_Alik_Bljk_BBS_BH_UserArgs_MT64x32x128_MI16x16x1_SN_LDSB1_CLR1_GSU0_GSUC0_GSUWGMRR0_K1_LBSPPA512_LBSPPB256_MIWT2_1_PLR1_SU32_SUM0_SUS256_VWA2_VWB1_WGM1_WGMXCC1_WGMXCCGn1
    SolutionIndex: 96
    SolutionNameMin: Cijk_Alik_Bljk_BBS_BH_UserArgs_MT64x32x128_MI16x16x1_SN_LDSB1_CLR1_GSU0_GSUC0_GSUWGMRR0_K1_LBSPPA256_LBSPPB256_MIWT2_1_PLR2_SU32_SUM0_SUS256_VWA1_VWB1_WGM1_WGMXCC1_WGMXCCGn1
    SolutionIndex: 97
    SolutionNameMin: Cijk_Alik_Bljk_BBS_BH_UserArgs_MT64x32x128_MI16x16x1_SN_LDSB1_CLR1_GSU0_GSUC0_GSUWGMRR0_K1_LBSPPA512_LBSPPB256_MIWT2_1_PLR2_SU32_SUM0_SUS256_VWA2_VWB1_WGM1_WGMXCC1_WGMXCCGn1
    SolutionIndex: 98
    SolutionNameMin: Cijk_Alik_Bljk_BBS_BH_UserArgs_MT64x32x128_MI16x16x1_SN_LDSB1_CLR1_GSU0_GSUC0_GSUWGMRR0_K1_LBSPPA256_LBSPPB256_MIWT2_1_PLR2_SU32_SUM0_SUS256_VWA1_VWB1_WGM8_WGMXCC1_WGMXCCGn1
    SolutionIndex: 99
    SolutionNameMin: Cijk_Alik_Bljk_BBS_BH_UserArgs_MT32x32x128_MI16x16x1_SN_LDSB1_CLR1_GSU0_GSUC0_GSUWGMRR0_K1_LBSPPA256_LBSPPB256_MIWT1_1_PLR1_SU32_SUM0_SUS256_VWA1_VWB1_WGM1_WGMXCC1_WGMXCCGn1
    SolutionIndex: 100
    SolutionNameMin: Cijk_Alik_Bljk_BBS_BH_UserArgs_MT32x32x128_MI16x16x1_SN_LDSB1_CLR1_GSU0_GSUC0_GSUWGMRR0_K1_LBSPPA256_LBSPPB256_MIWT1_1_PLR2_SU32_SUM0_SUS256_VWA1_VWB1_WGM1_WGMXCC1_WGMXCCGn1
    SolutionIndex: 101
    SolutionNameMin: Cijk_Alik_Bljk_BBS_BH_UserArgs_MT32x32x128_MI16x16x1_SN_LDSB1_CLR1_GSU0_GSUC0_GSUWGMRR0_K1_LBSPPA256_LBSPPB256_MIWT1_1_PLR1_SU32_SUM0_SUS256_VWA1_VWB1_WGM8_WGMXCC1_WGMXCCGn1
    SolutionIndex: 102
    SolutionNameMin: Cijk_Alik_Bljk_BBS_BH_UserArgs_MT32x32x128_MI16x16x1_SN_LDSB1_CLR1_GSU0_GSUC0_GSUWGMRR0_K1_LBSPPA256_LBSPPB256_MIWT1_1_PLR2_SU32_SUM0_SUS256_VWA1_VWB1_WGM8_WGMXCC1_WGMXCCGn1
    SolutionIndex: 103
    SolutionNameMin: Cijk_Alik_Bljk_BBS_BH_UserArgs_MT32x32x32_MI16x16x1_SN_LDSB0_CLR0_GSU0_GSUC0_GSUWGMRR0_K1_LBSPPA128_LBSPPB128_MIWT1_1_PLR0_SU32_SUM0_SUS256_VWA1_VWB1_WGM8_WGMXCC1_WGMXCCGn1
- - - [128, 128, 1, 128, 128, 128, 128, 128]
    - [1, 0.093]
  - - [128, 128, 1, 256, 128, 128, 256, 256]
    - [70, 0.16]
  - - [128, 128, 1, 512, 128, 128, 512, 512]
    - [99, 0.292]
  - - [128, 128, 1, 1024, 128, 128, 1024, 1024]
    - [101, 0.439]
  - - [128, 128, 1, 2048, 128, 128, 2048, 2048]
    - [100, 0.609]
  - - [128, 128, 1, 4096, 128, 128, 4096, 4096]
    - [66, 0.958]
  - - [128, 128, 1, 8192, 128, 128, 8192, 8192]
    - [94, 1.432]
  - - [128, 256, 1, 128, 128, 128, 128, 128]
    - [2, 0.17]
  - - [128, 256, 1, 256, 128, 128, 256, 256]
    - [77, 0.331]
  - - [128, 256, 1, 512, 128, 128, 512, 512]
    - [102, 0.529]
  - - [128, 256, 1, 1024, 128, 128, 1024, 1024]
    - [99, 0.914]
  - - [128, 256, 1, 2048, 128, 128, 2048, 2048]
    - [74, 1.232]
  - - [128, 256, 1, 4096, 128, 128, 4096, 4096]
    - [99, 1.6]
  - - [128, 256, 1, 8192, 128, 128, 8192, 8192]
    - [91, 2.261]
  - - [128, 512, 1, 128, 128, 128, 128, 128]
    - [73, 0.34]
  - - [128, 512, 1, 256, 128, 128, 256, 256]
    - [72, 0.588]
  - - [128, 512, 1, 512, 128, 128, 512, 512]
    - [71, 0.998]
  - - [128, 512, 1, 1024, 128, 128, 1024, 1024]
    - [97, 1.494]
  - - [128, 512, 1, 2048, 128, 128, 2048, 2048]
    - [93, 2.043]
  - - [128, 512, 1, 4096, 128, 128, 4096, 4096]
    - [91, 2.485]
  - - [128, 512, 1, 8192, 128, 128, 8192, 8192]
    - [85, 3.185]
  - - [128, 1024, 1, 128, 128, 128, 128, 128]
    - [86, 0.62]
  - - [128, 1024, 1, 256, 128, 128, 256, 256]
    - [59, 1.068]
  - - [128, 1024, 1, 512, 128, 128, 512, 512]
    - [64, 1.728]
  - - [128, 1024, 1, 1024, 128, 128, 1024, 1024]
    - [62, 2.524]
  - - [128, 1024, 1, 2048, 128, 128, 2048, 2048]
    - [84, 2.992]
  - - [128, 1024, 1, 4096, 128, 128, 4096, 4096]
    - [81, 3.618]
  - - [128, 1024, 1, 8192, 128, 128, 8192, 8192]
    - [55, 3.967]
  - - [128, 2048, 1, 128, 128, 128, 128, 128]
    - [52, 1.033]
  - - [128, 2048, 1, 256, 128, 128, 256, 256]
    - [56, 1.682]
  - - [128, 2048, 1, 512, 128, 128, 512, 512]
    - [43, 2.617]
  - - [128, 2048, 1, 1024, 128, 128, 1024, 1024]
    - [50, 3.145]
  - - [128, 2048, 1, 2048, 128, 128, 2048, 2048]
    - [49, 3.969]
  - - [128, 2048, 1, 4096, 128, 128, 4096, 4096]
    - [49, 4.534]
  - - [128, 2048, 1, 8192, 128, 128, 8192, 8192]
    - [30, 5.527]
  - - [128, 4096, 1, 128, 128, 128, 128, 128]
    - [0, 1.487]
  - - [128, 4096, 1, 256, 128, 128, 256, 256]
    - [39, 2.252]
  - - [128, 4096, 1, 512, 128, 128, 512, 512]
    - [20, 3.507]
  - - [128, 4096, 1, 1024, 128, 128, 1024, 1024]
    - [37, 4.671]
  - - [128, 4096, 1, 2048, 128, 128, 2048, 2048]
    - [17, 5.704]
  - - [128, 4096, 1, 4096, 128, 128, 4096, 4096]
    - [19, 6.111]
  - - [128, 4096, 1, 8192, 128, 128, 8192, 8192]
    - [30, 7.003]
  - - [128, 8192, 1, 128, 128, 128, 128, 128]
    - [25, 1.619]
  - - [128, 8192, 1, 256, 128, 128, 256, 256]
    - [54, 1.909]
  - - [128, 8192, 1, 512, 128, 128, 512, 512]
    - [18, 3.073]
  - - [128, 8192, 1, 1024, 128, 128, 1024, 1024]
    - [21, 4.545]
  - - [128, 8192, 1, 2048, 128, 128, 2048, 2048]
    - [31, 5.986]
  - - [128, 8192, 1, 4096, 128, 128, 4096, 4096]
    - [18, 6.831]
  - - [128, 8192, 1, 8192, 128, 128, 8192, 8192]
    - [26, 7.159]
  - - [256, 128, 1, 128, 256, 256, 128, 128]
    - [95, 0.169]
  - - [256, 128, 1, 256, 256, 256, 256, 256]
    - [75, 0.332]
  - - [256, 128, 1, 512, 256, 256, 512, 512]
    - [74, 0.555]
  - - [256, 128, 1, 1024, 256, 256, 1024, 1024]
    - [76, 0.902]
  - - [256, 128, 1, 2048, 256, 256, 2048, 2048]
    - [99, 1.275]
  - - [256, 128, 1, 4096, 256, 256, 4096, 4096]
    - [99, 1.661]
  - - [256, 128, 1, 8192, 256, 256, 8192, 8192]
    - [88, 2.334]
  - - [256, 256, 1, 128, 256, 256, 128, 128]
    - [67, 0.336]
  - - [256, 256, 1, 256, 256, 256, 256, 256]
    - [69, 0.603]
  - - [256, 256, 1, 512, 256, 256, 512, 512]
    - [92, 1.023]
  - - [256, 256, 1, 1024, 256, 256, 1024, 1024]
    - [96, 1.603]
  - - [256, 256, 1, 2048, 256, 256, 2048, 2048]
    - [98, 2.063]
  - - [256, 256, 1, 4096, 256, 256, 4096, 4096]
    - [89, 2.499]
  - - [256, 256, 1, 8192, 256, 256, 8192, 8192]
    - [82, 3.236]
  - - [256, 512, 1, 128, 256, 256, 128, 128]
    - [60, 0.619]
  - - [256, 512, 1, 256, 256, 256, 256, 256]
    - [62, 1.051]
  - - [256, 512, 1, 512, 256, 256, 512, 512]
    - [80, 1.743]
  - - [256, 512, 1, 1024, 256, 256, 1024, 1024]
    - [65, 2.462]
  - - [256, 512, 1, 2048, 256, 256, 2048, 2048]
    - [82, 3.158]
  - - [256, 512, 1, 4096, 256, 256, 4096, 4096]
    - [80, 3.648]
  - - [256, 512, 1, 8192, 256, 256, 8192, 8192]
    - [21, 4.166]
  - - [256, 1024, 1, 128, 256, 256, 128, 128]
    - [53, 1.081]
  - - [256, 1024, 1, 256, 256, 256, 256, 256]
    - [42, 1.841]
  - - [256, 1024, 1, 512, 256, 256, 512, 512]
    - [52, 2.685]
  - - [256, 1024, 1, 1024, 256, 256, 1024, 1024]
    - [54, 3.633]
  - - [256, 1024, 1, 2048, 256, 256, 2048, 2048]
    - [48, 4.31]
  - - [256, 1024, 1, 4096, 256, 256, 4096, 4096]
    - [41, 4.916]
  - - [256, 1024, 1, 8192, 256, 256, 8192, 8192]
    - [36, 5.872]
  - - [256, 2048, 1, 128, 256, 256, 128, 128]
    - [20, 1.577]
  - - [256, 2048, 1, 256, 256, 256, 256, 256]
    - [30, 2.556]
  - - [256, 2048, 1, 512, 256, 256, 512, 512]
    - [15, 3.668]
  - - [256, 2048, 1, 1024, 256, 256, 1024, 1024]
    - [25, 4.752]
  - - [256, 2048, 1, 2048, 256, 256, 2048, 2048]
    - [20, 5.849]
  - - [256, 2048, 1, 4096, 256, 256, 4096, 4096]
    - [32, 5.44]
  - - [256, 2048, 1, 8192, 256, 256, 8192, 8192]
    - [13, 6.526]
  - - [256, 4096, 1, 128, 256, 256, 128, 128]
    - [8, 1.657]
  - - [256, 4096, 1, 256, 256, 256, 256, 256]
    - [48, 2.064]
  - - [256, 4096, 1, 512, 256, 256, 512, 512]
    - [30, 3.151]
  - - [256, 4096, 1, 1024, 256, 256, 1024, 1024]
    - [20, 4.501]
  - - [256, 4096, 1, 2048, 256, 256, 2048, 2048]
    - [7, 5.69]
  - - [256, 4096, 1, 4096, 256, 256, 4096, 4096]
    - [28, 6.391]
  - - [256, 4096, 1, 8192, 256, 256, 8192, 8192]
    - [15, 6.95]
  - - [256, 8192, 1, 128, 256, 256, 128, 128]
    - [31, 1.743]
  - - [256, 8192, 1, 256, 256, 256, 256, 256]
    - [38, 2.838]
  - - [256, 8192, 1, 512, 256, 256, 512, 512]
    - [38, 3.977]
  - - [256, 8192, 1, 1024, 256, 256, 1024, 1024]
    - [28, 5.187]
  - - [256, 8192, 1, 2048, 256, 256, 2048, 2048]
    - [41, 6.344]
  - - [256, 8192, 1, 4096, 256, 256, 4096, 4096]
    - [26, 6.703]
  - - [256, 8192, 1, 8192, 256, 256, 8192, 8192]
    - [9, 5.622]
  - - [512, 128, 1, 128, 512, 512, 128, 128]
    - [95, 0.359]
  - - [512, 128, 1, 256, 512, 512, 256, 256]
    - [97, 0.64]
  - - [512, 128, 1, 512, 512, 512, 512, 512]
    - [68, 1.036]
  - - [512, 128, 1, 1024, 512, 512, 1024, 1024]
    - [68, 1.573]
  - - [512, 128, 1, 2048, 512, 512, 2048, 2048]
    - [97, 2.06]
  - - [512, 128, 1, 4096, 512, 512, 4096, 4096]
    - [82, 2.549]
  - - [512, 128, 1, 8192, 512, 512, 8192, 8192]
    - [79, 3.204]
  - - [512, 256, 1, 128, 512, 512, 128, 128]
    - [78, 0.641]
  - - [512, 256, 1, 256, 512, 512, 256, 256]
    - [61, 1.115]
  - - [512, 256, 1, 512, 512, 512, 512, 512]
    - [83, 1.739]
  - - [512, 256, 1, 1024, 512, 512, 1024, 1024]
    - [80, 2.503]
  - - [512, 256, 1, 2048, 512, 512, 2048, 2048]
    - [82, 3.248]
  - - [512, 256, 1, 4096, 512, 512, 4096, 4096]
    - [82, 3.696]
  - - [512, 256, 1, 8192, 512, 512, 8192, 8192]
    - [17, 4.224]
  - - [512, 512, 1, 128, 512, 512, 128, 128]
    - [47, 1.078]
  - - [512, 512, 1, 256, 512, 512, 256, 256]
    - [43, 1.858]
  - - [512, 512, 1, 512, 512, 512, 512, 512]
    - [45, 2.725]
  - - [512, 512, 1, 1024, 512, 512, 1024, 1024]
    - [43, 3.63]
  - - [512, 512, 1, 2048, 512, 512, 2048, 2048]
    - [57, 3.862]
  - - [512, 512, 1, 4096, 512, 512, 4096, 4096]
    - [31, 4.47]
  - - [512, 512, 1, 8192, 512, 512, 8192, 8192]
    - [41, 5.681]
  - - [512, 1024, 1, 128, 512, 512, 128, 128]
    - [37, 1.632]
  - - [512, 1024, 1, 256, 512, 512, 256, 256]
    - [20, 2.682]
  - - [512, 1024, 1, 512, 512, 512, 512, 512]
    - [17, 4.09]
  - - [512, 1024, 1, 1024, 512, 512, 1024, 1024]
    - [21, 4.957]
  - - [512, 1024, 1, 2048, 512, 512, 2048, 2048]
    - [10, 5.68]
  - - [512, 1024, 1, 4096, 512, 512, 4096, 4096]
    - [34, 5.701]
  - - [512, 1024, 1, 8192, 512, 512, 8192, 8192]
    - [15, 6.716]
  - - [512, 2048, 1, 128, 512, 512, 128, 128]
    - [18, 1.742]
  - - [512, 2048, 1, 256, 512, 512, 256, 256]
    - [48, 2.09]
  - - [512, 2048, 1, 512, 512, 512, 512, 512]
    - [26, 3.327]
  - - [512, 2048, 1, 1024, 512, 512, 1024, 1024]
    - [17, 4.666]
  - - [512, 2048, 1, 2048, 512, 512, 2048, 2048]
    - [35, 5.255]
  - - [512, 2048, 1, 4096, 512, 512, 4096, 4096]
    - [24, 5.968]
  - - [512, 2048, 1, 8192, 512, 512, 8192, 8192]
    - [25, 7.088]
  - - [512, 4096, 1, 128, 512, 512, 128, 128]
    - [4, 1.832]
  - - [512, 4096, 1, 256, 512, 512, 256, 256]
    - [28, 2.838]
  - - [512, 4096, 1, 512, 512, 512, 512, 512]
    - [38, 4.011]
  - - [512, 4096, 1, 1024, 512, 512, 1024, 1024]
    - [18, 5.557]
  - - [512, 4096, 1, 2048, 512, 512, 2048, 2048]
    - [30, 6.281]
  - - [512, 4096, 1, 4096, 512, 512, 4096, 4096]
    - [41, 7.361]
  - - [512, 4096, 1, 8192, 512, 512, 8192, 8192]
    - [24, 7.973]
  - - [512, 8192, 1, 128, 512, 512, 128, 128]
    - [6, 2.187]
  - - [512, 8192, 1, 256, 512, 512, 256, 256]
    - [21, 3.251]
  - - [512, 8192, 1, 512, 512, 512, 512, 512]
    - [20, 4.735]
  - - [512, 8192, 1, 1024, 512, 512, 1024, 1024]
    - [18, 6.089]
  - - [512, 8192, 1, 2048, 512, 512, 2048, 2048]
    - [31, 6.507]
  - - [512, 8192, 1, 4096, 512, 512, 4096, 4096]
    - [41, 6.492]
  - - [512, 8192, 1, 8192, 512, 512, 8192, 8192]
    - [33, 7.043]
  - - [1024, 128, 1, 128, 1024, 1024, 128, 128]
    - [60, 0.689]
  - - [1024, 128, 1, 256, 1024, 1024, 256, 256]
    - [58, 1.105]
  - - [1024, 128, 1, 512, 1024, 1024, 512, 512]
    - [63, 1.791]
  - - [1024, 128, 1, 1024, 1024, 1024, 1024, 1024]
    - [79, 2.573]
  - - [1024, 128, 1, 2048, 1024, 1024, 2048, 2048]
    - [90, 3.052]
  - - [1024, 128, 1, 4096, 1024, 1024, 4096, 4096]
    - [87, 3.667]
  - - [1024, 128, 1, 8192, 1024, 1024, 8192, 8192]
    - [21, 4.36]
  - - [1024, 256, 1, 128, 1024, 1024, 128, 128]
    - [44, 1.074]
  - - [1024, 256, 1, 256, 1024, 1024, 256, 256]
    - [46, 1.791]
  - - [1024, 256, 1, 512, 1024, 1024, 512, 512]
    - [43, 2.827]
  - - [1024, 256, 1, 1024, 1024, 1024, 1024, 1024]
    - [42, 3.766]
  - - [1024, 256, 1, 2048, 1024, 1024, 2048, 2048]
    - [43, 3.475]
  - - [1024, 256, 1, 4096, 1024, 1024, 4096, 4096]
    - [17, 4.474]
  - - [1024, 256, 1, 8192, 1024, 1024, 8192, 8192]
    - [16, 5.859]
  - - [1024, 512, 1, 128, 1024, 1024, 128, 128]
    - [5, 1.585]
  - - [1024, 512, 1, 256, 1024, 1024, 256, 256]
    - [14, 2.766]
  - - [1024, 512, 1, 512, 1024, 1024, 512, 512]
    - [14, 4.168]
  - - [1024, 512, 1, 1024, 1024, 1024, 1024, 1024]
    - [25, 4.77]
  - - [1024, 512, 1, 2048, 1024, 1024, 2048, 2048]
    - [18, 4.983]
  - - [1024, 512, 1, 4096, 1024, 1024, 4096, 4096]
    - [18, 5.811]
  - - [1024, 512, 1, 8192, 1024, 1024, 8192, 8192]
    - [15, 6.828]
  - - [1024, 1024, 1, 128, 1024, 1024, 128, 128]
    - [12, 1.748]
  - - [1024, 1024, 1, 256, 1024, 1024, 256, 256]
    - [49, 2.135]
  - - [1024, 1024, 1, 512, 1024, 1024, 512, 512]
    - [28, 3.373]
  - - [1024, 1024, 1, 1024, 1024, 1024, 1024, 1024]
    - [17, 4.796]
  - - [1024, 1024, 1, 2048, 1024, 1024, 2048, 2048]
    - [35, 5.315]
  - - [1024, 1024, 1, 4096, 1024, 1024, 4096, 4096]
    - [18, 6.209]
  - - [1024, 1024, 1, 8192, 1024, 1024, 8192, 8192]
    - [27, 6.936]
  - - [1024, 2048, 1, 128, 1024, 1024, 128, 128]
    - [18, 1.82]
  - - [1024, 2048, 1, 256, 1024, 1024, 256, 256]
    - [15, 2.969]
  - - [1024, 2048, 1, 512, 1024, 1024, 512, 512]
    - [18, 4.111]
  - - [1024, 2048, 1, 1024, 1024, 1024, 1024, 1024]
    - [15, 5.382]
  - - [1024, 2048, 1, 2048, 1024, 1024, 2048, 2048]
    - [27, 6.239]
  - - [1024, 2048, 1, 4096, 1024, 1024, 4096, 4096]
    - [35, 7.151]
  - - [1024, 2048, 1, 8192, 1024, 1024, 8192, 8192]
    - [27, 7.842]
  - - [1024, 4096, 1, 128, 1024, 1024, 128, 128]
    - [4, 2.16]
  - - [1024, 4096, 1, 256, 1024, 1024, 256, 256]
    - [15, 3.225]
  - - [1024, 4096, 1, 512, 1024, 1024, 512, 512]
    - [21, 4.757]
  - - [1024, 4096, 1, 1024, 1024, 1024, 1024, 1024]
    - [34, 5.723]
  - - [1024, 4096, 1, 2048, 1024, 1024, 2048, 2048]
    - [25, 6.491]
  - - [1024, 4096, 1, 4096, 1024, 1024, 4096, 4096]
    - [30, 7.634]
  - - [1024, 4096, 1, 8192, 1024, 1024, 8192, 8192]
    - [34, 8.266]
  - - [1024, 8192, 1, 128, 1024, 1024, 128, 128]
    - [21, 2.332]
  - - [1024, 8192, 1, 256, 1024, 1024, 256, 256]
    - [21, 3.702]
  - - [1024, 8192, 1, 512, 1024, 1024, 512, 512]
    - [15, 5.147]
  - - [1024, 8192, 1, 1024, 1024, 1024, 1024, 1024]
    - [25, 6.11]
  - - [1024, 8192, 1, 2048, 1024, 1024, 2048, 2048]
    - [37, 6.568]
  - - [1024, 8192, 1, 4096, 1024, 1024, 4096, 4096]
    - [29, 7.068]
  - - [1024, 8192, 1, 8192, 1024, 1024, 8192, 8192]
    - [41, 8.433]
  - - [2048, 128, 1, 128, 2048, 2048, 128, 128]
    - [51, 1.083]
  - - [2048, 128, 1, 256, 2048, 2048, 256, 256]
    - [49, 1.709]
  - - [2048, 128, 1, 512, 2048, 2048, 512, 512]
    - [43, 2.784]
  - - [2048, 128, 1, 1024, 2048, 2048, 1024, 1024]
    - [45, 3.004]
  - - [2048, 128, 1, 2048, 2048, 2048, 2048, 2048]
    - [51, 3.416]
  - - [2048, 128, 1, 4096, 2048, 2048, 4096, 4096]
    - [18, 4.482]
  - - [2048, 128, 1, 8192, 2048, 2048, 8192, 8192]
    - [28, 6.075]
  - - [2048, 256, 1, 128, 2048, 2048, 128, 128]
    - [21, 1.666]
  - - [2048, 256, 1, 256, 2048, 2048, 256, 256]
    - [17, 2.761]
  - - [2048, 256, 1, 512, 2048, 2048, 512, 512]
    - [6, 3.622]
  - - [2048, 256, 1, 1024, 2048, 2048, 1024, 1024]
    - [18, 4.233]
  - - [2048, 256, 1, 2048, 2048, 2048, 2048, 2048]
    - [23, 4.692]
  - - [2048, 256, 1, 4096, 2048, 2048, 4096, 4096]
    - [15, 6.507]
  - - [2048, 256, 1, 8192, 2048, 2048, 8192, 8192]
    - [20, 7.033]
  - - [2048, 512, 1, 128, 2048, 2048, 128, 128]
    - [6, 1.83]
  - - [2048, 512, 1, 256, 2048, 2048, 256, 256]
    - [49, 2.184]
  - - [2048, 512, 1, 512, 2048, 2048, 512, 512]
    - [15, 3.279]
  - - [2048, 512, 1, 1024, 2048, 2048, 1024, 1024]
    - [21, 4.589]
  - - [2048, 512, 1, 2048, 2048, 2048, 2048, 2048]
    - [20, 5.473]
  - - [2048, 512, 1, 4096, 2048, 2048, 4096, 4096]
    - [18, 6.212]
  - - [2048, 512, 1, 8192, 2048, 2048, 8192, 8192]
    - [16, 7.392]
  - - [2048, 1024, 1, 128, 2048, 2048, 128, 128]
    - [21, 1.823]
  - - [2048, 1024, 1, 256, 2048, 2048, 256, 256]
    - [20, 2.945]
  - - [2048, 1024, 1, 512, 2048, 2048, 512, 512]
    - [21, 4.03]
  - - [2048, 1024, 1, 1024, 2048, 2048, 1024, 1024]
    - [38, 5.276]
  - - [2048, 1024, 1, 2048, 2048, 2048, 2048, 2048]
    - [35, 6.0]
  - - [2048, 1024, 1, 4096, 2048, 2048, 4096, 4096]
    - [38, 7.068]
  - - [2048, 1024, 1, 8192, 2048, 2048, 8192, 8192]
    - [35, 7.815]
  - - [2048, 2048, 1, 128, 2048, 2048, 128, 128]
    - [10, 2.167]
  - - [2048, 2048, 1, 256, 2048, 2048, 256, 256]
    - [18, 3.35]
  - - [2048, 2048, 1, 512, 2048, 2048, 512, 512]
    - [15, 4.661]
  - - [2048, 2048, 1, 1024, 2048, 2048, 1024, 1024]
    - [41, 5.807]
  - - [2048, 2048, 1, 2048, 2048, 2048, 2048, 2048]
    - [35, 6.474]
  - - [2048, 2048, 1, 4096, 2048, 2048, 4096, 4096]
    - [34, 7.516]
  - - [2048, 2048, 1, 8192, 2048, 2048, 8192, 8192]
    - [33, 7.435]
  - - [2048, 4096, 1, 128, 2048, 2048, 128, 128]
    - [6, 2.35]
  - - [2048, 4096, 1, 256, 2048, 2048, 256, 256]
    - [18, 3.753]
  - - [2048, 4096, 1, 512, 2048, 2048, 512, 512]
    - [21, 4.892]
  - - [2048, 4096, 1, 1024, 2048, 2048, 1024, 1024]
    - [41, 5.972]
  - - [2048, 4096, 1, 2048, 2048, 2048, 2048, 2048]
    - [33, 6.592]
  - - [2048, 4096, 1, 4096, 2048, 2048, 4096, 4096]
    - [34, 7.834]
  - - [2048, 4096, 1, 8192, 2048, 2048, 8192, 8192]
    - [29, 8.007]
  - - [2048, 8192, 1, 128, 2048, 2048, 128, 128]
    - [21, 2.491]
  - - [2048, 8192, 1, 256, 2048, 2048, 256, 256]
    - [18, 3.865]
  - - [2048, 8192, 1, 512, 2048, 2048, 512, 512]
    - [17, 5.087]
  - - [2048, 8192, 1, 1024, 2048, 2048, 1024, 1024]
    - [31, 5.975]
  - - [2048, 8192, 1, 2048, 2048, 2048, 2048, 2048]
    - [34, 6.806]
  - - [2048, 8192, 1, 4096, 2048, 2048, 4096, 4096]
    - [40, 7.766]
  - - [2048, 8192, 1, 8192, 2048, 2048, 8192, 8192]
    - [31, 7.699]
  - - [4096, 128, 1, 128, 4096, 4096, 128, 128]
    - [20, 1.663]
  - - [4096, 128, 1, 256, 4096, 4096, 256, 256]
    - [34, 2.446]
  - - [4096, 128, 1, 512, 4096, 4096, 512, 512]
    - [18, 3.289]
  - - [4096, 128, 1, 1024, 4096, 4096, 1024, 1024]
    - [17, 4.044]
  - - [4096, 128, 1, 2048, 4096, 4096, 2048, 2048]
    - [22, 4.65]
  - - [4096, 128, 1, 4096, 4096, 4096, 4096, 4096]
    - [35, 5.911]
  - - [4096, 128, 1, 8192, 4096, 4096, 8192, 8192]
    - [30, 7.121]
  - - [4096, 256, 1, 128, 4096, 4096, 128, 128]
    - [3, 1.764]
  - - [4096, 256, 1, 256, 4096, 4096, 256, 256]
    - [49, 2.241]
  - - [4096, 256, 1, 512, 4096, 4096, 512, 512]
    - [21, 3.198]
  - - [4096, 256, 1, 1024, 4096, 4096, 1024, 1024]
    - [20, 4.658]
  - - [4096, 256, 1, 2048, 4096, 4096, 2048, 2048]
    - [21, 6.083]
  - - [4096, 256, 1, 4096, 4096, 4096, 4096, 4096]
    - [21, 6.945]
  - - [4096, 256, 1, 8192, 4096, 4096, 8192, 8192]
    - [21, 7.734]
  - - [4096, 512, 1, 128, 4096, 4096, 128, 128]
    - [21, 1.831]
  - - [4096, 512, 1, 256, 4096, 4096, 256, 256]
    - [31, 2.875]
  - - [4096, 512, 1, 512, 4096, 4096, 512, 512]
    - [26, 3.949]
  - - [4096, 512, 1, 1024, 4096, 4096, 1024, 1024]
    - [18, 4.938]
  - - [4096, 512, 1, 2048, 4096, 4096, 2048, 2048]
    - [31, 5.765]
  - - [4096, 512, 1, 4096, 4096, 4096, 4096, 4096]
    - [35, 6.948]
  - - [4096, 512, 1, 8192, 4096, 4096, 8192, 8192]
    - [35, 7.81]
  - - [4096, 1024, 1, 128, 4096, 4096, 128, 128]
    - [18, 2.234]
  - - [4096, 1024, 1, 256, 4096, 4096, 256, 256]
    - [35, 3.174]
  - - [4096, 1024, 1, 512, 4096, 4096, 512, 512]
    - [38, 4.567]
  - - [4096, 1024, 1, 1024, 4096, 4096, 1024, 1024]
    - [38, 5.741]
  - - [4096, 1024, 1, 2048, 4096, 4096, 2048, 2048]
    - [38, 6.474]
  - - [4096, 1024, 1, 4096, 4096, 4096, 4096, 4096]
    - [31, 7.257]
  - - [4096, 1024, 1, 8192, 4096, 4096, 8192, 8192]
    - [37, 8.239]
  - - [4096, 2048, 1, 128, 4096, 4096, 128, 128]
    - [18, 2.331]
  - - [4096, 2048, 1, 256, 4096, 4096, 256, 256]
    - [38, 3.501]
  - - [4096, 2048, 1, 512, 4096, 4096, 512, 512]
    - [38, 4.854]
  - - [4096, 2048, 1, 1024, 4096, 4096, 1024, 1024]
    - [34, 5.79]
  - - [4096, 2048, 1, 2048, 4096, 4096, 2048, 2048]
    - [38, 6.544]
  - - [4096, 2048, 1, 4096, 4096, 4096, 4096, 4096]
    - [28, 7.764]
  - - [4096, 2048, 1, 8192, 4096, 4096, 8192, 8192]
    - [37, 8.668]
  - - [4096, 4096, 1, 128, 4096, 4096, 128, 128]
    - [21, 2.489]
  - - [4096, 4096, 1, 256, 4096, 4096, 256, 256]
    - [21, 3.583]
  - - [4096, 4096, 1, 512, 4096, 4096, 512, 512]
    - [38, 4.941]
  - - [4096, 4096, 1, 1024, 4096, 4096, 1024, 1024]
    - [41, 5.998]
  - - [4096, 4096, 1, 2048, 4096, 4096, 2048, 2048]
    - [37, 6.627]
  - - [4096, 4096, 1, 4096, 4096, 4096, 4096, 4096]
    - [24, 7.915]
  - - [4096, 4096, 1, 8192, 4096, 4096, 8192, 8192]
    - [28, 8.071]
  - - [4096, 8192, 1, 128, 4096, 4096, 128, 128]
    - [6, 2.531]
  - - [4096, 8192, 1, 256, 4096, 4096, 256, 256]
    - [21, 3.64]
  - - [4096, 8192, 1, 512, 4096, 4096, 512, 512]
    - [20, 4.94]
  - - [4096, 8192, 1, 1024, 4096, 4096, 1024, 1024]
    - [31, 5.878]
  - - [4096, 8192, 1, 2048, 4096, 4096, 2048, 2048]
    - [30, 6.432]
  - - [4096, 8192, 1, 4096, 4096, 4096, 4096, 4096]
    - [27, 7.56]
  - - [4096, 8192, 1, 8192, 4096, 4096, 8192, 8192]
    - [36, 7.754]
  - - [8192, 128, 1, 128, 8192, 8192, 128, 128]
    - [6, 1.79]
  - - [8192, 128, 1, 256, 8192, 8192, 256, 256]
    - [15, 2.011]
  - - [8192, 128, 1, 512, 8192, 8192, 512, 512]
    - [18, 3.184]
  - - [8192, 128, 1, 1024, 8192, 8192, 1024, 1024]
    - [15, 4.542]
  - - [8192, 128, 1, 2048, 8192, 8192, 2048, 2048]
    - [15, 5.826]
  - - [8192, 128, 1, 4096, 8192, 8192, 4096, 4096]
    - [18, 6.981]
  - - [8192, 128, 1, 8192, 8192, 8192, 8192, 8192]
    - [20, 7.689]
  - - [8192, 256, 1, 128, 8192, 8192, 128, 128]
    - [6, 1.797]
  - - [8192, 256, 1, 256, 8192, 8192, 256, 256]
    - [31, 2.774]
  - - [8192, 256, 1, 512, 8192, 8192, 512, 512]
    - [38, 3.789]
  - - [8192, 256, 1, 1024, 8192, 8192, 1024, 1024]
    - [26, 4.774]
  - - [8192, 256, 1, 2048, 8192, 8192, 2048, 2048]
    - [18, 5.58]
  - - [8192, 256, 1, 4096, 8192, 8192, 4096, 4096]
    - [38, 6.931]
  - - [8192, 256, 1, 8192, 8192, 8192, 8192, 8192]
    - [40, 8.038]
  - - [8192, 512, 1, 128, 8192, 8192, 128, 128]
    - [4, 2.198]
  - - [8192, 512, 1, 256, 8192, 8192, 256, 256]
    - [38, 3.112]
  - - [8192, 512, 1, 512, 8192, 8192, 512, 512]
    - [26, 4.491]
  - - [8192, 512, 1, 1024, 8192, 8192, 1024, 1024]
    - [26, 5.501]
  - - [8192, 512, 1, 2048, 8192, 8192, 2048, 2048]
    - [38, 6.175]
  - - [8192, 512, 1, 4096, 8192, 8192, 4096, 4096]
    - [41, 7.462]
  - - [8192, 512, 1, 8192, 8192, 8192, 8192, 8192]
    - [31, 8.31]
  - - [8192, 1024, 1, 128, 8192, 8192, 128, 128]
    - [26, 2.245]
  - - [8192, 1024, 1, 256, 8192, 8192, 256, 256]
    - [28, 3.495]
  - - [8192, 1024, 1, 512, 8192, 8192, 512, 512]
    - [35, 4.857]
  - - [8192, 1024, 1, 1024, 8192, 8192, 1024, 1024]
    - [35, 5.904]
  - - [8192, 1024, 1, 2048, 8192, 8192, 2048, 2048]
    - [40, 6.388]
  - - [8192, 1024, 1, 4096, 8192, 8192, 4096, 4096]
    - [38, 8.029]
  - - [8192, 1024, 1, 8192, 8192, 8192, 8192, 8192]
    - [26, 8.698]
  - - [8192, 2048, 1, 128, 8192, 8192, 128, 128]
    - [28, 2.357]
  - - [8192, 2048, 1, 256, 8192, 8192, 256, 256]
    - [28, 3.548]
  - - [8192, 2048, 1, 512, 8192, 8192, 512, 512]
    - [34, 4.947]
  - - [8192, 2048, 1, 1024, 8192, 8192, 1024, 1024]
    - [35, 6.029]
  - - [8192, 2048, 1, 2048, 8192, 8192, 2048, 2048]
    - [35, 6.737]
  - - [8192, 2048, 1, 4096, 8192, 8192, 4096, 4096]
    - [24, 7.867]
  - - [8192, 2048, 1, 8192, 8192, 8192, 8192, 8192]
    - [31, 8.718]
  - - [8192, 4096, 1, 128, 8192, 8192, 128, 128]
    - [6, 2.398]
  - - [8192, 4096, 1, 256, 8192, 8192, 256, 256]
    - [26, 3.612]
  - - [8192, 4096, 1, 512, 8192, 8192, 512, 512]
    - [35, 4.98]
  - - [8192, 4096, 1, 1024, 8192, 8192, 1024, 1024]
    - [38, 5.979]
  - - [8192, 4096, 1, 2048, 8192, 8192, 2048, 2048]
    - [41, 6.681]
  - - [8192, 4096, 1, 4096, 8192, 8192, 4096, 4096]
    - [30, 7.916]
  - - [8192, 4096, 1, 8192, 8192, 8192, 8192, 8192]
    - [25, 7.666]
  - - [8192, 8192, 1, 128, 8192, 8192, 128, 128]
    - [11, 2.387]
  - - [8192, 8192, 1, 256, 8192, 8192, 256, 256]
    - [28, 3.609]
  - - [8192, 8192, 1, 512, 8192, 8192, 512, 512]
    - [35, 4.82]
  - - [8192, 8192, 1, 1024, 8192, 8192, 1024, 1024]
    - [35, 5.83]
  - - [8192, 8192, 1, 2048, 8192, 8192, 2048, 2048]
    - [38, 6.476]
  - - [8192, 8192, 1, 4096, 8192, 8192, 4096, 4096]
    - [38, 7.881]
  - - [8192, 8192, 1, 8192, 8192, 8192, 8192, 8192]
    - [31, 8.134]
  - - [1, 1, 1, 32, 1, 1, 32, 32]
    - [103, 0.0]
- null
- null
- ExperimentalStreamK
- GridBased
