library/src/amd_detail/rocblaslt/src/Tensile/Logic/asm_full/aquavanjaram/gfx942_38cu/StreamK/aquavanjaram942_Cijk_Alik_Bjlk_HSS_BH_UserArgs.yaml
- {MinimumRequiredVersion: 4.33.0}
- aquavanjaram942
- {Architecture: gfx942, CUCount: 38}
- [Device 0049, Device 0050]
    SolutionIndex: 0
    SolutionNameMin: Cijk_Alik_Bjlk_HSS_BH_UserArgs_MT256x256x32_MI16x16x1_SN_LDSB1_CLR1_GSU0_GSUC0_GSUWGMRR0_K1_LBSPPA128_LBSPPB2048_LPB16_MIWT8_8_PLR1_SU32_SUM0_SUS256_VWA2_VWB1_WGM1_WGMXCC1_WGMXCCGn1
    SolutionIndex: 1
    SolutionNameMin: Cijk_Alik_Bjlk_HSS_BH_UserArgs_MT256x256x32_MI16x16x1_SN_LDSB1_CLR1_GSU0_GSUC0_GSUWGMRR0_K1_LBSPPA256_LBSPPB2048_LPB16_MIWT8_8_PLR1_SU32_SUM0_SUS256_VWA4_VWB1_WGM1_WGMXCC1_WGMXCCGn1
    SolutionIndex: 2
    SolutionNameMin: Cijk_Alik_Bjlk_HSS_BH_UserArgs_MT256x256x32_MI16x16x1_SN_LDSB1_CLR1_GSU0_GSUC0_GSUWGMRR0_K1_LBSPPA128_LBSPPB2048_LPB32_MIWT8_8_PLR1_SU32_SUM0_SUS256_VWA2_VWB2_WGM1_WGMXCC1_WGMXCCGn1
    SolutionIndex: 3
    SolutionNameMin: Cijk_Alik_Bjlk_HSS_BH_UserArgs_MT256x256x32_MI16x16x1_SN_LDSB1_CLR1_GSU0_GSUC0_GSUWGMRR0_K1_LBSPPA256_LBSPPB2048_LPB32_MIWT8_8_PLR1_SU32_SUM0_SUS256_VWA4_VWB2_WGM1_WGMXCC1_WGMXCCGn1
    SolutionIndex: 4
    SolutionNameMin: Cijk_Alik_Bjlk_HSS_BH_UserArgs_MT256x256x32_MI16x16x1_SN_LDSB1_CLR1_GSU0_GSUC0_GSUWGMRR0_K1_LBSPPA128_LBSPPB2048_LPB0_MIWT8_8_PLR1_SU32_SUM0_SUS256_VWA1_VWB4_WGM1_WGMXCC1_WGMXCCGn1
    SolutionIndex: 5
    SolutionNameMin: Cijk_Alik_Bjlk_HSS_BH_UserArgs_MT256x256x32_MI16x16x1_SN_LDSB1_CLR1_GSU0_GSUC0_GSUWGMRR0_K1_LBSPPA128_LBSPPB2048_LPB0_MIWT8_8_PLR1_SU32_SUM0_SUS256_VWA2_VWB4_WGM1_WGMXCC1_WGMXCCGn1
    SolutionIndex: 6
    SolutionNameMin: Cijk_Alik_Bjlk_HSS_BH_UserArgs_MT256x256x32_MI16x16x1_SN_LDSB1_CLR1_GSU0_GSUC0_GSUWGMRR0_K1_LBSPPA256_LBSPPB2048_LPB0_MIWT8_8_PLR1_SU32_SUM0_SUS256_VWA4_VWB4_WGM1_WGMXCC1_WGMXCCGn1
    SolutionIndex: 7
    SolutionNameMin: Cijk_Alik_Bjlk_HSS_BH_UserArgs_MT256x256x32_MI16x16x1_SN_LDSB1_CLR1_GSU0_GSUC0_GSUWGMRR0_K1_LBSPPA512_LBSPPB2048_LPB0_MIWT8_8_PLR1_SU32_SUM0_SUS256_VWA8_VWB4_WGM1_WGMXCC1_WGMXCCGn1
    SolutionIndex: 8
    SolutionNameMin: Cijk_Alik_Bjlk_HSS_BH_UserArgs_MT256x256x32_MI16x16x1_SN_LDSB1_CLR1_GSU0_GSUC0_GSUWGMRR0_K1_LBSPPA128_LBSPPB2048_LPB0_MIWT8_8_PLR1_SU32_SUM0_SUS256_VWA1_VWB8_WGM1_WGMXCC1_WGMXCCGn1
    SolutionIndex: 9
    SolutionNameMin: Cijk_Alik_Bjlk_HSS_BH_UserArgs_MT256x256x32_MI16x16x1_SN_LDSB1_CLR1_GSU0_GSUC0_GSUWGMRR0_K1_LBSPPA128_LBSPPB2048_LPB0_MIWT8_8_PLR1_SU32_SUM0_SUS256_VWA2_VWB8_WGM1_WGMXCC1_WGMXCCGn1
    SolutionIndex: 10
    SolutionNameMin: Cijk_Alik_Bjlk_HSS_BH_UserArgs_MT256x256x32_MI16x16x1_SN_LDSB1_CLR1_GSU0_GSUC0_GSUWGMRR0_K1_LBSPPA256_LBSPPB2048_LPB0_MIWT8_8_PLR1_SU32_SUM0_SUS256_VWA4_VWB8_WGM1_WGMXCC1_WGMXCCGn1
    SolutionIndex: 11
    SolutionNameMin: Cijk_Alik_Bjlk_HSS_BH_UserArgs_MT256x256x32_MI16x16x1_SN_LDSB1_CLR1_GSU0_GSUC0_GSUWGMRR0_K1_LBSPPA128_LBSPPB2048_LPB32_MIWT8_8_PLR1_SU32_SUM0_SUS256_VWA1_VWB2_WGM4_WGMXCC1_WGMXCCGn1
    SolutionIndex: 12
    SolutionNameMin: Cijk_Alik_Bjlk_HSS_BH_UserArgs_MT256x256x32_MI16x16x1_SN_LDSB1_CLR1_GSU0_GSUC0_GSUWGMRR0_K1_LBSPPA256_LBSPPB2048_LPB32_MIWT8_8_PLR1_SU32_SUM0_SUS256_VWA4_VWB2_WGM4_WGMXCC1_WGMXCCGn1
    SolutionIndex: 13
    SolutionNameMin: Cijk_Alik_Bjlk_HSS_BH_UserArgs_MT256x256x32_MI16x16x1_SN_LDSB1_CLR1_GSU0_GSUC0_GSUWGMRR0_K1_LBSPPA128_LBSPPB2048_LPB0_MIWT8_8_PLR1_SU32_SUM0_SUS256_VWA2_VWB4_WGM4_WGMXCC1_WGMXCCGn1
    SolutionIndex: 14
    SolutionNameMin: Cijk_Alik_Bjlk_HSS_BH_UserArgs_MT256x256x32_MI16x16x1_SN_LDSB1_CLR1_GSU0_GSUC0_GSUWGMRR0_K1_LBSPPA256_LBSPPB2048_LPB0_MIWT8_8_PLR1_SU32_SUM0_SUS256_VWA4_VWB4_WGM4_WGMXCC1_WGMXCCGn1
    SolutionIndex: 15
    SolutionNameMin: Cijk_Alik_Bjlk_HSS_BH_UserArgs_MT256x256x32_MI16x16x1_SN_LDSB1_CLR1_GSU0_GSUC0_GSUWGMRR0_K1_LBSPPA128_LBSPPB2048_LPB0_MIWT8_8_PLR1_SU32_SUM0_SUS256_VWA2_VWB8_WGM4_WGMXCC1_WGMXCCGn1
    SolutionIndex: 16
    SolutionNameMin: Cijk_Alik_Bjlk_HSS_BH_UserArgs_MT256x256x32_MI16x16x1_SN_LDSB1_CLR1_GSU0_GSUC0_GSUWGMRR0_K1_LBSPPA256_LBSPPB2048_LPB0_MIWT8_8_PLR1_SU32_SUM0_SUS256_VWA4_VWB8_WGM4_WGMXCC1_WGMXCCGn1
    SolutionIndex: 17
    SolutionNameMin: Cijk_Alik_Bjlk_HSS_BH_UserArgs_MT256x256x32_MI16x16x1_SN_LDSB1_CLR1_GSU0_GSUC0_GSUWGMRR0_K1_LBSPPA128_LBSPPB2048_LPB16_MIWT8_8_PLR1_SU32_SUM0_SUS256_VWA1_VWB1_WGM8_WGMXCC1_WGMXCCGn1
    SolutionIndex: 18
    SolutionNameMin: Cijk_Alik_Bjlk_HSS_BH_UserArgs_MT256x256x32_MI16x16x1_SN_LDSB1_CLR1_GSU0_GSUC0_GSUWGMRR0_K1_LBSPPA256_LBSPPB2048_LPB16_MIWT8_8_PLR1_SU32_SUM0_SUS256_VWA4_VWB1_WGM8_WGMXCC1_WGMXCCGn1
    SolutionIndex: 19
    SolutionNameMin: Cijk_Alik_Bjlk_HSS_BH_UserArgs_MT256x256x32_MI16x16x1_SN_LDSB1_CLR1_GSU0_GSUC0_GSUWGMRR0_K1_LBSPPA256_LBSPPB2048_LPB32_MIWT8_8_PLR1_SU32_SUM0_SUS256_VWA4_VWB2_WGM8_WGMXCC1_WGMXCCGn1
    SolutionIndex: 20
    SolutionNameMin: Cijk_Alik_Bjlk_HSS_BH_UserArgs_MT256x256x32_MI16x16x1_SN_LDSB1_CLR1_GSU0_GSUC0_GSUWGMRR0_K1_LBSPPA128_LBSPPB2048_LPB0_MIWT8_8_PLR1_SU32_SUM0_SUS256_VWA1_VWB4_WGM8_WGMXCC1_WGMXCCGn1
    SolutionIndex: 21
    SolutionNameMin: Cijk_Alik_Bjlk_HSS_BH_UserArgs_MT256x256x32_MI16x16x1_SN_LDSB1_CLR1_GSU0_GSUC0_GSUWGMRR0_K1_LBSPPA128_LBSPPB2048_LPB0_MIWT8_8_PLR1_SU32_SUM0_SUS256_VWA2_VWB4_WGM8_WGMXCC1_WGMXCCGn1
    SolutionIndex: 22
    SolutionNameMin: Cijk_Alik_Bjlk_HSS_BH_UserArgs_MT256x256x32_MI16x16x1_SN_LDSB1_CLR1_GSU0_GSUC0_GSUWGMRR0_K1_LBSPPA256_LBSPPB2048_LPB0_MIWT8_8_PLR1_SU32_SUM0_SUS256_VWA4_VWB4_WGM8_WGMXCC1_WGMXCCGn1
    SolutionIndex: 23
    SolutionNameMin: Cijk_Alik_Bjlk_HSS_BH_UserArgs_MT256x256x32_MI16x16x1_SN_LDSB1_CLR1_GSU0_GSUC0_GSUWGMRR0_K1_LBSPPA128_LBSPPB2048_LPB0_MIWT8_8_PLR1_SU32_SUM0_SUS256_VWA2_VWB8_WGM8_WGMXCC1_WGMXCCGn1
    SolutionIndex: 24
    SolutionNameMin: Cijk_Alik_Bjlk_HSS_BH_UserArgs_MT256x256x32_MI16x16x1_SN_LDSB1_CLR1_GSU0_GSUC0_GSUWGMRR0_K1_LBSPPA256_LBSPPB2048_LPB0_MIWT8_8_PLR1_SU32_SUM0_SUS256_VWA4_VWB8_WGM8_WGMXCC1_WGMXCCGn1
    SolutionIndex: 25
    SolutionNameMin: Cijk_Alik_Bjlk_HSS_BH_UserArgs_MT256x256x32_MI16x16x1_SN_LDSB1_CLR1_GSU0_GSUC0_GSUWGMRR0_K1_LBSPPA512_LBSPPB2048_LPB0_MIWT8_8_PLR1_SU32_SUM0_SUS256_VWA8_VWB8_WGM8_WGMXCC1_WGMXCCGn1
    SolutionIndex: 26
    SolutionNameMin: Cijk_Alik_Bjlk_HSS_BH_UserArgs_MT128x256x32_MI16x16x1_SN_LDSB1_CLR1_GSU0_GSUC0_GSUWGMRR0_K1_LBSPPA128_LBSPPB2048_LPB32_MIWT4_8_PLR1_SU32_SUM0_SUS256_VWA1_VWB2_WGM1_WGMXCC1_WGMXCCGn1
    SolutionIndex: 27
    SolutionNameMin: Cijk_Alik_Bjlk_HSS_BH_UserArgs_MT128x256x32_MI16x16x1_SN_LDSB1_CLR1_GSU0_GSUC0_GSUWGMRR0_K1_LBSPPA256_LBSPPB2048_LPB32_MIWT4_8_PLR1_SU32_SUM0_SUS256_VWA4_VWB2_WGM1_WGMXCC1_WGMXCCGn1
    SolutionIndex: 28
    SolutionNameMin: Cijk_Alik_Bjlk_HSS_BH_UserArgs_MT128x256x32_MI16x16x1_SN_LDSB1_CLR1_GSU0_GSUC0_GSUWGMRR0_K1_LBSPPA256_LBSPPB2048_LPB0_MIWT4_8_PLR1_SU32_SUM0_SUS256_VWA4_VWB4_WGM1_WGMXCC1_WGMXCCGn1
    SolutionIndex: 29
    SolutionNameMin: Cijk_Alik_Bjlk_HSS_BH_UserArgs_MT128x256x32_MI16x16x1_SN_LDSB1_CLR1_GSU0_GSUC0_GSUWGMRR0_K1_LBSPPA256_LBSPPB2048_LPB0_MIWT4_8_PLR1_SU32_SUM0_SUS256_VWA4_VWB8_WGM1_WGMXCC1_WGMXCCGn1
    SolutionIndex: 30
    SolutionNameMin: Cijk_Alik_Bjlk_HSS_BH_UserArgs_MT128x256x32_MI16x16x1_SN_LDSB1_CLR1_GSU0_GSUC0_GSUWGMRR0_K1_LBSPPA128_LBSPPB2048_LPB32_MIWT4_8_PLR1_SU32_SUM0_SUS256_VWA2_VWB2_WGM4_WGMXCC1_WGMXCCGn1
    SolutionIndex: 31
    SolutionNameMin: Cijk_Alik_Bjlk_HSS_BH_UserArgs_MT128x256x32_MI16x16x1_SN_LDSB1_CLR1_GSU0_GSUC0_GSUWGMRR0_K1_LBSPPA256_LBSPPB2048_LPB32_MIWT4_8_PLR1_SU32_SUM0_SUS256_VWA4_VWB2_WGM4_WGMXCC1_WGMXCCGn1
    SolutionIndex: 32
    SolutionNameMin: Cijk_Alik_Bjlk_HSS_BH_UserArgs_MT128x256x32_MI16x16x1_SN_LDSB1_CLR1_GSU0_GSUC0_GSUWGMRR0_K1_LBSPPA256_LBSPPB2048_LPB0_MIWT4_8_PLR1_SU32_SUM0_SUS256_VWA4_VWB4_WGM4_WGMXCC1_WGMXCCGn1
    SolutionIndex: 33
    SolutionNameMin: Cijk_Alik_Bjlk_HSS_BH_UserArgs_MT128x256x32_MI16x16x1_SN_LDSB1_CLR1_GSU0_GSUC0_GSUWGMRR0_K1_LBSPPA128_LBSPPB2048_LPB0_MIWT4_8_PLR1_SU32_SUM0_SUS256_VWA2_VWB8_WGM4_WGMXCC1_WGMXCCGn1
    SolutionIndex: 34
    SolutionNameMin: Cijk_Alik_Bjlk_HSS_BH_UserArgs_MT128x256x32_MI16x16x1_SN_LDSB1_CLR1_GSU0_GSUC0_GSUWGMRR0_K1_LBSPPA256_LBSPPB2048_LPB0_MIWT4_8_PLR1_SU32_SUM0_SUS256_VWA4_VWB8_WGM4_WGMXCC1_WGMXCCGn1
    SolutionIndex: 35
    SolutionNameMin: Cijk_Alik_Bjlk_HSS_BH_UserArgs_MT128x256x32_MI16x16x1_SN_LDSB1_CLR1_GSU0_GSUC0_GSUWGMRR0_K1_LBSPPA128_LBSPPB2048_LPB0_MIWT4_8_PLR1_SU32_SUM0_SUS256_VWA1_VWB4_WGM8_WGMXCC1_WGMXCCGn1
    SolutionIndex: 36
    SolutionNameMin: Cijk_Alik_Bjlk_HSS_BH_UserArgs_MT128x256x32_MI16x16x1_SN_LDSB1_CLR1_GSU0_GSUC0_GSUWGMRR0_K1_LBSPPA256_LBSPPB2048_LPB0_MIWT4_8_PLR1_SU32_SUM0_SUS256_VWA4_VWB4_WGM8_WGMXCC1_WGMXCCGn1
    SolutionIndex: 37
    SolutionNameMin: Cijk_Alik_Bjlk_HSS_BH_UserArgs_MT128x256x32_MI16x16x1_SN_LDSB1_CLR1_GSU0_GSUC0_GSUWGMRR0_K1_LBSPPA128_LBSPPB2048_LPB0_MIWT4_8_PLR1_SU32_SUM0_SUS256_VWA2_VWB8_WGM8_WGMXCC1_WGMXCCGn1
    SolutionIndex: 38
    SolutionNameMin: Cijk_Alik_Bjlk_HSS_BH_UserArgs_MT128x256x32_MI16x16x1_SN_LDSB1_CLR1_GSU0_GSUC0_GSUWGMRR0_K1_LBSPPA256_LBSPPB2048_LPB0_MIWT4_8_PLR1_SU32_SUM0_SUS256_VWA4_VWB8_WGM8_WGMXCC1_WGMXCCGn1
    SolutionIndex: 39
    SolutionNameMin: Cijk_Alik_Bjlk_HSS_BH_UserArgs_MT256x128x32_MI16x16x1_SN_LDSB1_CLR1_GSU0_GSUC0_GSUWGMRR0_K1_LBSPPA256_LBSPPB1024_LPB32_MIWT8_4_PLR1_SU32_SUM0_SUS256_VWA4_VWB2_WGM1_WGMXCC1_WGMXCCGn1
    SolutionIndex: 40
    SolutionNameMin: Cijk_Alik_Bjlk_HSS_BH_UserArgs_MT256x128x32_MI16x16x1_SN_LDSB1_CLR1_GSU0_GSUC0_GSUWGMRR0_K1_LBSPPA128_LBSPPB1024_LPB0_MIWT8_4_PLR1_SU32_SUM0_SUS256_VWA1_VWB4_WGM1_WGMXCC1_WGMXCCGn1
    SolutionIndex: 41
    SolutionNameMin: Cijk_Alik_Bjlk_HSS_BH_UserArgs_MT256x128x32_MI16x16x1_SN_LDSB1_CLR1_GSU0_GSUC0_GSUWGMRR0_K1_LBSPPA128_LBSPPB1024_LPB0_MIWT8_4_PLR1_SU32_SUM0_SUS256_VWA2_VWB4_WGM1_WGMXCC1_WGMXCCGn1
    SolutionIndex: 42
    SolutionNameMin: Cijk_Alik_Bjlk_HSS_BH_UserArgs_MT256x128x32_MI16x16x1_SN_LDSB1_CLR1_GSU0_GSUC0_GSUWGMRR0_K1_LBSPPA256_LBSPPB1024_LPB0_MIWT8_4_PLR1_SU32_SUM0_SUS256_VWA4_VWB4_WGM4_WGMXCC1_WGMXCCGn1
    SolutionIndex: 43
    SolutionNameMin: Cijk_Alik_Bjlk_HSS_BH_UserArgs_MT128x128x32_MI16x16x1_SN_LDSB1_CLR1_GSU0_GSUC0_GSUWGMRR0_K1_LBSPPA256_LBSPPB1024_LPB16_MIWT4_4_PLR1_SU32_SUM0_SUS256_VWA4_VWB1_WGM1_WGMXCC1_WGMXCCGn1
    SolutionIndex: 44
    SolutionNameMin: Cijk_Alik_Bjlk_HSS_BH_UserArgs_MT128x128x32_MI16x16x1_SN_LDSB1_CLR1_GSU0_GSUC0_GSUWGMRR0_K1_LBSPPA256_LBSPPB1024_LPB32_MIWT4_4_PLR1_SU32_SUM0_SUS256_VWA4_VWB2_WGM1_WGMXCC1_WGMXCCGn1
    SolutionIndex: 45
    SolutionNameMin: Cijk_Alik_Bjlk_HSS_BH_UserArgs_MT128x128x32_MI16x16x1_SN_LDSB1_CLR1_GSU0_GSUC0_GSUWGMRR0_K1_LBSPPA128_LBSPPB1024_LPB0_MIWT4_4_PLR1_SU32_SUM0_SUS256_VWA1_VWB4_WGM1_WGMXCC1_WGMXCCGn1
    SolutionIndex: 46
    SolutionNameMin: Cijk_Alik_Bjlk_HSS_BH_UserArgs_MT128x128x32_MI16x16x1_SN_LDSB1_CLR1_GSU0_GSUC0_GSUWGMRR0_K1_LBSPPA128_LBSPPB1024_LPB0_MIWT4_4_PLR1_SU32_SUM0_SUS256_VWA2_VWB4_WGM1_WGMXCC1_WGMXCCGn1
    SolutionIndex: 47
    SolutionNameMin: Cijk_Alik_Bjlk_HSS_BH_UserArgs_MT128x128x32_MI16x16x1_SN_LDSB1_CLR1_GSU0_GSUC0_GSUWGMRR0_K1_LBSPPA256_LBSPPB1024_LPB0_MIWT4_4_PLR1_SU32_SUM0_SUS256_VWA4_VWB4_WGM1_WGMXCC1_WGMXCCGn1
    SolutionIndex: 48
    SolutionNameMin: Cijk_Alik_Bjlk_HSS_BH_UserArgs_MT64x128x32_MI16x16x1_SN_LDSB0_CLR1_GSU0_GSUC0_GSUWGMRR0_K1_LBSPPA128_LBSPPB1024_LPB0_MIWT2_4_PLR1_SU32_SUM0_SUS256_VWA1_VWB4_WGM1_WGMXCC1_WGMXCCGn1
    SolutionIndex: 49
    SolutionNameMin: Cijk_Alik_Bjlk_HSS_BH_UserArgs_MT64x128x32_MI16x16x1_SN_LDSB0_CLR0_GSU0_GSUC0_GSUWGMRR0_K1_LBSPPA128_LBSPPB1024_LPB0_MIWT2_4_PLR0_SU32_SUM0_SUS256_VWA1_VWB4_WGM1_WGMXCC1_WGMXCCGn1
    SolutionIndex: 50
    SolutionNameMin: Cijk_Alik_Bjlk_HSS_BH_UserArgs_MT128x64x32_MI16x16x1_SN_LDSB0_CLR1_GSU0_GSUC0_GSUWGMRR0_K1_LBSPPA256_LBSPPB512_LPB32_MIWT4_2_PLR1_SU32_SUM0_SUS256_VWA4_VWB2_WGM1_WGMXCC1_WGMXCCGn1
    SolutionIndex: 51
    SolutionNameMin: Cijk_Alik_Bjlk_HSS_BH_UserArgs_MT64x64x32_MI16x16x1_SN_LDSB0_CLR1_GSU0_GSUC0_GSUWGMRR0_K1_LBSPPA128_LBSPPB512_LPB32_MIWT2_2_PLR1_SU32_SUM0_SUS256_VWA1_VWB2_WGM1_WGMXCC1_WGMXCCGn1
    SolutionIndex: 52
    SolutionNameMin: Cijk_Alik_Bjlk_HSS_BH_UserArgs_MT64x64x32_MI16x16x1_SN_LDSB0_CLR1_GSU0_GSUC0_GSUWGMRR0_K1_LBSPPA128_LBSPPB512_LPB32_MIWT2_2_PLR1_SU32_SUM0_SUS256_VWA2_VWB2_WGM1_WGMXCC1_WGMXCCGn1
    SolutionIndex: 53
    SolutionNameMin: Cijk_Alik_Bjlk_HSS_BH_UserArgs_MT64x32x32_MI16x16x1_SN_LDSB0_CLR0_GSU0_GSUC0_GSUWGMRR0_K1_LBSPPA128_LBSPPB256_LPB16_MIWT2_1_PLR0_SU32_SUM0_SUS256_VWA2_VWB1_WGM1_WGMXCC1_WGMXCCGn1
    SolutionIndex: 54
    SolutionNameMin: Cijk_Alik_Bjlk_HSS_BH_UserArgs_MT32x32x32_MI16x16x1_SN_LDSB0_CLR0_GSU0_GSUC0_GSUWGMRR0_K1_LBSPPA128_LBSPPB256_LPB16_MIWT1_1_PLR0_SU32_SUM0_SUS256_VWA1_VWB1_WGM1_WGMXCC1_WGMXCCGn1
    SolutionIndex: 55
    SolutionNameMin: Cijk_Alik_Bjlk_HSS_BH_UserArgs_MT32x32x32_MI16x16x1_SN_LDSB0_CLR0_GSU0_GSUC0_GSUWGMRR0_K1_LBSPPA128_LBSPPB256_LPB16_MIWT1_1_PLR0_SU32_SUM0_SUS256_VWA1_VWB1_WGM8_WGMXCC1_WGMXCCGn1
    SolutionIndex: 56
    SolutionNameMin: Cijk_Alik_Bjlk_HSS_BH_UserArgs_MT128x256x64_MI16x16x1_SN_LDSB1_CLR1_GSU0_GSUC0_GSUWGMRR0_K1_LBSPPA512_LBSPPB4096_LPB32_MIWT4_8_PLR1_SU32_SUM0_SUS256_VWA4_VWB2_WGM1_WGMXCC1_WGMXCCGn1
    SolutionIndex: 57
    SolutionNameMin: Cijk_Alik_Bjlk_HSS_BH_UserArgs_MT128x256x64_MI16x16x1_SN_LDSB1_CLR1_GSU0_GSUC0_GSUWGMRR0_K1_LBSPPA512_LBSPPB4096_LPB0_MIWT4_8_PLR1_SU32_SUM0_SUS256_VWA4_VWB4_WGM1_WGMXCC1_WGMXCCGn1
    SolutionIndex: 58
    SolutionNameMin: Cijk_Alik_Bjlk_HSS_BH_UserArgs_MT128x256x64_MI16x16x1_SN_LDSB1_CLR1_GSU0_GSUC0_GSUWGMRR0_K1_LBSPPA512_LBSPPB4096_LPB0_MIWT4_8_PLR1_SU32_SUM0_SUS256_VWA4_VWB8_WGM1_WGMXCC1_WGMXCCGn1
    SolutionIndex: 59
    SolutionNameMin: Cijk_Alik_Bjlk_HSS_BH_UserArgs_MT128x256x64_MI16x16x1_SN_LDSB1_CLR1_GSU0_GSUC0_GSUWGMRR0_K1_LBSPPA512_LBSPPB4096_LPB0_MIWT4_8_PLR1_SU32_SUM0_SUS256_VWA4_VWB4_WGM4_WGMXCC1_WGMXCCGn1
    SolutionIndex: 60
    SolutionNameMin: Cijk_Alik_Bjlk_HSS_BH_UserArgs_MT128x256x64_MI16x16x1_SN_LDSB1_CLR1_GSU0_GSUC0_GSUWGMRR0_K1_LBSPPA128_LBSPPB4096_LPB0_MIWT4_8_PLR1_SU32_SUM0_SUS256_VWA1_VWB4_WGM8_WGMXCC1_WGMXCCGn1
    SolutionIndex: 61
    SolutionNameMin: Cijk_Alik_Bjlk_HSS_BH_UserArgs_MT128x256x64_MI16x16x1_SN_LDSB1_CLR1_GSU0_GSUC0_GSUWGMRR0_K1_LBSPPA512_LBSPPB4096_LPB0_MIWT4_8_PLR1_SU32_SUM0_SUS256_VWA4_VWB4_WGM8_WGMXCC1_WGMXCCGn1
    SolutionIndex: 62
    SolutionNameMin: Cijk_Alik_Bjlk_HSS_BH_UserArgs_MT256x128x64_MI16x16x1_SN_LDSB1_CLR1_GSU0_GSUC0_GSUWGMRR0_K1_LBSPPA512_LBSPPB2048_LPB16_MIWT8_4_PLR1_SU32_SUM0_SUS256_VWA4_VWB1_WGM1_WGMXCC1_WGMXCCGn1
    SolutionIndex: 63
    SolutionNameMin: Cijk_Alik_Bjlk_HSS_BH_UserArgs_MT256x128x64_MI16x16x1_SN_LDSB1_CLR1_GSU0_GSUC0_GSUWGMRR0_K1_LBSPPA512_LBSPPB2048_LPB32_MIWT8_4_PLR1_SU32_SUM0_SUS256_VWA4_VWB2_WGM1_WGMXCC1_WGMXCCGn1
    SolutionIndex: 64
    SolutionNameMin: Cijk_Alik_Bjlk_HSS_BH_UserArgs_MT256x128x64_MI16x16x1_SN_LDSB1_CLR1_GSU0_GSUC0_GSUWGMRR0_K1_LBSPPA128_LBSPPB2048_LPB0_MIWT8_4_PLR1_SU32_SUM0_SUS256_VWA1_VWB4_WGM1_WGMXCC1_WGMXCCGn1
    SolutionIndex: 65
    SolutionNameMin: Cijk_Alik_Bjlk_HSS_BH_UserArgs_MT256x128x64_MI16x16x1_SN_LDSB1_CLR1_GSU0_GSUC0_GSUWGMRR0_K1_LBSPPA256_LBSPPB2048_LPB0_MIWT8_4_PLR1_SU32_SUM0_SUS256_VWA2_VWB4_WGM1_WGMXCC1_WGMXCCGn1
    SolutionIndex: 66
    SolutionNameMin: Cijk_Alik_Bjlk_HSS_BH_UserArgs_MT256x128x64_MI16x16x1_SN_LDSB1_CLR1_GSU0_GSUC0_GSUWGMRR0_K1_LBSPPA512_LBSPPB2048_LPB0_MIWT8_4_PLR1_SU32_SUM0_SUS256_VWA4_VWB4_WGM1_WGMXCC1_WGMXCCGn1
    SolutionIndex: 67
    SolutionNameMin: Cijk_Alik_Bjlk_HSS_BH_UserArgs_MT256x128x64_MI16x16x1_SN_LDSB1_CLR1_GSU0_GSUC0_GSUWGMRR0_K1_LBSPPA512_LBSPPB2048_LPB32_MIWT8_4_PLR1_SU32_SUM0_SUS256_VWA4_VWB2_WGM4_WGMXCC1_WGMXCCGn1
    SolutionIndex: 68
    SolutionNameMin: Cijk_Alik_Bjlk_HSS_BH_UserArgs_MT256x128x64_MI16x16x1_SN_LDSB1_CLR1_GSU0_GSUC0_GSUWGMRR0_K1_LBSPPA128_LBSPPB2048_LPB0_MIWT8_4_PLR1_SU32_SUM0_SUS256_VWA1_VWB4_WGM4_WGMXCC1_WGMXCCGn1
    SolutionIndex: 69
    SolutionNameMin: Cijk_Alik_Bjlk_HSS_BH_UserArgs_MT256x128x64_MI16x16x1_SN_LDSB1_CLR1_GSU0_GSUC0_GSUWGMRR0_K1_LBSPPA512_LBSPPB2048_LPB0_MIWT8_4_PLR1_SU32_SUM0_SUS256_VWA4_VWB4_WGM4_WGMXCC1_WGMXCCGn1
    SolutionIndex: 70
    SolutionNameMin: Cijk_Alik_Bjlk_HSS_BH_UserArgs_MT256x128x64_MI16x16x1_SN_LDSB1_CLR1_GSU0_GSUC0_GSUWGMRR0_K1_LBSPPA512_LBSPPB2048_LPB0_MIWT8_4_PLR1_SU32_SUM0_SUS256_VWA4_VWB4_WGM8_WGMXCC1_WGMXCCGn1
    SolutionIndex: 71
    SolutionNameMin: Cijk_Alik_Bjlk_HSS_BH_UserArgs_MT128x128x64_MI16x16x1_SN_LDSB1_CLR1_GSU0_GSUC0_GSUWGMRR0_K1_LBSPPA512_LBSPPB2048_LPB32_MIWT4_4_PLR1_SU32_SUM0_SUS256_VWA4_VWB2_WGM1_WGMXCC1_WGMXCCGn1
    SolutionIndex: 72
    SolutionNameMin: Cijk_Alik_Bjlk_HSS_BH_UserArgs_MT128x128x64_MI16x16x1_SN_LDSB1_CLR1_GSU0_GSUC0_GSUWGMRR0_K1_LBSPPA128_LBSPPB2048_LPB0_MIWT4_4_PLR1_SU32_SUM0_SUS256_VWA1_VWB4_WGM1_WGMXCC1_WGMXCCGn1
    SolutionIndex: 73
    SolutionNameMin: Cijk_Alik_Bjlk_HSS_BH_UserArgs_MT128x128x64_MI16x16x1_SN_LDSB1_CLR1_GSU0_GSUC0_GSUWGMRR0_K1_LBSPPA256_LBSPPB2048_LPB0_MIWT4_4_PLR1_SU32_SUM0_SUS256_VWA2_VWB4_WGM1_WGMXCC1_WGMXCCGn1
    SolutionIndex: 74
    SolutionNameMin: Cijk_Alik_Bjlk_HSS_BH_UserArgs_MT128x128x64_MI16x16x1_SN_LDSB1_CLR1_GSU0_GSUC0_GSUWGMRR0_K1_LBSPPA512_LBSPPB2048_LPB0_MIWT4_4_PLR1_SU32_SUM0_SUS256_VWA4_VWB4_WGM1_WGMXCC1_WGMXCCGn1
    SolutionIndex: 75
    SolutionNameMin: Cijk_Alik_Bjlk_HSS_BH_UserArgs_MT128x128x64_MI16x16x1_SN_LDSB1_CLR1_GSU0_GSUC0_GSUWGMRR0_K1_LBSPPA256_LBSPPB2048_LPB32_MIWT4_4_PLR1_SU32_SUM0_SUS256_VWA2_VWB2_WGM4_WGMXCC1_WGMXCCGn1
    SolutionIndex: 76
    SolutionNameMin: Cijk_Alik_Bjlk_HSS_BH_UserArgs_MT128x128x64_MI16x16x1_SN_LDSB1_CLR1_GSU0_GSUC0_GSUWGMRR0_K1_LBSPPA128_LBSPPB2048_LPB0_MIWT4_4_PLR1_SU32_SUM0_SUS256_VWA1_VWB4_WGM4_WGMXCC1_WGMXCCGn1
    SolutionIndex: 77
    SolutionNameMin: Cijk_Alik_Bjlk_HSS_BH_UserArgs_MT128x128x64_MI16x16x1_SN_LDSB1_CLR1_GSU0_GSUC0_GSUWGMRR0_K1_LBSPPA256_LBSPPB2048_LPB0_MIWT4_4_PLR1_SU32_SUM0_SUS256_VWA2_VWB4_WGM4_WGMXCC1_WGMXCCGn1
    SolutionIndex: 78
    SolutionNameMin: Cijk_Alik_Bjlk_HSS_BH_UserArgs_MT128x128x64_MI16x16x1_SN_LDSB1_CLR1_GSU0_GSUC0_GSUWGMRR0_K1_LBSPPA512_LBSPPB2048_LPB0_MIWT4_4_PLR1_SU32_SUM0_SUS256_VWA4_VWB4_WGM4_WGMXCC1_WGMXCCGn1
    SolutionIndex: 79
    SolutionNameMin: Cijk_Alik_Bjlk_HSS_BH_UserArgs_MT128x128x64_MI16x16x1_SN_LDSB1_CLR1_GSU0_GSUC0_GSUWGMRR0_K1_LBSPPA512_LBSPPB2048_LPB32_MIWT4_4_PLR1_SU32_SUM0_SUS256_VWA4_VWB2_WGM8_WGMXCC1_WGMXCCGn1
    SolutionIndex: 80
    SolutionNameMin: Cijk_Alik_Bjlk_HSS_BH_UserArgs_MT128x128x64_MI16x16x1_SN_LDSB1_CLR1_GSU0_GSUC0_GSUWGMRR0_K1_LBSPPA256_LBSPPB2048_LPB0_MIWT4_4_PLR1_SU32_SUM0_SUS256_VWA2_VWB4_WGM8_WGMXCC1_WGMXCCGn1
    SolutionIndex: 81
    SolutionNameMin: Cijk_Alik_Bjlk_HSS_BH_UserArgs_MT128x128x64_MI16x16x1_SN_LDSB1_CLR1_GSU0_GSUC0_GSUWGMRR0_K1_LBSPPA512_LBSPPB2048_LPB0_MIWT4_4_PLR1_SU32_SUM0_SUS256_VWA4_VWB4_WGM8_WGMXCC1_WGMXCCGn1
    SolutionIndex: 82
    SolutionNameMin: Cijk_Alik_Bjlk_HSS_BH_UserArgs_MT64x128x64_MI16x16x1_SN_LDSB1_CLR1_GSU0_GSUC0_GSUWGMRR0_K1_LBSPPA128_LBSPPB2048_LPB0_MIWT2_4_PLR1_SU32_SUM0_SUS256_VWA1_VWB4_WGM1_WGMXCC1_WGMXCCGn1
    SolutionIndex: 83
    SolutionNameMin: Cijk_Alik_Bjlk_HSS_BH_UserArgs_MT64x128x64_MI16x16x1_SN_LDSB1_CLR1_GSU0_GSUC0_GSUWGMRR0_K1_LBSPPA256_LBSPPB2048_LPB0_MIWT2_4_PLR1_SU32_SUM0_SUS256_VWA2_VWB4_WGM1_WGMXCC1_WGMXCCGn1
    SolutionIndex: 84
    SolutionNameMin: Cijk_Alik_Bjlk_HSS_BH_UserArgs_MT128x64x64_MI16x16x1_SN_LDSB1_CLR1_GSU0_GSUC0_GSUWGMRR0_K1_LBSPPA128_LBSPPB1024_LPB32_MIWT4_2_PLR1_SU32_SUM0_SUS256_VWA1_VWB2_WGM1_WGMXCC1_WGMXCCGn1
    SolutionIndex: 85
    SolutionNameMin: Cijk_Alik_Bjlk_HSS_BH_UserArgs_MT64x64x64_MI16x16x1_SN_LDSB1_CLR1_GSU0_GSUC0_GSUWGMRR0_K1_LBSPPA128_LBSPPB1024_LPB32_MIWT2_2_PLR1_SU32_SUM0_SUS256_VWA1_VWB2_WGM1_WGMXCC1_WGMXCCGn1
    SolutionIndex: 86
    SolutionNameMin: Cijk_Alik_Bjlk_HSS_BH_UserArgs_MT32x64x64_MI16x16x1_SN_LDSB0_CLR1_GSU0_GSUC0_GSUWGMRR0_K1_LBSPPA128_LBSPPB1024_LPB32_MIWT1_2_PLR1_SU32_SUM0_SUS256_VWA1_VWB2_WGM1_WGMXCC1_WGMXCCGn1
    SolutionIndex: 87
    SolutionNameMin: Cijk_Alik_Bjlk_HSS_BH_UserArgs_MT32x64x64_MI16x16x1_SN_LDSB0_CLR1_GSU0_GSUC0_GSUWGMRR0_K1_LBSPPA128_LBSPPB1024_LPB16_MIWT1_2_PLR2_SU32_SUM0_SUS256_VWA1_VWB1_WGM1_WGMXCC1_WGMXCCGn1
    SolutionIndex: 88
    SolutionNameMin: Cijk_Alik_Bjlk_HSS_BH_UserArgs_MT32x64x64_MI16x16x1_SN_LDSB0_CLR1_GSU0_GSUC0_GSUWGMRR0_K1_LBSPPA128_LBSPPB1024_LPB32_MIWT1_2_PLR2_SU32_SUM0_SUS256_VWA1_VWB2_WGM1_WGMXCC1_WGMXCCGn1
    SolutionIndex: 89
    SolutionNameMin: Cijk_Alik_Bjlk_HSS_BH_UserArgs_MT64x32x64_MI16x16x1_SN_LDSB0_CLR1_GSU0_GSUC0_GSUWGMRR0_K1_LBSPPA256_LBSPPB512_LPB16_MIWT2_1_PLR1_SU32_SUM0_SUS256_VWA2_VWB1_WGM1_WGMXCC1_WGMXCCGn1
    SolutionIndex: 90
    SolutionNameMin: Cijk_Alik_Bjlk_HSS_BH_UserArgs_MT32x32x64_MI16x16x1_SN_LDSB0_CLR1_GSU0_GSUC0_GSUWGMRR0_K1_LBSPPA128_LBSPPB512_LPB16_MIWT1_1_PLR1_SU32_SUM0_SUS256_VWA1_VWB1_WGM1_WGMXCC1_WGMXCCGn1
    SolutionIndex: 91
    SolutionNameMin: Cijk_Alik_Bjlk_HSS_BH_UserArgs_MT32x32x64_MI16x16x1_SN_LDSB0_CLR1_GSU0_GSUC0_GSUWGMRR0_K1_LBSPPA128_LBSPPB512_LPB16_MIWT1_1_PLR2_SU32_SUM0_SUS256_VWA1_VWB1_WGM1_WGMXCC1_WGMXCCGn1
    SolutionIndex: 92
    SolutionNameMin: Cijk_Alik_Bjlk_HSS_BH_UserArgs_MT32x32x64_MI16x16x1_SN_LDSB0_CLR1_GSU0_GSUC0_GSUWGMRR0_K1_LBSPPA128_LBSPPB512_LPB16_MIWT1_1_PLR1_SU32_SUM0_SUS256_VWA1_VWB1_WGM4_WGMXCC1_WGMXCCGn1
    SolutionIndex: 93
    SolutionNameMin: Cijk_Alik_Bjlk_HSS_BH_UserArgs_MT64x128x128_MI16x16x1_SN_LDSB1_CLR1_GSU0_GSUC0_GSUWGMRR0_K1_LBSPPA512_LBSPPB2048_LPB0_MIWT2_4_PLR1_SU32_SUM0_SUS256_VWA2_VWB4_WGM1_WGMXCC1_WGMXCCGn1
    SolutionIndex: 94
    SolutionNameMin: Cijk_Alik_Bjlk_HSS_BH_UserArgs_MT64x128x128_MI16x16x1_SN_LDSB1_CLR1_GSU0_GSUC0_GSUWGMRR0_K1_LBSPPA256_LBSPPB2048_LPB0_MIWT2_4_PLR2_SU32_SUM0_SUS256_VWA1_VWB4_WGM1_WGMXCC1_WGMXCCGn1
    SolutionIndex: 95
    SolutionNameMin: Cijk_Alik_Bjlk_HSS_BH_UserArgs_MT64x128x128_MI16x16x1_SN_LDSB1_CLR1_GSU0_GSUC0_GSUWGMRR0_K1_LBSPPA512_LBSPPB2048_LPB0_MIWT2_4_PLR2_SU32_SUM0_SUS256_VWA2_VWB4_WGM1_WGMXCC1_WGMXCCGn1
    SolutionIndex: 96
    SolutionNameMin: Cijk_Alik_Bjlk_HSS_BH_UserArgs_MT128x64x128_MI16x16x1_SN_LDSB1_CLR1_GSU0_GSUC0_GSUWGMRR0_K1_LBSPPA256_LBSPPB1024_LPB32_MIWT4_2_PLR2_SU32_SUM0_SUS256_VWA1_VWB2_WGM1_WGMXCC1_WGMXCCGn1
    SolutionIndex: 97
    SolutionNameMin: Cijk_Alik_Bjlk_HSS_BH_UserArgs_MT128x64x128_MI16x16x1_SN_LDSB1_CLR1_GSU0_GSUC0_GSUWGMRR0_K1_LBSPPA1024_LBSPPB1024_LPB32_MIWT4_2_PLR2_SU32_SUM0_SUS256_VWA4_VWB2_WGM1_WGMXCC1_WGMXCCGn1
    SolutionIndex: 98
    SolutionNameMin: Cijk_Alik_Bjlk_HSS_BH_UserArgs_MT128x64x128_MI16x16x1_SN_LDSB1_CLR1_GSU0_GSUC0_GSUWGMRR0_K1_LBSPPA256_LBSPPB1024_LPB32_MIWT4_2_PLR2_SU32_SUM0_SUS256_VWA1_VWB2_WGM4_WGMXCC1_WGMXCCGn1
    SolutionIndex: 99
    SolutionNameMin: Cijk_Alik_Bjlk_HSS_BH_UserArgs_MT128x64x128_MI16x16x1_SN_LDSB1_CLR1_GSU0_GSUC0_GSUWGMRR0_K1_LBSPPA512_LBSPPB1024_LPB32_MIWT4_2_PLR2_SU32_SUM0_SUS256_VWA2_VWB2_WGM4_WGMXCC1_WGMXCCGn1
    SolutionIndex: 100
    SolutionNameMin: Cijk_Alik_Bjlk_HSS_BH_UserArgs_MT128x64x128_MI16x16x1_SN_LDSB1_CLR1_GSU0_GSUC0_GSUWGMRR0_K1_LBSPPA1024_LBSPPB1024_LPB32_MIWT4_2_PLR2_SU32_SUM0_SUS256_VWA4_VWB2_WGM4_WGMXCC1_WGMXCCGn1
    SolutionIndex: 101
    SolutionNameMin: Cijk_Alik_Bjlk_HSS_BH_UserArgs_MT64x64x128_MI16x16x1_SN_LDSB1_CLR1_GSU0_GSUC0_GSUWGMRR0_K1_LBSPPA256_LBSPPB1024_LPB32_MIWT2_2_PLR2_SU32_SUM0_SUS256_VWA1_VWB2_WGM1_WGMXCC1_WGMXCCGn1
    SolutionIndex: 102
    SolutionNameMin: Cijk_Alik_Bjlk_HSS_BH_UserArgs_MT64x64x128_MI16x16x1_SN_LDSB1_CLR1_GSU0_GSUC0_GSUWGMRR0_K1_LBSPPA512_LBSPPB1024_LPB32_MIWT2_2_PLR2_SU32_SUM0_SUS256_VWA2_VWB2_WGM1_WGMXCC1_WGMXCCGn1
    SolutionIndex: 103
    SolutionNameMin: Cijk_Alik_Bjlk_HSS_BH_UserArgs_MT64x64x128_MI16x16x1_SN_LDSB1_CLR1_GSU0_GSUC0_GSUWGMRR0_K1_LBSPPA256_LBSPPB1024_LPB32_MIWT2_2_PLR2_SU32_SUM0_SUS256_VWA1_VWB2_WGM4_WGMXCC1_WGMXCCGn1
    SolutionIndex: 104
    SolutionNameMin: Cijk_Alik_Bjlk_HSS_BH_UserArgs_MT64x64x128_MI16x16x1_SN_LDSB1_CLR1_GSU0_GSUC0_GSUWGMRR0_K1_LBSPPA256_LBSPPB1024_LPB32_MIWT2_2_PLR2_SU32_SUM0_SUS256_VWA1_VWB2_WGM8_WGMXCC1_WGMXCCGn1
    SolutionIndex: 105
    SolutionNameMin: Cijk_Alik_Bjlk_HSS_BH_UserArgs_MT64x64x128_MI16x16x1_SN_LDSB1_CLR1_GSU0_GSUC0_GSUWGMRR0_K1_LBSPPA512_LBSPPB1024_LPB32_MIWT2_2_PLR2_SU32_SUM0_SUS256_VWA2_VWB2_WGM8_WGMXCC1_WGMXCCGn1
    SolutionIndex: 106
    SolutionNameMin: Cijk_Alik_Bjlk_HSS_BH_UserArgs_MT32x64x128_MI16x16x1_SN_LDSB1_CLR1_GSU0_GSUC0_GSUWGMRR0_K1_LBSPPA256_LBSPPB1024_LPB32_MIWT1_2_PLR1_SU32_SUM0_SUS256_VWA1_VWB2_WGM1_WGMXCC1_WGMXCCGn1
    SolutionIndex: 107
    SolutionNameMin: Cijk_Alik_Bjlk_HSS_BH_UserArgs_MT32x64x128_MI16x16x1_SN_LDSB1_CLR1_GSU0_GSUC0_GSUWGMRR0_K1_LBSPPA256_LBSPPB1024_LPB32_MIWT1_2_PLR2_SU32_SUM0_SUS256_VWA1_VWB2_WGM1_WGMXCC1_WGMXCCGn1
    SolutionIndex: 108
    SolutionNameMin: Cijk_Alik_Bjlk_HSS_BH_UserArgs_MT32x64x128_MI16x16x1_SN_LDSB1_CLR1_GSU0_GSUC0_GSUWGMRR0_K1_LBSPPA256_LBSPPB1024_LPB32_MIWT1_2_PLR2_SU32_SUM0_SUS256_VWA1_VWB2_WGM8_WGMXCC1_WGMXCCGn1
    SolutionIndex: 109
    SolutionNameMin: Cijk_Alik_Bjlk_HSS_BH_UserArgs_MT64x32x128_MI16x16x1_SN_LDSB1_CLR1_GSU0_GSUC0_GSUWGMRR0_K1_LBSPPA512_LBSPPB512_LPB16_MIWT2_1_PLR2_SU32_SUM0_SUS256_VWA2_VWB1_WGM1_WGMXCC1_WGMXCCGn1
    SolutionIndex: 110
    SolutionNameMin: Cijk_Alik_Bjlk_HSS_BH_UserArgs_MT32x32x128_MI16x16x1_SN_LDSB1_CLR1_GSU0_GSUC0_GSUWGMRR0_K1_LBSPPA256_LBSPPB512_LPB16_MIWT1_1_PLR1_SU32_SUM0_SUS256_VWA1_VWB1_WGM1_WGMXCC1_WGMXCCGn1
    SolutionIndex: 111
    SolutionNameMin: Cijk_Alik_Bjlk_HSS_BH_UserArgs_MT32x32x128_MI16x16x1_SN_LDSB1_CLR1_GSU0_GSUC0_GSUWGMRR0_K1_LBSPPA256_LBSPPB512_LPB16_MIWT1_1_PLR2_SU32_SUM0_SUS256_VWA1_VWB1_WGM1_WGMXCC1_WGMXCCGn1
    SolutionIndex: 112
    SolutionNameMin: Cijk_Alik_Bjlk_HSS_BH_UserArgs_MT32x32x128_MI16x16x1_SN_LDSB1_CLR1_GSU0_GSUC0_GSUWGMRR0_K1_LBSPPA256_LBSPPB512_LPB16_MIWT1_1_PLR1_SU32_SUM0_SUS256_VWA1_VWB1_WGM8_WGMXCC1_WGMXCCGn1
    SolutionIndex: 113
    SolutionNameMin: Cijk_Alik_Bjlk_HSS_BH_UserArgs_MT64x32x128_MI16x16x1_SN_LDSB1_CLR1_GSU0_GSUC0_GSUWGMRR0_K1_LBSPPA512_LBSPPB256_LPB16_MIWT2_1_PLR1_SU32_SUM0_SUS256_VWA2_VWB1_WGM1_WGMXCC1_WGMXCCGn1
- - - [128, 128, 1, 128, 128, 128, 128, 128]
    - [53, 0.078]
  - - [128, 128, 1, 256, 128, 128, 256, 128]
    - [91, 0.155]
  - - [128, 128, 1, 512, 128, 128, 512, 128]
    - [110, 0.268]
  - - [128, 128, 1, 1024, 128, 128, 1024, 128]
    - [110, 0.403]
  - - [128, 128, 1, 2048, 128, 128, 2048, 128]
    - [111, 0.578]
  - - [128, 128, 1, 4096, 128, 128, 4096, 128]
    - [89, 0.871]
  - - [128, 128, 1, 8192, 128, 128, 8192, 128]
    - [107, 1.369]
  - - [128, 256, 1, 128, 128, 128, 128, 256]
    - [54, 0.161]
  - - [128, 256, 1, 256, 128, 128, 256, 256]
    - [112, 0.304]
  - - [128, 256, 1, 512, 128, 128, 512, 256]
    - [90, 0.523]
  - - [128, 256, 1, 1024, 128, 128, 1024, 256]
    - [110, 0.786]
  - - [128, 256, 1, 2048, 128, 128, 2048, 256]
    - [111, 1.051]
  - - [128, 256, 1, 4096, 128, 128, 4096, 256]
    - [107, 1.484]
  - - [128, 256, 1, 8192, 128, 128, 8192, 256]
    - [104, 2.259]
  - - [128, 512, 1, 128, 128, 128, 128, 512]
    - [88, 0.311]
  - - [128, 512, 1, 256, 128, 128, 256, 512]
    - [89, 0.564]
  - - [128, 512, 1, 512, 128, 128, 512, 512]
    - [109, 0.921]
  - - [128, 512, 1, 1024, 128, 128, 1024, 512]
    - [107, 1.343]
  - - [128, 512, 1, 2048, 128, 128, 2048, 512]
    - [107, 1.8]
  - - [128, 512, 1, 4096, 128, 128, 4096, 512]
    - [101, 2.298]
  - - [128, 512, 1, 8192, 128, 128, 8192, 512]
    - [97, 3.587]
  - - [128, 1024, 1, 128, 128, 128, 128, 1024]
    - [85, 0.564]
  - - [128, 1024, 1, 256, 128, 128, 256, 1024]
    - [102, 0.962]
  - - [128, 1024, 1, 512, 128, 128, 512, 1024]
    - [101, 1.533]
  - - [128, 1024, 1, 1024, 128, 128, 1024, 1024]
    - [101, 2.27]
  - - [128, 1024, 1, 2048, 128, 128, 2048, 1024]
    - [105, 2.649]
  - - [128, 1024, 1, 4096, 128, 128, 4096, 1024]
    - [81, 3.437]
  - - [128, 1024, 1, 8192, 128, 128, 8192, 1024]
    - [97, 4.469]
  - - [128, 2048, 1, 128, 128, 128, 128, 2048]
    - [48, 0.944]
  - - [128, 2048, 1, 256, 128, 128, 256, 2048]
    - [83, 1.556]
  - - [128, 2048, 1, 512, 128, 128, 512, 2048]
    - [83, 2.282]
  - - [128, 2048, 1, 1024, 128, 128, 1024, 2048]
    - [96, 3.261]
  - - [128, 2048, 1, 2048, 128, 128, 2048, 2048]
    - [96, 4.23]
  - - [128, 2048, 1, 4096, 128, 128, 4096, 2048]
    - [98, 4.968]
  - - [128, 2048, 1, 8192, 128, 128, 8192, 2048]
    - [73, 5.69]
  - - [128, 4096, 1, 128, 128, 128, 128, 4096]
    - [46, 1.184]
  - - [128, 4096, 1, 256, 128, 128, 256, 4096]
    - [47, 2.016]
  - - [128, 4096, 1, 512, 128, 128, 512, 4096]
    - [78, 3.124]
  - - [128, 4096, 1, 1024, 128, 128, 1024, 4096]
    - [74, 4.37]
  - - [128, 4096, 1, 2048, 128, 128, 2048, 4096]
    - [80, 5.539]
  - - [128, 4096, 1, 4096, 128, 128, 4096, 4096]
    - [71, 5.956]
  - - [128, 4096, 1, 8192, 128, 128, 8192, 4096]
    - [81, 7.191]
  - - [128, 8192, 1, 128, 128, 128, 128, 8192]
    - [27, 1.614]
  - - [128, 8192, 1, 256, 128, 128, 256, 8192]
    - [28, 2.662]
  - - [128, 8192, 1, 512, 128, 128, 512, 8192]
    - [28, 3.956]
  - - [128, 8192, 1, 1024, 128, 128, 1024, 8192]
    - [36, 5.215]
  - - [128, 8192, 1, 2048, 128, 128, 2048, 8192]
    - [57, 6.097]
  - - [128, 8192, 1, 4096, 128, 128, 4096, 8192]
    - [78, 7.327]
  - - [128, 8192, 1, 8192, 128, 128, 8192, 8192]
    - [59, 8.196]
  - - [256, 128, 1, 128, 256, 256, 128, 128]
    - [55, 0.164]
  - - [256, 128, 1, 256, 256, 256, 256, 128]
    - [92, 0.302]
  - - [256, 128, 1, 512, 256, 256, 512, 128]
    - [110, 0.515]
  - - [256, 128, 1, 1024, 256, 256, 1024, 128]
    - [111, 0.794]
  - - [256, 128, 1, 2048, 256, 256, 2048, 128]
    - [111, 1.049]
  - - [256, 128, 1, 4096, 256, 256, 4096, 128]
    - [107, 1.461]
  - - [256, 128, 1, 8192, 256, 256, 8192, 128]
    - [101, 2.202]
  - - [256, 256, 1, 128, 256, 256, 128, 256]
    - [106, 0.313]
  - - [256, 256, 1, 256, 256, 256, 256, 256]
    - [86, 0.564]
  - - [256, 256, 1, 512, 256, 256, 512, 256]
    - [107, 0.939]
  - - [256, 256, 1, 1024, 256, 256, 1024, 256]
    - [107, 1.391]
  - - [256, 256, 1, 2048, 256, 256, 2048, 256]
    - [107, 1.808]
  - - [256, 256, 1, 4096, 256, 256, 4096, 256]
    - [82, 2.301]
  - - [256, 256, 1, 8192, 256, 256, 8192, 256]
    - [97, 3.274]
  - - [256, 512, 1, 128, 256, 256, 128, 512]
    - [85, 0.569]
  - - [256, 512, 1, 256, 256, 256, 256, 512]
    - [85, 0.982]
  - - [256, 512, 1, 512, 256, 256, 512, 512]
    - [101, 1.568]
  - - [256, 512, 1, 1024, 256, 256, 1024, 512]
    - [102, 2.29]
  - - [256, 512, 1, 2048, 256, 256, 2048, 512]
    - [103, 2.922]
  - - [256, 512, 1, 4096, 256, 256, 4096, 512]
    - [100, 3.56]
  - - [256, 512, 1, 8192, 256, 256, 8192, 512]
    - [78, 4.521]
  - - [256, 1024, 1, 128, 256, 256, 128, 1024]
    - [48, 0.935]
  - - [256, 1024, 1, 256, 256, 256, 256, 1024]
    - [82, 1.578]
  - - [256, 1024, 1, 512, 256, 256, 512, 1024]
    - [96, 2.392]
  - - [256, 1024, 1, 1024, 256, 256, 1024, 1024]
    - [97, 3.306]
  - - [256, 1024, 1, 2048, 256, 256, 2048, 1024]
    - [96, 4.202]
  - - [256, 1024, 1, 4096, 256, 256, 4096, 1024]
    - [71, 4.377]
  - - [256, 1024, 1, 8192, 256, 256, 8192, 1024]
    - [77, 5.797]
  - - [256, 2048, 1, 128, 256, 256, 128, 2048]
    - [44, 1.216]
  - - [256, 2048, 1, 256, 256, 256, 256, 2048]
    - [75, 1.931]
  - - [256, 2048, 1, 512, 256, 256, 512, 2048]
    - [74, 3.166]
  - - [256, 2048, 1, 1024, 256, 256, 1024, 2048]
    - [73, 4.423]
  - - [256, 2048, 1, 2048, 256, 256, 2048, 2048]
    - [81, 5.572]
  - - [256, 2048, 1, 4096, 256, 256, 4096, 2048]
    - [59, 5.888]
  - - [256, 2048, 1, 8192, 256, 256, 8192, 2048]
    - [6, 6.08]
  - - [256, 4096, 1, 128, 256, 256, 128, 4096]
    - [30, 1.6]
  - - [256, 4096, 1, 256, 256, 256, 256, 4096]
    - [38, 2.633]
  - - [256, 4096, 1, 512, 256, 256, 512, 4096]
    - [57, 3.882]
  - - [256, 4096, 1, 1024, 256, 256, 1024, 4096]
    - [32, 5.275]
  - - [256, 4096, 1, 2048, 256, 256, 2048, 4096]
    - [59, 6.392]
  - - [256, 4096, 1, 4096, 256, 256, 4096, 4096]
    - [70, 7.394]
  - - [256, 4096, 1, 8192, 256, 256, 8192, 4096]
    - [65, 8.044]
  - - [256, 8192, 1, 128, 256, 256, 128, 8192]
    - [5, 1.865]
  - - [256, 8192, 1, 256, 256, 256, 256, 8192]
    - [6, 3.056]
  - - [256, 8192, 1, 512, 256, 256, 512, 8192]
    - [13, 4.366]
  - - [256, 8192, 1, 1024, 256, 256, 1024, 8192]
    - [1, 5.878]
  - - [256, 8192, 1, 2048, 256, 256, 2048, 8192]
    - [40, 7.057]
  - - [256, 8192, 1, 4096, 256, 256, 4096, 8192]
    - [10, 8.196]
  - - [256, 8192, 1, 8192, 256, 256, 8192, 8192]
    - [6, 9.116]
  - - [512, 128, 1, 128, 512, 512, 128, 128]
    - [87, 0.306]
  - - [512, 128, 1, 256, 512, 512, 256, 128]
    - [86, 0.579]
  - - [512, 128, 1, 512, 512, 512, 512, 128]
    - [107, 0.916]
  - - [512, 128, 1, 1024, 512, 512, 1024, 128]
    - [107, 1.376]
  - - [512, 128, 1, 2048, 512, 512, 2048, 128]
    - [108, 1.768]
  - - [512, 128, 1, 4096, 512, 512, 4096, 128]
    - [101, 2.425]
  - - [512, 128, 1, 8192, 512, 512, 8192, 128]
    - [97, 3.379]
  - - [512, 256, 1, 128, 512, 512, 128, 256]
    - [52, 0.582]
  - - [512, 256, 1, 256, 512, 512, 256, 256]
    - [101, 0.986]
  - - [512, 256, 1, 512, 512, 512, 512, 256]
    - [102, 1.58]
  - - [512, 256, 1, 1024, 512, 512, 1024, 256]
    - [101, 2.31]
  - - [512, 256, 1, 2048, 512, 512, 2048, 256]
    - [101, 2.944]
  - - [512, 256, 1, 4096, 512, 512, 4096, 256]
    - [74, 3.663]
  - - [512, 256, 1, 8192, 512, 512, 8192, 256]
    - [74, 4.627]
  - - [512, 512, 1, 128, 512, 512, 128, 512]
    - [82, 0.952]
  - - [512, 512, 1, 256, 512, 512, 256, 512]
    - [82, 1.586]
  - - [512, 512, 1, 512, 512, 512, 512, 512]
    - [95, 2.409]
  - - [512, 512, 1, 1024, 512, 512, 1024, 512]
    - [97, 3.463]
  - - [512, 512, 1, 2048, 512, 512, 2048, 512]
    - [99, 4.057]
  - - [512, 512, 1, 4096, 512, 512, 4096, 512]
    - [78, 4.889]
  - - [512, 512, 1, 8192, 512, 512, 8192, 512]
    - [94, 5.153]
  - - [512, 1024, 1, 128, 512, 512, 128, 1024]
    - [47, 1.247]
  - - [512, 1024, 1, 256, 512, 512, 256, 1024]
    - [47, 2.02]
  - - [512, 1024, 1, 512, 512, 512, 512, 1024]
    - [74, 3.199]
  - - [512, 1024, 1, 1024, 512, 512, 1024, 1024]
    - [78, 4.482]
  - - [512, 1024, 1, 2048, 512, 512, 2048, 1024]
    - [78, 5.406]
  - - [512, 1024, 1, 4096, 512, 512, 4096, 1024]
    - [78, 5.982]
  - - [512, 1024, 1, 8192, 512, 512, 8192, 1024]
    - [57, 7.086]
  - - [512, 2048, 1, 128, 512, 512, 128, 2048]
    - [29, 1.554]
  - - [512, 2048, 1, 256, 512, 512, 256, 2048]
    - [29, 2.636]
  - - [512, 2048, 1, 512, 512, 512, 512, 2048]
    - [29, 3.964]
  - - [512, 2048, 1, 1024, 512, 512, 1024, 2048]
    - [42, 5.243]
  - - [512, 2048, 1, 2048, 512, 512, 2048, 2048]
    - [60, 6.367]
  - - [512, 2048, 1, 4096, 512, 512, 4096, 2048]
    - [61, 7.239]
  - - [512, 2048, 1, 8192, 512, 512, 8192, 2048]
    - [69, 8.082]
  - - [512, 4096, 1, 128, 512, 512, 128, 4096]
    - [10, 1.795]
  - - [512, 4096, 1, 256, 512, 512, 256, 4096]
    - [8, 2.984]
  - - [512, 4096, 1, 512, 512, 512, 512, 4096]
    - [22, 4.414]
  - - [512, 4096, 1, 1024, 512, 512, 1024, 4096]
    - [0, 5.783]
  - - [512, 4096, 1, 2048, 512, 512, 2048, 4096]
    - [61, 7.009]
  - - [512, 4096, 1, 4096, 512, 512, 4096, 4096]
    - [6, 8.077]
  - - [512, 4096, 1, 8192, 512, 512, 8192, 4096]
    - [14, 9.021]
  - - [512, 8192, 1, 128, 512, 512, 128, 8192]
    - [27, 1.891]
  - - [512, 8192, 1, 256, 512, 512, 256, 8192]
    - [64, 2.876]
  - - [512, 8192, 1, 512, 512, 512, 512, 8192]
    - [10, 4.689]
  - - [512, 8192, 1, 1024, 512, 512, 1024, 8192]
    - [22, 6.175]
  - - [512, 8192, 1, 2048, 512, 512, 2048, 8192]
    - [14, 7.869]
  - - [512, 8192, 1, 4096, 512, 512, 4096, 8192]
    - [22, 8.764]
  - - [512, 8192, 1, 8192, 512, 512, 8192, 8192]
    - [22, 9.419]
  - - [1024, 128, 1, 128, 1024, 1024, 128, 128]
    - [51, 0.588]
  - - [1024, 128, 1, 256, 1024, 1024, 256, 128]
    - [85, 0.997]
  - - [1024, 128, 1, 512, 1024, 1024, 512, 128]
    - [102, 1.596]
  - - [1024, 128, 1, 1024, 1024, 1024, 1024, 128]
    - [102, 2.221]
  - - [1024, 128, 1, 2048, 1024, 1024, 2048, 128]
    - [102, 2.836]
  - - [1024, 128, 1, 4096, 1024, 1024, 4096, 128]
    - [81, 3.558]
  - - [1024, 128, 1, 8192, 1024, 1024, 8192, 128]
    - [78, 4.476]
  - - [1024, 256, 1, 128, 1024, 1024, 128, 256]
    - [49, 0.964]
  - - [1024, 256, 1, 256, 1024, 1024, 256, 256]
    - [82, 1.606]
  - - [1024, 256, 1, 512, 1024, 1024, 512, 256]
    - [98, 2.389]
  - - [1024, 256, 1, 1024, 1024, 1024, 1024, 256]
    - [97, 3.208]
  - - [1024, 256, 1, 2048, 1024, 1024, 2048, 256]
    - [95, 3.975]
  - - [1024, 256, 1, 4096, 1024, 1024, 4096, 256]
    - [74, 4.979]
  - - [1024, 256, 1, 8192, 1024, 1024, 8192, 256]
    - [78, 5.862]
  - - [1024, 512, 1, 128, 1024, 1024, 128, 512]
    - [45, 1.2]
  - - [1024, 512, 1, 256, 1024, 1024, 256, 512]
    - [81, 1.986]
  - - [1024, 512, 1, 512, 1024, 1024, 512, 512]
    - [74, 3.141]
  - - [1024, 512, 1, 1024, 1024, 1024, 1024, 512]
    - [72, 4.528]
  - - [1024, 512, 1, 2048, 1024, 1024, 2048, 512]
    - [80, 5.383]
  - - [1024, 512, 1, 4096, 1024, 1024, 4096, 512]
    - [74, 6.203]
  - - [1024, 512, 1, 8192, 1024, 1024, 8192, 512]
    - [32, 7.037]
  - - [1024, 1024, 1, 128, 1024, 1024, 128, 1024]
    - [37, 1.557]
  - - [1024, 1024, 1, 256, 1024, 1024, 256, 1024]
    - [33, 2.642]
  - - [1024, 1024, 1, 512, 1024, 1024, 512, 1024]
    - [29, 3.935]
  - - [1024, 1024, 1, 1024, 1024, 1024, 1024, 1024]
    - [28, 5.376]
  - - [1024, 1024, 1, 2048, 1024, 1024, 2048, 1024]
    - [61, 6.485]
  - - [1024, 1024, 1, 4096, 1024, 1024, 4096, 1024]
    - [59, 7.255]
  - - [1024, 1024, 1, 8192, 1024, 1024, 8192, 1024]
    - [14, 8.154]
  - - [1024, 2048, 1, 128, 1024, 1024, 128, 2048]
    - [9, 1.854]
  - - [1024, 2048, 1, 256, 1024, 1024, 256, 2048]
    - [23, 3.058]
  - - [1024, 2048, 1, 512, 1024, 1024, 512, 2048]
    - [24, 4.531]
  - - [1024, 2048, 1, 1024, 1024, 1024, 1024, 2048]
    - [24, 5.978]
  - - [1024, 2048, 1, 2048, 1024, 1024, 2048, 2048]
    - [57, 6.89]
  - - [1024, 2048, 1, 4096, 1024, 1024, 4096, 2048]
    - [16, 8.027]
  - - [1024, 2048, 1, 8192, 1024, 1024, 8192, 2048]
    - [14, 9.036]
  - - [1024, 4096, 1, 128, 1024, 1024, 128, 4096]
    - [29, 1.897]
  - - [1024, 4096, 1, 256, 1024, 1024, 256, 4096]
    - [63, 3.041]
  - - [1024, 4096, 1, 512, 1024, 1024, 512, 4096]
    - [22, 4.696]
  - - [1024, 4096, 1, 1024, 1024, 1024, 1024, 4096]
    - [5, 6.085]
  - - [1024, 4096, 1, 2048, 1024, 1024, 2048, 4096]
    - [6, 7.757]
  - - [1024, 4096, 1, 4096, 1024, 1024, 4096, 4096]
    - [4, 8.538]
  - - [1024, 4096, 1, 8192, 1024, 1024, 8192, 4096]
    - [4, 9.359]
  - - [1024, 8192, 1, 128, 1024, 1024, 128, 8192]
    - [29, 2.084]
  - - [1024, 8192, 1, 256, 1024, 1024, 256, 8192]
    - [39, 3.332]
  - - [1024, 8192, 1, 512, 1024, 1024, 512, 8192]
    - [32, 5.082]
  - - [1024, 8192, 1, 1024, 1024, 1024, 1024, 8192]
    - [24, 6.716]
  - - [1024, 8192, 1, 2048, 1024, 1024, 2048, 8192]
    - [6, 8.068]
  - - [1024, 8192, 1, 4096, 1024, 1024, 4096, 8192]
    - [22, 8.829]
  - - [1024, 8192, 1, 8192, 1024, 1024, 8192, 8192]
    - [23, 9.379]
  - - [2048, 128, 1, 128, 2048, 2048, 128, 128]
    - [50, 0.953]
  - - [2048, 128, 1, 256, 2048, 2048, 256, 128]
    - [84, 1.62]
  - - [2048, 128, 1, 512, 2048, 2048, 512, 128]
    - [96, 2.347]
  - - [2048, 128, 1, 1024, 2048, 2048, 1024, 128]
    - [93, 3.072]
  - - [2048, 128, 1, 2048, 2048, 2048, 2048, 128]
    - [95, 3.865]
  - - [2048, 128, 1, 4096, 2048, 2048, 4096, 128]
    - [74, 4.826]
  - - [2048, 128, 1, 8192, 2048, 2048, 8192, 128]
    - [78, 6.151]
  - - [2048, 256, 1, 128, 2048, 2048, 128, 256]
    - [44, 1.226]
  - - [2048, 256, 1, 256, 2048, 2048, 256, 256]
    - [44, 1.989]
  - - [2048, 256, 1, 512, 2048, 2048, 512, 256]
    - [79, 3.202]
  - - [2048, 256, 1, 1024, 2048, 2048, 1024, 256]
    - [78, 4.505]
  - - [2048, 256, 1, 2048, 2048, 2048, 2048, 256]
    - [72, 4.943]
  - - [2048, 256, 1, 4096, 2048, 2048, 4096, 256]
    - [57, 5.926]
  - - [2048, 256, 1, 8192, 2048, 2048, 8192, 256]
    - [59, 7.345]
  - - [2048, 512, 1, 128, 2048, 2048, 128, 512]
    - [29, 1.572]
  - - [2048, 512, 1, 256, 2048, 2048, 256, 512]
    - [29, 2.658]
  - - [2048, 512, 1, 512, 2048, 2048, 512, 512]
    - [31, 4.048]
  - - [2048, 512, 1, 1024, 2048, 2048, 1024, 512]
    - [35, 5.306]
  - - [2048, 512, 1, 2048, 2048, 2048, 2048, 512]
    - [59, 6.445]
  - - [2048, 512, 1, 4096, 2048, 2048, 4096, 512]
    - [57, 7.37]
  - - [2048, 512, 1, 8192, 2048, 2048, 8192, 512]
    - [66, 8.008]
  - - [2048, 1024, 1, 128, 2048, 2048, 128, 1024]
    - [10, 1.877]
  - - [2048, 1024, 1, 256, 2048, 2048, 256, 1024]
    - [16, 3.082]
  - - [2048, 1024, 1, 512, 2048, 2048, 512, 1024]
    - [24, 4.535]
  - - [2048, 1024, 1, 1024, 2048, 2048, 1024, 1024]
    - [4, 5.966]
  - - [2048, 1024, 1, 2048, 2048, 2048, 2048, 1024]
    - [57, 6.996]
  - - [2048, 1024, 1, 4096, 2048, 2048, 4096, 1024]
    - [4, 7.966]
  - - [2048, 1024, 1, 8192, 2048, 2048, 8192, 1024]
    - [3, 8.912]
  - - [2048, 2048, 1, 128, 2048, 2048, 128, 2048]
    - [28, 1.903]
  - - [2048, 2048, 1, 256, 2048, 2048, 256, 2048]
    - [57, 3.035]
  - - [2048, 2048, 1, 512, 2048, 2048, 512, 2048]
    - [6, 4.707]
  - - [2048, 2048, 1, 1024, 2048, 2048, 1024, 2048]
    - [14, 6.326]
  - - [2048, 2048, 1, 2048, 2048, 2048, 2048, 2048]
    - [22, 7.683]
  - - [2048, 2048, 1, 4096, 2048, 2048, 4096, 2048]
    - [6, 8.68]
  - - [2048, 2048, 1, 8192, 2048, 2048, 8192, 2048]
    - [8, 9.307]
  - - [2048, 4096, 1, 128, 2048, 2048, 128, 4096]
    - [58, 2.137]
  - - [2048, 4096, 1, 256, 2048, 2048, 256, 4096]
    - [36, 3.464]
  - - [2048, 4096, 1, 512, 2048, 2048, 512, 4096]
    - [35, 5.011]
  - - [2048, 4096, 1, 1024, 2048, 2048, 1024, 4096]
    - [14, 6.73]
  - - [2048, 4096, 1, 2048, 2048, 2048, 2048, 4096]
    - [20, 7.917]
  - - [2048, 4096, 1, 4096, 2048, 2048, 4096, 4096]
    - [20, 8.826]
  - - [2048, 4096, 1, 8192, 2048, 2048, 8192, 4096]
    - [13, 9.141]
  - - [2048, 8192, 1, 128, 2048, 2048, 128, 8192]
    - [32, 2.395]
  - - [2048, 8192, 1, 256, 2048, 2048, 256, 8192]
    - [29, 3.769]
  - - [2048, 8192, 1, 512, 2048, 2048, 512, 8192]
    - [10, 5.497]
  - - [2048, 8192, 1, 1024, 2048, 2048, 1024, 8192]
    - [22, 7.121]
  - - [2048, 8192, 1, 2048, 2048, 2048, 2048, 8192]
    - [24, 8.18]
  - - [2048, 8192, 1, 4096, 2048, 2048, 4096, 8192]
    - [20, 8.884]
  - - [2048, 8192, 1, 8192, 2048, 2048, 8192, 8192]
    - [5, 9.187]
  - - [4096, 128, 1, 128, 4096, 4096, 128, 128]
    - [43, 1.172]
  - - [4096, 128, 1, 256, 4096, 4096, 256, 128]
    - [71, 1.943]
  - - [4096, 128, 1, 512, 4096, 4096, 512, 128]
    - [81, 3.072]
  - - [4096, 128, 1, 1024, 4096, 4096, 1024, 128]
    - [74, 4.235]
  - - [4096, 128, 1, 2048, 4096, 4096, 2048, 128]
    - [73, 5.345]
  - - [4096, 128, 1, 4096, 4096, 4096, 4096, 128]
    - [81, 6.367]
  - - [4096, 128, 1, 8192, 4096, 4096, 8192, 128]
    - [74, 7.234]
  - - [4096, 256, 1, 128, 4096, 4096, 128, 256]
    - [41, 1.621]
  - - [4096, 256, 1, 256, 4096, 4096, 256, 256]
    - [26, 2.552]
  - - [4096, 256, 1, 512, 4096, 4096, 512, 256]
    - [67, 3.846]
  - - [4096, 256, 1, 1024, 4096, 4096, 1024, 256]
    - [57, 5.179]
  - - [4096, 256, 1, 2048, 4096, 4096, 2048, 256]
    - [57, 6.246]
  - - [4096, 256, 1, 4096, 4096, 4096, 4096, 256]
    - [59, 7.38]
  - - [4096, 256, 1, 8192, 4096, 4096, 8192, 256]
    - [59, 8.349]
  - - [4096, 512, 1, 128, 4096, 4096, 128, 512]
    - [5, 1.83]
  - - [4096, 512, 1, 256, 4096, 4096, 256, 512]
    - [2, 2.965]
  - - [4096, 512, 1, 512, 4096, 4096, 512, 512]
    - [12, 4.639]
  - - [4096, 512, 1, 1024, 4096, 4096, 1024, 512]
    - [16, 5.695]
  - - [4096, 512, 1, 2048, 4096, 4096, 2048, 512]
    - [57, 7.096]
  - - [4096, 512, 1, 4096, 4096, 4096, 4096, 512]
    - [10, 8.008]
  - - [4096, 512, 1, 8192, 4096, 4096, 8192, 512]
    - [14, 8.987]
  - - [4096, 1024, 1, 128, 4096, 4096, 128, 1024]
    - [27, 1.897]
  - - [4096, 1024, 1, 256, 4096, 4096, 256, 1024]
    - [63, 2.994]
  - - [4096, 1024, 1, 512, 4096, 4096, 512, 1024]
    - [1, 4.565]
  - - [4096, 1024, 1, 1024, 4096, 4096, 1024, 1024]
    - [6, 6.466]
  - - [4096, 1024, 1, 2048, 4096, 4096, 2048, 1024]
    - [14, 7.475]
  - - [4096, 1024, 1, 4096, 4096, 4096, 4096, 1024]
    - [22, 8.656]
  - - [4096, 1024, 1, 8192, 4096, 4096, 8192, 1024]
    - [10, 9.235]
  - - [4096, 2048, 1, 128, 4096, 4096, 128, 2048]
    - [62, 2.117]
  - - [4096, 2048, 1, 256, 4096, 4096, 256, 2048]
    - [27, 3.367]
  - - [4096, 2048, 1, 512, 4096, 4096, 512, 2048]
    - [3, 4.983]
  - - [4096, 2048, 1, 1024, 4096, 4096, 1024, 2048]
    - [6, 6.483]
  - - [4096, 2048, 1, 2048, 4096, 4096, 2048, 2048]
    - [57, 7.603]
  - - [4096, 2048, 1, 4096, 4096, 4096, 4096, 2048]
    - [12, 8.501]
  - - [4096, 2048, 1, 8192, 4096, 4096, 8192, 2048]
    - [25, 8.997]
  - - [4096, 4096, 1, 128, 4096, 4096, 128, 4096]
    - [39, 2.36]
  - - [4096, 4096, 1, 256, 4096, 4096, 256, 4096]
    - [27, 3.722]
  - - [4096, 4096, 1, 512, 4096, 4096, 512, 4096]
    - [5, 5.29]
  - - [4096, 4096, 1, 1024, 4096, 4096, 1024, 4096]
    - [3, 6.795]
  - - [4096, 4096, 1, 2048, 4096, 4096, 2048, 4096]
    - [21, 7.996]
  - - [4096, 4096, 1, 4096, 4096, 4096, 4096, 4096]
    - [22, 8.787]
  - - [4096, 4096, 1, 8192, 4096, 4096, 8192, 4096]
    - [22, 8.918]
  - - [4096, 8192, 1, 128, 4096, 4096, 128, 8192]
    - [56, 2.444]
  - - [4096, 8192, 1, 256, 4096, 4096, 256, 8192]
    - [22, 3.7]
  - - [4096, 8192, 1, 512, 4096, 4096, 512, 8192]
    - [20, 5.218]
  - - [4096, 8192, 1, 1024, 4096, 4096, 1024, 8192]
    - [13, 6.567]
  - - [4096, 8192, 1, 2048, 4096, 4096, 2048, 8192]
    - [6, 7.634]
  - - [4096, 8192, 1, 4096, 4096, 4096, 4096, 8192]
    - [10, 8.52]
  - - [4096, 8192, 1, 8192, 4096, 4096, 8192, 8192]
    - [15, 8.839]
  - - [8192, 128, 1, 128, 8192, 8192, 128, 128]
    - [62, 1.51]
  - - [8192, 128, 1, 256, 8192, 8192, 256, 128]
    - [39, 2.402]
  - - [8192, 128, 1, 512, 8192, 8192, 512, 128]
    - [68, 3.591]
  - - [8192, 128, 1, 1024, 8192, 8192, 1024, 128]
    - [66, 4.837]
  - - [8192, 128, 1, 2048, 8192, 8192, 2048, 128]
    - [65, 5.887]
  - - [8192, 128, 1, 4096, 8192, 8192, 4096, 128]
    - [76, 6.927]
  - - [8192, 128, 1, 8192, 8192, 8192, 8192, 128]
    - [70, 8.144]
  - - [8192, 256, 1, 128, 8192, 8192, 128, 256]
    - [2, 1.813]
  - - [8192, 256, 1, 256, 8192, 8192, 256, 256]
    - [14, 2.939]
  - - [8192, 256, 1, 512, 8192, 8192, 512, 256]
    - [22, 4.332]
  - - [8192, 256, 1, 1024, 8192, 8192, 1024, 256]
    - [36, 5.559]
  - - [8192, 256, 1, 2048, 8192, 8192, 2048, 256]
    - [28, 6.909]
  - - [8192, 256, 1, 4096, 8192, 8192, 4096, 256]
    - [61, 8.169]
  - - [8192, 256, 1, 8192, 8192, 8192, 8192, 256]
    - [10, 9.078]
  - - [8192, 512, 1, 128, 8192, 8192, 128, 512]
    - [29, 1.875]
  - - [8192, 512, 1, 256, 8192, 8192, 256, 512]
    - [57, 3.012]
  - - [8192, 512, 1, 512, 8192, 8192, 512, 512]
    - [3, 4.516]
  - - [8192, 512, 1, 1024, 8192, 8192, 1024, 512]
    - [6, 6.225]
  - - [8192, 512, 1, 2048, 8192, 8192, 2048, 512]
    - [6, 7.797]
  - - [8192, 512, 1, 4096, 8192, 8192, 4096, 512]
    - [22, 8.674]
  - - [8192, 512, 1, 8192, 8192, 8192, 8192, 512]
    - [9, 9.348]
  - - [8192, 1024, 1, 128, 8192, 8192, 128, 1024]
    - [63, 2.116]
  - - [8192, 1024, 1, 256, 8192, 8192, 256, 1024]
    - [34, 3.297]
  - - [8192, 1024, 1, 512, 8192, 8192, 512, 1024]
    - [28, 4.825]
  - - [8192, 1024, 1, 1024, 8192, 8192, 1024, 1024]
    - [19, 6.474]
  - - [8192, 1024, 1, 2048, 8192, 8192, 2048, 1024]
    - [22, 7.821]
  - - [8192, 1024, 1, 4096, 8192, 8192, 4096, 1024]
    - [15, 8.607]
  - - [8192, 1024, 1, 8192, 8192, 8192, 8192, 1024]
    - [7, 8.898]
  - - [8192, 2048, 1, 128, 8192, 8192, 128, 2048]
    - [62, 2.304]
  - - [8192, 2048, 1, 256, 8192, 8192, 256, 2048]
    - [3, 3.617]
  - - [8192, 2048, 1, 512, 8192, 8192, 512, 2048]
    - [18, 5.319]
  - - [8192, 2048, 1, 1024, 8192, 8192, 1024, 2048]
    - [19, 6.912]
  - - [8192, 2048, 1, 2048, 8192, 8192, 2048, 2048]
    - [24, 8.066]
  - - [8192, 2048, 1, 4096, 8192, 8192, 4096, 2048]
    - [16, 8.8]
  - - [8192, 2048, 1, 8192, 8192, 8192, 8192, 2048]
    - [3, 8.805]
  - - [8192, 4096, 1, 128, 8192, 8192, 128, 4096]
    - [31, 2.437]
  - - [8192, 4096, 1, 256, 8192, 8192, 256, 4096]
    - [11, 3.687]
  - - [8192, 4096, 1, 512, 8192, 8192, 512, 4096]
    - [16, 5.155]
  - - [8192, 4096, 1, 1024, 8192, 8192, 1024, 4096]
    - [19, 6.767]
  - - [8192, 4096, 1, 2048, 8192, 8192, 2048, 4096]
    - [21, 7.795]
  - - [8192, 4096, 1, 4096, 8192, 8192, 4096, 4096]
    - [14, 8.444]
  - - [8192, 4096, 1, 8192, 8192, 8192, 8192, 4096]
    - [7, 8.702]
  - - [8192, 8192, 1, 128, 8192, 8192, 128, 8192]
    - [3, 2.174]
  - - [8192, 8192, 1, 256, 8192, 8192, 256, 8192]
    - [18, 3.467]
  - - [8192, 8192, 1, 512, 8192, 8192, 512, 8192]
    - [17, 5.292]
  - - [8192, 8192, 1, 1024, 8192, 8192, 1024, 8192]
    - [12, 6.816]
  - - [8192, 8192, 1, 2048, 8192, 8192, 2048, 8192]
    - [6, 7.968]
  - - [8192, 8192, 1, 4096, 8192, 8192, 4096, 8192]
    - [15, 8.359]
  - - [8192, 8192, 1, 8192, 8192, 8192, 8192, 8192]
    - [8, 8.177]
  - - [1, 1, 1, 32, 1, 1, 32, 1]
    - [113, 0.0]
- null
- null
- ExperimentalStreamK
- GridBased
