library/src/amd_detail/rocblaslt/src/Tensile/Logic/asm_full/aquavanjaram/gfx942_38cu/StreamK/aquavanjaram942_Cijk_Alik_Bljk_HSS_BH_UserArgs.yaml
- {MinimumRequiredVersion: 4.33.0}
- aquavanjaram942
- {Architecture: gfx942, CUCount: 38}
- [Device 0049, Device 0050]
    SolutionIndex: 0
    SolutionNameMin: Cijk_Alik_Bljk_HSS_BH_UserArgs_MT128x128x32_MI16x16x1_SN_LDSB1_CLR1_GSU0_GSUC0_GSUWGMRR0_K1_LBSPPA256_LBSPPB128_MIWT4_4_PLR1_SU32_SUM0_SUS256_VWA4_VWB1_WGM1_WGMXCC1_WGMXCCGn1
    SolutionIndex: 1
    SolutionNameMin: Cijk_Alik_Bljk_HSS_BH_UserArgs_MT128x128x32_MI16x16x1_SN_LDSB1_CLR1_GSU0_GSUC0_GSUWGMRR0_K1_LBSPPA128_LBSPPB128_MIWT4_4_PLR1_SU32_SUM0_SUS256_VWA2_VWB2_WGM1_WGMXCC1_WGMXCCGn1
    SolutionIndex: 2
    SolutionNameMin: Cijk_Alik_Bljk_HSS_BH_UserArgs_MT128x128x32_MI16x16x1_SN_LDSB1_CLR1_GSU0_GSUC0_GSUWGMRR0_K1_LBSPPA256_LBSPPB128_MIWT4_4_PLR1_SU32_SUM0_SUS256_VWA4_VWB2_WGM1_WGMXCC1_WGMXCCGn1
    SolutionIndex: 3
    SolutionNameMin: Cijk_Alik_Bljk_HSS_BH_UserArgs_MT128x128x32_MI16x16x1_SN_LDSB1_CLR1_GSU0_GSUC0_GSUWGMRR0_K1_LBSPPA256_LBSPPB256_MIWT4_4_PLR1_SU32_SUM0_SUS256_VWA4_VWB4_WGM4_WGMXCC1_WGMXCCGn1
    SolutionIndex: 4
    SolutionNameMin: Cijk_Alik_Bljk_HSS_BH_UserArgs_MT128x128x32_MI16x16x1_SN_LDSB1_CLR1_GSU0_GSUC0_GSUWGMRR0_K1_LBSPPA256_LBSPPB128_MIWT4_4_PLR1_SU32_SUM0_SUS256_VWA4_VWB1_WGM8_WGMXCC1_WGMXCCGn1
    SolutionIndex: 5
    SolutionNameMin: Cijk_Alik_Bljk_HSS_BH_UserArgs_MT64x32x32_MI16x16x1_SN_LDSB0_CLR1_GSU0_GSUC0_GSUWGMRR0_K1_LBSPPA128_LBSPPB128_MIWT2_1_PLR1_SU32_SUM0_SUS256_VWA1_VWB1_WGM1_WGMXCC1_WGMXCCGn1
    SolutionIndex: 6
    SolutionNameMin: Cijk_Alik_Bljk_HSS_BH_UserArgs_MT64x32x32_MI16x16x1_SN_LDSB0_CLR0_GSU0_GSUC0_GSUWGMRR0_K1_LBSPPA128_LBSPPB128_MIWT2_1_PLR0_SU32_SUM0_SUS256_VWA2_VWB1_WGM4_WGMXCC1_WGMXCCGn1
    SolutionIndex: 7
    SolutionNameMin: Cijk_Alik_Bljk_HSS_BH_UserArgs_MT32x32x32_MI16x16x1_SN_LDSB0_CLR1_GSU0_GSUC0_GSUWGMRR0_K1_LBSPPA128_LBSPPB128_MIWT1_1_PLR1_SU32_SUM0_SUS256_VWA1_VWB1_WGM1_WGMXCC1_WGMXCCGn1
    SolutionIndex: 8
    SolutionNameMin: Cijk_Alik_Bljk_HSS_BH_UserArgs_MT64x256x64_MI16x16x1_SN_LDSB1_CLR1_GSU0_GSUC0_GSUWGMRR0_K1_LBSPPA128_LBSPPB128_MIWT2_8_PLR1_SU32_SUM0_SUS256_VWA1_VWB1_WGM1_WGMXCC1_WGMXCCGn1
    SolutionIndex: 9
    SolutionNameMin: Cijk_Alik_Bljk_HSS_BH_UserArgs_MT64x256x64_MI16x16x1_SN_LDSB1_CLR1_GSU0_GSUC0_GSUWGMRR0_K1_LBSPPA256_LBSPPB256_MIWT2_8_PLR2_SU32_SUM0_SUS256_VWA2_VWB2_WGM8_WGMXCC1_WGMXCCGn1
    SolutionIndex: 10
    SolutionNameMin: Cijk_Alik_Bljk_HSS_BH_UserArgs_MT256x64x64_MI16x16x1_SN_LDSB1_CLR1_GSU0_GSUC0_GSUWGMRR0_K1_LBSPPA512_LBSPPB128_MIWT8_2_PLR1_SU32_SUM0_SUS256_VWA4_VWB1_WGM1_WGMXCC1_WGMXCCGn1
    SolutionIndex: 11
    SolutionNameMin: Cijk_Alik_Bljk_HSS_BH_UserArgs_MT256x64x64_MI16x16x1_SN_LDSB1_CLR1_GSU0_GSUC0_GSUWGMRR0_K1_LBSPPA512_LBSPPB256_MIWT8_2_PLR1_SU32_SUM0_SUS256_VWA4_VWB2_WGM1_WGMXCC1_WGMXCCGn1
    SolutionIndex: 12
    SolutionNameMin: Cijk_Alik_Bljk_HSS_BH_UserArgs_MT256x64x64_MI16x16x1_SN_LDSB1_CLR1_GSU0_GSUC0_GSUWGMRR0_K1_LBSPPA128_LBSPPB128_MIWT8_2_PLR1_SU32_SUM0_SUS256_VWA1_VWB1_WGM4_WGMXCC1_WGMXCCGn1
    SolutionIndex: 13
    SolutionNameMin: Cijk_Alik_Bljk_HSS_BH_UserArgs_MT256x64x64_MI16x16x1_SN_LDSB1_CLR1_GSU0_GSUC0_GSUWGMRR0_K1_LBSPPA1024_LBSPPB128_MIWT8_2_PLR1_SU32_SUM0_SUS256_VWA8_VWB1_WGM4_WGMXCC1_WGMXCCGn1
    SolutionIndex: 14
    SolutionNameMin: Cijk_Alik_Bljk_HSS_BH_UserArgs_MT256x64x64_MI16x16x1_SN_LDSB1_CLR1_GSU0_GSUC0_GSUWGMRR0_K1_LBSPPA512_LBSPPB256_MIWT8_2_PLR1_SU32_SUM0_SUS256_VWA4_VWB2_WGM4_WGMXCC1_WGMXCCGn1
    SolutionIndex: 15
    SolutionNameMin: Cijk_Alik_Bljk_HSS_BH_UserArgs_MT256x64x64_MI16x16x1_SN_LDSB1_CLR1_GSU0_GSUC0_GSUWGMRR0_K1_LBSPPA128_LBSPPB128_MIWT8_2_PLR1_SU32_SUM0_SUS256_VWA1_VWB1_WGM8_WGMXCC1_WGMXCCGn1
    SolutionIndex: 16
    SolutionNameMin: Cijk_Alik_Bljk_HSS_BH_UserArgs_MT256x64x64_MI16x16x1_SN_LDSB1_CLR1_GSU0_GSUC0_GSUWGMRR0_K1_LBSPPA512_LBSPPB128_MIWT8_2_PLR1_SU32_SUM0_SUS256_VWA4_VWB1_WGM8_WGMXCC1_WGMXCCGn1
    SolutionIndex: 17
    SolutionNameMin: Cijk_Alik_Bljk_HSS_BH_UserArgs_MT128x128x64_MI16x16x1_SN_LDSB1_CLR1_GSU0_GSUC0_GSUWGMRR0_K1_LBSPPA128_LBSPPB128_MIWT4_4_PLR1_SU32_SUM0_SUS256_VWA1_VWB1_WGM1_WGMXCC1_WGMXCCGn1
    SolutionIndex: 18
    SolutionNameMin: Cijk_Alik_Bljk_HSS_BH_UserArgs_MT128x128x64_MI16x16x1_SN_LDSB1_CLR1_GSU0_GSUC0_GSUWGMRR0_K1_LBSPPA256_LBSPPB128_MIWT4_4_PLR1_SU32_SUM0_SUS256_VWA2_VWB1_WGM1_WGMXCC1_WGMXCCGn1
    SolutionIndex: 19
    SolutionNameMin: Cijk_Alik_Bljk_HSS_BH_UserArgs_MT128x128x64_MI16x16x1_SN_LDSB1_CLR1_GSU0_GSUC0_GSUWGMRR0_K1_LBSPPA512_LBSPPB128_MIWT4_4_PLR1_SU32_SUM0_SUS256_VWA4_VWB1_WGM1_WGMXCC1_WGMXCCGn1
    SolutionIndex: 20
    SolutionNameMin: Cijk_Alik_Bljk_HSS_BH_UserArgs_MT128x128x64_MI16x16x1_SN_LDSB1_CLR1_GSU0_GSUC0_GSUWGMRR0_K1_LBSPPA128_LBSPPB256_MIWT4_4_PLR1_SU32_SUM0_SUS256_VWA1_VWB2_WGM1_WGMXCC1_WGMXCCGn1
    SolutionIndex: 21
    SolutionNameMin: Cijk_Alik_Bljk_HSS_BH_UserArgs_MT128x128x64_MI16x16x1_SN_LDSB1_CLR1_GSU0_GSUC0_GSUWGMRR0_K1_LBSPPA256_LBSPPB256_MIWT4_4_PLR1_SU32_SUM0_SUS256_VWA2_VWB2_WGM1_WGMXCC1_WGMXCCGn1
    SolutionIndex: 22
    SolutionNameMin: Cijk_Alik_Bljk_HSS_BH_UserArgs_MT128x128x64_MI16x16x1_SN_LDSB1_CLR1_GSU0_GSUC0_GSUWGMRR0_K1_LBSPPA512_LBSPPB256_MIWT4_4_PLR1_SU32_SUM0_SUS256_VWA4_VWB2_WGM1_WGMXCC1_WGMXCCGn1
    SolutionIndex: 23
    SolutionNameMin: Cijk_Alik_Bljk_HSS_BH_UserArgs_MT128x128x64_MI16x16x1_SN_LDSB1_CLR1_GSU0_GSUC0_GSUWGMRR0_K1_LBSPPA256_LBSPPB512_MIWT4_4_PLR1_SU32_SUM0_SUS256_VWA2_VWB4_WGM1_WGMXCC1_WGMXCCGn1
    SolutionIndex: 24
    SolutionNameMin: Cijk_Alik_Bljk_HSS_BH_UserArgs_MT128x128x64_MI16x16x1_SN_LDSB1_CLR1_GSU0_GSUC0_GSUWGMRR0_K1_LBSPPA512_LBSPPB512_MIWT4_4_PLR1_SU32_SUM0_SUS256_VWA4_VWB4_WGM1_WGMXCC1_WGMXCCGn1
    SolutionIndex: 25
    SolutionNameMin: Cijk_Alik_Bljk_HSS_BH_UserArgs_MT128x128x64_MI16x16x1_SN_LDSB1_CLR1_GSU0_GSUC0_GSUWGMRR0_K1_LBSPPA256_LBSPPB128_MIWT4_4_PLR2_SU32_SUM0_SUS256_VWA2_VWB1_WGM1_WGMXCC1_WGMXCCGn1
    SolutionIndex: 26
    SolutionNameMin: Cijk_Alik_Bljk_HSS_BH_UserArgs_MT128x128x64_MI16x16x1_SN_LDSB1_CLR1_GSU0_GSUC0_GSUWGMRR0_K1_LBSPPA512_LBSPPB256_MIWT4_4_PLR2_SU32_SUM0_SUS256_VWA4_VWB2_WGM1_WGMXCC1_WGMXCCGn1
    SolutionIndex: 27
    SolutionNameMin: Cijk_Alik_Bljk_HSS_BH_UserArgs_MT128x128x64_MI16x16x1_SN_LDSB1_CLR1_GSU0_GSUC0_GSUWGMRR0_K1_LBSPPA512_LBSPPB512_MIWT4_4_PLR2_SU32_SUM0_SUS256_VWA4_VWB4_WGM1_WGMXCC1_WGMXCCGn1
    SolutionIndex: 28
    SolutionNameMin: Cijk_Alik_Bljk_HSS_BH_UserArgs_MT128x128x64_MI16x16x1_SN_LDSB1_CLR1_GSU0_GSUC0_GSUWGMRR0_K1_LBSPPA128_LBSPPB128_MIWT4_4_PLR1_SU32_SUM0_SUS256_VWA1_VWB1_WGM4_WGMXCC1_WGMXCCGn1
    SolutionIndex: 29
    SolutionNameMin: Cijk_Alik_Bljk_HSS_BH_UserArgs_MT128x128x64_MI16x16x1_SN_LDSB1_CLR1_GSU0_GSUC0_GSUWGMRR0_K1_LBSPPA256_LBSPPB128_MIWT4_4_PLR1_SU32_SUM0_SUS256_VWA2_VWB1_WGM4_WGMXCC1_WGMXCCGn1
    SolutionIndex: 30
    SolutionNameMin: Cijk_Alik_Bljk_HSS_BH_UserArgs_MT128x128x64_MI16x16x1_SN_LDSB1_CLR1_GSU0_GSUC0_GSUWGMRR0_K1_LBSPPA512_LBSPPB128_MIWT4_4_PLR1_SU32_SUM0_SUS256_VWA4_VWB1_WGM4_WGMXCC1_WGMXCCGn1
    SolutionIndex: 31
    SolutionNameMin: Cijk_Alik_Bljk_HSS_BH_UserArgs_MT128x128x64_MI16x16x1_SN_LDSB1_CLR1_GSU0_GSUC0_GSUWGMRR0_K1_LBSPPA128_LBSPPB256_MIWT4_4_PLR1_SU32_SUM0_SUS256_VWA1_VWB2_WGM4_WGMXCC1_WGMXCCGn1
    SolutionIndex: 32
    SolutionNameMin: Cijk_Alik_Bljk_HSS_BH_UserArgs_MT128x128x64_MI16x16x1_SN_LDSB1_CLR1_GSU0_GSUC0_GSUWGMRR0_K1_LBSPPA256_LBSPPB256_MIWT4_4_PLR1_SU32_SUM0_SUS256_VWA2_VWB2_WGM4_WGMXCC1_WGMXCCGn1
    SolutionIndex: 33
    SolutionNameMin: Cijk_Alik_Bljk_HSS_BH_UserArgs_MT128x128x64_MI16x16x1_SN_LDSB1_CLR1_GSU0_GSUC0_GSUWGMRR0_K1_LBSPPA512_LBSPPB256_MIWT4_4_PLR1_SU32_SUM0_SUS256_VWA4_VWB2_WGM4_WGMXCC1_WGMXCCGn1
    SolutionIndex: 34
    SolutionNameMin: Cijk_Alik_Bljk_HSS_BH_UserArgs_MT128x128x64_MI16x16x1_SN_LDSB1_CLR1_GSU0_GSUC0_GSUWGMRR0_K1_LBSPPA128_LBSPPB512_MIWT4_4_PLR1_SU32_SUM0_SUS256_VWA1_VWB4_WGM4_WGMXCC1_WGMXCCGn1
    SolutionIndex: 35
    SolutionNameMin: Cijk_Alik_Bljk_HSS_BH_UserArgs_MT128x128x64_MI16x16x1_SN_LDSB1_CLR1_GSU0_GSUC0_GSUWGMRR0_K1_LBSPPA256_LBSPPB512_MIWT4_4_PLR1_SU32_SUM0_SUS256_VWA2_VWB4_WGM4_WGMXCC1_WGMXCCGn1
    SolutionIndex: 36
    SolutionNameMin: Cijk_Alik_Bljk_HSS_BH_UserArgs_MT128x128x64_MI16x16x1_SN_LDSB1_CLR1_GSU0_GSUC0_GSUWGMRR0_K1_LBSPPA512_LBSPPB512_MIWT4_4_PLR1_SU32_SUM0_SUS256_VWA4_VWB4_WGM4_WGMXCC1_WGMXCCGn1
    SolutionIndex: 37
    SolutionNameMin: Cijk_Alik_Bljk_HSS_BH_UserArgs_MT128x128x64_MI16x16x1_SN_LDSB1_CLR1_GSU0_GSUC0_GSUWGMRR0_K1_LBSPPA256_LBSPPB512_MIWT4_4_PLR2_SU32_SUM0_SUS256_VWA2_VWB4_WGM4_WGMXCC1_WGMXCCGn1
    SolutionIndex: 38
    SolutionNameMin: Cijk_Alik_Bljk_HSS_BH_UserArgs_MT128x128x64_MI16x16x1_SN_LDSB1_CLR1_GSU0_GSUC0_GSUWGMRR0_K1_LBSPPA128_LBSPPB128_MIWT4_4_PLR1_SU32_SUM0_SUS256_VWA1_VWB1_WGM8_WGMXCC1_WGMXCCGn1
    SolutionIndex: 39
    SolutionNameMin: Cijk_Alik_Bljk_HSS_BH_UserArgs_MT128x128x64_MI16x16x1_SN_LDSB1_CLR1_GSU0_GSUC0_GSUWGMRR0_K1_LBSPPA256_LBSPPB128_MIWT4_4_PLR1_SU32_SUM0_SUS256_VWA2_VWB1_WGM8_WGMXCC1_WGMXCCGn1
    SolutionIndex: 40
    SolutionNameMin: Cijk_Alik_Bljk_HSS_BH_UserArgs_MT128x128x64_MI16x16x1_SN_LDSB1_CLR1_GSU0_GSUC0_GSUWGMRR0_K1_LBSPPA512_LBSPPB128_MIWT4_4_PLR1_SU32_SUM0_SUS256_VWA4_VWB1_WGM8_WGMXCC1_WGMXCCGn1
    SolutionIndex: 41
    SolutionNameMin: Cijk_Alik_Bljk_HSS_BH_UserArgs_MT128x128x64_MI16x16x1_SN_LDSB1_CLR1_GSU0_GSUC0_GSUWGMRR0_K1_LBSPPA128_LBSPPB256_MIWT4_4_PLR1_SU32_SUM0_SUS256_VWA1_VWB2_WGM8_WGMXCC1_WGMXCCGn1
    SolutionIndex: 42
    SolutionNameMin: Cijk_Alik_Bljk_HSS_BH_UserArgs_MT128x128x64_MI16x16x1_SN_LDSB1_CLR1_GSU0_GSUC0_GSUWGMRR0_K1_LBSPPA256_LBSPPB256_MIWT4_4_PLR1_SU32_SUM0_SUS256_VWA2_VWB2_WGM8_WGMXCC1_WGMXCCGn1
    SolutionIndex: 43
    SolutionNameMin: Cijk_Alik_Bljk_HSS_BH_UserArgs_MT128x128x64_MI16x16x1_SN_LDSB1_CLR1_GSU0_GSUC0_GSUWGMRR0_K1_LBSPPA512_LBSPPB256_MIWT4_4_PLR1_SU32_SUM0_SUS256_VWA4_VWB2_WGM8_WGMXCC1_WGMXCCGn1
    SolutionIndex: 44
    SolutionNameMin: Cijk_Alik_Bljk_HSS_BH_UserArgs_MT128x128x64_MI16x16x1_SN_LDSB1_CLR1_GSU0_GSUC0_GSUWGMRR0_K1_LBSPPA128_LBSPPB512_MIWT4_4_PLR1_SU32_SUM0_SUS256_VWA1_VWB4_WGM8_WGMXCC1_WGMXCCGn1
    SolutionIndex: 45
    SolutionNameMin: Cijk_Alik_Bljk_HSS_BH_UserArgs_MT128x128x64_MI16x16x1_SN_LDSB1_CLR1_GSU0_GSUC0_GSUWGMRR0_K1_LBSPPA256_LBSPPB512_MIWT4_4_PLR1_SU32_SUM0_SUS256_VWA2_VWB4_WGM8_WGMXCC1_WGMXCCGn1
    SolutionIndex: 46
    SolutionNameMin: Cijk_Alik_Bljk_HSS_BH_UserArgs_MT128x128x64_MI16x16x1_SN_LDSB1_CLR1_GSU0_GSUC0_GSUWGMRR0_K1_LBSPPA512_LBSPPB512_MIWT4_4_PLR1_SU32_SUM0_SUS256_VWA4_VWB4_WGM8_WGMXCC1_WGMXCCGn1
    SolutionIndex: 47
    SolutionNameMin: Cijk_Alik_Bljk_HSS_BH_UserArgs_MT128x128x64_MI16x16x1_SN_LDSB1_CLR1_GSU0_GSUC0_GSUWGMRR0_K1_LBSPPA128_LBSPPB128_MIWT4_4_PLR2_SU32_SUM0_SUS256_VWA1_VWB1_WGM8_WGMXCC1_WGMXCCGn1
    SolutionIndex: 48
    SolutionNameMin: Cijk_Alik_Bljk_HSS_BH_UserArgs_MT128x128x64_MI16x16x1_SN_LDSB1_CLR1_GSU0_GSUC0_GSUWGMRR0_K1_LBSPPA128_LBSPPB256_MIWT4_4_PLR2_SU32_SUM0_SUS256_VWA1_VWB2_WGM8_WGMXCC1_WGMXCCGn1
    SolutionIndex: 49
    SolutionNameMin: Cijk_Alik_Bljk_HSS_BH_UserArgs_MT128x128x64_MI16x16x1_SN_LDSB1_CLR1_GSU0_GSUC0_GSUWGMRR0_K1_LBSPPA512_LBSPPB512_MIWT4_4_PLR2_SU32_SUM0_SUS256_VWA4_VWB4_WGM8_WGMXCC1_WGMXCCGn1
    SolutionIndex: 50
    SolutionNameMin: Cijk_Alik_Bljk_HSS_BH_UserArgs_MT64x128x64_MI16x16x1_SN_LDSB1_CLR1_GSU0_GSUC0_GSUWGMRR0_K1_LBSPPA128_LBSPPB128_MIWT2_4_PLR1_SU32_SUM0_SUS256_VWA1_VWB1_WGM1_WGMXCC1_WGMXCCGn1
    SolutionIndex: 51
    SolutionNameMin: Cijk_Alik_Bljk_HSS_BH_UserArgs_MT64x128x64_MI16x16x1_SN_LDSB1_CLR1_GSU0_GSUC0_GSUWGMRR0_K1_LBSPPA256_LBSPPB128_MIWT2_4_PLR1_SU32_SUM0_SUS256_VWA2_VWB1_WGM1_WGMXCC1_WGMXCCGn1
    SolutionIndex: 52
    SolutionNameMin: Cijk_Alik_Bljk_HSS_BH_UserArgs_MT64x128x64_MI16x16x1_SN_LDSB1_CLR1_GSU0_GSUC0_GSUWGMRR0_K1_LBSPPA128_LBSPPB256_MIWT2_4_PLR1_SU32_SUM0_SUS256_VWA1_VWB2_WGM1_WGMXCC1_WGMXCCGn1
    SolutionIndex: 53
    SolutionNameMin: Cijk_Alik_Bljk_HSS_BH_UserArgs_MT64x128x64_MI16x16x1_SN_LDSB1_CLR1_GSU0_GSUC0_GSUWGMRR0_K1_LBSPPA128_LBSPPB512_MIWT2_4_PLR1_SU32_SUM0_SUS256_VWA1_VWB4_WGM1_WGMXCC1_WGMXCCGn1
    SolutionIndex: 54
    SolutionNameMin: Cijk_Alik_Bljk_HSS_BH_UserArgs_MT64x128x64_MI16x16x1_SN_LDSB1_CLR1_GSU0_GSUC0_GSUWGMRR0_K1_LBSPPA128_LBSPPB512_MIWT2_4_PLR1_SU32_SUM0_SUS256_VWA1_VWB4_WGM4_WGMXCC1_WGMXCCGn1
    SolutionIndex: 55
    SolutionNameMin: Cijk_Alik_Bljk_HSS_BH_UserArgs_MT64x128x64_MI16x16x1_SN_LDSB1_CLR1_GSU0_GSUC0_GSUWGMRR0_K1_LBSPPA128_LBSPPB128_MIWT2_4_PLR1_SU32_SUM0_SUS256_VWA1_VWB1_WGM8_WGMXCC1_WGMXCCGn1
    SolutionIndex: 56
    SolutionNameMin: Cijk_Alik_Bljk_HSS_BH_UserArgs_MT128x64x64_MI16x16x1_SN_LDSB1_CLR1_GSU0_GSUC0_GSUWGMRR0_K1_LBSPPA128_LBSPPB128_MIWT4_2_PLR1_SU32_SUM0_SUS256_VWA1_VWB1_WGM1_WGMXCC1_WGMXCCGn1
    SolutionIndex: 57
    SolutionNameMin: Cijk_Alik_Bljk_HSS_BH_UserArgs_MT128x64x64_MI16x16x1_SN_LDSB1_CLR1_GSU0_GSUC0_GSUWGMRR0_K1_LBSPPA512_LBSPPB128_MIWT4_2_PLR1_SU32_SUM0_SUS256_VWA4_VWB1_WGM1_WGMXCC1_WGMXCCGn1
    SolutionIndex: 58
    SolutionNameMin: Cijk_Alik_Bljk_HSS_BH_UserArgs_MT128x64x64_MI16x16x1_SN_LDSB1_CLR1_GSU0_GSUC0_GSUWGMRR0_K1_LBSPPA128_LBSPPB256_MIWT4_2_PLR1_SU32_SUM0_SUS256_VWA1_VWB2_WGM1_WGMXCC1_WGMXCCGn1
    SolutionIndex: 59
    SolutionNameMin: Cijk_Alik_Bljk_HSS_BH_UserArgs_MT128x64x64_MI16x16x1_SN_LDSB1_CLR1_GSU0_GSUC0_GSUWGMRR0_K1_LBSPPA256_LBSPPB256_MIWT4_2_PLR1_SU32_SUM0_SUS256_VWA2_VWB2_WGM1_WGMXCC1_WGMXCCGn1
    SolutionIndex: 60
    SolutionNameMin: Cijk_Alik_Bljk_HSS_BH_UserArgs_MT128x64x64_MI16x16x1_SN_LDSB1_CLR1_GSU0_GSUC0_GSUWGMRR0_K1_LBSPPA512_LBSPPB256_MIWT4_2_PLR1_SU32_SUM0_SUS256_VWA4_VWB2_WGM1_WGMXCC1_WGMXCCGn1
    SolutionIndex: 61
    SolutionNameMin: Cijk_Alik_Bljk_HSS_BH_UserArgs_MT128x64x64_MI16x16x1_SN_LDSB1_CLR1_GSU0_GSUC0_GSUWGMRR0_K1_LBSPPA512_LBSPPB128_MIWT4_2_PLR1_SU32_SUM0_SUS256_VWA4_VWB1_WGM4_WGMXCC1_WGMXCCGn1
    SolutionIndex: 62
    SolutionNameMin: Cijk_Alik_Bljk_HSS_BH_UserArgs_MT128x64x64_MI16x16x1_SN_LDSB1_CLR1_GSU0_GSUC0_GSUWGMRR0_K1_LBSPPA128_LBSPPB256_MIWT4_2_PLR1_SU32_SUM0_SUS256_VWA1_VWB2_WGM4_WGMXCC1_WGMXCCGn1
    SolutionIndex: 63
    SolutionNameMin: Cijk_Alik_Bljk_HSS_BH_UserArgs_MT128x64x64_MI16x16x1_SN_LDSB1_CLR1_GSU0_GSUC0_GSUWGMRR0_K1_LBSPPA256_LBSPPB256_MIWT4_2_PLR1_SU32_SUM0_SUS256_VWA2_VWB2_WGM4_WGMXCC1_WGMXCCGn1
    SolutionIndex: 64
    SolutionNameMin: Cijk_Alik_Bljk_HSS_BH_UserArgs_MT128x64x64_MI16x16x1_SN_LDSB1_CLR1_GSU0_GSUC0_GSUWGMRR0_K1_LBSPPA128_LBSPPB128_MIWT4_2_PLR1_SU32_SUM0_SUS256_VWA1_VWB1_WGM8_WGMXCC1_WGMXCCGn1
    SolutionIndex: 65
    SolutionNameMin: Cijk_Alik_Bljk_HSS_BH_UserArgs_MT128x32x64_MI16x16x1_SN_LDSB1_CLR1_GSU0_GSUC0_GSUWGMRR0_K1_LBSPPA512_LBSPPB128_MIWT4_1_PLR1_SU32_SUM0_SUS256_VWA4_VWB1_WGM1_WGMXCC1_WGMXCCGn1
    SolutionIndex: 66
    SolutionNameMin: Cijk_Alik_Bljk_HSS_BH_UserArgs_MT64x64x64_MI16x16x1_SN_LDSB1_CLR1_GSU0_GSUC0_GSUWGMRR0_K1_LBSPPA128_LBSPPB128_MIWT2_2_PLR1_SU32_SUM0_SUS256_VWA1_VWB1_WGM1_WGMXCC1_WGMXCCGn1
    SolutionIndex: 67
    SolutionNameMin: Cijk_Alik_Bljk_HSS_BH_UserArgs_MT64x64x64_MI16x16x1_SN_LDSB1_CLR1_GSU0_GSUC0_GSUWGMRR0_K1_LBSPPA128_LBSPPB256_MIWT2_2_PLR1_SU32_SUM0_SUS256_VWA1_VWB2_WGM1_WGMXCC1_WGMXCCGn1
    SolutionIndex: 68
    SolutionNameMin: Cijk_Alik_Bljk_HSS_BH_UserArgs_MT64x64x64_MI16x16x1_SN_LDSB1_CLR1_GSU0_GSUC0_GSUWGMRR0_K1_LBSPPA256_LBSPPB256_MIWT2_2_PLR1_SU32_SUM0_SUS256_VWA2_VWB2_WGM1_WGMXCC1_WGMXCCGn1
    SolutionIndex: 69
    SolutionNameMin: Cijk_Alik_Bljk_HSS_BH_UserArgs_MT64x64x64_MI16x16x1_SN_LDSB1_CLR1_GSU0_GSUC0_GSUWGMRR0_K1_LBSPPA128_LBSPPB256_MIWT2_2_PLR1_SU32_SUM0_SUS256_VWA1_VWB2_WGM4_WGMXCC1_WGMXCCGn1
    SolutionIndex: 70
    SolutionNameMin: Cijk_Alik_Bljk_HSS_BH_UserArgs_MT64x64x64_MI16x16x1_SN_LDSB1_CLR1_GSU0_GSUC0_GSUWGMRR0_K1_LBSPPA128_LBSPPB256_MIWT2_2_PLR1_SU32_SUM0_SUS256_VWA1_VWB2_WGM8_WGMXCC1_WGMXCCGn1
    SolutionIndex: 71
    SolutionNameMin: Cijk_Alik_Bljk_HSS_BH_UserArgs_MT64x64x64_MI16x16x1_SN_LDSB1_CLR1_GSU0_GSUC0_GSUWGMRR0_K1_LBSPPA256_LBSPPB256_MIWT2_2_PLR1_SU32_SUM0_SUS256_VWA2_VWB2_WGM8_WGMXCC1_WGMXCCGn1
    SolutionIndex: 72
    SolutionNameMin: Cijk_Alik_Bljk_HSS_BH_UserArgs_MT32x64x64_MI16x16x1_SN_LDSB0_CLR1_GSU0_GSUC0_GSUWGMRR0_K1_LBSPPA128_LBSPPB128_MIWT1_2_PLR1_SU32_SUM0_SUS256_VWA1_VWB1_WGM1_WGMXCC1_WGMXCCGn1
    SolutionIndex: 73
    SolutionNameMin: Cijk_Alik_Bljk_HSS_BH_UserArgs_MT32x64x64_MI16x16x1_SN_LDSB0_CLR1_GSU0_GSUC0_GSUWGMRR0_K1_LBSPPA128_LBSPPB256_MIWT1_2_PLR1_SU32_SUM0_SUS256_VWA1_VWB2_WGM1_WGMXCC1_WGMXCCGn1
    SolutionIndex: 74
    SolutionNameMin: Cijk_Alik_Bljk_HSS_BH_UserArgs_MT64x32x64_MI16x16x1_SN_LDSB0_CLR1_GSU0_GSUC0_GSUWGMRR0_K1_LBSPPA256_LBSPPB128_MIWT2_1_PLR1_SU32_SUM0_SUS256_VWA2_VWB1_WGM1_WGMXCC1_WGMXCCGn1
    SolutionIndex: 75
    SolutionNameMin: Cijk_Alik_Bljk_HSS_BH_UserArgs_MT64x32x64_MI16x16x1_SN_LDSB0_CLR1_GSU0_GSUC0_GSUWGMRR0_K1_LBSPPA128_LBSPPB128_MIWT2_1_PLR2_SU32_SUM0_SUS256_VWA1_VWB1_WGM1_WGMXCC1_WGMXCCGn1
    SolutionIndex: 76
    SolutionNameMin: Cijk_Alik_Bljk_HSS_BH_UserArgs_MT64x32x64_MI16x16x1_SN_LDSB0_CLR1_GSU0_GSUC0_GSUWGMRR0_K1_LBSPPA256_LBSPPB128_MIWT2_1_PLR1_SU32_SUM0_SUS256_VWA2_VWB1_WGM8_WGMXCC1_WGMXCCGn1
    SolutionIndex: 77
    SolutionNameMin: Cijk_Alik_Bljk_HSS_BH_UserArgs_MT32x32x64_MI16x16x1_SN_LDSB0_CLR1_GSU0_GSUC0_GSUWGMRR0_K1_LBSPPA128_LBSPPB128_MIWT1_1_PLR1_SU32_SUM0_SUS256_VWA1_VWB1_WGM1_WGMXCC1_WGMXCCGn1
    SolutionIndex: 78
    SolutionNameMin: Cijk_Alik_Bljk_HSS_BH_UserArgs_MT32x32x64_MI16x16x1_SN_LDSB0_CLR1_GSU0_GSUC0_GSUWGMRR0_K1_LBSPPA128_LBSPPB128_MIWT1_1_PLR2_SU32_SUM0_SUS256_VWA1_VWB1_WGM1_WGMXCC1_WGMXCCGn1
    SolutionIndex: 79
    SolutionNameMin: Cijk_Alik_Bljk_HSS_BH_UserArgs_MT32x32x64_MI16x16x1_SN_LDSB0_CLR1_GSU0_GSUC0_GSUWGMRR0_K1_LBSPPA128_LBSPPB128_MIWT1_1_PLR1_SU32_SUM0_SUS256_VWA1_VWB1_WGM4_WGMXCC1_WGMXCCGn1
    SolutionIndex: 80
    SolutionNameMin: Cijk_Alik_Bljk_HSS_BH_UserArgs_MT64x64x128_MI16x16x1_SN_LDSB1_CLR1_GSU0_GSUC0_GSUWGMRR0_K1_LBSPPA256_LBSPPB256_MIWT2_2_PLR1_SU32_SUM0_SUS256_VWA1_VWB1_WGM1_WGMXCC1_WGMXCCGn1
    SolutionIndex: 81
    SolutionNameMin: Cijk_Alik_Bljk_HSS_BH_UserArgs_MT64x64x128_MI16x16x1_SN_LDSB1_CLR1_GSU0_GSUC0_GSUWGMRR0_K1_LBSPPA512_LBSPPB256_MIWT2_2_PLR1_SU32_SUM0_SUS256_VWA2_VWB1_WGM1_WGMXCC1_WGMXCCGn1
    SolutionIndex: 82
    SolutionNameMin: Cijk_Alik_Bljk_HSS_BH_UserArgs_MT64x64x128_MI16x16x1_SN_LDSB1_CLR1_GSU0_GSUC0_GSUWGMRR0_K1_LBSPPA256_LBSPPB512_MIWT2_2_PLR1_SU32_SUM0_SUS256_VWA1_VWB2_WGM1_WGMXCC1_WGMXCCGn1
    SolutionIndex: 83
    SolutionNameMin: Cijk_Alik_Bljk_HSS_BH_UserArgs_MT64x64x128_MI16x16x1_SN_LDSB1_CLR1_GSU0_GSUC0_GSUWGMRR0_K1_LBSPPA256_LBSPPB256_MIWT2_2_PLR2_SU32_SUM0_SUS256_VWA1_VWB1_WGM1_WGMXCC1_WGMXCCGn1
    SolutionIndex: 84
    SolutionNameMin: Cijk_Alik_Bljk_HSS_BH_UserArgs_MT64x64x128_MI16x16x1_SN_LDSB1_CLR1_GSU0_GSUC0_GSUWGMRR0_K1_LBSPPA256_LBSPPB512_MIWT2_2_PLR2_SU32_SUM0_SUS256_VWA1_VWB2_WGM1_WGMXCC1_WGMXCCGn1
    SolutionIndex: 85
    SolutionNameMin: Cijk_Alik_Bljk_HSS_BH_UserArgs_MT64x64x128_MI16x16x1_SN_LDSB1_CLR1_GSU0_GSUC0_GSUWGMRR0_K1_LBSPPA512_LBSPPB512_MIWT2_2_PLR2_SU32_SUM0_SUS256_VWA2_VWB2_WGM1_WGMXCC1_WGMXCCGn1
    SolutionIndex: 86
    SolutionNameMin: Cijk_Alik_Bljk_HSS_BH_UserArgs_MT64x64x128_MI16x16x1_SN_LDSB1_CLR1_GSU0_GSUC0_GSUWGMRR0_K1_LBSPPA256_LBSPPB512_MIWT2_2_PLR1_SU32_SUM0_SUS256_VWA1_VWB2_WGM8_WGMXCC1_WGMXCCGn1
    SolutionIndex: 87
    SolutionNameMin: Cijk_Alik_Bljk_HSS_BH_UserArgs_MT64x64x128_MI16x16x1_SN_LDSB1_CLR1_GSU0_GSUC0_GSUWGMRR0_K1_LBSPPA256_LBSPPB256_MIWT2_2_PLR2_SU32_SUM0_SUS256_VWA1_VWB1_WGM8_WGMXCC1_WGMXCCGn1
    SolutionIndex: 88
    SolutionNameMin: Cijk_Alik_Bljk_HSS_BH_UserArgs_MT64x64x128_MI16x16x1_SN_LDSB1_CLR1_GSU0_GSUC0_GSUWGMRR0_K1_LBSPPA512_LBSPPB256_MIWT2_2_PLR2_SU32_SUM0_SUS256_VWA2_VWB1_WGM8_WGMXCC1_WGMXCCGn1
    SolutionIndex: 89
    SolutionNameMin: Cijk_Alik_Bljk_HSS_BH_UserArgs_MT32x64x128_MI16x16x1_SN_LDSB1_CLR1_GSU0_GSUC0_GSUWGMRR0_K1_LBSPPA256_LBSPPB256_MIWT1_2_PLR2_SU32_SUM0_SUS256_VWA1_VWB1_WGM1_WGMXCC1_WGMXCCGn1
    SolutionIndex: 90
    SolutionNameMin: Cijk_Alik_Bljk_HSS_BH_UserArgs_MT32x64x128_MI16x16x1_SN_LDSB1_CLR1_GSU0_GSUC0_GSUWGMRR0_K1_LBSPPA256_LBSPPB512_MIWT1_2_PLR2_SU32_SUM0_SUS256_VWA1_VWB2_WGM1_WGMXCC1_WGMXCCGn1
    SolutionIndex: 91
    SolutionNameMin: Cijk_Alik_Bljk_HSS_BH_UserArgs_MT64x32x128_MI16x16x1_SN_LDSB1_CLR1_GSU0_GSUC0_GSUWGMRR0_K1_LBSPPA256_LBSPPB256_MIWT2_1_PLR2_SU32_SUM0_SUS256_VWA1_VWB1_WGM1_WGMXCC1_WGMXCCGn1
    SolutionIndex: 92
    SolutionNameMin: Cijk_Alik_Bljk_HSS_BH_UserArgs_MT64x32x128_MI16x16x1_SN_LDSB1_CLR1_GSU0_GSUC0_GSUWGMRR0_K1_LBSPPA512_LBSPPB256_MIWT2_1_PLR2_SU32_SUM0_SUS256_VWA2_VWB1_WGM1_WGMXCC1_WGMXCCGn1
    SolutionIndex: 93
    SolutionNameMin: Cijk_Alik_Bljk_HSS_BH_UserArgs_MT64x32x128_MI16x16x1_SN_LDSB1_CLR1_GSU0_GSUC0_GSUWGMRR0_K1_LBSPPA256_LBSPPB256_MIWT2_1_PLR2_SU32_SUM0_SUS256_VWA1_VWB1_WGM8_WGMXCC1_WGMXCCGn1
    SolutionIndex: 94
    SolutionNameMin: Cijk_Alik_Bljk_HSS_BH_UserArgs_MT32x32x128_MI16x16x1_SN_LDSB1_CLR1_GSU0_GSUC0_GSUWGMRR0_K1_LBSPPA256_LBSPPB256_MIWT1_1_PLR1_SU32_SUM0_SUS256_VWA1_VWB1_WGM1_WGMXCC1_WGMXCCGn1
    SolutionIndex: 95
    SolutionNameMin: Cijk_Alik_Bljk_HSS_BH_UserArgs_MT32x32x128_MI16x16x1_SN_LDSB1_CLR1_GSU0_GSUC0_GSUWGMRR0_K1_LBSPPA256_LBSPPB256_MIWT1_1_PLR2_SU32_SUM0_SUS256_VWA1_VWB1_WGM1_WGMXCC1_WGMXCCGn1
    SolutionIndex: 96
    SolutionNameMin: Cijk_Alik_Bljk_HSS_BH_UserArgs_MT32x32x128_MI16x16x1_SN_LDSB1_CLR1_GSU0_GSUC0_GSUWGMRR0_K1_LBSPPA256_LBSPPB256_MIWT1_1_PLR1_SU32_SUM0_SUS256_VWA1_VWB1_WGM8_WGMXCC1_WGMXCCGn1
    SolutionIndex: 97
    SolutionNameMin: Cijk_Alik_Bljk_HSS_BH_UserArgs_MT32x32x32_MI16x16x1_SN_LDSB0_CLR1_GSU0_GSUC0_GSUWGMRR0_K1_LBSPPA128_LBSPPB128_MIWT1_1_PLR1_SU32_SUM0_SUS256_VWA1_VWB1_WGM4_WGMXCC1_WGMXCCGn1
- - - [128, 128, 1, 128, 128, 128, 128, 128]
    - [6, 0.079]
  - - [128, 128, 1, 256, 128, 128, 256, 256]
    - [93, 0.155]
  - - [128, 128, 1, 512, 128, 128, 512, 512]
    - [78, 0.287]
  - - [128, 128, 1, 1024, 128, 128, 1024, 1024]
    - [94, 0.478]
  - - [128, 128, 1, 2048, 128, 128, 2048, 2048]
    - [94, 0.649]
  - - [128, 128, 1, 4096, 128, 128, 4096, 4096]
    - [94, 1.013]
  - - [128, 128, 1, 8192, 128, 128, 8192, 8192]
    - [91, 1.468]
  - - [128, 256, 1, 128, 128, 128, 128, 128]
    - [75, 0.159]
  - - [128, 256, 1, 256, 128, 128, 256, 256]
    - [76, 0.319]
  - - [128, 256, 1, 512, 128, 128, 512, 512]
    - [79, 0.574]
  - - [128, 256, 1, 1024, 128, 128, 1024, 1024]
    - [77, 0.943]
  - - [128, 256, 1, 2048, 128, 128, 2048, 2048]
    - [95, 1.315]
  - - [128, 256, 1, 4096, 128, 128, 4096, 4096]
    - [95, 1.643]
  - - [128, 256, 1, 8192, 128, 128, 8192, 8192]
    - [84, 2.362]
  - - [128, 512, 1, 128, 128, 128, 128, 128]
    - [90, 0.334]
  - - [128, 512, 1, 256, 128, 128, 256, 256]
    - [74, 0.614]
  - - [128, 512, 1, 512, 128, 128, 512, 512]
    - [72, 1.058]
  - - [128, 512, 1, 1024, 128, 128, 1024, 1024]
    - [91, 1.531]
  - - [128, 512, 1, 2048, 128, 128, 2048, 2048]
    - [92, 2.03]
  - - [128, 512, 1, 4096, 128, 128, 4096, 4096]
    - [80, 2.568]
  - - [128, 512, 1, 8192, 128, 128, 8192, 8192]
    - [86, 3.256]
  - - [128, 1024, 1, 128, 128, 128, 128, 128]
    - [65, 0.597]
  - - [128, 1024, 1, 256, 128, 128, 256, 256]
    - [67, 1.079]
  - - [128, 1024, 1, 512, 128, 128, 512, 512]
    - [67, 1.741]
  - - [128, 1024, 1, 1024, 128, 128, 1024, 1024]
    - [83, 2.479]
  - - [128, 1024, 1, 2048, 128, 128, 2048, 2048]
    - [82, 2.929]
  - - [128, 1024, 1, 4096, 128, 128, 4096, 4096]
    - [83, 3.641]
  - - [128, 1024, 1, 8192, 128, 128, 8192, 8192]
    - [19, 4.403]
  - - [128, 2048, 1, 128, 128, 128, 128, 128]
    - [56, 0.973]
  - - [128, 2048, 1, 256, 128, 128, 256, 256]
    - [51, 1.636]
  - - [128, 2048, 1, 512, 128, 128, 512, 512]
    - [64, 2.412]
  - - [128, 2048, 1, 1024, 128, 128, 1024, 1024]
    - [64, 3.214]
  - - [128, 2048, 1, 2048, 128, 128, 2048, 2048]
    - [56, 4.089]
  - - [128, 2048, 1, 4096, 128, 128, 4096, 4096]
    - [57, 4.728]
  - - [128, 2048, 1, 8192, 128, 128, 8192, 8192]
    - [36, 5.654]
  - - [128, 4096, 1, 128, 128, 128, 128, 128]
    - [4, 1.117]
  - - [128, 4096, 1, 256, 128, 128, 256, 256]
    - [17, 1.932]
  - - [128, 4096, 1, 512, 128, 128, 512, 512]
    - [17, 3.104]
  - - [128, 4096, 1, 1024, 128, 128, 1024, 1024]
    - [21, 4.337]
  - - [128, 4096, 1, 2048, 128, 128, 2048, 2048]
    - [17, 5.534]
  - - [128, 4096, 1, 4096, 128, 128, 4096, 4096]
    - [17, 5.894]
  - - [128, 4096, 1, 8192, 128, 128, 8192, 8192]
    - [88, 4.655]
  - - [128, 8192, 1, 128, 128, 128, 128, 128]
    - [17, 1.332]
  - - [128, 8192, 1, 256, 128, 128, 256, 256]
    - [17, 1.985]
  - - [128, 8192, 1, 512, 128, 128, 512, 512]
    - [19, 3.187]
  - - [128, 8192, 1, 1024, 128, 128, 1024, 1024]
    - [19, 4.511]
  - - [128, 8192, 1, 2048, 128, 128, 2048, 2048]
    - [24, 5.981]
  - - [128, 8192, 1, 4096, 128, 128, 4096, 4096]
    - [19, 6.547]
  - - [128, 8192, 1, 8192, 128, 128, 8192, 8192]
    - [46, 7.602]
  - - [256, 128, 1, 128, 256, 256, 128, 128]
    - [94, 0.167]
  - - [256, 128, 1, 256, 256, 256, 256, 256]
    - [7, 0.315]
  - - [256, 128, 1, 512, 256, 256, 512, 512]
    - [77, 0.585]
  - - [256, 128, 1, 1024, 256, 256, 1024, 1024]
    - [77, 0.937]
  - - [256, 128, 1, 2048, 256, 256, 2048, 2048]
    - [96, 1.297]
  - - [256, 128, 1, 4096, 256, 256, 4096, 4096]
    - [94, 1.645]
  - - [256, 128, 1, 8192, 256, 256, 8192, 8192]
    - [82, 2.413]
  - - [256, 256, 1, 128, 256, 256, 128, 128]
    - [5, 0.341]
  - - [256, 256, 1, 256, 256, 256, 256, 256]
    - [74, 0.644]
  - - [256, 256, 1, 512, 256, 256, 512, 512]
    - [72, 1.05]
  - - [256, 256, 1, 1024, 256, 256, 1024, 1024]
    - [72, 1.553]
  - - [256, 256, 1, 2048, 256, 256, 2048, 2048]
    - [91, 2.052]
  - - [256, 256, 1, 4096, 256, 256, 4096, 4096]
    - [85, 2.558]
  - - [256, 256, 1, 8192, 256, 256, 8192, 8192]
    - [82, 3.298]
  - - [256, 512, 1, 128, 256, 256, 128, 128]
    - [70, 0.605]
  - - [256, 512, 1, 256, 256, 256, 256, 256]
    - [71, 1.048]
  - - [256, 512, 1, 512, 256, 256, 512, 512]
    - [66, 1.718]
  - - [256, 512, 1, 1024, 256, 256, 1024, 1024]
    - [81, 2.465]
  - - [256, 512, 1, 2048, 256, 256, 2048, 2048]
    - [81, 3.165]
  - - [256, 512, 1, 4096, 256, 256, 4096, 4096]
    - [88, 3.627]
  - - [256, 512, 1, 8192, 256, 256, 8192, 8192]
    - [11, 3.777]
  - - [256, 1024, 1, 128, 256, 256, 128, 128]
    - [53, 0.979]
  - - [256, 1024, 1, 256, 256, 256, 256, 256]
    - [60, 1.67]
  - - [256, 1024, 1, 512, 256, 256, 512, 512]
    - [57, 2.588]
  - - [256, 1024, 1, 1024, 256, 256, 1024, 1024]
    - [57, 3.371]
  - - [256, 1024, 1, 2048, 256, 256, 2048, 2048]
    - [56, 4.189]
  - - [256, 1024, 1, 4096, 256, 256, 4096, 4096]
    - [40, 4.983]
  - - [256, 1024, 1, 8192, 256, 256, 8192, 8192]
    - [43, 6.052]
  - - [256, 2048, 1, 128, 256, 256, 128, 128]
    - [17, 1.186]
  - - [256, 2048, 1, 256, 256, 256, 256, 256]
    - [19, 2.061]
  - - [256, 2048, 1, 512, 256, 256, 512, 512]
    - [20, 2.998]
  - - [256, 2048, 1, 1024, 256, 256, 1024, 1024]
    - [38, 4.414]
  - - [256, 2048, 1, 2048, 256, 256, 2048, 2048]
    - [30, 5.705]
  - - [256, 2048, 1, 4096, 256, 256, 4096, 4096]
    - [22, 5.598]
  - - [256, 2048, 1, 8192, 256, 256, 8192, 8192]
    - [13, 5.634]
  - - [256, 4096, 1, 128, 256, 256, 128, 128]
    - [8, 1.243]
  - - [256, 4096, 1, 256, 256, 256, 256, 256]
    - [57, 1.96]
  - - [256, 4096, 1, 512, 256, 256, 512, 512]
    - [36, 2.976]
  - - [256, 4096, 1, 1024, 256, 256, 1024, 1024]
    - [24, 4.672]
  - - [256, 4096, 1, 2048, 256, 256, 2048, 2048]
    - [16, 5.748]
  - - [256, 4096, 1, 4096, 256, 256, 4096, 4096]
    - [24, 5.909]
  - - [256, 4096, 1, 8192, 256, 256, 8192, 8192]
    - [42, 6.144]
  - - [256, 8192, 1, 128, 256, 256, 128, 128]
    - [2, 1.467]
  - - [256, 8192, 1, 256, 256, 256, 256, 256]
    - [17, 2.539]
  - - [256, 8192, 1, 512, 256, 256, 512, 512]
    - [24, 3.795]
  - - [256, 8192, 1, 1024, 256, 256, 1024, 1024]
    - [22, 5.293]
  - - [256, 8192, 1, 2048, 256, 256, 2048, 2048]
    - [57, 4.433]
  - - [256, 8192, 1, 4096, 256, 256, 4096, 4096]
    - [12, 4.013]
  - - [256, 8192, 1, 8192, 256, 256, 8192, 8192]
    - [28, 8.103]
  - - [512, 128, 1, 128, 512, 512, 128, 128]
    - [6, 0.315]
  - - [512, 128, 1, 256, 512, 512, 256, 256]
    - [92, 0.614]
  - - [512, 128, 1, 512, 512, 512, 512, 512]
    - [73, 1.054]
  - - [512, 128, 1, 1024, 512, 512, 1024, 1024]
    - [89, 1.537]
  - - [512, 128, 1, 2048, 512, 512, 2048, 2048]
    - [91, 2.051]
  - - [512, 128, 1, 4096, 512, 512, 4096, 4096]
    - [81, 2.532]
  - - [512, 128, 1, 8192, 512, 512, 8192, 8192]
    - [83, 3.202]
  - - [512, 256, 1, 128, 512, 512, 128, 128]
    - [68, 0.607]
  - - [512, 256, 1, 256, 512, 512, 256, 256]
    - [68, 1.068]
  - - [512, 256, 1, 512, 512, 512, 512, 512]
    - [67, 1.738]
  - - [512, 256, 1, 1024, 512, 512, 1024, 1024]
    - [68, 2.457]
  - - [512, 256, 1, 2048, 512, 512, 2048, 2048]
    - [84, 3.171]
  - - [512, 256, 1, 4096, 512, 512, 4096, 4096]
    - [88, 3.595]
  - - [512, 256, 1, 8192, 512, 512, 8192, 8192]
    - [24, 4.299]
  - - [512, 512, 1, 128, 512, 512, 128, 128]
    - [60, 0.987]
  - - [512, 512, 1, 256, 512, 512, 256, 256]
    - [57, 1.698]
  - - [512, 512, 1, 512, 512, 512, 512, 512]
    - [54, 2.543]
  - - [512, 512, 1, 1024, 512, 512, 1024, 1024]
    - [52, 3.564]
  - - [512, 512, 1, 2048, 512, 512, 2048, 2048]
    - [63, 3.63]
  - - [512, 512, 1, 4096, 512, 512, 4096, 4096]
    - [24, 4.571]
  - - [512, 512, 1, 8192, 512, 512, 8192, 8192]
    - [33, 4.843]
  - - [512, 1024, 1, 128, 512, 512, 128, 128]
    - [3, 1.212]
  - - [512, 1024, 1, 256, 512, 512, 256, 256]
    - [24, 1.993]
  - - [512, 1024, 1, 512, 512, 512, 512, 512]
    - [24, 3.308]
  - - [512, 1024, 1, 1024, 512, 512, 1024, 1024]
    - [23, 4.503]
  - - [512, 1024, 1, 2048, 512, 512, 2048, 2048]
    - [15, 5.104]
  - - [512, 1024, 1, 4096, 512, 512, 4096, 4096]
    - [41, 5.514]
  - - [512, 1024, 1, 8192, 512, 512, 8192, 8192]
    - [40, 6.564]
  - - [512, 2048, 1, 128, 512, 512, 128, 128]
    - [24, 1.332]
  - - [512, 2048, 1, 256, 512, 512, 256, 256]
    - [36, 2.042]
  - - [512, 2048, 1, 512, 512, 512, 512, 512]
    - [43, 3.301]
  - - [512, 2048, 1, 1024, 512, 512, 1024, 1024]
    - [33, 4.668]
  - - [512, 2048, 1, 2048, 512, 512, 2048, 2048]
    - [34, 5.199]
  - - [512, 2048, 1, 4096, 512, 512, 4096, 4096]
    - [30, 6.083]
  - - [512, 2048, 1, 8192, 512, 512, 8192, 8192]
    - [15, 5.887]
  - - [512, 4096, 1, 128, 512, 512, 128, 128]
    - [61, 1.493]
  - - [512, 4096, 1, 256, 512, 512, 256, 256]
    - [19, 2.449]
  - - [512, 4096, 1, 512, 512, 512, 512, 512]
    - [17, 3.653]
  - - [512, 4096, 1, 1024, 512, 512, 1024, 1024]
    - [19, 5.229]
  - - [512, 4096, 1, 2048, 512, 512, 2048, 2048]
    - [31, 6.074]
  - - [512, 4096, 1, 4096, 512, 512, 4096, 4096]
    - [17, 7.268]
  - - [512, 4096, 1, 8192, 512, 512, 8192, 8192]
    - [30, 7.872]
  - - [512, 8192, 1, 128, 512, 512, 128, 128]
    - [22, 1.935]
  - - [512, 8192, 1, 256, 512, 512, 256, 256]
    - [46, 2.934]
  - - [512, 8192, 1, 512, 512, 512, 512, 512]
    - [22, 4.529]
  - - [512, 8192, 1, 1024, 512, 512, 1024, 1024]
    - [36, 5.769]
  - - [512, 8192, 1, 2048, 512, 512, 2048, 2048]
    - [37, 5.602]
  - - [512, 8192, 1, 4096, 512, 512, 4096, 4096]
    - [30, 7.039]
  - - [512, 8192, 1, 8192, 512, 512, 8192, 8192]
    - [9, 4.944]
  - - [1024, 128, 1, 128, 1024, 1024, 128, 128]
    - [66, 0.623]
  - - [1024, 128, 1, 256, 1024, 1024, 256, 256]
    - [69, 1.068]
  - - [1024, 128, 1, 512, 1024, 1024, 512, 512]
    - [80, 1.724]
  - - [1024, 128, 1, 1024, 1024, 1024, 1024, 1024]
    - [84, 2.465]
  - - [1024, 128, 1, 2048, 1024, 1024, 2048, 2048]
    - [80, 2.89]
  - - [1024, 128, 1, 4096, 1024, 1024, 4096, 4096]
    - [87, 3.637]
  - - [1024, 128, 1, 8192, 1024, 1024, 8192, 8192]
    - [36, 4.344]
  - - [1024, 256, 1, 128, 1024, 1024, 128, 128]
    - [50, 0.992]
  - - [1024, 256, 1, 256, 1024, 1024, 256, 256]
    - [64, 1.636]
  - - [1024, 256, 1, 512, 1024, 1024, 512, 512]
    - [59, 2.503]
  - - [1024, 256, 1, 1024, 1024, 1024, 1024, 1024]
    - [61, 3.114]
  - - [1024, 256, 1, 2048, 1024, 1024, 2048, 2048]
    - [55, 3.477]
  - - [1024, 256, 1, 4096, 1024, 1024, 4096, 4096]
    - [22, 4.669]
  - - [1024, 256, 1, 8192, 1024, 1024, 8192, 8192]
    - [27, 5.172]
  - - [1024, 512, 1, 128, 1024, 1024, 128, 128]
    - [2, 1.236]
  - - [1024, 512, 1, 256, 1024, 1024, 256, 256]
    - [24, 2.076]
  - - [1024, 512, 1, 512, 1024, 1024, 512, 512]
    - [23, 3.186]
  - - [1024, 512, 1, 1024, 1024, 1024, 1024, 1024]
    - [20, 4.404]
  - - [1024, 512, 1, 2048, 1024, 1024, 2048, 2048]
    - [21, 4.867]
  - - [1024, 512, 1, 4096, 1024, 1024, 4096, 4096]
    - [18, 5.464]
  - - [1024, 512, 1, 8192, 1024, 1024, 8192, 8192]
    - [28, 6.304]
  - - [1024, 1024, 1, 128, 1024, 1024, 128, 128]
    - [45, 1.311]
  - - [1024, 1024, 1, 256, 1024, 1024, 256, 256]
    - [24, 2.097]
  - - [1024, 1024, 1, 512, 1024, 1024, 512, 512]
    - [33, 3.309]
  - - [1024, 1024, 1, 1024, 1024, 1024, 1024, 1024]
    - [22, 4.748]
  - - [1024, 1024, 1, 2048, 1024, 1024, 2048, 2048]
    - [27, 4.703]
  - - [1024, 1024, 1, 4096, 1024, 1024, 4096, 4096]
    - [46, 6.147]
  - - [1024, 1024, 1, 8192, 1024, 1024, 8192, 8192]
    - [17, 5.822]
  - - [1024, 2048, 1, 128, 1024, 1024, 128, 128]
    - [2, 1.548]
  - - [1024, 2048, 1, 256, 1024, 1024, 256, 256]
    - [19, 2.62]
  - - [1024, 2048, 1, 512, 1024, 1024, 512, 512]
    - [24, 3.877]
  - - [1024, 2048, 1, 1024, 1024, 1024, 1024, 1024]
    - [33, 5.186]
  - - [1024, 2048, 1, 2048, 1024, 1024, 2048, 2048]
    - [46, 6.176]
  - - [1024, 2048, 1, 4096, 1024, 1024, 4096, 4096]
    - [43, 7.07]
  - - [1024, 2048, 1, 8192, 1024, 1024, 8192, 8192]
    - [35, 7.811]
  - - [1024, 4096, 1, 128, 1024, 1024, 128, 128]
    - [22, 1.698]
  - - [1024, 4096, 1, 256, 1024, 1024, 256, 256]
    - [43, 2.845]
  - - [1024, 4096, 1, 512, 1024, 1024, 512, 512]
    - [46, 4.416]
  - - [1024, 4096, 1, 1024, 1024, 1024, 1024, 1024]
    - [33, 5.62]
  - - [1024, 4096, 1, 2048, 1024, 1024, 2048, 2048]
    - [46, 6.422]
  - - [1024, 4096, 1, 4096, 1024, 1024, 4096, 4096]
    - [46, 7.253]
  - - [1024, 4096, 1, 8192, 1024, 1024, 8192, 8192]
    - [28, 7.638]
  - - [1024, 8192, 1, 128, 1024, 1024, 128, 128]
    - [43, 2.085]
  - - [1024, 8192, 1, 256, 1024, 1024, 256, 256]
    - [24, 3.181]
  - - [1024, 8192, 1, 512, 1024, 1024, 512, 512]
    - [36, 4.714]
  - - [1024, 8192, 1, 1024, 1024, 1024, 1024, 1024]
    - [30, 5.894]
  - - [1024, 8192, 1, 2048, 1024, 1024, 2048, 2048]
    - [44, 6.707]
  - - [1024, 8192, 1, 4096, 1024, 1024, 4096, 4096]
    - [30, 7.373]
  - - [1024, 8192, 1, 8192, 1024, 1024, 8192, 8192]
    - [35, 8.092]
  - - [2048, 128, 1, 128, 2048, 2048, 128, 128]
    - [58, 0.985]
  - - [2048, 128, 1, 256, 2048, 2048, 256, 256]
    - [53, 1.624]
  - - [2048, 128, 1, 512, 2048, 2048, 512, 512]
    - [56, 2.384]
  - - [2048, 128, 1, 1024, 2048, 2048, 1024, 1024]
    - [62, 2.832]
  - - [2048, 128, 1, 2048, 2048, 2048, 2048, 2048]
    - [59, 3.376]
  - - [2048, 128, 1, 4096, 2048, 2048, 4096, 4096]
    - [43, 4.577]
  - - [2048, 128, 1, 8192, 2048, 2048, 8192, 8192]
    - [26, 5.411]
  - - [2048, 256, 1, 128, 2048, 2048, 128, 128]
    - [1, 1.189]
  - - [2048, 256, 1, 256, 2048, 2048, 256, 256]
    - [36, 1.901]
  - - [2048, 256, 1, 512, 2048, 2048, 512, 512]
    - [24, 3.286]
  - - [2048, 256, 1, 1024, 2048, 2048, 1024, 1024]
    - [30, 4.169]
  - - [2048, 256, 1, 2048, 2048, 2048, 2048, 2048]
    - [17, 4.833]
  - - [2048, 256, 1, 4096, 2048, 2048, 4096, 4096]
    - [17, 6.094]
  - - [2048, 256, 1, 8192, 2048, 2048, 8192, 8192]
    - [17, 6.918]
  - - [2048, 512, 1, 128, 2048, 2048, 128, 128]
    - [22, 1.381]
  - - [2048, 512, 1, 256, 2048, 2048, 256, 256]
    - [22, 2.096]
  - - [2048, 512, 1, 512, 2048, 2048, 512, 512]
    - [43, 3.251]
  - - [2048, 512, 1, 1024, 2048, 2048, 1024, 1024]
    - [21, 4.368]
  - - [2048, 512, 1, 2048, 2048, 2048, 2048, 2048]
    - [18, 5.083]
  - - [2048, 512, 1, 4096, 2048, 2048, 4096, 4096]
    - [20, 5.791]
  - - [2048, 512, 1, 8192, 2048, 2048, 8192, 8192]
    - [19, 7.085]
  - - [2048, 1024, 1, 128, 2048, 2048, 128, 128]
    - [22, 1.567]
  - - [2048, 1024, 1, 256, 2048, 2048, 256, 256]
    - [36, 2.631]
  - - [2048, 1024, 1, 512, 2048, 2048, 512, 512]
    - [46, 3.874]
  - - [2048, 1024, 1, 1024, 2048, 2048, 1024, 1024]
    - [22, 5.157]
  - - [2048, 1024, 1, 2048, 2048, 2048, 2048, 2048]
    - [49, 5.262]
  - - [2048, 1024, 1, 4096, 2048, 2048, 4096, 4096]
    - [39, 6.167]
  - - [2048, 1024, 1, 8192, 2048, 2048, 8192, 8192]
    - [18, 7.817]
  - - [2048, 2048, 1, 128, 2048, 2048, 128, 128]
    - [27, 1.872]
  - - [2048, 2048, 1, 256, 2048, 2048, 256, 256]
    - [33, 2.886]
  - - [2048, 2048, 1, 512, 2048, 2048, 512, 512]
    - [22, 4.42]
  - - [2048, 2048, 1, 1024, 2048, 2048, 1024, 1024]
    - [44, 5.603]
  - - [2048, 2048, 1, 2048, 2048, 2048, 2048, 2048]
    - [46, 5.887]
  - - [2048, 2048, 1, 4096, 2048, 2048, 4096, 4096]
    - [45, 7.171]
  - - [2048, 2048, 1, 8192, 2048, 2048, 8192, 8192]
    - [39, 8.262]
  - - [2048, 4096, 1, 128, 2048, 2048, 128, 128]
    - [24, 2.118]
  - - [2048, 4096, 1, 256, 2048, 2048, 256, 256]
    - [24, 3.434]
  - - [2048, 4096, 1, 512, 2048, 2048, 512, 512]
    - [22, 4.709]
  - - [2048, 4096, 1, 1024, 2048, 2048, 1024, 1024]
    - [41, 5.741]
  - - [2048, 4096, 1, 2048, 2048, 2048, 2048, 2048]
    - [46, 6.711]
  - - [2048, 4096, 1, 4096, 2048, 2048, 4096, 4096]
    - [41, 7.852]
  - - [2048, 4096, 1, 8192, 2048, 2048, 8192, 8192]
    - [33, 8.457]
  - - [2048, 8192, 1, 128, 2048, 2048, 128, 128]
    - [0, 2.152]
  - - [2048, 8192, 1, 256, 2048, 2048, 256, 256]
    - [24, 3.318]
  - - [2048, 8192, 1, 512, 2048, 2048, 512, 512]
    - [44, 4.696]
  - - [2048, 8192, 1, 1024, 2048, 2048, 1024, 1024]
    - [43, 5.774]
  - - [2048, 8192, 1, 2048, 2048, 2048, 2048, 2048]
    - [44, 6.769]
  - - [2048, 8192, 1, 4096, 2048, 2048, 4096, 4096]
    - [43, 7.738]
  - - [2048, 8192, 1, 8192, 2048, 2048, 8192, 8192]
    - [42, 6.262]
  - - [4096, 128, 1, 128, 4096, 4096, 128, 128]
    - [0, 1.218]
  - - [4096, 128, 1, 256, 4096, 4096, 256, 256]
    - [40, 1.97]
  - - [4096, 128, 1, 512, 4096, 4096, 512, 512]
    - [17, 3.015]
  - - [4096, 128, 1, 1024, 4096, 4096, 1024, 1024]
    - [17, 3.67]
  - - [4096, 128, 1, 2048, 4096, 4096, 2048, 2048]
    - [18, 4.656]
  - - [4096, 128, 1, 4096, 4096, 4096, 4096, 4096]
    - [38, 5.906]
  - - [4096, 128, 1, 8192, 4096, 4096, 8192, 8192]
    - [24, 6.717]
  - - [4096, 256, 1, 128, 4096, 4096, 128, 128]
    - [19, 1.374]
  - - [4096, 256, 1, 256, 4096, 4096, 256, 256]
    - [16, 1.931]
  - - [4096, 256, 1, 512, 4096, 4096, 512, 512]
    - [30, 2.999]
  - - [4096, 256, 1, 1024, 4096, 4096, 1024, 1024]
    - [47, 4.032]
  - - [4096, 256, 1, 2048, 4096, 4096, 2048, 2048]
    - [17, 5.969]
  - - [4096, 256, 1, 4096, 4096, 4096, 4096, 4096]
    - [21, 6.151]
  - - [4096, 256, 1, 8192, 4096, 4096, 8192, 8192]
    - [20, 7.26]
  - - [4096, 512, 1, 128, 4096, 4096, 128, 128]
    - [19, 1.574]
  - - [4096, 512, 1, 256, 4096, 4096, 256, 256]
    - [19, 2.694]
  - - [4096, 512, 1, 512, 4096, 4096, 512, 512]
    - [19, 3.789]
  - - [4096, 512, 1, 1024, 4096, 4096, 1024, 1024]
    - [40, 4.948]
  - - [4096, 512, 1, 2048, 4096, 4096, 2048, 2048]
    - [24, 5.612]
  - - [4096, 512, 1, 4096, 4096, 4096, 4096, 4096]
    - [43, 6.876]
  - - [4096, 512, 1, 8192, 4096, 4096, 8192, 8192]
    - [34, 7.712]
  - - [4096, 1024, 1, 128, 4096, 4096, 128, 128]
    - [10, 1.839]
  - - [4096, 1024, 1, 256, 4096, 4096, 256, 256]
    - [19, 2.953]
  - - [4096, 1024, 1, 512, 4096, 4096, 512, 512]
    - [33, 4.352]
  - - [4096, 1024, 1, 1024, 4096, 4096, 1024, 1024]
    - [44, 5.482]
  - - [4096, 1024, 1, 2048, 4096, 4096, 2048, 2048]
    - [44, 6.283]
  - - [4096, 1024, 1, 4096, 4096, 4096, 4096, 4096]
    - [44, 6.299]
  - - [4096, 1024, 1, 8192, 4096, 4096, 8192, 8192]
    - [33, 7.758]
  - - [4096, 2048, 1, 128, 4096, 4096, 128, 128]
    - [19, 2.092]
  - - [4096, 2048, 1, 256, 4096, 4096, 256, 256]
    - [22, 3.245]
  - - [4096, 2048, 1, 512, 4096, 4096, 512, 512]
    - [46, 4.596]
  - - [4096, 2048, 1, 1024, 4096, 4096, 1024, 1024]
    - [30, 5.636]
  - - [4096, 2048, 1, 2048, 4096, 4096, 2048, 2048]
    - [41, 6.763]
  - - [4096, 2048, 1, 4096, 4096, 4096, 4096, 4096]
    - [39, 7.907]
  - - [4096, 2048, 1, 8192, 4096, 4096, 8192, 8192]
    - [44, 8.064]
  - - [4096, 4096, 1, 128, 4096, 4096, 128, 128]
    - [19, 2.272]
  - - [4096, 4096, 1, 256, 4096, 4096, 256, 256]
    - [30, 3.34]
  - - [4096, 4096, 1, 512, 4096, 4096, 512, 512]
    - [33, 4.71]
  - - [4096, 4096, 1, 1024, 4096, 4096, 1024, 1024]
    - [33, 5.595]
  - - [4096, 4096, 1, 2048, 4096, 4096, 2048, 2048]
    - [46, 6.723]
  - - [4096, 4096, 1, 4096, 4096, 4096, 4096, 4096]
    - [36, 7.715]
  - - [4096, 4096, 1, 8192, 4096, 4096, 8192, 8192]
    - [35, 8.124]
  - - [4096, 8192, 1, 128, 4096, 4096, 128, 128]
    - [26, 2.181]
  - - [4096, 8192, 1, 256, 4096, 4096, 256, 256]
    - [17, 3.296]
  - - [4096, 8192, 1, 512, 4096, 4096, 512, 512]
    - [30, 4.501]
  - - [4096, 8192, 1, 1024, 4096, 4096, 1024, 1024]
    - [33, 5.618]
  - - [4096, 8192, 1, 2048, 4096, 4096, 2048, 2048]
    - [40, 6.716]
  - - [4096, 8192, 1, 4096, 4096, 4096, 4096, 4096]
    - [33, 6.371]
  - - [4096, 8192, 1, 8192, 4096, 4096, 8192, 8192]
    - [39, 7.407]
  - - [8192, 128, 1, 128, 8192, 8192, 128, 128]
    - [14, 1.364]
  - - [8192, 128, 1, 256, 8192, 8192, 256, 256]
    - [40, 2.011]
  - - [8192, 128, 1, 512, 8192, 8192, 512, 512]
    - [19, 3.173]
  - - [8192, 128, 1, 1024, 8192, 8192, 1024, 1024]
    - [19, 4.471]
  - - [8192, 128, 1, 2048, 8192, 8192, 2048, 2048]
    - [19, 5.749]
  - - [8192, 128, 1, 4096, 8192, 8192, 4096, 4096]
    - [43, 6.924]
  - - [8192, 128, 1, 8192, 8192, 8192, 8192, 8192]
    - [30, 7.401]
  - - [8192, 256, 1, 128, 8192, 8192, 128, 128]
    - [22, 1.553]
  - - [8192, 256, 1, 256, 8192, 8192, 256, 256]
    - [19, 2.585]
  - - [8192, 256, 1, 512, 8192, 8192, 512, 512]
    - [40, 3.692]
  - - [8192, 256, 1, 1024, 8192, 8192, 1024, 1024]
    - [33, 4.772]
  - - [8192, 256, 1, 2048, 8192, 8192, 2048, 2048]
    - [22, 5.67]
  - - [8192, 256, 1, 4096, 8192, 8192, 4096, 4096]
    - [36, 6.868]
  - - [8192, 256, 1, 8192, 8192, 8192, 8192, 8192]
    - [40, 7.763]
  - - [8192, 512, 1, 128, 8192, 8192, 128, 128]
    - [19, 1.902]
  - - [8192, 512, 1, 256, 8192, 8192, 256, 256]
    - [19, 2.882]
  - - [8192, 512, 1, 512, 8192, 8192, 512, 512]
    - [46, 4.318]
  - - [8192, 512, 1, 1024, 8192, 8192, 1024, 1024]
    - [43, 5.415]
  - - [8192, 512, 1, 2048, 8192, 8192, 2048, 2048]
    - [30, 6.049]
  - - [8192, 512, 1, 4096, 8192, 8192, 4096, 4096]
    - [43, 7.365]
  - - [8192, 512, 1, 8192, 8192, 8192, 8192, 8192]
    - [36, 8.094]
  - - [8192, 1024, 1, 128, 8192, 8192, 128, 128]
    - [10, 2.076]
  - - [8192, 1024, 1, 256, 8192, 8192, 256, 256]
    - [19, 3.214]
  - - [8192, 1024, 1, 512, 8192, 8192, 512, 512]
    - [36, 4.679]
  - - [8192, 1024, 1, 1024, 8192, 8192, 1024, 1024]
    - [34, 5.648]
  - - [8192, 1024, 1, 2048, 8192, 8192, 2048, 2048]
    - [42, 6.556]
  - - [8192, 1024, 1, 4096, 8192, 8192, 4096, 4096]
    - [30, 7.747]
  - - [8192, 1024, 1, 8192, 8192, 8192, 8192, 8192]
    - [28, 8.36]
  - - [8192, 2048, 1, 128, 8192, 8192, 128, 128]
    - [46, 2.149]
  - - [8192, 2048, 1, 256, 8192, 8192, 256, 256]
    - [19, 3.322]
  - - [8192, 2048, 1, 512, 8192, 8192, 512, 512]
    - [30, 4.762]
  - - [8192, 2048, 1, 1024, 8192, 8192, 1024, 1024]
    - [36, 5.857]
  - - [8192, 2048, 1, 2048, 8192, 8192, 2048, 2048]
    - [45, 6.604]
  - - [8192, 2048, 1, 4096, 8192, 8192, 4096, 4096]
    - [44, 8.039]
  - - [8192, 2048, 1, 8192, 8192, 8192, 8192, 8192]
    - [34, 7.886]
  - - [8192, 4096, 1, 128, 8192, 8192, 128, 128]
    - [17, 2.222]
  - - [8192, 4096, 1, 256, 8192, 8192, 256, 256]
    - [20, 3.219]
  - - [8192, 4096, 1, 512, 8192, 8192, 512, 512]
    - [41, 4.552]
  - - [8192, 4096, 1, 1024, 8192, 8192, 1024, 1024]
    - [29, 5.532]
  - - [8192, 4096, 1, 2048, 8192, 8192, 2048, 2048]
    - [40, 6.589]
  - - [8192, 4096, 1, 4096, 8192, 8192, 4096, 4096]
    - [31, 7.478]
  - - [8192, 4096, 1, 8192, 8192, 8192, 8192, 8192]
    - [34, 7.645]
  - - [8192, 8192, 1, 128, 8192, 8192, 128, 128]
    - [32, 1.851]
  - - [8192, 8192, 1, 256, 8192, 8192, 256, 256]
    - [25, 2.898]
  - - [8192, 8192, 1, 512, 8192, 8192, 512, 512]
    - [48, 4.045]
  - - [8192, 8192, 1, 1024, 8192, 8192, 1024, 1024]
    - [36, 5.523]
  - - [8192, 8192, 1, 2048, 8192, 8192, 2048, 2048]
    - [38, 6.004]
  - - [8192, 8192, 1, 4096, 8192, 8192, 4096, 4096]
    - [29, 7.18]
  - - [8192, 8192, 1, 8192, 8192, 8192, 8192, 8192]
    - [35, 7.251]
  - - [1, 1, 1, 32, 1, 1, 32, 32]
    - [97, 0.0]
- null
- null
- ExperimentalStreamK
- GridBased
