library/src/amd_detail/rocblaslt/src/Tensile/Logic/asm_full/aquavanjaram/gfx942_38cu/StreamK/aquavanjaram942_Cijk_Alik_Bljk_HHS_BH_UserArgs.yaml
- {MinimumRequiredVersion: 4.33.0}
- aquavanjaram942
- {Architecture: gfx942, CUCount: 38}
- [Device 0049, Device 0050]
    SolutionIndex: 0
    SolutionNameMin: Cijk_Alik_Bljk_HHS_BH_UserArgs_MT128x64x32_MI16x16x1_SN_LDSB0_CLR1_GSU0_GSUC0_GSUWGMRR0_K1_LBSPPA128_LBSPPB128_MIWT4_2_PLR1_SU32_SUM0_SUS256_VWA2_VWB1_WGM1_WGMXCC1_WGMXCCGn1
    SolutionIndex: 1
    SolutionNameMin: Cijk_Alik_Bljk_HHS_BH_UserArgs_MT64x32x32_MI16x16x1_SN_LDSB0_CLR0_GSU0_GSUC0_GSUWGMRR0_K1_LBSPPA128_LBSPPB128_MIWT2_1_PLR0_SU32_SUM0_SUS256_VWA2_VWB1_WGM1_WGMXCC1_WGMXCCGn1
    SolutionIndex: 2
    SolutionNameMin: Cijk_Alik_Bljk_HHS_BH_UserArgs_MT64x32x32_MI16x16x1_SN_LDSB0_CLR0_GSU0_GSUC0_GSUWGMRR0_K1_LBSPPA128_LBSPPB128_MIWT2_1_PLR0_SU32_SUM0_SUS256_VWA2_VWB1_WGM4_WGMXCC1_WGMXCCGn1
    SolutionIndex: 3
    SolutionNameMin: Cijk_Alik_Bljk_HHS_BH_UserArgs_MT64x32x32_MI16x16x1_SN_LDSB0_CLR1_GSU0_GSUC0_GSUWGMRR0_K1_LBSPPA128_LBSPPB128_MIWT2_1_PLR1_SU32_SUM0_SUS256_VWA2_VWB1_WGM8_WGMXCC1_WGMXCCGn1
    SolutionIndex: 4
    SolutionNameMin: Cijk_Alik_Bljk_HHS_BH_UserArgs_MT64x256x64_MI16x16x1_SN_LDSB1_CLR1_GSU0_GSUC0_GSUWGMRR0_K1_LBSPPA256_LBSPPB1024_MIWT2_8_PLR2_SU32_SUM0_SUS256_VWA2_VWB8_WGM1_WGMXCC1_WGMXCCGn1
    SolutionIndex: 5
    SolutionNameMin: Cijk_Alik_Bljk_HHS_BH_UserArgs_MT256x64x64_MI16x16x1_SN_LDSB1_CLR1_GSU0_GSUC0_GSUWGMRR0_K1_LBSPPA1024_LBSPPB128_MIWT8_2_PLR1_SU32_SUM0_SUS256_VWA8_VWB1_WGM1_WGMXCC1_WGMXCCGn1
    SolutionIndex: 6
    SolutionNameMin: Cijk_Alik_Bljk_HHS_BH_UserArgs_MT256x64x64_MI16x16x1_SN_LDSB1_CLR1_GSU0_GSUC0_GSUWGMRR0_K1_LBSPPA256_LBSPPB256_MIWT8_2_PLR1_SU32_SUM0_SUS256_VWA2_VWB2_WGM1_WGMXCC1_WGMXCCGn1
    SolutionIndex: 7
    SolutionNameMin: Cijk_Alik_Bljk_HHS_BH_UserArgs_MT256x64x64_MI16x16x1_SN_LDSB1_CLR1_GSU0_GSUC0_GSUWGMRR0_K1_LBSPPA512_LBSPPB256_MIWT8_2_PLR1_SU32_SUM0_SUS256_VWA4_VWB2_WGM1_WGMXCC1_WGMXCCGn1
    SolutionIndex: 8
    SolutionNameMin: Cijk_Alik_Bljk_HHS_BH_UserArgs_MT256x64x64_MI16x16x1_SN_LDSB1_CLR1_GSU0_GSUC0_GSUWGMRR0_K1_LBSPPA1024_LBSPPB256_MIWT8_2_PLR1_SU32_SUM0_SUS256_VWA8_VWB2_WGM1_WGMXCC1_WGMXCCGn1
    SolutionIndex: 9
    SolutionNameMin: Cijk_Alik_Bljk_HHS_BH_UserArgs_MT256x64x64_MI16x16x1_SN_LDSB1_CLR1_GSU0_GSUC0_GSUWGMRR0_K1_LBSPPA1024_LBSPPB256_MIWT8_2_PLR1_SU32_SUM0_SUS256_VWA8_VWB2_WGM8_WGMXCC1_WGMXCCGn1
    SolutionIndex: 10
    SolutionNameMin: Cijk_Alik_Bljk_HHS_BH_UserArgs_MT128x128x64_MI16x16x1_SN_LDSB1_CLR1_GSU0_GSUC0_GSUWGMRR0_K1_LBSPPA128_LBSPPB128_MIWT4_4_PLR1_SU32_SUM0_SUS256_VWA1_VWB1_WGM1_WGMXCC1_WGMXCCGn1
    SolutionIndex: 11
    SolutionNameMin: Cijk_Alik_Bljk_HHS_BH_UserArgs_MT128x128x64_MI16x16x1_SN_LDSB1_CLR1_GSU0_GSUC0_GSUWGMRR0_K1_LBSPPA256_LBSPPB128_MIWT4_4_PLR1_SU32_SUM0_SUS256_VWA2_VWB1_WGM1_WGMXCC1_WGMXCCGn1
    SolutionIndex: 12
    SolutionNameMin: Cijk_Alik_Bljk_HHS_BH_UserArgs_MT128x128x64_MI16x16x1_SN_LDSB1_CLR1_GSU0_GSUC0_GSUWGMRR0_K1_LBSPPA512_LBSPPB128_MIWT4_4_PLR1_SU32_SUM0_SUS256_VWA4_VWB1_WGM1_WGMXCC1_WGMXCCGn1
    SolutionIndex: 13
    SolutionNameMin: Cijk_Alik_Bljk_HHS_BH_UserArgs_MT128x128x64_MI16x16x1_SN_LDSB1_CLR1_GSU0_GSUC0_GSUWGMRR0_K1_LBSPPA256_LBSPPB256_MIWT4_4_PLR1_SU32_SUM0_SUS256_VWA2_VWB2_WGM1_WGMXCC1_WGMXCCGn1
    SolutionIndex: 14
    SolutionNameMin: Cijk_Alik_Bljk_HHS_BH_UserArgs_MT128x128x64_MI16x16x1_SN_LDSB1_CLR1_GSU0_GSUC0_GSUWGMRR0_K1_LBSPPA512_LBSPPB256_MIWT4_4_PLR1_SU32_SUM0_SUS256_VWA4_VWB2_WGM1_WGMXCC1_WGMXCCGn1
    SolutionIndex: 15
    SolutionNameMin: Cijk_Alik_Bljk_HHS_BH_UserArgs_MT128x128x64_MI16x16x1_SN_LDSB1_CLR1_GSU0_GSUC0_GSUWGMRR0_K1_LBSPPA256_LBSPPB512_MIWT4_4_PLR1_SU32_SUM0_SUS256_VWA2_VWB4_WGM1_WGMXCC1_WGMXCCGn1
    SolutionIndex: 16
    SolutionNameMin: Cijk_Alik_Bljk_HHS_BH_UserArgs_MT128x128x64_MI16x16x1_SN_LDSB1_CLR1_GSU0_GSUC0_GSUWGMRR0_K1_LBSPPA512_LBSPPB512_MIWT4_4_PLR1_SU32_SUM0_SUS256_VWA4_VWB4_WGM1_WGMXCC1_WGMXCCGn1
    SolutionIndex: 17
    SolutionNameMin: Cijk_Alik_Bljk_HHS_BH_UserArgs_MT128x128x64_MI16x16x1_SN_LDSB1_CLR1_GSU0_GSUC0_GSUWGMRR0_K1_LBSPPA128_LBSPPB128_MIWT4_4_PLR1_SU32_SUM0_SUS256_VWA1_VWB1_WGM4_WGMXCC1_WGMXCCGn1
    SolutionIndex: 18
    SolutionNameMin: Cijk_Alik_Bljk_HHS_BH_UserArgs_MT128x128x64_MI16x16x1_SN_LDSB1_CLR1_GSU0_GSUC0_GSUWGMRR0_K1_LBSPPA256_LBSPPB128_MIWT4_4_PLR1_SU32_SUM0_SUS256_VWA2_VWB1_WGM4_WGMXCC1_WGMXCCGn1
    SolutionIndex: 19
    SolutionNameMin: Cijk_Alik_Bljk_HHS_BH_UserArgs_MT128x128x64_MI16x16x1_SN_LDSB1_CLR1_GSU0_GSUC0_GSUWGMRR0_K1_LBSPPA512_LBSPPB128_MIWT4_4_PLR1_SU32_SUM0_SUS256_VWA4_VWB1_WGM4_WGMXCC1_WGMXCCGn1
    SolutionIndex: 20
    SolutionNameMin: Cijk_Alik_Bljk_HHS_BH_UserArgs_MT128x128x64_MI16x16x1_SN_LDSB1_CLR1_GSU0_GSUC0_GSUWGMRR0_K1_LBSPPA128_LBSPPB256_MIWT4_4_PLR1_SU32_SUM0_SUS256_VWA1_VWB2_WGM4_WGMXCC1_WGMXCCGn1
    SolutionIndex: 21
    SolutionNameMin: Cijk_Alik_Bljk_HHS_BH_UserArgs_MT128x128x64_MI16x16x1_SN_LDSB1_CLR1_GSU0_GSUC0_GSUWGMRR0_K1_LBSPPA256_LBSPPB256_MIWT4_4_PLR1_SU32_SUM0_SUS256_VWA2_VWB2_WGM4_WGMXCC1_WGMXCCGn1
    SolutionIndex: 22
    SolutionNameMin: Cijk_Alik_Bljk_HHS_BH_UserArgs_MT128x128x64_MI16x16x1_SN_LDSB1_CLR1_GSU0_GSUC0_GSUWGMRR0_K1_LBSPPA512_LBSPPB256_MIWT4_4_PLR1_SU32_SUM0_SUS256_VWA4_VWB2_WGM4_WGMXCC1_WGMXCCGn1
    SolutionIndex: 23
    SolutionNameMin: Cijk_Alik_Bljk_HHS_BH_UserArgs_MT128x128x64_MI16x16x1_SN_LDSB1_CLR1_GSU0_GSUC0_GSUWGMRR0_K1_LBSPPA128_LBSPPB512_MIWT4_4_PLR1_SU32_SUM0_SUS256_VWA1_VWB4_WGM4_WGMXCC1_WGMXCCGn1
    SolutionIndex: 24
    SolutionNameMin: Cijk_Alik_Bljk_HHS_BH_UserArgs_MT128x128x64_MI16x16x1_SN_LDSB1_CLR1_GSU0_GSUC0_GSUWGMRR0_K1_LBSPPA256_LBSPPB512_MIWT4_4_PLR1_SU32_SUM0_SUS256_VWA2_VWB4_WGM4_WGMXCC1_WGMXCCGn1
    SolutionIndex: 25
    SolutionNameMin: Cijk_Alik_Bljk_HHS_BH_UserArgs_MT128x128x64_MI16x16x1_SN_LDSB1_CLR1_GSU0_GSUC0_GSUWGMRR0_K1_LBSPPA512_LBSPPB512_MIWT4_4_PLR1_SU32_SUM0_SUS256_VWA4_VWB4_WGM4_WGMXCC1_WGMXCCGn1
    SolutionIndex: 26
    SolutionNameMin: Cijk_Alik_Bljk_HHS_BH_UserArgs_MT128x128x64_MI16x16x1_SN_LDSB1_CLR1_GSU0_GSUC0_GSUWGMRR0_K1_LBSPPA512_LBSPPB256_MIWT4_4_PLR2_SU32_SUM0_SUS256_VWA4_VWB2_WGM4_WGMXCC1_WGMXCCGn1
    SolutionIndex: 27
    SolutionNameMin: Cijk_Alik_Bljk_HHS_BH_UserArgs_MT128x128x64_MI16x16x1_SN_LDSB1_CLR1_GSU0_GSUC0_GSUWGMRR0_K1_LBSPPA128_LBSPPB128_MIWT4_4_PLR1_SU32_SUM0_SUS256_VWA1_VWB1_WGM8_WGMXCC1_WGMXCCGn1
    SolutionIndex: 28
    SolutionNameMin: Cijk_Alik_Bljk_HHS_BH_UserArgs_MT128x128x64_MI16x16x1_SN_LDSB1_CLR1_GSU0_GSUC0_GSUWGMRR0_K1_LBSPPA256_LBSPPB128_MIWT4_4_PLR1_SU32_SUM0_SUS256_VWA2_VWB1_WGM8_WGMXCC1_WGMXCCGn1
    SolutionIndex: 29
    SolutionNameMin: Cijk_Alik_Bljk_HHS_BH_UserArgs_MT128x128x64_MI16x16x1_SN_LDSB1_CLR1_GSU0_GSUC0_GSUWGMRR0_K1_LBSPPA512_LBSPPB128_MIWT4_4_PLR1_SU32_SUM0_SUS256_VWA4_VWB1_WGM8_WGMXCC1_WGMXCCGn1
    SolutionIndex: 30
    SolutionNameMin: Cijk_Alik_Bljk_HHS_BH_UserArgs_MT128x128x64_MI16x16x1_SN_LDSB1_CLR1_GSU0_GSUC0_GSUWGMRR0_K1_LBSPPA128_LBSPPB256_MIWT4_4_PLR1_SU32_SUM0_SUS256_VWA1_VWB2_WGM8_WGMXCC1_WGMXCCGn1
    SolutionIndex: 31
    SolutionNameMin: Cijk_Alik_Bljk_HHS_BH_UserArgs_MT128x128x64_MI16x16x1_SN_LDSB1_CLR1_GSU0_GSUC0_GSUWGMRR0_K1_LBSPPA256_LBSPPB256_MIWT4_4_PLR1_SU32_SUM0_SUS256_VWA2_VWB2_WGM8_WGMXCC1_WGMXCCGn1
    SolutionIndex: 32
    SolutionNameMin: Cijk_Alik_Bljk_HHS_BH_UserArgs_MT128x128x64_MI16x16x1_SN_LDSB1_CLR1_GSU0_GSUC0_GSUWGMRR0_K1_LBSPPA512_LBSPPB256_MIWT4_4_PLR1_SU32_SUM0_SUS256_VWA4_VWB2_WGM8_WGMXCC1_WGMXCCGn1
    SolutionIndex: 33
    SolutionNameMin: Cijk_Alik_Bljk_HHS_BH_UserArgs_MT128x128x64_MI16x16x1_SN_LDSB1_CLR1_GSU0_GSUC0_GSUWGMRR0_K1_LBSPPA128_LBSPPB512_MIWT4_4_PLR1_SU32_SUM0_SUS256_VWA1_VWB4_WGM8_WGMXCC1_WGMXCCGn1
    SolutionIndex: 34
    SolutionNameMin: Cijk_Alik_Bljk_HHS_BH_UserArgs_MT128x128x64_MI16x16x1_SN_LDSB1_CLR1_GSU0_GSUC0_GSUWGMRR0_K1_LBSPPA256_LBSPPB512_MIWT4_4_PLR1_SU32_SUM0_SUS256_VWA2_VWB4_WGM8_WGMXCC1_WGMXCCGn1
    SolutionIndex: 35
    SolutionNameMin: Cijk_Alik_Bljk_HHS_BH_UserArgs_MT128x128x64_MI16x16x1_SN_LDSB1_CLR1_GSU0_GSUC0_GSUWGMRR0_K1_LBSPPA512_LBSPPB512_MIWT4_4_PLR1_SU32_SUM0_SUS256_VWA4_VWB4_WGM8_WGMXCC1_WGMXCCGn1
    SolutionIndex: 36
    SolutionNameMin: Cijk_Alik_Bljk_HHS_BH_UserArgs_MT64x128x64_MI16x16x1_SN_LDSB1_CLR1_GSU0_GSUC0_GSUWGMRR0_K1_LBSPPA256_LBSPPB128_MIWT2_4_PLR1_SU32_SUM0_SUS256_VWA2_VWB1_WGM1_WGMXCC1_WGMXCCGn1
    SolutionIndex: 37
    SolutionNameMin: Cijk_Alik_Bljk_HHS_BH_UserArgs_MT64x128x64_MI16x16x1_SN_LDSB1_CLR1_GSU0_GSUC0_GSUWGMRR0_K1_LBSPPA256_LBSPPB256_MIWT2_4_PLR1_SU32_SUM0_SUS256_VWA2_VWB2_WGM1_WGMXCC1_WGMXCCGn1
    SolutionIndex: 38
    SolutionNameMin: Cijk_Alik_Bljk_HHS_BH_UserArgs_MT64x128x64_MI16x16x1_SN_LDSB1_CLR1_GSU0_GSUC0_GSUWGMRR0_K1_LBSPPA256_LBSPPB512_MIWT2_4_PLR1_SU32_SUM0_SUS256_VWA2_VWB4_WGM1_WGMXCC1_WGMXCCGn1
    SolutionIndex: 39
    SolutionNameMin: Cijk_Alik_Bljk_HHS_BH_UserArgs_MT64x128x64_MI16x16x1_SN_LDSB1_CLR1_GSU0_GSUC0_GSUWGMRR0_K1_LBSPPA256_LBSPPB512_MIWT2_4_PLR1_SU32_SUM0_SUS256_VWA2_VWB4_WGM4_WGMXCC1_WGMXCCGn1
    SolutionIndex: 40
    SolutionNameMin: Cijk_Alik_Bljk_HHS_BH_UserArgs_MT64x128x64_MI16x16x1_SN_LDSB1_CLR1_GSU0_GSUC0_GSUWGMRR0_K1_LBSPPA256_LBSPPB256_MIWT2_4_PLR1_SU32_SUM0_SUS256_VWA2_VWB2_WGM8_WGMXCC1_WGMXCCGn1
    SolutionIndex: 41
    SolutionNameMin: Cijk_Alik_Bljk_HHS_BH_UserArgs_MT64x128x64_MI16x16x1_SN_LDSB1_CLR1_GSU0_GSUC0_GSUWGMRR0_K1_LBSPPA256_LBSPPB512_MIWT2_4_PLR1_SU32_SUM0_SUS256_VWA2_VWB4_WGM8_WGMXCC1_WGMXCCGn1
    SolutionIndex: 42
    SolutionNameMin: Cijk_Alik_Bljk_HHS_BH_UserArgs_MT128x64x64_MI16x16x1_SN_LDSB1_CLR1_GSU0_GSUC0_GSUWGMRR0_K1_LBSPPA128_LBSPPB128_MIWT4_2_PLR1_SU32_SUM0_SUS256_VWA1_VWB1_WGM1_WGMXCC1_WGMXCCGn1
    SolutionIndex: 43
    SolutionNameMin: Cijk_Alik_Bljk_HHS_BH_UserArgs_MT128x64x64_MI16x16x1_SN_LDSB1_CLR1_GSU0_GSUC0_GSUWGMRR0_K1_LBSPPA256_LBSPPB128_MIWT4_2_PLR1_SU32_SUM0_SUS256_VWA2_VWB1_WGM1_WGMXCC1_WGMXCCGn1
    SolutionIndex: 44
    SolutionNameMin: Cijk_Alik_Bljk_HHS_BH_UserArgs_MT128x64x64_MI16x16x1_SN_LDSB1_CLR1_GSU0_GSUC0_GSUWGMRR0_K1_LBSPPA512_LBSPPB128_MIWT4_2_PLR1_SU32_SUM0_SUS256_VWA4_VWB1_WGM1_WGMXCC1_WGMXCCGn1
    SolutionIndex: 45
    SolutionNameMin: Cijk_Alik_Bljk_HHS_BH_UserArgs_MT128x64x64_MI16x16x1_SN_LDSB1_CLR1_GSU0_GSUC0_GSUWGMRR0_K1_LBSPPA256_LBSPPB256_MIWT4_2_PLR1_SU32_SUM0_SUS256_VWA2_VWB2_WGM1_WGMXCC1_WGMXCCGn1
    SolutionIndex: 46
    SolutionNameMin: Cijk_Alik_Bljk_HHS_BH_UserArgs_MT128x64x64_MI16x16x1_SN_LDSB1_CLR1_GSU0_GSUC0_GSUWGMRR0_K1_LBSPPA512_LBSPPB256_MIWT4_2_PLR1_SU32_SUM0_SUS256_VWA4_VWB2_WGM1_WGMXCC1_WGMXCCGn1
    SolutionIndex: 47
    SolutionNameMin: Cijk_Alik_Bljk_HHS_BH_UserArgs_MT128x64x64_MI16x16x1_SN_LDSB1_CLR1_GSU0_GSUC0_GSUWGMRR0_K1_LBSPPA512_LBSPPB128_MIWT4_2_PLR2_SU32_SUM0_SUS256_VWA4_VWB1_WGM1_WGMXCC1_WGMXCCGn1
    SolutionIndex: 48
    SolutionNameMin: Cijk_Alik_Bljk_HHS_BH_UserArgs_MT128x64x64_MI16x16x1_SN_LDSB1_CLR1_GSU0_GSUC0_GSUWGMRR0_K1_LBSPPA256_LBSPPB256_MIWT4_2_PLR2_SU32_SUM0_SUS256_VWA2_VWB2_WGM1_WGMXCC1_WGMXCCGn1
    SolutionIndex: 49
    SolutionNameMin: Cijk_Alik_Bljk_HHS_BH_UserArgs_MT128x64x64_MI16x16x1_SN_LDSB1_CLR1_GSU0_GSUC0_GSUWGMRR0_K1_LBSPPA256_LBSPPB128_MIWT4_2_PLR1_SU32_SUM0_SUS256_VWA2_VWB1_WGM4_WGMXCC1_WGMXCCGn1
    SolutionIndex: 50
    SolutionNameMin: Cijk_Alik_Bljk_HHS_BH_UserArgs_MT128x64x64_MI16x16x1_SN_LDSB1_CLR1_GSU0_GSUC0_GSUWGMRR0_K1_LBSPPA512_LBSPPB128_MIWT4_2_PLR1_SU32_SUM0_SUS256_VWA4_VWB1_WGM4_WGMXCC1_WGMXCCGn1
    SolutionIndex: 51
    SolutionNameMin: Cijk_Alik_Bljk_HHS_BH_UserArgs_MT128x64x64_MI16x16x1_SN_LDSB1_CLR1_GSU0_GSUC0_GSUWGMRR0_K1_LBSPPA512_LBSPPB128_MIWT4_2_PLR1_SU32_SUM0_SUS256_VWA4_VWB1_WGM8_WGMXCC1_WGMXCCGn1
    SolutionIndex: 52
    SolutionNameMin: Cijk_Alik_Bljk_HHS_BH_UserArgs_MT128x64x64_MI16x16x1_SN_LDSB1_CLR1_GSU0_GSUC0_GSUWGMRR0_K1_LBSPPA512_LBSPPB256_MIWT4_2_PLR1_SU32_SUM0_SUS256_VWA4_VWB2_WGM8_WGMXCC1_WGMXCCGn1
    SolutionIndex: 53
    SolutionNameMin: Cijk_Alik_Bljk_HHS_BH_UserArgs_MT128x32x64_MI16x16x1_SN_LDSB1_CLR1_GSU0_GSUC0_GSUWGMRR0_K1_LBSPPA256_LBSPPB128_MIWT4_1_PLR1_SU32_SUM0_SUS256_VWA2_VWB1_WGM1_WGMXCC1_WGMXCCGn1
    SolutionIndex: 54
    SolutionNameMin: Cijk_Alik_Bljk_HHS_BH_UserArgs_MT64x64x64_MI16x16x1_SN_LDSB1_CLR1_GSU0_GSUC0_GSUWGMRR0_K1_LBSPPA256_LBSPPB128_MIWT2_2_PLR1_SU32_SUM0_SUS256_VWA2_VWB1_WGM1_WGMXCC1_WGMXCCGn1
    SolutionIndex: 55
    SolutionNameMin: Cijk_Alik_Bljk_HHS_BH_UserArgs_MT64x64x64_MI16x16x1_SN_LDSB1_CLR1_GSU0_GSUC0_GSUWGMRR0_K1_LBSPPA256_LBSPPB256_MIWT2_2_PLR1_SU32_SUM0_SUS256_VWA2_VWB2_WGM1_WGMXCC1_WGMXCCGn1
    SolutionIndex: 56
    SolutionNameMin: Cijk_Alik_Bljk_HHS_BH_UserArgs_MT64x64x64_MI16x16x1_SN_LDSB1_CLR1_GSU0_GSUC0_GSUWGMRR0_K1_LBSPPA256_LBSPPB128_MIWT2_2_PLR2_SU32_SUM0_SUS256_VWA2_VWB1_WGM1_WGMXCC1_WGMXCCGn1
    SolutionIndex: 57
    SolutionNameMin: Cijk_Alik_Bljk_HHS_BH_UserArgs_MT64x64x64_MI16x16x1_SN_LDSB1_CLR1_GSU0_GSUC0_GSUWGMRR0_K1_LBSPPA256_LBSPPB128_MIWT2_2_PLR1_SU32_SUM0_SUS256_VWA2_VWB1_WGM4_WGMXCC1_WGMXCCGn1
    SolutionIndex: 58
    SolutionNameMin: Cijk_Alik_Bljk_HHS_BH_UserArgs_MT64x64x64_MI16x16x1_SN_LDSB1_CLR1_GSU0_GSUC0_GSUWGMRR0_K1_LBSPPA256_LBSPPB256_MIWT2_2_PLR1_SU32_SUM0_SUS256_VWA2_VWB2_WGM4_WGMXCC1_WGMXCCGn1
    SolutionIndex: 59
    SolutionNameMin: Cijk_Alik_Bljk_HHS_BH_UserArgs_MT64x64x64_MI16x16x1_SN_LDSB1_CLR1_GSU0_GSUC0_GSUWGMRR0_K1_LBSPPA256_LBSPPB256_MIWT2_2_PLR2_SU32_SUM0_SUS256_VWA2_VWB2_WGM4_WGMXCC1_WGMXCCGn1
    SolutionIndex: 60
    SolutionNameMin: Cijk_Alik_Bljk_HHS_BH_UserArgs_MT64x64x64_MI16x16x1_SN_LDSB1_CLR1_GSU0_GSUC0_GSUWGMRR0_K1_LBSPPA256_LBSPPB256_MIWT2_2_PLR2_SU32_SUM0_SUS256_VWA2_VWB2_WGM8_WGMXCC1_WGMXCCGn1
    SolutionIndex: 61
    SolutionNameMin: Cijk_Alik_Bljk_HHS_BH_UserArgs_MT32x64x64_MI16x16x1_SN_LDSB0_CLR1_GSU0_GSUC0_GSUWGMRR0_K1_LBSPPA128_LBSPPB128_MIWT1_2_PLR1_SU32_SUM0_SUS256_VWA1_VWB1_WGM1_WGMXCC1_WGMXCCGn1
    SolutionIndex: 62
    SolutionNameMin: Cijk_Alik_Bljk_HHS_BH_UserArgs_MT32x64x64_MI16x16x1_SN_LDSB0_CLR1_GSU0_GSUC0_GSUWGMRR0_K1_LBSPPA128_LBSPPB256_MIWT1_2_PLR1_SU32_SUM0_SUS256_VWA1_VWB2_WGM1_WGMXCC1_WGMXCCGn1
    SolutionIndex: 63
    SolutionNameMin: Cijk_Alik_Bljk_HHS_BH_UserArgs_MT32x64x64_MI16x16x1_SN_LDSB0_CLR1_GSU0_GSUC0_GSUWGMRR0_K1_LBSPPA128_LBSPPB128_MIWT1_2_PLR1_SU32_SUM0_SUS256_VWA1_VWB1_WGM4_WGMXCC1_WGMXCCGn1
    SolutionIndex: 64
    SolutionNameMin: Cijk_Alik_Bljk_HHS_BH_UserArgs_MT64x32x64_MI16x16x1_SN_LDSB0_CLR1_GSU0_GSUC0_GSUWGMRR0_K1_LBSPPA128_LBSPPB128_MIWT2_1_PLR1_SU32_SUM0_SUS256_VWA1_VWB1_WGM1_WGMXCC1_WGMXCCGn1
    SolutionIndex: 65
    SolutionNameMin: Cijk_Alik_Bljk_HHS_BH_UserArgs_MT64x32x64_MI16x16x1_SN_LDSB0_CLR1_GSU0_GSUC0_GSUWGMRR0_K1_LBSPPA256_LBSPPB128_MIWT2_1_PLR1_SU32_SUM0_SUS256_VWA2_VWB1_WGM1_WGMXCC1_WGMXCCGn1
    SolutionIndex: 66
    SolutionNameMin: Cijk_Alik_Bljk_HHS_BH_UserArgs_MT64x32x64_MI16x16x1_SN_LDSB0_CLR1_GSU0_GSUC0_GSUWGMRR0_K1_LBSPPA128_LBSPPB128_MIWT2_1_PLR2_SU32_SUM0_SUS256_VWA1_VWB1_WGM1_WGMXCC1_WGMXCCGn1
    SolutionIndex: 67
    SolutionNameMin: Cijk_Alik_Bljk_HHS_BH_UserArgs_MT32x32x64_MI16x16x1_SN_LDSB0_CLR1_GSU0_GSUC0_GSUWGMRR0_K1_LBSPPA128_LBSPPB128_MIWT1_1_PLR1_SU32_SUM0_SUS256_VWA1_VWB1_WGM1_WGMXCC1_WGMXCCGn1
    SolutionIndex: 68
    SolutionNameMin: Cijk_Alik_Bljk_HHS_BH_UserArgs_MT32x32x64_MI16x16x1_SN_LDSB0_CLR1_GSU0_GSUC0_GSUWGMRR0_K1_LBSPPA128_LBSPPB128_MIWT1_1_PLR2_SU32_SUM0_SUS256_VWA1_VWB1_WGM1_WGMXCC1_WGMXCCGn1
    SolutionIndex: 69
    SolutionNameMin: Cijk_Alik_Bljk_HHS_BH_UserArgs_MT32x32x64_MI16x16x1_SN_LDSB0_CLR1_GSU0_GSUC0_GSUWGMRR0_K1_LBSPPA128_LBSPPB128_MIWT1_1_PLR1_SU32_SUM0_SUS256_VWA1_VWB1_WGM4_WGMXCC1_WGMXCCGn1
    SolutionIndex: 70
    SolutionNameMin: Cijk_Alik_Bljk_HHS_BH_UserArgs_MT64x64x128_MI16x16x1_SN_LDSB1_CLR1_GSU0_GSUC0_GSUWGMRR0_K1_LBSPPA256_LBSPPB256_MIWT2_2_PLR1_SU32_SUM0_SUS256_VWA1_VWB1_WGM1_WGMXCC1_WGMXCCGn1
    SolutionIndex: 71
    SolutionNameMin: Cijk_Alik_Bljk_HHS_BH_UserArgs_MT64x64x128_MI16x16x1_SN_LDSB1_CLR1_GSU0_GSUC0_GSUWGMRR0_K1_LBSPPA512_LBSPPB256_MIWT2_2_PLR1_SU32_SUM0_SUS256_VWA2_VWB1_WGM1_WGMXCC1_WGMXCCGn1
    SolutionIndex: 72
    SolutionNameMin: Cijk_Alik_Bljk_HHS_BH_UserArgs_MT64x64x128_MI16x16x1_SN_LDSB1_CLR1_GSU0_GSUC0_GSUWGMRR0_K1_LBSPPA256_LBSPPB512_MIWT2_2_PLR1_SU32_SUM0_SUS256_VWA1_VWB2_WGM1_WGMXCC1_WGMXCCGn1
    SolutionIndex: 73
    SolutionNameMin: Cijk_Alik_Bljk_HHS_BH_UserArgs_MT64x64x128_MI16x16x1_SN_LDSB1_CLR1_GSU0_GSUC0_GSUWGMRR0_K1_LBSPPA512_LBSPPB512_MIWT2_2_PLR1_SU32_SUM0_SUS256_VWA2_VWB2_WGM1_WGMXCC1_WGMXCCGn1
    SolutionIndex: 74
    SolutionNameMin: Cijk_Alik_Bljk_HHS_BH_UserArgs_MT64x64x128_MI16x16x1_SN_LDSB1_CLR1_GSU0_GSUC0_GSUWGMRR0_K1_LBSPPA512_LBSPPB256_MIWT2_2_PLR2_SU32_SUM0_SUS256_VWA2_VWB1_WGM1_WGMXCC1_WGMXCCGn1
    SolutionIndex: 75
    SolutionNameMin: Cijk_Alik_Bljk_HHS_BH_UserArgs_MT64x64x128_MI16x16x1_SN_LDSB1_CLR1_GSU0_GSUC0_GSUWGMRR0_K1_LBSPPA512_LBSPPB512_MIWT2_2_PLR2_SU32_SUM0_SUS256_VWA2_VWB2_WGM1_WGMXCC1_WGMXCCGn1
    SolutionIndex: 76
    SolutionNameMin: Cijk_Alik_Bljk_HHS_BH_UserArgs_MT64x64x128_MI16x16x1_SN_LDSB1_CLR1_GSU0_GSUC0_GSUWGMRR0_K1_LBSPPA512_LBSPPB256_MIWT2_2_PLR1_SU32_SUM0_SUS256_VWA2_VWB1_WGM4_WGMXCC1_WGMXCCGn1
    SolutionIndex: 77
    SolutionNameMin: Cijk_Alik_Bljk_HHS_BH_UserArgs_MT64x64x128_MI16x16x1_SN_LDSB1_CLR1_GSU0_GSUC0_GSUWGMRR0_K1_LBSPPA512_LBSPPB512_MIWT2_2_PLR2_SU32_SUM0_SUS256_VWA2_VWB2_WGM4_WGMXCC1_WGMXCCGn1
    SolutionIndex: 78
    SolutionNameMin: Cijk_Alik_Bljk_HHS_BH_UserArgs_MT64x64x128_MI16x16x1_SN_LDSB1_CLR1_GSU0_GSUC0_GSUWGMRR0_K1_LBSPPA512_LBSPPB512_MIWT2_2_PLR1_SU32_SUM0_SUS256_VWA2_VWB2_WGM8_WGMXCC1_WGMXCCGn1
    SolutionIndex: 79
    SolutionNameMin: Cijk_Alik_Bljk_HHS_BH_UserArgs_MT64x64x128_MI16x16x1_SN_LDSB1_CLR1_GSU0_GSUC0_GSUWGMRR0_K1_LBSPPA512_LBSPPB256_MIWT2_2_PLR2_SU32_SUM0_SUS256_VWA2_VWB1_WGM8_WGMXCC1_WGMXCCGn1
    SolutionIndex: 80
    SolutionNameMin: Cijk_Alik_Bljk_HHS_BH_UserArgs_MT64x64x128_MI16x16x1_SN_LDSB1_CLR1_GSU0_GSUC0_GSUWGMRR0_K1_LBSPPA512_LBSPPB512_MIWT2_2_PLR2_SU32_SUM0_SUS256_VWA2_VWB2_WGM8_WGMXCC1_WGMXCCGn1
    SolutionIndex: 81
    SolutionNameMin: Cijk_Alik_Bljk_HHS_BH_UserArgs_MT32x64x128_MI16x16x1_SN_LDSB1_CLR1_GSU0_GSUC0_GSUWGMRR0_K1_LBSPPA256_LBSPPB256_MIWT1_2_PLR1_SU32_SUM0_SUS256_VWA1_VWB1_WGM1_WGMXCC1_WGMXCCGn1
    SolutionIndex: 82
    SolutionNameMin: Cijk_Alik_Bljk_HHS_BH_UserArgs_MT32x64x128_MI16x16x1_SN_LDSB1_CLR1_GSU0_GSUC0_GSUWGMRR0_K1_LBSPPA256_LBSPPB256_MIWT1_2_PLR1_SU32_SUM0_SUS256_VWA1_VWB1_WGM8_WGMXCC1_WGMXCCGn1
    SolutionIndex: 83
    SolutionNameMin: Cijk_Alik_Bljk_HHS_BH_UserArgs_MT32x64x128_MI16x16x1_SN_LDSB1_CLR1_GSU0_GSUC0_GSUWGMRR0_K1_LBSPPA256_LBSPPB256_MIWT1_2_PLR2_SU32_SUM0_SUS256_VWA1_VWB1_WGM8_WGMXCC1_WGMXCCGn1
    SolutionIndex: 84
    SolutionNameMin: Cijk_Alik_Bljk_HHS_BH_UserArgs_MT64x32x128_MI16x16x1_SN_LDSB1_CLR1_GSU0_GSUC0_GSUWGMRR0_K1_LBSPPA512_LBSPPB256_MIWT2_1_PLR2_SU32_SUM0_SUS256_VWA2_VWB1_WGM1_WGMXCC1_WGMXCCGn1
    SolutionIndex: 85
    SolutionNameMin: Cijk_Alik_Bljk_HHS_BH_UserArgs_MT64x32x128_MI16x16x1_SN_LDSB1_CLR1_GSU0_GSUC0_GSUWGMRR0_K1_LBSPPA256_LBSPPB256_MIWT2_1_PLR2_SU32_SUM0_SUS256_VWA1_VWB1_WGM4_WGMXCC1_WGMXCCGn1
    SolutionIndex: 86
    SolutionNameMin: Cijk_Alik_Bljk_HHS_BH_UserArgs_MT64x32x128_MI16x16x1_SN_LDSB1_CLR1_GSU0_GSUC0_GSUWGMRR0_K1_LBSPPA512_LBSPPB256_MIWT2_1_PLR2_SU32_SUM0_SUS256_VWA2_VWB1_WGM4_WGMXCC1_WGMXCCGn1
    SolutionIndex: 87
    SolutionNameMin: Cijk_Alik_Bljk_HHS_BH_UserArgs_MT64x32x128_MI16x16x1_SN_LDSB1_CLR1_GSU0_GSUC0_GSUWGMRR0_K1_LBSPPA512_LBSPPB256_MIWT2_1_PLR1_SU32_SUM0_SUS256_VWA2_VWB1_WGM8_WGMXCC1_WGMXCCGn1
    SolutionIndex: 88
    SolutionNameMin: Cijk_Alik_Bljk_HHS_BH_UserArgs_MT32x32x128_MI16x16x1_SN_LDSB1_CLR1_GSU0_GSUC0_GSUWGMRR0_K1_LBSPPA256_LBSPPB256_MIWT1_1_PLR1_SU32_SUM0_SUS256_VWA1_VWB1_WGM1_WGMXCC1_WGMXCCGn1
    SolutionIndex: 89
    SolutionNameMin: Cijk_Alik_Bljk_HHS_BH_UserArgs_MT32x32x128_MI16x16x1_SN_LDSB1_CLR1_GSU0_GSUC0_GSUWGMRR0_K1_LBSPPA256_LBSPPB256_MIWT1_1_PLR2_SU32_SUM0_SUS256_VWA1_VWB1_WGM1_WGMXCC1_WGMXCCGn1
    SolutionIndex: 90
    SolutionNameMin: Cijk_Alik_Bljk_HHS_BH_UserArgs_MT32x32x128_MI16x16x1_SN_LDSB1_CLR1_GSU0_GSUC0_GSUWGMRR0_K1_LBSPPA256_LBSPPB256_MIWT1_1_PLR1_SU32_SUM0_SUS256_VWA1_VWB1_WGM8_WGMXCC1_WGMXCCGn1
    SolutionIndex: 91
    SolutionNameMin: Cijk_Alik_Bljk_HHS_BH_UserArgs_MT32x32x128_MI16x16x1_SN_LDSB1_CLR1_GSU0_GSUC0_GSUWGMRR0_K1_LBSPPA256_LBSPPB256_MIWT1_1_PLR2_SU32_SUM0_SUS256_VWA1_VWB1_WGM8_WGMXCC1_WGMXCCGn1
    SolutionIndex: 92
    SolutionNameMin: Cijk_Alik_Bljk_HHS_BH_UserArgs_MT64x32x128_MI16x16x1_SN_LDSB1_CLR1_GSU0_GSUC0_GSUWGMRR0_K1_LBSPPA512_LBSPPB256_MIWT2_1_PLR2_SU32_SUM0_SUS256_VWA2_VWB1_WGM8_WGMXCC1_WGMXCCGn1
- - - [128, 128, 1, 128, 128, 128, 128, 128]
    - [1, 0.085]
  - - [128, 128, 1, 256, 128, 128, 256, 256]
    - [88, 0.156]
  - - [128, 128, 1, 512, 128, 128, 512, 512]
    - [91, 0.293]
  - - [128, 128, 1, 1024, 128, 128, 1024, 1024]
    - [90, 0.447]
  - - [128, 128, 1, 2048, 128, 128, 2048, 2048]
    - [67, 0.598]
  - - [128, 128, 1, 4096, 128, 128, 4096, 4096]
    - [88, 0.951]
  - - [128, 128, 1, 8192, 128, 128, 8192, 8192]
    - [81, 1.425]
  - - [128, 256, 1, 128, 128, 128, 128, 128]
    - [55, 0.166]
  - - [128, 256, 1, 256, 128, 128, 256, 256]
    - [68, 0.323]
  - - [128, 256, 1, 512, 128, 128, 512, 512]
    - [69, 0.542]
  - - [128, 256, 1, 1024, 128, 128, 1024, 1024]
    - [67, 0.896]
  - - [128, 256, 1, 2048, 128, 128, 2048, 2048]
    - [88, 1.264]
  - - [128, 256, 1, 4096, 128, 128, 4096, 4096]
    - [90, 1.576]
  - - [128, 256, 1, 8192, 128, 128, 8192, 8192]
    - [80, 2.249]
  - - [128, 512, 1, 128, 128, 128, 128, 128]
    - [2, 0.314]
  - - [128, 512, 1, 256, 128, 128, 256, 256]
    - [87, 0.612]
  - - [128, 512, 1, 512, 128, 128, 512, 512]
    - [63, 1.006]
  - - [128, 512, 1, 1024, 128, 128, 1024, 1024]
    - [84, 1.506]
  - - [128, 512, 1, 2048, 128, 128, 2048, 2048]
    - [86, 2.028]
  - - [128, 512, 1, 4096, 128, 128, 4096, 4096]
    - [70, 2.442]
  - - [128, 512, 1, 8192, 128, 128, 8192, 8192]
    - [74, 3.133]
  - - [128, 1024, 1, 128, 128, 128, 128, 128]
    - [54, 0.669]
  - - [128, 1024, 1, 256, 128, 128, 256, 256]
    - [57, 1.088]
  - - [128, 1024, 1, 512, 128, 128, 512, 512]
    - [58, 1.764]
  - - [128, 1024, 1, 1024, 128, 128, 1024, 1024]
    - [77, 2.467]
  - - [128, 1024, 1, 2048, 128, 128, 2048, 2048]
    - [72, 2.934]
  - - [128, 1024, 1, 4096, 128, 128, 4096, 4096]
    - [71, 3.604]
  - - [128, 1024, 1, 8192, 128, 128, 8192, 8192]
    - [25, 4.156]
  - - [128, 2048, 1, 128, 128, 128, 128, 128]
    - [0, 1.051]
  - - [128, 2048, 1, 256, 128, 128, 256, 256]
    - [37, 1.777]
  - - [128, 2048, 1, 512, 128, 128, 512, 512]
    - [37, 2.686]
  - - [128, 2048, 1, 1024, 128, 128, 1024, 1024]
    - [44, 3.306]
  - - [128, 2048, 1, 2048, 128, 128, 2048, 2048]
    - [50, 4.088]
  - - [128, 2048, 1, 4096, 128, 128, 4096, 4096]
    - [15, 4.567]
  - - [128, 2048, 1, 8192, 128, 128, 8192, 8192]
    - [27, 5.403]
  - - [128, 4096, 1, 128, 128, 128, 128, 128]
    - [4, 1.594]
  - - [128, 4096, 1, 256, 128, 128, 256, 256]
    - [24, 2.426]
  - - [128, 4096, 1, 512, 128, 128, 512, 512]
    - [22, 3.582]
  - - [128, 4096, 1, 1024, 128, 128, 1024, 1024]
    - [12, 4.731]
  - - [128, 4096, 1, 2048, 128, 128, 2048, 2048]
    - [13, 5.869]
  - - [128, 4096, 1, 4096, 128, 128, 4096, 4096]
    - [12, 6.223]
  - - [128, 4096, 1, 8192, 128, 128, 8192, 8192]
    - [20, 6.414]
  - - [128, 8192, 1, 128, 128, 128, 128, 128]
    - [26, 1.65]
  - - [128, 8192, 1, 256, 128, 128, 256, 256]
    - [12, 2.066]
  - - [128, 8192, 1, 512, 128, 128, 512, 512]
    - [14, 3.269]
  - - [128, 8192, 1, 1024, 128, 128, 1024, 1024]
    - [18, 4.635]
  - - [128, 8192, 1, 2048, 128, 128, 2048, 2048]
    - [28, 5.41]
  - - [128, 8192, 1, 4096, 128, 128, 4096, 4096]
    - [13, 6.895]
  - - [128, 8192, 1, 8192, 128, 128, 8192, 8192]
    - [31, 6.817]
  - - [256, 128, 1, 128, 256, 256, 128, 128]
    - [86, 0.17]
  - - [256, 128, 1, 256, 256, 256, 256, 256]
    - [61, 0.317]
  - - [256, 128, 1, 512, 256, 256, 512, 512]
    - [88, 0.554]
  - - [256, 128, 1, 1024, 256, 256, 1024, 1024]
    - [89, 0.918]
  - - [256, 128, 1, 2048, 256, 256, 2048, 2048]
    - [88, 1.276]
  - - [256, 128, 1, 4096, 256, 256, 4096, 4096]
    - [89, 1.635]
  - - [256, 128, 1, 8192, 256, 256, 8192, 8192]
    - [79, 2.293]
  - - [256, 256, 1, 128, 256, 256, 128, 128]
    - [85, 0.31]
  - - [256, 256, 1, 256, 256, 256, 256, 256]
    - [64, 0.614]
  - - [256, 256, 1, 512, 256, 256, 512, 512]
    - [83, 0.985]
  - - [256, 256, 1, 1024, 256, 256, 1024, 1024]
    - [62, 1.548]
  - - [256, 256, 1, 2048, 256, 256, 2048, 2048]
    - [84, 2.022]
  - - [256, 256, 1, 4096, 256, 256, 4096, 4096]
    - [71, 2.47]
  - - [256, 256, 1, 8192, 256, 256, 8192, 8192]
    - [48, 2.826]
  - - [256, 512, 1, 128, 256, 256, 128, 128]
    - [53, 0.573]
  - - [256, 512, 1, 256, 256, 256, 256, 256]
    - [54, 1.112]
  - - [256, 512, 1, 512, 256, 256, 512, 512]
    - [54, 1.782]
  - - [256, 512, 1, 1024, 256, 256, 1024, 1024]
    - [79, 2.466]
  - - [256, 512, 1, 2048, 256, 256, 2048, 2048]
    - [73, 3.127]
  - - [256, 512, 1, 4096, 256, 256, 4096, 4096]
    - [78, 3.711]
  - - [256, 512, 1, 8192, 256, 256, 8192, 8192]
    - [21, 4.175]
  - - [256, 1024, 1, 128, 256, 256, 128, 128]
    - [50, 1.041]
  - - [256, 1024, 1, 256, 256, 256, 256, 256]
    - [44, 1.888]
  - - [256, 1024, 1, 512, 256, 256, 512, 512]
    - [41, 2.749]
  - - [256, 1024, 1, 1024, 256, 256, 1024, 1024]
    - [36, 3.662]
  - - [256, 1024, 1, 2048, 256, 256, 2048, 2048]
    - [42, 4.204]
  - - [256, 1024, 1, 4096, 256, 256, 4096, 4096]
    - [34, 4.592]
  - - [256, 1024, 1, 8192, 256, 256, 8192, 8192]
    - [29, 6.018]
  - - [256, 2048, 1, 128, 256, 256, 128, 128]
    - [6, 1.586]
  - - [256, 2048, 1, 256, 256, 256, 256, 256]
    - [14, 2.735]
  - - [256, 2048, 1, 512, 256, 256, 512, 512]
    - [15, 3.673]
  - - [256, 2048, 1, 1024, 256, 256, 1024, 1024]
    - [11, 4.923]
  - - [256, 2048, 1, 2048, 256, 256, 2048, 2048]
    - [19, 5.75]
  - - [256, 2048, 1, 4096, 256, 256, 4096, 4096]
    - [14, 5.695]
  - - [256, 2048, 1, 8192, 256, 256, 8192, 8192]
    - [30, 6.544]
  - - [256, 4096, 1, 128, 256, 256, 128, 128]
    - [11, 1.803]
  - - [256, 4096, 1, 256, 256, 256, 256, 256]
    - [34, 2.089]
  - - [256, 4096, 1, 512, 256, 256, 512, 512]
    - [35, 3.365]
  - - [256, 4096, 1, 1024, 256, 256, 1024, 1024]
    - [34, 4.634]
  - - [256, 4096, 1, 2048, 256, 256, 2048, 2048]
    - [5, 5.9]
  - - [256, 4096, 1, 4096, 256, 256, 4096, 4096]
    - [16, 6.131]
  - - [256, 4096, 1, 8192, 256, 256, 8192, 8192]
    - [10, 7.252]
  - - [256, 8192, 1, 128, 256, 256, 128, 128]
    - [14, 1.855]
  - - [256, 8192, 1, 256, 256, 256, 256, 256]
    - [14, 2.957]
  - - [256, 8192, 1, 512, 256, 256, 512, 512]
    - [14, 4.17]
  - - [256, 8192, 1, 1024, 256, 256, 1024, 1024]
    - [22, 5.239]
  - - [256, 8192, 1, 2048, 256, 256, 2048, 2048]
    - [22, 6.415]
  - - [256, 8192, 1, 4096, 256, 256, 4096, 4096]
    - [21, 6.634]
  - - [256, 8192, 1, 8192, 256, 256, 8192, 8192]
    - [29, 5.83]
  - - [512, 128, 1, 128, 512, 512, 128, 128]
    - [3, 0.325]
  - - [512, 128, 1, 256, 512, 512, 256, 256]
    - [66, 0.623]
  - - [512, 128, 1, 512, 512, 512, 512, 512]
    - [65, 1.085]
  - - [512, 128, 1, 1024, 512, 512, 1024, 1024]
    - [62, 1.602]
  - - [512, 128, 1, 2048, 512, 512, 2048, 2048]
    - [82, 2.049]
  - - [512, 128, 1, 4096, 512, 512, 4096, 4096]
    - [76, 2.463]
  - - [512, 128, 1, 8192, 512, 512, 8192, 8192]
    - [73, 3.182]
  - - [512, 256, 1, 128, 512, 512, 128, 128]
    - [60, 0.633]
  - - [512, 256, 1, 256, 512, 512, 256, 256]
    - [54, 1.178]
  - - [512, 256, 1, 512, 512, 512, 512, 512]
    - [54, 1.885]
  - - [512, 256, 1, 1024, 512, 512, 1024, 1024]
    - [80, 2.526]
  - - [512, 256, 1, 2048, 512, 512, 2048, 2048]
    - [75, 3.271]
  - - [512, 256, 1, 4096, 512, 512, 4096, 4096]
    - [73, 3.738]
  - - [512, 256, 1, 8192, 512, 512, 8192, 8192]
    - [12, 4.52]
  - - [512, 512, 1, 128, 512, 512, 128, 128]
    - [47, 1.079]
  - - [512, 512, 1, 256, 512, 512, 256, 256]
    - [45, 1.874]
  - - [512, 512, 1, 512, 512, 512, 512, 512]
    - [49, 2.799]
  - - [512, 512, 1, 1024, 512, 512, 1024, 1024]
    - [43, 3.702]
  - - [512, 512, 1, 2048, 512, 512, 2048, 2048]
    - [45, 3.894]
  - - [512, 512, 1, 4096, 512, 512, 4096, 4096]
    - [12, 4.55]
  - - [512, 512, 1, 8192, 512, 512, 8192, 8192]
    - [32, 5.845]
  - - [512, 1024, 1, 128, 512, 512, 128, 128]
    - [9, 1.669]
  - - [512, 1024, 1, 256, 512, 512, 256, 256]
    - [15, 2.813]
  - - [512, 1024, 1, 512, 512, 512, 512, 512]
    - [15, 4.209]
  - - [512, 1024, 1, 1024, 512, 512, 1024, 1024]
    - [11, 5.074]
  - - [512, 1024, 1, 2048, 512, 512, 2048, 2048]
    - [5, 5.669]
  - - [512, 1024, 1, 4096, 512, 512, 4096, 4096]
    - [35, 5.813]
  - - [512, 1024, 1, 8192, 512, 512, 8192, 8192]
    - [14, 6.541]
  - - [512, 2048, 1, 128, 512, 512, 128, 128]
    - [15, 1.822]
  - - [512, 2048, 1, 256, 512, 512, 256, 256]
    - [46, 2.164]
  - - [512, 2048, 1, 512, 512, 512, 512, 512]
    - [35, 3.416]
  - - [512, 2048, 1, 1024, 512, 512, 1024, 1024]
    - [15, 4.725]
  - - [512, 2048, 1, 2048, 512, 512, 2048, 2048]
    - [29, 5.243]
  - - [512, 2048, 1, 4096, 512, 512, 4096, 4096]
    - [15, 5.974]
  - - [512, 2048, 1, 8192, 512, 512, 8192, 8192]
    - [34, 7.126]
  - - [512, 4096, 1, 128, 512, 512, 128, 128]
    - [12, 1.913]
  - - [512, 4096, 1, 256, 512, 512, 256, 256]
    - [12, 3.109]
  - - [512, 4096, 1, 512, 512, 512, 512, 512]
    - [32, 4.205]
  - - [512, 4096, 1, 1024, 512, 512, 1024, 1024]
    - [11, 5.55]
  - - [512, 4096, 1, 2048, 512, 512, 2048, 2048]
    - [24, 6.293]
  - - [512, 4096, 1, 4096, 512, 512, 4096, 4096]
    - [25, 7.289]
  - - [512, 4096, 1, 8192, 512, 512, 8192, 8192]
    - [24, 8.154]
  - - [512, 8192, 1, 128, 512, 512, 128, 128]
    - [13, 2.333]
  - - [512, 8192, 1, 256, 512, 512, 256, 256]
    - [12, 3.393]
  - - [512, 8192, 1, 512, 512, 512, 512, 512]
    - [15, 4.993]
  - - [512, 8192, 1, 1024, 512, 512, 1024, 1024]
    - [12, 6.281]
  - - [512, 8192, 1, 2048, 512, 512, 2048, 2048]
    - [17, 6.361]
  - - [512, 8192, 1, 4096, 512, 512, 4096, 4096]
    - [12, 6.792]
  - - [512, 8192, 1, 8192, 512, 512, 8192, 8192]
    - [11, 7.275]
  - - [1024, 128, 1, 128, 1024, 1024, 128, 128]
    - [59, 0.647]
  - - [1024, 128, 1, 256, 1024, 1024, 256, 256]
    - [56, 1.12]
  - - [1024, 128, 1, 512, 1024, 1024, 512, 512]
    - [57, 1.838]
  - - [1024, 128, 1, 1024, 1024, 1024, 1024, 1024]
    - [58, 2.544]
  - - [1024, 128, 1, 2048, 1024, 1024, 2048, 2048]
    - [70, 3.109]
  - - [1024, 128, 1, 4096, 1024, 1024, 4096, 4096]
    - [74, 3.653]
  - - [1024, 128, 1, 8192, 1024, 1024, 8192, 8192]
    - [12, 4.379]
  - - [1024, 256, 1, 128, 1024, 1024, 128, 128]
    - [43, 1.108]
  - - [1024, 256, 1, 256, 1024, 1024, 256, 256]
    - [38, 1.865]
  - - [1024, 256, 1, 512, 1024, 1024, 512, 512]
    - [39, 2.789]
  - - [1024, 256, 1, 1024, 1024, 1024, 1024, 1024]
    - [51, 3.77]
  - - [1024, 256, 1, 2048, 1024, 1024, 2048, 2048]
    - [38, 3.519]
  - - [1024, 256, 1, 4096, 1024, 1024, 4096, 4096]
    - [16, 4.977]
  - - [1024, 256, 1, 8192, 1024, 1024, 8192, 8192]
    - [19, 5.406]
  - - [1024, 512, 1, 128, 1024, 1024, 128, 128]
    - [31, 1.631]
  - - [1024, 512, 1, 256, 1024, 1024, 256, 256]
    - [14, 2.825]
  - - [1024, 512, 1, 512, 1024, 1024, 512, 512]
    - [18, 4.173]
  - - [1024, 512, 1, 1024, 1024, 1024, 1024, 1024]
    - [11, 5.021]
  - - [1024, 512, 1, 2048, 1024, 1024, 2048, 2048]
    - [29, 4.967]
  - - [1024, 512, 1, 4096, 1024, 1024, 4096, 4096]
    - [15, 5.717]
  - - [1024, 512, 1, 8192, 1024, 1024, 8192, 8192]
    - [35, 6.65]
  - - [1024, 1024, 1, 128, 1024, 1024, 128, 128]
    - [11, 1.932]
  - - [1024, 1024, 1, 256, 1024, 1024, 256, 256]
    - [50, 2.139]
  - - [1024, 1024, 1, 512, 1024, 1024, 512, 512]
    - [19, 3.444]
  - - [1024, 1024, 1, 1024, 1024, 1024, 1024, 1024]
    - [14, 4.806]
  - - [1024, 1024, 1, 2048, 1024, 1024, 2048, 2048]
    - [14, 5.25]
  - - [1024, 1024, 1, 4096, 1024, 1024, 4096, 4096]
    - [14, 6.246]
  - - [1024, 1024, 1, 8192, 1024, 1024, 8192, 8192]
    - [28, 7.229]
  - - [1024, 2048, 1, 128, 1024, 1024, 128, 128]
    - [25, 1.943]
  - - [1024, 2048, 1, 256, 1024, 1024, 256, 256]
    - [12, 3.091]
  - - [1024, 2048, 1, 512, 1024, 1024, 512, 512]
    - [12, 4.294]
  - - [1024, 2048, 1, 1024, 1024, 1024, 1024, 1024]
    - [16, 5.559]
  - - [1024, 2048, 1, 2048, 1024, 1024, 2048, 2048]
    - [21, 6.285]
  - - [1024, 2048, 1, 4096, 1024, 1024, 4096, 4096]
    - [25, 7.179]
  - - [1024, 2048, 1, 8192, 1024, 1024, 8192, 8192]
    - [17, 7.902]
  - - [1024, 4096, 1, 128, 1024, 1024, 128, 128]
    - [8, 2.353]
  - - [1024, 4096, 1, 256, 1024, 1024, 256, 256]
    - [19, 3.381]
  - - [1024, 4096, 1, 512, 1024, 1024, 512, 512]
    - [12, 4.99]
  - - [1024, 4096, 1, 1024, 1024, 1024, 1024, 1024]
    - [22, 6.052]
  - - [1024, 4096, 1, 2048, 1024, 1024, 2048, 2048]
    - [32, 6.441]
  - - [1024, 4096, 1, 4096, 1024, 1024, 4096, 4096]
    - [30, 7.264]
  - - [1024, 4096, 1, 8192, 1024, 1024, 8192, 8192]
    - [31, 8.121]
  - - [1024, 8192, 1, 128, 1024, 1024, 128, 128]
    - [12, 2.57]
  - - [1024, 8192, 1, 256, 1024, 1024, 256, 256]
    - [16, 4.045]
  - - [1024, 8192, 1, 512, 1024, 1024, 512, 512]
    - [16, 5.381]
  - - [1024, 8192, 1, 1024, 1024, 1024, 1024, 1024]
    - [21, 6.309]
  - - [1024, 8192, 1, 2048, 1024, 1024, 2048, 2048]
    - [33, 6.626]
  - - [1024, 8192, 1, 4096, 1024, 1024, 4096, 4096]
    - [32, 7.332]
  - - [1024, 8192, 1, 8192, 1024, 1024, 8192, 8192]
    - [34, 8.252]
  - - [2048, 128, 1, 128, 2048, 2048, 128, 128]
    - [52, 1.115]
  - - [2048, 128, 1, 256, 2048, 2048, 256, 256]
    - [37, 1.875]
  - - [2048, 128, 1, 512, 2048, 2048, 512, 512]
    - [44, 2.88]
  - - [2048, 128, 1, 1024, 2048, 2048, 1024, 1024]
    - [40, 2.993]
  - - [2048, 128, 1, 2048, 2048, 2048, 2048, 2048]
    - [46, 3.527]
  - - [2048, 128, 1, 4096, 2048, 2048, 4096, 4096]
    - [35, 4.625]
  - - [2048, 128, 1, 8192, 2048, 2048, 8192, 8192]
    - [12, 5.794]
  - - [2048, 256, 1, 128, 2048, 2048, 128, 128]
    - [16, 1.75]
  - - [2048, 256, 1, 256, 2048, 2048, 256, 256]
    - [15, 2.845]
  - - [2048, 256, 1, 512, 2048, 2048, 512, 512]
    - [11, 3.831]
  - - [2048, 256, 1, 1024, 2048, 2048, 1024, 1024]
    - [12, 4.459]
  - - [2048, 256, 1, 2048, 2048, 2048, 2048, 2048]
    - [12, 5.037]
  - - [2048, 256, 1, 4096, 2048, 2048, 4096, 4096]
    - [14, 6.296]
  - - [2048, 256, 1, 8192, 2048, 2048, 8192, 8192]
    - [16, 7.11]
  - - [2048, 512, 1, 128, 2048, 2048, 128, 128]
    - [12, 1.918]
  - - [2048, 512, 1, 256, 2048, 2048, 256, 256]
    - [46, 2.216]
  - - [2048, 512, 1, 512, 2048, 2048, 512, 512]
    - [22, 3.39]
  - - [2048, 512, 1, 1024, 2048, 2048, 1024, 1024]
    - [12, 4.908]
  - - [2048, 512, 1, 2048, 2048, 2048, 2048, 2048]
    - [12, 5.539]
  - - [2048, 512, 1, 4096, 2048, 2048, 4096, 4096]
    - [14, 6.566]
  - - [2048, 512, 1, 8192, 2048, 2048, 8192, 8192]
    - [15, 7.497]
  - - [2048, 1024, 1, 128, 2048, 2048, 128, 128]
    - [16, 1.961]
  - - [2048, 1024, 1, 256, 2048, 2048, 256, 256]
    - [16, 3.161]
  - - [2048, 1024, 1, 512, 2048, 2048, 512, 512]
    - [16, 4.216]
  - - [2048, 1024, 1, 1024, 2048, 2048, 1024, 1024]
    - [29, 5.429]
  - - [2048, 1024, 1, 2048, 2048, 2048, 2048, 2048]
    - [35, 5.962]
  - - [2048, 1024, 1, 4096, 2048, 2048, 4096, 4096]
    - [14, 7.035]
  - - [2048, 1024, 1, 8192, 2048, 2048, 8192, 8192]
    - [14, 7.891]
  - - [2048, 2048, 1, 128, 2048, 2048, 128, 128]
    - [16, 2.394]
  - - [2048, 2048, 1, 256, 2048, 2048, 256, 256]
    - [12, 3.502]
  - - [2048, 2048, 1, 512, 2048, 2048, 512, 512]
    - [14, 4.902]
  - - [2048, 2048, 1, 1024, 2048, 2048, 1024, 1024]
    - [32, 5.947]
  - - [2048, 2048, 1, 2048, 2048, 2048, 2048, 2048]
    - [28, 6.541]
  - - [2048, 2048, 1, 4096, 2048, 2048, 4096, 4096]
    - [28, 7.475]
  - - [2048, 2048, 1, 8192, 2048, 2048, 8192, 8192]
    - [13, 7.958]
  - - [2048, 4096, 1, 128, 2048, 2048, 128, 128]
    - [11, 2.504]
  - - [2048, 4096, 1, 256, 2048, 2048, 256, 256]
    - [14, 4.084]
  - - [2048, 4096, 1, 512, 2048, 2048, 512, 512]
    - [16, 5.32]
  - - [2048, 4096, 1, 1024, 2048, 2048, 1024, 1024]
    - [31, 6.128]
  - - [2048, 4096, 1, 2048, 2048, 2048, 2048, 2048]
    - [29, 6.752]
  - - [2048, 4096, 1, 4096, 2048, 2048, 4096, 4096]
    - [30, 7.716]
  - - [2048, 4096, 1, 8192, 2048, 2048, 8192, 8192]
    - [23, 8.494]
  - - [2048, 8192, 1, 128, 2048, 2048, 128, 128]
    - [12, 2.769]
  - - [2048, 8192, 1, 256, 2048, 2048, 256, 256]
    - [14, 4.244]
  - - [2048, 8192, 1, 512, 2048, 2048, 512, 512]
    - [16, 5.354]
  - - [2048, 8192, 1, 1024, 2048, 2048, 1024, 1024]
    - [29, 6.179]
  - - [2048, 8192, 1, 2048, 2048, 2048, 2048, 2048]
    - [35, 7.028]
  - - [2048, 8192, 1, 4096, 2048, 2048, 4096, 4096]
    - [28, 7.781]
  - - [2048, 8192, 1, 8192, 2048, 2048, 8192, 8192]
    - [18, 8.081]
  - - [4096, 128, 1, 128, 4096, 4096, 128, 128]
    - [11, 1.781]
  - - [4096, 128, 1, 256, 4096, 4096, 256, 256]
    - [16, 2.6]
  - - [4096, 128, 1, 512, 4096, 4096, 512, 512]
    - [11, 3.443]
  - - [4096, 128, 1, 1024, 4096, 4096, 1024, 1024]
    - [19, 4.074]
  - - [4096, 128, 1, 2048, 4096, 4096, 2048, 2048]
    - [14, 5.043]
  - - [4096, 128, 1, 4096, 4096, 4096, 4096, 4096]
    - [14, 6.207]
  - - [4096, 128, 1, 8192, 4096, 4096, 8192, 8192]
    - [32, 7.066]
  - - [4096, 256, 1, 128, 4096, 4096, 128, 128]
    - [5, 1.839]
  - - [4096, 256, 1, 256, 4096, 4096, 256, 256]
    - [44, 2.256]
  - - [4096, 256, 1, 512, 4096, 4096, 512, 512]
    - [14, 3.355]
  - - [4096, 256, 1, 1024, 4096, 4096, 1024, 1024]
    - [13, 4.839]
  - - [4096, 256, 1, 2048, 4096, 4096, 2048, 2048]
    - [14, 6.162]
  - - [4096, 256, 1, 4096, 4096, 4096, 4096, 4096]
    - [16, 6.924]
  - - [4096, 256, 1, 8192, 4096, 4096, 8192, 8192]
    - [15, 7.79]
  - - [4096, 512, 1, 128, 4096, 4096, 128, 128]
    - [7, 1.961]
  - - [4096, 512, 1, 256, 4096, 4096, 256, 256]
    - [14, 3.063]
  - - [4096, 512, 1, 512, 4096, 4096, 512, 512]
    - [29, 4.091]
  - - [4096, 512, 1, 1024, 4096, 4096, 1024, 1024]
    - [25, 5.187]
  - - [4096, 512, 1, 2048, 4096, 4096, 2048, 2048]
    - [22, 5.824]
  - - [4096, 512, 1, 4096, 4096, 4096, 4096, 4096]
    - [12, 6.972]
  - - [4096, 512, 1, 8192, 4096, 4096, 8192, 8192]
    - [29, 7.892]
  - - [4096, 1024, 1, 128, 4096, 4096, 128, 128]
    - [16, 2.425]
  - - [4096, 1024, 1, 256, 4096, 4096, 256, 256]
    - [14, 3.412]
  - - [4096, 1024, 1, 512, 4096, 4096, 512, 512]
    - [32, 4.79]
  - - [4096, 1024, 1, 1024, 4096, 4096, 1024, 1024]
    - [34, 5.892]
  - - [4096, 1024, 1, 2048, 4096, 4096, 2048, 2048]
    - [28, 6.39]
  - - [4096, 1024, 1, 4096, 4096, 4096, 4096, 4096]
    - [29, 7.555]
  - - [4096, 1024, 1, 8192, 4096, 4096, 8192, 8192]
    - [28, 8.397]
  - - [4096, 2048, 1, 128, 4096, 4096, 128, 128]
    - [8, 2.631]
  - - [4096, 2048, 1, 256, 4096, 4096, 256, 256]
    - [35, 3.779]
  - - [4096, 2048, 1, 512, 4096, 4096, 512, 512]
    - [35, 5.056]
  - - [4096, 2048, 1, 1024, 4096, 4096, 1024, 1024]
    - [32, 6.202]
  - - [4096, 2048, 1, 2048, 4096, 4096, 2048, 2048]
    - [35, 6.871]
  - - [4096, 2048, 1, 4096, 4096, 4096, 4096, 4096]
    - [35, 8.01]
  - - [4096, 2048, 1, 8192, 4096, 4096, 8192, 8192]
    - [29, 8.44]
  - - [4096, 4096, 1, 128, 4096, 4096, 128, 128]
    - [12, 2.789]
  - - [4096, 4096, 1, 256, 4096, 4096, 256, 256]
    - [12, 3.934]
  - - [4096, 4096, 1, 512, 4096, 4096, 512, 512]
    - [29, 5.227]
  - - [4096, 4096, 1, 1024, 4096, 4096, 1024, 1024]
    - [34, 6.167]
  - - [4096, 4096, 1, 2048, 4096, 4096, 2048, 2048]
    - [34, 6.901]
  - - [4096, 4096, 1, 4096, 4096, 4096, 4096, 4096]
    - [29, 8.092]
  - - [4096, 4096, 1, 8192, 4096, 4096, 8192, 8192]
    - [24, 7.502]
  - - [4096, 8192, 1, 128, 4096, 4096, 128, 128]
    - [11, 2.771]
  - - [4096, 8192, 1, 256, 4096, 4096, 256, 256]
    - [19, 3.914]
  - - [4096, 8192, 1, 512, 4096, 4096, 512, 512]
    - [14, 5.345]
  - - [4096, 8192, 1, 1024, 4096, 4096, 1024, 1024]
    - [25, 5.972]
  - - [4096, 8192, 1, 2048, 4096, 4096, 2048, 2048]
    - [28, 6.685]
  - - [4096, 8192, 1, 4096, 4096, 4096, 4096, 4096]
    - [34, 7.929]
  - - [4096, 8192, 1, 8192, 4096, 4096, 8192, 8192]
    - [22, 8.121]
  - - [8192, 128, 1, 128, 8192, 8192, 128, 128]
    - [8, 1.922]
  - - [8192, 128, 1, 256, 8192, 8192, 256, 256]
    - [14, 2.085]
  - - [8192, 128, 1, 512, 8192, 8192, 512, 512]
    - [12, 3.316]
  - - [8192, 128, 1, 1024, 8192, 8192, 1024, 1024]
    - [16, 4.671]
  - - [8192, 128, 1, 2048, 8192, 8192, 2048, 2048]
    - [16, 5.872]
  - - [8192, 128, 1, 4096, 8192, 8192, 4096, 4096]
    - [12, 7.049]
  - - [8192, 128, 1, 8192, 8192, 8192, 8192, 8192]
    - [35, 7.721]
  - - [8192, 256, 1, 128, 8192, 8192, 128, 128]
    - [14, 1.903]
  - - [8192, 256, 1, 256, 8192, 8192, 256, 256]
    - [29, 2.935]
  - - [8192, 256, 1, 512, 8192, 8192, 512, 512]
    - [22, 3.88]
  - - [8192, 256, 1, 1024, 8192, 8192, 1024, 1024]
    - [19, 4.982]
  - - [8192, 256, 1, 2048, 8192, 8192, 2048, 2048]
    - [16, 5.914]
  - - [8192, 256, 1, 4096, 8192, 8192, 4096, 4096]
    - [25, 7.107]
  - - [8192, 256, 1, 8192, 8192, 8192, 8192, 8192]
    - [20, 7.85]
  - - [8192, 512, 1, 128, 8192, 8192, 128, 128]
    - [8, 2.397]
  - - [8192, 512, 1, 256, 8192, 8192, 256, 256]
    - [19, 3.347]
  - - [8192, 512, 1, 512, 8192, 8192, 512, 512]
    - [22, 4.714]
  - - [8192, 512, 1, 1024, 8192, 8192, 1024, 1024]
    - [29, 5.739]
  - - [8192, 512, 1, 2048, 8192, 8192, 2048, 2048]
    - [29, 6.259]
  - - [8192, 512, 1, 4096, 8192, 8192, 4096, 4096]
    - [19, 7.374]
  - - [8192, 512, 1, 8192, 8192, 8192, 8192, 8192]
    - [34, 8.323]
  - - [8192, 1024, 1, 128, 8192, 8192, 128, 128]
    - [5, 2.514]
  - - [8192, 1024, 1, 256, 8192, 8192, 256, 256]
    - [22, 3.747]
  - - [8192, 1024, 1, 512, 8192, 8192, 512, 512]
    - [35, 5.055]
  - - [8192, 1024, 1, 1024, 8192, 8192, 1024, 1024]
    - [32, 6.194]
  - - [8192, 1024, 1, 2048, 8192, 8192, 2048, 2048]
    - [35, 6.864]
  - - [8192, 1024, 1, 4096, 8192, 8192, 4096, 4096]
    - [31, 7.947]
  - - [8192, 1024, 1, 8192, 8192, 8192, 8192, 8192]
    - [30, 8.45]
  - - [8192, 2048, 1, 128, 8192, 8192, 128, 128]
    - [8, 2.664]
  - - [8192, 2048, 1, 256, 8192, 8192, 256, 256]
    - [21, 3.81]
  - - [8192, 2048, 1, 512, 8192, 8192, 512, 512]
    - [29, 5.179]
  - - [8192, 2048, 1, 1024, 8192, 8192, 1024, 1024]
    - [28, 6.191]
  - - [8192, 2048, 1, 2048, 8192, 8192, 2048, 2048]
    - [31, 6.892]
  - - [8192, 2048, 1, 4096, 8192, 8192, 4096, 4096]
    - [35, 7.877]
  - - [8192, 2048, 1, 8192, 8192, 8192, 8192, 8192]
    - [28, 7.977]
  - - [8192, 4096, 1, 128, 8192, 8192, 128, 128]
    - [8, 2.706]
  - - [8192, 4096, 1, 256, 8192, 8192, 256, 256]
    - [22, 3.938]
  - - [8192, 4096, 1, 512, 8192, 8192, 512, 512]
    - [35, 5.248]
  - - [8192, 4096, 1, 1024, 8192, 8192, 1024, 1024]
    - [21, 6.077]
  - - [8192, 4096, 1, 2048, 8192, 8192, 2048, 2048]
    - [29, 6.766]
  - - [8192, 4096, 1, 4096, 8192, 8192, 4096, 4096]
    - [27, 7.84]
  - - [8192, 4096, 1, 8192, 8192, 8192, 8192, 8192]
    - [20, 7.61]
  - - [8192, 8192, 1, 128, 8192, 8192, 128, 128]
    - [5, 2.692]
  - - [8192, 8192, 1, 256, 8192, 8192, 256, 256]
    - [22, 3.885]
  - - [8192, 8192, 1, 512, 8192, 8192, 512, 512]
    - [25, 5.155]
  - - [8192, 8192, 1, 1024, 8192, 8192, 1024, 1024]
    - [19, 6.089]
  - - [8192, 8192, 1, 2048, 8192, 8192, 2048, 2048]
    - [28, 6.451]
  - - [8192, 8192, 1, 4096, 8192, 8192, 4096, 4096]
    - [20, 7.691]
  - - [8192, 8192, 1, 8192, 8192, 8192, 8192, 8192]
    - [19, 8.108]
  - - [1, 1, 1, 32, 1, 1, 32, 32]
    - [92, 0.0]
- null
- null
- ExperimentalStreamK
- GridBased
