library/src/amd_detail/rocblaslt/src/Tensile/Logic/asm_full/aquavanjaram/gfx942_38cu/StreamK/aquavanjaram942_Cijk_Ailk_Bljk_HHS_BH_UserArgs.yaml
- {MinimumRequiredVersion: 4.33.0}
- aquavanjaram942
- {Architecture: gfx942, CUCount: 38}
- [Device 0049, Device 0050]
    SolutionIndex: 0
    SolutionNameMin: Cijk_Ailk_Bljk_HHS_BH_UserArgs_MT256x256x32_MI16x16x1_SN_LDSB1_CLR1_GSU0_GSUC0_GSUWGMRR0_K1_LBSPPA2048_LBSPPB128_LPA32_MIWT8_8_PLR1_SU32_SUM0_SUS256_VWA2_VWB1_WGM1_WGMXCC1_WGMXCCGn1
    SolutionIndex: 1
    SolutionNameMin: Cijk_Ailk_Bljk_HHS_BH_UserArgs_MT256x256x32_MI16x16x1_SN_LDSB1_CLR1_GSU0_GSUC0_GSUWGMRR0_K1_LBSPPA2048_LBSPPB128_LPA0_MIWT8_8_PLR1_SU32_SUM0_SUS256_VWA4_VWB1_WGM1_WGMXCC1_WGMXCCGn1
    SolutionIndex: 2
    SolutionNameMin: Cijk_Ailk_Bljk_HHS_BH_UserArgs_MT256x256x32_MI16x16x1_SN_LDSB1_CLR1_GSU0_GSUC0_GSUWGMRR0_K1_LBSPPA2048_LBSPPB128_LPA0_MIWT8_8_PLR1_SU32_SUM0_SUS256_VWA8_VWB1_WGM1_WGMXCC1_WGMXCCGn1
    SolutionIndex: 3
    SolutionNameMin: Cijk_Ailk_Bljk_HHS_BH_UserArgs_MT256x256x32_MI16x16x1_SN_LDSB1_CLR1_GSU0_GSUC0_GSUWGMRR0_K1_LBSPPA2048_LBSPPB128_LPA32_MIWT8_8_PLR1_SU32_SUM0_SUS256_VWA2_VWB2_WGM1_WGMXCC1_WGMXCCGn1
    SolutionIndex: 4
    SolutionNameMin: Cijk_Ailk_Bljk_HHS_BH_UserArgs_MT256x256x32_MI16x16x1_SN_LDSB1_CLR1_GSU0_GSUC0_GSUWGMRR0_K1_LBSPPA2048_LBSPPB128_LPA0_MIWT8_8_PLR1_SU32_SUM0_SUS256_VWA4_VWB2_WGM1_WGMXCC1_WGMXCCGn1
    SolutionIndex: 5
    SolutionNameMin: Cijk_Ailk_Bljk_HHS_BH_UserArgs_MT256x256x32_MI16x16x1_SN_LDSB1_CLR1_GSU0_GSUC0_GSUWGMRR0_K1_LBSPPA2048_LBSPPB128_LPA0_MIWT8_8_PLR1_SU32_SUM0_SUS256_VWA8_VWB2_WGM1_WGMXCC1_WGMXCCGn1
    SolutionIndex: 6
    SolutionNameMin: Cijk_Ailk_Bljk_HHS_BH_UserArgs_MT256x256x32_MI16x16x1_SN_LDSB1_CLR1_GSU0_GSUC0_GSUWGMRR0_K1_LBSPPA2048_LBSPPB256_LPA32_MIWT8_8_PLR1_SU32_SUM0_SUS256_VWA2_VWB4_WGM1_WGMXCC1_WGMXCCGn1
    SolutionIndex: 7
    SolutionNameMin: Cijk_Ailk_Bljk_HHS_BH_UserArgs_MT256x256x32_MI16x16x1_SN_LDSB1_CLR1_GSU0_GSUC0_GSUWGMRR0_K1_LBSPPA2048_LBSPPB256_LPA0_MIWT8_8_PLR1_SU32_SUM0_SUS256_VWA4_VWB4_WGM1_WGMXCC1_WGMXCCGn1
    SolutionIndex: 8
    SolutionNameMin: Cijk_Ailk_Bljk_HHS_BH_UserArgs_MT256x256x32_MI16x16x1_SN_LDSB1_CLR1_GSU0_GSUC0_GSUWGMRR0_K1_LBSPPA2048_LBSPPB256_LPA0_MIWT8_8_PLR1_SU32_SUM0_SUS256_VWA8_VWB4_WGM1_WGMXCC1_WGMXCCGn1
    SolutionIndex: 9
    SolutionNameMin: Cijk_Ailk_Bljk_HHS_BH_UserArgs_MT256x256x32_MI16x16x1_SN_LDSB1_CLR1_GSU0_GSUC0_GSUWGMRR0_K1_LBSPPA2048_LBSPPB512_LPA32_MIWT8_8_PLR1_SU32_SUM0_SUS256_VWA2_VWB8_WGM1_WGMXCC1_WGMXCCGn1
    SolutionIndex: 10
    SolutionNameMin: Cijk_Ailk_Bljk_HHS_BH_UserArgs_MT256x256x32_MI16x16x1_SN_LDSB1_CLR1_GSU0_GSUC0_GSUWGMRR0_K1_LBSPPA2048_LBSPPB512_LPA0_MIWT8_8_PLR1_SU32_SUM0_SUS256_VWA4_VWB8_WGM1_WGMXCC1_WGMXCCGn1
    SolutionIndex: 11
    SolutionNameMin: Cijk_Ailk_Bljk_HHS_BH_UserArgs_MT256x256x32_MI16x16x1_SN_LDSB1_CLR1_GSU0_GSUC0_GSUWGMRR0_K1_LBSPPA2048_LBSPPB512_LPA0_MIWT8_8_PLR1_SU32_SUM0_SUS256_VWA8_VWB8_WGM1_WGMXCC1_WGMXCCGn1
    SolutionIndex: 12
    SolutionNameMin: Cijk_Ailk_Bljk_HHS_BH_UserArgs_MT256x256x32_MI16x16x1_SN_LDSB1_CLR1_GSU0_GSUC0_GSUWGMRR0_K1_LBSPPA2048_LBSPPB128_LPA32_MIWT8_8_PLR1_SU32_SUM0_SUS256_VWA2_VWB1_WGM4_WGMXCC1_WGMXCCGn1
    SolutionIndex: 13
    SolutionNameMin: Cijk_Ailk_Bljk_HHS_BH_UserArgs_MT256x256x32_MI16x16x1_SN_LDSB1_CLR1_GSU0_GSUC0_GSUWGMRR0_K1_LBSPPA2048_LBSPPB128_LPA0_MIWT8_8_PLR1_SU32_SUM0_SUS256_VWA4_VWB1_WGM4_WGMXCC1_WGMXCCGn1
    SolutionIndex: 14
    SolutionNameMin: Cijk_Ailk_Bljk_HHS_BH_UserArgs_MT256x256x32_MI16x16x1_SN_LDSB1_CLR1_GSU0_GSUC0_GSUWGMRR0_K1_LBSPPA2048_LBSPPB128_LPA0_MIWT8_8_PLR1_SU32_SUM0_SUS256_VWA8_VWB1_WGM4_WGMXCC1_WGMXCCGn1
    SolutionIndex: 15
    SolutionNameMin: Cijk_Ailk_Bljk_HHS_BH_UserArgs_MT256x256x32_MI16x16x1_SN_LDSB1_CLR1_GSU0_GSUC0_GSUWGMRR0_K1_LBSPPA2048_LBSPPB128_LPA32_MIWT8_8_PLR1_SU32_SUM0_SUS256_VWA2_VWB2_WGM4_WGMXCC1_WGMXCCGn1
    SolutionIndex: 16
    SolutionNameMin: Cijk_Ailk_Bljk_HHS_BH_UserArgs_MT256x256x32_MI16x16x1_SN_LDSB1_CLR1_GSU0_GSUC0_GSUWGMRR0_K1_LBSPPA2048_LBSPPB128_LPA0_MIWT8_8_PLR1_SU32_SUM0_SUS256_VWA4_VWB2_WGM4_WGMXCC1_WGMXCCGn1
    SolutionIndex: 17
    SolutionNameMin: Cijk_Ailk_Bljk_HHS_BH_UserArgs_MT256x256x32_MI16x16x1_SN_LDSB1_CLR1_GSU0_GSUC0_GSUWGMRR0_K1_LBSPPA2048_LBSPPB128_LPA0_MIWT8_8_PLR1_SU32_SUM0_SUS256_VWA8_VWB2_WGM4_WGMXCC1_WGMXCCGn1
    SolutionIndex: 18
    SolutionNameMin: Cijk_Ailk_Bljk_HHS_BH_UserArgs_MT256x256x32_MI16x16x1_SN_LDSB1_CLR1_GSU0_GSUC0_GSUWGMRR0_K1_LBSPPA2048_LBSPPB256_LPA0_MIWT8_8_PLR1_SU32_SUM0_SUS256_VWA4_VWB4_WGM4_WGMXCC1_WGMXCCGn1
    SolutionIndex: 19
    SolutionNameMin: Cijk_Ailk_Bljk_HHS_BH_UserArgs_MT256x256x32_MI16x16x1_SN_LDSB1_CLR1_GSU0_GSUC0_GSUWGMRR0_K1_LBSPPA2048_LBSPPB512_LPA0_MIWT8_8_PLR1_SU32_SUM0_SUS256_VWA4_VWB8_WGM4_WGMXCC1_WGMXCCGn1
    SolutionIndex: 20
    SolutionNameMin: Cijk_Ailk_Bljk_HHS_BH_UserArgs_MT256x256x32_MI16x16x1_SN_LDSB1_CLR1_GSU0_GSUC0_GSUWGMRR0_K1_LBSPPA2048_LBSPPB512_LPA0_MIWT8_8_PLR1_SU32_SUM0_SUS256_VWA8_VWB8_WGM4_WGMXCC1_WGMXCCGn1
    SolutionIndex: 21
    SolutionNameMin: Cijk_Ailk_Bljk_HHS_BH_UserArgs_MT256x256x32_MI16x16x1_SN_LDSB1_CLR1_GSU0_GSUC0_GSUWGMRR0_K1_LBSPPA2048_LBSPPB128_LPA32_MIWT8_8_PLR1_SU32_SUM0_SUS256_VWA2_VWB1_WGM8_WGMXCC1_WGMXCCGn1
    SolutionIndex: 22
    SolutionNameMin: Cijk_Ailk_Bljk_HHS_BH_UserArgs_MT256x256x32_MI16x16x1_SN_LDSB1_CLR1_GSU0_GSUC0_GSUWGMRR0_K1_LBSPPA2048_LBSPPB128_LPA0_MIWT8_8_PLR1_SU32_SUM0_SUS256_VWA4_VWB1_WGM8_WGMXCC1_WGMXCCGn1
    SolutionIndex: 23
    SolutionNameMin: Cijk_Ailk_Bljk_HHS_BH_UserArgs_MT256x256x32_MI16x16x1_SN_LDSB1_CLR1_GSU0_GSUC0_GSUWGMRR0_K1_LBSPPA2048_LBSPPB128_LPA0_MIWT8_8_PLR1_SU32_SUM0_SUS256_VWA8_VWB1_WGM8_WGMXCC1_WGMXCCGn1
    SolutionIndex: 24
    SolutionNameMin: Cijk_Ailk_Bljk_HHS_BH_UserArgs_MT256x256x32_MI16x16x1_SN_LDSB1_CLR1_GSU0_GSUC0_GSUWGMRR0_K1_LBSPPA2048_LBSPPB128_LPA32_MIWT8_8_PLR1_SU32_SUM0_SUS256_VWA2_VWB2_WGM8_WGMXCC1_WGMXCCGn1
    SolutionIndex: 25
    SolutionNameMin: Cijk_Ailk_Bljk_HHS_BH_UserArgs_MT256x256x32_MI16x16x1_SN_LDSB1_CLR1_GSU0_GSUC0_GSUWGMRR0_K1_LBSPPA2048_LBSPPB128_LPA0_MIWT8_8_PLR1_SU32_SUM0_SUS256_VWA4_VWB2_WGM8_WGMXCC1_WGMXCCGn1
    SolutionIndex: 26
    SolutionNameMin: Cijk_Ailk_Bljk_HHS_BH_UserArgs_MT256x256x32_MI16x16x1_SN_LDSB1_CLR1_GSU0_GSUC0_GSUWGMRR0_K1_LBSPPA2048_LBSPPB128_LPA0_MIWT8_8_PLR1_SU32_SUM0_SUS256_VWA8_VWB2_WGM8_WGMXCC1_WGMXCCGn1
    SolutionIndex: 27
    SolutionNameMin: Cijk_Ailk_Bljk_HHS_BH_UserArgs_MT256x256x32_MI16x16x1_SN_LDSB1_CLR1_GSU0_GSUC0_GSUWGMRR0_K1_LBSPPA2048_LBSPPB256_LPA32_MIWT8_8_PLR1_SU32_SUM0_SUS256_VWA2_VWB4_WGM8_WGMXCC1_WGMXCCGn1
    SolutionIndex: 28
    SolutionNameMin: Cijk_Ailk_Bljk_HHS_BH_UserArgs_MT256x256x32_MI16x16x1_SN_LDSB1_CLR1_GSU0_GSUC0_GSUWGMRR0_K1_LBSPPA2048_LBSPPB256_LPA0_MIWT8_8_PLR1_SU32_SUM0_SUS256_VWA4_VWB4_WGM8_WGMXCC1_WGMXCCGn1
    SolutionIndex: 29
    SolutionNameMin: Cijk_Ailk_Bljk_HHS_BH_UserArgs_MT256x256x32_MI16x16x1_SN_LDSB1_CLR1_GSU0_GSUC0_GSUWGMRR0_K1_LBSPPA2048_LBSPPB256_LPA0_MIWT8_8_PLR1_SU32_SUM0_SUS256_VWA8_VWB4_WGM8_WGMXCC1_WGMXCCGn1
    SolutionIndex: 30
    SolutionNameMin: Cijk_Ailk_Bljk_HHS_BH_UserArgs_MT256x256x32_MI16x16x1_SN_LDSB1_CLR1_GSU0_GSUC0_GSUWGMRR0_K1_LBSPPA2048_LBSPPB512_LPA0_MIWT8_8_PLR1_SU32_SUM0_SUS256_VWA4_VWB8_WGM8_WGMXCC1_WGMXCCGn1
    SolutionIndex: 31
    SolutionNameMin: Cijk_Ailk_Bljk_HHS_BH_UserArgs_MT256x256x32_MI16x16x1_SN_LDSB1_CLR1_GSU0_GSUC0_GSUWGMRR0_K1_LBSPPA2048_LBSPPB512_LPA0_MIWT8_8_PLR1_SU32_SUM0_SUS256_VWA8_VWB8_WGM8_WGMXCC1_WGMXCCGn1
    SolutionIndex: 32
    SolutionNameMin: Cijk_Ailk_Bljk_HHS_BH_UserArgs_MT128x256x32_MI16x16x1_SN_LDSB1_CLR1_GSU0_GSUC0_GSUWGMRR0_K1_LBSPPA1024_LBSPPB512_LPA0_MIWT4_8_PLR1_SU32_SUM0_SUS256_VWA4_VWB8_WGM1_WGMXCC1_WGMXCCGn1
    SolutionIndex: 33
    SolutionNameMin: Cijk_Ailk_Bljk_HHS_BH_UserArgs_MT128x256x32_MI16x16x1_SN_LDSB1_CLR1_GSU0_GSUC0_GSUWGMRR0_K1_LBSPPA1024_LBSPPB128_LPA0_MIWT4_8_PLR1_SU32_SUM0_SUS256_VWA4_VWB1_WGM8_WGMXCC1_WGMXCCGn1
    SolutionIndex: 34
    SolutionNameMin: Cijk_Ailk_Bljk_HHS_BH_UserArgs_MT256x128x32_MI16x16x1_SN_LDSB1_CLR1_GSU0_GSUC0_GSUWGMRR0_K1_LBSPPA2048_LBSPPB128_LPA0_MIWT8_4_PLR1_SU32_SUM0_SUS256_VWA4_VWB1_WGM1_WGMXCC1_WGMXCCGn1
    SolutionIndex: 35
    SolutionNameMin: Cijk_Ailk_Bljk_HHS_BH_UserArgs_MT256x128x32_MI16x16x1_SN_LDSB1_CLR1_GSU0_GSUC0_GSUWGMRR0_K1_LBSPPA2048_LBSPPB128_LPA0_MIWT8_4_PLR1_SU32_SUM0_SUS256_VWA8_VWB1_WGM1_WGMXCC1_WGMXCCGn1
    SolutionIndex: 36
    SolutionNameMin: Cijk_Ailk_Bljk_HHS_BH_UserArgs_MT256x128x32_MI16x16x1_SN_LDSB1_CLR1_GSU0_GSUC0_GSUWGMRR0_K1_LBSPPA2048_LBSPPB128_LPA0_MIWT8_4_PLR1_SU32_SUM0_SUS256_VWA4_VWB2_WGM1_WGMXCC1_WGMXCCGn1
    SolutionIndex: 37
    SolutionNameMin: Cijk_Ailk_Bljk_HHS_BH_UserArgs_MT256x128x32_MI16x16x1_SN_LDSB1_CLR1_GSU0_GSUC0_GSUWGMRR0_K1_LBSPPA2048_LBSPPB128_LPA0_MIWT8_4_PLR1_SU32_SUM0_SUS256_VWA8_VWB2_WGM1_WGMXCC1_WGMXCCGn1
    SolutionIndex: 38
    SolutionNameMin: Cijk_Ailk_Bljk_HHS_BH_UserArgs_MT256x128x32_MI16x16x1_SN_LDSB1_CLR1_GSU0_GSUC0_GSUWGMRR0_K1_LBSPPA2048_LBSPPB256_LPA0_MIWT8_4_PLR1_SU32_SUM0_SUS256_VWA4_VWB4_WGM1_WGMXCC1_WGMXCCGn1
    SolutionIndex: 39
    SolutionNameMin: Cijk_Ailk_Bljk_HHS_BH_UserArgs_MT256x128x32_MI16x16x1_SN_LDSB1_CLR1_GSU0_GSUC0_GSUWGMRR0_K1_LBSPPA2048_LBSPPB256_LPA0_MIWT8_4_PLR1_SU32_SUM0_SUS256_VWA8_VWB4_WGM1_WGMXCC1_WGMXCCGn1
    SolutionIndex: 40
    SolutionNameMin: Cijk_Ailk_Bljk_HHS_BH_UserArgs_MT256x128x32_MI16x16x1_SN_LDSB1_CLR1_GSU0_GSUC0_GSUWGMRR0_K1_LBSPPA2048_LBSPPB128_LPA0_MIWT8_4_PLR1_SU32_SUM0_SUS256_VWA4_VWB1_WGM4_WGMXCC1_WGMXCCGn1
    SolutionIndex: 41
    SolutionNameMin: Cijk_Ailk_Bljk_HHS_BH_UserArgs_MT256x128x32_MI16x16x1_SN_LDSB1_CLR1_GSU0_GSUC0_GSUWGMRR0_K1_LBSPPA2048_LBSPPB128_LPA0_MIWT8_4_PLR1_SU32_SUM0_SUS256_VWA4_VWB2_WGM4_WGMXCC1_WGMXCCGn1
    SolutionIndex: 42
    SolutionNameMin: Cijk_Ailk_Bljk_HHS_BH_UserArgs_MT256x128x32_MI16x16x1_SN_LDSB1_CLR1_GSU0_GSUC0_GSUWGMRR0_K1_LBSPPA2048_LBSPPB256_LPA0_MIWT8_4_PLR1_SU32_SUM0_SUS256_VWA4_VWB4_WGM4_WGMXCC1_WGMXCCGn1
    SolutionIndex: 43
    SolutionNameMin: Cijk_Ailk_Bljk_HHS_BH_UserArgs_MT256x128x32_MI16x16x1_SN_LDSB1_CLR1_GSU0_GSUC0_GSUWGMRR0_K1_LBSPPA2048_LBSPPB128_LPA0_MIWT8_4_PLR1_SU32_SUM0_SUS256_VWA4_VWB1_WGM8_WGMXCC1_WGMXCCGn1
    SolutionIndex: 44
    SolutionNameMin: Cijk_Ailk_Bljk_HHS_BH_UserArgs_MT256x128x32_MI16x16x1_SN_LDSB1_CLR1_GSU0_GSUC0_GSUWGMRR0_K1_LBSPPA2048_LBSPPB128_LPA0_MIWT8_4_PLR1_SU32_SUM0_SUS256_VWA8_VWB1_WGM8_WGMXCC1_WGMXCCGn1
    SolutionIndex: 45
    SolutionNameMin: Cijk_Ailk_Bljk_HHS_BH_UserArgs_MT256x128x32_MI16x16x1_SN_LDSB1_CLR1_GSU0_GSUC0_GSUWGMRR0_K1_LBSPPA2048_LBSPPB256_LPA0_MIWT8_4_PLR1_SU32_SUM0_SUS256_VWA4_VWB4_WGM8_WGMXCC1_WGMXCCGn1
    SolutionIndex: 46
    SolutionNameMin: Cijk_Ailk_Bljk_HHS_BH_UserArgs_MT128x128x32_MI16x16x1_SN_LDSB1_CLR1_GSU0_GSUC0_GSUWGMRR0_K1_LBSPPA1024_LBSPPB128_LPA32_MIWT4_4_PLR1_SU32_SUM0_SUS256_VWA2_VWB1_WGM4_WGMXCC1_WGMXCCGn1
    SolutionIndex: 47
    SolutionNameMin: Cijk_Ailk_Bljk_HHS_BH_UserArgs_MT64x128x32_MI16x16x1_SN_LDSB0_CLR1_GSU0_GSUC0_GSUWGMRR0_K1_LBSPPA512_LBSPPB128_LPA32_MIWT2_4_PLR1_SU32_SUM0_SUS256_VWA2_VWB2_WGM1_WGMXCC1_WGMXCCGn1
    SolutionIndex: 48
    SolutionNameMin: Cijk_Ailk_Bljk_HHS_BH_UserArgs_MT128x64x32_MI16x16x1_SN_LDSB0_CLR1_GSU0_GSUC0_GSUWGMRR0_K1_LBSPPA1024_LBSPPB128_LPA32_MIWT4_2_PLR1_SU32_SUM0_SUS256_VWA2_VWB2_WGM1_WGMXCC1_WGMXCCGn1
    SolutionIndex: 49
    SolutionNameMin: Cijk_Ailk_Bljk_HHS_BH_UserArgs_MT128x64x32_MI16x16x1_SN_LDSB0_CLR1_GSU0_GSUC0_GSUWGMRR0_K1_LBSPPA1024_LBSPPB128_LPA0_MIWT4_2_PLR1_SU32_SUM0_SUS256_VWA4_VWB2_WGM1_WGMXCC1_WGMXCCGn1
    SolutionIndex: 50
    SolutionNameMin: Cijk_Ailk_Bljk_HHS_BH_UserArgs_MT32x32x32_MI16x16x1_SN_LDSB0_CLR1_GSU0_GSUC0_GSUWGMRR0_K1_LBSPPA256_LBSPPB128_LPA16_MIWT1_1_PLR1_SU32_SUM0_SUS256_VWA1_VWB1_WGM1_WGMXCC1_WGMXCCGn1
    SolutionIndex: 51
    SolutionNameMin: Cijk_Ailk_Bljk_HHS_BH_UserArgs_MT128x256x64_MI16x16x1_SN_LDSB1_CLR1_GSU0_GSUC0_GSUWGMRR0_K1_LBSPPA2048_LBSPPB128_LPA0_MIWT4_8_PLR1_SU32_SUM0_SUS256_VWA4_VWB1_WGM1_WGMXCC1_WGMXCCGn1
    SolutionIndex: 52
    SolutionNameMin: Cijk_Ailk_Bljk_HHS_BH_UserArgs_MT128x256x64_MI16x16x1_SN_LDSB1_CLR1_GSU0_GSUC0_GSUWGMRR0_K1_LBSPPA2048_LBSPPB256_LPA32_MIWT4_8_PLR1_SU32_SUM0_SUS256_VWA2_VWB2_WGM1_WGMXCC1_WGMXCCGn1
    SolutionIndex: 53
    SolutionNameMin: Cijk_Ailk_Bljk_HHS_BH_UserArgs_MT128x256x64_MI16x16x1_SN_LDSB1_CLR1_GSU0_GSUC0_GSUWGMRR0_K1_LBSPPA2048_LBSPPB256_LPA0_MIWT4_8_PLR1_SU32_SUM0_SUS256_VWA4_VWB2_WGM1_WGMXCC1_WGMXCCGn1
    SolutionIndex: 54
    SolutionNameMin: Cijk_Ailk_Bljk_HHS_BH_UserArgs_MT128x256x64_MI16x16x1_SN_LDSB1_CLR1_GSU0_GSUC0_GSUWGMRR0_K1_LBSPPA2048_LBSPPB512_LPA0_MIWT4_8_PLR1_SU32_SUM0_SUS256_VWA4_VWB4_WGM1_WGMXCC1_WGMXCCGn1
    SolutionIndex: 55
    SolutionNameMin: Cijk_Ailk_Bljk_HHS_BH_UserArgs_MT128x256x64_MI16x16x1_SN_LDSB1_CLR1_GSU0_GSUC0_GSUWGMRR0_K1_LBSPPA2048_LBSPPB1024_LPA0_MIWT4_8_PLR1_SU32_SUM0_SUS256_VWA4_VWB8_WGM1_WGMXCC1_WGMXCCGn1
    SolutionIndex: 56
    SolutionNameMin: Cijk_Ailk_Bljk_HHS_BH_UserArgs_MT128x256x64_MI16x16x1_SN_LDSB1_CLR1_GSU0_GSUC0_GSUWGMRR0_K1_LBSPPA2048_LBSPPB128_LPA32_MIWT4_8_PLR1_SU32_SUM0_SUS256_VWA2_VWB1_WGM4_WGMXCC1_WGMXCCGn1
    SolutionIndex: 57
    SolutionNameMin: Cijk_Ailk_Bljk_HHS_BH_UserArgs_MT128x256x64_MI16x16x1_SN_LDSB1_CLR1_GSU0_GSUC0_GSUWGMRR0_K1_LBSPPA2048_LBSPPB256_LPA0_MIWT4_8_PLR1_SU32_SUM0_SUS256_VWA4_VWB2_WGM4_WGMXCC1_WGMXCCGn1
    SolutionIndex: 58
    SolutionNameMin: Cijk_Ailk_Bljk_HHS_BH_UserArgs_MT128x256x64_MI16x16x1_SN_LDSB1_CLR1_GSU0_GSUC0_GSUWGMRR0_K1_LBSPPA2048_LBSPPB512_LPA0_MIWT4_8_PLR1_SU32_SUM0_SUS256_VWA4_VWB4_WGM4_WGMXCC1_WGMXCCGn1
    SolutionIndex: 59
    SolutionNameMin: Cijk_Ailk_Bljk_HHS_BH_UserArgs_MT128x256x64_MI16x16x1_SN_LDSB1_CLR1_GSU0_GSUC0_GSUWGMRR0_K1_LBSPPA2048_LBSPPB128_LPA32_MIWT4_8_PLR1_SU32_SUM0_SUS256_VWA2_VWB1_WGM8_WGMXCC1_WGMXCCGn1
    SolutionIndex: 60
    SolutionNameMin: Cijk_Ailk_Bljk_HHS_BH_UserArgs_MT128x256x64_MI16x16x1_SN_LDSB1_CLR1_GSU0_GSUC0_GSUWGMRR0_K1_LBSPPA2048_LBSPPB256_LPA0_MIWT4_8_PLR1_SU32_SUM0_SUS256_VWA4_VWB2_WGM8_WGMXCC1_WGMXCCGn1
    SolutionIndex: 61
    SolutionNameMin: Cijk_Ailk_Bljk_HHS_BH_UserArgs_MT128x256x64_MI16x16x1_SN_LDSB1_CLR1_GSU0_GSUC0_GSUWGMRR0_K1_LBSPPA2048_LBSPPB512_LPA0_MIWT4_8_PLR1_SU32_SUM0_SUS256_VWA4_VWB4_WGM8_WGMXCC1_WGMXCCGn1
    SolutionIndex: 62
    SolutionNameMin: Cijk_Ailk_Bljk_HHS_BH_UserArgs_MT256x128x64_MI16x16x1_SN_LDSB1_CLR1_GSU0_GSUC0_GSUWGMRR0_K1_LBSPPA4096_LBSPPB128_LPA32_MIWT8_4_PLR1_SU32_SUM0_SUS256_VWA2_VWB1_WGM1_WGMXCC1_WGMXCCGn1
    SolutionIndex: 63
    SolutionNameMin: Cijk_Ailk_Bljk_HHS_BH_UserArgs_MT256x128x64_MI16x16x1_SN_LDSB1_CLR1_GSU0_GSUC0_GSUWGMRR0_K1_LBSPPA4096_LBSPPB128_LPA0_MIWT8_4_PLR1_SU32_SUM0_SUS256_VWA4_VWB1_WGM1_WGMXCC1_WGMXCCGn1
    SolutionIndex: 64
    SolutionNameMin: Cijk_Ailk_Bljk_HHS_BH_UserArgs_MT256x128x64_MI16x16x1_SN_LDSB1_CLR1_GSU0_GSUC0_GSUWGMRR0_K1_LBSPPA4096_LBSPPB256_LPA32_MIWT8_4_PLR1_SU32_SUM0_SUS256_VWA2_VWB2_WGM1_WGMXCC1_WGMXCCGn1
    SolutionIndex: 65
    SolutionNameMin: Cijk_Ailk_Bljk_HHS_BH_UserArgs_MT256x128x64_MI16x16x1_SN_LDSB1_CLR1_GSU0_GSUC0_GSUWGMRR0_K1_LBSPPA4096_LBSPPB256_LPA0_MIWT8_4_PLR1_SU32_SUM0_SUS256_VWA4_VWB2_WGM1_WGMXCC1_WGMXCCGn1
    SolutionIndex: 66
    SolutionNameMin: Cijk_Ailk_Bljk_HHS_BH_UserArgs_MT256x128x64_MI16x16x1_SN_LDSB1_CLR1_GSU0_GSUC0_GSUWGMRR0_K1_LBSPPA4096_LBSPPB256_LPA0_MIWT8_4_PLR1_SU32_SUM0_SUS256_VWA8_VWB2_WGM1_WGMXCC1_WGMXCCGn1
    SolutionIndex: 67
    SolutionNameMin: Cijk_Ailk_Bljk_HHS_BH_UserArgs_MT256x128x64_MI16x16x1_SN_LDSB1_CLR1_GSU0_GSUC0_GSUWGMRR0_K1_LBSPPA4096_LBSPPB512_LPA32_MIWT8_4_PLR1_SU32_SUM0_SUS256_VWA2_VWB4_WGM1_WGMXCC1_WGMXCCGn1
    SolutionIndex: 68
    SolutionNameMin: Cijk_Ailk_Bljk_HHS_BH_UserArgs_MT256x128x64_MI16x16x1_SN_LDSB1_CLR1_GSU0_GSUC0_GSUWGMRR0_K1_LBSPPA4096_LBSPPB512_LPA0_MIWT8_4_PLR1_SU32_SUM0_SUS256_VWA4_VWB4_WGM1_WGMXCC1_WGMXCCGn1
    SolutionIndex: 69
    SolutionNameMin: Cijk_Ailk_Bljk_HHS_BH_UserArgs_MT256x128x64_MI16x16x1_SN_LDSB1_CLR1_GSU0_GSUC0_GSUWGMRR0_K1_LBSPPA4096_LBSPPB128_LPA0_MIWT8_4_PLR1_SU32_SUM0_SUS256_VWA4_VWB1_WGM4_WGMXCC1_WGMXCCGn1
    SolutionIndex: 70
    SolutionNameMin: Cijk_Ailk_Bljk_HHS_BH_UserArgs_MT256x128x64_MI16x16x1_SN_LDSB1_CLR1_GSU0_GSUC0_GSUWGMRR0_K1_LBSPPA4096_LBSPPB128_LPA0_MIWT8_4_PLR1_SU32_SUM0_SUS256_VWA8_VWB1_WGM4_WGMXCC1_WGMXCCGn1
    SolutionIndex: 71
    SolutionNameMin: Cijk_Ailk_Bljk_HHS_BH_UserArgs_MT256x128x64_MI16x16x1_SN_LDSB1_CLR1_GSU0_GSUC0_GSUWGMRR0_K1_LBSPPA4096_LBSPPB512_LPA0_MIWT8_4_PLR1_SU32_SUM0_SUS256_VWA4_VWB4_WGM4_WGMXCC1_WGMXCCGn1
    SolutionIndex: 72
    SolutionNameMin: Cijk_Ailk_Bljk_HHS_BH_UserArgs_MT256x128x64_MI16x16x1_SN_LDSB1_CLR1_GSU0_GSUC0_GSUWGMRR0_K1_LBSPPA4096_LBSPPB128_LPA0_MIWT8_4_PLR1_SU32_SUM0_SUS256_VWA4_VWB1_WGM8_WGMXCC1_WGMXCCGn1
    SolutionIndex: 73
    SolutionNameMin: Cijk_Ailk_Bljk_HHS_BH_UserArgs_MT256x128x64_MI16x16x1_SN_LDSB1_CLR1_GSU0_GSUC0_GSUWGMRR0_K1_LBSPPA4096_LBSPPB256_LPA0_MIWT8_4_PLR1_SU32_SUM0_SUS256_VWA4_VWB2_WGM8_WGMXCC1_WGMXCCGn1
    SolutionIndex: 74
    SolutionNameMin: Cijk_Ailk_Bljk_HHS_BH_UserArgs_MT256x128x64_MI16x16x1_SN_LDSB1_CLR1_GSU0_GSUC0_GSUWGMRR0_K1_LBSPPA4096_LBSPPB512_LPA0_MIWT8_4_PLR1_SU32_SUM0_SUS256_VWA4_VWB4_WGM8_WGMXCC1_WGMXCCGn1
    SolutionIndex: 75
    SolutionNameMin: Cijk_Ailk_Bljk_HHS_BH_UserArgs_MT256x64x64_MI16x16x1_SN_LDSB1_CLR1_GSU0_GSUC0_GSUWGMRR0_K1_LBSPPA4096_LBSPPB256_LPA0_MIWT8_2_PLR1_SU32_SUM0_SUS256_VWA4_VWB2_WGM4_WGMXCC1_WGMXCCGn1
    SolutionIndex: 76
    SolutionNameMin: Cijk_Ailk_Bljk_HHS_BH_UserArgs_MT128x128x64_MI16x16x1_SN_LDSB1_CLR1_GSU0_GSUC0_GSUWGMRR0_K1_LBSPPA2048_LBSPPB128_LPA32_MIWT4_4_PLR1_SU32_SUM0_SUS256_VWA2_VWB1_WGM1_WGMXCC1_WGMXCCGn1
    SolutionIndex: 77
    SolutionNameMin: Cijk_Ailk_Bljk_HHS_BH_UserArgs_MT128x128x64_MI16x16x1_SN_LDSB1_CLR1_GSU0_GSUC0_GSUWGMRR0_K1_LBSPPA2048_LBSPPB128_LPA0_MIWT4_4_PLR1_SU32_SUM0_SUS256_VWA4_VWB1_WGM1_WGMXCC1_WGMXCCGn1
    SolutionIndex: 78
    SolutionNameMin: Cijk_Ailk_Bljk_HHS_BH_UserArgs_MT128x128x64_MI16x16x1_SN_LDSB1_CLR1_GSU0_GSUC0_GSUWGMRR0_K1_LBSPPA2048_LBSPPB256_LPA32_MIWT4_4_PLR1_SU32_SUM0_SUS256_VWA2_VWB2_WGM1_WGMXCC1_WGMXCCGn1
    SolutionIndex: 79
    SolutionNameMin: Cijk_Ailk_Bljk_HHS_BH_UserArgs_MT128x128x64_MI16x16x1_SN_LDSB1_CLR1_GSU0_GSUC0_GSUWGMRR0_K1_LBSPPA2048_LBSPPB256_LPA0_MIWT4_4_PLR1_SU32_SUM0_SUS256_VWA4_VWB2_WGM1_WGMXCC1_WGMXCCGn1
    SolutionIndex: 80
    SolutionNameMin: Cijk_Ailk_Bljk_HHS_BH_UserArgs_MT128x128x64_MI16x16x1_SN_LDSB1_CLR1_GSU0_GSUC0_GSUWGMRR0_K1_LBSPPA2048_LBSPPB512_LPA32_MIWT4_4_PLR1_SU32_SUM0_SUS256_VWA2_VWB4_WGM1_WGMXCC1_WGMXCCGn1
    SolutionIndex: 81
    SolutionNameMin: Cijk_Ailk_Bljk_HHS_BH_UserArgs_MT128x128x64_MI16x16x1_SN_LDSB1_CLR1_GSU0_GSUC0_GSUWGMRR0_K1_LBSPPA2048_LBSPPB512_LPA0_MIWT4_4_PLR1_SU32_SUM0_SUS256_VWA4_VWB4_WGM1_WGMXCC1_WGMXCCGn1
    SolutionIndex: 82
    SolutionNameMin: Cijk_Ailk_Bljk_HHS_BH_UserArgs_MT128x128x64_MI16x16x1_SN_LDSB1_CLR1_GSU0_GSUC0_GSUWGMRR0_K1_LBSPPA2048_LBSPPB128_LPA32_MIWT4_4_PLR1_SU32_SUM0_SUS256_VWA2_VWB1_WGM4_WGMXCC1_WGMXCCGn1
    SolutionIndex: 83
    SolutionNameMin: Cijk_Ailk_Bljk_HHS_BH_UserArgs_MT128x128x64_MI16x16x1_SN_LDSB1_CLR1_GSU0_GSUC0_GSUWGMRR0_K1_LBSPPA2048_LBSPPB128_LPA0_MIWT4_4_PLR1_SU32_SUM0_SUS256_VWA4_VWB1_WGM4_WGMXCC1_WGMXCCGn1
    SolutionIndex: 84
    SolutionNameMin: Cijk_Ailk_Bljk_HHS_BH_UserArgs_MT128x128x64_MI16x16x1_SN_LDSB1_CLR1_GSU0_GSUC0_GSUWGMRR0_K1_LBSPPA2048_LBSPPB256_LPA32_MIWT4_4_PLR1_SU32_SUM0_SUS256_VWA2_VWB2_WGM4_WGMXCC1_WGMXCCGn1
    SolutionIndex: 85
    SolutionNameMin: Cijk_Ailk_Bljk_HHS_BH_UserArgs_MT128x128x64_MI16x16x1_SN_LDSB1_CLR1_GSU0_GSUC0_GSUWGMRR0_K1_LBSPPA2048_LBSPPB256_LPA0_MIWT4_4_PLR1_SU32_SUM0_SUS256_VWA4_VWB2_WGM4_WGMXCC1_WGMXCCGn1
    SolutionIndex: 86
    SolutionNameMin: Cijk_Ailk_Bljk_HHS_BH_UserArgs_MT128x128x64_MI16x16x1_SN_LDSB1_CLR1_GSU0_GSUC0_GSUWGMRR0_K1_LBSPPA2048_LBSPPB512_LPA32_MIWT4_4_PLR1_SU32_SUM0_SUS256_VWA2_VWB4_WGM4_WGMXCC1_WGMXCCGn1
    SolutionIndex: 87
    SolutionNameMin: Cijk_Ailk_Bljk_HHS_BH_UserArgs_MT128x128x64_MI16x16x1_SN_LDSB1_CLR1_GSU0_GSUC0_GSUWGMRR0_K1_LBSPPA2048_LBSPPB512_LPA0_MIWT4_4_PLR1_SU32_SUM0_SUS256_VWA4_VWB4_WGM4_WGMXCC1_WGMXCCGn1
    SolutionIndex: 88
    SolutionNameMin: Cijk_Ailk_Bljk_HHS_BH_UserArgs_MT128x128x64_MI16x16x1_SN_LDSB1_CLR1_GSU0_GSUC0_GSUWGMRR0_K1_LBSPPA2048_LBSPPB128_LPA32_MIWT4_4_PLR1_SU32_SUM0_SUS256_VWA2_VWB1_WGM8_WGMXCC1_WGMXCCGn1
    SolutionIndex: 89
    SolutionNameMin: Cijk_Ailk_Bljk_HHS_BH_UserArgs_MT128x128x64_MI16x16x1_SN_LDSB1_CLR1_GSU0_GSUC0_GSUWGMRR0_K1_LBSPPA2048_LBSPPB128_LPA0_MIWT4_4_PLR1_SU32_SUM0_SUS256_VWA4_VWB1_WGM8_WGMXCC1_WGMXCCGn1
    SolutionIndex: 90
    SolutionNameMin: Cijk_Ailk_Bljk_HHS_BH_UserArgs_MT128x128x64_MI16x16x1_SN_LDSB1_CLR1_GSU0_GSUC0_GSUWGMRR0_K1_LBSPPA2048_LBSPPB512_LPA32_MIWT4_4_PLR1_SU32_SUM0_SUS256_VWA2_VWB4_WGM8_WGMXCC1_WGMXCCGn1
    SolutionIndex: 91
    SolutionNameMin: Cijk_Ailk_Bljk_HHS_BH_UserArgs_MT128x128x64_MI16x16x1_SN_LDSB1_CLR1_GSU0_GSUC0_GSUWGMRR0_K1_LBSPPA2048_LBSPPB512_LPA0_MIWT4_4_PLR1_SU32_SUM0_SUS256_VWA4_VWB4_WGM8_WGMXCC1_WGMXCCGn1
    SolutionIndex: 92
    SolutionNameMin: Cijk_Ailk_Bljk_HHS_BH_UserArgs_MT128x64x64_MI16x16x1_SN_LDSB1_CLR1_GSU0_GSUC0_GSUWGMRR0_K1_LBSPPA2048_LBSPPB128_LPA0_MIWT4_2_PLR1_SU32_SUM0_SUS256_VWA4_VWB1_WGM1_WGMXCC1_WGMXCCGn1
    SolutionIndex: 93
    SolutionNameMin: Cijk_Ailk_Bljk_HHS_BH_UserArgs_MT128x64x64_MI16x16x1_SN_LDSB1_CLR1_GSU0_GSUC0_GSUWGMRR0_K1_LBSPPA2048_LBSPPB256_LPA0_MIWT4_2_PLR1_SU32_SUM0_SUS256_VWA4_VWB2_WGM1_WGMXCC1_WGMXCCGn1
    SolutionIndex: 94
    SolutionNameMin: Cijk_Ailk_Bljk_HHS_BH_UserArgs_MT128x64x64_MI16x16x1_SN_LDSB1_CLR1_GSU0_GSUC0_GSUWGMRR0_K1_LBSPPA2048_LBSPPB128_LPA0_MIWT4_2_PLR1_SU32_SUM0_SUS256_VWA4_VWB1_WGM4_WGMXCC1_WGMXCCGn1
    SolutionIndex: 95
    SolutionNameMin: Cijk_Ailk_Bljk_HHS_BH_UserArgs_MT128x64x64_MI16x16x1_SN_LDSB1_CLR1_GSU0_GSUC0_GSUWGMRR0_K1_LBSPPA2048_LBSPPB256_LPA0_MIWT4_2_PLR1_SU32_SUM0_SUS256_VWA4_VWB2_WGM4_WGMXCC1_WGMXCCGn1
    SolutionIndex: 96
    SolutionNameMin: Cijk_Ailk_Bljk_HHS_BH_UserArgs_MT128x64x64_MI16x16x1_SN_LDSB1_CLR1_GSU0_GSUC0_GSUWGMRR0_K1_LBSPPA2048_LBSPPB128_LPA0_MIWT4_2_PLR1_SU32_SUM0_SUS256_VWA4_VWB1_WGM8_WGMXCC1_WGMXCCGn1
    SolutionIndex: 97
    SolutionNameMin: Cijk_Ailk_Bljk_HHS_BH_UserArgs_MT128x64x64_MI16x16x1_SN_LDSB1_CLR1_GSU0_GSUC0_GSUWGMRR0_K1_LBSPPA2048_LBSPPB256_LPA0_MIWT4_2_PLR1_SU32_SUM0_SUS256_VWA4_VWB2_WGM8_WGMXCC1_WGMXCCGn1
    SolutionIndex: 98
    SolutionNameMin: Cijk_Ailk_Bljk_HHS_BH_UserArgs_MT64x64x64_MI16x16x1_SN_LDSB1_CLR1_GSU0_GSUC0_GSUWGMRR0_K1_LBSPPA1024_LBSPPB128_LPA32_MIWT2_2_PLR1_SU32_SUM0_SUS256_VWA2_VWB1_WGM1_WGMXCC1_WGMXCCGn1
    SolutionIndex: 99
    SolutionNameMin: Cijk_Ailk_Bljk_HHS_BH_UserArgs_MT64x64x64_MI16x16x1_SN_LDSB1_CLR1_GSU0_GSUC0_GSUWGMRR0_K1_LBSPPA1024_LBSPPB256_LPA32_MIWT2_2_PLR1_SU32_SUM0_SUS256_VWA2_VWB2_WGM1_WGMXCC1_WGMXCCGn1
    SolutionIndex: 100
    SolutionNameMin: Cijk_Ailk_Bljk_HHS_BH_UserArgs_MT32x64x64_MI16x16x1_SN_LDSB0_CLR1_GSU0_GSUC0_GSUWGMRR0_K1_LBSPPA512_LBSPPB256_LPA16_MIWT1_2_PLR1_SU32_SUM0_SUS256_VWA1_VWB2_WGM1_WGMXCC1_WGMXCCGn1
    SolutionIndex: 101
    SolutionNameMin: Cijk_Ailk_Bljk_HHS_BH_UserArgs_MT64x32x64_MI16x16x1_SN_LDSB0_CLR1_GSU0_GSUC0_GSUWGMRR0_K1_LBSPPA1024_LBSPPB128_LPA32_MIWT2_1_PLR1_SU32_SUM0_SUS256_VWA2_VWB1_WGM1_WGMXCC1_WGMXCCGn1
    SolutionIndex: 102
    SolutionNameMin: Cijk_Ailk_Bljk_HHS_BH_UserArgs_MT64x32x64_MI16x16x1_SN_LDSB0_CLR1_GSU0_GSUC0_GSUWGMRR0_K1_LBSPPA1024_LBSPPB128_LPA32_MIWT2_1_PLR2_SU32_SUM0_SUS256_VWA2_VWB1_WGM1_WGMXCC1_WGMXCCGn1
    SolutionIndex: 103
    SolutionNameMin: Cijk_Ailk_Bljk_HHS_BH_UserArgs_MT32x32x64_MI16x16x1_SN_LDSB0_CLR1_GSU0_GSUC0_GSUWGMRR0_K1_LBSPPA512_LBSPPB128_LPA16_MIWT1_1_PLR1_SU32_SUM0_SUS256_VWA1_VWB1_WGM1_WGMXCC1_WGMXCCGn1
    SolutionIndex: 104
    SolutionNameMin: Cijk_Ailk_Bljk_HHS_BH_UserArgs_MT128x64x128_MI16x16x1_SN_LDSB1_CLR1_GSU0_GSUC0_GSUWGMRR0_K1_LBSPPA2048_LBSPPB256_LPA0_MIWT4_2_PLR1_SU32_SUM0_SUS256_VWA4_VWB1_WGM1_WGMXCC1_WGMXCCGn1
    SolutionIndex: 105
    SolutionNameMin: Cijk_Ailk_Bljk_HHS_BH_UserArgs_MT128x64x128_MI16x16x1_SN_LDSB1_CLR1_GSU0_GSUC0_GSUWGMRR0_K1_LBSPPA2048_LBSPPB256_LPA0_MIWT4_2_PLR2_SU32_SUM0_SUS256_VWA4_VWB1_WGM1_WGMXCC1_WGMXCCGn1
    SolutionIndex: 106
    SolutionNameMin: Cijk_Ailk_Bljk_HHS_BH_UserArgs_MT128x64x128_MI16x16x1_SN_LDSB1_CLR1_GSU0_GSUC0_GSUWGMRR0_K1_LBSPPA2048_LBSPPB512_LPA0_MIWT4_2_PLR2_SU32_SUM0_SUS256_VWA4_VWB2_WGM1_WGMXCC1_WGMXCCGn1
    SolutionIndex: 107
    SolutionNameMin: Cijk_Ailk_Bljk_HHS_BH_UserArgs_MT128x64x128_MI16x16x1_SN_LDSB1_CLR1_GSU0_GSUC0_GSUWGMRR0_K1_LBSPPA2048_LBSPPB256_LPA0_MIWT4_2_PLR1_SU32_SUM0_SUS256_VWA4_VWB1_WGM4_WGMXCC1_WGMXCCGn1
    SolutionIndex: 108
    SolutionNameMin: Cijk_Ailk_Bljk_HHS_BH_UserArgs_MT128x64x128_MI16x16x1_SN_LDSB1_CLR1_GSU0_GSUC0_GSUWGMRR0_K1_LBSPPA2048_LBSPPB256_LPA0_MIWT4_2_PLR2_SU32_SUM0_SUS256_VWA4_VWB1_WGM4_WGMXCC1_WGMXCCGn1
    SolutionIndex: 109
    SolutionNameMin: Cijk_Ailk_Bljk_HHS_BH_UserArgs_MT128x64x128_MI16x16x1_SN_LDSB1_CLR1_GSU0_GSUC0_GSUWGMRR0_K1_LBSPPA2048_LBSPPB256_LPA0_MIWT4_2_PLR2_SU32_SUM0_SUS256_VWA4_VWB1_WGM8_WGMXCC1_WGMXCCGn1
    SolutionIndex: 110
    SolutionNameMin: Cijk_Ailk_Bljk_HHS_BH_UserArgs_MT64x64x128_MI16x16x1_SN_LDSB1_CLR1_GSU0_GSUC0_GSUWGMRR0_K1_LBSPPA1024_LBSPPB256_LPA32_MIWT2_2_PLR2_SU32_SUM0_SUS256_VWA2_VWB1_WGM1_WGMXCC1_WGMXCCGn1
    SolutionIndex: 111
    SolutionNameMin: Cijk_Ailk_Bljk_HHS_BH_UserArgs_MT64x64x128_MI16x16x1_SN_LDSB1_CLR1_GSU0_GSUC0_GSUWGMRR0_K1_LBSPPA1024_LBSPPB512_LPA32_MIWT2_2_PLR2_SU32_SUM0_SUS256_VWA2_VWB2_WGM1_WGMXCC1_WGMXCCGn1
    SolutionIndex: 112
    SolutionNameMin: Cijk_Ailk_Bljk_HHS_BH_UserArgs_MT64x64x128_MI16x16x1_SN_LDSB1_CLR1_GSU0_GSUC0_GSUWGMRR0_K1_LBSPPA1024_LBSPPB256_LPA32_MIWT2_2_PLR2_SU32_SUM0_SUS256_VWA2_VWB1_WGM8_WGMXCC1_WGMXCCGn1
    SolutionIndex: 113
    SolutionNameMin: Cijk_Ailk_Bljk_HHS_BH_UserArgs_MT64x32x128_MI16x16x1_SN_LDSB1_CLR1_GSU0_GSUC0_GSUWGMRR0_K1_LBSPPA1024_LBSPPB256_LPA32_MIWT2_1_PLR2_SU32_SUM0_SUS256_VWA2_VWB1_WGM1_WGMXCC1_WGMXCCGn1
    SolutionIndex: 114
    SolutionNameMin: Cijk_Ailk_Bljk_HHS_BH_UserArgs_MT64x32x128_MI16x16x1_SN_LDSB1_CLR1_GSU0_GSUC0_GSUWGMRR0_K1_LBSPPA1024_LBSPPB256_LPA32_MIWT2_1_PLR2_SU32_SUM0_SUS256_VWA2_VWB1_WGM4_WGMXCC1_WGMXCCGn1
    SolutionIndex: 115
    SolutionNameMin: Cijk_Ailk_Bljk_HHS_BH_UserArgs_MT64x32x128_MI16x16x1_SN_LDSB1_CLR1_GSU0_GSUC0_GSUWGMRR0_K1_LBSPPA1024_LBSPPB256_LPA32_MIWT2_1_PLR2_SU32_SUM0_SUS256_VWA2_VWB1_WGM8_WGMXCC1_WGMXCCGn1
    SolutionIndex: 116
    SolutionNameMin: Cijk_Ailk_Bljk_HHS_BH_UserArgs_MT32x32x128_MI16x16x1_SN_LDSB1_CLR1_GSU0_GSUC0_GSUWGMRR0_K1_LBSPPA512_LBSPPB256_LPA16_MIWT1_1_PLR1_SU32_SUM0_SUS256_VWA1_VWB1_WGM1_WGMXCC1_WGMXCCGn1
    SolutionIndex: 117
    SolutionNameMin: Cijk_Ailk_Bljk_HHS_BH_UserArgs_MT32x32x128_MI16x16x1_SN_LDSB1_CLR1_GSU0_GSUC0_GSUWGMRR0_K1_LBSPPA512_LBSPPB256_LPA16_MIWT1_1_PLR2_SU32_SUM0_SUS256_VWA1_VWB1_WGM1_WGMXCC1_WGMXCCGn1
    SolutionIndex: 118
    SolutionNameMin: Cijk_Ailk_Bljk_HHS_BH_UserArgs_MT32x32x32_MI16x16x1_SN_LDSB0_CLR0_GSU0_GSUC0_GSUWGMRR0_K1_LBSPPA256_LBSPPB128_LPA16_MIWT1_1_PLR0_SU32_SUM0_SUS256_VWA1_VWB1_WGM8_WGMXCC1_WGMXCCGn1
- - - [128, 128, 1, 128, 128, 128, 128, 128]
    - [50, 0.089]
  - - [128, 128, 1, 256, 128, 128, 128, 256]
    - [103, 0.16]
  - - [128, 128, 1, 512, 128, 128, 128, 512]
    - [117, 0.267]
  - - [128, 128, 1, 1024, 128, 128, 128, 1024]
    - [116, 0.402]
  - - [128, 128, 1, 2048, 128, 128, 128, 2048]
    - [117, 0.576]
  - - [128, 128, 1, 4096, 128, 128, 128, 4096]
    - [100, 0.885]
  - - [128, 128, 1, 8192, 128, 128, 128, 8192]
    - [114, 1.378]
  - - [128, 256, 1, 128, 128, 128, 128, 128]
    - [117, 0.176]
  - - [128, 256, 1, 256, 128, 128, 128, 256]
    - [103, 0.313]
  - - [128, 256, 1, 512, 128, 128, 128, 512]
    - [116, 0.509]
  - - [128, 256, 1, 1024, 128, 128, 128, 1024]
    - [116, 0.786]
  - - [128, 256, 1, 2048, 128, 128, 128, 2048]
    - [116, 1.035]
  - - [128, 256, 1, 4096, 128, 128, 128, 4096]
    - [113, 1.461]
  - - [128, 256, 1, 8192, 128, 128, 128, 8192]
    - [110, 2.183]
  - - [128, 512, 1, 128, 128, 128, 128, 128]
    - [101, 0.338]
  - - [128, 512, 1, 256, 128, 128, 128, 256]
    - [101, 0.596]
  - - [128, 512, 1, 512, 128, 128, 128, 512]
    - [113, 0.929]
  - - [128, 512, 1, 1024, 128, 128, 128, 1024]
    - [115, 1.379]
  - - [128, 512, 1, 2048, 128, 128, 128, 2048]
    - [115, 1.788]
  - - [128, 512, 1, 4096, 128, 128, 128, 4096]
    - [95, 2.365]
  - - [128, 512, 1, 8192, 128, 128, 128, 8192]
    - [109, 3.431]
  - - [128, 1024, 1, 128, 128, 128, 128, 128]
    - [98, 0.616]
  - - [128, 1024, 1, 256, 128, 128, 128, 256]
    - [98, 1.028]
  - - [128, 1024, 1, 512, 128, 128, 128, 512]
    - [110, 1.648]
  - - [128, 1024, 1, 1024, 128, 128, 128, 1024]
    - [110, 2.368]
  - - [128, 1024, 1, 2048, 128, 128, 128, 2048]
    - [110, 2.852]
  - - [128, 1024, 1, 4096, 128, 128, 128, 4096]
    - [81, 3.611]
  - - [128, 1024, 1, 8192, 128, 128, 128, 8192]
    - [107, 4.396]
  - - [128, 2048, 1, 128, 128, 128, 128, 128]
    - [48, 1.028]
  - - [128, 2048, 1, 256, 128, 128, 128, 256]
    - [92, 1.716]
  - - [128, 2048, 1, 512, 128, 128, 128, 512]
    - [93, 2.604]
  - - [128, 2048, 1, 1024, 128, 128, 128, 1024]
    - [104, 3.482]
  - - [128, 2048, 1, 2048, 128, 128, 128, 2048]
    - [108, 4.335]
  - - [128, 2048, 1, 4096, 128, 128, 128, 4096]
    - [77, 5.034]
  - - [128, 2048, 1, 8192, 128, 128, 128, 8192]
    - [87, 6.462]
  - - [128, 4096, 1, 128, 128, 128, 128, 128]
    - [90, 1.587]
  - - [128, 4096, 1, 256, 128, 128, 128, 256]
    - [76, 2.561]
  - - [128, 4096, 1, 512, 128, 128, 128, 512]
    - [80, 3.655]
  - - [128, 4096, 1, 1024, 128, 128, 128, 1024]
    - [86, 4.435]
  - - [128, 4096, 1, 2048, 128, 128, 128, 2048]
    - [77, 5.783]
  - - [128, 4096, 1, 4096, 128, 128, 128, 4096]
    - [85, 6.196]
  - - [128, 4096, 1, 8192, 128, 128, 128, 8192]
    - [79, 7.204]
  - - [128, 8192, 1, 128, 128, 128, 128, 128]
    - [33, 1.891]
  - - [128, 8192, 1, 256, 128, 128, 128, 256]
    - [32, 2.96]
  - - [128, 8192, 1, 512, 128, 128, 128, 512]
    - [52, 4.371]
  - - [128, 8192, 1, 1024, 128, 128, 128, 1024]
    - [56, 5.556]
  - - [128, 8192, 1, 2048, 128, 128, 128, 2048]
    - [60, 6.64]
  - - [128, 8192, 1, 4096, 128, 128, 128, 4096]
    - [54, 7.377]
  - - [128, 8192, 1, 8192, 128, 128, 128, 8192]
    - [60, 7.232]
  - - [256, 128, 1, 128, 256, 256, 256, 128]
    - [101, 0.174]
  - - [256, 128, 1, 256, 256, 256, 256, 256]
    - [116, 0.314]
  - - [256, 128, 1, 512, 256, 256, 256, 512]
    - [117, 0.511]
  - - [256, 128, 1, 1024, 256, 256, 256, 1024]
    - [117, 0.779]
  - - [256, 128, 1, 2048, 256, 256, 256, 2048]
    - [117, 1.036]
  - - [256, 128, 1, 4096, 256, 256, 256, 4096]
    - [113, 1.473]
  - - [256, 128, 1, 8192, 256, 256, 256, 8192]
    - [110, 2.006]
  - - [256, 256, 1, 128, 256, 256, 256, 128]
    - [102, 0.333]
  - - [256, 256, 1, 256, 256, 256, 256, 256]
    - [101, 0.587]
  - - [256, 256, 1, 512, 256, 256, 256, 512]
    - [113, 0.938]
  - - [256, 256, 1, 1024, 256, 256, 256, 1024]
    - [113, 1.431]
  - - [256, 256, 1, 2048, 256, 256, 256, 2048]
    - [113, 1.837]
  - - [256, 256, 1, 4096, 256, 256, 256, 4096]
    - [96, 2.433]
  - - [256, 256, 1, 8192, 256, 256, 256, 8192]
    - [106, 3.357]
  - - [256, 512, 1, 128, 256, 256, 256, 128]
    - [98, 0.606]
  - - [256, 512, 1, 256, 256, 256, 256, 256]
    - [99, 1.019]
  - - [256, 512, 1, 512, 256, 256, 256, 512]
    - [110, 1.643]
  - - [256, 512, 1, 1024, 256, 256, 256, 1024]
    - [110, 2.356]
  - - [256, 512, 1, 2048, 256, 256, 256, 2048]
    - [112, 2.97]
  - - [256, 512, 1, 4096, 256, 256, 256, 4096]
    - [83, 3.651]
  - - [256, 512, 1, 8192, 256, 256, 256, 8192]
    - [81, 4.496]
  - - [256, 1024, 1, 128, 256, 256, 256, 128]
    - [49, 1.034]
  - - [256, 1024, 1, 256, 256, 256, 256, 256]
    - [94, 1.713]
  - - [256, 1024, 1, 512, 256, 256, 256, 512]
    - [92, 2.609]
  - - [256, 1024, 1, 1024, 256, 256, 256, 1024]
    - [105, 3.608]
  - - [256, 1024, 1, 2048, 256, 256, 256, 2048]
    - [105, 4.335]
  - - [256, 1024, 1, 4096, 256, 256, 256, 4096]
    - [75, 4.689]
  - - [256, 1024, 1, 8192, 256, 256, 256, 8192]
    - [88, 5.874]
  - - [256, 2048, 1, 128, 256, 256, 256, 128]
    - [46, 1.566]
  - - [256, 2048, 1, 256, 256, 256, 256, 256]
    - [78, 2.689]
  - - [256, 2048, 1, 512, 256, 256, 256, 512]
    - [79, 3.817]
  - - [256, 2048, 1, 1024, 256, 256, 256, 1024]
    - [80, 4.835]
  - - [256, 2048, 1, 2048, 256, 256, 256, 2048]
    - [83, 5.95]
  - - [256, 2048, 1, 4096, 256, 256, 256, 4096]
    - [79, 6.148]
  - - [256, 2048, 1, 8192, 256, 256, 256, 8192]
    - [63, 7.067]
  - - [256, 4096, 1, 128, 256, 256, 256, 128]
    - [35, 1.882]
  - - [256, 4096, 1, 256, 256, 256, 256, 256]
    - [39, 3.298]
  - - [256, 4096, 1, 512, 256, 256, 256, 512]
    - [36, 4.546]
  - - [256, 4096, 1, 1024, 256, 256, 256, 1024]
    - [56, 5.782]
  - - [256, 4096, 1, 2048, 256, 256, 256, 2048]
    - [52, 6.74]
  - - [256, 4096, 1, 4096, 256, 256, 256, 4096]
    - [43, 7.365]
  - - [256, 4096, 1, 8192, 256, 256, 256, 8192]
    - [45, 7.907]
  - - [256, 8192, 1, 128, 256, 256, 256, 128]
    - [1, 2.469]
  - - [256, 8192, 1, 256, 256, 256, 256, 256]
    - [8, 3.839]
  - - [256, 8192, 1, 512, 256, 256, 256, 512]
    - [24, 5.206]
  - - [256, 8192, 1, 1024, 256, 256, 256, 1024]
    - [8, 6.562]
  - - [256, 8192, 1, 2048, 256, 256, 256, 2048]
    - [74, 7.278]
  - - [256, 8192, 1, 4096, 256, 256, 256, 4096]
    - [58, 8.208]
  - - [256, 8192, 1, 8192, 256, 256, 256, 8192]
    - [18, 9.152]
  - - [512, 128, 1, 128, 512, 512, 512, 128]
    - [102, 0.331]
  - - [512, 128, 1, 256, 512, 512, 512, 256]
    - [113, 0.594]
  - - [512, 128, 1, 512, 512, 512, 512, 512]
    - [113, 0.935]
  - - [512, 128, 1, 1024, 512, 512, 512, 1024]
    - [113, 1.394]
  - - [512, 128, 1, 2048, 512, 512, 512, 2048]
    - [113, 1.805]
  - - [512, 128, 1, 4096, 512, 512, 512, 4096]
    - [97, 2.489]
  - - [512, 128, 1, 8192, 512, 512, 512, 8192]
    - [104, 3.295]
  - - [512, 256, 1, 128, 512, 512, 512, 128]
    - [99, 0.605]
  - - [512, 256, 1, 256, 512, 512, 512, 256]
    - [99, 1.032]
  - - [512, 256, 1, 512, 512, 512, 512, 512]
    - [111, 1.657]
  - - [512, 256, 1, 1024, 512, 512, 512, 1024]
    - [111, 2.367]
  - - [512, 256, 1, 2048, 512, 512, 512, 2048]
    - [110, 2.987]
  - - [512, 256, 1, 4096, 512, 512, 512, 4096]
    - [87, 3.542]
  - - [512, 256, 1, 8192, 512, 512, 512, 8192]
    - [89, 4.571]
  - - [512, 512, 1, 128, 512, 512, 512, 128]
    - [49, 1.042]
  - - [512, 512, 1, 256, 512, 512, 512, 256]
    - [93, 1.719]
  - - [512, 512, 1, 512, 512, 512, 512, 512]
    - [94, 2.596]
  - - [512, 512, 1, 1024, 512, 512, 512, 1024]
    - [108, 3.579]
  - - [512, 512, 1, 2048, 512, 512, 512, 2048]
    - [109, 4.182]
  - - [512, 512, 1, 4096, 512, 512, 512, 4096]
    - [79, 4.842]
  - - [512, 512, 1, 8192, 512, 512, 512, 8192]
    - [85, 6.214]
  - - [512, 1024, 1, 128, 512, 512, 512, 128]
    - [85, 1.64]
  - - [512, 1024, 1, 256, 512, 512, 512, 256]
    - [85, 2.616]
  - - [512, 1024, 1, 512, 512, 512, 512, 512]
    - [82, 3.865]
  - - [512, 1024, 1, 1024, 512, 512, 512, 1024]
    - [79, 4.947]
  - - [512, 1024, 1, 2048, 512, 512, 512, 2048]
    - [79, 5.891]
  - - [512, 1024, 1, 4096, 512, 512, 512, 4096]
    - [89, 6.242]
  - - [512, 1024, 1, 8192, 512, 512, 512, 8192]
    - [57, 7.268]
  - - [512, 2048, 1, 128, 512, 512, 512, 128]
    - [33, 1.985]
  - - [512, 2048, 1, 256, 512, 512, 512, 256]
    - [34, 3.233]
  - - [512, 2048, 1, 512, 512, 512, 512, 512]
    - [34, 4.674]
  - - [512, 2048, 1, 1024, 512, 512, 512, 1024]
    - [36, 5.842]
  - - [512, 2048, 1, 2048, 512, 512, 512, 2048]
    - [59, 6.7]
  - - [512, 2048, 1, 4096, 512, 512, 512, 4096]
    - [67, 7.203]
  - - [512, 2048, 1, 8192, 512, 512, 512, 8192]
    - [68, 8.109]
  - - [512, 4096, 1, 128, 512, 512, 512, 128]
    - [6, 2.507]
  - - [512, 4096, 1, 256, 512, 512, 512, 256]
    - [26, 3.985]
  - - [512, 4096, 1, 512, 512, 512, 512, 512]
    - [23, 5.434]
  - - [512, 4096, 1, 1024, 512, 512, 512, 1024]
    - [14, 6.578]
  - - [512, 4096, 1, 2048, 512, 512, 512, 2048]
    - [38, 7.206]
  - - [512, 4096, 1, 4096, 512, 512, 512, 4096]
    - [73, 8.098]
  - - [512, 4096, 1, 8192, 512, 512, 512, 8192]
    - [69, 8.677]
  - - [512, 8192, 1, 128, 512, 512, 512, 128]
    - [41, 2.325]
  - - [512, 8192, 1, 256, 512, 512, 512, 256]
    - [55, 3.549]
  - - [512, 8192, 1, 512, 512, 512, 512, 512]
    - [13, 5.019]
  - - [512, 8192, 1, 1024, 512, 512, 512, 1024]
    - [10, 6.551]
  - - [512, 8192, 1, 2048, 512, 512, 512, 2048]
    - [31, 8.018]
  - - [512, 8192, 1, 4096, 512, 512, 512, 4096]
    - [13, 8.908]
  - - [512, 8192, 1, 8192, 512, 512, 512, 8192]
    - [21, 9.394]
  - - [1024, 128, 1, 128, 1024, 1024, 1024, 128]
    - [99, 0.606]
  - - [1024, 128, 1, 256, 1024, 1024, 1024, 256]
    - [98, 1.035]
  - - [1024, 128, 1, 512, 1024, 1024, 1024, 512]
    - [110, 1.641]
  - - [1024, 128, 1, 1024, 1024, 1024, 1024, 1024]
    - [110, 2.338]
  - - [1024, 128, 1, 2048, 1024, 1024, 1024, 2048]
    - [93, 2.6]
  - - [1024, 128, 1, 4096, 1024, 1024, 1024, 4096]
    - [87, 3.717]
  - - [1024, 128, 1, 8192, 1024, 1024, 1024, 8192]
    - [81, 4.678]
  - - [1024, 256, 1, 128, 1024, 1024, 1024, 128]
    - [47, 1.043]
  - - [1024, 256, 1, 256, 1024, 1024, 1024, 256]
    - [93, 1.719]
  - - [1024, 256, 1, 512, 1024, 1024, 1024, 512]
    - [93, 2.583]
  - - [1024, 256, 1, 1024, 1024, 1024, 1024, 1024]
    - [106, 3.634]
  - - [1024, 256, 1, 2048, 1024, 1024, 1024, 2048]
    - [105, 4.05]
  - - [1024, 256, 1, 4096, 1024, 1024, 1024, 4096]
    - [77, 5.154]
  - - [1024, 256, 1, 8192, 1024, 1024, 1024, 8192]
    - [77, 6.4]
  - - [1024, 512, 1, 128, 1024, 1024, 1024, 128]
    - [90, 1.573]
  - - [1024, 512, 1, 256, 1024, 1024, 1024, 256]
    - [84, 2.687]
  - - [1024, 512, 1, 512, 1024, 1024, 1024, 512]
    - [79, 3.944]
  - - [1024, 512, 1, 1024, 1024, 1024, 1024, 1024]
    - [81, 5.042]
  - - [1024, 512, 1, 2048, 1024, 1024, 1024, 2048]
    - [79, 6.007]
  - - [1024, 512, 1, 4096, 1024, 1024, 1024, 4096]
    - [81, 6.313]
  - - [1024, 512, 1, 8192, 1024, 1024, 1024, 8192]
    - [57, 7.33]
  - - [1024, 1024, 1, 128, 1024, 1024, 1024, 128]
    - [35, 2.105]
  - - [1024, 1024, 1, 256, 1024, 1024, 1024, 256]
    - [35, 3.321]
  - - [1024, 1024, 1, 512, 1024, 1024, 1024, 512]
    - [38, 4.717]
  - - [1024, 1024, 1, 1024, 1024, 1024, 1024, 1024]
    - [52, 5.801]
  - - [1024, 1024, 1, 2048, 1024, 1024, 1024, 2048]
    - [54, 6.84]
  - - [1024, 1024, 1, 4096, 1024, 1024, 1024, 4096]
    - [53, 7.443]
  - - [1024, 1024, 1, 8192, 1024, 1024, 1024, 8192]
    - [74, 8.348]
  - - [1024, 2048, 1, 128, 1024, 1024, 1024, 128]
    - [30, 2.576]
  - - [1024, 2048, 1, 256, 1024, 1024, 1024, 256]
    - [7, 3.751]
  - - [1024, 2048, 1, 512, 1024, 1024, 1024, 512]
    - [11, 5.48]
  - - [1024, 2048, 1, 1024, 1024, 1024, 1024, 1024]
    - [23, 6.578]
  - - [1024, 2048, 1, 2048, 1024, 1024, 1024, 2048]
    - [71, 7.196]
  - - [1024, 2048, 1, 4096, 1024, 1024, 1024, 4096]
    - [18, 8.166]
  - - [1024, 2048, 1, 8192, 1024, 1024, 1024, 8192]
    - [27, 8.054]
  - - [1024, 4096, 1, 128, 1024, 1024, 1024, 128]
    - [70, 2.227]
  - - [1024, 4096, 1, 256, 1024, 1024, 1024, 256]
    - [64, 3.61]
  - - [1024, 4096, 1, 512, 1024, 1024, 1024, 512]
    - [34, 5.007]
  - - [1024, 4096, 1, 1024, 1024, 1024, 1024, 1024]
    - [18, 6.765]
  - - [1024, 4096, 1, 2048, 1024, 1024, 1024, 2048]
    - [19, 8.05]
  - - [1024, 4096, 1, 4096, 1024, 1024, 1024, 4096]
    - [28, 8.91]
  - - [1024, 4096, 1, 8192, 1024, 1024, 1024, 8192]
    - [22, 9.466]
  - - [1024, 8192, 1, 128, 1024, 1024, 1024, 128]
    - [1, 2.712]
  - - [1024, 8192, 1, 256, 1024, 1024, 1024, 256]
    - [45, 4.152]
  - - [1024, 8192, 1, 512, 1024, 1024, 1024, 512]
    - [34, 5.711]
  - - [1024, 8192, 1, 1024, 1024, 1024, 1024, 1024]
    - [10, 7.082]
  - - [1024, 8192, 1, 2048, 1024, 1024, 1024, 2048]
    - [14, 8.251]
  - - [1024, 8192, 1, 4096, 1024, 1024, 1024, 4096]
    - [2, 8.908]
  - - [1024, 8192, 1, 8192, 1024, 1024, 1024, 8192]
    - [25, 9.574]
  - - [2048, 128, 1, 128, 2048, 2048, 2048, 128]
    - [49, 1.071]
  - - [2048, 128, 1, 256, 2048, 2048, 2048, 256]
    - [93, 1.735]
  - - [2048, 128, 1, 512, 2048, 2048, 2048, 512]
    - [93, 2.602]
  - - [2048, 128, 1, 1024, 2048, 2048, 2048, 1024]
    - [97, 3.299]
  - - [2048, 128, 1, 2048, 2048, 2048, 2048, 2048]
    - [93, 4.039]
  - - [2048, 128, 1, 4096, 2048, 2048, 2048, 4096]
    - [91, 5.02]
  - - [2048, 128, 1, 8192, 2048, 2048, 2048, 8192]
    - [78, 5.837]
  - - [2048, 256, 1, 128, 2048, 2048, 2048, 128]
    - [80, 1.641]
  - - [2048, 256, 1, 256, 2048, 2048, 2048, 256]
    - [80, 2.664]
  - - [2048, 256, 1, 512, 2048, 2048, 2048, 512]
    - [85, 3.816]
  - - [2048, 256, 1, 1024, 2048, 2048, 2048, 1024]
    - [85, 4.962]
  - - [2048, 256, 1, 2048, 2048, 2048, 2048, 2048]
    - [79, 6.038]
  - - [2048, 256, 1, 4096, 2048, 2048, 2048, 4096]
    - [79, 6.59]
  - - [2048, 256, 1, 8192, 2048, 2048, 2048, 8192]
    - [65, 7.314]
  - - [2048, 512, 1, 128, 2048, 2048, 2048, 128]
    - [34, 2.189]
  - - [2048, 512, 1, 256, 2048, 2048, 2048, 256]
    - [35, 3.393]
  - - [2048, 512, 1, 512, 2048, 2048, 2048, 512]
    - [34, 4.64]
  - - [2048, 512, 1, 1024, 2048, 2048, 2048, 1024]
    - [43, 5.801]
  - - [2048, 512, 1, 2048, 2048, 2048, 2048, 2048]
    - [57, 6.783]
  - - [2048, 512, 1, 4096, 2048, 2048, 2048, 4096]
    - [55, 7.461]
  - - [2048, 512, 1, 8192, 2048, 2048, 2048, 8192]
    - [55, 8.354]
  - - [2048, 1024, 1, 128, 2048, 2048, 2048, 128]
    - [11, 2.587]
  - - [2048, 1024, 1, 256, 2048, 2048, 2048, 256]
    - [20, 3.988]
  - - [2048, 1024, 1, 512, 2048, 2048, 2048, 512]
    - [31, 5.495]
  - - [2048, 1024, 1, 1024, 2048, 2048, 2048, 1024]
    - [10, 6.664]
  - - [2048, 1024, 1, 2048, 2048, 2048, 2048, 2048]
    - [53, 7.202]
  - - [2048, 1024, 1, 4096, 2048, 2048, 2048, 4096]
    - [8, 8.241]
  - - [2048, 1024, 1, 8192, 2048, 2048, 2048, 8192]
    - [16, 9.111]
  - - [2048, 2048, 1, 128, 2048, 2048, 2048, 128]
    - [42, 2.371]
  - - [2048, 2048, 1, 256, 2048, 2048, 2048, 256]
    - [65, 3.689]
  - - [2048, 2048, 1, 512, 2048, 2048, 2048, 512]
    - [40, 5.103]
  - - [2048, 2048, 1, 1024, 2048, 2048, 2048, 1024]
    - [7, 6.809]
  - - [2048, 2048, 1, 2048, 2048, 2048, 2048, 2048]
    - [10, 8.13]
  - - [2048, 2048, 1, 4096, 2048, 2048, 2048, 4096]
    - [4, 8.99]
  - - [2048, 2048, 1, 8192, 2048, 2048, 2048, 8192]
    - [1, 9.562]
  - - [2048, 4096, 1, 128, 2048, 2048, 2048, 128]
    - [66, 2.822]
  - - [2048, 4096, 1, 256, 2048, 2048, 2048, 256]
    - [38, 4.203]
  - - [2048, 4096, 1, 512, 2048, 2048, 2048, 512]
    - [41, 5.493]
  - - [2048, 4096, 1, 1024, 2048, 2048, 2048, 1024]
    - [20, 6.995]
  - - [2048, 4096, 1, 2048, 2048, 2048, 2048, 2048]
    - [28, 8.33]
  - - [2048, 4096, 1, 4096, 2048, 2048, 2048, 4096]
    - [13, 9.182]
  - - [2048, 4096, 1, 8192, 2048, 2048, 2048, 8192]
    - [22, 8.768]
  - - [2048, 8192, 1, 128, 2048, 2048, 2048, 128]
    - [35, 3.141]
  - - [2048, 8192, 1, 256, 2048, 2048, 2048, 256]
    - [7, 4.652]
  - - [2048, 8192, 1, 512, 2048, 2048, 2048, 512]
    - [21, 6.286]
  - - [2048, 8192, 1, 1024, 2048, 2048, 2048, 1024]
    - [20, 7.609]
  - - [2048, 8192, 1, 2048, 2048, 2048, 2048, 2048]
    - [10, 8.747]
  - - [2048, 8192, 1, 4096, 2048, 2048, 2048, 4096]
    - [8, 9.174]
  - - [2048, 8192, 1, 8192, 2048, 2048, 2048, 8192]
    - [25, 9.4]
  - - [4096, 128, 1, 128, 4096, 4096, 4096, 128]
    - [84, 1.68]
  - - [4096, 128, 1, 256, 4096, 4096, 4096, 256]
    - [79, 2.551]
  - - [4096, 128, 1, 512, 4096, 4096, 4096, 512]
    - [79, 3.629]
  - - [4096, 128, 1, 1024, 4096, 4096, 4096, 1024]
    - [79, 4.721]
  - - [4096, 128, 1, 2048, 4096, 4096, 4096, 2048]
    - [79, 5.71]
  - - [4096, 128, 1, 4096, 4096, 4096, 4096, 4096]
    - [79, 6.568]
  - - [4096, 128, 1, 8192, 4096, 4096, 4096, 8192]
    - [73, 7.321]
  - - [4096, 256, 1, 128, 4096, 4096, 4096, 128]
    - [37, 2.25]
  - - [4096, 256, 1, 256, 4096, 4096, 4096, 256]
    - [39, 3.413]
  - - [4096, 256, 1, 512, 4096, 4096, 4096, 512]
    - [40, 4.698]
  - - [4096, 256, 1, 1024, 4096, 4096, 4096, 1024]
    - [40, 5.946]
  - - [4096, 256, 1, 2048, 4096, 4096, 4096, 2048]
    - [62, 6.721]
  - - [4096, 256, 1, 4096, 4096, 4096, 4096, 4096]
    - [61, 7.437]
  - - [4096, 256, 1, 8192, 4096, 4096, 4096, 8192]
    - [54, 8.393]
  - - [4096, 512, 1, 128, 4096, 4096, 4096, 128]
    - [31, 2.544]
  - - [4096, 512, 1, 256, 4096, 4096, 4096, 256]
    - [20, 3.997]
  - - [4096, 512, 1, 512, 4096, 4096, 4096, 512]
    - [11, 5.485]
  - - [4096, 512, 1, 1024, 4096, 4096, 4096, 1024]
    - [11, 6.718]
  - - [4096, 512, 1, 2048, 4096, 4096, 4096, 2048]
    - [51, 7.272]
  - - [4096, 512, 1, 4096, 4096, 4096, 4096, 4096]
    - [18, 8.299]
  - - [4096, 512, 1, 8192, 4096, 4096, 4096, 8192]
    - [1, 9.111]
  - - [4096, 1024, 1, 128, 4096, 4096, 4096, 128]
    - [38, 2.445]
  - - [4096, 1024, 1, 256, 4096, 4096, 4096, 256]
    - [73, 3.656]
  - - [4096, 1024, 1, 512, 4096, 4096, 4096, 512]
    - [7, 5.117]
  - - [4096, 1024, 1, 1024, 4096, 4096, 4096, 1024]
    - [10, 6.812]
  - - [4096, 1024, 1, 2048, 4096, 4096, 4096, 2048]
    - [1, 8.185]
  - - [4096, 1024, 1, 4096, 4096, 4096, 4096, 4096]
    - [18, 9.031]
  - - [4096, 1024, 1, 8192, 4096, 4096, 4096, 8192]
    - [30, 9.439]
  - - [4096, 2048, 1, 128, 4096, 4096, 4096, 128]
    - [66, 2.911]
  - - [4096, 2048, 1, 256, 4096, 4096, 4096, 256]
    - [40, 4.189]
  - - [4096, 2048, 1, 512, 4096, 4096, 4096, 512]
    - [34, 5.845]
  - - [4096, 2048, 1, 1024, 4096, 4096, 4096, 1024]
    - [4, 7.31]
  - - [4096, 2048, 1, 2048, 4096, 4096, 4096, 2048]
    - [11, 8.488]
  - - [4096, 2048, 1, 4096, 4096, 4096, 4096, 4096]
    - [11, 9.14]
  - - [4096, 2048, 1, 8192, 4096, 4096, 4096, 8192]
    - [18, 9.613]
  - - [4096, 4096, 1, 128, 4096, 4096, 4096, 128]
    - [38, 3.2]
  - - [4096, 4096, 1, 256, 4096, 4096, 4096, 256]
    - [18, 4.466]
  - - [4096, 4096, 1, 512, 4096, 4096, 4096, 512]
    - [22, 6.213]
  - - [4096, 4096, 1, 1024, 4096, 4096, 4096, 1024]
    - [25, 7.679]
  - - [4096, 4096, 1, 2048, 4096, 4096, 4096, 2048]
    - [26, 8.732]
  - - [4096, 4096, 1, 4096, 4096, 4096, 4096, 4096]
    - [26, 9.332]
  - - [4096, 4096, 1, 8192, 4096, 4096, 4096, 8192]
    - [2, 9.456]
  - - [4096, 8192, 1, 128, 4096, 4096, 4096, 128]
    - [29, 3.59]
  - - [4096, 8192, 1, 256, 4096, 4096, 4096, 256]
    - [9, 5.075]
  - - [4096, 8192, 1, 512, 4096, 4096, 4096, 512]
    - [30, 6.574]
  - - [4096, 8192, 1, 1024, 4096, 4096, 4096, 1024]
    - [29, 7.887]
  - - [4096, 8192, 1, 2048, 4096, 4096, 4096, 2048]
    - [24, 8.918]
  - - [4096, 8192, 1, 4096, 4096, 4096, 4096, 4096]
    - [11, 9.295]
  - - [4096, 8192, 1, 8192, 4096, 4096, 4096, 8192]
    - [14, 9.414]
  - - [8192, 128, 1, 128, 8192, 8192, 8192, 128]
    - [44, 2.27]
  - - [8192, 128, 1, 256, 8192, 8192, 8192, 256]
    - [37, 3.152]
  - - [8192, 128, 1, 512, 8192, 8192, 8192, 512]
    - [62, 4.415]
  - - [8192, 128, 1, 1024, 8192, 8192, 8192, 1024]
    - [34, 5.785]
  - - [8192, 128, 1, 2048, 8192, 8192, 8192, 2048]
    - [71, 6.673]
  - - [8192, 128, 1, 4096, 8192, 8192, 8192, 4096]
    - [65, 7.436]
  - - [8192, 128, 1, 8192, 8192, 8192, 8192, 8192]
    - [68, 8.36]
  - - [8192, 256, 1, 128, 8192, 8192, 8192, 128]
    - [11, 2.591]
  - - [8192, 256, 1, 256, 8192, 8192, 8192, 256]
    - [31, 3.984]
  - - [8192, 256, 1, 512, 8192, 8192, 8192, 512]
    - [17, 5.39]
  - - [8192, 256, 1, 1024, 8192, 8192, 8192, 1024]
    - [11, 6.665]
  - - [8192, 256, 1, 2048, 8192, 8192, 8192, 2048]
    - [54, 7.289]
  - - [8192, 256, 1, 4096, 8192, 8192, 8192, 4096]
    - [16, 8.306]
  - - [8192, 256, 1, 8192, 8192, 8192, 8192, 8192]
    - [28, 9.083]
  - - [8192, 512, 1, 128, 8192, 8192, 8192, 128]
    - [34, 2.482]
  - - [8192, 512, 1, 256, 8192, 8192, 8192, 256]
    - [72, 3.666]
  - - [8192, 512, 1, 512, 8192, 8192, 8192, 512]
    - [36, 5.145]
  - - [8192, 512, 1, 1024, 8192, 8192, 8192, 1024]
    - [22, 6.844]
  - - [8192, 512, 1, 2048, 8192, 8192, 8192, 2048]
    - [10, 8.193]
  - - [8192, 512, 1, 4096, 8192, 8192, 8192, 4096]
    - [2, 9.007]
  - - [8192, 512, 1, 8192, 8192, 8192, 8192, 8192]
    - [29, 9.436]
  - - [8192, 1024, 1, 128, 8192, 8192, 8192, 128]
    - [64, 2.891]
  - - [8192, 1024, 1, 256, 8192, 8192, 8192, 256]
    - [45, 4.153]
  - - [8192, 1024, 1, 512, 8192, 8192, 8192, 512]
    - [38, 5.738]
  - - [8192, 1024, 1, 1024, 8192, 8192, 8192, 1024]
    - [1, 7.332]
  - - [8192, 1024, 1, 2048, 8192, 8192, 8192, 2048]
    - [10, 8.509]
  - - [8192, 1024, 1, 4096, 8192, 8192, 8192, 4096]
    - [4, 8.932]
  - - [8192, 1024, 1, 8192, 8192, 8192, 8192, 8192]
    - [31, 9.482]
  - - [8192, 2048, 1, 128, 8192, 8192, 8192, 128]
    - [35, 3.254]
  - - [8192, 2048, 1, 256, 8192, 8192, 8192, 256]
    - [4, 4.684]
  - - [8192, 2048, 1, 512, 8192, 8192, 8192, 512]
    - [10, 6.395]
  - - [8192, 2048, 1, 1024, 8192, 8192, 8192, 1024]
    - [11, 7.795]
  - - [8192, 2048, 1, 2048, 8192, 8192, 8192, 2048]
    - [3, 8.792]
  - - [8192, 2048, 1, 4096, 8192, 8192, 8192, 4096]
    - [21, 9.349]
  - - [8192, 2048, 1, 8192, 8192, 8192, 8192, 8192]
    - [2, 9.398]
  - - [8192, 4096, 1, 128, 8192, 8192, 8192, 128]
    - [5, 3.593]
  - - [8192, 4096, 1, 256, 8192, 8192, 8192, 256]
    - [3, 5.063]
  - - [8192, 4096, 1, 512, 8192, 8192, 8192, 512]
    - [0, 6.735]
  - - [8192, 4096, 1, 1024, 8192, 8192, 8192, 1024]
    - [15, 7.994]
  - - [8192, 4096, 1, 2048, 8192, 8192, 8192, 2048]
    - [16, 8.651]
  - - [8192, 4096, 1, 4096, 8192, 8192, 8192, 4096]
    - [7, 9.35]
  - - [8192, 4096, 1, 8192, 8192, 8192, 8192, 8192]
    - [11, 9.532]
  - - [8192, 8192, 1, 128, 8192, 8192, 8192, 128]
    - [5, 3.778]
  - - [8192, 8192, 1, 256, 8192, 8192, 8192, 256]
    - [21, 5.111]
  - - [8192, 8192, 1, 512, 8192, 8192, 8192, 512]
    - [12, 6.736]
  - - [8192, 8192, 1, 1024, 8192, 8192, 8192, 1024]
    - [14, 8.032]
  - - [8192, 8192, 1, 2048, 8192, 8192, 8192, 2048]
    - [23, 8.826]
  - - [8192, 8192, 1, 4096, 8192, 8192, 8192, 4096]
    - [17, 9.277]
  - - [8192, 8192, 1, 8192, 8192, 8192, 8192, 8192]
    - [14, 9.05]
  - - [1, 1, 1, 32, 1, 1, 1, 32]
    - [118, 0.0]
- null
- null
- ExperimentalStreamK
- GridBased
