library/src/amd_detail/rocblaslt/src/Tensile/Logic/asm_full/aquavanjaram/gfx942_38cu/StreamK/aquavanjaram942_Cijk_Ailk_Bjlk_HSS_BH_UserArgs.yaml
- {MinimumRequiredVersion: 4.33.0}
- aquavanjaram942
- {Architecture: gfx942, CUCount: 38}
- [Device 0049, Device 0050]
    SolutionIndex: 0
    SolutionNameMin: Cijk_Ailk_Bjlk_HSS_BH_UserArgs_MT256x256x32_MI16x16x1_SN_LDSB1_CLR1_GSU0_GSUC0_GSUWGMRR0_K1_LBSPPA2048_LBSPPB2048_LPA0_LPB16_MIWT8_8_PLR1_SU32_SUM0_SUS256_VWA4_VWB1_WGM1_WGMXCC1_WGMXCCGn1
    SolutionIndex: 1
    SolutionNameMin: Cijk_Ailk_Bjlk_HSS_BH_UserArgs_MT256x256x32_MI16x16x1_SN_LDSB1_CLR1_GSU0_GSUC0_GSUWGMRR0_K1_LBSPPA2048_LBSPPB2048_LPA32_LPB32_MIWT8_8_PLR1_SU32_SUM0_SUS256_VWA2_VWB2_WGM1_WGMXCC1_WGMXCCGn1
    SolutionIndex: 2
    SolutionNameMin: Cijk_Ailk_Bjlk_HSS_BH_UserArgs_MT256x256x32_MI16x16x1_SN_LDSB1_CLR1_GSU0_GSUC0_GSUWGMRR0_K1_LBSPPA2048_LBSPPB2048_LPA0_LPB32_MIWT8_8_PLR1_SU32_SUM0_SUS256_VWA4_VWB2_WGM1_WGMXCC1_WGMXCCGn1
    SolutionIndex: 3
    SolutionNameMin: Cijk_Ailk_Bjlk_HSS_BH_UserArgs_MT256x256x32_MI16x16x1_SN_LDSB0_CLR1_GSU0_GSUC0_GSUWGMRR0_K1_LBSPPA2048_LBSPPB2048_LPA0_LPB0_MIWT8_8_PLR1_SU32_SUM0_SUS256_VWA4_VWB4_WGM1_WGMXCC1_WGMXCCGn1
    SolutionIndex: 4
    SolutionNameMin: Cijk_Ailk_Bjlk_HSS_BH_UserArgs_MT256x256x32_MI16x16x1_SN_LDSB1_CLR1_GSU0_GSUC0_GSUWGMRR0_K1_LBSPPA2048_LBSPPB2048_LPA32_LPB0_MIWT8_8_PLR1_SU32_SUM0_SUS256_VWA2_VWB8_WGM1_WGMXCC1_WGMXCCGn1
    SolutionIndex: 5
    SolutionNameMin: Cijk_Ailk_Bjlk_HSS_BH_UserArgs_MT256x256x32_MI16x16x1_SN_LDSB0_CLR1_GSU0_GSUC0_GSUWGMRR0_K1_LBSPPA2048_LBSPPB2048_LPA0_LPB0_MIWT8_8_PLR1_SU32_SUM0_SUS256_VWA4_VWB8_WGM1_WGMXCC1_WGMXCCGn1
    SolutionIndex: 6
    SolutionNameMin: Cijk_Ailk_Bjlk_HSS_BH_UserArgs_MT256x256x32_MI16x16x1_SN_LDSB1_CLR1_GSU0_GSUC0_GSUWGMRR0_K1_LBSPPA2048_LBSPPB2048_LPA0_LPB16_MIWT8_8_PLR1_SU32_SUM0_SUS256_VWA4_VWB1_WGM4_WGMXCC1_WGMXCCGn1
    SolutionIndex: 7
    SolutionNameMin: Cijk_Ailk_Bjlk_HSS_BH_UserArgs_MT256x256x32_MI16x16x1_SN_LDSB1_CLR1_GSU0_GSUC0_GSUWGMRR0_K1_LBSPPA2048_LBSPPB2048_LPA0_LPB32_MIWT8_8_PLR1_SU32_SUM0_SUS256_VWA4_VWB2_WGM4_WGMXCC1_WGMXCCGn1
    SolutionIndex: 8
    SolutionNameMin: Cijk_Ailk_Bjlk_HSS_BH_UserArgs_MT256x256x32_MI16x16x1_SN_LDSB0_CLR1_GSU0_GSUC0_GSUWGMRR0_K1_LBSPPA2048_LBSPPB2048_LPA0_LPB0_MIWT8_8_PLR1_SU32_SUM0_SUS256_VWA4_VWB4_WGM4_WGMXCC1_WGMXCCGn1
    SolutionIndex: 9
    SolutionNameMin: Cijk_Ailk_Bjlk_HSS_BH_UserArgs_MT256x256x32_MI16x16x1_SN_LDSB1_CLR1_GSU0_GSUC0_GSUWGMRR0_K1_LBSPPA2048_LBSPPB2048_LPA32_LPB0_MIWT8_8_PLR1_SU32_SUM0_SUS256_VWA2_VWB8_WGM4_WGMXCC1_WGMXCCGn1
    SolutionIndex: 10
    SolutionNameMin: Cijk_Ailk_Bjlk_HSS_BH_UserArgs_MT256x256x32_MI16x16x1_SN_LDSB0_CLR1_GSU0_GSUC0_GSUWGMRR0_K1_LBSPPA2048_LBSPPB2048_LPA0_LPB0_MIWT8_8_PLR1_SU32_SUM0_SUS256_VWA4_VWB8_WGM4_WGMXCC1_WGMXCCGn1
    SolutionIndex: 11
    SolutionNameMin: Cijk_Ailk_Bjlk_HSS_BH_UserArgs_MT256x256x32_MI16x16x1_SN_LDSB1_CLR1_GSU0_GSUC0_GSUWGMRR0_K1_LBSPPA2048_LBSPPB2048_LPA0_LPB16_MIWT8_8_PLR1_SU32_SUM0_SUS256_VWA4_VWB1_WGM8_WGMXCC1_WGMXCCGn1
    SolutionIndex: 12
    SolutionNameMin: Cijk_Ailk_Bjlk_HSS_BH_UserArgs_MT256x256x32_MI16x16x1_SN_LDSB1_CLR1_GSU0_GSUC0_GSUWGMRR0_K1_LBSPPA2048_LBSPPB2048_LPA0_LPB32_MIWT8_8_PLR1_SU32_SUM0_SUS256_VWA4_VWB2_WGM8_WGMXCC1_WGMXCCGn1
    SolutionIndex: 13
    SolutionNameMin: Cijk_Ailk_Bjlk_HSS_BH_UserArgs_MT256x256x32_MI16x16x1_SN_LDSB0_CLR1_GSU0_GSUC0_GSUWGMRR0_K1_LBSPPA2048_LBSPPB2048_LPA0_LPB0_MIWT8_8_PLR1_SU32_SUM0_SUS256_VWA4_VWB4_WGM8_WGMXCC1_WGMXCCGn1
    SolutionIndex: 14
    SolutionNameMin: Cijk_Ailk_Bjlk_HSS_BH_UserArgs_MT256x256x32_MI16x16x1_SN_LDSB1_CLR1_GSU0_GSUC0_GSUWGMRR0_K1_LBSPPA2048_LBSPPB2048_LPA32_LPB0_MIWT8_8_PLR1_SU32_SUM0_SUS256_VWA2_VWB8_WGM8_WGMXCC1_WGMXCCGn1
    SolutionIndex: 15
    SolutionNameMin: Cijk_Ailk_Bjlk_HSS_BH_UserArgs_MT256x256x32_MI16x16x1_SN_LDSB0_CLR1_GSU0_GSUC0_GSUWGMRR0_K1_LBSPPA2048_LBSPPB2048_LPA0_LPB0_MIWT8_8_PLR1_SU32_SUM0_SUS256_VWA4_VWB8_WGM8_WGMXCC1_WGMXCCGn1
    SolutionIndex: 16
    SolutionNameMin: Cijk_Ailk_Bjlk_HSS_BH_UserArgs_MT256x256x32_MI16x16x1_SN_LDSB0_CLR1_GSU0_GSUC0_GSUWGMRR0_K1_LBSPPA2048_LBSPPB2048_LPA0_LPB0_MIWT8_8_PLR1_SU32_SUM0_SUS256_VWA8_VWB8_WGM8_WGMXCC1_WGMXCCGn1
    SolutionIndex: 17
    SolutionNameMin: Cijk_Ailk_Bjlk_HSS_BH_UserArgs_MT128x256x32_MI16x16x1_SN_LDSB1_CLR1_GSU0_GSUC0_GSUWGMRR0_K1_LBSPPA1024_LBSPPB2048_LPA0_LPB32_MIWT4_8_PLR1_SU32_SUM0_SUS256_VWA4_VWB2_WGM1_WGMXCC1_WGMXCCGn1
    SolutionIndex: 18
    SolutionNameMin: Cijk_Ailk_Bjlk_HSS_BH_UserArgs_MT128x256x32_MI16x16x1_SN_LDSB1_CLR1_GSU0_GSUC0_GSUWGMRR0_K1_LBSPPA1024_LBSPPB2048_LPA32_LPB0_MIWT4_8_PLR1_SU32_SUM0_SUS256_VWA2_VWB8_WGM1_WGMXCC1_WGMXCCGn1
    SolutionIndex: 19
    SolutionNameMin: Cijk_Ailk_Bjlk_HSS_BH_UserArgs_MT128x256x32_MI16x16x1_SN_LDSB1_CLR1_GSU0_GSUC0_GSUWGMRR0_K1_LBSPPA1024_LBSPPB2048_LPA0_LPB0_MIWT4_8_PLR1_SU32_SUM0_SUS256_VWA4_VWB8_WGM1_WGMXCC1_WGMXCCGn1
    SolutionIndex: 20
    SolutionNameMin: Cijk_Ailk_Bjlk_HSS_BH_UserArgs_MT128x256x32_MI16x16x1_SN_LDSB1_CLR1_GSU0_GSUC0_GSUWGMRR0_K1_LBSPPA1024_LBSPPB2048_LPA0_LPB32_MIWT4_8_PLR1_SU32_SUM0_SUS256_VWA4_VWB2_WGM4_WGMXCC1_WGMXCCGn1
    SolutionIndex: 21
    SolutionNameMin: Cijk_Ailk_Bjlk_HSS_BH_UserArgs_MT128x256x32_MI16x16x1_SN_LDSB1_CLR1_GSU0_GSUC0_GSUWGMRR0_K1_LBSPPA1024_LBSPPB2048_LPA0_LPB0_MIWT4_8_PLR1_SU32_SUM0_SUS256_VWA4_VWB4_WGM4_WGMXCC1_WGMXCCGn1
    SolutionIndex: 22
    SolutionNameMin: Cijk_Ailk_Bjlk_HSS_BH_UserArgs_MT128x256x32_MI16x16x1_SN_LDSB1_CLR1_GSU0_GSUC0_GSUWGMRR0_K1_LBSPPA1024_LBSPPB2048_LPA0_LPB0_MIWT4_8_PLR1_SU32_SUM0_SUS256_VWA4_VWB8_WGM4_WGMXCC1_WGMXCCGn1
    SolutionIndex: 23
    SolutionNameMin: Cijk_Ailk_Bjlk_HSS_BH_UserArgs_MT128x256x32_MI16x16x1_SN_LDSB1_CLR1_GSU0_GSUC0_GSUWGMRR0_K1_LBSPPA1024_LBSPPB2048_LPA0_LPB32_MIWT4_8_PLR1_SU32_SUM0_SUS256_VWA4_VWB2_WGM8_WGMXCC1_WGMXCCGn1
    SolutionIndex: 24
    SolutionNameMin: Cijk_Ailk_Bjlk_HSS_BH_UserArgs_MT128x256x32_MI16x16x1_SN_LDSB1_CLR1_GSU0_GSUC0_GSUWGMRR0_K1_LBSPPA1024_LBSPPB2048_LPA0_LPB0_MIWT4_8_PLR1_SU32_SUM0_SUS256_VWA4_VWB4_WGM8_WGMXCC1_WGMXCCGn1
    SolutionIndex: 25
    SolutionNameMin: Cijk_Ailk_Bjlk_HSS_BH_UserArgs_MT128x256x32_MI16x16x1_SN_LDSB1_CLR1_GSU0_GSUC0_GSUWGMRR0_K1_LBSPPA1024_LBSPPB2048_LPA0_LPB0_MIWT4_8_PLR1_SU32_SUM0_SUS256_VWA4_VWB8_WGM8_WGMXCC1_WGMXCCGn1
    SolutionIndex: 26
    SolutionNameMin: Cijk_Ailk_Bjlk_HSS_BH_UserArgs_MT256x128x32_MI16x16x1_SN_LDSB1_CLR1_GSU0_GSUC0_GSUWGMRR0_K1_LBSPPA2048_LBSPPB1024_LPA0_LPB16_MIWT8_4_PLR1_SU32_SUM0_SUS256_VWA4_VWB1_WGM1_WGMXCC1_WGMXCCGn1
    SolutionIndex: 27
    SolutionNameMin: Cijk_Ailk_Bjlk_HSS_BH_UserArgs_MT256x128x32_MI16x16x1_SN_LDSB1_CLR1_GSU0_GSUC0_GSUWGMRR0_K1_LBSPPA2048_LBSPPB1024_LPA0_LPB32_MIWT8_4_PLR1_SU32_SUM0_SUS256_VWA4_VWB2_WGM1_WGMXCC1_WGMXCCGn1
    SolutionIndex: 28
    SolutionNameMin: Cijk_Ailk_Bjlk_HSS_BH_UserArgs_MT256x128x32_MI16x16x1_SN_LDSB1_CLR1_GSU0_GSUC0_GSUWGMRR0_K1_LBSPPA2048_LBSPPB1024_LPA32_LPB0_MIWT8_4_PLR1_SU32_SUM0_SUS256_VWA2_VWB4_WGM1_WGMXCC1_WGMXCCGn1
    SolutionIndex: 29
    SolutionNameMin: Cijk_Ailk_Bjlk_HSS_BH_UserArgs_MT256x128x32_MI16x16x1_SN_LDSB1_CLR1_GSU0_GSUC0_GSUWGMRR0_K1_LBSPPA2048_LBSPPB1024_LPA0_LPB0_MIWT8_4_PLR1_SU32_SUM0_SUS256_VWA4_VWB4_WGM1_WGMXCC1_WGMXCCGn1
    SolutionIndex: 30
    SolutionNameMin: Cijk_Ailk_Bjlk_HSS_BH_UserArgs_MT256x128x32_MI16x16x1_SN_LDSB1_CLR1_GSU0_GSUC0_GSUWGMRR0_K1_LBSPPA2048_LBSPPB1024_LPA0_LPB16_MIWT8_4_PLR1_SU32_SUM0_SUS256_VWA4_VWB1_WGM4_WGMXCC1_WGMXCCGn1
    SolutionIndex: 31
    SolutionNameMin: Cijk_Ailk_Bjlk_HSS_BH_UserArgs_MT256x128x32_MI16x16x1_SN_LDSB1_CLR1_GSU0_GSUC0_GSUWGMRR0_K1_LBSPPA2048_LBSPPB1024_LPA0_LPB32_MIWT8_4_PLR1_SU32_SUM0_SUS256_VWA4_VWB2_WGM4_WGMXCC1_WGMXCCGn1
    SolutionIndex: 32
    SolutionNameMin: Cijk_Ailk_Bjlk_HSS_BH_UserArgs_MT256x128x32_MI16x16x1_SN_LDSB1_CLR1_GSU0_GSUC0_GSUWGMRR0_K1_LBSPPA2048_LBSPPB1024_LPA0_LPB0_MIWT8_4_PLR1_SU32_SUM0_SUS256_VWA4_VWB4_WGM4_WGMXCC1_WGMXCCGn1
    SolutionIndex: 33
    SolutionNameMin: Cijk_Ailk_Bjlk_HSS_BH_UserArgs_MT256x128x32_MI16x16x1_SN_LDSB1_CLR1_GSU0_GSUC0_GSUWGMRR0_K1_LBSPPA2048_LBSPPB1024_LPA0_LPB16_MIWT8_4_PLR1_SU32_SUM0_SUS256_VWA4_VWB1_WGM8_WGMXCC1_WGMXCCGn1
    SolutionIndex: 34
    SolutionNameMin: Cijk_Ailk_Bjlk_HSS_BH_UserArgs_MT256x128x32_MI16x16x1_SN_LDSB1_CLR1_GSU0_GSUC0_GSUWGMRR0_K1_LBSPPA2048_LBSPPB1024_LPA0_LPB32_MIWT8_4_PLR1_SU32_SUM0_SUS256_VWA4_VWB2_WGM8_WGMXCC1_WGMXCCGn1
    SolutionIndex: 35
    SolutionNameMin: Cijk_Ailk_Bjlk_HSS_BH_UserArgs_MT256x128x32_MI16x16x1_SN_LDSB1_CLR1_GSU0_GSUC0_GSUWGMRR0_K1_LBSPPA2048_LBSPPB1024_LPA0_LPB0_MIWT8_4_PLR1_SU32_SUM0_SUS256_VWA4_VWB4_WGM8_WGMXCC1_WGMXCCGn1
    SolutionIndex: 36
    SolutionNameMin: Cijk_Ailk_Bjlk_HSS_BH_UserArgs_MT128x128x32_MI16x16x1_SN_LDSB1_CLR1_GSU0_GSUC0_GSUWGMRR0_K1_LBSPPA1024_LBSPPB1024_LPA32_LPB16_MIWT4_4_PLR1_SU32_SUM0_SUS256_VWA2_VWB1_WGM1_WGMXCC1_WGMXCCGn1
    SolutionIndex: 37
    SolutionNameMin: Cijk_Ailk_Bjlk_HSS_BH_UserArgs_MT128x128x32_MI16x16x1_SN_LDSB1_CLR1_GSU0_GSUC0_GSUWGMRR0_K1_LBSPPA1024_LBSPPB1024_LPA0_LPB16_MIWT4_4_PLR1_SU32_SUM0_SUS256_VWA4_VWB1_WGM1_WGMXCC1_WGMXCCGn1
    SolutionIndex: 38
    SolutionNameMin: Cijk_Ailk_Bjlk_HSS_BH_UserArgs_MT128x128x32_MI16x16x1_SN_LDSB1_CLR1_GSU0_GSUC0_GSUWGMRR0_K1_LBSPPA1024_LBSPPB1024_LPA0_LPB32_MIWT4_4_PLR1_SU32_SUM0_SUS256_VWA4_VWB2_WGM1_WGMXCC1_WGMXCCGn1
    SolutionIndex: 39
    SolutionNameMin: Cijk_Ailk_Bjlk_HSS_BH_UserArgs_MT128x128x32_MI16x16x1_SN_LDSB1_CLR1_GSU0_GSUC0_GSUWGMRR0_K1_LBSPPA1024_LBSPPB1024_LPA32_LPB32_MIWT4_4_PLR1_SU32_SUM0_SUS256_VWA2_VWB2_WGM4_WGMXCC1_WGMXCCGn1
    SolutionIndex: 40
    SolutionNameMin: Cijk_Ailk_Bjlk_HSS_BH_UserArgs_MT128x128x32_MI16x16x1_SN_LDSB1_CLR1_GSU0_GSUC0_GSUWGMRR0_K1_LBSPPA1024_LBSPPB1024_LPA0_LPB32_MIWT4_4_PLR1_SU32_SUM0_SUS256_VWA4_VWB2_WGM4_WGMXCC1_WGMXCCGn1
    SolutionIndex: 41
    SolutionNameMin: Cijk_Ailk_Bjlk_HSS_BH_UserArgs_MT128x128x32_MI16x16x1_SN_LDSB1_CLR1_GSU0_GSUC0_GSUWGMRR0_K1_LBSPPA1024_LBSPPB1024_LPA32_LPB0_MIWT4_4_PLR1_SU32_SUM0_SUS256_VWA2_VWB4_WGM4_WGMXCC1_WGMXCCGn1
    SolutionIndex: 42
    SolutionNameMin: Cijk_Ailk_Bjlk_HSS_BH_UserArgs_MT128x128x32_MI16x16x1_SN_LDSB0_CLR1_GSU0_GSUC0_GSUWGMRR0_K1_LBSPPA1024_LBSPPB1024_LPA0_LPB0_MIWT4_4_PLR1_SU32_SUM0_SUS256_VWA4_VWB4_WGM4_WGMXCC1_WGMXCCGn1
    SolutionIndex: 43
    SolutionNameMin: Cijk_Ailk_Bjlk_HSS_BH_UserArgs_MT128x128x32_MI16x16x1_SN_LDSB1_CLR1_GSU0_GSUC0_GSUWGMRR0_K1_LBSPPA1024_LBSPPB1024_LPA0_LPB16_MIWT4_4_PLR1_SU32_SUM0_SUS256_VWA4_VWB1_WGM8_WGMXCC1_WGMXCCGn1
    SolutionIndex: 44
    SolutionNameMin: Cijk_Ailk_Bjlk_HSS_BH_UserArgs_MT128x128x32_MI16x16x1_SN_LDSB1_CLR1_GSU0_GSUC0_GSUWGMRR0_K1_LBSPPA1024_LBSPPB1024_LPA0_LPB32_MIWT4_4_PLR1_SU32_SUM0_SUS256_VWA4_VWB2_WGM8_WGMXCC1_WGMXCCGn1
    SolutionIndex: 45
    SolutionNameMin: Cijk_Ailk_Bjlk_HSS_BH_UserArgs_MT64x128x32_MI16x16x1_SN_LDSB0_CLR1_GSU0_GSUC0_GSUWGMRR0_K1_LBSPPA512_LBSPPB1024_LPA32_LPB32_MIWT2_4_PLR1_SU32_SUM0_SUS256_VWA2_VWB2_WGM1_WGMXCC1_WGMXCCGn1
    SolutionIndex: 46
    SolutionNameMin: Cijk_Ailk_Bjlk_HSS_BH_UserArgs_MT64x128x32_MI16x16x1_SN_LDSB0_CLR1_GSU0_GSUC0_GSUWGMRR0_K1_LBSPPA512_LBSPPB1024_LPA32_LPB0_MIWT2_4_PLR1_SU32_SUM0_SUS256_VWA2_VWB4_WGM1_WGMXCC1_WGMXCCGn1
    SolutionIndex: 47
    SolutionNameMin: Cijk_Ailk_Bjlk_HSS_BH_UserArgs_MT64x128x32_MI16x16x1_SN_LDSB0_CLR1_GSU0_GSUC0_GSUWGMRR0_K1_LBSPPA512_LBSPPB1024_LPA16_LPB32_MIWT2_4_PLR1_SU32_SUM0_SUS256_VWA1_VWB2_WGM8_WGMXCC1_WGMXCCGn1
    SolutionIndex: 48
    SolutionNameMin: Cijk_Ailk_Bjlk_HSS_BH_UserArgs_MT128x64x32_MI16x16x1_SN_LDSB0_CLR1_GSU0_GSUC0_GSUWGMRR0_K1_LBSPPA1024_LBSPPB512_LPA0_LPB32_MIWT4_2_PLR1_SU32_SUM0_SUS256_VWA4_VWB2_WGM1_WGMXCC1_WGMXCCGn1
    SolutionIndex: 49
    SolutionNameMin: Cijk_Ailk_Bjlk_HSS_BH_UserArgs_MT64x64x32_MI16x16x1_SN_LDSB0_CLR1_GSU0_GSUC0_GSUWGMRR0_K1_LBSPPA512_LBSPPB512_LPA32_LPB16_MIWT2_2_PLR1_SU32_SUM0_SUS256_VWA2_VWB1_WGM1_WGMXCC1_WGMXCCGn1
    SolutionIndex: 50
    SolutionNameMin: Cijk_Ailk_Bjlk_HSS_BH_UserArgs_MT32x64x32_MI16x16x1_SN_LDSB0_CLR0_GSU0_GSUC0_GSUWGMRR0_K1_LBSPPA256_LBSPPB512_LPA16_LPB32_MIWT1_2_PLR0_SU32_SUM0_SUS256_VWA1_VWB2_WGM1_WGMXCC1_WGMXCCGn1
    SolutionIndex: 51
    SolutionNameMin: Cijk_Ailk_Bjlk_HSS_BH_UserArgs_MT32x32x32_MI16x16x1_SN_LDSB0_CLR1_GSU0_GSUC0_GSUWGMRR0_K1_LBSPPA256_LBSPPB256_LPA16_LPB16_MIWT1_1_PLR1_SU32_SUM0_SUS256_VWA1_VWB1_WGM4_WGMXCC1_WGMXCCGn1
    SolutionIndex: 52
    SolutionNameMin: Cijk_Ailk_Bjlk_HSS_BH_UserArgs_MT32x32x32_MI16x16x1_SN_LDSB0_CLR0_GSU0_GSUC0_GSUWGMRR0_K1_LBSPPA256_LBSPPB256_LPA16_LPB16_MIWT1_1_PLR0_SU32_SUM0_SUS256_VWA1_VWB1_WGM8_WGMXCC1_WGMXCCGn1
    SolutionIndex: 53
    SolutionNameMin: Cijk_Ailk_Bjlk_HSS_BH_UserArgs_MT256x256x64_MI16x16x1_SN_LDSB1_CLR1_GSU0_GSUC0_GSUWGMRR0_K1_LBSPPA2048_LBSPPB2048_LPA0_LPB0_MIWT8_8_PLR1_SU32_SUM0_SUS256_VWA4_VWB4_WGM1_WGMXCC1_WGMXCCGn1
    SolutionIndex: 54
    SolutionNameMin: Cijk_Ailk_Bjlk_HSS_BH_UserArgs_MT256x256x64_MI16x16x1_SN_LDSB1_CLR1_GSU0_GSUC0_GSUWGMRR0_K1_LBSPPA2048_LBSPPB2048_LPA0_LPB0_MIWT8_8_PLR2_SU32_SUM0_SUS256_VWA4_VWB4_WGM1_WGMXCC1_WGMXCCGn1
    SolutionIndex: 55
    SolutionNameMin: Cijk_Ailk_Bjlk_HSS_BH_UserArgs_MT256x256x64_MI16x16x1_SN_LDSB1_CLR1_GSU0_GSUC0_GSUWGMRR0_K1_LBSPPA2048_LBSPPB2048_LPA0_LPB0_MIWT8_8_PLR2_SU32_SUM0_SUS256_VWA4_VWB8_WGM1_WGMXCC1_WGMXCCGn1
    SolutionIndex: 56
    SolutionNameMin: Cijk_Ailk_Bjlk_HSS_BH_UserArgs_MT256x256x64_MI16x16x1_SN_LDSB1_CLR1_GSU0_GSUC0_GSUWGMRR0_K1_LBSPPA2048_LBSPPB2048_LPA0_LPB0_MIWT8_8_PLR1_SU32_SUM0_SUS256_VWA4_VWB4_WGM4_WGMXCC1_WGMXCCGn1
    SolutionIndex: 57
    SolutionNameMin: Cijk_Ailk_Bjlk_HSS_BH_UserArgs_MT256x256x64_MI16x16x1_SN_LDSB1_CLR1_GSU0_GSUC0_GSUWGMRR0_K1_LBSPPA2048_LBSPPB2048_LPA0_LPB0_MIWT8_8_PLR2_SU32_SUM0_SUS256_VWA4_VWB4_WGM4_WGMXCC1_WGMXCCGn1
    SolutionIndex: 58
    SolutionNameMin: Cijk_Ailk_Bjlk_HSS_BH_UserArgs_MT256x256x64_MI16x16x1_SN_LDSB1_CLR1_GSU0_GSUC0_GSUWGMRR0_K1_LBSPPA2048_LBSPPB2048_LPA0_LPB0_MIWT8_8_PLR2_SU32_SUM0_SUS256_VWA4_VWB8_WGM4_WGMXCC1_WGMXCCGn1
    SolutionIndex: 59
    SolutionNameMin: Cijk_Ailk_Bjlk_HSS_BH_UserArgs_MT256x256x64_MI16x16x1_SN_LDSB1_CLR1_GSU0_GSUC0_GSUWGMRR0_K1_LBSPPA2048_LBSPPB2048_LPA0_LPB0_MIWT8_8_PLR1_SU32_SUM0_SUS256_VWA4_VWB4_WGM8_WGMXCC1_WGMXCCGn1
    SolutionIndex: 60
    SolutionNameMin: Cijk_Ailk_Bjlk_HSS_BH_UserArgs_MT256x256x64_MI16x16x1_SN_LDSB1_CLR1_GSU0_GSUC0_GSUWGMRR0_K1_LBSPPA2048_LBSPPB2048_LPA0_LPB0_MIWT8_8_PLR2_SU32_SUM0_SUS256_VWA4_VWB4_WGM8_WGMXCC1_WGMXCCGn1
    SolutionIndex: 61
    SolutionNameMin: Cijk_Ailk_Bjlk_HSS_BH_UserArgs_MT128x256x64_MI16x16x1_SN_LDSB1_CLR1_GSU0_GSUC0_GSUWGMRR0_K1_LBSPPA1024_LBSPPB2048_LPA0_LPB32_MIWT4_8_PLR1_SU32_SUM0_SUS256_VWA4_VWB2_WGM1_WGMXCC1_WGMXCCGn1
    SolutionIndex: 62
    SolutionNameMin: Cijk_Ailk_Bjlk_HSS_BH_UserArgs_MT128x256x64_MI16x16x1_SN_LDSB1_CLR1_GSU0_GSUC0_GSUWGMRR0_K1_LBSPPA1024_LBSPPB2048_LPA32_LPB0_MIWT4_8_PLR1_SU32_SUM0_SUS256_VWA2_VWB4_WGM1_WGMXCC1_WGMXCCGn1
    SolutionIndex: 63
    SolutionNameMin: Cijk_Ailk_Bjlk_HSS_BH_UserArgs_MT128x256x64_MI16x16x1_SN_LDSB1_CLR1_GSU0_GSUC0_GSUWGMRR0_K1_LBSPPA1024_LBSPPB2048_LPA0_LPB0_MIWT4_8_PLR1_SU32_SUM0_SUS256_VWA4_VWB4_WGM1_WGMXCC1_WGMXCCGn1
    SolutionIndex: 64
    SolutionNameMin: Cijk_Ailk_Bjlk_HSS_BH_UserArgs_MT128x256x64_MI16x16x1_SN_LDSB1_CLR1_GSU0_GSUC0_GSUWGMRR0_K1_LBSPPA1024_LBSPPB2048_LPA0_LPB0_MIWT4_8_PLR1_SU32_SUM0_SUS256_VWA4_VWB4_WGM4_WGMXCC1_WGMXCCGn1
    SolutionIndex: 65
    SolutionNameMin: Cijk_Ailk_Bjlk_HSS_BH_UserArgs_MT128x256x64_MI16x16x1_SN_LDSB1_CLR1_GSU0_GSUC0_GSUWGMRR0_K1_LBSPPA1024_LBSPPB2048_LPA0_LPB32_MIWT4_8_PLR2_SU32_SUM0_SUS256_VWA4_VWB2_WGM4_WGMXCC1_WGMXCCGn1
    SolutionIndex: 66
    SolutionNameMin: Cijk_Ailk_Bjlk_HSS_BH_UserArgs_MT128x256x64_MI16x16x1_SN_LDSB1_CLR1_GSU0_GSUC0_GSUWGMRR0_K1_LBSPPA1024_LBSPPB2048_LPA0_LPB0_MIWT4_8_PLR1_SU32_SUM0_SUS256_VWA4_VWB4_WGM8_WGMXCC1_WGMXCCGn1
    SolutionIndex: 67
    SolutionNameMin: Cijk_Ailk_Bjlk_HSS_BH_UserArgs_MT256x128x64_MI16x16x1_SN_LDSB1_CLR1_GSU0_GSUC0_GSUWGMRR0_K1_LBSPPA2048_LBSPPB1024_LPA0_LPB16_MIWT8_4_PLR1_SU32_SUM0_SUS256_VWA4_VWB1_WGM1_WGMXCC1_WGMXCCGn1
    SolutionIndex: 68
    SolutionNameMin: Cijk_Ailk_Bjlk_HSS_BH_UserArgs_MT256x128x64_MI16x16x1_SN_LDSB1_CLR1_GSU0_GSUC0_GSUWGMRR0_K1_LBSPPA2048_LBSPPB1024_LPA0_LPB32_MIWT8_4_PLR1_SU32_SUM0_SUS256_VWA4_VWB2_WGM1_WGMXCC1_WGMXCCGn1
    SolutionIndex: 69
    SolutionNameMin: Cijk_Ailk_Bjlk_HSS_BH_UserArgs_MT256x128x64_MI16x16x1_SN_LDSB1_CLR1_GSU0_GSUC0_GSUWGMRR0_K1_LBSPPA2048_LBSPPB1024_LPA32_LPB0_MIWT8_4_PLR1_SU32_SUM0_SUS256_VWA2_VWB4_WGM1_WGMXCC1_WGMXCCGn1
    SolutionIndex: 70
    SolutionNameMin: Cijk_Ailk_Bjlk_HSS_BH_UserArgs_MT256x128x64_MI16x16x1_SN_LDSB1_CLR1_GSU0_GSUC0_GSUWGMRR0_K1_LBSPPA2048_LBSPPB1024_LPA0_LPB0_MIWT8_4_PLR1_SU32_SUM0_SUS256_VWA4_VWB4_WGM1_WGMXCC1_WGMXCCGn1
    SolutionIndex: 71
    SolutionNameMin: Cijk_Ailk_Bjlk_HSS_BH_UserArgs_MT256x128x64_MI16x16x1_SN_LDSB1_CLR1_GSU0_GSUC0_GSUWGMRR0_K1_LBSPPA2048_LBSPPB1024_LPA0_LPB0_MIWT8_4_PLR2_SU32_SUM0_SUS256_VWA4_VWB4_WGM1_WGMXCC1_WGMXCCGn1
    SolutionIndex: 72
    SolutionNameMin: Cijk_Ailk_Bjlk_HSS_BH_UserArgs_MT256x128x64_MI16x16x1_SN_LDSB1_CLR1_GSU0_GSUC0_GSUWGMRR0_K1_LBSPPA2048_LBSPPB1024_LPA0_LPB0_MIWT8_4_PLR1_SU32_SUM0_SUS256_VWA4_VWB4_WGM4_WGMXCC1_WGMXCCGn1
    SolutionIndex: 73
    SolutionNameMin: Cijk_Ailk_Bjlk_HSS_BH_UserArgs_MT256x128x64_MI16x16x1_SN_LDSB1_CLR1_GSU0_GSUC0_GSUWGMRR0_K1_LBSPPA2048_LBSPPB1024_LPA0_LPB32_MIWT8_4_PLR1_SU32_SUM0_SUS256_VWA4_VWB2_WGM8_WGMXCC1_WGMXCCGn1
    SolutionIndex: 74
    SolutionNameMin: Cijk_Ailk_Bjlk_HSS_BH_UserArgs_MT256x128x64_MI16x16x1_SN_LDSB1_CLR1_GSU0_GSUC0_GSUWGMRR0_K1_LBSPPA2048_LBSPPB1024_LPA32_LPB0_MIWT8_4_PLR1_SU32_SUM0_SUS256_VWA2_VWB4_WGM8_WGMXCC1_WGMXCCGn1
    SolutionIndex: 75
    SolutionNameMin: Cijk_Ailk_Bjlk_HSS_BH_UserArgs_MT256x128x64_MI16x16x1_SN_LDSB1_CLR1_GSU0_GSUC0_GSUWGMRR0_K1_LBSPPA2048_LBSPPB1024_LPA0_LPB0_MIWT8_4_PLR1_SU32_SUM0_SUS256_VWA4_VWB4_WGM8_WGMXCC1_WGMXCCGn1
    SolutionIndex: 76
    SolutionNameMin: Cijk_Ailk_Bjlk_HSS_BH_UserArgs_MT128x128x64_MI16x16x1_SN_LDSB1_CLR1_GSU0_GSUC0_GSUWGMRR0_K1_LBSPPA1024_LBSPPB1024_LPA0_LPB0_MIWT4_4_PLR1_SU32_SUM0_SUS256_VWA4_VWB4_WGM1_WGMXCC1_WGMXCCGn1
    SolutionIndex: 77
    SolutionNameMin: Cijk_Ailk_Bjlk_HSS_BH_UserArgs_MT128x128x64_MI16x16x1_SN_LDSB1_CLR1_GSU0_GSUC0_GSUWGMRR0_K1_LBSPPA1024_LBSPPB1024_LPA0_LPB0_MIWT4_4_PLR2_SU32_SUM0_SUS256_VWA4_VWB4_WGM1_WGMXCC1_WGMXCCGn1
    SolutionIndex: 78
    SolutionNameMin: Cijk_Ailk_Bjlk_HSS_BH_UserArgs_MT128x128x64_MI16x16x1_SN_LDSB1_CLR1_GSU0_GSUC0_GSUWGMRR0_K1_LBSPPA1024_LBSPPB1024_LPA0_LPB0_MIWT4_4_PLR1_SU32_SUM0_SUS256_VWA4_VWB4_WGM4_WGMXCC1_WGMXCCGn1
    SolutionIndex: 79
    SolutionNameMin: Cijk_Ailk_Bjlk_HSS_BH_UserArgs_MT128x128x64_MI16x16x1_SN_LDSB1_CLR1_GSU0_GSUC0_GSUWGMRR0_K1_LBSPPA1024_LBSPPB1024_LPA0_LPB32_MIWT4_4_PLR2_SU32_SUM0_SUS256_VWA4_VWB2_WGM4_WGMXCC1_WGMXCCGn1
    SolutionIndex: 80
    SolutionNameMin: Cijk_Ailk_Bjlk_HSS_BH_UserArgs_MT128x128x64_MI16x16x1_SN_LDSB1_CLR1_GSU0_GSUC0_GSUWGMRR0_K1_LBSPPA1024_LBSPPB1024_LPA0_LPB32_MIWT4_4_PLR1_SU32_SUM0_SUS256_VWA4_VWB2_WGM8_WGMXCC1_WGMXCCGn1
    SolutionIndex: 81
    SolutionNameMin: Cijk_Ailk_Bjlk_HSS_BH_UserArgs_MT128x128x64_MI16x16x1_SN_LDSB1_CLR1_GSU0_GSUC0_GSUWGMRR0_K1_LBSPPA1024_LBSPPB1024_LPA0_LPB0_MIWT4_4_PLR1_SU32_SUM0_SUS256_VWA4_VWB4_WGM8_WGMXCC1_WGMXCCGn1
    SolutionIndex: 82
    SolutionNameMin: Cijk_Ailk_Bjlk_HSS_BH_UserArgs_MT128x128x64_MI16x16x1_SN_LDSB1_CLR1_GSU0_GSUC0_GSUWGMRR0_K1_LBSPPA1024_LBSPPB1024_LPA0_LPB0_MIWT4_4_PLR2_SU32_SUM0_SUS256_VWA4_VWB4_WGM8_WGMXCC1_WGMXCCGn1
    SolutionIndex: 83
    SolutionNameMin: Cijk_Ailk_Bjlk_HSS_BH_UserArgs_MT64x128x64_MI16x16x1_SN_LDSB1_CLR1_GSU0_GSUC0_GSUWGMRR0_K1_LBSPPA512_LBSPPB1024_LPA32_LPB0_MIWT2_4_PLR2_SU32_SUM0_SUS256_VWA2_VWB4_WGM1_WGMXCC1_WGMXCCGn1
    SolutionIndex: 84
    SolutionNameMin: Cijk_Ailk_Bjlk_HSS_BH_UserArgs_MT64x128x64_MI16x16x1_SN_LDSB1_CLR1_GSU0_GSUC0_GSUWGMRR0_K1_LBSPPA512_LBSPPB1024_LPA32_LPB0_MIWT2_4_PLR2_SU32_SUM0_SUS256_VWA2_VWB4_WGM8_WGMXCC1_WGMXCCGn1
    SolutionIndex: 85
    SolutionNameMin: Cijk_Ailk_Bjlk_HSS_BH_UserArgs_MT128x64x64_MI16x16x1_SN_LDSB1_CLR1_GSU0_GSUC0_GSUWGMRR0_K1_LBSPPA1024_LBSPPB512_LPA0_LPB16_MIWT4_2_PLR1_SU32_SUM0_SUS256_VWA4_VWB1_WGM1_WGMXCC1_WGMXCCGn1
    SolutionIndex: 86
    SolutionNameMin: Cijk_Ailk_Bjlk_HSS_BH_UserArgs_MT128x64x64_MI16x16x1_SN_LDSB1_CLR1_GSU0_GSUC0_GSUWGMRR0_K1_LBSPPA1024_LBSPPB512_LPA0_LPB32_MIWT4_2_PLR1_SU32_SUM0_SUS256_VWA4_VWB2_WGM1_WGMXCC1_WGMXCCGn1
    SolutionIndex: 87
    SolutionNameMin: Cijk_Ailk_Bjlk_HSS_BH_UserArgs_MT128x64x64_MI16x16x1_SN_LDSB1_CLR1_GSU0_GSUC0_GSUWGMRR0_K1_LBSPPA1024_LBSPPB512_LPA0_LPB16_MIWT4_2_PLR2_SU32_SUM0_SUS256_VWA4_VWB1_WGM1_WGMXCC1_WGMXCCGn1
    SolutionIndex: 88
    SolutionNameMin: Cijk_Ailk_Bjlk_HSS_BH_UserArgs_MT128x64x64_MI16x16x1_SN_LDSB1_CLR1_GSU0_GSUC0_GSUWGMRR0_K1_LBSPPA1024_LBSPPB512_LPA32_LPB32_MIWT4_2_PLR2_SU32_SUM0_SUS256_VWA2_VWB2_WGM1_WGMXCC1_WGMXCCGn1
    SolutionIndex: 89
    SolutionNameMin: Cijk_Ailk_Bjlk_HSS_BH_UserArgs_MT128x64x64_MI16x16x1_SN_LDSB1_CLR1_GSU0_GSUC0_GSUWGMRR0_K1_LBSPPA1024_LBSPPB512_LPA0_LPB32_MIWT4_2_PLR2_SU32_SUM0_SUS256_VWA4_VWB2_WGM1_WGMXCC1_WGMXCCGn1
    SolutionIndex: 90
    SolutionNameMin: Cijk_Ailk_Bjlk_HSS_BH_UserArgs_MT128x64x64_MI16x16x1_SN_LDSB1_CLR1_GSU0_GSUC0_GSUWGMRR0_K1_LBSPPA1024_LBSPPB512_LPA0_LPB32_MIWT4_2_PLR1_SU32_SUM0_SUS256_VWA4_VWB2_WGM4_WGMXCC1_WGMXCCGn1
    SolutionIndex: 91
    SolutionNameMin: Cijk_Ailk_Bjlk_HSS_BH_UserArgs_MT128x64x64_MI16x16x1_SN_LDSB1_CLR1_GSU0_GSUC0_GSUWGMRR0_K1_LBSPPA1024_LBSPPB512_LPA0_LPB16_MIWT4_2_PLR2_SU32_SUM0_SUS256_VWA4_VWB1_WGM4_WGMXCC1_WGMXCCGn1
    SolutionIndex: 92
    SolutionNameMin: Cijk_Ailk_Bjlk_HSS_BH_UserArgs_MT128x64x64_MI16x16x1_SN_LDSB1_CLR1_GSU0_GSUC0_GSUWGMRR0_K1_LBSPPA1024_LBSPPB512_LPA0_LPB32_MIWT4_2_PLR2_SU32_SUM0_SUS256_VWA4_VWB2_WGM4_WGMXCC1_WGMXCCGn1
    SolutionIndex: 93
    SolutionNameMin: Cijk_Ailk_Bjlk_HSS_BH_UserArgs_MT128x64x64_MI16x16x1_SN_LDSB1_CLR1_GSU0_GSUC0_GSUWGMRR0_K1_LBSPPA1024_LBSPPB512_LPA0_LPB32_MIWT4_2_PLR1_SU32_SUM0_SUS256_VWA4_VWB2_WGM8_WGMXCC1_WGMXCCGn1
    SolutionIndex: 94
    SolutionNameMin: Cijk_Ailk_Bjlk_HSS_BH_UserArgs_MT128x64x64_MI16x16x1_SN_LDSB1_CLR1_GSU0_GSUC0_GSUWGMRR0_K1_LBSPPA1024_LBSPPB512_LPA0_LPB32_MIWT4_2_PLR2_SU32_SUM0_SUS256_VWA4_VWB2_WGM8_WGMXCC1_WGMXCCGn1
    SolutionIndex: 95
    SolutionNameMin: Cijk_Ailk_Bjlk_HSS_BH_UserArgs_MT64x64x64_MI16x16x1_SN_LDSB1_CLR1_GSU0_GSUC0_GSUWGMRR0_K1_LBSPPA512_LBSPPB512_LPA32_LPB32_MIWT2_2_PLR1_SU32_SUM0_SUS256_VWA2_VWB2_WGM1_WGMXCC1_WGMXCCGn1
    SolutionIndex: 96
    SolutionNameMin: Cijk_Ailk_Bjlk_HSS_BH_UserArgs_MT64x64x64_MI16x16x1_SN_LDSB1_CLR1_GSU0_GSUC0_GSUWGMRR0_K1_LBSPPA512_LBSPPB512_LPA32_LPB32_MIWT2_2_PLR2_SU32_SUM0_SUS256_VWA2_VWB2_WGM1_WGMXCC1_WGMXCCGn1
    SolutionIndex: 97
    SolutionNameMin: Cijk_Ailk_Bjlk_HSS_BH_UserArgs_MT64x64x64_MI16x16x1_SN_LDSB1_CLR1_GSU0_GSUC0_GSUWGMRR0_K1_LBSPPA512_LBSPPB512_LPA32_LPB32_MIWT2_2_PLR1_SU32_SUM0_SUS256_VWA2_VWB2_WGM4_WGMXCC1_WGMXCCGn1
    SolutionIndex: 98
    SolutionNameMin: Cijk_Ailk_Bjlk_HSS_BH_UserArgs_MT64x64x64_MI16x16x1_SN_LDSB1_CLR1_GSU0_GSUC0_GSUWGMRR0_K1_LBSPPA512_LBSPPB512_LPA32_LPB32_MIWT2_2_PLR1_SU32_SUM0_SUS256_VWA2_VWB2_WGM8_WGMXCC1_WGMXCCGn1
    SolutionIndex: 99
    SolutionNameMin: Cijk_Ailk_Bjlk_HSS_BH_UserArgs_MT32x64x64_MI16x16x1_SN_LDSB0_CLR1_GSU0_GSUC0_GSUWGMRR0_K1_LBSPPA256_LBSPPB512_LPA16_LPB16_MIWT1_2_PLR2_SU32_SUM0_SUS256_VWA1_VWB1_WGM1_WGMXCC1_WGMXCCGn1
    SolutionIndex: 100
    SolutionNameMin: Cijk_Ailk_Bjlk_HSS_BH_UserArgs_MT32x64x64_MI16x16x1_SN_LDSB0_CLR1_GSU0_GSUC0_GSUWGMRR0_K1_LBSPPA256_LBSPPB512_LPA16_LPB32_MIWT1_2_PLR2_SU32_SUM0_SUS256_VWA1_VWB2_WGM1_WGMXCC1_WGMXCCGn1
    SolutionIndex: 101
    SolutionNameMin: Cijk_Ailk_Bjlk_HSS_BH_UserArgs_MT32x64x64_MI16x16x1_SN_LDSB0_CLR1_GSU0_GSUC0_GSUWGMRR0_K1_LBSPPA256_LBSPPB512_LPA16_LPB32_MIWT1_2_PLR1_SU32_SUM0_SUS256_VWA1_VWB2_WGM4_WGMXCC1_WGMXCCGn1
    SolutionIndex: 102
    SolutionNameMin: Cijk_Ailk_Bjlk_HSS_BH_UserArgs_MT32x64x64_MI16x16x1_SN_LDSB0_CLR1_GSU0_GSUC0_GSUWGMRR0_K1_LBSPPA256_LBSPPB512_LPA16_LPB32_MIWT1_2_PLR2_SU32_SUM0_SUS256_VWA1_VWB2_WGM4_WGMXCC1_WGMXCCGn1
    SolutionIndex: 103
    SolutionNameMin: Cijk_Ailk_Bjlk_HSS_BH_UserArgs_MT64x32x64_MI16x16x1_SN_LDSB0_CLR1_GSU0_GSUC0_GSUWGMRR0_K1_LBSPPA512_LBSPPB256_LPA16_LPB16_MIWT2_1_PLR1_SU32_SUM0_SUS256_VWA1_VWB1_WGM1_WGMXCC1_WGMXCCGn1
    SolutionIndex: 104
    SolutionNameMin: Cijk_Ailk_Bjlk_HSS_BH_UserArgs_MT64x32x64_MI16x16x1_SN_LDSB0_CLR1_GSU0_GSUC0_GSUWGMRR0_K1_LBSPPA512_LBSPPB256_LPA32_LPB16_MIWT2_1_PLR2_SU32_SUM0_SUS256_VWA2_VWB1_WGM1_WGMXCC1_WGMXCCGn1
    SolutionIndex: 105
    SolutionNameMin: Cijk_Ailk_Bjlk_HSS_BH_UserArgs_MT32x32x64_MI16x16x1_SN_LDSB0_CLR1_GSU0_GSUC0_GSUWGMRR0_K1_LBSPPA256_LBSPPB256_LPA16_LPB16_MIWT1_1_PLR1_SU32_SUM0_SUS256_VWA1_VWB1_WGM1_WGMXCC1_WGMXCCGn1
    SolutionIndex: 106
    SolutionNameMin: Cijk_Ailk_Bjlk_HSS_BH_UserArgs_MT32x32x64_MI16x16x1_SN_LDSB0_CLR1_GSU0_GSUC0_GSUWGMRR0_K1_LBSPPA256_LBSPPB256_LPA16_LPB16_MIWT1_1_PLR1_SU32_SUM0_SUS256_VWA1_VWB1_WGM4_WGMXCC1_WGMXCCGn1
    SolutionIndex: 107
    SolutionNameMin: Cijk_Ailk_Bjlk_HSS_BH_UserArgs_MT32x32x64_MI16x16x1_SN_LDSB0_CLR1_GSU0_GSUC0_GSUWGMRR0_K1_LBSPPA256_LBSPPB256_LPA16_LPB16_MIWT1_1_PLR2_SU32_SUM0_SUS256_VWA1_VWB1_WGM4_WGMXCC1_WGMXCCGn1
    SolutionIndex: 108
    SolutionNameMin: Cijk_Ailk_Bjlk_HSS_BH_UserArgs_MT32x32x64_MI16x16x1_SN_LDSB0_CLR1_GSU0_GSUC0_GSUWGMRR0_K1_LBSPPA256_LBSPPB256_LPA16_LPB16_MIWT1_1_PLR1_SU32_SUM0_SUS256_VWA1_VWB1_WGM8_WGMXCC1_WGMXCCGn1
    SolutionIndex: 109
    SolutionNameMin: Cijk_Ailk_Bjlk_HSS_BH_UserArgs_MT32x32x64_MI16x16x1_SN_LDSB0_CLR1_GSU0_GSUC0_GSUWGMRR0_K1_LBSPPA256_LBSPPB256_LPA16_LPB16_MIWT1_1_PLR2_SU32_SUM0_SUS256_VWA1_VWB1_WGM8_WGMXCC1_WGMXCCGn1
    SolutionIndex: 110
    SolutionNameMin: Cijk_Ailk_Bjlk_HSS_BH_UserArgs_MT128x128x128_MI16x16x1_SN_LDSB1_CLR1_GSU0_GSUC0_GSUWGMRR0_K1_LBSPPA1024_LBSPPB1024_LPA0_LPB0_MIWT4_4_PLR1_SU32_SUM0_SUS256_VWA4_VWB4_WGM1_WGMXCC1_WGMXCCGn1
    SolutionIndex: 111
    SolutionNameMin: Cijk_Ailk_Bjlk_HSS_BH_UserArgs_MT128x128x128_MI16x16x1_SN_LDSB1_CLR1_GSU0_GSUC0_GSUWGMRR0_K1_LBSPPA1024_LBSPPB1024_LPA0_LPB0_MIWT4_4_PLR2_SU32_SUM0_SUS256_VWA4_VWB4_WGM1_WGMXCC1_WGMXCCGn1
    SolutionIndex: 112
    SolutionNameMin: Cijk_Ailk_Bjlk_HSS_BH_UserArgs_MT128x128x128_MI16x16x1_SN_LDSB1_CLR1_GSU0_GSUC0_GSUWGMRR0_K1_LBSPPA1024_LBSPPB1024_LPA0_LPB0_MIWT4_4_PLR1_SU32_SUM0_SUS256_VWA4_VWB4_WGM4_WGMXCC1_WGMXCCGn1
    SolutionIndex: 113
    SolutionNameMin: Cijk_Ailk_Bjlk_HSS_BH_UserArgs_MT128x128x128_MI16x16x1_SN_LDSB1_CLR1_GSU0_GSUC0_GSUWGMRR0_K1_LBSPPA1024_LBSPPB1024_LPA0_LPB0_MIWT4_4_PLR2_SU32_SUM0_SUS256_VWA4_VWB4_WGM4_WGMXCC1_WGMXCCGn1
    SolutionIndex: 114
    SolutionNameMin: Cijk_Ailk_Bjlk_HSS_BH_UserArgs_MT128x128x128_MI16x16x1_SN_LDSB1_CLR1_GSU0_GSUC0_GSUWGMRR0_K1_LBSPPA1024_LBSPPB1024_LPA0_LPB0_MIWT4_4_PLR1_SU32_SUM0_SUS256_VWA4_VWB4_WGM8_WGMXCC1_WGMXCCGn1
    SolutionIndex: 115
    SolutionNameMin: Cijk_Ailk_Bjlk_HSS_BH_UserArgs_MT128x128x128_MI16x16x1_SN_LDSB1_CLR1_GSU0_GSUC0_GSUWGMRR0_K1_LBSPPA1024_LBSPPB1024_LPA0_LPB0_MIWT4_4_PLR2_SU32_SUM0_SUS256_VWA4_VWB4_WGM8_WGMXCC1_WGMXCCGn1
    SolutionIndex: 116
    SolutionNameMin: Cijk_Ailk_Bjlk_HSS_BH_UserArgs_MT128x64x128_MI16x16x1_SN_LDSB1_CLR1_GSU0_GSUC0_GSUWGMRR0_K1_LBSPPA1024_LBSPPB512_LPA0_LPB32_MIWT4_2_PLR2_SU32_SUM0_SUS256_VWA4_VWB2_WGM1_WGMXCC1_WGMXCCGn1
    SolutionIndex: 117
    SolutionNameMin: Cijk_Ailk_Bjlk_HSS_BH_UserArgs_MT64x64x128_MI16x16x1_SN_LDSB1_CLR1_GSU0_GSUC0_GSUWGMRR0_K1_LBSPPA512_LBSPPB512_LPA32_LPB32_MIWT2_2_PLR2_SU32_SUM0_SUS256_VWA2_VWB2_WGM1_WGMXCC1_WGMXCCGn1
    SolutionIndex: 118
    SolutionNameMin: Cijk_Ailk_Bjlk_HSS_BH_UserArgs_MT64x64x128_MI16x16x1_SN_LDSB1_CLR1_GSU0_GSUC0_GSUWGMRR0_K1_LBSPPA512_LBSPPB512_LPA16_LPB32_MIWT2_2_PLR1_SU32_SUM0_SUS256_VWA1_VWB2_WGM4_WGMXCC1_WGMXCCGn1
    SolutionIndex: 119
    SolutionNameMin: Cijk_Ailk_Bjlk_HSS_BH_UserArgs_MT64x64x128_MI16x16x1_SN_LDSB1_CLR1_GSU0_GSUC0_GSUWGMRR0_K1_LBSPPA512_LBSPPB512_LPA32_LPB32_MIWT2_2_PLR1_SU32_SUM0_SUS256_VWA2_VWB2_WGM4_WGMXCC1_WGMXCCGn1
    SolutionIndex: 120
    SolutionNameMin: Cijk_Ailk_Bjlk_HSS_BH_UserArgs_MT64x64x128_MI16x16x1_SN_LDSB1_CLR1_GSU0_GSUC0_GSUWGMRR0_K1_LBSPPA512_LBSPPB512_LPA32_LPB32_MIWT2_2_PLR2_SU32_SUM0_SUS256_VWA2_VWB2_WGM4_WGMXCC1_WGMXCCGn1
    SolutionIndex: 121
    SolutionNameMin: Cijk_Ailk_Bjlk_HSS_BH_UserArgs_MT32x64x128_MI16x16x1_SN_LDSB1_CLR1_GSU0_GSUC0_GSUWGMRR0_K1_LBSPPA256_LBSPPB512_LPA16_LPB32_MIWT1_2_PLR2_SU32_SUM0_SUS256_VWA1_VWB2_WGM1_WGMXCC1_WGMXCCGn1
    SolutionIndex: 122
    SolutionNameMin: Cijk_Ailk_Bjlk_HSS_BH_UserArgs_MT32x64x128_MI16x16x1_SN_LDSB1_CLR1_GSU0_GSUC0_GSUWGMRR0_K1_LBSPPA256_LBSPPB512_LPA16_LPB32_MIWT1_2_PLR2_SU32_SUM0_SUS256_VWA1_VWB2_WGM4_WGMXCC1_WGMXCCGn1
    SolutionIndex: 123
    SolutionNameMin: Cijk_Ailk_Bjlk_HSS_BH_UserArgs_MT64x32x128_MI16x16x1_SN_LDSB1_CLR1_GSU0_GSUC0_GSUWGMRR0_K1_LBSPPA512_LBSPPB256_LPA32_LPB16_MIWT2_1_PLR1_SU32_SUM0_SUS256_VWA2_VWB1_WGM1_WGMXCC1_WGMXCCGn1
    SolutionIndex: 124
    SolutionNameMin: Cijk_Ailk_Bjlk_HSS_BH_UserArgs_MT64x32x128_MI16x16x1_SN_LDSB1_CLR1_GSU0_GSUC0_GSUWGMRR0_K1_LBSPPA512_LBSPPB256_LPA32_LPB16_MIWT2_1_PLR2_SU32_SUM0_SUS256_VWA2_VWB1_WGM1_WGMXCC1_WGMXCCGn1
    SolutionIndex: 125
    SolutionNameMin: Cijk_Ailk_Bjlk_HSS_BH_UserArgs_MT64x32x128_MI16x16x1_SN_LDSB1_CLR1_GSU0_GSUC0_GSUWGMRR0_K1_LBSPPA512_LBSPPB256_LPA32_LPB16_MIWT2_1_PLR2_SU32_SUM0_SUS256_VWA2_VWB1_WGM4_WGMXCC1_WGMXCCGn1
    SolutionIndex: 126
    SolutionNameMin: Cijk_Ailk_Bjlk_HSS_BH_UserArgs_MT32x32x128_MI16x16x1_SN_LDSB1_CLR1_GSU0_GSUC0_GSUWGMRR0_K1_LBSPPA256_LBSPPB256_LPA16_LPB16_MIWT1_1_PLR1_SU32_SUM0_SUS256_VWA1_VWB1_WGM1_WGMXCC1_WGMXCCGn1
    SolutionIndex: 127
    SolutionNameMin: Cijk_Ailk_Bjlk_HSS_BH_UserArgs_MT32x32x32_MI16x16x1_SN_LDSB0_CLR1_GSU0_GSUC0_GSUWGMRR0_K1_LBSPPA256_LBSPPB256_LPA16_LPB16_MIWT1_1_PLR1_SU32_SUM0_SUS256_VWA1_VWB1_WGM1_WGMXCC1_WGMXCCGn1
- - - [128, 128, 1, 128, 128, 128, 128, 128]
    - [51, 0.072]
  - - [128, 128, 1, 256, 128, 128, 128, 128]
    - [106, 0.13]
  - - [128, 128, 1, 512, 128, 128, 128, 128]
    - [109, 0.221]
  - - [128, 128, 1, 1024, 128, 128, 128, 128]
    - [109, 0.313]
  - - [128, 128, 1, 2048, 128, 128, 128, 128]
    - [126, 0.48]
  - - [128, 128, 1, 4096, 128, 128, 128, 128]
    - [104, 0.798]
  - - [128, 128, 1, 8192, 128, 128, 128, 128]
    - [122, 1.197]
  - - [128, 256, 1, 128, 128, 128, 128, 256]
    - [105, 0.149]
  - - [128, 256, 1, 256, 128, 128, 128, 256]
    - [52, 0.258]
  - - [128, 256, 1, 512, 128, 128, 128, 256]
    - [105, 0.431]
  - - [128, 256, 1, 1024, 128, 128, 128, 256]
    - [126, 0.635]
  - - [128, 256, 1, 2048, 128, 128, 128, 256]
    - [124, 0.897]
  - - [128, 256, 1, 4096, 128, 128, 128, 256]
    - [95, 1.33]
  - - [128, 256, 1, 8192, 128, 128, 128, 256]
    - [119, 1.866]
  - - [128, 512, 1, 128, 128, 128, 128, 512]
    - [103, 0.29]
  - - [128, 512, 1, 256, 128, 128, 128, 512]
    - [99, 0.489]
  - - [128, 512, 1, 512, 128, 128, 128, 512]
    - [104, 0.837]
  - - [128, 512, 1, 1024, 128, 128, 128, 512]
    - [121, 1.158]
  - - [128, 512, 1, 2048, 128, 128, 128, 512]
    - [125, 1.527]
  - - [128, 512, 1, 4096, 128, 128, 128, 512]
    - [94, 2.197]
  - - [128, 512, 1, 8192, 128, 128, 128, 512]
    - [90, 2.843]
  - - [128, 1024, 1, 128, 128, 128, 128, 1024]
    - [96, 0.513]
  - - [128, 1024, 1, 256, 128, 128, 128, 1024]
    - [96, 0.922]
  - - [128, 1024, 1, 512, 128, 128, 128, 1024]
    - [96, 1.457]
  - - [128, 1024, 1, 1024, 128, 128, 128, 1024]
    - [117, 2.009]
  - - [128, 1024, 1, 2048, 128, 128, 128, 1024]
    - [117, 2.537]
  - - [128, 1024, 1, 4096, 128, 128, 128, 1024]
    - [79, 3.214]
  - - [128, 1024, 1, 8192, 128, 128, 128, 1024]
    - [113, 4.604]
  - - [128, 2048, 1, 128, 128, 128, 128, 2048]
    - [47, 0.873]
  - - [128, 2048, 1, 256, 128, 128, 128, 2048]
    - [84, 1.407]
  - - [128, 2048, 1, 512, 128, 128, 128, 2048]
    - [88, 2.001]
  - - [128, 2048, 1, 1024, 128, 128, 128, 2048]
    - [92, 2.79]
  - - [128, 2048, 1, 2048, 128, 128, 128, 2048]
    - [77, 3.496]
  - - [128, 2048, 1, 4096, 128, 128, 128, 2048]
    - [115, 4.715]
  - - [128, 2048, 1, 8192, 128, 128, 128, 2048]
    - [78, 5.976]
  - - [128, 4096, 1, 128, 128, 128, 128, 4096]
    - [41, 1.124]
  - - [128, 4096, 1, 256, 128, 128, 128, 4096]
    - [42, 1.849]
  - - [128, 4096, 1, 512, 128, 128, 128, 4096]
    - [81, 2.908]
  - - [128, 4096, 1, 1024, 128, 128, 128, 4096]
    - [82, 4.029]
  - - [128, 4096, 1, 2048, 128, 128, 128, 4096]
    - [110, 5.047]
  - - [128, 4096, 1, 4096, 128, 128, 128, 4096]
    - [78, 5.98]
  - - [128, 4096, 1, 8192, 128, 128, 128, 4096]
    - [111, 6.988]
  - - [128, 8192, 1, 128, 128, 128, 128, 8192]
    - [17, 1.582]
  - - [128, 8192, 1, 256, 128, 128, 128, 8192]
    - [21, 2.629]
  - - [128, 8192, 1, 512, 128, 128, 128, 8192]
    - [62, 3.59]
  - - [128, 8192, 1, 1024, 128, 128, 128, 8192]
    - [24, 5.06]
  - - [128, 8192, 1, 2048, 128, 128, 128, 8192]
    - [76, 5.922]
  - - [128, 8192, 1, 4096, 128, 128, 128, 8192]
    - [65, 6.934]
  - - [128, 8192, 1, 8192, 128, 128, 128, 8192]
    - [17, 7.58]
  - - [256, 128, 1, 128, 256, 256, 256, 128]
    - [124, 0.157]
  - - [256, 128, 1, 256, 256, 256, 256, 128]
    - [100, 0.272]
  - - [256, 128, 1, 512, 256, 256, 256, 128]
    - [108, 0.44]
  - - [256, 128, 1, 1024, 256, 256, 256, 128]
    - [107, 0.654]
  - - [256, 128, 1, 2048, 256, 256, 256, 128]
    - [122, 0.884]
  - - [256, 128, 1, 4096, 256, 256, 256, 128]
    - [122, 1.276]
  - - [256, 128, 1, 8192, 256, 256, 256, 128]
    - [117, 1.814]
  - - [256, 256, 1, 128, 256, 256, 256, 256]
    - [50, 0.292]
  - - [256, 256, 1, 256, 256, 256, 256, 256]
    - [102, 0.504]
  - - [256, 256, 1, 512, 256, 256, 256, 256]
    - [121, 0.821]
  - - [256, 256, 1, 1024, 256, 256, 256, 256]
    - [124, 1.193]
  - - [256, 256, 1, 2048, 256, 256, 256, 256]
    - [125, 1.519]
  - - [256, 256, 1, 4096, 256, 256, 256, 256]
    - [91, 2.161]
  - - [256, 256, 1, 8192, 256, 256, 256, 256]
    - [94, 2.899]
  - - [256, 512, 1, 128, 256, 256, 256, 512]
    - [98, 0.522]
  - - [256, 512, 1, 256, 256, 256, 256, 512]
    - [117, 0.883]
  - - [256, 512, 1, 512, 256, 256, 256, 512]
    - [95, 1.424]
  - - [256, 512, 1, 1024, 256, 256, 256, 512]
    - [117, 2.041]
  - - [256, 512, 1, 2048, 256, 256, 256, 512]
    - [120, 2.489]
  - - [256, 512, 1, 4096, 256, 256, 256, 512]
    - [76, 3.549]
  - - [256, 512, 1, 8192, 256, 256, 256, 512]
    - [111, 4.708]
  - - [256, 1024, 1, 128, 256, 256, 256, 1024]
    - [48, 0.898]
  - - [256, 1024, 1, 256, 256, 256, 256, 1024]
    - [48, 1.46]
  - - [256, 1024, 1, 512, 256, 256, 256, 1024]
    - [85, 2.096]
  - - [256, 1024, 1, 1024, 256, 256, 256, 1024]
    - [92, 2.9]
  - - [256, 1024, 1, 2048, 256, 256, 256, 1024]
    - [116, 3.584]
  - - [256, 1024, 1, 4096, 256, 256, 256, 1024]
    - [114, 4.645]
  - - [256, 1024, 1, 8192, 256, 256, 256, 1024]
    - [112, 5.84]
  - - [256, 2048, 1, 128, 256, 256, 256, 2048]
    - [39, 1.118]
  - - [256, 2048, 1, 256, 256, 256, 256, 2048]
    - [44, 1.935]
  - - [256, 2048, 1, 512, 256, 256, 256, 2048]
    - [38, 2.982]
  - - [256, 2048, 1, 1024, 256, 256, 256, 2048]
    - [110, 4.161]
  - - [256, 2048, 1, 2048, 256, 256, 256, 2048]
    - [112, 5.207]
  - - [256, 2048, 1, 4096, 256, 256, 256, 2048]
    - [113, 6.022]
  - - [256, 2048, 1, 8192, 256, 256, 256, 2048]
    - [25, 7.023]
  - - [256, 4096, 1, 128, 256, 256, 256, 4096]
    - [33, 1.522]
  - - [256, 4096, 1, 256, 256, 256, 256, 4096]
    - [27, 2.677]
  - - [256, 4096, 1, 512, 256, 256, 256, 4096]
    - [23, 3.83]
  - - [256, 4096, 1, 1024, 256, 256, 256, 4096]
    - [31, 5.189]
  - - [256, 4096, 1, 2048, 256, 256, 256, 4096]
    - [70, 6.177]
  - - [256, 4096, 1, 4096, 256, 256, 256, 4096]
    - [29, 7.08]
  - - [256, 4096, 1, 8192, 256, 256, 256, 4096]
    - [2, 8.091]
  - - [256, 8192, 1, 128, 256, 256, 256, 8192]
    - [6, 1.845]
  - - [256, 8192, 1, 256, 256, 256, 256, 8192]
    - [54, 2.999]
  - - [256, 8192, 1, 512, 256, 256, 256, 8192]
    - [0, 4.44]
  - - [256, 8192, 1, 1024, 256, 256, 256, 8192]
    - [3, 5.939]
  - - [256, 8192, 1, 2048, 256, 256, 256, 8192]
    - [53, 7.089]
  - - [256, 8192, 1, 4096, 256, 256, 256, 8192]
    - [15, 8.118]
  - - [256, 8192, 1, 8192, 256, 256, 256, 8192]
    - [5, 8.906]
  - - [512, 128, 1, 128, 512, 512, 512, 128]
    - [96, 0.297]
  - - [512, 128, 1, 256, 512, 512, 512, 128]
    - [101, 0.52]
  - - [512, 128, 1, 512, 512, 512, 512, 128]
    - [122, 0.789]
  - - [512, 128, 1, 1024, 512, 512, 512, 128]
    - [123, 1.172]
  - - [512, 128, 1, 2048, 512, 512, 512, 128]
    - [125, 1.524]
  - - [512, 128, 1, 4096, 512, 512, 512, 128]
    - [87, 2.238]
  - - [512, 128, 1, 8192, 512, 512, 512, 128]
    - [116, 2.926]
  - - [512, 256, 1, 128, 512, 512, 512, 256]
    - [49, 0.547]
  - - [512, 256, 1, 256, 512, 512, 512, 256]
    - [95, 0.925]
  - - [512, 256, 1, 512, 512, 512, 512, 256]
    - [95, 1.441]
  - - [512, 256, 1, 1024, 512, 512, 512, 256]
    - [117, 2.039]
  - - [512, 256, 1, 2048, 512, 512, 512, 256]
    - [120, 2.525]
  - - [512, 256, 1, 4096, 512, 512, 512, 256]
    - [81, 3.556]
  - - [512, 256, 1, 8192, 512, 512, 512, 256]
    - [110, 4.756]
  - - [512, 512, 1, 128, 512, 512, 512, 512]
    - [48, 0.896]
  - - [512, 512, 1, 256, 512, 512, 512, 512]
    - [87, 1.473]
  - - [512, 512, 1, 512, 512, 512, 512, 512]
    - [83, 2.159]
  - - [512, 512, 1, 1024, 512, 512, 512, 512]
    - [89, 2.97]
  - - [512, 512, 1, 2048, 512, 512, 512, 512]
    - [76, 3.682]
  - - [512, 512, 1, 4096, 512, 512, 512, 512]
    - [81, 4.863]
  - - [512, 512, 1, 8192, 512, 512, 512, 512]
    - [81, 6.015]
  - - [512, 1024, 1, 128, 512, 512, 512, 1024]
    - [36, 1.154]
  - - [512, 1024, 1, 256, 512, 512, 512, 1024]
    - [44, 1.88]
  - - [512, 1024, 1, 512, 512, 512, 512, 1024]
    - [76, 2.997]
  - - [512, 1024, 1, 1024, 512, 512, 512, 1024]
    - [81, 4.13]
  - - [512, 1024, 1, 2048, 512, 512, 512, 1024]
    - [78, 5.249]
  - - [512, 1024, 1, 4096, 512, 512, 512, 1024]
    - [112, 6.17]
  - - [512, 1024, 1, 8192, 512, 512, 512, 1024]
    - [70, 7.158]
  - - [512, 2048, 1, 128, 512, 512, 512, 2048]
    - [24, 1.535]
  - - [512, 2048, 1, 256, 512, 512, 512, 2048]
    - [26, 2.609]
  - - [512, 2048, 1, 512, 512, 512, 512, 2048]
    - [34, 3.902]
  - - [512, 2048, 1, 1024, 512, 512, 512, 2048]
    - [74, 5.153]
  - - [512, 2048, 1, 2048, 512, 512, 512, 2048]
    - [64, 6.164]
  - - [512, 2048, 1, 4096, 512, 512, 512, 2048]
    - [72, 7.15]
  - - [512, 2048, 1, 8192, 512, 512, 512, 2048]
    - [15, 8.008]
  - - [512, 4096, 1, 128, 512, 512, 512, 4096]
    - [5, 1.771]
  - - [512, 4096, 1, 256, 512, 512, 512, 4096]
    - [15, 2.983]
  - - [512, 4096, 1, 512, 512, 512, 512, 4096]
    - [15, 4.439]
  - - [512, 4096, 1, 1024, 512, 512, 512, 4096]
    - [15, 5.863]
  - - [512, 4096, 1, 2048, 512, 512, 512, 4096]
    - [56, 7.04]
  - - [512, 4096, 1, 4096, 512, 512, 512, 4096]
    - [8, 8.116]
  - - [512, 4096, 1, 8192, 512, 512, 512, 4096]
    - [53, 8.902]
  - - [512, 8192, 1, 128, 512, 512, 512, 8192]
    - [55, 1.866]
  - - [512, 8192, 1, 256, 512, 512, 512, 8192]
    - [3, 2.993]
  - - [512, 8192, 1, 512, 512, 512, 512, 8192]
    - [2, 4.665]
  - - [512, 8192, 1, 1024, 512, 512, 512, 8192]
    - [59, 6.381]
  - - [512, 8192, 1, 2048, 512, 512, 512, 8192]
    - [2, 7.916]
  - - [512, 8192, 1, 4096, 512, 512, 512, 8192]
    - [15, 8.78]
  - - [512, 8192, 1, 8192, 512, 512, 512, 8192]
    - [56, 9.469]
  - - [1024, 128, 1, 128, 1024, 1024, 1024, 128]
    - [118, 0.545]
  - - [1024, 128, 1, 256, 1024, 1024, 1024, 128]
    - [97, 0.92]
  - - [1024, 128, 1, 512, 1024, 1024, 1024, 128]
    - [98, 1.399]
  - - [1024, 128, 1, 1024, 1024, 1024, 1024, 128]
    - [96, 2.014]
  - - [1024, 128, 1, 2048, 1024, 1024, 1024, 128]
    - [89, 2.371]
  - - [1024, 128, 1, 4096, 1024, 1024, 1024, 128]
    - [76, 3.474]
  - - [1024, 128, 1, 8192, 1024, 1024, 1024, 128]
    - [81, 4.534]
  - - [1024, 256, 1, 128, 1024, 1024, 1024, 256]
    - [89, 0.938]
  - - [1024, 256, 1, 256, 1024, 1024, 1024, 256]
    - [46, 1.519]
  - - [1024, 256, 1, 512, 1024, 1024, 1024, 256]
    - [83, 2.253]
  - - [1024, 256, 1, 1024, 1024, 1024, 1024, 256]
    - [93, 2.835]
  - - [1024, 256, 1, 2048, 1024, 1024, 1024, 256]
    - [81, 3.665]
  - - [1024, 256, 1, 4096, 1024, 1024, 1024, 256]
    - [112, 4.826]
  - - [1024, 256, 1, 8192, 1024, 1024, 1024, 256]
    - [76, 6.057]
  - - [1024, 512, 1, 128, 1024, 1024, 1024, 512]
    - [38, 1.232]
  - - [1024, 512, 1, 256, 1024, 1024, 1024, 512]
    - [38, 1.947]
  - - [1024, 512, 1, 512, 1024, 1024, 1024, 512]
    - [81, 2.959]
  - - [1024, 512, 1, 1024, 1024, 1024, 1024, 512]
    - [76, 4.256]
  - - [1024, 512, 1, 2048, 1024, 1024, 1024, 512]
    - [110, 5.337]
  - - [1024, 512, 1, 4096, 1024, 1024, 1024, 512]
    - [112, 6.146]
  - - [1024, 512, 1, 8192, 1024, 1024, 1024, 512]
    - [19, 7.106]
  - - [1024, 1024, 1, 128, 1024, 1024, 1024, 1024]
    - [25, 1.591]
  - - [1024, 1024, 1, 256, 1024, 1024, 1024, 1024]
    - [18, 2.654]
  - - [1024, 1024, 1, 512, 1024, 1024, 1024, 1024]
    - [25, 4.036]
  - - [1024, 1024, 1, 1024, 1024, 1024, 1024, 1024]
    - [25, 5.238]
  - - [1024, 1024, 1, 2048, 1024, 1024, 1024, 1024]
    - [62, 6.234]
  - - [1024, 1024, 1, 4096, 1024, 1024, 1024, 1024]
    - [66, 7.125]
  - - [1024, 1024, 1, 8192, 1024, 1024, 1024, 1024]
    - [53, 8.218]
  - - [1024, 2048, 1, 128, 1024, 1024, 1024, 2048]
    - [15, 1.891]
  - - [1024, 2048, 1, 256, 1024, 1024, 1024, 2048]
    - [5, 3.13]
  - - [1024, 2048, 1, 512, 1024, 1024, 1024, 2048]
    - [9, 4.615]
  - - [1024, 2048, 1, 1024, 1024, 1024, 1024, 2048]
    - [5, 5.978]
  - - [1024, 2048, 1, 2048, 1024, 1024, 1024, 2048]
    - [27, 6.912]
  - - [1024, 2048, 1, 4096, 1024, 1024, 1024, 2048]
    - [15, 8.114]
  - - [1024, 2048, 1, 8192, 1024, 1024, 1024, 2048]
    - [60, 8.977]
  - - [1024, 4096, 1, 128, 1024, 1024, 1024, 4096]
    - [58, 1.954]
  - - [1024, 4096, 1, 256, 1024, 1024, 1024, 4096]
    - [5, 2.994]
  - - [1024, 4096, 1, 512, 1024, 1024, 1024, 4096]
    - [60, 4.662]
  - - [1024, 4096, 1, 1024, 1024, 1024, 1024, 4096]
    - [54, 6.257]
  - - [1024, 4096, 1, 2048, 1024, 1024, 1024, 4096]
    - [60, 7.878]
  - - [1024, 4096, 1, 4096, 1024, 1024, 1024, 4096]
    - [59, 8.85]
  - - [1024, 4096, 1, 8192, 1024, 1024, 1024, 4096]
    - [60, 9.221]
  - - [1024, 8192, 1, 128, 1024, 1024, 1024, 8192]
    - [67, 2.065]
  - - [1024, 8192, 1, 256, 1024, 1024, 1024, 8192]
    - [19, 3.442]
  - - [1024, 8192, 1, 512, 1024, 1024, 1024, 8192]
    - [22, 4.961]
  - - [1024, 8192, 1, 1024, 1024, 1024, 1024, 8192]
    - [15, 6.731]
  - - [1024, 8192, 1, 2048, 1024, 1024, 1024, 8192]
    - [60, 8.048]
  - - [1024, 8192, 1, 4096, 1024, 1024, 1024, 8192]
    - [14, 8.585]
  - - [1024, 8192, 1, 8192, 1024, 1024, 1024, 8192]
    - [57, 9.137]
  - - [2048, 128, 1, 128, 2048, 2048, 2048, 128]
    - [86, 0.932]
  - - [2048, 128, 1, 256, 2048, 2048, 2048, 128]
    - [45, 1.501]
  - - [2048, 128, 1, 512, 2048, 2048, 2048, 128]
    - [92, 2.223]
  - - [2048, 128, 1, 1024, 2048, 2048, 2048, 128]
    - [92, 2.965]
  - - [2048, 128, 1, 2048, 2048, 2048, 2048, 128]
    - [78, 3.597]
  - - [2048, 128, 1, 4096, 2048, 2048, 2048, 128]
    - [81, 4.766]
  - - [2048, 128, 1, 8192, 2048, 2048, 2048, 128]
    - [81, 5.894]
  - - [2048, 256, 1, 128, 2048, 2048, 2048, 256]
    - [43, 1.193]
  - - [2048, 256, 1, 256, 2048, 2048, 2048, 256]
    - [38, 1.961]
  - - [2048, 256, 1, 512, 2048, 2048, 2048, 256]
    - [76, 3.125]
  - - [2048, 256, 1, 1024, 2048, 2048, 2048, 256]
    - [76, 4.28]
  - - [2048, 256, 1, 2048, 2048, 2048, 2048, 256]
    - [110, 5.341]
  - - [2048, 256, 1, 4096, 2048, 2048, 2048, 256]
    - [110, 6.147]
  - - [2048, 256, 1, 8192, 2048, 2048, 2048, 256]
    - [64, 7.102]
  - - [2048, 512, 1, 128, 2048, 2048, 2048, 512]
    - [29, 1.621]
  - - [2048, 512, 1, 256, 2048, 2048, 2048, 512]
    - [35, 2.707]
  - - [2048, 512, 1, 512, 2048, 2048, 2048, 512]
    - [19, 4.07]
  - - [2048, 512, 1, 1024, 2048, 2048, 2048, 512]
    - [19, 5.275]
  - - [2048, 512, 1, 2048, 2048, 2048, 2048, 512]
    - [64, 6.187]
  - - [2048, 512, 1, 4096, 2048, 2048, 2048, 512]
    - [63, 7.124]
  - - [2048, 512, 1, 8192, 2048, 2048, 2048, 512]
    - [13, 8.164]
  - - [2048, 1024, 1, 128, 2048, 2048, 2048, 1024]
    - [10, 1.87]
  - - [2048, 1024, 1, 256, 2048, 2048, 2048, 1024]
    - [4, 3.109]
  - - [2048, 1024, 1, 512, 2048, 2048, 2048, 1024]
    - [5, 4.601]
  - - [2048, 1024, 1, 1024, 2048, 2048, 2048, 1024]
    - [5, 6.006]
  - - [2048, 1024, 1, 2048, 2048, 2048, 2048, 1024]
    - [59, 7.046]
  - - [2048, 1024, 1, 4096, 2048, 2048, 2048, 1024]
    - [5, 8.138]
  - - [2048, 1024, 1, 8192, 2048, 2048, 2048, 1024]
    - [9, 8.795]
  - - [2048, 2048, 1, 128, 2048, 2048, 2048, 2048]
    - [60, 1.973]
  - - [2048, 2048, 1, 256, 2048, 2048, 2048, 2048]
    - [71, 3.02]
  - - [2048, 2048, 1, 512, 2048, 2048, 2048, 2048]
    - [2, 4.658]
  - - [2048, 2048, 1, 1024, 2048, 2048, 2048, 2048]
    - [5, 6.51]
  - - [2048, 2048, 1, 2048, 2048, 2048, 2048, 2048]
    - [5, 7.875]
  - - [2048, 2048, 1, 4096, 2048, 2048, 2048, 2048]
    - [56, 8.862]
  - - [2048, 2048, 1, 8192, 2048, 2048, 2048, 2048]
    - [59, 9.398]
  - - [2048, 4096, 1, 128, 2048, 2048, 2048, 4096]
    - [61, 2.09]
  - - [2048, 4096, 1, 256, 2048, 2048, 2048, 4096]
    - [53, 3.412]
  - - [2048, 4096, 1, 512, 2048, 2048, 2048, 4096]
    - [5, 5.035]
  - - [2048, 4096, 1, 1024, 2048, 2048, 2048, 4096]
    - [8, 6.69]
  - - [2048, 4096, 1, 2048, 2048, 2048, 2048, 4096]
    - [6, 7.953]
  - - [2048, 4096, 1, 4096, 2048, 2048, 2048, 4096]
    - [3, 8.85]
  - - [2048, 4096, 1, 8192, 2048, 2048, 2048, 4096]
    - [16, 9.074]
  - - [2048, 8192, 1, 128, 2048, 2048, 2048, 8192]
    - [23, 2.388]
  - - [2048, 8192, 1, 256, 2048, 2048, 2048, 8192]
    - [24, 3.808]
  - - [2048, 8192, 1, 512, 2048, 2048, 2048, 8192]
    - [8, 5.509]
  - - [2048, 8192, 1, 1024, 2048, 2048, 2048, 8192]
    - [10, 7.224]
  - - [2048, 8192, 1, 2048, 2048, 2048, 2048, 8192]
    - [13, 8.275]
  - - [2048, 8192, 1, 4096, 2048, 2048, 2048, 8192]
    - [53, 8.738]
  - - [2048, 8192, 1, 8192, 2048, 2048, 2048, 8192]
    - [53, 9.366]
  - - [4096, 128, 1, 128, 4096, 4096, 4096, 128]
    - [37, 1.185]
  - - [4096, 128, 1, 256, 4096, 4096, 4096, 128]
    - [40, 2.019]
  - - [4096, 128, 1, 512, 4096, 4096, 4096, 128]
    - [80, 3.02]
  - - [4096, 128, 1, 1024, 4096, 4096, 4096, 128]
    - [76, 4.291]
  - - [4096, 128, 1, 2048, 4096, 4096, 4096, 128]
    - [76, 5.308]
  - - [4096, 128, 1, 4096, 4096, 4096, 4096, 128]
    - [76, 6.127]
  - - [4096, 128, 1, 8192, 4096, 4096, 4096, 128]
    - [71, 7.073]
  - - [4096, 256, 1, 128, 4096, 4096, 4096, 256]
    - [28, 1.599]
  - - [4096, 256, 1, 256, 4096, 4096, 4096, 256]
    - [32, 2.676]
  - - [4096, 256, 1, 512, 4096, 4096, 4096, 256]
    - [32, 3.932]
  - - [4096, 256, 1, 1024, 4096, 4096, 4096, 256]
    - [27, 5.183]
  - - [4096, 256, 1, 2048, 4096, 4096, 4096, 256]
    - [69, 6.204]
  - - [4096, 256, 1, 4096, 4096, 4096, 4096, 256]
    - [66, 7.117]
  - - [4096, 256, 1, 8192, 4096, 4096, 4096, 256]
    - [59, 8.206]
  - - [4096, 512, 1, 128, 4096, 4096, 4096, 512]
    - [1, 1.807]
  - - [4096, 512, 1, 256, 4096, 4096, 4096, 512]
    - [2, 3.043]
  - - [4096, 512, 1, 512, 4096, 4096, 4096, 512]
    - [10, 4.505]
  - - [4096, 512, 1, 1024, 4096, 4096, 4096, 512]
    - [2, 5.914]
  - - [4096, 512, 1, 2048, 4096, 4096, 4096, 512]
    - [53, 7.082]
  - - [4096, 512, 1, 4096, 4096, 4096, 4096, 512]
    - [53, 8.171]
  - - [4096, 512, 1, 8192, 4096, 4096, 4096, 512]
    - [7, 9.043]
  - - [4096, 1024, 1, 128, 4096, 4096, 4096, 1024]
    - [29, 1.89]
  - - [4096, 1024, 1, 256, 4096, 4096, 4096, 1024]
    - [67, 3.043]
  - - [4096, 1024, 1, 512, 4096, 4096, 4096, 1024]
    - [2, 4.834]
  - - [4096, 1024, 1, 1024, 4096, 4096, 4096, 1024]
    - [12, 6.536]
  - - [4096, 1024, 1, 2048, 4096, 4096, 4096, 1024]
    - [53, 7.948]
  - - [4096, 1024, 1, 4096, 4096, 4096, 4096, 1024]
    - [53, 8.869]
  - - [4096, 1024, 1, 8192, 4096, 4096, 4096, 1024]
    - [53, 9.383]
  - - [4096, 2048, 1, 128, 4096, 4096, 4096, 2048]
    - [68, 2.108]
  - - [4096, 2048, 1, 256, 4096, 4096, 4096, 2048]
    - [17, 3.392]
  - - [4096, 2048, 1, 512, 4096, 4096, 4096, 2048]
    - [35, 4.896]
  - - [4096, 2048, 1, 1024, 4096, 4096, 4096, 2048]
    - [5, 6.57]
  - - [4096, 2048, 1, 2048, 4096, 4096, 4096, 2048]
    - [53, 8.062]
  - - [4096, 2048, 1, 4096, 4096, 4096, 4096, 2048]
    - [53, 8.937]
  - - [4096, 2048, 1, 8192, 4096, 4096, 4096, 2048]
    - [5, 9.196]
  - - [4096, 4096, 1, 128, 4096, 4096, 4096, 4096]
    - [27, 2.423]
  - - [4096, 4096, 1, 256, 4096, 4096, 4096, 4096]
    - [27, 3.834]
  - - [4096, 4096, 1, 512, 4096, 4096, 4096, 4096]
    - [7, 5.465]
  - - [4096, 4096, 1, 1024, 4096, 4096, 4096, 4096]
    - [13, 7.065]
  - - [4096, 4096, 1, 2048, 4096, 4096, 4096, 4096]
    - [8, 8.253]
  - - [4096, 4096, 1, 4096, 4096, 4096, 4096, 4096]
    - [12, 8.696]
  - - [4096, 4096, 1, 8192, 4096, 4096, 4096, 4096]
    - [54, 9.17]
  - - [4096, 8192, 1, 128, 4096, 4096, 4096, 8192]
    - [17, 2.532]
  - - [4096, 8192, 1, 256, 4096, 4096, 4096, 8192]
    - [27, 3.91]
  - - [4096, 8192, 1, 512, 4096, 4096, 4096, 8192]
    - [0, 5.358]
  - - [4096, 8192, 1, 1024, 4096, 4096, 4096, 8192]
    - [54, 6.753]
  - - [4096, 8192, 1, 2048, 4096, 4096, 4096, 8192]
    - [53, 8.049]
  - - [4096, 8192, 1, 4096, 4096, 4096, 4096, 8192]
    - [53, 8.732]
  - - [4096, 8192, 1, 8192, 4096, 4096, 4096, 8192]
    - [10, 9.037]
  - - [8192, 128, 1, 128, 8192, 8192, 8192, 128]
    - [30, 1.644]
  - - [8192, 128, 1, 256, 8192, 8192, 8192, 128]
    - [26, 2.692]
  - - [8192, 128, 1, 512, 8192, 8192, 8192, 128]
    - [35, 3.903]
  - - [8192, 128, 1, 1024, 8192, 8192, 8192, 128]
    - [67, 5.081]
  - - [8192, 128, 1, 2048, 8192, 8192, 8192, 128]
    - [73, 6.172]
  - - [8192, 128, 1, 4096, 8192, 8192, 8192, 128]
    - [75, 7.108]
  - - [8192, 128, 1, 8192, 8192, 8192, 8192, 128]
    - [70, 8.001]
  - - [8192, 256, 1, 128, 8192, 8192, 8192, 256]
    - [0, 1.841]
  - - [8192, 256, 1, 256, 8192, 8192, 8192, 256]
    - [11, 3.04]
  - - [8192, 256, 1, 512, 8192, 8192, 8192, 256]
    - [2, 4.456]
  - - [8192, 256, 1, 1024, 8192, 8192, 8192, 256]
    - [8, 5.862]
  - - [8192, 256, 1, 2048, 8192, 8192, 8192, 256]
    - [59, 7.056]
  - - [8192, 256, 1, 4096, 8192, 8192, 8192, 256]
    - [8, 8.116]
  - - [8192, 256, 1, 8192, 8192, 8192, 8192, 256]
    - [59, 9.014]
  - - [8192, 512, 1, 128, 8192, 8192, 8192, 512]
    - [26, 1.94]
  - - [8192, 512, 1, 256, 8192, 8192, 8192, 512]
    - [68, 3.025]
  - - [8192, 512, 1, 512, 8192, 8192, 8192, 512]
    - [5, 4.662]
  - - [8192, 512, 1, 1024, 8192, 8192, 8192, 512]
    - [7, 6.476]
  - - [8192, 512, 1, 2048, 8192, 8192, 8192, 512]
    - [5, 7.909]
  - - [8192, 512, 1, 4096, 8192, 8192, 8192, 512]
    - [54, 8.864]
  - - [8192, 512, 1, 8192, 8192, 8192, 8192, 512]
    - [57, 9.368]
  - - [8192, 1024, 1, 128, 8192, 8192, 8192, 1024]
    - [70, 2.156]
  - - [8192, 1024, 1, 256, 8192, 8192, 8192, 1024]
    - [54, 3.376]
  - - [8192, 1024, 1, 512, 8192, 8192, 8192, 1024]
    - [25, 4.964]
  - - [8192, 1024, 1, 1024, 8192, 8192, 8192, 1024]
    - [15, 6.665]
  - - [8192, 1024, 1, 2048, 8192, 8192, 8192, 1024]
    - [2, 8.051]
  - - [8192, 1024, 1, 4096, 8192, 8192, 8192, 1024]
    - [59, 8.907]
  - - [8192, 1024, 1, 8192, 8192, 8192, 8192, 1024]
    - [3, 9.157]
  - - [8192, 2048, 1, 128, 8192, 8192, 8192, 2048]
    - [26, 2.398]
  - - [8192, 2048, 1, 256, 8192, 8192, 8192, 2048]
    - [26, 3.744]
  - - [8192, 2048, 1, 512, 8192, 8192, 8192, 2048]
    - [0, 5.478]
  - - [8192, 2048, 1, 1024, 8192, 8192, 8192, 2048]
    - [5, 7.068]
  - - [8192, 2048, 1, 2048, 8192, 8192, 8192, 2048]
    - [59, 8.259]
  - - [8192, 2048, 1, 4096, 8192, 8192, 8192, 2048]
    - [11, 8.763]
  - - [8192, 2048, 1, 8192, 8192, 8192, 8192, 2048]
    - [14, 8.983]
  - - [8192, 4096, 1, 128, 8192, 8192, 8192, 4096]
    - [26, 2.426]
  - - [8192, 4096, 1, 256, 8192, 8192, 8192, 4096]
    - [2, 3.908]
  - - [8192, 4096, 1, 512, 8192, 8192, 8192, 4096]
    - [11, 5.538]
  - - [8192, 4096, 1, 1024, 8192, 8192, 8192, 4096]
    - [10, 6.766]
  - - [8192, 4096, 1, 2048, 8192, 8192, 8192, 4096]
    - [13, 8.027]
  - - [8192, 4096, 1, 4096, 8192, 8192, 8192, 4096]
    - [59, 8.641]
  - - [8192, 4096, 1, 8192, 8192, 8192, 8192, 4096]
    - [53, 9.314]
  - - [8192, 8192, 1, 128, 8192, 8192, 8192, 8192]
    - [2, 2.196]
  - - [8192, 8192, 1, 256, 8192, 8192, 8192, 8192]
    - [20, 3.771]
  - - [8192, 8192, 1, 512, 8192, 8192, 8192, 8192]
    - [0, 5.541]
  - - [8192, 8192, 1, 1024, 8192, 8192, 8192, 8192]
    - [2, 7.17]
  - - [8192, 8192, 1, 2048, 8192, 8192, 8192, 8192]
    - [54, 8.391]
  - - [8192, 8192, 1, 4096, 8192, 8192, 8192, 8192]
    - [54, 8.905]
  - - [8192, 8192, 1, 8192, 8192, 8192, 8192, 8192]
    - [53, 8.88]
  - - [1, 1, 1, 32, 1, 1, 1, 1]
    - [127, 0.0]
- null
- null
- ExperimentalStreamK
- GridBased
