library/src/amd_detail/rocblaslt/src/Tensile/Logic/asm_full/aquavanjaram/gfx942_38cu/StreamK/aquavanjaram942_Cijk_Ailk_Bjlk_BBS_BH_UserArgs.yaml
- {MinimumRequiredVersion: 4.33.0}
- aquavanjaram942
- {Architecture: gfx942, CUCount: 38}
- [Device 0049, Device 0050]
    SolutionIndex: 0
    SolutionNameMin: Cijk_Ailk_Bjlk_BBS_BH_UserArgs_MT256x256x32_MI16x16x1_SN_LDSB1_CLR1_GSU0_GSUC0_GSUWGMRR0_K1_LBSPPA2048_LBSPPB2048_LPA0_LPB16_MIWT8_8_PLR1_SU32_SUM0_SUS256_VWA4_VWB1_WGM1_WGMXCC1_WGMXCCGn1
    SolutionIndex: 1
    SolutionNameMin: Cijk_Ailk_Bjlk_BBS_BH_UserArgs_MT256x256x32_MI16x16x1_SN_LDSB1_CLR1_GSU0_GSUC0_GSUWGMRR0_K1_LBSPPA2048_LBSPPB2048_LPA0_LPB16_MIWT8_8_PLR1_SU32_SUM0_SUS256_VWA8_VWB1_WGM1_WGMXCC1_WGMXCCGn1
    SolutionIndex: 2
    SolutionNameMin: Cijk_Ailk_Bjlk_BBS_BH_UserArgs_MT256x256x32_MI16x16x1_SN_LDSB1_CLR1_GSU0_GSUC0_GSUWGMRR0_K1_LBSPPA2048_LBSPPB2048_LPA32_LPB32_MIWT8_8_PLR1_SU32_SUM0_SUS256_VWA2_VWB2_WGM1_WGMXCC1_WGMXCCGn1
    SolutionIndex: 3
    SolutionNameMin: Cijk_Ailk_Bjlk_BBS_BH_UserArgs_MT256x256x32_MI16x16x1_SN_LDSB1_CLR1_GSU0_GSUC0_GSUWGMRR0_K1_LBSPPA2048_LBSPPB2048_LPA0_LPB32_MIWT8_8_PLR1_SU32_SUM0_SUS256_VWA4_VWB2_WGM1_WGMXCC1_WGMXCCGn1
    SolutionIndex: 4
    SolutionNameMin: Cijk_Ailk_Bjlk_BBS_BH_UserArgs_MT256x256x32_MI16x16x1_SN_LDSB1_CLR1_GSU0_GSUC0_GSUWGMRR0_K1_LBSPPA2048_LBSPPB2048_LPA0_LPB32_MIWT8_8_PLR1_SU32_SUM0_SUS256_VWA8_VWB2_WGM1_WGMXCC1_WGMXCCGn1
    SolutionIndex: 5
    SolutionNameMin: Cijk_Ailk_Bjlk_BBS_BH_UserArgs_MT256x256x32_MI16x16x1_SN_LDSB0_CLR1_GSU0_GSUC0_GSUWGMRR0_K1_LBSPPA2048_LBSPPB2048_LPA0_LPB0_MIWT8_8_PLR1_SU32_SUM0_SUS256_VWA8_VWB4_WGM1_WGMXCC1_WGMXCCGn1
    SolutionIndex: 6
    SolutionNameMin: Cijk_Ailk_Bjlk_BBS_BH_UserArgs_MT256x256x32_MI16x16x1_SN_LDSB1_CLR1_GSU0_GSUC0_GSUWGMRR0_K1_LBSPPA2048_LBSPPB2048_LPA16_LPB0_MIWT8_8_PLR1_SU32_SUM0_SUS256_VWA1_VWB8_WGM1_WGMXCC1_WGMXCCGn1
    SolutionIndex: 7
    SolutionNameMin: Cijk_Ailk_Bjlk_BBS_BH_UserArgs_MT256x256x32_MI16x16x1_SN_LDSB1_CLR1_GSU0_GSUC0_GSUWGMRR0_K1_LBSPPA2048_LBSPPB2048_LPA32_LPB0_MIWT8_8_PLR1_SU32_SUM0_SUS256_VWA2_VWB8_WGM1_WGMXCC1_WGMXCCGn1
    SolutionIndex: 8
    SolutionNameMin: Cijk_Ailk_Bjlk_BBS_BH_UserArgs_MT256x256x32_MI16x16x1_SN_LDSB0_CLR1_GSU0_GSUC0_GSUWGMRR0_K1_LBSPPA2048_LBSPPB2048_LPA0_LPB0_MIWT8_8_PLR1_SU32_SUM0_SUS256_VWA4_VWB8_WGM1_WGMXCC1_WGMXCCGn1
    SolutionIndex: 9
    SolutionNameMin: Cijk_Ailk_Bjlk_BBS_BH_UserArgs_MT256x256x32_MI16x16x1_SN_LDSB0_CLR1_GSU0_GSUC0_GSUWGMRR0_K1_LBSPPA2048_LBSPPB2048_LPA0_LPB0_MIWT8_8_PLR1_SU32_SUM0_SUS256_VWA8_VWB8_WGM1_WGMXCC1_WGMXCCGn1
    SolutionIndex: 10
    SolutionNameMin: Cijk_Ailk_Bjlk_BBS_BH_UserArgs_MT256x256x32_MI16x16x1_SN_LDSB1_CLR1_GSU0_GSUC0_GSUWGMRR0_K1_LBSPPA2048_LBSPPB2048_LPA0_LPB16_MIWT8_8_PLR1_SU32_SUM0_SUS256_VWA4_VWB1_WGM4_WGMXCC1_WGMXCCGn1
    SolutionIndex: 11
    SolutionNameMin: Cijk_Ailk_Bjlk_BBS_BH_UserArgs_MT256x256x32_MI16x16x1_SN_LDSB1_CLR1_GSU0_GSUC0_GSUWGMRR0_K1_LBSPPA2048_LBSPPB2048_LPA0_LPB16_MIWT8_8_PLR1_SU32_SUM0_SUS256_VWA8_VWB1_WGM4_WGMXCC1_WGMXCCGn1
    SolutionIndex: 12
    SolutionNameMin: Cijk_Ailk_Bjlk_BBS_BH_UserArgs_MT256x256x32_MI16x16x1_SN_LDSB1_CLR1_GSU0_GSUC0_GSUWGMRR0_K1_LBSPPA2048_LBSPPB2048_LPA0_LPB32_MIWT8_8_PLR1_SU32_SUM0_SUS256_VWA4_VWB2_WGM4_WGMXCC1_WGMXCCGn1
    SolutionIndex: 13
    SolutionNameMin: Cijk_Ailk_Bjlk_BBS_BH_UserArgs_MT256x256x32_MI16x16x1_SN_LDSB1_CLR1_GSU0_GSUC0_GSUWGMRR0_K1_LBSPPA2048_LBSPPB2048_LPA0_LPB32_MIWT8_8_PLR1_SU32_SUM0_SUS256_VWA8_VWB2_WGM4_WGMXCC1_WGMXCCGn1
    SolutionIndex: 14
    SolutionNameMin: Cijk_Ailk_Bjlk_BBS_BH_UserArgs_MT256x256x32_MI16x16x1_SN_LDSB1_CLR1_GSU0_GSUC0_GSUWGMRR0_K1_LBSPPA2048_LBSPPB2048_LPA32_LPB0_MIWT8_8_PLR1_SU32_SUM0_SUS256_VWA2_VWB4_WGM4_WGMXCC1_WGMXCCGn1
    SolutionIndex: 15
    SolutionNameMin: Cijk_Ailk_Bjlk_BBS_BH_UserArgs_MT256x256x32_MI16x16x1_SN_LDSB0_CLR1_GSU0_GSUC0_GSUWGMRR0_K1_LBSPPA2048_LBSPPB2048_LPA0_LPB0_MIWT8_8_PLR1_SU32_SUM0_SUS256_VWA8_VWB4_WGM4_WGMXCC1_WGMXCCGn1
    SolutionIndex: 16
    SolutionNameMin: Cijk_Ailk_Bjlk_BBS_BH_UserArgs_MT256x256x32_MI16x16x1_SN_LDSB1_CLR1_GSU0_GSUC0_GSUWGMRR0_K1_LBSPPA2048_LBSPPB2048_LPA32_LPB0_MIWT8_8_PLR1_SU32_SUM0_SUS256_VWA2_VWB8_WGM4_WGMXCC1_WGMXCCGn1
    SolutionIndex: 17
    SolutionNameMin: Cijk_Ailk_Bjlk_BBS_BH_UserArgs_MT256x256x32_MI16x16x1_SN_LDSB0_CLR1_GSU0_GSUC0_GSUWGMRR0_K1_LBSPPA2048_LBSPPB2048_LPA0_LPB0_MIWT8_8_PLR1_SU32_SUM0_SUS256_VWA4_VWB8_WGM4_WGMXCC1_WGMXCCGn1
    SolutionIndex: 18
    SolutionNameMin: Cijk_Ailk_Bjlk_BBS_BH_UserArgs_MT256x256x32_MI16x16x1_SN_LDSB0_CLR1_GSU0_GSUC0_GSUWGMRR0_K1_LBSPPA2048_LBSPPB2048_LPA0_LPB0_MIWT8_8_PLR1_SU32_SUM0_SUS256_VWA8_VWB8_WGM4_WGMXCC1_WGMXCCGn1
    SolutionIndex: 19
    SolutionNameMin: Cijk_Ailk_Bjlk_BBS_BH_UserArgs_MT256x256x32_MI16x16x1_SN_LDSB1_CLR1_GSU0_GSUC0_GSUWGMRR0_K1_LBSPPA2048_LBSPPB2048_LPA0_LPB16_MIWT8_8_PLR1_SU32_SUM0_SUS256_VWA8_VWB1_WGM8_WGMXCC1_WGMXCCGn1
    SolutionIndex: 20
    SolutionNameMin: Cijk_Ailk_Bjlk_BBS_BH_UserArgs_MT256x256x32_MI16x16x1_SN_LDSB1_CLR1_GSU0_GSUC0_GSUWGMRR0_K1_LBSPPA2048_LBSPPB2048_LPA0_LPB32_MIWT8_8_PLR1_SU32_SUM0_SUS256_VWA4_VWB2_WGM8_WGMXCC1_WGMXCCGn1
    SolutionIndex: 21
    SolutionNameMin: Cijk_Ailk_Bjlk_BBS_BH_UserArgs_MT256x256x32_MI16x16x1_SN_LDSB1_CLR1_GSU0_GSUC0_GSUWGMRR0_K1_LBSPPA2048_LBSPPB2048_LPA0_LPB32_MIWT8_8_PLR1_SU32_SUM0_SUS256_VWA8_VWB2_WGM8_WGMXCC1_WGMXCCGn1
    SolutionIndex: 22
    SolutionNameMin: Cijk_Ailk_Bjlk_BBS_BH_UserArgs_MT256x256x32_MI16x16x1_SN_LDSB0_CLR1_GSU0_GSUC0_GSUWGMRR0_K1_LBSPPA2048_LBSPPB2048_LPA0_LPB0_MIWT8_8_PLR1_SU32_SUM0_SUS256_VWA8_VWB4_WGM8_WGMXCC1_WGMXCCGn1
    SolutionIndex: 23
    SolutionNameMin: Cijk_Ailk_Bjlk_BBS_BH_UserArgs_MT256x256x32_MI16x16x1_SN_LDSB0_CLR1_GSU0_GSUC0_GSUWGMRR0_K1_LBSPPA2048_LBSPPB2048_LPA0_LPB0_MIWT8_8_PLR1_SU32_SUM0_SUS256_VWA4_VWB8_WGM8_WGMXCC1_WGMXCCGn1
    SolutionIndex: 24
    SolutionNameMin: Cijk_Ailk_Bjlk_BBS_BH_UserArgs_MT256x256x32_MI16x16x1_SN_LDSB0_CLR1_GSU0_GSUC0_GSUWGMRR0_K1_LBSPPA2048_LBSPPB2048_LPA0_LPB0_MIWT8_8_PLR1_SU32_SUM0_SUS256_VWA8_VWB8_WGM8_WGMXCC1_WGMXCCGn1
    SolutionIndex: 25
    SolutionNameMin: Cijk_Ailk_Bjlk_BBS_BH_UserArgs_MT128x256x32_MI16x16x1_SN_LDSB1_CLR1_GSU0_GSUC0_GSUWGMRR0_K1_LBSPPA1024_LBSPPB2048_LPA0_LPB32_MIWT4_8_PLR1_SU32_SUM0_SUS256_VWA4_VWB2_WGM1_WGMXCC1_WGMXCCGn1
    SolutionIndex: 26
    SolutionNameMin: Cijk_Ailk_Bjlk_BBS_BH_UserArgs_MT128x256x32_MI16x16x1_SN_LDSB1_CLR1_GSU0_GSUC0_GSUWGMRR0_K1_LBSPPA1024_LBSPPB2048_LPA0_LPB0_MIWT4_8_PLR1_SU32_SUM0_SUS256_VWA4_VWB4_WGM1_WGMXCC1_WGMXCCGn1
    SolutionIndex: 27
    SolutionNameMin: Cijk_Ailk_Bjlk_BBS_BH_UserArgs_MT128x256x32_MI16x16x1_SN_LDSB1_CLR1_GSU0_GSUC0_GSUWGMRR0_K1_LBSPPA1024_LBSPPB2048_LPA32_LPB0_MIWT4_8_PLR1_SU32_SUM0_SUS256_VWA2_VWB8_WGM1_WGMXCC1_WGMXCCGn1
    SolutionIndex: 28
    SolutionNameMin: Cijk_Ailk_Bjlk_BBS_BH_UserArgs_MT128x256x32_MI16x16x1_SN_LDSB1_CLR1_GSU0_GSUC0_GSUWGMRR0_K1_LBSPPA1024_LBSPPB2048_LPA0_LPB0_MIWT4_8_PLR1_SU32_SUM0_SUS256_VWA4_VWB8_WGM1_WGMXCC1_WGMXCCGn1
    SolutionIndex: 29
    SolutionNameMin: Cijk_Ailk_Bjlk_BBS_BH_UserArgs_MT128x256x32_MI16x16x1_SN_LDSB1_CLR1_GSU0_GSUC0_GSUWGMRR0_K1_LBSPPA1024_LBSPPB2048_LPA32_LPB32_MIWT4_8_PLR1_SU32_SUM0_SUS256_VWA2_VWB2_WGM4_WGMXCC1_WGMXCCGn1
    SolutionIndex: 30
    SolutionNameMin: Cijk_Ailk_Bjlk_BBS_BH_UserArgs_MT128x256x32_MI16x16x1_SN_LDSB1_CLR1_GSU0_GSUC0_GSUWGMRR0_K1_LBSPPA1024_LBSPPB2048_LPA32_LPB0_MIWT4_8_PLR1_SU32_SUM0_SUS256_VWA2_VWB4_WGM4_WGMXCC1_WGMXCCGn1
    SolutionIndex: 31
    SolutionNameMin: Cijk_Ailk_Bjlk_BBS_BH_UserArgs_MT128x256x32_MI16x16x1_SN_LDSB1_CLR1_GSU0_GSUC0_GSUWGMRR0_K1_LBSPPA1024_LBSPPB2048_LPA0_LPB0_MIWT4_8_PLR1_SU32_SUM0_SUS256_VWA4_VWB4_WGM4_WGMXCC1_WGMXCCGn1
    SolutionIndex: 32
    SolutionNameMin: Cijk_Ailk_Bjlk_BBS_BH_UserArgs_MT128x256x32_MI16x16x1_SN_LDSB1_CLR1_GSU0_GSUC0_GSUWGMRR0_K1_LBSPPA1024_LBSPPB2048_LPA0_LPB0_MIWT4_8_PLR1_SU32_SUM0_SUS256_VWA4_VWB8_WGM4_WGMXCC1_WGMXCCGn1
    SolutionIndex: 33
    SolutionNameMin: Cijk_Ailk_Bjlk_BBS_BH_UserArgs_MT128x256x32_MI16x16x1_SN_LDSB1_CLR1_GSU0_GSUC0_GSUWGMRR0_K1_LBSPPA1024_LBSPPB2048_LPA0_LPB0_MIWT4_8_PLR1_SU32_SUM0_SUS256_VWA4_VWB8_WGM8_WGMXCC1_WGMXCCGn1
    SolutionIndex: 34
    SolutionNameMin: Cijk_Ailk_Bjlk_BBS_BH_UserArgs_MT256x128x32_MI16x16x1_SN_LDSB1_CLR1_GSU0_GSUC0_GSUWGMRR0_K1_LBSPPA2048_LBSPPB1024_LPA0_LPB16_MIWT8_4_PLR1_SU32_SUM0_SUS256_VWA4_VWB1_WGM1_WGMXCC1_WGMXCCGn1
    SolutionIndex: 35
    SolutionNameMin: Cijk_Ailk_Bjlk_BBS_BH_UserArgs_MT256x128x32_MI16x16x1_SN_LDSB1_CLR1_GSU0_GSUC0_GSUWGMRR0_K1_LBSPPA2048_LBSPPB1024_LPA0_LPB16_MIWT8_4_PLR1_SU32_SUM0_SUS256_VWA8_VWB1_WGM1_WGMXCC1_WGMXCCGn1
    SolutionIndex: 36
    SolutionNameMin: Cijk_Ailk_Bjlk_BBS_BH_UserArgs_MT256x128x32_MI16x16x1_SN_LDSB1_CLR1_GSU0_GSUC0_GSUWGMRR0_K1_LBSPPA2048_LBSPPB1024_LPA0_LPB32_MIWT8_4_PLR1_SU32_SUM0_SUS256_VWA4_VWB2_WGM1_WGMXCC1_WGMXCCGn1
    SolutionIndex: 37
    SolutionNameMin: Cijk_Ailk_Bjlk_BBS_BH_UserArgs_MT256x128x32_MI16x16x1_SN_LDSB1_CLR1_GSU0_GSUC0_GSUWGMRR0_K1_LBSPPA2048_LBSPPB1024_LPA0_LPB32_MIWT8_4_PLR1_SU32_SUM0_SUS256_VWA8_VWB2_WGM1_WGMXCC1_WGMXCCGn1
    SolutionIndex: 38
    SolutionNameMin: Cijk_Ailk_Bjlk_BBS_BH_UserArgs_MT256x128x32_MI16x16x1_SN_LDSB1_CLR1_GSU0_GSUC0_GSUWGMRR0_K1_LBSPPA2048_LBSPPB1024_LPA32_LPB0_MIWT8_4_PLR1_SU32_SUM0_SUS256_VWA2_VWB4_WGM1_WGMXCC1_WGMXCCGn1
    SolutionIndex: 39
    SolutionNameMin: Cijk_Ailk_Bjlk_BBS_BH_UserArgs_MT256x128x32_MI16x16x1_SN_LDSB1_CLR1_GSU0_GSUC0_GSUWGMRR0_K1_LBSPPA2048_LBSPPB1024_LPA0_LPB0_MIWT8_4_PLR1_SU32_SUM0_SUS256_VWA4_VWB4_WGM1_WGMXCC1_WGMXCCGn1
    SolutionIndex: 40
    SolutionNameMin: Cijk_Ailk_Bjlk_BBS_BH_UserArgs_MT256x128x32_MI16x16x1_SN_LDSB1_CLR1_GSU0_GSUC0_GSUWGMRR0_K1_LBSPPA2048_LBSPPB1024_LPA0_LPB0_MIWT8_4_PLR1_SU32_SUM0_SUS256_VWA8_VWB4_WGM1_WGMXCC1_WGMXCCGn1
    SolutionIndex: 41
    SolutionNameMin: Cijk_Ailk_Bjlk_BBS_BH_UserArgs_MT256x128x32_MI16x16x1_SN_LDSB1_CLR1_GSU0_GSUC0_GSUWGMRR0_K1_LBSPPA2048_LBSPPB1024_LPA0_LPB16_MIWT8_4_PLR1_SU32_SUM0_SUS256_VWA8_VWB1_WGM4_WGMXCC1_WGMXCCGn1
    SolutionIndex: 42
    SolutionNameMin: Cijk_Ailk_Bjlk_BBS_BH_UserArgs_MT256x128x32_MI16x16x1_SN_LDSB1_CLR1_GSU0_GSUC0_GSUWGMRR0_K1_LBSPPA2048_LBSPPB1024_LPA0_LPB0_MIWT8_4_PLR1_SU32_SUM0_SUS256_VWA4_VWB4_WGM4_WGMXCC1_WGMXCCGn1
    SolutionIndex: 43
    SolutionNameMin: Cijk_Ailk_Bjlk_BBS_BH_UserArgs_MT256x128x32_MI16x16x1_SN_LDSB1_CLR1_GSU0_GSUC0_GSUWGMRR0_K1_LBSPPA2048_LBSPPB1024_LPA0_LPB16_MIWT8_4_PLR1_SU32_SUM0_SUS256_VWA4_VWB1_WGM8_WGMXCC1_WGMXCCGn1
    SolutionIndex: 44
    SolutionNameMin: Cijk_Ailk_Bjlk_BBS_BH_UserArgs_MT256x128x32_MI16x16x1_SN_LDSB1_CLR1_GSU0_GSUC0_GSUWGMRR0_K1_LBSPPA2048_LBSPPB1024_LPA0_LPB32_MIWT8_4_PLR1_SU32_SUM0_SUS256_VWA4_VWB2_WGM8_WGMXCC1_WGMXCCGn1
    SolutionIndex: 45
    SolutionNameMin: Cijk_Ailk_Bjlk_BBS_BH_UserArgs_MT256x128x32_MI16x16x1_SN_LDSB1_CLR1_GSU0_GSUC0_GSUWGMRR0_K1_LBSPPA2048_LBSPPB1024_LPA0_LPB32_MIWT8_4_PLR1_SU32_SUM0_SUS256_VWA8_VWB2_WGM8_WGMXCC1_WGMXCCGn1
    SolutionIndex: 46
    SolutionNameMin: Cijk_Ailk_Bjlk_BBS_BH_UserArgs_MT256x128x32_MI16x16x1_SN_LDSB1_CLR1_GSU0_GSUC0_GSUWGMRR0_K1_LBSPPA2048_LBSPPB1024_LPA0_LPB0_MIWT8_4_PLR1_SU32_SUM0_SUS256_VWA8_VWB4_WGM8_WGMXCC1_WGMXCCGn1
    SolutionIndex: 47
    SolutionNameMin: Cijk_Ailk_Bjlk_BBS_BH_UserArgs_MT256x64x32_MI16x16x1_SN_LDSB1_CLR1_GSU0_GSUC0_GSUWGMRR0_K1_LBSPPA2048_LBSPPB512_LPA0_LPB32_MIWT8_2_PLR1_SU32_SUM0_SUS256_VWA8_VWB2_WGM1_WGMXCC1_WGMXCCGn1
    SolutionIndex: 48
    SolutionNameMin: Cijk_Ailk_Bjlk_BBS_BH_UserArgs_MT256x64x32_MI16x16x1_SN_LDSB1_CLR1_GSU0_GSUC0_GSUWGMRR0_K1_LBSPPA2048_LBSPPB512_LPA0_LPB32_MIWT8_2_PLR1_SU32_SUM0_SUS256_VWA8_VWB2_WGM8_WGMXCC1_WGMXCCGn1
    SolutionIndex: 49
    SolutionNameMin: Cijk_Ailk_Bjlk_BBS_BH_UserArgs_MT128x128x32_MI16x16x1_SN_LDSB1_CLR1_GSU0_GSUC0_GSUWGMRR0_K1_LBSPPA1024_LBSPPB1024_LPA32_LPB0_MIWT4_4_PLR1_SU32_SUM0_SUS256_VWA2_VWB4_WGM1_WGMXCC1_WGMXCCGn1
    SolutionIndex: 50
    SolutionNameMin: Cijk_Ailk_Bjlk_BBS_BH_UserArgs_MT128x128x32_MI16x16x1_SN_LDSB0_CLR1_GSU0_GSUC0_GSUWGMRR0_K1_LBSPPA1024_LBSPPB1024_LPA0_LPB0_MIWT4_4_PLR1_SU32_SUM0_SUS256_VWA4_VWB4_WGM1_WGMXCC1_WGMXCCGn1
    SolutionIndex: 51
    SolutionNameMin: Cijk_Ailk_Bjlk_BBS_BH_UserArgs_MT128x128x32_MI16x16x1_SN_LDSB1_CLR1_GSU0_GSUC0_GSUWGMRR0_K1_LBSPPA1024_LBSPPB1024_LPA32_LPB0_MIWT4_4_PLR1_SU32_SUM0_SUS256_VWA2_VWB4_WGM8_WGMXCC1_WGMXCCGn1
    SolutionIndex: 52
    SolutionNameMin: Cijk_Ailk_Bjlk_BBS_BH_UserArgs_MT128x128x32_MI16x16x1_SN_LDSB0_CLR1_GSU0_GSUC0_GSUWGMRR0_K1_LBSPPA1024_LBSPPB1024_LPA0_LPB0_MIWT4_4_PLR1_SU32_SUM0_SUS256_VWA4_VWB4_WGM8_WGMXCC1_WGMXCCGn1
    SolutionIndex: 53
    SolutionNameMin: Cijk_Ailk_Bjlk_BBS_BH_UserArgs_MT64x128x32_MI16x16x1_SN_LDSB0_CLR1_GSU0_GSUC0_GSUWGMRR0_K1_LBSPPA512_LBSPPB1024_LPA32_LPB0_MIWT2_4_PLR1_SU32_SUM0_SUS256_VWA2_VWB4_WGM1_WGMXCC1_WGMXCCGn1
    SolutionIndex: 54
    SolutionNameMin: Cijk_Ailk_Bjlk_BBS_BH_UserArgs_MT128x64x32_MI16x16x1_SN_LDSB0_CLR1_GSU0_GSUC0_GSUWGMRR0_K1_LBSPPA1024_LBSPPB512_LPA0_LPB16_MIWT4_2_PLR1_SU32_SUM0_SUS256_VWA4_VWB1_WGM1_WGMXCC1_WGMXCCGn1
    SolutionIndex: 55
    SolutionNameMin: Cijk_Ailk_Bjlk_BBS_BH_UserArgs_MT128x64x32_MI16x16x1_SN_LDSB0_CLR1_GSU0_GSUC0_GSUWGMRR0_K1_LBSPPA1024_LBSPPB512_LPA0_LPB32_MIWT4_2_PLR1_SU32_SUM0_SUS256_VWA4_VWB2_WGM1_WGMXCC1_WGMXCCGn1
    SolutionIndex: 56
    SolutionNameMin: Cijk_Ailk_Bjlk_BBS_BH_UserArgs_MT32x32x32_MI16x16x1_SN_LDSB0_CLR1_GSU0_GSUC0_GSUWGMRR0_K1_LBSPPA256_LBSPPB256_LPA16_LPB16_MIWT1_1_PLR1_SU32_SUM0_SUS256_VWA1_VWB1_WGM1_WGMXCC1_WGMXCCGn1
    SolutionIndex: 57
    SolutionNameMin: Cijk_Ailk_Bjlk_BBS_BH_UserArgs_MT32x32x32_MI16x16x1_SN_LDSB0_CLR0_GSU0_GSUC0_GSUWGMRR0_K1_LBSPPA256_LBSPPB256_LPA16_LPB16_MIWT1_1_PLR0_SU32_SUM0_SUS256_VWA1_VWB1_WGM8_WGMXCC1_WGMXCCGn1
    SolutionIndex: 58
    SolutionNameMin: Cijk_Ailk_Bjlk_BBS_BH_UserArgs_MT256x256x64_MI16x16x1_SN_LDSB1_CLR1_GSU0_GSUC0_GSUWGMRR0_K1_LBSPPA2048_LBSPPB2048_LPA0_LPB0_MIWT8_8_PLR1_SU32_SUM0_SUS256_VWA4_VWB4_WGM1_WGMXCC1_WGMXCCGn1
    SolutionIndex: 59
    SolutionNameMin: Cijk_Ailk_Bjlk_BBS_BH_UserArgs_MT256x256x64_MI16x16x1_SN_LDSB1_CLR1_GSU0_GSUC0_GSUWGMRR0_K1_LBSPPA2048_LBSPPB2048_LPA0_LPB0_MIWT8_8_PLR1_SU32_SUM0_SUS256_VWA8_VWB4_WGM1_WGMXCC1_WGMXCCGn1
    SolutionIndex: 60
    SolutionNameMin: Cijk_Ailk_Bjlk_BBS_BH_UserArgs_MT256x256x64_MI16x16x1_SN_LDSB1_CLR1_GSU0_GSUC0_GSUWGMRR0_K1_LBSPPA2048_LBSPPB2048_LPA0_LPB0_MIWT8_8_PLR1_SU32_SUM0_SUS256_VWA8_VWB8_WGM1_WGMXCC1_WGMXCCGn1
    SolutionIndex: 61
    SolutionNameMin: Cijk_Ailk_Bjlk_BBS_BH_UserArgs_MT256x256x64_MI16x16x1_SN_LDSB1_CLR1_GSU0_GSUC0_GSUWGMRR0_K1_LBSPPA2048_LBSPPB2048_LPA0_LPB0_MIWT8_8_PLR2_SU32_SUM0_SUS256_VWA4_VWB4_WGM1_WGMXCC1_WGMXCCGn1
    SolutionIndex: 62
    SolutionNameMin: Cijk_Ailk_Bjlk_BBS_BH_UserArgs_MT256x256x64_MI16x16x1_SN_LDSB1_CLR1_GSU0_GSUC0_GSUWGMRR0_K1_LBSPPA2048_LBSPPB2048_LPA0_LPB0_MIWT8_8_PLR2_SU32_SUM0_SUS256_VWA8_VWB4_WGM1_WGMXCC1_WGMXCCGn1
    SolutionIndex: 63
    SolutionNameMin: Cijk_Ailk_Bjlk_BBS_BH_UserArgs_MT256x256x64_MI16x16x1_SN_LDSB1_CLR1_GSU0_GSUC0_GSUWGMRR0_K1_LBSPPA2048_LBSPPB2048_LPA0_LPB0_MIWT8_8_PLR2_SU32_SUM0_SUS256_VWA4_VWB8_WGM1_WGMXCC1_WGMXCCGn1
    SolutionIndex: 64
    SolutionNameMin: Cijk_Ailk_Bjlk_BBS_BH_UserArgs_MT256x256x64_MI16x16x1_SN_LDSB1_CLR1_GSU0_GSUC0_GSUWGMRR0_K1_LBSPPA2048_LBSPPB2048_LPA0_LPB0_MIWT8_8_PLR2_SU32_SUM0_SUS256_VWA8_VWB8_WGM1_WGMXCC1_WGMXCCGn1
    SolutionIndex: 65
    SolutionNameMin: Cijk_Ailk_Bjlk_BBS_BH_UserArgs_MT256x256x64_MI16x16x1_SN_LDSB1_CLR1_GSU0_GSUC0_GSUWGMRR0_K1_LBSPPA2048_LBSPPB2048_LPA0_LPB0_MIWT8_8_PLR1_SU32_SUM0_SUS256_VWA4_VWB4_WGM4_WGMXCC1_WGMXCCGn1
    SolutionIndex: 66
    SolutionNameMin: Cijk_Ailk_Bjlk_BBS_BH_UserArgs_MT256x256x64_MI16x16x1_SN_LDSB1_CLR1_GSU0_GSUC0_GSUWGMRR0_K1_LBSPPA2048_LBSPPB2048_LPA0_LPB0_MIWT8_8_PLR2_SU32_SUM0_SUS256_VWA4_VWB4_WGM4_WGMXCC1_WGMXCCGn1
    SolutionIndex: 67
    SolutionNameMin: Cijk_Ailk_Bjlk_BBS_BH_UserArgs_MT256x256x64_MI16x16x1_SN_LDSB1_CLR1_GSU0_GSUC0_GSUWGMRR0_K1_LBSPPA2048_LBSPPB2048_LPA0_LPB0_MIWT8_8_PLR2_SU32_SUM0_SUS256_VWA8_VWB4_WGM4_WGMXCC1_WGMXCCGn1
    SolutionIndex: 68
    SolutionNameMin: Cijk_Ailk_Bjlk_BBS_BH_UserArgs_MT256x256x64_MI16x16x1_SN_LDSB1_CLR1_GSU0_GSUC0_GSUWGMRR0_K1_LBSPPA2048_LBSPPB2048_LPA0_LPB0_MIWT8_8_PLR2_SU32_SUM0_SUS256_VWA8_VWB8_WGM4_WGMXCC1_WGMXCCGn1
    SolutionIndex: 69
    SolutionNameMin: Cijk_Ailk_Bjlk_BBS_BH_UserArgs_MT256x256x64_MI16x16x1_SN_LDSB1_CLR1_GSU0_GSUC0_GSUWGMRR0_K1_LBSPPA2048_LBSPPB2048_LPA0_LPB0_MIWT8_8_PLR1_SU32_SUM0_SUS256_VWA4_VWB4_WGM8_WGMXCC1_WGMXCCGn1
    SolutionIndex: 70
    SolutionNameMin: Cijk_Ailk_Bjlk_BBS_BH_UserArgs_MT256x256x64_MI16x16x1_SN_LDSB1_CLR1_GSU0_GSUC0_GSUWGMRR0_K1_LBSPPA2048_LBSPPB2048_LPA0_LPB0_MIWT8_8_PLR1_SU32_SUM0_SUS256_VWA8_VWB4_WGM8_WGMXCC1_WGMXCCGn1
    SolutionIndex: 71
    SolutionNameMin: Cijk_Ailk_Bjlk_BBS_BH_UserArgs_MT256x256x64_MI16x16x1_SN_LDSB1_CLR1_GSU0_GSUC0_GSUWGMRR0_K1_LBSPPA2048_LBSPPB2048_LPA0_LPB0_MIWT8_8_PLR2_SU32_SUM0_SUS256_VWA4_VWB4_WGM8_WGMXCC1_WGMXCCGn1
    SolutionIndex: 72
    SolutionNameMin: Cijk_Ailk_Bjlk_BBS_BH_UserArgs_MT256x256x64_MI16x16x1_SN_LDSB1_CLR1_GSU0_GSUC0_GSUWGMRR0_K1_LBSPPA2048_LBSPPB2048_LPA0_LPB0_MIWT8_8_PLR2_SU32_SUM0_SUS256_VWA8_VWB4_WGM8_WGMXCC1_WGMXCCGn1
    SolutionIndex: 73
    SolutionNameMin: Cijk_Ailk_Bjlk_BBS_BH_UserArgs_MT128x256x64_MI16x16x1_SN_LDSB1_CLR1_GSU0_GSUC0_GSUWGMRR0_K1_LBSPPA1024_LBSPPB2048_LPA0_LPB32_MIWT4_8_PLR1_SU32_SUM0_SUS256_VWA4_VWB2_WGM1_WGMXCC1_WGMXCCGn1
    SolutionIndex: 74
    SolutionNameMin: Cijk_Ailk_Bjlk_BBS_BH_UserArgs_MT128x256x64_MI16x16x1_SN_LDSB1_CLR1_GSU0_GSUC0_GSUWGMRR0_K1_LBSPPA1024_LBSPPB2048_LPA0_LPB0_MIWT4_8_PLR1_SU32_SUM0_SUS256_VWA4_VWB4_WGM1_WGMXCC1_WGMXCCGn1
    SolutionIndex: 75
    SolutionNameMin: Cijk_Ailk_Bjlk_BBS_BH_UserArgs_MT128x256x64_MI16x16x1_SN_LDSB1_CLR1_GSU0_GSUC0_GSUWGMRR0_K1_LBSPPA1024_LBSPPB2048_LPA32_LPB0_MIWT4_8_PLR1_SU32_SUM0_SUS256_VWA2_VWB8_WGM1_WGMXCC1_WGMXCCGn1
    SolutionIndex: 76
    SolutionNameMin: Cijk_Ailk_Bjlk_BBS_BH_UserArgs_MT128x256x64_MI16x16x1_SN_LDSB1_CLR1_GSU0_GSUC0_GSUWGMRR0_K1_LBSPPA1024_LBSPPB2048_LPA32_LPB0_MIWT4_8_PLR2_SU32_SUM0_SUS256_VWA2_VWB4_WGM1_WGMXCC1_WGMXCCGn1
    SolutionIndex: 77
    SolutionNameMin: Cijk_Ailk_Bjlk_BBS_BH_UserArgs_MT128x256x64_MI16x16x1_SN_LDSB1_CLR1_GSU0_GSUC0_GSUWGMRR0_K1_LBSPPA1024_LBSPPB2048_LPA0_LPB0_MIWT4_8_PLR1_SU32_SUM0_SUS256_VWA4_VWB4_WGM4_WGMXCC1_WGMXCCGn1
    SolutionIndex: 78
    SolutionNameMin: Cijk_Ailk_Bjlk_BBS_BH_UserArgs_MT128x256x64_MI16x16x1_SN_LDSB1_CLR1_GSU0_GSUC0_GSUWGMRR0_K1_LBSPPA1024_LBSPPB2048_LPA32_LPB32_MIWT4_8_PLR1_SU32_SUM0_SUS256_VWA2_VWB2_WGM8_WGMXCC1_WGMXCCGn1
    SolutionIndex: 79
    SolutionNameMin: Cijk_Ailk_Bjlk_BBS_BH_UserArgs_MT128x256x64_MI16x16x1_SN_LDSB1_CLR1_GSU0_GSUC0_GSUWGMRR0_K1_LBSPPA1024_LBSPPB2048_LPA0_LPB0_MIWT4_8_PLR1_SU32_SUM0_SUS256_VWA4_VWB4_WGM8_WGMXCC1_WGMXCCGn1
    SolutionIndex: 80
    SolutionNameMin: Cijk_Ailk_Bjlk_BBS_BH_UserArgs_MT256x128x64_MI16x16x1_SN_LDSB1_CLR1_GSU0_GSUC0_GSUWGMRR0_K1_LBSPPA2048_LBSPPB1024_LPA0_LPB32_MIWT8_4_PLR1_SU32_SUM0_SUS256_VWA4_VWB2_WGM1_WGMXCC1_WGMXCCGn1
    SolutionIndex: 81
    SolutionNameMin: Cijk_Ailk_Bjlk_BBS_BH_UserArgs_MT256x128x64_MI16x16x1_SN_LDSB1_CLR1_GSU0_GSUC0_GSUWGMRR0_K1_LBSPPA2048_LBSPPB1024_LPA0_LPB32_MIWT8_4_PLR1_SU32_SUM0_SUS256_VWA8_VWB2_WGM1_WGMXCC1_WGMXCCGn1
    SolutionIndex: 82
    SolutionNameMin: Cijk_Ailk_Bjlk_BBS_BH_UserArgs_MT256x128x64_MI16x16x1_SN_LDSB1_CLR1_GSU0_GSUC0_GSUWGMRR0_K1_LBSPPA2048_LBSPPB1024_LPA0_LPB0_MIWT8_4_PLR1_SU32_SUM0_SUS256_VWA4_VWB4_WGM1_WGMXCC1_WGMXCCGn1
    SolutionIndex: 83
    SolutionNameMin: Cijk_Ailk_Bjlk_BBS_BH_UserArgs_MT256x128x64_MI16x16x1_SN_LDSB1_CLR1_GSU0_GSUC0_GSUWGMRR0_K1_LBSPPA2048_LBSPPB1024_LPA0_LPB32_MIWT8_4_PLR2_SU32_SUM0_SUS256_VWA8_VWB2_WGM1_WGMXCC1_WGMXCCGn1
    SolutionIndex: 84
    SolutionNameMin: Cijk_Ailk_Bjlk_BBS_BH_UserArgs_MT256x128x64_MI16x16x1_SN_LDSB1_CLR1_GSU0_GSUC0_GSUWGMRR0_K1_LBSPPA2048_LBSPPB1024_LPA0_LPB0_MIWT8_4_PLR2_SU32_SUM0_SUS256_VWA4_VWB4_WGM1_WGMXCC1_WGMXCCGn1
    SolutionIndex: 85
    SolutionNameMin: Cijk_Ailk_Bjlk_BBS_BH_UserArgs_MT256x128x64_MI16x16x1_SN_LDSB1_CLR1_GSU0_GSUC0_GSUWGMRR0_K1_LBSPPA2048_LBSPPB1024_LPA0_LPB32_MIWT8_4_PLR1_SU32_SUM0_SUS256_VWA4_VWB2_WGM4_WGMXCC1_WGMXCCGn1
    SolutionIndex: 86
    SolutionNameMin: Cijk_Ailk_Bjlk_BBS_BH_UserArgs_MT256x128x64_MI16x16x1_SN_LDSB1_CLR1_GSU0_GSUC0_GSUWGMRR0_K1_LBSPPA2048_LBSPPB1024_LPA0_LPB0_MIWT8_4_PLR1_SU32_SUM0_SUS256_VWA4_VWB4_WGM4_WGMXCC1_WGMXCCGn1
    SolutionIndex: 87
    SolutionNameMin: Cijk_Ailk_Bjlk_BBS_BH_UserArgs_MT256x128x64_MI16x16x1_SN_LDSB1_CLR1_GSU0_GSUC0_GSUWGMRR0_K1_LBSPPA2048_LBSPPB1024_LPA0_LPB32_MIWT8_4_PLR2_SU32_SUM0_SUS256_VWA4_VWB2_WGM4_WGMXCC1_WGMXCCGn1
    SolutionIndex: 88
    SolutionNameMin: Cijk_Ailk_Bjlk_BBS_BH_UserArgs_MT256x128x64_MI16x16x1_SN_LDSB1_CLR1_GSU0_GSUC0_GSUWGMRR0_K1_LBSPPA2048_LBSPPB1024_LPA0_LPB32_MIWT8_4_PLR1_SU32_SUM0_SUS256_VWA4_VWB2_WGM8_WGMXCC1_WGMXCCGn1
    SolutionIndex: 89
    SolutionNameMin: Cijk_Ailk_Bjlk_BBS_BH_UserArgs_MT256x128x64_MI16x16x1_SN_LDSB1_CLR1_GSU0_GSUC0_GSUWGMRR0_K1_LBSPPA2048_LBSPPB1024_LPA0_LPB0_MIWT8_4_PLR1_SU32_SUM0_SUS256_VWA4_VWB4_WGM8_WGMXCC1_WGMXCCGn1
    SolutionIndex: 90
    SolutionNameMin: Cijk_Ailk_Bjlk_BBS_BH_UserArgs_MT256x128x64_MI16x16x1_SN_LDSB1_CLR1_GSU0_GSUC0_GSUWGMRR0_K1_LBSPPA2048_LBSPPB1024_LPA0_LPB32_MIWT8_4_PLR2_SU32_SUM0_SUS256_VWA8_VWB2_WGM8_WGMXCC1_WGMXCCGn1
    SolutionIndex: 91
    SolutionNameMin: Cijk_Ailk_Bjlk_BBS_BH_UserArgs_MT128x128x64_MI16x16x1_SN_LDSB1_CLR1_GSU0_GSUC0_GSUWGMRR0_K1_LBSPPA1024_LBSPPB1024_LPA0_LPB0_MIWT4_4_PLR1_SU32_SUM0_SUS256_VWA4_VWB4_WGM1_WGMXCC1_WGMXCCGn1
    SolutionIndex: 92
    SolutionNameMin: Cijk_Ailk_Bjlk_BBS_BH_UserArgs_MT128x128x64_MI16x16x1_SN_LDSB1_CLR1_GSU0_GSUC0_GSUWGMRR0_K1_LBSPPA1024_LBSPPB1024_LPA0_LPB32_MIWT4_4_PLR2_SU32_SUM0_SUS256_VWA4_VWB2_WGM1_WGMXCC1_WGMXCCGn1
    SolutionIndex: 93
    SolutionNameMin: Cijk_Ailk_Bjlk_BBS_BH_UserArgs_MT128x128x64_MI16x16x1_SN_LDSB1_CLR1_GSU0_GSUC0_GSUWGMRR0_K1_LBSPPA1024_LBSPPB1024_LPA0_LPB0_MIWT4_4_PLR2_SU32_SUM0_SUS256_VWA4_VWB4_WGM1_WGMXCC1_WGMXCCGn1
    SolutionIndex: 94
    SolutionNameMin: Cijk_Ailk_Bjlk_BBS_BH_UserArgs_MT128x128x64_MI16x16x1_SN_LDSB1_CLR1_GSU0_GSUC0_GSUWGMRR0_K1_LBSPPA1024_LBSPPB1024_LPA0_LPB0_MIWT4_4_PLR1_SU32_SUM0_SUS256_VWA4_VWB4_WGM4_WGMXCC1_WGMXCCGn1
    SolutionIndex: 95
    SolutionNameMin: Cijk_Ailk_Bjlk_BBS_BH_UserArgs_MT128x128x64_MI16x16x1_SN_LDSB1_CLR1_GSU0_GSUC0_GSUWGMRR0_K1_LBSPPA1024_LBSPPB1024_LPA0_LPB0_MIWT4_4_PLR2_SU32_SUM0_SUS256_VWA4_VWB4_WGM4_WGMXCC1_WGMXCCGn1
    SolutionIndex: 96
    SolutionNameMin: Cijk_Ailk_Bjlk_BBS_BH_UserArgs_MT128x128x64_MI16x16x1_SN_LDSB1_CLR1_GSU0_GSUC0_GSUWGMRR0_K1_LBSPPA1024_LBSPPB1024_LPA0_LPB0_MIWT4_4_PLR1_SU32_SUM0_SUS256_VWA4_VWB4_WGM8_WGMXCC1_WGMXCCGn1
    SolutionIndex: 97
    SolutionNameMin: Cijk_Ailk_Bjlk_BBS_BH_UserArgs_MT128x128x64_MI16x16x1_SN_LDSB1_CLR1_GSU0_GSUC0_GSUWGMRR0_K1_LBSPPA1024_LBSPPB1024_LPA0_LPB0_MIWT4_4_PLR2_SU32_SUM0_SUS256_VWA4_VWB4_WGM8_WGMXCC1_WGMXCCGn1
    SolutionIndex: 98
    SolutionNameMin: Cijk_Ailk_Bjlk_BBS_BH_UserArgs_MT64x128x64_MI16x16x1_SN_LDSB1_CLR1_GSU0_GSUC0_GSUWGMRR0_K1_LBSPPA512_LBSPPB1024_LPA32_LPB32_MIWT2_4_PLR1_SU32_SUM0_SUS256_VWA2_VWB2_WGM1_WGMXCC1_WGMXCCGn1
    SolutionIndex: 99
    SolutionNameMin: Cijk_Ailk_Bjlk_BBS_BH_UserArgs_MT64x128x64_MI16x16x1_SN_LDSB1_CLR1_GSU0_GSUC0_GSUWGMRR0_K1_LBSPPA512_LBSPPB1024_LPA32_LPB0_MIWT2_4_PLR2_SU32_SUM0_SUS256_VWA2_VWB4_WGM4_WGMXCC1_WGMXCCGn1
    SolutionIndex: 100
    SolutionNameMin: Cijk_Ailk_Bjlk_BBS_BH_UserArgs_MT128x64x64_MI16x16x1_SN_LDSB1_CLR1_GSU0_GSUC0_GSUWGMRR0_K1_LBSPPA1024_LBSPPB512_LPA0_LPB32_MIWT4_2_PLR1_SU32_SUM0_SUS256_VWA4_VWB2_WGM1_WGMXCC1_WGMXCCGn1
    SolutionIndex: 101
    SolutionNameMin: Cijk_Ailk_Bjlk_BBS_BH_UserArgs_MT128x64x64_MI16x16x1_SN_LDSB1_CLR1_GSU0_GSUC0_GSUWGMRR0_K1_LBSPPA1024_LBSPPB512_LPA0_LPB32_MIWT4_2_PLR2_SU32_SUM0_SUS256_VWA4_VWB2_WGM1_WGMXCC1_WGMXCCGn1
    SolutionIndex: 102
    SolutionNameMin: Cijk_Ailk_Bjlk_BBS_BH_UserArgs_MT128x64x64_MI16x16x1_SN_LDSB1_CLR1_GSU0_GSUC0_GSUWGMRR0_K1_LBSPPA1024_LBSPPB512_LPA0_LPB32_MIWT4_2_PLR1_SU32_SUM0_SUS256_VWA4_VWB2_WGM4_WGMXCC1_WGMXCCGn1
    SolutionIndex: 103
    SolutionNameMin: Cijk_Ailk_Bjlk_BBS_BH_UserArgs_MT128x64x64_MI16x16x1_SN_LDSB1_CLR1_GSU0_GSUC0_GSUWGMRR0_K1_LBSPPA1024_LBSPPB512_LPA0_LPB32_MIWT4_2_PLR1_SU32_SUM0_SUS256_VWA4_VWB2_WGM8_WGMXCC1_WGMXCCGn1
    SolutionIndex: 104
    SolutionNameMin: Cijk_Ailk_Bjlk_BBS_BH_UserArgs_MT128x64x64_MI16x16x1_SN_LDSB1_CLR1_GSU0_GSUC0_GSUWGMRR0_K1_LBSPPA1024_LBSPPB512_LPA0_LPB32_MIWT4_2_PLR2_SU32_SUM0_SUS256_VWA4_VWB2_WGM8_WGMXCC1_WGMXCCGn1
    SolutionIndex: 105
    SolutionNameMin: Cijk_Ailk_Bjlk_BBS_BH_UserArgs_MT64x64x64_MI16x16x1_SN_LDSB1_CLR1_GSU0_GSUC0_GSUWGMRR0_K1_LBSPPA512_LBSPPB512_LPA32_LPB32_MIWT2_2_PLR1_SU32_SUM0_SUS256_VWA2_VWB2_WGM1_WGMXCC1_WGMXCCGn1
    SolutionIndex: 106
    SolutionNameMin: Cijk_Ailk_Bjlk_BBS_BH_UserArgs_MT64x64x64_MI16x16x1_SN_LDSB1_CLR1_GSU0_GSUC0_GSUWGMRR0_K1_LBSPPA512_LBSPPB512_LPA32_LPB32_MIWT2_2_PLR2_SU32_SUM0_SUS256_VWA2_VWB2_WGM1_WGMXCC1_WGMXCCGn1
    SolutionIndex: 107
    SolutionNameMin: Cijk_Ailk_Bjlk_BBS_BH_UserArgs_MT64x64x64_MI16x16x1_SN_LDSB1_CLR1_GSU0_GSUC0_GSUWGMRR0_K1_LBSPPA512_LBSPPB512_LPA32_LPB32_MIWT2_2_PLR2_SU32_SUM0_SUS256_VWA2_VWB2_WGM8_WGMXCC1_WGMXCCGn1
    SolutionIndex: 108
    SolutionNameMin: Cijk_Ailk_Bjlk_BBS_BH_UserArgs_MT32x64x64_MI16x16x1_SN_LDSB0_CLR1_GSU0_GSUC0_GSUWGMRR0_K1_LBSPPA256_LBSPPB512_LPA16_LPB32_MIWT1_2_PLR2_SU32_SUM0_SUS256_VWA1_VWB2_WGM1_WGMXCC1_WGMXCCGn1
    SolutionIndex: 109
    SolutionNameMin: Cijk_Ailk_Bjlk_BBS_BH_UserArgs_MT64x32x64_MI16x16x1_SN_LDSB0_CLR1_GSU0_GSUC0_GSUWGMRR0_K1_LBSPPA512_LBSPPB256_LPA32_LPB16_MIWT2_1_PLR1_SU32_SUM0_SUS256_VWA2_VWB1_WGM1_WGMXCC1_WGMXCCGn1
    SolutionIndex: 110
    SolutionNameMin: Cijk_Ailk_Bjlk_BBS_BH_UserArgs_MT64x32x64_MI16x16x1_SN_LDSB0_CLR1_GSU0_GSUC0_GSUWGMRR0_K1_LBSPPA512_LBSPPB256_LPA32_LPB16_MIWT2_1_PLR2_SU32_SUM0_SUS256_VWA2_VWB1_WGM1_WGMXCC1_WGMXCCGn1
    SolutionIndex: 111
    SolutionNameMin: Cijk_Ailk_Bjlk_BBS_BH_UserArgs_MT32x32x64_MI16x16x1_SN_LDSB0_CLR1_GSU0_GSUC0_GSUWGMRR0_K1_LBSPPA256_LBSPPB256_LPA16_LPB16_MIWT1_1_PLR1_SU32_SUM0_SUS256_VWA1_VWB1_WGM1_WGMXCC1_WGMXCCGn1
    SolutionIndex: 112
    SolutionNameMin: Cijk_Ailk_Bjlk_BBS_BH_UserArgs_MT32x32x64_MI16x16x1_SN_LDSB0_CLR1_GSU0_GSUC0_GSUWGMRR0_K1_LBSPPA256_LBSPPB256_LPA16_LPB16_MIWT1_1_PLR2_SU32_SUM0_SUS256_VWA1_VWB1_WGM1_WGMXCC1_WGMXCCGn1
    SolutionIndex: 113
    SolutionNameMin: Cijk_Ailk_Bjlk_BBS_BH_UserArgs_MT128x128x128_MI16x16x1_SN_LDSB1_CLR1_GSU0_GSUC0_GSUWGMRR0_K1_LBSPPA1024_LBSPPB1024_LPA0_LPB0_MIWT4_4_PLR1_SU32_SUM0_SUS256_VWA4_VWB4_WGM1_WGMXCC1_WGMXCCGn1
    SolutionIndex: 114
    SolutionNameMin: Cijk_Ailk_Bjlk_BBS_BH_UserArgs_MT128x128x128_MI16x16x1_SN_LDSB1_CLR1_GSU0_GSUC0_GSUWGMRR0_K1_LBSPPA1024_LBSPPB1024_LPA0_LPB0_MIWT4_4_PLR1_SU32_SUM0_SUS256_VWA4_VWB4_WGM4_WGMXCC1_WGMXCCGn1
    SolutionIndex: 115
    SolutionNameMin: Cijk_Ailk_Bjlk_BBS_BH_UserArgs_MT64x128x128_MI16x16x1_SN_LDSB1_CLR1_GSU0_GSUC0_GSUWGMRR0_K1_LBSPPA512_LBSPPB1024_LPA32_LPB0_MIWT2_4_PLR2_SU32_SUM0_SUS256_VWA2_VWB4_WGM1_WGMXCC1_WGMXCCGn1
    SolutionIndex: 116
    SolutionNameMin: Cijk_Ailk_Bjlk_BBS_BH_UserArgs_MT128x64x128_MI16x16x1_SN_LDSB1_CLR1_GSU0_GSUC0_GSUWGMRR0_K1_LBSPPA1024_LBSPPB512_LPA0_LPB32_MIWT4_2_PLR2_SU32_SUM0_SUS256_VWA4_VWB2_WGM1_WGMXCC1_WGMXCCGn1
    SolutionIndex: 117
    SolutionNameMin: Cijk_Ailk_Bjlk_BBS_BH_UserArgs_MT128x64x128_MI16x16x1_SN_LDSB1_CLR1_GSU0_GSUC0_GSUWGMRR0_K1_LBSPPA1024_LBSPPB512_LPA0_LPB32_MIWT4_2_PLR2_SU32_SUM0_SUS256_VWA4_VWB2_WGM4_WGMXCC1_WGMXCCGn1
    SolutionIndex: 118
    SolutionNameMin: Cijk_Ailk_Bjlk_BBS_BH_UserArgs_MT128x64x128_MI16x16x1_SN_LDSB1_CLR1_GSU0_GSUC0_GSUWGMRR0_K1_LBSPPA1024_LBSPPB512_LPA0_LPB32_MIWT4_2_PLR2_SU32_SUM0_SUS256_VWA4_VWB2_WGM8_WGMXCC1_WGMXCCGn1
    SolutionIndex: 119
    SolutionNameMin: Cijk_Ailk_Bjlk_BBS_BH_UserArgs_MT64x64x128_MI16x16x1_SN_LDSB1_CLR1_GSU0_GSUC0_GSUWGMRR0_K1_LBSPPA512_LBSPPB512_LPA32_LPB32_MIWT2_2_PLR2_SU32_SUM0_SUS256_VWA2_VWB2_WGM1_WGMXCC1_WGMXCCGn1
    SolutionIndex: 120
    SolutionNameMin: Cijk_Ailk_Bjlk_BBS_BH_UserArgs_MT64x64x128_MI16x16x1_SN_LDSB1_CLR1_GSU0_GSUC0_GSUWGMRR0_K1_LBSPPA512_LBSPPB512_LPA32_LPB32_MIWT2_2_PLR2_SU32_SUM0_SUS256_VWA2_VWB2_WGM4_WGMXCC1_WGMXCCGn1
    SolutionIndex: 121
    SolutionNameMin: Cijk_Ailk_Bjlk_BBS_BH_UserArgs_MT64x64x128_MI16x16x1_SN_LDSB1_CLR1_GSU0_GSUC0_GSUWGMRR0_K1_LBSPPA512_LBSPPB512_LPA32_LPB32_MIWT2_2_PLR2_SU32_SUM0_SUS256_VWA2_VWB2_WGM8_WGMXCC1_WGMXCCGn1
    SolutionIndex: 122
    SolutionNameMin: Cijk_Ailk_Bjlk_BBS_BH_UserArgs_MT32x64x128_MI16x16x1_SN_LDSB1_CLR1_GSU0_GSUC0_GSUWGMRR0_K1_LBSPPA256_LBSPPB512_LPA16_LPB32_MIWT1_2_PLR2_SU32_SUM0_SUS256_VWA1_VWB2_WGM1_WGMXCC1_WGMXCCGn1
    SolutionIndex: 123
    SolutionNameMin: Cijk_Ailk_Bjlk_BBS_BH_UserArgs_MT64x32x128_MI16x16x1_SN_LDSB1_CLR1_GSU0_GSUC0_GSUWGMRR0_K1_LBSPPA512_LBSPPB256_LPA32_LPB16_MIWT2_1_PLR2_SU32_SUM0_SUS256_VWA2_VWB1_WGM1_WGMXCC1_WGMXCCGn1
    SolutionIndex: 124
    SolutionNameMin: Cijk_Ailk_Bjlk_BBS_BH_UserArgs_MT64x32x128_MI16x16x1_SN_LDSB1_CLR1_GSU0_GSUC0_GSUWGMRR0_K1_LBSPPA512_LBSPPB256_LPA32_LPB16_MIWT2_1_PLR2_SU32_SUM0_SUS256_VWA2_VWB1_WGM4_WGMXCC1_WGMXCCGn1
    SolutionIndex: 125
    SolutionNameMin: Cijk_Ailk_Bjlk_BBS_BH_UserArgs_MT32x32x128_MI16x16x1_SN_LDSB1_CLR1_GSU0_GSUC0_GSUWGMRR0_K1_LBSPPA256_LBSPPB256_LPA16_LPB16_MIWT1_1_PLR1_SU32_SUM0_SUS256_VWA1_VWB1_WGM1_WGMXCC1_WGMXCCGn1
    SolutionIndex: 126
    SolutionNameMin: Cijk_Ailk_Bjlk_BBS_BH_UserArgs_MT32x32x128_MI16x16x1_SN_LDSB1_CLR1_GSU0_GSUC0_GSUWGMRR0_K1_LBSPPA256_LBSPPB256_LPA16_LPB16_MIWT1_1_PLR2_SU32_SUM0_SUS256_VWA1_VWB1_WGM1_WGMXCC1_WGMXCCGn1
    SolutionIndex: 127
    SolutionNameMin: Cijk_Ailk_Bjlk_BBS_BH_UserArgs_MT32x32x32_MI16x16x1_SN_LDSB0_CLR1_GSU0_GSUC0_GSUWGMRR0_K1_LBSPPA256_LBSPPB256_LPA16_LPB16_MIWT1_1_PLR1_SU32_SUM0_SUS256_VWA1_VWB1_WGM8_WGMXCC1_WGMXCCGn1
- - - [128, 128, 1, 128, 128, 128, 128, 128]
    - [57, 0.082]
  - - [128, 128, 1, 256, 128, 128, 128, 128]
    - [125, 0.145]
  - - [128, 128, 1, 512, 128, 128, 128, 128]
    - [111, 0.23]
  - - [128, 128, 1, 1024, 128, 128, 128, 128]
    - [126, 0.334]
  - - [128, 128, 1, 2048, 128, 128, 128, 128]
    - [125, 0.504]
  - - [128, 128, 1, 4096, 128, 128, 128, 128]
    - [108, 0.82]
  - - [128, 128, 1, 8192, 128, 128, 128, 128]
    - [122, 1.208]
  - - [128, 256, 1, 128, 128, 128, 128, 256]
    - [56, 0.166]
  - - [128, 256, 1, 256, 128, 128, 128, 256]
    - [112, 0.287]
  - - [128, 256, 1, 512, 128, 128, 128, 256]
    - [112, 0.462]
  - - [128, 256, 1, 1024, 128, 128, 128, 256]
    - [111, 0.665]
  - - [128, 256, 1, 2048, 128, 128, 128, 256]
    - [122, 0.915]
  - - [128, 256, 1, 4096, 128, 128, 128, 256]
    - [106, 1.344]
  - - [128, 256, 1, 8192, 128, 128, 128, 256]
    - [119, 1.96]
  - - [128, 512, 1, 128, 128, 128, 128, 512]
    - [110, 0.306]
  - - [128, 512, 1, 256, 128, 128, 128, 512]
    - [109, 0.531]
  - - [128, 512, 1, 512, 128, 128, 128, 512]
    - [123, 0.848]
  - - [128, 512, 1, 1024, 128, 128, 128, 512]
    - [123, 1.22]
  - - [128, 512, 1, 2048, 128, 128, 128, 512]
    - [119, 1.572]
  - - [128, 512, 1, 4096, 128, 128, 128, 512]
    - [102, 2.196]
  - - [128, 512, 1, 8192, 128, 128, 128, 512]
    - [116, 2.952]
  - - [128, 1024, 1, 128, 128, 128, 128, 1024]
    - [105, 0.561]
  - - [128, 1024, 1, 256, 128, 128, 128, 1024]
    - [106, 0.968]
  - - [128, 1024, 1, 512, 128, 128, 128, 1024]
    - [119, 1.5]
  - - [128, 1024, 1, 1024, 128, 128, 128, 1024]
    - [119, 2.106]
  - - [128, 1024, 1, 2048, 128, 128, 128, 1024]
    - [119, 2.548]
  - - [128, 1024, 1, 4096, 128, 128, 128, 1024]
    - [96, 3.226]
  - - [128, 1024, 1, 8192, 128, 128, 128, 1024]
    - [114, 4.542]
  - - [128, 2048, 1, 128, 128, 128, 128, 2048]
    - [55, 0.956]
  - - [128, 2048, 1, 256, 128, 128, 128, 2048]
    - [55, 1.545]
  - - [128, 2048, 1, 512, 128, 128, 128, 2048]
    - [101, 2.296]
  - - [128, 2048, 1, 1024, 128, 128, 128, 2048]
    - [116, 2.933]
  - - [128, 2048, 1, 2048, 128, 128, 128, 2048]
    - [116, 3.719]
  - - [128, 2048, 1, 4096, 128, 128, 128, 2048]
    - [114, 4.791]
  - - [128, 2048, 1, 8192, 128, 128, 128, 2048]
    - [91, 6.058]
  - - [128, 4096, 1, 128, 128, 128, 128, 4096]
    - [49, 1.454]
  - - [128, 4096, 1, 256, 128, 128, 128, 4096]
    - [92, 2.303]
  - - [128, 4096, 1, 512, 128, 128, 128, 4096]
    - [97, 3.401]
  - - [128, 4096, 1, 1024, 128, 128, 128, 4096]
    - [52, 4.064]
  - - [128, 4096, 1, 2048, 128, 128, 128, 4096]
    - [93, 5.262]
  - - [128, 4096, 1, 4096, 128, 128, 128, 4096]
    - [114, 6.122]
  - - [128, 4096, 1, 8192, 128, 128, 128, 4096]
    - [114, 7.149]
  - - [128, 8192, 1, 128, 128, 128, 128, 8192]
    - [33, 1.944]
  - - [128, 8192, 1, 256, 128, 128, 128, 8192]
    - [28, 3.091]
  - - [128, 8192, 1, 512, 128, 128, 128, 8192]
    - [27, 4.384]
  - - [128, 8192, 1, 1024, 128, 128, 128, 8192]
    - [29, 5.162]
  - - [128, 8192, 1, 2048, 128, 128, 128, 8192]
    - [75, 6.028]
  - - [128, 8192, 1, 4096, 128, 128, 128, 8192]
    - [114, 7.011]
  - - [128, 8192, 1, 8192, 128, 128, 128, 8192]
    - [78, 7.556]
  - - [256, 128, 1, 128, 256, 256, 256, 128]
    - [56, 0.166]
  - - [256, 128, 1, 256, 256, 256, 256, 128]
    - [112, 0.292]
  - - [256, 128, 1, 512, 256, 256, 256, 128]
    - [112, 0.457]
  - - [256, 128, 1, 1024, 256, 256, 256, 128]
    - [125, 0.662]
  - - [256, 128, 1, 2048, 256, 256, 256, 128]
    - [123, 0.918]
  - - [256, 128, 1, 4096, 256, 256, 256, 128]
    - [105, 1.339]
  - - [256, 128, 1, 8192, 256, 256, 256, 128]
    - [105, 1.854]
  - - [256, 256, 1, 128, 256, 256, 256, 256]
    - [110, 0.311]
  - - [256, 256, 1, 256, 256, 256, 256, 256]
    - [110, 0.522]
  - - [256, 256, 1, 512, 256, 256, 256, 256]
    - [123, 0.835]
  - - [256, 256, 1, 1024, 256, 256, 256, 256]
    - [123, 1.194]
  - - [256, 256, 1, 2048, 256, 256, 256, 256]
    - [124, 1.548]
  - - [256, 256, 1, 4096, 256, 256, 256, 256]
    - [104, 2.223]
  - - [256, 256, 1, 8192, 256, 256, 256, 256]
    - [116, 2.884]
  - - [256, 512, 1, 128, 256, 256, 256, 512]
    - [106, 0.566]
  - - [256, 512, 1, 256, 256, 256, 256, 512]
    - [106, 0.956]
  - - [256, 512, 1, 512, 256, 256, 256, 512]
    - [119, 1.493]
  - - [256, 512, 1, 1024, 256, 256, 256, 512]
    - [119, 2.105]
  - - [256, 512, 1, 2048, 256, 256, 256, 512]
    - [119, 2.642]
  - - [256, 512, 1, 4096, 256, 256, 256, 512]
    - [94, 3.21]
  - - [256, 512, 1, 8192, 256, 256, 256, 512]
    - [113, 4.652]
  - - [256, 1024, 1, 128, 256, 256, 256, 1024]
    - [53, 0.955]
  - - [256, 1024, 1, 256, 256, 256, 256, 1024]
    - [55, 1.542]
  - - [256, 1024, 1, 512, 256, 256, 256, 1024]
    - [99, 2.267]
  - - [256, 1024, 1, 1024, 256, 256, 256, 1024]
    - [115, 3.084]
  - - [256, 1024, 1, 2048, 256, 256, 256, 1024]
    - [116, 3.663]
  - - [256, 1024, 1, 4096, 256, 256, 256, 1024]
    - [94, 4.835]
  - - [256, 1024, 1, 8192, 256, 256, 256, 1024]
    - [97, 5.805]
  - - [256, 2048, 1, 128, 256, 256, 256, 2048]
    - [50, 1.435]
  - - [256, 2048, 1, 256, 256, 256, 256, 2048]
    - [91, 2.425]
  - - [256, 2048, 1, 512, 256, 256, 256, 2048]
    - [93, 3.502]
  - - [256, 2048, 1, 1024, 256, 256, 256, 2048]
    - [93, 4.552]
  - - [256, 2048, 1, 2048, 256, 256, 256, 2048]
    - [96, 5.459]
  - - [256, 2048, 1, 4096, 256, 256, 256, 2048]
    - [114, 6.221]
  - - [256, 2048, 1, 8192, 256, 256, 256, 2048]
    - [31, 6.43]
  - - [256, 4096, 1, 128, 256, 256, 256, 4096]
    - [30, 1.824]
  - - [256, 4096, 1, 256, 256, 256, 256, 4096]
    - [46, 3.121]
  - - [256, 4096, 1, 512, 256, 256, 256, 4096]
    - [38, 4.445]
  - - [256, 4096, 1, 1024, 256, 256, 256, 4096]
    - [42, 5.679]
  - - [256, 4096, 1, 2048, 256, 256, 256, 4096]
    - [76, 6.193]
  - - [256, 4096, 1, 4096, 256, 256, 256, 4096]
    - [80, 6.985]
  - - [256, 4096, 1, 8192, 256, 256, 256, 4096]
    - [88, 8.047]
  - - [256, 8192, 1, 128, 256, 256, 256, 8192]
    - [21, 2.486]
  - - [256, 8192, 1, 256, 256, 256, 256, 8192]
    - [19, 3.793]
  - - [256, 8192, 1, 512, 256, 256, 256, 8192]
    - [19, 5.158]
  - - [256, 8192, 1, 1024, 256, 256, 256, 8192]
    - [18, 6.431]
  - - [256, 8192, 1, 2048, 256, 256, 256, 8192]
    - [58, 7.085]
  - - [256, 8192, 1, 4096, 256, 256, 256, 8192]
    - [65, 8.164]
  - - [256, 8192, 1, 8192, 256, 256, 256, 8192]
    - [71, 9.099]
  - - [512, 128, 1, 128, 512, 512, 512, 128]
    - [108, 0.307]
  - - [512, 128, 1, 256, 512, 512, 512, 128]
    - [110, 0.534]
  - - [512, 128, 1, 512, 512, 512, 512, 128]
    - [123, 0.854]
  - - [512, 128, 1, 1024, 512, 512, 512, 128]
    - [123, 1.225]
  - - [512, 128, 1, 2048, 512, 512, 512, 128]
    - [123, 1.556]
  - - [512, 128, 1, 4096, 512, 512, 512, 128]
    - [103, 2.221]
  - - [512, 128, 1, 8192, 512, 512, 512, 128]
    - [116, 2.94]
  - - [512, 256, 1, 128, 512, 512, 512, 256]
    - [105, 0.566]
  - - [512, 256, 1, 256, 512, 512, 512, 256]
    - [105, 0.963]
  - - [512, 256, 1, 512, 512, 512, 512, 256]
    - [105, 1.479]
  - - [512, 256, 1, 1024, 512, 512, 512, 256]
    - [120, 2.074]
  - - [512, 256, 1, 2048, 512, 512, 512, 256]
    - [119, 2.655]
  - - [512, 256, 1, 4096, 512, 512, 512, 256]
    - [94, 3.494]
  - - [512, 256, 1, 8192, 512, 512, 512, 256]
    - [114, 4.639]
  - - [512, 512, 1, 128, 512, 512, 512, 512]
    - [53, 0.961]
  - - [512, 512, 1, 256, 512, 512, 512, 512]
    - [98, 1.58]
  - - [512, 512, 1, 512, 512, 512, 512, 512]
    - [101, 2.315]
  - - [512, 512, 1, 1024, 512, 512, 512, 512]
    - [118, 3.072]
  - - [512, 512, 1, 2048, 512, 512, 512, 512]
    - [117, 3.594]
  - - [512, 512, 1, 4096, 512, 512, 512, 512]
    - [114, 4.842]
  - - [512, 512, 1, 8192, 512, 512, 512, 512]
    - [96, 6.045]
  - - [512, 1024, 1, 128, 512, 512, 512, 1024]
    - [51, 1.476]
  - - [512, 1024, 1, 256, 512, 512, 512, 1024]
    - [91, 2.436]
  - - [512, 1024, 1, 512, 512, 512, 512, 1024]
    - [94, 3.608]
  - - [512, 1024, 1, 1024, 512, 512, 512, 1024]
    - [94, 4.538]
  - - [512, 1024, 1, 2048, 512, 512, 512, 1024]
    - [96, 5.586]
  - - [512, 1024, 1, 4096, 512, 512, 512, 1024]
    - [114, 6.322]
  - - [512, 1024, 1, 8192, 512, 512, 512, 1024]
    - [85, 6.7]
  - - [512, 2048, 1, 128, 512, 512, 512, 2048]
    - [37, 1.967]
  - - [512, 2048, 1, 256, 512, 512, 512, 2048]
    - [43, 3.086]
  - - [512, 2048, 1, 512, 512, 512, 512, 2048]
    - [37, 4.442]
  - - [512, 2048, 1, 1024, 512, 512, 512, 2048]
    - [32, 5.544]
  - - [512, 2048, 1, 2048, 512, 512, 512, 2048]
    - [77, 6.326]
  - - [512, 2048, 1, 4096, 512, 512, 512, 2048]
    - [88, 7.177]
  - - [512, 2048, 1, 8192, 512, 512, 512, 2048]
    - [87, 7.444]
  - - [512, 4096, 1, 128, 512, 512, 512, 4096]
    - [59, 2.369]
  - - [512, 4096, 1, 256, 512, 512, 512, 4096]
    - [19, 3.792]
  - - [512, 4096, 1, 512, 512, 512, 512, 4096]
    - [24, 5.253]
  - - [512, 4096, 1, 1024, 512, 512, 512, 4096]
    - [24, 6.601]
  - - [512, 4096, 1, 2048, 512, 512, 512, 4096]
    - [89, 6.97]
  - - [512, 4096, 1, 4096, 512, 512, 512, 4096]
    - [10, 8.127]
  - - [512, 4096, 1, 8192, 512, 512, 512, 4096]
    - [6, 8.291]
  - - [512, 8192, 1, 128, 512, 512, 512, 8192]
    - [60, 2.368]
  - - [512, 8192, 1, 256, 512, 512, 512, 8192]
    - [36, 3.243]
  - - [512, 8192, 1, 512, 512, 512, 512, 8192]
    - [7, 4.714]
  - - [512, 8192, 1, 1024, 512, 512, 512, 8192]
    - [23, 6.488]
  - - [512, 8192, 1, 2048, 512, 512, 512, 8192]
    - [20, 7.889]
  - - [512, 8192, 1, 4096, 512, 512, 512, 8192]
    - [9, 8.948]
  - - [512, 8192, 1, 8192, 512, 512, 512, 8192]
    - [61, 9.508]
  - - [1024, 128, 1, 128, 1024, 1024, 1024, 128]
    - [106, 0.575]
  - - [1024, 128, 1, 256, 1024, 1024, 1024, 128]
    - [107, 0.984]
  - - [1024, 128, 1, 512, 1024, 1024, 1024, 128]
    - [106, 1.483]
  - - [1024, 128, 1, 1024, 1024, 1024, 1024, 128]
    - [121, 2.081]
  - - [1024, 128, 1, 2048, 1024, 1024, 1024, 128]
    - [101, 2.366]
  - - [1024, 128, 1, 4096, 1024, 1024, 1024, 128]
    - [94, 3.464]
  - - [1024, 128, 1, 8192, 1024, 1024, 1024, 128]
    - [96, 4.526]
  - - [1024, 256, 1, 128, 1024, 1024, 1024, 256]
    - [53, 0.954]
  - - [1024, 256, 1, 256, 1024, 1024, 1024, 256]
    - [101, 1.559]
  - - [1024, 256, 1, 512, 1024, 1024, 1024, 256]
    - [101, 2.313]
  - - [1024, 256, 1, 1024, 1024, 1024, 1024, 256]
    - [116, 3.086]
  - - [1024, 256, 1, 2048, 1024, 1024, 1024, 256]
    - [91, 3.651]
  - - [1024, 256, 1, 4096, 1024, 1024, 1024, 256]
    - [91, 4.911]
  - - [1024, 256, 1, 8192, 1024, 1024, 1024, 256]
    - [91, 6.05]
  - - [1024, 512, 1, 128, 1024, 1024, 1024, 512]
    - [47, 1.474]
  - - [1024, 512, 1, 256, 1024, 1024, 1024, 512]
    - [91, 2.425]
  - - [1024, 512, 1, 512, 1024, 1024, 1024, 512]
    - [91, 3.647]
  - - [1024, 512, 1, 1024, 1024, 1024, 1024, 512]
    - [94, 4.664]
  - - [1024, 512, 1, 2048, 1024, 1024, 1024, 512]
    - [91, 5.673]
  - - [1024, 512, 1, 4096, 1024, 1024, 1024, 512]
    - [114, 6.151]
  - - [1024, 512, 1, 8192, 1024, 1024, 1024, 512]
    - [36, 7.091]
  - - [1024, 1024, 1, 128, 1024, 1024, 1024, 1024]
    - [46, 1.992]
  - - [1024, 1024, 1, 256, 1024, 1024, 1024, 1024]
    - [34, 3.089]
  - - [1024, 1024, 1, 512, 1024, 1024, 1024, 1024]
    - [39, 4.46]
  - - [1024, 1024, 1, 1024, 1024, 1024, 1024, 1024]
    - [25, 5.591]
  - - [1024, 1024, 1, 2048, 1024, 1024, 1024, 1024]
    - [79, 6.482]
  - - [1024, 1024, 1, 4096, 1024, 1024, 1024, 1024]
    - [32, 7.191]
  - - [1024, 1024, 1, 8192, 1024, 1024, 1024, 1024]
    - [65, 8.212]
  - - [1024, 2048, 1, 128, 1024, 1024, 1024, 2048]
    - [9, 2.443]
  - - [1024, 2048, 1, 256, 1024, 1024, 1024, 2048]
    - [24, 3.795]
  - - [1024, 2048, 1, 512, 1024, 1024, 1024, 2048]
    - [24, 5.356]
  - - [1024, 2048, 1, 1024, 1024, 1024, 1024, 2048]
    - [9, 6.639]
  - - [1024, 2048, 1, 2048, 1024, 1024, 1024, 2048]
    - [58, 7.3]
  - - [1024, 2048, 1, 4096, 1024, 1024, 1024, 2048]
    - [58, 8.186]
  - - [1024, 2048, 1, 8192, 1024, 1024, 1024, 2048]
    - [58, 9.14]
  - - [1024, 4096, 1, 128, 1024, 1024, 1024, 4096]
    - [72, 2.438]
  - - [1024, 4096, 1, 256, 1024, 1024, 1024, 4096]
    - [82, 3.187]
  - - [1024, 4096, 1, 512, 1024, 1024, 1024, 4096]
    - [39, 4.755]
  - - [1024, 4096, 1, 1024, 1024, 1024, 1024, 4096]
    - [71, 6.318]
  - - [1024, 4096, 1, 2048, 1024, 1024, 1024, 4096]
    - [0, 7.242]
  - - [1024, 4096, 1, 4096, 1024, 1024, 1024, 4096]
    - [9, 8.894]
  - - [1024, 4096, 1, 8192, 1024, 1024, 1024, 4096]
    - [71, 9.432]
  - - [1024, 8192, 1, 128, 1024, 1024, 1024, 8192]
    - [64, 2.505]
  - - [1024, 8192, 1, 256, 1024, 1024, 1024, 8192]
    - [70, 3.905]
  - - [1024, 8192, 1, 512, 1024, 1024, 1024, 8192]
    - [23, 5.362]
  - - [1024, 8192, 1, 1024, 1024, 1024, 1024, 8192]
    - [71, 7.06]
  - - [1024, 8192, 1, 2048, 1024, 1024, 1024, 8192]
    - [14, 8.002]
  - - [1024, 8192, 1, 4096, 1024, 1024, 1024, 8192]
    - [69, 9.15]
  - - [1024, 8192, 1, 8192, 1024, 1024, 1024, 8192]
    - [16, 9.306]
  - - [2048, 128, 1, 128, 2048, 2048, 2048, 128]
    - [54, 0.941]
  - - [2048, 128, 1, 256, 2048, 2048, 2048, 128]
    - [100, 1.568]
  - - [2048, 128, 1, 512, 2048, 2048, 2048, 128]
    - [101, 2.335]
  - - [2048, 128, 1, 1024, 2048, 2048, 2048, 128]
    - [101, 2.988]
  - - [2048, 128, 1, 2048, 2048, 2048, 2048, 128]
    - [101, 3.582]
  - - [2048, 128, 1, 4096, 2048, 2048, 2048, 128]
    - [114, 4.617]
  - - [2048, 128, 1, 8192, 2048, 2048, 2048, 128]
    - [95, 5.833]
  - - [2048, 256, 1, 128, 2048, 2048, 2048, 256]
    - [50, 1.504]
  - - [2048, 256, 1, 256, 2048, 2048, 2048, 256]
    - [91, 2.46]
  - - [2048, 256, 1, 512, 2048, 2048, 2048, 256]
    - [91, 3.554]
  - - [2048, 256, 1, 1024, 2048, 2048, 2048, 256]
    - [93, 4.563]
  - - [2048, 256, 1, 2048, 2048, 2048, 2048, 256]
    - [91, 5.675]
  - - [2048, 256, 1, 4096, 2048, 2048, 2048, 256]
    - [114, 6.032]
  - - [2048, 256, 1, 8192, 2048, 2048, 2048, 256]
    - [44, 7.041]
  - - [2048, 512, 1, 128, 2048, 2048, 2048, 512]
    - [45, 1.988]
  - - [2048, 512, 1, 256, 2048, 2048, 2048, 512]
    - [37, 3.176]
  - - [2048, 512, 1, 512, 2048, 2048, 2048, 512]
    - [33, 4.463]
  - - [2048, 512, 1, 1024, 2048, 2048, 2048, 512]
    - [28, 5.624]
  - - [2048, 512, 1, 2048, 2048, 2048, 2048, 512]
    - [74, 6.516]
  - - [2048, 512, 1, 4096, 2048, 2048, 2048, 512]
    - [82, 7.188]
  - - [2048, 512, 1, 8192, 2048, 2048, 2048, 512]
    - [65, 8.195]
  - - [2048, 1024, 1, 128, 2048, 2048, 2048, 1024]
    - [24, 2.432]
  - - [2048, 1024, 1, 256, 2048, 2048, 2048, 1024]
    - [23, 3.782]
  - - [2048, 1024, 1, 512, 2048, 2048, 2048, 1024]
    - [9, 5.384]
  - - [2048, 1024, 1, 1024, 2048, 2048, 2048, 1024]
    - [9, 6.578]
  - - [2048, 1024, 1, 2048, 2048, 2048, 2048, 1024]
    - [61, 7.287]
  - - [2048, 1024, 1, 4096, 2048, 2048, 2048, 1024]
    - [9, 8.29]
  - - [2048, 1024, 1, 8192, 2048, 2048, 2048, 1024]
    - [65, 9.073]
  - - [2048, 2048, 1, 128, 2048, 2048, 2048, 2048]
    - [68, 2.552]
  - - [2048, 2048, 1, 256, 2048, 2048, 2048, 2048]
    - [84, 3.33]
  - - [2048, 2048, 1, 512, 2048, 2048, 2048, 2048]
    - [36, 4.799]
  - - [2048, 2048, 1, 1024, 2048, 2048, 2048, 2048]
    - [3, 6.6]
  - - [2048, 2048, 1, 2048, 2048, 2048, 2048, 2048]
    - [20, 8.017]
  - - [2048, 2048, 1, 4096, 2048, 2048, 2048, 2048]
    - [61, 8.967]
  - - [2048, 2048, 1, 8192, 2048, 2048, 2048, 2048]
    - [69, 9.391]
  - - [2048, 4096, 1, 128, 2048, 2048, 2048, 4096]
    - [81, 2.612]
  - - [2048, 4096, 1, 256, 2048, 2048, 2048, 4096]
    - [58, 3.937]
  - - [2048, 4096, 1, 512, 2048, 2048, 2048, 4096]
    - [8, 5.533]
  - - [2048, 4096, 1, 1024, 2048, 2048, 2048, 4096]
    - [66, 6.853]
  - - [2048, 4096, 1, 2048, 2048, 2048, 2048, 4096]
    - [8, 8.352]
  - - [2048, 4096, 1, 4096, 2048, 2048, 2048, 4096]
    - [65, 9.105]
  - - [2048, 4096, 1, 8192, 2048, 2048, 2048, 4096]
    - [24, 9.521]
  - - [2048, 8192, 1, 128, 2048, 2048, 2048, 8192]
    - [63, 2.85]
  - - [2048, 8192, 1, 256, 2048, 2048, 2048, 8192]
    - [61, 4.14]
  - - [2048, 8192, 1, 512, 2048, 2048, 2048, 8192]
    - [14, 6.095]
  - - [2048, 8192, 1, 1024, 2048, 2048, 2048, 8192]
    - [66, 7.23]
  - - [2048, 8192, 1, 2048, 2048, 2048, 2048, 8192]
    - [65, 8.71]
  - - [2048, 8192, 1, 4096, 2048, 2048, 2048, 8192]
    - [3, 9.269]
  - - [2048, 8192, 1, 8192, 2048, 2048, 2048, 8192]
    - [58, 9.47]
  - - [4096, 128, 1, 128, 4096, 4096, 4096, 128]
    - [48, 1.505]
  - - [4096, 128, 1, 256, 4096, 4096, 4096, 128]
    - [96, 2.404]
  - - [4096, 128, 1, 512, 4096, 4096, 4096, 128]
    - [91, 3.469]
  - - [4096, 128, 1, 1024, 4096, 4096, 4096, 128]
    - [96, 4.606]
  - - [4096, 128, 1, 2048, 4096, 4096, 4096, 128]
    - [96, 5.54]
  - - [4096, 128, 1, 4096, 4096, 4096, 4096, 128]
    - [94, 6.141]
  - - [4096, 128, 1, 8192, 4096, 4096, 4096, 128]
    - [82, 7.151]
  - - [4096, 256, 1, 128, 4096, 4096, 4096, 256]
    - [34, 2.072]
  - - [4096, 256, 1, 256, 4096, 4096, 4096, 256]
    - [35, 3.246]
  - - [4096, 256, 1, 512, 4096, 4096, 4096, 256]
    - [26, 4.486]
  - - [4096, 256, 1, 1024, 4096, 4096, 4096, 256]
    - [36, 5.675]
  - - [4096, 256, 1, 2048, 4096, 4096, 4096, 256]
    - [74, 6.496]
  - - [4096, 256, 1, 4096, 4096, 4096, 4096, 256]
    - [82, 7.217]
  - - [4096, 256, 1, 8192, 4096, 4096, 4096, 256]
    - [8, 8.183]
  - - [4096, 512, 1, 128, 4096, 4096, 4096, 512]
    - [9, 2.521]
  - - [4096, 512, 1, 256, 4096, 4096, 4096, 512]
    - [13, 3.748]
  - - [4096, 512, 1, 512, 4096, 4096, 4096, 512]
    - [24, 5.351]
  - - [4096, 512, 1, 1024, 4096, 4096, 4096, 512]
    - [24, 6.655]
  - - [4096, 512, 1, 2048, 4096, 4096, 4096, 512]
    - [61, 7.196]
  - - [4096, 512, 1, 4096, 4096, 4096, 4096, 512]
    - [8, 8.311]
  - - [4096, 512, 1, 8192, 4096, 4096, 4096, 512]
    - [17, 9.142]
  - - [4096, 1024, 1, 128, 4096, 4096, 4096, 1024]
    - [64, 2.551]
  - - [4096, 1024, 1, 256, 4096, 4096, 4096, 1024]
    - [89, 3.32]
  - - [4096, 1024, 1, 512, 4096, 4096, 4096, 1024]
    - [3, 4.906]
  - - [4096, 1024, 1, 1024, 4096, 4096, 4096, 1024]
    - [3, 6.642]
  - - [4096, 1024, 1, 2048, 4096, 4096, 4096, 1024]
    - [58, 8.05]
  - - [4096, 1024, 1, 4096, 4096, 4096, 4096, 1024]
    - [12, 8.931]
  - - [4096, 1024, 1, 8192, 4096, 4096, 4096, 1024]
    - [58, 9.515]
  - - [4096, 2048, 1, 128, 4096, 4096, 4096, 2048]
    - [90, 2.554]
  - - [4096, 2048, 1, 256, 4096, 4096, 4096, 2048]
    - [58, 3.942]
  - - [4096, 2048, 1, 512, 4096, 4096, 4096, 2048]
    - [23, 5.472]
  - - [4096, 2048, 1, 1024, 4096, 4096, 4096, 2048]
    - [9, 7.221]
  - - [4096, 2048, 1, 2048, 4096, 4096, 4096, 2048]
    - [18, 8.436]
  - - [4096, 2048, 1, 4096, 4096, 4096, 4096, 2048]
    - [9, 9.102]
  - - [4096, 2048, 1, 8192, 4096, 4096, 4096, 2048]
    - [69, 9.336]
  - - [4096, 4096, 1, 128, 4096, 4096, 4096, 4096]
    - [67, 2.944]
  - - [4096, 4096, 1, 256, 4096, 4096, 4096, 4096]
    - [16, 4.181]
  - - [4096, 4096, 1, 512, 4096, 4096, 4096, 4096]
    - [2, 6.099]
  - - [4096, 4096, 1, 1024, 4096, 4096, 4096, 4096]
    - [18, 7.472]
  - - [4096, 4096, 1, 2048, 4096, 4096, 4096, 4096]
    - [7, 8.526]
  - - [4096, 4096, 1, 4096, 4096, 4096, 4096, 4096]
    - [9, 9.135]
  - - [4096, 4096, 1, 8192, 4096, 4096, 4096, 4096]
    - [61, 9.315]
  - - [4096, 8192, 1, 128, 4096, 4096, 4096, 8192]
    - [22, 3.245]
  - - [4096, 8192, 1, 256, 4096, 4096, 4096, 8192]
    - [8, 4.5]
  - - [4096, 8192, 1, 512, 4096, 4096, 4096, 8192]
    - [9, 6.376]
  - - [4096, 8192, 1, 1024, 4096, 4096, 4096, 8192]
    - [8, 7.734]
  - - [4096, 8192, 1, 2048, 4096, 4096, 4096, 8192]
    - [4, 8.66]
  - - [4096, 8192, 1, 4096, 4096, 4096, 4096, 8192]
    - [64, 9.034]
  - - [4096, 8192, 1, 8192, 4096, 4096, 4096, 8192]
    - [58, 8.985]
  - - [8192, 128, 1, 128, 8192, 8192, 8192, 128]
    - [40, 2.011]
  - - [8192, 128, 1, 256, 8192, 8192, 8192, 128]
    - [41, 3.116]
  - - [8192, 128, 1, 512, 8192, 8192, 8192, 128]
    - [37, 4.443]
  - - [8192, 128, 1, 1024, 8192, 8192, 8192, 128]
    - [44, 5.662]
  - - [8192, 128, 1, 2048, 8192, 8192, 8192, 128]
    - [86, 6.426]
  - - [8192, 128, 1, 4096, 8192, 8192, 8192, 128]
    - [80, 7.088]
  - - [8192, 128, 1, 8192, 8192, 8192, 8192, 128]
    - [84, 8.039]
  - - [8192, 256, 1, 128, 8192, 8192, 8192, 256]
    - [11, 2.404]
  - - [8192, 256, 1, 256, 8192, 8192, 8192, 256]
    - [0, 3.79]
  - - [8192, 256, 1, 512, 8192, 8192, 8192, 256]
    - [18, 5.248]
  - - [8192, 256, 1, 1024, 8192, 8192, 8192, 256]
    - [3, 6.533]
  - - [8192, 256, 1, 2048, 8192, 8192, 8192, 256]
    - [58, 7.418]
  - - [8192, 256, 1, 4096, 8192, 8192, 8192, 256]
    - [3, 8.315]
  - - [8192, 256, 1, 8192, 8192, 8192, 8192, 256]
    - [23, 9.048]
  - - [8192, 512, 1, 128, 8192, 8192, 8192, 512]
    - [62, 2.462]
  - - [8192, 512, 1, 256, 8192, 8192, 8192, 512]
    - [73, 3.306]
  - - [8192, 512, 1, 512, 8192, 8192, 8192, 512]
    - [3, 4.855]
  - - [8192, 512, 1, 1024, 8192, 8192, 8192, 512]
    - [8, 6.668]
  - - [8192, 512, 1, 2048, 8192, 8192, 8192, 512]
    - [8, 8.051]
  - - [8192, 512, 1, 4096, 8192, 8192, 8192, 512]
    - [69, 8.944]
  - - [8192, 512, 1, 8192, 8192, 8192, 8192, 512]
    - [69, 9.389]
  - - [8192, 1024, 1, 128, 8192, 8192, 8192, 1024]
    - [83, 2.58]
  - - [8192, 1024, 1, 256, 8192, 8192, 8192, 1024]
    - [58, 3.908]
  - - [8192, 1024, 1, 512, 8192, 8192, 8192, 1024]
    - [0, 5.398]
  - - [8192, 1024, 1, 1024, 8192, 8192, 8192, 1024]
    - [4, 7.132]
  - - [8192, 1024, 1, 2048, 8192, 8192, 8192, 1024]
    - [24, 8.413]
  - - [8192, 1024, 1, 4096, 8192, 8192, 8192, 1024]
    - [65, 9.107]
  - - [8192, 1024, 1, 8192, 8192, 8192, 8192, 1024]
    - [61, 9.32]
  - - [8192, 2048, 1, 128, 8192, 8192, 8192, 2048]
    - [64, 3.012]
  - - [8192, 2048, 1, 256, 8192, 8192, 8192, 2048]
    - [17, 4.3]
  - - [8192, 2048, 1, 512, 8192, 8192, 8192, 2048]
    - [8, 6.143]
  - - [8192, 2048, 1, 1024, 8192, 8192, 8192, 2048]
    - [18, 7.607]
  - - [8192, 2048, 1, 2048, 8192, 8192, 8192, 2048]
    - [24, 8.588]
  - - [8192, 2048, 1, 4096, 8192, 8192, 8192, 2048]
    - [65, 8.945]
  - - [8192, 2048, 1, 8192, 8192, 8192, 8192, 2048]
    - [9, 9.258]
  - - [8192, 4096, 1, 128, 8192, 8192, 8192, 4096]
    - [1, 3.317]
  - - [8192, 4096, 1, 256, 8192, 8192, 8192, 4096]
    - [15, 4.758]
  - - [8192, 4096, 1, 512, 8192, 8192, 8192, 4096]
    - [18, 6.503]
  - - [8192, 4096, 1, 1024, 8192, 8192, 8192, 4096]
    - [4, 7.723]
  - - [8192, 4096, 1, 2048, 8192, 8192, 8192, 4096]
    - [4, 8.542]
  - - [8192, 4096, 1, 4096, 8192, 8192, 8192, 4096]
    - [3, 8.834]
  - - [8192, 4096, 1, 8192, 8192, 8192, 8192, 4096]
    - [58, 8.747]
  - - [8192, 8192, 1, 128, 8192, 8192, 8192, 8192]
    - [9, 3.354]
  - - [8192, 8192, 1, 256, 8192, 8192, 8192, 8192]
    - [13, 4.838]
  - - [8192, 8192, 1, 512, 8192, 8192, 8192, 8192]
    - [5, 6.517]
  - - [8192, 8192, 1, 1024, 8192, 8192, 8192, 8192]
    - [5, 7.824]
  - - [8192, 8192, 1, 2048, 8192, 8192, 8192, 8192]
    - [24, 8.505]
  - - [8192, 8192, 1, 4096, 8192, 8192, 8192, 8192]
    - [58, 8.872]
  - - [8192, 8192, 1, 8192, 8192, 8192, 8192, 8192]
    - [58, 8.311]
  - - [1, 1, 1, 32, 1, 1, 1, 1]
    - [127, 0.0]
- null
- null
- ExperimentalStreamK
- GridBased
