library/src/amd_detail/rocblaslt/src/Tensile/Logic/asm_full/aquavanjaram/gfx942_80cu/StreamK/aquavanjaram942_Cijk_Ailk_Bljk_HSS_BH_UserArgs.yaml
- {MinimumRequiredVersion: 4.33.0}
- aquavanjaram942
- {Architecture: gfx942, CUCount: 80}
- [Device 0049, Device 0050]
    SolutionIndex: 0
    SolutionNameMin: Cijk_Ailk_Bljk_HSS_BH_UserArgs_MT256x256x32_MI16x16x1_SN_LDSB1_CLR1_GSU0_GSUC0_GSUWGMRR0_K1_LBSPPA2048_LBSPPB128_LPA0_MIWT8_8_PLR1_SU32_SUM0_SUS256_SKXCCM0_VWA4_VWB1_WGM1_WGMXCC1_WGMXCCGn1
    SolutionIndex: 1
    SolutionNameMin: Cijk_Ailk_Bljk_HSS_BH_UserArgs_MT256x256x32_MI16x16x1_SN_LDSB1_CLR1_GSU0_GSUC0_GSUWGMRR0_K1_LBSPPA2048_LBSPPB256_LPA0_MIWT8_8_PLR1_SU32_SUM0_SUS256_SKXCCM0_VWA4_VWB4_WGM1_WGMXCC1_WGMXCCGn1
    SolutionIndex: 2
    SolutionNameMin: Cijk_Ailk_Bljk_HSS_BH_UserArgs_MT256x256x32_MI16x16x1_SN_LDSB1_CLR1_GSU0_GSUC0_GSUWGMRR0_K1_LBSPPA2048_LBSPPB512_LPA0_MIWT8_8_PLR1_SU32_SUM0_SUS256_SKXCCM0_VWA4_VWB8_WGM1_WGMXCC1_WGMXCCGn1
    SolutionIndex: 3
    SolutionNameMin: Cijk_Ailk_Bljk_HSS_BH_UserArgs_MT256x256x32_MI16x16x1_SN_LDSB1_CLR1_GSU0_GSUC0_GSUWGMRR0_K1_LBSPPA2048_LBSPPB128_LPA0_MIWT8_8_PLR1_SU32_SUM0_SUS256_SKXCCM0_VWA4_VWB1_WGM2_WGMXCC1_WGMXCCGn1
    SolutionIndex: 4
    SolutionNameMin: Cijk_Ailk_Bljk_HSS_BH_UserArgs_MT256x256x32_MI16x16x1_SN_LDSB1_CLR1_GSU0_GSUC0_GSUWGMRR0_K1_LBSPPA2048_LBSPPB128_LPA0_MIWT8_8_PLR1_SU32_SUM0_SUS256_SKXCCM0_VWA4_VWB2_WGM2_WGMXCC1_WGMXCCGn1
    SolutionIndex: 5
    SolutionNameMin: Cijk_Ailk_Bljk_HSS_BH_UserArgs_MT256x256x32_MI16x16x1_SN_LDSB1_CLR1_GSU0_GSUC0_GSUWGMRR0_K1_LBSPPA2048_LBSPPB256_LPA0_MIWT8_8_PLR1_SU32_SUM0_SUS256_SKXCCM0_VWA4_VWB4_WGM2_WGMXCC1_WGMXCCGn1
    SolutionIndex: 6
    SolutionNameMin: Cijk_Ailk_Bljk_HSS_BH_UserArgs_MT256x256x32_MI16x16x1_SN_LDSB1_CLR1_GSU0_GSUC0_GSUWGMRR0_K1_LBSPPA2048_LBSPPB512_LPA0_MIWT8_8_PLR1_SU32_SUM0_SUS256_SKXCCM0_VWA4_VWB8_WGM2_WGMXCC1_WGMXCCGn1
    SolutionIndex: 7
    SolutionNameMin: Cijk_Ailk_Bljk_HSS_BH_UserArgs_MT256x256x32_MI16x16x1_SN_LDSB1_CLR1_GSU0_GSUC0_GSUWGMRR0_K1_LBSPPA2048_LBSPPB128_LPA0_MIWT8_8_PLR1_SU32_SUM0_SUS256_SKXCCM0_VWA4_VWB1_WGM4_WGMXCC1_WGMXCCGn1
    SolutionIndex: 8
    SolutionNameMin: Cijk_Ailk_Bljk_HSS_BH_UserArgs_MT256x256x32_MI16x16x1_SN_LDSB1_CLR1_GSU0_GSUC0_GSUWGMRR0_K1_LBSPPA2048_LBSPPB256_LPA0_MIWT8_8_PLR1_SU32_SUM0_SUS256_SKXCCM0_VWA4_VWB4_WGM4_WGMXCC1_WGMXCCGn1
    SolutionIndex: 9
    SolutionNameMin: Cijk_Ailk_Bljk_HSS_BH_UserArgs_MT256x128x32_MI16x16x1_SN_LDSB1_CLR1_GSU0_GSUC0_GSUWGMRR0_K1_LBSPPA2048_LBSPPB128_LPA0_MIWT8_4_PLR1_SU32_SUM0_SUS256_SKXCCM0_VWA4_VWB1_WGM1_WGMXCC1_WGMXCCGn1
    SolutionIndex: 10
    SolutionNameMin: Cijk_Ailk_Bljk_HSS_BH_UserArgs_MT256x128x32_MI16x16x1_SN_LDSB1_CLR1_GSU0_GSUC0_GSUWGMRR0_K1_LBSPPA2048_LBSPPB128_LPA0_MIWT8_4_PLR1_SU32_SUM0_SUS256_SKXCCM0_VWA4_VWB2_WGM1_WGMXCC1_WGMXCCGn1
    SolutionIndex: 11
    SolutionNameMin: Cijk_Ailk_Bljk_HSS_BH_UserArgs_MT256x128x32_MI16x16x1_SN_LDSB1_CLR1_GSU0_GSUC0_GSUWGMRR0_K1_LBSPPA2048_LBSPPB256_LPA0_MIWT8_4_PLR1_SU32_SUM0_SUS256_SKXCCM0_VWA4_VWB4_WGM1_WGMXCC1_WGMXCCGn1
    SolutionIndex: 12
    SolutionNameMin: Cijk_Ailk_Bljk_HSS_BH_UserArgs_MT256x128x32_MI16x16x1_SN_LDSB1_CLR1_GSU0_GSUC0_GSUWGMRR0_K1_LBSPPA2048_LBSPPB256_LPA0_MIWT8_4_PLR1_SU32_SUM0_SUS256_SKXCCM0_VWA4_VWB4_WGM2_WGMXCC1_WGMXCCGn1
    SolutionIndex: 13
    SolutionNameMin: Cijk_Ailk_Bljk_HSS_BH_UserArgs_MT256x128x32_MI16x16x1_SN_LDSB1_CLR1_GSU0_GSUC0_GSUWGMRR0_K1_LBSPPA2048_LBSPPB256_LPA0_MIWT8_4_PLR1_SU32_SUM0_SUS256_SKXCCM0_VWA4_VWB4_WGM4_WGMXCC1_WGMXCCGn1
    SolutionIndex: 14
    SolutionNameMin: Cijk_Ailk_Bljk_HSS_BH_UserArgs_MT32x32x32_MI16x16x1_SN_LDSB0_CLR1_GSU0_GSUC0_GSUWGMRR0_K1_LBSPPA256_LBSPPB128_LPA16_MIWT1_1_PLR1_SU32_SUM0_SUS256_SKXCCM0_VWA1_VWB1_WGM1_WGMXCC1_WGMXCCGn1
    SolutionIndex: 15
    SolutionNameMin: Cijk_Ailk_Bljk_HSS_BH_UserArgs_MT128x256x64_MI16x16x1_SN_LDSB1_CLR1_GSU0_GSUC0_GSUWGMRR0_K1_LBSPPA2048_LBSPPB128_LPA32_MIWT4_8_PLR1_SU32_SUM0_SUS256_SKXCCM0_VWA2_VWB1_WGM1_WGMXCC1_WGMXCCGn1
    SolutionIndex: 16
    SolutionNameMin: Cijk_Ailk_Bljk_HSS_BH_UserArgs_MT128x256x64_MI16x16x1_SN_LDSB1_CLR1_GSU0_GSUC0_GSUWGMRR0_K1_LBSPPA2048_LBSPPB128_LPA0_MIWT4_8_PLR1_SU32_SUM0_SUS256_SKXCCM0_VWA4_VWB1_WGM1_WGMXCC1_WGMXCCGn1
    SolutionIndex: 17
    SolutionNameMin: Cijk_Ailk_Bljk_HSS_BH_UserArgs_MT128x256x64_MI16x16x1_SN_LDSB1_CLR1_GSU0_GSUC0_GSUWGMRR0_K1_LBSPPA2048_LBSPPB256_LPA0_MIWT4_8_PLR1_SU32_SUM0_SUS256_SKXCCM0_VWA4_VWB2_WGM1_WGMXCC1_WGMXCCGn1
    SolutionIndex: 18
    SolutionNameMin: Cijk_Ailk_Bljk_HSS_BH_UserArgs_MT128x256x64_MI16x16x1_SN_LDSB1_CLR1_GSU0_GSUC0_GSUWGMRR0_K1_LBSPPA2048_LBSPPB512_LPA0_MIWT4_8_PLR1_SU32_SUM0_SUS256_SKXCCM0_VWA4_VWB4_WGM1_WGMXCC1_WGMXCCGn1
    SolutionIndex: 19
    SolutionNameMin: Cijk_Ailk_Bljk_HSS_BH_UserArgs_MT128x256x64_MI16x16x1_SN_LDSB1_CLR1_GSU0_GSUC0_GSUWGMRR0_K1_LBSPPA2048_LBSPPB1024_LPA0_MIWT4_8_PLR1_SU32_SUM0_SUS256_SKXCCM0_VWA4_VWB8_WGM1_WGMXCC1_WGMXCCGn1
    SolutionIndex: 20
    SolutionNameMin: Cijk_Ailk_Bljk_HSS_BH_UserArgs_MT256x128x64_MI16x16x1_SN_LDSB1_CLR1_GSU0_GSUC0_GSUWGMRR0_K1_LBSPPA4096_LBSPPB256_LPA0_MIWT8_4_PLR1_SU32_SUM0_SUS256_SKXCCM0_VWA4_VWB2_WGM1_WGMXCC1_WGMXCCGn1
    SolutionIndex: 21
    SolutionNameMin: Cijk_Ailk_Bljk_HSS_BH_UserArgs_MT128x128x64_MI16x16x1_SN_LDSB1_CLR1_GSU0_GSUC0_GSUWGMRR0_K1_LBSPPA2048_LBSPPB128_LPA0_MIWT4_4_PLR1_SU32_SUM0_SUS256_SKXCCM0_VWA4_VWB1_WGM1_WGMXCC1_WGMXCCGn1
    SolutionIndex: 22
    SolutionNameMin: Cijk_Ailk_Bljk_HSS_BH_UserArgs_MT128x128x64_MI16x16x1_SN_LDSB1_CLR1_GSU0_GSUC0_GSUWGMRR0_K1_LBSPPA2048_LBSPPB256_LPA0_MIWT4_4_PLR1_SU32_SUM0_SUS256_SKXCCM0_VWA4_VWB2_WGM1_WGMXCC1_WGMXCCGn1
    SolutionIndex: 23
    SolutionNameMin: Cijk_Ailk_Bljk_HSS_BH_UserArgs_MT128x128x64_MI16x16x1_SN_LDSB1_CLR1_GSU0_GSUC0_GSUWGMRR0_K1_LBSPPA2048_LBSPPB512_LPA0_MIWT4_4_PLR1_SU32_SUM0_SUS256_SKXCCM0_VWA4_VWB4_WGM1_WGMXCC1_WGMXCCGn1
    SolutionIndex: 24
    SolutionNameMin: Cijk_Ailk_Bljk_HSS_BH_UserArgs_MT128x128x64_MI16x16x1_SN_LDSB1_CLR1_GSU0_GSUC0_GSUWGMRR0_K1_LBSPPA2048_LBSPPB512_LPA0_MIWT4_4_PLR1_SU32_SUM0_SUS256_SKXCCM0_VWA4_VWB4_WGM2_WGMXCC1_WGMXCCGn1
    SolutionIndex: 25
    SolutionNameMin: Cijk_Ailk_Bljk_HSS_BH_UserArgs_MT128x128x64_MI16x16x1_SN_LDSB1_CLR1_GSU0_GSUC0_GSUWGMRR0_K1_LBSPPA2048_LBSPPB256_LPA0_MIWT4_4_PLR1_SU32_SUM0_SUS256_SKXCCM0_VWA4_VWB2_WGM4_WGMXCC1_WGMXCCGn1
    SolutionIndex: 26
    SolutionNameMin: Cijk_Ailk_Bljk_HSS_BH_UserArgs_MT128x128x64_MI16x16x1_SN_LDSB1_CLR1_GSU0_GSUC0_GSUWGMRR0_K1_LBSPPA2048_LBSPPB512_LPA0_MIWT4_4_PLR1_SU32_SUM0_SUS256_SKXCCM0_VWA4_VWB4_WGM4_WGMXCC1_WGMXCCGn1
    SolutionIndex: 27
    SolutionNameMin: Cijk_Ailk_Bljk_HSS_BH_UserArgs_MT128x64x64_MI16x16x1_SN_LDSB1_CLR1_GSU0_GSUC0_GSUWGMRR0_K1_LBSPPA2048_LBSPPB256_LPA0_MIWT4_2_PLR1_SU32_SUM0_SUS256_SKXCCM0_VWA4_VWB2_WGM1_WGMXCC1_WGMXCCGn1
    SolutionIndex: 28
    SolutionNameMin: Cijk_Ailk_Bljk_HSS_BH_UserArgs_MT128x64x64_MI16x16x1_SN_LDSB1_CLR1_GSU0_GSUC0_GSUWGMRR0_K1_LBSPPA2048_LBSPPB128_LPA0_MIWT4_2_PLR1_SU32_SUM0_SUS256_SKXCCM0_VWA4_VWB1_WGM4_WGMXCC1_WGMXCCGn1
    SolutionIndex: 29
    SolutionNameMin: Cijk_Ailk_Bljk_HSS_BH_UserArgs_MT32x64x64_MI16x16x1_SN_LDSB0_CLR1_GSU0_GSUC0_GSUWGMRR0_K1_LBSPPA512_LBSPPB128_LPA16_MIWT1_2_PLR1_SU32_SUM0_SUS256_SKXCCM0_VWA1_VWB1_WGM1_WGMXCC1_WGMXCCGn1
    SolutionIndex: 30
    SolutionNameMin: Cijk_Ailk_Bljk_HSS_BH_UserArgs_MT32x32x64_MI16x16x1_SN_LDSB0_CLR1_GSU0_GSUC0_GSUWGMRR0_K1_LBSPPA512_LBSPPB128_LPA16_MIWT1_1_PLR1_SU32_SUM0_SUS256_SKXCCM0_VWA1_VWB1_WGM1_WGMXCC1_WGMXCCGn1
    SolutionIndex: 31
    SolutionNameMin: Cijk_Ailk_Bljk_HSS_BH_UserArgs_MT128x64x128_MI16x16x1_SN_LDSB1_CLR1_GSU0_GSUC0_GSUWGMRR0_K1_LBSPPA2048_LBSPPB256_LPA0_MIWT4_2_PLR1_SU32_SUM0_SUS256_SKXCCM0_VWA4_VWB1_WGM1_WGMXCC1_WGMXCCGn1
    SolutionIndex: 32
    SolutionNameMin: Cijk_Ailk_Bljk_HSS_BH_UserArgs_MT128x64x128_MI16x16x1_SN_LDSB1_CLR1_GSU0_GSUC0_GSUWGMRR0_K1_LBSPPA2048_LBSPPB256_LPA0_MIWT4_2_PLR2_SU32_SUM0_SUS256_SKXCCM0_VWA4_VWB1_WGM1_WGMXCC1_WGMXCCGn1
    SolutionIndex: 33
    SolutionNameMin: Cijk_Ailk_Bljk_HSS_BH_UserArgs_MT128x64x128_MI16x16x1_SN_LDSB1_CLR1_GSU0_GSUC0_GSUWGMRR0_K1_LBSPPA2048_LBSPPB256_LPA0_MIWT4_2_PLR2_SU32_SUM0_SUS256_SKXCCM0_VWA4_VWB1_WGM2_WGMXCC1_WGMXCCGn1
    SolutionIndex: 34
    SolutionNameMin: Cijk_Ailk_Bljk_HSS_BH_UserArgs_MT64x64x128_MI16x16x1_SN_LDSB1_CLR1_GSU0_GSUC0_GSUWGMRR0_K1_LBSPPA1024_LBSPPB256_LPA32_MIWT2_2_PLR2_SU32_SUM0_SUS256_SKXCCM0_VWA2_VWB1_WGM1_WGMXCC1_WGMXCCGn1
    SolutionIndex: 35
    SolutionNameMin: Cijk_Ailk_Bljk_HSS_BH_UserArgs_MT64x64x128_MI16x16x1_SN_LDSB1_CLR1_GSU0_GSUC0_GSUWGMRR0_K1_LBSPPA1024_LBSPPB256_LPA32_MIWT2_2_PLR2_SU32_SUM0_SUS256_SKXCCM0_VWA2_VWB1_WGM2_WGMXCC1_WGMXCCGn1
    SolutionIndex: 36
    SolutionNameMin: Cijk_Ailk_Bljk_HSS_BH_UserArgs_MT64x32x128_MI16x16x1_SN_LDSB1_CLR1_GSU0_GSUC0_GSUWGMRR0_K1_LBSPPA1024_LBSPPB256_LPA32_MIWT2_1_PLR2_SU32_SUM0_SUS256_SKXCCM0_VWA2_VWB1_WGM1_WGMXCC1_WGMXCCGn1
    SolutionIndex: 37
    SolutionNameMin: Cijk_Ailk_Bljk_HSS_BH_UserArgs_MT32x32x128_MI16x16x1_SN_LDSB1_CLR1_GSU0_GSUC0_GSUWGMRR0_K1_LBSPPA512_LBSPPB256_LPA16_MIWT1_1_PLR1_SU32_SUM0_SUS256_SKXCCM0_VWA1_VWB1_WGM1_WGMXCC1_WGMXCCGn1
    SolutionIndex: 38
    SolutionNameMin: Cijk_Ailk_Bljk_HSS_BH_UserArgs_MT32x32x128_MI16x16x1_SN_LDSB1_CLR1_GSU0_GSUC0_GSUWGMRR0_K1_LBSPPA512_LBSPPB256_LPA16_MIWT1_1_PLR2_SU32_SUM0_SUS256_SKXCCM0_VWA1_VWB1_WGM1_WGMXCC1_WGMXCCGn1
    SolutionIndex: 39
    SolutionNameMin: Cijk_Ailk_Bljk_HSS_BH_UserArgs_MT256x256x32_MI16x16x1_SN_LDSB1_CLR1_GSU0_GSUC0_GSUWGMRR0_K1_LBSPPA2048_LBSPPB128_LPA0_MIWT8_8_PLR1_SU32_SUM0_SUS256_SKXCCM4_VWA4_VWB1_WGM1_WGMXCC1_WGMXCCGn1
    SolutionIndex: 40
    SolutionNameMin: Cijk_Ailk_Bljk_HSS_BH_UserArgs_MT256x256x32_MI16x16x1_SN_LDSB1_CLR1_GSU0_GSUC0_GSUWGMRR0_K1_LBSPPA2048_LBSPPB128_LPA0_MIWT8_8_PLR1_SU32_SUM0_SUS256_SKXCCM4_VWA4_VWB2_WGM1_WGMXCC1_WGMXCCGn1
    SolutionIndex: 41
    SolutionNameMin: Cijk_Ailk_Bljk_HSS_BH_UserArgs_MT256x256x32_MI16x16x1_SN_LDSB1_CLR1_GSU0_GSUC0_GSUWGMRR0_K1_LBSPPA2048_LBSPPB256_LPA0_MIWT8_8_PLR1_SU32_SUM0_SUS256_SKXCCM4_VWA4_VWB4_WGM1_WGMXCC1_WGMXCCGn1
    SolutionIndex: 42
    SolutionNameMin: Cijk_Ailk_Bljk_HSS_BH_UserArgs_MT256x256x32_MI16x16x1_SN_LDSB1_CLR1_GSU0_GSUC0_GSUWGMRR0_K1_LBSPPA2048_LBSPPB512_LPA32_MIWT8_8_PLR1_SU32_SUM0_SUS256_SKXCCM4_VWA2_VWB8_WGM1_WGMXCC1_WGMXCCGn1
    SolutionIndex: 43
    SolutionNameMin: Cijk_Ailk_Bljk_HSS_BH_UserArgs_MT256x256x32_MI16x16x1_SN_LDSB1_CLR1_GSU0_GSUC0_GSUWGMRR0_K1_LBSPPA2048_LBSPPB512_LPA0_MIWT8_8_PLR1_SU32_SUM0_SUS256_SKXCCM4_VWA4_VWB8_WGM1_WGMXCC1_WGMXCCGn1
    SolutionIndex: 44
    SolutionNameMin: Cijk_Ailk_Bljk_HSS_BH_UserArgs_MT256x256x32_MI16x16x1_SN_LDSB1_CLR1_GSU0_GSUC0_GSUWGMRR0_K1_LBSPPA2048_LBSPPB128_LPA0_MIWT8_8_PLR1_SU32_SUM0_SUS256_SKXCCM4_VWA4_VWB1_WGM2_WGMXCC1_WGMXCCGn1
    SolutionIndex: 45
    SolutionNameMin: Cijk_Ailk_Bljk_HSS_BH_UserArgs_MT256x256x32_MI16x16x1_SN_LDSB1_CLR1_GSU0_GSUC0_GSUWGMRR0_K1_LBSPPA2048_LBSPPB128_LPA0_MIWT8_8_PLR1_SU32_SUM0_SUS256_SKXCCM4_VWA4_VWB2_WGM2_WGMXCC1_WGMXCCGn1
    SolutionIndex: 46
    SolutionNameMin: Cijk_Ailk_Bljk_HSS_BH_UserArgs_MT256x256x32_MI16x16x1_SN_LDSB1_CLR1_GSU0_GSUC0_GSUWGMRR0_K1_LBSPPA2048_LBSPPB256_LPA0_MIWT8_8_PLR1_SU32_SUM0_SUS256_SKXCCM4_VWA4_VWB4_WGM2_WGMXCC1_WGMXCCGn1
    SolutionIndex: 47
    SolutionNameMin: Cijk_Ailk_Bljk_HSS_BH_UserArgs_MT256x256x32_MI16x16x1_SN_LDSB1_CLR1_GSU0_GSUC0_GSUWGMRR0_K1_LBSPPA2048_LBSPPB512_LPA0_MIWT8_8_PLR1_SU32_SUM0_SUS256_SKXCCM4_VWA4_VWB8_WGM2_WGMXCC1_WGMXCCGn1
    SolutionIndex: 48
    SolutionNameMin: Cijk_Ailk_Bljk_HSS_BH_UserArgs_MT256x256x32_MI16x16x1_SN_LDSB1_CLR1_GSU0_GSUC0_GSUWGMRR0_K1_LBSPPA2048_LBSPPB128_LPA0_MIWT8_8_PLR1_SU32_SUM0_SUS256_SKXCCM4_VWA4_VWB1_WGM4_WGMXCC1_WGMXCCGn1
    SolutionIndex: 49
    SolutionNameMin: Cijk_Ailk_Bljk_HSS_BH_UserArgs_MT256x256x32_MI16x16x1_SN_LDSB1_CLR1_GSU0_GSUC0_GSUWGMRR0_K1_LBSPPA2048_LBSPPB256_LPA0_MIWT8_8_PLR1_SU32_SUM0_SUS256_SKXCCM4_VWA4_VWB4_WGM4_WGMXCC1_WGMXCCGn1
    SolutionIndex: 50
    SolutionNameMin: Cijk_Ailk_Bljk_HSS_BH_UserArgs_MT256x256x32_MI16x16x1_SN_LDSB1_CLR1_GSU0_GSUC0_GSUWGMRR0_K1_LBSPPA2048_LBSPPB512_LPA0_MIWT8_8_PLR1_SU32_SUM0_SUS256_SKXCCM4_VWA4_VWB8_WGM4_WGMXCC1_WGMXCCGn1
    SolutionIndex: 51
    SolutionNameMin: Cijk_Ailk_Bljk_HSS_BH_UserArgs_MT128x256x32_MI16x16x1_SN_LDSB1_CLR1_GSU0_GSUC0_GSUWGMRR0_K1_LBSPPA1024_LBSPPB512_LPA0_MIWT4_8_PLR1_SU32_SUM0_SUS256_SKXCCM4_VWA4_VWB8_WGM1_WGMXCC1_WGMXCCGn1
    SolutionIndex: 52
    SolutionNameMin: Cijk_Ailk_Bljk_HSS_BH_UserArgs_MT256x128x32_MI16x16x1_SN_LDSB1_CLR1_GSU0_GSUC0_GSUWGMRR0_K1_LBSPPA2048_LBSPPB128_LPA0_MIWT8_4_PLR1_SU32_SUM0_SUS256_SKXCCM4_VWA4_VWB1_WGM1_WGMXCC1_WGMXCCGn1
    SolutionIndex: 53
    SolutionNameMin: Cijk_Ailk_Bljk_HSS_BH_UserArgs_MT256x128x32_MI16x16x1_SN_LDSB1_CLR1_GSU0_GSUC0_GSUWGMRR0_K1_LBSPPA2048_LBSPPB128_LPA0_MIWT8_4_PLR1_SU32_SUM0_SUS256_SKXCCM4_VWA4_VWB2_WGM1_WGMXCC1_WGMXCCGn1
    SolutionIndex: 54
    SolutionNameMin: Cijk_Ailk_Bljk_HSS_BH_UserArgs_MT256x128x32_MI16x16x1_SN_LDSB1_CLR1_GSU0_GSUC0_GSUWGMRR0_K1_LBSPPA2048_LBSPPB256_LPA0_MIWT8_4_PLR1_SU32_SUM0_SUS256_SKXCCM4_VWA4_VWB4_WGM1_WGMXCC1_WGMXCCGn1
    SolutionIndex: 55
    SolutionNameMin: Cijk_Ailk_Bljk_HSS_BH_UserArgs_MT256x128x32_MI16x16x1_SN_LDSB1_CLR1_GSU0_GSUC0_GSUWGMRR0_K1_LBSPPA2048_LBSPPB128_LPA0_MIWT8_4_PLR1_SU32_SUM0_SUS256_SKXCCM4_VWA4_VWB1_WGM2_WGMXCC1_WGMXCCGn1
    SolutionIndex: 56
    SolutionNameMin: Cijk_Ailk_Bljk_HSS_BH_UserArgs_MT256x128x32_MI16x16x1_SN_LDSB1_CLR1_GSU0_GSUC0_GSUWGMRR0_K1_LBSPPA2048_LBSPPB128_LPA0_MIWT8_4_PLR1_SU32_SUM0_SUS256_SKXCCM4_VWA4_VWB2_WGM2_WGMXCC1_WGMXCCGn1
    SolutionIndex: 57
    SolutionNameMin: Cijk_Ailk_Bljk_HSS_BH_UserArgs_MT256x128x32_MI16x16x1_SN_LDSB1_CLR1_GSU0_GSUC0_GSUWGMRR0_K1_LBSPPA2048_LBSPPB128_LPA0_MIWT8_4_PLR1_SU32_SUM0_SUS256_SKXCCM4_VWA4_VWB1_WGM4_WGMXCC1_WGMXCCGn1
    SolutionIndex: 58
    SolutionNameMin: Cijk_Ailk_Bljk_HSS_BH_UserArgs_MT256x128x32_MI16x16x1_SN_LDSB1_CLR1_GSU0_GSUC0_GSUWGMRR0_K1_LBSPPA2048_LBSPPB128_LPA0_MIWT8_4_PLR1_SU32_SUM0_SUS256_SKXCCM4_VWA4_VWB2_WGM4_WGMXCC1_WGMXCCGn1
    SolutionIndex: 59
    SolutionNameMin: Cijk_Ailk_Bljk_HSS_BH_UserArgs_MT256x128x32_MI16x16x1_SN_LDSB1_CLR1_GSU0_GSUC0_GSUWGMRR0_K1_LBSPPA2048_LBSPPB256_LPA0_MIWT8_4_PLR1_SU32_SUM0_SUS256_SKXCCM4_VWA4_VWB4_WGM4_WGMXCC1_WGMXCCGn1
    SolutionIndex: 60
    SolutionNameMin: Cijk_Ailk_Bljk_HSS_BH_UserArgs_MT128x128x32_MI16x16x1_SN_LDSB1_CLR1_GSU0_GSUC0_GSUWGMRR0_K1_LBSPPA1024_LBSPPB128_LPA0_MIWT4_4_PLR1_SU32_SUM0_SUS256_SKXCCM4_VWA4_VWB1_WGM1_WGMXCC1_WGMXCCGn1
    SolutionIndex: 61
    SolutionNameMin: Cijk_Ailk_Bljk_HSS_BH_UserArgs_MT128x128x32_MI16x16x1_SN_LDSB1_CLR1_GSU0_GSUC0_GSUWGMRR0_K1_LBSPPA1024_LBSPPB128_LPA0_MIWT4_4_PLR1_SU32_SUM0_SUS256_SKXCCM4_VWA4_VWB2_WGM1_WGMXCC1_WGMXCCGn1
    SolutionIndex: 62
    SolutionNameMin: Cijk_Ailk_Bljk_HSS_BH_UserArgs_MT128x128x32_MI16x16x1_SN_LDSB1_CLR1_GSU0_GSUC0_GSUWGMRR0_K1_LBSPPA1024_LBSPPB256_LPA0_MIWT4_4_PLR1_SU32_SUM0_SUS256_SKXCCM4_VWA4_VWB4_WGM1_WGMXCC1_WGMXCCGn1
    SolutionIndex: 63
    SolutionNameMin: Cijk_Ailk_Bljk_HSS_BH_UserArgs_MT128x128x32_MI16x16x1_SN_LDSB1_CLR1_GSU0_GSUC0_GSUWGMRR0_K1_LBSPPA1024_LBSPPB128_LPA0_MIWT4_4_PLR1_SU32_SUM0_SUS256_SKXCCM4_VWA4_VWB1_WGM2_WGMXCC1_WGMXCCGn1
    SolutionIndex: 64
    SolutionNameMin: Cijk_Ailk_Bljk_HSS_BH_UserArgs_MT128x64x32_MI16x16x1_SN_LDSB0_CLR1_GSU0_GSUC0_GSUWGMRR0_K1_LBSPPA1024_LBSPPB128_LPA0_MIWT4_2_PLR1_SU32_SUM0_SUS256_SKXCCM4_VWA4_VWB1_WGM1_WGMXCC1_WGMXCCGn1
    SolutionIndex: 65
    SolutionNameMin: Cijk_Ailk_Bljk_HSS_BH_UserArgs_MT128x64x32_MI16x16x1_SN_LDSB0_CLR1_GSU0_GSUC0_GSUWGMRR0_K1_LBSPPA1024_LBSPPB128_LPA0_MIWT4_2_PLR1_SU32_SUM0_SUS256_SKXCCM4_VWA4_VWB2_WGM1_WGMXCC1_WGMXCCGn1
    SolutionIndex: 66
    SolutionNameMin: Cijk_Ailk_Bljk_HSS_BH_UserArgs_MT128x256x64_MI16x16x1_SN_LDSB1_CLR1_GSU0_GSUC0_GSUWGMRR0_K1_LBSPPA2048_LBSPPB128_LPA0_MIWT4_8_PLR1_SU32_SUM0_SUS256_SKXCCM4_VWA4_VWB1_WGM1_WGMXCC1_WGMXCCGn1
    SolutionIndex: 67
    SolutionNameMin: Cijk_Ailk_Bljk_HSS_BH_UserArgs_MT128x256x64_MI16x16x1_SN_LDSB1_CLR1_GSU0_GSUC0_GSUWGMRR0_K1_LBSPPA2048_LBSPPB256_LPA0_MIWT4_8_PLR1_SU32_SUM0_SUS256_SKXCCM4_VWA4_VWB2_WGM1_WGMXCC1_WGMXCCGn1
    SolutionIndex: 68
    SolutionNameMin: Cijk_Ailk_Bljk_HSS_BH_UserArgs_MT128x256x64_MI16x16x1_SN_LDSB1_CLR1_GSU0_GSUC0_GSUWGMRR0_K1_LBSPPA2048_LBSPPB1024_LPA0_MIWT4_8_PLR1_SU32_SUM0_SUS256_SKXCCM4_VWA4_VWB8_WGM1_WGMXCC1_WGMXCCGn1
    SolutionIndex: 69
    SolutionNameMin: Cijk_Ailk_Bljk_HSS_BH_UserArgs_MT128x256x64_MI16x16x1_SN_LDSB1_CLR1_GSU0_GSUC0_GSUWGMRR0_K1_LBSPPA2048_LBSPPB128_LPA0_MIWT4_8_PLR1_SU32_SUM0_SUS256_SKXCCM4_VWA4_VWB1_WGM2_WGMXCC1_WGMXCCGn1
    SolutionIndex: 70
    SolutionNameMin: Cijk_Ailk_Bljk_HSS_BH_UserArgs_MT128x256x64_MI16x16x1_SN_LDSB1_CLR1_GSU0_GSUC0_GSUWGMRR0_K1_LBSPPA2048_LBSPPB512_LPA0_MIWT4_8_PLR1_SU32_SUM0_SUS256_SKXCCM4_VWA4_VWB4_WGM2_WGMXCC1_WGMXCCGn1
    SolutionIndex: 71
    SolutionNameMin: Cijk_Ailk_Bljk_HSS_BH_UserArgs_MT128x256x64_MI16x16x1_SN_LDSB1_CLR1_GSU0_GSUC0_GSUWGMRR0_K1_LBSPPA2048_LBSPPB1024_LPA0_MIWT4_8_PLR1_SU32_SUM0_SUS256_SKXCCM4_VWA4_VWB8_WGM2_WGMXCC1_WGMXCCGn1
    SolutionIndex: 72
    SolutionNameMin: Cijk_Ailk_Bljk_HSS_BH_UserArgs_MT128x256x64_MI16x16x1_SN_LDSB1_CLR1_GSU0_GSUC0_GSUWGMRR0_K1_LBSPPA2048_LBSPPB1024_LPA0_MIWT4_8_PLR1_SU32_SUM0_SUS256_SKXCCM4_VWA4_VWB8_WGM4_WGMXCC1_WGMXCCGn1
    SolutionIndex: 73
    SolutionNameMin: Cijk_Ailk_Bljk_HSS_BH_UserArgs_MT256x128x64_MI16x16x1_SN_LDSB1_CLR1_GSU0_GSUC0_GSUWGMRR0_K1_LBSPPA4096_LBSPPB128_LPA0_MIWT8_4_PLR1_SU32_SUM0_SUS256_SKXCCM4_VWA4_VWB1_WGM4_WGMXCC1_WGMXCCGn1
    SolutionIndex: 74
    SolutionNameMin: Cijk_Ailk_Bljk_HSS_BH_UserArgs_MT128x128x64_MI16x16x1_SN_LDSB1_CLR1_GSU0_GSUC0_GSUWGMRR0_K1_LBSPPA2048_LBSPPB128_LPA0_MIWT4_4_PLR1_SU32_SUM0_SUS256_SKXCCM4_VWA4_VWB1_WGM1_WGMXCC1_WGMXCCGn1
    SolutionIndex: 75
    SolutionNameMin: Cijk_Ailk_Bljk_HSS_BH_UserArgs_MT128x128x64_MI16x16x1_SN_LDSB1_CLR1_GSU0_GSUC0_GSUWGMRR0_K1_LBSPPA2048_LBSPPB256_LPA0_MIWT4_4_PLR1_SU32_SUM0_SUS256_SKXCCM4_VWA4_VWB2_WGM1_WGMXCC1_WGMXCCGn1
    SolutionIndex: 76
    SolutionNameMin: Cijk_Ailk_Bljk_HSS_BH_UserArgs_MT128x128x64_MI16x16x1_SN_LDSB1_CLR1_GSU0_GSUC0_GSUWGMRR0_K1_LBSPPA2048_LBSPPB512_LPA0_MIWT4_4_PLR1_SU32_SUM0_SUS256_SKXCCM4_VWA4_VWB4_WGM1_WGMXCC1_WGMXCCGn1
    SolutionIndex: 77
    SolutionNameMin: Cijk_Ailk_Bljk_HSS_BH_UserArgs_MT128x128x64_MI16x16x1_SN_LDSB1_CLR1_GSU0_GSUC0_GSUWGMRR0_K1_LBSPPA2048_LBSPPB128_LPA0_MIWT4_4_PLR1_SU32_SUM0_SUS256_SKXCCM4_VWA4_VWB1_WGM2_WGMXCC1_WGMXCCGn1
    SolutionIndex: 78
    SolutionNameMin: Cijk_Ailk_Bljk_HSS_BH_UserArgs_MT128x128x64_MI16x16x1_SN_LDSB1_CLR1_GSU0_GSUC0_GSUWGMRR0_K1_LBSPPA2048_LBSPPB256_LPA0_MIWT4_4_PLR1_SU32_SUM0_SUS256_SKXCCM4_VWA4_VWB2_WGM2_WGMXCC1_WGMXCCGn1
    SolutionIndex: 79
    SolutionNameMin: Cijk_Ailk_Bljk_HSS_BH_UserArgs_MT128x128x64_MI16x16x1_SN_LDSB1_CLR1_GSU0_GSUC0_GSUWGMRR0_K1_LBSPPA2048_LBSPPB512_LPA0_MIWT4_4_PLR1_SU32_SUM0_SUS256_SKXCCM4_VWA4_VWB4_WGM2_WGMXCC1_WGMXCCGn1
    SolutionIndex: 80
    SolutionNameMin: Cijk_Ailk_Bljk_HSS_BH_UserArgs_MT128x128x64_MI16x16x1_SN_LDSB1_CLR1_GSU0_GSUC0_GSUWGMRR0_K1_LBSPPA2048_LBSPPB128_LPA0_MIWT4_4_PLR1_SU32_SUM0_SUS256_SKXCCM4_VWA4_VWB1_WGM4_WGMXCC1_WGMXCCGn1
    SolutionIndex: 81
    SolutionNameMin: Cijk_Ailk_Bljk_HSS_BH_UserArgs_MT128x128x64_MI16x16x1_SN_LDSB1_CLR1_GSU0_GSUC0_GSUWGMRR0_K1_LBSPPA2048_LBSPPB256_LPA0_MIWT4_4_PLR1_SU32_SUM0_SUS256_SKXCCM4_VWA4_VWB2_WGM4_WGMXCC1_WGMXCCGn1
    SolutionIndex: 82
    SolutionNameMin: Cijk_Ailk_Bljk_HSS_BH_UserArgs_MT128x64x64_MI16x16x1_SN_LDSB1_CLR1_GSU0_GSUC0_GSUWGMRR0_K1_LBSPPA2048_LBSPPB128_LPA0_MIWT4_2_PLR1_SU32_SUM0_SUS256_SKXCCM4_VWA4_VWB1_WGM1_WGMXCC1_WGMXCCGn1
    SolutionIndex: 83
    SolutionNameMin: Cijk_Ailk_Bljk_HSS_BH_UserArgs_MT128x64x64_MI16x16x1_SN_LDSB1_CLR1_GSU0_GSUC0_GSUWGMRR0_K1_LBSPPA2048_LBSPPB256_LPA0_MIWT4_2_PLR1_SU32_SUM0_SUS256_SKXCCM4_VWA4_VWB2_WGM1_WGMXCC1_WGMXCCGn1
    SolutionIndex: 84
    SolutionNameMin: Cijk_Ailk_Bljk_HSS_BH_UserArgs_MT128x64x64_MI16x16x1_SN_LDSB1_CLR1_GSU0_GSUC0_GSUWGMRR0_K1_LBSPPA2048_LBSPPB256_LPA0_MIWT4_2_PLR1_SU32_SUM0_SUS256_SKXCCM4_VWA4_VWB2_WGM2_WGMXCC1_WGMXCCGn1
    SolutionIndex: 85
    SolutionNameMin: Cijk_Ailk_Bljk_HSS_BH_UserArgs_MT64x64x64_MI16x16x1_SN_LDSB1_CLR1_GSU0_GSUC0_GSUWGMRR0_K1_LBSPPA1024_LBSPPB128_LPA32_MIWT2_2_PLR1_SU32_SUM0_SUS256_SKXCCM4_VWA2_VWB1_WGM1_WGMXCC1_WGMXCCGn1
    SolutionIndex: 86
    SolutionNameMin: Cijk_Ailk_Bljk_HSS_BH_UserArgs_MT64x64x64_MI16x16x1_SN_LDSB1_CLR1_GSU0_GSUC0_GSUWGMRR0_K1_LBSPPA1024_LBSPPB256_LPA32_MIWT2_2_PLR1_SU32_SUM0_SUS256_SKXCCM4_VWA2_VWB2_WGM1_WGMXCC1_WGMXCCGn1
    SolutionIndex: 87
    SolutionNameMin: Cijk_Ailk_Bljk_HSS_BH_UserArgs_MT32x64x64_MI16x16x1_SN_LDSB0_CLR1_GSU0_GSUC0_GSUWGMRR0_K1_LBSPPA512_LBSPPB128_LPA16_MIWT1_2_PLR1_SU32_SUM0_SUS256_SKXCCM4_VWA1_VWB1_WGM1_WGMXCC1_WGMXCCGn1
    SolutionIndex: 88
    SolutionNameMin: Cijk_Ailk_Bljk_HSS_BH_UserArgs_MT32x64x64_MI16x16x1_SN_LDSB0_CLR1_GSU0_GSUC0_GSUWGMRR0_K1_LBSPPA512_LBSPPB256_LPA16_MIWT1_2_PLR1_SU32_SUM0_SUS256_SKXCCM4_VWA1_VWB2_WGM1_WGMXCC1_WGMXCCGn1
    SolutionIndex: 89
    SolutionNameMin: Cijk_Ailk_Bljk_HSS_BH_UserArgs_MT64x32x64_MI16x16x1_SN_LDSB0_CLR1_GSU0_GSUC0_GSUWGMRR0_K1_LBSPPA1024_LBSPPB128_LPA32_MIWT2_1_PLR1_SU32_SUM0_SUS256_SKXCCM4_VWA2_VWB1_WGM1_WGMXCC1_WGMXCCGn1
    SolutionIndex: 90
    SolutionNameMin: Cijk_Ailk_Bljk_HSS_BH_UserArgs_MT32x32x64_MI16x16x1_SN_LDSB0_CLR1_GSU0_GSUC0_GSUWGMRR0_K1_LBSPPA512_LBSPPB128_LPA16_MIWT1_1_PLR1_SU32_SUM0_SUS256_SKXCCM4_VWA1_VWB1_WGM1_WGMXCC1_WGMXCCGn1
    SolutionIndex: 91
    SolutionNameMin: Cijk_Ailk_Bljk_HSS_BH_UserArgs_MT128x64x128_MI16x16x1_SN_LDSB1_CLR1_GSU0_GSUC0_GSUWGMRR0_K1_LBSPPA2048_LBSPPB512_LPA0_MIWT4_2_PLR2_SU32_SUM0_SUS256_SKXCCM4_VWA4_VWB2_WGM1_WGMXCC1_WGMXCCGn1
    SolutionIndex: 92
    SolutionNameMin: Cijk_Ailk_Bljk_HSS_BH_UserArgs_MT128x64x128_MI16x16x1_SN_LDSB1_CLR1_GSU0_GSUC0_GSUWGMRR0_K1_LBSPPA2048_LBSPPB256_LPA0_MIWT4_2_PLR2_SU32_SUM0_SUS256_SKXCCM4_VWA4_VWB1_WGM2_WGMXCC1_WGMXCCGn1
    SolutionIndex: 93
    SolutionNameMin: Cijk_Ailk_Bljk_HSS_BH_UserArgs_MT128x64x128_MI16x16x1_SN_LDSB1_CLR1_GSU0_GSUC0_GSUWGMRR0_K1_LBSPPA2048_LBSPPB512_LPA0_MIWT4_2_PLR2_SU32_SUM0_SUS256_SKXCCM4_VWA4_VWB2_WGM4_WGMXCC1_WGMXCCGn1
    SolutionIndex: 94
    SolutionNameMin: Cijk_Ailk_Bljk_HSS_BH_UserArgs_MT64x64x128_MI16x16x1_SN_LDSB1_CLR1_GSU0_GSUC0_GSUWGMRR0_K1_LBSPPA1024_LBSPPB256_LPA32_MIWT2_2_PLR2_SU32_SUM0_SUS256_SKXCCM4_VWA2_VWB1_WGM1_WGMXCC1_WGMXCCGn1
    SolutionIndex: 95
    SolutionNameMin: Cijk_Ailk_Bljk_HSS_BH_UserArgs_MT64x64x128_MI16x16x1_SN_LDSB1_CLR1_GSU0_GSUC0_GSUWGMRR0_K1_LBSPPA1024_LBSPPB512_LPA32_MIWT2_2_PLR2_SU32_SUM0_SUS256_SKXCCM4_VWA2_VWB2_WGM1_WGMXCC1_WGMXCCGn1
    SolutionIndex: 96
    SolutionNameMin: Cijk_Ailk_Bljk_HSS_BH_UserArgs_MT64x32x128_MI16x16x1_SN_LDSB1_CLR1_GSU0_GSUC0_GSUWGMRR0_K1_LBSPPA1024_LBSPPB256_LPA32_MIWT2_1_PLR2_SU32_SUM0_SUS256_SKXCCM4_VWA2_VWB1_WGM1_WGMXCC1_WGMXCCGn1
    SolutionIndex: 97
    SolutionNameMin: Cijk_Ailk_Bljk_HSS_BH_UserArgs_MT64x32x128_MI16x16x1_SN_LDSB1_CLR1_GSU0_GSUC0_GSUWGMRR0_K1_LBSPPA1024_LBSPPB256_LPA32_MIWT2_1_PLR2_SU32_SUM0_SUS256_SKXCCM4_VWA2_VWB1_WGM4_WGMXCC1_WGMXCCGn1
    SolutionIndex: 98
    SolutionNameMin: Cijk_Ailk_Bljk_HSS_BH_UserArgs_MT32x32x128_MI16x16x1_SN_LDSB1_CLR1_GSU0_GSUC0_GSUWGMRR0_K1_LBSPPA512_LBSPPB256_LPA16_MIWT1_1_PLR1_SU32_SUM0_SUS256_SKXCCM4_VWA1_VWB1_WGM1_WGMXCC1_WGMXCCGn1
    SolutionIndex: 99
    SolutionNameMin: Cijk_Ailk_Bljk_HSS_BH_UserArgs_MT32x32x128_MI16x16x1_SN_LDSB1_CLR1_GSU0_GSUC0_GSUWGMRR0_K1_LBSPPA512_LBSPPB256_LPA16_MIWT1_1_PLR2_SU32_SUM0_SUS256_SKXCCM4_VWA1_VWB1_WGM1_WGMXCC1_WGMXCCGn1
    SolutionIndex: 100
    SolutionNameMin: Cijk_Ailk_Bljk_HSS_BH_UserArgs_MT32x32x32_MI16x16x1_SN_LDSB0_CLR1_GSU0_GSUC0_GSUWGMRR0_K1_LBSPPA256_LBSPPB128_LPA16_MIWT1_1_PLR1_SU32_SUM0_SUS256_SKXCCM0_VWA1_VWB1_WGM1_WGMXCC1_WGMXCCGn1
- - - [128, 128, 1, 128, 128, 128, 128, 128]
    - [90, 0.088]
  - - [128, 128, 1, 256, 128, 128, 128, 256]
    - [98, 0.159]
  - - [128, 128, 1, 512, 128, 128, 128, 512]
    - [37, 0.264]
  - - [128, 128, 1, 1024, 128, 128, 128, 1024]
    - [98, 0.396]
  - - [128, 128, 1, 2048, 128, 128, 128, 2048]
    - [14, 0.591]
  - - [128, 128, 1, 4096, 128, 128, 128, 4096]
    - [30, 1.053]
  - - [128, 128, 1, 8192, 128, 128, 128, 8192]
    - [38, 1.582]
  - - [128, 256, 1, 128, 128, 128, 128, 128]
    - [30, 0.175]
  - - [128, 256, 1, 256, 128, 128, 128, 256]
    - [90, 0.316]
  - - [128, 256, 1, 512, 128, 128, 128, 512]
    - [98, 0.524]
  - - [128, 256, 1, 1024, 128, 128, 128, 1024]
    - [98, 0.782]
  - - [128, 256, 1, 2048, 128, 128, 128, 2048]
    - [38, 1.162]
  - - [128, 256, 1, 4096, 128, 128, 128, 4096]
    - [87, 1.767]
  - - [128, 256, 1, 8192, 128, 128, 128, 8192]
    - [96, 2.769]
  - - [128, 512, 1, 128, 128, 128, 128, 128]
    - [90, 0.344]
  - - [128, 512, 1, 256, 128, 128, 128, 256]
    - [90, 0.633]
  - - [128, 512, 1, 512, 128, 128, 128, 512]
    - [90, 1.026]
  - - [128, 512, 1, 1024, 128, 128, 128, 1024]
    - [98, 1.554]
  - - [128, 512, 1, 2048, 128, 128, 128, 2048]
    - [36, 2.091]
  - - [128, 512, 1, 4096, 128, 128, 128, 4096]
    - [36, 3.025]
  - - [128, 512, 1, 8192, 128, 128, 128, 8192]
    - [95, 4.553]
  - - [128, 1024, 1, 128, 128, 128, 128, 128]
    - [89, 0.636]
  - - [128, 1024, 1, 256, 128, 128, 128, 256]
    - [89, 1.121]
  - - [128, 1024, 1, 512, 128, 128, 128, 512]
    - [96, 1.855]
  - - [128, 1024, 1, 1024, 128, 128, 128, 1024]
    - [96, 2.796]
  - - [128, 1024, 1, 2048, 128, 128, 128, 2048]
    - [96, 3.671]
  - - [128, 1024, 1, 4096, 128, 128, 128, 4096]
    - [95, 4.994]
  - - [128, 1024, 1, 8192, 128, 128, 128, 8192]
    - [91, 7.125]
  - - [128, 2048, 1, 128, 128, 128, 128, 128]
    - [85, 1.112]
  - - [128, 2048, 1, 256, 128, 128, 128, 256]
    - [86, 1.917]
  - - [128, 2048, 1, 512, 128, 128, 128, 512]
    - [94, 3.137]
  - - [128, 2048, 1, 1024, 128, 128, 128, 1024]
    - [95, 4.603]
  - - [128, 2048, 1, 2048, 128, 128, 128, 2048]
    - [95, 6.021]
  - - [128, 2048, 1, 4096, 128, 128, 128, 4096]
    - [91, 7.647]
  - - [128, 2048, 1, 8192, 128, 128, 128, 8192]
    - [74, 10.024]
  - - [128, 4096, 1, 128, 128, 128, 128, 128]
    - [64, 1.843]
  - - [128, 4096, 1, 256, 128, 128, 128, 256]
    - [82, 3.13]
  - - [128, 4096, 1, 512, 128, 128, 128, 512]
    - [82, 4.861]
  - - [128, 4096, 1, 1024, 128, 128, 128, 1024]
    - [91, 6.982]
  - - [128, 4096, 1, 2048, 128, 128, 128, 2048]
    - [91, 8.715]
  - - [128, 4096, 1, 4096, 128, 128, 128, 4096]
    - [74, 10.78]
  - - [128, 4096, 1, 8192, 128, 128, 128, 8192]
    - [74, 13.66]
  - - [128, 8192, 1, 128, 128, 128, 128, 128]
    - [62, 2.768]
  - - [128, 8192, 1, 256, 128, 128, 128, 256]
    - [76, 4.597]
  - - [128, 8192, 1, 512, 128, 128, 128, 512]
    - [74, 7.029]
  - - [128, 8192, 1, 1024, 128, 128, 128, 1024]
    - [74, 9.368]
  - - [128, 8192, 1, 2048, 128, 128, 128, 2048]
    - [74, 10.861]
  - - [128, 8192, 1, 4096, 128, 128, 128, 4096]
    - [75, 13.898]
  - - [128, 8192, 1, 8192, 128, 128, 128, 8192]
    - [68, 15.553]
  - - [256, 128, 1, 128, 256, 256, 256, 128]
    - [90, 0.176]
  - - [256, 128, 1, 256, 256, 256, 256, 256]
    - [90, 0.316]
  - - [256, 128, 1, 512, 256, 256, 256, 512]
    - [98, 0.522]
  - - [256, 128, 1, 1024, 256, 256, 256, 1024]
    - [98, 0.782]
  - - [256, 128, 1, 2048, 256, 256, 256, 2048]
    - [37, 1.175]
  - - [256, 128, 1, 4096, 256, 256, 256, 4096]
    - [88, 1.774]
  - - [256, 128, 1, 8192, 256, 256, 256, 8192]
    - [97, 2.674]
  - - [256, 256, 1, 128, 256, 256, 256, 128]
    - [90, 0.346]
  - - [256, 256, 1, 256, 256, 256, 256, 256]
    - [90, 0.624]
  - - [256, 256, 1, 512, 256, 256, 256, 512]
    - [30, 1.015]
  - - [256, 256, 1, 1024, 256, 256, 256, 1024]
    - [99, 1.548]
  - - [256, 256, 1, 2048, 256, 256, 256, 2048]
    - [36, 2.095]
  - - [256, 256, 1, 4096, 256, 256, 256, 4096]
    - [36, 3.013]
  - - [256, 256, 1, 8192, 256, 256, 256, 8192]
    - [34, 4.149]
  - - [256, 512, 1, 128, 256, 256, 256, 128]
    - [88, 0.638]
  - - [256, 512, 1, 256, 256, 256, 256, 256]
    - [89, 1.117]
  - - [256, 512, 1, 512, 256, 256, 256, 512]
    - [96, 1.838]
  - - [256, 512, 1, 1024, 256, 256, 256, 1024]
    - [36, 2.752]
  - - [256, 512, 1, 2048, 256, 256, 256, 2048]
    - [96, 3.692]
  - - [256, 512, 1, 4096, 256, 256, 256, 4096]
    - [95, 4.992]
  - - [256, 512, 1, 8192, 256, 256, 256, 8192]
    - [32, 7.047]
  - - [256, 1024, 1, 128, 256, 256, 256, 128]
    - [85, 1.131]
  - - [256, 1024, 1, 256, 256, 256, 256, 256]
    - [86, 1.945]
  - - [256, 1024, 1, 512, 256, 256, 256, 512]
    - [95, 3.181]
  - - [256, 1024, 1, 1024, 256, 256, 256, 1024]
    - [95, 4.653]
  - - [256, 1024, 1, 2048, 256, 256, 256, 2048]
    - [95, 6.027]
  - - [256, 1024, 1, 4096, 256, 256, 256, 4096]
    - [33, 7.537]
  - - [256, 1024, 1, 8192, 256, 256, 256, 8192]
    - [23, 9.949]
  - - [256, 2048, 1, 128, 256, 256, 256, 128]
    - [83, 1.828]
  - - [256, 2048, 1, 256, 256, 256, 256, 256]
    - [83, 3.125]
  - - [256, 2048, 1, 512, 256, 256, 256, 512]
    - [82, 4.844]
  - - [256, 2048, 1, 1024, 256, 256, 256, 1024]
    - [91, 6.939]
  - - [256, 2048, 1, 2048, 256, 256, 256, 2048]
    - [91, 8.818]
  - - [256, 2048, 1, 4096, 256, 256, 256, 4096]
    - [77, 10.855]
  - - [256, 2048, 1, 8192, 256, 256, 256, 8192]
    - [76, 13.694]
  - - [256, 4096, 1, 128, 256, 256, 256, 128]
    - [61, 2.784]
  - - [256, 4096, 1, 256, 256, 256, 256, 256]
    - [76, 4.634]
  - - [256, 4096, 1, 512, 256, 256, 256, 512]
    - [76, 7.113]
  - - [256, 4096, 1, 1024, 256, 256, 256, 1024]
    - [76, 9.5]
  - - [256, 4096, 1, 2048, 256, 256, 256, 2048]
    - [76, 11.076]
  - - [256, 4096, 1, 4096, 256, 256, 256, 4096]
    - [80, 13.792]
  - - [256, 4096, 1, 8192, 256, 256, 256, 8192]
    - [80, 15.336]
  - - [256, 8192, 1, 128, 256, 256, 256, 128]
    - [51, 3.606]
  - - [256, 8192, 1, 256, 256, 256, 256, 256]
    - [53, 5.815]
  - - [256, 8192, 1, 512, 256, 256, 256, 512]
    - [11, 8.462]
  - - [256, 8192, 1, 1024, 256, 256, 256, 1024]
    - [19, 10.925]
  - - [256, 8192, 1, 2048, 256, 256, 256, 2048]
    - [74, 13.171]
  - - [256, 8192, 1, 4096, 256, 256, 256, 4096]
    - [20, 15.351]
  - - [256, 8192, 1, 8192, 256, 256, 256, 8192]
    - [72, 17.305]
  - - [512, 128, 1, 128, 512, 512, 512, 128]
    - [90, 0.345]
  - - [512, 128, 1, 256, 512, 512, 512, 256]
    - [90, 0.621]
  - - [512, 128, 1, 512, 512, 512, 512, 512]
    - [98, 1.03]
  - - [512, 128, 1, 1024, 512, 512, 512, 1024]
    - [38, 1.559]
  - - [512, 128, 1, 2048, 512, 512, 512, 2048]
    - [96, 2.067]
  - - [512, 128, 1, 4096, 512, 512, 512, 4096]
    - [36, 2.958]
  - - [512, 128, 1, 8192, 512, 512, 512, 8192]
    - [34, 4.187]
  - - [512, 256, 1, 128, 512, 512, 512, 128]
    - [29, 0.634]
  - - [512, 256, 1, 256, 512, 512, 512, 256]
    - [89, 1.119]
  - - [512, 256, 1, 512, 512, 512, 512, 512]
    - [36, 1.777]
  - - [512, 256, 1, 1024, 512, 512, 512, 1024]
    - [96, 2.802]
  - - [512, 256, 1, 2048, 512, 512, 512, 2048]
    - [96, 3.677]
  - - [512, 256, 1, 4096, 512, 512, 512, 4096]
    - [34, 4.91]
  - - [512, 256, 1, 8192, 512, 512, 512, 8192]
    - [31, 7.052]
  - - [512, 512, 1, 128, 512, 512, 512, 128]
    - [85, 1.121]
  - - [512, 512, 1, 256, 512, 512, 512, 256]
    - [86, 1.965]
  - - [512, 512, 1, 512, 512, 512, 512, 512]
    - [95, 3.16]
  - - [512, 512, 1, 1024, 512, 512, 512, 1024]
    - [95, 4.636]
  - - [512, 512, 1, 2048, 512, 512, 512, 2048]
    - [95, 6.014]
  - - [512, 512, 1, 4096, 512, 512, 512, 4096]
    - [33, 7.648]
  - - [512, 512, 1, 8192, 512, 512, 512, 8192]
    - [74, 9.981]
  - - [512, 1024, 1, 128, 512, 512, 512, 128]
    - [82, 1.866]
  - - [512, 1024, 1, 256, 512, 512, 512, 256]
    - [82, 3.185]
  - - [512, 1024, 1, 512, 512, 512, 512, 512]
    - [83, 4.899]
  - - [512, 1024, 1, 1024, 512, 512, 512, 1024]
    - [91, 6.995]
  - - [512, 1024, 1, 2048, 512, 512, 512, 2048]
    - [91, 8.862]
  - - [512, 1024, 1, 4096, 512, 512, 512, 4096]
    - [74, 10.81]
  - - [512, 1024, 1, 8192, 512, 512, 512, 8192]
    - [26, 13.613]
  - - [512, 2048, 1, 128, 512, 512, 512, 128]
    - [62, 2.773]
  - - [512, 2048, 1, 256, 512, 512, 512, 256]
    - [76, 4.636]
  - - [512, 2048, 1, 512, 512, 512, 512, 512]
    - [76, 7.139]
  - - [512, 2048, 1, 1024, 512, 512, 512, 1024]
    - [76, 9.754]
  - - [512, 2048, 1, 2048, 512, 512, 512, 2048]
    - [76, 11.138]
  - - [512, 2048, 1, 4096, 512, 512, 512, 4096]
    - [74, 13.775]
  - - [512, 2048, 1, 8192, 512, 512, 512, 8192]
    - [77, 15.353]
  - - [512, 4096, 1, 128, 512, 512, 512, 128]
    - [59, 3.705]
  - - [512, 4096, 1, 256, 512, 512, 512, 256]
    - [54, 6.038]
  - - [512, 4096, 1, 512, 512, 512, 512, 512]
    - [54, 8.693]
  - - [512, 4096, 1, 1024, 512, 512, 512, 1024]
    - [18, 11.157]
  - - [512, 4096, 1, 2048, 512, 512, 512, 2048]
    - [74, 13.166]
  - - [512, 4096, 1, 4096, 512, 512, 512, 4096]
    - [53, 15.219]
  - - [512, 4096, 1, 8192, 512, 512, 512, 8192]
    - [45, 16.831]
  - - [512, 8192, 1, 128, 512, 512, 512, 128]
    - [42, 4.176]
  - - [512, 8192, 1, 256, 512, 512, 512, 256]
    - [43, 6.686]
  - - [512, 8192, 1, 512, 512, 512, 512, 512]
    - [42, 9.757]
  - - [512, 8192, 1, 1024, 512, 512, 512, 1024]
    - [54, 12.317]
  - - [512, 8192, 1, 2048, 512, 512, 512, 2048]
    - [56, 14.684]
  - - [512, 8192, 1, 4096, 512, 512, 512, 4096]
    - [49, 16.582]
  - - [512, 8192, 1, 8192, 512, 512, 512, 8192]
    - [50, 18.693]
  - - [1024, 128, 1, 128, 1024, 1024, 1024, 128]
    - [89, 0.637]
  - - [1024, 128, 1, 256, 1024, 1024, 1024, 256]
    - [96, 1.121]
  - - [1024, 128, 1, 512, 1024, 1024, 1024, 512]
    - [96, 1.868]
  - - [1024, 128, 1, 1024, 1024, 1024, 1024, 1024]
    - [36, 2.762]
  - - [1024, 128, 1, 2048, 1024, 1024, 1024, 2048]
    - [36, 3.657]
  - - [1024, 128, 1, 4096, 1024, 1024, 1024, 4096]
    - [34, 4.88]
  - - [1024, 128, 1, 8192, 1024, 1024, 1024, 8192]
    - [32, 6.674]
  - - [1024, 256, 1, 128, 1024, 1024, 1024, 128]
    - [86, 1.127]
  - - [1024, 256, 1, 256, 1024, 1024, 1024, 256]
    - [85, 1.938]
  - - [1024, 256, 1, 512, 1024, 1024, 1024, 512]
    - [95, 3.17]
  - - [1024, 256, 1, 1024, 1024, 1024, 1024, 1024]
    - [95, 4.617]
  - - [1024, 256, 1, 2048, 1024, 1024, 1024, 2048]
    - [35, 5.938]
  - - [1024, 256, 1, 4096, 1024, 1024, 1024, 4096]
    - [27, 7.236]
  - - [1024, 256, 1, 8192, 1024, 1024, 1024, 8192]
    - [23, 9.889]
  - - [1024, 512, 1, 128, 1024, 1024, 1024, 128]
    - [65, 1.867]
  - - [1024, 512, 1, 256, 1024, 1024, 1024, 256]
    - [82, 3.188]
  - - [1024, 512, 1, 512, 1024, 1024, 1024, 512]
    - [83, 4.93]
  - - [1024, 512, 1, 1024, 1024, 1024, 1024, 1024]
    - [91, 7.016]
  - - [1024, 512, 1, 2048, 1024, 1024, 1024, 2048]
    - [74, 8.192]
  - - [1024, 512, 1, 4096, 1024, 1024, 1024, 4096]
    - [74, 10.744]
  - - [1024, 512, 1, 8192, 1024, 1024, 1024, 8192]
    - [26, 13.571]
  - - [1024, 1024, 1, 128, 1024, 1024, 1024, 128]
    - [75, 2.757]
  - - [1024, 1024, 1, 256, 1024, 1024, 1024, 256]
    - [76, 4.641]
  - - [1024, 1024, 1, 512, 1024, 1024, 1024, 512]
    - [75, 7.176]
  - - [1024, 1024, 1, 1024, 1024, 1024, 1024, 1024]
    - [79, 9.504]
  - - [1024, 1024, 1, 2048, 1024, 1024, 1024, 2048]
    - [74, 11.085]
  - - [1024, 1024, 1, 4096, 1024, 1024, 1024, 4096]
    - [75, 13.773]
  - - [1024, 1024, 1, 8192, 1024, 1024, 1024, 8192]
    - [76, 15.175]
  - - [1024, 2048, 1, 128, 1024, 1024, 1024, 128]
    - [58, 3.748]
  - - [1024, 2048, 1, 256, 1024, 1024, 1024, 256]
    - [13, 6.075]
  - - [1024, 2048, 1, 512, 1024, 1024, 1024, 512]
    - [13, 8.751]
  - - [1024, 2048, 1, 1024, 1024, 1024, 1024, 1024]
    - [18, 11.224]
  - - [1024, 2048, 1, 2048, 1024, 1024, 1024, 2048]
    - [74, 13.185]
  - - [1024, 2048, 1, 4096, 1024, 1024, 1024, 4096]
    - [70, 15.201]
  - - [1024, 2048, 1, 8192, 1024, 1024, 1024, 8192]
    - [43, 16.899]
  - - [1024, 4096, 1, 128, 1024, 1024, 1024, 128]
    - [2, 4.236]
  - - [1024, 4096, 1, 256, 1024, 1024, 1024, 256]
    - [6, 6.821]
  - - [1024, 4096, 1, 512, 1024, 1024, 1024, 512]
    - [6, 9.868]
  - - [1024, 4096, 1, 1024, 1024, 1024, 1024, 1024]
    - [53, 12.359]
  - - [1024, 4096, 1, 2048, 1024, 1024, 1024, 2048]
    - [57, 14.626]
  - - [1024, 4096, 1, 4096, 1024, 1024, 1024, 4096]
    - [45, 16.809]
  - - [1024, 4096, 1, 8192, 1024, 1024, 1024, 8192]
    - [46, 18.682]
  - - [1024, 8192, 1, 128, 1024, 1024, 1024, 128]
    - [53, 4.362]
  - - [1024, 8192, 1, 256, 1024, 1024, 1024, 256]
    - [53, 7.199]
  - - [1024, 8192, 1, 512, 1024, 1024, 1024, 512]
    - [45, 10.354]
  - - [1024, 8192, 1, 1024, 1024, 1024, 1024, 1024]
    - [50, 13.722]
  - - [1024, 8192, 1, 2048, 1024, 1024, 1024, 2048]
    - [46, 16.115]
  - - [1024, 8192, 1, 4096, 1024, 1024, 1024, 4096]
    - [48, 18.218]
  - - [1024, 8192, 1, 8192, 1024, 1024, 1024, 8192]
    - [49, 20.027]
  - - [2048, 128, 1, 128, 2048, 2048, 2048, 128]
    - [85, 1.127]
  - - [2048, 128, 1, 256, 2048, 2048, 2048, 256]
    - [86, 1.944]
  - - [2048, 128, 1, 512, 2048, 2048, 2048, 512]
    - [95, 3.132]
  - - [2048, 128, 1, 1024, 2048, 2048, 2048, 1024]
    - [94, 4.618]
  - - [2048, 128, 1, 2048, 2048, 2048, 2048, 2048]
    - [84, 5.333]
  - - [2048, 128, 1, 4096, 2048, 2048, 2048, 4096]
    - [76, 7.221]
  - - [2048, 128, 1, 8192, 2048, 2048, 2048, 8192]
    - [23, 9.821]
  - - [2048, 256, 1, 128, 2048, 2048, 2048, 128]
    - [64, 1.859]
  - - [2048, 256, 1, 256, 2048, 2048, 2048, 256]
    - [82, 3.178]
  - - [2048, 256, 1, 512, 2048, 2048, 2048, 512]
    - [82, 4.915]
  - - [2048, 256, 1, 1024, 2048, 2048, 2048, 1024]
    - [93, 6.853]
  - - [2048, 256, 1, 2048, 2048, 2048, 2048, 2048]
    - [77, 8.112]
  - - [2048, 256, 1, 4096, 2048, 2048, 2048, 4096]
    - [74, 10.694]
  - - [2048, 256, 1, 8192, 2048, 2048, 2048, 8192]
    - [21, 13.509]
  - - [2048, 512, 1, 128, 2048, 2048, 2048, 128]
    - [62, 2.794]
  - - [2048, 512, 1, 256, 2048, 2048, 2048, 256]
    - [76, 4.664]
  - - [2048, 512, 1, 512, 2048, 2048, 2048, 512]
    - [81, 7.078]
  - - [2048, 512, 1, 1024, 2048, 2048, 2048, 1024]
    - [78, 9.522]
  - - [2048, 512, 1, 2048, 2048, 2048, 2048, 2048]
    - [74, 10.969]
  - - [2048, 512, 1, 4096, 2048, 2048, 2048, 4096]
    - [74, 13.892]
  - - [2048, 512, 1, 8192, 2048, 2048, 2048, 8192]
    - [19, 15.234]
  - - [2048, 1024, 1, 128, 2048, 2048, 2048, 128]
    - [57, 3.713]
  - - [2048, 1024, 1, 256, 2048, 2048, 2048, 256]
    - [57, 5.913]
  - - [2048, 1024, 1, 512, 2048, 2048, 2048, 512]
    - [12, 8.613]
  - - [2048, 1024, 1, 1024, 2048, 2048, 2048, 1024]
    - [17, 11.09]
  - - [2048, 1024, 1, 2048, 2048, 2048, 2048, 2048]
    - [75, 13.082]
  - - [2048, 1024, 1, 4096, 2048, 2048, 2048, 4096]
    - [67, 15.493]
  - - [2048, 1024, 1, 8192, 2048, 2048, 2048, 8192]
    - [72, 16.808]
  - - [2048, 2048, 1, 128, 2048, 2048, 2048, 128]
    - [50, 4.282]
  - - [2048, 2048, 1, 256, 2048, 2048, 2048, 256]
    - [50, 6.861]
  - - [2048, 2048, 1, 512, 2048, 2048, 2048, 512]
    - [5, 9.936]
  - - [2048, 2048, 1, 1024, 2048, 2048, 2048, 1024]
    - [53, 12.405]
  - - [2048, 2048, 1, 2048, 2048, 2048, 2048, 2048]
    - [54, 14.836]
  - - [2048, 2048, 1, 4096, 2048, 2048, 2048, 4096]
    - [48, 16.722]
  - - [2048, 2048, 1, 8192, 2048, 2048, 2048, 8192]
    - [41, 18.704]
  - - [2048, 4096, 1, 128, 2048, 2048, 2048, 128]
    - [54, 4.409]
  - - [2048, 4096, 1, 256, 2048, 2048, 2048, 256]
    - [54, 7.233]
  - - [2048, 4096, 1, 512, 2048, 2048, 2048, 512]
    - [41, 10.511]
  - - [2048, 4096, 1, 1024, 2048, 2048, 2048, 1024]
    - [40, 13.887]
  - - [2048, 4096, 1, 2048, 2048, 2048, 2048, 2048]
    - [44, 16.181]
  - - [2048, 4096, 1, 4096, 2048, 2048, 2048, 4096]
    - [45, 18.294]
  - - [2048, 4096, 1, 8192, 2048, 2048, 2048, 8192]
    - [44, 20.114]
  - - [2048, 8192, 1, 128, 2048, 2048, 2048, 128]
    - [54, 5.295]
  - - [2048, 8192, 1, 256, 2048, 2048, 2048, 256]
    - [59, 8.055]
  - - [2048, 8192, 1, 512, 2048, 2048, 2048, 512]
    - [48, 11.336]
  - - [2048, 8192, 1, 1024, 2048, 2048, 2048, 1024]
    - [43, 14.387]
  - - [2048, 8192, 1, 2048, 2048, 2048, 2048, 2048]
    - [43, 17.191]
  - - [2048, 8192, 1, 4096, 2048, 2048, 2048, 4096]
    - [47, 19.363]
  - - [2048, 8192, 1, 8192, 2048, 2048, 2048, 8192]
    - [48, 19.841]
  - - [4096, 128, 1, 128, 4096, 4096, 4096, 128]
    - [28, 1.797]
  - - [4096, 128, 1, 256, 4096, 4096, 4096, 256]
    - [28, 3.063]
  - - [4096, 128, 1, 512, 4096, 4096, 4096, 512]
    - [82, 4.723]
  - - [4096, 128, 1, 1024, 4096, 4096, 4096, 1024]
    - [92, 6.634]
  - - [4096, 128, 1, 2048, 4096, 4096, 4096, 2048]
    - [32, 8.14]
  - - [4096, 128, 1, 4096, 4096, 4096, 4096, 4096]
    - [22, 10.768]
  - - [4096, 128, 1, 8192, 4096, 4096, 4096, 8192]
    - [21, 13.73]
  - - [4096, 256, 1, 128, 4096, 4096, 4096, 128]
    - [63, 2.71]
  - - [4096, 256, 1, 256, 4096, 4096, 4096, 256]
    - [77, 4.567]
  - - [4096, 256, 1, 512, 4096, 4096, 4096, 512]
    - [77, 7.059]
  - - [4096, 256, 1, 1024, 4096, 4096, 4096, 1024]
    - [80, 9.513]
  - - [4096, 256, 1, 2048, 4096, 4096, 4096, 2048]
    - [22, 10.954]
  - - [4096, 256, 1, 4096, 4096, 4096, 4096, 4096]
    - [26, 13.759]
  - - [4096, 256, 1, 8192, 4096, 4096, 4096, 8192]
    - [18, 15.329]
  - - [4096, 512, 1, 128, 4096, 4096, 4096, 128]
    - [56, 3.752]
  - - [4096, 512, 1, 256, 4096, 4096, 4096, 256]
    - [56, 6.025]
  - - [4096, 512, 1, 512, 4096, 4096, 4096, 512]
    - [55, 8.703]
  - - [4096, 512, 1, 1024, 4096, 4096, 4096, 1024]
    - [15, 11.152]
  - - [4096, 512, 1, 2048, 4096, 4096, 4096, 2048]
    - [24, 13.072]
  - - [4096, 512, 1, 4096, 4096, 4096, 4096, 4096]
    - [66, 15.482]
  - - [4096, 512, 1, 8192, 4096, 4096, 4096, 8192]
    - [7, 16.711]
  - - [4096, 1024, 1, 128, 4096, 4096, 4096, 128]
    - [4, 4.212]
  - - [4096, 1024, 1, 256, 4096, 4096, 4096, 256]
    - [3, 6.821]
  - - [4096, 1024, 1, 512, 4096, 4096, 4096, 512]
    - [4, 9.838]
  - - [4096, 1024, 1, 1024, 4096, 4096, 4096, 1024]
    - [52, 12.402]
  - - [4096, 1024, 1, 2048, 4096, 4096, 4096, 2048]
    - [69, 14.756]
  - - [4096, 1024, 1, 4096, 4096, 4096, 4096, 4096]
    - [1, 16.566]
  - - [4096, 1024, 1, 8192, 4096, 4096, 4096, 8192]
    - [7, 18.559]
  - - [4096, 2048, 1, 128, 4096, 4096, 4096, 128]
    - [53, 4.398]
  - - [4096, 2048, 1, 256, 4096, 4096, 4096, 256]
    - [56, 7.236]
  - - [4096, 2048, 1, 512, 4096, 4096, 4096, 512]
    - [40, 10.48]
  - - [4096, 2048, 1, 1024, 4096, 4096, 4096, 1024]
    - [39, 13.687]
  - - [4096, 2048, 1, 2048, 4096, 4096, 4096, 2048]
    - [41, 16.109]
  - - [4096, 2048, 1, 4096, 4096, 4096, 4096, 4096]
    - [39, 18.26]
  - - [4096, 2048, 1, 8192, 4096, 4096, 4096, 8192]
    - [43, 19.91]
  - - [4096, 4096, 1, 128, 4096, 4096, 4096, 128]
    - [56, 5.221]
  - - [4096, 4096, 1, 256, 4096, 4096, 4096, 256]
    - [53, 8.053]
  - - [4096, 4096, 1, 512, 4096, 4096, 4096, 512]
    - [41, 11.164]
  - - [4096, 4096, 1, 1024, 4096, 4096, 4096, 1024]
    - [43, 14.154]
  - - [4096, 4096, 1, 2048, 4096, 4096, 4096, 2048]
    - [46, 16.985]
  - - [4096, 4096, 1, 4096, 4096, 4096, 4096, 4096]
    - [44, 19.27]
  - - [4096, 4096, 1, 8192, 4096, 4096, 4096, 8192]
    - [47, 20.25]
  - - [4096, 8192, 1, 128, 4096, 4096, 4096, 128]
    - [10, 5.437]
  - - [4096, 8192, 1, 256, 4096, 4096, 4096, 256]
    - [20, 8.061]
  - - [4096, 8192, 1, 512, 4096, 4096, 4096, 512]
    - [0, 10.854]
  - - [4096, 8192, 1, 1024, 4096, 4096, 4096, 1024]
    - [0, 14.374]
  - - [4096, 8192, 1, 2048, 4096, 4096, 4096, 2048]
    - [46, 17.453]
  - - [4096, 8192, 1, 4096, 4096, 4096, 4096, 4096]
    - [48, 19.176]
  - - [4096, 8192, 1, 8192, 4096, 4096, 4096, 8192]
    - [48, 20.247]
  - - [8192, 128, 1, 128, 8192, 8192, 8192, 128]
    - [60, 2.768]
  - - [8192, 128, 1, 256, 8192, 8192, 8192, 256]
    - [74, 4.63]
  - - [8192, 128, 1, 512, 8192, 8192, 8192, 512]
    - [74, 6.965]
  - - [8192, 128, 1, 1024, 8192, 8192, 8192, 1024]
    - [21, 9.223]
  - - [8192, 128, 1, 2048, 8192, 8192, 8192, 2048]
    - [74, 11.098]
  - - [8192, 128, 1, 4096, 8192, 8192, 8192, 4096]
    - [25, 13.875]
  - - [8192, 128, 1, 8192, 8192, 8192, 8192, 8192]
    - [80, 15.074]
  - - [8192, 256, 1, 128, 8192, 8192, 8192, 128]
    - [52, 3.774]
  - - [8192, 256, 1, 256, 8192, 8192, 8192, 256]
    - [52, 6.099]
  - - [8192, 256, 1, 512, 8192, 8192, 8192, 512]
    - [53, 8.764]
  - - [8192, 256, 1, 1024, 8192, 8192, 8192, 1024]
    - [16, 11.151]
  - - [8192, 256, 1, 2048, 8192, 8192, 8192, 2048]
    - [75, 13.183]
  - - [8192, 256, 1, 4096, 8192, 8192, 8192, 4096]
    - [71, 15.483]
  - - [8192, 256, 1, 8192, 8192, 8192, 8192, 8192]
    - [69, 16.748]
  - - [8192, 512, 1, 128, 8192, 8192, 8192, 128]
    - [3, 4.183]
  - - [8192, 512, 1, 256, 8192, 8192, 8192, 256]
    - [0, 6.757]
  - - [8192, 512, 1, 512, 8192, 8192, 8192, 512]
    - [3, 9.824]
  - - [8192, 512, 1, 1024, 8192, 8192, 8192, 1024]
    - [52, 12.341]
  - - [8192, 512, 1, 2048, 8192, 8192, 8192, 2048]
    - [67, 14.819]
  - - [8192, 512, 1, 4096, 8192, 8192, 8192, 4096]
    - [41, 16.584]
  - - [8192, 512, 1, 8192, 8192, 8192, 8192, 8192]
    - [44, 18.552]
  - - [8192, 1024, 1, 128, 8192, 8192, 8192, 128]
    - [52, 4.398]
  - - [8192, 1024, 1, 256, 8192, 8192, 8192, 256]
    - [53, 7.235]
  - - [8192, 1024, 1, 512, 8192, 8192, 8192, 512]
    - [44, 10.377]
  - - [8192, 1024, 1, 1024, 8192, 8192, 8192, 1024]
    - [46, 13.556]
  - - [8192, 1024, 1, 2048, 8192, 8192, 8192, 2048]
    - [8, 15.938]
  - - [8192, 1024, 1, 4096, 8192, 8192, 8192, 4096]
    - [39, 18.13]
  - - [8192, 1024, 1, 8192, 8192, 8192, 8192, 8192]
    - [39, 19.874]
  - - [8192, 2048, 1, 128, 8192, 8192, 8192, 128]
    - [52, 5.246]
  - - [8192, 2048, 1, 256, 8192, 8192, 8192, 256]
    - [54, 7.917]
  - - [8192, 2048, 1, 512, 8192, 8192, 8192, 512]
    - [44, 11.36]
  - - [8192, 2048, 1, 1024, 8192, 8192, 8192, 1024]
    - [48, 14.214]
  - - [8192, 2048, 1, 2048, 8192, 8192, 8192, 2048]
    - [48, 17.093]
  - - [8192, 2048, 1, 4096, 8192, 8192, 8192, 4096]
    - [48, 19.309]
  - - [8192, 2048, 1, 8192, 8192, 8192, 8192, 8192]
    - [48, 20.215]
  - - [8192, 4096, 1, 128, 8192, 8192, 8192, 128]
    - [9, 5.226]
  - - [8192, 4096, 1, 256, 8192, 8192, 8192, 256]
    - [73, 7.835]
  - - [8192, 4096, 1, 512, 8192, 8192, 8192, 512]
    - [48, 10.963]
  - - [8192, 4096, 1, 1024, 8192, 8192, 8192, 1024]
    - [48, 14.434]
  - - [8192, 4096, 1, 2048, 8192, 8192, 8192, 2048]
    - [44, 17.406]
  - - [8192, 4096, 1, 4096, 8192, 8192, 8192, 4096]
    - [48, 19.413]
  - - [8192, 4096, 1, 8192, 8192, 8192, 8192, 8192]
    - [44, 20.345]
  - - [8192, 8192, 1, 128, 8192, 8192, 8192, 128]
    - [45, 4.901]
  - - [8192, 8192, 1, 256, 8192, 8192, 8192, 256]
    - [48, 7.814]
  - - [8192, 8192, 1, 512, 8192, 8192, 8192, 512]
    - [48, 11.57]
  - - [8192, 8192, 1, 1024, 8192, 8192, 8192, 1024]
    - [48, 15.157]
  - - [8192, 8192, 1, 2048, 8192, 8192, 8192, 2048]
    - [48, 17.881]
  - - [8192, 8192, 1, 4096, 8192, 8192, 8192, 4096]
    - [48, 19.626]
  - - [8192, 8192, 1, 8192, 8192, 8192, 8192, 8192]
    - [50, 20.705]
  - - [1, 1, 1, 32, 1, 1, 1, 32]
    - [100, 0.0]
- null
- null
- ExperimentalStreamK
- GridBased
