library/src/amd_detail/rocblaslt/src/Tensile/Logic/asm_full/aquavanjaram/gfx942_80cu/StreamK/aquavanjaram942_Cijk_Ailk_Bjlk_BSS_BH_UserArgs.yaml
- {MinimumRequiredVersion: 4.33.0}
- aquavanjaram942
- {Architecture: gfx942, CUCount: 80}
- [Device 0049, Device 0050]
    SolutionIndex: 0
    SolutionNameMin: Cijk_Ailk_Bjlk_BSS_BH_UserArgs_MT256x256x32_MI16x16x1_SN_LDSB1_CLR1_GSU0_GSUC0_GSUWGMRR0_K1_LBSPPA2048_LBSPPB2048_LPA0_LPB32_MIWT8_8_PLR1_SU32_SUM0_SUS256_SKXCCM0_VWA4_VWB2_WGM1_WGMXCC1_WGMXCCGn1
    SolutionIndex: 1
    SolutionNameMin: Cijk_Ailk_Bjlk_BSS_BH_UserArgs_MT256x256x32_MI16x16x1_SN_LDSB0_CLR1_GSU0_GSUC0_GSUWGMRR0_K1_LBSPPA2048_LBSPPB2048_LPA0_LPB0_MIWT8_8_PLR1_SU32_SUM0_SUS256_SKXCCM0_VWA4_VWB4_WGM1_WGMXCC1_WGMXCCGn1
    SolutionIndex: 2
    SolutionNameMin: Cijk_Ailk_Bjlk_BSS_BH_UserArgs_MT256x256x32_MI16x16x1_SN_LDSB0_CLR1_GSU0_GSUC0_GSUWGMRR0_K1_LBSPPA2048_LBSPPB2048_LPA0_LPB0_MIWT8_8_PLR1_SU32_SUM0_SUS256_SKXCCM0_VWA4_VWB8_WGM1_WGMXCC1_WGMXCCGn1
    SolutionIndex: 3
    SolutionNameMin: Cijk_Ailk_Bjlk_BSS_BH_UserArgs_MT256x256x32_MI16x16x1_SN_LDSB1_CLR1_GSU0_GSUC0_GSUWGMRR0_K1_LBSPPA2048_LBSPPB2048_LPA0_LPB32_MIWT8_8_PLR1_SU32_SUM0_SUS256_SKXCCM0_VWA4_VWB2_WGM2_WGMXCC1_WGMXCCGn1
    SolutionIndex: 4
    SolutionNameMin: Cijk_Ailk_Bjlk_BSS_BH_UserArgs_MT256x256x32_MI16x16x1_SN_LDSB1_CLR1_GSU0_GSUC0_GSUWGMRR0_K1_LBSPPA2048_LBSPPB2048_LPA0_LPB16_MIWT8_8_PLR1_SU32_SUM0_SUS256_SKXCCM0_VWA4_VWB1_WGM4_WGMXCC1_WGMXCCGn1
    SolutionIndex: 5
    SolutionNameMin: Cijk_Ailk_Bjlk_BSS_BH_UserArgs_MT256x256x32_MI16x16x1_SN_LDSB1_CLR1_GSU0_GSUC0_GSUWGMRR0_K1_LBSPPA2048_LBSPPB2048_LPA0_LPB32_MIWT8_8_PLR1_SU32_SUM0_SUS256_SKXCCM0_VWA4_VWB2_WGM4_WGMXCC1_WGMXCCGn1
    SolutionIndex: 6
    SolutionNameMin: Cijk_Ailk_Bjlk_BSS_BH_UserArgs_MT256x256x32_MI16x16x1_SN_LDSB0_CLR1_GSU0_GSUC0_GSUWGMRR0_K1_LBSPPA2048_LBSPPB2048_LPA0_LPB0_MIWT8_8_PLR1_SU32_SUM0_SUS256_SKXCCM0_VWA4_VWB8_WGM4_WGMXCC1_WGMXCCGn1
    SolutionIndex: 7
    SolutionNameMin: Cijk_Ailk_Bjlk_BSS_BH_UserArgs_MT128x256x32_MI16x16x1_SN_LDSB1_CLR1_GSU0_GSUC0_GSUWGMRR0_K1_LBSPPA1024_LBSPPB2048_LPA0_LPB32_MIWT4_8_PLR1_SU32_SUM0_SUS256_SKXCCM0_VWA4_VWB2_WGM1_WGMXCC1_WGMXCCGn1
    SolutionIndex: 8
    SolutionNameMin: Cijk_Ailk_Bjlk_BSS_BH_UserArgs_MT128x256x32_MI16x16x1_SN_LDSB1_CLR1_GSU0_GSUC0_GSUWGMRR0_K1_LBSPPA1024_LBSPPB2048_LPA0_LPB0_MIWT4_8_PLR1_SU32_SUM0_SUS256_SKXCCM0_VWA4_VWB8_WGM1_WGMXCC1_WGMXCCGn1
    SolutionIndex: 9
    SolutionNameMin: Cijk_Ailk_Bjlk_BSS_BH_UserArgs_MT256x128x32_MI16x16x1_SN_LDSB1_CLR1_GSU0_GSUC0_GSUWGMRR0_K1_LBSPPA2048_LBSPPB1024_LPA0_LPB16_MIWT8_4_PLR1_SU32_SUM0_SUS256_SKXCCM0_VWA4_VWB1_WGM1_WGMXCC1_WGMXCCGn1
    SolutionIndex: 10
    SolutionNameMin: Cijk_Ailk_Bjlk_BSS_BH_UserArgs_MT256x128x32_MI16x16x1_SN_LDSB1_CLR1_GSU0_GSUC0_GSUWGMRR0_K1_LBSPPA2048_LBSPPB1024_LPA0_LPB0_MIWT8_4_PLR1_SU32_SUM0_SUS256_SKXCCM0_VWA4_VWB4_WGM1_WGMXCC1_WGMXCCGn1
    SolutionIndex: 11
    SolutionNameMin: Cijk_Ailk_Bjlk_BSS_BH_UserArgs_MT256x128x32_MI16x16x1_SN_LDSB1_CLR1_GSU0_GSUC0_GSUWGMRR0_K1_LBSPPA2048_LBSPPB1024_LPA0_LPB32_MIWT8_4_PLR1_SU32_SUM0_SUS256_SKXCCM0_VWA4_VWB2_WGM4_WGMXCC1_WGMXCCGn1
    SolutionIndex: 12
    SolutionNameMin: Cijk_Ailk_Bjlk_BSS_BH_UserArgs_MT128x64x32_MI16x16x1_SN_LDSB0_CLR1_GSU0_GSUC0_GSUWGMRR0_K1_LBSPPA1024_LBSPPB512_LPA0_LPB16_MIWT4_2_PLR1_SU32_SUM0_SUS256_SKXCCM0_VWA4_VWB1_WGM4_WGMXCC1_WGMXCCGn1
    SolutionIndex: 13
    SolutionNameMin: Cijk_Ailk_Bjlk_BSS_BH_UserArgs_MT128x64x32_MI16x16x1_SN_LDSB0_CLR1_GSU0_GSUC0_GSUWGMRR0_K1_LBSPPA1024_LBSPPB512_LPA0_LPB32_MIWT4_2_PLR1_SU32_SUM0_SUS256_SKXCCM0_VWA4_VWB2_WGM4_WGMXCC1_WGMXCCGn1
    SolutionIndex: 14
    SolutionNameMin: Cijk_Ailk_Bjlk_BSS_BH_UserArgs_MT32x32x32_MI16x16x1_SN_LDSB0_CLR1_GSU0_GSUC0_GSUWGMRR0_K1_LBSPPA256_LBSPPB256_LPA16_LPB16_MIWT1_1_PLR1_SU32_SUM0_SUS256_SKXCCM0_VWA1_VWB1_WGM1_WGMXCC1_WGMXCCGn1
    SolutionIndex: 15
    SolutionNameMin: Cijk_Ailk_Bjlk_BSS_BH_UserArgs_MT256x256x64_MI16x16x1_SN_LDSB1_CLR1_GSU0_GSUC0_GSUWGMRR0_K1_LBSPPA2048_LBSPPB2048_LPA0_LPB0_MIWT8_8_PLR1_SU32_SUM0_SUS256_SKXCCM0_VWA4_VWB4_WGM1_WGMXCC1_WGMXCCGn1
    SolutionIndex: 16
    SolutionNameMin: Cijk_Ailk_Bjlk_BSS_BH_UserArgs_MT256x256x64_MI16x16x1_SN_LDSB1_CLR1_GSU0_GSUC0_GSUWGMRR0_K1_LBSPPA2048_LBSPPB2048_LPA0_LPB0_MIWT8_8_PLR2_SU32_SUM0_SUS256_SKXCCM0_VWA4_VWB8_WGM1_WGMXCC1_WGMXCCGn1
    SolutionIndex: 17
    SolutionNameMin: Cijk_Ailk_Bjlk_BSS_BH_UserArgs_MT256x256x64_MI16x16x1_SN_LDSB1_CLR1_GSU0_GSUC0_GSUWGMRR0_K1_LBSPPA2048_LBSPPB2048_LPA0_LPB0_MIWT8_8_PLR1_SU32_SUM0_SUS256_SKXCCM0_VWA4_VWB4_WGM2_WGMXCC1_WGMXCCGn1
    SolutionIndex: 18
    SolutionNameMin: Cijk_Ailk_Bjlk_BSS_BH_UserArgs_MT256x256x64_MI16x16x1_SN_LDSB1_CLR1_GSU0_GSUC0_GSUWGMRR0_K1_LBSPPA2048_LBSPPB2048_LPA0_LPB0_MIWT8_8_PLR1_SU32_SUM0_SUS256_SKXCCM0_VWA4_VWB4_WGM4_WGMXCC1_WGMXCCGn1
    SolutionIndex: 19
    SolutionNameMin: Cijk_Ailk_Bjlk_BSS_BH_UserArgs_MT128x256x64_MI16x16x1_SN_LDSB1_CLR1_GSU0_GSUC0_GSUWGMRR0_K1_LBSPPA1024_LBSPPB2048_LPA0_LPB32_MIWT4_8_PLR1_SU32_SUM0_SUS256_SKXCCM0_VWA4_VWB2_WGM1_WGMXCC1_WGMXCCGn1
    SolutionIndex: 20
    SolutionNameMin: Cijk_Ailk_Bjlk_BSS_BH_UserArgs_MT128x256x64_MI16x16x1_SN_LDSB1_CLR1_GSU0_GSUC0_GSUWGMRR0_K1_LBSPPA1024_LBSPPB2048_LPA0_LPB0_MIWT4_8_PLR1_SU32_SUM0_SUS256_SKXCCM0_VWA4_VWB4_WGM1_WGMXCC1_WGMXCCGn1
    SolutionIndex: 21
    SolutionNameMin: Cijk_Ailk_Bjlk_BSS_BH_UserArgs_MT128x256x64_MI16x16x1_SN_LDSB1_CLR1_GSU0_GSUC0_GSUWGMRR0_K1_LBSPPA1024_LBSPPB2048_LPA0_LPB0_MIWT4_8_PLR1_SU32_SUM0_SUS256_SKXCCM0_VWA4_VWB4_WGM4_WGMXCC1_WGMXCCGn1
    SolutionIndex: 22
    SolutionNameMin: Cijk_Ailk_Bjlk_BSS_BH_UserArgs_MT256x128x64_MI16x16x1_SN_LDSB1_CLR1_GSU0_GSUC0_GSUWGMRR0_K1_LBSPPA2048_LBSPPB1024_LPA0_LPB16_MIWT8_4_PLR1_SU32_SUM0_SUS256_SKXCCM0_VWA4_VWB1_WGM1_WGMXCC1_WGMXCCGn1
    SolutionIndex: 23
    SolutionNameMin: Cijk_Ailk_Bjlk_BSS_BH_UserArgs_MT256x128x64_MI16x16x1_SN_LDSB1_CLR1_GSU0_GSUC0_GSUWGMRR0_K1_LBSPPA2048_LBSPPB1024_LPA0_LPB32_MIWT8_4_PLR1_SU32_SUM0_SUS256_SKXCCM0_VWA4_VWB2_WGM1_WGMXCC1_WGMXCCGn1
    SolutionIndex: 24
    SolutionNameMin: Cijk_Ailk_Bjlk_BSS_BH_UserArgs_MT256x128x64_MI16x16x1_SN_LDSB1_CLR1_GSU0_GSUC0_GSUWGMRR0_K1_LBSPPA2048_LBSPPB1024_LPA0_LPB32_MIWT8_4_PLR1_SU32_SUM0_SUS256_SKXCCM0_VWA4_VWB2_WGM4_WGMXCC1_WGMXCCGn1
    SolutionIndex: 25
    SolutionNameMin: Cijk_Ailk_Bjlk_BSS_BH_UserArgs_MT128x128x64_MI16x16x1_SN_LDSB1_CLR1_GSU0_GSUC0_GSUWGMRR0_K1_LBSPPA1024_LBSPPB1024_LPA0_LPB0_MIWT4_4_PLR1_SU32_SUM0_SUS256_SKXCCM0_VWA4_VWB4_WGM1_WGMXCC1_WGMXCCGn1
    SolutionIndex: 26
    SolutionNameMin: Cijk_Ailk_Bjlk_BSS_BH_UserArgs_MT128x128x64_MI16x16x1_SN_LDSB1_CLR1_GSU0_GSUC0_GSUWGMRR0_K1_LBSPPA1024_LBSPPB1024_LPA0_LPB0_MIWT4_4_PLR1_SU32_SUM0_SUS256_SKXCCM0_VWA4_VWB4_WGM4_WGMXCC1_WGMXCCGn1
    SolutionIndex: 27
    SolutionNameMin: Cijk_Ailk_Bjlk_BSS_BH_UserArgs_MT128x64x64_MI16x16x1_SN_LDSB1_CLR1_GSU0_GSUC0_GSUWGMRR0_K1_LBSPPA1024_LBSPPB512_LPA0_LPB32_MIWT4_2_PLR2_SU32_SUM0_SUS256_SKXCCM0_VWA4_VWB2_WGM1_WGMXCC1_WGMXCCGn1
    SolutionIndex: 28
    SolutionNameMin: Cijk_Ailk_Bjlk_BSS_BH_UserArgs_MT32x64x64_MI16x16x1_SN_LDSB0_CLR1_GSU0_GSUC0_GSUWGMRR0_K1_LBSPPA256_LBSPPB512_LPA16_LPB32_MIWT1_2_PLR2_SU32_SUM0_SUS256_SKXCCM0_VWA1_VWB2_WGM1_WGMXCC1_WGMXCCGn1
    SolutionIndex: 29
    SolutionNameMin: Cijk_Ailk_Bjlk_BSS_BH_UserArgs_MT32x32x64_MI16x16x1_SN_LDSB0_CLR1_GSU0_GSUC0_GSUWGMRR0_K1_LBSPPA256_LBSPPB256_LPA16_LPB16_MIWT1_1_PLR1_SU32_SUM0_SUS256_SKXCCM0_VWA1_VWB1_WGM1_WGMXCC1_WGMXCCGn1
    SolutionIndex: 30
    SolutionNameMin: Cijk_Ailk_Bjlk_BSS_BH_UserArgs_MT32x32x64_MI16x16x1_SN_LDSB0_CLR1_GSU0_GSUC0_GSUWGMRR0_K1_LBSPPA256_LBSPPB256_LPA16_LPB16_MIWT1_1_PLR2_SU32_SUM0_SUS256_SKXCCM0_VWA1_VWB1_WGM1_WGMXCC1_WGMXCCGn1
    SolutionIndex: 31
    SolutionNameMin: Cijk_Ailk_Bjlk_BSS_BH_UserArgs_MT128x128x128_MI16x16x1_SN_LDSB1_CLR1_GSU0_GSUC0_GSUWGMRR0_K1_LBSPPA1024_LBSPPB1024_LPA0_LPB0_MIWT4_4_PLR1_SU32_SUM0_SUS256_SKXCCM0_VWA4_VWB4_WGM1_WGMXCC1_WGMXCCGn1
    SolutionIndex: 32
    SolutionNameMin: Cijk_Ailk_Bjlk_BSS_BH_UserArgs_MT128x128x128_MI16x16x1_SN_LDSB1_CLR1_GSU0_GSUC0_GSUWGMRR0_K1_LBSPPA1024_LBSPPB1024_LPA0_LPB0_MIWT4_4_PLR1_SU32_SUM0_SUS256_SKXCCM0_VWA4_VWB4_WGM2_WGMXCC1_WGMXCCGn1
    SolutionIndex: 33
    SolutionNameMin: Cijk_Ailk_Bjlk_BSS_BH_UserArgs_MT128x128x128_MI16x16x1_SN_LDSB1_CLR1_GSU0_GSUC0_GSUWGMRR0_K1_LBSPPA1024_LBSPPB1024_LPA0_LPB0_MIWT4_4_PLR1_SU32_SUM0_SUS256_SKXCCM0_VWA4_VWB4_WGM4_WGMXCC1_WGMXCCGn1
    SolutionIndex: 34
    SolutionNameMin: Cijk_Ailk_Bjlk_BSS_BH_UserArgs_MT128x64x128_MI16x16x1_SN_LDSB1_CLR1_GSU0_GSUC0_GSUWGMRR0_K1_LBSPPA1024_LBSPPB512_LPA0_LPB32_MIWT4_2_PLR2_SU32_SUM0_SUS256_SKXCCM0_VWA4_VWB2_WGM1_WGMXCC1_WGMXCCGn1
    SolutionIndex: 35
    SolutionNameMin: Cijk_Ailk_Bjlk_BSS_BH_UserArgs_MT64x64x128_MI16x16x1_SN_LDSB1_CLR1_GSU0_GSUC0_GSUWGMRR0_K1_LBSPPA512_LBSPPB512_LPA32_LPB32_MIWT2_2_PLR2_SU32_SUM0_SUS256_SKXCCM0_VWA2_VWB2_WGM1_WGMXCC1_WGMXCCGn1
    SolutionIndex: 36
    SolutionNameMin: Cijk_Ailk_Bjlk_BSS_BH_UserArgs_MT64x64x128_MI16x16x1_SN_LDSB1_CLR1_GSU0_GSUC0_GSUWGMRR0_K1_LBSPPA512_LBSPPB512_LPA32_LPB32_MIWT2_2_PLR2_SU32_SUM0_SUS256_SKXCCM0_VWA2_VWB2_WGM2_WGMXCC1_WGMXCCGn1
    SolutionIndex: 37
    SolutionNameMin: Cijk_Ailk_Bjlk_BSS_BH_UserArgs_MT64x64x128_MI16x16x1_SN_LDSB1_CLR1_GSU0_GSUC0_GSUWGMRR0_K1_LBSPPA512_LBSPPB512_LPA32_LPB32_MIWT2_2_PLR2_SU32_SUM0_SUS256_SKXCCM0_VWA2_VWB2_WGM4_WGMXCC1_WGMXCCGn1
    SolutionIndex: 38
    SolutionNameMin: Cijk_Ailk_Bjlk_BSS_BH_UserArgs_MT32x64x128_MI16x16x1_SN_LDSB1_CLR1_GSU0_GSUC0_GSUWGMRR0_K1_LBSPPA256_LBSPPB512_LPA16_LPB32_MIWT1_2_PLR2_SU32_SUM0_SUS256_SKXCCM0_VWA1_VWB2_WGM1_WGMXCC1_WGMXCCGn1
    SolutionIndex: 39
    SolutionNameMin: Cijk_Ailk_Bjlk_BSS_BH_UserArgs_MT64x32x128_MI16x16x1_SN_LDSB1_CLR1_GSU0_GSUC0_GSUWGMRR0_K1_LBSPPA512_LBSPPB256_LPA32_LPB16_MIWT2_1_PLR2_SU32_SUM0_SUS256_SKXCCM0_VWA2_VWB1_WGM1_WGMXCC1_WGMXCCGn1
    SolutionIndex: 40
    SolutionNameMin: Cijk_Ailk_Bjlk_BSS_BH_UserArgs_MT32x32x128_MI16x16x1_SN_LDSB1_CLR1_GSU0_GSUC0_GSUWGMRR0_K1_LBSPPA256_LBSPPB256_LPA16_LPB16_MIWT1_1_PLR1_SU32_SUM0_SUS256_SKXCCM0_VWA1_VWB1_WGM1_WGMXCC1_WGMXCCGn1
    SolutionIndex: 41
    SolutionNameMin: Cijk_Ailk_Bjlk_BSS_BH_UserArgs_MT256x256x32_MI16x16x1_SN_LDSB1_CLR1_GSU0_GSUC0_GSUWGMRR0_K1_LBSPPA2048_LBSPPB2048_LPA0_LPB16_MIWT8_8_PLR1_SU32_SUM0_SUS256_SKXCCM4_VWA4_VWB1_WGM1_WGMXCC1_WGMXCCGn1
    SolutionIndex: 42
    SolutionNameMin: Cijk_Ailk_Bjlk_BSS_BH_UserArgs_MT256x256x32_MI16x16x1_SN_LDSB1_CLR1_GSU0_GSUC0_GSUWGMRR0_K1_LBSPPA2048_LBSPPB2048_LPA0_LPB32_MIWT8_8_PLR1_SU32_SUM0_SUS256_SKXCCM4_VWA4_VWB2_WGM1_WGMXCC1_WGMXCCGn1
    SolutionIndex: 43
    SolutionNameMin: Cijk_Ailk_Bjlk_BSS_BH_UserArgs_MT256x256x32_MI16x16x1_SN_LDSB0_CLR1_GSU0_GSUC0_GSUWGMRR0_K1_LBSPPA2048_LBSPPB2048_LPA0_LPB0_MIWT8_8_PLR1_SU32_SUM0_SUS256_SKXCCM4_VWA4_VWB4_WGM1_WGMXCC1_WGMXCCGn1
    SolutionIndex: 44
    SolutionNameMin: Cijk_Ailk_Bjlk_BSS_BH_UserArgs_MT256x256x32_MI16x16x1_SN_LDSB0_CLR1_GSU0_GSUC0_GSUWGMRR0_K1_LBSPPA2048_LBSPPB2048_LPA0_LPB0_MIWT8_8_PLR1_SU32_SUM0_SUS256_SKXCCM4_VWA4_VWB8_WGM1_WGMXCC1_WGMXCCGn1
    SolutionIndex: 45
    SolutionNameMin: Cijk_Ailk_Bjlk_BSS_BH_UserArgs_MT256x256x32_MI16x16x1_SN_LDSB1_CLR1_GSU0_GSUC0_GSUWGMRR0_K1_LBSPPA2048_LBSPPB2048_LPA0_LPB32_MIWT8_8_PLR1_SU32_SUM0_SUS256_SKXCCM4_VWA4_VWB2_WGM2_WGMXCC1_WGMXCCGn1
    SolutionIndex: 46
    SolutionNameMin: Cijk_Ailk_Bjlk_BSS_BH_UserArgs_MT256x256x32_MI16x16x1_SN_LDSB0_CLR1_GSU0_GSUC0_GSUWGMRR0_K1_LBSPPA2048_LBSPPB2048_LPA0_LPB0_MIWT8_8_PLR1_SU32_SUM0_SUS256_SKXCCM4_VWA4_VWB8_WGM2_WGMXCC1_WGMXCCGn1
    SolutionIndex: 47
    SolutionNameMin: Cijk_Ailk_Bjlk_BSS_BH_UserArgs_MT256x256x32_MI16x16x1_SN_LDSB1_CLR1_GSU0_GSUC0_GSUWGMRR0_K1_LBSPPA2048_LBSPPB2048_LPA0_LPB32_MIWT8_8_PLR1_SU32_SUM0_SUS256_SKXCCM4_VWA4_VWB2_WGM4_WGMXCC1_WGMXCCGn1
    SolutionIndex: 48
    SolutionNameMin: Cijk_Ailk_Bjlk_BSS_BH_UserArgs_MT256x256x32_MI16x16x1_SN_LDSB0_CLR1_GSU0_GSUC0_GSUWGMRR0_K1_LBSPPA2048_LBSPPB2048_LPA0_LPB0_MIWT8_8_PLR1_SU32_SUM0_SUS256_SKXCCM4_VWA4_VWB4_WGM4_WGMXCC1_WGMXCCGn1
    SolutionIndex: 49
    SolutionNameMin: Cijk_Ailk_Bjlk_BSS_BH_UserArgs_MT256x256x32_MI16x16x1_SN_LDSB0_CLR1_GSU0_GSUC0_GSUWGMRR0_K1_LBSPPA2048_LBSPPB2048_LPA0_LPB0_MIWT8_8_PLR1_SU32_SUM0_SUS256_SKXCCM4_VWA4_VWB8_WGM4_WGMXCC1_WGMXCCGn1
    SolutionIndex: 50
    SolutionNameMin: Cijk_Ailk_Bjlk_BSS_BH_UserArgs_MT128x256x32_MI16x16x1_SN_LDSB1_CLR1_GSU0_GSUC0_GSUWGMRR0_K1_LBSPPA1024_LBSPPB2048_LPA0_LPB0_MIWT4_8_PLR1_SU32_SUM0_SUS256_SKXCCM4_VWA4_VWB4_WGM1_WGMXCC1_WGMXCCGn1
    SolutionIndex: 51
    SolutionNameMin: Cijk_Ailk_Bjlk_BSS_BH_UserArgs_MT128x256x32_MI16x16x1_SN_LDSB1_CLR1_GSU0_GSUC0_GSUWGMRR0_K1_LBSPPA1024_LBSPPB2048_LPA0_LPB0_MIWT4_8_PLR1_SU32_SUM0_SUS256_SKXCCM4_VWA4_VWB8_WGM1_WGMXCC1_WGMXCCGn1
    SolutionIndex: 52
    SolutionNameMin: Cijk_Ailk_Bjlk_BSS_BH_UserArgs_MT128x256x32_MI16x16x1_SN_LDSB1_CLR1_GSU0_GSUC0_GSUWGMRR0_K1_LBSPPA1024_LBSPPB2048_LPA0_LPB0_MIWT4_8_PLR1_SU32_SUM0_SUS256_SKXCCM4_VWA4_VWB8_WGM2_WGMXCC1_WGMXCCGn1
    SolutionIndex: 53
    SolutionNameMin: Cijk_Ailk_Bjlk_BSS_BH_UserArgs_MT128x256x32_MI16x16x1_SN_LDSB1_CLR1_GSU0_GSUC0_GSUWGMRR0_K1_LBSPPA1024_LBSPPB2048_LPA0_LPB0_MIWT4_8_PLR1_SU32_SUM0_SUS256_SKXCCM4_VWA4_VWB8_WGM4_WGMXCC1_WGMXCCGn1
    SolutionIndex: 54
    SolutionNameMin: Cijk_Ailk_Bjlk_BSS_BH_UserArgs_MT256x128x32_MI16x16x1_SN_LDSB1_CLR1_GSU0_GSUC0_GSUWGMRR0_K1_LBSPPA2048_LBSPPB1024_LPA0_LPB16_MIWT8_4_PLR1_SU32_SUM0_SUS256_SKXCCM4_VWA4_VWB1_WGM1_WGMXCC1_WGMXCCGn1
    SolutionIndex: 55
    SolutionNameMin: Cijk_Ailk_Bjlk_BSS_BH_UserArgs_MT256x128x32_MI16x16x1_SN_LDSB1_CLR1_GSU0_GSUC0_GSUWGMRR0_K1_LBSPPA2048_LBSPPB1024_LPA0_LPB32_MIWT8_4_PLR1_SU32_SUM0_SUS256_SKXCCM4_VWA4_VWB2_WGM1_WGMXCC1_WGMXCCGn1
    SolutionIndex: 56
    SolutionNameMin: Cijk_Ailk_Bjlk_BSS_BH_UserArgs_MT256x128x32_MI16x16x1_SN_LDSB1_CLR1_GSU0_GSUC0_GSUWGMRR0_K1_LBSPPA2048_LBSPPB1024_LPA0_LPB0_MIWT8_4_PLR1_SU32_SUM0_SUS256_SKXCCM4_VWA4_VWB4_WGM1_WGMXCC1_WGMXCCGn1
    SolutionIndex: 57
    SolutionNameMin: Cijk_Ailk_Bjlk_BSS_BH_UserArgs_MT256x128x32_MI16x16x1_SN_LDSB1_CLR1_GSU0_GSUC0_GSUWGMRR0_K1_LBSPPA2048_LBSPPB1024_LPA0_LPB32_MIWT8_4_PLR1_SU32_SUM0_SUS256_SKXCCM4_VWA4_VWB2_WGM2_WGMXCC1_WGMXCCGn1
    SolutionIndex: 58
    SolutionNameMin: Cijk_Ailk_Bjlk_BSS_BH_UserArgs_MT256x128x32_MI16x16x1_SN_LDSB1_CLR1_GSU0_GSUC0_GSUWGMRR0_K1_LBSPPA2048_LBSPPB1024_LPA0_LPB0_MIWT8_4_PLR1_SU32_SUM0_SUS256_SKXCCM4_VWA4_VWB4_WGM2_WGMXCC1_WGMXCCGn1
    SolutionIndex: 59
    SolutionNameMin: Cijk_Ailk_Bjlk_BSS_BH_UserArgs_MT256x128x32_MI16x16x1_SN_LDSB1_CLR1_GSU0_GSUC0_GSUWGMRR0_K1_LBSPPA2048_LBSPPB1024_LPA0_LPB32_MIWT8_4_PLR1_SU32_SUM0_SUS256_SKXCCM4_VWA4_VWB2_WGM4_WGMXCC1_WGMXCCGn1
    SolutionIndex: 60
    SolutionNameMin: Cijk_Ailk_Bjlk_BSS_BH_UserArgs_MT128x128x32_MI16x16x1_SN_LDSB1_CLR1_GSU0_GSUC0_GSUWGMRR0_K1_LBSPPA1024_LBSPPB1024_LPA0_LPB32_MIWT4_4_PLR1_SU32_SUM0_SUS256_SKXCCM4_VWA4_VWB2_WGM1_WGMXCC1_WGMXCCGn1
    SolutionIndex: 61
    SolutionNameMin: Cijk_Ailk_Bjlk_BSS_BH_UserArgs_MT128x128x32_MI16x16x1_SN_LDSB0_CLR1_GSU0_GSUC0_GSUWGMRR0_K1_LBSPPA1024_LBSPPB1024_LPA0_LPB0_MIWT4_4_PLR1_SU32_SUM0_SUS256_SKXCCM4_VWA4_VWB4_WGM1_WGMXCC1_WGMXCCGn1
    SolutionIndex: 62
    SolutionNameMin: Cijk_Ailk_Bjlk_BSS_BH_UserArgs_MT128x64x32_MI16x16x1_SN_LDSB0_CLR1_GSU0_GSUC0_GSUWGMRR0_K1_LBSPPA1024_LBSPPB512_LPA0_LPB16_MIWT4_2_PLR1_SU32_SUM0_SUS256_SKXCCM4_VWA4_VWB1_WGM1_WGMXCC1_WGMXCCGn1
    SolutionIndex: 63
    SolutionNameMin: Cijk_Ailk_Bjlk_BSS_BH_UserArgs_MT128x64x32_MI16x16x1_SN_LDSB0_CLR1_GSU0_GSUC0_GSUWGMRR0_K1_LBSPPA1024_LBSPPB512_LPA0_LPB32_MIWT4_2_PLR1_SU32_SUM0_SUS256_SKXCCM4_VWA4_VWB2_WGM1_WGMXCC1_WGMXCCGn1
    SolutionIndex: 64
    SolutionNameMin: Cijk_Ailk_Bjlk_BSS_BH_UserArgs_MT128x64x32_MI16x16x1_SN_LDSB0_CLR1_GSU0_GSUC0_GSUWGMRR0_K1_LBSPPA1024_LBSPPB512_LPA0_LPB32_MIWT4_2_PLR1_SU32_SUM0_SUS256_SKXCCM4_VWA4_VWB2_WGM4_WGMXCC1_WGMXCCGn1
    SolutionIndex: 65
    SolutionNameMin: Cijk_Ailk_Bjlk_BSS_BH_UserArgs_MT64x64x32_MI16x16x1_SN_LDSB0_CLR1_GSU0_GSUC0_GSUWGMRR0_K1_LBSPPA512_LBSPPB512_LPA32_LPB32_MIWT2_2_PLR1_SU32_SUM0_SUS256_SKXCCM4_VWA2_VWB2_WGM1_WGMXCC1_WGMXCCGn1
    SolutionIndex: 66
    SolutionNameMin: Cijk_Ailk_Bjlk_BSS_BH_UserArgs_MT32x32x32_MI16x16x1_SN_LDSB0_CLR1_GSU0_GSUC0_GSUWGMRR0_K1_LBSPPA256_LBSPPB256_LPA16_LPB16_MIWT1_1_PLR1_SU32_SUM0_SUS256_SKXCCM4_VWA1_VWB1_WGM1_WGMXCC1_WGMXCCGn1
    SolutionIndex: 67
    SolutionNameMin: Cijk_Ailk_Bjlk_BSS_BH_UserArgs_MT32x32x32_MI16x16x1_SN_LDSB0_CLR0_GSU0_GSUC0_GSUWGMRR0_K1_LBSPPA256_LBSPPB256_LPA16_LPB16_MIWT1_1_PLR0_SU32_SUM0_SUS256_SKXCCM4_VWA1_VWB1_WGM1_WGMXCC1_WGMXCCGn1
    SolutionIndex: 68
    SolutionNameMin: Cijk_Ailk_Bjlk_BSS_BH_UserArgs_MT256x256x64_MI16x16x1_SN_LDSB1_CLR1_GSU0_GSUC0_GSUWGMRR0_K1_LBSPPA2048_LBSPPB2048_LPA0_LPB0_MIWT8_8_PLR1_SU32_SUM0_SUS256_SKXCCM4_VWA4_VWB4_WGM1_WGMXCC1_WGMXCCGn1
    SolutionIndex: 69
    SolutionNameMin: Cijk_Ailk_Bjlk_BSS_BH_UserArgs_MT256x256x64_MI16x16x1_SN_LDSB1_CLR1_GSU0_GSUC0_GSUWGMRR0_K1_LBSPPA2048_LBSPPB2048_LPA0_LPB0_MIWT8_8_PLR2_SU32_SUM0_SUS256_SKXCCM4_VWA4_VWB4_WGM1_WGMXCC1_WGMXCCGn1
    SolutionIndex: 70
    SolutionNameMin: Cijk_Ailk_Bjlk_BSS_BH_UserArgs_MT256x256x64_MI16x16x1_SN_LDSB1_CLR1_GSU0_GSUC0_GSUWGMRR0_K1_LBSPPA2048_LBSPPB2048_LPA0_LPB0_MIWT8_8_PLR2_SU32_SUM0_SUS256_SKXCCM4_VWA4_VWB8_WGM1_WGMXCC1_WGMXCCGn1
    SolutionIndex: 71
    SolutionNameMin: Cijk_Ailk_Bjlk_BSS_BH_UserArgs_MT256x256x64_MI16x16x1_SN_LDSB1_CLR1_GSU0_GSUC0_GSUWGMRR0_K1_LBSPPA2048_LBSPPB2048_LPA0_LPB0_MIWT8_8_PLR1_SU32_SUM0_SUS256_SKXCCM4_VWA4_VWB4_WGM2_WGMXCC1_WGMXCCGn1
    SolutionIndex: 72
    SolutionNameMin: Cijk_Ailk_Bjlk_BSS_BH_UserArgs_MT256x256x64_MI16x16x1_SN_LDSB1_CLR1_GSU0_GSUC0_GSUWGMRR0_K1_LBSPPA2048_LBSPPB2048_LPA0_LPB0_MIWT8_8_PLR1_SU32_SUM0_SUS256_SKXCCM4_VWA4_VWB4_WGM4_WGMXCC1_WGMXCCGn1
    SolutionIndex: 73
    SolutionNameMin: Cijk_Ailk_Bjlk_BSS_BH_UserArgs_MT256x256x64_MI16x16x1_SN_LDSB1_CLR1_GSU0_GSUC0_GSUWGMRR0_K1_LBSPPA2048_LBSPPB2048_LPA0_LPB0_MIWT8_8_PLR2_SU32_SUM0_SUS256_SKXCCM4_VWA4_VWB4_WGM4_WGMXCC1_WGMXCCGn1
    SolutionIndex: 74
    SolutionNameMin: Cijk_Ailk_Bjlk_BSS_BH_UserArgs_MT128x128x64_MI16x16x1_SN_LDSB1_CLR1_GSU0_GSUC0_GSUWGMRR0_K1_LBSPPA1024_LBSPPB1024_LPA0_LPB0_MIWT4_4_PLR1_SU32_SUM0_SUS256_SKXCCM4_VWA4_VWB4_WGM1_WGMXCC1_WGMXCCGn1
    SolutionIndex: 75
    SolutionNameMin: Cijk_Ailk_Bjlk_BSS_BH_UserArgs_MT128x128x64_MI16x16x1_SN_LDSB1_CLR1_GSU0_GSUC0_GSUWGMRR0_K1_LBSPPA1024_LBSPPB1024_LPA0_LPB0_MIWT4_4_PLR1_SU32_SUM0_SUS256_SKXCCM4_VWA4_VWB4_WGM2_WGMXCC1_WGMXCCGn1
    SolutionIndex: 76
    SolutionNameMin: Cijk_Ailk_Bjlk_BSS_BH_UserArgs_MT128x128x64_MI16x16x1_SN_LDSB1_CLR1_GSU0_GSUC0_GSUWGMRR0_K1_LBSPPA1024_LBSPPB1024_LPA0_LPB0_MIWT4_4_PLR1_SU32_SUM0_SUS256_SKXCCM4_VWA4_VWB4_WGM4_WGMXCC1_WGMXCCGn1
    SolutionIndex: 77
    SolutionNameMin: Cijk_Ailk_Bjlk_BSS_BH_UserArgs_MT128x64x64_MI16x16x1_SN_LDSB1_CLR1_GSU0_GSUC0_GSUWGMRR0_K1_LBSPPA1024_LBSPPB512_LPA0_LPB32_MIWT4_2_PLR2_SU32_SUM0_SUS256_SKXCCM4_VWA4_VWB2_WGM1_WGMXCC1_WGMXCCGn1
    SolutionIndex: 78
    SolutionNameMin: Cijk_Ailk_Bjlk_BSS_BH_UserArgs_MT128x64x64_MI16x16x1_SN_LDSB1_CLR1_GSU0_GSUC0_GSUWGMRR0_K1_LBSPPA1024_LBSPPB512_LPA0_LPB32_MIWT4_2_PLR2_SU32_SUM0_SUS256_SKXCCM4_VWA4_VWB2_WGM4_WGMXCC1_WGMXCCGn1
    SolutionIndex: 79
    SolutionNameMin: Cijk_Ailk_Bjlk_BSS_BH_UserArgs_MT64x64x64_MI16x16x1_SN_LDSB1_CLR1_GSU0_GSUC0_GSUWGMRR0_K1_LBSPPA512_LBSPPB512_LPA32_LPB32_MIWT2_2_PLR1_SU32_SUM0_SUS256_SKXCCM4_VWA2_VWB2_WGM1_WGMXCC1_WGMXCCGn1
    SolutionIndex: 80
    SolutionNameMin: Cijk_Ailk_Bjlk_BSS_BH_UserArgs_MT64x64x64_MI16x16x1_SN_LDSB1_CLR1_GSU0_GSUC0_GSUWGMRR0_K1_LBSPPA512_LBSPPB512_LPA32_LPB32_MIWT2_2_PLR2_SU32_SUM0_SUS256_SKXCCM4_VWA2_VWB2_WGM1_WGMXCC1_WGMXCCGn1
    SolutionIndex: 81
    SolutionNameMin: Cijk_Ailk_Bjlk_BSS_BH_UserArgs_MT64x64x64_MI16x16x1_SN_LDSB1_CLR1_GSU0_GSUC0_GSUWGMRR0_K1_LBSPPA512_LBSPPB512_LPA32_LPB32_MIWT2_2_PLR1_SU32_SUM0_SUS256_SKXCCM4_VWA2_VWB2_WGM2_WGMXCC1_WGMXCCGn1
    SolutionIndex: 82
    SolutionNameMin: Cijk_Ailk_Bjlk_BSS_BH_UserArgs_MT64x64x64_MI16x16x1_SN_LDSB1_CLR1_GSU0_GSUC0_GSUWGMRR0_K1_LBSPPA512_LBSPPB512_LPA32_LPB32_MIWT2_2_PLR2_SU32_SUM0_SUS256_SKXCCM4_VWA2_VWB2_WGM4_WGMXCC1_WGMXCCGn1
    SolutionIndex: 83
    SolutionNameMin: Cijk_Ailk_Bjlk_BSS_BH_UserArgs_MT32x64x64_MI16x16x1_SN_LDSB0_CLR1_GSU0_GSUC0_GSUWGMRR0_K1_LBSPPA256_LBSPPB512_LPA16_LPB32_MIWT1_2_PLR2_SU32_SUM0_SUS256_SKXCCM4_VWA1_VWB2_WGM1_WGMXCC1_WGMXCCGn1
    SolutionIndex: 84
    SolutionNameMin: Cijk_Ailk_Bjlk_BSS_BH_UserArgs_MT64x32x64_MI16x16x1_SN_LDSB0_CLR1_GSU0_GSUC0_GSUWGMRR0_K1_LBSPPA512_LBSPPB256_LPA32_LPB16_MIWT2_1_PLR1_SU32_SUM0_SUS256_SKXCCM4_VWA2_VWB1_WGM1_WGMXCC1_WGMXCCGn1
    SolutionIndex: 85
    SolutionNameMin: Cijk_Ailk_Bjlk_BSS_BH_UserArgs_MT64x32x64_MI16x16x1_SN_LDSB0_CLR1_GSU0_GSUC0_GSUWGMRR0_K1_LBSPPA512_LBSPPB256_LPA32_LPB16_MIWT2_1_PLR2_SU32_SUM0_SUS256_SKXCCM4_VWA2_VWB1_WGM1_WGMXCC1_WGMXCCGn1
    SolutionIndex: 86
    SolutionNameMin: Cijk_Ailk_Bjlk_BSS_BH_UserArgs_MT32x32x64_MI16x16x1_SN_LDSB0_CLR1_GSU0_GSUC0_GSUWGMRR0_K1_LBSPPA256_LBSPPB256_LPA16_LPB16_MIWT1_1_PLR1_SU32_SUM0_SUS256_SKXCCM4_VWA1_VWB1_WGM1_WGMXCC1_WGMXCCGn1
    SolutionIndex: 87
    SolutionNameMin: Cijk_Ailk_Bjlk_BSS_BH_UserArgs_MT128x128x128_MI16x16x1_SN_LDSB1_CLR1_GSU0_GSUC0_GSUWGMRR0_K1_LBSPPA1024_LBSPPB1024_LPA0_LPB0_MIWT4_4_PLR1_SU32_SUM0_SUS256_SKXCCM4_VWA4_VWB4_WGM1_WGMXCC1_WGMXCCGn1
    SolutionIndex: 88
    SolutionNameMin: Cijk_Ailk_Bjlk_BSS_BH_UserArgs_MT128x128x128_MI16x16x1_SN_LDSB1_CLR1_GSU0_GSUC0_GSUWGMRR0_K1_LBSPPA1024_LBSPPB1024_LPA0_LPB0_MIWT4_4_PLR1_SU32_SUM0_SUS256_SKXCCM4_VWA4_VWB4_WGM2_WGMXCC1_WGMXCCGn1
    SolutionIndex: 89
    SolutionNameMin: Cijk_Ailk_Bjlk_BSS_BH_UserArgs_MT128x64x128_MI16x16x1_SN_LDSB1_CLR1_GSU0_GSUC0_GSUWGMRR0_K1_LBSPPA1024_LBSPPB512_LPA0_LPB32_MIWT4_2_PLR2_SU32_SUM0_SUS256_SKXCCM4_VWA4_VWB2_WGM1_WGMXCC1_WGMXCCGn1
    SolutionIndex: 90
    SolutionNameMin: Cijk_Ailk_Bjlk_BSS_BH_UserArgs_MT128x64x128_MI16x16x1_SN_LDSB1_CLR1_GSU0_GSUC0_GSUWGMRR0_K1_LBSPPA1024_LBSPPB512_LPA0_LPB32_MIWT4_2_PLR2_SU32_SUM0_SUS256_SKXCCM4_VWA4_VWB2_WGM4_WGMXCC1_WGMXCCGn1
    SolutionIndex: 91
    SolutionNameMin: Cijk_Ailk_Bjlk_BSS_BH_UserArgs_MT64x64x128_MI16x16x1_SN_LDSB1_CLR1_GSU0_GSUC0_GSUWGMRR0_K1_LBSPPA512_LBSPPB512_LPA32_LPB32_MIWT2_2_PLR2_SU32_SUM0_SUS256_SKXCCM4_VWA2_VWB2_WGM1_WGMXCC1_WGMXCCGn1
    SolutionIndex: 92
    SolutionNameMin: Cijk_Ailk_Bjlk_BSS_BH_UserArgs_MT32x64x128_MI16x16x1_SN_LDSB1_CLR1_GSU0_GSUC0_GSUWGMRR0_K1_LBSPPA256_LBSPPB512_LPA16_LPB32_MIWT1_2_PLR2_SU32_SUM0_SUS256_SKXCCM4_VWA1_VWB2_WGM1_WGMXCC1_WGMXCCGn1
    SolutionIndex: 93
    SolutionNameMin: Cijk_Ailk_Bjlk_BSS_BH_UserArgs_MT64x32x128_MI16x16x1_SN_LDSB1_CLR1_GSU0_GSUC0_GSUWGMRR0_K1_LBSPPA512_LBSPPB256_LPA32_LPB16_MIWT2_1_PLR2_SU32_SUM0_SUS256_SKXCCM4_VWA2_VWB1_WGM1_WGMXCC1_WGMXCCGn1
    SolutionIndex: 94
    SolutionNameMin: Cijk_Ailk_Bjlk_BSS_BH_UserArgs_MT64x32x128_MI16x16x1_SN_LDSB1_CLR1_GSU0_GSUC0_GSUWGMRR0_K1_LBSPPA512_LBSPPB256_LPA32_LPB16_MIWT2_1_PLR2_SU32_SUM0_SUS256_SKXCCM4_VWA2_VWB1_WGM4_WGMXCC1_WGMXCCGn1
    SolutionIndex: 95
    SolutionNameMin: Cijk_Ailk_Bjlk_BSS_BH_UserArgs_MT32x32x32_MI16x16x1_SN_LDSB0_CLR1_GSU0_GSUC0_GSUWGMRR0_K1_LBSPPA256_LBSPPB256_LPA16_LPB16_MIWT1_1_PLR1_SU32_SUM0_SUS256_SKXCCM0_VWA1_VWB1_WGM1_WGMXCC1_WGMXCCGn1
- - - [128, 128, 1, 128, 128, 128, 128, 128]
    - [86, 0.082]
  - - [128, 128, 1, 256, 128, 128, 128, 128]
    - [29, 0.146]
  - - [128, 128, 1, 512, 128, 128, 128, 128]
    - [29, 0.234]
  - - [128, 128, 1, 1024, 128, 128, 128, 128]
    - [29, 0.338]
  - - [128, 128, 1, 2048, 128, 128, 128, 128]
    - [14, 0.567]
  - - [128, 128, 1, 4096, 128, 128, 128, 128]
    - [29, 0.956]
  - - [128, 128, 1, 8192, 128, 128, 128, 128]
    - [40, 1.361]
  - - [128, 256, 1, 128, 128, 128, 128, 256]
    - [86, 0.164]
  - - [128, 256, 1, 256, 128, 128, 128, 256]
    - [29, 0.29]
  - - [128, 256, 1, 512, 128, 128, 128, 256]
    - [30, 0.461]
  - - [128, 256, 1, 1024, 128, 128, 128, 256]
    - [29, 0.672]
  - - [128, 256, 1, 2048, 128, 128, 128, 256]
    - [40, 1.043]
  - - [128, 256, 1, 4096, 128, 128, 128, 256]
    - [83, 1.645]
  - - [128, 256, 1, 8192, 128, 128, 128, 256]
    - [92, 2.412]
  - - [128, 512, 1, 128, 128, 128, 128, 512]
    - [29, 0.321]
  - - [128, 512, 1, 256, 128, 128, 128, 512]
    - [30, 0.565]
  - - [128, 512, 1, 512, 128, 128, 128, 512]
    - [29, 0.914]
  - - [128, 512, 1, 1024, 128, 128, 128, 512]
    - [40, 1.317]
  - - [128, 512, 1, 2048, 128, 128, 128, 512]
    - [38, 1.891]
  - - [128, 512, 1, 4096, 128, 128, 128, 512]
    - [82, 2.706]
  - - [128, 512, 1, 8192, 128, 128, 128, 512]
    - [91, 4.053]
  - - [128, 1024, 1, 128, 128, 128, 128, 1024]
    - [83, 0.594]
  - - [128, 1024, 1, 256, 128, 128, 128, 1024]
    - [28, 1.046]
  - - [128, 1024, 1, 512, 128, 128, 128, 1024]
    - [38, 1.682]
  - - [128, 1024, 1, 1024, 128, 128, 128, 1024]
    - [38, 2.434]
  - - [128, 1024, 1, 2048, 128, 128, 128, 1024]
    - [35, 3.164]
  - - [128, 1024, 1, 4096, 128, 128, 128, 1024]
    - [35, 4.392]
  - - [128, 1024, 1, 8192, 128, 128, 128, 1024]
    - [27, 6.073]
  - - [128, 2048, 1, 128, 128, 128, 128, 2048]
    - [80, 1.052]
  - - [128, 2048, 1, 256, 128, 128, 128, 2048]
    - [80, 1.811]
  - - [128, 2048, 1, 512, 128, 128, 128, 2048]
    - [91, 2.847]
  - - [128, 2048, 1, 1024, 128, 128, 128, 2048]
    - [91, 4.102]
  - - [128, 2048, 1, 2048, 128, 128, 128, 2048]
    - [91, 5.134]
  - - [128, 2048, 1, 4096, 128, 128, 128, 2048]
    - [74, 7.024]
  - - [128, 2048, 1, 8192, 128, 128, 128, 2048]
    - [25, 9.575]
  - - [128, 4096, 1, 128, 128, 128, 128, 4096]
    - [62, 1.777]
  - - [128, 4096, 1, 256, 128, 128, 128, 4096]
    - [63, 2.922]
  - - [128, 4096, 1, 512, 128, 128, 128, 4096]
    - [77, 4.446]
  - - [128, 4096, 1, 1024, 128, 128, 128, 4096]
    - [89, 6.05]
  - - [128, 4096, 1, 2048, 128, 128, 128, 4096]
    - [74, 7.9]
  - - [128, 4096, 1, 4096, 128, 128, 128, 4096]
    - [25, 10.348]
  - - [128, 4096, 1, 8192, 128, 128, 128, 4096]
    - [25, 12.96]
  - - [128, 8192, 1, 128, 128, 128, 128, 8192]
    - [61, 2.631]
  - - [128, 8192, 1, 256, 128, 128, 128, 8192]
    - [74, 4.39]
  - - [128, 8192, 1, 512, 128, 128, 128, 8192]
    - [74, 6.598]
  - - [128, 8192, 1, 1024, 128, 128, 128, 8192]
    - [74, 8.968]
  - - [128, 8192, 1, 2048, 128, 128, 128, 8192]
    - [87, 10.984]
  - - [128, 8192, 1, 4096, 128, 128, 128, 8192]
    - [26, 13.092]
  - - [128, 8192, 1, 8192, 128, 128, 128, 8192]
    - [51, 14.875]
  - - [256, 128, 1, 128, 256, 256, 256, 128]
    - [29, 0.164]
  - - [256, 128, 1, 256, 256, 256, 256, 128]
    - [29, 0.289]
  - - [256, 128, 1, 512, 256, 256, 256, 128]
    - [29, 0.465]
  - - [256, 128, 1, 1024, 256, 256, 256, 128]
    - [40, 0.665]
  - - [256, 128, 1, 2048, 256, 256, 256, 128]
    - [40, 1.041]
  - - [256, 128, 1, 4096, 256, 256, 256, 128]
    - [83, 1.639]
  - - [256, 128, 1, 8192, 256, 256, 256, 128]
    - [94, 2.397]
  - - [256, 256, 1, 128, 256, 256, 256, 256]
    - [67, 0.322]
  - - [256, 256, 1, 256, 256, 256, 256, 256]
    - [30, 0.564]
  - - [256, 256, 1, 512, 256, 256, 256, 256]
    - [29, 0.904]
  - - [256, 256, 1, 1024, 256, 256, 256, 256]
    - [29, 1.317]
  - - [256, 256, 1, 2048, 256, 256, 256, 256]
    - [38, 1.893]
  - - [256, 256, 1, 4096, 256, 256, 256, 256]
    - [81, 2.727]
  - - [256, 256, 1, 8192, 256, 256, 256, 256]
    - [91, 3.782]
  - - [256, 512, 1, 128, 256, 256, 256, 512]
    - [83, 0.596]
  - - [256, 512, 1, 256, 256, 256, 256, 512]
    - [28, 1.04]
  - - [256, 512, 1, 512, 256, 256, 256, 512]
    - [38, 1.656]
  - - [256, 512, 1, 1024, 256, 256, 256, 512]
    - [38, 2.422]
  - - [256, 512, 1, 2048, 256, 256, 256, 512]
    - [91, 3.22]
  - - [256, 512, 1, 4096, 256, 256, 256, 512]
    - [78, 4.454]
  - - [256, 512, 1, 8192, 256, 256, 256, 512]
    - [27, 6.098]
  - - [256, 1024, 1, 128, 256, 256, 256, 1024]
    - [79, 1.058]
  - - [256, 1024, 1, 256, 256, 256, 256, 1024]
    - [79, 1.819]
  - - [256, 1024, 1, 512, 256, 256, 256, 1024]
    - [35, 2.853]
  - - [256, 1024, 1, 1024, 256, 256, 256, 1024]
    - [91, 4.112]
  - - [256, 1024, 1, 2048, 256, 256, 256, 1024]
    - [36, 5.183]
  - - [256, 1024, 1, 4096, 256, 256, 256, 1024]
    - [76, 6.968]
  - - [256, 1024, 1, 8192, 256, 256, 256, 1024]
    - [25, 9.503]
  - - [256, 2048, 1, 128, 256, 256, 256, 2048]
    - [64, 1.728]
  - - [256, 2048, 1, 256, 256, 256, 256, 2048]
    - [64, 2.874]
  - - [256, 2048, 1, 512, 256, 256, 256, 2048]
    - [78, 4.391]
  - - [256, 2048, 1, 1024, 256, 256, 256, 2048]
    - [89, 5.991]
  - - [256, 2048, 1, 2048, 256, 256, 256, 2048]
    - [76, 7.819]
  - - [256, 2048, 1, 4096, 256, 256, 256, 2048]
    - [25, 10.319]
  - - [256, 2048, 1, 8192, 256, 256, 256, 2048]
    - [74, 12.923]
  - - [256, 4096, 1, 128, 256, 256, 256, 4096]
    - [60, 2.674]
  - - [256, 4096, 1, 256, 256, 256, 256, 4096]
    - [74, 4.42]
  - - [256, 4096, 1, 512, 256, 256, 256, 4096]
    - [74, 6.719]
  - - [256, 4096, 1, 1024, 256, 256, 256, 4096]
    - [74, 9.123]
  - - [256, 4096, 1, 2048, 256, 256, 256, 4096]
    - [33, 10.945]
  - - [256, 4096, 1, 4096, 256, 256, 256, 4096]
    - [25, 13.098]
  - - [256, 4096, 1, 8192, 256, 256, 256, 4096]
    - [52, 14.953]
  - - [256, 8192, 1, 128, 256, 256, 256, 8192]
    - [51, 3.624]
  - - [256, 8192, 1, 256, 256, 256, 256, 8192]
    - [51, 5.87]
  - - [256, 8192, 1, 512, 256, 256, 256, 8192]
    - [8, 8.419]
  - - [256, 8192, 1, 1024, 256, 256, 256, 8192]
    - [21, 10.554]
  - - [256, 8192, 1, 2048, 256, 256, 256, 8192]
    - [8, 12.633]
  - - [256, 8192, 1, 4096, 256, 256, 256, 8192]
    - [53, 15.077]
  - - [256, 8192, 1, 8192, 256, 256, 256, 8192]
    - [46, 17.008]
  - - [512, 128, 1, 128, 512, 512, 512, 128]
    - [66, 0.323]
  - - [512, 128, 1, 256, 512, 512, 512, 128]
    - [30, 0.567]
  - - [512, 128, 1, 512, 512, 512, 512, 128]
    - [30, 0.91]
  - - [512, 128, 1, 1024, 512, 512, 512, 128]
    - [29, 1.315]
  - - [512, 128, 1, 2048, 512, 512, 512, 128]
    - [39, 1.89]
  - - [512, 128, 1, 4096, 512, 512, 512, 128]
    - [80, 2.698]
  - - [512, 128, 1, 8192, 512, 512, 512, 128]
    - [35, 3.784]
  - - [512, 256, 1, 128, 512, 512, 512, 256]
    - [85, 0.603]
  - - [512, 256, 1, 256, 512, 512, 512, 256]
    - [28, 1.038]
  - - [512, 256, 1, 512, 512, 512, 512, 256]
    - [38, 1.671]
  - - [512, 256, 1, 1024, 512, 512, 512, 256]
    - [38, 2.419]
  - - [512, 256, 1, 2048, 512, 512, 512, 256]
    - [91, 3.216]
  - - [512, 256, 1, 4096, 512, 512, 512, 256]
    - [77, 4.531]
  - - [512, 256, 1, 8192, 512, 512, 512, 256]
    - [34, 6.164]
  - - [512, 512, 1, 128, 512, 512, 512, 512]
    - [79, 1.064]
  - - [512, 512, 1, 256, 512, 512, 512, 512]
    - [80, 1.828]
  - - [512, 512, 1, 512, 512, 512, 512, 512]
    - [91, 2.859]
  - - [512, 512, 1, 1024, 512, 512, 512, 512]
    - [35, 4.105]
  - - [512, 512, 1, 2048, 512, 512, 512, 512]
    - [37, 5.224]
  - - [512, 512, 1, 4096, 512, 512, 512, 512]
    - [74, 7.12]
  - - [512, 512, 1, 8192, 512, 512, 512, 512]
    - [25, 9.553]
  - - [512, 1024, 1, 128, 512, 512, 512, 1024]
    - [62, 1.789]
  - - [512, 1024, 1, 256, 512, 512, 512, 1024]
    - [77, 2.951]
  - - [512, 1024, 1, 512, 512, 512, 512, 1024]
    - [77, 4.454]
  - - [512, 1024, 1, 1024, 512, 512, 512, 1024]
    - [89, 6.063]
  - - [512, 1024, 1, 2048, 512, 512, 512, 1024]
    - [76, 7.764]
  - - [512, 1024, 1, 4096, 512, 512, 512, 1024]
    - [74, 10.309]
  - - [512, 1024, 1, 8192, 512, 512, 512, 1024]
    - [74, 12.944]
  - - [512, 2048, 1, 128, 512, 512, 512, 2048]
    - [61, 2.67]
  - - [512, 2048, 1, 256, 512, 512, 512, 2048]
    - [74, 4.397]
  - - [512, 2048, 1, 512, 512, 512, 512, 2048]
    - [74, 6.815]
  - - [512, 2048, 1, 1024, 512, 512, 512, 2048]
    - [74, 9.133]
  - - [512, 2048, 1, 2048, 512, 512, 512, 2048]
    - [32, 10.999]
  - - [512, 2048, 1, 4096, 512, 512, 512, 2048]
    - [26, 13.047]
  - - [512, 2048, 1, 8192, 512, 512, 512, 2048]
    - [51, 14.922]
  - - [512, 4096, 1, 128, 512, 512, 512, 4096]
    - [55, 3.757]
  - - [512, 4096, 1, 256, 512, 512, 512, 4096]
    - [56, 5.976]
  - - [512, 4096, 1, 512, 512, 512, 512, 4096]
    - [56, 8.551]
  - - [512, 4096, 1, 1024, 512, 512, 512, 4096]
    - [20, 10.715]
  - - [512, 4096, 1, 2048, 512, 512, 512, 4096]
    - [10, 12.548]
  - - [512, 4096, 1, 4096, 512, 512, 512, 4096]
    - [56, 14.955]
  - - [512, 4096, 1, 8192, 512, 512, 512, 4096]
    - [47, 17.075]
  - - [512, 8192, 1, 128, 512, 512, 512, 8192]
    - [44, 4.342]
  - - [512, 8192, 1, 256, 512, 512, 512, 8192]
    - [44, 6.941]
  - - [512, 8192, 1, 512, 512, 512, 512, 8192]
    - [44, 9.924]
  - - [512, 8192, 1, 1024, 512, 512, 512, 8192]
    - [17, 12.411]
  - - [512, 8192, 1, 2048, 512, 512, 512, 8192]
    - [44, 14.511]
  - - [512, 8192, 1, 4096, 512, 512, 512, 8192]
    - [2, 17.125]
  - - [512, 8192, 1, 8192, 512, 512, 512, 8192]
    - [49, 19.029]
  - - [1024, 128, 1, 128, 1024, 1024, 1024, 128]
    - [84, 0.595]
  - - [1024, 128, 1, 256, 1024, 1024, 1024, 128]
    - [28, 1.046]
  - - [1024, 128, 1, 512, 1024, 1024, 1024, 128]
    - [85, 1.666]
  - - [1024, 128, 1, 1024, 1024, 1024, 1024, 128]
    - [93, 2.413]
  - - [1024, 128, 1, 2048, 1024, 1024, 1024, 128]
    - [35, 3.133]
  - - [1024, 128, 1, 4096, 1024, 1024, 1024, 128]
    - [77, 4.438]
  - - [1024, 128, 1, 8192, 1024, 1024, 1024, 128]
    - [27, 6.102]
  - - [1024, 256, 1, 128, 1024, 1024, 1024, 256]
    - [65, 1.062]
  - - [1024, 256, 1, 256, 1024, 1024, 1024, 256]
    - [80, 1.836]
  - - [1024, 256, 1, 512, 1024, 1024, 1024, 256]
    - [35, 2.868]
  - - [1024, 256, 1, 1024, 1024, 1024, 1024, 256]
    - [91, 4.13]
  - - [1024, 256, 1, 2048, 1024, 1024, 1024, 256]
    - [36, 5.229]
  - - [1024, 256, 1, 4096, 1024, 1024, 1024, 256]
    - [74, 7.008]
  - - [1024, 256, 1, 8192, 1024, 1024, 1024, 256]
    - [74, 9.547]
  - - [1024, 512, 1, 128, 1024, 1024, 1024, 512]
    - [63, 1.778]
  - - [1024, 512, 1, 256, 1024, 1024, 1024, 512]
    - [77, 2.934]
  - - [1024, 512, 1, 512, 1024, 1024, 1024, 512]
    - [77, 4.462]
  - - [1024, 512, 1, 1024, 1024, 1024, 1024, 512]
    - [89, 6.068]
  - - [1024, 512, 1, 2048, 1024, 1024, 1024, 512]
    - [74, 7.911]
  - - [1024, 512, 1, 4096, 1024, 1024, 1024, 512]
    - [25, 10.298]
  - - [1024, 512, 1, 8192, 1024, 1024, 1024, 512]
    - [74, 12.905]
  - - [1024, 1024, 1, 128, 1024, 1024, 1024, 1024]
    - [60, 2.706]
  - - [1024, 1024, 1, 256, 1024, 1024, 1024, 1024]
    - [74, 4.401]
  - - [1024, 1024, 1, 512, 1024, 1024, 1024, 1024]
    - [74, 6.818]
  - - [1024, 1024, 1, 1024, 1024, 1024, 1024, 1024]
    - [74, 9.1]
  - - [1024, 1024, 1, 2048, 1024, 1024, 1024, 1024]
    - [87, 10.863]
  - - [1024, 1024, 1, 4096, 1024, 1024, 1024, 1024]
    - [74, 13.102]
  - - [1024, 1024, 1, 8192, 1024, 1024, 1024, 1024]
    - [51, 14.786]
  - - [1024, 2048, 1, 128, 1024, 1024, 1024, 2048]
    - [55, 3.732]
  - - [1024, 2048, 1, 256, 1024, 1024, 1024, 2048]
    - [11, 5.984]
  - - [1024, 2048, 1, 512, 1024, 1024, 1024, 2048]
    - [11, 8.596]
  - - [1024, 2048, 1, 1024, 1024, 1024, 1024, 2048]
    - [24, 10.679]
  - - [1024, 2048, 1, 2048, 1024, 1024, 1024, 2048]
    - [8, 12.481]
  - - [1024, 2048, 1, 4096, 1024, 1024, 1024, 2048]
    - [53, 15.041]
  - - [1024, 2048, 1, 8192, 1024, 1024, 1024, 2048]
    - [44, 17.021]
  - - [1024, 4096, 1, 128, 1024, 1024, 1024, 4096]
    - [44, 4.267]
  - - [1024, 4096, 1, 256, 1024, 1024, 1024, 4096]
    - [44, 6.84]
  - - [1024, 4096, 1, 512, 1024, 1024, 1024, 4096]
    - [44, 9.824]
  - - [1024, 4096, 1, 1024, 1024, 1024, 1024, 4096]
    - [68, 12.235]
  - - [1024, 4096, 1, 2048, 1024, 1024, 1024, 4096]
    - [45, 14.589]
  - - [1024, 4096, 1, 4096, 1024, 1024, 1024, 4096]
    - [46, 17.015]
  - - [1024, 4096, 1, 8192, 1024, 1024, 1024, 4096]
    - [2, 19.006]
  - - [1024, 8192, 1, 128, 1024, 1024, 1024, 8192]
    - [16, 4.371]
  - - [1024, 8192, 1, 256, 1024, 1024, 1024, 8192]
    - [55, 7.099]
  - - [1024, 8192, 1, 512, 1024, 1024, 1024, 8192]
    - [2, 10.453]
  - - [1024, 8192, 1, 1024, 1024, 1024, 1024, 8192]
    - [49, 13.902]
  - - [1024, 8192, 1, 2048, 1024, 1024, 1024, 8192]
    - [47, 16.441]
  - - [1024, 8192, 1, 4096, 1024, 1024, 1024, 8192]
    - [49, 18.577]
  - - [1024, 8192, 1, 8192, 1024, 1024, 1024, 8192]
    - [68, 20.162]
  - - [2048, 128, 1, 128, 2048, 2048, 2048, 128]
    - [80, 1.054]
  - - [2048, 128, 1, 256, 2048, 2048, 2048, 128]
    - [80, 1.818]
  - - [2048, 128, 1, 512, 2048, 2048, 2048, 128]
    - [91, 2.868]
  - - [2048, 128, 1, 1024, 2048, 2048, 2048, 128]
    - [91, 4.125]
  - - [2048, 128, 1, 2048, 2048, 2048, 2048, 128]
    - [77, 4.897]
  - - [2048, 128, 1, 4096, 2048, 2048, 2048, 128]
    - [74, 6.996]
  - - [2048, 128, 1, 8192, 2048, 2048, 2048, 128]
    - [74, 9.59]
  - - [2048, 256, 1, 128, 2048, 2048, 2048, 256]
    - [63, 1.791]
  - - [2048, 256, 1, 256, 2048, 2048, 2048, 256]
    - [77, 2.946]
  - - [2048, 256, 1, 512, 2048, 2048, 2048, 256]
    - [77, 4.47]
  - - [2048, 256, 1, 1024, 2048, 2048, 2048, 256]
    - [90, 5.96]
  - - [2048, 256, 1, 2048, 2048, 2048, 2048, 256]
    - [74, 7.905]
  - - [2048, 256, 1, 4096, 2048, 2048, 2048, 256]
    - [25, 10.291]
  - - [2048, 256, 1, 8192, 2048, 2048, 2048, 256]
    - [25, 12.962]
  - - [2048, 512, 1, 128, 2048, 2048, 2048, 512]
    - [60, 2.666]
  - - [2048, 512, 1, 256, 2048, 2048, 2048, 512]
    - [74, 4.447]
  - - [2048, 512, 1, 512, 2048, 2048, 2048, 512]
    - [76, 6.715]
  - - [2048, 512, 1, 1024, 2048, 2048, 2048, 512]
    - [76, 9.054]
  - - [2048, 512, 1, 2048, 2048, 2048, 2048, 512]
    - [31, 10.794]
  - - [2048, 512, 1, 4096, 2048, 2048, 2048, 512]
    - [74, 13.092]
  - - [2048, 512, 1, 8192, 2048, 2048, 2048, 512]
    - [51, 14.943]
  - - [2048, 1024, 1, 128, 2048, 2048, 2048, 1024]
    - [55, 3.732]
  - - [2048, 1024, 1, 256, 2048, 2048, 2048, 1024]
    - [59, 5.961]
  - - [2048, 1024, 1, 512, 2048, 2048, 2048, 1024]
    - [50, 8.511]
  - - [2048, 1024, 1, 1024, 2048, 2048, 2048, 1024]
    - [19, 10.703]
  - - [2048, 1024, 1, 2048, 2048, 2048, 2048, 1024]
    - [25, 12.523]
  - - [2048, 1024, 1, 4096, 2048, 2048, 2048, 1024]
    - [52, 14.907]
  - - [2048, 1024, 1, 8192, 2048, 2048, 2048, 1024]
    - [42, 16.866]
  - - [2048, 2048, 1, 128, 2048, 2048, 2048, 2048]
    - [44, 4.295]
  - - [2048, 2048, 1, 256, 2048, 2048, 2048, 2048]
    - [44, 6.886]
  - - [2048, 2048, 1, 512, 2048, 2048, 2048, 2048]
    - [44, 9.903]
  - - [2048, 2048, 1, 1024, 2048, 2048, 2048, 2048]
    - [15, 12.512]
  - - [2048, 2048, 1, 2048, 2048, 2048, 2048, 2048]
    - [53, 14.52]
  - - [2048, 2048, 1, 4096, 2048, 2048, 2048, 2048]
    - [43, 17.051]
  - - [2048, 2048, 1, 8192, 2048, 2048, 2048, 2048]
    - [73, 18.972]
  - - [2048, 4096, 1, 128, 2048, 2048, 2048, 4096]
    - [70, 4.46]
  - - [2048, 4096, 1, 256, 2048, 2048, 2048, 4096]
    - [56, 7.114]
  - - [2048, 4096, 1, 512, 2048, 2048, 2048, 4096]
    - [0, 10.442]
  - - [2048, 4096, 1, 1024, 2048, 2048, 2048, 4096]
    - [1, 13.736]
  - - [2048, 4096, 1, 2048, 2048, 2048, 2048, 4096]
    - [46, 16.317]
  - - [2048, 4096, 1, 4096, 2048, 2048, 2048, 4096]
    - [44, 18.442]
  - - [2048, 4096, 1, 8192, 2048, 2048, 2048, 4096]
    - [68, 20.103]
  - - [2048, 8192, 1, 128, 2048, 2048, 2048, 8192]
    - [56, 5.206]
  - - [2048, 8192, 1, 256, 2048, 2048, 2048, 8192]
    - [49, 7.979]
  - - [2048, 8192, 1, 512, 2048, 2048, 2048, 8192]
    - [69, 11.461]
  - - [2048, 8192, 1, 1024, 2048, 2048, 2048, 8192]
    - [68, 14.78]
  - - [2048, 8192, 1, 2048, 2048, 2048, 2048, 8192]
    - [68, 17.465]
  - - [2048, 8192, 1, 4096, 2048, 2048, 2048, 8192]
    - [68, 19.418]
  - - [2048, 8192, 1, 8192, 2048, 2048, 2048, 8192]
    - [68, 20.285]
  - - [4096, 128, 1, 128, 4096, 4096, 4096, 128]
    - [12, 1.721]
  - - [4096, 128, 1, 256, 4096, 4096, 4096, 128]
    - [13, 2.853]
  - - [4096, 128, 1, 512, 4096, 4096, 4096, 128]
    - [77, 4.314]
  - - [4096, 128, 1, 1024, 4096, 4096, 4096, 128]
    - [90, 5.801]
  - - [4096, 128, 1, 2048, 4096, 4096, 4096, 128]
    - [74, 7.696]
  - - [4096, 128, 1, 4096, 4096, 4096, 4096, 128]
    - [25, 10.328]
  - - [4096, 128, 1, 8192, 4096, 4096, 4096, 128]
    - [74, 12.871]
  - - [4096, 256, 1, 128, 4096, 4096, 4096, 256]
    - [60, 2.725]
  - - [4096, 256, 1, 256, 4096, 4096, 4096, 256]
    - [60, 4.401]
  - - [4096, 256, 1, 512, 4096, 4096, 4096, 256]
    - [75, 6.637]
  - - [4096, 256, 1, 1024, 4096, 4096, 4096, 256]
    - [75, 8.957]
  - - [4096, 256, 1, 2048, 4096, 4096, 4096, 256]
    - [88, 10.81]
  - - [4096, 256, 1, 4096, 4096, 4096, 4096, 256]
    - [76, 13.037]
  - - [4096, 256, 1, 8192, 4096, 4096, 4096, 256]
    - [8, 14.807]
  - - [4096, 512, 1, 128, 4096, 4096, 4096, 512]
    - [55, 3.72]
  - - [4096, 512, 1, 256, 4096, 4096, 4096, 512]
    - [55, 5.952]
  - - [4096, 512, 1, 512, 4096, 4096, 4096, 512]
    - [55, 8.562]
  - - [4096, 512, 1, 1024, 4096, 4096, 4096, 512]
    - [23, 10.637]
  - - [4096, 512, 1, 2048, 4096, 4096, 4096, 512]
    - [74, 12.542]
  - - [4096, 512, 1, 4096, 4096, 4096, 4096, 512]
    - [53, 14.947]
  - - [4096, 512, 1, 8192, 4096, 4096, 4096, 512]
    - [47, 16.949]
  - - [4096, 1024, 1, 128, 4096, 4096, 4096, 1024]
    - [0, 4.245]
  - - [4096, 1024, 1, 256, 4096, 4096, 4096, 1024]
    - [0, 6.807]
  - - [4096, 1024, 1, 512, 4096, 4096, 4096, 1024]
    - [0, 9.85]
  - - [4096, 1024, 1, 1024, 4096, 4096, 4096, 1024]
    - [18, 12.415]
  - - [4096, 1024, 1, 2048, 4096, 4096, 4096, 1024]
    - [43, 14.563]
  - - [4096, 1024, 1, 4096, 4096, 4096, 4096, 1024]
    - [6, 16.889]
  - - [4096, 1024, 1, 8192, 4096, 4096, 4096, 1024]
    - [5, 18.909]
  - - [4096, 2048, 1, 128, 4096, 4096, 4096, 2048]
    - [68, 4.41]
  - - [4096, 2048, 1, 256, 4096, 4096, 4096, 2048]
    - [55, 7.102]
  - - [4096, 2048, 1, 512, 4096, 4096, 4096, 2048]
    - [0, 10.374]
  - - [4096, 2048, 1, 1024, 4096, 4096, 4096, 2048]
    - [43, 13.715]
  - - [4096, 2048, 1, 2048, 4096, 4096, 4096, 2048]
    - [42, 16.269]
  - - [4096, 2048, 1, 4096, 4096, 4096, 4096, 2048]
    - [43, 18.45]
  - - [4096, 2048, 1, 8192, 4096, 4096, 4096, 2048]
    - [68, 20.19]
  - - [4096, 4096, 1, 128, 4096, 4096, 4096, 4096]
    - [57, 5.124]
  - - [4096, 4096, 1, 256, 4096, 4096, 4096, 4096]
    - [55, 7.908]
  - - [4096, 4096, 1, 512, 4096, 4096, 4096, 4096]
    - [1, 11.24]
  - - [4096, 4096, 1, 1024, 4096, 4096, 4096, 4096]
    - [1, 14.463]
  - - [4096, 4096, 1, 2048, 4096, 4096, 4096, 4096]
    - [68, 17.282]
  - - [4096, 4096, 1, 4096, 4096, 4096, 4096, 4096]
    - [68, 19.34]
  - - [4096, 4096, 1, 8192, 4096, 4096, 4096, 4096]
    - [68, 20.231]
  - - [4096, 8192, 1, 128, 4096, 4096, 4096, 8192]
    - [9, 5.3]
  - - [4096, 8192, 1, 256, 4096, 4096, 4096, 8192]
    - [24, 7.998]
  - - [4096, 8192, 1, 512, 4096, 4096, 4096, 8192]
    - [72, 11.295]
  - - [4096, 8192, 1, 1024, 4096, 4096, 4096, 8192]
    - [0, 14.612]
  - - [4096, 8192, 1, 2048, 4096, 4096, 4096, 8192]
    - [18, 17.491]
  - - [4096, 8192, 1, 4096, 4096, 4096, 4096, 8192]
    - [15, 19.451]
  - - [4096, 8192, 1, 8192, 4096, 4096, 4096, 8192]
    - [68, 20.721]
  - - [8192, 128, 1, 128, 8192, 8192, 8192, 128]
    - [60, 2.648]
  - - [8192, 128, 1, 256, 8192, 8192, 8192, 128]
    - [74, 4.302]
  - - [8192, 128, 1, 512, 8192, 8192, 8192, 128]
    - [74, 6.575]
  - - [8192, 128, 1, 1024, 8192, 8192, 8192, 128]
    - [74, 8.93]
  - - [8192, 128, 1, 2048, 8192, 8192, 8192, 128]
    - [31, 10.677]
  - - [8192, 128, 1, 4096, 8192, 8192, 8192, 128]
    - [74, 13.04]
  - - [8192, 128, 1, 8192, 8192, 8192, 8192, 128]
    - [58, 14.702]
  - - [8192, 256, 1, 128, 8192, 8192, 8192, 256]
    - [58, 3.65]
  - - [8192, 256, 1, 256, 8192, 8192, 8192, 256]
    - [55, 5.904]
  - - [8192, 256, 1, 512, 8192, 8192, 8192, 256]
    - [55, 8.527]
  - - [8192, 256, 1, 1024, 8192, 8192, 8192, 256]
    - [22, 10.518]
  - - [8192, 256, 1, 2048, 8192, 8192, 8192, 256]
    - [8, 12.585]
  - - [8192, 256, 1, 4096, 8192, 8192, 8192, 256]
    - [51, 15.017]
  - - [8192, 256, 1, 8192, 8192, 8192, 8192, 256]
    - [47, 16.863]
  - - [8192, 512, 1, 128, 8192, 8192, 8192, 512]
    - [4, 4.188]
  - - [8192, 512, 1, 256, 8192, 8192, 8192, 512]
    - [44, 6.756]
  - - [8192, 512, 1, 512, 8192, 8192, 8192, 512]
    - [44, 9.719]
  - - [8192, 512, 1, 1024, 8192, 8192, 8192, 512]
    - [68, 12.399]
  - - [8192, 512, 1, 2048, 8192, 8192, 8192, 512]
    - [44, 14.56]
  - - [8192, 512, 1, 4096, 8192, 8192, 8192, 512]
    - [42, 17.022]
  - - [8192, 512, 1, 8192, 8192, 8192, 8192, 512]
    - [2, 18.969]
  - - [8192, 1024, 1, 128, 8192, 8192, 8192, 1024]
    - [68, 4.392]
  - - [8192, 1024, 1, 256, 8192, 8192, 8192, 1024]
    - [56, 7.102]
  - - [8192, 1024, 1, 512, 8192, 8192, 8192, 1024]
    - [0, 10.401]
  - - [8192, 1024, 1, 1024, 8192, 8192, 8192, 1024]
    - [3, 13.896]
  - - [8192, 1024, 1, 2048, 8192, 8192, 8192, 1024]
    - [44, 16.304]
  - - [8192, 1024, 1, 4096, 8192, 8192, 8192, 1024]
    - [49, 18.569]
  - - [8192, 1024, 1, 8192, 8192, 8192, 8192, 1024]
    - [68, 20.056]
  - - [8192, 2048, 1, 128, 8192, 8192, 8192, 2048]
    - [54, 5.16]
  - - [8192, 2048, 1, 256, 8192, 8192, 8192, 2048]
    - [44, 7.953]
  - - [8192, 2048, 1, 512, 8192, 8192, 8192, 2048]
    - [71, 11.346]
  - - [8192, 2048, 1, 1024, 8192, 8192, 8192, 2048]
    - [72, 14.548]
  - - [8192, 2048, 1, 2048, 8192, 8192, 8192, 2048]
    - [15, 17.412]
  - - [8192, 2048, 1, 4096, 8192, 8192, 8192, 2048]
    - [68, 19.31]
  - - [8192, 2048, 1, 8192, 8192, 8192, 8192, 2048]
    - [15, 20.265]
  - - [8192, 4096, 1, 128, 8192, 8192, 8192, 4096]
    - [7, 5.242]
  - - [8192, 4096, 1, 256, 8192, 8192, 8192, 4096]
    - [48, 7.87]
  - - [8192, 4096, 1, 512, 8192, 8192, 8192, 4096]
    - [72, 11.344]
  - - [8192, 4096, 1, 1024, 8192, 8192, 8192, 4096]
    - [48, 14.614]
  - - [8192, 4096, 1, 2048, 8192, 8192, 8192, 4096]
    - [68, 17.489]
  - - [8192, 4096, 1, 4096, 8192, 8192, 8192, 4096]
    - [68, 19.498]
  - - [8192, 4096, 1, 8192, 8192, 8192, 8192, 4096]
    - [68, 20.71]
  - - [8192, 8192, 1, 128, 8192, 8192, 8192, 8192]
    - [41, 5.022]
  - - [8192, 8192, 1, 256, 8192, 8192, 8192, 8192]
    - [46, 8.014]
  - - [8192, 8192, 1, 512, 8192, 8192, 8192, 8192]
    - [47, 11.815]
  - - [8192, 8192, 1, 1024, 8192, 8192, 8192, 8192]
    - [45, 15.48]
  - - [8192, 8192, 1, 2048, 8192, 8192, 8192, 8192]
    - [68, 18.183]
  - - [8192, 8192, 1, 4096, 8192, 8192, 8192, 8192]
    - [68, 19.91]
  - - [8192, 8192, 1, 8192, 8192, 8192, 8192, 8192]
    - [71, 20.992]
  - - [1, 1, 1, 32, 1, 1, 1, 1]
    - [95, 0.0]
- null
- null
- ExperimentalStreamK
- GridBased
