library/src/amd_detail/rocblaslt/src/Tensile/Logic/asm_full/aquavanjaram/gfx942_80cu/StreamK/aquavanjaram942_Cijk_Ailk_Bjlk_HSS_BH_UserArgs.yaml
- {MinimumRequiredVersion: 4.33.0}
- aquavanjaram942
- {Architecture: gfx942, CUCount: 80}
- [Device 0049, Device 0050]
    SolutionIndex: 0
    SolutionNameMin: Cijk_Ailk_Bjlk_HSS_BH_UserArgs_MT256x256x32_MI16x16x1_SN_LDSB1_CLR1_GSU0_GSUC0_GSUWGMRR0_K1_LBSPPA2048_LBSPPB2048_LPA0_LPB32_MIWT8_8_PLR1_SU32_SUM0_SUS256_SKXCCM0_VWA4_VWB2_WGM1_WGMXCC1_WGMXCCGn1
    SolutionIndex: 1
    SolutionNameMin: Cijk_Ailk_Bjlk_HSS_BH_UserArgs_MT256x256x32_MI16x16x1_SN_LDSB0_CLR1_GSU0_GSUC0_GSUWGMRR0_K1_LBSPPA2048_LBSPPB2048_LPA0_LPB0_MIWT8_8_PLR1_SU32_SUM0_SUS256_SKXCCM0_VWA4_VWB4_WGM1_WGMXCC1_WGMXCCGn1
    SolutionIndex: 2
    SolutionNameMin: Cijk_Ailk_Bjlk_HSS_BH_UserArgs_MT256x256x32_MI16x16x1_SN_LDSB0_CLR1_GSU0_GSUC0_GSUWGMRR0_K1_LBSPPA2048_LBSPPB2048_LPA0_LPB0_MIWT8_8_PLR1_SU32_SUM0_SUS256_SKXCCM0_VWA4_VWB8_WGM1_WGMXCC1_WGMXCCGn1
    SolutionIndex: 3
    SolutionNameMin: Cijk_Ailk_Bjlk_HSS_BH_UserArgs_MT256x256x32_MI16x16x1_SN_LDSB0_CLR1_GSU0_GSUC0_GSUWGMRR0_K1_LBSPPA2048_LBSPPB2048_LPA0_LPB0_MIWT8_8_PLR1_SU32_SUM0_SUS256_SKXCCM0_VWA4_VWB8_WGM2_WGMXCC1_WGMXCCGn1
    SolutionIndex: 4
    SolutionNameMin: Cijk_Ailk_Bjlk_HSS_BH_UserArgs_MT256x256x32_MI16x16x1_SN_LDSB1_CLR1_GSU0_GSUC0_GSUWGMRR0_K1_LBSPPA2048_LBSPPB2048_LPA0_LPB32_MIWT8_8_PLR1_SU32_SUM0_SUS256_SKXCCM0_VWA4_VWB2_WGM4_WGMXCC1_WGMXCCGn1
    SolutionIndex: 5
    SolutionNameMin: Cijk_Ailk_Bjlk_HSS_BH_UserArgs_MT256x256x32_MI16x16x1_SN_LDSB0_CLR1_GSU0_GSUC0_GSUWGMRR0_K1_LBSPPA2048_LBSPPB2048_LPA0_LPB0_MIWT8_8_PLR1_SU32_SUM0_SUS256_SKXCCM0_VWA4_VWB8_WGM4_WGMXCC1_WGMXCCGn1
    SolutionIndex: 6
    SolutionNameMin: Cijk_Ailk_Bjlk_HSS_BH_UserArgs_MT128x256x32_MI16x16x1_SN_LDSB1_CLR1_GSU0_GSUC0_GSUWGMRR0_K1_LBSPPA1024_LBSPPB2048_LPA0_LPB0_MIWT4_8_PLR1_SU32_SUM0_SUS256_SKXCCM0_VWA4_VWB8_WGM1_WGMXCC1_WGMXCCGn1
    SolutionIndex: 7
    SolutionNameMin: Cijk_Ailk_Bjlk_HSS_BH_UserArgs_MT128x256x32_MI16x16x1_SN_LDSB1_CLR1_GSU0_GSUC0_GSUWGMRR0_K1_LBSPPA1024_LBSPPB2048_LPA0_LPB0_MIWT4_8_PLR1_SU32_SUM0_SUS256_SKXCCM0_VWA4_VWB8_WGM2_WGMXCC1_WGMXCCGn1
    SolutionIndex: 8
    SolutionNameMin: Cijk_Ailk_Bjlk_HSS_BH_UserArgs_MT256x128x32_MI16x16x1_SN_LDSB1_CLR1_GSU0_GSUC0_GSUWGMRR0_K1_LBSPPA2048_LBSPPB1024_LPA0_LPB16_MIWT8_4_PLR1_SU32_SUM0_SUS256_SKXCCM0_VWA4_VWB1_WGM1_WGMXCC1_WGMXCCGn1
    SolutionIndex: 9
    SolutionNameMin: Cijk_Ailk_Bjlk_HSS_BH_UserArgs_MT256x128x32_MI16x16x1_SN_LDSB1_CLR1_GSU0_GSUC0_GSUWGMRR0_K1_LBSPPA2048_LBSPPB1024_LPA0_LPB32_MIWT8_4_PLR1_SU32_SUM0_SUS256_SKXCCM0_VWA4_VWB2_WGM1_WGMXCC1_WGMXCCGn1
    SolutionIndex: 10
    SolutionNameMin: Cijk_Ailk_Bjlk_HSS_BH_UserArgs_MT256x128x32_MI16x16x1_SN_LDSB1_CLR1_GSU0_GSUC0_GSUWGMRR0_K1_LBSPPA2048_LBSPPB1024_LPA0_LPB0_MIWT8_4_PLR1_SU32_SUM0_SUS256_SKXCCM0_VWA4_VWB4_WGM1_WGMXCC1_WGMXCCGn1
    SolutionIndex: 11
    SolutionNameMin: Cijk_Ailk_Bjlk_HSS_BH_UserArgs_MT256x128x32_MI16x16x1_SN_LDSB1_CLR1_GSU0_GSUC0_GSUWGMRR0_K1_LBSPPA2048_LBSPPB1024_LPA0_LPB32_MIWT8_4_PLR1_SU32_SUM0_SUS256_SKXCCM0_VWA4_VWB2_WGM4_WGMXCC1_WGMXCCGn1
    SolutionIndex: 12
    SolutionNameMin: Cijk_Ailk_Bjlk_HSS_BH_UserArgs_MT256x128x32_MI16x16x1_SN_LDSB1_CLR1_GSU0_GSUC0_GSUWGMRR0_K1_LBSPPA2048_LBSPPB1024_LPA0_LPB0_MIWT8_4_PLR1_SU32_SUM0_SUS256_SKXCCM0_VWA4_VWB4_WGM4_WGMXCC1_WGMXCCGn1
    SolutionIndex: 13
    SolutionNameMin: Cijk_Ailk_Bjlk_HSS_BH_UserArgs_MT128x64x32_MI16x16x1_SN_LDSB0_CLR1_GSU0_GSUC0_GSUWGMRR0_K1_LBSPPA1024_LBSPPB512_LPA0_LPB16_MIWT4_2_PLR1_SU32_SUM0_SUS256_SKXCCM0_VWA4_VWB1_WGM2_WGMXCC1_WGMXCCGn1
    SolutionIndex: 14
    SolutionNameMin: Cijk_Ailk_Bjlk_HSS_BH_UserArgs_MT32x32x32_MI16x16x1_SN_LDSB0_CLR1_GSU0_GSUC0_GSUWGMRR0_K1_LBSPPA256_LBSPPB256_LPA16_LPB16_MIWT1_1_PLR1_SU32_SUM0_SUS256_SKXCCM0_VWA1_VWB1_WGM1_WGMXCC1_WGMXCCGn1
    SolutionIndex: 15
    SolutionNameMin: Cijk_Ailk_Bjlk_HSS_BH_UserArgs_MT32x32x32_MI16x16x1_SN_LDSB0_CLR0_GSU0_GSUC0_GSUWGMRR0_K1_LBSPPA256_LBSPPB256_LPA16_LPB16_MIWT1_1_PLR0_SU32_SUM0_SUS256_SKXCCM0_VWA1_VWB1_WGM1_WGMXCC1_WGMXCCGn1
    SolutionIndex: 16
    SolutionNameMin: Cijk_Ailk_Bjlk_HSS_BH_UserArgs_MT256x256x64_MI16x16x1_SN_LDSB1_CLR1_GSU0_GSUC0_GSUWGMRR0_K1_LBSPPA2048_LBSPPB2048_LPA0_LPB0_MIWT8_8_PLR1_SU32_SUM0_SUS256_SKXCCM0_VWA4_VWB4_WGM1_WGMXCC1_WGMXCCGn1
    SolutionIndex: 17
    SolutionNameMin: Cijk_Ailk_Bjlk_HSS_BH_UserArgs_MT256x256x64_MI16x16x1_SN_LDSB1_CLR1_GSU0_GSUC0_GSUWGMRR0_K1_LBSPPA2048_LBSPPB2048_LPA0_LPB0_MIWT8_8_PLR2_SU32_SUM0_SUS256_SKXCCM0_VWA4_VWB4_WGM2_WGMXCC1_WGMXCCGn1
    SolutionIndex: 18
    SolutionNameMin: Cijk_Ailk_Bjlk_HSS_BH_UserArgs_MT256x256x64_MI16x16x1_SN_LDSB1_CLR1_GSU0_GSUC0_GSUWGMRR0_K1_LBSPPA2048_LBSPPB2048_LPA0_LPB0_MIWT8_8_PLR1_SU32_SUM0_SUS256_SKXCCM0_VWA4_VWB4_WGM4_WGMXCC1_WGMXCCGn1
    SolutionIndex: 19
    SolutionNameMin: Cijk_Ailk_Bjlk_HSS_BH_UserArgs_MT128x256x64_MI16x16x1_SN_LDSB1_CLR1_GSU0_GSUC0_GSUWGMRR0_K1_LBSPPA1024_LBSPPB2048_LPA0_LPB32_MIWT4_8_PLR1_SU32_SUM0_SUS256_SKXCCM0_VWA4_VWB2_WGM1_WGMXCC1_WGMXCCGn1
    SolutionIndex: 20
    SolutionNameMin: Cijk_Ailk_Bjlk_HSS_BH_UserArgs_MT128x256x64_MI16x16x1_SN_LDSB1_CLR1_GSU0_GSUC0_GSUWGMRR0_K1_LBSPPA1024_LBSPPB2048_LPA0_LPB0_MIWT4_8_PLR1_SU32_SUM0_SUS256_SKXCCM0_VWA4_VWB4_WGM1_WGMXCC1_WGMXCCGn1
    SolutionIndex: 21
    SolutionNameMin: Cijk_Ailk_Bjlk_HSS_BH_UserArgs_MT128x256x64_MI16x16x1_SN_LDSB1_CLR1_GSU0_GSUC0_GSUWGMRR0_K1_LBSPPA1024_LBSPPB2048_LPA0_LPB0_MIWT4_8_PLR2_SU32_SUM0_SUS256_SKXCCM0_VWA4_VWB4_WGM4_WGMXCC1_WGMXCCGn1
    SolutionIndex: 22
    SolutionNameMin: Cijk_Ailk_Bjlk_HSS_BH_UserArgs_MT256x128x64_MI16x16x1_SN_LDSB1_CLR1_GSU0_GSUC0_GSUWGMRR0_K1_LBSPPA2048_LBSPPB1024_LPA0_LPB16_MIWT8_4_PLR1_SU32_SUM0_SUS256_SKXCCM0_VWA4_VWB1_WGM1_WGMXCC1_WGMXCCGn1
    SolutionIndex: 23
    SolutionNameMin: Cijk_Ailk_Bjlk_HSS_BH_UserArgs_MT256x128x64_MI16x16x1_SN_LDSB1_CLR1_GSU0_GSUC0_GSUWGMRR0_K1_LBSPPA2048_LBSPPB1024_LPA0_LPB32_MIWT8_4_PLR1_SU32_SUM0_SUS256_SKXCCM0_VWA4_VWB2_WGM1_WGMXCC1_WGMXCCGn1
    SolutionIndex: 24
    SolutionNameMin: Cijk_Ailk_Bjlk_HSS_BH_UserArgs_MT128x128x64_MI16x16x1_SN_LDSB1_CLR1_GSU0_GSUC0_GSUWGMRR0_K1_LBSPPA1024_LBSPPB1024_LPA0_LPB0_MIWT4_4_PLR1_SU32_SUM0_SUS256_SKXCCM0_VWA4_VWB4_WGM1_WGMXCC1_WGMXCCGn1
    SolutionIndex: 25
    SolutionNameMin: Cijk_Ailk_Bjlk_HSS_BH_UserArgs_MT128x128x64_MI16x16x1_SN_LDSB1_CLR1_GSU0_GSUC0_GSUWGMRR0_K1_LBSPPA1024_LBSPPB1024_LPA0_LPB0_MIWT4_4_PLR1_SU32_SUM0_SUS256_SKXCCM0_VWA4_VWB4_WGM2_WGMXCC1_WGMXCCGn1
    SolutionIndex: 26
    SolutionNameMin: Cijk_Ailk_Bjlk_HSS_BH_UserArgs_MT128x128x64_MI16x16x1_SN_LDSB1_CLR1_GSU0_GSUC0_GSUWGMRR0_K1_LBSPPA1024_LBSPPB1024_LPA0_LPB0_MIWT4_4_PLR1_SU32_SUM0_SUS256_SKXCCM0_VWA4_VWB4_WGM4_WGMXCC1_WGMXCCGn1
    SolutionIndex: 27
    SolutionNameMin: Cijk_Ailk_Bjlk_HSS_BH_UserArgs_MT128x64x64_MI16x16x1_SN_LDSB1_CLR1_GSU0_GSUC0_GSUWGMRR0_K1_LBSPPA1024_LBSPPB512_LPA0_LPB32_MIWT4_2_PLR2_SU32_SUM0_SUS256_SKXCCM0_VWA4_VWB2_WGM1_WGMXCC1_WGMXCCGn1
    SolutionIndex: 28
    SolutionNameMin: Cijk_Ailk_Bjlk_HSS_BH_UserArgs_MT128x64x64_MI16x16x1_SN_LDSB1_CLR1_GSU0_GSUC0_GSUWGMRR0_K1_LBSPPA1024_LBSPPB512_LPA0_LPB32_MIWT4_2_PLR2_SU32_SUM0_SUS256_SKXCCM0_VWA4_VWB2_WGM4_WGMXCC1_WGMXCCGn1
    SolutionIndex: 29
    SolutionNameMin: Cijk_Ailk_Bjlk_HSS_BH_UserArgs_MT32x64x64_MI16x16x1_SN_LDSB0_CLR1_GSU0_GSUC0_GSUWGMRR0_K1_LBSPPA256_LBSPPB512_LPA16_LPB32_MIWT1_2_PLR2_SU32_SUM0_SUS256_SKXCCM0_VWA1_VWB2_WGM1_WGMXCC1_WGMXCCGn1
    SolutionIndex: 30
    SolutionNameMin: Cijk_Ailk_Bjlk_HSS_BH_UserArgs_MT32x32x64_MI16x16x1_SN_LDSB0_CLR1_GSU0_GSUC0_GSUWGMRR0_K1_LBSPPA256_LBSPPB256_LPA16_LPB16_MIWT1_1_PLR1_SU32_SUM0_SUS256_SKXCCM0_VWA1_VWB1_WGM1_WGMXCC1_WGMXCCGn1
    SolutionIndex: 31
    SolutionNameMin: Cijk_Ailk_Bjlk_HSS_BH_UserArgs_MT32x32x64_MI16x16x1_SN_LDSB0_CLR1_GSU0_GSUC0_GSUWGMRR0_K1_LBSPPA256_LBSPPB256_LPA16_LPB16_MIWT1_1_PLR2_SU32_SUM0_SUS256_SKXCCM0_VWA1_VWB1_WGM1_WGMXCC1_WGMXCCGn1
    SolutionIndex: 32
    SolutionNameMin: Cijk_Ailk_Bjlk_HSS_BH_UserArgs_MT128x128x128_MI16x16x1_SN_LDSB1_CLR1_GSU0_GSUC0_GSUWGMRR0_K1_LBSPPA1024_LBSPPB1024_LPA0_LPB0_MIWT4_4_PLR1_SU32_SUM0_SUS256_SKXCCM0_VWA4_VWB4_WGM1_WGMXCC1_WGMXCCGn1
    SolutionIndex: 33
    SolutionNameMin: Cijk_Ailk_Bjlk_HSS_BH_UserArgs_MT128x128x128_MI16x16x1_SN_LDSB1_CLR1_GSU0_GSUC0_GSUWGMRR0_K1_LBSPPA1024_LBSPPB1024_LPA0_LPB0_MIWT4_4_PLR1_SU32_SUM0_SUS256_SKXCCM0_VWA4_VWB4_WGM2_WGMXCC1_WGMXCCGn1
    SolutionIndex: 34
    SolutionNameMin: Cijk_Ailk_Bjlk_HSS_BH_UserArgs_MT128x128x128_MI16x16x1_SN_LDSB1_CLR1_GSU0_GSUC0_GSUWGMRR0_K1_LBSPPA1024_LBSPPB1024_LPA0_LPB0_MIWT4_4_PLR1_SU32_SUM0_SUS256_SKXCCM0_VWA4_VWB4_WGM4_WGMXCC1_WGMXCCGn1
    SolutionIndex: 35
    SolutionNameMin: Cijk_Ailk_Bjlk_HSS_BH_UserArgs_MT128x64x128_MI16x16x1_SN_LDSB1_CLR1_GSU0_GSUC0_GSUWGMRR0_K1_LBSPPA1024_LBSPPB512_LPA0_LPB32_MIWT4_2_PLR2_SU32_SUM0_SUS256_SKXCCM0_VWA4_VWB2_WGM1_WGMXCC1_WGMXCCGn1
    SolutionIndex: 36
    SolutionNameMin: Cijk_Ailk_Bjlk_HSS_BH_UserArgs_MT64x64x128_MI16x16x1_SN_LDSB1_CLR1_GSU0_GSUC0_GSUWGMRR0_K1_LBSPPA512_LBSPPB512_LPA32_LPB32_MIWT2_2_PLR2_SU32_SUM0_SUS256_SKXCCM0_VWA2_VWB2_WGM1_WGMXCC1_WGMXCCGn1
    SolutionIndex: 37
    SolutionNameMin: Cijk_Ailk_Bjlk_HSS_BH_UserArgs_MT64x64x128_MI16x16x1_SN_LDSB1_CLR1_GSU0_GSUC0_GSUWGMRR0_K1_LBSPPA512_LBSPPB512_LPA32_LPB32_MIWT2_2_PLR2_SU32_SUM0_SUS256_SKXCCM0_VWA2_VWB2_WGM2_WGMXCC1_WGMXCCGn1
    SolutionIndex: 38
    SolutionNameMin: Cijk_Ailk_Bjlk_HSS_BH_UserArgs_MT64x64x128_MI16x16x1_SN_LDSB1_CLR1_GSU0_GSUC0_GSUWGMRR0_K1_LBSPPA512_LBSPPB512_LPA32_LPB32_MIWT2_2_PLR2_SU32_SUM0_SUS256_SKXCCM0_VWA2_VWB2_WGM4_WGMXCC1_WGMXCCGn1
    SolutionIndex: 39
    SolutionNameMin: Cijk_Ailk_Bjlk_HSS_BH_UserArgs_MT32x64x128_MI16x16x1_SN_LDSB1_CLR1_GSU0_GSUC0_GSUWGMRR0_K1_LBSPPA256_LBSPPB512_LPA16_LPB32_MIWT1_2_PLR2_SU32_SUM0_SUS256_SKXCCM0_VWA1_VWB2_WGM1_WGMXCC1_WGMXCCGn1
    SolutionIndex: 40
    SolutionNameMin: Cijk_Ailk_Bjlk_HSS_BH_UserArgs_MT64x32x128_MI16x16x1_SN_LDSB1_CLR1_GSU0_GSUC0_GSUWGMRR0_K1_LBSPPA512_LBSPPB256_LPA32_LPB16_MIWT2_1_PLR2_SU32_SUM0_SUS256_SKXCCM0_VWA2_VWB1_WGM1_WGMXCC1_WGMXCCGn1
    SolutionIndex: 41
    SolutionNameMin: Cijk_Ailk_Bjlk_HSS_BH_UserArgs_MT32x32x128_MI16x16x1_SN_LDSB1_CLR1_GSU0_GSUC0_GSUWGMRR0_K1_LBSPPA256_LBSPPB256_LPA16_LPB16_MIWT1_1_PLR1_SU32_SUM0_SUS256_SKXCCM0_VWA1_VWB1_WGM1_WGMXCC1_WGMXCCGn1
    SolutionIndex: 42
    SolutionNameMin: Cijk_Ailk_Bjlk_HSS_BH_UserArgs_MT32x32x128_MI16x16x1_SN_LDSB1_CLR1_GSU0_GSUC0_GSUWGMRR0_K1_LBSPPA256_LBSPPB256_LPA16_LPB16_MIWT1_1_PLR2_SU32_SUM0_SUS256_SKXCCM0_VWA1_VWB1_WGM1_WGMXCC1_WGMXCCGn1
    SolutionIndex: 43
    SolutionNameMin: Cijk_Ailk_Bjlk_HSS_BH_UserArgs_MT256x256x32_MI16x16x1_SN_LDSB1_CLR1_GSU0_GSUC0_GSUWGMRR0_K1_LBSPPA2048_LBSPPB2048_LPA0_LPB32_MIWT8_8_PLR1_SU32_SUM0_SUS256_SKXCCM4_VWA4_VWB2_WGM1_WGMXCC1_WGMXCCGn1
    SolutionIndex: 44
    SolutionNameMin: Cijk_Ailk_Bjlk_HSS_BH_UserArgs_MT256x256x32_MI16x16x1_SN_LDSB0_CLR1_GSU0_GSUC0_GSUWGMRR0_K1_LBSPPA2048_LBSPPB2048_LPA0_LPB0_MIWT8_8_PLR1_SU32_SUM0_SUS256_SKXCCM4_VWA4_VWB4_WGM1_WGMXCC1_WGMXCCGn1
    SolutionIndex: 45
    SolutionNameMin: Cijk_Ailk_Bjlk_HSS_BH_UserArgs_MT256x256x32_MI16x16x1_SN_LDSB0_CLR1_GSU0_GSUC0_GSUWGMRR0_K1_LBSPPA2048_LBSPPB2048_LPA0_LPB0_MIWT8_8_PLR1_SU32_SUM0_SUS256_SKXCCM4_VWA4_VWB8_WGM1_WGMXCC1_WGMXCCGn1
    SolutionIndex: 46
    SolutionNameMin: Cijk_Ailk_Bjlk_HSS_BH_UserArgs_MT256x256x32_MI16x16x1_SN_LDSB1_CLR1_GSU0_GSUC0_GSUWGMRR0_K1_LBSPPA2048_LBSPPB2048_LPA0_LPB32_MIWT8_8_PLR1_SU32_SUM0_SUS256_SKXCCM4_VWA4_VWB2_WGM2_WGMXCC1_WGMXCCGn1
    SolutionIndex: 47
    SolutionNameMin: Cijk_Ailk_Bjlk_HSS_BH_UserArgs_MT256x256x32_MI16x16x1_SN_LDSB0_CLR1_GSU0_GSUC0_GSUWGMRR0_K1_LBSPPA2048_LBSPPB2048_LPA0_LPB0_MIWT8_8_PLR1_SU32_SUM0_SUS256_SKXCCM4_VWA4_VWB4_WGM2_WGMXCC1_WGMXCCGn1
    SolutionIndex: 48
    SolutionNameMin: Cijk_Ailk_Bjlk_HSS_BH_UserArgs_MT256x256x32_MI16x16x1_SN_LDSB0_CLR1_GSU0_GSUC0_GSUWGMRR0_K1_LBSPPA2048_LBSPPB2048_LPA0_LPB0_MIWT8_8_PLR1_SU32_SUM0_SUS256_SKXCCM4_VWA4_VWB8_WGM2_WGMXCC1_WGMXCCGn1
    SolutionIndex: 49
    SolutionNameMin: Cijk_Ailk_Bjlk_HSS_BH_UserArgs_MT256x256x32_MI16x16x1_SN_LDSB1_CLR1_GSU0_GSUC0_GSUWGMRR0_K1_LBSPPA2048_LBSPPB2048_LPA0_LPB32_MIWT8_8_PLR1_SU32_SUM0_SUS256_SKXCCM4_VWA4_VWB2_WGM4_WGMXCC1_WGMXCCGn1
    SolutionIndex: 50
    SolutionNameMin: Cijk_Ailk_Bjlk_HSS_BH_UserArgs_MT256x256x32_MI16x16x1_SN_LDSB0_CLR1_GSU0_GSUC0_GSUWGMRR0_K1_LBSPPA2048_LBSPPB2048_LPA0_LPB0_MIWT8_8_PLR1_SU32_SUM0_SUS256_SKXCCM4_VWA4_VWB4_WGM4_WGMXCC1_WGMXCCGn1
    SolutionIndex: 51
    SolutionNameMin: Cijk_Ailk_Bjlk_HSS_BH_UserArgs_MT256x256x32_MI16x16x1_SN_LDSB0_CLR1_GSU0_GSUC0_GSUWGMRR0_K1_LBSPPA2048_LBSPPB2048_LPA0_LPB0_MIWT8_8_PLR1_SU32_SUM0_SUS256_SKXCCM4_VWA4_VWB8_WGM4_WGMXCC1_WGMXCCGn1
    SolutionIndex: 52
    SolutionNameMin: Cijk_Ailk_Bjlk_HSS_BH_UserArgs_MT128x256x32_MI16x16x1_SN_LDSB1_CLR1_GSU0_GSUC0_GSUWGMRR0_K1_LBSPPA1024_LBSPPB2048_LPA0_LPB0_MIWT4_8_PLR1_SU32_SUM0_SUS256_SKXCCM4_VWA4_VWB4_WGM1_WGMXCC1_WGMXCCGn1
    SolutionIndex: 53
    SolutionNameMin: Cijk_Ailk_Bjlk_HSS_BH_UserArgs_MT128x256x32_MI16x16x1_SN_LDSB1_CLR1_GSU0_GSUC0_GSUWGMRR0_K1_LBSPPA1024_LBSPPB2048_LPA0_LPB0_MIWT4_8_PLR1_SU32_SUM0_SUS256_SKXCCM4_VWA4_VWB8_WGM1_WGMXCC1_WGMXCCGn1
    SolutionIndex: 54
    SolutionNameMin: Cijk_Ailk_Bjlk_HSS_BH_UserArgs_MT128x256x32_MI16x16x1_SN_LDSB1_CLR1_GSU0_GSUC0_GSUWGMRR0_K1_LBSPPA1024_LBSPPB2048_LPA0_LPB32_MIWT4_8_PLR1_SU32_SUM0_SUS256_SKXCCM4_VWA4_VWB2_WGM4_WGMXCC1_WGMXCCGn1
    SolutionIndex: 55
    SolutionNameMin: Cijk_Ailk_Bjlk_HSS_BH_UserArgs_MT128x256x32_MI16x16x1_SN_LDSB1_CLR1_GSU0_GSUC0_GSUWGMRR0_K1_LBSPPA1024_LBSPPB2048_LPA0_LPB0_MIWT4_8_PLR1_SU32_SUM0_SUS256_SKXCCM4_VWA4_VWB4_WGM4_WGMXCC1_WGMXCCGn1
    SolutionIndex: 56
    SolutionNameMin: Cijk_Ailk_Bjlk_HSS_BH_UserArgs_MT128x256x32_MI16x16x1_SN_LDSB1_CLR1_GSU0_GSUC0_GSUWGMRR0_K1_LBSPPA1024_LBSPPB2048_LPA0_LPB0_MIWT4_8_PLR1_SU32_SUM0_SUS256_SKXCCM4_VWA4_VWB8_WGM4_WGMXCC1_WGMXCCGn1
    SolutionIndex: 57
    SolutionNameMin: Cijk_Ailk_Bjlk_HSS_BH_UserArgs_MT256x128x32_MI16x16x1_SN_LDSB1_CLR1_GSU0_GSUC0_GSUWGMRR0_K1_LBSPPA2048_LBSPPB1024_LPA0_LPB16_MIWT8_4_PLR1_SU32_SUM0_SUS256_SKXCCM4_VWA4_VWB1_WGM1_WGMXCC1_WGMXCCGn1
    SolutionIndex: 58
    SolutionNameMin: Cijk_Ailk_Bjlk_HSS_BH_UserArgs_MT256x128x32_MI16x16x1_SN_LDSB1_CLR1_GSU0_GSUC0_GSUWGMRR0_K1_LBSPPA2048_LBSPPB1024_LPA0_LPB32_MIWT8_4_PLR1_SU32_SUM0_SUS256_SKXCCM4_VWA4_VWB2_WGM1_WGMXCC1_WGMXCCGn1
    SolutionIndex: 59
    SolutionNameMin: Cijk_Ailk_Bjlk_HSS_BH_UserArgs_MT256x128x32_MI16x16x1_SN_LDSB1_CLR1_GSU0_GSUC0_GSUWGMRR0_K1_LBSPPA2048_LBSPPB1024_LPA0_LPB0_MIWT8_4_PLR1_SU32_SUM0_SUS256_SKXCCM4_VWA4_VWB4_WGM1_WGMXCC1_WGMXCCGn1
    SolutionIndex: 60
    SolutionNameMin: Cijk_Ailk_Bjlk_HSS_BH_UserArgs_MT256x128x32_MI16x16x1_SN_LDSB1_CLR1_GSU0_GSUC0_GSUWGMRR0_K1_LBSPPA2048_LBSPPB1024_LPA0_LPB32_MIWT8_4_PLR1_SU32_SUM0_SUS256_SKXCCM4_VWA4_VWB2_WGM2_WGMXCC1_WGMXCCGn1
    SolutionIndex: 61
    SolutionNameMin: Cijk_Ailk_Bjlk_HSS_BH_UserArgs_MT256x128x32_MI16x16x1_SN_LDSB1_CLR1_GSU0_GSUC0_GSUWGMRR0_K1_LBSPPA2048_LBSPPB1024_LPA0_LPB32_MIWT8_4_PLR1_SU32_SUM0_SUS256_SKXCCM4_VWA4_VWB2_WGM4_WGMXCC1_WGMXCCGn1
    SolutionIndex: 62
    SolutionNameMin: Cijk_Ailk_Bjlk_HSS_BH_UserArgs_MT256x128x32_MI16x16x1_SN_LDSB1_CLR1_GSU0_GSUC0_GSUWGMRR0_K1_LBSPPA2048_LBSPPB1024_LPA0_LPB0_MIWT8_4_PLR1_SU32_SUM0_SUS256_SKXCCM4_VWA4_VWB4_WGM4_WGMXCC1_WGMXCCGn1
    SolutionIndex: 63
    SolutionNameMin: Cijk_Ailk_Bjlk_HSS_BH_UserArgs_MT128x128x32_MI16x16x1_SN_LDSB1_CLR1_GSU0_GSUC0_GSUWGMRR0_K1_LBSPPA1024_LBSPPB1024_LPA0_LPB32_MIWT4_4_PLR1_SU32_SUM0_SUS256_SKXCCM4_VWA4_VWB2_WGM1_WGMXCC1_WGMXCCGn1
    SolutionIndex: 64
    SolutionNameMin: Cijk_Ailk_Bjlk_HSS_BH_UserArgs_MT128x64x32_MI16x16x1_SN_LDSB0_CLR1_GSU0_GSUC0_GSUWGMRR0_K1_LBSPPA1024_LBSPPB512_LPA0_LPB16_MIWT4_2_PLR1_SU32_SUM0_SUS256_SKXCCM4_VWA4_VWB1_WGM1_WGMXCC1_WGMXCCGn1
    SolutionIndex: 65
    SolutionNameMin: Cijk_Ailk_Bjlk_HSS_BH_UserArgs_MT128x64x32_MI16x16x1_SN_LDSB0_CLR1_GSU0_GSUC0_GSUWGMRR0_K1_LBSPPA1024_LBSPPB512_LPA0_LPB32_MIWT4_2_PLR1_SU32_SUM0_SUS256_SKXCCM4_VWA4_VWB2_WGM1_WGMXCC1_WGMXCCGn1
    SolutionIndex: 66
    SolutionNameMin: Cijk_Ailk_Bjlk_HSS_BH_UserArgs_MT128x64x32_MI16x16x1_SN_LDSB0_CLR1_GSU0_GSUC0_GSUWGMRR0_K1_LBSPPA1024_LBSPPB512_LPA0_LPB32_MIWT4_2_PLR1_SU32_SUM0_SUS256_SKXCCM4_VWA4_VWB2_WGM4_WGMXCC1_WGMXCCGn1
    SolutionIndex: 67
    SolutionNameMin: Cijk_Ailk_Bjlk_HSS_BH_UserArgs_MT128x32x32_MI16x16x1_SN_LDSB0_CLR1_GSU0_GSUC0_GSUWGMRR0_K1_LBSPPA1024_LBSPPB256_LPA0_LPB16_MIWT4_1_PLR1_SU32_SUM0_SUS256_SKXCCM4_VWA4_VWB1_WGM1_WGMXCC1_WGMXCCGn1
    SolutionIndex: 68
    SolutionNameMin: Cijk_Ailk_Bjlk_HSS_BH_UserArgs_MT64x64x32_MI16x16x1_SN_LDSB0_CLR1_GSU0_GSUC0_GSUWGMRR0_K1_LBSPPA512_LBSPPB512_LPA32_LPB32_MIWT2_2_PLR1_SU32_SUM0_SUS256_SKXCCM4_VWA2_VWB2_WGM1_WGMXCC1_WGMXCCGn1
    SolutionIndex: 69
    SolutionNameMin: Cijk_Ailk_Bjlk_HSS_BH_UserArgs_MT32x32x32_MI16x16x1_SN_LDSB0_CLR1_GSU0_GSUC0_GSUWGMRR0_K1_LBSPPA256_LBSPPB256_LPA16_LPB16_MIWT1_1_PLR1_SU32_SUM0_SUS256_SKXCCM4_VWA1_VWB1_WGM1_WGMXCC1_WGMXCCGn1
    SolutionIndex: 70
    SolutionNameMin: Cijk_Ailk_Bjlk_HSS_BH_UserArgs_MT256x256x64_MI16x16x1_SN_LDSB1_CLR1_GSU0_GSUC0_GSUWGMRR0_K1_LBSPPA2048_LBSPPB2048_LPA0_LPB0_MIWT8_8_PLR1_SU32_SUM0_SUS256_SKXCCM4_VWA4_VWB4_WGM1_WGMXCC1_WGMXCCGn1
    SolutionIndex: 71
    SolutionNameMin: Cijk_Ailk_Bjlk_HSS_BH_UserArgs_MT256x256x64_MI16x16x1_SN_LDSB1_CLR1_GSU0_GSUC0_GSUWGMRR0_K1_LBSPPA2048_LBSPPB2048_LPA0_LPB0_MIWT8_8_PLR2_SU32_SUM0_SUS256_SKXCCM4_VWA4_VWB4_WGM1_WGMXCC1_WGMXCCGn1
    SolutionIndex: 72
    SolutionNameMin: Cijk_Ailk_Bjlk_HSS_BH_UserArgs_MT256x256x64_MI16x16x1_SN_LDSB1_CLR1_GSU0_GSUC0_GSUWGMRR0_K1_LBSPPA2048_LBSPPB2048_LPA0_LPB0_MIWT8_8_PLR2_SU32_SUM0_SUS256_SKXCCM4_VWA4_VWB8_WGM1_WGMXCC1_WGMXCCGn1
    SolutionIndex: 73
    SolutionNameMin: Cijk_Ailk_Bjlk_HSS_BH_UserArgs_MT256x256x64_MI16x16x1_SN_LDSB1_CLR1_GSU0_GSUC0_GSUWGMRR0_K1_LBSPPA2048_LBSPPB2048_LPA0_LPB0_MIWT8_8_PLR1_SU32_SUM0_SUS256_SKXCCM4_VWA4_VWB4_WGM2_WGMXCC1_WGMXCCGn1
    SolutionIndex: 74
    SolutionNameMin: Cijk_Ailk_Bjlk_HSS_BH_UserArgs_MT256x256x64_MI16x16x1_SN_LDSB1_CLR1_GSU0_GSUC0_GSUWGMRR0_K1_LBSPPA2048_LBSPPB2048_LPA0_LPB0_MIWT8_8_PLR2_SU32_SUM0_SUS256_SKXCCM4_VWA4_VWB4_WGM2_WGMXCC1_WGMXCCGn1
    SolutionIndex: 75
    SolutionNameMin: Cijk_Ailk_Bjlk_HSS_BH_UserArgs_MT256x256x64_MI16x16x1_SN_LDSB1_CLR1_GSU0_GSUC0_GSUWGMRR0_K1_LBSPPA2048_LBSPPB2048_LPA0_LPB0_MIWT8_8_PLR1_SU32_SUM0_SUS256_SKXCCM4_VWA4_VWB4_WGM4_WGMXCC1_WGMXCCGn1
    SolutionIndex: 76
    SolutionNameMin: Cijk_Ailk_Bjlk_HSS_BH_UserArgs_MT256x256x64_MI16x16x1_SN_LDSB1_CLR1_GSU0_GSUC0_GSUWGMRR0_K1_LBSPPA2048_LBSPPB2048_LPA0_LPB0_MIWT8_8_PLR2_SU32_SUM0_SUS256_SKXCCM4_VWA4_VWB4_WGM4_WGMXCC1_WGMXCCGn1
    SolutionIndex: 77
    SolutionNameMin: Cijk_Ailk_Bjlk_HSS_BH_UserArgs_MT128x256x64_MI16x16x1_SN_LDSB1_CLR1_GSU0_GSUC0_GSUWGMRR0_K1_LBSPPA1024_LBSPPB2048_LPA0_LPB0_MIWT4_8_PLR1_SU32_SUM0_SUS256_SKXCCM4_VWA4_VWB4_WGM1_WGMXCC1_WGMXCCGn1
    SolutionIndex: 78
    SolutionNameMin: Cijk_Ailk_Bjlk_HSS_BH_UserArgs_MT256x128x64_MI16x16x1_SN_LDSB1_CLR1_GSU0_GSUC0_GSUWGMRR0_K1_LBSPPA2048_LBSPPB1024_LPA0_LPB32_MIWT8_4_PLR1_SU32_SUM0_SUS256_SKXCCM4_VWA4_VWB2_WGM1_WGMXCC1_WGMXCCGn1
    SolutionIndex: 79
    SolutionNameMin: Cijk_Ailk_Bjlk_HSS_BH_UserArgs_MT128x128x64_MI16x16x1_SN_LDSB1_CLR1_GSU0_GSUC0_GSUWGMRR0_K1_LBSPPA1024_LBSPPB1024_LPA0_LPB0_MIWT4_4_PLR1_SU32_SUM0_SUS256_SKXCCM4_VWA4_VWB4_WGM1_WGMXCC1_WGMXCCGn1
    SolutionIndex: 80
    SolutionNameMin: Cijk_Ailk_Bjlk_HSS_BH_UserArgs_MT128x128x64_MI16x16x1_SN_LDSB1_CLR1_GSU0_GSUC0_GSUWGMRR0_K1_LBSPPA1024_LBSPPB1024_LPA0_LPB0_MIWT4_4_PLR1_SU32_SUM0_SUS256_SKXCCM4_VWA4_VWB4_WGM2_WGMXCC1_WGMXCCGn1
    SolutionIndex: 81
    SolutionNameMin: Cijk_Ailk_Bjlk_HSS_BH_UserArgs_MT128x128x64_MI16x16x1_SN_LDSB1_CLR1_GSU0_GSUC0_GSUWGMRR0_K1_LBSPPA1024_LBSPPB1024_LPA0_LPB0_MIWT4_4_PLR1_SU32_SUM0_SUS256_SKXCCM4_VWA4_VWB4_WGM4_WGMXCC1_WGMXCCGn1
    SolutionIndex: 82
    SolutionNameMin: Cijk_Ailk_Bjlk_HSS_BH_UserArgs_MT128x64x64_MI16x16x1_SN_LDSB1_CLR1_GSU0_GSUC0_GSUWGMRR0_K1_LBSPPA1024_LBSPPB512_LPA0_LPB32_MIWT4_2_PLR1_SU32_SUM0_SUS256_SKXCCM4_VWA4_VWB2_WGM1_WGMXCC1_WGMXCCGn1
    SolutionIndex: 83
    SolutionNameMin: Cijk_Ailk_Bjlk_HSS_BH_UserArgs_MT128x64x64_MI16x16x1_SN_LDSB1_CLR1_GSU0_GSUC0_GSUWGMRR0_K1_LBSPPA1024_LBSPPB512_LPA0_LPB32_MIWT4_2_PLR2_SU32_SUM0_SUS256_SKXCCM4_VWA4_VWB2_WGM1_WGMXCC1_WGMXCCGn1
    SolutionIndex: 84
    SolutionNameMin: Cijk_Ailk_Bjlk_HSS_BH_UserArgs_MT128x64x64_MI16x16x1_SN_LDSB1_CLR1_GSU0_GSUC0_GSUWGMRR0_K1_LBSPPA1024_LBSPPB512_LPA0_LPB32_MIWT4_2_PLR2_SU32_SUM0_SUS256_SKXCCM4_VWA4_VWB2_WGM4_WGMXCC1_WGMXCCGn1
    SolutionIndex: 85
    SolutionNameMin: Cijk_Ailk_Bjlk_HSS_BH_UserArgs_MT64x64x64_MI16x16x1_SN_LDSB1_CLR1_GSU0_GSUC0_GSUWGMRR0_K1_LBSPPA512_LBSPPB512_LPA32_LPB32_MIWT2_2_PLR1_SU32_SUM0_SUS256_SKXCCM4_VWA2_VWB2_WGM1_WGMXCC1_WGMXCCGn1
    SolutionIndex: 86
    SolutionNameMin: Cijk_Ailk_Bjlk_HSS_BH_UserArgs_MT64x64x64_MI16x16x1_SN_LDSB1_CLR1_GSU0_GSUC0_GSUWGMRR0_K1_LBSPPA512_LBSPPB512_LPA32_LPB32_MIWT2_2_PLR2_SU32_SUM0_SUS256_SKXCCM4_VWA2_VWB2_WGM1_WGMXCC1_WGMXCCGn1
    SolutionIndex: 87
    SolutionNameMin: Cijk_Ailk_Bjlk_HSS_BH_UserArgs_MT64x64x64_MI16x16x1_SN_LDSB1_CLR1_GSU0_GSUC0_GSUWGMRR0_K1_LBSPPA512_LBSPPB512_LPA32_LPB32_MIWT2_2_PLR2_SU32_SUM0_SUS256_SKXCCM4_VWA2_VWB2_WGM2_WGMXCC1_WGMXCCGn1
    SolutionIndex: 88
    SolutionNameMin: Cijk_Ailk_Bjlk_HSS_BH_UserArgs_MT32x64x64_MI16x16x1_SN_LDSB0_CLR1_GSU0_GSUC0_GSUWGMRR0_K1_LBSPPA256_LBSPPB512_LPA16_LPB32_MIWT1_2_PLR2_SU32_SUM0_SUS256_SKXCCM4_VWA1_VWB2_WGM1_WGMXCC1_WGMXCCGn1
    SolutionIndex: 89
    SolutionNameMin: Cijk_Ailk_Bjlk_HSS_BH_UserArgs_MT64x32x64_MI16x16x1_SN_LDSB0_CLR1_GSU0_GSUC0_GSUWGMRR0_K1_LBSPPA512_LBSPPB256_LPA32_LPB16_MIWT2_1_PLR2_SU32_SUM0_SUS256_SKXCCM4_VWA2_VWB1_WGM1_WGMXCC1_WGMXCCGn1
    SolutionIndex: 90
    SolutionNameMin: Cijk_Ailk_Bjlk_HSS_BH_UserArgs_MT32x32x64_MI16x16x1_SN_LDSB0_CLR1_GSU0_GSUC0_GSUWGMRR0_K1_LBSPPA256_LBSPPB256_LPA16_LPB16_MIWT1_1_PLR1_SU32_SUM0_SUS256_SKXCCM4_VWA1_VWB1_WGM1_WGMXCC1_WGMXCCGn1
    SolutionIndex: 91
    SolutionNameMin: Cijk_Ailk_Bjlk_HSS_BH_UserArgs_MT32x32x64_MI16x16x1_SN_LDSB0_CLR1_GSU0_GSUC0_GSUWGMRR0_K1_LBSPPA256_LBSPPB256_LPA16_LPB16_MIWT1_1_PLR2_SU32_SUM0_SUS256_SKXCCM4_VWA1_VWB1_WGM1_WGMXCC1_WGMXCCGn1
    SolutionIndex: 92
    SolutionNameMin: Cijk_Ailk_Bjlk_HSS_BH_UserArgs_MT128x128x128_MI16x16x1_SN_LDSB1_CLR1_GSU0_GSUC0_GSUWGMRR0_K1_LBSPPA1024_LBSPPB1024_LPA0_LPB0_MIWT4_4_PLR1_SU32_SUM0_SUS256_SKXCCM4_VWA4_VWB4_WGM1_WGMXCC1_WGMXCCGn1
    SolutionIndex: 93
    SolutionNameMin: Cijk_Ailk_Bjlk_HSS_BH_UserArgs_MT128x128x128_MI16x16x1_SN_LDSB1_CLR1_GSU0_GSUC0_GSUWGMRR0_K1_LBSPPA1024_LBSPPB1024_LPA0_LPB0_MIWT4_4_PLR1_SU32_SUM0_SUS256_SKXCCM4_VWA4_VWB4_WGM2_WGMXCC1_WGMXCCGn1
    SolutionIndex: 94
    SolutionNameMin: Cijk_Ailk_Bjlk_HSS_BH_UserArgs_MT128x64x128_MI16x16x1_SN_LDSB1_CLR1_GSU0_GSUC0_GSUWGMRR0_K1_LBSPPA1024_LBSPPB512_LPA0_LPB32_MIWT4_2_PLR2_SU32_SUM0_SUS256_SKXCCM4_VWA4_VWB2_WGM1_WGMXCC1_WGMXCCGn1
    SolutionIndex: 95
    SolutionNameMin: Cijk_Ailk_Bjlk_HSS_BH_UserArgs_MT128x64x128_MI16x16x1_SN_LDSB1_CLR1_GSU0_GSUC0_GSUWGMRR0_K1_LBSPPA1024_LBSPPB512_LPA0_LPB32_MIWT4_2_PLR2_SU32_SUM0_SUS256_SKXCCM4_VWA4_VWB2_WGM4_WGMXCC1_WGMXCCGn1
    SolutionIndex: 96
    SolutionNameMin: Cijk_Ailk_Bjlk_HSS_BH_UserArgs_MT64x64x128_MI16x16x1_SN_LDSB1_CLR1_GSU0_GSUC0_GSUWGMRR0_K1_LBSPPA512_LBSPPB512_LPA32_LPB32_MIWT2_2_PLR2_SU32_SUM0_SUS256_SKXCCM4_VWA2_VWB2_WGM1_WGMXCC1_WGMXCCGn1
    SolutionIndex: 97
    SolutionNameMin: Cijk_Ailk_Bjlk_HSS_BH_UserArgs_MT32x64x128_MI16x16x1_SN_LDSB1_CLR1_GSU0_GSUC0_GSUWGMRR0_K1_LBSPPA256_LBSPPB512_LPA16_LPB32_MIWT1_2_PLR2_SU32_SUM0_SUS256_SKXCCM4_VWA1_VWB2_WGM1_WGMXCC1_WGMXCCGn1
    SolutionIndex: 98
    SolutionNameMin: Cijk_Ailk_Bjlk_HSS_BH_UserArgs_MT64x32x128_MI16x16x1_SN_LDSB1_CLR1_GSU0_GSUC0_GSUWGMRR0_K1_LBSPPA512_LBSPPB256_LPA32_LPB16_MIWT2_1_PLR2_SU32_SUM0_SUS256_SKXCCM4_VWA2_VWB1_WGM1_WGMXCC1_WGMXCCGn1
    SolutionIndex: 99
    SolutionNameMin: Cijk_Ailk_Bjlk_HSS_BH_UserArgs_MT64x32x128_MI16x16x1_SN_LDSB1_CLR1_GSU0_GSUC0_GSUWGMRR0_K1_LBSPPA512_LBSPPB256_LPA32_LPB16_MIWT2_1_PLR2_SU32_SUM0_SUS256_SKXCCM4_VWA2_VWB1_WGM4_WGMXCC1_WGMXCCGn1
    SolutionIndex: 100
    SolutionNameMin: Cijk_Ailk_Bjlk_HSS_BH_UserArgs_MT32x32x32_MI16x16x1_SN_LDSB0_CLR1_GSU0_GSUC0_GSUWGMRR0_K1_LBSPPA256_LBSPPB256_LPA16_LPB16_MIWT1_1_PLR1_SU32_SUM0_SUS256_SKXCCM0_VWA1_VWB1_WGM1_WGMXCC1_WGMXCCGn1
- - - [128, 128, 1, 128, 128, 128, 128, 128]
    - [91, 0.082]
  - - [128, 128, 1, 256, 128, 128, 128, 128]
    - [90, 0.145]
  - - [128, 128, 1, 512, 128, 128, 128, 128]
    - [31, 0.232]
  - - [128, 128, 1, 1024, 128, 128, 128, 128]
    - [30, 0.338]
  - - [128, 128, 1, 2048, 128, 128, 128, 128]
    - [14, 0.567]
  - - [128, 128, 1, 4096, 128, 128, 128, 128]
    - [30, 0.954]
  - - [128, 128, 1, 8192, 128, 128, 128, 128]
    - [42, 1.356]
  - - [128, 256, 1, 128, 128, 128, 128, 256]
    - [69, 0.165]
  - - [128, 256, 1, 256, 128, 128, 128, 256]
    - [31, 0.289]
  - - [128, 256, 1, 512, 128, 128, 128, 256]
    - [30, 0.468]
  - - [128, 256, 1, 1024, 128, 128, 128, 256]
    - [30, 0.669]
  - - [128, 256, 1, 2048, 128, 128, 128, 256]
    - [41, 1.038]
  - - [128, 256, 1, 4096, 128, 128, 128, 256]
    - [88, 1.644]
  - - [128, 256, 1, 8192, 128, 128, 128, 256]
    - [97, 2.411]
  - - [128, 512, 1, 128, 128, 128, 128, 512]
    - [15, 0.317]
  - - [128, 512, 1, 256, 128, 128, 128, 512]
    - [31, 0.565]
  - - [128, 512, 1, 512, 128, 128, 128, 512]
    - [30, 0.915]
  - - [128, 512, 1, 1024, 128, 128, 128, 512]
    - [30, 1.322]
  - - [128, 512, 1, 2048, 128, 128, 128, 512]
    - [40, 1.886]
  - - [128, 512, 1, 4096, 128, 128, 128, 512]
    - [86, 2.727]
  - - [128, 512, 1, 8192, 128, 128, 128, 512]
    - [96, 4.046]
  - - [128, 1024, 1, 128, 128, 128, 128, 1024]
    - [29, 0.596]
  - - [128, 1024, 1, 256, 128, 128, 128, 1024]
    - [29, 1.049]
  - - [128, 1024, 1, 512, 128, 128, 128, 1024]
    - [39, 1.677]
  - - [128, 1024, 1, 1024, 128, 128, 128, 1024]
    - [40, 2.399]
  - - [128, 1024, 1, 2048, 128, 128, 128, 1024]
    - [36, 3.161]
  - - [128, 1024, 1, 4096, 128, 128, 128, 1024]
    - [36, 4.387]
  - - [128, 1024, 1, 8192, 128, 128, 128, 1024]
    - [27, 6.088]
  - - [128, 2048, 1, 128, 128, 128, 128, 2048]
    - [86, 1.054]
  - - [128, 2048, 1, 256, 128, 128, 128, 2048]
    - [86, 1.808]
  - - [128, 2048, 1, 512, 128, 128, 128, 2048]
    - [96, 2.843]
  - - [128, 2048, 1, 1024, 128, 128, 128, 2048]
    - [96, 4.101]
  - - [128, 2048, 1, 2048, 128, 128, 128, 2048]
    - [96, 5.112]
  - - [128, 2048, 1, 4096, 128, 128, 128, 2048]
    - [79, 7.01]
  - - [128, 2048, 1, 8192, 128, 128, 128, 2048]
    - [24, 9.516]
  - - [128, 4096, 1, 128, 128, 128, 128, 4096]
    - [64, 1.765]
  - - [128, 4096, 1, 256, 128, 128, 128, 4096]
    - [83, 2.922]
  - - [128, 4096, 1, 512, 128, 128, 128, 4096]
    - [82, 4.369]
  - - [128, 4096, 1, 1024, 128, 128, 128, 4096]
    - [94, 6.018]
  - - [128, 4096, 1, 2048, 128, 128, 128, 4096]
    - [79, 7.883]
  - - [128, 4096, 1, 4096, 128, 128, 128, 4096]
    - [79, 10.297]
  - - [128, 4096, 1, 8192, 128, 128, 128, 4096]
    - [79, 12.9]
  - - [128, 8192, 1, 128, 128, 128, 128, 8192]
    - [63, 2.673]
  - - [128, 8192, 1, 256, 128, 128, 128, 8192]
    - [79, 4.376]
  - - [128, 8192, 1, 512, 128, 128, 128, 8192]
    - [79, 6.63]
  - - [128, 8192, 1, 1024, 128, 128, 128, 8192]
    - [79, 8.951]
  - - [128, 8192, 1, 2048, 128, 128, 128, 8192]
    - [92, 10.943]
  - - [128, 8192, 1, 4096, 128, 128, 128, 8192]
    - [24, 13.055]
  - - [128, 8192, 1, 8192, 128, 128, 128, 8192]
    - [53, 14.547]
  - - [256, 128, 1, 128, 256, 256, 256, 128]
    - [69, 0.164]
  - - [256, 128, 1, 256, 256, 256, 256, 128]
    - [90, 0.287]
  - - [256, 128, 1, 512, 256, 256, 256, 128]
    - [30, 0.465]
  - - [256, 128, 1, 1024, 256, 256, 256, 128]
    - [31, 0.666]
  - - [256, 128, 1, 2048, 256, 256, 256, 128]
    - [30, 1.038]
  - - [256, 128, 1, 4096, 256, 256, 256, 128]
    - [88, 1.644]
  - - [256, 128, 1, 8192, 256, 256, 256, 128]
    - [99, 2.391]
  - - [256, 256, 1, 128, 256, 256, 256, 256]
    - [30, 0.321]
  - - [256, 256, 1, 256, 256, 256, 256, 256]
    - [30, 0.563]
  - - [256, 256, 1, 512, 256, 256, 256, 256]
    - [30, 0.914]
  - - [256, 256, 1, 1024, 256, 256, 256, 256]
    - [41, 1.311]
  - - [256, 256, 1, 2048, 256, 256, 256, 256]
    - [40, 1.882]
  - - [256, 256, 1, 4096, 256, 256, 256, 256]
    - [87, 2.723]
  - - [256, 256, 1, 8192, 256, 256, 256, 256]
    - [36, 3.777]
  - - [256, 512, 1, 128, 256, 256, 256, 512]
    - [88, 0.597]
  - - [256, 512, 1, 256, 256, 256, 256, 512]
    - [29, 1.033]
  - - [256, 512, 1, 512, 256, 256, 256, 512]
    - [39, 1.669]
  - - [256, 512, 1, 1024, 256, 256, 256, 512]
    - [39, 2.418]
  - - [256, 512, 1, 2048, 256, 256, 256, 512]
    - [96, 3.227]
  - - [256, 512, 1, 4096, 256, 256, 256, 512]
    - [84, 4.456]
  - - [256, 512, 1, 8192, 256, 256, 256, 512]
    - [35, 6.126]
  - - [256, 1024, 1, 128, 256, 256, 256, 1024]
    - [68, 1.046]
  - - [256, 1024, 1, 256, 256, 256, 256, 1024]
    - [85, 1.833]
  - - [256, 1024, 1, 512, 256, 256, 256, 1024]
    - [96, 2.874]
  - - [256, 1024, 1, 1024, 256, 256, 256, 1024]
    - [96, 4.137]
  - - [256, 1024, 1, 2048, 256, 256, 256, 1024]
    - [37, 5.181]
  - - [256, 1024, 1, 4096, 256, 256, 256, 1024]
    - [81, 6.956]
  - - [256, 1024, 1, 8192, 256, 256, 256, 1024]
    - [79, 9.537]
  - - [256, 2048, 1, 128, 256, 256, 256, 2048]
    - [66, 1.738]
  - - [256, 2048, 1, 256, 256, 256, 256, 2048]
    - [83, 2.887]
  - - [256, 2048, 1, 512, 256, 256, 256, 2048]
    - [84, 4.375]
  - - [256, 2048, 1, 1024, 256, 256, 256, 2048]
    - [94, 5.979]
  - - [256, 2048, 1, 2048, 256, 256, 256, 2048]
    - [79, 7.804]
  - - [256, 2048, 1, 4096, 256, 256, 256, 2048]
    - [24, 10.267]
  - - [256, 2048, 1, 8192, 256, 256, 256, 2048]
    - [25, 12.787]
  - - [256, 4096, 1, 128, 256, 256, 256, 4096]
    - [63, 2.673]
  - - [256, 4096, 1, 256, 256, 256, 256, 4096]
    - [79, 4.41]
  - - [256, 4096, 1, 512, 256, 256, 256, 4096]
    - [79, 6.737]
  - - [256, 4096, 1, 1024, 256, 256, 256, 4096]
    - [79, 9.074]
  - - [256, 4096, 1, 2048, 256, 256, 256, 4096]
    - [34, 10.905]
  - - [256, 4096, 1, 4096, 256, 256, 256, 4096]
    - [24, 13.069]
  - - [256, 4096, 1, 8192, 256, 256, 256, 4096]
    - [62, 14.595]
  - - [256, 8192, 1, 128, 256, 256, 256, 8192]
    - [53, 3.603]
  - - [256, 8192, 1, 256, 256, 256, 256, 8192]
    - [53, 5.861]
  - - [256, 8192, 1, 512, 256, 256, 256, 8192]
    - [58, 8.416]
  - - [256, 8192, 1, 1024, 256, 256, 256, 8192]
    - [21, 10.526]
  - - [256, 8192, 1, 2048, 256, 256, 256, 8192]
    - [79, 12.522]
  - - [256, 8192, 1, 4096, 256, 256, 256, 8192]
    - [6, 14.721]
  - - [256, 8192, 1, 8192, 256, 256, 256, 8192]
    - [48, 16.575]
  - - [512, 128, 1, 128, 512, 512, 512, 128]
    - [69, 0.322]
  - - [512, 128, 1, 256, 512, 512, 512, 128]
    - [91, 0.565]
  - - [512, 128, 1, 512, 512, 512, 512, 128]
    - [30, 0.911]
  - - [512, 128, 1, 1024, 512, 512, 512, 128]
    - [30, 1.317]
  - - [512, 128, 1, 2048, 512, 512, 512, 128]
    - [40, 1.881]
  - - [512, 128, 1, 4096, 512, 512, 512, 128]
    - [86, 2.686]
  - - [512, 128, 1, 8192, 512, 512, 512, 128]
    - [36, 3.779]
  - - [512, 256, 1, 128, 512, 512, 512, 256]
    - [89, 0.597]
  - - [512, 256, 1, 256, 512, 512, 512, 256]
    - [88, 1.045]
  - - [512, 256, 1, 512, 512, 512, 512, 256]
    - [39, 1.668]
  - - [512, 256, 1, 1024, 512, 512, 512, 256]
    - [98, 2.412]
  - - [512, 256, 1, 2048, 512, 512, 512, 256]
    - [96, 3.216]
  - - [512, 256, 1, 4096, 512, 512, 512, 256]
    - [83, 4.521]
  - - [512, 256, 1, 8192, 512, 512, 512, 256]
    - [35, 6.168]
  - - [512, 512, 1, 128, 512, 512, 512, 512]
    - [68, 1.052]
  - - [512, 512, 1, 256, 512, 512, 512, 512]
    - [86, 1.826]
  - - [512, 512, 1, 512, 512, 512, 512, 512]
    - [85, 2.848]
  - - [512, 512, 1, 1024, 512, 512, 512, 512]
    - [96, 4.127]
  - - [512, 512, 1, 2048, 512, 512, 512, 512]
    - [38, 5.209]
  - - [512, 512, 1, 4096, 512, 512, 512, 512]
    - [79, 7.095]
  - - [512, 512, 1, 8192, 512, 512, 512, 512]
    - [79, 9.512]
  - - [512, 1024, 1, 128, 512, 512, 512, 1024]
    - [65, 1.784]
  - - [512, 1024, 1, 256, 512, 512, 512, 1024]
    - [65, 2.927]
  - - [512, 1024, 1, 512, 512, 512, 512, 1024]
    - [83, 4.458]
  - - [512, 1024, 1, 1024, 512, 512, 512, 1024]
    - [94, 6.044]
  - - [512, 1024, 1, 2048, 512, 512, 512, 1024]
    - [81, 7.78]
  - - [512, 1024, 1, 4096, 512, 512, 512, 1024]
    - [79, 10.27]
  - - [512, 1024, 1, 8192, 512, 512, 512, 1024]
    - [25, 12.85]
  - - [512, 2048, 1, 128, 512, 512, 512, 2048]
    - [63, 2.674]
  - - [512, 2048, 1, 256, 512, 512, 512, 2048]
    - [79, 4.408]
  - - [512, 2048, 1, 512, 512, 512, 512, 2048]
    - [79, 6.797]
  - - [512, 2048, 1, 1024, 512, 512, 512, 2048]
    - [79, 9.084]
  - - [512, 2048, 1, 2048, 512, 512, 512, 2048]
    - [33, 10.967]
  - - [512, 2048, 1, 4096, 512, 512, 512, 2048]
    - [26, 12.881]
  - - [512, 2048, 1, 8192, 512, 512, 512, 2048]
    - [59, 14.711]
  - - [512, 4096, 1, 128, 512, 512, 512, 4096]
    - [58, 3.76]
  - - [512, 4096, 1, 256, 512, 512, 512, 4096]
    - [59, 6.004]
  - - [512, 4096, 1, 512, 512, 512, 512, 4096]
    - [59, 8.533]
  - - [512, 4096, 1, 1024, 512, 512, 512, 4096]
    - [20, 10.707]
  - - [512, 4096, 1, 2048, 512, 512, 512, 4096]
    - [10, 12.53]
  - - [512, 4096, 1, 4096, 512, 512, 512, 4096]
    - [56, 14.65]
  - - [512, 4096, 1, 8192, 512, 512, 512, 4096]
    - [48, 16.741]
  - - [512, 8192, 1, 128, 512, 512, 512, 8192]
    - [51, 4.295]
  - - [512, 8192, 1, 256, 512, 512, 512, 8192]
    - [45, 6.89]
  - - [512, 8192, 1, 512, 512, 512, 512, 8192]
    - [45, 9.874]
  - - [512, 8192, 1, 1024, 512, 512, 512, 8192]
    - [17, 12.348]
  - - [512, 8192, 1, 2048, 512, 512, 512, 8192]
    - [51, 14.525]
  - - [512, 8192, 1, 4096, 512, 512, 512, 8192]
    - [5, 16.824]
  - - [512, 8192, 1, 8192, 512, 512, 512, 8192]
    - [51, 18.565]
  - - [1024, 128, 1, 128, 1024, 1024, 1024, 128]
    - [89, 0.599]
  - - [1024, 128, 1, 256, 1024, 1024, 1024, 128]
    - [89, 1.044]
  - - [1024, 128, 1, 512, 1024, 1024, 1024, 128]
    - [39, 1.672]
  - - [1024, 128, 1, 1024, 1024, 1024, 1024, 128]
    - [39, 2.407]
  - - [1024, 128, 1, 2048, 1024, 1024, 1024, 128]
    - [38, 3.129]
  - - [1024, 128, 1, 4096, 1024, 1024, 1024, 128]
    - [83, 4.441]
  - - [1024, 128, 1, 8192, 1024, 1024, 1024, 128]
    - [27, 6.077]
  - - [1024, 256, 1, 128, 1024, 1024, 1024, 256]
    - [85, 1.063]
  - - [1024, 256, 1, 256, 1024, 1024, 1024, 256]
    - [86, 1.828]
  - - [1024, 256, 1, 512, 1024, 1024, 1024, 256]
    - [86, 2.863]
  - - [1024, 256, 1, 1024, 1024, 1024, 1024, 256]
    - [96, 4.137]
  - - [1024, 256, 1, 2048, 1024, 1024, 1024, 256]
    - [37, 5.222]
  - - [1024, 256, 1, 4096, 1024, 1024, 1024, 256]
    - [79, 6.992]
  - - [1024, 256, 1, 8192, 1024, 1024, 1024, 256]
    - [79, 9.509]
  - - [1024, 512, 1, 128, 1024, 1024, 1024, 512]
    - [65, 1.796]
  - - [1024, 512, 1, 256, 1024, 1024, 1024, 512]
    - [65, 2.955]
  - - [1024, 512, 1, 512, 1024, 1024, 1024, 512]
    - [83, 4.475]
  - - [1024, 512, 1, 1024, 1024, 1024, 1024, 512]
    - [94, 6.052]
  - - [1024, 512, 1, 2048, 1024, 1024, 1024, 512]
    - [79, 7.896]
  - - [1024, 512, 1, 4096, 1024, 1024, 1024, 512]
    - [24, 10.282]
  - - [1024, 512, 1, 8192, 1024, 1024, 1024, 512]
    - [79, 12.828]
  - - [1024, 1024, 1, 128, 1024, 1024, 1024, 1024]
    - [63, 2.697]
  - - [1024, 1024, 1, 256, 1024, 1024, 1024, 1024]
    - [79, 4.447]
  - - [1024, 1024, 1, 512, 1024, 1024, 1024, 1024]
    - [79, 6.781]
  - - [1024, 1024, 1, 1024, 1024, 1024, 1024, 1024]
    - [79, 9.088]
  - - [1024, 1024, 1, 2048, 1024, 1024, 1024, 1024]
    - [33, 10.828]
  - - [1024, 1024, 1, 4096, 1024, 1024, 1024, 1024]
    - [24, 12.96]
  - - [1024, 1024, 1, 8192, 1024, 1024, 1024, 1024]
    - [56, 14.611]
  - - [1024, 2048, 1, 128, 1024, 1024, 1024, 2048]
    - [12, 3.705]
  - - [1024, 2048, 1, 256, 1024, 1024, 1024, 2048]
    - [12, 5.974]
  - - [1024, 2048, 1, 512, 1024, 1024, 1024, 2048]
    - [55, 8.506]
  - - [1024, 2048, 1, 1024, 1024, 1024, 1024, 2048]
    - [77, 10.654]
  - - [1024, 2048, 1, 2048, 1024, 1024, 1024, 2048]
    - [79, 12.416]
  - - [1024, 2048, 1, 4096, 1024, 1024, 1024, 2048]
    - [53, 14.747]
  - - [1024, 2048, 1, 8192, 1024, 1024, 1024, 2048]
    - [45, 16.593]
  - - [1024, 4096, 1, 128, 1024, 1024, 1024, 4096]
    - [2, 4.249]
  - - [1024, 4096, 1, 256, 1024, 1024, 1024, 4096]
    - [2, 6.809]
  - - [1024, 4096, 1, 512, 1024, 1024, 1024, 4096]
    - [45, 9.769]
  - - [1024, 4096, 1, 1024, 1024, 1024, 1024, 4096]
    - [16, 12.234]
  - - [1024, 4096, 1, 2048, 1024, 1024, 1024, 4096]
    - [43, 14.299]
  - - [1024, 4096, 1, 4096, 1024, 1024, 1024, 4096]
    - [3, 16.628]
  - - [1024, 4096, 1, 8192, 1024, 1024, 1024, 4096]
    - [2, 18.434]
  - - [1024, 8192, 1, 128, 1024, 1024, 1024, 8192]
    - [72, 4.342]
  - - [1024, 8192, 1, 256, 1024, 1024, 1024, 8192]
    - [58, 7.091]
  - - [1024, 8192, 1, 512, 1024, 1024, 1024, 8192]
    - [1, 10.376]
  - - [1024, 8192, 1, 1024, 1024, 1024, 1024, 8192]
    - [45, 13.601]
  - - [1024, 8192, 1, 2048, 1024, 1024, 1024, 8192]
    - [43, 16.078]
  - - [1024, 8192, 1, 4096, 1024, 1024, 1024, 8192]
    - [45, 18.062]
  - - [1024, 8192, 1, 8192, 1024, 1024, 1024, 8192]
    - [70, 19.762]
  - - [2048, 128, 1, 128, 2048, 2048, 2048, 128]
    - [67, 1.054]
  - - [2048, 128, 1, 256, 2048, 2048, 2048, 128]
    - [86, 1.823]
  - - [2048, 128, 1, 512, 2048, 2048, 2048, 128]
    - [96, 2.867]
  - - [2048, 128, 1, 1024, 2048, 2048, 2048, 128]
    - [96, 4.124]
  - - [2048, 128, 1, 2048, 2048, 2048, 2048, 128]
    - [83, 4.885]
  - - [2048, 128, 1, 4096, 2048, 2048, 2048, 128]
    - [79, 6.993]
  - - [2048, 128, 1, 8192, 2048, 2048, 2048, 128]
    - [79, 9.56]
  - - [2048, 256, 1, 128, 2048, 2048, 2048, 256]
    - [65, 1.779]
  - - [2048, 256, 1, 256, 2048, 2048, 2048, 256]
    - [65, 2.957]
  - - [2048, 256, 1, 512, 2048, 2048, 2048, 256]
    - [83, 4.464]
  - - [2048, 256, 1, 1024, 2048, 2048, 2048, 256]
    - [95, 5.958]
  - - [2048, 256, 1, 2048, 2048, 2048, 2048, 256]
    - [79, 7.888]
  - - [2048, 256, 1, 4096, 2048, 2048, 2048, 256]
    - [24, 10.265]
  - - [2048, 256, 1, 8192, 2048, 2048, 2048, 256]
    - [24, 12.898]
  - - [2048, 512, 1, 128, 2048, 2048, 2048, 512]
    - [63, 2.672]
  - - [2048, 512, 1, 256, 2048, 2048, 2048, 512]
    - [79, 4.404]
  - - [2048, 512, 1, 512, 2048, 2048, 2048, 512]
    - [80, 6.683]
  - - [2048, 512, 1, 1024, 2048, 2048, 2048, 512]
    - [81, 8.999]
  - - [2048, 512, 1, 2048, 2048, 2048, 2048, 512]
    - [32, 10.767]
  - - [2048, 512, 1, 4096, 2048, 2048, 2048, 512]
    - [24, 12.996]
  - - [2048, 512, 1, 8192, 2048, 2048, 2048, 512]
    - [56, 14.71]
  - - [2048, 1024, 1, 128, 2048, 2048, 2048, 1024]
    - [58, 3.748]
  - - [2048, 1024, 1, 256, 2048, 2048, 2048, 1024]
    - [61, 5.953]
  - - [2048, 1024, 1, 512, 2048, 2048, 2048, 1024]
    - [52, 8.476]
  - - [2048, 1024, 1, 1024, 2048, 2048, 2048, 1024]
    - [19, 10.683]
  - - [2048, 1024, 1, 2048, 2048, 2048, 2048, 1024]
    - [9, 12.47]
  - - [2048, 1024, 1, 4096, 2048, 2048, 2048, 1024]
    - [56, 14.805]
  - - [2048, 1024, 1, 8192, 2048, 2048, 2048, 1024]
    - [50, 16.541]
  - - [2048, 2048, 1, 128, 2048, 2048, 2048, 2048]
    - [45, 4.317]
  - - [2048, 2048, 1, 256, 2048, 2048, 2048, 2048]
    - [45, 6.893]
  - - [2048, 2048, 1, 512, 2048, 2048, 2048, 2048]
    - [45, 9.864]
  - - [2048, 2048, 1, 1024, 2048, 2048, 2048, 2048]
    - [16, 12.463]
  - - [2048, 2048, 1, 2048, 2048, 2048, 2048, 2048]
    - [0, 14.343]
  - - [2048, 2048, 1, 4096, 2048, 2048, 2048, 2048]
    - [43, 16.663]
  - - [2048, 2048, 1, 8192, 2048, 2048, 2048, 2048]
    - [43, 18.562]
  - - [2048, 4096, 1, 128, 2048, 2048, 2048, 4096]
    - [72, 4.463]
  - - [2048, 4096, 1, 256, 2048, 2048, 2048, 4096]
    - [59, 7.097]
  - - [2048, 4096, 1, 512, 2048, 2048, 2048, 4096]
    - [4, 10.401]
  - - [2048, 4096, 1, 1024, 2048, 2048, 2048, 4096]
    - [43, 13.618]
  - - [2048, 4096, 1, 2048, 2048, 2048, 2048, 4096]
    - [43, 15.911]
  - - [2048, 4096, 1, 4096, 2048, 2048, 2048, 4096]
    - [47, 18.015]
  - - [2048, 4096, 1, 8192, 2048, 2048, 2048, 4096]
    - [71, 19.687]
  - - [2048, 8192, 1, 128, 2048, 2048, 2048, 8192]
    - [59, 5.191]
  - - [2048, 8192, 1, 256, 2048, 2048, 2048, 8192]
    - [44, 7.953]
  - - [2048, 8192, 1, 512, 2048, 2048, 2048, 8192]
    - [75, 11.32]
  - - [2048, 8192, 1, 1024, 2048, 2048, 2048, 8192]
    - [70, 14.358]
  - - [2048, 8192, 1, 2048, 2048, 2048, 2048, 8192]
    - [71, 17.139]
  - - [2048, 8192, 1, 4096, 2048, 2048, 2048, 8192]
    - [70, 19.168]
  - - [2048, 8192, 1, 8192, 2048, 2048, 2048, 8192]
    - [70, 20.059]
  - - [4096, 128, 1, 128, 4096, 4096, 4096, 128]
    - [13, 1.724]
  - - [4096, 128, 1, 256, 4096, 4096, 4096, 128]
    - [28, 2.837]
  - - [4096, 128, 1, 512, 4096, 4096, 4096, 128]
    - [94, 4.264]
  - - [4096, 128, 1, 1024, 4096, 4096, 4096, 128]
    - [95, 5.774]
  - - [4096, 128, 1, 2048, 4096, 4096, 4096, 128]
    - [79, 7.676]
  - - [4096, 128, 1, 4096, 4096, 4096, 4096, 128]
    - [24, 10.285]
  - - [4096, 128, 1, 8192, 4096, 4096, 4096, 128]
    - [79, 12.776]
  - - [4096, 256, 1, 128, 4096, 4096, 4096, 256]
    - [63, 2.715]
  - - [4096, 256, 1, 256, 4096, 4096, 4096, 256]
    - [63, 4.402]
  - - [4096, 256, 1, 512, 4096, 4096, 4096, 256]
    - [81, 6.625]
  - - [4096, 256, 1, 1024, 4096, 4096, 4096, 256]
    - [80, 8.963]
  - - [4096, 256, 1, 2048, 4096, 4096, 4096, 256]
    - [93, 10.81]
  - - [4096, 256, 1, 4096, 4096, 4096, 4096, 256]
    - [81, 12.947]
  - - [4096, 256, 1, 8192, 4096, 4096, 4096, 256]
    - [56, 14.619]
  - - [4096, 512, 1, 128, 4096, 4096, 4096, 512]
    - [62, 3.703]
  - - [4096, 512, 1, 256, 4096, 4096, 4096, 512]
    - [58, 5.962]
  - - [4096, 512, 1, 512, 4096, 4096, 4096, 512]
    - [58, 8.512]
  - - [4096, 512, 1, 1024, 4096, 4096, 4096, 512]
    - [23, 10.595]
  - - [4096, 512, 1, 2048, 4096, 4096, 4096, 512]
    - [24, 12.449]
  - - [4096, 512, 1, 4096, 4096, 4096, 4096, 512]
    - [78, 14.889]
  - - [4096, 512, 1, 8192, 4096, 4096, 4096, 512]
    - [51, 16.595]
  - - [4096, 1024, 1, 128, 4096, 4096, 4096, 1024]
    - [0, 4.227]
  - - [4096, 1024, 1, 256, 4096, 4096, 4096, 1024]
    - [0, 6.769]
  - - [4096, 1024, 1, 512, 4096, 4096, 4096, 1024]
    - [0, 9.78]
  - - [4096, 1024, 1, 1024, 4096, 4096, 4096, 1024]
    - [18, 12.391]
  - - [4096, 1024, 1, 2048, 4096, 4096, 4096, 1024]
    - [46, 14.319]
  - - [4096, 1024, 1, 4096, 4096, 4096, 4096, 1024]
    - [1, 16.533]
  - - [4096, 1024, 1, 8192, 4096, 4096, 4096, 1024]
    - [2, 18.411]
  - - [4096, 2048, 1, 128, 4096, 4096, 4096, 2048]
    - [70, 4.384]
  - - [4096, 2048, 1, 256, 4096, 4096, 4096, 2048]
    - [62, 7.087]
  - - [4096, 2048, 1, 512, 4096, 4096, 4096, 2048]
    - [4, 10.302]
  - - [4096, 2048, 1, 1024, 4096, 4096, 4096, 2048]
    - [43, 13.539]
  - - [4096, 2048, 1, 2048, 4096, 4096, 4096, 2048]
    - [51, 15.813]
  - - [4096, 2048, 1, 4096, 4096, 4096, 4096, 2048]
    - [43, 17.985]
  - - [4096, 2048, 1, 8192, 4096, 4096, 4096, 2048]
    - [70, 19.737]
  - - [4096, 4096, 1, 128, 4096, 4096, 4096, 4096]
    - [60, 5.096]
  - - [4096, 4096, 1, 256, 4096, 4096, 4096, 4096]
    - [58, 7.906]
  - - [4096, 4096, 1, 512, 4096, 4096, 4096, 4096]
    - [73, 11.076]
  - - [4096, 4096, 1, 1024, 4096, 4096, 4096, 4096]
    - [70, 14.268]
  - - [4096, 4096, 1, 2048, 4096, 4096, 4096, 4096]
    - [48, 16.889]
  - - [4096, 4096, 1, 4096, 4096, 4096, 4096, 4096]
    - [70, 19.024]
  - - [4096, 4096, 1, 8192, 4096, 4096, 4096, 4096]
    - [70, 20.039]
  - - [4096, 8192, 1, 128, 4096, 4096, 4096, 8192]
    - [8, 5.251]
  - - [4096, 8192, 1, 256, 4096, 4096, 4096, 8192]
    - [23, 7.847]
  - - [4096, 8192, 1, 512, 4096, 4096, 4096, 8192]
    - [76, 11.079]
  - - [4096, 8192, 1, 1024, 4096, 4096, 4096, 8192]
    - [75, 14.33]
  - - [4096, 8192, 1, 2048, 4096, 4096, 4096, 8192]
    - [16, 17.274]
  - - [4096, 8192, 1, 4096, 4096, 4096, 4096, 8192]
    - [70, 19.242]
  - - [4096, 8192, 1, 8192, 4096, 4096, 4096, 8192]
    - [70, 20.447]
  - - [8192, 128, 1, 128, 8192, 8192, 8192, 128]
    - [63, 2.634]
  - - [8192, 128, 1, 256, 8192, 8192, 8192, 128]
    - [79, 4.339]
  - - [8192, 128, 1, 512, 8192, 8192, 8192, 128]
    - [79, 6.614]
  - - [8192, 128, 1, 1024, 8192, 8192, 8192, 128]
    - [79, 8.919]
  - - [8192, 128, 1, 2048, 8192, 8192, 8192, 128]
    - [32, 10.638]
  - - [8192, 128, 1, 4096, 8192, 8192, 8192, 128]
    - [24, 13.029]
  - - [8192, 128, 1, 8192, 8192, 8192, 8192, 128]
    - [11, 14.33]
  - - [8192, 256, 1, 128, 8192, 8192, 8192, 256]
    - [57, 3.679]
  - - [8192, 256, 1, 256, 8192, 8192, 8192, 256]
    - [58, 5.864]
  - - [8192, 256, 1, 512, 8192, 8192, 8192, 256]
    - [58, 8.463]
  - - [8192, 256, 1, 1024, 8192, 8192, 8192, 256]
    - [22, 10.488]
  - - [8192, 256, 1, 2048, 8192, 8192, 8192, 256]
    - [6, 12.529]
  - - [8192, 256, 1, 4096, 8192, 8192, 8192, 256]
    - [7, 14.69]
  - - [8192, 256, 1, 8192, 8192, 8192, 8192, 256]
    - [43, 16.469]
  - - [8192, 512, 1, 128, 8192, 8192, 8192, 512]
    - [45, 4.199]
  - - [8192, 512, 1, 256, 8192, 8192, 8192, 512]
    - [45, 6.754]
  - - [8192, 512, 1, 512, 8192, 8192, 8192, 512]
    - [45, 9.706]
  - - [8192, 512, 1, 1024, 8192, 8192, 8192, 512]
    - [75, 12.387]
  - - [8192, 512, 1, 2048, 8192, 8192, 8192, 512]
    - [4, 14.37]
  - - [8192, 512, 1, 4096, 8192, 8192, 8192, 512]
    - [45, 16.559]
  - - [8192, 512, 1, 8192, 8192, 8192, 8192, 512]
    - [5, 18.432]
  - - [8192, 1024, 1, 128, 8192, 8192, 8192, 1024]
    - [70, 4.384]
  - - [8192, 1024, 1, 256, 8192, 8192, 8192, 1024]
    - [59, 7.056]
  - - [8192, 1024, 1, 512, 8192, 8192, 8192, 1024]
    - [0, 10.394]
  - - [8192, 1024, 1, 1024, 8192, 8192, 8192, 1024]
    - [49, 13.622]
  - - [8192, 1024, 1, 2048, 8192, 8192, 8192, 1024]
    - [2, 15.975]
  - - [8192, 1024, 1, 4096, 8192, 8192, 8192, 1024]
    - [3, 18.069]
  - - [8192, 1024, 1, 8192, 8192, 8192, 8192, 1024]
    - [70, 19.618]
  - - [8192, 2048, 1, 128, 8192, 8192, 8192, 2048]
    - [58, 5.131]
  - - [8192, 2048, 1, 256, 8192, 8192, 8192, 2048]
    - [44, 7.956]
  - - [8192, 2048, 1, 512, 8192, 8192, 8192, 2048]
    - [76, 11.163]
  - - [8192, 2048, 1, 1024, 8192, 8192, 8192, 2048]
    - [73, 14.294]
  - - [8192, 2048, 1, 2048, 8192, 8192, 8192, 2048]
    - [51, 16.979]
  - - [8192, 2048, 1, 4096, 8192, 8192, 8192, 2048]
    - [73, 19.049]
  - - [8192, 2048, 1, 8192, 8192, 8192, 8192, 2048]
    - [16, 19.946]
  - - [8192, 4096, 1, 128, 8192, 8192, 8192, 4096]
    - [54, 5.14]
  - - [8192, 4096, 1, 256, 8192, 8192, 8192, 4096]
    - [3, 7.732]
  - - [8192, 4096, 1, 512, 8192, 8192, 8192, 4096]
    - [73, 11.089]
  - - [8192, 4096, 1, 1024, 8192, 8192, 8192, 4096]
    - [0, 14.342]
  - - [8192, 4096, 1, 2048, 8192, 8192, 8192, 4096]
    - [74, 17.317]
  - - [8192, 4096, 1, 4096, 8192, 8192, 8192, 4096]
    - [70, 19.26]
  - - [8192, 4096, 1, 8192, 8192, 8192, 8192, 4096]
    - [70, 20.435]
  - - [8192, 8192, 1, 128, 8192, 8192, 8192, 8192]
    - [43, 4.98]
  - - [8192, 8192, 1, 256, 8192, 8192, 8192, 8192]
    - [16, 7.931]
  - - [8192, 8192, 1, 512, 8192, 8192, 8192, 8192]
    - [46, 11.636]
  - - [8192, 8192, 1, 1024, 8192, 8192, 8192, 8192]
    - [50, 15.197]
  - - [8192, 8192, 1, 2048, 8192, 8192, 8192, 8192]
    - [16, 17.898]
  - - [8192, 8192, 1, 4096, 8192, 8192, 8192, 8192]
    - [75, 19.623]
  - - [8192, 8192, 1, 8192, 8192, 8192, 8192, 8192]
    - [75, 20.705]
  - - [1, 1, 1, 32, 1, 1, 1, 1]
    - [100, 0.0]
- null
- null
- ExperimentalStreamK
- GridBased
