library/src/amd_detail/rocblaslt/src/Tensile/Logic/asm_full/aquavanjaram/gfx942_80cu/StreamK/aquavanjaram942_Cijk_Alik_Bljk_HHS_BH_UserArgs.yaml
- {MinimumRequiredVersion: 4.33.0}
- aquavanjaram942
- {Architecture: gfx942, CUCount: 80}
- [Device 0049, Device 0050]
    SolutionIndex: 0
    SolutionNameMin: Cijk_Alik_Bljk_HHS_BH_UserArgs_MT256x64x64_MI16x16x1_SN_LDSB1_CLR1_GSU0_GSUC0_GSUWGMRR0_K1_LBSPPA1024_LBSPPB256_MIWT8_2_PLR1_SU32_SUM0_SUS256_SKXCCM0_VWA8_VWB2_WGM1_WGMXCC1_WGMXCCGn1
    SolutionIndex: 1
    SolutionNameMin: Cijk_Alik_Bljk_HHS_BH_UserArgs_MT128x128x64_MI16x16x1_SN_LDSB1_CLR1_GSU0_GSUC0_GSUWGMRR0_K1_LBSPPA256_LBSPPB128_MIWT4_4_PLR1_SU32_SUM0_SUS256_SKXCCM0_VWA2_VWB1_WGM1_WGMXCC1_WGMXCCGn1
    SolutionIndex: 2
    SolutionNameMin: Cijk_Alik_Bljk_HHS_BH_UserArgs_MT128x128x64_MI16x16x1_SN_LDSB1_CLR1_GSU0_GSUC0_GSUWGMRR0_K1_LBSPPA512_LBSPPB128_MIWT4_4_PLR1_SU32_SUM0_SUS256_SKXCCM0_VWA4_VWB1_WGM1_WGMXCC1_WGMXCCGn1
    SolutionIndex: 3
    SolutionNameMin: Cijk_Alik_Bljk_HHS_BH_UserArgs_MT128x128x64_MI16x16x1_SN_LDSB1_CLR1_GSU0_GSUC0_GSUWGMRR0_K1_LBSPPA512_LBSPPB256_MIWT4_4_PLR1_SU32_SUM0_SUS256_SKXCCM0_VWA4_VWB2_WGM1_WGMXCC1_WGMXCCGn1
    SolutionIndex: 4
    SolutionNameMin: Cijk_Alik_Bljk_HHS_BH_UserArgs_MT128x128x64_MI16x16x1_SN_LDSB1_CLR1_GSU0_GSUC0_GSUWGMRR0_K1_LBSPPA512_LBSPPB512_MIWT4_4_PLR1_SU32_SUM0_SUS256_SKXCCM0_VWA4_VWB4_WGM1_WGMXCC1_WGMXCCGn1
    SolutionIndex: 5
    SolutionNameMin: Cijk_Alik_Bljk_HHS_BH_UserArgs_MT128x128x64_MI16x16x1_SN_LDSB1_CLR1_GSU0_GSUC0_GSUWGMRR0_K1_LBSPPA512_LBSPPB128_MIWT4_4_PLR1_SU32_SUM0_SUS256_SKXCCM0_VWA4_VWB1_WGM2_WGMXCC1_WGMXCCGn1
    SolutionIndex: 6
    SolutionNameMin: Cijk_Alik_Bljk_HHS_BH_UserArgs_MT128x128x64_MI16x16x1_SN_LDSB1_CLR1_GSU0_GSUC0_GSUWGMRR0_K1_LBSPPA512_LBSPPB256_MIWT4_4_PLR1_SU32_SUM0_SUS256_SKXCCM0_VWA4_VWB2_WGM2_WGMXCC1_WGMXCCGn1
    SolutionIndex: 7
    SolutionNameMin: Cijk_Alik_Bljk_HHS_BH_UserArgs_MT128x128x64_MI16x16x1_SN_LDSB1_CLR1_GSU0_GSUC0_GSUWGMRR0_K1_LBSPPA512_LBSPPB512_MIWT4_4_PLR1_SU32_SUM0_SUS256_SKXCCM0_VWA4_VWB4_WGM2_WGMXCC1_WGMXCCGn1
    SolutionIndex: 8
    SolutionNameMin: Cijk_Alik_Bljk_HHS_BH_UserArgs_MT128x128x64_MI16x16x1_SN_LDSB1_CLR1_GSU0_GSUC0_GSUWGMRR0_K1_LBSPPA512_LBSPPB256_MIWT4_4_PLR1_SU32_SUM0_SUS256_SKXCCM0_VWA4_VWB2_WGM4_WGMXCC1_WGMXCCGn1
    SolutionIndex: 9
    SolutionNameMin: Cijk_Alik_Bljk_HHS_BH_UserArgs_MT128x128x64_MI16x16x1_SN_LDSB1_CLR1_GSU0_GSUC0_GSUWGMRR0_K1_LBSPPA512_LBSPPB512_MIWT4_4_PLR1_SU32_SUM0_SUS256_SKXCCM0_VWA4_VWB4_WGM4_WGMXCC1_WGMXCCGn1
    SolutionIndex: 10
    SolutionNameMin: Cijk_Alik_Bljk_HHS_BH_UserArgs_MT64x64x64_MI16x16x1_SN_LDSB1_CLR1_GSU0_GSUC0_GSUWGMRR0_K1_LBSPPA256_LBSPPB128_MIWT2_2_PLR1_SU32_SUM0_SUS256_SKXCCM0_VWA2_VWB1_WGM1_WGMXCC1_WGMXCCGn1
    SolutionIndex: 11
    SolutionNameMin: Cijk_Alik_Bljk_HHS_BH_UserArgs_MT64x64x64_MI16x16x1_SN_LDSB1_CLR1_GSU0_GSUC0_GSUWGMRR0_K1_LBSPPA256_LBSPPB256_MIWT2_2_PLR1_SU32_SUM0_SUS256_SKXCCM0_VWA2_VWB2_WGM1_WGMXCC1_WGMXCCGn1
    SolutionIndex: 12
    SolutionNameMin: Cijk_Alik_Bljk_HHS_BH_UserArgs_MT32x64x64_MI16x16x1_SN_LDSB0_CLR1_GSU0_GSUC0_GSUWGMRR0_K1_LBSPPA128_LBSPPB128_MIWT1_2_PLR1_SU32_SUM0_SUS256_SKXCCM0_VWA1_VWB1_WGM1_WGMXCC1_WGMXCCGn1
    SolutionIndex: 13
    SolutionNameMin: Cijk_Alik_Bljk_HHS_BH_UserArgs_MT32x64x64_MI16x16x1_SN_LDSB0_CLR1_GSU0_GSUC0_GSUWGMRR0_K1_LBSPPA128_LBSPPB256_MIWT1_2_PLR1_SU32_SUM0_SUS256_SKXCCM0_VWA1_VWB2_WGM1_WGMXCC1_WGMXCCGn1
    SolutionIndex: 14
    SolutionNameMin: Cijk_Alik_Bljk_HHS_BH_UserArgs_MT64x32x64_MI16x16x1_SN_LDSB0_CLR1_GSU0_GSUC0_GSUWGMRR0_K1_LBSPPA256_LBSPPB128_MIWT2_1_PLR1_SU32_SUM0_SUS256_SKXCCM0_VWA2_VWB1_WGM1_WGMXCC1_WGMXCCGn1
    SolutionIndex: 15
    SolutionNameMin: Cijk_Alik_Bljk_HHS_BH_UserArgs_MT32x32x64_MI16x16x1_SN_LDSB0_CLR1_GSU0_GSUC0_GSUWGMRR0_K1_LBSPPA128_LBSPPB128_MIWT1_1_PLR1_SU32_SUM0_SUS256_SKXCCM0_VWA1_VWB1_WGM1_WGMXCC1_WGMXCCGn1
    SolutionIndex: 16
    SolutionNameMin: Cijk_Alik_Bljk_HHS_BH_UserArgs_MT32x32x64_MI16x16x1_SN_LDSB0_CLR1_GSU0_GSUC0_GSUWGMRR0_K1_LBSPPA128_LBSPPB128_MIWT1_1_PLR2_SU32_SUM0_SUS256_SKXCCM0_VWA1_VWB1_WGM1_WGMXCC1_WGMXCCGn1
    SolutionIndex: 17
    SolutionNameMin: Cijk_Alik_Bljk_HHS_BH_UserArgs_MT64x64x128_MI16x16x1_SN_LDSB1_CLR1_GSU0_GSUC0_GSUWGMRR0_K1_LBSPPA512_LBSPPB256_MIWT2_2_PLR1_SU32_SUM0_SUS256_SKXCCM0_VWA2_VWB1_WGM1_WGMXCC1_WGMXCCGn1
    SolutionIndex: 18
    SolutionNameMin: Cijk_Alik_Bljk_HHS_BH_UserArgs_MT64x64x128_MI16x16x1_SN_LDSB1_CLR1_GSU0_GSUC0_GSUWGMRR0_K1_LBSPPA512_LBSPPB512_MIWT2_2_PLR1_SU32_SUM0_SUS256_SKXCCM0_VWA2_VWB2_WGM1_WGMXCC1_WGMXCCGn1
    SolutionIndex: 19
    SolutionNameMin: Cijk_Alik_Bljk_HHS_BH_UserArgs_MT64x64x128_MI16x16x1_SN_LDSB1_CLR1_GSU0_GSUC0_GSUWGMRR0_K1_LBSPPA512_LBSPPB256_MIWT2_2_PLR2_SU32_SUM0_SUS256_SKXCCM0_VWA2_VWB1_WGM1_WGMXCC1_WGMXCCGn1
    SolutionIndex: 20
    SolutionNameMin: Cijk_Alik_Bljk_HHS_BH_UserArgs_MT64x64x128_MI16x16x1_SN_LDSB1_CLR1_GSU0_GSUC0_GSUWGMRR0_K1_LBSPPA512_LBSPPB256_MIWT2_2_PLR2_SU32_SUM0_SUS256_SKXCCM0_VWA2_VWB1_WGM4_WGMXCC1_WGMXCCGn1
    SolutionIndex: 21
    SolutionNameMin: Cijk_Alik_Bljk_HHS_BH_UserArgs_MT64x32x128_MI16x16x1_SN_LDSB1_CLR1_GSU0_GSUC0_GSUWGMRR0_K1_LBSPPA256_LBSPPB256_MIWT2_1_PLR2_SU32_SUM0_SUS256_SKXCCM0_VWA1_VWB1_WGM1_WGMXCC1_WGMXCCGn1
    SolutionIndex: 22
    SolutionNameMin: Cijk_Alik_Bljk_HHS_BH_UserArgs_MT64x32x128_MI16x16x1_SN_LDSB1_CLR1_GSU0_GSUC0_GSUWGMRR0_K1_LBSPPA512_LBSPPB256_MIWT2_1_PLR2_SU32_SUM0_SUS256_SKXCCM0_VWA2_VWB1_WGM1_WGMXCC1_WGMXCCGn1
    SolutionIndex: 23
    SolutionNameMin: Cijk_Alik_Bljk_HHS_BH_UserArgs_MT32x32x128_MI16x16x1_SN_LDSB1_CLR1_GSU0_GSUC0_GSUWGMRR0_K1_LBSPPA256_LBSPPB256_MIWT1_1_PLR1_SU32_SUM0_SUS256_SKXCCM0_VWA1_VWB1_WGM1_WGMXCC1_WGMXCCGn1
    SolutionIndex: 24
    SolutionNameMin: Cijk_Alik_Bljk_HHS_BH_UserArgs_MT32x32x128_MI16x16x1_SN_LDSB1_CLR1_GSU0_GSUC0_GSUWGMRR0_K1_LBSPPA256_LBSPPB256_MIWT1_1_PLR2_SU32_SUM0_SUS256_SKXCCM0_VWA1_VWB1_WGM1_WGMXCC1_WGMXCCGn1
    SolutionIndex: 25
    SolutionNameMin: Cijk_Alik_Bljk_HHS_BH_UserArgs_MT256x64x64_MI16x16x1_SN_LDSB1_CLR1_GSU0_GSUC0_GSUWGMRR0_K1_LBSPPA1024_LBSPPB128_MIWT8_2_PLR1_SU32_SUM0_SUS256_SKXCCM4_VWA8_VWB1_WGM1_WGMXCC1_WGMXCCGn1
    SolutionIndex: 26
    SolutionNameMin: Cijk_Alik_Bljk_HHS_BH_UserArgs_MT128x128x64_MI16x16x1_SN_LDSB1_CLR1_GSU0_GSUC0_GSUWGMRR0_K1_LBSPPA256_LBSPPB128_MIWT4_4_PLR1_SU32_SUM0_SUS256_SKXCCM4_VWA2_VWB1_WGM1_WGMXCC1_WGMXCCGn1
    SolutionIndex: 27
    SolutionNameMin: Cijk_Alik_Bljk_HHS_BH_UserArgs_MT128x128x64_MI16x16x1_SN_LDSB1_CLR1_GSU0_GSUC0_GSUWGMRR0_K1_LBSPPA512_LBSPPB128_MIWT4_4_PLR1_SU32_SUM0_SUS256_SKXCCM4_VWA4_VWB1_WGM1_WGMXCC1_WGMXCCGn1
    SolutionIndex: 28
    SolutionNameMin: Cijk_Alik_Bljk_HHS_BH_UserArgs_MT128x128x64_MI16x16x1_SN_LDSB1_CLR1_GSU0_GSUC0_GSUWGMRR0_K1_LBSPPA256_LBSPPB256_MIWT4_4_PLR1_SU32_SUM0_SUS256_SKXCCM4_VWA2_VWB2_WGM1_WGMXCC1_WGMXCCGn1
    SolutionIndex: 29
    SolutionNameMin: Cijk_Alik_Bljk_HHS_BH_UserArgs_MT128x128x64_MI16x16x1_SN_LDSB1_CLR1_GSU0_GSUC0_GSUWGMRR0_K1_LBSPPA512_LBSPPB256_MIWT4_4_PLR1_SU32_SUM0_SUS256_SKXCCM4_VWA4_VWB2_WGM1_WGMXCC1_WGMXCCGn1
    SolutionIndex: 30
    SolutionNameMin: Cijk_Alik_Bljk_HHS_BH_UserArgs_MT128x128x64_MI16x16x1_SN_LDSB1_CLR1_GSU0_GSUC0_GSUWGMRR0_K1_LBSPPA256_LBSPPB512_MIWT4_4_PLR1_SU32_SUM0_SUS256_SKXCCM4_VWA2_VWB4_WGM1_WGMXCC1_WGMXCCGn1
    SolutionIndex: 31
    SolutionNameMin: Cijk_Alik_Bljk_HHS_BH_UserArgs_MT128x128x64_MI16x16x1_SN_LDSB1_CLR1_GSU0_GSUC0_GSUWGMRR0_K1_LBSPPA512_LBSPPB512_MIWT4_4_PLR1_SU32_SUM0_SUS256_SKXCCM4_VWA4_VWB4_WGM1_WGMXCC1_WGMXCCGn1
    SolutionIndex: 32
    SolutionNameMin: Cijk_Alik_Bljk_HHS_BH_UserArgs_MT128x128x64_MI16x16x1_SN_LDSB1_CLR1_GSU0_GSUC0_GSUWGMRR0_K1_LBSPPA256_LBSPPB128_MIWT4_4_PLR1_SU32_SUM0_SUS256_SKXCCM4_VWA2_VWB1_WGM2_WGMXCC1_WGMXCCGn1
    SolutionIndex: 33
    SolutionNameMin: Cijk_Alik_Bljk_HHS_BH_UserArgs_MT128x128x64_MI16x16x1_SN_LDSB1_CLR1_GSU0_GSUC0_GSUWGMRR0_K1_LBSPPA512_LBSPPB128_MIWT4_4_PLR1_SU32_SUM0_SUS256_SKXCCM4_VWA4_VWB1_WGM2_WGMXCC1_WGMXCCGn1
    SolutionIndex: 34
    SolutionNameMin: Cijk_Alik_Bljk_HHS_BH_UserArgs_MT128x128x64_MI16x16x1_SN_LDSB1_CLR1_GSU0_GSUC0_GSUWGMRR0_K1_LBSPPA256_LBSPPB256_MIWT4_4_PLR1_SU32_SUM0_SUS256_SKXCCM4_VWA2_VWB2_WGM2_WGMXCC1_WGMXCCGn1
    SolutionIndex: 35
    SolutionNameMin: Cijk_Alik_Bljk_HHS_BH_UserArgs_MT128x128x64_MI16x16x1_SN_LDSB1_CLR1_GSU0_GSUC0_GSUWGMRR0_K1_LBSPPA512_LBSPPB256_MIWT4_4_PLR1_SU32_SUM0_SUS256_SKXCCM4_VWA4_VWB2_WGM2_WGMXCC1_WGMXCCGn1
    SolutionIndex: 36
    SolutionNameMin: Cijk_Alik_Bljk_HHS_BH_UserArgs_MT128x128x64_MI16x16x1_SN_LDSB1_CLR1_GSU0_GSUC0_GSUWGMRR0_K1_LBSPPA512_LBSPPB512_MIWT4_4_PLR1_SU32_SUM0_SUS256_SKXCCM4_VWA4_VWB4_WGM2_WGMXCC1_WGMXCCGn1
    SolutionIndex: 37
    SolutionNameMin: Cijk_Alik_Bljk_HHS_BH_UserArgs_MT128x128x64_MI16x16x1_SN_LDSB1_CLR1_GSU0_GSUC0_GSUWGMRR0_K1_LBSPPA256_LBSPPB128_MIWT4_4_PLR1_SU32_SUM0_SUS256_SKXCCM4_VWA2_VWB1_WGM4_WGMXCC1_WGMXCCGn1
    SolutionIndex: 38
    SolutionNameMin: Cijk_Alik_Bljk_HHS_BH_UserArgs_MT128x128x64_MI16x16x1_SN_LDSB1_CLR1_GSU0_GSUC0_GSUWGMRR0_K1_LBSPPA512_LBSPPB128_MIWT4_4_PLR1_SU32_SUM0_SUS256_SKXCCM4_VWA4_VWB1_WGM4_WGMXCC1_WGMXCCGn1
    SolutionIndex: 39
    SolutionNameMin: Cijk_Alik_Bljk_HHS_BH_UserArgs_MT128x128x64_MI16x16x1_SN_LDSB1_CLR1_GSU0_GSUC0_GSUWGMRR0_K1_LBSPPA128_LBSPPB256_MIWT4_4_PLR1_SU32_SUM0_SUS256_SKXCCM4_VWA1_VWB2_WGM4_WGMXCC1_WGMXCCGn1
    SolutionIndex: 40
    SolutionNameMin: Cijk_Alik_Bljk_HHS_BH_UserArgs_MT128x128x64_MI16x16x1_SN_LDSB1_CLR1_GSU0_GSUC0_GSUWGMRR0_K1_LBSPPA512_LBSPPB256_MIWT4_4_PLR1_SU32_SUM0_SUS256_SKXCCM4_VWA4_VWB2_WGM4_WGMXCC1_WGMXCCGn1
    SolutionIndex: 41
    SolutionNameMin: Cijk_Alik_Bljk_HHS_BH_UserArgs_MT128x128x64_MI16x16x1_SN_LDSB1_CLR1_GSU0_GSUC0_GSUWGMRR0_K1_LBSPPA256_LBSPPB512_MIWT4_4_PLR1_SU32_SUM0_SUS256_SKXCCM4_VWA2_VWB4_WGM4_WGMXCC1_WGMXCCGn1
    SolutionIndex: 42
    SolutionNameMin: Cijk_Alik_Bljk_HHS_BH_UserArgs_MT128x128x64_MI16x16x1_SN_LDSB1_CLR1_GSU0_GSUC0_GSUWGMRR0_K1_LBSPPA512_LBSPPB512_MIWT4_4_PLR1_SU32_SUM0_SUS256_SKXCCM4_VWA4_VWB4_WGM4_WGMXCC1_WGMXCCGn1
    SolutionIndex: 43
    SolutionNameMin: Cijk_Alik_Bljk_HHS_BH_UserArgs_MT64x128x64_MI16x16x1_SN_LDSB1_CLR1_GSU0_GSUC0_GSUWGMRR0_K1_LBSPPA256_LBSPPB128_MIWT2_4_PLR1_SU32_SUM0_SUS256_SKXCCM4_VWA2_VWB1_WGM1_WGMXCC1_WGMXCCGn1
    SolutionIndex: 44
    SolutionNameMin: Cijk_Alik_Bljk_HHS_BH_UserArgs_MT64x128x64_MI16x16x1_SN_LDSB1_CLR1_GSU0_GSUC0_GSUWGMRR0_K1_LBSPPA256_LBSPPB512_MIWT2_4_PLR1_SU32_SUM0_SUS256_SKXCCM4_VWA2_VWB4_WGM1_WGMXCC1_WGMXCCGn1
    SolutionIndex: 45
    SolutionNameMin: Cijk_Alik_Bljk_HHS_BH_UserArgs_MT128x64x64_MI16x16x1_SN_LDSB1_CLR1_GSU0_GSUC0_GSUWGMRR0_K1_LBSPPA256_LBSPPB128_MIWT4_2_PLR1_SU32_SUM0_SUS256_SKXCCM4_VWA2_VWB1_WGM1_WGMXCC1_WGMXCCGn1
    SolutionIndex: 46
    SolutionNameMin: Cijk_Alik_Bljk_HHS_BH_UserArgs_MT128x64x64_MI16x16x1_SN_LDSB1_CLR1_GSU0_GSUC0_GSUWGMRR0_K1_LBSPPA512_LBSPPB128_MIWT4_2_PLR1_SU32_SUM0_SUS256_SKXCCM4_VWA4_VWB1_WGM1_WGMXCC1_WGMXCCGn1
    SolutionIndex: 47
    SolutionNameMin: Cijk_Alik_Bljk_HHS_BH_UserArgs_MT128x64x64_MI16x16x1_SN_LDSB1_CLR1_GSU0_GSUC0_GSUWGMRR0_K1_LBSPPA256_LBSPPB256_MIWT4_2_PLR1_SU32_SUM0_SUS256_SKXCCM4_VWA2_VWB2_WGM1_WGMXCC1_WGMXCCGn1
    SolutionIndex: 48
    SolutionNameMin: Cijk_Alik_Bljk_HHS_BH_UserArgs_MT128x64x64_MI16x16x1_SN_LDSB1_CLR1_GSU0_GSUC0_GSUWGMRR0_K1_LBSPPA512_LBSPPB256_MIWT4_2_PLR1_SU32_SUM0_SUS256_SKXCCM4_VWA4_VWB2_WGM1_WGMXCC1_WGMXCCGn1
    SolutionIndex: 49
    SolutionNameMin: Cijk_Alik_Bljk_HHS_BH_UserArgs_MT128x64x64_MI16x16x1_SN_LDSB1_CLR1_GSU0_GSUC0_GSUWGMRR0_K1_LBSPPA512_LBSPPB256_MIWT4_2_PLR1_SU32_SUM0_SUS256_SKXCCM4_VWA4_VWB2_WGM4_WGMXCC1_WGMXCCGn1
    SolutionIndex: 50
    SolutionNameMin: Cijk_Alik_Bljk_HHS_BH_UserArgs_MT32x64x64_MI16x16x1_SN_LDSB0_CLR1_GSU0_GSUC0_GSUWGMRR0_K1_LBSPPA128_LBSPPB256_MIWT1_2_PLR1_SU32_SUM0_SUS256_SKXCCM4_VWA1_VWB2_WGM1_WGMXCC1_WGMXCCGn1
    SolutionIndex: 51
    SolutionNameMin: Cijk_Alik_Bljk_HHS_BH_UserArgs_MT32x32x64_MI16x16x1_SN_LDSB0_CLR1_GSU0_GSUC0_GSUWGMRR0_K1_LBSPPA128_LBSPPB128_MIWT1_1_PLR1_SU32_SUM0_SUS256_SKXCCM4_VWA1_VWB1_WGM1_WGMXCC1_WGMXCCGn1
    SolutionIndex: 52
    SolutionNameMin: Cijk_Alik_Bljk_HHS_BH_UserArgs_MT32x32x64_MI16x16x1_SN_LDSB0_CLR1_GSU0_GSUC0_GSUWGMRR0_K1_LBSPPA128_LBSPPB128_MIWT1_1_PLR2_SU32_SUM0_SUS256_SKXCCM4_VWA1_VWB1_WGM1_WGMXCC1_WGMXCCGn1
    SolutionIndex: 53
    SolutionNameMin: Cijk_Alik_Bljk_HHS_BH_UserArgs_MT64x64x128_MI16x16x1_SN_LDSB1_CLR1_GSU0_GSUC0_GSUWGMRR0_K1_LBSPPA512_LBSPPB256_MIWT2_2_PLR1_SU32_SUM0_SUS256_SKXCCM4_VWA2_VWB1_WGM1_WGMXCC1_WGMXCCGn1
    SolutionIndex: 54
    SolutionNameMin: Cijk_Alik_Bljk_HHS_BH_UserArgs_MT64x64x128_MI16x16x1_SN_LDSB1_CLR1_GSU0_GSUC0_GSUWGMRR0_K1_LBSPPA256_LBSPPB512_MIWT2_2_PLR1_SU32_SUM0_SUS256_SKXCCM4_VWA1_VWB2_WGM1_WGMXCC1_WGMXCCGn1
    SolutionIndex: 55
    SolutionNameMin: Cijk_Alik_Bljk_HHS_BH_UserArgs_MT64x64x128_MI16x16x1_SN_LDSB1_CLR1_GSU0_GSUC0_GSUWGMRR0_K1_LBSPPA512_LBSPPB512_MIWT2_2_PLR1_SU32_SUM0_SUS256_SKXCCM4_VWA2_VWB2_WGM1_WGMXCC1_WGMXCCGn1
    SolutionIndex: 56
    SolutionNameMin: Cijk_Alik_Bljk_HHS_BH_UserArgs_MT64x64x128_MI16x16x1_SN_LDSB1_CLR1_GSU0_GSUC0_GSUWGMRR0_K1_LBSPPA256_LBSPPB512_MIWT2_2_PLR2_SU32_SUM0_SUS256_SKXCCM4_VWA1_VWB2_WGM1_WGMXCC1_WGMXCCGn1
    SolutionIndex: 57
    SolutionNameMin: Cijk_Alik_Bljk_HHS_BH_UserArgs_MT64x64x128_MI16x16x1_SN_LDSB1_CLR1_GSU0_GSUC0_GSUWGMRR0_K1_LBSPPA512_LBSPPB512_MIWT2_2_PLR2_SU32_SUM0_SUS256_SKXCCM4_VWA2_VWB2_WGM1_WGMXCC1_WGMXCCGn1
    SolutionIndex: 58
    SolutionNameMin: Cijk_Alik_Bljk_HHS_BH_UserArgs_MT64x64x128_MI16x16x1_SN_LDSB1_CLR1_GSU0_GSUC0_GSUWGMRR0_K1_LBSPPA512_LBSPPB512_MIWT2_2_PLR1_SU32_SUM0_SUS256_SKXCCM4_VWA2_VWB2_WGM4_WGMXCC1_WGMXCCGn1
    SolutionIndex: 59
    SolutionNameMin: Cijk_Alik_Bljk_HHS_BH_UserArgs_MT32x64x128_MI16x16x1_SN_LDSB1_CLR1_GSU0_GSUC0_GSUWGMRR0_K1_LBSPPA256_LBSPPB256_MIWT1_2_PLR1_SU32_SUM0_SUS256_SKXCCM4_VWA1_VWB1_WGM1_WGMXCC1_WGMXCCGn1
    SolutionIndex: 60
    SolutionNameMin: Cijk_Alik_Bljk_HHS_BH_UserArgs_MT32x64x128_MI16x16x1_SN_LDSB1_CLR1_GSU0_GSUC0_GSUWGMRR0_K1_LBSPPA256_LBSPPB256_MIWT1_2_PLR2_SU32_SUM0_SUS256_SKXCCM4_VWA1_VWB1_WGM1_WGMXCC1_WGMXCCGn1
    SolutionIndex: 61
    SolutionNameMin: Cijk_Alik_Bljk_HHS_BH_UserArgs_MT64x32x128_MI16x16x1_SN_LDSB1_CLR1_GSU0_GSUC0_GSUWGMRR0_K1_LBSPPA512_LBSPPB256_MIWT2_1_PLR2_SU32_SUM0_SUS256_SKXCCM4_VWA2_VWB1_WGM1_WGMXCC1_WGMXCCGn1
    SolutionIndex: 62
    SolutionNameMin: Cijk_Alik_Bljk_HHS_BH_UserArgs_MT32x32x128_MI16x16x1_SN_LDSB1_CLR1_GSU0_GSUC0_GSUWGMRR0_K1_LBSPPA256_LBSPPB256_MIWT1_1_PLR2_SU32_SUM0_SUS256_SKXCCM4_VWA1_VWB1_WGM1_WGMXCC1_WGMXCCGn1
    SolutionIndex: 63
    SolutionNameMin: Cijk_Alik_Bljk_HHS_BH_UserArgs_MT32x32x32_MI16x16x1_SN_LDSB0_CLR0_GSU0_GSUC0_GSUWGMRR0_K1_LBSPPA128_LBSPPB128_MIWT1_1_PLR0_SU32_SUM0_SUS256_SKXCCM0_VWA1_VWB1_WGM2_WGMXCC1_WGMXCCGn1
- - - [128, 128, 1, 128, 128, 128, 128, 128]
    - [52, 0.097]
  - - [128, 128, 1, 256, 128, 128, 256, 256]
    - [51, 0.18]
  - - [128, 128, 1, 512, 128, 128, 512, 512]
    - [23, 0.31]
  - - [128, 128, 1, 1024, 128, 128, 1024, 1024]
    - [23, 0.488]
  - - [128, 128, 1, 2048, 128, 128, 2048, 2048]
    - [24, 0.702]
  - - [128, 128, 1, 4096, 128, 128, 4096, 4096]
    - [15, 1.193]
  - - [128, 128, 1, 8192, 128, 128, 8192, 8192]
    - [23, 1.919]
  - - [128, 256, 1, 128, 128, 128, 128, 128]
    - [23, 0.191]
  - - [128, 256, 1, 256, 128, 128, 256, 256]
    - [51, 0.352]
  - - [128, 256, 1, 512, 128, 128, 512, 512]
    - [62, 0.612]
  - - [128, 256, 1, 1024, 128, 128, 1024, 1024]
    - [24, 0.968]
  - - [128, 256, 1, 2048, 128, 128, 2048, 2048]
    - [24, 1.377]
  - - [128, 256, 1, 4096, 128, 128, 4096, 4096]
    - [23, 2.112]
  - - [128, 256, 1, 8192, 128, 128, 8192, 8192]
    - [59, 3.074]
  - - [128, 512, 1, 128, 128, 128, 128, 128]
    - [15, 0.377]
  - - [128, 512, 1, 256, 128, 128, 256, 256]
    - [23, 0.693]
  - - [128, 512, 1, 512, 128, 128, 512, 512]
    - [51, 1.196]
  - - [128, 512, 1, 1024, 128, 128, 1024, 1024]
    - [24, 1.916]
  - - [128, 512, 1, 2048, 128, 128, 2048, 2048]
    - [23, 2.693]
  - - [128, 512, 1, 4096, 128, 128, 4096, 4096]
    - [22, 3.368]
  - - [128, 512, 1, 8192, 128, 128, 8192, 8192]
    - [54, 4.927]
  - - [128, 1024, 1, 128, 128, 128, 128, 128]
    - [14, 0.71]
  - - [128, 1024, 1, 256, 128, 128, 256, 256]
    - [12, 1.277]
  - - [128, 1024, 1, 512, 128, 128, 512, 512]
    - [13, 2.119]
  - - [128, 1024, 1, 1024, 128, 128, 1024, 1024]
    - [22, 3.178]
  - - [128, 1024, 1, 2048, 128, 128, 2048, 2048]
    - [61, 4.192]
  - - [128, 1024, 1, 4096, 128, 128, 4096, 4096]
    - [19, 5.405]
  - - [128, 1024, 1, 8192, 128, 128, 8192, 8192]
    - [56, 7.059]
  - - [128, 2048, 1, 128, 128, 128, 128, 128]
    - [11, 1.307]
  - - [128, 2048, 1, 256, 128, 128, 256, 256]
    - [11, 2.265]
  - - [128, 2048, 1, 512, 128, 128, 512, 512]
    - [17, 3.578]
  - - [128, 2048, 1, 1024, 128, 128, 1024, 1024]
    - [57, 5.174]
  - - [128, 2048, 1, 2048, 128, 128, 2048, 2048]
    - [55, 6.698]
  - - [128, 2048, 1, 4096, 128, 128, 4096, 4096]
    - [2, 7.766]
  - - [128, 2048, 1, 8192, 128, 128, 8192, 8192]
    - [27, 9.627]
  - - [128, 4096, 1, 128, 128, 128, 128, 128]
    - [45, 2.176]
  - - [128, 4096, 1, 256, 128, 128, 256, 256]
    - [47, 3.706]
  - - [128, 4096, 1, 512, 128, 128, 512, 512]
    - [48, 5.68]
  - - [128, 4096, 1, 1024, 128, 128, 1024, 1024]
    - [43, 7.68]
  - - [128, 4096, 1, 2048, 128, 128, 2048, 2048]
    - [2, 7.876]
  - - [128, 4096, 1, 4096, 128, 128, 4096, 4096]
    - [4, 10.462]
  - - [128, 4096, 1, 8192, 128, 128, 8192, 8192]
    - [3, 13.252]
  - - [128, 8192, 1, 128, 128, 128, 128, 128]
    - [30, 3.347]
  - - [128, 8192, 1, 256, 128, 128, 256, 256]
    - [28, 5.647]
  - - [128, 8192, 1, 512, 128, 128, 512, 512]
    - [28, 8.556]
  - - [128, 8192, 1, 1024, 128, 128, 1024, 1024]
    - [26, 10.168]
  - - [128, 8192, 1, 2048, 128, 128, 2048, 2048]
    - [27, 11.064]
  - - [128, 8192, 1, 4096, 128, 128, 4096, 4096]
    - [27, 13.132]
  - - [128, 8192, 1, 8192, 128, 128, 8192, 8192]
    - [8, 14.298]
  - - [256, 128, 1, 128, 256, 256, 128, 128]
    - [16, 0.184]
  - - [256, 128, 1, 256, 256, 256, 256, 256]
    - [51, 0.351]
  - - [256, 128, 1, 512, 256, 256, 512, 512]
    - [23, 0.614]
  - - [256, 128, 1, 1024, 256, 256, 1024, 1024]
    - [23, 0.972]
  - - [256, 128, 1, 2048, 256, 256, 2048, 2048]
    - [24, 1.391]
  - - [256, 128, 1, 4096, 256, 256, 4096, 4096]
    - [24, 2.115]
  - - [256, 128, 1, 8192, 256, 256, 8192, 8192]
    - [60, 3.068]
  - - [256, 256, 1, 128, 256, 256, 128, 128]
    - [51, 0.378]
  - - [256, 256, 1, 256, 256, 256, 256, 256]
    - [15, 0.706]
  - - [256, 256, 1, 512, 256, 256, 512, 512]
    - [51, 1.202]
  - - [256, 256, 1, 1024, 256, 256, 1024, 1024]
    - [23, 1.924]
  - - [256, 256, 1, 2048, 256, 256, 2048, 2048]
    - [24, 2.682]
  - - [256, 256, 1, 4096, 256, 256, 4096, 4096]
    - [22, 3.38]
  - - [256, 256, 1, 8192, 256, 256, 8192, 8192]
    - [57, 4.869]
  - - [256, 512, 1, 128, 256, 256, 128, 128]
    - [14, 0.709]
  - - [256, 512, 1, 256, 256, 256, 256, 256]
    - [14, 1.279]
  - - [256, 512, 1, 512, 256, 256, 512, 512]
    - [12, 2.112]
  - - [256, 512, 1, 1024, 256, 256, 1024, 1024]
    - [61, 3.16]
  - - [256, 512, 1, 2048, 256, 256, 2048, 2048]
    - [22, 4.235]
  - - [256, 512, 1, 4096, 256, 256, 4096, 4096]
    - [57, 5.394]
  - - [256, 512, 1, 8192, 256, 256, 8192, 8192]
    - [53, 7.092]
  - - [256, 1024, 1, 128, 256, 256, 128, 128]
    - [10, 1.289]
  - - [256, 1024, 1, 256, 256, 256, 256, 256]
    - [10, 2.256]
  - - [256, 1024, 1, 512, 256, 256, 512, 512]
    - [17, 3.587]
  - - [256, 1024, 1, 1024, 256, 256, 1024, 1024]
    - [17, 5.209]
  - - [256, 1024, 1, 2048, 256, 256, 2048, 2048]
    - [53, 6.674]
  - - [256, 1024, 1, 4096, 256, 256, 4096, 4096]
    - [9, 7.736]
  - - [256, 1024, 1, 8192, 256, 256, 8192, 8192]
    - [27, 9.738]
  - - [256, 2048, 1, 128, 256, 256, 128, 128]
    - [47, 2.157]
  - - [256, 2048, 1, 256, 256, 256, 256, 256]
    - [45, 3.677]
  - - [256, 2048, 1, 512, 256, 256, 512, 512]
    - [45, 5.642]
  - - [256, 2048, 1, 1024, 256, 256, 1024, 1024]
    - [47, 7.656]
  - - [256, 2048, 1, 2048, 256, 256, 2048, 2048]
    - [9, 8.229]
  - - [256, 2048, 1, 4096, 256, 256, 4096, 4096]
    - [35, 9.944]
  - - [256, 2048, 1, 8192, 256, 256, 8192, 8192]
    - [29, 12.888]
  - - [256, 4096, 1, 128, 256, 256, 128, 128]
    - [28, 3.38]
  - - [256, 4096, 1, 256, 256, 256, 256, 256]
    - [30, 5.64]
  - - [256, 4096, 1, 512, 256, 256, 512, 512]
    - [28, 8.531]
  - - [256, 4096, 1, 1024, 256, 256, 1024, 1024]
    - [30, 11.411]
  - - [256, 4096, 1, 2048, 256, 256, 2048, 2048]
    - [38, 11.418]
  - - [256, 4096, 1, 4096, 256, 256, 4096, 4096]
    - [40, 13.269]
  - - [256, 4096, 1, 8192, 256, 256, 8192, 8192]
    - [40, 15.401]
  - - [256, 8192, 1, 128, 256, 256, 128, 128]
    - [30, 3.947]
  - - [256, 8192, 1, 256, 256, 256, 256, 256]
    - [48, 4.571]
  - - [256, 8192, 1, 512, 256, 256, 512, 512]
    - [31, 7.408]
  - - [256, 8192, 1, 1024, 256, 256, 1024, 1024]
    - [27, 10.306]
  - - [256, 8192, 1, 2048, 256, 256, 2048, 2048]
    - [25, 12.665]
  - - [256, 8192, 1, 4096, 256, 256, 4096, 4096]
    - [7, 14.012]
  - - [256, 8192, 1, 8192, 256, 256, 8192, 8192]
    - [41, 15.589]
  - - [512, 128, 1, 128, 512, 512, 128, 128]
    - [52, 0.376]
  - - [512, 128, 1, 256, 512, 512, 256, 256]
    - [51, 0.693]
  - - [512, 128, 1, 512, 512, 512, 512, 512]
    - [23, 1.191]
  - - [512, 128, 1, 1024, 512, 512, 1024, 1024]
    - [24, 1.912]
  - - [512, 128, 1, 2048, 512, 512, 2048, 2048]
    - [23, 2.634]
  - - [512, 128, 1, 4096, 512, 512, 4096, 4096]
    - [22, 3.369]
  - - [512, 128, 1, 8192, 512, 512, 8192, 8192]
    - [58, 4.854]
  - - [512, 256, 1, 128, 512, 512, 128, 128]
    - [14, 0.714]
  - - [512, 256, 1, 256, 512, 512, 256, 256]
    - [14, 1.273]
  - - [512, 256, 1, 512, 512, 512, 512, 512]
    - [50, 2.101]
  - - [512, 256, 1, 1024, 512, 512, 1024, 1024]
    - [22, 3.173]
  - - [512, 256, 1, 2048, 512, 512, 2048, 2048]
    - [22, 4.225]
  - - [512, 256, 1, 4096, 512, 512, 4096, 4096]
    - [58, 5.356]
  - - [512, 256, 1, 8192, 512, 512, 8192, 8192]
    - [55, 7.088]
  - - [512, 512, 1, 128, 512, 512, 128, 128]
    - [11, 1.287]
  - - [512, 512, 1, 256, 512, 512, 256, 256]
    - [11, 2.26]
  - - [512, 512, 1, 512, 512, 512, 512, 512]
    - [11, 3.636]
  - - [512, 512, 1, 1024, 512, 512, 1024, 1024]
    - [55, 5.187]
  - - [512, 512, 1, 2048, 512, 512, 2048, 2048]
    - [53, 6.696]
  - - [512, 512, 1, 4096, 512, 512, 4096, 4096]
    - [4, 7.365]
  - - [512, 512, 1, 8192, 512, 512, 8192, 8192]
    - [5, 9.153]
  - - [512, 1024, 1, 128, 512, 512, 128, 128]
    - [48, 2.182]
  - - [512, 1024, 1, 256, 512, 512, 256, 256]
    - [47, 3.701]
  - - [512, 1024, 1, 512, 512, 512, 512, 512]
    - [47, 5.683]
  - - [512, 1024, 1, 1024, 512, 512, 1024, 1024]
    - [48, 7.678]
  - - [512, 1024, 1, 2048, 512, 512, 2048, 2048]
    - [6, 8.644]
  - - [512, 1024, 1, 4096, 512, 512, 4096, 4096]
    - [38, 9.937]
  - - [512, 1024, 1, 8192, 512, 512, 8192, 8192]
    - [27, 12.519]
  - - [512, 2048, 1, 128, 512, 512, 128, 128]
    - [30, 3.347]
  - - [512, 2048, 1, 256, 512, 512, 256, 256]
    - [30, 5.658]
  - - [512, 2048, 1, 512, 512, 512, 512, 512]
    - [30, 8.544]
  - - [512, 2048, 1, 1024, 512, 512, 1024, 1024]
    - [30, 11.46]
  - - [512, 2048, 1, 2048, 512, 512, 2048, 2048]
    - [40, 11.254]
  - - [512, 2048, 1, 4096, 512, 512, 4096, 4096]
    - [29, 12.638]
  - - [512, 2048, 1, 8192, 512, 512, 8192, 8192]
    - [38, 15.273]
  - - [512, 4096, 1, 128, 512, 512, 128, 128]
    - [28, 3.948]
  - - [512, 4096, 1, 256, 512, 512, 256, 256]
    - [48, 4.709]
  - - [512, 4096, 1, 512, 512, 512, 512, 512]
    - [31, 7.562]
  - - [512, 4096, 1, 1024, 512, 512, 1024, 1024]
    - [29, 10.276]
  - - [512, 4096, 1, 2048, 512, 512, 2048, 2048]
    - [40, 12.104]
  - - [512, 4096, 1, 4096, 512, 512, 4096, 4096]
    - [27, 14.006]
  - - [512, 4096, 1, 8192, 512, 512, 8192, 8192]
    - [37, 15.796]
  - - [512, 8192, 1, 128, 512, 512, 128, 128]
    - [31, 4.093]
  - - [512, 8192, 1, 256, 512, 512, 256, 256]
    - [29, 6.579]
  - - [512, 8192, 1, 512, 512, 512, 512, 512]
    - [27, 9.923]
  - - [512, 8192, 1, 1024, 512, 512, 1024, 1024]
    - [29, 12.96]
  - - [512, 8192, 1, 2048, 512, 512, 2048, 2048]
    - [27, 13.859]
  - - [512, 8192, 1, 4096, 512, 512, 4096, 4096]
    - [29, 15.652]
  - - [512, 8192, 1, 8192, 512, 512, 8192, 8192]
    - [27, 17.18]
  - - [1024, 128, 1, 128, 1024, 1024, 128, 128]
    - [14, 0.71]
  - - [1024, 128, 1, 256, 1024, 1024, 256, 256]
    - [14, 1.282]
  - - [1024, 128, 1, 512, 1024, 1024, 512, 512]
    - [22, 2.09]
  - - [1024, 128, 1, 1024, 1024, 1024, 1024, 1024]
    - [22, 3.112]
  - - [1024, 128, 1, 2048, 1024, 1024, 2048, 2048]
    - [21, 4.184]
  - - [1024, 128, 1, 4096, 1024, 1024, 4096, 4096]
    - [20, 5.368]
  - - [1024, 128, 1, 8192, 1024, 1024, 8192, 8192]
    - [53, 7.059]
  - - [1024, 256, 1, 128, 1024, 1024, 128, 128]
    - [11, 1.303]
  - - [1024, 256, 1, 256, 1024, 1024, 256, 256]
    - [11, 2.282]
  - - [1024, 256, 1, 512, 1024, 1024, 512, 512]
    - [10, 3.637]
  - - [1024, 256, 1, 1024, 1024, 1024, 1024, 1024]
    - [18, 5.183]
  - - [1024, 256, 1, 2048, 1024, 1024, 2048, 2048]
    - [19, 6.706]
  - - [1024, 256, 1, 4096, 1024, 1024, 4096, 4096]
    - [3, 7.798]
  - - [1024, 256, 1, 8192, 1024, 1024, 8192, 8192]
    - [33, 9.613]
  - - [1024, 512, 1, 128, 1024, 1024, 128, 128]
    - [48, 2.177]
  - - [1024, 512, 1, 256, 1024, 1024, 256, 256]
    - [48, 3.683]
  - - [1024, 512, 1, 512, 1024, 1024, 512, 512]
    - [48, 5.656]
  - - [1024, 512, 1, 1024, 1024, 1024, 1024, 1024]
    - [48, 7.673]
  - - [1024, 512, 1, 2048, 1024, 1024, 2048, 2048]
    - [8, 8.723]
  - - [1024, 512, 1, 4096, 1024, 1024, 4096, 4096]
    - [38, 9.955]
  - - [1024, 512, 1, 8192, 1024, 1024, 8192, 8192]
    - [40, 12.479]
  - - [1024, 1024, 1, 128, 1024, 1024, 128, 128]
    - [28, 3.378]
  - - [1024, 1024, 1, 256, 1024, 1024, 256, 256]
    - [28, 5.678]
  - - [1024, 1024, 1, 512, 1024, 1024, 512, 512]
    - [28, 8.494]
  - - [1024, 1024, 1, 1024, 1024, 1024, 1024, 1024]
    - [28, 11.462]
  - - [1024, 1024, 1, 2048, 1024, 1024, 2048, 2048]
    - [29, 10.873]
  - - [1024, 1024, 1, 4096, 1024, 1024, 4096, 4096]
    - [33, 12.488]
  - - [1024, 1024, 1, 8192, 1024, 1024, 8192, 8192]
    - [38, 15.494]
  - - [1024, 2048, 1, 128, 1024, 1024, 128, 128]
    - [28, 3.964]
  - - [1024, 2048, 1, 256, 1024, 1024, 256, 256]
    - [48, 4.697]
  - - [1024, 2048, 1, 512, 1024, 1024, 512, 512]
    - [29, 7.368]
  - - [1024, 2048, 1, 1024, 1024, 1024, 1024, 1024]
    - [27, 10.07]
  - - [1024, 2048, 1, 2048, 1024, 1024, 2048, 2048]
    - [29, 12.076]
  - - [1024, 2048, 1, 4096, 1024, 1024, 4096, 4096]
    - [29, 14.218]
  - - [1024, 2048, 1, 8192, 1024, 1024, 8192, 8192]
    - [30, 16.084]
  - - [1024, 4096, 1, 128, 1024, 1024, 128, 128]
    - [29, 4.097]
  - - [1024, 4096, 1, 256, 1024, 1024, 256, 256]
    - [29, 6.634]
  - - [1024, 4096, 1, 512, 1024, 1024, 512, 512]
    - [29, 10.046]
  - - [1024, 4096, 1, 1024, 1024, 1024, 1024, 1024]
    - [31, 12.798]
  - - [1024, 4096, 1, 2048, 1024, 1024, 2048, 2048]
    - [3, 13.454]
  - - [1024, 4096, 1, 4096, 1024, 1024, 4096, 4096]
    - [35, 15.342]
  - - [1024, 4096, 1, 8192, 1024, 1024, 8192, 8192]
    - [3, 17.08]
  - - [1024, 8192, 1, 128, 1024, 1024, 128, 128]
    - [27, 5.024]
  - - [1024, 8192, 1, 256, 1024, 1024, 256, 256]
    - [27, 7.96]
  - - [1024, 8192, 1, 512, 1024, 1024, 512, 512]
    - [29, 11.077]
  - - [1024, 8192, 1, 1024, 1024, 1024, 1024, 1024]
    - [27, 13.526]
  - - [1024, 8192, 1, 2048, 1024, 1024, 2048, 2048]
    - [3, 14.085]
  - - [1024, 8192, 1, 4096, 1024, 1024, 4096, 4096]
    - [31, 15.987]
  - - [1024, 8192, 1, 8192, 1024, 1024, 8192, 8192]
    - [27, 17.915]
  - - [2048, 128, 1, 128, 2048, 2048, 128, 128]
    - [18, 1.242]
  - - [2048, 128, 1, 256, 2048, 2048, 256, 256]
    - [11, 2.28]
  - - [2048, 128, 1, 512, 2048, 2048, 512, 512]
    - [11, 3.633]
  - - [2048, 128, 1, 1024, 2048, 2048, 1024, 1024]
    - [19, 5.186]
  - - [2048, 128, 1, 2048, 2048, 2048, 2048, 2048]
    - [19, 6.71]
  - - [2048, 128, 1, 4096, 2048, 2048, 4096, 4096]
    - [2, 7.706]
  - - [2048, 128, 1, 8192, 2048, 2048, 8192, 8192]
    - [27, 9.69]
  - - [2048, 256, 1, 128, 2048, 2048, 128, 128]
    - [47, 2.192]
  - - [2048, 256, 1, 256, 2048, 2048, 256, 256]
    - [45, 3.698]
  - - [2048, 256, 1, 512, 2048, 2048, 512, 512]
    - [46, 5.654]
  - - [2048, 256, 1, 1024, 2048, 2048, 1024, 1024]
    - [43, 7.638]
  - - [2048, 256, 1, 2048, 2048, 2048, 2048, 2048]
    - [3, 8.526]
  - - [2048, 256, 1, 4096, 2048, 2048, 4096, 4096]
    - [29, 10.009]
  - - [2048, 256, 1, 8192, 2048, 2048, 8192, 8192]
    - [40, 13.241]
  - - [2048, 512, 1, 128, 2048, 2048, 128, 128]
    - [26, 3.371]
  - - [2048, 512, 1, 256, 2048, 2048, 256, 256]
    - [28, 5.674]
  - - [2048, 512, 1, 512, 2048, 2048, 512, 512]
    - [28, 8.567]
  - - [2048, 512, 1, 1024, 2048, 2048, 1024, 1024]
    - [34, 11.358]
  - - [2048, 512, 1, 2048, 2048, 2048, 2048, 2048]
    - [38, 10.846]
  - - [2048, 512, 1, 4096, 2048, 2048, 4096, 4096]
    - [29, 12.688]
  - - [2048, 512, 1, 8192, 2048, 2048, 8192, 8192]
    - [38, 15.394]
  - - [2048, 1024, 1, 128, 2048, 2048, 128, 128]
    - [28, 3.964]
  - - [2048, 1024, 1, 256, 2048, 2048, 256, 256]
    - [48, 4.689]
  - - [2048, 1024, 1, 512, 2048, 2048, 512, 512]
    - [40, 7.502]
  - - [2048, 1024, 1, 1024, 2048, 2048, 1024, 1024]
    - [40, 10.266]
  - - [2048, 1024, 1, 2048, 2048, 2048, 2048, 2048]
    - [31, 11.988]
  - - [2048, 1024, 1, 4096, 2048, 2048, 4096, 4096]
    - [29, 14.056]
  - - [2048, 1024, 1, 8192, 2048, 2048, 8192, 8192]
    - [27, 16.184]
  - - [2048, 2048, 1, 128, 2048, 2048, 128, 128]
    - [29, 4.105]
  - - [2048, 2048, 1, 256, 2048, 2048, 256, 256]
    - [29, 6.708]
  - - [2048, 2048, 1, 512, 2048, 2048, 512, 512]
    - [31, 9.841]
  - - [2048, 2048, 1, 1024, 2048, 2048, 1024, 1024]
    - [38, 11.978]
  - - [2048, 2048, 1, 2048, 2048, 2048, 2048, 2048]
    - [2, 13.824]
  - - [2048, 2048, 1, 4096, 2048, 2048, 4096, 4096]
    - [34, 15.173]
  - - [2048, 2048, 1, 8192, 2048, 2048, 8192, 8192]
    - [3, 16.865]
  - - [2048, 4096, 1, 128, 2048, 2048, 128, 128]
    - [29, 5.051]
  - - [2048, 4096, 1, 256, 2048, 2048, 256, 256]
    - [31, 8.012]
  - - [2048, 4096, 1, 512, 2048, 2048, 512, 512]
    - [27, 11.001]
  - - [2048, 4096, 1, 1024, 2048, 2048, 1024, 1024]
    - [6, 12.811]
  - - [2048, 4096, 1, 2048, 2048, 2048, 2048, 2048]
    - [2, 14.101]
  - - [2048, 4096, 1, 4096, 2048, 2048, 4096, 4096]
    - [40, 16.022]
  - - [2048, 4096, 1, 8192, 2048, 2048, 8192, 8192]
    - [38, 17.947]
  - - [2048, 8192, 1, 128, 2048, 2048, 128, 128]
    - [29, 5.776]
  - - [2048, 8192, 1, 256, 2048, 2048, 256, 256]
    - [29, 8.581]
  - - [2048, 8192, 1, 512, 2048, 2048, 512, 512]
    - [27, 11.751]
  - - [2048, 8192, 1, 1024, 2048, 2048, 1024, 1024]
    - [2, 13.527]
  - - [2048, 8192, 1, 2048, 2048, 2048, 2048, 2048]
    - [2, 14.485]
  - - [2048, 8192, 1, 4096, 2048, 2048, 4096, 4096]
    - [38, 16.793]
  - - [2048, 8192, 1, 8192, 2048, 2048, 8192, 8192]
    - [38, 18.475]
  - - [4096, 128, 1, 128, 4096, 4096, 128, 128]
    - [48, 2.168]
  - - [4096, 128, 1, 256, 4096, 4096, 256, 256]
    - [48, 3.705]
  - - [4096, 128, 1, 512, 4096, 4096, 512, 512]
    - [47, 5.666]
  - - [4096, 128, 1, 1024, 4096, 4096, 1024, 1024]
    - [44, 7.569]
  - - [4096, 128, 1, 2048, 4096, 4096, 2048, 2048]
    - [4, 8.174]
  - - [4096, 128, 1, 4096, 4096, 4096, 4096, 4096]
    - [2, 10.442]
  - - [4096, 128, 1, 8192, 4096, 4096, 8192, 8192]
    - [3, 12.857]
  - - [4096, 256, 1, 128, 4096, 4096, 128, 128]
    - [28, 3.384]
  - - [4096, 256, 1, 256, 4096, 4096, 256, 256]
    - [26, 5.631]
  - - [4096, 256, 1, 512, 4096, 4096, 512, 512]
    - [26, 8.546]
  - - [4096, 256, 1, 1024, 4096, 4096, 1024, 1024]
    - [37, 11.365]
  - - [4096, 256, 1, 2048, 4096, 4096, 2048, 2048]
    - [29, 10.747]
  - - [4096, 256, 1, 4096, 4096, 4096, 4096, 4096]
    - [31, 13.14]
  - - [4096, 256, 1, 8192, 4096, 4096, 8192, 8192]
    - [3, 14.586]
  - - [4096, 512, 1, 128, 4096, 4096, 128, 128]
    - [28, 3.993]
  - - [4096, 512, 1, 256, 4096, 4096, 256, 256]
    - [48, 4.56]
  - - [4096, 512, 1, 512, 4096, 4096, 512, 512]
    - [40, 7.544]
  - - [4096, 512, 1, 1024, 4096, 4096, 1024, 1024]
    - [38, 9.971]
  - - [4096, 512, 1, 2048, 4096, 4096, 2048, 2048]
    - [7, 11.516]
  - - [4096, 512, 1, 4096, 4096, 4096, 4096, 4096]
    - [29, 13.893]
  - - [4096, 512, 1, 8192, 4096, 4096, 8192, 8192]
    - [3, 15.861]
  - - [4096, 1024, 1, 128, 4096, 4096, 128, 128]
    - [25, 4.124]
  - - [4096, 1024, 1, 256, 4096, 4096, 256, 256]
    - [31, 6.382]
  - - [4096, 1024, 1, 512, 4096, 4096, 512, 512]
    - [38, 9.487]
  - - [4096, 1024, 1, 1024, 4096, 4096, 1024, 1024]
    - [42, 12.01]
  - - [4096, 1024, 1, 2048, 4096, 4096, 2048, 2048]
    - [2, 13.173]
  - - [4096, 1024, 1, 4096, 4096, 4096, 4096, 4096]
    - [39, 15.217]
  - - [4096, 1024, 1, 8192, 4096, 4096, 8192, 8192]
    - [38, 17.147]
  - - [4096, 2048, 1, 128, 4096, 4096, 128, 128]
    - [25, 5.055]
  - - [4096, 2048, 1, 256, 4096, 4096, 256, 256]
    - [25, 7.712]
  - - [4096, 2048, 1, 512, 4096, 4096, 512, 512]
    - [40, 10.461]
  - - [4096, 2048, 1, 1024, 4096, 4096, 1024, 1024]
    - [3, 13.015]
  - - [4096, 2048, 1, 2048, 4096, 4096, 2048, 2048]
    - [40, 13.764]
  - - [4096, 2048, 1, 4096, 4096, 4096, 4096, 4096]
    - [40, 16.152]
  - - [4096, 2048, 1, 8192, 4096, 4096, 8192, 8192]
    - [38, 17.912]
  - - [4096, 4096, 1, 128, 4096, 4096, 128, 128]
    - [25, 5.791]
  - - [4096, 4096, 1, 256, 4096, 4096, 256, 256]
    - [25, 8.253]
  - - [4096, 4096, 1, 512, 4096, 4096, 512, 512]
    - [2, 11.443]
  - - [4096, 4096, 1, 1024, 4096, 4096, 1024, 1024]
    - [2, 13.679]
  - - [4096, 4096, 1, 2048, 4096, 4096, 2048, 2048]
    - [5, 13.782]
  - - [4096, 4096, 1, 4096, 4096, 4096, 4096, 4096]
    - [40, 16.781]
  - - [4096, 4096, 1, 8192, 4096, 4096, 8192, 8192]
    - [33, 18.582]
  - - [4096, 8192, 1, 128, 4096, 4096, 128, 128]
    - [25, 5.936]
  - - [4096, 8192, 1, 256, 4096, 4096, 256, 256]
    - [2, 8.643]
  - - [4096, 8192, 1, 512, 4096, 4096, 512, 512]
    - [3, 11.994]
  - - [4096, 8192, 1, 1024, 4096, 4096, 1024, 1024]
    - [2, 14.43]
  - - [4096, 8192, 1, 2048, 4096, 4096, 2048, 2048]
    - [5, 14.042]
  - - [4096, 8192, 1, 4096, 4096, 4096, 4096, 4096]
    - [40, 17.201]
  - - [4096, 8192, 1, 8192, 4096, 4096, 8192, 8192]
    - [38, 17.717]
  - - [8192, 128, 1, 128, 8192, 8192, 128, 128]
    - [30, 3.135]
  - - [8192, 128, 1, 256, 8192, 8192, 256, 256]
    - [26, 5.316]
  - - [8192, 128, 1, 512, 8192, 8192, 512, 512]
    - [30, 8.147]
  - - [8192, 128, 1, 1024, 8192, 8192, 1024, 1024]
    - [4, 9.82]
  - - [8192, 128, 1, 2048, 8192, 8192, 2048, 2048]
    - [27, 10.9]
  - - [8192, 128, 1, 4096, 8192, 8192, 4096, 4096]
    - [2, 13.473]
  - - [8192, 128, 1, 8192, 8192, 8192, 8192, 8192]
    - [2, 14.525]
  - - [8192, 256, 1, 128, 8192, 8192, 128, 128]
    - [30, 3.914]
  - - [8192, 256, 1, 256, 8192, 8192, 256, 256]
    - [49, 4.422]
  - - [8192, 256, 1, 512, 8192, 8192, 512, 512]
    - [3, 7.2]
  - - [8192, 256, 1, 1024, 8192, 8192, 1024, 1024]
    - [3, 9.949]
  - - [8192, 256, 1, 2048, 8192, 8192, 2048, 2048]
    - [29, 12.864]
  - - [8192, 256, 1, 4096, 8192, 8192, 4096, 4096]
    - [2, 14.073]
  - - [8192, 256, 1, 8192, 8192, 8192, 8192, 8192]
    - [3, 16.005]
  - - [8192, 512, 1, 128, 8192, 8192, 128, 128]
    - [25, 3.956]
  - - [8192, 512, 1, 256, 8192, 8192, 256, 256]
    - [40, 6.333]
  - - [8192, 512, 1, 512, 8192, 8192, 512, 512]
    - [38, 9.522]
  - - [8192, 512, 1, 1024, 8192, 8192, 1024, 1024]
    - [38, 12.037]
  - - [8192, 512, 1, 2048, 8192, 8192, 2048, 2048]
    - [36, 12.985]
  - - [8192, 512, 1, 4096, 8192, 8192, 4096, 4096]
    - [40, 15.318]
  - - [8192, 512, 1, 8192, 8192, 8192, 8192, 8192]
    - [38, 17.245]
  - - [8192, 1024, 1, 128, 8192, 8192, 128, 128]
    - [25, 4.946]
  - - [8192, 1024, 1, 256, 8192, 8192, 256, 256]
    - [40, 7.538]
  - - [8192, 1024, 1, 512, 8192, 8192, 512, 512]
    - [38, 10.583]
  - - [8192, 1024, 1, 1024, 8192, 8192, 1024, 1024]
    - [1, 12.571]
  - - [8192, 1024, 1, 2048, 8192, 8192, 2048, 2048]
    - [35, 13.309]
  - - [8192, 1024, 1, 4096, 8192, 8192, 4096, 4096]
    - [40, 16.012]
  - - [8192, 1024, 1, 8192, 8192, 8192, 8192, 8192]
    - [32, 18.087]
  - - [8192, 2048, 1, 128, 8192, 8192, 128, 128]
    - [25, 5.526]
  - - [8192, 2048, 1, 256, 8192, 8192, 256, 256]
    - [40, 8.062]
  - - [8192, 2048, 1, 512, 8192, 8192, 512, 512]
    - [38, 11.112]
  - - [8192, 2048, 1, 1024, 8192, 8192, 1024, 1024]
    - [3, 13.212]
  - - [8192, 2048, 1, 2048, 8192, 8192, 2048, 2048]
    - [40, 13.866]
  - - [8192, 2048, 1, 4096, 8192, 8192, 4096, 4096]
    - [37, 16.754]
  - - [8192, 2048, 1, 8192, 8192, 8192, 8192, 8192]
    - [38, 18.606]
  - - [8192, 4096, 1, 128, 8192, 8192, 128, 128]
    - [2, 5.632]
  - - [8192, 4096, 1, 256, 8192, 8192, 256, 256]
    - [2, 8.443]
  - - [8192, 4096, 1, 512, 8192, 8192, 512, 512]
    - [37, 11.427]
  - - [8192, 4096, 1, 1024, 8192, 8192, 1024, 1024]
    - [2, 13.963]
  - - [8192, 4096, 1, 2048, 8192, 8192, 2048, 2048]
    - [37, 13.874]
  - - [8192, 4096, 1, 4096, 8192, 8192, 4096, 4096]
    - [38, 17.221]
  - - [8192, 4096, 1, 8192, 8192, 8192, 8192, 8192]
    - [38, 18.267]
  - - [8192, 8192, 1, 128, 8192, 8192, 128, 128]
    - [0, 5.71]
  - - [8192, 8192, 1, 256, 8192, 8192, 256, 256]
    - [38, 8.401]
  - - [8192, 8192, 1, 512, 8192, 8192, 512, 512]
    - [2, 11.433]
  - - [8192, 8192, 1, 1024, 8192, 8192, 1024, 1024]
    - [2, 13.983]
  - - [8192, 8192, 1, 2048, 8192, 8192, 2048, 2048]
    - [40, 13.883]
  - - [8192, 8192, 1, 4096, 8192, 8192, 4096, 4096]
    - [42, 16.485]
  - - [8192, 8192, 1, 8192, 8192, 8192, 8192, 8192]
    - [38, 17.988]
  - - [1, 1, 1, 32, 1, 1, 32, 32]
    - [63, 0.0]
- null
- null
- ExperimentalStreamK
- GridBased
