library/src/amd_detail/rocblaslt/src/Tensile/Logic/asm_full/aquavanjaram/gfx942_80cu/StreamK/aquavanjaram942_Cijk_Ailk_Bjlk_BBS_BH_UserArgs.yaml
- {MinimumRequiredVersion: 4.33.0}
- aquavanjaram942
- {Architecture: gfx942, CUCount: 80}
- [Device 0049, Device 0050]
    SolutionIndex: 0
    SolutionNameMin: Cijk_Ailk_Bjlk_BBS_BH_UserArgs_MT256x256x32_MI16x16x1_SN_LDSB1_CLR1_GSU0_GSUC0_GSUWGMRR0_K1_LBSPPA2048_LBSPPB2048_LPA0_LPB32_MIWT8_8_PLR1_SU32_SUM0_SUS256_SKXCCM0_VWA4_VWB2_WGM1_WGMXCC1_WGMXCCGn1
    SolutionIndex: 1
    SolutionNameMin: Cijk_Ailk_Bjlk_BBS_BH_UserArgs_MT256x256x32_MI16x16x1_SN_LDSB0_CLR1_GSU0_GSUC0_GSUWGMRR0_K1_LBSPPA2048_LBSPPB2048_LPA0_LPB0_MIWT8_8_PLR1_SU32_SUM0_SUS256_SKXCCM0_VWA4_VWB4_WGM1_WGMXCC1_WGMXCCGn1
    SolutionIndex: 2
    SolutionNameMin: Cijk_Ailk_Bjlk_BBS_BH_UserArgs_MT256x256x32_MI16x16x1_SN_LDSB0_CLR1_GSU0_GSUC0_GSUWGMRR0_K1_LBSPPA2048_LBSPPB2048_LPA0_LPB0_MIWT8_8_PLR1_SU32_SUM0_SUS256_SKXCCM0_VWA4_VWB8_WGM1_WGMXCC1_WGMXCCGn1
    SolutionIndex: 3
    SolutionNameMin: Cijk_Ailk_Bjlk_BBS_BH_UserArgs_MT256x256x32_MI16x16x1_SN_LDSB0_CLR1_GSU0_GSUC0_GSUWGMRR0_K1_LBSPPA2048_LBSPPB2048_LPA0_LPB0_MIWT8_8_PLR1_SU32_SUM0_SUS256_SKXCCM0_VWA8_VWB8_WGM1_WGMXCC1_WGMXCCGn1
    SolutionIndex: 4
    SolutionNameMin: Cijk_Ailk_Bjlk_BBS_BH_UserArgs_MT256x256x32_MI16x16x1_SN_LDSB0_CLR1_GSU0_GSUC0_GSUWGMRR0_K1_LBSPPA2048_LBSPPB2048_LPA0_LPB0_MIWT8_8_PLR1_SU32_SUM0_SUS256_SKXCCM0_VWA4_VWB8_WGM2_WGMXCC1_WGMXCCGn1
    SolutionIndex: 5
    SolutionNameMin: Cijk_Ailk_Bjlk_BBS_BH_UserArgs_MT256x256x32_MI16x16x1_SN_LDSB1_CLR1_GSU0_GSUC0_GSUWGMRR0_K1_LBSPPA2048_LBSPPB2048_LPA0_LPB32_MIWT8_8_PLR1_SU32_SUM0_SUS256_SKXCCM0_VWA4_VWB2_WGM4_WGMXCC1_WGMXCCGn1
    SolutionIndex: 6
    SolutionNameMin: Cijk_Ailk_Bjlk_BBS_BH_UserArgs_MT256x256x32_MI16x16x1_SN_LDSB1_CLR1_GSU0_GSUC0_GSUWGMRR0_K1_LBSPPA2048_LBSPPB2048_LPA0_LPB32_MIWT8_8_PLR1_SU32_SUM0_SUS256_SKXCCM0_VWA8_VWB2_WGM4_WGMXCC1_WGMXCCGn1
    SolutionIndex: 7
    SolutionNameMin: Cijk_Ailk_Bjlk_BBS_BH_UserArgs_MT256x256x32_MI16x16x1_SN_LDSB0_CLR1_GSU0_GSUC0_GSUWGMRR0_K1_LBSPPA2048_LBSPPB2048_LPA0_LPB0_MIWT8_8_PLR1_SU32_SUM0_SUS256_SKXCCM0_VWA4_VWB4_WGM4_WGMXCC1_WGMXCCGn1
    SolutionIndex: 8
    SolutionNameMin: Cijk_Ailk_Bjlk_BBS_BH_UserArgs_MT256x256x32_MI16x16x1_SN_LDSB0_CLR1_GSU0_GSUC0_GSUWGMRR0_K1_LBSPPA2048_LBSPPB2048_LPA0_LPB0_MIWT8_8_PLR1_SU32_SUM0_SUS256_SKXCCM0_VWA4_VWB8_WGM4_WGMXCC1_WGMXCCGn1
    SolutionIndex: 9
    SolutionNameMin: Cijk_Ailk_Bjlk_BBS_BH_UserArgs_MT256x256x32_MI16x16x1_SN_LDSB0_CLR1_GSU0_GSUC0_GSUWGMRR0_K1_LBSPPA2048_LBSPPB2048_LPA0_LPB0_MIWT8_8_PLR1_SU32_SUM0_SUS256_SKXCCM0_VWA8_VWB8_WGM4_WGMXCC1_WGMXCCGn1
    SolutionIndex: 10
    SolutionNameMin: Cijk_Ailk_Bjlk_BBS_BH_UserArgs_MT128x256x32_MI16x16x1_SN_LDSB1_CLR1_GSU0_GSUC0_GSUWGMRR0_K1_LBSPPA1024_LBSPPB2048_LPA0_LPB0_MIWT4_8_PLR1_SU32_SUM0_SUS256_SKXCCM0_VWA4_VWB8_WGM2_WGMXCC1_WGMXCCGn1
    SolutionIndex: 11
    SolutionNameMin: Cijk_Ailk_Bjlk_BBS_BH_UserArgs_MT256x128x32_MI16x16x1_SN_LDSB1_CLR1_GSU0_GSUC0_GSUWGMRR0_K1_LBSPPA2048_LBSPPB1024_LPA0_LPB16_MIWT8_4_PLR1_SU32_SUM0_SUS256_SKXCCM0_VWA8_VWB1_WGM1_WGMXCC1_WGMXCCGn1
    SolutionIndex: 12
    SolutionNameMin: Cijk_Ailk_Bjlk_BBS_BH_UserArgs_MT256x128x32_MI16x16x1_SN_LDSB1_CLR1_GSU0_GSUC0_GSUWGMRR0_K1_LBSPPA2048_LBSPPB1024_LPA0_LPB32_MIWT8_4_PLR1_SU32_SUM0_SUS256_SKXCCM0_VWA4_VWB2_WGM1_WGMXCC1_WGMXCCGn1
    SolutionIndex: 13
    SolutionNameMin: Cijk_Ailk_Bjlk_BBS_BH_UserArgs_MT256x128x32_MI16x16x1_SN_LDSB1_CLR1_GSU0_GSUC0_GSUWGMRR0_K1_LBSPPA2048_LBSPPB1024_LPA0_LPB0_MIWT8_4_PLR1_SU32_SUM0_SUS256_SKXCCM0_VWA4_VWB4_WGM1_WGMXCC1_WGMXCCGn1
    SolutionIndex: 14
    SolutionNameMin: Cijk_Ailk_Bjlk_BBS_BH_UserArgs_MT256x64x32_MI16x16x1_SN_LDSB1_CLR1_GSU0_GSUC0_GSUWGMRR0_K1_LBSPPA2048_LBSPPB512_LPA0_LPB32_MIWT8_2_PLR1_SU32_SUM0_SUS256_SKXCCM0_VWA8_VWB2_WGM2_WGMXCC1_WGMXCCGn1
    SolutionIndex: 15
    SolutionNameMin: Cijk_Ailk_Bjlk_BBS_BH_UserArgs_MT32x32x32_MI16x16x1_SN_LDSB0_CLR1_GSU0_GSUC0_GSUWGMRR0_K1_LBSPPA256_LBSPPB256_LPA16_LPB16_MIWT1_1_PLR1_SU32_SUM0_SUS256_SKXCCM0_VWA1_VWB1_WGM1_WGMXCC1_WGMXCCGn1
    SolutionIndex: 16
    SolutionNameMin: Cijk_Ailk_Bjlk_BBS_BH_UserArgs_MT256x256x64_MI16x16x1_SN_LDSB1_CLR1_GSU0_GSUC0_GSUWGMRR0_K1_LBSPPA2048_LBSPPB2048_LPA0_LPB0_MIWT8_8_PLR1_SU32_SUM0_SUS256_SKXCCM0_VWA4_VWB4_WGM1_WGMXCC1_WGMXCCGn1
    SolutionIndex: 17
    SolutionNameMin: Cijk_Ailk_Bjlk_BBS_BH_UserArgs_MT256x256x64_MI16x16x1_SN_LDSB1_CLR1_GSU0_GSUC0_GSUWGMRR0_K1_LBSPPA2048_LBSPPB2048_LPA0_LPB0_MIWT8_8_PLR2_SU32_SUM0_SUS256_SKXCCM0_VWA8_VWB8_WGM1_WGMXCC1_WGMXCCGn1
    SolutionIndex: 18
    SolutionNameMin: Cijk_Ailk_Bjlk_BBS_BH_UserArgs_MT256x256x64_MI16x16x1_SN_LDSB1_CLR1_GSU0_GSUC0_GSUWGMRR0_K1_LBSPPA2048_LBSPPB2048_LPA0_LPB0_MIWT8_8_PLR1_SU32_SUM0_SUS256_SKXCCM0_VWA4_VWB4_WGM2_WGMXCC1_WGMXCCGn1
    SolutionIndex: 19
    SolutionNameMin: Cijk_Ailk_Bjlk_BBS_BH_UserArgs_MT256x256x64_MI16x16x1_SN_LDSB1_CLR1_GSU0_GSUC0_GSUWGMRR0_K1_LBSPPA2048_LBSPPB2048_LPA0_LPB0_MIWT8_8_PLR2_SU32_SUM0_SUS256_SKXCCM0_VWA8_VWB8_WGM2_WGMXCC1_WGMXCCGn1
    SolutionIndex: 20
    SolutionNameMin: Cijk_Ailk_Bjlk_BBS_BH_UserArgs_MT256x256x64_MI16x16x1_SN_LDSB1_CLR1_GSU0_GSUC0_GSUWGMRR0_K1_LBSPPA2048_LBSPPB2048_LPA0_LPB0_MIWT8_8_PLR1_SU32_SUM0_SUS256_SKXCCM0_VWA4_VWB4_WGM4_WGMXCC1_WGMXCCGn1
    SolutionIndex: 21
    SolutionNameMin: Cijk_Ailk_Bjlk_BBS_BH_UserArgs_MT256x256x64_MI16x16x1_SN_LDSB1_CLR1_GSU0_GSUC0_GSUWGMRR0_K1_LBSPPA2048_LBSPPB2048_LPA0_LPB0_MIWT8_8_PLR1_SU32_SUM0_SUS256_SKXCCM0_VWA8_VWB4_WGM4_WGMXCC1_WGMXCCGn1
    SolutionIndex: 22
    SolutionNameMin: Cijk_Ailk_Bjlk_BBS_BH_UserArgs_MT256x128x64_MI16x16x1_SN_LDSB1_CLR1_GSU0_GSUC0_GSUWGMRR0_K1_LBSPPA2048_LBSPPB1024_LPA0_LPB32_MIWT8_4_PLR2_SU32_SUM0_SUS256_SKXCCM0_VWA4_VWB2_WGM1_WGMXCC1_WGMXCCGn1
    SolutionIndex: 23
    SolutionNameMin: Cijk_Ailk_Bjlk_BBS_BH_UserArgs_MT128x128x64_MI16x16x1_SN_LDSB1_CLR1_GSU0_GSUC0_GSUWGMRR0_K1_LBSPPA1024_LBSPPB1024_LPA0_LPB0_MIWT4_4_PLR1_SU32_SUM0_SUS256_SKXCCM0_VWA4_VWB4_WGM1_WGMXCC1_WGMXCCGn1
    SolutionIndex: 24
    SolutionNameMin: Cijk_Ailk_Bjlk_BBS_BH_UserArgs_MT128x128x64_MI16x16x1_SN_LDSB1_CLR1_GSU0_GSUC0_GSUWGMRR0_K1_LBSPPA1024_LBSPPB1024_LPA0_LPB0_MIWT4_4_PLR1_SU32_SUM0_SUS256_SKXCCM0_VWA4_VWB4_WGM2_WGMXCC1_WGMXCCGn1
    SolutionIndex: 25
    SolutionNameMin: Cijk_Ailk_Bjlk_BBS_BH_UserArgs_MT128x64x64_MI16x16x1_SN_LDSB1_CLR1_GSU0_GSUC0_GSUWGMRR0_K1_LBSPPA1024_LBSPPB512_LPA0_LPB32_MIWT4_2_PLR2_SU32_SUM0_SUS256_SKXCCM0_VWA4_VWB2_WGM1_WGMXCC1_WGMXCCGn1
    SolutionIndex: 26
    SolutionNameMin: Cijk_Ailk_Bjlk_BBS_BH_UserArgs_MT64x64x64_MI16x16x1_SN_LDSB1_CLR1_GSU0_GSUC0_GSUWGMRR0_K1_LBSPPA512_LBSPPB512_LPA32_LPB32_MIWT2_2_PLR1_SU32_SUM0_SUS256_SKXCCM0_VWA2_VWB2_WGM1_WGMXCC1_WGMXCCGn1
    SolutionIndex: 27
    SolutionNameMin: Cijk_Ailk_Bjlk_BBS_BH_UserArgs_MT64x64x64_MI16x16x1_SN_LDSB1_CLR1_GSU0_GSUC0_GSUWGMRR0_K1_LBSPPA512_LBSPPB512_LPA32_LPB32_MIWT2_2_PLR2_SU32_SUM0_SUS256_SKXCCM0_VWA2_VWB2_WGM1_WGMXCC1_WGMXCCGn1
    SolutionIndex: 28
    SolutionNameMin: Cijk_Ailk_Bjlk_BBS_BH_UserArgs_MT64x32x64_MI16x16x1_SN_LDSB0_CLR1_GSU0_GSUC0_GSUWGMRR0_K1_LBSPPA512_LBSPPB256_LPA32_LPB16_MIWT2_1_PLR2_SU32_SUM0_SUS256_SKXCCM0_VWA2_VWB1_WGM1_WGMXCC1_WGMXCCGn1
    SolutionIndex: 29
    SolutionNameMin: Cijk_Ailk_Bjlk_BBS_BH_UserArgs_MT32x32x64_MI16x16x1_SN_LDSB0_CLR1_GSU0_GSUC0_GSUWGMRR0_K1_LBSPPA256_LBSPPB256_LPA16_LPB16_MIWT1_1_PLR1_SU32_SUM0_SUS256_SKXCCM0_VWA1_VWB1_WGM1_WGMXCC1_WGMXCCGn1
    SolutionIndex: 30
    SolutionNameMin: Cijk_Ailk_Bjlk_BBS_BH_UserArgs_MT32x32x64_MI16x16x1_SN_LDSB0_CLR1_GSU0_GSUC0_GSUWGMRR0_K1_LBSPPA256_LBSPPB256_LPA16_LPB16_MIWT1_1_PLR2_SU32_SUM0_SUS256_SKXCCM0_VWA1_VWB1_WGM1_WGMXCC1_WGMXCCGn1
    SolutionIndex: 31
    SolutionNameMin: Cijk_Ailk_Bjlk_BBS_BH_UserArgs_MT128x128x128_MI16x16x1_SN_LDSB1_CLR1_GSU0_GSUC0_GSUWGMRR0_K1_LBSPPA1024_LBSPPB1024_LPA0_LPB0_MIWT4_4_PLR1_SU32_SUM0_SUS256_SKXCCM0_VWA4_VWB4_WGM1_WGMXCC1_WGMXCCGn1
    SolutionIndex: 32
    SolutionNameMin: Cijk_Ailk_Bjlk_BBS_BH_UserArgs_MT128x128x128_MI16x16x1_SN_LDSB1_CLR1_GSU0_GSUC0_GSUWGMRR0_K1_LBSPPA1024_LBSPPB1024_LPA0_LPB0_MIWT4_4_PLR1_SU32_SUM0_SUS256_SKXCCM0_VWA4_VWB4_WGM2_WGMXCC1_WGMXCCGn1
    SolutionIndex: 33
    SolutionNameMin: Cijk_Ailk_Bjlk_BBS_BH_UserArgs_MT64x128x128_MI16x16x1_SN_LDSB1_CLR1_GSU0_GSUC0_GSUWGMRR0_K1_LBSPPA512_LBSPPB1024_LPA32_LPB0_MIWT2_4_PLR2_SU32_SUM0_SUS256_SKXCCM0_VWA2_VWB4_WGM1_WGMXCC1_WGMXCCGn1
    SolutionIndex: 34
    SolutionNameMin: Cijk_Ailk_Bjlk_BBS_BH_UserArgs_MT128x64x128_MI16x16x1_SN_LDSB1_CLR1_GSU0_GSUC0_GSUWGMRR0_K1_LBSPPA1024_LBSPPB512_LPA0_LPB32_MIWT4_2_PLR2_SU32_SUM0_SUS256_SKXCCM0_VWA4_VWB2_WGM1_WGMXCC1_WGMXCCGn1
    SolutionIndex: 35
    SolutionNameMin: Cijk_Ailk_Bjlk_BBS_BH_UserArgs_MT64x64x128_MI16x16x1_SN_LDSB1_CLR1_GSU0_GSUC0_GSUWGMRR0_K1_LBSPPA512_LBSPPB512_LPA32_LPB32_MIWT2_2_PLR2_SU32_SUM0_SUS256_SKXCCM0_VWA2_VWB2_WGM1_WGMXCC1_WGMXCCGn1
    SolutionIndex: 36
    SolutionNameMin: Cijk_Ailk_Bjlk_BBS_BH_UserArgs_MT64x64x128_MI16x16x1_SN_LDSB1_CLR1_GSU0_GSUC0_GSUWGMRR0_K1_LBSPPA512_LBSPPB512_LPA32_LPB32_MIWT2_2_PLR2_SU32_SUM0_SUS256_SKXCCM0_VWA2_VWB2_WGM2_WGMXCC1_WGMXCCGn1
    SolutionIndex: 37
    SolutionNameMin: Cijk_Ailk_Bjlk_BBS_BH_UserArgs_MT64x32x128_MI16x16x1_SN_LDSB1_CLR1_GSU0_GSUC0_GSUWGMRR0_K1_LBSPPA512_LBSPPB256_LPA32_LPB16_MIWT2_1_PLR2_SU32_SUM0_SUS256_SKXCCM0_VWA2_VWB1_WGM1_WGMXCC1_WGMXCCGn1
    SolutionIndex: 38
    SolutionNameMin: Cijk_Ailk_Bjlk_BBS_BH_UserArgs_MT32x32x128_MI16x16x1_SN_LDSB1_CLR1_GSU0_GSUC0_GSUWGMRR0_K1_LBSPPA256_LBSPPB256_LPA16_LPB16_MIWT1_1_PLR1_SU32_SUM0_SUS256_SKXCCM0_VWA1_VWB1_WGM1_WGMXCC1_WGMXCCGn1
    SolutionIndex: 39
    SolutionNameMin: Cijk_Ailk_Bjlk_BBS_BH_UserArgs_MT32x32x128_MI16x16x1_SN_LDSB1_CLR1_GSU0_GSUC0_GSUWGMRR0_K1_LBSPPA256_LBSPPB256_LPA16_LPB16_MIWT1_1_PLR2_SU32_SUM0_SUS256_SKXCCM0_VWA1_VWB1_WGM1_WGMXCC1_WGMXCCGn1
    SolutionIndex: 40
    SolutionNameMin: Cijk_Ailk_Bjlk_BBS_BH_UserArgs_MT256x256x32_MI16x16x1_SN_LDSB1_CLR1_GSU0_GSUC0_GSUWGMRR0_K1_LBSPPA2048_LBSPPB2048_LPA0_LPB16_MIWT8_8_PLR1_SU32_SUM0_SUS256_SKXCCM4_VWA4_VWB1_WGM1_WGMXCC1_WGMXCCGn1
    SolutionIndex: 41
    SolutionNameMin: Cijk_Ailk_Bjlk_BBS_BH_UserArgs_MT256x256x32_MI16x16x1_SN_LDSB1_CLR1_GSU0_GSUC0_GSUWGMRR0_K1_LBSPPA2048_LBSPPB2048_LPA0_LPB32_MIWT8_8_PLR1_SU32_SUM0_SUS256_SKXCCM4_VWA4_VWB2_WGM1_WGMXCC1_WGMXCCGn1
    SolutionIndex: 42
    SolutionNameMin: Cijk_Ailk_Bjlk_BBS_BH_UserArgs_MT256x256x32_MI16x16x1_SN_LDSB1_CLR1_GSU0_GSUC0_GSUWGMRR0_K1_LBSPPA2048_LBSPPB2048_LPA0_LPB32_MIWT8_8_PLR1_SU32_SUM0_SUS256_SKXCCM4_VWA8_VWB2_WGM1_WGMXCC1_WGMXCCGn1
    SolutionIndex: 43
    SolutionNameMin: Cijk_Ailk_Bjlk_BBS_BH_UserArgs_MT256x256x32_MI16x16x1_SN_LDSB0_CLR1_GSU0_GSUC0_GSUWGMRR0_K1_LBSPPA2048_LBSPPB2048_LPA0_LPB0_MIWT8_8_PLR1_SU32_SUM0_SUS256_SKXCCM4_VWA4_VWB4_WGM1_WGMXCC1_WGMXCCGn1
    SolutionIndex: 44
    SolutionNameMin: Cijk_Ailk_Bjlk_BBS_BH_UserArgs_MT256x256x32_MI16x16x1_SN_LDSB0_CLR1_GSU0_GSUC0_GSUWGMRR0_K1_LBSPPA2048_LBSPPB2048_LPA0_LPB0_MIWT8_8_PLR1_SU32_SUM0_SUS256_SKXCCM4_VWA8_VWB4_WGM1_WGMXCC1_WGMXCCGn1
    SolutionIndex: 45
    SolutionNameMin: Cijk_Ailk_Bjlk_BBS_BH_UserArgs_MT256x256x32_MI16x16x1_SN_LDSB0_CLR1_GSU0_GSUC0_GSUWGMRR0_K1_LBSPPA2048_LBSPPB2048_LPA0_LPB0_MIWT8_8_PLR1_SU32_SUM0_SUS256_SKXCCM4_VWA4_VWB8_WGM1_WGMXCC1_WGMXCCGn1
    SolutionIndex: 46
    SolutionNameMin: Cijk_Ailk_Bjlk_BBS_BH_UserArgs_MT256x256x32_MI16x16x1_SN_LDSB0_CLR1_GSU0_GSUC0_GSUWGMRR0_K1_LBSPPA2048_LBSPPB2048_LPA0_LPB0_MIWT8_8_PLR1_SU32_SUM0_SUS256_SKXCCM4_VWA8_VWB8_WGM1_WGMXCC1_WGMXCCGn1
    SolutionIndex: 47
    SolutionNameMin: Cijk_Ailk_Bjlk_BBS_BH_UserArgs_MT256x256x32_MI16x16x1_SN_LDSB1_CLR1_GSU0_GSUC0_GSUWGMRR0_K1_LBSPPA2048_LBSPPB2048_LPA0_LPB32_MIWT8_8_PLR1_SU32_SUM0_SUS256_SKXCCM4_VWA4_VWB2_WGM2_WGMXCC1_WGMXCCGn1
    SolutionIndex: 48
    SolutionNameMin: Cijk_Ailk_Bjlk_BBS_BH_UserArgs_MT256x256x32_MI16x16x1_SN_LDSB0_CLR1_GSU0_GSUC0_GSUWGMRR0_K1_LBSPPA2048_LBSPPB2048_LPA0_LPB0_MIWT8_8_PLR1_SU32_SUM0_SUS256_SKXCCM4_VWA4_VWB8_WGM2_WGMXCC1_WGMXCCGn1
    SolutionIndex: 49
    SolutionNameMin: Cijk_Ailk_Bjlk_BBS_BH_UserArgs_MT256x256x32_MI16x16x1_SN_LDSB0_CLR1_GSU0_GSUC0_GSUWGMRR0_K1_LBSPPA2048_LBSPPB2048_LPA0_LPB0_MIWT8_8_PLR1_SU32_SUM0_SUS256_SKXCCM4_VWA8_VWB8_WGM2_WGMXCC1_WGMXCCGn1
    SolutionIndex: 50
    SolutionNameMin: Cijk_Ailk_Bjlk_BBS_BH_UserArgs_MT256x256x32_MI16x16x1_SN_LDSB1_CLR1_GSU0_GSUC0_GSUWGMRR0_K1_LBSPPA2048_LBSPPB2048_LPA0_LPB32_MIWT8_8_PLR1_SU32_SUM0_SUS256_SKXCCM4_VWA4_VWB2_WGM4_WGMXCC1_WGMXCCGn1
    SolutionIndex: 51
    SolutionNameMin: Cijk_Ailk_Bjlk_BBS_BH_UserArgs_MT256x256x32_MI16x16x1_SN_LDSB0_CLR1_GSU0_GSUC0_GSUWGMRR0_K1_LBSPPA2048_LBSPPB2048_LPA0_LPB0_MIWT8_8_PLR1_SU32_SUM0_SUS256_SKXCCM4_VWA4_VWB4_WGM4_WGMXCC1_WGMXCCGn1
    SolutionIndex: 52
    SolutionNameMin: Cijk_Ailk_Bjlk_BBS_BH_UserArgs_MT256x256x32_MI16x16x1_SN_LDSB0_CLR1_GSU0_GSUC0_GSUWGMRR0_K1_LBSPPA2048_LBSPPB2048_LPA0_LPB0_MIWT8_8_PLR1_SU32_SUM0_SUS256_SKXCCM4_VWA8_VWB4_WGM4_WGMXCC1_WGMXCCGn1
    SolutionIndex: 53
    SolutionNameMin: Cijk_Ailk_Bjlk_BBS_BH_UserArgs_MT256x256x32_MI16x16x1_SN_LDSB0_CLR1_GSU0_GSUC0_GSUWGMRR0_K1_LBSPPA2048_LBSPPB2048_LPA0_LPB0_MIWT8_8_PLR1_SU32_SUM0_SUS256_SKXCCM4_VWA4_VWB8_WGM4_WGMXCC1_WGMXCCGn1
    SolutionIndex: 54
    SolutionNameMin: Cijk_Ailk_Bjlk_BBS_BH_UserArgs_MT256x256x32_MI16x16x1_SN_LDSB0_CLR1_GSU0_GSUC0_GSUWGMRR0_K1_LBSPPA2048_LBSPPB2048_LPA0_LPB0_MIWT8_8_PLR1_SU32_SUM0_SUS256_SKXCCM4_VWA8_VWB8_WGM4_WGMXCC1_WGMXCCGn1
    SolutionIndex: 55
    SolutionNameMin: Cijk_Ailk_Bjlk_BBS_BH_UserArgs_MT128x256x32_MI16x16x1_SN_LDSB1_CLR1_GSU0_GSUC0_GSUWGMRR0_K1_LBSPPA1024_LBSPPB2048_LPA0_LPB0_MIWT4_8_PLR1_SU32_SUM0_SUS256_SKXCCM4_VWA4_VWB8_WGM1_WGMXCC1_WGMXCCGn1
    SolutionIndex: 56
    SolutionNameMin: Cijk_Ailk_Bjlk_BBS_BH_UserArgs_MT128x256x32_MI16x16x1_SN_LDSB1_CLR1_GSU0_GSUC0_GSUWGMRR0_K1_LBSPPA1024_LBSPPB2048_LPA0_LPB0_MIWT4_8_PLR1_SU32_SUM0_SUS256_SKXCCM4_VWA4_VWB8_WGM2_WGMXCC1_WGMXCCGn1
    SolutionIndex: 57
    SolutionNameMin: Cijk_Ailk_Bjlk_BBS_BH_UserArgs_MT128x256x32_MI16x16x1_SN_LDSB1_CLR1_GSU0_GSUC0_GSUWGMRR0_K1_LBSPPA1024_LBSPPB2048_LPA0_LPB0_MIWT4_8_PLR1_SU32_SUM0_SUS256_SKXCCM4_VWA4_VWB8_WGM4_WGMXCC1_WGMXCCGn1
    SolutionIndex: 58
    SolutionNameMin: Cijk_Ailk_Bjlk_BBS_BH_UserArgs_MT256x128x32_MI16x16x1_SN_LDSB1_CLR1_GSU0_GSUC0_GSUWGMRR0_K1_LBSPPA2048_LBSPPB1024_LPA0_LPB16_MIWT8_4_PLR1_SU32_SUM0_SUS256_SKXCCM4_VWA8_VWB1_WGM1_WGMXCC1_WGMXCCGn1
    SolutionIndex: 59
    SolutionNameMin: Cijk_Ailk_Bjlk_BBS_BH_UserArgs_MT256x128x32_MI16x16x1_SN_LDSB1_CLR1_GSU0_GSUC0_GSUWGMRR0_K1_LBSPPA2048_LBSPPB1024_LPA0_LPB32_MIWT8_4_PLR1_SU32_SUM0_SUS256_SKXCCM4_VWA8_VWB2_WGM1_WGMXCC1_WGMXCCGn1
    SolutionIndex: 60
    SolutionNameMin: Cijk_Ailk_Bjlk_BBS_BH_UserArgs_MT256x128x32_MI16x16x1_SN_LDSB1_CLR1_GSU0_GSUC0_GSUWGMRR0_K1_LBSPPA2048_LBSPPB1024_LPA0_LPB0_MIWT8_4_PLR1_SU32_SUM0_SUS256_SKXCCM4_VWA4_VWB4_WGM1_WGMXCC1_WGMXCCGn1
    SolutionIndex: 61
    SolutionNameMin: Cijk_Ailk_Bjlk_BBS_BH_UserArgs_MT256x64x32_MI16x16x1_SN_LDSB1_CLR1_GSU0_GSUC0_GSUWGMRR0_K1_LBSPPA2048_LBSPPB512_LPA0_LPB32_MIWT8_2_PLR1_SU32_SUM0_SUS256_SKXCCM4_VWA8_VWB2_WGM1_WGMXCC1_WGMXCCGn1
    SolutionIndex: 62
    SolutionNameMin: Cijk_Ailk_Bjlk_BBS_BH_UserArgs_MT128x128x32_MI16x16x1_SN_LDSB0_CLR1_GSU0_GSUC0_GSUWGMRR0_K1_LBSPPA1024_LBSPPB1024_LPA0_LPB0_MIWT4_4_PLR1_SU32_SUM0_SUS256_SKXCCM4_VWA4_VWB4_WGM1_WGMXCC1_WGMXCCGn1
    SolutionIndex: 63
    SolutionNameMin: Cijk_Ailk_Bjlk_BBS_BH_UserArgs_MT128x64x32_MI16x16x1_SN_LDSB0_CLR1_GSU0_GSUC0_GSUWGMRR0_K1_LBSPPA1024_LBSPPB512_LPA0_LPB16_MIWT4_2_PLR1_SU32_SUM0_SUS256_SKXCCM4_VWA4_VWB1_WGM1_WGMXCC1_WGMXCCGn1
    SolutionIndex: 64
    SolutionNameMin: Cijk_Ailk_Bjlk_BBS_BH_UserArgs_MT128x64x32_MI16x16x1_SN_LDSB0_CLR1_GSU0_GSUC0_GSUWGMRR0_K1_LBSPPA1024_LBSPPB512_LPA32_LPB32_MIWT4_2_PLR1_SU32_SUM0_SUS256_SKXCCM4_VWA2_VWB2_WGM1_WGMXCC1_WGMXCCGn1
    SolutionIndex: 65
    SolutionNameMin: Cijk_Ailk_Bjlk_BBS_BH_UserArgs_MT128x64x32_MI16x16x1_SN_LDSB0_CLR1_GSU0_GSUC0_GSUWGMRR0_K1_LBSPPA1024_LBSPPB512_LPA0_LPB32_MIWT4_2_PLR1_SU32_SUM0_SUS256_SKXCCM4_VWA4_VWB2_WGM1_WGMXCC1_WGMXCCGn1
    SolutionIndex: 66
    SolutionNameMin: Cijk_Ailk_Bjlk_BBS_BH_UserArgs_MT32x32x32_MI16x16x1_SN_LDSB0_CLR1_GSU0_GSUC0_GSUWGMRR0_K1_LBSPPA256_LBSPPB256_LPA16_LPB16_MIWT1_1_PLR1_SU32_SUM0_SUS256_SKXCCM4_VWA1_VWB1_WGM1_WGMXCC1_WGMXCCGn1
    SolutionIndex: 67
    SolutionNameMin: Cijk_Ailk_Bjlk_BBS_BH_UserArgs_MT32x32x32_MI16x16x1_SN_LDSB0_CLR0_GSU0_GSUC0_GSUWGMRR0_K1_LBSPPA256_LBSPPB256_LPA16_LPB16_MIWT1_1_PLR0_SU32_SUM0_SUS256_SKXCCM4_VWA1_VWB1_WGM1_WGMXCC1_WGMXCCGn1
    SolutionIndex: 68
    SolutionNameMin: Cijk_Ailk_Bjlk_BBS_BH_UserArgs_MT256x256x64_MI16x16x1_SN_LDSB1_CLR1_GSU0_GSUC0_GSUWGMRR0_K1_LBSPPA2048_LBSPPB2048_LPA0_LPB0_MIWT8_8_PLR1_SU32_SUM0_SUS256_SKXCCM4_VWA4_VWB4_WGM1_WGMXCC1_WGMXCCGn1
    SolutionIndex: 69
    SolutionNameMin: Cijk_Ailk_Bjlk_BBS_BH_UserArgs_MT256x256x64_MI16x16x1_SN_LDSB1_CLR1_GSU0_GSUC0_GSUWGMRR0_K1_LBSPPA2048_LBSPPB2048_LPA0_LPB0_MIWT8_8_PLR2_SU32_SUM0_SUS256_SKXCCM4_VWA4_VWB4_WGM1_WGMXCC1_WGMXCCGn1
    SolutionIndex: 70
    SolutionNameMin: Cijk_Ailk_Bjlk_BBS_BH_UserArgs_MT256x256x64_MI16x16x1_SN_LDSB1_CLR1_GSU0_GSUC0_GSUWGMRR0_K1_LBSPPA2048_LBSPPB2048_LPA0_LPB0_MIWT8_8_PLR2_SU32_SUM0_SUS256_SKXCCM4_VWA8_VWB8_WGM1_WGMXCC1_WGMXCCGn1
    SolutionIndex: 71
    SolutionNameMin: Cijk_Ailk_Bjlk_BBS_BH_UserArgs_MT256x256x64_MI16x16x1_SN_LDSB1_CLR1_GSU0_GSUC0_GSUWGMRR0_K1_LBSPPA2048_LBSPPB2048_LPA0_LPB0_MIWT8_8_PLR2_SU32_SUM0_SUS256_SKXCCM4_VWA4_VWB4_WGM2_WGMXCC1_WGMXCCGn1
    SolutionIndex: 72
    SolutionNameMin: Cijk_Ailk_Bjlk_BBS_BH_UserArgs_MT256x128x64_MI16x16x1_SN_LDSB1_CLR1_GSU0_GSUC0_GSUWGMRR0_K1_LBSPPA2048_LBSPPB1024_LPA32_LPB0_MIWT8_4_PLR1_SU32_SUM0_SUS256_SKXCCM4_VWA2_VWB4_WGM1_WGMXCC1_WGMXCCGn1
    SolutionIndex: 73
    SolutionNameMin: Cijk_Ailk_Bjlk_BBS_BH_UserArgs_MT256x128x64_MI16x16x1_SN_LDSB1_CLR1_GSU0_GSUC0_GSUWGMRR0_K1_LBSPPA2048_LBSPPB1024_LPA0_LPB0_MIWT8_4_PLR1_SU32_SUM0_SUS256_SKXCCM4_VWA4_VWB4_WGM1_WGMXCC1_WGMXCCGn1
    SolutionIndex: 74
    SolutionNameMin: Cijk_Ailk_Bjlk_BBS_BH_UserArgs_MT256x128x64_MI16x16x1_SN_LDSB1_CLR1_GSU0_GSUC0_GSUWGMRR0_K1_LBSPPA2048_LBSPPB1024_LPA32_LPB0_MIWT8_4_PLR1_SU32_SUM0_SUS256_SKXCCM4_VWA2_VWB4_WGM4_WGMXCC1_WGMXCCGn1
    SolutionIndex: 75
    SolutionNameMin: Cijk_Ailk_Bjlk_BBS_BH_UserArgs_MT128x128x64_MI16x16x1_SN_LDSB1_CLR1_GSU0_GSUC0_GSUWGMRR0_K1_LBSPPA1024_LBSPPB1024_LPA0_LPB0_MIWT4_4_PLR1_SU32_SUM0_SUS256_SKXCCM4_VWA4_VWB4_WGM1_WGMXCC1_WGMXCCGn1
    SolutionIndex: 76
    SolutionNameMin: Cijk_Ailk_Bjlk_BBS_BH_UserArgs_MT128x128x64_MI16x16x1_SN_LDSB1_CLR1_GSU0_GSUC0_GSUWGMRR0_K1_LBSPPA1024_LBSPPB1024_LPA0_LPB0_MIWT4_4_PLR1_SU32_SUM0_SUS256_SKXCCM4_VWA4_VWB4_WGM2_WGMXCC1_WGMXCCGn1
    SolutionIndex: 77
    SolutionNameMin: Cijk_Ailk_Bjlk_BBS_BH_UserArgs_MT128x128x64_MI16x16x1_SN_LDSB1_CLR1_GSU0_GSUC0_GSUWGMRR0_K1_LBSPPA1024_LBSPPB1024_LPA0_LPB0_MIWT4_4_PLR1_SU32_SUM0_SUS256_SKXCCM4_VWA4_VWB4_WGM4_WGMXCC1_WGMXCCGn1
    SolutionIndex: 78
    SolutionNameMin: Cijk_Ailk_Bjlk_BBS_BH_UserArgs_MT128x64x64_MI16x16x1_SN_LDSB1_CLR1_GSU0_GSUC0_GSUWGMRR0_K1_LBSPPA1024_LBSPPB512_LPA0_LPB32_MIWT4_2_PLR1_SU32_SUM0_SUS256_SKXCCM4_VWA4_VWB2_WGM1_WGMXCC1_WGMXCCGn1
    SolutionIndex: 79
    SolutionNameMin: Cijk_Ailk_Bjlk_BBS_BH_UserArgs_MT128x64x64_MI16x16x1_SN_LDSB1_CLR1_GSU0_GSUC0_GSUWGMRR0_K1_LBSPPA1024_LBSPPB512_LPA0_LPB32_MIWT4_2_PLR2_SU32_SUM0_SUS256_SKXCCM4_VWA4_VWB2_WGM1_WGMXCC1_WGMXCCGn1
    SolutionIndex: 80
    SolutionNameMin: Cijk_Ailk_Bjlk_BBS_BH_UserArgs_MT64x64x64_MI16x16x1_SN_LDSB1_CLR1_GSU0_GSUC0_GSUWGMRR0_K1_LBSPPA512_LBSPPB512_LPA32_LPB32_MIWT2_2_PLR1_SU32_SUM0_SUS256_SKXCCM4_VWA2_VWB2_WGM1_WGMXCC1_WGMXCCGn1
    SolutionIndex: 81
    SolutionNameMin: Cijk_Ailk_Bjlk_BBS_BH_UserArgs_MT64x64x64_MI16x16x1_SN_LDSB1_CLR1_GSU0_GSUC0_GSUWGMRR0_K1_LBSPPA512_LBSPPB512_LPA32_LPB32_MIWT2_2_PLR2_SU32_SUM0_SUS256_SKXCCM4_VWA2_VWB2_WGM1_WGMXCC1_WGMXCCGn1
    SolutionIndex: 82
    SolutionNameMin: Cijk_Ailk_Bjlk_BBS_BH_UserArgs_MT64x64x64_MI16x16x1_SN_LDSB1_CLR1_GSU0_GSUC0_GSUWGMRR0_K1_LBSPPA512_LBSPPB512_LPA32_LPB32_MIWT2_2_PLR2_SU32_SUM0_SUS256_SKXCCM4_VWA2_VWB2_WGM4_WGMXCC1_WGMXCCGn1
    SolutionIndex: 83
    SolutionNameMin: Cijk_Ailk_Bjlk_BBS_BH_UserArgs_MT32x64x64_MI16x16x1_SN_LDSB0_CLR1_GSU0_GSUC0_GSUWGMRR0_K1_LBSPPA256_LBSPPB512_LPA16_LPB32_MIWT1_2_PLR2_SU32_SUM0_SUS256_SKXCCM4_VWA1_VWB2_WGM1_WGMXCC1_WGMXCCGn1
    SolutionIndex: 84
    SolutionNameMin: Cijk_Ailk_Bjlk_BBS_BH_UserArgs_MT64x32x64_MI16x16x1_SN_LDSB0_CLR1_GSU0_GSUC0_GSUWGMRR0_K1_LBSPPA512_LBSPPB256_LPA32_LPB16_MIWT2_1_PLR2_SU32_SUM0_SUS256_SKXCCM4_VWA2_VWB1_WGM1_WGMXCC1_WGMXCCGn1
    SolutionIndex: 85
    SolutionNameMin: Cijk_Ailk_Bjlk_BBS_BH_UserArgs_MT32x32x64_MI16x16x1_SN_LDSB0_CLR1_GSU0_GSUC0_GSUWGMRR0_K1_LBSPPA256_LBSPPB256_LPA16_LPB16_MIWT1_1_PLR1_SU32_SUM0_SUS256_SKXCCM4_VWA1_VWB1_WGM1_WGMXCC1_WGMXCCGn1
    SolutionIndex: 86
    SolutionNameMin: Cijk_Ailk_Bjlk_BBS_BH_UserArgs_MT128x128x128_MI16x16x1_SN_LDSB1_CLR1_GSU0_GSUC0_GSUWGMRR0_K1_LBSPPA1024_LBSPPB1024_LPA0_LPB0_MIWT4_4_PLR1_SU32_SUM0_SUS256_SKXCCM4_VWA4_VWB4_WGM1_WGMXCC1_WGMXCCGn1
    SolutionIndex: 87
    SolutionNameMin: Cijk_Ailk_Bjlk_BBS_BH_UserArgs_MT128x128x128_MI16x16x1_SN_LDSB1_CLR1_GSU0_GSUC0_GSUWGMRR0_K1_LBSPPA1024_LBSPPB1024_LPA0_LPB0_MIWT4_4_PLR1_SU32_SUM0_SUS256_SKXCCM4_VWA4_VWB4_WGM2_WGMXCC1_WGMXCCGn1
    SolutionIndex: 88
    SolutionNameMin: Cijk_Ailk_Bjlk_BBS_BH_UserArgs_MT128x64x128_MI16x16x1_SN_LDSB1_CLR1_GSU0_GSUC0_GSUWGMRR0_K1_LBSPPA1024_LBSPPB512_LPA0_LPB32_MIWT4_2_PLR2_SU32_SUM0_SUS256_SKXCCM4_VWA4_VWB2_WGM1_WGMXCC1_WGMXCCGn1
    SolutionIndex: 89
    SolutionNameMin: Cijk_Ailk_Bjlk_BBS_BH_UserArgs_MT128x64x128_MI16x16x1_SN_LDSB1_CLR1_GSU0_GSUC0_GSUWGMRR0_K1_LBSPPA1024_LBSPPB512_LPA0_LPB32_MIWT4_2_PLR2_SU32_SUM0_SUS256_SKXCCM4_VWA4_VWB2_WGM4_WGMXCC1_WGMXCCGn1
    SolutionIndex: 90
    SolutionNameMin: Cijk_Ailk_Bjlk_BBS_BH_UserArgs_MT64x64x128_MI16x16x1_SN_LDSB1_CLR1_GSU0_GSUC0_GSUWGMRR0_K1_LBSPPA512_LBSPPB512_LPA32_LPB32_MIWT2_2_PLR2_SU32_SUM0_SUS256_SKXCCM4_VWA2_VWB2_WGM1_WGMXCC1_WGMXCCGn1
    SolutionIndex: 91
    SolutionNameMin: Cijk_Ailk_Bjlk_BBS_BH_UserArgs_MT32x64x128_MI16x16x1_SN_LDSB1_CLR1_GSU0_GSUC0_GSUWGMRR0_K1_LBSPPA256_LBSPPB512_LPA16_LPB32_MIWT1_2_PLR2_SU32_SUM0_SUS256_SKXCCM4_VWA1_VWB2_WGM1_WGMXCC1_WGMXCCGn1
    SolutionIndex: 92
    SolutionNameMin: Cijk_Ailk_Bjlk_BBS_BH_UserArgs_MT64x32x128_MI16x16x1_SN_LDSB1_CLR1_GSU0_GSUC0_GSUWGMRR0_K1_LBSPPA512_LBSPPB256_LPA32_LPB16_MIWT2_1_PLR2_SU32_SUM0_SUS256_SKXCCM4_VWA2_VWB1_WGM1_WGMXCC1_WGMXCCGn1
    SolutionIndex: 93
    SolutionNameMin: Cijk_Ailk_Bjlk_BBS_BH_UserArgs_MT64x32x128_MI16x16x1_SN_LDSB1_CLR1_GSU0_GSUC0_GSUWGMRR0_K1_LBSPPA512_LBSPPB256_LPA32_LPB16_MIWT2_1_PLR2_SU32_SUM0_SUS256_SKXCCM4_VWA2_VWB1_WGM2_WGMXCC1_WGMXCCGn1
    SolutionIndex: 94
    SolutionNameMin: Cijk_Ailk_Bjlk_BBS_BH_UserArgs_MT32x32x32_MI16x16x1_SN_LDSB0_CLR0_GSU0_GSUC0_GSUWGMRR0_K1_LBSPPA256_LBSPPB256_LPA16_LPB16_MIWT1_1_PLR0_SU32_SUM0_SUS256_SKXCCM4_VWA1_VWB1_WGM1_WGMXCC1_WGMXCCGn1
- - - [128, 128, 1, 128, 128, 128, 128, 128]
    - [66, 0.082]
  - - [128, 128, 1, 256, 128, 128, 128, 128]
    - [30, 0.145]
  - - [128, 128, 1, 512, 128, 128, 128, 128]
    - [29, 0.235]
  - - [128, 128, 1, 1024, 128, 128, 128, 128]
    - [29, 0.343]
  - - [128, 128, 1, 2048, 128, 128, 128, 128]
    - [15, 0.558]
  - - [128, 128, 1, 4096, 128, 128, 128, 128]
    - [29, 0.948]
  - - [128, 128, 1, 8192, 128, 128, 128, 128]
    - [39, 1.35]
  - - [128, 256, 1, 128, 128, 128, 128, 256]
    - [30, 0.161]
  - - [128, 256, 1, 256, 128, 128, 128, 256]
    - [30, 0.289]
  - - [128, 256, 1, 512, 128, 128, 128, 256]
    - [30, 0.457]
  - - [128, 256, 1, 1024, 128, 128, 128, 256]
    - [29, 0.676]
  - - [128, 256, 1, 2048, 128, 128, 128, 256]
    - [38, 1.047]
  - - [128, 256, 1, 4096, 128, 128, 128, 256]
    - [83, 1.65]
  - - [128, 256, 1, 8192, 128, 128, 128, 256]
    - [91, 2.428]
  - - [128, 512, 1, 128, 128, 128, 128, 512]
    - [30, 0.321]
  - - [128, 512, 1, 256, 128, 128, 128, 512]
    - [30, 0.569]
  - - [128, 512, 1, 512, 128, 128, 128, 512]
    - [29, 0.919]
  - - [128, 512, 1, 1024, 128, 128, 128, 512]
    - [29, 1.323]
  - - [128, 512, 1, 2048, 128, 128, 128, 512]
    - [37, 1.887]
  - - [128, 512, 1, 4096, 128, 128, 128, 512]
    - [82, 2.735]
  - - [128, 512, 1, 8192, 128, 128, 128, 512]
    - [90, 4.062]
  - - [128, 1024, 1, 128, 128, 128, 128, 1024]
    - [84, 0.599]
  - - [128, 1024, 1, 256, 128, 128, 128, 1024]
    - [28, 1.049]
  - - [128, 1024, 1, 512, 128, 128, 128, 1024]
    - [92, 1.672]
  - - [128, 1024, 1, 1024, 128, 128, 128, 1024]
    - [37, 2.423]
  - - [128, 1024, 1, 2048, 128, 128, 128, 1024]
    - [35, 3.175]
  - - [128, 1024, 1, 4096, 128, 128, 128, 1024]
    - [35, 4.435]
  - - [128, 1024, 1, 8192, 128, 128, 128, 1024]
    - [34, 6.088]
  - - [128, 2048, 1, 128, 128, 128, 128, 2048]
    - [26, 1.091]
  - - [128, 2048, 1, 256, 128, 128, 128, 2048]
    - [27, 1.888]
  - - [128, 2048, 1, 512, 128, 128, 128, 2048]
    - [35, 2.958]
  - - [128, 2048, 1, 1024, 128, 128, 128, 2048]
    - [90, 4.194]
  - - [128, 2048, 1, 2048, 128, 128, 128, 2048]
    - [90, 5.174]
  - - [128, 2048, 1, 4096, 128, 128, 128, 2048]
    - [75, 6.878]
  - - [128, 2048, 1, 8192, 128, 128, 128, 2048]
    - [23, 9.499]
  - - [128, 4096, 1, 128, 128, 128, 128, 4096]
    - [63, 1.857]
  - - [128, 4096, 1, 256, 128, 128, 128, 4096]
    - [65, 3.032]
  - - [128, 4096, 1, 512, 128, 128, 128, 4096]
    - [79, 4.562]
  - - [128, 4096, 1, 1024, 128, 128, 128, 4096]
    - [88, 6.134]
  - - [128, 4096, 1, 2048, 128, 128, 128, 4096]
    - [75, 7.796]
  - - [128, 4096, 1, 4096, 128, 128, 128, 4096]
    - [75, 10.255]
  - - [128, 4096, 1, 8192, 128, 128, 128, 4096]
    - [23, 12.882]
  - - [128, 8192, 1, 128, 128, 128, 128, 8192]
    - [62, 2.825]
  - - [128, 8192, 1, 256, 128, 128, 128, 8192]
    - [75, 4.636]
  - - [128, 8192, 1, 512, 128, 128, 128, 8192]
    - [75, 7.028]
  - - [128, 8192, 1, 1024, 128, 128, 128, 8192]
    - [75, 9.316]
  - - [128, 8192, 1, 2048, 128, 128, 128, 8192]
    - [86, 11.222]
  - - [128, 8192, 1, 4096, 128, 128, 128, 8192]
    - [24, 13.088]
  - - [128, 8192, 1, 8192, 128, 128, 128, 8192]
    - [31, 14.737]
  - - [256, 128, 1, 128, 256, 256, 256, 128]
    - [30, 0.163]
  - - [256, 128, 1, 256, 256, 256, 256, 128]
    - [30, 0.288]
  - - [256, 128, 1, 512, 256, 256, 256, 128]
    - [29, 0.463]
  - - [256, 128, 1, 1024, 256, 256, 256, 128]
    - [29, 0.676]
  - - [256, 128, 1, 2048, 256, 256, 256, 128]
    - [29, 1.046]
  - - [256, 128, 1, 4096, 256, 256, 256, 128]
    - [84, 1.659]
  - - [256, 128, 1, 8192, 256, 256, 256, 128]
    - [93, 2.369]
  - - [256, 256, 1, 128, 256, 256, 256, 256]
    - [67, 0.321]
  - - [256, 256, 1, 256, 256, 256, 256, 256]
    - [85, 0.555]
  - - [256, 256, 1, 512, 256, 256, 256, 256]
    - [29, 0.912]
  - - [256, 256, 1, 1024, 256, 256, 256, 256]
    - [38, 1.314]
  - - [256, 256, 1, 2048, 256, 256, 256, 256]
    - [37, 1.882]
  - - [256, 256, 1, 4096, 256, 256, 256, 256]
    - [81, 2.69]
  - - [256, 256, 1, 8192, 256, 256, 256, 256]
    - [36, 3.804]
  - - [256, 512, 1, 128, 256, 256, 256, 512]
    - [28, 0.6]
  - - [256, 512, 1, 256, 256, 256, 256, 512]
    - [84, 1.045]
  - - [256, 512, 1, 512, 256, 256, 256, 512]
    - [37, 1.671]
  - - [256, 512, 1, 1024, 256, 256, 256, 512]
    - [92, 2.411]
  - - [256, 512, 1, 2048, 256, 256, 256, 512]
    - [90, 3.225]
  - - [256, 512, 1, 4096, 256, 256, 256, 512]
    - [35, 4.419]
  - - [256, 512, 1, 8192, 256, 256, 256, 512]
    - [25, 6.071]
  - - [256, 1024, 1, 128, 256, 256, 256, 1024]
    - [80, 1.096]
  - - [256, 1024, 1, 256, 256, 256, 256, 1024]
    - [27, 1.882]
  - - [256, 1024, 1, 512, 256, 256, 256, 1024]
    - [35, 2.956]
  - - [256, 1024, 1, 1024, 256, 256, 256, 1024]
    - [35, 4.222]
  - - [256, 1024, 1, 2048, 256, 256, 256, 1024]
    - [36, 5.246]
  - - [256, 1024, 1, 4096, 256, 256, 256, 1024]
    - [23, 6.802]
  - - [256, 1024, 1, 8192, 256, 256, 256, 1024]
    - [23, 9.503]
  - - [256, 2048, 1, 128, 256, 256, 256, 2048]
    - [63, 1.854]
  - - [256, 2048, 1, 256, 256, 256, 256, 2048]
    - [79, 3.023]
  - - [256, 2048, 1, 512, 256, 256, 256, 2048]
    - [79, 4.541]
  - - [256, 2048, 1, 1024, 256, 256, 256, 2048]
    - [88, 6.131]
  - - [256, 2048, 1, 2048, 256, 256, 256, 2048]
    - [75, 7.696]
  - - [256, 2048, 1, 4096, 256, 256, 256, 2048]
    - [23, 10.217]
  - - [256, 2048, 1, 8192, 256, 256, 256, 2048]
    - [75, 12.86]
  - - [256, 4096, 1, 128, 256, 256, 256, 4096]
    - [62, 2.837]
  - - [256, 4096, 1, 256, 256, 256, 256, 4096]
    - [75, 4.67]
  - - [256, 4096, 1, 512, 256, 256, 256, 4096]
    - [75, 7.021]
  - - [256, 4096, 1, 1024, 256, 256, 256, 4096]
    - [75, 9.405]
  - - [256, 4096, 1, 2048, 256, 256, 256, 4096]
    - [86, 11.215]
  - - [256, 4096, 1, 4096, 256, 256, 256, 4096]
    - [75, 13.087]
  - - [256, 4096, 1, 8192, 256, 256, 256, 4096]
    - [22, 14.781]
  - - [256, 8192, 1, 128, 256, 256, 256, 8192]
    - [58, 4.064]
  - - [256, 8192, 1, 256, 256, 256, 256, 8192]
    - [58, 6.387]
  - - [256, 8192, 1, 512, 256, 256, 256, 8192]
    - [58, 8.905]
  - - [256, 8192, 1, 1024, 256, 256, 256, 8192]
    - [72, 11.151]
  - - [256, 8192, 1, 2048, 256, 256, 256, 8192]
    - [60, 12.638]
  - - [256, 8192, 1, 4096, 256, 256, 256, 8192]
    - [13, 14.947]
  - - [256, 8192, 1, 8192, 256, 256, 256, 8192]
    - [48, 16.768]
  - - [512, 128, 1, 128, 512, 512, 512, 128]
    - [66, 0.322]
  - - [512, 128, 1, 256, 512, 512, 512, 128]
    - [30, 0.567]
  - - [512, 128, 1, 512, 512, 512, 512, 128]
    - [29, 0.908]
  - - [512, 128, 1, 1024, 512, 512, 512, 128]
    - [29, 1.315]
  - - [512, 128, 1, 2048, 512, 512, 512, 128]
    - [37, 1.888]
  - - [512, 128, 1, 4096, 512, 512, 512, 128]
    - [81, 2.711]
  - - [512, 128, 1, 8192, 512, 512, 512, 128]
    - [35, 3.828]
  - - [512, 256, 1, 128, 512, 512, 512, 256]
    - [84, 0.605]
  - - [512, 256, 1, 256, 512, 512, 512, 256]
    - [84, 1.054]
  - - [512, 256, 1, 512, 512, 512, 512, 256]
    - [37, 1.685]
  - - [512, 256, 1, 1024, 512, 512, 512, 256]
    - [37, 2.437]
  - - [512, 256, 1, 2048, 512, 512, 512, 256]
    - [90, 3.237]
  - - [512, 256, 1, 4096, 512, 512, 512, 256]
    - [79, 4.514]
  - - [512, 256, 1, 8192, 512, 512, 512, 256]
    - [25, 6.105]
  - - [512, 512, 1, 128, 512, 512, 512, 512]
    - [81, 1.097]
  - - [512, 512, 1, 256, 512, 512, 512, 512]
    - [80, 1.875]
  - - [512, 512, 1, 512, 512, 512, 512, 512]
    - [35, 2.952]
  - - [512, 512, 1, 1024, 512, 512, 512, 512]
    - [35, 4.22]
  - - [512, 512, 1, 2048, 512, 512, 512, 512]
    - [35, 5.296]
  - - [512, 512, 1, 4096, 512, 512, 512, 512]
    - [75, 6.963]
  - - [512, 512, 1, 8192, 512, 512, 512, 512]
    - [23, 9.482]
  - - [512, 1024, 1, 128, 512, 512, 512, 1024]
    - [64, 1.837]
  - - [512, 1024, 1, 256, 512, 512, 512, 1024]
    - [65, 3.043]
  - - [512, 1024, 1, 512, 512, 512, 512, 1024]
    - [79, 4.567]
  - - [512, 1024, 1, 1024, 512, 512, 512, 1024]
    - [88, 6.147]
  - - [512, 1024, 1, 2048, 512, 512, 512, 1024]
    - [23, 7.647]
  - - [512, 1024, 1, 4096, 512, 512, 512, 1024]
    - [23, 10.193]
  - - [512, 1024, 1, 8192, 512, 512, 512, 1024]
    - [76, 12.802]
  - - [512, 2048, 1, 128, 512, 512, 512, 2048]
    - [62, 2.829]
  - - [512, 2048, 1, 256, 512, 512, 512, 2048]
    - [77, 4.608]
  - - [512, 2048, 1, 512, 512, 512, 512, 2048]
    - [75, 7.042]
  - - [512, 2048, 1, 1024, 512, 512, 512, 2048]
    - [75, 9.413]
  - - [512, 2048, 1, 2048, 512, 512, 512, 2048]
    - [32, 11.079]
  - - [512, 2048, 1, 4096, 512, 512, 512, 2048]
    - [23, 13.023]
  - - [512, 2048, 1, 8192, 512, 512, 512, 2048]
    - [55, 14.729]
  - - [512, 4096, 1, 128, 512, 512, 512, 4096]
    - [59, 4.05]
  - - [512, 4096, 1, 256, 512, 512, 512, 4096]
    - [59, 6.388]
  - - [512, 4096, 1, 512, 512, 512, 512, 4096]
    - [58, 8.916]
  - - [512, 4096, 1, 1024, 512, 512, 512, 4096]
    - [72, 11.24]
  - - [512, 4096, 1, 2048, 512, 512, 512, 4096]
    - [60, 12.577]
  - - [512, 4096, 1, 4096, 512, 512, 512, 4096]
    - [57, 14.978]
  - - [512, 4096, 1, 8192, 512, 512, 512, 4096]
    - [53, 16.938]
  - - [512, 8192, 1, 128, 512, 512, 512, 8192]
    - [46, 5.097]
  - - [512, 8192, 1, 256, 512, 512, 512, 8192]
    - [46, 7.827]
  - - [512, 8192, 1, 512, 512, 512, 512, 8192]
    - [9, 10.674]
  - - [512, 8192, 1, 1024, 512, 512, 512, 8192]
    - [16, 13.001]
  - - [512, 8192, 1, 2048, 512, 512, 512, 8192]
    - [47, 14.5]
  - - [512, 8192, 1, 4096, 512, 512, 512, 8192]
    - [53, 17.028]
  - - [512, 8192, 1, 8192, 512, 512, 512, 8192]
    - [53, 18.87]
  - - [1024, 128, 1, 128, 1024, 1024, 1024, 128]
    - [28, 0.604]
  - - [1024, 128, 1, 256, 1024, 1024, 1024, 128]
    - [84, 1.066]
  - - [1024, 128, 1, 512, 1024, 1024, 1024, 128]
    - [37, 1.686]
  - - [1024, 128, 1, 1024, 1024, 1024, 1024, 128]
    - [92, 2.436]
  - - [1024, 128, 1, 2048, 1024, 1024, 1024, 128]
    - [35, 3.189]
  - - [1024, 128, 1, 4096, 1024, 1024, 1024, 128]
    - [35, 4.426]
  - - [1024, 128, 1, 8192, 1024, 1024, 1024, 128]
    - [25, 6.053]
  - - [1024, 256, 1, 128, 1024, 1024, 1024, 256]
    - [27, 1.098]
  - - [1024, 256, 1, 256, 1024, 1024, 1024, 256]
    - [27, 1.883]
  - - [1024, 256, 1, 512, 1024, 1024, 1024, 256]
    - [35, 2.944]
  - - [1024, 256, 1, 1024, 1024, 1024, 1024, 256]
    - [35, 4.202]
  - - [1024, 256, 1, 2048, 1024, 1024, 1024, 256]
    - [35, 5.312]
  - - [1024, 256, 1, 4096, 1024, 1024, 1024, 256]
    - [75, 6.862]
  - - [1024, 256, 1, 8192, 1024, 1024, 1024, 256]
    - [23, 9.477]
  - - [1024, 512, 1, 128, 1024, 1024, 1024, 512]
    - [65, 1.857]
  - - [1024, 512, 1, 256, 1024, 1024, 1024, 512]
    - [78, 3.025]
  - - [1024, 512, 1, 512, 1024, 1024, 1024, 512]
    - [79, 4.562]
  - - [1024, 512, 1, 1024, 1024, 1024, 1024, 512]
    - [88, 6.154]
  - - [1024, 512, 1, 2048, 1024, 1024, 1024, 512]
    - [75, 7.793]
  - - [1024, 512, 1, 4096, 1024, 1024, 1024, 512]
    - [75, 10.205]
  - - [1024, 512, 1, 8192, 1024, 1024, 1024, 512]
    - [23, 12.872]
  - - [1024, 1024, 1, 128, 1024, 1024, 1024, 1024]
    - [61, 2.824]
  - - [1024, 1024, 1, 256, 1024, 1024, 1024, 1024]
    - [75, 4.681]
  - - [1024, 1024, 1, 512, 1024, 1024, 1024, 1024]
    - [75, 7.051]
  - - [1024, 1024, 1, 1024, 1024, 1024, 1024, 1024]
    - [75, 9.33]
  - - [1024, 1024, 1, 2048, 1024, 1024, 1024, 1024]
    - [86, 10.834]
  - - [1024, 1024, 1, 4096, 1024, 1024, 1024, 1024]
    - [75, 12.991]
  - - [1024, 1024, 1, 8192, 1024, 1024, 1024, 1024]
    - [56, 14.732]
  - - [1024, 2048, 1, 128, 1024, 1024, 1024, 2048]
    - [59, 4.059]
  - - [1024, 2048, 1, 256, 1024, 1024, 1024, 2048]
    - [58, 6.373]
  - - [1024, 2048, 1, 512, 1024, 1024, 1024, 2048]
    - [59, 8.914]
  - - [1024, 2048, 1, 1024, 1024, 1024, 1024, 2048]
    - [72, 11.215]
  - - [1024, 2048, 1, 2048, 1024, 1024, 1024, 2048]
    - [12, 12.491]
  - - [1024, 2048, 1, 4096, 1024, 1024, 1024, 2048]
    - [60, 14.876]
  - - [1024, 2048, 1, 8192, 1024, 1024, 1024, 2048]
    - [53, 16.883]
  - - [1024, 4096, 1, 128, 1024, 1024, 1024, 4096]
    - [44, 5.113]
  - - [1024, 4096, 1, 256, 1024, 1024, 1024, 4096]
    - [42, 7.847]
  - - [1024, 4096, 1, 512, 1024, 1024, 1024, 4096]
    - [44, 10.785]
  - - [1024, 4096, 1, 1024, 1024, 1024, 1024, 4096]
    - [20, 13.053]
  - - [1024, 4096, 1, 2048, 1024, 1024, 1024, 4096]
    - [51, 14.529]
  - - [1024, 4096, 1, 4096, 1024, 1024, 1024, 4096]
    - [48, 16.968]
  - - [1024, 4096, 1, 8192, 1024, 1024, 1024, 4096]
    - [0, 18.897]
  - - [1024, 8192, 1, 128, 1024, 1024, 1024, 8192]
    - [17, 5.104]
  - - [1024, 8192, 1, 256, 1024, 1024, 1024, 8192]
    - [60, 7.398]
  - - [1024, 8192, 1, 512, 1024, 1024, 1024, 8192]
    - [73, 10.279]
  - - [1024, 8192, 1, 1024, 1024, 1024, 1024, 8192]
    - [51, 13.628]
  - - [1024, 8192, 1, 2048, 1024, 1024, 1024, 8192]
    - [51, 16.318]
  - - [1024, 8192, 1, 4096, 1024, 1024, 1024, 8192]
    - [49, 18.41]
  - - [1024, 8192, 1, 8192, 1024, 1024, 1024, 8192]
    - [68, 19.953]
  - - [2048, 128, 1, 128, 2048, 2048, 2048, 128]
    - [26, 1.108]
  - - [2048, 128, 1, 256, 2048, 2048, 2048, 128]
    - [27, 1.883]
  - - [2048, 128, 1, 512, 2048, 2048, 2048, 128]
    - [35, 2.959]
  - - [2048, 128, 1, 1024, 2048, 2048, 2048, 128]
    - [35, 4.207]
  - - [2048, 128, 1, 2048, 2048, 2048, 2048, 128]
    - [79, 4.865]
  - - [2048, 128, 1, 4096, 2048, 2048, 2048, 128]
    - [75, 6.87]
  - - [2048, 128, 1, 8192, 2048, 2048, 2048, 128]
    - [23, 9.49]
  - - [2048, 256, 1, 128, 2048, 2048, 2048, 256]
    - [63, 1.852]
  - - [2048, 256, 1, 256, 2048, 2048, 2048, 256]
    - [79, 3.049]
  - - [2048, 256, 1, 512, 2048, 2048, 2048, 256]
    - [79, 4.576]
  - - [2048, 256, 1, 1024, 2048, 2048, 2048, 256]
    - [33, 6.075]
  - - [2048, 256, 1, 2048, 2048, 2048, 2048, 256]
    - [75, 7.774]
  - - [2048, 256, 1, 4096, 2048, 2048, 2048, 256]
    - [23, 10.183]
  - - [2048, 256, 1, 8192, 2048, 2048, 2048, 256]
    - [77, 12.798]
  - - [2048, 512, 1, 128, 2048, 2048, 2048, 512]
    - [62, 2.84]
  - - [2048, 512, 1, 256, 2048, 2048, 2048, 512]
    - [75, 4.689]
  - - [2048, 512, 1, 512, 2048, 2048, 2048, 512]
    - [75, 7.069]
  - - [2048, 512, 1, 1024, 2048, 2048, 2048, 512]
    - [76, 9.348]
  - - [2048, 512, 1, 2048, 2048, 2048, 2048, 512]
    - [31, 10.739]
  - - [2048, 512, 1, 4096, 2048, 2048, 2048, 512]
    - [75, 13.035]
  - - [2048, 512, 1, 8192, 2048, 2048, 2048, 512]
    - [57, 14.775]
  - - [2048, 1024, 1, 128, 2048, 2048, 2048, 1024]
    - [59, 4.066]
  - - [2048, 1024, 1, 256, 2048, 2048, 2048, 1024]
    - [58, 6.397]
  - - [2048, 1024, 1, 512, 2048, 2048, 2048, 1024]
    - [59, 8.914]
  - - [2048, 1024, 1, 1024, 2048, 2048, 2048, 1024]
    - [74, 11.196]
  - - [2048, 1024, 1, 2048, 2048, 2048, 2048, 1024]
    - [60, 12.466]
  - - [2048, 1024, 1, 4096, 2048, 2048, 2048, 1024]
    - [56, 14.885]
  - - [2048, 1024, 1, 8192, 2048, 2048, 2048, 1024]
    - [8, 16.684]
  - - [2048, 2048, 1, 128, 2048, 2048, 2048, 2048]
    - [42, 5.13]
  - - [2048, 2048, 1, 256, 2048, 2048, 2048, 2048]
    - [42, 7.856]
  - - [2048, 2048, 1, 512, 2048, 2048, 2048, 2048]
    - [52, 10.744]
  - - [2048, 2048, 1, 1024, 2048, 2048, 2048, 2048]
    - [69, 13.02]
  - - [2048, 2048, 1, 2048, 2048, 2048, 2048, 2048]
    - [43, 14.432]
  - - [2048, 2048, 1, 4096, 2048, 2048, 2048, 2048]
    - [1, 17.137]
  - - [2048, 2048, 1, 8192, 2048, 2048, 2048, 2048]
    - [2, 18.799]
  - - [2048, 4096, 1, 128, 2048, 2048, 2048, 4096]
    - [21, 5.07]
  - - [2048, 4096, 1, 256, 2048, 2048, 2048, 4096]
    - [60, 7.434]
  - - [2048, 4096, 1, 512, 2048, 2048, 2048, 4096]
    - [43, 10.285]
  - - [2048, 4096, 1, 1024, 2048, 2048, 2048, 4096]
    - [43, 13.634]
  - - [2048, 4096, 1, 2048, 2048, 2048, 2048, 4096]
    - [43, 16.174]
  - - [2048, 4096, 1, 4096, 2048, 2048, 2048, 4096]
    - [48, 18.439]
  - - [2048, 4096, 1, 8192, 2048, 2048, 2048, 4096]
    - [68, 19.991]
  - - [2048, 8192, 1, 128, 2048, 2048, 2048, 8192]
    - [59, 5.587]
  - - [2048, 8192, 1, 256, 2048, 2048, 2048, 8192]
    - [45, 8.521]
  - - [2048, 8192, 1, 512, 2048, 2048, 2048, 8192]
    - [69, 11.932]
  - - [2048, 8192, 1, 1024, 2048, 2048, 2048, 8192]
    - [43, 15.034]
  - - [2048, 8192, 1, 2048, 2048, 2048, 2048, 8192]
    - [46, 17.585]
  - - [2048, 8192, 1, 4096, 2048, 2048, 2048, 8192]
    - [68, 19.407]
  - - [2048, 8192, 1, 8192, 2048, 2048, 2048, 8192]
    - [68, 20.303]
  - - [4096, 128, 1, 128, 4096, 4096, 4096, 128]
    - [65, 1.867]
  - - [4096, 128, 1, 256, 4096, 4096, 4096, 128]
    - [65, 3.044]
  - - [4096, 128, 1, 512, 4096, 4096, 4096, 128]
    - [79, 4.555]
  - - [4096, 128, 1, 1024, 4096, 4096, 4096, 128]
    - [89, 6.059]
  - - [4096, 128, 1, 2048, 4096, 4096, 4096, 128]
    - [75, 7.717]
  - - [4096, 128, 1, 4096, 4096, 4096, 4096, 128]
    - [75, 10.262]
  - - [4096, 128, 1, 8192, 4096, 4096, 4096, 128]
    - [75, 12.897]
  - - [4096, 256, 1, 128, 4096, 4096, 4096, 256]
    - [62, 2.851]
  - - [4096, 256, 1, 256, 4096, 4096, 4096, 256]
    - [75, 4.699]
  - - [4096, 256, 1, 512, 4096, 4096, 4096, 256]
    - [75, 7.084]
  - - [4096, 256, 1, 1024, 4096, 4096, 4096, 256]
    - [77, 9.348]
  - - [4096, 256, 1, 2048, 4096, 4096, 4096, 256]
    - [87, 10.893]
  - - [4096, 256, 1, 4096, 4096, 4096, 4096, 256]
    - [75, 13.145]
  - - [4096, 256, 1, 8192, 4096, 4096, 4096, 256]
    - [55, 14.799]
  - - [4096, 512, 1, 128, 4096, 4096, 4096, 512]
    - [59, 4.063]
  - - [4096, 512, 1, 256, 4096, 4096, 4096, 512]
    - [58, 6.403]
  - - [4096, 512, 1, 512, 4096, 4096, 4096, 512]
    - [59, 8.94]
  - - [4096, 512, 1, 1024, 4096, 4096, 4096, 512]
    - [74, 11.187]
  - - [4096, 512, 1, 2048, 4096, 4096, 4096, 512]
    - [60, 12.535]
  - - [4096, 512, 1, 4096, 4096, 4096, 4096, 512]
    - [10, 14.928]
  - - [4096, 512, 1, 8192, 4096, 4096, 4096, 512]
    - [47, 16.846]
  - - [4096, 1024, 1, 128, 4096, 4096, 4096, 1024]
    - [42, 5.115]
  - - [4096, 1024, 1, 256, 4096, 4096, 4096, 1024]
    - [44, 7.879]
  - - [4096, 1024, 1, 512, 4096, 4096, 4096, 1024]
    - [44, 10.754]
  - - [4096, 1024, 1, 1024, 4096, 4096, 4096, 1024]
    - [68, 13.04]
  - - [4096, 1024, 1, 2048, 4096, 4096, 4096, 1024]
    - [50, 14.461]
  - - [4096, 1024, 1, 4096, 4096, 4096, 4096, 1024]
    - [8, 16.807]
  - - [4096, 1024, 1, 8192, 4096, 4096, 4096, 1024]
    - [5, 18.851]
  - - [4096, 2048, 1, 128, 4096, 4096, 4096, 2048]
    - [21, 5.075]
  - - [4096, 2048, 1, 256, 4096, 4096, 4096, 2048]
    - [60, 7.445]
  - - [4096, 2048, 1, 512, 4096, 4096, 4096, 2048]
    - [43, 10.265]
  - - [4096, 2048, 1, 1024, 4096, 4096, 4096, 2048]
    - [45, 13.646]
  - - [4096, 2048, 1, 2048, 4096, 4096, 4096, 2048]
    - [1, 16.166]
  - - [4096, 2048, 1, 4096, 4096, 4096, 4096, 2048]
    - [2, 18.377]
  - - [4096, 2048, 1, 8192, 4096, 4096, 4096, 2048]
    - [68, 20.054]
  - - [4096, 4096, 1, 128, 4096, 4096, 4096, 4096]
    - [58, 5.621]
  - - [4096, 4096, 1, 256, 4096, 4096, 4096, 4096]
    - [40, 8.561]
  - - [4096, 4096, 1, 512, 4096, 4096, 4096, 4096]
    - [71, 11.832]
  - - [4096, 4096, 1, 1024, 4096, 4096, 4096, 4096]
    - [68, 14.889]
  - - [4096, 4096, 1, 2048, 4096, 4096, 4096, 4096]
    - [54, 17.569]
  - - [4096, 4096, 1, 4096, 4096, 4096, 4096, 4096]
    - [68, 19.314]
  - - [4096, 4096, 1, 8192, 4096, 4096, 4096, 4096]
    - [68, 20.263]
  - - [4096, 8192, 1, 128, 4096, 4096, 4096, 8192]
    - [42, 6.464]
  - - [4096, 8192, 1, 256, 4096, 4096, 4096, 8192]
    - [44, 9.467]
  - - [4096, 8192, 1, 512, 4096, 4096, 4096, 8192]
    - [49, 12.954]
  - - [4096, 8192, 1, 1024, 4096, 4096, 4096, 8192]
    - [46, 16.202]
  - - [4096, 8192, 1, 2048, 4096, 4096, 4096, 8192]
    - [16, 18.312]
  - - [4096, 8192, 1, 4096, 4096, 4096, 4096, 8192]
    - [68, 19.712]
  - - [4096, 8192, 1, 8192, 4096, 4096, 4096, 8192]
    - [68, 20.663]
  - - [8192, 128, 1, 128, 8192, 8192, 8192, 128]
    - [14, 2.752]
  - - [8192, 128, 1, 256, 8192, 8192, 8192, 128]
    - [23, 4.53]
  - - [8192, 128, 1, 512, 8192, 8192, 8192, 128]
    - [23, 6.852]
  - - [8192, 128, 1, 1024, 8192, 8192, 8192, 128]
    - [23, 9.183]
  - - [8192, 128, 1, 2048, 8192, 8192, 8192, 128]
    - [31, 10.997]
  - - [8192, 128, 1, 4096, 8192, 8192, 8192, 128]
    - [23, 13.136]
  - - [8192, 128, 1, 8192, 8192, 8192, 8192, 128]
    - [76, 14.529]
  - - [8192, 256, 1, 128, 8192, 8192, 8192, 256]
    - [59, 4.122]
  - - [8192, 256, 1, 256, 8192, 8192, 8192, 256]
    - [59, 6.447]
  - - [8192, 256, 1, 512, 8192, 8192, 8192, 256]
    - [11, 8.903]
  - - [8192, 256, 1, 1024, 8192, 8192, 8192, 256]
    - [74, 11.154]
  - - [8192, 256, 1, 2048, 8192, 8192, 8192, 256]
    - [55, 12.612]
  - - [8192, 256, 1, 4096, 8192, 8192, 8192, 256]
    - [56, 14.876]
  - - [8192, 256, 1, 8192, 8192, 8192, 8192, 256]
    - [48, 16.751]
  - - [8192, 512, 1, 128, 8192, 8192, 8192, 512]
    - [49, 5.065]
  - - [8192, 512, 1, 256, 8192, 8192, 8192, 512]
    - [49, 7.833]
  - - [8192, 512, 1, 512, 8192, 8192, 8192, 512]
    - [49, 10.762]
  - - [8192, 512, 1, 1024, 8192, 8192, 8192, 512]
    - [18, 12.962]
  - - [8192, 512, 1, 2048, 8192, 8192, 8192, 512]
    - [7, 14.58]
  - - [8192, 512, 1, 4096, 8192, 8192, 8192, 512]
    - [4, 16.841]
  - - [8192, 512, 1, 8192, 8192, 8192, 8192, 512]
    - [2, 18.87]
  - - [8192, 1024, 1, 128, 8192, 8192, 8192, 1024]
    - [19, 5.016]
  - - [8192, 1024, 1, 256, 8192, 8192, 8192, 1024]
    - [60, 7.314]
  - - [8192, 1024, 1, 512, 8192, 8192, 8192, 1024]
    - [43, 10.265]
  - - [8192, 1024, 1, 1024, 8192, 8192, 8192, 1024]
    - [41, 13.704]
  - - [8192, 1024, 1, 2048, 8192, 8192, 8192, 1024]
    - [48, 16.233]
  - - [8192, 1024, 1, 4096, 8192, 8192, 8192, 1024]
    - [8, 18.45]
  - - [8192, 1024, 1, 8192, 8192, 8192, 8192, 1024]
    - [68, 19.919]
  - - [8192, 2048, 1, 128, 8192, 8192, 8192, 2048]
    - [58, 5.552]
  - - [8192, 2048, 1, 256, 8192, 8192, 8192, 2048]
    - [40, 8.454]
  - - [8192, 2048, 1, 512, 8192, 8192, 8192, 2048]
    - [68, 11.797]
  - - [8192, 2048, 1, 1024, 8192, 8192, 8192, 2048]
    - [46, 14.89]
  - - [8192, 2048, 1, 2048, 8192, 8192, 8192, 2048]
    - [49, 17.563]
  - - [8192, 2048, 1, 4096, 8192, 8192, 8192, 2048]
    - [68, 19.326]
  - - [8192, 2048, 1, 8192, 8192, 8192, 8192, 2048]
    - [68, 20.236]
  - - [8192, 4096, 1, 128, 8192, 8192, 8192, 4096]
    - [42, 6.39]
  - - [8192, 4096, 1, 256, 8192, 8192, 8192, 4096]
    - [70, 9.455]
  - - [8192, 4096, 1, 512, 8192, 8192, 8192, 4096]
    - [3, 12.847]
  - - [8192, 4096, 1, 1024, 8192, 8192, 8192, 4096]
    - [46, 16.116]
  - - [8192, 4096, 1, 2048, 8192, 8192, 8192, 4096]
    - [46, 18.331]
  - - [8192, 4096, 1, 4096, 8192, 8192, 8192, 4096]
    - [68, 19.665]
  - - [8192, 4096, 1, 8192, 8192, 8192, 8192, 4096]
    - [68, 20.661]
  - - [8192, 8192, 1, 128, 8192, 8192, 8192, 8192]
    - [6, 6.655]
  - - [8192, 8192, 1, 256, 8192, 8192, 8192, 8192]
    - [70, 9.616]
  - - [8192, 8192, 1, 512, 8192, 8192, 8192, 8192]
    - [54, 13.387]
  - - [8192, 8192, 1, 1024, 8192, 8192, 8192, 8192]
    - [54, 16.47]
  - - [8192, 8192, 1, 2048, 8192, 8192, 8192, 8192]
    - [68, 18.471]
  - - [8192, 8192, 1, 4096, 8192, 8192, 8192, 8192]
    - [16, 20.003]
  - - [8192, 8192, 1, 8192, 8192, 8192, 8192, 8192]
    - [16, 21.01]
  - - [1, 1, 1, 32, 1, 1, 1, 1]
    - [94, 0.0]
- null
- null
- ExperimentalStreamK
- GridBased
