library/src/amd_detail/rocblaslt/src/Tensile/Logic/asm_full/aquavanjaram/gfx942_80cu/StreamK/aquavanjaram942_Cijk_Alik_Bjlk_HHS_BH_UserArgs.yaml
- {MinimumRequiredVersion: 4.33.0}
- aquavanjaram942
- {Architecture: gfx942, CUCount: 80}
- [Device 0049, Device 0050]
    SolutionIndex: 0
    SolutionNameMin: Cijk_Alik_Bjlk_HHS_BH_UserArgs_MT256x256x32_MI16x16x1_SN_LDSB1_CLR1_GSU0_GSUC0_GSUWGMRR0_K1_LBSPPA512_LBSPPB2048_LPB32_MIWT8_8_PLR1_SU32_SUM0_SUS256_SKXCCM0_VWA8_VWB2_WGM1_WGMXCC1_WGMXCCGn1
    SolutionIndex: 1
    SolutionNameMin: Cijk_Alik_Bjlk_HHS_BH_UserArgs_MT256x256x32_MI16x16x1_SN_LDSB1_CLR1_GSU0_GSUC0_GSUWGMRR0_K1_LBSPPA256_LBSPPB2048_LPB0_MIWT8_8_PLR1_SU32_SUM0_SUS256_SKXCCM0_VWA4_VWB4_WGM1_WGMXCC1_WGMXCCGn1
    SolutionIndex: 2
    SolutionNameMin: Cijk_Alik_Bjlk_HHS_BH_UserArgs_MT256x256x32_MI16x16x1_SN_LDSB1_CLR1_GSU0_GSUC0_GSUWGMRR0_K1_LBSPPA512_LBSPPB2048_LPB0_MIWT8_8_PLR1_SU32_SUM0_SUS256_SKXCCM0_VWA8_VWB4_WGM1_WGMXCC1_WGMXCCGn1
    SolutionIndex: 3
    SolutionNameMin: Cijk_Alik_Bjlk_HHS_BH_UserArgs_MT256x256x32_MI16x16x1_SN_LDSB1_CLR1_GSU0_GSUC0_GSUWGMRR0_K1_LBSPPA256_LBSPPB2048_LPB0_MIWT8_8_PLR1_SU32_SUM0_SUS256_SKXCCM0_VWA4_VWB8_WGM1_WGMXCC1_WGMXCCGn1
    SolutionIndex: 4
    SolutionNameMin: Cijk_Alik_Bjlk_HHS_BH_UserArgs_MT256x256x32_MI16x16x1_SN_LDSB1_CLR1_GSU0_GSUC0_GSUWGMRR0_K1_LBSPPA512_LBSPPB2048_LPB0_MIWT8_8_PLR1_SU32_SUM0_SUS256_SKXCCM0_VWA8_VWB8_WGM1_WGMXCC1_WGMXCCGn1
    SolutionIndex: 5
    SolutionNameMin: Cijk_Alik_Bjlk_HHS_BH_UserArgs_MT256x256x32_MI16x16x1_SN_LDSB1_CLR1_GSU0_GSUC0_GSUWGMRR0_K1_LBSPPA256_LBSPPB2048_LPB0_MIWT8_8_PLR1_SU32_SUM0_SUS256_SKXCCM0_VWA4_VWB4_WGM2_WGMXCC1_WGMXCCGn1
    SolutionIndex: 6
    SolutionNameMin: Cijk_Alik_Bjlk_HHS_BH_UserArgs_MT256x256x32_MI16x16x1_SN_LDSB1_CLR1_GSU0_GSUC0_GSUWGMRR0_K1_LBSPPA256_LBSPPB2048_LPB0_MIWT8_8_PLR1_SU32_SUM0_SUS256_SKXCCM0_VWA4_VWB8_WGM2_WGMXCC1_WGMXCCGn1
    SolutionIndex: 7
    SolutionNameMin: Cijk_Alik_Bjlk_HHS_BH_UserArgs_MT256x256x32_MI16x16x1_SN_LDSB1_CLR1_GSU0_GSUC0_GSUWGMRR0_K1_LBSPPA512_LBSPPB2048_LPB0_MIWT8_8_PLR1_SU32_SUM0_SUS256_SKXCCM0_VWA8_VWB8_WGM2_WGMXCC1_WGMXCCGn1
    SolutionIndex: 8
    SolutionNameMin: Cijk_Alik_Bjlk_HHS_BH_UserArgs_MT256x256x32_MI16x16x1_SN_LDSB1_CLR1_GSU0_GSUC0_GSUWGMRR0_K1_LBSPPA256_LBSPPB2048_LPB0_MIWT8_8_PLR1_SU32_SUM0_SUS256_SKXCCM0_VWA4_VWB8_WGM4_WGMXCC1_WGMXCCGn1
    SolutionIndex: 9
    SolutionNameMin: Cijk_Alik_Bjlk_HHS_BH_UserArgs_MT128x256x32_MI16x16x1_SN_LDSB1_CLR1_GSU0_GSUC0_GSUWGMRR0_K1_LBSPPA256_LBSPPB2048_LPB0_MIWT4_8_PLR1_SU32_SUM0_SUS256_SKXCCM0_VWA4_VWB4_WGM1_WGMXCC1_WGMXCCGn1
    SolutionIndex: 10
    SolutionNameMin: Cijk_Alik_Bjlk_HHS_BH_UserArgs_MT64x64x32_MI16x16x1_SN_LDSB0_CLR1_GSU0_GSUC0_GSUWGMRR0_K1_LBSPPA128_LBSPPB512_LPB32_MIWT2_2_PLR1_SU32_SUM0_SUS256_SKXCCM0_VWA2_VWB2_WGM1_WGMXCC1_WGMXCCGn1
    SolutionIndex: 11
    SolutionNameMin: Cijk_Alik_Bjlk_HHS_BH_UserArgs_MT128x256x64_MI16x16x1_SN_LDSB1_CLR1_GSU0_GSUC0_GSUWGMRR0_K1_LBSPPA512_LBSPPB4096_LPB0_MIWT4_8_PLR1_SU32_SUM0_SUS256_SKXCCM0_VWA4_VWB4_WGM1_WGMXCC1_WGMXCCGn1
    SolutionIndex: 12
    SolutionNameMin: Cijk_Alik_Bjlk_HHS_BH_UserArgs_MT256x128x64_MI16x16x1_SN_LDSB1_CLR1_GSU0_GSUC0_GSUWGMRR0_K1_LBSPPA512_LBSPPB2048_LPB0_MIWT8_4_PLR1_SU32_SUM0_SUS256_SKXCCM0_VWA4_VWB4_WGM1_WGMXCC1_WGMXCCGn1
    SolutionIndex: 13
    SolutionNameMin: Cijk_Alik_Bjlk_HHS_BH_UserArgs_MT128x128x64_MI16x16x1_SN_LDSB1_CLR1_GSU0_GSUC0_GSUWGMRR0_K1_LBSPPA512_LBSPPB2048_LPB0_MIWT4_4_PLR1_SU32_SUM0_SUS256_SKXCCM0_VWA4_VWB4_WGM1_WGMXCC1_WGMXCCGn1
    SolutionIndex: 14
    SolutionNameMin: Cijk_Alik_Bjlk_HHS_BH_UserArgs_MT128x128x64_MI16x16x1_SN_LDSB1_CLR1_GSU0_GSUC0_GSUWGMRR0_K1_LBSPPA256_LBSPPB2048_LPB0_MIWT4_4_PLR1_SU32_SUM0_SUS256_SKXCCM0_VWA2_VWB4_WGM2_WGMXCC1_WGMXCCGn1
    SolutionIndex: 15
    SolutionNameMin: Cijk_Alik_Bjlk_HHS_BH_UserArgs_MT128x128x64_MI16x16x1_SN_LDSB1_CLR1_GSU0_GSUC0_GSUWGMRR0_K1_LBSPPA512_LBSPPB2048_LPB0_MIWT4_4_PLR1_SU32_SUM0_SUS256_SKXCCM0_VWA4_VWB4_WGM2_WGMXCC1_WGMXCCGn1
    SolutionIndex: 16
    SolutionNameMin: Cijk_Alik_Bjlk_HHS_BH_UserArgs_MT64x128x64_MI16x16x1_SN_LDSB1_CLR1_GSU0_GSUC0_GSUWGMRR0_K1_LBSPPA256_LBSPPB2048_LPB0_MIWT2_4_PLR1_SU32_SUM0_SUS256_SKXCCM0_VWA2_VWB4_WGM1_WGMXCC1_WGMXCCGn1
    SolutionIndex: 17
    SolutionNameMin: Cijk_Alik_Bjlk_HHS_BH_UserArgs_MT64x64x64_MI16x16x1_SN_LDSB1_CLR1_GSU0_GSUC0_GSUWGMRR0_K1_LBSPPA256_LBSPPB1024_LPB32_MIWT2_2_PLR1_SU32_SUM0_SUS256_SKXCCM0_VWA2_VWB2_WGM1_WGMXCC1_WGMXCCGn1
    SolutionIndex: 18
    SolutionNameMin: Cijk_Alik_Bjlk_HHS_BH_UserArgs_MT32x64x64_MI16x16x1_SN_LDSB0_CLR1_GSU0_GSUC0_GSUWGMRR0_K1_LBSPPA128_LBSPPB1024_LPB32_MIWT1_2_PLR1_SU32_SUM0_SUS256_SKXCCM0_VWA1_VWB2_WGM1_WGMXCC1_WGMXCCGn1
    SolutionIndex: 19
    SolutionNameMin: Cijk_Alik_Bjlk_HHS_BH_UserArgs_MT64x32x64_MI16x16x1_SN_LDSB0_CLR1_GSU0_GSUC0_GSUWGMRR0_K1_LBSPPA256_LBSPPB512_LPB16_MIWT2_1_PLR1_SU32_SUM0_SUS256_SKXCCM0_VWA2_VWB1_WGM1_WGMXCC1_WGMXCCGn1
    SolutionIndex: 20
    SolutionNameMin: Cijk_Alik_Bjlk_HHS_BH_UserArgs_MT32x32x64_MI16x16x1_SN_LDSB0_CLR1_GSU0_GSUC0_GSUWGMRR0_K1_LBSPPA128_LBSPPB512_LPB16_MIWT1_1_PLR1_SU32_SUM0_SUS256_SKXCCM0_VWA1_VWB1_WGM1_WGMXCC1_WGMXCCGn1
    SolutionIndex: 21
    SolutionNameMin: Cijk_Alik_Bjlk_HHS_BH_UserArgs_MT64x128x128_MI16x16x1_SN_LDSB1_CLR1_GSU0_GSUC0_GSUWGMRR0_K1_LBSPPA512_LBSPPB2048_LPB0_MIWT2_4_PLR2_SU32_SUM0_SUS256_SKXCCM0_VWA2_VWB4_WGM1_WGMXCC1_WGMXCCGn1
    SolutionIndex: 22
    SolutionNameMin: Cijk_Alik_Bjlk_HHS_BH_UserArgs_MT128x64x128_MI16x16x1_SN_LDSB1_CLR1_GSU0_GSUC0_GSUWGMRR0_K1_LBSPPA512_LBSPPB1024_LPB32_MIWT4_2_PLR2_SU32_SUM0_SUS256_SKXCCM0_VWA2_VWB2_WGM1_WGMXCC1_WGMXCCGn1
    SolutionIndex: 23
    SolutionNameMin: Cijk_Alik_Bjlk_HHS_BH_UserArgs_MT128x64x128_MI16x16x1_SN_LDSB1_CLR1_GSU0_GSUC0_GSUWGMRR0_K1_LBSPPA1024_LBSPPB1024_LPB32_MIWT4_2_PLR2_SU32_SUM0_SUS256_SKXCCM0_VWA4_VWB2_WGM1_WGMXCC1_WGMXCCGn1
    SolutionIndex: 24
    SolutionNameMin: Cijk_Alik_Bjlk_HHS_BH_UserArgs_MT128x64x128_MI16x16x1_SN_LDSB1_CLR1_GSU0_GSUC0_GSUWGMRR0_K1_LBSPPA512_LBSPPB1024_LPB32_MIWT4_2_PLR2_SU32_SUM0_SUS256_SKXCCM0_VWA2_VWB2_WGM2_WGMXCC1_WGMXCCGn1
    SolutionIndex: 25
    SolutionNameMin: Cijk_Alik_Bjlk_HHS_BH_UserArgs_MT128x64x128_MI16x16x1_SN_LDSB1_CLR1_GSU0_GSUC0_GSUWGMRR0_K1_LBSPPA1024_LBSPPB1024_LPB32_MIWT4_2_PLR2_SU32_SUM0_SUS256_SKXCCM0_VWA4_VWB2_WGM4_WGMXCC1_WGMXCCGn1
    SolutionIndex: 26
    SolutionNameMin: Cijk_Alik_Bjlk_HHS_BH_UserArgs_MT64x64x128_MI16x16x1_SN_LDSB1_CLR1_GSU0_GSUC0_GSUWGMRR0_K1_LBSPPA512_LBSPPB1024_LPB32_MIWT2_2_PLR2_SU32_SUM0_SUS256_SKXCCM0_VWA2_VWB2_WGM1_WGMXCC1_WGMXCCGn1
    SolutionIndex: 27
    SolutionNameMin: Cijk_Alik_Bjlk_HHS_BH_UserArgs_MT64x64x128_MI16x16x1_SN_LDSB1_CLR1_GSU0_GSUC0_GSUWGMRR0_K1_LBSPPA512_LBSPPB1024_LPB32_MIWT2_2_PLR2_SU32_SUM0_SUS256_SKXCCM0_VWA2_VWB2_WGM2_WGMXCC1_WGMXCCGn1
    SolutionIndex: 28
    SolutionNameMin: Cijk_Alik_Bjlk_HHS_BH_UserArgs_MT64x64x128_MI16x16x1_SN_LDSB1_CLR1_GSU0_GSUC0_GSUWGMRR0_K1_LBSPPA512_LBSPPB1024_LPB32_MIWT2_2_PLR2_SU32_SUM0_SUS256_SKXCCM0_VWA2_VWB2_WGM4_WGMXCC1_WGMXCCGn1
    SolutionIndex: 29
    SolutionNameMin: Cijk_Alik_Bjlk_HHS_BH_UserArgs_MT32x64x128_MI16x16x1_SN_LDSB1_CLR1_GSU0_GSUC0_GSUWGMRR0_K1_LBSPPA256_LBSPPB1024_LPB32_MIWT1_2_PLR2_SU32_SUM0_SUS256_SKXCCM0_VWA1_VWB2_WGM1_WGMXCC1_WGMXCCGn1
    SolutionIndex: 30
    SolutionNameMin: Cijk_Alik_Bjlk_HHS_BH_UserArgs_MT32x64x128_MI16x16x1_SN_LDSB1_CLR1_GSU0_GSUC0_GSUWGMRR0_K1_LBSPPA256_LBSPPB1024_LPB32_MIWT1_2_PLR2_SU32_SUM0_SUS256_SKXCCM0_VWA1_VWB2_WGM2_WGMXCC1_WGMXCCGn1
    SolutionIndex: 31
    SolutionNameMin: Cijk_Alik_Bjlk_HHS_BH_UserArgs_MT64x32x128_MI16x16x1_SN_LDSB1_CLR1_GSU0_GSUC0_GSUWGMRR0_K1_LBSPPA512_LBSPPB512_LPB16_MIWT2_1_PLR2_SU32_SUM0_SUS256_SKXCCM0_VWA2_VWB1_WGM1_WGMXCC1_WGMXCCGn1
    SolutionIndex: 32
    SolutionNameMin: Cijk_Alik_Bjlk_HHS_BH_UserArgs_MT32x32x128_MI16x16x1_SN_LDSB1_CLR1_GSU0_GSUC0_GSUWGMRR0_K1_LBSPPA256_LBSPPB512_LPB16_MIWT1_1_PLR1_SU32_SUM0_SUS256_SKXCCM0_VWA1_VWB1_WGM1_WGMXCC1_WGMXCCGn1
    SolutionIndex: 33
    SolutionNameMin: Cijk_Alik_Bjlk_HHS_BH_UserArgs_MT32x32x128_MI16x16x1_SN_LDSB1_CLR1_GSU0_GSUC0_GSUWGMRR0_K1_LBSPPA256_LBSPPB512_LPB16_MIWT1_1_PLR2_SU32_SUM0_SUS256_SKXCCM0_VWA1_VWB1_WGM1_WGMXCC1_WGMXCCGn1
    SolutionIndex: 34
    SolutionNameMin: Cijk_Alik_Bjlk_HHS_BH_UserArgs_MT256x256x32_MI16x16x1_SN_LDSB1_CLR1_GSU0_GSUC0_GSUWGMRR0_K1_LBSPPA512_LBSPPB2048_LPB32_MIWT8_8_PLR1_SU32_SUM0_SUS256_SKXCCM4_VWA8_VWB2_WGM1_WGMXCC1_WGMXCCGn1
    SolutionIndex: 35
    SolutionNameMin: Cijk_Alik_Bjlk_HHS_BH_UserArgs_MT256x256x32_MI16x16x1_SN_LDSB1_CLR1_GSU0_GSUC0_GSUWGMRR0_K1_LBSPPA256_LBSPPB2048_LPB0_MIWT8_8_PLR1_SU32_SUM0_SUS256_SKXCCM4_VWA4_VWB4_WGM1_WGMXCC1_WGMXCCGn1
    SolutionIndex: 36
    SolutionNameMin: Cijk_Alik_Bjlk_HHS_BH_UserArgs_MT256x256x32_MI16x16x1_SN_LDSB1_CLR1_GSU0_GSUC0_GSUWGMRR0_K1_LBSPPA512_LBSPPB2048_LPB0_MIWT8_8_PLR1_SU32_SUM0_SUS256_SKXCCM4_VWA8_VWB4_WGM1_WGMXCC1_WGMXCCGn1
    SolutionIndex: 37
    SolutionNameMin: Cijk_Alik_Bjlk_HHS_BH_UserArgs_MT256x256x32_MI16x16x1_SN_LDSB1_CLR1_GSU0_GSUC0_GSUWGMRR0_K1_LBSPPA256_LBSPPB2048_LPB0_MIWT8_8_PLR1_SU32_SUM0_SUS256_SKXCCM4_VWA4_VWB8_WGM1_WGMXCC1_WGMXCCGn1
    SolutionIndex: 38
    SolutionNameMin: Cijk_Alik_Bjlk_HHS_BH_UserArgs_MT256x256x32_MI16x16x1_SN_LDSB1_CLR1_GSU0_GSUC0_GSUWGMRR0_K1_LBSPPA512_LBSPPB2048_LPB0_MIWT8_8_PLR1_SU32_SUM0_SUS256_SKXCCM4_VWA8_VWB8_WGM1_WGMXCC1_WGMXCCGn1
    SolutionIndex: 39
    SolutionNameMin: Cijk_Alik_Bjlk_HHS_BH_UserArgs_MT256x256x32_MI16x16x1_SN_LDSB1_CLR1_GSU0_GSUC0_GSUWGMRR0_K1_LBSPPA256_LBSPPB2048_LPB0_MIWT8_8_PLR1_SU32_SUM0_SUS256_SKXCCM4_VWA4_VWB4_WGM2_WGMXCC1_WGMXCCGn1
    SolutionIndex: 40
    SolutionNameMin: Cijk_Alik_Bjlk_HHS_BH_UserArgs_MT256x256x32_MI16x16x1_SN_LDSB1_CLR1_GSU0_GSUC0_GSUWGMRR0_K1_LBSPPA512_LBSPPB2048_LPB0_MIWT8_8_PLR1_SU32_SUM0_SUS256_SKXCCM4_VWA8_VWB4_WGM2_WGMXCC1_WGMXCCGn1
    SolutionIndex: 41
    SolutionNameMin: Cijk_Alik_Bjlk_HHS_BH_UserArgs_MT256x256x32_MI16x16x1_SN_LDSB1_CLR1_GSU0_GSUC0_GSUWGMRR0_K1_LBSPPA256_LBSPPB2048_LPB0_MIWT8_8_PLR1_SU32_SUM0_SUS256_SKXCCM4_VWA4_VWB8_WGM2_WGMXCC1_WGMXCCGn1
    SolutionIndex: 42
    SolutionNameMin: Cijk_Alik_Bjlk_HHS_BH_UserArgs_MT256x256x32_MI16x16x1_SN_LDSB1_CLR1_GSU0_GSUC0_GSUWGMRR0_K1_LBSPPA512_LBSPPB2048_LPB0_MIWT8_8_PLR1_SU32_SUM0_SUS256_SKXCCM4_VWA8_VWB8_WGM2_WGMXCC1_WGMXCCGn1
    SolutionIndex: 43
    SolutionNameMin: Cijk_Alik_Bjlk_HHS_BH_UserArgs_MT256x256x32_MI16x16x1_SN_LDSB1_CLR1_GSU0_GSUC0_GSUWGMRR0_K1_LBSPPA256_LBSPPB2048_LPB0_MIWT8_8_PLR1_SU32_SUM0_SUS256_SKXCCM4_VWA4_VWB4_WGM4_WGMXCC1_WGMXCCGn1
    SolutionIndex: 44
    SolutionNameMin: Cijk_Alik_Bjlk_HHS_BH_UserArgs_MT256x256x32_MI16x16x1_SN_LDSB1_CLR1_GSU0_GSUC0_GSUWGMRR0_K1_LBSPPA512_LBSPPB2048_LPB0_MIWT8_8_PLR1_SU32_SUM0_SUS256_SKXCCM4_VWA8_VWB4_WGM4_WGMXCC1_WGMXCCGn1
    SolutionIndex: 45
    SolutionNameMin: Cijk_Alik_Bjlk_HHS_BH_UserArgs_MT256x256x32_MI16x16x1_SN_LDSB1_CLR1_GSU0_GSUC0_GSUWGMRR0_K1_LBSPPA256_LBSPPB2048_LPB0_MIWT8_8_PLR1_SU32_SUM0_SUS256_SKXCCM4_VWA4_VWB8_WGM4_WGMXCC1_WGMXCCGn1
    SolutionIndex: 46
    SolutionNameMin: Cijk_Alik_Bjlk_HHS_BH_UserArgs_MT256x256x32_MI16x16x1_SN_LDSB1_CLR1_GSU0_GSUC0_GSUWGMRR0_K1_LBSPPA512_LBSPPB2048_LPB0_MIWT8_8_PLR1_SU32_SUM0_SUS256_SKXCCM4_VWA8_VWB8_WGM4_WGMXCC1_WGMXCCGn1
    SolutionIndex: 47
    SolutionNameMin: Cijk_Alik_Bjlk_HHS_BH_UserArgs_MT128x256x32_MI16x16x1_SN_LDSB1_CLR1_GSU0_GSUC0_GSUWGMRR0_K1_LBSPPA256_LBSPPB2048_LPB0_MIWT4_8_PLR1_SU32_SUM0_SUS256_SKXCCM4_VWA4_VWB4_WGM1_WGMXCC1_WGMXCCGn1
    SolutionIndex: 48
    SolutionNameMin: Cijk_Alik_Bjlk_HHS_BH_UserArgs_MT128x256x32_MI16x16x1_SN_LDSB1_CLR1_GSU0_GSUC0_GSUWGMRR0_K1_LBSPPA256_LBSPPB2048_LPB0_MIWT4_8_PLR1_SU32_SUM0_SUS256_SKXCCM4_VWA4_VWB4_WGM2_WGMXCC1_WGMXCCGn1
    SolutionIndex: 49
    SolutionNameMin: Cijk_Alik_Bjlk_HHS_BH_UserArgs_MT128x256x32_MI16x16x1_SN_LDSB1_CLR1_GSU0_GSUC0_GSUWGMRR0_K1_LBSPPA256_LBSPPB2048_LPB0_MIWT4_8_PLR1_SU32_SUM0_SUS256_SKXCCM4_VWA4_VWB4_WGM4_WGMXCC1_WGMXCCGn1
    SolutionIndex: 50
    SolutionNameMin: Cijk_Alik_Bjlk_HHS_BH_UserArgs_MT256x128x32_MI16x16x1_SN_LDSB1_CLR1_GSU0_GSUC0_GSUWGMRR0_K1_LBSPPA256_LBSPPB1024_LPB32_MIWT8_4_PLR1_SU32_SUM0_SUS256_SKXCCM4_VWA4_VWB2_WGM1_WGMXCC1_WGMXCCGn1
    SolutionIndex: 51
    SolutionNameMin: Cijk_Alik_Bjlk_HHS_BH_UserArgs_MT256x128x32_MI16x16x1_SN_LDSB1_CLR1_GSU0_GSUC0_GSUWGMRR0_K1_LBSPPA512_LBSPPB1024_LPB32_MIWT8_4_PLR1_SU32_SUM0_SUS256_SKXCCM4_VWA8_VWB2_WGM1_WGMXCC1_WGMXCCGn1
    SolutionIndex: 52
    SolutionNameMin: Cijk_Alik_Bjlk_HHS_BH_UserArgs_MT256x128x32_MI16x16x1_SN_LDSB1_CLR1_GSU0_GSUC0_GSUWGMRR0_K1_LBSPPA512_LBSPPB1024_LPB0_MIWT8_4_PLR1_SU32_SUM0_SUS256_SKXCCM4_VWA8_VWB4_WGM1_WGMXCC1_WGMXCCGn1
    SolutionIndex: 53
    SolutionNameMin: Cijk_Alik_Bjlk_HHS_BH_UserArgs_MT256x128x32_MI16x16x1_SN_LDSB1_CLR1_GSU0_GSUC0_GSUWGMRR0_K1_LBSPPA256_LBSPPB1024_LPB32_MIWT8_4_PLR1_SU32_SUM0_SUS256_SKXCCM4_VWA4_VWB2_WGM2_WGMXCC1_WGMXCCGn1
    SolutionIndex: 54
    SolutionNameMin: Cijk_Alik_Bjlk_HHS_BH_UserArgs_MT256x128x32_MI16x16x1_SN_LDSB1_CLR1_GSU0_GSUC0_GSUWGMRR0_K1_LBSPPA512_LBSPPB1024_LPB32_MIWT8_4_PLR1_SU32_SUM0_SUS256_SKXCCM4_VWA8_VWB2_WGM2_WGMXCC1_WGMXCCGn1
    SolutionIndex: 55
    SolutionNameMin: Cijk_Alik_Bjlk_HHS_BH_UserArgs_MT256x128x32_MI16x16x1_SN_LDSB1_CLR1_GSU0_GSUC0_GSUWGMRR0_K1_LBSPPA512_LBSPPB1024_LPB0_MIWT8_4_PLR1_SU32_SUM0_SUS256_SKXCCM4_VWA8_VWB4_WGM2_WGMXCC1_WGMXCCGn1
    SolutionIndex: 56
    SolutionNameMin: Cijk_Alik_Bjlk_HHS_BH_UserArgs_MT256x128x32_MI16x16x1_SN_LDSB1_CLR1_GSU0_GSUC0_GSUWGMRR0_K1_LBSPPA512_LBSPPB1024_LPB0_MIWT8_4_PLR1_SU32_SUM0_SUS256_SKXCCM4_VWA8_VWB4_WGM4_WGMXCC1_WGMXCCGn1
    SolutionIndex: 57
    SolutionNameMin: Cijk_Alik_Bjlk_HHS_BH_UserArgs_MT128x64x32_MI16x16x1_SN_LDSB0_CLR1_GSU0_GSUC0_GSUWGMRR0_K1_LBSPPA128_LBSPPB512_LPB32_MIWT4_2_PLR1_SU32_SUM0_SUS256_SKXCCM4_VWA2_VWB2_WGM1_WGMXCC1_WGMXCCGn1
    SolutionIndex: 58
    SolutionNameMin: Cijk_Alik_Bjlk_HHS_BH_UserArgs_MT128x64x32_MI16x16x1_SN_LDSB0_CLR1_GSU0_GSUC0_GSUWGMRR0_K1_LBSPPA256_LBSPPB512_LPB32_MIWT4_2_PLR1_SU32_SUM0_SUS256_SKXCCM4_VWA4_VWB2_WGM1_WGMXCC1_WGMXCCGn1
    SolutionIndex: 59
    SolutionNameMin: Cijk_Alik_Bjlk_HHS_BH_UserArgs_MT128x256x64_MI16x16x1_SN_LDSB1_CLR1_GSU0_GSUC0_GSUWGMRR0_K1_LBSPPA512_LBSPPB4096_LPB0_MIWT4_8_PLR1_SU32_SUM0_SUS256_SKXCCM4_VWA4_VWB4_WGM1_WGMXCC1_WGMXCCGn1
    SolutionIndex: 60
    SolutionNameMin: Cijk_Alik_Bjlk_HHS_BH_UserArgs_MT128x256x64_MI16x16x1_SN_LDSB1_CLR1_GSU0_GSUC0_GSUWGMRR0_K1_LBSPPA512_LBSPPB4096_LPB0_MIWT4_8_PLR1_SU32_SUM0_SUS256_SKXCCM4_VWA4_VWB4_WGM4_WGMXCC1_WGMXCCGn1
    SolutionIndex: 61
    SolutionNameMin: Cijk_Alik_Bjlk_HHS_BH_UserArgs_MT256x128x64_MI16x16x1_SN_LDSB1_CLR1_GSU0_GSUC0_GSUWGMRR0_K1_LBSPPA1024_LBSPPB2048_LPB16_MIWT8_4_PLR1_SU32_SUM0_SUS256_SKXCCM4_VWA8_VWB1_WGM1_WGMXCC1_WGMXCCGn1
    SolutionIndex: 62
    SolutionNameMin: Cijk_Alik_Bjlk_HHS_BH_UserArgs_MT256x128x64_MI16x16x1_SN_LDSB1_CLR1_GSU0_GSUC0_GSUWGMRR0_K1_LBSPPA512_LBSPPB2048_LPB0_MIWT8_4_PLR1_SU32_SUM0_SUS256_SKXCCM4_VWA4_VWB4_WGM1_WGMXCC1_WGMXCCGn1
    SolutionIndex: 63
    SolutionNameMin: Cijk_Alik_Bjlk_HHS_BH_UserArgs_MT256x128x64_MI16x16x1_SN_LDSB1_CLR1_GSU0_GSUC0_GSUWGMRR0_K1_LBSPPA1024_LBSPPB2048_LPB0_MIWT8_4_PLR1_SU32_SUM0_SUS256_SKXCCM4_VWA8_VWB4_WGM1_WGMXCC1_WGMXCCGn1
    SolutionIndex: 64
    SolutionNameMin: Cijk_Alik_Bjlk_HHS_BH_UserArgs_MT256x128x64_MI16x16x1_SN_LDSB1_CLR1_GSU0_GSUC0_GSUWGMRR0_K1_LBSPPA512_LBSPPB2048_LPB0_MIWT8_4_PLR1_SU32_SUM0_SUS256_SKXCCM4_VWA4_VWB4_WGM2_WGMXCC1_WGMXCCGn1
    SolutionIndex: 65
    SolutionNameMin: Cijk_Alik_Bjlk_HHS_BH_UserArgs_MT256x128x64_MI16x16x1_SN_LDSB1_CLR1_GSU0_GSUC0_GSUWGMRR0_K1_LBSPPA1024_LBSPPB2048_LPB32_MIWT8_4_PLR1_SU32_SUM0_SUS256_SKXCCM4_VWA8_VWB2_WGM4_WGMXCC1_WGMXCCGn1
    SolutionIndex: 66
    SolutionNameMin: Cijk_Alik_Bjlk_HHS_BH_UserArgs_MT256x128x64_MI16x16x1_SN_LDSB1_CLR1_GSU0_GSUC0_GSUWGMRR0_K1_LBSPPA512_LBSPPB2048_LPB0_MIWT8_4_PLR1_SU32_SUM0_SUS256_SKXCCM4_VWA4_VWB4_WGM4_WGMXCC1_WGMXCCGn1
    SolutionIndex: 67
    SolutionNameMin: Cijk_Alik_Bjlk_HHS_BH_UserArgs_MT256x128x64_MI16x16x1_SN_LDSB1_CLR1_GSU0_GSUC0_GSUWGMRR0_K1_LBSPPA1024_LBSPPB2048_LPB0_MIWT8_4_PLR1_SU32_SUM0_SUS256_SKXCCM4_VWA8_VWB4_WGM4_WGMXCC1_WGMXCCGn1
    SolutionIndex: 68
    SolutionNameMin: Cijk_Alik_Bjlk_HHS_BH_UserArgs_MT128x128x64_MI16x16x1_SN_LDSB1_CLR1_GSU0_GSUC0_GSUWGMRR0_K1_LBSPPA256_LBSPPB2048_LPB0_MIWT4_4_PLR1_SU32_SUM0_SUS256_SKXCCM4_VWA2_VWB4_WGM1_WGMXCC1_WGMXCCGn1
    SolutionIndex: 69
    SolutionNameMin: Cijk_Alik_Bjlk_HHS_BH_UserArgs_MT128x128x64_MI16x16x1_SN_LDSB1_CLR1_GSU0_GSUC0_GSUWGMRR0_K1_LBSPPA512_LBSPPB2048_LPB0_MIWT4_4_PLR1_SU32_SUM0_SUS256_SKXCCM4_VWA4_VWB4_WGM1_WGMXCC1_WGMXCCGn1
    SolutionIndex: 70
    SolutionNameMin: Cijk_Alik_Bjlk_HHS_BH_UserArgs_MT128x128x64_MI16x16x1_SN_LDSB1_CLR1_GSU0_GSUC0_GSUWGMRR0_K1_LBSPPA256_LBSPPB2048_LPB0_MIWT4_4_PLR1_SU32_SUM0_SUS256_SKXCCM4_VWA2_VWB4_WGM2_WGMXCC1_WGMXCCGn1
    SolutionIndex: 71
    SolutionNameMin: Cijk_Alik_Bjlk_HHS_BH_UserArgs_MT128x128x64_MI16x16x1_SN_LDSB1_CLR1_GSU0_GSUC0_GSUWGMRR0_K1_LBSPPA512_LBSPPB2048_LPB0_MIWT4_4_PLR1_SU32_SUM0_SUS256_SKXCCM4_VWA4_VWB4_WGM2_WGMXCC1_WGMXCCGn1
    SolutionIndex: 72
    SolutionNameMin: Cijk_Alik_Bjlk_HHS_BH_UserArgs_MT128x128x64_MI16x16x1_SN_LDSB1_CLR1_GSU0_GSUC0_GSUWGMRR0_K1_LBSPPA256_LBSPPB2048_LPB0_MIWT4_4_PLR1_SU32_SUM0_SUS256_SKXCCM4_VWA2_VWB4_WGM4_WGMXCC1_WGMXCCGn1
    SolutionIndex: 73
    SolutionNameMin: Cijk_Alik_Bjlk_HHS_BH_UserArgs_MT128x128x64_MI16x16x1_SN_LDSB1_CLR1_GSU0_GSUC0_GSUWGMRR0_K1_LBSPPA512_LBSPPB2048_LPB0_MIWT4_4_PLR1_SU32_SUM0_SUS256_SKXCCM4_VWA4_VWB4_WGM4_WGMXCC1_WGMXCCGn1
    SolutionIndex: 74
    SolutionNameMin: Cijk_Alik_Bjlk_HHS_BH_UserArgs_MT128x64x64_MI16x16x1_SN_LDSB1_CLR1_GSU0_GSUC0_GSUWGMRR0_K1_LBSPPA256_LBSPPB1024_LPB32_MIWT4_2_PLR1_SU32_SUM0_SUS256_SKXCCM4_VWA2_VWB2_WGM1_WGMXCC1_WGMXCCGn1
    SolutionIndex: 75
    SolutionNameMin: Cijk_Alik_Bjlk_HHS_BH_UserArgs_MT64x64x64_MI16x16x1_SN_LDSB1_CLR1_GSU0_GSUC0_GSUWGMRR0_K1_LBSPPA256_LBSPPB1024_LPB32_MIWT2_2_PLR1_SU32_SUM0_SUS256_SKXCCM4_VWA2_VWB2_WGM1_WGMXCC1_WGMXCCGn1
    SolutionIndex: 76
    SolutionNameMin: Cijk_Alik_Bjlk_HHS_BH_UserArgs_MT32x64x64_MI16x16x1_SN_LDSB0_CLR1_GSU0_GSUC0_GSUWGMRR0_K1_LBSPPA128_LBSPPB1024_LPB32_MIWT1_2_PLR1_SU32_SUM0_SUS256_SKXCCM4_VWA1_VWB2_WGM1_WGMXCC1_WGMXCCGn1
    SolutionIndex: 77
    SolutionNameMin: Cijk_Alik_Bjlk_HHS_BH_UserArgs_MT32x32x64_MI16x16x1_SN_LDSB0_CLR1_GSU0_GSUC0_GSUWGMRR0_K1_LBSPPA128_LBSPPB512_LPB16_MIWT1_1_PLR1_SU32_SUM0_SUS256_SKXCCM4_VWA1_VWB1_WGM1_WGMXCC1_WGMXCCGn1
    SolutionIndex: 78
    SolutionNameMin: Cijk_Alik_Bjlk_HHS_BH_UserArgs_MT128x64x128_MI16x16x1_SN_LDSB1_CLR1_GSU0_GSUC0_GSUWGMRR0_K1_LBSPPA512_LBSPPB1024_LPB32_MIWT4_2_PLR2_SU32_SUM0_SUS256_SKXCCM4_VWA2_VWB2_WGM1_WGMXCC1_WGMXCCGn1
    SolutionIndex: 79
    SolutionNameMin: Cijk_Alik_Bjlk_HHS_BH_UserArgs_MT128x64x128_MI16x16x1_SN_LDSB1_CLR1_GSU0_GSUC0_GSUWGMRR0_K1_LBSPPA1024_LBSPPB1024_LPB32_MIWT4_2_PLR2_SU32_SUM0_SUS256_SKXCCM4_VWA4_VWB2_WGM1_WGMXCC1_WGMXCCGn1
    SolutionIndex: 80
    SolutionNameMin: Cijk_Alik_Bjlk_HHS_BH_UserArgs_MT128x64x128_MI16x16x1_SN_LDSB1_CLR1_GSU0_GSUC0_GSUWGMRR0_K1_LBSPPA1024_LBSPPB1024_LPB32_MIWT4_2_PLR2_SU32_SUM0_SUS256_SKXCCM4_VWA4_VWB2_WGM2_WGMXCC1_WGMXCCGn1
    SolutionIndex: 81
    SolutionNameMin: Cijk_Alik_Bjlk_HHS_BH_UserArgs_MT128x64x128_MI16x16x1_SN_LDSB1_CLR1_GSU0_GSUC0_GSUWGMRR0_K1_LBSPPA512_LBSPPB1024_LPB32_MIWT4_2_PLR2_SU32_SUM0_SUS256_SKXCCM4_VWA2_VWB2_WGM4_WGMXCC1_WGMXCCGn1
    SolutionIndex: 82
    SolutionNameMin: Cijk_Alik_Bjlk_HHS_BH_UserArgs_MT128x64x128_MI16x16x1_SN_LDSB1_CLR1_GSU0_GSUC0_GSUWGMRR0_K1_LBSPPA1024_LBSPPB1024_LPB32_MIWT4_2_PLR2_SU32_SUM0_SUS256_SKXCCM4_VWA4_VWB2_WGM4_WGMXCC1_WGMXCCGn1
    SolutionIndex: 83
    SolutionNameMin: Cijk_Alik_Bjlk_HHS_BH_UserArgs_MT64x64x128_MI16x16x1_SN_LDSB1_CLR1_GSU0_GSUC0_GSUWGMRR0_K1_LBSPPA512_LBSPPB1024_LPB32_MIWT2_2_PLR2_SU32_SUM0_SUS256_SKXCCM4_VWA2_VWB2_WGM1_WGMXCC1_WGMXCCGn1
    SolutionIndex: 84
    SolutionNameMin: Cijk_Alik_Bjlk_HHS_BH_UserArgs_MT64x64x128_MI16x16x1_SN_LDSB1_CLR1_GSU0_GSUC0_GSUWGMRR0_K1_LBSPPA512_LBSPPB1024_LPB32_MIWT2_2_PLR2_SU32_SUM0_SUS256_SKXCCM4_VWA2_VWB2_WGM4_WGMXCC1_WGMXCCGn1
    SolutionIndex: 85
    SolutionNameMin: Cijk_Alik_Bjlk_HHS_BH_UserArgs_MT32x64x128_MI16x16x1_SN_LDSB1_CLR1_GSU0_GSUC0_GSUWGMRR0_K1_LBSPPA256_LBSPPB1024_LPB32_MIWT1_2_PLR2_SU32_SUM0_SUS256_SKXCCM4_VWA1_VWB2_WGM1_WGMXCC1_WGMXCCGn1
    SolutionIndex: 86
    SolutionNameMin: Cijk_Alik_Bjlk_HHS_BH_UserArgs_MT32x32x128_MI16x16x1_SN_LDSB1_CLR1_GSU0_GSUC0_GSUWGMRR0_K1_LBSPPA256_LBSPPB512_LPB16_MIWT1_1_PLR1_SU32_SUM0_SUS256_SKXCCM4_VWA1_VWB1_WGM1_WGMXCC1_WGMXCCGn1
    SolutionIndex: 87
    SolutionNameMin: Cijk_Alik_Bjlk_HHS_BH_UserArgs_MT32x32x128_MI16x16x1_SN_LDSB1_CLR1_GSU0_GSUC0_GSUWGMRR0_K1_LBSPPA256_LBSPPB512_LPB16_MIWT1_1_PLR2_SU32_SUM0_SUS256_SKXCCM4_VWA1_VWB1_WGM1_WGMXCC1_WGMXCCGn1
    SolutionIndex: 88
    SolutionNameMin: Cijk_Alik_Bjlk_HHS_BH_UserArgs_MT32x32x32_MI16x16x1_SN_LDSB0_CLR1_GSU0_GSUC0_GSUWGMRR0_K1_LBSPPA128_LBSPPB256_LPB16_MIWT1_1_PLR1_SU32_SUM0_SUS256_SKXCCM0_VWA1_VWB1_WGM4_WGMXCC1_WGMXCCGn1
- - - [128, 128, 1, 128, 128, 128, 128, 128]
    - [20, 0.09]
  - - [128, 128, 1, 256, 128, 128, 256, 128]
    - [77, 0.164]
  - - [128, 128, 1, 512, 128, 128, 512, 128]
    - [77, 0.27]
  - - [128, 128, 1, 1024, 128, 128, 1024, 128]
    - [86, 0.401]
  - - [128, 128, 1, 2048, 128, 128, 2048, 128]
    - [87, 0.594]
  - - [128, 128, 1, 4096, 128, 128, 4096, 128]
    - [77, 1.021]
  - - [128, 128, 1, 8192, 128, 128, 8192, 128]
    - [86, 1.565]
  - - [128, 256, 1, 128, 128, 128, 128, 256]
    - [77, 0.178]
  - - [128, 256, 1, 256, 128, 128, 256, 256]
    - [32, 0.315]
  - - [128, 256, 1, 512, 128, 128, 512, 256]
    - [77, 0.53]
  - - [128, 256, 1, 1024, 128, 128, 1024, 256]
    - [33, 0.79]
  - - [128, 256, 1, 2048, 128, 128, 2048, 256]
    - [33, 1.159]
  - - [128, 256, 1, 4096, 128, 128, 4096, 256]
    - [76, 1.74]
  - - [128, 256, 1, 8192, 128, 128, 8192, 256]
    - [85, 2.723]
  - - [128, 512, 1, 128, 128, 128, 128, 512]
    - [20, 0.35]
  - - [128, 512, 1, 256, 128, 128, 256, 512]
    - [77, 0.628]
  - - [128, 512, 1, 512, 128, 128, 512, 512]
    - [32, 1.043]
  - - [128, 512, 1, 1024, 128, 128, 1024, 512]
    - [33, 1.576]
  - - [128, 512, 1, 2048, 128, 128, 2048, 512]
    - [33, 2.103]
  - - [128, 512, 1, 4096, 128, 128, 4096, 512]
    - [29, 2.969]
  - - [128, 512, 1, 8192, 128, 128, 8192, 512]
    - [83, 4.458]
  - - [128, 1024, 1, 128, 128, 128, 128, 1024]
    - [18, 0.652]
  - - [128, 1024, 1, 256, 128, 128, 256, 1024]
    - [29, 1.146]
  - - [128, 1024, 1, 512, 128, 128, 512, 1024]
    - [29, 1.89]
  - - [128, 1024, 1, 1024, 128, 128, 1024, 1024]
    - [29, 2.782]
  - - [128, 1024, 1, 2048, 128, 128, 2048, 1024]
    - [30, 3.616]
  - - [128, 1024, 1, 4096, 128, 128, 4096, 1024]
    - [28, 4.928]
  - - [128, 1024, 1, 8192, 128, 128, 8192, 1024]
    - [23, 7.041]
  - - [128, 2048, 1, 128, 128, 128, 128, 2048]
    - [75, 1.194]
  - - [128, 2048, 1, 256, 128, 128, 256, 2048]
    - [75, 2.038]
  - - [128, 2048, 1, 512, 128, 128, 512, 2048]
    - [83, 3.29]
  - - [128, 2048, 1, 1024, 128, 128, 1024, 2048]
    - [26, 4.736]
  - - [128, 2048, 1, 2048, 128, 128, 2048, 2048]
    - [83, 5.799]
  - - [128, 2048, 1, 4096, 128, 128, 4096, 2048]
    - [79, 7.387]
  - - [128, 2048, 1, 8192, 128, 128, 8192, 2048]
    - [13, 9.864]
  - - [128, 4096, 1, 128, 128, 128, 128, 4096]
    - [74, 2.046]
  - - [128, 4096, 1, 256, 128, 128, 256, 4096]
    - [16, 3.39]
  - - [128, 4096, 1, 512, 128, 128, 512, 4096]
    - [78, 5.222]
  - - [128, 4096, 1, 1024, 128, 128, 1024, 4096]
    - [78, 7.354]
  - - [128, 4096, 1, 2048, 128, 128, 2048, 4096]
    - [78, 8.905]
  - - [128, 4096, 1, 4096, 128, 128, 4096, 4096]
    - [13, 10.805]
  - - [128, 4096, 1, 8192, 128, 128, 8192, 4096]
    - [13, 13.553]
  - - [128, 8192, 1, 128, 128, 128, 128, 8192]
    - [68, 3.19]
  - - [128, 8192, 1, 256, 128, 128, 256, 8192]
    - [68, 5.343]
  - - [128, 8192, 1, 512, 128, 128, 512, 8192]
    - [68, 7.913]
  - - [128, 8192, 1, 1024, 128, 128, 1024, 8192]
    - [68, 10.204]
  - - [128, 8192, 1, 2048, 128, 128, 2048, 8192]
    - [69, 11.405]
  - - [128, 8192, 1, 4096, 128, 128, 4096, 8192]
    - [15, 14.14]
  - - [128, 8192, 1, 8192, 128, 128, 8192, 8192]
    - [69, 15.09]
  - - [256, 128, 1, 128, 256, 256, 128, 128]
    - [32, 0.177]
  - - [256, 128, 1, 256, 256, 256, 256, 128]
    - [77, 0.323]
  - - [256, 128, 1, 512, 256, 256, 512, 128]
    - [33, 0.533]
  - - [256, 128, 1, 1024, 256, 256, 1024, 128]
    - [33, 0.798]
  - - [256, 128, 1, 2048, 256, 256, 2048, 128]
    - [86, 1.155]
  - - [256, 128, 1, 4096, 256, 256, 4096, 128]
    - [76, 1.737]
  - - [256, 128, 1, 8192, 256, 256, 8192, 128]
    - [85, 2.739]
  - - [256, 256, 1, 128, 256, 256, 128, 256]
    - [20, 0.35]
  - - [256, 256, 1, 256, 256, 256, 256, 256]
    - [77, 0.63]
  - - [256, 256, 1, 512, 256, 256, 512, 256]
    - [32, 1.049]
  - - [256, 256, 1, 1024, 256, 256, 1024, 256]
    - [32, 1.582]
  - - [256, 256, 1, 2048, 256, 256, 2048, 256]
    - [33, 2.094]
  - - [256, 256, 1, 4096, 256, 256, 4096, 256]
    - [85, 2.964]
  - - [256, 256, 1, 8192, 256, 256, 8192, 256]
    - [83, 4.507]
  - - [256, 512, 1, 128, 256, 256, 128, 512]
    - [19, 0.658]
  - - [256, 512, 1, 256, 256, 256, 256, 512]
    - [19, 1.139]
  - - [256, 512, 1, 512, 256, 256, 512, 512]
    - [31, 1.873]
  - - [256, 512, 1, 1024, 256, 256, 1024, 512]
    - [31, 2.728]
  - - [256, 512, 1, 2048, 256, 256, 2048, 512]
    - [29, 3.641]
  - - [256, 512, 1, 4096, 256, 256, 4096, 512]
    - [26, 5.008]
  - - [256, 512, 1, 8192, 256, 256, 8192, 512]
    - [82, 7.049]
  - - [256, 1024, 1, 128, 256, 256, 128, 1024]
    - [10, 1.189]
  - - [256, 1024, 1, 256, 256, 256, 256, 1024]
    - [26, 2.042]
  - - [256, 1024, 1, 512, 256, 256, 512, 1024]
    - [26, 3.198]
  - - [256, 1024, 1, 1024, 256, 256, 1024, 1024]
    - [26, 4.746]
  - - [256, 1024, 1, 2048, 256, 256, 2048, 1024]
    - [27, 5.993]
  - - [256, 1024, 1, 4096, 256, 256, 4096, 1024]
    - [25, 7.816]
  - - [256, 1024, 1, 8192, 256, 256, 8192, 1024]
    - [73, 9.762]
  - - [256, 2048, 1, 128, 256, 256, 128, 2048]
    - [16, 2.027]
  - - [256, 2048, 1, 256, 256, 256, 256, 2048]
    - [16, 3.383]
  - - [256, 2048, 1, 512, 256, 256, 512, 2048]
    - [78, 5.178]
  - - [256, 2048, 1, 1024, 256, 256, 1024, 2048]
    - [79, 7.261]
  - - [256, 2048, 1, 2048, 256, 256, 2048, 2048]
    - [78, 8.941]
  - - [256, 2048, 1, 4096, 256, 256, 4096, 2048]
    - [71, 10.591]
  - - [256, 2048, 1, 8192, 256, 256, 8192, 2048]
    - [73, 13.348]
  - - [256, 4096, 1, 128, 256, 256, 128, 4096]
    - [68, 3.169]
  - - [256, 4096, 1, 256, 256, 256, 256, 4096]
    - [68, 5.33]
  - - [256, 4096, 1, 512, 256, 256, 512, 4096]
    - [68, 7.958]
  - - [256, 4096, 1, 1024, 256, 256, 1024, 4096]
    - [68, 10.599]
  - - [256, 4096, 1, 2048, 256, 256, 2048, 4096]
    - [73, 11.392]
  - - [256, 4096, 1, 4096, 256, 256, 4096, 4096]
    - [73, 13.879]
  - - [256, 4096, 1, 8192, 256, 256, 8192, 4096]
    - [12, 15.3]
  - - [256, 8192, 1, 128, 256, 256, 128, 8192]
    - [51, 4.644]
  - - [256, 8192, 1, 256, 256, 256, 256, 8192]
    - [51, 7.319]
  - - [256, 8192, 1, 512, 256, 256, 512, 8192]
    - [52, 10.126]
  - - [256, 8192, 1, 1024, 256, 256, 1024, 8192]
    - [61, 12.205]
  - - [256, 8192, 1, 2048, 256, 256, 2048, 8192]
    - [13, 13.39]
  - - [256, 8192, 1, 4096, 256, 256, 4096, 8192]
    - [62, 15.541]
  - - [256, 8192, 1, 8192, 256, 256, 8192, 8192]
    - [62, 16.912]
  - - [512, 128, 1, 128, 512, 512, 128, 128]
    - [77, 0.355]
  - - [512, 128, 1, 256, 512, 512, 256, 128]
    - [77, 0.636]
  - - [512, 128, 1, 512, 512, 512, 512, 128]
    - [77, 1.051]
  - - [512, 128, 1, 1024, 512, 512, 1024, 128]
    - [87, 1.561]
  - - [512, 128, 1, 2048, 512, 512, 2048, 128]
    - [33, 2.083]
  - - [512, 128, 1, 4096, 512, 512, 4096, 128]
    - [29, 2.966]
  - - [512, 128, 1, 8192, 512, 512, 8192, 128]
    - [83, 4.507]
  - - [512, 256, 1, 128, 512, 512, 128, 256]
    - [19, 0.659]
  - - [512, 256, 1, 256, 512, 512, 256, 256]
    - [19, 1.148]
  - - [512, 256, 1, 512, 512, 512, 512, 256]
    - [85, 1.866]
  - - [512, 256, 1, 1024, 512, 512, 1024, 256]
    - [29, 2.77]
  - - [512, 256, 1, 2048, 512, 512, 2048, 256]
    - [85, 3.637]
  - - [512, 256, 1, 4096, 512, 512, 4096, 256]
    - [84, 4.961]
  - - [512, 256, 1, 8192, 512, 512, 8192, 256]
    - [23, 6.996]
  - - [512, 512, 1, 128, 512, 512, 128, 512]
    - [10, 1.188]
  - - [512, 512, 1, 256, 512, 512, 256, 512]
    - [75, 2.04]
  - - [512, 512, 1, 512, 512, 512, 512, 512]
    - [26, 3.295]
  - - [512, 512, 1, 1024, 512, 512, 1024, 512]
    - [83, 4.726]
  - - [512, 512, 1, 2048, 512, 512, 2048, 512]
    - [26, 6.041]
  - - [512, 512, 1, 4096, 512, 512, 4096, 512]
    - [23, 7.797]
  - - [512, 512, 1, 8192, 512, 512, 8192, 512]
    - [73, 9.72]
  - - [512, 1024, 1, 128, 512, 512, 128, 1024]
    - [57, 2.025]
  - - [512, 1024, 1, 256, 512, 512, 256, 1024]
    - [16, 3.37]
  - - [512, 1024, 1, 512, 512, 512, 512, 1024]
    - [78, 5.199]
  - - [512, 1024, 1, 1024, 512, 512, 1024, 1024]
    - [78, 7.322]
  - - [512, 1024, 1, 2048, 512, 512, 2048, 1024]
    - [25, 8.901]
  - - [512, 1024, 1, 4096, 512, 512, 4096, 1024]
    - [73, 10.502]
  - - [512, 1024, 1, 8192, 512, 512, 8192, 1024]
    - [73, 13.233]
  - - [512, 2048, 1, 128, 512, 512, 128, 2048]
    - [68, 3.201]
  - - [512, 2048, 1, 256, 512, 512, 256, 2048]
    - [68, 5.337]
  - - [512, 2048, 1, 512, 512, 512, 512, 2048]
    - [69, 7.888]
  - - [512, 2048, 1, 1024, 512, 512, 1024, 2048]
    - [68, 10.577]
  - - [512, 2048, 1, 2048, 512, 512, 2048, 2048]
    - [73, 11.181]
  - - [512, 2048, 1, 4096, 512, 512, 4096, 2048]
    - [73, 13.585]
  - - [512, 2048, 1, 8192, 512, 512, 8192, 2048]
    - [71, 15.182]
  - - [512, 4096, 1, 128, 512, 512, 128, 4096]
    - [52, 4.681]
  - - [512, 4096, 1, 256, 512, 512, 256, 4096]
    - [52, 7.348]
  - - [512, 4096, 1, 512, 512, 512, 512, 4096]
    - [51, 10.259]
  - - [512, 4096, 1, 1024, 512, 512, 1024, 4096]
    - [65, 12.212]
  - - [512, 4096, 1, 2048, 512, 512, 2048, 4096]
    - [66, 13.118]
  - - [512, 4096, 1, 4096, 512, 512, 4096, 4096]
    - [64, 15.226]
  - - [512, 4096, 1, 8192, 512, 512, 8192, 4096]
    - [41, 16.9]
  - - [512, 8192, 1, 128, 512, 512, 128, 8192]
    - [38, 5.724]
  - - [512, 8192, 1, 256, 512, 512, 256, 8192]
    - [46, 8.423]
  - - [512, 8192, 1, 512, 512, 512, 512, 8192]
    - [2, 11.514]
  - - [512, 8192, 1, 1024, 512, 512, 1024, 8192]
    - [49, 12.636]
  - - [512, 8192, 1, 2048, 512, 512, 2048, 8192]
    - [43, 14.783]
  - - [512, 8192, 1, 4096, 512, 512, 4096, 8192]
    - [43, 16.799]
  - - [512, 8192, 1, 8192, 512, 512, 8192, 8192]
    - [45, 18.83]
  - - [1024, 128, 1, 128, 1024, 1024, 128, 128]
    - [19, 0.657]
  - - [1024, 128, 1, 256, 1024, 1024, 256, 128]
    - [19, 1.133]
  - - [1024, 128, 1, 512, 1024, 1024, 512, 128]
    - [31, 1.872]
  - - [1024, 128, 1, 1024, 1024, 1024, 1024, 128]
    - [85, 2.766]
  - - [1024, 128, 1, 2048, 1024, 1024, 2048, 128]
    - [29, 3.625]
  - - [1024, 128, 1, 4096, 1024, 1024, 4096, 128]
    - [26, 5.004]
  - - [1024, 128, 1, 8192, 1024, 1024, 8192, 128]
    - [23, 6.95]
  - - [1024, 256, 1, 128, 1024, 1024, 128, 256]
    - [75, 1.191]
  - - [1024, 256, 1, 256, 1024, 1024, 256, 256]
    - [75, 2.053]
  - - [1024, 256, 1, 512, 1024, 1024, 512, 256]
    - [83, 3.283]
  - - [1024, 256, 1, 1024, 1024, 1024, 1024, 256]
    - [83, 4.736]
  - - [1024, 256, 1, 2048, 1024, 1024, 2048, 256]
    - [26, 6.036]
  - - [1024, 256, 1, 4096, 1024, 1024, 4096, 256]
    - [21, 7.529]
  - - [1024, 256, 1, 8192, 1024, 1024, 8192, 256]
    - [13, 9.663]
  - - [1024, 512, 1, 128, 1024, 1024, 128, 512]
    - [58, 2.031]
  - - [1024, 512, 1, 256, 1024, 1024, 256, 512]
    - [74, 3.392]
  - - [1024, 512, 1, 512, 1024, 1024, 512, 512]
    - [78, 5.204]
  - - [1024, 512, 1, 1024, 1024, 1024, 1024, 512]
    - [79, 7.285]
  - - [1024, 512, 1, 2048, 1024, 1024, 2048, 512]
    - [24, 9.054]
  - - [1024, 512, 1, 4096, 1024, 1024, 4096, 512]
    - [13, 10.386]
  - - [1024, 512, 1, 8192, 1024, 1024, 8192, 512]
    - [73, 13.22]
  - - [1024, 1024, 1, 128, 1024, 1024, 128, 1024]
    - [68, 3.201]
  - - [1024, 1024, 1, 256, 1024, 1024, 256, 1024]
    - [68, 5.327]
  - - [1024, 1024, 1, 512, 1024, 1024, 512, 1024]
    - [68, 7.97]
  - - [1024, 1024, 1, 1024, 1024, 1024, 1024, 1024]
    - [14, 10.284]
  - - [1024, 1024, 1, 2048, 1024, 1024, 2048, 1024]
    - [73, 11.005]
  - - [1024, 1024, 1, 4096, 1024, 1024, 4096, 1024]
    - [73, 13.72]
  - - [1024, 1024, 1, 8192, 1024, 1024, 8192, 1024]
    - [15, 15.123]
  - - [1024, 2048, 1, 128, 1024, 1024, 128, 2048]
    - [52, 4.671]
  - - [1024, 2048, 1, 256, 1024, 1024, 256, 2048]
    - [52, 7.349]
  - - [1024, 2048, 1, 512, 1024, 1024, 512, 2048]
    - [51, 10.2]
  - - [1024, 2048, 1, 1024, 1024, 1024, 1024, 2048]
    - [67, 12.02]
  - - [1024, 2048, 1, 2048, 1024, 1024, 2048, 2048]
    - [49, 13.166]
  - - [1024, 2048, 1, 4096, 1024, 1024, 4096, 2048]
    - [49, 15.296]
  - - [1024, 2048, 1, 8192, 1024, 1024, 8192, 2048]
    - [63, 16.892]
  - - [1024, 4096, 1, 128, 1024, 1024, 128, 4096]
    - [4, 5.736]
  - - [1024, 4096, 1, 256, 1024, 1024, 256, 4096]
    - [4, 8.567]
  - - [1024, 4096, 1, 512, 1024, 1024, 512, 4096]
    - [2, 11.597]
  - - [1024, 4096, 1, 1024, 1024, 1024, 1024, 4096]
    - [49, 12.414]
  - - [1024, 4096, 1, 2048, 1024, 1024, 2048, 4096]
    - [47, 14.841]
  - - [1024, 4096, 1, 4096, 1024, 1024, 4096, 4096]
    - [41, 16.966]
  - - [1024, 4096, 1, 8192, 1024, 1024, 8192, 4096]
    - [41, 18.847]
  - - [1024, 8192, 1, 128, 1024, 1024, 128, 8192]
    - [50, 5.118]
  - - [1024, 8192, 1, 256, 1024, 1024, 256, 8192]
    - [47, 8.137]
  - - [1024, 8192, 1, 512, 1024, 1024, 512, 8192]
    - [62, 11.261]
  - - [1024, 8192, 1, 1024, 1024, 1024, 1024, 8192]
    - [39, 14.015]
  - - [1024, 8192, 1, 2048, 1024, 1024, 2048, 8192]
    - [45, 16.224]
  - - [1024, 8192, 1, 4096, 1024, 1024, 4096, 8192]
    - [35, 18.207]
  - - [1024, 8192, 1, 8192, 1024, 1024, 8192, 8192]
    - [43, 20.131]
  - - [2048, 128, 1, 128, 2048, 2048, 128, 128]
    - [10, 1.187]
  - - [2048, 128, 1, 256, 2048, 2048, 256, 128]
    - [17, 2.05]
  - - [2048, 128, 1, 512, 2048, 2048, 512, 128]
    - [26, 3.292]
  - - [2048, 128, 1, 1024, 2048, 2048, 1024, 128]
    - [26, 4.721]
  - - [2048, 128, 1, 2048, 2048, 2048, 2048, 128]
    - [26, 6.032]
  - - [2048, 128, 1, 4096, 2048, 2048, 4096, 128]
    - [80, 7.353]
  - - [2048, 128, 1, 8192, 2048, 2048, 8192, 128]
    - [13, 9.642]
  - - [2048, 256, 1, 128, 2048, 2048, 128, 256]
    - [57, 2.037]
  - - [2048, 256, 1, 256, 2048, 2048, 256, 256]
    - [74, 3.399]
  - - [2048, 256, 1, 512, 2048, 2048, 512, 256]
    - [78, 5.194]
  - - [2048, 256, 1, 1024, 2048, 2048, 1024, 256]
    - [23, 7.294]
  - - [2048, 256, 1, 2048, 2048, 2048, 2048, 256]
    - [82, 9.083]
  - - [2048, 256, 1, 4096, 2048, 2048, 4096, 256]
    - [15, 10.407]
  - - [2048, 256, 1, 8192, 2048, 2048, 8192, 256]
    - [73, 13.159]
  - - [2048, 512, 1, 128, 2048, 2048, 128, 512]
    - [68, 3.204]
  - - [2048, 512, 1, 256, 2048, 2048, 256, 512]
    - [68, 5.351]
  - - [2048, 512, 1, 512, 2048, 2048, 512, 512]
    - [69, 7.9]
  - - [2048, 512, 1, 1024, 2048, 2048, 1024, 512]
    - [70, 10.44]
  - - [2048, 512, 1, 2048, 2048, 2048, 2048, 512]
    - [13, 11.04]
  - - [2048, 512, 1, 4096, 2048, 2048, 4096, 512]
    - [69, 13.492]
  - - [2048, 512, 1, 8192, 2048, 2048, 8192, 512]
    - [73, 15.238]
  - - [2048, 1024, 1, 128, 2048, 2048, 128, 1024]
    - [52, 4.692]
  - - [2048, 1024, 1, 256, 2048, 2048, 256, 1024]
    - [52, 7.335]
  - - [2048, 1024, 1, 512, 2048, 2048, 512, 1024]
    - [56, 10.168]
  - - [2048, 1024, 1, 1024, 2048, 2048, 1024, 1024]
    - [67, 12.035]
  - - [2048, 1024, 1, 2048, 2048, 2048, 2048, 1024]
    - [59, 12.988]
  - - [2048, 1024, 1, 4096, 2048, 2048, 4096, 1024]
    - [48, 15.102]
  - - [2048, 1024, 1, 8192, 2048, 2048, 8192, 1024]
    - [45, 16.873]
  - - [2048, 2048, 1, 128, 2048, 2048, 128, 2048]
    - [36, 5.816]
  - - [2048, 2048, 1, 256, 2048, 2048, 256, 2048]
    - [44, 8.566]
  - - [2048, 2048, 1, 512, 2048, 2048, 512, 2048]
    - [2, 11.603]
  - - [2048, 2048, 1, 1024, 2048, 2048, 1024, 2048]
    - [49, 12.372]
  - - [2048, 2048, 1, 2048, 2048, 2048, 2048, 2048]
    - [60, 14.62]
  - - [2048, 2048, 1, 4096, 2048, 2048, 4096, 2048]
    - [35, 16.858]
  - - [2048, 2048, 1, 8192, 2048, 2048, 8192, 2048]
    - [37, 18.915]
  - - [2048, 4096, 1, 128, 2048, 2048, 128, 4096]
    - [50, 5.114]
  - - [2048, 4096, 1, 256, 2048, 2048, 256, 4096]
    - [47, 8.073]
  - - [2048, 4096, 1, 512, 2048, 2048, 512, 4096]
    - [59, 11.102]
  - - [2048, 4096, 1, 1024, 2048, 2048, 1024, 4096]
    - [35, 13.86]
  - - [2048, 4096, 1, 2048, 2048, 2048, 2048, 4096]
    - [8, 16.239]
  - - [2048, 4096, 1, 4096, 2048, 2048, 4096, 4096]
    - [37, 18.376]
  - - [2048, 4096, 1, 8192, 2048, 2048, 8192, 4096]
    - [40, 20.172]
  - - [2048, 8192, 1, 128, 2048, 2048, 128, 8192]
    - [52, 6.493]
  - - [2048, 8192, 1, 256, 2048, 2048, 256, 8192]
    - [37, 9.483]
  - - [2048, 8192, 1, 512, 2048, 2048, 512, 8192]
    - [38, 12.582]
  - - [2048, 8192, 1, 1024, 2048, 2048, 1024, 8192]
    - [3, 15.166]
  - - [2048, 8192, 1, 2048, 2048, 2048, 2048, 8192]
    - [3, 17.709]
  - - [2048, 8192, 1, 4096, 2048, 2048, 4096, 8192]
    - [4, 19.548]
  - - [2048, 8192, 1, 8192, 2048, 2048, 8192, 8192]
    - [1, 20.64]
  - - [4096, 128, 1, 128, 4096, 4096, 128, 128]
    - [74, 2.061]
  - - [4096, 128, 1, 256, 4096, 4096, 256, 128]
    - [74, 3.459]
  - - [4096, 128, 1, 512, 4096, 4096, 512, 128]
    - [74, 5.136]
  - - [4096, 128, 1, 1024, 4096, 4096, 1024, 128]
    - [81, 7.178]
  - - [4096, 128, 1, 2048, 4096, 4096, 2048, 128]
    - [22, 8.221]
  - - [4096, 128, 1, 4096, 4096, 4096, 4096, 128]
    - [13, 10.42]
  - - [4096, 128, 1, 8192, 4096, 4096, 8192, 128]
    - [69, 13.318]
  - - [4096, 256, 1, 128, 4096, 4096, 128, 256]
    - [68, 3.177]
  - - [4096, 256, 1, 256, 4096, 4096, 256, 256]
    - [69, 5.234]
  - - [4096, 256, 1, 512, 4096, 4096, 512, 256]
    - [70, 7.883]
  - - [4096, 256, 1, 1024, 4096, 4096, 1024, 256]
    - [72, 10.478]
  - - [4096, 256, 1, 2048, 4096, 4096, 2048, 256]
    - [71, 10.849]
  - - [4096, 256, 1, 4096, 4096, 4096, 4096, 256]
    - [69, 13.59]
  - - [4096, 256, 1, 8192, 4096, 4096, 8192, 256]
    - [15, 15.206]
  - - [4096, 512, 1, 128, 4096, 4096, 128, 512]
    - [52, 4.701]
  - - [4096, 512, 1, 256, 4096, 4096, 256, 512]
    - [54, 7.061]
  - - [4096, 512, 1, 512, 4096, 4096, 512, 512]
    - [56, 10.175]
  - - [4096, 512, 1, 1024, 4096, 4096, 1024, 512]
    - [67, 12.021]
  - - [4096, 512, 1, 2048, 4096, 4096, 2048, 512]
    - [48, 12.93]
  - - [4096, 512, 1, 4096, 4096, 4096, 4096, 512]
    - [47, 15.193]
  - - [4096, 512, 1, 8192, 4096, 4096, 8192, 512]
    - [35, 16.811]
  - - [4096, 1024, 1, 128, 4096, 4096, 128, 1024]
    - [36, 5.792]
  - - [4096, 1024, 1, 256, 4096, 4096, 256, 1024]
    - [0, 8.408]
  - - [4096, 1024, 1, 512, 4096, 4096, 512, 1024]
    - [0, 11.661]
  - - [4096, 1024, 1, 1024, 4096, 4096, 1024, 1024]
    - [49, 12.309]
  - - [4096, 1024, 1, 2048, 4096, 4096, 2048, 1024]
    - [59, 14.576]
  - - [4096, 1024, 1, 4096, 4096, 4096, 4096, 1024]
    - [41, 16.763]
  - - [4096, 1024, 1, 8192, 4096, 4096, 8192, 1024]
    - [5, 18.769]
  - - [4096, 2048, 1, 128, 4096, 4096, 128, 2048]
    - [50, 5.149]
  - - [4096, 2048, 1, 256, 4096, 4096, 256, 2048]
    - [47, 8.006]
  - - [4096, 2048, 1, 512, 4096, 4096, 512, 2048]
    - [59, 10.968]
  - - [4096, 2048, 1, 1024, 4096, 4096, 1024, 2048]
    - [45, 13.95]
  - - [4096, 2048, 1, 2048, 4096, 4096, 2048, 2048]
    - [38, 16.101]
  - - [4096, 2048, 1, 4096, 4096, 4096, 4096, 2048]
    - [37, 18.351]
  - - [4096, 2048, 1, 8192, 4096, 4096, 8192, 2048]
    - [35, 20.191]
  - - [4096, 4096, 1, 128, 4096, 4096, 128, 4096]
    - [52, 6.486]
  - - [4096, 4096, 1, 256, 4096, 4096, 256, 4096]
    - [45, 9.396]
  - - [4096, 4096, 1, 512, 4096, 4096, 512, 4096]
    - [44, 12.26]
  - - [4096, 4096, 1, 1024, 4096, 4096, 1024, 4096]
    - [1, 15.221]
  - - [4096, 4096, 1, 2048, 4096, 4096, 2048, 4096]
    - [2, 17.52]
  - - [4096, 4096, 1, 4096, 4096, 4096, 4096, 4096]
    - [2, 19.592]
  - - [4096, 4096, 1, 8192, 4096, 4096, 8192, 4096]
    - [43, 20.669]
  - - [4096, 8192, 1, 128, 4096, 4096, 128, 8192]
    - [34, 7.361]
  - - [4096, 8192, 1, 256, 4096, 4096, 256, 8192]
    - [38, 10.161]
  - - [4096, 8192, 1, 512, 4096, 4096, 512, 8192]
    - [6, 13.545]
  - - [4096, 8192, 1, 1024, 4096, 4096, 1024, 8192]
    - [2, 16.533]
  - - [4096, 8192, 1, 2048, 4096, 4096, 2048, 8192]
    - [44, 18.5]
  - - [4096, 8192, 1, 4096, 4096, 4096, 4096, 8192]
    - [46, 19.899]
  - - [4096, 8192, 1, 8192, 4096, 4096, 8192, 8192]
    - [44, 21.054]
  - - [8192, 128, 1, 128, 8192, 8192, 128, 128]
    - [68, 2.983]
  - - [8192, 128, 1, 256, 8192, 8192, 256, 128]
    - [68, 5.054]
  - - [8192, 128, 1, 512, 8192, 8192, 512, 128]
    - [68, 7.492]
  - - [8192, 128, 1, 1024, 8192, 8192, 1024, 128]
    - [13, 9.6]
  - - [8192, 128, 1, 2048, 8192, 8192, 2048, 128]
    - [13, 10.668]
  - - [8192, 128, 1, 4096, 8192, 8192, 4096, 128]
    - [13, 13.623]
  - - [8192, 128, 1, 8192, 8192, 8192, 8192, 128]
    - [73, 15.241]
  - - [8192, 256, 1, 128, 8192, 8192, 128, 256]
    - [51, 4.733]
  - - [8192, 256, 1, 256, 8192, 8192, 256, 256]
    - [55, 7.195]
  - - [8192, 256, 1, 512, 8192, 8192, 512, 256]
    - [55, 9.931]
  - - [8192, 256, 1, 1024, 8192, 8192, 1024, 256]
    - [59, 11.487]
  - - [8192, 256, 1, 2048, 8192, 8192, 2048, 256]
    - [9, 12.892]
  - - [8192, 256, 1, 4096, 8192, 8192, 4096, 256]
    - [59, 15.438]
  - - [8192, 256, 1, 8192, 8192, 8192, 8192, 256]
    - [45, 17.016]
  - - [8192, 512, 1, 128, 8192, 8192, 128, 512]
    - [46, 5.739]
  - - [8192, 512, 1, 256, 8192, 8192, 256, 512]
    - [46, 8.406]
  - - [8192, 512, 1, 512, 8192, 8192, 512, 512]
    - [46, 11.325]
  - - [8192, 512, 1, 1024, 8192, 8192, 1024, 512]
    - [47, 12.289]
  - - [8192, 512, 1, 2048, 8192, 8192, 2048, 512]
    - [11, 14.667]
  - - [8192, 512, 1, 4096, 8192, 8192, 4096, 512]
    - [45, 16.764]
  - - [8192, 512, 1, 8192, 8192, 8192, 8192, 512]
    - [37, 18.757]
  - - [8192, 1024, 1, 128, 8192, 8192, 128, 1024]
    - [53, 5.018]
  - - [8192, 1024, 1, 256, 8192, 8192, 256, 1024]
    - [47, 7.907]
  - - [8192, 1024, 1, 512, 8192, 8192, 512, 1024]
    - [59, 10.917]
  - - [8192, 1024, 1, 1024, 8192, 8192, 1024, 1024]
    - [45, 13.783]
  - - [8192, 1024, 1, 2048, 8192, 8192, 2048, 1024]
    - [37, 15.999]
  - - [8192, 1024, 1, 4096, 8192, 8192, 4096, 1024]
    - [1, 18.275]
  - - [8192, 1024, 1, 8192, 8192, 8192, 8192, 1024]
    - [42, 20.016]
  - - [8192, 2048, 1, 128, 8192, 8192, 128, 2048]
    - [52, 6.259]
  - - [8192, 2048, 1, 256, 8192, 8192, 256, 2048]
    - [41, 9.307]
  - - [8192, 2048, 1, 512, 8192, 8192, 512, 2048]
    - [44, 12.325]
  - - [8192, 2048, 1, 1024, 8192, 8192, 1024, 2048]
    - [45, 15.146]
  - - [8192, 2048, 1, 2048, 8192, 8192, 2048, 2048]
    - [43, 17.515]
  - - [8192, 2048, 1, 4096, 8192, 8192, 4096, 2048]
    - [43, 19.45]
  - - [8192, 2048, 1, 8192, 8192, 8192, 8192, 2048]
    - [44, 20.723]
  - - [8192, 4096, 1, 128, 8192, 8192, 128, 4096]
    - [38, 7.21]
  - - [8192, 4096, 1, 256, 8192, 8192, 256, 4096]
    - [3, 10.102]
  - - [8192, 4096, 1, 512, 8192, 8192, 512, 4096]
    - [3, 13.521]
  - - [8192, 4096, 1, 1024, 8192, 8192, 1024, 4096]
    - [46, 16.42]
  - - [8192, 4096, 1, 2048, 8192, 8192, 2048, 4096]
    - [44, 18.525]
  - - [8192, 4096, 1, 4096, 8192, 8192, 4096, 4096]
    - [44, 20.044]
  - - [8192, 4096, 1, 8192, 8192, 8192, 8192, 4096]
    - [43, 21.126]
  - - [8192, 8192, 1, 128, 8192, 8192, 128, 8192]
    - [7, 7.608]
  - - [8192, 8192, 1, 256, 8192, 8192, 256, 8192]
    - [0, 10.191]
  - - [8192, 8192, 1, 512, 8192, 8192, 512, 8192]
    - [46, 13.926]
  - - [8192, 8192, 1, 1024, 8192, 8192, 1024, 8192]
    - [46, 16.946]
  - - [8192, 8192, 1, 2048, 8192, 8192, 2048, 8192]
    - [44, 18.756]
  - - [8192, 8192, 1, 4096, 8192, 8192, 4096, 8192]
    - [44, 20.261]
  - - [8192, 8192, 1, 8192, 8192, 8192, 8192, 8192]
    - [2, 21.144]
  - - [1, 1, 1, 32, 1, 1, 32, 1]
    - [88, 0.0]
- null
- null
- ExperimentalStreamK
- GridBased
