library/src/amd_detail/rocblaslt/src/Tensile/Logic/asm_full/aquavanjaram/gfx942_80cu/StreamK/aquavanjaram942_Cijk_Ailk_Bljk_BBS_BH_UserArgs.yaml
- {MinimumRequiredVersion: 4.33.0}
- aquavanjaram942
- {Architecture: gfx942, CUCount: 80}
- [Device 0049, Device 0050]
    SolutionIndex: 0
    SolutionNameMin: Cijk_Ailk_Bljk_BBS_BH_UserArgs_MT256x256x32_MI16x16x1_SN_LDSB1_CLR1_GSU0_GSUC0_GSUWGMRR0_K1_LBSPPA2048_LBSPPB128_LPA0_MIWT8_8_PLR1_SU32_SUM0_SUS256_SKXCCM0_VWA4_VWB1_WGM1_WGMXCC1_WGMXCCGn1
    SolutionIndex: 1
    SolutionNameMin: Cijk_Ailk_Bljk_BBS_BH_UserArgs_MT256x256x32_MI16x16x1_SN_LDSB1_CLR1_GSU0_GSUC0_GSUWGMRR0_K1_LBSPPA2048_LBSPPB128_LPA0_MIWT8_8_PLR1_SU32_SUM0_SUS256_SKXCCM0_VWA8_VWB1_WGM1_WGMXCC1_WGMXCCGn1
    SolutionIndex: 2
    SolutionNameMin: Cijk_Ailk_Bljk_BBS_BH_UserArgs_MT256x256x32_MI16x16x1_SN_LDSB1_CLR1_GSU0_GSUC0_GSUWGMRR0_K1_LBSPPA2048_LBSPPB128_LPA0_MIWT8_8_PLR1_SU32_SUM0_SUS256_SKXCCM0_VWA4_VWB2_WGM1_WGMXCC1_WGMXCCGn1
    SolutionIndex: 3
    SolutionNameMin: Cijk_Ailk_Bljk_BBS_BH_UserArgs_MT256x256x32_MI16x16x1_SN_LDSB1_CLR1_GSU0_GSUC0_GSUWGMRR0_K1_LBSPPA2048_LBSPPB128_LPA0_MIWT8_8_PLR1_SU32_SUM0_SUS256_SKXCCM0_VWA8_VWB2_WGM1_WGMXCC1_WGMXCCGn1
    SolutionIndex: 4
    SolutionNameMin: Cijk_Ailk_Bljk_BBS_BH_UserArgs_MT256x256x32_MI16x16x1_SN_LDSB1_CLR1_GSU0_GSUC0_GSUWGMRR0_K1_LBSPPA2048_LBSPPB512_LPA0_MIWT8_8_PLR1_SU32_SUM0_SUS256_SKXCCM0_VWA8_VWB8_WGM1_WGMXCC1_WGMXCCGn1
    SolutionIndex: 5
    SolutionNameMin: Cijk_Ailk_Bljk_BBS_BH_UserArgs_MT256x256x32_MI16x16x1_SN_LDSB1_CLR1_GSU0_GSUC0_GSUWGMRR0_K1_LBSPPA2048_LBSPPB128_LPA0_MIWT8_8_PLR1_SU32_SUM0_SUS256_SKXCCM0_VWA4_VWB1_WGM2_WGMXCC1_WGMXCCGn1
    SolutionIndex: 6
    SolutionNameMin: Cijk_Ailk_Bljk_BBS_BH_UserArgs_MT256x256x32_MI16x16x1_SN_LDSB1_CLR1_GSU0_GSUC0_GSUWGMRR0_K1_LBSPPA2048_LBSPPB128_LPA0_MIWT8_8_PLR1_SU32_SUM0_SUS256_SKXCCM0_VWA8_VWB2_WGM2_WGMXCC1_WGMXCCGn1
    SolutionIndex: 7
    SolutionNameMin: Cijk_Ailk_Bljk_BBS_BH_UserArgs_MT256x256x32_MI16x16x1_SN_LDSB1_CLR1_GSU0_GSUC0_GSUWGMRR0_K1_LBSPPA2048_LBSPPB128_LPA0_MIWT8_8_PLR1_SU32_SUM0_SUS256_SKXCCM0_VWA4_VWB1_WGM4_WGMXCC1_WGMXCCGn1
    SolutionIndex: 8
    SolutionNameMin: Cijk_Ailk_Bljk_BBS_BH_UserArgs_MT256x128x32_MI16x16x1_SN_LDSB1_CLR1_GSU0_GSUC0_GSUWGMRR0_K1_LBSPPA2048_LBSPPB256_LPA0_MIWT8_4_PLR1_SU32_SUM0_SUS256_SKXCCM0_VWA4_VWB4_WGM1_WGMXCC1_WGMXCCGn1
    SolutionIndex: 9
    SolutionNameMin: Cijk_Ailk_Bljk_BBS_BH_UserArgs_MT256x64x32_MI16x16x1_SN_LDSB1_CLR1_GSU0_GSUC0_GSUWGMRR0_K1_LBSPPA2048_LBSPPB128_LPA0_MIWT8_2_PLR1_SU32_SUM0_SUS256_SKXCCM0_VWA8_VWB1_WGM4_WGMXCC1_WGMXCCGn1
    SolutionIndex: 10
    SolutionNameMin: Cijk_Ailk_Bljk_BBS_BH_UserArgs_MT128x64x32_MI16x16x1_SN_LDSB0_CLR1_GSU0_GSUC0_GSUWGMRR0_K1_LBSPPA1024_LBSPPB128_LPA0_MIWT4_2_PLR1_SU32_SUM0_SUS256_SKXCCM0_VWA4_VWB1_WGM1_WGMXCC1_WGMXCCGn1
    SolutionIndex: 11
    SolutionNameMin: Cijk_Ailk_Bljk_BBS_BH_UserArgs_MT32x32x32_MI16x16x1_SN_LDSB0_CLR1_GSU0_GSUC0_GSUWGMRR0_K1_LBSPPA256_LBSPPB128_LPA16_MIWT1_1_PLR1_SU32_SUM0_SUS256_SKXCCM0_VWA1_VWB1_WGM1_WGMXCC1_WGMXCCGn1
    SolutionIndex: 12
    SolutionNameMin: Cijk_Ailk_Bljk_BBS_BH_UserArgs_MT128x256x64_MI16x16x1_SN_LDSB1_CLR1_GSU0_GSUC0_GSUWGMRR0_K1_LBSPPA2048_LBSPPB128_LPA32_MIWT4_8_PLR1_SU32_SUM0_SUS256_SKXCCM0_VWA2_VWB1_WGM1_WGMXCC1_WGMXCCGn1
    SolutionIndex: 13
    SolutionNameMin: Cijk_Ailk_Bljk_BBS_BH_UserArgs_MT128x128x64_MI16x16x1_SN_LDSB1_CLR1_GSU0_GSUC0_GSUWGMRR0_K1_LBSPPA2048_LBSPPB128_LPA0_MIWT4_4_PLR1_SU32_SUM0_SUS256_SKXCCM0_VWA4_VWB1_WGM1_WGMXCC1_WGMXCCGn1
    SolutionIndex: 14
    SolutionNameMin: Cijk_Ailk_Bljk_BBS_BH_UserArgs_MT128x128x64_MI16x16x1_SN_LDSB1_CLR1_GSU0_GSUC0_GSUWGMRR0_K1_LBSPPA2048_LBSPPB256_LPA0_MIWT4_4_PLR1_SU32_SUM0_SUS256_SKXCCM0_VWA4_VWB2_WGM1_WGMXCC1_WGMXCCGn1
    SolutionIndex: 15
    SolutionNameMin: Cijk_Ailk_Bljk_BBS_BH_UserArgs_MT128x128x64_MI16x16x1_SN_LDSB1_CLR1_GSU0_GSUC0_GSUWGMRR0_K1_LBSPPA2048_LBSPPB512_LPA0_MIWT4_4_PLR1_SU32_SUM0_SUS256_SKXCCM0_VWA4_VWB4_WGM1_WGMXCC1_WGMXCCGn1
    SolutionIndex: 16
    SolutionNameMin: Cijk_Ailk_Bljk_BBS_BH_UserArgs_MT128x128x64_MI16x16x1_SN_LDSB1_CLR1_GSU0_GSUC0_GSUWGMRR0_K1_LBSPPA2048_LBSPPB256_LPA0_MIWT4_4_PLR1_SU32_SUM0_SUS256_SKXCCM0_VWA4_VWB2_WGM4_WGMXCC1_WGMXCCGn1
    SolutionIndex: 17
    SolutionNameMin: Cijk_Ailk_Bljk_BBS_BH_UserArgs_MT64x64x64_MI16x16x1_SN_LDSB1_CLR1_GSU0_GSUC0_GSUWGMRR0_K1_LBSPPA1024_LBSPPB128_LPA32_MIWT2_2_PLR1_SU32_SUM0_SUS256_SKXCCM0_VWA2_VWB1_WGM1_WGMXCC1_WGMXCCGn1
    SolutionIndex: 18
    SolutionNameMin: Cijk_Ailk_Bljk_BBS_BH_UserArgs_MT64x32x64_MI16x16x1_SN_LDSB0_CLR1_GSU0_GSUC0_GSUWGMRR0_K1_LBSPPA1024_LBSPPB128_LPA32_MIWT2_1_PLR1_SU32_SUM0_SUS256_SKXCCM0_VWA2_VWB1_WGM1_WGMXCC1_WGMXCCGn1
    SolutionIndex: 19
    SolutionNameMin: Cijk_Ailk_Bljk_BBS_BH_UserArgs_MT32x32x64_MI16x16x1_SN_LDSB0_CLR1_GSU0_GSUC0_GSUWGMRR0_K1_LBSPPA512_LBSPPB128_LPA16_MIWT1_1_PLR1_SU32_SUM0_SUS256_SKXCCM0_VWA1_VWB1_WGM1_WGMXCC1_WGMXCCGn1
    SolutionIndex: 20
    SolutionNameMin: Cijk_Ailk_Bljk_BBS_BH_UserArgs_MT64x128x128_MI16x16x1_SN_LDSB1_CLR1_GSU0_GSUC0_GSUWGMRR0_K1_LBSPPA1024_LBSPPB256_LPA32_MIWT2_4_PLR2_SU32_SUM0_SUS256_SKXCCM0_VWA2_VWB1_WGM1_WGMXCC1_WGMXCCGn1
    SolutionIndex: 21
    SolutionNameMin: Cijk_Ailk_Bljk_BBS_BH_UserArgs_MT64x128x128_MI16x16x1_SN_LDSB1_CLR1_GSU0_GSUC0_GSUWGMRR0_K1_LBSPPA1024_LBSPPB512_LPA32_MIWT2_4_PLR2_SU32_SUM0_SUS256_SKXCCM0_VWA2_VWB2_WGM1_WGMXCC1_WGMXCCGn1
    SolutionIndex: 22
    SolutionNameMin: Cijk_Ailk_Bljk_BBS_BH_UserArgs_MT64x128x128_MI16x16x1_SN_LDSB1_CLR1_GSU0_GSUC0_GSUWGMRR0_K1_LBSPPA1024_LBSPPB1024_LPA32_MIWT2_4_PLR2_SU32_SUM0_SUS256_SKXCCM0_VWA2_VWB4_WGM2_WGMXCC1_WGMXCCGn1
    SolutionIndex: 23
    SolutionNameMin: Cijk_Ailk_Bljk_BBS_BH_UserArgs_MT128x64x128_MI16x16x1_SN_LDSB1_CLR1_GSU0_GSUC0_GSUWGMRR0_K1_LBSPPA2048_LBSPPB256_LPA0_MIWT4_2_PLR1_SU32_SUM0_SUS256_SKXCCM0_VWA4_VWB1_WGM1_WGMXCC1_WGMXCCGn1
    SolutionIndex: 24
    SolutionNameMin: Cijk_Ailk_Bljk_BBS_BH_UserArgs_MT128x64x128_MI16x16x1_SN_LDSB1_CLR1_GSU0_GSUC0_GSUWGMRR0_K1_LBSPPA2048_LBSPPB512_LPA0_MIWT4_2_PLR1_SU32_SUM0_SUS256_SKXCCM0_VWA4_VWB2_WGM1_WGMXCC1_WGMXCCGn1
    SolutionIndex: 25
    SolutionNameMin: Cijk_Ailk_Bljk_BBS_BH_UserArgs_MT128x64x128_MI16x16x1_SN_LDSB1_CLR1_GSU0_GSUC0_GSUWGMRR0_K1_LBSPPA2048_LBSPPB256_LPA0_MIWT4_2_PLR2_SU32_SUM0_SUS256_SKXCCM0_VWA4_VWB1_WGM1_WGMXCC1_WGMXCCGn1
    SolutionIndex: 26
    SolutionNameMin: Cijk_Ailk_Bljk_BBS_BH_UserArgs_MT128x64x128_MI16x16x1_SN_LDSB1_CLR1_GSU0_GSUC0_GSUWGMRR0_K1_LBSPPA2048_LBSPPB256_LPA0_MIWT4_2_PLR2_SU32_SUM0_SUS256_SKXCCM0_VWA4_VWB1_WGM2_WGMXCC1_WGMXCCGn1
    SolutionIndex: 27
    SolutionNameMin: Cijk_Ailk_Bljk_BBS_BH_UserArgs_MT128x64x128_MI16x16x1_SN_LDSB1_CLR1_GSU0_GSUC0_GSUWGMRR0_K1_LBSPPA2048_LBSPPB256_LPA0_MIWT4_2_PLR2_SU32_SUM0_SUS256_SKXCCM0_VWA4_VWB1_WGM4_WGMXCC1_WGMXCCGn1
    SolutionIndex: 28
    SolutionNameMin: Cijk_Ailk_Bljk_BBS_BH_UserArgs_MT64x64x128_MI16x16x1_SN_LDSB1_CLR1_GSU0_GSUC0_GSUWGMRR0_K1_LBSPPA1024_LBSPPB256_LPA32_MIWT2_2_PLR2_SU32_SUM0_SUS256_SKXCCM0_VWA2_VWB1_WGM1_WGMXCC1_WGMXCCGn1
    SolutionIndex: 29
    SolutionNameMin: Cijk_Ailk_Bljk_BBS_BH_UserArgs_MT64x64x128_MI16x16x1_SN_LDSB1_CLR1_GSU0_GSUC0_GSUWGMRR0_K1_LBSPPA1024_LBSPPB512_LPA32_MIWT2_2_PLR2_SU32_SUM0_SUS256_SKXCCM0_VWA2_VWB2_WGM1_WGMXCC1_WGMXCCGn1
    SolutionIndex: 30
    SolutionNameMin: Cijk_Ailk_Bljk_BBS_BH_UserArgs_MT32x64x128_MI16x16x1_SN_LDSB1_CLR1_GSU0_GSUC0_GSUWGMRR0_K1_LBSPPA512_LBSPPB256_LPA16_MIWT1_2_PLR2_SU32_SUM0_SUS256_SKXCCM0_VWA1_VWB1_WGM1_WGMXCC1_WGMXCCGn1
    SolutionIndex: 31
    SolutionNameMin: Cijk_Ailk_Bljk_BBS_BH_UserArgs_MT64x32x128_MI16x16x1_SN_LDSB1_CLR1_GSU0_GSUC0_GSUWGMRR0_K1_LBSPPA1024_LBSPPB256_LPA32_MIWT2_1_PLR2_SU32_SUM0_SUS256_SKXCCM0_VWA2_VWB1_WGM1_WGMXCC1_WGMXCCGn1
    SolutionIndex: 32
    SolutionNameMin: Cijk_Ailk_Bljk_BBS_BH_UserArgs_MT64x32x128_MI16x16x1_SN_LDSB1_CLR1_GSU0_GSUC0_GSUWGMRR0_K1_LBSPPA1024_LBSPPB256_LPA32_MIWT2_1_PLR2_SU32_SUM0_SUS256_SKXCCM0_VWA2_VWB1_WGM4_WGMXCC1_WGMXCCGn1
    SolutionIndex: 33
    SolutionNameMin: Cijk_Ailk_Bljk_BBS_BH_UserArgs_MT32x32x128_MI16x16x1_SN_LDSB1_CLR1_GSU0_GSUC0_GSUWGMRR0_K1_LBSPPA512_LBSPPB256_LPA16_MIWT1_1_PLR1_SU32_SUM0_SUS256_SKXCCM0_VWA1_VWB1_WGM1_WGMXCC1_WGMXCCGn1
    SolutionIndex: 34
    SolutionNameMin: Cijk_Ailk_Bljk_BBS_BH_UserArgs_MT32x32x128_MI16x16x1_SN_LDSB1_CLR1_GSU0_GSUC0_GSUWGMRR0_K1_LBSPPA512_LBSPPB256_LPA16_MIWT1_1_PLR2_SU32_SUM0_SUS256_SKXCCM0_VWA1_VWB1_WGM1_WGMXCC1_WGMXCCGn1
    SolutionIndex: 35
    SolutionNameMin: Cijk_Ailk_Bljk_BBS_BH_UserArgs_MT256x256x32_MI16x16x1_SN_LDSB1_CLR1_GSU0_GSUC0_GSUWGMRR0_K1_LBSPPA2048_LBSPPB128_LPA0_MIWT8_8_PLR1_SU32_SUM0_SUS256_SKXCCM4_VWA4_VWB1_WGM1_WGMXCC1_WGMXCCGn1
    SolutionIndex: 36
    SolutionNameMin: Cijk_Ailk_Bljk_BBS_BH_UserArgs_MT256x256x32_MI16x16x1_SN_LDSB1_CLR1_GSU0_GSUC0_GSUWGMRR0_K1_LBSPPA2048_LBSPPB128_LPA0_MIWT8_8_PLR1_SU32_SUM0_SUS256_SKXCCM4_VWA8_VWB1_WGM1_WGMXCC1_WGMXCCGn1
    SolutionIndex: 37
    SolutionNameMin: Cijk_Ailk_Bljk_BBS_BH_UserArgs_MT256x256x32_MI16x16x1_SN_LDSB1_CLR1_GSU0_GSUC0_GSUWGMRR0_K1_LBSPPA2048_LBSPPB128_LPA32_MIWT8_8_PLR1_SU32_SUM0_SUS256_SKXCCM4_VWA2_VWB2_WGM1_WGMXCC1_WGMXCCGn1
    SolutionIndex: 38
    SolutionNameMin: Cijk_Ailk_Bljk_BBS_BH_UserArgs_MT256x256x32_MI16x16x1_SN_LDSB1_CLR1_GSU0_GSUC0_GSUWGMRR0_K1_LBSPPA2048_LBSPPB128_LPA0_MIWT8_8_PLR1_SU32_SUM0_SUS256_SKXCCM4_VWA4_VWB2_WGM1_WGMXCC1_WGMXCCGn1
    SolutionIndex: 39
    SolutionNameMin: Cijk_Ailk_Bljk_BBS_BH_UserArgs_MT256x256x32_MI16x16x1_SN_LDSB1_CLR1_GSU0_GSUC0_GSUWGMRR0_K1_LBSPPA2048_LBSPPB128_LPA0_MIWT8_8_PLR1_SU32_SUM0_SUS256_SKXCCM4_VWA8_VWB2_WGM1_WGMXCC1_WGMXCCGn1
    SolutionIndex: 40
    SolutionNameMin: Cijk_Ailk_Bljk_BBS_BH_UserArgs_MT256x256x32_MI16x16x1_SN_LDSB1_CLR1_GSU0_GSUC0_GSUWGMRR0_K1_LBSPPA2048_LBSPPB256_LPA0_MIWT8_8_PLR1_SU32_SUM0_SUS256_SKXCCM4_VWA4_VWB4_WGM1_WGMXCC1_WGMXCCGn1
    SolutionIndex: 41
    SolutionNameMin: Cijk_Ailk_Bljk_BBS_BH_UserArgs_MT256x256x32_MI16x16x1_SN_LDSB1_CLR1_GSU0_GSUC0_GSUWGMRR0_K1_LBSPPA2048_LBSPPB256_LPA0_MIWT8_8_PLR1_SU32_SUM0_SUS256_SKXCCM4_VWA8_VWB4_WGM1_WGMXCC1_WGMXCCGn1
    SolutionIndex: 42
    SolutionNameMin: Cijk_Ailk_Bljk_BBS_BH_UserArgs_MT256x256x32_MI16x16x1_SN_LDSB1_CLR1_GSU0_GSUC0_GSUWGMRR0_K1_LBSPPA2048_LBSPPB512_LPA0_MIWT8_8_PLR1_SU32_SUM0_SUS256_SKXCCM4_VWA4_VWB8_WGM1_WGMXCC1_WGMXCCGn1
    SolutionIndex: 43
    SolutionNameMin: Cijk_Ailk_Bljk_BBS_BH_UserArgs_MT256x256x32_MI16x16x1_SN_LDSB1_CLR1_GSU0_GSUC0_GSUWGMRR0_K1_LBSPPA2048_LBSPPB512_LPA0_MIWT8_8_PLR1_SU32_SUM0_SUS256_SKXCCM4_VWA8_VWB8_WGM1_WGMXCC1_WGMXCCGn1
    SolutionIndex: 44
    SolutionNameMin: Cijk_Ailk_Bljk_BBS_BH_UserArgs_MT256x256x32_MI16x16x1_SN_LDSB1_CLR1_GSU0_GSUC0_GSUWGMRR0_K1_LBSPPA2048_LBSPPB128_LPA0_MIWT8_8_PLR1_SU32_SUM0_SUS256_SKXCCM4_VWA4_VWB1_WGM2_WGMXCC1_WGMXCCGn1
    SolutionIndex: 45
    SolutionNameMin: Cijk_Ailk_Bljk_BBS_BH_UserArgs_MT256x256x32_MI16x16x1_SN_LDSB1_CLR1_GSU0_GSUC0_GSUWGMRR0_K1_LBSPPA2048_LBSPPB128_LPA0_MIWT8_8_PLR1_SU32_SUM0_SUS256_SKXCCM4_VWA8_VWB1_WGM2_WGMXCC1_WGMXCCGn1
    SolutionIndex: 46
    SolutionNameMin: Cijk_Ailk_Bljk_BBS_BH_UserArgs_MT256x256x32_MI16x16x1_SN_LDSB1_CLR1_GSU0_GSUC0_GSUWGMRR0_K1_LBSPPA2048_LBSPPB128_LPA0_MIWT8_8_PLR1_SU32_SUM0_SUS256_SKXCCM4_VWA4_VWB2_WGM2_WGMXCC1_WGMXCCGn1
    SolutionIndex: 47
    SolutionNameMin: Cijk_Ailk_Bljk_BBS_BH_UserArgs_MT256x256x32_MI16x16x1_SN_LDSB1_CLR1_GSU0_GSUC0_GSUWGMRR0_K1_LBSPPA2048_LBSPPB256_LPA0_MIWT8_8_PLR1_SU32_SUM0_SUS256_SKXCCM4_VWA4_VWB4_WGM2_WGMXCC1_WGMXCCGn1
    SolutionIndex: 48
    SolutionNameMin: Cijk_Ailk_Bljk_BBS_BH_UserArgs_MT256x256x32_MI16x16x1_SN_LDSB1_CLR1_GSU0_GSUC0_GSUWGMRR0_K1_LBSPPA2048_LBSPPB512_LPA0_MIWT8_8_PLR1_SU32_SUM0_SUS256_SKXCCM4_VWA4_VWB8_WGM2_WGMXCC1_WGMXCCGn1
    SolutionIndex: 49
    SolutionNameMin: Cijk_Ailk_Bljk_BBS_BH_UserArgs_MT256x256x32_MI16x16x1_SN_LDSB1_CLR1_GSU0_GSUC0_GSUWGMRR0_K1_LBSPPA2048_LBSPPB512_LPA0_MIWT8_8_PLR1_SU32_SUM0_SUS256_SKXCCM4_VWA8_VWB8_WGM2_WGMXCC1_WGMXCCGn1
    SolutionIndex: 50
    SolutionNameMin: Cijk_Ailk_Bljk_BBS_BH_UserArgs_MT256x256x32_MI16x16x1_SN_LDSB1_CLR1_GSU0_GSUC0_GSUWGMRR0_K1_LBSPPA2048_LBSPPB128_LPA0_MIWT8_8_PLR1_SU32_SUM0_SUS256_SKXCCM4_VWA4_VWB1_WGM4_WGMXCC1_WGMXCCGn1
    SolutionIndex: 51
    SolutionNameMin: Cijk_Ailk_Bljk_BBS_BH_UserArgs_MT256x256x32_MI16x16x1_SN_LDSB1_CLR1_GSU0_GSUC0_GSUWGMRR0_K1_LBSPPA2048_LBSPPB128_LPA0_MIWT8_8_PLR1_SU32_SUM0_SUS256_SKXCCM4_VWA8_VWB1_WGM4_WGMXCC1_WGMXCCGn1
    SolutionIndex: 52
    SolutionNameMin: Cijk_Ailk_Bljk_BBS_BH_UserArgs_MT256x256x32_MI16x16x1_SN_LDSB1_CLR1_GSU0_GSUC0_GSUWGMRR0_K1_LBSPPA2048_LBSPPB256_LPA0_MIWT8_8_PLR1_SU32_SUM0_SUS256_SKXCCM4_VWA8_VWB4_WGM4_WGMXCC1_WGMXCCGn1
    SolutionIndex: 53
    SolutionNameMin: Cijk_Ailk_Bljk_BBS_BH_UserArgs_MT256x256x32_MI16x16x1_SN_LDSB1_CLR1_GSU0_GSUC0_GSUWGMRR0_K1_LBSPPA2048_LBSPPB512_LPA0_MIWT8_8_PLR1_SU32_SUM0_SUS256_SKXCCM4_VWA4_VWB8_WGM4_WGMXCC1_WGMXCCGn1
    SolutionIndex: 54
    SolutionNameMin: Cijk_Ailk_Bljk_BBS_BH_UserArgs_MT256x256x32_MI16x16x1_SN_LDSB1_CLR1_GSU0_GSUC0_GSUWGMRR0_K1_LBSPPA2048_LBSPPB512_LPA0_MIWT8_8_PLR1_SU32_SUM0_SUS256_SKXCCM4_VWA8_VWB8_WGM4_WGMXCC1_WGMXCCGn1
    SolutionIndex: 55
    SolutionNameMin: Cijk_Ailk_Bljk_BBS_BH_UserArgs_MT256x128x32_MI16x16x1_SN_LDSB1_CLR1_GSU0_GSUC0_GSUWGMRR0_K1_LBSPPA2048_LBSPPB128_LPA0_MIWT8_4_PLR1_SU32_SUM0_SUS256_SKXCCM4_VWA4_VWB1_WGM1_WGMXCC1_WGMXCCGn1
    SolutionIndex: 56
    SolutionNameMin: Cijk_Ailk_Bljk_BBS_BH_UserArgs_MT256x128x32_MI16x16x1_SN_LDSB1_CLR1_GSU0_GSUC0_GSUWGMRR0_K1_LBSPPA2048_LBSPPB128_LPA0_MIWT8_4_PLR1_SU32_SUM0_SUS256_SKXCCM4_VWA8_VWB1_WGM1_WGMXCC1_WGMXCCGn1
    SolutionIndex: 57
    SolutionNameMin: Cijk_Ailk_Bljk_BBS_BH_UserArgs_MT256x128x32_MI16x16x1_SN_LDSB1_CLR1_GSU0_GSUC0_GSUWGMRR0_K1_LBSPPA2048_LBSPPB128_LPA0_MIWT8_4_PLR1_SU32_SUM0_SUS256_SKXCCM4_VWA4_VWB2_WGM1_WGMXCC1_WGMXCCGn1
    SolutionIndex: 58
    SolutionNameMin: Cijk_Ailk_Bljk_BBS_BH_UserArgs_MT256x128x32_MI16x16x1_SN_LDSB1_CLR1_GSU0_GSUC0_GSUWGMRR0_K1_LBSPPA2048_LBSPPB128_LPA0_MIWT8_4_PLR1_SU32_SUM0_SUS256_SKXCCM4_VWA8_VWB2_WGM1_WGMXCC1_WGMXCCGn1
    SolutionIndex: 59
    SolutionNameMin: Cijk_Ailk_Bljk_BBS_BH_UserArgs_MT256x128x32_MI16x16x1_SN_LDSB1_CLR1_GSU0_GSUC0_GSUWGMRR0_K1_LBSPPA2048_LBSPPB256_LPA0_MIWT8_4_PLR1_SU32_SUM0_SUS256_SKXCCM4_VWA4_VWB4_WGM1_WGMXCC1_WGMXCCGn1
    SolutionIndex: 60
    SolutionNameMin: Cijk_Ailk_Bljk_BBS_BH_UserArgs_MT256x128x32_MI16x16x1_SN_LDSB1_CLR1_GSU0_GSUC0_GSUWGMRR0_K1_LBSPPA2048_LBSPPB256_LPA0_MIWT8_4_PLR1_SU32_SUM0_SUS256_SKXCCM4_VWA8_VWB4_WGM1_WGMXCC1_WGMXCCGn1
    SolutionIndex: 61
    SolutionNameMin: Cijk_Ailk_Bljk_BBS_BH_UserArgs_MT256x128x32_MI16x16x1_SN_LDSB1_CLR1_GSU0_GSUC0_GSUWGMRR0_K1_LBSPPA2048_LBSPPB256_LPA0_MIWT8_4_PLR1_SU32_SUM0_SUS256_SKXCCM4_VWA8_VWB4_WGM4_WGMXCC1_WGMXCCGn1
    SolutionIndex: 62
    SolutionNameMin: Cijk_Ailk_Bljk_BBS_BH_UserArgs_MT128x64x32_MI16x16x1_SN_LDSB0_CLR1_GSU0_GSUC0_GSUWGMRR0_K1_LBSPPA1024_LBSPPB128_LPA0_MIWT4_2_PLR1_SU32_SUM0_SUS256_SKXCCM4_VWA4_VWB1_WGM1_WGMXCC1_WGMXCCGn1
    SolutionIndex: 63
    SolutionNameMin: Cijk_Ailk_Bljk_BBS_BH_UserArgs_MT128x64x32_MI16x16x1_SN_LDSB0_CLR1_GSU0_GSUC0_GSUWGMRR0_K1_LBSPPA1024_LBSPPB128_LPA0_MIWT4_2_PLR1_SU32_SUM0_SUS256_SKXCCM4_VWA4_VWB2_WGM1_WGMXCC1_WGMXCCGn1
    SolutionIndex: 64
    SolutionNameMin: Cijk_Ailk_Bljk_BBS_BH_UserArgs_MT128x256x64_MI16x16x1_SN_LDSB1_CLR1_GSU0_GSUC0_GSUWGMRR0_K1_LBSPPA2048_LBSPPB128_LPA32_MIWT4_8_PLR1_SU32_SUM0_SUS256_SKXCCM4_VWA2_VWB1_WGM1_WGMXCC1_WGMXCCGn1
    SolutionIndex: 65
    SolutionNameMin: Cijk_Ailk_Bljk_BBS_BH_UserArgs_MT128x256x64_MI16x16x1_SN_LDSB1_CLR1_GSU0_GSUC0_GSUWGMRR0_K1_LBSPPA2048_LBSPPB128_LPA0_MIWT4_8_PLR1_SU32_SUM0_SUS256_SKXCCM4_VWA4_VWB1_WGM1_WGMXCC1_WGMXCCGn1
    SolutionIndex: 66
    SolutionNameMin: Cijk_Ailk_Bljk_BBS_BH_UserArgs_MT128x256x64_MI16x16x1_SN_LDSB1_CLR1_GSU0_GSUC0_GSUWGMRR0_K1_LBSPPA2048_LBSPPB256_LPA0_MIWT4_8_PLR1_SU32_SUM0_SUS256_SKXCCM4_VWA4_VWB2_WGM1_WGMXCC1_WGMXCCGn1
    SolutionIndex: 67
    SolutionNameMin: Cijk_Ailk_Bljk_BBS_BH_UserArgs_MT128x256x64_MI16x16x1_SN_LDSB1_CLR1_GSU0_GSUC0_GSUWGMRR0_K1_LBSPPA2048_LBSPPB512_LPA32_MIWT4_8_PLR1_SU32_SUM0_SUS256_SKXCCM4_VWA2_VWB4_WGM1_WGMXCC1_WGMXCCGn1
    SolutionIndex: 68
    SolutionNameMin: Cijk_Ailk_Bljk_BBS_BH_UserArgs_MT128x256x64_MI16x16x1_SN_LDSB1_CLR1_GSU0_GSUC0_GSUWGMRR0_K1_LBSPPA2048_LBSPPB512_LPA0_MIWT4_8_PLR1_SU32_SUM0_SUS256_SKXCCM4_VWA4_VWB4_WGM1_WGMXCC1_WGMXCCGn1
    SolutionIndex: 69
    SolutionNameMin: Cijk_Ailk_Bljk_BBS_BH_UserArgs_MT128x256x64_MI16x16x1_SN_LDSB1_CLR1_GSU0_GSUC0_GSUWGMRR0_K1_LBSPPA2048_LBSPPB1024_LPA32_MIWT4_8_PLR1_SU32_SUM0_SUS256_SKXCCM4_VWA2_VWB8_WGM1_WGMXCC1_WGMXCCGn1
    SolutionIndex: 70
    SolutionNameMin: Cijk_Ailk_Bljk_BBS_BH_UserArgs_MT128x256x64_MI16x16x1_SN_LDSB1_CLR1_GSU0_GSUC0_GSUWGMRR0_K1_LBSPPA2048_LBSPPB1024_LPA0_MIWT4_8_PLR1_SU32_SUM0_SUS256_SKXCCM4_VWA4_VWB8_WGM1_WGMXCC1_WGMXCCGn1
    SolutionIndex: 71
    SolutionNameMin: Cijk_Ailk_Bljk_BBS_BH_UserArgs_MT128x256x64_MI16x16x1_SN_LDSB1_CLR1_GSU0_GSUC0_GSUWGMRR0_K1_LBSPPA2048_LBSPPB128_LPA32_MIWT4_8_PLR1_SU32_SUM0_SUS256_SKXCCM4_VWA2_VWB1_WGM2_WGMXCC1_WGMXCCGn1
    SolutionIndex: 72
    SolutionNameMin: Cijk_Ailk_Bljk_BBS_BH_UserArgs_MT128x256x64_MI16x16x1_SN_LDSB1_CLR1_GSU0_GSUC0_GSUWGMRR0_K1_LBSPPA2048_LBSPPB1024_LPA32_MIWT4_8_PLR1_SU32_SUM0_SUS256_SKXCCM4_VWA2_VWB8_WGM2_WGMXCC1_WGMXCCGn1
    SolutionIndex: 73
    SolutionNameMin: Cijk_Ailk_Bljk_BBS_BH_UserArgs_MT128x256x64_MI16x16x1_SN_LDSB1_CLR1_GSU0_GSUC0_GSUWGMRR0_K1_LBSPPA2048_LBSPPB1024_LPA0_MIWT4_8_PLR1_SU32_SUM0_SUS256_SKXCCM4_VWA4_VWB8_WGM2_WGMXCC1_WGMXCCGn1
    SolutionIndex: 74
    SolutionNameMin: Cijk_Ailk_Bljk_BBS_BH_UserArgs_MT128x256x64_MI16x16x1_SN_LDSB1_CLR1_GSU0_GSUC0_GSUWGMRR0_K1_LBSPPA2048_LBSPPB128_LPA0_MIWT4_8_PLR1_SU32_SUM0_SUS256_SKXCCM4_VWA4_VWB1_WGM4_WGMXCC1_WGMXCCGn1
    SolutionIndex: 75
    SolutionNameMin: Cijk_Ailk_Bljk_BBS_BH_UserArgs_MT128x256x64_MI16x16x1_SN_LDSB1_CLR1_GSU0_GSUC0_GSUWGMRR0_K1_LBSPPA2048_LBSPPB256_LPA0_MIWT4_8_PLR1_SU32_SUM0_SUS256_SKXCCM4_VWA4_VWB2_WGM4_WGMXCC1_WGMXCCGn1
    SolutionIndex: 76
    SolutionNameMin: Cijk_Ailk_Bljk_BBS_BH_UserArgs_MT128x256x64_MI16x16x1_SN_LDSB1_CLR1_GSU0_GSUC0_GSUWGMRR0_K1_LBSPPA2048_LBSPPB1024_LPA0_MIWT4_8_PLR1_SU32_SUM0_SUS256_SKXCCM4_VWA4_VWB8_WGM4_WGMXCC1_WGMXCCGn1
    SolutionIndex: 77
    SolutionNameMin: Cijk_Ailk_Bljk_BBS_BH_UserArgs_MT256x128x64_MI16x16x1_SN_LDSB1_CLR1_GSU0_GSUC0_GSUWGMRR0_K1_LBSPPA4096_LBSPPB128_LPA0_MIWT8_4_PLR1_SU32_SUM0_SUS256_SKXCCM4_VWA4_VWB1_WGM1_WGMXCC1_WGMXCCGn1
    SolutionIndex: 78
    SolutionNameMin: Cijk_Ailk_Bljk_BBS_BH_UserArgs_MT256x128x64_MI16x16x1_SN_LDSB1_CLR1_GSU0_GSUC0_GSUWGMRR0_K1_LBSPPA4096_LBSPPB512_LPA0_MIWT8_4_PLR1_SU32_SUM0_SUS256_SKXCCM4_VWA4_VWB4_WGM1_WGMXCC1_WGMXCCGn1
    SolutionIndex: 79
    SolutionNameMin: Cijk_Ailk_Bljk_BBS_BH_UserArgs_MT256x128x64_MI16x16x1_SN_LDSB1_CLR1_GSU0_GSUC0_GSUWGMRR0_K1_LBSPPA4096_LBSPPB256_LPA0_MIWT8_4_PLR1_SU32_SUM0_SUS256_SKXCCM4_VWA4_VWB2_WGM4_WGMXCC1_WGMXCCGn1
    SolutionIndex: 80
    SolutionNameMin: Cijk_Ailk_Bljk_BBS_BH_UserArgs_MT128x128x64_MI16x16x1_SN_LDSB1_CLR1_GSU0_GSUC0_GSUWGMRR0_K1_LBSPPA2048_LBSPPB128_LPA32_MIWT4_4_PLR1_SU32_SUM0_SUS256_SKXCCM4_VWA2_VWB1_WGM1_WGMXCC1_WGMXCCGn1
    SolutionIndex: 81
    SolutionNameMin: Cijk_Ailk_Bljk_BBS_BH_UserArgs_MT128x128x64_MI16x16x1_SN_LDSB1_CLR1_GSU0_GSUC0_GSUWGMRR0_K1_LBSPPA2048_LBSPPB128_LPA0_MIWT4_4_PLR1_SU32_SUM0_SUS256_SKXCCM4_VWA4_VWB1_WGM1_WGMXCC1_WGMXCCGn1
    SolutionIndex: 82
    SolutionNameMin: Cijk_Ailk_Bljk_BBS_BH_UserArgs_MT128x128x64_MI16x16x1_SN_LDSB1_CLR1_GSU0_GSUC0_GSUWGMRR0_K1_LBSPPA2048_LBSPPB256_LPA32_MIWT4_4_PLR1_SU32_SUM0_SUS256_SKXCCM4_VWA2_VWB2_WGM1_WGMXCC1_WGMXCCGn1
    SolutionIndex: 83
    SolutionNameMin: Cijk_Ailk_Bljk_BBS_BH_UserArgs_MT128x128x64_MI16x16x1_SN_LDSB1_CLR1_GSU0_GSUC0_GSUWGMRR0_K1_LBSPPA2048_LBSPPB256_LPA0_MIWT4_4_PLR1_SU32_SUM0_SUS256_SKXCCM4_VWA4_VWB2_WGM1_WGMXCC1_WGMXCCGn1
    SolutionIndex: 84
    SolutionNameMin: Cijk_Ailk_Bljk_BBS_BH_UserArgs_MT128x128x64_MI16x16x1_SN_LDSB1_CLR1_GSU0_GSUC0_GSUWGMRR0_K1_LBSPPA2048_LBSPPB512_LPA32_MIWT4_4_PLR1_SU32_SUM0_SUS256_SKXCCM4_VWA2_VWB4_WGM1_WGMXCC1_WGMXCCGn1
    SolutionIndex: 85
    SolutionNameMin: Cijk_Ailk_Bljk_BBS_BH_UserArgs_MT128x128x64_MI16x16x1_SN_LDSB1_CLR1_GSU0_GSUC0_GSUWGMRR0_K1_LBSPPA2048_LBSPPB512_LPA0_MIWT4_4_PLR1_SU32_SUM0_SUS256_SKXCCM4_VWA4_VWB4_WGM1_WGMXCC1_WGMXCCGn1
    SolutionIndex: 86
    SolutionNameMin: Cijk_Ailk_Bljk_BBS_BH_UserArgs_MT128x128x64_MI16x16x1_SN_LDSB1_CLR1_GSU0_GSUC0_GSUWGMRR0_K1_LBSPPA2048_LBSPPB128_LPA0_MIWT4_4_PLR1_SU32_SUM0_SUS256_SKXCCM4_VWA4_VWB1_WGM2_WGMXCC1_WGMXCCGn1
    SolutionIndex: 87
    SolutionNameMin: Cijk_Ailk_Bljk_BBS_BH_UserArgs_MT128x128x64_MI16x16x1_SN_LDSB1_CLR1_GSU0_GSUC0_GSUWGMRR0_K1_LBSPPA2048_LBSPPB256_LPA0_MIWT4_4_PLR1_SU32_SUM0_SUS256_SKXCCM4_VWA4_VWB2_WGM2_WGMXCC1_WGMXCCGn1
    SolutionIndex: 88
    SolutionNameMin: Cijk_Ailk_Bljk_BBS_BH_UserArgs_MT128x128x64_MI16x16x1_SN_LDSB1_CLR1_GSU0_GSUC0_GSUWGMRR0_K1_LBSPPA2048_LBSPPB512_LPA0_MIWT4_4_PLR1_SU32_SUM0_SUS256_SKXCCM4_VWA4_VWB4_WGM2_WGMXCC1_WGMXCCGn1
    SolutionIndex: 89
    SolutionNameMin: Cijk_Ailk_Bljk_BBS_BH_UserArgs_MT128x128x64_MI16x16x1_SN_LDSB1_CLR1_GSU0_GSUC0_GSUWGMRR0_K1_LBSPPA2048_LBSPPB128_LPA0_MIWT4_4_PLR1_SU32_SUM0_SUS256_SKXCCM4_VWA4_VWB1_WGM4_WGMXCC1_WGMXCCGn1
    SolutionIndex: 90
    SolutionNameMin: Cijk_Ailk_Bljk_BBS_BH_UserArgs_MT128x128x64_MI16x16x1_SN_LDSB1_CLR1_GSU0_GSUC0_GSUWGMRR0_K1_LBSPPA2048_LBSPPB256_LPA0_MIWT4_4_PLR1_SU32_SUM0_SUS256_SKXCCM4_VWA4_VWB2_WGM4_WGMXCC1_WGMXCCGn1
    SolutionIndex: 91
    SolutionNameMin: Cijk_Ailk_Bljk_BBS_BH_UserArgs_MT128x64x64_MI16x16x1_SN_LDSB1_CLR1_GSU0_GSUC0_GSUWGMRR0_K1_LBSPPA2048_LBSPPB128_LPA0_MIWT4_2_PLR1_SU32_SUM0_SUS256_SKXCCM4_VWA4_VWB1_WGM1_WGMXCC1_WGMXCCGn1
    SolutionIndex: 92
    SolutionNameMin: Cijk_Ailk_Bljk_BBS_BH_UserArgs_MT128x64x64_MI16x16x1_SN_LDSB1_CLR1_GSU0_GSUC0_GSUWGMRR0_K1_LBSPPA2048_LBSPPB256_LPA0_MIWT4_2_PLR1_SU32_SUM0_SUS256_SKXCCM4_VWA4_VWB2_WGM1_WGMXCC1_WGMXCCGn1
    SolutionIndex: 93
    SolutionNameMin: Cijk_Ailk_Bljk_BBS_BH_UserArgs_MT64x64x64_MI16x16x1_SN_LDSB1_CLR1_GSU0_GSUC0_GSUWGMRR0_K1_LBSPPA1024_LBSPPB128_LPA32_MIWT2_2_PLR1_SU32_SUM0_SUS256_SKXCCM4_VWA2_VWB1_WGM1_WGMXCC1_WGMXCCGn1
    SolutionIndex: 94
    SolutionNameMin: Cijk_Ailk_Bljk_BBS_BH_UserArgs_MT64x64x64_MI16x16x1_SN_LDSB1_CLR1_GSU0_GSUC0_GSUWGMRR0_K1_LBSPPA1024_LBSPPB256_LPA32_MIWT2_2_PLR1_SU32_SUM0_SUS256_SKXCCM4_VWA2_VWB2_WGM1_WGMXCC1_WGMXCCGn1
    SolutionIndex: 95
    SolutionNameMin: Cijk_Ailk_Bljk_BBS_BH_UserArgs_MT64x32x64_MI16x16x1_SN_LDSB0_CLR1_GSU0_GSUC0_GSUWGMRR0_K1_LBSPPA1024_LBSPPB128_LPA32_MIWT2_1_PLR1_SU32_SUM0_SUS256_SKXCCM4_VWA2_VWB1_WGM1_WGMXCC1_WGMXCCGn1
    SolutionIndex: 96
    SolutionNameMin: Cijk_Ailk_Bljk_BBS_BH_UserArgs_MT32x32x64_MI16x16x1_SN_LDSB0_CLR1_GSU0_GSUC0_GSUWGMRR0_K1_LBSPPA512_LBSPPB128_LPA16_MIWT1_1_PLR1_SU32_SUM0_SUS256_SKXCCM4_VWA1_VWB1_WGM1_WGMXCC1_WGMXCCGn1
    SolutionIndex: 97
    SolutionNameMin: Cijk_Ailk_Bljk_BBS_BH_UserArgs_MT64x128x128_MI16x16x1_SN_LDSB1_CLR1_GSU0_GSUC0_GSUWGMRR0_K1_LBSPPA1024_LBSPPB256_LPA32_MIWT2_4_PLR2_SU32_SUM0_SUS256_SKXCCM4_VWA2_VWB1_WGM1_WGMXCC1_WGMXCCGn1
    SolutionIndex: 98
    SolutionNameMin: Cijk_Ailk_Bljk_BBS_BH_UserArgs_MT128x64x128_MI16x16x1_SN_LDSB1_CLR1_GSU0_GSUC0_GSUWGMRR0_K1_LBSPPA2048_LBSPPB256_LPA0_MIWT4_2_PLR1_SU32_SUM0_SUS256_SKXCCM4_VWA4_VWB1_WGM1_WGMXCC1_WGMXCCGn1
    SolutionIndex: 99
    SolutionNameMin: Cijk_Ailk_Bljk_BBS_BH_UserArgs_MT128x64x128_MI16x16x1_SN_LDSB1_CLR1_GSU0_GSUC0_GSUWGMRR0_K1_LBSPPA2048_LBSPPB256_LPA0_MIWT4_2_PLR2_SU32_SUM0_SUS256_SKXCCM4_VWA4_VWB1_WGM1_WGMXCC1_WGMXCCGn1
    SolutionIndex: 100
    SolutionNameMin: Cijk_Ailk_Bljk_BBS_BH_UserArgs_MT128x64x128_MI16x16x1_SN_LDSB1_CLR1_GSU0_GSUC0_GSUWGMRR0_K1_LBSPPA2048_LBSPPB512_LPA0_MIWT4_2_PLR2_SU32_SUM0_SUS256_SKXCCM4_VWA4_VWB2_WGM1_WGMXCC1_WGMXCCGn1
    SolutionIndex: 101
    SolutionNameMin: Cijk_Ailk_Bljk_BBS_BH_UserArgs_MT64x64x128_MI16x16x1_SN_LDSB1_CLR1_GSU0_GSUC0_GSUWGMRR0_K1_LBSPPA1024_LBSPPB256_LPA32_MIWT2_2_PLR2_SU32_SUM0_SUS256_SKXCCM4_VWA2_VWB1_WGM1_WGMXCC1_WGMXCCGn1
    SolutionIndex: 102
    SolutionNameMin: Cijk_Ailk_Bljk_BBS_BH_UserArgs_MT64x64x128_MI16x16x1_SN_LDSB1_CLR1_GSU0_GSUC0_GSUWGMRR0_K1_LBSPPA1024_LBSPPB512_LPA32_MIWT2_2_PLR2_SU32_SUM0_SUS256_SKXCCM4_VWA2_VWB2_WGM1_WGMXCC1_WGMXCCGn1
    SolutionIndex: 103
    SolutionNameMin: Cijk_Ailk_Bljk_BBS_BH_UserArgs_MT64x32x128_MI16x16x1_SN_LDSB1_CLR1_GSU0_GSUC0_GSUWGMRR0_K1_LBSPPA1024_LBSPPB256_LPA32_MIWT2_1_PLR2_SU32_SUM0_SUS256_SKXCCM4_VWA2_VWB1_WGM1_WGMXCC1_WGMXCCGn1
    SolutionIndex: 104
    SolutionNameMin: Cijk_Ailk_Bljk_BBS_BH_UserArgs_MT32x32x128_MI16x16x1_SN_LDSB1_CLR1_GSU0_GSUC0_GSUWGMRR0_K1_LBSPPA512_LBSPPB256_LPA16_MIWT1_1_PLR1_SU32_SUM0_SUS256_SKXCCM4_VWA1_VWB1_WGM1_WGMXCC1_WGMXCCGn1
    SolutionIndex: 105
    SolutionNameMin: Cijk_Ailk_Bljk_BBS_BH_UserArgs_MT32x32x32_MI16x16x1_SN_LDSB0_CLR1_GSU0_GSUC0_GSUWGMRR0_K1_LBSPPA256_LBSPPB128_LPA16_MIWT1_1_PLR1_SU32_SUM0_SUS256_SKXCCM0_VWA1_VWB1_WGM1_WGMXCC1_WGMXCCGn1
- - - [128, 128, 1, 128, 128, 128, 128, 128]
    - [96, 0.087]
  - - [128, 128, 1, 256, 128, 128, 128, 256]
    - [96, 0.159]
  - - [128, 128, 1, 512, 128, 128, 128, 512]
    - [33, 0.263]
  - - [128, 128, 1, 1024, 128, 128, 128, 1024]
    - [104, 0.397]
  - - [128, 128, 1, 2048, 128, 128, 128, 2048]
    - [11, 0.593]
  - - [128, 128, 1, 4096, 128, 128, 128, 4096]
    - [19, 1.045]
  - - [128, 128, 1, 8192, 128, 128, 128, 8192]
    - [33, 1.592]
  - - [128, 256, 1, 128, 128, 128, 128, 128]
    - [34, 0.172]
  - - [128, 256, 1, 256, 128, 128, 128, 256]
    - [19, 0.314]
  - - [128, 256, 1, 512, 128, 128, 128, 512]
    - [33, 0.524]
  - - [128, 256, 1, 1024, 128, 128, 128, 1024]
    - [34, 0.789]
  - - [128, 256, 1, 2048, 128, 128, 128, 2048]
    - [34, 1.179]
  - - [128, 256, 1, 4096, 128, 128, 128, 4096]
    - [95, 1.763]
  - - [128, 256, 1, 8192, 128, 128, 128, 8192]
    - [103, 2.758]
  - - [128, 512, 1, 128, 128, 128, 128, 128]
    - [34, 0.337]
  - - [128, 512, 1, 256, 128, 128, 128, 256]
    - [19, 0.621]
  - - [128, 512, 1, 512, 128, 128, 128, 512]
    - [96, 1.024]
  - - [128, 512, 1, 1024, 128, 128, 128, 1024]
    - [34, 1.559]
  - - [128, 512, 1, 2048, 128, 128, 128, 2048]
    - [32, 2.088]
  - - [128, 512, 1, 4096, 128, 128, 128, 4096]
    - [31, 3.012]
  - - [128, 512, 1, 8192, 128, 128, 128, 8192]
    - [102, 4.552]
  - - [128, 1024, 1, 128, 128, 128, 128, 128]
    - [103, 0.647]
  - - [128, 1024, 1, 256, 128, 128, 128, 256]
    - [103, 1.135]
  - - [128, 1024, 1, 512, 128, 128, 128, 512]
    - [30, 1.831]
  - - [128, 1024, 1, 1024, 128, 128, 128, 1024]
    - [103, 2.804]
  - - [128, 1024, 1, 2048, 128, 128, 128, 2048]
    - [103, 3.687]
  - - [128, 1024, 1, 4096, 128, 128, 128, 4096]
    - [28, 5.009]
  - - [128, 1024, 1, 8192, 128, 128, 128, 8192]
    - [25, 7.095]
  - - [128, 2048, 1, 128, 128, 128, 128, 128]
    - [93, 1.156]
  - - [128, 2048, 1, 256, 128, 128, 128, 256]
    - [94, 1.988]
  - - [128, 2048, 1, 512, 128, 128, 128, 512]
    - [102, 3.216]
  - - [128, 2048, 1, 1024, 128, 128, 128, 1024]
    - [102, 4.696]
  - - [128, 2048, 1, 2048, 128, 128, 128, 2048]
    - [101, 6.035]
  - - [128, 2048, 1, 4096, 128, 128, 128, 4096]
    - [99, 7.626]
  - - [128, 2048, 1, 8192, 128, 128, 128, 8192]
    - [100, 9.947]
  - - [128, 4096, 1, 128, 128, 128, 128, 128]
    - [10, 1.925]
  - - [128, 4096, 1, 256, 128, 128, 128, 256]
    - [92, 3.251]
  - - [128, 4096, 1, 512, 128, 128, 128, 512]
    - [92, 5.018]
  - - [128, 4096, 1, 1024, 128, 128, 128, 1024]
    - [100, 7.115]
  - - [128, 4096, 1, 2048, 128, 128, 128, 2048]
    - [100, 8.855]
  - - [128, 4096, 1, 4096, 128, 128, 128, 4096]
    - [81, 10.625]
  - - [128, 4096, 1, 8192, 128, 128, 128, 8192]
    - [14, 13.643]
  - - [128, 8192, 1, 128, 128, 128, 128, 128]
    - [84, 2.918]
  - - [128, 8192, 1, 256, 128, 128, 128, 256]
    - [81, 4.926]
  - - [128, 8192, 1, 512, 128, 128, 128, 512]
    - [81, 7.489]
  - - [128, 8192, 1, 1024, 128, 128, 128, 1024]
    - [81, 9.755]
  - - [128, 8192, 1, 2048, 128, 128, 128, 2048]
    - [81, 10.911]
  - - [128, 8192, 1, 4096, 128, 128, 128, 4096]
    - [81, 13.989]
  - - [128, 8192, 1, 8192, 128, 128, 128, 8192]
    - [83, 15.525]
  - - [256, 128, 1, 128, 256, 256, 256, 128]
    - [19, 0.175]
  - - [256, 128, 1, 256, 256, 256, 256, 256]
    - [96, 0.314]
  - - [256, 128, 1, 512, 256, 256, 256, 512]
    - [33, 0.52]
  - - [256, 128, 1, 1024, 256, 256, 256, 1024]
    - [33, 0.782]
  - - [256, 128, 1, 2048, 256, 256, 256, 2048]
    - [33, 1.174]
  - - [256, 128, 1, 4096, 256, 256, 256, 4096]
    - [95, 1.761]
  - - [256, 128, 1, 8192, 256, 256, 256, 8192]
    - [31, 2.686]
  - - [256, 256, 1, 128, 256, 256, 256, 128]
    - [96, 0.341]
  - - [256, 256, 1, 256, 256, 256, 256, 256]
    - [96, 0.623]
  - - [256, 256, 1, 512, 256, 256, 256, 512]
    - [34, 1.022]
  - - [256, 256, 1, 1024, 256, 256, 256, 1024]
    - [34, 1.556]
  - - [256, 256, 1, 2048, 256, 256, 256, 2048]
    - [103, 2.078]
  - - [256, 256, 1, 4096, 256, 256, 256, 4096]
    - [103, 3.006]
  - - [256, 256, 1, 8192, 256, 256, 256, 8192]
    - [29, 4.173]
  - - [256, 512, 1, 128, 256, 256, 256, 128]
    - [18, 0.644]
  - - [256, 512, 1, 256, 256, 256, 256, 256]
    - [31, 1.134]
  - - [256, 512, 1, 512, 256, 256, 256, 512]
    - [103, 1.876]
  - - [256, 512, 1, 1024, 256, 256, 256, 1024]
    - [103, 2.819]
  - - [256, 512, 1, 2048, 256, 256, 256, 2048]
    - [103, 3.704]
  - - [256, 512, 1, 4096, 256, 256, 256, 4096]
    - [102, 4.99]
  - - [256, 512, 1, 8192, 256, 256, 256, 8192]
    - [24, 6.82]
  - - [256, 1024, 1, 128, 256, 256, 256, 128]
    - [94, 1.152]
  - - [256, 1024, 1, 256, 256, 256, 256, 256]
    - [93, 2.004]
  - - [256, 1024, 1, 512, 256, 256, 256, 512]
    - [29, 3.253]
  - - [256, 1024, 1, 1024, 256, 256, 256, 1024]
    - [28, 4.719]
  - - [256, 1024, 1, 2048, 256, 256, 256, 2048]
    - [102, 6.076]
  - - [256, 1024, 1, 4096, 256, 256, 256, 4096]
    - [27, 7.621]
  - - [256, 1024, 1, 8192, 256, 256, 256, 8192]
    - [81, 9.855]
  - - [256, 2048, 1, 128, 256, 256, 256, 128]
    - [62, 1.926]
  - - [256, 2048, 1, 256, 256, 256, 256, 256]
    - [91, 3.281]
  - - [256, 2048, 1, 512, 256, 256, 256, 512]
    - [92, 5.018]
  - - [256, 2048, 1, 1024, 256, 256, 256, 1024]
    - [99, 7.093]
  - - [256, 2048, 1, 2048, 256, 256, 256, 2048]
    - [97, 8.96]
  - - [256, 2048, 1, 4096, 256, 256, 256, 4096]
    - [81, 10.713]
  - - [256, 2048, 1, 8192, 256, 256, 256, 8192]
    - [85, 13.634]
  - - [256, 4096, 1, 128, 256, 256, 256, 128]
    - [81, 2.913]
  - - [256, 4096, 1, 256, 256, 256, 256, 256]
    - [82, 4.919]
  - - [256, 4096, 1, 512, 256, 256, 256, 512]
    - [83, 7.473]
  - - [256, 4096, 1, 1024, 256, 256, 256, 1024]
    - [81, 10.089]
  - - [256, 4096, 1, 2048, 256, 256, 256, 2048]
    - [81, 11.107]
  - - [256, 4096, 1, 4096, 256, 256, 256, 4096]
    - [86, 13.87]
  - - [256, 4096, 1, 8192, 256, 256, 256, 8192]
    - [81, 15.44]
  - - [256, 8192, 1, 128, 256, 256, 256, 128]
    - [60, 4.129]
  - - [256, 8192, 1, 256, 256, 256, 256, 256]
    - [60, 6.577]
  - - [256, 8192, 1, 512, 256, 256, 256, 512]
    - [56, 9.143]
  - - [256, 8192, 1, 1024, 256, 256, 256, 1024]
    - [64, 11.552]
  - - [256, 8192, 1, 2048, 256, 256, 256, 2048]
    - [81, 13.116]
  - - [256, 8192, 1, 4096, 256, 256, 256, 4096]
    - [8, 15.561]
  - - [256, 8192, 1, 8192, 256, 256, 256, 8192]
    - [59, 17.061]
  - - [512, 128, 1, 128, 512, 512, 512, 128]
    - [96, 0.34]
  - - [512, 128, 1, 256, 512, 512, 512, 256]
    - [96, 0.62]
  - - [512, 128, 1, 512, 512, 512, 512, 512]
    - [33, 1.022]
  - - [512, 128, 1, 1024, 512, 512, 512, 1024]
    - [34, 1.559]
  - - [512, 128, 1, 2048, 512, 512, 512, 2048]
    - [31, 2.104]
  - - [512, 128, 1, 4096, 512, 512, 512, 4096]
    - [31, 3.013]
  - - [512, 128, 1, 8192, 512, 512, 512, 8192]
    - [28, 4.184]
  - - [512, 256, 1, 128, 512, 512, 512, 128]
    - [18, 0.644]
  - - [512, 256, 1, 256, 512, 512, 512, 256]
    - [18, 1.137]
  - - [512, 256, 1, 512, 512, 512, 512, 512]
    - [103, 1.879]
  - - [512, 256, 1, 1024, 512, 512, 512, 1024]
    - [31, 2.812]
  - - [512, 256, 1, 2048, 512, 512, 512, 2048]
    - [31, 3.708]
  - - [512, 256, 1, 4096, 512, 512, 512, 4096]
    - [28, 4.936]
  - - [512, 256, 1, 8192, 512, 512, 512, 8192]
    - [23, 6.837]
  - - [512, 512, 1, 128, 512, 512, 512, 128]
    - [93, 1.156]
  - - [512, 512, 1, 256, 512, 512, 512, 256]
    - [93, 1.994]
  - - [512, 512, 1, 512, 512, 512, 512, 512]
    - [29, 3.245]
  - - [512, 512, 1, 1024, 512, 512, 512, 1024]
    - [29, 4.713]
  - - [512, 512, 1, 2048, 512, 512, 512, 2048]
    - [29, 6.081]
  - - [512, 512, 1, 4096, 512, 512, 512, 4096]
    - [26, 7.631]
  - - [512, 512, 1, 8192, 512, 512, 512, 8192]
    - [81, 9.903]
  - - [512, 1024, 1, 128, 512, 512, 512, 128]
    - [62, 1.919]
  - - [512, 1024, 1, 256, 512, 512, 512, 256]
    - [92, 3.266]
  - - [512, 1024, 1, 512, 512, 512, 512, 512]
    - [92, 5.025]
  - - [512, 1024, 1, 1024, 512, 512, 512, 1024]
    - [99, 7.111]
  - - [512, 1024, 1, 2048, 512, 512, 512, 2048]
    - [99, 8.956]
  - - [512, 1024, 1, 4096, 512, 512, 512, 4096]
    - [85, 10.665]
  - - [512, 1024, 1, 8192, 512, 512, 512, 8192]
    - [81, 13.619]
  - - [512, 2048, 1, 128, 512, 512, 512, 128]
    - [82, 2.924]
  - - [512, 2048, 1, 256, 512, 512, 512, 256]
    - [85, 4.944]
  - - [512, 2048, 1, 512, 512, 512, 512, 512]
    - [85, 7.466]
  - - [512, 2048, 1, 1024, 512, 512, 512, 1024]
    - [85, 10.088]
  - - [512, 2048, 1, 2048, 512, 512, 512, 2048]
    - [85, 11.179]
  - - [512, 2048, 1, 4096, 512, 512, 512, 4096]
    - [88, 13.779]
  - - [512, 2048, 1, 8192, 512, 512, 512, 8192]
    - [81, 15.47]
  - - [512, 4096, 1, 128, 512, 512, 512, 128]
    - [60, 4.16]
  - - [512, 4096, 1, 256, 512, 512, 512, 256]
    - [60, 6.56]
  - - [512, 4096, 1, 512, 512, 512, 512, 512]
    - [67, 9.258]
  - - [512, 4096, 1, 1024, 512, 512, 512, 1024]
    - [69, 11.73]
  - - [512, 4096, 1, 2048, 512, 512, 512, 2048]
    - [89, 13.147]
  - - [512, 4096, 1, 4096, 512, 512, 512, 4096]
    - [73, 15.467]
  - - [512, 4096, 1, 8192, 512, 512, 512, 8192]
    - [75, 17.085]
  - - [512, 8192, 1, 128, 512, 512, 512, 128]
    - [49, 5.147]
  - - [512, 8192, 1, 256, 512, 512, 512, 256]
    - [43, 7.845]
  - - [512, 8192, 1, 512, 512, 512, 512, 512]
    - [4, 10.833]
  - - [512, 8192, 1, 1024, 512, 512, 512, 1024]
    - [55, 12.332]
  - - [512, 8192, 1, 2048, 512, 512, 512, 2048]
    - [8, 14.925]
  - - [512, 8192, 1, 4096, 512, 512, 512, 4096]
    - [38, 17.04]
  - - [512, 8192, 1, 8192, 512, 512, 512, 8192]
    - [5, 19.161]
  - - [1024, 128, 1, 128, 1024, 1024, 1024, 128]
    - [95, 0.638]
  - - [1024, 128, 1, 256, 1024, 1024, 1024, 256]
    - [18, 1.124]
  - - [1024, 128, 1, 512, 1024, 1024, 1024, 512]
    - [31, 1.879]
  - - [1024, 128, 1, 1024, 1024, 1024, 1024, 1024]
    - [31, 2.807]
  - - [1024, 128, 1, 2048, 1024, 1024, 1024, 2048]
    - [31, 3.702]
  - - [1024, 128, 1, 4096, 1024, 1024, 1024, 4096]
    - [28, 4.937]
  - - [1024, 128, 1, 8192, 1024, 1024, 1024, 8192]
    - [25, 6.999]
  - - [1024, 256, 1, 128, 1024, 1024, 1024, 128]
    - [94, 1.155]
  - - [1024, 256, 1, 256, 1024, 1024, 1024, 256]
    - [94, 1.998]
  - - [1024, 256, 1, 512, 1024, 1024, 1024, 512]
    - [29, 3.232]
  - - [1024, 256, 1, 1024, 1024, 1024, 1024, 1024]
    - [102, 4.691]
  - - [1024, 256, 1, 2048, 1024, 1024, 1024, 2048]
    - [28, 6.101]
  - - [1024, 256, 1, 4096, 1024, 1024, 1024, 4096]
    - [92, 7.226]
  - - [1024, 256, 1, 8192, 1024, 1024, 1024, 8192]
    - [14, 9.733]
  - - [1024, 512, 1, 128, 1024, 1024, 1024, 128]
    - [62, 1.932]
  - - [1024, 512, 1, 256, 1024, 1024, 1024, 256]
    - [91, 3.258]
  - - [1024, 512, 1, 512, 1024, 1024, 1024, 512]
    - [100, 5.014]
  - - [1024, 512, 1, 1024, 1024, 1024, 1024, 1024]
    - [100, 7.117]
  - - [1024, 512, 1, 2048, 1024, 1024, 1024, 2048]
    - [22, 8.875]
  - - [1024, 512, 1, 4096, 1024, 1024, 1024, 4096]
    - [81, 10.649]
  - - [1024, 512, 1, 8192, 1024, 1024, 1024, 8192]
    - [83, 13.59]
  - - [1024, 1024, 1, 128, 1024, 1024, 1024, 128]
    - [82, 2.929]
  - - [1024, 1024, 1, 256, 1024, 1024, 1024, 256]
    - [80, 4.915]
  - - [1024, 1024, 1, 512, 1024, 1024, 1024, 512]
    - [81, 7.471]
  - - [1024, 1024, 1, 1024, 1024, 1024, 1024, 1024]
    - [81, 10.07]
  - - [1024, 1024, 1, 2048, 1024, 1024, 1024, 2048]
    - [81, 11.214]
  - - [1024, 1024, 1, 4096, 1024, 1024, 1024, 4096]
    - [81, 13.892]
  - - [1024, 1024, 1, 8192, 1024, 1024, 1024, 8192]
    - [85, 15.601]
  - - [1024, 2048, 1, 128, 1024, 1024, 1024, 128]
    - [60, 4.154]
  - - [1024, 2048, 1, 256, 1024, 1024, 1024, 256]
    - [60, 6.578]
  - - [1024, 2048, 1, 512, 1024, 1024, 1024, 512]
    - [60, 9.26]
  - - [1024, 2048, 1, 1024, 1024, 1024, 1024, 1024]
    - [67, 11.706]
  - - [1024, 2048, 1, 2048, 1024, 1024, 1024, 2048]
    - [81, 13.15]
  - - [1024, 2048, 1, 4096, 1024, 1024, 1024, 4096]
    - [65, 15.555]
  - - [1024, 2048, 1, 8192, 1024, 1024, 1024, 8192]
    - [76, 17.119]
  - - [1024, 4096, 1, 128, 1024, 1024, 1024, 128]
    - [39, 5.174]
  - - [1024, 4096, 1, 256, 1024, 1024, 1024, 256]
    - [39, 7.926]
  - - [1024, 4096, 1, 512, 1024, 1024, 1024, 512]
    - [39, 10.952]
  - - [1024, 4096, 1, 1024, 1024, 1024, 1024, 1024]
    - [55, 12.324]
  - - [1024, 4096, 1, 2048, 1024, 1024, 1024, 2048]
    - [55, 14.833]
  - - [1024, 4096, 1, 4096, 1024, 1024, 1024, 4096]
    - [44, 17.311]
  - - [1024, 4096, 1, 8192, 1024, 1024, 1024, 8192]
    - [48, 19.197]
  - - [1024, 8192, 1, 128, 1024, 1024, 1024, 128]
    - [55, 4.639]
  - - [1024, 8192, 1, 256, 1024, 1024, 1024, 256]
    - [55, 7.589]
  - - [1024, 8192, 1, 512, 1024, 1024, 1024, 512]
    - [77, 10.595]
  - - [1024, 8192, 1, 1024, 1024, 1024, 1024, 1024]
    - [53, 13.761]
  - - [1024, 8192, 1, 2048, 1024, 1024, 1024, 2048]
    - [50, 16.433]
  - - [1024, 8192, 1, 4096, 1024, 1024, 1024, 4096]
    - [53, 18.542]
  - - [1024, 8192, 1, 8192, 1024, 1024, 1024, 8192]
    - [53, 20.452]
  - - [2048, 128, 1, 128, 2048, 2048, 2048, 128]
    - [17, 1.147]
  - - [2048, 128, 1, 256, 2048, 2048, 2048, 256]
    - [29, 1.973]
  - - [2048, 128, 1, 512, 2048, 2048, 2048, 512]
    - [29, 3.242]
  - - [2048, 128, 1, 1024, 2048, 2048, 2048, 1024]
    - [29, 4.715]
  - - [2048, 128, 1, 2048, 2048, 2048, 2048, 2048]
    - [21, 5.377]
  - - [2048, 128, 1, 4096, 2048, 2048, 2048, 4096]
    - [13, 7.116]
  - - [2048, 128, 1, 8192, 2048, 2048, 2048, 8192]
    - [13, 9.764]
  - - [2048, 256, 1, 128, 2048, 2048, 2048, 128]
    - [92, 1.934]
  - - [2048, 256, 1, 256, 2048, 2048, 2048, 256]
    - [92, 3.272]
  - - [2048, 256, 1, 512, 2048, 2048, 2048, 512]
    - [91, 5.018]
  - - [2048, 256, 1, 1024, 2048, 2048, 2048, 1024]
    - [20, 7.088]
  - - [2048, 256, 1, 2048, 2048, 2048, 2048, 2048]
    - [25, 8.134]
  - - [2048, 256, 1, 4096, 2048, 2048, 2048, 4096]
    - [81, 10.605]
  - - [2048, 256, 1, 8192, 2048, 2048, 2048, 8192]
    - [13, 13.401]
  - - [2048, 512, 1, 128, 2048, 2048, 2048, 128]
    - [82, 2.931]
  - - [2048, 512, 1, 256, 2048, 2048, 2048, 256]
    - [85, 4.923]
  - - [2048, 512, 1, 512, 2048, 2048, 2048, 512]
    - [85, 7.475]
  - - [2048, 512, 1, 1024, 2048, 2048, 2048, 1024]
    - [86, 9.991]
  - - [2048, 512, 1, 2048, 2048, 2048, 2048, 2048]
    - [81, 10.944]
  - - [2048, 512, 1, 4096, 2048, 2048, 2048, 4096]
    - [81, 13.795]
  - - [2048, 512, 1, 8192, 2048, 2048, 2048, 8192]
    - [87, 15.323]
  - - [2048, 1024, 1, 128, 2048, 2048, 2048, 128]
    - [58, 4.15]
  - - [2048, 1024, 1, 256, 2048, 2048, 2048, 256]
    - [60, 6.584]
  - - [2048, 1024, 1, 512, 2048, 2048, 2048, 512]
    - [61, 9.181]
  - - [2048, 1024, 1, 1024, 2048, 2048, 2048, 1024]
    - [71, 11.649]
  - - [2048, 1024, 1, 2048, 2048, 2048, 2048, 2048]
    - [55, 13.005]
  - - [2048, 1024, 1, 4096, 2048, 2048, 2048, 4096]
    - [66, 15.667]
  - - [2048, 1024, 1, 8192, 2048, 2048, 2048, 8192]
    - [70, 17.144]
  - - [2048, 2048, 1, 128, 2048, 2048, 2048, 128]
    - [41, 5.157]
  - - [2048, 2048, 1, 256, 2048, 2048, 2048, 256]
    - [41, 7.918]
  - - [2048, 2048, 1, 512, 2048, 2048, 2048, 512]
    - [41, 10.924]
  - - [2048, 2048, 1, 1024, 2048, 2048, 2048, 1024]
    - [59, 12.321]
  - - [2048, 2048, 1, 2048, 2048, 2048, 2048, 2048]
    - [55, 14.976]
  - - [2048, 2048, 1, 4096, 2048, 2048, 2048, 4096]
    - [42, 17.121]
  - - [2048, 2048, 1, 8192, 2048, 2048, 2048, 8192]
    - [38, 19.157]
  - - [2048, 4096, 1, 128, 2048, 2048, 2048, 128]
    - [55, 4.649]
  - - [2048, 4096, 1, 256, 2048, 2048, 2048, 256]
    - [55, 7.616]
  - - [2048, 4096, 1, 512, 2048, 2048, 2048, 512]
    - [78, 10.585]
  - - [2048, 4096, 1, 1024, 2048, 2048, 2048, 1024]
    - [35, 13.854]
  - - [2048, 4096, 1, 2048, 2048, 2048, 2048, 2048]
    - [47, 16.467]
  - - [2048, 4096, 1, 4096, 2048, 2048, 2048, 4096]
    - [44, 18.67]
  - - [2048, 4096, 1, 8192, 2048, 2048, 2048, 8192]
    - [44, 20.506]
  - - [2048, 8192, 1, 128, 2048, 2048, 2048, 128]
    - [60, 5.747]
  - - [2048, 8192, 1, 256, 2048, 2048, 2048, 256]
    - [35, 8.561]
  - - [2048, 8192, 1, 512, 2048, 2048, 2048, 512]
    - [38, 11.878]
  - - [2048, 8192, 1, 1024, 2048, 2048, 2048, 1024]
    - [42, 15.11]
  - - [2048, 8192, 1, 2048, 2048, 2048, 2048, 2048]
    - [44, 17.807]
  - - [2048, 8192, 1, 4096, 2048, 2048, 2048, 4096]
    - [45, 19.863]
  - - [2048, 8192, 1, 8192, 2048, 2048, 2048, 8192]
    - [35, 21.003]
  - - [4096, 128, 1, 128, 4096, 4096, 4096, 128]
    - [63, 1.948]
  - - [4096, 128, 1, 256, 4096, 4096, 4096, 256]
    - [92, 3.289]
  - - [4096, 128, 1, 512, 4096, 4096, 4096, 512]
    - [98, 5.014]
  - - [4096, 128, 1, 1024, 4096, 4096, 4096, 1024]
    - [97, 7.027]
  - - [4096, 128, 1, 2048, 4096, 4096, 4096, 2048]
    - [25, 8.206]
  - - [4096, 128, 1, 4096, 4096, 4096, 4096, 4096]
    - [81, 10.734]
  - - [4096, 128, 1, 8192, 4096, 4096, 4096, 8192]
    - [15, 13.619]
  - - [4096, 256, 1, 128, 4096, 4096, 4096, 128]
    - [80, 2.939]
  - - [4096, 256, 1, 256, 4096, 4096, 4096, 256]
    - [81, 4.938]
  - - [4096, 256, 1, 512, 4096, 4096, 4096, 512]
    - [81, 7.495]
  - - [4096, 256, 1, 1024, 4096, 4096, 4096, 1024]
    - [86, 9.981]
  - - [4096, 256, 1, 2048, 4096, 4096, 4096, 2048]
    - [89, 11.016]
  - - [4096, 256, 1, 4096, 4096, 4096, 4096, 4096]
    - [16, 13.791]
  - - [4096, 256, 1, 8192, 4096, 4096, 4096, 8192]
    - [89, 15.325]
  - - [4096, 512, 1, 128, 4096, 4096, 4096, 128]
    - [58, 4.156]
  - - [4096, 512, 1, 256, 4096, 4096, 4096, 256]
    - [61, 6.514]
  - - [4096, 512, 1, 512, 4096, 4096, 4096, 512]
    - [61, 9.183]
  - - [4096, 512, 1, 1024, 4096, 4096, 4096, 1024]
    - [72, 11.668]
  - - [4096, 512, 1, 2048, 4096, 4096, 4096, 2048]
    - [55, 13.015]
  - - [4096, 512, 1, 4096, 4096, 4096, 4096, 4096]
    - [65, 15.615]
  - - [4096, 512, 1, 8192, 4096, 4096, 4096, 8192]
    - [74, 17.119]
  - - [4096, 1024, 1, 128, 4096, 4096, 4096, 128]
    - [39, 5.174]
  - - [4096, 1024, 1, 256, 4096, 4096, 4096, 256]
    - [39, 7.871]
  - - [4096, 1024, 1, 512, 4096, 4096, 4096, 512]
    - [39, 10.946]
  - - [4096, 1024, 1, 1024, 4096, 4096, 4096, 1024]
    - [55, 12.295]
  - - [4096, 1024, 1, 2048, 4096, 4096, 4096, 2048]
    - [55, 15.198]
  - - [4096, 1024, 1, 4096, 4096, 4096, 4096, 4096]
    - [46, 17.115]
  - - [4096, 1024, 1, 8192, 4096, 4096, 4096, 8192]
    - [42, 19.074]
  - - [4096, 2048, 1, 128, 4096, 4096, 4096, 128]
    - [55, 4.694]
  - - [4096, 2048, 1, 256, 4096, 4096, 4096, 256]
    - [55, 7.63]
  - - [4096, 2048, 1, 512, 4096, 4096, 4096, 512]
    - [77, 10.502]
  - - [4096, 2048, 1, 1024, 4096, 4096, 4096, 1024]
    - [38, 13.814]
  - - [4096, 2048, 1, 2048, 4096, 4096, 4096, 2048]
    - [40, 16.485]
  - - [4096, 2048, 1, 4096, 4096, 4096, 4096, 4096]
    - [44, 18.485]
  - - [4096, 2048, 1, 8192, 4096, 4096, 4096, 8192]
    - [35, 20.378]
  - - [4096, 4096, 1, 128, 4096, 4096, 4096, 128]
    - [58, 5.774]
  - - [4096, 4096, 1, 256, 4096, 4096, 4096, 256]
    - [42, 8.601]
  - - [4096, 4096, 1, 512, 4096, 4096, 4096, 512]
    - [46, 11.769]
  - - [4096, 4096, 1, 1024, 4096, 4096, 4096, 1024]
    - [2, 15.046]
  - - [4096, 4096, 1, 2048, 4096, 4096, 4096, 2048]
    - [47, 17.777]
  - - [4096, 4096, 1, 4096, 4096, 4096, 4096, 4096]
    - [35, 19.804]
  - - [4096, 4096, 1, 8192, 4096, 4096, 4096, 8192]
    - [36, 20.907]
  - - [4096, 8192, 1, 128, 4096, 4096, 4096, 128]
    - [52, 6.499]
  - - [4096, 8192, 1, 256, 4096, 4096, 4096, 256]
    - [36, 9.434]
  - - [4096, 8192, 1, 512, 4096, 4096, 4096, 512]
    - [37, 12.892]
  - - [4096, 8192, 1, 1024, 4096, 4096, 4096, 1024]
    - [51, 16.357]
  - - [4096, 8192, 1, 2048, 4096, 4096, 4096, 2048]
    - [36, 18.863]
  - - [4096, 8192, 1, 4096, 4096, 4096, 4096, 4096]
    - [39, 20.38]
  - - [4096, 8192, 1, 8192, 4096, 4096, 4096, 8192]
    - [50, 20.837]
  - - [8192, 128, 1, 128, 8192, 8192, 8192, 128]
    - [9, 2.827]
  - - [8192, 128, 1, 256, 8192, 8192, 8192, 256]
    - [82, 4.665]
  - - [8192, 128, 1, 512, 8192, 8192, 8192, 512]
    - [85, 7.124]
  - - [8192, 128, 1, 1024, 8192, 8192, 8192, 1024]
    - [13, 9.671]
  - - [8192, 128, 1, 2048, 8192, 8192, 8192, 2048]
    - [81, 11.138]
  - - [8192, 128, 1, 4096, 8192, 8192, 8192, 4096]
    - [15, 13.889]
  - - [8192, 128, 1, 8192, 8192, 8192, 8192, 8192]
    - [90, 15.289]
  - - [8192, 256, 1, 128, 8192, 8192, 8192, 128]
    - [58, 4.211]
  - - [8192, 256, 1, 256, 8192, 8192, 8192, 256]
    - [58, 6.661]
  - - [8192, 256, 1, 512, 8192, 8192, 8192, 512]
    - [58, 9.201]
  - - [8192, 256, 1, 1024, 8192, 8192, 8192, 1024]
    - [12, 11.503]
  - - [8192, 256, 1, 2048, 8192, 8192, 8192, 2048]
    - [55, 13.145]
  - - [8192, 256, 1, 4096, 8192, 8192, 8192, 4096]
    - [68, 15.701]
  - - [8192, 256, 1, 8192, 8192, 8192, 8192, 8192]
    - [65, 17.129]
  - - [8192, 512, 1, 128, 8192, 8192, 8192, 128]
    - [49, 5.096]
  - - [8192, 512, 1, 256, 8192, 8192, 8192, 256]
    - [54, 7.814]
  - - [8192, 512, 1, 512, 8192, 8192, 8192, 512]
    - [43, 10.881]
  - - [8192, 512, 1, 1024, 8192, 8192, 8192, 1024]
    - [57, 12.268]
  - - [8192, 512, 1, 2048, 8192, 8192, 8192, 2048]
    - [65, 14.961]
  - - [8192, 512, 1, 4096, 8192, 8192, 8192, 4096]
    - [35, 16.931]
  - - [8192, 512, 1, 8192, 8192, 8192, 8192, 8192]
    - [0, 19.192]
  - - [8192, 1024, 1, 128, 8192, 8192, 8192, 128]
    - [55, 4.687]
  - - [8192, 1024, 1, 256, 8192, 8192, 8192, 256]
    - [55, 7.54]
  - - [8192, 1024, 1, 512, 8192, 8192, 8192, 512]
    - [79, 10.469]
  - - [8192, 1024, 1, 1024, 8192, 8192, 8192, 1024]
    - [42, 13.791]
  - - [8192, 1024, 1, 2048, 8192, 8192, 8192, 2048]
    - [35, 16.446]
  - - [8192, 1024, 1, 4096, 8192, 8192, 8192, 4096]
    - [7, 18.52]
  - - [8192, 1024, 1, 8192, 8192, 8192, 8192, 8192]
    - [53, 20.384]
  - - [8192, 2048, 1, 128, 8192, 8192, 8192, 128]
    - [58, 5.703]
  - - [8192, 2048, 1, 256, 8192, 8192, 8192, 256]
    - [53, 8.527]
  - - [8192, 2048, 1, 512, 8192, 8192, 8192, 512]
    - [46, 11.799]
  - - [8192, 2048, 1, 1024, 8192, 8192, 8192, 1024]
    - [35, 14.967]
  - - [8192, 2048, 1, 2048, 8192, 8192, 8192, 2048]
    - [6, 17.695]
  - - [8192, 2048, 1, 4096, 8192, 8192, 8192, 4096]
    - [45, 19.759]
  - - [8192, 2048, 1, 8192, 8192, 8192, 8192, 8192]
    - [36, 20.841]
  - - [8192, 4096, 1, 128, 8192, 8192, 8192, 128]
    - [41, 6.392]
  - - [8192, 4096, 1, 256, 8192, 8192, 8192, 256]
    - [43, 9.407]
  - - [8192, 4096, 1, 512, 8192, 8192, 8192, 512]
    - [1, 13.038]
  - - [8192, 4096, 1, 1024, 8192, 8192, 8192, 1024]
    - [51, 16.337]
  - - [8192, 4096, 1, 2048, 8192, 8192, 8192, 2048]
    - [45, 18.866]
  - - [8192, 4096, 1, 4096, 8192, 8192, 8192, 4096]
    - [51, 20.326]
  - - [8192, 4096, 1, 8192, 8192, 8192, 8192, 8192]
    - [5, 20.909]
  - - [8192, 8192, 1, 128, 8192, 8192, 8192, 128]
    - [3, 6.869]
  - - [8192, 8192, 1, 256, 8192, 8192, 8192, 256]
    - [3, 9.707]
  - - [8192, 8192, 1, 512, 8192, 8192, 8192, 512]
    - [45, 13.581]
  - - [8192, 8192, 1, 1024, 8192, 8192, 8192, 1024]
    - [51, 16.987]
  - - [8192, 8192, 1, 2048, 8192, 8192, 8192, 2048]
    - [51, 19.191]
  - - [8192, 8192, 1, 4096, 8192, 8192, 8192, 4096]
    - [51, 20.334]
  - - [8192, 8192, 1, 8192, 8192, 8192, 8192, 8192]
    - [51, 21.285]
  - - [1, 1, 1, 32, 1, 1, 1, 32]
    - [105, 0.0]
- null
- null
- ExperimentalStreamK
- GridBased
