library/src/amd_detail/rocblaslt/src/Tensile/Logic/asm_full/aquavanjaram/gfx942_80cu/StreamK/aquavanjaram942_Cijk_Alik_Bjlk_BSS_BH_UserArgs.yaml
- {MinimumRequiredVersion: 4.33.0}
- aquavanjaram942
- {Architecture: gfx942, CUCount: 80}
- [Device 0049, Device 0050]
    SolutionIndex: 0
    SolutionNameMin: Cijk_Alik_Bjlk_BSS_BH_UserArgs_MT256x256x32_MI16x16x1_SN_LDSB1_CLR1_GSU0_GSUC0_GSUWGMRR0_K1_LBSPPA128_LBSPPB2048_LPB16_MIWT8_8_PLR1_SU32_SUM0_SUS256_SKXCCM0_VWA2_VWB1_WGM1_WGMXCC1_WGMXCCGn1
    SolutionIndex: 1
    SolutionNameMin: Cijk_Alik_Bjlk_BSS_BH_UserArgs_MT256x256x32_MI16x16x1_SN_LDSB1_CLR1_GSU0_GSUC0_GSUWGMRR0_K1_LBSPPA256_LBSPPB2048_LPB32_MIWT8_8_PLR1_SU32_SUM0_SUS256_SKXCCM0_VWA4_VWB2_WGM1_WGMXCC1_WGMXCCGn1
    SolutionIndex: 2
    SolutionNameMin: Cijk_Alik_Bjlk_BSS_BH_UserArgs_MT256x256x32_MI16x16x1_SN_LDSB1_CLR1_GSU0_GSUC0_GSUWGMRR0_K1_LBSPPA256_LBSPPB2048_LPB0_MIWT8_8_PLR1_SU32_SUM0_SUS256_SKXCCM0_VWA4_VWB4_WGM1_WGMXCC1_WGMXCCGn1
    SolutionIndex: 3
    SolutionNameMin: Cijk_Alik_Bjlk_BSS_BH_UserArgs_MT256x256x32_MI16x16x1_SN_LDSB1_CLR1_GSU0_GSUC0_GSUWGMRR0_K1_LBSPPA256_LBSPPB2048_LPB0_MIWT8_8_PLR1_SU32_SUM0_SUS256_SKXCCM0_VWA4_VWB8_WGM1_WGMXCC1_WGMXCCGn1
    SolutionIndex: 4
    SolutionNameMin: Cijk_Alik_Bjlk_BSS_BH_UserArgs_MT256x256x32_MI16x16x1_SN_LDSB1_CLR1_GSU0_GSUC0_GSUWGMRR0_K1_LBSPPA256_LBSPPB2048_LPB0_MIWT8_8_PLR1_SU32_SUM0_SUS256_SKXCCM0_VWA4_VWB8_WGM2_WGMXCC1_WGMXCCGn1
    SolutionIndex: 5
    SolutionNameMin: Cijk_Alik_Bjlk_BSS_BH_UserArgs_MT256x256x32_MI16x16x1_SN_LDSB1_CLR1_GSU0_GSUC0_GSUWGMRR0_K1_LBSPPA256_LBSPPB2048_LPB0_MIWT8_8_PLR1_SU32_SUM0_SUS256_SKXCCM0_VWA4_VWB4_WGM4_WGMXCC1_WGMXCCGn1
    SolutionIndex: 6
    SolutionNameMin: Cijk_Alik_Bjlk_BSS_BH_UserArgs_MT256x256x32_MI16x16x1_SN_LDSB1_CLR1_GSU0_GSUC0_GSUWGMRR0_K1_LBSPPA256_LBSPPB2048_LPB0_MIWT8_8_PLR1_SU32_SUM0_SUS256_SKXCCM0_VWA4_VWB8_WGM4_WGMXCC1_WGMXCCGn1
    SolutionIndex: 7
    SolutionNameMin: Cijk_Alik_Bjlk_BSS_BH_UserArgs_MT128x256x32_MI16x16x1_SN_LDSB1_CLR1_GSU0_GSUC0_GSUWGMRR0_K1_LBSPPA256_LBSPPB2048_LPB32_MIWT4_8_PLR1_SU32_SUM0_SUS256_SKXCCM0_VWA4_VWB2_WGM1_WGMXCC1_WGMXCCGn1
    SolutionIndex: 8
    SolutionNameMin: Cijk_Alik_Bjlk_BSS_BH_UserArgs_MT128x256x32_MI16x16x1_SN_LDSB1_CLR1_GSU0_GSUC0_GSUWGMRR0_K1_LBSPPA256_LBSPPB2048_LPB0_MIWT4_8_PLR1_SU32_SUM0_SUS256_SKXCCM0_VWA4_VWB4_WGM1_WGMXCC1_WGMXCCGn1
    SolutionIndex: 9
    SolutionNameMin: Cijk_Alik_Bjlk_BSS_BH_UserArgs_MT128x256x32_MI16x16x1_SN_LDSB1_CLR1_GSU0_GSUC0_GSUWGMRR0_K1_LBSPPA256_LBSPPB2048_LPB0_MIWT4_8_PLR1_SU32_SUM0_SUS256_SKXCCM0_VWA4_VWB4_WGM4_WGMXCC1_WGMXCCGn1
    SolutionIndex: 10
    SolutionNameMin: Cijk_Alik_Bjlk_BSS_BH_UserArgs_MT128x256x32_MI16x16x1_SN_LDSB1_CLR1_GSU0_GSUC0_GSUWGMRR0_K1_LBSPPA256_LBSPPB2048_LPB0_MIWT4_8_PLR1_SU32_SUM0_SUS256_SKXCCM0_VWA4_VWB8_WGM4_WGMXCC1_WGMXCCGn1
    SolutionIndex: 11
    SolutionNameMin: Cijk_Alik_Bjlk_BSS_BH_UserArgs_MT256x128x32_MI16x16x1_SN_LDSB1_CLR1_GSU0_GSUC0_GSUWGMRR0_K1_LBSPPA256_LBSPPB1024_LPB32_MIWT8_4_PLR1_SU32_SUM0_SUS256_SKXCCM0_VWA4_VWB2_WGM1_WGMXCC1_WGMXCCGn1
    SolutionIndex: 12
    SolutionNameMin: Cijk_Alik_Bjlk_BSS_BH_UserArgs_MT128x64x32_MI16x16x1_SN_LDSB0_CLR1_GSU0_GSUC0_GSUWGMRR0_K1_LBSPPA256_LBSPPB512_LPB16_MIWT4_2_PLR1_SU32_SUM0_SUS256_SKXCCM0_VWA4_VWB1_WGM2_WGMXCC1_WGMXCCGn1
    SolutionIndex: 13
    SolutionNameMin: Cijk_Alik_Bjlk_BSS_BH_UserArgs_MT128x256x64_MI16x16x1_SN_LDSB1_CLR1_GSU0_GSUC0_GSUWGMRR0_K1_LBSPPA512_LBSPPB4096_LPB32_MIWT4_8_PLR1_SU32_SUM0_SUS256_SKXCCM0_VWA4_VWB2_WGM1_WGMXCC1_WGMXCCGn1
    SolutionIndex: 14
    SolutionNameMin: Cijk_Alik_Bjlk_BSS_BH_UserArgs_MT128x256x64_MI16x16x1_SN_LDSB1_CLR1_GSU0_GSUC0_GSUWGMRR0_K1_LBSPPA128_LBSPPB4096_LPB0_MIWT4_8_PLR1_SU32_SUM0_SUS256_SKXCCM0_VWA1_VWB4_WGM1_WGMXCC1_WGMXCCGn1
    SolutionIndex: 15
    SolutionNameMin: Cijk_Alik_Bjlk_BSS_BH_UserArgs_MT128x256x64_MI16x16x1_SN_LDSB1_CLR1_GSU0_GSUC0_GSUWGMRR0_K1_LBSPPA512_LBSPPB4096_LPB0_MIWT4_8_PLR1_SU32_SUM0_SUS256_SKXCCM0_VWA4_VWB4_WGM1_WGMXCC1_WGMXCCGn1
    SolutionIndex: 16
    SolutionNameMin: Cijk_Alik_Bjlk_BSS_BH_UserArgs_MT256x128x64_MI16x16x1_SN_LDSB1_CLR1_GSU0_GSUC0_GSUWGMRR0_K1_LBSPPA512_LBSPPB2048_LPB32_MIWT8_4_PLR1_SU32_SUM0_SUS256_SKXCCM0_VWA4_VWB2_WGM1_WGMXCC1_WGMXCCGn1
    SolutionIndex: 17
    SolutionNameMin: Cijk_Alik_Bjlk_BSS_BH_UserArgs_MT256x128x64_MI16x16x1_SN_LDSB1_CLR1_GSU0_GSUC0_GSUWGMRR0_K1_LBSPPA512_LBSPPB2048_LPB0_MIWT8_4_PLR1_SU32_SUM0_SUS256_SKXCCM0_VWA4_VWB4_WGM1_WGMXCC1_WGMXCCGn1
    SolutionIndex: 18
    SolutionNameMin: Cijk_Alik_Bjlk_BSS_BH_UserArgs_MT256x128x64_MI16x16x1_SN_LDSB1_CLR1_GSU0_GSUC0_GSUWGMRR0_K1_LBSPPA512_LBSPPB2048_LPB0_MIWT8_4_PLR1_SU32_SUM0_SUS256_SKXCCM0_VWA4_VWB4_WGM2_WGMXCC1_WGMXCCGn1
    SolutionIndex: 19
    SolutionNameMin: Cijk_Alik_Bjlk_BSS_BH_UserArgs_MT128x128x64_MI16x16x1_SN_LDSB1_CLR1_GSU0_GSUC0_GSUWGMRR0_K1_LBSPPA128_LBSPPB2048_LPB0_MIWT4_4_PLR1_SU32_SUM0_SUS256_SKXCCM0_VWA1_VWB4_WGM1_WGMXCC1_WGMXCCGn1
    SolutionIndex: 20
    SolutionNameMin: Cijk_Alik_Bjlk_BSS_BH_UserArgs_MT128x128x64_MI16x16x1_SN_LDSB1_CLR1_GSU0_GSUC0_GSUWGMRR0_K1_LBSPPA512_LBSPPB2048_LPB0_MIWT4_4_PLR1_SU32_SUM0_SUS256_SKXCCM0_VWA4_VWB4_WGM1_WGMXCC1_WGMXCCGn1
    SolutionIndex: 21
    SolutionNameMin: Cijk_Alik_Bjlk_BSS_BH_UserArgs_MT128x128x64_MI16x16x1_SN_LDSB1_CLR1_GSU0_GSUC0_GSUWGMRR0_K1_LBSPPA512_LBSPPB2048_LPB0_MIWT4_4_PLR1_SU32_SUM0_SUS256_SKXCCM0_VWA4_VWB4_WGM2_WGMXCC1_WGMXCCGn1
    SolutionIndex: 22
    SolutionNameMin: Cijk_Alik_Bjlk_BSS_BH_UserArgs_MT128x128x64_MI16x16x1_SN_LDSB1_CLR1_GSU0_GSUC0_GSUWGMRR0_K1_LBSPPA512_LBSPPB2048_LPB0_MIWT4_4_PLR1_SU32_SUM0_SUS256_SKXCCM0_VWA4_VWB4_WGM4_WGMXCC1_WGMXCCGn1
    SolutionIndex: 23
    SolutionNameMin: Cijk_Alik_Bjlk_BSS_BH_UserArgs_MT32x64x64_MI16x16x1_SN_LDSB0_CLR1_GSU0_GSUC0_GSUWGMRR0_K1_LBSPPA128_LBSPPB1024_LPB32_MIWT1_2_PLR1_SU32_SUM0_SUS256_SKXCCM0_VWA1_VWB2_WGM1_WGMXCC1_WGMXCCGn1
    SolutionIndex: 24
    SolutionNameMin: Cijk_Alik_Bjlk_BSS_BH_UserArgs_MT64x32x64_MI16x16x1_SN_LDSB0_CLR1_GSU0_GSUC0_GSUWGMRR0_K1_LBSPPA256_LBSPPB512_LPB16_MIWT2_1_PLR1_SU32_SUM0_SUS256_SKXCCM0_VWA2_VWB1_WGM1_WGMXCC1_WGMXCCGn1
    SolutionIndex: 25
    SolutionNameMin: Cijk_Alik_Bjlk_BSS_BH_UserArgs_MT32x32x64_MI16x16x1_SN_LDSB0_CLR1_GSU0_GSUC0_GSUWGMRR0_K1_LBSPPA128_LBSPPB512_LPB16_MIWT1_1_PLR1_SU32_SUM0_SUS256_SKXCCM0_VWA1_VWB1_WGM1_WGMXCC1_WGMXCCGn1
    SolutionIndex: 26
    SolutionNameMin: Cijk_Alik_Bjlk_BSS_BH_UserArgs_MT128x64x128_MI16x16x1_SN_LDSB1_CLR1_GSU0_GSUC0_GSUWGMRR0_K1_LBSPPA256_LBSPPB1024_LPB32_MIWT4_2_PLR2_SU32_SUM0_SUS256_SKXCCM0_VWA1_VWB2_WGM1_WGMXCC1_WGMXCCGn1
    SolutionIndex: 27
    SolutionNameMin: Cijk_Alik_Bjlk_BSS_BH_UserArgs_MT128x64x128_MI16x16x1_SN_LDSB1_CLR1_GSU0_GSUC0_GSUWGMRR0_K1_LBSPPA1024_LBSPPB1024_LPB32_MIWT4_2_PLR2_SU32_SUM0_SUS256_SKXCCM0_VWA4_VWB2_WGM1_WGMXCC1_WGMXCCGn1
    SolutionIndex: 28
    SolutionNameMin: Cijk_Alik_Bjlk_BSS_BH_UserArgs_MT128x64x128_MI16x16x1_SN_LDSB1_CLR1_GSU0_GSUC0_GSUWGMRR0_K1_LBSPPA1024_LBSPPB1024_LPB32_MIWT4_2_PLR2_SU32_SUM0_SUS256_SKXCCM0_VWA4_VWB2_WGM2_WGMXCC1_WGMXCCGn1
    SolutionIndex: 29
    SolutionNameMin: Cijk_Alik_Bjlk_BSS_BH_UserArgs_MT128x64x128_MI16x16x1_SN_LDSB1_CLR1_GSU0_GSUC0_GSUWGMRR0_K1_LBSPPA1024_LBSPPB1024_LPB32_MIWT4_2_PLR2_SU32_SUM0_SUS256_SKXCCM0_VWA4_VWB2_WGM4_WGMXCC1_WGMXCCGn1
    SolutionIndex: 30
    SolutionNameMin: Cijk_Alik_Bjlk_BSS_BH_UserArgs_MT64x64x128_MI16x16x1_SN_LDSB1_CLR1_GSU0_GSUC0_GSUWGMRR0_K1_LBSPPA256_LBSPPB1024_LPB32_MIWT2_2_PLR2_SU32_SUM0_SUS256_SKXCCM0_VWA1_VWB2_WGM1_WGMXCC1_WGMXCCGn1
    SolutionIndex: 31
    SolutionNameMin: Cijk_Alik_Bjlk_BSS_BH_UserArgs_MT64x64x128_MI16x16x1_SN_LDSB1_CLR1_GSU0_GSUC0_GSUWGMRR0_K1_LBSPPA256_LBSPPB1024_LPB32_MIWT2_2_PLR2_SU32_SUM0_SUS256_SKXCCM0_VWA1_VWB2_WGM4_WGMXCC1_WGMXCCGn1
    SolutionIndex: 32
    SolutionNameMin: Cijk_Alik_Bjlk_BSS_BH_UserArgs_MT32x64x128_MI16x16x1_SN_LDSB1_CLR1_GSU0_GSUC0_GSUWGMRR0_K1_LBSPPA256_LBSPPB1024_LPB32_MIWT1_2_PLR2_SU32_SUM0_SUS256_SKXCCM0_VWA1_VWB2_WGM1_WGMXCC1_WGMXCCGn1
    SolutionIndex: 33
    SolutionNameMin: Cijk_Alik_Bjlk_BSS_BH_UserArgs_MT32x64x128_MI16x16x1_SN_LDSB1_CLR1_GSU0_GSUC0_GSUWGMRR0_K1_LBSPPA256_LBSPPB1024_LPB32_MIWT1_2_PLR2_SU32_SUM0_SUS256_SKXCCM0_VWA1_VWB2_WGM2_WGMXCC1_WGMXCCGn1
    SolutionIndex: 34
    SolutionNameMin: Cijk_Alik_Bjlk_BSS_BH_UserArgs_MT32x32x128_MI16x16x1_SN_LDSB1_CLR1_GSU0_GSUC0_GSUWGMRR0_K1_LBSPPA256_LBSPPB512_LPB16_MIWT1_1_PLR1_SU32_SUM0_SUS256_SKXCCM0_VWA1_VWB1_WGM1_WGMXCC1_WGMXCCGn1
    SolutionIndex: 35
    SolutionNameMin: Cijk_Alik_Bjlk_BSS_BH_UserArgs_MT32x32x128_MI16x16x1_SN_LDSB1_CLR1_GSU0_GSUC0_GSUWGMRR0_K1_LBSPPA256_LBSPPB512_LPB16_MIWT1_1_PLR2_SU32_SUM0_SUS256_SKXCCM0_VWA1_VWB1_WGM1_WGMXCC1_WGMXCCGn1
    SolutionIndex: 36
    SolutionNameMin: Cijk_Alik_Bjlk_BSS_BH_UserArgs_MT256x256x32_MI16x16x1_SN_LDSB1_CLR1_GSU0_GSUC0_GSUWGMRR0_K1_LBSPPA256_LBSPPB2048_LPB32_MIWT8_8_PLR1_SU32_SUM0_SUS256_SKXCCM4_VWA4_VWB2_WGM1_WGMXCC1_WGMXCCGn1
    SolutionIndex: 37
    SolutionNameMin: Cijk_Alik_Bjlk_BSS_BH_UserArgs_MT256x256x32_MI16x16x1_SN_LDSB1_CLR1_GSU0_GSUC0_GSUWGMRR0_K1_LBSPPA128_LBSPPB2048_LPB0_MIWT8_8_PLR1_SU32_SUM0_SUS256_SKXCCM4_VWA1_VWB4_WGM1_WGMXCC1_WGMXCCGn1
    SolutionIndex: 38
    SolutionNameMin: Cijk_Alik_Bjlk_BSS_BH_UserArgs_MT256x256x32_MI16x16x1_SN_LDSB1_CLR1_GSU0_GSUC0_GSUWGMRR0_K1_LBSPPA256_LBSPPB2048_LPB0_MIWT8_8_PLR1_SU32_SUM0_SUS256_SKXCCM4_VWA4_VWB4_WGM1_WGMXCC1_WGMXCCGn1
    SolutionIndex: 39
    SolutionNameMin: Cijk_Alik_Bjlk_BSS_BH_UserArgs_MT256x256x32_MI16x16x1_SN_LDSB1_CLR1_GSU0_GSUC0_GSUWGMRR0_K1_LBSPPA256_LBSPPB2048_LPB0_MIWT8_8_PLR1_SU32_SUM0_SUS256_SKXCCM4_VWA4_VWB8_WGM1_WGMXCC1_WGMXCCGn1
    SolutionIndex: 40
    SolutionNameMin: Cijk_Alik_Bjlk_BSS_BH_UserArgs_MT256x256x32_MI16x16x1_SN_LDSB1_CLR1_GSU0_GSUC0_GSUWGMRR0_K1_LBSPPA256_LBSPPB2048_LPB16_MIWT8_8_PLR1_SU32_SUM0_SUS256_SKXCCM4_VWA4_VWB1_WGM2_WGMXCC1_WGMXCCGn1
    SolutionIndex: 41
    SolutionNameMin: Cijk_Alik_Bjlk_BSS_BH_UserArgs_MT256x256x32_MI16x16x1_SN_LDSB1_CLR1_GSU0_GSUC0_GSUWGMRR0_K1_LBSPPA256_LBSPPB2048_LPB0_MIWT8_8_PLR1_SU32_SUM0_SUS256_SKXCCM4_VWA4_VWB4_WGM2_WGMXCC1_WGMXCCGn1
    SolutionIndex: 42
    SolutionNameMin: Cijk_Alik_Bjlk_BSS_BH_UserArgs_MT256x256x32_MI16x16x1_SN_LDSB1_CLR1_GSU0_GSUC0_GSUWGMRR0_K1_LBSPPA256_LBSPPB2048_LPB0_MIWT8_8_PLR1_SU32_SUM0_SUS256_SKXCCM4_VWA4_VWB8_WGM2_WGMXCC1_WGMXCCGn1
    SolutionIndex: 43
    SolutionNameMin: Cijk_Alik_Bjlk_BSS_BH_UserArgs_MT256x256x32_MI16x16x1_SN_LDSB1_CLR1_GSU0_GSUC0_GSUWGMRR0_K1_LBSPPA256_LBSPPB2048_LPB32_MIWT8_8_PLR1_SU32_SUM0_SUS256_SKXCCM4_VWA4_VWB2_WGM4_WGMXCC1_WGMXCCGn1
    SolutionIndex: 44
    SolutionNameMin: Cijk_Alik_Bjlk_BSS_BH_UserArgs_MT256x256x32_MI16x16x1_SN_LDSB1_CLR1_GSU0_GSUC0_GSUWGMRR0_K1_LBSPPA256_LBSPPB2048_LPB0_MIWT8_8_PLR1_SU32_SUM0_SUS256_SKXCCM4_VWA4_VWB4_WGM4_WGMXCC1_WGMXCCGn1
    SolutionIndex: 45
    SolutionNameMin: Cijk_Alik_Bjlk_BSS_BH_UserArgs_MT256x256x32_MI16x16x1_SN_LDSB1_CLR1_GSU0_GSUC0_GSUWGMRR0_K1_LBSPPA256_LBSPPB2048_LPB0_MIWT8_8_PLR1_SU32_SUM0_SUS256_SKXCCM4_VWA4_VWB8_WGM4_WGMXCC1_WGMXCCGn1
    SolutionIndex: 46
    SolutionNameMin: Cijk_Alik_Bjlk_BSS_BH_UserArgs_MT128x256x32_MI16x16x1_SN_LDSB1_CLR1_GSU0_GSUC0_GSUWGMRR0_K1_LBSPPA256_LBSPPB2048_LPB32_MIWT4_8_PLR1_SU32_SUM0_SUS256_SKXCCM4_VWA4_VWB2_WGM1_WGMXCC1_WGMXCCGn1
    SolutionIndex: 47
    SolutionNameMin: Cijk_Alik_Bjlk_BSS_BH_UserArgs_MT128x256x32_MI16x16x1_SN_LDSB1_CLR1_GSU0_GSUC0_GSUWGMRR0_K1_LBSPPA256_LBSPPB2048_LPB0_MIWT4_8_PLR1_SU32_SUM0_SUS256_SKXCCM4_VWA4_VWB4_WGM1_WGMXCC1_WGMXCCGn1
    SolutionIndex: 48
    SolutionNameMin: Cijk_Alik_Bjlk_BSS_BH_UserArgs_MT128x256x32_MI16x16x1_SN_LDSB1_CLR1_GSU0_GSUC0_GSUWGMRR0_K1_LBSPPA128_LBSPPB2048_LPB0_MIWT4_8_PLR1_SU32_SUM0_SUS256_SKXCCM4_VWA1_VWB8_WGM1_WGMXCC1_WGMXCCGn1
    SolutionIndex: 49
    SolutionNameMin: Cijk_Alik_Bjlk_BSS_BH_UserArgs_MT128x256x32_MI16x16x1_SN_LDSB1_CLR1_GSU0_GSUC0_GSUWGMRR0_K1_LBSPPA256_LBSPPB2048_LPB0_MIWT4_8_PLR1_SU32_SUM0_SUS256_SKXCCM4_VWA4_VWB8_WGM1_WGMXCC1_WGMXCCGn1
    SolutionIndex: 50
    SolutionNameMin: Cijk_Alik_Bjlk_BSS_BH_UserArgs_MT128x256x32_MI16x16x1_SN_LDSB1_CLR1_GSU0_GSUC0_GSUWGMRR0_K1_LBSPPA256_LBSPPB2048_LPB32_MIWT4_8_PLR1_SU32_SUM0_SUS256_SKXCCM4_VWA4_VWB2_WGM2_WGMXCC1_WGMXCCGn1
    SolutionIndex: 51
    SolutionNameMin: Cijk_Alik_Bjlk_BSS_BH_UserArgs_MT128x256x32_MI16x16x1_SN_LDSB1_CLR1_GSU0_GSUC0_GSUWGMRR0_K1_LBSPPA256_LBSPPB2048_LPB0_MIWT4_8_PLR1_SU32_SUM0_SUS256_SKXCCM4_VWA4_VWB4_WGM2_WGMXCC1_WGMXCCGn1
    SolutionIndex: 52
    SolutionNameMin: Cijk_Alik_Bjlk_BSS_BH_UserArgs_MT128x256x32_MI16x16x1_SN_LDSB1_CLR1_GSU0_GSUC0_GSUWGMRR0_K1_LBSPPA256_LBSPPB2048_LPB0_MIWT4_8_PLR1_SU32_SUM0_SUS256_SKXCCM4_VWA4_VWB8_WGM2_WGMXCC1_WGMXCCGn1
    SolutionIndex: 53
    SolutionNameMin: Cijk_Alik_Bjlk_BSS_BH_UserArgs_MT128x256x32_MI16x16x1_SN_LDSB1_CLR1_GSU0_GSUC0_GSUWGMRR0_K1_LBSPPA256_LBSPPB2048_LPB0_MIWT4_8_PLR1_SU32_SUM0_SUS256_SKXCCM4_VWA4_VWB4_WGM4_WGMXCC1_WGMXCCGn1
    SolutionIndex: 54
    SolutionNameMin: Cijk_Alik_Bjlk_BSS_BH_UserArgs_MT128x256x32_MI16x16x1_SN_LDSB1_CLR1_GSU0_GSUC0_GSUWGMRR0_K1_LBSPPA256_LBSPPB2048_LPB0_MIWT4_8_PLR1_SU32_SUM0_SUS256_SKXCCM4_VWA4_VWB8_WGM4_WGMXCC1_WGMXCCGn1
    SolutionIndex: 55
    SolutionNameMin: Cijk_Alik_Bjlk_BSS_BH_UserArgs_MT256x128x32_MI16x16x1_SN_LDSB1_CLR1_GSU0_GSUC0_GSUWGMRR0_K1_LBSPPA256_LBSPPB1024_LPB32_MIWT8_4_PLR1_SU32_SUM0_SUS256_SKXCCM4_VWA4_VWB2_WGM1_WGMXCC1_WGMXCCGn1
    SolutionIndex: 56
    SolutionNameMin: Cijk_Alik_Bjlk_BSS_BH_UserArgs_MT256x128x32_MI16x16x1_SN_LDSB1_CLR1_GSU0_GSUC0_GSUWGMRR0_K1_LBSPPA256_LBSPPB1024_LPB0_MIWT8_4_PLR1_SU32_SUM0_SUS256_SKXCCM4_VWA4_VWB4_WGM1_WGMXCC1_WGMXCCGn1
    SolutionIndex: 57
    SolutionNameMin: Cijk_Alik_Bjlk_BSS_BH_UserArgs_MT256x128x32_MI16x16x1_SN_LDSB1_CLR1_GSU0_GSUC0_GSUWGMRR0_K1_LBSPPA256_LBSPPB1024_LPB32_MIWT8_4_PLR1_SU32_SUM0_SUS256_SKXCCM4_VWA4_VWB2_WGM2_WGMXCC1_WGMXCCGn1
    SolutionIndex: 58
    SolutionNameMin: Cijk_Alik_Bjlk_BSS_BH_UserArgs_MT256x128x32_MI16x16x1_SN_LDSB1_CLR1_GSU0_GSUC0_GSUWGMRR0_K1_LBSPPA256_LBSPPB1024_LPB0_MIWT8_4_PLR1_SU32_SUM0_SUS256_SKXCCM4_VWA4_VWB4_WGM4_WGMXCC1_WGMXCCGn1
    SolutionIndex: 59
    SolutionNameMin: Cijk_Alik_Bjlk_BSS_BH_UserArgs_MT128x128x32_MI16x16x1_SN_LDSB1_CLR1_GSU0_GSUC0_GSUWGMRR0_K1_LBSPPA256_LBSPPB1024_LPB32_MIWT4_4_PLR1_SU32_SUM0_SUS256_SKXCCM4_VWA4_VWB2_WGM1_WGMXCC1_WGMXCCGn1
    SolutionIndex: 60
    SolutionNameMin: Cijk_Alik_Bjlk_BSS_BH_UserArgs_MT128x128x32_MI16x16x1_SN_LDSB1_CLR1_GSU0_GSUC0_GSUWGMRR0_K1_LBSPPA256_LBSPPB1024_LPB0_MIWT4_4_PLR1_SU32_SUM0_SUS256_SKXCCM4_VWA4_VWB4_WGM1_WGMXCC1_WGMXCCGn1
    SolutionIndex: 61
    SolutionNameMin: Cijk_Alik_Bjlk_BSS_BH_UserArgs_MT128x64x32_MI16x16x1_SN_LDSB0_CLR1_GSU0_GSUC0_GSUWGMRR0_K1_LBSPPA256_LBSPPB512_LPB32_MIWT4_2_PLR1_SU32_SUM0_SUS256_SKXCCM4_VWA4_VWB2_WGM1_WGMXCC1_WGMXCCGn1
    SolutionIndex: 62
    SolutionNameMin: Cijk_Alik_Bjlk_BSS_BH_UserArgs_MT32x32x32_MI16x16x1_SN_LDSB0_CLR1_GSU0_GSUC0_GSUWGMRR0_K1_LBSPPA128_LBSPPB256_LPB16_MIWT1_1_PLR1_SU32_SUM0_SUS256_SKXCCM4_VWA1_VWB1_WGM1_WGMXCC1_WGMXCCGn1
    SolutionIndex: 63
    SolutionNameMin: Cijk_Alik_Bjlk_BSS_BH_UserArgs_MT128x256x64_MI16x16x1_SN_LDSB1_CLR1_GSU0_GSUC0_GSUWGMRR0_K1_LBSPPA512_LBSPPB4096_LPB0_MIWT4_8_PLR1_SU32_SUM0_SUS256_SKXCCM4_VWA4_VWB4_WGM1_WGMXCC1_WGMXCCGn1
    SolutionIndex: 64
    SolutionNameMin: Cijk_Alik_Bjlk_BSS_BH_UserArgs_MT256x128x64_MI16x16x1_SN_LDSB1_CLR1_GSU0_GSUC0_GSUWGMRR0_K1_LBSPPA512_LBSPPB2048_LPB0_MIWT8_4_PLR1_SU32_SUM0_SUS256_SKXCCM4_VWA4_VWB4_WGM1_WGMXCC1_WGMXCCGn1
    SolutionIndex: 65
    SolutionNameMin: Cijk_Alik_Bjlk_BSS_BH_UserArgs_MT256x128x64_MI16x16x1_SN_LDSB1_CLR1_GSU0_GSUC0_GSUWGMRR0_K1_LBSPPA512_LBSPPB2048_LPB0_MIWT8_4_PLR1_SU32_SUM0_SUS256_SKXCCM4_VWA4_VWB4_WGM2_WGMXCC1_WGMXCCGn1
    SolutionIndex: 66
    SolutionNameMin: Cijk_Alik_Bjlk_BSS_BH_UserArgs_MT256x128x64_MI16x16x1_SN_LDSB1_CLR1_GSU0_GSUC0_GSUWGMRR0_K1_LBSPPA512_LBSPPB2048_LPB0_MIWT8_4_PLR1_SU32_SUM0_SUS256_SKXCCM4_VWA4_VWB4_WGM4_WGMXCC1_WGMXCCGn1
    SolutionIndex: 67
    SolutionNameMin: Cijk_Alik_Bjlk_BSS_BH_UserArgs_MT128x128x64_MI16x16x1_SN_LDSB1_CLR1_GSU0_GSUC0_GSUWGMRR0_K1_LBSPPA512_LBSPPB2048_LPB32_MIWT4_4_PLR1_SU32_SUM0_SUS256_SKXCCM4_VWA4_VWB2_WGM1_WGMXCC1_WGMXCCGn1
    SolutionIndex: 68
    SolutionNameMin: Cijk_Alik_Bjlk_BSS_BH_UserArgs_MT128x128x64_MI16x16x1_SN_LDSB1_CLR1_GSU0_GSUC0_GSUWGMRR0_K1_LBSPPA128_LBSPPB2048_LPB0_MIWT4_4_PLR1_SU32_SUM0_SUS256_SKXCCM4_VWA1_VWB4_WGM1_WGMXCC1_WGMXCCGn1
    SolutionIndex: 69
    SolutionNameMin: Cijk_Alik_Bjlk_BSS_BH_UserArgs_MT128x128x64_MI16x16x1_SN_LDSB1_CLR1_GSU0_GSUC0_GSUWGMRR0_K1_LBSPPA512_LBSPPB2048_LPB0_MIWT4_4_PLR1_SU32_SUM0_SUS256_SKXCCM4_VWA4_VWB4_WGM1_WGMXCC1_WGMXCCGn1
    SolutionIndex: 70
    SolutionNameMin: Cijk_Alik_Bjlk_BSS_BH_UserArgs_MT128x128x64_MI16x16x1_SN_LDSB1_CLR1_GSU0_GSUC0_GSUWGMRR0_K1_LBSPPA128_LBSPPB2048_LPB0_MIWT4_4_PLR1_SU32_SUM0_SUS256_SKXCCM4_VWA1_VWB4_WGM2_WGMXCC1_WGMXCCGn1
    SolutionIndex: 71
    SolutionNameMin: Cijk_Alik_Bjlk_BSS_BH_UserArgs_MT128x128x64_MI16x16x1_SN_LDSB1_CLR1_GSU0_GSUC0_GSUWGMRR0_K1_LBSPPA512_LBSPPB2048_LPB0_MIWT4_4_PLR1_SU32_SUM0_SUS256_SKXCCM4_VWA4_VWB4_WGM2_WGMXCC1_WGMXCCGn1
    SolutionIndex: 72
    SolutionNameMin: Cijk_Alik_Bjlk_BSS_BH_UserArgs_MT128x128x64_MI16x16x1_SN_LDSB1_CLR1_GSU0_GSUC0_GSUWGMRR0_K1_LBSPPA128_LBSPPB2048_LPB0_MIWT4_4_PLR1_SU32_SUM0_SUS256_SKXCCM4_VWA1_VWB4_WGM4_WGMXCC1_WGMXCCGn1
    SolutionIndex: 73
    SolutionNameMin: Cijk_Alik_Bjlk_BSS_BH_UserArgs_MT128x128x64_MI16x16x1_SN_LDSB1_CLR1_GSU0_GSUC0_GSUWGMRR0_K1_LBSPPA512_LBSPPB2048_LPB0_MIWT4_4_PLR1_SU32_SUM0_SUS256_SKXCCM4_VWA4_VWB4_WGM4_WGMXCC1_WGMXCCGn1
    SolutionIndex: 74
    SolutionNameMin: Cijk_Alik_Bjlk_BSS_BH_UserArgs_MT64x128x64_MI16x16x1_SN_LDSB1_CLR1_GSU0_GSUC0_GSUWGMRR0_K1_LBSPPA128_LBSPPB2048_LPB0_MIWT2_4_PLR1_SU32_SUM0_SUS256_SKXCCM4_VWA1_VWB4_WGM1_WGMXCC1_WGMXCCGn1
    SolutionIndex: 75
    SolutionNameMin: Cijk_Alik_Bjlk_BSS_BH_UserArgs_MT128x64x64_MI16x16x1_SN_LDSB1_CLR1_GSU0_GSUC0_GSUWGMRR0_K1_LBSPPA512_LBSPPB1024_LPB32_MIWT4_2_PLR1_SU32_SUM0_SUS256_SKXCCM4_VWA4_VWB2_WGM1_WGMXCC1_WGMXCCGn1
    SolutionIndex: 76
    SolutionNameMin: Cijk_Alik_Bjlk_BSS_BH_UserArgs_MT64x64x64_MI16x16x1_SN_LDSB1_CLR1_GSU0_GSUC0_GSUWGMRR0_K1_LBSPPA128_LBSPPB1024_LPB32_MIWT2_2_PLR1_SU32_SUM0_SUS256_SKXCCM4_VWA1_VWB2_WGM1_WGMXCC1_WGMXCCGn1
    SolutionIndex: 77
    SolutionNameMin: Cijk_Alik_Bjlk_BSS_BH_UserArgs_MT32x64x64_MI16x16x1_SN_LDSB0_CLR1_GSU0_GSUC0_GSUWGMRR0_K1_LBSPPA128_LBSPPB1024_LPB32_MIWT1_2_PLR1_SU32_SUM0_SUS256_SKXCCM4_VWA1_VWB2_WGM1_WGMXCC1_WGMXCCGn1
    SolutionIndex: 78
    SolutionNameMin: Cijk_Alik_Bjlk_BSS_BH_UserArgs_MT64x32x64_MI16x16x1_SN_LDSB0_CLR1_GSU0_GSUC0_GSUWGMRR0_K1_LBSPPA128_LBSPPB512_LPB16_MIWT2_1_PLR1_SU32_SUM0_SUS256_SKXCCM4_VWA1_VWB1_WGM1_WGMXCC1_WGMXCCGn1
    SolutionIndex: 79
    SolutionNameMin: Cijk_Alik_Bjlk_BSS_BH_UserArgs_MT32x32x64_MI16x16x1_SN_LDSB0_CLR1_GSU0_GSUC0_GSUWGMRR0_K1_LBSPPA128_LBSPPB512_LPB16_MIWT1_1_PLR1_SU32_SUM0_SUS256_SKXCCM4_VWA1_VWB1_WGM1_WGMXCC1_WGMXCCGn1
    SolutionIndex: 80
    SolutionNameMin: Cijk_Alik_Bjlk_BSS_BH_UserArgs_MT128x64x128_MI16x16x1_SN_LDSB1_CLR1_GSU0_GSUC0_GSUWGMRR0_K1_LBSPPA1024_LBSPPB1024_LPB32_MIWT4_2_PLR2_SU32_SUM0_SUS256_SKXCCM4_VWA4_VWB2_WGM1_WGMXCC1_WGMXCCGn1
    SolutionIndex: 81
    SolutionNameMin: Cijk_Alik_Bjlk_BSS_BH_UserArgs_MT128x64x128_MI16x16x1_SN_LDSB1_CLR1_GSU0_GSUC0_GSUWGMRR0_K1_LBSPPA1024_LBSPPB1024_LPB32_MIWT4_2_PLR2_SU32_SUM0_SUS256_SKXCCM4_VWA4_VWB2_WGM2_WGMXCC1_WGMXCCGn1
    SolutionIndex: 82
    SolutionNameMin: Cijk_Alik_Bjlk_BSS_BH_UserArgs_MT128x64x128_MI16x16x1_SN_LDSB1_CLR1_GSU0_GSUC0_GSUWGMRR0_K1_LBSPPA1024_LBSPPB1024_LPB32_MIWT4_2_PLR2_SU32_SUM0_SUS256_SKXCCM4_VWA4_VWB2_WGM4_WGMXCC1_WGMXCCGn1
    SolutionIndex: 83
    SolutionNameMin: Cijk_Alik_Bjlk_BSS_BH_UserArgs_MT64x64x128_MI16x16x1_SN_LDSB1_CLR1_GSU0_GSUC0_GSUWGMRR0_K1_LBSPPA256_LBSPPB1024_LPB32_MIWT2_2_PLR2_SU32_SUM0_SUS256_SKXCCM4_VWA1_VWB2_WGM1_WGMXCC1_WGMXCCGn1
    SolutionIndex: 84
    SolutionNameMin: Cijk_Alik_Bjlk_BSS_BH_UserArgs_MT64x64x128_MI16x16x1_SN_LDSB1_CLR1_GSU0_GSUC0_GSUWGMRR0_K1_LBSPPA512_LBSPPB1024_LPB32_MIWT2_2_PLR2_SU32_SUM0_SUS256_SKXCCM4_VWA2_VWB2_WGM1_WGMXCC1_WGMXCCGn1
    SolutionIndex: 85
    SolutionNameMin: Cijk_Alik_Bjlk_BSS_BH_UserArgs_MT64x64x128_MI16x16x1_SN_LDSB1_CLR1_GSU0_GSUC0_GSUWGMRR0_K1_LBSPPA256_LBSPPB1024_LPB32_MIWT2_2_PLR2_SU32_SUM0_SUS256_SKXCCM4_VWA1_VWB2_WGM2_WGMXCC1_WGMXCCGn1
    SolutionIndex: 86
    SolutionNameMin: Cijk_Alik_Bjlk_BSS_BH_UserArgs_MT32x64x128_MI16x16x1_SN_LDSB1_CLR1_GSU0_GSUC0_GSUWGMRR0_K1_LBSPPA256_LBSPPB1024_LPB32_MIWT1_2_PLR2_SU32_SUM0_SUS256_SKXCCM4_VWA1_VWB2_WGM1_WGMXCC1_WGMXCCGn1
    SolutionIndex: 87
    SolutionNameMin: Cijk_Alik_Bjlk_BSS_BH_UserArgs_MT32x64x128_MI16x16x1_SN_LDSB1_CLR1_GSU0_GSUC0_GSUWGMRR0_K1_LBSPPA256_LBSPPB1024_LPB32_MIWT1_2_PLR2_SU32_SUM0_SUS256_SKXCCM4_VWA1_VWB2_WGM2_WGMXCC1_WGMXCCGn1
    SolutionIndex: 88
    SolutionNameMin: Cijk_Alik_Bjlk_BSS_BH_UserArgs_MT32x32x128_MI16x16x1_SN_LDSB1_CLR1_GSU0_GSUC0_GSUWGMRR0_K1_LBSPPA256_LBSPPB512_LPB16_MIWT1_1_PLR1_SU32_SUM0_SUS256_SKXCCM4_VWA1_VWB1_WGM1_WGMXCC1_WGMXCCGn1
    SolutionIndex: 89
    SolutionNameMin: Cijk_Alik_Bjlk_BSS_BH_UserArgs_MT32x32x128_MI16x16x1_SN_LDSB1_CLR1_GSU0_GSUC0_GSUWGMRR0_K1_LBSPPA256_LBSPPB512_LPB16_MIWT1_1_PLR2_SU32_SUM0_SUS256_SKXCCM4_VWA1_VWB1_WGM1_WGMXCC1_WGMXCCGn1
    SolutionIndex: 90
    SolutionNameMin: Cijk_Alik_Bjlk_BSS_BH_UserArgs_MT32x32x32_MI16x16x1_SN_LDSB0_CLR1_GSU0_GSUC0_GSUWGMRR0_K1_LBSPPA128_LBSPPB256_LPB16_MIWT1_1_PLR1_SU32_SUM0_SUS256_SKXCCM0_VWA1_VWB1_WGM1_WGMXCC1_WGMXCCGn1
- - - [128, 128, 1, 128, 128, 128, 128, 128]
    - [25, 0.088]
  - - [128, 128, 1, 256, 128, 128, 256, 128]
    - [79, 0.158]
  - - [128, 128, 1, 512, 128, 128, 512, 128]
    - [89, 0.263]
  - - [128, 128, 1, 1024, 128, 128, 1024, 128]
    - [89, 0.395]
  - - [128, 128, 1, 2048, 128, 128, 2048, 128]
    - [62, 0.585]
  - - [128, 128, 1, 4096, 128, 128, 4096, 128]
    - [79, 1.026]
  - - [128, 128, 1, 8192, 128, 128, 8192, 128]
    - [35, 1.554]
  - - [128, 256, 1, 128, 128, 128, 128, 256]
    - [79, 0.172]
  - - [128, 256, 1, 256, 128, 128, 256, 256]
    - [79, 0.313]
  - - [128, 256, 1, 512, 128, 128, 512, 256]
    - [79, 0.518]
  - - [128, 256, 1, 1024, 128, 128, 1024, 256]
    - [35, 0.786]
  - - [128, 256, 1, 2048, 128, 128, 2048, 256]
    - [88, 1.144]
  - - [128, 256, 1, 4096, 128, 128, 4096, 256]
    - [78, 1.728]
  - - [128, 256, 1, 8192, 128, 128, 8192, 256]
    - [86, 2.671]
  - - [128, 512, 1, 128, 128, 128, 128, 512]
    - [25, 0.339]
  - - [128, 512, 1, 256, 128, 128, 256, 512]
    - [25, 0.616]
  - - [128, 512, 1, 512, 128, 128, 512, 512]
    - [88, 1.024]
  - - [128, 512, 1, 1024, 128, 128, 1024, 512]
    - [34, 1.545]
  - - [128, 512, 1, 2048, 128, 128, 2048, 512]
    - [34, 2.081]
  - - [128, 512, 1, 4096, 128, 128, 4096, 512]
    - [32, 2.955]
  - - [128, 512, 1, 8192, 128, 128, 8192, 512]
    - [83, 4.457]
  - - [128, 1024, 1, 128, 128, 128, 128, 1024]
    - [24, 0.626]
  - - [128, 1024, 1, 256, 128, 128, 256, 1024]
    - [23, 1.115]
  - - [128, 1024, 1, 512, 128, 128, 512, 1024]
    - [32, 1.844]
  - - [128, 1024, 1, 1024, 128, 128, 1024, 1024]
    - [86, 2.74]
  - - [128, 1024, 1, 2048, 128, 128, 2048, 1024]
    - [33, 3.585]
  - - [128, 1024, 1, 4096, 128, 128, 4096, 1024]
    - [31, 4.918]
  - - [128, 1024, 1, 8192, 128, 128, 8192, 1024]
    - [80, 7.02]
  - - [128, 2048, 1, 128, 128, 128, 128, 2048]
    - [76, 1.106]
  - - [128, 2048, 1, 256, 128, 128, 256, 2048]
    - [76, 1.927]
  - - [128, 2048, 1, 512, 128, 128, 512, 2048]
    - [83, 3.119]
  - - [128, 2048, 1, 1024, 128, 128, 1024, 2048]
    - [83, 4.529]
  - - [128, 2048, 1, 2048, 128, 128, 2048, 2048]
    - [83, 5.695]
  - - [128, 2048, 1, 4096, 128, 128, 4096, 2048]
    - [80, 7.347]
  - - [128, 2048, 1, 8192, 128, 128, 8192, 2048]
    - [69, 9.833]
  - - [128, 4096, 1, 128, 128, 128, 128, 4096]
    - [75, 1.828]
  - - [128, 4096, 1, 256, 128, 128, 256, 4096]
    - [75, 3.095]
  - - [128, 4096, 1, 512, 128, 128, 512, 4096]
    - [80, 4.851]
  - - [128, 4096, 1, 1024, 128, 128, 1024, 4096]
    - [80, 6.979]
  - - [128, 4096, 1, 2048, 128, 128, 2048, 4096]
    - [80, 8.72]
  - - [128, 4096, 1, 4096, 128, 128, 4096, 4096]
    - [20, 10.785]
  - - [128, 4096, 1, 8192, 128, 128, 8192, 4096]
    - [20, 13.562]
  - - [128, 8192, 1, 128, 128, 128, 128, 8192]
    - [60, 2.722]
  - - [128, 8192, 1, 256, 128, 128, 256, 8192]
    - [69, 4.598]
  - - [128, 8192, 1, 512, 128, 128, 512, 8192]
    - [72, 6.972]
  - - [128, 8192, 1, 1024, 128, 128, 1024, 8192]
    - [68, 9.54]
  - - [128, 8192, 1, 2048, 128, 128, 2048, 8192]
    - [20, 11.186]
  - - [128, 8192, 1, 4096, 128, 128, 4096, 8192]
    - [69, 13.949]
  - - [128, 8192, 1, 8192, 128, 128, 8192, 8192]
    - [20, 15.212]
  - - [256, 128, 1, 128, 256, 256, 128, 128]
    - [79, 0.175]
  - - [256, 128, 1, 256, 256, 256, 256, 128]
    - [79, 0.314]
  - - [256, 128, 1, 512, 256, 256, 512, 128]
    - [79, 0.524]
  - - [256, 128, 1, 1024, 256, 256, 1024, 128]
    - [35, 0.782]
  - - [256, 128, 1, 2048, 256, 256, 2048, 128]
    - [34, 1.14]
  - - [256, 128, 1, 4096, 256, 256, 4096, 128]
    - [77, 1.748]
  - - [256, 128, 1, 8192, 256, 256, 8192, 128]
    - [86, 2.731]
  - - [256, 256, 1, 128, 256, 256, 128, 256]
    - [62, 0.336]
  - - [256, 256, 1, 256, 256, 256, 256, 256]
    - [25, 0.614]
  - - [256, 256, 1, 512, 256, 256, 512, 256]
    - [35, 1.027]
  - - [256, 256, 1, 1024, 256, 256, 1024, 256]
    - [89, 1.538]
  - - [256, 256, 1, 2048, 256, 256, 2048, 256]
    - [35, 2.079]
  - - [256, 256, 1, 4096, 256, 256, 4096, 256]
    - [87, 2.932]
  - - [256, 256, 1, 8192, 256, 256, 8192, 256]
    - [83, 4.512]
  - - [256, 512, 1, 128, 256, 256, 128, 512]
    - [23, 0.636]
  - - [256, 512, 1, 256, 256, 256, 256, 512]
    - [86, 1.108]
  - - [256, 512, 1, 512, 256, 256, 512, 512]
    - [86, 1.855]
  - - [256, 512, 1, 1024, 256, 256, 1024, 512]
    - [32, 2.729]
  - - [256, 512, 1, 2048, 256, 256, 2048, 512]
    - [86, 3.625]
  - - [256, 512, 1, 4096, 256, 256, 4096, 512]
    - [30, 4.943]
  - - [256, 512, 1, 8192, 256, 256, 8192, 512]
    - [27, 7.151]
  - - [256, 1024, 1, 128, 256, 256, 128, 1024]
    - [76, 1.126]
  - - [256, 1024, 1, 256, 256, 256, 256, 1024]
    - [76, 1.947]
  - - [256, 1024, 1, 512, 256, 256, 512, 1024]
    - [84, 3.138]
  - - [256, 1024, 1, 1024, 256, 256, 1024, 1024]
    - [83, 4.543]
  - - [256, 1024, 1, 2048, 256, 256, 2048, 1024]
    - [31, 5.76]
  - - [256, 1024, 1, 4096, 256, 256, 4096, 1024]
    - [28, 7.701]
  - - [256, 1024, 1, 8192, 256, 256, 8192, 1024]
    - [21, 9.848]
  - - [256, 2048, 1, 128, 256, 256, 128, 2048]
    - [74, 1.803]
  - - [256, 2048, 1, 256, 256, 256, 256, 2048]
    - [74, 3.076]
  - - [256, 2048, 1, 512, 256, 256, 512, 2048]
    - [82, 4.797]
  - - [256, 2048, 1, 1024, 256, 256, 1024, 2048]
    - [80, 6.928]
  - - [256, 2048, 1, 2048, 256, 256, 2048, 2048]
    - [82, 8.704]
  - - [256, 2048, 1, 4096, 256, 256, 4096, 2048]
    - [71, 10.537]
  - - [256, 2048, 1, 8192, 256, 256, 8192, 2048]
    - [69, 13.432]
  - - [256, 4096, 1, 128, 256, 256, 128, 4096]
    - [60, 2.771]
  - - [256, 4096, 1, 256, 256, 256, 256, 4096]
    - [68, 4.597]
  - - [256, 4096, 1, 512, 256, 256, 512, 4096]
    - [69, 7.173]
  - - [256, 4096, 1, 1024, 256, 256, 1024, 4096]
    - [71, 9.554]
  - - [256, 4096, 1, 2048, 256, 256, 2048, 4096]
    - [69, 11.14]
  - - [256, 4096, 1, 4096, 256, 256, 4096, 4096]
    - [22, 13.716]
  - - [256, 4096, 1, 8192, 256, 256, 8192, 4096]
    - [71, 15.555]
  - - [256, 8192, 1, 128, 256, 256, 128, 8192]
    - [52, 3.654]
  - - [256, 8192, 1, 256, 256, 256, 256, 8192]
    - [48, 5.899]
  - - [256, 8192, 1, 512, 256, 256, 512, 8192]
    - [8, 8.546]
  - - [256, 8192, 1, 1024, 256, 256, 1024, 8192]
    - [15, 10.831]
  - - [256, 8192, 1, 2048, 256, 256, 2048, 8192]
    - [20, 13.243]
  - - [256, 8192, 1, 4096, 256, 256, 4096, 8192]
    - [18, 15.392]
  - - [256, 8192, 1, 8192, 256, 256, 8192, 8192]
    - [66, 17.076]
  - - [512, 128, 1, 128, 512, 512, 128, 128]
    - [79, 0.341]
  - - [512, 128, 1, 256, 512, 512, 256, 128]
    - [88, 0.61]
  - - [512, 128, 1, 512, 512, 512, 512, 128]
    - [79, 1.029]
  - - [512, 128, 1, 1024, 512, 512, 1024, 128]
    - [34, 1.549]
  - - [512, 128, 1, 2048, 512, 512, 2048, 128]
    - [35, 2.075]
  - - [512, 128, 1, 4096, 512, 512, 4096, 128]
    - [32, 2.959]
  - - [512, 128, 1, 8192, 512, 512, 8192, 128]
    - [85, 4.513]
  - - [512, 256, 1, 128, 512, 512, 128, 256]
    - [23, 0.629]
  - - [512, 256, 1, 256, 512, 512, 256, 256]
    - [78, 1.105]
  - - [512, 256, 1, 512, 512, 512, 512, 256]
    - [86, 1.839]
  - - [512, 256, 1, 1024, 512, 512, 1024, 256]
    - [32, 2.761]
  - - [512, 256, 1, 2048, 512, 512, 2048, 256]
    - [32, 3.62]
  - - [512, 256, 1, 4096, 512, 512, 4096, 256]
    - [30, 4.959]
  - - [512, 256, 1, 8192, 512, 512, 8192, 256]
    - [27, 7.165]
  - - [512, 512, 1, 128, 512, 512, 128, 512]
    - [76, 1.116]
  - - [512, 512, 1, 256, 512, 512, 256, 512]
    - [76, 1.929]
  - - [512, 512, 1, 512, 512, 512, 512, 512]
    - [84, 3.141]
  - - [512, 512, 1, 1024, 512, 512, 1024, 512]
    - [84, 4.592]
  - - [512, 512, 1, 2048, 512, 512, 2048, 512]
    - [31, 5.907]
  - - [512, 512, 1, 4096, 512, 512, 4096, 512]
    - [29, 7.695]
  - - [512, 512, 1, 8192, 512, 512, 8192, 512]
    - [21, 9.749]
  - - [512, 1024, 1, 128, 512, 512, 128, 1024]
    - [75, 1.837]
  - - [512, 1024, 1, 256, 512, 512, 256, 1024]
    - [75, 3.146]
  - - [512, 1024, 1, 512, 512, 512, 512, 1024]
    - [80, 4.901]
  - - [512, 1024, 1, 1024, 512, 512, 1024, 1024]
    - [80, 7.009]
  - - [512, 1024, 1, 2048, 512, 512, 2048, 1024]
    - [29, 8.676]
  - - [512, 1024, 1, 4096, 512, 512, 4096, 1024]
    - [71, 10.443]
  - - [512, 1024, 1, 8192, 512, 512, 8192, 1024]
    - [69, 13.479]
  - - [512, 2048, 1, 128, 512, 512, 128, 2048]
    - [60, 2.751]
  - - [512, 2048, 1, 256, 512, 512, 256, 2048]
    - [69, 4.666]
  - - [512, 2048, 1, 512, 512, 512, 512, 2048]
    - [69, 7.18]
  - - [512, 2048, 1, 1024, 512, 512, 1024, 2048]
    - [69, 9.593]
  - - [512, 2048, 1, 2048, 512, 512, 2048, 2048]
    - [73, 10.976]
  - - [512, 2048, 1, 4096, 512, 512, 4096, 2048]
    - [71, 13.354]
  - - [512, 2048, 1, 8192, 512, 512, 8192, 2048]
    - [20, 15.323]
  - - [512, 4096, 1, 128, 512, 512, 128, 4096]
    - [56, 3.715]
  - - [512, 4096, 1, 256, 512, 512, 256, 4096]
    - [10, 5.912]
  - - [512, 4096, 1, 512, 512, 512, 512, 4096]
    - [47, 8.584]
  - - [512, 4096, 1, 1024, 512, 512, 1024, 4096]
    - [15, 11.022]
  - - [512, 4096, 1, 2048, 512, 512, 2048, 4096]
    - [73, 12.991]
  - - [512, 4096, 1, 4096, 512, 512, 4096, 4096]
    - [64, 15.251]
  - - [512, 4096, 1, 8192, 512, 512, 8192, 4096]
    - [65, 16.919]
  - - [512, 8192, 1, 128, 512, 512, 128, 8192]
    - [39, 4.325]
  - - [512, 8192, 1, 256, 512, 512, 256, 8192]
    - [39, 6.84]
  - - [512, 8192, 1, 512, 512, 512, 512, 8192]
    - [39, 9.883]
  - - [512, 8192, 1, 1024, 512, 512, 1024, 8192]
    - [53, 12.28]
  - - [512, 8192, 1, 2048, 512, 512, 2048, 8192]
    - [44, 14.74]
  - - [512, 8192, 1, 4096, 512, 512, 4096, 8192]
    - [45, 16.935]
  - - [512, 8192, 1, 8192, 512, 512, 8192, 8192]
    - [44, 18.88]
  - - [1024, 128, 1, 128, 1024, 1024, 128, 128]
    - [23, 0.634]
  - - [1024, 128, 1, 256, 1024, 1024, 256, 128]
    - [23, 1.118]
  - - [1024, 128, 1, 512, 1024, 1024, 512, 128]
    - [32, 1.846]
  - - [1024, 128, 1, 1024, 1024, 1024, 1024, 128]
    - [86, 2.719]
  - - [1024, 128, 1, 2048, 1024, 1024, 2048, 128]
    - [32, 3.628]
  - - [1024, 128, 1, 4096, 1024, 1024, 4096, 128]
    - [30, 4.977]
  - - [1024, 128, 1, 8192, 1024, 1024, 8192, 128]
    - [81, 6.914]
  - - [1024, 256, 1, 128, 1024, 1024, 128, 256]
    - [76, 1.135]
  - - [1024, 256, 1, 256, 1024, 1024, 256, 256]
    - [76, 1.95]
  - - [1024, 256, 1, 512, 1024, 1024, 512, 256]
    - [83, 3.168]
  - - [1024, 256, 1, 1024, 1024, 1024, 1024, 256]
    - [84, 4.59]
  - - [1024, 256, 1, 2048, 1024, 1024, 2048, 256]
    - [30, 5.91]
  - - [1024, 256, 1, 4096, 1024, 1024, 4096, 256]
    - [82, 7.394]
  - - [1024, 256, 1, 8192, 1024, 1024, 8192, 256]
    - [22, 9.786]
  - - [1024, 512, 1, 128, 1024, 1024, 128, 512]
    - [75, 1.833]
  - - [1024, 512, 1, 256, 1024, 1024, 256, 512]
    - [74, 3.129]
  - - [1024, 512, 1, 512, 1024, 1024, 512, 512]
    - [80, 4.899]
  - - [1024, 512, 1, 1024, 1024, 1024, 1024, 512]
    - [80, 6.956]
  - - [1024, 512, 1, 2048, 1024, 1024, 2048, 512]
    - [26, 8.629]
  - - [1024, 512, 1, 4096, 1024, 1024, 4096, 512]
    - [69, 10.306]
  - - [1024, 512, 1, 8192, 1024, 1024, 8192, 512]
    - [22, 13.176]
  - - [1024, 1024, 1, 128, 1024, 1024, 128, 1024]
    - [60, 2.766]
  - - [1024, 1024, 1, 256, 1024, 1024, 256, 1024]
    - [68, 4.621]
  - - [1024, 1024, 1, 512, 1024, 1024, 512, 1024]
    - [69, 7.209]
  - - [1024, 1024, 1, 1024, 1024, 1024, 1024, 1024]
    - [73, 9.617]
  - - [1024, 1024, 1, 2048, 1024, 1024, 2048, 1024]
    - [73, 10.889]
  - - [1024, 1024, 1, 4096, 1024, 1024, 4096, 1024]
    - [73, 13.395]
  - - [1024, 1024, 1, 8192, 1024, 1024, 8192, 1024]
    - [21, 15.341]
  - - [1024, 2048, 1, 128, 1024, 1024, 128, 2048]
    - [57, 3.706]
  - - [1024, 2048, 1, 256, 1024, 1024, 256, 2048]
    - [47, 5.938]
  - - [1024, 2048, 1, 512, 1024, 1024, 512, 2048]
    - [51, 8.658]
  - - [1024, 2048, 1, 1024, 1024, 1024, 1024, 2048]
    - [17, 11.039]
  - - [1024, 2048, 1, 2048, 1024, 1024, 2048, 2048]
    - [53, 12.812]
  - - [1024, 2048, 1, 4096, 1024, 1024, 4096, 2048]
    - [47, 15.14]
  - - [1024, 2048, 1, 8192, 1024, 1024, 8192, 2048]
    - [39, 16.966]
  - - [1024, 4096, 1, 128, 1024, 1024, 128, 4096]
    - [39, 4.256]
  - - [1024, 4096, 1, 256, 1024, 1024, 256, 4096]
    - [39, 6.806]
  - - [1024, 4096, 1, 512, 1024, 1024, 512, 4096]
    - [3, 9.797]
  - - [1024, 4096, 1, 1024, 1024, 1024, 1024, 4096]
    - [53, 12.112]
  - - [1024, 4096, 1, 2048, 1024, 1024, 2048, 4096]
    - [63, 14.491]
  - - [1024, 4096, 1, 4096, 1024, 1024, 4096, 4096]
    - [6, 16.938]
  - - [1024, 4096, 1, 8192, 1024, 1024, 8192, 4096]
    - [39, 18.932]
  - - [1024, 8192, 1, 128, 1024, 1024, 128, 8192]
    - [55, 4.381]
  - - [1024, 8192, 1, 256, 1024, 1024, 256, 8192]
    - [49, 7.176]
  - - [1024, 8192, 1, 512, 1024, 1024, 512, 8192]
    - [2, 10.451]
  - - [1024, 8192, 1, 1024, 1024, 1024, 1024, 8192]
    - [45, 13.579]
  - - [1024, 8192, 1, 2048, 1024, 1024, 2048, 8192]
    - [45, 15.994]
  - - [1024, 8192, 1, 4096, 1024, 1024, 4096, 8192]
    - [45, 18.364]
  - - [1024, 8192, 1, 8192, 1024, 1024, 8192, 8192]
    - [42, 20.196]
  - - [2048, 128, 1, 128, 2048, 2048, 128, 128]
    - [76, 1.14]
  - - [2048, 128, 1, 256, 2048, 2048, 256, 128]
    - [76, 1.964]
  - - [2048, 128, 1, 512, 2048, 2048, 512, 128]
    - [83, 3.194]
  - - [2048, 128, 1, 1024, 2048, 2048, 1024, 128]
    - [84, 4.617]
  - - [2048, 128, 1, 2048, 2048, 2048, 2048, 128]
    - [85, 5.853]
  - - [2048, 128, 1, 4096, 2048, 2048, 4096, 128]
    - [81, 7.319]
  - - [2048, 128, 1, 8192, 2048, 2048, 8192, 128]
    - [69, 9.788]
  - - [2048, 256, 1, 128, 2048, 2048, 128, 256]
    - [61, 1.84]
  - - [2048, 256, 1, 256, 2048, 2048, 256, 256]
    - [75, 3.131]
  - - [2048, 256, 1, 512, 2048, 2048, 512, 256]
    - [80, 4.877]
  - - [2048, 256, 1, 1024, 2048, 2048, 1024, 256]
    - [81, 6.919]
  - - [2048, 256, 1, 2048, 2048, 2048, 2048, 256]
    - [82, 8.848]
  - - [2048, 256, 1, 4096, 2048, 2048, 4096, 256]
    - [73, 10.271]
  - - [2048, 256, 1, 8192, 2048, 2048, 8192, 256]
    - [20, 13.114]
  - - [2048, 512, 1, 128, 2048, 2048, 128, 512]
    - [60, 2.773]
  - - [2048, 512, 1, 256, 2048, 2048, 256, 512]
    - [69, 4.655]
  - - [2048, 512, 1, 512, 2048, 2048, 512, 512]
    - [72, 7.107]
  - - [2048, 512, 1, 1024, 2048, 2048, 1024, 512]
    - [72, 9.802]
  - - [2048, 512, 1, 2048, 2048, 2048, 2048, 512]
    - [20, 10.886]
  - - [2048, 512, 1, 4096, 2048, 2048, 4096, 512]
    - [73, 13.383]
  - - [2048, 512, 1, 8192, 2048, 2048, 8192, 512]
    - [20, 15.203]
  - - [2048, 1024, 1, 128, 2048, 2048, 128, 1024]
    - [46, 3.715]
  - - [2048, 1024, 1, 256, 2048, 2048, 256, 1024]
    - [47, 5.904]
  - - [2048, 1024, 1, 512, 2048, 2048, 512, 1024]
    - [50, 8.638]
  - - [2048, 1024, 1, 1024, 2048, 2048, 1024, 1024]
    - [17, 11.098]
  - - [2048, 1024, 1, 2048, 2048, 2048, 2048, 1024]
    - [53, 12.834]
  - - [2048, 1024, 1, 4096, 2048, 2048, 4096, 1024]
    - [9, 15.124]
  - - [2048, 1024, 1, 8192, 2048, 2048, 8192, 1024]
    - [45, 16.924]
  - - [2048, 2048, 1, 128, 2048, 2048, 128, 2048]
    - [2, 4.272]
  - - [2048, 2048, 1, 256, 2048, 2048, 256, 2048]
    - [2, 6.853]
  - - [2048, 2048, 1, 512, 2048, 2048, 512, 2048]
    - [41, 9.956]
  - - [2048, 2048, 1, 1024, 2048, 2048, 1024, 2048]
    - [53, 12.196]
  - - [2048, 2048, 1, 2048, 2048, 2048, 2048, 2048]
    - [63, 14.537]
  - - [2048, 2048, 1, 4096, 2048, 2048, 4096, 2048]
    - [39, 16.9]
  - - [2048, 2048, 1, 8192, 2048, 2048, 8192, 2048]
    - [38, 19.159]
  - - [2048, 4096, 1, 128, 2048, 2048, 128, 4096]
    - [56, 4.357]
  - - [2048, 4096, 1, 256, 2048, 2048, 256, 4096]
    - [46, 7.198]
  - - [2048, 4096, 1, 512, 2048, 2048, 512, 4096]
    - [38, 10.436]
  - - [2048, 4096, 1, 1024, 2048, 2048, 1024, 4096]
    - [44, 13.659]
  - - [2048, 4096, 1, 2048, 2048, 2048, 2048, 4096]
    - [39, 15.964]
  - - [2048, 4096, 1, 4096, 2048, 2048, 4096, 4096]
    - [41, 18.575]
  - - [2048, 4096, 1, 8192, 2048, 2048, 8192, 4096]
    - [42, 20.234]
  - - [2048, 8192, 1, 128, 2048, 2048, 128, 8192]
    - [56, 5.283]
  - - [2048, 8192, 1, 256, 2048, 2048, 256, 8192]
    - [39, 8.062]
  - - [2048, 8192, 1, 512, 2048, 2048, 512, 8192]
    - [38, 11.353]
  - - [2048, 8192, 1, 1024, 2048, 2048, 1024, 8192]
    - [41, 14.51]
  - - [2048, 8192, 1, 2048, 2048, 2048, 2048, 8192]
    - [2, 17.19]
  - - [2048, 8192, 1, 4096, 2048, 2048, 4096, 8192]
    - [2, 19.446]
  - - [2048, 8192, 1, 8192, 2048, 2048, 8192, 8192]
    - [44, 20.44]
  - - [4096, 128, 1, 128, 4096, 4096, 128, 128]
    - [12, 1.772]
  - - [4096, 128, 1, 256, 4096, 4096, 256, 128]
    - [75, 2.998]
  - - [4096, 128, 1, 512, 4096, 4096, 512, 128]
    - [80, 4.723]
  - - [4096, 128, 1, 1024, 4096, 4096, 1024, 128]
    - [82, 6.624]
  - - [4096, 128, 1, 2048, 4096, 4096, 2048, 128]
    - [26, 8.05]
  - - [4096, 128, 1, 4096, 4096, 4096, 4096, 128]
    - [20, 10.354]
  - - [4096, 128, 1, 8192, 4096, 4096, 8192, 128]
    - [22, 13.3]
  - - [4096, 256, 1, 128, 4096, 4096, 128, 256]
    - [59, 2.77]
  - - [4096, 256, 1, 256, 4096, 4096, 256, 256]
    - [67, 4.619]
  - - [4096, 256, 1, 512, 4096, 4096, 512, 256]
    - [70, 7.074]
  - - [4096, 256, 1, 1024, 4096, 4096, 1024, 256]
    - [71, 9.449]
  - - [4096, 256, 1, 2048, 4096, 4096, 2048, 256]
    - [73, 10.7]
  - - [4096, 256, 1, 4096, 4096, 4096, 4096, 256]
    - [20, 13.381]
  - - [4096, 256, 1, 8192, 4096, 4096, 8192, 256]
    - [20, 15.241]
  - - [4096, 512, 1, 128, 4096, 4096, 128, 512]
    - [57, 3.662]
  - - [4096, 512, 1, 256, 4096, 4096, 256, 512]
    - [54, 5.862]
  - - [4096, 512, 1, 512, 4096, 4096, 512, 512]
    - [52, 8.531]
  - - [4096, 512, 1, 1024, 4096, 4096, 1024, 512]
    - [13, 10.928]
  - - [4096, 512, 1, 2048, 4096, 4096, 2048, 512]
    - [51, 12.654]
  - - [4096, 512, 1, 4096, 4096, 4096, 4096, 512]
    - [15, 15.089]
  - - [4096, 512, 1, 8192, 4096, 4096, 8192, 512]
    - [42, 16.908]
  - - [4096, 1024, 1, 128, 4096, 4096, 128, 1024]
    - [1, 4.303]
  - - [4096, 1024, 1, 256, 4096, 4096, 256, 1024]
    - [1, 6.808]
  - - [4096, 1024, 1, 512, 4096, 4096, 512, 1024]
    - [1, 9.825]
  - - [4096, 1024, 1, 1024, 4096, 4096, 1024, 1024]
    - [53, 12.072]
  - - [4096, 1024, 1, 2048, 4096, 4096, 2048, 1024]
    - [8, 14.438]
  - - [4096, 1024, 1, 4096, 4096, 4096, 4096, 1024]
    - [45, 16.805]
  - - [4096, 1024, 1, 8192, 4096, 4096, 8192, 1024]
    - [4, 18.958]
  - - [4096, 2048, 1, 128, 4096, 4096, 128, 2048]
    - [58, 4.355]
  - - [4096, 2048, 1, 256, 4096, 4096, 256, 2048]
    - [49, 6.993]
  - - [4096, 2048, 1, 512, 4096, 4096, 512, 2048]
    - [2, 10.232]
  - - [4096, 2048, 1, 1024, 4096, 4096, 1024, 2048]
    - [5, 13.365]
  - - [4096, 2048, 1, 2048, 4096, 4096, 2048, 2048]
    - [2, 15.957]
  - - [4096, 2048, 1, 4096, 4096, 4096, 4096, 2048]
    - [2, 18.349]
  - - [4096, 2048, 1, 8192, 4096, 4096, 8192, 2048]
    - [37, 20.186]
  - - [4096, 4096, 1, 128, 4096, 4096, 128, 4096]
    - [55, 5.212]
  - - [4096, 4096, 1, 256, 4096, 4096, 256, 4096]
    - [36, 7.893]
  - - [4096, 4096, 1, 512, 4096, 4096, 512, 4096]
    - [36, 11.161]
  - - [4096, 4096, 1, 1024, 4096, 4096, 1024, 4096]
    - [44, 14.321]
  - - [4096, 4096, 1, 2048, 4096, 4096, 2048, 4096]
    - [2, 17.226]
  - - [4096, 4096, 1, 4096, 4096, 4096, 4096, 4096]
    - [44, 19.363]
  - - [4096, 4096, 1, 8192, 4096, 4096, 8192, 4096]
    - [44, 20.458]
  - - [4096, 8192, 1, 128, 4096, 4096, 128, 8192]
    - [11, 5.3]
  - - [4096, 8192, 1, 256, 4096, 4096, 256, 8192]
    - [16, 7.812]
  - - [4096, 8192, 1, 512, 4096, 4096, 512, 8192]
    - [38, 10.837]
  - - [4096, 8192, 1, 1024, 4096, 4096, 1024, 8192]
    - [1, 14.526]
  - - [4096, 8192, 1, 2048, 4096, 4096, 2048, 8192]
    - [44, 17.384]
  - - [4096, 8192, 1, 4096, 4096, 4096, 4096, 8192]
    - [44, 19.457]
  - - [4096, 8192, 1, 8192, 4096, 4096, 8192, 8192]
    - [44, 20.807]
  - - [8192, 128, 1, 128, 8192, 8192, 128, 128]
    - [60, 2.73]
  - - [8192, 128, 1, 256, 8192, 8192, 256, 128]
    - [69, 4.568]
  - - [8192, 128, 1, 512, 8192, 8192, 512, 128]
    - [68, 6.954]
  - - [8192, 128, 1, 1024, 8192, 8192, 1024, 128]
    - [19, 8.955]
  - - [8192, 128, 1, 2048, 8192, 8192, 2048, 128]
    - [69, 10.421]
  - - [8192, 128, 1, 4096, 8192, 8192, 4096, 128]
    - [20, 13.486]
  - - [8192, 128, 1, 8192, 8192, 8192, 8192, 128]
    - [20, 15.221]
  - - [8192, 256, 1, 128, 8192, 8192, 128, 256]
    - [58, 3.657]
  - - [8192, 256, 1, 256, 8192, 8192, 256, 256]
    - [47, 5.775]
  - - [8192, 256, 1, 512, 8192, 8192, 512, 256]
    - [47, 8.423]
  - - [8192, 256, 1, 1024, 8192, 8192, 1024, 256]
    - [14, 10.689]
  - - [8192, 256, 1, 2048, 8192, 8192, 2048, 256]
    - [47, 12.627]
  - - [8192, 256, 1, 4096, 8192, 8192, 4096, 256]
    - [63, 15.258]
  - - [8192, 256, 1, 8192, 8192, 8192, 8192, 256]
    - [38, 16.876]
  - - [8192, 512, 1, 128, 8192, 8192, 128, 512]
    - [0, 4.164]
  - - [8192, 512, 1, 256, 8192, 8192, 256, 512]
    - [0, 6.568]
  - - [8192, 512, 1, 512, 8192, 8192, 512, 512]
    - [40, 9.819]
  - - [8192, 512, 1, 1024, 8192, 8192, 1024, 512]
    - [47, 12.07]
  - - [8192, 512, 1, 2048, 8192, 8192, 2048, 512]
    - [47, 14.487]
  - - [8192, 512, 1, 4096, 8192, 8192, 4096, 512]
    - [38, 16.816]
  - - [8192, 512, 1, 8192, 8192, 8192, 8192, 512]
    - [39, 18.973]
  - - [8192, 1024, 1, 128, 8192, 8192, 128, 1024]
    - [47, 4.347]
  - - [8192, 1024, 1, 256, 8192, 8192, 256, 1024]
    - [47, 7.134]
  - - [8192, 1024, 1, 512, 8192, 8192, 512, 1024]
    - [1, 10.272]
  - - [8192, 1024, 1, 1024, 8192, 8192, 1024, 1024]
    - [2, 13.31]
  - - [8192, 1024, 1, 2048, 8192, 8192, 2048, 1024]
    - [38, 15.743]
  - - [8192, 1024, 1, 4096, 8192, 8192, 4096, 1024]
    - [3, 18.382]
  - - [8192, 1024, 1, 8192, 8192, 8192, 8192, 1024]
    - [42, 20.181]
  - - [8192, 2048, 1, 128, 8192, 8192, 128, 2048]
    - [47, 5.173]
  - - [8192, 2048, 1, 256, 8192, 8192, 256, 2048]
    - [39, 7.841]
  - - [8192, 2048, 1, 512, 8192, 8192, 512, 2048]
    - [44, 11.28]
  - - [8192, 2048, 1, 1024, 8192, 8192, 1024, 2048]
    - [43, 14.403]
  - - [8192, 2048, 1, 2048, 8192, 8192, 2048, 2048]
    - [44, 17.068]
  - - [8192, 2048, 1, 4096, 8192, 8192, 4096, 2048]
    - [44, 19.318]
  - - [8192, 2048, 1, 8192, 8192, 8192, 8192, 2048]
    - [41, 20.309]
  - - [8192, 4096, 1, 128, 8192, 8192, 128, 4096]
    - [7, 5.194]
  - - [8192, 4096, 1, 256, 8192, 8192, 256, 4096]
    - [44, 7.797]
  - - [8192, 4096, 1, 512, 8192, 8192, 512, 4096]
    - [1, 10.883]
  - - [8192, 4096, 1, 1024, 8192, 8192, 1024, 4096]
    - [44, 14.417]
  - - [8192, 4096, 1, 2048, 8192, 8192, 2048, 4096]
    - [44, 17.417]
  - - [8192, 4096, 1, 4096, 8192, 8192, 4096, 4096]
    - [44, 19.514]
  - - [8192, 4096, 1, 8192, 8192, 8192, 8192, 4096]
    - [2, 20.749]
  - - [8192, 8192, 1, 128, 8192, 8192, 128, 8192]
    - [43, 4.964]
  - - [8192, 8192, 1, 256, 8192, 8192, 256, 8192]
    - [44, 7.832]
  - - [8192, 8192, 1, 512, 8192, 8192, 512, 8192]
    - [43, 11.662]
  - - [8192, 8192, 1, 1024, 8192, 8192, 1024, 8192]
    - [44, 15.205]
  - - [8192, 8192, 1, 2048, 8192, 8192, 2048, 8192]
    - [44, 17.844]
  - - [8192, 8192, 1, 4096, 8192, 8192, 4096, 8192]
    - [44, 19.902]
  - - [8192, 8192, 1, 8192, 8192, 8192, 8192, 8192]
    - [2, 20.979]
  - - [1, 1, 1, 32, 1, 1, 32, 1]
    - [90, 0.0]
- null
- null
- ExperimentalStreamK
- GridBased
