library/src/amd_detail/rocblaslt/src/Tensile/Logic/asm_full/aquavanjaram/gfx942_80cu/StreamK/aquavanjaram942_Cijk_Ailk_Bljk_HHS_BH_UserArgs.yaml
- {MinimumRequiredVersion: 4.33.0}
- aquavanjaram942
- {Architecture: gfx942, CUCount: 80}
- [Device 0049, Device 0050]
    SolutionIndex: 0
    SolutionNameMin: Cijk_Ailk_Bljk_HHS_BH_UserArgs_MT256x256x32_MI16x16x1_SN_LDSB1_CLR1_GSU0_GSUC0_GSUWGMRR0_K1_LBSPPA2048_LBSPPB128_LPA0_MIWT8_8_PLR1_SU32_SUM0_SUS256_SKXCCM0_VWA4_VWB1_WGM1_WGMXCC1_WGMXCCGn1
    SolutionIndex: 1
    SolutionNameMin: Cijk_Ailk_Bljk_HHS_BH_UserArgs_MT256x256x32_MI16x16x1_SN_LDSB1_CLR1_GSU0_GSUC0_GSUWGMRR0_K1_LBSPPA2048_LBSPPB128_LPA0_MIWT8_8_PLR1_SU32_SUM0_SUS256_SKXCCM0_VWA8_VWB1_WGM1_WGMXCC1_WGMXCCGn1
    SolutionIndex: 2
    SolutionNameMin: Cijk_Ailk_Bljk_HHS_BH_UserArgs_MT256x256x32_MI16x16x1_SN_LDSB1_CLR1_GSU0_GSUC0_GSUWGMRR0_K1_LBSPPA2048_LBSPPB128_LPA0_MIWT8_8_PLR1_SU32_SUM0_SUS256_SKXCCM0_VWA4_VWB2_WGM1_WGMXCC1_WGMXCCGn1
    SolutionIndex: 3
    SolutionNameMin: Cijk_Ailk_Bljk_HHS_BH_UserArgs_MT256x256x32_MI16x16x1_SN_LDSB1_CLR1_GSU0_GSUC0_GSUWGMRR0_K1_LBSPPA2048_LBSPPB256_LPA0_MIWT8_8_PLR1_SU32_SUM0_SUS256_SKXCCM0_VWA8_VWB4_WGM1_WGMXCC1_WGMXCCGn1
    SolutionIndex: 4
    SolutionNameMin: Cijk_Ailk_Bljk_HHS_BH_UserArgs_MT256x256x32_MI16x16x1_SN_LDSB1_CLR1_GSU0_GSUC0_GSUWGMRR0_K1_LBSPPA2048_LBSPPB512_LPA0_MIWT8_8_PLR1_SU32_SUM0_SUS256_SKXCCM0_VWA8_VWB8_WGM4_WGMXCC1_WGMXCCGn1
    SolutionIndex: 5
    SolutionNameMin: Cijk_Ailk_Bljk_HHS_BH_UserArgs_MT256x64x32_MI16x16x1_SN_LDSB1_CLR1_GSU0_GSUC0_GSUWGMRR0_K1_LBSPPA2048_LBSPPB128_LPA0_MIWT8_2_PLR1_SU32_SUM0_SUS256_SKXCCM0_VWA8_VWB1_WGM4_WGMXCC1_WGMXCCGn1
    SolutionIndex: 6
    SolutionNameMin: Cijk_Ailk_Bljk_HHS_BH_UserArgs_MT128x256x64_MI16x16x1_SN_LDSB1_CLR1_GSU0_GSUC0_GSUWGMRR0_K1_LBSPPA2048_LBSPPB128_LPA0_MIWT4_8_PLR1_SU32_SUM0_SUS256_SKXCCM0_VWA4_VWB1_WGM1_WGMXCC1_WGMXCCGn1
    SolutionIndex: 7
    SolutionNameMin: Cijk_Ailk_Bljk_HHS_BH_UserArgs_MT128x256x64_MI16x16x1_SN_LDSB1_CLR1_GSU0_GSUC0_GSUWGMRR0_K1_LBSPPA2048_LBSPPB512_LPA0_MIWT4_8_PLR1_SU32_SUM0_SUS256_SKXCCM0_VWA4_VWB4_WGM1_WGMXCC1_WGMXCCGn1
    SolutionIndex: 8
    SolutionNameMin: Cijk_Ailk_Bljk_HHS_BH_UserArgs_MT128x128x64_MI16x16x1_SN_LDSB1_CLR1_GSU0_GSUC0_GSUWGMRR0_K1_LBSPPA2048_LBSPPB128_LPA0_MIWT4_4_PLR1_SU32_SUM0_SUS256_SKXCCM0_VWA4_VWB1_WGM1_WGMXCC1_WGMXCCGn1
    SolutionIndex: 9
    SolutionNameMin: Cijk_Ailk_Bljk_HHS_BH_UserArgs_MT128x128x64_MI16x16x1_SN_LDSB1_CLR1_GSU0_GSUC0_GSUWGMRR0_K1_LBSPPA2048_LBSPPB256_LPA0_MIWT4_4_PLR1_SU32_SUM0_SUS256_SKXCCM0_VWA4_VWB2_WGM1_WGMXCC1_WGMXCCGn1
    SolutionIndex: 10
    SolutionNameMin: Cijk_Ailk_Bljk_HHS_BH_UserArgs_MT128x128x64_MI16x16x1_SN_LDSB1_CLR1_GSU0_GSUC0_GSUWGMRR0_K1_LBSPPA2048_LBSPPB512_LPA0_MIWT4_4_PLR1_SU32_SUM0_SUS256_SKXCCM0_VWA4_VWB4_WGM1_WGMXCC1_WGMXCCGn1
    SolutionIndex: 11
    SolutionNameMin: Cijk_Ailk_Bljk_HHS_BH_UserArgs_MT128x128x64_MI16x16x1_SN_LDSB1_CLR1_GSU0_GSUC0_GSUWGMRR0_K1_LBSPPA2048_LBSPPB512_LPA0_MIWT4_4_PLR1_SU32_SUM0_SUS256_SKXCCM0_VWA4_VWB4_WGM2_WGMXCC1_WGMXCCGn1
    SolutionIndex: 12
    SolutionNameMin: Cijk_Ailk_Bljk_HHS_BH_UserArgs_MT128x64x64_MI16x16x1_SN_LDSB1_CLR1_GSU0_GSUC0_GSUWGMRR0_K1_LBSPPA2048_LBSPPB128_LPA0_MIWT4_2_PLR1_SU32_SUM0_SUS256_SKXCCM0_VWA4_VWB1_WGM1_WGMXCC1_WGMXCCGn1
    SolutionIndex: 13
    SolutionNameMin: Cijk_Ailk_Bljk_HHS_BH_UserArgs_MT64x64x64_MI16x16x1_SN_LDSB1_CLR1_GSU0_GSUC0_GSUWGMRR0_K1_LBSPPA1024_LBSPPB128_LPA32_MIWT2_2_PLR1_SU32_SUM0_SUS256_SKXCCM0_VWA2_VWB1_WGM1_WGMXCC1_WGMXCCGn1
    SolutionIndex: 14
    SolutionNameMin: Cijk_Ailk_Bljk_HHS_BH_UserArgs_MT64x32x64_MI16x16x1_SN_LDSB0_CLR1_GSU0_GSUC0_GSUWGMRR0_K1_LBSPPA1024_LBSPPB128_LPA32_MIWT2_1_PLR1_SU32_SUM0_SUS256_SKXCCM0_VWA2_VWB1_WGM1_WGMXCC1_WGMXCCGn1
    SolutionIndex: 15
    SolutionNameMin: Cijk_Ailk_Bljk_HHS_BH_UserArgs_MT32x32x64_MI16x16x1_SN_LDSB0_CLR1_GSU0_GSUC0_GSUWGMRR0_K1_LBSPPA512_LBSPPB128_LPA16_MIWT1_1_PLR1_SU32_SUM0_SUS256_SKXCCM0_VWA1_VWB1_WGM1_WGMXCC1_WGMXCCGn1
    SolutionIndex: 16
    SolutionNameMin: Cijk_Ailk_Bljk_HHS_BH_UserArgs_MT64x128x128_MI16x16x1_SN_LDSB1_CLR1_GSU0_GSUC0_GSUWGMRR0_K1_LBSPPA1024_LBSPPB512_LPA32_MIWT2_4_PLR2_SU32_SUM0_SUS256_SKXCCM0_VWA2_VWB2_WGM1_WGMXCC1_WGMXCCGn1
    SolutionIndex: 17
    SolutionNameMin: Cijk_Ailk_Bljk_HHS_BH_UserArgs_MT64x128x128_MI16x16x1_SN_LDSB1_CLR1_GSU0_GSUC0_GSUWGMRR0_K1_LBSPPA1024_LBSPPB1024_LPA32_MIWT2_4_PLR2_SU32_SUM0_SUS256_SKXCCM0_VWA2_VWB4_WGM1_WGMXCC1_WGMXCCGn1
    SolutionIndex: 18
    SolutionNameMin: Cijk_Ailk_Bljk_HHS_BH_UserArgs_MT64x128x128_MI16x16x1_SN_LDSB1_CLR1_GSU0_GSUC0_GSUWGMRR0_K1_LBSPPA1024_LBSPPB512_LPA32_MIWT2_4_PLR2_SU32_SUM0_SUS256_SKXCCM0_VWA2_VWB2_WGM2_WGMXCC1_WGMXCCGn1
    SolutionIndex: 19
    SolutionNameMin: Cijk_Ailk_Bljk_HHS_BH_UserArgs_MT128x64x128_MI16x16x1_SN_LDSB1_CLR1_GSU0_GSUC0_GSUWGMRR0_K1_LBSPPA2048_LBSPPB256_LPA0_MIWT4_2_PLR1_SU32_SUM0_SUS256_SKXCCM0_VWA4_VWB1_WGM1_WGMXCC1_WGMXCCGn1
    SolutionIndex: 20
    SolutionNameMin: Cijk_Ailk_Bljk_HHS_BH_UserArgs_MT128x64x128_MI16x16x1_SN_LDSB1_CLR1_GSU0_GSUC0_GSUWGMRR0_K1_LBSPPA2048_LBSPPB256_LPA0_MIWT4_2_PLR2_SU32_SUM0_SUS256_SKXCCM0_VWA4_VWB1_WGM1_WGMXCC1_WGMXCCGn1
    SolutionIndex: 21
    SolutionNameMin: Cijk_Ailk_Bljk_HHS_BH_UserArgs_MT128x64x128_MI16x16x1_SN_LDSB1_CLR1_GSU0_GSUC0_GSUWGMRR0_K1_LBSPPA2048_LBSPPB256_LPA0_MIWT4_2_PLR1_SU32_SUM0_SUS256_SKXCCM0_VWA4_VWB1_WGM2_WGMXCC1_WGMXCCGn1
    SolutionIndex: 22
    SolutionNameMin: Cijk_Ailk_Bljk_HHS_BH_UserArgs_MT128x64x128_MI16x16x1_SN_LDSB1_CLR1_GSU0_GSUC0_GSUWGMRR0_K1_LBSPPA2048_LBSPPB256_LPA0_MIWT4_2_PLR2_SU32_SUM0_SUS256_SKXCCM0_VWA4_VWB1_WGM2_WGMXCC1_WGMXCCGn1
    SolutionIndex: 23
    SolutionNameMin: Cijk_Ailk_Bljk_HHS_BH_UserArgs_MT128x64x128_MI16x16x1_SN_LDSB1_CLR1_GSU0_GSUC0_GSUWGMRR0_K1_LBSPPA2048_LBSPPB256_LPA0_MIWT4_2_PLR2_SU32_SUM0_SUS256_SKXCCM0_VWA4_VWB1_WGM4_WGMXCC1_WGMXCCGn1
    SolutionIndex: 24
    SolutionNameMin: Cijk_Ailk_Bljk_HHS_BH_UserArgs_MT64x64x128_MI16x16x1_SN_LDSB1_CLR1_GSU0_GSUC0_GSUWGMRR0_K1_LBSPPA1024_LBSPPB256_LPA32_MIWT2_2_PLR2_SU32_SUM0_SUS256_SKXCCM0_VWA2_VWB1_WGM1_WGMXCC1_WGMXCCGn1
    SolutionIndex: 25
    SolutionNameMin: Cijk_Ailk_Bljk_HHS_BH_UserArgs_MT64x64x128_MI16x16x1_SN_LDSB1_CLR1_GSU0_GSUC0_GSUWGMRR0_K1_LBSPPA1024_LBSPPB512_LPA32_MIWT2_2_PLR2_SU32_SUM0_SUS256_SKXCCM0_VWA2_VWB2_WGM1_WGMXCC1_WGMXCCGn1
    SolutionIndex: 26
    SolutionNameMin: Cijk_Ailk_Bljk_HHS_BH_UserArgs_MT64x32x128_MI16x16x1_SN_LDSB1_CLR1_GSU0_GSUC0_GSUWGMRR0_K1_LBSPPA1024_LBSPPB256_LPA32_MIWT2_1_PLR2_SU32_SUM0_SUS256_SKXCCM0_VWA2_VWB1_WGM1_WGMXCC1_WGMXCCGn1
    SolutionIndex: 27
    SolutionNameMin: Cijk_Ailk_Bljk_HHS_BH_UserArgs_MT32x32x128_MI16x16x1_SN_LDSB1_CLR1_GSU0_GSUC0_GSUWGMRR0_K1_LBSPPA512_LBSPPB256_LPA16_MIWT1_1_PLR1_SU32_SUM0_SUS256_SKXCCM0_VWA1_VWB1_WGM1_WGMXCC1_WGMXCCGn1
    SolutionIndex: 28
    SolutionNameMin: Cijk_Ailk_Bljk_HHS_BH_UserArgs_MT32x32x128_MI16x16x1_SN_LDSB1_CLR1_GSU0_GSUC0_GSUWGMRR0_K1_LBSPPA512_LBSPPB256_LPA16_MIWT1_1_PLR2_SU32_SUM0_SUS256_SKXCCM0_VWA1_VWB1_WGM1_WGMXCC1_WGMXCCGn1
    SolutionIndex: 29
    SolutionNameMin: Cijk_Ailk_Bljk_HHS_BH_UserArgs_MT256x256x32_MI16x16x1_SN_LDSB1_CLR1_GSU0_GSUC0_GSUWGMRR0_K1_LBSPPA2048_LBSPPB128_LPA0_MIWT8_8_PLR1_SU32_SUM0_SUS256_SKXCCM4_VWA4_VWB1_WGM1_WGMXCC1_WGMXCCGn1
    SolutionIndex: 30
    SolutionNameMin: Cijk_Ailk_Bljk_HHS_BH_UserArgs_MT256x256x32_MI16x16x1_SN_LDSB1_CLR1_GSU0_GSUC0_GSUWGMRR0_K1_LBSPPA2048_LBSPPB128_LPA0_MIWT8_8_PLR1_SU32_SUM0_SUS256_SKXCCM4_VWA8_VWB1_WGM1_WGMXCC1_WGMXCCGn1
    SolutionIndex: 31
    SolutionNameMin: Cijk_Ailk_Bljk_HHS_BH_UserArgs_MT256x256x32_MI16x16x1_SN_LDSB1_CLR1_GSU0_GSUC0_GSUWGMRR0_K1_LBSPPA2048_LBSPPB128_LPA0_MIWT8_8_PLR1_SU32_SUM0_SUS256_SKXCCM4_VWA8_VWB2_WGM1_WGMXCC1_WGMXCCGn1
    SolutionIndex: 32
    SolutionNameMin: Cijk_Ailk_Bljk_HHS_BH_UserArgs_MT256x256x32_MI16x16x1_SN_LDSB1_CLR1_GSU0_GSUC0_GSUWGMRR0_K1_LBSPPA2048_LBSPPB256_LPA0_MIWT8_8_PLR1_SU32_SUM0_SUS256_SKXCCM4_VWA4_VWB4_WGM1_WGMXCC1_WGMXCCGn1
    SolutionIndex: 33
    SolutionNameMin: Cijk_Ailk_Bljk_HHS_BH_UserArgs_MT256x256x32_MI16x16x1_SN_LDSB1_CLR1_GSU0_GSUC0_GSUWGMRR0_K1_LBSPPA2048_LBSPPB256_LPA0_MIWT8_8_PLR1_SU32_SUM0_SUS256_SKXCCM4_VWA8_VWB4_WGM1_WGMXCC1_WGMXCCGn1
    SolutionIndex: 34
    SolutionNameMin: Cijk_Ailk_Bljk_HHS_BH_UserArgs_MT256x256x32_MI16x16x1_SN_LDSB1_CLR1_GSU0_GSUC0_GSUWGMRR0_K1_LBSPPA2048_LBSPPB512_LPA0_MIWT8_8_PLR1_SU32_SUM0_SUS256_SKXCCM4_VWA4_VWB8_WGM1_WGMXCC1_WGMXCCGn1
    SolutionIndex: 35
    SolutionNameMin: Cijk_Ailk_Bljk_HHS_BH_UserArgs_MT256x256x32_MI16x16x1_SN_LDSB1_CLR1_GSU0_GSUC0_GSUWGMRR0_K1_LBSPPA2048_LBSPPB512_LPA0_MIWT8_8_PLR1_SU32_SUM0_SUS256_SKXCCM4_VWA8_VWB8_WGM1_WGMXCC1_WGMXCCGn1
    SolutionIndex: 36
    SolutionNameMin: Cijk_Ailk_Bljk_HHS_BH_UserArgs_MT256x256x32_MI16x16x1_SN_LDSB1_CLR1_GSU0_GSUC0_GSUWGMRR0_K1_LBSPPA2048_LBSPPB128_LPA0_MIWT8_8_PLR1_SU32_SUM0_SUS256_SKXCCM4_VWA4_VWB1_WGM2_WGMXCC1_WGMXCCGn1
    SolutionIndex: 37
    SolutionNameMin: Cijk_Ailk_Bljk_HHS_BH_UserArgs_MT256x256x32_MI16x16x1_SN_LDSB1_CLR1_GSU0_GSUC0_GSUWGMRR0_K1_LBSPPA2048_LBSPPB128_LPA0_MIWT8_8_PLR1_SU32_SUM0_SUS256_SKXCCM4_VWA8_VWB1_WGM2_WGMXCC1_WGMXCCGn1
    SolutionIndex: 38
    SolutionNameMin: Cijk_Ailk_Bljk_HHS_BH_UserArgs_MT256x256x32_MI16x16x1_SN_LDSB1_CLR1_GSU0_GSUC0_GSUWGMRR0_K1_LBSPPA2048_LBSPPB128_LPA0_MIWT8_8_PLR1_SU32_SUM0_SUS256_SKXCCM4_VWA4_VWB2_WGM2_WGMXCC1_WGMXCCGn1
    SolutionIndex: 39
    SolutionNameMin: Cijk_Ailk_Bljk_HHS_BH_UserArgs_MT256x256x32_MI16x16x1_SN_LDSB1_CLR1_GSU0_GSUC0_GSUWGMRR0_K1_LBSPPA2048_LBSPPB128_LPA0_MIWT8_8_PLR1_SU32_SUM0_SUS256_SKXCCM4_VWA8_VWB2_WGM2_WGMXCC1_WGMXCCGn1
    SolutionIndex: 40
    SolutionNameMin: Cijk_Ailk_Bljk_HHS_BH_UserArgs_MT256x256x32_MI16x16x1_SN_LDSB1_CLR1_GSU0_GSUC0_GSUWGMRR0_K1_LBSPPA2048_LBSPPB256_LPA0_MIWT8_8_PLR1_SU32_SUM0_SUS256_SKXCCM4_VWA4_VWB4_WGM2_WGMXCC1_WGMXCCGn1
    SolutionIndex: 41
    SolutionNameMin: Cijk_Ailk_Bljk_HHS_BH_UserArgs_MT256x256x32_MI16x16x1_SN_LDSB1_CLR1_GSU0_GSUC0_GSUWGMRR0_K1_LBSPPA2048_LBSPPB256_LPA0_MIWT8_8_PLR1_SU32_SUM0_SUS256_SKXCCM4_VWA8_VWB4_WGM2_WGMXCC1_WGMXCCGn1
    SolutionIndex: 42
    SolutionNameMin: Cijk_Ailk_Bljk_HHS_BH_UserArgs_MT256x256x32_MI16x16x1_SN_LDSB1_CLR1_GSU0_GSUC0_GSUWGMRR0_K1_LBSPPA2048_LBSPPB512_LPA0_MIWT8_8_PLR1_SU32_SUM0_SUS256_SKXCCM4_VWA4_VWB8_WGM2_WGMXCC1_WGMXCCGn1
    SolutionIndex: 43
    SolutionNameMin: Cijk_Ailk_Bljk_HHS_BH_UserArgs_MT256x256x32_MI16x16x1_SN_LDSB1_CLR1_GSU0_GSUC0_GSUWGMRR0_K1_LBSPPA2048_LBSPPB512_LPA0_MIWT8_8_PLR1_SU32_SUM0_SUS256_SKXCCM4_VWA8_VWB8_WGM2_WGMXCC1_WGMXCCGn1
    SolutionIndex: 44
    SolutionNameMin: Cijk_Ailk_Bljk_HHS_BH_UserArgs_MT256x256x32_MI16x16x1_SN_LDSB1_CLR1_GSU0_GSUC0_GSUWGMRR0_K1_LBSPPA2048_LBSPPB128_LPA32_MIWT8_8_PLR1_SU32_SUM0_SUS256_SKXCCM4_VWA2_VWB1_WGM4_WGMXCC1_WGMXCCGn1
    SolutionIndex: 45
    SolutionNameMin: Cijk_Ailk_Bljk_HHS_BH_UserArgs_MT256x256x32_MI16x16x1_SN_LDSB1_CLR1_GSU0_GSUC0_GSUWGMRR0_K1_LBSPPA2048_LBSPPB128_LPA0_MIWT8_8_PLR1_SU32_SUM0_SUS256_SKXCCM4_VWA4_VWB1_WGM4_WGMXCC1_WGMXCCGn1
    SolutionIndex: 46
    SolutionNameMin: Cijk_Ailk_Bljk_HHS_BH_UserArgs_MT256x256x32_MI16x16x1_SN_LDSB1_CLR1_GSU0_GSUC0_GSUWGMRR0_K1_LBSPPA2048_LBSPPB128_LPA0_MIWT8_8_PLR1_SU32_SUM0_SUS256_SKXCCM4_VWA8_VWB1_WGM4_WGMXCC1_WGMXCCGn1
    SolutionIndex: 47
    SolutionNameMin: Cijk_Ailk_Bljk_HHS_BH_UserArgs_MT256x256x32_MI16x16x1_SN_LDSB1_CLR1_GSU0_GSUC0_GSUWGMRR0_K1_LBSPPA2048_LBSPPB128_LPA0_MIWT8_8_PLR1_SU32_SUM0_SUS256_SKXCCM4_VWA4_VWB2_WGM4_WGMXCC1_WGMXCCGn1
    SolutionIndex: 48
    SolutionNameMin: Cijk_Ailk_Bljk_HHS_BH_UserArgs_MT256x256x32_MI16x16x1_SN_LDSB1_CLR1_GSU0_GSUC0_GSUWGMRR0_K1_LBSPPA2048_LBSPPB128_LPA0_MIWT8_8_PLR1_SU32_SUM0_SUS256_SKXCCM4_VWA8_VWB2_WGM4_WGMXCC1_WGMXCCGn1
    SolutionIndex: 49
    SolutionNameMin: Cijk_Ailk_Bljk_HHS_BH_UserArgs_MT256x256x32_MI16x16x1_SN_LDSB1_CLR1_GSU0_GSUC0_GSUWGMRR0_K1_LBSPPA2048_LBSPPB256_LPA0_MIWT8_8_PLR1_SU32_SUM0_SUS256_SKXCCM4_VWA4_VWB4_WGM4_WGMXCC1_WGMXCCGn1
    SolutionIndex: 50
    SolutionNameMin: Cijk_Ailk_Bljk_HHS_BH_UserArgs_MT256x256x32_MI16x16x1_SN_LDSB1_CLR1_GSU0_GSUC0_GSUWGMRR0_K1_LBSPPA2048_LBSPPB256_LPA0_MIWT8_8_PLR1_SU32_SUM0_SUS256_SKXCCM4_VWA8_VWB4_WGM4_WGMXCC1_WGMXCCGn1
    SolutionIndex: 51
    SolutionNameMin: Cijk_Ailk_Bljk_HHS_BH_UserArgs_MT256x256x32_MI16x16x1_SN_LDSB1_CLR1_GSU0_GSUC0_GSUWGMRR0_K1_LBSPPA2048_LBSPPB512_LPA0_MIWT8_8_PLR1_SU32_SUM0_SUS256_SKXCCM4_VWA4_VWB8_WGM4_WGMXCC1_WGMXCCGn1
    SolutionIndex: 52
    SolutionNameMin: Cijk_Ailk_Bljk_HHS_BH_UserArgs_MT256x256x32_MI16x16x1_SN_LDSB1_CLR1_GSU0_GSUC0_GSUWGMRR0_K1_LBSPPA2048_LBSPPB512_LPA0_MIWT8_8_PLR1_SU32_SUM0_SUS256_SKXCCM4_VWA8_VWB8_WGM4_WGMXCC1_WGMXCCGn1
    SolutionIndex: 53
    SolutionNameMin: Cijk_Ailk_Bljk_HHS_BH_UserArgs_MT128x256x32_MI16x16x1_SN_LDSB1_CLR1_GSU0_GSUC0_GSUWGMRR0_K1_LBSPPA1024_LBSPPB512_LPA0_MIWT4_8_PLR1_SU32_SUM0_SUS256_SKXCCM4_VWA4_VWB8_WGM1_WGMXCC1_WGMXCCGn1
    SolutionIndex: 54
    SolutionNameMin: Cijk_Ailk_Bljk_HHS_BH_UserArgs_MT256x128x32_MI16x16x1_SN_LDSB1_CLR1_GSU0_GSUC0_GSUWGMRR0_K1_LBSPPA2048_LBSPPB128_LPA0_MIWT8_4_PLR1_SU32_SUM0_SUS256_SKXCCM4_VWA4_VWB1_WGM1_WGMXCC1_WGMXCCGn1
    SolutionIndex: 55
    SolutionNameMin: Cijk_Ailk_Bljk_HHS_BH_UserArgs_MT256x128x32_MI16x16x1_SN_LDSB1_CLR1_GSU0_GSUC0_GSUWGMRR0_K1_LBSPPA2048_LBSPPB128_LPA0_MIWT8_4_PLR1_SU32_SUM0_SUS256_SKXCCM4_VWA8_VWB1_WGM1_WGMXCC1_WGMXCCGn1
    SolutionIndex: 56
    SolutionNameMin: Cijk_Ailk_Bljk_HHS_BH_UserArgs_MT256x128x32_MI16x16x1_SN_LDSB1_CLR1_GSU0_GSUC0_GSUWGMRR0_K1_LBSPPA2048_LBSPPB128_LPA0_MIWT8_4_PLR1_SU32_SUM0_SUS256_SKXCCM4_VWA4_VWB2_WGM1_WGMXCC1_WGMXCCGn1
    SolutionIndex: 57
    SolutionNameMin: Cijk_Ailk_Bljk_HHS_BH_UserArgs_MT256x128x32_MI16x16x1_SN_LDSB1_CLR1_GSU0_GSUC0_GSUWGMRR0_K1_LBSPPA2048_LBSPPB128_LPA0_MIWT8_4_PLR1_SU32_SUM0_SUS256_SKXCCM4_VWA8_VWB2_WGM1_WGMXCC1_WGMXCCGn1
    SolutionIndex: 58
    SolutionNameMin: Cijk_Ailk_Bljk_HHS_BH_UserArgs_MT256x128x32_MI16x16x1_SN_LDSB1_CLR1_GSU0_GSUC0_GSUWGMRR0_K1_LBSPPA2048_LBSPPB256_LPA0_MIWT8_4_PLR1_SU32_SUM0_SUS256_SKXCCM4_VWA4_VWB4_WGM1_WGMXCC1_WGMXCCGn1
    SolutionIndex: 59
    SolutionNameMin: Cijk_Ailk_Bljk_HHS_BH_UserArgs_MT256x128x32_MI16x16x1_SN_LDSB1_CLR1_GSU0_GSUC0_GSUWGMRR0_K1_LBSPPA2048_LBSPPB256_LPA0_MIWT8_4_PLR1_SU32_SUM0_SUS256_SKXCCM4_VWA8_VWB4_WGM1_WGMXCC1_WGMXCCGn1
    SolutionIndex: 60
    SolutionNameMin: Cijk_Ailk_Bljk_HHS_BH_UserArgs_MT256x128x32_MI16x16x1_SN_LDSB1_CLR1_GSU0_GSUC0_GSUWGMRR0_K1_LBSPPA2048_LBSPPB128_LPA0_MIWT8_4_PLR1_SU32_SUM0_SUS256_SKXCCM4_VWA4_VWB1_WGM2_WGMXCC1_WGMXCCGn1
    SolutionIndex: 61
    SolutionNameMin: Cijk_Ailk_Bljk_HHS_BH_UserArgs_MT256x128x32_MI16x16x1_SN_LDSB1_CLR1_GSU0_GSUC0_GSUWGMRR0_K1_LBSPPA2048_LBSPPB256_LPA0_MIWT8_4_PLR1_SU32_SUM0_SUS256_SKXCCM4_VWA8_VWB4_WGM2_WGMXCC1_WGMXCCGn1
    SolutionIndex: 62
    SolutionNameMin: Cijk_Ailk_Bljk_HHS_BH_UserArgs_MT256x128x32_MI16x16x1_SN_LDSB1_CLR1_GSU0_GSUC0_GSUWGMRR0_K1_LBSPPA2048_LBSPPB128_LPA0_MIWT8_4_PLR1_SU32_SUM0_SUS256_SKXCCM4_VWA4_VWB1_WGM4_WGMXCC1_WGMXCCGn1
    SolutionIndex: 63
    SolutionNameMin: Cijk_Ailk_Bljk_HHS_BH_UserArgs_MT128x64x32_MI16x16x1_SN_LDSB0_CLR1_GSU0_GSUC0_GSUWGMRR0_K1_LBSPPA1024_LBSPPB128_LPA0_MIWT4_2_PLR1_SU32_SUM0_SUS256_SKXCCM4_VWA4_VWB1_WGM1_WGMXCC1_WGMXCCGn1
    SolutionIndex: 64
    SolutionNameMin: Cijk_Ailk_Bljk_HHS_BH_UserArgs_MT128x64x32_MI16x16x1_SN_LDSB0_CLR1_GSU0_GSUC0_GSUWGMRR0_K1_LBSPPA1024_LBSPPB128_LPA32_MIWT4_2_PLR1_SU32_SUM0_SUS256_SKXCCM4_VWA2_VWB2_WGM1_WGMXCC1_WGMXCCGn1
    SolutionIndex: 65
    SolutionNameMin: Cijk_Ailk_Bljk_HHS_BH_UserArgs_MT128x64x32_MI16x16x1_SN_LDSB0_CLR1_GSU0_GSUC0_GSUWGMRR0_K1_LBSPPA1024_LBSPPB128_LPA0_MIWT4_2_PLR1_SU32_SUM0_SUS256_SKXCCM4_VWA4_VWB2_WGM1_WGMXCC1_WGMXCCGn1
    SolutionIndex: 66
    SolutionNameMin: Cijk_Ailk_Bljk_HHS_BH_UserArgs_MT128x256x64_MI16x16x1_SN_LDSB1_CLR1_GSU0_GSUC0_GSUWGMRR0_K1_LBSPPA2048_LBSPPB128_LPA0_MIWT4_8_PLR1_SU32_SUM0_SUS256_SKXCCM4_VWA4_VWB1_WGM1_WGMXCC1_WGMXCCGn1
    SolutionIndex: 67
    SolutionNameMin: Cijk_Ailk_Bljk_HHS_BH_UserArgs_MT128x256x64_MI16x16x1_SN_LDSB1_CLR1_GSU0_GSUC0_GSUWGMRR0_K1_LBSPPA2048_LBSPPB256_LPA0_MIWT4_8_PLR1_SU32_SUM0_SUS256_SKXCCM4_VWA4_VWB2_WGM1_WGMXCC1_WGMXCCGn1
    SolutionIndex: 68
    SolutionNameMin: Cijk_Ailk_Bljk_HHS_BH_UserArgs_MT128x256x64_MI16x16x1_SN_LDSB1_CLR1_GSU0_GSUC0_GSUWGMRR0_K1_LBSPPA2048_LBSPPB512_LPA32_MIWT4_8_PLR1_SU32_SUM0_SUS256_SKXCCM4_VWA2_VWB4_WGM1_WGMXCC1_WGMXCCGn1
    SolutionIndex: 69
    SolutionNameMin: Cijk_Ailk_Bljk_HHS_BH_UserArgs_MT128x256x64_MI16x16x1_SN_LDSB1_CLR1_GSU0_GSUC0_GSUWGMRR0_K1_LBSPPA2048_LBSPPB512_LPA0_MIWT4_8_PLR1_SU32_SUM0_SUS256_SKXCCM4_VWA4_VWB4_WGM1_WGMXCC1_WGMXCCGn1
    SolutionIndex: 70
    SolutionNameMin: Cijk_Ailk_Bljk_HHS_BH_UserArgs_MT128x256x64_MI16x16x1_SN_LDSB1_CLR1_GSU0_GSUC0_GSUWGMRR0_K1_LBSPPA2048_LBSPPB1024_LPA32_MIWT4_8_PLR1_SU32_SUM0_SUS256_SKXCCM4_VWA2_VWB8_WGM1_WGMXCC1_WGMXCCGn1
    SolutionIndex: 71
    SolutionNameMin: Cijk_Ailk_Bljk_HHS_BH_UserArgs_MT128x256x64_MI16x16x1_SN_LDSB1_CLR1_GSU0_GSUC0_GSUWGMRR0_K1_LBSPPA2048_LBSPPB1024_LPA0_MIWT4_8_PLR1_SU32_SUM0_SUS256_SKXCCM4_VWA4_VWB8_WGM1_WGMXCC1_WGMXCCGn1
    SolutionIndex: 72
    SolutionNameMin: Cijk_Ailk_Bljk_HHS_BH_UserArgs_MT128x256x64_MI16x16x1_SN_LDSB1_CLR1_GSU0_GSUC0_GSUWGMRR0_K1_LBSPPA2048_LBSPPB256_LPA32_MIWT4_8_PLR1_SU32_SUM0_SUS256_SKXCCM4_VWA2_VWB2_WGM2_WGMXCC1_WGMXCCGn1
    SolutionIndex: 73
    SolutionNameMin: Cijk_Ailk_Bljk_HHS_BH_UserArgs_MT128x256x64_MI16x16x1_SN_LDSB1_CLR1_GSU0_GSUC0_GSUWGMRR0_K1_LBSPPA2048_LBSPPB256_LPA0_MIWT4_8_PLR1_SU32_SUM0_SUS256_SKXCCM4_VWA4_VWB2_WGM2_WGMXCC1_WGMXCCGn1
    SolutionIndex: 74
    SolutionNameMin: Cijk_Ailk_Bljk_HHS_BH_UserArgs_MT128x256x64_MI16x16x1_SN_LDSB1_CLR1_GSU0_GSUC0_GSUWGMRR0_K1_LBSPPA2048_LBSPPB512_LPA0_MIWT4_8_PLR1_SU32_SUM0_SUS256_SKXCCM4_VWA4_VWB4_WGM2_WGMXCC1_WGMXCCGn1
    SolutionIndex: 75
    SolutionNameMin: Cijk_Ailk_Bljk_HHS_BH_UserArgs_MT128x256x64_MI16x16x1_SN_LDSB1_CLR1_GSU0_GSUC0_GSUWGMRR0_K1_LBSPPA2048_LBSPPB1024_LPA32_MIWT4_8_PLR1_SU32_SUM0_SUS256_SKXCCM4_VWA2_VWB8_WGM2_WGMXCC1_WGMXCCGn1
    SolutionIndex: 76
    SolutionNameMin: Cijk_Ailk_Bljk_HHS_BH_UserArgs_MT128x256x64_MI16x16x1_SN_LDSB1_CLR1_GSU0_GSUC0_GSUWGMRR0_K1_LBSPPA2048_LBSPPB512_LPA32_MIWT4_8_PLR1_SU32_SUM0_SUS256_SKXCCM4_VWA2_VWB4_WGM4_WGMXCC1_WGMXCCGn1
    SolutionIndex: 77
    SolutionNameMin: Cijk_Ailk_Bljk_HHS_BH_UserArgs_MT128x256x64_MI16x16x1_SN_LDSB1_CLR1_GSU0_GSUC0_GSUWGMRR0_K1_LBSPPA2048_LBSPPB1024_LPA32_MIWT4_8_PLR1_SU32_SUM0_SUS256_SKXCCM4_VWA2_VWB8_WGM4_WGMXCC1_WGMXCCGn1
    SolutionIndex: 78
    SolutionNameMin: Cijk_Ailk_Bljk_HHS_BH_UserArgs_MT128x256x64_MI16x16x1_SN_LDSB1_CLR1_GSU0_GSUC0_GSUWGMRR0_K1_LBSPPA2048_LBSPPB1024_LPA0_MIWT4_8_PLR1_SU32_SUM0_SUS256_SKXCCM4_VWA4_VWB8_WGM4_WGMXCC1_WGMXCCGn1
    SolutionIndex: 79
    SolutionNameMin: Cijk_Ailk_Bljk_HHS_BH_UserArgs_MT256x128x64_MI16x16x1_SN_LDSB1_CLR1_GSU0_GSUC0_GSUWGMRR0_K1_LBSPPA4096_LBSPPB128_LPA32_MIWT8_4_PLR1_SU32_SUM0_SUS256_SKXCCM4_VWA2_VWB1_WGM1_WGMXCC1_WGMXCCGn1
    SolutionIndex: 80
    SolutionNameMin: Cijk_Ailk_Bljk_HHS_BH_UserArgs_MT256x128x64_MI16x16x1_SN_LDSB1_CLR1_GSU0_GSUC0_GSUWGMRR0_K1_LBSPPA4096_LBSPPB128_LPA0_MIWT8_4_PLR1_SU32_SUM0_SUS256_SKXCCM4_VWA4_VWB1_WGM1_WGMXCC1_WGMXCCGn1
    SolutionIndex: 81
    SolutionNameMin: Cijk_Ailk_Bljk_HHS_BH_UserArgs_MT256x128x64_MI16x16x1_SN_LDSB1_CLR1_GSU0_GSUC0_GSUWGMRR0_K1_LBSPPA4096_LBSPPB128_LPA0_MIWT8_4_PLR1_SU32_SUM0_SUS256_SKXCCM4_VWA4_VWB1_WGM2_WGMXCC1_WGMXCCGn1
    SolutionIndex: 82
    SolutionNameMin: Cijk_Ailk_Bljk_HHS_BH_UserArgs_MT256x128x64_MI16x16x1_SN_LDSB1_CLR1_GSU0_GSUC0_GSUWGMRR0_K1_LBSPPA4096_LBSPPB512_LPA32_MIWT8_4_PLR1_SU32_SUM0_SUS256_SKXCCM4_VWA2_VWB4_WGM4_WGMXCC1_WGMXCCGn1
    SolutionIndex: 83
    SolutionNameMin: Cijk_Ailk_Bljk_HHS_BH_UserArgs_MT128x128x64_MI16x16x1_SN_LDSB1_CLR1_GSU0_GSUC0_GSUWGMRR0_K1_LBSPPA2048_LBSPPB128_LPA32_MIWT4_4_PLR1_SU32_SUM0_SUS256_SKXCCM4_VWA2_VWB1_WGM1_WGMXCC1_WGMXCCGn1
    SolutionIndex: 84
    SolutionNameMin: Cijk_Ailk_Bljk_HHS_BH_UserArgs_MT128x128x64_MI16x16x1_SN_LDSB1_CLR1_GSU0_GSUC0_GSUWGMRR0_K1_LBSPPA2048_LBSPPB128_LPA0_MIWT4_4_PLR1_SU32_SUM0_SUS256_SKXCCM4_VWA4_VWB1_WGM1_WGMXCC1_WGMXCCGn1
    SolutionIndex: 85
    SolutionNameMin: Cijk_Ailk_Bljk_HHS_BH_UserArgs_MT128x128x64_MI16x16x1_SN_LDSB1_CLR1_GSU0_GSUC0_GSUWGMRR0_K1_LBSPPA2048_LBSPPB256_LPA32_MIWT4_4_PLR1_SU32_SUM0_SUS256_SKXCCM4_VWA2_VWB2_WGM1_WGMXCC1_WGMXCCGn1
    SolutionIndex: 86
    SolutionNameMin: Cijk_Ailk_Bljk_HHS_BH_UserArgs_MT128x128x64_MI16x16x1_SN_LDSB1_CLR1_GSU0_GSUC0_GSUWGMRR0_K1_LBSPPA2048_LBSPPB256_LPA0_MIWT4_4_PLR1_SU32_SUM0_SUS256_SKXCCM4_VWA4_VWB2_WGM1_WGMXCC1_WGMXCCGn1
    SolutionIndex: 87
    SolutionNameMin: Cijk_Ailk_Bljk_HHS_BH_UserArgs_MT128x128x64_MI16x16x1_SN_LDSB1_CLR1_GSU0_GSUC0_GSUWGMRR0_K1_LBSPPA2048_LBSPPB512_LPA32_MIWT4_4_PLR1_SU32_SUM0_SUS256_SKXCCM4_VWA2_VWB4_WGM1_WGMXCC1_WGMXCCGn1
    SolutionIndex: 88
    SolutionNameMin: Cijk_Ailk_Bljk_HHS_BH_UserArgs_MT128x128x64_MI16x16x1_SN_LDSB1_CLR1_GSU0_GSUC0_GSUWGMRR0_K1_LBSPPA2048_LBSPPB512_LPA0_MIWT4_4_PLR1_SU32_SUM0_SUS256_SKXCCM4_VWA4_VWB4_WGM1_WGMXCC1_WGMXCCGn1
    SolutionIndex: 89
    SolutionNameMin: Cijk_Ailk_Bljk_HHS_BH_UserArgs_MT128x128x64_MI16x16x1_SN_LDSB1_CLR1_GSU0_GSUC0_GSUWGMRR0_K1_LBSPPA2048_LBSPPB128_LPA0_MIWT4_4_PLR1_SU32_SUM0_SUS256_SKXCCM4_VWA4_VWB1_WGM2_WGMXCC1_WGMXCCGn1
    SolutionIndex: 90
    SolutionNameMin: Cijk_Ailk_Bljk_HHS_BH_UserArgs_MT128x128x64_MI16x16x1_SN_LDSB1_CLR1_GSU0_GSUC0_GSUWGMRR0_K1_LBSPPA2048_LBSPPB512_LPA0_MIWT4_4_PLR1_SU32_SUM0_SUS256_SKXCCM4_VWA4_VWB4_WGM2_WGMXCC1_WGMXCCGn1
    SolutionIndex: 91
    SolutionNameMin: Cijk_Ailk_Bljk_HHS_BH_UserArgs_MT128x128x64_MI16x16x1_SN_LDSB1_CLR1_GSU0_GSUC0_GSUWGMRR0_K1_LBSPPA2048_LBSPPB128_LPA0_MIWT4_4_PLR1_SU32_SUM0_SUS256_SKXCCM4_VWA4_VWB1_WGM4_WGMXCC1_WGMXCCGn1
    SolutionIndex: 92
    SolutionNameMin: Cijk_Ailk_Bljk_HHS_BH_UserArgs_MT128x128x64_MI16x16x1_SN_LDSB1_CLR1_GSU0_GSUC0_GSUWGMRR0_K1_LBSPPA2048_LBSPPB512_LPA0_MIWT4_4_PLR1_SU32_SUM0_SUS256_SKXCCM4_VWA4_VWB4_WGM4_WGMXCC1_WGMXCCGn1
    SolutionIndex: 93
    SolutionNameMin: Cijk_Ailk_Bljk_HHS_BH_UserArgs_MT64x128x64_MI16x16x1_SN_LDSB1_CLR1_GSU0_GSUC0_GSUWGMRR0_K1_LBSPPA1024_LBSPPB128_LPA32_MIWT2_4_PLR1_SU32_SUM0_SUS256_SKXCCM4_VWA2_VWB1_WGM1_WGMXCC1_WGMXCCGn1
    SolutionIndex: 94
    SolutionNameMin: Cijk_Ailk_Bljk_HHS_BH_UserArgs_MT128x64x64_MI16x16x1_SN_LDSB1_CLR1_GSU0_GSUC0_GSUWGMRR0_K1_LBSPPA2048_LBSPPB128_LPA0_MIWT4_2_PLR1_SU32_SUM0_SUS256_SKXCCM4_VWA4_VWB1_WGM1_WGMXCC1_WGMXCCGn1
    SolutionIndex: 95
    SolutionNameMin: Cijk_Ailk_Bljk_HHS_BH_UserArgs_MT128x64x64_MI16x16x1_SN_LDSB1_CLR1_GSU0_GSUC0_GSUWGMRR0_K1_LBSPPA2048_LBSPPB256_LPA0_MIWT4_2_PLR1_SU32_SUM0_SUS256_SKXCCM4_VWA4_VWB2_WGM1_WGMXCC1_WGMXCCGn1
    SolutionIndex: 96
    SolutionNameMin: Cijk_Ailk_Bljk_HHS_BH_UserArgs_MT64x64x64_MI16x16x1_SN_LDSB1_CLR1_GSU0_GSUC0_GSUWGMRR0_K1_LBSPPA1024_LBSPPB128_LPA32_MIWT2_2_PLR1_SU32_SUM0_SUS256_SKXCCM4_VWA2_VWB1_WGM1_WGMXCC1_WGMXCCGn1
    SolutionIndex: 97
    SolutionNameMin: Cijk_Ailk_Bljk_HHS_BH_UserArgs_MT64x64x64_MI16x16x1_SN_LDSB1_CLR1_GSU0_GSUC0_GSUWGMRR0_K1_LBSPPA1024_LBSPPB256_LPA32_MIWT2_2_PLR1_SU32_SUM0_SUS256_SKXCCM4_VWA2_VWB2_WGM1_WGMXCC1_WGMXCCGn1
    SolutionIndex: 98
    SolutionNameMin: Cijk_Ailk_Bljk_HHS_BH_UserArgs_MT32x64x64_MI16x16x1_SN_LDSB0_CLR1_GSU0_GSUC0_GSUWGMRR0_K1_LBSPPA512_LBSPPB128_LPA16_MIWT1_2_PLR1_SU32_SUM0_SUS256_SKXCCM4_VWA1_VWB1_WGM1_WGMXCC1_WGMXCCGn1
    SolutionIndex: 99
    SolutionNameMin: Cijk_Ailk_Bljk_HHS_BH_UserArgs_MT64x32x64_MI16x16x1_SN_LDSB0_CLR1_GSU0_GSUC0_GSUWGMRR0_K1_LBSPPA1024_LBSPPB128_LPA32_MIWT2_1_PLR1_SU32_SUM0_SUS256_SKXCCM4_VWA2_VWB1_WGM1_WGMXCC1_WGMXCCGn1
    SolutionIndex: 100
    SolutionNameMin: Cijk_Ailk_Bljk_HHS_BH_UserArgs_MT32x32x64_MI16x16x1_SN_LDSB0_CLR1_GSU0_GSUC0_GSUWGMRR0_K1_LBSPPA512_LBSPPB128_LPA16_MIWT1_1_PLR1_SU32_SUM0_SUS256_SKXCCM4_VWA1_VWB1_WGM1_WGMXCC1_WGMXCCGn1
    SolutionIndex: 101
    SolutionNameMin: Cijk_Ailk_Bljk_HHS_BH_UserArgs_MT64x128x128_MI16x16x1_SN_LDSB1_CLR1_GSU0_GSUC0_GSUWGMRR0_K1_LBSPPA1024_LBSPPB256_LPA32_MIWT2_4_PLR2_SU32_SUM0_SUS256_SKXCCM4_VWA2_VWB1_WGM1_WGMXCC1_WGMXCCGn1
    SolutionIndex: 102
    SolutionNameMin: Cijk_Ailk_Bljk_HHS_BH_UserArgs_MT64x128x128_MI16x16x1_SN_LDSB1_CLR1_GSU0_GSUC0_GSUWGMRR0_K1_LBSPPA1024_LBSPPB1024_LPA32_MIWT2_4_PLR2_SU32_SUM0_SUS256_SKXCCM4_VWA2_VWB4_WGM1_WGMXCC1_WGMXCCGn1
    SolutionIndex: 103
    SolutionNameMin: Cijk_Ailk_Bljk_HHS_BH_UserArgs_MT128x64x128_MI16x16x1_SN_LDSB1_CLR1_GSU0_GSUC0_GSUWGMRR0_K1_LBSPPA2048_LBSPPB512_LPA0_MIWT4_2_PLR1_SU32_SUM0_SUS256_SKXCCM4_VWA4_VWB2_WGM1_WGMXCC1_WGMXCCGn1
    SolutionIndex: 104
    SolutionNameMin: Cijk_Ailk_Bljk_HHS_BH_UserArgs_MT128x64x128_MI16x16x1_SN_LDSB1_CLR1_GSU0_GSUC0_GSUWGMRR0_K1_LBSPPA2048_LBSPPB256_LPA0_MIWT4_2_PLR2_SU32_SUM0_SUS256_SKXCCM4_VWA4_VWB1_WGM1_WGMXCC1_WGMXCCGn1
    SolutionIndex: 105
    SolutionNameMin: Cijk_Ailk_Bljk_HHS_BH_UserArgs_MT128x64x128_MI16x16x1_SN_LDSB1_CLR1_GSU0_GSUC0_GSUWGMRR0_K1_LBSPPA2048_LBSPPB512_LPA0_MIWT4_2_PLR2_SU32_SUM0_SUS256_SKXCCM4_VWA4_VWB2_WGM1_WGMXCC1_WGMXCCGn1
    SolutionIndex: 106
    SolutionNameMin: Cijk_Ailk_Bljk_HHS_BH_UserArgs_MT64x64x128_MI16x16x1_SN_LDSB1_CLR1_GSU0_GSUC0_GSUWGMRR0_K1_LBSPPA1024_LBSPPB256_LPA32_MIWT2_2_PLR2_SU32_SUM0_SUS256_SKXCCM4_VWA2_VWB1_WGM1_WGMXCC1_WGMXCCGn1
    SolutionIndex: 107
    SolutionNameMin: Cijk_Ailk_Bljk_HHS_BH_UserArgs_MT64x64x128_MI16x16x1_SN_LDSB1_CLR1_GSU0_GSUC0_GSUWGMRR0_K1_LBSPPA1024_LBSPPB512_LPA32_MIWT2_2_PLR2_SU32_SUM0_SUS256_SKXCCM4_VWA2_VWB2_WGM1_WGMXCC1_WGMXCCGn1
    SolutionIndex: 108
    SolutionNameMin: Cijk_Ailk_Bljk_HHS_BH_UserArgs_MT64x32x128_MI16x16x1_SN_LDSB1_CLR1_GSU0_GSUC0_GSUWGMRR0_K1_LBSPPA1024_LBSPPB256_LPA32_MIWT2_1_PLR2_SU32_SUM0_SUS256_SKXCCM4_VWA2_VWB1_WGM1_WGMXCC1_WGMXCCGn1
    SolutionIndex: 109
    SolutionNameMin: Cijk_Ailk_Bljk_HHS_BH_UserArgs_MT32x32x128_MI16x16x1_SN_LDSB1_CLR1_GSU0_GSUC0_GSUWGMRR0_K1_LBSPPA512_LBSPPB256_LPA16_MIWT1_1_PLR1_SU32_SUM0_SUS256_SKXCCM4_VWA1_VWB1_WGM1_WGMXCC1_WGMXCCGn1
    SolutionIndex: 110
    SolutionNameMin: Cijk_Ailk_Bljk_HHS_BH_UserArgs_MT32x32x128_MI16x16x1_SN_LDSB1_CLR1_GSU0_GSUC0_GSUWGMRR0_K1_LBSPPA512_LBSPPB256_LPA16_MIWT1_1_PLR2_SU32_SUM0_SUS256_SKXCCM4_VWA1_VWB1_WGM1_WGMXCC1_WGMXCCGn1
    SolutionIndex: 111
    SolutionNameMin: Cijk_Ailk_Bljk_HHS_BH_UserArgs_MT32x32x32_MI16x16x1_SN_LDSB0_CLR0_GSU0_GSUC0_GSUWGMRR0_K1_LBSPPA256_LBSPPB128_LPA16_MIWT1_1_PLR0_SU32_SUM0_SUS256_SKXCCM0_VWA1_VWB1_WGM1_WGMXCC1_WGMXCCGn1
- - - [128, 128, 1, 128, 128, 128, 128, 128]
    - [100, 0.089]
  - - [128, 128, 1, 256, 128, 128, 128, 256]
    - [100, 0.161]
  - - [128, 128, 1, 512, 128, 128, 128, 512]
    - [110, 0.267]
  - - [128, 128, 1, 1024, 128, 128, 128, 1024]
    - [109, 0.4]
  - - [128, 128, 1, 2048, 128, 128, 128, 2048]
    - [27, 0.605]
  - - [128, 128, 1, 4096, 128, 128, 128, 4096]
    - [15, 1.045]
  - - [128, 128, 1, 8192, 128, 128, 128, 8192]
    - [27, 1.593]
  - - [128, 256, 1, 128, 128, 128, 128, 128]
    - [100, 0.176]
  - - [128, 256, 1, 256, 128, 128, 128, 256]
    - [100, 0.319]
  - - [128, 256, 1, 512, 128, 128, 128, 512]
    - [110, 0.525]
  - - [128, 256, 1, 1024, 128, 128, 128, 1024]
    - [28, 0.791]
  - - [128, 256, 1, 2048, 128, 128, 128, 2048]
    - [27, 1.198]
  - - [128, 256, 1, 4096, 128, 128, 128, 4096]
    - [99, 1.794]
  - - [128, 256, 1, 8192, 128, 128, 128, 8192]
    - [108, 2.812]
  - - [128, 512, 1, 128, 128, 128, 128, 128]
    - [100, 0.35]
  - - [128, 512, 1, 256, 128, 128, 128, 256]
    - [100, 0.632]
  - - [128, 512, 1, 512, 128, 128, 128, 512]
    - [27, 1.035]
  - - [128, 512, 1, 1024, 128, 128, 128, 1024]
    - [27, 1.567]
  - - [128, 512, 1, 2048, 128, 128, 128, 2048]
    - [26, 2.112]
  - - [128, 512, 1, 4096, 128, 128, 128, 4096]
    - [26, 3.041]
  - - [128, 512, 1, 8192, 128, 128, 128, 8192]
    - [107, 4.599]
  - - [128, 1024, 1, 128, 128, 128, 128, 128]
    - [108, 0.648]
  - - [128, 1024, 1, 256, 128, 128, 128, 256]
    - [26, 1.15]
  - - [128, 1024, 1, 512, 128, 128, 128, 512]
    - [108, 1.897]
  - - [128, 1024, 1, 1024, 128, 128, 128, 1024]
    - [108, 2.83]
  - - [128, 1024, 1, 2048, 128, 128, 128, 2048]
    - [108, 3.71]
  - - [128, 1024, 1, 4096, 128, 128, 128, 4096]
    - [24, 5.047]
  - - [128, 1024, 1, 8192, 128, 128, 128, 8192]
    - [105, 7.152]
  - - [128, 2048, 1, 128, 128, 128, 128, 128]
    - [97, 1.199]
  - - [128, 2048, 1, 256, 128, 128, 128, 256]
    - [96, 2.045]
  - - [128, 2048, 1, 512, 128, 128, 128, 512]
    - [25, 3.311]
  - - [128, 2048, 1, 1024, 128, 128, 128, 1024]
    - [107, 4.791]
  - - [128, 2048, 1, 2048, 128, 128, 128, 2048]
    - [107, 6.151]
  - - [128, 2048, 1, 4096, 128, 128, 128, 4096]
    - [105, 7.717]
  - - [128, 2048, 1, 8192, 128, 128, 128, 8192]
    - [84, 10.042]
  - - [128, 4096, 1, 128, 128, 128, 128, 128]
    - [65, 2.026]
  - - [128, 4096, 1, 256, 128, 128, 128, 256]
    - [12, 3.405]
  - - [128, 4096, 1, 512, 128, 128, 128, 512]
    - [94, 5.175]
  - - [128, 4096, 1, 1024, 128, 128, 128, 1024]
    - [105, 7.291]
  - - [128, 4096, 1, 2048, 128, 128, 128, 2048]
    - [105, 8.914]
  - - [128, 4096, 1, 4096, 128, 128, 128, 4096]
    - [84, 10.865]
  - - [128, 4096, 1, 8192, 128, 128, 128, 8192]
    - [8, 13.68]
  - - [128, 8192, 1, 128, 128, 128, 128, 128]
    - [85, 3.181]
  - - [128, 8192, 1, 256, 128, 128, 128, 256]
    - [85, 5.283]
  - - [128, 8192, 1, 512, 128, 128, 128, 512]
    - [85, 7.827]
  - - [128, 8192, 1, 1024, 128, 128, 128, 1024]
    - [84, 10.053]
  - - [128, 8192, 1, 2048, 128, 128, 128, 2048]
    - [84, 11.11]
  - - [128, 8192, 1, 4096, 128, 128, 128, 4096]
    - [86, 14.022]
  - - [128, 8192, 1, 8192, 128, 128, 128, 8192]
    - [88, 15.333]
  - - [256, 128, 1, 128, 256, 256, 256, 128]
    - [100, 0.175]
  - - [256, 128, 1, 256, 256, 256, 256, 256]
    - [100, 0.318]
  - - [256, 128, 1, 512, 256, 256, 256, 512]
    - [27, 0.525]
  - - [256, 128, 1, 1024, 256, 256, 256, 1024]
    - [27, 0.791]
  - - [256, 128, 1, 2048, 256, 256, 256, 2048]
    - [27, 1.202]
  - - [256, 128, 1, 4096, 256, 256, 256, 4096]
    - [98, 1.783]
  - - [256, 128, 1, 8192, 256, 256, 256, 8192]
    - [26, 2.695]
  - - [256, 256, 1, 128, 256, 256, 256, 128]
    - [100, 0.35]
  - - [256, 256, 1, 256, 256, 256, 256, 256]
    - [100, 0.632]
  - - [256, 256, 1, 512, 256, 256, 256, 512]
    - [100, 1.034]
  - - [256, 256, 1, 1024, 256, 256, 256, 1024]
    - [28, 1.568]
  - - [256, 256, 1, 2048, 256, 256, 256, 2048]
    - [26, 2.114]
  - - [256, 256, 1, 4096, 256, 256, 256, 4096]
    - [108, 3.038]
  - - [256, 256, 1, 8192, 256, 256, 256, 8192]
    - [25, 4.213]
  - - [256, 512, 1, 128, 256, 256, 256, 128]
    - [99, 0.655]
  - - [256, 512, 1, 256, 256, 256, 256, 256]
    - [26, 1.147]
  - - [256, 512, 1, 512, 256, 256, 256, 512]
    - [108, 1.893]
  - - [256, 512, 1, 1024, 256, 256, 256, 1024]
    - [26, 2.841]
  - - [256, 512, 1, 2048, 256, 256, 256, 2048]
    - [26, 3.731]
  - - [256, 512, 1, 4096, 256, 256, 256, 4096]
    - [107, 5.053]
  - - [256, 512, 1, 8192, 256, 256, 256, 8192]
    - [22, 6.888]
  - - [256, 1024, 1, 128, 256, 256, 256, 128]
    - [96, 1.203]
  - - [256, 1024, 1, 256, 256, 256, 256, 256]
    - [13, 2.055]
  - - [256, 1024, 1, 512, 256, 256, 256, 512]
    - [25, 3.301]
  - - [256, 1024, 1, 1024, 256, 256, 256, 1024]
    - [106, 4.745]
  - - [256, 1024, 1, 2048, 256, 256, 256, 2048]
    - [107, 6.136]
  - - [256, 1024, 1, 4096, 256, 256, 256, 4096]
    - [23, 7.697]
  - - [256, 1024, 1, 8192, 256, 256, 256, 8192]
    - [84, 9.985]
  - - [256, 2048, 1, 128, 256, 256, 256, 128]
    - [63, 2.005]
  - - [256, 2048, 1, 256, 256, 256, 256, 256]
    - [93, 3.364]
  - - [256, 2048, 1, 512, 256, 256, 256, 512]
    - [95, 5.159]
  - - [256, 2048, 1, 1024, 256, 256, 256, 1024]
    - [102, 7.24]
  - - [256, 2048, 1, 2048, 256, 256, 256, 2048]
    - [101, 9.082]
  - - [256, 2048, 1, 4096, 256, 256, 256, 4096]
    - [84, 10.847]
  - - [256, 2048, 1, 8192, 256, 256, 256, 8192]
    - [86, 13.648]
  - - [256, 4096, 1, 128, 256, 256, 256, 128]
    - [83, 3.146]
  - - [256, 4096, 1, 256, 256, 256, 256, 256]
    - [83, 5.251]
  - - [256, 4096, 1, 512, 256, 256, 256, 512]
    - [86, 7.799]
  - - [256, 4096, 1, 1024, 256, 256, 256, 1024]
    - [84, 10.404]
  - - [256, 4096, 1, 2048, 256, 256, 256, 2048]
    - [91, 11.263]
  - - [256, 4096, 1, 4096, 256, 256, 256, 4096]
    - [91, 13.962]
  - - [256, 4096, 1, 8192, 256, 256, 256, 8192]
    - [89, 15.453]
  - - [256, 8192, 1, 128, 256, 256, 256, 128]
    - [59, 4.591]
  - - [256, 8192, 1, 256, 256, 256, 256, 256]
    - [59, 7.139]
  - - [256, 8192, 1, 512, 256, 256, 256, 512]
    - [55, 9.718]
  - - [256, 8192, 1, 1024, 256, 256, 256, 1024]
    - [79, 12.059]
  - - [256, 8192, 1, 2048, 256, 256, 256, 2048]
    - [86, 13.251]
  - - [256, 8192, 1, 4096, 256, 256, 256, 4096]
    - [81, 15.403]
  - - [256, 8192, 1, 8192, 256, 256, 256, 8192]
    - [42, 16.683]
  - - [512, 128, 1, 128, 512, 512, 512, 128]
    - [100, 0.35]
  - - [512, 128, 1, 256, 512, 512, 512, 256]
    - [15, 0.615]
  - - [512, 128, 1, 512, 512, 512, 512, 512]
    - [27, 1.034]
  - - [512, 128, 1, 1024, 512, 512, 512, 1024]
    - [28, 1.564]
  - - [512, 128, 1, 2048, 512, 512, 512, 2048]
    - [26, 2.111]
  - - [512, 128, 1, 4096, 512, 512, 512, 4096]
    - [26, 3.043]
  - - [512, 128, 1, 8192, 512, 512, 512, 8192]
    - [25, 4.225]
  - - [512, 256, 1, 128, 512, 512, 512, 128]
    - [99, 0.656]
  - - [512, 256, 1, 256, 512, 512, 512, 256]
    - [14, 1.152]
  - - [512, 256, 1, 512, 512, 512, 512, 512]
    - [26, 1.892]
  - - [512, 256, 1, 1024, 512, 512, 512, 1024]
    - [108, 2.838]
  - - [512, 256, 1, 2048, 512, 512, 512, 2048]
    - [108, 3.729]
  - - [512, 256, 1, 4096, 512, 512, 512, 4096]
    - [24, 4.998]
  - - [512, 256, 1, 8192, 512, 512, 512, 8192]
    - [19, 6.921]
  - - [512, 512, 1, 128, 512, 512, 512, 128]
    - [96, 1.191]
  - - [512, 512, 1, 256, 512, 512, 512, 256]
    - [96, 2.046]
  - - [512, 512, 1, 512, 512, 512, 512, 512]
    - [24, 3.275]
  - - [512, 512, 1, 1024, 512, 512, 512, 1024]
    - [107, 4.768]
  - - [512, 512, 1, 2048, 512, 512, 512, 2048]
    - [25, 6.122]
  - - [512, 512, 1, 4096, 512, 512, 512, 4096]
    - [21, 7.672]
  - - [512, 512, 1, 8192, 512, 512, 512, 8192]
    - [84, 10.086]
  - - [512, 1024, 1, 128, 512, 512, 512, 128]
    - [64, 2.028]
  - - [512, 1024, 1, 256, 512, 512, 512, 256]
    - [95, 3.442]
  - - [512, 1024, 1, 512, 512, 512, 512, 512]
    - [94, 5.196]
  - - [512, 1024, 1, 1024, 512, 512, 512, 1024]
    - [103, 7.276]
  - - [512, 1024, 1, 2048, 512, 512, 512, 2048]
    - [104, 9.104]
  - - [512, 1024, 1, 4096, 512, 512, 512, 4096]
    - [88, 10.835]
  - - [512, 1024, 1, 8192, 512, 512, 512, 8192]
    - [90, 13.649]
  - - [512, 2048, 1, 128, 512, 512, 512, 128]
    - [85, 3.179]
  - - [512, 2048, 1, 256, 512, 512, 512, 256]
    - [87, 5.268]
  - - [512, 2048, 1, 512, 512, 512, 512, 512]
    - [87, 7.862]
  - - [512, 2048, 1, 1024, 512, 512, 512, 1024]
    - [88, 10.377]
  - - [512, 2048, 1, 2048, 512, 512, 512, 2048]
    - [88, 11.403]
  - - [512, 2048, 1, 4096, 512, 512, 512, 4096]
    - [91, 14.047]
  - - [512, 2048, 1, 8192, 512, 512, 512, 8192]
    - [89, 15.381]
  - - [512, 4096, 1, 128, 512, 512, 512, 128]
    - [57, 4.644]
  - - [512, 4096, 1, 256, 512, 512, 512, 256]
    - [57, 7.162]
  - - [512, 4096, 1, 512, 512, 512, 512, 512]
    - [68, 9.891]
  - - [512, 4096, 1, 1024, 512, 512, 512, 1024]
    - [70, 12.218]
  - - [512, 4096, 1, 2048, 512, 512, 512, 2048]
    - [92, 13.267]
  - - [512, 4096, 1, 4096, 512, 512, 512, 4096]
    - [73, 15.444]
  - - [512, 4096, 1, 8192, 512, 512, 512, 8192]
    - [78, 16.909]
  - - [512, 8192, 1, 128, 512, 512, 512, 128]
    - [35, 5.734]
  - - [512, 8192, 1, 256, 512, 512, 512, 256]
    - [35, 8.523]
  - - [512, 8192, 1, 512, 512, 512, 512, 512]
    - [3, 11.533]
  - - [512, 8192, 1, 1024, 512, 512, 512, 1024]
    - [56, 12.703]
  - - [512, 8192, 1, 2048, 512, 512, 512, 2048]
    - [80, 14.915]
  - - [512, 8192, 1, 4096, 512, 512, 512, 4096]
    - [51, 16.946]
  - - [512, 8192, 1, 8192, 512, 512, 512, 8192]
    - [51, 18.713]
  - - [1024, 128, 1, 128, 1024, 1024, 1024, 128]
    - [14, 0.668]
  - - [1024, 128, 1, 256, 1024, 1024, 1024, 256]
    - [108, 1.158]
  - - [1024, 128, 1, 512, 1024, 1024, 1024, 512]
    - [108, 1.913]
  - - [1024, 128, 1, 1024, 1024, 1024, 1024, 1024]
    - [26, 2.85]
  - - [1024, 128, 1, 2048, 1024, 1024, 1024, 2048]
    - [26, 3.722]
  - - [1024, 128, 1, 4096, 1024, 1024, 1024, 4096]
    - [24, 5.002]
  - - [1024, 128, 1, 8192, 1024, 1024, 1024, 8192]
    - [20, 7.055]
  - - [1024, 256, 1, 128, 1024, 1024, 1024, 128]
    - [96, 1.202]
  - - [1024, 256, 1, 256, 1024, 1024, 1024, 256]
    - [96, 2.076]
  - - [1024, 256, 1, 512, 1024, 1024, 1024, 512]
    - [25, 3.323]
  - - [1024, 256, 1, 1024, 1024, 1024, 1024, 1024]
    - [24, 4.794]
  - - [1024, 256, 1, 2048, 1024, 1024, 1024, 2048]
    - [24, 6.134]
  - - [1024, 256, 1, 4096, 1024, 1024, 1024, 4096]
    - [88, 7.29]
  - - [1024, 256, 1, 8192, 1024, 1024, 1024, 8192]
    - [91, 9.856]
  - - [1024, 512, 1, 128, 1024, 1024, 1024, 128]
    - [95, 2.031]
  - - [1024, 512, 1, 256, 1024, 1024, 1024, 256]
    - [94, 3.41]
  - - [1024, 512, 1, 512, 1024, 1024, 1024, 512]
    - [105, 5.201]
  - - [1024, 512, 1, 1024, 1024, 1024, 1024, 1024]
    - [105, 7.303]
  - - [1024, 512, 1, 2048, 1024, 1024, 1024, 2048]
    - [18, 9.001]
  - - [1024, 512, 1, 4096, 1024, 1024, 1024, 4096]
    - [84, 10.922]
  - - [1024, 512, 1, 8192, 1024, 1024, 1024, 8192]
    - [84, 13.754]
  - - [1024, 1024, 1, 128, 1024, 1024, 1024, 128]
    - [85, 3.193]
  - - [1024, 1024, 1, 256, 1024, 1024, 1024, 256]
    - [87, 5.295]
  - - [1024, 1024, 1, 512, 1024, 1024, 1024, 512]
    - [86, 7.864]
  - - [1024, 1024, 1, 1024, 1024, 1024, 1024, 1024]
    - [86, 10.4]
  - - [1024, 1024, 1, 2048, 1024, 1024, 1024, 2048]
    - [84, 11.375]
  - - [1024, 1024, 1, 4096, 1024, 1024, 1024, 4096]
    - [84, 13.879]
  - - [1024, 1024, 1, 8192, 1024, 1024, 1024, 8192]
    - [84, 15.355]
  - - [1024, 2048, 1, 128, 1024, 1024, 1024, 128]
    - [57, 4.616]
  - - [1024, 2048, 1, 256, 1024, 1024, 1024, 256]
    - [59, 7.178]
  - - [1024, 2048, 1, 512, 1024, 1024, 1024, 512]
    - [53, 9.898]
  - - [1024, 2048, 1, 1024, 1024, 1024, 1024, 1024]
    - [70, 12.213]
  - - [1024, 2048, 1, 2048, 1024, 1024, 1024, 2048]
    - [54, 13.271]
  - - [1024, 2048, 1, 4096, 1024, 1024, 1024, 4096]
    - [74, 15.469]
  - - [1024, 2048, 1, 8192, 1024, 1024, 1024, 8192]
    - [34, 16.739]
  - - [1024, 4096, 1, 128, 1024, 1024, 1024, 128]
    - [4, 5.776]
  - - [1024, 4096, 1, 256, 1024, 1024, 1024, 256]
    - [4, 8.645]
  - - [1024, 4096, 1, 512, 1024, 1024, 1024, 512]
    - [4, 11.664]
  - - [1024, 4096, 1, 1024, 1024, 1024, 1024, 1024]
    - [62, 12.784]
  - - [1024, 4096, 1, 2048, 1024, 1024, 1024, 2048]
    - [54, 14.851]
  - - [1024, 4096, 1, 4096, 1024, 1024, 1024, 4096]
    - [45, 16.801]
  - - [1024, 4096, 1, 8192, 1024, 1024, 1024, 8192]
    - [40, 18.662]
  - - [1024, 8192, 1, 128, 1024, 1024, 1024, 128]
    - [54, 5.107]
  - - [1024, 8192, 1, 256, 1024, 1024, 1024, 256]
    - [54, 8.191]
  - - [1024, 8192, 1, 512, 1024, 1024, 1024, 512]
    - [67, 11.253]
  - - [1024, 8192, 1, 1024, 1024, 1024, 1024, 1024]
    - [32, 14.133]
  - - [1024, 8192, 1, 2048, 1024, 1024, 1024, 2048]
    - [45, 16.57]
  - - [1024, 8192, 1, 4096, 1024, 1024, 1024, 4096]
    - [34, 18.373]
  - - [1024, 8192, 1, 8192, 1024, 1024, 1024, 8192]
    - [51, 20.024]
  - - [2048, 128, 1, 128, 2048, 2048, 2048, 128]
    - [13, 1.201]
  - - [2048, 128, 1, 256, 2048, 2048, 2048, 256]
    - [97, 2.033]
  - - [2048, 128, 1, 512, 2048, 2048, 2048, 512]
    - [24, 3.332]
  - - [2048, 128, 1, 1024, 2048, 2048, 2048, 1024]
    - [25, 4.79]
  - - [2048, 128, 1, 2048, 2048, 2048, 2048, 2048]
    - [17, 5.474]
  - - [2048, 128, 1, 4096, 2048, 2048, 2048, 4096]
    - [8, 7.299]
  - - [2048, 128, 1, 8192, 2048, 2048, 2048, 8192]
    - [84, 9.891]
  - - [2048, 256, 1, 128, 2048, 2048, 2048, 128]
    - [63, 2.039]
  - - [2048, 256, 1, 256, 2048, 2048, 2048, 256]
    - [94, 3.44]
  - - [2048, 256, 1, 512, 2048, 2048, 2048, 512]
    - [95, 5.213]
  - - [2048, 256, 1, 1024, 2048, 2048, 2048, 1024]
    - [16, 7.252]
  - - [2048, 256, 1, 2048, 2048, 2048, 2048, 2048]
    - [89, 8.207]
  - - [2048, 256, 1, 4096, 2048, 2048, 2048, 4096]
    - [84, 10.813]
  - - [2048, 256, 1, 8192, 2048, 2048, 2048, 8192]
    - [9, 13.482]
  - - [2048, 512, 1, 128, 2048, 2048, 2048, 128]
    - [83, 3.194]
  - - [2048, 512, 1, 256, 2048, 2048, 2048, 256]
    - [83, 5.317]
  - - [2048, 512, 1, 512, 2048, 2048, 2048, 512]
    - [87, 7.865]
  - - [2048, 512, 1, 1024, 2048, 2048, 2048, 1024]
    - [89, 10.288]
  - - [2048, 512, 1, 2048, 2048, 2048, 2048, 2048]
    - [10, 11.196]
  - - [2048, 512, 1, 4096, 2048, 2048, 2048, 4096]
    - [84, 13.778]
  - - [2048, 512, 1, 8192, 2048, 2048, 2048, 8192]
    - [84, 15.29]
  - - [2048, 1024, 1, 128, 2048, 2048, 2048, 128]
    - [57, 4.657]
  - - [2048, 1024, 1, 256, 2048, 2048, 2048, 256]
    - [59, 7.17]
  - - [2048, 1024, 1, 512, 2048, 2048, 2048, 512]
    - [72, 9.779]
  - - [2048, 1024, 1, 1024, 2048, 2048, 2048, 1024]
    - [75, 12.123]
  - - [2048, 1024, 1, 2048, 2048, 2048, 2048, 2048]
    - [88, 13.241]
  - - [2048, 1024, 1, 4096, 2048, 2048, 2048, 4096]
    - [66, 15.595]
  - - [2048, 1024, 1, 8192, 2048, 2048, 2048, 8192]
    - [78, 16.892]
  - - [2048, 2048, 1, 128, 2048, 2048, 2048, 128]
    - [41, 5.74]
  - - [2048, 2048, 1, 256, 2048, 2048, 2048, 256]
    - [33, 8.635]
  - - [2048, 2048, 1, 512, 2048, 2048, 2048, 512]
    - [33, 11.65]
  - - [2048, 2048, 1, 1024, 2048, 2048, 2048, 1024]
    - [58, 12.805]
  - - [2048, 2048, 1, 2048, 2048, 2048, 2048, 2048]
    - [58, 15.06]
  - - [2048, 2048, 1, 4096, 2048, 2048, 2048, 4096]
    - [38, 16.847]
  - - [2048, 2048, 1, 8192, 2048, 2048, 2048, 8192]
    - [34, 18.719]
  - - [2048, 4096, 1, 128, 2048, 2048, 2048, 128]
    - [56, 5.157]
  - - [2048, 4096, 1, 256, 2048, 2048, 2048, 256]
    - [56, 8.284]
  - - [2048, 4096, 1, 512, 2048, 2048, 2048, 512]
    - [56, 11.268]
  - - [2048, 4096, 1, 1024, 2048, 2048, 2048, 1024]
    - [51, 14.261]
  - - [2048, 4096, 1, 2048, 2048, 2048, 2048, 2048]
    - [32, 16.392]
  - - [2048, 4096, 1, 4096, 2048, 2048, 2048, 4096]
    - [38, 18.284]
  - - [2048, 4096, 1, 8192, 2048, 2048, 2048, 8192]
    - [36, 19.998]
  - - [2048, 8192, 1, 128, 2048, 2048, 2048, 128]
    - [55, 6.391]
  - - [2048, 8192, 1, 256, 2048, 2048, 2048, 256]
    - [49, 9.467]
  - - [2048, 8192, 1, 512, 2048, 2048, 2048, 512]
    - [34, 12.491]
  - - [2048, 8192, 1, 1024, 2048, 2048, 2048, 1024]
    - [29, 15.435]
  - - [2048, 8192, 1, 2048, 2048, 2048, 2048, 2048]
    - [32, 17.802]
  - - [2048, 8192, 1, 4096, 2048, 2048, 2048, 4096]
    - [30, 19.72]
  - - [2048, 8192, 1, 8192, 2048, 2048, 2048, 8192]
    - [30, 20.82]
  - - [4096, 128, 1, 128, 4096, 4096, 4096, 128]
    - [65, 2.038]
  - - [4096, 128, 1, 256, 4096, 4096, 4096, 256]
    - [94, 3.418]
  - - [4096, 128, 1, 512, 4096, 4096, 4096, 512]
    - [95, 5.197]
  - - [4096, 128, 1, 1024, 4096, 4096, 4096, 1024]
    - [101, 7.223]
  - - [4096, 128, 1, 2048, 4096, 4096, 4096, 2048]
    - [20, 8.302]
  - - [4096, 128, 1, 4096, 4096, 4096, 4096, 4096]
    - [84, 10.868]
  - - [4096, 128, 1, 8192, 4096, 4096, 4096, 8192]
    - [9, 13.641]
  - - [4096, 256, 1, 128, 4096, 4096, 4096, 128]
    - [83, 3.208]
  - - [4096, 256, 1, 256, 4096, 4096, 4096, 256]
    - [83, 5.312]
  - - [4096, 256, 1, 512, 4096, 4096, 4096, 512]
    - [83, 7.883]
  - - [4096, 256, 1, 1024, 4096, 4096, 4096, 1024]
    - [92, 10.344]
  - - [4096, 256, 1, 2048, 4096, 4096, 4096, 2048]
    - [84, 11.285]
  - - [4096, 256, 1, 4096, 4096, 4096, 4096, 4096]
    - [9, 13.98]
  - - [4096, 256, 1, 8192, 4096, 4096, 4096, 8192]
    - [11, 15.249]
  - - [4096, 512, 1, 128, 4096, 4096, 4096, 128]
    - [59, 4.624]
  - - [4096, 512, 1, 256, 4096, 4096, 4096, 256]
    - [55, 7.096]
  - - [4096, 512, 1, 512, 4096, 4096, 4096, 512]
    - [76, 9.818]
  - - [4096, 512, 1, 1024, 4096, 4096, 4096, 1024]
    - [77, 12.149]
  - - [4096, 512, 1, 2048, 4096, 4096, 4096, 2048]
    - [89, 13.315]
  - - [4096, 512, 1, 4096, 4096, 4096, 4096, 4096]
    - [66, 15.786]
  - - [4096, 512, 1, 8192, 4096, 4096, 4096, 8192]
    - [69, 16.779]
  - - [4096, 1024, 1, 128, 4096, 4096, 4096, 128]
    - [33, 5.811]
  - - [4096, 1024, 1, 256, 4096, 4096, 4096, 256]
    - [33, 8.615]
  - - [4096, 1024, 1, 512, 4096, 4096, 4096, 512]
    - [33, 11.631]
  - - [4096, 1024, 1, 1024, 4096, 4096, 4096, 1024]
    - [62, 12.768]
  - - [4096, 1024, 1, 2048, 4096, 4096, 4096, 2048]
    - [74, 14.869]
  - - [4096, 1024, 1, 4096, 4096, 4096, 4096, 4096]
    - [29, 16.699]
  - - [4096, 1024, 1, 8192, 4096, 4096, 4096, 8192]
    - [49, 18.553]
  - - [4096, 2048, 1, 128, 4096, 4096, 4096, 128]
    - [54, 5.184]
  - - [4096, 2048, 1, 256, 4096, 4096, 4096, 256]
    - [54, 8.313]
  - - [4096, 2048, 1, 512, 4096, 4096, 4096, 512]
    - [66, 11.239]
  - - [4096, 2048, 1, 1024, 4096, 4096, 4096, 1024]
    - [34, 14.182]
  - - [4096, 2048, 1, 2048, 4096, 4096, 4096, 2048]
    - [32, 16.461]
  - - [4096, 2048, 1, 4096, 4096, 4096, 4096, 4096]
    - [29, 18.372]
  - - [4096, 2048, 1, 8192, 4096, 4096, 4096, 8192]
    - [29, 20.035]
  - - [4096, 4096, 1, 128, 4096, 4096, 4096, 128]
    - [59, 6.436]
  - - [4096, 4096, 1, 256, 4096, 4096, 4096, 256]
    - [32, 9.478]
  - - [4096, 4096, 1, 512, 4096, 4096, 4096, 512]
    - [40, 12.496]
  - - [4096, 4096, 1, 1024, 4096, 4096, 4096, 1024]
    - [47, 15.506]
  - - [4096, 4096, 1, 2048, 4096, 4096, 4096, 2048]
    - [36, 17.741]
  - - [4096, 4096, 1, 4096, 4096, 4096, 4096, 4096]
    - [38, 19.676]
  - - [4096, 4096, 1, 8192, 4096, 4096, 4096, 8192]
    - [43, 20.708]
  - - [4096, 8192, 1, 128, 4096, 4096, 4096, 128]
    - [31, 7.263]
  - - [4096, 8192, 1, 256, 4096, 4096, 4096, 256]
    - [33, 10.165]
  - - [4096, 8192, 1, 512, 4096, 4096, 4096, 512]
    - [39, 13.413]
  - - [4096, 8192, 1, 1024, 4096, 4096, 4096, 1024]
    - [29, 16.589]
  - - [4096, 8192, 1, 2048, 4096, 4096, 4096, 2048]
    - [48, 18.925]
  - - [4096, 8192, 1, 4096, 4096, 4096, 4096, 4096]
    - [39, 20.276]
  - - [4096, 8192, 1, 8192, 4096, 4096, 4096, 8192]
    - [52, 20.682]
  - - [8192, 128, 1, 128, 8192, 8192, 8192, 128]
    - [5, 3.005]
  - - [8192, 128, 1, 256, 8192, 8192, 8192, 256]
    - [83, 5.003]
  - - [8192, 128, 1, 512, 8192, 8192, 8192, 512]
    - [83, 7.527]
  - - [8192, 128, 1, 1024, 8192, 8192, 8192, 1024]
    - [8, 10.014]
  - - [8192, 128, 1, 2048, 8192, 8192, 8192, 2048]
    - [8, 11.294]
  - - [8192, 128, 1, 4096, 8192, 8192, 8192, 4096]
    - [9, 13.969]
  - - [8192, 128, 1, 8192, 8192, 8192, 8192, 8192]
    - [9, 15.167]
  - - [8192, 256, 1, 128, 8192, 8192, 8192, 128]
    - [57, 4.664]
  - - [8192, 256, 1, 256, 8192, 8192, 8192, 256]
    - [55, 7.176]
  - - [8192, 256, 1, 512, 8192, 8192, 8192, 512]
    - [54, 9.669]
  - - [8192, 256, 1, 1024, 8192, 8192, 8192, 1024]
    - [82, 11.958]
  - - [8192, 256, 1, 2048, 8192, 8192, 8192, 2048]
    - [6, 13.316]
  - - [8192, 256, 1, 4096, 8192, 8192, 8192, 4096]
    - [7, 15.766]
  - - [8192, 256, 1, 8192, 8192, 8192, 8192, 8192]
    - [71, 16.952]
  - - [8192, 512, 1, 128, 8192, 8192, 8192, 128]
    - [43, 5.715]
  - - [8192, 512, 1, 256, 8192, 8192, 8192, 256]
    - [52, 8.62]
  - - [8192, 512, 1, 512, 8192, 8192, 8192, 512]
    - [35, 11.619]
  - - [8192, 512, 1, 1024, 8192, 8192, 8192, 1024]
    - [62, 12.671]
  - - [8192, 512, 1, 2048, 8192, 8192, 8192, 2048]
    - [7, 15.089]
  - - [8192, 512, 1, 4096, 8192, 8192, 8192, 4096]
    - [47, 16.674]
  - - [8192, 512, 1, 8192, 8192, 8192, 8192, 8192]
    - [42, 18.547]
  - - [8192, 1024, 1, 128, 8192, 8192, 8192, 128]
    - [60, 5.092]
  - - [8192, 1024, 1, 256, 8192, 8192, 8192, 256]
    - [60, 8.148]
  - - [8192, 1024, 1, 512, 8192, 8192, 8192, 512]
    - [54, 11.184]
  - - [8192, 1024, 1, 1024, 8192, 8192, 8192, 1024]
    - [0, 14.311]
  - - [8192, 1024, 1, 2048, 8192, 8192, 8192, 2048]
    - [34, 16.247]
  - - [8192, 1024, 1, 4096, 8192, 8192, 8192, 4096]
    - [2, 18.375]
  - - [8192, 1024, 1, 8192, 8192, 8192, 8192, 8192]
    - [51, 19.874]
  - - [8192, 2048, 1, 128, 8192, 8192, 8192, 128]
    - [61, 6.265]
  - - [8192, 2048, 1, 256, 8192, 8192, 8192, 256]
    - [42, 9.351]
  - - [8192, 2048, 1, 512, 8192, 8192, 8192, 512]
    - [45, 12.343]
  - - [8192, 2048, 1, 1024, 8192, 8192, 8192, 1024]
    - [36, 15.204]
  - - [8192, 2048, 1, 2048, 8192, 8192, 8192, 2048]
    - [38, 17.607]
  - - [8192, 2048, 1, 4096, 8192, 8192, 8192, 4096]
    - [37, 19.613]
  - - [8192, 2048, 1, 8192, 8192, 8192, 8192, 8192]
    - [43, 20.751]
  - - [8192, 4096, 1, 128, 8192, 8192, 8192, 128]
    - [31, 7.187]
  - - [8192, 4096, 1, 256, 8192, 8192, 8192, 256]
    - [35, 10.108]
  - - [8192, 4096, 1, 512, 8192, 8192, 8192, 512]
    - [44, 13.388]
  - - [8192, 4096, 1, 1024, 8192, 8192, 8192, 1024]
    - [1, 16.499]
  - - [8192, 4096, 1, 2048, 8192, 8192, 8192, 2048]
    - [37, 18.934]
  - - [8192, 4096, 1, 4096, 8192, 8192, 8192, 4096]
    - [37, 20.32]
  - - [8192, 4096, 1, 8192, 8192, 8192, 8192, 8192]
    - [43, 20.719]
  - - [8192, 8192, 1, 128, 8192, 8192, 8192, 128]
    - [39, 7.546]
  - - [8192, 8192, 1, 256, 8192, 8192, 8192, 256]
    - [39, 10.132]
  - - [8192, 8192, 1, 512, 8192, 8192, 8192, 512]
    - [46, 13.909]
  - - [8192, 8192, 1, 1024, 8192, 8192, 8192, 1024]
    - [46, 17.115]
  - - [8192, 8192, 1, 2048, 8192, 8192, 8192, 2048]
    - [50, 19.214]
  - - [8192, 8192, 1, 4096, 8192, 8192, 8192, 4096]
    - [46, 20.242]
  - - [8192, 8192, 1, 8192, 8192, 8192, 8192, 8192]
    - [52, 21.025]
  - - [1, 1, 1, 32, 1, 1, 1, 32]
    - [111, 0.0]
- null
- null
- ExperimentalStreamK
- GridBased
