library/src/amd_detail/rocblaslt/src/Tensile/Logic/asm_full/aquavanjaram/gfx942_80cu/StreamK/aquavanjaram942_Cijk_Alik_Bljk_HSS_BH_UserArgs.yaml
- {MinimumRequiredVersion: 4.33.0}
- aquavanjaram942
- {Architecture: gfx942, CUCount: 80}
- [Device 0049, Device 0050]
    SolutionIndex: 0
    SolutionNameMin: Cijk_Alik_Bljk_HSS_BH_UserArgs_MT128x128x64_MI16x16x1_SN_LDSB1_CLR1_GSU0_GSUC0_GSUWGMRR0_K1_LBSPPA512_LBSPPB128_MIWT4_4_PLR1_SU32_SUM0_SUS256_SKXCCM0_VWA4_VWB1_WGM1_WGMXCC1_WGMXCCGn1
    SolutionIndex: 1
    SolutionNameMin: Cijk_Alik_Bljk_HSS_BH_UserArgs_MT128x128x64_MI16x16x1_SN_LDSB1_CLR1_GSU0_GSUC0_GSUWGMRR0_K1_LBSPPA128_LBSPPB256_MIWT4_4_PLR1_SU32_SUM0_SUS256_SKXCCM0_VWA1_VWB2_WGM1_WGMXCC1_WGMXCCGn1
    SolutionIndex: 2
    SolutionNameMin: Cijk_Alik_Bljk_HSS_BH_UserArgs_MT128x128x64_MI16x16x1_SN_LDSB1_CLR1_GSU0_GSUC0_GSUWGMRR0_K1_LBSPPA512_LBSPPB256_MIWT4_4_PLR1_SU32_SUM0_SUS256_SKXCCM0_VWA4_VWB2_WGM1_WGMXCC1_WGMXCCGn1
    SolutionIndex: 3
    SolutionNameMin: Cijk_Alik_Bljk_HSS_BH_UserArgs_MT128x128x64_MI16x16x1_SN_LDSB1_CLR1_GSU0_GSUC0_GSUWGMRR0_K1_LBSPPA512_LBSPPB512_MIWT4_4_PLR1_SU32_SUM0_SUS256_SKXCCM0_VWA4_VWB4_WGM1_WGMXCC1_WGMXCCGn1
    SolutionIndex: 4
    SolutionNameMin: Cijk_Alik_Bljk_HSS_BH_UserArgs_MT128x128x64_MI16x16x1_SN_LDSB1_CLR1_GSU0_GSUC0_GSUWGMRR0_K1_LBSPPA512_LBSPPB512_MIWT4_4_PLR1_SU32_SUM0_SUS256_SKXCCM0_VWA4_VWB4_WGM2_WGMXCC1_WGMXCCGn1
    SolutionIndex: 5
    SolutionNameMin: Cijk_Alik_Bljk_HSS_BH_UserArgs_MT128x128x64_MI16x16x1_SN_LDSB1_CLR1_GSU0_GSUC0_GSUWGMRR0_K1_LBSPPA512_LBSPPB256_MIWT4_4_PLR1_SU32_SUM0_SUS256_SKXCCM0_VWA4_VWB2_WGM4_WGMXCC1_WGMXCCGn1
    SolutionIndex: 6
    SolutionNameMin: Cijk_Alik_Bljk_HSS_BH_UserArgs_MT128x128x64_MI16x16x1_SN_LDSB1_CLR1_GSU0_GSUC0_GSUWGMRR0_K1_LBSPPA512_LBSPPB512_MIWT4_4_PLR1_SU32_SUM0_SUS256_SKXCCM0_VWA4_VWB4_WGM4_WGMXCC1_WGMXCCGn1
    SolutionIndex: 7
    SolutionNameMin: Cijk_Alik_Bljk_HSS_BH_UserArgs_MT128x64x64_MI16x16x1_SN_LDSB1_CLR1_GSU0_GSUC0_GSUWGMRR0_K1_LBSPPA512_LBSPPB128_MIWT4_2_PLR1_SU32_SUM0_SUS256_SKXCCM0_VWA4_VWB1_WGM2_WGMXCC1_WGMXCCGn1
    SolutionIndex: 8
    SolutionNameMin: Cijk_Alik_Bljk_HSS_BH_UserArgs_MT64x64x64_MI16x16x1_SN_LDSB1_CLR1_GSU0_GSUC0_GSUWGMRR0_K1_LBSPPA128_LBSPPB256_MIWT2_2_PLR1_SU32_SUM0_SUS256_SKXCCM0_VWA1_VWB2_WGM1_WGMXCC1_WGMXCCGn1
    SolutionIndex: 9
    SolutionNameMin: Cijk_Alik_Bljk_HSS_BH_UserArgs_MT32x64x64_MI16x16x1_SN_LDSB0_CLR1_GSU0_GSUC0_GSUWGMRR0_K1_LBSPPA128_LBSPPB128_MIWT1_2_PLR1_SU32_SUM0_SUS256_SKXCCM0_VWA1_VWB1_WGM1_WGMXCC1_WGMXCCGn1
    SolutionIndex: 10
    SolutionNameMin: Cijk_Alik_Bljk_HSS_BH_UserArgs_MT32x64x64_MI16x16x1_SN_LDSB0_CLR1_GSU0_GSUC0_GSUWGMRR0_K1_LBSPPA128_LBSPPB256_MIWT1_2_PLR1_SU32_SUM0_SUS256_SKXCCM0_VWA1_VWB2_WGM1_WGMXCC1_WGMXCCGn1
    SolutionIndex: 11
    SolutionNameMin: Cijk_Alik_Bljk_HSS_BH_UserArgs_MT32x32x64_MI16x16x1_SN_LDSB0_CLR1_GSU0_GSUC0_GSUWGMRR0_K1_LBSPPA128_LBSPPB128_MIWT1_1_PLR1_SU32_SUM0_SUS256_SKXCCM0_VWA1_VWB1_WGM1_WGMXCC1_WGMXCCGn1
    SolutionIndex: 12
    SolutionNameMin: Cijk_Alik_Bljk_HSS_BH_UserArgs_MT64x64x128_MI16x16x1_SN_LDSB1_CLR1_GSU0_GSUC0_GSUWGMRR0_K1_LBSPPA256_LBSPPB256_MIWT2_2_PLR2_SU32_SUM0_SUS256_SKXCCM0_VWA1_VWB1_WGM1_WGMXCC1_WGMXCCGn1
    SolutionIndex: 13
    SolutionNameMin: Cijk_Alik_Bljk_HSS_BH_UserArgs_MT32x64x128_MI16x16x1_SN_LDSB1_CLR1_GSU0_GSUC0_GSUWGMRR0_K1_LBSPPA256_LBSPPB256_MIWT1_2_PLR1_SU32_SUM0_SUS256_SKXCCM0_VWA1_VWB1_WGM1_WGMXCC1_WGMXCCGn1
    SolutionIndex: 14
    SolutionNameMin: Cijk_Alik_Bljk_HSS_BH_UserArgs_MT32x64x128_MI16x16x1_SN_LDSB1_CLR1_GSU0_GSUC0_GSUWGMRR0_K1_LBSPPA256_LBSPPB256_MIWT1_2_PLR2_SU32_SUM0_SUS256_SKXCCM0_VWA1_VWB1_WGM1_WGMXCC1_WGMXCCGn1
    SolutionIndex: 15
    SolutionNameMin: Cijk_Alik_Bljk_HSS_BH_UserArgs_MT64x32x128_MI16x16x1_SN_LDSB1_CLR1_GSU0_GSUC0_GSUWGMRR0_K1_LBSPPA256_LBSPPB256_MIWT2_1_PLR2_SU32_SUM0_SUS256_SKXCCM0_VWA1_VWB1_WGM1_WGMXCC1_WGMXCCGn1
    SolutionIndex: 16
    SolutionNameMin: Cijk_Alik_Bljk_HSS_BH_UserArgs_MT64x32x128_MI16x16x1_SN_LDSB1_CLR1_GSU0_GSUC0_GSUWGMRR0_K1_LBSPPA512_LBSPPB256_MIWT2_1_PLR2_SU32_SUM0_SUS256_SKXCCM0_VWA2_VWB1_WGM1_WGMXCC1_WGMXCCGn1
    SolutionIndex: 17
    SolutionNameMin: Cijk_Alik_Bljk_HSS_BH_UserArgs_MT32x32x128_MI16x16x1_SN_LDSB1_CLR1_GSU0_GSUC0_GSUWGMRR0_K1_LBSPPA256_LBSPPB256_MIWT1_1_PLR1_SU32_SUM0_SUS256_SKXCCM0_VWA1_VWB1_WGM1_WGMXCC1_WGMXCCGn1
    SolutionIndex: 18
    SolutionNameMin: Cijk_Alik_Bljk_HSS_BH_UserArgs_MT32x32x128_MI16x16x1_SN_LDSB1_CLR1_GSU0_GSUC0_GSUWGMRR0_K1_LBSPPA256_LBSPPB256_MIWT1_1_PLR2_SU32_SUM0_SUS256_SKXCCM0_VWA1_VWB1_WGM1_WGMXCC1_WGMXCCGn1
    SolutionIndex: 19
    SolutionNameMin: Cijk_Alik_Bljk_HSS_BH_UserArgs_MT256x64x64_MI16x16x1_SN_LDSB1_CLR1_GSU0_GSUC0_GSUWGMRR0_K1_LBSPPA512_LBSPPB256_MIWT8_2_PLR1_SU32_SUM0_SUS256_SKXCCM4_VWA4_VWB2_WGM1_WGMXCC1_WGMXCCGn1
    SolutionIndex: 20
    SolutionNameMin: Cijk_Alik_Bljk_HSS_BH_UserArgs_MT128x128x64_MI16x16x1_SN_LDSB1_CLR1_GSU0_GSUC0_GSUWGMRR0_K1_LBSPPA128_LBSPPB128_MIWT4_4_PLR1_SU32_SUM0_SUS256_SKXCCM4_VWA1_VWB1_WGM1_WGMXCC1_WGMXCCGn1
    SolutionIndex: 21
    SolutionNameMin: Cijk_Alik_Bljk_HSS_BH_UserArgs_MT128x128x64_MI16x16x1_SN_LDSB1_CLR1_GSU0_GSUC0_GSUWGMRR0_K1_LBSPPA512_LBSPPB128_MIWT4_4_PLR1_SU32_SUM0_SUS256_SKXCCM4_VWA4_VWB1_WGM1_WGMXCC1_WGMXCCGn1
    SolutionIndex: 22
    SolutionNameMin: Cijk_Alik_Bljk_HSS_BH_UserArgs_MT128x128x64_MI16x16x1_SN_LDSB1_CLR1_GSU0_GSUC0_GSUWGMRR0_K1_LBSPPA128_LBSPPB256_MIWT4_4_PLR1_SU32_SUM0_SUS256_SKXCCM4_VWA1_VWB2_WGM1_WGMXCC1_WGMXCCGn1
    SolutionIndex: 23
    SolutionNameMin: Cijk_Alik_Bljk_HSS_BH_UserArgs_MT128x128x64_MI16x16x1_SN_LDSB1_CLR1_GSU0_GSUC0_GSUWGMRR0_K1_LBSPPA512_LBSPPB256_MIWT4_4_PLR1_SU32_SUM0_SUS256_SKXCCM4_VWA4_VWB2_WGM1_WGMXCC1_WGMXCCGn1
    SolutionIndex: 24
    SolutionNameMin: Cijk_Alik_Bljk_HSS_BH_UserArgs_MT128x128x64_MI16x16x1_SN_LDSB1_CLR1_GSU0_GSUC0_GSUWGMRR0_K1_LBSPPA128_LBSPPB512_MIWT4_4_PLR1_SU32_SUM0_SUS256_SKXCCM4_VWA1_VWB4_WGM1_WGMXCC1_WGMXCCGn1
    SolutionIndex: 25
    SolutionNameMin: Cijk_Alik_Bljk_HSS_BH_UserArgs_MT128x128x64_MI16x16x1_SN_LDSB1_CLR1_GSU0_GSUC0_GSUWGMRR0_K1_LBSPPA512_LBSPPB512_MIWT4_4_PLR1_SU32_SUM0_SUS256_SKXCCM4_VWA4_VWB4_WGM1_WGMXCC1_WGMXCCGn1
    SolutionIndex: 26
    SolutionNameMin: Cijk_Alik_Bljk_HSS_BH_UserArgs_MT128x128x64_MI16x16x1_SN_LDSB1_CLR1_GSU0_GSUC0_GSUWGMRR0_K1_LBSPPA128_LBSPPB128_MIWT4_4_PLR1_SU32_SUM0_SUS256_SKXCCM4_VWA1_VWB1_WGM2_WGMXCC1_WGMXCCGn1
    SolutionIndex: 27
    SolutionNameMin: Cijk_Alik_Bljk_HSS_BH_UserArgs_MT128x128x64_MI16x16x1_SN_LDSB1_CLR1_GSU0_GSUC0_GSUWGMRR0_K1_LBSPPA512_LBSPPB128_MIWT4_4_PLR1_SU32_SUM0_SUS256_SKXCCM4_VWA4_VWB1_WGM2_WGMXCC1_WGMXCCGn1
    SolutionIndex: 28
    SolutionNameMin: Cijk_Alik_Bljk_HSS_BH_UserArgs_MT128x128x64_MI16x16x1_SN_LDSB1_CLR1_GSU0_GSUC0_GSUWGMRR0_K1_LBSPPA512_LBSPPB256_MIWT4_4_PLR1_SU32_SUM0_SUS256_SKXCCM4_VWA4_VWB2_WGM2_WGMXCC1_WGMXCCGn1
    SolutionIndex: 29
    SolutionNameMin: Cijk_Alik_Bljk_HSS_BH_UserArgs_MT128x128x64_MI16x16x1_SN_LDSB1_CLR1_GSU0_GSUC0_GSUWGMRR0_K1_LBSPPA128_LBSPPB512_MIWT4_4_PLR1_SU32_SUM0_SUS256_SKXCCM4_VWA1_VWB4_WGM2_WGMXCC1_WGMXCCGn1
    SolutionIndex: 30
    SolutionNameMin: Cijk_Alik_Bljk_HSS_BH_UserArgs_MT128x128x64_MI16x16x1_SN_LDSB1_CLR1_GSU0_GSUC0_GSUWGMRR0_K1_LBSPPA512_LBSPPB512_MIWT4_4_PLR1_SU32_SUM0_SUS256_SKXCCM4_VWA4_VWB4_WGM2_WGMXCC1_WGMXCCGn1
    SolutionIndex: 31
    SolutionNameMin: Cijk_Alik_Bljk_HSS_BH_UserArgs_MT128x128x64_MI16x16x1_SN_LDSB1_CLR1_GSU0_GSUC0_GSUWGMRR0_K1_LBSPPA512_LBSPPB128_MIWT4_4_PLR1_SU32_SUM0_SUS256_SKXCCM4_VWA4_VWB1_WGM4_WGMXCC1_WGMXCCGn1
    SolutionIndex: 32
    SolutionNameMin: Cijk_Alik_Bljk_HSS_BH_UserArgs_MT128x128x64_MI16x16x1_SN_LDSB1_CLR1_GSU0_GSUC0_GSUWGMRR0_K1_LBSPPA512_LBSPPB256_MIWT4_4_PLR1_SU32_SUM0_SUS256_SKXCCM4_VWA4_VWB2_WGM4_WGMXCC1_WGMXCCGn1
    SolutionIndex: 33
    SolutionNameMin: Cijk_Alik_Bljk_HSS_BH_UserArgs_MT128x128x64_MI16x16x1_SN_LDSB1_CLR1_GSU0_GSUC0_GSUWGMRR0_K1_LBSPPA512_LBSPPB512_MIWT4_4_PLR1_SU32_SUM0_SUS256_SKXCCM4_VWA4_VWB4_WGM4_WGMXCC1_WGMXCCGn1
    SolutionIndex: 34
    SolutionNameMin: Cijk_Alik_Bljk_HSS_BH_UserArgs_MT64x128x64_MI16x16x1_SN_LDSB1_CLR1_GSU0_GSUC0_GSUWGMRR0_K1_LBSPPA128_LBSPPB128_MIWT2_4_PLR1_SU32_SUM0_SUS256_SKXCCM4_VWA1_VWB1_WGM1_WGMXCC1_WGMXCCGn1
    SolutionIndex: 35
    SolutionNameMin: Cijk_Alik_Bljk_HSS_BH_UserArgs_MT64x128x64_MI16x16x1_SN_LDSB1_CLR1_GSU0_GSUC0_GSUWGMRR0_K1_LBSPPA128_LBSPPB256_MIWT2_4_PLR1_SU32_SUM0_SUS256_SKXCCM4_VWA1_VWB2_WGM1_WGMXCC1_WGMXCCGn1
    SolutionIndex: 36
    SolutionNameMin: Cijk_Alik_Bljk_HSS_BH_UserArgs_MT64x128x64_MI16x16x1_SN_LDSB1_CLR1_GSU0_GSUC0_GSUWGMRR0_K1_LBSPPA128_LBSPPB512_MIWT2_4_PLR1_SU32_SUM0_SUS256_SKXCCM4_VWA1_VWB4_WGM1_WGMXCC1_WGMXCCGn1
    SolutionIndex: 37
    SolutionNameMin: Cijk_Alik_Bljk_HSS_BH_UserArgs_MT128x64x64_MI16x16x1_SN_LDSB1_CLR1_GSU0_GSUC0_GSUWGMRR0_K1_LBSPPA512_LBSPPB128_MIWT4_2_PLR1_SU32_SUM0_SUS256_SKXCCM4_VWA4_VWB1_WGM1_WGMXCC1_WGMXCCGn1
    SolutionIndex: 38
    SolutionNameMin: Cijk_Alik_Bljk_HSS_BH_UserArgs_MT128x64x64_MI16x16x1_SN_LDSB1_CLR1_GSU0_GSUC0_GSUWGMRR0_K1_LBSPPA512_LBSPPB256_MIWT4_2_PLR1_SU32_SUM0_SUS256_SKXCCM4_VWA4_VWB2_WGM1_WGMXCC1_WGMXCCGn1
    SolutionIndex: 39
    SolutionNameMin: Cijk_Alik_Bljk_HSS_BH_UserArgs_MT128x64x64_MI16x16x1_SN_LDSB1_CLR1_GSU0_GSUC0_GSUWGMRR0_K1_LBSPPA512_LBSPPB256_MIWT4_2_PLR1_SU32_SUM0_SUS256_SKXCCM4_VWA4_VWB2_WGM4_WGMXCC1_WGMXCCGn1
    SolutionIndex: 40
    SolutionNameMin: Cijk_Alik_Bljk_HSS_BH_UserArgs_MT64x64x64_MI16x16x1_SN_LDSB1_CLR1_GSU0_GSUC0_GSUWGMRR0_K1_LBSPPA128_LBSPPB128_MIWT2_2_PLR1_SU32_SUM0_SUS256_SKXCCM4_VWA1_VWB1_WGM1_WGMXCC1_WGMXCCGn1
    SolutionIndex: 41
    SolutionNameMin: Cijk_Alik_Bljk_HSS_BH_UserArgs_MT64x64x64_MI16x16x1_SN_LDSB1_CLR1_GSU0_GSUC0_GSUWGMRR0_K1_LBSPPA128_LBSPPB256_MIWT2_2_PLR1_SU32_SUM0_SUS256_SKXCCM4_VWA1_VWB2_WGM1_WGMXCC1_WGMXCCGn1
    SolutionIndex: 42
    SolutionNameMin: Cijk_Alik_Bljk_HSS_BH_UserArgs_MT64x64x64_MI16x16x1_SN_LDSB1_CLR1_GSU0_GSUC0_GSUWGMRR0_K1_LBSPPA128_LBSPPB128_MIWT2_2_PLR1_SU32_SUM0_SUS256_SKXCCM4_VWA1_VWB1_WGM4_WGMXCC1_WGMXCCGn1
    SolutionIndex: 43
    SolutionNameMin: Cijk_Alik_Bljk_HSS_BH_UserArgs_MT32x64x64_MI16x16x1_SN_LDSB0_CLR1_GSU0_GSUC0_GSUWGMRR0_K1_LBSPPA128_LBSPPB128_MIWT1_2_PLR1_SU32_SUM0_SUS256_SKXCCM4_VWA1_VWB1_WGM1_WGMXCC1_WGMXCCGn1
    SolutionIndex: 44
    SolutionNameMin: Cijk_Alik_Bljk_HSS_BH_UserArgs_MT32x64x64_MI16x16x1_SN_LDSB0_CLR1_GSU0_GSUC0_GSUWGMRR0_K1_LBSPPA128_LBSPPB256_MIWT1_2_PLR1_SU32_SUM0_SUS256_SKXCCM4_VWA1_VWB2_WGM1_WGMXCC1_WGMXCCGn1
    SolutionIndex: 45
    SolutionNameMin: Cijk_Alik_Bljk_HSS_BH_UserArgs_MT64x32x64_MI16x16x1_SN_LDSB0_CLR1_GSU0_GSUC0_GSUWGMRR0_K1_LBSPPA256_LBSPPB128_MIWT2_1_PLR1_SU32_SUM0_SUS256_SKXCCM4_VWA2_VWB1_WGM1_WGMXCC1_WGMXCCGn1
    SolutionIndex: 46
    SolutionNameMin: Cijk_Alik_Bljk_HSS_BH_UserArgs_MT32x32x64_MI16x16x1_SN_LDSB0_CLR1_GSU0_GSUC0_GSUWGMRR0_K1_LBSPPA128_LBSPPB128_MIWT1_1_PLR1_SU32_SUM0_SUS256_SKXCCM4_VWA1_VWB1_WGM1_WGMXCC1_WGMXCCGn1
    SolutionIndex: 47
    SolutionNameMin: Cijk_Alik_Bljk_HSS_BH_UserArgs_MT32x32x64_MI16x16x1_SN_LDSB0_CLR1_GSU0_GSUC0_GSUWGMRR0_K1_LBSPPA128_LBSPPB128_MIWT1_1_PLR2_SU32_SUM0_SUS256_SKXCCM4_VWA1_VWB1_WGM1_WGMXCC1_WGMXCCGn1
    SolutionIndex: 48
    SolutionNameMin: Cijk_Alik_Bljk_HSS_BH_UserArgs_MT64x64x128_MI16x16x1_SN_LDSB1_CLR1_GSU0_GSUC0_GSUWGMRR0_K1_LBSPPA256_LBSPPB256_MIWT2_2_PLR1_SU32_SUM0_SUS256_SKXCCM4_VWA1_VWB1_WGM1_WGMXCC1_WGMXCCGn1
    SolutionIndex: 49
    SolutionNameMin: Cijk_Alik_Bljk_HSS_BH_UserArgs_MT64x64x128_MI16x16x1_SN_LDSB1_CLR1_GSU0_GSUC0_GSUWGMRR0_K1_LBSPPA256_LBSPPB512_MIWT2_2_PLR1_SU32_SUM0_SUS256_SKXCCM4_VWA1_VWB2_WGM1_WGMXCC1_WGMXCCGn1
    SolutionIndex: 50
    SolutionNameMin: Cijk_Alik_Bljk_HSS_BH_UserArgs_MT64x64x128_MI16x16x1_SN_LDSB1_CLR1_GSU0_GSUC0_GSUWGMRR0_K1_LBSPPA256_LBSPPB256_MIWT2_2_PLR2_SU32_SUM0_SUS256_SKXCCM4_VWA1_VWB1_WGM1_WGMXCC1_WGMXCCGn1
    SolutionIndex: 51
    SolutionNameMin: Cijk_Alik_Bljk_HSS_BH_UserArgs_MT64x64x128_MI16x16x1_SN_LDSB1_CLR1_GSU0_GSUC0_GSUWGMRR0_K1_LBSPPA256_LBSPPB512_MIWT2_2_PLR2_SU32_SUM0_SUS256_SKXCCM4_VWA1_VWB2_WGM1_WGMXCC1_WGMXCCGn1
    SolutionIndex: 52
    SolutionNameMin: Cijk_Alik_Bljk_HSS_BH_UserArgs_MT64x64x128_MI16x16x1_SN_LDSB1_CLR1_GSU0_GSUC0_GSUWGMRR0_K1_LBSPPA256_LBSPPB256_MIWT2_2_PLR1_SU32_SUM0_SUS256_SKXCCM4_VWA1_VWB1_WGM2_WGMXCC1_WGMXCCGn1
    SolutionIndex: 53
    SolutionNameMin: Cijk_Alik_Bljk_HSS_BH_UserArgs_MT64x64x128_MI16x16x1_SN_LDSB1_CLR1_GSU0_GSUC0_GSUWGMRR0_K1_LBSPPA256_LBSPPB512_MIWT2_2_PLR1_SU32_SUM0_SUS256_SKXCCM4_VWA1_VWB2_WGM2_WGMXCC1_WGMXCCGn1
    SolutionIndex: 54
    SolutionNameMin: Cijk_Alik_Bljk_HSS_BH_UserArgs_MT64x64x128_MI16x16x1_SN_LDSB1_CLR1_GSU0_GSUC0_GSUWGMRR0_K1_LBSPPA256_LBSPPB512_MIWT2_2_PLR2_SU32_SUM0_SUS256_SKXCCM4_VWA1_VWB2_WGM4_WGMXCC1_WGMXCCGn1
    SolutionIndex: 55
    SolutionNameMin: Cijk_Alik_Bljk_HSS_BH_UserArgs_MT32x64x128_MI16x16x1_SN_LDSB1_CLR1_GSU0_GSUC0_GSUWGMRR0_K1_LBSPPA256_LBSPPB256_MIWT1_2_PLR2_SU32_SUM0_SUS256_SKXCCM4_VWA1_VWB1_WGM1_WGMXCC1_WGMXCCGn1
    SolutionIndex: 56
    SolutionNameMin: Cijk_Alik_Bljk_HSS_BH_UserArgs_MT64x32x128_MI16x16x1_SN_LDSB1_CLR1_GSU0_GSUC0_GSUWGMRR0_K1_LBSPPA512_LBSPPB256_MIWT2_1_PLR2_SU32_SUM0_SUS256_SKXCCM4_VWA2_VWB1_WGM1_WGMXCC1_WGMXCCGn1
    SolutionIndex: 57
    SolutionNameMin: Cijk_Alik_Bljk_HSS_BH_UserArgs_MT32x32x128_MI16x16x1_SN_LDSB1_CLR1_GSU0_GSUC0_GSUWGMRR0_K1_LBSPPA256_LBSPPB256_MIWT1_1_PLR1_SU32_SUM0_SUS256_SKXCCM4_VWA1_VWB1_WGM1_WGMXCC1_WGMXCCGn1
    SolutionIndex: 58
    SolutionNameMin: Cijk_Alik_Bljk_HSS_BH_UserArgs_MT32x32x128_MI16x16x1_SN_LDSB1_CLR1_GSU0_GSUC0_GSUWGMRR0_K1_LBSPPA256_LBSPPB256_MIWT1_1_PLR2_SU32_SUM0_SUS256_SKXCCM4_VWA1_VWB1_WGM1_WGMXCC1_WGMXCCGn1
    SolutionIndex: 59
    SolutionNameMin: Cijk_Alik_Bljk_HSS_BH_UserArgs_MT32x32x32_MI16x16x1_SN_LDSB0_CLR0_GSU0_GSUC0_GSUWGMRR0_K1_LBSPPA128_LBSPPB128_MIWT1_1_PLR0_SU32_SUM0_SUS256_SKXCCM0_VWA1_VWB1_WGM1_WGMXCC1_WGMXCCGn1
- - - [128, 128, 1, 128, 128, 128, 128, 128]
    - [11, 0.093]
  - - [128, 128, 1, 256, 128, 128, 256, 256]
    - [11, 0.175]
  - - [128, 128, 1, 512, 128, 128, 512, 512]
    - [58, 0.304]
  - - [128, 128, 1, 1024, 128, 128, 1024, 1024]
    - [58, 0.481]
  - - [128, 128, 1, 2048, 128, 128, 2048, 2048]
    - [17, 0.694]
  - - [128, 128, 1, 4096, 128, 128, 4096, 4096]
    - [11, 1.19]
  - - [128, 128, 1, 8192, 128, 128, 8192, 8192]
    - [17, 1.898]
  - - [128, 256, 1, 128, 128, 128, 128, 128]
    - [58, 0.186]
  - - [128, 256, 1, 256, 128, 128, 256, 256]
    - [46, 0.347]
  - - [128, 256, 1, 512, 128, 128, 512, 512]
    - [46, 0.605]
  - - [128, 256, 1, 1024, 128, 128, 1024, 1024]
    - [17, 0.957]
  - - [128, 256, 1, 2048, 128, 128, 2048, 2048]
    - [17, 1.37]
  - - [128, 256, 1, 4096, 128, 128, 4096, 4096]
    - [17, 2.102]
  - - [128, 256, 1, 8192, 128, 128, 8192, 8192]
    - [55, 3.053]
  - - [128, 512, 1, 128, 128, 128, 128, 128]
    - [47, 0.367]
  - - [128, 512, 1, 256, 128, 128, 256, 256]
    - [46, 0.689]
  - - [128, 512, 1, 512, 128, 128, 512, 512]
    - [18, 1.184]
  - - [128, 512, 1, 1024, 128, 128, 1024, 1024]
    - [58, 1.895]
  - - [128, 512, 1, 2048, 128, 128, 2048, 2048]
    - [17, 2.673]
  - - [128, 512, 1, 4096, 128, 128, 4096, 4096]
    - [15, 3.354]
  - - [128, 512, 1, 8192, 128, 128, 8192, 8192]
    - [48, 4.926]
  - - [128, 1024, 1, 128, 128, 128, 128, 128]
    - [10, 0.693]
  - - [128, 1024, 1, 256, 128, 128, 256, 256]
    - [10, 1.247]
  - - [128, 1024, 1, 512, 128, 128, 512, 512]
    - [10, 2.068]
  - - [128, 1024, 1, 1024, 128, 128, 1024, 1024]
    - [13, 3.111]
  - - [128, 1024, 1, 2048, 128, 128, 2048, 2048]
    - [56, 4.183]
  - - [128, 1024, 1, 4096, 128, 128, 4096, 4096]
    - [50, 5.374]
  - - [128, 1024, 1, 8192, 128, 128, 8192, 8192]
    - [49, 6.981]
  - - [128, 2048, 1, 128, 128, 128, 128, 128]
    - [40, 1.196]
  - - [128, 2048, 1, 256, 128, 128, 256, 256]
    - [40, 2.142]
  - - [128, 2048, 1, 512, 128, 128, 512, 512]
    - [42, 3.396]
  - - [128, 2048, 1, 1024, 128, 128, 1024, 1024]
    - [50, 4.957]
  - - [128, 2048, 1, 2048, 128, 128, 2048, 2048]
    - [48, 6.541]
  - - [128, 2048, 1, 4096, 128, 128, 4096, 4096]
    - [37, 7.651]
  - - [128, 2048, 1, 8192, 128, 128, 8192, 8192]
    - [21, 9.78]
  - - [128, 4096, 1, 128, 128, 128, 128, 128]
    - [38, 1.956]
  - - [128, 4096, 1, 256, 128, 128, 256, 256]
    - [37, 3.394]
  - - [128, 4096, 1, 512, 128, 128, 512, 512]
    - [35, 5.269]
  - - [128, 4096, 1, 1024, 128, 128, 1024, 1024]
    - [37, 7.303]
  - - [128, 4096, 1, 2048, 128, 128, 2048, 2048]
    - [38, 7.753]
  - - [128, 4096, 1, 4096, 128, 128, 4096, 4096]
    - [0, 10.532]
  - - [128, 4096, 1, 8192, 128, 128, 8192, 8192]
    - [3, 13.199]
  - - [128, 8192, 1, 128, 128, 128, 128, 128]
    - [24, 2.805]
  - - [128, 8192, 1, 256, 128, 128, 256, 256]
    - [20, 4.858]
  - - [128, 8192, 1, 512, 128, 128, 512, 512]
    - [21, 7.432]
  - - [128, 8192, 1, 1024, 128, 128, 1024, 1024]
    - [20, 9.35]
  - - [128, 8192, 1, 2048, 128, 128, 2048, 2048]
    - [23, 10.951]
  - - [128, 8192, 1, 4096, 128, 128, 4096, 4096]
    - [1, 12.828]
  - - [128, 8192, 1, 8192, 128, 128, 8192, 8192]
    - [5, 14.704]
  - - [256, 128, 1, 128, 256, 256, 128, 128]
    - [46, 0.188]
  - - [256, 128, 1, 256, 256, 256, 256, 256]
    - [17, 0.34]
  - - [256, 128, 1, 512, 256, 256, 512, 512]
    - [46, 0.604]
  - - [256, 128, 1, 1024, 256, 256, 1024, 1024]
    - [58, 0.948]
  - - [256, 128, 1, 2048, 256, 256, 2048, 2048]
    - [18, 1.369]
  - - [256, 128, 1, 4096, 256, 256, 4096, 4096]
    - [18, 2.107]
  - - [256, 128, 1, 8192, 256, 256, 8192, 8192]
    - [55, 3.04]
  - - [256, 256, 1, 128, 256, 256, 128, 128]
    - [57, 0.362]
  - - [256, 256, 1, 256, 256, 256, 256, 256]
    - [11, 0.683]
  - - [256, 256, 1, 512, 256, 256, 512, 512]
    - [57, 1.173]
  - - [256, 256, 1, 1024, 256, 256, 1024, 1024]
    - [17, 1.886]
  - - [256, 256, 1, 2048, 256, 256, 2048, 2048]
    - [18, 2.648]
  - - [256, 256, 1, 4096, 256, 256, 4096, 4096]
    - [16, 3.332]
  - - [256, 256, 1, 8192, 256, 256, 8192, 8192]
    - [51, 4.909]
  - - [256, 512, 1, 128, 256, 256, 128, 128]
    - [10, 0.684]
  - - [256, 512, 1, 256, 256, 256, 256, 256]
    - [9, 1.238]
  - - [256, 512, 1, 512, 256, 256, 512, 512]
    - [9, 2.088]
  - - [256, 512, 1, 1024, 256, 256, 1024, 1024]
    - [9, 3.106]
  - - [256, 512, 1, 2048, 256, 256, 2048, 2048]
    - [56, 4.16]
  - - [256, 512, 1, 4096, 256, 256, 4096, 4096]
    - [49, 5.371]
  - - [256, 512, 1, 8192, 256, 256, 8192, 8192]
    - [51, 7.076]
  - - [256, 1024, 1, 128, 256, 256, 128, 128]
    - [40, 1.191]
  - - [256, 1024, 1, 256, 256, 256, 256, 256]
    - [40, 2.132]
  - - [256, 1024, 1, 512, 256, 256, 512, 512]
    - [40, 3.43]
  - - [256, 1024, 1, 1024, 256, 256, 1024, 1024]
    - [48, 4.999]
  - - [256, 1024, 1, 2048, 256, 256, 2048, 2048]
    - [48, 6.543]
  - - [256, 1024, 1, 4096, 256, 256, 4096, 4096]
    - [2, 7.462]
  - - [256, 1024, 1, 8192, 256, 256, 8192, 8192]
    - [21, 9.746]
  - - [256, 2048, 1, 128, 256, 256, 128, 128]
    - [36, 1.915]
  - - [256, 2048, 1, 256, 256, 256, 256, 256]
    - [36, 3.327]
  - - [256, 2048, 1, 512, 256, 256, 512, 512]
    - [36, 5.195]
  - - [256, 2048, 1, 1024, 256, 256, 1024, 1024]
    - [36, 7.257]
  - - [256, 2048, 1, 2048, 256, 256, 2048, 2048]
    - [37, 8.005]
  - - [256, 2048, 1, 4096, 256, 256, 4096, 4096]
    - [28, 10.12]
  - - [256, 2048, 1, 8192, 256, 256, 8192, 8192]
    - [21, 13.43]
  - - [256, 4096, 1, 128, 256, 256, 128, 128]
    - [20, 2.806]
  - - [256, 4096, 1, 256, 256, 256, 256, 256]
    - [25, 4.851]
  - - [256, 4096, 1, 512, 256, 256, 512, 512]
    - [25, 7.576]
  - - [256, 4096, 1, 1024, 256, 256, 1024, 1024]
    - [20, 9.85]
  - - [256, 4096, 1, 2048, 256, 256, 2048, 2048]
    - [32, 11.146]
  - - [256, 4096, 1, 4096, 256, 256, 4096, 4096]
    - [32, 12.838]
  - - [256, 4096, 1, 8192, 256, 256, 8192, 8192]
    - [31, 15.589]
  - - [256, 8192, 1, 128, 256, 256, 128, 128]
    - [25, 3.375]
  - - [256, 8192, 1, 256, 256, 256, 256, 256]
    - [23, 4.291]
  - - [256, 8192, 1, 512, 256, 256, 512, 512]
    - [21, 7.052]
  - - [256, 8192, 1, 1024, 256, 256, 1024, 1024]
    - [25, 9.96]
  - - [256, 8192, 1, 2048, 256, 256, 2048, 2048]
    - [19, 12.386]
  - - [256, 8192, 1, 4096, 256, 256, 4096, 4096]
    - [27, 14.326]
  - - [256, 8192, 1, 8192, 256, 256, 8192, 8192]
    - [33, 15.786]
  - - [512, 128, 1, 128, 512, 512, 128, 128]
    - [46, 0.372]
  - - [512, 128, 1, 256, 512, 512, 256, 256]
    - [58, 0.678]
  - - [512, 128, 1, 512, 512, 512, 512, 512]
    - [46, 1.183]
  - - [512, 128, 1, 1024, 512, 512, 1024, 1024]
    - [17, 1.888]
  - - [512, 128, 1, 2048, 512, 512, 2048, 2048]
    - [17, 2.643]
  - - [512, 128, 1, 4096, 512, 512, 4096, 4096]
    - [15, 3.346]
  - - [512, 128, 1, 8192, 512, 512, 8192, 8192]
    - [49, 4.898]
  - - [512, 256, 1, 128, 512, 512, 128, 128]
    - [43, 0.683]
  - - [512, 256, 1, 256, 512, 512, 256, 256]
    - [44, 1.244]
  - - [512, 256, 1, 512, 512, 512, 512, 512]
    - [9, 2.088]
  - - [512, 256, 1, 1024, 512, 512, 1024, 1024]
    - [14, 3.1]
  - - [512, 256, 1, 2048, 512, 512, 2048, 2048]
    - [56, 4.162]
  - - [512, 256, 1, 4096, 512, 512, 4096, 4096]
    - [53, 5.327]
  - - [512, 256, 1, 8192, 512, 512, 8192, 8192]
    - [49, 7.069]
  - - [512, 512, 1, 128, 512, 512, 128, 128]
    - [41, 1.207]
  - - [512, 512, 1, 256, 512, 512, 256, 256]
    - [40, 2.132]
  - - [512, 512, 1, 512, 512, 512, 512, 512]
    - [41, 3.43]
  - - [512, 512, 1, 1024, 512, 512, 1024, 1024]
    - [49, 4.985]
  - - [512, 512, 1, 2048, 512, 512, 2048, 2048]
    - [51, 6.551]
  - - [512, 512, 1, 4096, 512, 512, 4096, 4096]
    - [0, 7.461]
  - - [512, 512, 1, 8192, 512, 512, 8192, 8192]
    - [30, 9.589]
  - - [512, 1024, 1, 128, 512, 512, 128, 128]
    - [38, 1.956]
  - - [512, 1024, 1, 256, 512, 512, 256, 256]
    - [38, 3.408]
  - - [512, 1024, 1, 512, 512, 512, 512, 512]
    - [38, 5.298]
  - - [512, 1024, 1, 1024, 512, 512, 1024, 1024]
    - [38, 7.356]
  - - [512, 1024, 1, 2048, 512, 512, 2048, 2048]
    - [6, 8.306]
  - - [512, 1024, 1, 4096, 512, 512, 4096, 4096]
    - [32, 9.841]
  - - [512, 1024, 1, 8192, 512, 512, 8192, 8192]
    - [21, 12.944]
  - - [512, 2048, 1, 128, 512, 512, 128, 128]
    - [25, 2.857]
  - - [512, 2048, 1, 256, 512, 512, 256, 256]
    - [25, 4.903]
  - - [512, 2048, 1, 512, 512, 512, 512, 512]
    - [25, 7.657]
  - - [512, 2048, 1, 1024, 512, 512, 1024, 1024]
    - [25, 10.614]
  - - [512, 2048, 1, 2048, 512, 512, 2048, 2048]
    - [32, 10.963]
  - - [512, 2048, 1, 4096, 512, 512, 4096, 4096]
    - [33, 12.649]
  - - [512, 2048, 1, 8192, 512, 512, 8192, 8192]
    - [25, 15.563]
  - - [512, 4096, 1, 128, 512, 512, 128, 128]
    - [25, 3.405]
  - - [512, 4096, 1, 256, 512, 512, 256, 256]
    - [38, 4.316]
  - - [512, 4096, 1, 512, 512, 512, 512, 512]
    - [23, 7.202]
  - - [512, 4096, 1, 1024, 512, 512, 1024, 1024]
    - [25, 9.855]
  - - [512, 4096, 1, 2048, 512, 512, 2048, 2048]
    - [31, 11.941]
  - - [512, 4096, 1, 4096, 512, 512, 4096, 4096]
    - [32, 14.114]
  - - [512, 4096, 1, 8192, 512, 512, 8192, 8192]
    - [33, 15.897]
  - - [512, 8192, 1, 128, 512, 512, 128, 128]
    - [21, 3.67]
  - - [512, 8192, 1, 256, 512, 512, 256, 256]
    - [21, 5.884]
  - - [512, 8192, 1, 512, 512, 512, 512, 512]
    - [21, 9.183]
  - - [512, 8192, 1, 1024, 512, 512, 1024, 1024]
    - [23, 12.269]
  - - [512, 8192, 1, 2048, 512, 512, 2048, 2048]
    - [23, 13.499]
  - - [512, 8192, 1, 4096, 512, 512, 4096, 4096]
    - [21, 15.358]
  - - [512, 8192, 1, 8192, 512, 512, 8192, 8192]
    - [21, 17.391]
  - - [1024, 128, 1, 128, 1024, 1024, 128, 128]
    - [45, 0.685]
  - - [1024, 128, 1, 256, 1024, 1024, 256, 256]
    - [10, 1.261]
  - - [1024, 128, 1, 512, 1024, 1024, 512, 512]
    - [44, 2.043]
  - - [1024, 128, 1, 1024, 1024, 1024, 1024, 1024]
    - [14, 3.09]
  - - [1024, 128, 1, 2048, 1024, 1024, 2048, 2048]
    - [13, 4.151]
  - - [1024, 128, 1, 4096, 1024, 1024, 4096, 4096]
    - [54, 5.336]
  - - [1024, 128, 1, 8192, 1024, 1024, 8192, 8192]
    - [49, 7.073]
  - - [1024, 256, 1, 128, 1024, 1024, 128, 128]
    - [8, 1.201]
  - - [1024, 256, 1, 256, 1024, 1024, 256, 256]
    - [40, 2.118]
  - - [1024, 256, 1, 512, 1024, 1024, 512, 512]
    - [40, 3.47]
  - - [1024, 256, 1, 1024, 1024, 1024, 1024, 1024]
    - [48, 5.012]
  - - [1024, 256, 1, 2048, 1024, 1024, 2048, 2048]
    - [12, 6.509]
  - - [1024, 256, 1, 4096, 1024, 1024, 4096, 4096]
    - [3, 7.486]
  - - [1024, 256, 1, 8192, 1024, 1024, 8192, 8192]
    - [33, 9.801]
  - - [1024, 512, 1, 128, 1024, 1024, 128, 128]
    - [38, 1.99]
  - - [1024, 512, 1, 256, 1024, 1024, 256, 256]
    - [38, 3.392]
  - - [1024, 512, 1, 512, 1024, 1024, 512, 512]
    - [38, 5.29]
  - - [1024, 512, 1, 1024, 1024, 1024, 1024, 1024]
    - [37, 7.327]
  - - [1024, 512, 1, 2048, 1024, 1024, 2048, 2048]
    - [5, 8.186]
  - - [1024, 512, 1, 4096, 1024, 1024, 4096, 4096]
    - [32, 9.842]
  - - [1024, 512, 1, 8192, 1024, 1024, 8192, 8192]
    - [30, 12.769]
  - - [1024, 1024, 1, 128, 1024, 1024, 128, 128]
    - [23, 2.853]
  - - [1024, 1024, 1, 256, 1024, 1024, 256, 256]
    - [25, 4.911]
  - - [1024, 1024, 1, 512, 1024, 1024, 512, 512]
    - [22, 7.685]
  - - [1024, 1024, 1, 1024, 1024, 1024, 1024, 1024]
    - [33, 10.537]
  - - [1024, 1024, 1, 2048, 1024, 1024, 2048, 2048]
    - [23, 10.686]
  - - [1024, 1024, 1, 4096, 1024, 1024, 4096, 4096]
    - [25, 12.297]
  - - [1024, 1024, 1, 8192, 1024, 1024, 8192, 8192]
    - [21, 15.385]
  - - [1024, 2048, 1, 128, 1024, 1024, 128, 128]
    - [25, 3.409]
  - - [1024, 2048, 1, 256, 1024, 1024, 256, 256]
    - [38, 4.371]
  - - [1024, 2048, 1, 512, 1024, 1024, 512, 512]
    - [25, 7.04]
  - - [1024, 2048, 1, 1024, 1024, 1024, 1024, 1024]
    - [23, 9.726]
  - - [1024, 2048, 1, 2048, 1024, 1024, 2048, 2048]
    - [23, 11.835]
  - - [1024, 2048, 1, 4096, 1024, 1024, 4096, 4096]
    - [25, 14.332]
  - - [1024, 2048, 1, 8192, 1024, 1024, 8192, 8192]
    - [21, 16.286]
  - - [1024, 4096, 1, 128, 1024, 1024, 128, 128]
    - [23, 3.725]
  - - [1024, 4096, 1, 256, 1024, 1024, 256, 256]
    - [25, 5.997]
  - - [1024, 4096, 1, 512, 1024, 1024, 512, 512]
    - [25, 9.271]
  - - [1024, 4096, 1, 1024, 1024, 1024, 1024, 1024]
    - [23, 11.732]
  - - [1024, 4096, 1, 2048, 1024, 1024, 2048, 2048]
    - [3, 13.284]
  - - [1024, 4096, 1, 4096, 1024, 1024, 4096, 4096]
    - [21, 15.216]
  - - [1024, 4096, 1, 8192, 1024, 1024, 8192, 8192]
    - [2, 17.028]
  - - [1024, 8192, 1, 128, 1024, 1024, 128, 128]
    - [25, 4.496]
  - - [1024, 8192, 1, 256, 1024, 1024, 256, 256]
    - [25, 7.235]
  - - [1024, 8192, 1, 512, 1024, 1024, 512, 512]
    - [25, 10.222]
  - - [1024, 8192, 1, 1024, 1024, 1024, 1024, 1024]
    - [0, 12.497]
  - - [1024, 8192, 1, 2048, 1024, 1024, 2048, 2048]
    - [2, 14.256]
  - - [1024, 8192, 1, 4096, 1024, 1024, 4096, 4096]
    - [21, 16.067]
  - - [1024, 8192, 1, 8192, 1024, 1024, 8192, 8192]
    - [21, 17.991]
  - - [2048, 128, 1, 128, 2048, 2048, 128, 128]
    - [40, 1.227]
  - - [2048, 128, 1, 256, 2048, 2048, 256, 256]
    - [40, 2.161]
  - - [2048, 128, 1, 512, 2048, 2048, 512, 512]
    - [40, 3.468]
  - - [2048, 128, 1, 1024, 2048, 2048, 1024, 1024]
    - [48, 5.03]
  - - [2048, 128, 1, 2048, 2048, 2048, 2048, 2048]
    - [52, 6.459]
  - - [2048, 128, 1, 4096, 2048, 2048, 4096, 4096]
    - [0, 7.262]
  - - [2048, 128, 1, 8192, 2048, 2048, 8192, 8192]
    - [21, 9.818]
  - - [2048, 256, 1, 128, 2048, 2048, 128, 128]
    - [38, 1.967]
  - - [2048, 256, 1, 256, 2048, 2048, 256, 256]
    - [38, 3.414]
  - - [2048, 256, 1, 512, 2048, 2048, 512, 512]
    - [37, 5.276]
  - - [2048, 256, 1, 1024, 2048, 2048, 1024, 1024]
    - [39, 7.226]
  - - [2048, 256, 1, 2048, 2048, 2048, 2048, 2048]
    - [0, 7.812]
  - - [2048, 256, 1, 4096, 2048, 2048, 4096, 4096]
    - [23, 9.929]
  - - [2048, 256, 1, 8192, 2048, 2048, 8192, 8192]
    - [31, 12.652]
  - - [2048, 512, 1, 128, 2048, 2048, 128, 128]
    - [23, 2.861]
  - - [2048, 512, 1, 256, 2048, 2048, 256, 256]
    - [20, 4.919]
  - - [2048, 512, 1, 512, 2048, 2048, 512, 512]
    - [26, 7.571]
  - - [2048, 512, 1, 1024, 2048, 2048, 1024, 1024]
    - [32, 10.52]
  - - [2048, 512, 1, 2048, 2048, 2048, 2048, 2048]
    - [32, 10.716]
  - - [2048, 512, 1, 4096, 2048, 2048, 4096, 4096]
    - [27, 12.284]
  - - [2048, 512, 1, 8192, 2048, 2048, 8192, 8192]
    - [31, 15.438]
  - - [2048, 1024, 1, 128, 2048, 2048, 128, 128]
    - [25, 3.438]
  - - [2048, 1024, 1, 256, 2048, 2048, 256, 256]
    - [38, 4.338]
  - - [2048, 1024, 1, 512, 2048, 2048, 512, 512]
    - [31, 7.002]
  - - [2048, 1024, 1, 1024, 2048, 2048, 1024, 1024]
    - [31, 9.747]
  - - [2048, 1024, 1, 2048, 2048, 2048, 2048, 2048]
    - [21, 11.911]
  - - [2048, 1024, 1, 4096, 2048, 2048, 4096, 4096]
    - [25, 13.902]
  - - [2048, 1024, 1, 8192, 2048, 2048, 8192, 8192]
    - [23, 16.44]
  - - [2048, 2048, 1, 128, 2048, 2048, 128, 128]
    - [23, 3.703]
  - - [2048, 2048, 1, 256, 2048, 2048, 256, 256]
    - [23, 6.047]
  - - [2048, 2048, 1, 512, 2048, 2048, 512, 512]
    - [23, 9.01]
  - - [2048, 2048, 1, 1024, 2048, 2048, 1024, 1024]
    - [33, 11.452]
  - - [2048, 2048, 1, 2048, 2048, 2048, 2048, 2048]
    - [3, 13.66]
  - - [2048, 2048, 1, 4096, 2048, 2048, 4096, 4096]
    - [31, 15.031]
  - - [2048, 2048, 1, 8192, 2048, 2048, 8192, 8192]
    - [32, 17.159]
  - - [2048, 4096, 1, 128, 2048, 2048, 128, 128]
    - [23, 4.55]
  - - [2048, 4096, 1, 256, 2048, 2048, 256, 256]
    - [23, 7.318]
  - - [2048, 4096, 1, 512, 2048, 2048, 512, 512]
    - [32, 9.926]
  - - [2048, 4096, 1, 1024, 2048, 2048, 1024, 1024]
    - [0, 12.652]
  - - [2048, 4096, 1, 2048, 2048, 2048, 2048, 2048]
    - [2, 13.87]
  - - [2048, 4096, 1, 4096, 2048, 2048, 4096, 4096]
    - [32, 15.989]
  - - [2048, 4096, 1, 8192, 2048, 2048, 8192, 8192]
    - [0, 18.053]
  - - [2048, 8192, 1, 128, 2048, 2048, 128, 128]
    - [23, 5.177]
  - - [2048, 8192, 1, 256, 2048, 2048, 256, 256]
    - [23, 7.774]
  - - [2048, 8192, 1, 512, 2048, 2048, 512, 512]
    - [2, 10.763]
  - - [2048, 8192, 1, 1024, 2048, 2048, 1024, 1024]
    - [0, 13.283]
  - - [2048, 8192, 1, 2048, 2048, 2048, 2048, 2048]
    - [0, 14.402]
  - - [2048, 8192, 1, 4096, 2048, 2048, 4096, 4096]
    - [31, 16.794]
  - - [2048, 8192, 1, 8192, 2048, 2048, 8192, 8192]
    - [31, 17.869]
  - - [4096, 128, 1, 128, 4096, 4096, 128, 128]
    - [7, 1.896]
  - - [4096, 128, 1, 256, 4096, 4096, 256, 256]
    - [38, 3.247]
  - - [4096, 128, 1, 512, 4096, 4096, 512, 512]
    - [38, 5.101]
  - - [4096, 128, 1, 1024, 4096, 4096, 1024, 1024]
    - [34, 7.009]
  - - [4096, 128, 1, 2048, 4096, 4096, 2048, 2048]
    - [0, 7.675]
  - - [4096, 128, 1, 4096, 4096, 4096, 4096, 4096]
    - [2, 10.381]
  - - [4096, 128, 1, 8192, 4096, 4096, 8192, 8192]
    - [2, 13.225]
  - - [4096, 256, 1, 128, 4096, 4096, 128, 128]
    - [21, 2.866]
  - - [4096, 256, 1, 256, 4096, 4096, 256, 256]
    - [21, 4.943]
  - - [4096, 256, 1, 512, 4096, 4096, 512, 512]
    - [31, 7.539]
  - - [4096, 256, 1, 1024, 4096, 4096, 1024, 1024]
    - [31, 10.029]
  - - [4096, 256, 1, 2048, 4096, 4096, 2048, 2048]
    - [21, 10.595]
  - - [4096, 256, 1, 4096, 4096, 4096, 4096, 4096]
    - [25, 12.547]
  - - [4096, 256, 1, 8192, 4096, 4096, 8192, 8192]
    - [21, 14.812]
  - - [4096, 512, 1, 128, 4096, 4096, 128, 128]
    - [27, 3.394]
  - - [4096, 512, 1, 256, 4096, 4096, 256, 256]
    - [31, 4.216]
  - - [4096, 512, 1, 512, 4096, 4096, 512, 512]
    - [31, 7.081]
  - - [4096, 512, 1, 1024, 4096, 4096, 1024, 1024]
    - [31, 9.694]
  - - [4096, 512, 1, 2048, 4096, 4096, 2048, 2048]
    - [31, 11.379]
  - - [4096, 512, 1, 4096, 4096, 4096, 4096, 4096]
    - [2, 14.047]
  - - [4096, 512, 1, 8192, 4096, 4096, 8192, 8192]
    - [1, 16.225]
  - - [4096, 1024, 1, 128, 4096, 4096, 128, 128]
    - [27, 3.608]
  - - [4096, 1024, 1, 256, 4096, 4096, 256, 256]
    - [0, 5.8]
  - - [4096, 1024, 1, 512, 4096, 4096, 512, 512]
    - [31, 8.952]
  - - [4096, 1024, 1, 1024, 4096, 4096, 1024, 1024]
    - [31, 11.607]
  - - [4096, 1024, 1, 2048, 4096, 4096, 2048, 2048]
    - [0, 12.809]
  - - [4096, 1024, 1, 4096, 4096, 4096, 4096, 4096]
    - [27, 15.163]
  - - [4096, 1024, 1, 8192, 4096, 4096, 8192, 8192]
    - [31, 17.368]
  - - [4096, 2048, 1, 128, 4096, 4096, 128, 128]
    - [27, 4.35]
  - - [4096, 2048, 1, 256, 4096, 4096, 256, 256]
    - [27, 6.92]
  - - [4096, 2048, 1, 512, 4096, 4096, 512, 512]
    - [27, 9.815]
  - - [4096, 2048, 1, 1024, 4096, 4096, 1024, 1024]
    - [0, 12.59]
  - - [4096, 2048, 1, 2048, 4096, 4096, 2048, 2048]
    - [32, 13.496]
  - - [4096, 2048, 1, 4096, 4096, 4096, 4096, 4096]
    - [32, 15.949]
  - - [4096, 2048, 1, 8192, 4096, 4096, 8192, 8192]
    - [31, 18.082]
  - - [4096, 4096, 1, 128, 4096, 4096, 128, 128]
    - [0, 5.022]
  - - [4096, 4096, 1, 256, 4096, 4096, 256, 256]
    - [0, 7.446]
  - - [4096, 4096, 1, 512, 4096, 4096, 512, 512]
    - [0, 10.576]
  - - [4096, 4096, 1, 1024, 4096, 4096, 1024, 1024]
    - [2, 13.316]
  - - [4096, 4096, 1, 2048, 4096, 4096, 2048, 2048]
    - [31, 13.589]
  - - [4096, 4096, 1, 4096, 4096, 4096, 4096, 4096]
    - [31, 16.724]
  - - [4096, 4096, 1, 8192, 4096, 4096, 8192, 8192]
    - [31, 18.597]
  - - [4096, 8192, 1, 128, 4096, 4096, 128, 128]
    - [0, 4.98]
  - - [4096, 8192, 1, 256, 4096, 4096, 256, 256]
    - [0, 7.321]
  - - [4096, 8192, 1, 512, 4096, 4096, 512, 512]
    - [0, 10.582]
  - - [4096, 8192, 1, 1024, 4096, 4096, 1024, 1024]
    - [0, 13.451]
  - - [4096, 8192, 1, 2048, 4096, 4096, 2048, 2048]
    - [0, 13.77]
  - - [4096, 8192, 1, 4096, 4096, 4096, 4096, 4096]
    - [32, 16.1]
  - - [4096, 8192, 1, 8192, 4096, 4096, 8192, 8192]
    - [31, 17.555]
  - - [8192, 128, 1, 128, 8192, 8192, 128, 128]
    - [20, 2.829]
  - - [8192, 128, 1, 256, 8192, 8192, 256, 256]
    - [20, 4.895]
  - - [8192, 128, 1, 512, 8192, 8192, 512, 512]
    - [21, 7.488]
  - - [8192, 128, 1, 1024, 8192, 8192, 1024, 1024]
    - [0, 9.094]
  - - [8192, 128, 1, 2048, 8192, 8192, 2048, 2048]
    - [21, 10.698]
  - - [8192, 128, 1, 4096, 8192, 8192, 4096, 4096]
    - [2, 13.133]
  - - [8192, 128, 1, 8192, 8192, 8192, 8192, 8192]
    - [4, 14.723]
  - - [8192, 256, 1, 128, 8192, 8192, 128, 128]
    - [21, 3.354]
  - - [8192, 256, 1, 256, 8192, 8192, 256, 256]
    - [28, 4.143]
  - - [8192, 256, 1, 512, 8192, 8192, 512, 512]
    - [27, 6.772]
  - - [8192, 256, 1, 1024, 8192, 8192, 1024, 1024]
    - [27, 9.622]
  - - [8192, 256, 1, 2048, 8192, 8192, 2048, 2048]
    - [23, 12.624]
  - - [8192, 256, 1, 4096, 8192, 8192, 4096, 4096]
    - [2, 14.057]
  - - [8192, 256, 1, 8192, 8192, 8192, 8192, 8192]
    - [2, 16.236]
  - - [8192, 512, 1, 128, 8192, 8192, 128, 128]
    - [21, 3.586]
  - - [8192, 512, 1, 256, 8192, 8192, 256, 256]
    - [0, 5.705]
  - - [8192, 512, 1, 512, 8192, 8192, 512, 512]
    - [33, 8.796]
  - - [8192, 512, 1, 1024, 8192, 8192, 1024, 1024]
    - [31, 11.413]
  - - [8192, 512, 1, 2048, 8192, 8192, 2048, 2048]
    - [27, 12.777]
  - - [8192, 512, 1, 4096, 8192, 8192, 4096, 4096]
    - [30, 15.154]
  - - [8192, 512, 1, 8192, 8192, 8192, 8192, 8192]
    - [29, 17.243]
  - - [8192, 1024, 1, 128, 8192, 8192, 128, 128]
    - [0, 4.369]
  - - [8192, 1024, 1, 256, 8192, 8192, 256, 256]
    - [0, 6.814]
  - - [8192, 1024, 1, 512, 8192, 8192, 512, 512]
    - [31, 9.802]
  - - [8192, 1024, 1, 1024, 8192, 8192, 1024, 1024]
    - [3, 12.276]
  - - [8192, 1024, 1, 2048, 8192, 8192, 2048, 2048]
    - [30, 13.216]
  - - [8192, 1024, 1, 4096, 8192, 8192, 4096, 4096]
    - [28, 15.882]
  - - [8192, 1024, 1, 8192, 8192, 8192, 8192, 8192]
    - [27, 18.068]
  - - [8192, 2048, 1, 128, 8192, 8192, 128, 128]
    - [0, 4.993]
  - - [8192, 2048, 1, 256, 8192, 8192, 256, 256]
    - [31, 7.275]
  - - [8192, 2048, 1, 512, 8192, 8192, 512, 512]
    - [31, 10.308]
  - - [8192, 2048, 1, 1024, 8192, 8192, 1024, 1024]
    - [2, 12.631]
  - - [8192, 2048, 1, 2048, 8192, 8192, 2048, 2048]
    - [32, 13.732]
  - - [8192, 2048, 1, 4096, 8192, 8192, 4096, 4096]
    - [32, 16.654]
  - - [8192, 2048, 1, 8192, 8192, 8192, 8192, 8192]
    - [31, 18.408]
  - - [8192, 4096, 1, 128, 8192, 8192, 128, 128]
    - [31, 4.91]
  - - [8192, 4096, 1, 256, 8192, 8192, 256, 256]
    - [31, 7.366]
  - - [8192, 4096, 1, 512, 8192, 8192, 512, 512]
    - [31, 10.36]
  - - [8192, 4096, 1, 1024, 8192, 8192, 1024, 1024]
    - [0, 12.931]
  - - [8192, 4096, 1, 2048, 8192, 8192, 2048, 2048]
    - [32, 13.517]
  - - [8192, 4096, 1, 4096, 8192, 8192, 4096, 4096]
    - [31, 16.809]
  - - [8192, 4096, 1, 8192, 8192, 8192, 8192, 8192]
    - [31, 17.774]
  - - [8192, 8192, 1, 128, 8192, 8192, 128, 128]
    - [0, 4.494]
  - - [8192, 8192, 1, 256, 8192, 8192, 256, 256]
    - [31, 7.066]
  - - [8192, 8192, 1, 512, 8192, 8192, 512, 512]
    - [31, 10.222]
  - - [8192, 8192, 1, 1024, 8192, 8192, 1024, 1024]
    - [0, 12.758]
  - - [8192, 8192, 1, 2048, 8192, 8192, 2048, 2048]
    - [31, 13.301]
  - - [8192, 8192, 1, 4096, 8192, 8192, 4096, 4096]
    - [31, 16.183]
  - - [8192, 8192, 1, 8192, 8192, 8192, 8192, 8192]
    - [31, 17.912]
  - - [1, 1, 1, 32, 1, 1, 32, 32]
    - [59, 0.0]
- null
- null
- ExperimentalStreamK
- GridBased
