library/src/amd_detail/rocblaslt/src/Tensile/Logic/asm_full/aquavanjaram/gfx942_80cu/StreamK/aquavanjaram942_Cijk_Ailk_Bljk_BSS_BH_UserArgs.yaml
- {MinimumRequiredVersion: 4.33.0}
- aquavanjaram942
- {Architecture: gfx942, CUCount: 80}
- [Device 0049, Device 0050]
    SolutionIndex: 0
    SolutionNameMin: Cijk_Ailk_Bljk_BSS_BH_UserArgs_MT256x256x32_MI16x16x1_SN_LDSB1_CLR1_GSU0_GSUC0_GSUWGMRR0_K1_LBSPPA2048_LBSPPB128_LPA32_MIWT8_8_PLR1_SU32_SUM0_SUS256_SKXCCM0_VWA2_VWB1_WGM1_WGMXCC1_WGMXCCGn1
    SolutionIndex: 1
    SolutionNameMin: Cijk_Ailk_Bljk_BSS_BH_UserArgs_MT256x256x32_MI16x16x1_SN_LDSB1_CLR1_GSU0_GSUC0_GSUWGMRR0_K1_LBSPPA2048_LBSPPB128_LPA0_MIWT8_8_PLR1_SU32_SUM0_SUS256_SKXCCM0_VWA4_VWB1_WGM1_WGMXCC1_WGMXCCGn1
    SolutionIndex: 2
    SolutionNameMin: Cijk_Ailk_Bljk_BSS_BH_UserArgs_MT256x256x32_MI16x16x1_SN_LDSB1_CLR1_GSU0_GSUC0_GSUWGMRR0_K1_LBSPPA2048_LBSPPB128_LPA0_MIWT8_8_PLR1_SU32_SUM0_SUS256_SKXCCM0_VWA4_VWB2_WGM1_WGMXCC1_WGMXCCGn1
    SolutionIndex: 3
    SolutionNameMin: Cijk_Ailk_Bljk_BSS_BH_UserArgs_MT256x256x32_MI16x16x1_SN_LDSB1_CLR1_GSU0_GSUC0_GSUWGMRR0_K1_LBSPPA2048_LBSPPB256_LPA0_MIWT8_8_PLR1_SU32_SUM0_SUS256_SKXCCM0_VWA4_VWB4_WGM1_WGMXCC1_WGMXCCGn1
    SolutionIndex: 4
    SolutionNameMin: Cijk_Ailk_Bljk_BSS_BH_UserArgs_MT256x256x32_MI16x16x1_SN_LDSB1_CLR1_GSU0_GSUC0_GSUWGMRR0_K1_LBSPPA2048_LBSPPB128_LPA0_MIWT8_8_PLR1_SU32_SUM0_SUS256_SKXCCM0_VWA4_VWB1_WGM2_WGMXCC1_WGMXCCGn1
    SolutionIndex: 5
    SolutionNameMin: Cijk_Ailk_Bljk_BSS_BH_UserArgs_MT256x256x32_MI16x16x1_SN_LDSB1_CLR1_GSU0_GSUC0_GSUWGMRR0_K1_LBSPPA2048_LBSPPB128_LPA0_MIWT8_8_PLR1_SU32_SUM0_SUS256_SKXCCM0_VWA4_VWB2_WGM2_WGMXCC1_WGMXCCGn1
    SolutionIndex: 6
    SolutionNameMin: Cijk_Ailk_Bljk_BSS_BH_UserArgs_MT256x256x32_MI16x16x1_SN_LDSB1_CLR1_GSU0_GSUC0_GSUWGMRR0_K1_LBSPPA2048_LBSPPB256_LPA0_MIWT8_8_PLR1_SU32_SUM0_SUS256_SKXCCM0_VWA4_VWB4_WGM2_WGMXCC1_WGMXCCGn1
    SolutionIndex: 7
    SolutionNameMin: Cijk_Ailk_Bljk_BSS_BH_UserArgs_MT256x256x32_MI16x16x1_SN_LDSB1_CLR1_GSU0_GSUC0_GSUWGMRR0_K1_LBSPPA2048_LBSPPB512_LPA0_MIWT8_8_PLR1_SU32_SUM0_SUS256_SKXCCM0_VWA4_VWB8_WGM2_WGMXCC1_WGMXCCGn1
    SolutionIndex: 8
    SolutionNameMin: Cijk_Ailk_Bljk_BSS_BH_UserArgs_MT256x256x32_MI16x16x1_SN_LDSB1_CLR1_GSU0_GSUC0_GSUWGMRR0_K1_LBSPPA2048_LBSPPB128_LPA0_MIWT8_8_PLR1_SU32_SUM0_SUS256_SKXCCM0_VWA4_VWB1_WGM4_WGMXCC1_WGMXCCGn1
    SolutionIndex: 9
    SolutionNameMin: Cijk_Ailk_Bljk_BSS_BH_UserArgs_MT256x256x32_MI16x16x1_SN_LDSB1_CLR1_GSU0_GSUC0_GSUWGMRR0_K1_LBSPPA2048_LBSPPB128_LPA0_MIWT8_8_PLR1_SU32_SUM0_SUS256_SKXCCM0_VWA4_VWB2_WGM4_WGMXCC1_WGMXCCGn1
    SolutionIndex: 10
    SolutionNameMin: Cijk_Ailk_Bljk_BSS_BH_UserArgs_MT256x128x32_MI16x16x1_SN_LDSB1_CLR1_GSU0_GSUC0_GSUWGMRR0_K1_LBSPPA2048_LBSPPB128_LPA0_MIWT8_4_PLR1_SU32_SUM0_SUS256_SKXCCM0_VWA4_VWB1_WGM1_WGMXCC1_WGMXCCGn1
    SolutionIndex: 11
    SolutionNameMin: Cijk_Ailk_Bljk_BSS_BH_UserArgs_MT256x128x32_MI16x16x1_SN_LDSB1_CLR1_GSU0_GSUC0_GSUWGMRR0_K1_LBSPPA2048_LBSPPB128_LPA0_MIWT8_4_PLR1_SU32_SUM0_SUS256_SKXCCM0_VWA4_VWB2_WGM1_WGMXCC1_WGMXCCGn1
    SolutionIndex: 12
    SolutionNameMin: Cijk_Ailk_Bljk_BSS_BH_UserArgs_MT256x128x32_MI16x16x1_SN_LDSB1_CLR1_GSU0_GSUC0_GSUWGMRR0_K1_LBSPPA2048_LBSPPB128_LPA0_MIWT8_4_PLR1_SU32_SUM0_SUS256_SKXCCM0_VWA4_VWB1_WGM2_WGMXCC1_WGMXCCGn1
    SolutionIndex: 13
    SolutionNameMin: Cijk_Ailk_Bljk_BSS_BH_UserArgs_MT256x128x32_MI16x16x1_SN_LDSB1_CLR1_GSU0_GSUC0_GSUWGMRR0_K1_LBSPPA2048_LBSPPB128_LPA0_MIWT8_4_PLR1_SU32_SUM0_SUS256_SKXCCM0_VWA4_VWB2_WGM4_WGMXCC1_WGMXCCGn1
    SolutionIndex: 14
    SolutionNameMin: Cijk_Ailk_Bljk_BSS_BH_UserArgs_MT128x64x32_MI16x16x1_SN_LDSB0_CLR1_GSU0_GSUC0_GSUWGMRR0_K1_LBSPPA1024_LBSPPB128_LPA0_MIWT4_2_PLR1_SU32_SUM0_SUS256_SKXCCM0_VWA4_VWB1_WGM2_WGMXCC1_WGMXCCGn1
    SolutionIndex: 15
    SolutionNameMin: Cijk_Ailk_Bljk_BSS_BH_UserArgs_MT32x32x32_MI16x16x1_SN_LDSB0_CLR1_GSU0_GSUC0_GSUWGMRR0_K1_LBSPPA256_LBSPPB128_LPA16_MIWT1_1_PLR1_SU32_SUM0_SUS256_SKXCCM0_VWA1_VWB1_WGM1_WGMXCC1_WGMXCCGn1
    SolutionIndex: 16
    SolutionNameMin: Cijk_Ailk_Bljk_BSS_BH_UserArgs_MT128x256x64_MI16x16x1_SN_LDSB1_CLR1_GSU0_GSUC0_GSUWGMRR0_K1_LBSPPA2048_LBSPPB128_LPA32_MIWT4_8_PLR1_SU32_SUM0_SUS256_SKXCCM0_VWA2_VWB1_WGM1_WGMXCC1_WGMXCCGn1
    SolutionIndex: 17
    SolutionNameMin: Cijk_Ailk_Bljk_BSS_BH_UserArgs_MT128x256x64_MI16x16x1_SN_LDSB1_CLR1_GSU0_GSUC0_GSUWGMRR0_K1_LBSPPA2048_LBSPPB128_LPA0_MIWT4_8_PLR1_SU32_SUM0_SUS256_SKXCCM0_VWA4_VWB1_WGM1_WGMXCC1_WGMXCCGn1
    SolutionIndex: 18
    SolutionNameMin: Cijk_Ailk_Bljk_BSS_BH_UserArgs_MT128x256x64_MI16x16x1_SN_LDSB1_CLR1_GSU0_GSUC0_GSUWGMRR0_K1_LBSPPA2048_LBSPPB256_LPA0_MIWT4_8_PLR1_SU32_SUM0_SUS256_SKXCCM0_VWA4_VWB2_WGM1_WGMXCC1_WGMXCCGn1
    SolutionIndex: 19
    SolutionNameMin: Cijk_Ailk_Bljk_BSS_BH_UserArgs_MT128x256x64_MI16x16x1_SN_LDSB1_CLR1_GSU0_GSUC0_GSUWGMRR0_K1_LBSPPA2048_LBSPPB512_LPA0_MIWT4_8_PLR1_SU32_SUM0_SUS256_SKXCCM0_VWA4_VWB4_WGM1_WGMXCC1_WGMXCCGn1
    SolutionIndex: 20
    SolutionNameMin: Cijk_Ailk_Bljk_BSS_BH_UserArgs_MT128x256x64_MI16x16x1_SN_LDSB1_CLR1_GSU0_GSUC0_GSUWGMRR0_K1_LBSPPA2048_LBSPPB1024_LPA0_MIWT4_8_PLR1_SU32_SUM0_SUS256_SKXCCM0_VWA4_VWB8_WGM1_WGMXCC1_WGMXCCGn1
    SolutionIndex: 21
    SolutionNameMin: Cijk_Ailk_Bljk_BSS_BH_UserArgs_MT128x256x64_MI16x16x1_SN_LDSB1_CLR1_GSU0_GSUC0_GSUWGMRR0_K1_LBSPPA2048_LBSPPB128_LPA0_MIWT4_8_PLR1_SU32_SUM0_SUS256_SKXCCM0_VWA4_VWB1_WGM2_WGMXCC1_WGMXCCGn1
    SolutionIndex: 22
    SolutionNameMin: Cijk_Ailk_Bljk_BSS_BH_UserArgs_MT256x128x64_MI16x16x1_SN_LDSB1_CLR1_GSU0_GSUC0_GSUWGMRR0_K1_LBSPPA4096_LBSPPB256_LPA0_MIWT8_4_PLR1_SU32_SUM0_SUS256_SKXCCM0_VWA4_VWB2_WGM1_WGMXCC1_WGMXCCGn1
    SolutionIndex: 23
    SolutionNameMin: Cijk_Ailk_Bljk_BSS_BH_UserArgs_MT256x128x64_MI16x16x1_SN_LDSB1_CLR1_GSU0_GSUC0_GSUWGMRR0_K1_LBSPPA4096_LBSPPB128_LPA0_MIWT8_4_PLR1_SU32_SUM0_SUS256_SKXCCM0_VWA4_VWB1_WGM4_WGMXCC1_WGMXCCGn1
    SolutionIndex: 24
    SolutionNameMin: Cijk_Ailk_Bljk_BSS_BH_UserArgs_MT128x128x64_MI16x16x1_SN_LDSB1_CLR1_GSU0_GSUC0_GSUWGMRR0_K1_LBSPPA2048_LBSPPB128_LPA0_MIWT4_4_PLR1_SU32_SUM0_SUS256_SKXCCM0_VWA4_VWB1_WGM1_WGMXCC1_WGMXCCGn1
    SolutionIndex: 25
    SolutionNameMin: Cijk_Ailk_Bljk_BSS_BH_UserArgs_MT128x128x64_MI16x16x1_SN_LDSB1_CLR1_GSU0_GSUC0_GSUWGMRR0_K1_LBSPPA2048_LBSPPB256_LPA0_MIWT4_4_PLR1_SU32_SUM0_SUS256_SKXCCM0_VWA4_VWB2_WGM1_WGMXCC1_WGMXCCGn1
    SolutionIndex: 26
    SolutionNameMin: Cijk_Ailk_Bljk_BSS_BH_UserArgs_MT128x128x64_MI16x16x1_SN_LDSB1_CLR1_GSU0_GSUC0_GSUWGMRR0_K1_LBSPPA2048_LBSPPB512_LPA0_MIWT4_4_PLR1_SU32_SUM0_SUS256_SKXCCM0_VWA4_VWB4_WGM1_WGMXCC1_WGMXCCGn1
    SolutionIndex: 27
    SolutionNameMin: Cijk_Ailk_Bljk_BSS_BH_UserArgs_MT128x128x64_MI16x16x1_SN_LDSB1_CLR1_GSU0_GSUC0_GSUWGMRR0_K1_LBSPPA2048_LBSPPB256_LPA0_MIWT4_4_PLR1_SU32_SUM0_SUS256_SKXCCM0_VWA4_VWB2_WGM2_WGMXCC1_WGMXCCGn1
    SolutionIndex: 28
    SolutionNameMin: Cijk_Ailk_Bljk_BSS_BH_UserArgs_MT128x128x64_MI16x16x1_SN_LDSB1_CLR1_GSU0_GSUC0_GSUWGMRR0_K1_LBSPPA2048_LBSPPB512_LPA0_MIWT4_4_PLR1_SU32_SUM0_SUS256_SKXCCM0_VWA4_VWB4_WGM2_WGMXCC1_WGMXCCGn1
    SolutionIndex: 29
    SolutionNameMin: Cijk_Ailk_Bljk_BSS_BH_UserArgs_MT128x128x64_MI16x16x1_SN_LDSB1_CLR1_GSU0_GSUC0_GSUWGMRR0_K1_LBSPPA2048_LBSPPB512_LPA0_MIWT4_4_PLR1_SU32_SUM0_SUS256_SKXCCM0_VWA4_VWB4_WGM4_WGMXCC1_WGMXCCGn1
    SolutionIndex: 30
    SolutionNameMin: Cijk_Ailk_Bljk_BSS_BH_UserArgs_MT128x64x64_MI16x16x1_SN_LDSB1_CLR1_GSU0_GSUC0_GSUWGMRR0_K1_LBSPPA2048_LBSPPB256_LPA0_MIWT4_2_PLR1_SU32_SUM0_SUS256_SKXCCM0_VWA4_VWB2_WGM1_WGMXCC1_WGMXCCGn1
    SolutionIndex: 31
    SolutionNameMin: Cijk_Ailk_Bljk_BSS_BH_UserArgs_MT128x64x64_MI16x16x1_SN_LDSB1_CLR1_GSU0_GSUC0_GSUWGMRR0_K1_LBSPPA2048_LBSPPB128_LPA0_MIWT4_2_PLR1_SU32_SUM0_SUS256_SKXCCM0_VWA4_VWB1_WGM2_WGMXCC1_WGMXCCGn1
    SolutionIndex: 32
    SolutionNameMin: Cijk_Ailk_Bljk_BSS_BH_UserArgs_MT32x64x64_MI16x16x1_SN_LDSB0_CLR1_GSU0_GSUC0_GSUWGMRR0_K1_LBSPPA512_LBSPPB256_LPA16_MIWT1_2_PLR1_SU32_SUM0_SUS256_SKXCCM0_VWA1_VWB2_WGM1_WGMXCC1_WGMXCCGn1
    SolutionIndex: 33
    SolutionNameMin: Cijk_Ailk_Bljk_BSS_BH_UserArgs_MT32x32x64_MI16x16x1_SN_LDSB0_CLR1_GSU0_GSUC0_GSUWGMRR0_K1_LBSPPA512_LBSPPB128_LPA16_MIWT1_1_PLR1_SU32_SUM0_SUS256_SKXCCM0_VWA1_VWB1_WGM1_WGMXCC1_WGMXCCGn1
    SolutionIndex: 34
    SolutionNameMin: Cijk_Ailk_Bljk_BSS_BH_UserArgs_MT128x64x128_MI16x16x1_SN_LDSB1_CLR1_GSU0_GSUC0_GSUWGMRR0_K1_LBSPPA2048_LBSPPB256_LPA0_MIWT4_2_PLR2_SU32_SUM0_SUS256_SKXCCM0_VWA4_VWB1_WGM1_WGMXCC1_WGMXCCGn1
    SolutionIndex: 35
    SolutionNameMin: Cijk_Ailk_Bljk_BSS_BH_UserArgs_MT128x64x128_MI16x16x1_SN_LDSB1_CLR1_GSU0_GSUC0_GSUWGMRR0_K1_LBSPPA2048_LBSPPB256_LPA0_MIWT4_2_PLR2_SU32_SUM0_SUS256_SKXCCM0_VWA4_VWB1_WGM2_WGMXCC1_WGMXCCGn1
    SolutionIndex: 36
    SolutionNameMin: Cijk_Ailk_Bljk_BSS_BH_UserArgs_MT64x64x128_MI16x16x1_SN_LDSB1_CLR1_GSU0_GSUC0_GSUWGMRR0_K1_LBSPPA1024_LBSPPB256_LPA32_MIWT2_2_PLR2_SU32_SUM0_SUS256_SKXCCM0_VWA2_VWB1_WGM1_WGMXCC1_WGMXCCGn1
    SolutionIndex: 37
    SolutionNameMin: Cijk_Ailk_Bljk_BSS_BH_UserArgs_MT64x64x128_MI16x16x1_SN_LDSB1_CLR1_GSU0_GSUC0_GSUWGMRR0_K1_LBSPPA1024_LBSPPB256_LPA32_MIWT2_2_PLR2_SU32_SUM0_SUS256_SKXCCM0_VWA2_VWB1_WGM2_WGMXCC1_WGMXCCGn1
    SolutionIndex: 38
    SolutionNameMin: Cijk_Ailk_Bljk_BSS_BH_UserArgs_MT64x32x128_MI16x16x1_SN_LDSB1_CLR1_GSU0_GSUC0_GSUWGMRR0_K1_LBSPPA1024_LBSPPB256_LPA32_MIWT2_1_PLR2_SU32_SUM0_SUS256_SKXCCM0_VWA2_VWB1_WGM1_WGMXCC1_WGMXCCGn1
    SolutionIndex: 39
    SolutionNameMin: Cijk_Ailk_Bljk_BSS_BH_UserArgs_MT32x32x128_MI16x16x1_SN_LDSB1_CLR1_GSU0_GSUC0_GSUWGMRR0_K1_LBSPPA512_LBSPPB256_LPA16_MIWT1_1_PLR1_SU32_SUM0_SUS256_SKXCCM0_VWA1_VWB1_WGM1_WGMXCC1_WGMXCCGn1
    SolutionIndex: 40
    SolutionNameMin: Cijk_Ailk_Bljk_BSS_BH_UserArgs_MT32x32x128_MI16x16x1_SN_LDSB1_CLR1_GSU0_GSUC0_GSUWGMRR0_K1_LBSPPA512_LBSPPB256_LPA16_MIWT1_1_PLR2_SU32_SUM0_SUS256_SKXCCM0_VWA1_VWB1_WGM1_WGMXCC1_WGMXCCGn1
    SolutionIndex: 41
    SolutionNameMin: Cijk_Ailk_Bljk_BSS_BH_UserArgs_MT256x256x32_MI16x16x1_SN_LDSB1_CLR1_GSU0_GSUC0_GSUWGMRR0_K1_LBSPPA2048_LBSPPB128_LPA0_MIWT8_8_PLR1_SU32_SUM0_SUS256_SKXCCM4_VWA4_VWB1_WGM1_WGMXCC1_WGMXCCGn1
    SolutionIndex: 42
    SolutionNameMin: Cijk_Ailk_Bljk_BSS_BH_UserArgs_MT256x256x32_MI16x16x1_SN_LDSB1_CLR1_GSU0_GSUC0_GSUWGMRR0_K1_LBSPPA2048_LBSPPB128_LPA0_MIWT8_8_PLR1_SU32_SUM0_SUS256_SKXCCM4_VWA4_VWB2_WGM1_WGMXCC1_WGMXCCGn1
    SolutionIndex: 43
    SolutionNameMin: Cijk_Ailk_Bljk_BSS_BH_UserArgs_MT256x256x32_MI16x16x1_SN_LDSB1_CLR1_GSU0_GSUC0_GSUWGMRR0_K1_LBSPPA2048_LBSPPB256_LPA0_MIWT8_8_PLR1_SU32_SUM0_SUS256_SKXCCM4_VWA4_VWB4_WGM1_WGMXCC1_WGMXCCGn1
    SolutionIndex: 44
    SolutionNameMin: Cijk_Ailk_Bljk_BSS_BH_UserArgs_MT256x256x32_MI16x16x1_SN_LDSB1_CLR1_GSU0_GSUC0_GSUWGMRR0_K1_LBSPPA2048_LBSPPB512_LPA32_MIWT8_8_PLR1_SU32_SUM0_SUS256_SKXCCM4_VWA2_VWB8_WGM1_WGMXCC1_WGMXCCGn1
    SolutionIndex: 45
    SolutionNameMin: Cijk_Ailk_Bljk_BSS_BH_UserArgs_MT256x256x32_MI16x16x1_SN_LDSB1_CLR1_GSU0_GSUC0_GSUWGMRR0_K1_LBSPPA2048_LBSPPB512_LPA0_MIWT8_8_PLR1_SU32_SUM0_SUS256_SKXCCM4_VWA4_VWB8_WGM1_WGMXCC1_WGMXCCGn1
    SolutionIndex: 46
    SolutionNameMin: Cijk_Ailk_Bljk_BSS_BH_UserArgs_MT256x256x32_MI16x16x1_SN_LDSB1_CLR1_GSU0_GSUC0_GSUWGMRR0_K1_LBSPPA2048_LBSPPB128_LPA0_MIWT8_8_PLR1_SU32_SUM0_SUS256_SKXCCM4_VWA4_VWB1_WGM2_WGMXCC1_WGMXCCGn1
    SolutionIndex: 47
    SolutionNameMin: Cijk_Ailk_Bljk_BSS_BH_UserArgs_MT256x256x32_MI16x16x1_SN_LDSB1_CLR1_GSU0_GSUC0_GSUWGMRR0_K1_LBSPPA2048_LBSPPB128_LPA0_MIWT8_8_PLR1_SU32_SUM0_SUS256_SKXCCM4_VWA4_VWB2_WGM2_WGMXCC1_WGMXCCGn1
    SolutionIndex: 48
    SolutionNameMin: Cijk_Ailk_Bljk_BSS_BH_UserArgs_MT256x256x32_MI16x16x1_SN_LDSB1_CLR1_GSU0_GSUC0_GSUWGMRR0_K1_LBSPPA2048_LBSPPB256_LPA0_MIWT8_8_PLR1_SU32_SUM0_SUS256_SKXCCM4_VWA4_VWB4_WGM2_WGMXCC1_WGMXCCGn1
    SolutionIndex: 49
    SolutionNameMin: Cijk_Ailk_Bljk_BSS_BH_UserArgs_MT256x256x32_MI16x16x1_SN_LDSB1_CLR1_GSU0_GSUC0_GSUWGMRR0_K1_LBSPPA2048_LBSPPB512_LPA0_MIWT8_8_PLR1_SU32_SUM0_SUS256_SKXCCM4_VWA4_VWB8_WGM2_WGMXCC1_WGMXCCGn1
    SolutionIndex: 50
    SolutionNameMin: Cijk_Ailk_Bljk_BSS_BH_UserArgs_MT256x256x32_MI16x16x1_SN_LDSB1_CLR1_GSU0_GSUC0_GSUWGMRR0_K1_LBSPPA2048_LBSPPB128_LPA0_MIWT8_8_PLR1_SU32_SUM0_SUS256_SKXCCM4_VWA4_VWB1_WGM4_WGMXCC1_WGMXCCGn1
    SolutionIndex: 51
    SolutionNameMin: Cijk_Ailk_Bljk_BSS_BH_UserArgs_MT256x256x32_MI16x16x1_SN_LDSB1_CLR1_GSU0_GSUC0_GSUWGMRR0_K1_LBSPPA2048_LBSPPB128_LPA0_MIWT8_8_PLR1_SU32_SUM0_SUS256_SKXCCM4_VWA4_VWB2_WGM4_WGMXCC1_WGMXCCGn1
    SolutionIndex: 52
    SolutionNameMin: Cijk_Ailk_Bljk_BSS_BH_UserArgs_MT256x256x32_MI16x16x1_SN_LDSB1_CLR1_GSU0_GSUC0_GSUWGMRR0_K1_LBSPPA2048_LBSPPB512_LPA0_MIWT8_8_PLR1_SU32_SUM0_SUS256_SKXCCM4_VWA4_VWB8_WGM4_WGMXCC1_WGMXCCGn1
    SolutionIndex: 53
    SolutionNameMin: Cijk_Ailk_Bljk_BSS_BH_UserArgs_MT256x128x32_MI16x16x1_SN_LDSB1_CLR1_GSU0_GSUC0_GSUWGMRR0_K1_LBSPPA2048_LBSPPB128_LPA0_MIWT8_4_PLR1_SU32_SUM0_SUS256_SKXCCM4_VWA4_VWB1_WGM1_WGMXCC1_WGMXCCGn1
    SolutionIndex: 54
    SolutionNameMin: Cijk_Ailk_Bljk_BSS_BH_UserArgs_MT256x128x32_MI16x16x1_SN_LDSB1_CLR1_GSU0_GSUC0_GSUWGMRR0_K1_LBSPPA2048_LBSPPB128_LPA0_MIWT8_4_PLR1_SU32_SUM0_SUS256_SKXCCM4_VWA4_VWB2_WGM1_WGMXCC1_WGMXCCGn1
    SolutionIndex: 55
    SolutionNameMin: Cijk_Ailk_Bljk_BSS_BH_UserArgs_MT256x128x32_MI16x16x1_SN_LDSB1_CLR1_GSU0_GSUC0_GSUWGMRR0_K1_LBSPPA2048_LBSPPB256_LPA0_MIWT8_4_PLR1_SU32_SUM0_SUS256_SKXCCM4_VWA4_VWB4_WGM1_WGMXCC1_WGMXCCGn1
    SolutionIndex: 56
    SolutionNameMin: Cijk_Ailk_Bljk_BSS_BH_UserArgs_MT256x128x32_MI16x16x1_SN_LDSB1_CLR1_GSU0_GSUC0_GSUWGMRR0_K1_LBSPPA2048_LBSPPB128_LPA0_MIWT8_4_PLR1_SU32_SUM0_SUS256_SKXCCM4_VWA4_VWB1_WGM2_WGMXCC1_WGMXCCGn1
    SolutionIndex: 57
    SolutionNameMin: Cijk_Ailk_Bljk_BSS_BH_UserArgs_MT256x128x32_MI16x16x1_SN_LDSB1_CLR1_GSU0_GSUC0_GSUWGMRR0_K1_LBSPPA2048_LBSPPB128_LPA0_MIWT8_4_PLR1_SU32_SUM0_SUS256_SKXCCM4_VWA4_VWB2_WGM2_WGMXCC1_WGMXCCGn1
    SolutionIndex: 58
    SolutionNameMin: Cijk_Ailk_Bljk_BSS_BH_UserArgs_MT256x128x32_MI16x16x1_SN_LDSB1_CLR1_GSU0_GSUC0_GSUWGMRR0_K1_LBSPPA2048_LBSPPB128_LPA0_MIWT8_4_PLR1_SU32_SUM0_SUS256_SKXCCM4_VWA4_VWB1_WGM4_WGMXCC1_WGMXCCGn1
    SolutionIndex: 59
    SolutionNameMin: Cijk_Ailk_Bljk_BSS_BH_UserArgs_MT256x128x32_MI16x16x1_SN_LDSB1_CLR1_GSU0_GSUC0_GSUWGMRR0_K1_LBSPPA2048_LBSPPB128_LPA0_MIWT8_4_PLR1_SU32_SUM0_SUS256_SKXCCM4_VWA4_VWB2_WGM4_WGMXCC1_WGMXCCGn1
    SolutionIndex: 60
    SolutionNameMin: Cijk_Ailk_Bljk_BSS_BH_UserArgs_MT256x128x32_MI16x16x1_SN_LDSB1_CLR1_GSU0_GSUC0_GSUWGMRR0_K1_LBSPPA2048_LBSPPB256_LPA0_MIWT8_4_PLR1_SU32_SUM0_SUS256_SKXCCM4_VWA4_VWB4_WGM4_WGMXCC1_WGMXCCGn1
    SolutionIndex: 61
    SolutionNameMin: Cijk_Ailk_Bljk_BSS_BH_UserArgs_MT128x128x32_MI16x16x1_SN_LDSB1_CLR1_GSU0_GSUC0_GSUWGMRR0_K1_LBSPPA1024_LBSPPB128_LPA0_MIWT4_4_PLR1_SU32_SUM0_SUS256_SKXCCM4_VWA4_VWB1_WGM1_WGMXCC1_WGMXCCGn1
    SolutionIndex: 62
    SolutionNameMin: Cijk_Ailk_Bljk_BSS_BH_UserArgs_MT128x128x32_MI16x16x1_SN_LDSB1_CLR1_GSU0_GSUC0_GSUWGMRR0_K1_LBSPPA1024_LBSPPB128_LPA0_MIWT4_4_PLR1_SU32_SUM0_SUS256_SKXCCM4_VWA4_VWB2_WGM1_WGMXCC1_WGMXCCGn1
    SolutionIndex: 63
    SolutionNameMin: Cijk_Ailk_Bljk_BSS_BH_UserArgs_MT128x128x32_MI16x16x1_SN_LDSB1_CLR1_GSU0_GSUC0_GSUWGMRR0_K1_LBSPPA1024_LBSPPB256_LPA0_MIWT4_4_PLR1_SU32_SUM0_SUS256_SKXCCM4_VWA4_VWB4_WGM1_WGMXCC1_WGMXCCGn1
    SolutionIndex: 64
    SolutionNameMin: Cijk_Ailk_Bljk_BSS_BH_UserArgs_MT128x128x32_MI16x16x1_SN_LDSB1_CLR1_GSU0_GSUC0_GSUWGMRR0_K1_LBSPPA1024_LBSPPB128_LPA0_MIWT4_4_PLR1_SU32_SUM0_SUS256_SKXCCM4_VWA4_VWB1_WGM2_WGMXCC1_WGMXCCGn1
    SolutionIndex: 65
    SolutionNameMin: Cijk_Ailk_Bljk_BSS_BH_UserArgs_MT128x64x32_MI16x16x1_SN_LDSB0_CLR1_GSU0_GSUC0_GSUWGMRR0_K1_LBSPPA1024_LBSPPB128_LPA0_MIWT4_2_PLR1_SU32_SUM0_SUS256_SKXCCM4_VWA4_VWB1_WGM1_WGMXCC1_WGMXCCGn1
    SolutionIndex: 66
    SolutionNameMin: Cijk_Ailk_Bljk_BSS_BH_UserArgs_MT128x64x32_MI16x16x1_SN_LDSB0_CLR1_GSU0_GSUC0_GSUWGMRR0_K1_LBSPPA1024_LBSPPB128_LPA0_MIWT4_2_PLR1_SU32_SUM0_SUS256_SKXCCM4_VWA4_VWB2_WGM1_WGMXCC1_WGMXCCGn1
    SolutionIndex: 67
    SolutionNameMin: Cijk_Ailk_Bljk_BSS_BH_UserArgs_MT128x64x32_MI16x16x1_SN_LDSB0_CLR1_GSU0_GSUC0_GSUWGMRR0_K1_LBSPPA1024_LBSPPB128_LPA0_MIWT4_2_PLR1_SU32_SUM0_SUS256_SKXCCM4_VWA4_VWB1_WGM4_WGMXCC1_WGMXCCGn1
    SolutionIndex: 68
    SolutionNameMin: Cijk_Ailk_Bljk_BSS_BH_UserArgs_MT128x256x64_MI16x16x1_SN_LDSB1_CLR1_GSU0_GSUC0_GSUWGMRR0_K1_LBSPPA2048_LBSPPB128_LPA0_MIWT4_8_PLR1_SU32_SUM0_SUS256_SKXCCM4_VWA4_VWB1_WGM1_WGMXCC1_WGMXCCGn1
    SolutionIndex: 69
    SolutionNameMin: Cijk_Ailk_Bljk_BSS_BH_UserArgs_MT128x256x64_MI16x16x1_SN_LDSB1_CLR1_GSU0_GSUC0_GSUWGMRR0_K1_LBSPPA2048_LBSPPB256_LPA0_MIWT4_8_PLR1_SU32_SUM0_SUS256_SKXCCM4_VWA4_VWB2_WGM1_WGMXCC1_WGMXCCGn1
    SolutionIndex: 70
    SolutionNameMin: Cijk_Ailk_Bljk_BSS_BH_UserArgs_MT128x256x64_MI16x16x1_SN_LDSB1_CLR1_GSU0_GSUC0_GSUWGMRR0_K1_LBSPPA2048_LBSPPB512_LPA0_MIWT4_8_PLR1_SU32_SUM0_SUS256_SKXCCM4_VWA4_VWB4_WGM1_WGMXCC1_WGMXCCGn1
    SolutionIndex: 71
    SolutionNameMin: Cijk_Ailk_Bljk_BSS_BH_UserArgs_MT128x256x64_MI16x16x1_SN_LDSB1_CLR1_GSU0_GSUC0_GSUWGMRR0_K1_LBSPPA2048_LBSPPB1024_LPA0_MIWT4_8_PLR1_SU32_SUM0_SUS256_SKXCCM4_VWA4_VWB8_WGM2_WGMXCC1_WGMXCCGn1
    SolutionIndex: 72
    SolutionNameMin: Cijk_Ailk_Bljk_BSS_BH_UserArgs_MT128x256x64_MI16x16x1_SN_LDSB1_CLR1_GSU0_GSUC0_GSUWGMRR0_K1_LBSPPA2048_LBSPPB128_LPA0_MIWT4_8_PLR1_SU32_SUM0_SUS256_SKXCCM4_VWA4_VWB1_WGM4_WGMXCC1_WGMXCCGn1
    SolutionIndex: 73
    SolutionNameMin: Cijk_Ailk_Bljk_BSS_BH_UserArgs_MT128x256x64_MI16x16x1_SN_LDSB1_CLR1_GSU0_GSUC0_GSUWGMRR0_K1_LBSPPA2048_LBSPPB256_LPA0_MIWT4_8_PLR1_SU32_SUM0_SUS256_SKXCCM4_VWA4_VWB2_WGM4_WGMXCC1_WGMXCCGn1
    SolutionIndex: 74
    SolutionNameMin: Cijk_Ailk_Bljk_BSS_BH_UserArgs_MT256x128x64_MI16x16x1_SN_LDSB1_CLR1_GSU0_GSUC0_GSUWGMRR0_K1_LBSPPA4096_LBSPPB128_LPA0_MIWT8_4_PLR1_SU32_SUM0_SUS256_SKXCCM4_VWA4_VWB1_WGM4_WGMXCC1_WGMXCCGn1
    SolutionIndex: 75
    SolutionNameMin: Cijk_Ailk_Bljk_BSS_BH_UserArgs_MT128x128x64_MI16x16x1_SN_LDSB1_CLR1_GSU0_GSUC0_GSUWGMRR0_K1_LBSPPA2048_LBSPPB128_LPA0_MIWT4_4_PLR1_SU32_SUM0_SUS256_SKXCCM4_VWA4_VWB1_WGM1_WGMXCC1_WGMXCCGn1
    SolutionIndex: 76
    SolutionNameMin: Cijk_Ailk_Bljk_BSS_BH_UserArgs_MT128x128x64_MI16x16x1_SN_LDSB1_CLR1_GSU0_GSUC0_GSUWGMRR0_K1_LBSPPA2048_LBSPPB256_LPA0_MIWT4_4_PLR1_SU32_SUM0_SUS256_SKXCCM4_VWA4_VWB2_WGM1_WGMXCC1_WGMXCCGn1
    SolutionIndex: 77
    SolutionNameMin: Cijk_Ailk_Bljk_BSS_BH_UserArgs_MT128x128x64_MI16x16x1_SN_LDSB1_CLR1_GSU0_GSUC0_GSUWGMRR0_K1_LBSPPA2048_LBSPPB512_LPA0_MIWT4_4_PLR1_SU32_SUM0_SUS256_SKXCCM4_VWA4_VWB4_WGM1_WGMXCC1_WGMXCCGn1
    SolutionIndex: 78
    SolutionNameMin: Cijk_Ailk_Bljk_BSS_BH_UserArgs_MT128x128x64_MI16x16x1_SN_LDSB1_CLR1_GSU0_GSUC0_GSUWGMRR0_K1_LBSPPA2048_LBSPPB128_LPA0_MIWT4_4_PLR1_SU32_SUM0_SUS256_SKXCCM4_VWA4_VWB1_WGM2_WGMXCC1_WGMXCCGn1
    SolutionIndex: 79
    SolutionNameMin: Cijk_Ailk_Bljk_BSS_BH_UserArgs_MT128x128x64_MI16x16x1_SN_LDSB1_CLR1_GSU0_GSUC0_GSUWGMRR0_K1_LBSPPA2048_LBSPPB256_LPA0_MIWT4_4_PLR1_SU32_SUM0_SUS256_SKXCCM4_VWA4_VWB2_WGM2_WGMXCC1_WGMXCCGn1
    SolutionIndex: 80
    SolutionNameMin: Cijk_Ailk_Bljk_BSS_BH_UserArgs_MT128x128x64_MI16x16x1_SN_LDSB1_CLR1_GSU0_GSUC0_GSUWGMRR0_K1_LBSPPA2048_LBSPPB512_LPA0_MIWT4_4_PLR1_SU32_SUM0_SUS256_SKXCCM4_VWA4_VWB4_WGM2_WGMXCC1_WGMXCCGn1
    SolutionIndex: 81
    SolutionNameMin: Cijk_Ailk_Bljk_BSS_BH_UserArgs_MT128x128x64_MI16x16x1_SN_LDSB1_CLR1_GSU0_GSUC0_GSUWGMRR0_K1_LBSPPA2048_LBSPPB128_LPA0_MIWT4_4_PLR1_SU32_SUM0_SUS256_SKXCCM4_VWA4_VWB1_WGM4_WGMXCC1_WGMXCCGn1
    SolutionIndex: 82
    SolutionNameMin: Cijk_Ailk_Bljk_BSS_BH_UserArgs_MT128x128x64_MI16x16x1_SN_LDSB1_CLR1_GSU0_GSUC0_GSUWGMRR0_K1_LBSPPA2048_LBSPPB512_LPA0_MIWT4_4_PLR1_SU32_SUM0_SUS256_SKXCCM4_VWA4_VWB4_WGM4_WGMXCC1_WGMXCCGn1
    SolutionIndex: 83
    SolutionNameMin: Cijk_Ailk_Bljk_BSS_BH_UserArgs_MT128x64x64_MI16x16x1_SN_LDSB1_CLR1_GSU0_GSUC0_GSUWGMRR0_K1_LBSPPA2048_LBSPPB128_LPA0_MIWT4_2_PLR1_SU32_SUM0_SUS256_SKXCCM4_VWA4_VWB1_WGM1_WGMXCC1_WGMXCCGn1
    SolutionIndex: 84
    SolutionNameMin: Cijk_Ailk_Bljk_BSS_BH_UserArgs_MT128x64x64_MI16x16x1_SN_LDSB1_CLR1_GSU0_GSUC0_GSUWGMRR0_K1_LBSPPA2048_LBSPPB256_LPA0_MIWT4_2_PLR1_SU32_SUM0_SUS256_SKXCCM4_VWA4_VWB2_WGM1_WGMXCC1_WGMXCCGn1
    SolutionIndex: 85
    SolutionNameMin: Cijk_Ailk_Bljk_BSS_BH_UserArgs_MT128x64x64_MI16x16x1_SN_LDSB1_CLR1_GSU0_GSUC0_GSUWGMRR0_K1_LBSPPA2048_LBSPPB256_LPA0_MIWT4_2_PLR1_SU32_SUM0_SUS256_SKXCCM4_VWA4_VWB2_WGM4_WGMXCC1_WGMXCCGn1
    SolutionIndex: 86
    SolutionNameMin: Cijk_Ailk_Bljk_BSS_BH_UserArgs_MT64x64x64_MI16x16x1_SN_LDSB1_CLR1_GSU0_GSUC0_GSUWGMRR0_K1_LBSPPA1024_LBSPPB128_LPA32_MIWT2_2_PLR1_SU32_SUM0_SUS256_SKXCCM4_VWA2_VWB1_WGM1_WGMXCC1_WGMXCCGn1
    SolutionIndex: 87
    SolutionNameMin: Cijk_Ailk_Bljk_BSS_BH_UserArgs_MT64x64x64_MI16x16x1_SN_LDSB1_CLR1_GSU0_GSUC0_GSUWGMRR0_K1_LBSPPA1024_LBSPPB256_LPA32_MIWT2_2_PLR1_SU32_SUM0_SUS256_SKXCCM4_VWA2_VWB2_WGM1_WGMXCC1_WGMXCCGn1
    SolutionIndex: 88
    SolutionNameMin: Cijk_Ailk_Bljk_BSS_BH_UserArgs_MT32x64x64_MI16x16x1_SN_LDSB0_CLR1_GSU0_GSUC0_GSUWGMRR0_K1_LBSPPA512_LBSPPB128_LPA16_MIWT1_2_PLR1_SU32_SUM0_SUS256_SKXCCM4_VWA1_VWB1_WGM1_WGMXCC1_WGMXCCGn1
    SolutionIndex: 89
    SolutionNameMin: Cijk_Ailk_Bljk_BSS_BH_UserArgs_MT32x64x64_MI16x16x1_SN_LDSB0_CLR1_GSU0_GSUC0_GSUWGMRR0_K1_LBSPPA512_LBSPPB256_LPA16_MIWT1_2_PLR1_SU32_SUM0_SUS256_SKXCCM4_VWA1_VWB2_WGM1_WGMXCC1_WGMXCCGn1
    SolutionIndex: 90
    SolutionNameMin: Cijk_Ailk_Bljk_BSS_BH_UserArgs_MT64x32x64_MI16x16x1_SN_LDSB0_CLR1_GSU0_GSUC0_GSUWGMRR0_K1_LBSPPA1024_LBSPPB128_LPA32_MIWT2_1_PLR1_SU32_SUM0_SUS256_SKXCCM4_VWA2_VWB1_WGM1_WGMXCC1_WGMXCCGn1
    SolutionIndex: 91
    SolutionNameMin: Cijk_Ailk_Bljk_BSS_BH_UserArgs_MT32x32x64_MI16x16x1_SN_LDSB0_CLR1_GSU0_GSUC0_GSUWGMRR0_K1_LBSPPA512_LBSPPB128_LPA16_MIWT1_1_PLR1_SU32_SUM0_SUS256_SKXCCM4_VWA1_VWB1_WGM1_WGMXCC1_WGMXCCGn1
    SolutionIndex: 92
    SolutionNameMin: Cijk_Ailk_Bljk_BSS_BH_UserArgs_MT128x64x128_MI16x16x1_SN_LDSB1_CLR1_GSU0_GSUC0_GSUWGMRR0_K1_LBSPPA2048_LBSPPB256_LPA0_MIWT4_2_PLR1_SU32_SUM0_SUS256_SKXCCM4_VWA4_VWB1_WGM1_WGMXCC1_WGMXCCGn1
    SolutionIndex: 93
    SolutionNameMin: Cijk_Ailk_Bljk_BSS_BH_UserArgs_MT128x64x128_MI16x16x1_SN_LDSB1_CLR1_GSU0_GSUC0_GSUWGMRR0_K1_LBSPPA2048_LBSPPB512_LPA0_MIWT4_2_PLR2_SU32_SUM0_SUS256_SKXCCM4_VWA4_VWB2_WGM1_WGMXCC1_WGMXCCGn1
    SolutionIndex: 94
    SolutionNameMin: Cijk_Ailk_Bljk_BSS_BH_UserArgs_MT128x64x128_MI16x16x1_SN_LDSB1_CLR1_GSU0_GSUC0_GSUWGMRR0_K1_LBSPPA2048_LBSPPB256_LPA0_MIWT4_2_PLR2_SU32_SUM0_SUS256_SKXCCM4_VWA4_VWB1_WGM2_WGMXCC1_WGMXCCGn1
    SolutionIndex: 95
    SolutionNameMin: Cijk_Ailk_Bljk_BSS_BH_UserArgs_MT128x64x128_MI16x16x1_SN_LDSB1_CLR1_GSU0_GSUC0_GSUWGMRR0_K1_LBSPPA2048_LBSPPB512_LPA0_MIWT4_2_PLR2_SU32_SUM0_SUS256_SKXCCM4_VWA4_VWB2_WGM4_WGMXCC1_WGMXCCGn1
    SolutionIndex: 96
    SolutionNameMin: Cijk_Ailk_Bljk_BSS_BH_UserArgs_MT64x64x128_MI16x16x1_SN_LDSB1_CLR1_GSU0_GSUC0_GSUWGMRR0_K1_LBSPPA1024_LBSPPB256_LPA32_MIWT2_2_PLR2_SU32_SUM0_SUS256_SKXCCM4_VWA2_VWB1_WGM1_WGMXCC1_WGMXCCGn1
    SolutionIndex: 97
    SolutionNameMin: Cijk_Ailk_Bljk_BSS_BH_UserArgs_MT64x64x128_MI16x16x1_SN_LDSB1_CLR1_GSU0_GSUC0_GSUWGMRR0_K1_LBSPPA1024_LBSPPB512_LPA32_MIWT2_2_PLR2_SU32_SUM0_SUS256_SKXCCM4_VWA2_VWB2_WGM1_WGMXCC1_WGMXCCGn1
    SolutionIndex: 98
    SolutionNameMin: Cijk_Ailk_Bljk_BSS_BH_UserArgs_MT64x32x128_MI16x16x1_SN_LDSB1_CLR1_GSU0_GSUC0_GSUWGMRR0_K1_LBSPPA1024_LBSPPB256_LPA32_MIWT2_1_PLR2_SU32_SUM0_SUS256_SKXCCM4_VWA2_VWB1_WGM1_WGMXCC1_WGMXCCGn1
    SolutionIndex: 99
    SolutionNameMin: Cijk_Ailk_Bljk_BSS_BH_UserArgs_MT64x32x128_MI16x16x1_SN_LDSB1_CLR1_GSU0_GSUC0_GSUWGMRR0_K1_LBSPPA1024_LBSPPB256_LPA32_MIWT2_1_PLR2_SU32_SUM0_SUS256_SKXCCM4_VWA2_VWB1_WGM2_WGMXCC1_WGMXCCGn1
    SolutionIndex: 100
    SolutionNameMin: Cijk_Ailk_Bljk_BSS_BH_UserArgs_MT64x32x128_MI16x16x1_SN_LDSB1_CLR1_GSU0_GSUC0_GSUWGMRR0_K1_LBSPPA1024_LBSPPB256_LPA32_MIWT2_1_PLR2_SU32_SUM0_SUS256_SKXCCM4_VWA2_VWB1_WGM4_WGMXCC1_WGMXCCGn1
    SolutionIndex: 101
    SolutionNameMin: Cijk_Ailk_Bljk_BSS_BH_UserArgs_MT32x32x128_MI16x16x1_SN_LDSB1_CLR1_GSU0_GSUC0_GSUWGMRR0_K1_LBSPPA512_LBSPPB256_LPA16_MIWT1_1_PLR1_SU32_SUM0_SUS256_SKXCCM4_VWA1_VWB1_WGM1_WGMXCC1_WGMXCCGn1
    SolutionIndex: 102
    SolutionNameMin: Cijk_Ailk_Bljk_BSS_BH_UserArgs_MT32x32x128_MI16x16x1_SN_LDSB1_CLR1_GSU0_GSUC0_GSUWGMRR0_K1_LBSPPA512_LBSPPB256_LPA16_MIWT1_1_PLR2_SU32_SUM0_SUS256_SKXCCM4_VWA1_VWB1_WGM1_WGMXCC1_WGMXCCGn1
    SolutionIndex: 103
    SolutionNameMin: Cijk_Ailk_Bljk_BSS_BH_UserArgs_MT32x32x32_MI16x16x1_SN_LDSB0_CLR0_GSU0_GSUC0_GSUWGMRR0_K1_LBSPPA256_LBSPPB128_LPA16_MIWT1_1_PLR0_SU32_SUM0_SUS256_SKXCCM0_VWA1_VWB1_WGM1_WGMXCC1_WGMXCCGn1
- - - [128, 128, 1, 128, 128, 128, 128, 128]
    - [102, 0.087]
  - - [128, 128, 1, 256, 128, 128, 128, 256]
    - [91, 0.163]
  - - [128, 128, 1, 512, 128, 128, 128, 512]
    - [101, 0.267]
  - - [128, 128, 1, 1024, 128, 128, 128, 1024]
    - [102, 0.397]
  - - [128, 128, 1, 2048, 128, 128, 128, 2048]
    - [15, 0.598]
  - - [128, 128, 1, 4096, 128, 128, 128, 4096]
    - [33, 1.058]
  - - [128, 128, 1, 8192, 128, 128, 128, 8192]
    - [39, 1.594]
  - - [128, 256, 1, 128, 128, 128, 128, 128]
    - [91, 0.175]
  - - [128, 256, 1, 256, 128, 128, 128, 256]
    - [91, 0.315]
  - - [128, 256, 1, 512, 128, 128, 128, 512]
    - [101, 0.53]
  - - [128, 256, 1, 1024, 128, 128, 128, 1024]
    - [101, 0.792]
  - - [128, 256, 1, 2048, 128, 128, 128, 2048]
    - [40, 1.181]
  - - [128, 256, 1, 4096, 128, 128, 128, 4096]
    - [88, 1.764]
  - - [128, 256, 1, 8192, 128, 128, 128, 8192]
    - [98, 2.763]
  - - [128, 512, 1, 128, 128, 128, 128, 128]
    - [91, 0.347]
  - - [128, 512, 1, 256, 128, 128, 128, 256]
    - [33, 0.621]
  - - [128, 512, 1, 512, 128, 128, 128, 512]
    - [101, 1.023]
  - - [128, 512, 1, 1024, 128, 128, 128, 1024]
    - [40, 1.558]
  - - [128, 512, 1, 2048, 128, 128, 128, 2048]
    - [38, 2.087]
  - - [128, 512, 1, 4096, 128, 128, 128, 4096]
    - [38, 3.017]
  - - [128, 512, 1, 8192, 128, 128, 128, 8192]
    - [97, 4.561]
  - - [128, 1024, 1, 128, 128, 128, 128, 128]
    - [32, 0.636]
  - - [128, 1024, 1, 256, 128, 128, 128, 256]
    - [88, 1.125]
  - - [128, 1024, 1, 512, 128, 128, 128, 512]
    - [98, 1.843]
  - - [128, 1024, 1, 1024, 128, 128, 128, 1024]
    - [98, 2.789]
  - - [128, 1024, 1, 2048, 128, 128, 128, 2048]
    - [99, 3.647]
  - - [128, 1024, 1, 4096, 128, 128, 128, 4096]
    - [97, 4.989]
  - - [128, 1024, 1, 8192, 128, 128, 128, 8192]
    - [93, 7.153]
  - - [128, 2048, 1, 128, 128, 128, 128, 128]
    - [86, 1.115]
  - - [128, 2048, 1, 256, 128, 128, 128, 256]
    - [86, 1.927]
  - - [128, 2048, 1, 512, 128, 128, 128, 512]
    - [97, 3.143]
  - - [128, 2048, 1, 1024, 128, 128, 128, 1024]
    - [96, 4.608]
  - - [128, 2048, 1, 2048, 128, 128, 128, 2048]
    - [97, 6.007]
  - - [128, 2048, 1, 4096, 128, 128, 128, 4096]
    - [92, 7.653]
  - - [128, 2048, 1, 8192, 128, 128, 128, 8192]
    - [75, 10.057]
  - - [128, 4096, 1, 128, 128, 128, 128, 128]
    - [65, 1.845]
  - - [128, 4096, 1, 256, 128, 128, 128, 256]
    - [83, 3.146]
  - - [128, 4096, 1, 512, 128, 128, 128, 512]
    - [93, 4.879]
  - - [128, 4096, 1, 1024, 128, 128, 128, 1024]
    - [93, 6.988]
  - - [128, 4096, 1, 2048, 128, 128, 128, 2048]
    - [93, 8.739]
  - - [128, 4096, 1, 4096, 128, 128, 128, 4096]
    - [75, 10.782]
  - - [128, 4096, 1, 8192, 128, 128, 128, 8192]
    - [75, 13.783]
  - - [128, 8192, 1, 128, 128, 128, 128, 128]
    - [62, 2.757]
  - - [128, 8192, 1, 256, 128, 128, 128, 256]
    - [75, 4.578]
  - - [128, 8192, 1, 512, 128, 128, 128, 512]
    - [75, 7.03]
  - - [128, 8192, 1, 1024, 128, 128, 128, 1024]
    - [75, 9.406]
  - - [128, 8192, 1, 2048, 128, 128, 128, 2048]
    - [75, 10.964]
  - - [128, 8192, 1, 4096, 128, 128, 128, 4096]
    - [75, 14.008]
  - - [128, 8192, 1, 8192, 128, 128, 128, 8192]
    - [79, 15.642]
  - - [256, 128, 1, 128, 256, 256, 256, 128]
    - [91, 0.175]
  - - [256, 128, 1, 256, 256, 256, 256, 256]
    - [91, 0.319]
  - - [256, 128, 1, 512, 256, 256, 256, 512]
    - [102, 0.524]
  - - [256, 128, 1, 1024, 256, 256, 256, 1024]
    - [102, 0.787]
  - - [256, 128, 1, 2048, 256, 256, 256, 2048]
    - [39, 1.181]
  - - [256, 128, 1, 4096, 256, 256, 256, 4096]
    - [88, 1.766]
  - - [256, 128, 1, 8192, 256, 256, 256, 8192]
    - [100, 2.667]
  - - [256, 256, 1, 128, 256, 256, 256, 128]
    - [91, 0.344]
  - - [256, 256, 1, 256, 256, 256, 256, 256]
    - [91, 0.623]
  - - [256, 256, 1, 512, 256, 256, 256, 512]
    - [91, 1.021]
  - - [256, 256, 1, 1024, 256, 256, 256, 1024]
    - [39, 1.553]
  - - [256, 256, 1, 2048, 256, 256, 256, 2048]
    - [38, 2.09]
  - - [256, 256, 1, 4096, 256, 256, 256, 4096]
    - [38, 3.019]
  - - [256, 256, 1, 8192, 256, 256, 256, 8192]
    - [36, 4.171]
  - - [256, 512, 1, 128, 256, 256, 256, 128]
    - [32, 0.634]
  - - [256, 512, 1, 256, 256, 256, 256, 256]
    - [89, 1.122]
  - - [256, 512, 1, 512, 256, 256, 256, 512]
    - [98, 1.838]
  - - [256, 512, 1, 1024, 256, 256, 256, 1024]
    - [98, 2.79]
  - - [256, 512, 1, 2048, 256, 256, 256, 2048]
    - [38, 3.68]
  - - [256, 512, 1, 4096, 256, 256, 256, 4096]
    - [97, 4.981]
  - - [256, 512, 1, 8192, 256, 256, 256, 8192]
    - [34, 7.055]
  - - [256, 1024, 1, 128, 256, 256, 256, 128]
    - [86, 1.125]
  - - [256, 1024, 1, 256, 256, 256, 256, 256]
    - [86, 1.953]
  - - [256, 1024, 1, 512, 256, 256, 256, 512]
    - [97, 3.169]
  - - [256, 1024, 1, 1024, 256, 256, 256, 1024]
    - [97, 4.578]
  - - [256, 1024, 1, 2048, 256, 256, 256, 2048]
    - [97, 6.039]
  - - [256, 1024, 1, 4096, 256, 256, 256, 4096]
    - [35, 7.611]
  - - [256, 1024, 1, 8192, 256, 256, 256, 8192]
    - [75, 9.979]
  - - [256, 2048, 1, 128, 256, 256, 256, 128]
    - [67, 1.808]
  - - [256, 2048, 1, 256, 256, 256, 256, 256]
    - [84, 3.112]
  - - [256, 2048, 1, 512, 256, 256, 256, 512]
    - [85, 4.826]
  - - [256, 2048, 1, 1024, 256, 256, 256, 1024]
    - [93, 6.936]
  - - [256, 2048, 1, 2048, 256, 256, 256, 2048]
    - [93, 8.808]
  - - [256, 2048, 1, 4096, 256, 256, 256, 4096]
    - [78, 10.852]
  - - [256, 2048, 1, 8192, 256, 256, 256, 8192]
    - [77, 13.738]
  - - [256, 4096, 1, 128, 256, 256, 256, 128]
    - [62, 2.752]
  - - [256, 4096, 1, 256, 256, 256, 256, 256]
    - [77, 4.623]
  - - [256, 4096, 1, 512, 256, 256, 256, 512]
    - [77, 7.119]
  - - [256, 4096, 1, 1024, 256, 256, 256, 1024]
    - [77, 9.487]
  - - [256, 4096, 1, 2048, 256, 256, 256, 2048]
    - [77, 11.075]
  - - [256, 4096, 1, 4096, 256, 256, 256, 4096]
    - [81, 13.945]
  - - [256, 4096, 1, 8192, 256, 256, 256, 8192]
    - [26, 15.578]
  - - [256, 8192, 1, 128, 256, 256, 256, 128]
    - [54, 3.637]
  - - [256, 8192, 1, 256, 256, 256, 256, 256]
    - [54, 5.854]
  - - [256, 8192, 1, 512, 256, 256, 256, 512]
    - [54, 8.617]
  - - [256, 8192, 1, 1024, 256, 256, 256, 1024]
    - [20, 10.962]
  - - [256, 8192, 1, 2048, 256, 256, 256, 2048]
    - [77, 13.289]
  - - [256, 8192, 1, 4096, 256, 256, 256, 4096]
    - [72, 15.574]
  - - [256, 8192, 1, 8192, 256, 256, 256, 8192]
    - [41, 17.311]
  - - [512, 128, 1, 128, 512, 512, 512, 128]
    - [91, 0.343]
  - - [512, 128, 1, 256, 512, 512, 512, 256]
    - [91, 0.626]
  - - [512, 128, 1, 512, 512, 512, 512, 512]
    - [91, 1.023]
  - - [512, 128, 1, 1024, 512, 512, 512, 1024]
    - [39, 1.555]
  - - [512, 128, 1, 2048, 512, 512, 512, 2048]
    - [38, 2.103]
  - - [512, 128, 1, 4096, 512, 512, 512, 4096]
    - [38, 3.013]
  - - [512, 128, 1, 8192, 512, 512, 512, 8192]
    - [36, 4.2]
  - - [512, 256, 1, 128, 512, 512, 512, 128]
    - [98, 0.635]
  - - [512, 256, 1, 256, 512, 512, 512, 256]
    - [88, 1.116]
  - - [512, 256, 1, 512, 512, 512, 512, 512]
    - [98, 1.848]
  - - [512, 256, 1, 1024, 512, 512, 512, 1024]
    - [98, 2.811]
  - - [512, 256, 1, 2048, 512, 512, 512, 2048]
    - [98, 3.696]
  - - [512, 256, 1, 4096, 512, 512, 512, 4096]
    - [36, 4.915]
  - - [512, 256, 1, 8192, 512, 512, 512, 8192]
    - [34, 7.071]
  - - [512, 512, 1, 128, 512, 512, 512, 128]
    - [87, 1.129]
  - - [512, 512, 1, 256, 512, 512, 512, 256]
    - [86, 1.945]
  - - [512, 512, 1, 512, 512, 512, 512, 512]
    - [97, 3.169]
  - - [512, 512, 1, 1024, 512, 512, 512, 1024]
    - [97, 4.662]
  - - [512, 512, 1, 2048, 512, 512, 512, 2048]
    - [97, 6.044]
  - - [512, 512, 1, 4096, 512, 512, 512, 4096]
    - [35, 7.668]
  - - [512, 512, 1, 8192, 512, 512, 512, 8192]
    - [75, 9.923]
  - - [512, 1024, 1, 128, 512, 512, 512, 128]
    - [66, 1.862]
  - - [512, 1024, 1, 256, 512, 512, 512, 256]
    - [84, 3.178]
  - - [512, 1024, 1, 512, 512, 512, 512, 512]
    - [83, 4.922]
  - - [512, 1024, 1, 1024, 512, 512, 512, 1024]
    - [93, 7.008]
  - - [512, 1024, 1, 2048, 512, 512, 512, 2048]
    - [93, 8.886]
  - - [512, 1024, 1, 4096, 512, 512, 512, 4096]
    - [75, 10.856]
  - - [512, 1024, 1, 8192, 512, 512, 512, 8192]
    - [76, 13.742]
  - - [512, 2048, 1, 128, 512, 512, 512, 128]
    - [63, 2.772]
  - - [512, 2048, 1, 256, 512, 512, 512, 256]
    - [77, 4.645]
  - - [512, 2048, 1, 512, 512, 512, 512, 512]
    - [77, 7.175]
  - - [512, 2048, 1, 1024, 512, 512, 512, 1024]
    - [77, 9.771]
  - - [512, 2048, 1, 2048, 512, 512, 512, 2048]
    - [75, 11.185]
  - - [512, 2048, 1, 4096, 512, 512, 512, 4096]
    - [77, 13.886]
  - - [512, 2048, 1, 8192, 512, 512, 512, 8192]
    - [24, 15.75]
  - - [512, 4096, 1, 128, 512, 512, 512, 128]
    - [54, 3.788]
  - - [512, 4096, 1, 256, 512, 512, 512, 256]
    - [55, 6.041]
  - - [512, 4096, 1, 512, 512, 512, 512, 512]
    - [55, 8.746]
  - - [512, 4096, 1, 1024, 512, 512, 512, 1024]
    - [20, 11.182]
  - - [512, 4096, 1, 2048, 512, 512, 512, 2048]
    - [77, 13.202]
  - - [512, 4096, 1, 4096, 512, 512, 512, 4096]
    - [73, 15.693]
  - - [512, 4096, 1, 8192, 512, 512, 512, 8192]
    - [52, 17.256]
  - - [512, 8192, 1, 128, 512, 512, 512, 128]
    - [45, 4.201]
  - - [512, 8192, 1, 256, 512, 512, 512, 256]
    - [44, 6.734]
  - - [512, 8192, 1, 512, 512, 512, 512, 512]
    - [45, 9.793]
  - - [512, 8192, 1, 1024, 512, 512, 512, 1024]
    - [54, 12.371]
  - - [512, 8192, 1, 2048, 512, 512, 512, 2048]
    - [23, 14.891]
  - - [512, 8192, 1, 4096, 512, 512, 512, 4096]
    - [7, 17.086]
  - - [512, 8192, 1, 8192, 512, 512, 512, 8192]
    - [50, 19.242]
  - - [1024, 128, 1, 128, 1024, 1024, 1024, 128]
    - [98, 0.634]
  - - [1024, 128, 1, 256, 1024, 1024, 1024, 256]
    - [90, 1.124]
  - - [1024, 128, 1, 512, 1024, 1024, 1024, 512]
    - [98, 1.866]
  - - [1024, 128, 1, 1024, 1024, 1024, 1024, 1024]
    - [98, 2.763]
  - - [1024, 128, 1, 2048, 1024, 1024, 1024, 2048]
    - [38, 3.68]
  - - [1024, 128, 1, 4096, 1024, 1024, 1024, 4096]
    - [36, 4.896]
  - - [1024, 128, 1, 8192, 1024, 1024, 1024, 8192]
    - [34, 6.674]
  - - [1024, 256, 1, 128, 1024, 1024, 1024, 128]
    - [87, 1.112]
  - - [1024, 256, 1, 256, 1024, 1024, 1024, 256]
    - [87, 1.969]
  - - [1024, 256, 1, 512, 1024, 1024, 1024, 512]
    - [96, 3.17]
  - - [1024, 256, 1, 1024, 1024, 1024, 1024, 1024]
    - [97, 4.63]
  - - [1024, 256, 1, 2048, 1024, 1024, 1024, 2048]
    - [37, 5.948]
  - - [1024, 256, 1, 4096, 1024, 1024, 1024, 4096]
    - [30, 7.26]
  - - [1024, 256, 1, 8192, 1024, 1024, 1024, 8192]
    - [75, 9.927]
  - - [1024, 512, 1, 128, 1024, 1024, 1024, 128]
    - [65, 1.863]
  - - [1024, 512, 1, 256, 1024, 1024, 1024, 256]
    - [84, 3.17]
  - - [1024, 512, 1, 512, 1024, 1024, 1024, 512]
    - [84, 4.932]
  - - [1024, 512, 1, 1024, 1024, 1024, 1024, 1024]
    - [93, 7.014]
  - - [1024, 512, 1, 2048, 1024, 1024, 1024, 2048]
    - [77, 8.198]
  - - [1024, 512, 1, 4096, 1024, 1024, 1024, 4096]
    - [75, 10.737]
  - - [1024, 512, 1, 8192, 1024, 1024, 1024, 8192]
    - [75, 13.67]
  - - [1024, 1024, 1, 128, 1024, 1024, 1024, 128]
    - [62, 2.791]
  - - [1024, 1024, 1, 256, 1024, 1024, 1024, 256]
    - [76, 4.685]
  - - [1024, 1024, 1, 512, 1024, 1024, 1024, 512]
    - [77, 7.193]
  - - [1024, 1024, 1, 1024, 1024, 1024, 1024, 1024]
    - [80, 9.533]
  - - [1024, 1024, 1, 2048, 1024, 1024, 1024, 2048]
    - [75, 11.116]
  - - [1024, 1024, 1, 4096, 1024, 1024, 1024, 4096]
    - [77, 13.846]
  - - [1024, 1024, 1, 8192, 1024, 1024, 1024, 8192]
    - [81, 15.692]
  - - [1024, 2048, 1, 128, 1024, 1024, 1024, 128]
    - [59, 3.753]
  - - [1024, 2048, 1, 256, 1024, 1024, 1024, 256]
    - [59, 6.008]
  - - [1024, 2048, 1, 512, 1024, 1024, 1024, 512]
    - [13, 8.728]
  - - [1024, 2048, 1, 1024, 1024, 1024, 1024, 1024]
    - [19, 11.303]
  - - [1024, 2048, 1, 2048, 1024, 1024, 1024, 2048]
    - [77, 13.229]
  - - [1024, 2048, 1, 4096, 1024, 1024, 1024, 4096]
    - [56, 15.581]
  - - [1024, 2048, 1, 8192, 1024, 1024, 1024, 8192]
    - [72, 17.248]
  - - [1024, 4096, 1, 128, 1024, 1024, 1024, 128]
    - [7, 4.246]
  - - [1024, 4096, 1, 256, 1024, 1024, 1024, 256]
    - [7, 6.832]
  - - [1024, 4096, 1, 512, 1024, 1024, 1024, 512]
    - [7, 9.91]
  - - [1024, 4096, 1, 1024, 1024, 1024, 1024, 1024]
    - [53, 12.42]
  - - [1024, 4096, 1, 2048, 1024, 1024, 1024, 2048]
    - [60, 14.995]
  - - [1024, 4096, 1, 4096, 1024, 1024, 1024, 4096]
    - [46, 17.055]
  - - [1024, 4096, 1, 8192, 1024, 1024, 1024, 8192]
    - [49, 19.231]
  - - [1024, 8192, 1, 128, 1024, 1024, 1024, 128]
    - [54, 4.369]
  - - [1024, 8192, 1, 256, 1024, 1024, 1024, 256]
    - [54, 7.239]
  - - [1024, 8192, 1, 512, 1024, 1024, 1024, 512]
    - [47, 10.442]
  - - [1024, 8192, 1, 1024, 1024, 1024, 1024, 1024]
    - [42, 13.948]
  - - [1024, 8192, 1, 2048, 1024, 1024, 1024, 2048]
    - [43, 16.507]
  - - [1024, 8192, 1, 4096, 1024, 1024, 1024, 4096]
    - [51, 18.752]
  - - [1024, 8192, 1, 8192, 1024, 1024, 1024, 8192]
    - [52, 20.487]
  - - [2048, 128, 1, 128, 2048, 2048, 2048, 128]
    - [87, 1.122]
  - - [2048, 128, 1, 256, 2048, 2048, 2048, 256]
    - [87, 1.933]
  - - [2048, 128, 1, 512, 2048, 2048, 2048, 512]
    - [96, 3.132]
  - - [2048, 128, 1, 1024, 2048, 2048, 2048, 1024]
    - [97, 4.613]
  - - [2048, 128, 1, 2048, 2048, 2048, 2048, 2048]
    - [85, 5.343]
  - - [2048, 128, 1, 4096, 2048, 2048, 2048, 4096]
    - [75, 7.22]
  - - [2048, 128, 1, 8192, 2048, 2048, 2048, 8192]
    - [75, 9.823]
  - - [2048, 256, 1, 128, 2048, 2048, 2048, 128]
    - [66, 1.857]
  - - [2048, 256, 1, 256, 2048, 2048, 2048, 256]
    - [84, 3.182]
  - - [2048, 256, 1, 512, 2048, 2048, 2048, 512]
    - [83, 4.908]
  - - [2048, 256, 1, 1024, 2048, 2048, 2048, 1024]
    - [95, 6.885]
  - - [2048, 256, 1, 2048, 2048, 2048, 2048, 2048]
    - [95, 8.146]
  - - [2048, 256, 1, 4096, 2048, 2048, 2048, 4096]
    - [75, 10.721]
  - - [2048, 256, 1, 8192, 2048, 2048, 2048, 8192]
    - [76, 13.629]
  - - [2048, 512, 1, 128, 2048, 2048, 2048, 128]
    - [63, 2.776]
  - - [2048, 512, 1, 256, 2048, 2048, 2048, 256]
    - [75, 4.664]
  - - [2048, 512, 1, 512, 2048, 2048, 2048, 512]
    - [82, 7.086]
  - - [2048, 512, 1, 1024, 2048, 2048, 2048, 1024]
    - [79, 9.526]
  - - [2048, 512, 1, 2048, 2048, 2048, 2048, 2048]
    - [75, 11.038]
  - - [2048, 512, 1, 4096, 2048, 2048, 2048, 4096]
    - [75, 13.835]
  - - [2048, 512, 1, 8192, 2048, 2048, 2048, 8192]
    - [25, 15.415]
  - - [2048, 1024, 1, 128, 2048, 2048, 2048, 128]
    - [58, 3.725]
  - - [2048, 1024, 1, 256, 2048, 2048, 2048, 256]
    - [58, 5.965]
  - - [2048, 1024, 1, 512, 2048, 2048, 2048, 512]
    - [55, 8.602]
  - - [2048, 1024, 1, 1024, 2048, 2048, 2048, 1024]
    - [18, 11.274]
  - - [2048, 1024, 1, 2048, 2048, 2048, 2048, 2048]
    - [77, 13.005]
  - - [2048, 1024, 1, 4096, 2048, 2048, 2048, 4096]
    - [70, 15.597]
  - - [2048, 1024, 1, 8192, 2048, 2048, 2048, 8192]
    - [71, 17.225]
  - - [2048, 2048, 1, 128, 2048, 2048, 2048, 128]
    - [3, 4.26]
  - - [2048, 2048, 1, 256, 2048, 2048, 2048, 256]
    - [6, 6.831]
  - - [2048, 2048, 1, 512, 2048, 2048, 2048, 512]
    - [6, 9.947]
  - - [2048, 2048, 1, 1024, 2048, 2048, 2048, 1024]
    - [53, 12.471]
  - - [2048, 2048, 1, 2048, 2048, 2048, 2048, 2048]
    - [53, 15.194]
  - - [2048, 2048, 1, 4096, 2048, 2048, 2048, 4096]
    - [48, 17.18]
  - - [2048, 2048, 1, 8192, 2048, 2048, 2048, 8192]
    - [41, 19.258]
  - - [2048, 4096, 1, 128, 2048, 2048, 2048, 128]
    - [55, 4.402]
  - - [2048, 4096, 1, 256, 2048, 2048, 2048, 256]
    - [55, 7.277]
  - - [2048, 4096, 1, 512, 2048, 2048, 2048, 512]
    - [42, 10.463]
  - - [2048, 4096, 1, 1024, 2048, 2048, 2048, 1024]
    - [43, 14.048]
  - - [2048, 4096, 1, 2048, 2048, 2048, 2048, 2048]
    - [43, 16.511]
  - - [2048, 4096, 1, 4096, 2048, 2048, 2048, 4096]
    - [46, 18.722]
  - - [2048, 4096, 1, 8192, 2048, 2048, 2048, 8192]
    - [46, 20.532]
  - - [2048, 8192, 1, 128, 2048, 2048, 2048, 128]
    - [55, 5.277]
  - - [2048, 8192, 1, 256, 2048, 2048, 2048, 256]
    - [57, 8.015]
  - - [2048, 8192, 1, 512, 2048, 2048, 2048, 512]
    - [46, 11.404]
  - - [2048, 8192, 1, 1024, 2048, 2048, 2048, 1024]
    - [43, 14.641]
  - - [2048, 8192, 1, 2048, 2048, 2048, 2048, 2048]
    - [52, 17.648]
  - - [2048, 8192, 1, 4096, 2048, 2048, 2048, 4096]
    - [46, 19.772]
  - - [2048, 8192, 1, 8192, 2048, 2048, 2048, 8192]
    - [4, 20.179]
  - - [4096, 128, 1, 128, 4096, 4096, 4096, 128]
    - [14, 1.806]
  - - [4096, 128, 1, 256, 4096, 4096, 4096, 256]
    - [31, 3.083]
  - - [4096, 128, 1, 512, 4096, 4096, 4096, 512]
    - [84, 4.743]
  - - [4096, 128, 1, 1024, 4096, 4096, 4096, 1024]
    - [94, 6.672]
  - - [4096, 128, 1, 2048, 4096, 4096, 4096, 2048]
    - [34, 8.147]
  - - [4096, 128, 1, 4096, 4096, 4096, 4096, 4096]
    - [25, 10.773]
  - - [4096, 128, 1, 8192, 4096, 4096, 4096, 8192]
    - [26, 13.689]
  - - [4096, 256, 1, 128, 4096, 4096, 4096, 128]
    - [64, 2.704]
  - - [4096, 256, 1, 256, 4096, 4096, 4096, 256]
    - [78, 4.585]
  - - [4096, 256, 1, 512, 4096, 4096, 4096, 512]
    - [78, 7.079]
  - - [4096, 256, 1, 1024, 4096, 4096, 4096, 1024]
    - [81, 9.526]
  - - [4096, 256, 1, 2048, 4096, 4096, 4096, 2048]
    - [78, 11.054]
  - - [4096, 256, 1, 4096, 4096, 4096, 4096, 4096]
    - [25, 13.88]
  - - [4096, 256, 1, 8192, 4096, 4096, 4096, 8192]
    - [21, 15.56]
  - - [4096, 512, 1, 128, 4096, 4096, 4096, 128]
    - [53, 3.732]
  - - [4096, 512, 1, 256, 4096, 4096, 4096, 256]
    - [56, 6.059]
  - - [4096, 512, 1, 512, 4096, 4096, 4096, 512]
    - [54, 8.738]
  - - [4096, 512, 1, 1024, 4096, 4096, 4096, 1024]
    - [17, 11.23]
  - - [4096, 512, 1, 2048, 4096, 4096, 4096, 2048]
    - [28, 13.189]
  - - [4096, 512, 1, 4096, 4096, 4096, 4096, 4096]
    - [68, 15.671]
  - - [4096, 512, 1, 8192, 4096, 4096, 4096, 8192]
    - [72, 17.37]
  - - [4096, 1024, 1, 128, 4096, 4096, 4096, 128]
    - [2, 4.271]
  - - [4096, 1024, 1, 256, 4096, 4096, 4096, 256]
    - [5, 6.854]
  - - [4096, 1024, 1, 512, 4096, 4096, 4096, 512]
    - [2, 9.928]
  - - [4096, 1024, 1, 1024, 4096, 4096, 4096, 1024]
    - [53, 12.385]
  - - [4096, 1024, 1, 2048, 4096, 4096, 4096, 2048]
    - [68, 14.963]
  - - [4096, 1024, 1, 4096, 4096, 4096, 4096, 4096]
    - [9, 17.007]
  - - [4096, 1024, 1, 8192, 4096, 4096, 4096, 8192]
    - [42, 19.105]
  - - [4096, 2048, 1, 128, 4096, 4096, 4096, 128]
    - [54, 4.385]
  - - [4096, 2048, 1, 256, 4096, 4096, 4096, 256]
    - [57, 7.248]
  - - [4096, 2048, 1, 512, 4096, 4096, 4096, 512]
    - [53, 10.468]
  - - [4096, 2048, 1, 1024, 4096, 4096, 4096, 1024]
    - [43, 13.916]
  - - [4096, 2048, 1, 2048, 4096, 4096, 4096, 2048]
    - [41, 16.539]
  - - [4096, 2048, 1, 4096, 4096, 4096, 4096, 4096]
    - [42, 18.822]
  - - [4096, 2048, 1, 8192, 4096, 4096, 4096, 8192]
    - [41, 20.439]
  - - [4096, 4096, 1, 128, 4096, 4096, 4096, 128]
    - [57, 5.269]
  - - [4096, 4096, 1, 256, 4096, 4096, 4096, 256]
    - [54, 8.122]
  - - [4096, 4096, 1, 512, 4096, 4096, 4096, 512]
    - [48, 11.257]
  - - [4096, 4096, 1, 1024, 4096, 4096, 4096, 1024]
    - [1, 14.774]
  - - [4096, 4096, 1, 2048, 4096, 4096, 4096, 2048]
    - [49, 17.414]
  - - [4096, 4096, 1, 4096, 4096, 4096, 4096, 4096]
    - [46, 19.665]
  - - [4096, 4096, 1, 8192, 4096, 4096, 4096, 8192]
    - [46, 20.637]
  - - [4096, 8192, 1, 128, 4096, 4096, 4096, 128]
    - [12, 5.379]
  - - [4096, 8192, 1, 256, 4096, 4096, 4096, 256]
    - [23, 8.063]
  - - [4096, 8192, 1, 512, 4096, 4096, 4096, 512]
    - [74, 11.166]
  - - [4096, 8192, 1, 1024, 4096, 4096, 4096, 1024]
    - [1, 14.719]
  - - [4096, 8192, 1, 2048, 4096, 4096, 4096, 2048]
    - [1, 17.86]
  - - [4096, 8192, 1, 4096, 4096, 4096, 4096, 4096]
    - [50, 19.44]
  - - [4096, 8192, 1, 8192, 4096, 4096, 4096, 8192]
    - [50, 20.634]
  - - [8192, 128, 1, 128, 8192, 8192, 8192, 128]
    - [61, 2.756]
  - - [8192, 128, 1, 256, 8192, 8192, 8192, 256]
    - [75, 4.625]
  - - [8192, 128, 1, 512, 8192, 8192, 8192, 512]
    - [75, 7.039]
  - - [8192, 128, 1, 1024, 8192, 8192, 8192, 1024]
    - [24, 9.291]
  - - [8192, 128, 1, 2048, 8192, 8192, 8192, 2048]
    - [75, 11.158]
  - - [8192, 128, 1, 4096, 8192, 8192, 8192, 4096]
    - [27, 13.856]
  - - [8192, 128, 1, 8192, 8192, 8192, 8192, 8192]
    - [29, 15.454]
  - - [8192, 256, 1, 128, 8192, 8192, 8192, 128]
    - [10, 3.718]
  - - [8192, 256, 1, 256, 8192, 8192, 8192, 256]
    - [10, 6.023]
  - - [8192, 256, 1, 512, 8192, 8192, 8192, 512]
    - [10, 8.735]
  - - [8192, 256, 1, 1024, 8192, 8192, 8192, 1024]
    - [16, 11.133]
  - - [8192, 256, 1, 2048, 8192, 8192, 8192, 2048]
    - [75, 13.247]
  - - [8192, 256, 1, 4096, 8192, 8192, 8192, 4096]
    - [20, 15.79]
  - - [8192, 256, 1, 8192, 8192, 8192, 8192, 8192]
    - [72, 17.291]
  - - [8192, 512, 1, 128, 8192, 8192, 8192, 128]
    - [8, 4.181]
  - - [8192, 512, 1, 256, 8192, 8192, 8192, 256]
    - [0, 6.755]
  - - [8192, 512, 1, 512, 8192, 8192, 8192, 512]
    - [48, 9.831]
  - - [8192, 512, 1, 1024, 8192, 8192, 8192, 1024]
    - [56, 12.331]
  - - [8192, 512, 1, 2048, 8192, 8192, 8192, 2048]
    - [69, 15.038]
  - - [8192, 512, 1, 4096, 8192, 8192, 8192, 4096]
    - [42, 17.009]
  - - [8192, 512, 1, 8192, 8192, 8192, 8192, 8192]
    - [46, 19.098]
  - - [8192, 1024, 1, 128, 8192, 8192, 8192, 128]
    - [53, 4.424]
  - - [8192, 1024, 1, 256, 8192, 8192, 8192, 256]
    - [53, 7.314]
  - - [8192, 1024, 1, 512, 8192, 8192, 8192, 512]
    - [41, 10.436]
  - - [8192, 1024, 1, 1024, 8192, 8192, 8192, 1024]
    - [49, 13.823]
  - - [8192, 1024, 1, 2048, 8192, 8192, 8192, 2048]
    - [41, 16.361]
  - - [8192, 1024, 1, 4096, 8192, 8192, 8192, 4096]
    - [41, 18.664]
  - - [8192, 1024, 1, 8192, 8192, 8192, 8192, 8192]
    - [52, 20.372]
  - - [8192, 2048, 1, 128, 8192, 8192, 8192, 128]
    - [53, 5.233]
  - - [8192, 2048, 1, 256, 8192, 8192, 8192, 256]
    - [53, 8.037]
  - - [8192, 2048, 1, 512, 8192, 8192, 8192, 512]
    - [47, 11.347]
  - - [8192, 2048, 1, 1024, 8192, 8192, 8192, 1024]
    - [50, 14.573]
  - - [8192, 2048, 1, 2048, 8192, 8192, 8192, 2048]
    - [41, 17.477]
  - - [8192, 2048, 1, 4096, 8192, 8192, 8192, 4096]
    - [50, 19.656]
  - - [8192, 2048, 1, 8192, 8192, 8192, 8192, 8192]
    - [50, 20.564]
  - - [8192, 4096, 1, 128, 8192, 8192, 8192, 128]
    - [11, 5.241]
  - - [8192, 4096, 1, 256, 8192, 8192, 8192, 256]
    - [22, 7.937]
  - - [8192, 4096, 1, 512, 8192, 8192, 8192, 512]
    - [50, 11.219]
  - - [8192, 4096, 1, 1024, 8192, 8192, 8192, 1024]
    - [50, 14.831]
  - - [8192, 4096, 1, 2048, 8192, 8192, 8192, 2048]
    - [46, 17.883]
  - - [8192, 4096, 1, 4096, 8192, 8192, 8192, 4096]
    - [50, 19.792]
  - - [8192, 4096, 1, 8192, 8192, 8192, 8192, 8192]
    - [4, 20.69]
  - - [8192, 8192, 1, 128, 8192, 8192, 8192, 128]
    - [41, 5.025]
  - - [8192, 8192, 1, 256, 8192, 8192, 8192, 256]
    - [46, 8.002]
  - - [8192, 8192, 1, 512, 8192, 8192, 8192, 512]
    - [50, 11.813]
  - - [8192, 8192, 1, 1024, 8192, 8192, 8192, 1024]
    - [46, 15.416]
  - - [8192, 8192, 1, 2048, 8192, 8192, 8192, 2048]
    - [50, 18.241]
  - - [8192, 8192, 1, 4096, 8192, 8192, 8192, 4096]
    - [50, 20.013]
  - - [8192, 8192, 1, 8192, 8192, 8192, 8192, 8192]
    - [50, 21.159]
  - - [1, 1, 1, 32, 1, 1, 1, 32]
    - [103, 0.0]
- null
- null
- ExperimentalStreamK
- GridBased
