library/src/amd_detail/rocblaslt/src/Tensile/Logic/asm_full/aquavanjaram/gfx942_80cu/StreamK/aquavanjaram942_Cijk_Alik_Bljk_BSS_BH_UserArgs.yaml
- {MinimumRequiredVersion: 4.33.0}
- aquavanjaram942
- {Architecture: gfx942, CUCount: 80}
- [Device 0049, Device 0050]
    SolutionIndex: 0
    SolutionNameMin: Cijk_Alik_Bljk_BSS_BH_UserArgs_MT128x128x64_MI16x16x1_SN_LDSB1_CLR1_GSU0_GSUC0_GSUWGMRR0_K1_LBSPPA128_LBSPPB128_MIWT4_4_PLR1_SU32_SUM0_SUS256_SKXCCM0_VWA1_VWB1_WGM1_WGMXCC1_WGMXCCGn1
    SolutionIndex: 1
    SolutionNameMin: Cijk_Alik_Bljk_BSS_BH_UserArgs_MT128x128x64_MI16x16x1_SN_LDSB1_CLR1_GSU0_GSUC0_GSUWGMRR0_K1_LBSPPA512_LBSPPB128_MIWT4_4_PLR1_SU32_SUM0_SUS256_SKXCCM0_VWA4_VWB1_WGM1_WGMXCC1_WGMXCCGn1
    SolutionIndex: 2
    SolutionNameMin: Cijk_Alik_Bljk_BSS_BH_UserArgs_MT128x128x64_MI16x16x1_SN_LDSB1_CLR1_GSU0_GSUC0_GSUWGMRR0_K1_LBSPPA512_LBSPPB256_MIWT4_4_PLR1_SU32_SUM0_SUS256_SKXCCM0_VWA4_VWB2_WGM1_WGMXCC1_WGMXCCGn1
    SolutionIndex: 3
    SolutionNameMin: Cijk_Alik_Bljk_BSS_BH_UserArgs_MT128x128x64_MI16x16x1_SN_LDSB1_CLR1_GSU0_GSUC0_GSUWGMRR0_K1_LBSPPA512_LBSPPB512_MIWT4_4_PLR1_SU32_SUM0_SUS256_SKXCCM0_VWA4_VWB4_WGM1_WGMXCC1_WGMXCCGn1
    SolutionIndex: 4
    SolutionNameMin: Cijk_Alik_Bljk_BSS_BH_UserArgs_MT128x128x64_MI16x16x1_SN_LDSB1_CLR1_GSU0_GSUC0_GSUWGMRR0_K1_LBSPPA512_LBSPPB256_MIWT4_4_PLR1_SU32_SUM0_SUS256_SKXCCM0_VWA4_VWB2_WGM2_WGMXCC1_WGMXCCGn1
    SolutionIndex: 5
    SolutionNameMin: Cijk_Alik_Bljk_BSS_BH_UserArgs_MT128x128x64_MI16x16x1_SN_LDSB1_CLR1_GSU0_GSUC0_GSUWGMRR0_K1_LBSPPA512_LBSPPB512_MIWT4_4_PLR1_SU32_SUM0_SUS256_SKXCCM0_VWA4_VWB4_WGM2_WGMXCC1_WGMXCCGn1
    SolutionIndex: 6
    SolutionNameMin: Cijk_Alik_Bljk_BSS_BH_UserArgs_MT128x128x64_MI16x16x1_SN_LDSB1_CLR1_GSU0_GSUC0_GSUWGMRR0_K1_LBSPPA512_LBSPPB512_MIWT4_4_PLR1_SU32_SUM0_SUS256_SKXCCM0_VWA4_VWB4_WGM4_WGMXCC1_WGMXCCGn1
    SolutionIndex: 7
    SolutionNameMin: Cijk_Alik_Bljk_BSS_BH_UserArgs_MT128x64x64_MI16x16x1_SN_LDSB1_CLR1_GSU0_GSUC0_GSUWGMRR0_K1_LBSPPA512_LBSPPB128_MIWT4_2_PLR1_SU32_SUM0_SUS256_SKXCCM0_VWA4_VWB1_WGM2_WGMXCC1_WGMXCCGn1
    SolutionIndex: 8
    SolutionNameMin: Cijk_Alik_Bljk_BSS_BH_UserArgs_MT128x64x64_MI16x16x1_SN_LDSB1_CLR1_GSU0_GSUC0_GSUWGMRR0_K1_LBSPPA512_LBSPPB256_MIWT4_2_PLR1_SU32_SUM0_SUS256_SKXCCM0_VWA4_VWB2_WGM4_WGMXCC1_WGMXCCGn1
    SolutionIndex: 9
    SolutionNameMin: Cijk_Alik_Bljk_BSS_BH_UserArgs_MT32x64x64_MI16x16x1_SN_LDSB0_CLR1_GSU0_GSUC0_GSUWGMRR0_K1_LBSPPA128_LBSPPB128_MIWT1_2_PLR1_SU32_SUM0_SUS256_SKXCCM0_VWA1_VWB1_WGM1_WGMXCC1_WGMXCCGn1
    SolutionIndex: 10
    SolutionNameMin: Cijk_Alik_Bljk_BSS_BH_UserArgs_MT32x64x64_MI16x16x1_SN_LDSB0_CLR1_GSU0_GSUC0_GSUWGMRR0_K1_LBSPPA128_LBSPPB256_MIWT1_2_PLR1_SU32_SUM0_SUS256_SKXCCM0_VWA1_VWB2_WGM1_WGMXCC1_WGMXCCGn1
    SolutionIndex: 11
    SolutionNameMin: Cijk_Alik_Bljk_BSS_BH_UserArgs_MT32x32x64_MI16x16x1_SN_LDSB0_CLR1_GSU0_GSUC0_GSUWGMRR0_K1_LBSPPA128_LBSPPB128_MIWT1_1_PLR1_SU32_SUM0_SUS256_SKXCCM0_VWA1_VWB1_WGM1_WGMXCC1_WGMXCCGn1
    SolutionIndex: 12
    SolutionNameMin: Cijk_Alik_Bljk_BSS_BH_UserArgs_MT32x32x64_MI16x16x1_SN_LDSB0_CLR1_GSU0_GSUC0_GSUWGMRR0_K1_LBSPPA128_LBSPPB128_MIWT1_1_PLR2_SU32_SUM0_SUS256_SKXCCM0_VWA1_VWB1_WGM1_WGMXCC1_WGMXCCGn1
    SolutionIndex: 13
    SolutionNameMin: Cijk_Alik_Bljk_BSS_BH_UserArgs_MT64x64x128_MI16x16x1_SN_LDSB1_CLR1_GSU0_GSUC0_GSUWGMRR0_K1_LBSPPA256_LBSPPB512_MIWT2_2_PLR1_SU32_SUM0_SUS256_SKXCCM0_VWA1_VWB2_WGM1_WGMXCC1_WGMXCCGn1
    SolutionIndex: 14
    SolutionNameMin: Cijk_Alik_Bljk_BSS_BH_UserArgs_MT64x64x128_MI16x16x1_SN_LDSB1_CLR1_GSU0_GSUC0_GSUWGMRR0_K1_LBSPPA256_LBSPPB512_MIWT2_2_PLR1_SU32_SUM0_SUS256_SKXCCM0_VWA1_VWB2_WGM4_WGMXCC1_WGMXCCGn1
    SolutionIndex: 15
    SolutionNameMin: Cijk_Alik_Bljk_BSS_BH_UserArgs_MT64x32x128_MI16x16x1_SN_LDSB1_CLR1_GSU0_GSUC0_GSUWGMRR0_K1_LBSPPA256_LBSPPB256_MIWT2_1_PLR2_SU32_SUM0_SUS256_SKXCCM0_VWA1_VWB1_WGM1_WGMXCC1_WGMXCCGn1
    SolutionIndex: 16
    SolutionNameMin: Cijk_Alik_Bljk_BSS_BH_UserArgs_MT32x32x128_MI16x16x1_SN_LDSB1_CLR1_GSU0_GSUC0_GSUWGMRR0_K1_LBSPPA256_LBSPPB256_MIWT1_1_PLR1_SU32_SUM0_SUS256_SKXCCM0_VWA1_VWB1_WGM1_WGMXCC1_WGMXCCGn1
    SolutionIndex: 17
    SolutionNameMin: Cijk_Alik_Bljk_BSS_BH_UserArgs_MT32x32x128_MI16x16x1_SN_LDSB1_CLR1_GSU0_GSUC0_GSUWGMRR0_K1_LBSPPA256_LBSPPB256_MIWT1_1_PLR2_SU32_SUM0_SUS256_SKXCCM0_VWA1_VWB1_WGM1_WGMXCC1_WGMXCCGn1
    SolutionIndex: 18
    SolutionNameMin: Cijk_Alik_Bljk_BSS_BH_UserArgs_MT256x64x64_MI16x16x1_SN_LDSB1_CLR1_GSU0_GSUC0_GSUWGMRR0_K1_LBSPPA512_LBSPPB256_MIWT8_2_PLR1_SU32_SUM0_SUS256_SKXCCM4_VWA4_VWB2_WGM1_WGMXCC1_WGMXCCGn1
    SolutionIndex: 19
    SolutionNameMin: Cijk_Alik_Bljk_BSS_BH_UserArgs_MT128x128x64_MI16x16x1_SN_LDSB1_CLR1_GSU0_GSUC0_GSUWGMRR0_K1_LBSPPA128_LBSPPB128_MIWT4_4_PLR1_SU32_SUM0_SUS256_SKXCCM4_VWA1_VWB1_WGM1_WGMXCC1_WGMXCCGn1
    SolutionIndex: 20
    SolutionNameMin: Cijk_Alik_Bljk_BSS_BH_UserArgs_MT128x128x64_MI16x16x1_SN_LDSB1_CLR1_GSU0_GSUC0_GSUWGMRR0_K1_LBSPPA512_LBSPPB128_MIWT4_4_PLR1_SU32_SUM0_SUS256_SKXCCM4_VWA4_VWB1_WGM1_WGMXCC1_WGMXCCGn1
    SolutionIndex: 21
    SolutionNameMin: Cijk_Alik_Bljk_BSS_BH_UserArgs_MT128x128x64_MI16x16x1_SN_LDSB1_CLR1_GSU0_GSUC0_GSUWGMRR0_K1_LBSPPA128_LBSPPB256_MIWT4_4_PLR1_SU32_SUM0_SUS256_SKXCCM4_VWA1_VWB2_WGM1_WGMXCC1_WGMXCCGn1
    SolutionIndex: 22
    SolutionNameMin: Cijk_Alik_Bljk_BSS_BH_UserArgs_MT128x128x64_MI16x16x1_SN_LDSB1_CLR1_GSU0_GSUC0_GSUWGMRR0_K1_LBSPPA512_LBSPPB256_MIWT4_4_PLR1_SU32_SUM0_SUS256_SKXCCM4_VWA4_VWB2_WGM1_WGMXCC1_WGMXCCGn1
    SolutionIndex: 23
    SolutionNameMin: Cijk_Alik_Bljk_BSS_BH_UserArgs_MT128x128x64_MI16x16x1_SN_LDSB1_CLR1_GSU0_GSUC0_GSUWGMRR0_K1_LBSPPA128_LBSPPB512_MIWT4_4_PLR1_SU32_SUM0_SUS256_SKXCCM4_VWA1_VWB4_WGM1_WGMXCC1_WGMXCCGn1
    SolutionIndex: 24
    SolutionNameMin: Cijk_Alik_Bljk_BSS_BH_UserArgs_MT128x128x64_MI16x16x1_SN_LDSB1_CLR1_GSU0_GSUC0_GSUWGMRR0_K1_LBSPPA512_LBSPPB512_MIWT4_4_PLR1_SU32_SUM0_SUS256_SKXCCM4_VWA4_VWB4_WGM1_WGMXCC1_WGMXCCGn1
    SolutionIndex: 25
    SolutionNameMin: Cijk_Alik_Bljk_BSS_BH_UserArgs_MT128x128x64_MI16x16x1_SN_LDSB1_CLR1_GSU0_GSUC0_GSUWGMRR0_K1_LBSPPA128_LBSPPB128_MIWT4_4_PLR1_SU32_SUM0_SUS256_SKXCCM4_VWA1_VWB1_WGM2_WGMXCC1_WGMXCCGn1
    SolutionIndex: 26
    SolutionNameMin: Cijk_Alik_Bljk_BSS_BH_UserArgs_MT128x128x64_MI16x16x1_SN_LDSB1_CLR1_GSU0_GSUC0_GSUWGMRR0_K1_LBSPPA512_LBSPPB128_MIWT4_4_PLR1_SU32_SUM0_SUS256_SKXCCM4_VWA4_VWB1_WGM2_WGMXCC1_WGMXCCGn1
    SolutionIndex: 27
    SolutionNameMin: Cijk_Alik_Bljk_BSS_BH_UserArgs_MT128x128x64_MI16x16x1_SN_LDSB1_CLR1_GSU0_GSUC0_GSUWGMRR0_K1_LBSPPA512_LBSPPB256_MIWT4_4_PLR1_SU32_SUM0_SUS256_SKXCCM4_VWA4_VWB2_WGM2_WGMXCC1_WGMXCCGn1
    SolutionIndex: 28
    SolutionNameMin: Cijk_Alik_Bljk_BSS_BH_UserArgs_MT128x128x64_MI16x16x1_SN_LDSB1_CLR1_GSU0_GSUC0_GSUWGMRR0_K1_LBSPPA512_LBSPPB512_MIWT4_4_PLR1_SU32_SUM0_SUS256_SKXCCM4_VWA4_VWB4_WGM2_WGMXCC1_WGMXCCGn1
    SolutionIndex: 29
    SolutionNameMin: Cijk_Alik_Bljk_BSS_BH_UserArgs_MT128x128x64_MI16x16x1_SN_LDSB1_CLR1_GSU0_GSUC0_GSUWGMRR0_K1_LBSPPA128_LBSPPB128_MIWT4_4_PLR1_SU32_SUM0_SUS256_SKXCCM4_VWA1_VWB1_WGM4_WGMXCC1_WGMXCCGn1
    SolutionIndex: 30
    SolutionNameMin: Cijk_Alik_Bljk_BSS_BH_UserArgs_MT128x128x64_MI16x16x1_SN_LDSB1_CLR1_GSU0_GSUC0_GSUWGMRR0_K1_LBSPPA512_LBSPPB128_MIWT4_4_PLR1_SU32_SUM0_SUS256_SKXCCM4_VWA4_VWB1_WGM4_WGMXCC1_WGMXCCGn1
    SolutionIndex: 31
    SolutionNameMin: Cijk_Alik_Bljk_BSS_BH_UserArgs_MT128x128x64_MI16x16x1_SN_LDSB1_CLR1_GSU0_GSUC0_GSUWGMRR0_K1_LBSPPA128_LBSPPB256_MIWT4_4_PLR1_SU32_SUM0_SUS256_SKXCCM4_VWA1_VWB2_WGM4_WGMXCC1_WGMXCCGn1
    SolutionIndex: 32
    SolutionNameMin: Cijk_Alik_Bljk_BSS_BH_UserArgs_MT128x128x64_MI16x16x1_SN_LDSB1_CLR1_GSU0_GSUC0_GSUWGMRR0_K1_LBSPPA512_LBSPPB256_MIWT4_4_PLR1_SU32_SUM0_SUS256_SKXCCM4_VWA4_VWB2_WGM4_WGMXCC1_WGMXCCGn1
    SolutionIndex: 33
    SolutionNameMin: Cijk_Alik_Bljk_BSS_BH_UserArgs_MT128x128x64_MI16x16x1_SN_LDSB1_CLR1_GSU0_GSUC0_GSUWGMRR0_K1_LBSPPA128_LBSPPB512_MIWT4_4_PLR1_SU32_SUM0_SUS256_SKXCCM4_VWA1_VWB4_WGM4_WGMXCC1_WGMXCCGn1
    SolutionIndex: 34
    SolutionNameMin: Cijk_Alik_Bljk_BSS_BH_UserArgs_MT128x128x64_MI16x16x1_SN_LDSB1_CLR1_GSU0_GSUC0_GSUWGMRR0_K1_LBSPPA512_LBSPPB512_MIWT4_4_PLR1_SU32_SUM0_SUS256_SKXCCM4_VWA4_VWB4_WGM4_WGMXCC1_WGMXCCGn1
    SolutionIndex: 35
    SolutionNameMin: Cijk_Alik_Bljk_BSS_BH_UserArgs_MT64x128x64_MI16x16x1_SN_LDSB1_CLR1_GSU0_GSUC0_GSUWGMRR0_K1_LBSPPA128_LBSPPB128_MIWT2_4_PLR1_SU32_SUM0_SUS256_SKXCCM4_VWA1_VWB1_WGM1_WGMXCC1_WGMXCCGn1
    SolutionIndex: 36
    SolutionNameMin: Cijk_Alik_Bljk_BSS_BH_UserArgs_MT64x128x64_MI16x16x1_SN_LDSB1_CLR1_GSU0_GSUC0_GSUWGMRR0_K1_LBSPPA128_LBSPPB256_MIWT2_4_PLR1_SU32_SUM0_SUS256_SKXCCM4_VWA1_VWB2_WGM1_WGMXCC1_WGMXCCGn1
    SolutionIndex: 37
    SolutionNameMin: Cijk_Alik_Bljk_BSS_BH_UserArgs_MT64x128x64_MI16x16x1_SN_LDSB1_CLR1_GSU0_GSUC0_GSUWGMRR0_K1_LBSPPA128_LBSPPB512_MIWT2_4_PLR1_SU32_SUM0_SUS256_SKXCCM4_VWA1_VWB4_WGM1_WGMXCC1_WGMXCCGn1
    SolutionIndex: 38
    SolutionNameMin: Cijk_Alik_Bljk_BSS_BH_UserArgs_MT128x64x64_MI16x16x1_SN_LDSB1_CLR1_GSU0_GSUC0_GSUWGMRR0_K1_LBSPPA512_LBSPPB128_MIWT4_2_PLR1_SU32_SUM0_SUS256_SKXCCM4_VWA4_VWB1_WGM1_WGMXCC1_WGMXCCGn1
    SolutionIndex: 39
    SolutionNameMin: Cijk_Alik_Bljk_BSS_BH_UserArgs_MT128x64x64_MI16x16x1_SN_LDSB1_CLR1_GSU0_GSUC0_GSUWGMRR0_K1_LBSPPA512_LBSPPB256_MIWT4_2_PLR1_SU32_SUM0_SUS256_SKXCCM4_VWA4_VWB2_WGM1_WGMXCC1_WGMXCCGn1
    SolutionIndex: 40
    SolutionNameMin: Cijk_Alik_Bljk_BSS_BH_UserArgs_MT128x64x64_MI16x16x1_SN_LDSB1_CLR1_GSU0_GSUC0_GSUWGMRR0_K1_LBSPPA512_LBSPPB128_MIWT4_2_PLR1_SU32_SUM0_SUS256_SKXCCM4_VWA4_VWB1_WGM4_WGMXCC1_WGMXCCGn1
    SolutionIndex: 41
    SolutionNameMin: Cijk_Alik_Bljk_BSS_BH_UserArgs_MT128x64x64_MI16x16x1_SN_LDSB1_CLR1_GSU0_GSUC0_GSUWGMRR0_K1_LBSPPA512_LBSPPB256_MIWT4_2_PLR1_SU32_SUM0_SUS256_SKXCCM4_VWA4_VWB2_WGM4_WGMXCC1_WGMXCCGn1
    SolutionIndex: 42
    SolutionNameMin: Cijk_Alik_Bljk_BSS_BH_UserArgs_MT64x64x64_MI16x16x1_SN_LDSB1_CLR1_GSU0_GSUC0_GSUWGMRR0_K1_LBSPPA128_LBSPPB128_MIWT2_2_PLR1_SU32_SUM0_SUS256_SKXCCM4_VWA1_VWB1_WGM1_WGMXCC1_WGMXCCGn1
    SolutionIndex: 43
    SolutionNameMin: Cijk_Alik_Bljk_BSS_BH_UserArgs_MT64x64x64_MI16x16x1_SN_LDSB1_CLR1_GSU0_GSUC0_GSUWGMRR0_K1_LBSPPA128_LBSPPB256_MIWT2_2_PLR1_SU32_SUM0_SUS256_SKXCCM4_VWA1_VWB2_WGM1_WGMXCC1_WGMXCCGn1
    SolutionIndex: 44
    SolutionNameMin: Cijk_Alik_Bljk_BSS_BH_UserArgs_MT32x64x64_MI16x16x1_SN_LDSB0_CLR1_GSU0_GSUC0_GSUWGMRR0_K1_LBSPPA128_LBSPPB256_MIWT1_2_PLR1_SU32_SUM0_SUS256_SKXCCM4_VWA1_VWB2_WGM1_WGMXCC1_WGMXCCGn1
    SolutionIndex: 45
    SolutionNameMin: Cijk_Alik_Bljk_BSS_BH_UserArgs_MT64x32x64_MI16x16x1_SN_LDSB0_CLR1_GSU0_GSUC0_GSUWGMRR0_K1_LBSPPA256_LBSPPB128_MIWT2_1_PLR1_SU32_SUM0_SUS256_SKXCCM4_VWA2_VWB1_WGM1_WGMXCC1_WGMXCCGn1
    SolutionIndex: 46
    SolutionNameMin: Cijk_Alik_Bljk_BSS_BH_UserArgs_MT32x32x64_MI16x16x1_SN_LDSB0_CLR1_GSU0_GSUC0_GSUWGMRR0_K1_LBSPPA128_LBSPPB128_MIWT1_1_PLR1_SU32_SUM0_SUS256_SKXCCM4_VWA1_VWB1_WGM1_WGMXCC1_WGMXCCGn1
    SolutionIndex: 47
    SolutionNameMin: Cijk_Alik_Bljk_BSS_BH_UserArgs_MT64x64x128_MI16x16x1_SN_LDSB1_CLR1_GSU0_GSUC0_GSUWGMRR0_K1_LBSPPA256_LBSPPB256_MIWT2_2_PLR1_SU32_SUM0_SUS256_SKXCCM4_VWA1_VWB1_WGM1_WGMXCC1_WGMXCCGn1
    SolutionIndex: 48
    SolutionNameMin: Cijk_Alik_Bljk_BSS_BH_UserArgs_MT64x64x128_MI16x16x1_SN_LDSB1_CLR1_GSU0_GSUC0_GSUWGMRR0_K1_LBSPPA256_LBSPPB512_MIWT2_2_PLR1_SU32_SUM0_SUS256_SKXCCM4_VWA1_VWB2_WGM1_WGMXCC1_WGMXCCGn1
    SolutionIndex: 49
    SolutionNameMin: Cijk_Alik_Bljk_BSS_BH_UserArgs_MT64x64x128_MI16x16x1_SN_LDSB1_CLR1_GSU0_GSUC0_GSUWGMRR0_K1_LBSPPA256_LBSPPB512_MIWT2_2_PLR2_SU32_SUM0_SUS256_SKXCCM4_VWA1_VWB2_WGM1_WGMXCC1_WGMXCCGn1
    SolutionIndex: 50
    SolutionNameMin: Cijk_Alik_Bljk_BSS_BH_UserArgs_MT64x64x128_MI16x16x1_SN_LDSB1_CLR1_GSU0_GSUC0_GSUWGMRR0_K1_LBSPPA256_LBSPPB256_MIWT2_2_PLR1_SU32_SUM0_SUS256_SKXCCM4_VWA1_VWB1_WGM2_WGMXCC1_WGMXCCGn1
    SolutionIndex: 51
    SolutionNameMin: Cijk_Alik_Bljk_BSS_BH_UserArgs_MT64x64x128_MI16x16x1_SN_LDSB1_CLR1_GSU0_GSUC0_GSUWGMRR0_K1_LBSPPA256_LBSPPB512_MIWT2_2_PLR2_SU32_SUM0_SUS256_SKXCCM4_VWA1_VWB2_WGM2_WGMXCC1_WGMXCCGn1
    SolutionIndex: 52
    SolutionNameMin: Cijk_Alik_Bljk_BSS_BH_UserArgs_MT64x64x128_MI16x16x1_SN_LDSB1_CLR1_GSU0_GSUC0_GSUWGMRR0_K1_LBSPPA256_LBSPPB256_MIWT2_2_PLR1_SU32_SUM0_SUS256_SKXCCM4_VWA1_VWB1_WGM4_WGMXCC1_WGMXCCGn1
    SolutionIndex: 53
    SolutionNameMin: Cijk_Alik_Bljk_BSS_BH_UserArgs_MT32x64x128_MI16x16x1_SN_LDSB1_CLR1_GSU0_GSUC0_GSUWGMRR0_K1_LBSPPA256_LBSPPB256_MIWT1_2_PLR2_SU32_SUM0_SUS256_SKXCCM4_VWA1_VWB1_WGM1_WGMXCC1_WGMXCCGn1
    SolutionIndex: 54
    SolutionNameMin: Cijk_Alik_Bljk_BSS_BH_UserArgs_MT32x64x128_MI16x16x1_SN_LDSB1_CLR1_GSU0_GSUC0_GSUWGMRR0_K1_LBSPPA256_LBSPPB512_MIWT1_2_PLR2_SU32_SUM0_SUS256_SKXCCM4_VWA1_VWB2_WGM1_WGMXCC1_WGMXCCGn1
    SolutionIndex: 55
    SolutionNameMin: Cijk_Alik_Bljk_BSS_BH_UserArgs_MT64x32x128_MI16x16x1_SN_LDSB1_CLR1_GSU0_GSUC0_GSUWGMRR0_K1_LBSPPA256_LBSPPB256_MIWT2_1_PLR2_SU32_SUM0_SUS256_SKXCCM4_VWA1_VWB1_WGM1_WGMXCC1_WGMXCCGn1
    SolutionIndex: 56
    SolutionNameMin: Cijk_Alik_Bljk_BSS_BH_UserArgs_MT32x32x128_MI16x16x1_SN_LDSB1_CLR1_GSU0_GSUC0_GSUWGMRR0_K1_LBSPPA256_LBSPPB256_MIWT1_1_PLR1_SU32_SUM0_SUS256_SKXCCM4_VWA1_VWB1_WGM1_WGMXCC1_WGMXCCGn1
    SolutionIndex: 57
    SolutionNameMin: Cijk_Alik_Bljk_BSS_BH_UserArgs_MT32x32x128_MI16x16x1_SN_LDSB1_CLR1_GSU0_GSUC0_GSUWGMRR0_K1_LBSPPA256_LBSPPB256_MIWT1_1_PLR2_SU32_SUM0_SUS256_SKXCCM4_VWA1_VWB1_WGM1_WGMXCC1_WGMXCCGn1
    SolutionIndex: 58
    SolutionNameMin: Cijk_Alik_Bljk_BSS_BH_UserArgs_MT32x32x32_MI16x16x1_SN_LDSB0_CLR1_GSU0_GSUC0_GSUWGMRR0_K1_LBSPPA128_LBSPPB128_MIWT1_1_PLR1_SU32_SUM0_SUS256_SKXCCM0_VWA1_VWB1_WGM1_WGMXCC1_WGMXCCGn1
- - - [128, 128, 1, 128, 128, 128, 128, 128]
    - [16, 0.095]
  - - [128, 128, 1, 256, 128, 128, 256, 256]
    - [11, 0.175]
  - - [128, 128, 1, 512, 128, 128, 512, 512]
    - [16, 0.3]
  - - [128, 128, 1, 1024, 128, 128, 1024, 1024]
    - [16, 0.48]
  - - [128, 128, 1, 2048, 128, 128, 2048, 2048]
    - [16, 0.694]
  - - [128, 128, 1, 4096, 128, 128, 4096, 4096]
    - [11, 1.188]
  - - [128, 128, 1, 8192, 128, 128, 8192, 8192]
    - [17, 1.905]
  - - [128, 256, 1, 128, 128, 128, 128, 128]
    - [46, 0.189]
  - - [128, 256, 1, 256, 128, 128, 256, 256]
    - [56, 0.348]
  - - [128, 256, 1, 512, 128, 128, 512, 512]
    - [46, 0.607]
  - - [128, 256, 1, 1024, 128, 128, 1024, 1024]
    - [16, 0.962]
  - - [128, 256, 1, 2048, 128, 128, 2048, 2048]
    - [17, 1.379]
  - - [128, 256, 1, 4096, 128, 128, 4096, 4096]
    - [17, 2.103]
  - - [128, 256, 1, 8192, 128, 128, 8192, 8192]
    - [53, 3.072]
  - - [128, 512, 1, 128, 128, 128, 128, 128]
    - [12, 0.371]
  - - [128, 512, 1, 256, 128, 128, 256, 256]
    - [46, 0.689]
  - - [128, 512, 1, 512, 128, 128, 512, 512]
    - [56, 1.188]
  - - [128, 512, 1, 1024, 128, 128, 1024, 1024]
    - [17, 1.905]
  - - [128, 512, 1, 2048, 128, 128, 2048, 2048]
    - [16, 2.678]
  - - [128, 512, 1, 4096, 128, 128, 4096, 4096]
    - [15, 3.337]
  - - [128, 512, 1, 8192, 128, 128, 8192, 8192]
    - [48, 4.939]
  - - [128, 1024, 1, 128, 128, 128, 128, 128]
    - [44, 0.69]
  - - [128, 1024, 1, 256, 128, 128, 256, 256]
    - [10, 1.263]
  - - [128, 1024, 1, 512, 128, 128, 512, 512]
    - [9, 2.086]
  - - [128, 1024, 1, 1024, 128, 128, 1024, 1024]
    - [9, 3.116]
  - - [128, 1024, 1, 2048, 128, 128, 2048, 2048]
    - [55, 4.166]
  - - [128, 1024, 1, 4096, 128, 128, 4096, 4096]
    - [47, 5.387]
  - - [128, 1024, 1, 8192, 128, 128, 8192, 8192]
    - [48, 7.02]
  - - [128, 2048, 1, 128, 128, 128, 128, 128]
    - [42, 1.212]
  - - [128, 2048, 1, 256, 128, 128, 256, 256]
    - [43, 2.086]
  - - [128, 2048, 1, 512, 128, 128, 512, 512]
    - [42, 3.41]
  - - [128, 2048, 1, 1024, 128, 128, 1024, 1024]
    - [47, 5.007]
  - - [128, 2048, 1, 2048, 128, 128, 2048, 2048]
    - [14, 6.466]
  - - [128, 2048, 1, 4096, 128, 128, 4096, 4096]
    - [38, 7.648]
  - - [128, 2048, 1, 8192, 128, 128, 8192, 8192]
    - [20, 9.852]
  - - [128, 4096, 1, 128, 128, 128, 128, 128]
    - [39, 1.966]
  - - [128, 4096, 1, 256, 128, 128, 256, 256]
    - [39, 3.392]
  - - [128, 4096, 1, 512, 128, 128, 512, 512]
    - [39, 5.298]
  - - [128, 4096, 1, 1024, 128, 128, 1024, 1024]
    - [38, 7.335]
  - - [128, 4096, 1, 2048, 128, 128, 2048, 2048]
    - [39, 7.758]
  - - [128, 4096, 1, 4096, 128, 128, 4096, 4096]
    - [2, 10.477]
  - - [128, 4096, 1, 8192, 128, 128, 8192, 8192]
    - [2, 13.347]
  - - [128, 8192, 1, 128, 128, 128, 128, 128]
    - [23, 2.807]
  - - [128, 8192, 1, 256, 128, 128, 256, 256]
    - [22, 4.848]
  - - [128, 8192, 1, 512, 128, 128, 512, 512]
    - [19, 7.427]
  - - [128, 8192, 1, 1024, 128, 128, 1024, 1024]
    - [20, 9.389]
  - - [128, 8192, 1, 2048, 128, 128, 2048, 2048]
    - [20, 10.997]
  - - [128, 8192, 1, 4096, 128, 128, 4096, 4096]
    - [24, 12.727]
  - - [128, 8192, 1, 8192, 128, 128, 8192, 8192]
    - [22, 14.833]
  - - [256, 128, 1, 128, 256, 256, 128, 128]
    - [46, 0.188]
  - - [256, 128, 1, 256, 256, 256, 256, 256]
    - [56, 0.348]
  - - [256, 128, 1, 512, 256, 256, 512, 512]
    - [16, 0.606]
  - - [256, 128, 1, 1024, 256, 256, 1024, 1024]
    - [57, 0.954]
  - - [256, 128, 1, 2048, 256, 256, 2048, 2048]
    - [17, 1.371]
  - - [256, 128, 1, 4096, 256, 256, 4096, 4096]
    - [16, 2.117]
  - - [256, 128, 1, 8192, 256, 256, 8192, 8192]
    - [54, 3.07]
  - - [256, 256, 1, 128, 256, 256, 128, 128]
    - [46, 0.374]
  - - [256, 256, 1, 256, 256, 256, 256, 256]
    - [11, 0.688]
  - - [256, 256, 1, 512, 256, 256, 512, 512]
    - [11, 1.181]
  - - [256, 256, 1, 1024, 256, 256, 1024, 1024]
    - [17, 1.888]
  - - [256, 256, 1, 2048, 256, 256, 2048, 2048]
    - [57, 2.662]
  - - [256, 256, 1, 4096, 256, 256, 4096, 4096]
    - [15, 3.361]
  - - [256, 256, 1, 8192, 256, 256, 8192, 8192]
    - [47, 4.846]
  - - [256, 512, 1, 128, 256, 256, 128, 128]
    - [45, 0.689]
  - - [256, 512, 1, 256, 256, 256, 256, 256]
    - [10, 1.253]
  - - [256, 512, 1, 512, 256, 256, 512, 512]
    - [44, 2.079]
  - - [256, 512, 1, 1024, 256, 256, 1024, 1024]
    - [10, 3.114]
  - - [256, 512, 1, 2048, 256, 256, 2048, 2048]
    - [15, 4.179]
  - - [256, 512, 1, 4096, 256, 256, 4096, 4096]
    - [48, 5.389]
  - - [256, 512, 1, 8192, 256, 256, 8192, 8192]
    - [48, 7.11]
  - - [256, 1024, 1, 128, 256, 256, 128, 128]
    - [42, 1.218]
  - - [256, 1024, 1, 256, 256, 256, 256, 256]
    - [42, 2.13]
  - - [256, 1024, 1, 512, 256, 256, 512, 512]
    - [42, 3.476]
  - - [256, 1024, 1, 1024, 256, 256, 1024, 1024]
    - [47, 5.041]
  - - [256, 1024, 1, 2048, 256, 256, 2048, 2048]
    - [49, 6.559]
  - - [256, 1024, 1, 4096, 256, 256, 4096, 4096]
    - [3, 7.468]
  - - [256, 1024, 1, 8192, 256, 256, 8192, 8192]
    - [20, 9.821]
  - - [256, 2048, 1, 128, 256, 256, 128, 128]
    - [36, 1.927]
  - - [256, 2048, 1, 256, 256, 256, 256, 256]
    - [37, 3.331]
  - - [256, 2048, 1, 512, 256, 256, 512, 512]
    - [36, 5.24]
  - - [256, 2048, 1, 1024, 256, 256, 1024, 1024]
    - [40, 7.255]
  - - [256, 2048, 1, 2048, 256, 256, 2048, 2048]
    - [41, 8.01]
  - - [256, 2048, 1, 4096, 256, 256, 4096, 4096]
    - [26, 10.336]
  - - [256, 2048, 1, 8192, 256, 256, 8192, 8192]
    - [20, 13.376]
  - - [256, 4096, 1, 128, 256, 256, 128, 128]
    - [24, 2.821]
  - - [256, 4096, 1, 256, 256, 256, 256, 256]
    - [19, 4.869]
  - - [256, 4096, 1, 512, 256, 256, 512, 512]
    - [21, 7.468]
  - - [256, 4096, 1, 1024, 256, 256, 1024, 1024]
    - [31, 9.886]
  - - [256, 4096, 1, 2048, 256, 256, 2048, 2048]
    - [30, 11.091]
  - - [256, 4096, 1, 4096, 256, 256, 4096, 4096]
    - [30, 12.886]
  - - [256, 4096, 1, 8192, 256, 256, 8192, 8192]
    - [30, 15.817]
  - - [256, 8192, 1, 128, 256, 256, 128, 128]
    - [24, 3.38]
  - - [256, 8192, 1, 256, 256, 256, 256, 256]
    - [24, 4.248]
  - - [256, 8192, 1, 512, 256, 256, 512, 512]
    - [24, 7.123]
  - - [256, 8192, 1, 1024, 256, 256, 1024, 1024]
    - [24, 9.943]
  - - [256, 8192, 1, 2048, 256, 256, 2048, 2048]
    - [18, 12.399]
  - - [256, 8192, 1, 4096, 256, 256, 4096, 4096]
    - [26, 14.416]
  - - [256, 8192, 1, 8192, 256, 256, 8192, 8192]
    - [22, 15.807]
  - - [512, 128, 1, 128, 512, 512, 128, 128]
    - [46, 0.376]
  - - [512, 128, 1, 256, 512, 512, 256, 256]
    - [46, 0.697]
  - - [512, 128, 1, 512, 512, 512, 512, 512]
    - [46, 1.191]
  - - [512, 128, 1, 1024, 512, 512, 1024, 1024]
    - [16, 1.908]
  - - [512, 128, 1, 2048, 512, 512, 2048, 2048]
    - [16, 2.639]
  - - [512, 128, 1, 4096, 512, 512, 4096, 4096]
    - [15, 3.354]
  - - [512, 128, 1, 8192, 512, 512, 8192, 8192]
    - [49, 4.908]
  - - [512, 256, 1, 128, 512, 512, 128, 128]
    - [9, 0.701]
  - - [512, 256, 1, 256, 512, 512, 256, 256]
    - [9, 1.25]
  - - [512, 256, 1, 512, 512, 512, 512, 512]
    - [44, 2.077]
  - - [512, 256, 1, 1024, 512, 512, 1024, 1024]
    - [9, 3.117]
  - - [512, 256, 1, 2048, 512, 512, 2048, 2048]
    - [55, 4.173]
  - - [512, 256, 1, 4096, 512, 512, 4096, 4096]
    - [50, 5.331]
  - - [512, 256, 1, 8192, 512, 512, 8192, 8192]
    - [49, 7.084]
  - - [512, 512, 1, 128, 512, 512, 128, 128]
    - [42, 1.21]
  - - [512, 512, 1, 256, 512, 512, 256, 256]
    - [43, 2.133]
  - - [512, 512, 1, 512, 512, 512, 512, 512]
    - [43, 3.455]
  - - [512, 512, 1, 1024, 512, 512, 1024, 1024]
    - [48, 5.035]
  - - [512, 512, 1, 2048, 512, 512, 2048, 2048]
    - [48, 6.584]
  - - [512, 512, 1, 4096, 512, 512, 4096, 4096]
    - [3, 7.535]
  - - [512, 512, 1, 8192, 512, 512, 8192, 8192]
    - [26, 9.635]
  - - [512, 1024, 1, 128, 512, 512, 128, 128]
    - [39, 1.963]
  - - [512, 1024, 1, 256, 512, 512, 256, 256]
    - [39, 3.403]
  - - [512, 1024, 1, 512, 512, 512, 512, 512]
    - [39, 5.289]
  - - [512, 1024, 1, 1024, 512, 512, 1024, 1024]
    - [39, 7.355]
  - - [512, 1024, 1, 2048, 512, 512, 2048, 2048]
    - [6, 8.329]
  - - [512, 1024, 1, 4096, 512, 512, 4096, 4096]
    - [32, 9.853]
  - - [512, 1024, 1, 8192, 512, 512, 8192, 8192]
    - [20, 12.878]
  - - [512, 2048, 1, 128, 512, 512, 128, 128]
    - [22, 2.847]
  - - [512, 2048, 1, 256, 512, 512, 256, 256]
    - [24, 4.918]
  - - [512, 2048, 1, 512, 512, 512, 512, 512]
    - [24, 7.683]
  - - [512, 2048, 1, 1024, 512, 512, 1024, 1024]
    - [22, 10.591]
  - - [512, 2048, 1, 2048, 512, 512, 2048, 2048]
    - [30, 11.077]
  - - [512, 2048, 1, 4096, 512, 512, 4096, 4096]
    - [27, 12.475]
  - - [512, 2048, 1, 8192, 512, 512, 8192, 8192]
    - [20, 15.628]
  - - [512, 4096, 1, 128, 512, 512, 128, 128]
    - [24, 3.462]
  - - [512, 4096, 1, 256, 512, 512, 256, 256]
    - [39, 4.327]
  - - [512, 4096, 1, 512, 512, 512, 512, 512]
    - [24, 7.197]
  - - [512, 4096, 1, 1024, 512, 512, 1024, 1024]
    - [20, 9.888]
  - - [512, 4096, 1, 2048, 512, 512, 2048, 2048]
    - [34, 11.832]
  - - [512, 4096, 1, 4096, 512, 512, 4096, 4096]
    - [30, 14.011]
  - - [512, 4096, 1, 8192, 512, 512, 8192, 8192]
    - [34, 16.269]
  - - [512, 8192, 1, 128, 512, 512, 128, 128]
    - [20, 3.684]
  - - [512, 8192, 1, 256, 512, 512, 256, 256]
    - [20, 5.912]
  - - [512, 8192, 1, 512, 512, 512, 512, 512]
    - [20, 9.232]
  - - [512, 8192, 1, 1024, 512, 512, 1024, 1024]
    - [20, 12.462]
  - - [512, 8192, 1, 2048, 512, 512, 2048, 2048]
    - [5, 13.725]
  - - [512, 8192, 1, 4096, 512, 512, 4096, 4096]
    - [20, 15.579]
  - - [512, 8192, 1, 8192, 512, 512, 8192, 8192]
    - [22, 17.737]
  - - [1024, 128, 1, 128, 1024, 1024, 128, 128]
    - [9, 0.703]
  - - [1024, 128, 1, 256, 1024, 1024, 256, 256]
    - [9, 1.262]
  - - [1024, 128, 1, 512, 1024, 1024, 512, 512]
    - [9, 2.093]
  - - [1024, 128, 1, 1024, 1024, 1024, 1024, 1024]
    - [9, 3.082]
  - - [1024, 128, 1, 2048, 1024, 1024, 2048, 2048]
    - [15, 4.165]
  - - [1024, 128, 1, 4096, 1024, 1024, 4096, 4096]
    - [51, 5.341]
  - - [1024, 128, 1, 8192, 1024, 1024, 8192, 8192]
    - [48, 7.082]
  - - [1024, 256, 1, 128, 1024, 1024, 128, 128]
    - [43, 1.22]
  - - [1024, 256, 1, 256, 1024, 1024, 256, 256]
    - [42, 2.168]
  - - [1024, 256, 1, 512, 1024, 1024, 512, 512]
    - [42, 3.476]
  - - [1024, 256, 1, 1024, 1024, 1024, 1024, 1024]
    - [47, 5.04]
  - - [1024, 256, 1, 2048, 1024, 1024, 2048, 2048]
    - [13, 6.547]
  - - [1024, 256, 1, 4096, 1024, 1024, 4096, 4096]
    - [3, 7.515]
  - - [1024, 256, 1, 8192, 1024, 1024, 8192, 8192]
    - [30, 9.845]
  - - [1024, 512, 1, 128, 1024, 1024, 128, 128]
    - [39, 1.985]
  - - [1024, 512, 1, 256, 1024, 1024, 256, 256]
    - [8, 3.328]
  - - [1024, 512, 1, 512, 1024, 1024, 512, 512]
    - [39, 5.327]
  - - [1024, 512, 1, 1024, 1024, 1024, 1024, 1024]
    - [39, 7.379]
  - - [1024, 512, 1, 2048, 1024, 1024, 2048, 2048]
    - [6, 8.155]
  - - [1024, 512, 1, 4096, 1024, 1024, 4096, 4096]
    - [34, 9.763]
  - - [1024, 512, 1, 8192, 1024, 1024, 8192, 8192]
    - [27, 12.722]
  - - [1024, 1024, 1, 128, 1024, 1024, 128, 128]
    - [24, 2.869]
  - - [1024, 1024, 1, 256, 1024, 1024, 256, 256]
    - [24, 4.945]
  - - [1024, 1024, 1, 512, 1024, 1024, 512, 512]
    - [21, 7.691]
  - - [1024, 1024, 1, 1024, 1024, 1024, 1024, 1024]
    - [33, 10.57]
  - - [1024, 1024, 1, 2048, 1024, 1024, 2048, 2048]
    - [24, 10.731]
  - - [1024, 1024, 1, 4096, 1024, 1024, 4096, 4096]
    - [22, 12.433]
  - - [1024, 1024, 1, 8192, 1024, 1024, 8192, 8192]
    - [30, 15.489]
  - - [1024, 2048, 1, 128, 1024, 1024, 128, 128]
    - [24, 3.431]
  - - [1024, 2048, 1, 256, 1024, 1024, 256, 256]
    - [39, 4.367]
  - - [1024, 2048, 1, 512, 1024, 1024, 512, 512]
    - [32, 7.021]
  - - [1024, 2048, 1, 1024, 1024, 1024, 1024, 1024]
    - [22, 9.635]
  - - [1024, 2048, 1, 2048, 1024, 1024, 2048, 2048]
    - [22, 11.915]
  - - [1024, 2048, 1, 4096, 1024, 1024, 4096, 4096]
    - [24, 14.51]
  - - [1024, 2048, 1, 8192, 1024, 1024, 8192, 8192]
    - [24, 16.526]
  - - [1024, 4096, 1, 128, 1024, 1024, 128, 128]
    - [22, 3.726]
  - - [1024, 4096, 1, 256, 1024, 1024, 256, 256]
    - [24, 5.981]
  - - [1024, 4096, 1, 512, 1024, 1024, 512, 512]
    - [24, 9.308]
  - - [1024, 4096, 1, 1024, 1024, 1024, 1024, 1024]
    - [24, 11.837]
  - - [1024, 4096, 1, 2048, 1024, 1024, 2048, 2048]
    - [1, 13.392]
  - - [1024, 4096, 1, 4096, 1024, 1024, 4096, 4096]
    - [30, 15.38]
  - - [1024, 4096, 1, 8192, 1024, 1024, 8192, 8192]
    - [30, 17.584]
  - - [1024, 8192, 1, 128, 1024, 1024, 128, 128]
    - [24, 4.495]
  - - [1024, 8192, 1, 256, 1024, 1024, 256, 256]
    - [24, 7.217]
  - - [1024, 8192, 1, 512, 1024, 1024, 512, 512]
    - [28, 10.355]
  - - [1024, 8192, 1, 1024, 1024, 1024, 1024, 1024]
    - [4, 12.688]
  - - [1024, 8192, 1, 2048, 1024, 1024, 2048, 2048]
    - [1, 14.352]
  - - [1024, 8192, 1, 4096, 1024, 1024, 4096, 4096]
    - [24, 16.243]
  - - [1024, 8192, 1, 8192, 1024, 1024, 8192, 8192]
    - [21, 18.34]
  - - [2048, 128, 1, 128, 2048, 2048, 128, 128]
    - [42, 1.214]
  - - [2048, 128, 1, 256, 2048, 2048, 256, 256]
    - [43, 2.139]
  - - [2048, 128, 1, 512, 2048, 2048, 512, 512]
    - [42, 3.474]
  - - [2048, 128, 1, 1024, 2048, 2048, 1024, 1024]
    - [47, 5.046]
  - - [2048, 128, 1, 2048, 2048, 2048, 2048, 2048]
    - [52, 6.459]
  - - [2048, 128, 1, 4096, 2048, 2048, 4096, 4096]
    - [1, 7.333]
  - - [2048, 128, 1, 8192, 2048, 2048, 8192, 8192]
    - [20, 9.896]
  - - [2048, 256, 1, 128, 2048, 2048, 128, 128]
    - [39, 1.961]
  - - [2048, 256, 1, 256, 2048, 2048, 256, 256]
    - [39, 3.404]
  - - [2048, 256, 1, 512, 2048, 2048, 512, 512]
    - [39, 5.308]
  - - [2048, 256, 1, 1024, 2048, 2048, 1024, 1024]
    - [41, 7.159]
  - - [2048, 256, 1, 2048, 2048, 2048, 2048, 2048]
    - [2, 7.839]
  - - [2048, 256, 1, 4096, 2048, 2048, 4096, 4096]
    - [24, 9.995]
  - - [2048, 256, 1, 8192, 2048, 2048, 8192, 8192]
    - [26, 12.68]
  - - [2048, 512, 1, 128, 2048, 2048, 128, 128]
    - [24, 2.876]
  - - [2048, 512, 1, 256, 2048, 2048, 256, 256]
    - [22, 4.938]
  - - [2048, 512, 1, 512, 2048, 2048, 512, 512]
    - [27, 7.598]
  - - [2048, 512, 1, 1024, 2048, 2048, 1024, 1024]
    - [32, 10.574]
  - - [2048, 512, 1, 2048, 2048, 2048, 2048, 2048]
    - [32, 10.688]
  - - [2048, 512, 1, 4096, 2048, 2048, 4096, 4096]
    - [32, 12.263]
  - - [2048, 512, 1, 8192, 2048, 2048, 8192, 8192]
    - [34, 15.571]
  - - [2048, 1024, 1, 128, 2048, 2048, 128, 128]
    - [22, 3.448]
  - - [2048, 1024, 1, 256, 2048, 2048, 256, 256]
    - [39, 4.34]
  - - [2048, 1024, 1, 512, 2048, 2048, 512, 512]
    - [32, 6.998]
  - - [2048, 1024, 1, 1024, 2048, 2048, 1024, 1024]
    - [30, 9.716]
  - - [2048, 1024, 1, 2048, 2048, 2048, 2048, 2048]
    - [20, 11.935]
  - - [2048, 1024, 1, 4096, 2048, 2048, 4096, 4096]
    - [20, 14.206]
  - - [2048, 1024, 1, 8192, 2048, 2048, 8192, 8192]
    - [20, 16.751]
  - - [2048, 2048, 1, 128, 2048, 2048, 128, 128]
    - [22, 3.696]
  - - [2048, 2048, 1, 256, 2048, 2048, 256, 256]
    - [22, 6.01]
  - - [2048, 2048, 1, 512, 2048, 2048, 512, 512]
    - [22, 8.94]
  - - [2048, 2048, 1, 1024, 2048, 2048, 1024, 1024]
    - [32, 11.477]
  - - [2048, 2048, 1, 2048, 2048, 2048, 2048, 2048]
    - [1, 13.703]
  - - [2048, 2048, 1, 4096, 2048, 2048, 4096, 4096]
    - [32, 15.317]
  - - [2048, 2048, 1, 8192, 2048, 2048, 8192, 8192]
    - [30, 17.527]
  - - [2048, 4096, 1, 128, 2048, 2048, 128, 128]
    - [22, 4.535]
  - - [2048, 4096, 1, 256, 2048, 2048, 256, 256]
    - [20, 7.252]
  - - [2048, 4096, 1, 512, 2048, 2048, 512, 512]
    - [2, 10.007]
  - - [2048, 4096, 1, 1024, 2048, 2048, 1024, 1024]
    - [1, 12.65]
  - - [2048, 4096, 1, 2048, 2048, 2048, 2048, 2048]
    - [1, 13.992]
  - - [2048, 4096, 1, 4096, 2048, 2048, 4096, 4096]
    - [30, 16.099]
  - - [2048, 4096, 1, 8192, 2048, 2048, 8192, 8192]
    - [26, 18.397]
  - - [2048, 8192, 1, 128, 2048, 2048, 128, 128]
    - [22, 5.165]
  - - [2048, 8192, 1, 256, 2048, 2048, 256, 256]
    - [22, 7.749]
  - - [2048, 8192, 1, 512, 2048, 2048, 512, 512]
    - [2, 10.744]
  - - [2048, 8192, 1, 1024, 2048, 2048, 1024, 1024]
    - [2, 13.469]
  - - [2048, 8192, 1, 2048, 2048, 2048, 2048, 2048]
    - [1, 14.398]
  - - [2048, 8192, 1, 4096, 2048, 2048, 4096, 4096]
    - [30, 16.965]
  - - [2048, 8192, 1, 8192, 2048, 2048, 8192, 8192]
    - [30, 18.151]
  - - [4096, 128, 1, 128, 4096, 4096, 128, 128]
    - [7, 1.901]
  - - [4096, 128, 1, 256, 4096, 4096, 256, 256]
    - [39, 3.272]
  - - [4096, 128, 1, 512, 4096, 4096, 512, 512]
    - [39, 5.137]
  - - [4096, 128, 1, 1024, 4096, 4096, 1024, 1024]
    - [35, 7.022]
  - - [4096, 128, 1, 2048, 4096, 4096, 2048, 2048]
    - [1, 7.636]
  - - [4096, 128, 1, 4096, 4096, 4096, 4096, 4096]
    - [3, 10.373]
  - - [4096, 128, 1, 8192, 4096, 4096, 8192, 8192]
    - [2, 13.257]
  - - [4096, 256, 1, 128, 4096, 4096, 128, 128]
    - [20, 2.896]
  - - [4096, 256, 1, 256, 4096, 4096, 256, 256]
    - [20, 4.963]
  - - [4096, 256, 1, 512, 4096, 4096, 512, 512]
    - [29, 7.589]
  - - [4096, 256, 1, 1024, 4096, 4096, 1024, 1024]
    - [30, 9.96]
  - - [4096, 256, 1, 2048, 4096, 4096, 2048, 2048]
    - [20, 10.678]
  - - [4096, 256, 1, 4096, 4096, 4096, 4096, 4096]
    - [20, 12.771]
  - - [4096, 256, 1, 8192, 4096, 4096, 8192, 8192]
    - [22, 14.984]
  - - [4096, 512, 1, 128, 4096, 4096, 128, 128]
    - [26, 3.401]
  - - [4096, 512, 1, 256, 4096, 4096, 256, 256]
    - [30, 4.208]
  - - [4096, 512, 1, 512, 4096, 4096, 512, 512]
    - [30, 7.113]
  - - [4096, 512, 1, 1024, 4096, 4096, 1024, 1024]
    - [30, 9.695]
  - - [4096, 512, 1, 2048, 4096, 4096, 2048, 2048]
    - [4, 11.381]
  - - [4096, 512, 1, 4096, 4096, 4096, 4096, 4096]
    - [3, 14.365]
  - - [4096, 512, 1, 8192, 4096, 4096, 8192, 8192]
    - [3, 16.62]
  - - [4096, 1024, 1, 128, 4096, 4096, 128, 128]
    - [26, 3.625]
  - - [4096, 1024, 1, 256, 4096, 4096, 256, 256]
    - [1, 5.846]
  - - [4096, 1024, 1, 512, 4096, 4096, 512, 512]
    - [30, 8.859]
  - - [4096, 1024, 1, 1024, 4096, 4096, 1024, 1024]
    - [30, 11.679]
  - - [4096, 1024, 1, 2048, 4096, 4096, 2048, 2048]
    - [1, 12.936]
  - - [4096, 1024, 1, 4096, 4096, 4096, 4096, 4096]
    - [28, 15.363]
  - - [4096, 1024, 1, 8192, 4096, 4096, 8192, 8192]
    - [30, 17.779]
  - - [4096, 2048, 1, 128, 4096, 4096, 128, 128]
    - [1, 4.396]
  - - [4096, 2048, 1, 256, 4096, 4096, 256, 256]
    - [1, 6.933]
  - - [4096, 2048, 1, 512, 4096, 4096, 512, 512]
    - [30, 9.905]
  - - [4096, 2048, 1, 1024, 4096, 4096, 1024, 1024]
    - [2, 12.732]
  - - [4096, 2048, 1, 2048, 4096, 4096, 2048, 2048]
    - [34, 13.669]
  - - [4096, 2048, 1, 4096, 4096, 4096, 4096, 4096]
    - [32, 16.186]
  - - [4096, 2048, 1, 8192, 4096, 4096, 8192, 8192]
    - [30, 18.353]
  - - [4096, 4096, 1, 128, 4096, 4096, 128, 128]
    - [1, 5.047]
  - - [4096, 4096, 1, 256, 4096, 4096, 256, 256]
    - [1, 7.526]
  - - [4096, 4096, 1, 512, 4096, 4096, 512, 512]
    - [1, 10.74]
  - - [4096, 4096, 1, 1024, 4096, 4096, 1024, 1024]
    - [1, 13.509]
  - - [4096, 4096, 1, 2048, 4096, 4096, 2048, 2048]
    - [1, 13.679]
  - - [4096, 4096, 1, 4096, 4096, 4096, 4096, 4096]
    - [32, 16.919]
  - - [4096, 4096, 1, 8192, 4096, 4096, 8192, 8192]
    - [30, 18.844]
  - - [4096, 8192, 1, 128, 4096, 4096, 128, 128]
    - [1, 5.034]
  - - [4096, 8192, 1, 256, 4096, 4096, 256, 256]
    - [1, 7.443]
  - - [4096, 8192, 1, 512, 4096, 4096, 512, 512]
    - [1, 10.833]
  - - [4096, 8192, 1, 1024, 4096, 4096, 1024, 1024]
    - [2, 13.705]
  - - [4096, 8192, 1, 2048, 4096, 4096, 2048, 2048]
    - [1, 13.836]
  - - [4096, 8192, 1, 4096, 4096, 4096, 4096, 4096]
    - [32, 16.175]
  - - [4096, 8192, 1, 8192, 4096, 4096, 8192, 8192]
    - [30, 17.797]
  - - [8192, 128, 1, 128, 8192, 8192, 128, 128]
    - [19, 2.861]
  - - [8192, 128, 1, 256, 8192, 8192, 256, 256]
    - [20, 4.883]
  - - [8192, 128, 1, 512, 8192, 8192, 512, 512]
    - [20, 7.498]
  - - [8192, 128, 1, 1024, 8192, 8192, 1024, 1024]
    - [1, 9.142]
  - - [8192, 128, 1, 2048, 8192, 8192, 2048, 2048]
    - [20, 10.766]
  - - [8192, 128, 1, 4096, 8192, 8192, 4096, 4096]
    - [1, 13.056]
  - - [8192, 128, 1, 8192, 8192, 8192, 8192, 8192]
    - [1, 15.006]
  - - [8192, 256, 1, 128, 8192, 8192, 128, 128]
    - [20, 3.409]
  - - [8192, 256, 1, 256, 8192, 8192, 256, 256]
    - [26, 4.194]
  - - [8192, 256, 1, 512, 8192, 8192, 512, 512]
    - [26, 6.802]
  - - [8192, 256, 1, 1024, 8192, 8192, 1024, 1024]
    - [27, 9.634]
  - - [8192, 256, 1, 2048, 8192, 8192, 2048, 2048]
    - [22, 12.72]
  - - [8192, 256, 1, 4096, 8192, 8192, 4096, 4096]
    - [1, 14.103]
  - - [8192, 256, 1, 8192, 8192, 8192, 8192, 8192]
    - [0, 16.414]
  - - [8192, 512, 1, 128, 8192, 8192, 128, 128]
    - [20, 3.574]
  - - [8192, 512, 1, 256, 8192, 8192, 256, 256]
    - [1, 5.723]
  - - [8192, 512, 1, 512, 8192, 8192, 512, 512]
    - [34, 8.77]
  - - [8192, 512, 1, 1024, 8192, 8192, 1024, 1024]
    - [30, 11.459]
  - - [8192, 512, 1, 2048, 8192, 8192, 2048, 2048]
    - [2, 12.807]
  - - [8192, 512, 1, 4096, 8192, 8192, 4096, 4096]
    - [26, 15.453]
  - - [8192, 512, 1, 8192, 8192, 8192, 8192, 8192]
    - [25, 17.636]
  - - [8192, 1024, 1, 128, 8192, 8192, 128, 128]
    - [1, 4.373]
  - - [8192, 1024, 1, 256, 8192, 8192, 256, 256]
    - [30, 6.819]
  - - [8192, 1024, 1, 512, 8192, 8192, 512, 512]
    - [30, 9.876]
  - - [8192, 1024, 1, 1024, 8192, 8192, 1024, 1024]
    - [2, 12.273]
  - - [8192, 1024, 1, 2048, 8192, 8192, 2048, 2048]
    - [26, 13.323]
  - - [8192, 1024, 1, 4096, 8192, 8192, 4096, 4096]
    - [30, 16.111]
  - - [8192, 1024, 1, 8192, 8192, 8192, 8192, 8192]
    - [26, 18.351]
  - - [8192, 2048, 1, 128, 8192, 8192, 128, 128]
    - [1, 5.0]
  - - [8192, 2048, 1, 256, 8192, 8192, 256, 256]
    - [2, 7.351]
  - - [8192, 2048, 1, 512, 8192, 8192, 512, 512]
    - [30, 10.517]
  - - [8192, 2048, 1, 1024, 8192, 8192, 1024, 1024]
    - [1, 12.752]
  - - [8192, 2048, 1, 2048, 8192, 8192, 2048, 2048]
    - [30, 13.663]
  - - [8192, 2048, 1, 4096, 8192, 8192, 4096, 4096]
    - [32, 16.89]
  - - [8192, 2048, 1, 8192, 8192, 8192, 8192, 8192]
    - [30, 18.608]
  - - [8192, 4096, 1, 128, 8192, 8192, 128, 128]
    - [30, 4.936]
  - - [8192, 4096, 1, 256, 8192, 8192, 256, 256]
    - [30, 7.414]
  - - [8192, 4096, 1, 512, 8192, 8192, 512, 512]
    - [30, 10.473]
  - - [8192, 4096, 1, 1024, 8192, 8192, 1024, 1024]
    - [1, 13.147]
  - - [8192, 4096, 1, 2048, 8192, 8192, 2048, 2048]
    - [30, 13.62]
  - - [8192, 4096, 1, 4096, 8192, 8192, 4096, 4096]
    - [30, 16.902]
  - - [8192, 4096, 1, 8192, 8192, 8192, 8192, 8192]
    - [30, 17.985]
  - - [8192, 8192, 1, 128, 8192, 8192, 128, 128]
    - [30, 4.529]
  - - [8192, 8192, 1, 256, 8192, 8192, 256, 256]
    - [30, 7.136]
  - - [8192, 8192, 1, 512, 8192, 8192, 512, 512]
    - [30, 10.306]
  - - [8192, 8192, 1, 1024, 8192, 8192, 1024, 1024]
    - [1, 12.848]
  - - [8192, 8192, 1, 2048, 8192, 8192, 2048, 2048]
    - [30, 13.303]
  - - [8192, 8192, 1, 4096, 8192, 8192, 4096, 4096]
    - [30, 16.214]
  - - [8192, 8192, 1, 8192, 8192, 8192, 8192, 8192]
    - [30, 18.253]
  - - [1, 1, 1, 32, 1, 1, 32, 32]
    - [58, 0.0]
- null
- null
- ExperimentalStreamK
- GridBased
