library/src/amd_detail/rocblaslt/src/Tensile/Logic/asm_full/aquavanjaram/gfx942_80cu/StreamK/aquavanjaram942_Cijk_Alik_Bljk_BBS_BH_UserArgs.yaml
- {MinimumRequiredVersion: 4.33.0}
- aquavanjaram942
- {Architecture: gfx942, CUCount: 80}
- [Device 0049, Device 0050]
    SolutionIndex: 0
    SolutionNameMin: Cijk_Alik_Bljk_BBS_BH_UserArgs_MT256x64x64_MI16x16x1_SN_LDSB1_CLR1_GSU0_GSUC0_GSUWGMRR0_K1_LBSPPA1024_LBSPPB256_MIWT8_2_PLR1_SU32_SUM0_SUS256_SKXCCM0_VWA8_VWB2_WGM1_WGMXCC1_WGMXCCGn1
    SolutionIndex: 1
    SolutionNameMin: Cijk_Alik_Bljk_BBS_BH_UserArgs_MT256x64x64_MI16x16x1_SN_LDSB1_CLR1_GSU0_GSUC0_GSUWGMRR0_K1_LBSPPA1024_LBSPPB256_MIWT8_2_PLR1_SU32_SUM0_SUS256_SKXCCM0_VWA8_VWB2_WGM2_WGMXCC1_WGMXCCGn1
    SolutionIndex: 2
    SolutionNameMin: Cijk_Alik_Bljk_BBS_BH_UserArgs_MT128x128x64_MI16x16x1_SN_LDSB1_CLR1_GSU0_GSUC0_GSUWGMRR0_K1_LBSPPA256_LBSPPB128_MIWT4_4_PLR1_SU32_SUM0_SUS256_SKXCCM0_VWA2_VWB1_WGM1_WGMXCC1_WGMXCCGn1
    SolutionIndex: 3
    SolutionNameMin: Cijk_Alik_Bljk_BBS_BH_UserArgs_MT128x128x64_MI16x16x1_SN_LDSB1_CLR1_GSU0_GSUC0_GSUWGMRR0_K1_LBSPPA512_LBSPPB128_MIWT4_4_PLR1_SU32_SUM0_SUS256_SKXCCM0_VWA4_VWB1_WGM1_WGMXCC1_WGMXCCGn1
    SolutionIndex: 4
    SolutionNameMin: Cijk_Alik_Bljk_BBS_BH_UserArgs_MT128x128x64_MI16x16x1_SN_LDSB1_CLR1_GSU0_GSUC0_GSUWGMRR0_K1_LBSPPA512_LBSPPB256_MIWT4_4_PLR1_SU32_SUM0_SUS256_SKXCCM0_VWA4_VWB2_WGM1_WGMXCC1_WGMXCCGn1
    SolutionIndex: 5
    SolutionNameMin: Cijk_Alik_Bljk_BBS_BH_UserArgs_MT128x128x64_MI16x16x1_SN_LDSB1_CLR1_GSU0_GSUC0_GSUWGMRR0_K1_LBSPPA512_LBSPPB512_MIWT4_4_PLR1_SU32_SUM0_SUS256_SKXCCM0_VWA4_VWB4_WGM1_WGMXCC1_WGMXCCGn1
    SolutionIndex: 6
    SolutionNameMin: Cijk_Alik_Bljk_BBS_BH_UserArgs_MT128x128x64_MI16x16x1_SN_LDSB1_CLR1_GSU0_GSUC0_GSUWGMRR0_K1_LBSPPA512_LBSPPB128_MIWT4_4_PLR1_SU32_SUM0_SUS256_SKXCCM0_VWA4_VWB1_WGM2_WGMXCC1_WGMXCCGn1
    SolutionIndex: 7
    SolutionNameMin: Cijk_Alik_Bljk_BBS_BH_UserArgs_MT128x128x64_MI16x16x1_SN_LDSB1_CLR1_GSU0_GSUC0_GSUWGMRR0_K1_LBSPPA512_LBSPPB256_MIWT4_4_PLR1_SU32_SUM0_SUS256_SKXCCM0_VWA4_VWB2_WGM2_WGMXCC1_WGMXCCGn1
    SolutionIndex: 8
    SolutionNameMin: Cijk_Alik_Bljk_BBS_BH_UserArgs_MT128x128x64_MI16x16x1_SN_LDSB1_CLR1_GSU0_GSUC0_GSUWGMRR0_K1_LBSPPA512_LBSPPB512_MIWT4_4_PLR1_SU32_SUM0_SUS256_SKXCCM0_VWA4_VWB4_WGM2_WGMXCC1_WGMXCCGn1
    SolutionIndex: 9
    SolutionNameMin: Cijk_Alik_Bljk_BBS_BH_UserArgs_MT128x128x64_MI16x16x1_SN_LDSB1_CLR1_GSU0_GSUC0_GSUWGMRR0_K1_LBSPPA512_LBSPPB256_MIWT4_4_PLR1_SU32_SUM0_SUS256_SKXCCM0_VWA4_VWB2_WGM4_WGMXCC1_WGMXCCGn1
    SolutionIndex: 10
    SolutionNameMin: Cijk_Alik_Bljk_BBS_BH_UserArgs_MT128x128x64_MI16x16x1_SN_LDSB1_CLR1_GSU0_GSUC0_GSUWGMRR0_K1_LBSPPA256_LBSPPB512_MIWT4_4_PLR1_SU32_SUM0_SUS256_SKXCCM0_VWA2_VWB4_WGM4_WGMXCC1_WGMXCCGn1
    SolutionIndex: 11
    SolutionNameMin: Cijk_Alik_Bljk_BBS_BH_UserArgs_MT128x128x64_MI16x16x1_SN_LDSB1_CLR1_GSU0_GSUC0_GSUWGMRR0_K1_LBSPPA512_LBSPPB512_MIWT4_4_PLR1_SU32_SUM0_SUS256_SKXCCM0_VWA4_VWB4_WGM4_WGMXCC1_WGMXCCGn1
    SolutionIndex: 12
    SolutionNameMin: Cijk_Alik_Bljk_BBS_BH_UserArgs_MT128x64x64_MI16x16x1_SN_LDSB1_CLR1_GSU0_GSUC0_GSUWGMRR0_K1_LBSPPA512_LBSPPB128_MIWT4_2_PLR1_SU32_SUM0_SUS256_SKXCCM0_VWA4_VWB1_WGM1_WGMXCC1_WGMXCCGn1
    SolutionIndex: 13
    SolutionNameMin: Cijk_Alik_Bljk_BBS_BH_UserArgs_MT64x64x64_MI16x16x1_SN_LDSB1_CLR1_GSU0_GSUC0_GSUWGMRR0_K1_LBSPPA256_LBSPPB128_MIWT2_2_PLR1_SU32_SUM0_SUS256_SKXCCM0_VWA2_VWB1_WGM1_WGMXCC1_WGMXCCGn1
    SolutionIndex: 14
    SolutionNameMin: Cijk_Alik_Bljk_BBS_BH_UserArgs_MT64x64x64_MI16x16x1_SN_LDSB1_CLR1_GSU0_GSUC0_GSUWGMRR0_K1_LBSPPA256_LBSPPB256_MIWT2_2_PLR1_SU32_SUM0_SUS256_SKXCCM0_VWA2_VWB2_WGM1_WGMXCC1_WGMXCCGn1
    SolutionIndex: 15
    SolutionNameMin: Cijk_Alik_Bljk_BBS_BH_UserArgs_MT32x64x64_MI16x16x1_SN_LDSB0_CLR1_GSU0_GSUC0_GSUWGMRR0_K1_LBSPPA128_LBSPPB128_MIWT1_2_PLR1_SU32_SUM0_SUS256_SKXCCM0_VWA1_VWB1_WGM1_WGMXCC1_WGMXCCGn1
    SolutionIndex: 16
    SolutionNameMin: Cijk_Alik_Bljk_BBS_BH_UserArgs_MT32x64x64_MI16x16x1_SN_LDSB0_CLR1_GSU0_GSUC0_GSUWGMRR0_K1_LBSPPA128_LBSPPB256_MIWT1_2_PLR1_SU32_SUM0_SUS256_SKXCCM0_VWA1_VWB2_WGM1_WGMXCC1_WGMXCCGn1
    SolutionIndex: 17
    SolutionNameMin: Cijk_Alik_Bljk_BBS_BH_UserArgs_MT64x32x64_MI16x16x1_SN_LDSB0_CLR1_GSU0_GSUC0_GSUWGMRR0_K1_LBSPPA256_LBSPPB128_MIWT2_1_PLR1_SU32_SUM0_SUS256_SKXCCM0_VWA2_VWB1_WGM1_WGMXCC1_WGMXCCGn1
    SolutionIndex: 18
    SolutionNameMin: Cijk_Alik_Bljk_BBS_BH_UserArgs_MT32x32x64_MI16x16x1_SN_LDSB0_CLR1_GSU0_GSUC0_GSUWGMRR0_K1_LBSPPA128_LBSPPB128_MIWT1_1_PLR1_SU32_SUM0_SUS256_SKXCCM0_VWA1_VWB1_WGM1_WGMXCC1_WGMXCCGn1
    SolutionIndex: 19
    SolutionNameMin: Cijk_Alik_Bljk_BBS_BH_UserArgs_MT64x64x128_MI16x16x1_SN_LDSB1_CLR1_GSU0_GSUC0_GSUWGMRR0_K1_LBSPPA512_LBSPPB256_MIWT2_2_PLR1_SU32_SUM0_SUS256_SKXCCM0_VWA2_VWB1_WGM1_WGMXCC1_WGMXCCGn1
    SolutionIndex: 20
    SolutionNameMin: Cijk_Alik_Bljk_BBS_BH_UserArgs_MT64x64x128_MI16x16x1_SN_LDSB1_CLR1_GSU0_GSUC0_GSUWGMRR0_K1_LBSPPA512_LBSPPB512_MIWT2_2_PLR1_SU32_SUM0_SUS256_SKXCCM0_VWA2_VWB2_WGM1_WGMXCC1_WGMXCCGn1
    SolutionIndex: 21
    SolutionNameMin: Cijk_Alik_Bljk_BBS_BH_UserArgs_MT64x64x128_MI16x16x1_SN_LDSB1_CLR1_GSU0_GSUC0_GSUWGMRR0_K1_LBSPPA512_LBSPPB256_MIWT2_2_PLR2_SU32_SUM0_SUS256_SKXCCM0_VWA2_VWB1_WGM1_WGMXCC1_WGMXCCGn1
    SolutionIndex: 22
    SolutionNameMin: Cijk_Alik_Bljk_BBS_BH_UserArgs_MT64x64x128_MI16x16x1_SN_LDSB1_CLR1_GSU0_GSUC0_GSUWGMRR0_K1_LBSPPA512_LBSPPB512_MIWT2_2_PLR2_SU32_SUM0_SUS256_SKXCCM0_VWA2_VWB2_WGM1_WGMXCC1_WGMXCCGn1
    SolutionIndex: 23
    SolutionNameMin: Cijk_Alik_Bljk_BBS_BH_UserArgs_MT64x64x128_MI16x16x1_SN_LDSB1_CLR1_GSU0_GSUC0_GSUWGMRR0_K1_LBSPPA512_LBSPPB256_MIWT2_2_PLR1_SU32_SUM0_SUS256_SKXCCM0_VWA2_VWB1_WGM4_WGMXCC1_WGMXCCGn1
    SolutionIndex: 24
    SolutionNameMin: Cijk_Alik_Bljk_BBS_BH_UserArgs_MT64x32x128_MI16x16x1_SN_LDSB1_CLR1_GSU0_GSUC0_GSUWGMRR0_K1_LBSPPA256_LBSPPB256_MIWT2_1_PLR2_SU32_SUM0_SUS256_SKXCCM0_VWA1_VWB1_WGM1_WGMXCC1_WGMXCCGn1
    SolutionIndex: 25
    SolutionNameMin: Cijk_Alik_Bljk_BBS_BH_UserArgs_MT64x32x128_MI16x16x1_SN_LDSB1_CLR1_GSU0_GSUC0_GSUWGMRR0_K1_LBSPPA512_LBSPPB256_MIWT2_1_PLR2_SU32_SUM0_SUS256_SKXCCM0_VWA2_VWB1_WGM1_WGMXCC1_WGMXCCGn1
    SolutionIndex: 26
    SolutionNameMin: Cijk_Alik_Bljk_BBS_BH_UserArgs_MT32x32x128_MI16x16x1_SN_LDSB1_CLR1_GSU0_GSUC0_GSUWGMRR0_K1_LBSPPA256_LBSPPB256_MIWT1_1_PLR1_SU32_SUM0_SUS256_SKXCCM0_VWA1_VWB1_WGM1_WGMXCC1_WGMXCCGn1
    SolutionIndex: 27
    SolutionNameMin: Cijk_Alik_Bljk_BBS_BH_UserArgs_MT32x32x128_MI16x16x1_SN_LDSB1_CLR1_GSU0_GSUC0_GSUWGMRR0_K1_LBSPPA256_LBSPPB256_MIWT1_1_PLR2_SU32_SUM0_SUS256_SKXCCM0_VWA1_VWB1_WGM1_WGMXCC1_WGMXCCGn1
    SolutionIndex: 28
    SolutionNameMin: Cijk_Alik_Bljk_BBS_BH_UserArgs_MT256x64x64_MI16x16x1_SN_LDSB1_CLR1_GSU0_GSUC0_GSUWGMRR0_K1_LBSPPA1024_LBSPPB128_MIWT8_2_PLR1_SU32_SUM0_SUS256_SKXCCM4_VWA8_VWB1_WGM1_WGMXCC1_WGMXCCGn1
    SolutionIndex: 29
    SolutionNameMin: Cijk_Alik_Bljk_BBS_BH_UserArgs_MT256x64x64_MI16x16x1_SN_LDSB1_CLR1_GSU0_GSUC0_GSUWGMRR0_K1_LBSPPA1024_LBSPPB256_MIWT8_2_PLR1_SU32_SUM0_SUS256_SKXCCM4_VWA8_VWB2_WGM1_WGMXCC1_WGMXCCGn1
    SolutionIndex: 30
    SolutionNameMin: Cijk_Alik_Bljk_BBS_BH_UserArgs_MT128x128x64_MI16x16x1_SN_LDSB1_CLR1_GSU0_GSUC0_GSUWGMRR0_K1_LBSPPA256_LBSPPB128_MIWT4_4_PLR1_SU32_SUM0_SUS256_SKXCCM4_VWA2_VWB1_WGM1_WGMXCC1_WGMXCCGn1
    SolutionIndex: 31
    SolutionNameMin: Cijk_Alik_Bljk_BBS_BH_UserArgs_MT128x128x64_MI16x16x1_SN_LDSB1_CLR1_GSU0_GSUC0_GSUWGMRR0_K1_LBSPPA512_LBSPPB128_MIWT4_4_PLR1_SU32_SUM0_SUS256_SKXCCM4_VWA4_VWB1_WGM1_WGMXCC1_WGMXCCGn1
    SolutionIndex: 32
    SolutionNameMin: Cijk_Alik_Bljk_BBS_BH_UserArgs_MT128x128x64_MI16x16x1_SN_LDSB1_CLR1_GSU0_GSUC0_GSUWGMRR0_K1_LBSPPA256_LBSPPB256_MIWT4_4_PLR1_SU32_SUM0_SUS256_SKXCCM4_VWA2_VWB2_WGM1_WGMXCC1_WGMXCCGn1
    SolutionIndex: 33
    SolutionNameMin: Cijk_Alik_Bljk_BBS_BH_UserArgs_MT128x128x64_MI16x16x1_SN_LDSB1_CLR1_GSU0_GSUC0_GSUWGMRR0_K1_LBSPPA512_LBSPPB256_MIWT4_4_PLR1_SU32_SUM0_SUS256_SKXCCM4_VWA4_VWB2_WGM1_WGMXCC1_WGMXCCGn1
    SolutionIndex: 34
    SolutionNameMin: Cijk_Alik_Bljk_BBS_BH_UserArgs_MT128x128x64_MI16x16x1_SN_LDSB1_CLR1_GSU0_GSUC0_GSUWGMRR0_K1_LBSPPA256_LBSPPB512_MIWT4_4_PLR1_SU32_SUM0_SUS256_SKXCCM4_VWA2_VWB4_WGM1_WGMXCC1_WGMXCCGn1
    SolutionIndex: 35
    SolutionNameMin: Cijk_Alik_Bljk_BBS_BH_UserArgs_MT128x128x64_MI16x16x1_SN_LDSB1_CLR1_GSU0_GSUC0_GSUWGMRR0_K1_LBSPPA512_LBSPPB512_MIWT4_4_PLR1_SU32_SUM0_SUS256_SKXCCM4_VWA4_VWB4_WGM1_WGMXCC1_WGMXCCGn1
    SolutionIndex: 36
    SolutionNameMin: Cijk_Alik_Bljk_BBS_BH_UserArgs_MT128x128x64_MI16x16x1_SN_LDSB1_CLR1_GSU0_GSUC0_GSUWGMRR0_K1_LBSPPA256_LBSPPB128_MIWT4_4_PLR1_SU32_SUM0_SUS256_SKXCCM4_VWA2_VWB1_WGM2_WGMXCC1_WGMXCCGn1
    SolutionIndex: 37
    SolutionNameMin: Cijk_Alik_Bljk_BBS_BH_UserArgs_MT128x128x64_MI16x16x1_SN_LDSB1_CLR1_GSU0_GSUC0_GSUWGMRR0_K1_LBSPPA512_LBSPPB128_MIWT4_4_PLR1_SU32_SUM0_SUS256_SKXCCM4_VWA4_VWB1_WGM2_WGMXCC1_WGMXCCGn1
    SolutionIndex: 38
    SolutionNameMin: Cijk_Alik_Bljk_BBS_BH_UserArgs_MT128x128x64_MI16x16x1_SN_LDSB1_CLR1_GSU0_GSUC0_GSUWGMRR0_K1_LBSPPA256_LBSPPB256_MIWT4_4_PLR1_SU32_SUM0_SUS256_SKXCCM4_VWA2_VWB2_WGM2_WGMXCC1_WGMXCCGn1
    SolutionIndex: 39
    SolutionNameMin: Cijk_Alik_Bljk_BBS_BH_UserArgs_MT128x128x64_MI16x16x1_SN_LDSB1_CLR1_GSU0_GSUC0_GSUWGMRR0_K1_LBSPPA512_LBSPPB256_MIWT4_4_PLR1_SU32_SUM0_SUS256_SKXCCM4_VWA4_VWB2_WGM2_WGMXCC1_WGMXCCGn1
    SolutionIndex: 40
    SolutionNameMin: Cijk_Alik_Bljk_BBS_BH_UserArgs_MT128x128x64_MI16x16x1_SN_LDSB1_CLR1_GSU0_GSUC0_GSUWGMRR0_K1_LBSPPA512_LBSPPB512_MIWT4_4_PLR1_SU32_SUM0_SUS256_SKXCCM4_VWA4_VWB4_WGM2_WGMXCC1_WGMXCCGn1
    SolutionIndex: 41
    SolutionNameMin: Cijk_Alik_Bljk_BBS_BH_UserArgs_MT128x128x64_MI16x16x1_SN_LDSB1_CLR1_GSU0_GSUC0_GSUWGMRR0_K1_LBSPPA256_LBSPPB128_MIWT4_4_PLR1_SU32_SUM0_SUS256_SKXCCM4_VWA2_VWB1_WGM4_WGMXCC1_WGMXCCGn1
    SolutionIndex: 42
    SolutionNameMin: Cijk_Alik_Bljk_BBS_BH_UserArgs_MT128x128x64_MI16x16x1_SN_LDSB1_CLR1_GSU0_GSUC0_GSUWGMRR0_K1_LBSPPA512_LBSPPB128_MIWT4_4_PLR1_SU32_SUM0_SUS256_SKXCCM4_VWA4_VWB1_WGM4_WGMXCC1_WGMXCCGn1
    SolutionIndex: 43
    SolutionNameMin: Cijk_Alik_Bljk_BBS_BH_UserArgs_MT128x128x64_MI16x16x1_SN_LDSB1_CLR1_GSU0_GSUC0_GSUWGMRR0_K1_LBSPPA256_LBSPPB256_MIWT4_4_PLR1_SU32_SUM0_SUS256_SKXCCM4_VWA2_VWB2_WGM4_WGMXCC1_WGMXCCGn1
    SolutionIndex: 44
    SolutionNameMin: Cijk_Alik_Bljk_BBS_BH_UserArgs_MT128x128x64_MI16x16x1_SN_LDSB1_CLR1_GSU0_GSUC0_GSUWGMRR0_K1_LBSPPA512_LBSPPB256_MIWT4_4_PLR1_SU32_SUM0_SUS256_SKXCCM4_VWA4_VWB2_WGM4_WGMXCC1_WGMXCCGn1
    SolutionIndex: 45
    SolutionNameMin: Cijk_Alik_Bljk_BBS_BH_UserArgs_MT128x128x64_MI16x16x1_SN_LDSB1_CLR1_GSU0_GSUC0_GSUWGMRR0_K1_LBSPPA256_LBSPPB512_MIWT4_4_PLR1_SU32_SUM0_SUS256_SKXCCM4_VWA2_VWB4_WGM4_WGMXCC1_WGMXCCGn1
    SolutionIndex: 46
    SolutionNameMin: Cijk_Alik_Bljk_BBS_BH_UserArgs_MT128x128x64_MI16x16x1_SN_LDSB1_CLR1_GSU0_GSUC0_GSUWGMRR0_K1_LBSPPA512_LBSPPB512_MIWT4_4_PLR1_SU32_SUM0_SUS256_SKXCCM4_VWA4_VWB4_WGM4_WGMXCC1_WGMXCCGn1
    SolutionIndex: 47
    SolutionNameMin: Cijk_Alik_Bljk_BBS_BH_UserArgs_MT64x128x64_MI16x16x1_SN_LDSB1_CLR1_GSU0_GSUC0_GSUWGMRR0_K1_LBSPPA256_LBSPPB512_MIWT2_4_PLR1_SU32_SUM0_SUS256_SKXCCM4_VWA2_VWB4_WGM1_WGMXCC1_WGMXCCGn1
    SolutionIndex: 48
    SolutionNameMin: Cijk_Alik_Bljk_BBS_BH_UserArgs_MT128x64x64_MI16x16x1_SN_LDSB1_CLR1_GSU0_GSUC0_GSUWGMRR0_K1_LBSPPA512_LBSPPB128_MIWT4_2_PLR1_SU32_SUM0_SUS256_SKXCCM4_VWA4_VWB1_WGM1_WGMXCC1_WGMXCCGn1
    SolutionIndex: 49
    SolutionNameMin: Cijk_Alik_Bljk_BBS_BH_UserArgs_MT128x64x64_MI16x16x1_SN_LDSB1_CLR1_GSU0_GSUC0_GSUWGMRR0_K1_LBSPPA256_LBSPPB256_MIWT4_2_PLR1_SU32_SUM0_SUS256_SKXCCM4_VWA2_VWB2_WGM1_WGMXCC1_WGMXCCGn1
    SolutionIndex: 50
    SolutionNameMin: Cijk_Alik_Bljk_BBS_BH_UserArgs_MT128x64x64_MI16x16x1_SN_LDSB1_CLR1_GSU0_GSUC0_GSUWGMRR0_K1_LBSPPA512_LBSPPB256_MIWT4_2_PLR1_SU32_SUM0_SUS256_SKXCCM4_VWA4_VWB2_WGM1_WGMXCC1_WGMXCCGn1
    SolutionIndex: 51
    SolutionNameMin: Cijk_Alik_Bljk_BBS_BH_UserArgs_MT128x64x64_MI16x16x1_SN_LDSB1_CLR1_GSU0_GSUC0_GSUWGMRR0_K1_LBSPPA512_LBSPPB256_MIWT4_2_PLR1_SU32_SUM0_SUS256_SKXCCM4_VWA4_VWB2_WGM2_WGMXCC1_WGMXCCGn1
    SolutionIndex: 52
    SolutionNameMin: Cijk_Alik_Bljk_BBS_BH_UserArgs_MT128x64x64_MI16x16x1_SN_LDSB1_CLR1_GSU0_GSUC0_GSUWGMRR0_K1_LBSPPA512_LBSPPB256_MIWT4_2_PLR1_SU32_SUM0_SUS256_SKXCCM4_VWA4_VWB2_WGM4_WGMXCC1_WGMXCCGn1
    SolutionIndex: 53
    SolutionNameMin: Cijk_Alik_Bljk_BBS_BH_UserArgs_MT64x64x64_MI16x16x1_SN_LDSB1_CLR1_GSU0_GSUC0_GSUWGMRR0_K1_LBSPPA256_LBSPPB128_MIWT2_2_PLR1_SU32_SUM0_SUS256_SKXCCM4_VWA2_VWB1_WGM1_WGMXCC1_WGMXCCGn1
    SolutionIndex: 54
    SolutionNameMin: Cijk_Alik_Bljk_BBS_BH_UserArgs_MT32x64x64_MI16x16x1_SN_LDSB0_CLR1_GSU0_GSUC0_GSUWGMRR0_K1_LBSPPA128_LBSPPB256_MIWT1_2_PLR1_SU32_SUM0_SUS256_SKXCCM4_VWA1_VWB2_WGM1_WGMXCC1_WGMXCCGn1
    SolutionIndex: 55
    SolutionNameMin: Cijk_Alik_Bljk_BBS_BH_UserArgs_MT64x32x64_MI16x16x1_SN_LDSB0_CLR1_GSU0_GSUC0_GSUWGMRR0_K1_LBSPPA256_LBSPPB128_MIWT2_1_PLR1_SU32_SUM0_SUS256_SKXCCM4_VWA2_VWB1_WGM1_WGMXCC1_WGMXCCGn1
    SolutionIndex: 56
    SolutionNameMin: Cijk_Alik_Bljk_BBS_BH_UserArgs_MT32x32x64_MI16x16x1_SN_LDSB0_CLR1_GSU0_GSUC0_GSUWGMRR0_K1_LBSPPA128_LBSPPB128_MIWT1_1_PLR1_SU32_SUM0_SUS256_SKXCCM4_VWA1_VWB1_WGM1_WGMXCC1_WGMXCCGn1
    SolutionIndex: 57
    SolutionNameMin: Cijk_Alik_Bljk_BBS_BH_UserArgs_MT64x64x128_MI16x16x1_SN_LDSB1_CLR1_GSU0_GSUC0_GSUWGMRR0_K1_LBSPPA256_LBSPPB256_MIWT2_2_PLR1_SU32_SUM0_SUS256_SKXCCM4_VWA1_VWB1_WGM1_WGMXCC1_WGMXCCGn1
    SolutionIndex: 58
    SolutionNameMin: Cijk_Alik_Bljk_BBS_BH_UserArgs_MT64x64x128_MI16x16x1_SN_LDSB1_CLR1_GSU0_GSUC0_GSUWGMRR0_K1_LBSPPA512_LBSPPB256_MIWT2_2_PLR1_SU32_SUM0_SUS256_SKXCCM4_VWA2_VWB1_WGM1_WGMXCC1_WGMXCCGn1
    SolutionIndex: 59
    SolutionNameMin: Cijk_Alik_Bljk_BBS_BH_UserArgs_MT64x64x128_MI16x16x1_SN_LDSB1_CLR1_GSU0_GSUC0_GSUWGMRR0_K1_LBSPPA256_LBSPPB512_MIWT2_2_PLR1_SU32_SUM0_SUS256_SKXCCM4_VWA1_VWB2_WGM1_WGMXCC1_WGMXCCGn1
    SolutionIndex: 60
    SolutionNameMin: Cijk_Alik_Bljk_BBS_BH_UserArgs_MT64x64x128_MI16x16x1_SN_LDSB1_CLR1_GSU0_GSUC0_GSUWGMRR0_K1_LBSPPA512_LBSPPB512_MIWT2_2_PLR1_SU32_SUM0_SUS256_SKXCCM4_VWA2_VWB2_WGM1_WGMXCC1_WGMXCCGn1
    SolutionIndex: 61
    SolutionNameMin: Cijk_Alik_Bljk_BBS_BH_UserArgs_MT64x64x128_MI16x16x1_SN_LDSB1_CLR1_GSU0_GSUC0_GSUWGMRR0_K1_LBSPPA256_LBSPPB256_MIWT2_2_PLR2_SU32_SUM0_SUS256_SKXCCM4_VWA1_VWB1_WGM1_WGMXCC1_WGMXCCGn1
    SolutionIndex: 62
    SolutionNameMin: Cijk_Alik_Bljk_BBS_BH_UserArgs_MT64x64x128_MI16x16x1_SN_LDSB1_CLR1_GSU0_GSUC0_GSUWGMRR0_K1_LBSPPA512_LBSPPB256_MIWT2_2_PLR2_SU32_SUM0_SUS256_SKXCCM4_VWA2_VWB1_WGM1_WGMXCC1_WGMXCCGn1
    SolutionIndex: 63
    SolutionNameMin: Cijk_Alik_Bljk_BBS_BH_UserArgs_MT64x64x128_MI16x16x1_SN_LDSB1_CLR1_GSU0_GSUC0_GSUWGMRR0_K1_LBSPPA256_LBSPPB512_MIWT2_2_PLR2_SU32_SUM0_SUS256_SKXCCM4_VWA1_VWB2_WGM1_WGMXCC1_WGMXCCGn1
    SolutionIndex: 64
    SolutionNameMin: Cijk_Alik_Bljk_BBS_BH_UserArgs_MT64x64x128_MI16x16x1_SN_LDSB1_CLR1_GSU0_GSUC0_GSUWGMRR0_K1_LBSPPA256_LBSPPB512_MIWT2_2_PLR2_SU32_SUM0_SUS256_SKXCCM4_VWA1_VWB2_WGM4_WGMXCC1_WGMXCCGn1
    SolutionIndex: 65
    SolutionNameMin: Cijk_Alik_Bljk_BBS_BH_UserArgs_MT32x64x128_MI16x16x1_SN_LDSB1_CLR1_GSU0_GSUC0_GSUWGMRR0_K1_LBSPPA256_LBSPPB512_MIWT1_2_PLR1_SU32_SUM0_SUS256_SKXCCM4_VWA1_VWB2_WGM1_WGMXCC1_WGMXCCGn1
    SolutionIndex: 66
    SolutionNameMin: Cijk_Alik_Bljk_BBS_BH_UserArgs_MT32x64x128_MI16x16x1_SN_LDSB1_CLR1_GSU0_GSUC0_GSUWGMRR0_K1_LBSPPA256_LBSPPB512_MIWT1_2_PLR2_SU32_SUM0_SUS256_SKXCCM4_VWA1_VWB2_WGM1_WGMXCC1_WGMXCCGn1
    SolutionIndex: 67
    SolutionNameMin: Cijk_Alik_Bljk_BBS_BH_UserArgs_MT64x32x128_MI16x16x1_SN_LDSB1_CLR1_GSU0_GSUC0_GSUWGMRR0_K1_LBSPPA512_LBSPPB256_MIWT2_1_PLR2_SU32_SUM0_SUS256_SKXCCM4_VWA2_VWB1_WGM1_WGMXCC1_WGMXCCGn1
    SolutionIndex: 68
    SolutionNameMin: Cijk_Alik_Bljk_BBS_BH_UserArgs_MT32x32x128_MI16x16x1_SN_LDSB1_CLR1_GSU0_GSUC0_GSUWGMRR0_K1_LBSPPA256_LBSPPB256_MIWT1_1_PLR1_SU32_SUM0_SUS256_SKXCCM4_VWA1_VWB1_WGM1_WGMXCC1_WGMXCCGn1
    SolutionIndex: 69
    SolutionNameMin: Cijk_Alik_Bljk_BBS_BH_UserArgs_MT32x32x128_MI16x16x1_SN_LDSB1_CLR1_GSU0_GSUC0_GSUWGMRR0_K1_LBSPPA256_LBSPPB256_MIWT1_1_PLR2_SU32_SUM0_SUS256_SKXCCM4_VWA1_VWB1_WGM1_WGMXCC1_WGMXCCGn1
    SolutionIndex: 70
    SolutionNameMin: Cijk_Alik_Bljk_BBS_BH_UserArgs_MT32x32x32_MI16x16x1_SN_LDSB0_CLR1_GSU0_GSUC0_GSUWGMRR0_K1_LBSPPA128_LBSPPB128_MIWT1_1_PLR1_SU32_SUM0_SUS256_SKXCCM0_VWA1_VWB1_WGM1_WGMXCC1_WGMXCCGn1
- - - [128, 128, 1, 128, 128, 128, 128, 128]
    - [56, 0.097]
  - - [128, 128, 1, 256, 128, 128, 256, 256]
    - [18, 0.178]
  - - [128, 128, 1, 512, 128, 128, 512, 512]
    - [26, 0.308]
  - - [128, 128, 1, 1024, 128, 128, 1024, 1024]
    - [69, 0.487]
  - - [128, 128, 1, 2048, 128, 128, 2048, 2048]
    - [26, 0.699]
  - - [128, 128, 1, 4096, 128, 128, 4096, 4096]
    - [18, 1.203]
  - - [128, 128, 1, 8192, 128, 128, 8192, 8192]
    - [27, 1.925]
  - - [128, 256, 1, 128, 128, 128, 128, 128]
    - [18, 0.192]
  - - [128, 256, 1, 256, 128, 128, 256, 256]
    - [18, 0.357]
  - - [128, 256, 1, 512, 128, 128, 512, 512]
    - [26, 0.609]
  - - [128, 256, 1, 1024, 128, 128, 1024, 1024]
    - [27, 0.965]
  - - [128, 256, 1, 2048, 128, 128, 2048, 2048]
    - [26, 1.389]
  - - [128, 256, 1, 4096, 128, 128, 4096, 4096]
    - [26, 2.109]
  - - [128, 256, 1, 8192, 128, 128, 8192, 8192]
    - [65, 3.068]
  - - [128, 512, 1, 128, 128, 128, 128, 128]
    - [18, 0.382]
  - - [128, 512, 1, 256, 128, 128, 256, 256]
    - [56, 0.702]
  - - [128, 512, 1, 512, 128, 128, 512, 512]
    - [56, 1.201]
  - - [128, 512, 1, 1024, 128, 128, 1024, 1024]
    - [27, 1.919]
  - - [128, 512, 1, 2048, 128, 128, 2048, 2048]
    - [26, 2.7]
  - - [128, 512, 1, 4096, 128, 128, 4096, 4096]
    - [24, 3.358]
  - - [128, 512, 1, 8192, 128, 128, 8192, 8192]
    - [62, 4.862]
  - - [128, 1024, 1, 128, 128, 128, 128, 128]
    - [16, 0.704]
  - - [128, 1024, 1, 256, 128, 128, 256, 256]
    - [16, 1.274]
  - - [128, 1024, 1, 512, 128, 128, 512, 512]
    - [54, 2.078]
  - - [128, 1024, 1, 1024, 128, 128, 1024, 1024]
    - [25, 3.181]
  - - [128, 1024, 1, 2048, 128, 128, 2048, 2048]
    - [67, 4.216]
  - - [128, 1024, 1, 4096, 128, 128, 4096, 4096]
    - [19, 5.375]
  - - [128, 1024, 1, 8192, 128, 128, 8192, 8192]
    - [64, 7.021]
  - - [128, 2048, 1, 128, 128, 128, 128, 128]
    - [14, 1.254]
  - - [128, 2048, 1, 256, 128, 128, 256, 256]
    - [53, 2.203]
  - - [128, 2048, 1, 512, 128, 128, 512, 512]
    - [14, 3.561]
  - - [128, 2048, 1, 1024, 128, 128, 1024, 1024]
    - [58, 5.125]
  - - [128, 2048, 1, 2048, 128, 128, 2048, 2048]
    - [60, 6.637]
  - - [128, 2048, 1, 4096, 128, 128, 4096, 4096]
    - [12, 7.683]
  - - [128, 2048, 1, 8192, 128, 128, 8192, 8192]
    - [31, 9.447]
  - - [128, 4096, 1, 128, 128, 128, 128, 128]
    - [50, 2.07]
  - - [128, 4096, 1, 256, 128, 128, 256, 256]
    - [49, 3.552]
  - - [128, 4096, 1, 512, 128, 128, 512, 512]
    - [50, 5.495]
  - - [128, 4096, 1, 1024, 128, 128, 1024, 1024]
    - [49, 7.529]
  - - [128, 4096, 1, 2048, 128, 128, 2048, 2048]
    - [12, 7.804]
  - - [128, 4096, 1, 4096, 128, 128, 4096, 4096]
    - [4, 10.425]
  - - [128, 4096, 1, 8192, 128, 128, 8192, 8192]
    - [4, 13.103]
  - - [128, 8192, 1, 128, 128, 128, 128, 128]
    - [33, 3.082]
  - - [128, 8192, 1, 256, 128, 128, 256, 256]
    - [32, 5.287]
  - - [128, 8192, 1, 512, 128, 128, 512, 512]
    - [30, 8.113]
  - - [128, 8192, 1, 1024, 128, 128, 1024, 1024]
    - [32, 9.819]
  - - [128, 8192, 1, 2048, 128, 128, 2048, 2048]
    - [33, 10.947]
  - - [128, 8192, 1, 4096, 128, 128, 4096, 4096]
    - [33, 13.034]
  - - [128, 8192, 1, 8192, 128, 128, 8192, 8192]
    - [4, 14.299]
  - - [256, 128, 1, 128, 256, 256, 128, 128]
    - [56, 0.192]
  - - [256, 128, 1, 256, 256, 256, 256, 256]
    - [18, 0.357]
  - - [256, 128, 1, 512, 256, 256, 512, 512]
    - [68, 0.61]
  - - [256, 128, 1, 1024, 256, 256, 1024, 1024]
    - [68, 0.957]
  - - [256, 128, 1, 2048, 256, 256, 2048, 2048]
    - [26, 1.39]
  - - [256, 128, 1, 4096, 256, 256, 4096, 4096]
    - [26, 2.12]
  - - [256, 128, 1, 8192, 256, 256, 8192, 8192]
    - [66, 3.055]
  - - [256, 256, 1, 128, 256, 256, 128, 128]
    - [56, 0.38]
  - - [256, 256, 1, 256, 256, 256, 256, 256]
    - [18, 0.702]
  - - [256, 256, 1, 512, 256, 256, 512, 512]
    - [56, 1.208]
  - - [256, 256, 1, 1024, 256, 256, 1024, 1024]
    - [26, 1.901]
  - - [256, 256, 1, 2048, 256, 256, 2048, 2048]
    - [26, 2.691]
  - - [256, 256, 1, 4096, 256, 256, 4096, 4096]
    - [25, 3.376]
  - - [256, 256, 1, 8192, 256, 256, 8192, 8192]
    - [61, 4.879]
  - - [256, 512, 1, 128, 256, 256, 128, 128]
    - [16, 0.709]
  - - [256, 512, 1, 256, 256, 256, 256, 256]
    - [15, 1.261]
  - - [256, 512, 1, 512, 256, 256, 512, 512]
    - [16, 2.095]
  - - [256, 512, 1, 1024, 256, 256, 1024, 1024]
    - [25, 3.157]
  - - [256, 512, 1, 2048, 256, 256, 2048, 2048]
    - [25, 4.233]
  - - [256, 512, 1, 4096, 256, 256, 4096, 4096]
    - [60, 5.363]
  - - [256, 512, 1, 8192, 256, 256, 8192, 8192]
    - [57, 7.084]
  - - [256, 1024, 1, 128, 256, 256, 128, 128]
    - [14, 1.262]
  - - [256, 1024, 1, 256, 256, 256, 256, 256]
    - [14, 2.235]
  - - [256, 1024, 1, 512, 256, 256, 512, 512]
    - [53, 3.526]
  - - [256, 1024, 1, 1024, 256, 256, 1024, 1024]
    - [22, 5.125]
  - - [256, 1024, 1, 2048, 256, 256, 2048, 2048]
    - [58, 6.626]
  - - [256, 1024, 1, 4096, 256, 256, 4096, 4096]
    - [4, 7.61]
  - - [256, 1024, 1, 8192, 256, 256, 8192, 8192]
    - [31, 9.536]
  - - [256, 2048, 1, 128, 256, 256, 128, 128]
    - [49, 2.075]
  - - [256, 2048, 1, 256, 256, 256, 256, 256]
    - [48, 3.545]
  - - [256, 2048, 1, 512, 256, 256, 512, 512]
    - [50, 5.492]
  - - [256, 2048, 1, 1024, 256, 256, 1024, 1024]
    - [48, 7.494]
  - - [256, 2048, 1, 2048, 256, 256, 2048, 2048]
    - [51, 8.041]
  - - [256, 2048, 1, 4096, 256, 256, 4096, 4096]
    - [37, 9.8]
  - - [256, 2048, 1, 8192, 256, 256, 8192, 8192]
    - [31, 12.83]
  - - [256, 4096, 1, 128, 256, 256, 128, 128]
    - [30, 3.099]
  - - [256, 4096, 1, 256, 256, 256, 256, 256]
    - [32, 5.265]
  - - [256, 4096, 1, 512, 256, 256, 512, 512]
    - [32, 8.009]
  - - [256, 4096, 1, 1024, 256, 256, 1024, 1024]
    - [30, 11.081]
  - - [256, 4096, 1, 2048, 256, 256, 2048, 2048]
    - [44, 11.232]
  - - [256, 4096, 1, 4096, 256, 256, 4096, 4096]
    - [42, 13.026]
  - - [256, 4096, 1, 8192, 256, 256, 8192, 8192]
    - [42, 15.426]
  - - [256, 8192, 1, 128, 256, 256, 128, 128]
    - [32, 3.578]
  - - [256, 8192, 1, 256, 256, 256, 256, 256]
    - [50, 4.43]
  - - [256, 8192, 1, 512, 256, 256, 512, 512]
    - [33, 7.037]
  - - [256, 8192, 1, 1024, 256, 256, 1024, 1024]
    - [5, 9.857]
  - - [256, 8192, 1, 2048, 256, 256, 2048, 2048]
    - [29, 12.388]
  - - [256, 8192, 1, 4096, 256, 256, 4096, 4096]
    - [7, 13.987]
  - - [256, 8192, 1, 8192, 256, 256, 8192, 8192]
    - [10, 15.728]
  - - [512, 128, 1, 128, 512, 512, 128, 128]
    - [18, 0.381]
  - - [512, 128, 1, 256, 512, 512, 256, 256]
    - [18, 0.701]
  - - [512, 128, 1, 512, 512, 512, 512, 512]
    - [27, 1.198]
  - - [512, 128, 1, 1024, 512, 512, 1024, 1024]
    - [27, 1.918]
  - - [512, 128, 1, 2048, 512, 512, 2048, 2048]
    - [26, 2.654]
  - - [512, 128, 1, 4096, 512, 512, 4096, 4096]
    - [25, 3.359]
  - - [512, 128, 1, 8192, 512, 512, 8192, 8192]
    - [59, 4.871]
  - - [512, 256, 1, 128, 512, 512, 128, 128]
    - [17, 0.708]
  - - [512, 256, 1, 256, 512, 512, 256, 256]
    - [17, 1.27]
  - - [512, 256, 1, 512, 512, 512, 512, 512]
    - [15, 2.113]
  - - [512, 256, 1, 1024, 512, 512, 1024, 1024]
    - [25, 3.156]
  - - [512, 256, 1, 2048, 512, 512, 2048, 2048]
    - [25, 4.221]
  - - [512, 256, 1, 4096, 512, 512, 4096, 4096]
    - [20, 5.311]
  - - [512, 256, 1, 8192, 512, 512, 8192, 8192]
    - [59, 7.057]
  - - [512, 512, 1, 128, 512, 512, 128, 128]
    - [14, 1.258]
  - - [512, 512, 1, 256, 512, 512, 256, 256]
    - [14, 2.215]
  - - [512, 512, 1, 512, 512, 512, 512, 512]
    - [14, 3.536]
  - - [512, 512, 1, 1024, 512, 512, 1024, 1024]
    - [19, 5.15]
  - - [512, 512, 1, 2048, 512, 512, 2048, 2048]
    - [21, 6.651]
  - - [512, 512, 1, 4096, 512, 512, 4096, 4096]
    - [57, 7.34]
  - - [512, 512, 1, 8192, 512, 512, 8192, 8192]
    - [31, 8.98]
  - - [512, 1024, 1, 128, 512, 512, 128, 128]
    - [49, 2.069]
  - - [512, 1024, 1, 256, 512, 512, 256, 256]
    - [50, 3.543]
  - - [512, 1024, 1, 512, 512, 512, 512, 512]
    - [50, 5.477]
  - - [512, 1024, 1, 1024, 512, 512, 1024, 1024]
    - [50, 7.522]
  - - [512, 1024, 1, 2048, 512, 512, 2048, 2048]
    - [11, 8.421]
  - - [512, 1024, 1, 4096, 512, 512, 4096, 4096]
    - [44, 9.826]
  - - [512, 1024, 1, 8192, 512, 512, 8192, 8192]
    - [35, 12.361]
  - - [512, 2048, 1, 128, 512, 512, 128, 128]
    - [32, 3.096]
  - - [512, 2048, 1, 256, 512, 512, 256, 256]
    - [32, 5.284]
  - - [512, 2048, 1, 512, 512, 512, 512, 512]
    - [32, 8.111]
  - - [512, 2048, 1, 1024, 512, 512, 1024, 1024]
    - [30, 11.056]
  - - [512, 2048, 1, 2048, 512, 512, 2048, 2048]
    - [44, 11.143]
  - - [512, 2048, 1, 4096, 512, 512, 4096, 4096]
    - [44, 12.615]
  - - [512, 2048, 1, 8192, 512, 512, 8192, 8192]
    - [42, 15.487]
  - - [512, 4096, 1, 128, 512, 512, 128, 128]
    - [32, 3.578]
  - - [512, 4096, 1, 256, 512, 512, 256, 256]
    - [50, 4.481]
  - - [512, 4096, 1, 512, 512, 512, 512, 512]
    - [31, 7.179]
  - - [512, 4096, 1, 1024, 512, 512, 1024, 1024]
    - [31, 9.898]
  - - [512, 4096, 1, 2048, 512, 512, 2048, 2048]
    - [42, 11.859]
  - - [512, 4096, 1, 4096, 512, 512, 4096, 4096]
    - [35, 13.921]
  - - [512, 4096, 1, 8192, 512, 512, 8192, 8192]
    - [43, 16.039]
  - - [512, 8192, 1, 128, 512, 512, 128, 128]
    - [28, 3.718]
  - - [512, 8192, 1, 256, 512, 512, 256, 256]
    - [33, 6.095]
  - - [512, 8192, 1, 512, 512, 512, 512, 512]
    - [33, 9.409]
  - - [512, 8192, 1, 1024, 512, 512, 1024, 1024]
    - [33, 12.49]
  - - [512, 8192, 1, 2048, 512, 512, 2048, 2048]
    - [33, 13.627]
  - - [512, 8192, 1, 4096, 512, 512, 4096, 4096]
    - [31, 15.591]
  - - [512, 8192, 1, 8192, 512, 512, 8192, 8192]
    - [30, 17.493]
  - - [1024, 128, 1, 128, 1024, 1024, 128, 128]
    - [55, 0.709]
  - - [1024, 128, 1, 256, 1024, 1024, 256, 256]
    - [16, 1.275]
  - - [1024, 128, 1, 512, 1024, 1024, 512, 512]
    - [16, 2.108]
  - - [1024, 128, 1, 1024, 1024, 1024, 1024, 1024]
    - [25, 3.153]
  - - [1024, 128, 1, 2048, 1024, 1024, 2048, 2048]
    - [24, 4.204]
  - - [1024, 128, 1, 4096, 1024, 1024, 4096, 4096]
    - [23, 5.34]
  - - [1024, 128, 1, 8192, 1024, 1024, 8192, 8192]
    - [63, 7.07]
  - - [1024, 256, 1, 128, 1024, 1024, 128, 128]
    - [14, 1.265]
  - - [1024, 256, 1, 256, 1024, 1024, 256, 256]
    - [14, 2.225]
  - - [1024, 256, 1, 512, 1024, 1024, 512, 512]
    - [14, 3.547]
  - - [1024, 256, 1, 1024, 1024, 1024, 1024, 1024]
    - [60, 5.097]
  - - [1024, 256, 1, 2048, 1024, 1024, 2048, 2048]
    - [19, 6.655]
  - - [1024, 256, 1, 4096, 1024, 1024, 4096, 4096]
    - [3, 7.59]
  - - [1024, 256, 1, 8192, 1024, 1024, 8192, 8192]
    - [33, 9.434]
  - - [1024, 512, 1, 128, 1024, 1024, 128, 128]
    - [50, 2.079]
  - - [1024, 512, 1, 256, 1024, 1024, 256, 256]
    - [50, 3.548]
  - - [1024, 512, 1, 512, 1024, 1024, 512, 512]
    - [50, 5.501]
  - - [1024, 512, 1, 1024, 1024, 1024, 1024, 1024]
    - [50, 7.542]
  - - [1024, 512, 1, 2048, 1024, 1024, 2048, 2048]
    - [11, 8.479]
  - - [1024, 512, 1, 4096, 1024, 1024, 4096, 4096]
    - [44, 9.716]
  - - [1024, 512, 1, 8192, 1024, 1024, 8192, 8192]
    - [44, 12.349]
  - - [1024, 1024, 1, 128, 1024, 1024, 128, 128]
    - [32, 3.098]
  - - [1024, 1024, 1, 256, 1024, 1024, 256, 256]
    - [32, 5.291]
  - - [1024, 1024, 1, 512, 1024, 1024, 512, 512]
    - [34, 8.112]
  - - [1024, 1024, 1, 1024, 1024, 1024, 1024, 1024]
    - [30, 11.07]
  - - [1024, 1024, 1, 2048, 1024, 1024, 2048, 2048]
    - [33, 10.706]
  - - [1024, 1024, 1, 4096, 1024, 1024, 4096, 4096]
    - [46, 12.329]
  - - [1024, 1024, 1, 8192, 1024, 1024, 8192, 8192]
    - [46, 15.366]
  - - [1024, 2048, 1, 128, 1024, 1024, 128, 128]
    - [34, 3.574]
  - - [1024, 2048, 1, 256, 1024, 1024, 256, 256]
    - [50, 4.473]
  - - [1024, 2048, 1, 512, 1024, 1024, 512, 512]
    - [33, 6.979]
  - - [1024, 2048, 1, 1024, 1024, 1024, 1024, 1024]
    - [33, 9.733]
  - - [1024, 2048, 1, 2048, 1024, 1024, 2048, 2048]
    - [33, 11.784]
  - - [1024, 2048, 1, 4096, 1024, 1024, 4096, 4096]
    - [35, 14.268]
  - - [1024, 2048, 1, 8192, 1024, 1024, 8192, 8192]
    - [35, 16.232]
  - - [1024, 4096, 1, 128, 1024, 1024, 128, 128]
    - [28, 3.668]
  - - [1024, 4096, 1, 256, 1024, 1024, 256, 256]
    - [33, 6.17]
  - - [1024, 4096, 1, 512, 1024, 1024, 512, 512]
    - [33, 9.463]
  - - [1024, 4096, 1, 1024, 1024, 1024, 1024, 1024]
    - [31, 12.336]
  - - [1024, 4096, 1, 2048, 1024, 1024, 2048, 2048]
    - [3, 13.323]
  - - [1024, 4096, 1, 4096, 1024, 1024, 4096, 4096]
    - [40, 15.59]
  - - [1024, 4096, 1, 8192, 1024, 1024, 8192, 8192]
    - [4, 17.238]
  - - [1024, 8192, 1, 128, 1024, 1024, 128, 128]
    - [28, 4.524]
  - - [1024, 8192, 1, 256, 1024, 1024, 256, 256]
    - [33, 7.306]
  - - [1024, 8192, 1, 512, 1024, 1024, 512, 512]
    - [33, 10.509]
  - - [1024, 8192, 1, 1024, 1024, 1024, 1024, 1024]
    - [31, 13.267]
  - - [1024, 8192, 1, 2048, 1024, 1024, 2048, 2048]
    - [5, 14.16]
  - - [1024, 8192, 1, 4096, 1024, 1024, 4096, 4096]
    - [33, 16.099]
  - - [1024, 8192, 1, 8192, 1024, 1024, 8192, 8192]
    - [31, 18.123]
  - - [2048, 128, 1, 128, 2048, 2048, 128, 128]
    - [13, 1.253]
  - - [2048, 128, 1, 256, 2048, 2048, 256, 256]
    - [13, 2.223]
  - - [2048, 128, 1, 512, 2048, 2048, 512, 512]
    - [13, 3.583]
  - - [2048, 128, 1, 1024, 2048, 2048, 1024, 1024]
    - [19, 5.148]
  - - [2048, 128, 1, 2048, 2048, 2048, 2048, 2048]
    - [21, 6.614]
  - - [2048, 128, 1, 4096, 2048, 2048, 4096, 4096]
    - [3, 7.518]
  - - [2048, 128, 1, 8192, 2048, 2048, 8192, 8192]
    - [33, 9.542]
  - - [2048, 256, 1, 128, 2048, 2048, 128, 128]
    - [49, 2.05]
  - - [2048, 256, 1, 256, 2048, 2048, 256, 256]
    - [50, 3.538]
  - - [2048, 256, 1, 512, 2048, 2048, 512, 512]
    - [50, 5.444]
  - - [2048, 256, 1, 1024, 2048, 2048, 1024, 1024]
    - [47, 7.448]
  - - [2048, 256, 1, 2048, 2048, 2048, 2048, 2048]
    - [3, 8.319]
  - - [2048, 256, 1, 4096, 2048, 2048, 4096, 4096]
    - [31, 9.884]
  - - [2048, 256, 1, 8192, 2048, 2048, 8192, 8192]
    - [39, 13.13]
  - - [2048, 512, 1, 128, 2048, 2048, 128, 128]
    - [34, 3.065]
  - - [2048, 512, 1, 256, 2048, 2048, 256, 256]
    - [34, 5.253]
  - - [2048, 512, 1, 512, 2048, 2048, 512, 512]
    - [30, 8.067]
  - - [2048, 512, 1, 1024, 2048, 2048, 1024, 1024]
    - [38, 10.947]
  - - [2048, 512, 1, 2048, 2048, 2048, 2048, 2048]
    - [44, 10.652]
  - - [2048, 512, 1, 4096, 2048, 2048, 4096, 4096]
    - [44, 12.436]
  - - [2048, 512, 1, 8192, 2048, 2048, 8192, 8192]
    - [46, 15.47]
  - - [2048, 1024, 1, 128, 2048, 2048, 128, 128]
    - [32, 3.565]
  - - [2048, 1024, 1, 256, 2048, 2048, 256, 256]
    - [50, 4.463]
  - - [2048, 1024, 1, 512, 2048, 2048, 512, 512]
    - [42, 7.077]
  - - [2048, 1024, 1, 1024, 2048, 2048, 1024, 1024]
    - [44, 9.906]
  - - [2048, 1024, 1, 2048, 2048, 2048, 2048, 2048]
    - [33, 11.755]
  - - [2048, 1024, 1, 4096, 2048, 2048, 4096, 4096]
    - [35, 13.963]
  - - [2048, 1024, 1, 8192, 2048, 2048, 8192, 8192]
    - [31, 16.236]
  - - [2048, 2048, 1, 128, 2048, 2048, 128, 128]
    - [28, 3.714]
  - - [2048, 2048, 1, 256, 2048, 2048, 256, 256]
    - [33, 6.178]
  - - [2048, 2048, 1, 512, 2048, 2048, 512, 512]
    - [33, 9.366]
  - - [2048, 2048, 1, 1024, 2048, 2048, 1024, 1024]
    - [44, 11.528]
  - - [2048, 2048, 1, 2048, 2048, 2048, 2048, 2048]
    - [5, 13.435]
  - - [2048, 2048, 1, 4096, 2048, 2048, 4096, 4096]
    - [37, 15.377]
  - - [2048, 2048, 1, 8192, 2048, 2048, 8192, 8192]
    - [3, 17.208]
  - - [2048, 4096, 1, 128, 2048, 2048, 128, 128]
    - [28, 4.531]
  - - [2048, 4096, 1, 256, 2048, 2048, 256, 256]
    - [33, 7.328]
  - - [2048, 4096, 1, 512, 2048, 2048, 512, 512]
    - [33, 10.398]
  - - [2048, 4096, 1, 1024, 2048, 2048, 1024, 1024]
    - [6, 12.516]
  - - [2048, 4096, 1, 2048, 2048, 2048, 2048, 2048]
    - [4, 14.012]
  - - [2048, 4096, 1, 4096, 2048, 2048, 4096, 4096]
    - [44, 16.13]
  - - [2048, 4096, 1, 8192, 2048, 2048, 8192, 8192]
    - [42, 18.165]
  - - [2048, 8192, 1, 128, 2048, 2048, 128, 128]
    - [28, 5.146]
  - - [2048, 8192, 1, 256, 2048, 2048, 256, 256]
    - [33, 7.809]
  - - [2048, 8192, 1, 512, 2048, 2048, 512, 512]
    - [9, 11.12]
  - - [2048, 8192, 1, 1024, 2048, 2048, 1024, 1024]
    - [3, 13.173]
  - - [2048, 8192, 1, 2048, 2048, 2048, 2048, 2048]
    - [4, 14.319]
  - - [2048, 8192, 1, 4096, 2048, 2048, 4096, 4096]
    - [44, 16.73]
  - - [2048, 8192, 1, 8192, 2048, 2048, 8192, 8192]
    - [42, 18.571]
  - - [4096, 128, 1, 128, 4096, 4096, 128, 128]
    - [50, 2.058]
  - - [4096, 128, 1, 256, 4096, 4096, 256, 256]
    - [49, 3.521]
  - - [4096, 128, 1, 512, 4096, 4096, 512, 512]
    - [50, 5.456]
  - - [4096, 128, 1, 1024, 4096, 4096, 1024, 1024]
    - [52, 7.357]
  - - [4096, 128, 1, 2048, 4096, 4096, 2048, 2048]
    - [3, 7.914]
  - - [4096, 128, 1, 4096, 4096, 4096, 4096, 4096]
    - [5, 10.239]
  - - [4096, 128, 1, 8192, 4096, 4096, 8192, 8192]
    - [4, 12.843]
  - - [4096, 256, 1, 128, 4096, 4096, 128, 128]
    - [32, 3.083]
  - - [4096, 256, 1, 256, 4096, 4096, 256, 256]
    - [32, 5.259]
  - - [4096, 256, 1, 512, 4096, 4096, 512, 512]
    - [32, 8.091]
  - - [4096, 256, 1, 1024, 4096, 4096, 1024, 1024]
    - [36, 10.948]
  - - [4096, 256, 1, 2048, 4096, 4096, 2048, 2048]
    - [33, 10.52]
  - - [4096, 256, 1, 4096, 4096, 4096, 4096, 4096]
    - [33, 12.973]
  - - [4096, 256, 1, 8192, 4096, 4096, 8192, 8192]
    - [5, 14.726]
  - - [4096, 512, 1, 128, 4096, 4096, 128, 128]
    - [32, 3.594]
  - - [4096, 512, 1, 256, 4096, 4096, 256, 256]
    - [50, 4.375]
  - - [4096, 512, 1, 512, 4096, 4096, 512, 512]
    - [42, 7.167]
  - - [4096, 512, 1, 1024, 4096, 4096, 1024, 1024]
    - [42, 9.605]
  - - [4096, 512, 1, 2048, 4096, 4096, 2048, 2048]
    - [8, 11.35]
  - - [4096, 512, 1, 4096, 4096, 4096, 4096, 4096]
    - [4, 14.206]
  - - [4096, 512, 1, 8192, 4096, 4096, 8192, 8192]
    - [2, 16.074]
  - - [4096, 1024, 1, 128, 4096, 4096, 128, 128]
    - [28, 3.758]
  - - [4096, 1024, 1, 256, 4096, 4096, 256, 256]
    - [33, 5.946]
  - - [4096, 1024, 1, 512, 4096, 4096, 512, 512]
    - [44, 8.89]
  - - [4096, 1024, 1, 1024, 4096, 4096, 1024, 1024]
    - [42, 11.543]
  - - [4096, 1024, 1, 2048, 4096, 4096, 2048, 2048]
    - [4, 12.973]
  - - [4096, 1024, 1, 4096, 4096, 4096, 4096, 4096]
    - [44, 15.241]
  - - [4096, 1024, 1, 8192, 4096, 4096, 8192, 8192]
    - [43, 17.327]
  - - [4096, 2048, 1, 128, 4096, 4096, 128, 128]
    - [28, 4.568]
  - - [4096, 2048, 1, 256, 4096, 4096, 256, 256]
    - [28, 7.177]
  - - [4096, 2048, 1, 512, 4096, 4096, 512, 512]
    - [42, 9.829]
  - - [4096, 2048, 1, 1024, 4096, 4096, 1024, 1024]
    - [4, 12.705]
  - - [4096, 2048, 1, 2048, 4096, 4096, 2048, 2048]
    - [42, 13.576]
  - - [4096, 2048, 1, 4096, 4096, 4096, 4096, 4096]
    - [44, 16.186]
  - - [4096, 2048, 1, 8192, 4096, 4096, 8192, 8192]
    - [41, 18.152]
  - - [4096, 4096, 1, 128, 4096, 4096, 128, 128]
    - [28, 5.166]
  - - [4096, 4096, 1, 256, 4096, 4096, 256, 256]
    - [28, 7.591]
  - - [4096, 4096, 1, 512, 4096, 4096, 512, 512]
    - [4, 10.896]
  - - [4096, 4096, 1, 1024, 4096, 4096, 1024, 1024]
    - [5, 13.374]
  - - [4096, 4096, 1, 2048, 4096, 4096, 2048, 2048]
    - [44, 13.579]
  - - [4096, 4096, 1, 4096, 4096, 4096, 4096, 4096]
    - [45, 16.704]
  - - [4096, 4096, 1, 8192, 4096, 4096, 8192, 8192]
    - [37, 18.706]
  - - [4096, 8192, 1, 128, 4096, 4096, 128, 128]
    - [28, 5.257]
  - - [4096, 8192, 1, 256, 4096, 4096, 256, 256]
    - [3, 7.868]
  - - [4096, 8192, 1, 512, 4096, 4096, 512, 512]
    - [4, 11.348]
  - - [4096, 8192, 1, 1024, 4096, 4096, 1024, 1024]
    - [3, 13.983]
  - - [4096, 8192, 1, 2048, 4096, 4096, 2048, 2048]
    - [4, 13.854]
  - - [4096, 8192, 1, 4096, 4096, 4096, 4096, 4096]
    - [42, 17.177]
  - - [4096, 8192, 1, 8192, 4096, 4096, 8192, 8192]
    - [42, 17.858]
  - - [8192, 128, 1, 128, 8192, 8192, 128, 128]
    - [1, 2.956]
  - - [8192, 128, 1, 256, 8192, 8192, 256, 256]
    - [34, 4.958]
  - - [8192, 128, 1, 512, 8192, 8192, 512, 512]
    - [32, 7.698]
  - - [8192, 128, 1, 1024, 8192, 8192, 1024, 1024]
    - [5, 9.526]
  - - [8192, 128, 1, 2048, 8192, 8192, 2048, 2048]
    - [31, 10.717]
  - - [8192, 128, 1, 4096, 8192, 8192, 4096, 4096]
    - [4, 13.288]
  - - [8192, 128, 1, 8192, 8192, 8192, 8192, 8192]
    - [11, 14.629]
  - - [8192, 256, 1, 128, 8192, 8192, 128, 128]
    - [34, 3.565]
  - - [8192, 256, 1, 256, 8192, 8192, 256, 256]
    - [52, 4.234]
  - - [8192, 256, 1, 512, 8192, 8192, 512, 512]
    - [5, 6.844]
  - - [8192, 256, 1, 1024, 8192, 8192, 1024, 1024]
    - [3, 9.576]
  - - [8192, 256, 1, 2048, 8192, 8192, 2048, 2048]
    - [31, 12.672]
  - - [8192, 256, 1, 4096, 8192, 8192, 4096, 4096]
    - [5, 14.122]
  - - [8192, 256, 1, 8192, 8192, 8192, 8192, 8192]
    - [4, 16.474]
  - - [8192, 512, 1, 128, 8192, 8192, 128, 128]
    - [28, 3.622]
  - - [8192, 512, 1, 256, 8192, 8192, 256, 256]
    - [42, 5.855]
  - - [8192, 512, 1, 512, 8192, 8192, 512, 512]
    - [44, 8.977]
  - - [8192, 512, 1, 1024, 8192, 8192, 1024, 1024]
    - [42, 11.567]
  - - [8192, 512, 1, 2048, 8192, 8192, 2048, 2048]
    - [3, 12.76]
  - - [8192, 512, 1, 4096, 8192, 8192, 4096, 4096]
    - [41, 15.386]
  - - [8192, 512, 1, 8192, 8192, 8192, 8192, 8192]
    - [42, 17.583]
  - - [8192, 1024, 1, 128, 8192, 8192, 128, 128]
    - [28, 4.442]
  - - [8192, 1024, 1, 256, 8192, 8192, 256, 256]
    - [42, 6.924]
  - - [8192, 1024, 1, 512, 8192, 8192, 512, 512]
    - [44, 9.962]
  - - [8192, 1024, 1, 1024, 8192, 8192, 1024, 1024]
    - [2, 12.166]
  - - [8192, 1024, 1, 2048, 8192, 8192, 2048, 2048]
    - [42, 13.211]
  - - [8192, 1024, 1, 4096, 8192, 8192, 4096, 4096]
    - [44, 16.033]
  - - [8192, 1024, 1, 8192, 8192, 8192, 8192, 8192]
    - [37, 18.417]
  - - [8192, 2048, 1, 128, 8192, 8192, 128, 128]
    - [28, 4.928]
  - - [8192, 2048, 1, 256, 8192, 8192, 256, 256]
    - [44, 7.407]
  - - [8192, 2048, 1, 512, 8192, 8192, 512, 512]
    - [42, 10.55]
  - - [8192, 2048, 1, 1024, 8192, 8192, 1024, 1024]
    - [5, 12.946]
  - - [8192, 2048, 1, 2048, 8192, 8192, 2048, 2048]
    - [44, 13.637]
  - - [8192, 2048, 1, 4096, 8192, 8192, 4096, 4096]
    - [44, 16.706]
  - - [8192, 2048, 1, 8192, 8192, 8192, 8192, 8192]
    - [42, 18.702]
  - - [8192, 4096, 1, 128, 8192, 8192, 128, 128]
    - [0, 5.009]
  - - [8192, 4096, 1, 256, 8192, 8192, 256, 256]
    - [5, 7.721]
  - - [8192, 4096, 1, 512, 8192, 8192, 512, 512]
    - [44, 10.849]
  - - [8192, 4096, 1, 1024, 8192, 8192, 1024, 1024]
    - [4, 13.507]
  - - [8192, 4096, 1, 2048, 8192, 8192, 2048, 2048]
    - [42, 13.653]
  - - [8192, 4096, 1, 4096, 8192, 8192, 4096, 4096]
    - [44, 17.145]
  - - [8192, 4096, 1, 8192, 8192, 8192, 8192, 8192]
    - [42, 18.364]
  - - [8192, 8192, 1, 128, 8192, 8192, 128, 128]
    - [0, 5.093]
  - - [8192, 8192, 1, 256, 8192, 8192, 256, 256]
    - [44, 7.793]
  - - [8192, 8192, 1, 512, 8192, 8192, 512, 512]
    - [5, 10.923]
  - - [8192, 8192, 1, 1024, 8192, 8192, 1024, 1024]
    - [3, 13.675]
  - - [8192, 8192, 1, 2048, 8192, 8192, 2048, 2048]
    - [42, 13.596]
  - - [8192, 8192, 1, 4096, 8192, 8192, 4096, 4096]
    - [44, 16.427]
  - - [8192, 8192, 1, 8192, 8192, 8192, 8192, 8192]
    - [42, 18.252]
  - - [1, 1, 1, 32, 1, 1, 32, 32]
    - [70, 0.0]
- null
- null
- ExperimentalStreamK
- GridBased
