library/src/amd_detail/rocblaslt/src/Tensile/Logic/asm_full/aquavanjaram/gfx942_80cu/StreamK/aquavanjaram942_Cijk_Alik_Bjlk_HSS_BH_UserArgs.yaml
- {MinimumRequiredVersion: 4.33.0}
- aquavanjaram942
- {Architecture: gfx942, CUCount: 80}
- [Device 0049, Device 0050]
    SolutionIndex: 0
    SolutionNameMin: Cijk_Alik_Bjlk_HSS_BH_UserArgs_MT256x256x32_MI16x16x1_SN_LDSB1_CLR1_GSU0_GSUC0_GSUWGMRR0_K1_LBSPPA256_LBSPPB2048_LPB32_MIWT8_8_PLR1_SU32_SUM0_SUS256_SKXCCM0_VWA4_VWB2_WGM1_WGMXCC1_WGMXCCGn1
    SolutionIndex: 1
    SolutionNameMin: Cijk_Alik_Bjlk_HSS_BH_UserArgs_MT256x256x32_MI16x16x1_SN_LDSB1_CLR1_GSU0_GSUC0_GSUWGMRR0_K1_LBSPPA256_LBSPPB2048_LPB0_MIWT8_8_PLR1_SU32_SUM0_SUS256_SKXCCM0_VWA4_VWB4_WGM1_WGMXCC1_WGMXCCGn1
    SolutionIndex: 2
    SolutionNameMin: Cijk_Alik_Bjlk_HSS_BH_UserArgs_MT256x256x32_MI16x16x1_SN_LDSB1_CLR1_GSU0_GSUC0_GSUWGMRR0_K1_LBSPPA256_LBSPPB2048_LPB0_MIWT8_8_PLR1_SU32_SUM0_SUS256_SKXCCM0_VWA4_VWB8_WGM1_WGMXCC1_WGMXCCGn1
    SolutionIndex: 3
    SolutionNameMin: Cijk_Alik_Bjlk_HSS_BH_UserArgs_MT256x256x32_MI16x16x1_SN_LDSB1_CLR1_GSU0_GSUC0_GSUWGMRR0_K1_LBSPPA256_LBSPPB2048_LPB0_MIWT8_8_PLR1_SU32_SUM0_SUS256_SKXCCM0_VWA4_VWB4_WGM2_WGMXCC1_WGMXCCGn1
    SolutionIndex: 4
    SolutionNameMin: Cijk_Alik_Bjlk_HSS_BH_UserArgs_MT256x256x32_MI16x16x1_SN_LDSB1_CLR1_GSU0_GSUC0_GSUWGMRR0_K1_LBSPPA256_LBSPPB2048_LPB0_MIWT8_8_PLR1_SU32_SUM0_SUS256_SKXCCM0_VWA4_VWB8_WGM4_WGMXCC1_WGMXCCGn1
    SolutionIndex: 5
    SolutionNameMin: Cijk_Alik_Bjlk_HSS_BH_UserArgs_MT128x256x32_MI16x16x1_SN_LDSB1_CLR1_GSU0_GSUC0_GSUWGMRR0_K1_LBSPPA256_LBSPPB2048_LPB0_MIWT4_8_PLR1_SU32_SUM0_SUS256_SKXCCM0_VWA4_VWB4_WGM1_WGMXCC1_WGMXCCGn1
    SolutionIndex: 6
    SolutionNameMin: Cijk_Alik_Bjlk_HSS_BH_UserArgs_MT128x256x32_MI16x16x1_SN_LDSB1_CLR1_GSU0_GSUC0_GSUWGMRR0_K1_LBSPPA256_LBSPPB2048_LPB0_MIWT4_8_PLR1_SU32_SUM0_SUS256_SKXCCM0_VWA4_VWB4_WGM4_WGMXCC1_WGMXCCGn1
    SolutionIndex: 7
    SolutionNameMin: Cijk_Alik_Bjlk_HSS_BH_UserArgs_MT128x64x32_MI16x16x1_SN_LDSB0_CLR1_GSU0_GSUC0_GSUWGMRR0_K1_LBSPPA256_LBSPPB512_LPB16_MIWT4_2_PLR1_SU32_SUM0_SUS256_SKXCCM0_VWA4_VWB1_WGM2_WGMXCC1_WGMXCCGn1
    SolutionIndex: 8
    SolutionNameMin: Cijk_Alik_Bjlk_HSS_BH_UserArgs_MT32x32x32_MI16x16x1_SN_LDSB0_CLR1_GSU0_GSUC0_GSUWGMRR0_K1_LBSPPA128_LBSPPB256_LPB16_MIWT1_1_PLR1_SU32_SUM0_SUS256_SKXCCM0_VWA1_VWB1_WGM1_WGMXCC1_WGMXCCGn1
    SolutionIndex: 9
    SolutionNameMin: Cijk_Alik_Bjlk_HSS_BH_UserArgs_MT128x256x64_MI16x16x1_SN_LDSB1_CLR1_GSU0_GSUC0_GSUWGMRR0_K1_LBSPPA128_LBSPPB4096_LPB32_MIWT4_8_PLR1_SU32_SUM0_SUS256_SKXCCM0_VWA1_VWB2_WGM1_WGMXCC1_WGMXCCGn1
    SolutionIndex: 10
    SolutionNameMin: Cijk_Alik_Bjlk_HSS_BH_UserArgs_MT128x256x64_MI16x16x1_SN_LDSB1_CLR1_GSU0_GSUC0_GSUWGMRR0_K1_LBSPPA128_LBSPPB4096_LPB0_MIWT4_8_PLR1_SU32_SUM0_SUS256_SKXCCM0_VWA1_VWB4_WGM1_WGMXCC1_WGMXCCGn1
    SolutionIndex: 11
    SolutionNameMin: Cijk_Alik_Bjlk_HSS_BH_UserArgs_MT128x256x64_MI16x16x1_SN_LDSB1_CLR1_GSU0_GSUC0_GSUWGMRR0_K1_LBSPPA512_LBSPPB4096_LPB0_MIWT4_8_PLR1_SU32_SUM0_SUS256_SKXCCM0_VWA4_VWB4_WGM1_WGMXCC1_WGMXCCGn1
    SolutionIndex: 12
    SolutionNameMin: Cijk_Alik_Bjlk_HSS_BH_UserArgs_MT128x256x64_MI16x16x1_SN_LDSB1_CLR1_GSU0_GSUC0_GSUWGMRR0_K1_LBSPPA512_LBSPPB4096_LPB0_MIWT4_8_PLR1_SU32_SUM0_SUS256_SKXCCM0_VWA4_VWB4_WGM4_WGMXCC1_WGMXCCGn1
    SolutionIndex: 13
    SolutionNameMin: Cijk_Alik_Bjlk_HSS_BH_UserArgs_MT256x128x64_MI16x16x1_SN_LDSB1_CLR1_GSU0_GSUC0_GSUWGMRR0_K1_LBSPPA512_LBSPPB2048_LPB0_MIWT8_4_PLR1_SU32_SUM0_SUS256_SKXCCM0_VWA4_VWB4_WGM1_WGMXCC1_WGMXCCGn1
    SolutionIndex: 14
    SolutionNameMin: Cijk_Alik_Bjlk_HSS_BH_UserArgs_MT128x128x64_MI16x16x1_SN_LDSB1_CLR1_GSU0_GSUC0_GSUWGMRR0_K1_LBSPPA128_LBSPPB2048_LPB0_MIWT4_4_PLR1_SU32_SUM0_SUS256_SKXCCM0_VWA1_VWB4_WGM1_WGMXCC1_WGMXCCGn1
    SolutionIndex: 15
    SolutionNameMin: Cijk_Alik_Bjlk_HSS_BH_UserArgs_MT128x128x64_MI16x16x1_SN_LDSB1_CLR1_GSU0_GSUC0_GSUWGMRR0_K1_LBSPPA512_LBSPPB2048_LPB0_MIWT4_4_PLR1_SU32_SUM0_SUS256_SKXCCM0_VWA4_VWB4_WGM1_WGMXCC1_WGMXCCGn1
    SolutionIndex: 16
    SolutionNameMin: Cijk_Alik_Bjlk_HSS_BH_UserArgs_MT128x128x64_MI16x16x1_SN_LDSB1_CLR1_GSU0_GSUC0_GSUWGMRR0_K1_LBSPPA512_LBSPPB2048_LPB0_MIWT4_4_PLR1_SU32_SUM0_SUS256_SKXCCM0_VWA4_VWB4_WGM2_WGMXCC1_WGMXCCGn1
    SolutionIndex: 17
    SolutionNameMin: Cijk_Alik_Bjlk_HSS_BH_UserArgs_MT128x128x64_MI16x16x1_SN_LDSB1_CLR1_GSU0_GSUC0_GSUWGMRR0_K1_LBSPPA512_LBSPPB2048_LPB0_MIWT4_4_PLR1_SU32_SUM0_SUS256_SKXCCM0_VWA4_VWB4_WGM4_WGMXCC1_WGMXCCGn1
    SolutionIndex: 18
    SolutionNameMin: Cijk_Alik_Bjlk_HSS_BH_UserArgs_MT32x64x64_MI16x16x1_SN_LDSB0_CLR1_GSU0_GSUC0_GSUWGMRR0_K1_LBSPPA128_LBSPPB1024_LPB32_MIWT1_2_PLR1_SU32_SUM0_SUS256_SKXCCM0_VWA1_VWB2_WGM1_WGMXCC1_WGMXCCGn1
    SolutionIndex: 19
    SolutionNameMin: Cijk_Alik_Bjlk_HSS_BH_UserArgs_MT32x32x64_MI16x16x1_SN_LDSB0_CLR1_GSU0_GSUC0_GSUWGMRR0_K1_LBSPPA128_LBSPPB512_LPB16_MIWT1_1_PLR1_SU32_SUM0_SUS256_SKXCCM0_VWA1_VWB1_WGM1_WGMXCC1_WGMXCCGn1
    SolutionIndex: 20
    SolutionNameMin: Cijk_Alik_Bjlk_HSS_BH_UserArgs_MT64x128x128_MI16x16x1_SN_LDSB1_CLR1_GSU0_GSUC0_GSUWGMRR0_K1_LBSPPA256_LBSPPB2048_LPB0_MIWT2_4_PLR2_SU32_SUM0_SUS256_SKXCCM0_VWA1_VWB4_WGM1_WGMXCC1_WGMXCCGn1
    SolutionIndex: 21
    SolutionNameMin: Cijk_Alik_Bjlk_HSS_BH_UserArgs_MT128x64x128_MI16x16x1_SN_LDSB1_CLR1_GSU0_GSUC0_GSUWGMRR0_K1_LBSPPA256_LBSPPB1024_LPB32_MIWT4_2_PLR2_SU32_SUM0_SUS256_SKXCCM0_VWA1_VWB2_WGM1_WGMXCC1_WGMXCCGn1
    SolutionIndex: 22
    SolutionNameMin: Cijk_Alik_Bjlk_HSS_BH_UserArgs_MT128x64x128_MI16x16x1_SN_LDSB1_CLR1_GSU0_GSUC0_GSUWGMRR0_K1_LBSPPA1024_LBSPPB1024_LPB32_MIWT4_2_PLR2_SU32_SUM0_SUS256_SKXCCM0_VWA4_VWB2_WGM1_WGMXCC1_WGMXCCGn1
    SolutionIndex: 23
    SolutionNameMin: Cijk_Alik_Bjlk_HSS_BH_UserArgs_MT128x64x128_MI16x16x1_SN_LDSB1_CLR1_GSU0_GSUC0_GSUWGMRR0_K1_LBSPPA1024_LBSPPB1024_LPB32_MIWT4_2_PLR2_SU32_SUM0_SUS256_SKXCCM0_VWA4_VWB2_WGM2_WGMXCC1_WGMXCCGn1
    SolutionIndex: 24
    SolutionNameMin: Cijk_Alik_Bjlk_HSS_BH_UserArgs_MT128x64x128_MI16x16x1_SN_LDSB1_CLR1_GSU0_GSUC0_GSUWGMRR0_K1_LBSPPA1024_LBSPPB1024_LPB32_MIWT4_2_PLR2_SU32_SUM0_SUS256_SKXCCM0_VWA4_VWB2_WGM4_WGMXCC1_WGMXCCGn1
    SolutionIndex: 25
    SolutionNameMin: Cijk_Alik_Bjlk_HSS_BH_UserArgs_MT64x64x128_MI16x16x1_SN_LDSB1_CLR1_GSU0_GSUC0_GSUWGMRR0_K1_LBSPPA256_LBSPPB1024_LPB32_MIWT2_2_PLR2_SU32_SUM0_SUS256_SKXCCM0_VWA1_VWB2_WGM1_WGMXCC1_WGMXCCGn1
    SolutionIndex: 26
    SolutionNameMin: Cijk_Alik_Bjlk_HSS_BH_UserArgs_MT64x64x128_MI16x16x1_SN_LDSB1_CLR1_GSU0_GSUC0_GSUWGMRR0_K1_LBSPPA256_LBSPPB1024_LPB32_MIWT2_2_PLR2_SU32_SUM0_SUS256_SKXCCM0_VWA1_VWB2_WGM2_WGMXCC1_WGMXCCGn1
    SolutionIndex: 27
    SolutionNameMin: Cijk_Alik_Bjlk_HSS_BH_UserArgs_MT64x64x128_MI16x16x1_SN_LDSB1_CLR1_GSU0_GSUC0_GSUWGMRR0_K1_LBSPPA256_LBSPPB1024_LPB32_MIWT2_2_PLR2_SU32_SUM0_SUS256_SKXCCM0_VWA1_VWB2_WGM4_WGMXCC1_WGMXCCGn1
    SolutionIndex: 28
    SolutionNameMin: Cijk_Alik_Bjlk_HSS_BH_UserArgs_MT32x64x128_MI16x16x1_SN_LDSB1_CLR1_GSU0_GSUC0_GSUWGMRR0_K1_LBSPPA256_LBSPPB1024_LPB32_MIWT1_2_PLR2_SU32_SUM0_SUS256_SKXCCM0_VWA1_VWB2_WGM1_WGMXCC1_WGMXCCGn1
    SolutionIndex: 29
    SolutionNameMin: Cijk_Alik_Bjlk_HSS_BH_UserArgs_MT32x64x128_MI16x16x1_SN_LDSB1_CLR1_GSU0_GSUC0_GSUWGMRR0_K1_LBSPPA256_LBSPPB1024_LPB32_MIWT1_2_PLR2_SU32_SUM0_SUS256_SKXCCM0_VWA1_VWB2_WGM2_WGMXCC1_WGMXCCGn1
    SolutionIndex: 30
    SolutionNameMin: Cijk_Alik_Bjlk_HSS_BH_UserArgs_MT32x32x128_MI16x16x1_SN_LDSB1_CLR1_GSU0_GSUC0_GSUWGMRR0_K1_LBSPPA256_LBSPPB512_LPB16_MIWT1_1_PLR1_SU32_SUM0_SUS256_SKXCCM0_VWA1_VWB1_WGM1_WGMXCC1_WGMXCCGn1
    SolutionIndex: 31
    SolutionNameMin: Cijk_Alik_Bjlk_HSS_BH_UserArgs_MT32x32x128_MI16x16x1_SN_LDSB1_CLR1_GSU0_GSUC0_GSUWGMRR0_K1_LBSPPA256_LBSPPB512_LPB16_MIWT1_1_PLR2_SU32_SUM0_SUS256_SKXCCM0_VWA1_VWB1_WGM1_WGMXCC1_WGMXCCGn1
    SolutionIndex: 32
    SolutionNameMin: Cijk_Alik_Bjlk_HSS_BH_UserArgs_MT256x256x32_MI16x16x1_SN_LDSB1_CLR1_GSU0_GSUC0_GSUWGMRR0_K1_LBSPPA256_LBSPPB2048_LPB32_MIWT8_8_PLR1_SU32_SUM0_SUS256_SKXCCM4_VWA4_VWB2_WGM1_WGMXCC1_WGMXCCGn1
    SolutionIndex: 33
    SolutionNameMin: Cijk_Alik_Bjlk_HSS_BH_UserArgs_MT256x256x32_MI16x16x1_SN_LDSB1_CLR1_GSU0_GSUC0_GSUWGMRR0_K1_LBSPPA256_LBSPPB2048_LPB0_MIWT8_8_PLR1_SU32_SUM0_SUS256_SKXCCM4_VWA4_VWB4_WGM1_WGMXCC1_WGMXCCGn1
    SolutionIndex: 34
    SolutionNameMin: Cijk_Alik_Bjlk_HSS_BH_UserArgs_MT256x256x32_MI16x16x1_SN_LDSB1_CLR1_GSU0_GSUC0_GSUWGMRR0_K1_LBSPPA128_LBSPPB2048_LPB0_MIWT8_8_PLR1_SU32_SUM0_SUS256_SKXCCM4_VWA2_VWB8_WGM1_WGMXCC1_WGMXCCGn1
    SolutionIndex: 35
    SolutionNameMin: Cijk_Alik_Bjlk_HSS_BH_UserArgs_MT256x256x32_MI16x16x1_SN_LDSB1_CLR1_GSU0_GSUC0_GSUWGMRR0_K1_LBSPPA256_LBSPPB2048_LPB0_MIWT8_8_PLR1_SU32_SUM0_SUS256_SKXCCM4_VWA4_VWB8_WGM1_WGMXCC1_WGMXCCGn1
    SolutionIndex: 36
    SolutionNameMin: Cijk_Alik_Bjlk_HSS_BH_UserArgs_MT256x256x32_MI16x16x1_SN_LDSB1_CLR1_GSU0_GSUC0_GSUWGMRR0_K1_LBSPPA256_LBSPPB2048_LPB16_MIWT8_8_PLR1_SU32_SUM0_SUS256_SKXCCM4_VWA4_VWB1_WGM2_WGMXCC1_WGMXCCGn1
    SolutionIndex: 37
    SolutionNameMin: Cijk_Alik_Bjlk_HSS_BH_UserArgs_MT256x256x32_MI16x16x1_SN_LDSB1_CLR1_GSU0_GSUC0_GSUWGMRR0_K1_LBSPPA256_LBSPPB2048_LPB32_MIWT8_8_PLR1_SU32_SUM0_SUS256_SKXCCM4_VWA4_VWB2_WGM2_WGMXCC1_WGMXCCGn1
    SolutionIndex: 38
    SolutionNameMin: Cijk_Alik_Bjlk_HSS_BH_UserArgs_MT256x256x32_MI16x16x1_SN_LDSB1_CLR1_GSU0_GSUC0_GSUWGMRR0_K1_LBSPPA256_LBSPPB2048_LPB0_MIWT8_8_PLR1_SU32_SUM0_SUS256_SKXCCM4_VWA4_VWB4_WGM2_WGMXCC1_WGMXCCGn1
    SolutionIndex: 39
    SolutionNameMin: Cijk_Alik_Bjlk_HSS_BH_UserArgs_MT256x256x32_MI16x16x1_SN_LDSB1_CLR1_GSU0_GSUC0_GSUWGMRR0_K1_LBSPPA256_LBSPPB2048_LPB0_MIWT8_8_PLR1_SU32_SUM0_SUS256_SKXCCM4_VWA4_VWB8_WGM2_WGMXCC1_WGMXCCGn1
    SolutionIndex: 40
    SolutionNameMin: Cijk_Alik_Bjlk_HSS_BH_UserArgs_MT256x256x32_MI16x16x1_SN_LDSB1_CLR1_GSU0_GSUC0_GSUWGMRR0_K1_LBSPPA256_LBSPPB2048_LPB32_MIWT8_8_PLR1_SU32_SUM0_SUS256_SKXCCM4_VWA4_VWB2_WGM4_WGMXCC1_WGMXCCGn1
    SolutionIndex: 41
    SolutionNameMin: Cijk_Alik_Bjlk_HSS_BH_UserArgs_MT256x256x32_MI16x16x1_SN_LDSB1_CLR1_GSU0_GSUC0_GSUWGMRR0_K1_LBSPPA256_LBSPPB2048_LPB0_MIWT8_8_PLR1_SU32_SUM0_SUS256_SKXCCM4_VWA4_VWB4_WGM4_WGMXCC1_WGMXCCGn1
    SolutionIndex: 42
    SolutionNameMin: Cijk_Alik_Bjlk_HSS_BH_UserArgs_MT256x256x32_MI16x16x1_SN_LDSB1_CLR1_GSU0_GSUC0_GSUWGMRR0_K1_LBSPPA256_LBSPPB2048_LPB0_MIWT8_8_PLR1_SU32_SUM0_SUS256_SKXCCM4_VWA4_VWB8_WGM4_WGMXCC1_WGMXCCGn1
    SolutionIndex: 43
    SolutionNameMin: Cijk_Alik_Bjlk_HSS_BH_UserArgs_MT128x256x32_MI16x16x1_SN_LDSB1_CLR1_GSU0_GSUC0_GSUWGMRR0_K1_LBSPPA256_LBSPPB2048_LPB32_MIWT4_8_PLR1_SU32_SUM0_SUS256_SKXCCM4_VWA4_VWB2_WGM1_WGMXCC1_WGMXCCGn1
    SolutionIndex: 44
    SolutionNameMin: Cijk_Alik_Bjlk_HSS_BH_UserArgs_MT128x256x32_MI16x16x1_SN_LDSB1_CLR1_GSU0_GSUC0_GSUWGMRR0_K1_LBSPPA256_LBSPPB2048_LPB0_MIWT4_8_PLR1_SU32_SUM0_SUS256_SKXCCM4_VWA4_VWB4_WGM1_WGMXCC1_WGMXCCGn1
    SolutionIndex: 45
    SolutionNameMin: Cijk_Alik_Bjlk_HSS_BH_UserArgs_MT128x256x32_MI16x16x1_SN_LDSB1_CLR1_GSU0_GSUC0_GSUWGMRR0_K1_LBSPPA256_LBSPPB2048_LPB0_MIWT4_8_PLR1_SU32_SUM0_SUS256_SKXCCM4_VWA4_VWB8_WGM1_WGMXCC1_WGMXCCGn1
    SolutionIndex: 46
    SolutionNameMin: Cijk_Alik_Bjlk_HSS_BH_UserArgs_MT128x256x32_MI16x16x1_SN_LDSB1_CLR1_GSU0_GSUC0_GSUWGMRR0_K1_LBSPPA256_LBSPPB2048_LPB32_MIWT4_8_PLR1_SU32_SUM0_SUS256_SKXCCM4_VWA4_VWB2_WGM2_WGMXCC1_WGMXCCGn1
    SolutionIndex: 47
    SolutionNameMin: Cijk_Alik_Bjlk_HSS_BH_UserArgs_MT128x256x32_MI16x16x1_SN_LDSB1_CLR1_GSU0_GSUC0_GSUWGMRR0_K1_LBSPPA256_LBSPPB2048_LPB0_MIWT4_8_PLR1_SU32_SUM0_SUS256_SKXCCM4_VWA4_VWB4_WGM2_WGMXCC1_WGMXCCGn1
    SolutionIndex: 48
    SolutionNameMin: Cijk_Alik_Bjlk_HSS_BH_UserArgs_MT128x256x32_MI16x16x1_SN_LDSB1_CLR1_GSU0_GSUC0_GSUWGMRR0_K1_LBSPPA256_LBSPPB2048_LPB0_MIWT4_8_PLR1_SU32_SUM0_SUS256_SKXCCM4_VWA4_VWB8_WGM2_WGMXCC1_WGMXCCGn1
    SolutionIndex: 49
    SolutionNameMin: Cijk_Alik_Bjlk_HSS_BH_UserArgs_MT128x256x32_MI16x16x1_SN_LDSB1_CLR1_GSU0_GSUC0_GSUWGMRR0_K1_LBSPPA256_LBSPPB2048_LPB0_MIWT4_8_PLR1_SU32_SUM0_SUS256_SKXCCM4_VWA4_VWB4_WGM4_WGMXCC1_WGMXCCGn1
    SolutionIndex: 50
    SolutionNameMin: Cijk_Alik_Bjlk_HSS_BH_UserArgs_MT128x256x32_MI16x16x1_SN_LDSB1_CLR1_GSU0_GSUC0_GSUWGMRR0_K1_LBSPPA256_LBSPPB2048_LPB0_MIWT4_8_PLR1_SU32_SUM0_SUS256_SKXCCM4_VWA4_VWB8_WGM4_WGMXCC1_WGMXCCGn1
    SolutionIndex: 51
    SolutionNameMin: Cijk_Alik_Bjlk_HSS_BH_UserArgs_MT256x128x32_MI16x16x1_SN_LDSB1_CLR1_GSU0_GSUC0_GSUWGMRR0_K1_LBSPPA256_LBSPPB1024_LPB32_MIWT8_4_PLR1_SU32_SUM0_SUS256_SKXCCM4_VWA4_VWB2_WGM1_WGMXCC1_WGMXCCGn1
    SolutionIndex: 52
    SolutionNameMin: Cijk_Alik_Bjlk_HSS_BH_UserArgs_MT256x128x32_MI16x16x1_SN_LDSB1_CLR1_GSU0_GSUC0_GSUWGMRR0_K1_LBSPPA256_LBSPPB1024_LPB0_MIWT8_4_PLR1_SU32_SUM0_SUS256_SKXCCM4_VWA4_VWB4_WGM1_WGMXCC1_WGMXCCGn1
    SolutionIndex: 53
    SolutionNameMin: Cijk_Alik_Bjlk_HSS_BH_UserArgs_MT256x128x32_MI16x16x1_SN_LDSB1_CLR1_GSU0_GSUC0_GSUWGMRR0_K1_LBSPPA256_LBSPPB1024_LPB32_MIWT8_4_PLR1_SU32_SUM0_SUS256_SKXCCM4_VWA4_VWB2_WGM2_WGMXCC1_WGMXCCGn1
    SolutionIndex: 54
    SolutionNameMin: Cijk_Alik_Bjlk_HSS_BH_UserArgs_MT256x128x32_MI16x16x1_SN_LDSB1_CLR1_GSU0_GSUC0_GSUWGMRR0_K1_LBSPPA256_LBSPPB1024_LPB0_MIWT8_4_PLR1_SU32_SUM0_SUS256_SKXCCM4_VWA4_VWB4_WGM4_WGMXCC1_WGMXCCGn1
    SolutionIndex: 55
    SolutionNameMin: Cijk_Alik_Bjlk_HSS_BH_UserArgs_MT128x128x32_MI16x16x1_SN_LDSB1_CLR1_GSU0_GSUC0_GSUWGMRR0_K1_LBSPPA256_LBSPPB1024_LPB0_MIWT4_4_PLR1_SU32_SUM0_SUS256_SKXCCM4_VWA4_VWB4_WGM1_WGMXCC1_WGMXCCGn1
    SolutionIndex: 56
    SolutionNameMin: Cijk_Alik_Bjlk_HSS_BH_UserArgs_MT128x128x32_MI16x16x1_SN_LDSB1_CLR1_GSU0_GSUC0_GSUWGMRR0_K1_LBSPPA256_LBSPPB1024_LPB0_MIWT4_4_PLR1_SU32_SUM0_SUS256_SKXCCM4_VWA4_VWB4_WGM2_WGMXCC1_WGMXCCGn1
    SolutionIndex: 57
    SolutionNameMin: Cijk_Alik_Bjlk_HSS_BH_UserArgs_MT128x128x32_MI16x16x1_SN_LDSB1_CLR1_GSU0_GSUC0_GSUWGMRR0_K1_LBSPPA256_LBSPPB1024_LPB0_MIWT4_4_PLR1_SU32_SUM0_SUS256_SKXCCM4_VWA4_VWB4_WGM4_WGMXCC1_WGMXCCGn1
    SolutionIndex: 58
    SolutionNameMin: Cijk_Alik_Bjlk_HSS_BH_UserArgs_MT128x256x64_MI16x16x1_SN_LDSB1_CLR1_GSU0_GSUC0_GSUWGMRR0_K1_LBSPPA512_LBSPPB4096_LPB0_MIWT4_8_PLR1_SU32_SUM0_SUS256_SKXCCM4_VWA4_VWB4_WGM2_WGMXCC1_WGMXCCGn1
    SolutionIndex: 59
    SolutionNameMin: Cijk_Alik_Bjlk_HSS_BH_UserArgs_MT128x256x64_MI16x16x1_SN_LDSB1_CLR1_GSU0_GSUC0_GSUWGMRR0_K1_LBSPPA512_LBSPPB4096_LPB0_MIWT4_8_PLR1_SU32_SUM0_SUS256_SKXCCM4_VWA4_VWB4_WGM4_WGMXCC1_WGMXCCGn1
    SolutionIndex: 60
    SolutionNameMin: Cijk_Alik_Bjlk_HSS_BH_UserArgs_MT256x128x64_MI16x16x1_SN_LDSB1_CLR1_GSU0_GSUC0_GSUWGMRR0_K1_LBSPPA512_LBSPPB2048_LPB0_MIWT8_4_PLR1_SU32_SUM0_SUS256_SKXCCM4_VWA4_VWB4_WGM1_WGMXCC1_WGMXCCGn1
    SolutionIndex: 61
    SolutionNameMin: Cijk_Alik_Bjlk_HSS_BH_UserArgs_MT256x128x64_MI16x16x1_SN_LDSB1_CLR1_GSU0_GSUC0_GSUWGMRR0_K1_LBSPPA512_LBSPPB2048_LPB0_MIWT8_4_PLR1_SU32_SUM0_SUS256_SKXCCM4_VWA4_VWB4_WGM2_WGMXCC1_WGMXCCGn1
    SolutionIndex: 62
    SolutionNameMin: Cijk_Alik_Bjlk_HSS_BH_UserArgs_MT128x128x64_MI16x16x1_SN_LDSB1_CLR1_GSU0_GSUC0_GSUWGMRR0_K1_LBSPPA128_LBSPPB2048_LPB0_MIWT4_4_PLR1_SU32_SUM0_SUS256_SKXCCM4_VWA1_VWB4_WGM1_WGMXCC1_WGMXCCGn1
    SolutionIndex: 63
    SolutionNameMin: Cijk_Alik_Bjlk_HSS_BH_UserArgs_MT128x128x64_MI16x16x1_SN_LDSB1_CLR1_GSU0_GSUC0_GSUWGMRR0_K1_LBSPPA512_LBSPPB2048_LPB0_MIWT4_4_PLR1_SU32_SUM0_SUS256_SKXCCM4_VWA4_VWB4_WGM1_WGMXCC1_WGMXCCGn1
    SolutionIndex: 64
    SolutionNameMin: Cijk_Alik_Bjlk_HSS_BH_UserArgs_MT128x128x64_MI16x16x1_SN_LDSB1_CLR1_GSU0_GSUC0_GSUWGMRR0_K1_LBSPPA512_LBSPPB2048_LPB0_MIWT4_4_PLR1_SU32_SUM0_SUS256_SKXCCM4_VWA4_VWB4_WGM2_WGMXCC1_WGMXCCGn1
    SolutionIndex: 65
    SolutionNameMin: Cijk_Alik_Bjlk_HSS_BH_UserArgs_MT128x128x64_MI16x16x1_SN_LDSB1_CLR1_GSU0_GSUC0_GSUWGMRR0_K1_LBSPPA128_LBSPPB2048_LPB0_MIWT4_4_PLR1_SU32_SUM0_SUS256_SKXCCM4_VWA1_VWB4_WGM4_WGMXCC1_WGMXCCGn1
    SolutionIndex: 66
    SolutionNameMin: Cijk_Alik_Bjlk_HSS_BH_UserArgs_MT128x128x64_MI16x16x1_SN_LDSB1_CLR1_GSU0_GSUC0_GSUWGMRR0_K1_LBSPPA512_LBSPPB2048_LPB0_MIWT4_4_PLR1_SU32_SUM0_SUS256_SKXCCM4_VWA4_VWB4_WGM4_WGMXCC1_WGMXCCGn1
    SolutionIndex: 67
    SolutionNameMin: Cijk_Alik_Bjlk_HSS_BH_UserArgs_MT64x128x64_MI16x16x1_SN_LDSB1_CLR1_GSU0_GSUC0_GSUWGMRR0_K1_LBSPPA128_LBSPPB2048_LPB0_MIWT2_4_PLR1_SU32_SUM0_SUS256_SKXCCM4_VWA1_VWB4_WGM1_WGMXCC1_WGMXCCGn1
    SolutionIndex: 68
    SolutionNameMin: Cijk_Alik_Bjlk_HSS_BH_UserArgs_MT128x64x64_MI16x16x1_SN_LDSB1_CLR1_GSU0_GSUC0_GSUWGMRR0_K1_LBSPPA128_LBSPPB1024_LPB32_MIWT4_2_PLR1_SU32_SUM0_SUS256_SKXCCM4_VWA1_VWB2_WGM1_WGMXCC1_WGMXCCGn1
    SolutionIndex: 69
    SolutionNameMin: Cijk_Alik_Bjlk_HSS_BH_UserArgs_MT128x64x64_MI16x16x1_SN_LDSB1_CLR1_GSU0_GSUC0_GSUWGMRR0_K1_LBSPPA512_LBSPPB1024_LPB32_MIWT4_2_PLR1_SU32_SUM0_SUS256_SKXCCM4_VWA4_VWB2_WGM1_WGMXCC1_WGMXCCGn1
    SolutionIndex: 70
    SolutionNameMin: Cijk_Alik_Bjlk_HSS_BH_UserArgs_MT64x64x64_MI16x16x1_SN_LDSB1_CLR1_GSU0_GSUC0_GSUWGMRR0_K1_LBSPPA128_LBSPPB1024_LPB32_MIWT2_2_PLR1_SU32_SUM0_SUS256_SKXCCM4_VWA1_VWB2_WGM1_WGMXCC1_WGMXCCGn1
    SolutionIndex: 71
    SolutionNameMin: Cijk_Alik_Bjlk_HSS_BH_UserArgs_MT32x64x64_MI16x16x1_SN_LDSB0_CLR1_GSU0_GSUC0_GSUWGMRR0_K1_LBSPPA128_LBSPPB1024_LPB32_MIWT1_2_PLR1_SU32_SUM0_SUS256_SKXCCM4_VWA1_VWB2_WGM1_WGMXCC1_WGMXCCGn1
    SolutionIndex: 72
    SolutionNameMin: Cijk_Alik_Bjlk_HSS_BH_UserArgs_MT64x32x64_MI16x16x1_SN_LDSB0_CLR1_GSU0_GSUC0_GSUWGMRR0_K1_LBSPPA128_LBSPPB512_LPB16_MIWT2_1_PLR1_SU32_SUM0_SUS256_SKXCCM4_VWA1_VWB1_WGM1_WGMXCC1_WGMXCCGn1
    SolutionIndex: 73
    SolutionNameMin: Cijk_Alik_Bjlk_HSS_BH_UserArgs_MT32x32x64_MI16x16x1_SN_LDSB0_CLR1_GSU0_GSUC0_GSUWGMRR0_K1_LBSPPA128_LBSPPB512_LPB16_MIWT1_1_PLR1_SU32_SUM0_SUS256_SKXCCM4_VWA1_VWB1_WGM1_WGMXCC1_WGMXCCGn1
    SolutionIndex: 74
    SolutionNameMin: Cijk_Alik_Bjlk_HSS_BH_UserArgs_MT128x64x128_MI16x16x1_SN_LDSB1_CLR1_GSU0_GSUC0_GSUWGMRR0_K1_LBSPPA1024_LBSPPB1024_LPB32_MIWT4_2_PLR2_SU32_SUM0_SUS256_SKXCCM4_VWA4_VWB2_WGM1_WGMXCC1_WGMXCCGn1
    SolutionIndex: 75
    SolutionNameMin: Cijk_Alik_Bjlk_HSS_BH_UserArgs_MT128x64x128_MI16x16x1_SN_LDSB1_CLR1_GSU0_GSUC0_GSUWGMRR0_K1_LBSPPA256_LBSPPB1024_LPB32_MIWT4_2_PLR2_SU32_SUM0_SUS256_SKXCCM4_VWA1_VWB2_WGM4_WGMXCC1_WGMXCCGn1
    SolutionIndex: 76
    SolutionNameMin: Cijk_Alik_Bjlk_HSS_BH_UserArgs_MT128x64x128_MI16x16x1_SN_LDSB1_CLR1_GSU0_GSUC0_GSUWGMRR0_K1_LBSPPA1024_LBSPPB1024_LPB32_MIWT4_2_PLR2_SU32_SUM0_SUS256_SKXCCM4_VWA4_VWB2_WGM4_WGMXCC1_WGMXCCGn1
    SolutionIndex: 77
    SolutionNameMin: Cijk_Alik_Bjlk_HSS_BH_UserArgs_MT64x64x128_MI16x16x1_SN_LDSB1_CLR1_GSU0_GSUC0_GSUWGMRR0_K1_LBSPPA256_LBSPPB1024_LPB32_MIWT2_2_PLR2_SU32_SUM0_SUS256_SKXCCM4_VWA1_VWB2_WGM1_WGMXCC1_WGMXCCGn1
    SolutionIndex: 78
    SolutionNameMin: Cijk_Alik_Bjlk_HSS_BH_UserArgs_MT64x64x128_MI16x16x1_SN_LDSB1_CLR1_GSU0_GSUC0_GSUWGMRR0_K1_LBSPPA512_LBSPPB1024_LPB32_MIWT2_2_PLR2_SU32_SUM0_SUS256_SKXCCM4_VWA2_VWB2_WGM1_WGMXCC1_WGMXCCGn1
    SolutionIndex: 79
    SolutionNameMin: Cijk_Alik_Bjlk_HSS_BH_UserArgs_MT64x64x128_MI16x16x1_SN_LDSB1_CLR1_GSU0_GSUC0_GSUWGMRR0_K1_LBSPPA256_LBSPPB1024_LPB32_MIWT2_2_PLR2_SU32_SUM0_SUS256_SKXCCM4_VWA1_VWB2_WGM2_WGMXCC1_WGMXCCGn1
    SolutionIndex: 80
    SolutionNameMin: Cijk_Alik_Bjlk_HSS_BH_UserArgs_MT64x64x128_MI16x16x1_SN_LDSB1_CLR1_GSU0_GSUC0_GSUWGMRR0_K1_LBSPPA256_LBSPPB1024_LPB32_MIWT2_2_PLR2_SU32_SUM0_SUS256_SKXCCM4_VWA1_VWB2_WGM4_WGMXCC1_WGMXCCGn1
    SolutionIndex: 81
    SolutionNameMin: Cijk_Alik_Bjlk_HSS_BH_UserArgs_MT32x64x128_MI16x16x1_SN_LDSB1_CLR1_GSU0_GSUC0_GSUWGMRR0_K1_LBSPPA256_LBSPPB1024_LPB32_MIWT1_2_PLR2_SU32_SUM0_SUS256_SKXCCM4_VWA1_VWB2_WGM1_WGMXCC1_WGMXCCGn1
    SolutionIndex: 82
    SolutionNameMin: Cijk_Alik_Bjlk_HSS_BH_UserArgs_MT64x32x128_MI16x16x1_SN_LDSB1_CLR1_GSU0_GSUC0_GSUWGMRR0_K1_LBSPPA256_LBSPPB512_LPB16_MIWT2_1_PLR2_SU32_SUM0_SUS256_SKXCCM4_VWA1_VWB1_WGM1_WGMXCC1_WGMXCCGn1
    SolutionIndex: 83
    SolutionNameMin: Cijk_Alik_Bjlk_HSS_BH_UserArgs_MT32x32x128_MI16x16x1_SN_LDSB1_CLR1_GSU0_GSUC0_GSUWGMRR0_K1_LBSPPA256_LBSPPB512_LPB16_MIWT1_1_PLR1_SU32_SUM0_SUS256_SKXCCM4_VWA1_VWB1_WGM1_WGMXCC1_WGMXCCGn1
    SolutionIndex: 84
    SolutionNameMin: Cijk_Alik_Bjlk_HSS_BH_UserArgs_MT32x32x128_MI16x16x1_SN_LDSB1_CLR1_GSU0_GSUC0_GSUWGMRR0_K1_LBSPPA256_LBSPPB512_LPB16_MIWT1_1_PLR2_SU32_SUM0_SUS256_SKXCCM4_VWA1_VWB1_WGM1_WGMXCC1_WGMXCCGn1
    SolutionIndex: 85
    SolutionNameMin: Cijk_Alik_Bjlk_HSS_BH_UserArgs_MT32x32x32_MI16x16x1_SN_LDSB0_CLR1_GSU0_GSUC0_GSUWGMRR0_K1_LBSPPA128_LBSPPB256_LPB16_MIWT1_1_PLR1_SU32_SUM0_SUS256_SKXCCM0_VWA1_VWB1_WGM2_WGMXCC1_WGMXCCGn1
- - - [128, 128, 1, 128, 128, 128, 128, 128]
    - [73, 0.088]
  - - [128, 128, 1, 256, 128, 128, 256, 128]
    - [73, 0.159]
  - - [128, 128, 1, 512, 128, 128, 512, 128]
    - [73, 0.265]
  - - [128, 128, 1, 1024, 128, 128, 1024, 128]
    - [84, 0.394]
  - - [128, 128, 1, 2048, 128, 128, 2048, 128]
    - [8, 0.592]
  - - [128, 128, 1, 4096, 128, 128, 4096, 128]
    - [19, 1.043]
  - - [128, 128, 1, 8192, 128, 128, 8192, 128]
    - [31, 1.593]
  - - [128, 256, 1, 128, 128, 128, 128, 256]
    - [19, 0.174]
  - - [128, 256, 1, 256, 128, 128, 256, 256]
    - [73, 0.313]
  - - [128, 256, 1, 512, 128, 128, 512, 256]
    - [31, 0.518]
  - - [128, 256, 1, 1024, 128, 128, 1024, 256]
    - [31, 0.784]
  - - [128, 256, 1, 2048, 128, 128, 2048, 256]
    - [31, 1.186]
  - - [128, 256, 1, 4096, 128, 128, 4096, 256]
    - [71, 1.765]
  - - [128, 256, 1, 8192, 128, 128, 8192, 256]
    - [81, 2.663]
  - - [128, 512, 1, 128, 128, 128, 128, 512]
    - [73, 0.342]
  - - [128, 512, 1, 256, 128, 128, 256, 512]
    - [19, 0.612]
  - - [128, 512, 1, 512, 128, 128, 512, 512]
    - [30, 1.028]
  - - [128, 512, 1, 1024, 128, 128, 1024, 512]
    - [84, 1.538]
  - - [128, 512, 1, 2048, 128, 128, 2048, 512]
    - [81, 2.072]
  - - [128, 512, 1, 4096, 128, 128, 4096, 512]
    - [28, 2.976]
  - - [128, 512, 1, 8192, 128, 128, 8192, 512]
    - [77, 4.474]
  - - [128, 1024, 1, 128, 128, 128, 128, 1024]
    - [18, 0.635]
  - - [128, 1024, 1, 256, 128, 128, 256, 1024]
    - [28, 1.106]
  - - [128, 1024, 1, 512, 128, 128, 512, 1024]
    - [81, 1.848]
  - - [128, 1024, 1, 1024, 128, 128, 1024, 1024]
    - [28, 2.765]
  - - [128, 1024, 1, 2048, 128, 128, 2048, 1024]
    - [29, 3.58]
  - - [128, 1024, 1, 4096, 128, 128, 4096, 1024]
    - [27, 4.91]
  - - [128, 1024, 1, 8192, 128, 128, 8192, 1024]
    - [22, 6.925]
  - - [128, 2048, 1, 128, 128, 128, 128, 2048]
    - [70, 1.115]
  - - [128, 2048, 1, 256, 128, 128, 256, 2048]
    - [70, 1.934]
  - - [128, 2048, 1, 512, 128, 128, 512, 2048]
    - [77, 3.09]
  - - [128, 2048, 1, 1024, 128, 128, 1024, 2048]
    - [78, 4.556]
  - - [128, 2048, 1, 2048, 128, 128, 2048, 2048]
    - [77, 5.674]
  - - [128, 2048, 1, 4096, 128, 128, 4096, 2048]
    - [74, 7.369]
  - - [128, 2048, 1, 8192, 128, 128, 8192, 2048]
    - [63, 9.91]
  - - [128, 4096, 1, 128, 128, 128, 128, 4096]
    - [68, 1.836]
  - - [128, 4096, 1, 256, 128, 128, 256, 4096]
    - [69, 3.113]
  - - [128, 4096, 1, 512, 128, 128, 512, 4096]
    - [74, 4.876]
  - - [128, 4096, 1, 1024, 128, 128, 1024, 4096]
    - [74, 6.991]
  - - [128, 4096, 1, 2048, 128, 128, 2048, 4096]
    - [74, 8.708]
  - - [128, 4096, 1, 4096, 128, 128, 4096, 4096]
    - [63, 10.783]
  - - [128, 4096, 1, 8192, 128, 128, 8192, 4096]
    - [17, 13.422]
  - - [128, 8192, 1, 128, 128, 128, 128, 8192]
    - [55, 2.744]
  - - [128, 8192, 1, 256, 128, 128, 256, 8192]
    - [63, 4.597]
  - - [128, 8192, 1, 512, 128, 128, 512, 8192]
    - [62, 7.032]
  - - [128, 8192, 1, 1024, 128, 128, 1024, 8192]
    - [63, 9.658]
  - - [128, 8192, 1, 2048, 128, 128, 2048, 8192]
    - [15, 11.164]
  - - [128, 8192, 1, 4096, 128, 128, 4096, 8192]
    - [63, 13.807]
  - - [128, 8192, 1, 8192, 128, 128, 8192, 8192]
    - [15, 15.168]
  - - [256, 128, 1, 128, 256, 256, 128, 128]
    - [73, 0.175]
  - - [256, 128, 1, 256, 256, 256, 256, 128]
    - [73, 0.313]
  - - [256, 128, 1, 512, 256, 256, 512, 128]
    - [83, 0.522]
  - - [256, 128, 1, 1024, 256, 256, 1024, 128]
    - [30, 0.785]
  - - [256, 128, 1, 2048, 256, 256, 2048, 128]
    - [31, 1.192]
  - - [256, 128, 1, 4096, 256, 256, 4096, 128]
    - [72, 1.772]
  - - [256, 128, 1, 8192, 256, 256, 8192, 128]
    - [81, 2.755]
  - - [256, 256, 1, 128, 256, 256, 128, 256]
    - [19, 0.341]
  - - [256, 256, 1, 256, 256, 256, 256, 256]
    - [73, 0.618]
  - - [256, 256, 1, 512, 256, 256, 512, 256]
    - [83, 1.025]
  - - [256, 256, 1, 1024, 256, 256, 1024, 256]
    - [84, 1.546]
  - - [256, 256, 1, 2048, 256, 256, 2048, 256]
    - [31, 2.077]
  - - [256, 256, 1, 4096, 256, 256, 4096, 256]
    - [28, 2.979]
  - - [256, 256, 1, 8192, 256, 256, 8192, 256]
    - [77, 4.548]
  - - [256, 512, 1, 128, 256, 256, 128, 512]
    - [18, 0.624]
  - - [256, 512, 1, 256, 256, 256, 256, 512]
    - [81, 1.112]
  - - [256, 512, 1, 512, 256, 256, 512, 512]
    - [81, 1.849]
  - - [256, 512, 1, 1024, 256, 256, 1024, 512]
    - [81, 2.74]
  - - [256, 512, 1, 2048, 256, 256, 2048, 512]
    - [81, 3.613]
  - - [256, 512, 1, 4096, 256, 256, 4096, 512]
    - [25, 4.945]
  - - [256, 512, 1, 8192, 256, 256, 8192, 512]
    - [22, 7.158]
  - - [256, 1024, 1, 128, 256, 256, 128, 1024]
    - [70, 1.121]
  - - [256, 1024, 1, 256, 256, 256, 256, 1024]
    - [70, 1.945]
  - - [256, 1024, 1, 512, 256, 256, 512, 1024]
    - [77, 3.16]
  - - [256, 1024, 1, 1024, 256, 256, 1024, 1024]
    - [77, 4.614]
  - - [256, 1024, 1, 2048, 256, 256, 2048, 1024]
    - [26, 5.726]
  - - [256, 1024, 1, 4096, 256, 256, 4096, 1024]
    - [23, 7.643]
  - - [256, 1024, 1, 8192, 256, 256, 8192, 1024]
    - [66, 9.806]
  - - [256, 2048, 1, 128, 256, 256, 128, 2048]
    - [67, 1.8]
  - - [256, 2048, 1, 256, 256, 256, 256, 2048]
    - [67, 3.063]
  - - [256, 2048, 1, 512, 256, 256, 512, 2048]
    - [76, 4.78]
  - - [256, 2048, 1, 1024, 256, 256, 1024, 2048]
    - [74, 6.929]
  - - [256, 2048, 1, 2048, 256, 256, 2048, 2048]
    - [74, 8.636]
  - - [256, 2048, 1, 4096, 256, 256, 4096, 2048]
    - [63, 10.515]
  - - [256, 2048, 1, 8192, 256, 256, 8192, 2048]
    - [64, 13.271]
  - - [256, 4096, 1, 128, 256, 256, 128, 4096]
    - [55, 2.752]
  - - [256, 4096, 1, 256, 256, 256, 256, 4096]
    - [63, 4.633]
  - - [256, 4096, 1, 512, 256, 256, 512, 4096]
    - [63, 7.164]
  - - [256, 4096, 1, 1024, 256, 256, 1024, 4096]
    - [62, 9.525]
  - - [256, 4096, 1, 2048, 256, 256, 2048, 4096]
    - [66, 11.11]
  - - [256, 4096, 1, 4096, 256, 256, 4096, 4096]
    - [66, 13.608]
  - - [256, 4096, 1, 8192, 256, 256, 8192, 4096]
    - [15, 15.128]
  - - [256, 8192, 1, 128, 256, 256, 128, 8192]
    - [50, 3.635]
  - - [256, 8192, 1, 256, 256, 256, 256, 8192]
    - [50, 5.904]
  - - [256, 8192, 1, 512, 256, 256, 512, 8192]
    - [5, 8.584]
  - - [256, 8192, 1, 1024, 256, 256, 1024, 8192]
    - [11, 10.827]
  - - [256, 8192, 1, 2048, 256, 256, 2048, 8192]
    - [15, 13.141]
  - - [256, 8192, 1, 4096, 256, 256, 4096, 8192]
    - [60, 15.3]
  - - [256, 8192, 1, 8192, 256, 256, 8192, 8192]
    - [42, 16.674]
  - - [512, 128, 1, 128, 512, 512, 128, 128]
    - [73, 0.348]
  - - [512, 128, 1, 256, 512, 512, 256, 128]
    - [73, 0.624]
  - - [512, 128, 1, 512, 512, 512, 512, 128]
    - [73, 1.035]
  - - [512, 128, 1, 1024, 512, 512, 1024, 128]
    - [31, 1.547]
  - - [512, 128, 1, 2048, 512, 512, 2048, 128]
    - [28, 2.072]
  - - [512, 128, 1, 4096, 512, 512, 4096, 128]
    - [28, 2.968]
  - - [512, 128, 1, 8192, 512, 512, 8192, 128]
    - [80, 4.45]
  - - [512, 256, 1, 128, 512, 512, 128, 256]
    - [72, 0.636]
  - - [512, 256, 1, 256, 512, 512, 256, 256]
    - [18, 1.122]
  - - [512, 256, 1, 512, 512, 512, 512, 256]
    - [81, 1.861]
  - - [512, 256, 1, 1024, 512, 512, 1024, 256]
    - [81, 2.741]
  - - [512, 256, 1, 2048, 512, 512, 2048, 256]
    - [81, 3.615]
  - - [512, 256, 1, 4096, 512, 512, 4096, 256]
    - [25, 4.958]
  - - [512, 256, 1, 8192, 512, 512, 8192, 256]
    - [22, 7.17]
  - - [512, 512, 1, 128, 512, 512, 128, 512]
    - [70, 1.131]
  - - [512, 512, 1, 256, 512, 512, 256, 512]
    - [70, 1.933]
  - - [512, 512, 1, 512, 512, 512, 512, 512]
    - [25, 3.094]
  - - [512, 512, 1, 1024, 512, 512, 1024, 512]
    - [77, 4.608]
  - - [512, 512, 1, 2048, 512, 512, 2048, 512]
    - [27, 5.905]
  - - [512, 512, 1, 4096, 512, 512, 4096, 512]
    - [23, 7.704]
  - - [512, 512, 1, 8192, 512, 512, 8192, 512]
    - [63, 9.741]
  - - [512, 1024, 1, 128, 512, 512, 128, 1024]
    - [69, 1.838]
  - - [512, 1024, 1, 256, 512, 512, 256, 1024]
    - [69, 3.136]
  - - [512, 1024, 1, 512, 512, 512, 512, 1024]
    - [74, 4.89]
  - - [512, 1024, 1, 1024, 512, 512, 1024, 1024]
    - [74, 7.023]
  - - [512, 1024, 1, 2048, 512, 512, 2048, 1024]
    - [24, 8.646]
  - - [512, 1024, 1, 4096, 512, 512, 4096, 1024]
    - [15, 10.413]
  - - [512, 1024, 1, 8192, 512, 512, 8192, 1024]
    - [66, 13.221]
  - - [512, 2048, 1, 128, 512, 512, 128, 2048]
    - [57, 2.71]
  - - [512, 2048, 1, 256, 512, 512, 256, 2048]
    - [62, 4.595]
  - - [512, 2048, 1, 512, 512, 512, 512, 2048]
    - [63, 7.171]
  - - [512, 2048, 1, 1024, 512, 512, 1024, 2048]
    - [66, 9.538]
  - - [512, 2048, 1, 2048, 512, 512, 2048, 2048]
    - [66, 10.911]
  - - [512, 2048, 1, 4096, 512, 512, 4096, 2048]
    - [64, 13.479]
  - - [512, 2048, 1, 8192, 512, 512, 8192, 2048]
    - [17, 14.991]
  - - [512, 4096, 1, 128, 512, 512, 128, 4096]
    - [52, 3.732]
  - - [512, 4096, 1, 256, 512, 512, 256, 4096]
    - [5, 5.901]
  - - [512, 4096, 1, 512, 512, 512, 512, 4096]
    - [5, 8.593]
  - - [512, 4096, 1, 1024, 512, 512, 1024, 4096]
    - [11, 11.025]
  - - [512, 4096, 1, 2048, 512, 512, 2048, 4096]
    - [49, 12.8]
  - - [512, 4096, 1, 4096, 512, 512, 4096, 4096]
    - [61, 15.047]
  - - [512, 4096, 1, 8192, 512, 512, 8192, 4096]
    - [42, 16.581]
  - - [512, 8192, 1, 128, 512, 512, 128, 8192]
    - [3, 4.153]
  - - [512, 8192, 1, 256, 512, 512, 256, 8192]
    - [3, 6.701]
  - - [512, 8192, 1, 512, 512, 512, 512, 8192]
    - [34, 9.704]
  - - [512, 8192, 1, 1024, 512, 512, 1024, 8192]
    - [44, 12.148]
  - - [512, 8192, 1, 2048, 512, 512, 2048, 8192]
    - [41, 14.378]
  - - [512, 8192, 1, 4096, 512, 512, 4096, 8192]
    - [38, 16.516]
  - - [512, 8192, 1, 8192, 512, 512, 8192, 8192]
    - [41, 18.402]
  - - [1024, 128, 1, 128, 1024, 1024, 128, 128]
    - [72, 0.633]
  - - [1024, 128, 1, 256, 1024, 1024, 256, 128]
    - [18, 1.123]
  - - [1024, 128, 1, 512, 1024, 1024, 512, 128]
    - [82, 1.825]
  - - [1024, 128, 1, 1024, 1024, 1024, 1024, 128]
    - [28, 2.741]
  - - [1024, 128, 1, 2048, 1024, 1024, 2048, 128]
    - [81, 3.61]
  - - [1024, 128, 1, 4096, 1024, 1024, 4096, 128]
    - [25, 4.968]
  - - [1024, 128, 1, 8192, 1024, 1024, 8192, 128]
    - [22, 7.089]
  - - [1024, 256, 1, 128, 1024, 1024, 128, 256]
    - [70, 1.124]
  - - [1024, 256, 1, 256, 1024, 1024, 256, 256]
    - [70, 1.955]
  - - [1024, 256, 1, 512, 1024, 1024, 512, 256]
    - [77, 3.15]
  - - [1024, 256, 1, 1024, 1024, 1024, 1024, 256]
    - [77, 4.597]
  - - [1024, 256, 1, 2048, 1024, 1024, 2048, 256]
    - [25, 5.918]
  - - [1024, 256, 1, 4096, 1024, 1024, 4096, 256]
    - [20, 7.393]
  - - [1024, 256, 1, 8192, 1024, 1024, 8192, 256]
    - [63, 9.813]
  - - [1024, 512, 1, 128, 1024, 1024, 128, 512]
    - [69, 1.859]
  - - [1024, 512, 1, 256, 1024, 1024, 256, 512]
    - [69, 3.156]
  - - [1024, 512, 1, 512, 1024, 1024, 512, 512]
    - [74, 4.87]
  - - [1024, 512, 1, 1024, 1024, 1024, 1024, 512]
    - [74, 7.021]
  - - [1024, 512, 1, 2048, 1024, 1024, 2048, 512]
    - [21, 8.594]
  - - [1024, 512, 1, 4096, 1024, 1024, 4096, 512]
    - [64, 10.334]
  - - [1024, 512, 1, 8192, 1024, 1024, 8192, 512]
    - [16, 13.05]
  - - [1024, 1024, 1, 128, 1024, 1024, 128, 1024]
    - [55, 2.766]
  - - [1024, 1024, 1, 256, 1024, 1024, 256, 1024]
    - [63, 4.675]
  - - [1024, 1024, 1, 512, 1024, 1024, 512, 1024]
    - [63, 7.195]
  - - [1024, 1024, 1, 1024, 1024, 1024, 1024, 1024]
    - [64, 9.589]
  - - [1024, 1024, 1, 2048, 1024, 1024, 2048, 1024]
    - [66, 10.898]
  - - [1024, 1024, 1, 4096, 1024, 1024, 4096, 1024]
    - [66, 13.386]
  - - [1024, 1024, 1, 8192, 1024, 1024, 8192, 1024]
    - [16, 15.13]
  - - [1024, 2048, 1, 128, 1024, 1024, 128, 2048]
    - [52, 3.679]
  - - [1024, 2048, 1, 256, 1024, 1024, 256, 2048]
    - [6, 5.878]
  - - [1024, 2048, 1, 512, 1024, 1024, 512, 2048]
    - [47, 8.582]
  - - [1024, 2048, 1, 1024, 1024, 1024, 1024, 2048]
    - [13, 10.957]
  - - [1024, 2048, 1, 2048, 1024, 1024, 2048, 2048]
    - [49, 12.733]
  - - [1024, 2048, 1, 4096, 1024, 1024, 4096, 2048]
    - [44, 14.963]
  - - [1024, 2048, 1, 8192, 1024, 1024, 8192, 2048]
    - [35, 16.673]
  - - [1024, 4096, 1, 128, 1024, 1024, 128, 4096]
    - [2, 4.25]
  - - [1024, 4096, 1, 256, 1024, 1024, 256, 4096]
    - [2, 6.792]
  - - [1024, 4096, 1, 512, 1024, 1024, 512, 4096]
    - [42, 9.765]
  - - [1024, 4096, 1, 1024, 1024, 1024, 1024, 4096]
    - [49, 12.09]
  - - [1024, 4096, 1, 2048, 1024, 1024, 2048, 4096]
    - [44, 14.306]
  - - [1024, 4096, 1, 4096, 1024, 1024, 4096, 4096]
    - [39, 16.522]
  - - [1024, 4096, 1, 8192, 1024, 1024, 8192, 4096]
    - [39, 18.56]
  - - [1024, 8192, 1, 128, 1024, 1024, 128, 8192]
    - [51, 4.33]
  - - [1024, 8192, 1, 256, 1024, 1024, 256, 8192]
    - [44, 7.141]
  - - [1024, 8192, 1, 512, 1024, 1024, 512, 8192]
    - [38, 10.399]
  - - [1024, 8192, 1, 1024, 1024, 1024, 1024, 8192]
    - [41, 13.56]
  - - [1024, 8192, 1, 2048, 1024, 1024, 2048, 8192]
    - [33, 15.77]
  - - [1024, 8192, 1, 4096, 1024, 1024, 4096, 8192]
    - [39, 17.861]
  - - [1024, 8192, 1, 8192, 1024, 1024, 8192, 8192]
    - [33, 19.758]
  - - [2048, 128, 1, 128, 2048, 2048, 128, 128]
    - [70, 1.116]
  - - [2048, 128, 1, 256, 2048, 2048, 256, 128]
    - [70, 1.946]
  - - [2048, 128, 1, 512, 2048, 2048, 512, 128]
    - [77, 3.151]
  - - [2048, 128, 1, 1024, 2048, 2048, 1024, 128]
    - [78, 4.583]
  - - [2048, 128, 1, 2048, 2048, 2048, 2048, 128]
    - [79, 5.862]
  - - [2048, 128, 1, 4096, 2048, 2048, 4096, 128]
    - [63, 7.337]
  - - [2048, 128, 1, 8192, 2048, 2048, 8192, 128]
    - [63, 9.829]
  - - [2048, 256, 1, 128, 2048, 2048, 128, 256]
    - [69, 1.847]
  - - [2048, 256, 1, 256, 2048, 2048, 256, 256]
    - [69, 3.133]
  - - [2048, 256, 1, 512, 2048, 2048, 512, 256]
    - [74, 4.88]
  - - [2048, 256, 1, 1024, 2048, 2048, 1024, 256]
    - [76, 6.927]
  - - [2048, 256, 1, 2048, 2048, 2048, 2048, 256]
    - [75, 8.821]
  - - [2048, 256, 1, 4096, 2048, 2048, 4096, 256]
    - [63, 10.39]
  - - [2048, 256, 1, 8192, 2048, 2048, 8192, 256]
    - [66, 13.145]
  - - [2048, 512, 1, 128, 2048, 2048, 128, 512]
    - [55, 2.775]
  - - [2048, 512, 1, 256, 2048, 2048, 256, 512]
    - [63, 4.643]
  - - [2048, 512, 1, 512, 2048, 2048, 512, 512]
    - [65, 7.124]
  - - [2048, 512, 1, 1024, 2048, 2048, 1024, 512]
    - [66, 9.75]
  - - [2048, 512, 1, 2048, 2048, 2048, 2048, 512]
    - [66, 10.831]
  - - [2048, 512, 1, 4096, 2048, 2048, 4096, 512]
    - [64, 13.354]
  - - [2048, 512, 1, 8192, 2048, 2048, 8192, 512]
    - [64, 15.076]
  - - [2048, 1024, 1, 128, 2048, 2048, 128, 1024]
    - [43, 3.653]
  - - [2048, 1024, 1, 256, 2048, 2048, 256, 1024]
    - [6, 5.824]
  - - [2048, 1024, 1, 512, 2048, 2048, 512, 1024]
    - [46, 8.622]
  - - [2048, 1024, 1, 1024, 2048, 2048, 1024, 1024]
    - [13, 10.979]
  - - [2048, 1024, 1, 2048, 2048, 2048, 2048, 1024]
    - [49, 12.792]
  - - [2048, 1024, 1, 4096, 2048, 2048, 4096, 1024]
    - [49, 14.853]
  - - [2048, 1024, 1, 8192, 2048, 2048, 8192, 1024]
    - [39, 16.487]
  - - [2048, 2048, 1, 128, 2048, 2048, 128, 2048]
    - [35, 4.26]
  - - [2048, 2048, 1, 256, 2048, 2048, 256, 2048]
    - [41, 6.763]
  - - [2048, 2048, 1, 512, 2048, 2048, 512, 2048]
    - [37, 9.867]
  - - [2048, 2048, 1, 1024, 2048, 2048, 1024, 2048]
    - [49, 12.004]
  - - [2048, 2048, 1, 2048, 2048, 2048, 2048, 2048]
    - [49, 14.166]
  - - [2048, 2048, 1, 4096, 2048, 2048, 4096, 2048]
    - [1, 16.51]
  - - [2048, 2048, 1, 8192, 2048, 2048, 8192, 2048]
    - [35, 18.501]
  - - [2048, 4096, 1, 128, 2048, 2048, 128, 4096]
    - [52, 4.322]
  - - [2048, 4096, 1, 256, 2048, 2048, 256, 4096]
    - [44, 7.2]
  - - [2048, 4096, 1, 512, 2048, 2048, 512, 4096]
    - [35, 10.307]
  - - [2048, 4096, 1, 1024, 2048, 2048, 1024, 4096]
    - [35, 13.525]
  - - [2048, 4096, 1, 2048, 2048, 2048, 2048, 4096]
    - [35, 15.655]
  - - [2048, 4096, 1, 4096, 2048, 2048, 4096, 4096]
    - [39, 18.0]
  - - [2048, 4096, 1, 8192, 2048, 2048, 8192, 4096]
    - [39, 19.781]
  - - [2048, 8192, 1, 128, 2048, 2048, 128, 8192]
    - [44, 5.234]
  - - [2048, 8192, 1, 256, 2048, 2048, 256, 8192]
    - [35, 7.947]
  - - [2048, 8192, 1, 512, 2048, 2048, 512, 8192]
    - [42, 11.279]
  - - [2048, 8192, 1, 1024, 2048, 2048, 1024, 8192]
    - [38, 14.136]
  - - [2048, 8192, 1, 2048, 2048, 2048, 2048, 8192]
    - [3, 16.847]
  - - [2048, 8192, 1, 4096, 2048, 2048, 4096, 8192]
    - [1, 18.986]
  - - [2048, 8192, 1, 8192, 2048, 2048, 8192, 8192]
    - [1, 19.984]
  - - [4096, 128, 1, 128, 4096, 4096, 128, 128]
    - [7, 1.769]
  - - [4096, 128, 1, 256, 4096, 4096, 256, 128]
    - [69, 2.982]
  - - [4096, 128, 1, 512, 4096, 4096, 512, 128]
    - [74, 4.691]
  - - [4096, 128, 1, 1024, 4096, 4096, 1024, 128]
    - [21, 6.632]
  - - [4096, 128, 1, 2048, 4096, 4096, 2048, 128]
    - [21, 8.05]
  - - [4096, 128, 1, 4096, 4096, 4096, 4096, 128]
    - [15, 10.261]
  - - [4096, 128, 1, 8192, 4096, 4096, 8192, 128]
    - [16, 13.102]
  - - [4096, 256, 1, 128, 4096, 4096, 128, 256]
    - [56, 2.723]
  - - [4096, 256, 1, 256, 4096, 4096, 256, 256]
    - [66, 4.555]
  - - [4096, 256, 1, 512, 4096, 4096, 512, 256]
    - [66, 7.047]
  - - [4096, 256, 1, 1024, 4096, 4096, 1024, 256]
    - [65, 9.42]
  - - [4096, 256, 1, 2048, 4096, 4096, 2048, 256]
    - [66, 10.665]
  - - [4096, 256, 1, 4096, 4096, 4096, 4096, 256]
    - [64, 13.41]
  - - [4096, 256, 1, 8192, 4096, 4096, 8192, 256]
    - [17, 15.087]
  - - [4096, 512, 1, 128, 4096, 4096, 128, 512]
    - [50, 3.642]
  - - [4096, 512, 1, 256, 4096, 4096, 256, 512]
    - [48, 5.855]
  - - [4096, 512, 1, 512, 4096, 4096, 512, 512]
    - [50, 8.551]
  - - [4096, 512, 1, 1024, 4096, 4096, 1024, 512]
    - [9, 10.892]
  - - [4096, 512, 1, 2048, 4096, 4096, 2048, 512]
    - [47, 12.651]
  - - [4096, 512, 1, 4096, 4096, 4096, 4096, 512]
    - [59, 14.783]
  - - [4096, 512, 1, 8192, 4096, 4096, 8192, 512]
    - [39, 16.566]
  - - [4096, 1024, 1, 128, 4096, 4096, 128, 1024]
    - [0, 4.254]
  - - [4096, 1024, 1, 256, 4096, 4096, 256, 1024]
    - [0, 6.751]
  - - [4096, 1024, 1, 512, 4096, 4096, 512, 1024]
    - [0, 9.75]
  - - [4096, 1024, 1, 1024, 4096, 4096, 1024, 1024]
    - [5, 12.02]
  - - [4096, 1024, 1, 2048, 4096, 4096, 2048, 1024]
    - [49, 14.106]
  - - [4096, 1024, 1, 4096, 4096, 4096, 4096, 1024]
    - [1, 16.366]
  - - [4096, 1024, 1, 8192, 4096, 4096, 8192, 1024]
    - [4, 18.656]
  - - [4096, 2048, 1, 128, 4096, 4096, 128, 2048]
    - [54, 4.354]
  - - [4096, 2048, 1, 256, 4096, 4096, 256, 2048]
    - [45, 6.962]
  - - [4096, 2048, 1, 512, 4096, 4096, 512, 2048]
    - [0, 10.268]
  - - [4096, 2048, 1, 1024, 4096, 4096, 1024, 2048]
    - [33, 13.134]
  - - [4096, 2048, 1, 2048, 4096, 4096, 2048, 2048]
    - [35, 15.781]
  - - [4096, 2048, 1, 4096, 4096, 4096, 4096, 2048]
    - [33, 17.906]
  - - [4096, 2048, 1, 8192, 4096, 4096, 8192, 2048]
    - [35, 19.792]
  - - [4096, 4096, 1, 128, 4096, 4096, 128, 4096]
    - [53, 5.149]
  - - [4096, 4096, 1, 256, 4096, 4096, 256, 4096]
    - [33, 7.817]
  - - [4096, 4096, 1, 512, 4096, 4096, 512, 4096]
    - [38, 10.939]
  - - [4096, 4096, 1, 1024, 4096, 4096, 1024, 4096]
    - [1, 13.943]
  - - [4096, 4096, 1, 2048, 4096, 4096, 2048, 4096]
    - [1, 16.802]
  - - [4096, 4096, 1, 4096, 4096, 4096, 4096, 4096]
    - [41, 19.066]
  - - [4096, 4096, 1, 8192, 4096, 4096, 8192, 4096]
    - [41, 20.117]
  - - [4096, 8192, 1, 128, 4096, 4096, 128, 8192]
    - [54, 5.162]
  - - [4096, 8192, 1, 256, 4096, 4096, 256, 8192]
    - [58, 7.726]
  - - [4096, 8192, 1, 512, 4096, 4096, 512, 8192]
    - [41, 10.668]
  - - [4096, 8192, 1, 1024, 4096, 4096, 1024, 8192]
    - [1, 14.164]
  - - [4096, 8192, 1, 2048, 4096, 4096, 2048, 8192]
    - [1, 17.117]
  - - [4096, 8192, 1, 4096, 4096, 4096, 4096, 8192]
    - [41, 19.126]
  - - [4096, 8192, 1, 8192, 4096, 4096, 8192, 8192]
    - [1, 20.361]
  - - [8192, 128, 1, 128, 8192, 8192, 128, 128]
    - [55, 2.726]
  - - [8192, 128, 1, 256, 8192, 8192, 256, 128]
    - [62, 4.568]
  - - [8192, 128, 1, 512, 8192, 8192, 512, 128]
    - [62, 6.964]
  - - [8192, 128, 1, 1024, 8192, 8192, 1024, 128]
    - [14, 8.908]
  - - [8192, 128, 1, 2048, 8192, 8192, 2048, 128]
    - [15, 10.417]
  - - [8192, 128, 1, 4096, 8192, 8192, 4096, 128]
    - [63, 13.474]
  - - [8192, 128, 1, 8192, 8192, 8192, 8192, 128]
    - [66, 14.977]
  - - [8192, 256, 1, 128, 8192, 8192, 128, 256]
    - [54, 3.658]
  - - [8192, 256, 1, 256, 8192, 8192, 256, 256]
    - [44, 5.816]
  - - [8192, 256, 1, 512, 8192, 8192, 512, 256]
    - [5, 8.247]
  - - [8192, 256, 1, 1024, 8192, 8192, 1024, 256]
    - [10, 10.604]
  - - [8192, 256, 1, 2048, 8192, 8192, 2048, 256]
    - [47, 12.485]
  - - [8192, 256, 1, 4096, 8192, 8192, 4096, 256]
    - [12, 14.905]
  - - [8192, 256, 1, 8192, 8192, 8192, 8192, 256]
    - [39, 16.579]
  - - [8192, 512, 1, 128, 8192, 8192, 128, 512]
    - [35, 4.166]
  - - [8192, 512, 1, 256, 8192, 8192, 256, 512]
    - [41, 6.57]
  - - [8192, 512, 1, 512, 8192, 8192, 512, 512]
    - [36, 9.849]
  - - [8192, 512, 1, 1024, 8192, 8192, 1024, 512]
    - [44, 12.018]
  - - [8192, 512, 1, 2048, 8192, 8192, 2048, 512]
    - [44, 14.397]
  - - [8192, 512, 1, 4096, 8192, 8192, 4096, 512]
    - [42, 16.426]
  - - [8192, 512, 1, 8192, 8192, 8192, 8192, 512]
    - [41, 18.415]
  - - [8192, 1024, 1, 128, 8192, 8192, 128, 1024]
    - [44, 4.371]
  - - [8192, 1024, 1, 256, 8192, 8192, 256, 1024]
    - [44, 7.113]
  - - [8192, 1024, 1, 512, 8192, 8192, 512, 1024]
    - [40, 10.13]
  - - [8192, 1024, 1, 1024, 8192, 8192, 1024, 1024]
    - [33, 13.126]
  - - [8192, 1024, 1, 2048, 8192, 8192, 2048, 1024]
    - [35, 15.452]
  - - [8192, 1024, 1, 4096, 8192, 8192, 4096, 1024]
    - [2, 17.909]
  - - [8192, 1024, 1, 8192, 8192, 8192, 8192, 1024]
    - [2, 19.634]
  - - [8192, 2048, 1, 128, 8192, 8192, 128, 2048]
    - [44, 5.118]
  - - [8192, 2048, 1, 256, 8192, 8192, 256, 2048]
    - [35, 7.901]
  - - [8192, 2048, 1, 512, 8192, 8192, 512, 2048]
    - [40, 10.974]
  - - [8192, 2048, 1, 1024, 8192, 8192, 1024, 2048]
    - [41, 14.154]
  - - [8192, 2048, 1, 2048, 8192, 8192, 2048, 2048]
    - [41, 16.764]
  - - [8192, 2048, 1, 4096, 8192, 8192, 4096, 2048]
    - [42, 19.012]
  - - [8192, 2048, 1, 8192, 8192, 8192, 8192, 2048]
    - [1, 19.918]
  - - [8192, 4096, 1, 128, 8192, 8192, 128, 4096]
    - [47, 5.216]
  - - [8192, 4096, 1, 256, 8192, 8192, 256, 4096]
    - [41, 7.607]
  - - [8192, 4096, 1, 512, 8192, 8192, 512, 4096]
    - [40, 10.645]
  - - [8192, 4096, 1, 1024, 8192, 8192, 1024, 4096]
    - [41, 14.072]
  - - [8192, 4096, 1, 2048, 8192, 8192, 2048, 4096]
    - [41, 16.997]
  - - [8192, 4096, 1, 4096, 8192, 8192, 4096, 4096]
    - [41, 19.22]
  - - [8192, 4096, 1, 8192, 8192, 8192, 8192, 4096]
    - [2, 20.252]
  - - [8192, 8192, 1, 128, 8192, 8192, 128, 8192]
    - [32, 4.895]
  - - [8192, 8192, 1, 256, 8192, 8192, 256, 8192]
    - [40, 7.706]
  - - [8192, 8192, 1, 512, 8192, 8192, 512, 8192]
    - [40, 11.381]
  - - [8192, 8192, 1, 1024, 8192, 8192, 1024, 8192]
    - [42, 14.954]
  - - [8192, 8192, 1, 2048, 8192, 8192, 2048, 8192]
    - [42, 17.569]
  - - [8192, 8192, 1, 4096, 8192, 8192, 4096, 8192]
    - [41, 19.511]
  - - [8192, 8192, 1, 8192, 8192, 8192, 8192, 8192]
    - [2, 20.425]
  - - [1, 1, 1, 32, 1, 1, 32, 1]
    - [85, 0.0]
- null
- null
- ExperimentalStreamK
- GridBased
