library/src/amd_detail/rocblaslt/src/Tensile/Logic/asm_full/aquavanjaram/gfx942_80cu/StreamK/aquavanjaram942_Cijk_Alik_Bjlk_BBS_BH_UserArgs.yaml
- {MinimumRequiredVersion: 4.33.0}
- aquavanjaram942
- {Architecture: gfx942, CUCount: 80}
- [Device 0049, Device 0050]
    SolutionIndex: 0
    SolutionNameMin: Cijk_Alik_Bjlk_BBS_BH_UserArgs_MT256x256x32_MI16x16x1_SN_LDSB1_CLR1_GSU0_GSUC0_GSUWGMRR0_K1_LBSPPA256_LBSPPB2048_LPB32_MIWT8_8_PLR1_SU32_SUM0_SUS256_SKXCCM0_VWA4_VWB2_WGM1_WGMXCC1_WGMXCCGn1
    SolutionIndex: 1
    SolutionNameMin: Cijk_Alik_Bjlk_BBS_BH_UserArgs_MT256x256x32_MI16x16x1_SN_LDSB1_CLR1_GSU0_GSUC0_GSUWGMRR0_K1_LBSPPA512_LBSPPB2048_LPB32_MIWT8_8_PLR1_SU32_SUM0_SUS256_SKXCCM0_VWA8_VWB2_WGM1_WGMXCC1_WGMXCCGn1
    SolutionIndex: 2
    SolutionNameMin: Cijk_Alik_Bjlk_BBS_BH_UserArgs_MT256x256x32_MI16x16x1_SN_LDSB1_CLR1_GSU0_GSUC0_GSUWGMRR0_K1_LBSPPA256_LBSPPB2048_LPB0_MIWT8_8_PLR1_SU32_SUM0_SUS256_SKXCCM0_VWA4_VWB4_WGM1_WGMXCC1_WGMXCCGn1
    SolutionIndex: 3
    SolutionNameMin: Cijk_Alik_Bjlk_BBS_BH_UserArgs_MT256x256x32_MI16x16x1_SN_LDSB1_CLR1_GSU0_GSUC0_GSUWGMRR0_K1_LBSPPA512_LBSPPB2048_LPB0_MIWT8_8_PLR1_SU32_SUM0_SUS256_SKXCCM0_VWA8_VWB4_WGM1_WGMXCC1_WGMXCCGn1
    SolutionIndex: 4
    SolutionNameMin: Cijk_Alik_Bjlk_BBS_BH_UserArgs_MT256x256x32_MI16x16x1_SN_LDSB1_CLR1_GSU0_GSUC0_GSUWGMRR0_K1_LBSPPA256_LBSPPB2048_LPB0_MIWT8_8_PLR1_SU32_SUM0_SUS256_SKXCCM0_VWA4_VWB4_WGM2_WGMXCC1_WGMXCCGn1
    SolutionIndex: 5
    SolutionNameMin: Cijk_Alik_Bjlk_BBS_BH_UserArgs_MT256x256x32_MI16x16x1_SN_LDSB1_CLR1_GSU0_GSUC0_GSUWGMRR0_K1_LBSPPA512_LBSPPB2048_LPB0_MIWT8_8_PLR1_SU32_SUM0_SUS256_SKXCCM0_VWA8_VWB4_WGM2_WGMXCC1_WGMXCCGn1
    SolutionIndex: 6
    SolutionNameMin: Cijk_Alik_Bjlk_BBS_BH_UserArgs_MT256x256x32_MI16x16x1_SN_LDSB1_CLR1_GSU0_GSUC0_GSUWGMRR0_K1_LBSPPA256_LBSPPB2048_LPB0_MIWT8_8_PLR1_SU32_SUM0_SUS256_SKXCCM0_VWA4_VWB8_WGM2_WGMXCC1_WGMXCCGn1
    SolutionIndex: 7
    SolutionNameMin: Cijk_Alik_Bjlk_BBS_BH_UserArgs_MT256x256x32_MI16x16x1_SN_LDSB1_CLR1_GSU0_GSUC0_GSUWGMRR0_K1_LBSPPA256_LBSPPB2048_LPB0_MIWT8_8_PLR1_SU32_SUM0_SUS256_SKXCCM0_VWA4_VWB8_WGM4_WGMXCC1_WGMXCCGn1
    SolutionIndex: 8
    SolutionNameMin: Cijk_Alik_Bjlk_BBS_BH_UserArgs_MT128x256x32_MI16x16x1_SN_LDSB1_CLR1_GSU0_GSUC0_GSUWGMRR0_K1_LBSPPA256_LBSPPB2048_LPB0_MIWT4_8_PLR1_SU32_SUM0_SUS256_SKXCCM0_VWA4_VWB4_WGM1_WGMXCC1_WGMXCCGn1
    SolutionIndex: 9
    SolutionNameMin: Cijk_Alik_Bjlk_BBS_BH_UserArgs_MT256x128x64_MI16x16x1_SN_LDSB1_CLR1_GSU0_GSUC0_GSUWGMRR0_K1_LBSPPA512_LBSPPB2048_LPB0_MIWT8_4_PLR1_SU32_SUM0_SUS256_SKXCCM0_VWA4_VWB4_WGM2_WGMXCC1_WGMXCCGn1
    SolutionIndex: 10
    SolutionNameMin: Cijk_Alik_Bjlk_BBS_BH_UserArgs_MT256x64x64_MI16x16x1_SN_LDSB1_CLR1_GSU0_GSUC0_GSUWGMRR0_K1_LBSPPA1024_LBSPPB1024_LPB32_MIWT8_2_PLR1_SU32_SUM0_SUS256_SKXCCM0_VWA8_VWB2_WGM4_WGMXCC1_WGMXCCGn1
    SolutionIndex: 11
    SolutionNameMin: Cijk_Alik_Bjlk_BBS_BH_UserArgs_MT128x128x64_MI16x16x1_SN_LDSB1_CLR1_GSU0_GSUC0_GSUWGMRR0_K1_LBSPPA512_LBSPPB2048_LPB0_MIWT4_4_PLR1_SU32_SUM0_SUS256_SKXCCM0_VWA4_VWB4_WGM1_WGMXCC1_WGMXCCGn1
    SolutionIndex: 12
    SolutionNameMin: Cijk_Alik_Bjlk_BBS_BH_UserArgs_MT128x128x64_MI16x16x1_SN_LDSB1_CLR1_GSU0_GSUC0_GSUWGMRR0_K1_LBSPPA256_LBSPPB2048_LPB0_MIWT4_4_PLR1_SU32_SUM0_SUS256_SKXCCM0_VWA2_VWB4_WGM2_WGMXCC1_WGMXCCGn1
    SolutionIndex: 13
    SolutionNameMin: Cijk_Alik_Bjlk_BBS_BH_UserArgs_MT128x128x64_MI16x16x1_SN_LDSB1_CLR1_GSU0_GSUC0_GSUWGMRR0_K1_LBSPPA512_LBSPPB2048_LPB0_MIWT4_4_PLR1_SU32_SUM0_SUS256_SKXCCM0_VWA4_VWB4_WGM2_WGMXCC1_WGMXCCGn1
    SolutionIndex: 14
    SolutionNameMin: Cijk_Alik_Bjlk_BBS_BH_UserArgs_MT128x128x64_MI16x16x1_SN_LDSB1_CLR1_GSU0_GSUC0_GSUWGMRR0_K1_LBSPPA512_LBSPPB2048_LPB0_MIWT4_4_PLR1_SU32_SUM0_SUS256_SKXCCM0_VWA4_VWB4_WGM4_WGMXCC1_WGMXCCGn1
    SolutionIndex: 15
    SolutionNameMin: Cijk_Alik_Bjlk_BBS_BH_UserArgs_MT64x64x64_MI16x16x1_SN_LDSB1_CLR1_GSU0_GSUC0_GSUWGMRR0_K1_LBSPPA256_LBSPPB1024_LPB32_MIWT2_2_PLR1_SU32_SUM0_SUS256_SKXCCM0_VWA2_VWB2_WGM1_WGMXCC1_WGMXCCGn1
    SolutionIndex: 16
    SolutionNameMin: Cijk_Alik_Bjlk_BBS_BH_UserArgs_MT32x64x64_MI16x16x1_SN_LDSB0_CLR1_GSU0_GSUC0_GSUWGMRR0_K1_LBSPPA128_LBSPPB1024_LPB32_MIWT1_2_PLR1_SU32_SUM0_SUS256_SKXCCM0_VWA1_VWB2_WGM1_WGMXCC1_WGMXCCGn1
    SolutionIndex: 17
    SolutionNameMin: Cijk_Alik_Bjlk_BBS_BH_UserArgs_MT64x32x64_MI16x16x1_SN_LDSB0_CLR1_GSU0_GSUC0_GSUWGMRR0_K1_LBSPPA256_LBSPPB512_LPB16_MIWT2_1_PLR1_SU32_SUM0_SUS256_SKXCCM0_VWA2_VWB1_WGM1_WGMXCC1_WGMXCCGn1
    SolutionIndex: 18
    SolutionNameMin: Cijk_Alik_Bjlk_BBS_BH_UserArgs_MT32x32x64_MI16x16x1_SN_LDSB0_CLR1_GSU0_GSUC0_GSUWGMRR0_K1_LBSPPA128_LBSPPB512_LPB16_MIWT1_1_PLR1_SU32_SUM0_SUS256_SKXCCM0_VWA1_VWB1_WGM1_WGMXCC1_WGMXCCGn1
    SolutionIndex: 19
    SolutionNameMin: Cijk_Alik_Bjlk_BBS_BH_UserArgs_MT64x128x128_MI16x16x1_SN_LDSB1_CLR1_GSU0_GSUC0_GSUWGMRR0_K1_LBSPPA512_LBSPPB2048_LPB0_MIWT2_4_PLR2_SU32_SUM0_SUS256_SKXCCM0_VWA2_VWB4_WGM1_WGMXCC1_WGMXCCGn1
    SolutionIndex: 20
    SolutionNameMin: Cijk_Alik_Bjlk_BBS_BH_UserArgs_MT128x64x128_MI16x16x1_SN_LDSB1_CLR1_GSU0_GSUC0_GSUWGMRR0_K1_LBSPPA512_LBSPPB1024_LPB32_MIWT4_2_PLR2_SU32_SUM0_SUS256_SKXCCM0_VWA2_VWB2_WGM1_WGMXCC1_WGMXCCGn1
    SolutionIndex: 21
    SolutionNameMin: Cijk_Alik_Bjlk_BBS_BH_UserArgs_MT128x64x128_MI16x16x1_SN_LDSB1_CLR1_GSU0_GSUC0_GSUWGMRR0_K1_LBSPPA1024_LBSPPB1024_LPB32_MIWT4_2_PLR2_SU32_SUM0_SUS256_SKXCCM0_VWA4_VWB2_WGM1_WGMXCC1_WGMXCCGn1
    SolutionIndex: 22
    SolutionNameMin: Cijk_Alik_Bjlk_BBS_BH_UserArgs_MT128x64x128_MI16x16x1_SN_LDSB1_CLR1_GSU0_GSUC0_GSUWGMRR0_K1_LBSPPA1024_LBSPPB1024_LPB32_MIWT4_2_PLR2_SU32_SUM0_SUS256_SKXCCM0_VWA4_VWB2_WGM2_WGMXCC1_WGMXCCGn1
    SolutionIndex: 23
    SolutionNameMin: Cijk_Alik_Bjlk_BBS_BH_UserArgs_MT128x64x128_MI16x16x1_SN_LDSB1_CLR1_GSU0_GSUC0_GSUWGMRR0_K1_LBSPPA1024_LBSPPB1024_LPB32_MIWT4_2_PLR2_SU32_SUM0_SUS256_SKXCCM0_VWA4_VWB2_WGM4_WGMXCC1_WGMXCCGn1
    SolutionIndex: 24
    SolutionNameMin: Cijk_Alik_Bjlk_BBS_BH_UserArgs_MT64x64x128_MI16x16x1_SN_LDSB1_CLR1_GSU0_GSUC0_GSUWGMRR0_K1_LBSPPA512_LBSPPB1024_LPB32_MIWT2_2_PLR2_SU32_SUM0_SUS256_SKXCCM0_VWA2_VWB2_WGM1_WGMXCC1_WGMXCCGn1
    SolutionIndex: 25
    SolutionNameMin: Cijk_Alik_Bjlk_BBS_BH_UserArgs_MT64x64x128_MI16x16x1_SN_LDSB1_CLR1_GSU0_GSUC0_GSUWGMRR0_K1_LBSPPA512_LBSPPB1024_LPB32_MIWT2_2_PLR2_SU32_SUM0_SUS256_SKXCCM0_VWA2_VWB2_WGM2_WGMXCC1_WGMXCCGn1
    SolutionIndex: 26
    SolutionNameMin: Cijk_Alik_Bjlk_BBS_BH_UserArgs_MT64x64x128_MI16x16x1_SN_LDSB1_CLR1_GSU0_GSUC0_GSUWGMRR0_K1_LBSPPA512_LBSPPB1024_LPB32_MIWT2_2_PLR2_SU32_SUM0_SUS256_SKXCCM0_VWA2_VWB2_WGM4_WGMXCC1_WGMXCCGn1
    SolutionIndex: 27
    SolutionNameMin: Cijk_Alik_Bjlk_BBS_BH_UserArgs_MT32x64x128_MI16x16x1_SN_LDSB1_CLR1_GSU0_GSUC0_GSUWGMRR0_K1_LBSPPA256_LBSPPB1024_LPB32_MIWT1_2_PLR2_SU32_SUM0_SUS256_SKXCCM0_VWA1_VWB2_WGM1_WGMXCC1_WGMXCCGn1
    SolutionIndex: 28
    SolutionNameMin: Cijk_Alik_Bjlk_BBS_BH_UserArgs_MT32x64x128_MI16x16x1_SN_LDSB1_CLR1_GSU0_GSUC0_GSUWGMRR0_K1_LBSPPA256_LBSPPB1024_LPB32_MIWT1_2_PLR2_SU32_SUM0_SUS256_SKXCCM0_VWA1_VWB2_WGM2_WGMXCC1_WGMXCCGn1
    SolutionIndex: 29
    SolutionNameMin: Cijk_Alik_Bjlk_BBS_BH_UserArgs_MT32x32x128_MI16x16x1_SN_LDSB1_CLR1_GSU0_GSUC0_GSUWGMRR0_K1_LBSPPA256_LBSPPB512_LPB16_MIWT1_1_PLR1_SU32_SUM0_SUS256_SKXCCM0_VWA1_VWB1_WGM1_WGMXCC1_WGMXCCGn1
    SolutionIndex: 30
    SolutionNameMin: Cijk_Alik_Bjlk_BBS_BH_UserArgs_MT32x32x128_MI16x16x1_SN_LDSB1_CLR1_GSU0_GSUC0_GSUWGMRR0_K1_LBSPPA256_LBSPPB512_LPB16_MIWT1_1_PLR2_SU32_SUM0_SUS256_SKXCCM0_VWA1_VWB1_WGM1_WGMXCC1_WGMXCCGn1
    SolutionIndex: 31
    SolutionNameMin: Cijk_Alik_Bjlk_BBS_BH_UserArgs_MT256x256x32_MI16x16x1_SN_LDSB1_CLR1_GSU0_GSUC0_GSUWGMRR0_K1_LBSPPA256_LBSPPB2048_LPB0_MIWT8_8_PLR1_SU32_SUM0_SUS256_SKXCCM4_VWA4_VWB4_WGM1_WGMXCC1_WGMXCCGn1
    SolutionIndex: 32
    SolutionNameMin: Cijk_Alik_Bjlk_BBS_BH_UserArgs_MT256x256x32_MI16x16x1_SN_LDSB1_CLR1_GSU0_GSUC0_GSUWGMRR0_K1_LBSPPA512_LBSPPB2048_LPB0_MIWT8_8_PLR1_SU32_SUM0_SUS256_SKXCCM4_VWA8_VWB4_WGM1_WGMXCC1_WGMXCCGn1
    SolutionIndex: 33
    SolutionNameMin: Cijk_Alik_Bjlk_BBS_BH_UserArgs_MT256x256x32_MI16x16x1_SN_LDSB1_CLR1_GSU0_GSUC0_GSUWGMRR0_K1_LBSPPA256_LBSPPB2048_LPB0_MIWT8_8_PLR1_SU32_SUM0_SUS256_SKXCCM4_VWA4_VWB8_WGM1_WGMXCC1_WGMXCCGn1
    SolutionIndex: 34
    SolutionNameMin: Cijk_Alik_Bjlk_BBS_BH_UserArgs_MT256x256x32_MI16x16x1_SN_LDSB1_CLR1_GSU0_GSUC0_GSUWGMRR0_K1_LBSPPA512_LBSPPB2048_LPB0_MIWT8_8_PLR1_SU32_SUM0_SUS256_SKXCCM4_VWA8_VWB8_WGM1_WGMXCC1_WGMXCCGn1
    SolutionIndex: 35
    SolutionNameMin: Cijk_Alik_Bjlk_BBS_BH_UserArgs_MT256x256x32_MI16x16x1_SN_LDSB1_CLR1_GSU0_GSUC0_GSUWGMRR0_K1_LBSPPA256_LBSPPB2048_LPB0_MIWT8_8_PLR1_SU32_SUM0_SUS256_SKXCCM4_VWA4_VWB4_WGM2_WGMXCC1_WGMXCCGn1
    SolutionIndex: 36
    SolutionNameMin: Cijk_Alik_Bjlk_BBS_BH_UserArgs_MT256x256x32_MI16x16x1_SN_LDSB1_CLR1_GSU0_GSUC0_GSUWGMRR0_K1_LBSPPA512_LBSPPB2048_LPB0_MIWT8_8_PLR1_SU32_SUM0_SUS256_SKXCCM4_VWA8_VWB4_WGM2_WGMXCC1_WGMXCCGn1
    SolutionIndex: 37
    SolutionNameMin: Cijk_Alik_Bjlk_BBS_BH_UserArgs_MT256x256x32_MI16x16x1_SN_LDSB1_CLR1_GSU0_GSUC0_GSUWGMRR0_K1_LBSPPA256_LBSPPB2048_LPB0_MIWT8_8_PLR1_SU32_SUM0_SUS256_SKXCCM4_VWA4_VWB8_WGM2_WGMXCC1_WGMXCCGn1
    SolutionIndex: 38
    SolutionNameMin: Cijk_Alik_Bjlk_BBS_BH_UserArgs_MT256x256x32_MI16x16x1_SN_LDSB1_CLR1_GSU0_GSUC0_GSUWGMRR0_K1_LBSPPA512_LBSPPB2048_LPB0_MIWT8_8_PLR1_SU32_SUM0_SUS256_SKXCCM4_VWA8_VWB8_WGM2_WGMXCC1_WGMXCCGn1
    SolutionIndex: 39
    SolutionNameMin: Cijk_Alik_Bjlk_BBS_BH_UserArgs_MT256x256x32_MI16x16x1_SN_LDSB1_CLR1_GSU0_GSUC0_GSUWGMRR0_K1_LBSPPA512_LBSPPB2048_LPB32_MIWT8_8_PLR1_SU32_SUM0_SUS256_SKXCCM4_VWA8_VWB2_WGM4_WGMXCC1_WGMXCCGn1
    SolutionIndex: 40
    SolutionNameMin: Cijk_Alik_Bjlk_BBS_BH_UserArgs_MT256x256x32_MI16x16x1_SN_LDSB1_CLR1_GSU0_GSUC0_GSUWGMRR0_K1_LBSPPA256_LBSPPB2048_LPB0_MIWT8_8_PLR1_SU32_SUM0_SUS256_SKXCCM4_VWA4_VWB4_WGM4_WGMXCC1_WGMXCCGn1
    SolutionIndex: 41
    SolutionNameMin: Cijk_Alik_Bjlk_BBS_BH_UserArgs_MT256x256x32_MI16x16x1_SN_LDSB1_CLR1_GSU0_GSUC0_GSUWGMRR0_K1_LBSPPA512_LBSPPB2048_LPB0_MIWT8_8_PLR1_SU32_SUM0_SUS256_SKXCCM4_VWA8_VWB4_WGM4_WGMXCC1_WGMXCCGn1
    SolutionIndex: 42
    SolutionNameMin: Cijk_Alik_Bjlk_BBS_BH_UserArgs_MT256x256x32_MI16x16x1_SN_LDSB1_CLR1_GSU0_GSUC0_GSUWGMRR0_K1_LBSPPA256_LBSPPB2048_LPB0_MIWT8_8_PLR1_SU32_SUM0_SUS256_SKXCCM4_VWA4_VWB8_WGM4_WGMXCC1_WGMXCCGn1
    SolutionIndex: 43
    SolutionNameMin: Cijk_Alik_Bjlk_BBS_BH_UserArgs_MT256x256x32_MI16x16x1_SN_LDSB1_CLR1_GSU0_GSUC0_GSUWGMRR0_K1_LBSPPA512_LBSPPB2048_LPB0_MIWT8_8_PLR1_SU32_SUM0_SUS256_SKXCCM4_VWA8_VWB8_WGM4_WGMXCC1_WGMXCCGn1
    SolutionIndex: 44
    SolutionNameMin: Cijk_Alik_Bjlk_BBS_BH_UserArgs_MT128x256x32_MI16x16x1_SN_LDSB1_CLR1_GSU0_GSUC0_GSUWGMRR0_K1_LBSPPA256_LBSPPB2048_LPB32_MIWT4_8_PLR1_SU32_SUM0_SUS256_SKXCCM4_VWA4_VWB2_WGM1_WGMXCC1_WGMXCCGn1
    SolutionIndex: 45
    SolutionNameMin: Cijk_Alik_Bjlk_BBS_BH_UserArgs_MT128x256x32_MI16x16x1_SN_LDSB1_CLR1_GSU0_GSUC0_GSUWGMRR0_K1_LBSPPA256_LBSPPB2048_LPB0_MIWT4_8_PLR1_SU32_SUM0_SUS256_SKXCCM4_VWA4_VWB4_WGM1_WGMXCC1_WGMXCCGn1
    SolutionIndex: 46
    SolutionNameMin: Cijk_Alik_Bjlk_BBS_BH_UserArgs_MT128x256x32_MI16x16x1_SN_LDSB1_CLR1_GSU0_GSUC0_GSUWGMRR0_K1_LBSPPA256_LBSPPB2048_LPB0_MIWT4_8_PLR1_SU32_SUM0_SUS256_SKXCCM4_VWA4_VWB4_WGM2_WGMXCC1_WGMXCCGn1
    SolutionIndex: 47
    SolutionNameMin: Cijk_Alik_Bjlk_BBS_BH_UserArgs_MT128x256x32_MI16x16x1_SN_LDSB1_CLR1_GSU0_GSUC0_GSUWGMRR0_K1_LBSPPA256_LBSPPB2048_LPB0_MIWT4_8_PLR1_SU32_SUM0_SUS256_SKXCCM4_VWA4_VWB8_WGM2_WGMXCC1_WGMXCCGn1
    SolutionIndex: 48
    SolutionNameMin: Cijk_Alik_Bjlk_BBS_BH_UserArgs_MT128x256x32_MI16x16x1_SN_LDSB1_CLR1_GSU0_GSUC0_GSUWGMRR0_K1_LBSPPA256_LBSPPB2048_LPB32_MIWT4_8_PLR1_SU32_SUM0_SUS256_SKXCCM4_VWA4_VWB2_WGM4_WGMXCC1_WGMXCCGn1
    SolutionIndex: 49
    SolutionNameMin: Cijk_Alik_Bjlk_BBS_BH_UserArgs_MT128x256x32_MI16x16x1_SN_LDSB1_CLR1_GSU0_GSUC0_GSUWGMRR0_K1_LBSPPA256_LBSPPB2048_LPB0_MIWT4_8_PLR1_SU32_SUM0_SUS256_SKXCCM4_VWA4_VWB4_WGM4_WGMXCC1_WGMXCCGn1
    SolutionIndex: 50
    SolutionNameMin: Cijk_Alik_Bjlk_BBS_BH_UserArgs_MT128x256x32_MI16x16x1_SN_LDSB1_CLR1_GSU0_GSUC0_GSUWGMRR0_K1_LBSPPA256_LBSPPB2048_LPB0_MIWT4_8_PLR1_SU32_SUM0_SUS256_SKXCCM4_VWA4_VWB8_WGM4_WGMXCC1_WGMXCCGn1
    SolutionIndex: 51
    SolutionNameMin: Cijk_Alik_Bjlk_BBS_BH_UserArgs_MT256x128x32_MI16x16x1_SN_LDSB1_CLR1_GSU0_GSUC0_GSUWGMRR0_K1_LBSPPA256_LBSPPB1024_LPB32_MIWT8_4_PLR1_SU32_SUM0_SUS256_SKXCCM4_VWA4_VWB2_WGM1_WGMXCC1_WGMXCCGn1
    SolutionIndex: 52
    SolutionNameMin: Cijk_Alik_Bjlk_BBS_BH_UserArgs_MT256x128x32_MI16x16x1_SN_LDSB1_CLR1_GSU0_GSUC0_GSUWGMRR0_K1_LBSPPA512_LBSPPB1024_LPB32_MIWT8_4_PLR1_SU32_SUM0_SUS256_SKXCCM4_VWA8_VWB2_WGM1_WGMXCC1_WGMXCCGn1
    SolutionIndex: 53
    SolutionNameMin: Cijk_Alik_Bjlk_BBS_BH_UserArgs_MT256x128x32_MI16x16x1_SN_LDSB1_CLR1_GSU0_GSUC0_GSUWGMRR0_K1_LBSPPA512_LBSPPB1024_LPB0_MIWT8_4_PLR1_SU32_SUM0_SUS256_SKXCCM4_VWA8_VWB4_WGM1_WGMXCC1_WGMXCCGn1
    SolutionIndex: 54
    SolutionNameMin: Cijk_Alik_Bjlk_BBS_BH_UserArgs_MT256x128x32_MI16x16x1_SN_LDSB1_CLR1_GSU0_GSUC0_GSUWGMRR0_K1_LBSPPA512_LBSPPB1024_LPB0_MIWT8_4_PLR1_SU32_SUM0_SUS256_SKXCCM4_VWA8_VWB4_WGM2_WGMXCC1_WGMXCCGn1
    SolutionIndex: 55
    SolutionNameMin: Cijk_Alik_Bjlk_BBS_BH_UserArgs_MT256x128x32_MI16x16x1_SN_LDSB1_CLR1_GSU0_GSUC0_GSUWGMRR0_K1_LBSPPA512_LBSPPB1024_LPB32_MIWT8_4_PLR1_SU32_SUM0_SUS256_SKXCCM4_VWA8_VWB2_WGM4_WGMXCC1_WGMXCCGn1
    SolutionIndex: 56
    SolutionNameMin: Cijk_Alik_Bjlk_BBS_BH_UserArgs_MT256x128x32_MI16x16x1_SN_LDSB1_CLR1_GSU0_GSUC0_GSUWGMRR0_K1_LBSPPA512_LBSPPB1024_LPB0_MIWT8_4_PLR1_SU32_SUM0_SUS256_SKXCCM4_VWA8_VWB4_WGM4_WGMXCC1_WGMXCCGn1
    SolutionIndex: 57
    SolutionNameMin: Cijk_Alik_Bjlk_BBS_BH_UserArgs_MT128x64x32_MI16x16x1_SN_LDSB0_CLR1_GSU0_GSUC0_GSUWGMRR0_K1_LBSPPA128_LBSPPB512_LPB32_MIWT4_2_PLR1_SU32_SUM0_SUS256_SKXCCM4_VWA2_VWB2_WGM1_WGMXCC1_WGMXCCGn1
    SolutionIndex: 58
    SolutionNameMin: Cijk_Alik_Bjlk_BBS_BH_UserArgs_MT128x256x64_MI16x16x1_SN_LDSB1_CLR1_GSU0_GSUC0_GSUWGMRR0_K1_LBSPPA512_LBSPPB4096_LPB0_MIWT4_8_PLR1_SU32_SUM0_SUS256_SKXCCM4_VWA4_VWB4_WGM1_WGMXCC1_WGMXCCGn1
    SolutionIndex: 59
    SolutionNameMin: Cijk_Alik_Bjlk_BBS_BH_UserArgs_MT256x128x64_MI16x16x1_SN_LDSB1_CLR1_GSU0_GSUC0_GSUWGMRR0_K1_LBSPPA512_LBSPPB2048_LPB32_MIWT8_4_PLR1_SU32_SUM0_SUS256_SKXCCM4_VWA4_VWB2_WGM1_WGMXCC1_WGMXCCGn1
    SolutionIndex: 60
    SolutionNameMin: Cijk_Alik_Bjlk_BBS_BH_UserArgs_MT256x128x64_MI16x16x1_SN_LDSB1_CLR1_GSU0_GSUC0_GSUWGMRR0_K1_LBSPPA1024_LBSPPB2048_LPB32_MIWT8_4_PLR1_SU32_SUM0_SUS256_SKXCCM4_VWA8_VWB2_WGM1_WGMXCC1_WGMXCCGn1
    SolutionIndex: 61
    SolutionNameMin: Cijk_Alik_Bjlk_BBS_BH_UserArgs_MT256x128x64_MI16x16x1_SN_LDSB1_CLR1_GSU0_GSUC0_GSUWGMRR0_K1_LBSPPA128_LBSPPB2048_LPB0_MIWT8_4_PLR1_SU32_SUM0_SUS256_SKXCCM4_VWA1_VWB4_WGM1_WGMXCC1_WGMXCCGn1
    SolutionIndex: 62
    SolutionNameMin: Cijk_Alik_Bjlk_BBS_BH_UserArgs_MT256x128x64_MI16x16x1_SN_LDSB1_CLR1_GSU0_GSUC0_GSUWGMRR0_K1_LBSPPA512_LBSPPB2048_LPB0_MIWT8_4_PLR1_SU32_SUM0_SUS256_SKXCCM4_VWA4_VWB4_WGM1_WGMXCC1_WGMXCCGn1
    SolutionIndex: 63
    SolutionNameMin: Cijk_Alik_Bjlk_BBS_BH_UserArgs_MT256x128x64_MI16x16x1_SN_LDSB1_CLR1_GSU0_GSUC0_GSUWGMRR0_K1_LBSPPA1024_LBSPPB2048_LPB0_MIWT8_4_PLR1_SU32_SUM0_SUS256_SKXCCM4_VWA8_VWB4_WGM1_WGMXCC1_WGMXCCGn1
    SolutionIndex: 64
    SolutionNameMin: Cijk_Alik_Bjlk_BBS_BH_UserArgs_MT256x128x64_MI16x16x1_SN_LDSB1_CLR1_GSU0_GSUC0_GSUWGMRR0_K1_LBSPPA1024_LBSPPB2048_LPB0_MIWT8_4_PLR1_SU32_SUM0_SUS256_SKXCCM4_VWA8_VWB4_WGM4_WGMXCC1_WGMXCCGn1
    SolutionIndex: 65
    SolutionNameMin: Cijk_Alik_Bjlk_BBS_BH_UserArgs_MT128x128x64_MI16x16x1_SN_LDSB1_CLR1_GSU0_GSUC0_GSUWGMRR0_K1_LBSPPA256_LBSPPB2048_LPB32_MIWT4_4_PLR1_SU32_SUM0_SUS256_SKXCCM4_VWA2_VWB2_WGM1_WGMXCC1_WGMXCCGn1
    SolutionIndex: 66
    SolutionNameMin: Cijk_Alik_Bjlk_BBS_BH_UserArgs_MT128x128x64_MI16x16x1_SN_LDSB1_CLR1_GSU0_GSUC0_GSUWGMRR0_K1_LBSPPA256_LBSPPB2048_LPB0_MIWT4_4_PLR1_SU32_SUM0_SUS256_SKXCCM4_VWA2_VWB4_WGM1_WGMXCC1_WGMXCCGn1
    SolutionIndex: 67
    SolutionNameMin: Cijk_Alik_Bjlk_BBS_BH_UserArgs_MT128x128x64_MI16x16x1_SN_LDSB1_CLR1_GSU0_GSUC0_GSUWGMRR0_K1_LBSPPA512_LBSPPB2048_LPB0_MIWT4_4_PLR1_SU32_SUM0_SUS256_SKXCCM4_VWA4_VWB4_WGM1_WGMXCC1_WGMXCCGn1
    SolutionIndex: 68
    SolutionNameMin: Cijk_Alik_Bjlk_BBS_BH_UserArgs_MT128x128x64_MI16x16x1_SN_LDSB1_CLR1_GSU0_GSUC0_GSUWGMRR0_K1_LBSPPA512_LBSPPB2048_LPB0_MIWT4_4_PLR1_SU32_SUM0_SUS256_SKXCCM4_VWA4_VWB4_WGM2_WGMXCC1_WGMXCCGn1
    SolutionIndex: 69
    SolutionNameMin: Cijk_Alik_Bjlk_BBS_BH_UserArgs_MT128x128x64_MI16x16x1_SN_LDSB1_CLR1_GSU0_GSUC0_GSUWGMRR0_K1_LBSPPA256_LBSPPB2048_LPB0_MIWT4_4_PLR1_SU32_SUM0_SUS256_SKXCCM4_VWA2_VWB4_WGM4_WGMXCC1_WGMXCCGn1
    SolutionIndex: 70
    SolutionNameMin: Cijk_Alik_Bjlk_BBS_BH_UserArgs_MT128x128x64_MI16x16x1_SN_LDSB1_CLR1_GSU0_GSUC0_GSUWGMRR0_K1_LBSPPA512_LBSPPB2048_LPB0_MIWT4_4_PLR1_SU32_SUM0_SUS256_SKXCCM4_VWA4_VWB4_WGM4_WGMXCC1_WGMXCCGn1
    SolutionIndex: 71
    SolutionNameMin: Cijk_Alik_Bjlk_BBS_BH_UserArgs_MT128x64x64_MI16x16x1_SN_LDSB1_CLR1_GSU0_GSUC0_GSUWGMRR0_K1_LBSPPA256_LBSPPB1024_LPB32_MIWT4_2_PLR1_SU32_SUM0_SUS256_SKXCCM4_VWA2_VWB2_WGM1_WGMXCC1_WGMXCCGn1
    SolutionIndex: 72
    SolutionNameMin: Cijk_Alik_Bjlk_BBS_BH_UserArgs_MT128x64x64_MI16x16x1_SN_LDSB1_CLR1_GSU0_GSUC0_GSUWGMRR0_K1_LBSPPA512_LBSPPB1024_LPB32_MIWT4_2_PLR1_SU32_SUM0_SUS256_SKXCCM4_VWA4_VWB2_WGM1_WGMXCC1_WGMXCCGn1
    SolutionIndex: 73
    SolutionNameMin: Cijk_Alik_Bjlk_BBS_BH_UserArgs_MT64x64x64_MI16x16x1_SN_LDSB1_CLR1_GSU0_GSUC0_GSUWGMRR0_K1_LBSPPA256_LBSPPB1024_LPB32_MIWT2_2_PLR1_SU32_SUM0_SUS256_SKXCCM4_VWA2_VWB2_WGM1_WGMXCC1_WGMXCCGn1
    SolutionIndex: 74
    SolutionNameMin: Cijk_Alik_Bjlk_BBS_BH_UserArgs_MT32x64x64_MI16x16x1_SN_LDSB0_CLR1_GSU0_GSUC0_GSUWGMRR0_K1_LBSPPA128_LBSPPB1024_LPB32_MIWT1_2_PLR1_SU32_SUM0_SUS256_SKXCCM4_VWA1_VWB2_WGM1_WGMXCC1_WGMXCCGn1
    SolutionIndex: 75
    SolutionNameMin: Cijk_Alik_Bjlk_BBS_BH_UserArgs_MT64x32x64_MI16x16x1_SN_LDSB0_CLR1_GSU0_GSUC0_GSUWGMRR0_K1_LBSPPA256_LBSPPB512_LPB16_MIWT2_1_PLR1_SU32_SUM0_SUS256_SKXCCM4_VWA2_VWB1_WGM1_WGMXCC1_WGMXCCGn1
    SolutionIndex: 76
    SolutionNameMin: Cijk_Alik_Bjlk_BBS_BH_UserArgs_MT32x32x64_MI16x16x1_SN_LDSB0_CLR1_GSU0_GSUC0_GSUWGMRR0_K1_LBSPPA128_LBSPPB512_LPB16_MIWT1_1_PLR1_SU32_SUM0_SUS256_SKXCCM4_VWA1_VWB1_WGM1_WGMXCC1_WGMXCCGn1
    SolutionIndex: 77
    SolutionNameMin: Cijk_Alik_Bjlk_BBS_BH_UserArgs_MT128x64x128_MI16x16x1_SN_LDSB1_CLR1_GSU0_GSUC0_GSUWGMRR0_K1_LBSPPA512_LBSPPB1024_LPB32_MIWT4_2_PLR2_SU32_SUM0_SUS256_SKXCCM4_VWA2_VWB2_WGM1_WGMXCC1_WGMXCCGn1
    SolutionIndex: 78
    SolutionNameMin: Cijk_Alik_Bjlk_BBS_BH_UserArgs_MT128x64x128_MI16x16x1_SN_LDSB1_CLR1_GSU0_GSUC0_GSUWGMRR0_K1_LBSPPA1024_LBSPPB1024_LPB32_MIWT4_2_PLR2_SU32_SUM0_SUS256_SKXCCM4_VWA4_VWB2_WGM1_WGMXCC1_WGMXCCGn1
    SolutionIndex: 79
    SolutionNameMin: Cijk_Alik_Bjlk_BBS_BH_UserArgs_MT128x64x128_MI16x16x1_SN_LDSB1_CLR1_GSU0_GSUC0_GSUWGMRR0_K1_LBSPPA1024_LBSPPB1024_LPB32_MIWT4_2_PLR2_SU32_SUM0_SUS256_SKXCCM4_VWA4_VWB2_WGM2_WGMXCC1_WGMXCCGn1
    SolutionIndex: 80
    SolutionNameMin: Cijk_Alik_Bjlk_BBS_BH_UserArgs_MT128x64x128_MI16x16x1_SN_LDSB1_CLR1_GSU0_GSUC0_GSUWGMRR0_K1_LBSPPA1024_LBSPPB1024_LPB32_MIWT4_2_PLR2_SU32_SUM0_SUS256_SKXCCM4_VWA4_VWB2_WGM4_WGMXCC1_WGMXCCGn1
    SolutionIndex: 81
    SolutionNameMin: Cijk_Alik_Bjlk_BBS_BH_UserArgs_MT64x64x128_MI16x16x1_SN_LDSB1_CLR1_GSU0_GSUC0_GSUWGMRR0_K1_LBSPPA512_LBSPPB1024_LPB32_MIWT2_2_PLR2_SU32_SUM0_SUS256_SKXCCM4_VWA2_VWB2_WGM1_WGMXCC1_WGMXCCGn1
    SolutionIndex: 82
    SolutionNameMin: Cijk_Alik_Bjlk_BBS_BH_UserArgs_MT64x64x128_MI16x16x1_SN_LDSB1_CLR1_GSU0_GSUC0_GSUWGMRR0_K1_LBSPPA512_LBSPPB1024_LPB32_MIWT2_2_PLR2_SU32_SUM0_SUS256_SKXCCM4_VWA2_VWB2_WGM4_WGMXCC1_WGMXCCGn1
    SolutionIndex: 83
    SolutionNameMin: Cijk_Alik_Bjlk_BBS_BH_UserArgs_MT32x64x128_MI16x16x1_SN_LDSB1_CLR1_GSU0_GSUC0_GSUWGMRR0_K1_LBSPPA256_LBSPPB1024_LPB32_MIWT1_2_PLR2_SU32_SUM0_SUS256_SKXCCM4_VWA1_VWB2_WGM1_WGMXCC1_WGMXCCGn1
    SolutionIndex: 84
    SolutionNameMin: Cijk_Alik_Bjlk_BBS_BH_UserArgs_MT32x32x128_MI16x16x1_SN_LDSB1_CLR1_GSU0_GSUC0_GSUWGMRR0_K1_LBSPPA256_LBSPPB512_LPB16_MIWT1_1_PLR1_SU32_SUM0_SUS256_SKXCCM4_VWA1_VWB1_WGM1_WGMXCC1_WGMXCCGn1
    SolutionIndex: 85
    SolutionNameMin: Cijk_Alik_Bjlk_BBS_BH_UserArgs_MT32x32x128_MI16x16x1_SN_LDSB1_CLR1_GSU0_GSUC0_GSUWGMRR0_K1_LBSPPA256_LBSPPB512_LPB16_MIWT1_1_PLR2_SU32_SUM0_SUS256_SKXCCM4_VWA1_VWB1_WGM1_WGMXCC1_WGMXCCGn1
    SolutionIndex: 86
    SolutionNameMin: Cijk_Alik_Bjlk_BBS_BH_UserArgs_MT32x32x32_MI16x16x1_SN_LDSB0_CLR0_GSU0_GSUC0_GSUWGMRR0_K1_LBSPPA128_LBSPPB256_LPB16_MIWT1_1_PLR0_SU32_SUM0_SUS256_SKXCCM4_VWA1_VWB1_WGM2_WGMXCC1_WGMXCCGn1
- - - [128, 128, 1, 128, 128, 128, 128, 128]
    - [18, 0.088]
  - - [128, 128, 1, 256, 128, 128, 256, 128]
    - [18, 0.157]
  - - [128, 128, 1, 512, 128, 128, 512, 128]
    - [84, 0.266]
  - - [128, 128, 1, 1024, 128, 128, 1024, 128]
    - [29, 0.397]
  - - [128, 128, 1, 2048, 128, 128, 2048, 128]
    - [85, 0.591]
  - - [128, 128, 1, 4096, 128, 128, 4096, 128]
    - [18, 1.013]
  - - [128, 128, 1, 8192, 128, 128, 8192, 128]
    - [85, 1.549]
  - - [128, 256, 1, 128, 128, 128, 128, 256]
    - [18, 0.176]
  - - [128, 256, 1, 256, 128, 128, 256, 256]
    - [76, 0.313]
  - - [128, 256, 1, 512, 128, 128, 512, 256]
    - [29, 0.525]
  - - [128, 256, 1, 1024, 128, 128, 1024, 256]
    - [85, 0.781]
  - - [128, 256, 1, 2048, 128, 128, 2048, 256]
    - [30, 1.147]
  - - [128, 256, 1, 4096, 128, 128, 4096, 256]
    - [74, 1.719]
  - - [128, 256, 1, 8192, 128, 128, 8192, 256]
    - [83, 2.682]
  - - [128, 512, 1, 128, 128, 128, 128, 512]
    - [18, 0.345]
  - - [128, 512, 1, 256, 128, 128, 256, 512]
    - [29, 0.617]
  - - [128, 512, 1, 512, 128, 128, 512, 512]
    - [30, 1.033]
  - - [128, 512, 1, 1024, 128, 128, 1024, 512]
    - [29, 1.563]
  - - [128, 512, 1, 2048, 128, 128, 2048, 512]
    - [30, 2.087]
  - - [128, 512, 1, 4096, 128, 128, 4096, 512]
    - [27, 2.934]
  - - [128, 512, 1, 8192, 128, 128, 8192, 512]
    - [81, 4.407]
  - - [128, 1024, 1, 128, 128, 128, 128, 1024]
    - [16, 0.635]
  - - [128, 1024, 1, 256, 128, 128, 256, 1024]
    - [27, 1.118]
  - - [128, 1024, 1, 512, 128, 128, 512, 1024]
    - [83, 1.855]
  - - [128, 1024, 1, 1024, 128, 128, 1024, 1024]
    - [27, 2.76]
  - - [128, 1024, 1, 2048, 128, 128, 2048, 1024]
    - [28, 3.579]
  - - [128, 1024, 1, 4096, 128, 128, 4096, 1024]
    - [26, 4.9]
  - - [128, 1024, 1, 8192, 128, 128, 8192, 1024]
    - [78, 7.01]
  - - [128, 2048, 1, 128, 128, 128, 128, 2048]
    - [73, 1.141]
  - - [128, 2048, 1, 256, 128, 128, 256, 2048]
    - [73, 1.975]
  - - [128, 2048, 1, 512, 128, 128, 512, 2048]
    - [24, 3.211]
  - - [128, 2048, 1, 1024, 128, 128, 1024, 2048]
    - [24, 4.654]
  - - [128, 2048, 1, 2048, 128, 128, 2048, 2048]
    - [81, 5.765]
  - - [128, 2048, 1, 4096, 128, 128, 4096, 2048]
    - [78, 7.323]
  - - [128, 2048, 1, 8192, 128, 128, 8192, 2048]
    - [67, 9.691]
  - - [128, 4096, 1, 128, 128, 128, 128, 4096]
    - [71, 1.939]
  - - [128, 4096, 1, 256, 128, 128, 256, 4096]
    - [71, 3.224]
  - - [128, 4096, 1, 512, 128, 128, 512, 4096]
    - [21, 5.027]
  - - [128, 4096, 1, 1024, 128, 128, 1024, 4096]
    - [77, 7.161]
  - - [128, 4096, 1, 2048, 128, 128, 2048, 4096]
    - [20, 8.834]
  - - [128, 4096, 1, 4096, 128, 128, 4096, 4096]
    - [11, 10.623]
  - - [128, 4096, 1, 8192, 128, 128, 8192, 4096]
    - [11, 13.434]
  - - [128, 8192, 1, 128, 128, 128, 128, 8192]
    - [65, 2.913]
  - - [128, 8192, 1, 256, 128, 128, 256, 8192]
    - [66, 4.96]
  - - [128, 8192, 1, 512, 128, 128, 512, 8192]
    - [67, 7.513]
  - - [128, 8192, 1, 1024, 128, 128, 1024, 8192]
    - [66, 9.822]
  - - [128, 8192, 1, 2048, 128, 128, 2048, 8192]
    - [67, 11.195]
  - - [128, 8192, 1, 4096, 128, 128, 4096, 8192]
    - [11, 14.091]
  - - [128, 8192, 1, 8192, 128, 128, 8192, 8192]
    - [14, 15.287]
  - - [256, 128, 1, 128, 256, 256, 128, 128]
    - [18, 0.171]
  - - [256, 128, 1, 256, 256, 256, 256, 128]
    - [18, 0.315]
  - - [256, 128, 1, 512, 256, 256, 512, 128]
    - [18, 0.522]
  - - [256, 128, 1, 1024, 256, 256, 1024, 128]
    - [84, 0.789]
  - - [256, 128, 1, 2048, 256, 256, 2048, 128]
    - [30, 1.151]
  - - [256, 128, 1, 4096, 256, 256, 4096, 128]
    - [74, 1.728]
  - - [256, 128, 1, 8192, 256, 256, 8192, 128]
    - [83, 2.715]
  - - [256, 256, 1, 128, 256, 256, 128, 256]
    - [76, 0.343]
  - - [256, 256, 1, 256, 256, 256, 256, 256]
    - [18, 0.619]
  - - [256, 256, 1, 512, 256, 256, 512, 256]
    - [76, 1.025]
  - - [256, 256, 1, 1024, 256, 256, 1024, 256]
    - [30, 1.56]
  - - [256, 256, 1, 2048, 256, 256, 2048, 256]
    - [30, 2.081]
  - - [256, 256, 1, 4096, 256, 256, 4096, 256]
    - [83, 2.958]
  - - [256, 256, 1, 8192, 256, 256, 8192, 256]
    - [81, 4.481]
  - - [256, 512, 1, 128, 256, 256, 128, 512]
    - [17, 0.639]
  - - [256, 512, 1, 256, 256, 256, 256, 512]
    - [17, 1.126]
  - - [256, 512, 1, 512, 256, 256, 512, 512]
    - [27, 1.85]
  - - [256, 512, 1, 1024, 256, 256, 1024, 512]
    - [27, 2.769]
  - - [256, 512, 1, 2048, 256, 256, 2048, 512]
    - [27, 3.624]
  - - [256, 512, 1, 4096, 256, 256, 4096, 512]
    - [24, 4.927]
  - - [256, 512, 1, 8192, 256, 256, 8192, 512]
    - [80, 6.982]
  - - [256, 1024, 1, 128, 256, 256, 128, 1024]
    - [15, 1.15]
  - - [256, 1024, 1, 256, 256, 256, 256, 1024]
    - [15, 1.989]
  - - [256, 1024, 1, 512, 256, 256, 512, 1024]
    - [81, 3.194]
  - - [256, 1024, 1, 1024, 256, 256, 1024, 1024]
    - [81, 4.661]
  - - [256, 1024, 1, 2048, 256, 256, 2048, 1024]
    - [25, 5.944]
  - - [256, 1024, 1, 4096, 256, 256, 4096, 1024]
    - [23, 7.73]
  - - [256, 1024, 1, 8192, 256, 256, 8192, 1024]
    - [13, 9.681]
  - - [256, 2048, 1, 128, 256, 256, 128, 2048]
    - [72, 1.906]
  - - [256, 2048, 1, 256, 256, 256, 256, 2048]
    - [72, 3.235]
  - - [256, 2048, 1, 512, 256, 256, 512, 2048]
    - [78, 4.979]
  - - [256, 2048, 1, 1024, 256, 256, 1024, 2048]
    - [77, 7.072]
  - - [256, 2048, 1, 2048, 256, 256, 2048, 2048]
    - [77, 8.823]
  - - [256, 2048, 1, 4096, 256, 256, 4096, 2048]
    - [11, 10.389]
  - - [256, 2048, 1, 8192, 256, 256, 8192, 2048]
    - [14, 13.009]
  - - [256, 4096, 1, 128, 256, 256, 128, 4096]
    - [66, 2.928]
  - - [256, 4096, 1, 256, 256, 256, 256, 4096]
    - [66, 4.956]
  - - [256, 4096, 1, 512, 256, 256, 512, 4096]
    - [66, 7.526]
  - - [256, 4096, 1, 1024, 256, 256, 1024, 4096]
    - [66, 10.208]
  - - [256, 4096, 1, 2048, 256, 256, 2048, 4096]
    - [70, 11.162]
  - - [256, 4096, 1, 4096, 256, 256, 4096, 4096]
    - [11, 13.642]
  - - [256, 4096, 1, 8192, 256, 256, 8192, 4096]
    - [70, 15.328]
  - - [256, 8192, 1, 128, 256, 256, 128, 8192]
    - [53, 4.154]
  - - [256, 8192, 1, 256, 256, 256, 256, 8192]
    - [53, 6.704]
  - - [256, 8192, 1, 512, 256, 256, 512, 8192]
    - [52, 9.461]
  - - [256, 8192, 1, 1024, 256, 256, 1024, 8192]
    - [60, 11.826]
  - - [256, 8192, 1, 2048, 256, 256, 2048, 8192]
    - [11, 13.079]
  - - [256, 8192, 1, 4096, 256, 256, 4096, 8192]
    - [62, 15.533]
  - - [256, 8192, 1, 8192, 256, 256, 8192, 8192]
    - [61, 17.307]
  - - [512, 128, 1, 128, 512, 512, 128, 128]
    - [76, 0.345]
  - - [512, 128, 1, 256, 512, 512, 256, 128]
    - [76, 0.622]
  - - [512, 128, 1, 512, 512, 512, 512, 128]
    - [30, 1.035]
  - - [512, 128, 1, 1024, 512, 512, 1024, 128]
    - [30, 1.562]
  - - [512, 128, 1, 2048, 512, 512, 2048, 128]
    - [30, 2.075]
  - - [512, 128, 1, 4096, 512, 512, 4096, 128]
    - [27, 2.957]
  - - [512, 128, 1, 8192, 512, 512, 8192, 128]
    - [82, 4.492]
  - - [512, 256, 1, 128, 512, 512, 128, 256]
    - [16, 0.638]
  - - [512, 256, 1, 256, 512, 512, 256, 256]
    - [27, 1.122]
  - - [512, 256, 1, 512, 512, 512, 512, 256]
    - [27, 1.849]
  - - [512, 256, 1, 1024, 512, 512, 1024, 256]
    - [27, 2.763]
  - - [512, 256, 1, 2048, 512, 512, 2048, 256]
    - [83, 3.62]
  - - [512, 256, 1, 4096, 512, 512, 4096, 256]
    - [24, 4.913]
  - - [512, 256, 1, 8192, 512, 512, 8192, 256]
    - [21, 6.915]
  - - [512, 512, 1, 128, 512, 512, 128, 512]
    - [73, 1.148]
  - - [512, 512, 1, 256, 512, 512, 256, 512]
    - [15, 1.979]
  - - [512, 512, 1, 512, 512, 512, 512, 512]
    - [81, 3.186]
  - - [512, 512, 1, 1024, 512, 512, 1024, 512]
    - [81, 4.652]
  - - [512, 512, 1, 2048, 512, 512, 2048, 512]
    - [24, 5.983]
  - - [512, 512, 1, 4096, 512, 512, 4096, 512]
    - [21, 7.727]
  - - [512, 512, 1, 8192, 512, 512, 8192, 512]
    - [11, 9.652]
  - - [512, 1024, 1, 128, 512, 512, 128, 1024]
    - [71, 1.917]
  - - [512, 1024, 1, 256, 512, 512, 256, 1024]
    - [71, 3.229]
  - - [512, 1024, 1, 512, 512, 512, 512, 1024]
    - [77, 5.007]
  - - [512, 1024, 1, 1024, 512, 512, 1024, 1024]
    - [78, 7.096]
  - - [512, 1024, 1, 2048, 512, 512, 2048, 1024]
    - [23, 8.811]
  - - [512, 1024, 1, 4096, 512, 512, 4096, 1024]
    - [68, 10.303]
  - - [512, 1024, 1, 8192, 512, 512, 8192, 1024]
    - [67, 13.274]
  - - [512, 2048, 1, 128, 512, 512, 128, 2048]
    - [66, 2.91]
  - - [512, 2048, 1, 256, 512, 512, 256, 2048]
    - [66, 4.943]
  - - [512, 2048, 1, 512, 512, 512, 512, 2048]
    - [66, 7.534]
  - - [512, 2048, 1, 1024, 512, 512, 1024, 2048]
    - [67, 10.12]
  - - [512, 2048, 1, 2048, 512, 512, 2048, 2048]
    - [70, 10.978]
  - - [512, 2048, 1, 4096, 512, 512, 4096, 2048]
    - [68, 13.406]
  - - [512, 2048, 1, 8192, 512, 512, 8192, 2048]
    - [68, 15.258]
  - - [512, 4096, 1, 128, 512, 512, 128, 4096]
    - [53, 4.168]
  - - [512, 4096, 1, 256, 512, 512, 256, 4096]
    - [53, 6.725]
  - - [512, 4096, 1, 512, 512, 512, 512, 4096]
    - [53, 9.596]
  - - [512, 4096, 1, 1024, 512, 512, 1024, 4096]
    - [60, 11.864]
  - - [512, 4096, 1, 2048, 512, 512, 2048, 4096]
    - [49, 12.898]
  - - [512, 4096, 1, 4096, 512, 512, 4096, 4096]
    - [9, 15.302]
  - - [512, 4096, 1, 8192, 512, 512, 8192, 4096]
    - [62, 17.234]
  - - [512, 8192, 1, 128, 512, 512, 128, 8192]
    - [34, 5.182]
  - - [512, 8192, 1, 256, 512, 512, 256, 8192]
    - [34, 7.817]
  - - [512, 8192, 1, 512, 512, 512, 512, 8192]
    - [34, 10.734]
  - - [512, 8192, 1, 1024, 512, 512, 1024, 8192]
    - [49, 12.163]
  - - [512, 8192, 1, 2048, 512, 512, 2048, 8192]
    - [42, 14.797]
  - - [512, 8192, 1, 4096, 512, 512, 4096, 8192]
    - [31, 17.226]
  - - [512, 8192, 1, 8192, 512, 512, 8192, 8192]
    - [40, 19.226]
  - - [1024, 128, 1, 128, 1024, 1024, 128, 128]
    - [75, 0.637]
  - - [1024, 128, 1, 256, 1024, 1024, 256, 128]
    - [75, 1.115]
  - - [1024, 128, 1, 512, 1024, 1024, 512, 128]
    - [27, 1.86]
  - - [1024, 128, 1, 1024, 1024, 1024, 1024, 128]
    - [83, 2.741]
  - - [1024, 128, 1, 2048, 1024, 1024, 2048, 128]
    - [27, 3.616]
  - - [1024, 128, 1, 4096, 1024, 1024, 4096, 128]
    - [24, 4.948]
  - - [1024, 128, 1, 8192, 1024, 1024, 8192, 128]
    - [21, 6.875]
  - - [1024, 256, 1, 128, 1024, 1024, 128, 256]
    - [24, 1.139]
  - - [1024, 256, 1, 256, 1024, 1024, 256, 256]
    - [24, 1.983]
  - - [1024, 256, 1, 512, 1024, 1024, 512, 256]
    - [24, 3.229]
  - - [1024, 256, 1, 1024, 1024, 1024, 1024, 256]
    - [24, 4.656]
  - - [1024, 256, 1, 2048, 1024, 1024, 2048, 256]
    - [24, 5.946]
  - - [1024, 256, 1, 4096, 1024, 1024, 4096, 256]
    - [19, 7.498]
  - - [1024, 256, 1, 8192, 1024, 1024, 8192, 256]
    - [14, 9.582]
  - - [1024, 512, 1, 128, 1024, 1024, 128, 512]
    - [57, 1.915]
  - - [1024, 512, 1, 256, 1024, 1024, 256, 512]
    - [72, 3.23]
  - - [1024, 512, 1, 512, 1024, 1024, 512, 512]
    - [20, 4.993]
  - - [1024, 512, 1, 1024, 1024, 1024, 1024, 512]
    - [77, 7.139]
  - - [1024, 512, 1, 2048, 1024, 1024, 2048, 512]
    - [22, 8.93]
  - - [1024, 512, 1, 4096, 1024, 1024, 4096, 512]
    - [68, 10.235]
  - - [1024, 512, 1, 8192, 1024, 1024, 8192, 512]
    - [14, 13.082]
  - - [1024, 1024, 1, 128, 1024, 1024, 128, 1024]
    - [66, 2.919]
  - - [1024, 1024, 1, 256, 1024, 1024, 256, 1024]
    - [66, 4.956]
  - - [1024, 1024, 1, 512, 1024, 1024, 512, 1024]
    - [66, 7.537]
  - - [1024, 1024, 1, 1024, 1024, 1024, 1024, 1024]
    - [12, 9.909]
  - - [1024, 1024, 1, 2048, 1024, 1024, 2048, 1024]
    - [70, 10.778]
  - - [1024, 1024, 1, 4096, 1024, 1024, 4096, 1024]
    - [70, 13.437]
  - - [1024, 1024, 1, 8192, 1024, 1024, 8192, 1024]
    - [67, 15.43]
  - - [1024, 2048, 1, 128, 1024, 1024, 128, 2048]
    - [53, 4.182]
  - - [1024, 2048, 1, 256, 1024, 1024, 256, 2048]
    - [53, 6.695]
  - - [1024, 2048, 1, 512, 1024, 1024, 512, 2048]
    - [53, 9.627]
  - - [1024, 2048, 1, 1024, 1024, 1024, 1024, 2048]
    - [63, 11.6]
  - - [1024, 2048, 1, 2048, 1024, 1024, 2048, 2048]
    - [49, 12.775]
  - - [1024, 2048, 1, 4096, 1024, 1024, 4096, 2048]
    - [47, 15.272]
  - - [1024, 2048, 1, 8192, 1024, 1024, 8192, 2048]
    - [63, 17.23]
  - - [1024, 4096, 1, 128, 1024, 1024, 128, 4096]
    - [32, 5.178]
  - - [1024, 4096, 1, 256, 1024, 1024, 256, 4096]
    - [32, 7.831]
  - - [1024, 4096, 1, 512, 1024, 1024, 512, 4096]
    - [32, 10.897]
  - - [1024, 4096, 1, 1024, 1024, 1024, 1024, 4096]
    - [49, 11.991]
  - - [1024, 4096, 1, 2048, 1024, 1024, 2048, 4096]
    - [45, 14.53]
  - - [1024, 4096, 1, 4096, 1024, 1024, 4096, 4096]
    - [35, 17.127]
  - - [1024, 4096, 1, 8192, 1024, 1024, 8192, 4096]
    - [37, 19.333]
  - - [1024, 8192, 1, 128, 1024, 1024, 128, 8192]
    - [51, 4.615]
  - - [1024, 8192, 1, 256, 1024, 1024, 256, 8192]
    - [45, 7.472]
  - - [1024, 8192, 1, 512, 1024, 1024, 512, 8192]
    - [59, 10.507]
  - - [1024, 8192, 1, 1024, 1024, 1024, 1024, 8192]
    - [40, 13.51]
  - - [1024, 8192, 1, 2048, 1024, 1024, 2048, 8192]
    - [35, 16.178]
  - - [1024, 8192, 1, 4096, 1024, 1024, 4096, 8192]
    - [40, 18.633]
  - - [1024, 8192, 1, 8192, 1024, 1024, 8192, 8192]
    - [40, 20.374]
  - - [2048, 128, 1, 128, 2048, 2048, 128, 128]
    - [24, 1.152]
  - - [2048, 128, 1, 256, 2048, 2048, 256, 128]
    - [15, 1.991]
  - - [2048, 128, 1, 512, 2048, 2048, 512, 128]
    - [24, 3.197]
  - - [2048, 128, 1, 1024, 2048, 2048, 1024, 128]
    - [24, 4.634]
  - - [2048, 128, 1, 2048, 2048, 2048, 2048, 128]
    - [24, 5.961]
  - - [2048, 128, 1, 4096, 2048, 2048, 4096, 128]
    - [79, 7.298]
  - - [2048, 128, 1, 8192, 2048, 2048, 8192, 128]
    - [11, 9.627]
  - - [2048, 256, 1, 128, 2048, 2048, 128, 256]
    - [72, 1.927]
  - - [2048, 256, 1, 256, 2048, 2048, 256, 256]
    - [72, 3.238]
  - - [2048, 256, 1, 512, 2048, 2048, 512, 256]
    - [77, 5.011]
  - - [2048, 256, 1, 1024, 2048, 2048, 1024, 256]
    - [21, 7.146]
  - - [2048, 256, 1, 2048, 2048, 2048, 2048, 256]
    - [80, 8.93]
  - - [2048, 256, 1, 4096, 2048, 2048, 4096, 256]
    - [14, 10.189]
  - - [2048, 256, 1, 8192, 2048, 2048, 8192, 256]
    - [67, 13.203]
  - - [2048, 512, 1, 128, 2048, 2048, 128, 512]
    - [66, 2.928]
  - - [2048, 512, 1, 256, 2048, 2048, 256, 512]
    - [66, 4.931]
  - - [2048, 512, 1, 512, 2048, 2048, 512, 512]
    - [66, 7.548]
  - - [2048, 512, 1, 1024, 2048, 2048, 1024, 512]
    - [69, 10.103]
  - - [2048, 512, 1, 2048, 2048, 2048, 2048, 512]
    - [11, 10.842]
  - - [2048, 512, 1, 4096, 2048, 2048, 4096, 512]
    - [11, 13.242]
  - - [2048, 512, 1, 8192, 2048, 2048, 8192, 512]
    - [14, 15.385]
  - - [2048, 1024, 1, 128, 2048, 2048, 128, 1024]
    - [53, 4.182]
  - - [2048, 1024, 1, 256, 2048, 2048, 256, 1024]
    - [52, 6.681]
  - - [2048, 1024, 1, 512, 2048, 2048, 512, 1024]
    - [55, 9.53]
  - - [2048, 1024, 1, 1024, 2048, 2048, 1024, 1024]
    - [64, 11.541]
  - - [2048, 1024, 1, 2048, 2048, 2048, 2048, 1024]
    - [48, 12.828]
  - - [2048, 1024, 1, 4096, 2048, 2048, 4096, 1024]
    - [46, 15.273]
  - - [2048, 1024, 1, 8192, 2048, 2048, 8192, 1024]
    - [42, 17.127]
  - - [2048, 2048, 1, 128, 2048, 2048, 128, 2048]
    - [39, 5.14]
  - - [2048, 2048, 1, 256, 2048, 2048, 256, 2048]
    - [41, 7.826]
  - - [2048, 2048, 1, 512, 2048, 2048, 512, 2048]
    - [41, 10.85]
  - - [2048, 2048, 1, 1024, 2048, 2048, 1024, 2048]
    - [49, 11.956]
  - - [2048, 2048, 1, 2048, 2048, 2048, 2048, 2048]
    - [47, 14.457]
  - - [2048, 2048, 1, 4096, 2048, 2048, 4096, 2048]
    - [40, 17.0]
  - - [2048, 2048, 1, 8192, 2048, 2048, 8192, 2048]
    - [31, 19.334]
  - - [2048, 4096, 1, 128, 2048, 2048, 128, 4096]
    - [51, 4.61]
  - - [2048, 4096, 1, 256, 2048, 2048, 256, 4096]
    - [45, 7.425]
  - - [2048, 4096, 1, 512, 2048, 2048, 512, 4096]
    - [58, 10.383]
  - - [2048, 4096, 1, 1024, 2048, 2048, 1024, 4096]
    - [31, 13.693]
  - - [2048, 4096, 1, 2048, 2048, 2048, 2048, 4096]
    - [37, 16.251]
  - - [2048, 4096, 1, 4096, 2048, 2048, 4096, 4096]
    - [33, 18.644]
  - - [2048, 4096, 1, 8192, 2048, 2048, 8192, 4096]
    - [36, 20.423]
  - - [2048, 8192, 1, 128, 2048, 2048, 128, 8192]
    - [53, 5.775]
  - - [2048, 8192, 1, 256, 2048, 2048, 256, 8192]
    - [33, 8.571]
  - - [2048, 8192, 1, 512, 2048, 2048, 512, 8192]
    - [2, 11.719]
  - - [2048, 8192, 1, 1024, 2048, 2048, 1024, 8192]
    - [3, 14.95]
  - - [2048, 8192, 1, 2048, 2048, 2048, 2048, 8192]
    - [3, 17.603]
  - - [2048, 8192, 1, 4096, 2048, 2048, 4096, 8192]
    - [2, 19.595]
  - - [2048, 8192, 1, 8192, 2048, 2048, 8192, 8192]
    - [36, 20.784]
  - - [4096, 128, 1, 128, 4096, 4096, 128, 128]
    - [72, 1.942]
  - - [4096, 128, 1, 256, 4096, 4096, 256, 128]
    - [71, 3.252]
  - - [4096, 128, 1, 512, 4096, 4096, 512, 128]
    - [78, 5.056]
  - - [4096, 128, 1, 1024, 4096, 4096, 1024, 128]
    - [79, 6.991]
  - - [4096, 128, 1, 2048, 4096, 4096, 2048, 128]
    - [20, 8.134]
  - - [4096, 128, 1, 4096, 4096, 4096, 4096, 128]
    - [67, 10.273]
  - - [4096, 128, 1, 8192, 4096, 4096, 8192, 128]
    - [67, 13.294]
  - - [4096, 256, 1, 128, 4096, 4096, 128, 256]
    - [66, 2.95]
  - - [4096, 256, 1, 256, 4096, 4096, 256, 256]
    - [66, 4.954]
  - - [4096, 256, 1, 512, 4096, 4096, 512, 256]
    - [69, 7.444]
  - - [4096, 256, 1, 1024, 4096, 4096, 1024, 256]
    - [69, 10.114]
  - - [4096, 256, 1, 2048, 4096, 4096, 2048, 256]
    - [68, 10.648]
  - - [4096, 256, 1, 4096, 4096, 4096, 4096, 256]
    - [14, 13.407]
  - - [4096, 256, 1, 8192, 4096, 4096, 8192, 256]
    - [13, 15.258]
  - - [4096, 512, 1, 128, 4096, 4096, 128, 512]
    - [53, 4.194]
  - - [4096, 512, 1, 256, 4096, 4096, 256, 512]
    - [54, 6.646]
  - - [4096, 512, 1, 512, 4096, 4096, 512, 512]
    - [56, 9.54]
  - - [4096, 512, 1, 1024, 4096, 4096, 1024, 512]
    - [64, 11.553]
  - - [4096, 512, 1, 2048, 4096, 4096, 2048, 512]
    - [49, 12.77]
  - - [4096, 512, 1, 4096, 4096, 4096, 4096, 512]
    - [47, 15.213]
  - - [4096, 512, 1, 8192, 4096, 4096, 8192, 512]
    - [4, 17.144]
  - - [4096, 1024, 1, 128, 4096, 4096, 128, 1024]
    - [32, 5.137]
  - - [4096, 1024, 1, 256, 4096, 4096, 256, 1024]
    - [43, 7.752]
  - - [4096, 1024, 1, 512, 4096, 4096, 512, 1024]
    - [3, 10.854]
  - - [4096, 1024, 1, 1024, 4096, 4096, 1024, 1024]
    - [49, 11.997]
  - - [4096, 1024, 1, 2048, 4096, 4096, 2048, 1024]
    - [50, 14.384]
  - - [4096, 1024, 1, 4096, 4096, 4096, 4096, 1024]
    - [37, 16.995]
  - - [4096, 1024, 1, 8192, 4096, 4096, 8192, 1024]
    - [6, 19.349]
  - - [4096, 2048, 1, 128, 4096, 4096, 128, 2048]
    - [51, 4.621]
  - - [4096, 2048, 1, 256, 4096, 4096, 256, 2048]
    - [45, 7.318]
  - - [4096, 2048, 1, 512, 4096, 4096, 512, 2048]
    - [58, 10.325]
  - - [4096, 2048, 1, 1024, 4096, 4096, 1024, 2048]
    - [7, 13.288]
  - - [4096, 2048, 1, 2048, 4096, 4096, 2048, 2048]
    - [31, 16.126]
  - - [4096, 2048, 1, 4096, 4096, 4096, 4096, 2048]
    - [31, 18.613]
  - - [4096, 2048, 1, 8192, 4096, 4096, 8192, 2048]
    - [32, 20.41]
  - - [4096, 4096, 1, 128, 4096, 4096, 128, 4096]
    - [52, 5.737]
  - - [4096, 4096, 1, 256, 4096, 4096, 256, 4096]
    - [0, 8.42]
  - - [4096, 4096, 1, 512, 4096, 4096, 512, 4096]
    - [43, 11.728]
  - - [4096, 4096, 1, 1024, 4096, 4096, 1024, 4096]
    - [3, 14.867]
  - - [4096, 4096, 1, 2048, 4096, 4096, 2048, 4096]
    - [41, 17.437]
  - - [4096, 4096, 1, 4096, 4096, 4096, 4096, 4096]
    - [41, 19.563]
  - - [4096, 4096, 1, 8192, 4096, 4096, 8192, 4096]
    - [40, 20.783]
  - - [4096, 8192, 1, 128, 4096, 4096, 128, 8192]
    - [34, 6.542]
  - - [4096, 8192, 1, 256, 4096, 4096, 256, 8192]
    - [43, 9.455]
  - - [4096, 8192, 1, 512, 4096, 4096, 512, 8192]
    - [5, 12.95]
  - - [4096, 8192, 1, 1024, 4096, 4096, 1024, 8192]
    - [3, 16.222]
  - - [4096, 8192, 1, 2048, 4096, 4096, 2048, 8192]
    - [41, 18.234]
  - - [4096, 8192, 1, 4096, 4096, 4096, 4096, 8192]
    - [41, 19.956]
  - - [4096, 8192, 1, 8192, 4096, 4096, 8192, 8192]
    - [41, 21.199]
  - - [8192, 128, 1, 128, 8192, 8192, 128, 128]
    - [10, 2.766]
  - - [8192, 128, 1, 256, 8192, 8192, 256, 128]
    - [66, 4.706]
  - - [8192, 128, 1, 512, 8192, 8192, 512, 128]
    - [66, 7.249]
  - - [8192, 128, 1, 1024, 8192, 8192, 1024, 128]
    - [11, 9.267]
  - - [8192, 128, 1, 2048, 8192, 8192, 2048, 128]
    - [11, 10.489]
  - - [8192, 128, 1, 4096, 8192, 8192, 4096, 128]
    - [14, 13.46]
  - - [8192, 128, 1, 8192, 8192, 8192, 8192, 128]
    - [13, 15.28]
  - - [8192, 256, 1, 128, 8192, 8192, 128, 256]
    - [53, 4.217]
  - - [8192, 256, 1, 256, 8192, 8192, 256, 256]
    - [56, 6.64]
  - - [8192, 256, 1, 512, 8192, 8192, 512, 256]
    - [56, 9.291]
  - - [8192, 256, 1, 1024, 8192, 8192, 1024, 256]
    - [58, 11.081]
  - - [8192, 256, 1, 2048, 8192, 8192, 2048, 256]
    - [8, 12.683]
  - - [8192, 256, 1, 4096, 8192, 8192, 4096, 256]
    - [46, 15.319]
  - - [8192, 256, 1, 8192, 8192, 8192, 8192, 256]
    - [35, 16.968]
  - - [8192, 512, 1, 128, 8192, 8192, 128, 512]
    - [34, 5.171]
  - - [8192, 512, 1, 256, 8192, 8192, 256, 512]
    - [38, 7.751]
  - - [8192, 512, 1, 512, 8192, 8192, 512, 512]
    - [1, 10.714]
  - - [8192, 512, 1, 1024, 8192, 8192, 1024, 512]
    - [45, 11.857]
  - - [8192, 512, 1, 2048, 8192, 8192, 2048, 512]
    - [45, 14.665]
  - - [8192, 512, 1, 4096, 8192, 8192, 4096, 512]
    - [33, 16.997]
  - - [8192, 512, 1, 8192, 8192, 8192, 8192, 512]
    - [33, 19.236]
  - - [8192, 1024, 1, 128, 8192, 8192, 128, 1024]
    - [44, 4.545]
  - - [8192, 1024, 1, 256, 8192, 8192, 256, 1024]
    - [8, 7.294]
  - - [8192, 1024, 1, 512, 8192, 8192, 512, 1024]
    - [64, 10.335]
  - - [8192, 1024, 1, 1024, 8192, 8192, 1024, 1024]
    - [31, 13.38]
  - - [8192, 1024, 1, 2048, 8192, 8192, 2048, 1024]
    - [37, 16.163]
  - - [8192, 1024, 1, 4096, 8192, 8192, 4096, 1024]
    - [2, 18.583]
  - - [8192, 1024, 1, 8192, 8192, 8192, 8192, 1024]
    - [40, 20.339]
  - - [8192, 2048, 1, 128, 8192, 8192, 128, 2048]
    - [53, 5.64]
  - - [8192, 2048, 1, 256, 8192, 8192, 256, 2048]
    - [0, 8.433]
  - - [8192, 2048, 1, 512, 8192, 8192, 512, 2048]
    - [40, 11.731]
  - - [8192, 2048, 1, 1024, 8192, 8192, 1024, 2048]
    - [42, 14.835]
  - - [8192, 2048, 1, 2048, 8192, 8192, 2048, 2048]
    - [43, 17.32]
  - - [8192, 2048, 1, 4096, 8192, 8192, 4096, 2048]
    - [41, 19.558]
  - - [8192, 2048, 1, 8192, 8192, 8192, 8192, 2048]
    - [36, 20.814]
  - - [8192, 4096, 1, 128, 8192, 8192, 128, 4096]
    - [32, 6.534]
  - - [8192, 4096, 1, 256, 8192, 8192, 256, 4096]
    - [43, 9.327]
  - - [8192, 4096, 1, 512, 8192, 8192, 512, 4096]
    - [3, 12.963]
  - - [8192, 4096, 1, 1024, 8192, 8192, 1024, 4096]
    - [41, 16.038]
  - - [8192, 4096, 1, 2048, 8192, 8192, 2048, 4096]
    - [41, 18.239]
  - - [8192, 4096, 1, 4096, 8192, 8192, 4096, 4096]
    - [41, 20.049]
  - - [8192, 4096, 1, 8192, 8192, 8192, 8192, 4096]
    - [41, 21.247]
  - - [8192, 8192, 1, 128, 8192, 8192, 128, 8192]
    - [1, 6.818]
  - - [8192, 8192, 1, 256, 8192, 8192, 256, 8192]
    - [1, 9.736]
  - - [8192, 8192, 1, 512, 8192, 8192, 512, 8192]
    - [3, 13.506]
  - - [8192, 8192, 1, 1024, 8192, 8192, 1024, 8192]
    - [41, 16.555]
  - - [8192, 8192, 1, 2048, 8192, 8192, 2048, 8192]
    - [41, 18.562]
  - - [8192, 8192, 1, 4096, 8192, 8192, 4096, 8192]
    - [41, 20.318]
  - - [8192, 8192, 1, 8192, 8192, 8192, 8192, 8192]
    - [36, 21.403]
  - - [1, 1, 1, 32, 1, 1, 32, 1]
    - [86, 0.0]
- null
- null
- ExperimentalStreamK
- GridBased
