library/src/amd_detail/rocblaslt/src/Tensile/Logic/asm_full/aquavanjaram/gfx942_80cu/StreamK/aquavanjaram942_Cijk_Ailk_Bjlk_HHS_BH_UserArgs.yaml
- {MinimumRequiredVersion: 4.33.0}
- aquavanjaram942
- {Architecture: gfx942, CUCount: 80}
- [Device 0049, Device 0050]
    SolutionIndex: 0
    SolutionNameMin: Cijk_Ailk_Bjlk_HHS_BH_UserArgs_MT256x256x32_MI16x16x1_SN_LDSB1_CLR1_GSU0_GSUC0_GSUWGMRR0_K1_LBSPPA2048_LBSPPB2048_LPA0_LPB16_MIWT8_8_PLR1_SU32_SUM0_SUS256_SKXCCM0_VWA4_VWB1_WGM1_WGMXCC1_WGMXCCGn1
    SolutionIndex: 1
    SolutionNameMin: Cijk_Ailk_Bjlk_HHS_BH_UserArgs_MT256x256x32_MI16x16x1_SN_LDSB1_CLR1_GSU0_GSUC0_GSUWGMRR0_K1_LBSPPA2048_LBSPPB2048_LPA0_LPB32_MIWT8_8_PLR1_SU32_SUM0_SUS256_SKXCCM0_VWA4_VWB2_WGM1_WGMXCC1_WGMXCCGn1
    SolutionIndex: 2
    SolutionNameMin: Cijk_Ailk_Bjlk_HHS_BH_UserArgs_MT256x256x32_MI16x16x1_SN_LDSB0_CLR1_GSU0_GSUC0_GSUWGMRR0_K1_LBSPPA2048_LBSPPB2048_LPA0_LPB0_MIWT8_8_PLR1_SU32_SUM0_SUS256_SKXCCM0_VWA4_VWB8_WGM1_WGMXCC1_WGMXCCGn1
    SolutionIndex: 3
    SolutionNameMin: Cijk_Ailk_Bjlk_HHS_BH_UserArgs_MT256x256x32_MI16x16x1_SN_LDSB1_CLR1_GSU0_GSUC0_GSUWGMRR0_K1_LBSPPA2048_LBSPPB2048_LPA0_LPB32_MIWT8_8_PLR1_SU32_SUM0_SUS256_SKXCCM0_VWA4_VWB2_WGM4_WGMXCC1_WGMXCCGn1
    SolutionIndex: 4
    SolutionNameMin: Cijk_Ailk_Bjlk_HHS_BH_UserArgs_MT256x256x32_MI16x16x1_SN_LDSB0_CLR1_GSU0_GSUC0_GSUWGMRR0_K1_LBSPPA2048_LBSPPB2048_LPA0_LPB0_MIWT8_8_PLR1_SU32_SUM0_SUS256_SKXCCM0_VWA4_VWB4_WGM4_WGMXCC1_WGMXCCGn1
    SolutionIndex: 5
    SolutionNameMin: Cijk_Ailk_Bjlk_HHS_BH_UserArgs_MT256x256x32_MI16x16x1_SN_LDSB0_CLR1_GSU0_GSUC0_GSUWGMRR0_K1_LBSPPA2048_LBSPPB2048_LPA0_LPB0_MIWT8_8_PLR1_SU32_SUM0_SUS256_SKXCCM0_VWA8_VWB4_WGM4_WGMXCC1_WGMXCCGn1
    SolutionIndex: 6
    SolutionNameMin: Cijk_Ailk_Bjlk_HHS_BH_UserArgs_MT256x256x32_MI16x16x1_SN_LDSB0_CLR1_GSU0_GSUC0_GSUWGMRR0_K1_LBSPPA2048_LBSPPB2048_LPA0_LPB0_MIWT8_8_PLR1_SU32_SUM0_SUS256_SKXCCM0_VWA8_VWB8_WGM4_WGMXCC1_WGMXCCGn1
    SolutionIndex: 7
    SolutionNameMin: Cijk_Ailk_Bjlk_HHS_BH_UserArgs_MT128x256x32_MI16x16x1_SN_LDSB1_CLR1_GSU0_GSUC0_GSUWGMRR0_K1_LBSPPA1024_LBSPPB2048_LPA0_LPB32_MIWT4_8_PLR1_SU32_SUM0_SUS256_SKXCCM0_VWA4_VWB2_WGM1_WGMXCC1_WGMXCCGn1
    SolutionIndex: 8
    SolutionNameMin: Cijk_Ailk_Bjlk_HHS_BH_UserArgs_MT128x256x32_MI16x16x1_SN_LDSB1_CLR1_GSU0_GSUC0_GSUWGMRR0_K1_LBSPPA1024_LBSPPB2048_LPA0_LPB0_MIWT4_8_PLR1_SU32_SUM0_SUS256_SKXCCM0_VWA4_VWB4_WGM2_WGMXCC1_WGMXCCGn1
    SolutionIndex: 9
    SolutionNameMin: Cijk_Ailk_Bjlk_HHS_BH_UserArgs_MT128x256x32_MI16x16x1_SN_LDSB1_CLR1_GSU0_GSUC0_GSUWGMRR0_K1_LBSPPA1024_LBSPPB2048_LPA0_LPB0_MIWT4_8_PLR1_SU32_SUM0_SUS256_SKXCCM0_VWA4_VWB8_WGM2_WGMXCC1_WGMXCCGn1
    SolutionIndex: 10
    SolutionNameMin: Cijk_Ailk_Bjlk_HHS_BH_UserArgs_MT256x128x32_MI16x16x1_SN_LDSB1_CLR1_GSU0_GSUC0_GSUWGMRR0_K1_LBSPPA2048_LBSPPB1024_LPA0_LPB32_MIWT8_4_PLR1_SU32_SUM0_SUS256_SKXCCM0_VWA4_VWB2_WGM1_WGMXCC1_WGMXCCGn1
    SolutionIndex: 11
    SolutionNameMin: Cijk_Ailk_Bjlk_HHS_BH_UserArgs_MT256x128x32_MI16x16x1_SN_LDSB1_CLR1_GSU0_GSUC0_GSUWGMRR0_K1_LBSPPA2048_LBSPPB1024_LPA0_LPB32_MIWT8_4_PLR1_SU32_SUM0_SUS256_SKXCCM0_VWA4_VWB2_WGM4_WGMXCC1_WGMXCCGn1
    SolutionIndex: 12
    SolutionNameMin: Cijk_Ailk_Bjlk_HHS_BH_UserArgs_MT32x32x32_MI16x16x1_SN_LDSB0_CLR1_GSU0_GSUC0_GSUWGMRR0_K1_LBSPPA256_LBSPPB256_LPA16_LPB16_MIWT1_1_PLR1_SU32_SUM0_SUS256_SKXCCM0_VWA1_VWB1_WGM1_WGMXCC1_WGMXCCGn1
    SolutionIndex: 13
    SolutionNameMin: Cijk_Ailk_Bjlk_HHS_BH_UserArgs_MT256x256x64_MI16x16x1_SN_LDSB1_CLR1_GSU0_GSUC0_GSUWGMRR0_K1_LBSPPA2048_LBSPPB2048_LPA0_LPB0_MIWT8_8_PLR1_SU32_SUM0_SUS256_SKXCCM0_VWA4_VWB4_WGM1_WGMXCC1_WGMXCCGn1
    SolutionIndex: 14
    SolutionNameMin: Cijk_Ailk_Bjlk_HHS_BH_UserArgs_MT256x256x64_MI16x16x1_SN_LDSB1_CLR1_GSU0_GSUC0_GSUWGMRR0_K1_LBSPPA2048_LBSPPB2048_LPA0_LPB0_MIWT8_8_PLR1_SU32_SUM0_SUS256_SKXCCM0_VWA4_VWB4_WGM4_WGMXCC1_WGMXCCGn1
    SolutionIndex: 15
    SolutionNameMin: Cijk_Ailk_Bjlk_HHS_BH_UserArgs_MT256x128x64_MI16x16x1_SN_LDSB1_CLR1_GSU0_GSUC0_GSUWGMRR0_K1_LBSPPA2048_LBSPPB1024_LPA0_LPB32_MIWT8_4_PLR1_SU32_SUM0_SUS256_SKXCCM0_VWA4_VWB2_WGM1_WGMXCC1_WGMXCCGn1
    SolutionIndex: 16
    SolutionNameMin: Cijk_Ailk_Bjlk_HHS_BH_UserArgs_MT128x128x64_MI16x16x1_SN_LDSB1_CLR1_GSU0_GSUC0_GSUWGMRR0_K1_LBSPPA1024_LBSPPB1024_LPA0_LPB0_MIWT4_4_PLR1_SU32_SUM0_SUS256_SKXCCM0_VWA4_VWB4_WGM1_WGMXCC1_WGMXCCGn1
    SolutionIndex: 17
    SolutionNameMin: Cijk_Ailk_Bjlk_HHS_BH_UserArgs_MT128x128x64_MI16x16x1_SN_LDSB1_CLR1_GSU0_GSUC0_GSUWGMRR0_K1_LBSPPA1024_LBSPPB1024_LPA0_LPB0_MIWT4_4_PLR1_SU32_SUM0_SUS256_SKXCCM0_VWA4_VWB4_WGM2_WGMXCC1_WGMXCCGn1
    SolutionIndex: 18
    SolutionNameMin: Cijk_Ailk_Bjlk_HHS_BH_UserArgs_MT128x128x64_MI16x16x1_SN_LDSB1_CLR1_GSU0_GSUC0_GSUWGMRR0_K1_LBSPPA1024_LBSPPB1024_LPA0_LPB0_MIWT4_4_PLR1_SU32_SUM0_SUS256_SKXCCM0_VWA4_VWB4_WGM4_WGMXCC1_WGMXCCGn1
    SolutionIndex: 19
    SolutionNameMin: Cijk_Ailk_Bjlk_HHS_BH_UserArgs_MT128x64x64_MI16x16x1_SN_LDSB1_CLR1_GSU0_GSUC0_GSUWGMRR0_K1_LBSPPA1024_LBSPPB512_LPA0_LPB32_MIWT4_2_PLR2_SU32_SUM0_SUS256_SKXCCM0_VWA4_VWB2_WGM1_WGMXCC1_WGMXCCGn1
    SolutionIndex: 20
    SolutionNameMin: Cijk_Ailk_Bjlk_HHS_BH_UserArgs_MT64x64x64_MI16x16x1_SN_LDSB1_CLR1_GSU0_GSUC0_GSUWGMRR0_K1_LBSPPA512_LBSPPB512_LPA32_LPB32_MIWT2_2_PLR1_SU32_SUM0_SUS256_SKXCCM0_VWA2_VWB2_WGM1_WGMXCC1_WGMXCCGn1
    SolutionIndex: 21
    SolutionNameMin: Cijk_Ailk_Bjlk_HHS_BH_UserArgs_MT64x64x64_MI16x16x1_SN_LDSB1_CLR1_GSU0_GSUC0_GSUWGMRR0_K1_LBSPPA512_LBSPPB512_LPA32_LPB32_MIWT2_2_PLR2_SU32_SUM0_SUS256_SKXCCM0_VWA2_VWB2_WGM1_WGMXCC1_WGMXCCGn1
    SolutionIndex: 22
    SolutionNameMin: Cijk_Ailk_Bjlk_HHS_BH_UserArgs_MT64x32x64_MI16x16x1_SN_LDSB0_CLR1_GSU0_GSUC0_GSUWGMRR0_K1_LBSPPA512_LBSPPB256_LPA32_LPB16_MIWT2_1_PLR2_SU32_SUM0_SUS256_SKXCCM0_VWA2_VWB1_WGM1_WGMXCC1_WGMXCCGn1
    SolutionIndex: 23
    SolutionNameMin: Cijk_Ailk_Bjlk_HHS_BH_UserArgs_MT32x32x64_MI16x16x1_SN_LDSB0_CLR1_GSU0_GSUC0_GSUWGMRR0_K1_LBSPPA256_LBSPPB256_LPA16_LPB16_MIWT1_1_PLR1_SU32_SUM0_SUS256_SKXCCM0_VWA1_VWB1_WGM1_WGMXCC1_WGMXCCGn1
    SolutionIndex: 24
    SolutionNameMin: Cijk_Ailk_Bjlk_HHS_BH_UserArgs_MT32x32x64_MI16x16x1_SN_LDSB0_CLR1_GSU0_GSUC0_GSUWGMRR0_K1_LBSPPA256_LBSPPB256_LPA16_LPB16_MIWT1_1_PLR2_SU32_SUM0_SUS256_SKXCCM0_VWA1_VWB1_WGM1_WGMXCC1_WGMXCCGn1
    SolutionIndex: 25
    SolutionNameMin: Cijk_Ailk_Bjlk_HHS_BH_UserArgs_MT128x128x128_MI16x16x1_SN_LDSB1_CLR1_GSU0_GSUC0_GSUWGMRR0_K1_LBSPPA1024_LBSPPB1024_LPA0_LPB0_MIWT4_4_PLR1_SU32_SUM0_SUS256_SKXCCM0_VWA4_VWB4_WGM1_WGMXCC1_WGMXCCGn1
    SolutionIndex: 26
    SolutionNameMin: Cijk_Ailk_Bjlk_HHS_BH_UserArgs_MT128x128x128_MI16x16x1_SN_LDSB1_CLR1_GSU0_GSUC0_GSUWGMRR0_K1_LBSPPA1024_LBSPPB1024_LPA0_LPB0_MIWT4_4_PLR1_SU32_SUM0_SUS256_SKXCCM0_VWA4_VWB4_WGM2_WGMXCC1_WGMXCCGn1
    SolutionIndex: 27
    SolutionNameMin: Cijk_Ailk_Bjlk_HHS_BH_UserArgs_MT64x128x128_MI16x16x1_SN_LDSB1_CLR1_GSU0_GSUC0_GSUWGMRR0_K1_LBSPPA512_LBSPPB1024_LPA32_LPB0_MIWT2_4_PLR2_SU32_SUM0_SUS256_SKXCCM0_VWA2_VWB4_WGM1_WGMXCC1_WGMXCCGn1
    SolutionIndex: 28
    SolutionNameMin: Cijk_Ailk_Bjlk_HHS_BH_UserArgs_MT64x64x128_MI16x16x1_SN_LDSB1_CLR1_GSU0_GSUC0_GSUWGMRR0_K1_LBSPPA512_LBSPPB512_LPA32_LPB32_MIWT2_2_PLR2_SU32_SUM0_SUS256_SKXCCM0_VWA2_VWB2_WGM1_WGMXCC1_WGMXCCGn1
    SolutionIndex: 29
    SolutionNameMin: Cijk_Ailk_Bjlk_HHS_BH_UserArgs_MT64x64x128_MI16x16x1_SN_LDSB1_CLR1_GSU0_GSUC0_GSUWGMRR0_K1_LBSPPA512_LBSPPB512_LPA32_LPB32_MIWT2_2_PLR2_SU32_SUM0_SUS256_SKXCCM0_VWA2_VWB2_WGM2_WGMXCC1_WGMXCCGn1
    SolutionIndex: 30
    SolutionNameMin: Cijk_Ailk_Bjlk_HHS_BH_UserArgs_MT32x64x128_MI16x16x1_SN_LDSB1_CLR1_GSU0_GSUC0_GSUWGMRR0_K1_LBSPPA256_LBSPPB512_LPA16_LPB32_MIWT1_2_PLR2_SU32_SUM0_SUS256_SKXCCM0_VWA1_VWB2_WGM1_WGMXCC1_WGMXCCGn1
    SolutionIndex: 31
    SolutionNameMin: Cijk_Ailk_Bjlk_HHS_BH_UserArgs_MT64x32x128_MI16x16x1_SN_LDSB1_CLR1_GSU0_GSUC0_GSUWGMRR0_K1_LBSPPA512_LBSPPB256_LPA32_LPB16_MIWT2_1_PLR2_SU32_SUM0_SUS256_SKXCCM0_VWA2_VWB1_WGM1_WGMXCC1_WGMXCCGn1
    SolutionIndex: 32
    SolutionNameMin: Cijk_Ailk_Bjlk_HHS_BH_UserArgs_MT32x32x128_MI16x16x1_SN_LDSB1_CLR1_GSU0_GSUC0_GSUWGMRR0_K1_LBSPPA256_LBSPPB256_LPA16_LPB16_MIWT1_1_PLR1_SU32_SUM0_SUS256_SKXCCM0_VWA1_VWB1_WGM1_WGMXCC1_WGMXCCGn1
    SolutionIndex: 33
    SolutionNameMin: Cijk_Ailk_Bjlk_HHS_BH_UserArgs_MT256x256x32_MI16x16x1_SN_LDSB1_CLR1_GSU0_GSUC0_GSUWGMRR0_K1_LBSPPA2048_LBSPPB2048_LPA0_LPB32_MIWT8_8_PLR1_SU32_SUM0_SUS256_SKXCCM4_VWA4_VWB2_WGM1_WGMXCC1_WGMXCCGn1
    SolutionIndex: 34
    SolutionNameMin: Cijk_Ailk_Bjlk_HHS_BH_UserArgs_MT256x256x32_MI16x16x1_SN_LDSB1_CLR1_GSU0_GSUC0_GSUWGMRR0_K1_LBSPPA2048_LBSPPB2048_LPA0_LPB32_MIWT8_8_PLR1_SU32_SUM0_SUS256_SKXCCM4_VWA8_VWB2_WGM1_WGMXCC1_WGMXCCGn1
    SolutionIndex: 35
    SolutionNameMin: Cijk_Ailk_Bjlk_HHS_BH_UserArgs_MT256x256x32_MI16x16x1_SN_LDSB0_CLR1_GSU0_GSUC0_GSUWGMRR0_K1_LBSPPA2048_LBSPPB2048_LPA0_LPB0_MIWT8_8_PLR1_SU32_SUM0_SUS256_SKXCCM4_VWA4_VWB4_WGM1_WGMXCC1_WGMXCCGn1
    SolutionIndex: 36
    SolutionNameMin: Cijk_Ailk_Bjlk_HHS_BH_UserArgs_MT256x256x32_MI16x16x1_SN_LDSB0_CLR1_GSU0_GSUC0_GSUWGMRR0_K1_LBSPPA2048_LBSPPB2048_LPA0_LPB0_MIWT8_8_PLR1_SU32_SUM0_SUS256_SKXCCM4_VWA8_VWB4_WGM1_WGMXCC1_WGMXCCGn1
    SolutionIndex: 37
    SolutionNameMin: Cijk_Ailk_Bjlk_HHS_BH_UserArgs_MT256x256x32_MI16x16x1_SN_LDSB1_CLR1_GSU0_GSUC0_GSUWGMRR0_K1_LBSPPA2048_LBSPPB2048_LPA32_LPB0_MIWT8_8_PLR1_SU32_SUM0_SUS256_SKXCCM4_VWA2_VWB8_WGM1_WGMXCC1_WGMXCCGn1
    SolutionIndex: 38
    SolutionNameMin: Cijk_Ailk_Bjlk_HHS_BH_UserArgs_MT256x256x32_MI16x16x1_SN_LDSB0_CLR1_GSU0_GSUC0_GSUWGMRR0_K1_LBSPPA2048_LBSPPB2048_LPA0_LPB0_MIWT8_8_PLR1_SU32_SUM0_SUS256_SKXCCM4_VWA4_VWB8_WGM1_WGMXCC1_WGMXCCGn1
    SolutionIndex: 39
    SolutionNameMin: Cijk_Ailk_Bjlk_HHS_BH_UserArgs_MT256x256x32_MI16x16x1_SN_LDSB0_CLR1_GSU0_GSUC0_GSUWGMRR0_K1_LBSPPA2048_LBSPPB2048_LPA0_LPB0_MIWT8_8_PLR1_SU32_SUM0_SUS256_SKXCCM4_VWA8_VWB8_WGM1_WGMXCC1_WGMXCCGn1
    SolutionIndex: 40
    SolutionNameMin: Cijk_Ailk_Bjlk_HHS_BH_UserArgs_MT256x256x32_MI16x16x1_SN_LDSB1_CLR1_GSU0_GSUC0_GSUWGMRR0_K1_LBSPPA2048_LBSPPB2048_LPA0_LPB32_MIWT8_8_PLR1_SU32_SUM0_SUS256_SKXCCM4_VWA4_VWB2_WGM2_WGMXCC1_WGMXCCGn1
    SolutionIndex: 41
    SolutionNameMin: Cijk_Ailk_Bjlk_HHS_BH_UserArgs_MT256x256x32_MI16x16x1_SN_LDSB1_CLR1_GSU0_GSUC0_GSUWGMRR0_K1_LBSPPA2048_LBSPPB2048_LPA0_LPB32_MIWT8_8_PLR1_SU32_SUM0_SUS256_SKXCCM4_VWA8_VWB2_WGM2_WGMXCC1_WGMXCCGn1
    SolutionIndex: 42
    SolutionNameMin: Cijk_Ailk_Bjlk_HHS_BH_UserArgs_MT256x256x32_MI16x16x1_SN_LDSB1_CLR1_GSU0_GSUC0_GSUWGMRR0_K1_LBSPPA2048_LBSPPB2048_LPA32_LPB0_MIWT8_8_PLR1_SU32_SUM0_SUS256_SKXCCM4_VWA2_VWB4_WGM2_WGMXCC1_WGMXCCGn1
    SolutionIndex: 43
    SolutionNameMin: Cijk_Ailk_Bjlk_HHS_BH_UserArgs_MT256x256x32_MI16x16x1_SN_LDSB0_CLR1_GSU0_GSUC0_GSUWGMRR0_K1_LBSPPA2048_LBSPPB2048_LPA0_LPB0_MIWT8_8_PLR1_SU32_SUM0_SUS256_SKXCCM4_VWA4_VWB4_WGM2_WGMXCC1_WGMXCCGn1
    SolutionIndex: 44
    SolutionNameMin: Cijk_Ailk_Bjlk_HHS_BH_UserArgs_MT256x256x32_MI16x16x1_SN_LDSB0_CLR1_GSU0_GSUC0_GSUWGMRR0_K1_LBSPPA2048_LBSPPB2048_LPA0_LPB0_MIWT8_8_PLR1_SU32_SUM0_SUS256_SKXCCM4_VWA4_VWB8_WGM2_WGMXCC1_WGMXCCGn1
    SolutionIndex: 45
    SolutionNameMin: Cijk_Ailk_Bjlk_HHS_BH_UserArgs_MT256x256x32_MI16x16x1_SN_LDSB0_CLR1_GSU0_GSUC0_GSUWGMRR0_K1_LBSPPA2048_LBSPPB2048_LPA0_LPB0_MIWT8_8_PLR1_SU32_SUM0_SUS256_SKXCCM4_VWA8_VWB8_WGM2_WGMXCC1_WGMXCCGn1
    SolutionIndex: 46
    SolutionNameMin: Cijk_Ailk_Bjlk_HHS_BH_UserArgs_MT256x256x32_MI16x16x1_SN_LDSB0_CLR1_GSU0_GSUC0_GSUWGMRR0_K1_LBSPPA2048_LBSPPB2048_LPA0_LPB0_MIWT8_8_PLR1_SU32_SUM0_SUS256_SKXCCM4_VWA4_VWB4_WGM4_WGMXCC1_WGMXCCGn1
    SolutionIndex: 47
    SolutionNameMin: Cijk_Ailk_Bjlk_HHS_BH_UserArgs_MT256x256x32_MI16x16x1_SN_LDSB0_CLR1_GSU0_GSUC0_GSUWGMRR0_K1_LBSPPA2048_LBSPPB2048_LPA0_LPB0_MIWT8_8_PLR1_SU32_SUM0_SUS256_SKXCCM4_VWA4_VWB8_WGM4_WGMXCC1_WGMXCCGn1
    SolutionIndex: 48
    SolutionNameMin: Cijk_Ailk_Bjlk_HHS_BH_UserArgs_MT256x256x32_MI16x16x1_SN_LDSB0_CLR1_GSU0_GSUC0_GSUWGMRR0_K1_LBSPPA2048_LBSPPB2048_LPA0_LPB0_MIWT8_8_PLR1_SU32_SUM0_SUS256_SKXCCM4_VWA8_VWB8_WGM4_WGMXCC1_WGMXCCGn1
    SolutionIndex: 49
    SolutionNameMin: Cijk_Ailk_Bjlk_HHS_BH_UserArgs_MT128x256x32_MI16x16x1_SN_LDSB1_CLR1_GSU0_GSUC0_GSUWGMRR0_K1_LBSPPA1024_LBSPPB2048_LPA0_LPB0_MIWT4_8_PLR1_SU32_SUM0_SUS256_SKXCCM4_VWA4_VWB8_WGM1_WGMXCC1_WGMXCCGn1
    SolutionIndex: 50
    SolutionNameMin: Cijk_Ailk_Bjlk_HHS_BH_UserArgs_MT128x256x32_MI16x16x1_SN_LDSB1_CLR1_GSU0_GSUC0_GSUWGMRR0_K1_LBSPPA1024_LBSPPB2048_LPA0_LPB0_MIWT4_8_PLR1_SU32_SUM0_SUS256_SKXCCM4_VWA4_VWB8_WGM4_WGMXCC1_WGMXCCGn1
    SolutionIndex: 51
    SolutionNameMin: Cijk_Ailk_Bjlk_HHS_BH_UserArgs_MT256x128x32_MI16x16x1_SN_LDSB1_CLR1_GSU0_GSUC0_GSUWGMRR0_K1_LBSPPA2048_LBSPPB1024_LPA0_LPB16_MIWT8_4_PLR1_SU32_SUM0_SUS256_SKXCCM4_VWA8_VWB1_WGM1_WGMXCC1_WGMXCCGn1
    SolutionIndex: 52
    SolutionNameMin: Cijk_Ailk_Bjlk_HHS_BH_UserArgs_MT256x128x32_MI16x16x1_SN_LDSB1_CLR1_GSU0_GSUC0_GSUWGMRR0_K1_LBSPPA2048_LBSPPB1024_LPA0_LPB32_MIWT8_4_PLR1_SU32_SUM0_SUS256_SKXCCM4_VWA4_VWB2_WGM1_WGMXCC1_WGMXCCGn1
    SolutionIndex: 53
    SolutionNameMin: Cijk_Ailk_Bjlk_HHS_BH_UserArgs_MT256x128x32_MI16x16x1_SN_LDSB1_CLR1_GSU0_GSUC0_GSUWGMRR0_K1_LBSPPA2048_LBSPPB1024_LPA0_LPB32_MIWT8_4_PLR1_SU32_SUM0_SUS256_SKXCCM4_VWA8_VWB2_WGM1_WGMXCC1_WGMXCCGn1
    SolutionIndex: 54
    SolutionNameMin: Cijk_Ailk_Bjlk_HHS_BH_UserArgs_MT256x128x32_MI16x16x1_SN_LDSB1_CLR1_GSU0_GSUC0_GSUWGMRR0_K1_LBSPPA2048_LBSPPB1024_LPA0_LPB0_MIWT8_4_PLR1_SU32_SUM0_SUS256_SKXCCM4_VWA4_VWB4_WGM1_WGMXCC1_WGMXCCGn1
    SolutionIndex: 55
    SolutionNameMin: Cijk_Ailk_Bjlk_HHS_BH_UserArgs_MT256x64x32_MI16x16x1_SN_LDSB1_CLR1_GSU0_GSUC0_GSUWGMRR0_K1_LBSPPA2048_LBSPPB512_LPA0_LPB32_MIWT8_2_PLR1_SU32_SUM0_SUS256_SKXCCM4_VWA8_VWB2_WGM1_WGMXCC1_WGMXCCGn1
    SolutionIndex: 56
    SolutionNameMin: Cijk_Ailk_Bjlk_HHS_BH_UserArgs_MT128x128x32_MI16x16x1_SN_LDSB0_CLR1_GSU0_GSUC0_GSUWGMRR0_K1_LBSPPA1024_LBSPPB1024_LPA0_LPB0_MIWT4_4_PLR1_SU32_SUM0_SUS256_SKXCCM4_VWA4_VWB4_WGM1_WGMXCC1_WGMXCCGn1
    SolutionIndex: 57
    SolutionNameMin: Cijk_Ailk_Bjlk_HHS_BH_UserArgs_MT128x64x32_MI16x16x1_SN_LDSB0_CLR1_GSU0_GSUC0_GSUWGMRR0_K1_LBSPPA1024_LBSPPB512_LPA0_LPB16_MIWT4_2_PLR1_SU32_SUM0_SUS256_SKXCCM4_VWA4_VWB1_WGM1_WGMXCC1_WGMXCCGn1
    SolutionIndex: 58
    SolutionNameMin: Cijk_Ailk_Bjlk_HHS_BH_UserArgs_MT128x64x32_MI16x16x1_SN_LDSB0_CLR1_GSU0_GSUC0_GSUWGMRR0_K1_LBSPPA1024_LBSPPB512_LPA0_LPB32_MIWT4_2_PLR1_SU32_SUM0_SUS256_SKXCCM4_VWA4_VWB2_WGM1_WGMXCC1_WGMXCCGn1
    SolutionIndex: 59
    SolutionNameMin: Cijk_Ailk_Bjlk_HHS_BH_UserArgs_MT32x32x32_MI16x16x1_SN_LDSB0_CLR1_GSU0_GSUC0_GSUWGMRR0_K1_LBSPPA256_LBSPPB256_LPA16_LPB16_MIWT1_1_PLR1_SU32_SUM0_SUS256_SKXCCM4_VWA1_VWB1_WGM1_WGMXCC1_WGMXCCGn1
    SolutionIndex: 60
    SolutionNameMin: Cijk_Ailk_Bjlk_HHS_BH_UserArgs_MT32x32x32_MI16x16x1_SN_LDSB0_CLR0_GSU0_GSUC0_GSUWGMRR0_K1_LBSPPA256_LBSPPB256_LPA16_LPB16_MIWT1_1_PLR0_SU32_SUM0_SUS256_SKXCCM4_VWA1_VWB1_WGM1_WGMXCC1_WGMXCCGn1
    SolutionIndex: 61
    SolutionNameMin: Cijk_Ailk_Bjlk_HHS_BH_UserArgs_MT256x256x64_MI16x16x1_SN_LDSB1_CLR1_GSU0_GSUC0_GSUWGMRR0_K1_LBSPPA2048_LBSPPB2048_LPA0_LPB0_MIWT8_8_PLR1_SU32_SUM0_SUS256_SKXCCM4_VWA4_VWB4_WGM1_WGMXCC1_WGMXCCGn1
    SolutionIndex: 62
    SolutionNameMin: Cijk_Ailk_Bjlk_HHS_BH_UserArgs_MT256x256x64_MI16x16x1_SN_LDSB1_CLR1_GSU0_GSUC0_GSUWGMRR0_K1_LBSPPA2048_LBSPPB2048_LPA0_LPB0_MIWT8_8_PLR2_SU32_SUM0_SUS256_SKXCCM4_VWA4_VWB4_WGM1_WGMXCC1_WGMXCCGn1
    SolutionIndex: 63
    SolutionNameMin: Cijk_Ailk_Bjlk_HHS_BH_UserArgs_MT256x256x64_MI16x16x1_SN_LDSB1_CLR1_GSU0_GSUC0_GSUWGMRR0_K1_LBSPPA2048_LBSPPB2048_LPA0_LPB0_MIWT8_8_PLR2_SU32_SUM0_SUS256_SKXCCM4_VWA8_VWB4_WGM1_WGMXCC1_WGMXCCGn1
    SolutionIndex: 64
    SolutionNameMin: Cijk_Ailk_Bjlk_HHS_BH_UserArgs_MT256x256x64_MI16x16x1_SN_LDSB1_CLR1_GSU0_GSUC0_GSUWGMRR0_K1_LBSPPA2048_LBSPPB2048_LPA0_LPB0_MIWT8_8_PLR2_SU32_SUM0_SUS256_SKXCCM4_VWA8_VWB8_WGM1_WGMXCC1_WGMXCCGn1
    SolutionIndex: 65
    SolutionNameMin: Cijk_Ailk_Bjlk_HHS_BH_UserArgs_MT256x256x64_MI16x16x1_SN_LDSB1_CLR1_GSU0_GSUC0_GSUWGMRR0_K1_LBSPPA2048_LBSPPB2048_LPA0_LPB0_MIWT8_8_PLR1_SU32_SUM0_SUS256_SKXCCM4_VWA4_VWB4_WGM2_WGMXCC1_WGMXCCGn1
    SolutionIndex: 66
    SolutionNameMin: Cijk_Ailk_Bjlk_HHS_BH_UserArgs_MT256x256x64_MI16x16x1_SN_LDSB1_CLR1_GSU0_GSUC0_GSUWGMRR0_K1_LBSPPA2048_LBSPPB2048_LPA0_LPB0_MIWT8_8_PLR2_SU32_SUM0_SUS256_SKXCCM4_VWA4_VWB4_WGM2_WGMXCC1_WGMXCCGn1
    SolutionIndex: 67
    SolutionNameMin: Cijk_Ailk_Bjlk_HHS_BH_UserArgs_MT256x256x64_MI16x16x1_SN_LDSB1_CLR1_GSU0_GSUC0_GSUWGMRR0_K1_LBSPPA2048_LBSPPB2048_LPA0_LPB0_MIWT8_8_PLR2_SU32_SUM0_SUS256_SKXCCM4_VWA8_VWB8_WGM2_WGMXCC1_WGMXCCGn1
    SolutionIndex: 68
    SolutionNameMin: Cijk_Ailk_Bjlk_HHS_BH_UserArgs_MT256x256x64_MI16x16x1_SN_LDSB1_CLR1_GSU0_GSUC0_GSUWGMRR0_K1_LBSPPA2048_LBSPPB2048_LPA0_LPB0_MIWT8_8_PLR1_SU32_SUM0_SUS256_SKXCCM4_VWA4_VWB4_WGM4_WGMXCC1_WGMXCCGn1
    SolutionIndex: 69
    SolutionNameMin: Cijk_Ailk_Bjlk_HHS_BH_UserArgs_MT256x256x64_MI16x16x1_SN_LDSB1_CLR1_GSU0_GSUC0_GSUWGMRR0_K1_LBSPPA2048_LBSPPB2048_LPA0_LPB0_MIWT8_8_PLR2_SU32_SUM0_SUS256_SKXCCM4_VWA4_VWB4_WGM4_WGMXCC1_WGMXCCGn1
    SolutionIndex: 70
    SolutionNameMin: Cijk_Ailk_Bjlk_HHS_BH_UserArgs_MT128x256x64_MI16x16x1_SN_LDSB1_CLR1_GSU0_GSUC0_GSUWGMRR0_K1_LBSPPA1024_LBSPPB2048_LPA0_LPB0_MIWT4_8_PLR2_SU32_SUM0_SUS256_SKXCCM4_VWA4_VWB4_WGM1_WGMXCC1_WGMXCCGn1
    SolutionIndex: 71
    SolutionNameMin: Cijk_Ailk_Bjlk_HHS_BH_UserArgs_MT256x128x64_MI16x16x1_SN_LDSB1_CLR1_GSU0_GSUC0_GSUWGMRR0_K1_LBSPPA2048_LBSPPB1024_LPA32_LPB0_MIWT8_4_PLR1_SU32_SUM0_SUS256_SKXCCM4_VWA2_VWB4_WGM1_WGMXCC1_WGMXCCGn1
    SolutionIndex: 72
    SolutionNameMin: Cijk_Ailk_Bjlk_HHS_BH_UserArgs_MT256x128x64_MI16x16x1_SN_LDSB1_CLR1_GSU0_GSUC0_GSUWGMRR0_K1_LBSPPA2048_LBSPPB1024_LPA0_LPB0_MIWT8_4_PLR1_SU32_SUM0_SUS256_SKXCCM4_VWA4_VWB4_WGM1_WGMXCC1_WGMXCCGn1
    SolutionIndex: 73
    SolutionNameMin: Cijk_Ailk_Bjlk_HHS_BH_UserArgs_MT256x128x64_MI16x16x1_SN_LDSB1_CLR1_GSU0_GSUC0_GSUWGMRR0_K1_LBSPPA2048_LBSPPB1024_LPA32_LPB0_MIWT8_4_PLR1_SU32_SUM0_SUS256_SKXCCM4_VWA2_VWB4_WGM4_WGMXCC1_WGMXCCGn1
    SolutionIndex: 74
    SolutionNameMin: Cijk_Ailk_Bjlk_HHS_BH_UserArgs_MT128x128x64_MI16x16x1_SN_LDSB1_CLR1_GSU0_GSUC0_GSUWGMRR0_K1_LBSPPA1024_LBSPPB1024_LPA0_LPB0_MIWT4_4_PLR1_SU32_SUM0_SUS256_SKXCCM4_VWA4_VWB4_WGM1_WGMXCC1_WGMXCCGn1
    SolutionIndex: 75
    SolutionNameMin: Cijk_Ailk_Bjlk_HHS_BH_UserArgs_MT128x128x64_MI16x16x1_SN_LDSB1_CLR1_GSU0_GSUC0_GSUWGMRR0_K1_LBSPPA1024_LBSPPB1024_LPA0_LPB0_MIWT4_4_PLR1_SU32_SUM0_SUS256_SKXCCM4_VWA4_VWB4_WGM2_WGMXCC1_WGMXCCGn1
    SolutionIndex: 76
    SolutionNameMin: Cijk_Ailk_Bjlk_HHS_BH_UserArgs_MT128x128x64_MI16x16x1_SN_LDSB1_CLR1_GSU0_GSUC0_GSUWGMRR0_K1_LBSPPA1024_LBSPPB1024_LPA0_LPB0_MIWT4_4_PLR1_SU32_SUM0_SUS256_SKXCCM4_VWA4_VWB4_WGM4_WGMXCC1_WGMXCCGn1
    SolutionIndex: 77
    SolutionNameMin: Cijk_Ailk_Bjlk_HHS_BH_UserArgs_MT128x64x64_MI16x16x1_SN_LDSB1_CLR1_GSU0_GSUC0_GSUWGMRR0_K1_LBSPPA1024_LBSPPB512_LPA0_LPB32_MIWT4_2_PLR2_SU32_SUM0_SUS256_SKXCCM4_VWA4_VWB2_WGM1_WGMXCC1_WGMXCCGn1
    SolutionIndex: 78
    SolutionNameMin: Cijk_Ailk_Bjlk_HHS_BH_UserArgs_MT128x64x64_MI16x16x1_SN_LDSB1_CLR1_GSU0_GSUC0_GSUWGMRR0_K1_LBSPPA1024_LBSPPB512_LPA0_LPB32_MIWT4_2_PLR2_SU32_SUM0_SUS256_SKXCCM4_VWA4_VWB2_WGM4_WGMXCC1_WGMXCCGn1
    SolutionIndex: 79
    SolutionNameMin: Cijk_Ailk_Bjlk_HHS_BH_UserArgs_MT64x64x64_MI16x16x1_SN_LDSB1_CLR1_GSU0_GSUC0_GSUWGMRR0_K1_LBSPPA512_LBSPPB512_LPA32_LPB32_MIWT2_2_PLR1_SU32_SUM0_SUS256_SKXCCM4_VWA2_VWB2_WGM1_WGMXCC1_WGMXCCGn1
    SolutionIndex: 80
    SolutionNameMin: Cijk_Ailk_Bjlk_HHS_BH_UserArgs_MT64x64x64_MI16x16x1_SN_LDSB1_CLR1_GSU0_GSUC0_GSUWGMRR0_K1_LBSPPA512_LBSPPB512_LPA32_LPB32_MIWT2_2_PLR2_SU32_SUM0_SUS256_SKXCCM4_VWA2_VWB2_WGM1_WGMXCC1_WGMXCCGn1
    SolutionIndex: 81
    SolutionNameMin: Cijk_Ailk_Bjlk_HHS_BH_UserArgs_MT64x64x64_MI16x16x1_SN_LDSB1_CLR1_GSU0_GSUC0_GSUWGMRR0_K1_LBSPPA512_LBSPPB512_LPA32_LPB32_MIWT2_2_PLR1_SU32_SUM0_SUS256_SKXCCM4_VWA2_VWB2_WGM2_WGMXCC1_WGMXCCGn1
    SolutionIndex: 82
    SolutionNameMin: Cijk_Ailk_Bjlk_HHS_BH_UserArgs_MT32x64x64_MI16x16x1_SN_LDSB0_CLR1_GSU0_GSUC0_GSUWGMRR0_K1_LBSPPA256_LBSPPB512_LPA16_LPB32_MIWT1_2_PLR2_SU32_SUM0_SUS256_SKXCCM4_VWA1_VWB2_WGM1_WGMXCC1_WGMXCCGn1
    SolutionIndex: 83
    SolutionNameMin: Cijk_Ailk_Bjlk_HHS_BH_UserArgs_MT64x32x64_MI16x16x1_SN_LDSB0_CLR1_GSU0_GSUC0_GSUWGMRR0_K1_LBSPPA512_LBSPPB256_LPA32_LPB16_MIWT2_1_PLR1_SU32_SUM0_SUS256_SKXCCM4_VWA2_VWB1_WGM1_WGMXCC1_WGMXCCGn1
    SolutionIndex: 84
    SolutionNameMin: Cijk_Ailk_Bjlk_HHS_BH_UserArgs_MT64x32x64_MI16x16x1_SN_LDSB0_CLR1_GSU0_GSUC0_GSUWGMRR0_K1_LBSPPA512_LBSPPB256_LPA32_LPB16_MIWT2_1_PLR2_SU32_SUM0_SUS256_SKXCCM4_VWA2_VWB1_WGM1_WGMXCC1_WGMXCCGn1
    SolutionIndex: 85
    SolutionNameMin: Cijk_Ailk_Bjlk_HHS_BH_UserArgs_MT32x32x64_MI16x16x1_SN_LDSB0_CLR1_GSU0_GSUC0_GSUWGMRR0_K1_LBSPPA256_LBSPPB256_LPA16_LPB16_MIWT1_1_PLR1_SU32_SUM0_SUS256_SKXCCM4_VWA1_VWB1_WGM1_WGMXCC1_WGMXCCGn1
    SolutionIndex: 86
    SolutionNameMin: Cijk_Ailk_Bjlk_HHS_BH_UserArgs_MT128x128x128_MI16x16x1_SN_LDSB1_CLR1_GSU0_GSUC0_GSUWGMRR0_K1_LBSPPA1024_LBSPPB1024_LPA0_LPB0_MIWT4_4_PLR1_SU32_SUM0_SUS256_SKXCCM4_VWA4_VWB4_WGM1_WGMXCC1_WGMXCCGn1
    SolutionIndex: 87
    SolutionNameMin: Cijk_Ailk_Bjlk_HHS_BH_UserArgs_MT128x128x128_MI16x16x1_SN_LDSB1_CLR1_GSU0_GSUC0_GSUWGMRR0_K1_LBSPPA1024_LBSPPB1024_LPA0_LPB0_MIWT4_4_PLR1_SU32_SUM0_SUS256_SKXCCM4_VWA4_VWB4_WGM4_WGMXCC1_WGMXCCGn1
    SolutionIndex: 88
    SolutionNameMin: Cijk_Ailk_Bjlk_HHS_BH_UserArgs_MT128x64x128_MI16x16x1_SN_LDSB1_CLR1_GSU0_GSUC0_GSUWGMRR0_K1_LBSPPA1024_LBSPPB512_LPA0_LPB32_MIWT4_2_PLR2_SU32_SUM0_SUS256_SKXCCM4_VWA4_VWB2_WGM1_WGMXCC1_WGMXCCGn1
    SolutionIndex: 89
    SolutionNameMin: Cijk_Ailk_Bjlk_HHS_BH_UserArgs_MT128x64x128_MI16x16x1_SN_LDSB1_CLR1_GSU0_GSUC0_GSUWGMRR0_K1_LBSPPA1024_LBSPPB512_LPA0_LPB32_MIWT4_2_PLR2_SU32_SUM0_SUS256_SKXCCM4_VWA4_VWB2_WGM2_WGMXCC1_WGMXCCGn1
    SolutionIndex: 90
    SolutionNameMin: Cijk_Ailk_Bjlk_HHS_BH_UserArgs_MT64x64x128_MI16x16x1_SN_LDSB1_CLR1_GSU0_GSUC0_GSUWGMRR0_K1_LBSPPA512_LBSPPB512_LPA32_LPB32_MIWT2_2_PLR2_SU32_SUM0_SUS256_SKXCCM4_VWA2_VWB2_WGM1_WGMXCC1_WGMXCCGn1
    SolutionIndex: 91
    SolutionNameMin: Cijk_Ailk_Bjlk_HHS_BH_UserArgs_MT32x64x128_MI16x16x1_SN_LDSB1_CLR1_GSU0_GSUC0_GSUWGMRR0_K1_LBSPPA256_LBSPPB512_LPA16_LPB32_MIWT1_2_PLR2_SU32_SUM0_SUS256_SKXCCM4_VWA1_VWB2_WGM1_WGMXCC1_WGMXCCGn1
    SolutionIndex: 92
    SolutionNameMin: Cijk_Ailk_Bjlk_HHS_BH_UserArgs_MT64x32x128_MI16x16x1_SN_LDSB1_CLR1_GSU0_GSUC0_GSUWGMRR0_K1_LBSPPA512_LBSPPB256_LPA32_LPB16_MIWT2_1_PLR2_SU32_SUM0_SUS256_SKXCCM4_VWA2_VWB1_WGM1_WGMXCC1_WGMXCCGn1
    SolutionIndex: 93
    SolutionNameMin: Cijk_Ailk_Bjlk_HHS_BH_UserArgs_MT64x32x128_MI16x16x1_SN_LDSB1_CLR1_GSU0_GSUC0_GSUWGMRR0_K1_LBSPPA512_LBSPPB256_LPA32_LPB16_MIWT2_1_PLR2_SU32_SUM0_SUS256_SKXCCM4_VWA2_VWB1_WGM4_WGMXCC1_WGMXCCGn1
    SolutionIndex: 94
    SolutionNameMin: Cijk_Ailk_Bjlk_HHS_BH_UserArgs_MT32x32x32_MI16x16x1_SN_LDSB0_CLR1_GSU0_GSUC0_GSUWGMRR0_K1_LBSPPA256_LBSPPB256_LPA16_LPB16_MIWT1_1_PLR1_SU32_SUM0_SUS256_SKXCCM0_VWA1_VWB1_WGM2_WGMXCC1_WGMXCCGn1
- - - [128, 128, 1, 128, 128, 128, 128, 128]
    - [85, 0.082]
  - - [128, 128, 1, 256, 128, 128, 128, 128]
    - [23, 0.147]
  - - [128, 128, 1, 512, 128, 128, 128, 128]
    - [23, 0.234]
  - - [128, 128, 1, 1024, 128, 128, 128, 128]
    - [23, 0.34]
  - - [128, 128, 1, 2048, 128, 128, 128, 128]
    - [12, 0.56]
  - - [128, 128, 1, 4096, 128, 128, 128, 128]
    - [23, 0.947]
  - - [128, 128, 1, 8192, 128, 128, 128, 128]
    - [32, 1.352]
  - - [128, 256, 1, 128, 128, 128, 128, 256]
    - [12, 0.163]
  - - [128, 256, 1, 256, 128, 128, 128, 256]
    - [24, 0.289]
  - - [128, 256, 1, 512, 128, 128, 128, 256]
    - [23, 0.462]
  - - [128, 256, 1, 1024, 128, 128, 128, 256]
    - [23, 0.67]
  - - [128, 256, 1, 2048, 128, 128, 128, 256]
    - [32, 1.037]
  - - [128, 256, 1, 4096, 128, 128, 128, 256]
    - [82, 1.644]
  - - [128, 256, 1, 8192, 128, 128, 128, 256]
    - [91, 2.436]
  - - [128, 512, 1, 128, 128, 128, 128, 512]
    - [59, 0.32]
  - - [128, 512, 1, 256, 128, 128, 128, 512]
    - [23, 0.569]
  - - [128, 512, 1, 512, 128, 128, 128, 512]
    - [23, 0.918]
  - - [128, 512, 1, 1024, 128, 128, 128, 512]
    - [23, 1.323]
  - - [128, 512, 1, 2048, 128, 128, 128, 512]
    - [31, 1.894]
  - - [128, 512, 1, 4096, 128, 128, 128, 512]
    - [80, 2.759]
  - - [128, 512, 1, 8192, 128, 128, 128, 512]
    - [90, 4.086]
  - - [128, 1024, 1, 128, 128, 128, 128, 1024]
    - [83, 0.609]
  - - [128, 1024, 1, 256, 128, 128, 128, 1024]
    - [84, 1.057]
  - - [128, 1024, 1, 512, 128, 128, 128, 1024]
    - [30, 1.694]
  - - [128, 1024, 1, 1024, 128, 128, 128, 1024]
    - [92, 2.44]
  - - [128, 1024, 1, 2048, 128, 128, 128, 1024]
    - [28, 3.203]
  - - [128, 1024, 1, 4096, 128, 128, 128, 1024]
    - [28, 4.449]
  - - [128, 1024, 1, 8192, 128, 128, 128, 1024]
    - [19, 6.132]
  - - [128, 2048, 1, 128, 128, 128, 128, 2048]
    - [21, 1.127]
  - - [128, 2048, 1, 256, 128, 128, 128, 2048]
    - [21, 1.926]
  - - [128, 2048, 1, 512, 128, 128, 128, 2048]
    - [28, 2.998]
  - - [128, 2048, 1, 1024, 128, 128, 128, 2048]
    - [28, 4.257]
  - - [128, 2048, 1, 2048, 128, 128, 128, 2048]
    - [90, 5.202]
  - - [128, 2048, 1, 4096, 128, 128, 128, 2048]
    - [74, 7.009]
  - - [128, 2048, 1, 8192, 128, 128, 128, 2048]
    - [16, 9.604]
  - - [128, 4096, 1, 128, 128, 128, 128, 4096]
    - [58, 1.951]
  - - [128, 4096, 1, 256, 128, 128, 128, 4096]
    - [19, 3.155]
  - - [128, 4096, 1, 512, 128, 128, 128, 4096]
    - [19, 4.664]
  - - [128, 4096, 1, 1024, 128, 128, 128, 4096]
    - [88, 6.242]
  - - [128, 4096, 1, 2048, 128, 128, 128, 4096]
    - [74, 7.977]
  - - [128, 4096, 1, 4096, 128, 128, 128, 4096]
    - [74, 10.408]
  - - [128, 4096, 1, 8192, 128, 128, 128, 4096]
    - [16, 12.928]
  - - [128, 8192, 1, 128, 128, 128, 128, 8192]
    - [56, 3.052]
  - - [128, 8192, 1, 256, 128, 128, 128, 8192]
    - [74, 4.937]
  - - [128, 8192, 1, 512, 128, 128, 128, 8192]
    - [74, 7.356]
  - - [128, 8192, 1, 1024, 128, 128, 128, 8192]
    - [74, 9.63]
  - - [128, 8192, 1, 2048, 128, 128, 128, 8192]
    - [86, 11.414]
  - - [128, 8192, 1, 4096, 128, 128, 128, 8192]
    - [76, 13.111]
  - - [128, 8192, 1, 8192, 128, 128, 128, 8192]
    - [7, 14.425]
  - - [256, 128, 1, 128, 256, 256, 256, 128]
    - [23, 0.164]
  - - [256, 128, 1, 256, 256, 256, 256, 128]
    - [24, 0.288]
  - - [256, 128, 1, 512, 256, 256, 256, 128]
    - [24, 0.467]
  - - [256, 128, 1, 1024, 256, 256, 256, 128]
    - [23, 0.669]
  - - [256, 128, 1, 2048, 256, 256, 256, 128]
    - [23, 1.041]
  - - [256, 128, 1, 4096, 256, 256, 256, 128]
    - [82, 1.641]
  - - [256, 128, 1, 8192, 256, 256, 256, 128]
    - [93, 2.386]
  - - [256, 256, 1, 128, 256, 256, 256, 256]
    - [60, 0.325]
  - - [256, 256, 1, 256, 256, 256, 256, 256]
    - [24, 0.567]
  - - [256, 256, 1, 512, 256, 256, 256, 256]
    - [23, 0.923]
  - - [256, 256, 1, 1024, 256, 256, 256, 256]
    - [23, 1.326]
  - - [256, 256, 1, 2048, 256, 256, 256, 256]
    - [31, 1.896]
  - - [256, 256, 1, 4096, 256, 256, 256, 256]
    - [81, 2.745]
  - - [256, 256, 1, 8192, 256, 256, 256, 256]
    - [90, 3.83]
  - - [256, 512, 1, 128, 256, 256, 256, 512]
    - [84, 0.613]
  - - [256, 512, 1, 256, 256, 256, 256, 512]
    - [22, 1.051]
  - - [256, 512, 1, 512, 256, 256, 256, 512]
    - [31, 1.695]
  - - [256, 512, 1, 1024, 256, 256, 256, 512]
    - [92, 2.441]
  - - [256, 512, 1, 2048, 256, 256, 256, 512]
    - [90, 3.266]
  - - [256, 512, 1, 4096, 256, 256, 256, 512]
    - [78, 4.489]
  - - [256, 512, 1, 8192, 256, 256, 256, 512]
    - [19, 6.103]
  - - [256, 1024, 1, 128, 256, 256, 256, 1024]
    - [20, 1.129]
  - - [256, 1024, 1, 256, 256, 256, 256, 1024]
    - [21, 1.933]
  - - [256, 1024, 1, 512, 256, 256, 256, 1024]
    - [28, 3.021]
  - - [256, 1024, 1, 1024, 256, 256, 256, 1024]
    - [28, 4.248]
  - - [256, 1024, 1, 2048, 256, 256, 256, 1024]
    - [29, 5.315]
  - - [256, 1024, 1, 4096, 256, 256, 256, 1024]
    - [76, 6.98]
  - - [256, 1024, 1, 8192, 256, 256, 256, 1024]
    - [16, 9.62]
  - - [256, 2048, 1, 128, 256, 256, 256, 2048]
    - [58, 1.913]
  - - [256, 2048, 1, 256, 256, 256, 256, 2048]
    - [77, 3.125]
  - - [256, 2048, 1, 512, 256, 256, 256, 2048]
    - [77, 4.663]
  - - [256, 2048, 1, 1024, 256, 256, 256, 2048]
    - [88, 6.23]
  - - [256, 2048, 1, 2048, 256, 256, 256, 2048]
    - [75, 7.861]
  - - [256, 2048, 1, 4096, 256, 256, 256, 2048]
    - [16, 10.31]
  - - [256, 2048, 1, 8192, 256, 256, 256, 2048]
    - [74, 13.007]
  - - [256, 4096, 1, 128, 256, 256, 256, 4096]
    - [56, 3.034]
  - - [256, 4096, 1, 256, 256, 256, 256, 4096]
    - [74, 4.955]
  - - [256, 4096, 1, 512, 256, 256, 256, 4096]
    - [74, 7.364]
  - - [256, 4096, 1, 1024, 256, 256, 256, 4096]
    - [74, 9.663]
  - - [256, 4096, 1, 2048, 256, 256, 256, 4096]
    - [86, 11.43]
  - - [256, 4096, 1, 4096, 256, 256, 256, 4096]
    - [16, 13.136]
  - - [256, 4096, 1, 8192, 256, 256, 256, 4096]
    - [50, 14.69]
  - - [256, 8192, 1, 128, 256, 256, 256, 8192]
    - [51, 4.473]
  - - [256, 8192, 1, 256, 256, 256, 256, 8192]
    - [51, 6.924]
  - - [256, 8192, 1, 512, 256, 256, 256, 8192]
    - [51, 9.388]
  - - [256, 8192, 1, 1024, 256, 256, 256, 8192]
    - [71, 11.549]
  - - [256, 8192, 1, 2048, 256, 256, 256, 8192]
    - [72, 12.718]
  - - [256, 8192, 1, 4096, 256, 256, 256, 8192]
    - [11, 14.966]
  - - [256, 8192, 1, 8192, 256, 256, 256, 8192]
    - [47, 16.464]
  - - [512, 128, 1, 128, 512, 512, 512, 128]
    - [59, 0.323]
  - - [512, 128, 1, 256, 512, 512, 512, 128]
    - [23, 0.567]
  - - [512, 128, 1, 512, 512, 512, 512, 128]
    - [23, 0.912]
  - - [512, 128, 1, 1024, 512, 512, 512, 128]
    - [23, 1.323]
  - - [512, 128, 1, 2048, 512, 512, 512, 128]
    - [31, 1.896]
  - - [512, 128, 1, 4096, 512, 512, 512, 128]
    - [79, 2.729]
  - - [512, 128, 1, 8192, 512, 512, 512, 128]
    - [28, 3.813]
  - - [512, 256, 1, 128, 512, 512, 512, 256]
    - [84, 0.613]
  - - [512, 256, 1, 256, 512, 512, 512, 256]
    - [22, 1.061]
  - - [512, 256, 1, 512, 512, 512, 512, 256]
    - [31, 1.702]
  - - [512, 256, 1, 1024, 512, 512, 512, 256]
    - [31, 2.448]
  - - [512, 256, 1, 2048, 512, 512, 512, 256]
    - [90, 3.266]
  - - [512, 256, 1, 4096, 512, 512, 512, 256]
    - [77, 4.523]
  - - [512, 256, 1, 8192, 512, 512, 512, 256]
    - [19, 6.122]
  - - [512, 512, 1, 128, 512, 512, 512, 512]
    - [21, 1.132]
  - - [512, 512, 1, 256, 512, 512, 512, 512]
    - [20, 1.944]
  - - [512, 512, 1, 512, 512, 512, 512, 512]
    - [28, 3.018]
  - - [512, 512, 1, 1024, 512, 512, 512, 512]
    - [90, 4.236]
  - - [512, 512, 1, 2048, 512, 512, 512, 512]
    - [29, 5.319]
  - - [512, 512, 1, 4096, 512, 512, 512, 512]
    - [74, 7.149]
  - - [512, 512, 1, 8192, 512, 512, 512, 512]
    - [74, 9.589]
  - - [512, 1024, 1, 128, 512, 512, 512, 1024]
    - [57, 1.94]
  - - [512, 1024, 1, 256, 512, 512, 512, 1024]
    - [58, 3.149]
  - - [512, 1024, 1, 512, 512, 512, 512, 1024]
    - [77, 4.672]
  - - [512, 1024, 1, 1024, 512, 512, 512, 1024]
    - [88, 6.243]
  - - [512, 1024, 1, 2048, 512, 512, 512, 1024]
    - [76, 7.878]
  - - [512, 1024, 1, 4096, 512, 512, 512, 1024]
    - [16, 10.384]
  - - [512, 1024, 1, 8192, 512, 512, 512, 1024]
    - [74, 12.778]
  - - [512, 2048, 1, 128, 512, 512, 512, 2048]
    - [56, 3.054]
  - - [512, 2048, 1, 256, 512, 512, 512, 2048]
    - [74, 4.957]
  - - [512, 2048, 1, 512, 512, 512, 512, 2048]
    - [74, 7.319]
  - - [512, 2048, 1, 1024, 512, 512, 512, 2048]
    - [74, 9.664]
  - - [512, 2048, 1, 2048, 512, 512, 512, 2048]
    - [26, 11.279]
  - - [512, 2048, 1, 4096, 512, 512, 512, 2048]
    - [75, 13.111]
  - - [512, 2048, 1, 8192, 512, 512, 512, 2048]
    - [49, 14.621]
  - - [512, 4096, 1, 128, 512, 512, 512, 4096]
    - [53, 4.517]
  - - [512, 4096, 1, 256, 512, 512, 512, 4096]
    - [53, 6.907]
  - - [512, 4096, 1, 512, 512, 512, 512, 4096]
    - [53, 9.388]
  - - [512, 4096, 1, 1024, 512, 512, 512, 4096]
    - [71, 11.641]
  - - [512, 4096, 1, 2048, 512, 512, 512, 4096]
    - [10, 12.777]
  - - [512, 4096, 1, 4096, 512, 512, 512, 4096]
    - [15, 14.828]
  - - [512, 4096, 1, 8192, 512, 512, 512, 4096]
    - [40, 16.56]
  - - [512, 8192, 1, 128, 512, 512, 512, 8192]
    - [45, 5.621]
  - - [512, 8192, 1, 256, 512, 512, 512, 8192]
    - [45, 8.514]
  - - [512, 8192, 1, 512, 512, 512, 512, 8192]
    - [5, 11.266]
  - - [512, 8192, 1, 1024, 512, 512, 512, 8192]
    - [14, 13.497]
  - - [512, 8192, 1, 2048, 512, 512, 512, 8192]
    - [47, 14.74]
  - - [512, 8192, 1, 4096, 512, 512, 512, 8192]
    - [3, 16.734]
  - - [512, 8192, 1, 8192, 512, 512, 512, 8192]
    - [2, 18.574]
  - - [1024, 128, 1, 128, 1024, 1024, 1024, 128]
    - [84, 0.62]
  - - [1024, 128, 1, 256, 1024, 1024, 1024, 128]
    - [84, 1.074]
  - - [1024, 128, 1, 512, 1024, 1024, 1024, 128]
    - [31, 1.697]
  - - [1024, 128, 1, 1024, 1024, 1024, 1024, 128]
    - [92, 2.445]
  - - [1024, 128, 1, 2048, 1024, 1024, 1024, 128]
    - [28, 3.211]
  - - [1024, 128, 1, 4096, 1024, 1024, 1024, 128]
    - [77, 4.462]
  - - [1024, 128, 1, 8192, 1024, 1024, 1024, 128]
    - [19, 6.123]
  - - [1024, 256, 1, 128, 1024, 1024, 1024, 256]
    - [21, 1.127]
  - - [1024, 256, 1, 256, 1024, 1024, 1024, 256]
    - [80, 1.927]
  - - [1024, 256, 1, 512, 1024, 1024, 1024, 256]
    - [28, 3.012]
  - - [1024, 256, 1, 1024, 1024, 1024, 1024, 256]
    - [28, 4.246]
  - - [1024, 256, 1, 2048, 1024, 1024, 1024, 256]
    - [28, 5.353]
  - - [1024, 256, 1, 4096, 1024, 1024, 1024, 256]
    - [74, 7.015]
  - - [1024, 256, 1, 8192, 1024, 1024, 1024, 256]
    - [16, 9.629]
  - - [1024, 512, 1, 128, 1024, 1024, 1024, 512]
    - [58, 1.919]
  - - [1024, 512, 1, 256, 1024, 1024, 1024, 512]
    - [77, 3.141]
  - - [1024, 512, 1, 512, 1024, 1024, 1024, 512]
    - [77, 4.679]
  - - [1024, 512, 1, 1024, 1024, 1024, 1024, 512]
    - [88, 6.261]
  - - [1024, 512, 1, 2048, 1024, 1024, 1024, 512]
    - [74, 7.987]
  - - [1024, 512, 1, 4096, 1024, 1024, 1024, 512]
    - [74, 10.365]
  - - [1024, 512, 1, 8192, 1024, 1024, 1024, 512]
    - [76, 12.765]
  - - [1024, 1024, 1, 128, 1024, 1024, 1024, 1024]
    - [56, 3.031]
  - - [1024, 1024, 1, 256, 1024, 1024, 1024, 1024]
    - [74, 4.961]
  - - [1024, 1024, 1, 512, 1024, 1024, 1024, 1024]
    - [74, 7.407]
  - - [1024, 1024, 1, 1024, 1024, 1024, 1024, 1024]
    - [74, 9.609]
  - - [1024, 1024, 1, 2048, 1024, 1024, 1024, 1024]
    - [26, 11.048]
  - - [1024, 1024, 1, 4096, 1024, 1024, 1024, 1024]
    - [74, 13.146]
  - - [1024, 1024, 1, 8192, 1024, 1024, 1024, 1024]
    - [49, 14.61]
  - - [1024, 2048, 1, 128, 1024, 1024, 1024, 2048]
    - [53, 4.491]
  - - [1024, 2048, 1, 256, 1024, 1024, 1024, 2048]
    - [53, 6.912]
  - - [1024, 2048, 1, 512, 1024, 1024, 1024, 2048]
    - [53, 9.41]
  - - [1024, 2048, 1, 1024, 1024, 1024, 1024, 2048]
    - [71, 11.613]
  - - [1024, 2048, 1, 2048, 1024, 1024, 1024, 2048]
    - [54, 12.689]
  - - [1024, 2048, 1, 4096, 1024, 1024, 1024, 2048]
    - [49, 14.845]
  - - [1024, 2048, 1, 8192, 1024, 1024, 1024, 2048]
    - [38, 16.479]
  - - [1024, 4096, 1, 128, 1024, 1024, 1024, 4096]
    - [36, 5.686]
  - - [1024, 4096, 1, 256, 1024, 1024, 1024, 4096]
    - [6, 8.517]
  - - [1024, 4096, 1, 512, 1024, 1024, 1024, 4096]
    - [6, 11.429]
  - - [1024, 4096, 1, 1024, 1024, 1024, 1024, 4096]
    - [14, 13.548]
  - - [1024, 4096, 1, 2048, 1024, 1024, 1024, 4096]
    - [33, 14.535]
  - - [1024, 4096, 1, 4096, 1024, 1024, 1024, 4096]
    - [40, 16.66]
  - - [1024, 4096, 1, 8192, 1024, 1024, 1024, 4096]
    - [4, 18.532]
  - - [1024, 8192, 1, 128, 1024, 1024, 1024, 8192]
    - [63, 5.859]
  - - [1024, 8192, 1, 256, 1024, 1024, 1024, 8192]
    - [54, 7.992]
  - - [1024, 8192, 1, 512, 1024, 1024, 1024, 8192]
    - [35, 10.885]
  - - [1024, 8192, 1, 1024, 1024, 1024, 1024, 8192]
    - [43, 14.019]
  - - [1024, 8192, 1, 2048, 1024, 1024, 1024, 8192]
    - [47, 16.247]
  - - [1024, 8192, 1, 4096, 1024, 1024, 1024, 8192]
    - [47, 18.111]
  - - [1024, 8192, 1, 8192, 1024, 1024, 1024, 8192]
    - [61, 19.675]
  - - [2048, 128, 1, 128, 2048, 2048, 2048, 128]
    - [20, 1.132]
  - - [2048, 128, 1, 256, 2048, 2048, 2048, 128]
    - [21, 1.94]
  - - [2048, 128, 1, 512, 2048, 2048, 2048, 128]
    - [28, 3.021]
  - - [2048, 128, 1, 1024, 2048, 2048, 2048, 128]
    - [28, 4.261]
  - - [2048, 128, 1, 2048, 2048, 2048, 2048, 128]
    - [77, 4.906]
  - - [2048, 128, 1, 4096, 2048, 2048, 2048, 128]
    - [74, 7.023]
  - - [2048, 128, 1, 8192, 2048, 2048, 2048, 128]
    - [16, 9.604]
  - - [2048, 256, 1, 128, 2048, 2048, 2048, 256]
    - [57, 1.936]
  - - [2048, 256, 1, 256, 2048, 2048, 2048, 256]
    - [58, 3.142]
  - - [2048, 256, 1, 512, 2048, 2048, 2048, 256]
    - [77, 4.644]
  - - [2048, 256, 1, 1024, 2048, 2048, 2048, 256]
    - [27, 6.193]
  - - [2048, 256, 1, 2048, 2048, 2048, 2048, 256]
    - [74, 7.936]
  - - [2048, 256, 1, 4096, 2048, 2048, 2048, 256]
    - [16, 10.338]
  - - [2048, 256, 1, 8192, 2048, 2048, 2048, 256]
    - [17, 12.9]
  - - [2048, 512, 1, 128, 2048, 2048, 2048, 512]
    - [56, 3.023]
  - - [2048, 512, 1, 256, 2048, 2048, 2048, 512]
    - [74, 4.976]
  - - [2048, 512, 1, 512, 2048, 2048, 2048, 512]
    - [74, 7.359]
  - - [2048, 512, 1, 1024, 2048, 2048, 2048, 512]
    - [75, 9.579]
  - - [2048, 512, 1, 2048, 2048, 2048, 2048, 512]
    - [26, 10.909]
  - - [2048, 512, 1, 4096, 2048, 2048, 2048, 512]
    - [76, 13.063]
  - - [2048, 512, 1, 8192, 2048, 2048, 2048, 512]
    - [8, 14.669]
  - - [2048, 1024, 1, 128, 2048, 2048, 2048, 1024]
    - [53, 4.503]
  - - [2048, 1024, 1, 256, 2048, 2048, 2048, 1024]
    - [53, 6.906]
  - - [2048, 1024, 1, 512, 2048, 2048, 2048, 1024]
    - [53, 9.43]
  - - [2048, 1024, 1, 1024, 2048, 2048, 2048, 1024]
    - [73, 11.6]
  - - [2048, 1024, 1, 2048, 2048, 2048, 2048, 1024]
    - [50, 12.686]
  - - [2048, 1024, 1, 4096, 2048, 2048, 2048, 1024]
    - [52, 14.864]
  - - [2048, 1024, 1, 8192, 2048, 2048, 2048, 1024]
    - [38, 16.48]
  - - [2048, 2048, 1, 128, 2048, 2048, 2048, 2048]
    - [36, 5.684]
  - - [2048, 2048, 1, 256, 2048, 2048, 2048, 2048]
    - [34, 8.503]
  - - [2048, 2048, 1, 512, 2048, 2048, 2048, 2048]
    - [36, 11.423]
  - - [2048, 2048, 1, 1024, 2048, 2048, 2048, 2048]
    - [62, 13.543]
  - - [2048, 2048, 1, 2048, 2048, 2048, 2048, 2048]
    - [47, 14.694]
  - - [2048, 2048, 1, 4096, 2048, 2048, 2048, 2048]
    - [2, 16.669]
  - - [2048, 2048, 1, 8192, 2048, 2048, 2048, 2048]
    - [35, 18.414]
  - - [2048, 4096, 1, 128, 2048, 2048, 2048, 4096]
    - [63, 5.753]
  - - [2048, 4096, 1, 256, 2048, 2048, 2048, 4096]
    - [54, 8.086]
  - - [2048, 4096, 1, 512, 2048, 2048, 2048, 4096]
    - [72, 10.902]
  - - [2048, 4096, 1, 1024, 2048, 2048, 2048, 4096]
    - [35, 14.083]
  - - [2048, 4096, 1, 2048, 2048, 2048, 2048, 4096]
    - [2, 16.235]
  - - [2048, 4096, 1, 4096, 2048, 2048, 2048, 4096]
    - [42, 18.058]
  - - [2048, 4096, 1, 8192, 2048, 2048, 2048, 4096]
    - [65, 19.65]
  - - [2048, 8192, 1, 128, 2048, 2048, 2048, 8192]
    - [51, 6.23]
  - - [2048, 8192, 1, 256, 2048, 2048, 2048, 8192]
    - [38, 9.422]
  - - [2048, 8192, 1, 512, 2048, 2048, 2048, 8192]
    - [62, 12.642]
  - - [2048, 8192, 1, 1024, 2048, 2048, 2048, 8192]
    - [68, 15.224]
  - - [2048, 8192, 1, 2048, 2048, 2048, 2048, 8192]
    - [2, 17.739]
  - - [2048, 8192, 1, 4096, 2048, 2048, 2048, 8192]
    - [61, 19.393]
  - - [2048, 8192, 1, 8192, 2048, 2048, 2048, 8192]
    - [61, 20.243]
  - - [4096, 128, 1, 128, 4096, 4096, 4096, 128]
    - [58, 1.97]
  - - [4096, 128, 1, 256, 4096, 4096, 4096, 128]
    - [77, 3.199]
  - - [4096, 128, 1, 512, 4096, 4096, 4096, 128]
    - [77, 4.713]
  - - [4096, 128, 1, 1024, 4096, 4096, 4096, 128]
    - [89, 6.162]
  - - [4096, 128, 1, 2048, 4096, 4096, 4096, 128]
    - [74, 7.958]
  - - [4096, 128, 1, 4096, 4096, 4096, 4096, 128]
    - [74, 10.398]
  - - [4096, 128, 1, 8192, 4096, 4096, 4096, 128]
    - [76, 12.871]
  - - [4096, 256, 1, 128, 4096, 4096, 4096, 256]
    - [56, 3.005]
  - - [4096, 256, 1, 256, 4096, 4096, 4096, 256]
    - [74, 4.94]
  - - [4096, 256, 1, 512, 4096, 4096, 4096, 256]
    - [74, 7.327]
  - - [4096, 256, 1, 1024, 4096, 4096, 4096, 256]
    - [76, 9.607]
  - - [4096, 256, 1, 2048, 4096, 4096, 4096, 256]
    - [87, 11.072]
  - - [4096, 256, 1, 4096, 4096, 4096, 4096, 256]
    - [18, 13.01]
  - - [4096, 256, 1, 8192, 4096, 4096, 4096, 256]
    - [49, 14.608]
  - - [4096, 512, 1, 128, 4096, 4096, 4096, 512]
    - [51, 4.509]
  - - [4096, 512, 1, 256, 4096, 4096, 4096, 512]
    - [53, 6.925]
  - - [4096, 512, 1, 512, 4096, 4096, 4096, 512]
    - [53, 9.427]
  - - [4096, 512, 1, 1024, 4096, 4096, 4096, 512]
    - [71, 11.571]
  - - [4096, 512, 1, 2048, 4096, 4096, 4096, 512]
    - [16, 12.699]
  - - [4096, 512, 1, 4096, 4096, 4096, 4096, 512]
    - [9, 14.886]
  - - [4096, 512, 1, 8192, 4096, 4096, 4096, 512]
    - [44, 16.651]
  - - [4096, 1024, 1, 128, 4096, 4096, 4096, 1024]
    - [36, 5.748]
  - - [4096, 1024, 1, 256, 4096, 4096, 4096, 1024]
    - [34, 8.583]
  - - [4096, 1024, 1, 512, 4096, 4096, 4096, 1024]
    - [48, 11.442]
  - - [4096, 1024, 1, 1024, 4096, 4096, 4096, 1024]
    - [61, 13.596]
  - - [4096, 1024, 1, 2048, 4096, 4096, 4096, 1024]
    - [38, 14.517]
  - - [4096, 1024, 1, 4096, 4096, 4096, 4096, 1024]
    - [1, 16.649]
  - - [4096, 1024, 1, 8192, 4096, 4096, 4096, 1024]
    - [46, 18.377]
  - - [4096, 2048, 1, 128, 4096, 4096, 4096, 2048]
    - [63, 5.831]
  - - [4096, 2048, 1, 256, 4096, 4096, 4096, 2048]
    - [54, 8.06]
  - - [4096, 2048, 1, 512, 4096, 4096, 4096, 2048]
    - [35, 10.882]
  - - [4096, 2048, 1, 1024, 4096, 4096, 4096, 2048]
    - [0, 13.991]
  - - [4096, 2048, 1, 2048, 4096, 4096, 4096, 2048]
    - [38, 16.061]
  - - [4096, 2048, 1, 4096, 4096, 4096, 4096, 2048]
    - [38, 18.008]
  - - [4096, 2048, 1, 8192, 4096, 4096, 4096, 2048]
    - [61, 19.707]
  - - [4096, 4096, 1, 128, 4096, 4096, 4096, 4096]
    - [53, 6.275]
  - - [4096, 4096, 1, 256, 4096, 4096, 4096, 4096]
    - [35, 9.333]
  - - [4096, 4096, 1, 512, 4096, 4096, 4096, 4096]
    - [66, 12.549]
  - - [4096, 4096, 1, 1024, 4096, 4096, 4096, 4096]
    - [65, 15.228]
  - - [4096, 4096, 1, 2048, 4096, 4096, 4096, 4096]
    - [65, 17.506]
  - - [4096, 4096, 1, 4096, 4096, 4096, 4096, 4096]
    - [62, 19.23]
  - - [4096, 4096, 1, 8192, 4096, 4096, 4096, 4096]
    - [61, 20.178]
  - - [4096, 8192, 1, 128, 4096, 4096, 4096, 8192]
    - [41, 7.205]
  - - [4096, 8192, 1, 256, 4096, 4096, 4096, 8192]
    - [37, 10.173]
  - - [4096, 8192, 1, 512, 4096, 4096, 4096, 8192]
    - [35, 13.408]
  - - [4096, 8192, 1, 1024, 4096, 4096, 4096, 8192]
    - [48, 16.546]
  - - [4096, 8192, 1, 2048, 4096, 4096, 4096, 8192]
    - [45, 18.506]
  - - [4096, 8192, 1, 4096, 4096, 4096, 4096, 8192]
    - [61, 19.763]
  - - [4096, 8192, 1, 8192, 4096, 4096, 4096, 8192]
    - [13, 20.433]
  - - [8192, 128, 1, 128, 8192, 8192, 8192, 128]
    - [55, 2.895]
  - - [8192, 128, 1, 256, 8192, 8192, 8192, 128]
    - [16, 4.739]
  - - [8192, 128, 1, 512, 8192, 8192, 8192, 128]
    - [16, 7.101]
  - - [8192, 128, 1, 1024, 8192, 8192, 8192, 128]
    - [16, 9.446]
  - - [8192, 128, 1, 2048, 8192, 8192, 8192, 128]
    - [25, 11.155]
  - - [8192, 128, 1, 4096, 8192, 8192, 8192, 128]
    - [16, 13.203]
  - - [8192, 128, 1, 8192, 8192, 8192, 8192, 128]
    - [11, 14.541]
  - - [8192, 256, 1, 128, 8192, 8192, 8192, 256]
    - [53, 4.57]
  - - [8192, 256, 1, 256, 8192, 8192, 8192, 256]
    - [51, 7.042]
  - - [8192, 256, 1, 512, 8192, 8192, 8192, 256]
    - [53, 9.498]
  - - [8192, 256, 1, 1024, 8192, 8192, 8192, 256]
    - [73, 11.515]
  - - [8192, 256, 1, 2048, 8192, 8192, 8192, 256]
    - [49, 12.719]
  - - [8192, 256, 1, 4096, 8192, 8192, 8192, 256]
    - [70, 14.756]
  - - [8192, 256, 1, 8192, 8192, 8192, 8192, 256]
    - [46, 16.558]
  - - [8192, 512, 1, 128, 8192, 8192, 8192, 512]
    - [45, 5.658]
  - - [8192, 512, 1, 256, 8192, 8192, 8192, 512]
    - [45, 8.491]
  - - [8192, 512, 1, 512, 8192, 8192, 8192, 512]
    - [45, 11.36]
  - - [8192, 512, 1, 1024, 8192, 8192, 8192, 512]
    - [14, 13.427]
  - - [8192, 512, 1, 2048, 8192, 8192, 8192, 512]
    - [46, 14.607]
  - - [8192, 512, 1, 4096, 8192, 8192, 8192, 512]
    - [38, 16.649]
  - - [8192, 512, 1, 8192, 8192, 8192, 8192, 512]
    - [38, 18.444]
  - - [8192, 1024, 1, 128, 8192, 8192, 8192, 1024]
    - [64, 5.706]
  - - [8192, 1024, 1, 256, 8192, 8192, 8192, 1024]
    - [52, 7.897]
  - - [8192, 1024, 1, 512, 8192, 8192, 8192, 1024]
    - [46, 10.898]
  - - [8192, 1024, 1, 1024, 8192, 8192, 8192, 1024]
    - [38, 14.047]
  - - [8192, 1024, 1, 2048, 8192, 8192, 8192, 1024]
    - [1, 16.194]
  - - [8192, 1024, 1, 4096, 8192, 8192, 8192, 1024]
    - [2, 18.105]
  - - [8192, 1024, 1, 8192, 8192, 8192, 8192, 1024]
    - [69, 19.616]
  - - [8192, 2048, 1, 128, 8192, 8192, 8192, 2048]
    - [51, 6.183]
  - - [8192, 2048, 1, 256, 8192, 8192, 8192, 2048]
    - [33, 9.372]
  - - [8192, 2048, 1, 512, 8192, 8192, 8192, 2048]
    - [61, 12.522]
  - - [8192, 2048, 1, 1024, 8192, 8192, 8192, 2048]
    - [65, 15.153]
  - - [8192, 2048, 1, 2048, 8192, 8192, 8192, 2048]
    - [48, 17.509]
  - - [8192, 2048, 1, 4096, 8192, 8192, 8192, 2048]
    - [61, 19.282]
  - - [8192, 2048, 1, 8192, 8192, 8192, 8192, 2048]
    - [61, 20.18]
  - - [8192, 4096, 1, 128, 8192, 8192, 8192, 4096]
    - [36, 7.154]
  - - [8192, 4096, 1, 256, 8192, 8192, 8192, 4096]
    - [39, 10.283]
  - - [8192, 4096, 1, 512, 8192, 8192, 8192, 4096]
    - [1, 13.477]
  - - [8192, 4096, 1, 1024, 8192, 8192, 8192, 4096]
    - [48, 16.521]
  - - [8192, 4096, 1, 2048, 8192, 8192, 8192, 4096]
    - [61, 18.487]
  - - [8192, 4096, 1, 4096, 8192, 8192, 8192, 4096]
    - [61, 19.706]
  - - [8192, 4096, 1, 8192, 8192, 8192, 8192, 4096]
    - [13, 20.497]
  - - [8192, 8192, 1, 128, 8192, 8192, 8192, 8192]
    - [67, 7.482]
  - - [8192, 8192, 1, 256, 8192, 8192, 8192, 8192]
    - [67, 10.399]
  - - [8192, 8192, 1, 512, 8192, 8192, 8192, 8192]
    - [48, 13.876]
  - - [8192, 8192, 1, 1024, 8192, 8192, 8192, 8192]
    - [48, 16.834]
  - - [8192, 8192, 1, 2048, 8192, 8192, 8192, 8192]
    - [61, 18.637]
  - - [8192, 8192, 1, 4096, 8192, 8192, 8192, 8192]
    - [13, 19.979]
  - - [8192, 8192, 1, 8192, 8192, 8192, 8192, 8192]
    - [65, 20.843]
  - - [1, 1, 1, 32, 1, 1, 1, 1]
    - [94, 0.0]
- null
- null
- ExperimentalStreamK
- GridBased
