library/src/amd_detail/rocblaslt/src/Tensile/Logic/asm_full/aquavanjaram/gfx942/StreamK/aquavanjaram942_Cijk_Ailk_Bljk_HSS_BH_UserArgs.yaml
- {MinimumRequiredVersion: 4.33.0}
- aquavanjaram942
- gfx942
- [Device 0049, Device 0050]
    SolutionIndex: 0
    SolutionNameMin: Cijk_Ailk_Bljk_HSS_BH_UserArgs_MT256x256x32_MI16x16x1_SN_LDSB1_CLR1_GSU0_GSUC0_GSUWGMRR0_K1_LBSPPA2048_LBSPPB256_LPA0_MIWT8_8_PLR1_SU32_SUM0_SUS256_SKXCCM0_VWA4_VWB4_WGM4_WGMXCC1_WGMXCCGn1
    SolutionIndex: 1
    SolutionNameMin: Cijk_Ailk_Bljk_HSS_BH_UserArgs_MT256x256x32_MI16x16x1_SN_LDSB1_CLR1_GSU0_GSUC0_GSUWGMRR0_K1_LBSPPA2048_LBSPPB512_LPA32_MIWT8_8_PLR1_SU32_SUM0_SUS256_SKXCCM0_VWA2_VWB8_WGM4_WGMXCC1_WGMXCCGn1
    SolutionIndex: 2
    SolutionNameMin: Cijk_Ailk_Bljk_HSS_BH_UserArgs_MT256x256x32_MI16x16x1_SN_LDSB1_CLR1_GSU0_GSUC0_GSUWGMRR0_K1_LBSPPA2048_LBSPPB256_LPA0_MIWT8_8_PLR1_SU32_SUM0_SUS256_SKXCCM0_VWA4_VWB4_WGM8_WGMXCC1_WGMXCCGn1
    SolutionIndex: 3
    SolutionNameMin: Cijk_Ailk_Bljk_HSS_BH_UserArgs_MT256x256x32_MI16x16x1_SN_LDSB1_CLR1_GSU0_GSUC0_GSUWGMRR0_K1_LBSPPA2048_LBSPPB512_LPA32_MIWT8_8_PLR1_SU32_SUM0_SUS256_SKXCCM0_VWA2_VWB8_WGM8_WGMXCC1_WGMXCCGn1
    SolutionIndex: 4
    SolutionNameMin: Cijk_Ailk_Bljk_HSS_BH_UserArgs_MT256x256x32_MI16x16x1_SN_LDSB1_CLR1_GSU0_GSUC0_GSUWGMRR0_K1_LBSPPA2048_LBSPPB512_LPA0_MIWT8_8_PLR1_SU32_SUM0_SUS256_SKXCCM0_VWA4_VWB8_WGM8_WGMXCC1_WGMXCCGn1
    SolutionIndex: 5
    SolutionNameMin: Cijk_Ailk_Bljk_HSS_BH_UserArgs_MT128x128x32_MI16x16x1_SN_LDSB1_CLR1_GSU0_GSUC0_GSUWGMRR0_K1_LBSPPA1024_LBSPPB256_LPA0_MIWT4_4_PLR1_SU32_SUM0_SUS256_SKXCCM0_VWA4_VWB4_WGM8_WGMXCC1_WGMXCCGn1
    SolutionIndex: 6
    SolutionNameMin: Cijk_Ailk_Bljk_HSS_BH_UserArgs_MT128x256x64_MI16x16x1_SN_LDSB1_CLR1_GSU0_GSUC0_GSUWGMRR0_K1_LBSPPA2048_LBSPPB128_LPA0_MIWT4_8_PLR1_SU32_SUM0_SUS256_SKXCCM0_VWA4_VWB1_WGM1_WGMXCC1_WGMXCCGn1
    SolutionIndex: 7
    SolutionNameMin: Cijk_Ailk_Bljk_HSS_BH_UserArgs_MT128x256x64_MI16x16x1_SN_LDSB1_CLR1_GSU0_GSUC0_GSUWGMRR0_K1_LBSPPA2048_LBSPPB128_LPA32_MIWT4_8_PLR1_SU32_SUM0_SUS256_SKXCCM0_VWA2_VWB1_WGM4_WGMXCC1_WGMXCCGn1
    SolutionIndex: 8
    SolutionNameMin: Cijk_Ailk_Bljk_HSS_BH_UserArgs_MT128x256x64_MI16x16x1_SN_LDSB1_CLR1_GSU0_GSUC0_GSUWGMRR0_K1_LBSPPA2048_LBSPPB128_LPA0_MIWT4_8_PLR1_SU32_SUM0_SUS256_SKXCCM0_VWA4_VWB1_WGM4_WGMXCC1_WGMXCCGn1
    SolutionIndex: 9
    SolutionNameMin: Cijk_Ailk_Bljk_HSS_BH_UserArgs_MT128x256x64_MI16x16x1_SN_LDSB1_CLR1_GSU0_GSUC0_GSUWGMRR0_K1_LBSPPA2048_LBSPPB256_LPA32_MIWT4_8_PLR1_SU32_SUM0_SUS256_SKXCCM0_VWA2_VWB2_WGM4_WGMXCC1_WGMXCCGn1
    SolutionIndex: 10
    SolutionNameMin: Cijk_Ailk_Bljk_HSS_BH_UserArgs_MT128x256x64_MI16x16x1_SN_LDSB1_CLR1_GSU0_GSUC0_GSUWGMRR0_K1_LBSPPA2048_LBSPPB128_LPA0_MIWT4_8_PLR1_SU32_SUM0_SUS256_SKXCCM0_VWA4_VWB1_WGM8_WGMXCC1_WGMXCCGn1
    SolutionIndex: 11
    SolutionNameMin: Cijk_Ailk_Bljk_HSS_BH_UserArgs_MT256x128x64_MI16x16x1_SN_LDSB1_CLR1_GSU0_GSUC0_GSUWGMRR0_K1_LBSPPA4096_LBSPPB256_LPA0_MIWT8_4_PLR1_SU32_SUM0_SUS256_SKXCCM0_VWA4_VWB2_WGM1_WGMXCC1_WGMXCCGn1
    SolutionIndex: 12
    SolutionNameMin: Cijk_Ailk_Bljk_HSS_BH_UserArgs_MT256x128x64_MI16x16x1_SN_LDSB1_CLR1_GSU0_GSUC0_GSUWGMRR0_K1_LBSPPA4096_LBSPPB512_LPA0_MIWT8_4_PLR1_SU32_SUM0_SUS256_SKXCCM0_VWA4_VWB4_WGM1_WGMXCC1_WGMXCCGn1
    SolutionIndex: 13
    SolutionNameMin: Cijk_Ailk_Bljk_HSS_BH_UserArgs_MT256x128x64_MI16x16x1_SN_LDSB1_CLR1_GSU0_GSUC0_GSUWGMRR0_K1_LBSPPA4096_LBSPPB512_LPA0_MIWT8_4_PLR1_SU32_SUM0_SUS256_SKXCCM0_VWA4_VWB4_WGM4_WGMXCC1_WGMXCCGn1
    SolutionIndex: 14
    SolutionNameMin: Cijk_Ailk_Bljk_HSS_BH_UserArgs_MT256x128x64_MI16x16x1_SN_LDSB1_CLR1_GSU0_GSUC0_GSUWGMRR0_K1_LBSPPA4096_LBSPPB128_LPA0_MIWT8_4_PLR1_SU32_SUM0_SUS256_SKXCCM0_VWA4_VWB1_WGM8_WGMXCC1_WGMXCCGn1
    SolutionIndex: 15
    SolutionNameMin: Cijk_Ailk_Bljk_HSS_BH_UserArgs_MT256x128x64_MI16x16x1_SN_LDSB1_CLR1_GSU0_GSUC0_GSUWGMRR0_K1_LBSPPA4096_LBSPPB512_LPA0_MIWT8_4_PLR2_SU32_SUM0_SUS256_SKXCCM0_VWA4_VWB4_WGM8_WGMXCC1_WGMXCCGn1
    SolutionIndex: 16
    SolutionNameMin: Cijk_Ailk_Bljk_HSS_BH_UserArgs_MT256x64x64_MI16x16x1_SN_LDSB1_CLR1_GSU0_GSUC0_GSUWGMRR0_K1_LBSPPA4096_LBSPPB128_LPA0_MIWT8_2_PLR1_SU32_SUM0_SUS256_SKXCCM0_VWA4_VWB1_WGM8_WGMXCC1_WGMXCCGn1
    SolutionIndex: 17
    SolutionNameMin: Cijk_Ailk_Bljk_HSS_BH_UserArgs_MT128x128x64_MI16x16x1_SN_LDSB1_CLR1_GSU0_GSUC0_GSUWGMRR0_K1_LBSPPA2048_LBSPPB256_LPA0_MIWT4_4_PLR1_SU32_SUM0_SUS256_SKXCCM0_VWA4_VWB2_WGM1_WGMXCC1_WGMXCCGn1
    SolutionIndex: 18
    SolutionNameMin: Cijk_Ailk_Bljk_HSS_BH_UserArgs_MT128x128x64_MI16x16x1_SN_LDSB1_CLR1_GSU0_GSUC0_GSUWGMRR0_K1_LBSPPA2048_LBSPPB512_LPA0_MIWT4_4_PLR1_SU32_SUM0_SUS256_SKXCCM0_VWA4_VWB4_WGM1_WGMXCC1_WGMXCCGn1
    SolutionIndex: 19
    SolutionNameMin: Cijk_Ailk_Bljk_HSS_BH_UserArgs_MT128x128x64_MI16x16x1_SN_LDSB1_CLR1_GSU0_GSUC0_GSUWGMRR0_K1_LBSPPA2048_LBSPPB128_LPA32_MIWT4_4_PLR1_SU32_SUM0_SUS256_SKXCCM0_VWA2_VWB1_WGM4_WGMXCC1_WGMXCCGn1
    SolutionIndex: 20
    SolutionNameMin: Cijk_Ailk_Bljk_HSS_BH_UserArgs_MT128x128x64_MI16x16x1_SN_LDSB1_CLR1_GSU0_GSUC0_GSUWGMRR0_K1_LBSPPA2048_LBSPPB128_LPA0_MIWT4_4_PLR1_SU32_SUM0_SUS256_SKXCCM0_VWA4_VWB1_WGM4_WGMXCC1_WGMXCCGn1
    SolutionIndex: 21
    SolutionNameMin: Cijk_Ailk_Bljk_HSS_BH_UserArgs_MT128x128x64_MI16x16x1_SN_LDSB1_CLR1_GSU0_GSUC0_GSUWGMRR0_K1_LBSPPA2048_LBSPPB128_LPA0_MIWT4_4_PLR1_SU32_SUM0_SUS256_SKXCCM0_VWA4_VWB1_WGM8_WGMXCC1_WGMXCCGn1
    SolutionIndex: 22
    SolutionNameMin: Cijk_Ailk_Bljk_HSS_BH_UserArgs_MT64x64x64_MI16x16x1_SN_LDSB1_CLR1_GSU0_GSUC0_GSUWGMRR0_K1_LBSPPA1024_LBSPPB128_LPA32_MIWT2_2_PLR1_SU32_SUM0_SUS256_SKXCCM0_VWA2_VWB1_WGM1_WGMXCC1_WGMXCCGn1
    SolutionIndex: 23
    SolutionNameMin: Cijk_Ailk_Bljk_HSS_BH_UserArgs_MT64x64x64_MI16x16x1_SN_LDSB1_CLR1_GSU0_GSUC0_GSUWGMRR0_K1_LBSPPA1024_LBSPPB128_LPA32_MIWT2_2_PLR1_SU32_SUM0_SUS256_SKXCCM0_VWA2_VWB1_WGM8_WGMXCC1_WGMXCCGn1
    SolutionIndex: 24
    SolutionNameMin: Cijk_Ailk_Bljk_HSS_BH_UserArgs_MT32x32x64_MI16x16x1_SN_LDSB0_CLR1_GSU0_GSUC0_GSUWGMRR0_K1_LBSPPA512_LBSPPB128_LPA16_MIWT1_1_PLR1_SU32_SUM0_SUS256_SKXCCM0_VWA1_VWB1_WGM1_WGMXCC1_WGMXCCGn1
    SolutionIndex: 25
    SolutionNameMin: Cijk_Ailk_Bljk_HSS_BH_UserArgs_MT64x128x128_MI16x16x1_SN_LDSB1_CLR1_GSU0_GSUC0_GSUWGMRR0_K1_LBSPPA1024_LBSPPB512_LPA32_MIWT2_4_PLR2_SU32_SUM0_SUS256_SKXCCM0_VWA2_VWB2_WGM1_WGMXCC1_WGMXCCGn1
    SolutionIndex: 26
    SolutionNameMin: Cijk_Ailk_Bljk_HSS_BH_UserArgs_MT64x128x128_MI16x16x1_SN_LDSB1_CLR1_GSU0_GSUC0_GSUWGMRR0_K1_LBSPPA1024_LBSPPB1024_LPA32_MIWT2_4_PLR2_SU32_SUM0_SUS256_SKXCCM0_VWA2_VWB4_WGM1_WGMXCC1_WGMXCCGn1
    SolutionIndex: 27
    SolutionNameMin: Cijk_Ailk_Bljk_HSS_BH_UserArgs_MT64x128x128_MI16x16x1_SN_LDSB1_CLR1_GSU0_GSUC0_GSUWGMRR0_K1_LBSPPA1024_LBSPPB256_LPA32_MIWT2_4_PLR2_SU32_SUM0_SUS256_SKXCCM0_VWA2_VWB1_WGM4_WGMXCC1_WGMXCCGn1
    SolutionIndex: 28
    SolutionNameMin: Cijk_Ailk_Bljk_HSS_BH_UserArgs_MT64x128x128_MI16x16x1_SN_LDSB1_CLR1_GSU0_GSUC0_GSUWGMRR0_K1_LBSPPA1024_LBSPPB512_LPA32_MIWT2_4_PLR2_SU32_SUM0_SUS256_SKXCCM0_VWA2_VWB2_WGM4_WGMXCC1_WGMXCCGn1
    SolutionIndex: 29
    SolutionNameMin: Cijk_Ailk_Bljk_HSS_BH_UserArgs_MT128x64x128_MI16x16x1_SN_LDSB1_CLR1_GSU0_GSUC0_GSUWGMRR0_K1_LBSPPA2048_LBSPPB256_LPA0_MIWT4_2_PLR1_SU32_SUM0_SUS256_SKXCCM0_VWA4_VWB1_WGM1_WGMXCC1_WGMXCCGn1
    SolutionIndex: 30
    SolutionNameMin: Cijk_Ailk_Bljk_HSS_BH_UserArgs_MT128x64x128_MI16x16x1_SN_LDSB1_CLR1_GSU0_GSUC0_GSUWGMRR0_K1_LBSPPA2048_LBSPPB256_LPA0_MIWT4_2_PLR2_SU32_SUM0_SUS256_SKXCCM0_VWA4_VWB1_WGM1_WGMXCC1_WGMXCCGn1
    SolutionIndex: 31
    SolutionNameMin: Cijk_Ailk_Bljk_HSS_BH_UserArgs_MT128x64x128_MI16x16x1_SN_LDSB1_CLR1_GSU0_GSUC0_GSUWGMRR0_K1_LBSPPA2048_LBSPPB512_LPA0_MIWT4_2_PLR2_SU32_SUM0_SUS256_SKXCCM0_VWA4_VWB2_WGM1_WGMXCC1_WGMXCCGn1
    SolutionIndex: 32
    SolutionNameMin: Cijk_Ailk_Bljk_HSS_BH_UserArgs_MT128x64x128_MI16x16x1_SN_LDSB1_CLR1_GSU0_GSUC0_GSUWGMRR0_K1_LBSPPA2048_LBSPPB512_LPA0_MIWT4_2_PLR1_SU32_SUM0_SUS256_SKXCCM0_VWA4_VWB2_WGM8_WGMXCC1_WGMXCCGn1
    SolutionIndex: 33
    SolutionNameMin: Cijk_Ailk_Bljk_HSS_BH_UserArgs_MT64x64x128_MI16x16x1_SN_LDSB1_CLR1_GSU0_GSUC0_GSUWGMRR0_K1_LBSPPA1024_LBSPPB256_LPA32_MIWT2_2_PLR2_SU32_SUM0_SUS256_SKXCCM0_VWA2_VWB1_WGM1_WGMXCC1_WGMXCCGn1
    SolutionIndex: 34
    SolutionNameMin: Cijk_Ailk_Bljk_HSS_BH_UserArgs_MT64x64x128_MI16x16x1_SN_LDSB1_CLR1_GSU0_GSUC0_GSUWGMRR0_K1_LBSPPA1024_LBSPPB512_LPA32_MIWT2_2_PLR2_SU32_SUM0_SUS256_SKXCCM0_VWA2_VWB2_WGM1_WGMXCC1_WGMXCCGn1
    SolutionIndex: 35
    SolutionNameMin: Cijk_Ailk_Bljk_HSS_BH_UserArgs_MT64x64x128_MI16x16x1_SN_LDSB1_CLR1_GSU0_GSUC0_GSUWGMRR0_K1_LBSPPA1024_LBSPPB256_LPA32_MIWT2_2_PLR2_SU32_SUM0_SUS256_SKXCCM0_VWA2_VWB1_WGM4_WGMXCC1_WGMXCCGn1
    SolutionIndex: 36
    SolutionNameMin: Cijk_Ailk_Bljk_HSS_BH_UserArgs_MT64x64x128_MI16x16x1_SN_LDSB1_CLR1_GSU0_GSUC0_GSUWGMRR0_K1_LBSPPA1024_LBSPPB512_LPA32_MIWT2_2_PLR2_SU32_SUM0_SUS256_SKXCCM0_VWA2_VWB2_WGM4_WGMXCC1_WGMXCCGn1
    SolutionIndex: 37
    SolutionNameMin: Cijk_Ailk_Bljk_HSS_BH_UserArgs_MT64x64x128_MI16x16x1_SN_LDSB1_CLR1_GSU0_GSUC0_GSUWGMRR0_K1_LBSPPA1024_LBSPPB256_LPA32_MIWT2_2_PLR2_SU32_SUM0_SUS256_SKXCCM0_VWA2_VWB1_WGM8_WGMXCC1_WGMXCCGn1
    SolutionIndex: 38
    SolutionNameMin: Cijk_Ailk_Bljk_HSS_BH_UserArgs_MT64x64x128_MI16x16x1_SN_LDSB1_CLR1_GSU0_GSUC0_GSUWGMRR0_K1_LBSPPA1024_LBSPPB512_LPA32_MIWT2_2_PLR2_SU32_SUM0_SUS256_SKXCCM0_VWA2_VWB2_WGM8_WGMXCC1_WGMXCCGn1
    SolutionIndex: 39
    SolutionNameMin: Cijk_Ailk_Bljk_HSS_BH_UserArgs_MT32x64x128_MI16x16x1_SN_LDSB1_CLR1_GSU0_GSUC0_GSUWGMRR0_K1_LBSPPA512_LBSPPB256_LPA16_MIWT1_2_PLR2_SU32_SUM0_SUS256_SKXCCM0_VWA1_VWB1_WGM1_WGMXCC1_WGMXCCGn1
    SolutionIndex: 40
    SolutionNameMin: Cijk_Ailk_Bljk_HSS_BH_UserArgs_MT32x64x128_MI16x16x1_SN_LDSB1_CLR1_GSU0_GSUC0_GSUWGMRR0_K1_LBSPPA512_LBSPPB256_LPA16_MIWT1_2_PLR2_SU32_SUM0_SUS256_SKXCCM0_VWA1_VWB1_WGM4_WGMXCC1_WGMXCCGn1
    SolutionIndex: 41
    SolutionNameMin: Cijk_Ailk_Bljk_HSS_BH_UserArgs_MT64x32x128_MI16x16x1_SN_LDSB1_CLR1_GSU0_GSUC0_GSUWGMRR0_K1_LBSPPA1024_LBSPPB256_LPA32_MIWT2_1_PLR2_SU32_SUM0_SUS256_SKXCCM0_VWA2_VWB1_WGM1_WGMXCC1_WGMXCCGn1
    SolutionIndex: 42
    SolutionNameMin: Cijk_Ailk_Bljk_HSS_BH_UserArgs_MT64x32x128_MI16x16x1_SN_LDSB1_CLR1_GSU0_GSUC0_GSUWGMRR0_K1_LBSPPA1024_LBSPPB256_LPA32_MIWT2_1_PLR2_SU32_SUM0_SUS256_SKXCCM0_VWA2_VWB1_WGM4_WGMXCC1_WGMXCCGn1
    SolutionIndex: 43
    SolutionNameMin: Cijk_Ailk_Bljk_HSS_BH_UserArgs_MT32x32x128_MI16x16x1_SN_LDSB1_CLR1_GSU0_GSUC0_GSUWGMRR0_K1_LBSPPA512_LBSPPB256_LPA16_MIWT1_1_PLR1_SU32_SUM0_SUS256_SKXCCM0_VWA1_VWB1_WGM1_WGMXCC1_WGMXCCGn1
    SolutionIndex: 44
    SolutionNameMin: Cijk_Ailk_Bljk_HSS_BH_UserArgs_MT32x32x128_MI16x16x1_SN_LDSB1_CLR1_GSU0_GSUC0_GSUWGMRR0_K1_LBSPPA512_LBSPPB256_LPA16_MIWT1_1_PLR2_SU32_SUM0_SUS256_SKXCCM0_VWA1_VWB1_WGM1_WGMXCC1_WGMXCCGn1
    SolutionIndex: 45
    SolutionNameMin: Cijk_Ailk_Bljk_HSS_BH_UserArgs_MT256x256x32_MI16x16x1_SN_LDSB1_CLR1_GSU0_GSUC0_GSUWGMRR0_K1_LBSPPA2048_LBSPPB128_LPA0_MIWT8_8_PLR1_SU32_SUM0_SUS256_SKXCCM8_VWA4_VWB1_WGM1_WGMXCC1_WGMXCCGn1
    SolutionIndex: 46
    SolutionNameMin: Cijk_Ailk_Bljk_HSS_BH_UserArgs_MT256x256x32_MI16x16x1_SN_LDSB1_CLR1_GSU0_GSUC0_GSUWGMRR0_K1_LBSPPA2048_LBSPPB128_LPA0_MIWT8_8_PLR1_SU32_SUM0_SUS256_SKXCCM8_VWA4_VWB2_WGM1_WGMXCC1_WGMXCCGn1
    SolutionIndex: 47
    SolutionNameMin: Cijk_Ailk_Bljk_HSS_BH_UserArgs_MT256x256x32_MI16x16x1_SN_LDSB1_CLR1_GSU0_GSUC0_GSUWGMRR0_K1_LBSPPA2048_LBSPPB512_LPA0_MIWT8_8_PLR1_SU32_SUM0_SUS256_SKXCCM8_VWA4_VWB8_WGM1_WGMXCC1_WGMXCCGn1
    SolutionIndex: 48
    SolutionNameMin: Cijk_Ailk_Bljk_HSS_BH_UserArgs_MT256x256x32_MI16x16x1_SN_LDSB1_CLR1_GSU0_GSUC0_GSUWGMRR0_K1_LBSPPA2048_LBSPPB128_LPA0_MIWT8_8_PLR1_SU32_SUM0_SUS256_SKXCCM8_VWA4_VWB1_WGM4_WGMXCC1_WGMXCCGn1
    SolutionIndex: 49
    SolutionNameMin: Cijk_Ailk_Bljk_HSS_BH_UserArgs_MT256x256x32_MI16x16x1_SN_LDSB1_CLR1_GSU0_GSUC0_GSUWGMRR0_K1_LBSPPA2048_LBSPPB128_LPA32_MIWT8_8_PLR1_SU32_SUM0_SUS256_SKXCCM8_VWA2_VWB2_WGM4_WGMXCC1_WGMXCCGn1
    SolutionIndex: 50
    SolutionNameMin: Cijk_Ailk_Bljk_HSS_BH_UserArgs_MT256x256x32_MI16x16x1_SN_LDSB1_CLR1_GSU0_GSUC0_GSUWGMRR0_K1_LBSPPA2048_LBSPPB128_LPA0_MIWT8_8_PLR1_SU32_SUM0_SUS256_SKXCCM8_VWA4_VWB2_WGM4_WGMXCC1_WGMXCCGn1
    SolutionIndex: 51
    SolutionNameMin: Cijk_Ailk_Bljk_HSS_BH_UserArgs_MT256x256x32_MI16x16x1_SN_LDSB1_CLR1_GSU0_GSUC0_GSUWGMRR0_K1_LBSPPA2048_LBSPPB512_LPA32_MIWT8_8_PLR1_SU32_SUM0_SUS256_SKXCCM8_VWA2_VWB8_WGM4_WGMXCC1_WGMXCCGn1
    SolutionIndex: 52
    SolutionNameMin: Cijk_Ailk_Bljk_HSS_BH_UserArgs_MT256x256x32_MI16x16x1_SN_LDSB1_CLR1_GSU0_GSUC0_GSUWGMRR0_K1_LBSPPA2048_LBSPPB512_LPA0_MIWT8_8_PLR1_SU32_SUM0_SUS256_SKXCCM8_VWA4_VWB8_WGM4_WGMXCC1_WGMXCCGn1
    SolutionIndex: 53
    SolutionNameMin: Cijk_Ailk_Bljk_HSS_BH_UserArgs_MT256x256x32_MI16x16x1_SN_LDSB1_CLR1_GSU0_GSUC0_GSUWGMRR0_K1_LBSPPA2048_LBSPPB128_LPA0_MIWT8_8_PLR1_SU32_SUM0_SUS256_SKXCCM8_VWA4_VWB2_WGM8_WGMXCC1_WGMXCCGn1
    SolutionIndex: 54
    SolutionNameMin: Cijk_Ailk_Bljk_HSS_BH_UserArgs_MT256x256x32_MI16x16x1_SN_LDSB1_CLR1_GSU0_GSUC0_GSUWGMRR0_K1_LBSPPA2048_LBSPPB256_LPA0_MIWT8_8_PLR1_SU32_SUM0_SUS256_SKXCCM8_VWA4_VWB4_WGM8_WGMXCC1_WGMXCCGn1
    SolutionIndex: 55
    SolutionNameMin: Cijk_Ailk_Bljk_HSS_BH_UserArgs_MT256x256x32_MI16x16x1_SN_LDSB1_CLR1_GSU0_GSUC0_GSUWGMRR0_K1_LBSPPA2048_LBSPPB512_LPA32_MIWT8_8_PLR1_SU32_SUM0_SUS256_SKXCCM8_VWA2_VWB8_WGM8_WGMXCC1_WGMXCCGn1
    SolutionIndex: 56
    SolutionNameMin: Cijk_Ailk_Bljk_HSS_BH_UserArgs_MT256x256x32_MI16x16x1_SN_LDSB1_CLR1_GSU0_GSUC0_GSUWGMRR0_K1_LBSPPA2048_LBSPPB512_LPA0_MIWT8_8_PLR1_SU32_SUM0_SUS256_SKXCCM8_VWA4_VWB8_WGM8_WGMXCC1_WGMXCCGn1
    SolutionIndex: 57
    SolutionNameMin: Cijk_Ailk_Bljk_HSS_BH_UserArgs_MT256x128x32_MI16x16x1_SN_LDSB1_CLR1_GSU0_GSUC0_GSUWGMRR0_K1_LBSPPA2048_LBSPPB256_LPA0_MIWT8_4_PLR1_SU32_SUM0_SUS256_SKXCCM8_VWA4_VWB4_WGM4_WGMXCC1_WGMXCCGn1
    SolutionIndex: 58
    SolutionNameMin: Cijk_Ailk_Bljk_HSS_BH_UserArgs_MT256x64x32_MI16x16x1_SN_LDSB1_CLR1_GSU0_GSUC0_GSUWGMRR0_K1_LBSPPA2048_LBSPPB128_LPA0_MIWT8_2_PLR1_SU32_SUM0_SUS256_SKXCCM8_VWA4_VWB1_WGM8_WGMXCC1_WGMXCCGn1
    SolutionIndex: 59
    SolutionNameMin: Cijk_Ailk_Bljk_HSS_BH_UserArgs_MT128x128x32_MI16x16x1_SN_LDSB1_CLR1_GSU0_GSUC0_GSUWGMRR0_K1_LBSPPA1024_LBSPPB128_LPA0_MIWT4_4_PLR1_SU32_SUM0_SUS256_SKXCCM8_VWA4_VWB1_WGM1_WGMXCC1_WGMXCCGn1
    SolutionIndex: 60
    SolutionNameMin: Cijk_Ailk_Bljk_HSS_BH_UserArgs_MT128x128x32_MI16x16x1_SN_LDSB1_CLR1_GSU0_GSUC0_GSUWGMRR0_K1_LBSPPA1024_LBSPPB128_LPA0_MIWT4_4_PLR1_SU32_SUM0_SUS256_SKXCCM8_VWA4_VWB2_WGM1_WGMXCC1_WGMXCCGn1
    SolutionIndex: 61
    SolutionNameMin: Cijk_Ailk_Bljk_HSS_BH_UserArgs_MT128x128x32_MI16x16x1_SN_LDSB1_CLR1_GSU0_GSUC0_GSUWGMRR0_K1_LBSPPA1024_LBSPPB256_LPA0_MIWT4_4_PLR1_SU32_SUM0_SUS256_SKXCCM8_VWA4_VWB4_WGM1_WGMXCC1_WGMXCCGn1
    SolutionIndex: 62
    SolutionNameMin: Cijk_Ailk_Bljk_HSS_BH_UserArgs_MT128x128x32_MI16x16x1_SN_LDSB1_CLR1_GSU0_GSUC0_GSUWGMRR0_K1_LBSPPA1024_LBSPPB256_LPA0_MIWT4_4_PLR1_SU32_SUM0_SUS256_SKXCCM8_VWA4_VWB4_WGM4_WGMXCC1_WGMXCCGn1
    SolutionIndex: 63
    SolutionNameMin: Cijk_Ailk_Bljk_HSS_BH_UserArgs_MT128x128x32_MI16x16x1_SN_LDSB1_CLR1_GSU0_GSUC0_GSUWGMRR0_K1_LBSPPA1024_LBSPPB128_LPA0_MIWT4_4_PLR1_SU32_SUM0_SUS256_SKXCCM8_VWA4_VWB2_WGM8_WGMXCC1_WGMXCCGn1
    SolutionIndex: 64
    SolutionNameMin: Cijk_Ailk_Bljk_HSS_BH_UserArgs_MT128x128x32_MI16x16x1_SN_LDSB1_CLR1_GSU0_GSUC0_GSUWGMRR0_K1_LBSPPA1024_LBSPPB256_LPA0_MIWT4_4_PLR1_SU32_SUM0_SUS256_SKXCCM8_VWA4_VWB4_WGM8_WGMXCC1_WGMXCCGn1
    SolutionIndex: 65
    SolutionNameMin: Cijk_Ailk_Bljk_HSS_BH_UserArgs_MT128x64x32_MI16x16x1_SN_LDSB0_CLR1_GSU0_GSUC0_GSUWGMRR0_K1_LBSPPA1024_LBSPPB128_LPA0_MIWT4_2_PLR1_SU32_SUM0_SUS256_SKXCCM8_VWA4_VWB1_WGM1_WGMXCC1_WGMXCCGn1
    SolutionIndex: 66
    SolutionNameMin: Cijk_Ailk_Bljk_HSS_BH_UserArgs_MT128x64x32_MI16x16x1_SN_LDSB0_CLR1_GSU0_GSUC0_GSUWGMRR0_K1_LBSPPA1024_LBSPPB128_LPA0_MIWT4_2_PLR1_SU32_SUM0_SUS256_SKXCCM8_VWA4_VWB2_WGM1_WGMXCC1_WGMXCCGn1
    SolutionIndex: 67
    SolutionNameMin: Cijk_Ailk_Bljk_HSS_BH_UserArgs_MT128x32x32_MI16x16x1_SN_LDSB0_CLR1_GSU0_GSUC0_GSUWGMRR0_K1_LBSPPA1024_LBSPPB128_LPA0_MIWT4_1_PLR1_SU32_SUM0_SUS256_SKXCCM8_VWA4_VWB1_WGM1_WGMXCC1_WGMXCCGn1
    SolutionIndex: 68
    SolutionNameMin: Cijk_Ailk_Bljk_HSS_BH_UserArgs_MT128x256x64_MI16x16x1_SN_LDSB1_CLR1_GSU0_GSUC0_GSUWGMRR0_K1_LBSPPA2048_LBSPPB128_LPA0_MIWT4_8_PLR1_SU32_SUM0_SUS256_SKXCCM8_VWA4_VWB1_WGM1_WGMXCC1_WGMXCCGn1
    SolutionIndex: 69
    SolutionNameMin: Cijk_Ailk_Bljk_HSS_BH_UserArgs_MT128x256x64_MI16x16x1_SN_LDSB1_CLR1_GSU0_GSUC0_GSUWGMRR0_K1_LBSPPA2048_LBSPPB256_LPA0_MIWT4_8_PLR1_SU32_SUM0_SUS256_SKXCCM8_VWA4_VWB2_WGM1_WGMXCC1_WGMXCCGn1
    SolutionIndex: 70
    SolutionNameMin: Cijk_Ailk_Bljk_HSS_BH_UserArgs_MT128x256x64_MI16x16x1_SN_LDSB1_CLR1_GSU0_GSUC0_GSUWGMRR0_K1_LBSPPA2048_LBSPPB512_LPA0_MIWT4_8_PLR1_SU32_SUM0_SUS256_SKXCCM8_VWA4_VWB4_WGM1_WGMXCC1_WGMXCCGn1
    SolutionIndex: 71
    SolutionNameMin: Cijk_Ailk_Bljk_HSS_BH_UserArgs_MT128x256x64_MI16x16x1_SN_LDSB1_CLR1_GSU0_GSUC0_GSUWGMRR0_K1_LBSPPA2048_LBSPPB1024_LPA0_MIWT4_8_PLR1_SU32_SUM0_SUS256_SKXCCM8_VWA4_VWB8_WGM1_WGMXCC1_WGMXCCGn1
    SolutionIndex: 72
    SolutionNameMin: Cijk_Ailk_Bljk_HSS_BH_UserArgs_MT128x256x64_MI16x16x1_SN_LDSB1_CLR1_GSU0_GSUC0_GSUWGMRR0_K1_LBSPPA2048_LBSPPB128_LPA32_MIWT4_8_PLR1_SU32_SUM0_SUS256_SKXCCM8_VWA2_VWB1_WGM4_WGMXCC1_WGMXCCGn1
    SolutionIndex: 73
    SolutionNameMin: Cijk_Ailk_Bljk_HSS_BH_UserArgs_MT128x256x64_MI16x16x1_SN_LDSB1_CLR1_GSU0_GSUC0_GSUWGMRR0_K1_LBSPPA2048_LBSPPB128_LPA0_MIWT4_8_PLR1_SU32_SUM0_SUS256_SKXCCM8_VWA4_VWB1_WGM4_WGMXCC1_WGMXCCGn1
    SolutionIndex: 74
    SolutionNameMin: Cijk_Ailk_Bljk_HSS_BH_UserArgs_MT128x256x64_MI16x16x1_SN_LDSB1_CLR1_GSU0_GSUC0_GSUWGMRR0_K1_LBSPPA2048_LBSPPB256_LPA0_MIWT4_8_PLR1_SU32_SUM0_SUS256_SKXCCM8_VWA4_VWB2_WGM4_WGMXCC1_WGMXCCGn1
    SolutionIndex: 75
    SolutionNameMin: Cijk_Ailk_Bljk_HSS_BH_UserArgs_MT128x256x64_MI16x16x1_SN_LDSB1_CLR1_GSU0_GSUC0_GSUWGMRR0_K1_LBSPPA2048_LBSPPB512_LPA32_MIWT4_8_PLR1_SU32_SUM0_SUS256_SKXCCM8_VWA2_VWB4_WGM4_WGMXCC1_WGMXCCGn1
    SolutionIndex: 76
    SolutionNameMin: Cijk_Ailk_Bljk_HSS_BH_UserArgs_MT128x256x64_MI16x16x1_SN_LDSB1_CLR1_GSU0_GSUC0_GSUWGMRR0_K1_LBSPPA2048_LBSPPB512_LPA0_MIWT4_8_PLR1_SU32_SUM0_SUS256_SKXCCM8_VWA4_VWB4_WGM4_WGMXCC1_WGMXCCGn1
    SolutionIndex: 77
    SolutionNameMin: Cijk_Ailk_Bljk_HSS_BH_UserArgs_MT128x256x64_MI16x16x1_SN_LDSB1_CLR1_GSU0_GSUC0_GSUWGMRR0_K1_LBSPPA2048_LBSPPB1024_LPA0_MIWT4_8_PLR1_SU32_SUM0_SUS256_SKXCCM8_VWA4_VWB8_WGM4_WGMXCC1_WGMXCCGn1
    SolutionIndex: 78
    SolutionNameMin: Cijk_Ailk_Bljk_HSS_BH_UserArgs_MT128x256x64_MI16x16x1_SN_LDSB1_CLR1_GSU0_GSUC0_GSUWGMRR0_K1_LBSPPA2048_LBSPPB256_LPA32_MIWT4_8_PLR1_SU32_SUM0_SUS256_SKXCCM8_VWA2_VWB2_WGM8_WGMXCC1_WGMXCCGn1
    SolutionIndex: 79
    SolutionNameMin: Cijk_Ailk_Bljk_HSS_BH_UserArgs_MT128x256x64_MI16x16x1_SN_LDSB1_CLR1_GSU0_GSUC0_GSUWGMRR0_K1_LBSPPA2048_LBSPPB512_LPA32_MIWT4_8_PLR1_SU32_SUM0_SUS256_SKXCCM8_VWA2_VWB4_WGM8_WGMXCC1_WGMXCCGn1
    SolutionIndex: 80
    SolutionNameMin: Cijk_Ailk_Bljk_HSS_BH_UserArgs_MT128x256x64_MI16x16x1_SN_LDSB1_CLR1_GSU0_GSUC0_GSUWGMRR0_K1_LBSPPA2048_LBSPPB512_LPA0_MIWT4_8_PLR1_SU32_SUM0_SUS256_SKXCCM8_VWA4_VWB4_WGM8_WGMXCC1_WGMXCCGn1
    SolutionIndex: 81
    SolutionNameMin: Cijk_Ailk_Bljk_HSS_BH_UserArgs_MT128x256x64_MI16x16x1_SN_LDSB1_CLR1_GSU0_GSUC0_GSUWGMRR0_K1_LBSPPA2048_LBSPPB1024_LPA32_MIWT4_8_PLR1_SU32_SUM0_SUS256_SKXCCM8_VWA2_VWB8_WGM8_WGMXCC1_WGMXCCGn1
    SolutionIndex: 82
    SolutionNameMin: Cijk_Ailk_Bljk_HSS_BH_UserArgs_MT128x256x64_MI16x16x1_SN_LDSB1_CLR1_GSU0_GSUC0_GSUWGMRR0_K1_LBSPPA2048_LBSPPB1024_LPA0_MIWT4_8_PLR1_SU32_SUM0_SUS256_SKXCCM8_VWA4_VWB8_WGM8_WGMXCC1_WGMXCCGn1
    SolutionIndex: 83
    SolutionNameMin: Cijk_Ailk_Bljk_HSS_BH_UserArgs_MT256x128x64_MI16x16x1_SN_LDSB1_CLR1_GSU0_GSUC0_GSUWGMRR0_K1_LBSPPA4096_LBSPPB512_LPA0_MIWT8_4_PLR1_SU32_SUM0_SUS256_SKXCCM8_VWA4_VWB4_WGM1_WGMXCC1_WGMXCCGn1
    SolutionIndex: 84
    SolutionNameMin: Cijk_Ailk_Bljk_HSS_BH_UserArgs_MT256x128x64_MI16x16x1_SN_LDSB1_CLR1_GSU0_GSUC0_GSUWGMRR0_K1_LBSPPA4096_LBSPPB256_LPA0_MIWT8_4_PLR1_SU32_SUM0_SUS256_SKXCCM8_VWA4_VWB2_WGM4_WGMXCC1_WGMXCCGn1
    SolutionIndex: 85
    SolutionNameMin: Cijk_Ailk_Bljk_HSS_BH_UserArgs_MT256x128x64_MI16x16x1_SN_LDSB1_CLR1_GSU0_GSUC0_GSUWGMRR0_K1_LBSPPA4096_LBSPPB512_LPA0_MIWT8_4_PLR1_SU32_SUM0_SUS256_SKXCCM8_VWA4_VWB4_WGM4_WGMXCC1_WGMXCCGn1
    SolutionIndex: 86
    SolutionNameMin: Cijk_Ailk_Bljk_HSS_BH_UserArgs_MT128x128x64_MI16x16x1_SN_LDSB1_CLR1_GSU0_GSUC0_GSUWGMRR0_K1_LBSPPA2048_LBSPPB128_LPA0_MIWT4_4_PLR1_SU32_SUM0_SUS256_SKXCCM8_VWA4_VWB1_WGM1_WGMXCC1_WGMXCCGn1
    SolutionIndex: 87
    SolutionNameMin: Cijk_Ailk_Bljk_HSS_BH_UserArgs_MT128x128x64_MI16x16x1_SN_LDSB1_CLR1_GSU0_GSUC0_GSUWGMRR0_K1_LBSPPA2048_LBSPPB256_LPA0_MIWT4_4_PLR1_SU32_SUM0_SUS256_SKXCCM8_VWA4_VWB2_WGM1_WGMXCC1_WGMXCCGn1
    SolutionIndex: 88
    SolutionNameMin: Cijk_Ailk_Bljk_HSS_BH_UserArgs_MT128x128x64_MI16x16x1_SN_LDSB1_CLR1_GSU0_GSUC0_GSUWGMRR0_K1_LBSPPA2048_LBSPPB512_LPA32_MIWT4_4_PLR1_SU32_SUM0_SUS256_SKXCCM8_VWA2_VWB4_WGM1_WGMXCC1_WGMXCCGn1
    SolutionIndex: 89
    SolutionNameMin: Cijk_Ailk_Bljk_HSS_BH_UserArgs_MT128x128x64_MI16x16x1_SN_LDSB1_CLR1_GSU0_GSUC0_GSUWGMRR0_K1_LBSPPA2048_LBSPPB512_LPA0_MIWT4_4_PLR1_SU32_SUM0_SUS256_SKXCCM8_VWA4_VWB4_WGM1_WGMXCC1_WGMXCCGn1
    SolutionIndex: 90
    SolutionNameMin: Cijk_Ailk_Bljk_HSS_BH_UserArgs_MT128x128x64_MI16x16x1_SN_LDSB1_CLR1_GSU0_GSUC0_GSUWGMRR0_K1_LBSPPA2048_LBSPPB128_LPA0_MIWT4_4_PLR1_SU32_SUM0_SUS256_SKXCCM8_VWA4_VWB1_WGM4_WGMXCC1_WGMXCCGn1
    SolutionIndex: 91
    SolutionNameMin: Cijk_Ailk_Bljk_HSS_BH_UserArgs_MT128x128x64_MI16x16x1_SN_LDSB1_CLR1_GSU0_GSUC0_GSUWGMRR0_K1_LBSPPA2048_LBSPPB256_LPA0_MIWT4_4_PLR1_SU32_SUM0_SUS256_SKXCCM8_VWA4_VWB2_WGM4_WGMXCC1_WGMXCCGn1
    SolutionIndex: 92
    SolutionNameMin: Cijk_Ailk_Bljk_HSS_BH_UserArgs_MT128x128x64_MI16x16x1_SN_LDSB1_CLR1_GSU0_GSUC0_GSUWGMRR0_K1_LBSPPA2048_LBSPPB512_LPA32_MIWT4_4_PLR1_SU32_SUM0_SUS256_SKXCCM8_VWA2_VWB4_WGM4_WGMXCC1_WGMXCCGn1
    SolutionIndex: 93
    SolutionNameMin: Cijk_Ailk_Bljk_HSS_BH_UserArgs_MT128x128x64_MI16x16x1_SN_LDSB1_CLR1_GSU0_GSUC0_GSUWGMRR0_K1_LBSPPA2048_LBSPPB512_LPA0_MIWT4_4_PLR1_SU32_SUM0_SUS256_SKXCCM8_VWA4_VWB4_WGM4_WGMXCC1_WGMXCCGn1
    SolutionIndex: 94
    SolutionNameMin: Cijk_Ailk_Bljk_HSS_BH_UserArgs_MT128x128x64_MI16x16x1_SN_LDSB1_CLR1_GSU0_GSUC0_GSUWGMRR0_K1_LBSPPA2048_LBSPPB128_LPA0_MIWT4_4_PLR1_SU32_SUM0_SUS256_SKXCCM8_VWA4_VWB1_WGM8_WGMXCC1_WGMXCCGn1
    SolutionIndex: 95
    SolutionNameMin: Cijk_Ailk_Bljk_HSS_BH_UserArgs_MT128x128x64_MI16x16x1_SN_LDSB1_CLR1_GSU0_GSUC0_GSUWGMRR0_K1_LBSPPA2048_LBSPPB256_LPA0_MIWT4_4_PLR1_SU32_SUM0_SUS256_SKXCCM8_VWA4_VWB2_WGM8_WGMXCC1_WGMXCCGn1
    SolutionIndex: 96
    SolutionNameMin: Cijk_Ailk_Bljk_HSS_BH_UserArgs_MT128x128x64_MI16x16x1_SN_LDSB1_CLR1_GSU0_GSUC0_GSUWGMRR0_K1_LBSPPA2048_LBSPPB512_LPA0_MIWT4_4_PLR1_SU32_SUM0_SUS256_SKXCCM8_VWA4_VWB4_WGM8_WGMXCC1_WGMXCCGn1
    SolutionIndex: 97
    SolutionNameMin: Cijk_Ailk_Bljk_HSS_BH_UserArgs_MT128x64x64_MI16x16x1_SN_LDSB1_CLR1_GSU0_GSUC0_GSUWGMRR0_K1_LBSPPA2048_LBSPPB128_LPA0_MIWT4_2_PLR1_SU32_SUM0_SUS256_SKXCCM8_VWA4_VWB1_WGM1_WGMXCC1_WGMXCCGn1
    SolutionIndex: 98
    SolutionNameMin: Cijk_Ailk_Bljk_HSS_BH_UserArgs_MT128x64x64_MI16x16x1_SN_LDSB1_CLR1_GSU0_GSUC0_GSUWGMRR0_K1_LBSPPA2048_LBSPPB256_LPA0_MIWT4_2_PLR1_SU32_SUM0_SUS256_SKXCCM8_VWA4_VWB2_WGM1_WGMXCC1_WGMXCCGn1
    SolutionIndex: 99
    SolutionNameMin: Cijk_Ailk_Bljk_HSS_BH_UserArgs_MT128x64x64_MI16x16x1_SN_LDSB1_CLR1_GSU0_GSUC0_GSUWGMRR0_K1_LBSPPA2048_LBSPPB128_LPA0_MIWT4_2_PLR1_SU32_SUM0_SUS256_SKXCCM8_VWA4_VWB1_WGM4_WGMXCC1_WGMXCCGn1
    SolutionIndex: 100
    SolutionNameMin: Cijk_Ailk_Bljk_HSS_BH_UserArgs_MT128x64x64_MI16x16x1_SN_LDSB1_CLR1_GSU0_GSUC0_GSUWGMRR0_K1_LBSPPA2048_LBSPPB256_LPA0_MIWT4_2_PLR1_SU32_SUM0_SUS256_SKXCCM8_VWA4_VWB2_WGM4_WGMXCC1_WGMXCCGn1
    SolutionIndex: 101
    SolutionNameMin: Cijk_Ailk_Bljk_HSS_BH_UserArgs_MT128x64x64_MI16x16x1_SN_LDSB1_CLR1_GSU0_GSUC0_GSUWGMRR0_K1_LBSPPA2048_LBSPPB128_LPA0_MIWT4_2_PLR1_SU32_SUM0_SUS256_SKXCCM8_VWA4_VWB1_WGM8_WGMXCC1_WGMXCCGn1
    SolutionIndex: 102
    SolutionNameMin: Cijk_Ailk_Bljk_HSS_BH_UserArgs_MT128x64x64_MI16x16x1_SN_LDSB1_CLR1_GSU0_GSUC0_GSUWGMRR0_K1_LBSPPA2048_LBSPPB256_LPA0_MIWT4_2_PLR1_SU32_SUM0_SUS256_SKXCCM8_VWA4_VWB2_WGM8_WGMXCC1_WGMXCCGn1
    SolutionIndex: 103
    SolutionNameMin: Cijk_Ailk_Bljk_HSS_BH_UserArgs_MT64x64x64_MI16x16x1_SN_LDSB1_CLR1_GSU0_GSUC0_GSUWGMRR0_K1_LBSPPA1024_LBSPPB128_LPA32_MIWT2_2_PLR1_SU32_SUM0_SUS256_SKXCCM8_VWA2_VWB1_WGM1_WGMXCC1_WGMXCCGn1
    SolutionIndex: 104
    SolutionNameMin: Cijk_Ailk_Bljk_HSS_BH_UserArgs_MT64x64x64_MI16x16x1_SN_LDSB1_CLR1_GSU0_GSUC0_GSUWGMRR0_K1_LBSPPA1024_LBSPPB256_LPA32_MIWT2_2_PLR1_SU32_SUM0_SUS256_SKXCCM8_VWA2_VWB2_WGM1_WGMXCC1_WGMXCCGn1
    SolutionIndex: 105
    SolutionNameMin: Cijk_Ailk_Bljk_HSS_BH_UserArgs_MT64x64x64_MI16x16x1_SN_LDSB1_CLR1_GSU0_GSUC0_GSUWGMRR0_K1_LBSPPA1024_LBSPPB128_LPA32_MIWT2_2_PLR1_SU32_SUM0_SUS256_SKXCCM8_VWA2_VWB1_WGM4_WGMXCC1_WGMXCCGn1
    SolutionIndex: 106
    SolutionNameMin: Cijk_Ailk_Bljk_HSS_BH_UserArgs_MT64x64x64_MI16x16x1_SN_LDSB1_CLR1_GSU0_GSUC0_GSUWGMRR0_K1_LBSPPA1024_LBSPPB256_LPA32_MIWT2_2_PLR1_SU32_SUM0_SUS256_SKXCCM8_VWA2_VWB2_WGM4_WGMXCC1_WGMXCCGn1
    SolutionIndex: 107
    SolutionNameMin: Cijk_Ailk_Bljk_HSS_BH_UserArgs_MT64x64x64_MI16x16x1_SN_LDSB1_CLR1_GSU0_GSUC0_GSUWGMRR0_K1_LBSPPA1024_LBSPPB128_LPA32_MIWT2_2_PLR1_SU32_SUM0_SUS256_SKXCCM8_VWA2_VWB1_WGM8_WGMXCC1_WGMXCCGn1
    SolutionIndex: 108
    SolutionNameMin: Cijk_Ailk_Bljk_HSS_BH_UserArgs_MT32x64x64_MI16x16x1_SN_LDSB0_CLR1_GSU0_GSUC0_GSUWGMRR0_K1_LBSPPA512_LBSPPB128_LPA16_MIWT1_2_PLR1_SU32_SUM0_SUS256_SKXCCM8_VWA1_VWB1_WGM1_WGMXCC1_WGMXCCGn1
    SolutionIndex: 109
    SolutionNameMin: Cijk_Ailk_Bljk_HSS_BH_UserArgs_MT32x64x64_MI16x16x1_SN_LDSB0_CLR1_GSU0_GSUC0_GSUWGMRR0_K1_LBSPPA512_LBSPPB256_LPA16_MIWT1_2_PLR1_SU32_SUM0_SUS256_SKXCCM8_VWA1_VWB2_WGM1_WGMXCC1_WGMXCCGn1
    SolutionIndex: 110
    SolutionNameMin: Cijk_Ailk_Bljk_HSS_BH_UserArgs_MT64x32x64_MI16x16x1_SN_LDSB0_CLR1_GSU0_GSUC0_GSUWGMRR0_K1_LBSPPA1024_LBSPPB128_LPA32_MIWT2_1_PLR1_SU32_SUM0_SUS256_SKXCCM8_VWA2_VWB1_WGM1_WGMXCC1_WGMXCCGn1
    SolutionIndex: 111
    SolutionNameMin: Cijk_Ailk_Bljk_HSS_BH_UserArgs_MT32x32x64_MI16x16x1_SN_LDSB0_CLR1_GSU0_GSUC0_GSUWGMRR0_K1_LBSPPA512_LBSPPB128_LPA16_MIWT1_1_PLR1_SU32_SUM0_SUS256_SKXCCM8_VWA1_VWB1_WGM1_WGMXCC1_WGMXCCGn1
    SolutionIndex: 112
    SolutionNameMin: Cijk_Ailk_Bljk_HSS_BH_UserArgs_MT32x32x64_MI16x16x1_SN_LDSB0_CLR1_GSU0_GSUC0_GSUWGMRR0_K1_LBSPPA512_LBSPPB128_LPA16_MIWT1_1_PLR1_SU32_SUM0_SUS256_SKXCCM8_VWA1_VWB1_WGM4_WGMXCC1_WGMXCCGn1
    SolutionIndex: 113
    SolutionNameMin: Cijk_Ailk_Bljk_HSS_BH_UserArgs_MT128x64x128_MI16x16x1_SN_LDSB1_CLR1_GSU0_GSUC0_GSUWGMRR0_K1_LBSPPA2048_LBSPPB512_LPA0_MIWT4_2_PLR1_SU32_SUM0_SUS256_SKXCCM8_VWA4_VWB2_WGM1_WGMXCC1_WGMXCCGn1
    SolutionIndex: 114
    SolutionNameMin: Cijk_Ailk_Bljk_HSS_BH_UserArgs_MT128x64x128_MI16x16x1_SN_LDSB1_CLR1_GSU0_GSUC0_GSUWGMRR0_K1_LBSPPA2048_LBSPPB256_LPA0_MIWT4_2_PLR2_SU32_SUM0_SUS256_SKXCCM8_VWA4_VWB1_WGM1_WGMXCC1_WGMXCCGn1
    SolutionIndex: 115
    SolutionNameMin: Cijk_Ailk_Bljk_HSS_BH_UserArgs_MT128x64x128_MI16x16x1_SN_LDSB1_CLR1_GSU0_GSUC0_GSUWGMRR0_K1_LBSPPA2048_LBSPPB256_LPA0_MIWT4_2_PLR1_SU32_SUM0_SUS256_SKXCCM8_VWA4_VWB1_WGM4_WGMXCC1_WGMXCCGn1
    SolutionIndex: 116
    SolutionNameMin: Cijk_Ailk_Bljk_HSS_BH_UserArgs_MT128x64x128_MI16x16x1_SN_LDSB1_CLR1_GSU0_GSUC0_GSUWGMRR0_K1_LBSPPA2048_LBSPPB256_LPA0_MIWT4_2_PLR2_SU32_SUM0_SUS256_SKXCCM8_VWA4_VWB1_WGM4_WGMXCC1_WGMXCCGn1
    SolutionIndex: 117
    SolutionNameMin: Cijk_Ailk_Bljk_HSS_BH_UserArgs_MT128x64x128_MI16x16x1_SN_LDSB1_CLR1_GSU0_GSUC0_GSUWGMRR0_K1_LBSPPA2048_LBSPPB512_LPA0_MIWT4_2_PLR2_SU32_SUM0_SUS256_SKXCCM8_VWA4_VWB2_WGM4_WGMXCC1_WGMXCCGn1
    SolutionIndex: 118
    SolutionNameMin: Cijk_Ailk_Bljk_HSS_BH_UserArgs_MT128x64x128_MI16x16x1_SN_LDSB1_CLR1_GSU0_GSUC0_GSUWGMRR0_K1_LBSPPA2048_LBSPPB512_LPA0_MIWT4_2_PLR1_SU32_SUM0_SUS256_SKXCCM8_VWA4_VWB2_WGM8_WGMXCC1_WGMXCCGn1
    SolutionIndex: 119
    SolutionNameMin: Cijk_Ailk_Bljk_HSS_BH_UserArgs_MT128x64x128_MI16x16x1_SN_LDSB1_CLR1_GSU0_GSUC0_GSUWGMRR0_K1_LBSPPA2048_LBSPPB256_LPA0_MIWT4_2_PLR2_SU32_SUM0_SUS256_SKXCCM8_VWA4_VWB1_WGM8_WGMXCC1_WGMXCCGn1
    SolutionIndex: 120
    SolutionNameMin: Cijk_Ailk_Bljk_HSS_BH_UserArgs_MT64x64x128_MI16x16x1_SN_LDSB1_CLR1_GSU0_GSUC0_GSUWGMRR0_K1_LBSPPA1024_LBSPPB256_LPA32_MIWT2_2_PLR2_SU32_SUM0_SUS256_SKXCCM8_VWA2_VWB1_WGM1_WGMXCC1_WGMXCCGn1
    SolutionIndex: 121
    SolutionNameMin: Cijk_Ailk_Bljk_HSS_BH_UserArgs_MT64x64x128_MI16x16x1_SN_LDSB1_CLR1_GSU0_GSUC0_GSUWGMRR0_K1_LBSPPA1024_LBSPPB512_LPA32_MIWT2_2_PLR2_SU32_SUM0_SUS256_SKXCCM8_VWA2_VWB2_WGM1_WGMXCC1_WGMXCCGn1
    SolutionIndex: 122
    SolutionNameMin: Cijk_Ailk_Bljk_HSS_BH_UserArgs_MT64x64x128_MI16x16x1_SN_LDSB1_CLR1_GSU0_GSUC0_GSUWGMRR0_K1_LBSPPA1024_LBSPPB256_LPA32_MIWT2_2_PLR2_SU32_SUM0_SUS256_SKXCCM8_VWA2_VWB1_WGM4_WGMXCC1_WGMXCCGn1
    SolutionIndex: 123
    SolutionNameMin: Cijk_Ailk_Bljk_HSS_BH_UserArgs_MT64x64x128_MI16x16x1_SN_LDSB1_CLR1_GSU0_GSUC0_GSUWGMRR0_K1_LBSPPA1024_LBSPPB512_LPA32_MIWT2_2_PLR2_SU32_SUM0_SUS256_SKXCCM8_VWA2_VWB2_WGM4_WGMXCC1_WGMXCCGn1
    SolutionIndex: 124
    SolutionNameMin: Cijk_Ailk_Bljk_HSS_BH_UserArgs_MT64x64x128_MI16x16x1_SN_LDSB1_CLR1_GSU0_GSUC0_GSUWGMRR0_K1_LBSPPA1024_LBSPPB256_LPA32_MIWT2_2_PLR2_SU32_SUM0_SUS256_SKXCCM8_VWA2_VWB1_WGM8_WGMXCC1_WGMXCCGn1
    SolutionIndex: 125
    SolutionNameMin: Cijk_Ailk_Bljk_HSS_BH_UserArgs_MT64x64x128_MI16x16x1_SN_LDSB1_CLR1_GSU0_GSUC0_GSUWGMRR0_K1_LBSPPA1024_LBSPPB512_LPA32_MIWT2_2_PLR2_SU32_SUM0_SUS256_SKXCCM8_VWA2_VWB2_WGM8_WGMXCC1_WGMXCCGn1
    SolutionIndex: 126
    SolutionNameMin: Cijk_Ailk_Bljk_HSS_BH_UserArgs_MT64x32x128_MI16x16x1_SN_LDSB1_CLR1_GSU0_GSUC0_GSUWGMRR0_K1_LBSPPA1024_LBSPPB256_LPA32_MIWT2_1_PLR1_SU32_SUM0_SUS256_SKXCCM8_VWA2_VWB1_WGM1_WGMXCC1_WGMXCCGn1
    SolutionIndex: 127
    SolutionNameMin: Cijk_Ailk_Bljk_HSS_BH_UserArgs_MT64x32x128_MI16x16x1_SN_LDSB1_CLR1_GSU0_GSUC0_GSUWGMRR0_K1_LBSPPA1024_LBSPPB256_LPA32_MIWT2_1_PLR2_SU32_SUM0_SUS256_SKXCCM8_VWA2_VWB1_WGM1_WGMXCC1_WGMXCCGn1
    SolutionIndex: 128
    SolutionNameMin: Cijk_Ailk_Bljk_HSS_BH_UserArgs_MT64x32x128_MI16x16x1_SN_LDSB1_CLR1_GSU0_GSUC0_GSUWGMRR0_K1_LBSPPA1024_LBSPPB256_LPA32_MIWT2_1_PLR1_SU32_SUM0_SUS256_SKXCCM8_VWA2_VWB1_WGM4_WGMXCC1_WGMXCCGn1
    SolutionIndex: 129
    SolutionNameMin: Cijk_Ailk_Bljk_HSS_BH_UserArgs_MT64x32x128_MI16x16x1_SN_LDSB1_CLR1_GSU0_GSUC0_GSUWGMRR0_K1_LBSPPA1024_LBSPPB256_LPA32_MIWT2_1_PLR2_SU32_SUM0_SUS256_SKXCCM8_VWA2_VWB1_WGM4_WGMXCC1_WGMXCCGn1
    SolutionIndex: 130
    SolutionNameMin: Cijk_Ailk_Bljk_HSS_BH_UserArgs_MT64x32x128_MI16x16x1_SN_LDSB1_CLR1_GSU0_GSUC0_GSUWGMRR0_K1_LBSPPA1024_LBSPPB256_LPA32_MIWT2_1_PLR1_SU32_SUM0_SUS256_SKXCCM8_VWA2_VWB1_WGM8_WGMXCC1_WGMXCCGn1
    SolutionIndex: 131
    SolutionNameMin: Cijk_Ailk_Bljk_HSS_BH_UserArgs_MT32x32x128_MI16x16x1_SN_LDSB1_CLR1_GSU0_GSUC0_GSUWGMRR0_K1_LBSPPA512_LBSPPB256_LPA16_MIWT1_1_PLR1_SU32_SUM0_SUS256_SKXCCM8_VWA1_VWB1_WGM1_WGMXCC1_WGMXCCGn1
    SolutionIndex: 132
    SolutionNameMin: Cijk_Ailk_Bljk_HSS_BH_UserArgs_MT32x32x128_MI16x16x1_SN_LDSB1_CLR1_GSU0_GSUC0_GSUWGMRR0_K1_LBSPPA512_LBSPPB256_LPA16_MIWT1_1_PLR2_SU32_SUM0_SUS256_SKXCCM8_VWA1_VWB1_WGM1_WGMXCC1_WGMXCCGn1
    SolutionIndex: 133
    SolutionNameMin: Cijk_Ailk_Bljk_HSS_BH_UserArgs_MT32x32x128_MI16x16x1_SN_LDSB1_CLR1_GSU0_GSUC0_GSUWGMRR0_K1_LBSPPA512_LBSPPB256_LPA16_MIWT1_1_PLR2_SU32_SUM0_SUS256_SKXCCM8_VWA1_VWB1_WGM4_WGMXCC1_WGMXCCGn1
    SolutionIndex: 134
    SolutionNameMin: Cijk_Ailk_Bljk_HSS_BH_UserArgs_MT32x32x32_MI16x16x1_SN_LDSB0_CLR0_GSU0_GSUC0_GSUWGMRR0_K1_LBSPPA256_LBSPPB128_LPA16_MIWT1_1_PLR0_SU32_SUM0_SUS256_SKXCCM8_VWA1_VWB1_WGM4_WGMXCC1_WGMXCCGn1
- - - [128, 128, 1, 128, 128, 128, 128, 128]
    - [131, 0.082]
  - - [128, 128, 1, 256, 128, 128, 128, 256]
    - [24, 0.149]
  - - [128, 128, 1, 512, 128, 128, 128, 512]
    - [111, 0.25]
  - - [128, 128, 1, 1024, 128, 128, 128, 1024]
    - [132, 0.381]
  - - [128, 128, 1, 2048, 128, 128, 128, 2048]
    - [44, 0.578]
  - - [128, 128, 1, 4096, 128, 128, 128, 4096]
    - [24, 0.988]
  - - [128, 128, 1, 8192, 128, 128, 128, 8192]
    - [132, 1.553]
  - - [128, 256, 1, 128, 128, 128, 128, 128]
    - [111, 0.169]
  - - [128, 256, 1, 256, 128, 128, 128, 256]
    - [131, 0.303]
  - - [128, 256, 1, 512, 128, 128, 128, 512]
    - [44, 0.51]
  - - [128, 256, 1, 1024, 128, 128, 128, 1024]
    - [131, 0.783]
  - - [128, 256, 1, 2048, 128, 128, 128, 2048]
    - [132, 1.154]
  - - [128, 256, 1, 4096, 128, 128, 128, 4096]
    - [111, 1.989]
  - - [128, 256, 1, 8192, 128, 128, 128, 8192]
    - [132, 3.026]
  - - [128, 512, 1, 128, 128, 128, 128, 128]
    - [24, 0.334]
  - - [128, 512, 1, 256, 128, 128, 128, 256]
    - [111, 0.604]
  - - [128, 512, 1, 512, 128, 128, 128, 512]
    - [131, 1.008]
  - - [128, 512, 1, 1024, 128, 128, 128, 1024]
    - [43, 1.551]
  - - [128, 512, 1, 2048, 128, 128, 128, 2048]
    - [132, 2.265]
  - - [128, 512, 1, 4096, 128, 128, 128, 4096]
    - [111, 3.759]
  - - [128, 512, 1, 8192, 128, 128, 128, 8192]
    - [132, 5.84]
  - - [128, 1024, 1, 128, 128, 128, 128, 128]
    - [131, 0.639]
  - - [128, 1024, 1, 256, 128, 128, 128, 256]
    - [111, 1.183]
  - - [128, 1024, 1, 512, 128, 128, 128, 512]
    - [43, 1.995]
  - - [128, 1024, 1, 1024, 128, 128, 128, 1024]
    - [132, 3.037]
  - - [128, 1024, 1, 2048, 128, 128, 128, 2048]
    - [44, 4.25]
  - - [128, 1024, 1, 4096, 128, 128, 128, 4096]
    - [109, 6.478]
  - - [128, 1024, 1, 8192, 128, 128, 128, 8192]
    - [41, 9.001]
  - - [128, 2048, 1, 128, 128, 128, 128, 128]
    - [24, 1.245]
  - - [128, 2048, 1, 256, 128, 128, 128, 256]
    - [111, 2.287]
  - - [128, 2048, 1, 512, 128, 128, 128, 512]
    - [111, 3.693]
  - - [128, 2048, 1, 1024, 128, 128, 128, 1024]
    - [132, 5.701]
  - - [128, 2048, 1, 2048, 128, 128, 128, 2048]
    - [132, 7.705]
  - - [128, 2048, 1, 4096, 128, 128, 128, 4096]
    - [127, 10.122]
  - - [128, 2048, 1, 8192, 128, 128, 128, 8192]
    - [35, 12.871]
  - - [128, 4096, 1, 128, 128, 128, 128, 128]
    - [127, 2.229]
  - - [128, 4096, 1, 256, 128, 128, 128, 256]
    - [127, 4.048]
  - - [128, 4096, 1, 512, 128, 128, 128, 512]
    - [127, 6.455]
  - - [128, 4096, 1, 1024, 128, 128, 128, 1024]
    - [126, 9.786]
  - - [128, 4096, 1, 2048, 128, 128, 128, 2048]
    - [127, 11.52]
  - - [128, 4096, 1, 4096, 128, 128, 128, 4096]
    - [98, 13.79]
  - - [128, 4096, 1, 8192, 128, 128, 128, 8192]
    - [113, 17.384]
  - - [128, 8192, 1, 128, 128, 128, 128, 128]
    - [103, 3.656]
  - - [128, 8192, 1, 256, 128, 128, 128, 256]
    - [103, 6.697]
  - - [128, 8192, 1, 512, 128, 128, 128, 512]
    - [103, 10.541]
  - - [128, 8192, 1, 1024, 128, 128, 128, 1024]
    - [120, 14.22]
  - - [128, 8192, 1, 2048, 128, 128, 128, 2048]
    - [123, 15.318]
  - - [128, 8192, 1, 4096, 128, 128, 128, 4096]
    - [96, 18.441]
  - - [128, 8192, 1, 8192, 128, 128, 128, 8192]
    - [89, 21.104]
  - - [256, 128, 1, 128, 256, 256, 256, 128]
    - [111, 0.168]
  - - [256, 128, 1, 256, 256, 256, 256, 256]
    - [111, 0.301]
  - - [256, 128, 1, 512, 256, 256, 256, 512]
    - [132, 0.506]
  - - [256, 128, 1, 1024, 256, 256, 256, 1024]
    - [43, 0.775]
  - - [256, 128, 1, 2048, 256, 256, 256, 2048]
    - [44, 1.141]
  - - [256, 128, 1, 4096, 256, 256, 256, 4096]
    - [111, 1.942]
  - - [256, 128, 1, 8192, 256, 256, 256, 8192]
    - [43, 2.998]
  - - [256, 256, 1, 128, 256, 256, 256, 128]
    - [111, 0.336]
  - - [256, 256, 1, 256, 256, 256, 256, 256]
    - [111, 0.603]
  - - [256, 256, 1, 512, 256, 256, 256, 512]
    - [111, 1.0]
  - - [256, 256, 1, 1024, 256, 256, 256, 1024]
    - [43, 1.53]
  - - [256, 256, 1, 2048, 256, 256, 256, 2048]
    - [131, 2.253]
  - - [256, 256, 1, 4096, 256, 256, 256, 4096]
    - [111, 3.792]
  - - [256, 256, 1, 8192, 256, 256, 256, 8192]
    - [44, 5.629]
  - - [256, 512, 1, 128, 256, 256, 256, 128]
    - [111, 0.654]
  - - [256, 512, 1, 256, 256, 256, 256, 256]
    - [111, 1.182]
  - - [256, 512, 1, 512, 256, 256, 256, 512]
    - [131, 1.986]
  - - [256, 512, 1, 1024, 256, 256, 256, 1024]
    - [44, 3.031]
  - - [256, 512, 1, 2048, 256, 256, 256, 2048]
    - [132, 4.24]
  - - [256, 512, 1, 4096, 256, 256, 256, 4096]
    - [109, 6.519]
  - - [256, 512, 1, 8192, 256, 256, 256, 8192]
    - [40, 8.959]
  - - [256, 1024, 1, 128, 256, 256, 256, 128]
    - [111, 1.258]
  - - [256, 1024, 1, 256, 256, 256, 256, 256]
    - [111, 2.285]
  - - [256, 1024, 1, 512, 256, 256, 256, 512]
    - [111, 3.735]
  - - [256, 1024, 1, 1024, 256, 256, 256, 1024]
    - [131, 5.891]
  - - [256, 1024, 1, 2048, 256, 256, 256, 2048]
    - [132, 7.723]
  - - [256, 1024, 1, 4096, 256, 256, 256, 4096]
    - [127, 10.17]
  - - [256, 1024, 1, 8192, 256, 256, 256, 8192]
    - [37, 13.019]
  - - [256, 2048, 1, 128, 256, 256, 256, 128]
    - [110, 2.257]
  - - [256, 2048, 1, 256, 256, 256, 256, 256]
    - [108, 3.969]
  - - [256, 2048, 1, 512, 256, 256, 256, 512]
    - [127, 6.58]
  - - [256, 2048, 1, 1024, 256, 256, 256, 1024]
    - [126, 9.504]
  - - [256, 2048, 1, 2048, 256, 256, 256, 2048]
    - [127, 11.513]
  - - [256, 2048, 1, 4096, 256, 256, 256, 4096]
    - [99, 13.938]
  - - [256, 2048, 1, 8192, 256, 256, 256, 8192]
    - [32, 17.599]
  - - [256, 4096, 1, 128, 256, 256, 256, 128]
    - [103, 3.791]
  - - [256, 4096, 1, 256, 256, 256, 256, 256]
    - [104, 6.647]
  - - [256, 4096, 1, 512, 256, 256, 256, 512]
    - [107, 10.38]
  - - [256, 4096, 1, 1024, 256, 256, 256, 1024]
    - [121, 14.199]
  - - [256, 4096, 1, 2048, 256, 256, 256, 2048]
    - [121, 16.553]
  - - [256, 4096, 1, 4096, 256, 256, 256, 4096]
    - [89, 18.979]
  - - [256, 4096, 1, 8192, 256, 256, 256, 8192]
    - [86, 20.633]
  - - [256, 8192, 1, 128, 256, 256, 256, 128]
    - [66, 5.767]
  - - [256, 8192, 1, 256, 256, 256, 256, 256]
    - [97, 9.587]
  - - [256, 8192, 1, 512, 256, 256, 256, 512]
    - [98, 14.143]
  - - [256, 8192, 1, 1024, 256, 256, 256, 1024]
    - [114, 18.132]
  - - [256, 8192, 1, 2048, 256, 256, 256, 2048]
    - [119, 19.804]
  - - [256, 8192, 1, 4096, 256, 256, 256, 4096]
    - [114, 22.591]
  - - [256, 8192, 1, 8192, 256, 256, 256, 8192]
    - [14, 24.875]
  - - [512, 128, 1, 128, 512, 512, 512, 128]
    - [111, 0.331]
  - - [512, 128, 1, 256, 512, 512, 512, 256]
    - [24, 0.604]
  - - [512, 128, 1, 512, 512, 512, 512, 512]
    - [44, 1.006]
  - - [512, 128, 1, 1024, 512, 512, 512, 1024]
    - [44, 1.526]
  - - [512, 128, 1, 2048, 512, 512, 512, 2048]
    - [131, 2.238]
  - - [512, 128, 1, 4096, 512, 512, 512, 4096]
    - [112, 3.697]
  - - [512, 128, 1, 8192, 512, 512, 512, 8192]
    - [44, 5.638]
  - - [512, 256, 1, 128, 512, 512, 512, 128]
    - [111, 0.661]
  - - [512, 256, 1, 256, 512, 512, 512, 256]
    - [131, 1.176]
  - - [512, 256, 1, 512, 512, 512, 512, 512]
    - [131, 1.97]
  - - [512, 256, 1, 1024, 512, 512, 512, 1024]
    - [131, 3.029]
  - - [512, 256, 1, 2048, 512, 512, 512, 2048]
    - [132, 4.243]
  - - [512, 256, 1, 4096, 512, 512, 512, 4096]
    - [44, 6.291]
  - - [512, 256, 1, 8192, 512, 512, 512, 8192]
    - [39, 9.023]
  - - [512, 512, 1, 128, 512, 512, 512, 128]
    - [111, 1.265]
  - - [512, 512, 1, 256, 512, 512, 512, 256]
    - [111, 2.298]
  - - [512, 512, 1, 512, 512, 512, 512, 512]
    - [111, 3.761]
  - - [512, 512, 1, 1024, 512, 512, 512, 1024]
    - [44, 5.777]
  - - [512, 512, 1, 2048, 512, 512, 512, 2048]
    - [133, 7.635]
  - - [512, 512, 1, 4096, 512, 512, 512, 4096]
    - [41, 10.013]
  - - [512, 512, 1, 8192, 512, 512, 512, 8192]
    - [33, 13.807]
  - - [512, 1024, 1, 128, 512, 512, 512, 128]
    - [127, 2.279]
  - - [512, 1024, 1, 256, 512, 512, 512, 256]
    - [127, 4.021]
  - - [512, 1024, 1, 512, 512, 512, 512, 512]
    - [127, 6.659]
  - - [512, 1024, 1, 1024, 512, 512, 512, 1024]
    - [126, 9.549]
  - - [512, 1024, 1, 2048, 512, 512, 512, 2048]
    - [126, 11.43]
  - - [512, 1024, 1, 4096, 512, 512, 512, 4096]
    - [38, 14.822]
  - - [512, 1024, 1, 8192, 512, 512, 512, 8192]
    - [31, 17.672]
  - - [512, 2048, 1, 128, 512, 512, 512, 128]
    - [104, 3.77]
  - - [512, 2048, 1, 256, 512, 512, 512, 256]
    - [104, 6.621]
  - - [512, 2048, 1, 512, 512, 512, 512, 512]
    - [121, 10.27]
  - - [512, 2048, 1, 1024, 512, 512, 512, 1024]
    - [121, 14.192]
  - - [512, 2048, 1, 2048, 512, 512, 512, 2048]
    - [38, 16.63]
  - - [512, 2048, 1, 4096, 512, 512, 512, 4096]
    - [86, 19.117]
  - - [512, 2048, 1, 8192, 512, 512, 512, 8192]
    - [87, 20.892]
  - - [512, 4096, 1, 128, 512, 512, 512, 128]
    - [65, 5.782]
  - - [512, 4096, 1, 256, 512, 512, 512, 256]
    - [99, 9.574]
  - - [512, 4096, 1, 512, 512, 512, 512, 512]
    - [98, 14.092]
  - - [512, 4096, 1, 1024, 512, 512, 512, 1024]
    - [115, 18.485]
  - - [512, 4096, 1, 2048, 512, 512, 512, 2048]
    - [119, 20.188]
  - - [512, 4096, 1, 4096, 512, 512, 512, 4096]
    - [27, 23.189]
  - - [512, 4096, 1, 8192, 512, 512, 512, 8192]
    - [77, 23.795]
  - - [512, 8192, 1, 128, 512, 512, 512, 128]
    - [61, 7.787]
  - - [512, 8192, 1, 256, 512, 512, 512, 256]
    - [16, 11.84]
  - - [512, 8192, 1, 512, 512, 512, 512, 512]
    - [86, 17.115]
  - - [512, 8192, 1, 1024, 512, 512, 512, 1024]
    - [94, 20.584]
  - - [512, 8192, 1, 2048, 512, 512, 512, 2048]
    - [20, 25.179]
  - - [512, 8192, 1, 4096, 512, 512, 512, 4096]
    - [11, 24.966]
  - - [512, 8192, 1, 8192, 512, 512, 512, 8192]
    - [12, 28.108]
  - - [1024, 128, 1, 128, 1024, 1024, 1024, 128]
    - [111, 0.649]
  - - [1024, 128, 1, 256, 1024, 1024, 1024, 256]
    - [24, 1.175]
  - - [1024, 128, 1, 512, 1024, 1024, 1024, 512]
    - [44, 1.979]
  - - [1024, 128, 1, 1024, 1024, 1024, 1024, 1024]
    - [44, 3.019]
  - - [1024, 128, 1, 2048, 1024, 1024, 1024, 2048]
    - [43, 4.223]
  - - [1024, 128, 1, 4096, 1024, 1024, 1024, 4096]
    - [44, 6.288]
  - - [1024, 128, 1, 8192, 1024, 1024, 1024, 8192]
    - [41, 9.157]
  - - [1024, 256, 1, 128, 1024, 1024, 1024, 128]
    - [111, 1.266]
  - - [1024, 256, 1, 256, 1024, 1024, 1024, 256]
    - [111, 2.273]
  - - [1024, 256, 1, 512, 1024, 1024, 1024, 512]
    - [44, 3.697]
  - - [1024, 256, 1, 1024, 1024, 1024, 1024, 1024]
    - [44, 5.819]
  - - [1024, 256, 1, 2048, 1024, 1024, 1024, 2048]
    - [24, 7.561]
  - - [1024, 256, 1, 4096, 1024, 1024, 1024, 4096]
    - [41, 9.972]
  - - [1024, 256, 1, 8192, 1024, 1024, 1024, 8192]
    - [34, 13.449]
  - - [1024, 512, 1, 128, 1024, 1024, 1024, 128]
    - [109, 2.246]
  - - [1024, 512, 1, 256, 1024, 1024, 1024, 256]
    - [110, 4.026]
  - - [1024, 512, 1, 512, 1024, 1024, 1024, 512]
    - [127, 6.644]
  - - [1024, 512, 1, 1024, 1024, 1024, 1024, 1024]
    - [130, 9.473]
  - - [1024, 512, 1, 2048, 1024, 1024, 1024, 2048]
    - [42, 11.301]
  - - [1024, 512, 1, 4096, 1024, 1024, 1024, 4096]
    - [33, 14.656]
  - - [1024, 512, 1, 8192, 1024, 1024, 1024, 8192]
    - [26, 17.798]
  - - [1024, 1024, 1, 128, 1024, 1024, 1024, 128]
    - [103, 3.778]
  - - [1024, 1024, 1, 256, 1024, 1024, 1024, 256]
    - [104, 6.649]
  - - [1024, 1024, 1, 512, 1024, 1024, 1024, 512]
    - [103, 10.377]
  - - [1024, 1024, 1, 1024, 1024, 1024, 1024, 1024]
    - [120, 14.048]
  - - [1024, 1024, 1, 2048, 1024, 1024, 1024, 2048]
    - [36, 16.139]
  - - [1024, 1024, 1, 4096, 1024, 1024, 1024, 4096]
    - [90, 19.025]
  - - [1024, 1024, 1, 8192, 1024, 1024, 1024, 8192]
    - [86, 20.563]
  - - [1024, 2048, 1, 128, 1024, 1024, 1024, 128]
    - [97, 5.813]
  - - [1024, 2048, 1, 256, 1024, 1024, 1024, 256]
    - [98, 9.511]
  - - [1024, 2048, 1, 512, 1024, 1024, 1024, 512]
    - [100, 14.029]
  - - [1024, 2048, 1, 1024, 1024, 1024, 1024, 1024]
    - [114, 17.938]
  - - [1024, 2048, 1, 2048, 1024, 1024, 1024, 2048]
    - [28, 20.237]
  - - [1024, 2048, 1, 4096, 1024, 1024, 1024, 4096]
    - [118, 22.554]
  - - [1024, 2048, 1, 8192, 1024, 1024, 1024, 8192]
    - [71, 24.286]
  - - [1024, 4096, 1, 128, 1024, 1024, 1024, 128]
    - [60, 7.913]
  - - [1024, 4096, 1, 256, 1024, 1024, 1024, 256]
    - [59, 11.968]
  - - [1024, 4096, 1, 512, 1024, 1024, 1024, 512]
    - [21, 17.158]
  - - [1024, 4096, 1, 1024, 1024, 1024, 1024, 1024]
    - [19, 21.099]
  - - [1024, 4096, 1, 2048, 1024, 1024, 1024, 2048]
    - [96, 25.004]
  - - [1024, 4096, 1, 4096, 1024, 1024, 1024, 4096]
    - [73, 24.569]
  - - [1024, 4096, 1, 8192, 1024, 1024, 1024, 8192]
    - [78, 27.299]
  - - [1024, 8192, 1, 128, 1024, 1024, 1024, 128]
    - [85, 7.819]
  - - [1024, 8192, 1, 256, 1024, 1024, 1024, 256]
    - [84, 12.816]
  - - [1024, 8192, 1, 512, 1024, 1024, 1024, 512]
    - [7, 18.588]
  - - [1024, 8192, 1, 1024, 1024, 1024, 1024, 1024]
    - [68, 24.051]
  - - [1024, 8192, 1, 2048, 1024, 1024, 1024, 2048]
    - [76, 29.806]
  - - [1024, 8192, 1, 4096, 1024, 1024, 1024, 4096]
    - [11, 26.643]
  - - [1024, 8192, 1, 8192, 1024, 1024, 1024, 8192]
    - [54, 30.07]
  - - [2048, 128, 1, 128, 2048, 2048, 2048, 128]
    - [24, 1.238]
  - - [2048, 128, 1, 256, 2048, 2048, 2048, 256]
    - [111, 2.219]
  - - [2048, 128, 1, 512, 2048, 2048, 2048, 512]
    - [131, 3.678]
  - - [2048, 128, 1, 1024, 2048, 2048, 2048, 1024]
    - [43, 5.821]
  - - [2048, 128, 1, 2048, 2048, 2048, 2048, 2048]
    - [41, 7.381]
  - - [2048, 128, 1, 4096, 2048, 2048, 2048, 4096]
    - [22, 9.564]
  - - [2048, 128, 1, 8192, 2048, 2048, 2048, 8192]
    - [33, 12.858]
  - - [2048, 256, 1, 128, 2048, 2048, 2048, 128]
    - [110, 2.271]
  - - [2048, 256, 1, 256, 2048, 2048, 2048, 256]
    - [127, 4.022]
  - - [2048, 256, 1, 512, 2048, 2048, 2048, 512]
    - [127, 6.48]
  - - [2048, 256, 1, 1024, 2048, 2048, 2048, 1024]
    - [128, 9.315]
  - - [2048, 256, 1, 2048, 2048, 2048, 2048, 2048]
    - [33, 11.03]
  - - [2048, 256, 1, 4096, 2048, 2048, 2048, 4096]
    - [102, 13.58]
  - - [2048, 256, 1, 8192, 2048, 2048, 2048, 8192]
    - [30, 17.396]
  - - [2048, 512, 1, 128, 2048, 2048, 2048, 128]
    - [103, 3.795]
  - - [2048, 512, 1, 256, 2048, 2048, 2048, 256]
    - [23, 6.462]
  - - [2048, 512, 1, 512, 2048, 2048, 2048, 512]
    - [103, 10.348]
  - - [2048, 512, 1, 1024, 2048, 2048, 2048, 1024]
    - [122, 13.893]
  - - [2048, 512, 1, 2048, 2048, 2048, 2048, 2048]
    - [25, 15.205]
  - - [2048, 512, 1, 4096, 2048, 2048, 2048, 4096]
    - [91, 18.993]
  - - [2048, 512, 1, 8192, 2048, 2048, 2048, 8192]
    - [86, 20.663]
  - - [2048, 1024, 1, 128, 2048, 2048, 2048, 128]
    - [65, 5.818]
  - - [2048, 1024, 1, 256, 2048, 2048, 2048, 256]
    - [97, 9.584]
  - - [2048, 1024, 1, 512, 2048, 2048, 2048, 512]
    - [97, 14.038]
  - - [2048, 1024, 1, 1024, 2048, 2048, 2048, 1024]
    - [115, 17.723]
  - - [2048, 1024, 1, 2048, 2048, 2048, 2048, 2048]
    - [119, 19.868]
  - - [2048, 1024, 1, 4096, 2048, 2048, 2048, 4096]
    - [117, 22.568]
  - - [2048, 1024, 1, 8192, 2048, 2048, 2048, 8192]
    - [76, 23.949]
  - - [2048, 2048, 1, 128, 2048, 2048, 2048, 128]
    - [5, 7.558]
  - - [2048, 2048, 1, 256, 2048, 2048, 2048, 256]
    - [58, 11.928]
  - - [2048, 2048, 1, 512, 2048, 2048, 2048, 512]
    - [95, 16.923]
  - - [2048, 2048, 1, 1024, 2048, 2048, 2048, 1024]
    - [94, 20.893]
  - - [2048, 2048, 1, 2048, 2048, 2048, 2048, 2048]
    - [95, 24.923]
  - - [2048, 2048, 1, 4096, 2048, 2048, 2048, 4096]
    - [88, 25.607]
  - - [2048, 2048, 1, 8192, 2048, 2048, 2048, 8192]
    - [70, 26.774]
  - - [2048, 4096, 1, 128, 2048, 2048, 2048, 128]
    - [83, 7.79]
  - - [2048, 4096, 1, 256, 2048, 2048, 2048, 256]
    - [13, 12.74]
  - - [2048, 4096, 1, 512, 2048, 2048, 2048, 512]
    - [9, 18.364]
  - - [2048, 4096, 1, 1024, 2048, 2048, 2048, 1024]
    - [13, 24.194]
  - - [2048, 4096, 1, 2048, 2048, 2048, 2048, 2048]
    - [81, 29.637]
  - - [2048, 4096, 1, 4096, 2048, 2048, 2048, 4096]
    - [68, 26.713]
  - - [2048, 4096, 1, 8192, 2048, 2048, 2048, 8192]
    - [54, 30.64]
  - - [2048, 8192, 1, 128, 2048, 2048, 2048, 128]
    - [4, 8.149]
  - - [2048, 8192, 1, 256, 2048, 2048, 2048, 256]
    - [1, 13.182]
  - - [2048, 8192, 1, 512, 2048, 2048, 2048, 512]
    - [56, 19.571]
  - - [2048, 8192, 1, 1024, 2048, 2048, 2048, 1024]
    - [55, 27.025]
  - - [2048, 8192, 1, 2048, 2048, 2048, 2048, 2048]
    - [70, 25.946]
  - - [2048, 8192, 1, 4096, 2048, 2048, 2048, 4096]
    - [47, 29.069]
  - - [2048, 8192, 1, 8192, 2048, 2048, 2048, 8192]
    - [48, 31.272]
  - - [4096, 128, 1, 128, 4096, 4096, 4096, 128]
    - [110, 2.252]
  - - [4096, 128, 1, 256, 4096, 4096, 4096, 256]
    - [108, 3.877]
  - - [4096, 128, 1, 512, 4096, 4096, 4096, 512]
    - [127, 6.637]
  - - [4096, 128, 1, 1024, 4096, 4096, 4096, 1024]
    - [130, 9.349]
  - - [4096, 128, 1, 2048, 4096, 4096, 4096, 2048]
    - [129, 10.234]
  - - [4096, 128, 1, 4096, 4096, 4096, 4096, 4096]
    - [102, 13.357]
  - - [4096, 128, 1, 8192, 4096, 4096, 4096, 8192]
    - [29, 16.932]
  - - [4096, 256, 1, 128, 4096, 4096, 4096, 128]
    - [107, 3.696]
  - - [4096, 256, 1, 256, 4096, 4096, 4096, 256]
    - [105, 6.476]
  - - [4096, 256, 1, 512, 4096, 4096, 4096, 512]
    - [105, 10.184]
  - - [4096, 256, 1, 1024, 4096, 4096, 4096, 1024]
    - [125, 13.908]
  - - [4096, 256, 1, 2048, 4096, 4096, 4096, 2048]
    - [125, 14.954]
  - - [4096, 256, 1, 4096, 4096, 4096, 4096, 4096]
    - [91, 18.616]
  - - [4096, 256, 1, 8192, 4096, 4096, 4096, 8192]
    - [91, 20.747]
  - - [4096, 512, 1, 128, 4096, 4096, 4096, 128]
    - [66, 5.7]
  - - [4096, 512, 1, 256, 4096, 4096, 4096, 256]
    - [101, 9.435]
  - - [4096, 512, 1, 512, 4096, 4096, 4096, 512]
    - [101, 13.867]
  - - [4096, 512, 1, 1024, 4096, 4096, 4096, 1024]
    - [115, 17.854]
  - - [4096, 512, 1, 2048, 4096, 4096, 4096, 2048]
    - [118, 20.046]
  - - [4096, 512, 1, 4096, 4096, 4096, 4096, 4096]
    - [115, 22.765]
  - - [4096, 512, 1, 8192, 4096, 4096, 4096, 8192]
    - [89, 25.272]
  - - [4096, 1024, 1, 128, 4096, 4096, 4096, 128]
    - [62, 7.38]
  - - [4096, 1024, 1, 256, 4096, 4096, 4096, 256]
    - [63, 11.671]
  - - [4096, 1024, 1, 512, 4096, 4096, 4096, 512]
    - [94, 17.119]
  - - [4096, 1024, 1, 1024, 4096, 4096, 4096, 1024]
    - [94, 20.763]
  - - [4096, 1024, 1, 2048, 4096, 4096, 4096, 2048]
    - [92, 24.719]
  - - [4096, 1024, 1, 4096, 4096, 4096, 4096, 4096]
    - [68, 25.829]
  - - [4096, 1024, 1, 8192, 4096, 4096, 4096, 8192]
    - [82, 27.518]
  - - [4096, 2048, 1, 128, 4096, 4096, 4096, 128]
    - [12, 7.82]
  - - [4096, 2048, 1, 256, 4096, 4096, 4096, 256]
    - [8, 12.694]
  - - [4096, 2048, 1, 512, 4096, 4096, 4096, 512]
    - [6, 18.328]
  - - [4096, 2048, 1, 1024, 4096, 4096, 4096, 1024]
    - [75, 23.497]
  - - [4096, 2048, 1, 2048, 4096, 4096, 4096, 2048]
    - [77, 29.603]
  - - [4096, 2048, 1, 4096, 4096, 4096, 4096, 4096]
    - [71, 27.647]
  - - [4096, 2048, 1, 8192, 4096, 4096, 4096, 8192]
    - [50, 30.211]
  - - [4096, 4096, 1, 128, 4096, 4096, 4096, 128]
    - [82, 8.304]
  - - [4096, 4096, 1, 256, 4096, 4096, 4096, 256]
    - [49, 13.322]
  - - [4096, 4096, 1, 512, 4096, 4096, 4096, 512]
    - [0, 19.351]
  - - [4096, 4096, 1, 1024, 4096, 4096, 4096, 1024]
    - [3, 26.05]
  - - [4096, 4096, 1, 2048, 4096, 4096, 4096, 2048]
    - [70, 26.589]
  - - [4096, 4096, 1, 4096, 4096, 4096, 4096, 4096]
    - [46, 29.633]
  - - [4096, 4096, 1, 8192, 4096, 4096, 4096, 8192]
    - [56, 31.773]
  - - [4096, 8192, 1, 128, 4096, 4096, 4096, 128]
    - [18, 8.131]
  - - [4096, 8192, 1, 256, 4096, 4096, 4096, 256]
    - [68, 12.524]
  - - [4096, 8192, 1, 512, 4096, 4096, 4096, 512]
    - [90, 17.158]
  - - [4096, 8192, 1, 1024, 4096, 4096, 4096, 1024]
    - [45, 22.269]
  - - [4096, 8192, 1, 2048, 4096, 4096, 4096, 2048]
    - [45, 27.489]
  - - [4096, 8192, 1, 4096, 4096, 4096, 4096, 4096]
    - [69, 31.199]
  - - [4096, 8192, 1, 8192, 4096, 4096, 4096, 8192]
    - [52, 33.324]
  - - [8192, 128, 1, 128, 8192, 8192, 8192, 128]
    - [67, 3.719]
  - - [8192, 128, 1, 256, 8192, 8192, 8192, 256]
    - [106, 6.451]
  - - [8192, 128, 1, 512, 8192, 8192, 8192, 512]
    - [122, 10.043]
  - - [8192, 128, 1, 1024, 8192, 8192, 8192, 1024]
    - [124, 13.852]
  - - [8192, 128, 1, 2048, 8192, 8192, 8192, 2048]
    - [33, 14.469]
  - - [8192, 128, 1, 4096, 8192, 8192, 8192, 4096]
    - [29, 17.383]
  - - [8192, 128, 1, 8192, 8192, 8192, 8192, 8192]
    - [17, 21.046]
  - - [8192, 256, 1, 128, 8192, 8192, 8192, 128]
    - [65, 5.788]
  - - [8192, 256, 1, 256, 8192, 8192, 8192, 256]
    - [102, 9.483]
  - - [8192, 256, 1, 512, 8192, 8192, 8192, 512]
    - [101, 14.053]
  - - [8192, 256, 1, 1024, 8192, 8192, 8192, 1024]
    - [119, 17.844]
  - - [8192, 256, 1, 2048, 8192, 8192, 8192, 2048]
    - [115, 19.356]
  - - [8192, 256, 1, 4096, 8192, 8192, 8192, 4096]
    - [116, 22.19]
  - - [8192, 256, 1, 8192, 8192, 8192, 8192, 8192]
    - [89, 24.971]
  - - [8192, 512, 1, 128, 8192, 8192, 8192, 128]
    - [64, 7.823]
  - - [8192, 512, 1, 256, 8192, 8192, 8192, 256]
    - [64, 11.951]
  - - [8192, 512, 1, 512, 8192, 8192, 8192, 512]
    - [90, 16.771]
  - - [8192, 512, 1, 1024, 8192, 8192, 8192, 1024]
    - [90, 20.574]
  - - [8192, 512, 1, 2048, 8192, 8192, 8192, 2048]
    - [93, 24.969]
  - - [8192, 512, 1, 4096, 8192, 8192, 8192, 4096]
    - [69, 25.337]
  - - [8192, 512, 1, 8192, 8192, 8192, 8192, 8192]
    - [10, 27.95]
  - - [8192, 1024, 1, 128, 8192, 8192, 8192, 128]
    - [12, 7.782]
  - - [8192, 1024, 1, 256, 8192, 8192, 8192, 256]
    - [11, 12.713]
  - - [8192, 1024, 1, 512, 8192, 8192, 8192, 512]
    - [74, 17.896]
  - - [8192, 1024, 1, 1024, 8192, 8192, 8192, 1024]
    - [79, 23.483]
  - - [8192, 1024, 1, 2048, 8192, 8192, 8192, 2048]
    - [80, 29.747]
  - - [8192, 1024, 1, 4096, 8192, 8192, 8192, 4096]
    - [69, 27.969]
  - - [8192, 1024, 1, 8192, 8192, 8192, 8192, 8192]
    - [53, 29.982]
  - - [8192, 2048, 1, 128, 8192, 8192, 8192, 128]
    - [12, 8.468]
  - - [8192, 2048, 1, 256, 8192, 8192, 8192, 256]
    - [2, 13.061]
  - - [8192, 2048, 1, 512, 8192, 8192, 8192, 512]
    - [51, 19.493]
  - - [8192, 2048, 1, 1024, 8192, 8192, 8192, 1024]
    - [54, 25.975]
  - - [8192, 2048, 1, 2048, 8192, 8192, 8192, 2048]
    - [69, 26.701]
  - - [8192, 2048, 1, 4096, 8192, 8192, 8192, 4096]
    - [68, 30.256]
  - - [8192, 2048, 1, 8192, 8192, 8192, 8192, 8192]
    - [47, 32.085]
  - - [8192, 4096, 1, 128, 8192, 8192, 8192, 128]
    - [18, 8.404]
  - - [8192, 4096, 1, 256, 8192, 8192, 8192, 256]
    - [80, 12.743]
  - - [8192, 4096, 1, 512, 8192, 8192, 8192, 512]
    - [94, 17.101]
  - - [8192, 4096, 1, 1024, 8192, 8192, 8192, 1024]
    - [45, 22.192]
  - - [8192, 4096, 1, 2048, 8192, 8192, 8192, 2048]
    - [45, 27.662]
  - - [8192, 4096, 1, 4096, 8192, 8192, 8192, 4096]
    - [71, 30.693]
  - - [8192, 4096, 1, 8192, 8192, 8192, 8192, 8192]
    - [47, 33.282]
  - - [8192, 8192, 1, 128, 8192, 8192, 8192, 128]
    - [15, 7.071]
  - - [8192, 8192, 1, 256, 8192, 8192, 8192, 256]
    - [57, 11.359]
  - - [8192, 8192, 1, 512, 8192, 8192, 8192, 512]
    - [72, 17.268]
  - - [8192, 8192, 1, 1024, 8192, 8192, 8192, 1024]
    - [76, 23.815]
  - - [8192, 8192, 1, 2048, 8192, 8192, 8192, 2048]
    - [74, 29.444]
  - - [8192, 8192, 1, 4096, 8192, 8192, 8192, 4096]
    - [46, 32.726]
  - - [8192, 8192, 1, 8192, 8192, 8192, 8192, 8192]
    - [52, 34.848]
  - - [1, 1, 1, 32, 1, 1, 1, 32]
    - [134, 0.0]
- null
- null
- ExperimentalStreamK
- GridBased
