library/src/amd_detail/rocblaslt/src/Tensile/Logic/asm_full/aquavanjaram/gfx942/StreamK/aquavanjaram942_Cijk_Ailk_Bjlk_HHS_BH_UserArgs.yaml
- {MinimumRequiredVersion: 4.33.0}
- aquavanjaram942
- gfx942
- [Device 0049, Device 0050]
    SolutionIndex: 0
    SolutionNameMin: Cijk_Ailk_Bjlk_HHS_BH_UserArgs_MT256x256x32_MI16x16x1_SN_LDSB0_CLR1_GSU0_GSUC0_GSUWGMRR0_K1_LBSPPA2048_LBSPPB2048_LPA0_LPB0_MIWT8_8_PLR1_SU32_SUM0_SUS256_SKXCCM0_VWA8_VWB8_WGM4_WGMXCC1_WGMXCCGn1
    SolutionIndex: 1
    SolutionNameMin: Cijk_Ailk_Bjlk_HHS_BH_UserArgs_MT128x256x32_MI16x16x1_SN_LDSB1_CLR1_GSU0_GSUC0_GSUWGMRR0_K1_LBSPPA1024_LBSPPB2048_LPA32_LPB0_MIWT4_8_PLR1_SU32_SUM0_SUS256_SKXCCM0_VWA2_VWB8_WGM8_WGMXCC1_WGMXCCGn1
    SolutionIndex: 2
    SolutionNameMin: Cijk_Ailk_Bjlk_HHS_BH_UserArgs_MT128x256x32_MI16x16x1_SN_LDSB1_CLR1_GSU0_GSUC0_GSUWGMRR0_K1_LBSPPA1024_LBSPPB2048_LPA0_LPB0_MIWT4_8_PLR1_SU32_SUM0_SUS256_SKXCCM0_VWA4_VWB8_WGM8_WGMXCC1_WGMXCCGn1
    SolutionIndex: 3
    SolutionNameMin: Cijk_Ailk_Bjlk_HHS_BH_UserArgs_MT256x128x32_MI16x16x1_SN_LDSB1_CLR1_GSU0_GSUC0_GSUWGMRR0_K1_LBSPPA2048_LBSPPB1024_LPA0_LPB0_MIWT8_4_PLR1_SU32_SUM0_SUS256_SKXCCM0_VWA4_VWB4_WGM4_WGMXCC1_WGMXCCGn1
    SolutionIndex: 4
    SolutionNameMin: Cijk_Ailk_Bjlk_HHS_BH_UserArgs_MT64x64x32_MI16x16x1_SN_LDSB0_CLR1_GSU0_GSUC0_GSUWGMRR0_K1_LBSPPA512_LBSPPB512_LPA32_LPB32_MIWT2_2_PLR1_SU32_SUM0_SUS256_SKXCCM0_VWA2_VWB2_WGM1_WGMXCC1_WGMXCCGn1
    SolutionIndex: 5
    SolutionNameMin: Cijk_Ailk_Bjlk_HHS_BH_UserArgs_MT32x32x32_MI16x16x1_SN_LDSB0_CLR1_GSU0_GSUC0_GSUWGMRR0_K1_LBSPPA256_LBSPPB256_LPA16_LPB16_MIWT1_1_PLR1_SU32_SUM0_SUS256_SKXCCM0_VWA1_VWB1_WGM1_WGMXCC1_WGMXCCGn1
    SolutionIndex: 6
    SolutionNameMin: Cijk_Ailk_Bjlk_HHS_BH_UserArgs_MT32x32x32_MI16x16x1_SN_LDSB0_CLR0_GSU0_GSUC0_GSUWGMRR0_K1_LBSPPA256_LBSPPB256_LPA16_LPB16_MIWT1_1_PLR0_SU32_SUM0_SUS256_SKXCCM0_VWA1_VWB1_WGM1_WGMXCC1_WGMXCCGn1
    SolutionIndex: 7
    SolutionNameMin: Cijk_Ailk_Bjlk_HHS_BH_UserArgs_MT256x256x64_MI16x16x1_SN_LDSB1_CLR1_GSU0_GSUC0_GSUWGMRR0_K1_LBSPPA2048_LBSPPB2048_LPA0_LPB0_MIWT8_8_PLR2_SU32_SUM0_SUS256_SKXCCM0_VWA4_VWB8_WGM8_WGMXCC1_WGMXCCGn1
    SolutionIndex: 8
    SolutionNameMin: Cijk_Ailk_Bjlk_HHS_BH_UserArgs_MT256x256x64_MI16x16x1_SN_LDSB1_CLR1_GSU0_GSUC0_GSUWGMRR0_K1_LBSPPA2048_LBSPPB2048_LPA0_LPB0_MIWT8_8_PLR2_SU32_SUM0_SUS256_SKXCCM0_VWA8_VWB8_WGM8_WGMXCC1_WGMXCCGn1
    SolutionIndex: 9
    SolutionNameMin: Cijk_Ailk_Bjlk_HHS_BH_UserArgs_MT128x256x64_MI16x16x1_SN_LDSB1_CLR1_GSU0_GSUC0_GSUWGMRR0_K1_LBSPPA1024_LBSPPB2048_LPA0_LPB0_MIWT4_8_PLR2_SU32_SUM0_SUS256_SKXCCM0_VWA4_VWB4_WGM1_WGMXCC1_WGMXCCGn1
    SolutionIndex: 10
    SolutionNameMin: Cijk_Ailk_Bjlk_HHS_BH_UserArgs_MT128x256x64_MI16x16x1_SN_LDSB1_CLR1_GSU0_GSUC0_GSUWGMRR0_K1_LBSPPA1024_LBSPPB2048_LPA0_LPB32_MIWT4_8_PLR2_SU32_SUM0_SUS256_SKXCCM0_VWA4_VWB2_WGM4_WGMXCC1_WGMXCCGn1
    SolutionIndex: 11
    SolutionNameMin: Cijk_Ailk_Bjlk_HHS_BH_UserArgs_MT128x256x64_MI16x16x1_SN_LDSB1_CLR1_GSU0_GSUC0_GSUWGMRR0_K1_LBSPPA1024_LBSPPB2048_LPA32_LPB0_MIWT4_8_PLR1_SU32_SUM0_SUS256_SKXCCM0_VWA2_VWB4_WGM8_WGMXCC1_WGMXCCGn1
    SolutionIndex: 12
    SolutionNameMin: Cijk_Ailk_Bjlk_HHS_BH_UserArgs_MT256x128x64_MI16x16x1_SN_LDSB1_CLR1_GSU0_GSUC0_GSUWGMRR0_K1_LBSPPA2048_LBSPPB1024_LPA32_LPB0_MIWT8_4_PLR1_SU32_SUM0_SUS256_SKXCCM0_VWA2_VWB4_WGM4_WGMXCC1_WGMXCCGn1
    SolutionIndex: 13
    SolutionNameMin: Cijk_Ailk_Bjlk_HHS_BH_UserArgs_MT256x128x64_MI16x16x1_SN_LDSB1_CLR1_GSU0_GSUC0_GSUWGMRR0_K1_LBSPPA2048_LBSPPB1024_LPA0_LPB0_MIWT8_4_PLR2_SU32_SUM0_SUS256_SKXCCM0_VWA4_VWB4_WGM8_WGMXCC1_WGMXCCGn1
    SolutionIndex: 14
    SolutionNameMin: Cijk_Ailk_Bjlk_HHS_BH_UserArgs_MT128x128x64_MI16x16x1_SN_LDSB1_CLR1_GSU0_GSUC0_GSUWGMRR0_K1_LBSPPA1024_LBSPPB1024_LPA0_LPB0_MIWT4_4_PLR1_SU32_SUM0_SUS256_SKXCCM0_VWA4_VWB4_WGM1_WGMXCC1_WGMXCCGn1
    SolutionIndex: 15
    SolutionNameMin: Cijk_Ailk_Bjlk_HHS_BH_UserArgs_MT128x128x64_MI16x16x1_SN_LDSB1_CLR1_GSU0_GSUC0_GSUWGMRR0_K1_LBSPPA1024_LBSPPB1024_LPA0_LPB0_MIWT4_4_PLR1_SU32_SUM0_SUS256_SKXCCM0_VWA4_VWB4_WGM8_WGMXCC1_WGMXCCGn1
    SolutionIndex: 16
    SolutionNameMin: Cijk_Ailk_Bjlk_HHS_BH_UserArgs_MT64x128x64_MI16x16x1_SN_LDSB1_CLR1_GSU0_GSUC0_GSUWGMRR0_K1_LBSPPA512_LBSPPB1024_LPA32_LPB0_MIWT2_4_PLR2_SU32_SUM0_SUS256_SKXCCM0_VWA2_VWB4_WGM1_WGMXCC1_WGMXCCGn1
    SolutionIndex: 17
    SolutionNameMin: Cijk_Ailk_Bjlk_HHS_BH_UserArgs_MT64x128x64_MI16x16x1_SN_LDSB1_CLR1_GSU0_GSUC0_GSUWGMRR0_K1_LBSPPA512_LBSPPB1024_LPA32_LPB0_MIWT2_4_PLR2_SU32_SUM0_SUS256_SKXCCM0_VWA2_VWB4_WGM4_WGMXCC1_WGMXCCGn1
    SolutionIndex: 18
    SolutionNameMin: Cijk_Ailk_Bjlk_HHS_BH_UserArgs_MT128x64x64_MI16x16x1_SN_LDSB1_CLR1_GSU0_GSUC0_GSUWGMRR0_K1_LBSPPA1024_LBSPPB512_LPA0_LPB32_MIWT4_2_PLR2_SU32_SUM0_SUS256_SKXCCM0_VWA4_VWB2_WGM8_WGMXCC1_WGMXCCGn1
    SolutionIndex: 19
    SolutionNameMin: Cijk_Ailk_Bjlk_HHS_BH_UserArgs_MT64x64x64_MI16x16x1_SN_LDSB1_CLR1_GSU0_GSUC0_GSUWGMRR0_K1_LBSPPA512_LBSPPB512_LPA32_LPB32_MIWT2_2_PLR1_SU32_SUM0_SUS256_SKXCCM0_VWA2_VWB2_WGM1_WGMXCC1_WGMXCCGn1
    SolutionIndex: 20
    SolutionNameMin: Cijk_Ailk_Bjlk_HHS_BH_UserArgs_MT64x64x64_MI16x16x1_SN_LDSB1_CLR1_GSU0_GSUC0_GSUWGMRR0_K1_LBSPPA512_LBSPPB512_LPA32_LPB32_MIWT2_2_PLR2_SU32_SUM0_SUS256_SKXCCM0_VWA2_VWB2_WGM1_WGMXCC1_WGMXCCGn1
    SolutionIndex: 21
    SolutionNameMin: Cijk_Ailk_Bjlk_HHS_BH_UserArgs_MT64x64x64_MI16x16x1_SN_LDSB1_CLR1_GSU0_GSUC0_GSUWGMRR0_K1_LBSPPA512_LBSPPB512_LPA32_LPB32_MIWT2_2_PLR1_SU32_SUM0_SUS256_SKXCCM0_VWA2_VWB2_WGM4_WGMXCC1_WGMXCCGn1
    SolutionIndex: 22
    SolutionNameMin: Cijk_Ailk_Bjlk_HHS_BH_UserArgs_MT64x64x64_MI16x16x1_SN_LDSB1_CLR1_GSU0_GSUC0_GSUWGMRR0_K1_LBSPPA512_LBSPPB512_LPA32_LPB32_MIWT2_2_PLR2_SU32_SUM0_SUS256_SKXCCM0_VWA2_VWB2_WGM4_WGMXCC1_WGMXCCGn1
    SolutionIndex: 23
    SolutionNameMin: Cijk_Ailk_Bjlk_HHS_BH_UserArgs_MT64x64x64_MI16x16x1_SN_LDSB1_CLR1_GSU0_GSUC0_GSUWGMRR0_K1_LBSPPA512_LBSPPB512_LPA32_LPB32_MIWT2_2_PLR1_SU32_SUM0_SUS256_SKXCCM0_VWA2_VWB2_WGM8_WGMXCC1_WGMXCCGn1
    SolutionIndex: 24
    SolutionNameMin: Cijk_Ailk_Bjlk_HHS_BH_UserArgs_MT64x64x64_MI16x16x1_SN_LDSB1_CLR1_GSU0_GSUC0_GSUWGMRR0_K1_LBSPPA512_LBSPPB512_LPA32_LPB32_MIWT2_2_PLR2_SU32_SUM0_SUS256_SKXCCM0_VWA2_VWB2_WGM8_WGMXCC1_WGMXCCGn1
    SolutionIndex: 25
    SolutionNameMin: Cijk_Ailk_Bjlk_HHS_BH_UserArgs_MT32x64x64_MI16x16x1_SN_LDSB0_CLR1_GSU0_GSUC0_GSUWGMRR0_K1_LBSPPA256_LBSPPB512_LPA16_LPB32_MIWT1_2_PLR2_SU32_SUM0_SUS256_SKXCCM0_VWA1_VWB2_WGM1_WGMXCC1_WGMXCCGn1
    SolutionIndex: 26
    SolutionNameMin: Cijk_Ailk_Bjlk_HHS_BH_UserArgs_MT64x32x64_MI16x16x1_SN_LDSB0_CLR1_GSU0_GSUC0_GSUWGMRR0_K1_LBSPPA512_LBSPPB256_LPA32_LPB16_MIWT2_1_PLR2_SU32_SUM0_SUS256_SKXCCM0_VWA2_VWB1_WGM1_WGMXCC1_WGMXCCGn1
    SolutionIndex: 27
    SolutionNameMin: Cijk_Ailk_Bjlk_HHS_BH_UserArgs_MT32x32x64_MI16x16x1_SN_LDSB0_CLR1_GSU0_GSUC0_GSUWGMRR0_K1_LBSPPA256_LBSPPB256_LPA16_LPB16_MIWT1_1_PLR1_SU32_SUM0_SUS256_SKXCCM0_VWA1_VWB1_WGM1_WGMXCC1_WGMXCCGn1
    SolutionIndex: 28
    SolutionNameMin: Cijk_Ailk_Bjlk_HHS_BH_UserArgs_MT32x32x64_MI16x16x1_SN_LDSB0_CLR1_GSU0_GSUC0_GSUWGMRR0_K1_LBSPPA256_LBSPPB256_LPA16_LPB16_MIWT1_1_PLR2_SU32_SUM0_SUS256_SKXCCM0_VWA1_VWB1_WGM1_WGMXCC1_WGMXCCGn1
    SolutionIndex: 29
    SolutionNameMin: Cijk_Ailk_Bjlk_HHS_BH_UserArgs_MT128x128x128_MI16x16x1_SN_LDSB1_CLR1_GSU0_GSUC0_GSUWGMRR0_K1_LBSPPA1024_LBSPPB1024_LPA0_LPB0_MIWT4_4_PLR2_SU32_SUM0_SUS256_SKXCCM0_VWA4_VWB4_WGM1_WGMXCC1_WGMXCCGn1
    SolutionIndex: 30
    SolutionNameMin: Cijk_Ailk_Bjlk_HHS_BH_UserArgs_MT128x128x128_MI16x16x1_SN_LDSB1_CLR1_GSU0_GSUC0_GSUWGMRR0_K1_LBSPPA1024_LBSPPB1024_LPA0_LPB0_MIWT4_4_PLR1_SU32_SUM0_SUS256_SKXCCM0_VWA4_VWB4_WGM4_WGMXCC1_WGMXCCGn1
    SolutionIndex: 31
    SolutionNameMin: Cijk_Ailk_Bjlk_HHS_BH_UserArgs_MT128x128x128_MI16x16x1_SN_LDSB1_CLR1_GSU0_GSUC0_GSUWGMRR0_K1_LBSPPA1024_LBSPPB1024_LPA0_LPB0_MIWT4_4_PLR2_SU32_SUM0_SUS256_SKXCCM0_VWA4_VWB4_WGM4_WGMXCC1_WGMXCCGn1
    SolutionIndex: 32
    SolutionNameMin: Cijk_Ailk_Bjlk_HHS_BH_UserArgs_MT128x128x128_MI16x16x1_SN_LDSB1_CLR1_GSU0_GSUC0_GSUWGMRR0_K1_LBSPPA1024_LBSPPB1024_LPA0_LPB0_MIWT4_4_PLR1_SU32_SUM0_SUS256_SKXCCM0_VWA4_VWB4_WGM8_WGMXCC1_WGMXCCGn1
    SolutionIndex: 33
    SolutionNameMin: Cijk_Ailk_Bjlk_HHS_BH_UserArgs_MT128x128x128_MI16x16x1_SN_LDSB1_CLR1_GSU0_GSUC0_GSUWGMRR0_K1_LBSPPA1024_LBSPPB1024_LPA0_LPB0_MIWT4_4_PLR2_SU32_SUM0_SUS256_SKXCCM0_VWA4_VWB4_WGM8_WGMXCC1_WGMXCCGn1
    SolutionIndex: 34
    SolutionNameMin: Cijk_Ailk_Bjlk_HHS_BH_UserArgs_MT64x128x128_MI16x16x1_SN_LDSB1_CLR1_GSU0_GSUC0_GSUWGMRR0_K1_LBSPPA512_LBSPPB1024_LPA32_LPB0_MIWT2_4_PLR2_SU32_SUM0_SUS256_SKXCCM0_VWA2_VWB4_WGM1_WGMXCC1_WGMXCCGn1
    SolutionIndex: 35
    SolutionNameMin: Cijk_Ailk_Bjlk_HHS_BH_UserArgs_MT128x64x128_MI16x16x1_SN_LDSB1_CLR1_GSU0_GSUC0_GSUWGMRR0_K1_LBSPPA1024_LBSPPB512_LPA0_LPB32_MIWT4_2_PLR2_SU32_SUM0_SUS256_SKXCCM0_VWA4_VWB2_WGM1_WGMXCC1_WGMXCCGn1
    SolutionIndex: 36
    SolutionNameMin: Cijk_Ailk_Bjlk_HHS_BH_UserArgs_MT128x64x128_MI16x16x1_SN_LDSB1_CLR1_GSU0_GSUC0_GSUWGMRR0_K1_LBSPPA1024_LBSPPB512_LPA0_LPB32_MIWT4_2_PLR2_SU32_SUM0_SUS256_SKXCCM0_VWA4_VWB2_WGM4_WGMXCC1_WGMXCCGn1
    SolutionIndex: 37
    SolutionNameMin: Cijk_Ailk_Bjlk_HHS_BH_UserArgs_MT64x64x128_MI16x16x1_SN_LDSB1_CLR1_GSU0_GSUC0_GSUWGMRR0_K1_LBSPPA512_LBSPPB512_LPA32_LPB32_MIWT2_2_PLR2_SU32_SUM0_SUS256_SKXCCM0_VWA2_VWB2_WGM1_WGMXCC1_WGMXCCGn1
    SolutionIndex: 38
    SolutionNameMin: Cijk_Ailk_Bjlk_HHS_BH_UserArgs_MT64x64x128_MI16x16x1_SN_LDSB1_CLR1_GSU0_GSUC0_GSUWGMRR0_K1_LBSPPA512_LBSPPB512_LPA32_LPB32_MIWT2_2_PLR2_SU32_SUM0_SUS256_SKXCCM0_VWA2_VWB2_WGM4_WGMXCC1_WGMXCCGn1
    SolutionIndex: 39
    SolutionNameMin: Cijk_Ailk_Bjlk_HHS_BH_UserArgs_MT64x64x128_MI16x16x1_SN_LDSB1_CLR1_GSU0_GSUC0_GSUWGMRR0_K1_LBSPPA512_LBSPPB512_LPA32_LPB32_MIWT2_2_PLR2_SU32_SUM0_SUS256_SKXCCM0_VWA2_VWB2_WGM8_WGMXCC1_WGMXCCGn1
    SolutionIndex: 40
    SolutionNameMin: Cijk_Ailk_Bjlk_HHS_BH_UserArgs_MT32x64x128_MI16x16x1_SN_LDSB1_CLR1_GSU0_GSUC0_GSUWGMRR0_K1_LBSPPA256_LBSPPB512_LPA16_LPB32_MIWT1_2_PLR1_SU32_SUM0_SUS256_SKXCCM0_VWA1_VWB2_WGM1_WGMXCC1_WGMXCCGn1
    SolutionIndex: 41
    SolutionNameMin: Cijk_Ailk_Bjlk_HHS_BH_UserArgs_MT32x64x128_MI16x16x1_SN_LDSB1_CLR1_GSU0_GSUC0_GSUWGMRR0_K1_LBSPPA256_LBSPPB512_LPA16_LPB32_MIWT1_2_PLR2_SU32_SUM0_SUS256_SKXCCM0_VWA1_VWB2_WGM1_WGMXCC1_WGMXCCGn1
    SolutionIndex: 42
    SolutionNameMin: Cijk_Ailk_Bjlk_HHS_BH_UserArgs_MT32x64x128_MI16x16x1_SN_LDSB1_CLR1_GSU0_GSUC0_GSUWGMRR0_K1_LBSPPA256_LBSPPB512_LPA16_LPB32_MIWT1_2_PLR2_SU32_SUM0_SUS256_SKXCCM0_VWA1_VWB2_WGM4_WGMXCC1_WGMXCCGn1
    SolutionIndex: 43
    SolutionNameMin: Cijk_Ailk_Bjlk_HHS_BH_UserArgs_MT64x32x128_MI16x16x1_SN_LDSB1_CLR1_GSU0_GSUC0_GSUWGMRR0_K1_LBSPPA512_LBSPPB256_LPA32_LPB16_MIWT2_1_PLR1_SU32_SUM0_SUS256_SKXCCM0_VWA2_VWB1_WGM1_WGMXCC1_WGMXCCGn1
    SolutionIndex: 44
    SolutionNameMin: Cijk_Ailk_Bjlk_HHS_BH_UserArgs_MT64x32x128_MI16x16x1_SN_LDSB1_CLR1_GSU0_GSUC0_GSUWGMRR0_K1_LBSPPA512_LBSPPB256_LPA32_LPB16_MIWT2_1_PLR2_SU32_SUM0_SUS256_SKXCCM0_VWA2_VWB1_WGM1_WGMXCC1_WGMXCCGn1
    SolutionIndex: 45
    SolutionNameMin: Cijk_Ailk_Bjlk_HHS_BH_UserArgs_MT64x32x128_MI16x16x1_SN_LDSB1_CLR1_GSU0_GSUC0_GSUWGMRR0_K1_LBSPPA512_LBSPPB256_LPA32_LPB16_MIWT2_1_PLR1_SU32_SUM0_SUS256_SKXCCM0_VWA2_VWB1_WGM4_WGMXCC1_WGMXCCGn1
    SolutionIndex: 46
    SolutionNameMin: Cijk_Ailk_Bjlk_HHS_BH_UserArgs_MT64x32x128_MI16x16x1_SN_LDSB1_CLR1_GSU0_GSUC0_GSUWGMRR0_K1_LBSPPA512_LBSPPB256_LPA32_LPB16_MIWT2_1_PLR2_SU32_SUM0_SUS256_SKXCCM0_VWA2_VWB1_WGM4_WGMXCC1_WGMXCCGn1
    SolutionIndex: 47
    SolutionNameMin: Cijk_Ailk_Bjlk_HHS_BH_UserArgs_MT64x32x128_MI16x16x1_SN_LDSB1_CLR1_GSU0_GSUC0_GSUWGMRR0_K1_LBSPPA512_LBSPPB256_LPA32_LPB16_MIWT2_1_PLR2_SU32_SUM0_SUS256_SKXCCM0_VWA2_VWB1_WGM8_WGMXCC1_WGMXCCGn1
    SolutionIndex: 48
    SolutionNameMin: Cijk_Ailk_Bjlk_HHS_BH_UserArgs_MT32x32x128_MI16x16x1_SN_LDSB1_CLR1_GSU0_GSUC0_GSUWGMRR0_K1_LBSPPA256_LBSPPB256_LPA16_LPB16_MIWT1_1_PLR1_SU32_SUM0_SUS256_SKXCCM0_VWA1_VWB1_WGM1_WGMXCC1_WGMXCCGn1
    SolutionIndex: 49
    SolutionNameMin: Cijk_Ailk_Bjlk_HHS_BH_UserArgs_MT32x32x128_MI16x16x1_SN_LDSB1_CLR1_GSU0_GSUC0_GSUWGMRR0_K1_LBSPPA256_LBSPPB256_LPA16_LPB16_MIWT1_1_PLR2_SU32_SUM0_SUS256_SKXCCM0_VWA1_VWB1_WGM1_WGMXCC1_WGMXCCGn1
    SolutionIndex: 50
    SolutionNameMin: Cijk_Ailk_Bjlk_HHS_BH_UserArgs_MT32x32x128_MI16x16x1_SN_LDSB1_CLR1_GSU0_GSUC0_GSUWGMRR0_K1_LBSPPA256_LBSPPB256_LPA16_LPB16_MIWT1_1_PLR2_SU32_SUM0_SUS256_SKXCCM0_VWA1_VWB1_WGM4_WGMXCC1_WGMXCCGn1
    SolutionIndex: 51
    SolutionNameMin: Cijk_Ailk_Bjlk_HHS_BH_UserArgs_MT32x32x128_MI16x16x1_SN_LDSB1_CLR1_GSU0_GSUC0_GSUWGMRR0_K1_LBSPPA256_LBSPPB256_LPA16_LPB16_MIWT1_1_PLR2_SU32_SUM0_SUS256_SKXCCM0_VWA1_VWB1_WGM8_WGMXCC1_WGMXCCGn1
    SolutionIndex: 52
    SolutionNameMin: Cijk_Ailk_Bjlk_HHS_BH_UserArgs_MT256x256x32_MI16x16x1_SN_LDSB1_CLR1_GSU0_GSUC0_GSUWGMRR0_K1_LBSPPA2048_LBSPPB2048_LPA32_LPB0_MIWT8_8_PLR1_SU32_SUM0_SUS256_SKXCCM8_VWA2_VWB8_WGM1_WGMXCC1_WGMXCCGn1
    SolutionIndex: 53
    SolutionNameMin: Cijk_Ailk_Bjlk_HHS_BH_UserArgs_MT256x256x32_MI16x16x1_SN_LDSB0_CLR1_GSU0_GSUC0_GSUWGMRR0_K1_LBSPPA2048_LBSPPB2048_LPA0_LPB0_MIWT8_8_PLR1_SU32_SUM0_SUS256_SKXCCM8_VWA4_VWB8_WGM1_WGMXCC1_WGMXCCGn1
    SolutionIndex: 54
    SolutionNameMin: Cijk_Ailk_Bjlk_HHS_BH_UserArgs_MT256x256x32_MI16x16x1_SN_LDSB0_CLR1_GSU0_GSUC0_GSUWGMRR0_K1_LBSPPA2048_LBSPPB2048_LPA0_LPB0_MIWT8_8_PLR1_SU32_SUM0_SUS256_SKXCCM8_VWA8_VWB8_WGM1_WGMXCC1_WGMXCCGn1
    SolutionIndex: 55
    SolutionNameMin: Cijk_Ailk_Bjlk_HHS_BH_UserArgs_MT256x256x32_MI16x16x1_SN_LDSB1_CLR1_GSU0_GSUC0_GSUWGMRR0_K1_LBSPPA2048_LBSPPB2048_LPA0_LPB32_MIWT8_8_PLR1_SU32_SUM0_SUS256_SKXCCM8_VWA4_VWB2_WGM4_WGMXCC1_WGMXCCGn1
    SolutionIndex: 56
    SolutionNameMin: Cijk_Ailk_Bjlk_HHS_BH_UserArgs_MT256x256x32_MI16x16x1_SN_LDSB0_CLR1_GSU0_GSUC0_GSUWGMRR0_K1_LBSPPA2048_LBSPPB2048_LPA0_LPB0_MIWT8_8_PLR1_SU32_SUM0_SUS256_SKXCCM8_VWA4_VWB4_WGM4_WGMXCC1_WGMXCCGn1
    SolutionIndex: 57
    SolutionNameMin: Cijk_Ailk_Bjlk_HHS_BH_UserArgs_MT256x256x32_MI16x16x1_SN_LDSB0_CLR1_GSU0_GSUC0_GSUWGMRR0_K1_LBSPPA2048_LBSPPB2048_LPA0_LPB0_MIWT8_8_PLR1_SU32_SUM0_SUS256_SKXCCM8_VWA8_VWB4_WGM4_WGMXCC1_WGMXCCGn1
    SolutionIndex: 58
    SolutionNameMin: Cijk_Ailk_Bjlk_HHS_BH_UserArgs_MT256x256x32_MI16x16x1_SN_LDSB1_CLR1_GSU0_GSUC0_GSUWGMRR0_K1_LBSPPA2048_LBSPPB2048_LPA32_LPB0_MIWT8_8_PLR1_SU32_SUM0_SUS256_SKXCCM8_VWA2_VWB8_WGM4_WGMXCC1_WGMXCCGn1
    SolutionIndex: 59
    SolutionNameMin: Cijk_Ailk_Bjlk_HHS_BH_UserArgs_MT256x256x32_MI16x16x1_SN_LDSB0_CLR1_GSU0_GSUC0_GSUWGMRR0_K1_LBSPPA2048_LBSPPB2048_LPA0_LPB0_MIWT8_8_PLR1_SU32_SUM0_SUS256_SKXCCM8_VWA4_VWB8_WGM4_WGMXCC1_WGMXCCGn1
    SolutionIndex: 60
    SolutionNameMin: Cijk_Ailk_Bjlk_HHS_BH_UserArgs_MT256x256x32_MI16x16x1_SN_LDSB0_CLR1_GSU0_GSUC0_GSUWGMRR0_K1_LBSPPA2048_LBSPPB2048_LPA0_LPB0_MIWT8_8_PLR1_SU32_SUM0_SUS256_SKXCCM8_VWA8_VWB8_WGM4_WGMXCC1_WGMXCCGn1
    SolutionIndex: 61
    SolutionNameMin: Cijk_Ailk_Bjlk_HHS_BH_UserArgs_MT256x256x32_MI16x16x1_SN_LDSB1_CLR1_GSU0_GSUC0_GSUWGMRR0_K1_LBSPPA2048_LBSPPB2048_LPA0_LPB16_MIWT8_8_PLR1_SU32_SUM0_SUS256_SKXCCM8_VWA8_VWB1_WGM8_WGMXCC1_WGMXCCGn1
    SolutionIndex: 62
    SolutionNameMin: Cijk_Ailk_Bjlk_HHS_BH_UserArgs_MT256x256x32_MI16x16x1_SN_LDSB1_CLR1_GSU0_GSUC0_GSUWGMRR0_K1_LBSPPA2048_LBSPPB2048_LPA32_LPB0_MIWT8_8_PLR1_SU32_SUM0_SUS256_SKXCCM8_VWA2_VWB8_WGM8_WGMXCC1_WGMXCCGn1
    SolutionIndex: 63
    SolutionNameMin: Cijk_Ailk_Bjlk_HHS_BH_UserArgs_MT256x256x32_MI16x16x1_SN_LDSB0_CLR1_GSU0_GSUC0_GSUWGMRR0_K1_LBSPPA2048_LBSPPB2048_LPA0_LPB0_MIWT8_8_PLR1_SU32_SUM0_SUS256_SKXCCM8_VWA4_VWB8_WGM8_WGMXCC1_WGMXCCGn1
    SolutionIndex: 64
    SolutionNameMin: Cijk_Ailk_Bjlk_HHS_BH_UserArgs_MT128x256x32_MI16x16x1_SN_LDSB1_CLR1_GSU0_GSUC0_GSUWGMRR0_K1_LBSPPA1024_LBSPPB2048_LPA0_LPB0_MIWT4_8_PLR1_SU32_SUM0_SUS256_SKXCCM8_VWA4_VWB8_WGM1_WGMXCC1_WGMXCCGn1
    SolutionIndex: 65
    SolutionNameMin: Cijk_Ailk_Bjlk_HHS_BH_UserArgs_MT128x256x32_MI16x16x1_SN_LDSB1_CLR1_GSU0_GSUC0_GSUWGMRR0_K1_LBSPPA1024_LBSPPB2048_LPA0_LPB0_MIWT4_8_PLR1_SU32_SUM0_SUS256_SKXCCM8_VWA4_VWB8_WGM4_WGMXCC1_WGMXCCGn1
    SolutionIndex: 66
    SolutionNameMin: Cijk_Ailk_Bjlk_HHS_BH_UserArgs_MT128x256x32_MI16x16x1_SN_LDSB1_CLR1_GSU0_GSUC0_GSUWGMRR0_K1_LBSPPA1024_LBSPPB2048_LPA32_LPB32_MIWT4_8_PLR1_SU32_SUM0_SUS256_SKXCCM8_VWA2_VWB2_WGM8_WGMXCC1_WGMXCCGn1
    SolutionIndex: 67
    SolutionNameMin: Cijk_Ailk_Bjlk_HHS_BH_UserArgs_MT128x256x32_MI16x16x1_SN_LDSB1_CLR1_GSU0_GSUC0_GSUWGMRR0_K1_LBSPPA1024_LBSPPB2048_LPA32_LPB0_MIWT4_8_PLR1_SU32_SUM0_SUS256_SKXCCM8_VWA2_VWB8_WGM8_WGMXCC1_WGMXCCGn1
    SolutionIndex: 68
    SolutionNameMin: Cijk_Ailk_Bjlk_HHS_BH_UserArgs_MT256x128x32_MI16x16x1_SN_LDSB1_CLR1_GSU0_GSUC0_GSUWGMRR0_K1_LBSPPA2048_LBSPPB1024_LPA0_LPB32_MIWT8_4_PLR1_SU32_SUM0_SUS256_SKXCCM8_VWA8_VWB2_WGM1_WGMXCC1_WGMXCCGn1
    SolutionIndex: 69
    SolutionNameMin: Cijk_Ailk_Bjlk_HHS_BH_UserArgs_MT256x128x32_MI16x16x1_SN_LDSB1_CLR1_GSU0_GSUC0_GSUWGMRR0_K1_LBSPPA2048_LBSPPB1024_LPA0_LPB0_MIWT8_4_PLR1_SU32_SUM0_SUS256_SKXCCM8_VWA8_VWB4_WGM1_WGMXCC1_WGMXCCGn1
    SolutionIndex: 70
    SolutionNameMin: Cijk_Ailk_Bjlk_HHS_BH_UserArgs_MT256x128x32_MI16x16x1_SN_LDSB1_CLR1_GSU0_GSUC0_GSUWGMRR0_K1_LBSPPA2048_LBSPPB1024_LPA0_LPB32_MIWT8_4_PLR1_SU32_SUM0_SUS256_SKXCCM8_VWA8_VWB2_WGM8_WGMXCC1_WGMXCCGn1
    SolutionIndex: 71
    SolutionNameMin: Cijk_Ailk_Bjlk_HHS_BH_UserArgs_MT128x128x32_MI16x16x1_SN_LDSB1_CLR1_GSU0_GSUC0_GSUWGMRR0_K1_LBSPPA1024_LBSPPB1024_LPA32_LPB0_MIWT4_4_PLR1_SU32_SUM0_SUS256_SKXCCM8_VWA2_VWB4_WGM1_WGMXCC1_WGMXCCGn1
    SolutionIndex: 72
    SolutionNameMin: Cijk_Ailk_Bjlk_HHS_BH_UserArgs_MT128x128x32_MI16x16x1_SN_LDSB1_CLR1_GSU0_GSUC0_GSUWGMRR0_K1_LBSPPA1024_LBSPPB1024_LPA32_LPB0_MIWT4_4_PLR1_SU32_SUM0_SUS256_SKXCCM8_VWA2_VWB4_WGM4_WGMXCC1_WGMXCCGn1
    SolutionIndex: 73
    SolutionNameMin: Cijk_Ailk_Bjlk_HHS_BH_UserArgs_MT128x64x32_MI16x16x1_SN_LDSB0_CLR1_GSU0_GSUC0_GSUWGMRR0_K1_LBSPPA1024_LBSPPB512_LPA0_LPB16_MIWT4_2_PLR1_SU32_SUM0_SUS256_SKXCCM8_VWA4_VWB1_WGM1_WGMXCC1_WGMXCCGn1
    SolutionIndex: 74
    SolutionNameMin: Cijk_Ailk_Bjlk_HHS_BH_UserArgs_MT128x64x32_MI16x16x1_SN_LDSB0_CLR1_GSU0_GSUC0_GSUWGMRR0_K1_LBSPPA1024_LBSPPB512_LPA32_LPB32_MIWT4_2_PLR1_SU32_SUM0_SUS256_SKXCCM8_VWA2_VWB2_WGM1_WGMXCC1_WGMXCCGn1
    SolutionIndex: 75
    SolutionNameMin: Cijk_Ailk_Bjlk_HHS_BH_UserArgs_MT128x64x32_MI16x16x1_SN_LDSB0_CLR1_GSU0_GSUC0_GSUWGMRR0_K1_LBSPPA1024_LBSPPB512_LPA0_LPB32_MIWT4_2_PLR1_SU32_SUM0_SUS256_SKXCCM8_VWA4_VWB2_WGM1_WGMXCC1_WGMXCCGn1
    SolutionIndex: 76
    SolutionNameMin: Cijk_Ailk_Bjlk_HHS_BH_UserArgs_MT128x64x32_MI16x16x1_SN_LDSB0_CLR1_GSU0_GSUC0_GSUWGMRR0_K1_LBSPPA1024_LBSPPB512_LPA32_LPB32_MIWT4_2_PLR1_SU32_SUM0_SUS256_SKXCCM8_VWA2_VWB2_WGM4_WGMXCC1_WGMXCCGn1
    SolutionIndex: 77
    SolutionNameMin: Cijk_Ailk_Bjlk_HHS_BH_UserArgs_MT64x64x32_MI16x16x1_SN_LDSB0_CLR1_GSU0_GSUC0_GSUWGMRR0_K1_LBSPPA512_LBSPPB512_LPA32_LPB32_MIWT2_2_PLR1_SU32_SUM0_SUS256_SKXCCM8_VWA2_VWB2_WGM1_WGMXCC1_WGMXCCGn1
    SolutionIndex: 78
    SolutionNameMin: Cijk_Ailk_Bjlk_HHS_BH_UserArgs_MT32x32x32_MI16x16x1_SN_LDSB0_CLR1_GSU0_GSUC0_GSUWGMRR0_K1_LBSPPA256_LBSPPB256_LPA16_LPB16_MIWT1_1_PLR1_SU32_SUM0_SUS256_SKXCCM8_VWA1_VWB1_WGM1_WGMXCC1_WGMXCCGn1
    SolutionIndex: 79
    SolutionNameMin: Cijk_Ailk_Bjlk_HHS_BH_UserArgs_MT32x32x32_MI16x16x1_SN_LDSB0_CLR0_GSU0_GSUC0_GSUWGMRR0_K1_LBSPPA256_LBSPPB256_LPA16_LPB16_MIWT1_1_PLR0_SU32_SUM0_SUS256_SKXCCM8_VWA1_VWB1_WGM1_WGMXCC1_WGMXCCGn1
    SolutionIndex: 80
    SolutionNameMin: Cijk_Ailk_Bjlk_HHS_BH_UserArgs_MT256x256x64_MI16x16x1_SN_LDSB1_CLR1_GSU0_GSUC0_GSUWGMRR0_K1_LBSPPA2048_LBSPPB2048_LPA0_LPB0_MIWT8_8_PLR1_SU32_SUM0_SUS256_SKXCCM8_VWA4_VWB4_WGM1_WGMXCC1_WGMXCCGn1
    SolutionIndex: 81
    SolutionNameMin: Cijk_Ailk_Bjlk_HHS_BH_UserArgs_MT256x256x64_MI16x16x1_SN_LDSB1_CLR1_GSU0_GSUC0_GSUWGMRR0_K1_LBSPPA2048_LBSPPB2048_LPA0_LPB0_MIWT8_8_PLR2_SU32_SUM0_SUS256_SKXCCM8_VWA4_VWB4_WGM1_WGMXCC1_WGMXCCGn1
    SolutionIndex: 82
    SolutionNameMin: Cijk_Ailk_Bjlk_HHS_BH_UserArgs_MT256x256x64_MI16x16x1_SN_LDSB1_CLR1_GSU0_GSUC0_GSUWGMRR0_K1_LBSPPA2048_LBSPPB2048_LPA0_LPB0_MIWT8_8_PLR2_SU32_SUM0_SUS256_SKXCCM8_VWA4_VWB8_WGM1_WGMXCC1_WGMXCCGn1
    SolutionIndex: 83
    SolutionNameMin: Cijk_Ailk_Bjlk_HHS_BH_UserArgs_MT256x256x64_MI16x16x1_SN_LDSB1_CLR1_GSU0_GSUC0_GSUWGMRR0_K1_LBSPPA2048_LBSPPB2048_LPA0_LPB0_MIWT8_8_PLR2_SU32_SUM0_SUS256_SKXCCM8_VWA8_VWB8_WGM1_WGMXCC1_WGMXCCGn1
    SolutionIndex: 84
    SolutionNameMin: Cijk_Ailk_Bjlk_HHS_BH_UserArgs_MT256x256x64_MI16x16x1_SN_LDSB1_CLR1_GSU0_GSUC0_GSUWGMRR0_K1_LBSPPA2048_LBSPPB2048_LPA0_LPB0_MIWT8_8_PLR1_SU32_SUM0_SUS256_SKXCCM8_VWA4_VWB4_WGM4_WGMXCC1_WGMXCCGn1
    SolutionIndex: 85
    SolutionNameMin: Cijk_Ailk_Bjlk_HHS_BH_UserArgs_MT256x256x64_MI16x16x1_SN_LDSB1_CLR1_GSU0_GSUC0_GSUWGMRR0_K1_LBSPPA2048_LBSPPB2048_LPA0_LPB0_MIWT8_8_PLR2_SU32_SUM0_SUS256_SKXCCM8_VWA4_VWB8_WGM4_WGMXCC1_WGMXCCGn1
    SolutionIndex: 86
    SolutionNameMin: Cijk_Ailk_Bjlk_HHS_BH_UserArgs_MT256x256x64_MI16x16x1_SN_LDSB1_CLR1_GSU0_GSUC0_GSUWGMRR0_K1_LBSPPA2048_LBSPPB2048_LPA0_LPB0_MIWT8_8_PLR2_SU32_SUM0_SUS256_SKXCCM8_VWA8_VWB8_WGM4_WGMXCC1_WGMXCCGn1
    SolutionIndex: 87
    SolutionNameMin: Cijk_Ailk_Bjlk_HHS_BH_UserArgs_MT256x256x64_MI16x16x1_SN_LDSB1_CLR1_GSU0_GSUC0_GSUWGMRR0_K1_LBSPPA2048_LBSPPB2048_LPA0_LPB0_MIWT8_8_PLR1_SU32_SUM0_SUS256_SKXCCM8_VWA4_VWB4_WGM8_WGMXCC1_WGMXCCGn1
    SolutionIndex: 88
    SolutionNameMin: Cijk_Ailk_Bjlk_HHS_BH_UserArgs_MT256x256x64_MI16x16x1_SN_LDSB1_CLR1_GSU0_GSUC0_GSUWGMRR0_K1_LBSPPA2048_LBSPPB2048_LPA0_LPB0_MIWT8_8_PLR1_SU32_SUM0_SUS256_SKXCCM8_VWA8_VWB8_WGM8_WGMXCC1_WGMXCCGn1
    SolutionIndex: 89
    SolutionNameMin: Cijk_Ailk_Bjlk_HHS_BH_UserArgs_MT128x256x64_MI16x16x1_SN_LDSB1_CLR1_GSU0_GSUC0_GSUWGMRR0_K1_LBSPPA1024_LBSPPB2048_LPA0_LPB32_MIWT4_8_PLR1_SU32_SUM0_SUS256_SKXCCM8_VWA4_VWB2_WGM1_WGMXCC1_WGMXCCGn1
    SolutionIndex: 90
    SolutionNameMin: Cijk_Ailk_Bjlk_HHS_BH_UserArgs_MT128x256x64_MI16x16x1_SN_LDSB1_CLR1_GSU0_GSUC0_GSUWGMRR0_K1_LBSPPA1024_LBSPPB2048_LPA32_LPB0_MIWT4_8_PLR1_SU32_SUM0_SUS256_SKXCCM8_VWA2_VWB4_WGM4_WGMXCC1_WGMXCCGn1
    SolutionIndex: 91
    SolutionNameMin: Cijk_Ailk_Bjlk_HHS_BH_UserArgs_MT128x256x64_MI16x16x1_SN_LDSB1_CLR1_GSU0_GSUC0_GSUWGMRR0_K1_LBSPPA1024_LBSPPB2048_LPA0_LPB0_MIWT4_8_PLR1_SU32_SUM0_SUS256_SKXCCM8_VWA4_VWB4_WGM4_WGMXCC1_WGMXCCGn1
    SolutionIndex: 92
    SolutionNameMin: Cijk_Ailk_Bjlk_HHS_BH_UserArgs_MT128x256x64_MI16x16x1_SN_LDSB1_CLR1_GSU0_GSUC0_GSUWGMRR0_K1_LBSPPA1024_LBSPPB2048_LPA0_LPB0_MIWT4_8_PLR1_SU32_SUM0_SUS256_SKXCCM8_VWA4_VWB8_WGM4_WGMXCC1_WGMXCCGn1
    SolutionIndex: 93
    SolutionNameMin: Cijk_Ailk_Bjlk_HHS_BH_UserArgs_MT128x256x64_MI16x16x1_SN_LDSB1_CLR1_GSU0_GSUC0_GSUWGMRR0_K1_LBSPPA1024_LBSPPB2048_LPA32_LPB0_MIWT4_8_PLR2_SU32_SUM0_SUS256_SKXCCM8_VWA2_VWB4_WGM4_WGMXCC1_WGMXCCGn1
    SolutionIndex: 94
    SolutionNameMin: Cijk_Ailk_Bjlk_HHS_BH_UserArgs_MT128x256x64_MI16x16x1_SN_LDSB1_CLR1_GSU0_GSUC0_GSUWGMRR0_K1_LBSPPA1024_LBSPPB2048_LPA0_LPB0_MIWT4_8_PLR1_SU32_SUM0_SUS256_SKXCCM8_VWA4_VWB4_WGM8_WGMXCC1_WGMXCCGn1
    SolutionIndex: 95
    SolutionNameMin: Cijk_Ailk_Bjlk_HHS_BH_UserArgs_MT128x256x64_MI16x16x1_SN_LDSB1_CLR1_GSU0_GSUC0_GSUWGMRR0_K1_LBSPPA1024_LBSPPB2048_LPA0_LPB0_MIWT4_8_PLR2_SU32_SUM0_SUS256_SKXCCM8_VWA4_VWB4_WGM8_WGMXCC1_WGMXCCGn1
    SolutionIndex: 96
    SolutionNameMin: Cijk_Ailk_Bjlk_HHS_BH_UserArgs_MT256x128x64_MI16x16x1_SN_LDSB1_CLR1_GSU0_GSUC0_GSUWGMRR0_K1_LBSPPA2048_LBSPPB1024_LPA0_LPB16_MIWT8_4_PLR1_SU32_SUM0_SUS256_SKXCCM8_VWA4_VWB1_WGM1_WGMXCC1_WGMXCCGn1
    SolutionIndex: 97
    SolutionNameMin: Cijk_Ailk_Bjlk_HHS_BH_UserArgs_MT256x128x64_MI16x16x1_SN_LDSB1_CLR1_GSU0_GSUC0_GSUWGMRR0_K1_LBSPPA2048_LBSPPB1024_LPA32_LPB0_MIWT8_4_PLR2_SU32_SUM0_SUS256_SKXCCM8_VWA2_VWB4_WGM8_WGMXCC1_WGMXCCGn1
    SolutionIndex: 98
    SolutionNameMin: Cijk_Ailk_Bjlk_HHS_BH_UserArgs_MT128x128x64_MI16x16x1_SN_LDSB1_CLR1_GSU0_GSUC0_GSUWGMRR0_K1_LBSPPA1024_LBSPPB1024_LPA32_LPB0_MIWT4_4_PLR1_SU32_SUM0_SUS256_SKXCCM8_VWA2_VWB4_WGM1_WGMXCC1_WGMXCCGn1
    SolutionIndex: 99
    SolutionNameMin: Cijk_Ailk_Bjlk_HHS_BH_UserArgs_MT128x128x64_MI16x16x1_SN_LDSB1_CLR1_GSU0_GSUC0_GSUWGMRR0_K1_LBSPPA1024_LBSPPB1024_LPA0_LPB0_MIWT4_4_PLR1_SU32_SUM0_SUS256_SKXCCM8_VWA4_VWB4_WGM1_WGMXCC1_WGMXCCGn1
    SolutionIndex: 100
    SolutionNameMin: Cijk_Ailk_Bjlk_HHS_BH_UserArgs_MT128x128x64_MI16x16x1_SN_LDSB1_CLR1_GSU0_GSUC0_GSUWGMRR0_K1_LBSPPA1024_LBSPPB1024_LPA32_LPB0_MIWT4_4_PLR1_SU32_SUM0_SUS256_SKXCCM8_VWA2_VWB4_WGM4_WGMXCC1_WGMXCCGn1
    SolutionIndex: 101
    SolutionNameMin: Cijk_Ailk_Bjlk_HHS_BH_UserArgs_MT128x128x64_MI16x16x1_SN_LDSB1_CLR1_GSU0_GSUC0_GSUWGMRR0_K1_LBSPPA1024_LBSPPB1024_LPA0_LPB0_MIWT4_4_PLR1_SU32_SUM0_SUS256_SKXCCM8_VWA4_VWB4_WGM4_WGMXCC1_WGMXCCGn1
    SolutionIndex: 102
    SolutionNameMin: Cijk_Ailk_Bjlk_HHS_BH_UserArgs_MT128x128x64_MI16x16x1_SN_LDSB1_CLR1_GSU0_GSUC0_GSUWGMRR0_K1_LBSPPA1024_LBSPPB1024_LPA0_LPB0_MIWT4_4_PLR2_SU32_SUM0_SUS256_SKXCCM8_VWA4_VWB4_WGM4_WGMXCC1_WGMXCCGn1
    SolutionIndex: 103
    SolutionNameMin: Cijk_Ailk_Bjlk_HHS_BH_UserArgs_MT128x128x64_MI16x16x1_SN_LDSB1_CLR1_GSU0_GSUC0_GSUWGMRR0_K1_LBSPPA1024_LBSPPB1024_LPA0_LPB0_MIWT4_4_PLR1_SU32_SUM0_SUS256_SKXCCM8_VWA4_VWB4_WGM8_WGMXCC1_WGMXCCGn1
    SolutionIndex: 104
    SolutionNameMin: Cijk_Ailk_Bjlk_HHS_BH_UserArgs_MT64x128x64_MI16x16x1_SN_LDSB1_CLR1_GSU0_GSUC0_GSUWGMRR0_K1_LBSPPA512_LBSPPB1024_LPA32_LPB0_MIWT2_4_PLR2_SU32_SUM0_SUS256_SKXCCM8_VWA2_VWB4_WGM1_WGMXCC1_WGMXCCGn1
    SolutionIndex: 105
    SolutionNameMin: Cijk_Ailk_Bjlk_HHS_BH_UserArgs_MT128x64x64_MI16x16x1_SN_LDSB1_CLR1_GSU0_GSUC0_GSUWGMRR0_K1_LBSPPA1024_LBSPPB512_LPA32_LPB32_MIWT4_2_PLR2_SU32_SUM0_SUS256_SKXCCM8_VWA2_VWB2_WGM1_WGMXCC1_WGMXCCGn1
    SolutionIndex: 106
    SolutionNameMin: Cijk_Ailk_Bjlk_HHS_BH_UserArgs_MT128x64x64_MI16x16x1_SN_LDSB1_CLR1_GSU0_GSUC0_GSUWGMRR0_K1_LBSPPA1024_LBSPPB512_LPA0_LPB32_MIWT4_2_PLR2_SU32_SUM0_SUS256_SKXCCM8_VWA4_VWB2_WGM1_WGMXCC1_WGMXCCGn1
    SolutionIndex: 107
    SolutionNameMin: Cijk_Ailk_Bjlk_HHS_BH_UserArgs_MT128x64x64_MI16x16x1_SN_LDSB1_CLR1_GSU0_GSUC0_GSUWGMRR0_K1_LBSPPA1024_LBSPPB512_LPA32_LPB32_MIWT4_2_PLR2_SU32_SUM0_SUS256_SKXCCM8_VWA2_VWB2_WGM4_WGMXCC1_WGMXCCGn1
    SolutionIndex: 108
    SolutionNameMin: Cijk_Ailk_Bjlk_HHS_BH_UserArgs_MT128x64x64_MI16x16x1_SN_LDSB1_CLR1_GSU0_GSUC0_GSUWGMRR0_K1_LBSPPA1024_LBSPPB512_LPA0_LPB32_MIWT4_2_PLR2_SU32_SUM0_SUS256_SKXCCM8_VWA4_VWB2_WGM4_WGMXCC1_WGMXCCGn1
    SolutionIndex: 109
    SolutionNameMin: Cijk_Ailk_Bjlk_HHS_BH_UserArgs_MT128x64x64_MI16x16x1_SN_LDSB1_CLR1_GSU0_GSUC0_GSUWGMRR0_K1_LBSPPA1024_LBSPPB512_LPA0_LPB32_MIWT4_2_PLR2_SU32_SUM0_SUS256_SKXCCM8_VWA4_VWB2_WGM8_WGMXCC1_WGMXCCGn1
    SolutionIndex: 110
    SolutionNameMin: Cijk_Ailk_Bjlk_HHS_BH_UserArgs_MT64x64x64_MI16x16x1_SN_LDSB1_CLR1_GSU0_GSUC0_GSUWGMRR0_K1_LBSPPA512_LBSPPB512_LPA32_LPB32_MIWT2_2_PLR1_SU32_SUM0_SUS256_SKXCCM8_VWA2_VWB2_WGM1_WGMXCC1_WGMXCCGn1
    SolutionIndex: 111
    SolutionNameMin: Cijk_Ailk_Bjlk_HHS_BH_UserArgs_MT64x64x64_MI16x16x1_SN_LDSB1_CLR1_GSU0_GSUC0_GSUWGMRR0_K1_LBSPPA512_LBSPPB512_LPA32_LPB32_MIWT2_2_PLR2_SU32_SUM0_SUS256_SKXCCM8_VWA2_VWB2_WGM1_WGMXCC1_WGMXCCGn1
    SolutionIndex: 112
    SolutionNameMin: Cijk_Ailk_Bjlk_HHS_BH_UserArgs_MT64x64x64_MI16x16x1_SN_LDSB1_CLR1_GSU0_GSUC0_GSUWGMRR0_K1_LBSPPA512_LBSPPB512_LPA32_LPB32_MIWT2_2_PLR1_SU32_SUM0_SUS256_SKXCCM8_VWA2_VWB2_WGM4_WGMXCC1_WGMXCCGn1
    SolutionIndex: 113
    SolutionNameMin: Cijk_Ailk_Bjlk_HHS_BH_UserArgs_MT64x64x64_MI16x16x1_SN_LDSB1_CLR1_GSU0_GSUC0_GSUWGMRR0_K1_LBSPPA512_LBSPPB512_LPA32_LPB32_MIWT2_2_PLR2_SU32_SUM0_SUS256_SKXCCM8_VWA2_VWB2_WGM4_WGMXCC1_WGMXCCGn1
    SolutionIndex: 114
    SolutionNameMin: Cijk_Ailk_Bjlk_HHS_BH_UserArgs_MT64x64x64_MI16x16x1_SN_LDSB1_CLR1_GSU0_GSUC0_GSUWGMRR0_K1_LBSPPA512_LBSPPB512_LPA32_LPB32_MIWT2_2_PLR1_SU32_SUM0_SUS256_SKXCCM8_VWA2_VWB2_WGM8_WGMXCC1_WGMXCCGn1
    SolutionIndex: 115
    SolutionNameMin: Cijk_Ailk_Bjlk_HHS_BH_UserArgs_MT32x64x64_MI16x16x1_SN_LDSB0_CLR1_GSU0_GSUC0_GSUWGMRR0_K1_LBSPPA256_LBSPPB512_LPA16_LPB32_MIWT1_2_PLR2_SU32_SUM0_SUS256_SKXCCM8_VWA1_VWB2_WGM1_WGMXCC1_WGMXCCGn1
    SolutionIndex: 116
    SolutionNameMin: Cijk_Ailk_Bjlk_HHS_BH_UserArgs_MT32x64x64_MI16x16x1_SN_LDSB0_CLR1_GSU0_GSUC0_GSUWGMRR0_K1_LBSPPA256_LBSPPB512_LPA16_LPB32_MIWT1_2_PLR2_SU32_SUM0_SUS256_SKXCCM8_VWA1_VWB2_WGM8_WGMXCC1_WGMXCCGn1
    SolutionIndex: 117
    SolutionNameMin: Cijk_Ailk_Bjlk_HHS_BH_UserArgs_MT64x32x64_MI16x16x1_SN_LDSB0_CLR1_GSU0_GSUC0_GSUWGMRR0_K1_LBSPPA512_LBSPPB256_LPA32_LPB16_MIWT2_1_PLR2_SU32_SUM0_SUS256_SKXCCM8_VWA2_VWB1_WGM1_WGMXCC1_WGMXCCGn1
    SolutionIndex: 118
    SolutionNameMin: Cijk_Ailk_Bjlk_HHS_BH_UserArgs_MT32x32x64_MI16x16x1_SN_LDSB0_CLR1_GSU0_GSUC0_GSUWGMRR0_K1_LBSPPA256_LBSPPB256_LPA16_LPB16_MIWT1_1_PLR1_SU32_SUM0_SUS256_SKXCCM8_VWA1_VWB1_WGM1_WGMXCC1_WGMXCCGn1
    SolutionIndex: 119
    SolutionNameMin: Cijk_Ailk_Bjlk_HHS_BH_UserArgs_MT32x32x64_MI16x16x1_SN_LDSB0_CLR1_GSU0_GSUC0_GSUWGMRR0_K1_LBSPPA256_LBSPPB256_LPA16_LPB16_MIWT1_1_PLR2_SU32_SUM0_SUS256_SKXCCM8_VWA1_VWB1_WGM1_WGMXCC1_WGMXCCGn1
    SolutionIndex: 120
    SolutionNameMin: Cijk_Ailk_Bjlk_HHS_BH_UserArgs_MT32x32x64_MI16x16x1_SN_LDSB0_CLR1_GSU0_GSUC0_GSUWGMRR0_K1_LBSPPA256_LBSPPB256_LPA16_LPB16_MIWT1_1_PLR1_SU32_SUM0_SUS256_SKXCCM8_VWA1_VWB1_WGM8_WGMXCC1_WGMXCCGn1
    SolutionIndex: 121
    SolutionNameMin: Cijk_Ailk_Bjlk_HHS_BH_UserArgs_MT128x128x128_MI16x16x1_SN_LDSB1_CLR1_GSU0_GSUC0_GSUWGMRR0_K1_LBSPPA1024_LBSPPB1024_LPA0_LPB0_MIWT4_4_PLR1_SU32_SUM0_SUS256_SKXCCM8_VWA4_VWB4_WGM1_WGMXCC1_WGMXCCGn1
    SolutionIndex: 122
    SolutionNameMin: Cijk_Ailk_Bjlk_HHS_BH_UserArgs_MT128x128x128_MI16x16x1_SN_LDSB1_CLR1_GSU0_GSUC0_GSUWGMRR0_K1_LBSPPA1024_LBSPPB1024_LPA0_LPB0_MIWT4_4_PLR1_SU32_SUM0_SUS256_SKXCCM8_VWA4_VWB4_WGM4_WGMXCC1_WGMXCCGn1
    SolutionIndex: 123
    SolutionNameMin: Cijk_Ailk_Bjlk_HHS_BH_UserArgs_MT128x128x128_MI16x16x1_SN_LDSB1_CLR1_GSU0_GSUC0_GSUWGMRR0_K1_LBSPPA1024_LBSPPB1024_LPA0_LPB0_MIWT4_4_PLR2_SU32_SUM0_SUS256_SKXCCM8_VWA4_VWB4_WGM4_WGMXCC1_WGMXCCGn1
    SolutionIndex: 124
    SolutionNameMin: Cijk_Ailk_Bjlk_HHS_BH_UserArgs_MT128x128x128_MI16x16x1_SN_LDSB1_CLR1_GSU0_GSUC0_GSUWGMRR0_K1_LBSPPA1024_LBSPPB1024_LPA0_LPB0_MIWT4_4_PLR1_SU32_SUM0_SUS256_SKXCCM8_VWA4_VWB4_WGM8_WGMXCC1_WGMXCCGn1
    SolutionIndex: 125
    SolutionNameMin: Cijk_Ailk_Bjlk_HHS_BH_UserArgs_MT128x128x128_MI16x16x1_SN_LDSB1_CLR1_GSU0_GSUC0_GSUWGMRR0_K1_LBSPPA1024_LBSPPB1024_LPA0_LPB0_MIWT4_4_PLR2_SU32_SUM0_SUS256_SKXCCM8_VWA4_VWB4_WGM8_WGMXCC1_WGMXCCGn1
    SolutionIndex: 126
    SolutionNameMin: Cijk_Ailk_Bjlk_HHS_BH_UserArgs_MT128x64x128_MI16x16x1_SN_LDSB1_CLR1_GSU0_GSUC0_GSUWGMRR0_K1_LBSPPA1024_LBSPPB512_LPA0_LPB32_MIWT4_2_PLR2_SU32_SUM0_SUS256_SKXCCM8_VWA4_VWB2_WGM1_WGMXCC1_WGMXCCGn1
    SolutionIndex: 127
    SolutionNameMin: Cijk_Ailk_Bjlk_HHS_BH_UserArgs_MT128x64x128_MI16x16x1_SN_LDSB1_CLR1_GSU0_GSUC0_GSUWGMRR0_K1_LBSPPA1024_LBSPPB512_LPA0_LPB32_MIWT4_2_PLR2_SU32_SUM0_SUS256_SKXCCM8_VWA4_VWB2_WGM4_WGMXCC1_WGMXCCGn1
    SolutionIndex: 128
    SolutionNameMin: Cijk_Ailk_Bjlk_HHS_BH_UserArgs_MT128x64x128_MI16x16x1_SN_LDSB1_CLR1_GSU0_GSUC0_GSUWGMRR0_K1_LBSPPA1024_LBSPPB512_LPA0_LPB32_MIWT4_2_PLR2_SU32_SUM0_SUS256_SKXCCM8_VWA4_VWB2_WGM8_WGMXCC1_WGMXCCGn1
    SolutionIndex: 129
    SolutionNameMin: Cijk_Ailk_Bjlk_HHS_BH_UserArgs_MT64x64x128_MI16x16x1_SN_LDSB1_CLR1_GSU0_GSUC0_GSUWGMRR0_K1_LBSPPA512_LBSPPB512_LPA32_LPB32_MIWT2_2_PLR2_SU32_SUM0_SUS256_SKXCCM8_VWA2_VWB2_WGM1_WGMXCC1_WGMXCCGn1
    SolutionIndex: 130
    SolutionNameMin: Cijk_Ailk_Bjlk_HHS_BH_UserArgs_MT64x64x128_MI16x16x1_SN_LDSB1_CLR1_GSU0_GSUC0_GSUWGMRR0_K1_LBSPPA512_LBSPPB512_LPA32_LPB32_MIWT2_2_PLR2_SU32_SUM0_SUS256_SKXCCM8_VWA2_VWB2_WGM4_WGMXCC1_WGMXCCGn1
    SolutionIndex: 131
    SolutionNameMin: Cijk_Ailk_Bjlk_HHS_BH_UserArgs_MT64x32x128_MI16x16x1_SN_LDSB1_CLR1_GSU0_GSUC0_GSUWGMRR0_K1_LBSPPA512_LBSPPB256_LPA32_LPB16_MIWT2_1_PLR2_SU32_SUM0_SUS256_SKXCCM8_VWA2_VWB1_WGM1_WGMXCC1_WGMXCCGn1
    SolutionIndex: 132
    SolutionNameMin: Cijk_Ailk_Bjlk_HHS_BH_UserArgs_MT64x32x128_MI16x16x1_SN_LDSB1_CLR1_GSU0_GSUC0_GSUWGMRR0_K1_LBSPPA512_LBSPPB256_LPA32_LPB16_MIWT2_1_PLR1_SU32_SUM0_SUS256_SKXCCM8_VWA2_VWB1_WGM8_WGMXCC1_WGMXCCGn1
    SolutionIndex: 133
    SolutionNameMin: Cijk_Ailk_Bjlk_HHS_BH_UserArgs_MT32x32x128_MI16x16x1_SN_LDSB1_CLR1_GSU0_GSUC0_GSUWGMRR0_K1_LBSPPA256_LBSPPB256_LPA16_LPB16_MIWT1_1_PLR1_SU32_SUM0_SUS256_SKXCCM8_VWA1_VWB1_WGM1_WGMXCC1_WGMXCCGn1
    SolutionIndex: 134
    SolutionNameMin: Cijk_Ailk_Bjlk_HHS_BH_UserArgs_MT32x32x128_MI16x16x1_SN_LDSB1_CLR1_GSU0_GSUC0_GSUWGMRR0_K1_LBSPPA256_LBSPPB256_LPA16_LPB16_MIWT1_1_PLR2_SU32_SUM0_SUS256_SKXCCM8_VWA1_VWB1_WGM1_WGMXCC1_WGMXCCGn1
    SolutionIndex: 135
    SolutionNameMin: Cijk_Ailk_Bjlk_HHS_BH_UserArgs_MT32x32x32_MI16x16x1_SN_LDSB0_CLR0_GSU0_GSUC0_GSUWGMRR0_K1_LBSPPA256_LBSPPB256_LPA16_LPB16_MIWT1_1_PLR0_SU32_SUM0_SUS256_SKXCCM0_VWA1_VWB1_WGM1_WGMXCC1_WGMXCCGn1
- - - [128, 128, 1, 128, 128, 128, 128, 128]
    - [5, 0.08]
  - - [128, 128, 1, 256, 128, 128, 128, 128]
    - [27, 0.144]
  - - [128, 128, 1, 512, 128, 128, 128, 128]
    - [48, 0.229]
  - - [128, 128, 1, 1024, 128, 128, 128, 128]
    - [134, 0.332]
  - - [128, 128, 1, 2048, 128, 128, 128, 128]
    - [78, 0.545]
  - - [128, 128, 1, 4096, 128, 128, 128, 128]
    - [118, 0.908]
  - - [128, 128, 1, 8192, 128, 128, 128, 128]
    - [78, 1.407]
  - - [128, 256, 1, 128, 128, 128, 128, 256]
    - [28, 0.162]
  - - [128, 256, 1, 256, 128, 128, 128, 256]
    - [27, 0.283]
  - - [128, 256, 1, 512, 128, 128, 128, 256]
    - [27, 0.465]
  - - [128, 256, 1, 1024, 128, 128, 128, 256]
    - [50, 0.653]
  - - [128, 256, 1, 2048, 128, 128, 128, 256]
    - [78, 1.068]
  - - [128, 256, 1, 4096, 128, 128, 128, 256]
    - [118, 1.802]
  - - [128, 256, 1, 8192, 128, 128, 128, 256]
    - [134, 2.606]
  - - [128, 512, 1, 128, 128, 128, 128, 512]
    - [27, 0.323]
  - - [128, 512, 1, 256, 128, 128, 128, 512]
    - [28, 0.571]
  - - [128, 512, 1, 512, 128, 128, 128, 512]
    - [27, 0.92]
  - - [128, 512, 1, 1024, 128, 128, 128, 512]
    - [49, 1.328]
  - - [128, 512, 1, 2048, 128, 128, 128, 512]
    - [134, 1.995]
  - - [128, 512, 1, 4096, 128, 128, 128, 512]
    - [118, 3.414]
  - - [128, 512, 1, 8192, 128, 128, 128, 512]
    - [134, 4.909]
  - - [128, 1024, 1, 128, 128, 128, 128, 1024]
    - [5, 0.639]
  - - [128, 1024, 1, 256, 128, 128, 128, 1024]
    - [48, 1.105]
  - - [128, 1024, 1, 512, 128, 128, 128, 1024]
    - [48, 1.796]
  - - [128, 1024, 1, 1024, 128, 128, 128, 1024]
    - [49, 2.617]
  - - [128, 1024, 1, 2048, 128, 128, 128, 1024]
    - [49, 3.787]
  - - [128, 1024, 1, 4096, 128, 128, 128, 1024]
    - [115, 5.923]
  - - [128, 1024, 1, 8192, 128, 128, 128, 1024]
    - [42, 7.958]
  - - [128, 2048, 1, 128, 128, 128, 128, 2048]
    - [6, 1.224]
  - - [128, 2048, 1, 256, 128, 128, 128, 2048]
    - [28, 2.166]
  - - [128, 2048, 1, 512, 128, 128, 128, 2048]
    - [27, 3.479]
  - - [128, 2048, 1, 1024, 128, 128, 128, 2048]
    - [51, 4.968]
  - - [128, 2048, 1, 2048, 128, 128, 128, 2048]
    - [42, 6.784]
  - - [128, 2048, 1, 4096, 128, 128, 128, 2048]
    - [19, 9.46]
  - - [128, 2048, 1, 8192, 128, 128, 128, 2048]
    - [129, 12.156]
  - - [128, 4096, 1, 128, 128, 128, 128, 4096]
    - [26, 2.312]
  - - [128, 4096, 1, 256, 128, 128, 128, 4096]
    - [26, 3.983]
  - - [128, 4096, 1, 512, 128, 128, 128, 4096]
    - [131, 6.415]
  - - [128, 4096, 1, 1024, 128, 128, 128, 4096]
    - [132, 8.713]
  - - [128, 4096, 1, 2048, 128, 128, 128, 4096]
    - [38, 10.152]
  - - [128, 4096, 1, 4096, 128, 128, 128, 4096]
    - [106, 13.075]
  - - [128, 4096, 1, 8192, 128, 128, 128, 4096]
    - [127, 16.096]
  - - [128, 8192, 1, 128, 128, 128, 128, 8192]
    - [77, 4.174]
  - - [128, 8192, 1, 256, 128, 128, 128, 8192]
    - [20, 7.222]
  - - [128, 8192, 1, 512, 128, 128, 128, 8192]
    - [110, 10.296]
  - - [128, 8192, 1, 1024, 128, 128, 128, 8192]
    - [129, 13.01]
  - - [128, 8192, 1, 2048, 128, 128, 128, 8192]
    - [129, 14.308]
  - - [128, 8192, 1, 4096, 128, 128, 128, 8192]
    - [101, 17.195]
  - - [128, 8192, 1, 8192, 128, 128, 128, 8192]
    - [31, 20.621]
  - - [256, 128, 1, 128, 256, 256, 256, 128]
    - [27, 0.161]
  - - [256, 128, 1, 256, 256, 256, 256, 128]
    - [27, 0.284]
  - - [256, 128, 1, 512, 256, 256, 256, 128]
    - [48, 0.462]
  - - [256, 128, 1, 1024, 256, 256, 256, 128]
    - [48, 0.665]
  - - [256, 128, 1, 2048, 256, 256, 256, 128]
    - [78, 1.074]
  - - [256, 128, 1, 4096, 256, 256, 256, 128]
    - [119, 1.763]
  - - [256, 128, 1, 8192, 256, 256, 256, 128]
    - [49, 2.557]
  - - [256, 256, 1, 128, 256, 256, 256, 256]
    - [27, 0.318]
  - - [256, 256, 1, 256, 256, 256, 256, 256]
    - [48, 0.553]
  - - [256, 256, 1, 512, 256, 256, 256, 256]
    - [27, 0.916]
  - - [256, 256, 1, 1024, 256, 256, 256, 256]
    - [134, 1.317]
  - - [256, 256, 1, 2048, 256, 256, 256, 256]
    - [79, 2.058]
  - - [256, 256, 1, 4096, 256, 256, 256, 256]
    - [119, 3.381]
  - - [256, 256, 1, 8192, 256, 256, 256, 256]
    - [49, 4.822]
  - - [256, 512, 1, 128, 256, 256, 256, 512]
    - [79, 0.627]
  - - [256, 512, 1, 256, 256, 256, 256, 512]
    - [28, 1.102]
  - - [256, 512, 1, 512, 256, 256, 256, 512]
    - [27, 1.795]
  - - [256, 512, 1, 1024, 256, 256, 256, 512]
    - [48, 2.59]
  - - [256, 512, 1, 2048, 256, 256, 256, 512]
    - [27, 3.808]
  - - [256, 512, 1, 4096, 256, 256, 256, 512]
    - [117, 5.872]
  - - [256, 512, 1, 8192, 256, 256, 256, 512]
    - [40, 8.299]
  - - [256, 1024, 1, 128, 256, 256, 256, 1024]
    - [5, 1.207]
  - - [256, 1024, 1, 256, 256, 256, 256, 1024]
    - [28, 2.098]
  - - [256, 1024, 1, 512, 256, 256, 256, 1024]
    - [48, 3.449]
  - - [256, 1024, 1, 1024, 256, 256, 256, 1024]
    - [49, 5.032]
  - - [256, 1024, 1, 2048, 256, 256, 256, 1024]
    - [44, 6.816]
  - - [256, 1024, 1, 4096, 256, 256, 256, 1024]
    - [20, 9.018]
  - - [256, 1024, 1, 8192, 256, 256, 256, 1024]
    - [39, 12.929]
  - - [256, 2048, 1, 128, 256, 256, 256, 2048]
    - [26, 2.272]
  - - [256, 2048, 1, 256, 256, 256, 256, 2048]
    - [25, 3.824]
  - - [256, 2048, 1, 512, 256, 256, 256, 2048]
    - [44, 6.435]
  - - [256, 2048, 1, 1024, 256, 256, 256, 2048]
    - [45, 8.836]
  - - [256, 2048, 1, 2048, 256, 256, 256, 2048]
    - [39, 10.545]
  - - [256, 2048, 1, 4096, 256, 256, 256, 2048]
    - [18, 13.628]
  - - [256, 2048, 1, 8192, 256, 256, 256, 2048]
    - [126, 16.29]
  - - [256, 4096, 1, 128, 256, 256, 256, 4096]
    - [110, 4.117]
  - - [256, 4096, 1, 256, 256, 256, 256, 4096]
    - [111, 7.092]
  - - [256, 4096, 1, 512, 256, 256, 256, 4096]
    - [114, 10.453]
  - - [256, 4096, 1, 1024, 256, 256, 256, 4096]
    - [129, 13.344]
  - - [256, 4096, 1, 2048, 256, 256, 256, 4096]
    - [129, 14.722]
  - - [256, 4096, 1, 4096, 256, 256, 256, 4096]
    - [99, 17.978]
  - - [256, 4096, 1, 8192, 256, 256, 256, 4096]
    - [122, 22.541]
  - - [256, 8192, 1, 128, 256, 256, 256, 8192]
    - [73, 6.816]
  - - [256, 8192, 1, 256, 256, 256, 256, 8192]
    - [106, 10.416]
  - - [256, 8192, 1, 512, 256, 256, 256, 8192]
    - [104, 14.583]
  - - [256, 8192, 1, 1024, 256, 256, 256, 8192]
    - [121, 18.073]
  - - [256, 8192, 1, 2048, 256, 256, 256, 8192]
    - [108, 19.009]
  - - [256, 8192, 1, 4096, 256, 256, 256, 8192]
    - [33, 23.423]
  - - [256, 8192, 1, 8192, 256, 256, 256, 8192]
    - [3, 24.774]
  - - [512, 128, 1, 128, 512, 512, 512, 128]
    - [5, 0.317]
  - - [512, 128, 1, 256, 512, 512, 512, 128]
    - [28, 0.561]
  - - [512, 128, 1, 512, 512, 512, 512, 128]
    - [28, 0.908]
  - - [512, 128, 1, 1024, 512, 512, 512, 128]
    - [134, 1.326]
  - - [512, 128, 1, 2048, 512, 512, 512, 128]
    - [133, 2.016]
  - - [512, 128, 1, 4096, 512, 512, 512, 128]
    - [120, 3.384]
  - - [512, 128, 1, 8192, 512, 512, 512, 128]
    - [48, 4.792]
  - - [512, 256, 1, 128, 512, 512, 512, 256]
    - [78, 0.633]
  - - [512, 256, 1, 256, 512, 512, 512, 256]
    - [27, 1.113]
  - - [512, 256, 1, 512, 512, 512, 512, 256]
    - [119, 1.73]
  - - [512, 256, 1, 1024, 512, 512, 512, 256]
    - [134, 2.594]
  - - [512, 256, 1, 2048, 512, 512, 512, 256]
    - [48, 3.778]
  - - [512, 256, 1, 4096, 512, 512, 512, 256]
    - [116, 5.856]
  - - [512, 256, 1, 8192, 512, 512, 512, 256]
    - [46, 8.42]
  - - [512, 512, 1, 128, 512, 512, 512, 512]
    - [6, 1.211]
  - - [512, 512, 1, 256, 512, 512, 512, 512]
    - [27, 2.038]
  - - [512, 512, 1, 512, 512, 512, 512, 512]
    - [28, 3.463]
  - - [512, 512, 1, 1024, 512, 512, 512, 512]
    - [49, 5.031]
  - - [512, 512, 1, 2048, 512, 512, 512, 512]
    - [41, 6.782]
  - - [512, 512, 1, 4096, 512, 512, 512, 512]
    - [113, 9.275]
  - - [512, 512, 1, 8192, 512, 512, 512, 512]
    - [39, 12.924]
  - - [512, 1024, 1, 128, 512, 512, 512, 1024]
    - [131, 2.214]
  - - [512, 1024, 1, 256, 512, 512, 512, 1024]
    - [117, 3.928]
  - - [512, 1024, 1, 512, 512, 512, 512, 1024]
    - [44, 6.366]
  - - [512, 1024, 1, 1024, 512, 512, 512, 1024]
    - [131, 8.761]
  - - [512, 1024, 1, 2048, 512, 512, 512, 1024]
    - [37, 10.567]
  - - [512, 1024, 1, 4096, 512, 512, 512, 1024]
    - [39, 13.66]
  - - [512, 1024, 1, 8192, 512, 512, 512, 1024]
    - [36, 17.307]
  - - [512, 2048, 1, 128, 512, 512, 512, 2048]
    - [20, 4.106]
  - - [512, 2048, 1, 256, 512, 512, 512, 2048]
    - [4, 6.741]
  - - [512, 2048, 1, 512, 512, 512, 512, 2048]
    - [110, 10.6]
  - - [512, 2048, 1, 1024, 512, 512, 512, 2048]
    - [129, 13.337]
  - - [512, 2048, 1, 2048, 512, 512, 512, 2048]
    - [36, 14.937]
  - - [512, 2048, 1, 4096, 512, 512, 512, 2048]
    - [99, 18.15]
  - - [512, 2048, 1, 8192, 512, 512, 512, 2048]
    - [122, 22.47]
  - - [512, 4096, 1, 128, 512, 512, 512, 4096]
    - [74, 6.75]
  - - [512, 4096, 1, 256, 512, 512, 512, 4096]
    - [75, 10.349]
  - - [512, 4096, 1, 512, 512, 512, 512, 4096]
    - [108, 14.732]
  - - [512, 4096, 1, 1024, 512, 512, 512, 4096]
    - [128, 18.062]
  - - [512, 4096, 1, 2048, 512, 512, 512, 4096]
    - [106, 19.261]
  - - [512, 4096, 1, 4096, 512, 512, 512, 4096]
    - [33, 23.906]
  - - [512, 4096, 1, 8192, 512, 512, 512, 4096]
    - [96, 23.734]
  - - [512, 8192, 1, 128, 512, 512, 512, 8192]
    - [98, 9.225]
  - - [512, 8192, 1, 256, 512, 512, 512, 8192]
    - [98, 14.347]
  - - [512, 8192, 1, 512, 512, 512, 512, 8192]
    - [101, 19.84]
  - - [512, 8192, 1, 1024, 512, 512, 512, 8192]
    - [101, 23.012]
  - - [512, 8192, 1, 2048, 512, 512, 512, 8192]
    - [32, 26.439]
  - - [512, 8192, 1, 4096, 512, 512, 512, 8192]
    - [125, 28.951]
  - - [512, 8192, 1, 8192, 512, 512, 512, 8192]
    - [12, 27.311]
  - - [1024, 128, 1, 128, 1024, 1024, 1024, 128]
    - [28, 0.63]
  - - [1024, 128, 1, 256, 1024, 1024, 1024, 128]
    - [28, 1.118]
  - - [1024, 128, 1, 512, 1024, 1024, 1024, 128]
    - [119, 1.763]
  - - [1024, 128, 1, 1024, 1024, 1024, 1024, 128]
    - [134, 2.597]
  - - [1024, 128, 1, 2048, 1024, 1024, 1024, 128]
    - [27, 3.795]
  - - [1024, 128, 1, 4096, 1024, 1024, 1024, 128]
    - [116, 5.8]
  - - [1024, 128, 1, 8192, 1024, 1024, 1024, 128]
    - [44, 7.983]
  - - [1024, 256, 1, 128, 1024, 1024, 1024, 256]
    - [78, 1.209]
  - - [1024, 256, 1, 256, 1024, 1024, 1024, 256]
    - [28, 2.134]
  - - [1024, 256, 1, 512, 1024, 1024, 1024, 256]
    - [27, 3.482]
  - - [1024, 256, 1, 1024, 1024, 1024, 1024, 256]
    - [27, 5.04]
  - - [1024, 256, 1, 2048, 1024, 1024, 1024, 256]
    - [47, 6.79]
  - - [1024, 256, 1, 4096, 1024, 1024, 1024, 256]
    - [24, 8.957]
  - - [1024, 256, 1, 8192, 1024, 1024, 1024, 256]
    - [37, 12.967]
  - - [1024, 512, 1, 128, 1024, 1024, 1024, 512]
    - [26, 2.3]
  - - [1024, 512, 1, 256, 1024, 1024, 1024, 512]
    - [26, 3.979]
  - - [1024, 512, 1, 512, 1024, 1024, 1024, 512]
    - [131, 6.373]
  - - [1024, 512, 1, 1024, 1024, 1024, 1024, 512]
    - [43, 8.834]
  - - [1024, 512, 1, 2048, 1024, 1024, 1024, 512]
    - [38, 10.732]
  - - [1024, 512, 1, 4096, 1024, 1024, 1024, 512]
    - [18, 13.62]
  - - [1024, 512, 1, 8192, 1024, 1024, 1024, 512]
    - [35, 16.675]
  - - [1024, 1024, 1, 128, 1024, 1024, 1024, 1024]
    - [20, 4.11]
  - - [1024, 1024, 1, 256, 1024, 1024, 1024, 1024]
    - [19, 7.135]
  - - [1024, 1024, 1, 512, 1024, 1024, 1024, 1024]
    - [21, 10.507]
  - - [1024, 1024, 1, 1024, 1024, 1024, 1024, 1024]
    - [39, 13.22]
  - - [1024, 1024, 1, 2048, 1024, 1024, 1024, 1024]
    - [36, 15.246]
  - - [1024, 1024, 1, 4096, 1024, 1024, 1024, 1024]
    - [14, 17.746]
  - - [1024, 1024, 1, 8192, 1024, 1024, 1024, 1024]
    - [30, 22.511]
  - - [1024, 2048, 1, 128, 1024, 1024, 1024, 2048]
    - [74, 6.647]
  - - [1024, 2048, 1, 256, 1024, 1024, 1024, 2048]
    - [106, 10.396]
  - - [1024, 2048, 1, 512, 1024, 1024, 1024, 2048]
    - [108, 14.541]
  - - [1024, 2048, 1, 1024, 1024, 1024, 1024, 2048]
    - [126, 17.159]
  - - [1024, 2048, 1, 2048, 1024, 1024, 1024, 2048]
    - [32, 19.562]
  - - [1024, 2048, 1, 4096, 1024, 1024, 1024, 2048]
    - [30, 23.952]
  - - [1024, 2048, 1, 8192, 1024, 1024, 1024, 2048]
    - [65, 23.863]
  - - [1024, 4096, 1, 128, 1024, 1024, 1024, 4096]
    - [71, 9.462]
  - - [1024, 4096, 1, 256, 1024, 1024, 1024, 4096]
    - [98, 14.476]
  - - [1024, 4096, 1, 512, 1024, 1024, 1024, 4096]
    - [99, 19.98]
  - - [1024, 4096, 1, 1024, 1024, 1024, 1024, 4096]
    - [15, 22.81]
  - - [1024, 4096, 1, 2048, 1024, 1024, 1024, 4096]
    - [121, 25.752]
  - - [1024, 4096, 1, 4096, 1024, 1024, 1024, 4096]
    - [125, 28.948]
  - - [1024, 4096, 1, 8192, 1024, 1024, 1024, 4096]
    - [91, 26.628]
  - - [1024, 8192, 1, 128, 1024, 1024, 1024, 8192]
    - [69, 12.841]
  - - [1024, 8192, 1, 256, 1024, 1024, 1024, 8192]
    - [69, 18.501]
  - - [1024, 8192, 1, 512, 1024, 1024, 1024, 8192]
    - [1, 22.299]
  - - [1024, 8192, 1, 1024, 1024, 1024, 1024, 8192]
    - [11, 26.679]
  - - [1024, 8192, 1, 2048, 1024, 1024, 1024, 8192]
    - [13, 30.641]
  - - [1024, 8192, 1, 4096, 1024, 1024, 1024, 8192]
    - [85, 27.485]
  - - [1024, 8192, 1, 8192, 1024, 1024, 1024, 8192]
    - [80, 30.758]
  - - [2048, 128, 1, 128, 2048, 2048, 2048, 128]
    - [28, 1.208]
  - - [2048, 128, 1, 256, 2048, 2048, 2048, 128]
    - [28, 2.142]
  - - [2048, 128, 1, 512, 2048, 2048, 2048, 128]
    - [27, 3.478]
  - - [2048, 128, 1, 1024, 2048, 2048, 2048, 128]
    - [49, 5.045]
  - - [2048, 128, 1, 2048, 2048, 2048, 2048, 128]
    - [44, 6.794]
  - - [2048, 128, 1, 4096, 2048, 2048, 2048, 128]
    - [22, 9.316]
  - - [2048, 128, 1, 8192, 2048, 2048, 2048, 128]
    - [37, 11.751]
  - - [2048, 256, 1, 128, 2048, 2048, 2048, 256]
    - [26, 2.269]
  - - [2048, 256, 1, 256, 2048, 2048, 2048, 256]
    - [117, 4.016]
  - - [2048, 256, 1, 512, 2048, 2048, 2048, 256]
    - [131, 6.353]
  - - [2048, 256, 1, 1024, 2048, 2048, 2048, 256]
    - [44, 8.688]
  - - [2048, 256, 1, 2048, 2048, 2048, 2048, 256]
    - [37, 10.702]
  - - [2048, 256, 1, 4096, 2048, 2048, 2048, 256]
    - [16, 13.075]
  - - [2048, 256, 1, 8192, 2048, 2048, 2048, 256]
    - [35, 16.359]
  - - [2048, 512, 1, 128, 2048, 2048, 2048, 512]
    - [111, 4.152]
  - - [2048, 512, 1, 256, 2048, 2048, 2048, 512]
    - [20, 7.144]
  - - [2048, 512, 1, 512, 2048, 2048, 2048, 512]
    - [19, 10.613]
  - - [2048, 512, 1, 1024, 2048, 2048, 2048, 512]
    - [112, 13.273]
  - - [2048, 512, 1, 2048, 2048, 2048, 2048, 512]
    - [34, 14.926]
  - - [2048, 512, 1, 4096, 2048, 2048, 2048, 512]
    - [103, 18.265]
  - - [2048, 512, 1, 8192, 2048, 2048, 2048, 512]
    - [124, 22.467]
  - - [2048, 1024, 1, 128, 2048, 2048, 2048, 1024]
    - [74, 6.721]
  - - [2048, 1024, 1, 256, 2048, 2048, 2048, 1024]
    - [106, 10.427]
  - - [2048, 1024, 1, 512, 2048, 2048, 2048, 1024]
    - [106, 14.702]
  - - [2048, 1024, 1, 1024, 2048, 2048, 2048, 1024]
    - [17, 17.025]
  - - [2048, 1024, 1, 2048, 2048, 2048, 2048, 1024]
    - [15, 19.294]
  - - [2048, 1024, 1, 4096, 2048, 2048, 2048, 1024]
    - [29, 23.84]
  - - [2048, 1024, 1, 8192, 2048, 2048, 2048, 1024]
    - [94, 23.548]
  - - [2048, 2048, 1, 128, 2048, 2048, 2048, 2048]
    - [71, 9.313]
  - - [2048, 2048, 1, 256, 2048, 2048, 2048, 2048]
    - [98, 14.481]
  - - [2048, 2048, 1, 512, 2048, 2048, 2048, 2048]
    - [101, 19.655]
  - - [2048, 2048, 1, 1024, 2048, 2048, 2048, 2048]
    - [101, 22.377]
  - - [2048, 2048, 1, 2048, 2048, 2048, 2048, 2048]
    - [123, 25.62]
  - - [2048, 2048, 1, 4096, 2048, 2048, 2048, 2048]
    - [124, 28.556]
  - - [2048, 2048, 1, 8192, 2048, 2048, 2048, 2048]
    - [55, 26.325]
  - - [2048, 4096, 1, 128, 2048, 2048, 2048, 4096]
    - [68, 12.757]
  - - [2048, 4096, 1, 256, 2048, 2048, 2048, 4096]
    - [2, 17.917]
  - - [2048, 4096, 1, 512, 2048, 2048, 2048, 4096]
    - [2, 21.733]
  - - [2048, 4096, 1, 1024, 2048, 2048, 2048, 4096]
    - [65, 26.362]
  - - [2048, 4096, 1, 2048, 2048, 2048, 2048, 4096]
    - [93, 30.39]
  - - [2048, 4096, 1, 4096, 2048, 2048, 2048, 4096]
    - [85, 26.928]
  - - [2048, 4096, 1, 8192, 2048, 2048, 2048, 4096]
    - [53, 30.586]
  - - [2048, 8192, 1, 128, 2048, 2048, 2048, 8192]
    - [61, 12.753]
  - - [2048, 8192, 1, 256, 2048, 2048, 2048, 8192]
    - [54, 19.044]
  - - [2048, 8192, 1, 512, 2048, 2048, 2048, 8192]
    - [52, 25.064]
  - - [2048, 8192, 1, 1024, 2048, 2048, 2048, 8192]
    - [52, 30.805]
  - - [2048, 8192, 1, 2048, 2048, 2048, 2048, 8192]
    - [83, 31.782]
  - - [2048, 8192, 1, 4096, 2048, 2048, 2048, 8192]
    - [63, 30.073]
  - - [2048, 8192, 1, 8192, 2048, 2048, 2048, 8192]
    - [7, 32.063]
  - - [4096, 128, 1, 128, 4096, 4096, 4096, 128]
    - [117, 2.331]
  - - [4096, 128, 1, 256, 4096, 4096, 4096, 128]
    - [117, 4.041]
  - - [4096, 128, 1, 512, 4096, 4096, 4096, 128]
    - [131, 6.427]
  - - [4096, 128, 1, 1024, 4096, 4096, 4096, 128]
    - [115, 8.641]
  - - [4096, 128, 1, 2048, 4096, 4096, 4096, 128]
    - [23, 9.962]
  - - [4096, 128, 1, 4096, 4096, 4096, 4096, 128]
    - [109, 13.026]
  - - [4096, 128, 1, 8192, 4096, 4096, 4096, 128]
    - [35, 15.804]
  - - [4096, 256, 1, 128, 4096, 4096, 4096, 256]
    - [20, 4.143]
  - - [4096, 256, 1, 256, 4096, 4096, 4096, 256]
    - [20, 7.136]
  - - [4096, 256, 1, 512, 4096, 4096, 4096, 256]
    - [20, 10.624]
  - - [4096, 256, 1, 1024, 4096, 4096, 4096, 256]
    - [130, 13.16]
  - - [4096, 256, 1, 2048, 4096, 4096, 4096, 256]
    - [37, 14.19]
  - - [4096, 256, 1, 4096, 4096, 4096, 4096, 256]
    - [103, 18.015]
  - - [4096, 256, 1, 8192, 4096, 4096, 4096, 256]
    - [124, 22.187]
  - - [4096, 512, 1, 128, 4096, 4096, 4096, 512]
    - [75, 6.744]
  - - [4096, 512, 1, 256, 4096, 4096, 4096, 512]
    - [105, 10.48]
  - - [4096, 512, 1, 512, 4096, 4096, 4096, 512]
    - [108, 14.516]
  - - [4096, 512, 1, 1024, 4096, 4096, 4096, 512]
    - [127, 17.766]
  - - [4096, 512, 1, 2048, 4096, 4096, 4096, 512]
    - [128, 19.079]
  - - [4096, 512, 1, 4096, 4096, 4096, 4096, 512]
    - [122, 23.337]
  - - [4096, 512, 1, 8192, 4096, 4096, 4096, 512]
    - [95, 23.676]
  - - [4096, 1024, 1, 128, 4096, 4096, 4096, 1024]
    - [72, 9.306]
  - - [4096, 1024, 1, 256, 4096, 4096, 4096, 1024]
    - [102, 14.309]
  - - [4096, 1024, 1, 512, 4096, 4096, 4096, 1024]
    - [101, 19.848]
  - - [4096, 1024, 1, 1024, 4096, 4096, 4096, 1024]
    - [101, 22.346]
  - - [4096, 1024, 1, 2048, 4096, 4096, 4096, 1024]
    - [124, 25.673]
  - - [4096, 1024, 1, 4096, 4096, 4096, 4096, 1024]
    - [122, 28.614]
  - - [4096, 1024, 1, 8192, 4096, 4096, 4096, 1024]
    - [56, 26.624]
  - - [4096, 2048, 1, 128, 4096, 4096, 4096, 2048]
    - [70, 12.38]
  - - [4096, 2048, 1, 256, 4096, 4096, 4096, 2048]
    - [70, 17.844]
  - - [4096, 2048, 1, 512, 4096, 4096, 4096, 2048]
    - [97, 21.79]
  - - [4096, 2048, 1, 1024, 4096, 4096, 4096, 2048]
    - [65, 26.126]
  - - [4096, 2048, 1, 2048, 4096, 4096, 4096, 2048]
    - [90, 29.87]
  - - [4096, 2048, 1, 4096, 4096, 4096, 4096, 2048]
    - [80, 27.183]
  - - [4096, 2048, 1, 8192, 4096, 4096, 4096, 2048]
    - [87, 30.417]
  - - [4096, 4096, 1, 128, 4096, 4096, 4096, 4096]
    - [0, 12.677]
  - - [4096, 4096, 1, 256, 4096, 4096, 4096, 4096]
    - [60, 18.859]
  - - [4096, 4096, 1, 512, 4096, 4096, 4096, 4096]
    - [60, 25.101]
  - - [4096, 4096, 1, 1024, 4096, 4096, 4096, 4096]
    - [62, 31.063]
  - - [4096, 4096, 1, 2048, 4096, 4096, 4096, 4096]
    - [84, 31.428]
  - - [4096, 4096, 1, 4096, 4096, 4096, 4096, 4096]
    - [53, 30.488]
  - - [4096, 4096, 1, 8192, 4096, 4096, 4096, 4096]
    - [82, 32.798]
  - - [4096, 8192, 1, 128, 4096, 4096, 4096, 8192]
    - [8, 13.122]
  - - [4096, 8192, 1, 256, 4096, 4096, 4096, 8192]
    - [89, 17.123]
  - - [4096, 8192, 1, 512, 4096, 4096, 4096, 8192]
    - [64, 21.728]
  - - [4096, 8192, 1, 1024, 4096, 4096, 4096, 8192]
    - [80, 26.241]
  - - [4096, 8192, 1, 2048, 4096, 4096, 4096, 8192]
    - [82, 30.034]
  - - [4096, 8192, 1, 4096, 4096, 4096, 4096, 8192]
    - [81, 32.186]
  - - [4096, 8192, 1, 8192, 4096, 4096, 4096, 8192]
    - [63, 35.039]
  - - [8192, 128, 1, 128, 8192, 8192, 8192, 128]
    - [20, 4.087]
  - - [8192, 128, 1, 256, 8192, 8192, 8192, 128]
    - [38, 6.835]
  - - [8192, 128, 1, 512, 8192, 8192, 8192, 128]
    - [114, 10.211]
  - - [8192, 128, 1, 1024, 8192, 8192, 8192, 128]
    - [130, 13.096]
  - - [8192, 128, 1, 2048, 8192, 8192, 8192, 128]
    - [37, 13.859]
  - - [8192, 128, 1, 4096, 8192, 8192, 8192, 128]
    - [99, 16.786]
  - - [8192, 128, 1, 8192, 8192, 8192, 8192, 128]
    - [122, 20.458]
  - - [8192, 256, 1, 128, 8192, 8192, 8192, 256]
    - [76, 6.69]
  - - [8192, 256, 1, 256, 8192, 8192, 8192, 256]
    - [107, 10.313]
  - - [8192, 256, 1, 512, 8192, 8192, 8192, 256]
    - [108, 14.635]
  - - [8192, 256, 1, 1024, 8192, 8192, 8192, 256]
    - [124, 17.898]
  - - [8192, 256, 1, 2048, 8192, 8192, 8192, 256]
    - [109, 18.787]
  - - [8192, 256, 1, 4096, 8192, 8192, 8192, 256]
    - [122, 22.81]
  - - [8192, 256, 1, 8192, 8192, 8192, 8192, 256]
    - [65, 24.352]
  - - [8192, 512, 1, 128, 8192, 8192, 8192, 512]
    - [72, 9.401]
  - - [8192, 512, 1, 256, 8192, 8192, 8192, 512]
    - [100, 14.317]
  - - [8192, 512, 1, 512, 8192, 8192, 8192, 512]
    - [101, 19.775]
  - - [8192, 512, 1, 1024, 8192, 8192, 8192, 512]
    - [101, 23.136]
  - - [8192, 512, 1, 2048, 8192, 8192, 8192, 512]
    - [124, 26.179]
  - - [8192, 512, 1, 4096, 8192, 8192, 8192, 512]
    - [123, 28.283]
  - - [8192, 512, 1, 8192, 8192, 8192, 8192, 512]
    - [10, 27.436]
  - - [8192, 1024, 1, 128, 8192, 8192, 8192, 1024]
    - [66, 11.915]
  - - [8192, 1024, 1, 256, 8192, 8192, 8192, 1024]
    - [66, 17.391]
  - - [8192, 1024, 1, 512, 8192, 8192, 8192, 1024]
    - [65, 22.167]
  - - [8192, 1024, 1, 1024, 8192, 8192, 8192, 1024]
    - [67, 25.863]
  - - [8192, 1024, 1, 2048, 8192, 8192, 8192, 1024]
    - [95, 30.123]
  - - [8192, 1024, 1, 4096, 8192, 8192, 8192, 1024]
    - [84, 27.55]
  - - [8192, 1024, 1, 8192, 8192, 8192, 8192, 1024]
    - [59, 30.377]
  - - [8192, 2048, 1, 128, 8192, 8192, 8192, 2048]
    - [57, 12.571]
  - - [8192, 2048, 1, 256, 8192, 8192, 8192, 2048]
    - [60, 18.748]
  - - [8192, 2048, 1, 512, 8192, 8192, 8192, 2048]
    - [60, 25.024]
  - - [8192, 2048, 1, 1024, 8192, 8192, 8192, 2048]
    - [60, 30.787]
  - - [8192, 2048, 1, 2048, 8192, 8192, 8192, 2048]
    - [86, 31.668]
  - - [8192, 2048, 1, 4096, 8192, 8192, 8192, 2048]
    - [63, 30.037]
  - - [8192, 2048, 1, 8192, 8192, 8192, 8192, 2048]
    - [53, 33.389]
  - - [8192, 4096, 1, 128, 8192, 8192, 8192, 4096]
    - [88, 12.811]
  - - [8192, 4096, 1, 256, 8192, 8192, 8192, 4096]
    - [92, 16.957]
  - - [8192, 4096, 1, 512, 8192, 8192, 8192, 4096]
    - [65, 21.37]
  - - [8192, 4096, 1, 1024, 8192, 8192, 8192, 4096]
    - [53, 26.599]
  - - [8192, 4096, 1, 2048, 8192, 8192, 8192, 4096]
    - [53, 30.088]
  - - [8192, 4096, 1, 4096, 8192, 8192, 8192, 4096]
    - [81, 33.175]
  - - [8192, 4096, 1, 8192, 8192, 8192, 8192, 4096]
    - [59, 34.817]
  - - [8192, 8192, 1, 128, 8192, 8192, 8192, 8192]
    - [9, 12.85]
  - - [8192, 8192, 1, 256, 8192, 8192, 8192, 8192]
    - [85, 17.146]
  - - [8192, 8192, 1, 512, 8192, 8192, 8192, 8192]
    - [56, 21.556]
  - - [8192, 8192, 1, 1024, 8192, 8192, 8192, 8192]
    - [59, 27.636]
  - - [8192, 8192, 1, 2048, 8192, 8192, 8192, 8192]
    - [58, 32.954]
  - - [8192, 8192, 1, 4096, 8192, 8192, 8192, 8192]
    - [85, 35.394]
  - - [8192, 8192, 1, 8192, 8192, 8192, 8192, 8192]
    - [59, 36.272]
  - - [1, 1, 1, 32, 1, 1, 1, 1]
    - [135, 0.0]
- null
- null
- ExperimentalStreamK
- GridBased
