library/src/amd_detail/rocblaslt/src/Tensile/Logic/asm_full/aquavanjaram/gfx942/StreamK/aquavanjaram942_Cijk_Alik_Bljk_HHS_BH_UserArgs.yaml
- {MinimumRequiredVersion: 4.33.0}
- aquavanjaram942
- gfx942
- [Device 0049, Device 0050]
    SolutionIndex: 0
    SolutionNameMin: Cijk_Alik_Bljk_HHS_BH_UserArgs_MT256x64x64_MI16x16x1_SN_LDSB1_CLR1_GSU0_GSUC0_GSUWGMRR0_K1_LBSPPA128_LBSPPB128_MIWT8_2_PLR1_SU32_SUM0_SUS256_SKXCCM0_VWA1_VWB1_WGM8_WGMXCC1_WGMXCCGn1
    SolutionIndex: 1
    SolutionNameMin: Cijk_Alik_Bljk_HHS_BH_UserArgs_MT128x128x64_MI16x16x1_SN_LDSB1_CLR1_GSU0_GSUC0_GSUWGMRR0_K1_LBSPPA512_LBSPPB128_MIWT4_4_PLR1_SU32_SUM0_SUS256_SKXCCM0_VWA4_VWB1_WGM1_WGMXCC1_WGMXCCGn1
    SolutionIndex: 2
    SolutionNameMin: Cijk_Alik_Bljk_HHS_BH_UserArgs_MT128x128x64_MI16x16x1_SN_LDSB1_CLR1_GSU0_GSUC0_GSUWGMRR0_K1_LBSPPA128_LBSPPB256_MIWT4_4_PLR1_SU32_SUM0_SUS256_SKXCCM0_VWA1_VWB2_WGM1_WGMXCC1_WGMXCCGn1
    SolutionIndex: 3
    SolutionNameMin: Cijk_Alik_Bljk_HHS_BH_UserArgs_MT128x128x64_MI16x16x1_SN_LDSB1_CLR1_GSU0_GSUC0_GSUWGMRR0_K1_LBSPPA256_LBSPPB256_MIWT4_4_PLR1_SU32_SUM0_SUS256_SKXCCM0_VWA2_VWB2_WGM1_WGMXCC1_WGMXCCGn1
    SolutionIndex: 4
    SolutionNameMin: Cijk_Alik_Bljk_HHS_BH_UserArgs_MT128x128x64_MI16x16x1_SN_LDSB1_CLR1_GSU0_GSUC0_GSUWGMRR0_K1_LBSPPA512_LBSPPB256_MIWT4_4_PLR1_SU32_SUM0_SUS256_SKXCCM0_VWA4_VWB2_WGM1_WGMXCC1_WGMXCCGn1
    SolutionIndex: 5
    SolutionNameMin: Cijk_Alik_Bljk_HHS_BH_UserArgs_MT128x128x64_MI16x16x1_SN_LDSB1_CLR1_GSU0_GSUC0_GSUWGMRR0_K1_LBSPPA256_LBSPPB512_MIWT4_4_PLR1_SU32_SUM0_SUS256_SKXCCM0_VWA2_VWB4_WGM1_WGMXCC1_WGMXCCGn1
    SolutionIndex: 6
    SolutionNameMin: Cijk_Alik_Bljk_HHS_BH_UserArgs_MT128x128x64_MI16x16x1_SN_LDSB1_CLR1_GSU0_GSUC0_GSUWGMRR0_K1_LBSPPA256_LBSPPB128_MIWT4_4_PLR1_SU32_SUM0_SUS256_SKXCCM0_VWA2_VWB1_WGM8_WGMXCC1_WGMXCCGn1
    SolutionIndex: 7
    SolutionNameMin: Cijk_Alik_Bljk_HHS_BH_UserArgs_MT128x128x64_MI16x16x1_SN_LDSB1_CLR1_GSU0_GSUC0_GSUWGMRR0_K1_LBSPPA512_LBSPPB256_MIWT4_4_PLR1_SU32_SUM0_SUS256_SKXCCM0_VWA4_VWB2_WGM8_WGMXCC1_WGMXCCGn1
    SolutionIndex: 8
    SolutionNameMin: Cijk_Alik_Bljk_HHS_BH_UserArgs_MT64x128x64_MI16x16x1_SN_LDSB1_CLR1_GSU0_GSUC0_GSUWGMRR0_K1_LBSPPA256_LBSPPB512_MIWT2_4_PLR1_SU32_SUM0_SUS256_SKXCCM0_VWA2_VWB4_WGM4_WGMXCC1_WGMXCCGn1
    SolutionIndex: 9
    SolutionNameMin: Cijk_Alik_Bljk_HHS_BH_UserArgs_MT128x64x64_MI16x16x1_SN_LDSB1_CLR1_GSU0_GSUC0_GSUWGMRR0_K1_LBSPPA256_LBSPPB128_MIWT4_2_PLR1_SU32_SUM0_SUS256_SKXCCM0_VWA2_VWB1_WGM1_WGMXCC1_WGMXCCGn1
    SolutionIndex: 10
    SolutionNameMin: Cijk_Alik_Bljk_HHS_BH_UserArgs_MT128x64x64_MI16x16x1_SN_LDSB1_CLR1_GSU0_GSUC0_GSUWGMRR0_K1_LBSPPA512_LBSPPB128_MIWT4_2_PLR1_SU32_SUM0_SUS256_SKXCCM0_VWA4_VWB1_WGM1_WGMXCC1_WGMXCCGn1
    SolutionIndex: 11
    SolutionNameMin: Cijk_Alik_Bljk_HHS_BH_UserArgs_MT64x64x64_MI16x16x1_SN_LDSB1_CLR1_GSU0_GSUC0_GSUWGMRR0_K1_LBSPPA256_LBSPPB128_MIWT2_2_PLR1_SU32_SUM0_SUS256_SKXCCM0_VWA2_VWB1_WGM1_WGMXCC1_WGMXCCGn1
    SolutionIndex: 12
    SolutionNameMin: Cijk_Alik_Bljk_HHS_BH_UserArgs_MT64x64x64_MI16x16x1_SN_LDSB1_CLR1_GSU0_GSUC0_GSUWGMRR0_K1_LBSPPA256_LBSPPB256_MIWT2_2_PLR1_SU32_SUM0_SUS256_SKXCCM0_VWA2_VWB2_WGM1_WGMXCC1_WGMXCCGn1
    SolutionIndex: 13
    SolutionNameMin: Cijk_Alik_Bljk_HHS_BH_UserArgs_MT64x64x64_MI16x16x1_SN_LDSB1_CLR1_GSU0_GSUC0_GSUWGMRR0_K1_LBSPPA256_LBSPPB128_MIWT2_2_PLR2_SU32_SUM0_SUS256_SKXCCM0_VWA2_VWB1_WGM1_WGMXCC1_WGMXCCGn1
    SolutionIndex: 14
    SolutionNameMin: Cijk_Alik_Bljk_HHS_BH_UserArgs_MT64x64x64_MI16x16x1_SN_LDSB1_CLR1_GSU0_GSUC0_GSUWGMRR0_K1_LBSPPA256_LBSPPB128_MIWT2_2_PLR1_SU32_SUM0_SUS256_SKXCCM0_VWA2_VWB1_WGM4_WGMXCC1_WGMXCCGn1
    SolutionIndex: 15
    SolutionNameMin: Cijk_Alik_Bljk_HHS_BH_UserArgs_MT32x64x64_MI16x16x1_SN_LDSB0_CLR1_GSU0_GSUC0_GSUWGMRR0_K1_LBSPPA128_LBSPPB128_MIWT1_2_PLR1_SU32_SUM0_SUS256_SKXCCM0_VWA1_VWB1_WGM1_WGMXCC1_WGMXCCGn1
    SolutionIndex: 16
    SolutionNameMin: Cijk_Alik_Bljk_HHS_BH_UserArgs_MT64x32x64_MI16x16x1_SN_LDSB0_CLR1_GSU0_GSUC0_GSUWGMRR0_K1_LBSPPA256_LBSPPB128_MIWT2_1_PLR1_SU32_SUM0_SUS256_SKXCCM0_VWA2_VWB1_WGM1_WGMXCC1_WGMXCCGn1
    SolutionIndex: 17
    SolutionNameMin: Cijk_Alik_Bljk_HHS_BH_UserArgs_MT32x32x64_MI16x16x1_SN_LDSB0_CLR1_GSU0_GSUC0_GSUWGMRR0_K1_LBSPPA128_LBSPPB128_MIWT1_1_PLR1_SU32_SUM0_SUS256_SKXCCM0_VWA1_VWB1_WGM1_WGMXCC1_WGMXCCGn1
    SolutionIndex: 18
    SolutionNameMin: Cijk_Alik_Bljk_HHS_BH_UserArgs_MT32x32x64_MI16x16x1_SN_LDSB0_CLR1_GSU0_GSUC0_GSUWGMRR0_K1_LBSPPA128_LBSPPB128_MIWT1_1_PLR1_SU32_SUM0_SUS256_SKXCCM0_VWA1_VWB1_WGM8_WGMXCC1_WGMXCCGn1
    SolutionIndex: 19
    SolutionNameMin: Cijk_Alik_Bljk_HHS_BH_UserArgs_MT64x64x128_MI16x16x1_SN_LDSB1_CLR1_GSU0_GSUC0_GSUWGMRR0_K1_LBSPPA512_LBSPPB256_MIWT2_2_PLR1_SU32_SUM0_SUS256_SKXCCM0_VWA2_VWB1_WGM1_WGMXCC1_WGMXCCGn1
    SolutionIndex: 20
    SolutionNameMin: Cijk_Alik_Bljk_HHS_BH_UserArgs_MT64x64x128_MI16x16x1_SN_LDSB1_CLR1_GSU0_GSUC0_GSUWGMRR0_K1_LBSPPA512_LBSPPB512_MIWT2_2_PLR1_SU32_SUM0_SUS256_SKXCCM0_VWA2_VWB2_WGM1_WGMXCC1_WGMXCCGn1
    SolutionIndex: 21
    SolutionNameMin: Cijk_Alik_Bljk_HHS_BH_UserArgs_MT64x64x128_MI16x16x1_SN_LDSB1_CLR1_GSU0_GSUC0_GSUWGMRR0_K1_LBSPPA512_LBSPPB256_MIWT2_2_PLR2_SU32_SUM0_SUS256_SKXCCM0_VWA2_VWB1_WGM1_WGMXCC1_WGMXCCGn1
    SolutionIndex: 22
    SolutionNameMin: Cijk_Alik_Bljk_HHS_BH_UserArgs_MT64x64x128_MI16x16x1_SN_LDSB1_CLR1_GSU0_GSUC0_GSUWGMRR0_K1_LBSPPA256_LBSPPB512_MIWT2_2_PLR2_SU32_SUM0_SUS256_SKXCCM0_VWA1_VWB2_WGM1_WGMXCC1_WGMXCCGn1
    SolutionIndex: 23
    SolutionNameMin: Cijk_Alik_Bljk_HHS_BH_UserArgs_MT64x64x128_MI16x16x1_SN_LDSB1_CLR1_GSU0_GSUC0_GSUWGMRR0_K1_LBSPPA512_LBSPPB512_MIWT2_2_PLR2_SU32_SUM0_SUS256_SKXCCM0_VWA2_VWB2_WGM1_WGMXCC1_WGMXCCGn1
    SolutionIndex: 24
    SolutionNameMin: Cijk_Alik_Bljk_HHS_BH_UserArgs_MT64x64x128_MI16x16x1_SN_LDSB1_CLR1_GSU0_GSUC0_GSUWGMRR0_K1_LBSPPA512_LBSPPB256_MIWT2_2_PLR1_SU32_SUM0_SUS256_SKXCCM0_VWA2_VWB1_WGM4_WGMXCC1_WGMXCCGn1
    SolutionIndex: 25
    SolutionNameMin: Cijk_Alik_Bljk_HHS_BH_UserArgs_MT64x64x128_MI16x16x1_SN_LDSB1_CLR1_GSU0_GSUC0_GSUWGMRR0_K1_LBSPPA256_LBSPPB256_MIWT2_2_PLR1_SU32_SUM0_SUS256_SKXCCM0_VWA1_VWB1_WGM8_WGMXCC1_WGMXCCGn1
    SolutionIndex: 26
    SolutionNameMin: Cijk_Alik_Bljk_HHS_BH_UserArgs_MT64x64x128_MI16x16x1_SN_LDSB1_CLR1_GSU0_GSUC0_GSUWGMRR0_K1_LBSPPA512_LBSPPB256_MIWT2_2_PLR1_SU32_SUM0_SUS256_SKXCCM0_VWA2_VWB1_WGM8_WGMXCC1_WGMXCCGn1
    SolutionIndex: 27
    SolutionNameMin: Cijk_Alik_Bljk_HHS_BH_UserArgs_MT64x64x128_MI16x16x1_SN_LDSB1_CLR1_GSU0_GSUC0_GSUWGMRR0_K1_LBSPPA512_LBSPPB512_MIWT2_2_PLR1_SU32_SUM0_SUS256_SKXCCM0_VWA2_VWB2_WGM8_WGMXCC1_WGMXCCGn1
    SolutionIndex: 28
    SolutionNameMin: Cijk_Alik_Bljk_HHS_BH_UserArgs_MT64x64x128_MI16x16x1_SN_LDSB1_CLR1_GSU0_GSUC0_GSUWGMRR0_K1_LBSPPA512_LBSPPB256_MIWT2_2_PLR2_SU32_SUM0_SUS256_SKXCCM0_VWA2_VWB1_WGM8_WGMXCC1_WGMXCCGn1
    SolutionIndex: 29
    SolutionNameMin: Cijk_Alik_Bljk_HHS_BH_UserArgs_MT32x64x128_MI16x16x1_SN_LDSB1_CLR1_GSU0_GSUC0_GSUWGMRR0_K1_LBSPPA256_LBSPPB512_MIWT1_2_PLR1_SU32_SUM0_SUS256_SKXCCM0_VWA1_VWB2_WGM1_WGMXCC1_WGMXCCGn1
    SolutionIndex: 30
    SolutionNameMin: Cijk_Alik_Bljk_HHS_BH_UserArgs_MT32x64x128_MI16x16x1_SN_LDSB1_CLR1_GSU0_GSUC0_GSUWGMRR0_K1_LBSPPA256_LBSPPB256_MIWT1_2_PLR2_SU32_SUM0_SUS256_SKXCCM0_VWA1_VWB1_WGM1_WGMXCC1_WGMXCCGn1
    SolutionIndex: 31
    SolutionNameMin: Cijk_Alik_Bljk_HHS_BH_UserArgs_MT32x64x128_MI16x16x1_SN_LDSB1_CLR1_GSU0_GSUC0_GSUWGMRR0_K1_LBSPPA256_LBSPPB512_MIWT1_2_PLR2_SU32_SUM0_SUS256_SKXCCM0_VWA1_VWB2_WGM1_WGMXCC1_WGMXCCGn1
    SolutionIndex: 32
    SolutionNameMin: Cijk_Alik_Bljk_HHS_BH_UserArgs_MT32x64x128_MI16x16x1_SN_LDSB1_CLR1_GSU0_GSUC0_GSUWGMRR0_K1_LBSPPA256_LBSPPB256_MIWT1_2_PLR1_SU32_SUM0_SUS256_SKXCCM0_VWA1_VWB1_WGM4_WGMXCC1_WGMXCCGn1
    SolutionIndex: 33
    SolutionNameMin: Cijk_Alik_Bljk_HHS_BH_UserArgs_MT32x64x128_MI16x16x1_SN_LDSB1_CLR1_GSU0_GSUC0_GSUWGMRR0_K1_LBSPPA256_LBSPPB512_MIWT1_2_PLR2_SU32_SUM0_SUS256_SKXCCM0_VWA1_VWB2_WGM4_WGMXCC1_WGMXCCGn1
    SolutionIndex: 34
    SolutionNameMin: Cijk_Alik_Bljk_HHS_BH_UserArgs_MT32x64x128_MI16x16x1_SN_LDSB1_CLR1_GSU0_GSUC0_GSUWGMRR0_K1_LBSPPA256_LBSPPB256_MIWT1_2_PLR2_SU32_SUM0_SUS256_SKXCCM0_VWA1_VWB1_WGM8_WGMXCC1_WGMXCCGn1
    SolutionIndex: 35
    SolutionNameMin: Cijk_Alik_Bljk_HHS_BH_UserArgs_MT64x32x128_MI16x16x1_SN_LDSB1_CLR1_GSU0_GSUC0_GSUWGMRR0_K1_LBSPPA512_LBSPPB256_MIWT2_1_PLR2_SU32_SUM0_SUS256_SKXCCM0_VWA2_VWB1_WGM1_WGMXCC1_WGMXCCGn1
    SolutionIndex: 36
    SolutionNameMin: Cijk_Alik_Bljk_HHS_BH_UserArgs_MT32x32x128_MI16x16x1_SN_LDSB1_CLR1_GSU0_GSUC0_GSUWGMRR0_K1_LBSPPA256_LBSPPB256_MIWT1_1_PLR1_SU32_SUM0_SUS256_SKXCCM0_VWA1_VWB1_WGM1_WGMXCC1_WGMXCCGn1
    SolutionIndex: 37
    SolutionNameMin: Cijk_Alik_Bljk_HHS_BH_UserArgs_MT32x32x128_MI16x16x1_SN_LDSB1_CLR1_GSU0_GSUC0_GSUWGMRR0_K1_LBSPPA256_LBSPPB256_MIWT1_1_PLR2_SU32_SUM0_SUS256_SKXCCM0_VWA1_VWB1_WGM1_WGMXCC1_WGMXCCGn1
    SolutionIndex: 38
    SolutionNameMin: Cijk_Alik_Bljk_HHS_BH_UserArgs_MT128x128x64_MI16x16x1_SN_LDSB1_CLR1_GSU0_GSUC0_GSUWGMRR0_K1_LBSPPA128_LBSPPB128_MIWT4_4_PLR1_SU32_SUM0_SUS256_SKXCCM8_VWA1_VWB1_WGM1_WGMXCC1_WGMXCCGn1
    SolutionIndex: 39
    SolutionNameMin: Cijk_Alik_Bljk_HHS_BH_UserArgs_MT128x128x64_MI16x16x1_SN_LDSB1_CLR1_GSU0_GSUC0_GSUWGMRR0_K1_LBSPPA256_LBSPPB128_MIWT4_4_PLR1_SU32_SUM0_SUS256_SKXCCM8_VWA2_VWB1_WGM1_WGMXCC1_WGMXCCGn1
    SolutionIndex: 40
    SolutionNameMin: Cijk_Alik_Bljk_HHS_BH_UserArgs_MT128x128x64_MI16x16x1_SN_LDSB1_CLR1_GSU0_GSUC0_GSUWGMRR0_K1_LBSPPA512_LBSPPB128_MIWT4_4_PLR1_SU32_SUM0_SUS256_SKXCCM8_VWA4_VWB1_WGM1_WGMXCC1_WGMXCCGn1
    SolutionIndex: 41
    SolutionNameMin: Cijk_Alik_Bljk_HHS_BH_UserArgs_MT128x128x64_MI16x16x1_SN_LDSB1_CLR1_GSU0_GSUC0_GSUWGMRR0_K1_LBSPPA256_LBSPPB256_MIWT4_4_PLR1_SU32_SUM0_SUS256_SKXCCM8_VWA2_VWB2_WGM1_WGMXCC1_WGMXCCGn1
    SolutionIndex: 42
    SolutionNameMin: Cijk_Alik_Bljk_HHS_BH_UserArgs_MT128x128x64_MI16x16x1_SN_LDSB1_CLR1_GSU0_GSUC0_GSUWGMRR0_K1_LBSPPA512_LBSPPB256_MIWT4_4_PLR1_SU32_SUM0_SUS256_SKXCCM8_VWA4_VWB2_WGM1_WGMXCC1_WGMXCCGn1
    SolutionIndex: 43
    SolutionNameMin: Cijk_Alik_Bljk_HHS_BH_UserArgs_MT128x128x64_MI16x16x1_SN_LDSB1_CLR1_GSU0_GSUC0_GSUWGMRR0_K1_LBSPPA256_LBSPPB512_MIWT4_4_PLR1_SU32_SUM0_SUS256_SKXCCM8_VWA2_VWB4_WGM1_WGMXCC1_WGMXCCGn1
    SolutionIndex: 44
    SolutionNameMin: Cijk_Alik_Bljk_HHS_BH_UserArgs_MT128x128x64_MI16x16x1_SN_LDSB1_CLR1_GSU0_GSUC0_GSUWGMRR0_K1_LBSPPA512_LBSPPB512_MIWT4_4_PLR1_SU32_SUM0_SUS256_SKXCCM8_VWA4_VWB4_WGM1_WGMXCC1_WGMXCCGn1
    SolutionIndex: 45
    SolutionNameMin: Cijk_Alik_Bljk_HHS_BH_UserArgs_MT128x128x64_MI16x16x1_SN_LDSB1_CLR1_GSU0_GSUC0_GSUWGMRR0_K1_LBSPPA256_LBSPPB128_MIWT4_4_PLR1_SU32_SUM0_SUS256_SKXCCM8_VWA2_VWB1_WGM4_WGMXCC1_WGMXCCGn1
    SolutionIndex: 46
    SolutionNameMin: Cijk_Alik_Bljk_HHS_BH_UserArgs_MT128x128x64_MI16x16x1_SN_LDSB1_CLR1_GSU0_GSUC0_GSUWGMRR0_K1_LBSPPA512_LBSPPB128_MIWT4_4_PLR1_SU32_SUM0_SUS256_SKXCCM8_VWA4_VWB1_WGM4_WGMXCC1_WGMXCCGn1
    SolutionIndex: 47
    SolutionNameMin: Cijk_Alik_Bljk_HHS_BH_UserArgs_MT128x128x64_MI16x16x1_SN_LDSB1_CLR1_GSU0_GSUC0_GSUWGMRR0_K1_LBSPPA256_LBSPPB256_MIWT4_4_PLR1_SU32_SUM0_SUS256_SKXCCM8_VWA2_VWB2_WGM4_WGMXCC1_WGMXCCGn1
    SolutionIndex: 48
    SolutionNameMin: Cijk_Alik_Bljk_HHS_BH_UserArgs_MT128x128x64_MI16x16x1_SN_LDSB1_CLR1_GSU0_GSUC0_GSUWGMRR0_K1_LBSPPA512_LBSPPB256_MIWT4_4_PLR1_SU32_SUM0_SUS256_SKXCCM8_VWA4_VWB2_WGM4_WGMXCC1_WGMXCCGn1
    SolutionIndex: 49
    SolutionNameMin: Cijk_Alik_Bljk_HHS_BH_UserArgs_MT128x128x64_MI16x16x1_SN_LDSB1_CLR1_GSU0_GSUC0_GSUWGMRR0_K1_LBSPPA256_LBSPPB512_MIWT4_4_PLR1_SU32_SUM0_SUS256_SKXCCM8_VWA2_VWB4_WGM4_WGMXCC1_WGMXCCGn1
    SolutionIndex: 50
    SolutionNameMin: Cijk_Alik_Bljk_HHS_BH_UserArgs_MT128x128x64_MI16x16x1_SN_LDSB1_CLR1_GSU0_GSUC0_GSUWGMRR0_K1_LBSPPA512_LBSPPB512_MIWT4_4_PLR1_SU32_SUM0_SUS256_SKXCCM8_VWA4_VWB4_WGM4_WGMXCC1_WGMXCCGn1
    SolutionIndex: 51
    SolutionNameMin: Cijk_Alik_Bljk_HHS_BH_UserArgs_MT128x128x64_MI16x16x1_SN_LDSB1_CLR1_GSU0_GSUC0_GSUWGMRR0_K1_LBSPPA128_LBSPPB128_MIWT4_4_PLR1_SU32_SUM0_SUS256_SKXCCM8_VWA1_VWB1_WGM8_WGMXCC1_WGMXCCGn1
    SolutionIndex: 52
    SolutionNameMin: Cijk_Alik_Bljk_HHS_BH_UserArgs_MT128x128x64_MI16x16x1_SN_LDSB1_CLR1_GSU0_GSUC0_GSUWGMRR0_K1_LBSPPA256_LBSPPB128_MIWT4_4_PLR1_SU32_SUM0_SUS256_SKXCCM8_VWA2_VWB1_WGM8_WGMXCC1_WGMXCCGn1
    SolutionIndex: 53
    SolutionNameMin: Cijk_Alik_Bljk_HHS_BH_UserArgs_MT128x128x64_MI16x16x1_SN_LDSB1_CLR1_GSU0_GSUC0_GSUWGMRR0_K1_LBSPPA512_LBSPPB128_MIWT4_4_PLR1_SU32_SUM0_SUS256_SKXCCM8_VWA4_VWB1_WGM8_WGMXCC1_WGMXCCGn1
    SolutionIndex: 54
    SolutionNameMin: Cijk_Alik_Bljk_HHS_BH_UserArgs_MT128x128x64_MI16x16x1_SN_LDSB1_CLR1_GSU0_GSUC0_GSUWGMRR0_K1_LBSPPA256_LBSPPB256_MIWT4_4_PLR1_SU32_SUM0_SUS256_SKXCCM8_VWA2_VWB2_WGM8_WGMXCC1_WGMXCCGn1
    SolutionIndex: 55
    SolutionNameMin: Cijk_Alik_Bljk_HHS_BH_UserArgs_MT128x128x64_MI16x16x1_SN_LDSB1_CLR1_GSU0_GSUC0_GSUWGMRR0_K1_LBSPPA512_LBSPPB256_MIWT4_4_PLR1_SU32_SUM0_SUS256_SKXCCM8_VWA4_VWB2_WGM8_WGMXCC1_WGMXCCGn1
    SolutionIndex: 56
    SolutionNameMin: Cijk_Alik_Bljk_HHS_BH_UserArgs_MT128x128x64_MI16x16x1_SN_LDSB1_CLR1_GSU0_GSUC0_GSUWGMRR0_K1_LBSPPA256_LBSPPB512_MIWT4_4_PLR1_SU32_SUM0_SUS256_SKXCCM8_VWA2_VWB4_WGM8_WGMXCC1_WGMXCCGn1
    SolutionIndex: 57
    SolutionNameMin: Cijk_Alik_Bljk_HHS_BH_UserArgs_MT128x128x64_MI16x16x1_SN_LDSB1_CLR1_GSU0_GSUC0_GSUWGMRR0_K1_LBSPPA512_LBSPPB512_MIWT4_4_PLR1_SU32_SUM0_SUS256_SKXCCM8_VWA4_VWB4_WGM8_WGMXCC1_WGMXCCGn1
    SolutionIndex: 58
    SolutionNameMin: Cijk_Alik_Bljk_HHS_BH_UserArgs_MT64x128x64_MI16x16x1_SN_LDSB1_CLR1_GSU0_GSUC0_GSUWGMRR0_K1_LBSPPA256_LBSPPB128_MIWT2_4_PLR1_SU32_SUM0_SUS256_SKXCCM8_VWA2_VWB1_WGM1_WGMXCC1_WGMXCCGn1
    SolutionIndex: 59
    SolutionNameMin: Cijk_Alik_Bljk_HHS_BH_UserArgs_MT64x128x64_MI16x16x1_SN_LDSB1_CLR1_GSU0_GSUC0_GSUWGMRR0_K1_LBSPPA256_LBSPPB256_MIWT2_4_PLR1_SU32_SUM0_SUS256_SKXCCM8_VWA2_VWB2_WGM1_WGMXCC1_WGMXCCGn1
    SolutionIndex: 60
    SolutionNameMin: Cijk_Alik_Bljk_HHS_BH_UserArgs_MT64x128x64_MI16x16x1_SN_LDSB1_CLR1_GSU0_GSUC0_GSUWGMRR0_K1_LBSPPA256_LBSPPB128_MIWT2_4_PLR1_SU32_SUM0_SUS256_SKXCCM8_VWA2_VWB1_WGM4_WGMXCC1_WGMXCCGn1
    SolutionIndex: 61
    SolutionNameMin: Cijk_Alik_Bljk_HHS_BH_UserArgs_MT128x64x64_MI16x16x1_SN_LDSB1_CLR1_GSU0_GSUC0_GSUWGMRR0_K1_LBSPPA256_LBSPPB128_MIWT4_2_PLR1_SU32_SUM0_SUS256_SKXCCM8_VWA2_VWB1_WGM1_WGMXCC1_WGMXCCGn1
    SolutionIndex: 62
    SolutionNameMin: Cijk_Alik_Bljk_HHS_BH_UserArgs_MT128x64x64_MI16x16x1_SN_LDSB1_CLR1_GSU0_GSUC0_GSUWGMRR0_K1_LBSPPA512_LBSPPB128_MIWT4_2_PLR1_SU32_SUM0_SUS256_SKXCCM8_VWA4_VWB1_WGM1_WGMXCC1_WGMXCCGn1
    SolutionIndex: 63
    SolutionNameMin: Cijk_Alik_Bljk_HHS_BH_UserArgs_MT128x64x64_MI16x16x1_SN_LDSB1_CLR1_GSU0_GSUC0_GSUWGMRR0_K1_LBSPPA256_LBSPPB256_MIWT4_2_PLR1_SU32_SUM0_SUS256_SKXCCM8_VWA2_VWB2_WGM1_WGMXCC1_WGMXCCGn1
    SolutionIndex: 64
    SolutionNameMin: Cijk_Alik_Bljk_HHS_BH_UserArgs_MT128x64x64_MI16x16x1_SN_LDSB1_CLR1_GSU0_GSUC0_GSUWGMRR0_K1_LBSPPA512_LBSPPB256_MIWT4_2_PLR1_SU32_SUM0_SUS256_SKXCCM8_VWA4_VWB2_WGM1_WGMXCC1_WGMXCCGn1
    SolutionIndex: 65
    SolutionNameMin: Cijk_Alik_Bljk_HHS_BH_UserArgs_MT128x64x64_MI16x16x1_SN_LDSB1_CLR1_GSU0_GSUC0_GSUWGMRR0_K1_LBSPPA256_LBSPPB128_MIWT4_2_PLR1_SU32_SUM0_SUS256_SKXCCM8_VWA2_VWB1_WGM4_WGMXCC1_WGMXCCGn1
    SolutionIndex: 66
    SolutionNameMin: Cijk_Alik_Bljk_HHS_BH_UserArgs_MT128x64x64_MI16x16x1_SN_LDSB1_CLR1_GSU0_GSUC0_GSUWGMRR0_K1_LBSPPA256_LBSPPB128_MIWT4_2_PLR1_SU32_SUM0_SUS256_SKXCCM8_VWA2_VWB1_WGM8_WGMXCC1_WGMXCCGn1
    SolutionIndex: 67
    SolutionNameMin: Cijk_Alik_Bljk_HHS_BH_UserArgs_MT128x64x64_MI16x16x1_SN_LDSB1_CLR1_GSU0_GSUC0_GSUWGMRR0_K1_LBSPPA512_LBSPPB128_MIWT4_2_PLR1_SU32_SUM0_SUS256_SKXCCM8_VWA4_VWB1_WGM8_WGMXCC1_WGMXCCGn1
    SolutionIndex: 68
    SolutionNameMin: Cijk_Alik_Bljk_HHS_BH_UserArgs_MT128x64x64_MI16x16x1_SN_LDSB1_CLR1_GSU0_GSUC0_GSUWGMRR0_K1_LBSPPA256_LBSPPB256_MIWT4_2_PLR1_SU32_SUM0_SUS256_SKXCCM8_VWA2_VWB2_WGM8_WGMXCC1_WGMXCCGn1
    SolutionIndex: 69
    SolutionNameMin: Cijk_Alik_Bljk_HHS_BH_UserArgs_MT64x64x64_MI16x16x1_SN_LDSB1_CLR1_GSU0_GSUC0_GSUWGMRR0_K1_LBSPPA256_LBSPPB128_MIWT2_2_PLR1_SU32_SUM0_SUS256_SKXCCM8_VWA2_VWB1_WGM1_WGMXCC1_WGMXCCGn1
    SolutionIndex: 70
    SolutionNameMin: Cijk_Alik_Bljk_HHS_BH_UserArgs_MT64x64x64_MI16x16x1_SN_LDSB1_CLR1_GSU0_GSUC0_GSUWGMRR0_K1_LBSPPA256_LBSPPB128_MIWT2_2_PLR2_SU32_SUM0_SUS256_SKXCCM8_VWA2_VWB1_WGM1_WGMXCC1_WGMXCCGn1
    SolutionIndex: 71
    SolutionNameMin: Cijk_Alik_Bljk_HHS_BH_UserArgs_MT64x64x64_MI16x16x1_SN_LDSB1_CLR1_GSU0_GSUC0_GSUWGMRR0_K1_LBSPPA256_LBSPPB256_MIWT2_2_PLR2_SU32_SUM0_SUS256_SKXCCM8_VWA2_VWB2_WGM1_WGMXCC1_WGMXCCGn1
    SolutionIndex: 72
    SolutionNameMin: Cijk_Alik_Bljk_HHS_BH_UserArgs_MT64x64x64_MI16x16x1_SN_LDSB1_CLR1_GSU0_GSUC0_GSUWGMRR0_K1_LBSPPA256_LBSPPB128_MIWT2_2_PLR1_SU32_SUM0_SUS256_SKXCCM8_VWA2_VWB1_WGM4_WGMXCC1_WGMXCCGn1
    SolutionIndex: 73
    SolutionNameMin: Cijk_Alik_Bljk_HHS_BH_UserArgs_MT64x64x64_MI16x16x1_SN_LDSB1_CLR1_GSU0_GSUC0_GSUWGMRR0_K1_LBSPPA256_LBSPPB256_MIWT2_2_PLR1_SU32_SUM0_SUS256_SKXCCM8_VWA2_VWB2_WGM4_WGMXCC1_WGMXCCGn1
    SolutionIndex: 74
    SolutionNameMin: Cijk_Alik_Bljk_HHS_BH_UserArgs_MT32x64x64_MI16x16x1_SN_LDSB0_CLR1_GSU0_GSUC0_GSUWGMRR0_K1_LBSPPA128_LBSPPB128_MIWT1_2_PLR1_SU32_SUM0_SUS256_SKXCCM8_VWA1_VWB1_WGM1_WGMXCC1_WGMXCCGn1
    SolutionIndex: 75
    SolutionNameMin: Cijk_Alik_Bljk_HHS_BH_UserArgs_MT32x64x64_MI16x16x1_SN_LDSB0_CLR1_GSU0_GSUC0_GSUWGMRR0_K1_LBSPPA128_LBSPPB256_MIWT1_2_PLR1_SU32_SUM0_SUS256_SKXCCM8_VWA1_VWB2_WGM1_WGMXCC1_WGMXCCGn1
    SolutionIndex: 76
    SolutionNameMin: Cijk_Alik_Bljk_HHS_BH_UserArgs_MT64x32x64_MI16x16x1_SN_LDSB0_CLR1_GSU0_GSUC0_GSUWGMRR0_K1_LBSPPA256_LBSPPB128_MIWT2_1_PLR1_SU32_SUM0_SUS256_SKXCCM8_VWA2_VWB1_WGM1_WGMXCC1_WGMXCCGn1
    SolutionIndex: 77
    SolutionNameMin: Cijk_Alik_Bljk_HHS_BH_UserArgs_MT64x32x64_MI16x16x1_SN_LDSB0_CLR1_GSU0_GSUC0_GSUWGMRR0_K1_LBSPPA256_LBSPPB128_MIWT2_1_PLR2_SU32_SUM0_SUS256_SKXCCM8_VWA2_VWB1_WGM1_WGMXCC1_WGMXCCGn1
    SolutionIndex: 78
    SolutionNameMin: Cijk_Alik_Bljk_HHS_BH_UserArgs_MT32x32x64_MI16x16x1_SN_LDSB0_CLR1_GSU0_GSUC0_GSUWGMRR0_K1_LBSPPA128_LBSPPB128_MIWT1_1_PLR1_SU32_SUM0_SUS256_SKXCCM8_VWA1_VWB1_WGM1_WGMXCC1_WGMXCCGn1
    SolutionIndex: 79
    SolutionNameMin: Cijk_Alik_Bljk_HHS_BH_UserArgs_MT64x64x128_MI16x16x1_SN_LDSB1_CLR1_GSU0_GSUC0_GSUWGMRR0_K1_LBSPPA512_LBSPPB256_MIWT2_2_PLR1_SU32_SUM0_SUS256_SKXCCM8_VWA2_VWB1_WGM1_WGMXCC1_WGMXCCGn1
    SolutionIndex: 80
    SolutionNameMin: Cijk_Alik_Bljk_HHS_BH_UserArgs_MT64x64x128_MI16x16x1_SN_LDSB1_CLR1_GSU0_GSUC0_GSUWGMRR0_K1_LBSPPA512_LBSPPB256_MIWT2_2_PLR2_SU32_SUM0_SUS256_SKXCCM8_VWA2_VWB1_WGM1_WGMXCC1_WGMXCCGn1
    SolutionIndex: 81
    SolutionNameMin: Cijk_Alik_Bljk_HHS_BH_UserArgs_MT64x64x128_MI16x16x1_SN_LDSB1_CLR1_GSU0_GSUC0_GSUWGMRR0_K1_LBSPPA512_LBSPPB512_MIWT2_2_PLR2_SU32_SUM0_SUS256_SKXCCM8_VWA2_VWB2_WGM1_WGMXCC1_WGMXCCGn1
    SolutionIndex: 82
    SolutionNameMin: Cijk_Alik_Bljk_HHS_BH_UserArgs_MT64x64x128_MI16x16x1_SN_LDSB1_CLR1_GSU0_GSUC0_GSUWGMRR0_K1_LBSPPA512_LBSPPB256_MIWT2_2_PLR1_SU32_SUM0_SUS256_SKXCCM8_VWA2_VWB1_WGM4_WGMXCC1_WGMXCCGn1
    SolutionIndex: 83
    SolutionNameMin: Cijk_Alik_Bljk_HHS_BH_UserArgs_MT64x64x128_MI16x16x1_SN_LDSB1_CLR1_GSU0_GSUC0_GSUWGMRR0_K1_LBSPPA512_LBSPPB256_MIWT2_2_PLR2_SU32_SUM0_SUS256_SKXCCM8_VWA2_VWB1_WGM4_WGMXCC1_WGMXCCGn1
    SolutionIndex: 84
    SolutionNameMin: Cijk_Alik_Bljk_HHS_BH_UserArgs_MT64x64x128_MI16x16x1_SN_LDSB1_CLR1_GSU0_GSUC0_GSUWGMRR0_K1_LBSPPA512_LBSPPB512_MIWT2_2_PLR2_SU32_SUM0_SUS256_SKXCCM8_VWA2_VWB2_WGM4_WGMXCC1_WGMXCCGn1
    SolutionIndex: 85
    SolutionNameMin: Cijk_Alik_Bljk_HHS_BH_UserArgs_MT64x64x128_MI16x16x1_SN_LDSB1_CLR1_GSU0_GSUC0_GSUWGMRR0_K1_LBSPPA256_LBSPPB256_MIWT2_2_PLR1_SU32_SUM0_SUS256_SKXCCM8_VWA1_VWB1_WGM8_WGMXCC1_WGMXCCGn1
    SolutionIndex: 86
    SolutionNameMin: Cijk_Alik_Bljk_HHS_BH_UserArgs_MT32x64x128_MI16x16x1_SN_LDSB1_CLR1_GSU0_GSUC0_GSUWGMRR0_K1_LBSPPA256_LBSPPB256_MIWT1_2_PLR1_SU32_SUM0_SUS256_SKXCCM8_VWA1_VWB1_WGM1_WGMXCC1_WGMXCCGn1
    SolutionIndex: 87
    SolutionNameMin: Cijk_Alik_Bljk_HHS_BH_UserArgs_MT32x64x128_MI16x16x1_SN_LDSB1_CLR1_GSU0_GSUC0_GSUWGMRR0_K1_LBSPPA256_LBSPPB256_MIWT1_2_PLR2_SU32_SUM0_SUS256_SKXCCM8_VWA1_VWB1_WGM1_WGMXCC1_WGMXCCGn1
    SolutionIndex: 88
    SolutionNameMin: Cijk_Alik_Bljk_HHS_BH_UserArgs_MT64x32x128_MI16x16x1_SN_LDSB1_CLR1_GSU0_GSUC0_GSUWGMRR0_K1_LBSPPA512_LBSPPB256_MIWT2_1_PLR2_SU32_SUM0_SUS256_SKXCCM8_VWA2_VWB1_WGM1_WGMXCC1_WGMXCCGn1
    SolutionIndex: 89
    SolutionNameMin: Cijk_Alik_Bljk_HHS_BH_UserArgs_MT32x32x128_MI16x16x1_SN_LDSB1_CLR1_GSU0_GSUC0_GSUWGMRR0_K1_LBSPPA256_LBSPPB256_MIWT1_1_PLR1_SU32_SUM0_SUS256_SKXCCM8_VWA1_VWB1_WGM1_WGMXCC1_WGMXCCGn1
    SolutionIndex: 90
    SolutionNameMin: Cijk_Alik_Bljk_HHS_BH_UserArgs_MT32x32x128_MI16x16x1_SN_LDSB1_CLR1_GSU0_GSUC0_GSUWGMRR0_K1_LBSPPA256_LBSPPB256_MIWT1_1_PLR2_SU32_SUM0_SUS256_SKXCCM8_VWA1_VWB1_WGM1_WGMXCC1_WGMXCCGn1
    SolutionIndex: 91
    SolutionNameMin: Cijk_Alik_Bljk_HHS_BH_UserArgs_MT32x32x128_MI16x16x1_SN_LDSB1_CLR1_GSU0_GSUC0_GSUWGMRR0_K1_LBSPPA256_LBSPPB256_MIWT1_1_PLR1_SU32_SUM0_SUS256_SKXCCM8_VWA1_VWB1_WGM4_WGMXCC1_WGMXCCGn1
    SolutionIndex: 92
    SolutionNameMin: Cijk_Alik_Bljk_HHS_BH_UserArgs_MT32x32x128_MI16x16x1_SN_LDSB1_CLR1_GSU0_GSUC0_GSUWGMRR0_K1_LBSPPA256_LBSPPB256_MIWT1_1_PLR2_SU32_SUM0_SUS256_SKXCCM8_VWA1_VWB1_WGM4_WGMXCC1_WGMXCCGn1
    SolutionIndex: 93
    SolutionNameMin: Cijk_Alik_Bljk_HHS_BH_UserArgs_MT32x32x32_MI16x16x1_SN_LDSB0_CLR1_GSU0_GSUC0_GSUWGMRR0_K1_LBSPPA128_LBSPPB128_MIWT1_1_PLR1_SU32_SUM0_SUS256_SKXCCM8_VWA1_VWB1_WGM8_WGMXCC1_WGMXCCGn1
- - - [128, 128, 1, 128, 128, 128, 128, 128]
    - [89, 0.091]
  - - [128, 128, 1, 256, 128, 128, 256, 256]
    - [17, 0.172]
  - - [128, 128, 1, 512, 128, 128, 512, 512]
    - [17, 0.3]
  - - [128, 128, 1, 1024, 128, 128, 1024, 1024]
    - [36, 0.475]
  - - [128, 128, 1, 2048, 128, 128, 2048, 2048]
    - [37, 0.656]
  - - [128, 128, 1, 4096, 128, 128, 4096, 4096]
    - [78, 1.196]
  - - [128, 128, 1, 8192, 128, 128, 8192, 8192]
    - [90, 1.901]
  - - [128, 256, 1, 128, 128, 128, 128, 128]
    - [89, 0.186]
  - - [128, 256, 1, 256, 128, 128, 256, 256]
    - [78, 0.347]
  - - [128, 256, 1, 512, 128, 128, 512, 512]
    - [36, 0.605]
  - - [128, 256, 1, 1024, 128, 128, 1024, 1024]
    - [36, 0.959]
  - - [128, 256, 1, 2048, 128, 128, 2048, 2048]
    - [90, 1.326]
  - - [128, 256, 1, 4096, 128, 128, 4096, 4096]
    - [78, 2.267]
  - - [128, 256, 1, 8192, 128, 128, 8192, 8192]
    - [90, 3.673]
  - - [128, 512, 1, 128, 128, 128, 128, 128]
    - [17, 0.37]
  - - [128, 512, 1, 256, 128, 128, 256, 256]
    - [78, 0.69]
  - - [128, 512, 1, 512, 128, 128, 512, 512]
    - [36, 1.189]
  - - [128, 512, 1, 1024, 128, 128, 1024, 1024]
    - [36, 1.899]
  - - [128, 512, 1, 2048, 128, 128, 2048, 2048]
    - [90, 2.612]
  - - [128, 512, 1, 4096, 128, 128, 4096, 4096]
    - [78, 4.375]
  - - [128, 512, 1, 8192, 128, 128, 8192, 8192]
    - [90, 7.051]
  - - [128, 1024, 1, 128, 128, 128, 128, 128]
    - [36, 0.728]
  - - [128, 1024, 1, 256, 128, 128, 256, 256]
    - [17, 1.368]
  - - [128, 1024, 1, 512, 128, 128, 512, 512]
    - [17, 2.345]
  - - [128, 1024, 1, 1024, 128, 128, 1024, 1024]
    - [37, 3.734]
  - - [128, 1024, 1, 2048, 128, 128, 2048, 2048]
    - [78, 4.994]
  - - [128, 1024, 1, 4096, 128, 128, 4096, 4096]
    - [90, 7.683]
  - - [128, 1024, 1, 8192, 128, 128, 8192, 8192]
    - [87, 10.161]
  - - [128, 2048, 1, 128, 128, 128, 128, 128]
    - [17, 1.432]
  - - [128, 2048, 1, 256, 128, 128, 256, 256]
    - [78, 2.64]
  - - [128, 2048, 1, 512, 128, 128, 512, 512]
    - [78, 4.418]
  - - [128, 2048, 1, 1024, 128, 128, 1024, 1024]
    - [78, 7.231]
  - - [128, 2048, 1, 2048, 128, 128, 2048, 2048]
    - [78, 9.622]
  - - [128, 2048, 1, 4096, 128, 128, 4096, 4096]
    - [88, 11.177]
  - - [128, 2048, 1, 8192, 128, 128, 8192, 8192]
    - [25, 13.841]
  - - [128, 4096, 1, 128, 128, 128, 128, 128]
    - [16, 2.654]
  - - [128, 4096, 1, 256, 128, 128, 256, 256]
    - [15, 4.674]
  - - [128, 4096, 1, 512, 128, 128, 512, 512]
    - [86, 7.655]
  - - [128, 4096, 1, 1024, 128, 128, 1024, 1024]
    - [34, 10.688]
  - - [128, 4096, 1, 2048, 128, 128, 2048, 2048]
    - [88, 13.007]
  - - [128, 4096, 1, 4096, 128, 128, 4096, 4096]
    - [10, 14.951]
  - - [128, 4096, 1, 8192, 128, 128, 8192, 8192]
    - [10, 16.636]
  - - [128, 8192, 1, 128, 128, 128, 128, 128]
    - [11, 4.704]
  - - [128, 8192, 1, 256, 128, 128, 256, 256]
    - [69, 7.91]
  - - [128, 8192, 1, 512, 128, 128, 512, 512]
    - [70, 12.007]
  - - [128, 8192, 1, 1024, 128, 128, 1024, 1024]
    - [79, 16.144]
  - - [128, 8192, 1, 2048, 128, 128, 2048, 2048]
    - [26, 16.839]
  - - [128, 8192, 1, 4096, 128, 128, 4096, 4096]
    - [42, 18.935]
  - - [128, 8192, 1, 8192, 128, 128, 8192, 8192]
    - [40, 21.755]
  - - [256, 128, 1, 128, 256, 256, 128, 128]
    - [78, 0.185]
  - - [256, 128, 1, 256, 256, 256, 256, 256]
    - [17, 0.346]
  - - [256, 128, 1, 512, 256, 256, 512, 512]
    - [17, 0.606]
  - - [256, 128, 1, 1024, 256, 256, 1024, 1024]
    - [37, 0.951]
  - - [256, 128, 1, 2048, 256, 256, 2048, 2048]
    - [90, 1.322]
  - - [256, 128, 1, 4096, 256, 256, 4096, 4096]
    - [78, 2.281]
  - - [256, 128, 1, 8192, 256, 256, 8192, 8192]
    - [90, 3.671]
  - - [256, 256, 1, 128, 256, 256, 128, 128]
    - [78, 0.367]
  - - [256, 256, 1, 256, 256, 256, 256, 256]
    - [78, 0.691]
  - - [256, 256, 1, 512, 256, 256, 512, 512]
    - [78, 1.2]
  - - [256, 256, 1, 1024, 256, 256, 1024, 1024]
    - [36, 1.88]
  - - [256, 256, 1, 2048, 256, 256, 2048, 2048]
    - [90, 2.611]
  - - [256, 256, 1, 4096, 256, 256, 4096, 4096]
    - [78, 4.436]
  - - [256, 256, 1, 8192, 256, 256, 8192, 8192]
    - [91, 6.891]
  - - [256, 512, 1, 128, 256, 256, 128, 128]
    - [36, 0.716]
  - - [256, 512, 1, 256, 256, 256, 256, 256]
    - [78, 1.347]
  - - [256, 512, 1, 512, 256, 256, 512, 512]
    - [89, 2.237]
  - - [256, 512, 1, 1024, 256, 256, 1024, 1024]
    - [36, 3.73]
  - - [256, 512, 1, 2048, 256, 256, 2048, 2048]
    - [78, 4.928]
  - - [256, 512, 1, 4096, 256, 256, 4096, 4096]
    - [90, 7.522]
  - - [256, 512, 1, 8192, 256, 256, 8192, 8192]
    - [35, 10.089]
  - - [256, 1024, 1, 128, 256, 256, 128, 128]
    - [89, 1.384]
  - - [256, 1024, 1, 256, 256, 256, 256, 256]
    - [17, 2.447]
  - - [256, 1024, 1, 512, 256, 256, 512, 512]
    - [78, 4.421]
  - - [256, 1024, 1, 1024, 256, 256, 1024, 1024]
    - [90, 7.216]
  - - [256, 1024, 1, 2048, 256, 256, 2048, 2048]
    - [89, 9.675]
  - - [256, 1024, 1, 4096, 256, 256, 4096, 4096]
    - [33, 10.94]
  - - [256, 1024, 1, 8192, 256, 256, 8192, 8192]
    - [22, 14.341]
  - - [256, 2048, 1, 128, 256, 256, 128, 128]
    - [16, 2.638]
  - - [256, 2048, 1, 256, 256, 256, 256, 256]
    - [76, 4.613]
  - - [256, 2048, 1, 512, 256, 256, 512, 512]
    - [74, 7.878]
  - - [256, 2048, 1, 1024, 256, 256, 1024, 1024]
    - [76, 10.799]
  - - [256, 2048, 1, 2048, 256, 256, 2048, 2048]
    - [87, 12.907]
  - - [256, 2048, 1, 4096, 256, 256, 4096, 4096]
    - [27, 15.476]
  - - [256, 2048, 1, 8192, 256, 256, 8192, 8192]
    - [85, 16.257]
  - - [256, 4096, 1, 128, 256, 256, 128, 128]
    - [14, 4.554]
  - - [256, 4096, 1, 256, 256, 256, 256, 256]
    - [69, 8.129]
  - - [256, 4096, 1, 512, 256, 256, 512, 512]
    - [70, 12.008]
  - - [256, 4096, 1, 1024, 256, 256, 1024, 1024]
    - [79, 16.185]
  - - [256, 4096, 1, 2048, 256, 256, 2048, 2048]
    - [81, 18.466]
  - - [256, 4096, 1, 4096, 256, 256, 4096, 4096]
    - [42, 19.369]
  - - [256, 4096, 1, 8192, 256, 256, 8192, 8192]
    - [48, 21.381]
  - - [256, 8192, 1, 128, 256, 256, 128, 128]
    - [63, 7.438]
  - - [256, 8192, 1, 256, 256, 256, 256, 256]
    - [63, 11.48]
  - - [256, 8192, 1, 512, 256, 256, 512, 512]
    - [61, 16.705]
  - - [256, 8192, 1, 1024, 256, 256, 1024, 1024]
    - [61, 21.221]
  - - [256, 8192, 1, 2048, 256, 256, 2048, 2048]
    - [66, 20.889]
  - - [256, 8192, 1, 4096, 256, 256, 4096, 4096]
    - [53, 23.427]
  - - [256, 8192, 1, 8192, 256, 256, 8192, 8192]
    - [7, 25.444]
  - - [512, 128, 1, 128, 512, 512, 128, 128]
    - [17, 0.364]
  - - [512, 128, 1, 256, 512, 512, 256, 256]
    - [17, 0.686]
  - - [512, 128, 1, 512, 512, 512, 512, 512]
    - [17, 1.188]
  - - [512, 128, 1, 1024, 512, 512, 1024, 1024]
    - [36, 1.888]
  - - [512, 128, 1, 2048, 512, 512, 2048, 2048]
    - [89, 2.541]
  - - [512, 128, 1, 4096, 512, 512, 4096, 4096]
    - [78, 4.466]
  - - [512, 128, 1, 8192, 512, 512, 8192, 8192]
    - [92, 6.972]
  - - [512, 256, 1, 128, 512, 512, 128, 128]
    - [17, 0.725]
  - - [512, 256, 1, 256, 512, 512, 256, 256]
    - [17, 1.352]
  - - [512, 256, 1, 512, 512, 512, 512, 512]
    - [17, 2.342]
  - - [512, 256, 1, 1024, 512, 512, 1024, 1024]
    - [37, 3.716]
  - - [512, 256, 1, 2048, 512, 512, 2048, 2048]
    - [78, 4.946]
  - - [512, 256, 1, 4096, 512, 512, 4096, 4096]
    - [36, 7.579]
  - - [512, 256, 1, 8192, 512, 512, 8192, 8192]
    - [35, 10.108]
  - - [512, 512, 1, 128, 512, 512, 128, 128]
    - [17, 1.42]
  - - [512, 512, 1, 256, 512, 512, 256, 256]
    - [90, 2.494]
  - - [512, 512, 1, 512, 512, 512, 512, 512]
    - [78, 4.345]
  - - [512, 512, 1, 1024, 512, 512, 1024, 1024]
    - [37, 7.145]
  - - [512, 512, 1, 2048, 512, 512, 2048, 2048]
    - [89, 9.585]
  - - [512, 512, 1, 4096, 512, 512, 4096, 4096]
    - [31, 11.096]
  - - [512, 512, 1, 8192, 512, 512, 8192, 8192]
    - [19, 14.949]
  - - [512, 1024, 1, 128, 512, 512, 128, 128]
    - [77, 2.578]
  - - [512, 1024, 1, 256, 512, 512, 256, 256]
    - [76, 4.721]
  - - [512, 1024, 1, 512, 512, 512, 512, 512]
    - [15, 7.667]
  - - [512, 1024, 1, 1024, 512, 512, 1024, 1024]
    - [16, 10.769]
  - - [512, 1024, 1, 2048, 512, 512, 2048, 2048]
    - [88, 12.932]
  - - [512, 1024, 1, 4096, 512, 512, 4096, 4096]
    - [26, 16.03]
  - - [512, 1024, 1, 8192, 512, 512, 8192, 8192]
    - [80, 16.301]
  - - [512, 2048, 1, 128, 512, 512, 128, 128]
    - [19, 4.369]
  - - [512, 2048, 1, 256, 512, 512, 256, 256]
    - [12, 8.025]
  - - [512, 2048, 1, 512, 512, 512, 512, 512]
    - [71, 11.508]
  - - [512, 2048, 1, 1024, 512, 512, 1024, 1024]
    - [79, 16.116]
  - - [512, 2048, 1, 2048, 512, 512, 2048, 2048]
    - [81, 18.493]
  - - [512, 2048, 1, 4096, 512, 512, 4096, 4096]
    - [42, 19.552]
  - - [512, 2048, 1, 8192, 512, 512, 8192, 8192]
    - [40, 21.583]
  - - [512, 4096, 1, 128, 512, 512, 128, 128]
    - [63, 7.372]
  - - [512, 4096, 1, 256, 512, 512, 256, 256]
    - [59, 11.958]
  - - [512, 4096, 1, 512, 512, 512, 512, 512]
    - [61, 16.628]
  - - [512, 4096, 1, 1024, 512, 512, 1024, 1024]
    - [61, 20.854]
  - - [512, 4096, 1, 2048, 512, 512, 2048, 2048]
    - [64, 21.743]
  - - [512, 4096, 1, 4096, 512, 512, 4096, 4096]
    - [53, 23.526]
  - - [512, 4096, 1, 8192, 512, 512, 8192, 8192]
    - [51, 24.718]
  - - [512, 8192, 1, 128, 512, 512, 128, 128]
    - [43, 10.26]
  - - [512, 8192, 1, 256, 512, 512, 256, 256]
    - [52, 15.786]
  - - [512, 8192, 1, 512, 512, 512, 512, 512]
    - [52, 21.933]
  - - [512, 8192, 1, 1024, 512, 512, 1024, 1024]
    - [39, 25.238]
  - - [512, 8192, 1, 2048, 512, 512, 2048, 2048]
    - [47, 27.474]
  - - [512, 8192, 1, 4096, 512, 512, 4096, 4096]
    - [56, 25.492]
  - - [512, 8192, 1, 8192, 512, 512, 8192, 8192]
    - [0, 24.785]
  - - [1024, 128, 1, 128, 1024, 1024, 128, 128]
    - [78, 0.705]
  - - [1024, 128, 1, 256, 1024, 1024, 256, 256]
    - [78, 1.313]
  - - [1024, 128, 1, 512, 1024, 1024, 512, 512]
    - [17, 2.292]
  - - [1024, 128, 1, 1024, 1024, 1024, 1024, 1024]
    - [36, 3.706]
  - - [1024, 128, 1, 2048, 1024, 1024, 2048, 2048]
    - [18, 4.75]
  - - [1024, 128, 1, 4096, 1024, 1024, 4096, 4096]
    - [37, 7.519]
  - - [1024, 128, 1, 8192, 1024, 1024, 8192, 8192]
    - [32, 10.072]
  - - [1024, 256, 1, 128, 1024, 1024, 128, 128]
    - [36, 1.379]
  - - [1024, 256, 1, 256, 1024, 1024, 256, 256]
    - [78, 2.595]
  - - [1024, 256, 1, 512, 1024, 1024, 512, 512]
    - [17, 4.334]
  - - [1024, 256, 1, 1024, 1024, 1024, 1024, 1024]
    - [37, 7.188]
  - - [1024, 256, 1, 2048, 1024, 1024, 2048, 2048]
    - [37, 9.569]
  - - [1024, 256, 1, 4096, 1024, 1024, 4096, 4096]
    - [30, 10.99]
  - - [1024, 256, 1, 8192, 1024, 1024, 8192, 8192]
    - [28, 14.177]
  - - [1024, 512, 1, 128, 1024, 1024, 128, 128]
    - [16, 2.599]
  - - [1024, 512, 1, 256, 1024, 1024, 256, 256]
    - [16, 4.639]
  - - [1024, 512, 1, 512, 1024, 1024, 512, 512]
    - [15, 7.775]
  - - [1024, 512, 1, 1024, 1024, 1024, 1024, 1024]
    - [76, 10.709]
  - - [1024, 512, 1, 2048, 1024, 1024, 2048, 2048]
    - [30, 12.886]
  - - [1024, 512, 1, 4096, 1024, 1024, 4096, 4096]
    - [20, 16.064]
  - - [1024, 512, 1, 8192, 1024, 1024, 8192, 8192]
    - [85, 16.087]
  - - [1024, 1024, 1, 128, 1024, 1024, 128, 128]
    - [12, 4.62]
  - - [1024, 1024, 1, 256, 1024, 1024, 256, 256]
    - [12, 8.016]
  - - [1024, 1024, 1, 512, 1024, 1024, 512, 512]
    - [13, 11.821]
  - - [1024, 1024, 1, 1024, 1024, 1024, 1024, 1024]
    - [24, 15.939]
  - - [1024, 1024, 1, 2048, 1024, 1024, 2048, 2048]
    - [84, 18.267]
  - - [1024, 1024, 1, 4096, 1024, 1024, 4096, 4096]
    - [48, 19.333]
  - - [1024, 1024, 1, 8192, 1024, 1024, 8192, 8192]
    - [44, 21.462]
  - - [1024, 2048, 1, 128, 1024, 1024, 128, 128]
    - [63, 7.304]
  - - [1024, 2048, 1, 256, 1024, 1024, 256, 256]
    - [58, 11.999]
  - - [1024, 2048, 1, 512, 1024, 1024, 512, 512]
    - [58, 16.598]
  - - [1024, 2048, 1, 1024, 1024, 1024, 1024, 1024]
    - [58, 21.107]
  - - [1024, 2048, 1, 2048, 1024, 1024, 2048, 2048]
    - [8, 22.261]
  - - [1024, 2048, 1, 4096, 1024, 1024, 4096, 4096]
    - [53, 23.505]
  - - [1024, 2048, 1, 8192, 1024, 1024, 8192, 8192]
    - [41, 25.226]
  - - [1024, 4096, 1, 128, 1024, 1024, 128, 128]
    - [41, 10.307]
  - - [1024, 4096, 1, 256, 1024, 1024, 256, 256]
    - [41, 15.919]
  - - [1024, 4096, 1, 512, 1024, 1024, 512, 512]
    - [39, 21.822]
  - - [1024, 4096, 1, 1024, 1024, 1024, 1024, 1024]
    - [39, 25.411]
  - - [1024, 4096, 1, 2048, 1024, 1024, 2048, 2048]
    - [57, 27.665]
  - - [1024, 4096, 1, 4096, 1024, 1024, 4096, 4096]
    - [42, 26.633]
  - - [1024, 4096, 1, 8192, 1024, 1024, 8192, 8192]
    - [40, 24.323]
  - - [1024, 8192, 1, 128, 1024, 1024, 128, 128]
    - [41, 11.749]
  - - [1024, 8192, 1, 256, 1024, 1024, 256, 256]
    - [61, 12.384]
  - - [1024, 8192, 1, 512, 1024, 1024, 512, 512]
    - [40, 17.887]
  - - [1024, 8192, 1, 1024, 1024, 1024, 1024, 1024]
    - [40, 22.878]
  - - [1024, 8192, 1, 2048, 1024, 1024, 2048, 2048]
    - [44, 25.736]
  - - [1024, 8192, 1, 4096, 1024, 1024, 4096, 4096]
    - [41, 24.962]
  - - [1024, 8192, 1, 8192, 1024, 1024, 8192, 8192]
    - [52, 24.38]
  - - [2048, 128, 1, 128, 2048, 2048, 128, 128]
    - [36, 1.387]
  - - [2048, 128, 1, 256, 2048, 2048, 256, 256]
    - [17, 2.614]
  - - [2048, 128, 1, 512, 2048, 2048, 512, 512]
    - [17, 4.378]
  - - [2048, 128, 1, 1024, 2048, 2048, 1024, 1024]
    - [36, 6.97]
  - - [2048, 128, 1, 2048, 2048, 2048, 2048, 2048]
    - [92, 9.373]
  - - [2048, 128, 1, 4096, 2048, 2048, 4096, 4096]
    - [29, 11.013]
  - - [2048, 128, 1, 8192, 2048, 2048, 8192, 8192]
    - [23, 13.787]
  - - [2048, 256, 1, 128, 2048, 2048, 128, 128]
    - [16, 2.586]
  - - [2048, 256, 1, 256, 2048, 2048, 256, 256]
    - [16, 4.66]
  - - [2048, 256, 1, 512, 2048, 2048, 512, 512]
    - [15, 7.797]
  - - [2048, 256, 1, 1024, 2048, 2048, 1024, 1024]
    - [16, 10.8]
  - - [2048, 256, 1, 2048, 2048, 2048, 2048, 2048]
    - [35, 12.955]
  - - [2048, 256, 1, 4096, 2048, 2048, 4096, 4096]
    - [23, 15.361]
  - - [2048, 256, 1, 8192, 2048, 2048, 8192, 8192]
    - [58, 15.768]
  - - [2048, 512, 1, 128, 2048, 2048, 128, 128]
    - [69, 4.556]
  - - [2048, 512, 1, 256, 2048, 2048, 256, 256]
    - [12, 8.077]
  - - [2048, 512, 1, 512, 2048, 2048, 512, 512]
    - [79, 11.912]
  - - [2048, 512, 1, 1024, 2048, 2048, 1024, 1024]
    - [21, 16.134]
  - - [2048, 512, 1, 2048, 2048, 2048, 2048, 2048]
    - [83, 18.305]
  - - [2048, 512, 1, 4096, 2048, 2048, 4096, 4096]
    - [46, 19.347]
  - - [2048, 512, 1, 8192, 2048, 2048, 8192, 8192]
    - [40, 21.631]
  - - [2048, 1024, 1, 128, 2048, 2048, 128, 128]
    - [63, 7.418]
  - - [2048, 1024, 1, 256, 2048, 2048, 256, 256]
    - [63, 11.98]
  - - [2048, 1024, 1, 512, 2048, 2048, 512, 512]
    - [63, 16.567]
  - - [2048, 1024, 1, 1024, 2048, 2048, 1024, 1024]
    - [66, 20.837]
  - - [2048, 1024, 1, 2048, 2048, 2048, 2048, 2048]
    - [67, 21.844]
  - - [2048, 1024, 1, 4096, 2048, 2048, 4096, 4096]
    - [57, 23.485]
  - - [2048, 1024, 1, 8192, 2048, 2048, 8192, 8192]
    - [43, 25.237]
  - - [2048, 2048, 1, 128, 2048, 2048, 128, 128]
    - [43, 10.435]
  - - [2048, 2048, 1, 256, 2048, 2048, 256, 256]
    - [41, 15.932]
  - - [2048, 2048, 1, 512, 2048, 2048, 512, 512]
    - [6, 21.583]
  - - [2048, 2048, 1, 1024, 2048, 2048, 1024, 1024]
    - [45, 24.892]
  - - [2048, 2048, 1, 2048, 2048, 2048, 2048, 2048]
    - [4, 27.027]
  - - [2048, 2048, 1, 4096, 2048, 2048, 4096, 4096]
    - [42, 27.964]
  - - [2048, 2048, 1, 8192, 2048, 2048, 8192, 8192]
    - [39, 26.351]
  - - [2048, 4096, 1, 128, 2048, 2048, 128, 128]
    - [43, 11.469]
  - - [2048, 4096, 1, 256, 2048, 2048, 256, 256]
    - [63, 12.517]
  - - [2048, 4096, 1, 512, 2048, 2048, 512, 512]
    - [40, 17.888]
  - - [2048, 4096, 1, 1024, 2048, 2048, 1024, 1024]
    - [57, 22.894]
  - - [2048, 4096, 1, 2048, 2048, 2048, 2048, 2048]
    - [41, 26.693]
  - - [2048, 4096, 1, 4096, 2048, 2048, 4096, 4096]
    - [51, 25.208]
  - - [2048, 4096, 1, 8192, 2048, 2048, 8192, 8192]
    - [42, 25.184]
  - - [2048, 8192, 1, 128, 2048, 2048, 128, 128]
    - [4, 10.393]
  - - [2048, 8192, 1, 256, 2048, 2048, 256, 256]
    - [42, 16.638]
  - - [2048, 8192, 1, 512, 2048, 2048, 512, 512]
    - [40, 20.944]
  - - [2048, 8192, 1, 1024, 2048, 2048, 1024, 1024]
    - [40, 25.462]
  - - [2048, 8192, 1, 2048, 2048, 2048, 2048, 2048]
    - [55, 26.611]
  - - [2048, 8192, 1, 4096, 2048, 2048, 4096, 4096]
    - [40, 29.027]
  - - [2048, 8192, 1, 8192, 2048, 2048, 8192, 8192]
    - [40, 28.943]
  - - [4096, 128, 1, 128, 4096, 4096, 128, 128]
    - [76, 2.627]
  - - [4096, 128, 1, 256, 4096, 4096, 256, 256]
    - [76, 4.701]
  - - [4096, 128, 1, 512, 4096, 4096, 512, 512]
    - [75, 7.627]
  - - [4096, 128, 1, 1024, 4096, 4096, 1024, 1024]
    - [16, 10.81]
  - - [4096, 128, 1, 2048, 4096, 4096, 2048, 2048]
    - [35, 12.954]
  - - [4096, 128, 1, 4096, 4096, 4096, 4096, 4096]
    - [19, 14.788]
  - - [4096, 128, 1, 8192, 4096, 4096, 8192, 8192]
    - [58, 15.957]
  - - [4096, 256, 1, 128, 4096, 4096, 128, 128]
    - [11, 4.646]
  - - [4096, 256, 1, 256, 4096, 4096, 256, 256]
    - [11, 7.99]
  - - [4096, 256, 1, 512, 4096, 4096, 512, 512]
    - [79, 11.836]
  - - [4096, 256, 1, 1024, 4096, 4096, 1024, 1024]
    - [82, 15.925]
  - - [4096, 256, 1, 2048, 4096, 4096, 2048, 2048]
    - [84, 18.123]
  - - [4096, 256, 1, 4096, 4096, 4096, 4096, 4096]
    - [46, 19.374]
  - - [4096, 256, 1, 8192, 4096, 4096, 8192, 8192]
    - [42, 21.481]
  - - [4096, 512, 1, 128, 4096, 4096, 128, 128]
    - [63, 7.445]
  - - [4096, 512, 1, 256, 4096, 4096, 256, 256]
    - [58, 12.08]
  - - [4096, 512, 1, 512, 4096, 4096, 512, 512]
    - [58, 16.671]
  - - [4096, 512, 1, 1024, 4096, 4096, 1024, 1024]
    - [60, 20.884]
  - - [4096, 512, 1, 2048, 4096, 4096, 2048, 2048]
    - [9, 22.491]
  - - [4096, 512, 1, 4096, 4096, 4096, 4096, 4096]
    - [40, 22.671]
  - - [4096, 512, 1, 8192, 4096, 4096, 8192, 8192]
    - [44, 25.825]
  - - [4096, 1024, 1, 128, 4096, 4096, 128, 128]
    - [41, 10.45]
  - - [4096, 1024, 1, 256, 4096, 4096, 256, 256]
    - [47, 15.782]
  - - [4096, 1024, 1, 512, 4096, 4096, 512, 512]
    - [47, 21.704]
  - - [4096, 1024, 1, 1024, 4096, 4096, 1024, 1024]
    - [45, 25.046]
  - - [4096, 1024, 1, 2048, 4096, 4096, 2048, 2048]
    - [5, 27.957]
  - - [4096, 1024, 1, 4096, 4096, 4096, 4096, 4096]
    - [39, 27.273]
  - - [4096, 1024, 1, 8192, 4096, 4096, 8192, 8192]
    - [44, 26.861]
  - - [4096, 2048, 1, 128, 4096, 4096, 128, 128]
    - [49, 11.536]
  - - [4096, 2048, 1, 256, 4096, 4096, 256, 256]
    - [62, 12.541]
  - - [4096, 2048, 1, 512, 4096, 4096, 512, 512]
    - [53, 17.755]
  - - [4096, 2048, 1, 1024, 4096, 4096, 1024, 1024]
    - [40, 22.979]
  - - [4096, 2048, 1, 2048, 4096, 4096, 2048, 2048]
    - [44, 27.957]
  - - [4096, 2048, 1, 4096, 4096, 4096, 4096, 4096]
    - [42, 28.058]
  - - [4096, 2048, 1, 8192, 4096, 4096, 8192, 8192]
    - [40, 28.042]
  - - [4096, 4096, 1, 128, 4096, 4096, 128, 128]
    - [4, 10.268]
  - - [4096, 4096, 1, 256, 4096, 4096, 256, 256]
    - [53, 16.158]
  - - [4096, 4096, 1, 512, 4096, 4096, 512, 512]
    - [53, 20.769]
  - - [4096, 4096, 1, 1024, 4096, 4096, 1024, 1024]
    - [47, 25.327]
  - - [4096, 4096, 1, 2048, 4096, 4096, 2048, 2048]
    - [1, 26.793]
  - - [4096, 4096, 1, 4096, 4096, 4096, 4096, 4096]
    - [45, 29.302]
  - - [4096, 4096, 1, 8192, 4096, 4096, 8192, 8192]
    - [3, 29.438]
  - - [4096, 8192, 1, 128, 4096, 4096, 128, 128]
    - [4, 12.78]
  - - [4096, 8192, 1, 256, 4096, 4096, 256, 256]
    - [39, 17.22]
  - - [4096, 8192, 1, 512, 4096, 4096, 512, 512]
    - [55, 22.35]
  - - [4096, 8192, 1, 1024, 4096, 4096, 1024, 1024]
    - [52, 26.073]
  - - [4096, 8192, 1, 2048, 4096, 4096, 2048, 2048]
    - [50, 28.094]
  - - [4096, 8192, 1, 4096, 4096, 4096, 4096, 4096]
    - [46, 31.16]
  - - [4096, 8192, 1, 8192, 4096, 4096, 8192, 8192]
    - [46, 30.997]
  - - [8192, 128, 1, 128, 8192, 8192, 128, 128]
    - [11, 4.586]
  - - [8192, 128, 1, 256, 8192, 8192, 256, 256]
    - [73, 7.605]
  - - [8192, 128, 1, 512, 8192, 8192, 512, 512]
    - [69, 11.589]
  - - [8192, 128, 1, 1024, 8192, 8192, 1024, 1024]
    - [72, 15.489]
  - - [8192, 128, 1, 2048, 8192, 8192, 2048, 2048]
    - [19, 16.837]
  - - [8192, 128, 1, 4096, 8192, 8192, 4096, 4096]
    - [48, 18.746]
  - - [8192, 128, 1, 8192, 8192, 8192, 8192, 8192]
    - [4, 21.695]
  - - [8192, 256, 1, 128, 8192, 8192, 128, 128]
    - [68, 7.227]
  - - [8192, 256, 1, 256, 8192, 8192, 256, 256]
    - [60, 11.868]
  - - [8192, 256, 1, 512, 8192, 8192, 512, 512]
    - [65, 16.501]
  - - [8192, 256, 1, 1024, 8192, 8192, 1024, 1024]
    - [65, 20.985]
  - - [8192, 256, 1, 2048, 8192, 8192, 2048, 2048]
    - [4, 20.706]
  - - [8192, 256, 1, 4096, 8192, 8192, 4096, 4096]
    - [44, 22.766]
  - - [8192, 256, 1, 8192, 8192, 8192, 8192, 8192]
    - [44, 26.119]
  - - [8192, 512, 1, 128, 8192, 8192, 128, 128]
    - [47, 10.211]
  - - [8192, 512, 1, 256, 8192, 8192, 256, 256]
    - [47, 15.846]
  - - [8192, 512, 1, 512, 8192, 8192, 512, 512]
    - [52, 21.858]
  - - [8192, 512, 1, 1024, 8192, 8192, 1024, 1024]
    - [52, 25.184]
  - - [8192, 512, 1, 2048, 8192, 8192, 2048, 2048]
    - [46, 27.328]
  - - [8192, 512, 1, 4096, 8192, 8192, 4096, 4096]
    - [41, 27.592]
  - - [8192, 512, 1, 8192, 8192, 8192, 8192, 8192]
    - [39, 26.889]
  - - [8192, 1024, 1, 128, 8192, 8192, 128, 128]
    - [47, 11.547]
  - - [8192, 1024, 1, 256, 8192, 8192, 256, 256]
    - [10, 12.19]
  - - [8192, 1024, 1, 512, 8192, 8192, 512, 512]
    - [55, 17.8]
  - - [8192, 1024, 1, 1024, 8192, 8192, 1024, 1024]
    - [55, 23.113]
  - - [8192, 1024, 1, 2048, 8192, 8192, 2048, 2048]
    - [44, 25.835]
  - - [8192, 1024, 1, 4096, 8192, 8192, 4096, 4096]
    - [38, 27.419]
  - - [8192, 1024, 1, 8192, 8192, 8192, 8192, 8192]
    - [43, 27.862]
  - - [8192, 2048, 1, 128, 8192, 8192, 128, 128]
    - [1, 10.356]
  - - [8192, 2048, 1, 256, 8192, 8192, 256, 256]
    - [53, 15.981]
  - - [8192, 2048, 1, 512, 8192, 8192, 512, 512]
    - [53, 20.57]
  - - [8192, 2048, 1, 1024, 8192, 8192, 1024, 1024]
    - [53, 25.479]
  - - [8192, 2048, 1, 2048, 8192, 8192, 2048, 2048]
    - [57, 27.791]
  - - [8192, 2048, 1, 4096, 8192, 8192, 4096, 4096]
    - [2, 28.664]
  - - [8192, 2048, 1, 8192, 8192, 8192, 8192, 8192]
    - [1, 29.357]
  - - [8192, 4096, 1, 128, 8192, 8192, 128, 128]
    - [1, 12.556]
  - - [8192, 4096, 1, 256, 8192, 8192, 256, 256]
    - [53, 16.99]
  - - [8192, 4096, 1, 512, 8192, 8192, 512, 512]
    - [45, 22.146]
  - - [8192, 4096, 1, 1024, 8192, 8192, 1024, 1024]
    - [53, 25.682]
  - - [8192, 4096, 1, 2048, 8192, 8192, 2048, 2048]
    - [53, 27.943]
  - - [8192, 4096, 1, 4096, 8192, 8192, 4096, 4096]
    - [54, 31.073]
  - - [8192, 4096, 1, 8192, 8192, 8192, 8192, 8192]
    - [46, 31.199]
  - - [8192, 8192, 1, 128, 8192, 8192, 128, 128]
    - [4, 11.459]
  - - [8192, 8192, 1, 256, 8192, 8192, 256, 256]
    - [4, 16.431]
  - - [8192, 8192, 1, 512, 8192, 8192, 512, 512]
    - [5, 22.126]
  - - [8192, 8192, 1, 1024, 8192, 8192, 1024, 1024]
    - [1, 27.375]
  - - [8192, 8192, 1, 2048, 8192, 8192, 2048, 2048]
    - [52, 29.657]
  - - [8192, 8192, 1, 4096, 8192, 8192, 4096, 4096]
    - [54, 32.71]
  - - [8192, 8192, 1, 8192, 8192, 8192, 8192, 8192]
    - [53, 33.506]
  - - [1, 1, 1, 32, 1, 1, 32, 32]
    - [93, 0.0]
- null
- null
- ExperimentalStreamK
- GridBased
