library/src/amd_detail/rocblaslt/src/Tensile/Logic/asm_full/aquavanjaram/gfx942/StreamK/aquavanjaram942_Cijk_Alik_Bljk_BSS_BH_UserArgs.yaml
- {MinimumRequiredVersion: 4.33.0}
- aquavanjaram942
- gfx942
- [Device 0049, Device 0050]
    SolutionIndex: 0
    SolutionNameMin: Cijk_Alik_Bljk_BSS_BH_UserArgs_MT32x32x32_MI16x16x1_SN_LDSB0_CLR1_GSU0_GSUC0_GSUWGMRR0_K1_LBSPPA128_LBSPPB128_MIWT1_1_PLR1_SU32_SUM0_SUS256_SKXCCM0_VWA1_VWB1_WGM1_WGMXCC1_WGMXCCGn1
    SolutionIndex: 1
    SolutionNameMin: Cijk_Alik_Bljk_BSS_BH_UserArgs_MT256x64x64_MI16x16x1_SN_LDSB1_CLR1_GSU0_GSUC0_GSUWGMRR0_K1_LBSPPA256_LBSPPB256_MIWT8_2_PLR1_SU32_SUM0_SUS256_SKXCCM0_VWA2_VWB2_WGM1_WGMXCC1_WGMXCCGn1
    SolutionIndex: 2
    SolutionNameMin: Cijk_Alik_Bljk_BSS_BH_UserArgs_MT128x128x64_MI16x16x1_SN_LDSB1_CLR1_GSU0_GSUC0_GSUWGMRR0_K1_LBSPPA128_LBSPPB128_MIWT4_4_PLR1_SU32_SUM0_SUS256_SKXCCM0_VWA1_VWB1_WGM1_WGMXCC1_WGMXCCGn1
    SolutionIndex: 3
    SolutionNameMin: Cijk_Alik_Bljk_BSS_BH_UserArgs_MT128x128x64_MI16x16x1_SN_LDSB1_CLR1_GSU0_GSUC0_GSUWGMRR0_K1_LBSPPA256_LBSPPB128_MIWT4_4_PLR1_SU32_SUM0_SUS256_SKXCCM0_VWA2_VWB1_WGM1_WGMXCC1_WGMXCCGn1
    SolutionIndex: 4
    SolutionNameMin: Cijk_Alik_Bljk_BSS_BH_UserArgs_MT128x128x64_MI16x16x1_SN_LDSB1_CLR1_GSU0_GSUC0_GSUWGMRR0_K1_LBSPPA512_LBSPPB128_MIWT4_4_PLR1_SU32_SUM0_SUS256_SKXCCM0_VWA4_VWB1_WGM1_WGMXCC1_WGMXCCGn1
    SolutionIndex: 5
    SolutionNameMin: Cijk_Alik_Bljk_BSS_BH_UserArgs_MT128x128x64_MI16x16x1_SN_LDSB1_CLR1_GSU0_GSUC0_GSUWGMRR0_K1_LBSPPA512_LBSPPB256_MIWT4_4_PLR1_SU32_SUM0_SUS256_SKXCCM0_VWA4_VWB2_WGM1_WGMXCC1_WGMXCCGn1
    SolutionIndex: 6
    SolutionNameMin: Cijk_Alik_Bljk_BSS_BH_UserArgs_MT128x128x64_MI16x16x1_SN_LDSB1_CLR1_GSU0_GSUC0_GSUWGMRR0_K1_LBSPPA256_LBSPPB512_MIWT4_4_PLR1_SU32_SUM0_SUS256_SKXCCM0_VWA2_VWB4_WGM1_WGMXCC1_WGMXCCGn1
    SolutionIndex: 7
    SolutionNameMin: Cijk_Alik_Bljk_BSS_BH_UserArgs_MT128x128x64_MI16x16x1_SN_LDSB1_CLR1_GSU0_GSUC0_GSUWGMRR0_K1_LBSPPA512_LBSPPB512_MIWT4_4_PLR1_SU32_SUM0_SUS256_SKXCCM0_VWA4_VWB4_WGM1_WGMXCC1_WGMXCCGn1
    SolutionIndex: 8
    SolutionNameMin: Cijk_Alik_Bljk_BSS_BH_UserArgs_MT128x128x64_MI16x16x1_SN_LDSB1_CLR1_GSU0_GSUC0_GSUWGMRR0_K1_LBSPPA128_LBSPPB128_MIWT4_4_PLR1_SU32_SUM0_SUS256_SKXCCM0_VWA1_VWB1_WGM4_WGMXCC1_WGMXCCGn1
    SolutionIndex: 9
    SolutionNameMin: Cijk_Alik_Bljk_BSS_BH_UserArgs_MT128x128x64_MI16x16x1_SN_LDSB1_CLR1_GSU0_GSUC0_GSUWGMRR0_K1_LBSPPA256_LBSPPB128_MIWT4_4_PLR1_SU32_SUM0_SUS256_SKXCCM0_VWA2_VWB1_WGM4_WGMXCC1_WGMXCCGn1
    SolutionIndex: 10
    SolutionNameMin: Cijk_Alik_Bljk_BSS_BH_UserArgs_MT128x128x64_MI16x16x1_SN_LDSB1_CLR1_GSU0_GSUC0_GSUWGMRR0_K1_LBSPPA512_LBSPPB128_MIWT4_4_PLR1_SU32_SUM0_SUS256_SKXCCM0_VWA4_VWB1_WGM4_WGMXCC1_WGMXCCGn1
    SolutionIndex: 11
    SolutionNameMin: Cijk_Alik_Bljk_BSS_BH_UserArgs_MT128x128x64_MI16x16x1_SN_LDSB1_CLR1_GSU0_GSUC0_GSUWGMRR0_K1_LBSPPA256_LBSPPB256_MIWT4_4_PLR1_SU32_SUM0_SUS256_SKXCCM0_VWA2_VWB2_WGM4_WGMXCC1_WGMXCCGn1
    SolutionIndex: 12
    SolutionNameMin: Cijk_Alik_Bljk_BSS_BH_UserArgs_MT128x128x64_MI16x16x1_SN_LDSB1_CLR1_GSU0_GSUC0_GSUWGMRR0_K1_LBSPPA512_LBSPPB512_MIWT4_4_PLR1_SU32_SUM0_SUS256_SKXCCM0_VWA4_VWB4_WGM4_WGMXCC1_WGMXCCGn1
    SolutionIndex: 13
    SolutionNameMin: Cijk_Alik_Bljk_BSS_BH_UserArgs_MT64x128x64_MI16x16x1_SN_LDSB1_CLR1_GSU0_GSUC0_GSUWGMRR0_K1_LBSPPA128_LBSPPB256_MIWT2_4_PLR1_SU32_SUM0_SUS256_SKXCCM0_VWA1_VWB2_WGM1_WGMXCC1_WGMXCCGn1
    SolutionIndex: 14
    SolutionNameMin: Cijk_Alik_Bljk_BSS_BH_UserArgs_MT64x128x64_MI16x16x1_SN_LDSB1_CLR1_GSU0_GSUC0_GSUWGMRR0_K1_LBSPPA128_LBSPPB512_MIWT2_4_PLR1_SU32_SUM0_SUS256_SKXCCM0_VWA1_VWB4_WGM1_WGMXCC1_WGMXCCGn1
    SolutionIndex: 15
    SolutionNameMin: Cijk_Alik_Bljk_BSS_BH_UserArgs_MT128x64x64_MI16x16x1_SN_LDSB1_CLR1_GSU0_GSUC0_GSUWGMRR0_K1_LBSPPA512_LBSPPB128_MIWT4_2_PLR1_SU32_SUM0_SUS256_SKXCCM0_VWA4_VWB1_WGM1_WGMXCC1_WGMXCCGn1
    SolutionIndex: 16
    SolutionNameMin: Cijk_Alik_Bljk_BSS_BH_UserArgs_MT128x64x64_MI16x16x1_SN_LDSB1_CLR1_GSU0_GSUC0_GSUWGMRR0_K1_LBSPPA512_LBSPPB256_MIWT4_2_PLR1_SU32_SUM0_SUS256_SKXCCM0_VWA4_VWB2_WGM1_WGMXCC1_WGMXCCGn1
    SolutionIndex: 17
    SolutionNameMin: Cijk_Alik_Bljk_BSS_BH_UserArgs_MT128x64x64_MI16x16x1_SN_LDSB1_CLR1_GSU0_GSUC0_GSUWGMRR0_K1_LBSPPA512_LBSPPB128_MIWT4_2_PLR1_SU32_SUM0_SUS256_SKXCCM0_VWA4_VWB1_WGM4_WGMXCC1_WGMXCCGn1
    SolutionIndex: 18
    SolutionNameMin: Cijk_Alik_Bljk_BSS_BH_UserArgs_MT128x64x64_MI16x16x1_SN_LDSB1_CLR1_GSU0_GSUC0_GSUWGMRR0_K1_LBSPPA512_LBSPPB128_MIWT4_2_PLR1_SU32_SUM0_SUS256_SKXCCM0_VWA4_VWB1_WGM8_WGMXCC1_WGMXCCGn1
    SolutionIndex: 19
    SolutionNameMin: Cijk_Alik_Bljk_BSS_BH_UserArgs_MT128x64x64_MI16x16x1_SN_LDSB1_CLR1_GSU0_GSUC0_GSUWGMRR0_K1_LBSPPA512_LBSPPB256_MIWT4_2_PLR1_SU32_SUM0_SUS256_SKXCCM0_VWA4_VWB2_WGM8_WGMXCC1_WGMXCCGn1
    SolutionIndex: 20
    SolutionNameMin: Cijk_Alik_Bljk_BSS_BH_UserArgs_MT32x64x64_MI16x16x1_SN_LDSB0_CLR1_GSU0_GSUC0_GSUWGMRR0_K1_LBSPPA128_LBSPPB128_MIWT1_2_PLR1_SU32_SUM0_SUS256_SKXCCM0_VWA1_VWB1_WGM1_WGMXCC1_WGMXCCGn1
    SolutionIndex: 21
    SolutionNameMin: Cijk_Alik_Bljk_BSS_BH_UserArgs_MT32x64x64_MI16x16x1_SN_LDSB0_CLR1_GSU0_GSUC0_GSUWGMRR0_K1_LBSPPA128_LBSPPB256_MIWT1_2_PLR1_SU32_SUM0_SUS256_SKXCCM0_VWA1_VWB2_WGM1_WGMXCC1_WGMXCCGn1
    SolutionIndex: 22
    SolutionNameMin: Cijk_Alik_Bljk_BSS_BH_UserArgs_MT32x64x64_MI16x16x1_SN_LDSB0_CLR1_GSU0_GSUC0_GSUWGMRR0_K1_LBSPPA128_LBSPPB256_MIWT1_2_PLR1_SU32_SUM0_SUS256_SKXCCM0_VWA1_VWB2_WGM8_WGMXCC1_WGMXCCGn1
    SolutionIndex: 23
    SolutionNameMin: Cijk_Alik_Bljk_BSS_BH_UserArgs_MT32x32x64_MI16x16x1_SN_LDSB0_CLR1_GSU0_GSUC0_GSUWGMRR0_K1_LBSPPA128_LBSPPB128_MIWT1_1_PLR1_SU32_SUM0_SUS256_SKXCCM0_VWA1_VWB1_WGM1_WGMXCC1_WGMXCCGn1
    SolutionIndex: 24
    SolutionNameMin: Cijk_Alik_Bljk_BSS_BH_UserArgs_MT32x32x64_MI16x16x1_SN_LDSB0_CLR1_GSU0_GSUC0_GSUWGMRR0_K1_LBSPPA128_LBSPPB128_MIWT1_1_PLR2_SU32_SUM0_SUS256_SKXCCM0_VWA1_VWB1_WGM1_WGMXCC1_WGMXCCGn1
    SolutionIndex: 25
    SolutionNameMin: Cijk_Alik_Bljk_BSS_BH_UserArgs_MT64x64x128_MI16x16x1_SN_LDSB1_CLR1_GSU0_GSUC0_GSUWGMRR0_K1_LBSPPA256_LBSPPB256_MIWT2_2_PLR1_SU32_SUM0_SUS256_SKXCCM0_VWA1_VWB1_WGM1_WGMXCC1_WGMXCCGn1
    SolutionIndex: 26
    SolutionNameMin: Cijk_Alik_Bljk_BSS_BH_UserArgs_MT64x64x128_MI16x16x1_SN_LDSB1_CLR1_GSU0_GSUC0_GSUWGMRR0_K1_LBSPPA256_LBSPPB512_MIWT2_2_PLR1_SU32_SUM0_SUS256_SKXCCM0_VWA1_VWB2_WGM1_WGMXCC1_WGMXCCGn1
    SolutionIndex: 27
    SolutionNameMin: Cijk_Alik_Bljk_BSS_BH_UserArgs_MT64x64x128_MI16x16x1_SN_LDSB1_CLR1_GSU0_GSUC0_GSUWGMRR0_K1_LBSPPA256_LBSPPB256_MIWT2_2_PLR2_SU32_SUM0_SUS256_SKXCCM0_VWA1_VWB1_WGM1_WGMXCC1_WGMXCCGn1
    SolutionIndex: 28
    SolutionNameMin: Cijk_Alik_Bljk_BSS_BH_UserArgs_MT64x64x128_MI16x16x1_SN_LDSB1_CLR1_GSU0_GSUC0_GSUWGMRR0_K1_LBSPPA256_LBSPPB512_MIWT2_2_PLR2_SU32_SUM0_SUS256_SKXCCM0_VWA1_VWB2_WGM1_WGMXCC1_WGMXCCGn1
    SolutionIndex: 29
    SolutionNameMin: Cijk_Alik_Bljk_BSS_BH_UserArgs_MT64x64x128_MI16x16x1_SN_LDSB1_CLR1_GSU0_GSUC0_GSUWGMRR0_K1_LBSPPA512_LBSPPB512_MIWT2_2_PLR2_SU32_SUM0_SUS256_SKXCCM0_VWA2_VWB2_WGM4_WGMXCC1_WGMXCCGn1
    SolutionIndex: 30
    SolutionNameMin: Cijk_Alik_Bljk_BSS_BH_UserArgs_MT64x64x128_MI16x16x1_SN_LDSB1_CLR1_GSU0_GSUC0_GSUWGMRR0_K1_LBSPPA256_LBSPPB512_MIWT2_2_PLR1_SU32_SUM0_SUS256_SKXCCM0_VWA1_VWB2_WGM8_WGMXCC1_WGMXCCGn1
    SolutionIndex: 31
    SolutionNameMin: Cijk_Alik_Bljk_BSS_BH_UserArgs_MT64x64x128_MI16x16x1_SN_LDSB1_CLR1_GSU0_GSUC0_GSUWGMRR0_K1_LBSPPA512_LBSPPB512_MIWT2_2_PLR1_SU32_SUM0_SUS256_SKXCCM0_VWA2_VWB2_WGM8_WGMXCC1_WGMXCCGn1
    SolutionIndex: 32
    SolutionNameMin: Cijk_Alik_Bljk_BSS_BH_UserArgs_MT64x64x128_MI16x16x1_SN_LDSB1_CLR1_GSU0_GSUC0_GSUWGMRR0_K1_LBSPPA256_LBSPPB256_MIWT2_2_PLR2_SU32_SUM0_SUS256_SKXCCM0_VWA1_VWB1_WGM8_WGMXCC1_WGMXCCGn1
    SolutionIndex: 33
    SolutionNameMin: Cijk_Alik_Bljk_BSS_BH_UserArgs_MT64x64x128_MI16x16x1_SN_LDSB1_CLR1_GSU0_GSUC0_GSUWGMRR0_K1_LBSPPA256_LBSPPB512_MIWT2_2_PLR2_SU32_SUM0_SUS256_SKXCCM0_VWA1_VWB2_WGM8_WGMXCC1_WGMXCCGn1
    SolutionIndex: 34
    SolutionNameMin: Cijk_Alik_Bljk_BSS_BH_UserArgs_MT32x64x128_MI16x16x1_SN_LDSB1_CLR1_GSU0_GSUC0_GSUWGMRR0_K1_LBSPPA256_LBSPPB256_MIWT1_2_PLR2_SU32_SUM0_SUS256_SKXCCM0_VWA1_VWB1_WGM1_WGMXCC1_WGMXCCGn1
    SolutionIndex: 35
    SolutionNameMin: Cijk_Alik_Bljk_BSS_BH_UserArgs_MT64x32x128_MI16x16x1_SN_LDSB1_CLR1_GSU0_GSUC0_GSUWGMRR0_K1_LBSPPA256_LBSPPB256_MIWT2_1_PLR2_SU32_SUM0_SUS256_SKXCCM0_VWA1_VWB1_WGM8_WGMXCC1_WGMXCCGn1
    SolutionIndex: 36
    SolutionNameMin: Cijk_Alik_Bljk_BSS_BH_UserArgs_MT32x32x128_MI16x16x1_SN_LDSB1_CLR1_GSU0_GSUC0_GSUWGMRR0_K1_LBSPPA256_LBSPPB256_MIWT1_1_PLR1_SU32_SUM0_SUS256_SKXCCM0_VWA1_VWB1_WGM1_WGMXCC1_WGMXCCGn1
    SolutionIndex: 37
    SolutionNameMin: Cijk_Alik_Bljk_BSS_BH_UserArgs_MT32x32x128_MI16x16x1_SN_LDSB1_CLR1_GSU0_GSUC0_GSUWGMRR0_K1_LBSPPA256_LBSPPB256_MIWT1_1_PLR2_SU32_SUM0_SUS256_SKXCCM0_VWA1_VWB1_WGM1_WGMXCC1_WGMXCCGn1
    SolutionIndex: 38
    SolutionNameMin: Cijk_Alik_Bljk_BSS_BH_UserArgs_MT32x32x128_MI16x16x1_SN_LDSB1_CLR1_GSU0_GSUC0_GSUWGMRR0_K1_LBSPPA256_LBSPPB256_MIWT1_1_PLR1_SU32_SUM0_SUS256_SKXCCM0_VWA1_VWB1_WGM4_WGMXCC1_WGMXCCGn1
    SolutionIndex: 39
    SolutionNameMin: Cijk_Alik_Bljk_BSS_BH_UserArgs_MT128x128x32_MI16x16x1_SN_LDSB1_CLR1_GSU0_GSUC0_GSUWGMRR0_K1_LBSPPA256_LBSPPB128_MIWT4_4_PLR1_SU32_SUM0_SUS256_SKXCCM8_VWA4_VWB2_WGM1_WGMXCC1_WGMXCCGn1
    SolutionIndex: 40
    SolutionNameMin: Cijk_Alik_Bljk_BSS_BH_UserArgs_MT128x128x32_MI16x16x1_SN_LDSB1_CLR1_GSU0_GSUC0_GSUWGMRR0_K1_LBSPPA256_LBSPPB256_MIWT4_4_PLR1_SU32_SUM0_SUS256_SKXCCM8_VWA4_VWB4_WGM1_WGMXCC1_WGMXCCGn1
    SolutionIndex: 41
    SolutionNameMin: Cijk_Alik_Bljk_BSS_BH_UserArgs_MT128x128x32_MI16x16x1_SN_LDSB1_CLR1_GSU0_GSUC0_GSUWGMRR0_K1_LBSPPA256_LBSPPB256_MIWT4_4_PLR1_SU32_SUM0_SUS256_SKXCCM8_VWA4_VWB4_WGM4_WGMXCC1_WGMXCCGn1
    SolutionIndex: 42
    SolutionNameMin: Cijk_Alik_Bljk_BSS_BH_UserArgs_MT128x128x32_MI16x16x1_SN_LDSB1_CLR1_GSU0_GSUC0_GSUWGMRR0_K1_LBSPPA128_LBSPPB128_MIWT4_4_PLR1_SU32_SUM0_SUS256_SKXCCM8_VWA1_VWB2_WGM8_WGMXCC1_WGMXCCGn1
    SolutionIndex: 43
    SolutionNameMin: Cijk_Alik_Bljk_BSS_BH_UserArgs_MT128x128x64_MI16x16x1_SN_LDSB1_CLR1_GSU0_GSUC0_GSUWGMRR0_K1_LBSPPA128_LBSPPB128_MIWT4_4_PLR1_SU32_SUM0_SUS256_SKXCCM8_VWA1_VWB1_WGM1_WGMXCC1_WGMXCCGn1
    SolutionIndex: 44
    SolutionNameMin: Cijk_Alik_Bljk_BSS_BH_UserArgs_MT128x128x64_MI16x16x1_SN_LDSB1_CLR1_GSU0_GSUC0_GSUWGMRR0_K1_LBSPPA512_LBSPPB128_MIWT4_4_PLR1_SU32_SUM0_SUS256_SKXCCM8_VWA4_VWB1_WGM1_WGMXCC1_WGMXCCGn1
    SolutionIndex: 45
    SolutionNameMin: Cijk_Alik_Bljk_BSS_BH_UserArgs_MT128x128x64_MI16x16x1_SN_LDSB1_CLR1_GSU0_GSUC0_GSUWGMRR0_K1_LBSPPA128_LBSPPB256_MIWT4_4_PLR1_SU32_SUM0_SUS256_SKXCCM8_VWA1_VWB2_WGM1_WGMXCC1_WGMXCCGn1
    SolutionIndex: 46
    SolutionNameMin: Cijk_Alik_Bljk_BSS_BH_UserArgs_MT128x128x64_MI16x16x1_SN_LDSB1_CLR1_GSU0_GSUC0_GSUWGMRR0_K1_LBSPPA512_LBSPPB256_MIWT4_4_PLR1_SU32_SUM0_SUS256_SKXCCM8_VWA4_VWB2_WGM1_WGMXCC1_WGMXCCGn1
    SolutionIndex: 47
    SolutionNameMin: Cijk_Alik_Bljk_BSS_BH_UserArgs_MT128x128x64_MI16x16x1_SN_LDSB1_CLR1_GSU0_GSUC0_GSUWGMRR0_K1_LBSPPA128_LBSPPB512_MIWT4_4_PLR1_SU32_SUM0_SUS256_SKXCCM8_VWA1_VWB4_WGM1_WGMXCC1_WGMXCCGn1
    SolutionIndex: 48
    SolutionNameMin: Cijk_Alik_Bljk_BSS_BH_UserArgs_MT128x128x64_MI16x16x1_SN_LDSB1_CLR1_GSU0_GSUC0_GSUWGMRR0_K1_LBSPPA256_LBSPPB512_MIWT4_4_PLR1_SU32_SUM0_SUS256_SKXCCM8_VWA2_VWB4_WGM1_WGMXCC1_WGMXCCGn1
    SolutionIndex: 49
    SolutionNameMin: Cijk_Alik_Bljk_BSS_BH_UserArgs_MT128x128x64_MI16x16x1_SN_LDSB1_CLR1_GSU0_GSUC0_GSUWGMRR0_K1_LBSPPA512_LBSPPB512_MIWT4_4_PLR1_SU32_SUM0_SUS256_SKXCCM8_VWA4_VWB4_WGM1_WGMXCC1_WGMXCCGn1
    SolutionIndex: 50
    SolutionNameMin: Cijk_Alik_Bljk_BSS_BH_UserArgs_MT128x128x64_MI16x16x1_SN_LDSB1_CLR1_GSU0_GSUC0_GSUWGMRR0_K1_LBSPPA128_LBSPPB128_MIWT4_4_PLR1_SU32_SUM0_SUS256_SKXCCM8_VWA1_VWB1_WGM4_WGMXCC1_WGMXCCGn1
    SolutionIndex: 51
    SolutionNameMin: Cijk_Alik_Bljk_BSS_BH_UserArgs_MT128x128x64_MI16x16x1_SN_LDSB1_CLR1_GSU0_GSUC0_GSUWGMRR0_K1_LBSPPA512_LBSPPB128_MIWT4_4_PLR1_SU32_SUM0_SUS256_SKXCCM8_VWA4_VWB1_WGM4_WGMXCC1_WGMXCCGn1
    SolutionIndex: 52
    SolutionNameMin: Cijk_Alik_Bljk_BSS_BH_UserArgs_MT128x128x64_MI16x16x1_SN_LDSB1_CLR1_GSU0_GSUC0_GSUWGMRR0_K1_LBSPPA512_LBSPPB256_MIWT4_4_PLR1_SU32_SUM0_SUS256_SKXCCM8_VWA4_VWB2_WGM4_WGMXCC1_WGMXCCGn1
    SolutionIndex: 53
    SolutionNameMin: Cijk_Alik_Bljk_BSS_BH_UserArgs_MT128x128x64_MI16x16x1_SN_LDSB1_CLR1_GSU0_GSUC0_GSUWGMRR0_K1_LBSPPA512_LBSPPB512_MIWT4_4_PLR1_SU32_SUM0_SUS256_SKXCCM8_VWA4_VWB4_WGM4_WGMXCC1_WGMXCCGn1
    SolutionIndex: 54
    SolutionNameMin: Cijk_Alik_Bljk_BSS_BH_UserArgs_MT128x128x64_MI16x16x1_SN_LDSB1_CLR1_GSU0_GSUC0_GSUWGMRR0_K1_LBSPPA128_LBSPPB128_MIWT4_4_PLR1_SU32_SUM0_SUS256_SKXCCM8_VWA1_VWB1_WGM8_WGMXCC1_WGMXCCGn1
    SolutionIndex: 55
    SolutionNameMin: Cijk_Alik_Bljk_BSS_BH_UserArgs_MT128x128x64_MI16x16x1_SN_LDSB1_CLR1_GSU0_GSUC0_GSUWGMRR0_K1_LBSPPA512_LBSPPB128_MIWT4_4_PLR1_SU32_SUM0_SUS256_SKXCCM8_VWA4_VWB1_WGM8_WGMXCC1_WGMXCCGn1
    SolutionIndex: 56
    SolutionNameMin: Cijk_Alik_Bljk_BSS_BH_UserArgs_MT128x128x64_MI16x16x1_SN_LDSB1_CLR1_GSU0_GSUC0_GSUWGMRR0_K1_LBSPPA128_LBSPPB256_MIWT4_4_PLR1_SU32_SUM0_SUS256_SKXCCM8_VWA1_VWB2_WGM8_WGMXCC1_WGMXCCGn1
    SolutionIndex: 57
    SolutionNameMin: Cijk_Alik_Bljk_BSS_BH_UserArgs_MT128x128x64_MI16x16x1_SN_LDSB1_CLR1_GSU0_GSUC0_GSUWGMRR0_K1_LBSPPA512_LBSPPB256_MIWT4_4_PLR1_SU32_SUM0_SUS256_SKXCCM8_VWA4_VWB2_WGM8_WGMXCC1_WGMXCCGn1
    SolutionIndex: 58
    SolutionNameMin: Cijk_Alik_Bljk_BSS_BH_UserArgs_MT128x128x64_MI16x16x1_SN_LDSB1_CLR1_GSU0_GSUC0_GSUWGMRR0_K1_LBSPPA128_LBSPPB512_MIWT4_4_PLR1_SU32_SUM0_SUS256_SKXCCM8_VWA1_VWB4_WGM8_WGMXCC1_WGMXCCGn1
    SolutionIndex: 59
    SolutionNameMin: Cijk_Alik_Bljk_BSS_BH_UserArgs_MT128x128x64_MI16x16x1_SN_LDSB1_CLR1_GSU0_GSUC0_GSUWGMRR0_K1_LBSPPA512_LBSPPB512_MIWT4_4_PLR1_SU32_SUM0_SUS256_SKXCCM8_VWA4_VWB4_WGM8_WGMXCC1_WGMXCCGn1
    SolutionIndex: 60
    SolutionNameMin: Cijk_Alik_Bljk_BSS_BH_UserArgs_MT64x128x64_MI16x16x1_SN_LDSB1_CLR1_GSU0_GSUC0_GSUWGMRR0_K1_LBSPPA128_LBSPPB128_MIWT2_4_PLR1_SU32_SUM0_SUS256_SKXCCM8_VWA1_VWB1_WGM1_WGMXCC1_WGMXCCGn1
    SolutionIndex: 61
    SolutionNameMin: Cijk_Alik_Bljk_BSS_BH_UserArgs_MT64x128x64_MI16x16x1_SN_LDSB1_CLR1_GSU0_GSUC0_GSUWGMRR0_K1_LBSPPA128_LBSPPB256_MIWT2_4_PLR1_SU32_SUM0_SUS256_SKXCCM8_VWA1_VWB2_WGM1_WGMXCC1_WGMXCCGn1
    SolutionIndex: 62
    SolutionNameMin: Cijk_Alik_Bljk_BSS_BH_UserArgs_MT64x128x64_MI16x16x1_SN_LDSB1_CLR1_GSU0_GSUC0_GSUWGMRR0_K1_LBSPPA128_LBSPPB512_MIWT2_4_PLR1_SU32_SUM0_SUS256_SKXCCM8_VWA1_VWB4_WGM1_WGMXCC1_WGMXCCGn1
    SolutionIndex: 63
    SolutionNameMin: Cijk_Alik_Bljk_BSS_BH_UserArgs_MT64x128x64_MI16x16x1_SN_LDSB1_CLR1_GSU0_GSUC0_GSUWGMRR0_K1_LBSPPA128_LBSPPB512_MIWT2_4_PLR1_SU32_SUM0_SUS256_SKXCCM8_VWA1_VWB4_WGM4_WGMXCC1_WGMXCCGn1
    SolutionIndex: 64
    SolutionNameMin: Cijk_Alik_Bljk_BSS_BH_UserArgs_MT64x128x64_MI16x16x1_SN_LDSB1_CLR1_GSU0_GSUC0_GSUWGMRR0_K1_LBSPPA128_LBSPPB256_MIWT2_4_PLR1_SU32_SUM0_SUS256_SKXCCM8_VWA1_VWB2_WGM8_WGMXCC1_WGMXCCGn1
    SolutionIndex: 65
    SolutionNameMin: Cijk_Alik_Bljk_BSS_BH_UserArgs_MT128x64x64_MI16x16x1_SN_LDSB1_CLR1_GSU0_GSUC0_GSUWGMRR0_K1_LBSPPA128_LBSPPB128_MIWT4_2_PLR1_SU32_SUM0_SUS256_SKXCCM8_VWA1_VWB1_WGM1_WGMXCC1_WGMXCCGn1
    SolutionIndex: 66
    SolutionNameMin: Cijk_Alik_Bljk_BSS_BH_UserArgs_MT128x64x64_MI16x16x1_SN_LDSB1_CLR1_GSU0_GSUC0_GSUWGMRR0_K1_LBSPPA512_LBSPPB128_MIWT4_2_PLR1_SU32_SUM0_SUS256_SKXCCM8_VWA4_VWB1_WGM1_WGMXCC1_WGMXCCGn1
    SolutionIndex: 67
    SolutionNameMin: Cijk_Alik_Bljk_BSS_BH_UserArgs_MT128x64x64_MI16x16x1_SN_LDSB1_CLR1_GSU0_GSUC0_GSUWGMRR0_K1_LBSPPA512_LBSPPB256_MIWT4_2_PLR1_SU32_SUM0_SUS256_SKXCCM8_VWA4_VWB2_WGM1_WGMXCC1_WGMXCCGn1
    SolutionIndex: 68
    SolutionNameMin: Cijk_Alik_Bljk_BSS_BH_UserArgs_MT128x64x64_MI16x16x1_SN_LDSB1_CLR1_GSU0_GSUC0_GSUWGMRR0_K1_LBSPPA128_LBSPPB128_MIWT4_2_PLR1_SU32_SUM0_SUS256_SKXCCM8_VWA1_VWB1_WGM4_WGMXCC1_WGMXCCGn1
    SolutionIndex: 69
    SolutionNameMin: Cijk_Alik_Bljk_BSS_BH_UserArgs_MT128x64x64_MI16x16x1_SN_LDSB1_CLR1_GSU0_GSUC0_GSUWGMRR0_K1_LBSPPA512_LBSPPB128_MIWT4_2_PLR1_SU32_SUM0_SUS256_SKXCCM8_VWA4_VWB1_WGM8_WGMXCC1_WGMXCCGn1
    SolutionIndex: 70
    SolutionNameMin: Cijk_Alik_Bljk_BSS_BH_UserArgs_MT128x64x64_MI16x16x1_SN_LDSB1_CLR1_GSU0_GSUC0_GSUWGMRR0_K1_LBSPPA512_LBSPPB256_MIWT4_2_PLR1_SU32_SUM0_SUS256_SKXCCM8_VWA4_VWB2_WGM8_WGMXCC1_WGMXCCGn1
    SolutionIndex: 71
    SolutionNameMin: Cijk_Alik_Bljk_BSS_BH_UserArgs_MT64x64x64_MI16x16x1_SN_LDSB1_CLR1_GSU0_GSUC0_GSUWGMRR0_K1_LBSPPA128_LBSPPB128_MIWT2_2_PLR1_SU32_SUM0_SUS256_SKXCCM8_VWA1_VWB1_WGM1_WGMXCC1_WGMXCCGn1
    SolutionIndex: 72
    SolutionNameMin: Cijk_Alik_Bljk_BSS_BH_UserArgs_MT64x64x64_MI16x16x1_SN_LDSB1_CLR1_GSU0_GSUC0_GSUWGMRR0_K1_LBSPPA128_LBSPPB256_MIWT2_2_PLR1_SU32_SUM0_SUS256_SKXCCM8_VWA1_VWB2_WGM1_WGMXCC1_WGMXCCGn1
    SolutionIndex: 73
    SolutionNameMin: Cijk_Alik_Bljk_BSS_BH_UserArgs_MT64x64x64_MI16x16x1_SN_LDSB1_CLR1_GSU0_GSUC0_GSUWGMRR0_K1_LBSPPA128_LBSPPB128_MIWT2_2_PLR1_SU32_SUM0_SUS256_SKXCCM8_VWA1_VWB1_WGM4_WGMXCC1_WGMXCCGn1
    SolutionIndex: 74
    SolutionNameMin: Cijk_Alik_Bljk_BSS_BH_UserArgs_MT64x64x64_MI16x16x1_SN_LDSB1_CLR1_GSU0_GSUC0_GSUWGMRR0_K1_LBSPPA128_LBSPPB128_MIWT2_2_PLR1_SU32_SUM0_SUS256_SKXCCM8_VWA1_VWB1_WGM8_WGMXCC1_WGMXCCGn1
    SolutionIndex: 75
    SolutionNameMin: Cijk_Alik_Bljk_BSS_BH_UserArgs_MT32x64x64_MI16x16x1_SN_LDSB0_CLR1_GSU0_GSUC0_GSUWGMRR0_K1_LBSPPA128_LBSPPB128_MIWT1_2_PLR1_SU32_SUM0_SUS256_SKXCCM8_VWA1_VWB1_WGM1_WGMXCC1_WGMXCCGn1
    SolutionIndex: 76
    SolutionNameMin: Cijk_Alik_Bljk_BSS_BH_UserArgs_MT32x64x64_MI16x16x1_SN_LDSB0_CLR1_GSU0_GSUC0_GSUWGMRR0_K1_LBSPPA128_LBSPPB256_MIWT1_2_PLR1_SU32_SUM0_SUS256_SKXCCM8_VWA1_VWB2_WGM1_WGMXCC1_WGMXCCGn1
    SolutionIndex: 77
    SolutionNameMin: Cijk_Alik_Bljk_BSS_BH_UserArgs_MT32x64x64_MI16x16x1_SN_LDSB0_CLR1_GSU0_GSUC0_GSUWGMRR0_K1_LBSPPA128_LBSPPB128_MIWT1_2_PLR1_SU32_SUM0_SUS256_SKXCCM8_VWA1_VWB1_WGM4_WGMXCC1_WGMXCCGn1
    SolutionIndex: 78
    SolutionNameMin: Cijk_Alik_Bljk_BSS_BH_UserArgs_MT32x64x64_MI16x16x1_SN_LDSB0_CLR1_GSU0_GSUC0_GSUWGMRR0_K1_LBSPPA128_LBSPPB128_MIWT1_2_PLR1_SU32_SUM0_SUS256_SKXCCM8_VWA1_VWB1_WGM8_WGMXCC1_WGMXCCGn1
    SolutionIndex: 79
    SolutionNameMin: Cijk_Alik_Bljk_BSS_BH_UserArgs_MT64x32x64_MI16x16x1_SN_LDSB0_CLR1_GSU0_GSUC0_GSUWGMRR0_K1_LBSPPA128_LBSPPB128_MIWT2_1_PLR1_SU32_SUM0_SUS256_SKXCCM8_VWA1_VWB1_WGM1_WGMXCC1_WGMXCCGn1
    SolutionIndex: 80
    SolutionNameMin: Cijk_Alik_Bljk_BSS_BH_UserArgs_MT64x32x64_MI16x16x1_SN_LDSB0_CLR1_GSU0_GSUC0_GSUWGMRR0_K1_LBSPPA256_LBSPPB128_MIWT2_1_PLR1_SU32_SUM0_SUS256_SKXCCM8_VWA2_VWB1_WGM1_WGMXCC1_WGMXCCGn1
    SolutionIndex: 81
    SolutionNameMin: Cijk_Alik_Bljk_BSS_BH_UserArgs_MT32x32x64_MI16x16x1_SN_LDSB0_CLR1_GSU0_GSUC0_GSUWGMRR0_K1_LBSPPA128_LBSPPB128_MIWT1_1_PLR1_SU32_SUM0_SUS256_SKXCCM8_VWA1_VWB1_WGM1_WGMXCC1_WGMXCCGn1
    SolutionIndex: 82
    SolutionNameMin: Cijk_Alik_Bljk_BSS_BH_UserArgs_MT32x32x64_MI16x16x1_SN_LDSB0_CLR1_GSU0_GSUC0_GSUWGMRR0_K1_LBSPPA128_LBSPPB128_MIWT1_1_PLR2_SU32_SUM0_SUS256_SKXCCM8_VWA1_VWB1_WGM1_WGMXCC1_WGMXCCGn1
    SolutionIndex: 83
    SolutionNameMin: Cijk_Alik_Bljk_BSS_BH_UserArgs_MT32x32x64_MI16x16x1_SN_LDSB0_CLR1_GSU0_GSUC0_GSUWGMRR0_K1_LBSPPA128_LBSPPB128_MIWT1_1_PLR1_SU32_SUM0_SUS256_SKXCCM8_VWA1_VWB1_WGM4_WGMXCC1_WGMXCCGn1
    SolutionIndex: 84
    SolutionNameMin: Cijk_Alik_Bljk_BSS_BH_UserArgs_MT64x64x128_MI16x16x1_SN_LDSB1_CLR1_GSU0_GSUC0_GSUWGMRR0_K1_LBSPPA256_LBSPPB256_MIWT2_2_PLR1_SU32_SUM0_SUS256_SKXCCM8_VWA1_VWB1_WGM1_WGMXCC1_WGMXCCGn1
    SolutionIndex: 85
    SolutionNameMin: Cijk_Alik_Bljk_BSS_BH_UserArgs_MT64x64x128_MI16x16x1_SN_LDSB1_CLR1_GSU0_GSUC0_GSUWGMRR0_K1_LBSPPA256_LBSPPB512_MIWT2_2_PLR1_SU32_SUM0_SUS256_SKXCCM8_VWA1_VWB2_WGM1_WGMXCC1_WGMXCCGn1
    SolutionIndex: 86
    SolutionNameMin: Cijk_Alik_Bljk_BSS_BH_UserArgs_MT64x64x128_MI16x16x1_SN_LDSB1_CLR1_GSU0_GSUC0_GSUWGMRR0_K1_LBSPPA256_LBSPPB256_MIWT2_2_PLR2_SU32_SUM0_SUS256_SKXCCM8_VWA1_VWB1_WGM1_WGMXCC1_WGMXCCGn1
    SolutionIndex: 87
    SolutionNameMin: Cijk_Alik_Bljk_BSS_BH_UserArgs_MT64x64x128_MI16x16x1_SN_LDSB1_CLR1_GSU0_GSUC0_GSUWGMRR0_K1_LBSPPA256_LBSPPB256_MIWT2_2_PLR1_SU32_SUM0_SUS256_SKXCCM8_VWA1_VWB1_WGM4_WGMXCC1_WGMXCCGn1
    SolutionIndex: 88
    SolutionNameMin: Cijk_Alik_Bljk_BSS_BH_UserArgs_MT64x64x128_MI16x16x1_SN_LDSB1_CLR1_GSU0_GSUC0_GSUWGMRR0_K1_LBSPPA256_LBSPPB512_MIWT2_2_PLR1_SU32_SUM0_SUS256_SKXCCM8_VWA1_VWB2_WGM4_WGMXCC1_WGMXCCGn1
    SolutionIndex: 89
    SolutionNameMin: Cijk_Alik_Bljk_BSS_BH_UserArgs_MT64x64x128_MI16x16x1_SN_LDSB1_CLR1_GSU0_GSUC0_GSUWGMRR0_K1_LBSPPA256_LBSPPB512_MIWT2_2_PLR2_SU32_SUM0_SUS256_SKXCCM8_VWA1_VWB2_WGM4_WGMXCC1_WGMXCCGn1
    SolutionIndex: 90
    SolutionNameMin: Cijk_Alik_Bljk_BSS_BH_UserArgs_MT64x64x128_MI16x16x1_SN_LDSB1_CLR1_GSU0_GSUC0_GSUWGMRR0_K1_LBSPPA512_LBSPPB512_MIWT2_2_PLR2_SU32_SUM0_SUS256_SKXCCM8_VWA2_VWB2_WGM4_WGMXCC1_WGMXCCGn1
    SolutionIndex: 91
    SolutionNameMin: Cijk_Alik_Bljk_BSS_BH_UserArgs_MT64x64x128_MI16x16x1_SN_LDSB1_CLR1_GSU0_GSUC0_GSUWGMRR0_K1_LBSPPA256_LBSPPB256_MIWT2_2_PLR1_SU32_SUM0_SUS256_SKXCCM8_VWA1_VWB1_WGM8_WGMXCC1_WGMXCCGn1
    SolutionIndex: 92
    SolutionNameMin: Cijk_Alik_Bljk_BSS_BH_UserArgs_MT64x64x128_MI16x16x1_SN_LDSB1_CLR1_GSU0_GSUC0_GSUWGMRR0_K1_LBSPPA256_LBSPPB512_MIWT2_2_PLR1_SU32_SUM0_SUS256_SKXCCM8_VWA1_VWB2_WGM8_WGMXCC1_WGMXCCGn1
    SolutionIndex: 93
    SolutionNameMin: Cijk_Alik_Bljk_BSS_BH_UserArgs_MT64x64x128_MI16x16x1_SN_LDSB1_CLR1_GSU0_GSUC0_GSUWGMRR0_K1_LBSPPA256_LBSPPB256_MIWT2_2_PLR2_SU32_SUM0_SUS256_SKXCCM8_VWA1_VWB1_WGM8_WGMXCC1_WGMXCCGn1
    SolutionIndex: 94
    SolutionNameMin: Cijk_Alik_Bljk_BSS_BH_UserArgs_MT64x64x128_MI16x16x1_SN_LDSB1_CLR1_GSU0_GSUC0_GSUWGMRR0_K1_LBSPPA512_LBSPPB256_MIWT2_2_PLR2_SU32_SUM0_SUS256_SKXCCM8_VWA2_VWB1_WGM8_WGMXCC1_WGMXCCGn1
    SolutionIndex: 95
    SolutionNameMin: Cijk_Alik_Bljk_BSS_BH_UserArgs_MT64x64x128_MI16x16x1_SN_LDSB1_CLR1_GSU0_GSUC0_GSUWGMRR0_K1_LBSPPA256_LBSPPB512_MIWT2_2_PLR2_SU32_SUM0_SUS256_SKXCCM8_VWA1_VWB2_WGM8_WGMXCC1_WGMXCCGn1
    SolutionIndex: 96
    SolutionNameMin: Cijk_Alik_Bljk_BSS_BH_UserArgs_MT64x32x128_MI16x16x1_SN_LDSB1_CLR1_GSU0_GSUC0_GSUWGMRR0_K1_LBSPPA256_LBSPPB256_MIWT2_1_PLR2_SU32_SUM0_SUS256_SKXCCM8_VWA1_VWB1_WGM1_WGMXCC1_WGMXCCGn1
    SolutionIndex: 97
    SolutionNameMin: Cijk_Alik_Bljk_BSS_BH_UserArgs_MT64x32x128_MI16x16x1_SN_LDSB1_CLR1_GSU0_GSUC0_GSUWGMRR0_K1_LBSPPA512_LBSPPB256_MIWT2_1_PLR2_SU32_SUM0_SUS256_SKXCCM8_VWA2_VWB1_WGM1_WGMXCC1_WGMXCCGn1
    SolutionIndex: 98
    SolutionNameMin: Cijk_Alik_Bljk_BSS_BH_UserArgs_MT64x32x128_MI16x16x1_SN_LDSB1_CLR1_GSU0_GSUC0_GSUWGMRR0_K1_LBSPPA256_LBSPPB256_MIWT2_1_PLR2_SU32_SUM0_SUS256_SKXCCM8_VWA1_VWB1_WGM4_WGMXCC1_WGMXCCGn1
    SolutionIndex: 99
    SolutionNameMin: Cijk_Alik_Bljk_BSS_BH_UserArgs_MT64x32x128_MI16x16x1_SN_LDSB1_CLR1_GSU0_GSUC0_GSUWGMRR0_K1_LBSPPA512_LBSPPB256_MIWT2_1_PLR2_SU32_SUM0_SUS256_SKXCCM8_VWA2_VWB1_WGM4_WGMXCC1_WGMXCCGn1
    SolutionIndex: 100
    SolutionNameMin: Cijk_Alik_Bljk_BSS_BH_UserArgs_MT32x32x128_MI16x16x1_SN_LDSB1_CLR1_GSU0_GSUC0_GSUWGMRR0_K1_LBSPPA256_LBSPPB256_MIWT1_1_PLR1_SU32_SUM0_SUS256_SKXCCM8_VWA1_VWB1_WGM1_WGMXCC1_WGMXCCGn1
    SolutionIndex: 101
    SolutionNameMin: Cijk_Alik_Bljk_BSS_BH_UserArgs_MT32x32x128_MI16x16x1_SN_LDSB1_CLR1_GSU0_GSUC0_GSUWGMRR0_K1_LBSPPA256_LBSPPB256_MIWT1_1_PLR2_SU32_SUM0_SUS256_SKXCCM8_VWA1_VWB1_WGM1_WGMXCC1_WGMXCCGn1
    SolutionIndex: 102
    SolutionNameMin: Cijk_Alik_Bljk_BSS_BH_UserArgs_MT32x32x128_MI16x16x1_SN_LDSB1_CLR1_GSU0_GSUC0_GSUWGMRR0_K1_LBSPPA256_LBSPPB256_MIWT1_1_PLR2_SU32_SUM0_SUS256_SKXCCM8_VWA1_VWB1_WGM4_WGMXCC1_WGMXCCGn1
    SolutionIndex: 103
    SolutionNameMin: Cijk_Alik_Bljk_BSS_BH_UserArgs_MT32x32x128_MI16x16x1_SN_LDSB1_CLR1_GSU0_GSUC0_GSUWGMRR0_K1_LBSPPA256_LBSPPB256_MIWT1_1_PLR1_SU32_SUM0_SUS256_SKXCCM8_VWA1_VWB1_WGM8_WGMXCC1_WGMXCCGn1
    SolutionIndex: 104
    SolutionNameMin: Cijk_Alik_Bljk_BSS_BH_UserArgs_MT32x32x128_MI16x16x1_SN_LDSB1_CLR1_GSU0_GSUC0_GSUWGMRR0_K1_LBSPPA256_LBSPPB256_MIWT1_1_PLR2_SU32_SUM0_SUS256_SKXCCM8_VWA1_VWB1_WGM8_WGMXCC1_WGMXCCGn1
    SolutionIndex: 105
    SolutionNameMin: Cijk_Alik_Bljk_BSS_BH_UserArgs_MT32x32x32_MI16x16x1_SN_LDSB0_CLR1_GSU0_GSUC0_GSUWGMRR0_K1_LBSPPA128_LBSPPB128_MIWT1_1_PLR1_SU32_SUM0_SUS256_SKXCCM0_VWA1_VWB1_WGM4_WGMXCC1_WGMXCCGn1
- - - [128, 128, 1, 128, 128, 128, 128, 128]
    - [24, 0.092]
  - - [128, 128, 1, 256, 128, 128, 256, 256]
    - [23, 0.168]
  - - [128, 128, 1, 512, 128, 128, 512, 512]
    - [81, 0.298]
  - - [128, 128, 1, 1024, 128, 128, 1024, 1024]
    - [36, 0.464]
  - - [128, 128, 1, 2048, 128, 128, 2048, 2048]
    - [36, 0.665]
  - - [128, 128, 1, 4096, 128, 128, 4096, 4096]
    - [81, 1.153]
  - - [128, 128, 1, 8192, 128, 128, 8192, 8192]
    - [101, 1.861]
  - - [128, 256, 1, 128, 128, 128, 128, 128]
    - [0, 0.179]
  - - [128, 256, 1, 256, 128, 128, 256, 256]
    - [36, 0.332]
  - - [128, 256, 1, 512, 128, 128, 512, 512]
    - [81, 0.601]
  - - [128, 256, 1, 1024, 128, 128, 1024, 1024]
    - [36, 0.951]
  - - [128, 256, 1, 2048, 128, 128, 2048, 2048]
    - [37, 1.31]
  - - [128, 256, 1, 4096, 128, 128, 4096, 4096]
    - [81, 2.31]
  - - [128, 256, 1, 8192, 128, 128, 8192, 8192]
    - [101, 3.688]
  - - [128, 512, 1, 128, 128, 128, 128, 128]
    - [101, 0.361]
  - - [128, 512, 1, 256, 128, 128, 256, 256]
    - [81, 0.675]
  - - [128, 512, 1, 512, 128, 128, 512, 512]
    - [81, 1.184]
  - - [128, 512, 1, 1024, 128, 128, 1024, 1024]
    - [100, 1.87]
  - - [128, 512, 1, 2048, 128, 128, 2048, 2048]
    - [100, 2.556]
  - - [128, 512, 1, 4096, 128, 128, 4096, 4096]
    - [81, 4.455]
  - - [128, 512, 1, 8192, 128, 128, 8192, 8192]
    - [101, 6.923]
  - - [128, 1024, 1, 128, 128, 128, 128, 128]
    - [23, 0.73]
  - - [128, 1024, 1, 256, 128, 128, 256, 256]
    - [81, 1.362]
  - - [128, 1024, 1, 512, 128, 128, 512, 512]
    - [81, 2.218]
  - - [128, 1024, 1, 1024, 128, 128, 1024, 1024]
    - [101, 3.682]
  - - [128, 1024, 1, 2048, 128, 128, 2048, 2048]
    - [81, 4.964]
  - - [128, 1024, 1, 4096, 128, 128, 4096, 4096]
    - [101, 7.645]
  - - [128, 1024, 1, 8192, 128, 128, 8192, 8192]
    - [35, 10.583]
  - - [128, 2048, 1, 128, 128, 128, 128, 128]
    - [81, 1.409]
  - - [128, 2048, 1, 256, 128, 128, 256, 256]
    - [100, 2.535]
  - - [128, 2048, 1, 512, 128, 128, 512, 512]
    - [100, 4.239]
  - - [128, 2048, 1, 1024, 128, 128, 1024, 1024]
    - [101, 7.083]
  - - [128, 2048, 1, 2048, 128, 128, 2048, 2048]
    - [101, 9.985]
  - - [128, 2048, 1, 4096, 128, 128, 4096, 4096]
    - [101, 11.548]
  - - [128, 2048, 1, 8192, 128, 128, 8192, 8192]
    - [32, 14.411]
  - - [128, 4096, 1, 128, 128, 128, 128, 128]
    - [80, 2.479]
  - - [128, 4096, 1, 256, 128, 128, 256, 256]
    - [97, 4.33]
  - - [128, 4096, 1, 512, 128, 128, 512, 512]
    - [75, 7.654]
  - - [128, 4096, 1, 1024, 128, 128, 1024, 1024]
    - [80, 11.157]
  - - [128, 4096, 1, 2048, 128, 128, 2048, 2048]
    - [96, 13.518]
  - - [128, 4096, 1, 4096, 128, 128, 4096, 4096]
    - [95, 15.171]
  - - [128, 4096, 1, 8192, 128, 128, 8192, 8192]
    - [16, 16.97]
  - - [128, 8192, 1, 128, 128, 128, 128, 128]
    - [71, 4.137]
  - - [128, 8192, 1, 256, 128, 128, 256, 256]
    - [71, 7.291]
  - - [128, 8192, 1, 512, 128, 128, 512, 512]
    - [71, 11.744]
  - - [128, 8192, 1, 1024, 128, 128, 1024, 1024]
    - [71, 15.739]
  - - [128, 8192, 1, 2048, 128, 128, 2048, 2048]
    - [86, 17.042]
  - - [128, 8192, 1, 4096, 128, 128, 4096, 4096]
    - [46, 19.09]
  - - [128, 8192, 1, 8192, 128, 128, 8192, 8192]
    - [10, 22.073]
  - - [256, 128, 1, 128, 256, 256, 128, 128]
    - [101, 0.182]
  - - [256, 128, 1, 256, 256, 256, 256, 256]
    - [36, 0.336]
  - - [256, 128, 1, 512, 256, 256, 512, 512]
    - [23, 0.592]
  - - [256, 128, 1, 1024, 256, 256, 1024, 1024]
    - [37, 0.937]
  - - [256, 128, 1, 2048, 256, 256, 2048, 2048]
    - [101, 1.307]
  - - [256, 128, 1, 4096, 256, 256, 4096, 4096]
    - [81, 2.261]
  - - [256, 128, 1, 8192, 256, 256, 8192, 8192]
    - [100, 3.594]
  - - [256, 256, 1, 128, 256, 256, 128, 128]
    - [100, 0.364]
  - - [256, 256, 1, 256, 256, 256, 256, 256]
    - [100, 0.678]
  - - [256, 256, 1, 512, 256, 256, 512, 512]
    - [81, 1.184]
  - - [256, 256, 1, 1024, 256, 256, 1024, 1024]
    - [36, 1.862]
  - - [256, 256, 1, 2048, 256, 256, 2048, 2048]
    - [101, 2.545]
  - - [256, 256, 1, 4096, 256, 256, 4096, 4096]
    - [81, 4.442]
  - - [256, 256, 1, 8192, 256, 256, 8192, 8192]
    - [102, 6.9]
  - - [256, 512, 1, 128, 256, 256, 128, 128]
    - [81, 0.728]
  - - [256, 512, 1, 256, 256, 256, 256, 256]
    - [23, 1.331]
  - - [256, 512, 1, 512, 256, 256, 512, 512]
    - [81, 2.323]
  - - [256, 512, 1, 1024, 256, 256, 1024, 1024]
    - [37, 3.684]
  - - [256, 512, 1, 2048, 256, 256, 2048, 2048]
    - [81, 4.91]
  - - [256, 512, 1, 4096, 256, 256, 4096, 4096]
    - [36, 7.599]
  - - [256, 512, 1, 8192, 256, 256, 8192, 8192]
    - [98, 10.208]
  - - [256, 1024, 1, 128, 256, 256, 128, 128]
    - [82, 1.395]
  - - [256, 1024, 1, 256, 256, 256, 256, 256]
    - [81, 2.56]
  - - [256, 1024, 1, 512, 256, 256, 512, 512]
    - [81, 4.326]
  - - [256, 1024, 1, 1024, 256, 256, 1024, 1024]
    - [101, 7.119]
  - - [256, 1024, 1, 2048, 256, 256, 2048, 2048]
    - [38, 9.841]
  - - [256, 1024, 1, 4096, 256, 256, 4096, 4096]
    - [101, 11.569]
  - - [256, 1024, 1, 8192, 256, 256, 8192, 8192]
    - [27, 14.737]
  - - [256, 2048, 1, 128, 256, 256, 128, 128]
    - [21, 2.474]
  - - [256, 2048, 1, 256, 256, 256, 256, 256]
    - [79, 4.45]
  - - [256, 2048, 1, 512, 256, 256, 512, 512]
    - [76, 7.614]
  - - [256, 2048, 1, 1024, 256, 256, 1024, 1024]
    - [79, 11.049]
  - - [256, 2048, 1, 2048, 256, 256, 2048, 2048]
    - [96, 13.529]
  - - [256, 2048, 1, 4096, 256, 256, 4096, 4096]
    - [30, 15.825]
  - - [256, 2048, 1, 8192, 256, 256, 8192, 8192]
    - [94, 17.116]
  - - [256, 4096, 1, 128, 256, 256, 128, 128]
    - [71, 4.069]
  - - [256, 4096, 1, 256, 256, 256, 256, 256]
    - [71, 7.255]
  - - [256, 4096, 1, 512, 256, 256, 512, 512]
    - [71, 11.73]
  - - [256, 4096, 1, 1024, 256, 256, 1024, 1024]
    - [84, 15.812]
  - - [256, 4096, 1, 2048, 256, 256, 2048, 2048]
    - [85, 18.903]
  - - [256, 4096, 1, 4096, 256, 256, 4096, 4096]
    - [31, 19.955]
  - - [256, 4096, 1, 8192, 256, 256, 8192, 8192]
    - [55, 21.802]
  - - [256, 8192, 1, 128, 256, 256, 128, 128]
    - [62, 6.073]
  - - [256, 8192, 1, 256, 256, 256, 256, 256]
    - [62, 10.18]
  - - [256, 8192, 1, 512, 256, 256, 512, 512]
    - [62, 15.157]
  - - [256, 8192, 1, 1024, 256, 256, 1024, 1024]
    - [66, 19.439]
  - - [256, 8192, 1, 2048, 256, 256, 2048, 2048]
    - [67, 21.608]
  - - [256, 8192, 1, 4096, 256, 256, 4096, 4096]
    - [55, 23.893]
  - - [256, 8192, 1, 8192, 256, 256, 8192, 8192]
    - [55, 26.509]
  - - [512, 128, 1, 128, 512, 512, 128, 128]
    - [100, 0.362]
  - - [512, 128, 1, 256, 512, 512, 256, 256]
    - [23, 0.671]
  - - [512, 128, 1, 512, 512, 512, 512, 512]
    - [23, 1.172]
  - - [512, 128, 1, 1024, 512, 512, 1024, 1024]
    - [101, 1.852]
  - - [512, 128, 1, 2048, 512, 512, 2048, 2048]
    - [103, 2.563]
  - - [512, 128, 1, 4096, 512, 512, 4096, 4096]
    - [81, 4.432]
  - - [512, 128, 1, 8192, 512, 512, 8192, 8192]
    - [104, 6.821]
  - - [512, 256, 1, 128, 512, 512, 128, 128]
    - [23, 0.725]
  - - [512, 256, 1, 256, 512, 512, 256, 256]
    - [81, 1.33]
  - - [512, 256, 1, 512, 512, 512, 512, 512]
    - [23, 2.293]
  - - [512, 256, 1, 1024, 512, 512, 1024, 1024]
    - [36, 3.693]
  - - [512, 256, 1, 2048, 512, 512, 2048, 2048]
    - [100, 4.862]
  - - [512, 256, 1, 4096, 512, 512, 4096, 4096]
    - [36, 7.549]
  - - [512, 256, 1, 8192, 512, 512, 8192, 8192]
    - [98, 10.296]
  - - [512, 512, 1, 128, 512, 512, 128, 128]
    - [81, 1.388]
  - - [512, 512, 1, 256, 512, 512, 256, 256]
    - [81, 2.588]
  - - [512, 512, 1, 512, 512, 512, 512, 512]
    - [81, 4.325]
  - - [512, 512, 1, 1024, 512, 512, 1024, 1024]
    - [83, 6.929]
  - - [512, 512, 1, 2048, 512, 512, 2048, 2048]
    - [36, 9.987]
  - - [512, 512, 1, 4096, 512, 512, 4096, 4096]
    - [102, 11.482]
  - - [512, 512, 1, 8192, 512, 512, 8192, 8192]
    - [25, 15.33]
  - - [512, 1024, 1, 128, 512, 512, 128, 128]
    - [76, 2.471]
  - - [512, 1024, 1, 256, 512, 512, 256, 256]
    - [79, 4.483]
  - - [512, 1024, 1, 512, 512, 512, 512, 512]
    - [76, 7.401]
  - - [512, 1024, 1, 1024, 512, 512, 1024, 1024]
    - [22, 10.966]
  - - [512, 1024, 1, 2048, 512, 512, 2048, 2048]
    - [75, 13.443]
  - - [512, 1024, 1, 4096, 512, 512, 4096, 4096]
    - [33, 16.484]
  - - [512, 1024, 1, 8192, 512, 512, 8192, 8192]
    - [84, 17.243]
  - - [512, 2048, 1, 128, 512, 512, 128, 128]
    - [72, 4.067]
  - - [512, 2048, 1, 256, 512, 512, 256, 256]
    - [72, 6.899]
  - - [512, 2048, 1, 512, 512, 512, 512, 512]
    - [72, 11.586]
  - - [512, 2048, 1, 1024, 512, 512, 1024, 1024]
    - [84, 15.725]
  - - [512, 2048, 1, 2048, 512, 512, 2048, 2048]
    - [85, 18.832]
  - - [512, 2048, 1, 4096, 512, 512, 4096, 4096]
    - [29, 20.075]
  - - [512, 2048, 1, 8192, 512, 512, 8192, 8192]
    - [55, 21.993]
  - - [512, 4096, 1, 128, 512, 512, 128, 128]
    - [66, 6.072]
  - - [512, 4096, 1, 256, 512, 512, 256, 256]
    - [66, 10.489]
  - - [512, 4096, 1, 512, 512, 512, 512, 512]
    - [66, 15.266]
  - - [512, 4096, 1, 1024, 512, 512, 1024, 1024]
    - [67, 20.249]
  - - [512, 4096, 1, 2048, 512, 512, 2048, 2048]
    - [65, 21.585]
  - - [512, 4096, 1, 4096, 512, 512, 4096, 4096]
    - [57, 24.055]
  - - [512, 4096, 1, 8192, 512, 512, 8192, 8192]
    - [55, 25.652]
  - - [512, 8192, 1, 128, 512, 512, 128, 128]
    - [40, 7.916]
  - - [512, 8192, 1, 256, 512, 512, 256, 256]
    - [49, 12.294]
  - - [512, 8192, 1, 512, 512, 512, 512, 512]
    - [49, 17.928]
  - - [512, 8192, 1, 1024, 512, 512, 1024, 1024]
    - [43, 22.534]
  - - [512, 8192, 1, 2048, 512, 512, 2048, 2048]
    - [49, 27.233]
  - - [512, 8192, 1, 4096, 512, 512, 4096, 4096]
    - [57, 27.356]
  - - [512, 8192, 1, 8192, 512, 512, 8192, 8192]
    - [1, 26.087]
  - - [1024, 128, 1, 128, 1024, 1024, 128, 128]
    - [81, 0.704]
  - - [1024, 128, 1, 256, 1024, 1024, 256, 256]
    - [23, 1.332]
  - - [1024, 128, 1, 512, 1024, 1024, 512, 512]
    - [36, 2.29]
  - - [1024, 128, 1, 1024, 1024, 1024, 1024, 1024]
    - [36, 3.635]
  - - [1024, 128, 1, 2048, 1024, 1024, 2048, 2048]
    - [81, 4.809]
  - - [1024, 128, 1, 4096, 1024, 1024, 4096, 4096]
    - [36, 7.587]
  - - [1024, 128, 1, 8192, 1024, 1024, 8192, 8192]
    - [34, 10.609]
  - - [1024, 256, 1, 128, 1024, 1024, 128, 128]
    - [23, 1.375]
  - - [1024, 256, 1, 256, 1024, 1024, 256, 256]
    - [23, 2.532]
  - - [1024, 256, 1, 512, 1024, 1024, 512, 512]
    - [23, 4.256]
  - - [1024, 256, 1, 1024, 1024, 1024, 1024, 1024]
    - [36, 7.044]
  - - [1024, 256, 1, 2048, 1024, 1024, 2048, 2048]
    - [36, 9.961]
  - - [1024, 256, 1, 4096, 1024, 1024, 4096, 4096]
    - [37, 11.477]
  - - [1024, 256, 1, 8192, 1024, 1024, 8192, 8192]
    - [26, 14.786]
  - - [1024, 512, 1, 128, 1024, 1024, 128, 128]
    - [21, 2.46]
  - - [1024, 512, 1, 256, 1024, 1024, 256, 256]
    - [21, 4.392]
  - - [1024, 512, 1, 512, 1024, 1024, 512, 512]
    - [20, 7.698]
  - - [1024, 512, 1, 1024, 1024, 1024, 1024, 1024]
    - [96, 11.106]
  - - [1024, 512, 1, 2048, 1024, 1024, 2048, 2048]
    - [99, 13.336]
  - - [1024, 512, 1, 4096, 1024, 1024, 4096, 4096]
    - [26, 16.569]
  - - [1024, 512, 1, 8192, 1024, 1024, 8192, 8192]
    - [93, 17.09]
  - - [1024, 1024, 1, 128, 1024, 1024, 128, 128]
    - [71, 4.031]
  - - [1024, 1024, 1, 256, 1024, 1024, 256, 256]
    - [71, 7.278]
  - - [1024, 1024, 1, 512, 1024, 1024, 512, 512]
    - [71, 11.654]
  - - [1024, 1024, 1, 1024, 1024, 1024, 1024, 1024]
    - [71, 15.736]
  - - [1024, 1024, 1, 2048, 1024, 1024, 2048, 2048]
    - [88, 18.692]
  - - [1024, 1024, 1, 4096, 1024, 1024, 4096, 4096]
    - [51, 19.691]
  - - [1024, 1024, 1, 8192, 1024, 1024, 8192, 8192]
    - [49, 21.818]
  - - [1024, 2048, 1, 128, 1024, 1024, 128, 128]
    - [67, 6.104]
  - - [1024, 2048, 1, 256, 1024, 1024, 256, 256]
    - [67, 10.553]
  - - [1024, 2048, 1, 512, 1024, 1024, 512, 512]
    - [61, 15.276]
  - - [1024, 2048, 1, 1024, 1024, 1024, 1024, 1024]
    - [63, 19.983]
  - - [1024, 2048, 1, 2048, 1024, 1024, 2048, 2048]
    - [17, 21.923]
  - - [1024, 2048, 1, 4096, 1024, 1024, 4096, 4096]
    - [57, 23.869]
  - - [1024, 2048, 1, 8192, 1024, 1024, 8192, 8192]
    - [55, 26.279]
  - - [1024, 4096, 1, 128, 1024, 1024, 128, 128]
    - [39, 8.144]
  - - [1024, 4096, 1, 256, 1024, 1024, 256, 256]
    - [47, 12.116]
  - - [1024, 4096, 1, 512, 1024, 1024, 512, 512]
    - [59, 17.91]
  - - [1024, 4096, 1, 1024, 1024, 1024, 1024, 1024]
    - [8, 22.928]
  - - [1024, 4096, 1, 2048, 1024, 1024, 2048, 2048]
    - [11, 27.726]
  - - [1024, 4096, 1, 4096, 1024, 1024, 4096, 4096]
    - [59, 27.12]
  - - [1024, 4096, 1, 8192, 1024, 1024, 8192, 8192]
    - [47, 25.624]
  - - [1024, 8192, 1, 128, 1024, 1024, 128, 128]
    - [55, 7.719]
  - - [1024, 8192, 1, 256, 1024, 1024, 256, 256]
    - [66, 10.972]
  - - [1024, 8192, 1, 512, 1024, 1024, 512, 512]
    - [51, 16.481]
  - - [1024, 8192, 1, 1024, 1024, 1024, 1024, 1024]
    - [55, 22.028]
  - - [1024, 8192, 1, 2048, 1024, 1024, 2048, 2048]
    - [44, 26.273]
  - - [1024, 8192, 1, 4096, 1024, 1024, 4096, 4096]
    - [58, 26.086]
  - - [1024, 8192, 1, 8192, 1024, 1024, 8192, 8192]
    - [54, 24.021]
  - - [2048, 128, 1, 128, 2048, 2048, 128, 128]
    - [82, 1.365]
  - - [2048, 128, 1, 256, 2048, 2048, 256, 256]
    - [23, 2.58]
  - - [2048, 128, 1, 512, 2048, 2048, 512, 512]
    - [23, 4.303]
  - - [2048, 128, 1, 1024, 2048, 2048, 1024, 1024]
    - [37, 6.903]
  - - [2048, 128, 1, 2048, 2048, 2048, 2048, 2048]
    - [83, 9.644]
  - - [2048, 128, 1, 4096, 2048, 2048, 4096, 4096]
    - [37, 11.614]
  - - [2048, 128, 1, 8192, 2048, 2048, 8192, 8192]
    - [27, 14.333]
  - - [2048, 256, 1, 128, 2048, 2048, 128, 128]
    - [80, 2.462]
  - - [2048, 256, 1, 256, 2048, 2048, 256, 256]
    - [80, 4.458]
  - - [2048, 256, 1, 512, 2048, 2048, 512, 512]
    - [20, 7.388]
  - - [2048, 256, 1, 1024, 2048, 2048, 1024, 1024]
    - [75, 10.971]
  - - [2048, 256, 1, 2048, 2048, 2048, 2048, 2048]
    - [78, 13.442]
  - - [2048, 256, 1, 4096, 2048, 2048, 4096, 4096]
    - [28, 15.779]
  - - [2048, 256, 1, 8192, 2048, 2048, 8192, 8192]
    - [62, 16.545]
  - - [2048, 512, 1, 128, 2048, 2048, 128, 128]
    - [71, 4.075]
  - - [2048, 512, 1, 256, 2048, 2048, 256, 256]
    - [71, 7.211]
  - - [2048, 512, 1, 512, 2048, 2048, 512, 512]
    - [71, 11.69]
  - - [2048, 512, 1, 1024, 2048, 2048, 1024, 1024]
    - [92, 15.586]
  - - [2048, 512, 1, 2048, 2048, 2048, 2048, 2048]
    - [90, 18.566]
  - - [2048, 512, 1, 4096, 2048, 2048, 4096, 4096]
    - [51, 19.761]
  - - [2048, 512, 1, 8192, 2048, 2048, 8192, 8192]
    - [53, 21.885]
  - - [2048, 1024, 1, 128, 2048, 2048, 128, 128]
    - [66, 6.063]
  - - [2048, 1024, 1, 256, 2048, 2048, 256, 256]
    - [66, 10.543]
  - - [2048, 1024, 1, 512, 2048, 2048, 512, 512]
    - [60, 15.072]
  - - [2048, 1024, 1, 1024, 2048, 2048, 1024, 1024]
    - [70, 19.977]
  - - [2048, 1024, 1, 2048, 2048, 2048, 2048, 2048]
    - [70, 21.458]
  - - [2048, 1024, 1, 4096, 2048, 2048, 4096, 4096]
    - [57, 24.067]
  - - [2048, 1024, 1, 8192, 2048, 2048, 8192, 8192]
    - [44, 26.632]
  - - [2048, 2048, 1, 128, 2048, 2048, 128, 128]
    - [42, 7.882]
  - - [2048, 2048, 1, 256, 2048, 2048, 256, 256]
    - [57, 12.178]
  - - [2048, 2048, 1, 512, 2048, 2048, 512, 512]
    - [57, 18.043]
  - - [2048, 2048, 1, 1024, 2048, 2048, 1024, 1024]
    - [9, 23.246]
  - - [2048, 2048, 1, 2048, 2048, 2048, 2048, 2048]
    - [5, 27.123]
  - - [2048, 2048, 1, 4096, 2048, 2048, 4096, 4096]
    - [44, 29.38]
  - - [2048, 2048, 1, 8192, 2048, 2048, 8192, 8192]
    - [44, 27.357]
  - - [2048, 4096, 1, 128, 2048, 2048, 128, 128]
    - [6, 7.662]
  - - [2048, 4096, 1, 256, 2048, 2048, 256, 256]
    - [66, 11.211]
  - - [2048, 4096, 1, 512, 2048, 2048, 512, 512]
    - [55, 16.09]
  - - [2048, 4096, 1, 1024, 2048, 2048, 1024, 1024]
    - [44, 22.369]
  - - [2048, 4096, 1, 2048, 2048, 2048, 2048, 2048]
    - [45, 26.903]
  - - [2048, 4096, 1, 4096, 2048, 2048, 4096, 4096]
    - [44, 26.546]
  - - [2048, 4096, 1, 8192, 2048, 2048, 8192, 8192]
    - [46, 26.154]
  - - [2048, 8192, 1, 128, 2048, 2048, 128, 128]
    - [14, 7.726]
  - - [2048, 8192, 1, 256, 2048, 2048, 256, 256]
    - [44, 12.557]
  - - [2048, 8192, 1, 512, 2048, 2048, 512, 512]
    - [44, 18.523]
  - - [2048, 8192, 1, 1024, 2048, 2048, 1024, 1024]
    - [56, 24.141]
  - - [2048, 8192, 1, 2048, 2048, 2048, 2048, 2048]
    - [45, 26.691]
  - - [2048, 8192, 1, 4096, 2048, 2048, 4096, 4096]
    - [45, 28.882]
  - - [2048, 8192, 1, 8192, 2048, 2048, 8192, 8192]
    - [46, 29.527]
  - - [4096, 128, 1, 128, 4096, 4096, 128, 128]
    - [76, 2.45]
  - - [4096, 128, 1, 256, 4096, 4096, 256, 256]
    - [76, 4.392]
  - - [4096, 128, 1, 512, 4096, 4096, 512, 512]
    - [76, 7.234]
  - - [4096, 128, 1, 1024, 4096, 4096, 1024, 1024]
    - [75, 11.151]
  - - [4096, 128, 1, 2048, 4096, 4096, 2048, 2048]
    - [77, 13.289]
  - - [4096, 128, 1, 4096, 4096, 4096, 4096, 4096]
    - [26, 15.168]
  - - [4096, 128, 1, 8192, 4096, 4096, 8192, 8192]
    - [13, 16.505]
  - - [4096, 256, 1, 128, 4096, 4096, 128, 128]
    - [73, 3.975]
  - - [4096, 256, 1, 256, 4096, 4096, 256, 256]
    - [74, 7.071]
  - - [4096, 256, 1, 512, 4096, 4096, 512, 512]
    - [73, 11.523]
  - - [4096, 256, 1, 1024, 4096, 4096, 1024, 1024]
    - [91, 15.55]
  - - [4096, 256, 1, 2048, 4096, 4096, 2048, 2048]
    - [89, 18.498]
  - - [4096, 256, 1, 4096, 4096, 4096, 4096, 4096]
    - [52, 20.079]
  - - [4096, 256, 1, 8192, 4096, 4096, 8192, 8192]
    - [44, 21.661]
  - - [4096, 512, 1, 128, 4096, 4096, 128, 128]
    - [67, 6.063]
  - - [4096, 512, 1, 256, 4096, 4096, 256, 256]
    - [66, 10.339]
  - - [4096, 512, 1, 512, 4096, 4096, 512, 512]
    - [64, 15.028]
  - - [4096, 512, 1, 1024, 4096, 4096, 1024, 1024]
    - [69, 20.139]
  - - [4096, 512, 1, 2048, 4096, 4096, 2048, 2048]
    - [15, 22.604]
  - - [4096, 512, 1, 4096, 4096, 4096, 4096, 4096]
    - [52, 22.724]
  - - [4096, 512, 1, 8192, 4096, 4096, 8192, 8192]
    - [49, 27.51]
  - - [4096, 1024, 1, 128, 4096, 4096, 128, 128]
    - [42, 7.746]
  - - [4096, 1024, 1, 256, 4096, 4096, 256, 256]
    - [55, 12.124]
  - - [4096, 1024, 1, 512, 4096, 4096, 512, 512]
    - [4, 18.214]
  - - [4096, 1024, 1, 1024, 4096, 4096, 1024, 1024]
    - [3, 23.662]
  - - [4096, 1024, 1, 2048, 4096, 4096, 2048, 2048]
    - [3, 27.326]
  - - [4096, 1024, 1, 4096, 4096, 4096, 4096, 4096]
    - [47, 28.818]
  - - [4096, 1024, 1, 8192, 4096, 4096, 8192, 8192]
    - [44, 27.555]
  - - [4096, 2048, 1, 128, 4096, 4096, 128, 128]
    - [7, 7.724]
  - - [4096, 2048, 1, 256, 4096, 4096, 256, 256]
    - [18, 10.97]
  - - [4096, 2048, 1, 512, 4096, 4096, 512, 512]
    - [55, 15.913]
  - - [4096, 2048, 1, 1024, 4096, 4096, 1024, 1024]
    - [43, 21.968]
  - - [4096, 2048, 1, 2048, 4096, 4096, 2048, 2048]
    - [44, 28.036]
  - - [4096, 2048, 1, 4096, 4096, 4096, 4096, 4096]
    - [44, 28.409]
  - - [4096, 2048, 1, 8192, 4096, 4096, 8192, 8192]
    - [49, 28.558]
  - - [4096, 4096, 1, 128, 4096, 4096, 128, 128]
    - [19, 7.773]
  - - [4096, 4096, 1, 256, 4096, 4096, 256, 256]
    - [59, 12.501]
  - - [4096, 4096, 1, 512, 4096, 4096, 512, 512]
    - [51, 18.193]
  - - [4096, 4096, 1, 1024, 4096, 4096, 1024, 1024]
    - [52, 24.116]
  - - [4096, 4096, 1, 2048, 4096, 4096, 2048, 2048]
    - [59, 26.603]
  - - [4096, 4096, 1, 4096, 4096, 4096, 4096, 4096]
    - [59, 29.104]
  - - [4096, 4096, 1, 8192, 4096, 4096, 8192, 8192]
    - [4, 30.624]
  - - [4096, 8192, 1, 128, 4096, 4096, 128, 128]
    - [7, 8.41]
  - - [4096, 8192, 1, 256, 4096, 4096, 256, 256]
    - [54, 12.384]
  - - [4096, 8192, 1, 512, 4096, 4096, 512, 512]
    - [57, 18.185]
  - - [4096, 8192, 1, 1024, 4096, 4096, 1024, 1024]
    - [57, 23.24]
  - - [4096, 8192, 1, 2048, 4096, 4096, 2048, 2048]
    - [4, 26.69]
  - - [4096, 8192, 1, 4096, 4096, 4096, 4096, 4096]
    - [57, 30.761]
  - - [4096, 8192, 1, 8192, 4096, 4096, 8192, 8192]
    - [51, 31.77]
  - - [8192, 128, 1, 128, 8192, 8192, 128, 128]
    - [74, 3.97]
  - - [8192, 128, 1, 256, 8192, 8192, 256, 256]
    - [73, 7.112]
  - - [8192, 128, 1, 512, 8192, 8192, 512, 512]
    - [73, 11.544]
  - - [8192, 128, 1, 1024, 8192, 8192, 1024, 1024]
    - [87, 15.564]
  - - [8192, 128, 1, 2048, 8192, 8192, 2048, 2048]
    - [92, 16.964]
  - - [8192, 128, 1, 4096, 8192, 8192, 4096, 4096]
    - [44, 19.261]
  - - [8192, 128, 1, 8192, 8192, 8192, 8192, 8192]
    - [7, 22.042]
  - - [8192, 256, 1, 128, 8192, 8192, 128, 128]
    - [66, 6.013]
  - - [8192, 256, 1, 256, 8192, 8192, 256, 256]
    - [60, 10.407]
  - - [8192, 256, 1, 512, 8192, 8192, 512, 512]
    - [60, 15.024]
  - - [8192, 256, 1, 1024, 8192, 8192, 1024, 1024]
    - [68, 19.414]
  - - [8192, 256, 1, 2048, 8192, 8192, 2048, 2048]
    - [4, 20.849]
  - - [8192, 256, 1, 4096, 8192, 8192, 4096, 4096]
    - [44, 23.161]
  - - [8192, 256, 1, 8192, 8192, 8192, 8192, 8192]
    - [43, 26.67]
  - - [8192, 512, 1, 128, 8192, 8192, 128, 128]
    - [41, 8.063]
  - - [8192, 512, 1, 256, 8192, 8192, 256, 256]
    - [55, 12.11]
  - - [8192, 512, 1, 512, 8192, 8192, 512, 512]
    - [2, 18.262]
  - - [8192, 512, 1, 1024, 8192, 8192, 1024, 1024]
    - [3, 23.692]
  - - [8192, 512, 1, 2048, 8192, 8192, 2048, 2048]
    - [53, 26.723]
  - - [8192, 512, 1, 4096, 8192, 8192, 4096, 4096]
    - [44, 28.273]
  - - [8192, 512, 1, 8192, 8192, 8192, 8192, 8192]
    - [49, 27.617]
  - - [8192, 1024, 1, 128, 8192, 8192, 128, 128]
    - [59, 7.722]
  - - [8192, 1024, 1, 256, 8192, 8192, 256, 256]
    - [15, 10.794]
  - - [8192, 1024, 1, 512, 8192, 8192, 512, 512]
    - [55, 16.117]
  - - [8192, 1024, 1, 1024, 8192, 8192, 1024, 1024]
    - [57, 21.675]
  - - [8192, 1024, 1, 2048, 8192, 8192, 2048, 2048]
    - [44, 26.448]
  - - [8192, 1024, 1, 4096, 8192, 8192, 4096, 4096]
    - [48, 27.309]
  - - [8192, 1024, 1, 8192, 8192, 8192, 8192, 8192]
    - [49, 28.797]
  - - [8192, 2048, 1, 128, 8192, 8192, 128, 128]
    - [59, 7.747]
  - - [8192, 2048, 1, 256, 8192, 8192, 256, 256]
    - [59, 12.717]
  - - [8192, 2048, 1, 512, 8192, 8192, 512, 512]
    - [59, 18.123]
  - - [8192, 2048, 1, 1024, 8192, 8192, 1024, 1024]
    - [59, 23.583]
  - - [8192, 2048, 1, 2048, 8192, 8192, 2048, 2048]
    - [57, 27.237]
  - - [8192, 2048, 1, 4096, 8192, 8192, 4096, 4096]
    - [7, 29.43]
  - - [8192, 2048, 1, 8192, 8192, 8192, 8192, 8192]
    - [4, 30.65]
  - - [8192, 4096, 1, 128, 8192, 8192, 128, 128]
    - [59, 8.742]
  - - [8192, 4096, 1, 256, 8192, 8192, 256, 256]
    - [59, 12.609]
  - - [8192, 4096, 1, 512, 8192, 8192, 512, 512]
    - [53, 18.336]
  - - [8192, 4096, 1, 1024, 8192, 8192, 1024, 1024]
    - [54, 23.277]
  - - [8192, 4096, 1, 2048, 8192, 8192, 2048, 2048]
    - [57, 27.238]
  - - [8192, 4096, 1, 4096, 8192, 8192, 4096, 4096]
    - [57, 30.983]
  - - [8192, 4096, 1, 8192, 8192, 8192, 8192, 8192]
    - [50, 32.021]
  - - [8192, 8192, 1, 128, 8192, 8192, 128, 128]
    - [12, 7.089]
  - - [8192, 8192, 1, 256, 8192, 8192, 256, 256]
    - [59, 11.41]
  - - [8192, 8192, 1, 512, 8192, 8192, 512, 512]
    - [55, 17.497]
  - - [8192, 8192, 1, 1024, 8192, 8192, 1024, 1024]
    - [59, 24.021]
  - - [8192, 8192, 1, 2048, 8192, 8192, 2048, 2048]
    - [59, 28.604]
  - - [8192, 8192, 1, 4096, 8192, 8192, 4096, 4096]
    - [57, 33.428]
  - - [8192, 8192, 1, 8192, 8192, 8192, 8192, 8192]
    - [56, 34.456]
  - - [1, 1, 1, 32, 1, 1, 32, 32]
    - [105, 0.0]
- null
- null
- ExperimentalStreamK
- GridBased
