library/src/amd_detail/rocblaslt/src/Tensile/Logic/asm_full/aquavanjaram/gfx942/StreamK/aquavanjaram942_Cijk_Alik_Bjlk_HSS_BH_UserArgs.yaml
- {MinimumRequiredVersion: 4.33.0}
- aquavanjaram942
- gfx942
- [Device 0049, Device 0050]
    SolutionIndex: 0
    SolutionNameMin: Cijk_Alik_Bjlk_HSS_BH_UserArgs_MT256x256x32_MI16x16x1_SN_LDSB1_CLR1_GSU0_GSUC0_GSUWGMRR0_K1_LBSPPA256_LBSPPB2048_LPB32_MIWT8_8_PLR1_SU32_SUM0_SUS256_SKXCCM0_VWA4_VWB2_WGM1_WGMXCC1_WGMXCCGn1
    SolutionIndex: 1
    SolutionNameMin: Cijk_Alik_Bjlk_HSS_BH_UserArgs_MT256x256x32_MI16x16x1_SN_LDSB1_CLR1_GSU0_GSUC0_GSUWGMRR0_K1_LBSPPA256_LBSPPB2048_LPB0_MIWT8_8_PLR1_SU32_SUM0_SUS256_SKXCCM0_VWA4_VWB8_WGM1_WGMXCC1_WGMXCCGn1
    SolutionIndex: 2
    SolutionNameMin: Cijk_Alik_Bjlk_HSS_BH_UserArgs_MT256x256x32_MI16x16x1_SN_LDSB1_CLR1_GSU0_GSUC0_GSUWGMRR0_K1_LBSPPA128_LBSPPB2048_LPB0_MIWT8_8_PLR1_SU32_SUM0_SUS256_SKXCCM0_VWA2_VWB8_WGM4_WGMXCC1_WGMXCCGn1
    SolutionIndex: 3
    SolutionNameMin: Cijk_Alik_Bjlk_HSS_BH_UserArgs_MT256x256x32_MI16x16x1_SN_LDSB1_CLR1_GSU0_GSUC0_GSUWGMRR0_K1_LBSPPA256_LBSPPB2048_LPB0_MIWT8_8_PLR1_SU32_SUM0_SUS256_SKXCCM0_VWA4_VWB8_WGM4_WGMXCC1_WGMXCCGn1
    SolutionIndex: 4
    SolutionNameMin: Cijk_Alik_Bjlk_HSS_BH_UserArgs_MT128x128x32_MI16x16x1_SN_LDSB1_CLR1_GSU0_GSUC0_GSUWGMRR0_K1_LBSPPA256_LBSPPB1024_LPB0_MIWT4_4_PLR1_SU32_SUM0_SUS256_SKXCCM0_VWA4_VWB4_WGM1_WGMXCC1_WGMXCCGn1
    SolutionIndex: 5
    SolutionNameMin: Cijk_Alik_Bjlk_HSS_BH_UserArgs_MT128x128x32_MI16x16x1_SN_LDSB1_CLR1_GSU0_GSUC0_GSUWGMRR0_K1_LBSPPA256_LBSPPB1024_LPB0_MIWT4_4_PLR1_SU32_SUM0_SUS256_SKXCCM0_VWA4_VWB4_WGM8_WGMXCC1_WGMXCCGn1
    SolutionIndex: 6
    SolutionNameMin: Cijk_Alik_Bjlk_HSS_BH_UserArgs_MT128x256x64_MI16x16x1_SN_LDSB1_CLR1_GSU0_GSUC0_GSUWGMRR0_K1_LBSPPA512_LBSPPB4096_LPB32_MIWT4_8_PLR1_SU32_SUM0_SUS256_SKXCCM0_VWA4_VWB2_WGM1_WGMXCC1_WGMXCCGn1
    SolutionIndex: 7
    SolutionNameMin: Cijk_Alik_Bjlk_HSS_BH_UserArgs_MT128x256x64_MI16x16x1_SN_LDSB1_CLR1_GSU0_GSUC0_GSUWGMRR0_K1_LBSPPA128_LBSPPB4096_LPB0_MIWT4_8_PLR1_SU32_SUM0_SUS256_SKXCCM0_VWA1_VWB4_WGM1_WGMXCC1_WGMXCCGn1
    SolutionIndex: 8
    SolutionNameMin: Cijk_Alik_Bjlk_HSS_BH_UserArgs_MT128x256x64_MI16x16x1_SN_LDSB1_CLR1_GSU0_GSUC0_GSUWGMRR0_K1_LBSPPA512_LBSPPB4096_LPB0_MIWT4_8_PLR1_SU32_SUM0_SUS256_SKXCCM0_VWA4_VWB4_WGM1_WGMXCC1_WGMXCCGn1
    SolutionIndex: 9
    SolutionNameMin: Cijk_Alik_Bjlk_HSS_BH_UserArgs_MT128x256x64_MI16x16x1_SN_LDSB1_CLR1_GSU0_GSUC0_GSUWGMRR0_K1_LBSPPA256_LBSPPB4096_LPB0_MIWT4_8_PLR1_SU32_SUM0_SUS256_SKXCCM0_VWA2_VWB8_WGM4_WGMXCC1_WGMXCCGn1
    SolutionIndex: 10
    SolutionNameMin: Cijk_Alik_Bjlk_HSS_BH_UserArgs_MT128x256x64_MI16x16x1_SN_LDSB1_CLR1_GSU0_GSUC0_GSUWGMRR0_K1_LBSPPA512_LBSPPB4096_LPB0_MIWT4_8_PLR1_SU32_SUM0_SUS256_SKXCCM0_VWA4_VWB8_WGM4_WGMXCC1_WGMXCCGn1
    SolutionIndex: 11
    SolutionNameMin: Cijk_Alik_Bjlk_HSS_BH_UserArgs_MT128x256x64_MI16x16x1_SN_LDSB1_CLR1_GSU0_GSUC0_GSUWGMRR0_K1_LBSPPA256_LBSPPB4096_LPB0_MIWT4_8_PLR1_SU32_SUM0_SUS256_SKXCCM0_VWA2_VWB4_WGM8_WGMXCC1_WGMXCCGn1
    SolutionIndex: 12
    SolutionNameMin: Cijk_Alik_Bjlk_HSS_BH_UserArgs_MT256x128x64_MI16x16x1_SN_LDSB1_CLR1_GSU0_GSUC0_GSUWGMRR0_K1_LBSPPA128_LBSPPB2048_LPB0_MIWT8_4_PLR1_SU32_SUM0_SUS256_SKXCCM0_VWA1_VWB4_WGM1_WGMXCC1_WGMXCCGn1
    SolutionIndex: 13
    SolutionNameMin: Cijk_Alik_Bjlk_HSS_BH_UserArgs_MT256x128x64_MI16x16x1_SN_LDSB1_CLR1_GSU0_GSUC0_GSUWGMRR0_K1_LBSPPA256_LBSPPB2048_LPB0_MIWT8_4_PLR1_SU32_SUM0_SUS256_SKXCCM0_VWA2_VWB4_WGM1_WGMXCC1_WGMXCCGn1
    SolutionIndex: 14
    SolutionNameMin: Cijk_Alik_Bjlk_HSS_BH_UserArgs_MT256x128x64_MI16x16x1_SN_LDSB1_CLR1_GSU0_GSUC0_GSUWGMRR0_K1_LBSPPA512_LBSPPB2048_LPB0_MIWT8_4_PLR1_SU32_SUM0_SUS256_SKXCCM0_VWA4_VWB4_WGM1_WGMXCC1_WGMXCCGn1
    SolutionIndex: 15
    SolutionNameMin: Cijk_Alik_Bjlk_HSS_BH_UserArgs_MT256x128x64_MI16x16x1_SN_LDSB1_CLR1_GSU0_GSUC0_GSUWGMRR0_K1_LBSPPA256_LBSPPB2048_LPB0_MIWT8_4_PLR1_SU32_SUM0_SUS256_SKXCCM0_VWA2_VWB4_WGM4_WGMXCC1_WGMXCCGn1
    SolutionIndex: 16
    SolutionNameMin: Cijk_Alik_Bjlk_HSS_BH_UserArgs_MT256x128x64_MI16x16x1_SN_LDSB1_CLR1_GSU0_GSUC0_GSUWGMRR0_K1_LBSPPA512_LBSPPB2048_LPB0_MIWT8_4_PLR1_SU32_SUM0_SUS256_SKXCCM0_VWA4_VWB4_WGM4_WGMXCC1_WGMXCCGn1
    SolutionIndex: 17
    SolutionNameMin: Cijk_Alik_Bjlk_HSS_BH_UserArgs_MT256x128x64_MI16x16x1_SN_LDSB1_CLR1_GSU0_GSUC0_GSUWGMRR0_K1_LBSPPA512_LBSPPB2048_LPB0_MIWT8_4_PLR1_SU32_SUM0_SUS256_SKXCCM0_VWA4_VWB4_WGM8_WGMXCC1_WGMXCCGn1
    SolutionIndex: 18
    SolutionNameMin: Cijk_Alik_Bjlk_HSS_BH_UserArgs_MT128x128x64_MI16x16x1_SN_LDSB1_CLR1_GSU0_GSUC0_GSUWGMRR0_K1_LBSPPA128_LBSPPB2048_LPB0_MIWT4_4_PLR1_SU32_SUM0_SUS256_SKXCCM0_VWA1_VWB4_WGM1_WGMXCC1_WGMXCCGn1
    SolutionIndex: 19
    SolutionNameMin: Cijk_Alik_Bjlk_HSS_BH_UserArgs_MT128x128x64_MI16x16x1_SN_LDSB1_CLR1_GSU0_GSUC0_GSUWGMRR0_K1_LBSPPA512_LBSPPB2048_LPB0_MIWT4_4_PLR1_SU32_SUM0_SUS256_SKXCCM0_VWA4_VWB4_WGM1_WGMXCC1_WGMXCCGn1
    SolutionIndex: 20
    SolutionNameMin: Cijk_Alik_Bjlk_HSS_BH_UserArgs_MT128x128x64_MI16x16x1_SN_LDSB1_CLR1_GSU0_GSUC0_GSUWGMRR0_K1_LBSPPA256_LBSPPB2048_LPB0_MIWT4_4_PLR1_SU32_SUM0_SUS256_SKXCCM0_VWA2_VWB4_WGM4_WGMXCC1_WGMXCCGn1
    SolutionIndex: 21
    SolutionNameMin: Cijk_Alik_Bjlk_HSS_BH_UserArgs_MT128x128x64_MI16x16x1_SN_LDSB1_CLR1_GSU0_GSUC0_GSUWGMRR0_K1_LBSPPA512_LBSPPB2048_LPB0_MIWT4_4_PLR1_SU32_SUM0_SUS256_SKXCCM0_VWA4_VWB4_WGM4_WGMXCC1_WGMXCCGn1
    SolutionIndex: 22
    SolutionNameMin: Cijk_Alik_Bjlk_HSS_BH_UserArgs_MT128x128x64_MI16x16x1_SN_LDSB1_CLR1_GSU0_GSUC0_GSUWGMRR0_K1_LBSPPA128_LBSPPB2048_LPB0_MIWT4_4_PLR1_SU32_SUM0_SUS256_SKXCCM0_VWA1_VWB4_WGM8_WGMXCC1_WGMXCCGn1
    SolutionIndex: 23
    SolutionNameMin: Cijk_Alik_Bjlk_HSS_BH_UserArgs_MT128x128x64_MI16x16x1_SN_LDSB1_CLR1_GSU0_GSUC0_GSUWGMRR0_K1_LBSPPA256_LBSPPB2048_LPB0_MIWT4_4_PLR1_SU32_SUM0_SUS256_SKXCCM0_VWA2_VWB4_WGM8_WGMXCC1_WGMXCCGn1
    SolutionIndex: 24
    SolutionNameMin: Cijk_Alik_Bjlk_HSS_BH_UserArgs_MT128x128x64_MI16x16x1_SN_LDSB1_CLR1_GSU0_GSUC0_GSUWGMRR0_K1_LBSPPA512_LBSPPB2048_LPB0_MIWT4_4_PLR1_SU32_SUM0_SUS256_SKXCCM0_VWA4_VWB4_WGM8_WGMXCC1_WGMXCCGn1
    SolutionIndex: 25
    SolutionNameMin: Cijk_Alik_Bjlk_HSS_BH_UserArgs_MT64x128x64_MI16x16x1_SN_LDSB1_CLR1_GSU0_GSUC0_GSUWGMRR0_K1_LBSPPA128_LBSPPB2048_LPB0_MIWT2_4_PLR1_SU32_SUM0_SUS256_SKXCCM0_VWA1_VWB4_WGM8_WGMXCC1_WGMXCCGn1
    SolutionIndex: 26
    SolutionNameMin: Cijk_Alik_Bjlk_HSS_BH_UserArgs_MT64x64x64_MI16x16x1_SN_LDSB1_CLR1_GSU0_GSUC0_GSUWGMRR0_K1_LBSPPA128_LBSPPB1024_LPB32_MIWT2_2_PLR1_SU32_SUM0_SUS256_SKXCCM0_VWA1_VWB2_WGM1_WGMXCC1_WGMXCCGn1
    SolutionIndex: 27
    SolutionNameMin: Cijk_Alik_Bjlk_HSS_BH_UserArgs_MT64x64x64_MI16x16x1_SN_LDSB1_CLR1_GSU0_GSUC0_GSUWGMRR0_K1_LBSPPA128_LBSPPB1024_LPB32_MIWT2_2_PLR1_SU32_SUM0_SUS256_SKXCCM0_VWA1_VWB2_WGM4_WGMXCC1_WGMXCCGn1
    SolutionIndex: 28
    SolutionNameMin: Cijk_Alik_Bjlk_HSS_BH_UserArgs_MT64x64x64_MI16x16x1_SN_LDSB1_CLR1_GSU0_GSUC0_GSUWGMRR0_K1_LBSPPA128_LBSPPB1024_LPB32_MIWT2_2_PLR1_SU32_SUM0_SUS256_SKXCCM0_VWA1_VWB2_WGM8_WGMXCC1_WGMXCCGn1
    SolutionIndex: 29
    SolutionNameMin: Cijk_Alik_Bjlk_HSS_BH_UserArgs_MT32x64x64_MI16x16x1_SN_LDSB0_CLR1_GSU0_GSUC0_GSUWGMRR0_K1_LBSPPA128_LBSPPB1024_LPB32_MIWT1_2_PLR1_SU32_SUM0_SUS256_SKXCCM0_VWA1_VWB2_WGM1_WGMXCC1_WGMXCCGn1
    SolutionIndex: 30
    SolutionNameMin: Cijk_Alik_Bjlk_HSS_BH_UserArgs_MT32x32x64_MI16x16x1_SN_LDSB0_CLR1_GSU0_GSUC0_GSUWGMRR0_K1_LBSPPA128_LBSPPB512_LPB16_MIWT1_1_PLR1_SU32_SUM0_SUS256_SKXCCM0_VWA1_VWB1_WGM1_WGMXCC1_WGMXCCGn1
    SolutionIndex: 31
    SolutionNameMin: Cijk_Alik_Bjlk_HSS_BH_UserArgs_MT32x32x64_MI16x16x1_SN_LDSB0_CLR1_GSU0_GSUC0_GSUWGMRR0_K1_LBSPPA128_LBSPPB512_LPB16_MIWT1_1_PLR1_SU32_SUM0_SUS256_SKXCCM0_VWA1_VWB1_WGM4_WGMXCC1_WGMXCCGn1
    SolutionIndex: 32
    SolutionNameMin: Cijk_Alik_Bjlk_HSS_BH_UserArgs_MT128x64x128_MI16x16x1_SN_LDSB1_CLR1_GSU0_GSUC0_GSUWGMRR0_K1_LBSPPA256_LBSPPB1024_LPB32_MIWT4_2_PLR2_SU32_SUM0_SUS256_SKXCCM0_VWA1_VWB2_WGM1_WGMXCC1_WGMXCCGn1
    SolutionIndex: 33
    SolutionNameMin: Cijk_Alik_Bjlk_HSS_BH_UserArgs_MT128x64x128_MI16x16x1_SN_LDSB1_CLR1_GSU0_GSUC0_GSUWGMRR0_K1_LBSPPA512_LBSPPB1024_LPB32_MIWT4_2_PLR2_SU32_SUM0_SUS256_SKXCCM0_VWA2_VWB2_WGM1_WGMXCC1_WGMXCCGn1
    SolutionIndex: 34
    SolutionNameMin: Cijk_Alik_Bjlk_HSS_BH_UserArgs_MT128x64x128_MI16x16x1_SN_LDSB1_CLR1_GSU0_GSUC0_GSUWGMRR0_K1_LBSPPA1024_LBSPPB1024_LPB32_MIWT4_2_PLR2_SU32_SUM0_SUS256_SKXCCM0_VWA4_VWB2_WGM1_WGMXCC1_WGMXCCGn1
    SolutionIndex: 35
    SolutionNameMin: Cijk_Alik_Bjlk_HSS_BH_UserArgs_MT128x64x128_MI16x16x1_SN_LDSB1_CLR1_GSU0_GSUC0_GSUWGMRR0_K1_LBSPPA1024_LBSPPB1024_LPB32_MIWT4_2_PLR2_SU32_SUM0_SUS256_SKXCCM0_VWA4_VWB2_WGM4_WGMXCC1_WGMXCCGn1
    SolutionIndex: 36
    SolutionNameMin: Cijk_Alik_Bjlk_HSS_BH_UserArgs_MT64x64x128_MI16x16x1_SN_LDSB1_CLR1_GSU0_GSUC0_GSUWGMRR0_K1_LBSPPA256_LBSPPB1024_LPB32_MIWT2_2_PLR2_SU32_SUM0_SUS256_SKXCCM0_VWA1_VWB2_WGM1_WGMXCC1_WGMXCCGn1
    SolutionIndex: 37
    SolutionNameMin: Cijk_Alik_Bjlk_HSS_BH_UserArgs_MT64x64x128_MI16x16x1_SN_LDSB1_CLR1_GSU0_GSUC0_GSUWGMRR0_K1_LBSPPA256_LBSPPB1024_LPB32_MIWT2_2_PLR2_SU32_SUM0_SUS256_SKXCCM0_VWA1_VWB2_WGM4_WGMXCC1_WGMXCCGn1
    SolutionIndex: 38
    SolutionNameMin: Cijk_Alik_Bjlk_HSS_BH_UserArgs_MT64x64x128_MI16x16x1_SN_LDSB1_CLR1_GSU0_GSUC0_GSUWGMRR0_K1_LBSPPA256_LBSPPB1024_LPB32_MIWT2_2_PLR2_SU32_SUM0_SUS256_SKXCCM0_VWA1_VWB2_WGM8_WGMXCC1_WGMXCCGn1
    SolutionIndex: 39
    SolutionNameMin: Cijk_Alik_Bjlk_HSS_BH_UserArgs_MT32x64x128_MI16x16x1_SN_LDSB1_CLR1_GSU0_GSUC0_GSUWGMRR0_K1_LBSPPA256_LBSPPB1024_LPB32_MIWT1_2_PLR1_SU32_SUM0_SUS256_SKXCCM0_VWA1_VWB2_WGM1_WGMXCC1_WGMXCCGn1
    SolutionIndex: 40
    SolutionNameMin: Cijk_Alik_Bjlk_HSS_BH_UserArgs_MT32x64x128_MI16x16x1_SN_LDSB1_CLR1_GSU0_GSUC0_GSUWGMRR0_K1_LBSPPA256_LBSPPB1024_LPB32_MIWT1_2_PLR2_SU32_SUM0_SUS256_SKXCCM0_VWA1_VWB2_WGM1_WGMXCC1_WGMXCCGn1
    SolutionIndex: 41
    SolutionNameMin: Cijk_Alik_Bjlk_HSS_BH_UserArgs_MT32x64x128_MI16x16x1_SN_LDSB1_CLR1_GSU0_GSUC0_GSUWGMRR0_K1_LBSPPA256_LBSPPB1024_LPB32_MIWT1_2_PLR2_SU32_SUM0_SUS256_SKXCCM0_VWA1_VWB2_WGM4_WGMXCC1_WGMXCCGn1
    SolutionIndex: 42
    SolutionNameMin: Cijk_Alik_Bjlk_HSS_BH_UserArgs_MT32x64x128_MI16x16x1_SN_LDSB1_CLR1_GSU0_GSUC0_GSUWGMRR0_K1_LBSPPA256_LBSPPB1024_LPB32_MIWT1_2_PLR2_SU32_SUM0_SUS256_SKXCCM0_VWA1_VWB2_WGM8_WGMXCC1_WGMXCCGn1
    SolutionIndex: 43
    SolutionNameMin: Cijk_Alik_Bjlk_HSS_BH_UserArgs_MT64x32x128_MI16x16x1_SN_LDSB1_CLR1_GSU0_GSUC0_GSUWGMRR0_K1_LBSPPA256_LBSPPB512_LPB16_MIWT2_1_PLR2_SU32_SUM0_SUS256_SKXCCM0_VWA1_VWB1_WGM8_WGMXCC1_WGMXCCGn1
    SolutionIndex: 44
    SolutionNameMin: Cijk_Alik_Bjlk_HSS_BH_UserArgs_MT32x32x128_MI16x16x1_SN_LDSB1_CLR1_GSU0_GSUC0_GSUWGMRR0_K1_LBSPPA256_LBSPPB512_LPB16_MIWT1_1_PLR1_SU32_SUM0_SUS256_SKXCCM0_VWA1_VWB1_WGM1_WGMXCC1_WGMXCCGn1
    SolutionIndex: 45
    SolutionNameMin: Cijk_Alik_Bjlk_HSS_BH_UserArgs_MT32x32x128_MI16x16x1_SN_LDSB1_CLR1_GSU0_GSUC0_GSUWGMRR0_K1_LBSPPA256_LBSPPB512_LPB16_MIWT1_1_PLR2_SU32_SUM0_SUS256_SKXCCM0_VWA1_VWB1_WGM1_WGMXCC1_WGMXCCGn1
    SolutionIndex: 46
    SolutionNameMin: Cijk_Alik_Bjlk_HSS_BH_UserArgs_MT32x32x128_MI16x16x1_SN_LDSB1_CLR1_GSU0_GSUC0_GSUWGMRR0_K1_LBSPPA256_LBSPPB512_LPB16_MIWT1_1_PLR2_SU32_SUM0_SUS256_SKXCCM0_VWA1_VWB1_WGM4_WGMXCC1_WGMXCCGn1
    SolutionIndex: 47
    SolutionNameMin: Cijk_Alik_Bjlk_HSS_BH_UserArgs_MT32x32x128_MI16x16x1_SN_LDSB1_CLR1_GSU0_GSUC0_GSUWGMRR0_K1_LBSPPA256_LBSPPB512_LPB16_MIWT1_1_PLR2_SU32_SUM0_SUS256_SKXCCM0_VWA1_VWB1_WGM8_WGMXCC1_WGMXCCGn1
    SolutionIndex: 48
    SolutionNameMin: Cijk_Alik_Bjlk_HSS_BH_UserArgs_MT256x256x32_MI16x16x1_SN_LDSB1_CLR1_GSU0_GSUC0_GSUWGMRR0_K1_LBSPPA256_LBSPPB2048_LPB32_MIWT8_8_PLR1_SU32_SUM0_SUS256_SKXCCM8_VWA4_VWB2_WGM1_WGMXCC1_WGMXCCGn1
    SolutionIndex: 49
    SolutionNameMin: Cijk_Alik_Bjlk_HSS_BH_UserArgs_MT256x256x32_MI16x16x1_SN_LDSB1_CLR1_GSU0_GSUC0_GSUWGMRR0_K1_LBSPPA256_LBSPPB2048_LPB0_MIWT8_8_PLR1_SU32_SUM0_SUS256_SKXCCM8_VWA4_VWB4_WGM1_WGMXCC1_WGMXCCGn1
    SolutionIndex: 50
    SolutionNameMin: Cijk_Alik_Bjlk_HSS_BH_UserArgs_MT256x256x32_MI16x16x1_SN_LDSB1_CLR1_GSU0_GSUC0_GSUWGMRR0_K1_LBSPPA128_LBSPPB2048_LPB0_MIWT8_8_PLR1_SU32_SUM0_SUS256_SKXCCM8_VWA1_VWB8_WGM1_WGMXCC1_WGMXCCGn1
    SolutionIndex: 51
    SolutionNameMin: Cijk_Alik_Bjlk_HSS_BH_UserArgs_MT256x256x32_MI16x16x1_SN_LDSB1_CLR1_GSU0_GSUC0_GSUWGMRR0_K1_LBSPPA128_LBSPPB2048_LPB0_MIWT8_8_PLR1_SU32_SUM0_SUS256_SKXCCM8_VWA2_VWB8_WGM1_WGMXCC1_WGMXCCGn1
    SolutionIndex: 52
    SolutionNameMin: Cijk_Alik_Bjlk_HSS_BH_UserArgs_MT256x256x32_MI16x16x1_SN_LDSB1_CLR1_GSU0_GSUC0_GSUWGMRR0_K1_LBSPPA256_LBSPPB2048_LPB0_MIWT8_8_PLR1_SU32_SUM0_SUS256_SKXCCM8_VWA4_VWB8_WGM1_WGMXCC1_WGMXCCGn1
    SolutionIndex: 53
    SolutionNameMin: Cijk_Alik_Bjlk_HSS_BH_UserArgs_MT256x256x32_MI16x16x1_SN_LDSB1_CLR1_GSU0_GSUC0_GSUWGMRR0_K1_LBSPPA128_LBSPPB2048_LPB32_MIWT8_8_PLR1_SU32_SUM0_SUS256_SKXCCM8_VWA2_VWB2_WGM4_WGMXCC1_WGMXCCGn1
    SolutionIndex: 54
    SolutionNameMin: Cijk_Alik_Bjlk_HSS_BH_UserArgs_MT256x256x32_MI16x16x1_SN_LDSB1_CLR1_GSU0_GSUC0_GSUWGMRR0_K1_LBSPPA128_LBSPPB2048_LPB0_MIWT8_8_PLR1_SU32_SUM0_SUS256_SKXCCM8_VWA2_VWB4_WGM4_WGMXCC1_WGMXCCGn1
    SolutionIndex: 55
    SolutionNameMin: Cijk_Alik_Bjlk_HSS_BH_UserArgs_MT256x256x32_MI16x16x1_SN_LDSB1_CLR1_GSU0_GSUC0_GSUWGMRR0_K1_LBSPPA256_LBSPPB2048_LPB0_MIWT8_8_PLR1_SU32_SUM0_SUS256_SKXCCM8_VWA4_VWB4_WGM4_WGMXCC1_WGMXCCGn1
    SolutionIndex: 56
    SolutionNameMin: Cijk_Alik_Bjlk_HSS_BH_UserArgs_MT256x256x32_MI16x16x1_SN_LDSB1_CLR1_GSU0_GSUC0_GSUWGMRR0_K1_LBSPPA128_LBSPPB2048_LPB0_MIWT8_8_PLR1_SU32_SUM0_SUS256_SKXCCM8_VWA1_VWB8_WGM4_WGMXCC1_WGMXCCGn1
    SolutionIndex: 57
    SolutionNameMin: Cijk_Alik_Bjlk_HSS_BH_UserArgs_MT256x256x32_MI16x16x1_SN_LDSB1_CLR1_GSU0_GSUC0_GSUWGMRR0_K1_LBSPPA256_LBSPPB2048_LPB0_MIWT8_8_PLR1_SU32_SUM0_SUS256_SKXCCM8_VWA4_VWB8_WGM4_WGMXCC1_WGMXCCGn1
    SolutionIndex: 58
    SolutionNameMin: Cijk_Alik_Bjlk_HSS_BH_UserArgs_MT256x256x32_MI16x16x1_SN_LDSB1_CLR1_GSU0_GSUC0_GSUWGMRR0_K1_LBSPPA256_LBSPPB2048_LPB32_MIWT8_8_PLR1_SU32_SUM0_SUS256_SKXCCM8_VWA4_VWB2_WGM8_WGMXCC1_WGMXCCGn1
    SolutionIndex: 59
    SolutionNameMin: Cijk_Alik_Bjlk_HSS_BH_UserArgs_MT256x256x32_MI16x16x1_SN_LDSB1_CLR1_GSU0_GSUC0_GSUWGMRR0_K1_LBSPPA256_LBSPPB2048_LPB0_MIWT8_8_PLR1_SU32_SUM0_SUS256_SKXCCM8_VWA4_VWB4_WGM8_WGMXCC1_WGMXCCGn1
    SolutionIndex: 60
    SolutionNameMin: Cijk_Alik_Bjlk_HSS_BH_UserArgs_MT256x256x32_MI16x16x1_SN_LDSB1_CLR1_GSU0_GSUC0_GSUWGMRR0_K1_LBSPPA256_LBSPPB2048_LPB0_MIWT8_8_PLR1_SU32_SUM0_SUS256_SKXCCM8_VWA4_VWB8_WGM8_WGMXCC1_WGMXCCGn1
    SolutionIndex: 61
    SolutionNameMin: Cijk_Alik_Bjlk_HSS_BH_UserArgs_MT128x256x32_MI16x16x1_SN_LDSB1_CLR1_GSU0_GSUC0_GSUWGMRR0_K1_LBSPPA256_LBSPPB2048_LPB0_MIWT4_8_PLR1_SU32_SUM0_SUS256_SKXCCM8_VWA4_VWB8_WGM8_WGMXCC1_WGMXCCGn1
    SolutionIndex: 62
    SolutionNameMin: Cijk_Alik_Bjlk_HSS_BH_UserArgs_MT128x128x32_MI16x16x1_SN_LDSB1_CLR1_GSU0_GSUC0_GSUWGMRR0_K1_LBSPPA256_LBSPPB1024_LPB32_MIWT4_4_PLR1_SU32_SUM0_SUS256_SKXCCM8_VWA4_VWB2_WGM1_WGMXCC1_WGMXCCGn1
    SolutionIndex: 63
    SolutionNameMin: Cijk_Alik_Bjlk_HSS_BH_UserArgs_MT128x128x32_MI16x16x1_SN_LDSB1_CLR1_GSU0_GSUC0_GSUWGMRR0_K1_LBSPPA256_LBSPPB1024_LPB0_MIWT4_4_PLR1_SU32_SUM0_SUS256_SKXCCM8_VWA4_VWB4_WGM1_WGMXCC1_WGMXCCGn1
    SolutionIndex: 64
    SolutionNameMin: Cijk_Alik_Bjlk_HSS_BH_UserArgs_MT128x128x32_MI16x16x1_SN_LDSB1_CLR1_GSU0_GSUC0_GSUWGMRR0_K1_LBSPPA256_LBSPPB1024_LPB0_MIWT4_4_PLR1_SU32_SUM0_SUS256_SKXCCM8_VWA4_VWB4_WGM4_WGMXCC1_WGMXCCGn1
    SolutionIndex: 65
    SolutionNameMin: Cijk_Alik_Bjlk_HSS_BH_UserArgs_MT128x128x32_MI16x16x1_SN_LDSB1_CLR1_GSU0_GSUC0_GSUWGMRR0_K1_LBSPPA256_LBSPPB1024_LPB32_MIWT4_4_PLR1_SU32_SUM0_SUS256_SKXCCM8_VWA4_VWB2_WGM8_WGMXCC1_WGMXCCGn1
    SolutionIndex: 66
    SolutionNameMin: Cijk_Alik_Bjlk_HSS_BH_UserArgs_MT128x128x32_MI16x16x1_SN_LDSB1_CLR1_GSU0_GSUC0_GSUWGMRR0_K1_LBSPPA256_LBSPPB1024_LPB0_MIWT4_4_PLR1_SU32_SUM0_SUS256_SKXCCM8_VWA4_VWB4_WGM8_WGMXCC1_WGMXCCGn1
    SolutionIndex: 67
    SolutionNameMin: Cijk_Alik_Bjlk_HSS_BH_UserArgs_MT64x128x32_MI16x16x1_SN_LDSB0_CLR1_GSU0_GSUC0_GSUWGMRR0_K1_LBSPPA128_LBSPPB1024_LPB0_MIWT2_4_PLR1_SU32_SUM0_SUS256_SKXCCM8_VWA1_VWB4_WGM1_WGMXCC1_WGMXCCGn1
    SolutionIndex: 68
    SolutionNameMin: Cijk_Alik_Bjlk_HSS_BH_UserArgs_MT128x64x32_MI16x16x1_SN_LDSB0_CLR1_GSU0_GSUC0_GSUWGMRR0_K1_LBSPPA256_LBSPPB512_LPB16_MIWT4_2_PLR1_SU32_SUM0_SUS256_SKXCCM8_VWA4_VWB1_WGM1_WGMXCC1_WGMXCCGn1
    SolutionIndex: 69
    SolutionNameMin: Cijk_Alik_Bjlk_HSS_BH_UserArgs_MT128x256x64_MI16x16x1_SN_LDSB1_CLR1_GSU0_GSUC0_GSUWGMRR0_K1_LBSPPA512_LBSPPB4096_LPB32_MIWT4_8_PLR1_SU32_SUM0_SUS256_SKXCCM8_VWA4_VWB2_WGM1_WGMXCC1_WGMXCCGn1
    SolutionIndex: 70
    SolutionNameMin: Cijk_Alik_Bjlk_HSS_BH_UserArgs_MT128x256x64_MI16x16x1_SN_LDSB1_CLR1_GSU0_GSUC0_GSUWGMRR0_K1_LBSPPA256_LBSPPB4096_LPB0_MIWT4_8_PLR1_SU32_SUM0_SUS256_SKXCCM8_VWA2_VWB4_WGM1_WGMXCC1_WGMXCCGn1
    SolutionIndex: 71
    SolutionNameMin: Cijk_Alik_Bjlk_HSS_BH_UserArgs_MT128x256x64_MI16x16x1_SN_LDSB1_CLR1_GSU0_GSUC0_GSUWGMRR0_K1_LBSPPA512_LBSPPB4096_LPB0_MIWT4_8_PLR1_SU32_SUM0_SUS256_SKXCCM8_VWA4_VWB4_WGM1_WGMXCC1_WGMXCCGn1
    SolutionIndex: 72
    SolutionNameMin: Cijk_Alik_Bjlk_HSS_BH_UserArgs_MT128x256x64_MI16x16x1_SN_LDSB1_CLR1_GSU0_GSUC0_GSUWGMRR0_K1_LBSPPA512_LBSPPB4096_LPB0_MIWT4_8_PLR1_SU32_SUM0_SUS256_SKXCCM8_VWA4_VWB8_WGM1_WGMXCC1_WGMXCCGn1
    SolutionIndex: 73
    SolutionNameMin: Cijk_Alik_Bjlk_HSS_BH_UserArgs_MT128x256x64_MI16x16x1_SN_LDSB1_CLR1_GSU0_GSUC0_GSUWGMRR0_K1_LBSPPA128_LBSPPB4096_LPB32_MIWT4_8_PLR1_SU32_SUM0_SUS256_SKXCCM8_VWA1_VWB2_WGM4_WGMXCC1_WGMXCCGn1
    SolutionIndex: 74
    SolutionNameMin: Cijk_Alik_Bjlk_HSS_BH_UserArgs_MT128x256x64_MI16x16x1_SN_LDSB1_CLR1_GSU0_GSUC0_GSUWGMRR0_K1_LBSPPA512_LBSPPB4096_LPB0_MIWT4_8_PLR1_SU32_SUM0_SUS256_SKXCCM8_VWA4_VWB4_WGM4_WGMXCC1_WGMXCCGn1
    SolutionIndex: 75
    SolutionNameMin: Cijk_Alik_Bjlk_HSS_BH_UserArgs_MT128x256x64_MI16x16x1_SN_LDSB1_CLR1_GSU0_GSUC0_GSUWGMRR0_K1_LBSPPA512_LBSPPB4096_LPB0_MIWT4_8_PLR1_SU32_SUM0_SUS256_SKXCCM8_VWA4_VWB8_WGM4_WGMXCC1_WGMXCCGn1
    SolutionIndex: 76
    SolutionNameMin: Cijk_Alik_Bjlk_HSS_BH_UserArgs_MT128x256x64_MI16x16x1_SN_LDSB1_CLR1_GSU0_GSUC0_GSUWGMRR0_K1_LBSPPA512_LBSPPB4096_LPB0_MIWT4_8_PLR1_SU32_SUM0_SUS256_SKXCCM8_VWA4_VWB4_WGM8_WGMXCC1_WGMXCCGn1
    SolutionIndex: 77
    SolutionNameMin: Cijk_Alik_Bjlk_HSS_BH_UserArgs_MT256x128x64_MI16x16x1_SN_LDSB1_CLR1_GSU0_GSUC0_GSUWGMRR0_K1_LBSPPA128_LBSPPB2048_LPB0_MIWT8_4_PLR1_SU32_SUM0_SUS256_SKXCCM8_VWA1_VWB4_WGM1_WGMXCC1_WGMXCCGn1
    SolutionIndex: 78
    SolutionNameMin: Cijk_Alik_Bjlk_HSS_BH_UserArgs_MT256x128x64_MI16x16x1_SN_LDSB1_CLR1_GSU0_GSUC0_GSUWGMRR0_K1_LBSPPA512_LBSPPB2048_LPB0_MIWT8_4_PLR1_SU32_SUM0_SUS256_SKXCCM8_VWA4_VWB4_WGM1_WGMXCC1_WGMXCCGn1
    SolutionIndex: 79
    SolutionNameMin: Cijk_Alik_Bjlk_HSS_BH_UserArgs_MT256x128x64_MI16x16x1_SN_LDSB1_CLR1_GSU0_GSUC0_GSUWGMRR0_K1_LBSPPA128_LBSPPB2048_LPB0_MIWT8_4_PLR1_SU32_SUM0_SUS256_SKXCCM8_VWA1_VWB4_WGM8_WGMXCC1_WGMXCCGn1
    SolutionIndex: 80
    SolutionNameMin: Cijk_Alik_Bjlk_HSS_BH_UserArgs_MT256x128x64_MI16x16x1_SN_LDSB1_CLR1_GSU0_GSUC0_GSUWGMRR0_K1_LBSPPA512_LBSPPB2048_LPB0_MIWT8_4_PLR1_SU32_SUM0_SUS256_SKXCCM8_VWA4_VWB4_WGM8_WGMXCC1_WGMXCCGn1
    SolutionIndex: 81
    SolutionNameMin: Cijk_Alik_Bjlk_HSS_BH_UserArgs_MT128x128x64_MI16x16x1_SN_LDSB1_CLR1_GSU0_GSUC0_GSUWGMRR0_K1_LBSPPA128_LBSPPB2048_LPB0_MIWT4_4_PLR1_SU32_SUM0_SUS256_SKXCCM8_VWA1_VWB4_WGM1_WGMXCC1_WGMXCCGn1
    SolutionIndex: 82
    SolutionNameMin: Cijk_Alik_Bjlk_HSS_BH_UserArgs_MT128x128x64_MI16x16x1_SN_LDSB1_CLR1_GSU0_GSUC0_GSUWGMRR0_K1_LBSPPA512_LBSPPB2048_LPB0_MIWT4_4_PLR1_SU32_SUM0_SUS256_SKXCCM8_VWA4_VWB4_WGM1_WGMXCC1_WGMXCCGn1
    SolutionIndex: 83
    SolutionNameMin: Cijk_Alik_Bjlk_HSS_BH_UserArgs_MT128x128x64_MI16x16x1_SN_LDSB1_CLR1_GSU0_GSUC0_GSUWGMRR0_K1_LBSPPA512_LBSPPB2048_LPB0_MIWT4_4_PLR1_SU32_SUM0_SUS256_SKXCCM8_VWA4_VWB4_WGM4_WGMXCC1_WGMXCCGn1
    SolutionIndex: 84
    SolutionNameMin: Cijk_Alik_Bjlk_HSS_BH_UserArgs_MT128x128x64_MI16x16x1_SN_LDSB1_CLR1_GSU0_GSUC0_GSUWGMRR0_K1_LBSPPA128_LBSPPB2048_LPB0_MIWT4_4_PLR1_SU32_SUM0_SUS256_SKXCCM8_VWA1_VWB4_WGM8_WGMXCC1_WGMXCCGn1
    SolutionIndex: 85
    SolutionNameMin: Cijk_Alik_Bjlk_HSS_BH_UserArgs_MT128x128x64_MI16x16x1_SN_LDSB1_CLR1_GSU0_GSUC0_GSUWGMRR0_K1_LBSPPA256_LBSPPB2048_LPB0_MIWT4_4_PLR1_SU32_SUM0_SUS256_SKXCCM8_VWA2_VWB4_WGM8_WGMXCC1_WGMXCCGn1
    SolutionIndex: 86
    SolutionNameMin: Cijk_Alik_Bjlk_HSS_BH_UserArgs_MT128x128x64_MI16x16x1_SN_LDSB1_CLR1_GSU0_GSUC0_GSUWGMRR0_K1_LBSPPA512_LBSPPB2048_LPB0_MIWT4_4_PLR1_SU32_SUM0_SUS256_SKXCCM8_VWA4_VWB4_WGM8_WGMXCC1_WGMXCCGn1
    SolutionIndex: 87
    SolutionNameMin: Cijk_Alik_Bjlk_HSS_BH_UserArgs_MT64x128x64_MI16x16x1_SN_LDSB1_CLR1_GSU0_GSUC0_GSUWGMRR0_K1_LBSPPA128_LBSPPB2048_LPB0_MIWT2_4_PLR1_SU32_SUM0_SUS256_SKXCCM8_VWA1_VWB4_WGM4_WGMXCC1_WGMXCCGn1
    SolutionIndex: 88
    SolutionNameMin: Cijk_Alik_Bjlk_HSS_BH_UserArgs_MT128x64x64_MI16x16x1_SN_LDSB1_CLR1_GSU0_GSUC0_GSUWGMRR0_K1_LBSPPA512_LBSPPB1024_LPB32_MIWT4_2_PLR1_SU32_SUM0_SUS256_SKXCCM8_VWA4_VWB2_WGM1_WGMXCC1_WGMXCCGn1
    SolutionIndex: 89
    SolutionNameMin: Cijk_Alik_Bjlk_HSS_BH_UserArgs_MT128x64x64_MI16x16x1_SN_LDSB1_CLR1_GSU0_GSUC0_GSUWGMRR0_K1_LBSPPA512_LBSPPB1024_LPB32_MIWT4_2_PLR2_SU32_SUM0_SUS256_SKXCCM8_VWA4_VWB2_WGM1_WGMXCC1_WGMXCCGn1
    SolutionIndex: 90
    SolutionNameMin: Cijk_Alik_Bjlk_HSS_BH_UserArgs_MT128x64x64_MI16x16x1_SN_LDSB1_CLR1_GSU0_GSUC0_GSUWGMRR0_K1_LBSPPA512_LBSPPB1024_LPB32_MIWT4_2_PLR1_SU32_SUM0_SUS256_SKXCCM8_VWA4_VWB2_WGM4_WGMXCC1_WGMXCCGn1
    SolutionIndex: 91
    SolutionNameMin: Cijk_Alik_Bjlk_HSS_BH_UserArgs_MT128x64x64_MI16x16x1_SN_LDSB1_CLR1_GSU0_GSUC0_GSUWGMRR0_K1_LBSPPA512_LBSPPB1024_LPB32_MIWT4_2_PLR1_SU32_SUM0_SUS256_SKXCCM8_VWA4_VWB2_WGM8_WGMXCC1_WGMXCCGn1
    SolutionIndex: 92
    SolutionNameMin: Cijk_Alik_Bjlk_HSS_BH_UserArgs_MT128x64x64_MI16x16x1_SN_LDSB1_CLR1_GSU0_GSUC0_GSUWGMRR0_K1_LBSPPA512_LBSPPB1024_LPB32_MIWT4_2_PLR2_SU32_SUM0_SUS256_SKXCCM8_VWA4_VWB2_WGM8_WGMXCC1_WGMXCCGn1
    SolutionIndex: 93
    SolutionNameMin: Cijk_Alik_Bjlk_HSS_BH_UserArgs_MT64x64x64_MI16x16x1_SN_LDSB1_CLR1_GSU0_GSUC0_GSUWGMRR0_K1_LBSPPA128_LBSPPB1024_LPB32_MIWT2_2_PLR1_SU32_SUM0_SUS256_SKXCCM8_VWA1_VWB2_WGM1_WGMXCC1_WGMXCCGn1
    SolutionIndex: 94
    SolutionNameMin: Cijk_Alik_Bjlk_HSS_BH_UserArgs_MT64x64x64_MI16x16x1_SN_LDSB1_CLR1_GSU0_GSUC0_GSUWGMRR0_K1_LBSPPA128_LBSPPB1024_LPB32_MIWT2_2_PLR1_SU32_SUM0_SUS256_SKXCCM8_VWA1_VWB2_WGM4_WGMXCC1_WGMXCCGn1
    SolutionIndex: 95
    SolutionNameMin: Cijk_Alik_Bjlk_HSS_BH_UserArgs_MT64x64x64_MI16x16x1_SN_LDSB1_CLR1_GSU0_GSUC0_GSUWGMRR0_K1_LBSPPA128_LBSPPB1024_LPB32_MIWT2_2_PLR1_SU32_SUM0_SUS256_SKXCCM8_VWA1_VWB2_WGM8_WGMXCC1_WGMXCCGn1
    SolutionIndex: 96
    SolutionNameMin: Cijk_Alik_Bjlk_HSS_BH_UserArgs_MT64x64x64_MI16x16x1_SN_LDSB1_CLR1_GSU0_GSUC0_GSUWGMRR0_K1_LBSPPA256_LBSPPB1024_LPB32_MIWT2_2_PLR1_SU32_SUM0_SUS256_SKXCCM8_VWA2_VWB2_WGM8_WGMXCC1_WGMXCCGn1
    SolutionIndex: 97
    SolutionNameMin: Cijk_Alik_Bjlk_HSS_BH_UserArgs_MT32x64x64_MI16x16x1_SN_LDSB0_CLR1_GSU0_GSUC0_GSUWGMRR0_K1_LBSPPA128_LBSPPB1024_LPB32_MIWT1_2_PLR1_SU32_SUM0_SUS256_SKXCCM8_VWA1_VWB2_WGM1_WGMXCC1_WGMXCCGn1
    SolutionIndex: 98
    SolutionNameMin: Cijk_Alik_Bjlk_HSS_BH_UserArgs_MT64x32x64_MI16x16x1_SN_LDSB0_CLR1_GSU0_GSUC0_GSUWGMRR0_K1_LBSPPA128_LBSPPB512_LPB16_MIWT2_1_PLR1_SU32_SUM0_SUS256_SKXCCM8_VWA1_VWB1_WGM1_WGMXCC1_WGMXCCGn1
    SolutionIndex: 99
    SolutionNameMin: Cijk_Alik_Bjlk_HSS_BH_UserArgs_MT64x32x64_MI16x16x1_SN_LDSB0_CLR1_GSU0_GSUC0_GSUWGMRR0_K1_LBSPPA128_LBSPPB512_LPB16_MIWT2_1_PLR1_SU32_SUM0_SUS256_SKXCCM8_VWA1_VWB1_WGM8_WGMXCC1_WGMXCCGn1
    SolutionIndex: 100
    SolutionNameMin: Cijk_Alik_Bjlk_HSS_BH_UserArgs_MT32x32x64_MI16x16x1_SN_LDSB0_CLR1_GSU0_GSUC0_GSUWGMRR0_K1_LBSPPA128_LBSPPB512_LPB16_MIWT1_1_PLR1_SU32_SUM0_SUS256_SKXCCM8_VWA1_VWB1_WGM1_WGMXCC1_WGMXCCGn1
    SolutionIndex: 101
    SolutionNameMin: Cijk_Alik_Bjlk_HSS_BH_UserArgs_MT32x32x64_MI16x16x1_SN_LDSB0_CLR1_GSU0_GSUC0_GSUWGMRR0_K1_LBSPPA128_LBSPPB512_LPB16_MIWT1_1_PLR2_SU32_SUM0_SUS256_SKXCCM8_VWA1_VWB1_WGM1_WGMXCC1_WGMXCCGn1
    SolutionIndex: 102
    SolutionNameMin: Cijk_Alik_Bjlk_HSS_BH_UserArgs_MT32x32x64_MI16x16x1_SN_LDSB0_CLR1_GSU0_GSUC0_GSUWGMRR0_K1_LBSPPA128_LBSPPB512_LPB16_MIWT1_1_PLR1_SU32_SUM0_SUS256_SKXCCM8_VWA1_VWB1_WGM8_WGMXCC1_WGMXCCGn1
    SolutionIndex: 103
    SolutionNameMin: Cijk_Alik_Bjlk_HSS_BH_UserArgs_MT64x128x128_MI16x16x1_SN_LDSB1_CLR1_GSU0_GSUC0_GSUWGMRR0_K1_LBSPPA256_LBSPPB2048_LPB0_MIWT2_4_PLR1_SU32_SUM0_SUS256_SKXCCM8_VWA1_VWB4_WGM4_WGMXCC1_WGMXCCGn1
    SolutionIndex: 104
    SolutionNameMin: Cijk_Alik_Bjlk_HSS_BH_UserArgs_MT64x128x128_MI16x16x1_SN_LDSB1_CLR1_GSU0_GSUC0_GSUWGMRR0_K1_LBSPPA512_LBSPPB2048_LPB0_MIWT2_4_PLR2_SU32_SUM0_SUS256_SKXCCM8_VWA2_VWB4_WGM8_WGMXCC1_WGMXCCGn1
    SolutionIndex: 105
    SolutionNameMin: Cijk_Alik_Bjlk_HSS_BH_UserArgs_MT128x64x128_MI16x16x1_SN_LDSB1_CLR1_GSU0_GSUC0_GSUWGMRR0_K1_LBSPPA1024_LBSPPB1024_LPB32_MIWT4_2_PLR2_SU32_SUM0_SUS256_SKXCCM8_VWA4_VWB2_WGM1_WGMXCC1_WGMXCCGn1
    SolutionIndex: 106
    SolutionNameMin: Cijk_Alik_Bjlk_HSS_BH_UserArgs_MT128x64x128_MI16x16x1_SN_LDSB1_CLR1_GSU0_GSUC0_GSUWGMRR0_K1_LBSPPA1024_LBSPPB1024_LPB32_MIWT4_2_PLR2_SU32_SUM0_SUS256_SKXCCM8_VWA4_VWB2_WGM4_WGMXCC1_WGMXCCGn1
    SolutionIndex: 107
    SolutionNameMin: Cijk_Alik_Bjlk_HSS_BH_UserArgs_MT128x64x128_MI16x16x1_SN_LDSB1_CLR1_GSU0_GSUC0_GSUWGMRR0_K1_LBSPPA256_LBSPPB1024_LPB32_MIWT4_2_PLR2_SU32_SUM0_SUS256_SKXCCM8_VWA1_VWB2_WGM8_WGMXCC1_WGMXCCGn1
    SolutionIndex: 108
    SolutionNameMin: Cijk_Alik_Bjlk_HSS_BH_UserArgs_MT128x64x128_MI16x16x1_SN_LDSB1_CLR1_GSU0_GSUC0_GSUWGMRR0_K1_LBSPPA512_LBSPPB1024_LPB32_MIWT4_2_PLR2_SU32_SUM0_SUS256_SKXCCM8_VWA2_VWB2_WGM8_WGMXCC1_WGMXCCGn1
    SolutionIndex: 109
    SolutionNameMin: Cijk_Alik_Bjlk_HSS_BH_UserArgs_MT128x64x128_MI16x16x1_SN_LDSB1_CLR1_GSU0_GSUC0_GSUWGMRR0_K1_LBSPPA1024_LBSPPB1024_LPB32_MIWT4_2_PLR2_SU32_SUM0_SUS256_SKXCCM8_VWA4_VWB2_WGM8_WGMXCC1_WGMXCCGn1
    SolutionIndex: 110
    SolutionNameMin: Cijk_Alik_Bjlk_HSS_BH_UserArgs_MT64x64x128_MI16x16x1_SN_LDSB1_CLR1_GSU0_GSUC0_GSUWGMRR0_K1_LBSPPA256_LBSPPB1024_LPB32_MIWT2_2_PLR2_SU32_SUM0_SUS256_SKXCCM8_VWA1_VWB2_WGM1_WGMXCC1_WGMXCCGn1
    SolutionIndex: 111
    SolutionNameMin: Cijk_Alik_Bjlk_HSS_BH_UserArgs_MT64x64x128_MI16x16x1_SN_LDSB1_CLR1_GSU0_GSUC0_GSUWGMRR0_K1_LBSPPA512_LBSPPB1024_LPB32_MIWT2_2_PLR2_SU32_SUM0_SUS256_SKXCCM8_VWA2_VWB2_WGM1_WGMXCC1_WGMXCCGn1
    SolutionIndex: 112
    SolutionNameMin: Cijk_Alik_Bjlk_HSS_BH_UserArgs_MT64x64x128_MI16x16x1_SN_LDSB1_CLR1_GSU0_GSUC0_GSUWGMRR0_K1_LBSPPA256_LBSPPB1024_LPB32_MIWT2_2_PLR2_SU32_SUM0_SUS256_SKXCCM8_VWA1_VWB2_WGM4_WGMXCC1_WGMXCCGn1
    SolutionIndex: 113
    SolutionNameMin: Cijk_Alik_Bjlk_HSS_BH_UserArgs_MT64x64x128_MI16x16x1_SN_LDSB1_CLR1_GSU0_GSUC0_GSUWGMRR0_K1_LBSPPA512_LBSPPB1024_LPB32_MIWT2_2_PLR2_SU32_SUM0_SUS256_SKXCCM8_VWA2_VWB2_WGM4_WGMXCC1_WGMXCCGn1
    SolutionIndex: 114
    SolutionNameMin: Cijk_Alik_Bjlk_HSS_BH_UserArgs_MT64x64x128_MI16x16x1_SN_LDSB1_CLR1_GSU0_GSUC0_GSUWGMRR0_K1_LBSPPA256_LBSPPB1024_LPB32_MIWT2_2_PLR2_SU32_SUM0_SUS256_SKXCCM8_VWA1_VWB2_WGM8_WGMXCC1_WGMXCCGn1
    SolutionIndex: 115
    SolutionNameMin: Cijk_Alik_Bjlk_HSS_BH_UserArgs_MT64x64x128_MI16x16x1_SN_LDSB1_CLR1_GSU0_GSUC0_GSUWGMRR0_K1_LBSPPA512_LBSPPB1024_LPB32_MIWT2_2_PLR2_SU32_SUM0_SUS256_SKXCCM8_VWA2_VWB2_WGM8_WGMXCC1_WGMXCCGn1
    SolutionIndex: 116
    SolutionNameMin: Cijk_Alik_Bjlk_HSS_BH_UserArgs_MT32x64x128_MI16x16x1_SN_LDSB1_CLR1_GSU0_GSUC0_GSUWGMRR0_K1_LBSPPA256_LBSPPB1024_LPB32_MIWT1_2_PLR1_SU32_SUM0_SUS256_SKXCCM8_VWA1_VWB2_WGM1_WGMXCC1_WGMXCCGn1
    SolutionIndex: 117
    SolutionNameMin: Cijk_Alik_Bjlk_HSS_BH_UserArgs_MT32x64x128_MI16x16x1_SN_LDSB1_CLR1_GSU0_GSUC0_GSUWGMRR0_K1_LBSPPA256_LBSPPB1024_LPB32_MIWT1_2_PLR2_SU32_SUM0_SUS256_SKXCCM8_VWA1_VWB2_WGM1_WGMXCC1_WGMXCCGn1
    SolutionIndex: 118
    SolutionNameMin: Cijk_Alik_Bjlk_HSS_BH_UserArgs_MT32x64x128_MI16x16x1_SN_LDSB1_CLR1_GSU0_GSUC0_GSUWGMRR0_K1_LBSPPA256_LBSPPB1024_LPB32_MIWT1_2_PLR2_SU32_SUM0_SUS256_SKXCCM8_VWA1_VWB2_WGM4_WGMXCC1_WGMXCCGn1
    SolutionIndex: 119
    SolutionNameMin: Cijk_Alik_Bjlk_HSS_BH_UserArgs_MT32x64x128_MI16x16x1_SN_LDSB1_CLR1_GSU0_GSUC0_GSUWGMRR0_K1_LBSPPA256_LBSPPB1024_LPB32_MIWT1_2_PLR2_SU32_SUM0_SUS256_SKXCCM8_VWA1_VWB2_WGM8_WGMXCC1_WGMXCCGn1
    SolutionIndex: 120
    SolutionNameMin: Cijk_Alik_Bjlk_HSS_BH_UserArgs_MT32x32x128_MI16x16x1_SN_LDSB1_CLR1_GSU0_GSUC0_GSUWGMRR0_K1_LBSPPA256_LBSPPB512_LPB16_MIWT1_1_PLR1_SU32_SUM0_SUS256_SKXCCM8_VWA1_VWB1_WGM1_WGMXCC1_WGMXCCGn1
    SolutionIndex: 121
    SolutionNameMin: Cijk_Alik_Bjlk_HSS_BH_UserArgs_MT32x32x128_MI16x16x1_SN_LDSB1_CLR1_GSU0_GSUC0_GSUWGMRR0_K1_LBSPPA256_LBSPPB512_LPB16_MIWT1_1_PLR2_SU32_SUM0_SUS256_SKXCCM8_VWA1_VWB1_WGM1_WGMXCC1_WGMXCCGn1
    SolutionIndex: 122
    SolutionNameMin: Cijk_Alik_Bjlk_HSS_BH_UserArgs_MT32x32x128_MI16x16x1_SN_LDSB1_CLR1_GSU0_GSUC0_GSUWGMRR0_K1_LBSPPA256_LBSPPB512_LPB16_MIWT1_1_PLR2_SU32_SUM0_SUS256_SKXCCM8_VWA1_VWB1_WGM4_WGMXCC1_WGMXCCGn1
    SolutionIndex: 123
    SolutionNameMin: Cijk_Alik_Bjlk_HSS_BH_UserArgs_MT32x32x32_MI16x16x1_SN_LDSB0_CLR0_GSU0_GSUC0_GSUWGMRR0_K1_LBSPPA128_LBSPPB256_LPB16_MIWT1_1_PLR0_SU32_SUM0_SUS256_SKXCCM8_VWA1_VWB1_WGM8_WGMXCC1_WGMXCCGn1
- - - [128, 128, 1, 128, 128, 128, 128, 128]
    - [31, 0.081]
  - - [128, 128, 1, 256, 128, 128, 256, 128]
    - [30, 0.149]
  - - [128, 128, 1, 512, 128, 128, 512, 128]
    - [120, 0.254]
  - - [128, 128, 1, 1024, 128, 128, 1024, 128]
    - [121, 0.385]
  - - [128, 128, 1, 2048, 128, 128, 2048, 128]
    - [45, 0.578]
  - - [128, 128, 1, 4096, 128, 128, 4096, 128]
    - [30, 1.008]
  - - [128, 128, 1, 8192, 128, 128, 8192, 128]
    - [45, 1.575]
  - - [128, 256, 1, 128, 128, 128, 128, 256]
    - [30, 0.165]
  - - [128, 256, 1, 256, 128, 128, 256, 256]
    - [44, 0.302]
  - - [128, 256, 1, 512, 128, 128, 512, 256]
    - [100, 0.51]
  - - [128, 256, 1, 1024, 128, 128, 1024, 256]
    - [121, 0.775]
  - - [128, 256, 1, 2048, 128, 128, 2048, 256]
    - [45, 1.154]
  - - [128, 256, 1, 4096, 128, 128, 4096, 256]
    - [100, 1.977]
  - - [128, 256, 1, 8192, 128, 128, 8192, 256]
    - [45, 3.05]
  - - [128, 512, 1, 128, 128, 128, 128, 512]
    - [100, 0.336]
  - - [128, 512, 1, 256, 128, 128, 256, 512]
    - [44, 0.603]
  - - [128, 512, 1, 512, 128, 128, 512, 512]
    - [120, 1.009]
  - - [128, 512, 1, 1024, 128, 128, 1024, 512]
    - [44, 1.546]
  - - [128, 512, 1, 2048, 128, 128, 2048, 512]
    - [120, 2.268]
  - - [128, 512, 1, 4096, 128, 128, 4096, 512]
    - [100, 3.773]
  - - [128, 512, 1, 8192, 128, 128, 8192, 512]
    - [45, 5.637]
  - - [128, 1024, 1, 128, 128, 128, 128, 1024]
    - [100, 0.662]
  - - [128, 1024, 1, 256, 128, 128, 256, 1024]
    - [100, 1.19]
  - - [128, 1024, 1, 512, 128, 128, 512, 1024]
    - [121, 1.995]
  - - [128, 1024, 1, 1024, 128, 128, 1024, 1024]
    - [45, 3.028]
  - - [128, 1024, 1, 2048, 128, 128, 2048, 1024]
    - [47, 4.213]
  - - [128, 1024, 1, 4096, 128, 128, 4096, 1024]
    - [47, 6.234]
  - - [128, 1024, 1, 8192, 128, 128, 8192, 1024]
    - [42, 9.318]
  - - [128, 2048, 1, 128, 128, 128, 128, 2048]
    - [30, 1.229]
  - - [128, 2048, 1, 256, 128, 128, 256, 2048]
    - [30, 2.247]
  - - [128, 2048, 1, 512, 128, 128, 512, 2048]
    - [30, 3.842]
  - - [128, 2048, 1, 1024, 128, 128, 1024, 2048]
    - [47, 5.705]
  - - [128, 2048, 1, 2048, 128, 128, 2048, 2048]
    - [41, 7.26]
  - - [128, 2048, 1, 4096, 128, 128, 4096, 2048]
    - [26, 9.573]
  - - [128, 2048, 1, 8192, 128, 128, 8192, 2048]
    - [38, 13.17]
  - - [128, 4096, 1, 128, 128, 128, 128, 4096]
    - [99, 2.181]
  - - [128, 4096, 1, 256, 128, 128, 256, 4096]
    - [98, 4.013]
  - - [128, 4096, 1, 512, 128, 128, 512, 4096]
    - [41, 6.6]
  - - [128, 4096, 1, 1024, 128, 128, 1024, 4096]
    - [116, 9.25]
  - - [128, 4096, 1, 2048, 128, 128, 2048, 4096]
    - [110, 10.505]
  - - [128, 4096, 1, 4096, 128, 128, 4096, 4096]
    - [110, 13.497]
  - - [128, 4096, 1, 8192, 128, 128, 8192, 4096]
    - [109, 16.953]
  - - [128, 8192, 1, 128, 128, 128, 128, 8192]
    - [95, 3.75]
  - - [128, 8192, 1, 256, 128, 128, 256, 8192]
    - [93, 6.752]
  - - [128, 8192, 1, 512, 128, 128, 512, 8192]
    - [93, 10.134]
  - - [128, 8192, 1, 1024, 128, 128, 1024, 8192]
    - [113, 13.764]
  - - [128, 8192, 1, 2048, 128, 128, 2048, 8192]
    - [110, 14.701]
  - - [128, 8192, 1, 4096, 128, 128, 4096, 8192]
    - [33, 17.363]
  - - [128, 8192, 1, 8192, 128, 128, 8192, 8192]
    - [83, 20.752]
  - - [256, 128, 1, 128, 256, 256, 128, 128]
    - [100, 0.16]
  - - [256, 128, 1, 256, 256, 256, 256, 128]
    - [100, 0.305]
  - - [256, 128, 1, 512, 256, 256, 512, 128]
    - [100, 0.511]
  - - [256, 128, 1, 1024, 256, 256, 1024, 128]
    - [45, 0.778]
  - - [256, 128, 1, 2048, 256, 256, 2048, 128]
    - [45, 1.152]
  - - [256, 128, 1, 4096, 256, 256, 4096, 128]
    - [102, 1.951]
  - - [256, 128, 1, 8192, 256, 256, 8192, 128]
    - [121, 3.073]
  - - [256, 256, 1, 128, 256, 256, 128, 256]
    - [100, 0.338]
  - - [256, 256, 1, 256, 256, 256, 256, 256]
    - [121, 0.603]
  - - [256, 256, 1, 512, 256, 256, 512, 256]
    - [100, 1.022]
  - - [256, 256, 1, 1024, 256, 256, 1024, 256]
    - [120, 1.545]
  - - [256, 256, 1, 2048, 256, 256, 2048, 256]
    - [121, 2.26]
  - - [256, 256, 1, 4096, 256, 256, 4096, 256]
    - [100, 3.822]
  - - [256, 256, 1, 8192, 256, 256, 8192, 256]
    - [45, 5.636]
  - - [256, 512, 1, 128, 256, 256, 128, 512]
    - [100, 0.659]
  - - [256, 512, 1, 256, 256, 256, 256, 512]
    - [30, 1.193]
  - - [256, 512, 1, 512, 256, 256, 512, 512]
    - [120, 1.988]
  - - [256, 512, 1, 1024, 256, 256, 1024, 512]
    - [45, 3.061]
  - - [256, 512, 1, 2048, 256, 256, 2048, 512]
    - [121, 4.232]
  - - [256, 512, 1, 4096, 256, 256, 4096, 512]
    - [97, 6.365]
  - - [256, 512, 1, 8192, 256, 256, 8192, 512]
    - [40, 9.041]
  - - [256, 1024, 1, 128, 256, 256, 128, 1024]
    - [100, 1.23]
  - - [256, 1024, 1, 256, 256, 256, 256, 1024]
    - [44, 2.252]
  - - [256, 1024, 1, 512, 256, 256, 512, 1024]
    - [120, 3.811]
  - - [256, 1024, 1, 1024, 256, 256, 1024, 1024]
    - [45, 5.857]
  - - [256, 1024, 1, 2048, 256, 256, 2048, 1024]
    - [46, 7.378]
  - - [256, 1024, 1, 4096, 256, 256, 4096, 1024]
    - [41, 9.848]
  - - [256, 1024, 1, 8192, 256, 256, 8192, 1024]
    - [38, 13.763]
  - - [256, 2048, 1, 128, 256, 256, 128, 2048]
    - [116, 2.241]
  - - [256, 2048, 1, 256, 256, 256, 256, 2048]
    - [40, 4.003]
  - - [256, 2048, 1, 512, 256, 256, 512, 2048]
    - [117, 6.716]
  - - [256, 2048, 1, 1024, 256, 256, 1024, 2048]
    - [116, 9.383]
  - - [256, 2048, 1, 2048, 256, 256, 2048, 2048]
    - [38, 10.861]
  - - [256, 2048, 1, 4096, 256, 256, 4096, 2048]
    - [110, 13.948]
  - - [256, 2048, 1, 8192, 256, 256, 8192, 2048]
    - [105, 17.501]
  - - [256, 4096, 1, 128, 256, 256, 128, 4096]
    - [93, 3.807]
  - - [256, 4096, 1, 256, 256, 256, 256, 4096]
    - [93, 6.637]
  - - [256, 4096, 1, 512, 256, 256, 512, 4096]
    - [93, 10.191]
  - - [256, 4096, 1, 1024, 256, 256, 1024, 4096]
    - [111, 13.865]
  - - [256, 4096, 1, 2048, 256, 256, 2048, 4096]
    - [113, 15.61]
  - - [256, 4096, 1, 4096, 256, 256, 4096, 4096]
    - [106, 18.502]
  - - [256, 4096, 1, 8192, 256, 256, 8192, 4096]
    - [83, 20.826]
  - - [256, 8192, 1, 128, 256, 256, 128, 8192]
    - [67, 5.766]
  - - [256, 8192, 1, 256, 256, 256, 256, 8192]
    - [89, 9.286]
  - - [256, 8192, 1, 512, 256, 256, 512, 8192]
    - [90, 13.809]
  - - [256, 8192, 1, 1024, 256, 256, 1024, 8192]
    - [109, 17.653]
  - - [256, 8192, 1, 2048, 256, 256, 2048, 8192]
    - [109, 19.752]
  - - [256, 8192, 1, 4096, 256, 256, 4096, 8192]
    - [104, 22.522]
  - - [256, 8192, 1, 8192, 256, 256, 8192, 8192]
    - [23, 24.314]
  - - [512, 128, 1, 128, 512, 512, 128, 128]
    - [100, 0.335]
  - - [512, 128, 1, 256, 512, 512, 256, 128]
    - [100, 0.608]
  - - [512, 128, 1, 512, 512, 512, 512, 128]
    - [44, 1.027]
  - - [512, 128, 1, 1024, 512, 512, 1024, 128]
    - [45, 1.565]
  - - [512, 128, 1, 2048, 512, 512, 2048, 128]
    - [120, 2.249]
  - - [512, 128, 1, 4096, 512, 512, 4096, 128]
    - [100, 3.834]
  - - [512, 128, 1, 8192, 512, 512, 8192, 128]
    - [122, 5.804]
  - - [512, 256, 1, 128, 512, 512, 128, 256]
    - [120, 0.656]
  - - [512, 256, 1, 256, 512, 512, 256, 256]
    - [30, 1.191]
  - - [512, 256, 1, 512, 512, 512, 512, 256]
    - [44, 2.002]
  - - [512, 256, 1, 1024, 512, 512, 1024, 256]
    - [44, 3.07]
  - - [512, 256, 1, 2048, 512, 512, 2048, 256]
    - [120, 4.259]
  - - [512, 256, 1, 4096, 512, 512, 4096, 256]
    - [97, 6.435]
  - - [512, 256, 1, 8192, 512, 512, 8192, 256]
    - [43, 9.135]
  - - [512, 512, 1, 128, 512, 512, 128, 512]
    - [100, 1.248]
  - - [512, 512, 1, 256, 512, 512, 256, 512]
    - [120, 2.266]
  - - [512, 512, 1, 512, 512, 512, 512, 512]
    - [120, 3.823]
  - - [512, 512, 1, 1024, 512, 512, 1024, 512]
    - [45, 5.884]
  - - [512, 512, 1, 2048, 512, 512, 2048, 512]
    - [121, 7.569]
  - - [512, 512, 1, 4096, 512, 512, 4096, 512]
    - [40, 10.015]
  - - [512, 512, 1, 8192, 512, 512, 8192, 512]
    - [37, 13.878]
  - - [512, 1024, 1, 128, 512, 512, 128, 1024]
    - [29, 2.271]
  - - [512, 1024, 1, 256, 512, 512, 256, 1024]
    - [117, 4.022]
  - - [512, 1024, 1, 512, 512, 512, 512, 1024]
    - [40, 6.694]
  - - [512, 1024, 1, 1024, 512, 512, 1024, 1024]
    - [116, 9.359]
  - - [512, 1024, 1, 2048, 512, 512, 2048, 1024]
    - [41, 11.038]
  - - [512, 1024, 1, 4096, 512, 512, 4096, 1024]
    - [37, 14.241]
  - - [512, 1024, 1, 8192, 512, 512, 8192, 1024]
    - [35, 18.15]
  - - [512, 2048, 1, 128, 512, 512, 128, 2048]
    - [27, 3.674]
  - - [512, 2048, 1, 256, 512, 512, 256, 2048]
    - [93, 6.654]
  - - [512, 2048, 1, 512, 512, 512, 512, 2048]
    - [28, 10.099]
  - - [512, 2048, 1, 1024, 512, 512, 1024, 2048]
    - [110, 13.82]
  - - [512, 2048, 1, 2048, 512, 512, 2048, 2048]
    - [110, 15.868]
  - - [512, 2048, 1, 4096, 512, 512, 4096, 2048]
    - [35, 18.663]
  - - [512, 2048, 1, 8192, 512, 512, 8192, 2048]
    - [83, 21.06]
  - - [512, 4096, 1, 128, 512, 512, 128, 4096]
    - [88, 5.79]
  - - [512, 4096, 1, 256, 512, 512, 256, 4096]
    - [88, 9.459]
  - - [512, 4096, 1, 512, 512, 512, 512, 4096]
    - [88, 14.023]
  - - [512, 4096, 1, 1024, 512, 512, 1024, 4096]
    - [105, 17.742]
  - - [512, 4096, 1, 2048, 512, 512, 2048, 4096]
    - [106, 20.202]
  - - [512, 4096, 1, 4096, 512, 512, 4096, 4096]
    - [106, 23.194]
  - - [512, 4096, 1, 8192, 512, 512, 8192, 4096]
    - [82, 23.97]
  - - [512, 8192, 1, 128, 512, 512, 128, 8192]
    - [63, 7.656]
  - - [512, 8192, 1, 256, 512, 512, 256, 8192]
    - [82, 11.548]
  - - [512, 8192, 1, 512, 512, 512, 512, 8192]
    - [81, 16.882]
  - - [512, 8192, 1, 1024, 512, 512, 1024, 8192]
    - [22, 21.263]
  - - [512, 8192, 1, 2048, 512, 512, 2048, 8192]
    - [24, 25.422]
  - - [512, 8192, 1, 4096, 512, 512, 4096, 8192]
    - [61, 24.775]
  - - [512, 8192, 1, 8192, 512, 512, 8192, 8192]
    - [17, 27.287]
  - - [1024, 128, 1, 128, 1024, 1024, 128, 128]
    - [30, 0.654]
  - - [1024, 128, 1, 256, 1024, 1024, 256, 128]
    - [100, 1.179]
  - - [1024, 128, 1, 512, 1024, 1024, 512, 128]
    - [45, 2.006]
  - - [1024, 128, 1, 1024, 1024, 1024, 1024, 128]
    - [45, 3.084]
  - - [1024, 128, 1, 2048, 1024, 1024, 2048, 128]
    - [120, 4.252]
  - - [1024, 128, 1, 4096, 1024, 1024, 4096, 128]
    - [45, 6.355]
  - - [1024, 128, 1, 8192, 1024, 1024, 8192, 128]
    - [40, 9.081]
  - - [1024, 256, 1, 128, 1024, 1024, 128, 256]
    - [30, 1.264]
  - - [1024, 256, 1, 256, 1024, 1024, 256, 256]
    - [100, 2.273]
  - - [1024, 256, 1, 512, 1024, 1024, 512, 256]
    - [120, 3.849]
  - - [1024, 256, 1, 1024, 1024, 1024, 1024, 256]
    - [45, 5.921]
  - - [1024, 256, 1, 2048, 1024, 1024, 2048, 256]
    - [45, 7.552]
  - - [1024, 256, 1, 4096, 1024, 1024, 4096, 256]
    - [40, 10.086]
  - - [1024, 256, 1, 8192, 1024, 1024, 8192, 256]
    - [37, 13.206]
  - - [1024, 512, 1, 128, 1024, 1024, 128, 512]
    - [29, 2.291]
  - - [1024, 512, 1, 256, 1024, 1024, 256, 512]
    - [117, 4.051]
  - - [1024, 512, 1, 512, 1024, 1024, 512, 512]
    - [117, 6.805]
  - - [1024, 512, 1, 1024, 1024, 1024, 1024, 512]
    - [39, 9.515]
  - - [1024, 512, 1, 2048, 1024, 1024, 2048, 512]
    - [114, 11.34]
  - - [1024, 512, 1, 4096, 1024, 1024, 4096, 512]
    - [36, 14.669]
  - - [1024, 512, 1, 8192, 1024, 1024, 8192, 512]
    - [106, 17.706]
  - - [1024, 1024, 1, 128, 1024, 1024, 128, 1024]
    - [93, 3.752]
  - - [1024, 1024, 1, 256, 1024, 1024, 256, 1024]
    - [93, 6.69]
  - - [1024, 1024, 1, 512, 1024, 1024, 512, 1024]
    - [110, 10.129]
  - - [1024, 1024, 1, 1024, 1024, 1024, 1024, 1024]
    - [38, 13.777]
  - - [1024, 1024, 1, 2048, 1024, 1024, 2048, 1024]
    - [37, 16.035]
  - - [1024, 1024, 1, 4096, 1024, 1024, 4096, 1024]
    - [83, 18.441]
  - - [1024, 1024, 1, 8192, 1024, 1024, 8192, 1024]
    - [83, 21.139]
  - - [1024, 2048, 1, 128, 1024, 1024, 128, 2048]
    - [25, 5.676]
  - - [1024, 2048, 1, 256, 1024, 1024, 256, 2048]
    - [89, 9.406]
  - - [1024, 2048, 1, 512, 1024, 1024, 512, 2048]
    - [88, 14.02]
  - - [1024, 2048, 1, 1024, 1024, 1024, 1024, 2048]
    - [109, 17.474]
  - - [1024, 2048, 1, 2048, 1024, 1024, 2048, 2048]
    - [35, 20.007]
  - - [1024, 2048, 1, 4096, 1024, 1024, 4096, 2048]
    - [108, 22.769]
  - - [1024, 2048, 1, 8192, 1024, 1024, 8192, 2048]
    - [86, 23.799]
  - - [1024, 4096, 1, 128, 1024, 1024, 128, 4096]
    - [62, 7.679]
  - - [1024, 4096, 1, 256, 1024, 1024, 256, 4096]
    - [81, 11.613]
  - - [1024, 4096, 1, 512, 1024, 1024, 512, 4096]
    - [84, 16.803]
  - - [1024, 4096, 1, 1024, 1024, 1024, 1024, 4096]
    - [22, 21.519]
  - - [1024, 4096, 1, 2048, 1024, 1024, 2048, 4096]
    - [23, 24.859]
  - - [1024, 4096, 1, 4096, 1024, 1024, 4096, 4096]
    - [61, 24.283]
  - - [1024, 4096, 1, 8192, 1024, 1024, 8192, 4096]
    - [77, 26.555]
  - - [1024, 8192, 1, 128, 1024, 1024, 128, 8192]
    - [72, 7.694]
  - - [1024, 8192, 1, 256, 1024, 1024, 256, 8192]
    - [80, 12.626]
  - - [1024, 8192, 1, 512, 1024, 1024, 512, 8192]
    - [78, 18.279]
  - - [1024, 8192, 1, 1024, 1024, 1024, 1024, 8192]
    - [78, 23.83]
  - - [1024, 8192, 1, 2048, 1024, 1024, 2048, 8192]
    - [73, 29.215]
  - - [1024, 8192, 1, 4096, 1024, 1024, 4096, 8192]
    - [60, 26.609]
  - - [1024, 8192, 1, 8192, 1024, 1024, 8192, 8192]
    - [52, 29.863]
  - - [2048, 128, 1, 128, 2048, 2048, 128, 128]
    - [101, 1.259]
  - - [2048, 128, 1, 256, 2048, 2048, 256, 128]
    - [100, 2.304]
  - - [2048, 128, 1, 512, 2048, 2048, 512, 128]
    - [44, 3.857]
  - - [2048, 128, 1, 1024, 2048, 2048, 1024, 128]
    - [45, 5.934]
  - - [2048, 128, 1, 2048, 2048, 2048, 2048, 128]
    - [117, 7.565]
  - - [2048, 128, 1, 4096, 2048, 2048, 4096, 128]
    - [118, 9.922]
  - - [2048, 128, 1, 8192, 2048, 2048, 8192, 128]
    - [36, 12.728]
  - - [2048, 256, 1, 128, 2048, 2048, 128, 256]
    - [98, 2.269]
  - - [2048, 256, 1, 256, 2048, 2048, 256, 256]
    - [29, 4.012]
  - - [2048, 256, 1, 512, 2048, 2048, 512, 256]
    - [119, 6.674]
  - - [2048, 256, 1, 1024, 2048, 2048, 1024, 256]
    - [116, 9.381]
  - - [2048, 256, 1, 2048, 2048, 2048, 2048, 256]
    - [114, 11.267]
  - - [2048, 256, 1, 4096, 2048, 2048, 4096, 256]
    - [36, 14.018]
  - - [2048, 256, 1, 8192, 2048, 2048, 8192, 256]
    - [106, 17.505]
  - - [2048, 512, 1, 128, 2048, 2048, 128, 512]
    - [93, 3.834]
  - - [2048, 512, 1, 256, 2048, 2048, 256, 512]
    - [110, 6.656]
  - - [2048, 512, 1, 512, 2048, 2048, 512, 512]
    - [95, 10.327]
  - - [2048, 512, 1, 1024, 2048, 2048, 1024, 512]
    - [114, 13.846]
  - - [2048, 512, 1, 2048, 2048, 2048, 2048, 512]
    - [114, 16.101]
  - - [2048, 512, 1, 4096, 2048, 2048, 4096, 512]
    - [83, 18.556]
  - - [2048, 512, 1, 8192, 2048, 2048, 8192, 512]
    - [86, 20.652]
  - - [2048, 1024, 1, 128, 2048, 2048, 128, 1024]
    - [88, 5.692]
  - - [2048, 1024, 1, 256, 2048, 2048, 256, 1024]
    - [89, 9.415]
  - - [2048, 1024, 1, 512, 2048, 2048, 512, 1024]
    - [87, 13.708]
  - - [2048, 1024, 1, 1024, 2048, 2048, 1024, 1024]
    - [107, 17.462]
  - - [2048, 1024, 1, 2048, 2048, 2048, 2048, 1024]
    - [103, 19.502]
  - - [2048, 1024, 1, 4096, 2048, 2048, 4096, 1024]
    - [32, 22.732]
  - - [2048, 1024, 1, 8192, 2048, 2048, 8192, 1024]
    - [75, 23.914]
  - - [2048, 2048, 1, 128, 2048, 2048, 128, 2048]
    - [5, 7.415]
  - - [2048, 2048, 1, 256, 2048, 2048, 256, 2048]
    - [5, 11.525]
  - - [2048, 2048, 1, 512, 2048, 2048, 512, 2048]
    - [86, 16.651]
  - - [2048, 2048, 1, 1024, 2048, 2048, 1024, 2048]
    - [20, 21.035]
  - - [2048, 2048, 1, 2048, 2048, 2048, 2048, 2048]
    - [20, 24.801]
  - - [2048, 2048, 1, 4096, 2048, 2048, 4096, 2048]
    - [78, 24.327]
  - - [2048, 2048, 1, 8192, 2048, 2048, 8192, 2048]
    - [78, 26.266]
  - - [2048, 4096, 1, 128, 2048, 2048, 128, 4096]
    - [16, 7.6]
  - - [2048, 4096, 1, 256, 2048, 2048, 256, 4096]
    - [10, 12.5]
  - - [2048, 4096, 1, 512, 2048, 2048, 512, 4096]
    - [9, 18.004]
  - - [2048, 4096, 1, 1024, 2048, 2048, 1024, 4096]
    - [16, 23.835]
  - - [2048, 4096, 1, 2048, 2048, 2048, 2048, 4096]
    - [70, 29.24]
  - - [2048, 4096, 1, 4096, 2048, 2048, 4096, 4096]
    - [57, 26.552]
  - - [2048, 4096, 1, 8192, 2048, 2048, 8192, 4096]
    - [59, 29.913]
  - - [2048, 8192, 1, 128, 2048, 2048, 128, 8192]
    - [51, 8.121]
  - - [2048, 8192, 1, 256, 2048, 2048, 256, 8192]
    - [3, 12.955]
  - - [2048, 8192, 1, 512, 2048, 2048, 512, 8192]
    - [52, 19.731]
  - - [2048, 8192, 1, 1024, 2048, 2048, 1024, 8192]
    - [2, 26.271]
  - - [2048, 8192, 1, 2048, 2048, 2048, 2048, 8192]
    - [69, 26.213]
  - - [2048, 8192, 1, 4096, 2048, 2048, 4096, 8192]
    - [52, 29.1]
  - - [2048, 8192, 1, 8192, 2048, 2048, 8192, 8192]
    - [56, 30.767]
  - - [4096, 128, 1, 128, 4096, 4096, 128, 128]
    - [97, 2.287]
  - - [4096, 128, 1, 256, 4096, 4096, 256, 128]
    - [117, 4.017]
  - - [4096, 128, 1, 512, 4096, 4096, 512, 128]
    - [117, 6.686]
  - - [4096, 128, 1, 1024, 4096, 4096, 1024, 128]
    - [116, 9.467]
  - - [4096, 128, 1, 2048, 4096, 4096, 2048, 128]
    - [112, 11.202]
  - - [4096, 128, 1, 4096, 4096, 4096, 4096, 128]
    - [36, 13.722]
  - - [4096, 128, 1, 8192, 4096, 4096, 8192, 128]
    - [106, 16.978]
  - - [4096, 256, 1, 128, 4096, 4096, 128, 256]
    - [94, 3.723]
  - - [4096, 256, 1, 256, 4096, 4096, 256, 256]
    - [94, 6.6]
  - - [4096, 256, 1, 512, 4096, 4096, 512, 256]
    - [94, 9.859]
  - - [4096, 256, 1, 1024, 4096, 4096, 1024, 256]
    - [115, 13.642]
  - - [4096, 256, 1, 2048, 4096, 4096, 2048, 256]
    - [114, 16.398]
  - - [4096, 256, 1, 4096, 4096, 4096, 4096, 256]
    - [83, 18.585]
  - - [4096, 256, 1, 8192, 4096, 4096, 8192, 256]
    - [82, 20.609]
  - - [4096, 512, 1, 128, 4096, 4096, 128, 512]
    - [88, 5.722]
  - - [4096, 512, 1, 256, 4096, 4096, 256, 512]
    - [92, 9.374]
  - - [4096, 512, 1, 512, 4096, 4096, 512, 512]
    - [90, 13.847]
  - - [4096, 512, 1, 1024, 4096, 4096, 1024, 512]
    - [109, 17.966]
  - - [4096, 512, 1, 2048, 4096, 4096, 2048, 512]
    - [33, 20.622]
  - - [4096, 512, 1, 4096, 4096, 4096, 4096, 512]
    - [34, 22.81]
  - - [4096, 512, 1, 8192, 4096, 4096, 8192, 512]
    - [75, 23.984]
  - - [4096, 1024, 1, 128, 4096, 4096, 128, 1024]
    - [65, 7.279]
  - - [4096, 1024, 1, 256, 4096, 4096, 256, 1024]
    - [65, 11.499]
  - - [4096, 1024, 1, 512, 4096, 4096, 512, 1024]
    - [86, 16.755]
  - - [4096, 1024, 1, 1024, 4096, 4096, 1024, 1024]
    - [19, 21.108]
  - - [4096, 1024, 1, 2048, 4096, 4096, 2048, 1024]
    - [84, 24.892]
  - - [4096, 1024, 1, 4096, 4096, 4096, 4096, 1024]
    - [75, 24.256]
  - - [4096, 1024, 1, 8192, 4096, 4096, 8192, 1024]
    - [52, 25.673]
  - - [4096, 2048, 1, 128, 4096, 4096, 128, 2048]
    - [15, 7.644]
  - - [4096, 2048, 1, 256, 4096, 4096, 256, 2048]
    - [14, 12.526]
  - - [4096, 2048, 1, 512, 4096, 4096, 512, 2048]
    - [7, 17.947]
  - - [4096, 2048, 1, 1024, 4096, 4096, 1024, 2048]
    - [13, 23.592]
  - - [4096, 2048, 1, 2048, 4096, 4096, 2048, 2048]
    - [12, 28.837]
  - - [4096, 2048, 1, 4096, 4096, 4096, 4096, 2048]
    - [57, 26.737]
  - - [4096, 2048, 1, 8192, 4096, 4096, 8192, 2048]
    - [59, 29.477]
  - - [4096, 4096, 1, 128, 4096, 4096, 128, 4096]
    - [53, 8.126]
  - - [4096, 4096, 1, 256, 4096, 4096, 256, 4096]
    - [54, 12.916]
  - - [4096, 4096, 1, 512, 4096, 4096, 512, 4096]
    - [57, 19.394]
  - - [4096, 4096, 1, 1024, 4096, 4096, 1024, 4096]
    - [60, 26.544]
  - - [4096, 4096, 1, 2048, 4096, 4096, 2048, 4096]
    - [70, 25.688]
  - - [4096, 4096, 1, 4096, 4096, 4096, 4096, 4096]
    - [48, 29.187]
  - - [4096, 4096, 1, 8192, 4096, 4096, 8192, 4096]
    - [50, 32.031]
  - - [4096, 8192, 1, 128, 4096, 4096, 128, 8192]
    - [24, 8.05]
  - - [4096, 8192, 1, 256, 4096, 4096, 256, 8192]
    - [72, 12.415]
  - - [4096, 8192, 1, 512, 4096, 4096, 512, 8192]
    - [85, 16.833]
  - - [4096, 8192, 1, 1024, 4096, 4096, 1024, 8192]
    - [52, 21.913]
  - - [4096, 8192, 1, 2048, 4096, 4096, 2048, 8192]
    - [51, 26.932]
  - - [4096, 8192, 1, 4096, 4096, 4096, 4096, 8192]
    - [52, 30.203]
  - - [4096, 8192, 1, 8192, 4096, 4096, 8192, 8192]
    - [52, 33.826]
  - - [8192, 128, 1, 128, 8192, 8192, 128, 128]
    - [94, 3.742]
  - - [8192, 128, 1, 256, 8192, 8192, 256, 128]
    - [95, 6.539]
  - - [8192, 128, 1, 512, 8192, 8192, 512, 128]
    - [96, 9.776]
  - - [8192, 128, 1, 1024, 8192, 8192, 1024, 128]
    - [113, 13.825]
  - - [8192, 128, 1, 2048, 8192, 8192, 2048, 128]
    - [112, 15.137]
  - - [8192, 128, 1, 4096, 8192, 8192, 4096, 128]
    - [86, 18.05]
  - - [8192, 128, 1, 8192, 8192, 8192, 8192, 128]
    - [82, 20.774]
  - - [8192, 256, 1, 128, 8192, 8192, 128, 256]
    - [68, 5.747]
  - - [8192, 256, 1, 256, 8192, 8192, 256, 256]
    - [89, 9.271]
  - - [8192, 256, 1, 512, 8192, 8192, 512, 256]
    - [91, 13.823]
  - - [8192, 256, 1, 1024, 8192, 8192, 1024, 256]
    - [107, 17.301]
  - - [8192, 256, 1, 2048, 8192, 8192, 2048, 256]
    - [33, 19.4]
  - - [8192, 256, 1, 4096, 8192, 8192, 4096, 256]
    - [34, 22.598]
  - - [8192, 256, 1, 8192, 8192, 8192, 8192, 256]
    - [18, 24.793]
  - - [8192, 512, 1, 128, 8192, 8192, 128, 512]
    - [66, 7.742]
  - - [8192, 512, 1, 256, 8192, 8192, 256, 512]
    - [64, 11.753]
  - - [8192, 512, 1, 512, 8192, 8192, 512, 512]
    - [83, 16.425]
  - - [8192, 512, 1, 1024, 8192, 8192, 1024, 512]
    - [19, 20.615]
  - - [8192, 512, 1, 2048, 8192, 8192, 2048, 512]
    - [83, 24.785]
  - - [8192, 512, 1, 4096, 8192, 8192, 4096, 512]
    - [18, 24.86]
  - - [8192, 512, 1, 8192, 8192, 8192, 8192, 512]
    - [76, 27.453]
  - - [8192, 1024, 1, 128, 8192, 8192, 128, 1024]
    - [6, 7.593]
  - - [8192, 1024, 1, 256, 8192, 8192, 256, 1024]
    - [14, 12.488]
  - - [8192, 1024, 1, 512, 8192, 8192, 512, 1024]
    - [14, 18.121]
  - - [8192, 1024, 1, 1024, 8192, 8192, 1024, 1024]
    - [6, 24.076]
  - - [8192, 1024, 1, 2048, 8192, 8192, 2048, 1024]
    - [79, 29.008]
  - - [8192, 1024, 1, 4096, 8192, 8192, 4096, 1024]
    - [11, 26.792]
  - - [8192, 1024, 1, 8192, 8192, 8192, 8192, 1024]
    - [58, 29.368]
  - - [8192, 2048, 1, 128, 8192, 8192, 128, 2048]
    - [14, 8.334]
  - - [8192, 2048, 1, 256, 8192, 8192, 256, 2048]
    - [49, 12.935]
  - - [8192, 2048, 1, 512, 8192, 8192, 512, 2048]
    - [55, 19.312]
  - - [8192, 2048, 1, 1024, 8192, 8192, 1024, 2048]
    - [0, 26.567]
  - - [8192, 2048, 1, 2048, 8192, 8192, 2048, 2048]
    - [69, 25.814]
  - - [8192, 2048, 1, 4096, 8192, 8192, 4096, 2048]
    - [60, 28.419]
  - - [8192, 2048, 1, 8192, 8192, 8192, 8192, 2048]
    - [60, 31.186]
  - - [8192, 4096, 1, 128, 8192, 8192, 128, 4096]
    - [21, 8.261]
  - - [8192, 4096, 1, 256, 8192, 8192, 256, 4096]
    - [71, 12.572]
  - - [8192, 4096, 1, 512, 8192, 8192, 512, 4096]
    - [19, 17.095]
  - - [8192, 4096, 1, 1024, 8192, 8192, 1024, 4096]
    - [49, 22.391]
  - - [8192, 4096, 1, 2048, 8192, 8192, 2048, 4096]
    - [52, 27.403]
  - - [8192, 4096, 1, 4096, 8192, 8192, 4096, 4096]
    - [8, 30.852]
  - - [8192, 4096, 1, 8192, 8192, 8192, 8192, 4096]
    - [52, 33.875]
  - - [8192, 8192, 1, 128, 8192, 8192, 128, 8192]
    - [4, 7.064]
  - - [8192, 8192, 1, 256, 8192, 8192, 256, 8192]
    - [83, 11.383]
  - - [8192, 8192, 1, 512, 8192, 8192, 512, 8192]
    - [74, 17.049]
  - - [8192, 8192, 1, 1024, 8192, 8192, 1024, 8192]
    - [55, 23.351]
  - - [8192, 8192, 1, 2048, 8192, 8192, 2048, 8192]
    - [59, 29.306]
  - - [8192, 8192, 1, 4096, 8192, 8192, 4096, 8192]
    - [1, 33.219]
  - - [8192, 8192, 1, 8192, 8192, 8192, 8192, 8192]
    - [1, 35.112]
  - - [1, 1, 1, 32, 1, 1, 32, 1]
    - [123, 0.0]
- null
- null
- ExperimentalStreamK
- GridBased
