library/src/amd_detail/rocblaslt/src/Tensile/Logic/asm_full/aquavanjaram/gfx942/StreamK/aquavanjaram942_Cijk_Alik_Bljk_BBS_BH_UserArgs.yaml
- {MinimumRequiredVersion: 4.33.0}
- aquavanjaram942
- gfx942
- [Device 0049, Device 0050]
    SolutionIndex: 0
    SolutionNameMin: Cijk_Alik_Bljk_BBS_BH_UserArgs_MT32x32x32_MI16x16x1_SN_LDSB0_CLR0_GSU0_GSUC0_GSUWGMRR0_K1_LBSPPA128_LBSPPB128_MIWT1_1_PLR0_SU32_SUM0_SUS256_SKXCCM0_VWA1_VWB1_WGM1_WGMXCC1_WGMXCCGn1
    SolutionIndex: 1
    SolutionNameMin: Cijk_Alik_Bljk_BBS_BH_UserArgs_MT64x256x64_MI16x16x1_SN_LDSB1_CLR1_GSU0_GSUC0_GSUWGMRR0_K1_LBSPPA256_LBSPPB1024_MIWT2_8_PLR1_SU32_SUM0_SUS256_SKXCCM0_VWA2_VWB8_WGM1_WGMXCC1_WGMXCCGn1
    SolutionIndex: 2
    SolutionNameMin: Cijk_Alik_Bljk_BBS_BH_UserArgs_MT256x64x64_MI16x16x1_SN_LDSB1_CLR1_GSU0_GSUC0_GSUWGMRR0_K1_LBSPPA512_LBSPPB256_MIWT8_2_PLR1_SU32_SUM0_SUS256_SKXCCM0_VWA4_VWB2_WGM4_WGMXCC1_WGMXCCGn1
    SolutionIndex: 3
    SolutionNameMin: Cijk_Alik_Bljk_BBS_BH_UserArgs_MT128x128x64_MI16x16x1_SN_LDSB1_CLR1_GSU0_GSUC0_GSUWGMRR0_K1_LBSPPA256_LBSPPB128_MIWT4_4_PLR1_SU32_SUM0_SUS256_SKXCCM0_VWA2_VWB1_WGM1_WGMXCC1_WGMXCCGn1
    SolutionIndex: 4
    SolutionNameMin: Cijk_Alik_Bljk_BBS_BH_UserArgs_MT128x128x64_MI16x16x1_SN_LDSB1_CLR1_GSU0_GSUC0_GSUWGMRR0_K1_LBSPPA512_LBSPPB128_MIWT4_4_PLR1_SU32_SUM0_SUS256_SKXCCM0_VWA4_VWB1_WGM1_WGMXCC1_WGMXCCGn1
    SolutionIndex: 5
    SolutionNameMin: Cijk_Alik_Bljk_BBS_BH_UserArgs_MT128x128x64_MI16x16x1_SN_LDSB1_CLR1_GSU0_GSUC0_GSUWGMRR0_K1_LBSPPA512_LBSPPB256_MIWT4_4_PLR1_SU32_SUM0_SUS256_SKXCCM0_VWA4_VWB2_WGM1_WGMXCC1_WGMXCCGn1
    SolutionIndex: 6
    SolutionNameMin: Cijk_Alik_Bljk_BBS_BH_UserArgs_MT128x128x64_MI16x16x1_SN_LDSB1_CLR1_GSU0_GSUC0_GSUWGMRR0_K1_LBSPPA256_LBSPPB512_MIWT4_4_PLR1_SU32_SUM0_SUS256_SKXCCM0_VWA2_VWB4_WGM1_WGMXCC1_WGMXCCGn1
    SolutionIndex: 7
    SolutionNameMin: Cijk_Alik_Bljk_BBS_BH_UserArgs_MT128x128x64_MI16x16x1_SN_LDSB1_CLR1_GSU0_GSUC0_GSUWGMRR0_K1_LBSPPA512_LBSPPB512_MIWT4_4_PLR1_SU32_SUM0_SUS256_SKXCCM0_VWA4_VWB4_WGM1_WGMXCC1_WGMXCCGn1
    SolutionIndex: 8
    SolutionNameMin: Cijk_Alik_Bljk_BBS_BH_UserArgs_MT128x128x64_MI16x16x1_SN_LDSB1_CLR1_GSU0_GSUC0_GSUWGMRR0_K1_LBSPPA512_LBSPPB256_MIWT4_4_PLR1_SU32_SUM0_SUS256_SKXCCM0_VWA4_VWB2_WGM4_WGMXCC1_WGMXCCGn1
    SolutionIndex: 9
    SolutionNameMin: Cijk_Alik_Bljk_BBS_BH_UserArgs_MT128x128x64_MI16x16x1_SN_LDSB1_CLR1_GSU0_GSUC0_GSUWGMRR0_K1_LBSPPA512_LBSPPB512_MIWT4_4_PLR1_SU32_SUM0_SUS256_SKXCCM0_VWA4_VWB4_WGM8_WGMXCC1_WGMXCCGn1
    SolutionIndex: 10
    SolutionNameMin: Cijk_Alik_Bljk_BBS_BH_UserArgs_MT64x128x64_MI16x16x1_SN_LDSB1_CLR1_GSU0_GSUC0_GSUWGMRR0_K1_LBSPPA256_LBSPPB128_MIWT2_4_PLR1_SU32_SUM0_SUS256_SKXCCM0_VWA2_VWB1_WGM1_WGMXCC1_WGMXCCGn1
    SolutionIndex: 11
    SolutionNameMin: Cijk_Alik_Bljk_BBS_BH_UserArgs_MT64x128x64_MI16x16x1_SN_LDSB1_CLR1_GSU0_GSUC0_GSUWGMRR0_K1_LBSPPA256_LBSPPB512_MIWT2_4_PLR1_SU32_SUM0_SUS256_SKXCCM0_VWA2_VWB4_WGM4_WGMXCC1_WGMXCCGn1
    SolutionIndex: 12
    SolutionNameMin: Cijk_Alik_Bljk_BBS_BH_UserArgs_MT128x64x64_MI16x16x1_SN_LDSB1_CLR1_GSU0_GSUC0_GSUWGMRR0_K1_LBSPPA512_LBSPPB128_MIWT4_2_PLR1_SU32_SUM0_SUS256_SKXCCM0_VWA4_VWB1_WGM1_WGMXCC1_WGMXCCGn1
    SolutionIndex: 13
    SolutionNameMin: Cijk_Alik_Bljk_BBS_BH_UserArgs_MT128x64x64_MI16x16x1_SN_LDSB1_CLR1_GSU0_GSUC0_GSUWGMRR0_K1_LBSPPA512_LBSPPB256_MIWT4_2_PLR1_SU32_SUM0_SUS256_SKXCCM0_VWA4_VWB2_WGM1_WGMXCC1_WGMXCCGn1
    SolutionIndex: 14
    SolutionNameMin: Cijk_Alik_Bljk_BBS_BH_UserArgs_MT128x64x64_MI16x16x1_SN_LDSB1_CLR1_GSU0_GSUC0_GSUWGMRR0_K1_LBSPPA512_LBSPPB256_MIWT4_2_PLR1_SU32_SUM0_SUS256_SKXCCM0_VWA4_VWB2_WGM4_WGMXCC1_WGMXCCGn1
    SolutionIndex: 15
    SolutionNameMin: Cijk_Alik_Bljk_BBS_BH_UserArgs_MT128x64x64_MI16x16x1_SN_LDSB1_CLR1_GSU0_GSUC0_GSUWGMRR0_K1_LBSPPA512_LBSPPB128_MIWT4_2_PLR1_SU32_SUM0_SUS256_SKXCCM0_VWA4_VWB1_WGM8_WGMXCC1_WGMXCCGn1
    SolutionIndex: 16
    SolutionNameMin: Cijk_Alik_Bljk_BBS_BH_UserArgs_MT32x128x64_MI16x16x1_SN_LDSB1_CLR1_GSU0_GSUC0_GSUWGMRR0_K1_LBSPPA128_LBSPPB512_MIWT1_4_PLR1_SU32_SUM0_SUS256_SKXCCM0_VWA1_VWB4_WGM1_WGMXCC1_WGMXCCGn1
    SolutionIndex: 17
    SolutionNameMin: Cijk_Alik_Bljk_BBS_BH_UserArgs_MT64x64x64_MI16x16x1_SN_LDSB1_CLR1_GSU0_GSUC0_GSUWGMRR0_K1_LBSPPA256_LBSPPB128_MIWT2_2_PLR1_SU32_SUM0_SUS256_SKXCCM0_VWA2_VWB1_WGM1_WGMXCC1_WGMXCCGn1
    SolutionIndex: 18
    SolutionNameMin: Cijk_Alik_Bljk_BBS_BH_UserArgs_MT64x64x64_MI16x16x1_SN_LDSB1_CLR1_GSU0_GSUC0_GSUWGMRR0_K1_LBSPPA256_LBSPPB256_MIWT2_2_PLR1_SU32_SUM0_SUS256_SKXCCM0_VWA2_VWB2_WGM1_WGMXCC1_WGMXCCGn1
    SolutionIndex: 19
    SolutionNameMin: Cijk_Alik_Bljk_BBS_BH_UserArgs_MT32x64x64_MI16x16x1_SN_LDSB0_CLR1_GSU0_GSUC0_GSUWGMRR0_K1_LBSPPA128_LBSPPB128_MIWT1_2_PLR1_SU32_SUM0_SUS256_SKXCCM0_VWA1_VWB1_WGM1_WGMXCC1_WGMXCCGn1
    SolutionIndex: 20
    SolutionNameMin: Cijk_Alik_Bljk_BBS_BH_UserArgs_MT32x64x64_MI16x16x1_SN_LDSB0_CLR1_GSU0_GSUC0_GSUWGMRR0_K1_LBSPPA128_LBSPPB256_MIWT1_2_PLR1_SU32_SUM0_SUS256_SKXCCM0_VWA1_VWB2_WGM1_WGMXCC1_WGMXCCGn1
    SolutionIndex: 21
    SolutionNameMin: Cijk_Alik_Bljk_BBS_BH_UserArgs_MT32x64x64_MI16x16x1_SN_LDSB0_CLR1_GSU0_GSUC0_GSUWGMRR0_K1_LBSPPA128_LBSPPB256_MIWT1_2_PLR1_SU32_SUM0_SUS256_SKXCCM0_VWA1_VWB2_WGM8_WGMXCC1_WGMXCCGn1
    SolutionIndex: 22
    SolutionNameMin: Cijk_Alik_Bljk_BBS_BH_UserArgs_MT64x32x64_MI16x16x1_SN_LDSB0_CLR1_GSU0_GSUC0_GSUWGMRR0_K1_LBSPPA128_LBSPPB128_MIWT2_1_PLR1_SU32_SUM0_SUS256_SKXCCM0_VWA1_VWB1_WGM1_WGMXCC1_WGMXCCGn1
    SolutionIndex: 23
    SolutionNameMin: Cijk_Alik_Bljk_BBS_BH_UserArgs_MT64x32x64_MI16x16x1_SN_LDSB0_CLR1_GSU0_GSUC0_GSUWGMRR0_K1_LBSPPA256_LBSPPB128_MIWT2_1_PLR1_SU32_SUM0_SUS256_SKXCCM0_VWA2_VWB1_WGM1_WGMXCC1_WGMXCCGn1
    SolutionIndex: 24
    SolutionNameMin: Cijk_Alik_Bljk_BBS_BH_UserArgs_MT32x32x64_MI16x16x1_SN_LDSB0_CLR1_GSU0_GSUC0_GSUWGMRR0_K1_LBSPPA128_LBSPPB128_MIWT1_1_PLR1_SU32_SUM0_SUS256_SKXCCM0_VWA1_VWB1_WGM1_WGMXCC1_WGMXCCGn1
    SolutionIndex: 25
    SolutionNameMin: Cijk_Alik_Bljk_BBS_BH_UserArgs_MT32x32x64_MI16x16x1_SN_LDSB0_CLR1_GSU0_GSUC0_GSUWGMRR0_K1_LBSPPA128_LBSPPB128_MIWT1_1_PLR2_SU32_SUM0_SUS256_SKXCCM0_VWA1_VWB1_WGM1_WGMXCC1_WGMXCCGn1
    SolutionIndex: 26
    SolutionNameMin: Cijk_Alik_Bljk_BBS_BH_UserArgs_MT32x32x64_MI16x16x1_SN_LDSB0_CLR1_GSU0_GSUC0_GSUWGMRR0_K1_LBSPPA128_LBSPPB128_MIWT1_1_PLR1_SU32_SUM0_SUS256_SKXCCM0_VWA1_VWB1_WGM8_WGMXCC1_WGMXCCGn1
    SolutionIndex: 27
    SolutionNameMin: Cijk_Alik_Bljk_BBS_BH_UserArgs_MT64x64x128_MI16x16x1_SN_LDSB1_CLR1_GSU0_GSUC0_GSUWGMRR0_K1_LBSPPA256_LBSPPB256_MIWT2_2_PLR1_SU32_SUM0_SUS256_SKXCCM0_VWA1_VWB1_WGM1_WGMXCC1_WGMXCCGn1
    SolutionIndex: 28
    SolutionNameMin: Cijk_Alik_Bljk_BBS_BH_UserArgs_MT64x64x128_MI16x16x1_SN_LDSB1_CLR1_GSU0_GSUC0_GSUWGMRR0_K1_LBSPPA512_LBSPPB256_MIWT2_2_PLR1_SU32_SUM0_SUS256_SKXCCM0_VWA2_VWB1_WGM1_WGMXCC1_WGMXCCGn1
    SolutionIndex: 29
    SolutionNameMin: Cijk_Alik_Bljk_BBS_BH_UserArgs_MT64x64x128_MI16x16x1_SN_LDSB1_CLR1_GSU0_GSUC0_GSUWGMRR0_K1_LBSPPA256_LBSPPB512_MIWT2_2_PLR1_SU32_SUM0_SUS256_SKXCCM0_VWA1_VWB2_WGM1_WGMXCC1_WGMXCCGn1
    SolutionIndex: 30
    SolutionNameMin: Cijk_Alik_Bljk_BBS_BH_UserArgs_MT64x64x128_MI16x16x1_SN_LDSB1_CLR1_GSU0_GSUC0_GSUWGMRR0_K1_LBSPPA512_LBSPPB512_MIWT2_2_PLR1_SU32_SUM0_SUS256_SKXCCM0_VWA2_VWB2_WGM1_WGMXCC1_WGMXCCGn1
    SolutionIndex: 31
    SolutionNameMin: Cijk_Alik_Bljk_BBS_BH_UserArgs_MT64x64x128_MI16x16x1_SN_LDSB1_CLR1_GSU0_GSUC0_GSUWGMRR0_K1_LBSPPA256_LBSPPB256_MIWT2_2_PLR2_SU32_SUM0_SUS256_SKXCCM0_VWA1_VWB1_WGM1_WGMXCC1_WGMXCCGn1
    SolutionIndex: 32
    SolutionNameMin: Cijk_Alik_Bljk_BBS_BH_UserArgs_MT64x64x128_MI16x16x1_SN_LDSB1_CLR1_GSU0_GSUC0_GSUWGMRR0_K1_LBSPPA512_LBSPPB256_MIWT2_2_PLR2_SU32_SUM0_SUS256_SKXCCM0_VWA2_VWB1_WGM1_WGMXCC1_WGMXCCGn1
    SolutionIndex: 33
    SolutionNameMin: Cijk_Alik_Bljk_BBS_BH_UserArgs_MT64x64x128_MI16x16x1_SN_LDSB1_CLR1_GSU0_GSUC0_GSUWGMRR0_K1_LBSPPA256_LBSPPB512_MIWT2_2_PLR2_SU32_SUM0_SUS256_SKXCCM0_VWA1_VWB2_WGM1_WGMXCC1_WGMXCCGn1
    SolutionIndex: 34
    SolutionNameMin: Cijk_Alik_Bljk_BBS_BH_UserArgs_MT64x64x128_MI16x16x1_SN_LDSB1_CLR1_GSU0_GSUC0_GSUWGMRR0_K1_LBSPPA512_LBSPPB256_MIWT2_2_PLR1_SU32_SUM0_SUS256_SKXCCM0_VWA2_VWB1_WGM4_WGMXCC1_WGMXCCGn1
    SolutionIndex: 35
    SolutionNameMin: Cijk_Alik_Bljk_BBS_BH_UserArgs_MT64x64x128_MI16x16x1_SN_LDSB1_CLR1_GSU0_GSUC0_GSUWGMRR0_K1_LBSPPA256_LBSPPB512_MIWT2_2_PLR2_SU32_SUM0_SUS256_SKXCCM0_VWA1_VWB2_WGM4_WGMXCC1_WGMXCCGn1
    SolutionIndex: 36
    SolutionNameMin: Cijk_Alik_Bljk_BBS_BH_UserArgs_MT64x64x128_MI16x16x1_SN_LDSB1_CLR1_GSU0_GSUC0_GSUWGMRR0_K1_LBSPPA512_LBSPPB512_MIWT2_2_PLR2_SU32_SUM0_SUS256_SKXCCM0_VWA2_VWB2_WGM4_WGMXCC1_WGMXCCGn1
    SolutionIndex: 37
    SolutionNameMin: Cijk_Alik_Bljk_BBS_BH_UserArgs_MT64x64x128_MI16x16x1_SN_LDSB1_CLR1_GSU0_GSUC0_GSUWGMRR0_K1_LBSPPA512_LBSPPB512_MIWT2_2_PLR1_SU32_SUM0_SUS256_SKXCCM0_VWA2_VWB2_WGM8_WGMXCC1_WGMXCCGn1
    SolutionIndex: 38
    SolutionNameMin: Cijk_Alik_Bljk_BBS_BH_UserArgs_MT64x64x128_MI16x16x1_SN_LDSB1_CLR1_GSU0_GSUC0_GSUWGMRR0_K1_LBSPPA512_LBSPPB256_MIWT2_2_PLR2_SU32_SUM0_SUS256_SKXCCM0_VWA2_VWB1_WGM8_WGMXCC1_WGMXCCGn1
    SolutionIndex: 39
    SolutionNameMin: Cijk_Alik_Bljk_BBS_BH_UserArgs_MT64x64x128_MI16x16x1_SN_LDSB1_CLR1_GSU0_GSUC0_GSUWGMRR0_K1_LBSPPA256_LBSPPB512_MIWT2_2_PLR2_SU32_SUM0_SUS256_SKXCCM0_VWA1_VWB2_WGM8_WGMXCC1_WGMXCCGn1
    SolutionIndex: 40
    SolutionNameMin: Cijk_Alik_Bljk_BBS_BH_UserArgs_MT32x64x128_MI16x16x1_SN_LDSB1_CLR1_GSU0_GSUC0_GSUWGMRR0_K1_LBSPPA256_LBSPPB512_MIWT1_2_PLR1_SU32_SUM0_SUS256_SKXCCM0_VWA1_VWB2_WGM1_WGMXCC1_WGMXCCGn1
    SolutionIndex: 41
    SolutionNameMin: Cijk_Alik_Bljk_BBS_BH_UserArgs_MT32x64x128_MI16x16x1_SN_LDSB1_CLR1_GSU0_GSUC0_GSUWGMRR0_K1_LBSPPA256_LBSPPB256_MIWT1_2_PLR1_SU32_SUM0_SUS256_SKXCCM0_VWA1_VWB1_WGM8_WGMXCC1_WGMXCCGn1
    SolutionIndex: 42
    SolutionNameMin: Cijk_Alik_Bljk_BBS_BH_UserArgs_MT32x64x128_MI16x16x1_SN_LDSB1_CLR1_GSU0_GSUC0_GSUWGMRR0_K1_LBSPPA256_LBSPPB256_MIWT1_2_PLR2_SU32_SUM0_SUS256_SKXCCM0_VWA1_VWB1_WGM8_WGMXCC1_WGMXCCGn1
    SolutionIndex: 43
    SolutionNameMin: Cijk_Alik_Bljk_BBS_BH_UserArgs_MT64x32x128_MI16x16x1_SN_LDSB1_CLR1_GSU0_GSUC0_GSUWGMRR0_K1_LBSPPA256_LBSPPB256_MIWT2_1_PLR2_SU32_SUM0_SUS256_SKXCCM0_VWA1_VWB1_WGM1_WGMXCC1_WGMXCCGn1
    SolutionIndex: 44
    SolutionNameMin: Cijk_Alik_Bljk_BBS_BH_UserArgs_MT64x32x128_MI16x16x1_SN_LDSB1_CLR1_GSU0_GSUC0_GSUWGMRR0_K1_LBSPPA512_LBSPPB256_MIWT2_1_PLR2_SU32_SUM0_SUS256_SKXCCM0_VWA2_VWB1_WGM1_WGMXCC1_WGMXCCGn1
    SolutionIndex: 45
    SolutionNameMin: Cijk_Alik_Bljk_BBS_BH_UserArgs_MT64x32x128_MI16x16x1_SN_LDSB1_CLR1_GSU0_GSUC0_GSUWGMRR0_K1_LBSPPA512_LBSPPB256_MIWT2_1_PLR2_SU32_SUM0_SUS256_SKXCCM0_VWA2_VWB1_WGM8_WGMXCC1_WGMXCCGn1
    SolutionIndex: 46
    SolutionNameMin: Cijk_Alik_Bljk_BBS_BH_UserArgs_MT32x32x128_MI16x16x1_SN_LDSB1_CLR1_GSU0_GSUC0_GSUWGMRR0_K1_LBSPPA256_LBSPPB256_MIWT1_1_PLR1_SU32_SUM0_SUS256_SKXCCM0_VWA1_VWB1_WGM1_WGMXCC1_WGMXCCGn1
    SolutionIndex: 47
    SolutionNameMin: Cijk_Alik_Bljk_BBS_BH_UserArgs_MT32x32x128_MI16x16x1_SN_LDSB1_CLR1_GSU0_GSUC0_GSUWGMRR0_K1_LBSPPA256_LBSPPB256_MIWT1_1_PLR2_SU32_SUM0_SUS256_SKXCCM0_VWA1_VWB1_WGM1_WGMXCC1_WGMXCCGn1
    SolutionIndex: 48
    SolutionNameMin: Cijk_Alik_Bljk_BBS_BH_UserArgs_MT32x32x128_MI16x16x1_SN_LDSB1_CLR1_GSU0_GSUC0_GSUWGMRR0_K1_LBSPPA256_LBSPPB256_MIWT1_1_PLR2_SU32_SUM0_SUS256_SKXCCM0_VWA1_VWB1_WGM4_WGMXCC1_WGMXCCGn1
    SolutionIndex: 49
    SolutionNameMin: Cijk_Alik_Bljk_BBS_BH_UserArgs_MT256x64x64_MI16x16x1_SN_LDSB1_CLR1_GSU0_GSUC0_GSUWGMRR0_K1_LBSPPA1024_LBSPPB256_MIWT8_2_PLR1_SU32_SUM0_SUS256_SKXCCM8_VWA8_VWB2_WGM1_WGMXCC1_WGMXCCGn1
    SolutionIndex: 50
    SolutionNameMin: Cijk_Alik_Bljk_BBS_BH_UserArgs_MT128x128x64_MI16x16x1_SN_LDSB1_CLR1_GSU0_GSUC0_GSUWGMRR0_K1_LBSPPA256_LBSPPB128_MIWT4_4_PLR1_SU32_SUM0_SUS256_SKXCCM8_VWA2_VWB1_WGM1_WGMXCC1_WGMXCCGn1
    SolutionIndex: 51
    SolutionNameMin: Cijk_Alik_Bljk_BBS_BH_UserArgs_MT128x128x64_MI16x16x1_SN_LDSB1_CLR1_GSU0_GSUC0_GSUWGMRR0_K1_LBSPPA512_LBSPPB128_MIWT4_4_PLR1_SU32_SUM0_SUS256_SKXCCM8_VWA4_VWB1_WGM1_WGMXCC1_WGMXCCGn1
    SolutionIndex: 52
    SolutionNameMin: Cijk_Alik_Bljk_BBS_BH_UserArgs_MT128x128x64_MI16x16x1_SN_LDSB1_CLR1_GSU0_GSUC0_GSUWGMRR0_K1_LBSPPA128_LBSPPB256_MIWT4_4_PLR1_SU32_SUM0_SUS256_SKXCCM8_VWA1_VWB2_WGM1_WGMXCC1_WGMXCCGn1
    SolutionIndex: 53
    SolutionNameMin: Cijk_Alik_Bljk_BBS_BH_UserArgs_MT128x128x64_MI16x16x1_SN_LDSB1_CLR1_GSU0_GSUC0_GSUWGMRR0_K1_LBSPPA256_LBSPPB256_MIWT4_4_PLR1_SU32_SUM0_SUS256_SKXCCM8_VWA2_VWB2_WGM1_WGMXCC1_WGMXCCGn1
    SolutionIndex: 54
    SolutionNameMin: Cijk_Alik_Bljk_BBS_BH_UserArgs_MT128x128x64_MI16x16x1_SN_LDSB1_CLR1_GSU0_GSUC0_GSUWGMRR0_K1_LBSPPA512_LBSPPB256_MIWT4_4_PLR1_SU32_SUM0_SUS256_SKXCCM8_VWA4_VWB2_WGM1_WGMXCC1_WGMXCCGn1
    SolutionIndex: 55
    SolutionNameMin: Cijk_Alik_Bljk_BBS_BH_UserArgs_MT128x128x64_MI16x16x1_SN_LDSB1_CLR1_GSU0_GSUC0_GSUWGMRR0_K1_LBSPPA128_LBSPPB512_MIWT4_4_PLR1_SU32_SUM0_SUS256_SKXCCM8_VWA1_VWB4_WGM1_WGMXCC1_WGMXCCGn1
    SolutionIndex: 56
    SolutionNameMin: Cijk_Alik_Bljk_BBS_BH_UserArgs_MT128x128x64_MI16x16x1_SN_LDSB1_CLR1_GSU0_GSUC0_GSUWGMRR0_K1_LBSPPA256_LBSPPB512_MIWT4_4_PLR1_SU32_SUM0_SUS256_SKXCCM8_VWA2_VWB4_WGM1_WGMXCC1_WGMXCCGn1
    SolutionIndex: 57
    SolutionNameMin: Cijk_Alik_Bljk_BBS_BH_UserArgs_MT128x128x64_MI16x16x1_SN_LDSB1_CLR1_GSU0_GSUC0_GSUWGMRR0_K1_LBSPPA512_LBSPPB512_MIWT4_4_PLR1_SU32_SUM0_SUS256_SKXCCM8_VWA4_VWB4_WGM1_WGMXCC1_WGMXCCGn1
    SolutionIndex: 58
    SolutionNameMin: Cijk_Alik_Bljk_BBS_BH_UserArgs_MT128x128x64_MI16x16x1_SN_LDSB1_CLR1_GSU0_GSUC0_GSUWGMRR0_K1_LBSPPA512_LBSPPB256_MIWT4_4_PLR2_SU32_SUM0_SUS256_SKXCCM8_VWA4_VWB2_WGM1_WGMXCC1_WGMXCCGn1
    SolutionIndex: 59
    SolutionNameMin: Cijk_Alik_Bljk_BBS_BH_UserArgs_MT128x128x64_MI16x16x1_SN_LDSB1_CLR1_GSU0_GSUC0_GSUWGMRR0_K1_LBSPPA256_LBSPPB128_MIWT4_4_PLR1_SU32_SUM0_SUS256_SKXCCM8_VWA2_VWB1_WGM4_WGMXCC1_WGMXCCGn1
    SolutionIndex: 60
    SolutionNameMin: Cijk_Alik_Bljk_BBS_BH_UserArgs_MT128x128x64_MI16x16x1_SN_LDSB1_CLR1_GSU0_GSUC0_GSUWGMRR0_K1_LBSPPA512_LBSPPB128_MIWT4_4_PLR1_SU32_SUM0_SUS256_SKXCCM8_VWA4_VWB1_WGM4_WGMXCC1_WGMXCCGn1
    SolutionIndex: 61
    SolutionNameMin: Cijk_Alik_Bljk_BBS_BH_UserArgs_MT128x128x64_MI16x16x1_SN_LDSB1_CLR1_GSU0_GSUC0_GSUWGMRR0_K1_LBSPPA128_LBSPPB256_MIWT4_4_PLR1_SU32_SUM0_SUS256_SKXCCM8_VWA1_VWB2_WGM4_WGMXCC1_WGMXCCGn1
    SolutionIndex: 62
    SolutionNameMin: Cijk_Alik_Bljk_BBS_BH_UserArgs_MT128x128x64_MI16x16x1_SN_LDSB1_CLR1_GSU0_GSUC0_GSUWGMRR0_K1_LBSPPA256_LBSPPB256_MIWT4_4_PLR1_SU32_SUM0_SUS256_SKXCCM8_VWA2_VWB2_WGM4_WGMXCC1_WGMXCCGn1
    SolutionIndex: 63
    SolutionNameMin: Cijk_Alik_Bljk_BBS_BH_UserArgs_MT128x128x64_MI16x16x1_SN_LDSB1_CLR1_GSU0_GSUC0_GSUWGMRR0_K1_LBSPPA512_LBSPPB256_MIWT4_4_PLR1_SU32_SUM0_SUS256_SKXCCM8_VWA4_VWB2_WGM4_WGMXCC1_WGMXCCGn1
    SolutionIndex: 64
    SolutionNameMin: Cijk_Alik_Bljk_BBS_BH_UserArgs_MT128x128x64_MI16x16x1_SN_LDSB1_CLR1_GSU0_GSUC0_GSUWGMRR0_K1_LBSPPA256_LBSPPB512_MIWT4_4_PLR1_SU32_SUM0_SUS256_SKXCCM8_VWA2_VWB4_WGM4_WGMXCC1_WGMXCCGn1
    SolutionIndex: 65
    SolutionNameMin: Cijk_Alik_Bljk_BBS_BH_UserArgs_MT128x128x64_MI16x16x1_SN_LDSB1_CLR1_GSU0_GSUC0_GSUWGMRR0_K1_LBSPPA512_LBSPPB512_MIWT4_4_PLR1_SU32_SUM0_SUS256_SKXCCM8_VWA4_VWB4_WGM4_WGMXCC1_WGMXCCGn1
    SolutionIndex: 66
    SolutionNameMin: Cijk_Alik_Bljk_BBS_BH_UserArgs_MT128x128x64_MI16x16x1_SN_LDSB1_CLR1_GSU0_GSUC0_GSUWGMRR0_K1_LBSPPA256_LBSPPB128_MIWT4_4_PLR1_SU32_SUM0_SUS256_SKXCCM8_VWA2_VWB1_WGM8_WGMXCC1_WGMXCCGn1
    SolutionIndex: 67
    SolutionNameMin: Cijk_Alik_Bljk_BBS_BH_UserArgs_MT128x128x64_MI16x16x1_SN_LDSB1_CLR1_GSU0_GSUC0_GSUWGMRR0_K1_LBSPPA512_LBSPPB128_MIWT4_4_PLR1_SU32_SUM0_SUS256_SKXCCM8_VWA4_VWB1_WGM8_WGMXCC1_WGMXCCGn1
    SolutionIndex: 68
    SolutionNameMin: Cijk_Alik_Bljk_BBS_BH_UserArgs_MT128x128x64_MI16x16x1_SN_LDSB1_CLR1_GSU0_GSUC0_GSUWGMRR0_K1_LBSPPA128_LBSPPB256_MIWT4_4_PLR1_SU32_SUM0_SUS256_SKXCCM8_VWA1_VWB2_WGM8_WGMXCC1_WGMXCCGn1
    SolutionIndex: 69
    SolutionNameMin: Cijk_Alik_Bljk_BBS_BH_UserArgs_MT128x128x64_MI16x16x1_SN_LDSB1_CLR1_GSU0_GSUC0_GSUWGMRR0_K1_LBSPPA512_LBSPPB256_MIWT4_4_PLR1_SU32_SUM0_SUS256_SKXCCM8_VWA4_VWB2_WGM8_WGMXCC1_WGMXCCGn1
    SolutionIndex: 70
    SolutionNameMin: Cijk_Alik_Bljk_BBS_BH_UserArgs_MT128x128x64_MI16x16x1_SN_LDSB1_CLR1_GSU0_GSUC0_GSUWGMRR0_K1_LBSPPA128_LBSPPB512_MIWT4_4_PLR1_SU32_SUM0_SUS256_SKXCCM8_VWA1_VWB4_WGM8_WGMXCC1_WGMXCCGn1
    SolutionIndex: 71
    SolutionNameMin: Cijk_Alik_Bljk_BBS_BH_UserArgs_MT128x128x64_MI16x16x1_SN_LDSB1_CLR1_GSU0_GSUC0_GSUWGMRR0_K1_LBSPPA256_LBSPPB512_MIWT4_4_PLR1_SU32_SUM0_SUS256_SKXCCM8_VWA2_VWB4_WGM8_WGMXCC1_WGMXCCGn1
    SolutionIndex: 72
    SolutionNameMin: Cijk_Alik_Bljk_BBS_BH_UserArgs_MT128x128x64_MI16x16x1_SN_LDSB1_CLR1_GSU0_GSUC0_GSUWGMRR0_K1_LBSPPA512_LBSPPB512_MIWT4_4_PLR1_SU32_SUM0_SUS256_SKXCCM8_VWA4_VWB4_WGM8_WGMXCC1_WGMXCCGn1
    SolutionIndex: 73
    SolutionNameMin: Cijk_Alik_Bljk_BBS_BH_UserArgs_MT64x128x64_MI16x16x1_SN_LDSB1_CLR1_GSU0_GSUC0_GSUWGMRR0_K1_LBSPPA128_LBSPPB128_MIWT2_4_PLR1_SU32_SUM0_SUS256_SKXCCM8_VWA1_VWB1_WGM1_WGMXCC1_WGMXCCGn1
    SolutionIndex: 74
    SolutionNameMin: Cijk_Alik_Bljk_BBS_BH_UserArgs_MT64x128x64_MI16x16x1_SN_LDSB1_CLR1_GSU0_GSUC0_GSUWGMRR0_K1_LBSPPA256_LBSPPB128_MIWT2_4_PLR1_SU32_SUM0_SUS256_SKXCCM8_VWA2_VWB1_WGM1_WGMXCC1_WGMXCCGn1
    SolutionIndex: 75
    SolutionNameMin: Cijk_Alik_Bljk_BBS_BH_UserArgs_MT64x128x64_MI16x16x1_SN_LDSB1_CLR1_GSU0_GSUC0_GSUWGMRR0_K1_LBSPPA256_LBSPPB256_MIWT2_4_PLR1_SU32_SUM0_SUS256_SKXCCM8_VWA2_VWB2_WGM1_WGMXCC1_WGMXCCGn1
    SolutionIndex: 76
    SolutionNameMin: Cijk_Alik_Bljk_BBS_BH_UserArgs_MT64x128x64_MI16x16x1_SN_LDSB1_CLR1_GSU0_GSUC0_GSUWGMRR0_K1_LBSPPA256_LBSPPB512_MIWT2_4_PLR1_SU32_SUM0_SUS256_SKXCCM8_VWA2_VWB4_WGM1_WGMXCC1_WGMXCCGn1
    SolutionIndex: 77
    SolutionNameMin: Cijk_Alik_Bljk_BBS_BH_UserArgs_MT64x128x64_MI16x16x1_SN_LDSB1_CLR1_GSU0_GSUC0_GSUWGMRR0_K1_LBSPPA256_LBSPPB128_MIWT2_4_PLR1_SU32_SUM0_SUS256_SKXCCM8_VWA2_VWB1_WGM4_WGMXCC1_WGMXCCGn1
    SolutionIndex: 78
    SolutionNameMin: Cijk_Alik_Bljk_BBS_BH_UserArgs_MT128x64x64_MI16x16x1_SN_LDSB1_CLR1_GSU0_GSUC0_GSUWGMRR0_K1_LBSPPA256_LBSPPB128_MIWT4_2_PLR1_SU32_SUM0_SUS256_SKXCCM8_VWA2_VWB1_WGM1_WGMXCC1_WGMXCCGn1
    SolutionIndex: 79
    SolutionNameMin: Cijk_Alik_Bljk_BBS_BH_UserArgs_MT128x64x64_MI16x16x1_SN_LDSB1_CLR1_GSU0_GSUC0_GSUWGMRR0_K1_LBSPPA512_LBSPPB128_MIWT4_2_PLR1_SU32_SUM0_SUS256_SKXCCM8_VWA4_VWB1_WGM1_WGMXCC1_WGMXCCGn1
    SolutionIndex: 80
    SolutionNameMin: Cijk_Alik_Bljk_BBS_BH_UserArgs_MT128x64x64_MI16x16x1_SN_LDSB1_CLR1_GSU0_GSUC0_GSUWGMRR0_K1_LBSPPA256_LBSPPB256_MIWT4_2_PLR1_SU32_SUM0_SUS256_SKXCCM8_VWA2_VWB2_WGM1_WGMXCC1_WGMXCCGn1
    SolutionIndex: 81
    SolutionNameMin: Cijk_Alik_Bljk_BBS_BH_UserArgs_MT128x64x64_MI16x16x1_SN_LDSB1_CLR1_GSU0_GSUC0_GSUWGMRR0_K1_LBSPPA512_LBSPPB256_MIWT4_2_PLR1_SU32_SUM0_SUS256_SKXCCM8_VWA4_VWB2_WGM1_WGMXCC1_WGMXCCGn1
    SolutionIndex: 82
    SolutionNameMin: Cijk_Alik_Bljk_BBS_BH_UserArgs_MT128x64x64_MI16x16x1_SN_LDSB1_CLR1_GSU0_GSUC0_GSUWGMRR0_K1_LBSPPA512_LBSPPB128_MIWT4_2_PLR2_SU32_SUM0_SUS256_SKXCCM8_VWA4_VWB1_WGM1_WGMXCC1_WGMXCCGn1
    SolutionIndex: 83
    SolutionNameMin: Cijk_Alik_Bljk_BBS_BH_UserArgs_MT128x64x64_MI16x16x1_SN_LDSB1_CLR1_GSU0_GSUC0_GSUWGMRR0_K1_LBSPPA256_LBSPPB128_MIWT4_2_PLR1_SU32_SUM0_SUS256_SKXCCM8_VWA2_VWB1_WGM4_WGMXCC1_WGMXCCGn1
    SolutionIndex: 84
    SolutionNameMin: Cijk_Alik_Bljk_BBS_BH_UserArgs_MT128x64x64_MI16x16x1_SN_LDSB1_CLR1_GSU0_GSUC0_GSUWGMRR0_K1_LBSPPA512_LBSPPB128_MIWT4_2_PLR1_SU32_SUM0_SUS256_SKXCCM8_VWA4_VWB1_WGM4_WGMXCC1_WGMXCCGn1
    SolutionIndex: 85
    SolutionNameMin: Cijk_Alik_Bljk_BBS_BH_UserArgs_MT128x64x64_MI16x16x1_SN_LDSB1_CLR1_GSU0_GSUC0_GSUWGMRR0_K1_LBSPPA512_LBSPPB256_MIWT4_2_PLR1_SU32_SUM0_SUS256_SKXCCM8_VWA4_VWB2_WGM8_WGMXCC1_WGMXCCGn1
    SolutionIndex: 86
    SolutionNameMin: Cijk_Alik_Bljk_BBS_BH_UserArgs_MT64x64x64_MI16x16x1_SN_LDSB1_CLR1_GSU0_GSUC0_GSUWGMRR0_K1_LBSPPA128_LBSPPB128_MIWT2_2_PLR1_SU32_SUM0_SUS256_SKXCCM8_VWA1_VWB1_WGM1_WGMXCC1_WGMXCCGn1
    SolutionIndex: 87
    SolutionNameMin: Cijk_Alik_Bljk_BBS_BH_UserArgs_MT64x64x64_MI16x16x1_SN_LDSB1_CLR1_GSU0_GSUC0_GSUWGMRR0_K1_LBSPPA256_LBSPPB128_MIWT2_2_PLR1_SU32_SUM0_SUS256_SKXCCM8_VWA2_VWB1_WGM1_WGMXCC1_WGMXCCGn1
    SolutionIndex: 88
    SolutionNameMin: Cijk_Alik_Bljk_BBS_BH_UserArgs_MT64x64x64_MI16x16x1_SN_LDSB1_CLR1_GSU0_GSUC0_GSUWGMRR0_K1_LBSPPA256_LBSPPB128_MIWT2_2_PLR1_SU32_SUM0_SUS256_SKXCCM8_VWA2_VWB1_WGM8_WGMXCC1_WGMXCCGn1
    SolutionIndex: 89
    SolutionNameMin: Cijk_Alik_Bljk_BBS_BH_UserArgs_MT32x64x64_MI16x16x1_SN_LDSB0_CLR1_GSU0_GSUC0_GSUWGMRR0_K1_LBSPPA128_LBSPPB128_MIWT1_2_PLR1_SU32_SUM0_SUS256_SKXCCM8_VWA1_VWB1_WGM1_WGMXCC1_WGMXCCGn1
    SolutionIndex: 90
    SolutionNameMin: Cijk_Alik_Bljk_BBS_BH_UserArgs_MT32x64x64_MI16x16x1_SN_LDSB0_CLR1_GSU0_GSUC0_GSUWGMRR0_K1_LBSPPA128_LBSPPB256_MIWT1_2_PLR1_SU32_SUM0_SUS256_SKXCCM8_VWA1_VWB2_WGM1_WGMXCC1_WGMXCCGn1
    SolutionIndex: 91
    SolutionNameMin: Cijk_Alik_Bljk_BBS_BH_UserArgs_MT64x32x64_MI16x16x1_SN_LDSB0_CLR1_GSU0_GSUC0_GSUWGMRR0_K1_LBSPPA256_LBSPPB128_MIWT2_1_PLR1_SU32_SUM0_SUS256_SKXCCM8_VWA2_VWB1_WGM1_WGMXCC1_WGMXCCGn1
    SolutionIndex: 92
    SolutionNameMin: Cijk_Alik_Bljk_BBS_BH_UserArgs_MT64x32x64_MI16x16x1_SN_LDSB0_CLR1_GSU0_GSUC0_GSUWGMRR0_K1_LBSPPA256_LBSPPB128_MIWT2_1_PLR2_SU32_SUM0_SUS256_SKXCCM8_VWA2_VWB1_WGM1_WGMXCC1_WGMXCCGn1
    SolutionIndex: 93
    SolutionNameMin: Cijk_Alik_Bljk_BBS_BH_UserArgs_MT32x32x64_MI16x16x1_SN_LDSB0_CLR1_GSU0_GSUC0_GSUWGMRR0_K1_LBSPPA128_LBSPPB128_MIWT1_1_PLR1_SU32_SUM0_SUS256_SKXCCM8_VWA1_VWB1_WGM1_WGMXCC1_WGMXCCGn1
    SolutionIndex: 94
    SolutionNameMin: Cijk_Alik_Bljk_BBS_BH_UserArgs_MT32x32x64_MI16x16x1_SN_LDSB0_CLR1_GSU0_GSUC0_GSUWGMRR0_K1_LBSPPA128_LBSPPB128_MIWT1_1_PLR2_SU32_SUM0_SUS256_SKXCCM8_VWA1_VWB1_WGM1_WGMXCC1_WGMXCCGn1
    SolutionIndex: 95
    SolutionNameMin: Cijk_Alik_Bljk_BBS_BH_UserArgs_MT64x64x128_MI16x16x1_SN_LDSB1_CLR1_GSU0_GSUC0_GSUWGMRR0_K1_LBSPPA256_LBSPPB256_MIWT2_2_PLR1_SU32_SUM0_SUS256_SKXCCM8_VWA1_VWB1_WGM1_WGMXCC1_WGMXCCGn1
    SolutionIndex: 96
    SolutionNameMin: Cijk_Alik_Bljk_BBS_BH_UserArgs_MT64x64x128_MI16x16x1_SN_LDSB1_CLR1_GSU0_GSUC0_GSUWGMRR0_K1_LBSPPA512_LBSPPB256_MIWT2_2_PLR1_SU32_SUM0_SUS256_SKXCCM8_VWA2_VWB1_WGM1_WGMXCC1_WGMXCCGn1
    SolutionIndex: 97
    SolutionNameMin: Cijk_Alik_Bljk_BBS_BH_UserArgs_MT64x64x128_MI16x16x1_SN_LDSB1_CLR1_GSU0_GSUC0_GSUWGMRR0_K1_LBSPPA512_LBSPPB512_MIWT2_2_PLR1_SU32_SUM0_SUS256_SKXCCM8_VWA2_VWB2_WGM1_WGMXCC1_WGMXCCGn1
    SolutionIndex: 98
    SolutionNameMin: Cijk_Alik_Bljk_BBS_BH_UserArgs_MT64x64x128_MI16x16x1_SN_LDSB1_CLR1_GSU0_GSUC0_GSUWGMRR0_K1_LBSPPA512_LBSPPB256_MIWT2_2_PLR2_SU32_SUM0_SUS256_SKXCCM8_VWA2_VWB1_WGM1_WGMXCC1_WGMXCCGn1
    SolutionIndex: 99
    SolutionNameMin: Cijk_Alik_Bljk_BBS_BH_UserArgs_MT64x64x128_MI16x16x1_SN_LDSB1_CLR1_GSU0_GSUC0_GSUWGMRR0_K1_LBSPPA512_LBSPPB512_MIWT2_2_PLR2_SU32_SUM0_SUS256_SKXCCM8_VWA2_VWB2_WGM1_WGMXCC1_WGMXCCGn1
    SolutionIndex: 100
    SolutionNameMin: Cijk_Alik_Bljk_BBS_BH_UserArgs_MT64x64x128_MI16x16x1_SN_LDSB1_CLR1_GSU0_GSUC0_GSUWGMRR0_K1_LBSPPA512_LBSPPB256_MIWT2_2_PLR1_SU32_SUM0_SUS256_SKXCCM8_VWA2_VWB1_WGM4_WGMXCC1_WGMXCCGn1
    SolutionIndex: 101
    SolutionNameMin: Cijk_Alik_Bljk_BBS_BH_UserArgs_MT64x64x128_MI16x16x1_SN_LDSB1_CLR1_GSU0_GSUC0_GSUWGMRR0_K1_LBSPPA512_LBSPPB512_MIWT2_2_PLR2_SU32_SUM0_SUS256_SKXCCM8_VWA2_VWB2_WGM4_WGMXCC1_WGMXCCGn1
    SolutionIndex: 102
    SolutionNameMin: Cijk_Alik_Bljk_BBS_BH_UserArgs_MT64x64x128_MI16x16x1_SN_LDSB1_CLR1_GSU0_GSUC0_GSUWGMRR0_K1_LBSPPA256_LBSPPB512_MIWT2_2_PLR1_SU32_SUM0_SUS256_SKXCCM8_VWA1_VWB2_WGM8_WGMXCC1_WGMXCCGn1
    SolutionIndex: 103
    SolutionNameMin: Cijk_Alik_Bljk_BBS_BH_UserArgs_MT64x64x128_MI16x16x1_SN_LDSB1_CLR1_GSU0_GSUC0_GSUWGMRR0_K1_LBSPPA512_LBSPPB256_MIWT2_2_PLR2_SU32_SUM0_SUS256_SKXCCM8_VWA2_VWB1_WGM8_WGMXCC1_WGMXCCGn1
    SolutionIndex: 104
    SolutionNameMin: Cijk_Alik_Bljk_BBS_BH_UserArgs_MT64x64x128_MI16x16x1_SN_LDSB1_CLR1_GSU0_GSUC0_GSUWGMRR0_K1_LBSPPA512_LBSPPB512_MIWT2_2_PLR2_SU32_SUM0_SUS256_SKXCCM8_VWA2_VWB2_WGM8_WGMXCC1_WGMXCCGn1
    SolutionIndex: 105
    SolutionNameMin: Cijk_Alik_Bljk_BBS_BH_UserArgs_MT32x64x128_MI16x16x1_SN_LDSB1_CLR1_GSU0_GSUC0_GSUWGMRR0_K1_LBSPPA256_LBSPPB512_MIWT1_2_PLR1_SU32_SUM0_SUS256_SKXCCM8_VWA1_VWB2_WGM1_WGMXCC1_WGMXCCGn1
    SolutionIndex: 106
    SolutionNameMin: Cijk_Alik_Bljk_BBS_BH_UserArgs_MT64x32x128_MI16x16x1_SN_LDSB1_CLR1_GSU0_GSUC0_GSUWGMRR0_K1_LBSPPA512_LBSPPB256_MIWT2_1_PLR2_SU32_SUM0_SUS256_SKXCCM8_VWA2_VWB1_WGM4_WGMXCC1_WGMXCCGn1
    SolutionIndex: 107
    SolutionNameMin: Cijk_Alik_Bljk_BBS_BH_UserArgs_MT32x32x128_MI16x16x1_SN_LDSB1_CLR1_GSU0_GSUC0_GSUWGMRR0_K1_LBSPPA256_LBSPPB256_MIWT1_1_PLR1_SU32_SUM0_SUS256_SKXCCM8_VWA1_VWB1_WGM1_WGMXCC1_WGMXCCGn1
    SolutionIndex: 108
    SolutionNameMin: Cijk_Alik_Bljk_BBS_BH_UserArgs_MT32x32x128_MI16x16x1_SN_LDSB1_CLR1_GSU0_GSUC0_GSUWGMRR0_K1_LBSPPA256_LBSPPB256_MIWT1_1_PLR2_SU32_SUM0_SUS256_SKXCCM8_VWA1_VWB1_WGM1_WGMXCC1_WGMXCCGn1
    SolutionIndex: 109
    SolutionNameMin: Cijk_Alik_Bljk_BBS_BH_UserArgs_MT32x32x128_MI16x16x1_SN_LDSB1_CLR1_GSU0_GSUC0_GSUWGMRR0_K1_LBSPPA256_LBSPPB256_MIWT1_1_PLR1_SU32_SUM0_SUS256_SKXCCM8_VWA1_VWB1_WGM4_WGMXCC1_WGMXCCGn1
    SolutionIndex: 110
    SolutionNameMin: Cijk_Alik_Bljk_BBS_BH_UserArgs_MT32x32x128_MI16x16x1_SN_LDSB1_CLR1_GSU0_GSUC0_GSUWGMRR0_K1_LBSPPA256_LBSPPB256_MIWT1_1_PLR2_SU32_SUM0_SUS256_SKXCCM8_VWA1_VWB1_WGM4_WGMXCC1_WGMXCCGn1
    SolutionIndex: 111
    SolutionNameMin: Cijk_Alik_Bljk_BBS_BH_UserArgs_MT32x32x128_MI16x16x1_SN_LDSB1_CLR1_GSU0_GSUC0_GSUWGMRR0_K1_LBSPPA256_LBSPPB256_MIWT1_1_PLR2_SU32_SUM0_SUS256_SKXCCM8_VWA1_VWB1_WGM8_WGMXCC1_WGMXCCGn1
    SolutionIndex: 112
    SolutionNameMin: Cijk_Alik_Bljk_BBS_BH_UserArgs_MT32x32x32_MI16x16x1_SN_LDSB0_CLR0_GSU0_GSUC0_GSUWGMRR0_K1_LBSPPA128_LBSPPB128_MIWT1_1_PLR0_SU32_SUM0_SUS256_SKXCCM0_VWA1_VWB1_WGM4_WGMXCC1_WGMXCCGn1
- - - [128, 128, 1, 128, 128, 128, 128, 128]
    - [93, 0.091]
  - - [128, 128, 1, 256, 128, 128, 256, 256]
    - [24, 0.17]
  - - [128, 128, 1, 512, 128, 128, 512, 512]
    - [93, 0.291]
  - - [128, 128, 1, 1024, 128, 128, 1024, 1024]
    - [107, 0.462]
  - - [128, 128, 1, 2048, 128, 128, 2048, 2048]
    - [108, 0.657]
  - - [128, 128, 1, 4096, 128, 128, 4096, 4096]
    - [93, 1.187]
  - - [128, 128, 1, 8192, 128, 128, 8192, 8192]
    - [108, 1.891]
  - - [128, 256, 1, 128, 128, 128, 128, 128]
    - [26, 0.178]
  - - [128, 256, 1, 256, 128, 128, 256, 256]
    - [24, 0.338]
  - - [128, 256, 1, 512, 128, 128, 512, 512]
    - [24, 0.595]
  - - [128, 256, 1, 1024, 128, 128, 1024, 1024]
    - [108, 0.928]
  - - [128, 256, 1, 2048, 128, 128, 2048, 2048]
    - [107, 1.332]
  - - [128, 256, 1, 4096, 128, 128, 4096, 4096]
    - [93, 2.227]
  - - [128, 256, 1, 8192, 128, 128, 8192, 8192]
    - [108, 3.689]
  - - [128, 512, 1, 128, 128, 128, 128, 128]
    - [24, 0.359]
  - - [128, 512, 1, 256, 128, 128, 256, 256]
    - [107, 0.661]
  - - [128, 512, 1, 512, 128, 128, 512, 512]
    - [24, 1.179]
  - - [128, 512, 1, 1024, 128, 128, 1024, 1024]
    - [46, 1.865]
  - - [128, 512, 1, 2048, 128, 128, 2048, 2048]
    - [108, 2.614]
  - - [128, 512, 1, 4096, 128, 128, 4096, 4096]
    - [93, 4.414]
  - - [128, 512, 1, 8192, 128, 128, 8192, 8192]
    - [108, 7.013]
  - - [128, 1024, 1, 128, 128, 128, 128, 128]
    - [107, 0.706]
  - - [128, 1024, 1, 256, 128, 128, 256, 256]
    - [93, 1.326]
  - - [128, 1024, 1, 512, 128, 128, 512, 512]
    - [46, 2.288]
  - - [128, 1024, 1, 1024, 128, 128, 1024, 1024]
    - [47, 3.713]
  - - [128, 1024, 1, 2048, 128, 128, 2048, 2048]
    - [93, 4.91]
  - - [128, 1024, 1, 4096, 128, 128, 4096, 4096]
    - [108, 7.589]
  - - [128, 1024, 1, 8192, 128, 128, 8192, 8192]
    - [105, 10.464]
  - - [128, 2048, 1, 128, 128, 128, 128, 128]
    - [24, 1.396]
  - - [128, 2048, 1, 256, 128, 128, 256, 256]
    - [24, 2.558]
  - - [128, 2048, 1, 512, 128, 128, 512, 512]
    - [24, 4.271]
  - - [128, 2048, 1, 1024, 128, 128, 1024, 1024]
    - [93, 7.109]
  - - [128, 2048, 1, 2048, 128, 128, 2048, 2048]
    - [108, 9.983]
  - - [128, 2048, 1, 4096, 128, 128, 4096, 4096]
    - [108, 11.564]
  - - [128, 2048, 1, 8192, 128, 128, 8192, 8192]
    - [95, 14.362]
  - - [128, 4096, 1, 128, 128, 128, 128, 128]
    - [23, 2.511]
  - - [128, 4096, 1, 256, 128, 128, 256, 256]
    - [19, 4.597]
  - - [128, 4096, 1, 512, 128, 128, 512, 512]
    - [90, 7.749]
  - - [128, 4096, 1, 1024, 128, 128, 1024, 1024]
    - [42, 11.153]
  - - [128, 4096, 1, 2048, 128, 128, 2048, 2048]
    - [21, 13.493]
  - - [128, 4096, 1, 4096, 128, 128, 4096, 4096]
    - [13, 15.45]
  - - [128, 4096, 1, 8192, 128, 128, 8192, 8192]
    - [14, 17.053]
  - - [128, 8192, 1, 128, 128, 128, 128, 128]
    - [17, 4.526]
  - - [128, 8192, 1, 256, 128, 128, 256, 256]
    - [87, 7.618]
  - - [128, 8192, 1, 512, 128, 128, 512, 512]
    - [87, 12.17]
  - - [128, 8192, 1, 1024, 128, 128, 1024, 1024]
    - [86, 16.135]
  - - [128, 8192, 1, 2048, 128, 128, 2048, 2048]
    - [38, 17.562]
  - - [128, 8192, 1, 4096, 128, 128, 4096, 4096]
    - [39, 19.312]
  - - [128, 8192, 1, 8192, 128, 128, 8192, 8192]
    - [12, 22.074]
  - - [256, 128, 1, 128, 256, 256, 128, 128]
    - [93, 0.18]
  - - [256, 128, 1, 256, 256, 256, 256, 256]
    - [93, 0.34]
  - - [256, 128, 1, 512, 256, 256, 512, 512]
    - [24, 0.587]
  - - [256, 128, 1, 1024, 256, 256, 1024, 1024]
    - [107, 0.935]
  - - [256, 128, 1, 2048, 256, 256, 2048, 2048]
    - [108, 1.282]
  - - [256, 128, 1, 4096, 256, 256, 4096, 4096]
    - [93, 2.294]
  - - [256, 128, 1, 8192, 256, 256, 8192, 8192]
    - [108, 3.657]
  - - [256, 256, 1, 128, 256, 256, 128, 128]
    - [94, 0.349]
  - - [256, 256, 1, 256, 256, 256, 256, 256]
    - [108, 0.665]
  - - [256, 256, 1, 512, 256, 256, 512, 512]
    - [24, 1.171]
  - - [256, 256, 1, 1024, 256, 256, 1024, 1024]
    - [46, 1.858]
  - - [256, 256, 1, 2048, 256, 256, 2048, 2048]
    - [108, 2.574]
  - - [256, 256, 1, 4096, 256, 256, 4096, 4096]
    - [93, 4.424]
  - - [256, 256, 1, 8192, 256, 256, 8192, 8192]
    - [110, 6.92]
  - - [256, 512, 1, 128, 256, 256, 128, 128]
    - [94, 0.701]
  - - [256, 512, 1, 256, 256, 256, 256, 256]
    - [93, 1.321]
  - - [256, 512, 1, 512, 256, 256, 512, 512]
    - [24, 2.282]
  - - [256, 512, 1, 1024, 256, 256, 1024, 1024]
    - [108, 3.661]
  - - [256, 512, 1, 2048, 256, 256, 2048, 2048]
    - [93, 4.914]
  - - [256, 512, 1, 4096, 256, 256, 4096, 4096]
    - [46, 7.571]
  - - [256, 512, 1, 8192, 256, 256, 8192, 8192]
    - [106, 10.293]
  - - [256, 1024, 1, 128, 256, 256, 128, 128]
    - [24, 1.406]
  - - [256, 1024, 1, 256, 256, 256, 256, 256]
    - [24, 2.593]
  - - [256, 1024, 1, 512, 256, 256, 512, 512]
    - [24, 4.348]
  - - [256, 1024, 1, 1024, 256, 256, 1024, 1024]
    - [46, 7.02]
  - - [256, 1024, 1, 2048, 256, 256, 2048, 2048]
    - [108, 9.97]
  - - [256, 1024, 1, 4096, 256, 256, 4096, 4096]
    - [108, 11.594]
  - - [256, 1024, 1, 8192, 256, 256, 8192, 8192]
    - [27, 14.904]
  - - [256, 2048, 1, 128, 256, 256, 128, 128]
    - [20, 2.52]
  - - [256, 2048, 1, 256, 256, 256, 256, 256]
    - [20, 4.597]
  - - [256, 2048, 1, 512, 256, 256, 512, 512]
    - [20, 7.837]
  - - [256, 2048, 1, 1024, 256, 256, 1024, 1024]
    - [91, 11.328]
  - - [256, 2048, 1, 2048, 256, 256, 2048, 2048]
    - [45, 13.719]
  - - [256, 2048, 1, 4096, 256, 256, 4096, 4096]
    - [37, 15.982]
  - - [256, 2048, 1, 8192, 256, 256, 8192, 8192]
    - [102, 17.078]
  - - [256, 4096, 1, 128, 256, 256, 128, 128]
    - [87, 4.442]
  - - [256, 4096, 1, 256, 256, 256, 256, 256]
    - [87, 7.776]
  - - [256, 4096, 1, 512, 256, 256, 512, 512]
    - [98, 12.084]
  - - [256, 4096, 1, 1024, 256, 256, 1024, 1024]
    - [98, 16.399]
  - - [256, 4096, 1, 2048, 256, 256, 2048, 2048]
    - [96, 19.065]
  - - [256, 4096, 1, 4096, 256, 256, 4096, 4096]
    - [38, 20.009]
  - - [256, 4096, 1, 8192, 256, 256, 8192, 8192]
    - [60, 21.806]
  - - [256, 8192, 1, 128, 256, 256, 128, 128]
    - [80, 7.03]
  - - [256, 8192, 1, 256, 256, 256, 256, 256]
    - [78, 11.583]
  - - [256, 8192, 1, 512, 256, 256, 512, 512]
    - [81, 16.686]
  - - [256, 8192, 1, 1024, 256, 256, 1024, 1024]
    - [79, 21.609]
  - - [256, 8192, 1, 2048, 256, 256, 2048, 2048]
    - [79, 22.488]
  - - [256, 8192, 1, 4096, 256, 256, 4096, 4096]
    - [69, 23.923]
  - - [256, 8192, 1, 8192, 256, 256, 8192, 8192]
    - [4, 26.174]
  - - [512, 128, 1, 128, 512, 512, 128, 128]
    - [93, 0.361]
  - - [512, 128, 1, 256, 512, 512, 256, 256]
    - [24, 0.668]
  - - [512, 128, 1, 512, 512, 512, 512, 512]
    - [108, 1.158]
  - - [512, 128, 1, 1024, 512, 512, 1024, 1024]
    - [46, 1.789]
  - - [512, 128, 1, 2048, 512, 512, 2048, 2048]
    - [108, 2.564]
  - - [512, 128, 1, 4096, 512, 512, 4096, 4096]
    - [93, 4.398]
  - - [512, 128, 1, 8192, 512, 512, 8192, 8192]
    - [110, 6.907]
  - - [512, 256, 1, 128, 512, 512, 128, 128]
    - [93, 0.692]
  - - [512, 256, 1, 256, 512, 512, 256, 256]
    - [24, 1.317]
  - - [512, 256, 1, 512, 512, 512, 512, 512]
    - [24, 2.262]
  - - [512, 256, 1, 1024, 512, 512, 1024, 1024]
    - [47, 3.611]
  - - [512, 256, 1, 2048, 512, 512, 2048, 2048]
    - [107, 4.817]
  - - [512, 256, 1, 4096, 512, 512, 4096, 4096]
    - [111, 7.449]
  - - [512, 256, 1, 8192, 512, 512, 8192, 8192]
    - [43, 10.22]
  - - [512, 512, 1, 128, 512, 512, 128, 128]
    - [93, 1.386]
  - - [512, 512, 1, 256, 512, 512, 256, 256]
    - [108, 2.533]
  - - [512, 512, 1, 512, 512, 512, 512, 512]
    - [24, 4.194]
  - - [512, 512, 1, 1024, 512, 512, 1024, 1024]
    - [46, 6.922]
  - - [512, 512, 1, 2048, 512, 512, 2048, 2048]
    - [46, 10.043]
  - - [512, 512, 1, 4096, 512, 512, 4096, 4096]
    - [109, 11.442]
  - - [512, 512, 1, 8192, 512, 512, 8192, 8192]
    - [33, 15.329]
  - - [512, 1024, 1, 128, 512, 512, 128, 128]
    - [91, 2.564]
  - - [512, 1024, 1, 256, 512, 512, 256, 256]
    - [91, 4.611]
  - - [512, 1024, 1, 512, 512, 512, 512, 512]
    - [90, 7.599]
  - - [512, 1024, 1, 1024, 512, 512, 1024, 1024]
    - [22, 11.112]
  - - [512, 1024, 1, 2048, 512, 512, 2048, 2048]
    - [89, 13.555]
  - - [512, 1024, 1, 4096, 512, 512, 4096, 4096]
    - [35, 16.659]
  - - [512, 1024, 1, 8192, 512, 512, 8192, 8192]
    - [97, 17.223]
  - - [512, 2048, 1, 128, 512, 512, 128, 128]
    - [18, 4.423]
  - - [512, 2048, 1, 256, 512, 512, 256, 256]
    - [18, 7.847]
  - - [512, 2048, 1, 512, 512, 512, 512, 512]
    - [17, 11.97]
  - - [512, 2048, 1, 1024, 512, 512, 1024, 1024]
    - [98, 16.298]
  - - [512, 2048, 1, 2048, 512, 512, 2048, 2048]
    - [98, 19.265]
  - - [512, 2048, 1, 4096, 512, 512, 4096, 4096]
    - [36, 20.164]
  - - [512, 2048, 1, 8192, 512, 512, 8192, 8192]
    - [54, 21.788]
  - - [512, 4096, 1, 128, 512, 512, 128, 128]
    - [80, 6.859]
  - - [512, 4096, 1, 256, 512, 512, 256, 256]
    - [81, 11.881]
  - - [512, 4096, 1, 512, 512, 512, 512, 512]
    - [81, 16.639]
  - - [512, 4096, 1, 1024, 512, 512, 1024, 1024]
    - [79, 21.474]
  - - [512, 4096, 1, 2048, 512, 512, 2048, 2048]
    - [83, 23.032]
  - - [512, 4096, 1, 4096, 512, 512, 4096, 4096]
    - [69, 24.128]
  - - [512, 4096, 1, 8192, 512, 512, 8192, 8192]
    - [69, 27.004]
  - - [512, 8192, 1, 128, 512, 512, 128, 128]
    - [49, 9.739]
  - - [512, 8192, 1, 256, 512, 512, 256, 256]
    - [50, 15.045]
  - - [512, 8192, 1, 512, 512, 512, 512, 512]
    - [51, 21.973]
  - - [512, 8192, 1, 1024, 512, 512, 1024, 1024]
    - [50, 26.251]
  - - [512, 8192, 1, 2048, 512, 512, 2048, 2048]
    - [9, 28.703]
  - - [512, 8192, 1, 4096, 512, 512, 4096, 4096]
    - [68, 27.987]
  - - [512, 8192, 1, 8192, 512, 512, 8192, 8192]
    - [2, 26.335]
  - - [1024, 128, 1, 128, 1024, 1024, 128, 128]
    - [24, 0.674]
  - - [1024, 128, 1, 256, 1024, 1024, 256, 256]
    - [93, 1.302]
  - - [1024, 128, 1, 512, 1024, 1024, 512, 512]
    - [24, 2.268]
  - - [1024, 128, 1, 1024, 1024, 1024, 1024, 1024]
    - [46, 3.624]
  - - [1024, 128, 1, 2048, 1024, 1024, 2048, 2048]
    - [108, 4.8]
  - - [1024, 128, 1, 4096, 1024, 1024, 4096, 4096]
    - [48, 7.564]
  - - [1024, 128, 1, 8192, 1024, 1024, 8192, 8192]
    - [41, 10.399]
  - - [1024, 256, 1, 128, 1024, 1024, 128, 128]
    - [0, 1.291]
  - - [1024, 256, 1, 256, 1024, 1024, 256, 256]
    - [24, 2.564]
  - - [1024, 256, 1, 512, 1024, 1024, 512, 512]
    - [24, 4.236]
  - - [1024, 256, 1, 1024, 1024, 1024, 1024, 1024]
    - [47, 7.119]
  - - [1024, 256, 1, 2048, 1024, 1024, 2048, 2048]
    - [46, 9.936]
  - - [1024, 256, 1, 4096, 1024, 1024, 4096, 4096]
    - [46, 11.62]
  - - [1024, 256, 1, 8192, 1024, 1024, 8192, 8192]
    - [35, 14.834]
  - - [1024, 512, 1, 128, 1024, 1024, 128, 128]
    - [20, 2.534]
  - - [1024, 512, 1, 256, 1024, 1024, 256, 256]
    - [91, 4.516]
  - - [1024, 512, 1, 512, 1024, 1024, 512, 512]
    - [19, 7.748]
  - - [1024, 512, 1, 1024, 1024, 1024, 1024, 1024]
    - [23, 11.189]
  - - [1024, 512, 1, 2048, 1024, 1024, 2048, 2048]
    - [19, 13.507]
  - - [1024, 512, 1, 4096, 1024, 1024, 4096, 4096]
    - [30, 16.717]
  - - [1024, 512, 1, 8192, 1024, 1024, 8192, 8192]
    - [104, 17.009]
  - - [1024, 1024, 1, 128, 1024, 1024, 128, 128]
    - [18, 4.466]
  - - [1024, 1024, 1, 256, 1024, 1024, 256, 256]
    - [17, 7.891]
  - - [1024, 1024, 1, 512, 1024, 1024, 512, 512]
    - [96, 12.097]
  - - [1024, 1024, 1, 1024, 1024, 1024, 1024, 1024]
    - [99, 16.231]
  - - [1024, 1024, 1, 2048, 1024, 1024, 2048, 2048]
    - [34, 18.964]
  - - [1024, 1024, 1, 4096, 1024, 1024, 4096, 4096]
    - [36, 19.883]
  - - [1024, 1024, 1, 8192, 1024, 1024, 8192, 8192]
    - [51, 21.904]
  - - [1024, 2048, 1, 128, 1024, 1024, 128, 128]
    - [81, 7.046]
  - - [1024, 2048, 1, 256, 1024, 1024, 256, 256]
    - [74, 11.88]
  - - [1024, 2048, 1, 512, 1024, 1024, 512, 512]
    - [81, 16.562]
  - - [1024, 2048, 1, 1024, 1024, 1024, 1024, 1024]
    - [78, 21.381]
  - - [1024, 2048, 1, 2048, 1024, 1024, 2048, 2048]
    - [11, 23.178]
  - - [1024, 2048, 1, 4096, 1024, 1024, 4096, 4096]
    - [67, 24.035]
  - - [1024, 2048, 1, 8192, 1024, 1024, 8192, 8192]
    - [55, 26.47]
  - - [1024, 4096, 1, 128, 1024, 1024, 128, 128]
    - [54, 9.899]
  - - [1024, 4096, 1, 256, 1024, 1024, 256, 256]
    - [50, 15.395]
  - - [1024, 4096, 1, 512, 1024, 1024, 512, 512]
    - [50, 21.971]
  - - [1024, 4096, 1, 1024, 1024, 1024, 1024, 1024]
    - [50, 26.212]
  - - [1024, 4096, 1, 2048, 1024, 1024, 2048, 2048]
    - [8, 28.778]
  - - [1024, 4096, 1, 4096, 1024, 1024, 4096, 4096]
    - [71, 27.494]
  - - [1024, 4096, 1, 8192, 1024, 1024, 8192, 8192]
    - [72, 25.953]
  - - [1024, 8192, 1, 128, 1024, 1024, 128, 128]
    - [54, 11.191]
  - - [1024, 8192, 1, 256, 1024, 1024, 256, 256]
    - [79, 12.26]
  - - [1024, 8192, 1, 512, 1024, 1024, 512, 512]
    - [60, 17.92]
  - - [1024, 8192, 1, 1024, 1024, 1024, 1024, 1024]
    - [67, 23.278]
  - - [1024, 8192, 1, 2048, 1024, 1024, 2048, 2048]
    - [72, 27.123]
  - - [1024, 8192, 1, 4096, 1024, 1024, 4096, 4096]
    - [70, 26.88]
  - - [1024, 8192, 1, 8192, 1024, 1024, 8192, 8192]
    - [69, 24.641]
  - - [2048, 128, 1, 128, 2048, 2048, 128, 128]
    - [25, 1.4]
  - - [2048, 128, 1, 256, 2048, 2048, 256, 256]
    - [24, 2.605]
  - - [2048, 128, 1, 512, 2048, 2048, 512, 512]
    - [24, 4.342]
  - - [2048, 128, 1, 1024, 2048, 2048, 1024, 1024]
    - [24, 6.872]
  - - [2048, 128, 1, 2048, 2048, 2048, 2048, 2048]
    - [111, 9.729]
  - - [2048, 128, 1, 4096, 2048, 2048, 4096, 4096]
    - [47, 11.627]
  - - [2048, 128, 1, 8192, 2048, 2048, 8192, 8192]
    - [31, 14.456]
  - - [2048, 256, 1, 128, 2048, 2048, 128, 128]
    - [92, 2.581]
  - - [2048, 256, 1, 256, 2048, 2048, 256, 256]
    - [23, 4.713]
  - - [2048, 256, 1, 512, 2048, 2048, 512, 512]
    - [40, 7.711]
  - - [2048, 256, 1, 1024, 2048, 2048, 1024, 1024]
    - [19, 11.365]
  - - [2048, 256, 1, 2048, 2048, 2048, 2048, 2048]
    - [40, 13.749]
  - - [2048, 256, 1, 4096, 2048, 2048, 4096, 4096]
    - [29, 16.064]
  - - [2048, 256, 1, 8192, 2048, 2048, 8192, 8192]
    - [73, 16.326]
  - - [2048, 512, 1, 128, 2048, 2048, 128, 128]
    - [18, 4.572]
  - - [2048, 512, 1, 256, 2048, 2048, 256, 256]
    - [17, 7.981]
  - - [2048, 512, 1, 512, 2048, 2048, 512, 512]
    - [96, 12.188]
  - - [2048, 512, 1, 1024, 2048, 2048, 1024, 1024]
    - [28, 16.459]
  - - [2048, 512, 1, 2048, 2048, 2048, 2048, 2048]
    - [32, 18.881]
  - - [2048, 512, 1, 4096, 2048, 2048, 4096, 4096]
    - [32, 19.887]
  - - [2048, 512, 1, 8192, 2048, 2048, 8192, 8192]
    - [57, 21.821]
  - - [2048, 1024, 1, 128, 2048, 2048, 128, 128]
    - [75, 7.067]
  - - [2048, 1024, 1, 256, 2048, 2048, 256, 256]
    - [15, 11.88]
  - - [2048, 1024, 1, 512, 2048, 2048, 512, 512]
    - [79, 16.877]
  - - [2048, 1024, 1, 1024, 2048, 2048, 1024, 1024]
    - [84, 21.509]
  - - [2048, 1024, 1, 2048, 2048, 2048, 2048, 2048]
    - [85, 22.924]
  - - [2048, 1024, 1, 4096, 2048, 2048, 4096, 4096]
    - [67, 23.886]
  - - [2048, 1024, 1, 8192, 2048, 2048, 8192, 8192]
    - [72, 27.188]
  - - [2048, 2048, 1, 128, 2048, 2048, 128, 128]
    - [54, 10.026]
  - - [2048, 2048, 1, 256, 2048, 2048, 256, 256]
    - [53, 15.617]
  - - [2048, 2048, 1, 512, 2048, 2048, 512, 512]
    - [62, 21.723]
  - - [2048, 2048, 1, 1024, 2048, 2048, 1024, 1024]
    - [59, 26.085]
  - - [2048, 2048, 1, 2048, 2048, 2048, 2048, 2048]
    - [72, 28.607]
  - - [2048, 2048, 1, 4096, 2048, 2048, 4096, 4096]
    - [51, 29.268]
  - - [2048, 2048, 1, 8192, 2048, 2048, 8192, 8192]
    - [54, 28.664]
  - - [2048, 4096, 1, 128, 2048, 2048, 128, 128]
    - [58, 11.231]
  - - [2048, 4096, 1, 256, 2048, 2048, 256, 256]
    - [82, 12.525]
  - - [2048, 4096, 1, 512, 2048, 2048, 512, 512]
    - [51, 18.012]
  - - [2048, 4096, 1, 1024, 2048, 2048, 1024, 1024]
    - [67, 23.285]
  - - [2048, 4096, 1, 2048, 2048, 2048, 2048, 2048]
    - [54, 28.285]
  - - [2048, 4096, 1, 4096, 2048, 2048, 4096, 4096]
    - [71, 26.88]
  - - [2048, 4096, 1, 8192, 2048, 2048, 8192, 8192]
    - [51, 26.698]
  - - [2048, 8192, 1, 128, 2048, 2048, 128, 128]
    - [54, 10.001]
  - - [2048, 8192, 1, 256, 2048, 2048, 256, 256]
    - [51, 16.242]
  - - [2048, 8192, 1, 512, 2048, 2048, 512, 512]
    - [51, 21.019]
  - - [2048, 8192, 1, 1024, 2048, 2048, 1024, 1024]
    - [65, 25.594]
  - - [2048, 8192, 1, 2048, 2048, 2048, 2048, 2048]
    - [69, 28.032]
  - - [2048, 8192, 1, 4096, 2048, 2048, 4096, 4096]
    - [56, 29.448]
  - - [2048, 8192, 1, 8192, 2048, 2048, 8192, 8192]
    - [7, 30.484]
  - - [4096, 128, 1, 128, 4096, 4096, 128, 128]
    - [22, 2.608]
  - - [4096, 128, 1, 256, 4096, 4096, 256, 256]
    - [23, 4.736]
  - - [4096, 128, 1, 512, 4096, 4096, 512, 512]
    - [44, 7.557]
  - - [4096, 128, 1, 1024, 4096, 4096, 1024, 1024]
    - [90, 11.421]
  - - [4096, 128, 1, 2048, 4096, 4096, 2048, 2048]
    - [43, 13.611]
  - - [4096, 128, 1, 4096, 4096, 4096, 4096, 4096]
    - [33, 15.428]
  - - [4096, 128, 1, 8192, 4096, 4096, 8192, 8192]
    - [74, 16.493]
  - - [4096, 256, 1, 128, 4096, 4096, 128, 128]
    - [17, 4.538]
  - - [4096, 256, 1, 256, 4096, 4096, 256, 256]
    - [18, 7.833]
  - - [4096, 256, 1, 512, 4096, 4096, 512, 512]
    - [87, 12.265]
  - - [4096, 256, 1, 1024, 4096, 4096, 1024, 1024]
    - [100, 16.249]
  - - [4096, 256, 1, 2048, 4096, 4096, 2048, 2048]
    - [103, 18.929]
  - - [4096, 256, 1, 4096, 4096, 4096, 4096, 4096]
    - [33, 20.095]
  - - [4096, 256, 1, 8192, 4096, 4096, 8192, 8192]
    - [51, 21.937]
  - - [4096, 512, 1, 128, 4096, 4096, 128, 128]
    - [76, 7.152]
  - - [4096, 512, 1, 256, 4096, 4096, 256, 256]
    - [74, 12.028]
  - - [4096, 512, 1, 512, 4096, 4096, 512, 512]
    - [74, 16.873]
  - - [4096, 512, 1, 1024, 4096, 4096, 1024, 1024]
    - [84, 21.17]
  - - [4096, 512, 1, 2048, 4096, 4096, 2048, 2048]
    - [10, 23.027]
  - - [4096, 512, 1, 4096, 4096, 4096, 4096, 4096]
    - [54, 23.333]
  - - [4096, 512, 1, 8192, 4096, 4096, 8192, 8192]
    - [50, 27.368]
  - - [4096, 1024, 1, 128, 4096, 4096, 128, 128]
    - [53, 10.082]
  - - [4096, 1024, 1, 256, 4096, 4096, 256, 256]
    - [62, 15.39]
  - - [4096, 1024, 1, 512, 4096, 4096, 512, 512]
    - [59, 21.733]
  - - [4096, 1024, 1, 1024, 4096, 4096, 1024, 1024]
    - [59, 26.026]
  - - [4096, 1024, 1, 2048, 4096, 4096, 2048, 2048]
    - [7, 28.73]
  - - [4096, 1024, 1, 4096, 4096, 4096, 4096, 4096]
    - [55, 28.4]
  - - [4096, 1024, 1, 8192, 4096, 4096, 8192, 8192]
    - [51, 27.548]
  - - [4096, 2048, 1, 128, 4096, 4096, 128, 128]
    - [63, 11.056]
  - - [4096, 2048, 1, 256, 4096, 4096, 256, 256]
    - [79, 12.479]
  - - [4096, 2048, 1, 512, 4096, 4096, 512, 512]
    - [69, 17.97]
  - - [4096, 2048, 1, 1024, 4096, 4096, 1024, 1024]
    - [51, 23.367]
  - - [4096, 2048, 1, 2048, 4096, 4096, 2048, 2048]
    - [51, 28.996]
  - - [4096, 2048, 1, 4096, 4096, 4096, 4096, 4096]
    - [52, 28.985]
  - - [4096, 2048, 1, 8192, 4096, 4096, 8192, 8192]
    - [56, 29.178]
  - - [4096, 4096, 1, 128, 4096, 4096, 128, 128]
    - [57, 9.966]
  - - [4096, 4096, 1, 256, 4096, 4096, 256, 256]
    - [4, 15.866]
  - - [4096, 4096, 1, 512, 4096, 4096, 512, 512]
    - [67, 20.646]
  - - [4096, 4096, 1, 1024, 4096, 4096, 1024, 1024]
    - [69, 25.718]
  - - [4096, 4096, 1, 2048, 4096, 4096, 2048, 2048]
    - [66, 28.071]
  - - [4096, 4096, 1, 4096, 4096, 4096, 4096, 4096]
    - [60, 30.03]
  - - [4096, 4096, 1, 8192, 4096, 4096, 8192, 8192]
    - [3, 31.488]
  - - [4096, 8192, 1, 128, 4096, 4096, 128, 128]
    - [7, 12.274]
  - - [4096, 8192, 1, 256, 4096, 4096, 256, 256]
    - [69, 16.911]
  - - [4096, 8192, 1, 512, 4096, 4096, 512, 512]
    - [3, 22.532]
  - - [4096, 8192, 1, 1024, 4096, 4096, 1024, 1024]
    - [67, 26.238]
  - - [4096, 8192, 1, 2048, 4096, 4096, 2048, 2048]
    - [64, 29.161]
  - - [4096, 8192, 1, 4096, 4096, 4096, 4096, 4096]
    - [63, 32.271]
  - - [4096, 8192, 1, 8192, 4096, 4096, 8192, 8192]
    - [59, 32.39]
  - - [8192, 128, 1, 128, 8192, 8192, 128, 128]
    - [18, 4.479]
  - - [8192, 128, 1, 256, 8192, 8192, 256, 256]
    - [16, 7.36]
  - - [8192, 128, 1, 512, 8192, 8192, 512, 512]
    - [88, 11.963]
  - - [8192, 128, 1, 1024, 8192, 8192, 1024, 1024]
    - [100, 15.947]
  - - [8192, 128, 1, 2048, 8192, 8192, 2048, 2048]
    - [28, 17.511]
  - - [8192, 128, 1, 4096, 8192, 8192, 4096, 4096]
    - [101, 19.183]
  - - [8192, 128, 1, 8192, 8192, 8192, 8192, 8192]
    - [4, 21.993]
  - - [8192, 256, 1, 128, 8192, 8192, 128, 128]
    - [85, 6.976]
  - - [8192, 256, 1, 256, 8192, 8192, 256, 256]
    - [77, 11.695]
  - - [8192, 256, 1, 512, 8192, 8192, 512, 512]
    - [85, 16.458]
  - - [8192, 256, 1, 1024, 8192, 8192, 1024, 1024]
    - [77, 21.361]
  - - [8192, 256, 1, 2048, 8192, 8192, 2048, 2048]
    - [7, 21.315]
  - - [8192, 256, 1, 4096, 8192, 8192, 4096, 4096]
    - [54, 23.002]
  - - [8192, 256, 1, 8192, 8192, 8192, 8192, 8192]
    - [1, 26.757]
  - - [8192, 512, 1, 128, 8192, 8192, 128, 128]
    - [64, 9.838]
  - - [8192, 512, 1, 256, 8192, 8192, 256, 256]
    - [59, 15.349]
  - - [8192, 512, 1, 512, 8192, 8192, 512, 512]
    - [66, 21.86]
  - - [8192, 512, 1, 1024, 8192, 8192, 1024, 1024]
    - [59, 25.911]
  - - [8192, 512, 1, 2048, 8192, 8192, 2048, 2048]
    - [67, 28.023]
  - - [8192, 512, 1, 4096, 8192, 8192, 4096, 4096]
    - [53, 28.493]
  - - [8192, 512, 1, 8192, 8192, 8192, 8192, 8192]
    - [54, 27.394]
  - - [8192, 1024, 1, 128, 8192, 8192, 128, 128]
    - [63, 10.961]
  - - [8192, 1024, 1, 256, 8192, 8192, 256, 256]
    - [12, 12.044]
  - - [8192, 1024, 1, 512, 8192, 8192, 512, 512]
    - [69, 17.844]
  - - [8192, 1024, 1, 1024, 8192, 8192, 1024, 1024]
    - [67, 22.996]
  - - [8192, 1024, 1, 2048, 8192, 8192, 2048, 2048]
    - [51, 26.977]
  - - [8192, 1024, 1, 4096, 8192, 8192, 4096, 4096]
    - [53, 29.568]
  - - [8192, 1024, 1, 8192, 8192, 8192, 8192, 8192]
    - [55, 29.967]
  - - [8192, 2048, 1, 128, 8192, 8192, 128, 128]
    - [4, 9.784]
  - - [8192, 2048, 1, 256, 8192, 8192, 256, 256]
    - [3, 15.737]
  - - [8192, 2048, 1, 512, 8192, 8192, 512, 512]
    - [69, 20.69]
  - - [8192, 2048, 1, 1024, 8192, 8192, 1024, 1024]
    - [67, 26.445]
  - - [8192, 2048, 1, 2048, 8192, 8192, 2048, 2048]
    - [67, 28.105]
  - - [8192, 2048, 1, 4096, 8192, 8192, 4096, 4096]
    - [61, 29.674]
  - - [8192, 2048, 1, 8192, 8192, 8192, 8192, 8192]
    - [3, 31.118]
  - - [8192, 4096, 1, 128, 8192, 8192, 128, 128]
    - [5, 12.346]
  - - [8192, 4096, 1, 256, 8192, 8192, 256, 256]
    - [67, 17.024]
  - - [8192, 4096, 1, 512, 8192, 8192, 512, 512]
    - [5, 22.235]
  - - [8192, 4096, 1, 1024, 8192, 8192, 1024, 1024]
    - [3, 26.844]
  - - [8192, 4096, 1, 2048, 8192, 8192, 2048, 2048]
    - [69, 29.342]
  - - [8192, 4096, 1, 4096, 8192, 8192, 4096, 4096]
    - [64, 32.495]
  - - [8192, 4096, 1, 8192, 8192, 8192, 8192, 8192]
    - [60, 32.726]
  - - [8192, 8192, 1, 128, 8192, 8192, 128, 128]
    - [6, 10.889]
  - - [8192, 8192, 1, 256, 8192, 8192, 256, 256]
    - [3, 16.386]
  - - [8192, 8192, 1, 512, 8192, 8192, 512, 512]
    - [3, 22.391]
  - - [8192, 8192, 1, 1024, 8192, 8192, 1024, 1024]
    - [4, 28.247]
  - - [8192, 8192, 1, 2048, 8192, 8192, 2048, 2048]
    - [72, 30.546]
  - - [8192, 8192, 1, 4096, 8192, 8192, 4096, 4096]
    - [69, 34.684]
  - - [8192, 8192, 1, 8192, 8192, 8192, 8192, 8192]
    - [72, 35.47]
  - - [1, 1, 1, 32, 1, 1, 32, 32]
    - [112, 0.0]
- null
- null
- ExperimentalStreamK
- GridBased
