library/src/amd_detail/rocblaslt/src/Tensile/Logic/asm_full/aquavanjaram/gfx942/StreamK/aquavanjaram942_Cijk_Ailk_Bljk_BBS_BH_UserArgs.yaml
- {MinimumRequiredVersion: 4.33.0}
- aquavanjaram942
- gfx942
- [Device 0049, Device 0050]
    SolutionIndex: 0
    SolutionNameMin: Cijk_Ailk_Bljk_BBS_BH_UserArgs_MT256x256x32_MI16x16x1_SN_LDSB1_CLR1_GSU0_GSUC0_GSUWGMRR0_K1_LBSPPA2048_LBSPPB128_LPA0_MIWT8_8_PLR1_SU32_SUM0_SUS256_SKXCCM0_VWA8_VWB1_WGM1_WGMXCC1_WGMXCCGn1
    SolutionIndex: 1
    SolutionNameMin: Cijk_Ailk_Bljk_BBS_BH_UserArgs_MT256x256x32_MI16x16x1_SN_LDSB1_CLR1_GSU0_GSUC0_GSUWGMRR0_K1_LBSPPA2048_LBSPPB128_LPA0_MIWT8_8_PLR1_SU32_SUM0_SUS256_SKXCCM0_VWA8_VWB1_WGM4_WGMXCC1_WGMXCCGn1
    SolutionIndex: 2
    SolutionNameMin: Cijk_Ailk_Bljk_BBS_BH_UserArgs_MT256x256x32_MI16x16x1_SN_LDSB1_CLR1_GSU0_GSUC0_GSUWGMRR0_K1_LBSPPA2048_LBSPPB128_LPA0_MIWT8_8_PLR1_SU32_SUM0_SUS256_SKXCCM0_VWA8_VWB1_WGM8_WGMXCC1_WGMXCCGn1
    SolutionIndex: 3
    SolutionNameMin: Cijk_Ailk_Bljk_BBS_BH_UserArgs_MT256x128x32_MI16x16x1_SN_LDSB1_CLR1_GSU0_GSUC0_GSUWGMRR0_K1_LBSPPA2048_LBSPPB128_LPA0_MIWT8_4_PLR1_SU32_SUM0_SUS256_SKXCCM0_VWA8_VWB1_WGM8_WGMXCC1_WGMXCCGn1
    SolutionIndex: 4
    SolutionNameMin: Cijk_Ailk_Bljk_BBS_BH_UserArgs_MT32x32x32_MI16x16x1_SN_LDSB0_CLR1_GSU0_GSUC0_GSUWGMRR0_K1_LBSPPA256_LBSPPB128_LPA16_MIWT1_1_PLR1_SU32_SUM0_SUS256_SKXCCM0_VWA1_VWB1_WGM1_WGMXCC1_WGMXCCGn1
    SolutionIndex: 5
    SolutionNameMin: Cijk_Ailk_Bljk_BBS_BH_UserArgs_MT128x256x64_MI16x16x1_SN_LDSB1_CLR1_GSU0_GSUC0_GSUWGMRR0_K1_LBSPPA2048_LBSPPB128_LPA0_MIWT4_8_PLR1_SU32_SUM0_SUS256_SKXCCM0_VWA4_VWB1_WGM1_WGMXCC1_WGMXCCGn1
    SolutionIndex: 6
    SolutionNameMin: Cijk_Ailk_Bljk_BBS_BH_UserArgs_MT128x256x64_MI16x16x1_SN_LDSB1_CLR1_GSU0_GSUC0_GSUWGMRR0_K1_LBSPPA2048_LBSPPB128_LPA0_MIWT4_8_PLR1_SU32_SUM0_SUS256_SKXCCM0_VWA4_VWB1_WGM4_WGMXCC1_WGMXCCGn1
    SolutionIndex: 7
    SolutionNameMin: Cijk_Ailk_Bljk_BBS_BH_UserArgs_MT128x256x64_MI16x16x1_SN_LDSB1_CLR1_GSU0_GSUC0_GSUWGMRR0_K1_LBSPPA2048_LBSPPB128_LPA32_MIWT4_8_PLR1_SU32_SUM0_SUS256_SKXCCM0_VWA2_VWB1_WGM8_WGMXCC1_WGMXCCGn1
    SolutionIndex: 8
    SolutionNameMin: Cijk_Ailk_Bljk_BBS_BH_UserArgs_MT128x256x64_MI16x16x1_SN_LDSB1_CLR1_GSU0_GSUC0_GSUWGMRR0_K1_LBSPPA2048_LBSPPB512_LPA0_MIWT4_8_PLR1_SU32_SUM0_SUS256_SKXCCM0_VWA4_VWB4_WGM8_WGMXCC1_WGMXCCGn1
    SolutionIndex: 9
    SolutionNameMin: Cijk_Ailk_Bljk_BBS_BH_UserArgs_MT256x128x64_MI16x16x1_SN_LDSB1_CLR1_GSU0_GSUC0_GSUWGMRR0_K1_LBSPPA4096_LBSPPB256_LPA0_MIWT8_4_PLR1_SU32_SUM0_SUS256_SKXCCM0_VWA4_VWB2_WGM1_WGMXCC1_WGMXCCGn1
    SolutionIndex: 10
    SolutionNameMin: Cijk_Ailk_Bljk_BBS_BH_UserArgs_MT256x128x64_MI16x16x1_SN_LDSB1_CLR1_GSU0_GSUC0_GSUWGMRR0_K1_LBSPPA4096_LBSPPB512_LPA0_MIWT8_4_PLR1_SU32_SUM0_SUS256_SKXCCM0_VWA4_VWB4_WGM1_WGMXCC1_WGMXCCGn1
    SolutionIndex: 11
    SolutionNameMin: Cijk_Ailk_Bljk_BBS_BH_UserArgs_MT256x128x64_MI16x16x1_SN_LDSB1_CLR1_GSU0_GSUC0_GSUWGMRR0_K1_LBSPPA4096_LBSPPB512_LPA0_MIWT8_4_PLR1_SU32_SUM0_SUS256_SKXCCM0_VWA8_VWB4_WGM1_WGMXCC1_WGMXCCGn1
    SolutionIndex: 12
    SolutionNameMin: Cijk_Ailk_Bljk_BBS_BH_UserArgs_MT256x64x64_MI16x16x1_SN_LDSB1_CLR1_GSU0_GSUC0_GSUWGMRR0_K1_LBSPPA4096_LBSPPB128_LPA0_MIWT8_2_PLR1_SU32_SUM0_SUS256_SKXCCM0_VWA4_VWB1_WGM1_WGMXCC1_WGMXCCGn1
    SolutionIndex: 13
    SolutionNameMin: Cijk_Ailk_Bljk_BBS_BH_UserArgs_MT128x128x64_MI16x16x1_SN_LDSB1_CLR1_GSU0_GSUC0_GSUWGMRR0_K1_LBSPPA2048_LBSPPB128_LPA0_MIWT4_4_PLR1_SU32_SUM0_SUS256_SKXCCM0_VWA4_VWB1_WGM1_WGMXCC1_WGMXCCGn1
    SolutionIndex: 14
    SolutionNameMin: Cijk_Ailk_Bljk_BBS_BH_UserArgs_MT128x128x64_MI16x16x1_SN_LDSB1_CLR1_GSU0_GSUC0_GSUWGMRR0_K1_LBSPPA2048_LBSPPB256_LPA0_MIWT4_4_PLR1_SU32_SUM0_SUS256_SKXCCM0_VWA4_VWB2_WGM1_WGMXCC1_WGMXCCGn1
    SolutionIndex: 15
    SolutionNameMin: Cijk_Ailk_Bljk_BBS_BH_UserArgs_MT128x128x64_MI16x16x1_SN_LDSB1_CLR1_GSU0_GSUC0_GSUWGMRR0_K1_LBSPPA2048_LBSPPB512_LPA0_MIWT4_4_PLR1_SU32_SUM0_SUS256_SKXCCM0_VWA4_VWB4_WGM1_WGMXCC1_WGMXCCGn1
    SolutionIndex: 16
    SolutionNameMin: Cijk_Ailk_Bljk_BBS_BH_UserArgs_MT128x128x64_MI16x16x1_SN_LDSB1_CLR1_GSU0_GSUC0_GSUWGMRR0_K1_LBSPPA2048_LBSPPB128_LPA0_MIWT4_4_PLR1_SU32_SUM0_SUS256_SKXCCM0_VWA4_VWB1_WGM8_WGMXCC1_WGMXCCGn1
    SolutionIndex: 17
    SolutionNameMin: Cijk_Ailk_Bljk_BBS_BH_UserArgs_MT64x128x64_MI16x16x1_SN_LDSB1_CLR1_GSU0_GSUC0_GSUWGMRR0_K1_LBSPPA1024_LBSPPB256_LPA32_MIWT2_4_PLR1_SU32_SUM0_SUS256_SKXCCM0_VWA2_VWB2_WGM1_WGMXCC1_WGMXCCGn1
    SolutionIndex: 18
    SolutionNameMin: Cijk_Ailk_Bljk_BBS_BH_UserArgs_MT64x128x64_MI16x16x1_SN_LDSB1_CLR1_GSU0_GSUC0_GSUWGMRR0_K1_LBSPPA1024_LBSPPB512_LPA32_MIWT2_4_PLR1_SU32_SUM0_SUS256_SKXCCM0_VWA2_VWB4_WGM1_WGMXCC1_WGMXCCGn1
    SolutionIndex: 19
    SolutionNameMin: Cijk_Ailk_Bljk_BBS_BH_UserArgs_MT128x64x64_MI16x16x1_SN_LDSB1_CLR1_GSU0_GSUC0_GSUWGMRR0_K1_LBSPPA2048_LBSPPB256_LPA0_MIWT4_2_PLR1_SU32_SUM0_SUS256_SKXCCM0_VWA4_VWB2_WGM1_WGMXCC1_WGMXCCGn1
    SolutionIndex: 20
    SolutionNameMin: Cijk_Ailk_Bljk_BBS_BH_UserArgs_MT128x64x64_MI16x16x1_SN_LDSB1_CLR1_GSU0_GSUC0_GSUWGMRR0_K1_LBSPPA2048_LBSPPB128_LPA0_MIWT4_2_PLR1_SU32_SUM0_SUS256_SKXCCM0_VWA4_VWB1_WGM8_WGMXCC1_WGMXCCGn1
    SolutionIndex: 21
    SolutionNameMin: Cijk_Ailk_Bljk_BBS_BH_UserArgs_MT64x64x64_MI16x16x1_SN_LDSB1_CLR1_GSU0_GSUC0_GSUWGMRR0_K1_LBSPPA1024_LBSPPB128_LPA32_MIWT2_2_PLR1_SU32_SUM0_SUS256_SKXCCM0_VWA2_VWB1_WGM1_WGMXCC1_WGMXCCGn1
    SolutionIndex: 22
    SolutionNameMin: Cijk_Ailk_Bljk_BBS_BH_UserArgs_MT64x64x64_MI16x16x1_SN_LDSB1_CLR1_GSU0_GSUC0_GSUWGMRR0_K1_LBSPPA1024_LBSPPB256_LPA32_MIWT2_2_PLR1_SU32_SUM0_SUS256_SKXCCM0_VWA2_VWB2_WGM1_WGMXCC1_WGMXCCGn1
    SolutionIndex: 23
    SolutionNameMin: Cijk_Ailk_Bljk_BBS_BH_UserArgs_MT64x64x64_MI16x16x1_SN_LDSB1_CLR1_GSU0_GSUC0_GSUWGMRR0_K1_LBSPPA1024_LBSPPB128_LPA32_MIWT2_2_PLR1_SU32_SUM0_SUS256_SKXCCM0_VWA2_VWB1_WGM4_WGMXCC1_WGMXCCGn1
    SolutionIndex: 24
    SolutionNameMin: Cijk_Ailk_Bljk_BBS_BH_UserArgs_MT64x64x64_MI16x16x1_SN_LDSB1_CLR1_GSU0_GSUC0_GSUWGMRR0_K1_LBSPPA1024_LBSPPB256_LPA32_MIWT2_2_PLR1_SU32_SUM0_SUS256_SKXCCM0_VWA2_VWB2_WGM8_WGMXCC1_WGMXCCGn1
    SolutionIndex: 25
    SolutionNameMin: Cijk_Ailk_Bljk_BBS_BH_UserArgs_MT64x32x64_MI16x16x1_SN_LDSB0_CLR1_GSU0_GSUC0_GSUWGMRR0_K1_LBSPPA1024_LBSPPB128_LPA32_MIWT2_1_PLR1_SU32_SUM0_SUS256_SKXCCM0_VWA2_VWB1_WGM1_WGMXCC1_WGMXCCGn1
    SolutionIndex: 26
    SolutionNameMin: Cijk_Ailk_Bljk_BBS_BH_UserArgs_MT32x32x64_MI16x16x1_SN_LDSB0_CLR1_GSU0_GSUC0_GSUWGMRR0_K1_LBSPPA512_LBSPPB128_LPA16_MIWT1_1_PLR1_SU32_SUM0_SUS256_SKXCCM0_VWA1_VWB1_WGM1_WGMXCC1_WGMXCCGn1
    SolutionIndex: 27
    SolutionNameMin: Cijk_Ailk_Bljk_BBS_BH_UserArgs_MT64x128x128_MI16x16x1_SN_LDSB1_CLR1_GSU0_GSUC0_GSUWGMRR0_K1_LBSPPA1024_LBSPPB1024_LPA32_MIWT2_4_PLR2_SU32_SUM0_SUS256_SKXCCM0_VWA2_VWB4_WGM1_WGMXCC1_WGMXCCGn1
    SolutionIndex: 28
    SolutionNameMin: Cijk_Ailk_Bljk_BBS_BH_UserArgs_MT64x128x128_MI16x16x1_SN_LDSB1_CLR1_GSU0_GSUC0_GSUWGMRR0_K1_LBSPPA1024_LBSPPB1024_LPA32_MIWT2_4_PLR2_SU32_SUM0_SUS256_SKXCCM0_VWA2_VWB4_WGM4_WGMXCC1_WGMXCCGn1
    SolutionIndex: 29
    SolutionNameMin: Cijk_Ailk_Bljk_BBS_BH_UserArgs_MT64x128x128_MI16x16x1_SN_LDSB1_CLR1_GSU0_GSUC0_GSUWGMRR0_K1_LBSPPA1024_LBSPPB1024_LPA32_MIWT2_4_PLR2_SU32_SUM0_SUS256_SKXCCM0_VWA2_VWB4_WGM8_WGMXCC1_WGMXCCGn1
    SolutionIndex: 30
    SolutionNameMin: Cijk_Ailk_Bljk_BBS_BH_UserArgs_MT128x64x128_MI16x16x1_SN_LDSB1_CLR1_GSU0_GSUC0_GSUWGMRR0_K1_LBSPPA2048_LBSPPB256_LPA0_MIWT4_2_PLR2_SU32_SUM0_SUS256_SKXCCM0_VWA4_VWB1_WGM1_WGMXCC1_WGMXCCGn1
    SolutionIndex: 31
    SolutionNameMin: Cijk_Ailk_Bljk_BBS_BH_UserArgs_MT128x64x128_MI16x16x1_SN_LDSB1_CLR1_GSU0_GSUC0_GSUWGMRR0_K1_LBSPPA2048_LBSPPB512_LPA0_MIWT4_2_PLR2_SU32_SUM0_SUS256_SKXCCM0_VWA4_VWB2_WGM1_WGMXCC1_WGMXCCGn1
    SolutionIndex: 32
    SolutionNameMin: Cijk_Ailk_Bljk_BBS_BH_UserArgs_MT128x64x128_MI16x16x1_SN_LDSB1_CLR1_GSU0_GSUC0_GSUWGMRR0_K1_LBSPPA2048_LBSPPB256_LPA0_MIWT4_2_PLR1_SU32_SUM0_SUS256_SKXCCM0_VWA4_VWB1_WGM4_WGMXCC1_WGMXCCGn1
    SolutionIndex: 33
    SolutionNameMin: Cijk_Ailk_Bljk_BBS_BH_UserArgs_MT128x64x128_MI16x16x1_SN_LDSB1_CLR1_GSU0_GSUC0_GSUWGMRR0_K1_LBSPPA2048_LBSPPB512_LPA0_MIWT4_2_PLR2_SU32_SUM0_SUS256_SKXCCM0_VWA4_VWB2_WGM4_WGMXCC1_WGMXCCGn1
    SolutionIndex: 34
    SolutionNameMin: Cijk_Ailk_Bljk_BBS_BH_UserArgs_MT128x64x128_MI16x16x1_SN_LDSB1_CLR1_GSU0_GSUC0_GSUWGMRR0_K1_LBSPPA2048_LBSPPB256_LPA0_MIWT4_2_PLR2_SU32_SUM0_SUS256_SKXCCM0_VWA4_VWB1_WGM8_WGMXCC1_WGMXCCGn1
    SolutionIndex: 35
    SolutionNameMin: Cijk_Ailk_Bljk_BBS_BH_UserArgs_MT128x64x128_MI16x16x1_SN_LDSB1_CLR1_GSU0_GSUC0_GSUWGMRR0_K1_LBSPPA2048_LBSPPB512_LPA0_MIWT4_2_PLR2_SU32_SUM0_SUS256_SKXCCM0_VWA4_VWB2_WGM8_WGMXCC1_WGMXCCGn1
    SolutionIndex: 36
    SolutionNameMin: Cijk_Ailk_Bljk_BBS_BH_UserArgs_MT64x64x128_MI16x16x1_SN_LDSB1_CLR1_GSU0_GSUC0_GSUWGMRR0_K1_LBSPPA1024_LBSPPB256_LPA32_MIWT2_2_PLR2_SU32_SUM0_SUS256_SKXCCM0_VWA2_VWB1_WGM1_WGMXCC1_WGMXCCGn1
    SolutionIndex: 37
    SolutionNameMin: Cijk_Ailk_Bljk_BBS_BH_UserArgs_MT64x64x128_MI16x16x1_SN_LDSB1_CLR1_GSU0_GSUC0_GSUWGMRR0_K1_LBSPPA1024_LBSPPB256_LPA32_MIWT2_2_PLR2_SU32_SUM0_SUS256_SKXCCM0_VWA2_VWB1_WGM4_WGMXCC1_WGMXCCGn1
    SolutionIndex: 38
    SolutionNameMin: Cijk_Ailk_Bljk_BBS_BH_UserArgs_MT64x64x128_MI16x16x1_SN_LDSB1_CLR1_GSU0_GSUC0_GSUWGMRR0_K1_LBSPPA1024_LBSPPB512_LPA32_MIWT2_2_PLR2_SU32_SUM0_SUS256_SKXCCM0_VWA2_VWB2_WGM4_WGMXCC1_WGMXCCGn1
    SolutionIndex: 39
    SolutionNameMin: Cijk_Ailk_Bljk_BBS_BH_UserArgs_MT64x64x128_MI16x16x1_SN_LDSB1_CLR1_GSU0_GSUC0_GSUWGMRR0_K1_LBSPPA1024_LBSPPB256_LPA32_MIWT2_2_PLR2_SU32_SUM0_SUS256_SKXCCM0_VWA2_VWB1_WGM8_WGMXCC1_WGMXCCGn1
    SolutionIndex: 40
    SolutionNameMin: Cijk_Ailk_Bljk_BBS_BH_UserArgs_MT32x64x128_MI16x16x1_SN_LDSB1_CLR1_GSU0_GSUC0_GSUWGMRR0_K1_LBSPPA512_LBSPPB256_LPA16_MIWT1_2_PLR2_SU32_SUM0_SUS256_SKXCCM0_VWA1_VWB1_WGM1_WGMXCC1_WGMXCCGn1
    SolutionIndex: 41
    SolutionNameMin: Cijk_Ailk_Bljk_BBS_BH_UserArgs_MT32x64x128_MI16x16x1_SN_LDSB1_CLR1_GSU0_GSUC0_GSUWGMRR0_K1_LBSPPA512_LBSPPB512_LPA16_MIWT1_2_PLR2_SU32_SUM0_SUS256_SKXCCM0_VWA1_VWB2_WGM1_WGMXCC1_WGMXCCGn1
    SolutionIndex: 42
    SolutionNameMin: Cijk_Ailk_Bljk_BBS_BH_UserArgs_MT64x32x128_MI16x16x1_SN_LDSB1_CLR1_GSU0_GSUC0_GSUWGMRR0_K1_LBSPPA1024_LBSPPB256_LPA32_MIWT2_1_PLR2_SU32_SUM0_SUS256_SKXCCM0_VWA2_VWB1_WGM1_WGMXCC1_WGMXCCGn1
    SolutionIndex: 43
    SolutionNameMin: Cijk_Ailk_Bljk_BBS_BH_UserArgs_MT64x32x128_MI16x16x1_SN_LDSB1_CLR1_GSU0_GSUC0_GSUWGMRR0_K1_LBSPPA1024_LBSPPB256_LPA32_MIWT2_1_PLR2_SU32_SUM0_SUS256_SKXCCM0_VWA2_VWB1_WGM4_WGMXCC1_WGMXCCGn1
    SolutionIndex: 44
    SolutionNameMin: Cijk_Ailk_Bljk_BBS_BH_UserArgs_MT64x32x128_MI16x16x1_SN_LDSB1_CLR1_GSU0_GSUC0_GSUWGMRR0_K1_LBSPPA1024_LBSPPB256_LPA32_MIWT2_1_PLR2_SU32_SUM0_SUS256_SKXCCM0_VWA2_VWB1_WGM8_WGMXCC1_WGMXCCGn1
    SolutionIndex: 45
    SolutionNameMin: Cijk_Ailk_Bljk_BBS_BH_UserArgs_MT32x32x128_MI16x16x1_SN_LDSB1_CLR1_GSU0_GSUC0_GSUWGMRR0_K1_LBSPPA512_LBSPPB256_LPA16_MIWT1_1_PLR1_SU32_SUM0_SUS256_SKXCCM0_VWA1_VWB1_WGM1_WGMXCC1_WGMXCCGn1
    SolutionIndex: 46
    SolutionNameMin: Cijk_Ailk_Bljk_BBS_BH_UserArgs_MT32x32x128_MI16x16x1_SN_LDSB1_CLR1_GSU0_GSUC0_GSUWGMRR0_K1_LBSPPA512_LBSPPB256_LPA16_MIWT1_1_PLR2_SU32_SUM0_SUS256_SKXCCM0_VWA1_VWB1_WGM1_WGMXCC1_WGMXCCGn1
    SolutionIndex: 47
    SolutionNameMin: Cijk_Ailk_Bljk_BBS_BH_UserArgs_MT256x256x32_MI16x16x1_SN_LDSB1_CLR1_GSU0_GSUC0_GSUWGMRR0_K1_LBSPPA2048_LBSPPB128_LPA0_MIWT8_8_PLR1_SU32_SUM0_SUS256_SKXCCM8_VWA4_VWB1_WGM1_WGMXCC1_WGMXCCGn1
    SolutionIndex: 48
    SolutionNameMin: Cijk_Ailk_Bljk_BBS_BH_UserArgs_MT256x256x32_MI16x16x1_SN_LDSB1_CLR1_GSU0_GSUC0_GSUWGMRR0_K1_LBSPPA2048_LBSPPB128_LPA0_MIWT8_8_PLR1_SU32_SUM0_SUS256_SKXCCM8_VWA8_VWB1_WGM1_WGMXCC1_WGMXCCGn1
    SolutionIndex: 49
    SolutionNameMin: Cijk_Ailk_Bljk_BBS_BH_UserArgs_MT256x256x32_MI16x16x1_SN_LDSB1_CLR1_GSU0_GSUC0_GSUWGMRR0_K1_LBSPPA2048_LBSPPB128_LPA0_MIWT8_8_PLR1_SU32_SUM0_SUS256_SKXCCM8_VWA4_VWB2_WGM1_WGMXCC1_WGMXCCGn1
    SolutionIndex: 50
    SolutionNameMin: Cijk_Ailk_Bljk_BBS_BH_UserArgs_MT256x256x32_MI16x16x1_SN_LDSB1_CLR1_GSU0_GSUC0_GSUWGMRR0_K1_LBSPPA2048_LBSPPB256_LPA0_MIWT8_8_PLR1_SU32_SUM0_SUS256_SKXCCM8_VWA4_VWB4_WGM1_WGMXCC1_WGMXCCGn1
    SolutionIndex: 51
    SolutionNameMin: Cijk_Ailk_Bljk_BBS_BH_UserArgs_MT256x256x32_MI16x16x1_SN_LDSB1_CLR1_GSU0_GSUC0_GSUWGMRR0_K1_LBSPPA2048_LBSPPB512_LPA0_MIWT8_8_PLR1_SU32_SUM0_SUS256_SKXCCM8_VWA4_VWB8_WGM1_WGMXCC1_WGMXCCGn1
    SolutionIndex: 52
    SolutionNameMin: Cijk_Ailk_Bljk_BBS_BH_UserArgs_MT256x256x32_MI16x16x1_SN_LDSB1_CLR1_GSU0_GSUC0_GSUWGMRR0_K1_LBSPPA2048_LBSPPB512_LPA0_MIWT8_8_PLR1_SU32_SUM0_SUS256_SKXCCM8_VWA8_VWB8_WGM1_WGMXCC1_WGMXCCGn1
    SolutionIndex: 53
    SolutionNameMin: Cijk_Ailk_Bljk_BBS_BH_UserArgs_MT256x256x32_MI16x16x1_SN_LDSB1_CLR1_GSU0_GSUC0_GSUWGMRR0_K1_LBSPPA2048_LBSPPB128_LPA0_MIWT8_8_PLR1_SU32_SUM0_SUS256_SKXCCM8_VWA4_VWB1_WGM4_WGMXCC1_WGMXCCGn1
    SolutionIndex: 54
    SolutionNameMin: Cijk_Ailk_Bljk_BBS_BH_UserArgs_MT256x256x32_MI16x16x1_SN_LDSB1_CLR1_GSU0_GSUC0_GSUWGMRR0_K1_LBSPPA2048_LBSPPB256_LPA0_MIWT8_8_PLR1_SU32_SUM0_SUS256_SKXCCM8_VWA4_VWB4_WGM4_WGMXCC1_WGMXCCGn1
    SolutionIndex: 55
    SolutionNameMin: Cijk_Ailk_Bljk_BBS_BH_UserArgs_MT256x256x32_MI16x16x1_SN_LDSB1_CLR1_GSU0_GSUC0_GSUWGMRR0_K1_LBSPPA2048_LBSPPB256_LPA0_MIWT8_8_PLR1_SU32_SUM0_SUS256_SKXCCM8_VWA8_VWB4_WGM4_WGMXCC1_WGMXCCGn1
    SolutionIndex: 56
    SolutionNameMin: Cijk_Ailk_Bljk_BBS_BH_UserArgs_MT256x256x32_MI16x16x1_SN_LDSB1_CLR1_GSU0_GSUC0_GSUWGMRR0_K1_LBSPPA2048_LBSPPB512_LPA0_MIWT8_8_PLR1_SU32_SUM0_SUS256_SKXCCM8_VWA4_VWB8_WGM4_WGMXCC1_WGMXCCGn1
    SolutionIndex: 57
    SolutionNameMin: Cijk_Ailk_Bljk_BBS_BH_UserArgs_MT256x256x32_MI16x16x1_SN_LDSB1_CLR1_GSU0_GSUC0_GSUWGMRR0_K1_LBSPPA2048_LBSPPB512_LPA0_MIWT8_8_PLR1_SU32_SUM0_SUS256_SKXCCM8_VWA8_VWB8_WGM4_WGMXCC1_WGMXCCGn1
    SolutionIndex: 58
    SolutionNameMin: Cijk_Ailk_Bljk_BBS_BH_UserArgs_MT256x256x32_MI16x16x1_SN_LDSB1_CLR1_GSU0_GSUC0_GSUWGMRR0_K1_LBSPPA2048_LBSPPB256_LPA0_MIWT8_8_PLR1_SU32_SUM0_SUS256_SKXCCM8_VWA4_VWB4_WGM8_WGMXCC1_WGMXCCGn1
    SolutionIndex: 59
    SolutionNameMin: Cijk_Ailk_Bljk_BBS_BH_UserArgs_MT256x256x32_MI16x16x1_SN_LDSB1_CLR1_GSU0_GSUC0_GSUWGMRR0_K1_LBSPPA2048_LBSPPB512_LPA0_MIWT8_8_PLR1_SU32_SUM0_SUS256_SKXCCM8_VWA4_VWB8_WGM8_WGMXCC1_WGMXCCGn1
    SolutionIndex: 60
    SolutionNameMin: Cijk_Ailk_Bljk_BBS_BH_UserArgs_MT256x128x32_MI16x16x1_SN_LDSB1_CLR1_GSU0_GSUC0_GSUWGMRR0_K1_LBSPPA2048_LBSPPB128_LPA0_MIWT8_4_PLR1_SU32_SUM0_SUS256_SKXCCM8_VWA8_VWB2_WGM1_WGMXCC1_WGMXCCGn1
    SolutionIndex: 61
    SolutionNameMin: Cijk_Ailk_Bljk_BBS_BH_UserArgs_MT256x128x32_MI16x16x1_SN_LDSB1_CLR1_GSU0_GSUC0_GSUWGMRR0_K1_LBSPPA2048_LBSPPB256_LPA0_MIWT8_4_PLR1_SU32_SUM0_SUS256_SKXCCM8_VWA8_VWB4_WGM1_WGMXCC1_WGMXCCGn1
    SolutionIndex: 62
    SolutionNameMin: Cijk_Ailk_Bljk_BBS_BH_UserArgs_MT256x128x32_MI16x16x1_SN_LDSB1_CLR1_GSU0_GSUC0_GSUWGMRR0_K1_LBSPPA2048_LBSPPB128_LPA0_MIWT8_4_PLR1_SU32_SUM0_SUS256_SKXCCM8_VWA4_VWB1_WGM4_WGMXCC1_WGMXCCGn1
    SolutionIndex: 63
    SolutionNameMin: Cijk_Ailk_Bljk_BBS_BH_UserArgs_MT256x128x32_MI16x16x1_SN_LDSB1_CLR1_GSU0_GSUC0_GSUWGMRR0_K1_LBSPPA2048_LBSPPB128_LPA0_MIWT8_4_PLR1_SU32_SUM0_SUS256_SKXCCM8_VWA8_VWB2_WGM4_WGMXCC1_WGMXCCGn1
    SolutionIndex: 64
    SolutionNameMin: Cijk_Ailk_Bljk_BBS_BH_UserArgs_MT256x128x32_MI16x16x1_SN_LDSB1_CLR1_GSU0_GSUC0_GSUWGMRR0_K1_LBSPPA2048_LBSPPB128_LPA0_MIWT8_4_PLR1_SU32_SUM0_SUS256_SKXCCM8_VWA8_VWB1_WGM8_WGMXCC1_WGMXCCGn1
    SolutionIndex: 65
    SolutionNameMin: Cijk_Ailk_Bljk_BBS_BH_UserArgs_MT256x128x32_MI16x16x1_SN_LDSB1_CLR1_GSU0_GSUC0_GSUWGMRR0_K1_LBSPPA2048_LBSPPB128_LPA0_MIWT8_4_PLR1_SU32_SUM0_SUS256_SKXCCM8_VWA4_VWB2_WGM8_WGMXCC1_WGMXCCGn1
    SolutionIndex: 66
    SolutionNameMin: Cijk_Ailk_Bljk_BBS_BH_UserArgs_MT256x128x32_MI16x16x1_SN_LDSB1_CLR1_GSU0_GSUC0_GSUWGMRR0_K1_LBSPPA2048_LBSPPB256_LPA0_MIWT8_4_PLR1_SU32_SUM0_SUS256_SKXCCM8_VWA8_VWB4_WGM8_WGMXCC1_WGMXCCGn1
    SolutionIndex: 67
    SolutionNameMin: Cijk_Ailk_Bljk_BBS_BH_UserArgs_MT128x128x32_MI16x16x1_SN_LDSB1_CLR1_GSU0_GSUC0_GSUWGMRR0_K1_LBSPPA1024_LBSPPB128_LPA32_MIWT4_4_PLR1_SU32_SUM0_SUS256_SKXCCM8_VWA2_VWB2_WGM1_WGMXCC1_WGMXCCGn1
    SolutionIndex: 68
    SolutionNameMin: Cijk_Ailk_Bljk_BBS_BH_UserArgs_MT128x128x32_MI16x16x1_SN_LDSB1_CLR1_GSU0_GSUC0_GSUWGMRR0_K1_LBSPPA1024_LBSPPB256_LPA0_MIWT4_4_PLR1_SU32_SUM0_SUS256_SKXCCM8_VWA4_VWB4_WGM1_WGMXCC1_WGMXCCGn1
    SolutionIndex: 69
    SolutionNameMin: Cijk_Ailk_Bljk_BBS_BH_UserArgs_MT128x64x32_MI16x16x1_SN_LDSB0_CLR1_GSU0_GSUC0_GSUWGMRR0_K1_LBSPPA1024_LBSPPB128_LPA0_MIWT4_2_PLR1_SU32_SUM0_SUS256_SKXCCM8_VWA4_VWB1_WGM1_WGMXCC1_WGMXCCGn1
    SolutionIndex: 70
    SolutionNameMin: Cijk_Ailk_Bljk_BBS_BH_UserArgs_MT128x64x32_MI16x16x1_SN_LDSB0_CLR1_GSU0_GSUC0_GSUWGMRR0_K1_LBSPPA1024_LBSPPB128_LPA0_MIWT4_2_PLR1_SU32_SUM0_SUS256_SKXCCM8_VWA4_VWB2_WGM1_WGMXCC1_WGMXCCGn1
    SolutionIndex: 71
    SolutionNameMin: Cijk_Ailk_Bljk_BBS_BH_UserArgs_MT32x32x32_MI16x16x1_SN_LDSB0_CLR1_GSU0_GSUC0_GSUWGMRR0_K1_LBSPPA256_LBSPPB128_LPA16_MIWT1_1_PLR1_SU32_SUM0_SUS256_SKXCCM8_VWA1_VWB1_WGM1_WGMXCC1_WGMXCCGn1
    SolutionIndex: 72
    SolutionNameMin: Cijk_Ailk_Bljk_BBS_BH_UserArgs_MT32x32x32_MI16x16x1_SN_LDSB0_CLR0_GSU0_GSUC0_GSUWGMRR0_K1_LBSPPA256_LBSPPB128_LPA16_MIWT1_1_PLR0_SU32_SUM0_SUS256_SKXCCM8_VWA1_VWB1_WGM1_WGMXCC1_WGMXCCGn1
    SolutionIndex: 73
    SolutionNameMin: Cijk_Ailk_Bljk_BBS_BH_UserArgs_MT128x256x64_MI16x16x1_SN_LDSB1_CLR1_GSU0_GSUC0_GSUWGMRR0_K1_LBSPPA2048_LBSPPB128_LPA32_MIWT4_8_PLR1_SU32_SUM0_SUS256_SKXCCM8_VWA2_VWB1_WGM1_WGMXCC1_WGMXCCGn1
    SolutionIndex: 74
    SolutionNameMin: Cijk_Ailk_Bljk_BBS_BH_UserArgs_MT128x256x64_MI16x16x1_SN_LDSB1_CLR1_GSU0_GSUC0_GSUWGMRR0_K1_LBSPPA2048_LBSPPB128_LPA0_MIWT4_8_PLR1_SU32_SUM0_SUS256_SKXCCM8_VWA4_VWB1_WGM1_WGMXCC1_WGMXCCGn1
    SolutionIndex: 75
    SolutionNameMin: Cijk_Ailk_Bljk_BBS_BH_UserArgs_MT128x256x64_MI16x16x1_SN_LDSB1_CLR1_GSU0_GSUC0_GSUWGMRR0_K1_LBSPPA2048_LBSPPB256_LPA32_MIWT4_8_PLR1_SU32_SUM0_SUS256_SKXCCM8_VWA2_VWB2_WGM1_WGMXCC1_WGMXCCGn1
    SolutionIndex: 76
    SolutionNameMin: Cijk_Ailk_Bljk_BBS_BH_UserArgs_MT128x256x64_MI16x16x1_SN_LDSB1_CLR1_GSU0_GSUC0_GSUWGMRR0_K1_LBSPPA2048_LBSPPB256_LPA0_MIWT4_8_PLR1_SU32_SUM0_SUS256_SKXCCM8_VWA4_VWB2_WGM1_WGMXCC1_WGMXCCGn1
    SolutionIndex: 77
    SolutionNameMin: Cijk_Ailk_Bljk_BBS_BH_UserArgs_MT128x256x64_MI16x16x1_SN_LDSB1_CLR1_GSU0_GSUC0_GSUWGMRR0_K1_LBSPPA2048_LBSPPB512_LPA32_MIWT4_8_PLR1_SU32_SUM0_SUS256_SKXCCM8_VWA2_VWB4_WGM1_WGMXCC1_WGMXCCGn1
    SolutionIndex: 78
    SolutionNameMin: Cijk_Ailk_Bljk_BBS_BH_UserArgs_MT128x256x64_MI16x16x1_SN_LDSB1_CLR1_GSU0_GSUC0_GSUWGMRR0_K1_LBSPPA2048_LBSPPB512_LPA0_MIWT4_8_PLR1_SU32_SUM0_SUS256_SKXCCM8_VWA4_VWB4_WGM1_WGMXCC1_WGMXCCGn1
    SolutionIndex: 79
    SolutionNameMin: Cijk_Ailk_Bljk_BBS_BH_UserArgs_MT128x256x64_MI16x16x1_SN_LDSB1_CLR1_GSU0_GSUC0_GSUWGMRR0_K1_LBSPPA2048_LBSPPB1024_LPA32_MIWT4_8_PLR1_SU32_SUM0_SUS256_SKXCCM8_VWA2_VWB8_WGM1_WGMXCC1_WGMXCCGn1
    SolutionIndex: 80
    SolutionNameMin: Cijk_Ailk_Bljk_BBS_BH_UserArgs_MT128x256x64_MI16x16x1_SN_LDSB1_CLR1_GSU0_GSUC0_GSUWGMRR0_K1_LBSPPA2048_LBSPPB128_LPA32_MIWT4_8_PLR1_SU32_SUM0_SUS256_SKXCCM8_VWA2_VWB1_WGM4_WGMXCC1_WGMXCCGn1
    SolutionIndex: 81
    SolutionNameMin: Cijk_Ailk_Bljk_BBS_BH_UserArgs_MT128x256x64_MI16x16x1_SN_LDSB1_CLR1_GSU0_GSUC0_GSUWGMRR0_K1_LBSPPA2048_LBSPPB512_LPA0_MIWT4_8_PLR1_SU32_SUM0_SUS256_SKXCCM8_VWA4_VWB4_WGM4_WGMXCC1_WGMXCCGn1
    SolutionIndex: 82
    SolutionNameMin: Cijk_Ailk_Bljk_BBS_BH_UserArgs_MT128x256x64_MI16x16x1_SN_LDSB1_CLR1_GSU0_GSUC0_GSUWGMRR0_K1_LBSPPA2048_LBSPPB1024_LPA0_MIWT4_8_PLR1_SU32_SUM0_SUS256_SKXCCM8_VWA4_VWB8_WGM4_WGMXCC1_WGMXCCGn1
    SolutionIndex: 83
    SolutionNameMin: Cijk_Ailk_Bljk_BBS_BH_UserArgs_MT128x256x64_MI16x16x1_SN_LDSB1_CLR1_GSU0_GSUC0_GSUWGMRR0_K1_LBSPPA2048_LBSPPB128_LPA32_MIWT4_8_PLR1_SU32_SUM0_SUS256_SKXCCM8_VWA2_VWB1_WGM8_WGMXCC1_WGMXCCGn1
    SolutionIndex: 84
    SolutionNameMin: Cijk_Ailk_Bljk_BBS_BH_UserArgs_MT128x256x64_MI16x16x1_SN_LDSB1_CLR1_GSU0_GSUC0_GSUWGMRR0_K1_LBSPPA2048_LBSPPB1024_LPA32_MIWT4_8_PLR1_SU32_SUM0_SUS256_SKXCCM8_VWA2_VWB8_WGM8_WGMXCC1_WGMXCCGn1
    SolutionIndex: 85
    SolutionNameMin: Cijk_Ailk_Bljk_BBS_BH_UserArgs_MT128x256x64_MI16x16x1_SN_LDSB1_CLR1_GSU0_GSUC0_GSUWGMRR0_K1_LBSPPA2048_LBSPPB1024_LPA0_MIWT4_8_PLR1_SU32_SUM0_SUS256_SKXCCM8_VWA4_VWB8_WGM8_WGMXCC1_WGMXCCGn1
    SolutionIndex: 86
    SolutionNameMin: Cijk_Ailk_Bljk_BBS_BH_UserArgs_MT256x128x64_MI16x16x1_SN_LDSB1_CLR1_GSU0_GSUC0_GSUWGMRR0_K1_LBSPPA4096_LBSPPB256_LPA0_MIWT8_4_PLR2_SU32_SUM0_SUS256_SKXCCM8_VWA8_VWB2_WGM4_WGMXCC1_WGMXCCGn1
    SolutionIndex: 87
    SolutionNameMin: Cijk_Ailk_Bljk_BBS_BH_UserArgs_MT256x128x64_MI16x16x1_SN_LDSB1_CLR1_GSU0_GSUC0_GSUWGMRR0_K1_LBSPPA4096_LBSPPB128_LPA0_MIWT8_4_PLR1_SU32_SUM0_SUS256_SKXCCM8_VWA4_VWB1_WGM8_WGMXCC1_WGMXCCGn1
    SolutionIndex: 88
    SolutionNameMin: Cijk_Ailk_Bljk_BBS_BH_UserArgs_MT256x128x64_MI16x16x1_SN_LDSB1_CLR1_GSU0_GSUC0_GSUWGMRR0_K1_LBSPPA4096_LBSPPB128_LPA0_MIWT8_4_PLR1_SU32_SUM0_SUS256_SKXCCM8_VWA8_VWB1_WGM8_WGMXCC1_WGMXCCGn1
    SolutionIndex: 89
    SolutionNameMin: Cijk_Ailk_Bljk_BBS_BH_UserArgs_MT128x128x64_MI16x16x1_SN_LDSB1_CLR1_GSU0_GSUC0_GSUWGMRR0_K1_LBSPPA2048_LBSPPB128_LPA0_MIWT4_4_PLR1_SU32_SUM0_SUS256_SKXCCM8_VWA4_VWB1_WGM1_WGMXCC1_WGMXCCGn1
    SolutionIndex: 90
    SolutionNameMin: Cijk_Ailk_Bljk_BBS_BH_UserArgs_MT128x128x64_MI16x16x1_SN_LDSB1_CLR1_GSU0_GSUC0_GSUWGMRR0_K1_LBSPPA2048_LBSPPB256_LPA32_MIWT4_4_PLR1_SU32_SUM0_SUS256_SKXCCM8_VWA2_VWB2_WGM1_WGMXCC1_WGMXCCGn1
    SolutionIndex: 91
    SolutionNameMin: Cijk_Ailk_Bljk_BBS_BH_UserArgs_MT128x128x64_MI16x16x1_SN_LDSB1_CLR1_GSU0_GSUC0_GSUWGMRR0_K1_LBSPPA2048_LBSPPB256_LPA0_MIWT4_4_PLR1_SU32_SUM0_SUS256_SKXCCM8_VWA4_VWB2_WGM1_WGMXCC1_WGMXCCGn1
    SolutionIndex: 92
    SolutionNameMin: Cijk_Ailk_Bljk_BBS_BH_UserArgs_MT128x128x64_MI16x16x1_SN_LDSB1_CLR1_GSU0_GSUC0_GSUWGMRR0_K1_LBSPPA2048_LBSPPB512_LPA32_MIWT4_4_PLR1_SU32_SUM0_SUS256_SKXCCM8_VWA2_VWB4_WGM1_WGMXCC1_WGMXCCGn1
    SolutionIndex: 93
    SolutionNameMin: Cijk_Ailk_Bljk_BBS_BH_UserArgs_MT128x128x64_MI16x16x1_SN_LDSB1_CLR1_GSU0_GSUC0_GSUWGMRR0_K1_LBSPPA2048_LBSPPB512_LPA0_MIWT4_4_PLR1_SU32_SUM0_SUS256_SKXCCM8_VWA4_VWB4_WGM1_WGMXCC1_WGMXCCGn1
    SolutionIndex: 94
    SolutionNameMin: Cijk_Ailk_Bljk_BBS_BH_UserArgs_MT128x128x64_MI16x16x1_SN_LDSB1_CLR1_GSU0_GSUC0_GSUWGMRR0_K1_LBSPPA2048_LBSPPB128_LPA0_MIWT4_4_PLR1_SU32_SUM0_SUS256_SKXCCM8_VWA4_VWB1_WGM4_WGMXCC1_WGMXCCGn1
    SolutionIndex: 95
    SolutionNameMin: Cijk_Ailk_Bljk_BBS_BH_UserArgs_MT128x128x64_MI16x16x1_SN_LDSB1_CLR1_GSU0_GSUC0_GSUWGMRR0_K1_LBSPPA2048_LBSPPB256_LPA0_MIWT4_4_PLR1_SU32_SUM0_SUS256_SKXCCM8_VWA4_VWB2_WGM4_WGMXCC1_WGMXCCGn1
    SolutionIndex: 96
    SolutionNameMin: Cijk_Ailk_Bljk_BBS_BH_UserArgs_MT128x128x64_MI16x16x1_SN_LDSB1_CLR1_GSU0_GSUC0_GSUWGMRR0_K1_LBSPPA2048_LBSPPB128_LPA0_MIWT4_4_PLR1_SU32_SUM0_SUS256_SKXCCM8_VWA4_VWB1_WGM8_WGMXCC1_WGMXCCGn1
    SolutionIndex: 97
    SolutionNameMin: Cijk_Ailk_Bljk_BBS_BH_UserArgs_MT128x128x64_MI16x16x1_SN_LDSB1_CLR1_GSU0_GSUC0_GSUWGMRR0_K1_LBSPPA2048_LBSPPB256_LPA32_MIWT4_4_PLR1_SU32_SUM0_SUS256_SKXCCM8_VWA2_VWB2_WGM8_WGMXCC1_WGMXCCGn1
    SolutionIndex: 98
    SolutionNameMin: Cijk_Ailk_Bljk_BBS_BH_UserArgs_MT128x128x64_MI16x16x1_SN_LDSB1_CLR1_GSU0_GSUC0_GSUWGMRR0_K1_LBSPPA2048_LBSPPB256_LPA0_MIWT4_4_PLR1_SU32_SUM0_SUS256_SKXCCM8_VWA4_VWB2_WGM8_WGMXCC1_WGMXCCGn1
    SolutionIndex: 99
    SolutionNameMin: Cijk_Ailk_Bljk_BBS_BH_UserArgs_MT64x128x64_MI16x16x1_SN_LDSB1_CLR1_GSU0_GSUC0_GSUWGMRR0_K1_LBSPPA1024_LBSPPB128_LPA32_MIWT2_4_PLR1_SU32_SUM0_SUS256_SKXCCM8_VWA2_VWB1_WGM1_WGMXCC1_WGMXCCGn1
    SolutionIndex: 100
    SolutionNameMin: Cijk_Ailk_Bljk_BBS_BH_UserArgs_MT64x128x64_MI16x16x1_SN_LDSB1_CLR1_GSU0_GSUC0_GSUWGMRR0_K1_LBSPPA1024_LBSPPB256_LPA32_MIWT2_4_PLR1_SU32_SUM0_SUS256_SKXCCM8_VWA2_VWB2_WGM1_WGMXCC1_WGMXCCGn1
    SolutionIndex: 101
    SolutionNameMin: Cijk_Ailk_Bljk_BBS_BH_UserArgs_MT128x64x64_MI16x16x1_SN_LDSB1_CLR1_GSU0_GSUC0_GSUWGMRR0_K1_LBSPPA2048_LBSPPB128_LPA0_MIWT4_2_PLR1_SU32_SUM0_SUS256_SKXCCM8_VWA4_VWB1_WGM1_WGMXCC1_WGMXCCGn1
    SolutionIndex: 102
    SolutionNameMin: Cijk_Ailk_Bljk_BBS_BH_UserArgs_MT128x64x64_MI16x16x1_SN_LDSB1_CLR1_GSU0_GSUC0_GSUWGMRR0_K1_LBSPPA2048_LBSPPB256_LPA0_MIWT4_2_PLR1_SU32_SUM0_SUS256_SKXCCM8_VWA4_VWB2_WGM1_WGMXCC1_WGMXCCGn1
    SolutionIndex: 103
    SolutionNameMin: Cijk_Ailk_Bljk_BBS_BH_UserArgs_MT128x64x64_MI16x16x1_SN_LDSB1_CLR1_GSU0_GSUC0_GSUWGMRR0_K1_LBSPPA2048_LBSPPB128_LPA0_MIWT4_2_PLR1_SU32_SUM0_SUS256_SKXCCM8_VWA4_VWB1_WGM4_WGMXCC1_WGMXCCGn1
    SolutionIndex: 104
    SolutionNameMin: Cijk_Ailk_Bljk_BBS_BH_UserArgs_MT128x64x64_MI16x16x1_SN_LDSB1_CLR1_GSU0_GSUC0_GSUWGMRR0_K1_LBSPPA2048_LBSPPB256_LPA0_MIWT4_2_PLR1_SU32_SUM0_SUS256_SKXCCM8_VWA4_VWB2_WGM8_WGMXCC1_WGMXCCGn1
    SolutionIndex: 105
    SolutionNameMin: Cijk_Ailk_Bljk_BBS_BH_UserArgs_MT64x64x64_MI16x16x1_SN_LDSB1_CLR1_GSU0_GSUC0_GSUWGMRR0_K1_LBSPPA1024_LBSPPB128_LPA32_MIWT2_2_PLR1_SU32_SUM0_SUS256_SKXCCM8_VWA2_VWB1_WGM1_WGMXCC1_WGMXCCGn1
    SolutionIndex: 106
    SolutionNameMin: Cijk_Ailk_Bljk_BBS_BH_UserArgs_MT64x64x64_MI16x16x1_SN_LDSB1_CLR1_GSU0_GSUC0_GSUWGMRR0_K1_LBSPPA1024_LBSPPB256_LPA32_MIWT2_2_PLR1_SU32_SUM0_SUS256_SKXCCM8_VWA2_VWB2_WGM1_WGMXCC1_WGMXCCGn1
    SolutionIndex: 107
    SolutionNameMin: Cijk_Ailk_Bljk_BBS_BH_UserArgs_MT64x64x64_MI16x16x1_SN_LDSB1_CLR1_GSU0_GSUC0_GSUWGMRR0_K1_LBSPPA1024_LBSPPB128_LPA32_MIWT2_2_PLR1_SU32_SUM0_SUS256_SKXCCM8_VWA2_VWB1_WGM4_WGMXCC1_WGMXCCGn1
    SolutionIndex: 108
    SolutionNameMin: Cijk_Ailk_Bljk_BBS_BH_UserArgs_MT32x64x64_MI16x16x1_SN_LDSB0_CLR1_GSU0_GSUC0_GSUWGMRR0_K1_LBSPPA512_LBSPPB128_LPA16_MIWT1_2_PLR1_SU32_SUM0_SUS256_SKXCCM8_VWA1_VWB1_WGM1_WGMXCC1_WGMXCCGn1
    SolutionIndex: 109
    SolutionNameMin: Cijk_Ailk_Bljk_BBS_BH_UserArgs_MT64x32x64_MI16x16x1_SN_LDSB0_CLR1_GSU0_GSUC0_GSUWGMRR0_K1_LBSPPA1024_LBSPPB128_LPA32_MIWT2_1_PLR1_SU32_SUM0_SUS256_SKXCCM8_VWA2_VWB1_WGM1_WGMXCC1_WGMXCCGn1
    SolutionIndex: 110
    SolutionNameMin: Cijk_Ailk_Bljk_BBS_BH_UserArgs_MT32x32x64_MI16x16x1_SN_LDSB0_CLR1_GSU0_GSUC0_GSUWGMRR0_K1_LBSPPA512_LBSPPB128_LPA16_MIWT1_1_PLR1_SU32_SUM0_SUS256_SKXCCM8_VWA1_VWB1_WGM1_WGMXCC1_WGMXCCGn1
    SolutionIndex: 111
    SolutionNameMin: Cijk_Ailk_Bljk_BBS_BH_UserArgs_MT32x32x64_MI16x16x1_SN_LDSB0_CLR1_GSU0_GSUC0_GSUWGMRR0_K1_LBSPPA512_LBSPPB128_LPA16_MIWT1_1_PLR1_SU32_SUM0_SUS256_SKXCCM8_VWA1_VWB1_WGM8_WGMXCC1_WGMXCCGn1
    SolutionIndex: 112
    SolutionNameMin: Cijk_Ailk_Bljk_BBS_BH_UserArgs_MT64x128x128_MI16x16x1_SN_LDSB1_CLR1_GSU0_GSUC0_GSUWGMRR0_K1_LBSPPA1024_LBSPPB256_LPA32_MIWT2_4_PLR2_SU32_SUM0_SUS256_SKXCCM8_VWA2_VWB1_WGM1_WGMXCC1_WGMXCCGn1
    SolutionIndex: 113
    SolutionNameMin: Cijk_Ailk_Bljk_BBS_BH_UserArgs_MT128x64x128_MI16x16x1_SN_LDSB1_CLR1_GSU0_GSUC0_GSUWGMRR0_K1_LBSPPA2048_LBSPPB256_LPA0_MIWT4_2_PLR1_SU32_SUM0_SUS256_SKXCCM8_VWA4_VWB1_WGM1_WGMXCC1_WGMXCCGn1
    SolutionIndex: 114
    SolutionNameMin: Cijk_Ailk_Bljk_BBS_BH_UserArgs_MT128x64x128_MI16x16x1_SN_LDSB1_CLR1_GSU0_GSUC0_GSUWGMRR0_K1_LBSPPA2048_LBSPPB256_LPA0_MIWT4_2_PLR2_SU32_SUM0_SUS256_SKXCCM8_VWA4_VWB1_WGM1_WGMXCC1_WGMXCCGn1
    SolutionIndex: 115
    SolutionNameMin: Cijk_Ailk_Bljk_BBS_BH_UserArgs_MT128x64x128_MI16x16x1_SN_LDSB1_CLR1_GSU0_GSUC0_GSUWGMRR0_K1_LBSPPA2048_LBSPPB512_LPA0_MIWT4_2_PLR2_SU32_SUM0_SUS256_SKXCCM8_VWA4_VWB2_WGM1_WGMXCC1_WGMXCCGn1
    SolutionIndex: 116
    SolutionNameMin: Cijk_Ailk_Bljk_BBS_BH_UserArgs_MT128x64x128_MI16x16x1_SN_LDSB1_CLR1_GSU0_GSUC0_GSUWGMRR0_K1_LBSPPA2048_LBSPPB256_LPA0_MIWT4_2_PLR2_SU32_SUM0_SUS256_SKXCCM8_VWA4_VWB1_WGM4_WGMXCC1_WGMXCCGn1
    SolutionIndex: 117
    SolutionNameMin: Cijk_Ailk_Bljk_BBS_BH_UserArgs_MT128x64x128_MI16x16x1_SN_LDSB1_CLR1_GSU0_GSUC0_GSUWGMRR0_K1_LBSPPA2048_LBSPPB512_LPA0_MIWT4_2_PLR2_SU32_SUM0_SUS256_SKXCCM8_VWA4_VWB2_WGM4_WGMXCC1_WGMXCCGn1
    SolutionIndex: 118
    SolutionNameMin: Cijk_Ailk_Bljk_BBS_BH_UserArgs_MT128x64x128_MI16x16x1_SN_LDSB1_CLR1_GSU0_GSUC0_GSUWGMRR0_K1_LBSPPA2048_LBSPPB256_LPA0_MIWT4_2_PLR1_SU32_SUM0_SUS256_SKXCCM8_VWA4_VWB1_WGM8_WGMXCC1_WGMXCCGn1
    SolutionIndex: 119
    SolutionNameMin: Cijk_Ailk_Bljk_BBS_BH_UserArgs_MT128x64x128_MI16x16x1_SN_LDSB1_CLR1_GSU0_GSUC0_GSUWGMRR0_K1_LBSPPA2048_LBSPPB256_LPA0_MIWT4_2_PLR2_SU32_SUM0_SUS256_SKXCCM8_VWA4_VWB1_WGM8_WGMXCC1_WGMXCCGn1
    SolutionIndex: 120
    SolutionNameMin: Cijk_Ailk_Bljk_BBS_BH_UserArgs_MT128x64x128_MI16x16x1_SN_LDSB1_CLR1_GSU0_GSUC0_GSUWGMRR0_K1_LBSPPA2048_LBSPPB512_LPA0_MIWT4_2_PLR2_SU32_SUM0_SUS256_SKXCCM8_VWA4_VWB2_WGM8_WGMXCC1_WGMXCCGn1
    SolutionIndex: 121
    SolutionNameMin: Cijk_Ailk_Bljk_BBS_BH_UserArgs_MT64x64x128_MI16x16x1_SN_LDSB1_CLR1_GSU0_GSUC0_GSUWGMRR0_K1_LBSPPA1024_LBSPPB256_LPA32_MIWT2_2_PLR2_SU32_SUM0_SUS256_SKXCCM8_VWA2_VWB1_WGM1_WGMXCC1_WGMXCCGn1
    SolutionIndex: 122
    SolutionNameMin: Cijk_Ailk_Bljk_BBS_BH_UserArgs_MT64x64x128_MI16x16x1_SN_LDSB1_CLR1_GSU0_GSUC0_GSUWGMRR0_K1_LBSPPA1024_LBSPPB512_LPA32_MIWT2_2_PLR2_SU32_SUM0_SUS256_SKXCCM8_VWA2_VWB2_WGM1_WGMXCC1_WGMXCCGn1
    SolutionIndex: 123
    SolutionNameMin: Cijk_Ailk_Bljk_BBS_BH_UserArgs_MT64x64x128_MI16x16x1_SN_LDSB1_CLR1_GSU0_GSUC0_GSUWGMRR0_K1_LBSPPA1024_LBSPPB256_LPA32_MIWT2_2_PLR2_SU32_SUM0_SUS256_SKXCCM8_VWA2_VWB1_WGM4_WGMXCC1_WGMXCCGn1
    SolutionIndex: 124
    SolutionNameMin: Cijk_Ailk_Bljk_BBS_BH_UserArgs_MT64x32x128_MI16x16x1_SN_LDSB1_CLR1_GSU0_GSUC0_GSUWGMRR0_K1_LBSPPA1024_LBSPPB256_LPA32_MIWT2_1_PLR2_SU32_SUM0_SUS256_SKXCCM8_VWA2_VWB1_WGM1_WGMXCC1_WGMXCCGn1
    SolutionIndex: 125
    SolutionNameMin: Cijk_Ailk_Bljk_BBS_BH_UserArgs_MT64x32x128_MI16x16x1_SN_LDSB1_CLR1_GSU0_GSUC0_GSUWGMRR0_K1_LBSPPA1024_LBSPPB256_LPA32_MIWT2_1_PLR2_SU32_SUM0_SUS256_SKXCCM8_VWA2_VWB1_WGM4_WGMXCC1_WGMXCCGn1
    SolutionIndex: 126
    SolutionNameMin: Cijk_Ailk_Bljk_BBS_BH_UserArgs_MT32x32x128_MI16x16x1_SN_LDSB1_CLR1_GSU0_GSUC0_GSUWGMRR0_K1_LBSPPA512_LBSPPB256_LPA16_MIWT1_1_PLR1_SU32_SUM0_SUS256_SKXCCM8_VWA1_VWB1_WGM1_WGMXCC1_WGMXCCGn1
    SolutionIndex: 127
    SolutionNameMin: Cijk_Ailk_Bljk_BBS_BH_UserArgs_MT32x32x128_MI16x16x1_SN_LDSB1_CLR1_GSU0_GSUC0_GSUWGMRR0_K1_LBSPPA512_LBSPPB256_LPA16_MIWT1_1_PLR2_SU32_SUM0_SUS256_SKXCCM8_VWA1_VWB1_WGM1_WGMXCC1_WGMXCCGn1
    SolutionIndex: 128
    SolutionNameMin: Cijk_Ailk_Bljk_BBS_BH_UserArgs_MT32x32x32_MI16x16x1_SN_LDSB0_CLR1_GSU0_GSUC0_GSUWGMRR0_K1_LBSPPA256_LBSPPB128_LPA16_MIWT1_1_PLR1_SU32_SUM0_SUS256_SKXCCM8_VWA1_VWB1_WGM8_WGMXCC1_WGMXCCGn1
- - - [128, 128, 1, 128, 128, 128, 128, 128]
    - [26, 0.083]
  - - [128, 128, 1, 256, 128, 128, 128, 256]
    - [26, 0.149]
  - - [128, 128, 1, 512, 128, 128, 128, 512]
    - [45, 0.251]
  - - [128, 128, 1, 1024, 128, 128, 128, 1024]
    - [46, 0.385]
  - - [128, 128, 1, 2048, 128, 128, 128, 2048]
    - [72, 0.572]
  - - [128, 128, 1, 4096, 128, 128, 128, 4096]
    - [26, 0.993]
  - - [128, 128, 1, 8192, 128, 128, 128, 8192]
    - [126, 1.557]
  - - [128, 256, 1, 128, 128, 128, 128, 128]
    - [110, 0.167]
  - - [128, 256, 1, 256, 128, 128, 128, 256]
    - [26, 0.306]
  - - [128, 256, 1, 512, 128, 128, 128, 512]
    - [46, 0.51]
  - - [128, 256, 1, 1024, 128, 128, 128, 1024]
    - [46, 0.771]
  - - [128, 256, 1, 2048, 128, 128, 128, 2048]
    - [126, 1.139]
  - - [128, 256, 1, 4096, 128, 128, 128, 4096]
    - [110, 2.008]
  - - [128, 256, 1, 8192, 128, 128, 128, 8192]
    - [126, 3.088]
  - - [128, 512, 1, 128, 128, 128, 128, 128]
    - [26, 0.335]
  - - [128, 512, 1, 256, 128, 128, 128, 256]
    - [26, 0.604]
  - - [128, 512, 1, 512, 128, 128, 128, 512]
    - [45, 1.022]
  - - [128, 512, 1, 1024, 128, 128, 128, 1024]
    - [46, 1.542]
  - - [128, 512, 1, 2048, 128, 128, 128, 2048]
    - [126, 2.243]
  - - [128, 512, 1, 4096, 128, 128, 128, 4096]
    - [110, 3.852]
  - - [128, 512, 1, 8192, 128, 128, 128, 8192]
    - [127, 5.846]
  - - [128, 1024, 1, 128, 128, 128, 128, 128]
    - [26, 0.661]
  - - [128, 1024, 1, 256, 128, 128, 128, 256]
    - [26, 1.193]
  - - [128, 1024, 1, 512, 128, 128, 128, 512]
    - [46, 1.994]
  - - [128, 1024, 1, 1024, 128, 128, 128, 1024]
    - [46, 3.084]
  - - [128, 1024, 1, 2048, 128, 128, 128, 2048]
    - [46, 4.246]
  - - [128, 1024, 1, 4096, 128, 128, 128, 4096]
    - [108, 6.442]
  - - [128, 1024, 1, 8192, 128, 128, 128, 8192]
    - [42, 9.473]
  - - [128, 2048, 1, 128, 128, 128, 128, 128]
    - [110, 1.254]
  - - [128, 2048, 1, 256, 128, 128, 128, 256]
    - [110, 2.335]
  - - [128, 2048, 1, 512, 128, 128, 128, 512]
    - [26, 3.805]
  - - [128, 2048, 1, 1024, 128, 128, 128, 1024]
    - [126, 5.766]
  - - [128, 2048, 1, 2048, 128, 128, 128, 2048]
    - [126, 7.929]
  - - [128, 2048, 1, 4096, 128, 128, 128, 4096]
    - [124, 10.328]
  - - [128, 2048, 1, 8192, 128, 128, 128, 8192]
    - [39, 13.718]
  - - [128, 4096, 1, 128, 128, 128, 128, 128]
    - [25, 2.391]
  - - [128, 4096, 1, 256, 128, 128, 128, 256]
    - [25, 4.268]
  - - [128, 4096, 1, 512, 128, 128, 128, 512]
    - [124, 6.964]
  - - [128, 4096, 1, 1024, 128, 128, 128, 1024]
    - [124, 10.384]
  - - [128, 4096, 1, 2048, 128, 128, 128, 2048]
    - [124, 12.483]
  - - [128, 4096, 1, 4096, 128, 128, 128, 4096]
    - [19, 14.725]
  - - [128, 4096, 1, 8192, 128, 128, 128, 8192]
    - [113, 18.171]
  - - [128, 8192, 1, 128, 128, 128, 128, 128]
    - [105, 4.214]
  - - [128, 8192, 1, 256, 128, 128, 128, 256]
    - [105, 7.311]
  - - [128, 8192, 1, 512, 128, 128, 128, 512]
    - [105, 11.633]
  - - [128, 8192, 1, 1024, 128, 128, 128, 1024]
    - [121, 15.404]
  - - [128, 8192, 1, 2048, 128, 128, 128, 2048]
    - [39, 16.601]
  - - [128, 8192, 1, 4096, 128, 128, 128, 4096]
    - [98, 19.08]
  - - [128, 8192, 1, 8192, 128, 128, 128, 8192]
    - [13, 21.629]
  - - [256, 128, 1, 128, 256, 256, 256, 128]
    - [126, 0.165]
  - - [256, 128, 1, 256, 256, 256, 256, 256]
    - [110, 0.305]
  - - [256, 128, 1, 512, 256, 256, 256, 512]
    - [126, 0.503]
  - - [256, 128, 1, 1024, 256, 256, 256, 1024]
    - [46, 0.772]
  - - [256, 128, 1, 2048, 256, 256, 256, 2048]
    - [126, 1.133]
  - - [256, 128, 1, 4096, 256, 256, 256, 4096]
    - [110, 1.98]
  - - [256, 128, 1, 8192, 256, 256, 256, 8192]
    - [46, 3.019]
  - - [256, 256, 1, 128, 256, 256, 256, 128]
    - [26, 0.33]
  - - [256, 256, 1, 256, 256, 256, 256, 256]
    - [26, 0.6]
  - - [256, 256, 1, 512, 256, 256, 256, 512]
    - [45, 1.013]
  - - [256, 256, 1, 1024, 256, 256, 256, 1024]
    - [46, 1.541]
  - - [256, 256, 1, 2048, 256, 256, 256, 2048]
    - [46, 2.202]
  - - [256, 256, 1, 4096, 256, 256, 256, 4096]
    - [110, 3.786]
  - - [256, 256, 1, 8192, 256, 256, 256, 8192]
    - [46, 5.681]
  - - [256, 512, 1, 128, 256, 256, 256, 128]
    - [126, 0.646]
  - - [256, 512, 1, 256, 256, 256, 256, 256]
    - [26, 1.191]
  - - [256, 512, 1, 512, 256, 256, 256, 512]
    - [126, 1.985]
  - - [256, 512, 1, 1024, 256, 256, 256, 1024]
    - [126, 3.041]
  - - [256, 512, 1, 2048, 256, 256, 256, 2048]
    - [126, 4.227]
  - - [256, 512, 1, 4096, 256, 256, 256, 4096]
    - [109, 6.428]
  - - [256, 512, 1, 8192, 256, 256, 256, 8192]
    - [41, 9.455]
  - - [256, 1024, 1, 128, 256, 256, 256, 128]
    - [71, 1.263]
  - - [256, 1024, 1, 256, 256, 256, 256, 256]
    - [46, 2.286]
  - - [256, 1024, 1, 512, 256, 256, 256, 512]
    - [126, 3.729]
  - - [256, 1024, 1, 1024, 256, 256, 256, 1024]
    - [126, 5.919]
  - - [256, 1024, 1, 2048, 256, 256, 256, 2048]
    - [127, 7.949]
  - - [256, 1024, 1, 4096, 256, 256, 256, 4096]
    - [124, 10.325]
  - - [256, 1024, 1, 8192, 256, 256, 256, 8192]
    - [37, 13.624]
  - - [256, 2048, 1, 128, 256, 256, 256, 128]
    - [109, 2.401]
  - - [256, 2048, 1, 256, 256, 256, 256, 256]
    - [25, 4.224]
  - - [256, 2048, 1, 512, 256, 256, 256, 512]
    - [42, 6.926]
  - - [256, 2048, 1, 1024, 256, 256, 256, 1024]
    - [124, 10.355]
  - - [256, 2048, 1, 2048, 256, 256, 256, 2048]
    - [44, 12.226]
  - - [256, 2048, 1, 4096, 256, 256, 256, 4096]
    - [102, 14.846]
  - - [256, 2048, 1, 8192, 256, 256, 256, 8192]
    - [34, 18.703]
  - - [256, 4096, 1, 128, 256, 256, 256, 128]
    - [105, 4.142]
  - - [256, 4096, 1, 256, 256, 256, 256, 256]
    - [23, 7.033]
  - - [256, 4096, 1, 512, 256, 256, 256, 512]
    - [105, 11.501]
  - - [256, 4096, 1, 1024, 256, 256, 256, 1024]
    - [122, 15.236]
  - - [256, 4096, 1, 2048, 256, 256, 256, 2048]
    - [122, 17.683]
  - - [256, 4096, 1, 4096, 256, 256, 256, 4096]
    - [33, 19.511]
  - - [256, 4096, 1, 8192, 256, 256, 256, 8192]
    - [93, 21.513]
  - - [256, 8192, 1, 128, 256, 256, 256, 128]
    - [69, 6.753]
  - - [256, 8192, 1, 256, 256, 256, 256, 256]
    - [69, 11.046]
  - - [256, 8192, 1, 512, 256, 256, 256, 512]
    - [114, 15.665]
  - - [256, 8192, 1, 1024, 256, 256, 256, 1024]
    - [112, 20.443]
  - - [256, 8192, 1, 2048, 256, 256, 256, 2048]
    - [116, 21.603]
  - - [256, 8192, 1, 4096, 256, 256, 256, 4096]
    - [35, 24.014]
  - - [256, 8192, 1, 8192, 256, 256, 256, 8192]
    - [15, 27.421]
  - - [512, 128, 1, 128, 512, 512, 512, 128]
    - [45, 0.32]
  - - [512, 128, 1, 256, 512, 512, 512, 256]
    - [26, 0.586]
  - - [512, 128, 1, 512, 512, 512, 512, 512]
    - [45, 0.999]
  - - [512, 128, 1, 1024, 512, 512, 512, 1024]
    - [46, 1.529]
  - - [512, 128, 1, 2048, 512, 512, 512, 2048]
    - [45, 2.208]
  - - [512, 128, 1, 4096, 512, 512, 512, 4096]
    - [111, 3.716]
  - - [512, 128, 1, 8192, 512, 512, 512, 8192]
    - [46, 5.637]
  - - [512, 256, 1, 128, 512, 512, 512, 128]
    - [46, 0.631]
  - - [512, 256, 1, 256, 512, 512, 512, 256]
    - [110, 1.164]
  - - [512, 256, 1, 512, 512, 512, 512, 512]
    - [127, 1.964]
  - - [512, 256, 1, 1024, 512, 512, 512, 1024]
    - [126, 3.011]
  - - [512, 256, 1, 2048, 512, 512, 512, 2048]
    - [126, 4.196]
  - - [512, 256, 1, 4096, 512, 512, 512, 4096]
    - [46, 6.297]
  - - [512, 256, 1, 8192, 512, 512, 512, 8192]
    - [40, 9.378]
  - - [512, 512, 1, 128, 512, 512, 512, 128]
    - [110, 1.249]
  - - [512, 512, 1, 256, 512, 512, 512, 256]
    - [26, 2.24]
  - - [512, 512, 1, 512, 512, 512, 512, 512]
    - [110, 3.754]
  - - [512, 512, 1, 1024, 512, 512, 512, 1024]
    - [45, 5.813]
  - - [512, 512, 1, 2048, 512, 512, 512, 2048]
    - [127, 7.797]
  - - [512, 512, 1, 4096, 512, 512, 512, 4096]
    - [42, 10.234]
  - - [512, 512, 1, 8192, 512, 512, 512, 8192]
    - [36, 14.447]
  - - [512, 1024, 1, 128, 512, 512, 512, 128]
    - [25, 2.324]
  - - [512, 1024, 1, 256, 512, 512, 512, 256]
    - [124, 4.16]
  - - [512, 1024, 1, 512, 512, 512, 512, 512]
    - [42, 6.855]
  - - [512, 1024, 1, 1024, 512, 512, 512, 1024]
    - [124, 10.295]
  - - [512, 1024, 1, 2048, 512, 512, 512, 2048]
    - [43, 12.181]
  - - [512, 1024, 1, 4096, 512, 512, 512, 4096]
    - [38, 15.589]
  - - [512, 1024, 1, 8192, 512, 512, 512, 8192]
    - [32, 19.018]
  - - [512, 2048, 1, 128, 512, 512, 512, 128]
    - [106, 4.163]
  - - [512, 2048, 1, 256, 512, 512, 512, 256]
    - [21, 7.089]
  - - [512, 2048, 1, 512, 512, 512, 512, 512]
    - [106, 11.436]
  - - [512, 2048, 1, 1024, 512, 512, 512, 1024]
    - [121, 15.314]
  - - [512, 2048, 1, 2048, 512, 512, 512, 2048]
    - [122, 17.78]
  - - [512, 2048, 1, 4096, 512, 512, 512, 4096]
    - [34, 19.881]
  - - [512, 2048, 1, 8192, 512, 512, 512, 8192]
    - [93, 21.473]
  - - [512, 4096, 1, 128, 512, 512, 512, 128]
    - [102, 6.574]
  - - [512, 4096, 1, 256, 512, 512, 512, 256]
    - [99, 11.215]
  - - [512, 4096, 1, 512, 512, 512, 512, 512]
    - [103, 15.548]
  - - [512, 4096, 1, 1024, 512, 512, 512, 1024]
    - [112, 20.445]
  - - [512, 4096, 1, 2048, 512, 512, 512, 2048]
    - [29, 22.27]
  - - [512, 4096, 1, 4096, 512, 512, 512, 4096]
    - [115, 24.082]
  - - [512, 4096, 1, 8192, 512, 512, 512, 8192]
    - [12, 26.046]
  - - [512, 8192, 1, 128, 512, 512, 512, 128]
    - [92, 9.439]
  - - [512, 8192, 1, 256, 512, 512, 512, 256]
    - [96, 14.811]
  - - [512, 8192, 1, 512, 512, 512, 512, 512]
    - [89, 20.72]
  - - [512, 8192, 1, 1024, 512, 512, 512, 1024]
    - [89, 25.438]
  - - [512, 8192, 1, 2048, 512, 512, 512, 2048]
    - [16, 27.82]
  - - [512, 8192, 1, 4096, 512, 512, 512, 4096]
    - [96, 27.013]
  - - [512, 8192, 1, 8192, 512, 512, 512, 8192]
    - [10, 29.532]
  - - [1024, 128, 1, 128, 1024, 1024, 1024, 128]
    - [26, 0.66]
  - - [1024, 128, 1, 256, 1024, 1024, 1024, 256]
    - [127, 1.146]
  - - [1024, 128, 1, 512, 1024, 1024, 1024, 512]
    - [45, 1.967]
  - - [1024, 128, 1, 1024, 1024, 1024, 1024, 1024]
    - [45, 3.052]
  - - [1024, 128, 1, 2048, 1024, 1024, 1024, 2048]
    - [46, 4.197]
  - - [1024, 128, 1, 4096, 1024, 1024, 1024, 4096]
    - [45, 6.294]
  - - [1024, 128, 1, 8192, 1024, 1024, 1024, 8192]
    - [42, 9.011]
  - - [1024, 256, 1, 128, 1024, 1024, 1024, 128]
    - [4, 1.265]
  - - [1024, 256, 1, 256, 1024, 1024, 1024, 256]
    - [26, 2.347]
  - - [1024, 256, 1, 512, 1024, 1024, 1024, 512]
    - [26, 3.794]
  - - [1024, 256, 1, 1024, 1024, 1024, 1024, 1024]
    - [45, 6.025]
  - - [1024, 256, 1, 2048, 1024, 1024, 1024, 2048]
    - [46, 7.996]
  - - [1024, 256, 1, 4096, 1024, 1024, 1024, 4096]
    - [42, 10.243]
  - - [1024, 256, 1, 8192, 1024, 1024, 1024, 8192]
    - [36, 14.54]
  - - [1024, 512, 1, 128, 1024, 1024, 1024, 128]
    - [124, 2.399]
  - - [1024, 512, 1, 256, 1024, 1024, 1024, 256]
    - [124, 4.238]
  - - [1024, 512, 1, 512, 1024, 1024, 1024, 512]
    - [42, 6.872]
  - - [1024, 512, 1, 1024, 1024, 1024, 1024, 1024]
    - [42, 10.294]
  - - [1024, 512, 1, 2048, 1024, 1024, 1024, 2048]
    - [38, 12.137]
  - - [1024, 512, 1, 4096, 1024, 1024, 1024, 4096]
    - [36, 15.252]
  - - [1024, 512, 1, 8192, 1024, 1024, 1024, 8192]
    - [33, 18.722]
  - - [1024, 1024, 1, 128, 1024, 1024, 1024, 128]
    - [21, 4.144]
  - - [1024, 1024, 1, 256, 1024, 1024, 1024, 256]
    - [105, 7.34]
  - - [1024, 1024, 1, 512, 1024, 1024, 1024, 512]
    - [105, 11.536]
  - - [1024, 1024, 1, 1024, 1024, 1024, 1024, 1024]
    - [121, 14.987]
  - - [1024, 1024, 1, 2048, 1024, 1024, 1024, 2048]
    - [37, 17.554]
  - - [1024, 1024, 1, 4096, 1024, 1024, 1024, 4096]
    - [31, 19.842]
  - - [1024, 1024, 1, 8192, 1024, 1024, 1024, 8192]
    - [91, 21.273]
  - - [1024, 2048, 1, 128, 1024, 1024, 1024, 128]
    - [101, 6.74]
  - - [1024, 2048, 1, 256, 1024, 1024, 1024, 256]
    - [20, 11.027]
  - - [1024, 2048, 1, 512, 1024, 1024, 1024, 512]
    - [102, 15.746]
  - - [1024, 2048, 1, 1024, 1024, 1024, 1024, 1024]
    - [114, 20.285]
  - - [1024, 2048, 1, 2048, 1024, 1024, 1024, 2048]
    - [28, 22.224]
  - - [1024, 2048, 1, 4096, 1024, 1024, 1024, 4096]
    - [120, 23.826]
  - - [1024, 2048, 1, 8192, 1024, 1024, 1024, 8192]
    - [94, 25.708]
  - - [1024, 4096, 1, 128, 1024, 1024, 1024, 128]
    - [90, 9.532]
  - - [1024, 4096, 1, 256, 1024, 1024, 1024, 256]
    - [89, 14.993]
  - - [1024, 4096, 1, 512, 1024, 1024, 1024, 512]
    - [89, 20.935]
  - - [1024, 4096, 1, 1024, 1024, 1024, 1024, 1024]
    - [89, 25.344]
  - - [1024, 4096, 1, 2048, 1024, 1024, 1024, 2048]
    - [93, 27.865]
  - - [1024, 4096, 1, 4096, 1024, 1024, 1024, 4096]
    - [93, 26.269]
  - - [1024, 4096, 1, 8192, 1024, 1024, 1024, 8192]
    - [81, 27.6]
  - - [1024, 8192, 1, 128, 1024, 1024, 1024, 128]
    - [66, 12.279]
  - - [1024, 8192, 1, 256, 1024, 1024, 1024, 256]
    - [61, 18.118]
  - - [1024, 8192, 1, 512, 1024, 1024, 1024, 512]
    - [7, 23.217]
  - - [1024, 8192, 1, 1024, 1024, 1024, 1024, 1024]
    - [6, 28.424]
  - - [1024, 8192, 1, 2048, 1024, 1024, 1024, 2048]
    - [8, 32.953]
  - - [1024, 8192, 1, 4096, 1024, 1024, 1024, 4096]
    - [9, 28.709]
  - - [1024, 8192, 1, 8192, 1024, 1024, 1024, 8192]
    - [59, 32.3]
  - - [2048, 128, 1, 128, 2048, 2048, 2048, 128]
    - [26, 1.26]
  - - [2048, 128, 1, 256, 2048, 2048, 2048, 256]
    - [26, 2.327]
  - - [2048, 128, 1, 512, 2048, 2048, 2048, 512]
    - [46, 3.781]
  - - [2048, 128, 1, 1024, 2048, 2048, 2048, 1024]
    - [46, 5.911]
  - - [2048, 128, 1, 2048, 2048, 2048, 2048, 2048]
    - [42, 7.471]
  - - [2048, 128, 1, 4096, 2048, 2048, 2048, 4096]
    - [22, 9.932]
  - - [2048, 128, 1, 8192, 2048, 2048, 2048, 8192]
    - [36, 13.388]
  - - [2048, 256, 1, 128, 2048, 2048, 2048, 128]
    - [109, 2.338]
  - - [2048, 256, 1, 256, 2048, 2048, 2048, 256]
    - [25, 4.158]
  - - [2048, 256, 1, 512, 2048, 2048, 2048, 512]
    - [124, 6.901]
  - - [2048, 256, 1, 1024, 2048, 2048, 2048, 1024]
    - [42, 10.287]
  - - [2048, 256, 1, 2048, 2048, 2048, 2048, 2048]
    - [36, 12.138]
  - - [2048, 256, 1, 4096, 2048, 2048, 2048, 4096]
    - [17, 14.591]
  - - [2048, 256, 1, 8192, 2048, 2048, 2048, 8192]
    - [31, 18.134]
  - - [2048, 512, 1, 128, 2048, 2048, 2048, 128]
    - [105, 4.192]
  - - [2048, 512, 1, 256, 2048, 2048, 2048, 256]
    - [22, 7.038]
  - - [2048, 512, 1, 512, 2048, 2048, 2048, 512]
    - [105, 11.443]
  - - [2048, 512, 1, 1024, 2048, 2048, 2048, 1024]
    - [123, 15.11]
  - - [2048, 512, 1, 2048, 2048, 2048, 2048, 2048]
    - [27, 16.704]
  - - [2048, 512, 1, 4096, 2048, 2048, 2048, 4096]
    - [95, 19.542]
  - - [2048, 512, 1, 8192, 2048, 2048, 2048, 8192]
    - [91, 21.138]
  - - [2048, 1024, 1, 128, 2048, 2048, 2048, 128]
    - [69, 6.757]
  - - [2048, 1024, 1, 256, 2048, 2048, 2048, 256]
    - [101, 11.202]
  - - [2048, 1024, 1, 512, 2048, 2048, 2048, 512]
    - [101, 15.768]
  - - [2048, 1024, 1, 1024, 2048, 2048, 2048, 1024]
    - [116, 20.181]
  - - [2048, 1024, 1, 2048, 2048, 2048, 2048, 2048]
    - [17, 21.15]
  - - [2048, 1024, 1, 4096, 2048, 2048, 2048, 4096]
    - [120, 23.756]
  - - [2048, 1024, 1, 8192, 2048, 2048, 2048, 8192]
    - [89, 25.936]
  - - [2048, 2048, 1, 128, 2048, 2048, 2048, 128]
    - [68, 9.548]
  - - [2048, 2048, 1, 256, 2048, 2048, 2048, 256]
    - [89, 14.971]
  - - [2048, 2048, 1, 512, 2048, 2048, 2048, 512]
    - [94, 20.681]
  - - [2048, 2048, 1, 1024, 2048, 2048, 2048, 1024]
    - [94, 25.106]
  - - [2048, 2048, 1, 2048, 2048, 2048, 2048, 2048]
    - [94, 27.547]
  - - [2048, 2048, 1, 4096, 2048, 2048, 2048, 4096]
    - [93, 28.58]
  - - [2048, 2048, 1, 8192, 2048, 2048, 2048, 8192]
    - [82, 28.505]
  - - [2048, 4096, 1, 128, 2048, 2048, 2048, 128]
    - [60, 12.283]
  - - [2048, 4096, 1, 256, 2048, 2048, 2048, 256]
    - [3, 17.843]
  - - [2048, 4096, 1, 512, 2048, 2048, 2048, 512]
    - [64, 23.17]
  - - [2048, 4096, 1, 1024, 2048, 2048, 2048, 1024]
    - [85, 27.752]
  - - [2048, 4096, 1, 2048, 2048, 2048, 2048, 2048]
    - [78, 33.016]
  - - [2048, 4096, 1, 4096, 2048, 2048, 2048, 4096]
    - [74, 28.325]
  - - [2048, 4096, 1, 8192, 2048, 2048, 2048, 8192]
    - [51, 31.382]
  - - [2048, 8192, 1, 128, 2048, 2048, 2048, 128]
    - [1, 12.063]
  - - [2048, 8192, 1, 256, 2048, 2048, 2048, 256]
    - [48, 18.396]
  - - [2048, 8192, 1, 512, 2048, 2048, 2048, 512]
    - [1, 25.876]
  - - [2048, 8192, 1, 1024, 2048, 2048, 2048, 1024]
    - [2, 32.028]
  - - [2048, 8192, 1, 2048, 2048, 2048, 2048, 2048]
    - [79, 28.445]
  - - [2048, 8192, 1, 4096, 2048, 2048, 2048, 4096]
    - [59, 31.324]
  - - [2048, 8192, 1, 8192, 2048, 2048, 2048, 8192]
    - [50, 33.371]
  - - [4096, 128, 1, 128, 4096, 4096, 4096, 128]
    - [42, 2.296]
  - - [4096, 128, 1, 256, 4096, 4096, 4096, 256]
    - [124, 4.179]
  - - [4096, 128, 1, 512, 4096, 4096, 4096, 512]
    - [124, 6.825]
  - - [4096, 128, 1, 1024, 4096, 4096, 4096, 1024]
    - [125, 10.035]
  - - [4096, 128, 1, 2048, 4096, 4096, 4096, 2048]
    - [42, 10.745]
  - - [4096, 128, 1, 4096, 4096, 4096, 4096, 4096]
    - [104, 13.941]
  - - [4096, 128, 1, 8192, 4096, 4096, 4096, 8192]
    - [117, 17.446]
  - - [4096, 256, 1, 128, 4096, 4096, 4096, 128]
    - [22, 4.103]
  - - [4096, 256, 1, 256, 4096, 4096, 4096, 256]
    - [21, 7.231]
  - - [4096, 256, 1, 512, 4096, 4096, 4096, 512]
    - [105, 11.28]
  - - [4096, 256, 1, 1024, 4096, 4096, 4096, 1024]
    - [123, 14.909]
  - - [4096, 256, 1, 2048, 4096, 4096, 4096, 2048]
    - [36, 16.024]
  - - [4096, 256, 1, 4096, 4096, 4096, 4096, 4096]
    - [30, 19.145]
  - - [4096, 256, 1, 8192, 4096, 4096, 4096, 8192]
    - [89, 21.397]
  - - [4096, 512, 1, 128, 4096, 4096, 4096, 128]
    - [70, 6.649]
  - - [4096, 512, 1, 256, 4096, 4096, 4096, 256]
    - [99, 11.117]
  - - [4096, 512, 1, 512, 4096, 4096, 4096, 512]
    - [100, 15.625]
  - - [4096, 512, 1, 1024, 4096, 4096, 4096, 1024]
    - [116, 20.153]
  - - [4096, 512, 1, 2048, 4096, 4096, 4096, 2048]
    - [118, 21.289]
  - - [4096, 512, 1, 4096, 4096, 4096, 4096, 4096]
    - [120, 23.752]
  - - [4096, 512, 1, 8192, 4096, 4096, 4096, 8192]
    - [93, 26.943]
  - - [4096, 1024, 1, 128, 4096, 4096, 4096, 128]
    - [67, 9.391]
  - - [4096, 1024, 1, 256, 4096, 4096, 4096, 256]
    - [16, 14.505]
  - - [4096, 1024, 1, 512, 4096, 4096, 4096, 512]
    - [94, 20.675]
  - - [4096, 1024, 1, 1024, 4096, 4096, 4096, 1024]
    - [94, 24.927]
  - - [4096, 1024, 1, 2048, 4096, 4096, 4096, 2048]
    - [96, 27.569]
  - - [4096, 1024, 1, 4096, 4096, 4096, 4096, 4096]
    - [91, 28.05]
  - - [4096, 1024, 1, 8192, 4096, 4096, 4096, 8192]
    - [74, 29.449]
  - - [4096, 2048, 1, 128, 4096, 4096, 4096, 128]
    - [63, 11.914]
  - - [4096, 2048, 1, 256, 4096, 4096, 4096, 256]
    - [64, 17.741]
  - - [4096, 2048, 1, 512, 4096, 4096, 4096, 512]
    - [80, 22.972]
  - - [4096, 2048, 1, 1024, 4096, 4096, 4096, 1024]
    - [85, 27.8]
  - - [4096, 2048, 1, 2048, 4096, 4096, 4096, 2048]
    - [82, 32.782]
  - - [4096, 2048, 1, 4096, 4096, 4096, 4096, 4096]
    - [75, 30.049]
  - - [4096, 2048, 1, 8192, 4096, 4096, 4096, 8192]
    - [51, 31.952]
  - - [4096, 4096, 1, 128, 4096, 4096, 4096, 128]
    - [52, 12.091]
  - - [4096, 4096, 1, 256, 4096, 4096, 4096, 256]
    - [57, 18.209]
  - - [4096, 4096, 1, 512, 4096, 4096, 4096, 512]
    - [0, 25.098]
  - - [4096, 4096, 1, 1024, 4096, 4096, 4096, 1024]
    - [47, 30.934]
  - - [4096, 4096, 1, 2048, 4096, 4096, 4096, 2048]
    - [74, 29.732]
  - - [4096, 4096, 1, 4096, 4096, 4096, 4096, 4096]
    - [58, 31.595]
  - - [4096, 4096, 1, 8192, 4096, 4096, 4096, 8192]
    - [56, 33.964]
  - - [4096, 8192, 1, 128, 4096, 4096, 4096, 128]
    - [14, 11.764]
  - - [4096, 8192, 1, 256, 4096, 4096, 4096, 256]
    - [74, 17.09]
  - - [4096, 8192, 1, 512, 4096, 4096, 4096, 512]
    - [74, 22.187]
  - - [4096, 8192, 1, 1024, 4096, 4096, 4096, 1024]
    - [76, 26.638]
  - - [4096, 8192, 1, 2048, 4096, 4096, 4096, 2048]
    - [73, 31.427]
  - - [4096, 8192, 1, 4096, 4096, 4096, 4096, 4096]
    - [77, 34.347]
  - - [4096, 8192, 1, 8192, 4096, 4096, 4096, 8192]
    - [54, 36.452]
  - - [8192, 128, 1, 128, 8192, 8192, 8192, 128]
    - [21, 4.142]
  - - [8192, 128, 1, 256, 8192, 8192, 8192, 256]
    - [24, 6.994]
  - - [8192, 128, 1, 512, 8192, 8192, 8192, 512]
    - [107, 11.133]
  - - [8192, 128, 1, 1024, 8192, 8192, 8192, 1024]
    - [123, 14.841]
  - - [8192, 128, 1, 2048, 8192, 8192, 8192, 2048]
    - [36, 15.777]
  - - [8192, 128, 1, 4096, 8192, 8192, 8192, 4096]
    - [31, 18.497]
  - - [8192, 128, 1, 8192, 8192, 8192, 8192, 8192]
    - [14, 21.401]
  - - [8192, 256, 1, 128, 8192, 8192, 8192, 128]
    - [104, 6.604]
  - - [8192, 256, 1, 256, 8192, 8192, 8192, 256]
    - [104, 10.892]
  - - [8192, 256, 1, 512, 8192, 8192, 8192, 512]
    - [103, 15.424]
  - - [8192, 256, 1, 1024, 8192, 8192, 8192, 1024]
    - [119, 20.153]
  - - [8192, 256, 1, 2048, 8192, 8192, 8192, 2048]
    - [18, 20.794]
  - - [8192, 256, 1, 4096, 8192, 8192, 8192, 4096]
    - [116, 23.145]
  - - [8192, 256, 1, 8192, 8192, 8192, 8192, 8192]
    - [89, 26.456]
  - - [8192, 512, 1, 128, 8192, 8192, 8192, 128]
    - [97, 9.352]
  - - [8192, 512, 1, 256, 8192, 8192, 8192, 256]
    - [96, 14.808]
  - - [8192, 512, 1, 512, 8192, 8192, 8192, 512]
    - [94, 20.72]
  - - [8192, 512, 1, 1024, 8192, 8192, 8192, 1024]
    - [96, 24.988]
  - - [8192, 512, 1, 2048, 8192, 8192, 8192, 2048]
    - [94, 27.696]
  - - [8192, 512, 1, 4096, 8192, 8192, 8192, 4096]
    - [89, 27.307]
  - - [8192, 512, 1, 8192, 8192, 8192, 8192, 8192]
    - [5, 29.752]
  - - [8192, 1024, 1, 128, 8192, 8192, 8192, 128]
    - [86, 11.457]
  - - [8192, 1024, 1, 256, 8192, 8192, 8192, 256]
    - [88, 17.209]
  - - [8192, 1024, 1, 512, 8192, 8192, 8192, 512]
    - [83, 23.09]
  - - [8192, 1024, 1, 1024, 8192, 8192, 8192, 1024]
    - [84, 26.84]
  - - [8192, 1024, 1, 2048, 8192, 8192, 8192, 2048]
    - [83, 32.419]
  - - [8192, 1024, 1, 4096, 8192, 8192, 8192, 4096]
    - [77, 29.65]
  - - [8192, 1024, 1, 8192, 8192, 8192, 8192, 8192]
    - [51, 31.799]
  - - [8192, 2048, 1, 128, 8192, 8192, 8192, 128]
    - [55, 12.125]
  - - [8192, 2048, 1, 256, 8192, 8192, 8192, 256]
    - [55, 18.329]
  - - [8192, 2048, 1, 512, 8192, 8192, 8192, 512]
    - [55, 24.965]
  - - [8192, 2048, 1, 1024, 8192, 8192, 8192, 1024]
    - [57, 31.236]
  - - [8192, 2048, 1, 2048, 8192, 8192, 8192, 2048]
    - [78, 29.316]
  - - [8192, 2048, 1, 4096, 8192, 8192, 8192, 4096]
    - [76, 32.15]
  - - [8192, 2048, 1, 8192, 8192, 8192, 8192, 8192]
    - [51, 34.816]
  - - [8192, 4096, 1, 128, 8192, 8192, 8192, 128]
    - [14, 11.761]
  - - [8192, 4096, 1, 256, 8192, 8192, 8192, 256]
    - [87, 16.909]
  - - [8192, 4096, 1, 512, 8192, 8192, 8192, 512]
    - [82, 21.819]
  - - [8192, 4096, 1, 1024, 8192, 8192, 8192, 1024]
    - [49, 26.786]
  - - [8192, 4096, 1, 2048, 8192, 8192, 8192, 2048]
    - [81, 31.259]
  - - [8192, 4096, 1, 4096, 8192, 8192, 8192, 4096]
    - [49, 34.097]
  - - [8192, 4096, 1, 8192, 8192, 8192, 8192, 8192]
    - [59, 36.581]
  - - [8192, 8192, 1, 128, 8192, 8192, 8192, 128]
    - [11, 12.899]
  - - [8192, 8192, 1, 256, 8192, 8192, 8192, 256]
    - [62, 16.273]
  - - [8192, 8192, 1, 512, 8192, 8192, 8192, 512]
    - [65, 22.256]
  - - [8192, 8192, 1, 1024, 8192, 8192, 8192, 1024]
    - [80, 28.052]
  - - [8192, 8192, 1, 2048, 8192, 8192, 8192, 2048]
    - [54, 33.763]
  - - [8192, 8192, 1, 4096, 8192, 8192, 8192, 4096]
    - [47, 36.463]
  - - [8192, 8192, 1, 8192, 8192, 8192, 8192, 8192]
    - [53, 37.676]
  - - [1, 1, 1, 32, 1, 1, 1, 32]
    - [128, 0.0]
- null
- null
- ExperimentalStreamK
- GridBased
