library/src/amd_detail/rocblaslt/src/Tensile/Logic/asm_full/aquavanjaram/gfx942/StreamK/aquavanjaram942_Cijk_Ailk_Bjlk_BBS_BH_UserArgs.yaml
- {MinimumRequiredVersion: 4.33.0}
- aquavanjaram942
- gfx942
- [Device 0049, Device 0050]
    SolutionIndex: 0
    SolutionNameMin: Cijk_Ailk_Bjlk_BBS_BH_UserArgs_MT256x256x32_MI16x16x1_SN_LDSB0_CLR1_GSU0_GSUC0_GSUWGMRR0_K1_LBSPPA2048_LBSPPB2048_LPA0_LPB0_MIWT8_8_PLR1_SU32_SUM0_SUS256_SKXCCM0_VWA4_VWB8_WGM1_WGMXCC1_WGMXCCGn1
    SolutionIndex: 1
    SolutionNameMin: Cijk_Ailk_Bjlk_BBS_BH_UserArgs_MT256x256x32_MI16x16x1_SN_LDSB1_CLR1_GSU0_GSUC0_GSUWGMRR0_K1_LBSPPA2048_LBSPPB2048_LPA0_LPB16_MIWT8_8_PLR1_SU32_SUM0_SUS256_SKXCCM0_VWA8_VWB1_WGM4_WGMXCC1_WGMXCCGn1
    SolutionIndex: 2
    SolutionNameMin: Cijk_Ailk_Bjlk_BBS_BH_UserArgs_MT256x256x32_MI16x16x1_SN_LDSB0_CLR1_GSU0_GSUC0_GSUWGMRR0_K1_LBSPPA2048_LBSPPB2048_LPA0_LPB0_MIWT8_8_PLR1_SU32_SUM0_SUS256_SKXCCM0_VWA4_VWB8_WGM4_WGMXCC1_WGMXCCGn1
    SolutionIndex: 3
    SolutionNameMin: Cijk_Ailk_Bjlk_BBS_BH_UserArgs_MT256x256x32_MI16x16x1_SN_LDSB0_CLR1_GSU0_GSUC0_GSUWGMRR0_K1_LBSPPA2048_LBSPPB2048_LPA0_LPB0_MIWT8_8_PLR1_SU32_SUM0_SUS256_SKXCCM0_VWA8_VWB8_WGM4_WGMXCC1_WGMXCCGn1
    SolutionIndex: 4
    SolutionNameMin: Cijk_Ailk_Bjlk_BBS_BH_UserArgs_MT256x256x32_MI16x16x1_SN_LDSB0_CLR1_GSU0_GSUC0_GSUWGMRR0_K1_LBSPPA2048_LBSPPB2048_LPA0_LPB0_MIWT8_8_PLR1_SU32_SUM0_SUS256_SKXCCM0_VWA4_VWB8_WGM8_WGMXCC1_WGMXCCGn1
    SolutionIndex: 5
    SolutionNameMin: Cijk_Ailk_Bjlk_BBS_BH_UserArgs_MT128x256x32_MI16x16x1_SN_LDSB1_CLR1_GSU0_GSUC0_GSUWGMRR0_K1_LBSPPA1024_LBSPPB2048_LPA0_LPB0_MIWT4_8_PLR1_SU32_SUM0_SUS256_SKXCCM0_VWA4_VWB8_WGM4_WGMXCC1_WGMXCCGn1
    SolutionIndex: 6
    SolutionNameMin: Cijk_Ailk_Bjlk_BBS_BH_UserArgs_MT128x256x32_MI16x16x1_SN_LDSB1_CLR1_GSU0_GSUC0_GSUWGMRR0_K1_LBSPPA1024_LBSPPB2048_LPA0_LPB0_MIWT4_8_PLR1_SU32_SUM0_SUS256_SKXCCM0_VWA4_VWB8_WGM8_WGMXCC1_WGMXCCGn1
    SolutionIndex: 7
    SolutionNameMin: Cijk_Ailk_Bjlk_BBS_BH_UserArgs_MT256x128x32_MI16x16x1_SN_LDSB1_CLR1_GSU0_GSUC0_GSUWGMRR0_K1_LBSPPA2048_LBSPPB1024_LPA0_LPB0_MIWT8_4_PLR1_SU32_SUM0_SUS256_SKXCCM0_VWA8_VWB4_WGM8_WGMXCC1_WGMXCCGn1
    SolutionIndex: 8
    SolutionNameMin: Cijk_Ailk_Bjlk_BBS_BH_UserArgs_MT128x128x32_MI16x16x1_SN_LDSB0_CLR0_GSU0_GSUC0_GSUWGMRR0_K1_LBSPPA1024_LBSPPB1024_LPA0_LPB0_MIWT4_4_PLR0_SU32_SUM0_SUS256_SKXCCM0_VWA4_VWB4_WGM8_WGMXCC1_WGMXCCGn1
    SolutionIndex: 9
    SolutionNameMin: Cijk_Ailk_Bjlk_BBS_BH_UserArgs_MT64x128x32_MI16x16x1_SN_LDSB0_CLR1_GSU0_GSUC0_GSUWGMRR0_K1_LBSPPA512_LBSPPB1024_LPA32_LPB0_MIWT2_4_PLR1_SU32_SUM0_SUS256_SKXCCM0_VWA2_VWB4_WGM1_WGMXCC1_WGMXCCGn1
    SolutionIndex: 10
    SolutionNameMin: Cijk_Ailk_Bjlk_BBS_BH_UserArgs_MT64x32x32_MI16x16x1_SN_LDSB0_CLR1_GSU0_GSUC0_GSUWGMRR0_K1_LBSPPA512_LBSPPB256_LPA32_LPB16_MIWT2_1_PLR1_SU32_SUM0_SUS256_SKXCCM0_VWA2_VWB1_WGM1_WGMXCC1_WGMXCCGn1
    SolutionIndex: 11
    SolutionNameMin: Cijk_Ailk_Bjlk_BBS_BH_UserArgs_MT32x32x32_MI16x16x1_SN_LDSB0_CLR1_GSU0_GSUC0_GSUWGMRR0_K1_LBSPPA256_LBSPPB256_LPA16_LPB16_MIWT1_1_PLR1_SU32_SUM0_SUS256_SKXCCM0_VWA1_VWB1_WGM1_WGMXCC1_WGMXCCGn1
    SolutionIndex: 12
    SolutionNameMin: Cijk_Ailk_Bjlk_BBS_BH_UserArgs_MT32x32x32_MI16x16x1_SN_LDSB0_CLR0_GSU0_GSUC0_GSUWGMRR0_K1_LBSPPA256_LBSPPB256_LPA16_LPB16_MIWT1_1_PLR0_SU32_SUM0_SUS256_SKXCCM0_VWA1_VWB1_WGM1_WGMXCC1_WGMXCCGn1
    SolutionIndex: 13
    SolutionNameMin: Cijk_Ailk_Bjlk_BBS_BH_UserArgs_MT256x256x64_MI16x16x1_SN_LDSB1_CLR1_GSU0_GSUC0_GSUWGMRR0_K1_LBSPPA2048_LBSPPB2048_LPA0_LPB0_MIWT8_8_PLR1_SU32_SUM0_SUS256_SKXCCM0_VWA4_VWB8_WGM4_WGMXCC1_WGMXCCGn1
    SolutionIndex: 14
    SolutionNameMin: Cijk_Ailk_Bjlk_BBS_BH_UserArgs_MT256x256x64_MI16x16x1_SN_LDSB1_CLR1_GSU0_GSUC0_GSUWGMRR0_K1_LBSPPA2048_LBSPPB2048_LPA0_LPB0_MIWT8_8_PLR2_SU32_SUM0_SUS256_SKXCCM0_VWA8_VWB8_WGM8_WGMXCC1_WGMXCCGn1
    SolutionIndex: 15
    SolutionNameMin: Cijk_Ailk_Bjlk_BBS_BH_UserArgs_MT256x128x64_MI16x16x1_SN_LDSB1_CLR1_GSU0_GSUC0_GSUWGMRR0_K1_LBSPPA2048_LBSPPB1024_LPA0_LPB0_MIWT8_4_PLR1_SU32_SUM0_SUS256_SKXCCM0_VWA8_VWB4_WGM4_WGMXCC1_WGMXCCGn1
    SolutionIndex: 16
    SolutionNameMin: Cijk_Ailk_Bjlk_BBS_BH_UserArgs_MT256x128x64_MI16x16x1_SN_LDSB1_CLR1_GSU0_GSUC0_GSUWGMRR0_K1_LBSPPA2048_LBSPPB1024_LPA0_LPB0_MIWT8_4_PLR1_SU32_SUM0_SUS256_SKXCCM0_VWA4_VWB4_WGM8_WGMXCC1_WGMXCCGn1
    SolutionIndex: 17
    SolutionNameMin: Cijk_Ailk_Bjlk_BBS_BH_UserArgs_MT128x128x64_MI16x16x1_SN_LDSB1_CLR1_GSU0_GSUC0_GSUWGMRR0_K1_LBSPPA1024_LBSPPB1024_LPA0_LPB0_MIWT4_4_PLR1_SU32_SUM0_SUS256_SKXCCM0_VWA4_VWB4_WGM8_WGMXCC1_WGMXCCGn1
    SolutionIndex: 18
    SolutionNameMin: Cijk_Ailk_Bjlk_BBS_BH_UserArgs_MT64x128x64_MI16x16x1_SN_LDSB1_CLR1_GSU0_GSUC0_GSUWGMRR0_K1_LBSPPA512_LBSPPB1024_LPA32_LPB0_MIWT2_4_PLR2_SU32_SUM0_SUS256_SKXCCM0_VWA2_VWB4_WGM1_WGMXCC1_WGMXCCGn1
    SolutionIndex: 19
    SolutionNameMin: Cijk_Ailk_Bjlk_BBS_BH_UserArgs_MT128x64x64_MI16x16x1_SN_LDSB1_CLR1_GSU0_GSUC0_GSUWGMRR0_K1_LBSPPA1024_LBSPPB512_LPA0_LPB32_MIWT4_2_PLR2_SU32_SUM0_SUS256_SKXCCM0_VWA4_VWB2_WGM8_WGMXCC1_WGMXCCGn1
    SolutionIndex: 20
    SolutionNameMin: Cijk_Ailk_Bjlk_BBS_BH_UserArgs_MT64x64x64_MI16x16x1_SN_LDSB1_CLR1_GSU0_GSUC0_GSUWGMRR0_K1_LBSPPA512_LBSPPB512_LPA32_LPB32_MIWT2_2_PLR1_SU32_SUM0_SUS256_SKXCCM0_VWA2_VWB2_WGM1_WGMXCC1_WGMXCCGn1
    SolutionIndex: 21
    SolutionNameMin: Cijk_Ailk_Bjlk_BBS_BH_UserArgs_MT64x64x64_MI16x16x1_SN_LDSB1_CLR1_GSU0_GSUC0_GSUWGMRR0_K1_LBSPPA512_LBSPPB512_LPA32_LPB32_MIWT2_2_PLR2_SU32_SUM0_SUS256_SKXCCM0_VWA2_VWB2_WGM1_WGMXCC1_WGMXCCGn1
    SolutionIndex: 22
    SolutionNameMin: Cijk_Ailk_Bjlk_BBS_BH_UserArgs_MT64x64x64_MI16x16x1_SN_LDSB1_CLR1_GSU0_GSUC0_GSUWGMRR0_K1_LBSPPA512_LBSPPB512_LPA32_LPB32_MIWT2_2_PLR1_SU32_SUM0_SUS256_SKXCCM0_VWA2_VWB2_WGM4_WGMXCC1_WGMXCCGn1
    SolutionIndex: 23
    SolutionNameMin: Cijk_Ailk_Bjlk_BBS_BH_UserArgs_MT64x64x64_MI16x16x1_SN_LDSB1_CLR1_GSU0_GSUC0_GSUWGMRR0_K1_LBSPPA512_LBSPPB512_LPA32_LPB32_MIWT2_2_PLR2_SU32_SUM0_SUS256_SKXCCM0_VWA2_VWB2_WGM4_WGMXCC1_WGMXCCGn1
    SolutionIndex: 24
    SolutionNameMin: Cijk_Ailk_Bjlk_BBS_BH_UserArgs_MT32x64x64_MI16x16x1_SN_LDSB0_CLR1_GSU0_GSUC0_GSUWGMRR0_K1_LBSPPA256_LBSPPB512_LPA16_LPB32_MIWT1_2_PLR2_SU32_SUM0_SUS256_SKXCCM0_VWA1_VWB2_WGM1_WGMXCC1_WGMXCCGn1
    SolutionIndex: 25
    SolutionNameMin: Cijk_Ailk_Bjlk_BBS_BH_UserArgs_MT64x32x64_MI16x16x1_SN_LDSB0_CLR1_GSU0_GSUC0_GSUWGMRR0_K1_LBSPPA512_LBSPPB256_LPA32_LPB16_MIWT2_1_PLR2_SU32_SUM0_SUS256_SKXCCM0_VWA2_VWB1_WGM1_WGMXCC1_WGMXCCGn1
    SolutionIndex: 26
    SolutionNameMin: Cijk_Ailk_Bjlk_BBS_BH_UserArgs_MT32x32x64_MI16x16x1_SN_LDSB0_CLR1_GSU0_GSUC0_GSUWGMRR0_K1_LBSPPA256_LBSPPB256_LPA16_LPB16_MIWT1_1_PLR1_SU32_SUM0_SUS256_SKXCCM0_VWA1_VWB1_WGM1_WGMXCC1_WGMXCCGn1
    SolutionIndex: 27
    SolutionNameMin: Cijk_Ailk_Bjlk_BBS_BH_UserArgs_MT32x32x64_MI16x16x1_SN_LDSB0_CLR1_GSU0_GSUC0_GSUWGMRR0_K1_LBSPPA256_LBSPPB256_LPA16_LPB16_MIWT1_1_PLR2_SU32_SUM0_SUS256_SKXCCM0_VWA1_VWB1_WGM1_WGMXCC1_WGMXCCGn1
    SolutionIndex: 28
    SolutionNameMin: Cijk_Ailk_Bjlk_BBS_BH_UserArgs_MT128x128x128_MI16x16x1_SN_LDSB1_CLR1_GSU0_GSUC0_GSUWGMRR0_K1_LBSPPA1024_LBSPPB1024_LPA0_LPB0_MIWT4_4_PLR1_SU32_SUM0_SUS256_SKXCCM0_VWA4_VWB4_WGM1_WGMXCC1_WGMXCCGn1
    SolutionIndex: 29
    SolutionNameMin: Cijk_Ailk_Bjlk_BBS_BH_UserArgs_MT128x128x128_MI16x16x1_SN_LDSB1_CLR1_GSU0_GSUC0_GSUWGMRR0_K1_LBSPPA1024_LBSPPB1024_LPA0_LPB0_MIWT4_4_PLR2_SU32_SUM0_SUS256_SKXCCM0_VWA4_VWB4_WGM1_WGMXCC1_WGMXCCGn1
    SolutionIndex: 30
    SolutionNameMin: Cijk_Ailk_Bjlk_BBS_BH_UserArgs_MT128x128x128_MI16x16x1_SN_LDSB1_CLR1_GSU0_GSUC0_GSUWGMRR0_K1_LBSPPA1024_LBSPPB1024_LPA0_LPB0_MIWT4_4_PLR1_SU32_SUM0_SUS256_SKXCCM0_VWA4_VWB4_WGM4_WGMXCC1_WGMXCCGn1
    SolutionIndex: 31
    SolutionNameMin: Cijk_Ailk_Bjlk_BBS_BH_UserArgs_MT128x128x128_MI16x16x1_SN_LDSB1_CLR1_GSU0_GSUC0_GSUWGMRR0_K1_LBSPPA1024_LBSPPB1024_LPA0_LPB0_MIWT4_4_PLR1_SU32_SUM0_SUS256_SKXCCM0_VWA4_VWB4_WGM8_WGMXCC1_WGMXCCGn1
    SolutionIndex: 32
    SolutionNameMin: Cijk_Ailk_Bjlk_BBS_BH_UserArgs_MT128x128x128_MI16x16x1_SN_LDSB1_CLR1_GSU0_GSUC0_GSUWGMRR0_K1_LBSPPA1024_LBSPPB1024_LPA0_LPB0_MIWT4_4_PLR2_SU32_SUM0_SUS256_SKXCCM0_VWA4_VWB4_WGM8_WGMXCC1_WGMXCCGn1
    SolutionIndex: 33
    SolutionNameMin: Cijk_Ailk_Bjlk_BBS_BH_UserArgs_MT64x128x128_MI16x16x1_SN_LDSB1_CLR1_GSU0_GSUC0_GSUWGMRR0_K1_LBSPPA512_LBSPPB1024_LPA32_LPB0_MIWT2_4_PLR2_SU32_SUM0_SUS256_SKXCCM0_VWA2_VWB4_WGM1_WGMXCC1_WGMXCCGn1
    SolutionIndex: 34
    SolutionNameMin: Cijk_Ailk_Bjlk_BBS_BH_UserArgs_MT128x64x128_MI16x16x1_SN_LDSB1_CLR1_GSU0_GSUC0_GSUWGMRR0_K1_LBSPPA1024_LBSPPB512_LPA0_LPB32_MIWT4_2_PLR2_SU32_SUM0_SUS256_SKXCCM0_VWA4_VWB2_WGM1_WGMXCC1_WGMXCCGn1
    SolutionIndex: 35
    SolutionNameMin: Cijk_Ailk_Bjlk_BBS_BH_UserArgs_MT128x64x128_MI16x16x1_SN_LDSB1_CLR1_GSU0_GSUC0_GSUWGMRR0_K1_LBSPPA1024_LBSPPB512_LPA0_LPB32_MIWT4_2_PLR2_SU32_SUM0_SUS256_SKXCCM0_VWA4_VWB2_WGM4_WGMXCC1_WGMXCCGn1
    SolutionIndex: 36
    SolutionNameMin: Cijk_Ailk_Bjlk_BBS_BH_UserArgs_MT128x64x128_MI16x16x1_SN_LDSB1_CLR1_GSU0_GSUC0_GSUWGMRR0_K1_LBSPPA1024_LBSPPB512_LPA0_LPB32_MIWT4_2_PLR2_SU32_SUM0_SUS256_SKXCCM0_VWA4_VWB2_WGM8_WGMXCC1_WGMXCCGn1
    SolutionIndex: 37
    SolutionNameMin: Cijk_Ailk_Bjlk_BBS_BH_UserArgs_MT64x64x128_MI16x16x1_SN_LDSB1_CLR1_GSU0_GSUC0_GSUWGMRR0_K1_LBSPPA512_LBSPPB512_LPA32_LPB32_MIWT2_2_PLR2_SU32_SUM0_SUS256_SKXCCM0_VWA2_VWB2_WGM1_WGMXCC1_WGMXCCGn1
    SolutionIndex: 38
    SolutionNameMin: Cijk_Ailk_Bjlk_BBS_BH_UserArgs_MT64x64x128_MI16x16x1_SN_LDSB1_CLR1_GSU0_GSUC0_GSUWGMRR0_K1_LBSPPA512_LBSPPB512_LPA32_LPB32_MIWT2_2_PLR2_SU32_SUM0_SUS256_SKXCCM0_VWA2_VWB2_WGM4_WGMXCC1_WGMXCCGn1
    SolutionIndex: 39
    SolutionNameMin: Cijk_Ailk_Bjlk_BBS_BH_UserArgs_MT64x64x128_MI16x16x1_SN_LDSB1_CLR1_GSU0_GSUC0_GSUWGMRR0_K1_LBSPPA512_LBSPPB512_LPA32_LPB32_MIWT2_2_PLR2_SU32_SUM0_SUS256_SKXCCM0_VWA2_VWB2_WGM8_WGMXCC1_WGMXCCGn1
    SolutionIndex: 40
    SolutionNameMin: Cijk_Ailk_Bjlk_BBS_BH_UserArgs_MT32x64x128_MI16x16x1_SN_LDSB1_CLR1_GSU0_GSUC0_GSUWGMRR0_K1_LBSPPA256_LBSPPB512_LPA16_LPB32_MIWT1_2_PLR2_SU32_SUM0_SUS256_SKXCCM0_VWA1_VWB2_WGM1_WGMXCC1_WGMXCCGn1
    SolutionIndex: 41
    SolutionNameMin: Cijk_Ailk_Bjlk_BBS_BH_UserArgs_MT32x64x128_MI16x16x1_SN_LDSB1_CLR1_GSU0_GSUC0_GSUWGMRR0_K1_LBSPPA256_LBSPPB512_LPA16_LPB32_MIWT1_2_PLR2_SU32_SUM0_SUS256_SKXCCM0_VWA1_VWB2_WGM4_WGMXCC1_WGMXCCGn1
    SolutionIndex: 42
    SolutionNameMin: Cijk_Ailk_Bjlk_BBS_BH_UserArgs_MT64x32x128_MI16x16x1_SN_LDSB1_CLR1_GSU0_GSUC0_GSUWGMRR0_K1_LBSPPA512_LBSPPB256_LPA32_LPB16_MIWT2_1_PLR2_SU32_SUM0_SUS256_SKXCCM0_VWA2_VWB1_WGM1_WGMXCC1_WGMXCCGn1
    SolutionIndex: 43
    SolutionNameMin: Cijk_Ailk_Bjlk_BBS_BH_UserArgs_MT64x32x128_MI16x16x1_SN_LDSB1_CLR1_GSU0_GSUC0_GSUWGMRR0_K1_LBSPPA512_LBSPPB256_LPA32_LPB16_MIWT2_1_PLR2_SU32_SUM0_SUS256_SKXCCM0_VWA2_VWB1_WGM4_WGMXCC1_WGMXCCGn1
    SolutionIndex: 44
    SolutionNameMin: Cijk_Ailk_Bjlk_BBS_BH_UserArgs_MT64x32x128_MI16x16x1_SN_LDSB1_CLR1_GSU0_GSUC0_GSUWGMRR0_K1_LBSPPA512_LBSPPB256_LPA32_LPB16_MIWT2_1_PLR2_SU32_SUM0_SUS256_SKXCCM0_VWA2_VWB1_WGM8_WGMXCC1_WGMXCCGn1
    SolutionIndex: 45
    SolutionNameMin: Cijk_Ailk_Bjlk_BBS_BH_UserArgs_MT32x32x128_MI16x16x1_SN_LDSB1_CLR1_GSU0_GSUC0_GSUWGMRR0_K1_LBSPPA256_LBSPPB256_LPA16_LPB16_MIWT1_1_PLR1_SU32_SUM0_SUS256_SKXCCM0_VWA1_VWB1_WGM1_WGMXCC1_WGMXCCGn1
    SolutionIndex: 46
    SolutionNameMin: Cijk_Ailk_Bjlk_BBS_BH_UserArgs_MT32x32x128_MI16x16x1_SN_LDSB1_CLR1_GSU0_GSUC0_GSUWGMRR0_K1_LBSPPA256_LBSPPB256_LPA16_LPB16_MIWT1_1_PLR2_SU32_SUM0_SUS256_SKXCCM0_VWA1_VWB1_WGM1_WGMXCC1_WGMXCCGn1
    SolutionIndex: 47
    SolutionNameMin: Cijk_Ailk_Bjlk_BBS_BH_UserArgs_MT32x32x128_MI16x16x1_SN_LDSB1_CLR1_GSU0_GSUC0_GSUWGMRR0_K1_LBSPPA256_LBSPPB256_LPA16_LPB16_MIWT1_1_PLR2_SU32_SUM0_SUS256_SKXCCM0_VWA1_VWB1_WGM4_WGMXCC1_WGMXCCGn1
    SolutionIndex: 48
    SolutionNameMin: Cijk_Ailk_Bjlk_BBS_BH_UserArgs_MT256x256x32_MI16x16x1_SN_LDSB0_CLR1_GSU0_GSUC0_GSUWGMRR0_K1_LBSPPA2048_LBSPPB2048_LPA0_LPB0_MIWT8_8_PLR1_SU32_SUM0_SUS256_SKXCCM8_VWA4_VWB4_WGM1_WGMXCC1_WGMXCCGn1
    SolutionIndex: 49
    SolutionNameMin: Cijk_Ailk_Bjlk_BBS_BH_UserArgs_MT256x256x32_MI16x16x1_SN_LDSB0_CLR1_GSU0_GSUC0_GSUWGMRR0_K1_LBSPPA2048_LBSPPB2048_LPA0_LPB0_MIWT8_8_PLR1_SU32_SUM0_SUS256_SKXCCM8_VWA4_VWB8_WGM1_WGMXCC1_WGMXCCGn1
    SolutionIndex: 50
    SolutionNameMin: Cijk_Ailk_Bjlk_BBS_BH_UserArgs_MT256x256x32_MI16x16x1_SN_LDSB0_CLR1_GSU0_GSUC0_GSUWGMRR0_K1_LBSPPA2048_LBSPPB2048_LPA0_LPB0_MIWT8_8_PLR1_SU32_SUM0_SUS256_SKXCCM8_VWA8_VWB8_WGM1_WGMXCC1_WGMXCCGn1
    SolutionIndex: 51
    SolutionNameMin: Cijk_Ailk_Bjlk_BBS_BH_UserArgs_MT256x256x32_MI16x16x1_SN_LDSB1_CLR1_GSU0_GSUC0_GSUWGMRR0_K1_LBSPPA2048_LBSPPB2048_LPA0_LPB32_MIWT8_8_PLR1_SU32_SUM0_SUS256_SKXCCM8_VWA4_VWB2_WGM4_WGMXCC1_WGMXCCGn1
    SolutionIndex: 52
    SolutionNameMin: Cijk_Ailk_Bjlk_BBS_BH_UserArgs_MT256x256x32_MI16x16x1_SN_LDSB0_CLR1_GSU0_GSUC0_GSUWGMRR0_K1_LBSPPA2048_LBSPPB2048_LPA0_LPB0_MIWT8_8_PLR1_SU32_SUM0_SUS256_SKXCCM8_VWA4_VWB8_WGM4_WGMXCC1_WGMXCCGn1
    SolutionIndex: 53
    SolutionNameMin: Cijk_Ailk_Bjlk_BBS_BH_UserArgs_MT256x256x32_MI16x16x1_SN_LDSB0_CLR1_GSU0_GSUC0_GSUWGMRR0_K1_LBSPPA2048_LBSPPB2048_LPA0_LPB0_MIWT8_8_PLR1_SU32_SUM0_SUS256_SKXCCM8_VWA8_VWB8_WGM4_WGMXCC1_WGMXCCGn1
    SolutionIndex: 54
    SolutionNameMin: Cijk_Ailk_Bjlk_BBS_BH_UserArgs_MT256x256x32_MI16x16x1_SN_LDSB0_CLR1_GSU0_GSUC0_GSUWGMRR0_K1_LBSPPA2048_LBSPPB2048_LPA0_LPB0_MIWT8_8_PLR1_SU32_SUM0_SUS256_SKXCCM8_VWA4_VWB8_WGM8_WGMXCC1_WGMXCCGn1
    SolutionIndex: 55
    SolutionNameMin: Cijk_Ailk_Bjlk_BBS_BH_UserArgs_MT256x256x32_MI16x16x1_SN_LDSB0_CLR1_GSU0_GSUC0_GSUWGMRR0_K1_LBSPPA2048_LBSPPB2048_LPA0_LPB0_MIWT8_8_PLR1_SU32_SUM0_SUS256_SKXCCM8_VWA8_VWB8_WGM8_WGMXCC1_WGMXCCGn1
    SolutionIndex: 56
    SolutionNameMin: Cijk_Ailk_Bjlk_BBS_BH_UserArgs_MT128x256x32_MI16x16x1_SN_LDSB1_CLR1_GSU0_GSUC0_GSUWGMRR0_K1_LBSPPA1024_LBSPPB2048_LPA0_LPB0_MIWT4_8_PLR1_SU32_SUM0_SUS256_SKXCCM8_VWA4_VWB8_WGM1_WGMXCC1_WGMXCCGn1
    SolutionIndex: 57
    SolutionNameMin: Cijk_Ailk_Bjlk_BBS_BH_UserArgs_MT128x256x32_MI16x16x1_SN_LDSB1_CLR1_GSU0_GSUC0_GSUWGMRR0_K1_LBSPPA1024_LBSPPB2048_LPA0_LPB0_MIWT4_8_PLR1_SU32_SUM0_SUS256_SKXCCM8_VWA4_VWB8_WGM4_WGMXCC1_WGMXCCGn1
    SolutionIndex: 58
    SolutionNameMin: Cijk_Ailk_Bjlk_BBS_BH_UserArgs_MT128x256x32_MI16x16x1_SN_LDSB1_CLR1_GSU0_GSUC0_GSUWGMRR0_K1_LBSPPA1024_LBSPPB2048_LPA0_LPB0_MIWT4_8_PLR1_SU32_SUM0_SUS256_SKXCCM8_VWA4_VWB8_WGM8_WGMXCC1_WGMXCCGn1
    SolutionIndex: 59
    SolutionNameMin: Cijk_Ailk_Bjlk_BBS_BH_UserArgs_MT256x128x32_MI16x16x1_SN_LDSB1_CLR1_GSU0_GSUC0_GSUWGMRR0_K1_LBSPPA2048_LBSPPB1024_LPA0_LPB16_MIWT8_4_PLR1_SU32_SUM0_SUS256_SKXCCM8_VWA8_VWB1_WGM1_WGMXCC1_WGMXCCGn1
    SolutionIndex: 60
    SolutionNameMin: Cijk_Ailk_Bjlk_BBS_BH_UserArgs_MT256x128x32_MI16x16x1_SN_LDSB1_CLR1_GSU0_GSUC0_GSUWGMRR0_K1_LBSPPA2048_LBSPPB1024_LPA0_LPB32_MIWT8_4_PLR1_SU32_SUM0_SUS256_SKXCCM8_VWA8_VWB2_WGM1_WGMXCC1_WGMXCCGn1
    SolutionIndex: 61
    SolutionNameMin: Cijk_Ailk_Bjlk_BBS_BH_UserArgs_MT256x128x32_MI16x16x1_SN_LDSB1_CLR1_GSU0_GSUC0_GSUWGMRR0_K1_LBSPPA2048_LBSPPB1024_LPA0_LPB0_MIWT8_4_PLR1_SU32_SUM0_SUS256_SKXCCM8_VWA4_VWB4_WGM1_WGMXCC1_WGMXCCGn1
    SolutionIndex: 62
    SolutionNameMin: Cijk_Ailk_Bjlk_BBS_BH_UserArgs_MT256x128x32_MI16x16x1_SN_LDSB1_CLR1_GSU0_GSUC0_GSUWGMRR0_K1_LBSPPA2048_LBSPPB1024_LPA0_LPB0_MIWT8_4_PLR1_SU32_SUM0_SUS256_SKXCCM8_VWA8_VWB4_WGM1_WGMXCC1_WGMXCCGn1
    SolutionIndex: 63
    SolutionNameMin: Cijk_Ailk_Bjlk_BBS_BH_UserArgs_MT256x128x32_MI16x16x1_SN_LDSB1_CLR1_GSU0_GSUC0_GSUWGMRR0_K1_LBSPPA2048_LBSPPB1024_LPA0_LPB0_MIWT8_4_PLR1_SU32_SUM0_SUS256_SKXCCM8_VWA8_VWB4_WGM4_WGMXCC1_WGMXCCGn1
    SolutionIndex: 64
    SolutionNameMin: Cijk_Ailk_Bjlk_BBS_BH_UserArgs_MT256x128x32_MI16x16x1_SN_LDSB1_CLR1_GSU0_GSUC0_GSUWGMRR0_K1_LBSPPA2048_LBSPPB1024_LPA0_LPB32_MIWT8_4_PLR1_SU32_SUM0_SUS256_SKXCCM8_VWA4_VWB2_WGM8_WGMXCC1_WGMXCCGn1
    SolutionIndex: 65
    SolutionNameMin: Cijk_Ailk_Bjlk_BBS_BH_UserArgs_MT256x128x32_MI16x16x1_SN_LDSB1_CLR1_GSU0_GSUC0_GSUWGMRR0_K1_LBSPPA2048_LBSPPB1024_LPA0_LPB32_MIWT8_4_PLR1_SU32_SUM0_SUS256_SKXCCM8_VWA8_VWB2_WGM8_WGMXCC1_WGMXCCGn1
    SolutionIndex: 66
    SolutionNameMin: Cijk_Ailk_Bjlk_BBS_BH_UserArgs_MT256x128x32_MI16x16x1_SN_LDSB1_CLR1_GSU0_GSUC0_GSUWGMRR0_K1_LBSPPA2048_LBSPPB1024_LPA0_LPB0_MIWT8_4_PLR1_SU32_SUM0_SUS256_SKXCCM8_VWA4_VWB4_WGM8_WGMXCC1_WGMXCCGn1
    SolutionIndex: 67
    SolutionNameMin: Cijk_Ailk_Bjlk_BBS_BH_UserArgs_MT128x128x32_MI16x16x1_SN_LDSB0_CLR0_GSU0_GSUC0_GSUWGMRR0_K1_LBSPPA1024_LBSPPB1024_LPA0_LPB0_MIWT4_4_PLR0_SU32_SUM0_SUS256_SKXCCM8_VWA4_VWB4_WGM1_WGMXCC1_WGMXCCGn1
    SolutionIndex: 68
    SolutionNameMin: Cijk_Ailk_Bjlk_BBS_BH_UserArgs_MT128x128x32_MI16x16x1_SN_LDSB0_CLR0_GSU0_GSUC0_GSUWGMRR0_K1_LBSPPA1024_LBSPPB1024_LPA0_LPB0_MIWT4_4_PLR0_SU32_SUM0_SUS256_SKXCCM8_VWA4_VWB4_WGM4_WGMXCC1_WGMXCCGn1
    SolutionIndex: 69
    SolutionNameMin: Cijk_Ailk_Bjlk_BBS_BH_UserArgs_MT128x128x32_MI16x16x1_SN_LDSB0_CLR0_GSU0_GSUC0_GSUWGMRR0_K1_LBSPPA1024_LBSPPB1024_LPA0_LPB0_MIWT4_4_PLR0_SU32_SUM0_SUS256_SKXCCM8_VWA4_VWB4_WGM8_WGMXCC1_WGMXCCGn1
    SolutionIndex: 70
    SolutionNameMin: Cijk_Ailk_Bjlk_BBS_BH_UserArgs_MT128x64x32_MI16x16x1_SN_LDSB0_CLR1_GSU0_GSUC0_GSUWGMRR0_K1_LBSPPA1024_LBSPPB512_LPA0_LPB16_MIWT4_2_PLR1_SU32_SUM0_SUS256_SKXCCM8_VWA4_VWB1_WGM1_WGMXCC1_WGMXCCGn1
    SolutionIndex: 71
    SolutionNameMin: Cijk_Ailk_Bjlk_BBS_BH_UserArgs_MT128x64x32_MI16x16x1_SN_LDSB0_CLR1_GSU0_GSUC0_GSUWGMRR0_K1_LBSPPA1024_LBSPPB512_LPA32_LPB32_MIWT4_2_PLR1_SU32_SUM0_SUS256_SKXCCM8_VWA2_VWB2_WGM1_WGMXCC1_WGMXCCGn1
    SolutionIndex: 72
    SolutionNameMin: Cijk_Ailk_Bjlk_BBS_BH_UserArgs_MT128x64x32_MI16x16x1_SN_LDSB0_CLR1_GSU0_GSUC0_GSUWGMRR0_K1_LBSPPA1024_LBSPPB512_LPA0_LPB32_MIWT4_2_PLR1_SU32_SUM0_SUS256_SKXCCM8_VWA4_VWB2_WGM1_WGMXCC1_WGMXCCGn1
    SolutionIndex: 73
    SolutionNameMin: Cijk_Ailk_Bjlk_BBS_BH_UserArgs_MT128x64x32_MI16x16x1_SN_LDSB0_CLR1_GSU0_GSUC0_GSUWGMRR0_K1_LBSPPA1024_LBSPPB512_LPA0_LPB32_MIWT4_2_PLR1_SU32_SUM0_SUS256_SKXCCM8_VWA4_VWB2_WGM8_WGMXCC1_WGMXCCGn1
    SolutionIndex: 74
    SolutionNameMin: Cijk_Ailk_Bjlk_BBS_BH_UserArgs_MT32x32x32_MI16x16x1_SN_LDSB0_CLR1_GSU0_GSUC0_GSUWGMRR0_K1_LBSPPA256_LBSPPB256_LPA16_LPB16_MIWT1_1_PLR1_SU32_SUM0_SUS256_SKXCCM8_VWA1_VWB1_WGM1_WGMXCC1_WGMXCCGn1
    SolutionIndex: 75
    SolutionNameMin: Cijk_Ailk_Bjlk_BBS_BH_UserArgs_MT32x32x32_MI16x16x1_SN_LDSB0_CLR0_GSU0_GSUC0_GSUWGMRR0_K1_LBSPPA256_LBSPPB256_LPA16_LPB16_MIWT1_1_PLR0_SU32_SUM0_SUS256_SKXCCM8_VWA1_VWB1_WGM1_WGMXCC1_WGMXCCGn1
    SolutionIndex: 76
    SolutionNameMin: Cijk_Ailk_Bjlk_BBS_BH_UserArgs_MT256x256x64_MI16x16x1_SN_LDSB1_CLR1_GSU0_GSUC0_GSUWGMRR0_K1_LBSPPA2048_LBSPPB2048_LPA0_LPB0_MIWT8_8_PLR1_SU32_SUM0_SUS256_SKXCCM8_VWA4_VWB4_WGM1_WGMXCC1_WGMXCCGn1
    SolutionIndex: 77
    SolutionNameMin: Cijk_Ailk_Bjlk_BBS_BH_UserArgs_MT256x256x64_MI16x16x1_SN_LDSB1_CLR1_GSU0_GSUC0_GSUWGMRR0_K1_LBSPPA2048_LBSPPB2048_LPA0_LPB0_MIWT8_8_PLR2_SU32_SUM0_SUS256_SKXCCM8_VWA4_VWB4_WGM1_WGMXCC1_WGMXCCGn1
    SolutionIndex: 78
    SolutionNameMin: Cijk_Ailk_Bjlk_BBS_BH_UserArgs_MT256x256x64_MI16x16x1_SN_LDSB1_CLR1_GSU0_GSUC0_GSUWGMRR0_K1_LBSPPA2048_LBSPPB2048_LPA0_LPB0_MIWT8_8_PLR2_SU32_SUM0_SUS256_SKXCCM8_VWA4_VWB8_WGM1_WGMXCC1_WGMXCCGn1
    SolutionIndex: 79
    SolutionNameMin: Cijk_Ailk_Bjlk_BBS_BH_UserArgs_MT256x256x64_MI16x16x1_SN_LDSB1_CLR1_GSU0_GSUC0_GSUWGMRR0_K1_LBSPPA2048_LBSPPB2048_LPA0_LPB0_MIWT8_8_PLR1_SU32_SUM0_SUS256_SKXCCM8_VWA4_VWB4_WGM4_WGMXCC1_WGMXCCGn1
    SolutionIndex: 80
    SolutionNameMin: Cijk_Ailk_Bjlk_BBS_BH_UserArgs_MT256x256x64_MI16x16x1_SN_LDSB1_CLR1_GSU0_GSUC0_GSUWGMRR0_K1_LBSPPA2048_LBSPPB2048_LPA0_LPB0_MIWT8_8_PLR2_SU32_SUM0_SUS256_SKXCCM8_VWA4_VWB4_WGM4_WGMXCC1_WGMXCCGn1
    SolutionIndex: 81
    SolutionNameMin: Cijk_Ailk_Bjlk_BBS_BH_UserArgs_MT256x256x64_MI16x16x1_SN_LDSB1_CLR1_GSU0_GSUC0_GSUWGMRR0_K1_LBSPPA2048_LBSPPB2048_LPA0_LPB0_MIWT8_8_PLR2_SU32_SUM0_SUS256_SKXCCM8_VWA4_VWB8_WGM4_WGMXCC1_WGMXCCGn1
    SolutionIndex: 82
    SolutionNameMin: Cijk_Ailk_Bjlk_BBS_BH_UserArgs_MT256x256x64_MI16x16x1_SN_LDSB1_CLR1_GSU0_GSUC0_GSUWGMRR0_K1_LBSPPA2048_LBSPPB2048_LPA0_LPB0_MIWT8_8_PLR1_SU32_SUM0_SUS256_SKXCCM8_VWA4_VWB4_WGM8_WGMXCC1_WGMXCCGn1
    SolutionIndex: 83
    SolutionNameMin: Cijk_Ailk_Bjlk_BBS_BH_UserArgs_MT256x256x64_MI16x16x1_SN_LDSB1_CLR1_GSU0_GSUC0_GSUWGMRR0_K1_LBSPPA2048_LBSPPB2048_LPA0_LPB0_MIWT8_8_PLR1_SU32_SUM0_SUS256_SKXCCM8_VWA4_VWB8_WGM8_WGMXCC1_WGMXCCGn1
    SolutionIndex: 84
    SolutionNameMin: Cijk_Ailk_Bjlk_BBS_BH_UserArgs_MT128x256x64_MI16x16x1_SN_LDSB1_CLR1_GSU0_GSUC0_GSUWGMRR0_K1_LBSPPA1024_LBSPPB2048_LPA0_LPB0_MIWT4_8_PLR2_SU32_SUM0_SUS256_SKXCCM8_VWA4_VWB4_WGM1_WGMXCC1_WGMXCCGn1
    SolutionIndex: 85
    SolutionNameMin: Cijk_Ailk_Bjlk_BBS_BH_UserArgs_MT128x256x64_MI16x16x1_SN_LDSB1_CLR1_GSU0_GSUC0_GSUWGMRR0_K1_LBSPPA1024_LBSPPB2048_LPA0_LPB0_MIWT4_8_PLR2_SU32_SUM0_SUS256_SKXCCM8_VWA4_VWB8_WGM1_WGMXCC1_WGMXCCGn1
    SolutionIndex: 86
    SolutionNameMin: Cijk_Ailk_Bjlk_BBS_BH_UserArgs_MT128x256x64_MI16x16x1_SN_LDSB1_CLR1_GSU0_GSUC0_GSUWGMRR0_K1_LBSPPA1024_LBSPPB2048_LPA0_LPB0_MIWT4_8_PLR2_SU32_SUM0_SUS256_SKXCCM8_VWA4_VWB4_WGM4_WGMXCC1_WGMXCCGn1
    SolutionIndex: 87
    SolutionNameMin: Cijk_Ailk_Bjlk_BBS_BH_UserArgs_MT128x256x64_MI16x16x1_SN_LDSB1_CLR1_GSU0_GSUC0_GSUWGMRR0_K1_LBSPPA1024_LBSPPB2048_LPA0_LPB0_MIWT4_8_PLR2_SU32_SUM0_SUS256_SKXCCM8_VWA4_VWB8_WGM8_WGMXCC1_WGMXCCGn1
    SolutionIndex: 88
    SolutionNameMin: Cijk_Ailk_Bjlk_BBS_BH_UserArgs_MT256x128x64_MI16x16x1_SN_LDSB1_CLR1_GSU0_GSUC0_GSUWGMRR0_K1_LBSPPA2048_LBSPPB1024_LPA0_LPB32_MIWT8_4_PLR2_SU32_SUM0_SUS256_SKXCCM8_VWA4_VWB2_WGM1_WGMXCC1_WGMXCCGn1
    SolutionIndex: 89
    SolutionNameMin: Cijk_Ailk_Bjlk_BBS_BH_UserArgs_MT256x128x64_MI16x16x1_SN_LDSB1_CLR1_GSU0_GSUC0_GSUWGMRR0_K1_LBSPPA2048_LBSPPB1024_LPA0_LPB0_MIWT8_4_PLR1_SU32_SUM0_SUS256_SKXCCM8_VWA4_VWB4_WGM8_WGMXCC1_WGMXCCGn1
    SolutionIndex: 90
    SolutionNameMin: Cijk_Ailk_Bjlk_BBS_BH_UserArgs_MT256x128x64_MI16x16x1_SN_LDSB1_CLR1_GSU0_GSUC0_GSUWGMRR0_K1_LBSPPA2048_LBSPPB1024_LPA0_LPB0_MIWT8_4_PLR2_SU32_SUM0_SUS256_SKXCCM8_VWA4_VWB4_WGM8_WGMXCC1_WGMXCCGn1
    SolutionIndex: 91
    SolutionNameMin: Cijk_Ailk_Bjlk_BBS_BH_UserArgs_MT128x128x64_MI16x16x1_SN_LDSB1_CLR1_GSU0_GSUC0_GSUWGMRR0_K1_LBSPPA1024_LBSPPB1024_LPA0_LPB0_MIWT4_4_PLR1_SU32_SUM0_SUS256_SKXCCM8_VWA4_VWB4_WGM1_WGMXCC1_WGMXCCGn1
    SolutionIndex: 92
    SolutionNameMin: Cijk_Ailk_Bjlk_BBS_BH_UserArgs_MT128x128x64_MI16x16x1_SN_LDSB1_CLR1_GSU0_GSUC0_GSUWGMRR0_K1_LBSPPA1024_LBSPPB1024_LPA0_LPB0_MIWT4_4_PLR1_SU32_SUM0_SUS256_SKXCCM8_VWA4_VWB4_WGM4_WGMXCC1_WGMXCCGn1
    SolutionIndex: 93
    SolutionNameMin: Cijk_Ailk_Bjlk_BBS_BH_UserArgs_MT128x128x64_MI16x16x1_SN_LDSB1_CLR1_GSU0_GSUC0_GSUWGMRR0_K1_LBSPPA1024_LBSPPB1024_LPA32_LPB0_MIWT4_4_PLR1_SU32_SUM0_SUS256_SKXCCM8_VWA2_VWB4_WGM8_WGMXCC1_WGMXCCGn1
    SolutionIndex: 94
    SolutionNameMin: Cijk_Ailk_Bjlk_BBS_BH_UserArgs_MT128x128x64_MI16x16x1_SN_LDSB1_CLR1_GSU0_GSUC0_GSUWGMRR0_K1_LBSPPA1024_LBSPPB1024_LPA0_LPB0_MIWT4_4_PLR1_SU32_SUM0_SUS256_SKXCCM8_VWA4_VWB4_WGM8_WGMXCC1_WGMXCCGn1
    SolutionIndex: 95
    SolutionNameMin: Cijk_Ailk_Bjlk_BBS_BH_UserArgs_MT64x128x64_MI16x16x1_SN_LDSB1_CLR1_GSU0_GSUC0_GSUWGMRR0_K1_LBSPPA512_LBSPPB1024_LPA32_LPB32_MIWT2_4_PLR2_SU32_SUM0_SUS256_SKXCCM8_VWA2_VWB2_WGM1_WGMXCC1_WGMXCCGn1
    SolutionIndex: 96
    SolutionNameMin: Cijk_Ailk_Bjlk_BBS_BH_UserArgs_MT64x128x64_MI16x16x1_SN_LDSB1_CLR1_GSU0_GSUC0_GSUWGMRR0_K1_LBSPPA512_LBSPPB1024_LPA32_LPB0_MIWT2_4_PLR2_SU32_SUM0_SUS256_SKXCCM8_VWA2_VWB4_WGM4_WGMXCC1_WGMXCCGn1
    SolutionIndex: 97
    SolutionNameMin: Cijk_Ailk_Bjlk_BBS_BH_UserArgs_MT128x64x64_MI16x16x1_SN_LDSB1_CLR1_GSU0_GSUC0_GSUWGMRR0_K1_LBSPPA1024_LBSPPB512_LPA0_LPB32_MIWT4_2_PLR1_SU32_SUM0_SUS256_SKXCCM8_VWA4_VWB2_WGM1_WGMXCC1_WGMXCCGn1
    SolutionIndex: 98
    SolutionNameMin: Cijk_Ailk_Bjlk_BBS_BH_UserArgs_MT128x64x64_MI16x16x1_SN_LDSB1_CLR1_GSU0_GSUC0_GSUWGMRR0_K1_LBSPPA1024_LBSPPB512_LPA0_LPB32_MIWT4_2_PLR2_SU32_SUM0_SUS256_SKXCCM8_VWA4_VWB2_WGM1_WGMXCC1_WGMXCCGn1
    SolutionIndex: 99
    SolutionNameMin: Cijk_Ailk_Bjlk_BBS_BH_UserArgs_MT128x64x64_MI16x16x1_SN_LDSB1_CLR1_GSU0_GSUC0_GSUWGMRR0_K1_LBSPPA1024_LBSPPB512_LPA0_LPB32_MIWT4_2_PLR1_SU32_SUM0_SUS256_SKXCCM8_VWA4_VWB2_WGM4_WGMXCC1_WGMXCCGn1
    SolutionIndex: 100
    SolutionNameMin: Cijk_Ailk_Bjlk_BBS_BH_UserArgs_MT128x64x64_MI16x16x1_SN_LDSB1_CLR1_GSU0_GSUC0_GSUWGMRR0_K1_LBSPPA1024_LBSPPB512_LPA0_LPB32_MIWT4_2_PLR2_SU32_SUM0_SUS256_SKXCCM8_VWA4_VWB2_WGM4_WGMXCC1_WGMXCCGn1
    SolutionIndex: 101
    SolutionNameMin: Cijk_Ailk_Bjlk_BBS_BH_UserArgs_MT128x64x64_MI16x16x1_SN_LDSB1_CLR1_GSU0_GSUC0_GSUWGMRR0_K1_LBSPPA1024_LBSPPB512_LPA0_LPB32_MIWT4_2_PLR2_SU32_SUM0_SUS256_SKXCCM8_VWA4_VWB2_WGM8_WGMXCC1_WGMXCCGn1
    SolutionIndex: 102
    SolutionNameMin: Cijk_Ailk_Bjlk_BBS_BH_UserArgs_MT64x64x64_MI16x16x1_SN_LDSB1_CLR1_GSU0_GSUC0_GSUWGMRR0_K1_LBSPPA512_LBSPPB512_LPA32_LPB32_MIWT2_2_PLR1_SU32_SUM0_SUS256_SKXCCM8_VWA2_VWB2_WGM1_WGMXCC1_WGMXCCGn1
    SolutionIndex: 103
    SolutionNameMin: Cijk_Ailk_Bjlk_BBS_BH_UserArgs_MT64x64x64_MI16x16x1_SN_LDSB1_CLR1_GSU0_GSUC0_GSUWGMRR0_K1_LBSPPA512_LBSPPB512_LPA32_LPB32_MIWT2_2_PLR2_SU32_SUM0_SUS256_SKXCCM8_VWA2_VWB2_WGM1_WGMXCC1_WGMXCCGn1
    SolutionIndex: 104
    SolutionNameMin: Cijk_Ailk_Bjlk_BBS_BH_UserArgs_MT64x64x64_MI16x16x1_SN_LDSB1_CLR1_GSU0_GSUC0_GSUWGMRR0_K1_LBSPPA512_LBSPPB512_LPA32_LPB32_MIWT2_2_PLR2_SU32_SUM0_SUS256_SKXCCM8_VWA2_VWB2_WGM8_WGMXCC1_WGMXCCGn1
    SolutionIndex: 105
    SolutionNameMin: Cijk_Ailk_Bjlk_BBS_BH_UserArgs_MT32x64x64_MI16x16x1_SN_LDSB0_CLR1_GSU0_GSUC0_GSUWGMRR0_K1_LBSPPA256_LBSPPB512_LPA16_LPB32_MIWT1_2_PLR2_SU32_SUM0_SUS256_SKXCCM8_VWA1_VWB2_WGM1_WGMXCC1_WGMXCCGn1
    SolutionIndex: 106
    SolutionNameMin: Cijk_Ailk_Bjlk_BBS_BH_UserArgs_MT32x64x64_MI16x16x1_SN_LDSB0_CLR1_GSU0_GSUC0_GSUWGMRR0_K1_LBSPPA256_LBSPPB512_LPA16_LPB32_MIWT1_2_PLR2_SU32_SUM0_SUS256_SKXCCM8_VWA1_VWB2_WGM4_WGMXCC1_WGMXCCGn1
    SolutionIndex: 107
    SolutionNameMin: Cijk_Ailk_Bjlk_BBS_BH_UserArgs_MT64x32x64_MI16x16x1_SN_LDSB0_CLR1_GSU0_GSUC0_GSUWGMRR0_K1_LBSPPA512_LBSPPB256_LPA32_LPB16_MIWT2_1_PLR2_SU32_SUM0_SUS256_SKXCCM8_VWA2_VWB1_WGM1_WGMXCC1_WGMXCCGn1
    SolutionIndex: 108
    SolutionNameMin: Cijk_Ailk_Bjlk_BBS_BH_UserArgs_MT32x32x64_MI16x16x1_SN_LDSB0_CLR1_GSU0_GSUC0_GSUWGMRR0_K1_LBSPPA256_LBSPPB256_LPA16_LPB16_MIWT1_1_PLR1_SU32_SUM0_SUS256_SKXCCM8_VWA1_VWB1_WGM1_WGMXCC1_WGMXCCGn1
    SolutionIndex: 109
    SolutionNameMin: Cijk_Ailk_Bjlk_BBS_BH_UserArgs_MT32x32x64_MI16x16x1_SN_LDSB0_CLR1_GSU0_GSUC0_GSUWGMRR0_K1_LBSPPA256_LBSPPB256_LPA16_LPB16_MIWT1_1_PLR2_SU32_SUM0_SUS256_SKXCCM8_VWA1_VWB1_WGM1_WGMXCC1_WGMXCCGn1
    SolutionIndex: 110
    SolutionNameMin: Cijk_Ailk_Bjlk_BBS_BH_UserArgs_MT32x32x64_MI16x16x1_SN_LDSB0_CLR1_GSU0_GSUC0_GSUWGMRR0_K1_LBSPPA256_LBSPPB256_LPA16_LPB16_MIWT1_1_PLR1_SU32_SUM0_SUS256_SKXCCM8_VWA1_VWB1_WGM8_WGMXCC1_WGMXCCGn1
    SolutionIndex: 111
    SolutionNameMin: Cijk_Ailk_Bjlk_BBS_BH_UserArgs_MT128x128x128_MI16x16x1_SN_LDSB1_CLR1_GSU0_GSUC0_GSUWGMRR0_K1_LBSPPA1024_LBSPPB1024_LPA0_LPB0_MIWT4_4_PLR1_SU32_SUM0_SUS256_SKXCCM8_VWA4_VWB4_WGM1_WGMXCC1_WGMXCCGn1
    SolutionIndex: 112
    SolutionNameMin: Cijk_Ailk_Bjlk_BBS_BH_UserArgs_MT128x128x128_MI16x16x1_SN_LDSB1_CLR1_GSU0_GSUC0_GSUWGMRR0_K1_LBSPPA1024_LBSPPB1024_LPA0_LPB0_MIWT4_4_PLR2_SU32_SUM0_SUS256_SKXCCM8_VWA4_VWB4_WGM1_WGMXCC1_WGMXCCGn1
    SolutionIndex: 113
    SolutionNameMin: Cijk_Ailk_Bjlk_BBS_BH_UserArgs_MT128x128x128_MI16x16x1_SN_LDSB1_CLR1_GSU0_GSUC0_GSUWGMRR0_K1_LBSPPA1024_LBSPPB1024_LPA0_LPB0_MIWT4_4_PLR1_SU32_SUM0_SUS256_SKXCCM8_VWA4_VWB4_WGM4_WGMXCC1_WGMXCCGn1
    SolutionIndex: 114
    SolutionNameMin: Cijk_Ailk_Bjlk_BBS_BH_UserArgs_MT128x128x128_MI16x16x1_SN_LDSB1_CLR1_GSU0_GSUC0_GSUWGMRR0_K1_LBSPPA1024_LBSPPB1024_LPA0_LPB0_MIWT4_4_PLR2_SU32_SUM0_SUS256_SKXCCM8_VWA4_VWB4_WGM4_WGMXCC1_WGMXCCGn1
    SolutionIndex: 115
    SolutionNameMin: Cijk_Ailk_Bjlk_BBS_BH_UserArgs_MT128x128x128_MI16x16x1_SN_LDSB1_CLR1_GSU0_GSUC0_GSUWGMRR0_K1_LBSPPA1024_LBSPPB1024_LPA0_LPB0_MIWT4_4_PLR1_SU32_SUM0_SUS256_SKXCCM8_VWA4_VWB4_WGM8_WGMXCC1_WGMXCCGn1
    SolutionIndex: 116
    SolutionNameMin: Cijk_Ailk_Bjlk_BBS_BH_UserArgs_MT128x128x128_MI16x16x1_SN_LDSB1_CLR1_GSU0_GSUC0_GSUWGMRR0_K1_LBSPPA1024_LBSPPB1024_LPA0_LPB0_MIWT4_4_PLR2_SU32_SUM0_SUS256_SKXCCM8_VWA4_VWB4_WGM8_WGMXCC1_WGMXCCGn1
    SolutionIndex: 117
    SolutionNameMin: Cijk_Ailk_Bjlk_BBS_BH_UserArgs_MT128x64x128_MI16x16x1_SN_LDSB1_CLR1_GSU0_GSUC0_GSUWGMRR0_K1_LBSPPA1024_LBSPPB512_LPA0_LPB32_MIWT4_2_PLR2_SU32_SUM0_SUS256_SKXCCM8_VWA4_VWB2_WGM1_WGMXCC1_WGMXCCGn1
    SolutionIndex: 118
    SolutionNameMin: Cijk_Ailk_Bjlk_BBS_BH_UserArgs_MT128x64x128_MI16x16x1_SN_LDSB1_CLR1_GSU0_GSUC0_GSUWGMRR0_K1_LBSPPA1024_LBSPPB512_LPA0_LPB32_MIWT4_2_PLR2_SU32_SUM0_SUS256_SKXCCM8_VWA4_VWB2_WGM4_WGMXCC1_WGMXCCGn1
    SolutionIndex: 119
    SolutionNameMin: Cijk_Ailk_Bjlk_BBS_BH_UserArgs_MT128x64x128_MI16x16x1_SN_LDSB1_CLR1_GSU0_GSUC0_GSUWGMRR0_K1_LBSPPA1024_LBSPPB512_LPA0_LPB32_MIWT4_2_PLR2_SU32_SUM0_SUS256_SKXCCM8_VWA4_VWB2_WGM8_WGMXCC1_WGMXCCGn1
    SolutionIndex: 120
    SolutionNameMin: Cijk_Ailk_Bjlk_BBS_BH_UserArgs_MT64x64x128_MI16x16x1_SN_LDSB1_CLR1_GSU0_GSUC0_GSUWGMRR0_K1_LBSPPA512_LBSPPB512_LPA32_LPB32_MIWT2_2_PLR2_SU32_SUM0_SUS256_SKXCCM8_VWA2_VWB2_WGM1_WGMXCC1_WGMXCCGn1
    SolutionIndex: 121
    SolutionNameMin: Cijk_Ailk_Bjlk_BBS_BH_UserArgs_MT64x64x128_MI16x16x1_SN_LDSB1_CLR1_GSU0_GSUC0_GSUWGMRR0_K1_LBSPPA512_LBSPPB512_LPA32_LPB32_MIWT2_2_PLR2_SU32_SUM0_SUS256_SKXCCM8_VWA2_VWB2_WGM4_WGMXCC1_WGMXCCGn1
    SolutionIndex: 122
    SolutionNameMin: Cijk_Ailk_Bjlk_BBS_BH_UserArgs_MT64x64x128_MI16x16x1_SN_LDSB1_CLR1_GSU0_GSUC0_GSUWGMRR0_K1_LBSPPA512_LBSPPB512_LPA32_LPB32_MIWT2_2_PLR2_SU32_SUM0_SUS256_SKXCCM8_VWA2_VWB2_WGM8_WGMXCC1_WGMXCCGn1
    SolutionIndex: 123
    SolutionNameMin: Cijk_Ailk_Bjlk_BBS_BH_UserArgs_MT32x64x128_MI16x16x1_SN_LDSB1_CLR1_GSU0_GSUC0_GSUWGMRR0_K1_LBSPPA256_LBSPPB512_LPA16_LPB32_MIWT1_2_PLR2_SU32_SUM0_SUS256_SKXCCM8_VWA1_VWB2_WGM1_WGMXCC1_WGMXCCGn1
    SolutionIndex: 124
    SolutionNameMin: Cijk_Ailk_Bjlk_BBS_BH_UserArgs_MT64x32x128_MI16x16x1_SN_LDSB1_CLR1_GSU0_GSUC0_GSUWGMRR0_K1_LBSPPA512_LBSPPB256_LPA32_LPB16_MIWT2_1_PLR2_SU32_SUM0_SUS256_SKXCCM8_VWA2_VWB1_WGM1_WGMXCC1_WGMXCCGn1
    SolutionIndex: 125
    SolutionNameMin: Cijk_Ailk_Bjlk_BBS_BH_UserArgs_MT64x32x128_MI16x16x1_SN_LDSB1_CLR1_GSU0_GSUC0_GSUWGMRR0_K1_LBSPPA512_LBSPPB256_LPA32_LPB16_MIWT2_1_PLR2_SU32_SUM0_SUS256_SKXCCM8_VWA2_VWB1_WGM8_WGMXCC1_WGMXCCGn1
    SolutionIndex: 126
    SolutionNameMin: Cijk_Ailk_Bjlk_BBS_BH_UserArgs_MT32x32x128_MI16x16x1_SN_LDSB1_CLR1_GSU0_GSUC0_GSUWGMRR0_K1_LBSPPA256_LBSPPB256_LPA16_LPB16_MIWT1_1_PLR1_SU32_SUM0_SUS256_SKXCCM8_VWA1_VWB1_WGM1_WGMXCC1_WGMXCCGn1
    SolutionIndex: 127
    SolutionNameMin: Cijk_Ailk_Bjlk_BBS_BH_UserArgs_MT32x32x128_MI16x16x1_SN_LDSB1_CLR1_GSU0_GSUC0_GSUWGMRR0_K1_LBSPPA256_LBSPPB256_LPA16_LPB16_MIWT1_1_PLR2_SU32_SUM0_SUS256_SKXCCM8_VWA1_VWB1_WGM1_WGMXCC1_WGMXCCGn1
    SolutionIndex: 128
    SolutionNameMin: Cijk_Ailk_Bjlk_BBS_BH_UserArgs_MT32x32x32_MI16x16x1_SN_LDSB0_CLR0_GSU0_GSUC0_GSUWGMRR0_K1_LBSPPA256_LBSPPB256_LPA16_LPB16_MIWT1_1_PLR0_SU32_SUM0_SUS256_SKXCCM8_VWA1_VWB1_WGM1_WGMXCC1_WGMXCCGn1
- - - [128, 128, 1, 128, 128, 128, 128, 128]
    - [26, 0.078]
  - - [128, 128, 1, 256, 128, 128, 128, 128]
    - [108, 0.137]
  - - [128, 128, 1, 512, 128, 128, 128, 128]
    - [27, 0.225]
  - - [128, 128, 1, 1024, 128, 128, 128, 128]
    - [46, 0.33]
  - - [128, 128, 1, 2048, 128, 128, 128, 128]
    - [74, 0.553]
  - - [128, 128, 1, 4096, 128, 128, 128, 128]
    - [26, 0.916]
  - - [128, 128, 1, 8192, 128, 128, 128, 128]
    - [74, 1.415]
  - - [128, 256, 1, 128, 128, 128, 128, 256]
    - [26, 0.159]
  - - [128, 256, 1, 256, 128, 128, 128, 256]
    - [26, 0.282]
  - - [128, 256, 1, 512, 128, 128, 128, 256]
    - [26, 0.46]
  - - [128, 256, 1, 1024, 128, 128, 128, 256]
    - [45, 0.663]
  - - [128, 256, 1, 2048, 128, 128, 128, 256]
    - [74, 1.074]
  - - [128, 256, 1, 4096, 128, 128, 128, 256]
    - [108, 1.811]
  - - [128, 256, 1, 8192, 128, 128, 128, 256]
    - [127, 2.631]
  - - [128, 512, 1, 128, 128, 128, 128, 512]
    - [75, 0.313]
  - - [128, 512, 1, 256, 128, 128, 128, 512]
    - [26, 0.535]
  - - [128, 512, 1, 512, 128, 128, 128, 512]
    - [26, 0.9]
  - - [128, 512, 1, 1024, 128, 128, 128, 512]
    - [46, 1.315]
  - - [128, 512, 1, 2048, 128, 128, 128, 512]
    - [75, 2.031]
  - - [128, 512, 1, 4096, 128, 128, 128, 512]
    - [108, 3.477]
  - - [128, 512, 1, 8192, 128, 128, 128, 512]
    - [127, 4.945]
  - - [128, 1024, 1, 128, 128, 128, 128, 1024]
    - [75, 0.604]
  - - [128, 1024, 1, 256, 128, 128, 128, 1024]
    - [26, 1.086]
  - - [128, 1024, 1, 512, 128, 128, 128, 1024]
    - [26, 1.776]
  - - [128, 1024, 1, 1024, 128, 128, 128, 1024]
    - [126, 2.56]
  - - [128, 1024, 1, 2048, 128, 128, 128, 1024]
    - [45, 3.761]
  - - [128, 1024, 1, 4096, 128, 128, 128, 1024]
    - [105, 5.877]
  - - [128, 1024, 1, 8192, 128, 128, 128, 1024]
    - [41, 8.24]
  - - [128, 2048, 1, 128, 128, 128, 128, 2048]
    - [12, 1.218]
  - - [128, 2048, 1, 256, 128, 128, 128, 2048]
    - [27, 2.143]
  - - [128, 2048, 1, 512, 128, 128, 128, 2048]
    - [26, 3.471]
  - - [128, 2048, 1, 1024, 128, 128, 128, 2048]
    - [47, 4.925]
  - - [128, 2048, 1, 2048, 128, 128, 128, 2048]
    - [41, 6.61]
  - - [128, 2048, 1, 4096, 128, 128, 128, 2048]
    - [21, 9.641]
  - - [128, 2048, 1, 8192, 128, 128, 128, 2048]
    - [38, 12.665]
  - - [128, 4096, 1, 128, 128, 128, 128, 4096]
    - [107, 2.256]
  - - [128, 4096, 1, 256, 128, 128, 128, 4096]
    - [107, 3.926]
  - - [128, 4096, 1, 512, 128, 128, 128, 4096]
    - [42, 6.351]
  - - [128, 4096, 1, 1024, 128, 128, 128, 4096]
    - [125, 8.902]
  - - [128, 4096, 1, 2048, 128, 128, 128, 4096]
    - [120, 10.34]
  - - [128, 4096, 1, 4096, 128, 128, 128, 4096]
    - [98, 13.392]
  - - [128, 4096, 1, 8192, 128, 128, 128, 4096]
    - [34, 16.623]
  - - [128, 8192, 1, 128, 128, 128, 128, 8192]
    - [21, 4.011]
  - - [128, 8192, 1, 256, 128, 128, 128, 8192]
    - [21, 6.988]
  - - [128, 8192, 1, 512, 128, 128, 128, 8192]
    - [102, 10.734]
  - - [128, 8192, 1, 1024, 128, 128, 128, 8192]
    - [120, 13.761]
  - - [128, 8192, 1, 2048, 128, 128, 128, 8192]
    - [120, 14.9]
  - - [128, 8192, 1, 4096, 128, 128, 128, 8192]
    - [36, 17.686]
  - - [128, 8192, 1, 8192, 128, 128, 128, 8192]
    - [28, 21.231]
  - - [256, 128, 1, 128, 256, 256, 256, 128]
    - [74, 0.159]
  - - [256, 128, 1, 256, 256, 256, 256, 128]
    - [27, 0.277]
  - - [256, 128, 1, 512, 256, 256, 256, 128]
    - [26, 0.454]
  - - [256, 128, 1, 1024, 256, 256, 256, 128]
    - [45, 0.658]
  - - [256, 128, 1, 2048, 256, 256, 256, 128]
    - [75, 1.068]
  - - [256, 128, 1, 4096, 256, 256, 256, 128]
    - [27, 1.775]
  - - [256, 128, 1, 8192, 256, 256, 256, 128]
    - [46, 2.608]
  - - [256, 256, 1, 128, 256, 256, 256, 256]
    - [74, 0.311]
  - - [256, 256, 1, 256, 256, 256, 256, 256]
    - [27, 0.552]
  - - [256, 256, 1, 512, 256, 256, 256, 256]
    - [26, 0.899]
  - - [256, 256, 1, 1024, 256, 256, 256, 256]
    - [45, 1.297]
  - - [256, 256, 1, 2048, 256, 256, 256, 256]
    - [74, 2.068]
  - - [256, 256, 1, 4096, 256, 256, 256, 256]
    - [108, 3.48]
  - - [256, 256, 1, 8192, 256, 256, 256, 256]
    - [46, 4.872]
  - - [256, 512, 1, 128, 256, 256, 256, 512]
    - [11, 0.612]
  - - [256, 512, 1, 256, 256, 256, 256, 512]
    - [26, 1.076]
  - - [256, 512, 1, 512, 256, 256, 256, 512]
    - [109, 1.749]
  - - [256, 512, 1, 1024, 256, 256, 256, 512]
    - [127, 2.558]
  - - [256, 512, 1, 2048, 256, 256, 256, 512]
    - [45, 3.764]
  - - [256, 512, 1, 4096, 256, 256, 256, 512]
    - [106, 5.919]
  - - [256, 512, 1, 8192, 256, 256, 256, 512]
    - [43, 8.739]
  - - [256, 1024, 1, 128, 256, 256, 256, 1024]
    - [11, 1.194]
  - - [256, 1024, 1, 256, 256, 256, 256, 1024]
    - [27, 2.078]
  - - [256, 1024, 1, 512, 256, 256, 256, 1024]
    - [46, 3.355]
  - - [256, 1024, 1, 1024, 256, 256, 256, 1024]
    - [26, 4.91]
  - - [256, 1024, 1, 2048, 256, 256, 256, 1024]
    - [40, 6.773]
  - - [256, 1024, 1, 4096, 256, 256, 256, 1024]
    - [20, 9.208]
  - - [256, 1024, 1, 8192, 256, 256, 256, 1024]
    - [39, 13.449]
  - - [256, 2048, 1, 128, 256, 256, 256, 2048]
    - [10, 2.183]
  - - [256, 2048, 1, 256, 256, 256, 256, 2048]
    - [107, 3.825]
  - - [256, 2048, 1, 512, 256, 256, 256, 2048]
    - [42, 6.261]
  - - [256, 2048, 1, 1024, 256, 256, 256, 2048]
    - [43, 8.985]
  - - [256, 2048, 1, 2048, 256, 256, 256, 2048]
    - [37, 10.701]
  - - [256, 2048, 1, 4096, 256, 256, 256, 2048]
    - [19, 13.965]
  - - [256, 2048, 1, 8192, 256, 256, 256, 2048]
    - [36, 17.239]
  - - [256, 4096, 1, 128, 256, 256, 256, 4096]
    - [103, 3.977]
  - - [256, 4096, 1, 256, 256, 256, 256, 4096]
    - [103, 6.884]
  - - [256, 4096, 1, 512, 256, 256, 256, 4096]
    - [102, 10.657]
  - - [256, 4096, 1, 1024, 256, 256, 256, 4096]
    - [121, 13.736]
  - - [256, 4096, 1, 2048, 256, 256, 256, 4096]
    - [120, 15.395]
  - - [256, 4096, 1, 4096, 256, 256, 256, 4096]
    - [91, 18.747]
  - - [256, 4096, 1, 8192, 256, 256, 256, 4096]
    - [112, 23.052]
  - - [256, 8192, 1, 128, 256, 256, 256, 8192]
    - [9, 6.261]
  - - [256, 8192, 1, 256, 256, 256, 256, 8192]
    - [98, 10.377]
  - - [256, 8192, 1, 512, 256, 256, 256, 8192]
    - [98, 14.697]
  - - [256, 8192, 1, 1024, 256, 256, 256, 8192]
    - [117, 18.311]
  - - [256, 8192, 1, 2048, 256, 256, 256, 8192]
    - [118, 19.865]
  - - [256, 8192, 1, 4096, 256, 256, 256, 8192]
    - [30, 24.049]
  - - [256, 8192, 1, 8192, 256, 256, 256, 8192]
    - [94, 25.548]
  - - [512, 128, 1, 128, 512, 512, 512, 128]
    - [27, 0.31]
  - - [512, 128, 1, 256, 512, 512, 512, 128]
    - [26, 0.545]
  - - [512, 128, 1, 512, 512, 512, 512, 128]
    - [26, 0.893]
  - - [512, 128, 1, 1024, 512, 512, 512, 128]
    - [126, 1.295]
  - - [512, 128, 1, 2048, 512, 512, 512, 128]
    - [74, 2.036]
  - - [512, 128, 1, 4096, 512, 512, 512, 128]
    - [110, 3.353]
  - - [512, 128, 1, 8192, 512, 512, 512, 128]
    - [45, 4.854]
  - - [512, 256, 1, 128, 512, 512, 512, 256]
    - [12, 0.602]
  - - [512, 256, 1, 256, 512, 512, 512, 256]
    - [26, 1.066]
  - - [512, 256, 1, 512, 512, 512, 512, 256]
    - [27, 1.749]
  - - [512, 256, 1, 1024, 512, 512, 512, 256]
    - [126, 2.547]
  - - [512, 256, 1, 2048, 512, 512, 512, 256]
    - [127, 3.713]
  - - [512, 256, 1, 4096, 512, 512, 512, 256]
    - [106, 5.91]
  - - [512, 256, 1, 8192, 512, 512, 512, 256]
    - [44, 8.677]
  - - [512, 512, 1, 128, 512, 512, 512, 512]
    - [11, 1.18]
  - - [512, 512, 1, 256, 512, 512, 512, 512]
    - [27, 2.073]
  - - [512, 512, 1, 512, 512, 512, 512, 512]
    - [45, 3.4]
  - - [512, 512, 1, 1024, 512, 512, 512, 512]
    - [26, 5.009]
  - - [512, 512, 1, 2048, 512, 512, 512, 512]
    - [40, 6.842]
  - - [512, 512, 1, 4096, 512, 512, 512, 512]
    - [104, 9.316]
  - - [512, 512, 1, 8192, 512, 512, 512, 512]
    - [37, 13.212]
  - - [512, 1024, 1, 128, 512, 512, 512, 1024]
    - [107, 2.219]
  - - [512, 1024, 1, 256, 512, 512, 512, 1024]
    - [24, 3.891]
  - - [512, 1024, 1, 512, 512, 512, 512, 1024]
    - [42, 6.31]
  - - [512, 1024, 1, 1024, 512, 512, 512, 1024]
    - [42, 9.09]
  - - [512, 1024, 1, 2048, 512, 512, 512, 1024]
    - [37, 10.929]
  - - [512, 1024, 1, 4096, 512, 512, 512, 1024]
    - [39, 14.188]
  - - [512, 1024, 1, 8192, 512, 512, 512, 1024]
    - [35, 18.119]
  - - [512, 2048, 1, 128, 512, 512, 512, 2048]
    - [20, 4.033]
  - - [512, 2048, 1, 256, 512, 512, 512, 2048]
    - [103, 6.876]
  - - [512, 2048, 1, 512, 512, 512, 512, 2048]
    - [103, 10.674]
  - - [512, 2048, 1, 1024, 512, 512, 512, 2048]
    - [120, 13.846]
  - - [512, 2048, 1, 2048, 512, 512, 512, 2048]
    - [35, 15.442]
  - - [512, 2048, 1, 4096, 512, 512, 512, 2048]
    - [91, 18.956]
  - - [512, 2048, 1, 8192, 512, 512, 512, 2048]
    - [114, 23.164]
  - - [512, 4096, 1, 128, 512, 512, 512, 4096]
    - [72, 6.542]
  - - [512, 4096, 1, 256, 512, 512, 512, 4096]
    - [99, 10.467]
  - - [512, 4096, 1, 512, 512, 512, 512, 4096]
    - [100, 14.751]
  - - [512, 4096, 1, 1024, 512, 512, 512, 4096]
    - [119, 18.409]
  - - [512, 4096, 1, 2048, 512, 512, 512, 4096]
    - [95, 19.96]
  - - [512, 4096, 1, 4096, 512, 512, 512, 4096]
    - [32, 24.683]
  - - [512, 4096, 1, 8192, 512, 512, 512, 4096]
    - [64, 25.397]
  - - [512, 8192, 1, 128, 512, 512, 512, 8192]
    - [67, 9.266]
  - - [512, 8192, 1, 256, 512, 512, 512, 8192]
    - [91, 14.246]
  - - [512, 8192, 1, 512, 512, 512, 512, 8192]
    - [92, 20.119]
  - - [512, 8192, 1, 1024, 512, 512, 512, 8192]
    - [94, 24.838]
  - - [512, 8192, 1, 2048, 512, 512, 512, 8192]
    - [17, 27.48]
  - - [512, 8192, 1, 4096, 512, 512, 512, 8192]
    - [115, 30.429]
  - - [512, 8192, 1, 8192, 512, 512, 512, 8192]
    - [16, 28.312]
  - - [1024, 128, 1, 128, 1024, 1024, 1024, 128]
    - [27, 0.621]
  - - [1024, 128, 1, 256, 1024, 1024, 1024, 128]
    - [108, 1.073]
  - - [1024, 128, 1, 512, 1024, 1024, 1024, 128]
    - [26, 1.785]
  - - [1024, 128, 1, 1024, 1024, 1024, 1024, 128]
    - [45, 2.602]
  - - [1024, 128, 1, 2048, 1024, 1024, 1024, 128]
    - [27, 3.762]
  - - [1024, 128, 1, 4096, 1024, 1024, 1024, 128]
    - [106, 5.839]
  - - [1024, 128, 1, 8192, 1024, 1024, 1024, 128]
    - [42, 8.259]
  - - [1024, 256, 1, 128, 1024, 1024, 1024, 256]
    - [12, 1.22]
  - - [1024, 256, 1, 256, 1024, 1024, 1024, 256]
    - [45, 2.101]
  - - [1024, 256, 1, 512, 1024, 1024, 1024, 256]
    - [26, 3.447]
  - - [1024, 256, 1, 1024, 1024, 1024, 1024, 256]
    - [126, 5.006]
  - - [1024, 256, 1, 2048, 1024, 1024, 1024, 256]
    - [42, 6.805]
  - - [1024, 256, 1, 4096, 1024, 1024, 1024, 256]
    - [40, 9.214]
  - - [1024, 256, 1, 8192, 1024, 1024, 1024, 256]
    - [37, 13.227]
  - - [1024, 512, 1, 128, 1024, 1024, 1024, 512]
    - [25, 2.236]
  - - [1024, 512, 1, 256, 1024, 1024, 1024, 512]
    - [105, 3.896]
  - - [1024, 512, 1, 512, 1024, 1024, 1024, 512]
    - [124, 6.314]
  - - [1024, 512, 1, 1024, 1024, 1024, 1024, 512]
    - [42, 9.181]
  - - [1024, 512, 1, 2048, 1024, 1024, 1024, 512]
    - [38, 11.061]
  - - [1024, 512, 1, 4096, 1024, 1024, 1024, 512]
    - [37, 14.097]
  - - [1024, 512, 1, 8192, 1024, 1024, 1024, 512]
    - [34, 17.401]
  - - [1024, 1024, 1, 128, 1024, 1024, 1024, 1024]
    - [103, 3.901]
  - - [1024, 1024, 1, 256, 1024, 1024, 1024, 1024]
    - [102, 6.879]
  - - [1024, 1024, 1, 512, 1024, 1024, 1024, 1024]
    - [103, 10.81]
  - - [1024, 1024, 1, 1024, 1024, 1024, 1024, 1024]
    - [39, 13.834]
  - - [1024, 1024, 1, 2048, 1024, 1024, 1024, 1024]
    - [38, 15.96]
  - - [1024, 1024, 1, 4096, 1024, 1024, 1024, 1024]
    - [35, 18.53]
  - - [1024, 1024, 1, 8192, 1024, 1024, 1024, 1024]
    - [30, 23.041]
  - - [1024, 2048, 1, 128, 1024, 1024, 1024, 2048]
    - [72, 6.464]
  - - [1024, 2048, 1, 256, 1024, 1024, 1024, 2048]
    - [72, 10.55]
  - - [1024, 2048, 1, 512, 1024, 1024, 1024, 2048]
    - [97, 14.77]
  - - [1024, 2048, 1, 1024, 1024, 1024, 1024, 2048]
    - [117, 17.683]
  - - [1024, 2048, 1, 2048, 1024, 1024, 1024, 2048]
    - [17, 20.486]
  - - [1024, 2048, 1, 4096, 1024, 1024, 1024, 2048]
    - [31, 24.851]
  - - [1024, 2048, 1, 8192, 1024, 1024, 1024, 2048]
    - [61, 24.843]
  - - [1024, 4096, 1, 128, 1024, 1024, 1024, 4096]
    - [67, 9.284]
  - - [1024, 4096, 1, 256, 1024, 1024, 1024, 4096]
    - [91, 14.339]
  - - [1024, 4096, 1, 512, 1024, 1024, 1024, 4096]
    - [91, 20.257]
  - - [1024, 4096, 1, 1024, 1024, 1024, 1024, 4096]
    - [17, 24.198]
  - - [1024, 4096, 1, 2048, 1024, 1024, 1024, 4096]
    - [111, 27.111]
  - - [1024, 4096, 1, 4096, 1024, 1024, 1024, 4096]
    - [116, 29.851]
  - - [1024, 4096, 1, 8192, 1024, 1024, 1024, 4096]
    - [76, 27.876]
  - - [1024, 8192, 1, 128, 1024, 1024, 1024, 8192]
    - [63, 12.416]
  - - [1024, 8192, 1, 256, 1024, 1024, 1024, 8192]
    - [62, 18.384]
  - - [1024, 8192, 1, 512, 1024, 1024, 1024, 8192]
    - [7, 23.026]
  - - [1024, 8192, 1, 1024, 1024, 1024, 1024, 8192]
    - [58, 27.926]
  - - [1024, 8192, 1, 2048, 1024, 1024, 1024, 8192]
    - [84, 31.648]
  - - [1024, 8192, 1, 4096, 1024, 1024, 1024, 8192]
    - [51, 28.325]
  - - [1024, 8192, 1, 8192, 1024, 1024, 1024, 8192]
    - [4, 32.365]
  - - [2048, 128, 1, 128, 2048, 2048, 2048, 128]
    - [12, 1.213]
  - - [2048, 128, 1, 256, 2048, 2048, 2048, 128]
    - [27, 2.125]
  - - [2048, 128, 1, 512, 2048, 2048, 2048, 128]
    - [27, 3.461]
  - - [2048, 128, 1, 1024, 2048, 2048, 2048, 128]
    - [27, 4.989]
  - - [2048, 128, 1, 2048, 2048, 2048, 2048, 128]
    - [42, 6.845]
  - - [2048, 128, 1, 4096, 2048, 2048, 2048, 128]
    - [22, 9.521]
  - - [2048, 128, 1, 8192, 2048, 2048, 2048, 128]
    - [37, 12.272]
  - - [2048, 256, 1, 128, 2048, 2048, 2048, 256]
    - [25, 2.238]
  - - [2048, 256, 1, 256, 2048, 2048, 2048, 256]
    - [107, 3.954]
  - - [2048, 256, 1, 512, 2048, 2048, 2048, 256]
    - [124, 6.291]
  - - [2048, 256, 1, 1024, 2048, 2048, 2048, 256]
    - [42, 8.988]
  - - [2048, 256, 1, 2048, 2048, 2048, 2048, 256]
    - [37, 10.937]
  - - [2048, 256, 1, 4096, 2048, 2048, 2048, 256]
    - [18, 13.67]
  - - [2048, 256, 1, 8192, 2048, 2048, 2048, 256]
    - [119, 16.976]
  - - [2048, 512, 1, 128, 2048, 2048, 2048, 512]
    - [21, 3.988]
  - - [2048, 512, 1, 256, 2048, 2048, 2048, 512]
    - [103, 6.995]
  - - [2048, 512, 1, 512, 2048, 2048, 2048, 512]
    - [21, 10.845]
  - - [2048, 512, 1, 1024, 2048, 2048, 2048, 512]
    - [38, 13.877]
  - - [2048, 512, 1, 2048, 2048, 2048, 2048, 512]
    - [33, 15.485]
  - - [2048, 512, 1, 4096, 2048, 2048, 2048, 512]
    - [92, 18.947]
  - - [2048, 512, 1, 8192, 2048, 2048, 2048, 512]
    - [28, 23.28]
  - - [2048, 1024, 1, 128, 2048, 2048, 2048, 1024]
    - [71, 6.457]
  - - [2048, 1024, 1, 256, 2048, 2048, 2048, 1024]
    - [72, 10.555]
  - - [2048, 1024, 1, 512, 2048, 2048, 2048, 1024]
    - [98, 14.724]
  - - [2048, 1024, 1, 1024, 2048, 2048, 2048, 1024]
    - [118, 17.47]
  - - [2048, 1024, 1, 2048, 2048, 2048, 2048, 1024]
    - [17, 19.924]
  - - [2048, 1024, 1, 4096, 2048, 2048, 2048, 1024]
    - [29, 24.557]
  - - [2048, 1024, 1, 8192, 2048, 2048, 2048, 1024]
    - [87, 24.653]
  - - [2048, 2048, 1, 128, 2048, 2048, 2048, 2048]
    - [8, 9.04]
  - - [2048, 2048, 1, 256, 2048, 2048, 2048, 2048]
    - [91, 14.153]
  - - [2048, 2048, 1, 512, 2048, 2048, 2048, 2048]
    - [92, 19.691]
  - - [2048, 2048, 1, 1024, 2048, 2048, 2048, 2048]
    - [92, 23.664]
  - - [2048, 2048, 1, 2048, 2048, 2048, 2048, 2048]
    - [113, 26.746]
  - - [2048, 2048, 1, 4096, 2048, 2048, 2048, 2048]
    - [113, 30.459]
  - - [2048, 2048, 1, 8192, 2048, 2048, 2048, 2048]
    - [88, 27.785]
  - - [2048, 4096, 1, 128, 2048, 2048, 2048, 4096]
    - [60, 12.177]
  - - [2048, 4096, 1, 256, 2048, 2048, 2048, 4096]
    - [59, 17.729]
  - - [2048, 4096, 1, 512, 2048, 2048, 2048, 4096]
    - [65, 22.843]
  - - [2048, 4096, 1, 1024, 2048, 2048, 2048, 4096]
    - [6, 27.396]
  - - [2048, 4096, 1, 2048, 2048, 2048, 2048, 4096]
    - [89, 31.146]
  - - [2048, 4096, 1, 4096, 2048, 2048, 2048, 4096]
    - [54, 28.217]
  - - [2048, 4096, 1, 8192, 2048, 2048, 2048, 4096]
    - [49, 31.711]
  - - [2048, 8192, 1, 128, 2048, 2048, 2048, 8192]
    - [1, 12.043]
  - - [2048, 8192, 1, 256, 2048, 2048, 2048, 8192]
    - [1, 18.64]
  - - [2048, 8192, 1, 512, 2048, 2048, 2048, 8192]
    - [50, 25.736]
  - - [2048, 8192, 1, 1024, 2048, 2048, 2048, 8192]
    - [53, 32.026]
  - - [2048, 8192, 1, 2048, 2048, 2048, 2048, 8192]
    - [80, 33.797]
  - - [2048, 8192, 1, 4096, 2048, 2048, 2048, 8192]
    - [82, 31.455]
  - - [2048, 8192, 1, 8192, 2048, 2048, 2048, 8192]
    - [13, 34.25]
  - - [4096, 128, 1, 128, 4096, 4096, 4096, 128]
    - [25, 2.223]
  - - [4096, 128, 1, 256, 4096, 4096, 4096, 128]
    - [107, 3.937]
  - - [4096, 128, 1, 512, 4096, 4096, 4096, 128]
    - [107, 6.243]
  - - [4096, 128, 1, 1024, 4096, 4096, 4096, 128]
    - [123, 8.901]
  - - [4096, 128, 1, 2048, 4096, 4096, 4096, 128]
    - [22, 10.356]
  - - [4096, 128, 1, 4096, 4096, 4096, 4096, 128]
    - [100, 13.249]
  - - [4096, 128, 1, 8192, 4096, 4096, 4096, 128]
    - [118, 16.421]
  - - [4096, 256, 1, 128, 4096, 4096, 4096, 256]
    - [21, 4.001]
  - - [4096, 256, 1, 256, 4096, 4096, 4096, 256]
    - [21, 6.933]
  - - [4096, 256, 1, 512, 4096, 4096, 4096, 256]
    - [103, 10.605]
  - - [4096, 256, 1, 1024, 4096, 4096, 4096, 256]
    - [122, 13.599]
  - - [4096, 256, 1, 2048, 4096, 4096, 4096, 256]
    - [37, 14.744]
  - - [4096, 256, 1, 4096, 4096, 4096, 4096, 256]
    - [92, 18.64]
  - - [4096, 256, 1, 8192, 4096, 4096, 4096, 256]
    - [116, 22.609]
  - - [4096, 512, 1, 128, 4096, 4096, 4096, 512]
    - [70, 6.446]
  - - [4096, 512, 1, 256, 4096, 4096, 4096, 512]
    - [72, 10.581]
  - - [4096, 512, 1, 512, 4096, 4096, 4096, 512]
    - [101, 14.615]
  - - [4096, 512, 1, 1024, 4096, 4096, 4096, 512]
    - [118, 18.198]
  - - [4096, 512, 1, 2048, 4096, 4096, 4096, 512]
    - [101, 19.863]
  - - [4096, 512, 1, 4096, 4096, 4096, 4096, 512]
    - [28, 24.589]
  - - [4096, 512, 1, 8192, 4096, 4096, 4096, 512]
    - [57, 25.197]
  - - [4096, 1024, 1, 128, 4096, 4096, 4096, 1024]
    - [68, 9.052]
  - - [4096, 1024, 1, 256, 4096, 4096, 4096, 1024]
    - [92, 13.908]
  - - [4096, 1024, 1, 512, 4096, 4096, 4096, 1024]
    - [92, 19.846]
  - - [4096, 1024, 1, 1024, 4096, 4096, 4096, 1024]
    - [92, 23.585]
  - - [4096, 1024, 1, 2048, 4096, 4096, 4096, 1024]
    - [93, 26.839]
  - - [4096, 1024, 1, 4096, 4096, 4096, 4096, 1024]
    - [113, 30.979]
  - - [4096, 1024, 1, 8192, 4096, 4096, 4096, 1024]
    - [58, 27.749]
  - - [4096, 2048, 1, 128, 4096, 4096, 4096, 2048]
    - [65, 11.961]
  - - [4096, 2048, 1, 256, 4096, 4096, 4096, 2048]
    - [65, 17.697]
  - - [4096, 2048, 1, 512, 4096, 4096, 4096, 2048]
    - [57, 22.109]
  - - [4096, 2048, 1, 1024, 4096, 4096, 4096, 2048]
    - [58, 27.189]
  - - [4096, 2048, 1, 2048, 4096, 4096, 4096, 2048]
    - [90, 30.816]
  - - [4096, 2048, 1, 4096, 4096, 4096, 4096, 2048]
    - [49, 28.036]
  - - [4096, 2048, 1, 8192, 4096, 4096, 4096, 2048]
    - [82, 31.756]
  - - [4096, 4096, 1, 128, 4096, 4096, 4096, 4096]
    - [3, 12.19]
  - - [4096, 4096, 1, 256, 4096, 4096, 4096, 4096]
    - [50, 18.634]
  - - [4096, 4096, 1, 512, 4096, 4096, 4096, 4096]
    - [0, 26.065]
  - - [4096, 4096, 1, 1024, 4096, 4096, 4096, 4096]
    - [53, 32.421]
  - - [4096, 4096, 1, 2048, 4096, 4096, 4096, 4096]
    - [83, 33.308]
  - - [4096, 4096, 1, 4096, 4096, 4096, 4096, 4096]
    - [82, 31.22]
  - - [4096, 4096, 1, 8192, 4096, 4096, 4096, 4096]
    - [2, 34.417]
  - - [4096, 8192, 1, 128, 4096, 4096, 4096, 8192]
    - [14, 12.891]
  - - [4096, 8192, 1, 256, 4096, 4096, 4096, 8192]
    - [85, 16.772]
  - - [4096, 8192, 1, 512, 4096, 4096, 4096, 8192]
    - [49, 21.632]
  - - [4096, 8192, 1, 1024, 4096, 4096, 4096, 8192]
    - [49, 26.433]
  - - [4096, 8192, 1, 2048, 4096, 4096, 4096, 8192]
    - [49, 31.106]
  - - [4096, 8192, 1, 4096, 4096, 4096, 4096, 8192]
    - [78, 33.595]
  - - [4096, 8192, 1, 8192, 4096, 4096, 4096, 8192]
    - [48, 36.619]
  - - [8192, 128, 1, 128, 8192, 8192, 8192, 128]
    - [21, 3.967]
  - - [8192, 128, 1, 256, 8192, 8192, 8192, 128]
    - [23, 6.759]
  - - [8192, 128, 1, 512, 8192, 8192, 8192, 128]
    - [122, 10.187]
  - - [8192, 128, 1, 1024, 8192, 8192, 8192, 128]
    - [122, 13.542]
  - - [8192, 128, 1, 2048, 8192, 8192, 8192, 128]
    - [37, 14.364]
  - - [8192, 128, 1, 4096, 8192, 8192, 8192, 128]
    - [91, 16.976]
  - - [8192, 128, 1, 8192, 8192, 8192, 8192, 128]
    - [115, 21.168]
  - - [8192, 256, 1, 128, 8192, 8192, 8192, 256]
    - [73, 6.468]
  - - [8192, 256, 1, 256, 8192, 8192, 8192, 256]
    - [96, 10.297]
  - - [8192, 256, 1, 512, 8192, 8192, 8192, 256]
    - [101, 14.647]
  - - [8192, 256, 1, 1024, 8192, 8192, 8192, 256]
    - [118, 18.241]
  - - [8192, 256, 1, 2048, 8192, 8192, 8192, 256]
    - [96, 19.438]
  - - [8192, 256, 1, 4096, 8192, 8192, 8192, 256]
    - [114, 23.501]
  - - [8192, 256, 1, 8192, 8192, 8192, 8192, 256]
    - [57, 25.498]
  - - [8192, 512, 1, 128, 8192, 8192, 8192, 512]
    - [69, 9.189]
  - - [8192, 512, 1, 256, 8192, 8192, 8192, 512]
    - [92, 14.057]
  - - [8192, 512, 1, 512, 8192, 8192, 8192, 512]
    - [92, 19.782]
  - - [8192, 512, 1, 1024, 8192, 8192, 8192, 512]
    - [94, 24.642]
  - - [8192, 512, 1, 2048, 8192, 8192, 8192, 512]
    - [94, 26.998]
  - - [8192, 512, 1, 4096, 8192, 8192, 8192, 512]
    - [28, 29.123]
  - - [8192, 512, 1, 8192, 8192, 8192, 8192, 512]
    - [5, 28.668]
  - - [8192, 1024, 1, 128, 8192, 8192, 8192, 1024]
    - [56, 11.489]
  - - [8192, 1024, 1, 256, 8192, 8192, 8192, 1024]
    - [58, 17.065]
  - - [8192, 1024, 1, 512, 8192, 8192, 8192, 1024]
    - [57, 22.77]
  - - [8192, 1024, 1, 1024, 8192, 8192, 8192, 1024]
    - [58, 27.553]
  - - [8192, 1024, 1, 2048, 8192, 8192, 8192, 1024]
    - [86, 31.749]
  - - [8192, 1024, 1, 4096, 8192, 8192, 8192, 1024]
    - [0, 28.649]
  - - [8192, 1024, 1, 8192, 8192, 8192, 8192, 1024]
    - [52, 31.989]
  - - [8192, 2048, 1, 128, 8192, 8192, 8192, 2048]
    - [55, 12.191]
  - - [8192, 2048, 1, 256, 8192, 8192, 8192, 2048]
    - [55, 18.795]
  - - [8192, 2048, 1, 512, 8192, 8192, 8192, 2048]
    - [53, 25.729]
  - - [8192, 2048, 1, 1024, 8192, 8192, 8192, 2048]
    - [53, 31.616]
  - - [8192, 2048, 1, 2048, 8192, 8192, 8192, 2048]
    - [79, 33.316]
  - - [8192, 2048, 1, 4096, 8192, 8192, 8192, 2048]
    - [54, 31.676]
  - - [8192, 2048, 1, 8192, 8192, 8192, 8192, 2048]
    - [49, 35.071]
  - - [8192, 4096, 1, 128, 8192, 8192, 8192, 4096]
    - [14, 12.696]
  - - [8192, 4096, 1, 256, 8192, 8192, 8192, 4096]
    - [90, 16.66]
  - - [8192, 4096, 1, 512, 8192, 8192, 8192, 4096]
    - [66, 21.325]
  - - [8192, 4096, 1, 1024, 8192, 8192, 8192, 4096]
    - [77, 27.273]
  - - [8192, 4096, 1, 2048, 8192, 8192, 8192, 4096]
    - [49, 31.797]
  - - [8192, 4096, 1, 4096, 8192, 8192, 8192, 4096]
    - [77, 34.32]
  - - [8192, 4096, 1, 8192, 8192, 8192, 8192, 4096]
    - [49, 37.086]
  - - [8192, 8192, 1, 128, 8192, 8192, 8192, 8192]
    - [15, 12.55]
  - - [8192, 8192, 1, 256, 8192, 8192, 8192, 8192]
    - [81, 16.331]
  - - [8192, 8192, 1, 512, 8192, 8192, 8192, 8192]
    - [54, 21.789]
  - - [8192, 8192, 1, 1024, 8192, 8192, 8192, 8192]
    - [52, 28.508]
  - - [8192, 8192, 1, 2048, 8192, 8192, 8192, 8192]
    - [52, 34.523]
  - - [8192, 8192, 1, 4096, 8192, 8192, 8192, 8192]
    - [81, 37.038]
  - - [8192, 8192, 1, 8192, 8192, 8192, 8192, 8192]
    - [52, 38.059]
  - - [1, 1, 1, 32, 1, 1, 1, 1]
    - [128, 0.0]
- null
- null
- ExperimentalStreamK
- GridBased
