library/src/amd_detail/rocblaslt/src/Tensile/Logic/asm_full/aquavanjaram/gfx942/StreamK/aquavanjaram942_Cijk_Alik_Bljk_HSS_BH_UserArgs.yaml
- {MinimumRequiredVersion: 4.33.0}
- aquavanjaram942
- gfx942
- [Device 0049, Device 0050]
    SolutionIndex: 0
    SolutionNameMin: Cijk_Alik_Bljk_HSS_BH_UserArgs_MT128x128x32_MI16x16x1_SN_LDSB1_CLR1_GSU0_GSUC0_GSUWGMRR0_K1_LBSPPA256_LBSPPB256_MIWT4_4_PLR1_SU32_SUM0_SUS256_SKXCCM0_VWA4_VWB4_WGM8_WGMXCC1_WGMXCCGn1
    SolutionIndex: 1
    SolutionNameMin: Cijk_Alik_Bljk_HSS_BH_UserArgs_MT256x64x64_MI16x16x1_SN_LDSB1_CLR1_GSU0_GSUC0_GSUWGMRR0_K1_LBSPPA256_LBSPPB128_MIWT8_2_PLR1_SU32_SUM0_SUS256_SKXCCM0_VWA2_VWB1_WGM8_WGMXCC1_WGMXCCGn1
    SolutionIndex: 2
    SolutionNameMin: Cijk_Alik_Bljk_HSS_BH_UserArgs_MT128x128x64_MI16x16x1_SN_LDSB1_CLR1_GSU0_GSUC0_GSUWGMRR0_K1_LBSPPA128_LBSPPB128_MIWT4_4_PLR1_SU32_SUM0_SUS256_SKXCCM0_VWA1_VWB1_WGM1_WGMXCC1_WGMXCCGn1
    SolutionIndex: 3
    SolutionNameMin: Cijk_Alik_Bljk_HSS_BH_UserArgs_MT128x128x64_MI16x16x1_SN_LDSB1_CLR1_GSU0_GSUC0_GSUWGMRR0_K1_LBSPPA256_LBSPPB128_MIWT4_4_PLR1_SU32_SUM0_SUS256_SKXCCM0_VWA2_VWB1_WGM1_WGMXCC1_WGMXCCGn1
    SolutionIndex: 4
    SolutionNameMin: Cijk_Alik_Bljk_HSS_BH_UserArgs_MT128x128x64_MI16x16x1_SN_LDSB1_CLR1_GSU0_GSUC0_GSUWGMRR0_K1_LBSPPA512_LBSPPB128_MIWT4_4_PLR1_SU32_SUM0_SUS256_SKXCCM0_VWA4_VWB1_WGM1_WGMXCC1_WGMXCCGn1
    SolutionIndex: 5
    SolutionNameMin: Cijk_Alik_Bljk_HSS_BH_UserArgs_MT128x128x64_MI16x16x1_SN_LDSB1_CLR1_GSU0_GSUC0_GSUWGMRR0_K1_LBSPPA256_LBSPPB256_MIWT4_4_PLR1_SU32_SUM0_SUS256_SKXCCM0_VWA2_VWB2_WGM1_WGMXCC1_WGMXCCGn1
    SolutionIndex: 6
    SolutionNameMin: Cijk_Alik_Bljk_HSS_BH_UserArgs_MT128x128x64_MI16x16x1_SN_LDSB1_CLR1_GSU0_GSUC0_GSUWGMRR0_K1_LBSPPA512_LBSPPB256_MIWT4_4_PLR1_SU32_SUM0_SUS256_SKXCCM0_VWA4_VWB2_WGM1_WGMXCC1_WGMXCCGn1
    SolutionIndex: 7
    SolutionNameMin: Cijk_Alik_Bljk_HSS_BH_UserArgs_MT128x128x64_MI16x16x1_SN_LDSB1_CLR1_GSU0_GSUC0_GSUWGMRR0_K1_LBSPPA256_LBSPPB512_MIWT4_4_PLR1_SU32_SUM0_SUS256_SKXCCM0_VWA2_VWB4_WGM1_WGMXCC1_WGMXCCGn1
    SolutionIndex: 8
    SolutionNameMin: Cijk_Alik_Bljk_HSS_BH_UserArgs_MT128x128x64_MI16x16x1_SN_LDSB1_CLR1_GSU0_GSUC0_GSUWGMRR0_K1_LBSPPA512_LBSPPB512_MIWT4_4_PLR1_SU32_SUM0_SUS256_SKXCCM0_VWA4_VWB4_WGM1_WGMXCC1_WGMXCCGn1
    SolutionIndex: 9
    SolutionNameMin: Cijk_Alik_Bljk_HSS_BH_UserArgs_MT128x128x64_MI16x16x1_SN_LDSB1_CLR1_GSU0_GSUC0_GSUWGMRR0_K1_LBSPPA512_LBSPPB128_MIWT4_4_PLR1_SU32_SUM0_SUS256_SKXCCM0_VWA4_VWB1_WGM4_WGMXCC1_WGMXCCGn1
    SolutionIndex: 10
    SolutionNameMin: Cijk_Alik_Bljk_HSS_BH_UserArgs_MT128x128x64_MI16x16x1_SN_LDSB1_CLR1_GSU0_GSUC0_GSUWGMRR0_K1_LBSPPA512_LBSPPB256_MIWT4_4_PLR1_SU32_SUM0_SUS256_SKXCCM0_VWA4_VWB2_WGM4_WGMXCC1_WGMXCCGn1
    SolutionIndex: 11
    SolutionNameMin: Cijk_Alik_Bljk_HSS_BH_UserArgs_MT128x128x64_MI16x16x1_SN_LDSB1_CLR1_GSU0_GSUC0_GSUWGMRR0_K1_LBSPPA512_LBSPPB512_MIWT4_4_PLR1_SU32_SUM0_SUS256_SKXCCM0_VWA4_VWB4_WGM4_WGMXCC1_WGMXCCGn1
    SolutionIndex: 12
    SolutionNameMin: Cijk_Alik_Bljk_HSS_BH_UserArgs_MT128x128x64_MI16x16x1_SN_LDSB1_CLR1_GSU0_GSUC0_GSUWGMRR0_K1_LBSPPA512_LBSPPB128_MIWT4_4_PLR1_SU32_SUM0_SUS256_SKXCCM0_VWA4_VWB1_WGM8_WGMXCC1_WGMXCCGn1
    SolutionIndex: 13
    SolutionNameMin: Cijk_Alik_Bljk_HSS_BH_UserArgs_MT64x128x64_MI16x16x1_SN_LDSB1_CLR1_GSU0_GSUC0_GSUWGMRR0_K1_LBSPPA128_LBSPPB256_MIWT2_4_PLR1_SU32_SUM0_SUS256_SKXCCM0_VWA1_VWB2_WGM1_WGMXCC1_WGMXCCGn1
    SolutionIndex: 14
    SolutionNameMin: Cijk_Alik_Bljk_HSS_BH_UserArgs_MT128x64x64_MI16x16x1_SN_LDSB1_CLR1_GSU0_GSUC0_GSUWGMRR0_K1_LBSPPA512_LBSPPB128_MIWT4_2_PLR1_SU32_SUM0_SUS256_SKXCCM0_VWA4_VWB1_WGM1_WGMXCC1_WGMXCCGn1
    SolutionIndex: 15
    SolutionNameMin: Cijk_Alik_Bljk_HSS_BH_UserArgs_MT128x64x64_MI16x16x1_SN_LDSB1_CLR1_GSU0_GSUC0_GSUWGMRR0_K1_LBSPPA512_LBSPPB256_MIWT4_2_PLR1_SU32_SUM0_SUS256_SKXCCM0_VWA4_VWB2_WGM1_WGMXCC1_WGMXCCGn1
    SolutionIndex: 16
    SolutionNameMin: Cijk_Alik_Bljk_HSS_BH_UserArgs_MT128x64x64_MI16x16x1_SN_LDSB1_CLR1_GSU0_GSUC0_GSUWGMRR0_K1_LBSPPA128_LBSPPB128_MIWT4_2_PLR1_SU32_SUM0_SUS256_SKXCCM0_VWA1_VWB1_WGM4_WGMXCC1_WGMXCCGn1
    SolutionIndex: 17
    SolutionNameMin: Cijk_Alik_Bljk_HSS_BH_UserArgs_MT128x64x64_MI16x16x1_SN_LDSB1_CLR1_GSU0_GSUC0_GSUWGMRR0_K1_LBSPPA512_LBSPPB128_MIWT4_2_PLR1_SU32_SUM0_SUS256_SKXCCM0_VWA4_VWB1_WGM8_WGMXCC1_WGMXCCGn1
    SolutionIndex: 18
    SolutionNameMin: Cijk_Alik_Bljk_HSS_BH_UserArgs_MT64x64x64_MI16x16x1_SN_LDSB1_CLR1_GSU0_GSUC0_GSUWGMRR0_K1_LBSPPA128_LBSPPB128_MIWT2_2_PLR1_SU32_SUM0_SUS256_SKXCCM0_VWA1_VWB1_WGM8_WGMXCC1_WGMXCCGn1
    SolutionIndex: 19
    SolutionNameMin: Cijk_Alik_Bljk_HSS_BH_UserArgs_MT64x64x64_MI16x16x1_SN_LDSB1_CLR1_GSU0_GSUC0_GSUWGMRR0_K1_LBSPPA128_LBSPPB256_MIWT2_2_PLR1_SU32_SUM0_SUS256_SKXCCM0_VWA1_VWB2_WGM8_WGMXCC1_WGMXCCGn1
    SolutionIndex: 20
    SolutionNameMin: Cijk_Alik_Bljk_HSS_BH_UserArgs_MT32x64x64_MI16x16x1_SN_LDSB0_CLR1_GSU0_GSUC0_GSUWGMRR0_K1_LBSPPA128_LBSPPB128_MIWT1_2_PLR1_SU32_SUM0_SUS256_SKXCCM0_VWA1_VWB1_WGM1_WGMXCC1_WGMXCCGn1
    SolutionIndex: 21
    SolutionNameMin: Cijk_Alik_Bljk_HSS_BH_UserArgs_MT32x64x64_MI16x16x1_SN_LDSB0_CLR1_GSU0_GSUC0_GSUWGMRR0_K1_LBSPPA128_LBSPPB256_MIWT1_2_PLR1_SU32_SUM0_SUS256_SKXCCM0_VWA1_VWB2_WGM1_WGMXCC1_WGMXCCGn1
    SolutionIndex: 22
    SolutionNameMin: Cijk_Alik_Bljk_HSS_BH_UserArgs_MT64x32x64_MI16x16x1_SN_LDSB0_CLR1_GSU0_GSUC0_GSUWGMRR0_K1_LBSPPA256_LBSPPB128_MIWT2_1_PLR1_SU32_SUM0_SUS256_SKXCCM0_VWA2_VWB1_WGM8_WGMXCC1_WGMXCCGn1
    SolutionIndex: 23
    SolutionNameMin: Cijk_Alik_Bljk_HSS_BH_UserArgs_MT32x32x64_MI16x16x1_SN_LDSB0_CLR1_GSU0_GSUC0_GSUWGMRR0_K1_LBSPPA128_LBSPPB128_MIWT1_1_PLR1_SU32_SUM0_SUS256_SKXCCM0_VWA1_VWB1_WGM1_WGMXCC1_WGMXCCGn1
    SolutionIndex: 24
    SolutionNameMin: Cijk_Alik_Bljk_HSS_BH_UserArgs_MT64x64x128_MI16x16x1_SN_LDSB1_CLR1_GSU0_GSUC0_GSUWGMRR0_K1_LBSPPA256_LBSPPB256_MIWT2_2_PLR1_SU32_SUM0_SUS256_SKXCCM0_VWA1_VWB1_WGM1_WGMXCC1_WGMXCCGn1
    SolutionIndex: 25
    SolutionNameMin: Cijk_Alik_Bljk_HSS_BH_UserArgs_MT64x64x128_MI16x16x1_SN_LDSB1_CLR1_GSU0_GSUC0_GSUWGMRR0_K1_LBSPPA256_LBSPPB512_MIWT2_2_PLR1_SU32_SUM0_SUS256_SKXCCM0_VWA1_VWB2_WGM1_WGMXCC1_WGMXCCGn1
    SolutionIndex: 26
    SolutionNameMin: Cijk_Alik_Bljk_HSS_BH_UserArgs_MT64x64x128_MI16x16x1_SN_LDSB1_CLR1_GSU0_GSUC0_GSUWGMRR0_K1_LBSPPA256_LBSPPB256_MIWT2_2_PLR2_SU32_SUM0_SUS256_SKXCCM0_VWA1_VWB1_WGM1_WGMXCC1_WGMXCCGn1
    SolutionIndex: 27
    SolutionNameMin: Cijk_Alik_Bljk_HSS_BH_UserArgs_MT64x64x128_MI16x16x1_SN_LDSB1_CLR1_GSU0_GSUC0_GSUWGMRR0_K1_LBSPPA256_LBSPPB512_MIWT2_2_PLR2_SU32_SUM0_SUS256_SKXCCM0_VWA1_VWB2_WGM1_WGMXCC1_WGMXCCGn1
    SolutionIndex: 28
    SolutionNameMin: Cijk_Alik_Bljk_HSS_BH_UserArgs_MT64x64x128_MI16x16x1_SN_LDSB1_CLR1_GSU0_GSUC0_GSUWGMRR0_K1_LBSPPA256_LBSPPB256_MIWT2_2_PLR1_SU32_SUM0_SUS256_SKXCCM0_VWA1_VWB1_WGM4_WGMXCC1_WGMXCCGn1
    SolutionIndex: 29
    SolutionNameMin: Cijk_Alik_Bljk_HSS_BH_UserArgs_MT64x64x128_MI16x16x1_SN_LDSB1_CLR1_GSU0_GSUC0_GSUWGMRR0_K1_LBSPPA256_LBSPPB512_MIWT2_2_PLR1_SU32_SUM0_SUS256_SKXCCM0_VWA1_VWB2_WGM8_WGMXCC1_WGMXCCGn1
    SolutionIndex: 30
    SolutionNameMin: Cijk_Alik_Bljk_HSS_BH_UserArgs_MT64x64x128_MI16x16x1_SN_LDSB1_CLR1_GSU0_GSUC0_GSUWGMRR0_K1_LBSPPA256_LBSPPB512_MIWT2_2_PLR2_SU32_SUM0_SUS256_SKXCCM0_VWA1_VWB2_WGM8_WGMXCC1_WGMXCCGn1
    SolutionIndex: 31
    SolutionNameMin: Cijk_Alik_Bljk_HSS_BH_UserArgs_MT32x64x128_MI16x16x1_SN_LDSB1_CLR1_GSU0_GSUC0_GSUWGMRR0_K1_LBSPPA256_LBSPPB256_MIWT1_2_PLR1_SU32_SUM0_SUS256_SKXCCM0_VWA1_VWB1_WGM1_WGMXCC1_WGMXCCGn1
    SolutionIndex: 32
    SolutionNameMin: Cijk_Alik_Bljk_HSS_BH_UserArgs_MT32x64x128_MI16x16x1_SN_LDSB1_CLR1_GSU0_GSUC0_GSUWGMRR0_K1_LBSPPA256_LBSPPB256_MIWT1_2_PLR2_SU32_SUM0_SUS256_SKXCCM0_VWA1_VWB1_WGM1_WGMXCC1_WGMXCCGn1
    SolutionIndex: 33
    SolutionNameMin: Cijk_Alik_Bljk_HSS_BH_UserArgs_MT32x64x128_MI16x16x1_SN_LDSB1_CLR1_GSU0_GSUC0_GSUWGMRR0_K1_LBSPPA256_LBSPPB512_MIWT1_2_PLR2_SU32_SUM0_SUS256_SKXCCM0_VWA1_VWB2_WGM1_WGMXCC1_WGMXCCGn1
    SolutionIndex: 34
    SolutionNameMin: Cijk_Alik_Bljk_HSS_BH_UserArgs_MT32x64x128_MI16x16x1_SN_LDSB1_CLR1_GSU0_GSUC0_GSUWGMRR0_K1_LBSPPA256_LBSPPB256_MIWT1_2_PLR1_SU32_SUM0_SUS256_SKXCCM0_VWA1_VWB1_WGM4_WGMXCC1_WGMXCCGn1
    SolutionIndex: 35
    SolutionNameMin: Cijk_Alik_Bljk_HSS_BH_UserArgs_MT32x64x128_MI16x16x1_SN_LDSB1_CLR1_GSU0_GSUC0_GSUWGMRR0_K1_LBSPPA256_LBSPPB256_MIWT1_2_PLR1_SU32_SUM0_SUS256_SKXCCM0_VWA1_VWB1_WGM8_WGMXCC1_WGMXCCGn1
    SolutionIndex: 36
    SolutionNameMin: Cijk_Alik_Bljk_HSS_BH_UserArgs_MT32x64x128_MI16x16x1_SN_LDSB1_CLR1_GSU0_GSUC0_GSUWGMRR0_K1_LBSPPA256_LBSPPB512_MIWT1_2_PLR2_SU32_SUM0_SUS256_SKXCCM0_VWA1_VWB2_WGM8_WGMXCC1_WGMXCCGn1
    SolutionIndex: 37
    SolutionNameMin: Cijk_Alik_Bljk_HSS_BH_UserArgs_MT64x32x128_MI16x16x1_SN_LDSB1_CLR1_GSU0_GSUC0_GSUWGMRR0_K1_LBSPPA256_LBSPPB256_MIWT2_1_PLR2_SU32_SUM0_SUS256_SKXCCM0_VWA1_VWB1_WGM4_WGMXCC1_WGMXCCGn1
    SolutionIndex: 38
    SolutionNameMin: Cijk_Alik_Bljk_HSS_BH_UserArgs_MT32x32x128_MI16x16x1_SN_LDSB1_CLR1_GSU0_GSUC0_GSUWGMRR0_K1_LBSPPA256_LBSPPB256_MIWT1_1_PLR1_SU32_SUM0_SUS256_SKXCCM0_VWA1_VWB1_WGM1_WGMXCC1_WGMXCCGn1
    SolutionIndex: 39
    SolutionNameMin: Cijk_Alik_Bljk_HSS_BH_UserArgs_MT32x32x128_MI16x16x1_SN_LDSB1_CLR1_GSU0_GSUC0_GSUWGMRR0_K1_LBSPPA256_LBSPPB256_MIWT1_1_PLR2_SU32_SUM0_SUS256_SKXCCM0_VWA1_VWB1_WGM1_WGMXCC1_WGMXCCGn1
    SolutionIndex: 40
    SolutionNameMin: Cijk_Alik_Bljk_HSS_BH_UserArgs_MT32x32x128_MI16x16x1_SN_LDSB1_CLR1_GSU0_GSUC0_GSUWGMRR0_K1_LBSPPA256_LBSPPB256_MIWT1_1_PLR1_SU32_SUM0_SUS256_SKXCCM0_VWA1_VWB1_WGM8_WGMXCC1_WGMXCCGn1
    SolutionIndex: 41
    SolutionNameMin: Cijk_Alik_Bljk_HSS_BH_UserArgs_MT128x128x32_MI16x16x1_SN_LDSB1_CLR1_GSU0_GSUC0_GSUWGMRR0_K1_LBSPPA256_LBSPPB256_MIWT4_4_PLR1_SU32_SUM0_SUS256_SKXCCM8_VWA4_VWB4_WGM1_WGMXCC1_WGMXCCGn1
    SolutionIndex: 42
    SolutionNameMin: Cijk_Alik_Bljk_HSS_BH_UserArgs_MT128x128x32_MI16x16x1_SN_LDSB1_CLR1_GSU0_GSUC0_GSUWGMRR0_K1_LBSPPA256_LBSPPB128_MIWT4_4_PLR1_SU32_SUM0_SUS256_SKXCCM8_VWA4_VWB2_WGM4_WGMXCC1_WGMXCCGn1
    SolutionIndex: 43
    SolutionNameMin: Cijk_Alik_Bljk_HSS_BH_UserArgs_MT128x128x32_MI16x16x1_SN_LDSB1_CLR1_GSU0_GSUC0_GSUWGMRR0_K1_LBSPPA128_LBSPPB128_MIWT4_4_PLR1_SU32_SUM0_SUS256_SKXCCM8_VWA1_VWB2_WGM8_WGMXCC1_WGMXCCGn1
    SolutionIndex: 44
    SolutionNameMin: Cijk_Alik_Bljk_HSS_BH_UserArgs_MT128x128x32_MI16x16x1_SN_LDSB1_CLR1_GSU0_GSUC0_GSUWGMRR0_K1_LBSPPA256_LBSPPB256_MIWT4_4_PLR1_SU32_SUM0_SUS256_SKXCCM8_VWA4_VWB4_WGM8_WGMXCC1_WGMXCCGn1
    SolutionIndex: 45
    SolutionNameMin: Cijk_Alik_Bljk_HSS_BH_UserArgs_MT64x64x32_MI16x16x1_SN_LDSB0_CLR1_GSU0_GSUC0_GSUWGMRR0_K1_LBSPPA128_LBSPPB128_MIWT2_2_PLR1_SU32_SUM0_SUS256_SKXCCM8_VWA1_VWB2_WGM1_WGMXCC1_WGMXCCGn1
    SolutionIndex: 46
    SolutionNameMin: Cijk_Alik_Bljk_HSS_BH_UserArgs_MT32x64x32_MI16x16x1_SN_LDSB0_CLR1_GSU0_GSUC0_GSUWGMRR0_K1_LBSPPA128_LBSPPB128_MIWT1_2_PLR1_SU32_SUM0_SUS256_SKXCCM8_VWA1_VWB1_WGM1_WGMXCC1_WGMXCCGn1
    SolutionIndex: 47
    SolutionNameMin: Cijk_Alik_Bljk_HSS_BH_UserArgs_MT128x128x64_MI16x16x1_SN_LDSB1_CLR1_GSU0_GSUC0_GSUWGMRR0_K1_LBSPPA128_LBSPPB128_MIWT4_4_PLR1_SU32_SUM0_SUS256_SKXCCM8_VWA1_VWB1_WGM1_WGMXCC1_WGMXCCGn1
    SolutionIndex: 48
    SolutionNameMin: Cijk_Alik_Bljk_HSS_BH_UserArgs_MT128x128x64_MI16x16x1_SN_LDSB1_CLR1_GSU0_GSUC0_GSUWGMRR0_K1_LBSPPA512_LBSPPB128_MIWT4_4_PLR1_SU32_SUM0_SUS256_SKXCCM8_VWA4_VWB1_WGM1_WGMXCC1_WGMXCCGn1
    SolutionIndex: 49
    SolutionNameMin: Cijk_Alik_Bljk_HSS_BH_UserArgs_MT128x128x64_MI16x16x1_SN_LDSB1_CLR1_GSU0_GSUC0_GSUWGMRR0_K1_LBSPPA128_LBSPPB256_MIWT4_4_PLR1_SU32_SUM0_SUS256_SKXCCM8_VWA1_VWB2_WGM1_WGMXCC1_WGMXCCGn1
    SolutionIndex: 50
    SolutionNameMin: Cijk_Alik_Bljk_HSS_BH_UserArgs_MT128x128x64_MI16x16x1_SN_LDSB1_CLR1_GSU0_GSUC0_GSUWGMRR0_K1_LBSPPA256_LBSPPB256_MIWT4_4_PLR1_SU32_SUM0_SUS256_SKXCCM8_VWA2_VWB2_WGM1_WGMXCC1_WGMXCCGn1
    SolutionIndex: 51
    SolutionNameMin: Cijk_Alik_Bljk_HSS_BH_UserArgs_MT128x128x64_MI16x16x1_SN_LDSB1_CLR1_GSU0_GSUC0_GSUWGMRR0_K1_LBSPPA512_LBSPPB256_MIWT4_4_PLR1_SU32_SUM0_SUS256_SKXCCM8_VWA4_VWB2_WGM1_WGMXCC1_WGMXCCGn1
    SolutionIndex: 52
    SolutionNameMin: Cijk_Alik_Bljk_HSS_BH_UserArgs_MT128x128x64_MI16x16x1_SN_LDSB1_CLR1_GSU0_GSUC0_GSUWGMRR0_K1_LBSPPA128_LBSPPB512_MIWT4_4_PLR1_SU32_SUM0_SUS256_SKXCCM8_VWA1_VWB4_WGM1_WGMXCC1_WGMXCCGn1
    SolutionIndex: 53
    SolutionNameMin: Cijk_Alik_Bljk_HSS_BH_UserArgs_MT128x128x64_MI16x16x1_SN_LDSB1_CLR1_GSU0_GSUC0_GSUWGMRR0_K1_LBSPPA256_LBSPPB512_MIWT4_4_PLR1_SU32_SUM0_SUS256_SKXCCM8_VWA2_VWB4_WGM1_WGMXCC1_WGMXCCGn1
    SolutionIndex: 54
    SolutionNameMin: Cijk_Alik_Bljk_HSS_BH_UserArgs_MT128x128x64_MI16x16x1_SN_LDSB1_CLR1_GSU0_GSUC0_GSUWGMRR0_K1_LBSPPA512_LBSPPB512_MIWT4_4_PLR1_SU32_SUM0_SUS256_SKXCCM8_VWA4_VWB4_WGM1_WGMXCC1_WGMXCCGn1
    SolutionIndex: 55
    SolutionNameMin: Cijk_Alik_Bljk_HSS_BH_UserArgs_MT128x128x64_MI16x16x1_SN_LDSB1_CLR1_GSU0_GSUC0_GSUWGMRR0_K1_LBSPPA512_LBSPPB128_MIWT4_4_PLR1_SU32_SUM0_SUS256_SKXCCM8_VWA4_VWB1_WGM4_WGMXCC1_WGMXCCGn1
    SolutionIndex: 56
    SolutionNameMin: Cijk_Alik_Bljk_HSS_BH_UserArgs_MT128x128x64_MI16x16x1_SN_LDSB1_CLR1_GSU0_GSUC0_GSUWGMRR0_K1_LBSPPA128_LBSPPB256_MIWT4_4_PLR1_SU32_SUM0_SUS256_SKXCCM8_VWA1_VWB2_WGM4_WGMXCC1_WGMXCCGn1
    SolutionIndex: 57
    SolutionNameMin: Cijk_Alik_Bljk_HSS_BH_UserArgs_MT128x128x64_MI16x16x1_SN_LDSB1_CLR1_GSU0_GSUC0_GSUWGMRR0_K1_LBSPPA512_LBSPPB256_MIWT4_4_PLR1_SU32_SUM0_SUS256_SKXCCM8_VWA4_VWB2_WGM4_WGMXCC1_WGMXCCGn1
    SolutionIndex: 58
    SolutionNameMin: Cijk_Alik_Bljk_HSS_BH_UserArgs_MT128x128x64_MI16x16x1_SN_LDSB1_CLR1_GSU0_GSUC0_GSUWGMRR0_K1_LBSPPA512_LBSPPB512_MIWT4_4_PLR1_SU32_SUM0_SUS256_SKXCCM8_VWA4_VWB4_WGM4_WGMXCC1_WGMXCCGn1
    SolutionIndex: 59
    SolutionNameMin: Cijk_Alik_Bljk_HSS_BH_UserArgs_MT128x128x64_MI16x16x1_SN_LDSB1_CLR1_GSU0_GSUC0_GSUWGMRR0_K1_LBSPPA128_LBSPPB128_MIWT4_4_PLR1_SU32_SUM0_SUS256_SKXCCM8_VWA1_VWB1_WGM8_WGMXCC1_WGMXCCGn1
    SolutionIndex: 60
    SolutionNameMin: Cijk_Alik_Bljk_HSS_BH_UserArgs_MT128x128x64_MI16x16x1_SN_LDSB1_CLR1_GSU0_GSUC0_GSUWGMRR0_K1_LBSPPA256_LBSPPB128_MIWT4_4_PLR1_SU32_SUM0_SUS256_SKXCCM8_VWA2_VWB1_WGM8_WGMXCC1_WGMXCCGn1
    SolutionIndex: 61
    SolutionNameMin: Cijk_Alik_Bljk_HSS_BH_UserArgs_MT128x128x64_MI16x16x1_SN_LDSB1_CLR1_GSU0_GSUC0_GSUWGMRR0_K1_LBSPPA512_LBSPPB128_MIWT4_4_PLR1_SU32_SUM0_SUS256_SKXCCM8_VWA4_VWB1_WGM8_WGMXCC1_WGMXCCGn1
    SolutionIndex: 62
    SolutionNameMin: Cijk_Alik_Bljk_HSS_BH_UserArgs_MT128x128x64_MI16x16x1_SN_LDSB1_CLR1_GSU0_GSUC0_GSUWGMRR0_K1_LBSPPA128_LBSPPB256_MIWT4_4_PLR1_SU32_SUM0_SUS256_SKXCCM8_VWA1_VWB2_WGM8_WGMXCC1_WGMXCCGn1
    SolutionIndex: 63
    SolutionNameMin: Cijk_Alik_Bljk_HSS_BH_UserArgs_MT128x128x64_MI16x16x1_SN_LDSB1_CLR1_GSU0_GSUC0_GSUWGMRR0_K1_LBSPPA256_LBSPPB256_MIWT4_4_PLR1_SU32_SUM0_SUS256_SKXCCM8_VWA2_VWB2_WGM8_WGMXCC1_WGMXCCGn1
    SolutionIndex: 64
    SolutionNameMin: Cijk_Alik_Bljk_HSS_BH_UserArgs_MT128x128x64_MI16x16x1_SN_LDSB1_CLR1_GSU0_GSUC0_GSUWGMRR0_K1_LBSPPA512_LBSPPB256_MIWT4_4_PLR1_SU32_SUM0_SUS256_SKXCCM8_VWA4_VWB2_WGM8_WGMXCC1_WGMXCCGn1
    SolutionIndex: 65
    SolutionNameMin: Cijk_Alik_Bljk_HSS_BH_UserArgs_MT128x128x64_MI16x16x1_SN_LDSB1_CLR1_GSU0_GSUC0_GSUWGMRR0_K1_LBSPPA512_LBSPPB512_MIWT4_4_PLR1_SU32_SUM0_SUS256_SKXCCM8_VWA4_VWB4_WGM8_WGMXCC1_WGMXCCGn1
    SolutionIndex: 66
    SolutionNameMin: Cijk_Alik_Bljk_HSS_BH_UserArgs_MT64x128x64_MI16x16x1_SN_LDSB1_CLR1_GSU0_GSUC0_GSUWGMRR0_K1_LBSPPA128_LBSPPB128_MIWT2_4_PLR1_SU32_SUM0_SUS256_SKXCCM8_VWA1_VWB1_WGM1_WGMXCC1_WGMXCCGn1
    SolutionIndex: 67
    SolutionNameMin: Cijk_Alik_Bljk_HSS_BH_UserArgs_MT64x128x64_MI16x16x1_SN_LDSB1_CLR1_GSU0_GSUC0_GSUWGMRR0_K1_LBSPPA128_LBSPPB256_MIWT2_4_PLR1_SU32_SUM0_SUS256_SKXCCM8_VWA1_VWB2_WGM1_WGMXCC1_WGMXCCGn1
    SolutionIndex: 68
    SolutionNameMin: Cijk_Alik_Bljk_HSS_BH_UserArgs_MT64x128x64_MI16x16x1_SN_LDSB1_CLR1_GSU0_GSUC0_GSUWGMRR0_K1_LBSPPA128_LBSPPB512_MIWT2_4_PLR1_SU32_SUM0_SUS256_SKXCCM8_VWA1_VWB4_WGM1_WGMXCC1_WGMXCCGn1
    SolutionIndex: 69
    SolutionNameMin: Cijk_Alik_Bljk_HSS_BH_UserArgs_MT64x128x64_MI16x16x1_SN_LDSB1_CLR1_GSU0_GSUC0_GSUWGMRR0_K1_LBSPPA128_LBSPPB128_MIWT2_4_PLR1_SU32_SUM0_SUS256_SKXCCM8_VWA1_VWB1_WGM4_WGMXCC1_WGMXCCGn1
    SolutionIndex: 70
    SolutionNameMin: Cijk_Alik_Bljk_HSS_BH_UserArgs_MT64x128x64_MI16x16x1_SN_LDSB1_CLR1_GSU0_GSUC0_GSUWGMRR0_K1_LBSPPA128_LBSPPB256_MIWT2_4_PLR1_SU32_SUM0_SUS256_SKXCCM8_VWA1_VWB2_WGM4_WGMXCC1_WGMXCCGn1
    SolutionIndex: 71
    SolutionNameMin: Cijk_Alik_Bljk_HSS_BH_UserArgs_MT64x128x64_MI16x16x1_SN_LDSB1_CLR1_GSU0_GSUC0_GSUWGMRR0_K1_LBSPPA128_LBSPPB512_MIWT2_4_PLR1_SU32_SUM0_SUS256_SKXCCM8_VWA1_VWB4_WGM4_WGMXCC1_WGMXCCGn1
    SolutionIndex: 72
    SolutionNameMin: Cijk_Alik_Bljk_HSS_BH_UserArgs_MT64x128x64_MI16x16x1_SN_LDSB1_CLR1_GSU0_GSUC0_GSUWGMRR0_K1_LBSPPA128_LBSPPB128_MIWT2_4_PLR1_SU32_SUM0_SUS256_SKXCCM8_VWA1_VWB1_WGM8_WGMXCC1_WGMXCCGn1
    SolutionIndex: 73
    SolutionNameMin: Cijk_Alik_Bljk_HSS_BH_UserArgs_MT128x64x64_MI16x16x1_SN_LDSB1_CLR1_GSU0_GSUC0_GSUWGMRR0_K1_LBSPPA512_LBSPPB128_MIWT4_2_PLR1_SU32_SUM0_SUS256_SKXCCM8_VWA4_VWB1_WGM1_WGMXCC1_WGMXCCGn1
    SolutionIndex: 74
    SolutionNameMin: Cijk_Alik_Bljk_HSS_BH_UserArgs_MT128x64x64_MI16x16x1_SN_LDSB1_CLR1_GSU0_GSUC0_GSUWGMRR0_K1_LBSPPA512_LBSPPB256_MIWT4_2_PLR1_SU32_SUM0_SUS256_SKXCCM8_VWA4_VWB2_WGM1_WGMXCC1_WGMXCCGn1
    SolutionIndex: 75
    SolutionNameMin: Cijk_Alik_Bljk_HSS_BH_UserArgs_MT128x64x64_MI16x16x1_SN_LDSB1_CLR1_GSU0_GSUC0_GSUWGMRR0_K1_LBSPPA128_LBSPPB128_MIWT4_2_PLR1_SU32_SUM0_SUS256_SKXCCM8_VWA1_VWB1_WGM4_WGMXCC1_WGMXCCGn1
    SolutionIndex: 76
    SolutionNameMin: Cijk_Alik_Bljk_HSS_BH_UserArgs_MT128x64x64_MI16x16x1_SN_LDSB1_CLR1_GSU0_GSUC0_GSUWGMRR0_K1_LBSPPA512_LBSPPB128_MIWT4_2_PLR1_SU32_SUM0_SUS256_SKXCCM8_VWA4_VWB1_WGM4_WGMXCC1_WGMXCCGn1
    SolutionIndex: 77
    SolutionNameMin: Cijk_Alik_Bljk_HSS_BH_UserArgs_MT128x64x64_MI16x16x1_SN_LDSB1_CLR1_GSU0_GSUC0_GSUWGMRR0_K1_LBSPPA128_LBSPPB256_MIWT4_2_PLR1_SU32_SUM0_SUS256_SKXCCM8_VWA1_VWB2_WGM4_WGMXCC1_WGMXCCGn1
    SolutionIndex: 78
    SolutionNameMin: Cijk_Alik_Bljk_HSS_BH_UserArgs_MT128x64x64_MI16x16x1_SN_LDSB1_CLR1_GSU0_GSUC0_GSUWGMRR0_K1_LBSPPA512_LBSPPB256_MIWT4_2_PLR1_SU32_SUM0_SUS256_SKXCCM8_VWA4_VWB2_WGM4_WGMXCC1_WGMXCCGn1
    SolutionIndex: 79
    SolutionNameMin: Cijk_Alik_Bljk_HSS_BH_UserArgs_MT128x64x64_MI16x16x1_SN_LDSB1_CLR1_GSU0_GSUC0_GSUWGMRR0_K1_LBSPPA128_LBSPPB128_MIWT4_2_PLR1_SU32_SUM0_SUS256_SKXCCM8_VWA1_VWB1_WGM8_WGMXCC1_WGMXCCGn1
    SolutionIndex: 80
    SolutionNameMin: Cijk_Alik_Bljk_HSS_BH_UserArgs_MT128x64x64_MI16x16x1_SN_LDSB1_CLR1_GSU0_GSUC0_GSUWGMRR0_K1_LBSPPA512_LBSPPB128_MIWT4_2_PLR1_SU32_SUM0_SUS256_SKXCCM8_VWA4_VWB1_WGM8_WGMXCC1_WGMXCCGn1
    SolutionIndex: 81
    SolutionNameMin: Cijk_Alik_Bljk_HSS_BH_UserArgs_MT64x64x64_MI16x16x1_SN_LDSB1_CLR1_GSU0_GSUC0_GSUWGMRR0_K1_LBSPPA128_LBSPPB128_MIWT2_2_PLR1_SU32_SUM0_SUS256_SKXCCM8_VWA1_VWB1_WGM1_WGMXCC1_WGMXCCGn1
    SolutionIndex: 82
    SolutionNameMin: Cijk_Alik_Bljk_HSS_BH_UserArgs_MT64x64x64_MI16x16x1_SN_LDSB1_CLR1_GSU0_GSUC0_GSUWGMRR0_K1_LBSPPA128_LBSPPB256_MIWT2_2_PLR1_SU32_SUM0_SUS256_SKXCCM8_VWA1_VWB2_WGM1_WGMXCC1_WGMXCCGn1
    SolutionIndex: 83
    SolutionNameMin: Cijk_Alik_Bljk_HSS_BH_UserArgs_MT64x64x64_MI16x16x1_SN_LDSB1_CLR1_GSU0_GSUC0_GSUWGMRR0_K1_LBSPPA128_LBSPPB128_MIWT2_2_PLR1_SU32_SUM0_SUS256_SKXCCM8_VWA1_VWB1_WGM4_WGMXCC1_WGMXCCGn1
    SolutionIndex: 84
    SolutionNameMin: Cijk_Alik_Bljk_HSS_BH_UserArgs_MT64x64x64_MI16x16x1_SN_LDSB1_CLR1_GSU0_GSUC0_GSUWGMRR0_K1_LBSPPA128_LBSPPB128_MIWT2_2_PLR1_SU32_SUM0_SUS256_SKXCCM8_VWA1_VWB1_WGM8_WGMXCC1_WGMXCCGn1
    SolutionIndex: 85
    SolutionNameMin: Cijk_Alik_Bljk_HSS_BH_UserArgs_MT64x64x64_MI16x16x1_SN_LDSB1_CLR1_GSU0_GSUC0_GSUWGMRR0_K1_LBSPPA128_LBSPPB256_MIWT2_2_PLR1_SU32_SUM0_SUS256_SKXCCM8_VWA1_VWB2_WGM8_WGMXCC1_WGMXCCGn1
    SolutionIndex: 86
    SolutionNameMin: Cijk_Alik_Bljk_HSS_BH_UserArgs_MT32x64x64_MI16x16x1_SN_LDSB0_CLR1_GSU0_GSUC0_GSUWGMRR0_K1_LBSPPA128_LBSPPB128_MIWT1_2_PLR1_SU32_SUM0_SUS256_SKXCCM8_VWA1_VWB1_WGM1_WGMXCC1_WGMXCCGn1
    SolutionIndex: 87
    SolutionNameMin: Cijk_Alik_Bljk_HSS_BH_UserArgs_MT32x64x64_MI16x16x1_SN_LDSB0_CLR1_GSU0_GSUC0_GSUWGMRR0_K1_LBSPPA128_LBSPPB256_MIWT1_2_PLR1_SU32_SUM0_SUS256_SKXCCM8_VWA1_VWB2_WGM1_WGMXCC1_WGMXCCGn1
    SolutionIndex: 88
    SolutionNameMin: Cijk_Alik_Bljk_HSS_BH_UserArgs_MT32x64x64_MI16x16x1_SN_LDSB0_CLR1_GSU0_GSUC0_GSUWGMRR0_K1_LBSPPA128_LBSPPB256_MIWT1_2_PLR1_SU32_SUM0_SUS256_SKXCCM8_VWA1_VWB2_WGM4_WGMXCC1_WGMXCCGn1
    SolutionIndex: 89
    SolutionNameMin: Cijk_Alik_Bljk_HSS_BH_UserArgs_MT64x32x64_MI16x16x1_SN_LDSB0_CLR1_GSU0_GSUC0_GSUWGMRR0_K1_LBSPPA128_LBSPPB128_MIWT2_1_PLR1_SU32_SUM0_SUS256_SKXCCM8_VWA1_VWB1_WGM1_WGMXCC1_WGMXCCGn1
    SolutionIndex: 90
    SolutionNameMin: Cijk_Alik_Bljk_HSS_BH_UserArgs_MT32x32x64_MI16x16x1_SN_LDSB0_CLR1_GSU0_GSUC0_GSUWGMRR0_K1_LBSPPA128_LBSPPB128_MIWT1_1_PLR1_SU32_SUM0_SUS256_SKXCCM8_VWA1_VWB1_WGM1_WGMXCC1_WGMXCCGn1
    SolutionIndex: 91
    SolutionNameMin: Cijk_Alik_Bljk_HSS_BH_UserArgs_MT32x32x64_MI16x16x1_SN_LDSB0_CLR1_GSU0_GSUC0_GSUWGMRR0_K1_LBSPPA128_LBSPPB128_MIWT1_1_PLR2_SU32_SUM0_SUS256_SKXCCM8_VWA1_VWB1_WGM1_WGMXCC1_WGMXCCGn1
    SolutionIndex: 92
    SolutionNameMin: Cijk_Alik_Bljk_HSS_BH_UserArgs_MT32x32x64_MI16x16x1_SN_LDSB0_CLR1_GSU0_GSUC0_GSUWGMRR0_K1_LBSPPA128_LBSPPB128_MIWT1_1_PLR1_SU32_SUM0_SUS256_SKXCCM8_VWA1_VWB1_WGM4_WGMXCC1_WGMXCCGn1
    SolutionIndex: 93
    SolutionNameMin: Cijk_Alik_Bljk_HSS_BH_UserArgs_MT64x64x128_MI16x16x1_SN_LDSB1_CLR1_GSU0_GSUC0_GSUWGMRR0_K1_LBSPPA256_LBSPPB256_MIWT2_2_PLR1_SU32_SUM0_SUS256_SKXCCM8_VWA1_VWB1_WGM1_WGMXCC1_WGMXCCGn1
    SolutionIndex: 94
    SolutionNameMin: Cijk_Alik_Bljk_HSS_BH_UserArgs_MT64x64x128_MI16x16x1_SN_LDSB1_CLR1_GSU0_GSUC0_GSUWGMRR0_K1_LBSPPA512_LBSPPB256_MIWT2_2_PLR1_SU32_SUM0_SUS256_SKXCCM8_VWA2_VWB1_WGM1_WGMXCC1_WGMXCCGn1
    SolutionIndex: 95
    SolutionNameMin: Cijk_Alik_Bljk_HSS_BH_UserArgs_MT64x64x128_MI16x16x1_SN_LDSB1_CLR1_GSU0_GSUC0_GSUWGMRR0_K1_LBSPPA256_LBSPPB512_MIWT2_2_PLR1_SU32_SUM0_SUS256_SKXCCM8_VWA1_VWB2_WGM1_WGMXCC1_WGMXCCGn1
    SolutionIndex: 96
    SolutionNameMin: Cijk_Alik_Bljk_HSS_BH_UserArgs_MT64x64x128_MI16x16x1_SN_LDSB1_CLR1_GSU0_GSUC0_GSUWGMRR0_K1_LBSPPA256_LBSPPB256_MIWT2_2_PLR2_SU32_SUM0_SUS256_SKXCCM8_VWA1_VWB1_WGM1_WGMXCC1_WGMXCCGn1
    SolutionIndex: 97
    SolutionNameMin: Cijk_Alik_Bljk_HSS_BH_UserArgs_MT64x64x128_MI16x16x1_SN_LDSB1_CLR1_GSU0_GSUC0_GSUWGMRR0_K1_LBSPPA256_LBSPPB512_MIWT2_2_PLR2_SU32_SUM0_SUS256_SKXCCM8_VWA1_VWB2_WGM1_WGMXCC1_WGMXCCGn1
    SolutionIndex: 98
    SolutionNameMin: Cijk_Alik_Bljk_HSS_BH_UserArgs_MT64x64x128_MI16x16x1_SN_LDSB1_CLR1_GSU0_GSUC0_GSUWGMRR0_K1_LBSPPA256_LBSPPB512_MIWT2_2_PLR1_SU32_SUM0_SUS256_SKXCCM8_VWA1_VWB2_WGM4_WGMXCC1_WGMXCCGn1
    SolutionIndex: 99
    SolutionNameMin: Cijk_Alik_Bljk_HSS_BH_UserArgs_MT64x64x128_MI16x16x1_SN_LDSB1_CLR1_GSU0_GSUC0_GSUWGMRR0_K1_LBSPPA256_LBSPPB512_MIWT2_2_PLR2_SU32_SUM0_SUS256_SKXCCM8_VWA1_VWB2_WGM4_WGMXCC1_WGMXCCGn1
    SolutionIndex: 100
    SolutionNameMin: Cijk_Alik_Bljk_HSS_BH_UserArgs_MT64x64x128_MI16x16x1_SN_LDSB1_CLR1_GSU0_GSUC0_GSUWGMRR0_K1_LBSPPA256_LBSPPB256_MIWT2_2_PLR1_SU32_SUM0_SUS256_SKXCCM8_VWA1_VWB1_WGM8_WGMXCC1_WGMXCCGn1
    SolutionIndex: 101
    SolutionNameMin: Cijk_Alik_Bljk_HSS_BH_UserArgs_MT64x64x128_MI16x16x1_SN_LDSB1_CLR1_GSU0_GSUC0_GSUWGMRR0_K1_LBSPPA256_LBSPPB512_MIWT2_2_PLR1_SU32_SUM0_SUS256_SKXCCM8_VWA1_VWB2_WGM8_WGMXCC1_WGMXCCGn1
    SolutionIndex: 102
    SolutionNameMin: Cijk_Alik_Bljk_HSS_BH_UserArgs_MT64x64x128_MI16x16x1_SN_LDSB1_CLR1_GSU0_GSUC0_GSUWGMRR0_K1_LBSPPA512_LBSPPB256_MIWT2_2_PLR2_SU32_SUM0_SUS256_SKXCCM8_VWA2_VWB1_WGM8_WGMXCC1_WGMXCCGn1
    SolutionIndex: 103
    SolutionNameMin: Cijk_Alik_Bljk_HSS_BH_UserArgs_MT32x64x128_MI16x16x1_SN_LDSB1_CLR1_GSU0_GSUC0_GSUWGMRR0_K1_LBSPPA256_LBSPPB256_MIWT1_2_PLR1_SU32_SUM0_SUS256_SKXCCM8_VWA1_VWB1_WGM1_WGMXCC1_WGMXCCGn1
    SolutionIndex: 104
    SolutionNameMin: Cijk_Alik_Bljk_HSS_BH_UserArgs_MT32x64x128_MI16x16x1_SN_LDSB1_CLR1_GSU0_GSUC0_GSUWGMRR0_K1_LBSPPA256_LBSPPB256_MIWT1_2_PLR2_SU32_SUM0_SUS256_SKXCCM8_VWA1_VWB1_WGM1_WGMXCC1_WGMXCCGn1
    SolutionIndex: 105
    SolutionNameMin: Cijk_Alik_Bljk_HSS_BH_UserArgs_MT32x64x128_MI16x16x1_SN_LDSB1_CLR1_GSU0_GSUC0_GSUWGMRR0_K1_LBSPPA256_LBSPPB512_MIWT1_2_PLR2_SU32_SUM0_SUS256_SKXCCM8_VWA1_VWB2_WGM4_WGMXCC1_WGMXCCGn1
    SolutionIndex: 106
    SolutionNameMin: Cijk_Alik_Bljk_HSS_BH_UserArgs_MT64x32x128_MI16x16x1_SN_LDSB1_CLR1_GSU0_GSUC0_GSUWGMRR0_K1_LBSPPA512_LBSPPB256_MIWT2_1_PLR2_SU32_SUM0_SUS256_SKXCCM8_VWA2_VWB1_WGM1_WGMXCC1_WGMXCCGn1
    SolutionIndex: 107
    SolutionNameMin: Cijk_Alik_Bljk_HSS_BH_UserArgs_MT64x32x128_MI16x16x1_SN_LDSB1_CLR1_GSU0_GSUC0_GSUWGMRR0_K1_LBSPPA256_LBSPPB256_MIWT2_1_PLR2_SU32_SUM0_SUS256_SKXCCM8_VWA1_VWB1_WGM4_WGMXCC1_WGMXCCGn1
    SolutionIndex: 108
    SolutionNameMin: Cijk_Alik_Bljk_HSS_BH_UserArgs_MT32x32x128_MI16x16x1_SN_LDSB1_CLR1_GSU0_GSUC0_GSUWGMRR0_K1_LBSPPA256_LBSPPB256_MIWT1_1_PLR1_SU32_SUM0_SUS256_SKXCCM8_VWA1_VWB1_WGM1_WGMXCC1_WGMXCCGn1
    SolutionIndex: 109
    SolutionNameMin: Cijk_Alik_Bljk_HSS_BH_UserArgs_MT32x32x128_MI16x16x1_SN_LDSB1_CLR1_GSU0_GSUC0_GSUWGMRR0_K1_LBSPPA256_LBSPPB256_MIWT1_1_PLR2_SU32_SUM0_SUS256_SKXCCM8_VWA1_VWB1_WGM1_WGMXCC1_WGMXCCGn1
    SolutionIndex: 110
    SolutionNameMin: Cijk_Alik_Bljk_HSS_BH_UserArgs_MT32x32x128_MI16x16x1_SN_LDSB1_CLR1_GSU0_GSUC0_GSUWGMRR0_K1_LBSPPA256_LBSPPB256_MIWT1_1_PLR2_SU32_SUM0_SUS256_SKXCCM8_VWA1_VWB1_WGM4_WGMXCC1_WGMXCCGn1
    SolutionIndex: 111
    SolutionNameMin: Cijk_Alik_Bljk_HSS_BH_UserArgs_MT32x32x128_MI16x16x1_SN_LDSB1_CLR1_GSU0_GSUC0_GSUWGMRR0_K1_LBSPPA256_LBSPPB256_MIWT1_1_PLR2_SU32_SUM0_SUS256_SKXCCM8_VWA1_VWB1_WGM8_WGMXCC1_WGMXCCGn1
    SolutionIndex: 112
    SolutionNameMin: Cijk_Alik_Bljk_HSS_BH_UserArgs_MT32x32x32_MI16x16x1_SN_LDSB0_CLR0_GSU0_GSUC0_GSUWGMRR0_K1_LBSPPA128_LBSPPB128_MIWT1_1_PLR0_SU32_SUM0_SUS256_SKXCCM8_VWA1_VWB1_WGM8_WGMXCC1_WGMXCCGn1
- - - [128, 128, 1, 128, 128, 128, 128, 128]
    - [90, 0.092]
  - - [128, 128, 1, 256, 128, 128, 256, 256]
    - [38, 0.169]
  - - [128, 128, 1, 512, 128, 128, 512, 512]
    - [23, 0.294]
  - - [128, 128, 1, 1024, 128, 128, 1024, 1024]
    - [39, 0.466]
  - - [128, 128, 1, 2048, 128, 128, 2048, 2048]
    - [39, 0.667]
  - - [128, 128, 1, 4096, 128, 128, 4096, 4096]
    - [90, 1.17]
  - - [128, 128, 1, 8192, 128, 128, 8192, 8192]
    - [109, 1.851]
  - - [128, 256, 1, 128, 128, 128, 128, 128]
    - [90, 0.188]
  - - [128, 256, 1, 256, 128, 128, 256, 256]
    - [23, 0.35]
  - - [128, 256, 1, 512, 128, 128, 512, 512]
    - [109, 0.592]
  - - [128, 256, 1, 1024, 128, 128, 1024, 1024]
    - [109, 0.946]
  - - [128, 256, 1, 2048, 128, 128, 2048, 2048]
    - [108, 1.325]
  - - [128, 256, 1, 4096, 128, 128, 4096, 4096]
    - [90, 2.264]
  - - [128, 256, 1, 8192, 128, 128, 8192, 8192]
    - [109, 3.664]
  - - [128, 512, 1, 128, 128, 128, 128, 128]
    - [91, 0.364]
  - - [128, 512, 1, 256, 128, 128, 256, 256]
    - [90, 0.684]
  - - [128, 512, 1, 512, 128, 128, 512, 512]
    - [23, 1.187]
  - - [128, 512, 1, 1024, 128, 128, 1024, 1024]
    - [111, 1.823]
  - - [128, 512, 1, 2048, 128, 128, 2048, 2048]
    - [109, 2.554]
  - - [128, 512, 1, 4096, 128, 128, 4096, 4096]
    - [92, 4.371]
  - - [128, 512, 1, 8192, 128, 128, 8192, 8192]
    - [109, 6.995]
  - - [128, 1024, 1, 128, 128, 128, 128, 128]
    - [23, 0.721]
  - - [128, 1024, 1, 256, 128, 128, 256, 256]
    - [109, 1.322]
  - - [128, 1024, 1, 512, 128, 128, 512, 512]
    - [90, 2.318]
  - - [128, 1024, 1, 1024, 128, 128, 1024, 1024]
    - [38, 3.716]
  - - [128, 1024, 1, 2048, 128, 128, 2048, 2048]
    - [90, 4.953]
  - - [128, 1024, 1, 4096, 128, 128, 4096, 4096]
    - [40, 7.579]
  - - [128, 1024, 1, 8192, 128, 128, 8192, 8192]
    - [37, 10.379]
  - - [128, 2048, 1, 128, 128, 128, 128, 128]
    - [109, 1.383]
  - - [128, 2048, 1, 256, 128, 128, 256, 256]
    - [90, 2.596]
  - - [128, 2048, 1, 512, 128, 128, 512, 512]
    - [108, 4.284]
  - - [128, 2048, 1, 1024, 128, 128, 1024, 1024]
    - [109, 7.11]
  - - [128, 2048, 1, 2048, 128, 128, 2048, 2048]
    - [90, 9.554]
  - - [128, 2048, 1, 4096, 128, 128, 4096, 4096]
    - [37, 11.036]
  - - [128, 2048, 1, 8192, 128, 128, 8192, 8192]
    - [30, 13.631]
  - - [128, 4096, 1, 128, 128, 128, 128, 128]
    - [46, 2.403]
  - - [128, 4096, 1, 256, 128, 128, 256, 256]
    - [106, 4.372]
  - - [128, 4096, 1, 512, 128, 128, 512, 512]
    - [86, 7.648]
  - - [128, 4096, 1, 1024, 128, 128, 1024, 1024]
    - [89, 10.532]
  - - [128, 4096, 1, 2048, 128, 128, 2048, 2048]
    - [106, 12.773]
  - - [128, 4096, 1, 4096, 128, 128, 4096, 4096]
    - [28, 14.481]
  - - [128, 4096, 1, 8192, 128, 128, 8192, 8192]
    - [17, 16.38]
  - - [128, 8192, 1, 128, 128, 128, 128, 128]
    - [45, 3.967]
  - - [128, 8192, 1, 256, 128, 128, 256, 256]
    - [84, 7.135]
  - - [128, 8192, 1, 512, 128, 128, 512, 512]
    - [81, 11.326]
  - - [128, 8192, 1, 1024, 128, 128, 1024, 1024]
    - [96, 15.345]
  - - [128, 8192, 1, 2048, 128, 128, 2048, 2048]
    - [94, 16.287]
  - - [128, 8192, 1, 4096, 128, 128, 4096, 4096]
    - [55, 18.572]
  - - [128, 8192, 1, 8192, 128, 128, 8192, 8192]
    - [8, 21.705]
  - - [256, 128, 1, 128, 256, 256, 128, 128]
    - [91, 0.186]
  - - [256, 128, 1, 256, 256, 256, 256, 256]
    - [90, 0.346]
  - - [256, 128, 1, 512, 256, 256, 512, 512]
    - [90, 0.602]
  - - [256, 128, 1, 1024, 256, 256, 1024, 1024]
    - [108, 0.946]
  - - [256, 128, 1, 2048, 256, 256, 2048, 2048]
    - [39, 1.31]
  - - [256, 128, 1, 4096, 256, 256, 4096, 4096]
    - [90, 2.242]
  - - [256, 128, 1, 8192, 256, 256, 8192, 8192]
    - [109, 3.652]
  - - [256, 256, 1, 128, 256, 256, 128, 128]
    - [90, 0.368]
  - - [256, 256, 1, 256, 256, 256, 256, 256]
    - [23, 0.678]
  - - [256, 256, 1, 512, 256, 256, 512, 512]
    - [108, 1.174]
  - - [256, 256, 1, 1024, 256, 256, 1024, 1024]
    - [38, 1.877]
  - - [256, 256, 1, 2048, 256, 256, 2048, 2048]
    - [109, 2.581]
  - - [256, 256, 1, 4096, 256, 256, 4096, 4096]
    - [90, 4.43]
  - - [256, 256, 1, 8192, 256, 256, 8192, 8192]
    - [110, 6.88]
  - - [256, 512, 1, 128, 256, 256, 128, 128]
    - [23, 0.73]
  - - [256, 512, 1, 256, 256, 256, 256, 256]
    - [90, 1.339]
  - - [256, 512, 1, 512, 256, 256, 512, 512]
    - [90, 2.315]
  - - [256, 512, 1, 1024, 256, 256, 1024, 1024]
    - [38, 3.565]
  - - [256, 512, 1, 2048, 256, 256, 2048, 2048]
    - [90, 4.923]
  - - [256, 512, 1, 4096, 256, 256, 4096, 4096]
    - [38, 7.569]
  - - [256, 512, 1, 8192, 256, 256, 8192, 8192]
    - [36, 10.039]
  - - [256, 1024, 1, 128, 256, 256, 128, 128]
    - [23, 1.395]
  - - [256, 1024, 1, 256, 256, 256, 256, 256]
    - [90, 2.602]
  - - [256, 1024, 1, 512, 256, 256, 512, 512]
    - [90, 4.368]
  - - [256, 1024, 1, 1024, 256, 256, 1024, 1024]
    - [109, 7.065]
  - - [256, 1024, 1, 2048, 256, 256, 2048, 2048]
    - [109, 9.603]
  - - [256, 1024, 1, 4096, 256, 256, 4096, 4096]
    - [106, 11.173]
  - - [256, 1024, 1, 8192, 256, 256, 8192, 8192]
    - [25, 14.291]
  - - [256, 2048, 1, 128, 256, 256, 128, 128]
    - [87, 2.48]
  - - [256, 2048, 1, 256, 256, 256, 256, 256]
    - [21, 4.51]
  - - [256, 2048, 1, 512, 256, 256, 512, 512]
    - [86, 7.605]
  - - [256, 2048, 1, 1024, 256, 256, 1024, 1024]
    - [35, 10.341]
  - - [256, 2048, 1, 2048, 256, 256, 2048, 2048]
    - [104, 12.859]
  - - [256, 2048, 1, 4096, 256, 256, 4096, 4096]
    - [29, 15.094]
  - - [256, 2048, 1, 8192, 256, 256, 8192, 8192]
    - [80, 16.184]
  - - [256, 4096, 1, 128, 256, 256, 128, 128]
    - [81, 4.098]
  - - [256, 4096, 1, 256, 256, 256, 256, 256]
    - [81, 7.258]
  - - [256, 4096, 1, 512, 256, 256, 512, 512]
    - [84, 10.925]
  - - [256, 4096, 1, 1024, 256, 256, 1024, 1024]
    - [96, 15.372]
  - - [256, 4096, 1, 2048, 256, 256, 2048, 2048]
    - [95, 17.96]
  - - [256, 4096, 1, 4096, 256, 256, 4096, 4096]
    - [54, 19.451]
  - - [256, 4096, 1, 8192, 256, 256, 8192, 8192]
    - [51, 21.284]
  - - [256, 8192, 1, 128, 256, 256, 128, 128]
    - [68, 6.024]
  - - [256, 8192, 1, 256, 256, 256, 256, 256]
    - [80, 10.16]
  - - [256, 8192, 1, 512, 256, 256, 512, 512]
    - [73, 14.751]
  - - [256, 8192, 1, 1024, 256, 256, 1024, 1024]
    - [76, 18.506]
  - - [256, 8192, 1, 2048, 256, 256, 2048, 2048]
    - [77, 20.365]
  - - [256, 8192, 1, 4096, 256, 256, 4096, 4096]
    - [61, 23.177]
  - - [256, 8192, 1, 8192, 256, 256, 8192, 8192]
    - [12, 24.661]
  - - [512, 128, 1, 128, 512, 512, 128, 128]
    - [108, 0.36]
  - - [512, 128, 1, 256, 512, 512, 256, 256]
    - [23, 0.681]
  - - [512, 128, 1, 512, 512, 512, 512, 512]
    - [90, 1.183]
  - - [512, 128, 1, 1024, 512, 512, 1024, 1024]
    - [38, 1.873]
  - - [512, 128, 1, 2048, 512, 512, 2048, 2048]
    - [109, 2.603]
  - - [512, 128, 1, 4096, 512, 512, 4096, 4096]
    - [90, 4.446]
  - - [512, 128, 1, 8192, 512, 512, 8192, 8192]
    - [110, 6.901]
  - - [512, 256, 1, 128, 512, 512, 128, 128]
    - [23, 0.728]
  - - [512, 256, 1, 256, 512, 512, 256, 256]
    - [90, 1.363]
  - - [512, 256, 1, 512, 512, 512, 512, 512]
    - [90, 2.344]
  - - [512, 256, 1, 1024, 512, 512, 1024, 1024]
    - [38, 3.658]
  - - [512, 256, 1, 2048, 512, 512, 2048, 2048]
    - [90, 4.921]
  - - [512, 256, 1, 4096, 512, 512, 4096, 4096]
    - [38, 7.575]
  - - [512, 256, 1, 8192, 512, 512, 8192, 8192]
    - [34, 10.011]
  - - [512, 512, 1, 128, 512, 512, 128, 128]
    - [90, 1.401]
  - - [512, 512, 1, 256, 512, 512, 256, 256]
    - [90, 2.578]
  - - [512, 512, 1, 512, 512, 512, 512, 512]
    - [23, 4.236]
  - - [512, 512, 1, 1024, 512, 512, 1024, 1024]
    - [38, 7.07]
  - - [512, 512, 1, 2048, 512, 512, 2048, 2048]
    - [23, 9.552]
  - - [512, 512, 1, 4096, 512, 512, 4096, 4096]
    - [107, 11.03]
  - - [512, 512, 1, 8192, 512, 512, 8192, 8192]
    - [26, 14.738]
  - - [512, 1024, 1, 128, 512, 512, 128, 128]
    - [87, 2.497]
  - - [512, 1024, 1, 256, 512, 512, 256, 256]
    - [87, 4.431]
  - - [512, 1024, 1, 512, 512, 512, 512, 512]
    - [86, 7.613]
  - - [512, 1024, 1, 1024, 512, 512, 1024, 1024]
    - [22, 10.534]
  - - [512, 1024, 1, 2048, 512, 512, 2048, 2048]
    - [87, 12.841]
  - - [512, 1024, 1, 4096, 512, 512, 4096, 4096]
    - [30, 15.777]
  - - [512, 1024, 1, 8192, 512, 512, 8192, 8192]
    - [100, 16.28]
  - - [512, 2048, 1, 128, 512, 512, 128, 128]
    - [82, 4.076]
  - - [512, 2048, 1, 256, 512, 512, 256, 256]
    - [81, 7.197]
  - - [512, 2048, 1, 512, 512, 512, 512, 512]
    - [82, 11.321]
  - - [512, 2048, 1, 1024, 512, 512, 1024, 1024]
    - [93, 15.298]
  - - [512, 2048, 1, 2048, 512, 512, 2048, 2048]
    - [97, 18.017]
  - - [512, 2048, 1, 4096, 512, 512, 4096, 4096]
    - [57, 19.228]
  - - [512, 2048, 1, 8192, 512, 512, 8192, 8192]
    - [65, 21.241]
  - - [512, 4096, 1, 128, 512, 512, 128, 128]
    - [68, 6.105]
  - - [512, 4096, 1, 256, 512, 512, 256, 256]
    - [74, 10.336]
  - - [512, 4096, 1, 512, 512, 512, 512, 512]
    - [73, 15.031]
  - - [512, 4096, 1, 1024, 512, 512, 1024, 1024]
    - [73, 19.788]
  - - [512, 4096, 1, 2048, 512, 512, 2048, 2048]
    - [75, 20.577]
  - - [512, 4096, 1, 4096, 512, 512, 4096, 4096]
    - [64, 23.287]
  - - [512, 4096, 1, 8192, 512, 512, 8192, 8192]
    - [48, 24.697]
  - - [512, 8192, 1, 128, 512, 512, 128, 128]
    - [41, 7.897]
  - - [512, 8192, 1, 256, 512, 512, 256, 256]
    - [54, 12.07]
  - - [512, 8192, 1, 512, 512, 512, 512, 512]
    - [61, 17.475]
  - - [512, 8192, 1, 1024, 512, 512, 1024, 1024]
    - [48, 21.576]
  - - [512, 8192, 1, 2048, 512, 512, 2048, 2048]
    - [47, 26.067]
  - - [512, 8192, 1, 4096, 512, 512, 4096, 4096]
    - [64, 25.495]
  - - [512, 8192, 1, 8192, 512, 512, 8192, 8192]
    - [1, 24.519]
  - - [1024, 128, 1, 128, 1024, 1024, 128, 128]
    - [90, 0.723]
  - - [1024, 128, 1, 256, 1024, 1024, 256, 256]
    - [23, 1.323]
  - - [1024, 128, 1, 512, 1024, 1024, 512, 512]
    - [23, 2.314]
  - - [1024, 128, 1, 1024, 1024, 1024, 1024, 1024]
    - [38, 3.696]
  - - [1024, 128, 1, 2048, 1024, 1024, 2048, 2048]
    - [90, 4.878]
  - - [1024, 128, 1, 4096, 1024, 1024, 4096, 4096]
    - [38, 7.524]
  - - [1024, 128, 1, 8192, 1024, 1024, 8192, 8192]
    - [33, 10.419]
  - - [1024, 256, 1, 128, 1024, 1024, 128, 128]
    - [23, 1.392]
  - - [1024, 256, 1, 256, 1024, 1024, 256, 256]
    - [90, 2.585]
  - - [1024, 256, 1, 512, 1024, 1024, 512, 512]
    - [90, 4.35]
  - - [1024, 256, 1, 1024, 1024, 1024, 1024, 1024]
    - [38, 7.169]
  - - [1024, 256, 1, 2048, 1024, 1024, 2048, 2048]
    - [38, 9.546]
  - - [1024, 256, 1, 4096, 1024, 1024, 4096, 4096]
    - [33, 11.121]
  - - [1024, 256, 1, 8192, 1024, 1024, 8192, 8192]
    - [27, 14.225]
  - - [1024, 512, 1, 128, 1024, 1024, 128, 128]
    - [87, 2.5]
  - - [1024, 512, 1, 256, 1024, 1024, 256, 256]
    - [87, 4.466]
  - - [1024, 512, 1, 512, 1024, 1024, 512, 512]
    - [20, 7.285]
  - - [1024, 512, 1, 1024, 1024, 1024, 1024, 1024]
    - [103, 10.562]
  - - [1024, 512, 1, 2048, 1024, 1024, 2048, 2048]
    - [88, 12.553]
  - - [1024, 512, 1, 4096, 1024, 1024, 4096, 4096]
    - [25, 15.97]
  - - [1024, 512, 1, 8192, 1024, 1024, 8192, 8192]
    - [101, 16.234]
  - - [1024, 1024, 1, 128, 1024, 1024, 128, 128]
    - [82, 4.091]
  - - [1024, 1024, 1, 256, 1024, 1024, 256, 256]
    - [19, 7.109]
  - - [1024, 1024, 1, 512, 1024, 1024, 512, 512]
    - [18, 11.141]
  - - [1024, 1024, 1, 1024, 1024, 1024, 1024, 1024]
    - [81, 15.275]
  - - [1024, 1024, 1, 2048, 1024, 1024, 2048, 2048]
    - [99, 17.907]
  - - [1024, 1024, 1, 4096, 1024, 1024, 4096, 4096]
    - [58, 18.943]
  - - [1024, 1024, 1, 8192, 1024, 1024, 8192, 8192]
    - [64, 21.42]
  - - [1024, 2048, 1, 128, 1024, 1024, 128, 128]
    - [78, 6.054]
  - - [1024, 2048, 1, 256, 1024, 1024, 256, 256]
    - [67, 10.218]
  - - [1024, 2048, 1, 512, 1024, 1024, 512, 512]
    - [73, 15.018]
  - - [1024, 2048, 1, 1024, 1024, 1024, 1024, 1024]
    - [79, 19.318]
  - - [1024, 2048, 1, 2048, 1024, 1024, 2048, 2048]
    - [16, 20.907]
  - - [1024, 2048, 1, 4096, 1024, 1024, 4096, 4096]
    - [64, 23.143]
  - - [1024, 2048, 1, 8192, 1024, 1024, 8192, 8192]
    - [64, 25.199]
  - - [1024, 4096, 1, 128, 1024, 1024, 128, 128]
    - [42, 7.888]
  - - [1024, 4096, 1, 256, 1024, 1024, 256, 256]
    - [65, 11.877]
  - - [1024, 4096, 1, 512, 1024, 1024, 512, 512]
    - [65, 17.312]
  - - [1024, 4096, 1, 1024, 1024, 1024, 1024, 1024]
    - [9, 22.101]
  - - [1024, 4096, 1, 2048, 1024, 1024, 2048, 2048]
    - [10, 26.313]
  - - [1024, 4096, 1, 4096, 1024, 1024, 4096, 4096]
    - [61, 25.558]
  - - [1024, 4096, 1, 8192, 1024, 1024, 8192, 8192]
    - [63, 24.696]
  - - [1024, 8192, 1, 128, 1024, 1024, 128, 128]
    - [61, 7.673]
  - - [1024, 8192, 1, 256, 1024, 1024, 256, 256]
    - [73, 10.855]
  - - [1024, 8192, 1, 512, 1024, 1024, 512, 512]
    - [48, 15.865]
  - - [1024, 8192, 1, 1024, 1024, 1024, 1024, 1024]
    - [48, 21.556]
  - - [1024, 8192, 1, 2048, 1024, 1024, 2048, 2048]
    - [59, 24.867]
  - - [1024, 8192, 1, 4096, 1024, 1024, 4096, 4096]
    - [52, 24.802]
  - - [1024, 8192, 1, 8192, 1024, 1024, 8192, 8192]
    - [60, 23.782]
  - - [2048, 128, 1, 128, 2048, 2048, 128, 128]
    - [23, 1.41]
  - - [2048, 128, 1, 256, 2048, 2048, 256, 256]
    - [90, 2.589]
  - - [2048, 128, 1, 512, 2048, 2048, 512, 512]
    - [23, 4.384]
  - - [2048, 128, 1, 1024, 2048, 2048, 1024, 1024]
    - [38, 6.979]
  - - [2048, 128, 1, 2048, 2048, 2048, 2048, 2048]
    - [110, 9.426]
  - - [2048, 128, 1, 4096, 2048, 2048, 4096, 4096]
    - [105, 11.024]
  - - [2048, 128, 1, 8192, 2048, 2048, 8192, 8192]
    - [24, 13.649]
  - - [2048, 256, 1, 128, 2048, 2048, 128, 128]
    - [20, 2.524]
  - - [2048, 256, 1, 256, 2048, 2048, 256, 256]
    - [20, 4.341]
  - - [2048, 256, 1, 512, 2048, 2048, 512, 512]
    - [31, 7.494]
  - - [2048, 256, 1, 1024, 2048, 2048, 1024, 1024]
    - [104, 10.602]
  - - [2048, 256, 1, 2048, 2048, 2048, 2048, 2048]
    - [32, 12.708]
  - - [2048, 256, 1, 4096, 2048, 2048, 4096, 4096]
    - [27, 15.142]
  - - [2048, 256, 1, 8192, 2048, 2048, 8192, 8192]
    - [66, 15.848]
  - - [2048, 512, 1, 128, 2048, 2048, 128, 128]
    - [81, 3.958]
  - - [2048, 512, 1, 256, 2048, 2048, 256, 256]
    - [81, 7.334]
  - - [2048, 512, 1, 512, 2048, 2048, 512, 512]
    - [81, 11.345]
  - - [2048, 512, 1, 1024, 2048, 2048, 1024, 1024]
    - [100, 15.167]
  - - [2048, 512, 1, 2048, 2048, 2048, 2048, 2048]
    - [98, 17.863]
  - - [2048, 512, 1, 4096, 2048, 2048, 4096, 4096]
    - [58, 19.295]
  - - [2048, 512, 1, 8192, 2048, 2048, 8192, 8192]
    - [54, 21.082]
  - - [2048, 1024, 1, 128, 2048, 2048, 128, 128]
    - [73, 6.141]
  - - [2048, 1024, 1, 256, 2048, 2048, 256, 256]
    - [74, 10.332]
  - - [2048, 1024, 1, 512, 2048, 2048, 512, 512]
    - [66, 14.965]
  - - [2048, 1024, 1, 1024, 2048, 2048, 1024, 1024]
    - [71, 19.531]
  - - [2048, 1024, 1, 2048, 2048, 2048, 2048, 2048]
    - [6, 20.646]
  - - [2048, 1024, 1, 4096, 2048, 2048, 4096, 4096]
    - [61, 23.394]
  - - [2048, 1024, 1, 8192, 2048, 2048, 8192, 8192]
    - [48, 24.893]
  - - [2048, 2048, 1, 128, 2048, 2048, 128, 128]
    - [0, 7.768]
  - - [2048, 2048, 1, 256, 2048, 2048, 256, 256]
    - [64, 11.965]
  - - [2048, 2048, 1, 512, 2048, 2048, 512, 512]
    - [64, 17.386]
  - - [2048, 2048, 1, 1024, 2048, 2048, 1024, 1024]
    - [9, 22.235]
  - - [2048, 2048, 1, 2048, 2048, 2048, 2048, 2048]
    - [62, 25.656]
  - - [2048, 2048, 1, 4096, 2048, 2048, 4096, 4096]
    - [48, 28.372]
  - - [2048, 2048, 1, 8192, 2048, 2048, 8192, 8192]
    - [49, 26.243]
  - - [2048, 4096, 1, 128, 2048, 2048, 128, 128]
    - [7, 7.683]
  - - [2048, 4096, 1, 256, 2048, 2048, 256, 256]
    - [74, 10.957]
  - - [2048, 4096, 1, 512, 2048, 2048, 512, 512]
    - [61, 15.831]
  - - [2048, 4096, 1, 1024, 2048, 2048, 1024, 1024]
    - [61, 21.325]
  - - [2048, 4096, 1, 2048, 2048, 2048, 2048, 2048]
    - [52, 25.531]
  - - [2048, 4096, 1, 4096, 2048, 2048, 4096, 4096]
    - [47, 25.287]
  - - [2048, 4096, 1, 8192, 2048, 2048, 8192, 8192]
    - [52, 24.88]
  - - [2048, 8192, 1, 128, 2048, 2048, 128, 128]
    - [14, 7.626]
  - - [2048, 8192, 1, 256, 2048, 2048, 256, 256]
    - [61, 12.364]
  - - [2048, 8192, 1, 512, 2048, 2048, 512, 512]
    - [48, 18.057]
  - - [2048, 8192, 1, 1024, 2048, 2048, 1024, 1024]
    - [61, 22.758]
  - - [2048, 8192, 1, 2048, 2048, 2048, 2048, 2048]
    - [61, 24.919]
  - - [2048, 8192, 1, 4096, 2048, 2048, 4096, 4096]
    - [50, 27.865]
  - - [2048, 8192, 1, 8192, 2048, 2048, 8192, 8192]
    - [50, 27.852]
  - - [4096, 128, 1, 128, 4096, 4096, 128, 128]
    - [87, 2.501]
  - - [4096, 128, 1, 256, 4096, 4096, 256, 256]
    - [87, 4.492]
  - - [4096, 128, 1, 512, 4096, 4096, 512, 512]
    - [87, 7.303]
  - - [4096, 128, 1, 1024, 4096, 4096, 1024, 1024]
    - [104, 10.578]
  - - [4096, 128, 1, 2048, 4096, 4096, 2048, 2048]
    - [88, 12.67]
  - - [4096, 128, 1, 4096, 4096, 4096, 4096, 4096]
    - [27, 14.524]
  - - [4096, 128, 1, 8192, 4096, 4096, 8192, 8192]
    - [13, 15.946]
  - - [4096, 256, 1, 128, 4096, 4096, 128, 128]
    - [85, 4.013]
  - - [4096, 256, 1, 256, 4096, 4096, 256, 256]
    - [84, 7.146]
  - - [4096, 256, 1, 512, 4096, 4096, 512, 512]
    - [83, 11.171]
  - - [4096, 256, 1, 1024, 4096, 4096, 1024, 1024]
    - [102, 15.14]
  - - [4096, 256, 1, 2048, 4096, 4096, 2048, 2048]
    - [98, 17.895]
  - - [4096, 256, 1, 4096, 4096, 4096, 4096, 4096]
    - [65, 19.228]
  - - [4096, 256, 1, 8192, 4096, 4096, 8192, 8192]
    - [51, 21.254]
  - - [4096, 512, 1, 128, 4096, 4096, 128, 128]
    - [74, 6.11]
  - - [4096, 512, 1, 256, 4096, 4096, 256, 256]
    - [70, 10.231]
  - - [4096, 512, 1, 512, 4096, 4096, 512, 512]
    - [69, 14.729]
  - - [4096, 512, 1, 1024, 4096, 4096, 1024, 1024]
    - [72, 19.641]
  - - [4096, 512, 1, 2048, 4096, 4096, 2048, 2048]
    - [13, 21.505]
  - - [4096, 512, 1, 4096, 4096, 4096, 4096, 4096]
    - [55, 22.231]
  - - [4096, 512, 1, 8192, 4096, 4096, 8192, 8192]
    - [48, 25.315]
  - - [4096, 1024, 1, 128, 4096, 4096, 128, 128]
    - [43, 7.555]
  - - [4096, 1024, 1, 256, 4096, 4096, 256, 256]
    - [61, 11.868]
  - - [4096, 1024, 1, 512, 4096, 4096, 512, 512]
    - [61, 17.631]
  - - [4096, 1024, 1, 1024, 4096, 4096, 1024, 1024]
    - [4, 22.413]
  - - [4096, 1024, 1, 2048, 4096, 4096, 2048, 2048]
    - [6, 25.893]
  - - [4096, 1024, 1, 4096, 4096, 4096, 4096, 4096]
    - [51, 26.246]
  - - [4096, 1024, 1, 8192, 4096, 4096, 8192, 8192]
    - [51, 26.079]
  - - [4096, 2048, 1, 128, 4096, 4096, 128, 128]
    - [8, 7.763]
  - - [4096, 2048, 1, 256, 4096, 4096, 256, 256]
    - [17, 10.715]
  - - [4096, 2048, 1, 512, 4096, 4096, 512, 512]
    - [61, 15.489]
  - - [4096, 2048, 1, 1024, 4096, 4096, 1024, 1024]
    - [54, 21.313]
  - - [4096, 2048, 1, 2048, 4096, 4096, 2048, 2048]
    - [51, 26.358]
  - - [4096, 2048, 1, 4096, 4096, 4096, 4096, 4096]
    - [49, 27.794]
  - - [4096, 2048, 1, 8192, 4096, 4096, 8192, 8192]
    - [47, 27.35]
  - - [4096, 4096, 1, 128, 4096, 4096, 128, 128]
    - [17, 7.666]
  - - [4096, 4096, 1, 256, 4096, 4096, 256, 256]
    - [8, 12.098]
  - - [4096, 4096, 1, 512, 4096, 4096, 512, 512]
    - [61, 17.79]
  - - [4096, 4096, 1, 1024, 4096, 4096, 1024, 1024]
    - [60, 22.732]
  - - [4096, 4096, 1, 2048, 4096, 4096, 2048, 2048]
    - [56, 25.463]
  - - [4096, 4096, 1, 4096, 4096, 4096, 4096, 4096]
    - [51, 27.754]
  - - [4096, 4096, 1, 8192, 4096, 4096, 8192, 8192]
    - [5, 28.823]
  - - [4096, 8192, 1, 128, 4096, 4096, 128, 128]
    - [8, 8.346]
  - - [4096, 8192, 1, 256, 4096, 4096, 256, 256]
    - [65, 12.564]
  - - [4096, 8192, 1, 512, 4096, 4096, 512, 512]
    - [8, 18.197]
  - - [4096, 8192, 1, 1024, 4096, 4096, 1024, 1024]
    - [57, 22.352]
  - - [4096, 8192, 1, 2048, 4096, 4096, 2048, 2048]
    - [65, 25.916]
  - - [4096, 8192, 1, 4096, 4096, 4096, 4096, 4096]
    - [62, 29.165]
  - - [4096, 8192, 1, 8192, 4096, 4096, 8192, 8192]
    - [59, 30.202]
  - - [8192, 128, 1, 128, 8192, 8192, 128, 128]
    - [83, 4.012]
  - - [8192, 128, 1, 256, 8192, 8192, 256, 256]
    - [83, 7.174]
  - - [8192, 128, 1, 512, 8192, 8192, 512, 512]
    - [83, 11.197]
  - - [8192, 128, 1, 1024, 8192, 8192, 1024, 1024]
    - [99, 15.134]
  - - [8192, 128, 1, 2048, 8192, 8192, 2048, 2048]
    - [101, 16.282]
  - - [8192, 128, 1, 4096, 8192, 8192, 4096, 4096]
    - [51, 18.711]
  - - [8192, 128, 1, 8192, 8192, 8192, 8192, 8192]
    - [11, 21.396]
  - - [8192, 256, 1, 128, 8192, 8192, 128, 128]
    - [73, 6.068]
  - - [8192, 256, 1, 256, 8192, 8192, 256, 256]
    - [68, 10.239]
  - - [8192, 256, 1, 512, 8192, 8192, 512, 512]
    - [66, 14.812]
  - - [8192, 256, 1, 1024, 8192, 8192, 1024, 1024]
    - [80, 18.455]
  - - [8192, 256, 1, 2048, 8192, 8192, 2048, 2048]
    - [14, 19.933]
  - - [8192, 256, 1, 4096, 8192, 8192, 4096, 4096]
    - [48, 22.565]
  - - [8192, 256, 1, 8192, 8192, 8192, 8192, 8192]
    - [54, 25.276]
  - - [8192, 512, 1, 128, 8192, 8192, 128, 128]
    - [44, 7.816]
  - - [8192, 512, 1, 256, 8192, 8192, 256, 256]
    - [55, 11.883]
  - - [8192, 512, 1, 512, 8192, 8192, 512, 512]
    - [2, 17.434]
  - - [8192, 512, 1, 1024, 8192, 8192, 1024, 1024]
    - [4, 22.748]
  - - [8192, 512, 1, 2048, 8192, 8192, 2048, 2048]
    - [3, 26.027]
  - - [8192, 512, 1, 4096, 8192, 8192, 4096, 4096]
    - [49, 26.358]
  - - [8192, 512, 1, 8192, 8192, 8192, 8192, 8192]
    - [51, 26.556]
  - - [8192, 1024, 1, 128, 8192, 8192, 128, 128]
    - [11, 7.804]
  - - [8192, 1024, 1, 256, 8192, 8192, 256, 256]
    - [15, 10.64]
  - - [8192, 1024, 1, 512, 8192, 8192, 512, 512]
    - [61, 15.585]
  - - [8192, 1024, 1, 1024, 8192, 8192, 1024, 1024]
    - [64, 21.234]
  - - [8192, 1024, 1, 2048, 8192, 8192, 2048, 2048]
    - [49, 24.927]
  - - [8192, 1024, 1, 4096, 8192, 8192, 4096, 4096]
    - [53, 26.577]
  - - [8192, 1024, 1, 8192, 8192, 8192, 8192, 8192]
    - [48, 27.492]
  - - [8192, 2048, 1, 128, 8192, 8192, 128, 128]
    - [65, 7.711]
  - - [8192, 2048, 1, 256, 8192, 8192, 256, 256]
    - [65, 12.557]
  - - [8192, 2048, 1, 512, 8192, 8192, 512, 512]
    - [65, 17.706]
  - - [8192, 2048, 1, 1024, 8192, 8192, 1024, 1024]
    - [55, 22.588]
  - - [8192, 2048, 1, 2048, 8192, 8192, 2048, 2048]
    - [62, 24.72]
  - - [8192, 2048, 1, 4096, 8192, 8192, 4096, 4096]
    - [4, 27.582]
  - - [8192, 2048, 1, 8192, 8192, 8192, 8192, 8192]
    - [5, 28.889]
  - - [8192, 4096, 1, 128, 8192, 8192, 128, 128]
    - [65, 8.779]
  - - [8192, 4096, 1, 256, 8192, 8192, 256, 256]
    - [65, 12.306]
  - - [8192, 4096, 1, 512, 8192, 8192, 512, 512]
    - [61, 17.392]
  - - [8192, 4096, 1, 1024, 8192, 8192, 1024, 1024]
    - [65, 22.908]
  - - [8192, 4096, 1, 2048, 8192, 8192, 2048, 2048]
    - [61, 25.862]
  - - [8192, 4096, 1, 4096, 8192, 8192, 4096, 4096]
    - [65, 29.522]
  - - [8192, 4096, 1, 8192, 8192, 8192, 8192, 8192]
    - [55, 30.616]
  - - [8192, 8192, 1, 128, 8192, 8192, 128, 128]
    - [11, 7.209]
  - - [8192, 8192, 1, 256, 8192, 8192, 256, 256]
    - [65, 11.281]
  - - [8192, 8192, 1, 512, 8192, 8192, 512, 512]
    - [4, 17.036]
  - - [8192, 8192, 1, 1024, 8192, 8192, 1024, 1024]
    - [65, 23.304]
  - - [8192, 8192, 1, 2048, 8192, 8192, 2048, 2048]
    - [65, 27.425]
  - - [8192, 8192, 1, 4096, 8192, 8192, 4096, 4096]
    - [62, 31.595]
  - - [8192, 8192, 1, 8192, 8192, 8192, 8192, 8192]
    - [60, 32.812]
  - - [1, 1, 1, 32, 1, 1, 32, 32]
    - [112, 0.0]
- null
- null
- ExperimentalStreamK
- GridBased
