library/src/amd_detail/rocblaslt/src/Tensile/Logic/asm_full/aquavanjaram/gfx942/StreamK/aquavanjaram942_Cijk_Alik_Bjlk_BSS_BH_UserArgs.yaml
- {MinimumRequiredVersion: 4.33.0}
- aquavanjaram942
- gfx942
- [Device 0049, Device 0050]
    SolutionIndex: 0
    SolutionNameMin: Cijk_Alik_Bjlk_BSS_BH_UserArgs_MT256x256x32_MI16x16x1_SN_LDSB1_CLR1_GSU0_GSUC0_GSUWGMRR0_K1_LBSPPA256_LBSPPB2048_LPB32_MIWT8_8_PLR1_SU32_SUM0_SUS256_SKXCCM0_VWA4_VWB2_WGM1_WGMXCC1_WGMXCCGn1
    SolutionIndex: 1
    SolutionNameMin: Cijk_Alik_Bjlk_BSS_BH_UserArgs_MT256x256x32_MI16x16x1_SN_LDSB1_CLR1_GSU0_GSUC0_GSUWGMRR0_K1_LBSPPA128_LBSPPB2048_LPB0_MIWT8_8_PLR1_SU32_SUM0_SUS256_SKXCCM0_VWA2_VWB4_WGM1_WGMXCC1_WGMXCCGn1
    SolutionIndex: 2
    SolutionNameMin: Cijk_Alik_Bjlk_BSS_BH_UserArgs_MT256x256x32_MI16x16x1_SN_LDSB1_CLR1_GSU0_GSUC0_GSUWGMRR0_K1_LBSPPA128_LBSPPB2048_LPB0_MIWT8_8_PLR1_SU32_SUM0_SUS256_SKXCCM0_VWA1_VWB8_WGM1_WGMXCC1_WGMXCCGn1
    SolutionIndex: 3
    SolutionNameMin: Cijk_Alik_Bjlk_BSS_BH_UserArgs_MT256x256x32_MI16x16x1_SN_LDSB1_CLR1_GSU0_GSUC0_GSUWGMRR0_K1_LBSPPA256_LBSPPB2048_LPB0_MIWT8_8_PLR1_SU32_SUM0_SUS256_SKXCCM0_VWA4_VWB4_WGM4_WGMXCC1_WGMXCCGn1
    SolutionIndex: 4
    SolutionNameMin: Cijk_Alik_Bjlk_BSS_BH_UserArgs_MT256x256x32_MI16x16x1_SN_LDSB1_CLR1_GSU0_GSUC0_GSUWGMRR0_K1_LBSPPA256_LBSPPB2048_LPB0_MIWT8_8_PLR1_SU32_SUM0_SUS256_SKXCCM0_VWA4_VWB4_WGM8_WGMXCC1_WGMXCCGn1
    SolutionIndex: 5
    SolutionNameMin: Cijk_Alik_Bjlk_BSS_BH_UserArgs_MT256x256x32_MI16x16x1_SN_LDSB1_CLR1_GSU0_GSUC0_GSUWGMRR0_K1_LBSPPA256_LBSPPB2048_LPB0_MIWT8_8_PLR1_SU32_SUM0_SUS256_SKXCCM0_VWA4_VWB8_WGM8_WGMXCC1_WGMXCCGn1
    SolutionIndex: 6
    SolutionNameMin: Cijk_Alik_Bjlk_BSS_BH_UserArgs_MT128x256x32_MI16x16x1_SN_LDSB1_CLR1_GSU0_GSUC0_GSUWGMRR0_K1_LBSPPA256_LBSPPB2048_LPB0_MIWT4_8_PLR1_SU32_SUM0_SUS256_SKXCCM0_VWA4_VWB8_WGM8_WGMXCC1_WGMXCCGn1
    SolutionIndex: 7
    SolutionNameMin: Cijk_Alik_Bjlk_BSS_BH_UserArgs_MT128x128x32_MI16x16x1_SN_LDSB1_CLR1_GSU0_GSUC0_GSUWGMRR0_K1_LBSPPA256_LBSPPB1024_LPB0_MIWT4_4_PLR1_SU32_SUM0_SUS256_SKXCCM0_VWA4_VWB4_WGM8_WGMXCC1_WGMXCCGn1
    SolutionIndex: 8
    SolutionNameMin: Cijk_Alik_Bjlk_BSS_BH_UserArgs_MT128x256x64_MI16x16x1_SN_LDSB1_CLR1_GSU0_GSUC0_GSUWGMRR0_K1_LBSPPA512_LBSPPB4096_LPB32_MIWT4_8_PLR1_SU32_SUM0_SUS256_SKXCCM0_VWA4_VWB2_WGM1_WGMXCC1_WGMXCCGn1
    SolutionIndex: 9
    SolutionNameMin: Cijk_Alik_Bjlk_BSS_BH_UserArgs_MT128x256x64_MI16x16x1_SN_LDSB1_CLR1_GSU0_GSUC0_GSUWGMRR0_K1_LBSPPA512_LBSPPB4096_LPB0_MIWT4_8_PLR1_SU32_SUM0_SUS256_SKXCCM0_VWA4_VWB8_WGM1_WGMXCC1_WGMXCCGn1
    SolutionIndex: 10
    SolutionNameMin: Cijk_Alik_Bjlk_BSS_BH_UserArgs_MT128x256x64_MI16x16x1_SN_LDSB1_CLR1_GSU0_GSUC0_GSUWGMRR0_K1_LBSPPA512_LBSPPB4096_LPB0_MIWT4_8_PLR1_SU32_SUM0_SUS256_SKXCCM0_VWA4_VWB4_WGM4_WGMXCC1_WGMXCCGn1
    SolutionIndex: 11
    SolutionNameMin: Cijk_Alik_Bjlk_BSS_BH_UserArgs_MT128x256x64_MI16x16x1_SN_LDSB1_CLR1_GSU0_GSUC0_GSUWGMRR0_K1_LBSPPA256_LBSPPB4096_LPB0_MIWT4_8_PLR1_SU32_SUM0_SUS256_SKXCCM0_VWA2_VWB8_WGM4_WGMXCC1_WGMXCCGn1
    SolutionIndex: 12
    SolutionNameMin: Cijk_Alik_Bjlk_BSS_BH_UserArgs_MT128x256x64_MI16x16x1_SN_LDSB1_CLR1_GSU0_GSUC0_GSUWGMRR0_K1_LBSPPA512_LBSPPB4096_LPB0_MIWT4_8_PLR1_SU32_SUM0_SUS256_SKXCCM0_VWA4_VWB8_WGM4_WGMXCC1_WGMXCCGn1
    SolutionIndex: 13
    SolutionNameMin: Cijk_Alik_Bjlk_BSS_BH_UserArgs_MT128x256x64_MI16x16x1_SN_LDSB1_CLR1_GSU0_GSUC0_GSUWGMRR0_K1_LBSPPA512_LBSPPB4096_LPB0_MIWT4_8_PLR1_SU32_SUM0_SUS256_SKXCCM0_VWA4_VWB4_WGM8_WGMXCC1_WGMXCCGn1
    SolutionIndex: 14
    SolutionNameMin: Cijk_Alik_Bjlk_BSS_BH_UserArgs_MT128x256x64_MI16x16x1_SN_LDSB1_CLR1_GSU0_GSUC0_GSUWGMRR0_K1_LBSPPA512_LBSPPB4096_LPB0_MIWT4_8_PLR1_SU32_SUM0_SUS256_SKXCCM0_VWA4_VWB8_WGM8_WGMXCC1_WGMXCCGn1
    SolutionIndex: 15
    SolutionNameMin: Cijk_Alik_Bjlk_BSS_BH_UserArgs_MT256x128x64_MI16x16x1_SN_LDSB1_CLR1_GSU0_GSUC0_GSUWGMRR0_K1_LBSPPA128_LBSPPB2048_LPB32_MIWT8_4_PLR1_SU32_SUM0_SUS256_SKXCCM0_VWA1_VWB2_WGM1_WGMXCC1_WGMXCCGn1
    SolutionIndex: 16
    SolutionNameMin: Cijk_Alik_Bjlk_BSS_BH_UserArgs_MT256x128x64_MI16x16x1_SN_LDSB1_CLR1_GSU0_GSUC0_GSUWGMRR0_K1_LBSPPA128_LBSPPB2048_LPB0_MIWT8_4_PLR1_SU32_SUM0_SUS256_SKXCCM0_VWA1_VWB4_WGM1_WGMXCC1_WGMXCCGn1
    SolutionIndex: 17
    SolutionNameMin: Cijk_Alik_Bjlk_BSS_BH_UserArgs_MT256x128x64_MI16x16x1_SN_LDSB1_CLR1_GSU0_GSUC0_GSUWGMRR0_K1_LBSPPA256_LBSPPB2048_LPB0_MIWT8_4_PLR1_SU32_SUM0_SUS256_SKXCCM0_VWA2_VWB4_WGM1_WGMXCC1_WGMXCCGn1
    SolutionIndex: 18
    SolutionNameMin: Cijk_Alik_Bjlk_BSS_BH_UserArgs_MT256x128x64_MI16x16x1_SN_LDSB1_CLR1_GSU0_GSUC0_GSUWGMRR0_K1_LBSPPA512_LBSPPB2048_LPB0_MIWT8_4_PLR1_SU32_SUM0_SUS256_SKXCCM0_VWA4_VWB4_WGM1_WGMXCC1_WGMXCCGn1
    SolutionIndex: 19
    SolutionNameMin: Cijk_Alik_Bjlk_BSS_BH_UserArgs_MT256x128x64_MI16x16x1_SN_LDSB1_CLR1_GSU0_GSUC0_GSUWGMRR0_K1_LBSPPA256_LBSPPB2048_LPB0_MIWT8_4_PLR1_SU32_SUM0_SUS256_SKXCCM0_VWA2_VWB4_WGM4_WGMXCC1_WGMXCCGn1
    SolutionIndex: 20
    SolutionNameMin: Cijk_Alik_Bjlk_BSS_BH_UserArgs_MT256x128x64_MI16x16x1_SN_LDSB1_CLR1_GSU0_GSUC0_GSUWGMRR0_K1_LBSPPA512_LBSPPB2048_LPB32_MIWT8_4_PLR1_SU32_SUM0_SUS256_SKXCCM0_VWA4_VWB2_WGM8_WGMXCC1_WGMXCCGn1
    SolutionIndex: 21
    SolutionNameMin: Cijk_Alik_Bjlk_BSS_BH_UserArgs_MT128x128x64_MI16x16x1_SN_LDSB1_CLR1_GSU0_GSUC0_GSUWGMRR0_K1_LBSPPA128_LBSPPB2048_LPB32_MIWT4_4_PLR1_SU32_SUM0_SUS256_SKXCCM0_VWA1_VWB2_WGM1_WGMXCC1_WGMXCCGn1
    SolutionIndex: 22
    SolutionNameMin: Cijk_Alik_Bjlk_BSS_BH_UserArgs_MT128x128x64_MI16x16x1_SN_LDSB1_CLR1_GSU0_GSUC0_GSUWGMRR0_K1_LBSPPA128_LBSPPB2048_LPB0_MIWT4_4_PLR1_SU32_SUM0_SUS256_SKXCCM0_VWA1_VWB4_WGM1_WGMXCC1_WGMXCCGn1
    SolutionIndex: 23
    SolutionNameMin: Cijk_Alik_Bjlk_BSS_BH_UserArgs_MT128x128x64_MI16x16x1_SN_LDSB1_CLR1_GSU0_GSUC0_GSUWGMRR0_K1_LBSPPA512_LBSPPB2048_LPB0_MIWT4_4_PLR1_SU32_SUM0_SUS256_SKXCCM0_VWA4_VWB4_WGM1_WGMXCC1_WGMXCCGn1
    SolutionIndex: 24
    SolutionNameMin: Cijk_Alik_Bjlk_BSS_BH_UserArgs_MT128x128x64_MI16x16x1_SN_LDSB1_CLR1_GSU0_GSUC0_GSUWGMRR0_K1_LBSPPA256_LBSPPB2048_LPB0_MIWT4_4_PLR1_SU32_SUM0_SUS256_SKXCCM0_VWA2_VWB4_WGM4_WGMXCC1_WGMXCCGn1
    SolutionIndex: 25
    SolutionNameMin: Cijk_Alik_Bjlk_BSS_BH_UserArgs_MT128x128x64_MI16x16x1_SN_LDSB1_CLR1_GSU0_GSUC0_GSUWGMRR0_K1_LBSPPA512_LBSPPB2048_LPB0_MIWT4_4_PLR2_SU32_SUM0_SUS256_SKXCCM0_VWA4_VWB4_WGM4_WGMXCC1_WGMXCCGn1
    SolutionIndex: 26
    SolutionNameMin: Cijk_Alik_Bjlk_BSS_BH_UserArgs_MT128x128x64_MI16x16x1_SN_LDSB1_CLR1_GSU0_GSUC0_GSUWGMRR0_K1_LBSPPA512_LBSPPB2048_LPB0_MIWT4_4_PLR1_SU32_SUM0_SUS256_SKXCCM0_VWA4_VWB4_WGM8_WGMXCC1_WGMXCCGn1
    SolutionIndex: 27
    SolutionNameMin: Cijk_Alik_Bjlk_BSS_BH_UserArgs_MT128x64x64_MI16x16x1_SN_LDSB1_CLR1_GSU0_GSUC0_GSUWGMRR0_K1_LBSPPA512_LBSPPB1024_LPB32_MIWT4_2_PLR1_SU32_SUM0_SUS256_SKXCCM0_VWA4_VWB2_WGM8_WGMXCC1_WGMXCCGn1
    SolutionIndex: 28
    SolutionNameMin: Cijk_Alik_Bjlk_BSS_BH_UserArgs_MT64x64x64_MI16x16x1_SN_LDSB1_CLR1_GSU0_GSUC0_GSUWGMRR0_K1_LBSPPA128_LBSPPB1024_LPB32_MIWT2_2_PLR1_SU32_SUM0_SUS256_SKXCCM0_VWA1_VWB2_WGM8_WGMXCC1_WGMXCCGn1
    SolutionIndex: 29
    SolutionNameMin: Cijk_Alik_Bjlk_BSS_BH_UserArgs_MT32x64x64_MI16x16x1_SN_LDSB0_CLR1_GSU0_GSUC0_GSUWGMRR0_K1_LBSPPA128_LBSPPB1024_LPB32_MIWT1_2_PLR1_SU32_SUM0_SUS256_SKXCCM0_VWA1_VWB2_WGM1_WGMXCC1_WGMXCCGn1
    SolutionIndex: 30
    SolutionNameMin: Cijk_Alik_Bjlk_BSS_BH_UserArgs_MT32x32x64_MI16x16x1_SN_LDSB0_CLR1_GSU0_GSUC0_GSUWGMRR0_K1_LBSPPA128_LBSPPB512_LPB16_MIWT1_1_PLR1_SU32_SUM0_SUS256_SKXCCM0_VWA1_VWB1_WGM1_WGMXCC1_WGMXCCGn1
    SolutionIndex: 31
    SolutionNameMin: Cijk_Alik_Bjlk_BSS_BH_UserArgs_MT64x128x128_MI16x16x1_SN_LDSB1_CLR1_GSU0_GSUC0_GSUWGMRR0_K1_LBSPPA256_LBSPPB2048_LPB0_MIWT2_4_PLR2_SU32_SUM0_SUS256_SKXCCM0_VWA1_VWB4_WGM1_WGMXCC1_WGMXCCGn1
    SolutionIndex: 32
    SolutionNameMin: Cijk_Alik_Bjlk_BSS_BH_UserArgs_MT128x64x128_MI16x16x1_SN_LDSB1_CLR1_GSU0_GSUC0_GSUWGMRR0_K1_LBSPPA256_LBSPPB1024_LPB32_MIWT4_2_PLR2_SU32_SUM0_SUS256_SKXCCM0_VWA1_VWB2_WGM1_WGMXCC1_WGMXCCGn1
    SolutionIndex: 33
    SolutionNameMin: Cijk_Alik_Bjlk_BSS_BH_UserArgs_MT128x64x128_MI16x16x1_SN_LDSB1_CLR1_GSU0_GSUC0_GSUWGMRR0_K1_LBSPPA1024_LBSPPB1024_LPB32_MIWT4_2_PLR2_SU32_SUM0_SUS256_SKXCCM0_VWA4_VWB2_WGM1_WGMXCC1_WGMXCCGn1
    SolutionIndex: 34
    SolutionNameMin: Cijk_Alik_Bjlk_BSS_BH_UserArgs_MT128x64x128_MI16x16x1_SN_LDSB1_CLR1_GSU0_GSUC0_GSUWGMRR0_K1_LBSPPA512_LBSPPB1024_LPB32_MIWT4_2_PLR2_SU32_SUM0_SUS256_SKXCCM0_VWA2_VWB2_WGM4_WGMXCC1_WGMXCCGn1
    SolutionIndex: 35
    SolutionNameMin: Cijk_Alik_Bjlk_BSS_BH_UserArgs_MT128x64x128_MI16x16x1_SN_LDSB1_CLR1_GSU0_GSUC0_GSUWGMRR0_K1_LBSPPA512_LBSPPB1024_LPB32_MIWT4_2_PLR2_SU32_SUM0_SUS256_SKXCCM0_VWA2_VWB2_WGM8_WGMXCC1_WGMXCCGn1
    SolutionIndex: 36
    SolutionNameMin: Cijk_Alik_Bjlk_BSS_BH_UserArgs_MT128x64x128_MI16x16x1_SN_LDSB1_CLR1_GSU0_GSUC0_GSUWGMRR0_K1_LBSPPA1024_LBSPPB1024_LPB32_MIWT4_2_PLR2_SU32_SUM0_SUS256_SKXCCM0_VWA4_VWB2_WGM8_WGMXCC1_WGMXCCGn1
    SolutionIndex: 37
    SolutionNameMin: Cijk_Alik_Bjlk_BSS_BH_UserArgs_MT64x64x128_MI16x16x1_SN_LDSB1_CLR1_GSU0_GSUC0_GSUWGMRR0_K1_LBSPPA256_LBSPPB1024_LPB32_MIWT2_2_PLR2_SU32_SUM0_SUS256_SKXCCM0_VWA1_VWB2_WGM1_WGMXCC1_WGMXCCGn1
    SolutionIndex: 38
    SolutionNameMin: Cijk_Alik_Bjlk_BSS_BH_UserArgs_MT64x64x128_MI16x16x1_SN_LDSB1_CLR1_GSU0_GSUC0_GSUWGMRR0_K1_LBSPPA256_LBSPPB1024_LPB32_MIWT2_2_PLR2_SU32_SUM0_SUS256_SKXCCM0_VWA1_VWB2_WGM4_WGMXCC1_WGMXCCGn1
    SolutionIndex: 39
    SolutionNameMin: Cijk_Alik_Bjlk_BSS_BH_UserArgs_MT64x64x128_MI16x16x1_SN_LDSB1_CLR1_GSU0_GSUC0_GSUWGMRR0_K1_LBSPPA256_LBSPPB1024_LPB32_MIWT2_2_PLR2_SU32_SUM0_SUS256_SKXCCM0_VWA1_VWB2_WGM8_WGMXCC1_WGMXCCGn1
    SolutionIndex: 40
    SolutionNameMin: Cijk_Alik_Bjlk_BSS_BH_UserArgs_MT32x64x128_MI16x16x1_SN_LDSB1_CLR1_GSU0_GSUC0_GSUWGMRR0_K1_LBSPPA256_LBSPPB1024_LPB32_MIWT1_2_PLR2_SU32_SUM0_SUS256_SKXCCM0_VWA1_VWB2_WGM1_WGMXCC1_WGMXCCGn1
    SolutionIndex: 41
    SolutionNameMin: Cijk_Alik_Bjlk_BSS_BH_UserArgs_MT32x64x128_MI16x16x1_SN_LDSB1_CLR1_GSU0_GSUC0_GSUWGMRR0_K1_LBSPPA256_LBSPPB1024_LPB32_MIWT1_2_PLR1_SU32_SUM0_SUS256_SKXCCM0_VWA1_VWB2_WGM4_WGMXCC1_WGMXCCGn1
    SolutionIndex: 42
    SolutionNameMin: Cijk_Alik_Bjlk_BSS_BH_UserArgs_MT32x64x128_MI16x16x1_SN_LDSB1_CLR1_GSU0_GSUC0_GSUWGMRR0_K1_LBSPPA256_LBSPPB1024_LPB32_MIWT1_2_PLR2_SU32_SUM0_SUS256_SKXCCM0_VWA1_VWB2_WGM8_WGMXCC1_WGMXCCGn1
    SolutionIndex: 43
    SolutionNameMin: Cijk_Alik_Bjlk_BSS_BH_UserArgs_MT64x32x128_MI16x16x1_SN_LDSB1_CLR1_GSU0_GSUC0_GSUWGMRR0_K1_LBSPPA256_LBSPPB512_LPB16_MIWT2_1_PLR2_SU32_SUM0_SUS256_SKXCCM0_VWA1_VWB1_WGM8_WGMXCC1_WGMXCCGn1
    SolutionIndex: 44
    SolutionNameMin: Cijk_Alik_Bjlk_BSS_BH_UserArgs_MT32x32x128_MI16x16x1_SN_LDSB1_CLR1_GSU0_GSUC0_GSUWGMRR0_K1_LBSPPA256_LBSPPB512_LPB16_MIWT1_1_PLR1_SU32_SUM0_SUS256_SKXCCM0_VWA1_VWB1_WGM1_WGMXCC1_WGMXCCGn1
    SolutionIndex: 45
    SolutionNameMin: Cijk_Alik_Bjlk_BSS_BH_UserArgs_MT32x32x128_MI16x16x1_SN_LDSB1_CLR1_GSU0_GSUC0_GSUWGMRR0_K1_LBSPPA256_LBSPPB512_LPB16_MIWT1_1_PLR2_SU32_SUM0_SUS256_SKXCCM0_VWA1_VWB1_WGM1_WGMXCC1_WGMXCCGn1
    SolutionIndex: 46
    SolutionNameMin: Cijk_Alik_Bjlk_BSS_BH_UserArgs_MT32x32x128_MI16x16x1_SN_LDSB1_CLR1_GSU0_GSUC0_GSUWGMRR0_K1_LBSPPA256_LBSPPB512_LPB16_MIWT1_1_PLR2_SU32_SUM0_SUS256_SKXCCM0_VWA1_VWB1_WGM4_WGMXCC1_WGMXCCGn1
    SolutionIndex: 47
    SolutionNameMin: Cijk_Alik_Bjlk_BSS_BH_UserArgs_MT32x32x128_MI16x16x1_SN_LDSB1_CLR1_GSU0_GSUC0_GSUWGMRR0_K1_LBSPPA256_LBSPPB512_LPB16_MIWT1_1_PLR2_SU32_SUM0_SUS256_SKXCCM0_VWA1_VWB1_WGM8_WGMXCC1_WGMXCCGn1
    SolutionIndex: 48
    SolutionNameMin: Cijk_Alik_Bjlk_BSS_BH_UserArgs_MT256x256x32_MI16x16x1_SN_LDSB1_CLR1_GSU0_GSUC0_GSUWGMRR0_K1_LBSPPA256_LBSPPB2048_LPB0_MIWT8_8_PLR1_SU32_SUM0_SUS256_SKXCCM8_VWA4_VWB4_WGM1_WGMXCC1_WGMXCCGn1
    SolutionIndex: 49
    SolutionNameMin: Cijk_Alik_Bjlk_BSS_BH_UserArgs_MT256x256x32_MI16x16x1_SN_LDSB1_CLR1_GSU0_GSUC0_GSUWGMRR0_K1_LBSPPA128_LBSPPB2048_LPB0_MIWT8_8_PLR1_SU32_SUM0_SUS256_SKXCCM8_VWA1_VWB8_WGM1_WGMXCC1_WGMXCCGn1
    SolutionIndex: 50
    SolutionNameMin: Cijk_Alik_Bjlk_BSS_BH_UserArgs_MT256x256x32_MI16x16x1_SN_LDSB1_CLR1_GSU0_GSUC0_GSUWGMRR0_K1_LBSPPA128_LBSPPB2048_LPB0_MIWT8_8_PLR1_SU32_SUM0_SUS256_SKXCCM8_VWA2_VWB8_WGM1_WGMXCC1_WGMXCCGn1
    SolutionIndex: 51
    SolutionNameMin: Cijk_Alik_Bjlk_BSS_BH_UserArgs_MT256x256x32_MI16x16x1_SN_LDSB1_CLR1_GSU0_GSUC0_GSUWGMRR0_K1_LBSPPA256_LBSPPB2048_LPB0_MIWT8_8_PLR1_SU32_SUM0_SUS256_SKXCCM8_VWA4_VWB8_WGM1_WGMXCC1_WGMXCCGn1
    SolutionIndex: 52
    SolutionNameMin: Cijk_Alik_Bjlk_BSS_BH_UserArgs_MT256x256x32_MI16x16x1_SN_LDSB1_CLR1_GSU0_GSUC0_GSUWGMRR0_K1_LBSPPA128_LBSPPB2048_LPB32_MIWT8_8_PLR1_SU32_SUM0_SUS256_SKXCCM8_VWA2_VWB2_WGM4_WGMXCC1_WGMXCCGn1
    SolutionIndex: 53
    SolutionNameMin: Cijk_Alik_Bjlk_BSS_BH_UserArgs_MT256x256x32_MI16x16x1_SN_LDSB1_CLR1_GSU0_GSUC0_GSUWGMRR0_K1_LBSPPA256_LBSPPB2048_LPB32_MIWT8_8_PLR1_SU32_SUM0_SUS256_SKXCCM8_VWA4_VWB2_WGM4_WGMXCC1_WGMXCCGn1
    SolutionIndex: 54
    SolutionNameMin: Cijk_Alik_Bjlk_BSS_BH_UserArgs_MT256x256x32_MI16x16x1_SN_LDSB1_CLR1_GSU0_GSUC0_GSUWGMRR0_K1_LBSPPA256_LBSPPB2048_LPB0_MIWT8_8_PLR1_SU32_SUM0_SUS256_SKXCCM8_VWA4_VWB4_WGM4_WGMXCC1_WGMXCCGn1
    SolutionIndex: 55
    SolutionNameMin: Cijk_Alik_Bjlk_BSS_BH_UserArgs_MT256x256x32_MI16x16x1_SN_LDSB1_CLR1_GSU0_GSUC0_GSUWGMRR0_K1_LBSPPA128_LBSPPB2048_LPB0_MIWT8_8_PLR1_SU32_SUM0_SUS256_SKXCCM8_VWA2_VWB8_WGM4_WGMXCC1_WGMXCCGn1
    SolutionIndex: 56
    SolutionNameMin: Cijk_Alik_Bjlk_BSS_BH_UserArgs_MT256x256x32_MI16x16x1_SN_LDSB1_CLR1_GSU0_GSUC0_GSUWGMRR0_K1_LBSPPA256_LBSPPB2048_LPB0_MIWT8_8_PLR1_SU32_SUM0_SUS256_SKXCCM8_VWA4_VWB8_WGM4_WGMXCC1_WGMXCCGn1
    SolutionIndex: 57
    SolutionNameMin: Cijk_Alik_Bjlk_BSS_BH_UserArgs_MT256x256x32_MI16x16x1_SN_LDSB1_CLR1_GSU0_GSUC0_GSUWGMRR0_K1_LBSPPA256_LBSPPB2048_LPB32_MIWT8_8_PLR1_SU32_SUM0_SUS256_SKXCCM8_VWA4_VWB2_WGM8_WGMXCC1_WGMXCCGn1
    SolutionIndex: 58
    SolutionNameMin: Cijk_Alik_Bjlk_BSS_BH_UserArgs_MT256x256x32_MI16x16x1_SN_LDSB1_CLR1_GSU0_GSUC0_GSUWGMRR0_K1_LBSPPA128_LBSPPB2048_LPB0_MIWT8_8_PLR1_SU32_SUM0_SUS256_SKXCCM8_VWA2_VWB8_WGM8_WGMXCC1_WGMXCCGn1
    SolutionIndex: 59
    SolutionNameMin: Cijk_Alik_Bjlk_BSS_BH_UserArgs_MT256x256x32_MI16x16x1_SN_LDSB1_CLR1_GSU0_GSUC0_GSUWGMRR0_K1_LBSPPA256_LBSPPB2048_LPB0_MIWT8_8_PLR1_SU32_SUM0_SUS256_SKXCCM8_VWA4_VWB8_WGM8_WGMXCC1_WGMXCCGn1
    SolutionIndex: 60
    SolutionNameMin: Cijk_Alik_Bjlk_BSS_BH_UserArgs_MT128x256x32_MI16x16x1_SN_LDSB1_CLR1_GSU0_GSUC0_GSUWGMRR0_K1_LBSPPA256_LBSPPB2048_LPB0_MIWT4_8_PLR1_SU32_SUM0_SUS256_SKXCCM8_VWA4_VWB8_WGM1_WGMXCC1_WGMXCCGn1
    SolutionIndex: 61
    SolutionNameMin: Cijk_Alik_Bjlk_BSS_BH_UserArgs_MT128x128x32_MI16x16x1_SN_LDSB1_CLR1_GSU0_GSUC0_GSUWGMRR0_K1_LBSPPA256_LBSPPB1024_LPB32_MIWT4_4_PLR1_SU32_SUM0_SUS256_SKXCCM8_VWA4_VWB2_WGM1_WGMXCC1_WGMXCCGn1
    SolutionIndex: 62
    SolutionNameMin: Cijk_Alik_Bjlk_BSS_BH_UserArgs_MT128x128x32_MI16x16x1_SN_LDSB1_CLR1_GSU0_GSUC0_GSUWGMRR0_K1_LBSPPA256_LBSPPB1024_LPB0_MIWT4_4_PLR1_SU32_SUM0_SUS256_SKXCCM8_VWA4_VWB4_WGM1_WGMXCC1_WGMXCCGn1
    SolutionIndex: 63
    SolutionNameMin: Cijk_Alik_Bjlk_BSS_BH_UserArgs_MT128x128x32_MI16x16x1_SN_LDSB1_CLR1_GSU0_GSUC0_GSUWGMRR0_K1_LBSPPA256_LBSPPB1024_LPB0_MIWT4_4_PLR1_SU32_SUM0_SUS256_SKXCCM8_VWA4_VWB4_WGM4_WGMXCC1_WGMXCCGn1
    SolutionIndex: 64
    SolutionNameMin: Cijk_Alik_Bjlk_BSS_BH_UserArgs_MT128x128x32_MI16x16x1_SN_LDSB1_CLR1_GSU0_GSUC0_GSUWGMRR0_K1_LBSPPA256_LBSPPB1024_LPB32_MIWT4_4_PLR1_SU32_SUM0_SUS256_SKXCCM8_VWA4_VWB2_WGM8_WGMXCC1_WGMXCCGn1
    SolutionIndex: 65
    SolutionNameMin: Cijk_Alik_Bjlk_BSS_BH_UserArgs_MT128x128x32_MI16x16x1_SN_LDSB1_CLR1_GSU0_GSUC0_GSUWGMRR0_K1_LBSPPA128_LBSPPB1024_LPB0_MIWT4_4_PLR1_SU32_SUM0_SUS256_SKXCCM8_VWA1_VWB4_WGM8_WGMXCC1_WGMXCCGn1
    SolutionIndex: 66
    SolutionNameMin: Cijk_Alik_Bjlk_BSS_BH_UserArgs_MT64x128x32_MI16x16x1_SN_LDSB0_CLR1_GSU0_GSUC0_GSUWGMRR0_K1_LBSPPA128_LBSPPB1024_LPB0_MIWT2_4_PLR1_SU32_SUM0_SUS256_SKXCCM8_VWA1_VWB4_WGM1_WGMXCC1_WGMXCCGn1
    SolutionIndex: 67
    SolutionNameMin: Cijk_Alik_Bjlk_BSS_BH_UserArgs_MT64x128x32_MI16x16x1_SN_LDSB0_CLR1_GSU0_GSUC0_GSUWGMRR0_K1_LBSPPA128_LBSPPB1024_LPB0_MIWT2_4_PLR1_SU32_SUM0_SUS256_SKXCCM8_VWA1_VWB4_WGM4_WGMXCC1_WGMXCCGn1
    SolutionIndex: 68
    SolutionNameMin: Cijk_Alik_Bjlk_BSS_BH_UserArgs_MT32x32x32_MI16x16x1_SN_LDSB0_CLR0_GSU0_GSUC0_GSUWGMRR0_K1_LBSPPA128_LBSPPB256_LPB16_MIWT1_1_PLR0_SU32_SUM0_SUS256_SKXCCM8_VWA1_VWB1_WGM1_WGMXCC1_WGMXCCGn1
    SolutionIndex: 69
    SolutionNameMin: Cijk_Alik_Bjlk_BSS_BH_UserArgs_MT128x256x64_MI16x16x1_SN_LDSB1_CLR1_GSU0_GSUC0_GSUWGMRR0_K1_LBSPPA512_LBSPPB4096_LPB0_MIWT4_8_PLR1_SU32_SUM0_SUS256_SKXCCM8_VWA4_VWB4_WGM1_WGMXCC1_WGMXCCGn1
    SolutionIndex: 70
    SolutionNameMin: Cijk_Alik_Bjlk_BSS_BH_UserArgs_MT128x256x64_MI16x16x1_SN_LDSB1_CLR1_GSU0_GSUC0_GSUWGMRR0_K1_LBSPPA128_LBSPPB4096_LPB0_MIWT4_8_PLR1_SU32_SUM0_SUS256_SKXCCM8_VWA1_VWB8_WGM1_WGMXCC1_WGMXCCGn1
    SolutionIndex: 71
    SolutionNameMin: Cijk_Alik_Bjlk_BSS_BH_UserArgs_MT128x256x64_MI16x16x1_SN_LDSB1_CLR1_GSU0_GSUC0_GSUWGMRR0_K1_LBSPPA256_LBSPPB4096_LPB0_MIWT4_8_PLR1_SU32_SUM0_SUS256_SKXCCM8_VWA2_VWB8_WGM1_WGMXCC1_WGMXCCGn1
    SolutionIndex: 72
    SolutionNameMin: Cijk_Alik_Bjlk_BSS_BH_UserArgs_MT128x256x64_MI16x16x1_SN_LDSB1_CLR1_GSU0_GSUC0_GSUWGMRR0_K1_LBSPPA512_LBSPPB4096_LPB0_MIWT4_8_PLR1_SU32_SUM0_SUS256_SKXCCM8_VWA4_VWB4_WGM4_WGMXCC1_WGMXCCGn1
    SolutionIndex: 73
    SolutionNameMin: Cijk_Alik_Bjlk_BSS_BH_UserArgs_MT128x256x64_MI16x16x1_SN_LDSB1_CLR1_GSU0_GSUC0_GSUWGMRR0_K1_LBSPPA512_LBSPPB4096_LPB0_MIWT4_8_PLR1_SU32_SUM0_SUS256_SKXCCM8_VWA4_VWB8_WGM4_WGMXCC1_WGMXCCGn1
    SolutionIndex: 74
    SolutionNameMin: Cijk_Alik_Bjlk_BSS_BH_UserArgs_MT256x128x64_MI16x16x1_SN_LDSB1_CLR1_GSU0_GSUC0_GSUWGMRR0_K1_LBSPPA512_LBSPPB2048_LPB32_MIWT8_4_PLR1_SU32_SUM0_SUS256_SKXCCM8_VWA4_VWB2_WGM1_WGMXCC1_WGMXCCGn1
    SolutionIndex: 75
    SolutionNameMin: Cijk_Alik_Bjlk_BSS_BH_UserArgs_MT256x128x64_MI16x16x1_SN_LDSB1_CLR1_GSU0_GSUC0_GSUWGMRR0_K1_LBSPPA256_LBSPPB2048_LPB0_MIWT8_4_PLR1_SU32_SUM0_SUS256_SKXCCM8_VWA2_VWB4_WGM1_WGMXCC1_WGMXCCGn1
    SolutionIndex: 76
    SolutionNameMin: Cijk_Alik_Bjlk_BSS_BH_UserArgs_MT256x128x64_MI16x16x1_SN_LDSB1_CLR1_GSU0_GSUC0_GSUWGMRR0_K1_LBSPPA512_LBSPPB2048_LPB0_MIWT8_4_PLR1_SU32_SUM0_SUS256_SKXCCM8_VWA4_VWB4_WGM1_WGMXCC1_WGMXCCGn1
    SolutionIndex: 77
    SolutionNameMin: Cijk_Alik_Bjlk_BSS_BH_UserArgs_MT256x128x64_MI16x16x1_SN_LDSB1_CLR1_GSU0_GSUC0_GSUWGMRR0_K1_LBSPPA256_LBSPPB2048_LPB0_MIWT8_4_PLR1_SU32_SUM0_SUS256_SKXCCM8_VWA2_VWB4_WGM8_WGMXCC1_WGMXCCGn1
    SolutionIndex: 78
    SolutionNameMin: Cijk_Alik_Bjlk_BSS_BH_UserArgs_MT256x128x64_MI16x16x1_SN_LDSB1_CLR1_GSU0_GSUC0_GSUWGMRR0_K1_LBSPPA512_LBSPPB2048_LPB0_MIWT8_4_PLR1_SU32_SUM0_SUS256_SKXCCM8_VWA4_VWB4_WGM8_WGMXCC1_WGMXCCGn1
    SolutionIndex: 79
    SolutionNameMin: Cijk_Alik_Bjlk_BSS_BH_UserArgs_MT128x128x64_MI16x16x1_SN_LDSB1_CLR1_GSU0_GSUC0_GSUWGMRR0_K1_LBSPPA128_LBSPPB2048_LPB0_MIWT4_4_PLR1_SU32_SUM0_SUS256_SKXCCM8_VWA1_VWB4_WGM1_WGMXCC1_WGMXCCGn1
    SolutionIndex: 80
    SolutionNameMin: Cijk_Alik_Bjlk_BSS_BH_UserArgs_MT128x128x64_MI16x16x1_SN_LDSB1_CLR1_GSU0_GSUC0_GSUWGMRR0_K1_LBSPPA512_LBSPPB2048_LPB0_MIWT4_4_PLR1_SU32_SUM0_SUS256_SKXCCM8_VWA4_VWB4_WGM1_WGMXCC1_WGMXCCGn1
    SolutionIndex: 81
    SolutionNameMin: Cijk_Alik_Bjlk_BSS_BH_UserArgs_MT128x128x64_MI16x16x1_SN_LDSB1_CLR1_GSU0_GSUC0_GSUWGMRR0_K1_LBSPPA512_LBSPPB2048_LPB32_MIWT4_4_PLR1_SU32_SUM0_SUS256_SKXCCM8_VWA4_VWB2_WGM4_WGMXCC1_WGMXCCGn1
    SolutionIndex: 82
    SolutionNameMin: Cijk_Alik_Bjlk_BSS_BH_UserArgs_MT128x128x64_MI16x16x1_SN_LDSB1_CLR1_GSU0_GSUC0_GSUWGMRR0_K1_LBSPPA512_LBSPPB2048_LPB0_MIWT4_4_PLR1_SU32_SUM0_SUS256_SKXCCM8_VWA4_VWB4_WGM4_WGMXCC1_WGMXCCGn1
    SolutionIndex: 83
    SolutionNameMin: Cijk_Alik_Bjlk_BSS_BH_UserArgs_MT128x128x64_MI16x16x1_SN_LDSB1_CLR1_GSU0_GSUC0_GSUWGMRR0_K1_LBSPPA512_LBSPPB2048_LPB32_MIWT4_4_PLR1_SU32_SUM0_SUS256_SKXCCM8_VWA4_VWB2_WGM8_WGMXCC1_WGMXCCGn1
    SolutionIndex: 84
    SolutionNameMin: Cijk_Alik_Bjlk_BSS_BH_UserArgs_MT128x128x64_MI16x16x1_SN_LDSB1_CLR1_GSU0_GSUC0_GSUWGMRR0_K1_LBSPPA128_LBSPPB2048_LPB0_MIWT4_4_PLR1_SU32_SUM0_SUS256_SKXCCM8_VWA1_VWB4_WGM8_WGMXCC1_WGMXCCGn1
    SolutionIndex: 85
    SolutionNameMin: Cijk_Alik_Bjlk_BSS_BH_UserArgs_MT128x128x64_MI16x16x1_SN_LDSB1_CLR1_GSU0_GSUC0_GSUWGMRR0_K1_LBSPPA256_LBSPPB2048_LPB0_MIWT4_4_PLR1_SU32_SUM0_SUS256_SKXCCM8_VWA2_VWB4_WGM8_WGMXCC1_WGMXCCGn1
    SolutionIndex: 86
    SolutionNameMin: Cijk_Alik_Bjlk_BSS_BH_UserArgs_MT128x128x64_MI16x16x1_SN_LDSB1_CLR1_GSU0_GSUC0_GSUWGMRR0_K1_LBSPPA512_LBSPPB2048_LPB0_MIWT4_4_PLR1_SU32_SUM0_SUS256_SKXCCM8_VWA4_VWB4_WGM8_WGMXCC1_WGMXCCGn1
    SolutionIndex: 87
    SolutionNameMin: Cijk_Alik_Bjlk_BSS_BH_UserArgs_MT64x128x64_MI16x16x1_SN_LDSB1_CLR1_GSU0_GSUC0_GSUWGMRR0_K1_LBSPPA128_LBSPPB2048_LPB0_MIWT2_4_PLR1_SU32_SUM0_SUS256_SKXCCM8_VWA1_VWB4_WGM1_WGMXCC1_WGMXCCGn1
    SolutionIndex: 88
    SolutionNameMin: Cijk_Alik_Bjlk_BSS_BH_UserArgs_MT64x128x64_MI16x16x1_SN_LDSB1_CLR1_GSU0_GSUC0_GSUWGMRR0_K1_LBSPPA128_LBSPPB2048_LPB0_MIWT2_4_PLR1_SU32_SUM0_SUS256_SKXCCM8_VWA1_VWB4_WGM4_WGMXCC1_WGMXCCGn1
    SolutionIndex: 89
    SolutionNameMin: Cijk_Alik_Bjlk_BSS_BH_UserArgs_MT128x64x64_MI16x16x1_SN_LDSB1_CLR1_GSU0_GSUC0_GSUWGMRR0_K1_LBSPPA512_LBSPPB1024_LPB32_MIWT4_2_PLR1_SU32_SUM0_SUS256_SKXCCM8_VWA4_VWB2_WGM1_WGMXCC1_WGMXCCGn1
    SolutionIndex: 90
    SolutionNameMin: Cijk_Alik_Bjlk_BSS_BH_UserArgs_MT128x64x64_MI16x16x1_SN_LDSB1_CLR1_GSU0_GSUC0_GSUWGMRR0_K1_LBSPPA512_LBSPPB1024_LPB32_MIWT4_2_PLR1_SU32_SUM0_SUS256_SKXCCM8_VWA4_VWB2_WGM4_WGMXCC1_WGMXCCGn1
    SolutionIndex: 91
    SolutionNameMin: Cijk_Alik_Bjlk_BSS_BH_UserArgs_MT128x64x64_MI16x16x1_SN_LDSB1_CLR1_GSU0_GSUC0_GSUWGMRR0_K1_LBSPPA512_LBSPPB1024_LPB32_MIWT4_2_PLR1_SU32_SUM0_SUS256_SKXCCM8_VWA4_VWB2_WGM8_WGMXCC1_WGMXCCGn1
    SolutionIndex: 92
    SolutionNameMin: Cijk_Alik_Bjlk_BSS_BH_UserArgs_MT64x64x64_MI16x16x1_SN_LDSB1_CLR1_GSU0_GSUC0_GSUWGMRR0_K1_LBSPPA128_LBSPPB1024_LPB32_MIWT2_2_PLR1_SU32_SUM0_SUS256_SKXCCM8_VWA1_VWB2_WGM1_WGMXCC1_WGMXCCGn1
    SolutionIndex: 93
    SolutionNameMin: Cijk_Alik_Bjlk_BSS_BH_UserArgs_MT64x64x64_MI16x16x1_SN_LDSB1_CLR1_GSU0_GSUC0_GSUWGMRR0_K1_LBSPPA128_LBSPPB1024_LPB32_MIWT2_2_PLR1_SU32_SUM0_SUS256_SKXCCM8_VWA1_VWB2_WGM4_WGMXCC1_WGMXCCGn1
    SolutionIndex: 94
    SolutionNameMin: Cijk_Alik_Bjlk_BSS_BH_UserArgs_MT64x64x64_MI16x16x1_SN_LDSB1_CLR1_GSU0_GSUC0_GSUWGMRR0_K1_LBSPPA128_LBSPPB1024_LPB32_MIWT2_2_PLR1_SU32_SUM0_SUS256_SKXCCM8_VWA1_VWB2_WGM8_WGMXCC1_WGMXCCGn1
    SolutionIndex: 95
    SolutionNameMin: Cijk_Alik_Bjlk_BSS_BH_UserArgs_MT32x64x64_MI16x16x1_SN_LDSB0_CLR1_GSU0_GSUC0_GSUWGMRR0_K1_LBSPPA128_LBSPPB1024_LPB32_MIWT1_2_PLR1_SU32_SUM0_SUS256_SKXCCM8_VWA1_VWB2_WGM1_WGMXCC1_WGMXCCGn1
    SolutionIndex: 96
    SolutionNameMin: Cijk_Alik_Bjlk_BSS_BH_UserArgs_MT64x32x64_MI16x16x1_SN_LDSB0_CLR1_GSU0_GSUC0_GSUWGMRR0_K1_LBSPPA128_LBSPPB512_LPB16_MIWT2_1_PLR1_SU32_SUM0_SUS256_SKXCCM8_VWA1_VWB1_WGM1_WGMXCC1_WGMXCCGn1
    SolutionIndex: 97
    SolutionNameMin: Cijk_Alik_Bjlk_BSS_BH_UserArgs_MT32x32x64_MI16x16x1_SN_LDSB0_CLR1_GSU0_GSUC0_GSUWGMRR0_K1_LBSPPA128_LBSPPB512_LPB16_MIWT1_1_PLR1_SU32_SUM0_SUS256_SKXCCM8_VWA1_VWB1_WGM1_WGMXCC1_WGMXCCGn1
    SolutionIndex: 98
    SolutionNameMin: Cijk_Alik_Bjlk_BSS_BH_UserArgs_MT64x128x128_MI16x16x1_SN_LDSB1_CLR1_GSU0_GSUC0_GSUWGMRR0_K1_LBSPPA256_LBSPPB2048_LPB0_MIWT2_4_PLR2_SU32_SUM0_SUS256_SKXCCM8_VWA1_VWB4_WGM1_WGMXCC1_WGMXCCGn1
    SolutionIndex: 99
    SolutionNameMin: Cijk_Alik_Bjlk_BSS_BH_UserArgs_MT128x64x128_MI16x16x1_SN_LDSB1_CLR1_GSU0_GSUC0_GSUWGMRR0_K1_LBSPPA512_LBSPPB1024_LPB32_MIWT4_2_PLR2_SU32_SUM0_SUS256_SKXCCM8_VWA2_VWB2_WGM1_WGMXCC1_WGMXCCGn1
    SolutionIndex: 100
    SolutionNameMin: Cijk_Alik_Bjlk_BSS_BH_UserArgs_MT128x64x128_MI16x16x1_SN_LDSB1_CLR1_GSU0_GSUC0_GSUWGMRR0_K1_LBSPPA1024_LBSPPB1024_LPB32_MIWT4_2_PLR2_SU32_SUM0_SUS256_SKXCCM8_VWA4_VWB2_WGM1_WGMXCC1_WGMXCCGn1
    SolutionIndex: 101
    SolutionNameMin: Cijk_Alik_Bjlk_BSS_BH_UserArgs_MT128x64x128_MI16x16x1_SN_LDSB1_CLR1_GSU0_GSUC0_GSUWGMRR0_K1_LBSPPA1024_LBSPPB1024_LPB32_MIWT4_2_PLR2_SU32_SUM0_SUS256_SKXCCM8_VWA4_VWB2_WGM4_WGMXCC1_WGMXCCGn1
    SolutionIndex: 102
    SolutionNameMin: Cijk_Alik_Bjlk_BSS_BH_UserArgs_MT128x64x128_MI16x16x1_SN_LDSB1_CLR1_GSU0_GSUC0_GSUWGMRR0_K1_LBSPPA256_LBSPPB1024_LPB32_MIWT4_2_PLR2_SU32_SUM0_SUS256_SKXCCM8_VWA1_VWB2_WGM8_WGMXCC1_WGMXCCGn1
    SolutionIndex: 103
    SolutionNameMin: Cijk_Alik_Bjlk_BSS_BH_UserArgs_MT128x64x128_MI16x16x1_SN_LDSB1_CLR1_GSU0_GSUC0_GSUWGMRR0_K1_LBSPPA512_LBSPPB1024_LPB32_MIWT4_2_PLR2_SU32_SUM0_SUS256_SKXCCM8_VWA2_VWB2_WGM8_WGMXCC1_WGMXCCGn1
    SolutionIndex: 104
    SolutionNameMin: Cijk_Alik_Bjlk_BSS_BH_UserArgs_MT128x64x128_MI16x16x1_SN_LDSB1_CLR1_GSU0_GSUC0_GSUWGMRR0_K1_LBSPPA1024_LBSPPB1024_LPB32_MIWT4_2_PLR2_SU32_SUM0_SUS256_SKXCCM8_VWA4_VWB2_WGM8_WGMXCC1_WGMXCCGn1
    SolutionIndex: 105
    SolutionNameMin: Cijk_Alik_Bjlk_BSS_BH_UserArgs_MT64x64x128_MI16x16x1_SN_LDSB1_CLR1_GSU0_GSUC0_GSUWGMRR0_K1_LBSPPA256_LBSPPB1024_LPB32_MIWT2_2_PLR2_SU32_SUM0_SUS256_SKXCCM8_VWA1_VWB2_WGM1_WGMXCC1_WGMXCCGn1
    SolutionIndex: 106
    SolutionNameMin: Cijk_Alik_Bjlk_BSS_BH_UserArgs_MT64x64x128_MI16x16x1_SN_LDSB1_CLR1_GSU0_GSUC0_GSUWGMRR0_K1_LBSPPA512_LBSPPB1024_LPB32_MIWT2_2_PLR2_SU32_SUM0_SUS256_SKXCCM8_VWA2_VWB2_WGM1_WGMXCC1_WGMXCCGn1
    SolutionIndex: 107
    SolutionNameMin: Cijk_Alik_Bjlk_BSS_BH_UserArgs_MT64x64x128_MI16x16x1_SN_LDSB1_CLR1_GSU0_GSUC0_GSUWGMRR0_K1_LBSPPA256_LBSPPB1024_LPB32_MIWT2_2_PLR2_SU32_SUM0_SUS256_SKXCCM8_VWA1_VWB2_WGM4_WGMXCC1_WGMXCCGn1
    SolutionIndex: 108
    SolutionNameMin: Cijk_Alik_Bjlk_BSS_BH_UserArgs_MT64x64x128_MI16x16x1_SN_LDSB1_CLR1_GSU0_GSUC0_GSUWGMRR0_K1_LBSPPA512_LBSPPB1024_LPB32_MIWT2_2_PLR2_SU32_SUM0_SUS256_SKXCCM8_VWA2_VWB2_WGM4_WGMXCC1_WGMXCCGn1
    SolutionIndex: 109
    SolutionNameMin: Cijk_Alik_Bjlk_BSS_BH_UserArgs_MT64x64x128_MI16x16x1_SN_LDSB1_CLR1_GSU0_GSUC0_GSUWGMRR0_K1_LBSPPA256_LBSPPB1024_LPB32_MIWT2_2_PLR2_SU32_SUM0_SUS256_SKXCCM8_VWA1_VWB2_WGM8_WGMXCC1_WGMXCCGn1
    SolutionIndex: 110
    SolutionNameMin: Cijk_Alik_Bjlk_BSS_BH_UserArgs_MT32x64x128_MI16x16x1_SN_LDSB1_CLR1_GSU0_GSUC0_GSUWGMRR0_K1_LBSPPA256_LBSPPB1024_LPB32_MIWT1_2_PLR2_SU32_SUM0_SUS256_SKXCCM8_VWA1_VWB2_WGM1_WGMXCC1_WGMXCCGn1
    SolutionIndex: 111
    SolutionNameMin: Cijk_Alik_Bjlk_BSS_BH_UserArgs_MT32x64x128_MI16x16x1_SN_LDSB1_CLR1_GSU0_GSUC0_GSUWGMRR0_K1_LBSPPA256_LBSPPB1024_LPB32_MIWT1_2_PLR2_SU32_SUM0_SUS256_SKXCCM8_VWA1_VWB2_WGM4_WGMXCC1_WGMXCCGn1
    SolutionIndex: 112
    SolutionNameMin: Cijk_Alik_Bjlk_BSS_BH_UserArgs_MT32x64x128_MI16x16x1_SN_LDSB1_CLR1_GSU0_GSUC0_GSUWGMRR0_K1_LBSPPA256_LBSPPB1024_LPB32_MIWT1_2_PLR2_SU32_SUM0_SUS256_SKXCCM8_VWA1_VWB2_WGM8_WGMXCC1_WGMXCCGn1
    SolutionIndex: 113
    SolutionNameMin: Cijk_Alik_Bjlk_BSS_BH_UserArgs_MT32x32x128_MI16x16x1_SN_LDSB1_CLR1_GSU0_GSUC0_GSUWGMRR0_K1_LBSPPA256_LBSPPB512_LPB16_MIWT1_1_PLR1_SU32_SUM0_SUS256_SKXCCM8_VWA1_VWB1_WGM1_WGMXCC1_WGMXCCGn1
    SolutionIndex: 114
    SolutionNameMin: Cijk_Alik_Bjlk_BSS_BH_UserArgs_MT32x32x128_MI16x16x1_SN_LDSB1_CLR1_GSU0_GSUC0_GSUWGMRR0_K1_LBSPPA256_LBSPPB512_LPB16_MIWT1_1_PLR2_SU32_SUM0_SUS256_SKXCCM8_VWA1_VWB1_WGM1_WGMXCC1_WGMXCCGn1
    SolutionIndex: 115
    SolutionNameMin: Cijk_Alik_Bjlk_BSS_BH_UserArgs_MT32x32x128_MI16x16x1_SN_LDSB1_CLR1_GSU0_GSUC0_GSUWGMRR0_K1_LBSPPA256_LBSPPB512_LPB16_MIWT1_1_PLR2_SU32_SUM0_SUS256_SKXCCM8_VWA1_VWB1_WGM4_WGMXCC1_WGMXCCGn1
    SolutionIndex: 116
    SolutionNameMin: Cijk_Alik_Bjlk_BSS_BH_UserArgs_MT32x32x128_MI16x16x1_SN_LDSB1_CLR1_GSU0_GSUC0_GSUWGMRR0_K1_LBSPPA256_LBSPPB512_LPB16_MIWT1_1_PLR2_SU32_SUM0_SUS256_SKXCCM8_VWA1_VWB1_WGM8_WGMXCC1_WGMXCCGn1
    SolutionIndex: 117
    SolutionNameMin: Cijk_Alik_Bjlk_BSS_BH_UserArgs_MT32x32x32_MI16x16x1_SN_LDSB0_CLR1_GSU0_GSUC0_GSUWGMRR0_K1_LBSPPA128_LBSPPB256_LPB16_MIWT1_1_PLR1_SU32_SUM0_SUS256_SKXCCM8_VWA1_VWB1_WGM8_WGMXCC1_WGMXCCGn1
- - - [128, 128, 1, 128, 128, 128, 128, 128]
    - [97, 0.084]
  - - [128, 128, 1, 256, 128, 128, 256, 128]
    - [97, 0.151]
  - - [128, 128, 1, 512, 128, 128, 512, 128]
    - [45, 0.253]
  - - [128, 128, 1, 1024, 128, 128, 1024, 128]
    - [45, 0.388]
  - - [128, 128, 1, 2048, 128, 128, 2048, 128]
    - [68, 0.589]
  - - [128, 128, 1, 4096, 128, 128, 4096, 128]
    - [97, 1.042]
  - - [128, 128, 1, 8192, 128, 128, 8192, 128]
    - [45, 1.562]
  - - [128, 256, 1, 128, 128, 128, 128, 256]
    - [97, 0.17]
  - - [128, 256, 1, 256, 128, 128, 256, 256]
    - [97, 0.308]
  - - [128, 256, 1, 512, 128, 128, 512, 256]
    - [113, 0.512]
  - - [128, 256, 1, 1024, 128, 128, 1024, 256]
    - [45, 0.784]
  - - [128, 256, 1, 2048, 128, 128, 2048, 256]
    - [45, 1.159]
  - - [128, 256, 1, 4096, 128, 128, 4096, 256]
    - [97, 2.021]
  - - [128, 256, 1, 8192, 128, 128, 8192, 256]
    - [45, 3.028]
  - - [128, 512, 1, 128, 128, 128, 128, 512]
    - [44, 0.334]
  - - [128, 512, 1, 256, 128, 128, 256, 512]
    - [97, 0.608]
  - - [128, 512, 1, 512, 128, 128, 512, 512]
    - [44, 1.031]
  - - [128, 512, 1, 1024, 128, 128, 1024, 512]
    - [45, 1.55]
  - - [128, 512, 1, 2048, 128, 128, 2048, 512]
    - [45, 2.259]
  - - [128, 512, 1, 4096, 128, 128, 4096, 512]
    - [97, 3.824]
  - - [128, 512, 1, 8192, 128, 128, 8192, 512]
    - [44, 5.702]
  - - [128, 1024, 1, 128, 128, 128, 128, 1024]
    - [97, 0.663]
  - - [128, 1024, 1, 256, 128, 128, 256, 1024]
    - [30, 1.193]
  - - [128, 1024, 1, 512, 128, 128, 512, 1024]
    - [45, 2.012]
  - - [128, 1024, 1, 1024, 128, 128, 1024, 1024]
    - [45, 3.074]
  - - [128, 1024, 1, 2048, 128, 128, 2048, 1024]
    - [45, 4.229]
  - - [128, 1024, 1, 4096, 128, 128, 4096, 1024]
    - [47, 6.325]
  - - [128, 1024, 1, 8192, 128, 128, 8192, 1024]
    - [42, 9.506]
  - - [128, 2048, 1, 128, 128, 128, 128, 2048]
    - [30, 1.271]
  - - [128, 2048, 1, 256, 128, 128, 256, 2048]
    - [113, 2.254]
  - - [128, 2048, 1, 512, 128, 128, 512, 2048]
    - [45, 3.876]
  - - [128, 2048, 1, 1024, 128, 128, 1024, 2048]
    - [113, 5.834]
  - - [128, 2048, 1, 2048, 128, 128, 2048, 2048]
    - [42, 7.347]
  - - [128, 2048, 1, 4096, 128, 128, 4096, 2048]
    - [28, 9.952]
  - - [128, 2048, 1, 8192, 128, 128, 8192, 2048]
    - [39, 13.508]
  - - [128, 4096, 1, 128, 128, 128, 128, 4096]
    - [110, 2.249]
  - - [128, 4096, 1, 256, 128, 128, 256, 4096]
    - [110, 4.04]
  - - [128, 4096, 1, 512, 128, 128, 512, 4096]
    - [112, 6.609]
  - - [128, 4096, 1, 1024, 128, 128, 1024, 4096]
    - [110, 9.618]
  - - [128, 4096, 1, 2048, 128, 128, 2048, 4096]
    - [105, 10.962]
  - - [128, 4096, 1, 4096, 128, 128, 4096, 4096]
    - [105, 14.173]
  - - [128, 4096, 1, 8192, 128, 128, 8192, 4096]
    - [100, 18.256]
  - - [128, 8192, 1, 128, 128, 128, 128, 8192]
    - [92, 3.846]
  - - [128, 8192, 1, 256, 128, 128, 256, 8192]
    - [92, 6.731]
  - - [128, 8192, 1, 512, 128, 128, 512, 8192]
    - [92, 10.649]
  - - [128, 8192, 1, 1024, 128, 128, 1024, 8192]
    - [106, 14.295]
  - - [128, 8192, 1, 2048, 128, 128, 2048, 8192]
    - [106, 15.7]
  - - [128, 8192, 1, 4096, 128, 128, 4096, 8192]
    - [33, 18.251]
  - - [128, 8192, 1, 8192, 128, 128, 8192, 8192]
    - [23, 21.607]
  - - [256, 128, 1, 128, 256, 256, 128, 128]
    - [113, 0.169]
  - - [256, 128, 1, 256, 256, 256, 256, 128]
    - [97, 0.309]
  - - [256, 128, 1, 512, 256, 256, 512, 128]
    - [114, 0.513]
  - - [256, 128, 1, 1024, 256, 256, 1024, 128]
    - [45, 0.788]
  - - [256, 128, 1, 2048, 256, 256, 2048, 128]
    - [45, 1.161]
  - - [256, 128, 1, 4096, 256, 256, 4096, 128]
    - [97, 2.009]
  - - [256, 128, 1, 8192, 256, 256, 8192, 128]
    - [114, 3.1]
  - - [256, 256, 1, 128, 256, 256, 128, 256]
    - [97, 0.34]
  - - [256, 256, 1, 256, 256, 256, 256, 256]
    - [44, 0.606]
  - - [256, 256, 1, 512, 256, 256, 512, 256]
    - [97, 1.011]
  - - [256, 256, 1, 1024, 256, 256, 1024, 256]
    - [44, 1.55]
  - - [256, 256, 1, 2048, 256, 256, 2048, 256]
    - [114, 2.271]
  - - [256, 256, 1, 4096, 256, 256, 4096, 256]
    - [97, 3.787]
  - - [256, 256, 1, 8192, 256, 256, 8192, 256]
    - [45, 5.645]
  - - [256, 512, 1, 128, 256, 256, 128, 512]
    - [97, 0.665]
  - - [256, 512, 1, 256, 256, 256, 256, 512]
    - [30, 1.146]
  - - [256, 512, 1, 512, 256, 256, 512, 512]
    - [113, 2.0]
  - - [256, 512, 1, 1024, 256, 256, 1024, 512]
    - [44, 2.965]
  - - [256, 512, 1, 2048, 256, 256, 2048, 512]
    - [114, 4.295]
  - - [256, 512, 1, 4096, 256, 256, 4096, 512]
    - [95, 6.446]
  - - [256, 512, 1, 8192, 256, 256, 8192, 512]
    - [43, 9.403]
  - - [256, 1024, 1, 128, 256, 256, 128, 1024]
    - [30, 1.248]
  - - [256, 1024, 1, 256, 256, 256, 256, 1024]
    - [30, 2.268]
  - - [256, 1024, 1, 512, 256, 256, 512, 1024]
    - [113, 3.833]
  - - [256, 1024, 1, 1024, 256, 256, 1024, 1024]
    - [45, 5.868]
  - - [256, 1024, 1, 2048, 256, 256, 2048, 1024]
    - [46, 7.832]
  - - [256, 1024, 1, 4096, 256, 256, 4096, 1024]
    - [42, 10.063]
  - - [256, 1024, 1, 8192, 256, 256, 8192, 1024]
    - [39, 14.462]
  - - [256, 2048, 1, 128, 256, 256, 128, 2048]
    - [29, 2.279]
  - - [256, 2048, 1, 256, 256, 256, 256, 2048]
    - [40, 4.051]
  - - [256, 2048, 1, 512, 256, 256, 512, 2048]
    - [110, 6.744]
  - - [256, 2048, 1, 1024, 256, 256, 1024, 2048]
    - [110, 9.886]
  - - [256, 2048, 1, 2048, 256, 256, 2048, 2048]
    - [38, 11.201]
  - - [256, 2048, 1, 4096, 256, 256, 4096, 2048]
    - [105, 14.304]
  - - [256, 2048, 1, 8192, 256, 256, 8192, 2048]
    - [100, 18.606]
  - - [256, 4096, 1, 128, 256, 256, 128, 4096]
    - [92, 3.846]
  - - [256, 4096, 1, 256, 256, 256, 256, 4096]
    - [92, 6.734]
  - - [256, 4096, 1, 512, 256, 256, 512, 4096]
    - [92, 10.73]
  - - [256, 4096, 1, 1024, 256, 256, 1024, 4096]
    - [105, 14.422]
  - - [256, 4096, 1, 2048, 256, 256, 2048, 4096]
    - [105, 16.19]
  - - [256, 4096, 1, 4096, 256, 256, 4096, 4096]
    - [100, 19.422]
  - - [256, 4096, 1, 8192, 256, 256, 8192, 4096]
    - [82, 21.516]
  - - [256, 8192, 1, 128, 256, 256, 128, 8192]
    - [66, 5.808]
  - - [256, 8192, 1, 256, 256, 256, 256, 8192]
    - [90, 9.63]
  - - [256, 8192, 1, 512, 256, 256, 512, 8192]
    - [87, 14.308]
  - - [256, 8192, 1, 1024, 256, 256, 1024, 8192]
    - [100, 18.539]
  - - [256, 8192, 1, 2048, 256, 256, 2048, 8192]
    - [101, 20.866]
  - - [256, 8192, 1, 4096, 256, 256, 4096, 8192]
    - [98, 23.395]
  - - [256, 8192, 1, 8192, 256, 256, 8192, 8192]
    - [18, 25.66]
  - - [512, 128, 1, 128, 512, 512, 128, 128]
    - [45, 0.337]
  - - [512, 128, 1, 256, 512, 512, 256, 128]
    - [30, 0.606]
  - - [512, 128, 1, 512, 512, 512, 512, 128]
    - [44, 1.025]
  - - [512, 128, 1, 1024, 512, 512, 1024, 128]
    - [114, 1.559]
  - - [512, 128, 1, 2048, 512, 512, 2048, 128]
    - [113, 2.26]
  - - [512, 128, 1, 4096, 512, 512, 4096, 128]
    - [97, 3.888]
  - - [512, 128, 1, 8192, 512, 512, 8192, 128]
    - [115, 5.937]
  - - [512, 256, 1, 128, 512, 512, 128, 256]
    - [97, 0.663]
  - - [512, 256, 1, 256, 512, 512, 256, 256]
    - [30, 1.204]
  - - [512, 256, 1, 512, 512, 512, 512, 256]
    - [44, 2.023]
  - - [512, 256, 1, 1024, 512, 512, 1024, 256]
    - [113, 3.045]
  - - [512, 256, 1, 2048, 512, 512, 2048, 256]
    - [114, 4.28]
  - - [512, 256, 1, 4096, 512, 512, 4096, 256]
    - [95, 6.424]
  - - [512, 256, 1, 8192, 512, 512, 8192, 256]
    - [43, 9.371]
  - - [512, 512, 1, 128, 512, 512, 128, 512]
    - [97, 1.244]
  - - [512, 512, 1, 256, 512, 512, 256, 512]
    - [30, 2.309]
  - - [512, 512, 1, 512, 512, 512, 512, 512]
    - [113, 3.836]
  - - [512, 512, 1, 1024, 512, 512, 1024, 512]
    - [114, 5.88]
  - - [512, 512, 1, 2048, 512, 512, 2048, 512]
    - [45, 8.014]
  - - [512, 512, 1, 4096, 512, 512, 4096, 512]
    - [40, 10.201]
  - - [512, 512, 1, 8192, 512, 512, 8192, 512]
    - [38, 14.498]
  - - [512, 1024, 1, 128, 512, 512, 128, 1024]
    - [110, 2.263]
  - - [512, 1024, 1, 256, 512, 512, 256, 1024]
    - [110, 4.021]
  - - [512, 1024, 1, 512, 512, 512, 512, 1024]
    - [110, 6.756]
  - - [512, 1024, 1, 1024, 512, 512, 1024, 1024]
    - [110, 9.895]
  - - [512, 1024, 1, 2048, 512, 512, 2048, 1024]
    - [41, 11.492]
  - - [512, 1024, 1, 4096, 512, 512, 4096, 1024]
    - [38, 15.036]
  - - [512, 1024, 1, 8192, 512, 512, 8192, 1024]
    - [36, 19.114]
  - - [512, 2048, 1, 128, 512, 512, 128, 2048]
    - [92, 3.782]
  - - [512, 2048, 1, 256, 512, 512, 256, 2048]
    - [92, 6.732]
  - - [512, 2048, 1, 512, 512, 512, 512, 2048]
    - [92, 10.689]
  - - [512, 2048, 1, 1024, 512, 512, 1024, 2048]
    - [106, 14.435]
  - - [512, 2048, 1, 2048, 512, 512, 2048, 2048]
    - [39, 16.487]
  - - [512, 2048, 1, 4096, 512, 512, 4096, 2048]
    - [80, 19.259]
  - - [512, 2048, 1, 8192, 512, 512, 8192, 2048]
    - [82, 21.648]
  - - [512, 4096, 1, 128, 512, 512, 128, 4096]
    - [89, 5.796]
  - - [512, 4096, 1, 256, 512, 512, 256, 4096]
    - [89, 9.776]
  - - [512, 4096, 1, 512, 512, 512, 512, 4096]
    - [89, 14.353]
  - - [512, 4096, 1, 1024, 512, 512, 1024, 4096]
    - [104, 18.493]
  - - [512, 4096, 1, 2048, 512, 512, 2048, 4096]
    - [99, 21.297]
  - - [512, 4096, 1, 4096, 512, 512, 4096, 4096]
    - [104, 24.148]
  - - [512, 4096, 1, 8192, 512, 512, 8192, 4096]
    - [86, 26.215]
  - - [512, 8192, 1, 128, 512, 512, 128, 8192]
    - [62, 7.929]
  - - [512, 8192, 1, 256, 512, 512, 256, 8192]
    - [82, 11.886]
  - - [512, 8192, 1, 512, 512, 512, 512, 8192]
    - [79, 17.476]
  - - [512, 8192, 1, 1024, 512, 512, 1024, 8192]
    - [26, 22.186]
  - - [512, 8192, 1, 2048, 512, 512, 2048, 8192]
    - [26, 26.793]
  - - [512, 8192, 1, 4096, 512, 512, 4096, 8192]
    - [86, 26.284]
  - - [512, 8192, 1, 8192, 512, 512, 8192, 8192]
    - [20, 29.311]
  - - [1024, 128, 1, 128, 1024, 1024, 128, 128]
    - [30, 0.672]
  - - [1024, 128, 1, 256, 1024, 1024, 256, 128]
    - [45, 1.186]
  - - [1024, 128, 1, 512, 1024, 1024, 512, 128]
    - [30, 1.995]
  - - [1024, 128, 1, 1024, 1024, 1024, 1024, 128]
    - [45, 3.067]
  - - [1024, 128, 1, 2048, 1024, 1024, 2048, 128]
    - [114, 4.282]
  - - [1024, 128, 1, 4096, 1024, 1024, 4096, 128]
    - [45, 6.426]
  - - [1024, 128, 1, 8192, 1024, 1024, 8192, 128]
    - [40, 9.214]
  - - [1024, 256, 1, 128, 1024, 1024, 128, 256]
    - [97, 1.273]
  - - [1024, 256, 1, 256, 1024, 1024, 256, 256]
    - [30, 2.308]
  - - [1024, 256, 1, 512, 1024, 1024, 512, 256]
    - [44, 3.879]
  - - [1024, 256, 1, 1024, 1024, 1024, 1024, 256]
    - [45, 5.928]
  - - [1024, 256, 1, 2048, 1024, 1024, 2048, 256]
    - [45, 7.962]
  - - [1024, 256, 1, 4096, 1024, 1024, 4096, 256]
    - [40, 10.281]
  - - [1024, 256, 1, 8192, 1024, 1024, 8192, 256]
    - [37, 13.742]
  - - [1024, 512, 1, 128, 1024, 1024, 128, 512]
    - [110, 2.294]
  - - [1024, 512, 1, 256, 1024, 1024, 256, 512]
    - [29, 4.106]
  - - [1024, 512, 1, 512, 1024, 1024, 512, 512]
    - [110, 6.843]
  - - [1024, 512, 1, 1024, 1024, 1024, 1024, 512]
    - [40, 10.042]
  - - [1024, 512, 1, 2048, 1024, 1024, 2048, 512]
    - [111, 11.968]
  - - [1024, 512, 1, 4096, 1024, 1024, 4096, 512]
    - [37, 15.337]
  - - [1024, 512, 1, 8192, 1024, 1024, 8192, 512]
    - [101, 18.674]
  - - [1024, 1024, 1, 128, 1024, 1024, 128, 1024]
    - [92, 3.81]
  - - [1024, 1024, 1, 256, 1024, 1024, 256, 1024]
    - [92, 6.711]
  - - [1024, 1024, 1, 512, 1024, 1024, 512, 1024]
    - [92, 10.706]
  - - [1024, 1024, 1, 1024, 1024, 1024, 1024, 1024]
    - [39, 14.35]
  - - [1024, 1024, 1, 2048, 1024, 1024, 2048, 1024]
    - [38, 16.646]
  - - [1024, 1024, 1, 4096, 1024, 1024, 4096, 1024]
    - [35, 19.361]
  - - [1024, 1024, 1, 8192, 1024, 1024, 8192, 1024]
    - [82, 21.71]
  - - [1024, 2048, 1, 128, 1024, 1024, 128, 2048]
    - [87, 5.772]
  - - [1024, 2048, 1, 256, 1024, 1024, 256, 2048]
    - [89, 9.82]
  - - [1024, 2048, 1, 512, 1024, 1024, 512, 2048]
    - [100, 14.32]
  - - [1024, 2048, 1, 1024, 1024, 1024, 1024, 2048]
    - [102, 18.568]
  - - [1024, 2048, 1, 2048, 1024, 1024, 2048, 2048]
    - [34, 20.9]
  - - [1024, 2048, 1, 4096, 1024, 1024, 4096, 2048]
    - [100, 23.728]
  - - [1024, 2048, 1, 8192, 1024, 1024, 8192, 2048]
    - [78, 25.343]
  - - [1024, 4096, 1, 128, 1024, 1024, 128, 4096]
    - [61, 7.885]
  - - [1024, 4096, 1, 256, 1024, 1024, 256, 4096]
    - [65, 11.886]
  - - [1024, 4096, 1, 512, 1024, 1024, 512, 4096]
    - [26, 17.374]
  - - [1024, 4096, 1, 1024, 1024, 1024, 1024, 4096]
    - [80, 22.044]
  - - [1024, 4096, 1, 2048, 1024, 1024, 2048, 4096]
    - [79, 26.049]
  - - [1024, 4096, 1, 4096, 1024, 1024, 4096, 4096]
    - [85, 26.051]
  - - [1024, 4096, 1, 8192, 1024, 1024, 8192, 4096]
    - [74, 27.998]
  - - [1024, 8192, 1, 128, 1024, 1024, 128, 8192]
    - [76, 7.798]
  - - [1024, 8192, 1, 256, 1024, 1024, 256, 8192]
    - [76, 12.863]
  - - [1024, 8192, 1, 512, 1024, 1024, 512, 8192]
    - [12, 18.72]
  - - [1024, 8192, 1, 1024, 1024, 1024, 1024, 8192]
    - [71, 24.626]
  - - [1024, 8192, 1, 2048, 1024, 1024, 2048, 8192]
    - [77, 30.668]
  - - [1024, 8192, 1, 4096, 1024, 1024, 4096, 8192]
    - [51, 27.74]
  - - [1024, 8192, 1, 8192, 1024, 1024, 8192, 8192]
    - [48, 31.088]
  - - [2048, 128, 1, 128, 2048, 2048, 128, 128]
    - [97, 1.288]
  - - [2048, 128, 1, 256, 2048, 2048, 256, 128]
    - [97, 2.349]
  - - [2048, 128, 1, 512, 2048, 2048, 512, 128]
    - [97, 3.873]
  - - [2048, 128, 1, 1024, 2048, 2048, 1024, 128]
    - [45, 5.931]
  - - [2048, 128, 1, 2048, 2048, 2048, 2048, 128]
    - [116, 7.822]
  - - [2048, 128, 1, 4096, 2048, 2048, 4096, 128]
    - [112, 10.241]
  - - [2048, 128, 1, 8192, 2048, 2048, 8192, 128]
    - [37, 13.294]
  - - [2048, 256, 1, 128, 2048, 2048, 128, 256]
    - [96, 2.272]
  - - [2048, 256, 1, 256, 2048, 2048, 256, 256]
    - [29, 4.024]
  - - [2048, 256, 1, 512, 2048, 2048, 512, 256]
    - [112, 6.691]
  - - [2048, 256, 1, 1024, 2048, 2048, 1024, 256]
    - [40, 9.732]
  - - [2048, 256, 1, 2048, 2048, 2048, 2048, 256]
    - [111, 11.901]
  - - [2048, 256, 1, 4096, 2048, 2048, 4096, 256]
    - [37, 14.563]
  - - [2048, 256, 1, 8192, 2048, 2048, 8192, 256]
    - [101, 18.467]
  - - [2048, 512, 1, 128, 2048, 2048, 128, 512]
    - [105, 3.783]
  - - [2048, 512, 1, 256, 2048, 2048, 256, 512]
    - [92, 6.763]
  - - [2048, 512, 1, 512, 2048, 2048, 512, 512]
    - [92, 10.654]
  - - [2048, 512, 1, 1024, 2048, 2048, 1024, 512]
    - [107, 14.165]
  - - [2048, 512, 1, 2048, 2048, 2048, 2048, 512]
    - [109, 16.863]
  - - [2048, 512, 1, 4096, 2048, 2048, 4096, 512]
    - [86, 19.44]
  - - [2048, 512, 1, 8192, 2048, 2048, 8192, 512]
    - [82, 21.181]
  - - [2048, 1024, 1, 128, 2048, 2048, 128, 1024]
    - [67, 5.725]
  - - [2048, 1024, 1, 256, 2048, 2048, 256, 1024]
    - [27, 9.597]
  - - [2048, 1024, 1, 512, 2048, 2048, 512, 1024]
    - [88, 14.13]
  - - [2048, 1024, 1, 1024, 2048, 2048, 1024, 1024]
    - [104, 18.586]
  - - [2048, 1024, 1, 2048, 2048, 2048, 2048, 1024]
    - [102, 21.306]
  - - [2048, 1024, 1, 4096, 2048, 2048, 4096, 1024]
    - [103, 23.789]
  - - [2048, 1024, 1, 8192, 2048, 2048, 8192, 1024]
    - [73, 25.206]
  - - [2048, 2048, 1, 128, 2048, 2048, 128, 2048]
    - [7, 7.84]
  - - [2048, 2048, 1, 256, 2048, 2048, 256, 2048]
    - [86, 11.803]
  - - [2048, 2048, 1, 512, 2048, 2048, 512, 2048]
    - [84, 17.346]
  - - [2048, 2048, 1, 1024, 2048, 2048, 1024, 2048]
    - [24, 21.92]
  - - [2048, 2048, 1, 2048, 2048, 2048, 2048, 2048]
    - [86, 25.874]
  - - [2048, 2048, 1, 4096, 2048, 2048, 4096, 2048]
    - [76, 26.024]
  - - [2048, 2048, 1, 8192, 2048, 2048, 8192, 2048]
    - [75, 27.599]
  - - [2048, 4096, 1, 128, 2048, 2048, 128, 4096]
    - [9, 7.816]
  - - [2048, 4096, 1, 256, 2048, 2048, 256, 4096]
    - [9, 12.856]
  - - [2048, 4096, 1, 512, 2048, 2048, 512, 4096]
    - [12, 18.779]
  - - [2048, 4096, 1, 1024, 2048, 2048, 1024, 4096]
    - [11, 24.545]
  - - [2048, 4096, 1, 2048, 2048, 2048, 2048, 4096]
    - [77, 30.965]
  - - [2048, 4096, 1, 4096, 2048, 2048, 4096, 4096]
    - [51, 28.0]
  - - [2048, 4096, 1, 8192, 2048, 2048, 8192, 4096]
    - [59, 31.471]
  - - [2048, 8192, 1, 128, 2048, 2048, 128, 8192]
    - [55, 8.232]
  - - [2048, 8192, 1, 256, 2048, 2048, 256, 8192]
    - [50, 13.507]
  - - [2048, 8192, 1, 512, 2048, 2048, 512, 8192]
    - [55, 20.33]
  - - [2048, 8192, 1, 1024, 2048, 2048, 1024, 8192]
    - [5, 27.32]
  - - [2048, 8192, 1, 2048, 2048, 2048, 2048, 8192]
    - [71, 26.813]
  - - [2048, 8192, 1, 4096, 2048, 2048, 4096, 8192]
    - [50, 30.036]
  - - [2048, 8192, 1, 8192, 2048, 2048, 8192, 8192]
    - [56, 32.691]
  - - [4096, 128, 1, 128, 4096, 4096, 128, 128]
    - [95, 2.298]
  - - [4096, 128, 1, 256, 4096, 4096, 256, 128]
    - [110, 4.061]
  - - [4096, 128, 1, 512, 4096, 4096, 512, 128]
    - [110, 6.684]
  - - [4096, 128, 1, 1024, 4096, 4096, 1024, 128]
    - [110, 9.863]
  - - [4096, 128, 1, 2048, 4096, 4096, 2048, 128]
    - [112, 11.9]
  - - [4096, 128, 1, 4096, 4096, 4096, 4096, 128]
    - [37, 14.28]
  - - [4096, 128, 1, 8192, 4096, 4096, 8192, 128]
    - [101, 17.808]
  - - [4096, 256, 1, 128, 4096, 4096, 128, 256]
    - [93, 3.777]
  - - [4096, 256, 1, 256, 4096, 4096, 256, 256]
    - [94, 6.661]
  - - [4096, 256, 1, 512, 4096, 4096, 512, 256]
    - [93, 10.618]
  - - [4096, 256, 1, 1024, 4096, 4096, 1024, 256]
    - [108, 14.355]
  - - [4096, 256, 1, 2048, 4096, 4096, 2048, 256]
    - [107, 16.986]
  - - [4096, 256, 1, 4096, 4096, 4096, 4096, 256]
    - [86, 19.417]
  - - [4096, 256, 1, 8192, 4096, 4096, 8192, 256]
    - [86, 21.129]
  - - [4096, 512, 1, 128, 4096, 4096, 128, 512]
    - [89, 5.768]
  - - [4096, 512, 1, 256, 4096, 4096, 256, 512]
    - [91, 9.772]
  - - [4096, 512, 1, 512, 4096, 4096, 512, 512]
    - [91, 14.225]
  - - [4096, 512, 1, 1024, 4096, 4096, 1024, 512]
    - [104, 18.735]
  - - [4096, 512, 1, 2048, 4096, 4096, 2048, 512]
    - [33, 21.983]
  - - [4096, 512, 1, 4096, 4096, 4096, 4096, 512]
    - [32, 24.157]
  - - [4096, 512, 1, 8192, 4096, 4096, 8192, 512]
    - [82, 25.251]
  - - [4096, 1024, 1, 128, 4096, 4096, 128, 1024]
    - [64, 7.527]
  - - [4096, 1024, 1, 256, 4096, 4096, 256, 1024]
    - [64, 11.839]
  - - [4096, 1024, 1, 512, 4096, 4096, 512, 1024]
    - [84, 17.338]
  - - [4096, 1024, 1, 1024, 4096, 4096, 1024, 1024]
    - [23, 22.572]
  - - [4096, 1024, 1, 2048, 4096, 4096, 2048, 1024]
    - [23, 26.043]
  - - [4096, 1024, 1, 4096, 4096, 4096, 4096, 1024]
    - [72, 25.661]
  - - [4096, 1024, 1, 8192, 4096, 4096, 8192, 1024]
    - [78, 27.733]
  - - [4096, 2048, 1, 128, 4096, 4096, 128, 2048]
    - [19, 7.765]
  - - [4096, 2048, 1, 256, 4096, 4096, 256, 2048]
    - [18, 12.805]
  - - [4096, 2048, 1, 512, 4096, 4096, 512, 2048]
    - [17, 18.989]
  - - [4096, 2048, 1, 1024, 4096, 4096, 1024, 2048]
    - [17, 25.076]
  - - [4096, 2048, 1, 2048, 4096, 4096, 2048, 2048]
    - [16, 30.124]
  - - [4096, 2048, 1, 4096, 4096, 4096, 4096, 2048]
    - [57, 27.419]
  - - [4096, 2048, 1, 8192, 4096, 4096, 8192, 2048]
    - [58, 31.3]
  - - [4096, 4096, 1, 128, 4096, 4096, 128, 4096]
    - [52, 8.152]
  - - [4096, 4096, 1, 256, 4096, 4096, 256, 4096]
    - [54, 13.246]
  - - [4096, 4096, 1, 512, 4096, 4096, 512, 4096]
    - [3, 19.979]
  - - [4096, 4096, 1, 1024, 4096, 4096, 1024, 4096]
    - [59, 26.897]
  - - [4096, 4096, 1, 2048, 4096, 4096, 2048, 4096]
    - [70, 27.326]
  - - [4096, 4096, 1, 4096, 4096, 4096, 4096, 4096]
    - [51, 30.394]
  - - [4096, 4096, 1, 8192, 4096, 4096, 8192, 4096]
    - [49, 33.555]
  - - [4096, 8192, 1, 128, 4096, 4096, 128, 8192]
    - [26, 8.063]
  - - [4096, 8192, 1, 256, 4096, 4096, 256, 8192]
    - [69, 12.65]
  - - [4096, 8192, 1, 512, 4096, 4096, 512, 8192]
    - [83, 17.629]
  - - [4096, 8192, 1, 1024, 4096, 4096, 1024, 8192]
    - [50, 22.677]
  - - [4096, 8192, 1, 2048, 4096, 4096, 2048, 8192]
    - [50, 28.44]
  - - [4096, 8192, 1, 4096, 4096, 4096, 4096, 8192]
    - [49, 31.556]
  - - [4096, 8192, 1, 8192, 4096, 4096, 8192, 8192]
    - [51, 35.915]
  - - [8192, 128, 1, 128, 8192, 8192, 128, 128]
    - [94, 3.759]
  - - [8192, 128, 1, 256, 8192, 8192, 256, 128]
    - [94, 6.62]
  - - [8192, 128, 1, 512, 8192, 8192, 512, 128]
    - [93, 10.524]
  - - [8192, 128, 1, 1024, 8192, 8192, 1024, 128]
    - [108, 14.365]
  - - [8192, 128, 1, 2048, 8192, 8192, 2048, 128]
    - [107, 15.711]
  - - [8192, 128, 1, 4096, 8192, 8192, 4096, 128]
    - [80, 18.805]
  - - [8192, 128, 1, 8192, 8192, 8192, 8192, 128]
    - [23, 21.531]
  - - [8192, 256, 1, 128, 8192, 8192, 128, 256]
    - [66, 5.746]
  - - [8192, 256, 1, 256, 8192, 8192, 256, 256]
    - [91, 9.619]
  - - [8192, 256, 1, 512, 8192, 8192, 512, 256]
    - [88, 14.166]
  - - [8192, 256, 1, 1024, 8192, 8192, 1024, 256]
    - [104, 18.26]
  - - [8192, 256, 1, 2048, 8192, 8192, 2048, 256]
    - [31, 20.345]
  - - [8192, 256, 1, 4096, 8192, 8192, 4096, 256]
    - [32, 23.89]
  - - [8192, 256, 1, 8192, 8192, 8192, 8192, 256]
    - [6, 25.538]
  - - [8192, 512, 1, 128, 8192, 8192, 128, 512]
    - [63, 7.987]
  - - [8192, 512, 1, 256, 8192, 8192, 256, 512]
    - [63, 12.049]
  - - [8192, 512, 1, 512, 8192, 8192, 512, 512]
    - [86, 17.081]
  - - [8192, 512, 1, 1024, 8192, 8192, 1024, 512]
    - [21, 22.017]
  - - [8192, 512, 1, 2048, 8192, 8192, 2048, 512]
    - [22, 26.075]
  - - [8192, 512, 1, 4096, 8192, 8192, 4096, 512]
    - [13, 26.498]
  - - [8192, 512, 1, 8192, 8192, 8192, 8192, 512]
    - [14, 29.64]
  - - [8192, 1024, 1, 128, 8192, 8192, 128, 1024]
    - [18, 7.784]
  - - [8192, 1024, 1, 256, 8192, 8192, 256, 1024]
    - [18, 12.766]
  - - [8192, 1024, 1, 512, 8192, 8192, 512, 1024]
    - [18, 18.929]
  - - [8192, 1024, 1, 1024, 8192, 8192, 1024, 1024]
    - [8, 25.138]
  - - [8192, 1024, 1, 2048, 8192, 8192, 2048, 1024]
    - [15, 30.544]
  - - [8192, 1024, 1, 4096, 8192, 8192, 4096, 1024]
    - [53, 27.86]
  - - [8192, 1024, 1, 8192, 8192, 8192, 8192, 1024]
    - [56, 30.455]
  - - [8192, 2048, 1, 128, 8192, 8192, 128, 2048]
    - [18, 8.458]
  - - [8192, 2048, 1, 256, 8192, 8192, 256, 2048]
    - [4, 13.455]
  - - [8192, 2048, 1, 512, 8192, 8192, 512, 2048]
    - [1, 20.211]
  - - [8192, 2048, 1, 1024, 8192, 8192, 1024, 2048]
    - [0, 27.464]
  - - [8192, 2048, 1, 2048, 8192, 8192, 2048, 2048]
    - [82, 27.25]
  - - [8192, 2048, 1, 4096, 8192, 8192, 4096, 2048]
    - [59, 29.909]
  - - [8192, 2048, 1, 8192, 8192, 8192, 8192, 2048]
    - [58, 33.145]
  - - [8192, 4096, 1, 128, 8192, 8192, 128, 4096]
    - [25, 8.293]
  - - [8192, 4096, 1, 256, 8192, 8192, 256, 4096]
    - [86, 12.752]
  - - [8192, 4096, 1, 512, 8192, 8192, 512, 4096]
    - [86, 17.825]
  - - [8192, 4096, 1, 1024, 8192, 8192, 1024, 4096]
    - [51, 23.367]
  - - [8192, 4096, 1, 2048, 8192, 8192, 2048, 4096]
    - [51, 28.476]
  - - [8192, 4096, 1, 4096, 8192, 8192, 4096, 4096]
    - [50, 32.481]
  - - [8192, 4096, 1, 8192, 8192, 8192, 8192, 4096]
    - [51, 36.16]
  - - [8192, 8192, 1, 128, 8192, 8192, 128, 8192]
    - [10, 7.1]
  - - [8192, 8192, 1, 256, 8192, 8192, 256, 8192]
    - [81, 11.659]
  - - [8192, 8192, 1, 512, 8192, 8192, 512, 8192]
    - [60, 17.384]
  - - [8192, 8192, 1, 1024, 8192, 8192, 1024, 8192]
    - [72, 24.431]
  - - [8192, 8192, 1, 2048, 8192, 8192, 2048, 8192]
    - [73, 30.557]
  - - [8192, 8192, 1, 4096, 8192, 8192, 4096, 8192]
    - [59, 34.77]
  - - [8192, 8192, 1, 8192, 8192, 8192, 8192, 8192]
    - [2, 36.707]
  - - [1, 1, 1, 32, 1, 1, 32, 1]
    - [117, 0.0]
- null
- null
- ExperimentalStreamK
- GridBased
