library/src/amd_detail/rocblaslt/src/Tensile/Logic/asm_full/aquavanjaram/gfx942/StreamK/aquavanjaram942_Cijk_Ailk_Bjlk_HSS_BH_UserArgs.yaml
- {MinimumRequiredVersion: 4.33.0}
- aquavanjaram942
- gfx942
- [Device 0049, Device 0050]
    SolutionIndex: 0
    SolutionNameMin: Cijk_Ailk_Bjlk_HSS_BH_UserArgs_MT256x256x32_MI16x16x1_SN_LDSB0_CLR1_GSU0_GSUC0_GSUWGMRR0_K1_LBSPPA2048_LBSPPB2048_LPA0_LPB0_MIWT8_8_PLR1_SU32_SUM0_SUS256_SKXCCM0_VWA4_VWB8_WGM4_WGMXCC1_WGMXCCGn1
    SolutionIndex: 1
    SolutionNameMin: Cijk_Ailk_Bjlk_HSS_BH_UserArgs_MT128x256x32_MI16x16x1_SN_LDSB1_CLR1_GSU0_GSUC0_GSUWGMRR0_K1_LBSPPA1024_LBSPPB2048_LPA0_LPB0_MIWT4_8_PLR1_SU32_SUM0_SUS256_SKXCCM0_VWA4_VWB8_WGM1_WGMXCC1_WGMXCCGn1
    SolutionIndex: 2
    SolutionNameMin: Cijk_Ailk_Bjlk_HSS_BH_UserArgs_MT128x256x32_MI16x16x1_SN_LDSB1_CLR1_GSU0_GSUC0_GSUWGMRR0_K1_LBSPPA1024_LBSPPB2048_LPA0_LPB0_MIWT4_8_PLR1_SU32_SUM0_SUS256_SKXCCM0_VWA4_VWB8_WGM4_WGMXCC1_WGMXCCGn1
    SolutionIndex: 3
    SolutionNameMin: Cijk_Ailk_Bjlk_HSS_BH_UserArgs_MT256x128x32_MI16x16x1_SN_LDSB1_CLR1_GSU0_GSUC0_GSUWGMRR0_K1_LBSPPA2048_LBSPPB1024_LPA0_LPB32_MIWT8_4_PLR1_SU32_SUM0_SUS256_SKXCCM0_VWA4_VWB2_WGM1_WGMXCC1_WGMXCCGn1
    SolutionIndex: 4
    SolutionNameMin: Cijk_Ailk_Bjlk_HSS_BH_UserArgs_MT128x128x32_MI16x16x1_SN_LDSB1_CLR1_GSU0_GSUC0_GSUWGMRR0_K1_LBSPPA1024_LBSPPB1024_LPA0_LPB32_MIWT4_4_PLR1_SU32_SUM0_SUS256_SKXCCM0_VWA4_VWB2_WGM4_WGMXCC1_WGMXCCGn1
    SolutionIndex: 5
    SolutionNameMin: Cijk_Ailk_Bjlk_HSS_BH_UserArgs_MT128x128x32_MI16x16x1_SN_LDSB1_CLR1_GSU0_GSUC0_GSUWGMRR0_K1_LBSPPA1024_LBSPPB1024_LPA32_LPB0_MIWT4_4_PLR1_SU32_SUM0_SUS256_SKXCCM0_VWA2_VWB4_WGM8_WGMXCC1_WGMXCCGn1
    SolutionIndex: 6
    SolutionNameMin: Cijk_Ailk_Bjlk_HSS_BH_UserArgs_MT128x64x32_MI16x16x1_SN_LDSB0_CLR1_GSU0_GSUC0_GSUWGMRR0_K1_LBSPPA1024_LBSPPB512_LPA0_LPB32_MIWT4_2_PLR1_SU32_SUM0_SUS256_SKXCCM0_VWA4_VWB2_WGM8_WGMXCC1_WGMXCCGn1
    SolutionIndex: 7
    SolutionNameMin: Cijk_Ailk_Bjlk_HSS_BH_UserArgs_MT32x64x32_MI16x16x1_SN_LDSB0_CLR1_GSU0_GSUC0_GSUWGMRR0_K1_LBSPPA256_LBSPPB512_LPA16_LPB32_MIWT1_2_PLR1_SU32_SUM0_SUS256_SKXCCM0_VWA1_VWB2_WGM1_WGMXCC1_WGMXCCGn1
    SolutionIndex: 8
    SolutionNameMin: Cijk_Ailk_Bjlk_HSS_BH_UserArgs_MT32x64x32_MI16x16x1_SN_LDSB0_CLR1_GSU0_GSUC0_GSUWGMRR0_K1_LBSPPA256_LBSPPB512_LPA16_LPB32_MIWT1_2_PLR1_SU32_SUM0_SUS256_SKXCCM0_VWA1_VWB2_WGM4_WGMXCC1_WGMXCCGn1
    SolutionIndex: 9
    SolutionNameMin: Cijk_Ailk_Bjlk_HSS_BH_UserArgs_MT32x32x32_MI16x16x1_SN_LDSB0_CLR1_GSU0_GSUC0_GSUWGMRR0_K1_LBSPPA256_LBSPPB256_LPA16_LPB16_MIWT1_1_PLR1_SU32_SUM0_SUS256_SKXCCM0_VWA1_VWB1_WGM1_WGMXCC1_WGMXCCGn1
    SolutionIndex: 10
    SolutionNameMin: Cijk_Ailk_Bjlk_HSS_BH_UserArgs_MT32x32x32_MI16x16x1_SN_LDSB0_CLR0_GSU0_GSUC0_GSUWGMRR0_K1_LBSPPA256_LBSPPB256_LPA16_LPB16_MIWT1_1_PLR0_SU32_SUM0_SUS256_SKXCCM0_VWA1_VWB1_WGM1_WGMXCC1_WGMXCCGn1
    SolutionIndex: 11
    SolutionNameMin: Cijk_Ailk_Bjlk_HSS_BH_UserArgs_MT256x256x64_MI16x16x1_SN_LDSB1_CLR1_GSU0_GSUC0_GSUWGMRR0_K1_LBSPPA2048_LBSPPB2048_LPA0_LPB0_MIWT8_8_PLR2_SU32_SUM0_SUS256_SKXCCM0_VWA4_VWB8_WGM4_WGMXCC1_WGMXCCGn1
    SolutionIndex: 12
    SolutionNameMin: Cijk_Ailk_Bjlk_HSS_BH_UserArgs_MT128x256x64_MI16x16x1_SN_LDSB1_CLR1_GSU0_GSUC0_GSUWGMRR0_K1_LBSPPA1024_LBSPPB2048_LPA0_LPB0_MIWT4_8_PLR1_SU32_SUM0_SUS256_SKXCCM0_VWA4_VWB4_WGM4_WGMXCC1_WGMXCCGn1
    SolutionIndex: 13
    SolutionNameMin: Cijk_Ailk_Bjlk_HSS_BH_UserArgs_MT128x256x64_MI16x16x1_SN_LDSB1_CLR1_GSU0_GSUC0_GSUWGMRR0_K1_LBSPPA1024_LBSPPB2048_LPA0_LPB0_MIWT4_8_PLR2_SU32_SUM0_SUS256_SKXCCM0_VWA4_VWB8_WGM4_WGMXCC1_WGMXCCGn1
    SolutionIndex: 14
    SolutionNameMin: Cijk_Ailk_Bjlk_HSS_BH_UserArgs_MT256x128x64_MI16x16x1_SN_LDSB1_CLR1_GSU0_GSUC0_GSUWGMRR0_K1_LBSPPA2048_LBSPPB1024_LPA0_LPB0_MIWT8_4_PLR1_SU32_SUM0_SUS256_SKXCCM0_VWA4_VWB4_WGM1_WGMXCC1_WGMXCCGn1
    SolutionIndex: 15
    SolutionNameMin: Cijk_Ailk_Bjlk_HSS_BH_UserArgs_MT256x128x64_MI16x16x1_SN_LDSB1_CLR1_GSU0_GSUC0_GSUWGMRR0_K1_LBSPPA2048_LBSPPB1024_LPA0_LPB0_MIWT8_4_PLR2_SU32_SUM0_SUS256_SKXCCM0_VWA4_VWB4_WGM1_WGMXCC1_WGMXCCGn1
    SolutionIndex: 16
    SolutionNameMin: Cijk_Ailk_Bjlk_HSS_BH_UserArgs_MT256x128x64_MI16x16x1_SN_LDSB1_CLR1_GSU0_GSUC0_GSUWGMRR0_K1_LBSPPA2048_LBSPPB1024_LPA32_LPB0_MIWT8_4_PLR1_SU32_SUM0_SUS256_SKXCCM0_VWA2_VWB4_WGM4_WGMXCC1_WGMXCCGn1
    SolutionIndex: 17
    SolutionNameMin: Cijk_Ailk_Bjlk_HSS_BH_UserArgs_MT256x128x64_MI16x16x1_SN_LDSB1_CLR1_GSU0_GSUC0_GSUWGMRR0_K1_LBSPPA2048_LBSPPB1024_LPA0_LPB0_MIWT8_4_PLR1_SU32_SUM0_SUS256_SKXCCM0_VWA4_VWB4_WGM4_WGMXCC1_WGMXCCGn1
    SolutionIndex: 18
    SolutionNameMin: Cijk_Ailk_Bjlk_HSS_BH_UserArgs_MT256x128x64_MI16x16x1_SN_LDSB1_CLR1_GSU0_GSUC0_GSUWGMRR0_K1_LBSPPA2048_LBSPPB1024_LPA0_LPB0_MIWT8_4_PLR2_SU32_SUM0_SUS256_SKXCCM0_VWA4_VWB4_WGM4_WGMXCC1_WGMXCCGn1
    SolutionIndex: 19
    SolutionNameMin: Cijk_Ailk_Bjlk_HSS_BH_UserArgs_MT128x128x64_MI16x16x1_SN_LDSB1_CLR1_GSU0_GSUC0_GSUWGMRR0_K1_LBSPPA1024_LBSPPB1024_LPA0_LPB0_MIWT4_4_PLR1_SU32_SUM0_SUS256_SKXCCM0_VWA4_VWB4_WGM1_WGMXCC1_WGMXCCGn1
    SolutionIndex: 20
    SolutionNameMin: Cijk_Ailk_Bjlk_HSS_BH_UserArgs_MT128x128x64_MI16x16x1_SN_LDSB1_CLR1_GSU0_GSUC0_GSUWGMRR0_K1_LBSPPA1024_LBSPPB1024_LPA0_LPB0_MIWT4_4_PLR1_SU32_SUM0_SUS256_SKXCCM0_VWA4_VWB4_WGM4_WGMXCC1_WGMXCCGn1
    SolutionIndex: 21
    SolutionNameMin: Cijk_Ailk_Bjlk_HSS_BH_UserArgs_MT128x128x64_MI16x16x1_SN_LDSB1_CLR1_GSU0_GSUC0_GSUWGMRR0_K1_LBSPPA1024_LBSPPB1024_LPA0_LPB0_MIWT4_4_PLR1_SU32_SUM0_SUS256_SKXCCM0_VWA4_VWB4_WGM8_WGMXCC1_WGMXCCGn1
    SolutionIndex: 22
    SolutionNameMin: Cijk_Ailk_Bjlk_HSS_BH_UserArgs_MT64x64x64_MI16x16x1_SN_LDSB1_CLR1_GSU0_GSUC0_GSUWGMRR0_K1_LBSPPA512_LBSPPB512_LPA32_LPB32_MIWT2_2_PLR1_SU32_SUM0_SUS256_SKXCCM0_VWA2_VWB2_WGM8_WGMXCC1_WGMXCCGn1
    SolutionIndex: 23
    SolutionNameMin: Cijk_Ailk_Bjlk_HSS_BH_UserArgs_MT64x64x64_MI16x16x1_SN_LDSB1_CLR1_GSU0_GSUC0_GSUWGMRR0_K1_LBSPPA512_LBSPPB512_LPA32_LPB32_MIWT2_2_PLR2_SU32_SUM0_SUS256_SKXCCM0_VWA2_VWB2_WGM8_WGMXCC1_WGMXCCGn1
    SolutionIndex: 24
    SolutionNameMin: Cijk_Ailk_Bjlk_HSS_BH_UserArgs_MT32x64x64_MI16x16x1_SN_LDSB0_CLR1_GSU0_GSUC0_GSUWGMRR0_K1_LBSPPA256_LBSPPB512_LPA16_LPB32_MIWT1_2_PLR2_SU32_SUM0_SUS256_SKXCCM0_VWA1_VWB2_WGM1_WGMXCC1_WGMXCCGn1
    SolutionIndex: 25
    SolutionNameMin: Cijk_Ailk_Bjlk_HSS_BH_UserArgs_MT64x32x64_MI16x16x1_SN_LDSB0_CLR1_GSU0_GSUC0_GSUWGMRR0_K1_LBSPPA512_LBSPPB256_LPA32_LPB16_MIWT2_1_PLR2_SU32_SUM0_SUS256_SKXCCM0_VWA2_VWB1_WGM4_WGMXCC1_WGMXCCGn1
    SolutionIndex: 26
    SolutionNameMin: Cijk_Ailk_Bjlk_HSS_BH_UserArgs_MT32x32x64_MI16x16x1_SN_LDSB0_CLR1_GSU0_GSUC0_GSUWGMRR0_K1_LBSPPA256_LBSPPB256_LPA16_LPB16_MIWT1_1_PLR1_SU32_SUM0_SUS256_SKXCCM0_VWA1_VWB1_WGM1_WGMXCC1_WGMXCCGn1
    SolutionIndex: 27
    SolutionNameMin: Cijk_Ailk_Bjlk_HSS_BH_UserArgs_MT32x32x64_MI16x16x1_SN_LDSB0_CLR1_GSU0_GSUC0_GSUWGMRR0_K1_LBSPPA256_LBSPPB256_LPA16_LPB16_MIWT1_1_PLR2_SU32_SUM0_SUS256_SKXCCM0_VWA1_VWB1_WGM1_WGMXCC1_WGMXCCGn1
    SolutionIndex: 28
    SolutionNameMin: Cijk_Ailk_Bjlk_HSS_BH_UserArgs_MT128x128x128_MI16x16x1_SN_LDSB1_CLR1_GSU0_GSUC0_GSUWGMRR0_K1_LBSPPA1024_LBSPPB1024_LPA0_LPB0_MIWT4_4_PLR1_SU32_SUM0_SUS256_SKXCCM0_VWA4_VWB4_WGM1_WGMXCC1_WGMXCCGn1
    SolutionIndex: 29
    SolutionNameMin: Cijk_Ailk_Bjlk_HSS_BH_UserArgs_MT128x128x128_MI16x16x1_SN_LDSB1_CLR1_GSU0_GSUC0_GSUWGMRR0_K1_LBSPPA1024_LBSPPB1024_LPA0_LPB0_MIWT4_4_PLR2_SU32_SUM0_SUS256_SKXCCM0_VWA4_VWB4_WGM1_WGMXCC1_WGMXCCGn1
    SolutionIndex: 30
    SolutionNameMin: Cijk_Ailk_Bjlk_HSS_BH_UserArgs_MT128x128x128_MI16x16x1_SN_LDSB1_CLR1_GSU0_GSUC0_GSUWGMRR0_K1_LBSPPA1024_LBSPPB1024_LPA0_LPB0_MIWT4_4_PLR1_SU32_SUM0_SUS256_SKXCCM0_VWA4_VWB4_WGM4_WGMXCC1_WGMXCCGn1
    SolutionIndex: 31
    SolutionNameMin: Cijk_Ailk_Bjlk_HSS_BH_UserArgs_MT128x128x128_MI16x16x1_SN_LDSB1_CLR1_GSU0_GSUC0_GSUWGMRR0_K1_LBSPPA1024_LBSPPB1024_LPA0_LPB0_MIWT4_4_PLR2_SU32_SUM0_SUS256_SKXCCM0_VWA4_VWB4_WGM4_WGMXCC1_WGMXCCGn1
    SolutionIndex: 32
    SolutionNameMin: Cijk_Ailk_Bjlk_HSS_BH_UserArgs_MT128x128x128_MI16x16x1_SN_LDSB1_CLR1_GSU0_GSUC0_GSUWGMRR0_K1_LBSPPA1024_LBSPPB1024_LPA0_LPB0_MIWT4_4_PLR1_SU32_SUM0_SUS256_SKXCCM0_VWA4_VWB4_WGM8_WGMXCC1_WGMXCCGn1
    SolutionIndex: 33
    SolutionNameMin: Cijk_Ailk_Bjlk_HSS_BH_UserArgs_MT128x128x128_MI16x16x1_SN_LDSB1_CLR1_GSU0_GSUC0_GSUWGMRR0_K1_LBSPPA1024_LBSPPB1024_LPA0_LPB0_MIWT4_4_PLR2_SU32_SUM0_SUS256_SKXCCM0_VWA4_VWB4_WGM8_WGMXCC1_WGMXCCGn1
    SolutionIndex: 34
    SolutionNameMin: Cijk_Ailk_Bjlk_HSS_BH_UserArgs_MT64x128x128_MI16x16x1_SN_LDSB1_CLR1_GSU0_GSUC0_GSUWGMRR0_K1_LBSPPA512_LBSPPB1024_LPA32_LPB0_MIWT2_4_PLR2_SU32_SUM0_SUS256_SKXCCM0_VWA2_VWB4_WGM1_WGMXCC1_WGMXCCGn1
    SolutionIndex: 35
    SolutionNameMin: Cijk_Ailk_Bjlk_HSS_BH_UserArgs_MT128x64x128_MI16x16x1_SN_LDSB1_CLR1_GSU0_GSUC0_GSUWGMRR0_K1_LBSPPA1024_LBSPPB512_LPA0_LPB32_MIWT4_2_PLR2_SU32_SUM0_SUS256_SKXCCM0_VWA4_VWB2_WGM1_WGMXCC1_WGMXCCGn1
    SolutionIndex: 36
    SolutionNameMin: Cijk_Ailk_Bjlk_HSS_BH_UserArgs_MT128x64x128_MI16x16x1_SN_LDSB1_CLR1_GSU0_GSUC0_GSUWGMRR0_K1_LBSPPA1024_LBSPPB512_LPA0_LPB32_MIWT4_2_PLR1_SU32_SUM0_SUS256_SKXCCM0_VWA4_VWB2_WGM4_WGMXCC1_WGMXCCGn1
    SolutionIndex: 37
    SolutionNameMin: Cijk_Ailk_Bjlk_HSS_BH_UserArgs_MT128x64x128_MI16x16x1_SN_LDSB1_CLR1_GSU0_GSUC0_GSUWGMRR0_K1_LBSPPA1024_LBSPPB512_LPA0_LPB32_MIWT4_2_PLR2_SU32_SUM0_SUS256_SKXCCM0_VWA4_VWB2_WGM4_WGMXCC1_WGMXCCGn1
    SolutionIndex: 38
    SolutionNameMin: Cijk_Ailk_Bjlk_HSS_BH_UserArgs_MT64x64x128_MI16x16x1_SN_LDSB1_CLR1_GSU0_GSUC0_GSUWGMRR0_K1_LBSPPA512_LBSPPB512_LPA32_LPB32_MIWT2_2_PLR2_SU32_SUM0_SUS256_SKXCCM0_VWA2_VWB2_WGM1_WGMXCC1_WGMXCCGn1
    SolutionIndex: 39
    SolutionNameMin: Cijk_Ailk_Bjlk_HSS_BH_UserArgs_MT64x64x128_MI16x16x1_SN_LDSB1_CLR1_GSU0_GSUC0_GSUWGMRR0_K1_LBSPPA512_LBSPPB512_LPA32_LPB32_MIWT2_2_PLR2_SU32_SUM0_SUS256_SKXCCM0_VWA2_VWB2_WGM4_WGMXCC1_WGMXCCGn1
    SolutionIndex: 40
    SolutionNameMin: Cijk_Ailk_Bjlk_HSS_BH_UserArgs_MT64x64x128_MI16x16x1_SN_LDSB1_CLR1_GSU0_GSUC0_GSUWGMRR0_K1_LBSPPA512_LBSPPB512_LPA32_LPB32_MIWT2_2_PLR2_SU32_SUM0_SUS256_SKXCCM0_VWA2_VWB2_WGM8_WGMXCC1_WGMXCCGn1
    SolutionIndex: 41
    SolutionNameMin: Cijk_Ailk_Bjlk_HSS_BH_UserArgs_MT32x64x128_MI16x16x1_SN_LDSB1_CLR1_GSU0_GSUC0_GSUWGMRR0_K1_LBSPPA256_LBSPPB512_LPA16_LPB32_MIWT1_2_PLR2_SU32_SUM0_SUS256_SKXCCM0_VWA1_VWB2_WGM1_WGMXCC1_WGMXCCGn1
    SolutionIndex: 42
    SolutionNameMin: Cijk_Ailk_Bjlk_HSS_BH_UserArgs_MT32x64x128_MI16x16x1_SN_LDSB1_CLR1_GSU0_GSUC0_GSUWGMRR0_K1_LBSPPA256_LBSPPB512_LPA16_LPB32_MIWT1_2_PLR2_SU32_SUM0_SUS256_SKXCCM0_VWA1_VWB2_WGM4_WGMXCC1_WGMXCCGn1
    SolutionIndex: 43
    SolutionNameMin: Cijk_Ailk_Bjlk_HSS_BH_UserArgs_MT32x64x128_MI16x16x1_SN_LDSB1_CLR1_GSU0_GSUC0_GSUWGMRR0_K1_LBSPPA256_LBSPPB512_LPA16_LPB32_MIWT1_2_PLR2_SU32_SUM0_SUS256_SKXCCM0_VWA1_VWB2_WGM8_WGMXCC1_WGMXCCGn1
    SolutionIndex: 44
    SolutionNameMin: Cijk_Ailk_Bjlk_HSS_BH_UserArgs_MT64x32x128_MI16x16x1_SN_LDSB1_CLR1_GSU0_GSUC0_GSUWGMRR0_K1_LBSPPA512_LBSPPB256_LPA32_LPB16_MIWT2_1_PLR2_SU32_SUM0_SUS256_SKXCCM0_VWA2_VWB1_WGM1_WGMXCC1_WGMXCCGn1
    SolutionIndex: 45
    SolutionNameMin: Cijk_Ailk_Bjlk_HSS_BH_UserArgs_MT64x32x128_MI16x16x1_SN_LDSB1_CLR1_GSU0_GSUC0_GSUWGMRR0_K1_LBSPPA512_LBSPPB256_LPA32_LPB16_MIWT2_1_PLR1_SU32_SUM0_SUS256_SKXCCM0_VWA2_VWB1_WGM8_WGMXCC1_WGMXCCGn1
    SolutionIndex: 46
    SolutionNameMin: Cijk_Ailk_Bjlk_HSS_BH_UserArgs_MT64x32x128_MI16x16x1_SN_LDSB1_CLR1_GSU0_GSUC0_GSUWGMRR0_K1_LBSPPA512_LBSPPB256_LPA32_LPB16_MIWT2_1_PLR2_SU32_SUM0_SUS256_SKXCCM0_VWA2_VWB1_WGM8_WGMXCC1_WGMXCCGn1
    SolutionIndex: 47
    SolutionNameMin: Cijk_Ailk_Bjlk_HSS_BH_UserArgs_MT32x32x128_MI16x16x1_SN_LDSB1_CLR1_GSU0_GSUC0_GSUWGMRR0_K1_LBSPPA256_LBSPPB256_LPA16_LPB16_MIWT1_1_PLR1_SU32_SUM0_SUS256_SKXCCM0_VWA1_VWB1_WGM1_WGMXCC1_WGMXCCGn1
    SolutionIndex: 48
    SolutionNameMin: Cijk_Ailk_Bjlk_HSS_BH_UserArgs_MT32x32x128_MI16x16x1_SN_LDSB1_CLR1_GSU0_GSUC0_GSUWGMRR0_K1_LBSPPA256_LBSPPB256_LPA16_LPB16_MIWT1_1_PLR2_SU32_SUM0_SUS256_SKXCCM0_VWA1_VWB1_WGM1_WGMXCC1_WGMXCCGn1
    SolutionIndex: 49
    SolutionNameMin: Cijk_Ailk_Bjlk_HSS_BH_UserArgs_MT256x256x32_MI16x16x1_SN_LDSB1_CLR1_GSU0_GSUC0_GSUWGMRR0_K1_LBSPPA2048_LBSPPB2048_LPA32_LPB0_MIWT8_8_PLR1_SU32_SUM0_SUS256_SKXCCM8_VWA2_VWB4_WGM1_WGMXCC1_WGMXCCGn1
    SolutionIndex: 50
    SolutionNameMin: Cijk_Ailk_Bjlk_HSS_BH_UserArgs_MT256x256x32_MI16x16x1_SN_LDSB1_CLR1_GSU0_GSUC0_GSUWGMRR0_K1_LBSPPA2048_LBSPPB2048_LPA32_LPB0_MIWT8_8_PLR1_SU32_SUM0_SUS256_SKXCCM8_VWA2_VWB8_WGM1_WGMXCC1_WGMXCCGn1
    SolutionIndex: 51
    SolutionNameMin: Cijk_Ailk_Bjlk_HSS_BH_UserArgs_MT256x256x32_MI16x16x1_SN_LDSB0_CLR1_GSU0_GSUC0_GSUWGMRR0_K1_LBSPPA2048_LBSPPB2048_LPA0_LPB0_MIWT8_8_PLR1_SU32_SUM0_SUS256_SKXCCM8_VWA4_VWB8_WGM1_WGMXCC1_WGMXCCGn1
    SolutionIndex: 52
    SolutionNameMin: Cijk_Ailk_Bjlk_HSS_BH_UserArgs_MT256x256x32_MI16x16x1_SN_LDSB1_CLR1_GSU0_GSUC0_GSUWGMRR0_K1_LBSPPA2048_LBSPPB2048_LPA32_LPB32_MIWT8_8_PLR1_SU32_SUM0_SUS256_SKXCCM8_VWA2_VWB2_WGM4_WGMXCC1_WGMXCCGn1
    SolutionIndex: 53
    SolutionNameMin: Cijk_Ailk_Bjlk_HSS_BH_UserArgs_MT256x256x32_MI16x16x1_SN_LDSB1_CLR1_GSU0_GSUC0_GSUWGMRR0_K1_LBSPPA2048_LBSPPB2048_LPA32_LPB0_MIWT8_8_PLR1_SU32_SUM0_SUS256_SKXCCM8_VWA2_VWB8_WGM4_WGMXCC1_WGMXCCGn1
    SolutionIndex: 54
    SolutionNameMin: Cijk_Ailk_Bjlk_HSS_BH_UserArgs_MT256x256x32_MI16x16x1_SN_LDSB0_CLR1_GSU0_GSUC0_GSUWGMRR0_K1_LBSPPA2048_LBSPPB2048_LPA0_LPB0_MIWT8_8_PLR1_SU32_SUM0_SUS256_SKXCCM8_VWA4_VWB8_WGM4_WGMXCC1_WGMXCCGn1
    SolutionIndex: 55
    SolutionNameMin: Cijk_Ailk_Bjlk_HSS_BH_UserArgs_MT256x256x32_MI16x16x1_SN_LDSB0_CLR1_GSU0_GSUC0_GSUWGMRR0_K1_LBSPPA2048_LBSPPB2048_LPA0_LPB0_MIWT8_8_PLR1_SU32_SUM0_SUS256_SKXCCM8_VWA4_VWB8_WGM8_WGMXCC1_WGMXCCGn1
    SolutionIndex: 56
    SolutionNameMin: Cijk_Ailk_Bjlk_HSS_BH_UserArgs_MT128x256x32_MI16x16x1_SN_LDSB1_CLR1_GSU0_GSUC0_GSUWGMRR0_K1_LBSPPA1024_LBSPPB2048_LPA0_LPB32_MIWT4_8_PLR1_SU32_SUM0_SUS256_SKXCCM8_VWA4_VWB2_WGM4_WGMXCC1_WGMXCCGn1
    SolutionIndex: 57
    SolutionNameMin: Cijk_Ailk_Bjlk_HSS_BH_UserArgs_MT128x256x32_MI16x16x1_SN_LDSB1_CLR1_GSU0_GSUC0_GSUWGMRR0_K1_LBSPPA1024_LBSPPB2048_LPA32_LPB0_MIWT4_8_PLR1_SU32_SUM0_SUS256_SKXCCM8_VWA2_VWB4_WGM4_WGMXCC1_WGMXCCGn1
    SolutionIndex: 58
    SolutionNameMin: Cijk_Ailk_Bjlk_HSS_BH_UserArgs_MT128x256x32_MI16x16x1_SN_LDSB1_CLR1_GSU0_GSUC0_GSUWGMRR0_K1_LBSPPA1024_LBSPPB2048_LPA0_LPB0_MIWT4_8_PLR1_SU32_SUM0_SUS256_SKXCCM8_VWA4_VWB4_WGM4_WGMXCC1_WGMXCCGn1
    SolutionIndex: 59
    SolutionNameMin: Cijk_Ailk_Bjlk_HSS_BH_UserArgs_MT128x256x32_MI16x16x1_SN_LDSB1_CLR1_GSU0_GSUC0_GSUWGMRR0_K1_LBSPPA1024_LBSPPB2048_LPA0_LPB32_MIWT4_8_PLR1_SU32_SUM0_SUS256_SKXCCM8_VWA4_VWB2_WGM8_WGMXCC1_WGMXCCGn1
    SolutionIndex: 60
    SolutionNameMin: Cijk_Ailk_Bjlk_HSS_BH_UserArgs_MT128x256x32_MI16x16x1_SN_LDSB1_CLR1_GSU0_GSUC0_GSUWGMRR0_K1_LBSPPA1024_LBSPPB2048_LPA0_LPB0_MIWT4_8_PLR1_SU32_SUM0_SUS256_SKXCCM8_VWA4_VWB4_WGM8_WGMXCC1_WGMXCCGn1
    SolutionIndex: 61
    SolutionNameMin: Cijk_Ailk_Bjlk_HSS_BH_UserArgs_MT128x256x32_MI16x16x1_SN_LDSB1_CLR1_GSU0_GSUC0_GSUWGMRR0_K1_LBSPPA1024_LBSPPB2048_LPA0_LPB0_MIWT4_8_PLR1_SU32_SUM0_SUS256_SKXCCM8_VWA4_VWB8_WGM8_WGMXCC1_WGMXCCGn1
    SolutionIndex: 62
    SolutionNameMin: Cijk_Ailk_Bjlk_HSS_BH_UserArgs_MT256x128x32_MI16x16x1_SN_LDSB1_CLR1_GSU0_GSUC0_GSUWGMRR0_K1_LBSPPA2048_LBSPPB1024_LPA0_LPB0_MIWT8_4_PLR1_SU32_SUM0_SUS256_SKXCCM8_VWA4_VWB4_WGM1_WGMXCC1_WGMXCCGn1
    SolutionIndex: 63
    SolutionNameMin: Cijk_Ailk_Bjlk_HSS_BH_UserArgs_MT256x128x32_MI16x16x1_SN_LDSB1_CLR1_GSU0_GSUC0_GSUWGMRR0_K1_LBSPPA2048_LBSPPB1024_LPA0_LPB0_MIWT8_4_PLR1_SU32_SUM0_SUS256_SKXCCM8_VWA4_VWB4_WGM8_WGMXCC1_WGMXCCGn1
    SolutionIndex: 64
    SolutionNameMin: Cijk_Ailk_Bjlk_HSS_BH_UserArgs_MT64x256x32_MI16x16x1_SN_LDSB1_CLR1_GSU0_GSUC0_GSUWGMRR0_K1_LBSPPA512_LBSPPB2048_LPA16_LPB0_MIWT2_8_PLR1_SU32_SUM0_SUS256_SKXCCM8_VWA1_VWB8_WGM1_WGMXCC1_WGMXCCGn1
    SolutionIndex: 65
    SolutionNameMin: Cijk_Ailk_Bjlk_HSS_BH_UserArgs_MT256x64x32_MI16x16x1_SN_LDSB1_CLR1_GSU0_GSUC0_GSUWGMRR0_K1_LBSPPA2048_LBSPPB512_LPA0_LPB16_MIWT8_2_PLR1_SU32_SUM0_SUS256_SKXCCM8_VWA4_VWB1_WGM4_WGMXCC1_WGMXCCGn1
    SolutionIndex: 66
    SolutionNameMin: Cijk_Ailk_Bjlk_HSS_BH_UserArgs_MT128x128x32_MI16x16x1_SN_LDSB1_CLR1_GSU0_GSUC0_GSUWGMRR0_K1_LBSPPA1024_LBSPPB1024_LPA0_LPB32_MIWT4_4_PLR1_SU32_SUM0_SUS256_SKXCCM8_VWA4_VWB2_WGM1_WGMXCC1_WGMXCCGn1
    SolutionIndex: 67
    SolutionNameMin: Cijk_Ailk_Bjlk_HSS_BH_UserArgs_MT128x128x32_MI16x16x1_SN_LDSB1_CLR1_GSU0_GSUC0_GSUWGMRR0_K1_LBSPPA1024_LBSPPB1024_LPA0_LPB32_MIWT4_4_PLR1_SU32_SUM0_SUS256_SKXCCM8_VWA4_VWB2_WGM4_WGMXCC1_WGMXCCGn1
    SolutionIndex: 68
    SolutionNameMin: Cijk_Ailk_Bjlk_HSS_BH_UserArgs_MT128x128x32_MI16x16x1_SN_LDSB0_CLR1_GSU0_GSUC0_GSUWGMRR0_K1_LBSPPA1024_LBSPPB1024_LPA0_LPB0_MIWT4_4_PLR1_SU32_SUM0_SUS256_SKXCCM8_VWA4_VWB4_WGM4_WGMXCC1_WGMXCCGn1
    SolutionIndex: 69
    SolutionNameMin: Cijk_Ailk_Bjlk_HSS_BH_UserArgs_MT128x128x32_MI16x16x1_SN_LDSB1_CLR1_GSU0_GSUC0_GSUWGMRR0_K1_LBSPPA1024_LBSPPB1024_LPA32_LPB32_MIWT4_4_PLR1_SU32_SUM0_SUS256_SKXCCM8_VWA2_VWB2_WGM8_WGMXCC1_WGMXCCGn1
    SolutionIndex: 70
    SolutionNameMin: Cijk_Ailk_Bjlk_HSS_BH_UserArgs_MT128x128x32_MI16x16x1_SN_LDSB1_CLR1_GSU0_GSUC0_GSUWGMRR0_K1_LBSPPA1024_LBSPPB1024_LPA0_LPB32_MIWT4_4_PLR1_SU32_SUM0_SUS256_SKXCCM8_VWA4_VWB2_WGM8_WGMXCC1_WGMXCCGn1
    SolutionIndex: 71
    SolutionNameMin: Cijk_Ailk_Bjlk_HSS_BH_UserArgs_MT128x64x32_MI16x16x1_SN_LDSB0_CLR1_GSU0_GSUC0_GSUWGMRR0_K1_LBSPPA1024_LBSPPB512_LPA0_LPB16_MIWT4_2_PLR1_SU32_SUM0_SUS256_SKXCCM8_VWA4_VWB1_WGM1_WGMXCC1_WGMXCCGn1
    SolutionIndex: 72
    SolutionNameMin: Cijk_Ailk_Bjlk_HSS_BH_UserArgs_MT128x64x32_MI16x16x1_SN_LDSB0_CLR1_GSU0_GSUC0_GSUWGMRR0_K1_LBSPPA1024_LBSPPB512_LPA0_LPB32_MIWT4_2_PLR1_SU32_SUM0_SUS256_SKXCCM8_VWA4_VWB2_WGM1_WGMXCC1_WGMXCCGn1
    SolutionIndex: 73
    SolutionNameMin: Cijk_Ailk_Bjlk_HSS_BH_UserArgs_MT128x64x32_MI16x16x1_SN_LDSB0_CLR0_GSU0_GSUC0_GSUWGMRR0_K1_LBSPPA1024_LBSPPB512_LPA0_LPB32_MIWT4_2_PLR0_SU32_SUM0_SUS256_SKXCCM8_VWA4_VWB2_WGM1_WGMXCC1_WGMXCCGn1
    SolutionIndex: 74
    SolutionNameMin: Cijk_Ailk_Bjlk_HSS_BH_UserArgs_MT128x64x32_MI16x16x1_SN_LDSB0_CLR0_GSU0_GSUC0_GSUWGMRR0_K1_LBSPPA1024_LBSPPB512_LPA0_LPB32_MIWT4_2_PLR0_SU32_SUM0_SUS256_SKXCCM8_VWA4_VWB2_WGM4_WGMXCC1_WGMXCCGn1
    SolutionIndex: 75
    SolutionNameMin: Cijk_Ailk_Bjlk_HSS_BH_UserArgs_MT128x32x32_MI16x16x1_SN_LDSB0_CLR1_GSU0_GSUC0_GSUWGMRR0_K1_LBSPPA1024_LBSPPB256_LPA0_LPB16_MIWT4_1_PLR1_SU32_SUM0_SUS256_SKXCCM8_VWA4_VWB1_WGM1_WGMXCC1_WGMXCCGn1
    SolutionIndex: 76
    SolutionNameMin: Cijk_Ailk_Bjlk_HSS_BH_UserArgs_MT64x64x32_MI16x16x1_SN_LDSB0_CLR1_GSU0_GSUC0_GSUWGMRR0_K1_LBSPPA512_LBSPPB512_LPA32_LPB32_MIWT2_2_PLR1_SU32_SUM0_SUS256_SKXCCM8_VWA2_VWB2_WGM1_WGMXCC1_WGMXCCGn1
    SolutionIndex: 77
    SolutionNameMin: Cijk_Ailk_Bjlk_HSS_BH_UserArgs_MT32x32x32_MI16x16x1_SN_LDSB0_CLR1_GSU0_GSUC0_GSUWGMRR0_K1_LBSPPA256_LBSPPB256_LPA16_LPB16_MIWT1_1_PLR1_SU32_SUM0_SUS256_SKXCCM8_VWA1_VWB1_WGM1_WGMXCC1_WGMXCCGn1
    SolutionIndex: 78
    SolutionNameMin: Cijk_Ailk_Bjlk_HSS_BH_UserArgs_MT32x32x32_MI16x16x1_SN_LDSB0_CLR0_GSU0_GSUC0_GSUWGMRR0_K1_LBSPPA256_LBSPPB256_LPA16_LPB16_MIWT1_1_PLR0_SU32_SUM0_SUS256_SKXCCM8_VWA1_VWB1_WGM1_WGMXCC1_WGMXCCGn1
    SolutionIndex: 79
    SolutionNameMin: Cijk_Ailk_Bjlk_HSS_BH_UserArgs_MT256x256x64_MI16x16x1_SN_LDSB1_CLR1_GSU0_GSUC0_GSUWGMRR0_K1_LBSPPA2048_LBSPPB2048_LPA0_LPB0_MIWT8_8_PLR1_SU32_SUM0_SUS256_SKXCCM8_VWA4_VWB4_WGM1_WGMXCC1_WGMXCCGn1
    SolutionIndex: 80
    SolutionNameMin: Cijk_Ailk_Bjlk_HSS_BH_UserArgs_MT256x256x64_MI16x16x1_SN_LDSB1_CLR1_GSU0_GSUC0_GSUWGMRR0_K1_LBSPPA2048_LBSPPB2048_LPA0_LPB0_MIWT8_8_PLR2_SU32_SUM0_SUS256_SKXCCM8_VWA4_VWB4_WGM1_WGMXCC1_WGMXCCGn1
    SolutionIndex: 81
    SolutionNameMin: Cijk_Ailk_Bjlk_HSS_BH_UserArgs_MT256x256x64_MI16x16x1_SN_LDSB1_CLR1_GSU0_GSUC0_GSUWGMRR0_K1_LBSPPA2048_LBSPPB2048_LPA0_LPB0_MIWT8_8_PLR2_SU32_SUM0_SUS256_SKXCCM8_VWA4_VWB8_WGM1_WGMXCC1_WGMXCCGn1
    SolutionIndex: 82
    SolutionNameMin: Cijk_Ailk_Bjlk_HSS_BH_UserArgs_MT256x256x64_MI16x16x1_SN_LDSB1_CLR1_GSU0_GSUC0_GSUWGMRR0_K1_LBSPPA2048_LBSPPB2048_LPA0_LPB0_MIWT8_8_PLR1_SU32_SUM0_SUS256_SKXCCM8_VWA4_VWB4_WGM4_WGMXCC1_WGMXCCGn1
    SolutionIndex: 83
    SolutionNameMin: Cijk_Ailk_Bjlk_HSS_BH_UserArgs_MT256x256x64_MI16x16x1_SN_LDSB1_CLR1_GSU0_GSUC0_GSUWGMRR0_K1_LBSPPA2048_LBSPPB2048_LPA0_LPB0_MIWT8_8_PLR2_SU32_SUM0_SUS256_SKXCCM8_VWA4_VWB4_WGM4_WGMXCC1_WGMXCCGn1
    SolutionIndex: 84
    SolutionNameMin: Cijk_Ailk_Bjlk_HSS_BH_UserArgs_MT256x256x64_MI16x16x1_SN_LDSB1_CLR1_GSU0_GSUC0_GSUWGMRR0_K1_LBSPPA2048_LBSPPB2048_LPA0_LPB0_MIWT8_8_PLR2_SU32_SUM0_SUS256_SKXCCM8_VWA4_VWB8_WGM4_WGMXCC1_WGMXCCGn1
    SolutionIndex: 85
    SolutionNameMin: Cijk_Ailk_Bjlk_HSS_BH_UserArgs_MT256x256x64_MI16x16x1_SN_LDSB1_CLR1_GSU0_GSUC0_GSUWGMRR0_K1_LBSPPA2048_LBSPPB2048_LPA0_LPB0_MIWT8_8_PLR1_SU32_SUM0_SUS256_SKXCCM8_VWA4_VWB4_WGM8_WGMXCC1_WGMXCCGn1
    SolutionIndex: 86
    SolutionNameMin: Cijk_Ailk_Bjlk_HSS_BH_UserArgs_MT256x256x64_MI16x16x1_SN_LDSB1_CLR1_GSU0_GSUC0_GSUWGMRR0_K1_LBSPPA2048_LBSPPB2048_LPA0_LPB0_MIWT8_8_PLR2_SU32_SUM0_SUS256_SKXCCM8_VWA4_VWB4_WGM8_WGMXCC1_WGMXCCGn1
    SolutionIndex: 87
    SolutionNameMin: Cijk_Ailk_Bjlk_HSS_BH_UserArgs_MT128x256x64_MI16x16x1_SN_LDSB1_CLR1_GSU0_GSUC0_GSUWGMRR0_K1_LBSPPA1024_LBSPPB2048_LPA32_LPB0_MIWT4_8_PLR1_SU32_SUM0_SUS256_SKXCCM8_VWA2_VWB4_WGM1_WGMXCC1_WGMXCCGn1
    SolutionIndex: 88
    SolutionNameMin: Cijk_Ailk_Bjlk_HSS_BH_UserArgs_MT128x256x64_MI16x16x1_SN_LDSB1_CLR1_GSU0_GSUC0_GSUWGMRR0_K1_LBSPPA1024_LBSPPB2048_LPA0_LPB0_MIWT4_8_PLR1_SU32_SUM0_SUS256_SKXCCM8_VWA4_VWB4_WGM1_WGMXCC1_WGMXCCGn1
    SolutionIndex: 89
    SolutionNameMin: Cijk_Ailk_Bjlk_HSS_BH_UserArgs_MT128x256x64_MI16x16x1_SN_LDSB1_CLR1_GSU0_GSUC0_GSUWGMRR0_K1_LBSPPA1024_LBSPPB2048_LPA0_LPB0_MIWT4_8_PLR2_SU32_SUM0_SUS256_SKXCCM8_VWA4_VWB8_WGM1_WGMXCC1_WGMXCCGn1
    SolutionIndex: 90
    SolutionNameMin: Cijk_Ailk_Bjlk_HSS_BH_UserArgs_MT128x256x64_MI16x16x1_SN_LDSB1_CLR1_GSU0_GSUC0_GSUWGMRR0_K1_LBSPPA1024_LBSPPB2048_LPA0_LPB0_MIWT4_8_PLR1_SU32_SUM0_SUS256_SKXCCM8_VWA4_VWB4_WGM8_WGMXCC1_WGMXCCGn1
    SolutionIndex: 91
    SolutionNameMin: Cijk_Ailk_Bjlk_HSS_BH_UserArgs_MT128x256x64_MI16x16x1_SN_LDSB1_CLR1_GSU0_GSUC0_GSUWGMRR0_K1_LBSPPA1024_LBSPPB2048_LPA0_LPB0_MIWT4_8_PLR1_SU32_SUM0_SUS256_SKXCCM8_VWA4_VWB8_WGM8_WGMXCC1_WGMXCCGn1
    SolutionIndex: 92
    SolutionNameMin: Cijk_Ailk_Bjlk_HSS_BH_UserArgs_MT128x256x64_MI16x16x1_SN_LDSB1_CLR1_GSU0_GSUC0_GSUWGMRR0_K1_LBSPPA1024_LBSPPB2048_LPA32_LPB0_MIWT4_8_PLR2_SU32_SUM0_SUS256_SKXCCM8_VWA2_VWB4_WGM8_WGMXCC1_WGMXCCGn1
    SolutionIndex: 93
    SolutionNameMin: Cijk_Ailk_Bjlk_HSS_BH_UserArgs_MT256x128x64_MI16x16x1_SN_LDSB1_CLR1_GSU0_GSUC0_GSUWGMRR0_K1_LBSPPA2048_LBSPPB1024_LPA0_LPB0_MIWT8_4_PLR1_SU32_SUM0_SUS256_SKXCCM8_VWA4_VWB4_WGM1_WGMXCC1_WGMXCCGn1
    SolutionIndex: 94
    SolutionNameMin: Cijk_Ailk_Bjlk_HSS_BH_UserArgs_MT256x128x64_MI16x16x1_SN_LDSB1_CLR1_GSU0_GSUC0_GSUWGMRR0_K1_LBSPPA2048_LBSPPB1024_LPA0_LPB0_MIWT8_4_PLR2_SU32_SUM0_SUS256_SKXCCM8_VWA4_VWB4_WGM1_WGMXCC1_WGMXCCGn1
    SolutionIndex: 95
    SolutionNameMin: Cijk_Ailk_Bjlk_HSS_BH_UserArgs_MT256x128x64_MI16x16x1_SN_LDSB1_CLR1_GSU0_GSUC0_GSUWGMRR0_K1_LBSPPA2048_LBSPPB1024_LPA32_LPB0_MIWT8_4_PLR1_SU32_SUM0_SUS256_SKXCCM8_VWA2_VWB4_WGM4_WGMXCC1_WGMXCCGn1
    SolutionIndex: 96
    SolutionNameMin: Cijk_Ailk_Bjlk_HSS_BH_UserArgs_MT256x128x64_MI16x16x1_SN_LDSB1_CLR1_GSU0_GSUC0_GSUWGMRR0_K1_LBSPPA2048_LBSPPB1024_LPA0_LPB0_MIWT8_4_PLR1_SU32_SUM0_SUS256_SKXCCM8_VWA4_VWB4_WGM8_WGMXCC1_WGMXCCGn1
    SolutionIndex: 97
    SolutionNameMin: Cijk_Ailk_Bjlk_HSS_BH_UserArgs_MT128x128x64_MI16x16x1_SN_LDSB1_CLR1_GSU0_GSUC0_GSUWGMRR0_K1_LBSPPA1024_LBSPPB1024_LPA0_LPB0_MIWT4_4_PLR1_SU32_SUM0_SUS256_SKXCCM8_VWA4_VWB4_WGM1_WGMXCC1_WGMXCCGn1
    SolutionIndex: 98
    SolutionNameMin: Cijk_Ailk_Bjlk_HSS_BH_UserArgs_MT128x128x64_MI16x16x1_SN_LDSB1_CLR1_GSU0_GSUC0_GSUWGMRR0_K1_LBSPPA1024_LBSPPB1024_LPA0_LPB0_MIWT4_4_PLR2_SU32_SUM0_SUS256_SKXCCM8_VWA4_VWB4_WGM1_WGMXCC1_WGMXCCGn1
    SolutionIndex: 99
    SolutionNameMin: Cijk_Ailk_Bjlk_HSS_BH_UserArgs_MT128x128x64_MI16x16x1_SN_LDSB1_CLR1_GSU0_GSUC0_GSUWGMRR0_K1_LBSPPA1024_LBSPPB1024_LPA0_LPB0_MIWT4_4_PLR1_SU32_SUM0_SUS256_SKXCCM8_VWA4_VWB4_WGM4_WGMXCC1_WGMXCCGn1
    SolutionIndex: 100
    SolutionNameMin: Cijk_Ailk_Bjlk_HSS_BH_UserArgs_MT128x128x64_MI16x16x1_SN_LDSB1_CLR1_GSU0_GSUC0_GSUWGMRR0_K1_LBSPPA1024_LBSPPB1024_LPA0_LPB0_MIWT4_4_PLR1_SU32_SUM0_SUS256_SKXCCM8_VWA4_VWB4_WGM8_WGMXCC1_WGMXCCGn1
    SolutionIndex: 101
    SolutionNameMin: Cijk_Ailk_Bjlk_HSS_BH_UserArgs_MT128x128x64_MI16x16x1_SN_LDSB1_CLR1_GSU0_GSUC0_GSUWGMRR0_K1_LBSPPA1024_LBSPPB1024_LPA0_LPB0_MIWT4_4_PLR2_SU32_SUM0_SUS256_SKXCCM8_VWA4_VWB4_WGM8_WGMXCC1_WGMXCCGn1
    SolutionIndex: 102
    SolutionNameMin: Cijk_Ailk_Bjlk_HSS_BH_UserArgs_MT128x64x64_MI16x16x1_SN_LDSB1_CLR1_GSU0_GSUC0_GSUWGMRR0_K1_LBSPPA1024_LBSPPB512_LPA0_LPB32_MIWT4_2_PLR2_SU32_SUM0_SUS256_SKXCCM8_VWA4_VWB2_WGM1_WGMXCC1_WGMXCCGn1
    SolutionIndex: 103
    SolutionNameMin: Cijk_Ailk_Bjlk_HSS_BH_UserArgs_MT128x64x64_MI16x16x1_SN_LDSB1_CLR1_GSU0_GSUC0_GSUWGMRR0_K1_LBSPPA1024_LBSPPB512_LPA0_LPB32_MIWT4_2_PLR2_SU32_SUM0_SUS256_SKXCCM8_VWA4_VWB2_WGM8_WGMXCC1_WGMXCCGn1
    SolutionIndex: 104
    SolutionNameMin: Cijk_Ailk_Bjlk_HSS_BH_UserArgs_MT64x64x64_MI16x16x1_SN_LDSB1_CLR1_GSU0_GSUC0_GSUWGMRR0_K1_LBSPPA512_LBSPPB512_LPA32_LPB32_MIWT2_2_PLR1_SU32_SUM0_SUS256_SKXCCM8_VWA2_VWB2_WGM1_WGMXCC1_WGMXCCGn1
    SolutionIndex: 105
    SolutionNameMin: Cijk_Ailk_Bjlk_HSS_BH_UserArgs_MT64x64x64_MI16x16x1_SN_LDSB1_CLR1_GSU0_GSUC0_GSUWGMRR0_K1_LBSPPA512_LBSPPB512_LPA32_LPB32_MIWT2_2_PLR2_SU32_SUM0_SUS256_SKXCCM8_VWA2_VWB2_WGM1_WGMXCC1_WGMXCCGn1
    SolutionIndex: 106
    SolutionNameMin: Cijk_Ailk_Bjlk_HSS_BH_UserArgs_MT64x64x64_MI16x16x1_SN_LDSB1_CLR1_GSU0_GSUC0_GSUWGMRR0_K1_LBSPPA512_LBSPPB512_LPA32_LPB32_MIWT2_2_PLR1_SU32_SUM0_SUS256_SKXCCM8_VWA2_VWB2_WGM4_WGMXCC1_WGMXCCGn1
    SolutionIndex: 107
    SolutionNameMin: Cijk_Ailk_Bjlk_HSS_BH_UserArgs_MT64x64x64_MI16x16x1_SN_LDSB1_CLR1_GSU0_GSUC0_GSUWGMRR0_K1_LBSPPA512_LBSPPB512_LPA32_LPB32_MIWT2_2_PLR2_SU32_SUM0_SUS256_SKXCCM8_VWA2_VWB2_WGM4_WGMXCC1_WGMXCCGn1
    SolutionIndex: 108
    SolutionNameMin: Cijk_Ailk_Bjlk_HSS_BH_UserArgs_MT64x64x64_MI16x16x1_SN_LDSB1_CLR1_GSU0_GSUC0_GSUWGMRR0_K1_LBSPPA512_LBSPPB512_LPA32_LPB32_MIWT2_2_PLR1_SU32_SUM0_SUS256_SKXCCM8_VWA2_VWB2_WGM8_WGMXCC1_WGMXCCGn1
    SolutionIndex: 109
    SolutionNameMin: Cijk_Ailk_Bjlk_HSS_BH_UserArgs_MT64x64x64_MI16x16x1_SN_LDSB1_CLR1_GSU0_GSUC0_GSUWGMRR0_K1_LBSPPA512_LBSPPB512_LPA32_LPB32_MIWT2_2_PLR2_SU32_SUM0_SUS256_SKXCCM8_VWA2_VWB2_WGM8_WGMXCC1_WGMXCCGn1
    SolutionIndex: 110
    SolutionNameMin: Cijk_Ailk_Bjlk_HSS_BH_UserArgs_MT32x64x64_MI16x16x1_SN_LDSB0_CLR1_GSU0_GSUC0_GSUWGMRR0_K1_LBSPPA256_LBSPPB512_LPA16_LPB32_MIWT1_2_PLR2_SU32_SUM0_SUS256_SKXCCM8_VWA1_VWB2_WGM1_WGMXCC1_WGMXCCGn1
    SolutionIndex: 111
    SolutionNameMin: Cijk_Ailk_Bjlk_HSS_BH_UserArgs_MT32x64x64_MI16x16x1_SN_LDSB0_CLR1_GSU0_GSUC0_GSUWGMRR0_K1_LBSPPA256_LBSPPB512_LPA16_LPB32_MIWT1_2_PLR2_SU32_SUM0_SUS256_SKXCCM8_VWA1_VWB2_WGM8_WGMXCC1_WGMXCCGn1
    SolutionIndex: 112
    SolutionNameMin: Cijk_Ailk_Bjlk_HSS_BH_UserArgs_MT64x32x64_MI16x16x1_SN_LDSB0_CLR1_GSU0_GSUC0_GSUWGMRR0_K1_LBSPPA512_LBSPPB256_LPA32_LPB16_MIWT2_1_PLR2_SU32_SUM0_SUS256_SKXCCM8_VWA2_VWB1_WGM1_WGMXCC1_WGMXCCGn1
    SolutionIndex: 113
    SolutionNameMin: Cijk_Ailk_Bjlk_HSS_BH_UserArgs_MT32x32x64_MI16x16x1_SN_LDSB0_CLR1_GSU0_GSUC0_GSUWGMRR0_K1_LBSPPA256_LBSPPB256_LPA16_LPB16_MIWT1_1_PLR1_SU32_SUM0_SUS256_SKXCCM8_VWA1_VWB1_WGM1_WGMXCC1_WGMXCCGn1
    SolutionIndex: 114
    SolutionNameMin: Cijk_Ailk_Bjlk_HSS_BH_UserArgs_MT32x32x64_MI16x16x1_SN_LDSB0_CLR1_GSU0_GSUC0_GSUWGMRR0_K1_LBSPPA256_LBSPPB256_LPA16_LPB16_MIWT1_1_PLR2_SU32_SUM0_SUS256_SKXCCM8_VWA1_VWB1_WGM1_WGMXCC1_WGMXCCGn1
    SolutionIndex: 115
    SolutionNameMin: Cijk_Ailk_Bjlk_HSS_BH_UserArgs_MT32x32x64_MI16x16x1_SN_LDSB0_CLR1_GSU0_GSUC0_GSUWGMRR0_K1_LBSPPA256_LBSPPB256_LPA16_LPB16_MIWT1_1_PLR1_SU32_SUM0_SUS256_SKXCCM8_VWA1_VWB1_WGM8_WGMXCC1_WGMXCCGn1
    SolutionIndex: 116
    SolutionNameMin: Cijk_Ailk_Bjlk_HSS_BH_UserArgs_MT128x128x128_MI16x16x1_SN_LDSB1_CLR1_GSU0_GSUC0_GSUWGMRR0_K1_LBSPPA1024_LBSPPB1024_LPA0_LPB0_MIWT4_4_PLR1_SU32_SUM0_SUS256_SKXCCM8_VWA4_VWB4_WGM1_WGMXCC1_WGMXCCGn1
    SolutionIndex: 117
    SolutionNameMin: Cijk_Ailk_Bjlk_HSS_BH_UserArgs_MT128x128x128_MI16x16x1_SN_LDSB1_CLR1_GSU0_GSUC0_GSUWGMRR0_K1_LBSPPA1024_LBSPPB1024_LPA0_LPB0_MIWT4_4_PLR1_SU32_SUM0_SUS256_SKXCCM8_VWA4_VWB4_WGM4_WGMXCC1_WGMXCCGn1
    SolutionIndex: 118
    SolutionNameMin: Cijk_Ailk_Bjlk_HSS_BH_UserArgs_MT128x128x128_MI16x16x1_SN_LDSB1_CLR1_GSU0_GSUC0_GSUWGMRR0_K1_LBSPPA1024_LBSPPB1024_LPA0_LPB0_MIWT4_4_PLR2_SU32_SUM0_SUS256_SKXCCM8_VWA4_VWB4_WGM4_WGMXCC1_WGMXCCGn1
    SolutionIndex: 119
    SolutionNameMin: Cijk_Ailk_Bjlk_HSS_BH_UserArgs_MT128x128x128_MI16x16x1_SN_LDSB1_CLR1_GSU0_GSUC0_GSUWGMRR0_K1_LBSPPA1024_LBSPPB1024_LPA0_LPB0_MIWT4_4_PLR1_SU32_SUM0_SUS256_SKXCCM8_VWA4_VWB4_WGM8_WGMXCC1_WGMXCCGn1
    SolutionIndex: 120
    SolutionNameMin: Cijk_Ailk_Bjlk_HSS_BH_UserArgs_MT128x128x128_MI16x16x1_SN_LDSB1_CLR1_GSU0_GSUC0_GSUWGMRR0_K1_LBSPPA1024_LBSPPB1024_LPA0_LPB0_MIWT4_4_PLR2_SU32_SUM0_SUS256_SKXCCM8_VWA4_VWB4_WGM8_WGMXCC1_WGMXCCGn1
    SolutionIndex: 121
    SolutionNameMin: Cijk_Ailk_Bjlk_HSS_BH_UserArgs_MT128x64x128_MI16x16x1_SN_LDSB1_CLR1_GSU0_GSUC0_GSUWGMRR0_K1_LBSPPA1024_LBSPPB512_LPA0_LPB32_MIWT4_2_PLR2_SU32_SUM0_SUS256_SKXCCM8_VWA4_VWB2_WGM1_WGMXCC1_WGMXCCGn1
    SolutionIndex: 122
    SolutionNameMin: Cijk_Ailk_Bjlk_HSS_BH_UserArgs_MT128x64x128_MI16x16x1_SN_LDSB1_CLR1_GSU0_GSUC0_GSUWGMRR0_K1_LBSPPA1024_LBSPPB512_LPA0_LPB32_MIWT4_2_PLR2_SU32_SUM0_SUS256_SKXCCM8_VWA4_VWB2_WGM4_WGMXCC1_WGMXCCGn1
    SolutionIndex: 123
    SolutionNameMin: Cijk_Ailk_Bjlk_HSS_BH_UserArgs_MT128x64x128_MI16x16x1_SN_LDSB1_CLR1_GSU0_GSUC0_GSUWGMRR0_K1_LBSPPA1024_LBSPPB512_LPA0_LPB32_MIWT4_2_PLR2_SU32_SUM0_SUS256_SKXCCM8_VWA4_VWB2_WGM8_WGMXCC1_WGMXCCGn1
    SolutionIndex: 124
    SolutionNameMin: Cijk_Ailk_Bjlk_HSS_BH_UserArgs_MT64x64x128_MI16x16x1_SN_LDSB1_CLR1_GSU0_GSUC0_GSUWGMRR0_K1_LBSPPA512_LBSPPB512_LPA32_LPB32_MIWT2_2_PLR2_SU32_SUM0_SUS256_SKXCCM8_VWA2_VWB2_WGM1_WGMXCC1_WGMXCCGn1
    SolutionIndex: 125
    SolutionNameMin: Cijk_Ailk_Bjlk_HSS_BH_UserArgs_MT64x64x128_MI16x16x1_SN_LDSB1_CLR1_GSU0_GSUC0_GSUWGMRR0_K1_LBSPPA512_LBSPPB512_LPA32_LPB32_MIWT2_2_PLR2_SU32_SUM0_SUS256_SKXCCM8_VWA2_VWB2_WGM4_WGMXCC1_WGMXCCGn1
    SolutionIndex: 126
    SolutionNameMin: Cijk_Ailk_Bjlk_HSS_BH_UserArgs_MT32x64x128_MI16x16x1_SN_LDSB1_CLR1_GSU0_GSUC0_GSUWGMRR0_K1_LBSPPA256_LBSPPB512_LPA16_LPB32_MIWT1_2_PLR1_SU32_SUM0_SUS256_SKXCCM8_VWA1_VWB2_WGM1_WGMXCC1_WGMXCCGn1
    SolutionIndex: 127
    SolutionNameMin: Cijk_Ailk_Bjlk_HSS_BH_UserArgs_MT64x32x128_MI16x16x1_SN_LDSB1_CLR1_GSU0_GSUC0_GSUWGMRR0_K1_LBSPPA512_LBSPPB256_LPA32_LPB16_MIWT2_1_PLR1_SU32_SUM0_SUS256_SKXCCM8_VWA2_VWB1_WGM1_WGMXCC1_WGMXCCGn1
    SolutionIndex: 128
    SolutionNameMin: Cijk_Ailk_Bjlk_HSS_BH_UserArgs_MT64x32x128_MI16x16x1_SN_LDSB1_CLR1_GSU0_GSUC0_GSUWGMRR0_K1_LBSPPA512_LBSPPB256_LPA32_LPB16_MIWT2_1_PLR2_SU32_SUM0_SUS256_SKXCCM8_VWA2_VWB1_WGM1_WGMXCC1_WGMXCCGn1
    SolutionIndex: 129
    SolutionNameMin: Cijk_Ailk_Bjlk_HSS_BH_UserArgs_MT32x32x128_MI16x16x1_SN_LDSB1_CLR1_GSU0_GSUC0_GSUWGMRR0_K1_LBSPPA256_LBSPPB256_LPA16_LPB16_MIWT1_1_PLR1_SU32_SUM0_SUS256_SKXCCM8_VWA1_VWB1_WGM1_WGMXCC1_WGMXCCGn1
    SolutionIndex: 130
    SolutionNameMin: Cijk_Ailk_Bjlk_HSS_BH_UserArgs_MT32x32x32_MI16x16x1_SN_LDSB0_CLR1_GSU0_GSUC0_GSUWGMRR0_K1_LBSPPA256_LBSPPB256_LPA16_LPB16_MIWT1_1_PLR1_SU32_SUM0_SUS256_SKXCCM0_VWA1_VWB1_WGM1_WGMXCC1_WGMXCCGn1
- - - [128, 128, 1, 128, 128, 128, 128, 128]
    - [113, 0.079]
  - - [128, 128, 1, 256, 128, 128, 128, 128]
    - [47, 0.138]
  - - [128, 128, 1, 512, 128, 128, 128, 128]
    - [26, 0.229]
  - - [128, 128, 1, 1024, 128, 128, 128, 128]
    - [48, 0.323]
  - - [128, 128, 1, 2048, 128, 128, 128, 128]
    - [77, 0.547]
  - - [128, 128, 1, 4096, 128, 128, 128, 128]
    - [113, 0.928]
  - - [128, 128, 1, 8192, 128, 128, 128, 128]
    - [77, 1.411]
  - - [128, 256, 1, 128, 128, 128, 128, 256]
    - [27, 0.162]
  - - [128, 256, 1, 256, 128, 128, 128, 256]
    - [27, 0.285]
  - - [128, 256, 1, 512, 128, 128, 128, 256]
    - [48, 0.457]
  - - [128, 256, 1, 1024, 128, 128, 128, 256]
    - [48, 0.667]
  - - [128, 256, 1, 2048, 128, 128, 128, 256]
    - [9, 1.054]
  - - [128, 256, 1, 4096, 128, 128, 128, 256]
    - [113, 1.81]
  - - [128, 256, 1, 8192, 128, 128, 128, 256]
    - [48, 2.623]
  - - [128, 512, 1, 128, 128, 128, 128, 512]
    - [10, 0.318]
  - - [128, 512, 1, 256, 128, 128, 128, 512]
    - [114, 0.553]
  - - [128, 512, 1, 512, 128, 128, 128, 512]
    - [48, 0.902]
  - - [128, 512, 1, 1024, 128, 128, 128, 512]
    - [48, 1.322]
  - - [128, 512, 1, 2048, 128, 128, 128, 512]
    - [78, 2.027]
  - - [128, 512, 1, 4096, 128, 128, 128, 512]
    - [114, 3.421]
  - - [128, 512, 1, 8192, 128, 128, 128, 512]
    - [48, 4.842]
  - - [128, 1024, 1, 128, 128, 128, 128, 1024]
    - [9, 0.624]
  - - [128, 1024, 1, 256, 128, 128, 128, 1024]
    - [48, 1.093]
  - - [128, 1024, 1, 512, 128, 128, 128, 1024]
    - [26, 1.741]
  - - [128, 1024, 1, 1024, 128, 128, 128, 1024]
    - [48, 2.595]
  - - [128, 1024, 1, 2048, 128, 128, 128, 1024]
    - [26, 3.805]
  - - [128, 1024, 1, 4096, 128, 128, 128, 1024]
    - [110, 5.839]
  - - [128, 1024, 1, 8192, 128, 128, 128, 1024]
    - [42, 8.295]
  - - [128, 2048, 1, 128, 128, 128, 128, 2048]
    - [9, 1.207]
  - - [128, 2048, 1, 256, 128, 128, 128, 2048]
    - [9, 2.081]
  - - [128, 2048, 1, 512, 128, 128, 128, 2048]
    - [27, 3.454]
  - - [128, 2048, 1, 1024, 128, 128, 128, 2048]
    - [129, 4.982]
  - - [128, 2048, 1, 2048, 128, 128, 128, 2048]
    - [43, 6.739]
  - - [128, 2048, 1, 4096, 128, 128, 128, 2048]
    - [105, 9.15]
  - - [128, 2048, 1, 8192, 128, 128, 128, 2048]
    - [124, 12.057]
  - - [128, 4096, 1, 128, 128, 128, 128, 4096]
    - [8, 2.092]
  - - [128, 4096, 1, 256, 128, 128, 128, 4096]
    - [112, 3.84]
  - - [128, 4096, 1, 512, 128, 128, 128, 4096]
    - [112, 6.145]
  - - [128, 4096, 1, 1024, 128, 128, 128, 4096]
    - [127, 8.663]
  - - [128, 4096, 1, 2048, 128, 128, 128, 4096]
    - [40, 9.878]
  - - [128, 4096, 1, 4096, 128, 128, 128, 4096]
    - [102, 12.938]
  - - [128, 4096, 1, 8192, 128, 128, 128, 4096]
    - [121, 16.017]
  - - [128, 8192, 1, 128, 128, 128, 128, 8192]
    - [104, 3.694]
  - - [128, 8192, 1, 256, 128, 128, 128, 8192]
    - [76, 6.272]
  - - [128, 8192, 1, 512, 128, 128, 128, 8192]
    - [104, 9.669]
  - - [128, 8192, 1, 1024, 128, 128, 128, 8192]
    - [104, 12.687]
  - - [128, 8192, 1, 2048, 128, 128, 128, 8192]
    - [124, 13.957]
  - - [128, 8192, 1, 4096, 128, 128, 128, 8192]
    - [97, 16.995]
  - - [128, 8192, 1, 8192, 128, 128, 128, 8192]
    - [30, 20.232]
  - - [256, 128, 1, 128, 256, 256, 256, 128]
    - [77, 0.161]
  - - [256, 128, 1, 256, 256, 256, 256, 128]
    - [129, 0.278]
  - - [256, 128, 1, 512, 256, 256, 256, 128]
    - [47, 0.46]
  - - [256, 128, 1, 1024, 256, 256, 256, 128]
    - [48, 0.665]
  - - [256, 128, 1, 2048, 256, 256, 256, 128]
    - [77, 1.051]
  - - [256, 128, 1, 4096, 256, 256, 256, 128]
    - [113, 1.776]
  - - [256, 128, 1, 8192, 256, 256, 256, 128]
    - [47, 2.576]
  - - [256, 256, 1, 128, 256, 256, 256, 256]
    - [9, 0.318]
  - - [256, 256, 1, 256, 256, 256, 256, 256]
    - [27, 0.56]
  - - [256, 256, 1, 512, 256, 256, 256, 256]
    - [27, 0.904]
  - - [256, 256, 1, 1024, 256, 256, 256, 256]
    - [129, 1.311]
  - - [256, 256, 1, 2048, 256, 256, 256, 256]
    - [77, 2.064]
  - - [256, 256, 1, 4096, 256, 256, 256, 256]
    - [113, 3.455]
  - - [256, 256, 1, 8192, 256, 256, 256, 256]
    - [47, 4.895]
  - - [256, 512, 1, 128, 256, 256, 256, 512]
    - [9, 0.629]
  - - [256, 512, 1, 256, 256, 256, 256, 512]
    - [27, 1.098]
  - - [256, 512, 1, 512, 256, 256, 256, 512]
    - [26, 1.778]
  - - [256, 512, 1, 1024, 256, 256, 256, 512]
    - [129, 2.529]
  - - [256, 512, 1, 2048, 256, 256, 256, 512]
    - [26, 3.783]
  - - [256, 512, 1, 4096, 256, 256, 256, 512]
    - [112, 5.957]
  - - [256, 512, 1, 8192, 256, 256, 256, 512]
    - [46, 8.173]
  - - [256, 1024, 1, 128, 256, 256, 256, 1024]
    - [10, 1.173]
  - - [256, 1024, 1, 256, 256, 256, 256, 1024]
    - [27, 2.065]
  - - [256, 1024, 1, 512, 256, 256, 256, 1024]
    - [47, 3.369]
  - - [256, 1024, 1, 1024, 256, 256, 256, 1024]
    - [48, 4.968]
  - - [256, 1024, 1, 2048, 256, 256, 256, 1024]
    - [41, 6.75]
  - - [256, 1024, 1, 4096, 256, 256, 256, 1024]
    - [105, 9.172]
  - - [256, 1024, 1, 8192, 256, 256, 256, 1024]
    - [40, 12.941]
  - - [256, 2048, 1, 128, 256, 256, 256, 2048]
    - [7, 2.106]
  - - [256, 2048, 1, 256, 256, 256, 256, 2048]
    - [110, 3.72]
  - - [256, 2048, 1, 512, 256, 256, 256, 2048]
    - [128, 5.99]
  - - [256, 2048, 1, 1024, 256, 256, 256, 2048]
    - [128, 8.58]
  - - [256, 2048, 1, 2048, 256, 256, 256, 2048]
    - [40, 10.238]
  - - [256, 2048, 1, 4096, 256, 256, 256, 2048]
    - [103, 13.112]
  - - [256, 2048, 1, 8192, 256, 256, 256, 2048]
    - [122, 16.479]
  - - [256, 4096, 1, 128, 256, 256, 256, 4096]
    - [105, 3.635]
  - - [256, 4096, 1, 256, 256, 256, 256, 4096]
    - [105, 6.415]
  - - [256, 4096, 1, 512, 256, 256, 256, 4096]
    - [104, 9.874]
  - - [256, 4096, 1, 1024, 256, 256, 256, 4096]
    - [108, 12.697]
  - - [256, 4096, 1, 2048, 256, 256, 256, 4096]
    - [125, 14.351]
  - - [256, 4096, 1, 4096, 256, 256, 256, 4096]
    - [97, 18.239]
  - - [256, 4096, 1, 8192, 256, 256, 256, 4096]
    - [117, 22.546]
  - - [256, 8192, 1, 128, 256, 256, 256, 8192]
    - [72, 5.689]
  - - [256, 8192, 1, 256, 256, 256, 256, 8192]
    - [73, 9.03]
  - - [256, 8192, 1, 512, 256, 256, 256, 8192]
    - [102, 13.314]
  - - [256, 8192, 1, 1024, 256, 256, 256, 8192]
    - [116, 16.603]
  - - [256, 8192, 1, 2048, 256, 256, 256, 8192]
    - [123, 18.469]
  - - [256, 8192, 1, 4096, 256, 256, 256, 8192]
    - [118, 22.409]
  - - [256, 8192, 1, 8192, 256, 256, 256, 8192]
    - [3, 24.273]
  - - [512, 128, 1, 128, 512, 512, 512, 128]
    - [27, 0.317]
  - - [512, 128, 1, 256, 512, 512, 512, 128]
    - [113, 0.555]
  - - [512, 128, 1, 512, 512, 512, 512, 128]
    - [47, 0.904]
  - - [512, 128, 1, 1024, 512, 512, 512, 128]
    - [48, 1.318]
  - - [512, 128, 1, 2048, 512, 512, 512, 128]
    - [78, 2.005]
  - - [512, 128, 1, 4096, 512, 512, 512, 128]
    - [115, 3.324]
  - - [512, 128, 1, 8192, 512, 512, 512, 128]
    - [48, 4.909]
  - - [512, 256, 1, 128, 512, 512, 512, 256]
    - [27, 0.624]
  - - [512, 256, 1, 256, 512, 512, 512, 256]
    - [27, 1.102]
  - - [512, 256, 1, 512, 512, 512, 512, 256]
    - [26, 1.785]
  - - [512, 256, 1, 1024, 512, 512, 512, 256]
    - [48, 2.525]
  - - [512, 256, 1, 2048, 512, 512, 512, 256]
    - [48, 3.788]
  - - [512, 256, 1, 4096, 512, 512, 512, 256]
    - [111, 5.951]
  - - [512, 256, 1, 8192, 512, 512, 512, 256]
    - [46, 8.307]
  - - [512, 512, 1, 128, 512, 512, 512, 512]
    - [9, 1.192]
  - - [512, 512, 1, 256, 512, 512, 512, 512]
    - [27, 2.044]
  - - [512, 512, 1, 512, 512, 512, 512, 512]
    - [26, 3.411]
  - - [512, 512, 1, 1024, 512, 512, 512, 512]
    - [47, 4.978]
  - - [512, 512, 1, 2048, 512, 512, 512, 512]
    - [128, 6.854]
  - - [512, 512, 1, 4096, 512, 512, 512, 512]
    - [106, 9.166]
  - - [512, 512, 1, 8192, 512, 512, 512, 512]
    - [38, 12.719]
  - - [512, 1024, 1, 128, 512, 512, 512, 1024]
    - [112, 2.157]
  - - [512, 1024, 1, 256, 512, 512, 512, 1024]
    - [24, 3.775]
  - - [512, 1024, 1, 512, 512, 512, 512, 1024]
    - [41, 6.109]
  - - [512, 1024, 1, 1024, 512, 512, 512, 1024]
    - [127, 8.598]
  - - [512, 1024, 1, 2048, 512, 512, 512, 1024]
    - [38, 10.378]
  - - [512, 1024, 1, 4096, 512, 512, 512, 1024]
    - [39, 13.541]
  - - [512, 1024, 1, 8192, 512, 512, 512, 1024]
    - [36, 16.827]
  - - [512, 2048, 1, 128, 512, 512, 512, 2048]
    - [104, 3.64]
  - - [512, 2048, 1, 256, 512, 512, 512, 2048]
    - [104, 6.323]
  - - [512, 2048, 1, 512, 512, 512, 512, 2048]
    - [22, 9.846]
  - - [512, 2048, 1, 1024, 512, 512, 512, 2048]
    - [104, 12.827]
  - - [512, 2048, 1, 2048, 512, 512, 512, 2048]
    - [121, 14.489]
  - - [512, 2048, 1, 4096, 512, 512, 512, 2048]
    - [98, 18.205]
  - - [512, 2048, 1, 8192, 512, 512, 512, 2048]
    - [32, 22.156]
  - - [512, 4096, 1, 128, 512, 512, 512, 4096]
    - [72, 5.655]
  - - [512, 4096, 1, 256, 512, 512, 512, 4096]
    - [73, 9.017]
  - - [512, 4096, 1, 512, 512, 512, 512, 4096]
    - [123, 13.246]
  - - [512, 4096, 1, 1024, 512, 512, 512, 4096]
    - [116, 16.743]
  - - [512, 4096, 1, 2048, 512, 512, 512, 4096]
    - [97, 18.788]
  - - [512, 4096, 1, 4096, 512, 512, 512, 4096]
    - [31, 23.389]
  - - [512, 4096, 1, 8192, 512, 512, 512, 4096]
    - [63, 24.293]
  - - [512, 8192, 1, 128, 512, 512, 512, 8192]
    - [64, 7.318]
  - - [512, 8192, 1, 256, 512, 512, 512, 8192]
    - [97, 11.695]
  - - [512, 8192, 1, 512, 512, 512, 512, 8192]
    - [21, 16.599]
  - - [512, 8192, 1, 1024, 512, 512, 512, 8192]
    - [21, 21.04]
  - - [512, 8192, 1, 2048, 512, 512, 512, 8192]
    - [21, 24.705]
  - - [512, 8192, 1, 4096, 512, 512, 512, 8192]
    - [117, 28.008]
  - - [512, 8192, 1, 8192, 512, 512, 512, 8192]
    - [15, 27.141]
  - - [1024, 128, 1, 128, 1024, 1024, 1024, 128]
    - [9, 0.624]
  - - [1024, 128, 1, 256, 1024, 1024, 1024, 128]
    - [47, 1.088]
  - - [1024, 128, 1, 512, 1024, 1024, 1024, 128]
    - [26, 1.794]
  - - [1024, 128, 1, 1024, 1024, 1024, 1024, 128]
    - [48, 2.6]
  - - [1024, 128, 1, 2048, 1024, 1024, 1024, 128]
    - [26, 3.78]
  - - [1024, 128, 1, 4096, 1024, 1024, 1024, 128]
    - [111, 5.857]
  - - [1024, 128, 1, 8192, 1024, 1024, 1024, 128]
    - [44, 7.974]
  - - [1024, 256, 1, 128, 1024, 1024, 1024, 256]
    - [9, 1.203]
  - - [1024, 256, 1, 256, 1024, 1024, 1024, 256]
    - [27, 2.117]
  - - [1024, 256, 1, 512, 1024, 1024, 1024, 256]
    - [27, 3.434]
  - - [1024, 256, 1, 1024, 1024, 1024, 1024, 256]
    - [26, 5.004]
  - - [1024, 256, 1, 2048, 1024, 1024, 1024, 256]
    - [41, 6.718]
  - - [1024, 256, 1, 4096, 1024, 1024, 1024, 256]
    - [109, 9.06]
  - - [1024, 256, 1, 8192, 1024, 1024, 1024, 256]
    - [38, 12.72]
  - - [1024, 512, 1, 128, 1024, 1024, 1024, 512]
    - [112, 2.161]
  - - [1024, 512, 1, 256, 1024, 1024, 1024, 512]
    - [24, 3.814]
  - - [1024, 512, 1, 512, 1024, 1024, 1024, 512]
    - [41, 6.133]
  - - [1024, 512, 1, 1024, 1024, 1024, 1024, 512]
    - [45, 8.553]
  - - [1024, 512, 1, 2048, 1024, 1024, 1024, 512]
    - [39, 10.614]
  - - [1024, 512, 1, 4096, 1024, 1024, 1024, 512]
    - [38, 13.508]
  - - [1024, 512, 1, 8192, 1024, 1024, 1024, 512]
    - [35, 16.658]
  - - [1024, 1024, 1, 128, 1024, 1024, 1024, 1024]
    - [104, 3.626]
  - - [1024, 1024, 1, 256, 1024, 1024, 1024, 1024]
    - [105, 6.357]
  - - [1024, 1024, 1, 512, 1024, 1024, 1024, 1024]
    - [104, 9.854]
  - - [1024, 1024, 1, 1024, 1024, 1024, 1024, 1024]
    - [40, 12.633]
  - - [1024, 1024, 1, 2048, 1024, 1024, 1024, 1024]
    - [39, 14.538]
  - - [1024, 1024, 1, 4096, 1024, 1024, 1024, 1024]
    - [99, 17.689]
  - - [1024, 1024, 1, 8192, 1024, 1024, 1024, 1024]
    - [33, 22.35]
  - - [1024, 2048, 1, 128, 1024, 1024, 1024, 2048]
    - [72, 5.62]
  - - [1024, 2048, 1, 256, 1024, 1024, 1024, 2048]
    - [73, 8.991]
  - - [1024, 2048, 1, 512, 1024, 1024, 1024, 2048]
    - [102, 13.286]
  - - [1024, 2048, 1, 1024, 1024, 1024, 1024, 2048]
    - [37, 16.176]
  - - [1024, 2048, 1, 2048, 1024, 1024, 1024, 2048]
    - [31, 18.635]
  - - [1024, 2048, 1, 4096, 1024, 1024, 1024, 2048]
    - [32, 23.131]
  - - [1024, 2048, 1, 8192, 1024, 1024, 1024, 2048]
    - [62, 23.875]
  - - [1024, 4096, 1, 128, 1024, 1024, 1024, 4096]
    - [67, 7.574]
  - - [1024, 4096, 1, 256, 1024, 1024, 1024, 4096]
    - [66, 11.748]
  - - [1024, 4096, 1, 512, 1024, 1024, 1024, 4096]
    - [21, 16.663]
  - - [1024, 4096, 1, 1024, 1024, 1024, 1024, 4096]
    - [21, 21.219]
  - - [1024, 4096, 1, 2048, 1024, 1024, 1024, 4096]
    - [20, 24.468]
  - - [1024, 4096, 1, 4096, 1024, 1024, 1024, 4096]
    - [119, 27.586]
  - - [1024, 4096, 1, 8192, 1024, 1024, 1024, 4096]
    - [92, 26.171]
  - - [1024, 8192, 1, 128, 1024, 1024, 1024, 8192]
    - [94, 7.651]
  - - [1024, 8192, 1, 256, 1024, 1024, 1024, 8192]
    - [93, 12.483]
  - - [1024, 8192, 1, 512, 1024, 1024, 1024, 8192]
    - [89, 18.056]
  - - [1024, 8192, 1, 1024, 1024, 1024, 1024, 8192]
    - [2, 23.328]
  - - [1024, 8192, 1, 2048, 1024, 1024, 1024, 8192]
    - [87, 28.571]
  - - [1024, 8192, 1, 4096, 1024, 1024, 1024, 8192]
    - [84, 26.7]
  - - [1024, 8192, 1, 8192, 1024, 1024, 1024, 8192]
    - [55, 29.465]
  - - [2048, 128, 1, 128, 2048, 2048, 2048, 128]
    - [77, 1.204]
  - - [2048, 128, 1, 256, 2048, 2048, 2048, 128]
    - [27, 2.113]
  - - [2048, 128, 1, 512, 2048, 2048, 2048, 128]
    - [27, 3.43]
  - - [2048, 128, 1, 1024, 2048, 2048, 2048, 128]
    - [129, 5.013]
  - - [2048, 128, 1, 2048, 2048, 2048, 2048, 128]
    - [41, 6.846]
  - - [2048, 128, 1, 4096, 2048, 2048, 2048, 128]
    - [23, 9.092]
  - - [2048, 128, 1, 8192, 2048, 2048, 2048, 128]
    - [125, 11.651]
  - - [2048, 256, 1, 128, 2048, 2048, 2048, 256]
    - [24, 2.154]
  - - [2048, 256, 1, 256, 2048, 2048, 2048, 256]
    - [112, 3.773]
  - - [2048, 256, 1, 512, 2048, 2048, 2048, 256]
    - [41, 6.102]
  - - [2048, 256, 1, 1024, 2048, 2048, 2048, 256]
    - [25, 8.477]
  - - [2048, 256, 1, 2048, 2048, 2048, 2048, 256]
    - [38, 10.405]
  - - [2048, 256, 1, 4096, 2048, 2048, 2048, 256]
    - [103, 12.875]
  - - [2048, 256, 1, 8192, 2048, 2048, 2048, 256]
    - [123, 16.229]
  - - [2048, 512, 1, 128, 2048, 2048, 2048, 512]
    - [104, 3.641]
  - - [2048, 512, 1, 256, 2048, 2048, 2048, 512]
    - [23, 6.272]
  - - [2048, 512, 1, 512, 2048, 2048, 2048, 512]
    - [104, 9.897]
  - - [2048, 512, 1, 1024, 2048, 2048, 2048, 512]
    - [106, 12.657]
  - - [2048, 512, 1, 2048, 2048, 2048, 2048, 512]
    - [34, 14.019]
  - - [2048, 512, 1, 4096, 2048, 2048, 2048, 512]
    - [101, 18.227]
  - - [2048, 512, 1, 8192, 2048, 2048, 2048, 512]
    - [117, 22.296]
  - - [2048, 1024, 1, 128, 2048, 2048, 2048, 1024]
    - [6, 5.577]
  - - [2048, 1024, 1, 256, 2048, 2048, 2048, 1024]
    - [72, 9.002]
  - - [2048, 1024, 1, 512, 2048, 2048, 2048, 1024]
    - [102, 13.117]
  - - [2048, 1024, 1, 1024, 2048, 2048, 2048, 1024]
    - [123, 16.105]
  - - [2048, 1024, 1, 2048, 2048, 2048, 2048, 1024]
    - [117, 18.345]
  - - [2048, 1024, 1, 4096, 2048, 2048, 2048, 1024]
    - [28, 22.759]
  - - [2048, 1024, 1, 8192, 2048, 2048, 2048, 1024]
    - [91, 23.239]
  - - [2048, 2048, 1, 128, 2048, 2048, 2048, 2048]
    - [5, 7.353]
  - - [2048, 2048, 1, 256, 2048, 2048, 2048, 2048]
    - [5, 11.677]
  - - [2048, 2048, 1, 512, 2048, 2048, 2048, 2048]
    - [21, 16.586]
  - - [2048, 2048, 1, 1024, 2048, 2048, 2048, 2048]
    - [100, 20.472]
  - - [2048, 2048, 1, 2048, 2048, 2048, 2048, 2048]
    - [100, 24.149]
  - - [2048, 2048, 1, 4096, 2048, 2048, 2048, 2048]
    - [119, 28.848]
  - - [2048, 2048, 1, 8192, 2048, 2048, 2048, 2048]
    - [56, 25.78]
  - - [2048, 4096, 1, 128, 2048, 2048, 2048, 4096]
    - [13, 7.584]
  - - [2048, 4096, 1, 256, 2048, 2048, 2048, 4096]
    - [12, 12.471]
  - - [2048, 4096, 1, 512, 2048, 2048, 2048, 4096]
    - [17, 17.945]
  - - [2048, 4096, 1, 1024, 2048, 2048, 2048, 4096]
    - [18, 23.552]
  - - [2048, 4096, 1, 2048, 2048, 2048, 2048, 4096]
    - [90, 28.458]
  - - [2048, 4096, 1, 4096, 2048, 2048, 2048, 4096]
    - [55, 26.086]
  - - [2048, 4096, 1, 8192, 2048, 2048, 2048, 4096]
    - [85, 30.314]
  - - [2048, 8192, 1, 128, 2048, 2048, 2048, 8192]
    - [51, 8.25]
  - - [2048, 8192, 1, 256, 2048, 2048, 2048, 8192]
    - [50, 13.4]
  - - [2048, 8192, 1, 512, 2048, 2048, 2048, 8192]
    - [53, 19.864]
  - - [2048, 8192, 1, 1024, 2048, 2048, 2048, 8192]
    - [55, 26.685]
  - - [2048, 8192, 1, 2048, 2048, 2048, 2048, 8192]
    - [79, 29.515]
  - - [2048, 8192, 1, 4096, 2048, 2048, 2048, 8192]
    - [81, 28.862]
  - - [2048, 8192, 1, 8192, 2048, 2048, 2048, 8192]
    - [11, 30.92]
  - - [4096, 128, 1, 128, 4096, 4096, 4096, 128]
    - [110, 2.193]
  - - [4096, 128, 1, 256, 4096, 4096, 4096, 128]
    - [110, 3.852]
  - - [4096, 128, 1, 512, 4096, 4096, 4096, 128]
    - [43, 6.048]
  - - [4096, 128, 1, 1024, 4096, 4096, 4096, 128]
    - [126, 8.424]
  - - [4096, 128, 1, 2048, 4096, 4096, 4096, 128]
    - [23, 9.948]
  - - [4096, 128, 1, 4096, 4096, 4096, 4096, 128]
    - [103, 12.829]
  - - [4096, 128, 1, 8192, 4096, 4096, 4096, 128]
    - [123, 16.019]
  - - [4096, 256, 1, 128, 4096, 4096, 4096, 256]
    - [75, 3.593]
  - - [4096, 256, 1, 256, 4096, 4096, 4096, 256]
    - [107, 6.287]
  - - [4096, 256, 1, 512, 4096, 4096, 4096, 256]
    - [108, 9.846]
  - - [4096, 256, 1, 1024, 4096, 4096, 4096, 256]
    - [108, 12.789]
  - - [4096, 256, 1, 2048, 4096, 4096, 4096, 256]
    - [118, 13.873]
  - - [4096, 256, 1, 4096, 4096, 4096, 4096, 256]
    - [100, 17.837]
  - - [4096, 256, 1, 8192, 4096, 4096, 4096, 256]
    - [119, 22.498]
  - - [4096, 512, 1, 128, 4096, 4096, 4096, 512]
    - [71, 5.66]
  - - [4096, 512, 1, 256, 4096, 4096, 4096, 512]
    - [72, 9.054]
  - - [4096, 512, 1, 512, 4096, 4096, 4096, 512]
    - [103, 13.315]
  - - [4096, 512, 1, 1024, 4096, 4096, 4096, 512]
    - [118, 16.416]
  - - [4096, 512, 1, 2048, 4096, 4096, 4096, 512]
    - [123, 18.715]
  - - [4096, 512, 1, 4096, 4096, 4096, 4096, 512]
    - [29, 22.973]
  - - [4096, 512, 1, 8192, 4096, 4096, 4096, 512]
    - [61, 23.508]
  - - [4096, 1024, 1, 128, 4096, 4096, 4096, 1024]
    - [69, 7.258]
  - - [4096, 1024, 1, 256, 4096, 4096, 4096, 1024]
    - [70, 11.697]
  - - [4096, 1024, 1, 512, 4096, 4096, 4096, 1024]
    - [100, 16.566]
  - - [4096, 1024, 1, 1024, 4096, 4096, 4096, 1024]
    - [120, 20.097]
  - - [4096, 1024, 1, 2048, 4096, 4096, 4096, 1024]
    - [118, 23.987]
  - - [4096, 1024, 1, 4096, 4096, 4096, 4096, 1024]
    - [118, 27.494]
  - - [4096, 1024, 1, 8192, 4096, 4096, 4096, 1024]
    - [0, 25.862]
  - - [4096, 2048, 1, 128, 4096, 4096, 4096, 2048]
    - [17, 7.584]
  - - [4096, 2048, 1, 256, 4096, 4096, 4096, 2048]
    - [96, 12.326]
  - - [4096, 2048, 1, 512, 4096, 4096, 4096, 2048]
    - [16, 18.092]
  - - [4096, 2048, 1, 1024, 4096, 4096, 4096, 2048]
    - [95, 23.243]
  - - [4096, 2048, 1, 2048, 4096, 4096, 4096, 2048]
    - [96, 28.288]
  - - [4096, 2048, 1, 4096, 4096, 4096, 4096, 2048]
    - [85, 26.069]
  - - [4096, 2048, 1, 8192, 4096, 4096, 4096, 2048]
    - [54, 29.892]
  - - [4096, 4096, 1, 128, 4096, 4096, 4096, 4096]
    - [52, 8.236]
  - - [4096, 4096, 1, 256, 4096, 4096, 4096, 4096]
    - [82, 13.237]
  - - [4096, 4096, 1, 512, 4096, 4096, 4096, 4096]
    - [49, 19.628]
  - - [4096, 4096, 1, 1024, 4096, 4096, 4096, 4096]
    - [80, 26.157]
  - - [4096, 4096, 1, 2048, 4096, 4096, 4096, 4096]
    - [86, 29.203]
  - - [4096, 4096, 1, 4096, 4096, 4096, 4096, 4096]
    - [79, 29.518]
  - - [4096, 4096, 1, 8192, 4096, 4096, 4096, 4096]
    - [81, 32.088]
  - - [4096, 8192, 1, 128, 4096, 4096, 4096, 8192]
    - [83, 8.061]
  - - [4096, 8192, 1, 256, 4096, 4096, 4096, 8192]
    - [88, 12.392]
  - - [4096, 8192, 1, 512, 4096, 4096, 4096, 8192]
    - [79, 16.721]
  - - [4096, 8192, 1, 1024, 4096, 4096, 4096, 8192]
    - [51, 22.104]
  - - [4096, 8192, 1, 2048, 4096, 4096, 4096, 8192]
    - [82, 27.123]
  - - [4096, 8192, 1, 4096, 4096, 4096, 4096, 8192]
    - [81, 30.635]
  - - [4096, 8192, 1, 8192, 4096, 4096, 4096, 8192]
    - [50, 34.227]
  - - [8192, 128, 1, 128, 8192, 8192, 8192, 128]
    - [107, 3.583]
  - - [8192, 128, 1, 256, 8192, 8192, 8192, 128]
    - [109, 6.309]
  - - [8192, 128, 1, 512, 8192, 8192, 8192, 128]
    - [108, 9.76]
  - - [8192, 128, 1, 1024, 8192, 8192, 8192, 128]
    - [106, 12.656]
  - - [8192, 128, 1, 2048, 8192, 8192, 8192, 128]
    - [38, 13.466]
  - - [8192, 128, 1, 4096, 8192, 8192, 8192, 128]
    - [99, 16.508]
  - - [8192, 128, 1, 8192, 8192, 8192, 8192, 128]
    - [32, 20.518]
  - - [8192, 256, 1, 128, 8192, 8192, 8192, 256]
    - [71, 5.603]
  - - [8192, 256, 1, 256, 8192, 8192, 8192, 256]
    - [74, 8.873]
  - - [8192, 256, 1, 512, 8192, 8192, 8192, 256]
    - [103, 13.033]
  - - [8192, 256, 1, 1024, 8192, 8192, 8192, 256]
    - [118, 16.22]
  - - [8192, 256, 1, 2048, 8192, 8192, 8192, 256]
    - [122, 18.175]
  - - [8192, 256, 1, 4096, 8192, 8192, 8192, 256]
    - [117, 22.586]
  - - [8192, 256, 1, 8192, 8192, 8192, 8192, 256]
    - [1, 24.452]
  - - [8192, 512, 1, 128, 8192, 8192, 8192, 512]
    - [65, 7.218]
  - - [8192, 512, 1, 256, 8192, 8192, 8192, 512]
    - [68, 11.49]
  - - [8192, 512, 1, 512, 8192, 8192, 8192, 512]
    - [99, 16.324]
  - - [8192, 512, 1, 1024, 8192, 8192, 8192, 512]
    - [100, 19.768]
  - - [8192, 512, 1, 2048, 8192, 8192, 8192, 512]
    - [100, 24.177]
  - - [8192, 512, 1, 4096, 8192, 8192, 8192, 512]
    - [117, 27.755]
  - - [8192, 512, 1, 8192, 8192, 8192, 8192, 512]
    - [1, 27.094]
  - - [8192, 1024, 1, 128, 8192, 8192, 8192, 1024]
    - [14, 7.61]
  - - [8192, 1024, 1, 256, 8192, 8192, 8192, 1024]
    - [14, 12.425]
  - - [8192, 1024, 1, 512, 8192, 8192, 8192, 1024]
    - [60, 17.693]
  - - [8192, 1024, 1, 1024, 8192, 8192, 8192, 1024]
    - [57, 23.326]
  - - [8192, 1024, 1, 2048, 8192, 8192, 8192, 1024]
    - [95, 28.336]
  - - [8192, 1024, 1, 4096, 8192, 8192, 8192, 1024]
    - [55, 26.761]
  - - [8192, 1024, 1, 8192, 8192, 8192, 8192, 1024]
    - [55, 29.277]
  - - [8192, 2048, 1, 128, 8192, 8192, 8192, 2048]
    - [15, 8.288]
  - - [8192, 2048, 1, 256, 8192, 8192, 8192, 2048]
    - [53, 13.216]
  - - [8192, 2048, 1, 512, 8192, 8192, 8192, 2048]
    - [86, 19.597]
  - - [8192, 2048, 1, 1024, 8192, 8192, 8192, 2048]
    - [86, 26.295]
  - - [8192, 2048, 1, 2048, 8192, 8192, 8192, 2048]
    - [85, 29.669]
  - - [8192, 2048, 1, 4096, 8192, 8192, 8192, 2048]
    - [82, 28.935]
  - - [8192, 2048, 1, 8192, 8192, 8192, 8192, 2048]
    - [51, 32.455]
  - - [8192, 4096, 1, 128, 8192, 8192, 8192, 4096]
    - [19, 8.301]
  - - [8192, 4096, 1, 256, 8192, 8192, 8192, 4096]
    - [28, 12.724]
  - - [8192, 4096, 1, 512, 8192, 8192, 8192, 4096]
    - [100, 16.653]
  - - [8192, 4096, 1, 1024, 8192, 8192, 8192, 4096]
    - [51, 22.551]
  - - [8192, 4096, 1, 2048, 8192, 8192, 8192, 4096]
    - [79, 27.438]
  - - [8192, 4096, 1, 4096, 8192, 8192, 8192, 4096]
    - [79, 31.378]
  - - [8192, 4096, 1, 8192, 8192, 8192, 8192, 4096]
    - [51, 34.118]
  - - [8192, 8192, 1, 128, 8192, 8192, 8192, 8192]
    - [4, 7.13]
  - - [8192, 8192, 1, 256, 8192, 8192, 8192, 8192]
    - [79, 11.549]
  - - [8192, 8192, 1, 512, 8192, 8192, 8192, 8192]
    - [59, 17.058]
  - - [8192, 8192, 1, 1024, 8192, 8192, 8192, 8192]
    - [58, 23.906]
  - - [8192, 8192, 1, 2048, 8192, 8192, 8192, 8192]
    - [82, 30.022]
  - - [8192, 8192, 1, 4096, 8192, 8192, 8192, 8192]
    - [82, 33.501]
  - - [8192, 8192, 1, 8192, 8192, 8192, 8192, 8192]
    - [54, 34.966]
  - - [1, 1, 1, 32, 1, 1, 1, 1]
    - [130, 0.0]
- null
- null
- ExperimentalStreamK
- GridBased
