library/src/amd_detail/rocblaslt/src/Tensile/Logic/asm_full/aquavanjaram/gfx942/StreamK/aquavanjaram942_Cijk_Ailk_Bljk_BSS_BH_UserArgs.yaml
- {MinimumRequiredVersion: 4.33.0}
- aquavanjaram942
- gfx942
- [Device 0049, Device 0050]
    SolutionIndex: 0
    SolutionNameMin: Cijk_Ailk_Bljk_BSS_BH_UserArgs_MT256x256x32_MI16x16x1_SN_LDSB1_CLR1_GSU0_GSUC0_GSUWGMRR0_K1_LBSPPA2048_LBSPPB256_LPA0_MIWT8_8_PLR1_SU32_SUM0_SUS256_SKXCCM0_VWA4_VWB4_WGM4_WGMXCC1_WGMXCCGn1
    SolutionIndex: 1
    SolutionNameMin: Cijk_Ailk_Bljk_BSS_BH_UserArgs_MT256x256x32_MI16x16x1_SN_LDSB1_CLR1_GSU0_GSUC0_GSUWGMRR0_K1_LBSPPA2048_LBSPPB512_LPA32_MIWT8_8_PLR1_SU32_SUM0_SUS256_SKXCCM0_VWA2_VWB8_WGM4_WGMXCC1_WGMXCCGn1
    SolutionIndex: 2
    SolutionNameMin: Cijk_Ailk_Bljk_BSS_BH_UserArgs_MT256x256x32_MI16x16x1_SN_LDSB1_CLR1_GSU0_GSUC0_GSUWGMRR0_K1_LBSPPA2048_LBSPPB512_LPA0_MIWT8_8_PLR1_SU32_SUM0_SUS256_SKXCCM0_VWA4_VWB8_WGM4_WGMXCC1_WGMXCCGn1
    SolutionIndex: 3
    SolutionNameMin: Cijk_Ailk_Bljk_BSS_BH_UserArgs_MT256x256x32_MI16x16x1_SN_LDSB1_CLR1_GSU0_GSUC0_GSUWGMRR0_K1_LBSPPA2048_LBSPPB256_LPA0_MIWT8_8_PLR1_SU32_SUM0_SUS256_SKXCCM0_VWA4_VWB4_WGM8_WGMXCC1_WGMXCCGn1
    SolutionIndex: 4
    SolutionNameMin: Cijk_Ailk_Bljk_BSS_BH_UserArgs_MT128x128x32_MI16x16x1_SN_LDSB1_CLR1_GSU0_GSUC0_GSUWGMRR0_K1_LBSPPA1024_LBSPPB256_LPA0_MIWT4_4_PLR1_SU32_SUM0_SUS256_SKXCCM0_VWA4_VWB4_WGM8_WGMXCC1_WGMXCCGn1
    SolutionIndex: 5
    SolutionNameMin: Cijk_Ailk_Bljk_BSS_BH_UserArgs_MT128x256x64_MI16x16x1_SN_LDSB1_CLR1_GSU0_GSUC0_GSUWGMRR0_K1_LBSPPA2048_LBSPPB128_LPA0_MIWT4_8_PLR1_SU32_SUM0_SUS256_SKXCCM0_VWA4_VWB1_WGM1_WGMXCC1_WGMXCCGn1
    SolutionIndex: 6
    SolutionNameMin: Cijk_Ailk_Bljk_BSS_BH_UserArgs_MT128x256x64_MI16x16x1_SN_LDSB1_CLR1_GSU0_GSUC0_GSUWGMRR0_K1_LBSPPA2048_LBSPPB1024_LPA0_MIWT4_8_PLR1_SU32_SUM0_SUS256_SKXCCM0_VWA4_VWB8_WGM1_WGMXCC1_WGMXCCGn1
    SolutionIndex: 7
    SolutionNameMin: Cijk_Ailk_Bljk_BSS_BH_UserArgs_MT128x256x64_MI16x16x1_SN_LDSB1_CLR1_GSU0_GSUC0_GSUWGMRR0_K1_LBSPPA2048_LBSPPB128_LPA32_MIWT4_8_PLR1_SU32_SUM0_SUS256_SKXCCM0_VWA2_VWB1_WGM4_WGMXCC1_WGMXCCGn1
    SolutionIndex: 8
    SolutionNameMin: Cijk_Ailk_Bljk_BSS_BH_UserArgs_MT128x256x64_MI16x16x1_SN_LDSB1_CLR1_GSU0_GSUC0_GSUWGMRR0_K1_LBSPPA2048_LBSPPB128_LPA0_MIWT4_8_PLR1_SU32_SUM0_SUS256_SKXCCM0_VWA4_VWB1_WGM4_WGMXCC1_WGMXCCGn1
    SolutionIndex: 9
    SolutionNameMin: Cijk_Ailk_Bljk_BSS_BH_UserArgs_MT128x256x64_MI16x16x1_SN_LDSB1_CLR1_GSU0_GSUC0_GSUWGMRR0_K1_LBSPPA2048_LBSPPB256_LPA32_MIWT4_8_PLR1_SU32_SUM0_SUS256_SKXCCM0_VWA2_VWB2_WGM4_WGMXCC1_WGMXCCGn1
    SolutionIndex: 10
    SolutionNameMin: Cijk_Ailk_Bljk_BSS_BH_UserArgs_MT128x256x64_MI16x16x1_SN_LDSB1_CLR1_GSU0_GSUC0_GSUWGMRR0_K1_LBSPPA2048_LBSPPB1024_LPA0_MIWT4_8_PLR1_SU32_SUM0_SUS256_SKXCCM0_VWA4_VWB8_WGM4_WGMXCC1_WGMXCCGn1
    SolutionIndex: 11
    SolutionNameMin: Cijk_Ailk_Bljk_BSS_BH_UserArgs_MT128x256x64_MI16x16x1_SN_LDSB1_CLR1_GSU0_GSUC0_GSUWGMRR0_K1_LBSPPA2048_LBSPPB1024_LPA0_MIWT4_8_PLR1_SU32_SUM0_SUS256_SKXCCM0_VWA4_VWB8_WGM8_WGMXCC1_WGMXCCGn1
    SolutionIndex: 12
    SolutionNameMin: Cijk_Ailk_Bljk_BSS_BH_UserArgs_MT256x128x64_MI16x16x1_SN_LDSB1_CLR1_GSU0_GSUC0_GSUWGMRR0_K1_LBSPPA4096_LBSPPB256_LPA0_MIWT8_4_PLR1_SU32_SUM0_SUS256_SKXCCM0_VWA4_VWB2_WGM1_WGMXCC1_WGMXCCGn1
    SolutionIndex: 13
    SolutionNameMin: Cijk_Ailk_Bljk_BSS_BH_UserArgs_MT256x128x64_MI16x16x1_SN_LDSB1_CLR1_GSU0_GSUC0_GSUWGMRR0_K1_LBSPPA4096_LBSPPB512_LPA0_MIWT8_4_PLR1_SU32_SUM0_SUS256_SKXCCM0_VWA4_VWB4_WGM1_WGMXCC1_WGMXCCGn1
    SolutionIndex: 14
    SolutionNameMin: Cijk_Ailk_Bljk_BSS_BH_UserArgs_MT256x128x64_MI16x16x1_SN_LDSB1_CLR1_GSU0_GSUC0_GSUWGMRR0_K1_LBSPPA4096_LBSPPB256_LPA0_MIWT8_4_PLR1_SU32_SUM0_SUS256_SKXCCM0_VWA4_VWB2_WGM4_WGMXCC1_WGMXCCGn1
    SolutionIndex: 15
    SolutionNameMin: Cijk_Ailk_Bljk_BSS_BH_UserArgs_MT256x128x64_MI16x16x1_SN_LDSB1_CLR1_GSU0_GSUC0_GSUWGMRR0_K1_LBSPPA4096_LBSPPB512_LPA0_MIWT8_4_PLR1_SU32_SUM0_SUS256_SKXCCM0_VWA4_VWB4_WGM4_WGMXCC1_WGMXCCGn1
    SolutionIndex: 16
    SolutionNameMin: Cijk_Ailk_Bljk_BSS_BH_UserArgs_MT256x128x64_MI16x16x1_SN_LDSB1_CLR1_GSU0_GSUC0_GSUWGMRR0_K1_LBSPPA4096_LBSPPB512_LPA0_MIWT8_4_PLR1_SU32_SUM0_SUS256_SKXCCM0_VWA4_VWB4_WGM8_WGMXCC1_WGMXCCGn1
    SolutionIndex: 17
    SolutionNameMin: Cijk_Ailk_Bljk_BSS_BH_UserArgs_MT128x128x64_MI16x16x1_SN_LDSB1_CLR1_GSU0_GSUC0_GSUWGMRR0_K1_LBSPPA2048_LBSPPB128_LPA0_MIWT4_4_PLR1_SU32_SUM0_SUS256_SKXCCM0_VWA4_VWB1_WGM1_WGMXCC1_WGMXCCGn1
    SolutionIndex: 18
    SolutionNameMin: Cijk_Ailk_Bljk_BSS_BH_UserArgs_MT128x128x64_MI16x16x1_SN_LDSB1_CLR1_GSU0_GSUC0_GSUWGMRR0_K1_LBSPPA2048_LBSPPB256_LPA0_MIWT4_4_PLR1_SU32_SUM0_SUS256_SKXCCM0_VWA4_VWB2_WGM1_WGMXCC1_WGMXCCGn1
    SolutionIndex: 19
    SolutionNameMin: Cijk_Ailk_Bljk_BSS_BH_UserArgs_MT128x128x64_MI16x16x1_SN_LDSB1_CLR1_GSU0_GSUC0_GSUWGMRR0_K1_LBSPPA2048_LBSPPB512_LPA0_MIWT4_4_PLR1_SU32_SUM0_SUS256_SKXCCM0_VWA4_VWB4_WGM1_WGMXCC1_WGMXCCGn1
    SolutionIndex: 20
    SolutionNameMin: Cijk_Ailk_Bljk_BSS_BH_UserArgs_MT128x128x64_MI16x16x1_SN_LDSB1_CLR1_GSU0_GSUC0_GSUWGMRR0_K1_LBSPPA2048_LBSPPB128_LPA0_MIWT4_4_PLR1_SU32_SUM0_SUS256_SKXCCM0_VWA4_VWB1_WGM4_WGMXCC1_WGMXCCGn1
    SolutionIndex: 21
    SolutionNameMin: Cijk_Ailk_Bljk_BSS_BH_UserArgs_MT128x128x64_MI16x16x1_SN_LDSB1_CLR1_GSU0_GSUC0_GSUWGMRR0_K1_LBSPPA2048_LBSPPB512_LPA0_MIWT4_4_PLR1_SU32_SUM0_SUS256_SKXCCM0_VWA4_VWB4_WGM4_WGMXCC1_WGMXCCGn1
    SolutionIndex: 22
    SolutionNameMin: Cijk_Ailk_Bljk_BSS_BH_UserArgs_MT128x128x64_MI16x16x1_SN_LDSB1_CLR1_GSU0_GSUC0_GSUWGMRR0_K1_LBSPPA2048_LBSPPB256_LPA0_MIWT4_4_PLR1_SU32_SUM0_SUS256_SKXCCM0_VWA4_VWB2_WGM8_WGMXCC1_WGMXCCGn1
    SolutionIndex: 23
    SolutionNameMin: Cijk_Ailk_Bljk_BSS_BH_UserArgs_MT64x64x64_MI16x16x1_SN_LDSB1_CLR1_GSU0_GSUC0_GSUWGMRR0_K1_LBSPPA1024_LBSPPB256_LPA32_MIWT2_2_PLR1_SU32_SUM0_SUS256_SKXCCM0_VWA2_VWB2_WGM1_WGMXCC1_WGMXCCGn1
    SolutionIndex: 24
    SolutionNameMin: Cijk_Ailk_Bljk_BSS_BH_UserArgs_MT64x64x64_MI16x16x1_SN_LDSB1_CLR1_GSU0_GSUC0_GSUWGMRR0_K1_LBSPPA1024_LBSPPB128_LPA32_MIWT2_2_PLR1_SU32_SUM0_SUS256_SKXCCM0_VWA2_VWB1_WGM4_WGMXCC1_WGMXCCGn1
    SolutionIndex: 25
    SolutionNameMin: Cijk_Ailk_Bljk_BSS_BH_UserArgs_MT64x64x64_MI16x16x1_SN_LDSB1_CLR1_GSU0_GSUC0_GSUWGMRR0_K1_LBSPPA1024_LBSPPB256_LPA32_MIWT2_2_PLR1_SU32_SUM0_SUS256_SKXCCM0_VWA2_VWB2_WGM4_WGMXCC1_WGMXCCGn1
    SolutionIndex: 26
    SolutionNameMin: Cijk_Ailk_Bljk_BSS_BH_UserArgs_MT32x32x64_MI16x16x1_SN_LDSB0_CLR1_GSU0_GSUC0_GSUWGMRR0_K1_LBSPPA512_LBSPPB128_LPA16_MIWT1_1_PLR1_SU32_SUM0_SUS256_SKXCCM0_VWA1_VWB1_WGM1_WGMXCC1_WGMXCCGn1
    SolutionIndex: 27
    SolutionNameMin: Cijk_Ailk_Bljk_BSS_BH_UserArgs_MT64x128x128_MI16x16x1_SN_LDSB1_CLR1_GSU0_GSUC0_GSUWGMRR0_K1_LBSPPA1024_LBSPPB256_LPA32_MIWT2_4_PLR2_SU32_SUM0_SUS256_SKXCCM0_VWA2_VWB1_WGM1_WGMXCC1_WGMXCCGn1
    SolutionIndex: 28
    SolutionNameMin: Cijk_Ailk_Bljk_BSS_BH_UserArgs_MT64x128x128_MI16x16x1_SN_LDSB1_CLR1_GSU0_GSUC0_GSUWGMRR0_K1_LBSPPA1024_LBSPPB1024_LPA32_MIWT2_4_PLR2_SU32_SUM0_SUS256_SKXCCM0_VWA2_VWB4_WGM4_WGMXCC1_WGMXCCGn1
    SolutionIndex: 29
    SolutionNameMin: Cijk_Ailk_Bljk_BSS_BH_UserArgs_MT128x64x128_MI16x16x1_SN_LDSB1_CLR1_GSU0_GSUC0_GSUWGMRR0_K1_LBSPPA2048_LBSPPB256_LPA0_MIWT4_2_PLR1_SU32_SUM0_SUS256_SKXCCM0_VWA4_VWB1_WGM1_WGMXCC1_WGMXCCGn1
    SolutionIndex: 30
    SolutionNameMin: Cijk_Ailk_Bljk_BSS_BH_UserArgs_MT128x64x128_MI16x16x1_SN_LDSB1_CLR1_GSU0_GSUC0_GSUWGMRR0_K1_LBSPPA2048_LBSPPB512_LPA0_MIWT4_2_PLR1_SU32_SUM0_SUS256_SKXCCM0_VWA4_VWB2_WGM1_WGMXCC1_WGMXCCGn1
    SolutionIndex: 31
    SolutionNameMin: Cijk_Ailk_Bljk_BSS_BH_UserArgs_MT128x64x128_MI16x16x1_SN_LDSB1_CLR1_GSU0_GSUC0_GSUWGMRR0_K1_LBSPPA2048_LBSPPB512_LPA0_MIWT4_2_PLR2_SU32_SUM0_SUS256_SKXCCM0_VWA4_VWB2_WGM1_WGMXCC1_WGMXCCGn1
    SolutionIndex: 32
    SolutionNameMin: Cijk_Ailk_Bljk_BSS_BH_UserArgs_MT64x64x128_MI16x16x1_SN_LDSB1_CLR1_GSU0_GSUC0_GSUWGMRR0_K1_LBSPPA1024_LBSPPB256_LPA32_MIWT2_2_PLR2_SU32_SUM0_SUS256_SKXCCM0_VWA2_VWB1_WGM1_WGMXCC1_WGMXCCGn1
    SolutionIndex: 33
    SolutionNameMin: Cijk_Ailk_Bljk_BSS_BH_UserArgs_MT64x64x128_MI16x16x1_SN_LDSB1_CLR1_GSU0_GSUC0_GSUWGMRR0_K1_LBSPPA1024_LBSPPB512_LPA32_MIWT2_2_PLR2_SU32_SUM0_SUS256_SKXCCM0_VWA2_VWB2_WGM1_WGMXCC1_WGMXCCGn1
    SolutionIndex: 34
    SolutionNameMin: Cijk_Ailk_Bljk_BSS_BH_UserArgs_MT64x64x128_MI16x16x1_SN_LDSB1_CLR1_GSU0_GSUC0_GSUWGMRR0_K1_LBSPPA1024_LBSPPB256_LPA32_MIWT2_2_PLR2_SU32_SUM0_SUS256_SKXCCM0_VWA2_VWB1_WGM4_WGMXCC1_WGMXCCGn1
    SolutionIndex: 35
    SolutionNameMin: Cijk_Ailk_Bljk_BSS_BH_UserArgs_MT64x64x128_MI16x16x1_SN_LDSB1_CLR1_GSU0_GSUC0_GSUWGMRR0_K1_LBSPPA1024_LBSPPB512_LPA32_MIWT2_2_PLR2_SU32_SUM0_SUS256_SKXCCM0_VWA2_VWB2_WGM4_WGMXCC1_WGMXCCGn1
    SolutionIndex: 36
    SolutionNameMin: Cijk_Ailk_Bljk_BSS_BH_UserArgs_MT64x64x128_MI16x16x1_SN_LDSB1_CLR1_GSU0_GSUC0_GSUWGMRR0_K1_LBSPPA1024_LBSPPB256_LPA32_MIWT2_2_PLR2_SU32_SUM0_SUS256_SKXCCM0_VWA2_VWB1_WGM8_WGMXCC1_WGMXCCGn1
    SolutionIndex: 37
    SolutionNameMin: Cijk_Ailk_Bljk_BSS_BH_UserArgs_MT32x64x128_MI16x16x1_SN_LDSB1_CLR1_GSU0_GSUC0_GSUWGMRR0_K1_LBSPPA512_LBSPPB256_LPA16_MIWT1_2_PLR2_SU32_SUM0_SUS256_SKXCCM0_VWA1_VWB1_WGM1_WGMXCC1_WGMXCCGn1
    SolutionIndex: 38
    SolutionNameMin: Cijk_Ailk_Bljk_BSS_BH_UserArgs_MT32x64x128_MI16x16x1_SN_LDSB1_CLR1_GSU0_GSUC0_GSUWGMRR0_K1_LBSPPA512_LBSPPB256_LPA16_MIWT1_2_PLR2_SU32_SUM0_SUS256_SKXCCM0_VWA1_VWB1_WGM4_WGMXCC1_WGMXCCGn1
    SolutionIndex: 39
    SolutionNameMin: Cijk_Ailk_Bljk_BSS_BH_UserArgs_MT64x32x128_MI16x16x1_SN_LDSB1_CLR1_GSU0_GSUC0_GSUWGMRR0_K1_LBSPPA1024_LBSPPB256_LPA32_MIWT2_1_PLR2_SU32_SUM0_SUS256_SKXCCM0_VWA2_VWB1_WGM1_WGMXCC1_WGMXCCGn1
    SolutionIndex: 40
    SolutionNameMin: Cijk_Ailk_Bljk_BSS_BH_UserArgs_MT64x32x128_MI16x16x1_SN_LDSB1_CLR1_GSU0_GSUC0_GSUWGMRR0_K1_LBSPPA1024_LBSPPB256_LPA32_MIWT2_1_PLR2_SU32_SUM0_SUS256_SKXCCM0_VWA2_VWB1_WGM4_WGMXCC1_WGMXCCGn1
    SolutionIndex: 41
    SolutionNameMin: Cijk_Ailk_Bljk_BSS_BH_UserArgs_MT32x32x128_MI16x16x1_SN_LDSB1_CLR1_GSU0_GSUC0_GSUWGMRR0_K1_LBSPPA512_LBSPPB256_LPA16_MIWT1_1_PLR1_SU32_SUM0_SUS256_SKXCCM0_VWA1_VWB1_WGM1_WGMXCC1_WGMXCCGn1
    SolutionIndex: 42
    SolutionNameMin: Cijk_Ailk_Bljk_BSS_BH_UserArgs_MT32x32x128_MI16x16x1_SN_LDSB1_CLR1_GSU0_GSUC0_GSUWGMRR0_K1_LBSPPA512_LBSPPB256_LPA16_MIWT1_1_PLR2_SU32_SUM0_SUS256_SKXCCM0_VWA1_VWB1_WGM1_WGMXCC1_WGMXCCGn1
    SolutionIndex: 43
    SolutionNameMin: Cijk_Ailk_Bljk_BSS_BH_UserArgs_MT256x256x32_MI16x16x1_SN_LDSB1_CLR1_GSU0_GSUC0_GSUWGMRR0_K1_LBSPPA2048_LBSPPB128_LPA0_MIWT8_8_PLR1_SU32_SUM0_SUS256_SKXCCM8_VWA4_VWB1_WGM1_WGMXCC1_WGMXCCGn1
    SolutionIndex: 44
    SolutionNameMin: Cijk_Ailk_Bljk_BSS_BH_UserArgs_MT256x256x32_MI16x16x1_SN_LDSB1_CLR1_GSU0_GSUC0_GSUWGMRR0_K1_LBSPPA2048_LBSPPB128_LPA32_MIWT8_8_PLR1_SU32_SUM0_SUS256_SKXCCM8_VWA2_VWB2_WGM1_WGMXCC1_WGMXCCGn1
    SolutionIndex: 45
    SolutionNameMin: Cijk_Ailk_Bljk_BSS_BH_UserArgs_MT256x256x32_MI16x16x1_SN_LDSB1_CLR1_GSU0_GSUC0_GSUWGMRR0_K1_LBSPPA2048_LBSPPB256_LPA0_MIWT8_8_PLR1_SU32_SUM0_SUS256_SKXCCM8_VWA4_VWB4_WGM1_WGMXCC1_WGMXCCGn1
    SolutionIndex: 46
    SolutionNameMin: Cijk_Ailk_Bljk_BSS_BH_UserArgs_MT256x256x32_MI16x16x1_SN_LDSB1_CLR1_GSU0_GSUC0_GSUWGMRR0_K1_LBSPPA2048_LBSPPB512_LPA0_MIWT8_8_PLR1_SU32_SUM0_SUS256_SKXCCM8_VWA4_VWB8_WGM1_WGMXCC1_WGMXCCGn1
    SolutionIndex: 47
    SolutionNameMin: Cijk_Ailk_Bljk_BSS_BH_UserArgs_MT256x256x32_MI16x16x1_SN_LDSB1_CLR1_GSU0_GSUC0_GSUWGMRR0_K1_LBSPPA2048_LBSPPB128_LPA0_MIWT8_8_PLR1_SU32_SUM0_SUS256_SKXCCM8_VWA4_VWB1_WGM4_WGMXCC1_WGMXCCGn1
    SolutionIndex: 48
    SolutionNameMin: Cijk_Ailk_Bljk_BSS_BH_UserArgs_MT256x256x32_MI16x16x1_SN_LDSB1_CLR1_GSU0_GSUC0_GSUWGMRR0_K1_LBSPPA2048_LBSPPB128_LPA32_MIWT8_8_PLR1_SU32_SUM0_SUS256_SKXCCM8_VWA2_VWB2_WGM4_WGMXCC1_WGMXCCGn1
    SolutionIndex: 49
    SolutionNameMin: Cijk_Ailk_Bljk_BSS_BH_UserArgs_MT256x256x32_MI16x16x1_SN_LDSB1_CLR1_GSU0_GSUC0_GSUWGMRR0_K1_LBSPPA2048_LBSPPB128_LPA0_MIWT8_8_PLR1_SU32_SUM0_SUS256_SKXCCM8_VWA4_VWB2_WGM4_WGMXCC1_WGMXCCGn1
    SolutionIndex: 50
    SolutionNameMin: Cijk_Ailk_Bljk_BSS_BH_UserArgs_MT256x256x32_MI16x16x1_SN_LDSB1_CLR1_GSU0_GSUC0_GSUWGMRR0_K1_LBSPPA2048_LBSPPB256_LPA0_MIWT8_8_PLR1_SU32_SUM0_SUS256_SKXCCM8_VWA4_VWB4_WGM4_WGMXCC1_WGMXCCGn1
    SolutionIndex: 51
    SolutionNameMin: Cijk_Ailk_Bljk_BSS_BH_UserArgs_MT256x256x32_MI16x16x1_SN_LDSB1_CLR1_GSU0_GSUC0_GSUWGMRR0_K1_LBSPPA2048_LBSPPB512_LPA32_MIWT8_8_PLR1_SU32_SUM0_SUS256_SKXCCM8_VWA2_VWB8_WGM4_WGMXCC1_WGMXCCGn1
    SolutionIndex: 52
    SolutionNameMin: Cijk_Ailk_Bljk_BSS_BH_UserArgs_MT256x256x32_MI16x16x1_SN_LDSB1_CLR1_GSU0_GSUC0_GSUWGMRR0_K1_LBSPPA2048_LBSPPB512_LPA0_MIWT8_8_PLR1_SU32_SUM0_SUS256_SKXCCM8_VWA4_VWB8_WGM4_WGMXCC1_WGMXCCGn1
    SolutionIndex: 53
    SolutionNameMin: Cijk_Ailk_Bljk_BSS_BH_UserArgs_MT256x256x32_MI16x16x1_SN_LDSB1_CLR1_GSU0_GSUC0_GSUWGMRR0_K1_LBSPPA2048_LBSPPB128_LPA0_MIWT8_8_PLR1_SU32_SUM0_SUS256_SKXCCM8_VWA4_VWB2_WGM8_WGMXCC1_WGMXCCGn1
    SolutionIndex: 54
    SolutionNameMin: Cijk_Ailk_Bljk_BSS_BH_UserArgs_MT256x256x32_MI16x16x1_SN_LDSB1_CLR1_GSU0_GSUC0_GSUWGMRR0_K1_LBSPPA2048_LBSPPB256_LPA0_MIWT8_8_PLR1_SU32_SUM0_SUS256_SKXCCM8_VWA4_VWB4_WGM8_WGMXCC1_WGMXCCGn1
    SolutionIndex: 55
    SolutionNameMin: Cijk_Ailk_Bljk_BSS_BH_UserArgs_MT256x256x32_MI16x16x1_SN_LDSB1_CLR1_GSU0_GSUC0_GSUWGMRR0_K1_LBSPPA2048_LBSPPB512_LPA32_MIWT8_8_PLR1_SU32_SUM0_SUS256_SKXCCM8_VWA2_VWB8_WGM8_WGMXCC1_WGMXCCGn1
    SolutionIndex: 56
    SolutionNameMin: Cijk_Ailk_Bljk_BSS_BH_UserArgs_MT256x256x32_MI16x16x1_SN_LDSB1_CLR1_GSU0_GSUC0_GSUWGMRR0_K1_LBSPPA2048_LBSPPB512_LPA0_MIWT8_8_PLR1_SU32_SUM0_SUS256_SKXCCM8_VWA4_VWB8_WGM8_WGMXCC1_WGMXCCGn1
    SolutionIndex: 57
    SolutionNameMin: Cijk_Ailk_Bljk_BSS_BH_UserArgs_MT256x64x32_MI16x16x1_SN_LDSB1_CLR1_GSU0_GSUC0_GSUWGMRR0_K1_LBSPPA2048_LBSPPB128_LPA0_MIWT8_2_PLR1_SU32_SUM0_SUS256_SKXCCM8_VWA4_VWB1_WGM8_WGMXCC1_WGMXCCGn1
    SolutionIndex: 58
    SolutionNameMin: Cijk_Ailk_Bljk_BSS_BH_UserArgs_MT128x128x32_MI16x16x1_SN_LDSB1_CLR1_GSU0_GSUC0_GSUWGMRR0_K1_LBSPPA1024_LBSPPB128_LPA0_MIWT4_4_PLR1_SU32_SUM0_SUS256_SKXCCM8_VWA4_VWB1_WGM1_WGMXCC1_WGMXCCGn1
    SolutionIndex: 59
    SolutionNameMin: Cijk_Ailk_Bljk_BSS_BH_UserArgs_MT128x128x32_MI16x16x1_SN_LDSB1_CLR1_GSU0_GSUC0_GSUWGMRR0_K1_LBSPPA1024_LBSPPB256_LPA0_MIWT4_4_PLR1_SU32_SUM0_SUS256_SKXCCM8_VWA4_VWB4_WGM1_WGMXCC1_WGMXCCGn1
    SolutionIndex: 60
    SolutionNameMin: Cijk_Ailk_Bljk_BSS_BH_UserArgs_MT128x128x32_MI16x16x1_SN_LDSB1_CLR1_GSU0_GSUC0_GSUWGMRR0_K1_LBSPPA1024_LBSPPB128_LPA0_MIWT4_4_PLR1_SU32_SUM0_SUS256_SKXCCM8_VWA4_VWB2_WGM4_WGMXCC1_WGMXCCGn1
    SolutionIndex: 61
    SolutionNameMin: Cijk_Ailk_Bljk_BSS_BH_UserArgs_MT128x128x32_MI16x16x1_SN_LDSB1_CLR1_GSU0_GSUC0_GSUWGMRR0_K1_LBSPPA1024_LBSPPB256_LPA0_MIWT4_4_PLR1_SU32_SUM0_SUS256_SKXCCM8_VWA4_VWB4_WGM4_WGMXCC1_WGMXCCGn1
    SolutionIndex: 62
    SolutionNameMin: Cijk_Ailk_Bljk_BSS_BH_UserArgs_MT128x128x32_MI16x16x1_SN_LDSB1_CLR1_GSU0_GSUC0_GSUWGMRR0_K1_LBSPPA1024_LBSPPB128_LPA0_MIWT4_4_PLR1_SU32_SUM0_SUS256_SKXCCM8_VWA4_VWB2_WGM8_WGMXCC1_WGMXCCGn1
    SolutionIndex: 63
    SolutionNameMin: Cijk_Ailk_Bljk_BSS_BH_UserArgs_MT128x64x32_MI16x16x1_SN_LDSB0_CLR1_GSU0_GSUC0_GSUWGMRR0_K1_LBSPPA1024_LBSPPB128_LPA0_MIWT4_2_PLR1_SU32_SUM0_SUS256_SKXCCM8_VWA4_VWB1_WGM1_WGMXCC1_WGMXCCGn1
    SolutionIndex: 64
    SolutionNameMin: Cijk_Ailk_Bljk_BSS_BH_UserArgs_MT128x64x32_MI16x16x1_SN_LDSB0_CLR1_GSU0_GSUC0_GSUWGMRR0_K1_LBSPPA1024_LBSPPB128_LPA0_MIWT4_2_PLR1_SU32_SUM0_SUS256_SKXCCM8_VWA4_VWB2_WGM1_WGMXCC1_WGMXCCGn1
    SolutionIndex: 65
    SolutionNameMin: Cijk_Ailk_Bljk_BSS_BH_UserArgs_MT128x32x32_MI16x16x1_SN_LDSB0_CLR1_GSU0_GSUC0_GSUWGMRR0_K1_LBSPPA1024_LBSPPB128_LPA0_MIWT4_1_PLR1_SU32_SUM0_SUS256_SKXCCM8_VWA4_VWB1_WGM1_WGMXCC1_WGMXCCGn1
    SolutionIndex: 66
    SolutionNameMin: Cijk_Ailk_Bljk_BSS_BH_UserArgs_MT64x64x32_MI16x16x1_SN_LDSB0_CLR1_GSU0_GSUC0_GSUWGMRR0_K1_LBSPPA512_LBSPPB128_LPA16_MIWT2_2_PLR1_SU32_SUM0_SUS256_SKXCCM8_VWA1_VWB2_WGM1_WGMXCC1_WGMXCCGn1
    SolutionIndex: 67
    SolutionNameMin: Cijk_Ailk_Bljk_BSS_BH_UserArgs_MT64x32x32_MI16x16x1_SN_LDSB0_CLR1_GSU0_GSUC0_GSUWGMRR0_K1_LBSPPA512_LBSPPB128_LPA32_MIWT2_1_PLR1_SU32_SUM0_SUS256_SKXCCM8_VWA2_VWB1_WGM1_WGMXCC1_WGMXCCGn1
    SolutionIndex: 68
    SolutionNameMin: Cijk_Ailk_Bljk_BSS_BH_UserArgs_MT32x32x32_MI16x16x1_SN_LDSB0_CLR0_GSU0_GSUC0_GSUWGMRR0_K1_LBSPPA256_LBSPPB128_LPA16_MIWT1_1_PLR0_SU32_SUM0_SUS256_SKXCCM8_VWA1_VWB1_WGM1_WGMXCC1_WGMXCCGn1
    SolutionIndex: 69
    SolutionNameMin: Cijk_Ailk_Bljk_BSS_BH_UserArgs_MT128x256x64_MI16x16x1_SN_LDSB1_CLR1_GSU0_GSUC0_GSUWGMRR0_K1_LBSPPA2048_LBSPPB128_LPA32_MIWT4_8_PLR1_SU32_SUM0_SUS256_SKXCCM8_VWA2_VWB1_WGM1_WGMXCC1_WGMXCCGn1
    SolutionIndex: 70
    SolutionNameMin: Cijk_Ailk_Bljk_BSS_BH_UserArgs_MT128x256x64_MI16x16x1_SN_LDSB1_CLR1_GSU0_GSUC0_GSUWGMRR0_K1_LBSPPA2048_LBSPPB128_LPA0_MIWT4_8_PLR1_SU32_SUM0_SUS256_SKXCCM8_VWA4_VWB1_WGM1_WGMXCC1_WGMXCCGn1
    SolutionIndex: 71
    SolutionNameMin: Cijk_Ailk_Bljk_BSS_BH_UserArgs_MT128x256x64_MI16x16x1_SN_LDSB1_CLR1_GSU0_GSUC0_GSUWGMRR0_K1_LBSPPA2048_LBSPPB256_LPA16_MIWT4_8_PLR1_SU32_SUM0_SUS256_SKXCCM8_VWA1_VWB2_WGM1_WGMXCC1_WGMXCCGn1
    SolutionIndex: 72
    SolutionNameMin: Cijk_Ailk_Bljk_BSS_BH_UserArgs_MT128x256x64_MI16x16x1_SN_LDSB1_CLR1_GSU0_GSUC0_GSUWGMRR0_K1_LBSPPA2048_LBSPPB256_LPA0_MIWT4_8_PLR1_SU32_SUM0_SUS256_SKXCCM8_VWA4_VWB2_WGM1_WGMXCC1_WGMXCCGn1
    SolutionIndex: 73
    SolutionNameMin: Cijk_Ailk_Bljk_BSS_BH_UserArgs_MT128x256x64_MI16x16x1_SN_LDSB1_CLR1_GSU0_GSUC0_GSUWGMRR0_K1_LBSPPA2048_LBSPPB512_LPA0_MIWT4_8_PLR1_SU32_SUM0_SUS256_SKXCCM8_VWA4_VWB4_WGM1_WGMXCC1_WGMXCCGn1
    SolutionIndex: 74
    SolutionNameMin: Cijk_Ailk_Bljk_BSS_BH_UserArgs_MT128x256x64_MI16x16x1_SN_LDSB1_CLR1_GSU0_GSUC0_GSUWGMRR0_K1_LBSPPA2048_LBSPPB1024_LPA32_MIWT4_8_PLR1_SU32_SUM0_SUS256_SKXCCM8_VWA2_VWB8_WGM1_WGMXCC1_WGMXCCGn1
    SolutionIndex: 75
    SolutionNameMin: Cijk_Ailk_Bljk_BSS_BH_UserArgs_MT128x256x64_MI16x16x1_SN_LDSB1_CLR1_GSU0_GSUC0_GSUWGMRR0_K1_LBSPPA2048_LBSPPB1024_LPA0_MIWT4_8_PLR1_SU32_SUM0_SUS256_SKXCCM8_VWA4_VWB8_WGM1_WGMXCC1_WGMXCCGn1
    SolutionIndex: 76
    SolutionNameMin: Cijk_Ailk_Bljk_BSS_BH_UserArgs_MT128x256x64_MI16x16x1_SN_LDSB1_CLR1_GSU0_GSUC0_GSUWGMRR0_K1_LBSPPA2048_LBSPPB128_LPA0_MIWT4_8_PLR1_SU32_SUM0_SUS256_SKXCCM8_VWA4_VWB1_WGM4_WGMXCC1_WGMXCCGn1
    SolutionIndex: 77
    SolutionNameMin: Cijk_Ailk_Bljk_BSS_BH_UserArgs_MT128x256x64_MI16x16x1_SN_LDSB1_CLR1_GSU0_GSUC0_GSUWGMRR0_K1_LBSPPA2048_LBSPPB512_LPA32_MIWT4_8_PLR1_SU32_SUM0_SUS256_SKXCCM8_VWA2_VWB4_WGM4_WGMXCC1_WGMXCCGn1
    SolutionIndex: 78
    SolutionNameMin: Cijk_Ailk_Bljk_BSS_BH_UserArgs_MT128x256x64_MI16x16x1_SN_LDSB1_CLR1_GSU0_GSUC0_GSUWGMRR0_K1_LBSPPA2048_LBSPPB512_LPA0_MIWT4_8_PLR1_SU32_SUM0_SUS256_SKXCCM8_VWA4_VWB4_WGM4_WGMXCC1_WGMXCCGn1
    SolutionIndex: 79
    SolutionNameMin: Cijk_Ailk_Bljk_BSS_BH_UserArgs_MT128x256x64_MI16x16x1_SN_LDSB1_CLR1_GSU0_GSUC0_GSUWGMRR0_K1_LBSPPA2048_LBSPPB1024_LPA32_MIWT4_8_PLR1_SU32_SUM0_SUS256_SKXCCM8_VWA2_VWB8_WGM4_WGMXCC1_WGMXCCGn1
    SolutionIndex: 80
    SolutionNameMin: Cijk_Ailk_Bljk_BSS_BH_UserArgs_MT128x256x64_MI16x16x1_SN_LDSB1_CLR1_GSU0_GSUC0_GSUWGMRR0_K1_LBSPPA2048_LBSPPB128_LPA32_MIWT4_8_PLR1_SU32_SUM0_SUS256_SKXCCM8_VWA2_VWB1_WGM8_WGMXCC1_WGMXCCGn1
    SolutionIndex: 81
    SolutionNameMin: Cijk_Ailk_Bljk_BSS_BH_UserArgs_MT128x256x64_MI16x16x1_SN_LDSB1_CLR1_GSU0_GSUC0_GSUWGMRR0_K1_LBSPPA2048_LBSPPB128_LPA0_MIWT4_8_PLR1_SU32_SUM0_SUS256_SKXCCM8_VWA4_VWB1_WGM8_WGMXCC1_WGMXCCGn1
    SolutionIndex: 82
    SolutionNameMin: Cijk_Ailk_Bljk_BSS_BH_UserArgs_MT128x256x64_MI16x16x1_SN_LDSB1_CLR1_GSU0_GSUC0_GSUWGMRR0_K1_LBSPPA2048_LBSPPB1024_LPA0_MIWT4_8_PLR1_SU32_SUM0_SUS256_SKXCCM8_VWA4_VWB8_WGM8_WGMXCC1_WGMXCCGn1
    SolutionIndex: 83
    SolutionNameMin: Cijk_Ailk_Bljk_BSS_BH_UserArgs_MT256x128x64_MI16x16x1_SN_LDSB1_CLR1_GSU0_GSUC0_GSUWGMRR0_K1_LBSPPA4096_LBSPPB128_LPA0_MIWT8_4_PLR1_SU32_SUM0_SUS256_SKXCCM8_VWA4_VWB1_WGM1_WGMXCC1_WGMXCCGn1
    SolutionIndex: 84
    SolutionNameMin: Cijk_Ailk_Bljk_BSS_BH_UserArgs_MT256x128x64_MI16x16x1_SN_LDSB1_CLR1_GSU0_GSUC0_GSUWGMRR0_K1_LBSPPA4096_LBSPPB512_LPA0_MIWT8_4_PLR1_SU32_SUM0_SUS256_SKXCCM8_VWA4_VWB4_WGM1_WGMXCC1_WGMXCCGn1
    SolutionIndex: 85
    SolutionNameMin: Cijk_Ailk_Bljk_BSS_BH_UserArgs_MT256x128x64_MI16x16x1_SN_LDSB1_CLR1_GSU0_GSUC0_GSUWGMRR0_K1_LBSPPA4096_LBSPPB512_LPA0_MIWT8_4_PLR1_SU32_SUM0_SUS256_SKXCCM8_VWA4_VWB4_WGM4_WGMXCC1_WGMXCCGn1
    SolutionIndex: 86
    SolutionNameMin: Cijk_Ailk_Bljk_BSS_BH_UserArgs_MT128x128x64_MI16x16x1_SN_LDSB1_CLR1_GSU0_GSUC0_GSUWGMRR0_K1_LBSPPA2048_LBSPPB128_LPA0_MIWT4_4_PLR1_SU32_SUM0_SUS256_SKXCCM8_VWA4_VWB1_WGM1_WGMXCC1_WGMXCCGn1
    SolutionIndex: 87
    SolutionNameMin: Cijk_Ailk_Bljk_BSS_BH_UserArgs_MT128x128x64_MI16x16x1_SN_LDSB1_CLR1_GSU0_GSUC0_GSUWGMRR0_K1_LBSPPA2048_LBSPPB256_LPA0_MIWT4_4_PLR1_SU32_SUM0_SUS256_SKXCCM8_VWA4_VWB2_WGM1_WGMXCC1_WGMXCCGn1
    SolutionIndex: 88
    SolutionNameMin: Cijk_Ailk_Bljk_BSS_BH_UserArgs_MT128x128x64_MI16x16x1_SN_LDSB1_CLR1_GSU0_GSUC0_GSUWGMRR0_K1_LBSPPA2048_LBSPPB512_LPA0_MIWT4_4_PLR1_SU32_SUM0_SUS256_SKXCCM8_VWA4_VWB4_WGM1_WGMXCC1_WGMXCCGn1
    SolutionIndex: 89
    SolutionNameMin: Cijk_Ailk_Bljk_BSS_BH_UserArgs_MT128x128x64_MI16x16x1_SN_LDSB1_CLR1_GSU0_GSUC0_GSUWGMRR0_K1_LBSPPA2048_LBSPPB128_LPA0_MIWT4_4_PLR1_SU32_SUM0_SUS256_SKXCCM8_VWA4_VWB1_WGM4_WGMXCC1_WGMXCCGn1
    SolutionIndex: 90
    SolutionNameMin: Cijk_Ailk_Bljk_BSS_BH_UserArgs_MT128x128x64_MI16x16x1_SN_LDSB1_CLR1_GSU0_GSUC0_GSUWGMRR0_K1_LBSPPA2048_LBSPPB256_LPA0_MIWT4_4_PLR1_SU32_SUM0_SUS256_SKXCCM8_VWA4_VWB2_WGM4_WGMXCC1_WGMXCCGn1
    SolutionIndex: 91
    SolutionNameMin: Cijk_Ailk_Bljk_BSS_BH_UserArgs_MT128x128x64_MI16x16x1_SN_LDSB1_CLR1_GSU0_GSUC0_GSUWGMRR0_K1_LBSPPA2048_LBSPPB128_LPA0_MIWT4_4_PLR1_SU32_SUM0_SUS256_SKXCCM8_VWA4_VWB1_WGM8_WGMXCC1_WGMXCCGn1
    SolutionIndex: 92
    SolutionNameMin: Cijk_Ailk_Bljk_BSS_BH_UserArgs_MT128x128x64_MI16x16x1_SN_LDSB1_CLR1_GSU0_GSUC0_GSUWGMRR0_K1_LBSPPA2048_LBSPPB256_LPA0_MIWT4_4_PLR1_SU32_SUM0_SUS256_SKXCCM8_VWA4_VWB2_WGM8_WGMXCC1_WGMXCCGn1
    SolutionIndex: 93
    SolutionNameMin: Cijk_Ailk_Bljk_BSS_BH_UserArgs_MT128x128x64_MI16x16x1_SN_LDSB1_CLR1_GSU0_GSUC0_GSUWGMRR0_K1_LBSPPA2048_LBSPPB512_LPA0_MIWT4_4_PLR1_SU32_SUM0_SUS256_SKXCCM8_VWA4_VWB4_WGM8_WGMXCC1_WGMXCCGn1
    SolutionIndex: 94
    SolutionNameMin: Cijk_Ailk_Bljk_BSS_BH_UserArgs_MT128x64x64_MI16x16x1_SN_LDSB1_CLR1_GSU0_GSUC0_GSUWGMRR0_K1_LBSPPA2048_LBSPPB128_LPA0_MIWT4_2_PLR1_SU32_SUM0_SUS256_SKXCCM8_VWA4_VWB1_WGM1_WGMXCC1_WGMXCCGn1
    SolutionIndex: 95
    SolutionNameMin: Cijk_Ailk_Bljk_BSS_BH_UserArgs_MT128x64x64_MI16x16x1_SN_LDSB1_CLR1_GSU0_GSUC0_GSUWGMRR0_K1_LBSPPA2048_LBSPPB256_LPA0_MIWT4_2_PLR1_SU32_SUM0_SUS256_SKXCCM8_VWA4_VWB2_WGM1_WGMXCC1_WGMXCCGn1
    SolutionIndex: 96
    SolutionNameMin: Cijk_Ailk_Bljk_BSS_BH_UserArgs_MT128x64x64_MI16x16x1_SN_LDSB1_CLR1_GSU0_GSUC0_GSUWGMRR0_K1_LBSPPA2048_LBSPPB128_LPA0_MIWT4_2_PLR1_SU32_SUM0_SUS256_SKXCCM8_VWA4_VWB1_WGM4_WGMXCC1_WGMXCCGn1
    SolutionIndex: 97
    SolutionNameMin: Cijk_Ailk_Bljk_BSS_BH_UserArgs_MT128x64x64_MI16x16x1_SN_LDSB1_CLR1_GSU0_GSUC0_GSUWGMRR0_K1_LBSPPA2048_LBSPPB256_LPA0_MIWT4_2_PLR1_SU32_SUM0_SUS256_SKXCCM8_VWA4_VWB2_WGM4_WGMXCC1_WGMXCCGn1
    SolutionIndex: 98
    SolutionNameMin: Cijk_Ailk_Bljk_BSS_BH_UserArgs_MT128x64x64_MI16x16x1_SN_LDSB1_CLR1_GSU0_GSUC0_GSUWGMRR0_K1_LBSPPA2048_LBSPPB128_LPA0_MIWT4_2_PLR1_SU32_SUM0_SUS256_SKXCCM8_VWA4_VWB1_WGM8_WGMXCC1_WGMXCCGn1
    SolutionIndex: 99
    SolutionNameMin: Cijk_Ailk_Bljk_BSS_BH_UserArgs_MT128x32x64_MI16x16x1_SN_LDSB1_CLR1_GSU0_GSUC0_GSUWGMRR0_K1_LBSPPA2048_LBSPPB128_LPA0_MIWT4_1_PLR1_SU32_SUM0_SUS256_SKXCCM8_VWA4_VWB1_WGM1_WGMXCC1_WGMXCCGn1
    SolutionIndex: 100
    SolutionNameMin: Cijk_Ailk_Bljk_BSS_BH_UserArgs_MT64x64x64_MI16x16x1_SN_LDSB1_CLR1_GSU0_GSUC0_GSUWGMRR0_K1_LBSPPA1024_LBSPPB128_LPA32_MIWT2_2_PLR1_SU32_SUM0_SUS256_SKXCCM8_VWA2_VWB1_WGM1_WGMXCC1_WGMXCCGn1
    SolutionIndex: 101
    SolutionNameMin: Cijk_Ailk_Bljk_BSS_BH_UserArgs_MT64x64x64_MI16x16x1_SN_LDSB1_CLR1_GSU0_GSUC0_GSUWGMRR0_K1_LBSPPA1024_LBSPPB256_LPA32_MIWT2_2_PLR1_SU32_SUM0_SUS256_SKXCCM8_VWA2_VWB2_WGM1_WGMXCC1_WGMXCCGn1
    SolutionIndex: 102
    SolutionNameMin: Cijk_Ailk_Bljk_BSS_BH_UserArgs_MT64x64x64_MI16x16x1_SN_LDSB1_CLR1_GSU0_GSUC0_GSUWGMRR0_K1_LBSPPA1024_LBSPPB128_LPA32_MIWT2_2_PLR1_SU32_SUM0_SUS256_SKXCCM8_VWA2_VWB1_WGM4_WGMXCC1_WGMXCCGn1
    SolutionIndex: 103
    SolutionNameMin: Cijk_Ailk_Bljk_BSS_BH_UserArgs_MT64x64x64_MI16x16x1_SN_LDSB1_CLR1_GSU0_GSUC0_GSUWGMRR0_K1_LBSPPA1024_LBSPPB128_LPA32_MIWT2_2_PLR1_SU32_SUM0_SUS256_SKXCCM8_VWA2_VWB1_WGM8_WGMXCC1_WGMXCCGn1
    SolutionIndex: 104
    SolutionNameMin: Cijk_Ailk_Bljk_BSS_BH_UserArgs_MT32x64x64_MI16x16x1_SN_LDSB0_CLR1_GSU0_GSUC0_GSUWGMRR0_K1_LBSPPA512_LBSPPB256_LPA16_MIWT1_2_PLR1_SU32_SUM0_SUS256_SKXCCM8_VWA1_VWB2_WGM1_WGMXCC1_WGMXCCGn1
    SolutionIndex: 105
    SolutionNameMin: Cijk_Ailk_Bljk_BSS_BH_UserArgs_MT64x32x64_MI16x16x1_SN_LDSB0_CLR1_GSU0_GSUC0_GSUWGMRR0_K1_LBSPPA1024_LBSPPB128_LPA32_MIWT2_1_PLR1_SU32_SUM0_SUS256_SKXCCM8_VWA2_VWB1_WGM1_WGMXCC1_WGMXCCGn1
    SolutionIndex: 106
    SolutionNameMin: Cijk_Ailk_Bljk_BSS_BH_UserArgs_MT32x32x64_MI16x16x1_SN_LDSB0_CLR1_GSU0_GSUC0_GSUWGMRR0_K1_LBSPPA512_LBSPPB128_LPA16_MIWT1_1_PLR1_SU32_SUM0_SUS256_SKXCCM8_VWA1_VWB1_WGM1_WGMXCC1_WGMXCCGn1
    SolutionIndex: 107
    SolutionNameMin: Cijk_Ailk_Bljk_BSS_BH_UserArgs_MT32x32x64_MI16x16x1_SN_LDSB0_CLR1_GSU0_GSUC0_GSUWGMRR0_K1_LBSPPA512_LBSPPB128_LPA16_MIWT1_1_PLR1_SU32_SUM0_SUS256_SKXCCM8_VWA1_VWB1_WGM4_WGMXCC1_WGMXCCGn1
    SolutionIndex: 108
    SolutionNameMin: Cijk_Ailk_Bljk_BSS_BH_UserArgs_MT128x64x128_MI16x16x1_SN_LDSB1_CLR1_GSU0_GSUC0_GSUWGMRR0_K1_LBSPPA2048_LBSPPB256_LPA0_MIWT4_2_PLR1_SU32_SUM0_SUS256_SKXCCM8_VWA4_VWB1_WGM1_WGMXCC1_WGMXCCGn1
    SolutionIndex: 109
    SolutionNameMin: Cijk_Ailk_Bljk_BSS_BH_UserArgs_MT128x64x128_MI16x16x1_SN_LDSB1_CLR1_GSU0_GSUC0_GSUWGMRR0_K1_LBSPPA2048_LBSPPB512_LPA0_MIWT4_2_PLR1_SU32_SUM0_SUS256_SKXCCM8_VWA4_VWB2_WGM1_WGMXCC1_WGMXCCGn1
    SolutionIndex: 110
    SolutionNameMin: Cijk_Ailk_Bljk_BSS_BH_UserArgs_MT128x64x128_MI16x16x1_SN_LDSB1_CLR1_GSU0_GSUC0_GSUWGMRR0_K1_LBSPPA2048_LBSPPB256_LPA0_MIWT4_2_PLR2_SU32_SUM0_SUS256_SKXCCM8_VWA4_VWB1_WGM1_WGMXCC1_WGMXCCGn1
    SolutionIndex: 111
    SolutionNameMin: Cijk_Ailk_Bljk_BSS_BH_UserArgs_MT128x64x128_MI16x16x1_SN_LDSB1_CLR1_GSU0_GSUC0_GSUWGMRR0_K1_LBSPPA2048_LBSPPB256_LPA0_MIWT4_2_PLR1_SU32_SUM0_SUS256_SKXCCM8_VWA4_VWB1_WGM4_WGMXCC1_WGMXCCGn1
    SolutionIndex: 112
    SolutionNameMin: Cijk_Ailk_Bljk_BSS_BH_UserArgs_MT128x64x128_MI16x16x1_SN_LDSB1_CLR1_GSU0_GSUC0_GSUWGMRR0_K1_LBSPPA2048_LBSPPB256_LPA0_MIWT4_2_PLR2_SU32_SUM0_SUS256_SKXCCM8_VWA4_VWB1_WGM4_WGMXCC1_WGMXCCGn1
    SolutionIndex: 113
    SolutionNameMin: Cijk_Ailk_Bljk_BSS_BH_UserArgs_MT128x64x128_MI16x16x1_SN_LDSB1_CLR1_GSU0_GSUC0_GSUWGMRR0_K1_LBSPPA2048_LBSPPB256_LPA0_MIWT4_2_PLR1_SU32_SUM0_SUS256_SKXCCM8_VWA4_VWB1_WGM8_WGMXCC1_WGMXCCGn1
    SolutionIndex: 114
    SolutionNameMin: Cijk_Ailk_Bljk_BSS_BH_UserArgs_MT128x64x128_MI16x16x1_SN_LDSB1_CLR1_GSU0_GSUC0_GSUWGMRR0_K1_LBSPPA2048_LBSPPB512_LPA0_MIWT4_2_PLR1_SU32_SUM0_SUS256_SKXCCM8_VWA4_VWB2_WGM8_WGMXCC1_WGMXCCGn1
    SolutionIndex: 115
    SolutionNameMin: Cijk_Ailk_Bljk_BSS_BH_UserArgs_MT128x64x128_MI16x16x1_SN_LDSB1_CLR1_GSU0_GSUC0_GSUWGMRR0_K1_LBSPPA2048_LBSPPB256_LPA0_MIWT4_2_PLR2_SU32_SUM0_SUS256_SKXCCM8_VWA4_VWB1_WGM8_WGMXCC1_WGMXCCGn1
    SolutionIndex: 116
    SolutionNameMin: Cijk_Ailk_Bljk_BSS_BH_UserArgs_MT128x64x128_MI16x16x1_SN_LDSB1_CLR1_GSU0_GSUC0_GSUWGMRR0_K1_LBSPPA2048_LBSPPB512_LPA0_MIWT4_2_PLR2_SU32_SUM0_SUS256_SKXCCM8_VWA4_VWB2_WGM8_WGMXCC1_WGMXCCGn1
    SolutionIndex: 117
    SolutionNameMin: Cijk_Ailk_Bljk_BSS_BH_UserArgs_MT64x64x128_MI16x16x1_SN_LDSB1_CLR1_GSU0_GSUC0_GSUWGMRR0_K1_LBSPPA1024_LBSPPB256_LPA32_MIWT2_2_PLR2_SU32_SUM0_SUS256_SKXCCM8_VWA2_VWB1_WGM1_WGMXCC1_WGMXCCGn1
    SolutionIndex: 118
    SolutionNameMin: Cijk_Ailk_Bljk_BSS_BH_UserArgs_MT64x64x128_MI16x16x1_SN_LDSB1_CLR1_GSU0_GSUC0_GSUWGMRR0_K1_LBSPPA1024_LBSPPB512_LPA32_MIWT2_2_PLR2_SU32_SUM0_SUS256_SKXCCM8_VWA2_VWB2_WGM1_WGMXCC1_WGMXCCGn1
    SolutionIndex: 119
    SolutionNameMin: Cijk_Ailk_Bljk_BSS_BH_UserArgs_MT64x64x128_MI16x16x1_SN_LDSB1_CLR1_GSU0_GSUC0_GSUWGMRR0_K1_LBSPPA1024_LBSPPB256_LPA32_MIWT2_2_PLR2_SU32_SUM0_SUS256_SKXCCM8_VWA2_VWB1_WGM4_WGMXCC1_WGMXCCGn1
    SolutionIndex: 120
    SolutionNameMin: Cijk_Ailk_Bljk_BSS_BH_UserArgs_MT64x64x128_MI16x16x1_SN_LDSB1_CLR1_GSU0_GSUC0_GSUWGMRR0_K1_LBSPPA1024_LBSPPB256_LPA32_MIWT2_2_PLR2_SU32_SUM0_SUS256_SKXCCM8_VWA2_VWB1_WGM8_WGMXCC1_WGMXCCGn1
    SolutionIndex: 121
    SolutionNameMin: Cijk_Ailk_Bljk_BSS_BH_UserArgs_MT64x32x128_MI16x16x1_SN_LDSB1_CLR1_GSU0_GSUC0_GSUWGMRR0_K1_LBSPPA1024_LBSPPB256_LPA32_MIWT2_1_PLR2_SU32_SUM0_SUS256_SKXCCM8_VWA2_VWB1_WGM1_WGMXCC1_WGMXCCGn1
    SolutionIndex: 122
    SolutionNameMin: Cijk_Ailk_Bljk_BSS_BH_UserArgs_MT64x32x128_MI16x16x1_SN_LDSB1_CLR1_GSU0_GSUC0_GSUWGMRR0_K1_LBSPPA1024_LBSPPB256_LPA32_MIWT2_1_PLR2_SU32_SUM0_SUS256_SKXCCM8_VWA2_VWB1_WGM4_WGMXCC1_WGMXCCGn1
    SolutionIndex: 123
    SolutionNameMin: Cijk_Ailk_Bljk_BSS_BH_UserArgs_MT64x32x128_MI16x16x1_SN_LDSB1_CLR1_GSU0_GSUC0_GSUWGMRR0_K1_LBSPPA1024_LBSPPB256_LPA32_MIWT2_1_PLR2_SU32_SUM0_SUS256_SKXCCM8_VWA2_VWB1_WGM8_WGMXCC1_WGMXCCGn1
    SolutionIndex: 124
    SolutionNameMin: Cijk_Ailk_Bljk_BSS_BH_UserArgs_MT32x32x128_MI16x16x1_SN_LDSB1_CLR1_GSU0_GSUC0_GSUWGMRR0_K1_LBSPPA512_LBSPPB256_LPA16_MIWT1_1_PLR1_SU32_SUM0_SUS256_SKXCCM8_VWA1_VWB1_WGM1_WGMXCC1_WGMXCCGn1
    SolutionIndex: 125
    SolutionNameMin: Cijk_Ailk_Bljk_BSS_BH_UserArgs_MT32x32x128_MI16x16x1_SN_LDSB1_CLR1_GSU0_GSUC0_GSUWGMRR0_K1_LBSPPA512_LBSPPB256_LPA16_MIWT1_1_PLR2_SU32_SUM0_SUS256_SKXCCM8_VWA1_VWB1_WGM1_WGMXCC1_WGMXCCGn1
    SolutionIndex: 126
    SolutionNameMin: Cijk_Ailk_Bljk_BSS_BH_UserArgs_MT32x32x32_MI16x16x1_SN_LDSB0_CLR1_GSU0_GSUC0_GSUWGMRR0_K1_LBSPPA256_LBSPPB128_LPA16_MIWT1_1_PLR1_SU32_SUM0_SUS256_SKXCCM8_VWA1_VWB1_WGM1_WGMXCC1_WGMXCCGn1
- - - [128, 128, 1, 128, 128, 128, 128, 128]
    - [26, 0.081]
  - - [128, 128, 1, 256, 128, 128, 128, 256]
    - [106, 0.151]
  - - [128, 128, 1, 512, 128, 128, 128, 512]
    - [124, 0.25]
  - - [128, 128, 1, 1024, 128, 128, 128, 1024]
    - [124, 0.385]
  - - [128, 128, 1, 2048, 128, 128, 128, 2048]
    - [68, 0.566]
  - - [128, 128, 1, 4096, 128, 128, 128, 4096]
    - [106, 1.011]
  - - [128, 128, 1, 8192, 128, 128, 128, 8192]
    - [124, 1.56]
  - - [128, 256, 1, 128, 128, 128, 128, 128]
    - [106, 0.17]
  - - [128, 256, 1, 256, 128, 128, 128, 256]
    - [106, 0.305]
  - - [128, 256, 1, 512, 128, 128, 128, 512]
    - [42, 0.509]
  - - [128, 256, 1, 1024, 128, 128, 128, 1024]
    - [42, 0.783]
  - - [128, 256, 1, 2048, 128, 128, 128, 2048]
    - [124, 1.152]
  - - [128, 256, 1, 4096, 128, 128, 128, 4096]
    - [106, 1.986]
  - - [128, 256, 1, 8192, 128, 128, 128, 8192]
    - [124, 3.053]
  - - [128, 512, 1, 128, 128, 128, 128, 128]
    - [106, 0.34]
  - - [128, 512, 1, 256, 128, 128, 128, 256]
    - [26, 0.6]
  - - [128, 512, 1, 512, 128, 128, 128, 512]
    - [124, 1.02]
  - - [128, 512, 1, 1024, 128, 128, 128, 1024]
    - [124, 1.549]
  - - [128, 512, 1, 2048, 128, 128, 128, 2048]
    - [41, 2.24]
  - - [128, 512, 1, 4096, 128, 128, 128, 4096]
    - [106, 3.766]
  - - [128, 512, 1, 8192, 128, 128, 128, 8192]
    - [124, 5.747]
  - - [128, 1024, 1, 128, 128, 128, 128, 128]
    - [106, 0.656]
  - - [128, 1024, 1, 256, 128, 128, 128, 256]
    - [106, 1.195]
  - - [128, 1024, 1, 512, 128, 128, 128, 512]
    - [124, 1.991]
  - - [128, 1024, 1, 1024, 128, 128, 128, 1024]
    - [41, 3.077]
  - - [128, 1024, 1, 2048, 128, 128, 128, 2048]
    - [41, 4.248]
  - - [128, 1024, 1, 4096, 128, 128, 128, 4096]
    - [104, 6.592]
  - - [128, 1024, 1, 8192, 128, 128, 128, 8192]
    - [39, 9.285]
  - - [128, 2048, 1, 128, 128, 128, 128, 128]
    - [124, 1.251]
  - - [128, 2048, 1, 256, 128, 128, 128, 256]
    - [106, 2.302]
  - - [128, 2048, 1, 512, 128, 128, 128, 512]
    - [125, 3.764]
  - - [128, 2048, 1, 1024, 128, 128, 128, 1024]
    - [125, 5.923]
  - - [128, 2048, 1, 2048, 128, 128, 128, 2048]
    - [125, 7.907]
  - - [128, 2048, 1, 4096, 128, 128, 128, 4096]
    - [121, 10.368]
  - - [128, 2048, 1, 8192, 128, 128, 128, 8192]
    - [36, 13.425]
  - - [128, 4096, 1, 128, 128, 128, 128, 128]
    - [67, 2.254]
  - - [128, 4096, 1, 256, 128, 128, 128, 256]
    - [121, 4.048]
  - - [128, 4096, 1, 512, 128, 128, 128, 512]
    - [121, 6.694]
  - - [128, 4096, 1, 1024, 128, 128, 128, 1024]
    - [121, 10.009]
  - - [128, 4096, 1, 2048, 128, 128, 128, 2048]
    - [121, 12.389]
  - - [128, 4096, 1, 4096, 128, 128, 128, 4096]
    - [95, 14.392]
  - - [128, 4096, 1, 8192, 128, 128, 128, 8192]
    - [115, 18.226]
  - - [128, 8192, 1, 128, 128, 128, 128, 128]
    - [101, 3.813]
  - - [128, 8192, 1, 256, 128, 128, 128, 256]
    - [100, 6.668]
  - - [128, 8192, 1, 512, 128, 128, 128, 512]
    - [101, 10.877]
  - - [128, 8192, 1, 1024, 128, 128, 128, 1024]
    - [117, 14.794]
  - - [128, 8192, 1, 2048, 128, 128, 128, 2048]
    - [117, 15.965]
  - - [128, 8192, 1, 4096, 128, 128, 128, 4096]
    - [92, 19.186]
  - - [128, 8192, 1, 8192, 128, 128, 128, 8192]
    - [17, 21.67]
  - - [256, 128, 1, 128, 256, 256, 256, 128]
    - [26, 0.167]
  - - [256, 128, 1, 256, 256, 256, 256, 256]
    - [106, 0.303]
  - - [256, 128, 1, 512, 256, 256, 256, 512]
    - [42, 0.507]
  - - [256, 128, 1, 1024, 256, 256, 256, 1024]
    - [41, 0.774]
  - - [256, 128, 1, 2048, 256, 256, 256, 2048]
    - [42, 1.149]
  - - [256, 128, 1, 4096, 256, 256, 256, 4096]
    - [106, 1.977]
  - - [256, 128, 1, 8192, 256, 256, 256, 8192]
    - [41, 3.026]
  - - [256, 256, 1, 128, 256, 256, 256, 128]
    - [106, 0.334]
  - - [256, 256, 1, 256, 256, 256, 256, 256]
    - [106, 0.603]
  - - [256, 256, 1, 512, 256, 256, 256, 512]
    - [124, 1.003]
  - - [256, 256, 1, 1024, 256, 256, 256, 1024]
    - [42, 1.549]
  - - [256, 256, 1, 2048, 256, 256, 256, 2048]
    - [124, 2.284]
  - - [256, 256, 1, 4096, 256, 256, 256, 4096]
    - [106, 3.812]
  - - [256, 256, 1, 8192, 256, 256, 256, 8192]
    - [42, 5.595]
  - - [256, 512, 1, 128, 256, 256, 256, 128]
    - [106, 0.662]
  - - [256, 512, 1, 256, 256, 256, 256, 256]
    - [106, 1.182]
  - - [256, 512, 1, 512, 256, 256, 256, 512]
    - [124, 1.977]
  - - [256, 512, 1, 1024, 256, 256, 256, 1024]
    - [42, 3.056]
  - - [256, 512, 1, 2048, 256, 256, 256, 2048]
    - [124, 4.259]
  - - [256, 512, 1, 4096, 256, 256, 256, 4096]
    - [104, 6.552]
  - - [256, 512, 1, 8192, 256, 256, 256, 8192]
    - [38, 9.155]
  - - [256, 1024, 1, 128, 256, 256, 256, 128]
    - [106, 1.256]
  - - [256, 1024, 1, 256, 256, 256, 256, 256]
    - [106, 2.285]
  - - [256, 1024, 1, 512, 256, 256, 256, 512]
    - [124, 3.737]
  - - [256, 1024, 1, 1024, 256, 256, 256, 1024]
    - [124, 5.888]
  - - [256, 1024, 1, 2048, 256, 256, 256, 2048]
    - [124, 7.924]
  - - [256, 1024, 1, 4096, 256, 256, 256, 4096]
    - [121, 10.379]
  - - [256, 1024, 1, 8192, 256, 256, 256, 8192]
    - [36, 13.538]
  - - [256, 2048, 1, 128, 256, 256, 256, 128]
    - [105, 2.27]
  - - [256, 2048, 1, 256, 256, 256, 256, 256]
    - [121, 3.995]
  - - [256, 2048, 1, 512, 256, 256, 256, 512]
    - [121, 6.627]
  - - [256, 2048, 1, 1024, 256, 256, 256, 1024]
    - [121, 10.123]
  - - [256, 2048, 1, 2048, 256, 256, 256, 2048]
    - [122, 12.221]
  - - [256, 2048, 1, 4096, 256, 256, 256, 4096]
    - [95, 14.701]
  - - [256, 2048, 1, 8192, 256, 256, 256, 8192]
    - [108, 18.294]
  - - [256, 4096, 1, 128, 256, 256, 256, 128]
    - [100, 3.804]
  - - [256, 4096, 1, 256, 256, 256, 256, 256]
    - [101, 6.686]
  - - [256, 4096, 1, 512, 256, 256, 256, 512]
    - [118, 10.776]
  - - [256, 4096, 1, 1024, 256, 256, 256, 1024]
    - [117, 14.699]
  - - [256, 4096, 1, 2048, 256, 256, 256, 2048]
    - [118, 17.44]
  - - [256, 4096, 1, 4096, 256, 256, 256, 4096]
    - [87, 19.734]
  - - [256, 4096, 1, 8192, 256, 256, 256, 8192]
    - [87, 21.379]
  - - [256, 8192, 1, 128, 256, 256, 256, 128]
    - [64, 5.86]
  - - [256, 8192, 1, 256, 256, 256, 256, 256]
    - [94, 10.023]
  - - [256, 8192, 1, 512, 256, 256, 256, 512]
    - [95, 14.487]
  - - [256, 8192, 1, 1024, 256, 256, 256, 1024]
    - [108, 18.986]
  - - [256, 8192, 1, 2048, 256, 256, 256, 2048]
    - [112, 21.066]
  - - [256, 8192, 1, 4096, 256, 256, 256, 4096]
    - [109, 23.64]
  - - [256, 8192, 1, 8192, 256, 256, 256, 8192]
    - [19, 26.475]
  - - [512, 128, 1, 128, 512, 512, 512, 128]
    - [106, 0.328]
  - - [512, 128, 1, 256, 512, 512, 512, 256]
    - [124, 0.595]
  - - [512, 128, 1, 512, 512, 512, 512, 512]
    - [41, 1.007]
  - - [512, 128, 1, 1024, 512, 512, 512, 1024]
    - [42, 1.54]
  - - [512, 128, 1, 2048, 512, 512, 512, 2048]
    - [124, 2.257]
  - - [512, 128, 1, 4096, 512, 512, 512, 4096]
    - [107, 3.649]
  - - [512, 128, 1, 8192, 512, 512, 512, 8192]
    - [42, 5.613]
  - - [512, 256, 1, 128, 512, 512, 512, 128]
    - [106, 0.653]
  - - [512, 256, 1, 256, 512, 512, 512, 256]
    - [106, 1.177]
  - - [512, 256, 1, 512, 512, 512, 512, 512]
    - [125, 1.988]
  - - [512, 256, 1, 1024, 512, 512, 512, 1024]
    - [124, 3.033]
  - - [512, 256, 1, 2048, 512, 512, 512, 2048]
    - [42, 4.267]
  - - [512, 256, 1, 4096, 512, 512, 512, 4096]
    - [42, 6.342]
  - - [512, 256, 1, 8192, 512, 512, 512, 8192]
    - [37, 9.25]
  - - [512, 512, 1, 128, 512, 512, 512, 128]
    - [125, 1.244]
  - - [512, 512, 1, 256, 512, 512, 512, 256]
    - [106, 2.282]
  - - [512, 512, 1, 512, 512, 512, 512, 512]
    - [106, 3.779]
  - - [512, 512, 1, 1024, 512, 512, 512, 1024]
    - [41, 5.833]
  - - [512, 512, 1, 2048, 512, 512, 512, 2048]
    - [125, 7.857]
  - - [512, 512, 1, 4096, 512, 512, 512, 4096]
    - [39, 10.226]
  - - [512, 512, 1, 8192, 512, 512, 512, 8192]
    - [32, 14.51]
  - - [512, 1024, 1, 128, 512, 512, 512, 128]
    - [105, 2.283]
  - - [512, 1024, 1, 256, 512, 512, 512, 256]
    - [121, 4.019]
  - - [512, 1024, 1, 512, 512, 512, 512, 512]
    - [121, 6.666]
  - - [512, 1024, 1, 1024, 512, 512, 512, 1024]
    - [121, 10.223]
  - - [512, 1024, 1, 2048, 512, 512, 512, 2048]
    - [121, 12.265]
  - - [512, 1024, 1, 4096, 512, 512, 512, 4096]
    - [35, 15.298]
  - - [512, 1024, 1, 8192, 512, 512, 512, 8192]
    - [29, 18.708]
  - - [512, 2048, 1, 128, 512, 512, 512, 128]
    - [101, 3.792]
  - - [512, 2048, 1, 256, 512, 512, 512, 256]
    - [101, 6.636]
  - - [512, 2048, 1, 512, 512, 512, 512, 512]
    - [118, 10.792]
  - - [512, 2048, 1, 1024, 512, 512, 512, 1024]
    - [118, 14.749]
  - - [512, 2048, 1, 2048, 512, 512, 512, 2048]
    - [118, 17.463]
  - - [512, 2048, 1, 4096, 512, 512, 512, 4096]
    - [86, 19.725]
  - - [512, 2048, 1, 8192, 512, 512, 512, 8192]
    - [86, 21.417]
  - - [512, 4096, 1, 128, 512, 512, 512, 128]
    - [64, 5.841]
  - - [512, 4096, 1, 256, 512, 512, 512, 256]
    - [96, 9.938]
  - - [512, 4096, 1, 512, 512, 512, 512, 512]
    - [96, 14.524]
  - - [512, 4096, 1, 1024, 512, 512, 512, 1024]
    - [113, 19.364]
  - - [512, 4096, 1, 2048, 512, 512, 512, 2048]
    - [111, 21.239]
  - - [512, 4096, 1, 4096, 512, 512, 512, 4096]
    - [110, 24.045]
  - - [512, 4096, 1, 8192, 512, 512, 512, 8192]
    - [91, 26.304]
  - - [512, 8192, 1, 128, 512, 512, 512, 128]
    - [59, 8.177]
  - - [512, 8192, 1, 256, 512, 512, 512, 256]
    - [88, 12.126]
  - - [512, 8192, 1, 512, 512, 512, 512, 512]
    - [86, 17.657]
  - - [512, 8192, 1, 1024, 512, 512, 512, 1024]
    - [89, 21.841]
  - - [512, 8192, 1, 2048, 512, 512, 512, 2048]
    - [22, 26.432]
  - - [512, 8192, 1, 4096, 512, 512, 512, 4096]
    - [13, 26.274]
  - - [512, 8192, 1, 8192, 512, 512, 512, 8192]
    - [14, 29.019]
  - - [1024, 128, 1, 128, 1024, 1024, 1024, 128]
    - [106, 0.647]
  - - [1024, 128, 1, 256, 1024, 1024, 1024, 256]
    - [106, 1.18]
  - - [1024, 128, 1, 512, 1024, 1024, 1024, 512]
    - [42, 1.981]
  - - [1024, 128, 1, 1024, 1024, 1024, 1024, 1024]
    - [42, 3.065]
  - - [1024, 128, 1, 2048, 1024, 1024, 1024, 2048]
    - [41, 4.256]
  - - [1024, 128, 1, 4096, 1024, 1024, 1024, 4096]
    - [42, 6.325]
  - - [1024, 128, 1, 8192, 1024, 1024, 1024, 8192]
    - [39, 9.471]
  - - [1024, 256, 1, 128, 1024, 1024, 1024, 128]
    - [106, 1.251]
  - - [1024, 256, 1, 256, 1024, 1024, 1024, 256]
    - [106, 2.271]
  - - [1024, 256, 1, 512, 1024, 1024, 1024, 512]
    - [106, 3.736]
  - - [1024, 256, 1, 1024, 1024, 1024, 1024, 1024]
    - [42, 5.855]
  - - [1024, 256, 1, 2048, 1024, 1024, 1024, 2048]
    - [42, 7.933]
  - - [1024, 256, 1, 4096, 1024, 1024, 1024, 4096]
    - [39, 10.194]
  - - [1024, 256, 1, 8192, 1024, 1024, 1024, 8192]
    - [33, 14.152]
  - - [1024, 512, 1, 128, 1024, 1024, 1024, 128]
    - [121, 2.265]
  - - [1024, 512, 1, 256, 1024, 1024, 1024, 256]
    - [121, 4.042]
  - - [1024, 512, 1, 512, 1024, 1024, 1024, 512]
    - [121, 6.666]
  - - [1024, 512, 1, 1024, 1024, 1024, 1024, 1024]
    - [121, 10.072]
  - - [1024, 512, 1, 2048, 1024, 1024, 1024, 2048]
    - [40, 12.143]
  - - [1024, 512, 1, 4096, 1024, 1024, 1024, 4096]
    - [32, 15.159]
  - - [1024, 512, 1, 8192, 1024, 1024, 1024, 8192]
    - [31, 18.516]
  - - [1024, 1024, 1, 128, 1024, 1024, 1024, 128]
    - [66, 3.736]
  - - [1024, 1024, 1, 256, 1024, 1024, 1024, 256]
    - [100, 6.649]
  - - [1024, 1024, 1, 512, 1024, 1024, 1024, 512]
    - [100, 10.853]
  - - [1024, 1024, 1, 1024, 1024, 1024, 1024, 1024]
    - [117, 14.678]
  - - [1024, 1024, 1, 2048, 1024, 1024, 1024, 2048]
    - [34, 16.723]
  - - [1024, 1024, 1, 4096, 1024, 1024, 1024, 4096]
    - [90, 19.66]
  - - [1024, 1024, 1, 8192, 1024, 1024, 1024, 8192]
    - [87, 21.113]
  - - [1024, 2048, 1, 128, 1024, 1024, 1024, 128]
    - [95, 5.802]
  - - [1024, 2048, 1, 256, 1024, 1024, 1024, 256]
    - [95, 9.956]
  - - [1024, 2048, 1, 512, 1024, 1024, 1024, 512]
    - [95, 14.562]
  - - [1024, 2048, 1, 1024, 1024, 1024, 1024, 1024]
    - [115, 18.797]
  - - [1024, 2048, 1, 2048, 1024, 1024, 1024, 2048]
    - [28, 21.464]
  - - [1024, 2048, 1, 4096, 1024, 1024, 1024, 4096]
    - [87, 23.449]
  - - [1024, 2048, 1, 8192, 1024, 1024, 1024, 8192]
    - [86, 25.574]
  - - [1024, 4096, 1, 128, 1024, 1024, 1024, 128]
    - [60, 8.208]
  - - [1024, 4096, 1, 256, 1024, 1024, 1024, 256]
    - [58, 12.036]
  - - [1024, 4096, 1, 512, 1024, 1024, 1024, 512]
    - [22, 17.77]
  - - [1024, 4096, 1, 1024, 1024, 1024, 1024, 1024]
    - [20, 22.12]
  - - [1024, 4096, 1, 2048, 1024, 1024, 1024, 2048]
    - [89, 26.273]
  - - [1024, 4096, 1, 4096, 1024, 1024, 1024, 4096]
    - [83, 25.974]
  - - [1024, 4096, 1, 8192, 1024, 1024, 1024, 8192]
    - [76, 27.722]
  - - [1024, 8192, 1, 128, 1024, 1024, 1024, 128]
    - [84, 7.981]
  - - [1024, 8192, 1, 256, 1024, 1024, 1024, 256]
    - [8, 13.078]
  - - [1024, 8192, 1, 512, 1024, 1024, 1024, 512]
    - [7, 19.14]
  - - [1024, 8192, 1, 1024, 1024, 1024, 1024, 1024]
    - [7, 25.263]
  - - [1024, 8192, 1, 2048, 1024, 1024, 1024, 2048]
    - [79, 31.074]
  - - [1024, 8192, 1, 4096, 1024, 1024, 1024, 4096]
    - [12, 27.963]
  - - [1024, 8192, 1, 8192, 1024, 1024, 1024, 8192]
    - [47, 31.176]
  - - [2048, 128, 1, 128, 2048, 2048, 2048, 128]
    - [26, 1.257]
  - - [2048, 128, 1, 256, 2048, 2048, 2048, 256]
    - [124, 2.256]
  - - [2048, 128, 1, 512, 2048, 2048, 2048, 512]
    - [41, 3.718]
  - - [2048, 128, 1, 1024, 2048, 2048, 2048, 1024]
    - [41, 5.948]
  - - [2048, 128, 1, 2048, 2048, 2048, 2048, 2048]
    - [39, 7.439]
  - - [2048, 128, 1, 4096, 2048, 2048, 2048, 4096]
    - [23, 9.905]
  - - [2048, 128, 1, 8192, 2048, 2048, 2048, 8192]
    - [32, 13.191]
  - - [2048, 256, 1, 128, 2048, 2048, 2048, 128]
    - [105, 2.265]
  - - [2048, 256, 1, 256, 2048, 2048, 2048, 256]
    - [105, 4.013]
  - - [2048, 256, 1, 512, 2048, 2048, 2048, 512]
    - [37, 6.572]
  - - [2048, 256, 1, 1024, 2048, 2048, 2048, 1024]
    - [123, 9.869]
  - - [2048, 256, 1, 2048, 2048, 2048, 2048, 2048]
    - [32, 11.785]
  - - [2048, 256, 1, 4096, 2048, 2048, 2048, 4096]
    - [96, 13.981]
  - - [2048, 256, 1, 8192, 2048, 2048, 2048, 8192]
    - [111, 18.147]
  - - [2048, 512, 1, 128, 2048, 2048, 2048, 128]
    - [100, 3.787]
  - - [2048, 512, 1, 256, 2048, 2048, 2048, 256]
    - [24, 6.489]
  - - [2048, 512, 1, 512, 2048, 2048, 2048, 512]
    - [100, 10.795]
  - - [2048, 512, 1, 1024, 2048, 2048, 2048, 1024]
    - [119, 14.566]
  - - [2048, 512, 1, 2048, 2048, 2048, 2048, 2048]
    - [27, 15.752]
  - - [2048, 512, 1, 4096, 2048, 2048, 2048, 4096]
    - [89, 19.462]
  - - [2048, 512, 1, 8192, 2048, 2048, 2048, 8192]
    - [86, 21.109]
  - - [2048, 1024, 1, 128, 2048, 2048, 2048, 128]
    - [63, 5.846]
  - - [2048, 1024, 1, 256, 2048, 2048, 2048, 256]
    - [94, 9.986]
  - - [2048, 1024, 1, 512, 2048, 2048, 2048, 512]
    - [95, 14.352]
  - - [2048, 1024, 1, 1024, 2048, 2048, 2048, 1024]
    - [111, 18.735]
  - - [2048, 1024, 1, 2048, 2048, 2048, 2048, 2048]
    - [114, 20.572]
  - - [2048, 1024, 1, 4096, 2048, 2048, 2048, 4096]
    - [115, 23.563]
  - - [2048, 1024, 1, 8192, 2048, 2048, 2048, 8192]
    - [88, 25.751]
  - - [2048, 2048, 1, 128, 2048, 2048, 2048, 128]
    - [4, 7.938]
  - - [2048, 2048, 1, 256, 2048, 2048, 2048, 256]
    - [57, 12.258]
  - - [2048, 2048, 1, 512, 2048, 2048, 2048, 512]
    - [92, 17.453]
  - - [2048, 2048, 1, 1024, 2048, 2048, 2048, 1024]
    - [91, 22.199]
  - - [2048, 2048, 1, 2048, 2048, 2048, 2048, 2048]
    - [89, 26.058]
  - - [2048, 2048, 1, 4096, 2048, 2048, 2048, 4096]
    - [75, 27.497]
  - - [2048, 2048, 1, 8192, 2048, 2048, 2048, 8192]
    - [74, 28.718]
  - - [2048, 4096, 1, 128, 2048, 2048, 2048, 128]
    - [84, 7.903]
  - - [2048, 4096, 1, 256, 2048, 2048, 2048, 256]
    - [15, 12.982]
  - - [2048, 4096, 1, 512, 2048, 2048, 2048, 512]
    - [9, 19.099]
  - - [2048, 4096, 1, 1024, 2048, 2048, 2048, 1024]
    - [69, 24.755]
  - - [2048, 4096, 1, 2048, 2048, 2048, 2048, 2048]
    - [74, 30.479]
  - - [2048, 4096, 1, 4096, 2048, 2048, 2048, 4096]
    - [75, 28.014]
  - - [2048, 4096, 1, 8192, 2048, 2048, 2048, 8192]
    - [47, 31.685]
  - - [2048, 8192, 1, 128, 2048, 2048, 2048, 128]
    - [10, 8.187]
  - - [2048, 8192, 1, 256, 2048, 2048, 2048, 256]
    - [1, 13.6]
  - - [2048, 8192, 1, 512, 2048, 2048, 2048, 512]
    - [51, 20.501]
  - - [2048, 8192, 1, 1024, 2048, 2048, 2048, 1024]
    - [2, 27.635]
  - - [2048, 8192, 1, 2048, 2048, 2048, 2048, 2048]
    - [70, 27.72]
  - - [2048, 8192, 1, 4096, 2048, 2048, 2048, 4096]
    - [56, 30.198]
  - - [2048, 8192, 1, 8192, 2048, 2048, 2048, 8192]
    - [55, 32.76]
  - - [4096, 128, 1, 128, 4096, 4096, 4096, 128]
    - [104, 2.274]
  - - [4096, 128, 1, 256, 4096, 4096, 4096, 256]
    - [105, 4.025]
  - - [4096, 128, 1, 512, 4096, 4096, 4096, 512]
    - [121, 6.66]
  - - [4096, 128, 1, 1024, 4096, 4096, 4096, 1024]
    - [123, 9.829]
  - - [4096, 128, 1, 2048, 4096, 4096, 4096, 2048]
    - [25, 10.606]
  - - [4096, 128, 1, 4096, 4096, 4096, 4096, 4096]
    - [97, 14.068]
  - - [4096, 128, 1, 8192, 4096, 4096, 4096, 8192]
    - [29, 17.684]
  - - [4096, 256, 1, 128, 4096, 4096, 4096, 128]
    - [65, 3.759]
  - - [4096, 256, 1, 256, 4096, 4096, 4096, 256]
    - [103, 6.54]
  - - [4096, 256, 1, 512, 4096, 4096, 4096, 512]
    - [102, 10.652]
  - - [4096, 256, 1, 1024, 4096, 4096, 4096, 1024]
    - [120, 14.54]
  - - [4096, 256, 1, 2048, 4096, 4096, 4096, 2048]
    - [32, 15.758]
  - - [4096, 256, 1, 4096, 4096, 4096, 4096, 4096]
    - [90, 19.443]
  - - [4096, 256, 1, 8192, 4096, 4096, 4096, 8192]
    - [89, 21.428]
  - - [4096, 512, 1, 128, 4096, 4096, 4096, 128]
    - [64, 5.829]
  - - [4096, 512, 1, 256, 4096, 4096, 4096, 256]
    - [94, 9.809]
  - - [4096, 512, 1, 512, 4096, 4096, 4096, 512]
    - [96, 14.328]
  - - [4096, 512, 1, 1024, 4096, 4096, 4096, 1024]
    - [112, 18.808]
  - - [4096, 512, 1, 2048, 4096, 4096, 4096, 2048]
    - [115, 21.211]
  - - [4096, 512, 1, 4096, 4096, 4096, 4096, 4096]
    - [116, 24.078]
  - - [4096, 512, 1, 8192, 4096, 4096, 4096, 8192]
    - [87, 26.403]
  - - [4096, 1024, 1, 128, 4096, 4096, 4096, 128]
    - [62, 7.776]
  - - [4096, 1024, 1, 256, 4096, 4096, 4096, 256]
    - [91, 11.907]
  - - [4096, 1024, 1, 512, 4096, 4096, 4096, 512]
    - [91, 17.638]
  - - [4096, 1024, 1, 1024, 4096, 4096, 4096, 1024]
    - [91, 21.871]
  - - [4096, 1024, 1, 2048, 4096, 4096, 4096, 2048]
    - [91, 25.917]
  - - [4096, 1024, 1, 4096, 4096, 4096, 4096, 4096]
    - [73, 27.279]
  - - [4096, 1024, 1, 8192, 4096, 4096, 4096, 8192]
    - [80, 28.433]
  - - [4096, 2048, 1, 128, 4096, 4096, 4096, 128]
    - [15, 7.899]
  - - [4096, 2048, 1, 256, 4096, 4096, 4096, 256]
    - [15, 13.179]
  - - [4096, 2048, 1, 512, 4096, 4096, 4096, 512]
    - [5, 18.91]
  - - [4096, 2048, 1, 1024, 4096, 4096, 4096, 1024]
    - [79, 24.602]
  - - [4096, 2048, 1, 2048, 4096, 4096, 4096, 2048]
    - [76, 30.528]
  - - [4096, 2048, 1, 4096, 4096, 4096, 4096, 4096]
    - [72, 29.705]
  - - [4096, 2048, 1, 8192, 4096, 4096, 4096, 8192]
    - [43, 31.826]
  - - [4096, 4096, 1, 128, 4096, 4096, 4096, 128]
    - [82, 8.425]
  - - [4096, 4096, 1, 256, 4096, 4096, 4096, 256]
    - [48, 13.716]
  - - [4096, 4096, 1, 512, 4096, 4096, 4096, 512]
    - [49, 20.28]
  - - [4096, 4096, 1, 1024, 4096, 4096, 4096, 1024]
    - [0, 27.031]
  - - [4096, 4096, 1, 2048, 4096, 4096, 4096, 2048]
    - [71, 28.421]
  - - [4096, 4096, 1, 4096, 4096, 4096, 4096, 4096]
    - [53, 30.291]
  - - [4096, 4096, 1, 8192, 4096, 4096, 4096, 8192]
    - [46, 32.961]
  - - [4096, 8192, 1, 128, 4096, 4096, 4096, 128]
    - [19, 8.144]
  - - [4096, 8192, 1, 256, 4096, 4096, 4096, 256]
    - [82, 12.684]
  - - [4096, 8192, 1, 512, 4096, 4096, 4096, 512]
    - [90, 17.661]
  - - [4096, 8192, 1, 1024, 4096, 4096, 4096, 1024]
    - [70, 22.952]
  - - [4096, 8192, 1, 2048, 4096, 4096, 4096, 2048]
    - [78, 28.136]
  - - [4096, 8192, 1, 4096, 4096, 4096, 4096, 4096]
    - [43, 32.346]
  - - [4096, 8192, 1, 8192, 4096, 4096, 4096, 8192]
    - [52, 35.548]
  - - [8192, 128, 1, 128, 8192, 8192, 8192, 128]
    - [99, 3.752]
  - - [8192, 128, 1, 256, 8192, 8192, 8192, 256]
    - [102, 6.585]
  - - [8192, 128, 1, 512, 8192, 8192, 8192, 512]
    - [102, 10.63]
  - - [8192, 128, 1, 1024, 8192, 8192, 8192, 1024]
    - [120, 14.479]
  - - [8192, 128, 1, 2048, 8192, 8192, 8192, 2048]
    - [32, 15.071]
  - - [8192, 128, 1, 4096, 8192, 8192, 8192, 4096]
    - [30, 18.079]
  - - [8192, 128, 1, 8192, 8192, 8192, 8192, 8192]
    - [18, 21.461]
  - - [8192, 256, 1, 128, 8192, 8192, 8192, 128]
    - [63, 5.783]
  - - [8192, 256, 1, 256, 8192, 8192, 8192, 256]
    - [94, 9.782]
  - - [8192, 256, 1, 512, 8192, 8192, 8192, 512]
    - [98, 14.369]
  - - [8192, 256, 1, 1024, 8192, 8192, 8192, 1024]
    - [112, 18.72]
  - - [8192, 256, 1, 2048, 8192, 8192, 8192, 2048]
    - [116, 20.337]
  - - [8192, 256, 1, 4096, 8192, 8192, 8192, 4096]
    - [112, 22.979]
  - - [8192, 256, 1, 8192, 8192, 8192, 8192, 8192]
    - [19, 25.923]
  - - [8192, 512, 1, 128, 8192, 8192, 8192, 128]
    - [61, 8.056]
  - - [8192, 512, 1, 256, 8192, 8192, 8192, 256]
    - [61, 12.162]
  - - [8192, 512, 1, 512, 8192, 8192, 8192, 512]
    - [89, 17.023]
  - - [8192, 512, 1, 1024, 8192, 8192, 8192, 1024]
    - [91, 21.401]
  - - [8192, 512, 1, 2048, 8192, 8192, 8192, 2048]
    - [93, 25.837]
  - - [8192, 512, 1, 4096, 8192, 8192, 8192, 4096]
    - [73, 27.125]
  - - [8192, 512, 1, 8192, 8192, 8192, 8192, 8192]
    - [11, 29.319]
  - - [8192, 1024, 1, 128, 8192, 8192, 8192, 128]
    - [13, 7.873]
  - - [8192, 1024, 1, 256, 8192, 8192, 8192, 256]
    - [13, 13.078]
  - - [8192, 1024, 1, 512, 8192, 8192, 8192, 512]
    - [81, 18.654]
  - - [8192, 1024, 1, 1024, 8192, 8192, 8192, 1024]
    - [81, 24.545]
  - - [8192, 1024, 1, 2048, 8192, 8192, 8192, 2048]
    - [77, 30.774]
  - - [8192, 1024, 1, 4096, 8192, 8192, 8192, 4096]
    - [72, 29.614]
  - - [8192, 1024, 1, 8192, 8192, 8192, 8192, 8192]
    - [6, 31.923]
  - - [8192, 2048, 1, 128, 8192, 8192, 8192, 128]
    - [13, 8.514]
  - - [8192, 2048, 1, 256, 8192, 8192, 8192, 256]
    - [3, 13.529]
  - - [8192, 2048, 1, 512, 8192, 8192, 8192, 512]
    - [52, 19.943]
  - - [8192, 2048, 1, 1024, 8192, 8192, 8192, 1024]
    - [54, 26.948]
  - - [8192, 2048, 1, 2048, 8192, 8192, 8192, 2048]
    - [73, 28.453]
  - - [8192, 2048, 1, 4096, 8192, 8192, 8192, 4096]
    - [69, 31.191]
  - - [8192, 2048, 1, 8192, 8192, 8192, 8192, 8192]
    - [46, 34.055]
  - - [8192, 4096, 1, 128, 8192, 8192, 8192, 128]
    - [21, 8.392]
  - - [8192, 4096, 1, 256, 8192, 8192, 8192, 256]
    - [93, 12.916]
  - - [8192, 4096, 1, 512, 8192, 8192, 8192, 512]
    - [93, 17.477]
  - - [8192, 4096, 1, 1024, 8192, 8192, 8192, 1024]
    - [43, 23.482]
  - - [8192, 4096, 1, 2048, 8192, 8192, 8192, 2048]
    - [44, 28.647]
  - - [8192, 4096, 1, 4096, 8192, 8192, 8192, 4096]
    - [43, 32.484]
  - - [8192, 4096, 1, 8192, 8192, 8192, 8192, 8192]
    - [47, 35.714]
  - - [8192, 8192, 1, 128, 8192, 8192, 8192, 128]
    - [16, 7.103]
  - - [8192, 8192, 1, 256, 8192, 8192, 8192, 256]
    - [20, 11.825]
  - - [8192, 8192, 1, 512, 8192, 8192, 8192, 512]
    - [85, 17.503]
  - - [8192, 8192, 1, 1024, 8192, 8192, 8192, 1024]
    - [50, 24.294]
  - - [8192, 8192, 1, 2048, 8192, 8192, 8192, 2048]
    - [78, 30.684]
  - - [8192, 8192, 1, 4096, 8192, 8192, 8192, 4096]
    - [45, 34.593]
  - - [8192, 8192, 1, 8192, 8192, 8192, 8192, 8192]
    - [46, 36.633]
  - - [1, 1, 1, 32, 1, 1, 1, 32]
    - [126, 0.0]
- null
- null
- ExperimentalStreamK
- GridBased
