library/src/amd_detail/rocblaslt/src/Tensile/Logic/asm_full/aquavanjaram/gfx942/StreamK/aquavanjaram942_Cijk_Ailk_Bljk_HHS_BH_UserArgs.yaml
- {MinimumRequiredVersion: 4.33.0}
- aquavanjaram942
- gfx942
- [Device 0049, Device 0050]
    SolutionIndex: 0
    SolutionNameMin: Cijk_Ailk_Bljk_HHS_BH_UserArgs_MT256x256x32_MI16x16x1_SN_LDSB1_CLR1_GSU0_GSUC0_GSUWGMRR0_K1_LBSPPA2048_LBSPPB128_LPA0_MIWT8_8_PLR1_SU32_SUM0_SUS256_SKXCCM0_VWA8_VWB2_WGM1_WGMXCC1_WGMXCCGn1
    SolutionIndex: 1
    SolutionNameMin: Cijk_Ailk_Bljk_HHS_BH_UserArgs_MT256x256x32_MI16x16x1_SN_LDSB1_CLR1_GSU0_GSUC0_GSUWGMRR0_K1_LBSPPA2048_LBSPPB128_LPA0_MIWT8_8_PLR1_SU32_SUM0_SUS256_SKXCCM0_VWA8_VWB1_WGM4_WGMXCC1_WGMXCCGn1
    SolutionIndex: 2
    SolutionNameMin: Cijk_Ailk_Bljk_HHS_BH_UserArgs_MT256x256x32_MI16x16x1_SN_LDSB1_CLR1_GSU0_GSUC0_GSUWGMRR0_K1_LBSPPA2048_LBSPPB128_LPA0_MIWT8_8_PLR1_SU32_SUM0_SUS256_SKXCCM0_VWA4_VWB2_WGM4_WGMXCC1_WGMXCCGn1
    SolutionIndex: 3
    SolutionNameMin: Cijk_Ailk_Bljk_HHS_BH_UserArgs_MT256x256x32_MI16x16x1_SN_LDSB1_CLR1_GSU0_GSUC0_GSUWGMRR0_K1_LBSPPA2048_LBSPPB128_LPA0_MIWT8_8_PLR1_SU32_SUM0_SUS256_SKXCCM0_VWA8_VWB2_WGM4_WGMXCC1_WGMXCCGn1
    SolutionIndex: 4
    SolutionNameMin: Cijk_Ailk_Bljk_HHS_BH_UserArgs_MT256x128x32_MI16x16x1_SN_LDSB1_CLR1_GSU0_GSUC0_GSUWGMRR0_K1_LBSPPA2048_LBSPPB128_LPA0_MIWT8_4_PLR1_SU32_SUM0_SUS256_SKXCCM0_VWA8_VWB1_WGM8_WGMXCC1_WGMXCCGn1
    SolutionIndex: 5
    SolutionNameMin: Cijk_Ailk_Bljk_HHS_BH_UserArgs_MT128x256x64_MI16x16x1_SN_LDSB1_CLR1_GSU0_GSUC0_GSUWGMRR0_K1_LBSPPA2048_LBSPPB256_LPA0_MIWT4_8_PLR1_SU32_SUM0_SUS256_SKXCCM0_VWA4_VWB2_WGM1_WGMXCC1_WGMXCCGn1
    SolutionIndex: 6
    SolutionNameMin: Cijk_Ailk_Bljk_HHS_BH_UserArgs_MT128x256x64_MI16x16x1_SN_LDSB1_CLR1_GSU0_GSUC0_GSUWGMRR0_K1_LBSPPA2048_LBSPPB1024_LPA0_MIWT4_8_PLR1_SU32_SUM0_SUS256_SKXCCM0_VWA4_VWB8_WGM1_WGMXCC1_WGMXCCGn1
    SolutionIndex: 7
    SolutionNameMin: Cijk_Ailk_Bljk_HHS_BH_UserArgs_MT128x256x64_MI16x16x1_SN_LDSB1_CLR1_GSU0_GSUC0_GSUWGMRR0_K1_LBSPPA2048_LBSPPB128_LPA32_MIWT4_8_PLR1_SU32_SUM0_SUS256_SKXCCM0_VWA2_VWB1_WGM4_WGMXCC1_WGMXCCGn1
    SolutionIndex: 8
    SolutionNameMin: Cijk_Ailk_Bljk_HHS_BH_UserArgs_MT128x256x64_MI16x16x1_SN_LDSB1_CLR1_GSU0_GSUC0_GSUWGMRR0_K1_LBSPPA2048_LBSPPB256_LPA0_MIWT4_8_PLR1_SU32_SUM0_SUS256_SKXCCM0_VWA4_VWB2_WGM4_WGMXCC1_WGMXCCGn1
    SolutionIndex: 9
    SolutionNameMin: Cijk_Ailk_Bljk_HHS_BH_UserArgs_MT128x256x64_MI16x16x1_SN_LDSB1_CLR1_GSU0_GSUC0_GSUWGMRR0_K1_LBSPPA2048_LBSPPB1024_LPA0_MIWT4_8_PLR1_SU32_SUM0_SUS256_SKXCCM0_VWA4_VWB8_WGM4_WGMXCC1_WGMXCCGn1
    SolutionIndex: 10
    SolutionNameMin: Cijk_Ailk_Bljk_HHS_BH_UserArgs_MT128x256x64_MI16x16x1_SN_LDSB1_CLR1_GSU0_GSUC0_GSUWGMRR0_K1_LBSPPA2048_LBSPPB128_LPA32_MIWT4_8_PLR1_SU32_SUM0_SUS256_SKXCCM0_VWA2_VWB1_WGM8_WGMXCC1_WGMXCCGn1
    SolutionIndex: 11
    SolutionNameMin: Cijk_Ailk_Bljk_HHS_BH_UserArgs_MT128x256x64_MI16x16x1_SN_LDSB1_CLR1_GSU0_GSUC0_GSUWGMRR0_K1_LBSPPA2048_LBSPPB256_LPA0_MIWT4_8_PLR1_SU32_SUM0_SUS256_SKXCCM0_VWA4_VWB2_WGM8_WGMXCC1_WGMXCCGn1
    SolutionIndex: 12
    SolutionNameMin: Cijk_Ailk_Bljk_HHS_BH_UserArgs_MT256x128x64_MI16x16x1_SN_LDSB1_CLR1_GSU0_GSUC0_GSUWGMRR0_K1_LBSPPA4096_LBSPPB256_LPA0_MIWT8_4_PLR1_SU32_SUM0_SUS256_SKXCCM0_VWA4_VWB2_WGM4_WGMXCC1_WGMXCCGn1
    SolutionIndex: 13
    SolutionNameMin: Cijk_Ailk_Bljk_HHS_BH_UserArgs_MT256x128x64_MI16x16x1_SN_LDSB1_CLR1_GSU0_GSUC0_GSUWGMRR0_K1_LBSPPA4096_LBSPPB128_LPA0_MIWT8_4_PLR1_SU32_SUM0_SUS256_SKXCCM0_VWA4_VWB1_WGM8_WGMXCC1_WGMXCCGn1
    SolutionIndex: 14
    SolutionNameMin: Cijk_Ailk_Bljk_HHS_BH_UserArgs_MT256x128x64_MI16x16x1_SN_LDSB1_CLR1_GSU0_GSUC0_GSUWGMRR0_K1_LBSPPA4096_LBSPPB256_LPA0_MIWT8_4_PLR1_SU32_SUM0_SUS256_SKXCCM0_VWA4_VWB2_WGM8_WGMXCC1_WGMXCCGn1
    SolutionIndex: 15
    SolutionNameMin: Cijk_Ailk_Bljk_HHS_BH_UserArgs_MT128x128x64_MI16x16x1_SN_LDSB1_CLR1_GSU0_GSUC0_GSUWGMRR0_K1_LBSPPA2048_LBSPPB128_LPA0_MIWT4_4_PLR1_SU32_SUM0_SUS256_SKXCCM0_VWA4_VWB1_WGM1_WGMXCC1_WGMXCCGn1
    SolutionIndex: 16
    SolutionNameMin: Cijk_Ailk_Bljk_HHS_BH_UserArgs_MT128x128x64_MI16x16x1_SN_LDSB1_CLR1_GSU0_GSUC0_GSUWGMRR0_K1_LBSPPA2048_LBSPPB256_LPA0_MIWT4_4_PLR1_SU32_SUM0_SUS256_SKXCCM0_VWA4_VWB2_WGM1_WGMXCC1_WGMXCCGn1
    SolutionIndex: 17
    SolutionNameMin: Cijk_Ailk_Bljk_HHS_BH_UserArgs_MT128x128x64_MI16x16x1_SN_LDSB1_CLR1_GSU0_GSUC0_GSUWGMRR0_K1_LBSPPA2048_LBSPPB512_LPA0_MIWT4_4_PLR1_SU32_SUM0_SUS256_SKXCCM0_VWA4_VWB4_WGM1_WGMXCC1_WGMXCCGn1
    SolutionIndex: 18
    SolutionNameMin: Cijk_Ailk_Bljk_HHS_BH_UserArgs_MT64x128x64_MI16x16x1_SN_LDSB1_CLR1_GSU0_GSUC0_GSUWGMRR0_K1_LBSPPA1024_LBSPPB128_LPA32_MIWT2_4_PLR1_SU32_SUM0_SUS256_SKXCCM0_VWA2_VWB1_WGM1_WGMXCC1_WGMXCCGn1
    SolutionIndex: 19
    SolutionNameMin: Cijk_Ailk_Bljk_HHS_BH_UserArgs_MT64x128x64_MI16x16x1_SN_LDSB1_CLR1_GSU0_GSUC0_GSUWGMRR0_K1_LBSPPA1024_LBSPPB256_LPA32_MIWT2_4_PLR1_SU32_SUM0_SUS256_SKXCCM0_VWA2_VWB2_WGM1_WGMXCC1_WGMXCCGn1
    SolutionIndex: 20
    SolutionNameMin: Cijk_Ailk_Bljk_HHS_BH_UserArgs_MT64x128x64_MI16x16x1_SN_LDSB1_CLR1_GSU0_GSUC0_GSUWGMRR0_K1_LBSPPA1024_LBSPPB512_LPA32_MIWT2_4_PLR1_SU32_SUM0_SUS256_SKXCCM0_VWA2_VWB4_WGM1_WGMXCC1_WGMXCCGn1
    SolutionIndex: 21
    SolutionNameMin: Cijk_Ailk_Bljk_HHS_BH_UserArgs_MT64x128x64_MI16x16x1_SN_LDSB1_CLR1_GSU0_GSUC0_GSUWGMRR0_K1_LBSPPA1024_LBSPPB128_LPA32_MIWT2_4_PLR1_SU32_SUM0_SUS256_SKXCCM0_VWA2_VWB1_WGM4_WGMXCC1_WGMXCCGn1
    SolutionIndex: 22
    SolutionNameMin: Cijk_Ailk_Bljk_HHS_BH_UserArgs_MT128x64x64_MI16x16x1_SN_LDSB1_CLR1_GSU0_GSUC0_GSUWGMRR0_K1_LBSPPA2048_LBSPPB128_LPA0_MIWT4_2_PLR1_SU32_SUM0_SUS256_SKXCCM0_VWA4_VWB1_WGM1_WGMXCC1_WGMXCCGn1
    SolutionIndex: 23
    SolutionNameMin: Cijk_Ailk_Bljk_HHS_BH_UserArgs_MT128x64x64_MI16x16x1_SN_LDSB1_CLR1_GSU0_GSUC0_GSUWGMRR0_K1_LBSPPA2048_LBSPPB256_LPA0_MIWT4_2_PLR1_SU32_SUM0_SUS256_SKXCCM0_VWA4_VWB2_WGM8_WGMXCC1_WGMXCCGn1
    SolutionIndex: 24
    SolutionNameMin: Cijk_Ailk_Bljk_HHS_BH_UserArgs_MT64x64x64_MI16x16x1_SN_LDSB1_CLR1_GSU0_GSUC0_GSUWGMRR0_K1_LBSPPA1024_LBSPPB128_LPA32_MIWT2_2_PLR1_SU32_SUM0_SUS256_SKXCCM0_VWA2_VWB1_WGM1_WGMXCC1_WGMXCCGn1
    SolutionIndex: 25
    SolutionNameMin: Cijk_Ailk_Bljk_HHS_BH_UserArgs_MT64x64x64_MI16x16x1_SN_LDSB1_CLR1_GSU0_GSUC0_GSUWGMRR0_K1_LBSPPA1024_LBSPPB256_LPA32_MIWT2_2_PLR1_SU32_SUM0_SUS256_SKXCCM0_VWA2_VWB2_WGM1_WGMXCC1_WGMXCCGn1
    SolutionIndex: 26
    SolutionNameMin: Cijk_Ailk_Bljk_HHS_BH_UserArgs_MT64x64x64_MI16x16x1_SN_LDSB1_CLR1_GSU0_GSUC0_GSUWGMRR0_K1_LBSPPA1024_LBSPPB128_LPA32_MIWT2_2_PLR1_SU32_SUM0_SUS256_SKXCCM0_VWA2_VWB1_WGM4_WGMXCC1_WGMXCCGn1
    SolutionIndex: 27
    SolutionNameMin: Cijk_Ailk_Bljk_HHS_BH_UserArgs_MT64x64x64_MI16x16x1_SN_LDSB1_CLR1_GSU0_GSUC0_GSUWGMRR0_K1_LBSPPA1024_LBSPPB256_LPA32_MIWT2_2_PLR1_SU32_SUM0_SUS256_SKXCCM0_VWA2_VWB2_WGM8_WGMXCC1_WGMXCCGn1
    SolutionIndex: 28
    SolutionNameMin: Cijk_Ailk_Bljk_HHS_BH_UserArgs_MT64x32x64_MI16x16x1_SN_LDSB0_CLR1_GSU0_GSUC0_GSUWGMRR0_K1_LBSPPA1024_LBSPPB128_LPA32_MIWT2_1_PLR1_SU32_SUM0_SUS256_SKXCCM0_VWA2_VWB1_WGM1_WGMXCC1_WGMXCCGn1
    SolutionIndex: 29
    SolutionNameMin: Cijk_Ailk_Bljk_HHS_BH_UserArgs_MT32x32x64_MI16x16x1_SN_LDSB0_CLR1_GSU0_GSUC0_GSUWGMRR0_K1_LBSPPA512_LBSPPB128_LPA16_MIWT1_1_PLR1_SU32_SUM0_SUS256_SKXCCM0_VWA1_VWB1_WGM1_WGMXCC1_WGMXCCGn1
    SolutionIndex: 30
    SolutionNameMin: Cijk_Ailk_Bljk_HHS_BH_UserArgs_MT64x128x128_MI16x16x1_SN_LDSB1_CLR1_GSU0_GSUC0_GSUWGMRR0_K1_LBSPPA1024_LBSPPB256_LPA32_MIWT2_4_PLR2_SU32_SUM0_SUS256_SKXCCM0_VWA2_VWB1_WGM1_WGMXCC1_WGMXCCGn1
    SolutionIndex: 31
    SolutionNameMin: Cijk_Ailk_Bljk_HHS_BH_UserArgs_MT64x128x128_MI16x16x1_SN_LDSB1_CLR1_GSU0_GSUC0_GSUWGMRR0_K1_LBSPPA1024_LBSPPB256_LPA32_MIWT2_4_PLR2_SU32_SUM0_SUS256_SKXCCM0_VWA2_VWB1_WGM4_WGMXCC1_WGMXCCGn1
    SolutionIndex: 32
    SolutionNameMin: Cijk_Ailk_Bljk_HHS_BH_UserArgs_MT64x128x128_MI16x16x1_SN_LDSB1_CLR1_GSU0_GSUC0_GSUWGMRR0_K1_LBSPPA1024_LBSPPB1024_LPA32_MIWT2_4_PLR2_SU32_SUM0_SUS256_SKXCCM0_VWA2_VWB4_WGM4_WGMXCC1_WGMXCCGn1
    SolutionIndex: 33
    SolutionNameMin: Cijk_Ailk_Bljk_HHS_BH_UserArgs_MT64x128x128_MI16x16x1_SN_LDSB1_CLR1_GSU0_GSUC0_GSUWGMRR0_K1_LBSPPA1024_LBSPPB1024_LPA32_MIWT2_4_PLR2_SU32_SUM0_SUS256_SKXCCM0_VWA2_VWB4_WGM8_WGMXCC1_WGMXCCGn1
    SolutionIndex: 34
    SolutionNameMin: Cijk_Ailk_Bljk_HHS_BH_UserArgs_MT128x64x128_MI16x16x1_SN_LDSB1_CLR1_GSU0_GSUC0_GSUWGMRR0_K1_LBSPPA2048_LBSPPB512_LPA0_MIWT4_2_PLR1_SU32_SUM0_SUS256_SKXCCM0_VWA4_VWB2_WGM1_WGMXCC1_WGMXCCGn1
    SolutionIndex: 35
    SolutionNameMin: Cijk_Ailk_Bljk_HHS_BH_UserArgs_MT128x64x128_MI16x16x1_SN_LDSB1_CLR1_GSU0_GSUC0_GSUWGMRR0_K1_LBSPPA2048_LBSPPB512_LPA0_MIWT4_2_PLR2_SU32_SUM0_SUS256_SKXCCM0_VWA4_VWB2_WGM1_WGMXCC1_WGMXCCGn1
    SolutionIndex: 36
    SolutionNameMin: Cijk_Ailk_Bljk_HHS_BH_UserArgs_MT128x64x128_MI16x16x1_SN_LDSB1_CLR1_GSU0_GSUC0_GSUWGMRR0_K1_LBSPPA2048_LBSPPB256_LPA0_MIWT4_2_PLR1_SU32_SUM0_SUS256_SKXCCM0_VWA4_VWB1_WGM4_WGMXCC1_WGMXCCGn1
    SolutionIndex: 37
    SolutionNameMin: Cijk_Ailk_Bljk_HHS_BH_UserArgs_MT128x64x128_MI16x16x1_SN_LDSB1_CLR1_GSU0_GSUC0_GSUWGMRR0_K1_LBSPPA2048_LBSPPB256_LPA0_MIWT4_2_PLR2_SU32_SUM0_SUS256_SKXCCM0_VWA4_VWB1_WGM4_WGMXCC1_WGMXCCGn1
    SolutionIndex: 38
    SolutionNameMin: Cijk_Ailk_Bljk_HHS_BH_UserArgs_MT128x64x128_MI16x16x1_SN_LDSB1_CLR1_GSU0_GSUC0_GSUWGMRR0_K1_LBSPPA2048_LBSPPB256_LPA0_MIWT4_2_PLR2_SU32_SUM0_SUS256_SKXCCM0_VWA4_VWB1_WGM8_WGMXCC1_WGMXCCGn1
    SolutionIndex: 39
    SolutionNameMin: Cijk_Ailk_Bljk_HHS_BH_UserArgs_MT128x64x128_MI16x16x1_SN_LDSB1_CLR1_GSU0_GSUC0_GSUWGMRR0_K1_LBSPPA2048_LBSPPB512_LPA0_MIWT4_2_PLR2_SU32_SUM0_SUS256_SKXCCM0_VWA4_VWB2_WGM8_WGMXCC1_WGMXCCGn1
    SolutionIndex: 40
    SolutionNameMin: Cijk_Ailk_Bljk_HHS_BH_UserArgs_MT64x64x128_MI16x16x1_SN_LDSB1_CLR1_GSU0_GSUC0_GSUWGMRR0_K1_LBSPPA1024_LBSPPB256_LPA32_MIWT2_2_PLR2_SU32_SUM0_SUS256_SKXCCM0_VWA2_VWB1_WGM1_WGMXCC1_WGMXCCGn1
    SolutionIndex: 41
    SolutionNameMin: Cijk_Ailk_Bljk_HHS_BH_UserArgs_MT64x64x128_MI16x16x1_SN_LDSB1_CLR1_GSU0_GSUC0_GSUWGMRR0_K1_LBSPPA1024_LBSPPB512_LPA32_MIWT2_2_PLR2_SU32_SUM0_SUS256_SKXCCM0_VWA2_VWB2_WGM1_WGMXCC1_WGMXCCGn1
    SolutionIndex: 42
    SolutionNameMin: Cijk_Ailk_Bljk_HHS_BH_UserArgs_MT64x64x128_MI16x16x1_SN_LDSB1_CLR1_GSU0_GSUC0_GSUWGMRR0_K1_LBSPPA1024_LBSPPB256_LPA32_MIWT2_2_PLR2_SU32_SUM0_SUS256_SKXCCM0_VWA2_VWB1_WGM4_WGMXCC1_WGMXCCGn1
    SolutionIndex: 43
    SolutionNameMin: Cijk_Ailk_Bljk_HHS_BH_UserArgs_MT64x64x128_MI16x16x1_SN_LDSB1_CLR1_GSU0_GSUC0_GSUWGMRR0_K1_LBSPPA1024_LBSPPB512_LPA32_MIWT2_2_PLR2_SU32_SUM0_SUS256_SKXCCM0_VWA2_VWB2_WGM4_WGMXCC1_WGMXCCGn1
    SolutionIndex: 44
    SolutionNameMin: Cijk_Ailk_Bljk_HHS_BH_UserArgs_MT64x64x128_MI16x16x1_SN_LDSB1_CLR1_GSU0_GSUC0_GSUWGMRR0_K1_LBSPPA1024_LBSPPB256_LPA32_MIWT2_2_PLR2_SU32_SUM0_SUS256_SKXCCM0_VWA2_VWB1_WGM8_WGMXCC1_WGMXCCGn1
    SolutionIndex: 45
    SolutionNameMin: Cijk_Ailk_Bljk_HHS_BH_UserArgs_MT64x64x128_MI16x16x1_SN_LDSB1_CLR1_GSU0_GSUC0_GSUWGMRR0_K1_LBSPPA1024_LBSPPB512_LPA32_MIWT2_2_PLR2_SU32_SUM0_SUS256_SKXCCM0_VWA2_VWB2_WGM8_WGMXCC1_WGMXCCGn1
    SolutionIndex: 46
    SolutionNameMin: Cijk_Ailk_Bljk_HHS_BH_UserArgs_MT32x64x128_MI16x16x1_SN_LDSB1_CLR1_GSU0_GSUC0_GSUWGMRR0_K1_LBSPPA512_LBSPPB256_LPA16_MIWT1_2_PLR2_SU32_SUM0_SUS256_SKXCCM0_VWA1_VWB1_WGM1_WGMXCC1_WGMXCCGn1
    SolutionIndex: 47
    SolutionNameMin: Cijk_Ailk_Bljk_HHS_BH_UserArgs_MT64x32x128_MI16x16x1_SN_LDSB1_CLR1_GSU0_GSUC0_GSUWGMRR0_K1_LBSPPA1024_LBSPPB256_LPA32_MIWT2_1_PLR1_SU32_SUM0_SUS256_SKXCCM0_VWA2_VWB1_WGM1_WGMXCC1_WGMXCCGn1
    SolutionIndex: 48
    SolutionNameMin: Cijk_Ailk_Bljk_HHS_BH_UserArgs_MT64x32x128_MI16x16x1_SN_LDSB1_CLR1_GSU0_GSUC0_GSUWGMRR0_K1_LBSPPA1024_LBSPPB256_LPA32_MIWT2_1_PLR2_SU32_SUM0_SUS256_SKXCCM0_VWA2_VWB1_WGM1_WGMXCC1_WGMXCCGn1
    SolutionIndex: 49
    SolutionNameMin: Cijk_Ailk_Bljk_HHS_BH_UserArgs_MT64x32x128_MI16x16x1_SN_LDSB1_CLR1_GSU0_GSUC0_GSUWGMRR0_K1_LBSPPA1024_LBSPPB256_LPA32_MIWT2_1_PLR1_SU32_SUM0_SUS256_SKXCCM0_VWA2_VWB1_WGM4_WGMXCC1_WGMXCCGn1
    SolutionIndex: 50
    SolutionNameMin: Cijk_Ailk_Bljk_HHS_BH_UserArgs_MT32x32x128_MI16x16x1_SN_LDSB1_CLR1_GSU0_GSUC0_GSUWGMRR0_K1_LBSPPA512_LBSPPB256_LPA16_MIWT1_1_PLR1_SU32_SUM0_SUS256_SKXCCM0_VWA1_VWB1_WGM1_WGMXCC1_WGMXCCGn1
    SolutionIndex: 51
    SolutionNameMin: Cijk_Ailk_Bljk_HHS_BH_UserArgs_MT32x32x128_MI16x16x1_SN_LDSB1_CLR1_GSU0_GSUC0_GSUWGMRR0_K1_LBSPPA512_LBSPPB256_LPA16_MIWT1_1_PLR2_SU32_SUM0_SUS256_SKXCCM0_VWA1_VWB1_WGM1_WGMXCC1_WGMXCCGn1
    SolutionIndex: 52
    SolutionNameMin: Cijk_Ailk_Bljk_HHS_BH_UserArgs_MT256x256x32_MI16x16x1_SN_LDSB1_CLR1_GSU0_GSUC0_GSUWGMRR0_K1_LBSPPA2048_LBSPPB128_LPA0_MIWT8_8_PLR1_SU32_SUM0_SUS256_SKXCCM8_VWA4_VWB1_WGM1_WGMXCC1_WGMXCCGn1
    SolutionIndex: 53
    SolutionNameMin: Cijk_Ailk_Bljk_HHS_BH_UserArgs_MT256x256x32_MI16x16x1_SN_LDSB1_CLR1_GSU0_GSUC0_GSUWGMRR0_K1_LBSPPA2048_LBSPPB128_LPA0_MIWT8_8_PLR1_SU32_SUM0_SUS256_SKXCCM8_VWA8_VWB1_WGM1_WGMXCC1_WGMXCCGn1
    SolutionIndex: 54
    SolutionNameMin: Cijk_Ailk_Bljk_HHS_BH_UserArgs_MT256x256x32_MI16x16x1_SN_LDSB1_CLR1_GSU0_GSUC0_GSUWGMRR0_K1_LBSPPA2048_LBSPPB512_LPA0_MIWT8_8_PLR1_SU32_SUM0_SUS256_SKXCCM8_VWA4_VWB8_WGM1_WGMXCC1_WGMXCCGn1
    SolutionIndex: 55
    SolutionNameMin: Cijk_Ailk_Bljk_HHS_BH_UserArgs_MT256x256x32_MI16x16x1_SN_LDSB1_CLR1_GSU0_GSUC0_GSUWGMRR0_K1_LBSPPA2048_LBSPPB128_LPA32_MIWT8_8_PLR1_SU32_SUM0_SUS256_SKXCCM8_VWA2_VWB1_WGM4_WGMXCC1_WGMXCCGn1
    SolutionIndex: 56
    SolutionNameMin: Cijk_Ailk_Bljk_HHS_BH_UserArgs_MT256x256x32_MI16x16x1_SN_LDSB1_CLR1_GSU0_GSUC0_GSUWGMRR0_K1_LBSPPA2048_LBSPPB128_LPA0_MIWT8_8_PLR1_SU32_SUM0_SUS256_SKXCCM8_VWA4_VWB1_WGM4_WGMXCC1_WGMXCCGn1
    SolutionIndex: 57
    SolutionNameMin: Cijk_Ailk_Bljk_HHS_BH_UserArgs_MT256x256x32_MI16x16x1_SN_LDSB1_CLR1_GSU0_GSUC0_GSUWGMRR0_K1_LBSPPA2048_LBSPPB128_LPA0_MIWT8_8_PLR1_SU32_SUM0_SUS256_SKXCCM8_VWA8_VWB1_WGM4_WGMXCC1_WGMXCCGn1
    SolutionIndex: 58
    SolutionNameMin: Cijk_Ailk_Bljk_HHS_BH_UserArgs_MT256x256x32_MI16x16x1_SN_LDSB1_CLR1_GSU0_GSUC0_GSUWGMRR0_K1_LBSPPA2048_LBSPPB128_LPA0_MIWT8_8_PLR1_SU32_SUM0_SUS256_SKXCCM8_VWA4_VWB2_WGM4_WGMXCC1_WGMXCCGn1
    SolutionIndex: 59
    SolutionNameMin: Cijk_Ailk_Bljk_HHS_BH_UserArgs_MT256x256x32_MI16x16x1_SN_LDSB1_CLR1_GSU0_GSUC0_GSUWGMRR0_K1_LBSPPA2048_LBSPPB256_LPA0_MIWT8_8_PLR1_SU32_SUM0_SUS256_SKXCCM8_VWA8_VWB4_WGM4_WGMXCC1_WGMXCCGn1
    SolutionIndex: 60
    SolutionNameMin: Cijk_Ailk_Bljk_HHS_BH_UserArgs_MT256x256x32_MI16x16x1_SN_LDSB1_CLR1_GSU0_GSUC0_GSUWGMRR0_K1_LBSPPA2048_LBSPPB512_LPA32_MIWT8_8_PLR1_SU32_SUM0_SUS256_SKXCCM8_VWA2_VWB8_WGM4_WGMXCC1_WGMXCCGn1
    SolutionIndex: 61
    SolutionNameMin: Cijk_Ailk_Bljk_HHS_BH_UserArgs_MT256x256x32_MI16x16x1_SN_LDSB1_CLR1_GSU0_GSUC0_GSUWGMRR0_K1_LBSPPA2048_LBSPPB512_LPA0_MIWT8_8_PLR1_SU32_SUM0_SUS256_SKXCCM8_VWA8_VWB8_WGM4_WGMXCC1_WGMXCCGn1
    SolutionIndex: 62
    SolutionNameMin: Cijk_Ailk_Bljk_HHS_BH_UserArgs_MT256x256x32_MI16x16x1_SN_LDSB1_CLR1_GSU0_GSUC0_GSUWGMRR0_K1_LBSPPA2048_LBSPPB128_LPA0_MIWT8_8_PLR1_SU32_SUM0_SUS256_SKXCCM8_VWA8_VWB1_WGM8_WGMXCC1_WGMXCCGn1
    SolutionIndex: 63
    SolutionNameMin: Cijk_Ailk_Bljk_HHS_BH_UserArgs_MT256x256x32_MI16x16x1_SN_LDSB1_CLR1_GSU0_GSUC0_GSUWGMRR0_K1_LBSPPA2048_LBSPPB128_LPA0_MIWT8_8_PLR1_SU32_SUM0_SUS256_SKXCCM8_VWA4_VWB2_WGM8_WGMXCC1_WGMXCCGn1
    SolutionIndex: 64
    SolutionNameMin: Cijk_Ailk_Bljk_HHS_BH_UserArgs_MT256x256x32_MI16x16x1_SN_LDSB1_CLR1_GSU0_GSUC0_GSUWGMRR0_K1_LBSPPA2048_LBSPPB256_LPA0_MIWT8_8_PLR1_SU32_SUM0_SUS256_SKXCCM8_VWA4_VWB4_WGM8_WGMXCC1_WGMXCCGn1
    SolutionIndex: 65
    SolutionNameMin: Cijk_Ailk_Bljk_HHS_BH_UserArgs_MT256x256x32_MI16x16x1_SN_LDSB1_CLR1_GSU0_GSUC0_GSUWGMRR0_K1_LBSPPA2048_LBSPPB512_LPA0_MIWT8_8_PLR1_SU32_SUM0_SUS256_SKXCCM8_VWA4_VWB8_WGM8_WGMXCC1_WGMXCCGn1
    SolutionIndex: 66
    SolutionNameMin: Cijk_Ailk_Bljk_HHS_BH_UserArgs_MT256x256x32_MI16x16x1_SN_LDSB1_CLR1_GSU0_GSUC0_GSUWGMRR0_K1_LBSPPA2048_LBSPPB512_LPA0_MIWT8_8_PLR1_SU32_SUM0_SUS256_SKXCCM8_VWA8_VWB8_WGM8_WGMXCC1_WGMXCCGn1
    SolutionIndex: 67
    SolutionNameMin: Cijk_Ailk_Bljk_HHS_BH_UserArgs_MT128x256x32_MI16x16x1_SN_LDSB1_CLR1_GSU0_GSUC0_GSUWGMRR0_K1_LBSPPA1024_LBSPPB128_LPA32_MIWT4_8_PLR1_SU32_SUM0_SUS256_SKXCCM8_VWA2_VWB2_WGM4_WGMXCC1_WGMXCCGn1
    SolutionIndex: 68
    SolutionNameMin: Cijk_Ailk_Bljk_HHS_BH_UserArgs_MT256x128x32_MI16x16x1_SN_LDSB1_CLR1_GSU0_GSUC0_GSUWGMRR0_K1_LBSPPA2048_LBSPPB128_LPA0_MIWT8_4_PLR1_SU32_SUM0_SUS256_SKXCCM8_VWA8_VWB2_WGM1_WGMXCC1_WGMXCCGn1
    SolutionIndex: 69
    SolutionNameMin: Cijk_Ailk_Bljk_HHS_BH_UserArgs_MT256x128x32_MI16x16x1_SN_LDSB1_CLR1_GSU0_GSUC0_GSUWGMRR0_K1_LBSPPA2048_LBSPPB256_LPA0_MIWT8_4_PLR1_SU32_SUM0_SUS256_SKXCCM8_VWA8_VWB4_WGM1_WGMXCC1_WGMXCCGn1
    SolutionIndex: 70
    SolutionNameMin: Cijk_Ailk_Bljk_HHS_BH_UserArgs_MT256x128x32_MI16x16x1_SN_LDSB1_CLR1_GSU0_GSUC0_GSUWGMRR0_K1_LBSPPA2048_LBSPPB128_LPA0_MIWT8_4_PLR1_SU32_SUM0_SUS256_SKXCCM8_VWA8_VWB2_WGM8_WGMXCC1_WGMXCCGn1
    SolutionIndex: 71
    SolutionNameMin: Cijk_Ailk_Bljk_HHS_BH_UserArgs_MT128x64x32_MI16x16x1_SN_LDSB0_CLR1_GSU0_GSUC0_GSUWGMRR0_K1_LBSPPA1024_LBSPPB128_LPA32_MIWT4_2_PLR1_SU32_SUM0_SUS256_SKXCCM8_VWA2_VWB2_WGM1_WGMXCC1_WGMXCCGn1
    SolutionIndex: 72
    SolutionNameMin: Cijk_Ailk_Bljk_HHS_BH_UserArgs_MT128x64x32_MI16x16x1_SN_LDSB0_CLR1_GSU0_GSUC0_GSUWGMRR0_K1_LBSPPA1024_LBSPPB128_LPA0_MIWT4_2_PLR1_SU32_SUM0_SUS256_SKXCCM8_VWA4_VWB2_WGM1_WGMXCC1_WGMXCCGn1
    SolutionIndex: 73
    SolutionNameMin: Cijk_Ailk_Bljk_HHS_BH_UserArgs_MT32x32x32_MI16x16x1_SN_LDSB0_CLR1_GSU0_GSUC0_GSUWGMRR0_K1_LBSPPA256_LBSPPB128_LPA16_MIWT1_1_PLR1_SU32_SUM0_SUS256_SKXCCM8_VWA1_VWB1_WGM1_WGMXCC1_WGMXCCGn1
    SolutionIndex: 74
    SolutionNameMin: Cijk_Ailk_Bljk_HHS_BH_UserArgs_MT128x256x64_MI16x16x1_SN_LDSB1_CLR1_GSU0_GSUC0_GSUWGMRR0_K1_LBSPPA2048_LBSPPB128_LPA32_MIWT4_8_PLR1_SU32_SUM0_SUS256_SKXCCM8_VWA2_VWB1_WGM1_WGMXCC1_WGMXCCGn1
    SolutionIndex: 75
    SolutionNameMin: Cijk_Ailk_Bljk_HHS_BH_UserArgs_MT128x256x64_MI16x16x1_SN_LDSB1_CLR1_GSU0_GSUC0_GSUWGMRR0_K1_LBSPPA2048_LBSPPB128_LPA0_MIWT4_8_PLR1_SU32_SUM0_SUS256_SKXCCM8_VWA4_VWB1_WGM1_WGMXCC1_WGMXCCGn1
    SolutionIndex: 76
    SolutionNameMin: Cijk_Ailk_Bljk_HHS_BH_UserArgs_MT128x256x64_MI16x16x1_SN_LDSB1_CLR1_GSU0_GSUC0_GSUWGMRR0_K1_LBSPPA2048_LBSPPB256_LPA32_MIWT4_8_PLR1_SU32_SUM0_SUS256_SKXCCM8_VWA2_VWB2_WGM1_WGMXCC1_WGMXCCGn1
    SolutionIndex: 77
    SolutionNameMin: Cijk_Ailk_Bljk_HHS_BH_UserArgs_MT128x256x64_MI16x16x1_SN_LDSB1_CLR1_GSU0_GSUC0_GSUWGMRR0_K1_LBSPPA2048_LBSPPB256_LPA0_MIWT4_8_PLR1_SU32_SUM0_SUS256_SKXCCM8_VWA4_VWB2_WGM1_WGMXCC1_WGMXCCGn1
    SolutionIndex: 78
    SolutionNameMin: Cijk_Ailk_Bljk_HHS_BH_UserArgs_MT128x256x64_MI16x16x1_SN_LDSB1_CLR1_GSU0_GSUC0_GSUWGMRR0_K1_LBSPPA2048_LBSPPB512_LPA0_MIWT4_8_PLR1_SU32_SUM0_SUS256_SKXCCM8_VWA4_VWB4_WGM1_WGMXCC1_WGMXCCGn1
    SolutionIndex: 79
    SolutionNameMin: Cijk_Ailk_Bljk_HHS_BH_UserArgs_MT128x256x64_MI16x16x1_SN_LDSB1_CLR1_GSU0_GSUC0_GSUWGMRR0_K1_LBSPPA2048_LBSPPB1024_LPA32_MIWT4_8_PLR1_SU32_SUM0_SUS256_SKXCCM8_VWA2_VWB8_WGM1_WGMXCC1_WGMXCCGn1
    SolutionIndex: 80
    SolutionNameMin: Cijk_Ailk_Bljk_HHS_BH_UserArgs_MT128x256x64_MI16x16x1_SN_LDSB1_CLR1_GSU0_GSUC0_GSUWGMRR0_K1_LBSPPA2048_LBSPPB1024_LPA0_MIWT4_8_PLR1_SU32_SUM0_SUS256_SKXCCM8_VWA4_VWB8_WGM1_WGMXCC1_WGMXCCGn1
    SolutionIndex: 81
    SolutionNameMin: Cijk_Ailk_Bljk_HHS_BH_UserArgs_MT128x256x64_MI16x16x1_SN_LDSB1_CLR1_GSU0_GSUC0_GSUWGMRR0_K1_LBSPPA2048_LBSPPB128_LPA32_MIWT4_8_PLR1_SU32_SUM0_SUS256_SKXCCM8_VWA2_VWB1_WGM4_WGMXCC1_WGMXCCGn1
    SolutionIndex: 82
    SolutionNameMin: Cijk_Ailk_Bljk_HHS_BH_UserArgs_MT128x256x64_MI16x16x1_SN_LDSB1_CLR1_GSU0_GSUC0_GSUWGMRR0_K1_LBSPPA2048_LBSPPB128_LPA0_MIWT4_8_PLR1_SU32_SUM0_SUS256_SKXCCM8_VWA4_VWB1_WGM4_WGMXCC1_WGMXCCGn1
    SolutionIndex: 83
    SolutionNameMin: Cijk_Ailk_Bljk_HHS_BH_UserArgs_MT128x256x64_MI16x16x1_SN_LDSB1_CLR1_GSU0_GSUC0_GSUWGMRR0_K1_LBSPPA2048_LBSPPB256_LPA0_MIWT4_8_PLR1_SU32_SUM0_SUS256_SKXCCM8_VWA4_VWB2_WGM4_WGMXCC1_WGMXCCGn1
    SolutionIndex: 84
    SolutionNameMin: Cijk_Ailk_Bljk_HHS_BH_UserArgs_MT128x256x64_MI16x16x1_SN_LDSB1_CLR1_GSU0_GSUC0_GSUWGMRR0_K1_LBSPPA2048_LBSPPB512_LPA32_MIWT4_8_PLR1_SU32_SUM0_SUS256_SKXCCM8_VWA2_VWB4_WGM4_WGMXCC1_WGMXCCGn1
    SolutionIndex: 85
    SolutionNameMin: Cijk_Ailk_Bljk_HHS_BH_UserArgs_MT128x256x64_MI16x16x1_SN_LDSB1_CLR1_GSU0_GSUC0_GSUWGMRR0_K1_LBSPPA2048_LBSPPB1024_LPA32_MIWT4_8_PLR1_SU32_SUM0_SUS256_SKXCCM8_VWA2_VWB8_WGM4_WGMXCC1_WGMXCCGn1
    SolutionIndex: 86
    SolutionNameMin: Cijk_Ailk_Bljk_HHS_BH_UserArgs_MT128x256x64_MI16x16x1_SN_LDSB1_CLR1_GSU0_GSUC0_GSUWGMRR0_K1_LBSPPA2048_LBSPPB1024_LPA0_MIWT4_8_PLR1_SU32_SUM0_SUS256_SKXCCM8_VWA4_VWB8_WGM4_WGMXCC1_WGMXCCGn1
    SolutionIndex: 87
    SolutionNameMin: Cijk_Ailk_Bljk_HHS_BH_UserArgs_MT128x256x64_MI16x16x1_SN_LDSB1_CLR1_GSU0_GSUC0_GSUWGMRR0_K1_LBSPPA2048_LBSPPB128_LPA32_MIWT4_8_PLR1_SU32_SUM0_SUS256_SKXCCM8_VWA2_VWB1_WGM8_WGMXCC1_WGMXCCGn1
    SolutionIndex: 88
    SolutionNameMin: Cijk_Ailk_Bljk_HHS_BH_UserArgs_MT128x256x64_MI16x16x1_SN_LDSB1_CLR1_GSU0_GSUC0_GSUWGMRR0_K1_LBSPPA2048_LBSPPB1024_LPA0_MIWT4_8_PLR1_SU32_SUM0_SUS256_SKXCCM8_VWA4_VWB8_WGM8_WGMXCC1_WGMXCCGn1
    SolutionIndex: 89
    SolutionNameMin: Cijk_Ailk_Bljk_HHS_BH_UserArgs_MT256x128x64_MI16x16x1_SN_LDSB1_CLR1_GSU0_GSUC0_GSUWGMRR0_K1_LBSPPA4096_LBSPPB128_LPA0_MIWT8_4_PLR1_SU32_SUM0_SUS256_SKXCCM8_VWA4_VWB1_WGM1_WGMXCC1_WGMXCCGn1
    SolutionIndex: 90
    SolutionNameMin: Cijk_Ailk_Bljk_HHS_BH_UserArgs_MT256x128x64_MI16x16x1_SN_LDSB1_CLR1_GSU0_GSUC0_GSUWGMRR0_K1_LBSPPA4096_LBSPPB128_LPA0_MIWT8_4_PLR1_SU32_SUM0_SUS256_SKXCCM8_VWA4_VWB1_WGM4_WGMXCC1_WGMXCCGn1
    SolutionIndex: 91
    SolutionNameMin: Cijk_Ailk_Bljk_HHS_BH_UserArgs_MT256x128x64_MI16x16x1_SN_LDSB1_CLR1_GSU0_GSUC0_GSUWGMRR0_K1_LBSPPA4096_LBSPPB128_LPA32_MIWT8_4_PLR1_SU32_SUM0_SUS256_SKXCCM8_VWA2_VWB1_WGM8_WGMXCC1_WGMXCCGn1
    SolutionIndex: 92
    SolutionNameMin: Cijk_Ailk_Bljk_HHS_BH_UserArgs_MT256x128x64_MI16x16x1_SN_LDSB1_CLR1_GSU0_GSUC0_GSUWGMRR0_K1_LBSPPA4096_LBSPPB128_LPA0_MIWT8_4_PLR1_SU32_SUM0_SUS256_SKXCCM8_VWA4_VWB1_WGM8_WGMXCC1_WGMXCCGn1
    SolutionIndex: 93
    SolutionNameMin: Cijk_Ailk_Bljk_HHS_BH_UserArgs_MT256x128x64_MI16x16x1_SN_LDSB1_CLR1_GSU0_GSUC0_GSUWGMRR0_K1_LBSPPA4096_LBSPPB512_LPA0_MIWT8_4_PLR1_SU32_SUM0_SUS256_SKXCCM8_VWA4_VWB4_WGM8_WGMXCC1_WGMXCCGn1
    SolutionIndex: 94
    SolutionNameMin: Cijk_Ailk_Bljk_HHS_BH_UserArgs_MT128x128x64_MI16x16x1_SN_LDSB1_CLR1_GSU0_GSUC0_GSUWGMRR0_K1_LBSPPA2048_LBSPPB128_LPA32_MIWT4_4_PLR1_SU32_SUM0_SUS256_SKXCCM8_VWA2_VWB1_WGM1_WGMXCC1_WGMXCCGn1
    SolutionIndex: 95
    SolutionNameMin: Cijk_Ailk_Bljk_HHS_BH_UserArgs_MT128x128x64_MI16x16x1_SN_LDSB1_CLR1_GSU0_GSUC0_GSUWGMRR0_K1_LBSPPA2048_LBSPPB128_LPA0_MIWT4_4_PLR1_SU32_SUM0_SUS256_SKXCCM8_VWA4_VWB1_WGM1_WGMXCC1_WGMXCCGn1
    SolutionIndex: 96
    SolutionNameMin: Cijk_Ailk_Bljk_HHS_BH_UserArgs_MT128x128x64_MI16x16x1_SN_LDSB1_CLR1_GSU0_GSUC0_GSUWGMRR0_K1_LBSPPA2048_LBSPPB256_LPA32_MIWT4_4_PLR1_SU32_SUM0_SUS256_SKXCCM8_VWA2_VWB2_WGM1_WGMXCC1_WGMXCCGn1
    SolutionIndex: 97
    SolutionNameMin: Cijk_Ailk_Bljk_HHS_BH_UserArgs_MT128x128x64_MI16x16x1_SN_LDSB1_CLR1_GSU0_GSUC0_GSUWGMRR0_K1_LBSPPA2048_LBSPPB256_LPA0_MIWT4_4_PLR1_SU32_SUM0_SUS256_SKXCCM8_VWA4_VWB2_WGM1_WGMXCC1_WGMXCCGn1
    SolutionIndex: 98
    SolutionNameMin: Cijk_Ailk_Bljk_HHS_BH_UserArgs_MT128x128x64_MI16x16x1_SN_LDSB1_CLR1_GSU0_GSUC0_GSUWGMRR0_K1_LBSPPA2048_LBSPPB512_LPA32_MIWT4_4_PLR1_SU32_SUM0_SUS256_SKXCCM8_VWA2_VWB4_WGM1_WGMXCC1_WGMXCCGn1
    SolutionIndex: 99
    SolutionNameMin: Cijk_Ailk_Bljk_HHS_BH_UserArgs_MT128x128x64_MI16x16x1_SN_LDSB1_CLR1_GSU0_GSUC0_GSUWGMRR0_K1_LBSPPA2048_LBSPPB512_LPA0_MIWT4_4_PLR1_SU32_SUM0_SUS256_SKXCCM8_VWA4_VWB4_WGM1_WGMXCC1_WGMXCCGn1
    SolutionIndex: 100
    SolutionNameMin: Cijk_Ailk_Bljk_HHS_BH_UserArgs_MT128x128x64_MI16x16x1_SN_LDSB1_CLR1_GSU0_GSUC0_GSUWGMRR0_K1_LBSPPA2048_LBSPPB128_LPA32_MIWT4_4_PLR1_SU32_SUM0_SUS256_SKXCCM8_VWA2_VWB1_WGM4_WGMXCC1_WGMXCCGn1
    SolutionIndex: 101
    SolutionNameMin: Cijk_Ailk_Bljk_HHS_BH_UserArgs_MT128x128x64_MI16x16x1_SN_LDSB1_CLR1_GSU0_GSUC0_GSUWGMRR0_K1_LBSPPA2048_LBSPPB128_LPA0_MIWT4_4_PLR1_SU32_SUM0_SUS256_SKXCCM8_VWA4_VWB1_WGM4_WGMXCC1_WGMXCCGn1
    SolutionIndex: 102
    SolutionNameMin: Cijk_Ailk_Bljk_HHS_BH_UserArgs_MT128x128x64_MI16x16x1_SN_LDSB1_CLR1_GSU0_GSUC0_GSUWGMRR0_K1_LBSPPA2048_LBSPPB256_LPA32_MIWT4_4_PLR1_SU32_SUM0_SUS256_SKXCCM8_VWA2_VWB2_WGM4_WGMXCC1_WGMXCCGn1
    SolutionIndex: 103
    SolutionNameMin: Cijk_Ailk_Bljk_HHS_BH_UserArgs_MT128x128x64_MI16x16x1_SN_LDSB1_CLR1_GSU0_GSUC0_GSUWGMRR0_K1_LBSPPA2048_LBSPPB256_LPA0_MIWT4_4_PLR1_SU32_SUM0_SUS256_SKXCCM8_VWA4_VWB2_WGM4_WGMXCC1_WGMXCCGn1
    SolutionIndex: 104
    SolutionNameMin: Cijk_Ailk_Bljk_HHS_BH_UserArgs_MT128x128x64_MI16x16x1_SN_LDSB1_CLR1_GSU0_GSUC0_GSUWGMRR0_K1_LBSPPA2048_LBSPPB512_LPA32_MIWT4_4_PLR1_SU32_SUM0_SUS256_SKXCCM8_VWA2_VWB4_WGM4_WGMXCC1_WGMXCCGn1
    SolutionIndex: 105
    SolutionNameMin: Cijk_Ailk_Bljk_HHS_BH_UserArgs_MT128x128x64_MI16x16x1_SN_LDSB1_CLR1_GSU0_GSUC0_GSUWGMRR0_K1_LBSPPA2048_LBSPPB512_LPA0_MIWT4_4_PLR1_SU32_SUM0_SUS256_SKXCCM8_VWA4_VWB4_WGM4_WGMXCC1_WGMXCCGn1
    SolutionIndex: 106
    SolutionNameMin: Cijk_Ailk_Bljk_HHS_BH_UserArgs_MT128x128x64_MI16x16x1_SN_LDSB1_CLR1_GSU0_GSUC0_GSUWGMRR0_K1_LBSPPA2048_LBSPPB128_LPA32_MIWT4_4_PLR1_SU32_SUM0_SUS256_SKXCCM8_VWA2_VWB1_WGM8_WGMXCC1_WGMXCCGn1
    SolutionIndex: 107
    SolutionNameMin: Cijk_Ailk_Bljk_HHS_BH_UserArgs_MT128x128x64_MI16x16x1_SN_LDSB1_CLR1_GSU0_GSUC0_GSUWGMRR0_K1_LBSPPA2048_LBSPPB128_LPA0_MIWT4_4_PLR1_SU32_SUM0_SUS256_SKXCCM8_VWA4_VWB1_WGM8_WGMXCC1_WGMXCCGn1
    SolutionIndex: 108
    SolutionNameMin: Cijk_Ailk_Bljk_HHS_BH_UserArgs_MT128x128x64_MI16x16x1_SN_LDSB1_CLR1_GSU0_GSUC0_GSUWGMRR0_K1_LBSPPA2048_LBSPPB256_LPA32_MIWT4_4_PLR1_SU32_SUM0_SUS256_SKXCCM8_VWA2_VWB2_WGM8_WGMXCC1_WGMXCCGn1
    SolutionIndex: 109
    SolutionNameMin: Cijk_Ailk_Bljk_HHS_BH_UserArgs_MT128x128x64_MI16x16x1_SN_LDSB1_CLR1_GSU0_GSUC0_GSUWGMRR0_K1_LBSPPA2048_LBSPPB256_LPA0_MIWT4_4_PLR1_SU32_SUM0_SUS256_SKXCCM8_VWA4_VWB2_WGM8_WGMXCC1_WGMXCCGn1
    SolutionIndex: 110
    SolutionNameMin: Cijk_Ailk_Bljk_HHS_BH_UserArgs_MT128x128x64_MI16x16x1_SN_LDSB1_CLR1_GSU0_GSUC0_GSUWGMRR0_K1_LBSPPA2048_LBSPPB512_LPA0_MIWT4_4_PLR1_SU32_SUM0_SUS256_SKXCCM8_VWA4_VWB4_WGM8_WGMXCC1_WGMXCCGn1
    SolutionIndex: 111
    SolutionNameMin: Cijk_Ailk_Bljk_HHS_BH_UserArgs_MT64x128x64_MI16x16x1_SN_LDSB1_CLR1_GSU0_GSUC0_GSUWGMRR0_K1_LBSPPA1024_LBSPPB128_LPA32_MIWT2_4_PLR1_SU32_SUM0_SUS256_SKXCCM8_VWA2_VWB1_WGM1_WGMXCC1_WGMXCCGn1
    SolutionIndex: 112
    SolutionNameMin: Cijk_Ailk_Bljk_HHS_BH_UserArgs_MT64x128x64_MI16x16x1_SN_LDSB1_CLR1_GSU0_GSUC0_GSUWGMRR0_K1_LBSPPA1024_LBSPPB256_LPA32_MIWT2_4_PLR1_SU32_SUM0_SUS256_SKXCCM8_VWA2_VWB2_WGM1_WGMXCC1_WGMXCCGn1
    SolutionIndex: 113
    SolutionNameMin: Cijk_Ailk_Bljk_HHS_BH_UserArgs_MT64x128x64_MI16x16x1_SN_LDSB1_CLR1_GSU0_GSUC0_GSUWGMRR0_K1_LBSPPA1024_LBSPPB512_LPA32_MIWT2_4_PLR1_SU32_SUM0_SUS256_SKXCCM8_VWA2_VWB4_WGM1_WGMXCC1_WGMXCCGn1
    SolutionIndex: 114
    SolutionNameMin: Cijk_Ailk_Bljk_HHS_BH_UserArgs_MT64x128x64_MI16x16x1_SN_LDSB1_CLR1_GSU0_GSUC0_GSUWGMRR0_K1_LBSPPA1024_LBSPPB128_LPA32_MIWT2_4_PLR1_SU32_SUM0_SUS256_SKXCCM8_VWA2_VWB1_WGM8_WGMXCC1_WGMXCCGn1
    SolutionIndex: 115
    SolutionNameMin: Cijk_Ailk_Bljk_HHS_BH_UserArgs_MT128x64x64_MI16x16x1_SN_LDSB1_CLR1_GSU0_GSUC0_GSUWGMRR0_K1_LBSPPA2048_LBSPPB128_LPA0_MIWT4_2_PLR1_SU32_SUM0_SUS256_SKXCCM8_VWA4_VWB1_WGM1_WGMXCC1_WGMXCCGn1
    SolutionIndex: 116
    SolutionNameMin: Cijk_Ailk_Bljk_HHS_BH_UserArgs_MT128x64x64_MI16x16x1_SN_LDSB1_CLR1_GSU0_GSUC0_GSUWGMRR0_K1_LBSPPA2048_LBSPPB256_LPA0_MIWT4_2_PLR1_SU32_SUM0_SUS256_SKXCCM8_VWA4_VWB2_WGM8_WGMXCC1_WGMXCCGn1
    SolutionIndex: 117
    SolutionNameMin: Cijk_Ailk_Bljk_HHS_BH_UserArgs_MT64x64x64_MI16x16x1_SN_LDSB1_CLR1_GSU0_GSUC0_GSUWGMRR0_K1_LBSPPA1024_LBSPPB128_LPA32_MIWT2_2_PLR1_SU32_SUM0_SUS256_SKXCCM8_VWA2_VWB1_WGM1_WGMXCC1_WGMXCCGn1
    SolutionIndex: 118
    SolutionNameMin: Cijk_Ailk_Bljk_HHS_BH_UserArgs_MT64x64x64_MI16x16x1_SN_LDSB1_CLR1_GSU0_GSUC0_GSUWGMRR0_K1_LBSPPA1024_LBSPPB256_LPA32_MIWT2_2_PLR1_SU32_SUM0_SUS256_SKXCCM8_VWA2_VWB2_WGM1_WGMXCC1_WGMXCCGn1
    SolutionIndex: 119
    SolutionNameMin: Cijk_Ailk_Bljk_HHS_BH_UserArgs_MT64x64x64_MI16x16x1_SN_LDSB1_CLR1_GSU0_GSUC0_GSUWGMRR0_K1_LBSPPA1024_LBSPPB128_LPA32_MIWT2_2_PLR1_SU32_SUM0_SUS256_SKXCCM8_VWA2_VWB1_WGM8_WGMXCC1_WGMXCCGn1
    SolutionIndex: 120
    SolutionNameMin: Cijk_Ailk_Bljk_HHS_BH_UserArgs_MT64x32x64_MI16x16x1_SN_LDSB0_CLR1_GSU0_GSUC0_GSUWGMRR0_K1_LBSPPA1024_LBSPPB128_LPA32_MIWT2_1_PLR1_SU32_SUM0_SUS256_SKXCCM8_VWA2_VWB1_WGM1_WGMXCC1_WGMXCCGn1
    SolutionIndex: 121
    SolutionNameMin: Cijk_Ailk_Bljk_HHS_BH_UserArgs_MT32x32x64_MI16x16x1_SN_LDSB0_CLR1_GSU0_GSUC0_GSUWGMRR0_K1_LBSPPA512_LBSPPB128_LPA16_MIWT1_1_PLR1_SU32_SUM0_SUS256_SKXCCM8_VWA1_VWB1_WGM1_WGMXCC1_WGMXCCGn1
    SolutionIndex: 122
    SolutionNameMin: Cijk_Ailk_Bljk_HHS_BH_UserArgs_MT32x32x64_MI16x16x1_SN_LDSB0_CLR1_GSU0_GSUC0_GSUWGMRR0_K1_LBSPPA512_LBSPPB128_LPA16_MIWT1_1_PLR1_SU32_SUM0_SUS256_SKXCCM8_VWA1_VWB1_WGM8_WGMXCC1_WGMXCCGn1
    SolutionIndex: 123
    SolutionNameMin: Cijk_Ailk_Bljk_HHS_BH_UserArgs_MT64x128x128_MI16x16x1_SN_LDSB1_CLR1_GSU0_GSUC0_GSUWGMRR0_K1_LBSPPA1024_LBSPPB256_LPA32_MIWT2_4_PLR2_SU32_SUM0_SUS256_SKXCCM8_VWA2_VWB1_WGM1_WGMXCC1_WGMXCCGn1
    SolutionIndex: 124
    SolutionNameMin: Cijk_Ailk_Bljk_HHS_BH_UserArgs_MT64x128x128_MI16x16x1_SN_LDSB1_CLR1_GSU0_GSUC0_GSUWGMRR0_K1_LBSPPA1024_LBSPPB256_LPA32_MIWT2_4_PLR2_SU32_SUM0_SUS256_SKXCCM8_VWA2_VWB1_WGM4_WGMXCC1_WGMXCCGn1
    SolutionIndex: 125
    SolutionNameMin: Cijk_Ailk_Bljk_HHS_BH_UserArgs_MT64x128x128_MI16x16x1_SN_LDSB1_CLR1_GSU0_GSUC0_GSUWGMRR0_K1_LBSPPA1024_LBSPPB256_LPA32_MIWT2_4_PLR2_SU32_SUM0_SUS256_SKXCCM8_VWA2_VWB1_WGM8_WGMXCC1_WGMXCCGn1
    SolutionIndex: 126
    SolutionNameMin: Cijk_Ailk_Bljk_HHS_BH_UserArgs_MT128x64x128_MI16x16x1_SN_LDSB1_CLR1_GSU0_GSUC0_GSUWGMRR0_K1_LBSPPA2048_LBSPPB256_LPA0_MIWT4_2_PLR1_SU32_SUM0_SUS256_SKXCCM8_VWA4_VWB1_WGM4_WGMXCC1_WGMXCCGn1
    SolutionIndex: 127
    SolutionNameMin: Cijk_Ailk_Bljk_HHS_BH_UserArgs_MT128x64x128_MI16x16x1_SN_LDSB1_CLR1_GSU0_GSUC0_GSUWGMRR0_K1_LBSPPA2048_LBSPPB256_LPA0_MIWT4_2_PLR2_SU32_SUM0_SUS256_SKXCCM8_VWA4_VWB1_WGM8_WGMXCC1_WGMXCCGn1
    SolutionIndex: 128
    SolutionNameMin: Cijk_Ailk_Bljk_HHS_BH_UserArgs_MT128x64x128_MI16x16x1_SN_LDSB1_CLR1_GSU0_GSUC0_GSUWGMRR0_K1_LBSPPA2048_LBSPPB512_LPA0_MIWT4_2_PLR2_SU32_SUM0_SUS256_SKXCCM8_VWA4_VWB2_WGM8_WGMXCC1_WGMXCCGn1
    SolutionIndex: 129
    SolutionNameMin: Cijk_Ailk_Bljk_HHS_BH_UserArgs_MT64x64x128_MI16x16x1_SN_LDSB1_CLR1_GSU0_GSUC0_GSUWGMRR0_K1_LBSPPA1024_LBSPPB256_LPA32_MIWT2_2_PLR2_SU32_SUM0_SUS256_SKXCCM8_VWA2_VWB1_WGM1_WGMXCC1_WGMXCCGn1
    SolutionIndex: 130
    SolutionNameMin: Cijk_Ailk_Bljk_HHS_BH_UserArgs_MT64x64x128_MI16x16x1_SN_LDSB1_CLR1_GSU0_GSUC0_GSUWGMRR0_K1_LBSPPA1024_LBSPPB512_LPA32_MIWT2_2_PLR2_SU32_SUM0_SUS256_SKXCCM8_VWA2_VWB2_WGM1_WGMXCC1_WGMXCCGn1
    SolutionIndex: 131
    SolutionNameMin: Cijk_Ailk_Bljk_HHS_BH_UserArgs_MT64x64x128_MI16x16x1_SN_LDSB1_CLR1_GSU0_GSUC0_GSUWGMRR0_K1_LBSPPA1024_LBSPPB256_LPA32_MIWT2_2_PLR2_SU32_SUM0_SUS256_SKXCCM8_VWA2_VWB1_WGM4_WGMXCC1_WGMXCCGn1
    SolutionIndex: 132
    SolutionNameMin: Cijk_Ailk_Bljk_HHS_BH_UserArgs_MT64x64x128_MI16x16x1_SN_LDSB1_CLR1_GSU0_GSUC0_GSUWGMRR0_K1_LBSPPA1024_LBSPPB512_LPA32_MIWT2_2_PLR2_SU32_SUM0_SUS256_SKXCCM8_VWA2_VWB2_WGM4_WGMXCC1_WGMXCCGn1
    SolutionIndex: 133
    SolutionNameMin: Cijk_Ailk_Bljk_HHS_BH_UserArgs_MT64x64x128_MI16x16x1_SN_LDSB1_CLR1_GSU0_GSUC0_GSUWGMRR0_K1_LBSPPA1024_LBSPPB256_LPA32_MIWT2_2_PLR2_SU32_SUM0_SUS256_SKXCCM8_VWA2_VWB1_WGM8_WGMXCC1_WGMXCCGn1
    SolutionIndex: 134
    SolutionNameMin: Cijk_Ailk_Bljk_HHS_BH_UserArgs_MT64x32x128_MI16x16x1_SN_LDSB1_CLR1_GSU0_GSUC0_GSUWGMRR0_K1_LBSPPA1024_LBSPPB256_LPA32_MIWT2_1_PLR1_SU32_SUM0_SUS256_SKXCCM8_VWA2_VWB1_WGM1_WGMXCC1_WGMXCCGn1
    SolutionIndex: 135
    SolutionNameMin: Cijk_Ailk_Bljk_HHS_BH_UserArgs_MT64x32x128_MI16x16x1_SN_LDSB1_CLR1_GSU0_GSUC0_GSUWGMRR0_K1_LBSPPA1024_LBSPPB256_LPA32_MIWT2_1_PLR2_SU32_SUM0_SUS256_SKXCCM8_VWA2_VWB1_WGM1_WGMXCC1_WGMXCCGn1
    SolutionIndex: 136
    SolutionNameMin: Cijk_Ailk_Bljk_HHS_BH_UserArgs_MT64x32x128_MI16x16x1_SN_LDSB1_CLR1_GSU0_GSUC0_GSUWGMRR0_K1_LBSPPA1024_LBSPPB256_LPA32_MIWT2_1_PLR2_SU32_SUM0_SUS256_SKXCCM8_VWA2_VWB1_WGM4_WGMXCC1_WGMXCCGn1
    SolutionIndex: 137
    SolutionNameMin: Cijk_Ailk_Bljk_HHS_BH_UserArgs_MT64x32x128_MI16x16x1_SN_LDSB1_CLR1_GSU0_GSUC0_GSUWGMRR0_K1_LBSPPA1024_LBSPPB256_LPA32_MIWT2_1_PLR1_SU32_SUM0_SUS256_SKXCCM8_VWA2_VWB1_WGM8_WGMXCC1_WGMXCCGn1
    SolutionIndex: 138
    SolutionNameMin: Cijk_Ailk_Bljk_HHS_BH_UserArgs_MT32x32x128_MI16x16x1_SN_LDSB1_CLR1_GSU0_GSUC0_GSUWGMRR0_K1_LBSPPA512_LBSPPB256_LPA16_MIWT1_1_PLR1_SU32_SUM0_SUS256_SKXCCM8_VWA1_VWB1_WGM1_WGMXCC1_WGMXCCGn1
    SolutionIndex: 139
    SolutionNameMin: Cijk_Ailk_Bljk_HHS_BH_UserArgs_MT32x32x128_MI16x16x1_SN_LDSB1_CLR1_GSU0_GSUC0_GSUWGMRR0_K1_LBSPPA512_LBSPPB256_LPA16_MIWT1_1_PLR2_SU32_SUM0_SUS256_SKXCCM8_VWA1_VWB1_WGM1_WGMXCC1_WGMXCCGn1
    SolutionIndex: 140
    SolutionNameMin: Cijk_Ailk_Bljk_HHS_BH_UserArgs_MT32x32x128_MI16x16x1_SN_LDSB1_CLR1_GSU0_GSUC0_GSUWGMRR0_K1_LBSPPA512_LBSPPB256_LPA16_MIWT1_1_PLR2_SU32_SUM0_SUS256_SKXCCM8_VWA1_VWB1_WGM8_WGMXCC1_WGMXCCGn1
    SolutionIndex: 141
    SolutionNameMin: Cijk_Ailk_Bljk_HHS_BH_UserArgs_MT32x32x32_MI16x16x1_SN_LDSB0_CLR0_GSU0_GSUC0_GSUWGMRR0_K1_LBSPPA256_LBSPPB128_LPA16_MIWT1_1_PLR0_SU32_SUM0_SUS256_SKXCCM8_VWA1_VWB1_WGM1_WGMXCC1_WGMXCCGn1
- - - [128, 128, 1, 128, 128, 128, 128, 128]
    - [50, 0.083]
  - - [128, 128, 1, 256, 128, 128, 128, 256]
    - [121, 0.15]
  - - [128, 128, 1, 512, 128, 128, 128, 512]
    - [29, 0.253]
  - - [128, 128, 1, 1024, 128, 128, 128, 1024]
    - [138, 0.387]
  - - [128, 128, 1, 2048, 128, 128, 128, 2048]
    - [138, 0.576]
  - - [128, 128, 1, 4096, 128, 128, 128, 4096]
    - [121, 1.003]
  - - [128, 128, 1, 8192, 128, 128, 128, 8192]
    - [139, 1.55]
  - - [128, 256, 1, 128, 128, 128, 128, 128]
    - [121, 0.169]
  - - [128, 256, 1, 256, 128, 128, 128, 256]
    - [29, 0.307]
  - - [128, 256, 1, 512, 128, 128, 128, 512]
    - [138, 0.514]
  - - [128, 256, 1, 1024, 128, 128, 128, 1024]
    - [138, 0.777]
  - - [128, 256, 1, 2048, 128, 128, 128, 2048]
    - [139, 1.148]
  - - [128, 256, 1, 4096, 128, 128, 128, 4096]
    - [121, 1.992]
  - - [128, 256, 1, 8192, 128, 128, 128, 8192]
    - [138, 3.009]
  - - [128, 512, 1, 128, 128, 128, 128, 128]
    - [29, 0.333]
  - - [128, 512, 1, 256, 128, 128, 128, 256]
    - [29, 0.604]
  - - [128, 512, 1, 512, 128, 128, 128, 512]
    - [51, 1.032]
  - - [128, 512, 1, 1024, 128, 128, 128, 1024]
    - [138, 1.541]
  - - [128, 512, 1, 2048, 128, 128, 128, 2048]
    - [138, 2.25]
  - - [128, 512, 1, 4096, 128, 128, 128, 4096]
    - [121, 3.798]
  - - [128, 512, 1, 8192, 128, 128, 128, 8192]
    - [139, 5.825]
  - - [128, 1024, 1, 128, 128, 128, 128, 128]
    - [50, 0.661]
  - - [128, 1024, 1, 256, 128, 128, 128, 256]
    - [29, 1.2]
  - - [128, 1024, 1, 512, 128, 128, 128, 512]
    - [51, 2.006]
  - - [128, 1024, 1, 1024, 128, 128, 128, 1024]
    - [50, 3.076]
  - - [128, 1024, 1, 2048, 128, 128, 128, 2048]
    - [50, 4.272]
  - - [128, 1024, 1, 4096, 128, 128, 128, 4096]
    - [120, 6.367]
  - - [128, 1024, 1, 8192, 128, 128, 128, 8192]
    - [135, 9.079]
  - - [128, 2048, 1, 128, 128, 128, 128, 128]
    - [121, 1.288]
  - - [128, 2048, 1, 256, 128, 128, 128, 256]
    - [121, 2.351]
  - - [128, 2048, 1, 512, 128, 128, 128, 512]
    - [29, 3.773]
  - - [128, 2048, 1, 1024, 128, 128, 128, 1024]
    - [139, 5.93]
  - - [128, 2048, 1, 2048, 128, 128, 128, 2048]
    - [140, 7.653]
  - - [128, 2048, 1, 4096, 128, 128, 128, 4096]
    - [135, 10.118]
  - - [128, 2048, 1, 8192, 128, 128, 128, 8192]
    - [129, 12.941]
  - - [128, 4096, 1, 128, 128, 128, 128, 128]
    - [120, 2.436]
  - - [128, 4096, 1, 256, 128, 128, 128, 256]
    - [28, 4.289]
  - - [128, 4096, 1, 512, 128, 128, 128, 512]
    - [136, 6.817]
  - - [128, 4096, 1, 1024, 128, 128, 128, 1024]
    - [134, 10.028]
  - - [128, 4096, 1, 2048, 128, 128, 128, 2048]
    - [135, 11.736]
  - - [128, 4096, 1, 4096, 128, 128, 128, 4096]
    - [22, 14.101]
  - - [128, 4096, 1, 8192, 128, 128, 128, 8192]
    - [37, 17.349]
  - - [128, 8192, 1, 128, 128, 128, 128, 128]
    - [118, 4.344]
  - - [128, 8192, 1, 256, 128, 128, 128, 256]
    - [117, 7.471]
  - - [128, 8192, 1, 512, 128, 128, 128, 512]
    - [117, 11.328]
  - - [128, 8192, 1, 1024, 128, 128, 128, 1024]
    - [129, 14.651]
  - - [128, 8192, 1, 2048, 128, 128, 128, 2048]
    - [44, 15.938]
  - - [128, 8192, 1, 4096, 128, 128, 128, 4096]
    - [97, 18.568]
  - - [128, 8192, 1, 8192, 128, 128, 128, 8192]
    - [17, 21.251]
  - - [256, 128, 1, 128, 256, 256, 256, 128]
    - [138, 0.165]
  - - [256, 128, 1, 256, 256, 256, 256, 256]
    - [29, 0.302]
  - - [256, 128, 1, 512, 256, 256, 256, 512]
    - [50, 0.51]
  - - [256, 128, 1, 1024, 256, 256, 256, 1024]
    - [138, 0.775]
  - - [256, 128, 1, 2048, 256, 256, 256, 2048]
    - [138, 1.141]
  - - [256, 128, 1, 4096, 256, 256, 256, 4096]
    - [121, 1.971]
  - - [256, 128, 1, 8192, 256, 256, 256, 8192]
    - [51, 2.953]
  - - [256, 256, 1, 128, 256, 256, 256, 128]
    - [121, 0.335]
  - - [256, 256, 1, 256, 256, 256, 256, 256]
    - [121, 0.609]
  - - [256, 256, 1, 512, 256, 256, 256, 512]
    - [50, 1.017]
  - - [256, 256, 1, 1024, 256, 256, 256, 1024]
    - [139, 1.532]
  - - [256, 256, 1, 2048, 256, 256, 256, 2048]
    - [139, 2.246]
  - - [256, 256, 1, 4096, 256, 256, 256, 4096]
    - [121, 3.791]
  - - [256, 256, 1, 8192, 256, 256, 256, 8192]
    - [51, 5.535]
  - - [256, 512, 1, 128, 256, 256, 256, 128]
    - [73, 0.655]
  - - [256, 512, 1, 256, 256, 256, 256, 256]
    - [121, 1.193]
  - - [256, 512, 1, 512, 256, 256, 256, 512]
    - [138, 2.009]
  - - [256, 512, 1, 1024, 256, 256, 256, 1024]
    - [138, 3.068]
  - - [256, 512, 1, 2048, 256, 256, 256, 2048]
    - [51, 4.253]
  - - [256, 512, 1, 4096, 256, 256, 256, 4096]
    - [51, 6.354]
  - - [256, 512, 1, 8192, 256, 256, 256, 8192]
    - [46, 9.153]
  - - [256, 1024, 1, 128, 256, 256, 256, 128]
    - [138, 1.258]
  - - [256, 1024, 1, 256, 256, 256, 256, 256]
    - [138, 2.322]
  - - [256, 1024, 1, 512, 256, 256, 256, 512]
    - [138, 3.774]
  - - [256, 1024, 1, 1024, 256, 256, 256, 1024]
    - [51, 5.913]
  - - [256, 1024, 1, 2048, 256, 256, 256, 2048]
    - [139, 7.749]
  - - [256, 1024, 1, 4096, 256, 256, 256, 4096]
    - [135, 10.054]
  - - [256, 1024, 1, 8192, 256, 256, 256, 8192]
    - [45, 13.139]
  - - [256, 2048, 1, 128, 256, 256, 256, 128]
    - [48, 2.372]
  - - [256, 2048, 1, 256, 256, 256, 256, 256]
    - [28, 4.261]
  - - [256, 2048, 1, 512, 256, 256, 256, 512]
    - [48, 7.015]
  - - [256, 2048, 1, 1024, 256, 256, 256, 1024]
    - [134, 9.943]
  - - [256, 2048, 1, 2048, 256, 256, 256, 2048]
    - [135, 11.691]
  - - [256, 2048, 1, 4096, 256, 256, 256, 4096]
    - [23, 14.527]
  - - [256, 2048, 1, 8192, 256, 256, 256, 8192]
    - [38, 17.931]
  - - [256, 4096, 1, 128, 256, 256, 256, 128]
    - [117, 4.32]
  - - [256, 4096, 1, 256, 256, 256, 256, 256]
    - [117, 7.41]
  - - [256, 4096, 1, 512, 256, 256, 256, 512]
    - [117, 11.265]
  - - [256, 4096, 1, 1024, 256, 256, 256, 1024]
    - [129, 14.649]
  - - [256, 4096, 1, 2048, 256, 256, 256, 2048]
    - [129, 17.137]
  - - [256, 4096, 1, 4096, 256, 256, 256, 4096]
    - [103, 19.174]
  - - [256, 4096, 1, 8192, 256, 256, 256, 8192]
    - [95, 21.1]
  - - [256, 8192, 1, 128, 256, 256, 256, 128]
    - [72, 7.032]
  - - [256, 8192, 1, 256, 256, 256, 256, 256]
    - [113, 11.235]
  - - [256, 8192, 1, 512, 256, 256, 256, 512]
    - [115, 15.76]
  - - [256, 8192, 1, 1024, 256, 256, 256, 1024]
    - [125, 19.638]
  - - [256, 8192, 1, 2048, 256, 256, 256, 2048]
    - [127, 20.59]
  - - [256, 8192, 1, 4096, 256, 256, 256, 4096]
    - [109, 22.883]
  - - [256, 8192, 1, 8192, 256, 256, 256, 8192]
    - [16, 24.827]
  - - [512, 128, 1, 128, 512, 512, 512, 128]
    - [121, 0.329]
  - - [512, 128, 1, 256, 512, 512, 512, 256]
    - [138, 0.602]
  - - [512, 128, 1, 512, 512, 512, 512, 512]
    - [138, 1.02]
  - - [512, 128, 1, 1024, 512, 512, 512, 1024]
    - [139, 1.534]
  - - [512, 128, 1, 2048, 512, 512, 512, 2048]
    - [138, 2.245]
  - - [512, 128, 1, 4096, 512, 512, 512, 4096]
    - [122, 3.623]
  - - [512, 128, 1, 8192, 512, 512, 512, 8192]
    - [51, 5.513]
  - - [512, 256, 1, 128, 512, 512, 512, 128]
    - [29, 0.644]
  - - [512, 256, 1, 256, 512, 512, 512, 256]
    - [121, 1.179]
  - - [512, 256, 1, 512, 512, 512, 512, 512]
    - [51, 2.006]
  - - [512, 256, 1, 1024, 512, 512, 512, 1024]
    - [51, 3.053]
  - - [512, 256, 1, 2048, 512, 512, 512, 2048]
    - [50, 4.255]
  - - [512, 256, 1, 4096, 512, 512, 512, 4096]
    - [50, 6.297]
  - - [512, 256, 1, 8192, 512, 512, 512, 8192]
    - [46, 8.949]
  - - [512, 512, 1, 128, 512, 512, 512, 128]
    - [73, 1.262]
  - - [512, 512, 1, 256, 512, 512, 512, 256]
    - [121, 2.309]
  - - [512, 512, 1, 512, 512, 512, 512, 512]
    - [51, 3.781]
  - - [512, 512, 1, 1024, 512, 512, 512, 1024]
    - [51, 5.869]
  - - [512, 512, 1, 2048, 512, 512, 512, 2048]
    - [139, 7.745]
  - - [512, 512, 1, 4096, 512, 512, 512, 4096]
    - [48, 10.175]
  - - [512, 512, 1, 8192, 512, 512, 512, 8192]
    - [36, 13.85]
  - - [512, 1024, 1, 128, 512, 512, 512, 128]
    - [135, 2.398]
  - - [512, 1024, 1, 256, 512, 512, 512, 256]
    - [48, 4.221]
  - - [512, 1024, 1, 512, 512, 512, 512, 512]
    - [48, 6.967]
  - - [512, 1024, 1, 1024, 512, 512, 512, 1024]
    - [134, 10.034]
  - - [512, 1024, 1, 2048, 512, 512, 512, 2048]
    - [135, 11.851]
  - - [512, 1024, 1, 4096, 512, 512, 512, 4096]
    - [43, 15.039]
  - - [512, 1024, 1, 8192, 512, 512, 512, 8192]
    - [39, 18.225]
  - - [512, 2048, 1, 128, 512, 512, 512, 128]
    - [118, 4.289]
  - - [512, 2048, 1, 256, 512, 512, 512, 256]
    - [118, 7.357]
  - - [512, 2048, 1, 512, 512, 512, 512, 512]
    - [118, 11.107]
  - - [512, 2048, 1, 1024, 512, 512, 512, 1024]
    - [129, 14.835]
  - - [512, 2048, 1, 2048, 512, 512, 512, 2048]
    - [130, 17.258]
  - - [512, 2048, 1, 4096, 512, 512, 512, 4096]
    - [95, 19.301]
  - - [512, 2048, 1, 8192, 512, 512, 512, 8192]
    - [95, 20.759]
  - - [512, 4096, 1, 128, 512, 512, 512, 128]
    - [72, 6.92]
  - - [512, 4096, 1, 256, 512, 512, 512, 256]
    - [111, 11.115]
  - - [512, 4096, 1, 512, 512, 512, 512, 512]
    - [111, 15.695]
  - - [512, 4096, 1, 1024, 512, 512, 512, 1024]
    - [123, 19.657]
  - - [512, 4096, 1, 2048, 512, 512, 512, 2048]
    - [33, 21.188]
  - - [512, 4096, 1, 4096, 512, 512, 512, 4096]
    - [32, 22.992]
  - - [512, 4096, 1, 8192, 512, 512, 512, 8192]
    - [89, 24.514]
  - - [512, 8192, 1, 128, 512, 512, 512, 128]
    - [106, 9.784]
  - - [512, 8192, 1, 256, 512, 512, 512, 256]
    - [102, 15.05]
  - - [512, 8192, 1, 512, 512, 512, 512, 512]
    - [106, 20.799]
  - - [512, 8192, 1, 1024, 512, 512, 512, 1024]
    - [101, 24.172]
  - - [512, 8192, 1, 2048, 512, 512, 512, 2048]
    - [103, 27.012]
  - - [512, 8192, 1, 4096, 512, 512, 512, 4096]
    - [13, 25.95]
  - - [512, 8192, 1, 8192, 512, 512, 512, 8192]
    - [12, 28.251]
  - - [1024, 128, 1, 128, 1024, 1024, 1024, 128]
    - [121, 0.658]
  - - [1024, 128, 1, 256, 1024, 1024, 1024, 256]
    - [121, 1.188]
  - - [1024, 128, 1, 512, 1024, 1024, 1024, 512]
    - [138, 1.992]
  - - [1024, 128, 1, 1024, 1024, 1024, 1024, 1024]
    - [51, 3.046]
  - - [1024, 128, 1, 2048, 1024, 1024, 1024, 2048]
    - [51, 4.236]
  - - [1024, 128, 1, 4096, 1024, 1024, 1024, 4096]
    - [51, 6.306]
  - - [1024, 128, 1, 8192, 1024, 1024, 1024, 8192]
    - [48, 8.82]
  - - [1024, 256, 1, 128, 1024, 1024, 1024, 128]
    - [121, 1.266]
  - - [1024, 256, 1, 256, 1024, 1024, 1024, 256]
    - [29, 2.294]
  - - [1024, 256, 1, 512, 1024, 1024, 1024, 512]
    - [29, 3.757]
  - - [1024, 256, 1, 1024, 1024, 1024, 1024, 1024]
    - [51, 5.947]
  - - [1024, 256, 1, 2048, 1024, 1024, 1024, 2048]
    - [51, 7.676]
  - - [1024, 256, 1, 4096, 1024, 1024, 1024, 4096]
    - [48, 10.028]
  - - [1024, 256, 1, 8192, 1024, 1024, 1024, 8192]
    - [40, 13.746]
  - - [1024, 512, 1, 128, 1024, 1024, 1024, 128]
    - [120, 2.379]
  - - [1024, 512, 1, 256, 1024, 1024, 1024, 256]
    - [28, 4.242]
  - - [1024, 512, 1, 512, 1024, 1024, 1024, 512]
    - [135, 7.009]
  - - [1024, 512, 1, 1024, 1024, 1024, 1024, 1024]
    - [134, 9.874]
  - - [1024, 512, 1, 2048, 1024, 1024, 1024, 2048]
    - [49, 11.517]
  - - [1024, 512, 1, 4096, 1024, 1024, 1024, 4096]
    - [40, 14.732]
  - - [1024, 512, 1, 8192, 1024, 1024, 1024, 8192]
    - [39, 17.965]
  - - [1024, 1024, 1, 128, 1024, 1024, 1024, 128]
    - [117, 4.287]
  - - [1024, 1024, 1, 256, 1024, 1024, 1024, 256]
    - [118, 7.393]
  - - [1024, 1024, 1, 512, 1024, 1024, 1024, 512]
    - [117, 11.128]
  - - [1024, 1024, 1, 1024, 1024, 1024, 1024, 1024]
    - [132, 14.561]
  - - [1024, 1024, 1, 2048, 1024, 1024, 1024, 2048]
    - [42, 16.948]
  - - [1024, 1024, 1, 4096, 1024, 1024, 1024, 4096]
    - [105, 18.97]
  - - [1024, 1024, 1, 8192, 1024, 1024, 1024, 8192]
    - [95, 20.691]
  - - [1024, 2048, 1, 128, 1024, 1024, 1024, 128]
    - [72, 6.87]
  - - [1024, 2048, 1, 256, 1024, 1024, 1024, 256]
    - [112, 11.097]
  - - [1024, 2048, 1, 512, 1024, 1024, 1024, 512]
    - [111, 15.78]
  - - [1024, 2048, 1, 1024, 1024, 1024, 1024, 1024]
    - [31, 19.455]
  - - [1024, 2048, 1, 2048, 1024, 1024, 1024, 2048]
    - [31, 21.023]
  - - [1024, 2048, 1, 4096, 1024, 1024, 1024, 4096]
    - [127, 23.003]
  - - [1024, 2048, 1, 8192, 1024, 1024, 1024, 8192]
    - [101, 23.906]
  - - [1024, 4096, 1, 128, 1024, 1024, 1024, 128]
    - [98, 9.815]
  - - [1024, 4096, 1, 256, 1024, 1024, 1024, 256]
    - [96, 15.001]
  - - [1024, 4096, 1, 512, 1024, 1024, 1024, 512]
    - [101, 20.714]
  - - [1024, 4096, 1, 1024, 1024, 1024, 1024, 1024]
    - [95, 24.038]
  - - [1024, 4096, 1, 2048, 1024, 1024, 1024, 2048]
    - [101, 26.964]
  - - [1024, 4096, 1, 4096, 1024, 1024, 1024, 4096]
    - [109, 25.107]
  - - [1024, 4096, 1, 8192, 1024, 1024, 1024, 8192]
    - [85, 26.624]
  - - [1024, 8192, 1, 128, 1024, 1024, 1024, 128]
    - [69, 12.822]
  - - [1024, 8192, 1, 256, 1024, 1024, 1024, 256]
    - [69, 18.343]
  - - [1024, 8192, 1, 512, 1024, 1024, 1024, 512]
    - [10, 22.714]
  - - [1024, 8192, 1, 1024, 1024, 1024, 1024, 1024]
    - [8, 27.228]
  - - [1024, 8192, 1, 2048, 1024, 1024, 1024, 2048]
    - [79, 32.035]
  - - [1024, 8192, 1, 4096, 1024, 1024, 1024, 4096]
    - [14, 27.964]
  - - [1024, 8192, 1, 8192, 1024, 1024, 1024, 8192]
    - [65, 30.771]
  - - [2048, 128, 1, 128, 2048, 2048, 2048, 128]
    - [28, 1.257]
  - - [2048, 128, 1, 256, 2048, 2048, 2048, 256]
    - [29, 2.295]
  - - [2048, 128, 1, 512, 2048, 2048, 2048, 512]
    - [50, 3.775]
  - - [2048, 128, 1, 1024, 2048, 2048, 2048, 1024]
    - [51, 5.931]
  - - [2048, 128, 1, 2048, 2048, 2048, 2048, 2048]
    - [48, 7.448]
  - - [2048, 128, 1, 4096, 2048, 2048, 2048, 4096]
    - [27, 9.481]
  - - [2048, 128, 1, 8192, 2048, 2048, 2048, 8192]
    - [40, 13.025]
  - - [2048, 256, 1, 128, 2048, 2048, 2048, 128]
    - [120, 2.385]
  - - [2048, 256, 1, 256, 2048, 2048, 2048, 256]
    - [135, 4.254]
  - - [2048, 256, 1, 512, 2048, 2048, 2048, 512]
    - [135, 6.948]
  - - [2048, 256, 1, 1024, 2048, 2048, 2048, 1024]
    - [47, 9.761]
  - - [2048, 256, 1, 2048, 2048, 2048, 2048, 2048]
    - [41, 11.217]
  - - [2048, 256, 1, 4096, 2048, 2048, 2048, 4096]
    - [18, 14.107]
  - - [2048, 256, 1, 8192, 2048, 2048, 2048, 8192]
    - [34, 17.263]
  - - [2048, 512, 1, 128, 2048, 2048, 2048, 128]
    - [118, 4.327]
  - - [2048, 512, 1, 256, 2048, 2048, 2048, 256]
    - [118, 7.437]
  - - [2048, 512, 1, 512, 2048, 2048, 2048, 512]
    - [24, 10.984]
  - - [2048, 512, 1, 1024, 2048, 2048, 2048, 1024]
    - [131, 14.571]
  - - [2048, 512, 1, 2048, 2048, 2048, 2048, 2048]
    - [30, 16.077]
  - - [2048, 512, 1, 4096, 2048, 2048, 2048, 4096]
    - [107, 19.185]
  - - [2048, 512, 1, 8192, 2048, 2048, 2048, 8192]
    - [103, 20.685]
  - - [2048, 1024, 1, 128, 2048, 2048, 2048, 128]
    - [115, 6.955]
  - - [2048, 1024, 1, 256, 2048, 2048, 2048, 256]
    - [115, 11.252]
  - - [2048, 1024, 1, 512, 2048, 2048, 2048, 512]
    - [112, 15.746]
  - - [2048, 1024, 1, 1024, 2048, 2048, 2048, 1024]
    - [31, 19.507]
  - - [2048, 1024, 1, 2048, 2048, 2048, 2048, 2048]
    - [20, 20.063]
  - - [2048, 1024, 1, 4096, 2048, 2048, 2048, 4096]
    - [127, 22.894]
  - - [2048, 1024, 1, 8192, 2048, 2048, 2048, 8192]
    - [97, 23.986]
  - - [2048, 2048, 1, 128, 2048, 2048, 2048, 128]
    - [98, 9.91]
  - - [2048, 2048, 1, 256, 2048, 2048, 2048, 256]
    - [94, 15.072]
  - - [2048, 2048, 1, 512, 2048, 2048, 2048, 512]
    - [95, 20.35]
  - - [2048, 2048, 1, 1024, 2048, 2048, 2048, 1024]
    - [101, 23.919]
  - - [2048, 2048, 1, 2048, 2048, 2048, 2048, 2048]
    - [105, 26.598]
  - - [2048, 2048, 1, 4096, 2048, 2048, 2048, 4096]
    - [99, 26.512]
  - - [2048, 2048, 1, 8192, 2048, 2048, 2048, 8192]
    - [80, 27.895]
  - - [2048, 4096, 1, 128, 2048, 2048, 2048, 128]
    - [68, 12.799]
  - - [2048, 4096, 1, 256, 2048, 2048, 2048, 256]
    - [4, 17.927]
  - - [2048, 4096, 1, 512, 2048, 2048, 2048, 512]
    - [81, 22.351]
  - - [2048, 4096, 1, 1024, 2048, 2048, 2048, 1024]
    - [7, 27.006]
  - - [2048, 4096, 1, 2048, 2048, 2048, 2048, 2048]
    - [74, 31.31]
  - - [2048, 4096, 1, 4096, 2048, 2048, 2048, 4096]
    - [75, 27.792]
  - - [2048, 4096, 1, 8192, 2048, 2048, 2048, 8192]
    - [63, 30.535]
  - - [2048, 8192, 1, 128, 2048, 2048, 2048, 128]
    - [1, 12.733]
  - - [2048, 8192, 1, 256, 2048, 2048, 2048, 256]
    - [62, 18.923]
  - - [2048, 8192, 1, 512, 2048, 2048, 2048, 512]
    - [53, 25.09]
  - - [2048, 8192, 1, 1024, 2048, 2048, 2048, 1024]
    - [57, 31.178]
  - - [2048, 8192, 1, 2048, 2048, 2048, 2048, 2048]
    - [79, 27.464]
  - - [2048, 8192, 1, 4096, 2048, 2048, 2048, 4096]
    - [58, 30.738]
  - - [2048, 8192, 1, 8192, 2048, 2048, 2048, 8192]
    - [56, 31.937]
  - - [4096, 128, 1, 128, 4096, 4096, 4096, 128]
    - [28, 2.425]
  - - [4096, 128, 1, 256, 4096, 4096, 4096, 256]
    - [28, 4.295]
  - - [4096, 128, 1, 512, 4096, 4096, 4096, 512]
    - [135, 6.996]
  - - [4096, 128, 1, 1024, 4096, 4096, 4096, 1024]
    - [137, 9.713]
  - - [4096, 128, 1, 2048, 4096, 4096, 4096, 2048]
    - [48, 10.603]
  - - [4096, 128, 1, 4096, 4096, 4096, 4096, 4096]
    - [116, 13.398]
  - - [4096, 128, 1, 8192, 4096, 4096, 4096, 8192]
    - [127, 16.951]
  - - [4096, 256, 1, 128, 4096, 4096, 4096, 128]
    - [25, 4.226]
  - - [4096, 256, 1, 256, 4096, 4096, 4096, 256]
    - [24, 7.35]
  - - [4096, 256, 1, 512, 4096, 4096, 4096, 512]
    - [117, 11.117]
  - - [4096, 256, 1, 1024, 4096, 4096, 4096, 1024]
    - [133, 14.497]
  - - [4096, 256, 1, 2048, 4096, 4096, 4096, 2048]
    - [40, 15.489]
  - - [4096, 256, 1, 4096, 4096, 4096, 4096, 4096]
    - [110, 18.706]
  - - [4096, 256, 1, 8192, 4096, 4096, 4096, 8192]
    - [107, 21.02]
  - - [4096, 512, 1, 128, 4096, 4096, 4096, 128]
    - [71, 6.942]
  - - [4096, 512, 1, 256, 4096, 4096, 4096, 256]
    - [111, 11.288]
  - - [4096, 512, 1, 512, 4096, 4096, 4096, 512]
    - [21, 15.566]
  - - [4096, 512, 1, 1024, 4096, 4096, 4096, 1024]
    - [126, 19.355]
  - - [4096, 512, 1, 2048, 4096, 4096, 4096, 2048]
    - [19, 20.395]
  - - [4096, 512, 1, 4096, 4096, 4096, 4096, 4096]
    - [128, 23.394]
  - - [4096, 512, 1, 8192, 4096, 4096, 4096, 8192]
    - [97, 25.68]
  - - [4096, 1024, 1, 128, 4096, 4096, 4096, 128]
    - [96, 9.865]
  - - [4096, 1024, 1, 256, 4096, 4096, 4096, 256]
    - [104, 15.023]
  - - [4096, 1024, 1, 512, 4096, 4096, 4096, 512]
    - [101, 20.416]
  - - [4096, 1024, 1, 1024, 4096, 4096, 4096, 1024]
    - [101, 24.046]
  - - [4096, 1024, 1, 2048, 4096, 4096, 4096, 2048]
    - [103, 27.325]
  - - [4096, 1024, 1, 4096, 4096, 4096, 4096, 4096]
    - [76, 25.934]
  - - [4096, 1024, 1, 8192, 4096, 4096, 4096, 8192]
    - [75, 27.876]
  - - [4096, 2048, 1, 128, 4096, 4096, 4096, 128]
    - [70, 12.529]
  - - [4096, 2048, 1, 256, 4096, 4096, 4096, 256]
    - [70, 17.914]
  - - [4096, 2048, 1, 512, 4096, 4096, 4096, 512]
    - [81, 22.331]
  - - [4096, 2048, 1, 1024, 4096, 4096, 4096, 1024]
    - [88, 26.991]
  - - [4096, 2048, 1, 2048, 4096, 4096, 4096, 2048]
    - [84, 31.611]
  - - [4096, 2048, 1, 4096, 4096, 4096, 4096, 4096]
    - [78, 28.765]
  - - [4096, 2048, 1, 8192, 4096, 4096, 4096, 8192]
    - [64, 30.713]
  - - [4096, 4096, 1, 128, 4096, 4096, 4096, 128]
    - [66, 12.7]
  - - [4096, 4096, 1, 256, 4096, 4096, 4096, 256]
    - [2, 18.34]
  - - [4096, 4096, 1, 512, 4096, 4096, 4096, 512]
    - [3, 24.563]
  - - [4096, 4096, 1, 1024, 4096, 4096, 4096, 1024]
    - [52, 30.627]
  - - [4096, 4096, 1, 2048, 4096, 4096, 4096, 2048]
    - [75, 29.294]
  - - [4096, 4096, 1, 4096, 4096, 4096, 4096, 4096]
    - [54, 30.418]
  - - [4096, 4096, 1, 8192, 4096, 4096, 4096, 8192]
    - [54, 32.807]
  - - [4096, 8192, 1, 128, 4096, 4096, 4096, 128]
    - [16, 12.222]
  - - [4096, 8192, 1, 256, 4096, 4096, 4096, 256]
    - [74, 17.318]
  - - [4096, 8192, 1, 512, 4096, 4096, 4096, 512]
    - [82, 21.512]
  - - [4096, 8192, 1, 1024, 4096, 4096, 4096, 1024]
    - [80, 26.555]
  - - [4096, 8192, 1, 2048, 4096, 4096, 4096, 2048]
    - [80, 30.078]
  - - [4096, 8192, 1, 4096, 4096, 4096, 4096, 4096]
    - [77, 33.108]
  - - [4096, 8192, 1, 8192, 4096, 4096, 4096, 8192]
    - [65, 34.09]
  - - [8192, 128, 1, 128, 8192, 8192, 8192, 128]
    - [24, 4.271]
  - - [8192, 128, 1, 256, 8192, 8192, 8192, 256]
    - [26, 7.247]
  - - [8192, 128, 1, 512, 8192, 8192, 8192, 512]
    - [119, 10.931]
  - - [8192, 128, 1, 1024, 8192, 8192, 8192, 1024]
    - [133, 14.281]
  - - [8192, 128, 1, 2048, 8192, 8192, 8192, 2048]
    - [40, 14.884]
  - - [8192, 128, 1, 4096, 8192, 8192, 8192, 4096]
    - [35, 17.621]
  - - [8192, 128, 1, 8192, 8192, 8192, 8192, 8192]
    - [95, 20.993]
  - - [8192, 256, 1, 128, 8192, 8192, 8192, 128]
    - [116, 6.868]
  - - [8192, 256, 1, 256, 8192, 8192, 8192, 256]
    - [114, 11.052]
  - - [8192, 256, 1, 512, 8192, 8192, 8192, 512]
    - [114, 15.495]
  - - [8192, 256, 1, 1024, 8192, 8192, 8192, 1024]
    - [124, 19.306]
  - - [8192, 256, 1, 2048, 8192, 8192, 8192, 2048]
    - [128, 19.873]
  - - [8192, 256, 1, 4096, 8192, 8192, 8192, 4096]
    - [97, 22.11]
  - - [8192, 256, 1, 8192, 8192, 8192, 8192, 8192]
    - [11, 24.591]
  - - [8192, 512, 1, 128, 8192, 8192, 8192, 128]
    - [108, 9.793]
  - - [8192, 512, 1, 256, 8192, 8192, 8192, 256]
    - [100, 15.052]
  - - [8192, 512, 1, 512, 8192, 8192, 8192, 512]
    - [100, 20.528]
  - - [8192, 512, 1, 1024, 8192, 8192, 8192, 1024]
    - [107, 23.859]
  - - [8192, 512, 1, 2048, 8192, 8192, 8192, 2048]
    - [110, 27.034]
  - - [8192, 512, 1, 4096, 8192, 8192, 8192, 4096]
    - [78, 26.009]
  - - [8192, 512, 1, 8192, 8192, 8192, 8192, 8192]
    - [9, 28.272]
  - - [8192, 1024, 1, 128, 8192, 8192, 8192, 128]
    - [67, 11.66]
  - - [8192, 1024, 1, 256, 8192, 8192, 8192, 256]
    - [91, 17.502]
  - - [8192, 1024, 1, 512, 8192, 8192, 8192, 512]
    - [87, 22.28]
  - - [8192, 1024, 1, 1024, 8192, 8192, 8192, 1024]
    - [92, 26.152]
  - - [8192, 1024, 1, 2048, 8192, 8192, 8192, 2048]
    - [11, 31.557]
  - - [8192, 1024, 1, 4096, 8192, 8192, 8192, 4096]
    - [76, 28.965]
  - - [8192, 1024, 1, 8192, 8192, 8192, 8192, 8192]
    - [5, 30.575]
  - - [8192, 2048, 1, 128, 8192, 8192, 8192, 128]
    - [59, 12.828]
  - - [8192, 2048, 1, 256, 8192, 8192, 8192, 256]
    - [0, 18.275]
  - - [8192, 2048, 1, 512, 8192, 8192, 8192, 512]
    - [61, 24.231]
  - - [8192, 2048, 1, 1024, 8192, 8192, 8192, 1024]
    - [59, 30.526]
  - - [8192, 2048, 1, 2048, 8192, 8192, 8192, 2048]
    - [78, 28.153]
  - - [8192, 2048, 1, 4096, 8192, 8192, 8192, 4096]
    - [75, 30.945]
  - - [8192, 2048, 1, 8192, 8192, 8192, 8192, 8192]
    - [54, 32.734]
  - - [8192, 4096, 1, 128, 8192, 8192, 8192, 128]
    - [15, 12.089]
  - - [8192, 4096, 1, 256, 8192, 8192, 8192, 256]
    - [93, 17.143]
  - - [8192, 4096, 1, 512, 8192, 8192, 8192, 512]
    - [85, 21.528]
  - - [8192, 4096, 1, 1024, 8192, 8192, 8192, 1024]
    - [82, 25.951]
  - - [8192, 4096, 1, 2048, 8192, 8192, 8192, 2048]
    - [86, 30.172]
  - - [8192, 4096, 1, 4096, 8192, 8192, 8192, 4096]
    - [78, 32.649]
  - - [8192, 4096, 1, 8192, 8192, 8192, 8192, 8192]
    - [65, 33.983]
  - - [8192, 8192, 1, 128, 8192, 8192, 8192, 128]
    - [6, 13.095]
  - - [8192, 8192, 1, 256, 8192, 8192, 8192, 256]
    - [90, 16.058]
  - - [8192, 8192, 1, 512, 8192, 8192, 8192, 512]
    - [83, 21.96]
  - - [8192, 8192, 1, 1024, 8192, 8192, 8192, 1024]
    - [81, 27.49]
  - - [8192, 8192, 1, 2048, 8192, 8192, 8192, 2048]
    - [55, 32.064]
  - - [8192, 8192, 1, 4096, 8192, 8192, 8192, 4096]
    - [65, 34.391]
  - - [8192, 8192, 1, 8192, 8192, 8192, 8192, 8192]
    - [60, 36.146]
  - - [1, 1, 1, 32, 1, 1, 1, 32]
    - [141, 0.0]
- null
- null
- ExperimentalStreamK
- GridBased
