library/src/amd_detail/rocblaslt/src/Tensile/Logic/asm_full/aquavanjaram/gfx942/StreamK/aquavanjaram942_Cijk_Alik_Bjlk_HHS_BH_UserArgs.yaml
- {MinimumRequiredVersion: 4.33.0}
- aquavanjaram942
- gfx942
- [Device 0049, Device 0050]
    SolutionIndex: 0
    SolutionNameMin: Cijk_Alik_Bjlk_HHS_BH_UserArgs_MT256x256x32_MI16x16x1_SN_LDSB1_CLR1_GSU0_GSUC0_GSUWGMRR0_K1_LBSPPA512_LBSPPB2048_LPB32_MIWT8_8_PLR1_SU32_SUM0_SUS256_SKXCCM0_VWA8_VWB2_WGM1_WGMXCC1_WGMXCCGn1
    SolutionIndex: 1
    SolutionNameMin: Cijk_Alik_Bjlk_HHS_BH_UserArgs_MT256x256x32_MI16x16x1_SN_LDSB1_CLR1_GSU0_GSUC0_GSUWGMRR0_K1_LBSPPA512_LBSPPB2048_LPB0_MIWT8_8_PLR1_SU32_SUM0_SUS256_SKXCCM0_VWA8_VWB4_WGM1_WGMXCC1_WGMXCCGn1
    SolutionIndex: 2
    SolutionNameMin: Cijk_Alik_Bjlk_HHS_BH_UserArgs_MT256x256x32_MI16x16x1_SN_LDSB1_CLR1_GSU0_GSUC0_GSUWGMRR0_K1_LBSPPA256_LBSPPB2048_LPB0_MIWT8_8_PLR1_SU32_SUM0_SUS256_SKXCCM0_VWA4_VWB8_WGM1_WGMXCC1_WGMXCCGn1
    SolutionIndex: 3
    SolutionNameMin: Cijk_Alik_Bjlk_HHS_BH_UserArgs_MT256x256x32_MI16x16x1_SN_LDSB1_CLR1_GSU0_GSUC0_GSUWGMRR0_K1_LBSPPA128_LBSPPB2048_LPB0_MIWT8_8_PLR1_SU32_SUM0_SUS256_SKXCCM0_VWA2_VWB8_WGM4_WGMXCC1_WGMXCCGn1
    SolutionIndex: 4
    SolutionNameMin: Cijk_Alik_Bjlk_HHS_BH_UserArgs_MT256x256x32_MI16x16x1_SN_LDSB1_CLR1_GSU0_GSUC0_GSUWGMRR0_K1_LBSPPA512_LBSPPB2048_LPB0_MIWT8_8_PLR1_SU32_SUM0_SUS256_SKXCCM0_VWA8_VWB8_WGM4_WGMXCC1_WGMXCCGn1
    SolutionIndex: 5
    SolutionNameMin: Cijk_Alik_Bjlk_HHS_BH_UserArgs_MT128x256x32_MI16x16x1_SN_LDSB1_CLR1_GSU0_GSUC0_GSUWGMRR0_K1_LBSPPA256_LBSPPB2048_LPB0_MIWT4_8_PLR1_SU32_SUM0_SUS256_SKXCCM0_VWA4_VWB8_WGM8_WGMXCC1_WGMXCCGn1
    SolutionIndex: 6
    SolutionNameMin: Cijk_Alik_Bjlk_HHS_BH_UserArgs_MT128x64x32_MI16x16x1_SN_LDSB0_CLR1_GSU0_GSUC0_GSUWGMRR0_K1_LBSPPA128_LBSPPB512_LPB32_MIWT4_2_PLR1_SU32_SUM0_SUS256_SKXCCM0_VWA2_VWB2_WGM4_WGMXCC1_WGMXCCGn1
    SolutionIndex: 7
    SolutionNameMin: Cijk_Alik_Bjlk_HHS_BH_UserArgs_MT32x32x32_MI16x16x1_SN_LDSB0_CLR1_GSU0_GSUC0_GSUWGMRR0_K1_LBSPPA128_LBSPPB256_LPB16_MIWT1_1_PLR1_SU32_SUM0_SUS256_SKXCCM0_VWA1_VWB1_WGM1_WGMXCC1_WGMXCCGn1
    SolutionIndex: 8
    SolutionNameMin: Cijk_Alik_Bjlk_HHS_BH_UserArgs_MT128x256x64_MI16x16x1_SN_LDSB1_CLR1_GSU0_GSUC0_GSUWGMRR0_K1_LBSPPA512_LBSPPB4096_LPB32_MIWT4_8_PLR1_SU32_SUM0_SUS256_SKXCCM0_VWA4_VWB2_WGM1_WGMXCC1_WGMXCCGn1
    SolutionIndex: 9
    SolutionNameMin: Cijk_Alik_Bjlk_HHS_BH_UserArgs_MT128x256x64_MI16x16x1_SN_LDSB1_CLR1_GSU0_GSUC0_GSUWGMRR0_K1_LBSPPA256_LBSPPB4096_LPB0_MIWT4_8_PLR1_SU32_SUM0_SUS256_SKXCCM0_VWA2_VWB4_WGM1_WGMXCC1_WGMXCCGn1
    SolutionIndex: 10
    SolutionNameMin: Cijk_Alik_Bjlk_HHS_BH_UserArgs_MT128x256x64_MI16x16x1_SN_LDSB1_CLR1_GSU0_GSUC0_GSUWGMRR0_K1_LBSPPA256_LBSPPB4096_LPB0_MIWT4_8_PLR1_SU32_SUM0_SUS256_SKXCCM0_VWA2_VWB8_WGM1_WGMXCC1_WGMXCCGn1
    SolutionIndex: 11
    SolutionNameMin: Cijk_Alik_Bjlk_HHS_BH_UserArgs_MT128x256x64_MI16x16x1_SN_LDSB1_CLR1_GSU0_GSUC0_GSUWGMRR0_K1_LBSPPA512_LBSPPB4096_LPB0_MIWT4_8_PLR1_SU32_SUM0_SUS256_SKXCCM0_VWA4_VWB8_WGM1_WGMXCC1_WGMXCCGn1
    SolutionIndex: 12
    SolutionNameMin: Cijk_Alik_Bjlk_HHS_BH_UserArgs_MT128x256x64_MI16x16x1_SN_LDSB1_CLR1_GSU0_GSUC0_GSUWGMRR0_K1_LBSPPA256_LBSPPB4096_LPB32_MIWT4_8_PLR1_SU32_SUM0_SUS256_SKXCCM0_VWA2_VWB2_WGM8_WGMXCC1_WGMXCCGn1
    SolutionIndex: 13
    SolutionNameMin: Cijk_Alik_Bjlk_HHS_BH_UserArgs_MT256x128x64_MI16x16x1_SN_LDSB1_CLR1_GSU0_GSUC0_GSUWGMRR0_K1_LBSPPA256_LBSPPB2048_LPB0_MIWT8_4_PLR1_SU32_SUM0_SUS256_SKXCCM0_VWA2_VWB4_WGM1_WGMXCC1_WGMXCCGn1
    SolutionIndex: 14
    SolutionNameMin: Cijk_Alik_Bjlk_HHS_BH_UserArgs_MT256x128x64_MI16x16x1_SN_LDSB1_CLR1_GSU0_GSUC0_GSUWGMRR0_K1_LBSPPA1024_LBSPPB2048_LPB0_MIWT8_4_PLR1_SU32_SUM0_SUS256_SKXCCM0_VWA8_VWB4_WGM1_WGMXCC1_WGMXCCGn1
    SolutionIndex: 15
    SolutionNameMin: Cijk_Alik_Bjlk_HHS_BH_UserArgs_MT256x128x64_MI16x16x1_SN_LDSB1_CLR1_GSU0_GSUC0_GSUWGMRR0_K1_LBSPPA256_LBSPPB2048_LPB0_MIWT8_4_PLR1_SU32_SUM0_SUS256_SKXCCM0_VWA2_VWB4_WGM4_WGMXCC1_WGMXCCGn1
    SolutionIndex: 16
    SolutionNameMin: Cijk_Alik_Bjlk_HHS_BH_UserArgs_MT256x128x64_MI16x16x1_SN_LDSB1_CLR1_GSU0_GSUC0_GSUWGMRR0_K1_LBSPPA512_LBSPPB2048_LPB0_MIWT8_4_PLR1_SU32_SUM0_SUS256_SKXCCM0_VWA4_VWB4_WGM4_WGMXCC1_WGMXCCGn1
    SolutionIndex: 17
    SolutionNameMin: Cijk_Alik_Bjlk_HHS_BH_UserArgs_MT256x128x64_MI16x16x1_SN_LDSB1_CLR1_GSU0_GSUC0_GSUWGMRR0_K1_LBSPPA1024_LBSPPB2048_LPB0_MIWT8_4_PLR1_SU32_SUM0_SUS256_SKXCCM0_VWA8_VWB4_WGM4_WGMXCC1_WGMXCCGn1
    SolutionIndex: 18
    SolutionNameMin: Cijk_Alik_Bjlk_HHS_BH_UserArgs_MT256x128x64_MI16x16x1_SN_LDSB1_CLR1_GSU0_GSUC0_GSUWGMRR0_K1_LBSPPA256_LBSPPB2048_LPB0_MIWT8_4_PLR1_SU32_SUM0_SUS256_SKXCCM0_VWA2_VWB4_WGM8_WGMXCC1_WGMXCCGn1
    SolutionIndex: 19
    SolutionNameMin: Cijk_Alik_Bjlk_HHS_BH_UserArgs_MT256x128x64_MI16x16x1_SN_LDSB1_CLR1_GSU0_GSUC0_GSUWGMRR0_K1_LBSPPA512_LBSPPB2048_LPB0_MIWT8_4_PLR1_SU32_SUM0_SUS256_SKXCCM0_VWA4_VWB4_WGM8_WGMXCC1_WGMXCCGn1
    SolutionIndex: 20
    SolutionNameMin: Cijk_Alik_Bjlk_HHS_BH_UserArgs_MT256x128x64_MI16x16x1_SN_LDSB1_CLR1_GSU0_GSUC0_GSUWGMRR0_K1_LBSPPA1024_LBSPPB2048_LPB0_MIWT8_4_PLR1_SU32_SUM0_SUS256_SKXCCM0_VWA8_VWB4_WGM8_WGMXCC1_WGMXCCGn1
    SolutionIndex: 21
    SolutionNameMin: Cijk_Alik_Bjlk_HHS_BH_UserArgs_MT128x128x64_MI16x16x1_SN_LDSB1_CLR1_GSU0_GSUC0_GSUWGMRR0_K1_LBSPPA256_LBSPPB2048_LPB32_MIWT4_4_PLR1_SU32_SUM0_SUS256_SKXCCM0_VWA2_VWB2_WGM1_WGMXCC1_WGMXCCGn1
    SolutionIndex: 22
    SolutionNameMin: Cijk_Alik_Bjlk_HHS_BH_UserArgs_MT128x128x64_MI16x16x1_SN_LDSB1_CLR1_GSU0_GSUC0_GSUWGMRR0_K1_LBSPPA512_LBSPPB2048_LPB32_MIWT4_4_PLR1_SU32_SUM0_SUS256_SKXCCM0_VWA4_VWB2_WGM1_WGMXCC1_WGMXCCGn1
    SolutionIndex: 23
    SolutionNameMin: Cijk_Alik_Bjlk_HHS_BH_UserArgs_MT128x128x64_MI16x16x1_SN_LDSB1_CLR1_GSU0_GSUC0_GSUWGMRR0_K1_LBSPPA256_LBSPPB2048_LPB0_MIWT4_4_PLR1_SU32_SUM0_SUS256_SKXCCM0_VWA2_VWB4_WGM1_WGMXCC1_WGMXCCGn1
    SolutionIndex: 24
    SolutionNameMin: Cijk_Alik_Bjlk_HHS_BH_UserArgs_MT128x128x64_MI16x16x1_SN_LDSB1_CLR1_GSU0_GSUC0_GSUWGMRR0_K1_LBSPPA512_LBSPPB2048_LPB0_MIWT4_4_PLR1_SU32_SUM0_SUS256_SKXCCM0_VWA4_VWB4_WGM1_WGMXCC1_WGMXCCGn1
    SolutionIndex: 25
    SolutionNameMin: Cijk_Alik_Bjlk_HHS_BH_UserArgs_MT128x128x64_MI16x16x1_SN_LDSB1_CLR1_GSU0_GSUC0_GSUWGMRR0_K1_LBSPPA256_LBSPPB2048_LPB32_MIWT4_4_PLR1_SU32_SUM0_SUS256_SKXCCM0_VWA2_VWB2_WGM8_WGMXCC1_WGMXCCGn1
    SolutionIndex: 26
    SolutionNameMin: Cijk_Alik_Bjlk_HHS_BH_UserArgs_MT128x128x64_MI16x16x1_SN_LDSB1_CLR1_GSU0_GSUC0_GSUWGMRR0_K1_LBSPPA256_LBSPPB2048_LPB0_MIWT4_4_PLR1_SU32_SUM0_SUS256_SKXCCM0_VWA2_VWB4_WGM8_WGMXCC1_WGMXCCGn1
    SolutionIndex: 27
    SolutionNameMin: Cijk_Alik_Bjlk_HHS_BH_UserArgs_MT128x64x64_MI16x16x1_SN_LDSB1_CLR1_GSU0_GSUC0_GSUWGMRR0_K1_LBSPPA512_LBSPPB1024_LPB32_MIWT4_2_PLR1_SU32_SUM0_SUS256_SKXCCM0_VWA4_VWB2_WGM1_WGMXCC1_WGMXCCGn1
    SolutionIndex: 28
    SolutionNameMin: Cijk_Alik_Bjlk_HHS_BH_UserArgs_MT128x64x64_MI16x16x1_SN_LDSB1_CLR1_GSU0_GSUC0_GSUWGMRR0_K1_LBSPPA512_LBSPPB1024_LPB32_MIWT4_2_PLR1_SU32_SUM0_SUS256_SKXCCM0_VWA4_VWB2_WGM4_WGMXCC1_WGMXCCGn1
    SolutionIndex: 29
    SolutionNameMin: Cijk_Alik_Bjlk_HHS_BH_UserArgs_MT64x64x64_MI16x16x1_SN_LDSB1_CLR1_GSU0_GSUC0_GSUWGMRR0_K1_LBSPPA256_LBSPPB1024_LPB16_MIWT2_2_PLR1_SU32_SUM0_SUS256_SKXCCM0_VWA2_VWB1_WGM1_WGMXCC1_WGMXCCGn1
    SolutionIndex: 30
    SolutionNameMin: Cijk_Alik_Bjlk_HHS_BH_UserArgs_MT64x64x64_MI16x16x1_SN_LDSB1_CLR1_GSU0_GSUC0_GSUWGMRR0_K1_LBSPPA128_LBSPPB1024_LPB32_MIWT2_2_PLR1_SU32_SUM0_SUS256_SKXCCM0_VWA1_VWB2_WGM1_WGMXCC1_WGMXCCGn1
    SolutionIndex: 31
    SolutionNameMin: Cijk_Alik_Bjlk_HHS_BH_UserArgs_MT64x64x64_MI16x16x1_SN_LDSB1_CLR1_GSU0_GSUC0_GSUWGMRR0_K1_LBSPPA256_LBSPPB1024_LPB32_MIWT2_2_PLR1_SU32_SUM0_SUS256_SKXCCM0_VWA2_VWB2_WGM1_WGMXCC1_WGMXCCGn1
    SolutionIndex: 32
    SolutionNameMin: Cijk_Alik_Bjlk_HHS_BH_UserArgs_MT32x64x64_MI16x16x1_SN_LDSB0_CLR1_GSU0_GSUC0_GSUWGMRR0_K1_LBSPPA128_LBSPPB1024_LPB32_MIWT1_2_PLR1_SU32_SUM0_SUS256_SKXCCM0_VWA1_VWB2_WGM1_WGMXCC1_WGMXCCGn1
    SolutionIndex: 33
    SolutionNameMin: Cijk_Alik_Bjlk_HHS_BH_UserArgs_MT64x32x64_MI16x16x1_SN_LDSB0_CLR1_GSU0_GSUC0_GSUWGMRR0_K1_LBSPPA256_LBSPPB512_LPB16_MIWT2_1_PLR1_SU32_SUM0_SUS256_SKXCCM0_VWA2_VWB1_WGM1_WGMXCC1_WGMXCCGn1
    SolutionIndex: 34
    SolutionNameMin: Cijk_Alik_Bjlk_HHS_BH_UserArgs_MT32x32x64_MI16x16x1_SN_LDSB0_CLR1_GSU0_GSUC0_GSUWGMRR0_K1_LBSPPA128_LBSPPB512_LPB16_MIWT1_1_PLR1_SU32_SUM0_SUS256_SKXCCM0_VWA1_VWB1_WGM1_WGMXCC1_WGMXCCGn1
    SolutionIndex: 35
    SolutionNameMin: Cijk_Alik_Bjlk_HHS_BH_UserArgs_MT32x32x64_MI16x16x1_SN_LDSB0_CLR1_GSU0_GSUC0_GSUWGMRR0_K1_LBSPPA128_LBSPPB512_LPB16_MIWT1_1_PLR2_SU32_SUM0_SUS256_SKXCCM0_VWA1_VWB1_WGM1_WGMXCC1_WGMXCCGn1
    SolutionIndex: 36
    SolutionNameMin: Cijk_Alik_Bjlk_HHS_BH_UserArgs_MT64x128x128_MI16x16x1_SN_LDSB1_CLR1_GSU0_GSUC0_GSUWGMRR0_K1_LBSPPA512_LBSPPB2048_LPB0_MIWT2_4_PLR2_SU32_SUM0_SUS256_SKXCCM0_VWA2_VWB4_WGM8_WGMXCC1_WGMXCCGn1
    SolutionIndex: 37
    SolutionNameMin: Cijk_Alik_Bjlk_HHS_BH_UserArgs_MT128x64x128_MI16x16x1_SN_LDSB1_CLR1_GSU0_GSUC0_GSUWGMRR0_K1_LBSPPA256_LBSPPB1024_LPB32_MIWT4_2_PLR2_SU32_SUM0_SUS256_SKXCCM0_VWA1_VWB2_WGM1_WGMXCC1_WGMXCCGn1
    SolutionIndex: 38
    SolutionNameMin: Cijk_Alik_Bjlk_HHS_BH_UserArgs_MT128x64x128_MI16x16x1_SN_LDSB1_CLR1_GSU0_GSUC0_GSUWGMRR0_K1_LBSPPA1024_LBSPPB1024_LPB32_MIWT4_2_PLR2_SU32_SUM0_SUS256_SKXCCM0_VWA4_VWB2_WGM1_WGMXCC1_WGMXCCGn1
    SolutionIndex: 39
    SolutionNameMin: Cijk_Alik_Bjlk_HHS_BH_UserArgs_MT128x64x128_MI16x16x1_SN_LDSB1_CLR1_GSU0_GSUC0_GSUWGMRR0_K1_LBSPPA512_LBSPPB1024_LPB32_MIWT4_2_PLR2_SU32_SUM0_SUS256_SKXCCM0_VWA2_VWB2_WGM4_WGMXCC1_WGMXCCGn1
    SolutionIndex: 40
    SolutionNameMin: Cijk_Alik_Bjlk_HHS_BH_UserArgs_MT128x64x128_MI16x16x1_SN_LDSB1_CLR1_GSU0_GSUC0_GSUWGMRR0_K1_LBSPPA1024_LBSPPB1024_LPB32_MIWT4_2_PLR2_SU32_SUM0_SUS256_SKXCCM0_VWA4_VWB2_WGM4_WGMXCC1_WGMXCCGn1
    SolutionIndex: 41
    SolutionNameMin: Cijk_Alik_Bjlk_HHS_BH_UserArgs_MT128x64x128_MI16x16x1_SN_LDSB1_CLR1_GSU0_GSUC0_GSUWGMRR0_K1_LBSPPA1024_LBSPPB1024_LPB32_MIWT4_2_PLR2_SU32_SUM0_SUS256_SKXCCM0_VWA4_VWB2_WGM8_WGMXCC1_WGMXCCGn1
    SolutionIndex: 42
    SolutionNameMin: Cijk_Alik_Bjlk_HHS_BH_UserArgs_MT64x64x128_MI16x16x1_SN_LDSB1_CLR1_GSU0_GSUC0_GSUWGMRR0_K1_LBSPPA256_LBSPPB1024_LPB32_MIWT2_2_PLR2_SU32_SUM0_SUS256_SKXCCM0_VWA1_VWB2_WGM1_WGMXCC1_WGMXCCGn1
    SolutionIndex: 43
    SolutionNameMin: Cijk_Alik_Bjlk_HHS_BH_UserArgs_MT64x64x128_MI16x16x1_SN_LDSB1_CLR1_GSU0_GSUC0_GSUWGMRR0_K1_LBSPPA512_LBSPPB1024_LPB32_MIWT2_2_PLR2_SU32_SUM0_SUS256_SKXCCM0_VWA2_VWB2_WGM1_WGMXCC1_WGMXCCGn1
    SolutionIndex: 44
    SolutionNameMin: Cijk_Alik_Bjlk_HHS_BH_UserArgs_MT64x64x128_MI16x16x1_SN_LDSB1_CLR1_GSU0_GSUC0_GSUWGMRR0_K1_LBSPPA512_LBSPPB1024_LPB32_MIWT2_2_PLR2_SU32_SUM0_SUS256_SKXCCM0_VWA2_VWB2_WGM4_WGMXCC1_WGMXCCGn1
    SolutionIndex: 45
    SolutionNameMin: Cijk_Alik_Bjlk_HHS_BH_UserArgs_MT64x64x128_MI16x16x1_SN_LDSB1_CLR1_GSU0_GSUC0_GSUWGMRR0_K1_LBSPPA256_LBSPPB1024_LPB32_MIWT2_2_PLR2_SU32_SUM0_SUS256_SKXCCM0_VWA1_VWB2_WGM8_WGMXCC1_WGMXCCGn1
    SolutionIndex: 46
    SolutionNameMin: Cijk_Alik_Bjlk_HHS_BH_UserArgs_MT64x64x128_MI16x16x1_SN_LDSB1_CLR1_GSU0_GSUC0_GSUWGMRR0_K1_LBSPPA512_LBSPPB1024_LPB32_MIWT2_2_PLR2_SU32_SUM0_SUS256_SKXCCM0_VWA2_VWB2_WGM8_WGMXCC1_WGMXCCGn1
    SolutionIndex: 47
    SolutionNameMin: Cijk_Alik_Bjlk_HHS_BH_UserArgs_MT32x64x128_MI16x16x1_SN_LDSB1_CLR1_GSU0_GSUC0_GSUWGMRR0_K1_LBSPPA256_LBSPPB1024_LPB32_MIWT1_2_PLR2_SU32_SUM0_SUS256_SKXCCM0_VWA1_VWB2_WGM1_WGMXCC1_WGMXCCGn1
    SolutionIndex: 48
    SolutionNameMin: Cijk_Alik_Bjlk_HHS_BH_UserArgs_MT32x64x128_MI16x16x1_SN_LDSB1_CLR1_GSU0_GSUC0_GSUWGMRR0_K1_LBSPPA256_LBSPPB1024_LPB32_MIWT1_2_PLR2_SU32_SUM0_SUS256_SKXCCM0_VWA1_VWB2_WGM4_WGMXCC1_WGMXCCGn1
    SolutionIndex: 49
    SolutionNameMin: Cijk_Alik_Bjlk_HHS_BH_UserArgs_MT32x64x128_MI16x16x1_SN_LDSB1_CLR1_GSU0_GSUC0_GSUWGMRR0_K1_LBSPPA256_LBSPPB1024_LPB32_MIWT1_2_PLR2_SU32_SUM0_SUS256_SKXCCM0_VWA1_VWB2_WGM8_WGMXCC1_WGMXCCGn1
    SolutionIndex: 50
    SolutionNameMin: Cijk_Alik_Bjlk_HHS_BH_UserArgs_MT64x32x128_MI16x16x1_SN_LDSB1_CLR1_GSU0_GSUC0_GSUWGMRR0_K1_LBSPPA512_LBSPPB512_LPB16_MIWT2_1_PLR1_SU32_SUM0_SUS256_SKXCCM0_VWA2_VWB1_WGM1_WGMXCC1_WGMXCCGn1
    SolutionIndex: 51
    SolutionNameMin: Cijk_Alik_Bjlk_HHS_BH_UserArgs_MT64x32x128_MI16x16x1_SN_LDSB1_CLR1_GSU0_GSUC0_GSUWGMRR0_K1_LBSPPA512_LBSPPB512_LPB16_MIWT2_1_PLR2_SU32_SUM0_SUS256_SKXCCM0_VWA2_VWB1_WGM1_WGMXCC1_WGMXCCGn1
    SolutionIndex: 52
    SolutionNameMin: Cijk_Alik_Bjlk_HHS_BH_UserArgs_MT64x32x128_MI16x16x1_SN_LDSB1_CLR1_GSU0_GSUC0_GSUWGMRR0_K1_LBSPPA256_LBSPPB512_LPB16_MIWT2_1_PLR2_SU32_SUM0_SUS256_SKXCCM0_VWA1_VWB1_WGM4_WGMXCC1_WGMXCCGn1
    SolutionIndex: 53
    SolutionNameMin: Cijk_Alik_Bjlk_HHS_BH_UserArgs_MT64x32x128_MI16x16x1_SN_LDSB1_CLR1_GSU0_GSUC0_GSUWGMRR0_K1_LBSPPA512_LBSPPB512_LPB16_MIWT2_1_PLR2_SU32_SUM0_SUS256_SKXCCM0_VWA2_VWB1_WGM8_WGMXCC1_WGMXCCGn1
    SolutionIndex: 54
    SolutionNameMin: Cijk_Alik_Bjlk_HHS_BH_UserArgs_MT32x32x128_MI16x16x1_SN_LDSB1_CLR1_GSU0_GSUC0_GSUWGMRR0_K1_LBSPPA256_LBSPPB512_LPB16_MIWT1_1_PLR1_SU32_SUM0_SUS256_SKXCCM0_VWA1_VWB1_WGM1_WGMXCC1_WGMXCCGn1
    SolutionIndex: 55
    SolutionNameMin: Cijk_Alik_Bjlk_HHS_BH_UserArgs_MT32x32x128_MI16x16x1_SN_LDSB1_CLR1_GSU0_GSUC0_GSUWGMRR0_K1_LBSPPA256_LBSPPB512_LPB16_MIWT1_1_PLR2_SU32_SUM0_SUS256_SKXCCM0_VWA1_VWB1_WGM1_WGMXCC1_WGMXCCGn1
    SolutionIndex: 56
    SolutionNameMin: Cijk_Alik_Bjlk_HHS_BH_UserArgs_MT32x32x128_MI16x16x1_SN_LDSB1_CLR1_GSU0_GSUC0_GSUWGMRR0_K1_LBSPPA256_LBSPPB512_LPB16_MIWT1_1_PLR1_SU32_SUM0_SUS256_SKXCCM0_VWA1_VWB1_WGM8_WGMXCC1_WGMXCCGn1
    SolutionIndex: 57
    SolutionNameMin: Cijk_Alik_Bjlk_HHS_BH_UserArgs_MT32x32x128_MI16x16x1_SN_LDSB1_CLR1_GSU0_GSUC0_GSUWGMRR0_K1_LBSPPA256_LBSPPB512_LPB16_MIWT1_1_PLR2_SU32_SUM0_SUS256_SKXCCM0_VWA1_VWB1_WGM8_WGMXCC1_WGMXCCGn1
    SolutionIndex: 58
    SolutionNameMin: Cijk_Alik_Bjlk_HHS_BH_UserArgs_MT256x256x32_MI16x16x1_SN_LDSB1_CLR1_GSU0_GSUC0_GSUWGMRR0_K1_LBSPPA128_LBSPPB2048_LPB0_MIWT8_8_PLR1_SU32_SUM0_SUS256_SKXCCM8_VWA2_VWB4_WGM1_WGMXCC1_WGMXCCGn1
    SolutionIndex: 59
    SolutionNameMin: Cijk_Alik_Bjlk_HHS_BH_UserArgs_MT256x256x32_MI16x16x1_SN_LDSB1_CLR1_GSU0_GSUC0_GSUWGMRR0_K1_LBSPPA256_LBSPPB2048_LPB0_MIWT8_8_PLR1_SU32_SUM0_SUS256_SKXCCM8_VWA4_VWB4_WGM1_WGMXCC1_WGMXCCGn1
    SolutionIndex: 60
    SolutionNameMin: Cijk_Alik_Bjlk_HHS_BH_UserArgs_MT256x256x32_MI16x16x1_SN_LDSB1_CLR1_GSU0_GSUC0_GSUWGMRR0_K1_LBSPPA128_LBSPPB2048_LPB0_MIWT8_8_PLR1_SU32_SUM0_SUS256_SKXCCM8_VWA2_VWB8_WGM1_WGMXCC1_WGMXCCGn1
    SolutionIndex: 61
    SolutionNameMin: Cijk_Alik_Bjlk_HHS_BH_UserArgs_MT256x256x32_MI16x16x1_SN_LDSB1_CLR1_GSU0_GSUC0_GSUWGMRR0_K1_LBSPPA256_LBSPPB2048_LPB0_MIWT8_8_PLR1_SU32_SUM0_SUS256_SKXCCM8_VWA4_VWB8_WGM1_WGMXCC1_WGMXCCGn1
    SolutionIndex: 62
    SolutionNameMin: Cijk_Alik_Bjlk_HHS_BH_UserArgs_MT256x256x32_MI16x16x1_SN_LDSB1_CLR1_GSU0_GSUC0_GSUWGMRR0_K1_LBSPPA256_LBSPPB2048_LPB0_MIWT8_8_PLR1_SU32_SUM0_SUS256_SKXCCM8_VWA4_VWB4_WGM4_WGMXCC1_WGMXCCGn1
    SolutionIndex: 63
    SolutionNameMin: Cijk_Alik_Bjlk_HHS_BH_UserArgs_MT256x256x32_MI16x16x1_SN_LDSB1_CLR1_GSU0_GSUC0_GSUWGMRR0_K1_LBSPPA512_LBSPPB2048_LPB0_MIWT8_8_PLR1_SU32_SUM0_SUS256_SKXCCM8_VWA8_VWB4_WGM4_WGMXCC1_WGMXCCGn1
    SolutionIndex: 64
    SolutionNameMin: Cijk_Alik_Bjlk_HHS_BH_UserArgs_MT256x256x32_MI16x16x1_SN_LDSB1_CLR1_GSU0_GSUC0_GSUWGMRR0_K1_LBSPPA256_LBSPPB2048_LPB0_MIWT8_8_PLR1_SU32_SUM0_SUS256_SKXCCM8_VWA4_VWB8_WGM4_WGMXCC1_WGMXCCGn1
    SolutionIndex: 65
    SolutionNameMin: Cijk_Alik_Bjlk_HHS_BH_UserArgs_MT256x256x32_MI16x16x1_SN_LDSB1_CLR1_GSU0_GSUC0_GSUWGMRR0_K1_LBSPPA512_LBSPPB2048_LPB0_MIWT8_8_PLR1_SU32_SUM0_SUS256_SKXCCM8_VWA8_VWB8_WGM4_WGMXCC1_WGMXCCGn1
    SolutionIndex: 66
    SolutionNameMin: Cijk_Alik_Bjlk_HHS_BH_UserArgs_MT256x256x32_MI16x16x1_SN_LDSB1_CLR1_GSU0_GSUC0_GSUWGMRR0_K1_LBSPPA256_LBSPPB2048_LPB0_MIWT8_8_PLR1_SU32_SUM0_SUS256_SKXCCM8_VWA4_VWB4_WGM8_WGMXCC1_WGMXCCGn1
    SolutionIndex: 67
    SolutionNameMin: Cijk_Alik_Bjlk_HHS_BH_UserArgs_MT256x256x32_MI16x16x1_SN_LDSB1_CLR1_GSU0_GSUC0_GSUWGMRR0_K1_LBSPPA128_LBSPPB2048_LPB0_MIWT8_8_PLR1_SU32_SUM0_SUS256_SKXCCM8_VWA2_VWB8_WGM8_WGMXCC1_WGMXCCGn1
    SolutionIndex: 68
    SolutionNameMin: Cijk_Alik_Bjlk_HHS_BH_UserArgs_MT256x256x32_MI16x16x1_SN_LDSB1_CLR1_GSU0_GSUC0_GSUWGMRR0_K1_LBSPPA256_LBSPPB2048_LPB0_MIWT8_8_PLR1_SU32_SUM0_SUS256_SKXCCM8_VWA4_VWB8_WGM8_WGMXCC1_WGMXCCGn1
    SolutionIndex: 69
    SolutionNameMin: Cijk_Alik_Bjlk_HHS_BH_UserArgs_MT128x256x32_MI16x16x1_SN_LDSB1_CLR1_GSU0_GSUC0_GSUWGMRR0_K1_LBSPPA256_LBSPPB2048_LPB0_MIWT4_8_PLR1_SU32_SUM0_SUS256_SKXCCM8_VWA4_VWB4_WGM1_WGMXCC1_WGMXCCGn1
    SolutionIndex: 70
    SolutionNameMin: Cijk_Alik_Bjlk_HHS_BH_UserArgs_MT128x256x32_MI16x16x1_SN_LDSB1_CLR1_GSU0_GSUC0_GSUWGMRR0_K1_LBSPPA128_LBSPPB2048_LPB32_MIWT4_8_PLR1_SU32_SUM0_SUS256_SKXCCM8_VWA2_VWB2_WGM4_WGMXCC1_WGMXCCGn1
    SolutionIndex: 71
    SolutionNameMin: Cijk_Alik_Bjlk_HHS_BH_UserArgs_MT128x256x32_MI16x16x1_SN_LDSB1_CLR1_GSU0_GSUC0_GSUWGMRR0_K1_LBSPPA256_LBSPPB2048_LPB0_MIWT4_8_PLR1_SU32_SUM0_SUS256_SKXCCM8_VWA4_VWB8_WGM4_WGMXCC1_WGMXCCGn1
    SolutionIndex: 72
    SolutionNameMin: Cijk_Alik_Bjlk_HHS_BH_UserArgs_MT128x256x32_MI16x16x1_SN_LDSB1_CLR1_GSU0_GSUC0_GSUWGMRR0_K1_LBSPPA128_LBSPPB2048_LPB32_MIWT4_8_PLR1_SU32_SUM0_SUS256_SKXCCM8_VWA2_VWB2_WGM8_WGMXCC1_WGMXCCGn1
    SolutionIndex: 73
    SolutionNameMin: Cijk_Alik_Bjlk_HHS_BH_UserArgs_MT128x256x32_MI16x16x1_SN_LDSB1_CLR1_GSU0_GSUC0_GSUWGMRR0_K1_LBSPPA256_LBSPPB2048_LPB0_MIWT4_8_PLR1_SU32_SUM0_SUS256_SKXCCM8_VWA4_VWB4_WGM8_WGMXCC1_WGMXCCGn1
    SolutionIndex: 74
    SolutionNameMin: Cijk_Alik_Bjlk_HHS_BH_UserArgs_MT256x128x32_MI16x16x1_SN_LDSB1_CLR1_GSU0_GSUC0_GSUWGMRR0_K1_LBSPPA512_LBSPPB1024_LPB32_MIWT8_4_PLR1_SU32_SUM0_SUS256_SKXCCM8_VWA8_VWB2_WGM1_WGMXCC1_WGMXCCGn1
    SolutionIndex: 75
    SolutionNameMin: Cijk_Alik_Bjlk_HHS_BH_UserArgs_MT256x128x32_MI16x16x1_SN_LDSB1_CLR1_GSU0_GSUC0_GSUWGMRR0_K1_LBSPPA512_LBSPPB1024_LPB0_MIWT8_4_PLR1_SU32_SUM0_SUS256_SKXCCM8_VWA8_VWB4_WGM1_WGMXCC1_WGMXCCGn1
    SolutionIndex: 76
    SolutionNameMin: Cijk_Alik_Bjlk_HHS_BH_UserArgs_MT256x128x32_MI16x16x1_SN_LDSB1_CLR1_GSU0_GSUC0_GSUWGMRR0_K1_LBSPPA512_LBSPPB1024_LPB32_MIWT8_4_PLR1_SU32_SUM0_SUS256_SKXCCM8_VWA8_VWB2_WGM8_WGMXCC1_WGMXCCGn1
    SolutionIndex: 77
    SolutionNameMin: Cijk_Alik_Bjlk_HHS_BH_UserArgs_MT128x128x32_MI16x16x1_SN_LDSB1_CLR1_GSU0_GSUC0_GSUWGMRR0_K1_LBSPPA128_LBSPPB1024_LPB0_MIWT4_4_PLR1_SU32_SUM0_SUS256_SKXCCM8_VWA2_VWB4_WGM1_WGMXCC1_WGMXCCGn1
    SolutionIndex: 78
    SolutionNameMin: Cijk_Alik_Bjlk_HHS_BH_UserArgs_MT128x64x32_MI16x16x1_SN_LDSB0_CLR1_GSU0_GSUC0_GSUWGMRR0_K1_LBSPPA128_LBSPPB512_LPB32_MIWT4_2_PLR1_SU32_SUM0_SUS256_SKXCCM8_VWA2_VWB2_WGM1_WGMXCC1_WGMXCCGn1
    SolutionIndex: 79
    SolutionNameMin: Cijk_Alik_Bjlk_HHS_BH_UserArgs_MT32x32x32_MI16x16x1_SN_LDSB0_CLR0_GSU0_GSUC0_GSUWGMRR0_K1_LBSPPA128_LBSPPB256_LPB16_MIWT1_1_PLR0_SU32_SUM0_SUS256_SKXCCM8_VWA1_VWB1_WGM1_WGMXCC1_WGMXCCGn1
    SolutionIndex: 80
    SolutionNameMin: Cijk_Alik_Bjlk_HHS_BH_UserArgs_MT128x256x64_MI16x16x1_SN_LDSB1_CLR1_GSU0_GSUC0_GSUWGMRR0_K1_LBSPPA256_LBSPPB4096_LPB0_MIWT4_8_PLR1_SU32_SUM0_SUS256_SKXCCM8_VWA2_VWB4_WGM1_WGMXCC1_WGMXCCGn1
    SolutionIndex: 81
    SolutionNameMin: Cijk_Alik_Bjlk_HHS_BH_UserArgs_MT128x256x64_MI16x16x1_SN_LDSB1_CLR1_GSU0_GSUC0_GSUWGMRR0_K1_LBSPPA256_LBSPPB4096_LPB0_MIWT4_8_PLR1_SU32_SUM0_SUS256_SKXCCM8_VWA2_VWB8_WGM1_WGMXCC1_WGMXCCGn1
    SolutionIndex: 82
    SolutionNameMin: Cijk_Alik_Bjlk_HHS_BH_UserArgs_MT128x256x64_MI16x16x1_SN_LDSB1_CLR1_GSU0_GSUC0_GSUWGMRR0_K1_LBSPPA256_LBSPPB4096_LPB0_MIWT4_8_PLR1_SU32_SUM0_SUS256_SKXCCM8_VWA2_VWB8_WGM4_WGMXCC1_WGMXCCGn1
    SolutionIndex: 83
    SolutionNameMin: Cijk_Alik_Bjlk_HHS_BH_UserArgs_MT128x256x64_MI16x16x1_SN_LDSB1_CLR1_GSU0_GSUC0_GSUWGMRR0_K1_LBSPPA512_LBSPPB4096_LPB0_MIWT4_8_PLR1_SU32_SUM0_SUS256_SKXCCM8_VWA4_VWB8_WGM4_WGMXCC1_WGMXCCGn1
    SolutionIndex: 84
    SolutionNameMin: Cijk_Alik_Bjlk_HHS_BH_UserArgs_MT128x256x64_MI16x16x1_SN_LDSB1_CLR1_GSU0_GSUC0_GSUWGMRR0_K1_LBSPPA512_LBSPPB4096_LPB0_MIWT4_8_PLR1_SU32_SUM0_SUS256_SKXCCM8_VWA4_VWB4_WGM8_WGMXCC1_WGMXCCGn1
    SolutionIndex: 85
    SolutionNameMin: Cijk_Alik_Bjlk_HHS_BH_UserArgs_MT128x256x64_MI16x16x1_SN_LDSB1_CLR1_GSU0_GSUC0_GSUWGMRR0_K1_LBSPPA256_LBSPPB4096_LPB0_MIWT4_8_PLR1_SU32_SUM0_SUS256_SKXCCM8_VWA2_VWB8_WGM8_WGMXCC1_WGMXCCGn1
    SolutionIndex: 86
    SolutionNameMin: Cijk_Alik_Bjlk_HHS_BH_UserArgs_MT128x256x64_MI16x16x1_SN_LDSB1_CLR1_GSU0_GSUC0_GSUWGMRR0_K1_LBSPPA512_LBSPPB4096_LPB0_MIWT4_8_PLR1_SU32_SUM0_SUS256_SKXCCM8_VWA4_VWB8_WGM8_WGMXCC1_WGMXCCGn1
    SolutionIndex: 87
    SolutionNameMin: Cijk_Alik_Bjlk_HHS_BH_UserArgs_MT256x128x64_MI16x16x1_SN_LDSB1_CLR1_GSU0_GSUC0_GSUWGMRR0_K1_LBSPPA512_LBSPPB2048_LPB32_MIWT8_4_PLR1_SU32_SUM0_SUS256_SKXCCM8_VWA4_VWB2_WGM1_WGMXCC1_WGMXCCGn1
    SolutionIndex: 88
    SolutionNameMin: Cijk_Alik_Bjlk_HHS_BH_UserArgs_MT256x128x64_MI16x16x1_SN_LDSB1_CLR1_GSU0_GSUC0_GSUWGMRR0_K1_LBSPPA512_LBSPPB2048_LPB0_MIWT8_4_PLR1_SU32_SUM0_SUS256_SKXCCM8_VWA4_VWB4_WGM1_WGMXCC1_WGMXCCGn1
    SolutionIndex: 89
    SolutionNameMin: Cijk_Alik_Bjlk_HHS_BH_UserArgs_MT256x128x64_MI16x16x1_SN_LDSB1_CLR1_GSU0_GSUC0_GSUWGMRR0_K1_LBSPPA512_LBSPPB2048_LPB0_MIWT8_4_PLR1_SU32_SUM0_SUS256_SKXCCM8_VWA4_VWB4_WGM4_WGMXCC1_WGMXCCGn1
    SolutionIndex: 90
    SolutionNameMin: Cijk_Alik_Bjlk_HHS_BH_UserArgs_MT128x128x64_MI16x16x1_SN_LDSB1_CLR1_GSU0_GSUC0_GSUWGMRR0_K1_LBSPPA256_LBSPPB2048_LPB32_MIWT4_4_PLR1_SU32_SUM0_SUS256_SKXCCM8_VWA2_VWB2_WGM1_WGMXCC1_WGMXCCGn1
    SolutionIndex: 91
    SolutionNameMin: Cijk_Alik_Bjlk_HHS_BH_UserArgs_MT128x128x64_MI16x16x1_SN_LDSB1_CLR1_GSU0_GSUC0_GSUWGMRR0_K1_LBSPPA256_LBSPPB2048_LPB0_MIWT4_4_PLR1_SU32_SUM0_SUS256_SKXCCM8_VWA2_VWB4_WGM1_WGMXCC1_WGMXCCGn1
    SolutionIndex: 92
    SolutionNameMin: Cijk_Alik_Bjlk_HHS_BH_UserArgs_MT128x128x64_MI16x16x1_SN_LDSB1_CLR1_GSU0_GSUC0_GSUWGMRR0_K1_LBSPPA512_LBSPPB2048_LPB0_MIWT4_4_PLR1_SU32_SUM0_SUS256_SKXCCM8_VWA4_VWB4_WGM1_WGMXCC1_WGMXCCGn1
    SolutionIndex: 93
    SolutionNameMin: Cijk_Alik_Bjlk_HHS_BH_UserArgs_MT128x128x64_MI16x16x1_SN_LDSB1_CLR1_GSU0_GSUC0_GSUWGMRR0_K1_LBSPPA256_LBSPPB2048_LPB0_MIWT4_4_PLR1_SU32_SUM0_SUS256_SKXCCM8_VWA2_VWB4_WGM4_WGMXCC1_WGMXCCGn1
    SolutionIndex: 94
    SolutionNameMin: Cijk_Alik_Bjlk_HHS_BH_UserArgs_MT128x128x64_MI16x16x1_SN_LDSB1_CLR1_GSU0_GSUC0_GSUWGMRR0_K1_LBSPPA512_LBSPPB2048_LPB0_MIWT4_4_PLR1_SU32_SUM0_SUS256_SKXCCM8_VWA4_VWB4_WGM4_WGMXCC1_WGMXCCGn1
    SolutionIndex: 95
    SolutionNameMin: Cijk_Alik_Bjlk_HHS_BH_UserArgs_MT128x128x64_MI16x16x1_SN_LDSB1_CLR1_GSU0_GSUC0_GSUWGMRR0_K1_LBSPPA256_LBSPPB2048_LPB0_MIWT4_4_PLR1_SU32_SUM0_SUS256_SKXCCM8_VWA2_VWB4_WGM8_WGMXCC1_WGMXCCGn1
    SolutionIndex: 96
    SolutionNameMin: Cijk_Alik_Bjlk_HHS_BH_UserArgs_MT128x128x64_MI16x16x1_SN_LDSB1_CLR1_GSU0_GSUC0_GSUWGMRR0_K1_LBSPPA512_LBSPPB2048_LPB0_MIWT4_4_PLR1_SU32_SUM0_SUS256_SKXCCM8_VWA4_VWB4_WGM8_WGMXCC1_WGMXCCGn1
    SolutionIndex: 97
    SolutionNameMin: Cijk_Alik_Bjlk_HHS_BH_UserArgs_MT128x64x64_MI16x16x1_SN_LDSB1_CLR1_GSU0_GSUC0_GSUWGMRR0_K1_LBSPPA256_LBSPPB1024_LPB32_MIWT4_2_PLR1_SU32_SUM0_SUS256_SKXCCM8_VWA2_VWB2_WGM1_WGMXCC1_WGMXCCGn1
    SolutionIndex: 98
    SolutionNameMin: Cijk_Alik_Bjlk_HHS_BH_UserArgs_MT128x64x64_MI16x16x1_SN_LDSB1_CLR1_GSU0_GSUC0_GSUWGMRR0_K1_LBSPPA512_LBSPPB1024_LPB32_MIWT4_2_PLR1_SU32_SUM0_SUS256_SKXCCM8_VWA4_VWB2_WGM1_WGMXCC1_WGMXCCGn1
    SolutionIndex: 99
    SolutionNameMin: Cijk_Alik_Bjlk_HHS_BH_UserArgs_MT128x64x64_MI16x16x1_SN_LDSB1_CLR1_GSU0_GSUC0_GSUWGMRR0_K1_LBSPPA256_LBSPPB1024_LPB32_MIWT4_2_PLR1_SU32_SUM0_SUS256_SKXCCM8_VWA2_VWB2_WGM4_WGMXCC1_WGMXCCGn1
    SolutionIndex: 100
    SolutionNameMin: Cijk_Alik_Bjlk_HHS_BH_UserArgs_MT64x64x64_MI16x16x1_SN_LDSB1_CLR1_GSU0_GSUC0_GSUWGMRR0_K1_LBSPPA256_LBSPPB1024_LPB32_MIWT2_2_PLR1_SU32_SUM0_SUS256_SKXCCM8_VWA2_VWB2_WGM1_WGMXCC1_WGMXCCGn1
    SolutionIndex: 101
    SolutionNameMin: Cijk_Alik_Bjlk_HHS_BH_UserArgs_MT64x64x64_MI16x16x1_SN_LDSB1_CLR1_GSU0_GSUC0_GSUWGMRR0_K1_LBSPPA256_LBSPPB1024_LPB32_MIWT2_2_PLR1_SU32_SUM0_SUS256_SKXCCM8_VWA2_VWB2_WGM8_WGMXCC1_WGMXCCGn1
    SolutionIndex: 102
    SolutionNameMin: Cijk_Alik_Bjlk_HHS_BH_UserArgs_MT32x64x64_MI16x16x1_SN_LDSB0_CLR1_GSU0_GSUC0_GSUWGMRR0_K1_LBSPPA128_LBSPPB1024_LPB32_MIWT1_2_PLR1_SU32_SUM0_SUS256_SKXCCM8_VWA1_VWB2_WGM1_WGMXCC1_WGMXCCGn1
    SolutionIndex: 103
    SolutionNameMin: Cijk_Alik_Bjlk_HHS_BH_UserArgs_MT64x32x64_MI16x16x1_SN_LDSB0_CLR1_GSU0_GSUC0_GSUWGMRR0_K1_LBSPPA256_LBSPPB512_LPB16_MIWT2_1_PLR1_SU32_SUM0_SUS256_SKXCCM8_VWA2_VWB1_WGM1_WGMXCC1_WGMXCCGn1
    SolutionIndex: 104
    SolutionNameMin: Cijk_Alik_Bjlk_HHS_BH_UserArgs_MT32x32x64_MI16x16x1_SN_LDSB0_CLR1_GSU0_GSUC0_GSUWGMRR0_K1_LBSPPA128_LBSPPB512_LPB16_MIWT1_1_PLR1_SU32_SUM0_SUS256_SKXCCM8_VWA1_VWB1_WGM1_WGMXCC1_WGMXCCGn1
    SolutionIndex: 105
    SolutionNameMin: Cijk_Alik_Bjlk_HHS_BH_UserArgs_MT32x32x64_MI16x16x1_SN_LDSB0_CLR1_GSU0_GSUC0_GSUWGMRR0_K1_LBSPPA128_LBSPPB512_LPB16_MIWT1_1_PLR1_SU32_SUM0_SUS256_SKXCCM8_VWA1_VWB1_WGM4_WGMXCC1_WGMXCCGn1
    SolutionIndex: 106
    SolutionNameMin: Cijk_Alik_Bjlk_HHS_BH_UserArgs_MT64x128x128_MI16x16x1_SN_LDSB1_CLR1_GSU0_GSUC0_GSUWGMRR0_K1_LBSPPA512_LBSPPB2048_LPB0_MIWT2_4_PLR2_SU32_SUM0_SUS256_SKXCCM8_VWA2_VWB4_WGM4_WGMXCC1_WGMXCCGn1
    SolutionIndex: 107
    SolutionNameMin: Cijk_Alik_Bjlk_HHS_BH_UserArgs_MT128x64x128_MI16x16x1_SN_LDSB1_CLR1_GSU0_GSUC0_GSUWGMRR0_K1_LBSPPA512_LBSPPB1024_LPB32_MIWT4_2_PLR2_SU32_SUM0_SUS256_SKXCCM8_VWA2_VWB2_WGM1_WGMXCC1_WGMXCCGn1
    SolutionIndex: 108
    SolutionNameMin: Cijk_Alik_Bjlk_HHS_BH_UserArgs_MT128x64x128_MI16x16x1_SN_LDSB1_CLR1_GSU0_GSUC0_GSUWGMRR0_K1_LBSPPA1024_LBSPPB1024_LPB32_MIWT4_2_PLR2_SU32_SUM0_SUS256_SKXCCM8_VWA4_VWB2_WGM1_WGMXCC1_WGMXCCGn1
    SolutionIndex: 109
    SolutionNameMin: Cijk_Alik_Bjlk_HHS_BH_UserArgs_MT128x64x128_MI16x16x1_SN_LDSB1_CLR1_GSU0_GSUC0_GSUWGMRR0_K1_LBSPPA512_LBSPPB1024_LPB32_MIWT4_2_PLR2_SU32_SUM0_SUS256_SKXCCM8_VWA2_VWB2_WGM4_WGMXCC1_WGMXCCGn1
    SolutionIndex: 110
    SolutionNameMin: Cijk_Alik_Bjlk_HHS_BH_UserArgs_MT128x64x128_MI16x16x1_SN_LDSB1_CLR1_GSU0_GSUC0_GSUWGMRR0_K1_LBSPPA1024_LBSPPB1024_LPB32_MIWT4_2_PLR2_SU32_SUM0_SUS256_SKXCCM8_VWA4_VWB2_WGM4_WGMXCC1_WGMXCCGn1
    SolutionIndex: 111
    SolutionNameMin: Cijk_Alik_Bjlk_HHS_BH_UserArgs_MT128x64x128_MI16x16x1_SN_LDSB1_CLR1_GSU0_GSUC0_GSUWGMRR0_K1_LBSPPA512_LBSPPB1024_LPB32_MIWT4_2_PLR2_SU32_SUM0_SUS256_SKXCCM8_VWA2_VWB2_WGM8_WGMXCC1_WGMXCCGn1
    SolutionIndex: 112
    SolutionNameMin: Cijk_Alik_Bjlk_HHS_BH_UserArgs_MT128x64x128_MI16x16x1_SN_LDSB1_CLR1_GSU0_GSUC0_GSUWGMRR0_K1_LBSPPA1024_LBSPPB1024_LPB32_MIWT4_2_PLR2_SU32_SUM0_SUS256_SKXCCM8_VWA4_VWB2_WGM8_WGMXCC1_WGMXCCGn1
    SolutionIndex: 113
    SolutionNameMin: Cijk_Alik_Bjlk_HHS_BH_UserArgs_MT64x64x128_MI16x16x1_SN_LDSB1_CLR1_GSU0_GSUC0_GSUWGMRR0_K1_LBSPPA512_LBSPPB1024_LPB32_MIWT2_2_PLR2_SU32_SUM0_SUS256_SKXCCM8_VWA2_VWB2_WGM1_WGMXCC1_WGMXCCGn1
    SolutionIndex: 114
    SolutionNameMin: Cijk_Alik_Bjlk_HHS_BH_UserArgs_MT64x64x128_MI16x16x1_SN_LDSB1_CLR1_GSU0_GSUC0_GSUWGMRR0_K1_LBSPPA512_LBSPPB1024_LPB32_MIWT2_2_PLR2_SU32_SUM0_SUS256_SKXCCM8_VWA2_VWB2_WGM4_WGMXCC1_WGMXCCGn1
    SolutionIndex: 115
    SolutionNameMin: Cijk_Alik_Bjlk_HHS_BH_UserArgs_MT64x64x128_MI16x16x1_SN_LDSB1_CLR1_GSU0_GSUC0_GSUWGMRR0_K1_LBSPPA512_LBSPPB1024_LPB32_MIWT2_2_PLR2_SU32_SUM0_SUS256_SKXCCM8_VWA2_VWB2_WGM8_WGMXCC1_WGMXCCGn1
    SolutionIndex: 116
    SolutionNameMin: Cijk_Alik_Bjlk_HHS_BH_UserArgs_MT32x64x128_MI16x16x1_SN_LDSB1_CLR1_GSU0_GSUC0_GSUWGMRR0_K1_LBSPPA256_LBSPPB1024_LPB32_MIWT1_2_PLR1_SU32_SUM0_SUS256_SKXCCM8_VWA1_VWB2_WGM1_WGMXCC1_WGMXCCGn1
    SolutionIndex: 117
    SolutionNameMin: Cijk_Alik_Bjlk_HHS_BH_UserArgs_MT32x64x128_MI16x16x1_SN_LDSB1_CLR1_GSU0_GSUC0_GSUWGMRR0_K1_LBSPPA256_LBSPPB1024_LPB32_MIWT1_2_PLR2_SU32_SUM0_SUS256_SKXCCM8_VWA1_VWB2_WGM1_WGMXCC1_WGMXCCGn1
    SolutionIndex: 118
    SolutionNameMin: Cijk_Alik_Bjlk_HHS_BH_UserArgs_MT32x32x128_MI16x16x1_SN_LDSB1_CLR1_GSU0_GSUC0_GSUWGMRR0_K1_LBSPPA256_LBSPPB512_LPB16_MIWT1_1_PLR1_SU32_SUM0_SUS256_SKXCCM8_VWA1_VWB1_WGM1_WGMXCC1_WGMXCCGn1
    SolutionIndex: 119
    SolutionNameMin: Cijk_Alik_Bjlk_HHS_BH_UserArgs_MT32x32x128_MI16x16x1_SN_LDSB1_CLR1_GSU0_GSUC0_GSUWGMRR0_K1_LBSPPA256_LBSPPB512_LPB16_MIWT1_1_PLR2_SU32_SUM0_SUS256_SKXCCM8_VWA1_VWB1_WGM1_WGMXCC1_WGMXCCGn1
    SolutionIndex: 120
    SolutionNameMin: Cijk_Alik_Bjlk_HHS_BH_UserArgs_MT32x32x128_MI16x16x1_SN_LDSB1_CLR1_GSU0_GSUC0_GSUWGMRR0_K1_LBSPPA256_LBSPPB512_LPB16_MIWT1_1_PLR2_SU32_SUM0_SUS256_SKXCCM8_VWA1_VWB1_WGM4_WGMXCC1_WGMXCCGn1
    SolutionIndex: 121
    SolutionNameMin: Cijk_Alik_Bjlk_HHS_BH_UserArgs_MT32x32x32_MI16x16x1_SN_LDSB0_CLR1_GSU0_GSUC0_GSUWGMRR0_K1_LBSPPA128_LBSPPB256_LPB16_MIWT1_1_PLR1_SU32_SUM0_SUS256_SKXCCM8_VWA1_VWB1_WGM1_WGMXCC1_WGMXCCGn1
- - - [128, 128, 1, 128, 128, 128, 128, 128]
    - [104, 0.083]
  - - [128, 128, 1, 256, 128, 128, 256, 128]
    - [104, 0.15]
  - - [128, 128, 1, 512, 128, 128, 512, 128]
    - [118, 0.256]
  - - [128, 128, 1, 1024, 128, 128, 1024, 128]
    - [54, 0.391]
  - - [128, 128, 1, 2048, 128, 128, 2048, 128]
    - [79, 0.583]
  - - [128, 128, 1, 4096, 128, 128, 4096, 128]
    - [104, 1.037]
  - - [128, 128, 1, 8192, 128, 128, 8192, 128]
    - [119, 1.584]
  - - [128, 256, 1, 128, 128, 128, 128, 256]
    - [54, 0.167]
  - - [128, 256, 1, 256, 128, 128, 256, 256]
    - [54, 0.302]
  - - [128, 256, 1, 512, 128, 128, 512, 256]
    - [54, 0.516]
  - - [128, 256, 1, 1024, 128, 128, 1024, 256]
    - [55, 0.783]
  - - [128, 256, 1, 2048, 128, 128, 2048, 256]
    - [119, 1.146]
  - - [128, 256, 1, 4096, 128, 128, 4096, 256]
    - [105, 1.955]
  - - [128, 256, 1, 8192, 128, 128, 8192, 256]
    - [55, 2.994]
  - - [128, 512, 1, 128, 128, 128, 128, 512]
    - [34, 0.331]
  - - [128, 512, 1, 256, 128, 128, 256, 512]
    - [34, 0.609]
  - - [128, 512, 1, 512, 128, 128, 512, 512]
    - [54, 1.017]
  - - [128, 512, 1, 1024, 128, 128, 1024, 512]
    - [54, 1.512]
  - - [128, 512, 1, 2048, 128, 128, 2048, 512]
    - [119, 2.253]
  - - [128, 512, 1, 4096, 128, 128, 4096, 512]
    - [104, 3.816]
  - - [128, 512, 1, 8192, 128, 128, 8192, 512]
    - [55, 5.534]
  - - [128, 1024, 1, 128, 128, 128, 128, 1024]
    - [35, 0.649]
  - - [128, 1024, 1, 256, 128, 128, 256, 1024]
    - [104, 1.179]
  - - [128, 1024, 1, 512, 128, 128, 512, 1024]
    - [54, 2.025]
  - - [128, 1024, 1, 1024, 128, 128, 1024, 1024]
    - [55, 3.072]
  - - [128, 1024, 1, 2048, 128, 128, 2048, 1024]
    - [57, 4.199]
  - - [128, 1024, 1, 4096, 128, 128, 4096, 1024]
    - [57, 6.266]
  - - [128, 1024, 1, 8192, 128, 128, 8192, 1024]
    - [117, 8.71]
  - - [128, 2048, 1, 128, 128, 128, 128, 2048]
    - [7, 1.253]
  - - [128, 2048, 1, 256, 128, 128, 256, 2048]
    - [34, 2.318]
  - - [128, 2048, 1, 512, 128, 128, 512, 2048]
    - [55, 3.905]
  - - [128, 2048, 1, 1024, 128, 128, 1024, 2048]
    - [56, 5.792]
  - - [128, 2048, 1, 2048, 128, 128, 2048, 2048]
    - [49, 7.329]
  - - [128, 2048, 1, 4096, 128, 128, 4096, 2048]
    - [30, 9.76]
  - - [128, 2048, 1, 8192, 128, 128, 8192, 2048]
    - [45, 13.285]
  - - [128, 4096, 1, 128, 128, 128, 128, 4096]
    - [33, 2.383]
  - - [128, 4096, 1, 256, 128, 128, 256, 4096]
    - [33, 4.151]
  - - [128, 4096, 1, 512, 128, 128, 512, 4096]
    - [47, 6.9]
  - - [128, 4096, 1, 1024, 128, 128, 1024, 4096]
    - [116, 9.406]
  - - [128, 4096, 1, 2048, 128, 128, 2048, 4096]
    - [113, 10.747]
  - - [128, 4096, 1, 4096, 128, 128, 4096, 4096]
    - [27, 13.617]
  - - [128, 4096, 1, 8192, 128, 128, 8192, 4096]
    - [108, 17.093]
  - - [128, 8192, 1, 128, 128, 128, 128, 8192]
    - [100, 4.285]
  - - [128, 8192, 1, 256, 128, 128, 256, 8192]
    - [100, 7.389]
  - - [128, 8192, 1, 512, 128, 128, 512, 8192]
    - [100, 10.749]
  - - [128, 8192, 1, 1024, 128, 128, 1024, 8192]
    - [108, 14.188]
  - - [128, 8192, 1, 2048, 128, 128, 2048, 8192]
    - [46, 14.963]
  - - [128, 8192, 1, 4096, 128, 128, 4096, 8192]
    - [39, 17.683]
  - - [128, 8192, 1, 8192, 128, 128, 8192, 8192]
    - [24, 20.95]
  - - [256, 128, 1, 128, 256, 256, 128, 128]
    - [54, 0.167]
  - - [256, 128, 1, 256, 256, 256, 256, 128]
    - [34, 0.304]
  - - [256, 128, 1, 512, 256, 256, 512, 128]
    - [55, 0.519]
  - - [256, 128, 1, 1024, 256, 256, 1024, 128]
    - [55, 0.78]
  - - [256, 128, 1, 2048, 256, 256, 2048, 128]
    - [119, 1.146]
  - - [256, 128, 1, 4096, 256, 256, 4096, 128]
    - [104, 2.012]
  - - [256, 128, 1, 8192, 256, 256, 8192, 128]
    - [119, 3.09]
  - - [256, 256, 1, 128, 256, 256, 128, 256]
    - [104, 0.338]
  - - [256, 256, 1, 256, 256, 256, 256, 256]
    - [34, 0.593]
  - - [256, 256, 1, 512, 256, 256, 512, 256]
    - [55, 1.016]
  - - [256, 256, 1, 1024, 256, 256, 1024, 256]
    - [54, 1.54]
  - - [256, 256, 1, 2048, 256, 256, 2048, 256]
    - [119, 2.254]
  - - [256, 256, 1, 4096, 256, 256, 4096, 256]
    - [104, 3.842]
  - - [256, 256, 1, 8192, 256, 256, 8192, 256]
    - [55, 5.588]
  - - [256, 512, 1, 128, 256, 256, 128, 512]
    - [34, 0.658]
  - - [256, 512, 1, 256, 256, 256, 256, 512]
    - [104, 1.189]
  - - [256, 512, 1, 512, 256, 256, 512, 512]
    - [54, 2.003]
  - - [256, 512, 1, 1024, 256, 256, 1024, 512]
    - [55, 3.073]
  - - [256, 512, 1, 2048, 256, 256, 2048, 512]
    - [119, 4.281]
  - - [256, 512, 1, 4096, 256, 256, 4096, 512]
    - [55, 6.257]
  - - [256, 512, 1, 8192, 256, 256, 8192, 512]
    - [52, 8.975]
  - - [256, 1024, 1, 128, 256, 256, 128, 1024]
    - [34, 1.259]
  - - [256, 1024, 1, 256, 256, 256, 256, 1024]
    - [34, 2.298]
  - - [256, 1024, 1, 512, 256, 256, 512, 1024]
    - [55, 3.874]
  - - [256, 1024, 1, 1024, 256, 256, 1024, 1024]
    - [119, 5.738]
  - - [256, 1024, 1, 2048, 256, 256, 2048, 1024]
    - [56, 7.47]
  - - [256, 1024, 1, 4096, 256, 256, 4096, 1024]
    - [48, 9.91]
  - - [256, 1024, 1, 8192, 256, 256, 8192, 1024]
    - [41, 13.793]
  - - [256, 2048, 1, 128, 256, 256, 128, 2048]
    - [33, 2.389]
  - - [256, 2048, 1, 256, 256, 256, 256, 2048]
    - [32, 4.155]
  - - [256, 2048, 1, 512, 256, 256, 512, 2048]
    - [47, 6.892]
  - - [256, 2048, 1, 1024, 256, 256, 1024, 2048]
    - [116, 9.452]
  - - [256, 2048, 1, 2048, 256, 256, 2048, 2048]
    - [44, 11.196]
  - - [256, 2048, 1, 4096, 256, 256, 4096, 2048]
    - [28, 14.104]
  - - [256, 2048, 1, 8192, 256, 256, 8192, 2048]
    - [41, 17.87]
  - - [256, 4096, 1, 128, 256, 256, 128, 4096]
    - [100, 4.169]
  - - [256, 4096, 1, 256, 256, 256, 256, 4096]
    - [100, 7.069]
  - - [256, 4096, 1, 512, 256, 256, 512, 4096]
    - [100, 10.712]
  - - [256, 4096, 1, 1024, 256, 256, 1024, 4096]
    - [115, 14.235]
  - - [256, 4096, 1, 2048, 256, 256, 2048, 4096]
    - [113, 15.964]
  - - [256, 4096, 1, 4096, 256, 256, 4096, 4096]
    - [110, 18.642]
  - - [256, 4096, 1, 8192, 256, 256, 8192, 4096]
    - [94, 21.108]
  - - [256, 8192, 1, 128, 256, 256, 128, 8192]
    - [78, 6.901]
  - - [256, 8192, 1, 256, 256, 256, 256, 8192]
    - [97, 10.972]
  - - [256, 8192, 1, 512, 256, 256, 512, 8192]
    - [107, 15.301]
  - - [256, 8192, 1, 1024, 256, 256, 1024, 8192]
    - [108, 19.015]
  - - [256, 8192, 1, 2048, 256, 256, 2048, 8192]
    - [111, 20.259]
  - - [256, 8192, 1, 4096, 256, 256, 4096, 8192]
    - [109, 22.739]
  - - [256, 8192, 1, 8192, 256, 256, 8192, 8192]
    - [89, 24.17]
  - - [512, 128, 1, 128, 512, 512, 128, 128]
    - [104, 0.33]
  - - [512, 128, 1, 256, 512, 512, 256, 128]
    - [34, 0.604]
  - - [512, 128, 1, 512, 512, 512, 512, 128]
    - [54, 1.018]
  - - [512, 128, 1, 1024, 512, 512, 1024, 128]
    - [55, 1.502]
  - - [512, 128, 1, 2048, 512, 512, 2048, 128]
    - [54, 2.22]
  - - [512, 128, 1, 4096, 512, 512, 4096, 128]
    - [104, 3.864]
  - - [512, 128, 1, 8192, 512, 512, 8192, 128]
    - [120, 5.871]
  - - [512, 256, 1, 128, 512, 512, 128, 256]
    - [34, 0.654]
  - - [512, 256, 1, 256, 512, 512, 256, 256]
    - [34, 1.185]
  - - [512, 256, 1, 512, 512, 512, 512, 256]
    - [54, 2.006]
  - - [512, 256, 1, 1024, 512, 512, 1024, 256]
    - [55, 3.064]
  - - [512, 256, 1, 2048, 512, 512, 2048, 256]
    - [119, 4.279]
  - - [512, 256, 1, 4096, 512, 512, 4096, 256]
    - [102, 6.421]
  - - [512, 256, 1, 8192, 512, 512, 8192, 256]
    - [53, 9.142]
  - - [512, 512, 1, 128, 512, 512, 128, 512]
    - [7, 1.24]
  - - [512, 512, 1, 256, 512, 512, 256, 512]
    - [34, 2.292]
  - - [512, 512, 1, 512, 512, 512, 512, 512]
    - [34, 3.874]
  - - [512, 512, 1, 1024, 512, 512, 1024, 512]
    - [119, 5.755]
  - - [512, 512, 1, 2048, 512, 512, 2048, 512]
    - [55, 7.624]
  - - [512, 512, 1, 4096, 512, 512, 4096, 512]
    - [47, 10.028]
  - - [512, 512, 1, 8192, 512, 512, 8192, 512]
    - [40, 14.062]
  - - [512, 1024, 1, 128, 512, 512, 128, 1024]
    - [33, 2.351]
  - - [512, 1024, 1, 256, 512, 512, 256, 1024]
    - [33, 4.173]
  - - [512, 1024, 1, 512, 512, 512, 512, 1024]
    - [51, 6.78]
  - - [512, 1024, 1, 1024, 512, 512, 1024, 1024]
    - [50, 9.348]
  - - [512, 1024, 1, 2048, 512, 512, 2048, 1024]
    - [43, 11.221]
  - - [512, 1024, 1, 4096, 512, 512, 4096, 1024]
    - [46, 14.504]
  - - [512, 1024, 1, 8192, 512, 512, 8192, 1024]
    - [40, 18.575]
  - - [512, 2048, 1, 128, 512, 512, 128, 2048]
    - [31, 4.197]
  - - [512, 2048, 1, 256, 512, 512, 256, 2048]
    - [31, 7.328]
  - - [512, 2048, 1, 512, 512, 512, 512, 2048]
    - [100, 10.809]
  - - [512, 2048, 1, 1024, 512, 512, 1024, 2048]
    - [113, 14.395]
  - - [512, 2048, 1, 2048, 512, 512, 2048, 2048]
    - [46, 16.169]
  - - [512, 2048, 1, 4096, 512, 512, 4096, 2048]
    - [40, 18.989]
  - - [512, 2048, 1, 8192, 512, 512, 8192, 2048]
    - [94, 20.71]
  - - [512, 4096, 1, 128, 512, 512, 128, 4096]
    - [78, 6.885]
  - - [512, 4096, 1, 256, 512, 512, 256, 4096]
    - [97, 10.948]
  - - [512, 4096, 1, 512, 512, 512, 512, 4096]
    - [108, 15.208]
  - - [512, 4096, 1, 1024, 512, 512, 1024, 4096]
    - [107, 19.411]
  - - [512, 4096, 1, 2048, 512, 512, 2048, 4096]
    - [108, 20.273]
  - - [512, 4096, 1, 4096, 512, 512, 4096, 4096]
    - [108, 23.164]
  - - [512, 4096, 1, 8192, 512, 512, 8192, 4096]
    - [96, 24.583]
  - - [512, 8192, 1, 128, 512, 512, 128, 8192]
    - [91, 9.534]
  - - [512, 8192, 1, 256, 512, 512, 256, 8192]
    - [91, 14.779]
  - - [512, 8192, 1, 512, 512, 512, 512, 8192]
    - [91, 20.612]
  - - [512, 8192, 1, 1024, 512, 512, 1024, 8192]
    - [92, 23.566]
  - - [512, 8192, 1, 2048, 512, 512, 2048, 8192]
    - [96, 26.592]
  - - [512, 8192, 1, 4096, 512, 512, 4096, 8192]
    - [73, 25.381]
  - - [512, 8192, 1, 8192, 512, 512, 8192, 8192]
    - [19, 28.224]
  - - [1024, 128, 1, 128, 1024, 1024, 128, 128]
    - [104, 0.659]
  - - [1024, 128, 1, 256, 1024, 1024, 256, 128]
    - [34, 1.178]
  - - [1024, 128, 1, 512, 1024, 1024, 512, 128]
    - [34, 2.0]
  - - [1024, 128, 1, 1024, 1024, 1024, 1024, 128]
    - [55, 2.975]
  - - [1024, 128, 1, 2048, 1024, 1024, 2048, 128]
    - [119, 4.282]
  - - [1024, 128, 1, 4096, 1024, 1024, 4096, 128]
    - [102, 6.412]
  - - [1024, 128, 1, 8192, 1024, 1024, 8192, 128]
    - [48, 8.986]
  - - [1024, 256, 1, 128, 1024, 1024, 128, 256]
    - [34, 1.298]
  - - [1024, 256, 1, 256, 1024, 1024, 256, 256]
    - [34, 2.309]
  - - [1024, 256, 1, 512, 1024, 1024, 512, 256]
    - [118, 3.896]
  - - [1024, 256, 1, 1024, 1024, 1024, 1024, 256]
    - [54, 5.938]
  - - [1024, 256, 1, 2048, 1024, 1024, 2048, 256]
    - [55, 7.578]
  - - [1024, 256, 1, 4096, 1024, 1024, 4096, 256]
    - [47, 9.979]
  - - [1024, 256, 1, 8192, 1024, 1024, 8192, 256]
    - [46, 13.212]
  - - [1024, 512, 1, 128, 1024, 1024, 128, 512]
    - [33, 2.359]
  - - [1024, 512, 1, 256, 1024, 1024, 256, 512]
    - [117, 4.102]
  - - [1024, 512, 1, 512, 1024, 1024, 512, 512]
    - [33, 6.762]
  - - [1024, 512, 1, 1024, 1024, 1024, 1024, 512]
    - [32, 9.546]
  - - [1024, 512, 1, 2048, 1024, 1024, 2048, 512]
    - [47, 11.465]
  - - [1024, 512, 1, 4096, 1024, 1024, 4096, 512]
    - [43, 14.812]
  - - [1024, 512, 1, 8192, 1024, 1024, 8192, 512]
    - [41, 17.909]
  - - [1024, 1024, 1, 128, 1024, 1024, 128, 1024]
    - [100, 4.201]
  - - [1024, 1024, 1, 256, 1024, 1024, 256, 1024]
    - [31, 7.374]
  - - [1024, 1024, 1, 512, 1024, 1024, 512, 1024]
    - [43, 10.598]
  - - [1024, 1024, 1, 1024, 1024, 1024, 1024, 1024]
    - [46, 14.202]
  - - [1024, 1024, 1, 2048, 1024, 1024, 2048, 1024]
    - [44, 16.401]
  - - [1024, 1024, 1, 4096, 1024, 1024, 4096, 1024]
    - [36, 18.901]
  - - [1024, 1024, 1, 8192, 1024, 1024, 8192, 1024]
    - [94, 20.88]
  - - [1024, 2048, 1, 128, 1024, 1024, 128, 2048]
    - [97, 6.854]
  - - [1024, 2048, 1, 256, 1024, 1024, 256, 2048]
    - [98, 10.851]
  - - [1024, 2048, 1, 512, 1024, 1024, 512, 2048]
    - [97, 15.492]
  - - [1024, 2048, 1, 1024, 1024, 1024, 1024, 2048]
    - [111, 18.728]
  - - [1024, 2048, 1, 2048, 1024, 1024, 2048, 2048]
    - [40, 20.361]
  - - [1024, 2048, 1, 4096, 1024, 1024, 4096, 2048]
    - [111, 22.842]
  - - [1024, 2048, 1, 8192, 1024, 1024, 8192, 2048]
    - [87, 24.032]
  - - [1024, 4096, 1, 128, 1024, 1024, 128, 4096]
    - [77, 9.448]
  - - [1024, 4096, 1, 256, 1024, 1024, 256, 4096]
    - [90, 14.835]
  - - [1024, 4096, 1, 512, 1024, 1024, 512, 4096]
    - [91, 20.675]
  - - [1024, 4096, 1, 1024, 1024, 1024, 1024, 4096]
    - [26, 23.613]
  - - [1024, 4096, 1, 2048, 1024, 1024, 2048, 4096]
    - [92, 26.522]
  - - [1024, 4096, 1, 4096, 1024, 1024, 4096, 4096]
    - [86, 24.795]
  - - [1024, 4096, 1, 8192, 1024, 1024, 8192, 4096]
    - [88, 26.745]
  - - [1024, 8192, 1, 128, 1024, 1024, 128, 8192]
    - [75, 12.533]
  - - [1024, 8192, 1, 256, 1024, 1024, 256, 8192]
    - [75, 17.668]
  - - [1024, 8192, 1, 512, 1024, 1024, 512, 8192]
    - [81, 21.959]
  - - [1024, 8192, 1, 1024, 1024, 1024, 1024, 8192]
    - [18, 26.589]
  - - [1024, 8192, 1, 2048, 1024, 1024, 2048, 8192]
    - [20, 31.707]
  - - [1024, 8192, 1, 4096, 1024, 1024, 4096, 8192]
    - [13, 27.563]
  - - [1024, 8192, 1, 8192, 1024, 1024, 8192, 8192]
    - [61, 30.293]
  - - [2048, 128, 1, 128, 2048, 2048, 128, 128]
    - [104, 1.27]
  - - [2048, 128, 1, 256, 2048, 2048, 256, 128]
    - [54, 2.33]
  - - [2048, 128, 1, 512, 2048, 2048, 512, 128]
    - [54, 3.92]
  - - [2048, 128, 1, 1024, 2048, 2048, 1024, 128]
    - [55, 5.976]
  - - [2048, 128, 1, 2048, 2048, 2048, 2048, 128]
    - [55, 7.523]
  - - [2048, 128, 1, 4096, 2048, 2048, 4096, 128]
    - [47, 9.983]
  - - [2048, 128, 1, 8192, 2048, 2048, 8192, 128]
    - [42, 12.822]
  - - [2048, 256, 1, 128, 2048, 2048, 128, 256]
    - [33, 2.397]
  - - [2048, 256, 1, 256, 2048, 2048, 256, 256]
    - [32, 4.23]
  - - [2048, 256, 1, 512, 2048, 2048, 512, 256]
    - [47, 6.972]
  - - [2048, 256, 1, 1024, 2048, 2048, 1024, 256]
    - [32, 9.444]
  - - [2048, 256, 1, 2048, 2048, 2048, 2048, 256]
    - [47, 11.39]
  - - [2048, 256, 1, 4096, 2048, 2048, 4096, 256]
    - [43, 14.203]
  - - [2048, 256, 1, 8192, 2048, 2048, 8192, 256]
    - [38, 17.746]
  - - [2048, 512, 1, 128, 2048, 2048, 128, 512]
    - [100, 4.255]
  - - [2048, 512, 1, 256, 2048, 2048, 256, 512]
    - [31, 7.341]
  - - [2048, 512, 1, 512, 2048, 2048, 512, 512]
    - [31, 10.901]
  - - [2048, 512, 1, 1024, 2048, 2048, 1024, 512]
    - [43, 14.488]
  - - [2048, 512, 1, 2048, 2048, 2048, 2048, 512]
    - [43, 16.823]
  - - [2048, 512, 1, 4096, 2048, 2048, 4096, 512]
    - [94, 18.917]
  - - [2048, 512, 1, 8192, 2048, 2048, 8192, 512]
    - [92, 20.702]
  - - [2048, 1024, 1, 128, 2048, 2048, 128, 1024]
    - [6, 6.806]
  - - [2048, 1024, 1, 256, 2048, 2048, 256, 1024]
    - [98, 10.891]
  - - [2048, 1024, 1, 512, 2048, 2048, 512, 1024]
    - [97, 15.442]
  - - [2048, 1024, 1, 1024, 2048, 2048, 1024, 1024]
    - [111, 18.951]
  - - [2048, 1024, 1, 2048, 2048, 2048, 2048, 1024]
    - [24, 20.202]
  - - [2048, 1024, 1, 4096, 2048, 2048, 4096, 1024]
    - [112, 23.052]
  - - [2048, 1024, 1, 8192, 2048, 2048, 8192, 1024]
    - [84, 24.033]
  - - [2048, 2048, 1, 128, 2048, 2048, 128, 2048]
    - [91, 9.711]
  - - [2048, 2048, 1, 256, 2048, 2048, 256, 2048]
    - [26, 14.818]
  - - [2048, 2048, 1, 512, 2048, 2048, 512, 2048]
    - [93, 20.396]
  - - [2048, 2048, 1, 1024, 2048, 2048, 1024, 2048]
    - [93, 23.224]
  - - [2048, 2048, 1, 2048, 2048, 2048, 2048, 2048]
    - [96, 26.14]
  - - [2048, 2048, 1, 4096, 2048, 2048, 4096, 2048]
    - [96, 25.617]
  - - [2048, 2048, 1, 8192, 2048, 2048, 8192, 2048]
    - [88, 26.677]
  - - [2048, 4096, 1, 128, 2048, 2048, 128, 4096]
    - [74, 12.444]
  - - [2048, 4096, 1, 256, 2048, 2048, 256, 4096]
    - [5, 17.346]
  - - [2048, 4096, 1, 512, 2048, 2048, 512, 4096]
    - [20, 21.878]
  - - [2048, 4096, 1, 1024, 2048, 2048, 1024, 4096]
    - [15, 26.741]
  - - [2048, 4096, 1, 2048, 2048, 2048, 2048, 4096]
    - [17, 31.691]
  - - [2048, 4096, 1, 4096, 2048, 2048, 4096, 4096]
    - [87, 27.01]
  - - [2048, 4096, 1, 8192, 2048, 2048, 8192, 4096]
    - [61, 30.806]
  - - [2048, 8192, 1, 128, 2048, 2048, 128, 8192]
    - [65, 12.56]
  - - [2048, 8192, 1, 256, 2048, 2048, 256, 8192]
    - [60, 18.029]
  - - [2048, 8192, 1, 512, 2048, 2048, 512, 8192]
    - [60, 24.357]
  - - [2048, 8192, 1, 1024, 2048, 2048, 1024, 8192]
    - [66, 30.395]
  - - [2048, 8192, 1, 2048, 2048, 2048, 2048, 8192]
    - [69, 27.508]
  - - [2048, 8192, 1, 4096, 2048, 2048, 4096, 8192]
    - [59, 30.288]
  - - [2048, 8192, 1, 8192, 2048, 2048, 8192, 8192]
    - [61, 31.636]
  - - [4096, 128, 1, 128, 4096, 4096, 128, 128]
    - [103, 2.411]
  - - [4096, 128, 1, 256, 4096, 4096, 256, 128]
    - [33, 4.235]
  - - [4096, 128, 1, 512, 4096, 4096, 512, 128]
    - [117, 6.927]
  - - [4096, 128, 1, 1024, 4096, 4096, 1024, 128]
    - [116, 9.569]
  - - [4096, 128, 1, 2048, 4096, 4096, 2048, 128]
    - [115, 11.431]
  - - [4096, 128, 1, 4096, 4096, 4096, 4096, 128]
    - [43, 13.907]
  - - [4096, 128, 1, 8192, 4096, 4096, 8192, 128]
    - [110, 17.059]
  - - [4096, 256, 1, 128, 4096, 4096, 128, 256]
    - [31, 4.222]
  - - [4096, 256, 1, 256, 4096, 4096, 256, 256]
    - [43, 7.298]
  - - [4096, 256, 1, 512, 4096, 4096, 512, 256]
    - [113, 10.783]
  - - [4096, 256, 1, 1024, 4096, 4096, 1024, 256]
    - [114, 14.273]
  - - [4096, 256, 1, 2048, 4096, 4096, 2048, 256]
    - [115, 16.841]
  - - [4096, 256, 1, 4096, 4096, 4096, 4096, 256]
    - [94, 18.645]
  - - [4096, 256, 1, 8192, 4096, 4096, 8192, 256]
    - [92, 20.698]
  - - [4096, 512, 1, 128, 4096, 4096, 128, 512]
    - [97, 6.911]
  - - [4096, 512, 1, 256, 4096, 4096, 256, 512]
    - [97, 11.04]
  - - [4096, 512, 1, 512, 4096, 4096, 512, 512]
    - [99, 15.374]
  - - [4096, 512, 1, 1024, 4096, 4096, 1024, 512]
    - [112, 19.362]
  - - [4096, 512, 1, 2048, 4096, 4096, 2048, 512]
    - [37, 21.405]
  - - [4096, 512, 1, 4096, 4096, 4096, 4096, 512]
    - [112, 22.754]
  - - [4096, 512, 1, 8192, 4096, 4096, 8192, 512]
    - [83, 24.188]
  - - [4096, 1024, 1, 128, 4096, 4096, 128, 1024]
    - [25, 9.476]
  - - [4096, 1024, 1, 256, 4096, 4096, 256, 1024]
    - [93, 14.725]
  - - [4096, 1024, 1, 512, 4096, 4096, 512, 1024]
    - [93, 20.436]
  - - [4096, 1024, 1, 1024, 4096, 4096, 1024, 1024]
    - [96, 23.425]
  - - [4096, 1024, 1, 2048, 4096, 4096, 2048, 1024]
    - [24, 26.682]
  - - [4096, 1024, 1, 4096, 4096, 4096, 4096, 1024]
    - [96, 25.655]
  - - [4096, 1024, 1, 8192, 4096, 4096, 8192, 1024]
    - [85, 26.875]
  - - [4096, 2048, 1, 128, 4096, 4096, 128, 2048]
    - [76, 12.237]
  - - [4096, 2048, 1, 256, 4096, 4096, 256, 2048]
    - [76, 16.929]
  - - [4096, 2048, 1, 512, 4096, 4096, 512, 2048]
    - [13, 22.184]
  - - [4096, 2048, 1, 1024, 4096, 4096, 1024, 2048]
    - [16, 26.331]
  - - [4096, 2048, 1, 2048, 4096, 4096, 2048, 2048]
    - [14, 31.374]
  - - [4096, 2048, 1, 4096, 4096, 4096, 4096, 2048]
    - [62, 27.239]
  - - [4096, 2048, 1, 8192, 4096, 4096, 8192, 2048]
    - [68, 30.047]
  - - [4096, 4096, 1, 128, 4096, 4096, 128, 4096]
    - [4, 12.697]
  - - [4096, 4096, 1, 256, 4096, 4096, 256, 4096]
    - [4, 18.378]
  - - [4096, 4096, 1, 512, 4096, 4096, 512, 4096]
    - [3, 24.353]
  - - [4096, 4096, 1, 1024, 4096, 4096, 1024, 4096]
    - [3, 31.111]
  - - [4096, 4096, 1, 2048, 4096, 4096, 2048, 4096]
    - [68, 27.382]
  - - [4096, 4096, 1, 4096, 4096, 4096, 4096, 4096]
    - [61, 30.885]
  - - [4096, 4096, 1, 8192, 4096, 4096, 8192, 4096]
    - [61, 33.14]
  - - [4096, 8192, 1, 128, 4096, 4096, 128, 8192]
    - [23, 12.032]
  - - [4096, 8192, 1, 256, 4096, 4096, 256, 8192]
    - [83, 17.165]
  - - [4096, 8192, 1, 512, 4096, 4096, 512, 8192]
    - [71, 21.548]
  - - [4096, 8192, 1, 1024, 4096, 4096, 1024, 8192]
    - [58, 25.669]
  - - [4096, 8192, 1, 2048, 4096, 4096, 2048, 8192]
    - [61, 29.702]
  - - [4096, 8192, 1, 4096, 4096, 4096, 4096, 8192]
    - [80, 32.05]
  - - [4096, 8192, 1, 8192, 4096, 4096, 8192, 8192]
    - [60, 34.766]
  - - [8192, 128, 1, 128, 8192, 8192, 128, 128]
    - [29, 4.166]
  - - [8192, 128, 1, 256, 8192, 8192, 256, 128]
    - [101, 7.019]
  - - [8192, 128, 1, 512, 8192, 8192, 512, 128]
    - [100, 10.686]
  - - [8192, 128, 1, 1024, 8192, 8192, 1024, 128]
    - [114, 14.179]
  - - [8192, 128, 1, 2048, 8192, 8192, 2048, 128]
    - [43, 15.788]
  - - [8192, 128, 1, 4096, 8192, 8192, 4096, 128]
    - [96, 18.248]
  - - [8192, 128, 1, 8192, 8192, 8192, 8192, 128]
    - [94, 20.789]
  - - [8192, 256, 1, 128, 8192, 8192, 128, 256]
    - [99, 6.824]
  - - [8192, 256, 1, 256, 8192, 8192, 256, 256]
    - [111, 10.716]
  - - [8192, 256, 1, 512, 8192, 8192, 512, 256]
    - [99, 15.351]
  - - [8192, 256, 1, 1024, 8192, 8192, 1024, 256]
    - [111, 19.136]
  - - [8192, 256, 1, 2048, 8192, 8192, 2048, 256]
    - [22, 19.779]
  - - [8192, 256, 1, 4096, 8192, 8192, 4096, 256]
    - [106, 22.617]
  - - [8192, 256, 1, 8192, 8192, 8192, 8192, 256]
    - [24, 24.707]
  - - [8192, 512, 1, 128, 8192, 8192, 128, 512]
    - [93, 9.505]
  - - [8192, 512, 1, 256, 8192, 8192, 256, 512]
    - [95, 14.798]
  - - [8192, 512, 1, 512, 8192, 8192, 512, 512]
    - [95, 20.27]
  - - [8192, 512, 1, 1024, 8192, 8192, 1024, 512]
    - [95, 23.64]
  - - [8192, 512, 1, 2048, 8192, 8192, 2048, 512]
    - [96, 26.24]
  - - [8192, 512, 1, 4096, 8192, 8192, 4096, 512]
    - [11, 25.947]
  - - [8192, 512, 1, 8192, 8192, 8192, 8192, 512]
    - [12, 27.387]
  - - [8192, 1024, 1, 128, 8192, 8192, 128, 1024]
    - [70, 11.92]
  - - [8192, 1024, 1, 256, 8192, 8192, 256, 1024]
    - [72, 17.053]
  - - [8192, 1024, 1, 512, 8192, 8192, 512, 1024]
    - [14, 22.211]
  - - [8192, 1024, 1, 1024, 8192, 8192, 1024, 1024]
    - [13, 27.388]
  - - [8192, 1024, 1, 2048, 8192, 8192, 2048, 1024]
    - [9, 31.046]
  - - [8192, 1024, 1, 4096, 8192, 8192, 4096, 1024]
    - [10, 27.416]
  - - [8192, 1024, 1, 8192, 8192, 8192, 8192, 1024]
    - [62, 30.086]
  - - [8192, 2048, 1, 128, 8192, 8192, 128, 2048]
    - [63, 12.502]
  - - [8192, 2048, 1, 256, 8192, 8192, 256, 2048]
    - [1, 18.159]
  - - [8192, 2048, 1, 512, 8192, 8192, 512, 2048]
    - [68, 24.182]
  - - [8192, 2048, 1, 1024, 8192, 8192, 1024, 2048]
    - [0, 30.579]
  - - [8192, 2048, 1, 2048, 8192, 8192, 2048, 2048]
    - [80, 27.581]
  - - [8192, 2048, 1, 4096, 8192, 8192, 4096, 2048]
    - [68, 29.929]
  - - [8192, 2048, 1, 8192, 8192, 8192, 8192, 2048]
    - [64, 32.085]
  - - [8192, 4096, 1, 128, 8192, 8192, 128, 4096]
    - [22, 11.907]
  - - [8192, 4096, 1, 256, 8192, 8192, 256, 4096]
    - [11, 17.023]
  - - [8192, 4096, 1, 512, 8192, 8192, 512, 4096]
    - [82, 21.342]
  - - [8192, 4096, 1, 1024, 8192, 8192, 1024, 4096]
    - [61, 26.497]
  - - [8192, 4096, 1, 2048, 8192, 8192, 2048, 4096]
    - [60, 30.17]
  - - [8192, 4096, 1, 4096, 8192, 8192, 4096, 4096]
    - [61, 32.549]
  - - [8192, 4096, 1, 8192, 8192, 8192, 8192, 4096]
    - [60, 34.652]
  - - [8192, 8192, 1, 128, 8192, 8192, 128, 8192]
    - [11, 13.003]
  - - [8192, 8192, 1, 256, 8192, 8192, 256, 8192]
    - [21, 16.054]
  - - [8192, 8192, 1, 512, 8192, 8192, 512, 8192]
    - [8, 21.871]
  - - [8192, 8192, 1, 1024, 8192, 8192, 1024, 8192]
    - [68, 27.286]
  - - [8192, 8192, 1, 2048, 8192, 8192, 2048, 8192]
    - [67, 32.385]
  - - [8192, 8192, 1, 4096, 8192, 8192, 4096, 8192]
    - [2, 35.192]
  - - [8192, 8192, 1, 8192, 8192, 8192, 8192, 8192]
    - [2, 36.353]
  - - [1, 1, 1, 32, 1, 1, 32, 1]
    - [121, 0.0]
- null
- null
- ExperimentalStreamK
- GridBased
