library/src/amd_detail/rocblaslt/src/Tensile/Logic/asm_full/aquavanjaram/gfx942/StreamK/aquavanjaram942_Cijk_Ailk_Bjlk_BSS_BH_UserArgs.yaml
- {MinimumRequiredVersion: 4.33.0}
- aquavanjaram942
- gfx942
- [Device 0049, Device 0050]
    SolutionIndex: 0
    SolutionNameMin: Cijk_Ailk_Bjlk_BSS_BH_UserArgs_MT256x256x32_MI16x16x1_SN_LDSB1_CLR1_GSU0_GSUC0_GSUWGMRR0_K1_LBSPPA2048_LBSPPB2048_LPA32_LPB32_MIWT8_8_PLR1_SU32_SUM0_SUS256_SKXCCM0_VWA2_VWB2_WGM4_WGMXCC1_WGMXCCGn1
    SolutionIndex: 1
    SolutionNameMin: Cijk_Ailk_Bjlk_BSS_BH_UserArgs_MT256x256x32_MI16x16x1_SN_LDSB0_CLR1_GSU0_GSUC0_GSUWGMRR0_K1_LBSPPA2048_LBSPPB2048_LPA0_LPB0_MIWT8_8_PLR1_SU32_SUM0_SUS256_SKXCCM0_VWA4_VWB8_WGM4_WGMXCC1_WGMXCCGn1
    SolutionIndex: 2
    SolutionNameMin: Cijk_Ailk_Bjlk_BSS_BH_UserArgs_MT256x256x32_MI16x16x1_SN_LDSB0_CLR1_GSU0_GSUC0_GSUWGMRR0_K1_LBSPPA2048_LBSPPB2048_LPA0_LPB0_MIWT8_8_PLR1_SU32_SUM0_SUS256_SKXCCM0_VWA4_VWB8_WGM8_WGMXCC1_WGMXCCGn1
    SolutionIndex: 3
    SolutionNameMin: Cijk_Ailk_Bjlk_BSS_BH_UserArgs_MT128x256x32_MI16x16x1_SN_LDSB1_CLR1_GSU0_GSUC0_GSUWGMRR0_K1_LBSPPA1024_LBSPPB2048_LPA0_LPB0_MIWT4_8_PLR1_SU32_SUM0_SUS256_SKXCCM0_VWA4_VWB8_WGM1_WGMXCC1_WGMXCCGn1
    SolutionIndex: 4
    SolutionNameMin: Cijk_Ailk_Bjlk_BSS_BH_UserArgs_MT128x256x32_MI16x16x1_SN_LDSB1_CLR1_GSU0_GSUC0_GSUWGMRR0_K1_LBSPPA1024_LBSPPB2048_LPA0_LPB0_MIWT4_8_PLR1_SU32_SUM0_SUS256_SKXCCM0_VWA4_VWB8_WGM4_WGMXCC1_WGMXCCGn1
    SolutionIndex: 5
    SolutionNameMin: Cijk_Ailk_Bjlk_BSS_BH_UserArgs_MT128x256x32_MI16x16x1_SN_LDSB1_CLR1_GSU0_GSUC0_GSUWGMRR0_K1_LBSPPA1024_LBSPPB2048_LPA0_LPB0_MIWT4_8_PLR1_SU32_SUM0_SUS256_SKXCCM0_VWA4_VWB8_WGM8_WGMXCC1_WGMXCCGn1
    SolutionIndex: 6
    SolutionNameMin: Cijk_Ailk_Bjlk_BSS_BH_UserArgs_MT128x128x32_MI16x16x1_SN_LDSB1_CLR1_GSU0_GSUC0_GSUWGMRR0_K1_LBSPPA1024_LBSPPB1024_LPA0_LPB32_MIWT4_4_PLR1_SU32_SUM0_SUS256_SKXCCM0_VWA4_VWB2_WGM4_WGMXCC1_WGMXCCGn1
    SolutionIndex: 7
    SolutionNameMin: Cijk_Ailk_Bjlk_BSS_BH_UserArgs_MT128x128x32_MI16x16x1_SN_LDSB1_CLR1_GSU0_GSUC0_GSUWGMRR0_K1_LBSPPA1024_LBSPPB1024_LPA32_LPB0_MIWT4_4_PLR1_SU32_SUM0_SUS256_SKXCCM0_VWA2_VWB4_WGM8_WGMXCC1_WGMXCCGn1
    SolutionIndex: 8
    SolutionNameMin: Cijk_Ailk_Bjlk_BSS_BH_UserArgs_MT128x64x32_MI16x16x1_SN_LDSB0_CLR1_GSU0_GSUC0_GSUWGMRR0_K1_LBSPPA1024_LBSPPB512_LPA0_LPB16_MIWT4_2_PLR1_SU32_SUM0_SUS256_SKXCCM0_VWA4_VWB1_WGM4_WGMXCC1_WGMXCCGn1
    SolutionIndex: 9
    SolutionNameMin: Cijk_Ailk_Bjlk_BSS_BH_UserArgs_MT128x64x32_MI16x16x1_SN_LDSB0_CLR1_GSU0_GSUC0_GSUWGMRR0_K1_LBSPPA1024_LBSPPB512_LPA0_LPB32_MIWT4_2_PLR1_SU32_SUM0_SUS256_SKXCCM0_VWA4_VWB2_WGM4_WGMXCC1_WGMXCCGn1
    SolutionIndex: 10
    SolutionNameMin: Cijk_Ailk_Bjlk_BSS_BH_UserArgs_MT32x32x32_MI16x16x1_SN_LDSB0_CLR1_GSU0_GSUC0_GSUWGMRR0_K1_LBSPPA256_LBSPPB256_LPA16_LPB16_MIWT1_1_PLR1_SU32_SUM0_SUS256_SKXCCM0_VWA1_VWB1_WGM1_WGMXCC1_WGMXCCGn1
    SolutionIndex: 11
    SolutionNameMin: Cijk_Ailk_Bjlk_BSS_BH_UserArgs_MT32x32x32_MI16x16x1_SN_LDSB0_CLR0_GSU0_GSUC0_GSUWGMRR0_K1_LBSPPA256_LBSPPB256_LPA16_LPB16_MIWT1_1_PLR0_SU32_SUM0_SUS256_SKXCCM0_VWA1_VWB1_WGM1_WGMXCC1_WGMXCCGn1
    SolutionIndex: 12
    SolutionNameMin: Cijk_Ailk_Bjlk_BSS_BH_UserArgs_MT128x256x64_MI16x16x1_SN_LDSB1_CLR1_GSU0_GSUC0_GSUWGMRR0_K1_LBSPPA1024_LBSPPB2048_LPA0_LPB0_MIWT4_8_PLR1_SU32_SUM0_SUS256_SKXCCM0_VWA4_VWB8_WGM4_WGMXCC1_WGMXCCGn1
    SolutionIndex: 13
    SolutionNameMin: Cijk_Ailk_Bjlk_BSS_BH_UserArgs_MT128x256x64_MI16x16x1_SN_LDSB1_CLR1_GSU0_GSUC0_GSUWGMRR0_K1_LBSPPA1024_LBSPPB2048_LPA0_LPB0_MIWT4_8_PLR2_SU32_SUM0_SUS256_SKXCCM0_VWA4_VWB8_WGM4_WGMXCC1_WGMXCCGn1
    SolutionIndex: 14
    SolutionNameMin: Cijk_Ailk_Bjlk_BSS_BH_UserArgs_MT256x128x64_MI16x16x1_SN_LDSB1_CLR1_GSU0_GSUC0_GSUWGMRR0_K1_LBSPPA2048_LBSPPB1024_LPA0_LPB32_MIWT8_4_PLR1_SU32_SUM0_SUS256_SKXCCM0_VWA4_VWB2_WGM1_WGMXCC1_WGMXCCGn1
    SolutionIndex: 15
    SolutionNameMin: Cijk_Ailk_Bjlk_BSS_BH_UserArgs_MT256x128x64_MI16x16x1_SN_LDSB1_CLR1_GSU0_GSUC0_GSUWGMRR0_K1_LBSPPA2048_LBSPPB1024_LPA0_LPB0_MIWT8_4_PLR1_SU32_SUM0_SUS256_SKXCCM0_VWA4_VWB4_WGM1_WGMXCC1_WGMXCCGn1
    SolutionIndex: 16
    SolutionNameMin: Cijk_Ailk_Bjlk_BSS_BH_UserArgs_MT256x128x64_MI16x16x1_SN_LDSB1_CLR1_GSU0_GSUC0_GSUWGMRR0_K1_LBSPPA2048_LBSPPB1024_LPA0_LPB0_MIWT8_4_PLR2_SU32_SUM0_SUS256_SKXCCM0_VWA4_VWB4_WGM1_WGMXCC1_WGMXCCGn1
    SolutionIndex: 17
    SolutionNameMin: Cijk_Ailk_Bjlk_BSS_BH_UserArgs_MT256x128x64_MI16x16x1_SN_LDSB1_CLR1_GSU0_GSUC0_GSUWGMRR0_K1_LBSPPA2048_LBSPPB1024_LPA32_LPB0_MIWT8_4_PLR1_SU32_SUM0_SUS256_SKXCCM0_VWA2_VWB4_WGM4_WGMXCC1_WGMXCCGn1
    SolutionIndex: 18
    SolutionNameMin: Cijk_Ailk_Bjlk_BSS_BH_UserArgs_MT256x128x64_MI16x16x1_SN_LDSB1_CLR1_GSU0_GSUC0_GSUWGMRR0_K1_LBSPPA2048_LBSPPB1024_LPA0_LPB0_MIWT8_4_PLR1_SU32_SUM0_SUS256_SKXCCM0_VWA4_VWB4_WGM4_WGMXCC1_WGMXCCGn1
    SolutionIndex: 19
    SolutionNameMin: Cijk_Ailk_Bjlk_BSS_BH_UserArgs_MT256x128x64_MI16x16x1_SN_LDSB1_CLR1_GSU0_GSUC0_GSUWGMRR0_K1_LBSPPA2048_LBSPPB1024_LPA0_LPB0_MIWT8_4_PLR2_SU32_SUM0_SUS256_SKXCCM0_VWA4_VWB4_WGM4_WGMXCC1_WGMXCCGn1
    SolutionIndex: 20
    SolutionNameMin: Cijk_Ailk_Bjlk_BSS_BH_UserArgs_MT128x128x64_MI16x16x1_SN_LDSB1_CLR1_GSU0_GSUC0_GSUWGMRR0_K1_LBSPPA1024_LBSPPB1024_LPA0_LPB0_MIWT4_4_PLR1_SU32_SUM0_SUS256_SKXCCM0_VWA4_VWB4_WGM1_WGMXCC1_WGMXCCGn1
    SolutionIndex: 21
    SolutionNameMin: Cijk_Ailk_Bjlk_BSS_BH_UserArgs_MT128x128x64_MI16x16x1_SN_LDSB1_CLR1_GSU0_GSUC0_GSUWGMRR0_K1_LBSPPA1024_LBSPPB1024_LPA0_LPB0_MIWT4_4_PLR1_SU32_SUM0_SUS256_SKXCCM0_VWA4_VWB4_WGM4_WGMXCC1_WGMXCCGn1
    SolutionIndex: 22
    SolutionNameMin: Cijk_Ailk_Bjlk_BSS_BH_UserArgs_MT128x128x64_MI16x16x1_SN_LDSB1_CLR1_GSU0_GSUC0_GSUWGMRR0_K1_LBSPPA1024_LBSPPB1024_LPA0_LPB32_MIWT4_4_PLR1_SU32_SUM0_SUS256_SKXCCM0_VWA4_VWB2_WGM8_WGMXCC1_WGMXCCGn1
    SolutionIndex: 23
    SolutionNameMin: Cijk_Ailk_Bjlk_BSS_BH_UserArgs_MT128x128x64_MI16x16x1_SN_LDSB1_CLR1_GSU0_GSUC0_GSUWGMRR0_K1_LBSPPA1024_LBSPPB1024_LPA0_LPB0_MIWT4_4_PLR1_SU32_SUM0_SUS256_SKXCCM0_VWA4_VWB4_WGM8_WGMXCC1_WGMXCCGn1
    SolutionIndex: 24
    SolutionNameMin: Cijk_Ailk_Bjlk_BSS_BH_UserArgs_MT128x128x64_MI16x16x1_SN_LDSB1_CLR1_GSU0_GSUC0_GSUWGMRR0_K1_LBSPPA1024_LBSPPB1024_LPA0_LPB0_MIWT4_4_PLR2_SU32_SUM0_SUS256_SKXCCM0_VWA4_VWB4_WGM8_WGMXCC1_WGMXCCGn1
    SolutionIndex: 25
    SolutionNameMin: Cijk_Ailk_Bjlk_BSS_BH_UserArgs_MT64x64x64_MI16x16x1_SN_LDSB1_CLR1_GSU0_GSUC0_GSUWGMRR0_K1_LBSPPA512_LBSPPB512_LPA32_LPB32_MIWT2_2_PLR2_SU32_SUM0_SUS256_SKXCCM0_VWA2_VWB2_WGM1_WGMXCC1_WGMXCCGn1
    SolutionIndex: 26
    SolutionNameMin: Cijk_Ailk_Bjlk_BSS_BH_UserArgs_MT64x64x64_MI16x16x1_SN_LDSB1_CLR1_GSU0_GSUC0_GSUWGMRR0_K1_LBSPPA512_LBSPPB512_LPA32_LPB32_MIWT2_2_PLR2_SU32_SUM0_SUS256_SKXCCM0_VWA2_VWB2_WGM4_WGMXCC1_WGMXCCGn1
    SolutionIndex: 27
    SolutionNameMin: Cijk_Ailk_Bjlk_BSS_BH_UserArgs_MT64x64x64_MI16x16x1_SN_LDSB1_CLR1_GSU0_GSUC0_GSUWGMRR0_K1_LBSPPA512_LBSPPB512_LPA32_LPB32_MIWT2_2_PLR2_SU32_SUM0_SUS256_SKXCCM0_VWA2_VWB2_WGM8_WGMXCC1_WGMXCCGn1
    SolutionIndex: 28
    SolutionNameMin: Cijk_Ailk_Bjlk_BSS_BH_UserArgs_MT32x64x64_MI16x16x1_SN_LDSB0_CLR1_GSU0_GSUC0_GSUWGMRR0_K1_LBSPPA256_LBSPPB512_LPA16_LPB32_MIWT1_2_PLR2_SU32_SUM0_SUS256_SKXCCM0_VWA1_VWB2_WGM1_WGMXCC1_WGMXCCGn1
    SolutionIndex: 29
    SolutionNameMin: Cijk_Ailk_Bjlk_BSS_BH_UserArgs_MT32x32x64_MI16x16x1_SN_LDSB0_CLR1_GSU0_GSUC0_GSUWGMRR0_K1_LBSPPA256_LBSPPB256_LPA16_LPB16_MIWT1_1_PLR1_SU32_SUM0_SUS256_SKXCCM0_VWA1_VWB1_WGM1_WGMXCC1_WGMXCCGn1
    SolutionIndex: 30
    SolutionNameMin: Cijk_Ailk_Bjlk_BSS_BH_UserArgs_MT32x32x64_MI16x16x1_SN_LDSB0_CLR1_GSU0_GSUC0_GSUWGMRR0_K1_LBSPPA256_LBSPPB256_LPA16_LPB16_MIWT1_1_PLR2_SU32_SUM0_SUS256_SKXCCM0_VWA1_VWB1_WGM1_WGMXCC1_WGMXCCGn1
    SolutionIndex: 31
    SolutionNameMin: Cijk_Ailk_Bjlk_BSS_BH_UserArgs_MT128x128x128_MI16x16x1_SN_LDSB1_CLR1_GSU0_GSUC0_GSUWGMRR0_K1_LBSPPA1024_LBSPPB1024_LPA0_LPB0_MIWT4_4_PLR1_SU32_SUM0_SUS256_SKXCCM0_VWA4_VWB4_WGM1_WGMXCC1_WGMXCCGn1
    SolutionIndex: 32
    SolutionNameMin: Cijk_Ailk_Bjlk_BSS_BH_UserArgs_MT128x128x128_MI16x16x1_SN_LDSB1_CLR1_GSU0_GSUC0_GSUWGMRR0_K1_LBSPPA1024_LBSPPB1024_LPA0_LPB0_MIWT4_4_PLR2_SU32_SUM0_SUS256_SKXCCM0_VWA4_VWB4_WGM1_WGMXCC1_WGMXCCGn1
    SolutionIndex: 33
    SolutionNameMin: Cijk_Ailk_Bjlk_BSS_BH_UserArgs_MT128x128x128_MI16x16x1_SN_LDSB1_CLR1_GSU0_GSUC0_GSUWGMRR0_K1_LBSPPA1024_LBSPPB1024_LPA0_LPB0_MIWT4_4_PLR2_SU32_SUM0_SUS256_SKXCCM0_VWA4_VWB4_WGM4_WGMXCC1_WGMXCCGn1
    SolutionIndex: 34
    SolutionNameMin: Cijk_Ailk_Bjlk_BSS_BH_UserArgs_MT128x128x128_MI16x16x1_SN_LDSB1_CLR1_GSU0_GSUC0_GSUWGMRR0_K1_LBSPPA1024_LBSPPB1024_LPA0_LPB0_MIWT4_4_PLR1_SU32_SUM0_SUS256_SKXCCM0_VWA4_VWB4_WGM8_WGMXCC1_WGMXCCGn1
    SolutionIndex: 35
    SolutionNameMin: Cijk_Ailk_Bjlk_BSS_BH_UserArgs_MT64x128x128_MI16x16x1_SN_LDSB1_CLR1_GSU0_GSUC0_GSUWGMRR0_K1_LBSPPA512_LBSPPB1024_LPA32_LPB32_MIWT2_4_PLR2_SU32_SUM0_SUS256_SKXCCM0_VWA2_VWB2_WGM1_WGMXCC1_WGMXCCGn1
    SolutionIndex: 36
    SolutionNameMin: Cijk_Ailk_Bjlk_BSS_BH_UserArgs_MT128x64x128_MI16x16x1_SN_LDSB1_CLR1_GSU0_GSUC0_GSUWGMRR0_K1_LBSPPA1024_LBSPPB512_LPA0_LPB32_MIWT4_2_PLR2_SU32_SUM0_SUS256_SKXCCM0_VWA4_VWB2_WGM1_WGMXCC1_WGMXCCGn1
    SolutionIndex: 37
    SolutionNameMin: Cijk_Ailk_Bjlk_BSS_BH_UserArgs_MT128x64x128_MI16x16x1_SN_LDSB1_CLR1_GSU0_GSUC0_GSUWGMRR0_K1_LBSPPA1024_LBSPPB512_LPA0_LPB32_MIWT4_2_PLR2_SU32_SUM0_SUS256_SKXCCM0_VWA4_VWB2_WGM4_WGMXCC1_WGMXCCGn1
    SolutionIndex: 38
    SolutionNameMin: Cijk_Ailk_Bjlk_BSS_BH_UserArgs_MT128x64x128_MI16x16x1_SN_LDSB1_CLR1_GSU0_GSUC0_GSUWGMRR0_K1_LBSPPA1024_LBSPPB512_LPA0_LPB32_MIWT4_2_PLR2_SU32_SUM0_SUS256_SKXCCM0_VWA4_VWB2_WGM8_WGMXCC1_WGMXCCGn1
    SolutionIndex: 39
    SolutionNameMin: Cijk_Ailk_Bjlk_BSS_BH_UserArgs_MT64x64x128_MI16x16x1_SN_LDSB1_CLR1_GSU0_GSUC0_GSUWGMRR0_K1_LBSPPA512_LBSPPB512_LPA32_LPB32_MIWT2_2_PLR2_SU32_SUM0_SUS256_SKXCCM0_VWA2_VWB2_WGM1_WGMXCC1_WGMXCCGn1
    SolutionIndex: 40
    SolutionNameMin: Cijk_Ailk_Bjlk_BSS_BH_UserArgs_MT64x64x128_MI16x16x1_SN_LDSB1_CLR1_GSU0_GSUC0_GSUWGMRR0_K1_LBSPPA512_LBSPPB512_LPA32_LPB32_MIWT2_2_PLR2_SU32_SUM0_SUS256_SKXCCM0_VWA2_VWB2_WGM4_WGMXCC1_WGMXCCGn1
    SolutionIndex: 41
    SolutionNameMin: Cijk_Ailk_Bjlk_BSS_BH_UserArgs_MT64x64x128_MI16x16x1_SN_LDSB1_CLR1_GSU0_GSUC0_GSUWGMRR0_K1_LBSPPA512_LBSPPB512_LPA32_LPB32_MIWT2_2_PLR2_SU32_SUM0_SUS256_SKXCCM0_VWA2_VWB2_WGM8_WGMXCC1_WGMXCCGn1
    SolutionIndex: 42
    SolutionNameMin: Cijk_Ailk_Bjlk_BSS_BH_UserArgs_MT32x64x128_MI16x16x1_SN_LDSB1_CLR1_GSU0_GSUC0_GSUWGMRR0_K1_LBSPPA256_LBSPPB512_LPA16_LPB32_MIWT1_2_PLR2_SU32_SUM0_SUS256_SKXCCM0_VWA1_VWB2_WGM4_WGMXCC1_WGMXCCGn1
    SolutionIndex: 43
    SolutionNameMin: Cijk_Ailk_Bjlk_BSS_BH_UserArgs_MT32x64x128_MI16x16x1_SN_LDSB1_CLR1_GSU0_GSUC0_GSUWGMRR0_K1_LBSPPA256_LBSPPB512_LPA16_LPB32_MIWT1_2_PLR2_SU32_SUM0_SUS256_SKXCCM0_VWA1_VWB2_WGM8_WGMXCC1_WGMXCCGn1
    SolutionIndex: 44
    SolutionNameMin: Cijk_Ailk_Bjlk_BSS_BH_UserArgs_MT64x32x128_MI16x16x1_SN_LDSB1_CLR1_GSU0_GSUC0_GSUWGMRR0_K1_LBSPPA512_LBSPPB256_LPA32_LPB16_MIWT2_1_PLR2_SU32_SUM0_SUS256_SKXCCM0_VWA2_VWB1_WGM1_WGMXCC1_WGMXCCGn1
    SolutionIndex: 45
    SolutionNameMin: Cijk_Ailk_Bjlk_BSS_BH_UserArgs_MT64x32x128_MI16x16x1_SN_LDSB1_CLR1_GSU0_GSUC0_GSUWGMRR0_K1_LBSPPA512_LBSPPB256_LPA32_LPB16_MIWT2_1_PLR2_SU32_SUM0_SUS256_SKXCCM0_VWA2_VWB1_WGM4_WGMXCC1_WGMXCCGn1
    SolutionIndex: 46
    SolutionNameMin: Cijk_Ailk_Bjlk_BSS_BH_UserArgs_MT64x32x128_MI16x16x1_SN_LDSB1_CLR1_GSU0_GSUC0_GSUWGMRR0_K1_LBSPPA512_LBSPPB256_LPA32_LPB16_MIWT2_1_PLR2_SU32_SUM0_SUS256_SKXCCM0_VWA2_VWB1_WGM8_WGMXCC1_WGMXCCGn1
    SolutionIndex: 47
    SolutionNameMin: Cijk_Ailk_Bjlk_BSS_BH_UserArgs_MT32x32x128_MI16x16x1_SN_LDSB1_CLR1_GSU0_GSUC0_GSUWGMRR0_K1_LBSPPA256_LBSPPB256_LPA16_LPB16_MIWT1_1_PLR1_SU32_SUM0_SUS256_SKXCCM0_VWA1_VWB1_WGM1_WGMXCC1_WGMXCCGn1
    SolutionIndex: 48
    SolutionNameMin: Cijk_Ailk_Bjlk_BSS_BH_UserArgs_MT32x32x128_MI16x16x1_SN_LDSB1_CLR1_GSU0_GSUC0_GSUWGMRR0_K1_LBSPPA256_LBSPPB256_LPA16_LPB16_MIWT1_1_PLR2_SU32_SUM0_SUS256_SKXCCM0_VWA1_VWB1_WGM1_WGMXCC1_WGMXCCGn1
    SolutionIndex: 49
    SolutionNameMin: Cijk_Ailk_Bjlk_BSS_BH_UserArgs_MT32x32x128_MI16x16x1_SN_LDSB1_CLR1_GSU0_GSUC0_GSUWGMRR0_K1_LBSPPA256_LBSPPB256_LPA16_LPB16_MIWT1_1_PLR2_SU32_SUM0_SUS256_SKXCCM0_VWA1_VWB1_WGM8_WGMXCC1_WGMXCCGn1
    SolutionIndex: 50
    SolutionNameMin: Cijk_Ailk_Bjlk_BSS_BH_UserArgs_MT256x256x32_MI16x16x1_SN_LDSB0_CLR1_GSU0_GSUC0_GSUWGMRR0_K1_LBSPPA2048_LBSPPB2048_LPA0_LPB0_MIWT8_8_PLR1_SU32_SUM0_SUS256_SKXCCM8_VWA4_VWB4_WGM1_WGMXCC1_WGMXCCGn1
    SolutionIndex: 51
    SolutionNameMin: Cijk_Ailk_Bjlk_BSS_BH_UserArgs_MT256x256x32_MI16x16x1_SN_LDSB1_CLR1_GSU0_GSUC0_GSUWGMRR0_K1_LBSPPA2048_LBSPPB2048_LPA32_LPB0_MIWT8_8_PLR1_SU32_SUM0_SUS256_SKXCCM8_VWA2_VWB8_WGM1_WGMXCC1_WGMXCCGn1
    SolutionIndex: 52
    SolutionNameMin: Cijk_Ailk_Bjlk_BSS_BH_UserArgs_MT256x256x32_MI16x16x1_SN_LDSB0_CLR1_GSU0_GSUC0_GSUWGMRR0_K1_LBSPPA2048_LBSPPB2048_LPA0_LPB0_MIWT8_8_PLR1_SU32_SUM0_SUS256_SKXCCM8_VWA4_VWB8_WGM1_WGMXCC1_WGMXCCGn1
    SolutionIndex: 53
    SolutionNameMin: Cijk_Ailk_Bjlk_BSS_BH_UserArgs_MT256x256x32_MI16x16x1_SN_LDSB1_CLR1_GSU0_GSUC0_GSUWGMRR0_K1_LBSPPA2048_LBSPPB2048_LPA32_LPB32_MIWT8_8_PLR1_SU32_SUM0_SUS256_SKXCCM8_VWA2_VWB2_WGM4_WGMXCC1_WGMXCCGn1
    SolutionIndex: 54
    SolutionNameMin: Cijk_Ailk_Bjlk_BSS_BH_UserArgs_MT256x256x32_MI16x16x1_SN_LDSB1_CLR1_GSU0_GSUC0_GSUWGMRR0_K1_LBSPPA2048_LBSPPB2048_LPA32_LPB0_MIWT8_8_PLR1_SU32_SUM0_SUS256_SKXCCM8_VWA2_VWB8_WGM4_WGMXCC1_WGMXCCGn1
    SolutionIndex: 55
    SolutionNameMin: Cijk_Ailk_Bjlk_BSS_BH_UserArgs_MT256x256x32_MI16x16x1_SN_LDSB0_CLR1_GSU0_GSUC0_GSUWGMRR0_K1_LBSPPA2048_LBSPPB2048_LPA0_LPB0_MIWT8_8_PLR1_SU32_SUM0_SUS256_SKXCCM8_VWA4_VWB8_WGM4_WGMXCC1_WGMXCCGn1
    SolutionIndex: 56
    SolutionNameMin: Cijk_Ailk_Bjlk_BSS_BH_UserArgs_MT256x256x32_MI16x16x1_SN_LDSB0_CLR1_GSU0_GSUC0_GSUWGMRR0_K1_LBSPPA2048_LBSPPB2048_LPA0_LPB0_MIWT8_8_PLR1_SU32_SUM0_SUS256_SKXCCM8_VWA4_VWB4_WGM8_WGMXCC1_WGMXCCGn1
    SolutionIndex: 57
    SolutionNameMin: Cijk_Ailk_Bjlk_BSS_BH_UserArgs_MT256x256x32_MI16x16x1_SN_LDSB0_CLR1_GSU0_GSUC0_GSUWGMRR0_K1_LBSPPA2048_LBSPPB2048_LPA0_LPB0_MIWT8_8_PLR1_SU32_SUM0_SUS256_SKXCCM8_VWA4_VWB8_WGM8_WGMXCC1_WGMXCCGn1
    SolutionIndex: 58
    SolutionNameMin: Cijk_Ailk_Bjlk_BSS_BH_UserArgs_MT128x256x32_MI16x16x1_SN_LDSB1_CLR1_GSU0_GSUC0_GSUWGMRR0_K1_LBSPPA1024_LBSPPB2048_LPA0_LPB0_MIWT4_8_PLR1_SU32_SUM0_SUS256_SKXCCM8_VWA4_VWB4_WGM4_WGMXCC1_WGMXCCGn1
    SolutionIndex: 59
    SolutionNameMin: Cijk_Ailk_Bjlk_BSS_BH_UserArgs_MT128x256x32_MI16x16x1_SN_LDSB1_CLR1_GSU0_GSUC0_GSUWGMRR0_K1_LBSPPA1024_LBSPPB2048_LPA32_LPB0_MIWT4_8_PLR1_SU32_SUM0_SUS256_SKXCCM8_VWA2_VWB8_WGM4_WGMXCC1_WGMXCCGn1
    SolutionIndex: 60
    SolutionNameMin: Cijk_Ailk_Bjlk_BSS_BH_UserArgs_MT128x256x32_MI16x16x1_SN_LDSB1_CLR1_GSU0_GSUC0_GSUWGMRR0_K1_LBSPPA1024_LBSPPB2048_LPA0_LPB0_MIWT4_8_PLR1_SU32_SUM0_SUS256_SKXCCM8_VWA4_VWB8_WGM4_WGMXCC1_WGMXCCGn1
    SolutionIndex: 61
    SolutionNameMin: Cijk_Ailk_Bjlk_BSS_BH_UserArgs_MT128x256x32_MI16x16x1_SN_LDSB1_CLR1_GSU0_GSUC0_GSUWGMRR0_K1_LBSPPA1024_LBSPPB2048_LPA0_LPB0_MIWT4_8_PLR1_SU32_SUM0_SUS256_SKXCCM8_VWA4_VWB4_WGM8_WGMXCC1_WGMXCCGn1
    SolutionIndex: 62
    SolutionNameMin: Cijk_Ailk_Bjlk_BSS_BH_UserArgs_MT128x256x32_MI16x16x1_SN_LDSB1_CLR1_GSU0_GSUC0_GSUWGMRR0_K1_LBSPPA1024_LBSPPB2048_LPA0_LPB0_MIWT4_8_PLR1_SU32_SUM0_SUS256_SKXCCM8_VWA4_VWB8_WGM8_WGMXCC1_WGMXCCGn1
    SolutionIndex: 63
    SolutionNameMin: Cijk_Ailk_Bjlk_BSS_BH_UserArgs_MT64x256x32_MI16x16x1_SN_LDSB1_CLR1_GSU0_GSUC0_GSUWGMRR0_K1_LBSPPA512_LBSPPB2048_LPA16_LPB0_MIWT2_8_PLR1_SU32_SUM0_SUS256_SKXCCM8_VWA1_VWB8_WGM1_WGMXCC1_WGMXCCGn1
    SolutionIndex: 64
    SolutionNameMin: Cijk_Ailk_Bjlk_BSS_BH_UserArgs_MT256x64x32_MI16x16x1_SN_LDSB1_CLR1_GSU0_GSUC0_GSUWGMRR0_K1_LBSPPA2048_LBSPPB512_LPA0_LPB16_MIWT8_2_PLR1_SU32_SUM0_SUS256_SKXCCM8_VWA4_VWB1_WGM8_WGMXCC1_WGMXCCGn1
    SolutionIndex: 65
    SolutionNameMin: Cijk_Ailk_Bjlk_BSS_BH_UserArgs_MT128x128x32_MI16x16x1_SN_LDSB1_CLR1_GSU0_GSUC0_GSUWGMRR0_K1_LBSPPA1024_LBSPPB1024_LPA0_LPB32_MIWT4_4_PLR1_SU32_SUM0_SUS256_SKXCCM8_VWA4_VWB2_WGM1_WGMXCC1_WGMXCCGn1
    SolutionIndex: 66
    SolutionNameMin: Cijk_Ailk_Bjlk_BSS_BH_UserArgs_MT128x128x32_MI16x16x1_SN_LDSB1_CLR1_GSU0_GSUC0_GSUWGMRR0_K1_LBSPPA1024_LBSPPB1024_LPA0_LPB32_MIWT4_4_PLR1_SU32_SUM0_SUS256_SKXCCM8_VWA4_VWB2_WGM4_WGMXCC1_WGMXCCGn1
    SolutionIndex: 67
    SolutionNameMin: Cijk_Ailk_Bjlk_BSS_BH_UserArgs_MT128x128x32_MI16x16x1_SN_LDSB1_CLR1_GSU0_GSUC0_GSUWGMRR0_K1_LBSPPA1024_LBSPPB1024_LPA32_LPB0_MIWT4_4_PLR1_SU32_SUM0_SUS256_SKXCCM8_VWA2_VWB4_WGM4_WGMXCC1_WGMXCCGn1
    SolutionIndex: 68
    SolutionNameMin: Cijk_Ailk_Bjlk_BSS_BH_UserArgs_MT128x128x32_MI16x16x1_SN_LDSB1_CLR1_GSU0_GSUC0_GSUWGMRR0_K1_LBSPPA1024_LBSPPB1024_LPA0_LPB32_MIWT4_4_PLR1_SU32_SUM0_SUS256_SKXCCM8_VWA4_VWB2_WGM8_WGMXCC1_WGMXCCGn1
    SolutionIndex: 69
    SolutionNameMin: Cijk_Ailk_Bjlk_BSS_BH_UserArgs_MT128x64x32_MI16x16x1_SN_LDSB0_CLR1_GSU0_GSUC0_GSUWGMRR0_K1_LBSPPA1024_LBSPPB512_LPA0_LPB16_MIWT4_2_PLR1_SU32_SUM0_SUS256_SKXCCM8_VWA4_VWB1_WGM1_WGMXCC1_WGMXCCGn1
    SolutionIndex: 70
    SolutionNameMin: Cijk_Ailk_Bjlk_BSS_BH_UserArgs_MT128x64x32_MI16x16x1_SN_LDSB0_CLR1_GSU0_GSUC0_GSUWGMRR0_K1_LBSPPA1024_LBSPPB512_LPA0_LPB32_MIWT4_2_PLR1_SU32_SUM0_SUS256_SKXCCM8_VWA4_VWB2_WGM1_WGMXCC1_WGMXCCGn1
    SolutionIndex: 71
    SolutionNameMin: Cijk_Ailk_Bjlk_BSS_BH_UserArgs_MT128x64x32_MI16x16x1_SN_LDSB0_CLR1_GSU0_GSUC0_GSUWGMRR0_K1_LBSPPA1024_LBSPPB512_LPA0_LPB32_MIWT4_2_PLR1_SU32_SUM0_SUS256_SKXCCM8_VWA4_VWB2_WGM4_WGMXCC1_WGMXCCGn1
    SolutionIndex: 72
    SolutionNameMin: Cijk_Ailk_Bjlk_BSS_BH_UserArgs_MT128x32x32_MI16x16x1_SN_LDSB0_CLR1_GSU0_GSUC0_GSUWGMRR0_K1_LBSPPA1024_LBSPPB256_LPA0_LPB16_MIWT4_1_PLR1_SU32_SUM0_SUS256_SKXCCM8_VWA4_VWB1_WGM1_WGMXCC1_WGMXCCGn1
    SolutionIndex: 73
    SolutionNameMin: Cijk_Ailk_Bjlk_BSS_BH_UserArgs_MT64x64x32_MI16x16x1_SN_LDSB0_CLR1_GSU0_GSUC0_GSUWGMRR0_K1_LBSPPA512_LBSPPB512_LPA32_LPB32_MIWT2_2_PLR1_SU32_SUM0_SUS256_SKXCCM8_VWA2_VWB2_WGM1_WGMXCC1_WGMXCCGn1
    SolutionIndex: 74
    SolutionNameMin: Cijk_Ailk_Bjlk_BSS_BH_UserArgs_MT32x32x32_MI16x16x1_SN_LDSB0_CLR1_GSU0_GSUC0_GSUWGMRR0_K1_LBSPPA256_LBSPPB256_LPA16_LPB16_MIWT1_1_PLR1_SU32_SUM0_SUS256_SKXCCM8_VWA1_VWB1_WGM1_WGMXCC1_WGMXCCGn1
    SolutionIndex: 75
    SolutionNameMin: Cijk_Ailk_Bjlk_BSS_BH_UserArgs_MT32x32x32_MI16x16x1_SN_LDSB0_CLR0_GSU0_GSUC0_GSUWGMRR0_K1_LBSPPA256_LBSPPB256_LPA16_LPB16_MIWT1_1_PLR0_SU32_SUM0_SUS256_SKXCCM8_VWA1_VWB1_WGM1_WGMXCC1_WGMXCCGn1
    SolutionIndex: 76
    SolutionNameMin: Cijk_Ailk_Bjlk_BSS_BH_UserArgs_MT256x256x64_MI16x16x1_SN_LDSB1_CLR1_GSU0_GSUC0_GSUWGMRR0_K1_LBSPPA2048_LBSPPB2048_LPA0_LPB0_MIWT8_8_PLR1_SU32_SUM0_SUS256_SKXCCM8_VWA4_VWB4_WGM1_WGMXCC1_WGMXCCGn1
    SolutionIndex: 77
    SolutionNameMin: Cijk_Ailk_Bjlk_BSS_BH_UserArgs_MT256x256x64_MI16x16x1_SN_LDSB1_CLR1_GSU0_GSUC0_GSUWGMRR0_K1_LBSPPA2048_LBSPPB2048_LPA0_LPB0_MIWT8_8_PLR2_SU32_SUM0_SUS256_SKXCCM8_VWA4_VWB4_WGM1_WGMXCC1_WGMXCCGn1
    SolutionIndex: 78
    SolutionNameMin: Cijk_Ailk_Bjlk_BSS_BH_UserArgs_MT256x256x64_MI16x16x1_SN_LDSB1_CLR1_GSU0_GSUC0_GSUWGMRR0_K1_LBSPPA2048_LBSPPB2048_LPA0_LPB0_MIWT8_8_PLR1_SU32_SUM0_SUS256_SKXCCM8_VWA4_VWB4_WGM4_WGMXCC1_WGMXCCGn1
    SolutionIndex: 79
    SolutionNameMin: Cijk_Ailk_Bjlk_BSS_BH_UserArgs_MT256x256x64_MI16x16x1_SN_LDSB1_CLR1_GSU0_GSUC0_GSUWGMRR0_K1_LBSPPA2048_LBSPPB2048_LPA0_LPB0_MIWT8_8_PLR2_SU32_SUM0_SUS256_SKXCCM8_VWA4_VWB4_WGM4_WGMXCC1_WGMXCCGn1
    SolutionIndex: 80
    SolutionNameMin: Cijk_Ailk_Bjlk_BSS_BH_UserArgs_MT256x256x64_MI16x16x1_SN_LDSB1_CLR1_GSU0_GSUC0_GSUWGMRR0_K1_LBSPPA2048_LBSPPB2048_LPA0_LPB0_MIWT8_8_PLR2_SU32_SUM0_SUS256_SKXCCM8_VWA4_VWB8_WGM4_WGMXCC1_WGMXCCGn1
    SolutionIndex: 81
    SolutionNameMin: Cijk_Ailk_Bjlk_BSS_BH_UserArgs_MT256x256x64_MI16x16x1_SN_LDSB1_CLR1_GSU0_GSUC0_GSUWGMRR0_K1_LBSPPA2048_LBSPPB2048_LPA0_LPB0_MIWT8_8_PLR1_SU32_SUM0_SUS256_SKXCCM8_VWA4_VWB4_WGM8_WGMXCC1_WGMXCCGn1
    SolutionIndex: 82
    SolutionNameMin: Cijk_Ailk_Bjlk_BSS_BH_UserArgs_MT256x256x64_MI16x16x1_SN_LDSB1_CLR1_GSU0_GSUC0_GSUWGMRR0_K1_LBSPPA2048_LBSPPB2048_LPA0_LPB0_MIWT8_8_PLR2_SU32_SUM0_SUS256_SKXCCM8_VWA4_VWB4_WGM8_WGMXCC1_WGMXCCGn1
    SolutionIndex: 83
    SolutionNameMin: Cijk_Ailk_Bjlk_BSS_BH_UserArgs_MT128x256x64_MI16x16x1_SN_LDSB1_CLR1_GSU0_GSUC0_GSUWGMRR0_K1_LBSPPA1024_LBSPPB2048_LPA0_LPB0_MIWT4_8_PLR1_SU32_SUM0_SUS256_SKXCCM8_VWA4_VWB8_WGM1_WGMXCC1_WGMXCCGn1
    SolutionIndex: 84
    SolutionNameMin: Cijk_Ailk_Bjlk_BSS_BH_UserArgs_MT128x256x64_MI16x16x1_SN_LDSB1_CLR1_GSU0_GSUC0_GSUWGMRR0_K1_LBSPPA1024_LBSPPB2048_LPA32_LPB0_MIWT4_8_PLR2_SU32_SUM0_SUS256_SKXCCM8_VWA2_VWB4_WGM1_WGMXCC1_WGMXCCGn1
    SolutionIndex: 85
    SolutionNameMin: Cijk_Ailk_Bjlk_BSS_BH_UserArgs_MT128x256x64_MI16x16x1_SN_LDSB1_CLR1_GSU0_GSUC0_GSUWGMRR0_K1_LBSPPA1024_LBSPPB2048_LPA0_LPB32_MIWT4_8_PLR1_SU32_SUM0_SUS256_SKXCCM8_VWA4_VWB2_WGM4_WGMXCC1_WGMXCCGn1
    SolutionIndex: 86
    SolutionNameMin: Cijk_Ailk_Bjlk_BSS_BH_UserArgs_MT128x256x64_MI16x16x1_SN_LDSB1_CLR1_GSU0_GSUC0_GSUWGMRR0_K1_LBSPPA1024_LBSPPB2048_LPA32_LPB0_MIWT4_8_PLR1_SU32_SUM0_SUS256_SKXCCM8_VWA2_VWB4_WGM4_WGMXCC1_WGMXCCGn1
    SolutionIndex: 87
    SolutionNameMin: Cijk_Ailk_Bjlk_BSS_BH_UserArgs_MT128x256x64_MI16x16x1_SN_LDSB1_CLR1_GSU0_GSUC0_GSUWGMRR0_K1_LBSPPA1024_LBSPPB2048_LPA0_LPB0_MIWT4_8_PLR1_SU32_SUM0_SUS256_SKXCCM8_VWA4_VWB4_WGM4_WGMXCC1_WGMXCCGn1
    SolutionIndex: 88
    SolutionNameMin: Cijk_Ailk_Bjlk_BSS_BH_UserArgs_MT128x256x64_MI16x16x1_SN_LDSB1_CLR1_GSU0_GSUC0_GSUWGMRR0_K1_LBSPPA1024_LBSPPB2048_LPA0_LPB32_MIWT4_8_PLR1_SU32_SUM0_SUS256_SKXCCM8_VWA4_VWB2_WGM8_WGMXCC1_WGMXCCGn1
    SolutionIndex: 89
    SolutionNameMin: Cijk_Ailk_Bjlk_BSS_BH_UserArgs_MT128x256x64_MI16x16x1_SN_LDSB1_CLR1_GSU0_GSUC0_GSUWGMRR0_K1_LBSPPA1024_LBSPPB2048_LPA0_LPB0_MIWT4_8_PLR2_SU32_SUM0_SUS256_SKXCCM8_VWA4_VWB8_WGM8_WGMXCC1_WGMXCCGn1
    SolutionIndex: 90
    SolutionNameMin: Cijk_Ailk_Bjlk_BSS_BH_UserArgs_MT256x128x64_MI16x16x1_SN_LDSB1_CLR1_GSU0_GSUC0_GSUWGMRR0_K1_LBSPPA2048_LBSPPB1024_LPA0_LPB0_MIWT8_4_PLR1_SU32_SUM0_SUS256_SKXCCM8_VWA4_VWB4_WGM1_WGMXCC1_WGMXCCGn1
    SolutionIndex: 91
    SolutionNameMin: Cijk_Ailk_Bjlk_BSS_BH_UserArgs_MT128x128x64_MI16x16x1_SN_LDSB1_CLR1_GSU0_GSUC0_GSUWGMRR0_K1_LBSPPA1024_LBSPPB1024_LPA0_LPB0_MIWT4_4_PLR1_SU32_SUM0_SUS256_SKXCCM8_VWA4_VWB4_WGM1_WGMXCC1_WGMXCCGn1
    SolutionIndex: 92
    SolutionNameMin: Cijk_Ailk_Bjlk_BSS_BH_UserArgs_MT128x128x64_MI16x16x1_SN_LDSB1_CLR1_GSU0_GSUC0_GSUWGMRR0_K1_LBSPPA1024_LBSPPB1024_LPA0_LPB0_MIWT4_4_PLR1_SU32_SUM0_SUS256_SKXCCM8_VWA4_VWB4_WGM4_WGMXCC1_WGMXCCGn1
    SolutionIndex: 93
    SolutionNameMin: Cijk_Ailk_Bjlk_BSS_BH_UserArgs_MT128x128x64_MI16x16x1_SN_LDSB1_CLR1_GSU0_GSUC0_GSUWGMRR0_K1_LBSPPA1024_LBSPPB1024_LPA0_LPB0_MIWT4_4_PLR1_SU32_SUM0_SUS256_SKXCCM8_VWA4_VWB4_WGM8_WGMXCC1_WGMXCCGn1
    SolutionIndex: 94
    SolutionNameMin: Cijk_Ailk_Bjlk_BSS_BH_UserArgs_MT128x128x64_MI16x16x1_SN_LDSB1_CLR1_GSU0_GSUC0_GSUWGMRR0_K1_LBSPPA1024_LBSPPB1024_LPA0_LPB0_MIWT4_4_PLR2_SU32_SUM0_SUS256_SKXCCM8_VWA4_VWB4_WGM8_WGMXCC1_WGMXCCGn1
    SolutionIndex: 95
    SolutionNameMin: Cijk_Ailk_Bjlk_BSS_BH_UserArgs_MT128x64x64_MI16x16x1_SN_LDSB1_CLR1_GSU0_GSUC0_GSUWGMRR0_K1_LBSPPA1024_LBSPPB512_LPA0_LPB32_MIWT4_2_PLR1_SU32_SUM0_SUS256_SKXCCM8_VWA4_VWB2_WGM1_WGMXCC1_WGMXCCGn1
    SolutionIndex: 96
    SolutionNameMin: Cijk_Ailk_Bjlk_BSS_BH_UserArgs_MT128x64x64_MI16x16x1_SN_LDSB1_CLR1_GSU0_GSUC0_GSUWGMRR0_K1_LBSPPA1024_LBSPPB512_LPA0_LPB16_MIWT4_2_PLR2_SU32_SUM0_SUS256_SKXCCM8_VWA4_VWB1_WGM1_WGMXCC1_WGMXCCGn1
    SolutionIndex: 97
    SolutionNameMin: Cijk_Ailk_Bjlk_BSS_BH_UserArgs_MT128x64x64_MI16x16x1_SN_LDSB1_CLR1_GSU0_GSUC0_GSUWGMRR0_K1_LBSPPA1024_LBSPPB512_LPA0_LPB32_MIWT4_2_PLR2_SU32_SUM0_SUS256_SKXCCM8_VWA4_VWB2_WGM1_WGMXCC1_WGMXCCGn1
    SolutionIndex: 98
    SolutionNameMin: Cijk_Ailk_Bjlk_BSS_BH_UserArgs_MT128x64x64_MI16x16x1_SN_LDSB1_CLR1_GSU0_GSUC0_GSUWGMRR0_K1_LBSPPA1024_LBSPPB512_LPA0_LPB32_MIWT4_2_PLR2_SU32_SUM0_SUS256_SKXCCM8_VWA4_VWB2_WGM4_WGMXCC1_WGMXCCGn1
    SolutionIndex: 99
    SolutionNameMin: Cijk_Ailk_Bjlk_BSS_BH_UserArgs_MT128x64x64_MI16x16x1_SN_LDSB1_CLR1_GSU0_GSUC0_GSUWGMRR0_K1_LBSPPA1024_LBSPPB512_LPA0_LPB32_MIWT4_2_PLR2_SU32_SUM0_SUS256_SKXCCM8_VWA4_VWB2_WGM8_WGMXCC1_WGMXCCGn1
    SolutionIndex: 100
    SolutionNameMin: Cijk_Ailk_Bjlk_BSS_BH_UserArgs_MT64x64x64_MI16x16x1_SN_LDSB1_CLR1_GSU0_GSUC0_GSUWGMRR0_K1_LBSPPA512_LBSPPB512_LPA32_LPB32_MIWT2_2_PLR1_SU32_SUM0_SUS256_SKXCCM8_VWA2_VWB2_WGM1_WGMXCC1_WGMXCCGn1
    SolutionIndex: 101
    SolutionNameMin: Cijk_Ailk_Bjlk_BSS_BH_UserArgs_MT64x64x64_MI16x16x1_SN_LDSB1_CLR1_GSU0_GSUC0_GSUWGMRR0_K1_LBSPPA512_LBSPPB512_LPA32_LPB32_MIWT2_2_PLR2_SU32_SUM0_SUS256_SKXCCM8_VWA2_VWB2_WGM1_WGMXCC1_WGMXCCGn1
    SolutionIndex: 102
    SolutionNameMin: Cijk_Ailk_Bjlk_BSS_BH_UserArgs_MT64x64x64_MI16x16x1_SN_LDSB1_CLR1_GSU0_GSUC0_GSUWGMRR0_K1_LBSPPA512_LBSPPB512_LPA32_LPB32_MIWT2_2_PLR1_SU32_SUM0_SUS256_SKXCCM8_VWA2_VWB2_WGM4_WGMXCC1_WGMXCCGn1
    SolutionIndex: 103
    SolutionNameMin: Cijk_Ailk_Bjlk_BSS_BH_UserArgs_MT64x64x64_MI16x16x1_SN_LDSB1_CLR1_GSU0_GSUC0_GSUWGMRR0_K1_LBSPPA512_LBSPPB512_LPA32_LPB32_MIWT2_2_PLR2_SU32_SUM0_SUS256_SKXCCM8_VWA2_VWB2_WGM4_WGMXCC1_WGMXCCGn1
    SolutionIndex: 104
    SolutionNameMin: Cijk_Ailk_Bjlk_BSS_BH_UserArgs_MT64x64x64_MI16x16x1_SN_LDSB1_CLR1_GSU0_GSUC0_GSUWGMRR0_K1_LBSPPA512_LBSPPB512_LPA32_LPB32_MIWT2_2_PLR2_SU32_SUM0_SUS256_SKXCCM8_VWA2_VWB2_WGM8_WGMXCC1_WGMXCCGn1
    SolutionIndex: 105
    SolutionNameMin: Cijk_Ailk_Bjlk_BSS_BH_UserArgs_MT32x64x64_MI16x16x1_SN_LDSB0_CLR1_GSU0_GSUC0_GSUWGMRR0_K1_LBSPPA256_LBSPPB512_LPA16_LPB32_MIWT1_2_PLR2_SU32_SUM0_SUS256_SKXCCM8_VWA1_VWB2_WGM1_WGMXCC1_WGMXCCGn1
    SolutionIndex: 106
    SolutionNameMin: Cijk_Ailk_Bjlk_BSS_BH_UserArgs_MT32x64x64_MI16x16x1_SN_LDSB0_CLR1_GSU0_GSUC0_GSUWGMRR0_K1_LBSPPA256_LBSPPB512_LPA16_LPB32_MIWT1_2_PLR2_SU32_SUM0_SUS256_SKXCCM8_VWA1_VWB2_WGM4_WGMXCC1_WGMXCCGn1
    SolutionIndex: 107
    SolutionNameMin: Cijk_Ailk_Bjlk_BSS_BH_UserArgs_MT64x32x64_MI16x16x1_SN_LDSB0_CLR1_GSU0_GSUC0_GSUWGMRR0_K1_LBSPPA512_LBSPPB256_LPA32_LPB16_MIWT2_1_PLR1_SU32_SUM0_SUS256_SKXCCM8_VWA2_VWB1_WGM1_WGMXCC1_WGMXCCGn1
    SolutionIndex: 108
    SolutionNameMin: Cijk_Ailk_Bjlk_BSS_BH_UserArgs_MT64x32x64_MI16x16x1_SN_LDSB0_CLR1_GSU0_GSUC0_GSUWGMRR0_K1_LBSPPA512_LBSPPB256_LPA32_LPB16_MIWT2_1_PLR2_SU32_SUM0_SUS256_SKXCCM8_VWA2_VWB1_WGM1_WGMXCC1_WGMXCCGn1
    SolutionIndex: 109
    SolutionNameMin: Cijk_Ailk_Bjlk_BSS_BH_UserArgs_MT32x32x64_MI16x16x1_SN_LDSB0_CLR1_GSU0_GSUC0_GSUWGMRR0_K1_LBSPPA256_LBSPPB256_LPA16_LPB16_MIWT1_1_PLR1_SU32_SUM0_SUS256_SKXCCM8_VWA1_VWB1_WGM1_WGMXCC1_WGMXCCGn1
    SolutionIndex: 110
    SolutionNameMin: Cijk_Ailk_Bjlk_BSS_BH_UserArgs_MT32x32x64_MI16x16x1_SN_LDSB0_CLR1_GSU0_GSUC0_GSUWGMRR0_K1_LBSPPA256_LBSPPB256_LPA16_LPB16_MIWT1_1_PLR2_SU32_SUM0_SUS256_SKXCCM8_VWA1_VWB1_WGM1_WGMXCC1_WGMXCCGn1
    SolutionIndex: 111
    SolutionNameMin: Cijk_Ailk_Bjlk_BSS_BH_UserArgs_MT32x32x64_MI16x16x1_SN_LDSB0_CLR1_GSU0_GSUC0_GSUWGMRR0_K1_LBSPPA256_LBSPPB256_LPA16_LPB16_MIWT1_1_PLR1_SU32_SUM0_SUS256_SKXCCM8_VWA1_VWB1_WGM4_WGMXCC1_WGMXCCGn1
    SolutionIndex: 112
    SolutionNameMin: Cijk_Ailk_Bjlk_BSS_BH_UserArgs_MT128x128x128_MI16x16x1_SN_LDSB1_CLR1_GSU0_GSUC0_GSUWGMRR0_K1_LBSPPA1024_LBSPPB1024_LPA0_LPB0_MIWT4_4_PLR1_SU32_SUM0_SUS256_SKXCCM8_VWA4_VWB4_WGM1_WGMXCC1_WGMXCCGn1
    SolutionIndex: 113
    SolutionNameMin: Cijk_Ailk_Bjlk_BSS_BH_UserArgs_MT128x128x128_MI16x16x1_SN_LDSB1_CLR1_GSU0_GSUC0_GSUWGMRR0_K1_LBSPPA1024_LBSPPB1024_LPA0_LPB0_MIWT4_4_PLR2_SU32_SUM0_SUS256_SKXCCM8_VWA4_VWB4_WGM1_WGMXCC1_WGMXCCGn1
    SolutionIndex: 114
    SolutionNameMin: Cijk_Ailk_Bjlk_BSS_BH_UserArgs_MT128x128x128_MI16x16x1_SN_LDSB1_CLR1_GSU0_GSUC0_GSUWGMRR0_K1_LBSPPA1024_LBSPPB1024_LPA0_LPB0_MIWT4_4_PLR1_SU32_SUM0_SUS256_SKXCCM8_VWA4_VWB4_WGM4_WGMXCC1_WGMXCCGn1
    SolutionIndex: 115
    SolutionNameMin: Cijk_Ailk_Bjlk_BSS_BH_UserArgs_MT128x128x128_MI16x16x1_SN_LDSB1_CLR1_GSU0_GSUC0_GSUWGMRR0_K1_LBSPPA1024_LBSPPB1024_LPA0_LPB0_MIWT4_4_PLR2_SU32_SUM0_SUS256_SKXCCM8_VWA4_VWB4_WGM4_WGMXCC1_WGMXCCGn1
    SolutionIndex: 116
    SolutionNameMin: Cijk_Ailk_Bjlk_BSS_BH_UserArgs_MT128x128x128_MI16x16x1_SN_LDSB1_CLR1_GSU0_GSUC0_GSUWGMRR0_K1_LBSPPA1024_LBSPPB1024_LPA0_LPB0_MIWT4_4_PLR1_SU32_SUM0_SUS256_SKXCCM8_VWA4_VWB4_WGM8_WGMXCC1_WGMXCCGn1
    SolutionIndex: 117
    SolutionNameMin: Cijk_Ailk_Bjlk_BSS_BH_UserArgs_MT128x128x128_MI16x16x1_SN_LDSB1_CLR1_GSU0_GSUC0_GSUWGMRR0_K1_LBSPPA1024_LBSPPB1024_LPA0_LPB0_MIWT4_4_PLR2_SU32_SUM0_SUS256_SKXCCM8_VWA4_VWB4_WGM8_WGMXCC1_WGMXCCGn1
    SolutionIndex: 118
    SolutionNameMin: Cijk_Ailk_Bjlk_BSS_BH_UserArgs_MT128x64x128_MI16x16x1_SN_LDSB1_CLR1_GSU0_GSUC0_GSUWGMRR0_K1_LBSPPA1024_LBSPPB512_LPA0_LPB32_MIWT4_2_PLR2_SU32_SUM0_SUS256_SKXCCM8_VWA4_VWB2_WGM1_WGMXCC1_WGMXCCGn1
    SolutionIndex: 119
    SolutionNameMin: Cijk_Ailk_Bjlk_BSS_BH_UserArgs_MT128x64x128_MI16x16x1_SN_LDSB1_CLR1_GSU0_GSUC0_GSUWGMRR0_K1_LBSPPA1024_LBSPPB512_LPA0_LPB32_MIWT4_2_PLR2_SU32_SUM0_SUS256_SKXCCM8_VWA4_VWB2_WGM4_WGMXCC1_WGMXCCGn1
    SolutionIndex: 120
    SolutionNameMin: Cijk_Ailk_Bjlk_BSS_BH_UserArgs_MT128x64x128_MI16x16x1_SN_LDSB1_CLR1_GSU0_GSUC0_GSUWGMRR0_K1_LBSPPA1024_LBSPPB512_LPA0_LPB32_MIWT4_2_PLR2_SU32_SUM0_SUS256_SKXCCM8_VWA4_VWB2_WGM8_WGMXCC1_WGMXCCGn1
    SolutionIndex: 121
    SolutionNameMin: Cijk_Ailk_Bjlk_BSS_BH_UserArgs_MT64x64x128_MI16x16x1_SN_LDSB1_CLR1_GSU0_GSUC0_GSUWGMRR0_K1_LBSPPA512_LBSPPB512_LPA32_LPB32_MIWT2_2_PLR2_SU32_SUM0_SUS256_SKXCCM8_VWA2_VWB2_WGM1_WGMXCC1_WGMXCCGn1
    SolutionIndex: 122
    SolutionNameMin: Cijk_Ailk_Bjlk_BSS_BH_UserArgs_MT64x64x128_MI16x16x1_SN_LDSB1_CLR1_GSU0_GSUC0_GSUWGMRR0_K1_LBSPPA512_LBSPPB512_LPA32_LPB32_MIWT2_2_PLR2_SU32_SUM0_SUS256_SKXCCM8_VWA2_VWB2_WGM4_WGMXCC1_WGMXCCGn1
    SolutionIndex: 123
    SolutionNameMin: Cijk_Ailk_Bjlk_BSS_BH_UserArgs_MT64x64x128_MI16x16x1_SN_LDSB1_CLR1_GSU0_GSUC0_GSUWGMRR0_K1_LBSPPA512_LBSPPB512_LPA32_LPB32_MIWT2_2_PLR2_SU32_SUM0_SUS256_SKXCCM8_VWA2_VWB2_WGM8_WGMXCC1_WGMXCCGn1
    SolutionIndex: 124
    SolutionNameMin: Cijk_Ailk_Bjlk_BSS_BH_UserArgs_MT32x64x128_MI16x16x1_SN_LDSB1_CLR1_GSU0_GSUC0_GSUWGMRR0_K1_LBSPPA256_LBSPPB512_LPA16_LPB32_MIWT1_2_PLR2_SU32_SUM0_SUS256_SKXCCM8_VWA1_VWB2_WGM1_WGMXCC1_WGMXCCGn1
    SolutionIndex: 125
    SolutionNameMin: Cijk_Ailk_Bjlk_BSS_BH_UserArgs_MT64x32x128_MI16x16x1_SN_LDSB1_CLR1_GSU0_GSUC0_GSUWGMRR0_K1_LBSPPA512_LBSPPB256_LPA32_LPB16_MIWT2_1_PLR2_SU32_SUM0_SUS256_SKXCCM8_VWA2_VWB1_WGM1_WGMXCC1_WGMXCCGn1
    SolutionIndex: 126
    SolutionNameMin: Cijk_Ailk_Bjlk_BSS_BH_UserArgs_MT64x32x128_MI16x16x1_SN_LDSB1_CLR1_GSU0_GSUC0_GSUWGMRR0_K1_LBSPPA512_LBSPPB256_LPA32_LPB16_MIWT2_1_PLR2_SU32_SUM0_SUS256_SKXCCM8_VWA2_VWB1_WGM8_WGMXCC1_WGMXCCGn1
    SolutionIndex: 127
    SolutionNameMin: Cijk_Ailk_Bjlk_BSS_BH_UserArgs_MT32x32x128_MI16x16x1_SN_LDSB1_CLR1_GSU0_GSUC0_GSUWGMRR0_K1_LBSPPA256_LBSPPB256_LPA16_LPB16_MIWT1_1_PLR1_SU32_SUM0_SUS256_SKXCCM8_VWA1_VWB1_WGM1_WGMXCC1_WGMXCCGn1
    SolutionIndex: 128
    SolutionNameMin: Cijk_Ailk_Bjlk_BSS_BH_UserArgs_MT32x32x128_MI16x16x1_SN_LDSB1_CLR1_GSU0_GSUC0_GSUWGMRR0_K1_LBSPPA256_LBSPPB256_LPA16_LPB16_MIWT1_1_PLR2_SU32_SUM0_SUS256_SKXCCM8_VWA1_VWB1_WGM1_WGMXCC1_WGMXCCGn1
    SolutionIndex: 129
    SolutionNameMin: Cijk_Ailk_Bjlk_BSS_BH_UserArgs_MT32x32x32_MI16x16x1_SN_LDSB0_CLR1_GSU0_GSUC0_GSUWGMRR0_K1_LBSPPA256_LBSPPB256_LPA16_LPB16_MIWT1_1_PLR1_SU32_SUM0_SUS256_SKXCCM0_VWA1_VWB1_WGM1_WGMXCC1_WGMXCCGn1
- - - [128, 128, 1, 128, 128, 128, 128, 128]
    - [10, 0.079]
  - - [128, 128, 1, 256, 128, 128, 128, 128]
    - [30, 0.14]
  - - [128, 128, 1, 512, 128, 128, 128, 128]
    - [48, 0.228]
  - - [128, 128, 1, 1024, 128, 128, 128, 128]
    - [29, 0.33]
  - - [128, 128, 1, 2048, 128, 128, 128, 128]
    - [74, 0.529]
  - - [128, 128, 1, 4096, 128, 128, 128, 128]
    - [109, 0.92]
  - - [128, 128, 1, 8192, 128, 128, 128, 128]
    - [74, 1.411]
  - - [128, 256, 1, 128, 128, 128, 128, 256]
    - [29, 0.161]
  - - [128, 256, 1, 256, 128, 128, 128, 256]
    - [29, 0.286]
  - - [128, 256, 1, 512, 128, 128, 128, 256]
    - [29, 0.459]
  - - [128, 256, 1, 1024, 128, 128, 128, 256]
    - [48, 0.665]
  - - [128, 256, 1, 2048, 128, 128, 128, 256]
    - [75, 1.065]
  - - [128, 256, 1, 4096, 128, 128, 128, 256]
    - [109, 1.767]
  - - [128, 256, 1, 8192, 128, 128, 128, 256]
    - [127, 2.606]
  - - [128, 512, 1, 128, 128, 128, 128, 512]
    - [74, 0.315]
  - - [128, 512, 1, 256, 128, 128, 128, 512]
    - [30, 0.563]
  - - [128, 512, 1, 512, 128, 128, 128, 512]
    - [47, 0.903]
  - - [128, 512, 1, 1024, 128, 128, 128, 512]
    - [127, 1.317]
  - - [128, 512, 1, 2048, 128, 128, 128, 512]
    - [74, 2.019]
  - - [128, 512, 1, 4096, 128, 128, 128, 512]
    - [109, 3.45]
  - - [128, 512, 1, 8192, 128, 128, 128, 512]
    - [127, 4.903]
  - - [128, 1024, 1, 128, 128, 128, 128, 1024]
    - [11, 0.628]
  - - [128, 1024, 1, 256, 128, 128, 128, 1024]
    - [29, 1.104]
  - - [128, 1024, 1, 512, 128, 128, 128, 1024]
    - [47, 1.784]
  - - [128, 1024, 1, 1024, 128, 128, 128, 1024]
    - [48, 2.592]
  - - [128, 1024, 1, 2048, 128, 128, 128, 1024]
    - [47, 3.779]
  - - [128, 1024, 1, 4096, 128, 128, 128, 1024]
    - [105, 5.957]
  - - [128, 1024, 1, 8192, 128, 128, 128, 1024]
    - [42, 8.39]
  - - [128, 2048, 1, 128, 128, 128, 128, 2048]
    - [30, 1.192]
  - - [128, 2048, 1, 256, 128, 128, 128, 2048]
    - [30, 2.11]
  - - [128, 2048, 1, 512, 128, 128, 128, 2048]
    - [47, 3.442]
  - - [128, 2048, 1, 1024, 128, 128, 128, 2048]
    - [127, 4.891]
  - - [128, 2048, 1, 2048, 128, 128, 128, 2048]
    - [42, 6.727]
  - - [128, 2048, 1, 4096, 128, 128, 128, 2048]
    - [25, 9.37]
  - - [128, 2048, 1, 8192, 128, 128, 128, 2048]
    - [41, 12.466]
  - - [128, 4096, 1, 128, 128, 128, 128, 4096]
    - [108, 2.188]
  - - [128, 4096, 1, 256, 128, 128, 128, 4096]
    - [108, 3.835]
  - - [128, 4096, 1, 512, 128, 128, 128, 4096]
    - [125, 6.14]
  - - [128, 4096, 1, 1024, 128, 128, 128, 4096]
    - [108, 8.731]
  - - [128, 4096, 1, 2048, 128, 128, 128, 4096]
    - [41, 10.198]
  - - [128, 4096, 1, 4096, 128, 128, 128, 4096]
    - [97, 13.46]
  - - [128, 4096, 1, 8192, 128, 128, 128, 4096]
    - [119, 16.81]
  - - [128, 8192, 1, 128, 128, 128, 128, 8192]
    - [73, 3.663]
  - - [128, 8192, 1, 256, 128, 128, 128, 8192]
    - [101, 6.315]
  - - [128, 8192, 1, 512, 128, 128, 128, 8192]
    - [100, 9.973]
  - - [128, 8192, 1, 1024, 128, 128, 128, 8192]
    - [101, 13.234]
  - - [128, 8192, 1, 2048, 128, 128, 128, 8192]
    - [121, 14.613]
  - - [128, 8192, 1, 4096, 128, 128, 128, 8192]
    - [91, 17.683]
  - - [128, 8192, 1, 8192, 128, 128, 128, 8192]
    - [32, 21.202]
  - - [256, 128, 1, 128, 256, 256, 256, 128]
    - [11, 0.16]
  - - [256, 128, 1, 256, 256, 256, 256, 128]
    - [29, 0.285]
  - - [256, 128, 1, 512, 256, 256, 256, 128]
    - [47, 0.457]
  - - [256, 128, 1, 1024, 256, 256, 256, 128]
    - [47, 0.665]
  - - [256, 128, 1, 2048, 256, 256, 256, 128]
    - [74, 1.047]
  - - [256, 128, 1, 4096, 256, 256, 256, 128]
    - [109, 1.795]
  - - [256, 128, 1, 8192, 256, 256, 256, 128]
    - [47, 2.608]
  - - [256, 256, 1, 128, 256, 256, 256, 256]
    - [10, 0.313]
  - - [256, 256, 1, 256, 256, 256, 256, 256]
    - [48, 0.543]
  - - [256, 256, 1, 512, 256, 256, 256, 256]
    - [29, 0.906]
  - - [256, 256, 1, 1024, 256, 256, 256, 256]
    - [48, 1.308]
  - - [256, 256, 1, 2048, 256, 256, 256, 256]
    - [128, 2.013]
  - - [256, 256, 1, 4096, 256, 256, 256, 256]
    - [109, 3.381]
  - - [256, 256, 1, 8192, 256, 256, 256, 256]
    - [47, 4.824]
  - - [256, 512, 1, 128, 256, 256, 256, 512]
    - [10, 0.623]
  - - [256, 512, 1, 256, 256, 256, 256, 512]
    - [30, 1.102]
  - - [256, 512, 1, 512, 256, 256, 256, 512]
    - [29, 1.78]
  - - [256, 512, 1, 1024, 256, 256, 256, 512]
    - [48, 2.594]
  - - [256, 512, 1, 2048, 256, 256, 256, 512]
    - [29, 3.779]
  - - [256, 512, 1, 4096, 256, 256, 256, 512]
    - [108, 6.082]
  - - [256, 512, 1, 8192, 256, 256, 256, 512]
    - [45, 8.648]
  - - [256, 1024, 1, 128, 256, 256, 256, 1024]
    - [10, 1.176]
  - - [256, 1024, 1, 256, 256, 256, 256, 1024]
    - [47, 2.06]
  - - [256, 1024, 1, 512, 256, 256, 256, 1024]
    - [29, 3.396]
  - - [256, 1024, 1, 1024, 256, 256, 256, 1024]
    - [47, 4.981]
  - - [256, 1024, 1, 2048, 256, 256, 256, 1024]
    - [124, 6.738]
  - - [256, 1024, 1, 4096, 256, 256, 256, 1024]
    - [101, 9.311]
  - - [256, 1024, 1, 8192, 256, 256, 256, 1024]
    - [41, 13.188]
  - - [256, 2048, 1, 128, 256, 256, 256, 2048]
    - [105, 2.137]
  - - [256, 2048, 1, 256, 256, 256, 256, 2048]
    - [28, 3.756]
  - - [256, 2048, 1, 512, 256, 256, 256, 2048]
    - [124, 6.103]
  - - [256, 2048, 1, 1024, 256, 256, 256, 2048]
    - [43, 8.771]
  - - [256, 2048, 1, 2048, 256, 256, 256, 2048]
    - [39, 10.365]
  - - [256, 2048, 1, 4096, 256, 256, 256, 2048]
    - [97, 13.649]
  - - [256, 2048, 1, 8192, 256, 256, 256, 2048]
    - [118, 17.315]
  - - [256, 4096, 1, 128, 256, 256, 256, 4096]
    - [100, 3.646]
  - - [256, 4096, 1, 256, 256, 256, 256, 4096]
    - [101, 6.422]
  - - [256, 4096, 1, 512, 256, 256, 256, 4096]
    - [101, 10.134]
  - - [256, 4096, 1, 1024, 256, 256, 256, 4096]
    - [121, 13.42]
  - - [256, 4096, 1, 2048, 256, 256, 256, 4096]
    - [121, 15.167]
  - - [256, 4096, 1, 4096, 256, 256, 256, 4096]
    - [91, 19.233]
  - - [256, 4096, 1, 8192, 256, 256, 256, 4096]
    - [112, 23.375]
  - - [256, 8192, 1, 128, 256, 256, 256, 8192]
    - [70, 5.702]
  - - [256, 8192, 1, 256, 256, 256, 256, 8192]
    - [95, 9.379]
  - - [256, 8192, 1, 512, 256, 256, 256, 8192]
    - [97, 13.453]
  - - [256, 8192, 1, 1024, 256, 256, 256, 8192]
    - [112, 17.124]
  - - [256, 8192, 1, 2048, 256, 256, 256, 8192]
    - [120, 19.468]
  - - [256, 8192, 1, 4096, 256, 256, 256, 8192]
    - [33, 24.005]
  - - [256, 8192, 1, 8192, 256, 256, 256, 8192]
    - [22, 25.589]
  - - [512, 128, 1, 128, 512, 512, 512, 128]
    - [30, 0.321]
  - - [512, 128, 1, 256, 512, 512, 512, 128]
    - [30, 0.566]
  - - [512, 128, 1, 512, 512, 512, 512, 128]
    - [29, 0.914]
  - - [512, 128, 1, 1024, 512, 512, 512, 128]
    - [128, 1.316]
  - - [512, 128, 1, 2048, 512, 512, 512, 128]
    - [74, 2.042]
  - - [512, 128, 1, 4096, 512, 512, 512, 128]
    - [111, 3.423]
  - - [512, 128, 1, 8192, 512, 512, 512, 128]
    - [49, 4.846]
  - - [512, 256, 1, 128, 512, 512, 512, 256]
    - [10, 0.62]
  - - [512, 256, 1, 256, 512, 512, 512, 256]
    - [110, 1.093]
  - - [512, 256, 1, 512, 512, 512, 512, 256]
    - [29, 1.731]
  - - [512, 256, 1, 1024, 512, 512, 512, 256]
    - [128, 2.592]
  - - [512, 256, 1, 2048, 512, 512, 512, 256]
    - [127, 3.789]
  - - [512, 256, 1, 4096, 512, 512, 512, 256]
    - [106, 6.048]
  - - [512, 256, 1, 8192, 512, 512, 512, 256]
    - [46, 8.592]
  - - [512, 512, 1, 128, 512, 512, 512, 512]
    - [10, 1.188]
  - - [512, 512, 1, 256, 512, 512, 512, 512]
    - [30, 2.091]
  - - [512, 512, 1, 512, 512, 512, 512, 512]
    - [128, 3.381]
  - - [512, 512, 1, 1024, 512, 512, 512, 512]
    - [127, 4.995]
  - - [512, 512, 1, 2048, 512, 512, 512, 512]
    - [124, 6.883]
  - - [512, 512, 1, 4096, 512, 512, 512, 512]
    - [102, 9.269]
  - - [512, 512, 1, 8192, 512, 512, 512, 512]
    - [40, 13.191]
  - - [512, 1024, 1, 128, 512, 512, 512, 1024]
    - [28, 2.165]
  - - [512, 1024, 1, 256, 512, 512, 512, 1024]
    - [28, 3.77]
  - - [512, 1024, 1, 512, 512, 512, 512, 1024]
    - [28, 6.119]
  - - [512, 1024, 1, 1024, 512, 512, 512, 1024]
    - [125, 8.831]
  - - [512, 1024, 1, 2048, 512, 512, 512, 1024]
    - [39, 10.76]
  - - [512, 1024, 1, 4096, 512, 512, 512, 1024]
    - [41, 14.114]
  - - [512, 1024, 1, 8192, 512, 512, 512, 1024]
    - [38, 17.909]
  - - [512, 2048, 1, 128, 512, 512, 512, 2048]
    - [101, 3.634]
  - - [512, 2048, 1, 256, 512, 512, 512, 2048]
    - [101, 6.382]
  - - [512, 2048, 1, 512, 512, 512, 512, 2048]
    - [101, 10.125]
  - - [512, 2048, 1, 1024, 512, 512, 512, 2048]
    - [121, 13.399]
  - - [512, 2048, 1, 2048, 512, 512, 512, 2048]
    - [37, 15.106]
  - - [512, 2048, 1, 4096, 512, 512, 512, 2048]
    - [91, 19.322]
  - - [512, 2048, 1, 8192, 512, 512, 512, 2048]
    - [113, 23.234]
  - - [512, 4096, 1, 128, 512, 512, 512, 4096]
    - [70, 5.652]
  - - [512, 4096, 1, 256, 512, 512, 512, 4096]
    - [70, 9.481]
  - - [512, 4096, 1, 512, 512, 512, 512, 4096]
    - [97, 13.609]
  - - [512, 4096, 1, 1024, 512, 512, 512, 4096]
    - [112, 17.226]
  - - [512, 4096, 1, 2048, 512, 512, 512, 4096]
    - [119, 19.687]
  - - [512, 4096, 1, 4096, 512, 512, 512, 4096]
    - [33, 24.46]
  - - [512, 4096, 1, 8192, 512, 512, 512, 4096]
    - [58, 25.23]
  - - [512, 8192, 1, 128, 512, 512, 512, 8192]
    - [63, 7.589]
  - - [512, 8192, 1, 256, 512, 512, 512, 8192]
    - [92, 11.876]
  - - [512, 8192, 1, 512, 512, 512, 512, 8192]
    - [23, 17.277]
  - - [512, 8192, 1, 1024, 512, 512, 512, 8192]
    - [24, 21.972]
  - - [512, 8192, 1, 2048, 512, 512, 512, 8192]
    - [34, 26.176]
  - - [512, 8192, 1, 4096, 512, 512, 512, 8192]
    - [117, 29.295]
  - - [512, 8192, 1, 8192, 512, 512, 512, 8192]
    - [14, 28.503]
  - - [1024, 128, 1, 128, 1024, 1024, 1024, 128]
    - [10, 0.622]
  - - [1024, 128, 1, 256, 1024, 1024, 1024, 128]
    - [29, 1.073]
  - - [1024, 128, 1, 512, 1024, 1024, 1024, 128]
    - [29, 1.786]
  - - [1024, 128, 1, 1024, 1024, 1024, 1024, 128]
    - [127, 2.586]
  - - [1024, 128, 1, 2048, 1024, 1024, 1024, 128]
    - [29, 3.723]
  - - [1024, 128, 1, 4096, 1024, 1024, 1024, 128]
    - [106, 5.883]
  - - [1024, 128, 1, 8192, 1024, 1024, 1024, 128]
    - [44, 8.159]
  - - [1024, 256, 1, 128, 1024, 1024, 1024, 256]
    - [30, 1.205]
  - - [1024, 256, 1, 256, 1024, 1024, 1024, 256]
    - [30, 2.116]
  - - [1024, 256, 1, 512, 1024, 1024, 1024, 256]
    - [29, 3.431]
  - - [1024, 256, 1, 1024, 1024, 1024, 1024, 256]
    - [48, 5.017]
  - - [1024, 256, 1, 2048, 1024, 1024, 1024, 256]
    - [126, 6.7]
  - - [1024, 256, 1, 4096, 1024, 1024, 1024, 256]
    - [104, 9.403]
  - - [1024, 256, 1, 8192, 1024, 1024, 1024, 256]
    - [39, 12.887]
  - - [1024, 512, 1, 128, 1024, 1024, 1024, 512]
    - [28, 2.165]
  - - [1024, 512, 1, 256, 1024, 1024, 1024, 512]
    - [28, 3.826]
  - - [1024, 512, 1, 512, 1024, 1024, 1024, 512]
    - [124, 6.137]
  - - [1024, 512, 1, 1024, 1024, 1024, 1024, 512]
    - [124, 8.909]
  - - [1024, 512, 1, 2048, 1024, 1024, 1024, 512]
    - [40, 11.065]
  - - [1024, 512, 1, 4096, 1024, 1024, 1024, 512]
    - [39, 13.927]
  - - [1024, 512, 1, 8192, 1024, 1024, 1024, 512]
    - [36, 17.284]
  - - [1024, 1024, 1, 128, 1024, 1024, 1024, 1024]
    - [27, 3.603]
  - - [1024, 1024, 1, 256, 1024, 1024, 1024, 1024]
    - [101, 6.389]
  - - [1024, 1024, 1, 512, 1024, 1024, 1024, 1024]
    - [121, 10.204]
  - - [1024, 1024, 1, 1024, 1024, 1024, 1024, 1024]
    - [40, 13.326]
  - - [1024, 1024, 1, 2048, 1024, 1024, 1024, 1024]
    - [37, 15.366]
  - - [1024, 1024, 1, 4096, 1024, 1024, 1024, 1024]
    - [94, 18.47]
  - - [1024, 1024, 1, 8192, 1024, 1024, 1024, 1024]
    - [34, 23.027]
  - - [1024, 2048, 1, 128, 1024, 1024, 1024, 2048]
    - [70, 5.633]
  - - [1024, 2048, 1, 256, 1024, 1024, 1024, 2048]
    - [70, 9.492]
  - - [1024, 2048, 1, 512, 1024, 1024, 1024, 2048]
    - [97, 13.651]
  - - [1024, 2048, 1, 1024, 1024, 1024, 1024, 2048]
    - [37, 16.832]
  - - [1024, 2048, 1, 2048, 1024, 1024, 1024, 2048]
    - [20, 19.592]
  - - [1024, 2048, 1, 4096, 1024, 1024, 1024, 2048]
    - [34, 24.397]
  - - [1024, 2048, 1, 8192, 1024, 1024, 1024, 2048]
    - [60, 25.293]
  - - [1024, 4096, 1, 128, 1024, 1024, 1024, 4096]
    - [66, 7.856]
  - - [1024, 4096, 1, 256, 1024, 1024, 1024, 4096]
    - [65, 12.205]
  - - [1024, 4096, 1, 512, 1024, 1024, 1024, 4096]
    - [23, 17.208]
  - - [1024, 4096, 1, 1024, 1024, 1024, 1024, 4096]
    - [23, 22.05]
  - - [1024, 4096, 1, 2048, 1024, 1024, 1024, 4096]
    - [116, 25.336]
  - - [1024, 4096, 1, 4096, 1024, 1024, 1024, 4096]
    - [114, 30.311]
  - - [1024, 4096, 1, 8192, 1024, 1024, 1024, 4096]
    - [89, 27.686]
  - - [1024, 8192, 1, 128, 1024, 1024, 1024, 8192]
    - [83, 7.728]
  - - [1024, 8192, 1, 256, 1024, 1024, 1024, 8192]
    - [90, 12.674]
  - - [1024, 8192, 1, 512, 1024, 1024, 1024, 8192]
    - [83, 18.627]
  - - [1024, 8192, 1, 1024, 1024, 1024, 1024, 8192]
    - [5, 24.619]
  - - [1024, 8192, 1, 2048, 1024, 1024, 1024, 8192]
    - [86, 29.952]
  - - [1024, 8192, 1, 4096, 1024, 1024, 1024, 8192]
    - [2, 28.416]
  - - [1024, 8192, 1, 8192, 1024, 1024, 1024, 8192]
    - [55, 30.987]
  - - [2048, 128, 1, 128, 2048, 2048, 2048, 128]
    - [75, 1.19]
  - - [2048, 128, 1, 256, 2048, 2048, 2048, 128]
    - [30, 2.105]
  - - [2048, 128, 1, 512, 2048, 2048, 2048, 128]
    - [29, 3.435]
  - - [2048, 128, 1, 1024, 2048, 2048, 2048, 128]
    - [128, 5.042]
  - - [2048, 128, 1, 2048, 2048, 2048, 2048, 128]
    - [44, 6.787]
  - - [2048, 128, 1, 4096, 2048, 2048, 2048, 128]
    - [26, 9.36]
  - - [2048, 128, 1, 8192, 2048, 2048, 2048, 128]
    - [39, 12.048]
  - - [2048, 256, 1, 128, 2048, 2048, 2048, 256]
    - [107, 2.153]
  - - [2048, 256, 1, 256, 2048, 2048, 2048, 256]
    - [28, 3.785]
  - - [2048, 256, 1, 512, 2048, 2048, 2048, 256]
    - [108, 6.142]
  - - [2048, 256, 1, 1024, 2048, 2048, 2048, 256]
    - [45, 8.862]
  - - [2048, 256, 1, 2048, 2048, 2048, 2048, 256]
    - [39, 10.834]
  - - [2048, 256, 1, 4096, 2048, 2048, 2048, 256]
    - [98, 13.637]
  - - [2048, 256, 1, 8192, 2048, 2048, 2048, 256]
    - [36, 16.956]
  - - [2048, 512, 1, 128, 2048, 2048, 2048, 512]
    - [100, 3.637]
  - - [2048, 512, 1, 256, 2048, 2048, 2048, 512]
    - [101, 6.385]
  - - [2048, 512, 1, 512, 2048, 2048, 2048, 512]
    - [121, 10.145]
  - - [2048, 512, 1, 1024, 2048, 2048, 2048, 512]
    - [122, 13.042]
  - - [2048, 512, 1, 2048, 2048, 2048, 2048, 512]
    - [35, 14.682]
  - - [2048, 512, 1, 4096, 2048, 2048, 2048, 512]
    - [92, 19.166]
  - - [2048, 512, 1, 8192, 2048, 2048, 2048, 512]
    - [117, 23.138]
  - - [2048, 1024, 1, 128, 2048, 2048, 2048, 1024]
    - [9, 5.627]
  - - [2048, 1024, 1, 256, 2048, 2048, 2048, 1024]
    - [97, 9.409]
  - - [2048, 1024, 1, 512, 2048, 2048, 2048, 1024]
    - [97, 13.446]
  - - [2048, 1024, 1, 1024, 2048, 2048, 2048, 1024]
    - [120, 16.715]
  - - [2048, 1024, 1, 2048, 2048, 2048, 2048, 1024]
    - [114, 19.099]
  - - [2048, 1024, 1, 4096, 2048, 2048, 2048, 1024]
    - [115, 24.093]
  - - [2048, 1024, 1, 8192, 2048, 2048, 2048, 1024]
    - [62, 24.931]
  - - [2048, 2048, 1, 128, 2048, 2048, 2048, 2048]
    - [64, 7.593]
  - - [2048, 2048, 1, 256, 2048, 2048, 2048, 2048]
    - [7, 11.855]
  - - [2048, 2048, 1, 512, 2048, 2048, 2048, 2048]
    - [23, 17.086]
  - - [2048, 2048, 1, 1024, 2048, 2048, 2048, 2048]
    - [21, 21.604]
  - - [2048, 2048, 1, 2048, 2048, 2048, 2048, 2048]
    - [92, 25.045]
  - - [2048, 2048, 1, 4096, 2048, 2048, 2048, 2048]
    - [112, 29.306]
  - - [2048, 2048, 1, 8192, 2048, 2048, 2048, 2048]
    - [88, 27.386]
  - - [2048, 4096, 1, 128, 2048, 2048, 2048, 4096]
    - [13, 7.663]
  - - [2048, 4096, 1, 256, 2048, 2048, 2048, 4096]
    - [12, 12.737]
  - - [2048, 4096, 1, 512, 2048, 2048, 2048, 4096]
    - [17, 18.625]
  - - [2048, 4096, 1, 1024, 2048, 2048, 2048, 4096]
    - [19, 24.394]
  - - [2048, 4096, 1, 2048, 2048, 2048, 2048, 4096]
    - [84, 29.914]
  - - [2048, 4096, 1, 4096, 2048, 2048, 2048, 4096]
    - [76, 27.696]
  - - [2048, 4096, 1, 8192, 2048, 2048, 2048, 4096]
    - [57, 31.305]
  - - [2048, 8192, 1, 128, 2048, 2048, 2048, 8192]
    - [54, 8.292]
  - - [2048, 8192, 1, 256, 2048, 2048, 2048, 8192]
    - [54, 13.85]
  - - [2048, 8192, 1, 512, 2048, 2048, 2048, 8192]
    - [51, 20.783]
  - - [2048, 8192, 1, 1024, 2048, 2048, 2048, 8192]
    - [1, 27.802]
  - - [2048, 8192, 1, 2048, 2048, 2048, 2048, 8192]
    - [77, 31.102]
  - - [2048, 8192, 1, 4096, 2048, 2048, 2048, 8192]
    - [52, 30.13]
  - - [2048, 8192, 1, 8192, 2048, 2048, 2048, 8192]
    - [55, 33.297]
  - - [4096, 128, 1, 128, 4096, 4096, 4096, 128]
    - [105, 2.174]
  - - [4096, 128, 1, 256, 4096, 4096, 4096, 128]
    - [105, 3.836]
  - - [4096, 128, 1, 512, 4096, 4096, 4096, 128]
    - [105, 6.113]
  - - [4096, 128, 1, 1024, 4096, 4096, 4096, 128]
    - [124, 8.839]
  - - [4096, 128, 1, 2048, 4096, 4096, 4096, 128]
    - [27, 10.249]
  - - [4096, 128, 1, 4096, 4096, 4096, 4096, 128]
    - [99, 13.341]
  - - [4096, 128, 1, 8192, 4096, 4096, 4096, 128]
    - [120, 16.87]
  - - [4096, 256, 1, 128, 4096, 4096, 4096, 256]
    - [72, 3.597]
  - - [4096, 256, 1, 256, 4096, 4096, 4096, 256]
    - [103, 6.302]
  - - [4096, 256, 1, 512, 4096, 4096, 4096, 256]
    - [104, 9.8]
  - - [4096, 256, 1, 1024, 4096, 4096, 4096, 256]
    - [122, 13.28]
  - - [4096, 256, 1, 2048, 4096, 4096, 4096, 256]
    - [122, 14.389]
  - - [4096, 256, 1, 4096, 4096, 4096, 4096, 256]
    - [92, 18.901]
  - - [4096, 256, 1, 8192, 4096, 4096, 4096, 256]
    - [117, 23.184]
  - - [4096, 512, 1, 128, 4096, 4096, 4096, 512]
    - [8, 5.549]
  - - [4096, 512, 1, 256, 4096, 4096, 4096, 512]
    - [71, 9.414]
  - - [4096, 512, 1, 512, 4096, 4096, 4096, 512]
    - [99, 13.635]
  - - [4096, 512, 1, 1024, 4096, 4096, 4096, 512]
    - [114, 17.092]
  - - [4096, 512, 1, 2048, 4096, 4096, 4096, 512]
    - [92, 19.421]
  - - [4096, 512, 1, 4096, 4096, 4096, 4096, 512]
    - [115, 23.864]
  - - [4096, 512, 1, 8192, 4096, 4096, 4096, 512]
    - [62, 25.028]
  - - [4096, 1024, 1, 128, 4096, 4096, 4096, 1024]
    - [68, 7.545]
  - - [4096, 1024, 1, 256, 4096, 4096, 4096, 1024]
    - [68, 11.796]
  - - [4096, 1024, 1, 512, 4096, 4096, 4096, 1024]
    - [93, 17.072]
  - - [4096, 1024, 1, 1024, 4096, 4096, 4096, 1024]
    - [93, 21.105]
  - - [4096, 1024, 1, 2048, 4096, 4096, 4096, 1024]
    - [116, 24.947]
  - - [4096, 1024, 1, 4096, 4096, 4096, 4096, 1024]
    - [114, 28.53]
  - - [4096, 1024, 1, 8192, 4096, 4096, 4096, 1024]
    - [85, 27.831]
  - - [4096, 2048, 1, 128, 4096, 4096, 4096, 2048]
    - [17, 7.705]
  - - [4096, 2048, 1, 256, 4096, 4096, 4096, 2048]
    - [18, 12.726]
  - - [4096, 2048, 1, 512, 4096, 4096, 4096, 2048]
    - [19, 18.617]
  - - [4096, 2048, 1, 1024, 4096, 4096, 4096, 2048]
    - [59, 24.051]
  - - [4096, 2048, 1, 2048, 4096, 4096, 4096, 2048]
    - [86, 29.135]
  - - [4096, 2048, 1, 4096, 4096, 4096, 4096, 2048]
    - [57, 27.949]
  - - [4096, 2048, 1, 8192, 4096, 4096, 4096, 2048]
    - [82, 31.401]
  - - [4096, 4096, 1, 128, 4096, 4096, 4096, 4096]
    - [53, 8.266]
  - - [4096, 4096, 1, 256, 4096, 4096, 4096, 4096]
    - [53, 13.67]
  - - [4096, 4096, 1, 512, 4096, 4096, 4096, 4096]
    - [0, 20.184]
  - - [4096, 4096, 1, 1024, 4096, 4096, 4096, 4096]
    - [55, 27.172]
  - - [4096, 4096, 1, 2048, 4096, 4096, 4096, 4096]
    - [80, 31.211]
  - - [4096, 4096, 1, 4096, 4096, 4096, 4096, 4096]
    - [77, 30.112]
  - - [4096, 4096, 1, 8192, 4096, 4096, 4096, 4096]
    - [52, 33.73]
  - - [4096, 8192, 1, 128, 4096, 4096, 4096, 8192]
    - [24, 8.106]
  - - [4096, 8192, 1, 256, 4096, 4096, 4096, 8192]
    - [34, 12.692]
  - - [4096, 8192, 1, 512, 4096, 4096, 4096, 8192]
    - [93, 17.048]
  - - [4096, 8192, 1, 1024, 4096, 4096, 4096, 8192]
    - [51, 23.179]
  - - [4096, 8192, 1, 2048, 4096, 4096, 4096, 8192]
    - [52, 28.274]
  - - [4096, 8192, 1, 4096, 4096, 4096, 4096, 8192]
    - [57, 32.148]
  - - [4096, 8192, 1, 8192, 4096, 4096, 4096, 8192]
    - [57, 35.91]
  - - [8192, 128, 1, 128, 8192, 8192, 8192, 128]
    - [102, 3.589]
  - - [8192, 128, 1, 256, 8192, 8192, 8192, 128]
    - [103, 6.297]
  - - [8192, 128, 1, 512, 8192, 8192, 8192, 128]
    - [103, 9.982]
  - - [8192, 128, 1, 1024, 8192, 8192, 8192, 128]
    - [123, 13.268]
  - - [8192, 128, 1, 2048, 8192, 8192, 8192, 128]
    - [123, 14.084]
  - - [8192, 128, 1, 4096, 8192, 8192, 8192, 128]
    - [91, 16.997]
  - - [8192, 128, 1, 8192, 8192, 8192, 8192, 128]
    - [31, 21.253]
  - - [8192, 256, 1, 128, 8192, 8192, 8192, 256]
    - [69, 5.625]
  - - [8192, 256, 1, 256, 8192, 8192, 8192, 256]
    - [96, 9.29]
  - - [8192, 256, 1, 512, 8192, 8192, 8192, 256]
    - [98, 13.537]
  - - [8192, 256, 1, 1024, 8192, 8192, 8192, 256]
    - [116, 17.02]
  - - [8192, 256, 1, 2048, 8192, 8192, 8192, 256]
    - [120, 19.128]
  - - [8192, 256, 1, 4096, 8192, 8192, 8192, 256]
    - [112, 23.29]
  - - [8192, 256, 1, 8192, 8192, 8192, 8192, 256]
    - [4, 25.503]
  - - [8192, 512, 1, 128, 8192, 8192, 8192, 512]
    - [67, 7.475]
  - - [8192, 512, 1, 256, 8192, 8192, 8192, 512]
    - [93, 11.569]
  - - [8192, 512, 1, 512, 8192, 8192, 8192, 512]
    - [92, 16.782]
  - - [8192, 512, 1, 1024, 8192, 8192, 8192, 512]
    - [93, 20.594]
  - - [8192, 512, 1, 2048, 8192, 8192, 8192, 512]
    - [115, 25.246]
  - - [8192, 512, 1, 4096, 8192, 8192, 8192, 512]
    - [116, 29.593]
  - - [8192, 512, 1, 8192, 8192, 8192, 8192, 512]
    - [3, 28.33]
  - - [8192, 1024, 1, 128, 8192, 8192, 8192, 1024]
    - [16, 7.68]
  - - [8192, 1024, 1, 256, 8192, 8192, 8192, 1024]
    - [15, 12.708]
  - - [8192, 1024, 1, 512, 8192, 8192, 8192, 1024]
    - [58, 18.458]
  - - [8192, 1024, 1, 1024, 8192, 8192, 8192, 1024]
    - [61, 24.483]
  - - [8192, 1024, 1, 2048, 8192, 8192, 8192, 1024]
    - [87, 29.691]
  - - [8192, 1024, 1, 4096, 8192, 8192, 8192, 1024]
    - [1, 27.846]
  - - [8192, 1024, 1, 8192, 8192, 8192, 8192, 1024]
    - [57, 30.997]
  - - [8192, 2048, 1, 128, 8192, 8192, 8192, 2048]
    - [15, 8.409]
  - - [8192, 2048, 1, 256, 8192, 8192, 8192, 2048]
    - [50, 13.589]
  - - [8192, 2048, 1, 512, 8192, 8192, 8192, 2048]
    - [78, 20.333]
  - - [8192, 2048, 1, 1024, 8192, 8192, 8192, 2048]
    - [81, 27.271]
  - - [8192, 2048, 1, 2048, 8192, 8192, 8192, 2048]
    - [82, 31.227]
  - - [8192, 2048, 1, 4096, 8192, 8192, 8192, 2048]
    - [56, 30.123]
  - - [8192, 2048, 1, 8192, 8192, 8192, 8192, 2048]
    - [52, 33.695]
  - - [8192, 4096, 1, 128, 8192, 8192, 8192, 4096]
    - [21, 8.444]
  - - [8192, 4096, 1, 256, 8192, 8192, 8192, 4096]
    - [93, 12.875]
  - - [8192, 4096, 1, 512, 8192, 8192, 8192, 4096]
    - [116, 17.428]
  - - [8192, 4096, 1, 1024, 8192, 8192, 8192, 4096]
    - [52, 23.722]
  - - [8192, 4096, 1, 2048, 8192, 8192, 8192, 4096]
    - [52, 28.516]
  - - [8192, 4096, 1, 4096, 8192, 8192, 8192, 4096]
    - [76, 32.831]
  - - [8192, 4096, 1, 8192, 8192, 8192, 8192, 4096]
    - [51, 36.24]
  - - [8192, 8192, 1, 128, 8192, 8192, 8192, 8192]
    - [6, 7.175]
  - - [8192, 8192, 1, 256, 8192, 8192, 8192, 8192]
    - [61, 11.764]
  - - [8192, 8192, 1, 512, 8192, 8192, 8192, 8192]
    - [60, 17.632]
  - - [8192, 8192, 1, 1024, 8192, 8192, 8192, 8192]
    - [79, 24.479]
  - - [8192, 8192, 1, 2048, 8192, 8192, 8192, 8192]
    - [55, 31.248]
  - - [8192, 8192, 1, 4096, 8192, 8192, 8192, 8192]
    - [78, 35.123]
  - - [8192, 8192, 1, 8192, 8192, 8192, 8192, 8192]
    - [55, 36.872]
  - - [1, 1, 1, 32, 1, 1, 1, 1]
    - [129, 0.0]
- null
- null
- ExperimentalStreamK
- GridBased
