library/src/amd_detail/rocblaslt/src/Tensile/Logic/asm_full/aquavanjaram/gfx942/StreamK/aquavanjaram942_Cijk_Alik_Bjlk_BBS_BH_UserArgs.yaml
- {MinimumRequiredVersion: 4.33.0}
- aquavanjaram942
- gfx942
- [Device 0049, Device 0050]
    SolutionIndex: 0
    SolutionNameMin: Cijk_Alik_Bjlk_BBS_BH_UserArgs_MT256x256x32_MI16x16x1_SN_LDSB1_CLR1_GSU0_GSUC0_GSUWGMRR0_K1_LBSPPA256_LBSPPB2048_LPB0_MIWT8_8_PLR1_SU32_SUM0_SUS256_SKXCCM0_VWA4_VWB4_WGM1_WGMXCC1_WGMXCCGn1
    SolutionIndex: 1
    SolutionNameMin: Cijk_Alik_Bjlk_BBS_BH_UserArgs_MT256x256x32_MI16x16x1_SN_LDSB1_CLR1_GSU0_GSUC0_GSUWGMRR0_K1_LBSPPA128_LBSPPB2048_LPB0_MIWT8_8_PLR1_SU32_SUM0_SUS256_SKXCCM0_VWA2_VWB8_WGM1_WGMXCC1_WGMXCCGn1
    SolutionIndex: 2
    SolutionNameMin: Cijk_Alik_Bjlk_BBS_BH_UserArgs_MT256x256x32_MI16x16x1_SN_LDSB1_CLR1_GSU0_GSUC0_GSUWGMRR0_K1_LBSPPA256_LBSPPB2048_LPB0_MIWT8_8_PLR1_SU32_SUM0_SUS256_SKXCCM0_VWA4_VWB8_WGM1_WGMXCC1_WGMXCCGn1
    SolutionIndex: 3
    SolutionNameMin: Cijk_Alik_Bjlk_BBS_BH_UserArgs_MT256x256x32_MI16x16x1_SN_LDSB1_CLR1_GSU0_GSUC0_GSUWGMRR0_K1_LBSPPA512_LBSPPB2048_LPB16_MIWT8_8_PLR1_SU32_SUM0_SUS256_SKXCCM0_VWA8_VWB1_WGM4_WGMXCC1_WGMXCCGn1
    SolutionIndex: 4
    SolutionNameMin: Cijk_Alik_Bjlk_BBS_BH_UserArgs_MT256x256x32_MI16x16x1_SN_LDSB1_CLR1_GSU0_GSUC0_GSUWGMRR0_K1_LBSPPA256_LBSPPB2048_LPB0_MIWT8_8_PLR1_SU32_SUM0_SUS256_SKXCCM0_VWA4_VWB8_WGM4_WGMXCC1_WGMXCCGn1
    SolutionIndex: 5
    SolutionNameMin: Cijk_Alik_Bjlk_BBS_BH_UserArgs_MT256x256x32_MI16x16x1_SN_LDSB1_CLR1_GSU0_GSUC0_GSUWGMRR0_K1_LBSPPA512_LBSPPB2048_LPB0_MIWT8_8_PLR1_SU32_SUM0_SUS256_SKXCCM0_VWA8_VWB8_WGM4_WGMXCC1_WGMXCCGn1
    SolutionIndex: 6
    SolutionNameMin: Cijk_Alik_Bjlk_BBS_BH_UserArgs_MT256x256x32_MI16x16x1_SN_LDSB1_CLR1_GSU0_GSUC0_GSUWGMRR0_K1_LBSPPA256_LBSPPB2048_LPB0_MIWT8_8_PLR1_SU32_SUM0_SUS256_SKXCCM0_VWA4_VWB8_WGM8_WGMXCC1_WGMXCCGn1
    SolutionIndex: 7
    SolutionNameMin: Cijk_Alik_Bjlk_BBS_BH_UserArgs_MT128x256x32_MI16x16x1_SN_LDSB1_CLR1_GSU0_GSUC0_GSUWGMRR0_K1_LBSPPA128_LBSPPB2048_LPB0_MIWT4_8_PLR1_SU32_SUM0_SUS256_SKXCCM0_VWA2_VWB8_WGM8_WGMXCC1_WGMXCCGn1
    SolutionIndex: 8
    SolutionNameMin: Cijk_Alik_Bjlk_BBS_BH_UserArgs_MT128x256x32_MI16x16x1_SN_LDSB1_CLR1_GSU0_GSUC0_GSUWGMRR0_K1_LBSPPA256_LBSPPB2048_LPB0_MIWT4_8_PLR1_SU32_SUM0_SUS256_SKXCCM0_VWA4_VWB8_WGM8_WGMXCC1_WGMXCCGn1
    SolutionIndex: 9
    SolutionNameMin: Cijk_Alik_Bjlk_BBS_BH_UserArgs_MT128x64x32_MI16x16x1_SN_LDSB0_CLR1_GSU0_GSUC0_GSUWGMRR0_K1_LBSPPA128_LBSPPB512_LPB32_MIWT4_2_PLR1_SU32_SUM0_SUS256_SKXCCM0_VWA2_VWB2_WGM4_WGMXCC1_WGMXCCGn1
    SolutionIndex: 10
    SolutionNameMin: Cijk_Alik_Bjlk_BBS_BH_UserArgs_MT64x64x32_MI16x16x1_SN_LDSB0_CLR1_GSU0_GSUC0_GSUWGMRR0_K1_LBSPPA128_LBSPPB512_LPB32_MIWT2_2_PLR1_SU32_SUM0_SUS256_SKXCCM0_VWA2_VWB2_WGM1_WGMXCC1_WGMXCCGn1
    SolutionIndex: 11
    SolutionNameMin: Cijk_Alik_Bjlk_BBS_BH_UserArgs_MT32x32x32_MI16x16x1_SN_LDSB0_CLR0_GSU0_GSUC0_GSUWGMRR0_K1_LBSPPA128_LBSPPB256_LPB16_MIWT1_1_PLR0_SU32_SUM0_SUS256_SKXCCM0_VWA1_VWB1_WGM1_WGMXCC1_WGMXCCGn1
    SolutionIndex: 12
    SolutionNameMin: Cijk_Alik_Bjlk_BBS_BH_UserArgs_MT128x256x64_MI16x16x1_SN_LDSB1_CLR1_GSU0_GSUC0_GSUWGMRR0_K1_LBSPPA256_LBSPPB4096_LPB0_MIWT4_8_PLR1_SU32_SUM0_SUS256_SKXCCM0_VWA2_VWB4_WGM1_WGMXCC1_WGMXCCGn1
    SolutionIndex: 13
    SolutionNameMin: Cijk_Alik_Bjlk_BBS_BH_UserArgs_MT128x256x64_MI16x16x1_SN_LDSB1_CLR1_GSU0_GSUC0_GSUWGMRR0_K1_LBSPPA512_LBSPPB4096_LPB0_MIWT4_8_PLR1_SU32_SUM0_SUS256_SKXCCM0_VWA4_VWB4_WGM1_WGMXCC1_WGMXCCGn1
    SolutionIndex: 14
    SolutionNameMin: Cijk_Alik_Bjlk_BBS_BH_UserArgs_MT128x256x64_MI16x16x1_SN_LDSB1_CLR1_GSU0_GSUC0_GSUWGMRR0_K1_LBSPPA256_LBSPPB4096_LPB0_MIWT4_8_PLR1_SU32_SUM0_SUS256_SKXCCM0_VWA2_VWB8_WGM1_WGMXCC1_WGMXCCGn1
    SolutionIndex: 15
    SolutionNameMin: Cijk_Alik_Bjlk_BBS_BH_UserArgs_MT128x256x64_MI16x16x1_SN_LDSB1_CLR1_GSU0_GSUC0_GSUWGMRR0_K1_LBSPPA512_LBSPPB4096_LPB0_MIWT4_8_PLR1_SU32_SUM0_SUS256_SKXCCM0_VWA4_VWB8_WGM1_WGMXCC1_WGMXCCGn1
    SolutionIndex: 16
    SolutionNameMin: Cijk_Alik_Bjlk_BBS_BH_UserArgs_MT256x128x64_MI16x16x1_SN_LDSB1_CLR1_GSU0_GSUC0_GSUWGMRR0_K1_LBSPPA256_LBSPPB2048_LPB16_MIWT8_4_PLR1_SU32_SUM0_SUS256_SKXCCM0_VWA2_VWB1_WGM1_WGMXCC1_WGMXCCGn1
    SolutionIndex: 17
    SolutionNameMin: Cijk_Alik_Bjlk_BBS_BH_UserArgs_MT256x128x64_MI16x16x1_SN_LDSB1_CLR1_GSU0_GSUC0_GSUWGMRR0_K1_LBSPPA512_LBSPPB2048_LPB32_MIWT8_4_PLR1_SU32_SUM0_SUS256_SKXCCM0_VWA4_VWB2_WGM1_WGMXCC1_WGMXCCGn1
    SolutionIndex: 18
    SolutionNameMin: Cijk_Alik_Bjlk_BBS_BH_UserArgs_MT256x128x64_MI16x16x1_SN_LDSB1_CLR1_GSU0_GSUC0_GSUWGMRR0_K1_LBSPPA256_LBSPPB2048_LPB0_MIWT8_4_PLR1_SU32_SUM0_SUS256_SKXCCM0_VWA2_VWB4_WGM1_WGMXCC1_WGMXCCGn1
    SolutionIndex: 19
    SolutionNameMin: Cijk_Alik_Bjlk_BBS_BH_UserArgs_MT256x128x64_MI16x16x1_SN_LDSB1_CLR1_GSU0_GSUC0_GSUWGMRR0_K1_LBSPPA512_LBSPPB2048_LPB0_MIWT8_4_PLR1_SU32_SUM0_SUS256_SKXCCM0_VWA4_VWB4_WGM1_WGMXCC1_WGMXCCGn1
    SolutionIndex: 20
    SolutionNameMin: Cijk_Alik_Bjlk_BBS_BH_UserArgs_MT256x128x64_MI16x16x1_SN_LDSB1_CLR1_GSU0_GSUC0_GSUWGMRR0_K1_LBSPPA1024_LBSPPB2048_LPB0_MIWT8_4_PLR1_SU32_SUM0_SUS256_SKXCCM0_VWA8_VWB4_WGM1_WGMXCC1_WGMXCCGn1
    SolutionIndex: 21
    SolutionNameMin: Cijk_Alik_Bjlk_BBS_BH_UserArgs_MT256x128x64_MI16x16x1_SN_LDSB1_CLR1_GSU0_GSUC0_GSUWGMRR0_K1_LBSPPA512_LBSPPB2048_LPB32_MIWT8_4_PLR1_SU32_SUM0_SUS256_SKXCCM0_VWA4_VWB2_WGM4_WGMXCC1_WGMXCCGn1
    SolutionIndex: 22
    SolutionNameMin: Cijk_Alik_Bjlk_BBS_BH_UserArgs_MT256x128x64_MI16x16x1_SN_LDSB1_CLR1_GSU0_GSUC0_GSUWGMRR0_K1_LBSPPA128_LBSPPB2048_LPB0_MIWT8_4_PLR1_SU32_SUM0_SUS256_SKXCCM0_VWA1_VWB4_WGM4_WGMXCC1_WGMXCCGn1
    SolutionIndex: 23
    SolutionNameMin: Cijk_Alik_Bjlk_BBS_BH_UserArgs_MT256x128x64_MI16x16x1_SN_LDSB1_CLR1_GSU0_GSUC0_GSUWGMRR0_K1_LBSPPA256_LBSPPB2048_LPB0_MIWT8_4_PLR1_SU32_SUM0_SUS256_SKXCCM0_VWA2_VWB4_WGM4_WGMXCC1_WGMXCCGn1
    SolutionIndex: 24
    SolutionNameMin: Cijk_Alik_Bjlk_BBS_BH_UserArgs_MT256x128x64_MI16x16x1_SN_LDSB1_CLR1_GSU0_GSUC0_GSUWGMRR0_K1_LBSPPA512_LBSPPB2048_LPB0_MIWT8_4_PLR1_SU32_SUM0_SUS256_SKXCCM0_VWA4_VWB4_WGM4_WGMXCC1_WGMXCCGn1
    SolutionIndex: 25
    SolutionNameMin: Cijk_Alik_Bjlk_BBS_BH_UserArgs_MT256x128x64_MI16x16x1_SN_LDSB1_CLR1_GSU0_GSUC0_GSUWGMRR0_K1_LBSPPA1024_LBSPPB2048_LPB0_MIWT8_4_PLR1_SU32_SUM0_SUS256_SKXCCM0_VWA8_VWB4_WGM4_WGMXCC1_WGMXCCGn1
    SolutionIndex: 26
    SolutionNameMin: Cijk_Alik_Bjlk_BBS_BH_UserArgs_MT256x128x64_MI16x16x1_SN_LDSB1_CLR1_GSU0_GSUC0_GSUWGMRR0_K1_LBSPPA1024_LBSPPB2048_LPB32_MIWT8_4_PLR1_SU32_SUM0_SUS256_SKXCCM0_VWA8_VWB2_WGM8_WGMXCC1_WGMXCCGn1
    SolutionIndex: 27
    SolutionNameMin: Cijk_Alik_Bjlk_BBS_BH_UserArgs_MT256x128x64_MI16x16x1_SN_LDSB1_CLR1_GSU0_GSUC0_GSUWGMRR0_K1_LBSPPA256_LBSPPB2048_LPB0_MIWT8_4_PLR1_SU32_SUM0_SUS256_SKXCCM0_VWA2_VWB4_WGM8_WGMXCC1_WGMXCCGn1
    SolutionIndex: 28
    SolutionNameMin: Cijk_Alik_Bjlk_BBS_BH_UserArgs_MT256x64x64_MI16x16x1_SN_LDSB1_CLR1_GSU0_GSUC0_GSUWGMRR0_K1_LBSPPA1024_LBSPPB1024_LPB16_MIWT8_2_PLR1_SU32_SUM0_SUS256_SKXCCM0_VWA8_VWB1_WGM8_WGMXCC1_WGMXCCGn1
    SolutionIndex: 29
    SolutionNameMin: Cijk_Alik_Bjlk_BBS_BH_UserArgs_MT128x128x64_MI16x16x1_SN_LDSB1_CLR1_GSU0_GSUC0_GSUWGMRR0_K1_LBSPPA256_LBSPPB2048_LPB32_MIWT4_4_PLR1_SU32_SUM0_SUS256_SKXCCM0_VWA2_VWB2_WGM1_WGMXCC1_WGMXCCGn1
    SolutionIndex: 30
    SolutionNameMin: Cijk_Alik_Bjlk_BBS_BH_UserArgs_MT128x128x64_MI16x16x1_SN_LDSB1_CLR1_GSU0_GSUC0_GSUWGMRR0_K1_LBSPPA512_LBSPPB2048_LPB0_MIWT4_4_PLR1_SU32_SUM0_SUS256_SKXCCM0_VWA4_VWB4_WGM1_WGMXCC1_WGMXCCGn1
    SolutionIndex: 31
    SolutionNameMin: Cijk_Alik_Bjlk_BBS_BH_UserArgs_MT128x128x64_MI16x16x1_SN_LDSB1_CLR1_GSU0_GSUC0_GSUWGMRR0_K1_LBSPPA256_LBSPPB2048_LPB0_MIWT4_4_PLR1_SU32_SUM0_SUS256_SKXCCM0_VWA2_VWB4_WGM4_WGMXCC1_WGMXCCGn1
    SolutionIndex: 32
    SolutionNameMin: Cijk_Alik_Bjlk_BBS_BH_UserArgs_MT128x128x64_MI16x16x1_SN_LDSB1_CLR1_GSU0_GSUC0_GSUWGMRR0_K1_LBSPPA512_LBSPPB2048_LPB0_MIWT4_4_PLR1_SU32_SUM0_SUS256_SKXCCM0_VWA4_VWB4_WGM4_WGMXCC1_WGMXCCGn1
    SolutionIndex: 33
    SolutionNameMin: Cijk_Alik_Bjlk_BBS_BH_UserArgs_MT128x128x64_MI16x16x1_SN_LDSB1_CLR1_GSU0_GSUC0_GSUWGMRR0_K1_LBSPPA256_LBSPPB2048_LPB0_MIWT4_4_PLR1_SU32_SUM0_SUS256_SKXCCM0_VWA2_VWB4_WGM8_WGMXCC1_WGMXCCGn1
    SolutionIndex: 34
    SolutionNameMin: Cijk_Alik_Bjlk_BBS_BH_UserArgs_MT128x64x64_MI16x16x1_SN_LDSB1_CLR1_GSU0_GSUC0_GSUWGMRR0_K1_LBSPPA512_LBSPPB1024_LPB32_MIWT4_2_PLR1_SU32_SUM0_SUS256_SKXCCM0_VWA4_VWB2_WGM1_WGMXCC1_WGMXCCGn1
    SolutionIndex: 35
    SolutionNameMin: Cijk_Alik_Bjlk_BBS_BH_UserArgs_MT128x64x64_MI16x16x1_SN_LDSB1_CLR1_GSU0_GSUC0_GSUWGMRR0_K1_LBSPPA256_LBSPPB1024_LPB32_MIWT4_2_PLR1_SU32_SUM0_SUS256_SKXCCM0_VWA2_VWB2_WGM4_WGMXCC1_WGMXCCGn1
    SolutionIndex: 36
    SolutionNameMin: Cijk_Alik_Bjlk_BBS_BH_UserArgs_MT128x64x64_MI16x16x1_SN_LDSB1_CLR1_GSU0_GSUC0_GSUWGMRR0_K1_LBSPPA512_LBSPPB1024_LPB32_MIWT4_2_PLR1_SU32_SUM0_SUS256_SKXCCM0_VWA4_VWB2_WGM4_WGMXCC1_WGMXCCGn1
    SolutionIndex: 37
    SolutionNameMin: Cijk_Alik_Bjlk_BBS_BH_UserArgs_MT64x64x64_MI16x16x1_SN_LDSB1_CLR1_GSU0_GSUC0_GSUWGMRR0_K1_LBSPPA256_LBSPPB1024_LPB32_MIWT2_2_PLR1_SU32_SUM0_SUS256_SKXCCM0_VWA2_VWB2_WGM1_WGMXCC1_WGMXCCGn1
    SolutionIndex: 38
    SolutionNameMin: Cijk_Alik_Bjlk_BBS_BH_UserArgs_MT32x64x64_MI16x16x1_SN_LDSB0_CLR1_GSU0_GSUC0_GSUWGMRR0_K1_LBSPPA128_LBSPPB1024_LPB32_MIWT1_2_PLR1_SU32_SUM0_SUS256_SKXCCM0_VWA1_VWB2_WGM1_WGMXCC1_WGMXCCGn1
    SolutionIndex: 39
    SolutionNameMin: Cijk_Alik_Bjlk_BBS_BH_UserArgs_MT64x32x64_MI16x16x1_SN_LDSB0_CLR1_GSU0_GSUC0_GSUWGMRR0_K1_LBSPPA256_LBSPPB512_LPB16_MIWT2_1_PLR1_SU32_SUM0_SUS256_SKXCCM0_VWA2_VWB1_WGM1_WGMXCC1_WGMXCCGn1
    SolutionIndex: 40
    SolutionNameMin: Cijk_Alik_Bjlk_BBS_BH_UserArgs_MT32x32x64_MI16x16x1_SN_LDSB0_CLR1_GSU0_GSUC0_GSUWGMRR0_K1_LBSPPA128_LBSPPB512_LPB16_MIWT1_1_PLR1_SU32_SUM0_SUS256_SKXCCM0_VWA1_VWB1_WGM1_WGMXCC1_WGMXCCGn1
    SolutionIndex: 41
    SolutionNameMin: Cijk_Alik_Bjlk_BBS_BH_UserArgs_MT32x32x64_MI16x16x1_SN_LDSB0_CLR1_GSU0_GSUC0_GSUWGMRR0_K1_LBSPPA128_LBSPPB512_LPB16_MIWT1_1_PLR2_SU32_SUM0_SUS256_SKXCCM0_VWA1_VWB1_WGM1_WGMXCC1_WGMXCCGn1
    SolutionIndex: 42
    SolutionNameMin: Cijk_Alik_Bjlk_BBS_BH_UserArgs_MT32x32x64_MI16x16x1_SN_LDSB0_CLR1_GSU0_GSUC0_GSUWGMRR0_K1_LBSPPA128_LBSPPB512_LPB16_MIWT1_1_PLR1_SU32_SUM0_SUS256_SKXCCM0_VWA1_VWB1_WGM8_WGMXCC1_WGMXCCGn1
    SolutionIndex: 43
    SolutionNameMin: Cijk_Alik_Bjlk_BBS_BH_UserArgs_MT64x128x128_MI16x16x1_SN_LDSB1_CLR1_GSU0_GSUC0_GSUWGMRR0_K1_LBSPPA256_LBSPPB2048_LPB0_MIWT2_4_PLR2_SU32_SUM0_SUS256_SKXCCM0_VWA1_VWB4_WGM4_WGMXCC1_WGMXCCGn1
    SolutionIndex: 44
    SolutionNameMin: Cijk_Alik_Bjlk_BBS_BH_UserArgs_MT128x64x128_MI16x16x1_SN_LDSB1_CLR1_GSU0_GSUC0_GSUWGMRR0_K1_LBSPPA512_LBSPPB1024_LPB32_MIWT4_2_PLR2_SU32_SUM0_SUS256_SKXCCM0_VWA2_VWB2_WGM1_WGMXCC1_WGMXCCGn1
    SolutionIndex: 45
    SolutionNameMin: Cijk_Alik_Bjlk_BBS_BH_UserArgs_MT128x64x128_MI16x16x1_SN_LDSB1_CLR1_GSU0_GSUC0_GSUWGMRR0_K1_LBSPPA1024_LBSPPB1024_LPB32_MIWT4_2_PLR2_SU32_SUM0_SUS256_SKXCCM0_VWA4_VWB2_WGM1_WGMXCC1_WGMXCCGn1
    SolutionIndex: 46
    SolutionNameMin: Cijk_Alik_Bjlk_BBS_BH_UserArgs_MT128x64x128_MI16x16x1_SN_LDSB1_CLR1_GSU0_GSUC0_GSUWGMRR0_K1_LBSPPA512_LBSPPB1024_LPB32_MIWT4_2_PLR2_SU32_SUM0_SUS256_SKXCCM0_VWA2_VWB2_WGM4_WGMXCC1_WGMXCCGn1
    SolutionIndex: 47
    SolutionNameMin: Cijk_Alik_Bjlk_BBS_BH_UserArgs_MT128x64x128_MI16x16x1_SN_LDSB1_CLR1_GSU0_GSUC0_GSUWGMRR0_K1_LBSPPA1024_LBSPPB1024_LPB32_MIWT4_2_PLR2_SU32_SUM0_SUS256_SKXCCM0_VWA4_VWB2_WGM4_WGMXCC1_WGMXCCGn1
    SolutionIndex: 48
    SolutionNameMin: Cijk_Alik_Bjlk_BBS_BH_UserArgs_MT128x64x128_MI16x16x1_SN_LDSB1_CLR1_GSU0_GSUC0_GSUWGMRR0_K1_LBSPPA512_LBSPPB1024_LPB32_MIWT4_2_PLR2_SU32_SUM0_SUS256_SKXCCM0_VWA2_VWB2_WGM8_WGMXCC1_WGMXCCGn1
    SolutionIndex: 49
    SolutionNameMin: Cijk_Alik_Bjlk_BBS_BH_UserArgs_MT128x64x128_MI16x16x1_SN_LDSB1_CLR1_GSU0_GSUC0_GSUWGMRR0_K1_LBSPPA1024_LBSPPB1024_LPB32_MIWT4_2_PLR2_SU32_SUM0_SUS256_SKXCCM0_VWA4_VWB2_WGM8_WGMXCC1_WGMXCCGn1
    SolutionIndex: 50
    SolutionNameMin: Cijk_Alik_Bjlk_BBS_BH_UserArgs_MT64x64x128_MI16x16x1_SN_LDSB1_CLR1_GSU0_GSUC0_GSUWGMRR0_K1_LBSPPA256_LBSPPB1024_LPB32_MIWT2_2_PLR2_SU32_SUM0_SUS256_SKXCCM0_VWA1_VWB2_WGM1_WGMXCC1_WGMXCCGn1
    SolutionIndex: 51
    SolutionNameMin: Cijk_Alik_Bjlk_BBS_BH_UserArgs_MT64x64x128_MI16x16x1_SN_LDSB1_CLR1_GSU0_GSUC0_GSUWGMRR0_K1_LBSPPA512_LBSPPB1024_LPB32_MIWT2_2_PLR2_SU32_SUM0_SUS256_SKXCCM0_VWA2_VWB2_WGM1_WGMXCC1_WGMXCCGn1
    SolutionIndex: 52
    SolutionNameMin: Cijk_Alik_Bjlk_BBS_BH_UserArgs_MT64x64x128_MI16x16x1_SN_LDSB1_CLR1_GSU0_GSUC0_GSUWGMRR0_K1_LBSPPA512_LBSPPB1024_LPB32_MIWT2_2_PLR2_SU32_SUM0_SUS256_SKXCCM0_VWA2_VWB2_WGM4_WGMXCC1_WGMXCCGn1
    SolutionIndex: 53
    SolutionNameMin: Cijk_Alik_Bjlk_BBS_BH_UserArgs_MT64x64x128_MI16x16x1_SN_LDSB1_CLR1_GSU0_GSUC0_GSUWGMRR0_K1_LBSPPA256_LBSPPB1024_LPB32_MIWT2_2_PLR2_SU32_SUM0_SUS256_SKXCCM0_VWA1_VWB2_WGM8_WGMXCC1_WGMXCCGn1
    SolutionIndex: 54
    SolutionNameMin: Cijk_Alik_Bjlk_BBS_BH_UserArgs_MT64x64x128_MI16x16x1_SN_LDSB1_CLR1_GSU0_GSUC0_GSUWGMRR0_K1_LBSPPA512_LBSPPB1024_LPB32_MIWT2_2_PLR2_SU32_SUM0_SUS256_SKXCCM0_VWA2_VWB2_WGM8_WGMXCC1_WGMXCCGn1
    SolutionIndex: 55
    SolutionNameMin: Cijk_Alik_Bjlk_BBS_BH_UserArgs_MT32x64x128_MI16x16x1_SN_LDSB1_CLR1_GSU0_GSUC0_GSUWGMRR0_K1_LBSPPA256_LBSPPB1024_LPB32_MIWT1_2_PLR1_SU32_SUM0_SUS256_SKXCCM0_VWA1_VWB2_WGM1_WGMXCC1_WGMXCCGn1
    SolutionIndex: 56
    SolutionNameMin: Cijk_Alik_Bjlk_BBS_BH_UserArgs_MT32x64x128_MI16x16x1_SN_LDSB1_CLR1_GSU0_GSUC0_GSUWGMRR0_K1_LBSPPA256_LBSPPB1024_LPB32_MIWT1_2_PLR2_SU32_SUM0_SUS256_SKXCCM0_VWA1_VWB2_WGM1_WGMXCC1_WGMXCCGn1
    SolutionIndex: 57
    SolutionNameMin: Cijk_Alik_Bjlk_BBS_BH_UserArgs_MT32x64x128_MI16x16x1_SN_LDSB1_CLR1_GSU0_GSUC0_GSUWGMRR0_K1_LBSPPA256_LBSPPB1024_LPB32_MIWT1_2_PLR2_SU32_SUM0_SUS256_SKXCCM0_VWA1_VWB2_WGM4_WGMXCC1_WGMXCCGn1
    SolutionIndex: 58
    SolutionNameMin: Cijk_Alik_Bjlk_BBS_BH_UserArgs_MT32x64x128_MI16x16x1_SN_LDSB1_CLR1_GSU0_GSUC0_GSUWGMRR0_K1_LBSPPA256_LBSPPB1024_LPB32_MIWT1_2_PLR2_SU32_SUM0_SUS256_SKXCCM0_VWA1_VWB2_WGM8_WGMXCC1_WGMXCCGn1
    SolutionIndex: 59
    SolutionNameMin: Cijk_Alik_Bjlk_BBS_BH_UserArgs_MT64x32x128_MI16x16x1_SN_LDSB1_CLR1_GSU0_GSUC0_GSUWGMRR0_K1_LBSPPA512_LBSPPB512_LPB16_MIWT2_1_PLR2_SU32_SUM0_SUS256_SKXCCM0_VWA2_VWB1_WGM1_WGMXCC1_WGMXCCGn1
    SolutionIndex: 60
    SolutionNameMin: Cijk_Alik_Bjlk_BBS_BH_UserArgs_MT64x32x128_MI16x16x1_SN_LDSB1_CLR1_GSU0_GSUC0_GSUWGMRR0_K1_LBSPPA256_LBSPPB512_LPB16_MIWT2_1_PLR2_SU32_SUM0_SUS256_SKXCCM0_VWA1_VWB1_WGM8_WGMXCC1_WGMXCCGn1
    SolutionIndex: 61
    SolutionNameMin: Cijk_Alik_Bjlk_BBS_BH_UserArgs_MT32x32x128_MI16x16x1_SN_LDSB1_CLR1_GSU0_GSUC0_GSUWGMRR0_K1_LBSPPA256_LBSPPB512_LPB16_MIWT1_1_PLR1_SU32_SUM0_SUS256_SKXCCM0_VWA1_VWB1_WGM1_WGMXCC1_WGMXCCGn1
    SolutionIndex: 62
    SolutionNameMin: Cijk_Alik_Bjlk_BBS_BH_UserArgs_MT32x32x128_MI16x16x1_SN_LDSB1_CLR1_GSU0_GSUC0_GSUWGMRR0_K1_LBSPPA256_LBSPPB512_LPB16_MIWT1_1_PLR2_SU32_SUM0_SUS256_SKXCCM0_VWA1_VWB1_WGM1_WGMXCC1_WGMXCCGn1
    SolutionIndex: 63
    SolutionNameMin: Cijk_Alik_Bjlk_BBS_BH_UserArgs_MT32x32x128_MI16x16x1_SN_LDSB1_CLR1_GSU0_GSUC0_GSUWGMRR0_K1_LBSPPA256_LBSPPB512_LPB16_MIWT1_1_PLR1_SU32_SUM0_SUS256_SKXCCM0_VWA1_VWB1_WGM4_WGMXCC1_WGMXCCGn1
    SolutionIndex: 64
    SolutionNameMin: Cijk_Alik_Bjlk_BBS_BH_UserArgs_MT32x32x128_MI16x16x1_SN_LDSB1_CLR1_GSU0_GSUC0_GSUWGMRR0_K1_LBSPPA256_LBSPPB512_LPB16_MIWT1_1_PLR2_SU32_SUM0_SUS256_SKXCCM0_VWA1_VWB1_WGM4_WGMXCC1_WGMXCCGn1
    SolutionIndex: 65
    SolutionNameMin: Cijk_Alik_Bjlk_BBS_BH_UserArgs_MT32x32x128_MI16x16x1_SN_LDSB1_CLR1_GSU0_GSUC0_GSUWGMRR0_K1_LBSPPA256_LBSPPB512_LPB16_MIWT1_1_PLR2_SU32_SUM0_SUS256_SKXCCM0_VWA1_VWB1_WGM8_WGMXCC1_WGMXCCGn1
    SolutionIndex: 66
    SolutionNameMin: Cijk_Alik_Bjlk_BBS_BH_UserArgs_MT256x256x32_MI16x16x1_SN_LDSB1_CLR1_GSU0_GSUC0_GSUWGMRR0_K1_LBSPPA256_LBSPPB2048_LPB0_MIWT8_8_PLR1_SU32_SUM0_SUS256_SKXCCM8_VWA4_VWB4_WGM1_WGMXCC1_WGMXCCGn1
    SolutionIndex: 67
    SolutionNameMin: Cijk_Alik_Bjlk_BBS_BH_UserArgs_MT256x256x32_MI16x16x1_SN_LDSB1_CLR1_GSU0_GSUC0_GSUWGMRR0_K1_LBSPPA128_LBSPPB2048_LPB0_MIWT8_8_PLR1_SU32_SUM0_SUS256_SKXCCM8_VWA2_VWB8_WGM1_WGMXCC1_WGMXCCGn1
    SolutionIndex: 68
    SolutionNameMin: Cijk_Alik_Bjlk_BBS_BH_UserArgs_MT256x256x32_MI16x16x1_SN_LDSB1_CLR1_GSU0_GSUC0_GSUWGMRR0_K1_LBSPPA256_LBSPPB2048_LPB0_MIWT8_8_PLR1_SU32_SUM0_SUS256_SKXCCM8_VWA4_VWB8_WGM1_WGMXCC1_WGMXCCGn1
    SolutionIndex: 69
    SolutionNameMin: Cijk_Alik_Bjlk_BBS_BH_UserArgs_MT256x256x32_MI16x16x1_SN_LDSB1_CLR1_GSU0_GSUC0_GSUWGMRR0_K1_LBSPPA512_LBSPPB2048_LPB0_MIWT8_8_PLR1_SU32_SUM0_SUS256_SKXCCM8_VWA8_VWB8_WGM1_WGMXCC1_WGMXCCGn1
    SolutionIndex: 70
    SolutionNameMin: Cijk_Alik_Bjlk_BBS_BH_UserArgs_MT256x256x32_MI16x16x1_SN_LDSB1_CLR1_GSU0_GSUC0_GSUWGMRR0_K1_LBSPPA256_LBSPPB2048_LPB0_MIWT8_8_PLR1_SU32_SUM0_SUS256_SKXCCM8_VWA4_VWB8_WGM4_WGMXCC1_WGMXCCGn1
    SolutionIndex: 71
    SolutionNameMin: Cijk_Alik_Bjlk_BBS_BH_UserArgs_MT256x256x32_MI16x16x1_SN_LDSB1_CLR1_GSU0_GSUC0_GSUWGMRR0_K1_LBSPPA512_LBSPPB2048_LPB0_MIWT8_8_PLR1_SU32_SUM0_SUS256_SKXCCM8_VWA8_VWB8_WGM4_WGMXCC1_WGMXCCGn1
    SolutionIndex: 72
    SolutionNameMin: Cijk_Alik_Bjlk_BBS_BH_UserArgs_MT256x256x32_MI16x16x1_SN_LDSB1_CLR1_GSU0_GSUC0_GSUWGMRR0_K1_LBSPPA128_LBSPPB2048_LPB0_MIWT8_8_PLR1_SU32_SUM0_SUS256_SKXCCM8_VWA2_VWB8_WGM8_WGMXCC1_WGMXCCGn1
    SolutionIndex: 73
    SolutionNameMin: Cijk_Alik_Bjlk_BBS_BH_UserArgs_MT256x256x32_MI16x16x1_SN_LDSB1_CLR1_GSU0_GSUC0_GSUWGMRR0_K1_LBSPPA256_LBSPPB2048_LPB0_MIWT8_8_PLR1_SU32_SUM0_SUS256_SKXCCM8_VWA4_VWB8_WGM8_WGMXCC1_WGMXCCGn1
    SolutionIndex: 74
    SolutionNameMin: Cijk_Alik_Bjlk_BBS_BH_UserArgs_MT256x256x32_MI16x16x1_SN_LDSB1_CLR1_GSU0_GSUC0_GSUWGMRR0_K1_LBSPPA512_LBSPPB2048_LPB0_MIWT8_8_PLR1_SU32_SUM0_SUS256_SKXCCM8_VWA8_VWB8_WGM8_WGMXCC1_WGMXCCGn1
    SolutionIndex: 75
    SolutionNameMin: Cijk_Alik_Bjlk_BBS_BH_UserArgs_MT128x256x32_MI16x16x1_SN_LDSB1_CLR1_GSU0_GSUC0_GSUWGMRR0_K1_LBSPPA128_LBSPPB2048_LPB0_MIWT4_8_PLR1_SU32_SUM0_SUS256_SKXCCM8_VWA2_VWB8_WGM1_WGMXCC1_WGMXCCGn1
    SolutionIndex: 76
    SolutionNameMin: Cijk_Alik_Bjlk_BBS_BH_UserArgs_MT128x256x32_MI16x16x1_SN_LDSB1_CLR1_GSU0_GSUC0_GSUWGMRR0_K1_LBSPPA256_LBSPPB2048_LPB0_MIWT4_8_PLR1_SU32_SUM0_SUS256_SKXCCM8_VWA4_VWB8_WGM1_WGMXCC1_WGMXCCGn1
    SolutionIndex: 77
    SolutionNameMin: Cijk_Alik_Bjlk_BBS_BH_UserArgs_MT128x256x32_MI16x16x1_SN_LDSB1_CLR1_GSU0_GSUC0_GSUWGMRR0_K1_LBSPPA256_LBSPPB2048_LPB0_MIWT4_8_PLR1_SU32_SUM0_SUS256_SKXCCM8_VWA4_VWB8_WGM8_WGMXCC1_WGMXCCGn1
    SolutionIndex: 78
    SolutionNameMin: Cijk_Alik_Bjlk_BBS_BH_UserArgs_MT256x128x32_MI16x16x1_SN_LDSB1_CLR1_GSU0_GSUC0_GSUWGMRR0_K1_LBSPPA512_LBSPPB1024_LPB32_MIWT8_4_PLR1_SU32_SUM0_SUS256_SKXCCM8_VWA8_VWB2_WGM1_WGMXCC1_WGMXCCGn1
    SolutionIndex: 79
    SolutionNameMin: Cijk_Alik_Bjlk_BBS_BH_UserArgs_MT256x128x32_MI16x16x1_SN_LDSB1_CLR1_GSU0_GSUC0_GSUWGMRR0_K1_LBSPPA512_LBSPPB1024_LPB0_MIWT8_4_PLR1_SU32_SUM0_SUS256_SKXCCM8_VWA8_VWB4_WGM1_WGMXCC1_WGMXCCGn1
    SolutionIndex: 80
    SolutionNameMin: Cijk_Alik_Bjlk_BBS_BH_UserArgs_MT256x128x32_MI16x16x1_SN_LDSB1_CLR1_GSU0_GSUC0_GSUWGMRR0_K1_LBSPPA512_LBSPPB1024_LPB32_MIWT8_4_PLR1_SU32_SUM0_SUS256_SKXCCM8_VWA8_VWB2_WGM8_WGMXCC1_WGMXCCGn1
    SolutionIndex: 81
    SolutionNameMin: Cijk_Alik_Bjlk_BBS_BH_UserArgs_MT128x64x32_MI16x16x1_SN_LDSB0_CLR1_GSU0_GSUC0_GSUWGMRR0_K1_LBSPPA128_LBSPPB512_LPB32_MIWT4_2_PLR1_SU32_SUM0_SUS256_SKXCCM8_VWA2_VWB2_WGM1_WGMXCC1_WGMXCCGn1
    SolutionIndex: 82
    SolutionNameMin: Cijk_Alik_Bjlk_BBS_BH_UserArgs_MT128x64x32_MI16x16x1_SN_LDSB0_CLR1_GSU0_GSUC0_GSUWGMRR0_K1_LBSPPA256_LBSPPB512_LPB32_MIWT4_2_PLR1_SU32_SUM0_SUS256_SKXCCM8_VWA4_VWB2_WGM1_WGMXCC1_WGMXCCGn1
    SolutionIndex: 83
    SolutionNameMin: Cijk_Alik_Bjlk_BBS_BH_UserArgs_MT128x64x32_MI16x16x1_SN_LDSB0_CLR1_GSU0_GSUC0_GSUWGMRR0_K1_LBSPPA256_LBSPPB512_LPB32_MIWT4_2_PLR1_SU32_SUM0_SUS256_SKXCCM8_VWA4_VWB2_WGM8_WGMXCC1_WGMXCCGn1
    SolutionIndex: 84
    SolutionNameMin: Cijk_Alik_Bjlk_BBS_BH_UserArgs_MT64x64x32_MI16x16x1_SN_LDSB0_CLR1_GSU0_GSUC0_GSUWGMRR0_K1_LBSPPA128_LBSPPB512_LPB32_MIWT2_2_PLR1_SU32_SUM0_SUS256_SKXCCM8_VWA2_VWB2_WGM1_WGMXCC1_WGMXCCGn1
    SolutionIndex: 85
    SolutionNameMin: Cijk_Alik_Bjlk_BBS_BH_UserArgs_MT32x32x32_MI16x16x1_SN_LDSB0_CLR1_GSU0_GSUC0_GSUWGMRR0_K1_LBSPPA128_LBSPPB256_LPB16_MIWT1_1_PLR1_SU32_SUM0_SUS256_SKXCCM8_VWA1_VWB1_WGM1_WGMXCC1_WGMXCCGn1
    SolutionIndex: 86
    SolutionNameMin: Cijk_Alik_Bjlk_BBS_BH_UserArgs_MT32x32x32_MI16x16x1_SN_LDSB0_CLR0_GSU0_GSUC0_GSUWGMRR0_K1_LBSPPA128_LBSPPB256_LPB16_MIWT1_1_PLR0_SU32_SUM0_SUS256_SKXCCM8_VWA1_VWB1_WGM1_WGMXCC1_WGMXCCGn1
    SolutionIndex: 87
    SolutionNameMin: Cijk_Alik_Bjlk_BBS_BH_UserArgs_MT128x256x64_MI16x16x1_SN_LDSB1_CLR1_GSU0_GSUC0_GSUWGMRR0_K1_LBSPPA256_LBSPPB4096_LPB32_MIWT4_8_PLR1_SU32_SUM0_SUS256_SKXCCM8_VWA2_VWB2_WGM1_WGMXCC1_WGMXCCGn1
    SolutionIndex: 88
    SolutionNameMin: Cijk_Alik_Bjlk_BBS_BH_UserArgs_MT128x256x64_MI16x16x1_SN_LDSB1_CLR1_GSU0_GSUC0_GSUWGMRR0_K1_LBSPPA512_LBSPPB4096_LPB0_MIWT4_8_PLR1_SU32_SUM0_SUS256_SKXCCM8_VWA4_VWB4_WGM1_WGMXCC1_WGMXCCGn1
    SolutionIndex: 89
    SolutionNameMin: Cijk_Alik_Bjlk_BBS_BH_UserArgs_MT128x256x64_MI16x16x1_SN_LDSB1_CLR1_GSU0_GSUC0_GSUWGMRR0_K1_LBSPPA512_LBSPPB4096_LPB0_MIWT4_8_PLR1_SU32_SUM0_SUS256_SKXCCM8_VWA4_VWB8_WGM1_WGMXCC1_WGMXCCGn1
    SolutionIndex: 90
    SolutionNameMin: Cijk_Alik_Bjlk_BBS_BH_UserArgs_MT128x256x64_MI16x16x1_SN_LDSB1_CLR1_GSU0_GSUC0_GSUWGMRR0_K1_LBSPPA128_LBSPPB4096_LPB0_MIWT4_8_PLR1_SU32_SUM0_SUS256_SKXCCM8_VWA1_VWB4_WGM4_WGMXCC1_WGMXCCGn1
    SolutionIndex: 91
    SolutionNameMin: Cijk_Alik_Bjlk_BBS_BH_UserArgs_MT128x256x64_MI16x16x1_SN_LDSB1_CLR1_GSU0_GSUC0_GSUWGMRR0_K1_LBSPPA256_LBSPPB4096_LPB0_MIWT4_8_PLR1_SU32_SUM0_SUS256_SKXCCM8_VWA2_VWB4_WGM4_WGMXCC1_WGMXCCGn1
    SolutionIndex: 92
    SolutionNameMin: Cijk_Alik_Bjlk_BBS_BH_UserArgs_MT128x256x64_MI16x16x1_SN_LDSB1_CLR1_GSU0_GSUC0_GSUWGMRR0_K1_LBSPPA512_LBSPPB4096_LPB0_MIWT4_8_PLR1_SU32_SUM0_SUS256_SKXCCM8_VWA4_VWB4_WGM4_WGMXCC1_WGMXCCGn1
    SolutionIndex: 93
    SolutionNameMin: Cijk_Alik_Bjlk_BBS_BH_UserArgs_MT128x256x64_MI16x16x1_SN_LDSB1_CLR1_GSU0_GSUC0_GSUWGMRR0_K1_LBSPPA512_LBSPPB4096_LPB0_MIWT4_8_PLR1_SU32_SUM0_SUS256_SKXCCM8_VWA4_VWB8_WGM4_WGMXCC1_WGMXCCGn1
    SolutionIndex: 94
    SolutionNameMin: Cijk_Alik_Bjlk_BBS_BH_UserArgs_MT256x128x64_MI16x16x1_SN_LDSB1_CLR1_GSU0_GSUC0_GSUWGMRR0_K1_LBSPPA128_LBSPPB2048_LPB32_MIWT8_4_PLR1_SU32_SUM0_SUS256_SKXCCM8_VWA1_VWB2_WGM1_WGMXCC1_WGMXCCGn1
    SolutionIndex: 95
    SolutionNameMin: Cijk_Alik_Bjlk_BBS_BH_UserArgs_MT256x128x64_MI16x16x1_SN_LDSB1_CLR1_GSU0_GSUC0_GSUWGMRR0_K1_LBSPPA256_LBSPPB2048_LPB32_MIWT8_4_PLR1_SU32_SUM0_SUS256_SKXCCM8_VWA2_VWB2_WGM1_WGMXCC1_WGMXCCGn1
    SolutionIndex: 96
    SolutionNameMin: Cijk_Alik_Bjlk_BBS_BH_UserArgs_MT256x128x64_MI16x16x1_SN_LDSB1_CLR1_GSU0_GSUC0_GSUWGMRR0_K1_LBSPPA128_LBSPPB2048_LPB0_MIWT8_4_PLR1_SU32_SUM0_SUS256_SKXCCM8_VWA1_VWB4_WGM1_WGMXCC1_WGMXCCGn1
    SolutionIndex: 97
    SolutionNameMin: Cijk_Alik_Bjlk_BBS_BH_UserArgs_MT256x128x64_MI16x16x1_SN_LDSB1_CLR1_GSU0_GSUC0_GSUWGMRR0_K1_LBSPPA1024_LBSPPB2048_LPB0_MIWT8_4_PLR1_SU32_SUM0_SUS256_SKXCCM8_VWA8_VWB4_WGM1_WGMXCC1_WGMXCCGn1
    SolutionIndex: 98
    SolutionNameMin: Cijk_Alik_Bjlk_BBS_BH_UserArgs_MT256x128x64_MI16x16x1_SN_LDSB1_CLR1_GSU0_GSUC0_GSUWGMRR0_K1_LBSPPA512_LBSPPB2048_LPB32_MIWT8_4_PLR1_SU32_SUM0_SUS256_SKXCCM8_VWA4_VWB2_WGM4_WGMXCC1_WGMXCCGn1
    SolutionIndex: 99
    SolutionNameMin: Cijk_Alik_Bjlk_BBS_BH_UserArgs_MT256x128x64_MI16x16x1_SN_LDSB1_CLR1_GSU0_GSUC0_GSUWGMRR0_K1_LBSPPA256_LBSPPB2048_LPB0_MIWT8_4_PLR1_SU32_SUM0_SUS256_SKXCCM8_VWA2_VWB4_WGM8_WGMXCC1_WGMXCCGn1
    SolutionIndex: 100
    SolutionNameMin: Cijk_Alik_Bjlk_BBS_BH_UserArgs_MT256x128x64_MI16x16x1_SN_LDSB1_CLR1_GSU0_GSUC0_GSUWGMRR0_K1_LBSPPA512_LBSPPB2048_LPB0_MIWT8_4_PLR1_SU32_SUM0_SUS256_SKXCCM8_VWA4_VWB4_WGM8_WGMXCC1_WGMXCCGn1
    SolutionIndex: 101
    SolutionNameMin: Cijk_Alik_Bjlk_BBS_BH_UserArgs_MT256x128x64_MI16x16x1_SN_LDSB1_CLR1_GSU0_GSUC0_GSUWGMRR0_K1_LBSPPA1024_LBSPPB2048_LPB0_MIWT8_4_PLR1_SU32_SUM0_SUS256_SKXCCM8_VWA8_VWB4_WGM8_WGMXCC1_WGMXCCGn1
    SolutionIndex: 102
    SolutionNameMin: Cijk_Alik_Bjlk_BBS_BH_UserArgs_MT256x64x64_MI16x16x1_SN_LDSB1_CLR1_GSU0_GSUC0_GSUWGMRR0_K1_LBSPPA1024_LBSPPB1024_LPB16_MIWT8_2_PLR1_SU32_SUM0_SUS256_SKXCCM8_VWA8_VWB1_WGM1_WGMXCC1_WGMXCCGn1
    SolutionIndex: 103
    SolutionNameMin: Cijk_Alik_Bjlk_BBS_BH_UserArgs_MT128x128x64_MI16x16x1_SN_LDSB1_CLR1_GSU0_GSUC0_GSUWGMRR0_K1_LBSPPA256_LBSPPB2048_LPB0_MIWT4_4_PLR1_SU32_SUM0_SUS256_SKXCCM8_VWA2_VWB4_WGM1_WGMXCC1_WGMXCCGn1
    SolutionIndex: 104
    SolutionNameMin: Cijk_Alik_Bjlk_BBS_BH_UserArgs_MT128x128x64_MI16x16x1_SN_LDSB1_CLR1_GSU0_GSUC0_GSUWGMRR0_K1_LBSPPA512_LBSPPB2048_LPB0_MIWT4_4_PLR1_SU32_SUM0_SUS256_SKXCCM8_VWA4_VWB4_WGM1_WGMXCC1_WGMXCCGn1
    SolutionIndex: 105
    SolutionNameMin: Cijk_Alik_Bjlk_BBS_BH_UserArgs_MT128x128x64_MI16x16x1_SN_LDSB1_CLR1_GSU0_GSUC0_GSUWGMRR0_K1_LBSPPA256_LBSPPB2048_LPB0_MIWT4_4_PLR2_SU32_SUM0_SUS256_SKXCCM8_VWA2_VWB4_WGM1_WGMXCC1_WGMXCCGn1
    SolutionIndex: 106
    SolutionNameMin: Cijk_Alik_Bjlk_BBS_BH_UserArgs_MT128x128x64_MI16x16x1_SN_LDSB1_CLR1_GSU0_GSUC0_GSUWGMRR0_K1_LBSPPA256_LBSPPB2048_LPB0_MIWT4_4_PLR1_SU32_SUM0_SUS256_SKXCCM8_VWA2_VWB4_WGM4_WGMXCC1_WGMXCCGn1
    SolutionIndex: 107
    SolutionNameMin: Cijk_Alik_Bjlk_BBS_BH_UserArgs_MT128x128x64_MI16x16x1_SN_LDSB1_CLR1_GSU0_GSUC0_GSUWGMRR0_K1_LBSPPA512_LBSPPB2048_LPB0_MIWT4_4_PLR1_SU32_SUM0_SUS256_SKXCCM8_VWA4_VWB4_WGM4_WGMXCC1_WGMXCCGn1
    SolutionIndex: 108
    SolutionNameMin: Cijk_Alik_Bjlk_BBS_BH_UserArgs_MT128x128x64_MI16x16x1_SN_LDSB1_CLR1_GSU0_GSUC0_GSUWGMRR0_K1_LBSPPA128_LBSPPB2048_LPB0_MIWT4_4_PLR1_SU32_SUM0_SUS256_SKXCCM8_VWA1_VWB4_WGM8_WGMXCC1_WGMXCCGn1
    SolutionIndex: 109
    SolutionNameMin: Cijk_Alik_Bjlk_BBS_BH_UserArgs_MT128x128x64_MI16x16x1_SN_LDSB1_CLR1_GSU0_GSUC0_GSUWGMRR0_K1_LBSPPA256_LBSPPB2048_LPB0_MIWT4_4_PLR1_SU32_SUM0_SUS256_SKXCCM8_VWA2_VWB4_WGM8_WGMXCC1_WGMXCCGn1
    SolutionIndex: 110
    SolutionNameMin: Cijk_Alik_Bjlk_BBS_BH_UserArgs_MT128x128x64_MI16x16x1_SN_LDSB1_CLR1_GSU0_GSUC0_GSUWGMRR0_K1_LBSPPA512_LBSPPB2048_LPB0_MIWT4_4_PLR1_SU32_SUM0_SUS256_SKXCCM8_VWA4_VWB4_WGM8_WGMXCC1_WGMXCCGn1
    SolutionIndex: 111
    SolutionNameMin: Cijk_Alik_Bjlk_BBS_BH_UserArgs_MT64x128x64_MI16x16x1_SN_LDSB1_CLR1_GSU0_GSUC0_GSUWGMRR0_K1_LBSPPA256_LBSPPB2048_LPB0_MIWT2_4_PLR1_SU32_SUM0_SUS256_SKXCCM8_VWA2_VWB4_WGM1_WGMXCC1_WGMXCCGn1
    SolutionIndex: 112
    SolutionNameMin: Cijk_Alik_Bjlk_BBS_BH_UserArgs_MT128x64x64_MI16x16x1_SN_LDSB1_CLR1_GSU0_GSUC0_GSUWGMRR0_K1_LBSPPA256_LBSPPB1024_LPB32_MIWT4_2_PLR1_SU32_SUM0_SUS256_SKXCCM8_VWA2_VWB2_WGM1_WGMXCC1_WGMXCCGn1
    SolutionIndex: 113
    SolutionNameMin: Cijk_Alik_Bjlk_BBS_BH_UserArgs_MT128x64x64_MI16x16x1_SN_LDSB1_CLR1_GSU0_GSUC0_GSUWGMRR0_K1_LBSPPA512_LBSPPB1024_LPB32_MIWT4_2_PLR1_SU32_SUM0_SUS256_SKXCCM8_VWA4_VWB2_WGM1_WGMXCC1_WGMXCCGn1
    SolutionIndex: 114
    SolutionNameMin: Cijk_Alik_Bjlk_BBS_BH_UserArgs_MT128x64x64_MI16x16x1_SN_LDSB1_CLR1_GSU0_GSUC0_GSUWGMRR0_K1_LBSPPA256_LBSPPB1024_LPB32_MIWT4_2_PLR1_SU32_SUM0_SUS256_SKXCCM8_VWA2_VWB2_WGM4_WGMXCC1_WGMXCCGn1
    SolutionIndex: 115
    SolutionNameMin: Cijk_Alik_Bjlk_BBS_BH_UserArgs_MT128x64x64_MI16x16x1_SN_LDSB1_CLR1_GSU0_GSUC0_GSUWGMRR0_K1_LBSPPA512_LBSPPB1024_LPB32_MIWT4_2_PLR1_SU32_SUM0_SUS256_SKXCCM8_VWA4_VWB2_WGM4_WGMXCC1_WGMXCCGn1
    SolutionIndex: 116
    SolutionNameMin: Cijk_Alik_Bjlk_BBS_BH_UserArgs_MT64x64x64_MI16x16x1_SN_LDSB1_CLR1_GSU0_GSUC0_GSUWGMRR0_K1_LBSPPA256_LBSPPB1024_LPB32_MIWT2_2_PLR1_SU32_SUM0_SUS256_SKXCCM8_VWA2_VWB2_WGM1_WGMXCC1_WGMXCCGn1
    SolutionIndex: 117
    SolutionNameMin: Cijk_Alik_Bjlk_BBS_BH_UserArgs_MT64x64x64_MI16x16x1_SN_LDSB1_CLR1_GSU0_GSUC0_GSUWGMRR0_K1_LBSPPA256_LBSPPB1024_LPB32_MIWT2_2_PLR1_SU32_SUM0_SUS256_SKXCCM8_VWA2_VWB2_WGM4_WGMXCC1_WGMXCCGn1
    SolutionIndex: 118
    SolutionNameMin: Cijk_Alik_Bjlk_BBS_BH_UserArgs_MT64x64x64_MI16x16x1_SN_LDSB1_CLR1_GSU0_GSUC0_GSUWGMRR0_K1_LBSPPA256_LBSPPB1024_LPB32_MIWT2_2_PLR1_SU32_SUM0_SUS256_SKXCCM8_VWA2_VWB2_WGM8_WGMXCC1_WGMXCCGn1
    SolutionIndex: 119
    SolutionNameMin: Cijk_Alik_Bjlk_BBS_BH_UserArgs_MT32x64x64_MI16x16x1_SN_LDSB0_CLR1_GSU0_GSUC0_GSUWGMRR0_K1_LBSPPA128_LBSPPB1024_LPB32_MIWT1_2_PLR1_SU32_SUM0_SUS256_SKXCCM8_VWA1_VWB2_WGM1_WGMXCC1_WGMXCCGn1
    SolutionIndex: 120
    SolutionNameMin: Cijk_Alik_Bjlk_BBS_BH_UserArgs_MT64x32x64_MI16x16x1_SN_LDSB0_CLR1_GSU0_GSUC0_GSUWGMRR0_K1_LBSPPA256_LBSPPB512_LPB16_MIWT2_1_PLR1_SU32_SUM0_SUS256_SKXCCM8_VWA2_VWB1_WGM1_WGMXCC1_WGMXCCGn1
    SolutionIndex: 121
    SolutionNameMin: Cijk_Alik_Bjlk_BBS_BH_UserArgs_MT32x32x64_MI16x16x1_SN_LDSB0_CLR1_GSU0_GSUC0_GSUWGMRR0_K1_LBSPPA128_LBSPPB512_LPB16_MIWT1_1_PLR1_SU32_SUM0_SUS256_SKXCCM8_VWA1_VWB1_WGM1_WGMXCC1_WGMXCCGn1
    SolutionIndex: 122
    SolutionNameMin: Cijk_Alik_Bjlk_BBS_BH_UserArgs_MT32x32x64_MI16x16x1_SN_LDSB0_CLR1_GSU0_GSUC0_GSUWGMRR0_K1_LBSPPA128_LBSPPB512_LPB16_MIWT1_1_PLR2_SU32_SUM0_SUS256_SKXCCM8_VWA1_VWB1_WGM1_WGMXCC1_WGMXCCGn1
    SolutionIndex: 123
    SolutionNameMin: Cijk_Alik_Bjlk_BBS_BH_UserArgs_MT128x64x128_MI16x16x1_SN_LDSB1_CLR1_GSU0_GSUC0_GSUWGMRR0_K1_LBSPPA256_LBSPPB1024_LPB32_MIWT4_2_PLR2_SU32_SUM0_SUS256_SKXCCM8_VWA1_VWB2_WGM1_WGMXCC1_WGMXCCGn1
    SolutionIndex: 124
    SolutionNameMin: Cijk_Alik_Bjlk_BBS_BH_UserArgs_MT128x64x128_MI16x16x1_SN_LDSB1_CLR1_GSU0_GSUC0_GSUWGMRR0_K1_LBSPPA512_LBSPPB1024_LPB32_MIWT4_2_PLR2_SU32_SUM0_SUS256_SKXCCM8_VWA2_VWB2_WGM1_WGMXCC1_WGMXCCGn1
    SolutionIndex: 125
    SolutionNameMin: Cijk_Alik_Bjlk_BBS_BH_UserArgs_MT128x64x128_MI16x16x1_SN_LDSB1_CLR1_GSU0_GSUC0_GSUWGMRR0_K1_LBSPPA1024_LBSPPB1024_LPB32_MIWT4_2_PLR2_SU32_SUM0_SUS256_SKXCCM8_VWA4_VWB2_WGM1_WGMXCC1_WGMXCCGn1
    SolutionIndex: 126
    SolutionNameMin: Cijk_Alik_Bjlk_BBS_BH_UserArgs_MT128x64x128_MI16x16x1_SN_LDSB1_CLR1_GSU0_GSUC0_GSUWGMRR0_K1_LBSPPA512_LBSPPB1024_LPB32_MIWT4_2_PLR2_SU32_SUM0_SUS256_SKXCCM8_VWA2_VWB2_WGM4_WGMXCC1_WGMXCCGn1
    SolutionIndex: 127
    SolutionNameMin: Cijk_Alik_Bjlk_BBS_BH_UserArgs_MT128x64x128_MI16x16x1_SN_LDSB1_CLR1_GSU0_GSUC0_GSUWGMRR0_K1_LBSPPA1024_LBSPPB1024_LPB32_MIWT4_2_PLR2_SU32_SUM0_SUS256_SKXCCM8_VWA4_VWB2_WGM4_WGMXCC1_WGMXCCGn1
    SolutionIndex: 128
    SolutionNameMin: Cijk_Alik_Bjlk_BBS_BH_UserArgs_MT128x64x128_MI16x16x1_SN_LDSB1_CLR1_GSU0_GSUC0_GSUWGMRR0_K1_LBSPPA512_LBSPPB1024_LPB32_MIWT4_2_PLR2_SU32_SUM0_SUS256_SKXCCM8_VWA2_VWB2_WGM8_WGMXCC1_WGMXCCGn1
    SolutionIndex: 129
    SolutionNameMin: Cijk_Alik_Bjlk_BBS_BH_UserArgs_MT128x64x128_MI16x16x1_SN_LDSB1_CLR1_GSU0_GSUC0_GSUWGMRR0_K1_LBSPPA1024_LBSPPB1024_LPB32_MIWT4_2_PLR2_SU32_SUM0_SUS256_SKXCCM8_VWA4_VWB2_WGM8_WGMXCC1_WGMXCCGn1
    SolutionIndex: 130
    SolutionNameMin: Cijk_Alik_Bjlk_BBS_BH_UserArgs_MT64x64x128_MI16x16x1_SN_LDSB1_CLR1_GSU0_GSUC0_GSUWGMRR0_K1_LBSPPA512_LBSPPB1024_LPB32_MIWT2_2_PLR1_SU32_SUM0_SUS256_SKXCCM8_VWA2_VWB2_WGM1_WGMXCC1_WGMXCCGn1
    SolutionIndex: 131
    SolutionNameMin: Cijk_Alik_Bjlk_BBS_BH_UserArgs_MT64x64x128_MI16x16x1_SN_LDSB1_CLR1_GSU0_GSUC0_GSUWGMRR0_K1_LBSPPA512_LBSPPB1024_LPB32_MIWT2_2_PLR2_SU32_SUM0_SUS256_SKXCCM8_VWA2_VWB2_WGM1_WGMXCC1_WGMXCCGn1
    SolutionIndex: 132
    SolutionNameMin: Cijk_Alik_Bjlk_BBS_BH_UserArgs_MT64x64x128_MI16x16x1_SN_LDSB1_CLR1_GSU0_GSUC0_GSUWGMRR0_K1_LBSPPA256_LBSPPB1024_LPB32_MIWT2_2_PLR2_SU32_SUM0_SUS256_SKXCCM8_VWA1_VWB2_WGM4_WGMXCC1_WGMXCCGn1
    SolutionIndex: 133
    SolutionNameMin: Cijk_Alik_Bjlk_BBS_BH_UserArgs_MT64x64x128_MI16x16x1_SN_LDSB1_CLR1_GSU0_GSUC0_GSUWGMRR0_K1_LBSPPA512_LBSPPB1024_LPB32_MIWT2_2_PLR2_SU32_SUM0_SUS256_SKXCCM8_VWA2_VWB2_WGM4_WGMXCC1_WGMXCCGn1
    SolutionIndex: 134
    SolutionNameMin: Cijk_Alik_Bjlk_BBS_BH_UserArgs_MT64x64x128_MI16x16x1_SN_LDSB1_CLR1_GSU0_GSUC0_GSUWGMRR0_K1_LBSPPA512_LBSPPB1024_LPB32_MIWT2_2_PLR2_SU32_SUM0_SUS256_SKXCCM8_VWA2_VWB2_WGM8_WGMXCC1_WGMXCCGn1
    SolutionIndex: 135
    SolutionNameMin: Cijk_Alik_Bjlk_BBS_BH_UserArgs_MT32x64x128_MI16x16x1_SN_LDSB1_CLR1_GSU0_GSUC0_GSUWGMRR0_K1_LBSPPA256_LBSPPB1024_LPB32_MIWT1_2_PLR1_SU32_SUM0_SUS256_SKXCCM8_VWA1_VWB2_WGM1_WGMXCC1_WGMXCCGn1
    SolutionIndex: 136
    SolutionNameMin: Cijk_Alik_Bjlk_BBS_BH_UserArgs_MT32x64x128_MI16x16x1_SN_LDSB1_CLR1_GSU0_GSUC0_GSUWGMRR0_K1_LBSPPA256_LBSPPB1024_LPB32_MIWT1_2_PLR2_SU32_SUM0_SUS256_SKXCCM8_VWA1_VWB2_WGM1_WGMXCC1_WGMXCCGn1
    SolutionIndex: 137
    SolutionNameMin: Cijk_Alik_Bjlk_BBS_BH_UserArgs_MT32x64x128_MI16x16x1_SN_LDSB1_CLR1_GSU0_GSUC0_GSUWGMRR0_K1_LBSPPA256_LBSPPB1024_LPB32_MIWT1_2_PLR2_SU32_SUM0_SUS256_SKXCCM8_VWA1_VWB2_WGM4_WGMXCC1_WGMXCCGn1
    SolutionIndex: 138
    SolutionNameMin: Cijk_Alik_Bjlk_BBS_BH_UserArgs_MT32x64x128_MI16x16x1_SN_LDSB1_CLR1_GSU0_GSUC0_GSUWGMRR0_K1_LBSPPA256_LBSPPB1024_LPB32_MIWT1_2_PLR2_SU32_SUM0_SUS256_SKXCCM8_VWA1_VWB2_WGM8_WGMXCC1_WGMXCCGn1
    SolutionIndex: 139
    SolutionNameMin: Cijk_Alik_Bjlk_BBS_BH_UserArgs_MT32x32x128_MI16x16x1_SN_LDSB1_CLR1_GSU0_GSUC0_GSUWGMRR0_K1_LBSPPA256_LBSPPB512_LPB16_MIWT1_1_PLR1_SU32_SUM0_SUS256_SKXCCM8_VWA1_VWB1_WGM1_WGMXCC1_WGMXCCGn1
    SolutionIndex: 140
    SolutionNameMin: Cijk_Alik_Bjlk_BBS_BH_UserArgs_MT32x32x128_MI16x16x1_SN_LDSB1_CLR1_GSU0_GSUC0_GSUWGMRR0_K1_LBSPPA256_LBSPPB512_LPB16_MIWT1_1_PLR2_SU32_SUM0_SUS256_SKXCCM8_VWA1_VWB1_WGM1_WGMXCC1_WGMXCCGn1
    SolutionIndex: 141
    SolutionNameMin: Cijk_Alik_Bjlk_BBS_BH_UserArgs_MT32x32x128_MI16x16x1_SN_LDSB1_CLR1_GSU0_GSUC0_GSUWGMRR0_K1_LBSPPA256_LBSPPB512_LPB16_MIWT1_1_PLR2_SU32_SUM0_SUS256_SKXCCM8_VWA1_VWB1_WGM4_WGMXCC1_WGMXCCGn1
    SolutionIndex: 142
    SolutionNameMin: Cijk_Alik_Bjlk_BBS_BH_UserArgs_MT32x32x128_MI16x16x1_SN_LDSB1_CLR1_GSU0_GSUC0_GSUWGMRR0_K1_LBSPPA256_LBSPPB512_LPB16_MIWT1_1_PLR2_SU32_SUM0_SUS256_SKXCCM8_VWA1_VWB1_WGM8_WGMXCC1_WGMXCCGn1
    SolutionIndex: 143
    SolutionNameMin: Cijk_Alik_Bjlk_BBS_BH_UserArgs_MT32x32x32_MI16x16x1_SN_LDSB0_CLR1_GSU0_GSUC0_GSUWGMRR0_K1_LBSPPA128_LBSPPB256_LPB16_MIWT1_1_PLR1_SU32_SUM0_SUS256_SKXCCM8_VWA1_VWB1_WGM1_WGMXCC1_WGMXCCGn1
- - - [128, 128, 1, 128, 128, 128, 128, 128]
    - [42, 0.08]
  - - [128, 128, 1, 256, 128, 128, 256, 128]
    - [40, 0.145]
  - - [128, 128, 1, 512, 128, 128, 512, 128]
    - [139, 0.251]
  - - [128, 128, 1, 1024, 128, 128, 1024, 128]
    - [140, 0.382]
  - - [128, 128, 1, 2048, 128, 128, 2048, 128]
    - [86, 0.58]
  - - [128, 128, 1, 4096, 128, 128, 4096, 128]
    - [121, 1.022]
  - - [128, 128, 1, 8192, 128, 128, 8192, 128]
    - [140, 1.565]
  - - [128, 256, 1, 128, 128, 128, 128, 256]
    - [122, 0.161]
  - - [128, 256, 1, 256, 128, 128, 256, 256]
    - [139, 0.295]
  - - [128, 256, 1, 512, 128, 128, 512, 256]
    - [121, 0.506]
  - - [128, 256, 1, 1024, 128, 128, 1024, 256]
    - [62, 0.774]
  - - [128, 256, 1, 2048, 128, 128, 2048, 256]
    - [85, 1.133]
  - - [128, 256, 1, 4096, 128, 128, 4096, 256]
    - [121, 1.948]
  - - [128, 256, 1, 8192, 128, 128, 8192, 256]
    - [62, 3.055]
  - - [128, 512, 1, 128, 128, 128, 128, 512]
    - [40, 0.331]
  - - [128, 512, 1, 256, 128, 128, 256, 512]
    - [62, 0.589]
  - - [128, 512, 1, 512, 128, 128, 512, 512]
    - [139, 1.001]
  - - [128, 512, 1, 1024, 128, 128, 1024, 512]
    - [62, 1.534]
  - - [128, 512, 1, 2048, 128, 128, 2048, 512]
    - [140, 2.233]
  - - [128, 512, 1, 4096, 128, 128, 4096, 512]
    - [121, 3.735]
  - - [128, 512, 1, 8192, 128, 128, 8192, 512]
    - [62, 5.573]
  - - [128, 1024, 1, 128, 128, 128, 128, 1024]
    - [140, 0.63]
  - - [128, 1024, 1, 256, 128, 128, 256, 1024]
    - [61, 1.185]
  - - [128, 1024, 1, 512, 128, 128, 512, 1024]
    - [61, 2.017]
  - - [128, 1024, 1, 1024, 128, 128, 1024, 1024]
    - [61, 3.068]
  - - [128, 1024, 1, 2048, 128, 128, 2048, 1024]
    - [63, 4.201]
  - - [128, 1024, 1, 4096, 128, 128, 4096, 1024]
    - [65, 6.292]
  - - [128, 1024, 1, 8192, 128, 128, 8192, 1024]
    - [58, 8.898]
  - - [128, 2048, 1, 128, 128, 128, 128, 2048]
    - [11, 1.253]
  - - [128, 2048, 1, 256, 128, 128, 256, 2048]
    - [40, 2.277]
  - - [128, 2048, 1, 512, 128, 128, 512, 2048]
    - [140, 3.845]
  - - [128, 2048, 1, 1024, 128, 128, 1024, 2048]
    - [140, 5.667]
  - - [128, 2048, 1, 2048, 128, 128, 2048, 2048]
    - [57, 7.199]
  - - [128, 2048, 1, 4096, 128, 128, 4096, 2048]
    - [37, 9.981]
  - - [128, 2048, 1, 8192, 128, 128, 8192, 2048]
    - [53, 13.496]
  - - [128, 4096, 1, 128, 128, 128, 128, 4096]
    - [39, 2.35]
  - - [128, 4096, 1, 256, 128, 128, 256, 4096]
    - [38, 4.188]
  - - [128, 4096, 1, 512, 128, 128, 512, 4096]
    - [56, 6.865]
  - - [128, 4096, 1, 1024, 128, 128, 1024, 4096]
    - [135, 9.935]
  - - [128, 4096, 1, 2048, 128, 128, 2048, 4096]
    - [131, 10.787]
  - - [128, 4096, 1, 4096, 128, 128, 4096, 4096]
    - [34, 14.067]
  - - [128, 4096, 1, 8192, 128, 128, 8192, 4096]
    - [127, 17.862]
  - - [128, 8192, 1, 128, 128, 128, 128, 8192]
    - [116, 4.134]
  - - [128, 8192, 1, 256, 128, 128, 256, 8192]
    - [37, 7.133]
  - - [128, 8192, 1, 512, 128, 128, 512, 8192]
    - [118, 11.05]
  - - [128, 8192, 1, 1024, 128, 128, 1024, 8192]
    - [131, 14.835]
  - - [128, 8192, 1, 2048, 128, 128, 2048, 8192]
    - [133, 15.943]
  - - [128, 8192, 1, 4096, 128, 128, 4096, 8192]
    - [44, 18.463]
  - - [128, 8192, 1, 8192, 128, 128, 8192, 8192]
    - [32, 21.205]
  - - [256, 128, 1, 128, 256, 256, 128, 128]
    - [61, 0.165]
  - - [256, 128, 1, 256, 256, 256, 256, 128]
    - [61, 0.3]
  - - [256, 128, 1, 512, 256, 256, 512, 128]
    - [61, 0.504]
  - - [256, 128, 1, 1024, 256, 256, 1024, 128]
    - [64, 0.762]
  - - [256, 128, 1, 2048, 256, 256, 2048, 128]
    - [140, 1.147]
  - - [256, 128, 1, 4096, 256, 256, 4096, 128]
    - [121, 2.008]
  - - [256, 128, 1, 8192, 256, 256, 8192, 128]
    - [140, 3.067]
  - - [256, 256, 1, 128, 256, 256, 128, 256]
    - [121, 0.328]
  - - [256, 256, 1, 256, 256, 256, 256, 256]
    - [40, 0.593]
  - - [256, 256, 1, 512, 256, 256, 512, 256]
    - [139, 0.999]
  - - [256, 256, 1, 1024, 256, 256, 1024, 256]
    - [61, 1.48]
  - - [256, 256, 1, 2048, 256, 256, 2048, 256]
    - [140, 2.191]
  - - [256, 256, 1, 4096, 256, 256, 4096, 256]
    - [121, 3.853]
  - - [256, 256, 1, 8192, 256, 256, 8192, 256]
    - [62, 5.569]
  - - [256, 512, 1, 128, 256, 256, 128, 512]
    - [62, 0.642]
  - - [256, 512, 1, 256, 256, 256, 256, 512]
    - [139, 1.18]
  - - [256, 512, 1, 512, 256, 256, 512, 512]
    - [139, 1.984]
  - - [256, 512, 1, 1024, 256, 256, 1024, 512]
    - [140, 3.037]
  - - [256, 512, 1, 2048, 256, 256, 2048, 512]
    - [140, 4.259]
  - - [256, 512, 1, 4096, 256, 256, 4096, 512]
    - [119, 6.288]
  - - [256, 512, 1, 8192, 256, 256, 8192, 512]
    - [60, 9.434]
  - - [256, 1024, 1, 128, 256, 256, 128, 1024]
    - [40, 1.25]
  - - [256, 1024, 1, 256, 256, 256, 256, 1024]
    - [140, 2.217]
  - - [256, 1024, 1, 512, 256, 256, 512, 1024]
    - [62, 3.845]
  - - [256, 1024, 1, 1024, 256, 256, 1024, 1024]
    - [62, 5.732]
  - - [256, 1024, 1, 2048, 256, 256, 2048, 1024]
    - [64, 7.81]
  - - [256, 1024, 1, 4096, 256, 256, 4096, 1024]
    - [58, 9.992]
  - - [256, 1024, 1, 8192, 256, 256, 8192, 1024]
    - [53, 14.514]
  - - [256, 2048, 1, 128, 256, 256, 128, 2048]
    - [38, 2.321]
  - - [256, 2048, 1, 256, 256, 256, 256, 2048]
    - [38, 4.085]
  - - [256, 2048, 1, 512, 256, 256, 512, 2048]
    - [56, 6.822]
  - - [256, 2048, 1, 1024, 256, 256, 1024, 2048]
    - [58, 9.848]
  - - [256, 2048, 1, 2048, 256, 256, 2048, 2048]
    - [52, 11.394]
  - - [256, 2048, 1, 4096, 256, 256, 4096, 2048]
    - [36, 14.513]
  - - [256, 2048, 1, 8192, 256, 256, 8192, 2048]
    - [125, 18.376]
  - - [256, 4096, 1, 128, 256, 256, 128, 4096]
    - [84, 4.049]
  - - [256, 4096, 1, 256, 256, 256, 256, 4096]
    - [131, 7.103]
  - - [256, 4096, 1, 512, 256, 256, 512, 4096]
    - [116, 10.852]
  - - [256, 4096, 1, 1024, 256, 256, 1024, 4096]
    - [131, 15.003]
  - - [256, 4096, 1, 2048, 256, 256, 2048, 4096]
    - [131, 16.524]
  - - [256, 4096, 1, 4096, 256, 256, 4096, 4096]
    - [47, 19.517]
  - - [256, 4096, 1, 8192, 256, 256, 8192, 4096]
    - [107, 21.558]
  - - [256, 8192, 1, 128, 256, 256, 128, 8192]
    - [112, 6.588]
  - - [256, 8192, 1, 256, 256, 256, 256, 8192]
    - [113, 10.769]
  - - [256, 8192, 1, 512, 256, 256, 512, 8192]
    - [112, 15.399]
  - - [256, 8192, 1, 1024, 256, 256, 1024, 8192]
    - [125, 19.852]
  - - [256, 8192, 1, 2048, 256, 256, 2048, 8192]
    - [123, 21.293]
  - - [256, 8192, 1, 4096, 256, 256, 4096, 8192]
    - [126, 23.517]
  - - [256, 8192, 1, 8192, 256, 256, 8192, 8192]
    - [32, 25.662]
  - - [512, 128, 1, 128, 512, 512, 128, 128]
    - [121, 0.326]
  - - [512, 128, 1, 256, 512, 512, 256, 128]
    - [121, 0.591]
  - - [512, 128, 1, 512, 512, 512, 512, 128]
    - [140, 1.003]
  - - [512, 128, 1, 1024, 512, 512, 1024, 128]
    - [61, 1.503]
  - - [512, 128, 1, 2048, 512, 512, 2048, 128]
    - [62, 2.201]
  - - [512, 128, 1, 4096, 512, 512, 4096, 128]
    - [121, 3.833]
  - - [512, 128, 1, 8192, 512, 512, 8192, 128]
    - [141, 5.877]
  - - [512, 256, 1, 128, 512, 512, 128, 256]
    - [40, 0.635]
  - - [512, 256, 1, 256, 512, 512, 256, 256]
    - [139, 1.162]
  - - [512, 256, 1, 512, 512, 512, 512, 256]
    - [139, 1.957]
  - - [512, 256, 1, 1024, 512, 512, 1024, 256]
    - [62, 3.013]
  - - [512, 256, 1, 2048, 512, 512, 2048, 256]
    - [140, 4.237]
  - - [512, 256, 1, 4096, 512, 512, 4096, 256]
    - [119, 6.377]
  - - [512, 256, 1, 8192, 512, 512, 8192, 256]
    - [60, 9.384]
  - - [512, 512, 1, 128, 512, 512, 128, 512]
    - [139, 1.221]
  - - [512, 512, 1, 256, 512, 512, 256, 512]
    - [61, 2.263]
  - - [512, 512, 1, 512, 512, 512, 512, 512]
    - [139, 3.791]
  - - [512, 512, 1, 1024, 512, 512, 1024, 512]
    - [62, 5.843]
  - - [512, 512, 1, 2048, 512, 512, 2048, 512]
    - [140, 7.767]
  - - [512, 512, 1, 4096, 512, 512, 4096, 512]
    - [56, 10.102]
  - - [512, 512, 1, 8192, 512, 512, 8192, 512]
    - [54, 14.423]
  - - [512, 1024, 1, 128, 512, 512, 128, 1024]
    - [136, 2.257]
  - - [512, 1024, 1, 256, 512, 512, 256, 1024]
    - [39, 4.07]
  - - [512, 1024, 1, 512, 512, 512, 512, 1024]
    - [136, 6.768]
  - - [512, 1024, 1, 1024, 512, 512, 1024, 1024]
    - [136, 9.898]
  - - [512, 1024, 1, 2048, 512, 512, 2048, 1024]
    - [51, 11.501]
  - - [512, 1024, 1, 4096, 512, 512, 4096, 1024]
    - [53, 15.108]
  - - [512, 1024, 1, 8192, 512, 512, 8192, 1024]
    - [47, 19.324]
  - - [512, 2048, 1, 128, 512, 512, 128, 2048]
    - [10, 4.011]
  - - [512, 2048, 1, 256, 512, 512, 256, 2048]
    - [37, 7.125]
  - - [512, 2048, 1, 512, 512, 512, 512, 2048]
    - [116, 11.076]
  - - [512, 2048, 1, 1024, 512, 512, 1024, 2048]
    - [131, 14.843]
  - - [512, 2048, 1, 2048, 512, 512, 2048, 2048]
    - [131, 16.602]
  - - [512, 2048, 1, 4096, 512, 512, 4096, 2048]
    - [47, 19.752]
  - - [512, 2048, 1, 8192, 512, 512, 8192, 2048]
    - [107, 21.556]
  - - [512, 4096, 1, 128, 512, 512, 128, 4096]
    - [82, 6.57]
  - - [512, 4096, 1, 256, 512, 512, 256, 4096]
    - [113, 10.815]
  - - [512, 4096, 1, 512, 512, 512, 512, 4096]
    - [125, 15.427]
  - - [512, 4096, 1, 1024, 512, 512, 1024, 4096]
    - [124, 20.071]
  - - [512, 4096, 1, 2048, 512, 512, 2048, 4096]
    - [48, 21.649]
  - - [512, 4096, 1, 4096, 512, 512, 4096, 4096]
    - [49, 24.15]
  - - [512, 4096, 1, 8192, 512, 512, 8192, 4096]
    - [93, 25.16]
  - - [512, 8192, 1, 128, 512, 512, 128, 8192]
    - [105, 9.303]
  - - [512, 8192, 1, 256, 512, 512, 256, 8192]
    - [103, 14.415]
  - - [512, 8192, 1, 512, 512, 512, 512, 8192]
    - [103, 20.631]
  - - [512, 8192, 1, 1024, 512, 512, 1024, 8192]
    - [103, 24.698]
  - - [512, 8192, 1, 2048, 512, 512, 2048, 8192]
    - [33, 27.983]
  - - [512, 8192, 1, 4096, 512, 512, 4096, 8192]
    - [17, 26.286]
  - - [512, 8192, 1, 8192, 512, 512, 8192, 8192]
    - [21, 29.28]
  - - [1024, 128, 1, 128, 1024, 1024, 128, 128]
    - [121, 0.649]
  - - [1024, 128, 1, 256, 1024, 1024, 256, 128]
    - [121, 1.178]
  - - [1024, 128, 1, 512, 1024, 1024, 512, 128]
    - [61, 1.995]
  - - [1024, 128, 1, 1024, 1024, 1024, 1024, 128]
    - [140, 3.019]
  - - [1024, 128, 1, 2048, 1024, 1024, 2048, 128]
    - [139, 4.178]
  - - [1024, 128, 1, 4096, 1024, 1024, 4096, 128]
    - [119, 6.372]
  - - [1024, 128, 1, 8192, 1024, 1024, 8192, 128]
    - [57, 9.285]
  - - [1024, 256, 1, 128, 1024, 1024, 128, 256]
    - [41, 1.24]
  - - [1024, 256, 1, 256, 1024, 1024, 256, 256]
    - [40, 2.293]
  - - [1024, 256, 1, 512, 1024, 1024, 512, 256]
    - [61, 3.89]
  - - [1024, 256, 1, 1024, 1024, 1024, 1024, 256]
    - [61, 5.923]
  - - [1024, 256, 1, 2048, 1024, 1024, 2048, 256]
    - [62, 7.971]
  - - [1024, 256, 1, 4096, 1024, 1024, 4096, 256]
    - [56, 10.186]
  - - [1024, 256, 1, 8192, 1024, 1024, 8192, 256]
    - [50, 13.729]
  - - [1024, 512, 1, 128, 1024, 1024, 128, 512]
    - [39, 2.365]
  - - [1024, 512, 1, 256, 1024, 1024, 256, 512]
    - [136, 4.167]
  - - [1024, 512, 1, 512, 1024, 1024, 512, 512]
    - [56, 6.974]
  - - [1024, 512, 1, 1024, 1024, 1024, 1024, 512]
    - [56, 10.097]
  - - [1024, 512, 1, 2048, 1024, 1024, 2048, 512]
    - [56, 12.091]
  - - [1024, 512, 1, 4096, 1024, 1024, 4096, 512]
    - [51, 15.512]
  - - [1024, 512, 1, 8192, 1024, 1024, 8192, 512]
    - [49, 18.845]
  - - [1024, 1024, 1, 128, 1024, 1024, 128, 1024]
    - [10, 4.194]
  - - [1024, 1024, 1, 256, 1024, 1024, 256, 1024]
    - [37, 7.295]
  - - [1024, 1024, 1, 512, 1024, 1024, 512, 1024]
    - [116, 11.265]
  - - [1024, 1024, 1, 1024, 1024, 1024, 1024, 1024]
    - [54, 14.712]
  - - [1024, 1024, 1, 2048, 1024, 1024, 2048, 1024]
    - [52, 17.1]
  - - [1024, 1024, 1, 4096, 1024, 1024, 4096, 1024]
    - [46, 19.805]
  - - [1024, 1024, 1, 8192, 1024, 1024, 8192, 1024]
    - [107, 21.576]
  - - [1024, 2048, 1, 128, 1024, 1024, 128, 2048]
    - [81, 6.531]
  - - [1024, 2048, 1, 256, 1024, 1024, 256, 2048]
    - [112, 10.918]
  - - [1024, 2048, 1, 512, 1024, 1024, 512, 2048]
    - [125, 15.586]
  - - [1024, 2048, 1, 1024, 1024, 1024, 1024, 2048]
    - [128, 19.698]
  - - [1024, 2048, 1, 2048, 1024, 1024, 2048, 2048]
    - [46, 21.968]
  - - [1024, 2048, 1, 4096, 1024, 1024, 4096, 2048]
    - [43, 24.077]
  - - [1024, 2048, 1, 8192, 1024, 1024, 8192, 2048]
    - [100, 25.001]
  - - [1024, 4096, 1, 128, 1024, 1024, 128, 4096]
    - [102, 9.377]
  - - [1024, 4096, 1, 256, 1024, 1024, 256, 4096]
    - [103, 14.796]
  - - [1024, 4096, 1, 512, 1024, 1024, 512, 4096]
    - [104, 20.771]
  - - [1024, 4096, 1, 1024, 1024, 1024, 1024, 4096]
    - [103, 24.501]
  - - [1024, 4096, 1, 2048, 1024, 1024, 2048, 4096]
    - [31, 27.662]
  - - [1024, 4096, 1, 4096, 1024, 1024, 4096, 4096]
    - [110, 26.458]
  - - [1024, 4096, 1, 8192, 1024, 1024, 8192, 4096]
    - [96, 28.326]
  - - [1024, 8192, 1, 128, 1024, 1024, 128, 8192]
    - [79, 12.136]
  - - [1024, 8192, 1, 256, 1024, 1024, 256, 8192]
    - [79, 17.291]
  - - [1024, 8192, 1, 512, 1024, 1024, 512, 8192]
    - [97, 22.734]
  - - [1024, 8192, 1, 1024, 1024, 1024, 1024, 8192]
    - [26, 27.455]
  - - [1024, 8192, 1, 2048, 1024, 1024, 2048, 8192]
    - [27, 32.671]
  - - [1024, 8192, 1, 4096, 1024, 1024, 4096, 8192]
    - [22, 28.959]
  - - [1024, 8192, 1, 8192, 1024, 1024, 8192, 8192]
    - [66, 31.314]
  - - [2048, 128, 1, 128, 2048, 2048, 128, 128]
    - [40, 1.286]
  - - [2048, 128, 1, 256, 2048, 2048, 256, 128]
    - [121, 2.315]
  - - [2048, 128, 1, 512, 2048, 2048, 512, 128]
    - [61, 3.888]
  - - [2048, 128, 1, 1024, 2048, 2048, 1024, 128]
    - [61, 5.936]
  - - [2048, 128, 1, 2048, 2048, 2048, 2048, 128]
    - [142, 7.858]
  - - [2048, 128, 1, 4096, 2048, 2048, 4096, 128]
    - [56, 10.193]
  - - [2048, 128, 1, 8192, 2048, 2048, 8192, 128]
    - [132, 13.339]
  - - [2048, 256, 1, 128, 2048, 2048, 128, 256]
    - [38, 2.383]
  - - [2048, 256, 1, 256, 2048, 2048, 256, 256]
    - [38, 4.241]
  - - [2048, 256, 1, 512, 2048, 2048, 512, 256]
    - [56, 6.936]
  - - [2048, 256, 1, 1024, 2048, 2048, 1024, 256]
    - [55, 10.002]
  - - [2048, 256, 1, 2048, 2048, 2048, 2048, 256]
    - [138, 11.952]
  - - [2048, 256, 1, 4096, 2048, 2048, 4096, 256]
    - [51, 14.719]
  - - [2048, 256, 1, 8192, 2048, 2048, 8192, 256]
    - [45, 18.541]
  - - [2048, 512, 1, 128, 2048, 2048, 128, 512]
    - [51, 4.173]
  - - [2048, 512, 1, 256, 2048, 2048, 256, 512]
    - [116, 7.064]
  - - [2048, 512, 1, 512, 2048, 2048, 512, 512]
    - [116, 11.329]
  - - [2048, 512, 1, 1024, 2048, 2048, 1024, 512]
    - [51, 15.085]
  - - [2048, 512, 1, 2048, 2048, 2048, 2048, 512]
    - [134, 17.257]
  - - [2048, 512, 1, 4096, 2048, 2048, 4096, 512]
    - [45, 19.899]
  - - [2048, 512, 1, 8192, 2048, 2048, 8192, 512]
    - [107, 21.239]
  - - [2048, 1024, 1, 128, 2048, 2048, 128, 1024]
    - [112, 6.631]
  - - [2048, 1024, 1, 256, 2048, 2048, 256, 1024]
    - [35, 10.786]
  - - [2048, 1024, 1, 512, 2048, 2048, 512, 1024]
    - [112, 15.473]
  - - [2048, 1024, 1, 1024, 2048, 2048, 1024, 1024]
    - [47, 19.728]
  - - [2048, 1024, 1, 2048, 2048, 2048, 2048, 1024]
    - [129, 21.444]
  - - [2048, 1024, 1, 4096, 2048, 2048, 4096, 1024]
    - [128, 23.719]
  - - [2048, 1024, 1, 8192, 2048, 2048, 8192, 1024]
    - [110, 24.867]
  - - [2048, 2048, 1, 128, 2048, 2048, 128, 2048]
    - [28, 9.211]
  - - [2048, 2048, 1, 256, 2048, 2048, 256, 2048]
    - [33, 14.522]
  - - [2048, 2048, 1, 512, 2048, 2048, 512, 2048]
    - [106, 20.476]
  - - [2048, 2048, 1, 1024, 2048, 2048, 1024, 2048]
    - [106, 24.38]
  - - [2048, 2048, 1, 2048, 2048, 2048, 2048, 2048]
    - [108, 26.949]
  - - [2048, 2048, 1, 4096, 2048, 2048, 4096, 2048]
    - [98, 25.85]
  - - [2048, 2048, 1, 8192, 2048, 2048, 8192, 2048]
    - [95, 27.671]
  - - [2048, 4096, 1, 128, 2048, 2048, 128, 4096]
    - [78, 11.879]
  - - [2048, 4096, 1, 256, 2048, 2048, 256, 4096]
    - [7, 16.995]
  - - [2048, 4096, 1, 512, 2048, 2048, 512, 4096]
    - [101, 22.679]
  - - [2048, 4096, 1, 1024, 2048, 2048, 1024, 4096]
    - [23, 27.21]
  - - [2048, 4096, 1, 2048, 2048, 2048, 2048, 4096]
    - [24, 32.964]
  - - [2048, 4096, 1, 4096, 2048, 2048, 4096, 4096]
    - [70, 28.548]
  - - [2048, 4096, 1, 8192, 2048, 2048, 8192, 4096]
    - [68, 31.962]
  - - [2048, 8192, 1, 128, 2048, 2048, 128, 8192]
    - [3, 11.886]
  - - [2048, 8192, 1, 256, 2048, 2048, 256, 8192]
    - [69, 18.288]
  - - [2048, 8192, 1, 512, 2048, 2048, 512, 8192]
    - [73, 24.813]
  - - [2048, 8192, 1, 1024, 2048, 2048, 1024, 8192]
    - [6, 31.65]
  - - [2048, 8192, 1, 2048, 2048, 2048, 2048, 8192]
    - [89, 28.28]
  - - [2048, 8192, 1, 4096, 2048, 2048, 4096, 8192]
    - [68, 31.509]
  - - [2048, 8192, 1, 8192, 2048, 2048, 8192, 8192]
    - [67, 33.502]
  - - [4096, 128, 1, 128, 4096, 4096, 128, 128]
    - [119, 2.343]
  - - [4096, 128, 1, 256, 4096, 4096, 256, 128]
    - [120, 4.176]
  - - [4096, 128, 1, 512, 4096, 4096, 512, 128]
    - [136, 6.944]
  - - [4096, 128, 1, 1024, 4096, 4096, 1024, 128]
    - [59, 9.805]
  - - [4096, 128, 1, 2048, 4096, 4096, 2048, 128]
    - [137, 11.953]
  - - [4096, 128, 1, 4096, 4096, 4096, 4096, 128]
    - [50, 14.401]
  - - [4096, 128, 1, 8192, 4096, 4096, 8192, 128]
    - [127, 17.623]
  - - [4096, 256, 1, 128, 4096, 4096, 128, 256]
    - [37, 4.166]
  - - [4096, 256, 1, 256, 4096, 4096, 256, 256]
    - [37, 7.189]
  - - [4096, 256, 1, 512, 4096, 4096, 512, 256]
    - [130, 10.982]
  - - [4096, 256, 1, 1024, 4096, 4096, 1024, 256]
    - [133, 14.644]
  - - [4096, 256, 1, 2048, 4096, 4096, 2048, 256]
    - [134, 17.34]
  - - [4096, 256, 1, 4096, 4096, 4096, 4096, 256]
    - [127, 19.056]
  - - [4096, 256, 1, 8192, 4096, 4096, 8192, 256]
    - [107, 21.259]
  - - [4096, 512, 1, 128, 4096, 4096, 128, 512]
    - [83, 6.513]
  - - [4096, 512, 1, 256, 4096, 4096, 256, 512]
    - [113, 10.983]
  - - [4096, 512, 1, 512, 4096, 4096, 512, 512]
    - [111, 15.428]
  - - [4096, 512, 1, 1024, 4096, 4096, 1024, 512]
    - [128, 19.928]
  - - [4096, 512, 1, 2048, 4096, 4096, 2048, 512]
    - [45, 22.71]
  - - [4096, 512, 1, 4096, 4096, 4096, 4096, 512]
    - [45, 24.262]
  - - [4096, 512, 1, 8192, 4096, 4096, 8192, 512]
    - [77, 25.067]
  - - [4096, 1024, 1, 128, 4096, 4096, 128, 1024]
    - [105, 9.208]
  - - [4096, 1024, 1, 256, 4096, 4096, 256, 1024]
    - [106, 14.432]
  - - [4096, 1024, 1, 512, 4096, 4096, 512, 1024]
    - [106, 20.4]
  - - [4096, 1024, 1, 1024, 4096, 4096, 1024, 1024]
    - [106, 24.312]
  - - [4096, 1024, 1, 2048, 4096, 4096, 2048, 1024]
    - [107, 27.545]
  - - [4096, 1024, 1, 4096, 4096, 4096, 4096, 1024]
    - [109, 25.613]
  - - [4096, 1024, 1, 8192, 4096, 4096, 8192, 1024]
    - [90, 27.821]
  - - [4096, 2048, 1, 128, 4096, 4096, 128, 2048]
    - [80, 11.851]
  - - [4096, 2048, 1, 256, 4096, 4096, 256, 2048]
    - [80, 16.976]
  - - [4096, 2048, 1, 512, 4096, 4096, 512, 2048]
    - [20, 22.913]
  - - [4096, 2048, 1, 1024, 4096, 4096, 1024, 2048]
    - [25, 27.721]
  - - [4096, 2048, 1, 2048, 4096, 4096, 2048, 2048]
    - [18, 32.431]
  - - [4096, 2048, 1, 4096, 4096, 4096, 4096, 2048]
    - [94, 28.193]
  - - [4096, 2048, 1, 8192, 4096, 4096, 8192, 2048]
    - [73, 31.775]
  - - [4096, 4096, 1, 128, 4096, 4096, 128, 4096]
    - [71, 12.042]
  - - [4096, 4096, 1, 256, 4096, 4096, 256, 4096]
    - [5, 18.338]
  - - [4096, 4096, 1, 512, 4096, 4096, 512, 4096]
    - [5, 25.273]
  - - [4096, 4096, 1, 1024, 4096, 4096, 1024, 4096]
    - [4, 32.149]
  - - [4096, 4096, 1, 2048, 4096, 4096, 2048, 4096]
    - [87, 28.147]
  - - [4096, 4096, 1, 4096, 4096, 4096, 4096, 4096]
    - [67, 31.783]
  - - [4096, 4096, 1, 8192, 4096, 4096, 8192, 4096]
    - [68, 34.807]
  - - [4096, 8192, 1, 128, 4096, 4096, 128, 8192]
    - [30, 11.533]
  - - [4096, 8192, 1, 256, 4096, 4096, 256, 8192]
    - [93, 16.647]
  - - [4096, 8192, 1, 512, 4096, 4096, 512, 8192]
    - [76, 21.284]
  - - [4096, 8192, 1, 1024, 4096, 4096, 1024, 8192]
    - [92, 26.392]
  - - [4096, 8192, 1, 2048, 4096, 4096, 2048, 8192]
    - [88, 30.921]
  - - [4096, 8192, 1, 4096, 4096, 4096, 4096, 8192]
    - [15, 33.28]
  - - [4096, 8192, 1, 8192, 4096, 4096, 8192, 8192]
    - [68, 36.862]
  - - [8192, 128, 1, 128, 8192, 8192, 128, 128]
    - [51, 4.088]
  - - [8192, 128, 1, 256, 8192, 8192, 256, 128]
    - [117, 6.867]
  - - [8192, 128, 1, 512, 8192, 8192, 512, 128]
    - [118, 10.825]
  - - [8192, 128, 1, 1024, 8192, 8192, 1024, 128]
    - [133, 14.731]
  - - [8192, 128, 1, 2048, 8192, 8192, 2048, 128]
    - [50, 16.459]
  - - [8192, 128, 1, 4096, 8192, 8192, 4096, 128]
    - [104, 18.673]
  - - [8192, 128, 1, 8192, 8192, 8192, 8192, 128]
    - [30, 21.371]
  - - [8192, 256, 1, 128, 8192, 8192, 128, 256]
    - [9, 6.467]
  - - [8192, 256, 1, 256, 8192, 8192, 256, 256]
    - [115, 10.772]
  - - [8192, 256, 1, 512, 8192, 8192, 512, 256]
    - [114, 15.207]
  - - [8192, 256, 1, 1024, 8192, 8192, 1024, 256]
    - [128, 19.704]
  - - [8192, 256, 1, 2048, 8192, 8192, 2048, 256]
    - [129, 20.648]
  - - [8192, 256, 1, 4096, 8192, 8192, 4096, 256]
    - [129, 23.645]
  - - [8192, 256, 1, 8192, 8192, 8192, 8192, 256]
    - [30, 26.034]
  - - [8192, 512, 1, 128, 8192, 8192, 128, 512]
    - [102, 9.212]
  - - [8192, 512, 1, 256, 8192, 8192, 256, 512]
    - [109, 14.483]
  - - [8192, 512, 1, 512, 8192, 8192, 512, 512]
    - [106, 20.421]
  - - [8192, 512, 1, 1024, 8192, 8192, 1024, 512]
    - [107, 24.615]
  - - [8192, 512, 1, 2048, 8192, 8192, 2048, 512]
    - [108, 27.235]
  - - [8192, 512, 1, 4096, 8192, 8192, 4096, 512]
    - [92, 26.629]
  - - [8192, 512, 1, 8192, 8192, 8192, 8192, 512]
    - [8, 28.815]
  - - [8192, 1024, 1, 128, 8192, 8192, 128, 1024]
    - [75, 11.265]
  - - [8192, 1024, 1, 256, 8192, 8192, 256, 1024]
    - [101, 16.825]
  - - [8192, 1024, 1, 512, 8192, 8192, 512, 1024]
    - [20, 22.881]
  - - [8192, 1024, 1, 1024, 8192, 8192, 1024, 1024]
    - [19, 28.597]
  - - [8192, 1024, 1, 2048, 8192, 8192, 2048, 1024]
    - [20, 34.03]
  - - [8192, 1024, 1, 4096, 8192, 8192, 4096, 1024]
    - [12, 28.208]
  - - [8192, 1024, 1, 8192, 8192, 8192, 8192, 1024]
    - [70, 32.046]
  - - [8192, 2048, 1, 128, 8192, 8192, 128, 2048]
    - [74, 12.121]
  - - [8192, 2048, 1, 256, 8192, 8192, 256, 2048]
    - [5, 18.374]
  - - [8192, 2048, 1, 512, 8192, 8192, 512, 2048]
    - [0, 25.081]
  - - [8192, 2048, 1, 1024, 8192, 8192, 1024, 2048]
    - [72, 31.937]
  - - [8192, 2048, 1, 2048, 8192, 8192, 2048, 2048]
    - [88, 28.247]
  - - [8192, 2048, 1, 4096, 8192, 8192, 4096, 2048]
    - [73, 31.011]
  - - [8192, 2048, 1, 8192, 8192, 8192, 8192, 2048]
    - [68, 34.206]
  - - [8192, 4096, 1, 128, 8192, 8192, 128, 4096]
    - [29, 11.449]
  - - [8192, 4096, 1, 256, 8192, 8192, 256, 4096]
    - [93, 16.826]
  - - [8192, 4096, 1, 512, 8192, 8192, 512, 4096]
    - [76, 22.167]
  - - [8192, 4096, 1, 1024, 8192, 8192, 1024, 4096]
    - [99, 26.65]
  - - [8192, 4096, 1, 2048, 8192, 8192, 2048, 4096]
    - [91, 31.165]
  - - [8192, 4096, 1, 4096, 8192, 8192, 4096, 4096]
    - [14, 34.219]
  - - [8192, 4096, 1, 8192, 8192, 8192, 8192, 4096]
    - [68, 36.907]
  - - [8192, 8192, 1, 128, 8192, 8192, 128, 8192]
    - [97, 12.323]
  - - [8192, 8192, 1, 256, 8192, 8192, 256, 8192]
    - [98, 15.817]
  - - [8192, 8192, 1, 512, 8192, 8192, 512, 8192]
    - [13, 21.797]
  - - [8192, 8192, 1, 1024, 8192, 8192, 1024, 8192]
    - [16, 27.919]
  - - [8192, 8192, 1, 2048, 8192, 8192, 2048, 8192]
    - [72, 34.012]
  - - [8192, 8192, 1, 4096, 8192, 8192, 4096, 8192]
    - [1, 37.146]
  - - [8192, 8192, 1, 8192, 8192, 8192, 8192, 8192]
    - [2, 37.836]
  - - [1, 1, 1, 32, 1, 1, 32, 1]
    - [143, 0.0]
- null
- null
- ExperimentalStreamK
- GridBased
