library/src/amd_detail/rocblaslt/src/Tensile/Logic/asm_full/aquavanjaram/gfx942_228cu/StreamK/aquavanjaram942_Cijk_Ailk_Bljk_HSS_BH_UserArgs.yaml
- {MinimumRequiredVersion: 4.33.0}
- aquavanjaram942
- {Architecture: gfx942, CUCount: 228}
- [Device 0049, Device 0050]
    SolutionIndex: 0
    SolutionNameMin: Cijk_Ailk_Bljk_HSS_BH_UserArgs_MT256x256x32_MI16x16x1_SN_LDSB1_CLR1_GSU0_GSUC0_GSUWGMRR0_K1_LBSPPA2048_LBSPPB128_LPA32_MIWT8_8_PLR1_SU32_SUM0_SUS256_SKXCCM0_VWA2_VWB1_WGM1_WGMXCC1_WGMXCCGn1
    SolutionIndex: 1
    SolutionNameMin: Cijk_Ailk_Bljk_HSS_BH_UserArgs_MT256x256x32_MI16x16x1_SN_LDSB1_CLR1_GSU0_GSUC0_GSUWGMRR0_K1_LBSPPA2048_LBSPPB128_LPA0_MIWT8_8_PLR1_SU32_SUM0_SUS256_SKXCCM0_VWA4_VWB1_WGM1_WGMXCC1_WGMXCCGn1
    SolutionIndex: 2
    SolutionNameMin: Cijk_Ailk_Bljk_HSS_BH_UserArgs_MT256x256x32_MI16x16x1_SN_LDSB1_CLR1_GSU0_GSUC0_GSUWGMRR0_K1_LBSPPA2048_LBSPPB128_LPA32_MIWT8_8_PLR1_SU32_SUM0_SUS256_SKXCCM0_VWA2_VWB2_WGM1_WGMXCC1_WGMXCCGn1
    SolutionIndex: 3
    SolutionNameMin: Cijk_Ailk_Bljk_HSS_BH_UserArgs_MT256x256x32_MI16x16x1_SN_LDSB1_CLR1_GSU0_GSUC0_GSUWGMRR0_K1_LBSPPA2048_LBSPPB128_LPA0_MIWT8_8_PLR1_SU32_SUM0_SUS256_SKXCCM0_VWA4_VWB2_WGM1_WGMXCC1_WGMXCCGn1
    SolutionIndex: 4
    SolutionNameMin: Cijk_Ailk_Bljk_HSS_BH_UserArgs_MT256x256x32_MI16x16x1_SN_LDSB1_CLR1_GSU0_GSUC0_GSUWGMRR0_K1_LBSPPA2048_LBSPPB256_LPA0_MIWT8_8_PLR1_SU32_SUM0_SUS256_SKXCCM0_VWA4_VWB4_WGM1_WGMXCC1_WGMXCCGn1
    SolutionIndex: 5
    SolutionNameMin: Cijk_Ailk_Bljk_HSS_BH_UserArgs_MT256x256x32_MI16x16x1_SN_LDSB1_CLR1_GSU0_GSUC0_GSUWGMRR0_K1_LBSPPA2048_LBSPPB512_LPA32_MIWT8_8_PLR1_SU32_SUM0_SUS256_SKXCCM0_VWA2_VWB8_WGM1_WGMXCC1_WGMXCCGn1
    SolutionIndex: 6
    SolutionNameMin: Cijk_Ailk_Bljk_HSS_BH_UserArgs_MT256x256x32_MI16x16x1_SN_LDSB1_CLR1_GSU0_GSUC0_GSUWGMRR0_K1_LBSPPA2048_LBSPPB512_LPA0_MIWT8_8_PLR1_SU32_SUM0_SUS256_SKXCCM0_VWA4_VWB8_WGM1_WGMXCC1_WGMXCCGn1
    SolutionIndex: 7
    SolutionNameMin: Cijk_Ailk_Bljk_HSS_BH_UserArgs_MT256x256x32_MI16x16x1_SN_LDSB1_CLR1_GSU0_GSUC0_GSUWGMRR0_K1_LBSPPA2048_LBSPPB128_LPA32_MIWT8_8_PLR1_SU32_SUM0_SUS256_SKXCCM0_VWA2_VWB2_WGM4_WGMXCC1_WGMXCCGn1
    SolutionIndex: 8
    SolutionNameMin: Cijk_Ailk_Bljk_HSS_BH_UserArgs_MT256x256x32_MI16x16x1_SN_LDSB1_CLR1_GSU0_GSUC0_GSUWGMRR0_K1_LBSPPA2048_LBSPPB128_LPA0_MIWT8_8_PLR1_SU32_SUM0_SUS256_SKXCCM0_VWA4_VWB2_WGM4_WGMXCC1_WGMXCCGn1
    SolutionIndex: 9
    SolutionNameMin: Cijk_Ailk_Bljk_HSS_BH_UserArgs_MT128x256x32_MI16x16x1_SN_LDSB1_CLR1_GSU0_GSUC0_GSUWGMRR0_K1_LBSPPA1024_LBSPPB128_LPA0_MIWT4_8_PLR1_SU32_SUM0_SUS256_SKXCCM0_VWA4_VWB1_WGM1_WGMXCC1_WGMXCCGn1
    SolutionIndex: 10
    SolutionNameMin: Cijk_Ailk_Bljk_HSS_BH_UserArgs_MT128x256x32_MI16x16x1_SN_LDSB1_CLR1_GSU0_GSUC0_GSUWGMRR0_K1_LBSPPA1024_LBSPPB128_LPA0_MIWT4_8_PLR1_SU32_SUM0_SUS256_SKXCCM0_VWA4_VWB2_WGM1_WGMXCC1_WGMXCCGn1
    SolutionIndex: 11
    SolutionNameMin: Cijk_Ailk_Bljk_HSS_BH_UserArgs_MT256x128x32_MI16x16x1_SN_LDSB1_CLR1_GSU0_GSUC0_GSUWGMRR0_K1_LBSPPA2048_LBSPPB128_LPA0_MIWT8_4_PLR1_SU32_SUM0_SUS256_SKXCCM0_VWA4_VWB2_WGM1_WGMXCC1_WGMXCCGn1
    SolutionIndex: 12
    SolutionNameMin: Cijk_Ailk_Bljk_HSS_BH_UserArgs_MT256x128x32_MI16x16x1_SN_LDSB1_CLR1_GSU0_GSUC0_GSUWGMRR0_K1_LBSPPA2048_LBSPPB256_LPA0_MIWT8_4_PLR1_SU32_SUM0_SUS256_SKXCCM0_VWA4_VWB4_WGM1_WGMXCC1_WGMXCCGn1
    SolutionIndex: 13
    SolutionNameMin: Cijk_Ailk_Bljk_HSS_BH_UserArgs_MT256x64x32_MI16x16x1_SN_LDSB1_CLR1_GSU0_GSUC0_GSUWGMRR0_K1_LBSPPA2048_LBSPPB128_LPA0_MIWT8_2_PLR1_SU32_SUM0_SUS256_SKXCCM0_VWA4_VWB2_WGM8_WGMXCC1_WGMXCCGn1
    SolutionIndex: 14
    SolutionNameMin: Cijk_Ailk_Bljk_HSS_BH_UserArgs_MT128x128x32_MI16x16x1_SN_LDSB1_CLR1_GSU0_GSUC0_GSUWGMRR0_K1_LBSPPA1024_LBSPPB128_LPA0_MIWT4_4_PLR1_SU32_SUM0_SUS256_SKXCCM0_VWA4_VWB1_WGM1_WGMXCC1_WGMXCCGn1
    SolutionIndex: 15
    SolutionNameMin: Cijk_Ailk_Bljk_HSS_BH_UserArgs_MT128x128x32_MI16x16x1_SN_LDSB1_CLR1_GSU0_GSUC0_GSUWGMRR0_K1_LBSPPA1024_LBSPPB128_LPA0_MIWT4_4_PLR1_SU32_SUM0_SUS256_SKXCCM0_VWA4_VWB1_WGM8_WGMXCC1_WGMXCCGn1
    SolutionIndex: 16
    SolutionNameMin: Cijk_Ailk_Bljk_HSS_BH_UserArgs_MT128x128x32_MI16x16x1_SN_LDSB1_CLR1_GSU0_GSUC0_GSUWGMRR0_K1_LBSPPA1024_LBSPPB256_LPA0_MIWT4_4_PLR1_SU32_SUM0_SUS256_SKXCCM0_VWA4_VWB4_WGM8_WGMXCC1_WGMXCCGn1
    SolutionIndex: 17
    SolutionNameMin: Cijk_Ailk_Bljk_HSS_BH_UserArgs_MT128x64x32_MI16x16x1_SN_LDSB0_CLR1_GSU0_GSUC0_GSUWGMRR0_K1_LBSPPA1024_LBSPPB128_LPA0_MIWT4_2_PLR1_SU32_SUM0_SUS256_SKXCCM0_VWA4_VWB1_WGM1_WGMXCC1_WGMXCCGn1
    SolutionIndex: 18
    SolutionNameMin: Cijk_Ailk_Bljk_HSS_BH_UserArgs_MT128x64x32_MI16x16x1_SN_LDSB0_CLR1_GSU0_GSUC0_GSUWGMRR0_K1_LBSPPA1024_LBSPPB128_LPA0_MIWT4_2_PLR1_SU32_SUM0_SUS256_SKXCCM0_VWA4_VWB2_WGM1_WGMXCC1_WGMXCCGn1
    SolutionIndex: 19
    SolutionNameMin: Cijk_Ailk_Bljk_HSS_BH_UserArgs_MT32x32x32_MI16x16x1_SN_LDSB0_CLR0_GSU0_GSUC0_GSUWGMRR0_K1_LBSPPA256_LBSPPB128_LPA16_MIWT1_1_PLR0_SU32_SUM0_SUS256_SKXCCM0_VWA1_VWB1_WGM8_WGMXCC1_WGMXCCGn1
    SolutionIndex: 20
    SolutionNameMin: Cijk_Ailk_Bljk_HSS_BH_UserArgs_MT128x256x64_MI16x16x1_SN_LDSB1_CLR1_GSU0_GSUC0_GSUWGMRR0_K1_LBSPPA2048_LBSPPB128_LPA0_MIWT4_8_PLR1_SU32_SUM0_SUS256_SKXCCM0_VWA4_VWB1_WGM1_WGMXCC1_WGMXCCGn1
    SolutionIndex: 21
    SolutionNameMin: Cijk_Ailk_Bljk_HSS_BH_UserArgs_MT128x256x64_MI16x16x1_SN_LDSB1_CLR1_GSU0_GSUC0_GSUWGMRR0_K1_LBSPPA2048_LBSPPB512_LPA0_MIWT4_8_PLR1_SU32_SUM0_SUS256_SKXCCM0_VWA4_VWB4_WGM1_WGMXCC1_WGMXCCGn1
    SolutionIndex: 22
    SolutionNameMin: Cijk_Ailk_Bljk_HSS_BH_UserArgs_MT128x256x64_MI16x16x1_SN_LDSB1_CLR1_GSU0_GSUC0_GSUWGMRR0_K1_LBSPPA2048_LBSPPB128_LPA0_MIWT4_8_PLR1_SU32_SUM0_SUS256_SKXCCM0_VWA4_VWB1_WGM4_WGMXCC1_WGMXCCGn1
    SolutionIndex: 23
    SolutionNameMin: Cijk_Ailk_Bljk_HSS_BH_UserArgs_MT128x256x64_MI16x16x1_SN_LDSB1_CLR1_GSU0_GSUC0_GSUWGMRR0_K1_LBSPPA2048_LBSPPB1024_LPA0_MIWT4_8_PLR1_SU32_SUM0_SUS256_SKXCCM0_VWA4_VWB8_WGM4_WGMXCC1_WGMXCCGn1
    SolutionIndex: 24
    SolutionNameMin: Cijk_Ailk_Bljk_HSS_BH_UserArgs_MT128x256x64_MI16x16x1_SN_LDSB1_CLR1_GSU0_GSUC0_GSUWGMRR0_K1_LBSPPA2048_LBSPPB512_LPA0_MIWT4_8_PLR1_SU32_SUM0_SUS256_SKXCCM0_VWA4_VWB4_WGM8_WGMXCC1_WGMXCCGn1
    SolutionIndex: 25
    SolutionNameMin: Cijk_Ailk_Bljk_HSS_BH_UserArgs_MT256x128x64_MI16x16x1_SN_LDSB1_CLR1_GSU0_GSUC0_GSUWGMRR0_K1_LBSPPA4096_LBSPPB128_LPA0_MIWT8_4_PLR1_SU32_SUM0_SUS256_SKXCCM0_VWA4_VWB1_WGM1_WGMXCC1_WGMXCCGn1
    SolutionIndex: 26
    SolutionNameMin: Cijk_Ailk_Bljk_HSS_BH_UserArgs_MT256x128x64_MI16x16x1_SN_LDSB1_CLR1_GSU0_GSUC0_GSUWGMRR0_K1_LBSPPA4096_LBSPPB512_LPA0_MIWT8_4_PLR1_SU32_SUM0_SUS256_SKXCCM0_VWA4_VWB4_WGM1_WGMXCC1_WGMXCCGn1
    SolutionIndex: 27
    SolutionNameMin: Cijk_Ailk_Bljk_HSS_BH_UserArgs_MT256x128x64_MI16x16x1_SN_LDSB1_CLR1_GSU0_GSUC0_GSUWGMRR0_K1_LBSPPA4096_LBSPPB128_LPA0_MIWT8_4_PLR1_SU32_SUM0_SUS256_SKXCCM0_VWA4_VWB1_WGM4_WGMXCC1_WGMXCCGn1
    SolutionIndex: 28
    SolutionNameMin: Cijk_Ailk_Bljk_HSS_BH_UserArgs_MT256x128x64_MI16x16x1_SN_LDSB1_CLR1_GSU0_GSUC0_GSUWGMRR0_K1_LBSPPA4096_LBSPPB512_LPA0_MIWT8_4_PLR1_SU32_SUM0_SUS256_SKXCCM0_VWA4_VWB4_WGM4_WGMXCC1_WGMXCCGn1
    SolutionIndex: 29
    SolutionNameMin: Cijk_Ailk_Bljk_HSS_BH_UserArgs_MT256x128x64_MI16x16x1_SN_LDSB1_CLR1_GSU0_GSUC0_GSUWGMRR0_K1_LBSPPA4096_LBSPPB128_LPA0_MIWT8_4_PLR1_SU32_SUM0_SUS256_SKXCCM0_VWA4_VWB1_WGM8_WGMXCC1_WGMXCCGn1
    SolutionIndex: 30
    SolutionNameMin: Cijk_Ailk_Bljk_HSS_BH_UserArgs_MT256x128x64_MI16x16x1_SN_LDSB1_CLR1_GSU0_GSUC0_GSUWGMRR0_K1_LBSPPA4096_LBSPPB256_LPA0_MIWT8_4_PLR1_SU32_SUM0_SUS256_SKXCCM0_VWA4_VWB2_WGM8_WGMXCC1_WGMXCCGn1
    SolutionIndex: 31
    SolutionNameMin: Cijk_Ailk_Bljk_HSS_BH_UserArgs_MT256x128x64_MI16x16x1_SN_LDSB1_CLR1_GSU0_GSUC0_GSUWGMRR0_K1_LBSPPA4096_LBSPPB512_LPA0_MIWT8_4_PLR1_SU32_SUM0_SUS256_SKXCCM0_VWA4_VWB4_WGM8_WGMXCC1_WGMXCCGn1
    SolutionIndex: 32
    SolutionNameMin: Cijk_Ailk_Bljk_HSS_BH_UserArgs_MT256x64x64_MI16x16x1_SN_LDSB1_CLR1_GSU0_GSUC0_GSUWGMRR0_K1_LBSPPA4096_LBSPPB256_LPA0_MIWT8_2_PLR1_SU32_SUM0_SUS256_SKXCCM0_VWA4_VWB2_WGM1_WGMXCC1_WGMXCCGn1
    SolutionIndex: 33
    SolutionNameMin: Cijk_Ailk_Bljk_HSS_BH_UserArgs_MT128x128x64_MI16x16x1_SN_LDSB1_CLR1_GSU0_GSUC0_GSUWGMRR0_K1_LBSPPA2048_LBSPPB128_LPA0_MIWT4_4_PLR1_SU32_SUM0_SUS256_SKXCCM0_VWA4_VWB1_WGM1_WGMXCC1_WGMXCCGn1
    SolutionIndex: 34
    SolutionNameMin: Cijk_Ailk_Bljk_HSS_BH_UserArgs_MT128x128x64_MI16x16x1_SN_LDSB1_CLR1_GSU0_GSUC0_GSUWGMRR0_K1_LBSPPA2048_LBSPPB256_LPA0_MIWT4_4_PLR1_SU32_SUM0_SUS256_SKXCCM0_VWA4_VWB2_WGM1_WGMXCC1_WGMXCCGn1
    SolutionIndex: 35
    SolutionNameMin: Cijk_Ailk_Bljk_HSS_BH_UserArgs_MT128x128x64_MI16x16x1_SN_LDSB1_CLR1_GSU0_GSUC0_GSUWGMRR0_K1_LBSPPA2048_LBSPPB128_LPA0_MIWT4_4_PLR1_SU32_SUM0_SUS256_SKXCCM0_VWA4_VWB1_WGM4_WGMXCC1_WGMXCCGn1
    SolutionIndex: 36
    SolutionNameMin: Cijk_Ailk_Bljk_HSS_BH_UserArgs_MT128x128x64_MI16x16x1_SN_LDSB1_CLR1_GSU0_GSUC0_GSUWGMRR0_K1_LBSPPA2048_LBSPPB256_LPA0_MIWT4_4_PLR2_SU32_SUM0_SUS256_SKXCCM0_VWA4_VWB2_WGM4_WGMXCC1_WGMXCCGn1
    SolutionIndex: 37
    SolutionNameMin: Cijk_Ailk_Bljk_HSS_BH_UserArgs_MT128x128x64_MI16x16x1_SN_LDSB1_CLR1_GSU0_GSUC0_GSUWGMRR0_K1_LBSPPA2048_LBSPPB128_LPA0_MIWT4_4_PLR1_SU32_SUM0_SUS256_SKXCCM0_VWA4_VWB1_WGM8_WGMXCC1_WGMXCCGn1
    SolutionIndex: 38
    SolutionNameMin: Cijk_Ailk_Bljk_HSS_BH_UserArgs_MT128x128x64_MI16x16x1_SN_LDSB1_CLR1_GSU0_GSUC0_GSUWGMRR0_K1_LBSPPA2048_LBSPPB256_LPA0_MIWT4_4_PLR2_SU32_SUM0_SUS256_SKXCCM0_VWA4_VWB2_WGM8_WGMXCC1_WGMXCCGn1
    SolutionIndex: 39
    SolutionNameMin: Cijk_Ailk_Bljk_HSS_BH_UserArgs_MT64x128x64_MI16x16x1_SN_LDSB1_CLR1_GSU0_GSUC0_GSUWGMRR0_K1_LBSPPA1024_LBSPPB128_LPA32_MIWT2_4_PLR1_SU32_SUM0_SUS256_SKXCCM0_VWA2_VWB1_WGM1_WGMXCC1_WGMXCCGn1
    SolutionIndex: 40
    SolutionNameMin: Cijk_Ailk_Bljk_HSS_BH_UserArgs_MT64x128x64_MI16x16x1_SN_LDSB1_CLR1_GSU0_GSUC0_GSUWGMRR0_K1_LBSPPA1024_LBSPPB256_LPA32_MIWT2_4_PLR1_SU32_SUM0_SUS256_SKXCCM0_VWA2_VWB2_WGM1_WGMXCC1_WGMXCCGn1
    SolutionIndex: 41
    SolutionNameMin: Cijk_Ailk_Bljk_HSS_BH_UserArgs_MT128x64x64_MI16x16x1_SN_LDSB1_CLR1_GSU0_GSUC0_GSUWGMRR0_K1_LBSPPA2048_LBSPPB128_LPA0_MIWT4_2_PLR1_SU32_SUM0_SUS256_SKXCCM0_VWA4_VWB1_WGM1_WGMXCC1_WGMXCCGn1
    SolutionIndex: 42
    SolutionNameMin: Cijk_Ailk_Bljk_HSS_BH_UserArgs_MT128x64x64_MI16x16x1_SN_LDSB1_CLR1_GSU0_GSUC0_GSUWGMRR0_K1_LBSPPA2048_LBSPPB256_LPA0_MIWT4_2_PLR1_SU32_SUM0_SUS256_SKXCCM0_VWA4_VWB2_WGM1_WGMXCC1_WGMXCCGn1
    SolutionIndex: 43
    SolutionNameMin: Cijk_Ailk_Bljk_HSS_BH_UserArgs_MT128x64x64_MI16x16x1_SN_LDSB1_CLR1_GSU0_GSUC0_GSUWGMRR0_K1_LBSPPA2048_LBSPPB128_LPA0_MIWT4_2_PLR1_SU32_SUM0_SUS256_SKXCCM0_VWA4_VWB1_WGM8_WGMXCC1_WGMXCCGn1
    SolutionIndex: 44
    SolutionNameMin: Cijk_Ailk_Bljk_HSS_BH_UserArgs_MT128x64x64_MI16x16x1_SN_LDSB1_CLR1_GSU0_GSUC0_GSUWGMRR0_K1_LBSPPA2048_LBSPPB256_LPA0_MIWT4_2_PLR1_SU32_SUM0_SUS256_SKXCCM0_VWA4_VWB2_WGM8_WGMXCC1_WGMXCCGn1
    SolutionIndex: 45
    SolutionNameMin: Cijk_Ailk_Bljk_HSS_BH_UserArgs_MT64x64x64_MI16x16x1_SN_LDSB1_CLR1_GSU0_GSUC0_GSUWGMRR0_K1_LBSPPA1024_LBSPPB128_LPA32_MIWT2_2_PLR1_SU32_SUM0_SUS256_SKXCCM0_VWA2_VWB1_WGM1_WGMXCC1_WGMXCCGn1
    SolutionIndex: 46
    SolutionNameMin: Cijk_Ailk_Bljk_HSS_BH_UserArgs_MT64x64x64_MI16x16x1_SN_LDSB1_CLR1_GSU0_GSUC0_GSUWGMRR0_K1_LBSPPA1024_LBSPPB256_LPA16_MIWT2_2_PLR1_SU32_SUM0_SUS256_SKXCCM0_VWA1_VWB2_WGM1_WGMXCC1_WGMXCCGn1
    SolutionIndex: 47
    SolutionNameMin: Cijk_Ailk_Bljk_HSS_BH_UserArgs_MT64x64x64_MI16x16x1_SN_LDSB1_CLR1_GSU0_GSUC0_GSUWGMRR0_K1_LBSPPA1024_LBSPPB256_LPA32_MIWT2_2_PLR1_SU32_SUM0_SUS256_SKXCCM0_VWA2_VWB2_WGM1_WGMXCC1_WGMXCCGn1
    SolutionIndex: 48
    SolutionNameMin: Cijk_Ailk_Bljk_HSS_BH_UserArgs_MT32x64x64_MI16x16x1_SN_LDSB0_CLR1_GSU0_GSUC0_GSUWGMRR0_K1_LBSPPA512_LBSPPB256_LPA16_MIWT1_2_PLR1_SU32_SUM0_SUS256_SKXCCM0_VWA1_VWB2_WGM1_WGMXCC1_WGMXCCGn1
    SolutionIndex: 49
    SolutionNameMin: Cijk_Ailk_Bljk_HSS_BH_UserArgs_MT64x32x64_MI16x16x1_SN_LDSB0_CLR1_GSU0_GSUC0_GSUWGMRR0_K1_LBSPPA1024_LBSPPB128_LPA32_MIWT2_1_PLR1_SU32_SUM0_SUS256_SKXCCM0_VWA2_VWB1_WGM1_WGMXCC1_WGMXCCGn1
    SolutionIndex: 50
    SolutionNameMin: Cijk_Ailk_Bljk_HSS_BH_UserArgs_MT32x32x64_MI16x16x1_SN_LDSB0_CLR1_GSU0_GSUC0_GSUWGMRR0_K1_LBSPPA512_LBSPPB128_LPA16_MIWT1_1_PLR1_SU32_SUM0_SUS256_SKXCCM0_VWA1_VWB1_WGM1_WGMXCC1_WGMXCCGn1
    SolutionIndex: 51
    SolutionNameMin: Cijk_Ailk_Bljk_HSS_BH_UserArgs_MT128x64x128_MI16x16x1_SN_LDSB1_CLR1_GSU0_GSUC0_GSUWGMRR0_K1_LBSPPA2048_LBSPPB256_LPA0_MIWT4_2_PLR2_SU32_SUM0_SUS256_SKXCCM0_VWA4_VWB1_WGM1_WGMXCC1_WGMXCCGn1
    SolutionIndex: 52
    SolutionNameMin: Cijk_Ailk_Bljk_HSS_BH_UserArgs_MT128x64x128_MI16x16x1_SN_LDSB1_CLR1_GSU0_GSUC0_GSUWGMRR0_K1_LBSPPA2048_LBSPPB512_LPA0_MIWT4_2_PLR1_SU32_SUM0_SUS256_SKXCCM0_VWA4_VWB2_WGM8_WGMXCC1_WGMXCCGn1
    SolutionIndex: 53
    SolutionNameMin: Cijk_Ailk_Bljk_HSS_BH_UserArgs_MT64x64x128_MI16x16x1_SN_LDSB1_CLR1_GSU0_GSUC0_GSUWGMRR0_K1_LBSPPA1024_LBSPPB256_LPA32_MIWT2_2_PLR2_SU32_SUM0_SUS256_SKXCCM0_VWA2_VWB1_WGM1_WGMXCC1_WGMXCCGn1
    SolutionIndex: 54
    SolutionNameMin: Cijk_Ailk_Bljk_HSS_BH_UserArgs_MT64x64x128_MI16x16x1_SN_LDSB1_CLR1_GSU0_GSUC0_GSUWGMRR0_K1_LBSPPA1024_LBSPPB512_LPA32_MIWT2_2_PLR2_SU32_SUM0_SUS256_SKXCCM0_VWA2_VWB2_WGM1_WGMXCC1_WGMXCCGn1
    SolutionIndex: 55
    SolutionNameMin: Cijk_Ailk_Bljk_HSS_BH_UserArgs_MT64x64x128_MI16x16x1_SN_LDSB1_CLR1_GSU0_GSUC0_GSUWGMRR0_K1_LBSPPA1024_LBSPPB512_LPA32_MIWT2_2_PLR2_SU32_SUM0_SUS256_SKXCCM0_VWA2_VWB2_WGM4_WGMXCC1_WGMXCCGn1
    SolutionIndex: 56
    SolutionNameMin: Cijk_Ailk_Bljk_HSS_BH_UserArgs_MT64x64x128_MI16x16x1_SN_LDSB1_CLR1_GSU0_GSUC0_GSUWGMRR0_K1_LBSPPA1024_LBSPPB256_LPA32_MIWT2_2_PLR2_SU32_SUM0_SUS256_SKXCCM0_VWA2_VWB1_WGM8_WGMXCC1_WGMXCCGn1
    SolutionIndex: 57
    SolutionNameMin: Cijk_Ailk_Bljk_HSS_BH_UserArgs_MT32x64x128_MI16x16x1_SN_LDSB1_CLR1_GSU0_GSUC0_GSUWGMRR0_K1_LBSPPA512_LBSPPB256_LPA16_MIWT1_2_PLR2_SU32_SUM0_SUS256_SKXCCM0_VWA1_VWB1_WGM1_WGMXCC1_WGMXCCGn1
    SolutionIndex: 58
    SolutionNameMin: Cijk_Ailk_Bljk_HSS_BH_UserArgs_MT64x32x128_MI16x16x1_SN_LDSB1_CLR1_GSU0_GSUC0_GSUWGMRR0_K1_LBSPPA1024_LBSPPB256_LPA32_MIWT2_1_PLR2_SU32_SUM0_SUS256_SKXCCM0_VWA2_VWB1_WGM1_WGMXCC1_WGMXCCGn1
    SolutionIndex: 59
    SolutionNameMin: Cijk_Ailk_Bljk_HSS_BH_UserArgs_MT64x32x128_MI16x16x1_SN_LDSB1_CLR1_GSU0_GSUC0_GSUWGMRR0_K1_LBSPPA1024_LBSPPB256_LPA32_MIWT2_1_PLR2_SU32_SUM0_SUS256_SKXCCM0_VWA2_VWB1_WGM4_WGMXCC1_WGMXCCGn1
    SolutionIndex: 60
    SolutionNameMin: Cijk_Ailk_Bljk_HSS_BH_UserArgs_MT32x32x128_MI16x16x1_SN_LDSB1_CLR1_GSU0_GSUC0_GSUWGMRR0_K1_LBSPPA512_LBSPPB256_LPA16_MIWT1_1_PLR1_SU32_SUM0_SUS256_SKXCCM0_VWA1_VWB1_WGM1_WGMXCC1_WGMXCCGn1
    SolutionIndex: 61
    SolutionNameMin: Cijk_Ailk_Bljk_HSS_BH_UserArgs_MT32x32x128_MI16x16x1_SN_LDSB1_CLR1_GSU0_GSUC0_GSUWGMRR0_K1_LBSPPA512_LBSPPB256_LPA16_MIWT1_1_PLR2_SU32_SUM0_SUS256_SKXCCM0_VWA1_VWB1_WGM1_WGMXCC1_WGMXCCGn1
    SolutionIndex: 62
    SolutionNameMin: Cijk_Ailk_Bljk_HSS_BH_UserArgs_MT32x32x128_MI16x16x1_SN_LDSB1_CLR1_GSU0_GSUC0_GSUWGMRR0_K1_LBSPPA512_LBSPPB256_LPA16_MIWT1_1_PLR1_SU32_SUM0_SUS256_SKXCCM0_VWA1_VWB1_WGM4_WGMXCC1_WGMXCCGn1
    SolutionIndex: 63
    SolutionNameMin: Cijk_Ailk_Bljk_HSS_BH_UserArgs_MT32x32x128_MI16x16x1_SN_LDSB1_CLR1_GSU0_GSUC0_GSUWGMRR0_K1_LBSPPA512_LBSPPB256_LPA16_MIWT1_1_PLR1_SU32_SUM0_SUS256_SKXCCM0_VWA1_VWB1_WGM8_WGMXCC1_WGMXCCGn1
    SolutionIndex: 64
    SolutionNameMin: Cijk_Ailk_Bljk_HSS_BH_UserArgs_MT32x32x128_MI16x16x1_SN_LDSB1_CLR1_GSU0_GSUC0_GSUWGMRR0_K1_LBSPPA512_LBSPPB256_LPA16_MIWT1_1_PLR2_SU32_SUM0_SUS256_SKXCCM0_VWA1_VWB1_WGM8_WGMXCC1_WGMXCCGn1
    SolutionIndex: 65
    SolutionNameMin: Cijk_Ailk_Bljk_HSS_BH_UserArgs_MT256x256x32_MI16x16x1_SN_LDSB1_CLR1_GSU0_GSUC0_GSUWGMRR0_K1_LBSPPA2048_LBSPPB128_LPA32_MIWT8_8_PLR1_SU32_SUM0_SUS256_SKXCCM6_VWA2_VWB1_WGM1_WGMXCC1_WGMXCCGn1
    SolutionIndex: 66
    SolutionNameMin: Cijk_Ailk_Bljk_HSS_BH_UserArgs_MT256x256x32_MI16x16x1_SN_LDSB1_CLR1_GSU0_GSUC0_GSUWGMRR0_K1_LBSPPA2048_LBSPPB128_LPA0_MIWT8_8_PLR1_SU32_SUM0_SUS256_SKXCCM6_VWA4_VWB1_WGM1_WGMXCC1_WGMXCCGn1
    SolutionIndex: 67
    SolutionNameMin: Cijk_Ailk_Bljk_HSS_BH_UserArgs_MT256x256x32_MI16x16x1_SN_LDSB1_CLR1_GSU0_GSUC0_GSUWGMRR0_K1_LBSPPA2048_LBSPPB128_LPA0_MIWT8_8_PLR1_SU32_SUM0_SUS256_SKXCCM6_VWA4_VWB2_WGM1_WGMXCC1_WGMXCCGn1
    SolutionIndex: 68
    SolutionNameMin: Cijk_Ailk_Bljk_HSS_BH_UserArgs_MT256x256x32_MI16x16x1_SN_LDSB1_CLR1_GSU0_GSUC0_GSUWGMRR0_K1_LBSPPA2048_LBSPPB256_LPA32_MIWT8_8_PLR1_SU32_SUM0_SUS256_SKXCCM6_VWA2_VWB4_WGM1_WGMXCC1_WGMXCCGn1
    SolutionIndex: 69
    SolutionNameMin: Cijk_Ailk_Bljk_HSS_BH_UserArgs_MT256x256x32_MI16x16x1_SN_LDSB1_CLR1_GSU0_GSUC0_GSUWGMRR0_K1_LBSPPA2048_LBSPPB256_LPA0_MIWT8_8_PLR1_SU32_SUM0_SUS256_SKXCCM6_VWA4_VWB4_WGM1_WGMXCC1_WGMXCCGn1
    SolutionIndex: 70
    SolutionNameMin: Cijk_Ailk_Bljk_HSS_BH_UserArgs_MT256x256x32_MI16x16x1_SN_LDSB1_CLR1_GSU0_GSUC0_GSUWGMRR0_K1_LBSPPA2048_LBSPPB512_LPA32_MIWT8_8_PLR1_SU32_SUM0_SUS256_SKXCCM6_VWA2_VWB8_WGM1_WGMXCC1_WGMXCCGn1
    SolutionIndex: 71
    SolutionNameMin: Cijk_Ailk_Bljk_HSS_BH_UserArgs_MT256x256x32_MI16x16x1_SN_LDSB1_CLR1_GSU0_GSUC0_GSUWGMRR0_K1_LBSPPA2048_LBSPPB512_LPA0_MIWT8_8_PLR1_SU32_SUM0_SUS256_SKXCCM6_VWA4_VWB8_WGM1_WGMXCC1_WGMXCCGn1
    SolutionIndex: 72
    SolutionNameMin: Cijk_Ailk_Bljk_HSS_BH_UserArgs_MT256x256x32_MI16x16x1_SN_LDSB1_CLR1_GSU0_GSUC0_GSUWGMRR0_K1_LBSPPA2048_LBSPPB128_LPA0_MIWT8_8_PLR1_SU32_SUM0_SUS256_SKXCCM6_VWA4_VWB2_WGM4_WGMXCC1_WGMXCCGn1
    SolutionIndex: 73
    SolutionNameMin: Cijk_Ailk_Bljk_HSS_BH_UserArgs_MT256x256x32_MI16x16x1_SN_LDSB1_CLR1_GSU0_GSUC0_GSUWGMRR0_K1_LBSPPA2048_LBSPPB512_LPA0_MIWT8_8_PLR1_SU32_SUM0_SUS256_SKXCCM6_VWA4_VWB8_WGM4_WGMXCC1_WGMXCCGn1
    SolutionIndex: 74
    SolutionNameMin: Cijk_Ailk_Bljk_HSS_BH_UserArgs_MT256x256x32_MI16x16x1_SN_LDSB1_CLR1_GSU0_GSUC0_GSUWGMRR0_K1_LBSPPA2048_LBSPPB128_LPA0_MIWT8_8_PLR1_SU32_SUM0_SUS256_SKXCCM6_VWA4_VWB1_WGM8_WGMXCC1_WGMXCCGn1
    SolutionIndex: 75
    SolutionNameMin: Cijk_Ailk_Bljk_HSS_BH_UserArgs_MT256x256x32_MI16x16x1_SN_LDSB1_CLR1_GSU0_GSUC0_GSUWGMRR0_K1_LBSPPA2048_LBSPPB128_LPA32_MIWT8_8_PLR1_SU32_SUM0_SUS256_SKXCCM6_VWA2_VWB2_WGM8_WGMXCC1_WGMXCCGn1
    SolutionIndex: 76
    SolutionNameMin: Cijk_Ailk_Bljk_HSS_BH_UserArgs_MT128x256x32_MI16x16x1_SN_LDSB1_CLR1_GSU0_GSUC0_GSUWGMRR0_K1_LBSPPA1024_LBSPPB128_LPA0_MIWT4_8_PLR1_SU32_SUM0_SUS256_SKXCCM6_VWA4_VWB1_WGM4_WGMXCC1_WGMXCCGn1
    SolutionIndex: 77
    SolutionNameMin: Cijk_Ailk_Bljk_HSS_BH_UserArgs_MT128x256x32_MI16x16x1_SN_LDSB1_CLR1_GSU0_GSUC0_GSUWGMRR0_K1_LBSPPA1024_LBSPPB256_LPA0_MIWT4_8_PLR1_SU32_SUM0_SUS256_SKXCCM6_VWA4_VWB4_WGM4_WGMXCC1_WGMXCCGn1
    SolutionIndex: 78
    SolutionNameMin: Cijk_Ailk_Bljk_HSS_BH_UserArgs_MT256x128x32_MI16x16x1_SN_LDSB1_CLR1_GSU0_GSUC0_GSUWGMRR0_K1_LBSPPA2048_LBSPPB128_LPA0_MIWT8_4_PLR1_SU32_SUM0_SUS256_SKXCCM6_VWA4_VWB2_WGM1_WGMXCC1_WGMXCCGn1
    SolutionIndex: 79
    SolutionNameMin: Cijk_Ailk_Bljk_HSS_BH_UserArgs_MT256x128x32_MI16x16x1_SN_LDSB1_CLR1_GSU0_GSUC0_GSUWGMRR0_K1_LBSPPA2048_LBSPPB256_LPA0_MIWT8_4_PLR1_SU32_SUM0_SUS256_SKXCCM6_VWA4_VWB4_WGM1_WGMXCC1_WGMXCCGn1
    SolutionIndex: 80
    SolutionNameMin: Cijk_Ailk_Bljk_HSS_BH_UserArgs_MT256x128x32_MI16x16x1_SN_LDSB1_CLR1_GSU0_GSUC0_GSUWGMRR0_K1_LBSPPA2048_LBSPPB128_LPA0_MIWT8_4_PLR1_SU32_SUM0_SUS256_SKXCCM6_VWA4_VWB1_WGM4_WGMXCC1_WGMXCCGn1
    SolutionIndex: 81
    SolutionNameMin: Cijk_Ailk_Bljk_HSS_BH_UserArgs_MT256x128x32_MI16x16x1_SN_LDSB1_CLR1_GSU0_GSUC0_GSUWGMRR0_K1_LBSPPA2048_LBSPPB128_LPA0_MIWT8_4_PLR1_SU32_SUM0_SUS256_SKXCCM6_VWA4_VWB1_WGM8_WGMXCC1_WGMXCCGn1
    SolutionIndex: 82
    SolutionNameMin: Cijk_Ailk_Bljk_HSS_BH_UserArgs_MT256x64x32_MI16x16x1_SN_LDSB1_CLR1_GSU0_GSUC0_GSUWGMRR0_K1_LBSPPA2048_LBSPPB128_LPA0_MIWT8_2_PLR1_SU32_SUM0_SUS256_SKXCCM6_VWA4_VWB1_WGM1_WGMXCC1_WGMXCCGn1
    SolutionIndex: 83
    SolutionNameMin: Cijk_Ailk_Bljk_HSS_BH_UserArgs_MT128x128x32_MI16x16x1_SN_LDSB1_CLR1_GSU0_GSUC0_GSUWGMRR0_K1_LBSPPA1024_LBSPPB128_LPA0_MIWT4_4_PLR1_SU32_SUM0_SUS256_SKXCCM6_VWA4_VWB2_WGM1_WGMXCC1_WGMXCCGn1
    SolutionIndex: 84
    SolutionNameMin: Cijk_Ailk_Bljk_HSS_BH_UserArgs_MT128x128x32_MI16x16x1_SN_LDSB1_CLR1_GSU0_GSUC0_GSUWGMRR0_K1_LBSPPA1024_LBSPPB256_LPA0_MIWT4_4_PLR1_SU32_SUM0_SUS256_SKXCCM6_VWA4_VWB4_WGM1_WGMXCC1_WGMXCCGn1
    SolutionIndex: 85
    SolutionNameMin: Cijk_Ailk_Bljk_HSS_BH_UserArgs_MT128x64x32_MI16x16x1_SN_LDSB0_CLR1_GSU0_GSUC0_GSUWGMRR0_K1_LBSPPA1024_LBSPPB128_LPA0_MIWT4_2_PLR1_SU32_SUM0_SUS256_SKXCCM6_VWA4_VWB1_WGM1_WGMXCC1_WGMXCCGn1
    SolutionIndex: 86
    SolutionNameMin: Cijk_Ailk_Bljk_HSS_BH_UserArgs_MT128x256x64_MI16x16x1_SN_LDSB1_CLR1_GSU0_GSUC0_GSUWGMRR0_K1_LBSPPA2048_LBSPPB128_LPA0_MIWT4_8_PLR1_SU32_SUM0_SUS256_SKXCCM6_VWA4_VWB1_WGM1_WGMXCC1_WGMXCCGn1
    SolutionIndex: 87
    SolutionNameMin: Cijk_Ailk_Bljk_HSS_BH_UserArgs_MT128x256x64_MI16x16x1_SN_LDSB1_CLR1_GSU0_GSUC0_GSUWGMRR0_K1_LBSPPA2048_LBSPPB256_LPA16_MIWT4_8_PLR1_SU32_SUM0_SUS256_SKXCCM6_VWA1_VWB2_WGM1_WGMXCC1_WGMXCCGn1
    SolutionIndex: 88
    SolutionNameMin: Cijk_Ailk_Bljk_HSS_BH_UserArgs_MT128x256x64_MI16x16x1_SN_LDSB1_CLR1_GSU0_GSUC0_GSUWGMRR0_K1_LBSPPA2048_LBSPPB256_LPA32_MIWT4_8_PLR1_SU32_SUM0_SUS256_SKXCCM6_VWA2_VWB2_WGM1_WGMXCC1_WGMXCCGn1
    SolutionIndex: 89
    SolutionNameMin: Cijk_Ailk_Bljk_HSS_BH_UserArgs_MT128x256x64_MI16x16x1_SN_LDSB1_CLR1_GSU0_GSUC0_GSUWGMRR0_K1_LBSPPA2048_LBSPPB256_LPA0_MIWT4_8_PLR1_SU32_SUM0_SUS256_SKXCCM6_VWA4_VWB2_WGM1_WGMXCC1_WGMXCCGn1
    SolutionIndex: 90
    SolutionNameMin: Cijk_Ailk_Bljk_HSS_BH_UserArgs_MT128x256x64_MI16x16x1_SN_LDSB1_CLR1_GSU0_GSUC0_GSUWGMRR0_K1_LBSPPA2048_LBSPPB512_LPA0_MIWT4_8_PLR1_SU32_SUM0_SUS256_SKXCCM6_VWA4_VWB4_WGM1_WGMXCC1_WGMXCCGn1
    SolutionIndex: 91
    SolutionNameMin: Cijk_Ailk_Bljk_HSS_BH_UserArgs_MT128x256x64_MI16x16x1_SN_LDSB1_CLR1_GSU0_GSUC0_GSUWGMRR0_K1_LBSPPA2048_LBSPPB1024_LPA32_MIWT4_8_PLR1_SU32_SUM0_SUS256_SKXCCM6_VWA2_VWB8_WGM1_WGMXCC1_WGMXCCGn1
    SolutionIndex: 92
    SolutionNameMin: Cijk_Ailk_Bljk_HSS_BH_UserArgs_MT128x256x64_MI16x16x1_SN_LDSB1_CLR1_GSU0_GSUC0_GSUWGMRR0_K1_LBSPPA2048_LBSPPB1024_LPA0_MIWT4_8_PLR1_SU32_SUM0_SUS256_SKXCCM6_VWA4_VWB8_WGM1_WGMXCC1_WGMXCCGn1
    SolutionIndex: 93
    SolutionNameMin: Cijk_Ailk_Bljk_HSS_BH_UserArgs_MT128x256x64_MI16x16x1_SN_LDSB1_CLR1_GSU0_GSUC0_GSUWGMRR0_K1_LBSPPA2048_LBSPPB128_LPA0_MIWT4_8_PLR1_SU32_SUM0_SUS256_SKXCCM6_VWA4_VWB1_WGM4_WGMXCC1_WGMXCCGn1
    SolutionIndex: 94
    SolutionNameMin: Cijk_Ailk_Bljk_HSS_BH_UserArgs_MT128x256x64_MI16x16x1_SN_LDSB1_CLR1_GSU0_GSUC0_GSUWGMRR0_K1_LBSPPA2048_LBSPPB256_LPA0_MIWT4_8_PLR1_SU32_SUM0_SUS256_SKXCCM6_VWA4_VWB2_WGM4_WGMXCC1_WGMXCCGn1
    SolutionIndex: 95
    SolutionNameMin: Cijk_Ailk_Bljk_HSS_BH_UserArgs_MT256x128x64_MI16x16x1_SN_LDSB1_CLR1_GSU0_GSUC0_GSUWGMRR0_K1_LBSPPA4096_LBSPPB128_LPA0_MIWT8_4_PLR1_SU32_SUM0_SUS256_SKXCCM6_VWA4_VWB1_WGM4_WGMXCC1_WGMXCCGn1
    SolutionIndex: 96
    SolutionNameMin: Cijk_Ailk_Bljk_HSS_BH_UserArgs_MT64x256x64_MI16x16x1_SN_LDSB1_CLR1_GSU0_GSUC0_GSUWGMRR0_K1_LBSPPA1024_LBSPPB1024_LPA32_MIWT2_8_PLR1_SU32_SUM0_SUS256_SKXCCM6_VWA2_VWB8_WGM1_WGMXCC1_WGMXCCGn1
    SolutionIndex: 97
    SolutionNameMin: Cijk_Ailk_Bljk_HSS_BH_UserArgs_MT256x64x64_MI16x16x1_SN_LDSB1_CLR1_GSU0_GSUC0_GSUWGMRR0_K1_LBSPPA4096_LBSPPB128_LPA0_MIWT8_2_PLR1_SU32_SUM0_SUS256_SKXCCM6_VWA4_VWB1_WGM1_WGMXCC1_WGMXCCGn1
    SolutionIndex: 98
    SolutionNameMin: Cijk_Ailk_Bljk_HSS_BH_UserArgs_MT128x128x64_MI16x16x1_SN_LDSB1_CLR1_GSU0_GSUC0_GSUWGMRR0_K1_LBSPPA2048_LBSPPB128_LPA0_MIWT4_4_PLR1_SU32_SUM0_SUS256_SKXCCM6_VWA4_VWB1_WGM1_WGMXCC1_WGMXCCGn1
    SolutionIndex: 99
    SolutionNameMin: Cijk_Ailk_Bljk_HSS_BH_UserArgs_MT128x128x64_MI16x16x1_SN_LDSB1_CLR1_GSU0_GSUC0_GSUWGMRR0_K1_LBSPPA2048_LBSPPB256_LPA0_MIWT4_4_PLR1_SU32_SUM0_SUS256_SKXCCM6_VWA4_VWB2_WGM1_WGMXCC1_WGMXCCGn1
    SolutionIndex: 100
    SolutionNameMin: Cijk_Ailk_Bljk_HSS_BH_UserArgs_MT128x128x64_MI16x16x1_SN_LDSB1_CLR1_GSU0_GSUC0_GSUWGMRR0_K1_LBSPPA2048_LBSPPB512_LPA0_MIWT4_4_PLR1_SU32_SUM0_SUS256_SKXCCM6_VWA4_VWB4_WGM1_WGMXCC1_WGMXCCGn1
    SolutionIndex: 101
    SolutionNameMin: Cijk_Ailk_Bljk_HSS_BH_UserArgs_MT128x128x64_MI16x16x1_SN_LDSB1_CLR1_GSU0_GSUC0_GSUWGMRR0_K1_LBSPPA2048_LBSPPB256_LPA0_MIWT4_4_PLR2_SU32_SUM0_SUS256_SKXCCM6_VWA4_VWB2_WGM1_WGMXCC1_WGMXCCGn1
    SolutionIndex: 102
    SolutionNameMin: Cijk_Ailk_Bljk_HSS_BH_UserArgs_MT128x128x64_MI16x16x1_SN_LDSB1_CLR1_GSU0_GSUC0_GSUWGMRR0_K1_LBSPPA2048_LBSPPB512_LPA0_MIWT4_4_PLR2_SU32_SUM0_SUS256_SKXCCM6_VWA4_VWB4_WGM1_WGMXCC1_WGMXCCGn1
    SolutionIndex: 103
    SolutionNameMin: Cijk_Ailk_Bljk_HSS_BH_UserArgs_MT128x128x64_MI16x16x1_SN_LDSB1_CLR1_GSU0_GSUC0_GSUWGMRR0_K1_LBSPPA2048_LBSPPB128_LPA32_MIWT4_4_PLR1_SU32_SUM0_SUS256_SKXCCM6_VWA2_VWB1_WGM4_WGMXCC1_WGMXCCGn1
    SolutionIndex: 104
    SolutionNameMin: Cijk_Ailk_Bljk_HSS_BH_UserArgs_MT128x128x64_MI16x16x1_SN_LDSB1_CLR1_GSU0_GSUC0_GSUWGMRR0_K1_LBSPPA2048_LBSPPB128_LPA0_MIWT4_4_PLR1_SU32_SUM0_SUS256_SKXCCM6_VWA4_VWB1_WGM4_WGMXCC1_WGMXCCGn1
    SolutionIndex: 105
    SolutionNameMin: Cijk_Ailk_Bljk_HSS_BH_UserArgs_MT128x128x64_MI16x16x1_SN_LDSB1_CLR1_GSU0_GSUC0_GSUWGMRR0_K1_LBSPPA2048_LBSPPB256_LPA0_MIWT4_4_PLR1_SU32_SUM0_SUS256_SKXCCM6_VWA4_VWB2_WGM4_WGMXCC1_WGMXCCGn1
    SolutionIndex: 106
    SolutionNameMin: Cijk_Ailk_Bljk_HSS_BH_UserArgs_MT128x128x64_MI16x16x1_SN_LDSB1_CLR1_GSU0_GSUC0_GSUWGMRR0_K1_LBSPPA2048_LBSPPB512_LPA0_MIWT4_4_PLR1_SU32_SUM0_SUS256_SKXCCM6_VWA4_VWB4_WGM4_WGMXCC1_WGMXCCGn1
    SolutionIndex: 107
    SolutionNameMin: Cijk_Ailk_Bljk_HSS_BH_UserArgs_MT128x128x64_MI16x16x1_SN_LDSB1_CLR1_GSU0_GSUC0_GSUWGMRR0_K1_LBSPPA2048_LBSPPB128_LPA0_MIWT4_4_PLR2_SU32_SUM0_SUS256_SKXCCM6_VWA4_VWB1_WGM4_WGMXCC1_WGMXCCGn1
    SolutionIndex: 108
    SolutionNameMin: Cijk_Ailk_Bljk_HSS_BH_UserArgs_MT128x128x64_MI16x16x1_SN_LDSB1_CLR1_GSU0_GSUC0_GSUWGMRR0_K1_LBSPPA2048_LBSPPB128_LPA32_MIWT4_4_PLR1_SU32_SUM0_SUS256_SKXCCM6_VWA2_VWB1_WGM8_WGMXCC1_WGMXCCGn1
    SolutionIndex: 109
    SolutionNameMin: Cijk_Ailk_Bljk_HSS_BH_UserArgs_MT128x128x64_MI16x16x1_SN_LDSB1_CLR1_GSU0_GSUC0_GSUWGMRR0_K1_LBSPPA2048_LBSPPB128_LPA0_MIWT4_4_PLR1_SU32_SUM0_SUS256_SKXCCM6_VWA4_VWB1_WGM8_WGMXCC1_WGMXCCGn1
    SolutionIndex: 110
    SolutionNameMin: Cijk_Ailk_Bljk_HSS_BH_UserArgs_MT128x128x64_MI16x16x1_SN_LDSB1_CLR1_GSU0_GSUC0_GSUWGMRR0_K1_LBSPPA2048_LBSPPB256_LPA0_MIWT4_4_PLR1_SU32_SUM0_SUS256_SKXCCM6_VWA4_VWB2_WGM8_WGMXCC1_WGMXCCGn1
    SolutionIndex: 111
    SolutionNameMin: Cijk_Ailk_Bljk_HSS_BH_UserArgs_MT128x128x64_MI16x16x1_SN_LDSB1_CLR1_GSU0_GSUC0_GSUWGMRR0_K1_LBSPPA2048_LBSPPB256_LPA0_MIWT4_4_PLR2_SU32_SUM0_SUS256_SKXCCM6_VWA4_VWB2_WGM8_WGMXCC1_WGMXCCGn1
    SolutionIndex: 112
    SolutionNameMin: Cijk_Ailk_Bljk_HSS_BH_UserArgs_MT64x128x64_MI16x16x1_SN_LDSB1_CLR1_GSU0_GSUC0_GSUWGMRR0_K1_LBSPPA1024_LBSPPB512_LPA16_MIWT2_4_PLR1_SU32_SUM0_SUS256_SKXCCM6_VWA1_VWB4_WGM1_WGMXCC1_WGMXCCGn1
    SolutionIndex: 113
    SolutionNameMin: Cijk_Ailk_Bljk_HSS_BH_UserArgs_MT64x128x64_MI16x16x1_SN_LDSB1_CLR1_GSU0_GSUC0_GSUWGMRR0_K1_LBSPPA1024_LBSPPB512_LPA32_MIWT2_4_PLR1_SU32_SUM0_SUS256_SKXCCM6_VWA2_VWB4_WGM1_WGMXCC1_WGMXCCGn1
    SolutionIndex: 114
    SolutionNameMin: Cijk_Ailk_Bljk_HSS_BH_UserArgs_MT64x128x64_MI16x16x1_SN_LDSB1_CLR1_GSU0_GSUC0_GSUWGMRR0_K1_LBSPPA1024_LBSPPB128_LPA32_MIWT2_4_PLR1_SU32_SUM0_SUS256_SKXCCM6_VWA2_VWB1_WGM4_WGMXCC1_WGMXCCGn1
    SolutionIndex: 115
    SolutionNameMin: Cijk_Ailk_Bljk_HSS_BH_UserArgs_MT64x128x64_MI16x16x1_SN_LDSB1_CLR1_GSU0_GSUC0_GSUWGMRR0_K1_LBSPPA1024_LBSPPB256_LPA32_MIWT2_4_PLR1_SU32_SUM0_SUS256_SKXCCM6_VWA2_VWB2_WGM4_WGMXCC1_WGMXCCGn1
    SolutionIndex: 116
    SolutionNameMin: Cijk_Ailk_Bljk_HSS_BH_UserArgs_MT128x64x64_MI16x16x1_SN_LDSB1_CLR1_GSU0_GSUC0_GSUWGMRR0_K1_LBSPPA2048_LBSPPB128_LPA0_MIWT4_2_PLR1_SU32_SUM0_SUS256_SKXCCM6_VWA4_VWB1_WGM1_WGMXCC1_WGMXCCGn1
    SolutionIndex: 117
    SolutionNameMin: Cijk_Ailk_Bljk_HSS_BH_UserArgs_MT128x64x64_MI16x16x1_SN_LDSB1_CLR1_GSU0_GSUC0_GSUWGMRR0_K1_LBSPPA2048_LBSPPB256_LPA0_MIWT4_2_PLR1_SU32_SUM0_SUS256_SKXCCM6_VWA4_VWB2_WGM1_WGMXCC1_WGMXCCGn1
    SolutionIndex: 118
    SolutionNameMin: Cijk_Ailk_Bljk_HSS_BH_UserArgs_MT128x64x64_MI16x16x1_SN_LDSB1_CLR1_GSU0_GSUC0_GSUWGMRR0_K1_LBSPPA2048_LBSPPB256_LPA0_MIWT4_2_PLR1_SU32_SUM0_SUS256_SKXCCM6_VWA4_VWB2_WGM4_WGMXCC1_WGMXCCGn1
    SolutionIndex: 119
    SolutionNameMin: Cijk_Ailk_Bljk_HSS_BH_UserArgs_MT128x64x64_MI16x16x1_SN_LDSB1_CLR1_GSU0_GSUC0_GSUWGMRR0_K1_LBSPPA2048_LBSPPB256_LPA0_MIWT4_2_PLR1_SU32_SUM0_SUS256_SKXCCM6_VWA4_VWB2_WGM8_WGMXCC1_WGMXCCGn1
    SolutionIndex: 120
    SolutionNameMin: Cijk_Ailk_Bljk_HSS_BH_UserArgs_MT64x64x64_MI16x16x1_SN_LDSB1_CLR1_GSU0_GSUC0_GSUWGMRR0_K1_LBSPPA1024_LBSPPB256_LPA32_MIWT2_2_PLR1_SU32_SUM0_SUS256_SKXCCM6_VWA2_VWB2_WGM1_WGMXCC1_WGMXCCGn1
    SolutionIndex: 121
    SolutionNameMin: Cijk_Ailk_Bljk_HSS_BH_UserArgs_MT32x64x64_MI16x16x1_SN_LDSB0_CLR1_GSU0_GSUC0_GSUWGMRR0_K1_LBSPPA512_LBSPPB128_LPA16_MIWT1_2_PLR1_SU32_SUM0_SUS256_SKXCCM6_VWA1_VWB1_WGM1_WGMXCC1_WGMXCCGn1
    SolutionIndex: 122
    SolutionNameMin: Cijk_Ailk_Bljk_HSS_BH_UserArgs_MT64x32x64_MI16x16x1_SN_LDSB0_CLR1_GSU0_GSUC0_GSUWGMRR0_K1_LBSPPA1024_LBSPPB128_LPA32_MIWT2_1_PLR1_SU32_SUM0_SUS256_SKXCCM6_VWA2_VWB1_WGM1_WGMXCC1_WGMXCCGn1
    SolutionIndex: 123
    SolutionNameMin: Cijk_Ailk_Bljk_HSS_BH_UserArgs_MT32x32x64_MI16x16x1_SN_LDSB0_CLR1_GSU0_GSUC0_GSUWGMRR0_K1_LBSPPA512_LBSPPB128_LPA16_MIWT1_1_PLR1_SU32_SUM0_SUS256_SKXCCM6_VWA1_VWB1_WGM1_WGMXCC1_WGMXCCGn1
    SolutionIndex: 124
    SolutionNameMin: Cijk_Ailk_Bljk_HSS_BH_UserArgs_MT64x128x128_MI16x16x1_SN_LDSB1_CLR1_GSU0_GSUC0_GSUWGMRR0_K1_LBSPPA1024_LBSPPB1024_LPA32_MIWT2_4_PLR1_SU32_SUM0_SUS256_SKXCCM6_VWA2_VWB4_WGM4_WGMXCC1_WGMXCCGn1
    SolutionIndex: 125
    SolutionNameMin: Cijk_Ailk_Bljk_HSS_BH_UserArgs_MT64x128x128_MI16x16x1_SN_LDSB1_CLR1_GSU0_GSUC0_GSUWGMRR0_K1_LBSPPA1024_LBSPPB256_LPA32_MIWT2_4_PLR2_SU32_SUM0_SUS256_SKXCCM6_VWA2_VWB1_WGM4_WGMXCC1_WGMXCCGn1
    SolutionIndex: 126
    SolutionNameMin: Cijk_Ailk_Bljk_HSS_BH_UserArgs_MT64x128x128_MI16x16x1_SN_LDSB1_CLR1_GSU0_GSUC0_GSUWGMRR0_K1_LBSPPA1024_LBSPPB256_LPA32_MIWT2_4_PLR2_SU32_SUM0_SUS256_SKXCCM6_VWA2_VWB1_WGM8_WGMXCC1_WGMXCCGn1
    SolutionIndex: 127
    SolutionNameMin: Cijk_Ailk_Bljk_HSS_BH_UserArgs_MT64x128x128_MI16x16x1_SN_LDSB1_CLR1_GSU0_GSUC0_GSUWGMRR0_K1_LBSPPA1024_LBSPPB1024_LPA32_MIWT2_4_PLR2_SU32_SUM0_SUS256_SKXCCM6_VWA2_VWB4_WGM8_WGMXCC1_WGMXCCGn1
    SolutionIndex: 128
    SolutionNameMin: Cijk_Ailk_Bljk_HSS_BH_UserArgs_MT128x64x128_MI16x16x1_SN_LDSB1_CLR1_GSU0_GSUC0_GSUWGMRR0_K1_LBSPPA2048_LBSPPB256_LPA0_MIWT4_2_PLR1_SU32_SUM0_SUS256_SKXCCM6_VWA4_VWB1_WGM1_WGMXCC1_WGMXCCGn1
    SolutionIndex: 129
    SolutionNameMin: Cijk_Ailk_Bljk_HSS_BH_UserArgs_MT128x64x128_MI16x16x1_SN_LDSB1_CLR1_GSU0_GSUC0_GSUWGMRR0_K1_LBSPPA2048_LBSPPB512_LPA0_MIWT4_2_PLR1_SU32_SUM0_SUS256_SKXCCM6_VWA4_VWB2_WGM1_WGMXCC1_WGMXCCGn1
    SolutionIndex: 130
    SolutionNameMin: Cijk_Ailk_Bljk_HSS_BH_UserArgs_MT128x64x128_MI16x16x1_SN_LDSB1_CLR1_GSU0_GSUC0_GSUWGMRR0_K1_LBSPPA2048_LBSPPB256_LPA0_MIWT4_2_PLR2_SU32_SUM0_SUS256_SKXCCM6_VWA4_VWB1_WGM1_WGMXCC1_WGMXCCGn1
    SolutionIndex: 131
    SolutionNameMin: Cijk_Ailk_Bljk_HSS_BH_UserArgs_MT128x64x128_MI16x16x1_SN_LDSB1_CLR1_GSU0_GSUC0_GSUWGMRR0_K1_LBSPPA2048_LBSPPB512_LPA0_MIWT4_2_PLR2_SU32_SUM0_SUS256_SKXCCM6_VWA4_VWB2_WGM1_WGMXCC1_WGMXCCGn1
    SolutionIndex: 132
    SolutionNameMin: Cijk_Ailk_Bljk_HSS_BH_UserArgs_MT128x64x128_MI16x16x1_SN_LDSB1_CLR1_GSU0_GSUC0_GSUWGMRR0_K1_LBSPPA2048_LBSPPB256_LPA0_MIWT4_2_PLR2_SU32_SUM0_SUS256_SKXCCM6_VWA4_VWB1_WGM4_WGMXCC1_WGMXCCGn1
    SolutionIndex: 133
    SolutionNameMin: Cijk_Ailk_Bljk_HSS_BH_UserArgs_MT128x64x128_MI16x16x1_SN_LDSB1_CLR1_GSU0_GSUC0_GSUWGMRR0_K1_LBSPPA2048_LBSPPB512_LPA0_MIWT4_2_PLR2_SU32_SUM0_SUS256_SKXCCM6_VWA4_VWB2_WGM4_WGMXCC1_WGMXCCGn1
    SolutionIndex: 134
    SolutionNameMin: Cijk_Ailk_Bljk_HSS_BH_UserArgs_MT128x64x128_MI16x16x1_SN_LDSB1_CLR1_GSU0_GSUC0_GSUWGMRR0_K1_LBSPPA2048_LBSPPB256_LPA0_MIWT4_2_PLR2_SU32_SUM0_SUS256_SKXCCM6_VWA4_VWB1_WGM8_WGMXCC1_WGMXCCGn1
    SolutionIndex: 135
    SolutionNameMin: Cijk_Ailk_Bljk_HSS_BH_UserArgs_MT64x64x128_MI16x16x1_SN_LDSB1_CLR1_GSU0_GSUC0_GSUWGMRR0_K1_LBSPPA1024_LBSPPB256_LPA32_MIWT2_2_PLR2_SU32_SUM0_SUS256_SKXCCM6_VWA2_VWB1_WGM1_WGMXCC1_WGMXCCGn1
    SolutionIndex: 136
    SolutionNameMin: Cijk_Ailk_Bljk_HSS_BH_UserArgs_MT64x64x128_MI16x16x1_SN_LDSB1_CLR1_GSU0_GSUC0_GSUWGMRR0_K1_LBSPPA1024_LBSPPB512_LPA32_MIWT2_2_PLR2_SU32_SUM0_SUS256_SKXCCM6_VWA2_VWB2_WGM1_WGMXCC1_WGMXCCGn1
    SolutionIndex: 137
    SolutionNameMin: Cijk_Ailk_Bljk_HSS_BH_UserArgs_MT64x64x128_MI16x16x1_SN_LDSB1_CLR1_GSU0_GSUC0_GSUWGMRR0_K1_LBSPPA1024_LBSPPB256_LPA32_MIWT2_2_PLR2_SU32_SUM0_SUS256_SKXCCM6_VWA2_VWB1_WGM4_WGMXCC1_WGMXCCGn1
    SolutionIndex: 138
    SolutionNameMin: Cijk_Ailk_Bljk_HSS_BH_UserArgs_MT64x64x128_MI16x16x1_SN_LDSB1_CLR1_GSU0_GSUC0_GSUWGMRR0_K1_LBSPPA1024_LBSPPB512_LPA32_MIWT2_2_PLR2_SU32_SUM0_SUS256_SKXCCM6_VWA2_VWB2_WGM8_WGMXCC1_WGMXCCGn1
    SolutionIndex: 139
    SolutionNameMin: Cijk_Ailk_Bljk_HSS_BH_UserArgs_MT64x32x128_MI16x16x1_SN_LDSB1_CLR1_GSU0_GSUC0_GSUWGMRR0_K1_LBSPPA1024_LBSPPB256_LPA32_MIWT2_1_PLR2_SU32_SUM0_SUS256_SKXCCM6_VWA2_VWB1_WGM1_WGMXCC1_WGMXCCGn1
    SolutionIndex: 140
    SolutionNameMin: Cijk_Ailk_Bljk_HSS_BH_UserArgs_MT64x32x128_MI16x16x1_SN_LDSB1_CLR1_GSU0_GSUC0_GSUWGMRR0_K1_LBSPPA1024_LBSPPB256_LPA32_MIWT2_1_PLR2_SU32_SUM0_SUS256_SKXCCM6_VWA2_VWB1_WGM8_WGMXCC1_WGMXCCGn1
    SolutionIndex: 141
    SolutionNameMin: Cijk_Ailk_Bljk_HSS_BH_UserArgs_MT32x32x128_MI16x16x1_SN_LDSB1_CLR1_GSU0_GSUC0_GSUWGMRR0_K1_LBSPPA512_LBSPPB256_LPA16_MIWT1_1_PLR2_SU32_SUM0_SUS256_SKXCCM6_VWA1_VWB1_WGM1_WGMXCC1_WGMXCCGn1
    SolutionIndex: 142
    SolutionNameMin: Cijk_Ailk_Bljk_HSS_BH_UserArgs_MT32x32x128_MI16x16x1_SN_LDSB1_CLR1_GSU0_GSUC0_GSUWGMRR0_K1_LBSPPA512_LBSPPB256_LPA16_MIWT1_1_PLR2_SU32_SUM0_SUS256_SKXCCM6_VWA1_VWB1_WGM8_WGMXCC1_WGMXCCGn1
    SolutionIndex: 143
    SolutionNameMin: Cijk_Ailk_Bljk_HSS_BH_UserArgs_MT32x32x32_MI16x16x1_SN_LDSB0_CLR1_GSU0_GSUC0_GSUWGMRR0_K1_LBSPPA256_LBSPPB128_LPA16_MIWT1_1_PLR1_SU32_SUM0_SUS256_SKXCCM0_VWA1_VWB1_WGM8_WGMXCC1_WGMXCCGn1
- - - [128, 128, 1, 128, 128, 128, 128, 128]
    - [63, 0.08]
  - - [128, 128, 1, 256, 128, 128, 128, 256]
    - [142, 0.145]
  - - [128, 128, 1, 512, 128, 128, 128, 512]
    - [62, 0.247]
  - - [128, 128, 1, 1024, 128, 128, 128, 1024]
    - [64, 0.384]
  - - [128, 128, 1, 2048, 128, 128, 128, 2048]
    - [61, 0.59]
  - - [128, 128, 1, 4096, 128, 128, 128, 4096]
    - [50, 1.011]
  - - [128, 128, 1, 8192, 128, 128, 128, 8192]
    - [61, 1.555]
  - - [128, 256, 1, 128, 128, 128, 128, 128]
    - [50, 0.169]
  - - [128, 256, 1, 256, 128, 128, 128, 256]
    - [50, 0.31]
  - - [128, 256, 1, 512, 128, 128, 128, 512]
    - [60, 0.508]
  - - [128, 256, 1, 1024, 128, 128, 128, 1024]
    - [60, 0.785]
  - - [128, 256, 1, 2048, 128, 128, 128, 2048]
    - [61, 1.177]
  - - [128, 256, 1, 4096, 128, 128, 128, 4096]
    - [123, 2.011]
  - - [128, 256, 1, 8192, 128, 128, 128, 8192]
    - [141, 3.07]
  - - [128, 512, 1, 128, 128, 128, 128, 128]
    - [19, 0.298]
  - - [128, 512, 1, 256, 128, 128, 128, 256]
    - [50, 0.603]
  - - [128, 512, 1, 512, 128, 128, 128, 512]
    - [50, 1.011]
  - - [128, 512, 1, 1024, 128, 128, 128, 1024]
    - [61, 1.561]
  - - [128, 512, 1, 2048, 128, 128, 128, 2048]
    - [61, 2.271]
  - - [128, 512, 1, 4096, 128, 128, 128, 4096]
    - [121, 3.455]
  - - [128, 512, 1, 8192, 128, 128, 128, 8192]
    - [139, 5.424]
  - - [128, 1024, 1, 128, 128, 128, 128, 128]
    - [50, 0.648]
  - - [128, 1024, 1, 256, 128, 128, 128, 256]
    - [50, 1.171]
  - - [128, 1024, 1, 512, 128, 128, 128, 512]
    - [60, 1.952]
  - - [128, 1024, 1, 1024, 128, 128, 128, 1024]
    - [60, 3.006]
  - - [128, 1024, 1, 2048, 128, 128, 128, 2048]
    - [139, 3.998]
  - - [128, 1024, 1, 4096, 128, 128, 128, 4096]
    - [139, 5.966]
  - - [128, 1024, 1, 8192, 128, 128, 128, 8192]
    - [135, 8.54]
  - - [128, 2048, 1, 128, 128, 128, 128, 128]
    - [49, 1.2]
  - - [128, 2048, 1, 256, 128, 128, 128, 256]
    - [49, 2.099]
  - - [128, 2048, 1, 512, 128, 128, 128, 512]
    - [139, 3.454]
  - - [128, 2048, 1, 1024, 128, 128, 128, 1024]
    - [139, 5.323]
  - - [128, 2048, 1, 2048, 128, 128, 128, 2048]
    - [135, 6.668]
  - - [128, 2048, 1, 4096, 128, 128, 128, 4096]
    - [136, 9.463]
  - - [128, 2048, 1, 8192, 128, 128, 128, 8192]
    - [130, 12.749]
  - - [128, 4096, 1, 128, 128, 128, 128, 128]
    - [45, 2.003]
  - - [128, 4096, 1, 256, 128, 128, 128, 256]
    - [45, 3.558]
  - - [128, 4096, 1, 512, 128, 128, 128, 512]
    - [54, 5.832]
  - - [128, 4096, 1, 1024, 128, 128, 128, 1024]
    - [56, 8.539]
  - - [128, 4096, 1, 2048, 128, 128, 128, 2048]
    - [130, 10.455]
  - - [128, 4096, 1, 4096, 128, 128, 128, 4096]
    - [116, 12.739]
  - - [128, 4096, 1, 8192, 128, 128, 128, 8192]
    - [134, 15.912]
  - - [128, 8192, 1, 128, 128, 128, 128, 128]
    - [42, 3.192]
  - - [128, 8192, 1, 256, 128, 128, 128, 256]
    - [41, 5.568]
  - - [128, 8192, 1, 512, 128, 128, 128, 512]
    - [41, 8.821]
  - - [128, 8192, 1, 1024, 128, 128, 128, 1024]
    - [51, 12.693]
  - - [128, 8192, 1, 2048, 128, 128, 128, 2048]
    - [135, 12.763]
  - - [128, 8192, 1, 4096, 128, 128, 128, 4096]
    - [132, 16.371]
  - - [128, 8192, 1, 8192, 128, 128, 128, 8192]
    - [52, 19.496]
  - - [256, 128, 1, 128, 256, 256, 256, 128]
    - [50, 0.169]
  - - [256, 128, 1, 256, 256, 256, 256, 256]
    - [50, 0.304]
  - - [256, 128, 1, 512, 256, 256, 256, 512]
    - [60, 0.51]
  - - [256, 128, 1, 1024, 256, 256, 256, 1024]
    - [61, 0.782]
  - - [256, 128, 1, 2048, 256, 256, 256, 2048]
    - [61, 1.162]
  - - [256, 128, 1, 4096, 256, 256, 256, 4096]
    - [123, 2.013]
  - - [256, 128, 1, 8192, 256, 256, 256, 8192]
    - [60, 3.067]
  - - [256, 256, 1, 128, 256, 256, 256, 128]
    - [50, 0.333]
  - - [256, 256, 1, 256, 256, 256, 256, 256]
    - [50, 0.603]
  - - [256, 256, 1, 512, 256, 256, 256, 512]
    - [50, 1.004]
  - - [256, 256, 1, 1024, 256, 256, 256, 1024]
    - [61, 1.552]
  - - [256, 256, 1, 2048, 256, 256, 256, 2048]
    - [61, 2.266]
  - - [256, 256, 1, 4096, 256, 256, 256, 4096]
    - [122, 3.401]
  - - [256, 256, 1, 8192, 256, 256, 256, 8192]
    - [58, 5.324]
  - - [256, 512, 1, 128, 256, 256, 256, 128]
    - [50, 0.643]
  - - [256, 512, 1, 256, 256, 256, 256, 256]
    - [50, 1.165]
  - - [256, 512, 1, 512, 256, 256, 256, 512]
    - [60, 1.944]
  - - [256, 512, 1, 1024, 256, 256, 256, 1024]
    - [60, 3.005]
  - - [256, 512, 1, 2048, 256, 256, 256, 2048]
    - [139, 3.962]
  - - [256, 512, 1, 4096, 256, 256, 256, 4096]
    - [139, 5.964]
  - - [256, 512, 1, 8192, 256, 256, 256, 8192]
    - [135, 7.907]
  - - [256, 1024, 1, 128, 256, 256, 256, 128]
    - [48, 1.185]
  - - [256, 1024, 1, 256, 256, 256, 256, 256]
    - [48, 2.093]
  - - [256, 1024, 1, 512, 256, 256, 256, 512]
    - [58, 3.469]
  - - [256, 1024, 1, 1024, 256, 256, 256, 1024]
    - [58, 5.303]
  - - [256, 1024, 1, 2048, 256, 256, 256, 2048]
    - [135, 6.736]
  - - [256, 1024, 1, 4096, 256, 256, 256, 4096]
    - [139, 9.456]
  - - [256, 1024, 1, 8192, 256, 256, 256, 8192]
    - [131, 12.38]
  - - [256, 2048, 1, 128, 256, 256, 256, 128]
    - [120, 1.981]
  - - [256, 2048, 1, 256, 256, 256, 256, 256]
    - [120, 3.465]
  - - [256, 2048, 1, 512, 256, 256, 256, 512]
    - [55, 5.779]
  - - [256, 2048, 1, 1024, 256, 256, 256, 1024]
    - [135, 8.502]
  - - [256, 2048, 1, 2048, 256, 256, 256, 2048]
    - [135, 10.489]
  - - [256, 2048, 1, 4096, 256, 256, 256, 4096]
    - [117, 13.377]
  - - [256, 2048, 1, 8192, 256, 256, 256, 8192]
    - [100, 15.546]
  - - [256, 4096, 1, 128, 256, 256, 256, 128]
    - [18, 3.208]
  - - [256, 4096, 1, 256, 256, 256, 256, 256]
    - [42, 5.525]
  - - [256, 4096, 1, 512, 256, 256, 256, 512]
    - [119, 8.695]
  - - [256, 4096, 1, 1024, 256, 256, 256, 1024]
    - [133, 12.711]
  - - [256, 4096, 1, 2048, 256, 256, 256, 2048]
    - [135, 13.45]
  - - [256, 4096, 1, 4096, 256, 256, 256, 4096]
    - [100, 16.771]
  - - [256, 4096, 1, 8192, 256, 256, 256, 8192]
    - [32, 18.671]
  - - [256, 8192, 1, 128, 256, 256, 256, 128]
    - [16, 4.648]
  - - [256, 8192, 1, 256, 256, 256, 256, 256]
    - [99, 7.74]
  - - [256, 8192, 1, 512, 256, 256, 256, 512]
    - [100, 12.216]
  - - [256, 8192, 1, 1024, 256, 256, 256, 1024]
    - [116, 13.059]
  - - [256, 8192, 1, 2048, 256, 256, 256, 2048]
    - [129, 16.754]
  - - [256, 8192, 1, 4096, 256, 256, 256, 4096]
    - [97, 20.504]
  - - [256, 8192, 1, 8192, 256, 256, 256, 8192]
    - [27, 23.305]
  - - [512, 128, 1, 128, 512, 512, 512, 128]
    - [50, 0.336]
  - - [512, 128, 1, 256, 512, 512, 512, 256]
    - [50, 0.601]
  - - [512, 128, 1, 512, 512, 512, 512, 512]
    - [50, 1.011]
  - - [512, 128, 1, 1024, 512, 512, 512, 1024]
    - [60, 1.54]
  - - [512, 128, 1, 2048, 512, 512, 512, 2048]
    - [61, 2.27]
  - - [512, 128, 1, 4096, 512, 512, 512, 4096]
    - [49, 3.354]
  - - [512, 128, 1, 8192, 512, 512, 512, 8192]
    - [140, 4.973]
  - - [512, 256, 1, 128, 512, 512, 512, 128]
    - [50, 0.648]
  - - [512, 256, 1, 256, 512, 512, 512, 256]
    - [50, 1.171]
  - - [512, 256, 1, 512, 512, 512, 512, 512]
    - [61, 1.962]
  - - [512, 256, 1, 1024, 512, 512, 512, 1024]
    - [61, 3.033]
  - - [512, 256, 1, 2048, 512, 512, 512, 2048]
    - [139, 3.955]
  - - [512, 256, 1, 4096, 512, 512, 512, 4096]
    - [59, 5.816]
  - - [512, 256, 1, 8192, 512, 512, 512, 8192]
    - [53, 7.88]
  - - [512, 512, 1, 128, 512, 512, 512, 128]
    - [48, 1.18]
  - - [512, 512, 1, 256, 512, 512, 512, 256]
    - [49, 2.051]
  - - [512, 512, 1, 512, 512, 512, 512, 512]
    - [57, 3.427]
  - - [512, 512, 1, 1024, 512, 512, 512, 1024]
    - [58, 5.271]
  - - [512, 512, 1, 2048, 512, 512, 512, 2048]
    - [136, 6.644]
  - - [512, 512, 1, 4096, 512, 512, 512, 4096]
    - [117, 9.061]
  - - [512, 512, 1, 8192, 512, 512, 512, 8192]
    - [133, 12.262]
  - - [512, 1024, 1, 128, 512, 512, 512, 128]
    - [46, 2.025]
  - - [512, 1024, 1, 256, 512, 512, 512, 256]
    - [45, 3.526]
  - - [512, 1024, 1, 512, 512, 512, 512, 512]
    - [53, 5.823]
  - - [512, 1024, 1, 1024, 512, 512, 512, 1024]
    - [53, 8.698]
  - - [512, 1024, 1, 2048, 512, 512, 512, 2048]
    - [120, 10.129]
  - - [512, 1024, 1, 4096, 512, 512, 512, 4096]
    - [99, 12.825]
  - - [512, 1024, 1, 8192, 512, 512, 512, 8192]
    - [99, 14.97]
  - - [512, 2048, 1, 128, 512, 512, 512, 128]
    - [44, 3.17]
  - - [512, 2048, 1, 256, 512, 512, 512, 256]
    - [44, 5.459]
  - - [512, 2048, 1, 512, 512, 512, 512, 512]
    - [44, 8.718]
  - - [512, 2048, 1, 1024, 512, 512, 512, 1024]
    - [128, 12.814]
  - - [512, 2048, 1, 2048, 512, 512, 512, 2048]
    - [117, 13.771]
  - - [512, 2048, 1, 4096, 512, 512, 512, 4096]
    - [38, 16.025]
  - - [512, 2048, 1, 8192, 512, 512, 512, 8192]
    - [92, 17.765]
  - - [512, 4096, 1, 128, 512, 512, 512, 128]
    - [13, 4.674]
  - - [512, 4096, 1, 256, 512, 512, 512, 256]
    - [100, 7.801]
  - - [512, 4096, 1, 512, 512, 512, 512, 512]
    - [100, 12.332]
  - - [512, 4096, 1, 1024, 512, 512, 512, 1024]
    - [132, 13.127]
  - - [512, 4096, 1, 2048, 512, 512, 512, 2048]
    - [116, 16.716]
  - - [512, 4096, 1, 4096, 512, 512, 512, 4096]
    - [31, 19.728]
  - - [512, 4096, 1, 8192, 512, 512, 512, 8192]
    - [29, 21.122]
  - - [512, 8192, 1, 128, 512, 512, 512, 128]
    - [77, 5.594]
  - - [512, 8192, 1, 256, 512, 512, 512, 256]
    - [78, 9.461]
  - - [512, 8192, 1, 512, 512, 512, 512, 512]
    - [26, 13.973]
  - - [512, 8192, 1, 1024, 512, 512, 512, 1024]
    - [128, 16.327]
  - - [512, 8192, 1, 2048, 512, 512, 512, 2048]
    - [106, 20.027]
  - - [512, 8192, 1, 4096, 512, 512, 512, 4096]
    - [30, 23.444]
  - - [512, 8192, 1, 8192, 512, 512, 512, 8192]
    - [26, 24.798]
  - - [1024, 128, 1, 128, 1024, 1024, 1024, 128]
    - [50, 0.64]
  - - [1024, 128, 1, 256, 1024, 1024, 1024, 256]
    - [50, 1.157]
  - - [1024, 128, 1, 512, 1024, 1024, 1024, 512]
    - [50, 1.946]
  - - [1024, 128, 1, 1024, 1024, 1024, 1024, 1024]
    - [61, 3.016]
  - - [1024, 128, 1, 2048, 1024, 1024, 1024, 2048]
    - [58, 3.901]
  - - [1024, 128, 1, 4096, 1024, 1024, 1024, 4096]
    - [47, 5.554]
  - - [1024, 128, 1, 8192, 1024, 1024, 1024, 8192]
    - [137, 7.886]
  - - [1024, 256, 1, 128, 1024, 1024, 1024, 128]
    - [49, 1.18]
  - - [1024, 256, 1, 256, 1024, 1024, 1024, 256]
    - [49, 2.077]
  - - [1024, 256, 1, 512, 1024, 1024, 1024, 512]
    - [58, 3.477]
  - - [1024, 256, 1, 1024, 1024, 1024, 1024, 1024]
    - [58, 5.315]
  - - [1024, 256, 1, 2048, 1024, 1024, 1024, 2048]
    - [53, 6.512]
  - - [1024, 256, 1, 4096, 1024, 1024, 1024, 4096]
    - [118, 8.86]
  - - [1024, 256, 1, 8192, 1024, 1024, 1024, 8192]
    - [132, 12.168]
  - - [1024, 512, 1, 128, 1024, 1024, 1024, 128]
    - [46, 2.02]
  - - [1024, 512, 1, 256, 1024, 1024, 1024, 256]
    - [45, 3.516]
  - - [1024, 512, 1, 512, 1024, 1024, 1024, 512]
    - [54, 5.854]
  - - [1024, 512, 1, 1024, 1024, 1024, 1024, 1024]
    - [53, 8.652]
  - - [1024, 512, 1, 2048, 1024, 1024, 1024, 2048]
    - [51, 10.066]
  - - [1024, 512, 1, 4096, 1024, 1024, 1024, 4096]
    - [118, 12.738]
  - - [1024, 512, 1, 8192, 1024, 1024, 1024, 8192]
    - [102, 14.824]
  - - [1024, 1024, 1, 128, 1024, 1024, 1024, 128]
    - [18, 3.228]
  - - [1024, 1024, 1, 256, 1024, 1024, 1024, 256]
    - [41, 5.511]
  - - [1024, 1024, 1, 512, 1024, 1024, 1024, 512]
    - [44, 8.832]
  - - [1024, 1024, 1, 1024, 1024, 1024, 1024, 1024]
    - [131, 12.646]
  - - [1024, 1024, 1, 2048, 1024, 1024, 1024, 2048]
    - [112, 12.734]
  - - [1024, 1024, 1, 4096, 1024, 1024, 1024, 4096]
    - [36, 15.539]
  - - [1024, 1024, 1, 8192, 1024, 1024, 1024, 8192]
    - [86, 17.561]
  - - [1024, 2048, 1, 128, 1024, 1024, 1024, 128]
    - [84, 4.584]
  - - [1024, 2048, 1, 256, 1024, 1024, 1024, 256]
    - [99, 7.849]
  - - [1024, 2048, 1, 512, 1024, 1024, 1024, 512]
    - [99, 12.216]
  - - [1024, 2048, 1, 1024, 1024, 1024, 1024, 1024]
    - [113, 12.937]
  - - [1024, 2048, 1, 2048, 1024, 1024, 1024, 2048]
    - [101, 15.979]
  - - [1024, 2048, 1, 4096, 1024, 1024, 1024, 4096]
    - [89, 19.107]
  - - [1024, 2048, 1, 8192, 1024, 1024, 1024, 8192]
    - [30, 20.852]
  - - [1024, 4096, 1, 128, 1024, 1024, 1024, 128]
    - [77, 5.552]
  - - [1024, 4096, 1, 256, 1024, 1024, 1024, 256]
    - [12, 9.364]
  - - [1024, 4096, 1, 512, 1024, 1024, 1024, 512]
    - [26, 14.128]
  - - [1024, 4096, 1, 1024, 1024, 1024, 1024, 1024]
    - [104, 16.07]
  - - [1024, 4096, 1, 2048, 1024, 1024, 1024, 2048]
    - [106, 19.34]
  - - [1024, 4096, 1, 4096, 1024, 1024, 1024, 4096]
    - [29, 21.468]
  - - [1024, 4096, 1, 8192, 1024, 1024, 1024, 8192]
    - [31, 23.462]
  - - [1024, 8192, 1, 128, 1024, 1024, 1024, 128]
    - [5, 6.231]
  - - [1024, 8192, 1, 256, 1024, 1024, 1024, 256]
    - [6, 10.48]
  - - [1024, 8192, 1, 512, 1024, 1024, 1024, 512]
    - [98, 13.944]
  - - [1024, 8192, 1, 1024, 1024, 1024, 1024, 1024]
    - [98, 18.58]
  - - [1024, 8192, 1, 2048, 1024, 1024, 1024, 2048]
    - [27, 21.727]
  - - [1024, 8192, 1, 4096, 1024, 1024, 1024, 4096]
    - [28, 23.965]
  - - [1024, 8192, 1, 8192, 1024, 1024, 1024, 8192]
    - [73, 24.897]
  - - [2048, 128, 1, 128, 2048, 2048, 2048, 128]
    - [49, 1.205]
  - - [2048, 128, 1, 256, 2048, 2048, 2048, 256]
    - [58, 2.107]
  - - [2048, 128, 1, 512, 2048, 2048, 2048, 512]
    - [58, 3.45]
  - - [2048, 128, 1, 1024, 2048, 2048, 2048, 1024]
    - [58, 5.286]
  - - [2048, 128, 1, 2048, 2048, 2048, 2048, 2048]
    - [56, 6.132]
  - - [2048, 128, 1, 4096, 2048, 2048, 2048, 4096]
    - [119, 9.01]
  - - [2048, 128, 1, 8192, 2048, 2048, 2048, 8192]
    - [134, 12.223]
  - - [2048, 256, 1, 128, 2048, 2048, 2048, 128]
    - [120, 2.011]
  - - [2048, 256, 1, 256, 2048, 2048, 2048, 256]
    - [45, 3.515]
  - - [2048, 256, 1, 512, 2048, 2048, 2048, 512]
    - [53, 5.827]
  - - [2048, 256, 1, 1024, 2048, 2048, 2048, 1024]
    - [53, 8.682]
  - - [2048, 256, 1, 2048, 2048, 2048, 2048, 2048]
    - [134, 9.981]
  - - [2048, 256, 1, 4096, 2048, 2048, 2048, 4096]
    - [110, 12.85]
  - - [2048, 256, 1, 8192, 2048, 2048, 2048, 8192]
    - [109, 15.534]
  - - [2048, 512, 1, 128, 2048, 2048, 2048, 128]
    - [18, 3.238]
  - - [2048, 512, 1, 256, 2048, 2048, 2048, 256]
    - [117, 5.553]
  - - [2048, 512, 1, 512, 2048, 2048, 2048, 512]
    - [117, 8.809]
  - - [2048, 512, 1, 1024, 2048, 2048, 2048, 1024]
    - [133, 12.572]
  - - [2048, 512, 1, 2048, 2048, 2048, 2048, 2048]
    - [137, 12.977]
  - - [2048, 512, 1, 4096, 2048, 2048, 2048, 4096]
    - [107, 15.597]
  - - [2048, 512, 1, 8192, 2048, 2048, 2048, 8192]
    - [92, 17.769]
  - - [2048, 1024, 1, 128, 2048, 2048, 2048, 128]
    - [83, 4.539]
  - - [2048, 1024, 1, 256, 2048, 2048, 2048, 256]
    - [99, 7.612]
  - - [2048, 1024, 1, 512, 2048, 2048, 2048, 512]
    - [34, 12.082]
  - - [2048, 1024, 1, 1024, 2048, 2048, 2048, 1024]
    - [125, 13.11]
  - - [2048, 1024, 1, 2048, 2048, 2048, 2048, 2048]
    - [124, 16.271]
  - - [2048, 1024, 1, 4096, 2048, 2048, 2048, 4096]
    - [92, 19.398]
  - - [2048, 1024, 1, 8192, 2048, 2048, 2048, 8192]
    - [23, 20.187]
  - - [2048, 2048, 1, 128, 2048, 2048, 2048, 128]
    - [79, 5.769]
  - - [2048, 2048, 1, 256, 2048, 2048, 2048, 256]
    - [79, 9.622]
  - - [2048, 2048, 1, 512, 2048, 2048, 2048, 512]
    - [20, 14.376]
  - - [2048, 2048, 1, 1024, 2048, 2048, 2048, 1024]
    - [103, 15.771]
  - - [2048, 2048, 1, 2048, 2048, 2048, 2048, 2048]
    - [98, 19.537]
  - - [2048, 2048, 1, 4096, 2048, 2048, 2048, 4096]
    - [92, 21.472]
  - - [2048, 2048, 1, 8192, 2048, 2048, 2048, 8192]
    - [90, 23.98]
  - - [2048, 4096, 1, 128, 2048, 2048, 2048, 128]
    - [4, 6.25]
  - - [2048, 4096, 1, 256, 2048, 2048, 2048, 256]
    - [4, 10.564]
  - - [2048, 4096, 1, 512, 2048, 2048, 2048, 512]
    - [98, 13.996]
  - - [2048, 4096, 1, 1024, 2048, 2048, 2048, 1024]
    - [108, 18.609]
  - - [2048, 4096, 1, 2048, 2048, 2048, 2048, 2048]
    - [87, 21.438]
  - - [2048, 4096, 1, 4096, 2048, 2048, 2048, 4096]
    - [89, 23.622]
  - - [2048, 4096, 1, 8192, 2048, 2048, 2048, 8192]
    - [74, 25.661]
  - - [2048, 8192, 1, 128, 2048, 2048, 2048, 128]
    - [44, 6.688]
  - - [2048, 8192, 1, 256, 2048, 2048, 2048, 256]
    - [99, 10.516]
  - - [2048, 8192, 1, 512, 2048, 2048, 2048, 512]
    - [98, 15.619]
  - - [2048, 8192, 1, 1024, 2048, 2048, 2048, 1024]
    - [86, 19.675]
  - - [2048, 8192, 1, 2048, 2048, 2048, 2048, 2048]
    - [98, 22.892]
  - - [2048, 8192, 1, 4096, 2048, 2048, 2048, 4096]
    - [98, 25.883]
  - - [2048, 8192, 1, 8192, 2048, 2048, 2048, 8192]
    - [92, 27.206]
  - - [4096, 128, 1, 128, 4096, 4096, 4096, 128]
    - [46, 2.027]
  - - [4096, 128, 1, 256, 4096, 4096, 4096, 256]
    - [47, 3.492]
  - - [4096, 128, 1, 512, 4096, 4096, 4096, 512]
    - [54, 5.787]
  - - [4096, 128, 1, 1024, 4096, 4096, 4096, 1024]
    - [138, 8.332]
  - - [4096, 128, 1, 2048, 4096, 4096, 4096, 2048]
    - [132, 10.023]
  - - [4096, 128, 1, 4096, 4096, 4096, 4096, 4096]
    - [104, 12.897]
  - - [4096, 128, 1, 8192, 4096, 4096, 4096, 8192]
    - [110, 15.294]
  - - [4096, 256, 1, 128, 4096, 4096, 4096, 128]
    - [17, 3.191]
  - - [4096, 256, 1, 256, 4096, 4096, 4096, 256]
    - [117, 5.511]
  - - [4096, 256, 1, 512, 4096, 4096, 4096, 512]
    - [118, 8.627]
  - - [4096, 256, 1, 1024, 4096, 4096, 4096, 1024]
    - [134, 12.428]
  - - [4096, 256, 1, 2048, 4096, 4096, 4096, 2048]
    - [115, 13.376]
  - - [4096, 256, 1, 4096, 4096, 4096, 4096, 4096]
    - [111, 16.396]
  - - [4096, 256, 1, 8192, 4096, 4096, 4096, 8192]
    - [100, 18.175]
  - - [4096, 512, 1, 128, 4096, 4096, 4096, 128]
    - [82, 4.478]
  - - [4096, 512, 1, 256, 4096, 4096, 4096, 256]
    - [37, 7.504]
  - - [4096, 512, 1, 512, 4096, 4096, 4096, 512]
    - [104, 12.002]
  - - [4096, 512, 1, 1024, 4096, 4096, 4096, 1024]
    - [126, 13.281]
  - - [4096, 512, 1, 2048, 4096, 4096, 4096, 2048]
    - [125, 16.554]
  - - [4096, 512, 1, 4096, 4096, 4096, 4096, 4096]
    - [96, 19.081]
  - - [4096, 512, 1, 8192, 4096, 4096, 4096, 8192]
    - [90, 21.522]
  - - [4096, 1024, 1, 128, 4096, 4096, 4096, 128]
    - [76, 5.657]
  - - [4096, 1024, 1, 256, 4096, 4096, 4096, 256]
    - [11, 9.305]
  - - [4096, 1024, 1, 512, 4096, 4096, 4096, 512]
    - [93, 14.098]
  - - [4096, 1024, 1, 1024, 4096, 4096, 4096, 1024]
    - [109, 15.695]
  - - [4096, 1024, 1, 2048, 4096, 4096, 4096, 2048]
    - [103, 19.924]
  - - [4096, 1024, 1, 4096, 4096, 4096, 4096, 4096]
    - [89, 22.177]
  - - [4096, 1024, 1, 8192, 4096, 4096, 4096, 8192]
    - [89, 24.761]
  - - [4096, 2048, 1, 128, 4096, 4096, 4096, 128]
    - [3, 6.235]
  - - [4096, 2048, 1, 256, 4096, 4096, 4096, 256]
    - [2, 10.482]
  - - [4096, 2048, 1, 512, 4096, 4096, 4096, 512]
    - [110, 13.867]
  - - [4096, 2048, 1, 1024, 4096, 4096, 4096, 1024]
    - [94, 19.013]
  - - [4096, 2048, 1, 2048, 4096, 4096, 4096, 2048]
    - [99, 21.918]
  - - [4096, 2048, 1, 4096, 4096, 4096, 4096, 4096]
    - [91, 24.326]
  - - [4096, 2048, 1, 8192, 4096, 4096, 4096, 8192]
    - [68, 26.385]
  - - [4096, 4096, 1, 128, 4096, 4096, 4096, 128]
    - [44, 6.404]
  - - [4096, 4096, 1, 256, 4096, 4096, 4096, 256]
    - [98, 10.646]
  - - [4096, 4096, 1, 512, 4096, 4096, 4096, 512]
    - [98, 15.346]
  - - [4096, 4096, 1, 1024, 4096, 4096, 4096, 1024]
    - [104, 19.588]
  - - [4096, 4096, 1, 2048, 4096, 4096, 4096, 2048]
    - [89, 24.83]
  - - [4096, 4096, 1, 4096, 4096, 4096, 4096, 4096]
    - [89, 28.504]
  - - [4096, 4096, 1, 8192, 4096, 4096, 4096, 8192]
    - [71, 28.034]
  - - [4096, 8192, 1, 128, 4096, 4096, 4096, 128]
    - [14, 6.627]
  - - [4096, 8192, 1, 256, 4096, 4096, 4096, 256]
    - [98, 10.775]
  - - [4096, 8192, 1, 512, 4096, 4096, 4096, 512]
    - [104, 15.138]
  - - [4096, 8192, 1, 1024, 4096, 4096, 4096, 1024]
    - [95, 19.793]
  - - [4096, 8192, 1, 2048, 4096, 4096, 4096, 2048]
    - [22, 25.039]
  - - [4096, 8192, 1, 4096, 4096, 4096, 4096, 4096]
    - [74, 29.204]
  - - [4096, 8192, 1, 8192, 4096, 4096, 4096, 8192]
    - [75, 32.563]
  - - [8192, 128, 1, 128, 8192, 8192, 8192, 128]
    - [85, 3.182]
  - - [8192, 128, 1, 256, 8192, 8192, 8192, 256]
    - [43, 5.507]
  - - [8192, 128, 1, 512, 8192, 8192, 8192, 512]
    - [118, 8.651]
  - - [8192, 128, 1, 1024, 8192, 8192, 8192, 1024]
    - [132, 12.176]
  - - [8192, 128, 1, 2048, 8192, 8192, 8192, 2048]
    - [40, 13.042]
  - - [8192, 128, 1, 4096, 8192, 8192, 8192, 4096]
    - [39, 16.465]
  - - [8192, 128, 1, 8192, 8192, 8192, 8192, 8192]
    - [35, 18.978]
  - - [8192, 256, 1, 128, 8192, 8192, 8192, 128]
    - [15, 4.491]
  - - [8192, 256, 1, 256, 8192, 8192, 8192, 256]
    - [98, 7.547]
  - - [8192, 256, 1, 512, 8192, 8192, 8192, 512]
    - [105, 11.971]
  - - [8192, 256, 1, 1024, 8192, 8192, 8192, 1024]
    - [114, 12.837]
  - - [8192, 256, 1, 2048, 8192, 8192, 8192, 2048]
    - [127, 16.767]
  - - [8192, 256, 1, 4096, 8192, 8192, 8192, 4096]
    - [99, 20.289]
  - - [8192, 256, 1, 8192, 8192, 8192, 8192, 8192]
    - [22, 23.201]
  - - [8192, 512, 1, 128, 8192, 8192, 8192, 128]
    - [81, 5.565]
  - - [8192, 512, 1, 256, 8192, 8192, 8192, 256]
    - [80, 9.379]
  - - [8192, 512, 1, 512, 8192, 8192, 8192, 512]
    - [25, 13.791]
  - - [8192, 512, 1, 1024, 8192, 8192, 8192, 1024]
    - [104, 15.565]
  - - [8192, 512, 1, 2048, 8192, 8192, 8192, 2048]
    - [109, 19.577]
  - - [8192, 512, 1, 4096, 8192, 8192, 8192, 4096]
    - [24, 22.838]
  - - [8192, 512, 1, 8192, 8192, 8192, 8192, 8192]
    - [86, 26.095]
  - - [8192, 1024, 1, 128, 8192, 8192, 8192, 128]
    - [0, 6.094]
  - - [8192, 1024, 1, 256, 8192, 8192, 8192, 256]
    - [1, 10.212]
  - - [8192, 1024, 1, 512, 8192, 8192, 8192, 512]
    - [104, 13.935]
  - - [8192, 1024, 1, 1024, 8192, 8192, 8192, 1024]
    - [110, 18.366]
  - - [8192, 1024, 1, 2048, 8192, 8192, 8192, 2048]
    - [89, 22.424]
  - - [8192, 1024, 1, 4096, 8192, 8192, 8192, 4096]
    - [88, 24.821]
  - - [8192, 1024, 1, 8192, 8192, 8192, 8192, 8192]
    - [65, 27.358]
  - - [8192, 2048, 1, 128, 8192, 8192, 8192, 128]
    - [17, 6.288]
  - - [8192, 2048, 1, 256, 8192, 8192, 8192, 256]
    - [104, 10.446]
  - - [8192, 2048, 1, 512, 8192, 8192, 8192, 512]
    - [105, 15.347]
  - - [8192, 2048, 1, 1024, 8192, 8192, 8192, 1024]
    - [105, 19.113]
  - - [8192, 2048, 1, 2048, 8192, 8192, 8192, 2048]
    - [21, 23.487]
  - - [8192, 2048, 1, 4096, 8192, 8192, 8192, 4096]
    - [89, 28.089]
  - - [8192, 2048, 1, 8192, 8192, 8192, 8192, 8192]
    - [67, 29.659]
  - - [8192, 4096, 1, 128, 8192, 8192, 8192, 128]
    - [34, 6.854]
  - - [8192, 4096, 1, 256, 8192, 8192, 8192, 256]
    - [33, 10.699]
  - - [8192, 4096, 1, 512, 8192, 8192, 8192, 512]
    - [104, 14.913]
  - - [8192, 4096, 1, 1024, 8192, 8192, 8192, 1024]
    - [90, 19.79]
  - - [8192, 4096, 1, 2048, 8192, 8192, 8192, 2048]
    - [23, 25.093]
  - - [8192, 4096, 1, 4096, 8192, 8192, 8192, 4096]
    - [70, 30.472]
  - - [8192, 4096, 1, 8192, 8192, 8192, 8192, 8192]
    - [69, 33.88]
  - - [8192, 8192, 1, 128, 8192, 8192, 8192, 128]
    - [10, 6.202]
  - - [8192, 8192, 1, 256, 8192, 8192, 8192, 256]
    - [9, 9.783]
  - - [8192, 8192, 1, 512, 8192, 8192, 8192, 512]
    - [72, 15.565]
  - - [8192, 8192, 1, 1024, 8192, 8192, 8192, 1024]
    - [66, 21.497]
  - - [8192, 8192, 1, 2048, 8192, 8192, 8192, 2048]
    - [8, 27.269]
  - - [8192, 8192, 1, 4096, 8192, 8192, 8192, 4096]
    - [7, 31.371]
  - - [8192, 8192, 1, 8192, 8192, 8192, 8192, 8192]
    - [73, 35.338]
  - - [1, 1, 1, 32, 1, 1, 1, 32]
    - [143, 0.0]
- null
- null
- ExperimentalStreamK
- GridBased
