library/src/amd_detail/rocblaslt/src/Tensile/Logic/asm_full/aquavanjaram/gfx942_228cu/StreamK/aquavanjaram942_Cijk_Ailk_Bjlk_HHS_BH_UserArgs.yaml
- {MinimumRequiredVersion: 4.33.0}
- aquavanjaram942
- {Architecture: gfx942, CUCount: 228}
- [Device 0049, Device 0050]
    SolutionIndex: 0
    SolutionNameMin: Cijk_Ailk_Bjlk_HHS_BH_UserArgs_MT256x256x32_MI16x16x1_SN_LDSB1_CLR1_GSU0_GSUC0_GSUWGMRR0_K1_LBSPPA2048_LBSPPB2048_LPA16_LPB32_MIWT8_8_PLR1_SU32_SUM0_SUS256_SKXCCM0_VWA1_VWB2_WGM4_WGMXCC1_WGMXCCGn1
    SolutionIndex: 1
    SolutionNameMin: Cijk_Ailk_Bjlk_HHS_BH_UserArgs_MT256x256x32_MI16x16x1_SN_LDSB0_CLR1_GSU0_GSUC0_GSUWGMRR0_K1_LBSPPA2048_LBSPPB2048_LPA0_LPB0_MIWT8_8_PLR1_SU32_SUM0_SUS256_SKXCCM0_VWA4_VWB4_WGM8_WGMXCC1_WGMXCCGn1
    SolutionIndex: 2
    SolutionNameMin: Cijk_Ailk_Bjlk_HHS_BH_UserArgs_MT256x256x32_MI16x16x1_SN_LDSB0_CLR1_GSU0_GSUC0_GSUWGMRR0_K1_LBSPPA2048_LBSPPB2048_LPA0_LPB0_MIWT8_8_PLR1_SU32_SUM0_SUS256_SKXCCM0_VWA4_VWB8_WGM8_WGMXCC1_WGMXCCGn1
    SolutionIndex: 3
    SolutionNameMin: Cijk_Ailk_Bjlk_HHS_BH_UserArgs_MT128x256x32_MI16x16x1_SN_LDSB1_CLR1_GSU0_GSUC0_GSUWGMRR0_K1_LBSPPA1024_LBSPPB2048_LPA0_LPB32_MIWT4_8_PLR1_SU32_SUM0_SUS256_SKXCCM0_VWA4_VWB2_WGM1_WGMXCC1_WGMXCCGn1
    SolutionIndex: 4
    SolutionNameMin: Cijk_Ailk_Bjlk_HHS_BH_UserArgs_MT128x256x32_MI16x16x1_SN_LDSB1_CLR1_GSU0_GSUC0_GSUWGMRR0_K1_LBSPPA1024_LBSPPB2048_LPA0_LPB0_MIWT4_8_PLR1_SU32_SUM0_SUS256_SKXCCM0_VWA4_VWB4_WGM1_WGMXCC1_WGMXCCGn1
    SolutionIndex: 5
    SolutionNameMin: Cijk_Ailk_Bjlk_HHS_BH_UserArgs_MT128x256x32_MI16x16x1_SN_LDSB1_CLR1_GSU0_GSUC0_GSUWGMRR0_K1_LBSPPA1024_LBSPPB2048_LPA0_LPB0_MIWT4_8_PLR1_SU32_SUM0_SUS256_SKXCCM0_VWA4_VWB8_WGM1_WGMXCC1_WGMXCCGn1
    SolutionIndex: 6
    SolutionNameMin: Cijk_Ailk_Bjlk_HHS_BH_UserArgs_MT256x128x32_MI16x16x1_SN_LDSB1_CLR1_GSU0_GSUC0_GSUWGMRR0_K1_LBSPPA2048_LBSPPB1024_LPA0_LPB0_MIWT8_4_PLR1_SU32_SUM0_SUS256_SKXCCM0_VWA4_VWB4_WGM4_WGMXCC1_WGMXCCGn1
    SolutionIndex: 7
    SolutionNameMin: Cijk_Ailk_Bjlk_HHS_BH_UserArgs_MT256x128x32_MI16x16x1_SN_LDSB1_CLR1_GSU0_GSUC0_GSUWGMRR0_K1_LBSPPA2048_LBSPPB1024_LPA0_LPB32_MIWT8_4_PLR1_SU32_SUM0_SUS256_SKXCCM0_VWA4_VWB2_WGM8_WGMXCC1_WGMXCCGn1
    SolutionIndex: 8
    SolutionNameMin: Cijk_Ailk_Bjlk_HHS_BH_UserArgs_MT256x128x32_MI16x16x1_SN_LDSB1_CLR1_GSU0_GSUC0_GSUWGMRR0_K1_LBSPPA2048_LBSPPB1024_LPA0_LPB0_MIWT8_4_PLR1_SU32_SUM0_SUS256_SKXCCM0_VWA4_VWB4_WGM8_WGMXCC1_WGMXCCGn1
    SolutionIndex: 9
    SolutionNameMin: Cijk_Ailk_Bjlk_HHS_BH_UserArgs_MT256x64x32_MI16x16x1_SN_LDSB1_CLR1_GSU0_GSUC0_GSUWGMRR0_K1_LBSPPA2048_LBSPPB512_LPA0_LPB32_MIWT8_2_PLR1_SU32_SUM0_SUS256_SKXCCM0_VWA8_VWB2_WGM1_WGMXCC1_WGMXCCGn1
    SolutionIndex: 10
    SolutionNameMin: Cijk_Ailk_Bjlk_HHS_BH_UserArgs_MT128x128x32_MI16x16x1_SN_LDSB0_CLR1_GSU0_GSUC0_GSUWGMRR0_K1_LBSPPA1024_LBSPPB1024_LPA0_LPB0_MIWT4_4_PLR1_SU32_SUM0_SUS256_SKXCCM0_VWA4_VWB4_WGM1_WGMXCC1_WGMXCCGn1
    SolutionIndex: 11
    SolutionNameMin: Cijk_Ailk_Bjlk_HHS_BH_UserArgs_MT64x128x32_MI16x16x1_SN_LDSB0_CLR1_GSU0_GSUC0_GSUWGMRR0_K1_LBSPPA512_LBSPPB1024_LPA32_LPB0_MIWT2_4_PLR1_SU32_SUM0_SUS256_SKXCCM0_VWA2_VWB4_WGM1_WGMXCC1_WGMXCCGn1
    SolutionIndex: 12
    SolutionNameMin: Cijk_Ailk_Bjlk_HHS_BH_UserArgs_MT128x64x32_MI16x16x1_SN_LDSB0_CLR1_GSU0_GSUC0_GSUWGMRR0_K1_LBSPPA1024_LBSPPB512_LPA32_LPB32_MIWT4_2_PLR1_SU32_SUM0_SUS256_SKXCCM0_VWA2_VWB2_WGM1_WGMXCC1_WGMXCCGn1
    SolutionIndex: 13
    SolutionNameMin: Cijk_Ailk_Bjlk_HHS_BH_UserArgs_MT128x64x32_MI16x16x1_SN_LDSB0_CLR1_GSU0_GSUC0_GSUWGMRR0_K1_LBSPPA1024_LBSPPB512_LPA0_LPB32_MIWT4_2_PLR1_SU32_SUM0_SUS256_SKXCCM0_VWA4_VWB2_WGM1_WGMXCC1_WGMXCCGn1
    SolutionIndex: 14
    SolutionNameMin: Cijk_Ailk_Bjlk_HHS_BH_UserArgs_MT32x32x32_MI16x16x1_SN_LDSB0_CLR1_GSU0_GSUC0_GSUWGMRR0_K1_LBSPPA256_LBSPPB256_LPA16_LPB16_MIWT1_1_PLR1_SU32_SUM0_SUS256_SKXCCM0_VWA1_VWB1_WGM1_WGMXCC1_WGMXCCGn1
    SolutionIndex: 15
    SolutionNameMin: Cijk_Ailk_Bjlk_HHS_BH_UserArgs_MT32x32x32_MI16x16x1_SN_LDSB0_CLR0_GSU0_GSUC0_GSUWGMRR0_K1_LBSPPA256_LBSPPB256_LPA16_LPB16_MIWT1_1_PLR0_SU32_SUM0_SUS256_SKXCCM0_VWA1_VWB1_WGM1_WGMXCC1_WGMXCCGn1
    SolutionIndex: 16
    SolutionNameMin: Cijk_Ailk_Bjlk_HHS_BH_UserArgs_MT256x256x64_MI16x16x1_SN_LDSB1_CLR1_GSU0_GSUC0_GSUWGMRR0_K1_LBSPPA2048_LBSPPB2048_LPA0_LPB0_MIWT8_8_PLR1_SU32_SUM0_SUS256_SKXCCM0_VWA4_VWB4_WGM1_WGMXCC1_WGMXCCGn1
    SolutionIndex: 17
    SolutionNameMin: Cijk_Ailk_Bjlk_HHS_BH_UserArgs_MT256x256x64_MI16x16x1_SN_LDSB1_CLR1_GSU0_GSUC0_GSUWGMRR0_K1_LBSPPA2048_LBSPPB2048_LPA0_LPB0_MIWT8_8_PLR2_SU32_SUM0_SUS256_SKXCCM0_VWA4_VWB4_WGM1_WGMXCC1_WGMXCCGn1
    SolutionIndex: 18
    SolutionNameMin: Cijk_Ailk_Bjlk_HHS_BH_UserArgs_MT256x256x64_MI16x16x1_SN_LDSB1_CLR1_GSU0_GSUC0_GSUWGMRR0_K1_LBSPPA2048_LBSPPB2048_LPA0_LPB0_MIWT8_8_PLR2_SU32_SUM0_SUS256_SKXCCM0_VWA4_VWB8_WGM4_WGMXCC1_WGMXCCGn1
    SolutionIndex: 19
    SolutionNameMin: Cijk_Ailk_Bjlk_HHS_BH_UserArgs_MT256x256x64_MI16x16x1_SN_LDSB1_CLR1_GSU0_GSUC0_GSUWGMRR0_K1_LBSPPA2048_LBSPPB2048_LPA0_LPB0_MIWT8_8_PLR1_SU32_SUM0_SUS256_SKXCCM0_VWA4_VWB4_WGM8_WGMXCC1_WGMXCCGn1
    SolutionIndex: 20
    SolutionNameMin: Cijk_Ailk_Bjlk_HHS_BH_UserArgs_MT128x256x64_MI16x16x1_SN_LDSB1_CLR1_GSU0_GSUC0_GSUWGMRR0_K1_LBSPPA1024_LBSPPB2048_LPA0_LPB0_MIWT4_8_PLR1_SU32_SUM0_SUS256_SKXCCM0_VWA4_VWB4_WGM1_WGMXCC1_WGMXCCGn1
    SolutionIndex: 21
    SolutionNameMin: Cijk_Ailk_Bjlk_HHS_BH_UserArgs_MT256x128x64_MI16x16x1_SN_LDSB1_CLR1_GSU0_GSUC0_GSUWGMRR0_K1_LBSPPA2048_LBSPPB1024_LPA0_LPB16_MIWT8_4_PLR2_SU32_SUM0_SUS256_SKXCCM0_VWA8_VWB1_WGM4_WGMXCC1_WGMXCCGn1
    SolutionIndex: 22
    SolutionNameMin: Cijk_Ailk_Bjlk_HHS_BH_UserArgs_MT256x128x64_MI16x16x1_SN_LDSB1_CLR1_GSU0_GSUC0_GSUWGMRR0_K1_LBSPPA2048_LBSPPB1024_LPA0_LPB32_MIWT8_4_PLR2_SU32_SUM0_SUS256_SKXCCM0_VWA4_VWB2_WGM4_WGMXCC1_WGMXCCGn1
    SolutionIndex: 23
    SolutionNameMin: Cijk_Ailk_Bjlk_HHS_BH_UserArgs_MT256x128x64_MI16x16x1_SN_LDSB1_CLR1_GSU0_GSUC0_GSUWGMRR0_K1_LBSPPA2048_LBSPPB1024_LPA0_LPB16_MIWT8_4_PLR1_SU32_SUM0_SUS256_SKXCCM0_VWA4_VWB1_WGM8_WGMXCC1_WGMXCCGn1
    SolutionIndex: 24
    SolutionNameMin: Cijk_Ailk_Bjlk_HHS_BH_UserArgs_MT256x128x64_MI16x16x1_SN_LDSB1_CLR1_GSU0_GSUC0_GSUWGMRR0_K1_LBSPPA2048_LBSPPB1024_LPA0_LPB0_MIWT8_4_PLR2_SU32_SUM0_SUS256_SKXCCM0_VWA4_VWB4_WGM8_WGMXCC1_WGMXCCGn1
    SolutionIndex: 25
    SolutionNameMin: Cijk_Ailk_Bjlk_HHS_BH_UserArgs_MT256x64x64_MI16x16x1_SN_LDSB1_CLR1_GSU0_GSUC0_GSUWGMRR0_K1_LBSPPA2048_LBSPPB512_LPA0_LPB32_MIWT8_2_PLR1_SU32_SUM0_SUS256_SKXCCM0_VWA4_VWB2_WGM1_WGMXCC1_WGMXCCGn1
    SolutionIndex: 26
    SolutionNameMin: Cijk_Ailk_Bjlk_HHS_BH_UserArgs_MT256x64x64_MI16x16x1_SN_LDSB1_CLR1_GSU0_GSUC0_GSUWGMRR0_K1_LBSPPA2048_LBSPPB512_LPA0_LPB32_MIWT8_2_PLR2_SU32_SUM0_SUS256_SKXCCM0_VWA4_VWB2_WGM1_WGMXCC1_WGMXCCGn1
    SolutionIndex: 27
    SolutionNameMin: Cijk_Ailk_Bjlk_HHS_BH_UserArgs_MT128x128x64_MI16x16x1_SN_LDSB1_CLR1_GSU0_GSUC0_GSUWGMRR0_K1_LBSPPA1024_LBSPPB1024_LPA0_LPB0_MIWT4_4_PLR1_SU32_SUM0_SUS256_SKXCCM0_VWA4_VWB4_WGM1_WGMXCC1_WGMXCCGn1
    SolutionIndex: 28
    SolutionNameMin: Cijk_Ailk_Bjlk_HHS_BH_UserArgs_MT128x128x64_MI16x16x1_SN_LDSB1_CLR1_GSU0_GSUC0_GSUWGMRR0_K1_LBSPPA1024_LBSPPB1024_LPA0_LPB0_MIWT4_4_PLR1_SU32_SUM0_SUS256_SKXCCM0_VWA4_VWB4_WGM4_WGMXCC1_WGMXCCGn1
    SolutionIndex: 29
    SolutionNameMin: Cijk_Ailk_Bjlk_HHS_BH_UserArgs_MT128x128x64_MI16x16x1_SN_LDSB1_CLR1_GSU0_GSUC0_GSUWGMRR0_K1_LBSPPA1024_LBSPPB1024_LPA0_LPB0_MIWT4_4_PLR2_SU32_SUM0_SUS256_SKXCCM0_VWA4_VWB4_WGM8_WGMXCC1_WGMXCCGn1
    SolutionIndex: 30
    SolutionNameMin: Cijk_Ailk_Bjlk_HHS_BH_UserArgs_MT64x128x64_MI16x16x1_SN_LDSB1_CLR1_GSU0_GSUC0_GSUWGMRR0_K1_LBSPPA512_LBSPPB1024_LPA32_LPB0_MIWT2_4_PLR2_SU32_SUM0_SUS256_SKXCCM0_VWA2_VWB4_WGM1_WGMXCC1_WGMXCCGn1
    SolutionIndex: 31
    SolutionNameMin: Cijk_Ailk_Bjlk_HHS_BH_UserArgs_MT128x64x64_MI16x16x1_SN_LDSB1_CLR1_GSU0_GSUC0_GSUWGMRR0_K1_LBSPPA1024_LBSPPB512_LPA0_LPB32_MIWT4_2_PLR1_SU32_SUM0_SUS256_SKXCCM0_VWA4_VWB2_WGM1_WGMXCC1_WGMXCCGn1
    SolutionIndex: 32
    SolutionNameMin: Cijk_Ailk_Bjlk_HHS_BH_UserArgs_MT128x64x64_MI16x16x1_SN_LDSB1_CLR1_GSU0_GSUC0_GSUWGMRR0_K1_LBSPPA1024_LBSPPB512_LPA0_LPB32_MIWT4_2_PLR2_SU32_SUM0_SUS256_SKXCCM0_VWA4_VWB2_WGM1_WGMXCC1_WGMXCCGn1
    SolutionIndex: 33
    SolutionNameMin: Cijk_Ailk_Bjlk_HHS_BH_UserArgs_MT128x64x64_MI16x16x1_SN_LDSB1_CLR1_GSU0_GSUC0_GSUWGMRR0_K1_LBSPPA1024_LBSPPB512_LPA0_LPB32_MIWT4_2_PLR2_SU32_SUM0_SUS256_SKXCCM0_VWA4_VWB2_WGM4_WGMXCC1_WGMXCCGn1
    SolutionIndex: 34
    SolutionNameMin: Cijk_Ailk_Bjlk_HHS_BH_UserArgs_MT128x64x64_MI16x16x1_SN_LDSB1_CLR1_GSU0_GSUC0_GSUWGMRR0_K1_LBSPPA1024_LBSPPB512_LPA0_LPB32_MIWT4_2_PLR2_SU32_SUM0_SUS256_SKXCCM0_VWA4_VWB2_WGM8_WGMXCC1_WGMXCCGn1
    SolutionIndex: 35
    SolutionNameMin: Cijk_Ailk_Bjlk_HHS_BH_UserArgs_MT64x64x64_MI16x16x1_SN_LDSB1_CLR1_GSU0_GSUC0_GSUWGMRR0_K1_LBSPPA512_LBSPPB512_LPA32_LPB32_MIWT2_2_PLR1_SU32_SUM0_SUS256_SKXCCM0_VWA2_VWB2_WGM1_WGMXCC1_WGMXCCGn1
    SolutionIndex: 36
    SolutionNameMin: Cijk_Ailk_Bjlk_HHS_BH_UserArgs_MT64x64x64_MI16x16x1_SN_LDSB1_CLR1_GSU0_GSUC0_GSUWGMRR0_K1_LBSPPA512_LBSPPB512_LPA32_LPB32_MIWT2_2_PLR2_SU32_SUM0_SUS256_SKXCCM0_VWA2_VWB2_WGM1_WGMXCC1_WGMXCCGn1
    SolutionIndex: 37
    SolutionNameMin: Cijk_Ailk_Bjlk_HHS_BH_UserArgs_MT32x64x64_MI16x16x1_SN_LDSB0_CLR1_GSU0_GSUC0_GSUWGMRR0_K1_LBSPPA256_LBSPPB512_LPA16_LPB32_MIWT1_2_PLR2_SU32_SUM0_SUS256_SKXCCM0_VWA1_VWB2_WGM1_WGMXCC1_WGMXCCGn1
    SolutionIndex: 38
    SolutionNameMin: Cijk_Ailk_Bjlk_HHS_BH_UserArgs_MT64x32x64_MI16x16x1_SN_LDSB0_CLR1_GSU0_GSUC0_GSUWGMRR0_K1_LBSPPA512_LBSPPB256_LPA32_LPB16_MIWT2_1_PLR2_SU32_SUM0_SUS256_SKXCCM0_VWA2_VWB1_WGM1_WGMXCC1_WGMXCCGn1
    SolutionIndex: 39
    SolutionNameMin: Cijk_Ailk_Bjlk_HHS_BH_UserArgs_MT32x32x64_MI16x16x1_SN_LDSB0_CLR1_GSU0_GSUC0_GSUWGMRR0_K1_LBSPPA256_LBSPPB256_LPA16_LPB16_MIWT1_1_PLR1_SU32_SUM0_SUS256_SKXCCM0_VWA1_VWB1_WGM1_WGMXCC1_WGMXCCGn1
    SolutionIndex: 40
    SolutionNameMin: Cijk_Ailk_Bjlk_HHS_BH_UserArgs_MT32x32x64_MI16x16x1_SN_LDSB0_CLR1_GSU0_GSUC0_GSUWGMRR0_K1_LBSPPA256_LBSPPB256_LPA16_LPB16_MIWT1_1_PLR2_SU32_SUM0_SUS256_SKXCCM0_VWA1_VWB1_WGM1_WGMXCC1_WGMXCCGn1
    SolutionIndex: 41
    SolutionNameMin: Cijk_Ailk_Bjlk_HHS_BH_UserArgs_MT32x32x64_MI16x16x1_SN_LDSB0_CLR1_GSU0_GSUC0_GSUWGMRR0_K1_LBSPPA256_LBSPPB256_LPA16_LPB16_MIWT1_1_PLR1_SU32_SUM0_SUS256_SKXCCM0_VWA1_VWB1_WGM4_WGMXCC1_WGMXCCGn1
    SolutionIndex: 42
    SolutionNameMin: Cijk_Ailk_Bjlk_HHS_BH_UserArgs_MT32x32x64_MI16x16x1_SN_LDSB0_CLR1_GSU0_GSUC0_GSUWGMRR0_K1_LBSPPA256_LBSPPB256_LPA16_LPB16_MIWT1_1_PLR2_SU32_SUM0_SUS256_SKXCCM0_VWA1_VWB1_WGM8_WGMXCC1_WGMXCCGn1
    SolutionIndex: 43
    SolutionNameMin: Cijk_Ailk_Bjlk_HHS_BH_UserArgs_MT128x128x128_MI16x16x1_SN_LDSB1_CLR1_GSU0_GSUC0_GSUWGMRR0_K1_LBSPPA1024_LBSPPB1024_LPA0_LPB0_MIWT4_4_PLR1_SU32_SUM0_SUS256_SKXCCM0_VWA4_VWB4_WGM1_WGMXCC1_WGMXCCGn1
    SolutionIndex: 44
    SolutionNameMin: Cijk_Ailk_Bjlk_HHS_BH_UserArgs_MT128x128x128_MI16x16x1_SN_LDSB1_CLR1_GSU0_GSUC0_GSUWGMRR0_K1_LBSPPA1024_LBSPPB1024_LPA0_LPB0_MIWT4_4_PLR1_SU32_SUM0_SUS256_SKXCCM0_VWA4_VWB4_WGM4_WGMXCC1_WGMXCCGn1
    SolutionIndex: 45
    SolutionNameMin: Cijk_Ailk_Bjlk_HHS_BH_UserArgs_MT128x128x128_MI16x16x1_SN_LDSB1_CLR1_GSU0_GSUC0_GSUWGMRR0_K1_LBSPPA1024_LBSPPB1024_LPA0_LPB0_MIWT4_4_PLR2_SU32_SUM0_SUS256_SKXCCM0_VWA4_VWB4_WGM4_WGMXCC1_WGMXCCGn1
    SolutionIndex: 46
    SolutionNameMin: Cijk_Ailk_Bjlk_HHS_BH_UserArgs_MT128x128x128_MI16x16x1_SN_LDSB1_CLR1_GSU0_GSUC0_GSUWGMRR0_K1_LBSPPA1024_LBSPPB1024_LPA0_LPB0_MIWT4_4_PLR1_SU32_SUM0_SUS256_SKXCCM0_VWA4_VWB4_WGM8_WGMXCC1_WGMXCCGn1
    SolutionIndex: 47
    SolutionNameMin: Cijk_Ailk_Bjlk_HHS_BH_UserArgs_MT64x128x128_MI16x16x1_SN_LDSB1_CLR1_GSU0_GSUC0_GSUWGMRR0_K1_LBSPPA512_LBSPPB1024_LPA32_LPB0_MIWT2_4_PLR2_SU32_SUM0_SUS256_SKXCCM0_VWA2_VWB4_WGM1_WGMXCC1_WGMXCCGn1
    SolutionIndex: 48
    SolutionNameMin: Cijk_Ailk_Bjlk_HHS_BH_UserArgs_MT128x64x128_MI16x16x1_SN_LDSB1_CLR1_GSU0_GSUC0_GSUWGMRR0_K1_LBSPPA1024_LBSPPB512_LPA0_LPB32_MIWT4_2_PLR2_SU32_SUM0_SUS256_SKXCCM0_VWA4_VWB2_WGM1_WGMXCC1_WGMXCCGn1
    SolutionIndex: 49
    SolutionNameMin: Cijk_Ailk_Bjlk_HHS_BH_UserArgs_MT64x64x128_MI16x16x1_SN_LDSB1_CLR1_GSU0_GSUC0_GSUWGMRR0_K1_LBSPPA512_LBSPPB512_LPA32_LPB32_MIWT2_2_PLR2_SU32_SUM0_SUS256_SKXCCM0_VWA2_VWB2_WGM1_WGMXCC1_WGMXCCGn1
    SolutionIndex: 50
    SolutionNameMin: Cijk_Ailk_Bjlk_HHS_BH_UserArgs_MT64x64x128_MI16x16x1_SN_LDSB1_CLR1_GSU0_GSUC0_GSUWGMRR0_K1_LBSPPA512_LBSPPB512_LPA32_LPB32_MIWT2_2_PLR2_SU32_SUM0_SUS256_SKXCCM0_VWA2_VWB2_WGM4_WGMXCC1_WGMXCCGn1
    SolutionIndex: 51
    SolutionNameMin: Cijk_Ailk_Bjlk_HHS_BH_UserArgs_MT64x64x128_MI16x16x1_SN_LDSB1_CLR1_GSU0_GSUC0_GSUWGMRR0_K1_LBSPPA512_LBSPPB512_LPA32_LPB32_MIWT2_2_PLR2_SU32_SUM0_SUS256_SKXCCM0_VWA2_VWB2_WGM8_WGMXCC1_WGMXCCGn1
    SolutionIndex: 52
    SolutionNameMin: Cijk_Ailk_Bjlk_HHS_BH_UserArgs_MT32x64x128_MI16x16x1_SN_LDSB1_CLR1_GSU0_GSUC0_GSUWGMRR0_K1_LBSPPA256_LBSPPB512_LPA16_LPB32_MIWT1_2_PLR2_SU32_SUM0_SUS256_SKXCCM0_VWA1_VWB2_WGM1_WGMXCC1_WGMXCCGn1
    SolutionIndex: 53
    SolutionNameMin: Cijk_Ailk_Bjlk_HHS_BH_UserArgs_MT64x32x128_MI16x16x1_SN_LDSB1_CLR1_GSU0_GSUC0_GSUWGMRR0_K1_LBSPPA512_LBSPPB256_LPA32_LPB16_MIWT2_1_PLR2_SU32_SUM0_SUS256_SKXCCM0_VWA2_VWB1_WGM1_WGMXCC1_WGMXCCGn1
    SolutionIndex: 54
    SolutionNameMin: Cijk_Ailk_Bjlk_HHS_BH_UserArgs_MT32x32x128_MI16x16x1_SN_LDSB1_CLR1_GSU0_GSUC0_GSUWGMRR0_K1_LBSPPA256_LBSPPB256_LPA16_LPB16_MIWT1_1_PLR1_SU32_SUM0_SUS256_SKXCCM0_VWA1_VWB1_WGM1_WGMXCC1_WGMXCCGn1
    SolutionIndex: 55
    SolutionNameMin: Cijk_Ailk_Bjlk_HHS_BH_UserArgs_MT32x32x128_MI16x16x1_SN_LDSB1_CLR1_GSU0_GSUC0_GSUWGMRR0_K1_LBSPPA256_LBSPPB256_LPA16_LPB16_MIWT1_1_PLR2_SU32_SUM0_SUS256_SKXCCM0_VWA1_VWB1_WGM1_WGMXCC1_WGMXCCGn1
    SolutionIndex: 56
    SolutionNameMin: Cijk_Ailk_Bjlk_HHS_BH_UserArgs_MT256x256x32_MI16x16x1_SN_LDSB0_CLR1_GSU0_GSUC0_GSUWGMRR0_K1_LBSPPA2048_LBSPPB2048_LPA0_LPB0_MIWT8_8_PLR1_SU32_SUM0_SUS256_SKXCCM6_VWA4_VWB4_WGM1_WGMXCC1_WGMXCCGn1
    SolutionIndex: 57
    SolutionNameMin: Cijk_Ailk_Bjlk_HHS_BH_UserArgs_MT256x256x32_MI16x16x1_SN_LDSB0_CLR1_GSU0_GSUC0_GSUWGMRR0_K1_LBSPPA2048_LBSPPB2048_LPA0_LPB0_MIWT8_8_PLR1_SU32_SUM0_SUS256_SKXCCM6_VWA4_VWB8_WGM1_WGMXCC1_WGMXCCGn1
    SolutionIndex: 58
    SolutionNameMin: Cijk_Ailk_Bjlk_HHS_BH_UserArgs_MT256x256x32_MI16x16x1_SN_LDSB1_CLR1_GSU0_GSUC0_GSUWGMRR0_K1_LBSPPA2048_LBSPPB2048_LPA0_LPB16_MIWT8_8_PLR1_SU32_SUM0_SUS256_SKXCCM6_VWA8_VWB1_WGM4_WGMXCC1_WGMXCCGn1
    SolutionIndex: 59
    SolutionNameMin: Cijk_Ailk_Bjlk_HHS_BH_UserArgs_MT256x256x32_MI16x16x1_SN_LDSB1_CLR1_GSU0_GSUC0_GSUWGMRR0_K1_LBSPPA2048_LBSPPB2048_LPA0_LPB32_MIWT8_8_PLR1_SU32_SUM0_SUS256_SKXCCM6_VWA8_VWB2_WGM4_WGMXCC1_WGMXCCGn1
    SolutionIndex: 60
    SolutionNameMin: Cijk_Ailk_Bjlk_HHS_BH_UserArgs_MT256x256x32_MI16x16x1_SN_LDSB0_CLR1_GSU0_GSUC0_GSUWGMRR0_K1_LBSPPA2048_LBSPPB2048_LPA0_LPB0_MIWT8_8_PLR1_SU32_SUM0_SUS256_SKXCCM6_VWA8_VWB4_WGM4_WGMXCC1_WGMXCCGn1
    SolutionIndex: 61
    SolutionNameMin: Cijk_Ailk_Bjlk_HHS_BH_UserArgs_MT256x256x32_MI16x16x1_SN_LDSB0_CLR1_GSU0_GSUC0_GSUWGMRR0_K1_LBSPPA2048_LBSPPB2048_LPA0_LPB0_MIWT8_8_PLR1_SU32_SUM0_SUS256_SKXCCM6_VWA8_VWB8_WGM4_WGMXCC1_WGMXCCGn1
    SolutionIndex: 62
    SolutionNameMin: Cijk_Ailk_Bjlk_HHS_BH_UserArgs_MT256x256x32_MI16x16x1_SN_LDSB0_CLR1_GSU0_GSUC0_GSUWGMRR0_K1_LBSPPA2048_LBSPPB2048_LPA0_LPB0_MIWT8_8_PLR1_SU32_SUM0_SUS256_SKXCCM6_VWA4_VWB4_WGM8_WGMXCC1_WGMXCCGn1
    SolutionIndex: 63
    SolutionNameMin: Cijk_Ailk_Bjlk_HHS_BH_UserArgs_MT256x256x32_MI16x16x1_SN_LDSB0_CLR1_GSU0_GSUC0_GSUWGMRR0_K1_LBSPPA2048_LBSPPB2048_LPA0_LPB0_MIWT8_8_PLR1_SU32_SUM0_SUS256_SKXCCM6_VWA4_VWB8_WGM8_WGMXCC1_WGMXCCGn1
    SolutionIndex: 64
    SolutionNameMin: Cijk_Ailk_Bjlk_HHS_BH_UserArgs_MT128x256x32_MI16x16x1_SN_LDSB1_CLR1_GSU0_GSUC0_GSUWGMRR0_K1_LBSPPA1024_LBSPPB2048_LPA0_LPB32_MIWT4_8_PLR1_SU32_SUM0_SUS256_SKXCCM6_VWA4_VWB2_WGM1_WGMXCC1_WGMXCCGn1
    SolutionIndex: 65
    SolutionNameMin: Cijk_Ailk_Bjlk_HHS_BH_UserArgs_MT128x256x32_MI16x16x1_SN_LDSB1_CLR1_GSU0_GSUC0_GSUWGMRR0_K1_LBSPPA1024_LBSPPB2048_LPA0_LPB0_MIWT4_8_PLR1_SU32_SUM0_SUS256_SKXCCM6_VWA4_VWB4_WGM1_WGMXCC1_WGMXCCGn1
    SolutionIndex: 66
    SolutionNameMin: Cijk_Ailk_Bjlk_HHS_BH_UserArgs_MT128x256x32_MI16x16x1_SN_LDSB1_CLR1_GSU0_GSUC0_GSUWGMRR0_K1_LBSPPA1024_LBSPPB2048_LPA0_LPB0_MIWT4_8_PLR1_SU32_SUM0_SUS256_SKXCCM6_VWA4_VWB8_WGM1_WGMXCC1_WGMXCCGn1
    SolutionIndex: 67
    SolutionNameMin: Cijk_Ailk_Bjlk_HHS_BH_UserArgs_MT128x256x32_MI16x16x1_SN_LDSB1_CLR1_GSU0_GSUC0_GSUWGMRR0_K1_LBSPPA1024_LBSPPB2048_LPA0_LPB0_MIWT4_8_PLR1_SU32_SUM0_SUS256_SKXCCM6_VWA4_VWB4_WGM4_WGMXCC1_WGMXCCGn1
    SolutionIndex: 68
    SolutionNameMin: Cijk_Ailk_Bjlk_HHS_BH_UserArgs_MT128x256x32_MI16x16x1_SN_LDSB1_CLR1_GSU0_GSUC0_GSUWGMRR0_K1_LBSPPA1024_LBSPPB2048_LPA0_LPB0_MIWT4_8_PLR1_SU32_SUM0_SUS256_SKXCCM6_VWA4_VWB8_WGM4_WGMXCC1_WGMXCCGn1
    SolutionIndex: 69
    SolutionNameMin: Cijk_Ailk_Bjlk_HHS_BH_UserArgs_MT256x128x32_MI16x16x1_SN_LDSB1_CLR1_GSU0_GSUC0_GSUWGMRR0_K1_LBSPPA2048_LBSPPB1024_LPA0_LPB32_MIWT8_4_PLR1_SU32_SUM0_SUS256_SKXCCM6_VWA8_VWB2_WGM1_WGMXCC1_WGMXCCGn1
    SolutionIndex: 70
    SolutionNameMin: Cijk_Ailk_Bjlk_HHS_BH_UserArgs_MT256x128x32_MI16x16x1_SN_LDSB1_CLR1_GSU0_GSUC0_GSUWGMRR0_K1_LBSPPA2048_LBSPPB1024_LPA0_LPB0_MIWT8_4_PLR1_SU32_SUM0_SUS256_SKXCCM6_VWA4_VWB4_WGM1_WGMXCC1_WGMXCCGn1
    SolutionIndex: 71
    SolutionNameMin: Cijk_Ailk_Bjlk_HHS_BH_UserArgs_MT256x128x32_MI16x16x1_SN_LDSB1_CLR1_GSU0_GSUC0_GSUWGMRR0_K1_LBSPPA2048_LBSPPB1024_LPA0_LPB0_MIWT8_4_PLR1_SU32_SUM0_SUS256_SKXCCM6_VWA8_VWB4_WGM1_WGMXCC1_WGMXCCGn1
    SolutionIndex: 72
    SolutionNameMin: Cijk_Ailk_Bjlk_HHS_BH_UserArgs_MT256x128x32_MI16x16x1_SN_LDSB1_CLR1_GSU0_GSUC0_GSUWGMRR0_K1_LBSPPA2048_LBSPPB1024_LPA0_LPB32_MIWT8_4_PLR1_SU32_SUM0_SUS256_SKXCCM6_VWA8_VWB2_WGM4_WGMXCC1_WGMXCCGn1
    SolutionIndex: 73
    SolutionNameMin: Cijk_Ailk_Bjlk_HHS_BH_UserArgs_MT256x128x32_MI16x16x1_SN_LDSB1_CLR1_GSU0_GSUC0_GSUWGMRR0_K1_LBSPPA2048_LBSPPB1024_LPA0_LPB32_MIWT8_4_PLR1_SU32_SUM0_SUS256_SKXCCM6_VWA8_VWB2_WGM8_WGMXCC1_WGMXCCGn1
    SolutionIndex: 74
    SolutionNameMin: Cijk_Ailk_Bjlk_HHS_BH_UserArgs_MT256x128x32_MI16x16x1_SN_LDSB1_CLR1_GSU0_GSUC0_GSUWGMRR0_K1_LBSPPA2048_LBSPPB1024_LPA0_LPB0_MIWT8_4_PLR1_SU32_SUM0_SUS256_SKXCCM6_VWA8_VWB4_WGM8_WGMXCC1_WGMXCCGn1
    SolutionIndex: 75
    SolutionNameMin: Cijk_Ailk_Bjlk_HHS_BH_UserArgs_MT128x128x32_MI16x16x1_SN_LDSB0_CLR1_GSU0_GSUC0_GSUWGMRR0_K1_LBSPPA1024_LBSPPB1024_LPA0_LPB0_MIWT4_4_PLR1_SU32_SUM0_SUS256_SKXCCM6_VWA4_VWB4_WGM1_WGMXCC1_WGMXCCGn1
    SolutionIndex: 76
    SolutionNameMin: Cijk_Ailk_Bjlk_HHS_BH_UserArgs_MT128x128x32_MI16x16x1_SN_LDSB0_CLR1_GSU0_GSUC0_GSUWGMRR0_K1_LBSPPA1024_LBSPPB1024_LPA0_LPB0_MIWT4_4_PLR1_SU32_SUM0_SUS256_SKXCCM6_VWA4_VWB4_WGM4_WGMXCC1_WGMXCCGn1
    SolutionIndex: 77
    SolutionNameMin: Cijk_Ailk_Bjlk_HHS_BH_UserArgs_MT128x128x32_MI16x16x1_SN_LDSB0_CLR1_GSU0_GSUC0_GSUWGMRR0_K1_LBSPPA1024_LBSPPB1024_LPA0_LPB0_MIWT4_4_PLR1_SU32_SUM0_SUS256_SKXCCM6_VWA4_VWB4_WGM8_WGMXCC1_WGMXCCGn1
    SolutionIndex: 78
    SolutionNameMin: Cijk_Ailk_Bjlk_HHS_BH_UserArgs_MT128x128x32_MI16x16x1_SN_LDSB0_CLR0_GSU0_GSUC0_GSUWGMRR0_K1_LBSPPA1024_LBSPPB1024_LPA0_LPB0_MIWT4_4_PLR0_SU32_SUM0_SUS256_SKXCCM6_VWA4_VWB4_WGM8_WGMXCC1_WGMXCCGn1
    SolutionIndex: 79
    SolutionNameMin: Cijk_Ailk_Bjlk_HHS_BH_UserArgs_MT128x64x32_MI16x16x1_SN_LDSB0_CLR1_GSU0_GSUC0_GSUWGMRR0_K1_LBSPPA1024_LBSPPB512_LPA0_LPB16_MIWT4_2_PLR1_SU32_SUM0_SUS256_SKXCCM6_VWA4_VWB1_WGM1_WGMXCC1_WGMXCCGn1
    SolutionIndex: 80
    SolutionNameMin: Cijk_Ailk_Bjlk_HHS_BH_UserArgs_MT128x64x32_MI16x16x1_SN_LDSB0_CLR1_GSU0_GSUC0_GSUWGMRR0_K1_LBSPPA1024_LBSPPB512_LPA0_LPB32_MIWT4_2_PLR1_SU32_SUM0_SUS256_SKXCCM6_VWA4_VWB2_WGM1_WGMXCC1_WGMXCCGn1
    SolutionIndex: 81
    SolutionNameMin: Cijk_Ailk_Bjlk_HHS_BH_UserArgs_MT32x32x32_MI16x16x1_SN_LDSB0_CLR1_GSU0_GSUC0_GSUWGMRR0_K1_LBSPPA256_LBSPPB256_LPA16_LPB16_MIWT1_1_PLR1_SU32_SUM0_SUS256_SKXCCM6_VWA1_VWB1_WGM1_WGMXCC1_WGMXCCGn1
    SolutionIndex: 82
    SolutionNameMin: Cijk_Ailk_Bjlk_HHS_BH_UserArgs_MT32x32x32_MI16x16x1_SN_LDSB0_CLR0_GSU0_GSUC0_GSUWGMRR0_K1_LBSPPA256_LBSPPB256_LPA16_LPB16_MIWT1_1_PLR0_SU32_SUM0_SUS256_SKXCCM6_VWA1_VWB1_WGM1_WGMXCC1_WGMXCCGn1
    SolutionIndex: 83
    SolutionNameMin: Cijk_Ailk_Bjlk_HHS_BH_UserArgs_MT256x256x64_MI16x16x1_SN_LDSB1_CLR1_GSU0_GSUC0_GSUWGMRR0_K1_LBSPPA2048_LBSPPB2048_LPA0_LPB0_MIWT8_8_PLR1_SU32_SUM0_SUS256_SKXCCM6_VWA4_VWB4_WGM1_WGMXCC1_WGMXCCGn1
    SolutionIndex: 84
    SolutionNameMin: Cijk_Ailk_Bjlk_HHS_BH_UserArgs_MT256x256x64_MI16x16x1_SN_LDSB1_CLR1_GSU0_GSUC0_GSUWGMRR0_K1_LBSPPA2048_LBSPPB2048_LPA0_LPB0_MIWT8_8_PLR2_SU32_SUM0_SUS256_SKXCCM6_VWA4_VWB4_WGM1_WGMXCC1_WGMXCCGn1
    SolutionIndex: 85
    SolutionNameMin: Cijk_Ailk_Bjlk_HHS_BH_UserArgs_MT256x256x64_MI16x16x1_SN_LDSB1_CLR1_GSU0_GSUC0_GSUWGMRR0_K1_LBSPPA2048_LBSPPB2048_LPA0_LPB0_MIWT8_8_PLR2_SU32_SUM0_SUS256_SKXCCM6_VWA4_VWB8_WGM1_WGMXCC1_WGMXCCGn1
    SolutionIndex: 86
    SolutionNameMin: Cijk_Ailk_Bjlk_HHS_BH_UserArgs_MT256x256x64_MI16x16x1_SN_LDSB1_CLR1_GSU0_GSUC0_GSUWGMRR0_K1_LBSPPA2048_LBSPPB2048_LPA0_LPB0_MIWT8_8_PLR1_SU32_SUM0_SUS256_SKXCCM6_VWA4_VWB4_WGM4_WGMXCC1_WGMXCCGn1
    SolutionIndex: 87
    SolutionNameMin: Cijk_Ailk_Bjlk_HHS_BH_UserArgs_MT256x256x64_MI16x16x1_SN_LDSB1_CLR1_GSU0_GSUC0_GSUWGMRR0_K1_LBSPPA2048_LBSPPB2048_LPA0_LPB0_MIWT8_8_PLR1_SU32_SUM0_SUS256_SKXCCM6_VWA4_VWB8_WGM4_WGMXCC1_WGMXCCGn1
    SolutionIndex: 88
    SolutionNameMin: Cijk_Ailk_Bjlk_HHS_BH_UserArgs_MT256x256x64_MI16x16x1_SN_LDSB1_CLR1_GSU0_GSUC0_GSUWGMRR0_K1_LBSPPA2048_LBSPPB2048_LPA0_LPB0_MIWT8_8_PLR1_SU32_SUM0_SUS256_SKXCCM6_VWA4_VWB4_WGM8_WGMXCC1_WGMXCCGn1
    SolutionIndex: 89
    SolutionNameMin: Cijk_Ailk_Bjlk_HHS_BH_UserArgs_MT256x256x64_MI16x16x1_SN_LDSB1_CLR1_GSU0_GSUC0_GSUWGMRR0_K1_LBSPPA2048_LBSPPB2048_LPA0_LPB0_MIWT8_8_PLR2_SU32_SUM0_SUS256_SKXCCM6_VWA4_VWB4_WGM8_WGMXCC1_WGMXCCGn1
    SolutionIndex: 90
    SolutionNameMin: Cijk_Ailk_Bjlk_HHS_BH_UserArgs_MT256x256x64_MI16x16x1_SN_LDSB1_CLR1_GSU0_GSUC0_GSUWGMRR0_K1_LBSPPA2048_LBSPPB2048_LPA0_LPB0_MIWT8_8_PLR2_SU32_SUM0_SUS256_SKXCCM6_VWA8_VWB4_WGM8_WGMXCC1_WGMXCCGn1
    SolutionIndex: 91
    SolutionNameMin: Cijk_Ailk_Bjlk_HHS_BH_UserArgs_MT256x256x64_MI16x16x1_SN_LDSB1_CLR1_GSU0_GSUC0_GSUWGMRR0_K1_LBSPPA2048_LBSPPB2048_LPA0_LPB0_MIWT8_8_PLR2_SU32_SUM0_SUS256_SKXCCM6_VWA8_VWB8_WGM8_WGMXCC1_WGMXCCGn1
    SolutionIndex: 92
    SolutionNameMin: Cijk_Ailk_Bjlk_HHS_BH_UserArgs_MT128x256x64_MI16x16x1_SN_LDSB1_CLR1_GSU0_GSUC0_GSUWGMRR0_K1_LBSPPA1024_LBSPPB2048_LPA0_LPB32_MIWT4_8_PLR1_SU32_SUM0_SUS256_SKXCCM6_VWA4_VWB2_WGM1_WGMXCC1_WGMXCCGn1
    SolutionIndex: 93
    SolutionNameMin: Cijk_Ailk_Bjlk_HHS_BH_UserArgs_MT128x256x64_MI16x16x1_SN_LDSB1_CLR1_GSU0_GSUC0_GSUWGMRR0_K1_LBSPPA1024_LBSPPB2048_LPA32_LPB0_MIWT4_8_PLR1_SU32_SUM0_SUS256_SKXCCM6_VWA2_VWB4_WGM1_WGMXCC1_WGMXCCGn1
    SolutionIndex: 94
    SolutionNameMin: Cijk_Ailk_Bjlk_HHS_BH_UserArgs_MT128x256x64_MI16x16x1_SN_LDSB1_CLR1_GSU0_GSUC0_GSUWGMRR0_K1_LBSPPA1024_LBSPPB2048_LPA0_LPB0_MIWT4_8_PLR1_SU32_SUM0_SUS256_SKXCCM6_VWA4_VWB4_WGM1_WGMXCC1_WGMXCCGn1
    SolutionIndex: 95
    SolutionNameMin: Cijk_Ailk_Bjlk_HHS_BH_UserArgs_MT128x256x64_MI16x16x1_SN_LDSB1_CLR1_GSU0_GSUC0_GSUWGMRR0_K1_LBSPPA1024_LBSPPB2048_LPA0_LPB0_MIWT4_8_PLR2_SU32_SUM0_SUS256_SKXCCM6_VWA4_VWB8_WGM1_WGMXCC1_WGMXCCGn1
    SolutionIndex: 96
    SolutionNameMin: Cijk_Ailk_Bjlk_HHS_BH_UserArgs_MT128x256x64_MI16x16x1_SN_LDSB1_CLR1_GSU0_GSUC0_GSUWGMRR0_K1_LBSPPA1024_LBSPPB2048_LPA0_LPB0_MIWT4_8_PLR1_SU32_SUM0_SUS256_SKXCCM6_VWA4_VWB4_WGM4_WGMXCC1_WGMXCCGn1
    SolutionIndex: 97
    SolutionNameMin: Cijk_Ailk_Bjlk_HHS_BH_UserArgs_MT128x256x64_MI16x16x1_SN_LDSB1_CLR1_GSU0_GSUC0_GSUWGMRR0_K1_LBSPPA1024_LBSPPB2048_LPA0_LPB0_MIWT4_8_PLR1_SU32_SUM0_SUS256_SKXCCM6_VWA4_VWB8_WGM4_WGMXCC1_WGMXCCGn1
    SolutionIndex: 98
    SolutionNameMin: Cijk_Ailk_Bjlk_HHS_BH_UserArgs_MT128x256x64_MI16x16x1_SN_LDSB1_CLR1_GSU0_GSUC0_GSUWGMRR0_K1_LBSPPA1024_LBSPPB2048_LPA0_LPB0_MIWT4_8_PLR1_SU32_SUM0_SUS256_SKXCCM6_VWA4_VWB4_WGM8_WGMXCC1_WGMXCCGn1
    SolutionIndex: 99
    SolutionNameMin: Cijk_Ailk_Bjlk_HHS_BH_UserArgs_MT256x128x64_MI16x16x1_SN_LDSB1_CLR1_GSU0_GSUC0_GSUWGMRR0_K1_LBSPPA2048_LBSPPB1024_LPA32_LPB0_MIWT8_4_PLR1_SU32_SUM0_SUS256_SKXCCM6_VWA2_VWB4_WGM1_WGMXCC1_WGMXCCGn1
    SolutionIndex: 100
    SolutionNameMin: Cijk_Ailk_Bjlk_HHS_BH_UserArgs_MT256x128x64_MI16x16x1_SN_LDSB1_CLR1_GSU0_GSUC0_GSUWGMRR0_K1_LBSPPA2048_LBSPPB1024_LPA0_LPB0_MIWT8_4_PLR1_SU32_SUM0_SUS256_SKXCCM6_VWA4_VWB4_WGM4_WGMXCC1_WGMXCCGn1
    SolutionIndex: 101
    SolutionNameMin: Cijk_Ailk_Bjlk_HHS_BH_UserArgs_MT256x128x64_MI16x16x1_SN_LDSB1_CLR1_GSU0_GSUC0_GSUWGMRR0_K1_LBSPPA2048_LBSPPB1024_LPA0_LPB0_MIWT8_4_PLR2_SU32_SUM0_SUS256_SKXCCM6_VWA4_VWB4_WGM4_WGMXCC1_WGMXCCGn1
    SolutionIndex: 102
    SolutionNameMin: Cijk_Ailk_Bjlk_HHS_BH_UserArgs_MT256x128x64_MI16x16x1_SN_LDSB1_CLR1_GSU0_GSUC0_GSUWGMRR0_K1_LBSPPA2048_LBSPPB1024_LPA32_LPB0_MIWT8_4_PLR1_SU32_SUM0_SUS256_SKXCCM6_VWA2_VWB4_WGM8_WGMXCC1_WGMXCCGn1
    SolutionIndex: 103
    SolutionNameMin: Cijk_Ailk_Bjlk_HHS_BH_UserArgs_MT256x128x64_MI16x16x1_SN_LDSB1_CLR1_GSU0_GSUC0_GSUWGMRR0_K1_LBSPPA2048_LBSPPB1024_LPA0_LPB0_MIWT8_4_PLR1_SU32_SUM0_SUS256_SKXCCM6_VWA4_VWB4_WGM8_WGMXCC1_WGMXCCGn1
    SolutionIndex: 104
    SolutionNameMin: Cijk_Ailk_Bjlk_HHS_BH_UserArgs_MT128x128x64_MI16x16x1_SN_LDSB1_CLR1_GSU0_GSUC0_GSUWGMRR0_K1_LBSPPA1024_LBSPPB1024_LPA0_LPB32_MIWT4_4_PLR1_SU32_SUM0_SUS256_SKXCCM6_VWA4_VWB2_WGM1_WGMXCC1_WGMXCCGn1
    SolutionIndex: 105
    SolutionNameMin: Cijk_Ailk_Bjlk_HHS_BH_UserArgs_MT128x128x64_MI16x16x1_SN_LDSB1_CLR1_GSU0_GSUC0_GSUWGMRR0_K1_LBSPPA1024_LBSPPB1024_LPA0_LPB0_MIWT4_4_PLR1_SU32_SUM0_SUS256_SKXCCM6_VWA4_VWB4_WGM1_WGMXCC1_WGMXCCGn1
    SolutionIndex: 106
    SolutionNameMin: Cijk_Ailk_Bjlk_HHS_BH_UserArgs_MT128x128x64_MI16x16x1_SN_LDSB1_CLR1_GSU0_GSUC0_GSUWGMRR0_K1_LBSPPA1024_LBSPPB1024_LPA0_LPB0_MIWT4_4_PLR2_SU32_SUM0_SUS256_SKXCCM6_VWA4_VWB4_WGM1_WGMXCC1_WGMXCCGn1
    SolutionIndex: 107
    SolutionNameMin: Cijk_Ailk_Bjlk_HHS_BH_UserArgs_MT128x128x64_MI16x16x1_SN_LDSB1_CLR1_GSU0_GSUC0_GSUWGMRR0_K1_LBSPPA1024_LBSPPB1024_LPA0_LPB32_MIWT4_4_PLR1_SU32_SUM0_SUS256_SKXCCM6_VWA4_VWB2_WGM4_WGMXCC1_WGMXCCGn1
    SolutionIndex: 108
    SolutionNameMin: Cijk_Ailk_Bjlk_HHS_BH_UserArgs_MT128x128x64_MI16x16x1_SN_LDSB1_CLR1_GSU0_GSUC0_GSUWGMRR0_K1_LBSPPA1024_LBSPPB1024_LPA0_LPB0_MIWT4_4_PLR1_SU32_SUM0_SUS256_SKXCCM6_VWA4_VWB4_WGM4_WGMXCC1_WGMXCCGn1
    SolutionIndex: 109
    SolutionNameMin: Cijk_Ailk_Bjlk_HHS_BH_UserArgs_MT128x128x64_MI16x16x1_SN_LDSB1_CLR1_GSU0_GSUC0_GSUWGMRR0_K1_LBSPPA1024_LBSPPB1024_LPA0_LPB0_MIWT4_4_PLR2_SU32_SUM0_SUS256_SKXCCM6_VWA4_VWB4_WGM4_WGMXCC1_WGMXCCGn1
    SolutionIndex: 110
    SolutionNameMin: Cijk_Ailk_Bjlk_HHS_BH_UserArgs_MT128x128x64_MI16x16x1_SN_LDSB1_CLR1_GSU0_GSUC0_GSUWGMRR0_K1_LBSPPA1024_LBSPPB1024_LPA0_LPB16_MIWT4_4_PLR1_SU32_SUM0_SUS256_SKXCCM6_VWA4_VWB1_WGM8_WGMXCC1_WGMXCCGn1
    SolutionIndex: 111
    SolutionNameMin: Cijk_Ailk_Bjlk_HHS_BH_UserArgs_MT128x128x64_MI16x16x1_SN_LDSB1_CLR1_GSU0_GSUC0_GSUWGMRR0_K1_LBSPPA1024_LBSPPB1024_LPA0_LPB32_MIWT4_4_PLR1_SU32_SUM0_SUS256_SKXCCM6_VWA4_VWB2_WGM8_WGMXCC1_WGMXCCGn1
    SolutionIndex: 112
    SolutionNameMin: Cijk_Ailk_Bjlk_HHS_BH_UserArgs_MT128x128x64_MI16x16x1_SN_LDSB1_CLR1_GSU0_GSUC0_GSUWGMRR0_K1_LBSPPA1024_LBSPPB1024_LPA0_LPB0_MIWT4_4_PLR1_SU32_SUM0_SUS256_SKXCCM6_VWA4_VWB4_WGM8_WGMXCC1_WGMXCCGn1
    SolutionIndex: 113
    SolutionNameMin: Cijk_Ailk_Bjlk_HHS_BH_UserArgs_MT128x128x64_MI16x16x1_SN_LDSB1_CLR1_GSU0_GSUC0_GSUWGMRR0_K1_LBSPPA1024_LBSPPB1024_LPA0_LPB32_MIWT4_4_PLR2_SU32_SUM0_SUS256_SKXCCM6_VWA4_VWB2_WGM8_WGMXCC1_WGMXCCGn1
    SolutionIndex: 114
    SolutionNameMin: Cijk_Ailk_Bjlk_HHS_BH_UserArgs_MT128x128x64_MI16x16x1_SN_LDSB1_CLR1_GSU0_GSUC0_GSUWGMRR0_K1_LBSPPA1024_LBSPPB1024_LPA0_LPB0_MIWT4_4_PLR2_SU32_SUM0_SUS256_SKXCCM6_VWA4_VWB4_WGM8_WGMXCC1_WGMXCCGn1
    SolutionIndex: 115
    SolutionNameMin: Cijk_Ailk_Bjlk_HHS_BH_UserArgs_MT64x128x64_MI16x16x1_SN_LDSB1_CLR1_GSU0_GSUC0_GSUWGMRR0_K1_LBSPPA512_LBSPPB1024_LPA32_LPB0_MIWT2_4_PLR1_SU32_SUM0_SUS256_SKXCCM6_VWA2_VWB4_WGM8_WGMXCC1_WGMXCCGn1
    SolutionIndex: 116
    SolutionNameMin: Cijk_Ailk_Bjlk_HHS_BH_UserArgs_MT128x64x64_MI16x16x1_SN_LDSB1_CLR1_GSU0_GSUC0_GSUWGMRR0_K1_LBSPPA1024_LBSPPB512_LPA0_LPB16_MIWT4_2_PLR2_SU32_SUM0_SUS256_SKXCCM6_VWA4_VWB1_WGM1_WGMXCC1_WGMXCCGn1
    SolutionIndex: 117
    SolutionNameMin: Cijk_Ailk_Bjlk_HHS_BH_UserArgs_MT128x64x64_MI16x16x1_SN_LDSB1_CLR1_GSU0_GSUC0_GSUWGMRR0_K1_LBSPPA1024_LBSPPB512_LPA0_LPB32_MIWT4_2_PLR2_SU32_SUM0_SUS256_SKXCCM6_VWA4_VWB2_WGM1_WGMXCC1_WGMXCCGn1
    SolutionIndex: 118
    SolutionNameMin: Cijk_Ailk_Bjlk_HHS_BH_UserArgs_MT64x64x64_MI16x16x1_SN_LDSB1_CLR1_GSU0_GSUC0_GSUWGMRR0_K1_LBSPPA512_LBSPPB512_LPA32_LPB32_MIWT2_2_PLR2_SU32_SUM0_SUS256_SKXCCM6_VWA2_VWB2_WGM1_WGMXCC1_WGMXCCGn1
    SolutionIndex: 119
    SolutionNameMin: Cijk_Ailk_Bjlk_HHS_BH_UserArgs_MT64x64x64_MI16x16x1_SN_LDSB1_CLR1_GSU0_GSUC0_GSUWGMRR0_K1_LBSPPA512_LBSPPB512_LPA32_LPB32_MIWT2_2_PLR1_SU32_SUM0_SUS256_SKXCCM6_VWA2_VWB2_WGM4_WGMXCC1_WGMXCCGn1
    SolutionIndex: 120
    SolutionNameMin: Cijk_Ailk_Bjlk_HHS_BH_UserArgs_MT64x64x64_MI16x16x1_SN_LDSB1_CLR1_GSU0_GSUC0_GSUWGMRR0_K1_LBSPPA512_LBSPPB512_LPA32_LPB32_MIWT2_2_PLR2_SU32_SUM0_SUS256_SKXCCM6_VWA2_VWB2_WGM4_WGMXCC1_WGMXCCGn1
    SolutionIndex: 121
    SolutionNameMin: Cijk_Ailk_Bjlk_HHS_BH_UserArgs_MT32x64x64_MI16x16x1_SN_LDSB0_CLR1_GSU0_GSUC0_GSUWGMRR0_K1_LBSPPA256_LBSPPB512_LPA16_LPB32_MIWT1_2_PLR2_SU32_SUM0_SUS256_SKXCCM6_VWA1_VWB2_WGM1_WGMXCC1_WGMXCCGn1
    SolutionIndex: 122
    SolutionNameMin: Cijk_Ailk_Bjlk_HHS_BH_UserArgs_MT32x32x64_MI16x16x1_SN_LDSB0_CLR1_GSU0_GSUC0_GSUWGMRR0_K1_LBSPPA256_LBSPPB256_LPA16_LPB16_MIWT1_1_PLR1_SU32_SUM0_SUS256_SKXCCM6_VWA1_VWB1_WGM1_WGMXCC1_WGMXCCGn1
    SolutionIndex: 123
    SolutionNameMin: Cijk_Ailk_Bjlk_HHS_BH_UserArgs_MT32x32x64_MI16x16x1_SN_LDSB0_CLR1_GSU0_GSUC0_GSUWGMRR0_K1_LBSPPA256_LBSPPB256_LPA16_LPB16_MIWT1_1_PLR2_SU32_SUM0_SUS256_SKXCCM6_VWA1_VWB1_WGM1_WGMXCC1_WGMXCCGn1
    SolutionIndex: 124
    SolutionNameMin: Cijk_Ailk_Bjlk_HHS_BH_UserArgs_MT128x128x128_MI16x16x1_SN_LDSB1_CLR1_GSU0_GSUC0_GSUWGMRR0_K1_LBSPPA1024_LBSPPB1024_LPA0_LPB0_MIWT4_4_PLR1_SU32_SUM0_SUS256_SKXCCM6_VWA4_VWB4_WGM1_WGMXCC1_WGMXCCGn1
    SolutionIndex: 125
    SolutionNameMin: Cijk_Ailk_Bjlk_HHS_BH_UserArgs_MT128x128x128_MI16x16x1_SN_LDSB1_CLR1_GSU0_GSUC0_GSUWGMRR0_K1_LBSPPA1024_LBSPPB1024_LPA0_LPB0_MIWT4_4_PLR2_SU32_SUM0_SUS256_SKXCCM6_VWA4_VWB4_WGM1_WGMXCC1_WGMXCCGn1
    SolutionIndex: 126
    SolutionNameMin: Cijk_Ailk_Bjlk_HHS_BH_UserArgs_MT128x128x128_MI16x16x1_SN_LDSB1_CLR1_GSU0_GSUC0_GSUWGMRR0_K1_LBSPPA1024_LBSPPB1024_LPA0_LPB0_MIWT4_4_PLR1_SU32_SUM0_SUS256_SKXCCM6_VWA4_VWB4_WGM4_WGMXCC1_WGMXCCGn1
    SolutionIndex: 127
    SolutionNameMin: Cijk_Ailk_Bjlk_HHS_BH_UserArgs_MT128x128x128_MI16x16x1_SN_LDSB1_CLR1_GSU0_GSUC0_GSUWGMRR0_K1_LBSPPA1024_LBSPPB1024_LPA0_LPB0_MIWT4_4_PLR2_SU32_SUM0_SUS256_SKXCCM6_VWA4_VWB4_WGM4_WGMXCC1_WGMXCCGn1
    SolutionIndex: 128
    SolutionNameMin: Cijk_Ailk_Bjlk_HHS_BH_UserArgs_MT128x128x128_MI16x16x1_SN_LDSB1_CLR1_GSU0_GSUC0_GSUWGMRR0_K1_LBSPPA1024_LBSPPB1024_LPA0_LPB0_MIWT4_4_PLR1_SU32_SUM0_SUS256_SKXCCM6_VWA4_VWB4_WGM8_WGMXCC1_WGMXCCGn1
    SolutionIndex: 129
    SolutionNameMin: Cijk_Ailk_Bjlk_HHS_BH_UserArgs_MT64x128x128_MI16x16x1_SN_LDSB1_CLR1_GSU0_GSUC0_GSUWGMRR0_K1_LBSPPA512_LBSPPB1024_LPA32_LPB0_MIWT2_4_PLR2_SU32_SUM0_SUS256_SKXCCM6_VWA2_VWB4_WGM4_WGMXCC1_WGMXCCGn1
    SolutionIndex: 130
    SolutionNameMin: Cijk_Ailk_Bjlk_HHS_BH_UserArgs_MT128x64x128_MI16x16x1_SN_LDSB1_CLR1_GSU0_GSUC0_GSUWGMRR0_K1_LBSPPA1024_LBSPPB512_LPA0_LPB32_MIWT4_2_PLR2_SU32_SUM0_SUS256_SKXCCM6_VWA4_VWB2_WGM1_WGMXCC1_WGMXCCGn1
    SolutionIndex: 131
    SolutionNameMin: Cijk_Ailk_Bjlk_HHS_BH_UserArgs_MT128x64x128_MI16x16x1_SN_LDSB1_CLR1_GSU0_GSUC0_GSUWGMRR0_K1_LBSPPA1024_LBSPPB512_LPA0_LPB32_MIWT4_2_PLR2_SU32_SUM0_SUS256_SKXCCM6_VWA4_VWB2_WGM4_WGMXCC1_WGMXCCGn1
    SolutionIndex: 132
    SolutionNameMin: Cijk_Ailk_Bjlk_HHS_BH_UserArgs_MT128x64x128_MI16x16x1_SN_LDSB1_CLR1_GSU0_GSUC0_GSUWGMRR0_K1_LBSPPA1024_LBSPPB512_LPA0_LPB32_MIWT4_2_PLR2_SU32_SUM0_SUS256_SKXCCM6_VWA4_VWB2_WGM8_WGMXCC1_WGMXCCGn1
    SolutionIndex: 133
    SolutionNameMin: Cijk_Ailk_Bjlk_HHS_BH_UserArgs_MT64x64x128_MI16x16x1_SN_LDSB1_CLR1_GSU0_GSUC0_GSUWGMRR0_K1_LBSPPA512_LBSPPB512_LPA32_LPB32_MIWT2_2_PLR2_SU32_SUM0_SUS256_SKXCCM6_VWA2_VWB2_WGM1_WGMXCC1_WGMXCCGn1
    SolutionIndex: 134
    SolutionNameMin: Cijk_Ailk_Bjlk_HHS_BH_UserArgs_MT64x64x128_MI16x16x1_SN_LDSB1_CLR1_GSU0_GSUC0_GSUWGMRR0_K1_LBSPPA512_LBSPPB512_LPA32_LPB32_MIWT2_2_PLR2_SU32_SUM0_SUS256_SKXCCM6_VWA2_VWB2_WGM4_WGMXCC1_WGMXCCGn1
    SolutionIndex: 135
    SolutionNameMin: Cijk_Ailk_Bjlk_HHS_BH_UserArgs_MT32x64x128_MI16x16x1_SN_LDSB1_CLR1_GSU0_GSUC0_GSUWGMRR0_K1_LBSPPA256_LBSPPB512_LPA16_LPB32_MIWT1_2_PLR2_SU32_SUM0_SUS256_SKXCCM6_VWA1_VWB2_WGM1_WGMXCC1_WGMXCCGn1
    SolutionIndex: 136
    SolutionNameMin: Cijk_Ailk_Bjlk_HHS_BH_UserArgs_MT64x32x128_MI16x16x1_SN_LDSB1_CLR1_GSU0_GSUC0_GSUWGMRR0_K1_LBSPPA512_LBSPPB256_LPA32_LPB16_MIWT2_1_PLR2_SU32_SUM0_SUS256_SKXCCM6_VWA2_VWB1_WGM1_WGMXCC1_WGMXCCGn1
    SolutionIndex: 137
    SolutionNameMin: Cijk_Ailk_Bjlk_HHS_BH_UserArgs_MT64x32x128_MI16x16x1_SN_LDSB1_CLR1_GSU0_GSUC0_GSUWGMRR0_K1_LBSPPA512_LBSPPB256_LPA32_LPB16_MIWT2_1_PLR2_SU32_SUM0_SUS256_SKXCCM6_VWA2_VWB1_WGM4_WGMXCC1_WGMXCCGn1
    SolutionIndex: 138
    SolutionNameMin: Cijk_Ailk_Bjlk_HHS_BH_UserArgs_MT32x32x128_MI16x16x1_SN_LDSB1_CLR1_GSU0_GSUC0_GSUWGMRR0_K1_LBSPPA256_LBSPPB256_LPA16_LPB16_MIWT1_1_PLR1_SU32_SUM0_SUS256_SKXCCM6_VWA1_VWB1_WGM1_WGMXCC1_WGMXCCGn1
    SolutionIndex: 139
    SolutionNameMin: Cijk_Ailk_Bjlk_HHS_BH_UserArgs_MT32x32x32_MI16x16x1_SN_LDSB0_CLR1_GSU0_GSUC0_GSUWGMRR0_K1_LBSPPA256_LBSPPB256_LPA16_LPB16_MIWT1_1_PLR1_SU32_SUM0_SUS256_SKXCCM6_VWA1_VWB1_WGM8_WGMXCC1_WGMXCCGn1
- - - [128, 128, 1, 128, 128, 128, 128, 128]
    - [42, 0.079]
  - - [128, 128, 1, 256, 128, 128, 128, 128]
    - [42, 0.14]
  - - [128, 128, 1, 512, 128, 128, 128, 128]
    - [41, 0.229]
  - - [128, 128, 1, 1024, 128, 128, 128, 128]
    - [39, 0.338]
  - - [128, 128, 1, 2048, 128, 128, 128, 128]
    - [81, 0.548]
  - - [128, 128, 1, 4096, 128, 128, 128, 128]
    - [39, 0.929]
  - - [128, 128, 1, 8192, 128, 128, 128, 128]
    - [81, 1.412]
  - - [128, 256, 1, 128, 128, 128, 128, 256]
    - [40, 0.162]
  - - [128, 256, 1, 256, 128, 128, 128, 256]
    - [39, 0.289]
  - - [128, 256, 1, 512, 128, 128, 128, 256]
    - [55, 0.461]
  - - [128, 256, 1, 1024, 128, 128, 128, 256]
    - [54, 0.669]
  - - [128, 256, 1, 2048, 128, 128, 128, 256]
    - [81, 1.075]
  - - [128, 256, 1, 4096, 128, 128, 128, 256]
    - [122, 1.813]
  - - [128, 256, 1, 8192, 128, 128, 128, 256]
    - [54, 2.62]
  - - [128, 512, 1, 128, 128, 128, 128, 512]
    - [40, 0.327]
  - - [128, 512, 1, 256, 128, 128, 128, 512]
    - [40, 0.573]
  - - [128, 512, 1, 512, 128, 128, 128, 512]
    - [55, 0.921]
  - - [128, 512, 1, 1024, 128, 128, 128, 512]
    - [138, 1.327]
  - - [128, 512, 1, 2048, 128, 128, 128, 512]
    - [55, 2.042]
  - - [128, 512, 1, 4096, 128, 128, 128, 512]
    - [37, 3.181]
  - - [128, 512, 1, 8192, 128, 128, 128, 512]
    - [135, 4.724]
  - - [128, 1024, 1, 128, 128, 128, 128, 1024]
    - [14, 0.645]
  - - [128, 1024, 1, 256, 128, 128, 128, 1024]
    - [54, 1.109]
  - - [128, 1024, 1, 512, 128, 128, 128, 1024]
    - [39, 1.807]
  - - [128, 1024, 1, 1024, 128, 128, 128, 1024]
    - [55, 2.619]
  - - [128, 1024, 1, 2048, 128, 128, 128, 1024]
    - [52, 3.675]
  - - [128, 1024, 1, 4096, 128, 128, 128, 1024]
    - [36, 5.386]
  - - [128, 1024, 1, 8192, 128, 128, 128, 1024]
    - [50, 7.96]
  - - [128, 2048, 1, 128, 128, 128, 128, 2048]
    - [38, 1.188]
  - - [128, 2048, 1, 256, 128, 128, 128, 2048]
    - [38, 2.088]
  - - [128, 2048, 1, 512, 128, 128, 128, 2048]
    - [136, 3.286]
  - - [128, 2048, 1, 1024, 128, 128, 128, 2048]
    - [136, 4.758]
  - - [128, 2048, 1, 2048, 128, 128, 128, 2048]
    - [49, 6.259]
  - - [128, 2048, 1, 4096, 128, 128, 128, 2048]
    - [133, 8.718]
  - - [128, 2048, 1, 8192, 128, 128, 128, 2048]
    - [48, 11.523]
  - - [128, 4096, 1, 128, 128, 128, 128, 4096]
    - [36, 2.155]
  - - [128, 4096, 1, 256, 128, 128, 128, 4096]
    - [36, 3.7]
  - - [128, 4096, 1, 512, 128, 128, 128, 4096]
    - [49, 5.781]
  - - [128, 4096, 1, 1024, 128, 128, 128, 4096]
    - [133, 8.183]
  - - [128, 4096, 1, 2048, 128, 128, 128, 4096]
    - [118, 9.532]
  - - [128, 4096, 1, 4096, 128, 128, 128, 4096]
    - [105, 12.529]
  - - [128, 4096, 1, 8192, 128, 128, 128, 4096]
    - [125, 16.162]
  - - [128, 8192, 1, 128, 128, 128, 128, 8192]
    - [12, 3.576]
  - - [128, 8192, 1, 256, 128, 128, 128, 8192]
    - [32, 5.907]
  - - [128, 8192, 1, 512, 128, 128, 128, 8192]
    - [32, 8.948]
  - - [128, 8192, 1, 1024, 128, 128, 128, 8192]
    - [48, 11.818]
  - - [128, 8192, 1, 2048, 128, 128, 128, 8192]
    - [46, 13.165]
  - - [128, 8192, 1, 4096, 128, 128, 128, 8192]
    - [113, 15.616]
  - - [128, 8192, 1, 8192, 128, 128, 128, 8192]
    - [125, 18.502]
  - - [256, 128, 1, 128, 256, 256, 256, 128]
    - [15, 0.161]
  - - [256, 128, 1, 256, 256, 256, 256, 128]
    - [40, 0.286]
  - - [256, 128, 1, 512, 256, 256, 256, 128]
    - [40, 0.461]
  - - [256, 128, 1, 1024, 256, 256, 256, 128]
    - [54, 0.672]
  - - [256, 128, 1, 2048, 256, 256, 256, 128]
    - [82, 1.07]
  - - [256, 128, 1, 4096, 256, 256, 256, 128]
    - [123, 1.799]
  - - [256, 128, 1, 8192, 256, 256, 256, 128]
    - [55, 2.609]
  - - [256, 256, 1, 128, 256, 256, 256, 256]
    - [39, 0.316]
  - - [256, 256, 1, 256, 256, 256, 256, 256]
    - [40, 0.554]
  - - [256, 256, 1, 512, 256, 256, 256, 256]
    - [39, 0.905]
  - - [256, 256, 1, 1024, 256, 256, 256, 256]
    - [54, 1.315]
  - - [256, 256, 1, 2048, 256, 256, 256, 256]
    - [55, 2.03]
  - - [256, 256, 1, 4096, 256, 256, 256, 256]
    - [121, 3.22]
  - - [256, 256, 1, 8192, 256, 256, 256, 256]
    - [53, 4.821]
  - - [256, 512, 1, 128, 256, 256, 256, 512]
    - [15, 0.622]
  - - [256, 512, 1, 256, 256, 256, 256, 512]
    - [40, 1.1]
  - - [256, 512, 1, 512, 256, 256, 256, 512]
    - [39, 1.797]
  - - [256, 512, 1, 1024, 256, 256, 256, 512]
    - [54, 2.592]
  - - [256, 512, 1, 2048, 256, 256, 256, 512]
    - [52, 3.694]
  - - [256, 512, 1, 4096, 256, 256, 256, 512]
    - [118, 5.378]
  - - [256, 512, 1, 8192, 256, 256, 256, 512]
    - [49, 7.442]
  - - [256, 1024, 1, 128, 256, 256, 256, 1024]
    - [38, 1.172]
  - - [256, 1024, 1, 256, 256, 256, 256, 1024]
    - [38, 2.029]
  - - [256, 1024, 1, 512, 256, 256, 256, 1024]
    - [53, 3.245]
  - - [256, 1024, 1, 1024, 256, 256, 256, 1024]
    - [53, 4.773]
  - - [256, 1024, 1, 2048, 256, 256, 256, 1024]
    - [49, 6.258]
  - - [256, 1024, 1, 4096, 256, 256, 256, 1024]
    - [32, 8.803]
  - - [256, 1024, 1, 8192, 256, 256, 256, 1024]
    - [130, 11.135]
  - - [256, 2048, 1, 128, 256, 256, 256, 2048]
    - [36, 2.123]
  - - [256, 2048, 1, 256, 256, 256, 256, 2048]
    - [36, 3.665]
  - - [256, 2048, 1, 512, 256, 256, 256, 2048]
    - [49, 5.742]
  - - [256, 2048, 1, 1024, 256, 256, 256, 2048]
    - [133, 8.132]
  - - [256, 2048, 1, 2048, 256, 256, 256, 2048]
    - [33, 9.488]
  - - [256, 2048, 1, 4096, 256, 256, 256, 2048]
    - [117, 12.85]
  - - [256, 2048, 1, 8192, 256, 256, 256, 2048]
    - [124, 16.465]
  - - [256, 4096, 1, 128, 256, 256, 256, 4096]
    - [13, 3.54]
  - - [256, 4096, 1, 256, 256, 256, 256, 4096]
    - [32, 5.875]
  - - [256, 4096, 1, 512, 256, 256, 256, 4096]
    - [32, 8.884]
  - - [256, 4096, 1, 1024, 256, 256, 256, 4096]
    - [130, 12.133]
  - - [256, 4096, 1, 2048, 256, 256, 256, 4096]
    - [124, 13.462]
  - - [256, 4096, 1, 4096, 256, 256, 256, 4096]
    - [26, 15.839]
  - - [256, 4096, 1, 8192, 256, 256, 256, 4096]
    - [25, 18.379]
  - - [256, 8192, 1, 128, 256, 256, 256, 8192]
    - [75, 5.397]
  - - [256, 8192, 1, 256, 256, 256, 256, 8192]
    - [105, 9.012]
  - - [256, 8192, 1, 512, 256, 256, 256, 8192]
    - [105, 13.692]
  - - [256, 8192, 1, 1024, 256, 256, 256, 8192]
    - [124, 17.475]
  - - [256, 8192, 1, 2048, 256, 256, 256, 8192]
    - [76, 16.05]
  - - [256, 8192, 1, 4096, 256, 256, 256, 8192]
    - [100, 19.591]
  - - [256, 8192, 1, 8192, 256, 256, 256, 8192]
    - [6, 22.783]
  - - [512, 128, 1, 128, 512, 512, 512, 128]
    - [15, 0.316]
  - - [512, 128, 1, 256, 512, 512, 512, 128]
    - [39, 0.559]
  - - [512, 128, 1, 512, 512, 512, 512, 128]
    - [39, 0.906]
  - - [512, 128, 1, 1024, 512, 512, 512, 128]
    - [54, 1.321]
  - - [512, 128, 1, 2048, 512, 512, 512, 128]
    - [54, 2.018]
  - - [512, 128, 1, 4096, 512, 512, 512, 128]
    - [38, 3.177]
  - - [512, 128, 1, 8192, 512, 512, 512, 128]
    - [137, 4.582]
  - - [512, 256, 1, 128, 512, 512, 512, 256]
    - [40, 0.62]
  - - [512, 256, 1, 256, 512, 512, 512, 256]
    - [40, 1.093]
  - - [512, 256, 1, 512, 512, 512, 512, 256]
    - [40, 1.779]
  - - [512, 256, 1, 1024, 512, 512, 512, 256]
    - [54, 2.571]
  - - [512, 256, 1, 2048, 512, 512, 512, 256]
    - [53, 3.692]
  - - [512, 256, 1, 4096, 512, 512, 512, 256]
    - [119, 5.369]
  - - [512, 256, 1, 8192, 512, 512, 512, 256]
    - [49, 7.351]
  - - [512, 512, 1, 128, 512, 512, 512, 512]
    - [37, 1.16]
  - - [512, 512, 1, 256, 512, 512, 512, 512]
    - [38, 2.01]
  - - [512, 512, 1, 512, 512, 512, 512, 512]
    - [53, 3.274]
  - - [512, 512, 1, 1024, 512, 512, 512, 512]
    - [53, 4.784]
  - - [512, 512, 1, 2048, 512, 512, 512, 512]
    - [49, 6.224]
  - - [512, 512, 1, 4096, 512, 512, 512, 512]
    - [32, 8.756]
  - - [512, 512, 1, 8192, 512, 512, 512, 512]
    - [131, 11.129]
  - - [512, 1024, 1, 128, 512, 512, 512, 1024]
    - [35, 2.131]
  - - [512, 1024, 1, 256, 512, 512, 512, 1024]
    - [36, 3.681]
  - - [512, 1024, 1, 512, 512, 512, 512, 1024]
    - [49, 5.783]
  - - [512, 1024, 1, 1024, 512, 512, 512, 1024]
    - [49, 8.224]
  - - [512, 1024, 1, 2048, 512, 512, 512, 1024]
    - [130, 9.63]
  - - [512, 1024, 1, 4096, 512, 512, 512, 1024]
    - [33, 12.622]
  - - [512, 1024, 1, 8192, 512, 512, 512, 1024]
    - [45, 16.316]
  - - [512, 2048, 1, 128, 512, 512, 512, 2048]
    - [11, 3.5]
  - - [512, 2048, 1, 256, 512, 512, 512, 2048]
    - [32, 5.91]
  - - [512, 2048, 1, 512, 512, 512, 512, 2048]
    - [33, 8.916]
  - - [512, 2048, 1, 1024, 512, 512, 512, 2048]
    - [130, 12.169]
  - - [512, 2048, 1, 2048, 512, 512, 512, 2048]
    - [128, 13.956]
  - - [512, 2048, 1, 4096, 512, 512, 512, 2048]
    - [29, 15.49]
  - - [512, 2048, 1, 8192, 512, 512, 512, 2048]
    - [46, 18.152]
  - - [512, 4096, 1, 128, 512, 512, 512, 4096]
    - [10, 5.402]
  - - [512, 4096, 1, 256, 512, 512, 512, 4096]
    - [105, 9.032]
  - - [512, 4096, 1, 512, 512, 512, 512, 4096]
    - [105, 13.707]
  - - [512, 4096, 1, 1024, 512, 512, 512, 4096]
    - [124, 17.907]
  - - [512, 4096, 1, 2048, 512, 512, 512, 4096]
    - [130, 16.166]
  - - [512, 4096, 1, 4096, 512, 512, 512, 4096]
    - [24, 19.26]
  - - [512, 4096, 1, 8192, 512, 512, 512, 4096]
    - [8, 21.038]
  - - [512, 8192, 1, 128, 512, 512, 512, 8192]
    - [69, 7.908]
  - - [512, 8192, 1, 256, 512, 512, 512, 8192]
    - [69, 12.491]
  - - [512, 8192, 1, 512, 512, 512, 512, 8192]
    - [99, 16.988]
  - - [512, 8192, 1, 1024, 512, 512, 512, 8192]
    - [78, 16.669]
  - - [512, 8192, 1, 2048, 512, 512, 512, 8192]
    - [104, 20.159]
  - - [512, 8192, 1, 4096, 512, 512, 512, 8192]
    - [101, 23.6]
  - - [512, 8192, 1, 8192, 512, 512, 512, 8192]
    - [101, 25.174]
  - - [1024, 128, 1, 128, 1024, 1024, 1024, 128]
    - [40, 0.624]
  - - [1024, 128, 1, 256, 1024, 1024, 1024, 128]
    - [40, 1.097]
  - - [1024, 128, 1, 512, 1024, 1024, 1024, 128]
    - [39, 1.779]
  - - [1024, 128, 1, 1024, 1024, 1024, 1024, 128]
    - [54, 2.596]
  - - [1024, 128, 1, 2048, 1024, 1024, 1024, 128]
    - [53, 3.698]
  - - [1024, 128, 1, 4096, 1024, 1024, 1024, 128]
    - [36, 5.336]
  - - [1024, 128, 1, 8192, 1024, 1024, 1024, 128]
    - [49, 7.324]
  - - [1024, 256, 1, 128, 1024, 1024, 1024, 256]
    - [38, 1.174]
  - - [1024, 256, 1, 256, 1024, 1024, 1024, 256]
    - [38, 2.042]
  - - [1024, 256, 1, 512, 1024, 1024, 1024, 256]
    - [53, 3.271]
  - - [1024, 256, 1, 1024, 1024, 1024, 1024, 256]
    - [53, 4.735]
  - - [1024, 256, 1, 2048, 1024, 1024, 1024, 256]
    - [49, 6.264]
  - - [1024, 256, 1, 4096, 1024, 1024, 1024, 256]
    - [34, 8.477]
  - - [1024, 256, 1, 8192, 1024, 1024, 1024, 256]
    - [132, 11.12]
  - - [1024, 512, 1, 128, 1024, 1024, 1024, 512]
    - [36, 2.141]
  - - [1024, 512, 1, 256, 1024, 1024, 1024, 512]
    - [36, 3.672]
  - - [1024, 512, 1, 512, 1024, 1024, 1024, 512]
    - [49, 5.775]
  - - [1024, 512, 1, 1024, 1024, 1024, 1024, 512]
    - [49, 8.214]
  - - [1024, 512, 1, 2048, 1024, 1024, 1024, 512]
    - [48, 9.53]
  - - [1024, 512, 1, 4096, 1024, 1024, 1024, 512]
    - [28, 12.442]
  - - [1024, 512, 1, 8192, 1024, 1024, 1024, 512]
    - [43, 16.211]
  - - [1024, 1024, 1, 128, 1024, 1024, 1024, 1024]
    - [13, 3.56]
  - - [1024, 1024, 1, 256, 1024, 1024, 1024, 1024]
    - [32, 5.931]
  - - [1024, 1024, 1, 512, 1024, 1024, 1024, 1024]
    - [32, 8.946]
  - - [1024, 1024, 1, 1024, 1024, 1024, 1024, 1024]
    - [47, 12.08]
  - - [1024, 1024, 1, 2048, 1024, 1024, 1024, 1024]
    - [128, 13.89]
  - - [1024, 1024, 1, 4096, 1024, 1024, 1024, 1024]
    - [103, 15.136]
  - - [1024, 1024, 1, 8192, 1024, 1024, 1024, 1024]
    - [45, 17.883]
  - - [1024, 2048, 1, 128, 1024, 1024, 1024, 2048]
    - [10, 5.418]
  - - [1024, 2048, 1, 256, 1024, 1024, 1024, 2048]
    - [105, 9.045]
  - - [1024, 2048, 1, 512, 1024, 1024, 1024, 2048]
    - [105, 13.729]
  - - [1024, 2048, 1, 1024, 1024, 1024, 1024, 2048]
    - [124, 17.153]
  - - [1024, 2048, 1, 2048, 1024, 1024, 1024, 2048]
    - [116, 14.931]
  - - [1024, 2048, 1, 4096, 1024, 1024, 1024, 2048]
    - [23, 18.7]
  - - [1024, 2048, 1, 8192, 1024, 1024, 1024, 2048]
    - [7, 21.242]
  - - [1024, 4096, 1, 128, 1024, 1024, 1024, 4096]
    - [74, 8.208]
  - - [1024, 4096, 1, 256, 1024, 1024, 1024, 4096]
    - [74, 12.599]
  - - [1024, 4096, 1, 512, 1024, 1024, 1024, 4096]
    - [93, 17.007]
  - - [1024, 4096, 1, 1024, 1024, 1024, 1024, 4096]
    - [113, 16.776]
  - - [1024, 4096, 1, 2048, 1024, 1024, 1024, 4096]
    - [124, 19.539]
  - - [1024, 4096, 1, 4096, 1024, 1024, 1024, 4096]
    - [6, 22.003]
  - - [1024, 4096, 1, 8192, 1024, 1024, 1024, 4096]
    - [1, 25.419]
  - - [1024, 8192, 1, 128, 1024, 1024, 1024, 8192]
    - [61, 9.427]
  - - [1024, 8192, 1, 256, 1024, 1024, 1024, 8192]
    - [61, 14.797]
  - - [1024, 8192, 1, 512, 1024, 1024, 1024, 8192]
    - [91, 19.228]
  - - [1024, 8192, 1, 1024, 1024, 1024, 1024, 8192]
    - [70, 20.265]
  - - [1024, 8192, 1, 2048, 1024, 1024, 1024, 8192]
    - [103, 22.949]
  - - [1024, 8192, 1, 4096, 1024, 1024, 1024, 8192]
    - [18, 25.184]
  - - [1024, 8192, 1, 8192, 1024, 1024, 1024, 8192]
    - [2, 28.862]
  - - [2048, 128, 1, 128, 2048, 2048, 2048, 128]
    - [38, 1.179]
  - - [2048, 128, 1, 256, 2048, 2048, 2048, 128]
    - [38, 2.033]
  - - [2048, 128, 1, 512, 2048, 2048, 2048, 128]
    - [53, 3.293]
  - - [2048, 128, 1, 1024, 2048, 2048, 2048, 128]
    - [53, 4.757]
  - - [2048, 128, 1, 2048, 2048, 2048, 2048, 128]
    - [51, 5.942]
  - - [2048, 128, 1, 4096, 2048, 2048, 2048, 128]
    - [120, 8.274]
  - - [2048, 128, 1, 8192, 2048, 2048, 2048, 128]
    - [132, 11.213]
  - - [2048, 256, 1, 128, 2048, 2048, 2048, 256]
    - [36, 2.147]
  - - [2048, 256, 1, 256, 2048, 2048, 2048, 256]
    - [36, 3.71]
  - - [2048, 256, 1, 512, 2048, 2048, 2048, 256]
    - [49, 5.716]
  - - [2048, 256, 1, 1024, 2048, 2048, 2048, 256]
    - [49, 8.147]
  - - [2048, 256, 1, 2048, 2048, 2048, 2048, 256]
    - [35, 9.237]
  - - [2048, 256, 1, 4096, 2048, 2048, 2048, 256]
    - [108, 12.588]
  - - [2048, 256, 1, 8192, 2048, 2048, 2048, 256]
    - [126, 16.549]
  - - [2048, 512, 1, 128, 2048, 2048, 2048, 512]
    - [13, 3.556]
  - - [2048, 512, 1, 256, 2048, 2048, 2048, 512]
    - [31, 5.913]
  - - [2048, 512, 1, 512, 2048, 2048, 2048, 512]
    - [33, 8.824]
  - - [2048, 512, 1, 1024, 2048, 2048, 2048, 512]
    - [47, 12.032]
  - - [2048, 512, 1, 2048, 2048, 2048, 2048, 512]
    - [128, 14.072]
  - - [2048, 512, 1, 4096, 2048, 2048, 2048, 512]
    - [107, 15.509]
  - - [2048, 512, 1, 8192, 2048, 2048, 2048, 512]
    - [92, 16.962]
  - - [2048, 1024, 1, 128, 2048, 2048, 2048, 1024]
    - [75, 5.425]
  - - [2048, 1024, 1, 256, 2048, 2048, 2048, 1024]
    - [105, 9.036]
  - - [2048, 1024, 1, 512, 2048, 2048, 2048, 1024]
    - [105, 13.559]
  - - [2048, 1024, 1, 1024, 2048, 2048, 2048, 1024]
    - [126, 17.027]
  - - [2048, 1024, 1, 2048, 2048, 2048, 2048, 1024]
    - [77, 15.005]
  - - [2048, 1024, 1, 4096, 2048, 2048, 2048, 1024]
    - [22, 18.366]
  - - [2048, 1024, 1, 8192, 2048, 2048, 2048, 1024]
    - [5, 20.116]
  - - [2048, 2048, 1, 128, 2048, 2048, 2048, 2048]
    - [71, 7.978]
  - - [2048, 2048, 1, 256, 2048, 2048, 2048, 2048]
    - [69, 12.405]
  - - [2048, 2048, 1, 512, 2048, 2048, 2048, 2048]
    - [99, 16.585]
  - - [2048, 2048, 1, 1024, 2048, 2048, 2048, 2048]
    - [114, 16.618]
  - - [2048, 2048, 1, 2048, 2048, 2048, 2048, 2048]
    - [112, 19.937]
  - - [2048, 2048, 1, 4096, 2048, 2048, 2048, 2048]
    - [66, 21.908]
  - - [2048, 2048, 1, 8192, 2048, 2048, 2048, 2048]
    - [86, 24.071]
  - - [2048, 4096, 1, 128, 2048, 2048, 2048, 4096]
    - [60, 9.316]
  - - [2048, 4096, 1, 256, 2048, 2048, 2048, 4096]
    - [60, 14.492]
  - - [2048, 4096, 1, 512, 2048, 2048, 2048, 4096]
    - [88, 19.262]
  - - [2048, 4096, 1, 1024, 2048, 2048, 2048, 4096]
    - [127, 19.688]
  - - [2048, 4096, 1, 2048, 2048, 2048, 2048, 4096]
    - [93, 22.309]
  - - [2048, 4096, 1, 4096, 2048, 2048, 2048, 4096]
    - [57, 24.242]
  - - [2048, 4096, 1, 8192, 2048, 2048, 2048, 4096]
    - [0, 27.055]
  - - [2048, 8192, 1, 128, 2048, 2048, 2048, 8192]
    - [44, 9.081]
  - - [2048, 8192, 1, 256, 2048, 2048, 2048, 8192]
    - [106, 13.507]
  - - [2048, 8192, 1, 512, 2048, 2048, 2048, 8192]
    - [66, 18.889]
  - - [2048, 8192, 1, 1024, 2048, 2048, 2048, 8192]
    - [65, 21.585]
  - - [2048, 8192, 1, 2048, 2048, 2048, 2048, 8192]
    - [66, 24.856]
  - - [2048, 8192, 1, 4096, 2048, 2048, 2048, 8192]
    - [66, 28.847]
  - - [2048, 8192, 1, 8192, 2048, 2048, 2048, 8192]
    - [87, 29.267]
  - - [4096, 128, 1, 128, 4096, 4096, 4096, 128]
    - [36, 2.166]
  - - [4096, 128, 1, 256, 4096, 4096, 4096, 128]
    - [36, 3.682]
  - - [4096, 128, 1, 512, 4096, 4096, 4096, 128]
    - [49, 5.81]
  - - [4096, 128, 1, 1024, 4096, 4096, 4096, 128]
    - [134, 8.113]
  - - [4096, 128, 1, 2048, 4096, 4096, 4096, 128]
    - [35, 9.571]
  - - [4096, 128, 1, 4096, 4096, 4096, 4096, 128]
    - [105, 12.433]
  - - [4096, 128, 1, 8192, 4096, 4096, 4096, 128]
    - [46, 16.061]
  - - [4096, 256, 1, 128, 4096, 4096, 4096, 256]
    - [80, 3.553]
  - - [4096, 256, 1, 256, 4096, 4096, 4096, 256]
    - [32, 5.879]
  - - [4096, 256, 1, 512, 4096, 4096, 4096, 256]
    - [117, 8.83]
  - - [4096, 256, 1, 1024, 4096, 4096, 4096, 256]
    - [131, 12.062]
  - - [4096, 256, 1, 2048, 4096, 4096, 4096, 256]
    - [128, 13.625]
  - - [4096, 256, 1, 4096, 4096, 4096, 4096, 256]
    - [109, 15.772]
  - - [4096, 256, 1, 8192, 4096, 4096, 4096, 256]
    - [98, 17.733]
  - - [4096, 512, 1, 128, 4096, 4096, 4096, 512]
    - [9, 5.37]
  - - [4096, 512, 1, 256, 4096, 4096, 4096, 512]
    - [28, 8.96]
  - - [4096, 512, 1, 512, 4096, 4096, 4096, 512]
    - [108, 13.568]
  - - [4096, 512, 1, 1024, 4096, 4096, 4096, 512]
    - [126, 17.581]
  - - [4096, 512, 1, 2048, 4096, 4096, 4096, 512]
    - [115, 15.775]
  - - [4096, 512, 1, 4096, 4096, 4096, 4096, 512]
    - [97, 18.86]
  - - [4096, 512, 1, 8192, 4096, 4096, 4096, 512]
    - [5, 21.047]
  - - [4096, 1024, 1, 128, 4096, 4096, 4096, 1024]
    - [74, 8.144]
  - - [4096, 1024, 1, 256, 4096, 4096, 4096, 1024]
    - [73, 12.752]
  - - [4096, 1024, 1, 512, 4096, 4096, 4096, 1024]
    - [102, 16.729]
  - - [4096, 1024, 1, 1024, 4096, 4096, 4096, 1024]
    - [110, 16.774]
  - - [4096, 1024, 1, 2048, 4096, 4096, 4096, 1024]
    - [127, 19.733]
  - - [4096, 1024, 1, 4096, 4096, 4096, 4096, 1024]
    - [4, 21.932]
  - - [4096, 1024, 1, 8192, 4096, 4096, 4096, 1024]
    - [19, 23.854]
  - - [4096, 2048, 1, 128, 4096, 4096, 4096, 2048]
    - [59, 9.239]
  - - [4096, 2048, 1, 256, 4096, 4096, 4096, 2048]
    - [59, 14.414]
  - - [4096, 2048, 1, 512, 4096, 4096, 4096, 2048]
    - [88, 19.226]
  - - [4096, 2048, 1, 1024, 4096, 4096, 4096, 2048]
    - [67, 19.607]
  - - [4096, 2048, 1, 2048, 4096, 4096, 4096, 2048]
    - [94, 22.661]
  - - [4096, 2048, 1, 4096, 4096, 4096, 4096, 2048]
    - [57, 24.478]
  - - [4096, 2048, 1, 8192, 4096, 4096, 4096, 2048]
    - [85, 28.274]
  - - [4096, 4096, 1, 128, 4096, 4096, 4096, 4096]
    - [125, 9.201]
  - - [4096, 4096, 1, 256, 4096, 4096, 4096, 4096]
    - [108, 13.07]
  - - [4096, 4096, 1, 512, 4096, 4096, 4096, 4096]
    - [95, 18.032]
  - - [4096, 4096, 1, 1024, 4096, 4096, 4096, 4096]
    - [66, 21.83]
  - - [4096, 4096, 1, 2048, 4096, 4096, 4096, 4096]
    - [94, 24.953]
  - - [4096, 4096, 1, 4096, 4096, 4096, 4096, 4096]
    - [83, 29.078]
  - - [4096, 4096, 1, 8192, 4096, 4096, 4096, 4096]
    - [57, 30.989]
  - - [4096, 8192, 1, 128, 4096, 4096, 4096, 8192]
    - [104, 10.148]
  - - [4096, 8192, 1, 256, 4096, 4096, 4096, 8192]
    - [68, 14.809]
  - - [4096, 8192, 1, 512, 4096, 4096, 4096, 8192]
    - [66, 19.278]
  - - [4096, 8192, 1, 1024, 4096, 4096, 4096, 8192]
    - [88, 24.011]
  - - [4096, 8192, 1, 2048, 4096, 4096, 4096, 8192]
    - [56, 28.653]
  - - [4096, 8192, 1, 4096, 4096, 4096, 4096, 8192]
    - [87, 31.509]
  - - [4096, 8192, 1, 8192, 4096, 4096, 4096, 8192]
    - [63, 34.642]
  - - [8192, 128, 1, 128, 8192, 8192, 8192, 128]
    - [13, 3.587]
  - - [8192, 128, 1, 256, 8192, 8192, 8192, 128]
    - [79, 5.853]
  - - [8192, 128, 1, 512, 8192, 8192, 8192, 128]
    - [30, 8.743]
  - - [8192, 128, 1, 1024, 8192, 8192, 8192, 128]
    - [132, 11.105]
  - - [8192, 128, 1, 2048, 8192, 8192, 8192, 128]
    - [44, 13.018]
  - - [8192, 128, 1, 4096, 8192, 8192, 8192, 128]
    - [106, 16.059]
  - - [8192, 128, 1, 8192, 8192, 8192, 8192, 128]
    - [124, 18.515]
  - - [8192, 256, 1, 128, 8192, 8192, 8192, 256]
    - [77, 5.321]
  - - [8192, 256, 1, 256, 8192, 8192, 8192, 256]
    - [108, 8.904]
  - - [8192, 256, 1, 512, 8192, 8192, 8192, 256]
    - [108, 13.418]
  - - [8192, 256, 1, 1024, 8192, 8192, 8192, 256]
    - [128, 17.325]
  - - [8192, 256, 1, 2048, 8192, 8192, 8192, 256]
    - [129, 16.165]
  - - [8192, 256, 1, 4096, 8192, 8192, 8192, 256]
    - [106, 19.848]
  - - [8192, 256, 1, 8192, 8192, 8192, 8192, 256]
    - [5, 22.796]
  - - [8192, 512, 1, 128, 8192, 8192, 8192, 512]
    - [72, 7.914]
  - - [8192, 512, 1, 256, 8192, 8192, 8192, 512]
    - [73, 12.329]
  - - [8192, 512, 1, 512, 8192, 8192, 8192, 512]
    - [102, 16.609]
  - - [8192, 512, 1, 1024, 8192, 8192, 8192, 512]
    - [111, 16.633]
  - - [8192, 512, 1, 2048, 8192, 8192, 8192, 512]
    - [126, 20.352]
  - - [8192, 512, 1, 4096, 8192, 8192, 8192, 512]
    - [92, 24.162]
  - - [8192, 512, 1, 8192, 8192, 8192, 8192, 512]
    - [20, 25.493]
  - - [8192, 1024, 1, 128, 8192, 8192, 8192, 1024]
    - [58, 9.445]
  - - [8192, 1024, 1, 256, 8192, 8192, 8192, 1024]
    - [59, 14.591]
  - - [8192, 1024, 1, 512, 8192, 8192, 8192, 1024]
    - [90, 18.901]
  - - [8192, 1024, 1, 1024, 8192, 8192, 8192, 1024]
    - [68, 19.979]
  - - [8192, 1024, 1, 2048, 8192, 8192, 8192, 1024]
    - [65, 23.399]
  - - [8192, 1024, 1, 4096, 8192, 8192, 8192, 1024]
    - [56, 25.312]
  - - [8192, 1024, 1, 8192, 8192, 8192, 8192, 1024]
    - [83, 29.149]
  - - [8192, 2048, 1, 128, 8192, 8192, 8192, 2048]
    - [128, 8.676]
  - - [8192, 2048, 1, 256, 8192, 8192, 8192, 2048]
    - [109, 13.331]
  - - [8192, 2048, 1, 512, 8192, 8192, 8192, 2048]
    - [128, 17.925]
  - - [8192, 2048, 1, 1024, 8192, 8192, 8192, 2048]
    - [64, 21.601]
  - - [8192, 2048, 1, 2048, 8192, 8192, 8192, 2048]
    - [56, 25.296]
  - - [8192, 2048, 1, 4096, 8192, 8192, 8192, 2048]
    - [84, 29.874]
  - - [8192, 2048, 1, 8192, 8192, 8192, 8192, 2048]
    - [84, 31.819]
  - - [8192, 4096, 1, 128, 8192, 8192, 8192, 4096]
    - [27, 10.016]
  - - [8192, 4096, 1, 256, 8192, 8192, 8192, 4096]
    - [64, 14.598]
  - - [8192, 4096, 1, 512, 8192, 8192, 8192, 4096]
    - [92, 19.096]
  - - [8192, 4096, 1, 1024, 8192, 8192, 8192, 4096]
    - [89, 24.291]
  - - [8192, 4096, 1, 2048, 8192, 8192, 8192, 4096]
    - [56, 29.115]
  - - [8192, 4096, 1, 4096, 8192, 8192, 8192, 4096]
    - [88, 32.906]
  - - [8192, 4096, 1, 8192, 8192, 8192, 8192, 4096]
    - [16, 34.857]
  - - [8192, 8192, 1, 128, 8192, 8192, 8192, 8192]
    - [21, 10.222]
  - - [8192, 8192, 1, 256, 8192, 8192, 8192, 8192]
    - [3, 14.88]
  - - [8192, 8192, 1, 512, 8192, 8192, 8192, 8192]
    - [84, 20.299]
  - - [8192, 8192, 1, 1024, 8192, 8192, 8192, 8192]
    - [96, 25.937]
  - - [8192, 8192, 1, 2048, 8192, 8192, 8192, 8192]
    - [62, 31.31]
  - - [8192, 8192, 1, 4096, 8192, 8192, 8192, 8192]
    - [17, 34.356]
  - - [8192, 8192, 1, 8192, 8192, 8192, 8192, 8192]
    - [57, 37.156]
  - - [1, 1, 1, 32, 1, 1, 1, 1]
    - [139, 0.0]
- null
- null
- ExperimentalStreamK
- GridBased
