library/src/amd_detail/rocblaslt/src/Tensile/Logic/asm_full/aquavanjaram/gfx942_228cu/StreamK/aquavanjaram942_Cijk_Alik_Bjlk_HSS_BH_UserArgs.yaml
- {MinimumRequiredVersion: 4.33.0}
- aquavanjaram942
- {Architecture: gfx942, CUCount: 228}
- [Device 0049, Device 0050]
    SolutionIndex: 0
    SolutionNameMin: Cijk_Alik_Bjlk_HSS_BH_UserArgs_MT256x256x32_MI16x16x1_SN_LDSB1_CLR1_GSU0_GSUC0_GSUWGMRR0_K1_LBSPPA128_LBSPPB2048_LPB16_MIWT8_8_PLR1_SU32_SUM0_SUS256_SKXCCM0_VWA2_VWB1_WGM1_WGMXCC1_WGMXCCGn1
    SolutionIndex: 1
    SolutionNameMin: Cijk_Alik_Bjlk_HSS_BH_UserArgs_MT256x256x32_MI16x16x1_SN_LDSB1_CLR1_GSU0_GSUC0_GSUWGMRR0_K1_LBSPPA256_LBSPPB2048_LPB32_MIWT8_8_PLR1_SU32_SUM0_SUS256_SKXCCM0_VWA4_VWB2_WGM1_WGMXCC1_WGMXCCGn1
    SolutionIndex: 2
    SolutionNameMin: Cijk_Alik_Bjlk_HSS_BH_UserArgs_MT256x256x32_MI16x16x1_SN_LDSB1_CLR1_GSU0_GSUC0_GSUWGMRR0_K1_LBSPPA256_LBSPPB2048_LPB0_MIWT8_8_PLR1_SU32_SUM0_SUS256_SKXCCM0_VWA4_VWB4_WGM1_WGMXCC1_WGMXCCGn1
    SolutionIndex: 3
    SolutionNameMin: Cijk_Alik_Bjlk_HSS_BH_UserArgs_MT256x256x32_MI16x16x1_SN_LDSB1_CLR1_GSU0_GSUC0_GSUWGMRR0_K1_LBSPPA128_LBSPPB2048_LPB0_MIWT8_8_PLR1_SU32_SUM0_SUS256_SKXCCM0_VWA2_VWB8_WGM1_WGMXCC1_WGMXCCGn1
    SolutionIndex: 4
    SolutionNameMin: Cijk_Alik_Bjlk_HSS_BH_UserArgs_MT256x256x32_MI16x16x1_SN_LDSB1_CLR1_GSU0_GSUC0_GSUWGMRR0_K1_LBSPPA256_LBSPPB2048_LPB0_MIWT8_8_PLR1_SU32_SUM0_SUS256_SKXCCM0_VWA4_VWB8_WGM1_WGMXCC1_WGMXCCGn1
    SolutionIndex: 5
    SolutionNameMin: Cijk_Alik_Bjlk_HSS_BH_UserArgs_MT128x128x32_MI16x16x1_SN_LDSB1_CLR1_GSU0_GSUC0_GSUWGMRR0_K1_LBSPPA256_LBSPPB1024_LPB0_MIWT4_4_PLR1_SU32_SUM0_SUS256_SKXCCM0_VWA4_VWB4_WGM4_WGMXCC1_WGMXCCGn1
    SolutionIndex: 6
    SolutionNameMin: Cijk_Alik_Bjlk_HSS_BH_UserArgs_MT64x128x32_MI16x16x1_SN_LDSB0_CLR1_GSU0_GSUC0_GSUWGMRR0_K1_LBSPPA128_LBSPPB1024_LPB0_MIWT2_4_PLR1_SU32_SUM0_SUS256_SKXCCM0_VWA1_VWB4_WGM1_WGMXCC1_WGMXCCGn1
    SolutionIndex: 7
    SolutionNameMin: Cijk_Alik_Bjlk_HSS_BH_UserArgs_MT128x64x32_MI16x16x1_SN_LDSB0_CLR1_GSU0_GSUC0_GSUWGMRR0_K1_LBSPPA256_LBSPPB512_LPB32_MIWT4_2_PLR1_SU32_SUM0_SUS256_SKXCCM0_VWA4_VWB2_WGM1_WGMXCC1_WGMXCCGn1
    SolutionIndex: 8
    SolutionNameMin: Cijk_Alik_Bjlk_HSS_BH_UserArgs_MT64x64x32_MI16x16x1_SN_LDSB0_CLR1_GSU0_GSUC0_GSUWGMRR0_K1_LBSPPA128_LBSPPB512_LPB32_MIWT2_2_PLR1_SU32_SUM0_SUS256_SKXCCM0_VWA1_VWB2_WGM1_WGMXCC1_WGMXCCGn1
    SolutionIndex: 9
    SolutionNameMin: Cijk_Alik_Bjlk_HSS_BH_UserArgs_MT128x256x64_MI16x16x1_SN_LDSB1_CLR1_GSU0_GSUC0_GSUWGMRR0_K1_LBSPPA512_LBSPPB4096_LPB32_MIWT4_8_PLR1_SU32_SUM0_SUS256_SKXCCM0_VWA4_VWB2_WGM1_WGMXCC1_WGMXCCGn1
    SolutionIndex: 10
    SolutionNameMin: Cijk_Alik_Bjlk_HSS_BH_UserArgs_MT128x256x64_MI16x16x1_SN_LDSB1_CLR1_GSU0_GSUC0_GSUWGMRR0_K1_LBSPPA512_LBSPPB4096_LPB0_MIWT4_8_PLR1_SU32_SUM0_SUS256_SKXCCM0_VWA4_VWB4_WGM1_WGMXCC1_WGMXCCGn1
    SolutionIndex: 11
    SolutionNameMin: Cijk_Alik_Bjlk_HSS_BH_UserArgs_MT128x256x64_MI16x16x1_SN_LDSB1_CLR1_GSU0_GSUC0_GSUWGMRR0_K1_LBSPPA512_LBSPPB4096_LPB0_MIWT4_8_PLR1_SU32_SUM0_SUS256_SKXCCM0_VWA4_VWB8_WGM1_WGMXCC1_WGMXCCGn1
    SolutionIndex: 12
    SolutionNameMin: Cijk_Alik_Bjlk_HSS_BH_UserArgs_MT256x128x64_MI16x16x1_SN_LDSB1_CLR1_GSU0_GSUC0_GSUWGMRR0_K1_LBSPPA512_LBSPPB2048_LPB32_MIWT8_4_PLR1_SU32_SUM0_SUS256_SKXCCM0_VWA4_VWB2_WGM1_WGMXCC1_WGMXCCGn1
    SolutionIndex: 13
    SolutionNameMin: Cijk_Alik_Bjlk_HSS_BH_UserArgs_MT256x128x64_MI16x16x1_SN_LDSB1_CLR1_GSU0_GSUC0_GSUWGMRR0_K1_LBSPPA512_LBSPPB2048_LPB0_MIWT8_4_PLR1_SU32_SUM0_SUS256_SKXCCM0_VWA4_VWB4_WGM1_WGMXCC1_WGMXCCGn1
    SolutionIndex: 14
    SolutionNameMin: Cijk_Alik_Bjlk_HSS_BH_UserArgs_MT256x128x64_MI16x16x1_SN_LDSB1_CLR1_GSU0_GSUC0_GSUWGMRR0_K1_LBSPPA512_LBSPPB2048_LPB32_MIWT8_4_PLR1_SU32_SUM0_SUS256_SKXCCM0_VWA4_VWB2_WGM4_WGMXCC1_WGMXCCGn1
    SolutionIndex: 15
    SolutionNameMin: Cijk_Alik_Bjlk_HSS_BH_UserArgs_MT256x128x64_MI16x16x1_SN_LDSB1_CLR1_GSU0_GSUC0_GSUWGMRR0_K1_LBSPPA512_LBSPPB2048_LPB32_MIWT8_4_PLR1_SU32_SUM0_SUS256_SKXCCM0_VWA4_VWB2_WGM8_WGMXCC1_WGMXCCGn1
    SolutionIndex: 16
    SolutionNameMin: Cijk_Alik_Bjlk_HSS_BH_UserArgs_MT256x128x64_MI16x16x1_SN_LDSB1_CLR1_GSU0_GSUC0_GSUWGMRR0_K1_LBSPPA128_LBSPPB2048_LPB0_MIWT8_4_PLR1_SU32_SUM0_SUS256_SKXCCM0_VWA1_VWB4_WGM8_WGMXCC1_WGMXCCGn1
    SolutionIndex: 17
    SolutionNameMin: Cijk_Alik_Bjlk_HSS_BH_UserArgs_MT256x128x64_MI16x16x1_SN_LDSB1_CLR1_GSU0_GSUC0_GSUWGMRR0_K1_LBSPPA512_LBSPPB2048_LPB0_MIWT8_4_PLR1_SU32_SUM0_SUS256_SKXCCM0_VWA4_VWB4_WGM8_WGMXCC1_WGMXCCGn1
    SolutionIndex: 18
    SolutionNameMin: Cijk_Alik_Bjlk_HSS_BH_UserArgs_MT256x64x64_MI16x16x1_SN_LDSB1_CLR1_GSU0_GSUC0_GSUWGMRR0_K1_LBSPPA512_LBSPPB1024_LPB32_MIWT8_2_PLR1_SU32_SUM0_SUS256_SKXCCM0_VWA4_VWB2_WGM4_WGMXCC1_WGMXCCGn1
    SolutionIndex: 19
    SolutionNameMin: Cijk_Alik_Bjlk_HSS_BH_UserArgs_MT128x128x64_MI16x16x1_SN_LDSB1_CLR1_GSU0_GSUC0_GSUWGMRR0_K1_LBSPPA512_LBSPPB2048_LPB32_MIWT4_4_PLR1_SU32_SUM0_SUS256_SKXCCM0_VWA4_VWB2_WGM1_WGMXCC1_WGMXCCGn1
    SolutionIndex: 20
    SolutionNameMin: Cijk_Alik_Bjlk_HSS_BH_UserArgs_MT128x128x64_MI16x16x1_SN_LDSB1_CLR1_GSU0_GSUC0_GSUWGMRR0_K1_LBSPPA128_LBSPPB2048_LPB0_MIWT4_4_PLR1_SU32_SUM0_SUS256_SKXCCM0_VWA1_VWB4_WGM1_WGMXCC1_WGMXCCGn1
    SolutionIndex: 21
    SolutionNameMin: Cijk_Alik_Bjlk_HSS_BH_UserArgs_MT128x128x64_MI16x16x1_SN_LDSB1_CLR1_GSU0_GSUC0_GSUWGMRR0_K1_LBSPPA512_LBSPPB2048_LPB0_MIWT4_4_PLR1_SU32_SUM0_SUS256_SKXCCM0_VWA4_VWB4_WGM1_WGMXCC1_WGMXCCGn1
    SolutionIndex: 22
    SolutionNameMin: Cijk_Alik_Bjlk_HSS_BH_UserArgs_MT128x128x64_MI16x16x1_SN_LDSB1_CLR1_GSU0_GSUC0_GSUWGMRR0_K1_LBSPPA512_LBSPPB2048_LPB32_MIWT4_4_PLR2_SU32_SUM0_SUS256_SKXCCM0_VWA4_VWB2_WGM1_WGMXCC1_WGMXCCGn1
    SolutionIndex: 23
    SolutionNameMin: Cijk_Alik_Bjlk_HSS_BH_UserArgs_MT128x128x64_MI16x16x1_SN_LDSB1_CLR1_GSU0_GSUC0_GSUWGMRR0_K1_LBSPPA512_LBSPPB2048_LPB32_MIWT4_4_PLR1_SU32_SUM0_SUS256_SKXCCM0_VWA4_VWB2_WGM4_WGMXCC1_WGMXCCGn1
    SolutionIndex: 24
    SolutionNameMin: Cijk_Alik_Bjlk_HSS_BH_UserArgs_MT128x128x64_MI16x16x1_SN_LDSB1_CLR1_GSU0_GSUC0_GSUWGMRR0_K1_LBSPPA512_LBSPPB2048_LPB0_MIWT4_4_PLR1_SU32_SUM0_SUS256_SKXCCM0_VWA4_VWB4_WGM4_WGMXCC1_WGMXCCGn1
    SolutionIndex: 25
    SolutionNameMin: Cijk_Alik_Bjlk_HSS_BH_UserArgs_MT128x128x64_MI16x16x1_SN_LDSB1_CLR1_GSU0_GSUC0_GSUWGMRR0_K1_LBSPPA128_LBSPPB2048_LPB0_MIWT4_4_PLR1_SU32_SUM0_SUS256_SKXCCM0_VWA1_VWB4_WGM8_WGMXCC1_WGMXCCGn1
    SolutionIndex: 26
    SolutionNameMin: Cijk_Alik_Bjlk_HSS_BH_UserArgs_MT128x128x64_MI16x16x1_SN_LDSB1_CLR1_GSU0_GSUC0_GSUWGMRR0_K1_LBSPPA512_LBSPPB2048_LPB0_MIWT4_4_PLR1_SU32_SUM0_SUS256_SKXCCM0_VWA4_VWB4_WGM8_WGMXCC1_WGMXCCGn1
    SolutionIndex: 27
    SolutionNameMin: Cijk_Alik_Bjlk_HSS_BH_UserArgs_MT64x128x64_MI16x16x1_SN_LDSB1_CLR1_GSU0_GSUC0_GSUWGMRR0_K1_LBSPPA128_LBSPPB2048_LPB0_MIWT2_4_PLR1_SU32_SUM0_SUS256_SKXCCM0_VWA1_VWB4_WGM1_WGMXCC1_WGMXCCGn1
    SolutionIndex: 28
    SolutionNameMin: Cijk_Alik_Bjlk_HSS_BH_UserArgs_MT64x128x64_MI16x16x1_SN_LDSB1_CLR1_GSU0_GSUC0_GSUWGMRR0_K1_LBSPPA128_LBSPPB2048_LPB0_MIWT2_4_PLR1_SU32_SUM0_SUS256_SKXCCM0_VWA1_VWB4_WGM8_WGMXCC1_WGMXCCGn1
    SolutionIndex: 29
    SolutionNameMin: Cijk_Alik_Bjlk_HSS_BH_UserArgs_MT128x64x64_MI16x16x1_SN_LDSB1_CLR1_GSU0_GSUC0_GSUWGMRR0_K1_LBSPPA128_LBSPPB1024_LPB32_MIWT4_2_PLR1_SU32_SUM0_SUS256_SKXCCM0_VWA1_VWB2_WGM1_WGMXCC1_WGMXCCGn1
    SolutionIndex: 30
    SolutionNameMin: Cijk_Alik_Bjlk_HSS_BH_UserArgs_MT128x64x64_MI16x16x1_SN_LDSB1_CLR1_GSU0_GSUC0_GSUWGMRR0_K1_LBSPPA512_LBSPPB1024_LPB32_MIWT4_2_PLR1_SU32_SUM0_SUS256_SKXCCM0_VWA4_VWB2_WGM1_WGMXCC1_WGMXCCGn1
    SolutionIndex: 31
    SolutionNameMin: Cijk_Alik_Bjlk_HSS_BH_UserArgs_MT128x64x64_MI16x16x1_SN_LDSB1_CLR1_GSU0_GSUC0_GSUWGMRR0_K1_LBSPPA512_LBSPPB1024_LPB32_MIWT4_2_PLR1_SU32_SUM0_SUS256_SKXCCM0_VWA4_VWB2_WGM8_WGMXCC1_WGMXCCGn1
    SolutionIndex: 32
    SolutionNameMin: Cijk_Alik_Bjlk_HSS_BH_UserArgs_MT64x64x64_MI16x16x1_SN_LDSB1_CLR1_GSU0_GSUC0_GSUWGMRR0_K1_LBSPPA128_LBSPPB1024_LPB32_MIWT2_2_PLR1_SU32_SUM0_SUS256_SKXCCM0_VWA1_VWB2_WGM1_WGMXCC1_WGMXCCGn1
    SolutionIndex: 33
    SolutionNameMin: Cijk_Alik_Bjlk_HSS_BH_UserArgs_MT64x64x64_MI16x16x1_SN_LDSB1_CLR1_GSU0_GSUC0_GSUWGMRR0_K1_LBSPPA128_LBSPPB1024_LPB32_MIWT2_2_PLR1_SU32_SUM0_SUS256_SKXCCM0_VWA1_VWB2_WGM4_WGMXCC1_WGMXCCGn1
    SolutionIndex: 34
    SolutionNameMin: Cijk_Alik_Bjlk_HSS_BH_UserArgs_MT32x64x64_MI16x16x1_SN_LDSB0_CLR1_GSU0_GSUC0_GSUWGMRR0_K1_LBSPPA128_LBSPPB1024_LPB32_MIWT1_2_PLR1_SU32_SUM0_SUS256_SKXCCM0_VWA1_VWB2_WGM1_WGMXCC1_WGMXCCGn1
    SolutionIndex: 35
    SolutionNameMin: Cijk_Alik_Bjlk_HSS_BH_UserArgs_MT32x32x64_MI16x16x1_SN_LDSB0_CLR1_GSU0_GSUC0_GSUWGMRR0_K1_LBSPPA128_LBSPPB512_LPB16_MIWT1_1_PLR1_SU32_SUM0_SUS256_SKXCCM0_VWA1_VWB1_WGM1_WGMXCC1_WGMXCCGn1
    SolutionIndex: 36
    SolutionNameMin: Cijk_Alik_Bjlk_HSS_BH_UserArgs_MT32x32x64_MI16x16x1_SN_LDSB0_CLR1_GSU0_GSUC0_GSUWGMRR0_K1_LBSPPA128_LBSPPB512_LPB16_MIWT1_1_PLR1_SU32_SUM0_SUS256_SKXCCM0_VWA1_VWB1_WGM4_WGMXCC1_WGMXCCGn1
    SolutionIndex: 37
    SolutionNameMin: Cijk_Alik_Bjlk_HSS_BH_UserArgs_MT128x64x128_MI16x16x1_SN_LDSB1_CLR1_GSU0_GSUC0_GSUWGMRR0_K1_LBSPPA256_LBSPPB1024_LPB32_MIWT4_2_PLR2_SU32_SUM0_SUS256_SKXCCM0_VWA1_VWB2_WGM1_WGMXCC1_WGMXCCGn1
    SolutionIndex: 38
    SolutionNameMin: Cijk_Alik_Bjlk_HSS_BH_UserArgs_MT128x64x128_MI16x16x1_SN_LDSB1_CLR1_GSU0_GSUC0_GSUWGMRR0_K1_LBSPPA1024_LBSPPB1024_LPB32_MIWT4_2_PLR2_SU32_SUM0_SUS256_SKXCCM0_VWA4_VWB2_WGM1_WGMXCC1_WGMXCCGn1
    SolutionIndex: 39
    SolutionNameMin: Cijk_Alik_Bjlk_HSS_BH_UserArgs_MT128x64x128_MI16x16x1_SN_LDSB1_CLR1_GSU0_GSUC0_GSUWGMRR0_K1_LBSPPA1024_LBSPPB1024_LPB32_MIWT4_2_PLR2_SU32_SUM0_SUS256_SKXCCM0_VWA4_VWB2_WGM8_WGMXCC1_WGMXCCGn1
    SolutionIndex: 40
    SolutionNameMin: Cijk_Alik_Bjlk_HSS_BH_UserArgs_MT64x64x128_MI16x16x1_SN_LDSB1_CLR1_GSU0_GSUC0_GSUWGMRR0_K1_LBSPPA256_LBSPPB1024_LPB32_MIWT2_2_PLR2_SU32_SUM0_SUS256_SKXCCM0_VWA1_VWB2_WGM1_WGMXCC1_WGMXCCGn1
    SolutionIndex: 41
    SolutionNameMin: Cijk_Alik_Bjlk_HSS_BH_UserArgs_MT64x64x128_MI16x16x1_SN_LDSB1_CLR1_GSU0_GSUC0_GSUWGMRR0_K1_LBSPPA256_LBSPPB1024_LPB32_MIWT2_2_PLR2_SU32_SUM0_SUS256_SKXCCM0_VWA1_VWB2_WGM4_WGMXCC1_WGMXCCGn1
    SolutionIndex: 42
    SolutionNameMin: Cijk_Alik_Bjlk_HSS_BH_UserArgs_MT64x64x128_MI16x16x1_SN_LDSB1_CLR1_GSU0_GSUC0_GSUWGMRR0_K1_LBSPPA256_LBSPPB1024_LPB32_MIWT2_2_PLR2_SU32_SUM0_SUS256_SKXCCM0_VWA1_VWB2_WGM8_WGMXCC1_WGMXCCGn1
    SolutionIndex: 43
    SolutionNameMin: Cijk_Alik_Bjlk_HSS_BH_UserArgs_MT32x64x128_MI16x16x1_SN_LDSB1_CLR1_GSU0_GSUC0_GSUWGMRR0_K1_LBSPPA256_LBSPPB1024_LPB32_MIWT1_2_PLR2_SU32_SUM0_SUS256_SKXCCM0_VWA1_VWB2_WGM1_WGMXCC1_WGMXCCGn1
    SolutionIndex: 44
    SolutionNameMin: Cijk_Alik_Bjlk_HSS_BH_UserArgs_MT32x64x128_MI16x16x1_SN_LDSB1_CLR1_GSU0_GSUC0_GSUWGMRR0_K1_LBSPPA256_LBSPPB1024_LPB32_MIWT1_2_PLR2_SU32_SUM0_SUS256_SKXCCM0_VWA1_VWB2_WGM4_WGMXCC1_WGMXCCGn1
    SolutionIndex: 45
    SolutionNameMin: Cijk_Alik_Bjlk_HSS_BH_UserArgs_MT32x32x128_MI16x16x1_SN_LDSB1_CLR1_GSU0_GSUC0_GSUWGMRR0_K1_LBSPPA256_LBSPPB512_LPB16_MIWT1_1_PLR1_SU32_SUM0_SUS256_SKXCCM0_VWA1_VWB1_WGM1_WGMXCC1_WGMXCCGn1
    SolutionIndex: 46
    SolutionNameMin: Cijk_Alik_Bjlk_HSS_BH_UserArgs_MT32x32x128_MI16x16x1_SN_LDSB1_CLR1_GSU0_GSUC0_GSUWGMRR0_K1_LBSPPA256_LBSPPB512_LPB16_MIWT1_1_PLR2_SU32_SUM0_SUS256_SKXCCM0_VWA1_VWB1_WGM1_WGMXCC1_WGMXCCGn1
    SolutionIndex: 47
    SolutionNameMin: Cijk_Alik_Bjlk_HSS_BH_UserArgs_MT32x32x128_MI16x16x1_SN_LDSB1_CLR1_GSU0_GSUC0_GSUWGMRR0_K1_LBSPPA256_LBSPPB512_LPB16_MIWT1_1_PLR1_SU32_SUM0_SUS256_SKXCCM0_VWA1_VWB1_WGM4_WGMXCC1_WGMXCCGn1
    SolutionIndex: 48
    SolutionNameMin: Cijk_Alik_Bjlk_HSS_BH_UserArgs_MT32x32x128_MI16x16x1_SN_LDSB1_CLR1_GSU0_GSUC0_GSUWGMRR0_K1_LBSPPA256_LBSPPB512_LPB16_MIWT1_1_PLR2_SU32_SUM0_SUS256_SKXCCM0_VWA1_VWB1_WGM4_WGMXCC1_WGMXCCGn1
    SolutionIndex: 49
    SolutionNameMin: Cijk_Alik_Bjlk_HSS_BH_UserArgs_MT32x32x128_MI16x16x1_SN_LDSB1_CLR1_GSU0_GSUC0_GSUWGMRR0_K1_LBSPPA256_LBSPPB512_LPB16_MIWT1_1_PLR1_SU32_SUM0_SUS256_SKXCCM0_VWA1_VWB1_WGM8_WGMXCC1_WGMXCCGn1
    SolutionIndex: 50
    SolutionNameMin: Cijk_Alik_Bjlk_HSS_BH_UserArgs_MT256x256x32_MI16x16x1_SN_LDSB1_CLR1_GSU0_GSUC0_GSUWGMRR0_K1_LBSPPA128_LBSPPB2048_LPB0_MIWT8_8_PLR1_SU32_SUM0_SUS256_SKXCCM6_VWA1_VWB8_WGM1_WGMXCC1_WGMXCCGn1
    SolutionIndex: 51
    SolutionNameMin: Cijk_Alik_Bjlk_HSS_BH_UserArgs_MT256x256x32_MI16x16x1_SN_LDSB1_CLR1_GSU0_GSUC0_GSUWGMRR0_K1_LBSPPA256_LBSPPB2048_LPB0_MIWT8_8_PLR1_SU32_SUM0_SUS256_SKXCCM6_VWA4_VWB8_WGM1_WGMXCC1_WGMXCCGn1
    SolutionIndex: 52
    SolutionNameMin: Cijk_Alik_Bjlk_HSS_BH_UserArgs_MT256x256x32_MI16x16x1_SN_LDSB1_CLR1_GSU0_GSUC0_GSUWGMRR0_K1_LBSPPA256_LBSPPB2048_LPB0_MIWT8_8_PLR1_SU32_SUM0_SUS256_SKXCCM6_VWA4_VWB4_WGM4_WGMXCC1_WGMXCCGn1
    SolutionIndex: 53
    SolutionNameMin: Cijk_Alik_Bjlk_HSS_BH_UserArgs_MT256x256x32_MI16x16x1_SN_LDSB1_CLR1_GSU0_GSUC0_GSUWGMRR0_K1_LBSPPA128_LBSPPB2048_LPB0_MIWT8_8_PLR1_SU32_SUM0_SUS256_SKXCCM6_VWA1_VWB8_WGM4_WGMXCC1_WGMXCCGn1
    SolutionIndex: 54
    SolutionNameMin: Cijk_Alik_Bjlk_HSS_BH_UserArgs_MT256x256x32_MI16x16x1_SN_LDSB1_CLR1_GSU0_GSUC0_GSUWGMRR0_K1_LBSPPA256_LBSPPB2048_LPB0_MIWT8_8_PLR1_SU32_SUM0_SUS256_SKXCCM6_VWA4_VWB8_WGM4_WGMXCC1_WGMXCCGn1
    SolutionIndex: 55
    SolutionNameMin: Cijk_Alik_Bjlk_HSS_BH_UserArgs_MT256x256x32_MI16x16x1_SN_LDSB1_CLR1_GSU0_GSUC0_GSUWGMRR0_K1_LBSPPA512_LBSPPB2048_LPB0_MIWT8_8_PLR1_SU32_SUM0_SUS256_SKXCCM6_VWA8_VWB8_WGM4_WGMXCC1_WGMXCCGn1
    SolutionIndex: 56
    SolutionNameMin: Cijk_Alik_Bjlk_HSS_BH_UserArgs_MT256x256x32_MI16x16x1_SN_LDSB1_CLR1_GSU0_GSUC0_GSUWGMRR0_K1_LBSPPA128_LBSPPB2048_LPB32_MIWT8_8_PLR1_SU32_SUM0_SUS256_SKXCCM6_VWA2_VWB2_WGM8_WGMXCC1_WGMXCCGn1
    SolutionIndex: 57
    SolutionNameMin: Cijk_Alik_Bjlk_HSS_BH_UserArgs_MT256x256x32_MI16x16x1_SN_LDSB1_CLR1_GSU0_GSUC0_GSUWGMRR0_K1_LBSPPA256_LBSPPB2048_LPB0_MIWT8_8_PLR1_SU32_SUM0_SUS256_SKXCCM6_VWA4_VWB4_WGM8_WGMXCC1_WGMXCCGn1
    SolutionIndex: 58
    SolutionNameMin: Cijk_Alik_Bjlk_HSS_BH_UserArgs_MT256x256x32_MI16x16x1_SN_LDSB1_CLR1_GSU0_GSUC0_GSUWGMRR0_K1_LBSPPA128_LBSPPB2048_LPB0_MIWT8_8_PLR1_SU32_SUM0_SUS256_SKXCCM6_VWA2_VWB8_WGM8_WGMXCC1_WGMXCCGn1
    SolutionIndex: 59
    SolutionNameMin: Cijk_Alik_Bjlk_HSS_BH_UserArgs_MT256x256x32_MI16x16x1_SN_LDSB1_CLR1_GSU0_GSUC0_GSUWGMRR0_K1_LBSPPA256_LBSPPB2048_LPB0_MIWT8_8_PLR1_SU32_SUM0_SUS256_SKXCCM6_VWA4_VWB8_WGM8_WGMXCC1_WGMXCCGn1
    SolutionIndex: 60
    SolutionNameMin: Cijk_Alik_Bjlk_HSS_BH_UserArgs_MT128x256x32_MI16x16x1_SN_LDSB1_CLR1_GSU0_GSUC0_GSUWGMRR0_K1_LBSPPA256_LBSPPB2048_LPB0_MIWT4_8_PLR1_SU32_SUM0_SUS256_SKXCCM6_VWA4_VWB4_WGM1_WGMXCC1_WGMXCCGn1
    SolutionIndex: 61
    SolutionNameMin: Cijk_Alik_Bjlk_HSS_BH_UserArgs_MT128x256x32_MI16x16x1_SN_LDSB1_CLR1_GSU0_GSUC0_GSUWGMRR0_K1_LBSPPA128_LBSPPB2048_LPB0_MIWT4_8_PLR1_SU32_SUM0_SUS256_SKXCCM6_VWA1_VWB8_WGM1_WGMXCC1_WGMXCCGn1
    SolutionIndex: 62
    SolutionNameMin: Cijk_Alik_Bjlk_HSS_BH_UserArgs_MT128x256x32_MI16x16x1_SN_LDSB1_CLR1_GSU0_GSUC0_GSUWGMRR0_K1_LBSPPA256_LBSPPB2048_LPB0_MIWT4_8_PLR1_SU32_SUM0_SUS256_SKXCCM6_VWA4_VWB8_WGM1_WGMXCC1_WGMXCCGn1
    SolutionIndex: 63
    SolutionNameMin: Cijk_Alik_Bjlk_HSS_BH_UserArgs_MT128x256x32_MI16x16x1_SN_LDSB1_CLR1_GSU0_GSUC0_GSUWGMRR0_K1_LBSPPA256_LBSPPB2048_LPB32_MIWT4_8_PLR1_SU32_SUM0_SUS256_SKXCCM6_VWA4_VWB2_WGM4_WGMXCC1_WGMXCCGn1
    SolutionIndex: 64
    SolutionNameMin: Cijk_Alik_Bjlk_HSS_BH_UserArgs_MT128x256x32_MI16x16x1_SN_LDSB1_CLR1_GSU0_GSUC0_GSUWGMRR0_K1_LBSPPA256_LBSPPB2048_LPB0_MIWT4_8_PLR1_SU32_SUM0_SUS256_SKXCCM6_VWA4_VWB4_WGM4_WGMXCC1_WGMXCCGn1
    SolutionIndex: 65
    SolutionNameMin: Cijk_Alik_Bjlk_HSS_BH_UserArgs_MT128x256x32_MI16x16x1_SN_LDSB1_CLR1_GSU0_GSUC0_GSUWGMRR0_K1_LBSPPA256_LBSPPB2048_LPB0_MIWT4_8_PLR1_SU32_SUM0_SUS256_SKXCCM6_VWA4_VWB8_WGM4_WGMXCC1_WGMXCCGn1
    SolutionIndex: 66
    SolutionNameMin: Cijk_Alik_Bjlk_HSS_BH_UserArgs_MT128x256x32_MI16x16x1_SN_LDSB1_CLR1_GSU0_GSUC0_GSUWGMRR0_K1_LBSPPA256_LBSPPB2048_LPB32_MIWT4_8_PLR1_SU32_SUM0_SUS256_SKXCCM6_VWA4_VWB2_WGM8_WGMXCC1_WGMXCCGn1
    SolutionIndex: 67
    SolutionNameMin: Cijk_Alik_Bjlk_HSS_BH_UserArgs_MT128x256x32_MI16x16x1_SN_LDSB1_CLR1_GSU0_GSUC0_GSUWGMRR0_K1_LBSPPA256_LBSPPB2048_LPB0_MIWT4_8_PLR1_SU32_SUM0_SUS256_SKXCCM6_VWA4_VWB4_WGM8_WGMXCC1_WGMXCCGn1
    SolutionIndex: 68
    SolutionNameMin: Cijk_Alik_Bjlk_HSS_BH_UserArgs_MT128x256x32_MI16x16x1_SN_LDSB1_CLR1_GSU0_GSUC0_GSUWGMRR0_K1_LBSPPA256_LBSPPB2048_LPB0_MIWT4_8_PLR1_SU32_SUM0_SUS256_SKXCCM6_VWA4_VWB8_WGM8_WGMXCC1_WGMXCCGn1
    SolutionIndex: 69
    SolutionNameMin: Cijk_Alik_Bjlk_HSS_BH_UserArgs_MT256x128x32_MI16x16x1_SN_LDSB1_CLR1_GSU0_GSUC0_GSUWGMRR0_K1_LBSPPA256_LBSPPB1024_LPB32_MIWT8_4_PLR1_SU32_SUM0_SUS256_SKXCCM6_VWA4_VWB2_WGM8_WGMXCC1_WGMXCCGn1
    SolutionIndex: 70
    SolutionNameMin: Cijk_Alik_Bjlk_HSS_BH_UserArgs_MT128x128x32_MI16x16x1_SN_LDSB1_CLR1_GSU0_GSUC0_GSUWGMRR0_K1_LBSPPA256_LBSPPB1024_LPB16_MIWT4_4_PLR1_SU32_SUM0_SUS256_SKXCCM6_VWA4_VWB1_WGM1_WGMXCC1_WGMXCCGn1
    SolutionIndex: 71
    SolutionNameMin: Cijk_Alik_Bjlk_HSS_BH_UserArgs_MT128x128x32_MI16x16x1_SN_LDSB1_CLR1_GSU0_GSUC0_GSUWGMRR0_K1_LBSPPA256_LBSPPB1024_LPB32_MIWT4_4_PLR1_SU32_SUM0_SUS256_SKXCCM6_VWA4_VWB2_WGM1_WGMXCC1_WGMXCCGn1
    SolutionIndex: 72
    SolutionNameMin: Cijk_Alik_Bjlk_HSS_BH_UserArgs_MT128x128x32_MI16x16x1_SN_LDSB1_CLR1_GSU0_GSUC0_GSUWGMRR0_K1_LBSPPA256_LBSPPB1024_LPB0_MIWT4_4_PLR1_SU32_SUM0_SUS256_SKXCCM6_VWA4_VWB4_WGM1_WGMXCC1_WGMXCCGn1
    SolutionIndex: 73
    SolutionNameMin: Cijk_Alik_Bjlk_HSS_BH_UserArgs_MT128x128x32_MI16x16x1_SN_LDSB1_CLR1_GSU0_GSUC0_GSUWGMRR0_K1_LBSPPA256_LBSPPB1024_LPB0_MIWT4_4_PLR1_SU32_SUM0_SUS256_SKXCCM6_VWA4_VWB4_WGM8_WGMXCC1_WGMXCCGn1
    SolutionIndex: 74
    SolutionNameMin: Cijk_Alik_Bjlk_HSS_BH_UserArgs_MT128x256x64_MI16x16x1_SN_LDSB1_CLR1_GSU0_GSUC0_GSUWGMRR0_K1_LBSPPA512_LBSPPB4096_LPB32_MIWT4_8_PLR1_SU32_SUM0_SUS256_SKXCCM6_VWA4_VWB2_WGM1_WGMXCC1_WGMXCCGn1
    SolutionIndex: 75
    SolutionNameMin: Cijk_Alik_Bjlk_HSS_BH_UserArgs_MT128x256x64_MI16x16x1_SN_LDSB1_CLR1_GSU0_GSUC0_GSUWGMRR0_K1_LBSPPA128_LBSPPB4096_LPB0_MIWT4_8_PLR1_SU32_SUM0_SUS256_SKXCCM6_VWA1_VWB4_WGM1_WGMXCC1_WGMXCCGn1
    SolutionIndex: 76
    SolutionNameMin: Cijk_Alik_Bjlk_HSS_BH_UserArgs_MT128x256x64_MI16x16x1_SN_LDSB1_CLR1_GSU0_GSUC0_GSUWGMRR0_K1_LBSPPA256_LBSPPB4096_LPB0_MIWT4_8_PLR1_SU32_SUM0_SUS256_SKXCCM6_VWA2_VWB4_WGM1_WGMXCC1_WGMXCCGn1
    SolutionIndex: 77
    SolutionNameMin: Cijk_Alik_Bjlk_HSS_BH_UserArgs_MT128x256x64_MI16x16x1_SN_LDSB1_CLR1_GSU0_GSUC0_GSUWGMRR0_K1_LBSPPA512_LBSPPB4096_LPB0_MIWT4_8_PLR1_SU32_SUM0_SUS256_SKXCCM6_VWA4_VWB4_WGM1_WGMXCC1_WGMXCCGn1
    SolutionIndex: 78
    SolutionNameMin: Cijk_Alik_Bjlk_HSS_BH_UserArgs_MT128x256x64_MI16x16x1_SN_LDSB1_CLR1_GSU0_GSUC0_GSUWGMRR0_K1_LBSPPA512_LBSPPB4096_LPB0_MIWT4_8_PLR1_SU32_SUM0_SUS256_SKXCCM6_VWA4_VWB8_WGM1_WGMXCC1_WGMXCCGn1
    SolutionIndex: 79
    SolutionNameMin: Cijk_Alik_Bjlk_HSS_BH_UserArgs_MT128x256x64_MI16x16x1_SN_LDSB1_CLR1_GSU0_GSUC0_GSUWGMRR0_K1_LBSPPA128_LBSPPB4096_LPB32_MIWT4_8_PLR1_SU32_SUM0_SUS256_SKXCCM6_VWA1_VWB2_WGM4_WGMXCC1_WGMXCCGn1
    SolutionIndex: 80
    SolutionNameMin: Cijk_Alik_Bjlk_HSS_BH_UserArgs_MT128x256x64_MI16x16x1_SN_LDSB1_CLR1_GSU0_GSUC0_GSUWGMRR0_K1_LBSPPA512_LBSPPB4096_LPB0_MIWT4_8_PLR1_SU32_SUM0_SUS256_SKXCCM6_VWA4_VWB4_WGM4_WGMXCC1_WGMXCCGn1
    SolutionIndex: 81
    SolutionNameMin: Cijk_Alik_Bjlk_HSS_BH_UserArgs_MT128x256x64_MI16x16x1_SN_LDSB1_CLR1_GSU0_GSUC0_GSUWGMRR0_K1_LBSPPA512_LBSPPB4096_LPB32_MIWT4_8_PLR1_SU32_SUM0_SUS256_SKXCCM6_VWA4_VWB2_WGM8_WGMXCC1_WGMXCCGn1
    SolutionIndex: 82
    SolutionNameMin: Cijk_Alik_Bjlk_HSS_BH_UserArgs_MT128x256x64_MI16x16x1_SN_LDSB1_CLR1_GSU0_GSUC0_GSUWGMRR0_K1_LBSPPA128_LBSPPB4096_LPB0_MIWT4_8_PLR1_SU32_SUM0_SUS256_SKXCCM6_VWA1_VWB4_WGM8_WGMXCC1_WGMXCCGn1
    SolutionIndex: 83
    SolutionNameMin: Cijk_Alik_Bjlk_HSS_BH_UserArgs_MT256x128x64_MI16x16x1_SN_LDSB1_CLR1_GSU0_GSUC0_GSUWGMRR0_K1_LBSPPA512_LBSPPB2048_LPB0_MIWT8_4_PLR1_SU32_SUM0_SUS256_SKXCCM6_VWA4_VWB4_WGM1_WGMXCC1_WGMXCCGn1
    SolutionIndex: 84
    SolutionNameMin: Cijk_Alik_Bjlk_HSS_BH_UserArgs_MT256x128x64_MI16x16x1_SN_LDSB1_CLR1_GSU0_GSUC0_GSUWGMRR0_K1_LBSPPA512_LBSPPB2048_LPB0_MIWT8_4_PLR1_SU32_SUM0_SUS256_SKXCCM6_VWA4_VWB4_WGM4_WGMXCC1_WGMXCCGn1
    SolutionIndex: 85
    SolutionNameMin: Cijk_Alik_Bjlk_HSS_BH_UserArgs_MT256x128x64_MI16x16x1_SN_LDSB1_CLR1_GSU0_GSUC0_GSUWGMRR0_K1_LBSPPA128_LBSPPB2048_LPB16_MIWT8_4_PLR1_SU32_SUM0_SUS256_SKXCCM6_VWA1_VWB1_WGM8_WGMXCC1_WGMXCCGn1
    SolutionIndex: 86
    SolutionNameMin: Cijk_Alik_Bjlk_HSS_BH_UserArgs_MT256x128x64_MI16x16x1_SN_LDSB1_CLR1_GSU0_GSUC0_GSUWGMRR0_K1_LBSPPA512_LBSPPB2048_LPB0_MIWT8_4_PLR1_SU32_SUM0_SUS256_SKXCCM6_VWA4_VWB4_WGM8_WGMXCC1_WGMXCCGn1
    SolutionIndex: 87
    SolutionNameMin: Cijk_Alik_Bjlk_HSS_BH_UserArgs_MT64x256x64_MI16x16x1_SN_LDSB1_CLR1_GSU0_GSUC0_GSUWGMRR0_K1_LBSPPA128_LBSPPB4096_LPB0_MIWT2_8_PLR1_SU32_SUM0_SUS256_SKXCCM6_VWA1_VWB4_WGM4_WGMXCC1_WGMXCCGn1
    SolutionIndex: 88
    SolutionNameMin: Cijk_Alik_Bjlk_HSS_BH_UserArgs_MT128x128x64_MI16x16x1_SN_LDSB1_CLR1_GSU0_GSUC0_GSUWGMRR0_K1_LBSPPA128_LBSPPB2048_LPB0_MIWT4_4_PLR1_SU32_SUM0_SUS256_SKXCCM6_VWA1_VWB4_WGM1_WGMXCC1_WGMXCCGn1
    SolutionIndex: 89
    SolutionNameMin: Cijk_Alik_Bjlk_HSS_BH_UserArgs_MT128x128x64_MI16x16x1_SN_LDSB1_CLR1_GSU0_GSUC0_GSUWGMRR0_K1_LBSPPA512_LBSPPB2048_LPB0_MIWT4_4_PLR1_SU32_SUM0_SUS256_SKXCCM6_VWA4_VWB4_WGM1_WGMXCC1_WGMXCCGn1
    SolutionIndex: 90
    SolutionNameMin: Cijk_Alik_Bjlk_HSS_BH_UserArgs_MT128x128x64_MI16x16x1_SN_LDSB1_CLR1_GSU0_GSUC0_GSUWGMRR0_K1_LBSPPA512_LBSPPB2048_LPB0_MIWT4_4_PLR2_SU32_SUM0_SUS256_SKXCCM6_VWA4_VWB4_WGM1_WGMXCC1_WGMXCCGn1
    SolutionIndex: 91
    SolutionNameMin: Cijk_Alik_Bjlk_HSS_BH_UserArgs_MT128x128x64_MI16x16x1_SN_LDSB1_CLR1_GSU0_GSUC0_GSUWGMRR0_K1_LBSPPA128_LBSPPB2048_LPB32_MIWT4_4_PLR1_SU32_SUM0_SUS256_SKXCCM6_VWA1_VWB2_WGM4_WGMXCC1_WGMXCCGn1
    SolutionIndex: 92
    SolutionNameMin: Cijk_Alik_Bjlk_HSS_BH_UserArgs_MT128x128x64_MI16x16x1_SN_LDSB1_CLR1_GSU0_GSUC0_GSUWGMRR0_K1_LBSPPA512_LBSPPB2048_LPB32_MIWT4_4_PLR1_SU32_SUM0_SUS256_SKXCCM6_VWA4_VWB2_WGM4_WGMXCC1_WGMXCCGn1
    SolutionIndex: 93
    SolutionNameMin: Cijk_Alik_Bjlk_HSS_BH_UserArgs_MT128x128x64_MI16x16x1_SN_LDSB1_CLR1_GSU0_GSUC0_GSUWGMRR0_K1_LBSPPA128_LBSPPB2048_LPB0_MIWT4_4_PLR1_SU32_SUM0_SUS256_SKXCCM6_VWA1_VWB4_WGM4_WGMXCC1_WGMXCCGn1
    SolutionIndex: 94
    SolutionNameMin: Cijk_Alik_Bjlk_HSS_BH_UserArgs_MT128x128x64_MI16x16x1_SN_LDSB1_CLR1_GSU0_GSUC0_GSUWGMRR0_K1_LBSPPA512_LBSPPB2048_LPB0_MIWT4_4_PLR1_SU32_SUM0_SUS256_SKXCCM6_VWA4_VWB4_WGM4_WGMXCC1_WGMXCCGn1
    SolutionIndex: 95
    SolutionNameMin: Cijk_Alik_Bjlk_HSS_BH_UserArgs_MT128x128x64_MI16x16x1_SN_LDSB1_CLR1_GSU0_GSUC0_GSUWGMRR0_K1_LBSPPA512_LBSPPB2048_LPB32_MIWT4_4_PLR2_SU32_SUM0_SUS256_SKXCCM6_VWA4_VWB2_WGM4_WGMXCC1_WGMXCCGn1
    SolutionIndex: 96
    SolutionNameMin: Cijk_Alik_Bjlk_HSS_BH_UserArgs_MT128x128x64_MI16x16x1_SN_LDSB1_CLR1_GSU0_GSUC0_GSUWGMRR0_K1_LBSPPA128_LBSPPB2048_LPB32_MIWT4_4_PLR1_SU32_SUM0_SUS256_SKXCCM6_VWA1_VWB2_WGM8_WGMXCC1_WGMXCCGn1
    SolutionIndex: 97
    SolutionNameMin: Cijk_Alik_Bjlk_HSS_BH_UserArgs_MT128x128x64_MI16x16x1_SN_LDSB1_CLR1_GSU0_GSUC0_GSUWGMRR0_K1_LBSPPA512_LBSPPB2048_LPB32_MIWT4_4_PLR1_SU32_SUM0_SUS256_SKXCCM6_VWA4_VWB2_WGM8_WGMXCC1_WGMXCCGn1
    SolutionIndex: 98
    SolutionNameMin: Cijk_Alik_Bjlk_HSS_BH_UserArgs_MT128x128x64_MI16x16x1_SN_LDSB1_CLR1_GSU0_GSUC0_GSUWGMRR0_K1_LBSPPA128_LBSPPB2048_LPB0_MIWT4_4_PLR1_SU32_SUM0_SUS256_SKXCCM6_VWA1_VWB4_WGM8_WGMXCC1_WGMXCCGn1
    SolutionIndex: 99
    SolutionNameMin: Cijk_Alik_Bjlk_HSS_BH_UserArgs_MT128x128x64_MI16x16x1_SN_LDSB1_CLR1_GSU0_GSUC0_GSUWGMRR0_K1_LBSPPA512_LBSPPB2048_LPB0_MIWT4_4_PLR1_SU32_SUM0_SUS256_SKXCCM6_VWA4_VWB4_WGM8_WGMXCC1_WGMXCCGn1
    SolutionIndex: 100
    SolutionNameMin: Cijk_Alik_Bjlk_HSS_BH_UserArgs_MT128x128x64_MI16x16x1_SN_LDSB1_CLR1_GSU0_GSUC0_GSUWGMRR0_K1_LBSPPA512_LBSPPB2048_LPB32_MIWT4_4_PLR2_SU32_SUM0_SUS256_SKXCCM6_VWA4_VWB2_WGM8_WGMXCC1_WGMXCCGn1
    SolutionIndex: 101
    SolutionNameMin: Cijk_Alik_Bjlk_HSS_BH_UserArgs_MT64x128x64_MI16x16x1_SN_LDSB1_CLR1_GSU0_GSUC0_GSUWGMRR0_K1_LBSPPA128_LBSPPB2048_LPB0_MIWT2_4_PLR1_SU32_SUM0_SUS256_SKXCCM6_VWA1_VWB4_WGM4_WGMXCC1_WGMXCCGn1
    SolutionIndex: 102
    SolutionNameMin: Cijk_Alik_Bjlk_HSS_BH_UserArgs_MT64x128x64_MI16x16x1_SN_LDSB1_CLR1_GSU0_GSUC0_GSUWGMRR0_K1_LBSPPA256_LBSPPB2048_LPB0_MIWT2_4_PLR1_SU32_SUM0_SUS256_SKXCCM6_VWA2_VWB4_WGM4_WGMXCC1_WGMXCCGn1
    SolutionIndex: 103
    SolutionNameMin: Cijk_Alik_Bjlk_HSS_BH_UserArgs_MT64x128x64_MI16x16x1_SN_LDSB1_CLR1_GSU0_GSUC0_GSUWGMRR0_K1_LBSPPA128_LBSPPB2048_LPB0_MIWT2_4_PLR1_SU32_SUM0_SUS256_SKXCCM6_VWA1_VWB4_WGM8_WGMXCC1_WGMXCCGn1
    SolutionIndex: 104
    SolutionNameMin: Cijk_Alik_Bjlk_HSS_BH_UserArgs_MT64x128x64_MI16x16x1_SN_LDSB1_CLR1_GSU0_GSUC0_GSUWGMRR0_K1_LBSPPA256_LBSPPB2048_LPB0_MIWT2_4_PLR1_SU32_SUM0_SUS256_SKXCCM6_VWA2_VWB4_WGM8_WGMXCC1_WGMXCCGn1
    SolutionIndex: 105
    SolutionNameMin: Cijk_Alik_Bjlk_HSS_BH_UserArgs_MT128x64x64_MI16x16x1_SN_LDSB1_CLR1_GSU0_GSUC0_GSUWGMRR0_K1_LBSPPA512_LBSPPB1024_LPB16_MIWT4_2_PLR1_SU32_SUM0_SUS256_SKXCCM6_VWA4_VWB1_WGM1_WGMXCC1_WGMXCCGn1
    SolutionIndex: 106
    SolutionNameMin: Cijk_Alik_Bjlk_HSS_BH_UserArgs_MT128x64x64_MI16x16x1_SN_LDSB1_CLR1_GSU0_GSUC0_GSUWGMRR0_K1_LBSPPA256_LBSPPB1024_LPB32_MIWT4_2_PLR1_SU32_SUM0_SUS256_SKXCCM6_VWA2_VWB2_WGM1_WGMXCC1_WGMXCCGn1
    SolutionIndex: 107
    SolutionNameMin: Cijk_Alik_Bjlk_HSS_BH_UserArgs_MT128x64x64_MI16x16x1_SN_LDSB1_CLR1_GSU0_GSUC0_GSUWGMRR0_K1_LBSPPA512_LBSPPB1024_LPB32_MIWT4_2_PLR1_SU32_SUM0_SUS256_SKXCCM6_VWA4_VWB2_WGM1_WGMXCC1_WGMXCCGn1
    SolutionIndex: 108
    SolutionNameMin: Cijk_Alik_Bjlk_HSS_BH_UserArgs_MT128x64x64_MI16x16x1_SN_LDSB1_CLR1_GSU0_GSUC0_GSUWGMRR0_K1_LBSPPA256_LBSPPB1024_LPB32_MIWT4_2_PLR1_SU32_SUM0_SUS256_SKXCCM6_VWA2_VWB2_WGM4_WGMXCC1_WGMXCCGn1
    SolutionIndex: 109
    SolutionNameMin: Cijk_Alik_Bjlk_HSS_BH_UserArgs_MT128x64x64_MI16x16x1_SN_LDSB1_CLR1_GSU0_GSUC0_GSUWGMRR0_K1_LBSPPA512_LBSPPB1024_LPB32_MIWT4_2_PLR1_SU32_SUM0_SUS256_SKXCCM6_VWA4_VWB2_WGM4_WGMXCC1_WGMXCCGn1
    SolutionIndex: 110
    SolutionNameMin: Cijk_Alik_Bjlk_HSS_BH_UserArgs_MT128x64x64_MI16x16x1_SN_LDSB1_CLR1_GSU0_GSUC0_GSUWGMRR0_K1_LBSPPA128_LBSPPB1024_LPB32_MIWT4_2_PLR1_SU32_SUM0_SUS256_SKXCCM6_VWA1_VWB2_WGM8_WGMXCC1_WGMXCCGn1
    SolutionIndex: 111
    SolutionNameMin: Cijk_Alik_Bjlk_HSS_BH_UserArgs_MT128x64x64_MI16x16x1_SN_LDSB1_CLR1_GSU0_GSUC0_GSUWGMRR0_K1_LBSPPA512_LBSPPB1024_LPB32_MIWT4_2_PLR1_SU32_SUM0_SUS256_SKXCCM6_VWA4_VWB2_WGM8_WGMXCC1_WGMXCCGn1
    SolutionIndex: 112
    SolutionNameMin: Cijk_Alik_Bjlk_HSS_BH_UserArgs_MT64x64x64_MI16x16x1_SN_LDSB1_CLR1_GSU0_GSUC0_GSUWGMRR0_K1_LBSPPA128_LBSPPB1024_LPB32_MIWT2_2_PLR1_SU32_SUM0_SUS256_SKXCCM6_VWA1_VWB2_WGM1_WGMXCC1_WGMXCCGn1
    SolutionIndex: 113
    SolutionNameMin: Cijk_Alik_Bjlk_HSS_BH_UserArgs_MT32x64x64_MI16x16x1_SN_LDSB0_CLR1_GSU0_GSUC0_GSUWGMRR0_K1_LBSPPA128_LBSPPB1024_LPB32_MIWT1_2_PLR1_SU32_SUM0_SUS256_SKXCCM6_VWA1_VWB2_WGM1_WGMXCC1_WGMXCCGn1
    SolutionIndex: 114
    SolutionNameMin: Cijk_Alik_Bjlk_HSS_BH_UserArgs_MT32x32x64_MI16x16x1_SN_LDSB0_CLR1_GSU0_GSUC0_GSUWGMRR0_K1_LBSPPA128_LBSPPB512_LPB16_MIWT1_1_PLR1_SU32_SUM0_SUS256_SKXCCM6_VWA1_VWB1_WGM1_WGMXCC1_WGMXCCGn1
    SolutionIndex: 115
    SolutionNameMin: Cijk_Alik_Bjlk_HSS_BH_UserArgs_MT64x128x128_MI16x16x1_SN_LDSB1_CLR1_GSU0_GSUC0_GSUWGMRR0_K1_LBSPPA256_LBSPPB2048_LPB0_MIWT2_4_PLR2_SU32_SUM0_SUS256_SKXCCM6_VWA1_VWB4_WGM1_WGMXCC1_WGMXCCGn1
    SolutionIndex: 116
    SolutionNameMin: Cijk_Alik_Bjlk_HSS_BH_UserArgs_MT64x128x128_MI16x16x1_SN_LDSB1_CLR1_GSU0_GSUC0_GSUWGMRR0_K1_LBSPPA256_LBSPPB2048_LPB0_MIWT2_4_PLR1_SU32_SUM0_SUS256_SKXCCM6_VWA1_VWB4_WGM4_WGMXCC1_WGMXCCGn1
    SolutionIndex: 117
    SolutionNameMin: Cijk_Alik_Bjlk_HSS_BH_UserArgs_MT64x128x128_MI16x16x1_SN_LDSB1_CLR1_GSU0_GSUC0_GSUWGMRR0_K1_LBSPPA512_LBSPPB2048_LPB0_MIWT2_4_PLR2_SU32_SUM0_SUS256_SKXCCM6_VWA2_VWB4_WGM4_WGMXCC1_WGMXCCGn1
    SolutionIndex: 118
    SolutionNameMin: Cijk_Alik_Bjlk_HSS_BH_UserArgs_MT64x128x128_MI16x16x1_SN_LDSB1_CLR1_GSU0_GSUC0_GSUWGMRR0_K1_LBSPPA256_LBSPPB2048_LPB0_MIWT2_4_PLR1_SU32_SUM0_SUS256_SKXCCM6_VWA1_VWB4_WGM8_WGMXCC1_WGMXCCGn1
    SolutionIndex: 119
    SolutionNameMin: Cijk_Alik_Bjlk_HSS_BH_UserArgs_MT128x64x128_MI16x16x1_SN_LDSB1_CLR1_GSU0_GSUC0_GSUWGMRR0_K1_LBSPPA512_LBSPPB1024_LPB32_MIWT4_2_PLR1_SU32_SUM0_SUS256_SKXCCM6_VWA2_VWB2_WGM1_WGMXCC1_WGMXCCGn1
    SolutionIndex: 120
    SolutionNameMin: Cijk_Alik_Bjlk_HSS_BH_UserArgs_MT128x64x128_MI16x16x1_SN_LDSB1_CLR1_GSU0_GSUC0_GSUWGMRR0_K1_LBSPPA1024_LBSPPB1024_LPB32_MIWT4_2_PLR2_SU32_SUM0_SUS256_SKXCCM6_VWA4_VWB2_WGM1_WGMXCC1_WGMXCCGn1
    SolutionIndex: 121
    SolutionNameMin: Cijk_Alik_Bjlk_HSS_BH_UserArgs_MT128x64x128_MI16x16x1_SN_LDSB1_CLR1_GSU0_GSUC0_GSUWGMRR0_K1_LBSPPA1024_LBSPPB1024_LPB32_MIWT4_2_PLR1_SU32_SUM0_SUS256_SKXCCM6_VWA4_VWB2_WGM4_WGMXCC1_WGMXCCGn1
    SolutionIndex: 122
    SolutionNameMin: Cijk_Alik_Bjlk_HSS_BH_UserArgs_MT128x64x128_MI16x16x1_SN_LDSB1_CLR1_GSU0_GSUC0_GSUWGMRR0_K1_LBSPPA1024_LBSPPB1024_LPB32_MIWT4_2_PLR2_SU32_SUM0_SUS256_SKXCCM6_VWA4_VWB2_WGM4_WGMXCC1_WGMXCCGn1
    SolutionIndex: 123
    SolutionNameMin: Cijk_Alik_Bjlk_HSS_BH_UserArgs_MT128x64x128_MI16x16x1_SN_LDSB1_CLR1_GSU0_GSUC0_GSUWGMRR0_K1_LBSPPA1024_LBSPPB1024_LPB32_MIWT4_2_PLR1_SU32_SUM0_SUS256_SKXCCM6_VWA4_VWB2_WGM8_WGMXCC1_WGMXCCGn1
    SolutionIndex: 124
    SolutionNameMin: Cijk_Alik_Bjlk_HSS_BH_UserArgs_MT128x64x128_MI16x16x1_SN_LDSB1_CLR1_GSU0_GSUC0_GSUWGMRR0_K1_LBSPPA256_LBSPPB1024_LPB32_MIWT4_2_PLR2_SU32_SUM0_SUS256_SKXCCM6_VWA1_VWB2_WGM8_WGMXCC1_WGMXCCGn1
    SolutionIndex: 125
    SolutionNameMin: Cijk_Alik_Bjlk_HSS_BH_UserArgs_MT128x64x128_MI16x16x1_SN_LDSB1_CLR1_GSU0_GSUC0_GSUWGMRR0_K1_LBSPPA1024_LBSPPB1024_LPB32_MIWT4_2_PLR2_SU32_SUM0_SUS256_SKXCCM6_VWA4_VWB2_WGM8_WGMXCC1_WGMXCCGn1
    SolutionIndex: 126
    SolutionNameMin: Cijk_Alik_Bjlk_HSS_BH_UserArgs_MT64x64x128_MI16x16x1_SN_LDSB1_CLR1_GSU0_GSUC0_GSUWGMRR0_K1_LBSPPA256_LBSPPB1024_LPB32_MIWT2_2_PLR2_SU32_SUM0_SUS256_SKXCCM6_VWA1_VWB2_WGM1_WGMXCC1_WGMXCCGn1
    SolutionIndex: 127
    SolutionNameMin: Cijk_Alik_Bjlk_HSS_BH_UserArgs_MT64x64x128_MI16x16x1_SN_LDSB1_CLR1_GSU0_GSUC0_GSUWGMRR0_K1_LBSPPA512_LBSPPB1024_LPB32_MIWT2_2_PLR2_SU32_SUM0_SUS256_SKXCCM6_VWA2_VWB2_WGM1_WGMXCC1_WGMXCCGn1
    SolutionIndex: 128
    SolutionNameMin: Cijk_Alik_Bjlk_HSS_BH_UserArgs_MT64x64x128_MI16x16x1_SN_LDSB1_CLR1_GSU0_GSUC0_GSUWGMRR0_K1_LBSPPA256_LBSPPB1024_LPB32_MIWT2_2_PLR2_SU32_SUM0_SUS256_SKXCCM6_VWA1_VWB2_WGM4_WGMXCC1_WGMXCCGn1
    SolutionIndex: 129
    SolutionNameMin: Cijk_Alik_Bjlk_HSS_BH_UserArgs_MT64x64x128_MI16x16x1_SN_LDSB1_CLR1_GSU0_GSUC0_GSUWGMRR0_K1_LBSPPA256_LBSPPB1024_LPB32_MIWT2_2_PLR2_SU32_SUM0_SUS256_SKXCCM6_VWA1_VWB2_WGM8_WGMXCC1_WGMXCCGn1
    SolutionIndex: 130
    SolutionNameMin: Cijk_Alik_Bjlk_HSS_BH_UserArgs_MT32x64x128_MI16x16x1_SN_LDSB1_CLR1_GSU0_GSUC0_GSUWGMRR0_K1_LBSPPA256_LBSPPB1024_LPB32_MIWT1_2_PLR2_SU32_SUM0_SUS256_SKXCCM6_VWA1_VWB2_WGM1_WGMXCC1_WGMXCCGn1
    SolutionIndex: 131
    SolutionNameMin: Cijk_Alik_Bjlk_HSS_BH_UserArgs_MT32x64x128_MI16x16x1_SN_LDSB1_CLR1_GSU0_GSUC0_GSUWGMRR0_K1_LBSPPA256_LBSPPB1024_LPB32_MIWT1_2_PLR2_SU32_SUM0_SUS256_SKXCCM6_VWA1_VWB2_WGM8_WGMXCC1_WGMXCCGn1
    SolutionIndex: 132
    SolutionNameMin: Cijk_Alik_Bjlk_HSS_BH_UserArgs_MT32x32x32_MI16x16x1_SN_LDSB0_CLR0_GSU0_GSUC0_GSUWGMRR0_K1_LBSPPA128_LBSPPB256_LPB16_MIWT1_1_PLR0_SU32_SUM0_SUS256_SKXCCM0_VWA1_VWB1_WGM8_WGMXCC1_WGMXCCGn1
- - - [128, 128, 1, 128, 128, 128, 128, 128]
    - [36, 0.081]
  - - [128, 128, 1, 256, 128, 128, 256, 128]
    - [47, 0.153]
  - - [128, 128, 1, 512, 128, 128, 512, 128]
    - [48, 0.257]
  - - [128, 128, 1, 1024, 128, 128, 1024, 128]
    - [49, 0.391]
  - - [128, 128, 1, 2048, 128, 128, 2048, 128]
    - [46, 0.602]
  - - [128, 128, 1, 4096, 128, 128, 4096, 128]
    - [114, 1.06]
  - - [128, 128, 1, 8192, 128, 128, 8192, 128]
    - [45, 1.611]
  - - [128, 256, 1, 128, 128, 128, 128, 256]
    - [35, 0.174]
  - - [128, 256, 1, 256, 128, 128, 256, 256]
    - [45, 0.312]
  - - [128, 256, 1, 512, 128, 128, 512, 256]
    - [46, 0.526]
  - - [128, 256, 1, 1024, 128, 128, 1024, 256]
    - [46, 0.799]
  - - [128, 256, 1, 2048, 128, 128, 2048, 256]
    - [46, 1.189]
  - - [128, 256, 1, 4096, 128, 128, 4096, 256]
    - [114, 2.069]
  - - [128, 256, 1, 8192, 128, 128, 8192, 256]
    - [46, 3.133]
  - - [128, 512, 1, 128, 128, 128, 128, 512]
    - [35, 0.339]
  - - [128, 512, 1, 256, 128, 128, 256, 512]
    - [35, 0.622]
  - - [128, 512, 1, 512, 128, 128, 512, 512]
    - [45, 1.044]
  - - [128, 512, 1, 1024, 128, 128, 1024, 512]
    - [45, 1.579]
  - - [128, 512, 1, 2048, 128, 128, 2048, 512]
    - [46, 2.302]
  - - [128, 512, 1, 4096, 128, 128, 4096, 512]
    - [45, 3.485]
  - - [128, 512, 1, 8192, 128, 128, 8192, 512]
    - [130, 5.146]
  - - [128, 1024, 1, 128, 128, 128, 128, 1024]
    - [35, 0.677]
  - - [128, 1024, 1, 256, 128, 128, 256, 1024]
    - [35, 1.22]
  - - [128, 1024, 1, 512, 128, 128, 512, 1024]
    - [46, 2.016]
  - - [128, 1024, 1, 1024, 128, 128, 1024, 1024]
    - [45, 3.091]
  - - [128, 1024, 1, 2048, 128, 128, 2048, 1024]
    - [43, 3.994]
  - - [128, 1024, 1, 4096, 128, 128, 4096, 1024]
    - [44, 5.704]
  - - [128, 1024, 1, 8192, 128, 128, 8192, 1024]
    - [126, 8.722]
  - - [128, 2048, 1, 128, 128, 128, 128, 2048]
    - [34, 1.21]
  - - [128, 2048, 1, 256, 128, 128, 256, 2048]
    - [43, 2.117]
  - - [128, 2048, 1, 512, 128, 128, 512, 2048]
    - [43, 3.543]
  - - [128, 2048, 1, 1024, 128, 128, 1024, 2048]
    - [44, 5.28]
  - - [128, 2048, 1, 2048, 128, 128, 2048, 2048]
    - [40, 6.542]
  - - [128, 2048, 1, 4096, 128, 128, 4096, 2048]
    - [126, 9.295]
  - - [128, 2048, 1, 8192, 128, 128, 8192, 2048]
    - [120, 12.825]
  - - [128, 4096, 1, 128, 128, 128, 128, 4096]
    - [32, 2.082]
  - - [128, 4096, 1, 256, 128, 128, 256, 4096]
    - [32, 3.585]
  - - [128, 4096, 1, 512, 128, 128, 512, 4096]
    - [40, 5.966]
  - - [128, 4096, 1, 1024, 128, 128, 1024, 4096]
    - [127, 8.576]
  - - [128, 4096, 1, 2048, 128, 128, 2048, 4096]
    - [126, 10.208]
  - - [128, 4096, 1, 4096, 128, 128, 4096, 4096]
    - [107, 13.109]
  - - [128, 4096, 1, 8192, 128, 128, 8192, 4096]
    - [121, 15.464]
  - - [128, 8192, 1, 128, 128, 128, 128, 8192]
    - [30, 3.244]
  - - [128, 8192, 1, 256, 128, 128, 256, 8192]
    - [30, 5.546]
  - - [128, 8192, 1, 512, 128, 128, 512, 8192]
    - [38, 8.921]
  - - [128, 8192, 1, 1024, 128, 128, 1024, 8192]
    - [37, 12.624]
  - - [128, 8192, 1, 2048, 128, 128, 2048, 8192]
    - [108, 13.162]
  - - [128, 8192, 1, 4096, 128, 128, 4096, 8192]
    - [105, 16.584]
  - - [128, 8192, 1, 8192, 128, 128, 8192, 8192]
    - [39, 18.683]
  - - [256, 128, 1, 128, 256, 256, 128, 128]
    - [45, 0.173]
  - - [256, 128, 1, 256, 256, 256, 256, 128]
    - [35, 0.313]
  - - [256, 128, 1, 512, 256, 256, 512, 128]
    - [45, 0.528]
  - - [256, 128, 1, 1024, 256, 256, 1024, 128]
    - [46, 0.798]
  - - [256, 128, 1, 2048, 256, 256, 2048, 128]
    - [45, 1.18]
  - - [256, 128, 1, 4096, 256, 256, 4096, 128]
    - [114, 2.055]
  - - [256, 128, 1, 8192, 256, 256, 8192, 128]
    - [46, 3.141]
  - - [256, 256, 1, 128, 256, 256, 128, 256]
    - [35, 0.34]
  - - [256, 256, 1, 256, 256, 256, 256, 256]
    - [35, 0.619]
  - - [256, 256, 1, 512, 256, 256, 512, 256]
    - [45, 1.029]
  - - [256, 256, 1, 1024, 256, 256, 1024, 256]
    - [46, 1.574]
  - - [256, 256, 1, 2048, 256, 256, 2048, 256]
    - [46, 2.307]
  - - [256, 256, 1, 4096, 256, 256, 4096, 256]
    - [113, 3.49]
  - - [256, 256, 1, 8192, 256, 256, 8192, 256]
    - [43, 5.498]
  - - [256, 512, 1, 128, 256, 256, 128, 512]
    - [35, 0.666]
  - - [256, 512, 1, 256, 256, 256, 256, 512]
    - [35, 1.202]
  - - [256, 512, 1, 512, 256, 256, 512, 512]
    - [45, 2.001]
  - - [256, 512, 1, 1024, 256, 256, 1024, 512]
    - [46, 3.072]
  - - [256, 512, 1, 2048, 256, 256, 2048, 512]
    - [130, 4.041]
  - - [256, 512, 1, 4096, 256, 256, 4096, 512]
    - [130, 5.778]
  - - [256, 512, 1, 8192, 256, 256, 8192, 512]
    - [126, 8.578]
  - - [256, 1024, 1, 128, 256, 256, 128, 1024]
    - [34, 1.205]
  - - [256, 1024, 1, 256, 256, 256, 256, 1024]
    - [43, 2.128]
  - - [256, 1024, 1, 512, 256, 256, 512, 1024]
    - [43, 3.584]
  - - [256, 1024, 1, 1024, 256, 256, 1024, 1024]
    - [43, 5.354]
  - - [256, 1024, 1, 2048, 256, 256, 2048, 1024]
    - [40, 6.656]
  - - [256, 1024, 1, 4096, 256, 256, 4096, 1024]
    - [126, 9.318]
  - - [256, 1024, 1, 8192, 256, 256, 8192, 1024]
    - [38, 12.665]
  - - [256, 2048, 1, 128, 256, 256, 128, 2048]
    - [112, 2.005]
  - - [256, 2048, 1, 256, 256, 256, 256, 2048]
    - [33, 3.505]
  - - [256, 2048, 1, 512, 256, 256, 512, 2048]
    - [42, 5.768]
  - - [256, 2048, 1, 1024, 256, 256, 1024, 2048]
    - [41, 8.612]
  - - [256, 2048, 1, 2048, 256, 256, 2048, 2048]
    - [120, 10.272]
  - - [256, 2048, 1, 4096, 256, 256, 4096, 2048]
    - [107, 13.461]
  - - [256, 2048, 1, 8192, 256, 256, 8192, 2048]
    - [94, 15.15]
  - - [256, 4096, 1, 128, 256, 256, 128, 4096]
    - [27, 3.206]
  - - [256, 4096, 1, 256, 256, 256, 256, 4096]
    - [30, 5.505]
  - - [256, 4096, 1, 512, 256, 256, 512, 4096]
    - [115, 8.789]
  - - [256, 4096, 1, 1024, 256, 256, 1024, 4096]
    - [115, 12.937]
  - - [256, 4096, 1, 2048, 256, 256, 2048, 4096]
    - [107, 13.399]
  - - [256, 4096, 1, 4096, 256, 256, 4096, 4096]
    - [108, 16.092]
  - - [256, 4096, 1, 8192, 256, 256, 8192, 4096]
    - [18, 18.476]
  - - [256, 8192, 1, 128, 256, 256, 128, 8192]
    - [71, 4.592]
  - - [256, 8192, 1, 256, 256, 256, 256, 8192]
    - [89, 7.794]
  - - [256, 8192, 1, 512, 256, 256, 512, 8192]
    - [89, 12.261]
  - - [256, 8192, 1, 1024, 256, 256, 1024, 8192]
    - [107, 13.294]
  - - [256, 8192, 1, 2048, 256, 256, 2048, 8192]
    - [106, 16.454]
  - - [256, 8192, 1, 4096, 256, 256, 4096, 8192]
    - [91, 19.84]
  - - [256, 8192, 1, 8192, 256, 256, 8192, 8192]
    - [17, 23.38]
  - - [512, 128, 1, 128, 512, 512, 128, 128]
    - [45, 0.342]
  - - [512, 128, 1, 256, 512, 512, 256, 128]
    - [45, 0.621]
  - - [512, 128, 1, 512, 512, 512, 512, 128]
    - [45, 1.052]
  - - [512, 128, 1, 1024, 512, 512, 1024, 128]
    - [45, 1.578]
  - - [512, 128, 1, 2048, 512, 512, 2048, 128]
    - [46, 2.32]
  - - [512, 128, 1, 4096, 512, 512, 4096, 128]
    - [113, 3.491]
  - - [512, 128, 1, 8192, 512, 512, 8192, 128]
    - [43, 5.426]
  - - [512, 256, 1, 128, 512, 512, 128, 256]
    - [35, 0.67]
  - - [512, 256, 1, 256, 512, 512, 256, 256]
    - [35, 1.208]
  - - [512, 256, 1, 512, 512, 512, 512, 256]
    - [46, 2.01]
  - - [512, 256, 1, 1024, 512, 512, 1024, 256]
    - [46, 3.08]
  - - [512, 256, 1, 2048, 512, 512, 2048, 256]
    - [130, 4.045]
  - - [512, 256, 1, 4096, 512, 512, 4096, 256]
    - [131, 5.971]
  - - [512, 256, 1, 8192, 512, 512, 8192, 256]
    - [129, 8.543]
  - - [512, 512, 1, 128, 512, 512, 128, 512]
    - [34, 1.21]
  - - [512, 512, 1, 256, 512, 512, 256, 512]
    - [34, 2.148]
  - - [512, 512, 1, 512, 512, 512, 512, 512]
    - [43, 3.557]
  - - [512, 512, 1, 1024, 512, 512, 1024, 512]
    - [43, 5.33]
  - - [512, 512, 1, 2048, 512, 512, 2048, 512]
    - [128, 6.742]
  - - [512, 512, 1, 4096, 512, 512, 4096, 512]
    - [41, 9.278]
  - - [512, 512, 1, 8192, 512, 512, 8192, 512]
    - [39, 12.785]
  - - [512, 1024, 1, 128, 512, 512, 128, 1024]
    - [32, 2.054]
  - - [512, 1024, 1, 256, 512, 512, 256, 1024]
    - [32, 3.577]
  - - [512, 1024, 1, 512, 512, 512, 512, 1024]
    - [40, 5.92]
  - - [512, 1024, 1, 1024, 512, 512, 1024, 1024]
    - [42, 8.666]
  - - [512, 1024, 1, 2048, 512, 512, 2048, 1024]
    - [120, 10.417]
  - - [512, 1024, 1, 4096, 512, 512, 4096, 1024]
    - [21, 12.556]
  - - [512, 1024, 1, 8192, 512, 512, 8192, 1024]
    - [125, 15.178]
  - - [512, 2048, 1, 128, 512, 512, 128, 2048]
    - [6, 3.256]
  - - [512, 2048, 1, 256, 512, 512, 256, 2048]
    - [27, 5.549]
  - - [512, 2048, 1, 512, 512, 512, 512, 2048]
    - [115, 8.768]
  - - [512, 2048, 1, 1024, 512, 512, 1024, 2048]
    - [115, 12.565]
  - - [512, 2048, 1, 2048, 512, 512, 2048, 2048]
    - [109, 13.42]
  - - [512, 2048, 1, 4096, 512, 512, 4096, 2048]
    - [90, 16.297]
  - - [512, 2048, 1, 8192, 512, 512, 8192, 2048]
    - [26, 17.275]
  - - [512, 4096, 1, 128, 512, 512, 128, 4096]
    - [73, 4.589]
  - - [512, 4096, 1, 256, 512, 512, 256, 4096]
    - [89, 7.932]
  - - [512, 4096, 1, 512, 512, 512, 512, 4096]
    - [89, 12.372]
  - - [512, 4096, 1, 1024, 512, 512, 1024, 4096]
    - [107, 13.648]
  - - [512, 4096, 1, 2048, 512, 512, 2048, 4096]
    - [119, 16.699]
  - - [512, 4096, 1, 4096, 512, 512, 4096, 4096]
    - [84, 18.994]
  - - [512, 4096, 1, 8192, 512, 512, 8192, 4096]
    - [15, 21.375]
  - - [512, 8192, 1, 128, 512, 512, 128, 8192]
    - [65, 5.765]
  - - [512, 8192, 1, 256, 512, 512, 256, 8192]
    - [64, 9.546]
  - - [512, 8192, 1, 512, 512, 512, 512, 8192]
    - [13, 13.915]
  - - [512, 8192, 1, 1024, 512, 512, 1024, 8192]
    - [107, 16.527]
  - - [512, 8192, 1, 2048, 512, 512, 2048, 8192]
    - [94, 19.739]
  - - [512, 8192, 1, 4096, 512, 512, 4096, 8192]
    - [14, 22.753]
  - - [512, 8192, 1, 8192, 512, 512, 8192, 8192]
    - [13, 24.974]
  - - [1024, 128, 1, 128, 1024, 1024, 128, 128]
    - [35, 0.663]
  - - [1024, 128, 1, 256, 1024, 1024, 256, 128]
    - [35, 1.187]
  - - [1024, 128, 1, 512, 1024, 1024, 512, 128]
    - [46, 2.013]
  - - [1024, 128, 1, 1024, 1024, 1024, 1024, 128]
    - [46, 3.061]
  - - [1024, 128, 1, 2048, 1024, 1024, 2048, 128]
    - [130, 4.018]
  - - [1024, 128, 1, 4096, 1024, 1024, 4096, 128]
    - [130, 6.067]
  - - [1024, 128, 1, 8192, 1024, 1024, 8192, 128]
    - [129, 8.715]
  - - [1024, 256, 1, 128, 1024, 1024, 128, 256]
    - [34, 1.241]
  - - [1024, 256, 1, 256, 1024, 1024, 256, 256]
    - [34, 2.129]
  - - [1024, 256, 1, 512, 1024, 1024, 512, 256]
    - [43, 3.608]
  - - [1024, 256, 1, 1024, 1024, 1024, 1024, 256]
    - [43, 5.379]
  - - [1024, 256, 1, 2048, 1024, 1024, 2048, 256]
    - [128, 6.818]
  - - [1024, 256, 1, 4096, 1024, 1024, 4096, 256]
    - [128, 9.469]
  - - [1024, 256, 1, 8192, 1024, 1024, 8192, 256]
    - [122, 12.587]
  - - [1024, 512, 1, 128, 1024, 1024, 128, 512]
    - [32, 2.06]
  - - [1024, 512, 1, 256, 1024, 1024, 256, 512]
    - [40, 3.618]
  - - [1024, 512, 1, 512, 1024, 1024, 512, 512]
    - [40, 5.957]
  - - [1024, 512, 1, 1024, 1024, 1024, 1024, 512]
    - [42, 8.677]
  - - [1024, 512, 1, 2048, 1024, 1024, 2048, 512]
    - [129, 10.559]
  - - [1024, 512, 1, 4096, 1024, 1024, 4096, 512]
    - [24, 12.797]
  - - [1024, 512, 1, 8192, 1024, 1024, 8192, 512]
    - [123, 15.003]
  - - [1024, 1024, 1, 128, 1024, 1024, 128, 1024]
    - [7, 3.243]
  - - [1024, 1024, 1, 256, 1024, 1024, 256, 1024]
    - [28, 5.553]
  - - [1024, 1024, 1, 512, 1024, 1024, 512, 1024]
    - [115, 8.843]
  - - [1024, 1024, 1, 1024, 1024, 1024, 1024, 1024]
    - [38, 12.55]
  - - [1024, 1024, 1, 2048, 1024, 1024, 2048, 1024]
    - [125, 13.446]
  - - [1024, 1024, 1, 4096, 1024, 1024, 4096, 1024]
    - [99, 15.824]
  - - [1024, 1024, 1, 8192, 1024, 1024, 8192, 1024]
    - [86, 17.949]
  - - [1024, 2048, 1, 128, 1024, 1024, 128, 2048]
    - [72, 4.615]
  - - [1024, 2048, 1, 256, 1024, 1024, 256, 2048]
    - [89, 7.942]
  - - [1024, 2048, 1, 512, 1024, 1024, 512, 2048]
    - [89, 12.21]
  - - [1024, 2048, 1, 1024, 1024, 1024, 1024, 2048]
    - [124, 13.132]
  - - [1024, 2048, 1, 2048, 1024, 1024, 2048, 2048]
    - [115, 16.136]
  - - [1024, 2048, 1, 4096, 1024, 1024, 4096, 2048]
    - [86, 19.5]
  - - [1024, 2048, 1, 8192, 1024, 1024, 8192, 2048]
    - [17, 21.094]
  - - [1024, 4096, 1, 128, 1024, 1024, 128, 4096]
    - [64, 5.751]
  - - [1024, 4096, 1, 256, 1024, 1024, 256, 4096]
    - [62, 9.574]
  - - [1024, 4096, 1, 512, 1024, 1024, 512, 4096]
    - [10, 14.092]
  - - [1024, 4096, 1, 1024, 1024, 1024, 1024, 4096]
    - [90, 16.352]
  - - [1024, 4096, 1, 2048, 1024, 1024, 2048, 4096]
    - [97, 19.571]
  - - [1024, 4096, 1, 4096, 1024, 1024, 4096, 4096]
    - [16, 21.954]
  - - [1024, 4096, 1, 8192, 1024, 1024, 8192, 4096]
    - [57, 23.902]
  - - [1024, 8192, 1, 128, 1024, 1024, 128, 8192]
    - [3, 6.306]
  - - [1024, 8192, 1, 256, 1024, 1024, 256, 8192]
    - [3, 10.516]
  - - [1024, 8192, 1, 512, 1024, 1024, 512, 8192]
    - [94, 14.003]
  - - [1024, 8192, 1, 1024, 1024, 1024, 1024, 8192]
    - [89, 18.604]
  - - [1024, 8192, 1, 2048, 1024, 1024, 2048, 8192]
    - [83, 22.359]
  - - [1024, 8192, 1, 4096, 1024, 1024, 4096, 8192]
    - [13, 24.049]
  - - [1024, 8192, 1, 8192, 1024, 1024, 8192, 8192]
    - [54, 26.222]
  - - [2048, 128, 1, 128, 2048, 2048, 128, 128]
    - [34, 1.243]
  - - [2048, 128, 1, 256, 2048, 2048, 256, 128]
    - [43, 2.132]
  - - [2048, 128, 1, 512, 2048, 2048, 512, 128]
    - [43, 3.595]
  - - [2048, 128, 1, 1024, 2048, 2048, 1024, 128]
    - [43, 5.386]
  - - [2048, 128, 1, 2048, 2048, 2048, 2048, 128]
    - [126, 6.896]
  - - [2048, 128, 1, 4096, 2048, 2048, 4096, 128]
    - [129, 9.511]
  - - [2048, 128, 1, 8192, 2048, 2048, 8192, 128]
    - [122, 12.603]
  - - [2048, 256, 1, 128, 2048, 2048, 128, 256]
    - [112, 2.067]
  - - [2048, 256, 1, 256, 2048, 2048, 256, 256]
    - [112, 3.598]
  - - [2048, 256, 1, 512, 2048, 2048, 512, 256]
    - [40, 5.972]
  - - [2048, 256, 1, 1024, 2048, 2048, 1024, 256]
    - [41, 8.665]
  - - [2048, 256, 1, 2048, 2048, 2048, 2048, 256]
    - [129, 10.722]
  - - [2048, 256, 1, 4096, 2048, 2048, 4096, 256]
    - [101, 13.424]
  - - [2048, 256, 1, 8192, 2048, 2048, 8192, 256]
    - [97, 15.581]
  - - [2048, 512, 1, 128, 2048, 2048, 128, 512]
    - [29, 3.242]
  - - [2048, 512, 1, 256, 2048, 2048, 256, 512]
    - [30, 5.651]
  - - [2048, 512, 1, 512, 2048, 2048, 512, 512]
    - [120, 8.956]
  - - [2048, 512, 1, 1024, 2048, 2048, 1024, 512]
    - [125, 12.917]
  - - [2048, 512, 1, 2048, 2048, 2048, 2048, 512]
    - [111, 14.031]
  - - [2048, 512, 1, 4096, 2048, 2048, 4096, 512]
    - [95, 15.688]
  - - [2048, 512, 1, 8192, 2048, 2048, 8192, 512]
    - [86, 17.671]
  - - [2048, 1024, 1, 128, 2048, 2048, 128, 1024]
    - [72, 4.587]
  - - [2048, 1024, 1, 256, 2048, 2048, 256, 1024]
    - [88, 7.564]
  - - [2048, 1024, 1, 512, 2048, 2048, 512, 1024]
    - [20, 12.099]
  - - [2048, 1024, 1, 1024, 2048, 2048, 1024, 1024]
    - [102, 13.199]
  - - [2048, 1024, 1, 2048, 2048, 2048, 2048, 1024]
    - [100, 16.353]
  - - [2048, 1024, 1, 4096, 2048, 2048, 4096, 1024]
    - [86, 19.242]
  - - [2048, 1024, 1, 8192, 2048, 2048, 8192, 1024]
    - [12, 20.377]
  - - [2048, 2048, 1, 128, 2048, 2048, 128, 2048]
    - [63, 5.744]
  - - [2048, 2048, 1, 256, 2048, 2048, 256, 2048]
    - [64, 9.65]
  - - [2048, 2048, 1, 512, 2048, 2048, 512, 2048]
    - [9, 14.296]
  - - [2048, 2048, 1, 1024, 2048, 2048, 1024, 2048]
    - [110, 15.672]
  - - [2048, 2048, 1, 2048, 2048, 2048, 2048, 2048]
    - [99, 19.531]
  - - [2048, 2048, 1, 4096, 2048, 2048, 4096, 2048]
    - [78, 21.043]
  - - [2048, 2048, 1, 8192, 2048, 2048, 8192, 2048]
    - [59, 23.856]
  - - [2048, 4096, 1, 128, 2048, 2048, 128, 4096]
    - [2, 6.288]
  - - [2048, 4096, 1, 256, 2048, 2048, 256, 4096]
    - [2, 10.572]
  - - [2048, 4096, 1, 512, 2048, 2048, 512, 4096]
    - [88, 13.972]
  - - [2048, 4096, 1, 1024, 2048, 2048, 1024, 4096]
    - [89, 18.828]
  - - [2048, 4096, 1, 2048, 2048, 2048, 2048, 4096]
    - [75, 21.917]
  - - [2048, 4096, 1, 4096, 2048, 2048, 4096, 4096]
    - [75, 24.44]
  - - [2048, 4096, 1, 8192, 2048, 2048, 8192, 4096]
    - [59, 26.521]
  - - [2048, 8192, 1, 128, 2048, 2048, 128, 8192]
    - [107, 6.466]
  - - [2048, 8192, 1, 256, 2048, 2048, 256, 8192]
    - [89, 10.788]
  - - [2048, 8192, 1, 512, 2048, 2048, 512, 8192]
    - [99, 15.8]
  - - [2048, 8192, 1, 1024, 2048, 2048, 1024, 8192]
    - [74, 19.807]
  - - [2048, 8192, 1, 2048, 2048, 2048, 2048, 8192]
    - [75, 24.299]
  - - [2048, 8192, 1, 4096, 2048, 2048, 4096, 8192]
    - [77, 28.016]
  - - [2048, 8192, 1, 8192, 2048, 2048, 8192, 8192]
    - [61, 27.819]
  - - [4096, 128, 1, 128, 4096, 4096, 128, 128]
    - [8, 2.077]
  - - [4096, 128, 1, 256, 4096, 4096, 256, 128]
    - [112, 3.578]
  - - [4096, 128, 1, 512, 4096, 4096, 512, 128]
    - [126, 5.829]
  - - [4096, 128, 1, 1024, 4096, 4096, 1024, 128]
    - [41, 8.564]
  - - [4096, 128, 1, 2048, 4096, 4096, 2048, 128]
    - [129, 10.375]
  - - [4096, 128, 1, 4096, 4096, 4096, 4096, 128]
    - [26, 12.849]
  - - [4096, 128, 1, 8192, 4096, 4096, 8192, 128]
    - [92, 15.176]
  - - [4096, 256, 1, 128, 4096, 4096, 128, 256]
    - [6, 3.214]
  - - [4096, 256, 1, 256, 4096, 4096, 256, 256]
    - [107, 5.467]
  - - [4096, 256, 1, 512, 4096, 4096, 512, 256]
    - [122, 8.711]
  - - [4096, 256, 1, 1024, 4096, 4096, 1024, 256]
    - [125, 12.804]
  - - [4096, 256, 1, 2048, 4096, 4096, 2048, 256]
    - [103, 13.952]
  - - [4096, 256, 1, 4096, 4096, 4096, 4096, 256]
    - [99, 16.362]
  - - [4096, 256, 1, 8192, 4096, 4096, 8192, 256]
    - [80, 18.054]
  - - [4096, 512, 1, 128, 4096, 4096, 128, 512]
    - [5, 4.529]
  - - [4096, 512, 1, 256, 4096, 4096, 256, 512]
    - [25, 7.436]
  - - [4096, 512, 1, 512, 4096, 4096, 512, 512]
    - [98, 11.884]
  - - [4096, 512, 1, 1024, 4096, 4096, 1024, 512]
    - [104, 13.337]
  - - [4096, 512, 1, 2048, 4096, 4096, 2048, 512]
    - [118, 16.619]
  - - [4096, 512, 1, 4096, 4096, 4096, 4096, 512]
    - [84, 19.28]
  - - [4096, 512, 1, 8192, 4096, 4096, 8192, 512]
    - [67, 20.665]
  - - [4096, 1024, 1, 128, 4096, 4096, 128, 1024]
    - [66, 5.667]
  - - [4096, 1024, 1, 256, 4096, 4096, 256, 1024]
    - [63, 9.395]
  - - [4096, 1024, 1, 512, 4096, 4096, 512, 1024]
    - [82, 13.922]
  - - [4096, 1024, 1, 1024, 4096, 4096, 1024, 1024]
    - [96, 16.076]
  - - [4096, 1024, 1, 2048, 4096, 4096, 2048, 1024]
    - [98, 19.656]
  - - [4096, 1024, 1, 4096, 4096, 4096, 4096, 1024]
    - [89, 21.39]
  - - [4096, 1024, 1, 8192, 4096, 4096, 8192, 1024]
    - [54, 23.772]
  - - [4096, 2048, 1, 128, 4096, 4096, 128, 2048]
    - [1, 6.279]
  - - [4096, 2048, 1, 256, 4096, 4096, 256, 2048]
    - [1, 10.251]
  - - [4096, 2048, 1, 512, 4096, 4096, 512, 2048]
    - [99, 13.931]
  - - [4096, 2048, 1, 1024, 4096, 4096, 1024, 2048]
    - [98, 18.797]
  - - [4096, 2048, 1, 2048, 4096, 4096, 2048, 2048]
    - [76, 22.001]
  - - [4096, 2048, 1, 4096, 4096, 4096, 4096, 2048]
    - [77, 24.875]
  - - [4096, 2048, 1, 8192, 4096, 4096, 8192, 2048]
    - [51, 27.081]
  - - [4096, 4096, 1, 128, 4096, 4096, 128, 4096]
    - [31, 6.244]
  - - [4096, 4096, 1, 256, 4096, 4096, 256, 4096]
    - [94, 10.578]
  - - [4096, 4096, 1, 512, 4096, 4096, 512, 4096]
    - [98, 15.542]
  - - [4096, 4096, 1, 1024, 4096, 4096, 1024, 4096]
    - [98, 19.695]
  - - [4096, 4096, 1, 2048, 4096, 4096, 2048, 4096]
    - [75, 24.492]
  - - [4096, 4096, 1, 4096, 4096, 4096, 4096, 4096]
    - [77, 27.272]
  - - [4096, 4096, 1, 8192, 4096, 4096, 8192, 4096]
    - [51, 28.721]
  - - [4096, 8192, 1, 128, 4096, 4096, 128, 8192]
    - [19, 6.815]
  - - [4096, 8192, 1, 256, 4096, 4096, 256, 8192]
    - [23, 10.73]
  - - [4096, 8192, 1, 512, 4096, 4096, 512, 8192]
    - [94, 15.438]
  - - [4096, 8192, 1, 1024, 4096, 4096, 1024, 8192]
    - [77, 20.725]
  - - [4096, 8192, 1, 2048, 4096, 4096, 2048, 8192]
    - [59, 25.998]
  - - [4096, 8192, 1, 4096, 4096, 4096, 4096, 8192]
    - [57, 30.935]
  - - [4096, 8192, 1, 8192, 4096, 4096, 8192, 8192]
    - [57, 33.862]
  - - [8192, 128, 1, 128, 8192, 8192, 128, 128]
    - [6, 3.179]
  - - [8192, 128, 1, 256, 8192, 8192, 256, 128]
    - [27, 5.451]
  - - [8192, 128, 1, 512, 8192, 8192, 512, 128]
    - [115, 8.648]
  - - [8192, 128, 1, 1024, 8192, 8192, 1024, 128]
    - [115, 12.482]
  - - [8192, 128, 1, 2048, 8192, 8192, 2048, 128]
    - [129, 13.063]
  - - [8192, 128, 1, 4096, 8192, 8192, 4096, 128]
    - [116, 16.33]
  - - [8192, 128, 1, 8192, 8192, 8192, 8192, 128]
    - [21, 18.934]
  - - [8192, 256, 1, 128, 8192, 8192, 128, 256]
    - [70, 4.495]
  - - [8192, 256, 1, 256, 8192, 8192, 256, 256]
    - [98, 7.618]
  - - [8192, 256, 1, 512, 8192, 8192, 512, 256]
    - [98, 11.888]
  - - [8192, 256, 1, 1024, 8192, 8192, 1024, 256]
    - [117, 13.088]
  - - [8192, 256, 1, 2048, 8192, 8192, 2048, 256]
    - [22, 16.551]
  - - [8192, 256, 1, 4096, 8192, 8192, 4096, 256]
    - [87, 20.108]
  - - [8192, 256, 1, 8192, 8192, 8192, 8192, 256]
    - [10, 22.756]
  - - [8192, 512, 1, 128, 8192, 8192, 128, 512]
    - [69, 5.495]
  - - [8192, 512, 1, 256, 8192, 8192, 256, 512]
    - [68, 9.013]
  - - [8192, 512, 1, 512, 8192, 8192, 512, 512]
    - [79, 13.797]
  - - [8192, 512, 1, 1024, 8192, 8192, 1024, 512]
    - [97, 16.389]
  - - [8192, 512, 1, 2048, 8192, 8192, 2048, 512]
    - [99, 20.732]
  - - [8192, 512, 1, 4096, 8192, 8192, 4096, 512]
    - [9, 23.115]
  - - [8192, 512, 1, 8192, 8192, 8192, 8192, 512]
    - [11, 25.068]
  - - [8192, 1024, 1, 128, 8192, 8192, 128, 1024]
    - [0, 6.008]
  - - [8192, 1024, 1, 256, 8192, 8192, 256, 1024]
    - [4, 9.999]
  - - [8192, 1024, 1, 512, 8192, 8192, 512, 1024]
    - [99, 14.288]
  - - [8192, 1024, 1, 1024, 8192, 8192, 1024, 1024]
    - [97, 18.711]
  - - [8192, 1024, 1, 2048, 8192, 8192, 2048, 1024]
    - [77, 22.482]
  - - [8192, 1024, 1, 4096, 8192, 8192, 4096, 1024]
    - [60, 24.323]
  - - [8192, 1024, 1, 8192, 8192, 8192, 8192, 1024]
    - [50, 25.98]
  - - [8192, 2048, 1, 128, 8192, 8192, 128, 2048]
    - [73, 6.241]
  - - [8192, 2048, 1, 256, 8192, 8192, 256, 2048]
    - [93, 10.34]
  - - [8192, 2048, 1, 512, 8192, 8192, 512, 2048]
    - [94, 16.061]
  - - [8192, 2048, 1, 1024, 8192, 8192, 1024, 2048]
    - [99, 19.884]
  - - [8192, 2048, 1, 2048, 8192, 8192, 2048, 2048]
    - [77, 24.228]
  - - [8192, 2048, 1, 4096, 8192, 8192, 4096, 2048]
    - [11, 27.384]
  - - [8192, 2048, 1, 8192, 8192, 8192, 8192, 2048]
    - [51, 28.14]
  - - [8192, 4096, 1, 128, 8192, 8192, 128, 4096]
    - [21, 6.708]
  - - [8192, 4096, 1, 256, 8192, 8192, 256, 4096]
    - [81, 10.412]
  - - [8192, 4096, 1, 512, 8192, 8192, 512, 4096]
    - [94, 15.306]
  - - [8192, 4096, 1, 1024, 8192, 8192, 1024, 4096]
    - [75, 20.045]
  - - [8192, 4096, 1, 2048, 8192, 8192, 2048, 4096]
    - [58, 26.017]
  - - [8192, 4096, 1, 4096, 8192, 8192, 4096, 4096]
    - [56, 30.24]
  - - [8192, 4096, 1, 8192, 8192, 8192, 8192, 4096]
    - [58, 32.972]
  - - [8192, 8192, 1, 128, 8192, 8192, 128, 8192]
    - [67, 6.339]
  - - [8192, 8192, 1, 256, 8192, 8192, 256, 8192]
    - [78, 9.969]
  - - [8192, 8192, 1, 512, 8192, 8192, 512, 8192]
    - [85, 15.782]
  - - [8192, 8192, 1, 1024, 8192, 8192, 1024, 8192]
    - [52, 22.333]
  - - [8192, 8192, 1, 2048, 8192, 8192, 2048, 8192]
    - [54, 28.535]
  - - [8192, 8192, 1, 4096, 8192, 8192, 4096, 8192]
    - [55, 31.848]
  - - [8192, 8192, 1, 8192, 8192, 8192, 8192, 8192]
    - [53, 34.576]
  - - [1, 1, 1, 32, 1, 1, 32, 1]
    - [132, 0.0]
- null
- null
- ExperimentalStreamK
- GridBased
