library/src/amd_detail/rocblaslt/src/Tensile/Logic/asm_full/aquavanjaram/gfx942_228cu/StreamK/aquavanjaram942_Cijk_Alik_Bjlk_BSS_BH_UserArgs.yaml
- {MinimumRequiredVersion: 4.33.0}
- aquavanjaram942
- {Architecture: gfx942, CUCount: 228}
- [Device 0049, Device 0050]
    SolutionIndex: 0
    SolutionNameMin: Cijk_Alik_Bjlk_BSS_BH_UserArgs_MT256x256x32_MI16x16x1_SN_LDSB1_CLR1_GSU0_GSUC0_GSUWGMRR0_K1_LBSPPA128_LBSPPB2048_LPB32_MIWT8_8_PLR1_SU32_SUM0_SUS256_SKXCCM0_VWA2_VWB2_WGM1_WGMXCC1_WGMXCCGn1
    SolutionIndex: 1
    SolutionNameMin: Cijk_Alik_Bjlk_BSS_BH_UserArgs_MT256x256x32_MI16x16x1_SN_LDSB1_CLR1_GSU0_GSUC0_GSUWGMRR0_K1_LBSPPA256_LBSPPB2048_LPB32_MIWT8_8_PLR1_SU32_SUM0_SUS256_SKXCCM0_VWA4_VWB2_WGM1_WGMXCC1_WGMXCCGn1
    SolutionIndex: 2
    SolutionNameMin: Cijk_Alik_Bjlk_BSS_BH_UserArgs_MT256x256x32_MI16x16x1_SN_LDSB1_CLR1_GSU0_GSUC0_GSUWGMRR0_K1_LBSPPA128_LBSPPB2048_LPB0_MIWT8_8_PLR1_SU32_SUM0_SUS256_SKXCCM0_VWA2_VWB4_WGM1_WGMXCC1_WGMXCCGn1
    SolutionIndex: 3
    SolutionNameMin: Cijk_Alik_Bjlk_BSS_BH_UserArgs_MT256x256x32_MI16x16x1_SN_LDSB1_CLR1_GSU0_GSUC0_GSUWGMRR0_K1_LBSPPA256_LBSPPB2048_LPB0_MIWT8_8_PLR1_SU32_SUM0_SUS256_SKXCCM0_VWA4_VWB4_WGM1_WGMXCC1_WGMXCCGn1
    SolutionIndex: 4
    SolutionNameMin: Cijk_Alik_Bjlk_BSS_BH_UserArgs_MT256x256x32_MI16x16x1_SN_LDSB1_CLR1_GSU0_GSUC0_GSUWGMRR0_K1_LBSPPA128_LBSPPB2048_LPB0_MIWT8_8_PLR1_SU32_SUM0_SUS256_SKXCCM0_VWA1_VWB8_WGM1_WGMXCC1_WGMXCCGn1
    SolutionIndex: 5
    SolutionNameMin: Cijk_Alik_Bjlk_BSS_BH_UserArgs_MT256x256x32_MI16x16x1_SN_LDSB1_CLR1_GSU0_GSUC0_GSUWGMRR0_K1_LBSPPA128_LBSPPB2048_LPB0_MIWT8_8_PLR1_SU32_SUM0_SUS256_SKXCCM0_VWA2_VWB8_WGM1_WGMXCC1_WGMXCCGn1
    SolutionIndex: 6
    SolutionNameMin: Cijk_Alik_Bjlk_BSS_BH_UserArgs_MT256x256x32_MI16x16x1_SN_LDSB1_CLR1_GSU0_GSUC0_GSUWGMRR0_K1_LBSPPA256_LBSPPB2048_LPB0_MIWT8_8_PLR1_SU32_SUM0_SUS256_SKXCCM0_VWA4_VWB8_WGM1_WGMXCC1_WGMXCCGn1
    SolutionIndex: 7
    SolutionNameMin: Cijk_Alik_Bjlk_BSS_BH_UserArgs_MT256x256x32_MI16x16x1_SN_LDSB1_CLR1_GSU0_GSUC0_GSUWGMRR0_K1_LBSPPA256_LBSPPB2048_LPB0_MIWT8_8_PLR1_SU32_SUM0_SUS256_SKXCCM0_VWA4_VWB4_WGM8_WGMXCC1_WGMXCCGn1
    SolutionIndex: 8
    SolutionNameMin: Cijk_Alik_Bjlk_BSS_BH_UserArgs_MT256x256x32_MI16x16x1_SN_LDSB1_CLR1_GSU0_GSUC0_GSUWGMRR0_K1_LBSPPA256_LBSPPB2048_LPB0_MIWT8_8_PLR1_SU32_SUM0_SUS256_SKXCCM0_VWA4_VWB8_WGM8_WGMXCC1_WGMXCCGn1
    SolutionIndex: 9
    SolutionNameMin: Cijk_Alik_Bjlk_BSS_BH_UserArgs_MT128x256x32_MI16x16x1_SN_LDSB1_CLR1_GSU0_GSUC0_GSUWGMRR0_K1_LBSPPA256_LBSPPB2048_LPB32_MIWT4_8_PLR1_SU32_SUM0_SUS256_SKXCCM0_VWA4_VWB2_WGM1_WGMXCC1_WGMXCCGn1
    SolutionIndex: 10
    SolutionNameMin: Cijk_Alik_Bjlk_BSS_BH_UserArgs_MT128x256x32_MI16x16x1_SN_LDSB1_CLR1_GSU0_GSUC0_GSUWGMRR0_K1_LBSPPA256_LBSPPB2048_LPB0_MIWT4_8_PLR1_SU32_SUM0_SUS256_SKXCCM0_VWA4_VWB4_WGM1_WGMXCC1_WGMXCCGn1
    SolutionIndex: 11
    SolutionNameMin: Cijk_Alik_Bjlk_BSS_BH_UserArgs_MT128x256x32_MI16x16x1_SN_LDSB1_CLR1_GSU0_GSUC0_GSUWGMRR0_K1_LBSPPA256_LBSPPB2048_LPB0_MIWT4_8_PLR1_SU32_SUM0_SUS256_SKXCCM0_VWA4_VWB8_WGM1_WGMXCC1_WGMXCCGn1
    SolutionIndex: 12
    SolutionNameMin: Cijk_Alik_Bjlk_BSS_BH_UserArgs_MT128x128x32_MI16x16x1_SN_LDSB1_CLR1_GSU0_GSUC0_GSUWGMRR0_K1_LBSPPA256_LBSPPB1024_LPB0_MIWT4_4_PLR1_SU32_SUM0_SUS256_SKXCCM0_VWA4_VWB4_WGM4_WGMXCC1_WGMXCCGn1
    SolutionIndex: 13
    SolutionNameMin: Cijk_Alik_Bjlk_BSS_BH_UserArgs_MT128x128x32_MI16x16x1_SN_LDSB1_CLR1_GSU0_GSUC0_GSUWGMRR0_K1_LBSPPA256_LBSPPB1024_LPB0_MIWT4_4_PLR1_SU32_SUM0_SUS256_SKXCCM0_VWA4_VWB4_WGM8_WGMXCC1_WGMXCCGn1
    SolutionIndex: 14
    SolutionNameMin: Cijk_Alik_Bjlk_BSS_BH_UserArgs_MT64x128x32_MI16x16x1_SN_LDSB0_CLR1_GSU0_GSUC0_GSUWGMRR0_K1_LBSPPA128_LBSPPB1024_LPB32_MIWT2_4_PLR1_SU32_SUM0_SUS256_SKXCCM0_VWA1_VWB2_WGM1_WGMXCC1_WGMXCCGn1
    SolutionIndex: 15
    SolutionNameMin: Cijk_Alik_Bjlk_BSS_BH_UserArgs_MT64x128x32_MI16x16x1_SN_LDSB0_CLR1_GSU0_GSUC0_GSUWGMRR0_K1_LBSPPA128_LBSPPB1024_LPB0_MIWT2_4_PLR1_SU32_SUM0_SUS256_SKXCCM0_VWA1_VWB4_WGM1_WGMXCC1_WGMXCCGn1
    SolutionIndex: 16
    SolutionNameMin: Cijk_Alik_Bjlk_BSS_BH_UserArgs_MT128x64x32_MI16x16x1_SN_LDSB0_CLR1_GSU0_GSUC0_GSUWGMRR0_K1_LBSPPA256_LBSPPB512_LPB16_MIWT4_2_PLR1_SU32_SUM0_SUS256_SKXCCM0_VWA4_VWB1_WGM1_WGMXCC1_WGMXCCGn1
    SolutionIndex: 17
    SolutionNameMin: Cijk_Alik_Bjlk_BSS_BH_UserArgs_MT128x64x32_MI16x16x1_SN_LDSB0_CLR1_GSU0_GSUC0_GSUWGMRR0_K1_LBSPPA256_LBSPPB512_LPB32_MIWT4_2_PLR1_SU32_SUM0_SUS256_SKXCCM0_VWA4_VWB2_WGM1_WGMXCC1_WGMXCCGn1
    SolutionIndex: 18
    SolutionNameMin: Cijk_Alik_Bjlk_BSS_BH_UserArgs_MT64x64x32_MI16x16x1_SN_LDSB0_CLR1_GSU0_GSUC0_GSUWGMRR0_K1_LBSPPA128_LBSPPB512_LPB32_MIWT2_2_PLR1_SU32_SUM0_SUS256_SKXCCM0_VWA1_VWB2_WGM1_WGMXCC1_WGMXCCGn1
    SolutionIndex: 19
    SolutionNameMin: Cijk_Alik_Bjlk_BSS_BH_UserArgs_MT64x64x32_MI16x16x1_SN_LDSB0_CLR1_GSU0_GSUC0_GSUWGMRR0_K1_LBSPPA128_LBSPPB512_LPB32_MIWT2_2_PLR1_SU32_SUM0_SUS256_SKXCCM0_VWA1_VWB2_WGM4_WGMXCC1_WGMXCCGn1
    SolutionIndex: 20
    SolutionNameMin: Cijk_Alik_Bjlk_BSS_BH_UserArgs_MT128x256x64_MI16x16x1_SN_LDSB1_CLR1_GSU0_GSUC0_GSUWGMRR0_K1_LBSPPA128_LBSPPB4096_LPB32_MIWT4_8_PLR1_SU32_SUM0_SUS256_SKXCCM0_VWA1_VWB2_WGM1_WGMXCC1_WGMXCCGn1
    SolutionIndex: 21
    SolutionNameMin: Cijk_Alik_Bjlk_BSS_BH_UserArgs_MT128x256x64_MI16x16x1_SN_LDSB1_CLR1_GSU0_GSUC0_GSUWGMRR0_K1_LBSPPA512_LBSPPB4096_LPB32_MIWT4_8_PLR1_SU32_SUM0_SUS256_SKXCCM0_VWA4_VWB2_WGM1_WGMXCC1_WGMXCCGn1
    SolutionIndex: 22
    SolutionNameMin: Cijk_Alik_Bjlk_BSS_BH_UserArgs_MT128x256x64_MI16x16x1_SN_LDSB1_CLR1_GSU0_GSUC0_GSUWGMRR0_K1_LBSPPA128_LBSPPB4096_LPB0_MIWT4_8_PLR1_SU32_SUM0_SUS256_SKXCCM0_VWA1_VWB4_WGM1_WGMXCC1_WGMXCCGn1
    SolutionIndex: 23
    SolutionNameMin: Cijk_Alik_Bjlk_BSS_BH_UserArgs_MT128x256x64_MI16x16x1_SN_LDSB1_CLR1_GSU0_GSUC0_GSUWGMRR0_K1_LBSPPA256_LBSPPB4096_LPB0_MIWT4_8_PLR1_SU32_SUM0_SUS256_SKXCCM0_VWA2_VWB4_WGM1_WGMXCC1_WGMXCCGn1
    SolutionIndex: 24
    SolutionNameMin: Cijk_Alik_Bjlk_BSS_BH_UserArgs_MT128x256x64_MI16x16x1_SN_LDSB1_CLR1_GSU0_GSUC0_GSUWGMRR0_K1_LBSPPA512_LBSPPB4096_LPB0_MIWT4_8_PLR1_SU32_SUM0_SUS256_SKXCCM0_VWA4_VWB4_WGM1_WGMXCC1_WGMXCCGn1
    SolutionIndex: 25
    SolutionNameMin: Cijk_Alik_Bjlk_BSS_BH_UserArgs_MT128x256x64_MI16x16x1_SN_LDSB1_CLR1_GSU0_GSUC0_GSUWGMRR0_K1_LBSPPA128_LBSPPB4096_LPB0_MIWT4_8_PLR1_SU32_SUM0_SUS256_SKXCCM0_VWA1_VWB4_WGM4_WGMXCC1_WGMXCCGn1
    SolutionIndex: 26
    SolutionNameMin: Cijk_Alik_Bjlk_BSS_BH_UserArgs_MT128x256x64_MI16x16x1_SN_LDSB1_CLR1_GSU0_GSUC0_GSUWGMRR0_K1_LBSPPA512_LBSPPB4096_LPB0_MIWT4_8_PLR1_SU32_SUM0_SUS256_SKXCCM0_VWA4_VWB8_WGM4_WGMXCC1_WGMXCCGn1
    SolutionIndex: 27
    SolutionNameMin: Cijk_Alik_Bjlk_BSS_BH_UserArgs_MT256x128x64_MI16x16x1_SN_LDSB1_CLR1_GSU0_GSUC0_GSUWGMRR0_K1_LBSPPA512_LBSPPB2048_LPB0_MIWT8_4_PLR1_SU32_SUM0_SUS256_SKXCCM0_VWA4_VWB4_WGM1_WGMXCC1_WGMXCCGn1
    SolutionIndex: 28
    SolutionNameMin: Cijk_Alik_Bjlk_BSS_BH_UserArgs_MT256x128x64_MI16x16x1_SN_LDSB1_CLR1_GSU0_GSUC0_GSUWGMRR0_K1_LBSPPA512_LBSPPB2048_LPB32_MIWT8_4_PLR1_SU32_SUM0_SUS256_SKXCCM0_VWA4_VWB2_WGM4_WGMXCC1_WGMXCCGn1
    SolutionIndex: 29
    SolutionNameMin: Cijk_Alik_Bjlk_BSS_BH_UserArgs_MT256x128x64_MI16x16x1_SN_LDSB1_CLR1_GSU0_GSUC0_GSUWGMRR0_K1_LBSPPA512_LBSPPB2048_LPB0_MIWT8_4_PLR1_SU32_SUM0_SUS256_SKXCCM0_VWA4_VWB4_WGM8_WGMXCC1_WGMXCCGn1
    SolutionIndex: 30
    SolutionNameMin: Cijk_Alik_Bjlk_BSS_BH_UserArgs_MT64x256x64_MI16x16x1_SN_LDSB1_CLR1_GSU0_GSUC0_GSUWGMRR0_K1_LBSPPA128_LBSPPB4096_LPB0_MIWT2_8_PLR1_SU32_SUM0_SUS256_SKXCCM0_VWA1_VWB4_WGM1_WGMXCC1_WGMXCCGn1
    SolutionIndex: 31
    SolutionNameMin: Cijk_Alik_Bjlk_BSS_BH_UserArgs_MT256x64x64_MI16x16x1_SN_LDSB1_CLR1_GSU0_GSUC0_GSUWGMRR0_K1_LBSPPA512_LBSPPB1024_LPB32_MIWT8_2_PLR1_SU32_SUM0_SUS256_SKXCCM0_VWA4_VWB2_WGM4_WGMXCC1_WGMXCCGn1
    SolutionIndex: 32
    SolutionNameMin: Cijk_Alik_Bjlk_BSS_BH_UserArgs_MT128x128x64_MI16x16x1_SN_LDSB1_CLR1_GSU0_GSUC0_GSUWGMRR0_K1_LBSPPA512_LBSPPB2048_LPB32_MIWT4_4_PLR1_SU32_SUM0_SUS256_SKXCCM0_VWA4_VWB2_WGM1_WGMXCC1_WGMXCCGn1
    SolutionIndex: 33
    SolutionNameMin: Cijk_Alik_Bjlk_BSS_BH_UserArgs_MT128x128x64_MI16x16x1_SN_LDSB1_CLR1_GSU0_GSUC0_GSUWGMRR0_K1_LBSPPA512_LBSPPB2048_LPB0_MIWT4_4_PLR1_SU32_SUM0_SUS256_SKXCCM0_VWA4_VWB4_WGM1_WGMXCC1_WGMXCCGn1
    SolutionIndex: 34
    SolutionNameMin: Cijk_Alik_Bjlk_BSS_BH_UserArgs_MT128x128x64_MI16x16x1_SN_LDSB1_CLR1_GSU0_GSUC0_GSUWGMRR0_K1_LBSPPA512_LBSPPB2048_LPB32_MIWT4_4_PLR1_SU32_SUM0_SUS256_SKXCCM0_VWA4_VWB2_WGM4_WGMXCC1_WGMXCCGn1
    SolutionIndex: 35
    SolutionNameMin: Cijk_Alik_Bjlk_BSS_BH_UserArgs_MT128x128x64_MI16x16x1_SN_LDSB1_CLR1_GSU0_GSUC0_GSUWGMRR0_K1_LBSPPA128_LBSPPB2048_LPB0_MIWT4_4_PLR1_SU32_SUM0_SUS256_SKXCCM0_VWA1_VWB4_WGM8_WGMXCC1_WGMXCCGn1
    SolutionIndex: 36
    SolutionNameMin: Cijk_Alik_Bjlk_BSS_BH_UserArgs_MT64x128x64_MI16x16x1_SN_LDSB1_CLR1_GSU0_GSUC0_GSUWGMRR0_K1_LBSPPA128_LBSPPB2048_LPB0_MIWT2_4_PLR1_SU32_SUM0_SUS256_SKXCCM0_VWA1_VWB4_WGM1_WGMXCC1_WGMXCCGn1
    SolutionIndex: 37
    SolutionNameMin: Cijk_Alik_Bjlk_BSS_BH_UserArgs_MT64x128x64_MI16x16x1_SN_LDSB1_CLR1_GSU0_GSUC0_GSUWGMRR0_K1_LBSPPA128_LBSPPB2048_LPB0_MIWT2_4_PLR1_SU32_SUM0_SUS256_SKXCCM0_VWA1_VWB4_WGM4_WGMXCC1_WGMXCCGn1
    SolutionIndex: 38
    SolutionNameMin: Cijk_Alik_Bjlk_BSS_BH_UserArgs_MT64x128x64_MI16x16x1_SN_LDSB1_CLR1_GSU0_GSUC0_GSUWGMRR0_K1_LBSPPA128_LBSPPB2048_LPB0_MIWT2_4_PLR1_SU32_SUM0_SUS256_SKXCCM0_VWA1_VWB4_WGM8_WGMXCC1_WGMXCCGn1
    SolutionIndex: 39
    SolutionNameMin: Cijk_Alik_Bjlk_BSS_BH_UserArgs_MT128x64x64_MI16x16x1_SN_LDSB1_CLR1_GSU0_GSUC0_GSUWGMRR0_K1_LBSPPA512_LBSPPB1024_LPB32_MIWT4_2_PLR1_SU32_SUM0_SUS256_SKXCCM0_VWA4_VWB2_WGM1_WGMXCC1_WGMXCCGn1
    SolutionIndex: 40
    SolutionNameMin: Cijk_Alik_Bjlk_BSS_BH_UserArgs_MT128x64x64_MI16x16x1_SN_LDSB1_CLR1_GSU0_GSUC0_GSUWGMRR0_K1_LBSPPA128_LBSPPB1024_LPB32_MIWT4_2_PLR1_SU32_SUM0_SUS256_SKXCCM0_VWA1_VWB2_WGM8_WGMXCC1_WGMXCCGn1
    SolutionIndex: 41
    SolutionNameMin: Cijk_Alik_Bjlk_BSS_BH_UserArgs_MT128x64x64_MI16x16x1_SN_LDSB1_CLR1_GSU0_GSUC0_GSUWGMRR0_K1_LBSPPA512_LBSPPB1024_LPB32_MIWT4_2_PLR1_SU32_SUM0_SUS256_SKXCCM0_VWA4_VWB2_WGM8_WGMXCC1_WGMXCCGn1
    SolutionIndex: 42
    SolutionNameMin: Cijk_Alik_Bjlk_BSS_BH_UserArgs_MT64x64x64_MI16x16x1_SN_LDSB1_CLR1_GSU0_GSUC0_GSUWGMRR0_K1_LBSPPA128_LBSPPB1024_LPB32_MIWT2_2_PLR1_SU32_SUM0_SUS256_SKXCCM0_VWA1_VWB2_WGM1_WGMXCC1_WGMXCCGn1
    SolutionIndex: 43
    SolutionNameMin: Cijk_Alik_Bjlk_BSS_BH_UserArgs_MT32x64x64_MI16x16x1_SN_LDSB0_CLR1_GSU0_GSUC0_GSUWGMRR0_K1_LBSPPA128_LBSPPB1024_LPB32_MIWT1_2_PLR1_SU32_SUM0_SUS256_SKXCCM0_VWA1_VWB2_WGM1_WGMXCC1_WGMXCCGn1
    SolutionIndex: 44
    SolutionNameMin: Cijk_Alik_Bjlk_BSS_BH_UserArgs_MT64x32x64_MI16x16x1_SN_LDSB0_CLR1_GSU0_GSUC0_GSUWGMRR0_K1_LBSPPA256_LBSPPB512_LPB16_MIWT2_1_PLR1_SU32_SUM0_SUS256_SKXCCM0_VWA2_VWB1_WGM1_WGMXCC1_WGMXCCGn1
    SolutionIndex: 45
    SolutionNameMin: Cijk_Alik_Bjlk_BSS_BH_UserArgs_MT32x32x64_MI16x16x1_SN_LDSB0_CLR1_GSU0_GSUC0_GSUWGMRR0_K1_LBSPPA128_LBSPPB512_LPB16_MIWT1_1_PLR1_SU32_SUM0_SUS256_SKXCCM0_VWA1_VWB1_WGM1_WGMXCC1_WGMXCCGn1
    SolutionIndex: 46
    SolutionNameMin: Cijk_Alik_Bjlk_BSS_BH_UserArgs_MT32x32x64_MI16x16x1_SN_LDSB0_CLR1_GSU0_GSUC0_GSUWGMRR0_K1_LBSPPA128_LBSPPB512_LPB16_MIWT1_1_PLR1_SU32_SUM0_SUS256_SKXCCM0_VWA1_VWB1_WGM4_WGMXCC1_WGMXCCGn1
    SolutionIndex: 47
    SolutionNameMin: Cijk_Alik_Bjlk_BSS_BH_UserArgs_MT64x128x128_MI16x16x1_SN_LDSB1_CLR1_GSU0_GSUC0_GSUWGMRR0_K1_LBSPPA256_LBSPPB2048_LPB0_MIWT2_4_PLR2_SU32_SUM0_SUS256_SKXCCM0_VWA1_VWB4_WGM1_WGMXCC1_WGMXCCGn1
    SolutionIndex: 48
    SolutionNameMin: Cijk_Alik_Bjlk_BSS_BH_UserArgs_MT128x64x128_MI16x16x1_SN_LDSB1_CLR1_GSU0_GSUC0_GSUWGMRR0_K1_LBSPPA1024_LBSPPB1024_LPB32_MIWT4_2_PLR2_SU32_SUM0_SUS256_SKXCCM0_VWA4_VWB2_WGM1_WGMXCC1_WGMXCCGn1
    SolutionIndex: 49
    SolutionNameMin: Cijk_Alik_Bjlk_BSS_BH_UserArgs_MT128x64x128_MI16x16x1_SN_LDSB1_CLR1_GSU0_GSUC0_GSUWGMRR0_K1_LBSPPA1024_LBSPPB1024_LPB32_MIWT4_2_PLR2_SU32_SUM0_SUS256_SKXCCM0_VWA4_VWB2_WGM8_WGMXCC1_WGMXCCGn1
    SolutionIndex: 50
    SolutionNameMin: Cijk_Alik_Bjlk_BSS_BH_UserArgs_MT64x64x128_MI16x16x1_SN_LDSB1_CLR1_GSU0_GSUC0_GSUWGMRR0_K1_LBSPPA256_LBSPPB1024_LPB32_MIWT2_2_PLR2_SU32_SUM0_SUS256_SKXCCM0_VWA1_VWB2_WGM1_WGMXCC1_WGMXCCGn1
    SolutionIndex: 51
    SolutionNameMin: Cijk_Alik_Bjlk_BSS_BH_UserArgs_MT64x64x128_MI16x16x1_SN_LDSB1_CLR1_GSU0_GSUC0_GSUWGMRR0_K1_LBSPPA256_LBSPPB1024_LPB32_MIWT2_2_PLR2_SU32_SUM0_SUS256_SKXCCM0_VWA1_VWB2_WGM4_WGMXCC1_WGMXCCGn1
    SolutionIndex: 52
    SolutionNameMin: Cijk_Alik_Bjlk_BSS_BH_UserArgs_MT64x64x128_MI16x16x1_SN_LDSB1_CLR1_GSU0_GSUC0_GSUWGMRR0_K1_LBSPPA256_LBSPPB1024_LPB32_MIWT2_2_PLR2_SU32_SUM0_SUS256_SKXCCM0_VWA1_VWB2_WGM8_WGMXCC1_WGMXCCGn1
    SolutionIndex: 53
    SolutionNameMin: Cijk_Alik_Bjlk_BSS_BH_UserArgs_MT32x64x128_MI16x16x1_SN_LDSB1_CLR1_GSU0_GSUC0_GSUWGMRR0_K1_LBSPPA256_LBSPPB1024_LPB32_MIWT1_2_PLR2_SU32_SUM0_SUS256_SKXCCM0_VWA1_VWB2_WGM1_WGMXCC1_WGMXCCGn1
    SolutionIndex: 54
    SolutionNameMin: Cijk_Alik_Bjlk_BSS_BH_UserArgs_MT32x64x128_MI16x16x1_SN_LDSB1_CLR1_GSU0_GSUC0_GSUWGMRR0_K1_LBSPPA256_LBSPPB1024_LPB32_MIWT1_2_PLR2_SU32_SUM0_SUS256_SKXCCM0_VWA1_VWB2_WGM4_WGMXCC1_WGMXCCGn1
    SolutionIndex: 55
    SolutionNameMin: Cijk_Alik_Bjlk_BSS_BH_UserArgs_MT32x32x128_MI16x16x1_SN_LDSB1_CLR1_GSU0_GSUC0_GSUWGMRR0_K1_LBSPPA256_LBSPPB512_LPB16_MIWT1_1_PLR1_SU32_SUM0_SUS256_SKXCCM0_VWA1_VWB1_WGM1_WGMXCC1_WGMXCCGn1
    SolutionIndex: 56
    SolutionNameMin: Cijk_Alik_Bjlk_BSS_BH_UserArgs_MT32x32x128_MI16x16x1_SN_LDSB1_CLR1_GSU0_GSUC0_GSUWGMRR0_K1_LBSPPA256_LBSPPB512_LPB16_MIWT1_1_PLR2_SU32_SUM0_SUS256_SKXCCM0_VWA1_VWB1_WGM1_WGMXCC1_WGMXCCGn1
    SolutionIndex: 57
    SolutionNameMin: Cijk_Alik_Bjlk_BSS_BH_UserArgs_MT32x32x128_MI16x16x1_SN_LDSB1_CLR1_GSU0_GSUC0_GSUWGMRR0_K1_LBSPPA256_LBSPPB512_LPB16_MIWT1_1_PLR1_SU32_SUM0_SUS256_SKXCCM0_VWA1_VWB1_WGM8_WGMXCC1_WGMXCCGn1
    SolutionIndex: 58
    SolutionNameMin: Cijk_Alik_Bjlk_BSS_BH_UserArgs_MT32x32x128_MI16x16x1_SN_LDSB1_CLR1_GSU0_GSUC0_GSUWGMRR0_K1_LBSPPA256_LBSPPB512_LPB16_MIWT1_1_PLR2_SU32_SUM0_SUS256_SKXCCM0_VWA1_VWB1_WGM8_WGMXCC1_WGMXCCGn1
    SolutionIndex: 59
    SolutionNameMin: Cijk_Alik_Bjlk_BSS_BH_UserArgs_MT256x256x32_MI16x16x1_SN_LDSB1_CLR1_GSU0_GSUC0_GSUWGMRR0_K1_LBSPPA256_LBSPPB2048_LPB0_MIWT8_8_PLR1_SU32_SUM0_SUS256_SKXCCM6_VWA4_VWB4_WGM1_WGMXCC1_WGMXCCGn1
    SolutionIndex: 60
    SolutionNameMin: Cijk_Alik_Bjlk_BSS_BH_UserArgs_MT256x256x32_MI16x16x1_SN_LDSB1_CLR1_GSU0_GSUC0_GSUWGMRR0_K1_LBSPPA128_LBSPPB2048_LPB0_MIWT8_8_PLR1_SU32_SUM0_SUS256_SKXCCM6_VWA2_VWB8_WGM1_WGMXCC1_WGMXCCGn1
    SolutionIndex: 61
    SolutionNameMin: Cijk_Alik_Bjlk_BSS_BH_UserArgs_MT256x256x32_MI16x16x1_SN_LDSB1_CLR1_GSU0_GSUC0_GSUWGMRR0_K1_LBSPPA256_LBSPPB2048_LPB0_MIWT8_8_PLR1_SU32_SUM0_SUS256_SKXCCM6_VWA4_VWB8_WGM1_WGMXCC1_WGMXCCGn1
    SolutionIndex: 62
    SolutionNameMin: Cijk_Alik_Bjlk_BSS_BH_UserArgs_MT256x256x32_MI16x16x1_SN_LDSB1_CLR1_GSU0_GSUC0_GSUWGMRR0_K1_LBSPPA256_LBSPPB2048_LPB0_MIWT8_8_PLR1_SU32_SUM0_SUS256_SKXCCM6_VWA4_VWB4_WGM4_WGMXCC1_WGMXCCGn1
    SolutionIndex: 63
    SolutionNameMin: Cijk_Alik_Bjlk_BSS_BH_UserArgs_MT256x256x32_MI16x16x1_SN_LDSB1_CLR1_GSU0_GSUC0_GSUWGMRR0_K1_LBSPPA256_LBSPPB2048_LPB0_MIWT8_8_PLR1_SU32_SUM0_SUS256_SKXCCM6_VWA4_VWB8_WGM4_WGMXCC1_WGMXCCGn1
    SolutionIndex: 64
    SolutionNameMin: Cijk_Alik_Bjlk_BSS_BH_UserArgs_MT256x256x32_MI16x16x1_SN_LDSB1_CLR1_GSU0_GSUC0_GSUWGMRR0_K1_LBSPPA128_LBSPPB2048_LPB32_MIWT8_8_PLR1_SU32_SUM0_SUS256_SKXCCM6_VWA2_VWB2_WGM8_WGMXCC1_WGMXCCGn1
    SolutionIndex: 65
    SolutionNameMin: Cijk_Alik_Bjlk_BSS_BH_UserArgs_MT256x256x32_MI16x16x1_SN_LDSB1_CLR1_GSU0_GSUC0_GSUWGMRR0_K1_LBSPPA256_LBSPPB2048_LPB32_MIWT8_8_PLR1_SU32_SUM0_SUS256_SKXCCM6_VWA4_VWB2_WGM8_WGMXCC1_WGMXCCGn1
    SolutionIndex: 66
    SolutionNameMin: Cijk_Alik_Bjlk_BSS_BH_UserArgs_MT256x256x32_MI16x16x1_SN_LDSB1_CLR1_GSU0_GSUC0_GSUWGMRR0_K1_LBSPPA128_LBSPPB2048_LPB0_MIWT8_8_PLR1_SU32_SUM0_SUS256_SKXCCM6_VWA2_VWB8_WGM8_WGMXCC1_WGMXCCGn1
    SolutionIndex: 67
    SolutionNameMin: Cijk_Alik_Bjlk_BSS_BH_UserArgs_MT256x256x32_MI16x16x1_SN_LDSB1_CLR1_GSU0_GSUC0_GSUWGMRR0_K1_LBSPPA256_LBSPPB2048_LPB0_MIWT8_8_PLR1_SU32_SUM0_SUS256_SKXCCM6_VWA4_VWB8_WGM8_WGMXCC1_WGMXCCGn1
    SolutionIndex: 68
    SolutionNameMin: Cijk_Alik_Bjlk_BSS_BH_UserArgs_MT128x256x32_MI16x16x1_SN_LDSB1_CLR1_GSU0_GSUC0_GSUWGMRR0_K1_LBSPPA256_LBSPPB2048_LPB0_MIWT4_8_PLR1_SU32_SUM0_SUS256_SKXCCM6_VWA4_VWB8_WGM1_WGMXCC1_WGMXCCGn1
    SolutionIndex: 69
    SolutionNameMin: Cijk_Alik_Bjlk_BSS_BH_UserArgs_MT128x256x32_MI16x16x1_SN_LDSB1_CLR1_GSU0_GSUC0_GSUWGMRR0_K1_LBSPPA256_LBSPPB2048_LPB32_MIWT4_8_PLR1_SU32_SUM0_SUS256_SKXCCM6_VWA4_VWB2_WGM4_WGMXCC1_WGMXCCGn1
    SolutionIndex: 70
    SolutionNameMin: Cijk_Alik_Bjlk_BSS_BH_UserArgs_MT128x256x32_MI16x16x1_SN_LDSB1_CLR1_GSU0_GSUC0_GSUWGMRR0_K1_LBSPPA128_LBSPPB2048_LPB0_MIWT4_8_PLR1_SU32_SUM0_SUS256_SKXCCM6_VWA2_VWB4_WGM4_WGMXCC1_WGMXCCGn1
    SolutionIndex: 71
    SolutionNameMin: Cijk_Alik_Bjlk_BSS_BH_UserArgs_MT128x256x32_MI16x16x1_SN_LDSB1_CLR1_GSU0_GSUC0_GSUWGMRR0_K1_LBSPPA256_LBSPPB2048_LPB0_MIWT4_8_PLR1_SU32_SUM0_SUS256_SKXCCM6_VWA4_VWB4_WGM4_WGMXCC1_WGMXCCGn1
    SolutionIndex: 72
    SolutionNameMin: Cijk_Alik_Bjlk_BSS_BH_UserArgs_MT128x256x32_MI16x16x1_SN_LDSB1_CLR1_GSU0_GSUC0_GSUWGMRR0_K1_LBSPPA128_LBSPPB2048_LPB32_MIWT4_8_PLR1_SU32_SUM0_SUS256_SKXCCM6_VWA2_VWB2_WGM8_WGMXCC1_WGMXCCGn1
    SolutionIndex: 73
    SolutionNameMin: Cijk_Alik_Bjlk_BSS_BH_UserArgs_MT128x256x32_MI16x16x1_SN_LDSB1_CLR1_GSU0_GSUC0_GSUWGMRR0_K1_LBSPPA256_LBSPPB2048_LPB0_MIWT4_8_PLR1_SU32_SUM0_SUS256_SKXCCM6_VWA4_VWB4_WGM8_WGMXCC1_WGMXCCGn1
    SolutionIndex: 74
    SolutionNameMin: Cijk_Alik_Bjlk_BSS_BH_UserArgs_MT256x128x32_MI16x16x1_SN_LDSB1_CLR1_GSU0_GSUC0_GSUWGMRR0_K1_LBSPPA256_LBSPPB1024_LPB16_MIWT8_4_PLR1_SU32_SUM0_SUS256_SKXCCM6_VWA4_VWB1_WGM8_WGMXCC1_WGMXCCGn1
    SolutionIndex: 75
    SolutionNameMin: Cijk_Alik_Bjlk_BSS_BH_UserArgs_MT128x128x32_MI16x16x1_SN_LDSB1_CLR1_GSU0_GSUC0_GSUWGMRR0_K1_LBSPPA256_LBSPPB1024_LPB16_MIWT4_4_PLR1_SU32_SUM0_SUS256_SKXCCM6_VWA4_VWB1_WGM1_WGMXCC1_WGMXCCGn1
    SolutionIndex: 76
    SolutionNameMin: Cijk_Alik_Bjlk_BSS_BH_UserArgs_MT128x128x32_MI16x16x1_SN_LDSB1_CLR1_GSU0_GSUC0_GSUWGMRR0_K1_LBSPPA256_LBSPPB1024_LPB32_MIWT4_4_PLR1_SU32_SUM0_SUS256_SKXCCM6_VWA4_VWB2_WGM1_WGMXCC1_WGMXCCGn1
    SolutionIndex: 77
    SolutionNameMin: Cijk_Alik_Bjlk_BSS_BH_UserArgs_MT128x128x32_MI16x16x1_SN_LDSB1_CLR1_GSU0_GSUC0_GSUWGMRR0_K1_LBSPPA256_LBSPPB1024_LPB0_MIWT4_4_PLR1_SU32_SUM0_SUS256_SKXCCM6_VWA4_VWB4_WGM1_WGMXCC1_WGMXCCGn1
    SolutionIndex: 78
    SolutionNameMin: Cijk_Alik_Bjlk_BSS_BH_UserArgs_MT128x128x32_MI16x16x1_SN_LDSB1_CLR1_GSU0_GSUC0_GSUWGMRR0_K1_LBSPPA256_LBSPPB1024_LPB0_MIWT4_4_PLR1_SU32_SUM0_SUS256_SKXCCM6_VWA4_VWB4_WGM8_WGMXCC1_WGMXCCGn1
    SolutionIndex: 79
    SolutionNameMin: Cijk_Alik_Bjlk_BSS_BH_UserArgs_MT128x256x64_MI16x16x1_SN_LDSB1_CLR1_GSU0_GSUC0_GSUWGMRR0_K1_LBSPPA512_LBSPPB4096_LPB32_MIWT4_8_PLR1_SU32_SUM0_SUS256_SKXCCM6_VWA4_VWB2_WGM1_WGMXCC1_WGMXCCGn1
    SolutionIndex: 80
    SolutionNameMin: Cijk_Alik_Bjlk_BSS_BH_UserArgs_MT128x256x64_MI16x16x1_SN_LDSB1_CLR1_GSU0_GSUC0_GSUWGMRR0_K1_LBSPPA128_LBSPPB4096_LPB0_MIWT4_8_PLR1_SU32_SUM0_SUS256_SKXCCM6_VWA1_VWB4_WGM1_WGMXCC1_WGMXCCGn1
    SolutionIndex: 81
    SolutionNameMin: Cijk_Alik_Bjlk_BSS_BH_UserArgs_MT128x256x64_MI16x16x1_SN_LDSB1_CLR1_GSU0_GSUC0_GSUWGMRR0_K1_LBSPPA256_LBSPPB4096_LPB0_MIWT4_8_PLR1_SU32_SUM0_SUS256_SKXCCM6_VWA2_VWB4_WGM1_WGMXCC1_WGMXCCGn1
    SolutionIndex: 82
    SolutionNameMin: Cijk_Alik_Bjlk_BSS_BH_UserArgs_MT128x256x64_MI16x16x1_SN_LDSB1_CLR1_GSU0_GSUC0_GSUWGMRR0_K1_LBSPPA512_LBSPPB4096_LPB0_MIWT4_8_PLR1_SU32_SUM0_SUS256_SKXCCM6_VWA4_VWB4_WGM1_WGMXCC1_WGMXCCGn1
    SolutionIndex: 83
    SolutionNameMin: Cijk_Alik_Bjlk_BSS_BH_UserArgs_MT128x256x64_MI16x16x1_SN_LDSB1_CLR1_GSU0_GSUC0_GSUWGMRR0_K1_LBSPPA512_LBSPPB4096_LPB0_MIWT4_8_PLR1_SU32_SUM0_SUS256_SKXCCM6_VWA4_VWB8_WGM1_WGMXCC1_WGMXCCGn1
    SolutionIndex: 84
    SolutionNameMin: Cijk_Alik_Bjlk_BSS_BH_UserArgs_MT128x256x64_MI16x16x1_SN_LDSB1_CLR1_GSU0_GSUC0_GSUWGMRR0_K1_LBSPPA512_LBSPPB4096_LPB0_MIWT4_8_PLR1_SU32_SUM0_SUS256_SKXCCM6_VWA4_VWB8_WGM4_WGMXCC1_WGMXCCGn1
    SolutionIndex: 85
    SolutionNameMin: Cijk_Alik_Bjlk_BSS_BH_UserArgs_MT128x256x64_MI16x16x1_SN_LDSB1_CLR1_GSU0_GSUC0_GSUWGMRR0_K1_LBSPPA128_LBSPPB4096_LPB32_MIWT4_8_PLR1_SU32_SUM0_SUS256_SKXCCM6_VWA1_VWB2_WGM8_WGMXCC1_WGMXCCGn1
    SolutionIndex: 86
    SolutionNameMin: Cijk_Alik_Bjlk_BSS_BH_UserArgs_MT128x256x64_MI16x16x1_SN_LDSB1_CLR1_GSU0_GSUC0_GSUWGMRR0_K1_LBSPPA256_LBSPPB4096_LPB32_MIWT4_8_PLR1_SU32_SUM0_SUS256_SKXCCM6_VWA2_VWB2_WGM8_WGMXCC1_WGMXCCGn1
    SolutionIndex: 87
    SolutionNameMin: Cijk_Alik_Bjlk_BSS_BH_UserArgs_MT128x256x64_MI16x16x1_SN_LDSB1_CLR1_GSU0_GSUC0_GSUWGMRR0_K1_LBSPPA512_LBSPPB4096_LPB32_MIWT4_8_PLR1_SU32_SUM0_SUS256_SKXCCM6_VWA4_VWB2_WGM8_WGMXCC1_WGMXCCGn1
    SolutionIndex: 88
    SolutionNameMin: Cijk_Alik_Bjlk_BSS_BH_UserArgs_MT256x128x64_MI16x16x1_SN_LDSB1_CLR1_GSU0_GSUC0_GSUWGMRR0_K1_LBSPPA128_LBSPPB2048_LPB0_MIWT8_4_PLR1_SU32_SUM0_SUS256_SKXCCM6_VWA1_VWB4_WGM4_WGMXCC1_WGMXCCGn1
    SolutionIndex: 89
    SolutionNameMin: Cijk_Alik_Bjlk_BSS_BH_UserArgs_MT256x128x64_MI16x16x1_SN_LDSB1_CLR1_GSU0_GSUC0_GSUWGMRR0_K1_LBSPPA512_LBSPPB2048_LPB0_MIWT8_4_PLR1_SU32_SUM0_SUS256_SKXCCM6_VWA4_VWB4_WGM4_WGMXCC1_WGMXCCGn1
    SolutionIndex: 90
    SolutionNameMin: Cijk_Alik_Bjlk_BSS_BH_UserArgs_MT256x128x64_MI16x16x1_SN_LDSB1_CLR1_GSU0_GSUC0_GSUWGMRR0_K1_LBSPPA128_LBSPPB2048_LPB32_MIWT8_4_PLR1_SU32_SUM0_SUS256_SKXCCM6_VWA1_VWB2_WGM8_WGMXCC1_WGMXCCGn1
    SolutionIndex: 91
    SolutionNameMin: Cijk_Alik_Bjlk_BSS_BH_UserArgs_MT64x256x64_MI16x16x1_SN_LDSB1_CLR1_GSU0_GSUC0_GSUWGMRR0_K1_LBSPPA128_LBSPPB4096_LPB0_MIWT2_8_PLR1_SU32_SUM0_SUS256_SKXCCM6_VWA1_VWB4_WGM1_WGMXCC1_WGMXCCGn1
    SolutionIndex: 92
    SolutionNameMin: Cijk_Alik_Bjlk_BSS_BH_UserArgs_MT64x256x64_MI16x16x1_SN_LDSB1_CLR1_GSU0_GSUC0_GSUWGMRR0_K1_LBSPPA256_LBSPPB4096_LPB0_MIWT2_8_PLR1_SU32_SUM0_SUS256_SKXCCM6_VWA2_VWB8_WGM1_WGMXCC1_WGMXCCGn1
    SolutionIndex: 93
    SolutionNameMin: Cijk_Alik_Bjlk_BSS_BH_UserArgs_MT128x128x64_MI16x16x1_SN_LDSB1_CLR1_GSU0_GSUC0_GSUWGMRR0_K1_LBSPPA512_LBSPPB2048_LPB16_MIWT4_4_PLR1_SU32_SUM0_SUS256_SKXCCM6_VWA4_VWB1_WGM1_WGMXCC1_WGMXCCGn1
    SolutionIndex: 94
    SolutionNameMin: Cijk_Alik_Bjlk_BSS_BH_UserArgs_MT128x128x64_MI16x16x1_SN_LDSB1_CLR1_GSU0_GSUC0_GSUWGMRR0_K1_LBSPPA512_LBSPPB2048_LPB32_MIWT4_4_PLR1_SU32_SUM0_SUS256_SKXCCM6_VWA4_VWB2_WGM1_WGMXCC1_WGMXCCGn1
    SolutionIndex: 95
    SolutionNameMin: Cijk_Alik_Bjlk_BSS_BH_UserArgs_MT128x128x64_MI16x16x1_SN_LDSB1_CLR1_GSU0_GSUC0_GSUWGMRR0_K1_LBSPPA128_LBSPPB2048_LPB0_MIWT4_4_PLR1_SU32_SUM0_SUS256_SKXCCM6_VWA1_VWB4_WGM1_WGMXCC1_WGMXCCGn1
    SolutionIndex: 96
    SolutionNameMin: Cijk_Alik_Bjlk_BSS_BH_UserArgs_MT128x128x64_MI16x16x1_SN_LDSB1_CLR1_GSU0_GSUC0_GSUWGMRR0_K1_LBSPPA256_LBSPPB2048_LPB0_MIWT4_4_PLR1_SU32_SUM0_SUS256_SKXCCM6_VWA2_VWB4_WGM1_WGMXCC1_WGMXCCGn1
    SolutionIndex: 97
    SolutionNameMin: Cijk_Alik_Bjlk_BSS_BH_UserArgs_MT128x128x64_MI16x16x1_SN_LDSB1_CLR1_GSU0_GSUC0_GSUWGMRR0_K1_LBSPPA512_LBSPPB2048_LPB0_MIWT4_4_PLR1_SU32_SUM0_SUS256_SKXCCM6_VWA4_VWB4_WGM1_WGMXCC1_WGMXCCGn1
    SolutionIndex: 98
    SolutionNameMin: Cijk_Alik_Bjlk_BSS_BH_UserArgs_MT128x128x64_MI16x16x1_SN_LDSB1_CLR1_GSU0_GSUC0_GSUWGMRR0_K1_LBSPPA128_LBSPPB2048_LPB0_MIWT4_4_PLR1_SU32_SUM0_SUS256_SKXCCM6_VWA1_VWB4_WGM4_WGMXCC1_WGMXCCGn1
    SolutionIndex: 99
    SolutionNameMin: Cijk_Alik_Bjlk_BSS_BH_UserArgs_MT128x128x64_MI16x16x1_SN_LDSB1_CLR1_GSU0_GSUC0_GSUWGMRR0_K1_LBSPPA512_LBSPPB2048_LPB0_MIWT4_4_PLR1_SU32_SUM0_SUS256_SKXCCM6_VWA4_VWB4_WGM4_WGMXCC1_WGMXCCGn1
    SolutionIndex: 100
    SolutionNameMin: Cijk_Alik_Bjlk_BSS_BH_UserArgs_MT128x128x64_MI16x16x1_SN_LDSB1_CLR1_GSU0_GSUC0_GSUWGMRR0_K1_LBSPPA128_LBSPPB2048_LPB32_MIWT4_4_PLR1_SU32_SUM0_SUS256_SKXCCM6_VWA1_VWB2_WGM8_WGMXCC1_WGMXCCGn1
    SolutionIndex: 101
    SolutionNameMin: Cijk_Alik_Bjlk_BSS_BH_UserArgs_MT128x128x64_MI16x16x1_SN_LDSB1_CLR1_GSU0_GSUC0_GSUWGMRR0_K1_LBSPPA512_LBSPPB2048_LPB32_MIWT4_4_PLR1_SU32_SUM0_SUS256_SKXCCM6_VWA4_VWB2_WGM8_WGMXCC1_WGMXCCGn1
    SolutionIndex: 102
    SolutionNameMin: Cijk_Alik_Bjlk_BSS_BH_UserArgs_MT128x128x64_MI16x16x1_SN_LDSB1_CLR1_GSU0_GSUC0_GSUWGMRR0_K1_LBSPPA128_LBSPPB2048_LPB0_MIWT4_4_PLR1_SU32_SUM0_SUS256_SKXCCM6_VWA1_VWB4_WGM8_WGMXCC1_WGMXCCGn1
    SolutionIndex: 103
    SolutionNameMin: Cijk_Alik_Bjlk_BSS_BH_UserArgs_MT128x128x64_MI16x16x1_SN_LDSB1_CLR1_GSU0_GSUC0_GSUWGMRR0_K1_LBSPPA256_LBSPPB2048_LPB0_MIWT4_4_PLR1_SU32_SUM0_SUS256_SKXCCM6_VWA2_VWB4_WGM8_WGMXCC1_WGMXCCGn1
    SolutionIndex: 104
    SolutionNameMin: Cijk_Alik_Bjlk_BSS_BH_UserArgs_MT128x128x64_MI16x16x1_SN_LDSB1_CLR1_GSU0_GSUC0_GSUWGMRR0_K1_LBSPPA512_LBSPPB2048_LPB0_MIWT4_4_PLR1_SU32_SUM0_SUS256_SKXCCM6_VWA4_VWB4_WGM8_WGMXCC1_WGMXCCGn1
    SolutionIndex: 105
    SolutionNameMin: Cijk_Alik_Bjlk_BSS_BH_UserArgs_MT128x128x64_MI16x16x1_SN_LDSB1_CLR1_GSU0_GSUC0_GSUWGMRR0_K1_LBSPPA512_LBSPPB2048_LPB0_MIWT4_4_PLR2_SU32_SUM0_SUS256_SKXCCM6_VWA4_VWB4_WGM8_WGMXCC1_WGMXCCGn1
    SolutionIndex: 106
    SolutionNameMin: Cijk_Alik_Bjlk_BSS_BH_UserArgs_MT64x128x64_MI16x16x1_SN_LDSB1_CLR1_GSU0_GSUC0_GSUWGMRR0_K1_LBSPPA128_LBSPPB2048_LPB0_MIWT2_4_PLR1_SU32_SUM0_SUS256_SKXCCM6_VWA1_VWB4_WGM1_WGMXCC1_WGMXCCGn1
    SolutionIndex: 107
    SolutionNameMin: Cijk_Alik_Bjlk_BSS_BH_UserArgs_MT128x64x64_MI16x16x1_SN_LDSB1_CLR1_GSU0_GSUC0_GSUWGMRR0_K1_LBSPPA512_LBSPPB1024_LPB32_MIWT4_2_PLR1_SU32_SUM0_SUS256_SKXCCM6_VWA4_VWB2_WGM1_WGMXCC1_WGMXCCGn1
    SolutionIndex: 108
    SolutionNameMin: Cijk_Alik_Bjlk_BSS_BH_UserArgs_MT128x64x64_MI16x16x1_SN_LDSB1_CLR1_GSU0_GSUC0_GSUWGMRR0_K1_LBSPPA512_LBSPPB1024_LPB32_MIWT4_2_PLR1_SU32_SUM0_SUS256_SKXCCM6_VWA4_VWB2_WGM8_WGMXCC1_WGMXCCGn1
    SolutionIndex: 109
    SolutionNameMin: Cijk_Alik_Bjlk_BSS_BH_UserArgs_MT64x64x64_MI16x16x1_SN_LDSB1_CLR1_GSU0_GSUC0_GSUWGMRR0_K1_LBSPPA128_LBSPPB1024_LPB32_MIWT2_2_PLR1_SU32_SUM0_SUS256_SKXCCM6_VWA1_VWB2_WGM1_WGMXCC1_WGMXCCGn1
    SolutionIndex: 110
    SolutionNameMin: Cijk_Alik_Bjlk_BSS_BH_UserArgs_MT32x64x64_MI16x16x1_SN_LDSB0_CLR1_GSU0_GSUC0_GSUWGMRR0_K1_LBSPPA128_LBSPPB1024_LPB32_MIWT1_2_PLR1_SU32_SUM0_SUS256_SKXCCM6_VWA1_VWB2_WGM1_WGMXCC1_WGMXCCGn1
    SolutionIndex: 111
    SolutionNameMin: Cijk_Alik_Bjlk_BSS_BH_UserArgs_MT64x32x64_MI16x16x1_SN_LDSB0_CLR1_GSU0_GSUC0_GSUWGMRR0_K1_LBSPPA128_LBSPPB512_LPB16_MIWT2_1_PLR1_SU32_SUM0_SUS256_SKXCCM6_VWA1_VWB1_WGM1_WGMXCC1_WGMXCCGn1
    SolutionIndex: 112
    SolutionNameMin: Cijk_Alik_Bjlk_BSS_BH_UserArgs_MT32x32x64_MI16x16x1_SN_LDSB0_CLR1_GSU0_GSUC0_GSUWGMRR0_K1_LBSPPA128_LBSPPB512_LPB16_MIWT1_1_PLR1_SU32_SUM0_SUS256_SKXCCM6_VWA1_VWB1_WGM1_WGMXCC1_WGMXCCGn1
    SolutionIndex: 113
    SolutionNameMin: Cijk_Alik_Bjlk_BSS_BH_UserArgs_MT64x128x128_MI16x16x1_SN_LDSB1_CLR1_GSU0_GSUC0_GSUWGMRR0_K1_LBSPPA256_LBSPPB2048_LPB0_MIWT2_4_PLR1_SU32_SUM0_SUS256_SKXCCM6_VWA1_VWB4_WGM1_WGMXCC1_WGMXCCGn1
    SolutionIndex: 114
    SolutionNameMin: Cijk_Alik_Bjlk_BSS_BH_UserArgs_MT64x128x128_MI16x16x1_SN_LDSB1_CLR1_GSU0_GSUC0_GSUWGMRR0_K1_LBSPPA256_LBSPPB2048_LPB0_MIWT2_4_PLR2_SU32_SUM0_SUS256_SKXCCM6_VWA1_VWB4_WGM1_WGMXCC1_WGMXCCGn1
    SolutionIndex: 115
    SolutionNameMin: Cijk_Alik_Bjlk_BSS_BH_UserArgs_MT64x128x128_MI16x16x1_SN_LDSB1_CLR1_GSU0_GSUC0_GSUWGMRR0_K1_LBSPPA256_LBSPPB2048_LPB0_MIWT2_4_PLR1_SU32_SUM0_SUS256_SKXCCM6_VWA1_VWB4_WGM4_WGMXCC1_WGMXCCGn1
    SolutionIndex: 116
    SolutionNameMin: Cijk_Alik_Bjlk_BSS_BH_UserArgs_MT64x128x128_MI16x16x1_SN_LDSB1_CLR1_GSU0_GSUC0_GSUWGMRR0_K1_LBSPPA256_LBSPPB2048_LPB0_MIWT2_4_PLR2_SU32_SUM0_SUS256_SKXCCM6_VWA1_VWB4_WGM4_WGMXCC1_WGMXCCGn1
    SolutionIndex: 117
    SolutionNameMin: Cijk_Alik_Bjlk_BSS_BH_UserArgs_MT64x128x128_MI16x16x1_SN_LDSB1_CLR1_GSU0_GSUC0_GSUWGMRR0_K1_LBSPPA256_LBSPPB2048_LPB0_MIWT2_4_PLR2_SU32_SUM0_SUS256_SKXCCM6_VWA1_VWB4_WGM8_WGMXCC1_WGMXCCGn1
    SolutionIndex: 118
    SolutionNameMin: Cijk_Alik_Bjlk_BSS_BH_UserArgs_MT128x64x128_MI16x16x1_SN_LDSB1_CLR1_GSU0_GSUC0_GSUWGMRR0_K1_LBSPPA1024_LBSPPB1024_LPB32_MIWT4_2_PLR1_SU32_SUM0_SUS256_SKXCCM6_VWA4_VWB2_WGM1_WGMXCC1_WGMXCCGn1
    SolutionIndex: 119
    SolutionNameMin: Cijk_Alik_Bjlk_BSS_BH_UserArgs_MT128x64x128_MI16x16x1_SN_LDSB1_CLR1_GSU0_GSUC0_GSUWGMRR0_K1_LBSPPA256_LBSPPB1024_LPB32_MIWT4_2_PLR2_SU32_SUM0_SUS256_SKXCCM6_VWA1_VWB2_WGM1_WGMXCC1_WGMXCCGn1
    SolutionIndex: 120
    SolutionNameMin: Cijk_Alik_Bjlk_BSS_BH_UserArgs_MT128x64x128_MI16x16x1_SN_LDSB1_CLR1_GSU0_GSUC0_GSUWGMRR0_K1_LBSPPA1024_LBSPPB1024_LPB32_MIWT4_2_PLR2_SU32_SUM0_SUS256_SKXCCM6_VWA4_VWB2_WGM1_WGMXCC1_WGMXCCGn1
    SolutionIndex: 121
    SolutionNameMin: Cijk_Alik_Bjlk_BSS_BH_UserArgs_MT128x64x128_MI16x16x1_SN_LDSB1_CLR1_GSU0_GSUC0_GSUWGMRR0_K1_LBSPPA256_LBSPPB1024_LPB32_MIWT4_2_PLR1_SU32_SUM0_SUS256_SKXCCM6_VWA1_VWB2_WGM4_WGMXCC1_WGMXCCGn1
    SolutionIndex: 122
    SolutionNameMin: Cijk_Alik_Bjlk_BSS_BH_UserArgs_MT128x64x128_MI16x16x1_SN_LDSB1_CLR1_GSU0_GSUC0_GSUWGMRR0_K1_LBSPPA1024_LBSPPB1024_LPB32_MIWT4_2_PLR2_SU32_SUM0_SUS256_SKXCCM6_VWA4_VWB2_WGM4_WGMXCC1_WGMXCCGn1
    SolutionIndex: 123
    SolutionNameMin: Cijk_Alik_Bjlk_BSS_BH_UserArgs_MT128x64x128_MI16x16x1_SN_LDSB1_CLR1_GSU0_GSUC0_GSUWGMRR0_K1_LBSPPA256_LBSPPB1024_LPB32_MIWT4_2_PLR1_SU32_SUM0_SUS256_SKXCCM6_VWA1_VWB2_WGM8_WGMXCC1_WGMXCCGn1
    SolutionIndex: 124
    SolutionNameMin: Cijk_Alik_Bjlk_BSS_BH_UserArgs_MT128x64x128_MI16x16x1_SN_LDSB1_CLR1_GSU0_GSUC0_GSUWGMRR0_K1_LBSPPA1024_LBSPPB1024_LPB32_MIWT4_2_PLR1_SU32_SUM0_SUS256_SKXCCM6_VWA4_VWB2_WGM8_WGMXCC1_WGMXCCGn1
    SolutionIndex: 125
    SolutionNameMin: Cijk_Alik_Bjlk_BSS_BH_UserArgs_MT128x64x128_MI16x16x1_SN_LDSB1_CLR1_GSU0_GSUC0_GSUWGMRR0_K1_LBSPPA512_LBSPPB1024_LPB32_MIWT4_2_PLR2_SU32_SUM0_SUS256_SKXCCM6_VWA2_VWB2_WGM8_WGMXCC1_WGMXCCGn1
    SolutionIndex: 126
    SolutionNameMin: Cijk_Alik_Bjlk_BSS_BH_UserArgs_MT128x64x128_MI16x16x1_SN_LDSB1_CLR1_GSU0_GSUC0_GSUWGMRR0_K1_LBSPPA1024_LBSPPB1024_LPB32_MIWT4_2_PLR2_SU32_SUM0_SUS256_SKXCCM6_VWA4_VWB2_WGM8_WGMXCC1_WGMXCCGn1
    SolutionIndex: 127
    SolutionNameMin: Cijk_Alik_Bjlk_BSS_BH_UserArgs_MT64x64x128_MI16x16x1_SN_LDSB1_CLR1_GSU0_GSUC0_GSUWGMRR0_K1_LBSPPA256_LBSPPB1024_LPB32_MIWT2_2_PLR2_SU32_SUM0_SUS256_SKXCCM6_VWA1_VWB2_WGM1_WGMXCC1_WGMXCCGn1
    SolutionIndex: 128
    SolutionNameMin: Cijk_Alik_Bjlk_BSS_BH_UserArgs_MT64x64x128_MI16x16x1_SN_LDSB1_CLR1_GSU0_GSUC0_GSUWGMRR0_K1_LBSPPA512_LBSPPB1024_LPB32_MIWT2_2_PLR2_SU32_SUM0_SUS256_SKXCCM6_VWA2_VWB2_WGM1_WGMXCC1_WGMXCCGn1
    SolutionIndex: 129
    SolutionNameMin: Cijk_Alik_Bjlk_BSS_BH_UserArgs_MT64x64x128_MI16x16x1_SN_LDSB1_CLR1_GSU0_GSUC0_GSUWGMRR0_K1_LBSPPA256_LBSPPB1024_LPB32_MIWT2_2_PLR2_SU32_SUM0_SUS256_SKXCCM6_VWA1_VWB2_WGM4_WGMXCC1_WGMXCCGn1
    SolutionIndex: 130
    SolutionNameMin: Cijk_Alik_Bjlk_BSS_BH_UserArgs_MT64x64x128_MI16x16x1_SN_LDSB1_CLR1_GSU0_GSUC0_GSUWGMRR0_K1_LBSPPA256_LBSPPB1024_LPB32_MIWT2_2_PLR2_SU32_SUM0_SUS256_SKXCCM6_VWA1_VWB2_WGM8_WGMXCC1_WGMXCCGn1
    SolutionIndex: 131
    SolutionNameMin: Cijk_Alik_Bjlk_BSS_BH_UserArgs_MT32x64x128_MI16x16x1_SN_LDSB1_CLR1_GSU0_GSUC0_GSUWGMRR0_K1_LBSPPA256_LBSPPB1024_LPB32_MIWT1_2_PLR2_SU32_SUM0_SUS256_SKXCCM6_VWA1_VWB2_WGM1_WGMXCC1_WGMXCCGn1
    SolutionIndex: 132
    SolutionNameMin: Cijk_Alik_Bjlk_BSS_BH_UserArgs_MT32x64x128_MI16x16x1_SN_LDSB1_CLR1_GSU0_GSUC0_GSUWGMRR0_K1_LBSPPA256_LBSPPB1024_LPB32_MIWT1_2_PLR2_SU32_SUM0_SUS256_SKXCCM6_VWA1_VWB2_WGM4_WGMXCC1_WGMXCCGn1
    SolutionIndex: 133
    SolutionNameMin: Cijk_Alik_Bjlk_BSS_BH_UserArgs_MT32x32x128_MI16x16x1_SN_LDSB1_CLR1_GSU0_GSUC0_GSUWGMRR0_K1_LBSPPA256_LBSPPB512_LPB16_MIWT1_1_PLR2_SU32_SUM0_SUS256_SKXCCM6_VWA1_VWB1_WGM1_WGMXCC1_WGMXCCGn1
    SolutionIndex: 134
    SolutionNameMin: Cijk_Alik_Bjlk_BSS_BH_UserArgs_MT32x32x32_MI16x16x1_SN_LDSB0_CLR1_GSU0_GSUC0_GSUWGMRR0_K1_LBSPPA128_LBSPPB256_LPB16_MIWT1_1_PLR1_SU32_SUM0_SUS256_SKXCCM6_VWA1_VWB1_WGM4_WGMXCC1_WGMXCCGn1
- - - [128, 128, 1, 128, 128, 128, 128, 128]
    - [46, 0.081]
  - - [128, 128, 1, 256, 128, 128, 256, 128]
    - [46, 0.146]
  - - [128, 128, 1, 512, 128, 128, 512, 128]
    - [57, 0.25]
  - - [128, 128, 1, 1024, 128, 128, 1024, 128]
    - [58, 0.384]
  - - [128, 128, 1, 2048, 128, 128, 2048, 128]
    - [55, 0.592]
  - - [128, 128, 1, 4096, 128, 128, 4096, 128]
    - [112, 1.021]
  - - [128, 128, 1, 8192, 128, 128, 8192, 128]
    - [56, 1.575]
  - - [128, 256, 1, 128, 128, 128, 128, 256]
    - [45, 0.168]
  - - [128, 256, 1, 256, 128, 128, 256, 256]
    - [45, 0.307]
  - - [128, 256, 1, 512, 128, 128, 512, 256]
    - [45, 0.51]
  - - [128, 256, 1, 1024, 128, 128, 1024, 256]
    - [55, 0.783]
  - - [128, 256, 1, 2048, 128, 128, 2048, 256]
    - [56, 1.164]
  - - [128, 256, 1, 4096, 128, 128, 4096, 256]
    - [112, 1.991]
  - - [128, 256, 1, 8192, 128, 128, 8192, 256]
    - [56, 3.087]
  - - [128, 512, 1, 128, 128, 128, 128, 512]
    - [45, 0.331]
  - - [128, 512, 1, 256, 128, 128, 256, 512]
    - [45, 0.597]
  - - [128, 512, 1, 512, 128, 128, 512, 512]
    - [55, 1.007]
  - - [128, 512, 1, 1024, 128, 128, 1024, 512]
    - [56, 1.536]
  - - [128, 512, 1, 2048, 128, 128, 2048, 512]
    - [56, 2.277]
  - - [128, 512, 1, 4096, 128, 128, 4096, 512]
    - [56, 3.416]
  - - [128, 512, 1, 8192, 128, 128, 8192, 512]
    - [131, 5.073]
  - - [128, 1024, 1, 128, 128, 128, 128, 1024]
    - [45, 0.645]
  - - [128, 1024, 1, 256, 128, 128, 256, 1024]
    - [45, 1.164]
  - - [128, 1024, 1, 512, 128, 128, 512, 1024]
    - [55, 1.941]
  - - [128, 1024, 1, 1024, 128, 128, 1024, 1024]
    - [55, 3.019]
  - - [128, 1024, 1, 2048, 128, 128, 2048, 1024]
    - [53, 3.97]
  - - [128, 1024, 1, 4096, 128, 128, 4096, 1024]
    - [54, 5.619]
  - - [128, 1024, 1, 8192, 128, 128, 8192, 1024]
    - [127, 8.603]
  - - [128, 2048, 1, 128, 128, 128, 128, 2048]
    - [43, 1.174]
  - - [128, 2048, 1, 256, 128, 128, 256, 2048]
    - [53, 2.05]
  - - [128, 2048, 1, 512, 128, 128, 512, 2048]
    - [53, 3.474]
  - - [128, 2048, 1, 1024, 128, 128, 1024, 2048]
    - [131, 5.183]
  - - [128, 2048, 1, 2048, 128, 128, 2048, 2048]
    - [50, 6.444]
  - - [128, 2048, 1, 4096, 128, 128, 4096, 2048]
    - [127, 9.226]
  - - [128, 2048, 1, 8192, 128, 128, 8192, 2048]
    - [120, 13.087]
  - - [128, 4096, 1, 128, 128, 128, 128, 4096]
    - [18, 2.011]
  - - [128, 4096, 1, 256, 128, 128, 256, 4096]
    - [42, 3.514]
  - - [128, 4096, 1, 512, 128, 128, 512, 4096]
    - [50, 5.826]
  - - [128, 4096, 1, 1024, 128, 128, 1024, 4096]
    - [127, 8.448]
  - - [128, 4096, 1, 2048, 128, 128, 2048, 4096]
    - [127, 10.198]
  - - [128, 4096, 1, 4096, 128, 128, 4096, 4096]
    - [120, 13.489]
  - - [128, 4096, 1, 8192, 128, 128, 8192, 4096]
    - [120, 16.498]
  - - [128, 8192, 1, 128, 128, 128, 128, 8192]
    - [36, 3.159]
  - - [128, 8192, 1, 256, 128, 128, 256, 8192]
    - [39, 5.425]
  - - [128, 8192, 1, 512, 128, 128, 512, 8192]
    - [48, 8.777]
  - - [128, 8192, 1, 1024, 128, 128, 1024, 8192]
    - [48, 12.477]
  - - [128, 8192, 1, 2048, 128, 128, 2048, 8192]
    - [41, 13.987]
  - - [128, 8192, 1, 4096, 128, 128, 4096, 8192]
    - [40, 17.368]
  - - [128, 8192, 1, 8192, 128, 128, 8192, 8192]
    - [118, 19.729]
  - - [256, 128, 1, 128, 256, 256, 128, 128]
    - [45, 0.164]
  - - [256, 128, 1, 256, 256, 256, 256, 128]
    - [45, 0.302]
  - - [256, 128, 1, 512, 256, 256, 512, 128]
    - [55, 0.515]
  - - [256, 128, 1, 1024, 256, 256, 1024, 128]
    - [55, 0.778]
  - - [256, 128, 1, 2048, 256, 256, 2048, 128]
    - [56, 1.163]
  - - [256, 128, 1, 4096, 256, 256, 4096, 128]
    - [112, 2.014]
  - - [256, 128, 1, 8192, 256, 256, 8192, 128]
    - [56, 3.085]
  - - [256, 256, 1, 128, 256, 256, 128, 256]
    - [45, 0.331]
  - - [256, 256, 1, 256, 256, 256, 256, 256]
    - [45, 0.597]
  - - [256, 256, 1, 512, 256, 256, 512, 256]
    - [55, 1.013]
  - - [256, 256, 1, 1024, 256, 256, 1024, 256]
    - [56, 1.522]
  - - [256, 256, 1, 2048, 256, 256, 2048, 256]
    - [56, 2.262]
  - - [256, 256, 1, 4096, 256, 256, 4096, 256]
    - [110, 3.454]
  - - [256, 256, 1, 8192, 256, 256, 8192, 256]
    - [53, 5.408]
  - - [256, 512, 1, 128, 256, 256, 128, 512]
    - [45, 0.638]
  - - [256, 512, 1, 256, 256, 256, 256, 512]
    - [45, 1.156]
  - - [256, 512, 1, 512, 256, 256, 512, 512]
    - [55, 1.984]
  - - [256, 512, 1, 1024, 256, 256, 1024, 512]
    - [133, 2.977]
  - - [256, 512, 1, 2048, 256, 256, 2048, 512]
    - [131, 4.016]
  - - [256, 512, 1, 4096, 256, 256, 4096, 512]
    - [54, 5.688]
  - - [256, 512, 1, 8192, 256, 256, 8192, 512]
    - [129, 8.48]
  - - [256, 1024, 1, 128, 256, 256, 128, 1024]
    - [43, 1.172]
  - - [256, 1024, 1, 256, 256, 256, 256, 1024]
    - [43, 2.061]
  - - [256, 1024, 1, 512, 256, 256, 512, 1024]
    - [53, 3.492]
  - - [256, 1024, 1, 1024, 256, 256, 1024, 1024]
    - [53, 5.226]
  - - [256, 1024, 1, 2048, 256, 256, 2048, 1024]
    - [127, 6.567]
  - - [256, 1024, 1, 4096, 256, 256, 4096, 1024]
    - [127, 9.471]
  - - [256, 1024, 1, 8192, 256, 256, 8192, 1024]
    - [120, 12.746]
  - - [256, 2048, 1, 128, 256, 256, 128, 2048]
    - [19, 1.971]
  - - [256, 2048, 1, 256, 256, 256, 256, 2048]
    - [50, 3.44]
  - - [256, 2048, 1, 512, 256, 256, 512, 2048]
    - [50, 5.694]
  - - [256, 2048, 1, 1024, 256, 256, 1024, 2048]
    - [51, 8.499]
  - - [256, 2048, 1, 2048, 256, 256, 2048, 2048]
    - [127, 10.11]
  - - [256, 2048, 1, 4096, 256, 256, 4096, 2048]
    - [120, 13.775]
  - - [256, 2048, 1, 8192, 256, 256, 8192, 2048]
    - [97, 15.553]
  - - [256, 4096, 1, 128, 256, 256, 128, 4096]
    - [39, 3.139]
  - - [256, 4096, 1, 256, 256, 256, 256, 4096]
    - [38, 5.362]
  - - [256, 4096, 1, 512, 256, 256, 512, 4096]
    - [114, 8.637]
  - - [256, 4096, 1, 1024, 256, 256, 1024, 4096]
    - [114, 12.791]
  - - [256, 4096, 1, 2048, 256, 256, 2048, 4096]
    - [120, 14.346]
  - - [256, 4096, 1, 4096, 256, 256, 4096, 4096]
    - [121, 17.146]
  - - [256, 4096, 1, 8192, 256, 256, 8192, 4096]
    - [31, 19.44]
  - - [256, 8192, 1, 128, 256, 256, 128, 8192]
    - [12, 4.484]
  - - [256, 8192, 1, 256, 256, 256, 256, 8192]
    - [97, 7.746]
  - - [256, 8192, 1, 512, 256, 256, 512, 8192]
    - [97, 12.112]
  - - [256, 8192, 1, 1024, 256, 256, 1024, 8192]
    - [118, 13.405]
  - - [256, 8192, 1, 2048, 256, 256, 2048, 8192]
    - [123, 17.476]
  - - [256, 8192, 1, 4096, 256, 256, 4096, 8192]
    - [99, 20.937]
  - - [256, 8192, 1, 8192, 256, 256, 8192, 8192]
    - [27, 23.913]
  - - [512, 128, 1, 128, 512, 512, 128, 128]
    - [55, 0.329]
  - - [512, 128, 1, 256, 512, 512, 256, 128]
    - [45, 0.601]
  - - [512, 128, 1, 512, 512, 512, 512, 128]
    - [55, 1.014]
  - - [512, 128, 1, 1024, 512, 512, 1024, 128]
    - [56, 1.547]
  - - [512, 128, 1, 2048, 512, 512, 2048, 128]
    - [56, 2.247]
  - - [512, 128, 1, 4096, 512, 512, 4096, 128]
    - [111, 3.458]
  - - [512, 128, 1, 8192, 512, 512, 8192, 128]
    - [131, 5.387]
  - - [512, 256, 1, 128, 512, 512, 128, 256]
    - [45, 0.631]
  - - [512, 256, 1, 256, 512, 512, 256, 256]
    - [45, 1.162]
  - - [512, 256, 1, 512, 512, 512, 512, 256]
    - [55, 1.96]
  - - [512, 256, 1, 1024, 512, 512, 1024, 256]
    - [55, 3.003]
  - - [512, 256, 1, 2048, 512, 512, 2048, 256]
    - [131, 4.013]
  - - [512, 256, 1, 4096, 512, 512, 4096, 256]
    - [132, 5.823]
  - - [512, 256, 1, 8192, 512, 512, 8192, 256]
    - [130, 8.524]
  - - [512, 512, 1, 128, 512, 512, 128, 512]
    - [43, 1.17]
  - - [512, 512, 1, 256, 512, 512, 256, 512]
    - [43, 2.077]
  - - [512, 512, 1, 512, 512, 512, 512, 512]
    - [53, 3.509]
  - - [512, 512, 1, 1024, 512, 512, 1024, 512]
    - [53, 5.255]
  - - [512, 512, 1, 2048, 512, 512, 2048, 512]
    - [127, 6.618]
  - - [512, 512, 1, 4096, 512, 512, 4096, 512]
    - [51, 9.195]
  - - [512, 512, 1, 8192, 512, 512, 8192, 512]
    - [122, 12.696]
  - - [512, 1024, 1, 128, 512, 512, 128, 1024]
    - [18, 1.984]
  - - [512, 1024, 1, 256, 512, 512, 256, 1024]
    - [42, 3.494]
  - - [512, 1024, 1, 512, 512, 512, 512, 1024]
    - [50, 5.816]
  - - [512, 1024, 1, 1024, 512, 512, 1024, 1024]
    - [52, 8.538]
  - - [512, 1024, 1, 2048, 512, 512, 2048, 1024]
    - [127, 10.243]
  - - [512, 1024, 1, 4096, 512, 512, 4096, 1024]
    - [126, 12.707]
  - - [512, 1024, 1, 8192, 512, 512, 8192, 1024]
    - [124, 15.533]
  - - [512, 2048, 1, 128, 512, 512, 128, 2048]
    - [15, 3.138]
  - - [512, 2048, 1, 256, 512, 512, 256, 2048]
    - [37, 5.442]
  - - [512, 2048, 1, 512, 512, 512, 512, 2048]
    - [114, 8.665]
  - - [512, 2048, 1, 1024, 512, 512, 1024, 2048]
    - [120, 12.397]
  - - [512, 2048, 1, 2048, 512, 512, 2048, 2048]
    - [122, 13.928]
  - - [512, 2048, 1, 4096, 512, 512, 4096, 2048]
    - [104, 16.248]
  - - [512, 2048, 1, 8192, 512, 512, 8192, 2048]
    - [89, 17.797]
  - - [512, 4096, 1, 128, 512, 512, 128, 4096]
    - [78, 4.543]
  - - [512, 4096, 1, 256, 512, 512, 256, 4096]
    - [97, 7.771]
  - - [512, 4096, 1, 512, 512, 512, 512, 4096]
    - [97, 12.227]
  - - [512, 4096, 1, 1024, 512, 512, 1024, 4096]
    - [119, 13.456]
  - - [512, 4096, 1, 2048, 512, 512, 2048, 4096]
    - [99, 17.135]
  - - [512, 4096, 1, 4096, 512, 512, 4096, 4096]
    - [89, 19.466]
  - - [512, 4096, 1, 8192, 512, 512, 8192, 4096]
    - [29, 21.699]
  - - [512, 8192, 1, 128, 512, 512, 128, 8192]
    - [71, 5.705]
  - - [512, 8192, 1, 256, 512, 512, 256, 8192]
    - [71, 9.46]
  - - [512, 8192, 1, 512, 512, 512, 512, 8192]
    - [24, 13.98]
  - - [512, 8192, 1, 1024, 512, 512, 1024, 8192]
    - [96, 16.682]
  - - [512, 8192, 1, 2048, 512, 512, 2048, 8192]
    - [99, 20.962]
  - - [512, 8192, 1, 4096, 512, 512, 4096, 8192]
    - [89, 23.793]
  - - [512, 8192, 1, 8192, 512, 512, 8192, 8192]
    - [27, 25.972]
  - - [1024, 128, 1, 128, 1024, 1024, 128, 128]
    - [55, 0.635]
  - - [1024, 128, 1, 256, 1024, 1024, 256, 128]
    - [55, 1.151]
  - - [1024, 128, 1, 512, 1024, 1024, 512, 128]
    - [55, 1.958]
  - - [1024, 128, 1, 1024, 1024, 1024, 1024, 128]
    - [56, 3.023]
  - - [1024, 128, 1, 2048, 1024, 1024, 2048, 128]
    - [131, 4.01]
  - - [1024, 128, 1, 4096, 1024, 1024, 4096, 128]
    - [131, 5.926]
  - - [1024, 128, 1, 8192, 1024, 1024, 8192, 128]
    - [130, 8.683]
  - - [1024, 256, 1, 128, 1024, 1024, 128, 256]
    - [43, 1.184]
  - - [1024, 256, 1, 256, 1024, 1024, 256, 256]
    - [43, 2.092]
  - - [1024, 256, 1, 512, 1024, 1024, 512, 256]
    - [53, 3.522]
  - - [1024, 256, 1, 1024, 1024, 1024, 1024, 256]
    - [53, 5.266]
  - - [1024, 256, 1, 2048, 1024, 1024, 2048, 256]
    - [130, 6.67]
  - - [1024, 256, 1, 4096, 1024, 1024, 4096, 256]
    - [129, 9.48]
  - - [1024, 256, 1, 8192, 1024, 1024, 8192, 256]
    - [122, 12.824]
  - - [1024, 512, 1, 128, 1024, 1024, 128, 512]
    - [42, 2.014]
  - - [1024, 512, 1, 256, 1024, 1024, 256, 512]
    - [42, 3.52]
  - - [1024, 512, 1, 512, 1024, 1024, 512, 512]
    - [50, 5.834]
  - - [1024, 512, 1, 1024, 1024, 1024, 1024, 512]
    - [52, 8.569]
  - - [1024, 512, 1, 2048, 1024, 1024, 2048, 512]
    - [130, 10.413]
  - - [1024, 512, 1, 4096, 1024, 1024, 4096, 512]
    - [122, 12.965]
  - - [1024, 512, 1, 8192, 1024, 1024, 8192, 512]
    - [126, 15.67]
  - - [1024, 1024, 1, 128, 1024, 1024, 128, 1024]
    - [14, 3.138]
  - - [1024, 1024, 1, 256, 1024, 1024, 256, 1024]
    - [38, 5.439]
  - - [1024, 1024, 1, 512, 1024, 1024, 512, 1024]
    - [114, 8.7]
  - - [1024, 1024, 1, 1024, 1024, 1024, 1024, 1024]
    - [49, 12.425]
  - - [1024, 1024, 1, 2048, 1024, 1024, 2048, 1024]
    - [126, 13.484]
  - - [1024, 1024, 1, 4096, 1024, 1024, 4096, 1024]
    - [101, 16.329]
  - - [1024, 1024, 1, 8192, 1024, 1024, 8192, 1024]
    - [89, 17.533]
  - - [1024, 2048, 1, 128, 1024, 1024, 128, 2048]
    - [77, 4.581]
  - - [1024, 2048, 1, 256, 1024, 1024, 256, 2048]
    - [97, 7.855]
  - - [1024, 2048, 1, 512, 1024, 1024, 512, 2048]
    - [33, 12.088]
  - - [1024, 2048, 1, 1024, 1024, 1024, 1024, 2048]
    - [120, 13.555]
  - - [1024, 2048, 1, 2048, 1024, 1024, 2048, 2048]
    - [126, 16.552]
  - - [1024, 2048, 1, 4096, 1024, 1024, 4096, 2048]
    - [29, 19.742]
  - - [1024, 2048, 1, 8192, 1024, 1024, 8192, 2048]
    - [29, 21.893]
  - - [1024, 4096, 1, 128, 1024, 1024, 128, 4096]
    - [70, 5.695]
  - - [1024, 4096, 1, 256, 1024, 1024, 256, 4096]
    - [71, 9.466]
  - - [1024, 4096, 1, 512, 1024, 1024, 512, 4096]
    - [20, 14.021]
  - - [1024, 4096, 1, 1024, 1024, 1024, 1024, 4096]
    - [99, 16.592]
  - - [1024, 4096, 1, 2048, 1024, 1024, 2048, 4096]
    - [104, 20.691]
  - - [1024, 4096, 1, 4096, 1024, 1024, 4096, 4096]
    - [28, 22.55]
  - - [1024, 4096, 1, 8192, 1024, 1024, 8192, 4096]
    - [8, 24.956]
  - - [1024, 8192, 1, 128, 1024, 1024, 128, 8192]
    - [5, 6.309]
  - - [1024, 8192, 1, 256, 1024, 1024, 256, 8192]
    - [6, 10.612]
  - - [1024, 8192, 1, 512, 1024, 1024, 512, 8192]
    - [122, 14.41]
  - - [1024, 8192, 1, 1024, 1024, 1024, 1024, 8192]
    - [104, 19.649]
  - - [1024, 8192, 1, 2048, 1024, 1024, 2048, 8192]
    - [88, 22.249]
  - - [1024, 8192, 1, 4096, 1024, 1024, 4096, 8192]
    - [7, 24.778]
  - - [1024, 8192, 1, 8192, 1024, 1024, 8192, 8192]
    - [8, 27.212]
  - - [2048, 128, 1, 128, 2048, 2048, 128, 128]
    - [44, 1.165]
  - - [2048, 128, 1, 256, 2048, 2048, 256, 128]
    - [53, 2.096]
  - - [2048, 128, 1, 512, 2048, 2048, 512, 128]
    - [53, 3.514]
  - - [2048, 128, 1, 1024, 2048, 2048, 1024, 128]
    - [53, 5.249]
  - - [2048, 128, 1, 2048, 2048, 2048, 2048, 128]
    - [127, 6.718]
  - - [2048, 128, 1, 4096, 2048, 2048, 4096, 128]
    - [130, 9.509]
  - - [2048, 128, 1, 8192, 2048, 2048, 8192, 128]
    - [122, 12.569]
  - - [2048, 256, 1, 128, 2048, 2048, 128, 256]
    - [109, 2.005]
  - - [2048, 256, 1, 256, 2048, 2048, 256, 256]
    - [42, 3.497]
  - - [2048, 256, 1, 512, 2048, 2048, 512, 256]
    - [127, 5.797]
  - - [2048, 256, 1, 1024, 2048, 2048, 1024, 256]
    - [51, 8.53]
  - - [2048, 256, 1, 2048, 2048, 2048, 2048, 256]
    - [130, 10.571]
  - - [2048, 256, 1, 4096, 2048, 2048, 4096, 256]
    - [117, 13.397]
  - - [2048, 256, 1, 8192, 2048, 2048, 8192, 256]
    - [99, 15.848]
  - - [2048, 512, 1, 128, 2048, 2048, 128, 512]
    - [17, 3.164]
  - - [2048, 512, 1, 256, 2048, 2048, 256, 512]
    - [37, 5.428]
  - - [2048, 512, 1, 512, 2048, 2048, 512, 512]
    - [37, 8.631]
  - - [2048, 512, 1, 1024, 2048, 2048, 1024, 512]
    - [126, 12.768]
  - - [2048, 512, 1, 2048, 2048, 2048, 2048, 512]
    - [108, 14.082]
  - - [2048, 512, 1, 4096, 2048, 2048, 4096, 512]
    - [101, 16.054]
  - - [2048, 512, 1, 8192, 2048, 2048, 8192, 512]
    - [84, 17.942]
  - - [2048, 1024, 1, 128, 2048, 2048, 128, 1024]
    - [76, 4.521]
  - - [2048, 1024, 1, 256, 2048, 2048, 256, 1024]
    - [35, 7.446]
  - - [2048, 1024, 1, 512, 2048, 2048, 512, 1024]
    - [32, 11.901]
  - - [2048, 1024, 1, 1024, 2048, 2048, 1024, 1024]
    - [108, 13.438]
  - - [2048, 1024, 1, 2048, 2048, 2048, 2048, 1024]
    - [105, 16.851]
  - - [2048, 1024, 1, 4096, 2048, 2048, 4096, 1024]
    - [28, 19.479]
  - - [2048, 1024, 1, 8192, 2048, 2048, 8192, 1024]
    - [11, 20.588]
  - - [2048, 2048, 1, 128, 2048, 2048, 128, 2048]
    - [71, 5.7]
  - - [2048, 2048, 1, 256, 2048, 2048, 256, 2048]
    - [71, 9.534]
  - - [2048, 2048, 1, 512, 2048, 2048, 512, 2048]
    - [21, 14.304]
  - - [2048, 2048, 1, 1024, 2048, 2048, 1024, 2048]
    - [95, 16.191]
  - - [2048, 2048, 1, 2048, 2048, 2048, 2048, 2048]
    - [104, 20.096]
  - - [2048, 2048, 1, 4096, 2048, 2048, 4096, 2048]
    - [82, 21.35]
  - - [2048, 2048, 1, 8192, 2048, 2048, 8192, 2048]
    - [67, 23.912]
  - - [2048, 4096, 1, 128, 2048, 2048, 128, 4096]
    - [2, 6.229]
  - - [2048, 4096, 1, 256, 2048, 2048, 256, 4096]
    - [3, 10.35]
  - - [2048, 4096, 1, 512, 2048, 2048, 512, 4096]
    - [94, 14.161]
  - - [2048, 4096, 1, 1024, 2048, 2048, 1024, 4096]
    - [90, 19.09]
  - - [2048, 4096, 1, 2048, 2048, 2048, 2048, 4096]
    - [82, 22.176]
  - - [2048, 4096, 1, 4096, 2048, 2048, 4096, 4096]
    - [83, 24.471]
  - - [2048, 4096, 1, 8192, 2048, 2048, 8192, 4096]
    - [65, 26.434]
  - - [2048, 8192, 1, 128, 2048, 2048, 128, 8192]
    - [41, 6.437]
  - - [2048, 8192, 1, 256, 2048, 2048, 256, 8192]
    - [94, 10.705]
  - - [2048, 8192, 1, 512, 2048, 2048, 512, 8192]
    - [97, 16.085]
  - - [2048, 8192, 1, 1024, 2048, 2048, 1024, 8192]
    - [59, 19.881]
  - - [2048, 8192, 1, 2048, 2048, 2048, 2048, 8192]
    - [82, 24.23]
  - - [2048, 8192, 1, 4096, 2048, 2048, 4096, 8192]
    - [80, 28.177]
  - - [2048, 8192, 1, 8192, 2048, 2048, 8192, 8192]
    - [4, 28.394]
  - - [4096, 128, 1, 128, 4096, 4096, 128, 128]
    - [109, 1.994]
  - - [4096, 128, 1, 256, 4096, 4096, 256, 128]
    - [50, 3.511]
  - - [4096, 128, 1, 512, 4096, 4096, 512, 128]
    - [50, 5.713]
  - - [4096, 128, 1, 1024, 4096, 4096, 1024, 128]
    - [128, 8.469]
  - - [4096, 128, 1, 2048, 4096, 4096, 2048, 128]
    - [129, 10.374]
  - - [4096, 128, 1, 4096, 4096, 4096, 4096, 128]
    - [130, 13.356]
  - - [4096, 128, 1, 8192, 4096, 4096, 8192, 128]
    - [47, 16.23]
  - - [4096, 256, 1, 128, 4096, 4096, 128, 256]
    - [16, 3.125]
  - - [4096, 256, 1, 256, 4096, 4096, 256, 256]
    - [107, 5.373]
  - - [4096, 256, 1, 512, 4096, 4096, 512, 256]
    - [122, 8.589]
  - - [4096, 256, 1, 1024, 4096, 4096, 1024, 256]
    - [126, 12.643]
  - - [4096, 256, 1, 2048, 4096, 4096, 2048, 256]
    - [116, 14.042]
  - - [4096, 256, 1, 4096, 4096, 4096, 4096, 256]
    - [106, 17.094]
  - - [4096, 256, 1, 8192, 4096, 4096, 8192, 256]
    - [30, 18.632]
  - - [4096, 512, 1, 128, 4096, 4096, 128, 512]
    - [13, 4.464]
  - - [4096, 512, 1, 256, 4096, 4096, 256, 512]
    - [35, 7.351]
  - - [4096, 512, 1, 512, 4096, 4096, 512, 512]
    - [104, 11.631]
  - - [4096, 512, 1, 1024, 4096, 4096, 1024, 512]
    - [126, 13.413]
  - - [4096, 512, 1, 2048, 4096, 4096, 2048, 512]
    - [104, 17.209]
  - - [4096, 512, 1, 4096, 4096, 4096, 4096, 512]
    - [91, 18.955]
  - - [4096, 512, 1, 8192, 4096, 4096, 8192, 512]
    - [11, 21.242]
  - - [4096, 1024, 1, 128, 4096, 4096, 128, 1024]
    - [72, 5.696]
  - - [4096, 1024, 1, 256, 4096, 4096, 256, 1024]
    - [69, 9.422]
  - - [4096, 1024, 1, 512, 4096, 4096, 512, 1024]
    - [85, 14.05]
  - - [4096, 1024, 1, 1024, 4096, 4096, 1024, 1024]
    - [98, 16.41]
  - - [4096, 1024, 1, 2048, 4096, 4096, 2048, 1024]
    - [104, 20.046]
  - - [4096, 1024, 1, 4096, 4096, 4096, 4096, 1024]
    - [97, 21.886]
  - - [4096, 1024, 1, 8192, 4096, 4096, 8192, 1024]
    - [63, 24.223]
  - - [4096, 2048, 1, 128, 4096, 4096, 128, 2048]
    - [1, 6.216]
  - - [4096, 2048, 1, 256, 4096, 4096, 256, 2048]
    - [1, 10.463]
  - - [4096, 2048, 1, 512, 4096, 4096, 512, 2048]
    - [104, 14.046]
  - - [4096, 2048, 1, 1024, 4096, 4096, 1024, 2048]
    - [99, 18.545]
  - - [4096, 2048, 1, 2048, 4096, 4096, 2048, 2048]
    - [80, 21.956]
  - - [4096, 2048, 1, 4096, 4096, 4096, 4096, 2048]
    - [82, 24.652]
  - - [4096, 2048, 1, 8192, 4096, 4096, 8192, 2048]
    - [61, 26.976]
  - - [4096, 4096, 1, 128, 4096, 4096, 128, 4096]
    - [39, 6.31]
  - - [4096, 4096, 1, 256, 4096, 4096, 256, 4096]
    - [97, 10.631]
  - - [4096, 4096, 1, 512, 4096, 4096, 512, 4096]
    - [104, 16.182]
  - - [4096, 4096, 1, 1024, 4096, 4096, 1024, 4096]
    - [99, 20.174]
  - - [4096, 4096, 1, 2048, 4096, 4096, 2048, 4096]
    - [82, 24.431]
  - - [4096, 4096, 1, 4096, 4096, 4096, 4096, 4096]
    - [82, 27.012]
  - - [4096, 4096, 1, 8192, 4096, 4096, 8192, 4096]
    - [60, 28.88]
  - - [4096, 8192, 1, 128, 4096, 4096, 128, 8192]
    - [32, 6.704]
  - - [4096, 8192, 1, 256, 4096, 4096, 256, 8192]
    - [34, 10.562]
  - - [4096, 8192, 1, 512, 4096, 4096, 512, 8192]
    - [86, 15.246]
  - - [4096, 8192, 1, 1024, 4096, 4096, 1024, 8192]
    - [79, 20.435]
  - - [4096, 8192, 1, 2048, 4096, 4096, 2048, 8192]
    - [25, 25.384]
  - - [4096, 8192, 1, 4096, 4096, 4096, 4096, 8192]
    - [64, 30.575]
  - - [4096, 8192, 1, 8192, 4096, 4096, 8192, 8192]
    - [67, 34.131]
  - - [8192, 128, 1, 128, 8192, 8192, 128, 128]
    - [36, 3.127]
  - - [8192, 128, 1, 256, 8192, 8192, 256, 128]
    - [36, 5.363]
  - - [8192, 128, 1, 512, 8192, 8192, 512, 128]
    - [114, 8.535]
  - - [8192, 128, 1, 1024, 8192, 8192, 1024, 128]
    - [114, 12.316]
  - - [8192, 128, 1, 2048, 8192, 8192, 2048, 128]
    - [129, 13.36]
  - - [8192, 128, 1, 4096, 8192, 8192, 4096, 128]
    - [113, 17.114]
  - - [8192, 128, 1, 8192, 8192, 8192, 8192, 128]
    - [33, 20.203]
  - - [8192, 256, 1, 128, 8192, 8192, 128, 256]
    - [75, 4.406]
  - - [8192, 256, 1, 256, 8192, 8192, 256, 256]
    - [98, 7.586]
  - - [8192, 256, 1, 512, 8192, 8192, 512, 256]
    - [102, 11.822]
  - - [8192, 256, 1, 1024, 8192, 8192, 1024, 256]
    - [125, 13.219]
  - - [8192, 256, 1, 2048, 8192, 8192, 2048, 256]
    - [115, 17.336]
  - - [8192, 256, 1, 4096, 8192, 8192, 4096, 256]
    - [92, 20.545]
  - - [8192, 256, 1, 8192, 8192, 8192, 8192, 256]
    - [26, 23.798]
  - - [8192, 512, 1, 128, 8192, 8192, 128, 512]
    - [74, 5.331]
  - - [8192, 512, 1, 256, 8192, 8192, 256, 512]
    - [9, 8.944]
  - - [8192, 512, 1, 512, 8192, 8192, 512, 512]
    - [85, 13.698]
  - - [8192, 512, 1, 1024, 8192, 8192, 1024, 512]
    - [100, 16.622]
  - - [8192, 512, 1, 2048, 8192, 8192, 2048, 512]
    - [102, 21.513]
  - - [8192, 512, 1, 4096, 8192, 8192, 4096, 512]
    - [68, 23.67]
  - - [8192, 512, 1, 8192, 8192, 8192, 8192, 512]
    - [26, 25.503]
  - - [8192, 1024, 1, 128, 8192, 8192, 128, 1024]
    - [0, 6.038]
  - - [8192, 1024, 1, 256, 8192, 8192, 256, 1024]
    - [6, 10.206]
  - - [8192, 1024, 1, 512, 8192, 8192, 512, 1024]
    - [104, 14.162]
  - - [8192, 1024, 1, 1024, 8192, 8192, 1024, 1024]
    - [98, 18.967]
  - - [8192, 1024, 1, 2048, 8192, 8192, 2048, 1024]
    - [24, 22.071]
  - - [8192, 1024, 1, 4096, 8192, 8192, 4096, 1024]
    - [81, 24.671]
  - - [8192, 1024, 1, 8192, 8192, 8192, 8192, 1024]
    - [22, 26.51]
  - - [8192, 2048, 1, 128, 8192, 8192, 128, 2048]
    - [93, 6.21]
  - - [8192, 2048, 1, 256, 8192, 8192, 256, 2048]
    - [99, 10.649]
  - - [8192, 2048, 1, 512, 8192, 8192, 512, 2048]
    - [104, 15.832]
  - - [8192, 2048, 1, 1024, 8192, 8192, 1024, 2048]
    - [103, 20.026]
  - - [8192, 2048, 1, 2048, 8192, 8192, 2048, 2048]
    - [82, 24.361]
  - - [8192, 2048, 1, 4096, 8192, 8192, 4096, 2048]
    - [23, 27.392]
  - - [8192, 2048, 1, 8192, 8192, 8192, 8192, 2048]
    - [61, 28.516]
  - - [8192, 4096, 1, 128, 8192, 8192, 128, 4096]
    - [33, 6.629]
  - - [8192, 4096, 1, 256, 8192, 8192, 256, 4096]
    - [94, 10.304]
  - - [8192, 4096, 1, 512, 8192, 8192, 512, 4096]
    - [87, 15.056]
  - - [8192, 4096, 1, 1024, 8192, 8192, 1024, 4096]
    - [82, 20.299]
  - - [8192, 4096, 1, 2048, 8192, 8192, 2048, 4096]
    - [67, 26.14]
  - - [8192, 4096, 1, 4096, 8192, 8192, 4096, 4096]
    - [81, 29.999]
  - - [8192, 4096, 1, 8192, 8192, 8192, 8192, 4096]
    - [67, 33.903]
  - - [8192, 8192, 1, 128, 8192, 8192, 128, 8192]
    - [10, 6.111]
  - - [8192, 8192, 1, 256, 8192, 8192, 256, 8192]
    - [73, 9.862]
  - - [8192, 8192, 1, 512, 8192, 8192, 512, 8192]
    - [81, 15.532]
  - - [8192, 8192, 1, 1024, 8192, 8192, 1024, 8192]
    - [81, 22.249]
  - - [8192, 8192, 1, 2048, 8192, 8192, 2048, 8192]
    - [62, 28.606]
  - - [8192, 8192, 1, 4096, 8192, 8192, 4096, 8192]
    - [66, 33.156]
  - - [8192, 8192, 1, 8192, 8192, 8192, 8192, 8192]
    - [67, 36.966]
  - - [1, 1, 1, 32, 1, 1, 32, 1]
    - [134, 0.0]
- null
- null
- ExperimentalStreamK
- GridBased
