library/src/amd_detail/rocblaslt/src/Tensile/Logic/asm_full/aquavanjaram/gfx942_228cu/StreamK/aquavanjaram942_Cijk_Alik_Bljk_HHS_BH_UserArgs.yaml
- {MinimumRequiredVersion: 4.33.0}
- aquavanjaram942
- {Architecture: gfx942, CUCount: 228}
- [Device 0049, Device 0050]
    SolutionIndex: 0
    SolutionNameMin: Cijk_Alik_Bljk_HHS_BH_UserArgs_MT256x64x64_MI16x16x1_SN_LDSB1_CLR1_GSU0_GSUC0_GSUWGMRR0_K1_LBSPPA512_LBSPPB128_MIWT8_2_PLR1_SU32_SUM0_SUS256_SKXCCM0_VWA4_VWB1_WGM4_WGMXCC1_WGMXCCGn1
    SolutionIndex: 1
    SolutionNameMin: Cijk_Alik_Bljk_HHS_BH_UserArgs_MT256x64x64_MI16x16x1_SN_LDSB1_CLR1_GSU0_GSUC0_GSUWGMRR0_K1_LBSPPA128_LBSPPB128_MIWT8_2_PLR1_SU32_SUM0_SUS256_SKXCCM0_VWA1_VWB1_WGM8_WGMXCC1_WGMXCCGn1
    SolutionIndex: 2
    SolutionNameMin: Cijk_Alik_Bljk_HHS_BH_UserArgs_MT128x128x64_MI16x16x1_SN_LDSB1_CLR1_GSU0_GSUC0_GSUWGMRR0_K1_LBSPPA256_LBSPPB128_MIWT4_4_PLR1_SU32_SUM0_SUS256_SKXCCM0_VWA2_VWB1_WGM1_WGMXCC1_WGMXCCGn1
    SolutionIndex: 3
    SolutionNameMin: Cijk_Alik_Bljk_HHS_BH_UserArgs_MT128x128x64_MI16x16x1_SN_LDSB1_CLR1_GSU0_GSUC0_GSUWGMRR0_K1_LBSPPA512_LBSPPB128_MIWT4_4_PLR1_SU32_SUM0_SUS256_SKXCCM0_VWA4_VWB1_WGM1_WGMXCC1_WGMXCCGn1
    SolutionIndex: 4
    SolutionNameMin: Cijk_Alik_Bljk_HHS_BH_UserArgs_MT128x128x64_MI16x16x1_SN_LDSB1_CLR1_GSU0_GSUC0_GSUWGMRR0_K1_LBSPPA256_LBSPPB256_MIWT4_4_PLR1_SU32_SUM0_SUS256_SKXCCM0_VWA2_VWB2_WGM1_WGMXCC1_WGMXCCGn1
    SolutionIndex: 5
    SolutionNameMin: Cijk_Alik_Bljk_HHS_BH_UserArgs_MT128x128x64_MI16x16x1_SN_LDSB1_CLR1_GSU0_GSUC0_GSUWGMRR0_K1_LBSPPA512_LBSPPB256_MIWT4_4_PLR1_SU32_SUM0_SUS256_SKXCCM0_VWA4_VWB2_WGM1_WGMXCC1_WGMXCCGn1
    SolutionIndex: 6
    SolutionNameMin: Cijk_Alik_Bljk_HHS_BH_UserArgs_MT128x128x64_MI16x16x1_SN_LDSB1_CLR1_GSU0_GSUC0_GSUWGMRR0_K1_LBSPPA256_LBSPPB512_MIWT4_4_PLR1_SU32_SUM0_SUS256_SKXCCM0_VWA2_VWB4_WGM1_WGMXCC1_WGMXCCGn1
    SolutionIndex: 7
    SolutionNameMin: Cijk_Alik_Bljk_HHS_BH_UserArgs_MT128x128x64_MI16x16x1_SN_LDSB1_CLR1_GSU0_GSUC0_GSUWGMRR0_K1_LBSPPA512_LBSPPB256_MIWT4_4_PLR2_SU32_SUM0_SUS256_SKXCCM0_VWA4_VWB2_WGM1_WGMXCC1_WGMXCCGn1
    SolutionIndex: 8
    SolutionNameMin: Cijk_Alik_Bljk_HHS_BH_UserArgs_MT128x128x64_MI16x16x1_SN_LDSB1_CLR1_GSU0_GSUC0_GSUWGMRR0_K1_LBSPPA256_LBSPPB128_MIWT4_4_PLR1_SU32_SUM0_SUS256_SKXCCM0_VWA2_VWB1_WGM4_WGMXCC1_WGMXCCGn1
    SolutionIndex: 9
    SolutionNameMin: Cijk_Alik_Bljk_HHS_BH_UserArgs_MT128x128x64_MI16x16x1_SN_LDSB1_CLR1_GSU0_GSUC0_GSUWGMRR0_K1_LBSPPA512_LBSPPB128_MIWT4_4_PLR1_SU32_SUM0_SUS256_SKXCCM0_VWA4_VWB1_WGM4_WGMXCC1_WGMXCCGn1
    SolutionIndex: 10
    SolutionNameMin: Cijk_Alik_Bljk_HHS_BH_UserArgs_MT128x128x64_MI16x16x1_SN_LDSB1_CLR1_GSU0_GSUC0_GSUWGMRR0_K1_LBSPPA512_LBSPPB256_MIWT4_4_PLR1_SU32_SUM0_SUS256_SKXCCM0_VWA4_VWB2_WGM4_WGMXCC1_WGMXCCGn1
    SolutionIndex: 11
    SolutionNameMin: Cijk_Alik_Bljk_HHS_BH_UserArgs_MT128x128x64_MI16x16x1_SN_LDSB1_CLR1_GSU0_GSUC0_GSUWGMRR0_K1_LBSPPA256_LBSPPB128_MIWT4_4_PLR1_SU32_SUM0_SUS256_SKXCCM0_VWA2_VWB1_WGM8_WGMXCC1_WGMXCCGn1
    SolutionIndex: 12
    SolutionNameMin: Cijk_Alik_Bljk_HHS_BH_UserArgs_MT128x128x64_MI16x16x1_SN_LDSB1_CLR1_GSU0_GSUC0_GSUWGMRR0_K1_LBSPPA256_LBSPPB256_MIWT4_4_PLR1_SU32_SUM0_SUS256_SKXCCM0_VWA2_VWB2_WGM8_WGMXCC1_WGMXCCGn1
    SolutionIndex: 13
    SolutionNameMin: Cijk_Alik_Bljk_HHS_BH_UserArgs_MT128x128x64_MI16x16x1_SN_LDSB1_CLR1_GSU0_GSUC0_GSUWGMRR0_K1_LBSPPA256_LBSPPB512_MIWT4_4_PLR1_SU32_SUM0_SUS256_SKXCCM0_VWA2_VWB4_WGM8_WGMXCC1_WGMXCCGn1
    SolutionIndex: 14
    SolutionNameMin: Cijk_Alik_Bljk_HHS_BH_UserArgs_MT64x128x64_MI16x16x1_SN_LDSB1_CLR1_GSU0_GSUC0_GSUWGMRR0_K1_LBSPPA256_LBSPPB128_MIWT2_4_PLR1_SU32_SUM0_SUS256_SKXCCM0_VWA2_VWB1_WGM1_WGMXCC1_WGMXCCGn1
    SolutionIndex: 15
    SolutionNameMin: Cijk_Alik_Bljk_HHS_BH_UserArgs_MT64x128x64_MI16x16x1_SN_LDSB1_CLR1_GSU0_GSUC0_GSUWGMRR0_K1_LBSPPA256_LBSPPB512_MIWT2_4_PLR1_SU32_SUM0_SUS256_SKXCCM0_VWA2_VWB4_WGM8_WGMXCC1_WGMXCCGn1
    SolutionIndex: 16
    SolutionNameMin: Cijk_Alik_Bljk_HHS_BH_UserArgs_MT128x64x64_MI16x16x1_SN_LDSB1_CLR1_GSU0_GSUC0_GSUWGMRR0_K1_LBSPPA256_LBSPPB128_MIWT4_2_PLR1_SU32_SUM0_SUS256_SKXCCM0_VWA2_VWB1_WGM1_WGMXCC1_WGMXCCGn1
    SolutionIndex: 17
    SolutionNameMin: Cijk_Alik_Bljk_HHS_BH_UserArgs_MT128x64x64_MI16x16x1_SN_LDSB1_CLR1_GSU0_GSUC0_GSUWGMRR0_K1_LBSPPA512_LBSPPB128_MIWT4_2_PLR1_SU32_SUM0_SUS256_SKXCCM0_VWA4_VWB1_WGM1_WGMXCC1_WGMXCCGn1
    SolutionIndex: 18
    SolutionNameMin: Cijk_Alik_Bljk_HHS_BH_UserArgs_MT128x64x64_MI16x16x1_SN_LDSB1_CLR1_GSU0_GSUC0_GSUWGMRR0_K1_LBSPPA512_LBSPPB256_MIWT4_2_PLR1_SU32_SUM0_SUS256_SKXCCM0_VWA4_VWB2_WGM1_WGMXCC1_WGMXCCGn1
    SolutionIndex: 19
    SolutionNameMin: Cijk_Alik_Bljk_HHS_BH_UserArgs_MT128x64x64_MI16x16x1_SN_LDSB1_CLR1_GSU0_GSUC0_GSUWGMRR0_K1_LBSPPA512_LBSPPB128_MIWT4_2_PLR1_SU32_SUM0_SUS256_SKXCCM0_VWA4_VWB1_WGM4_WGMXCC1_WGMXCCGn1
    SolutionIndex: 20
    SolutionNameMin: Cijk_Alik_Bljk_HHS_BH_UserArgs_MT64x64x64_MI16x16x1_SN_LDSB1_CLR1_GSU0_GSUC0_GSUWGMRR0_K1_LBSPPA256_LBSPPB128_MIWT2_2_PLR1_SU32_SUM0_SUS256_SKXCCM0_VWA2_VWB1_WGM1_WGMXCC1_WGMXCCGn1
    SolutionIndex: 21
    SolutionNameMin: Cijk_Alik_Bljk_HHS_BH_UserArgs_MT64x64x64_MI16x16x1_SN_LDSB1_CLR1_GSU0_GSUC0_GSUWGMRR0_K1_LBSPPA256_LBSPPB256_MIWT2_2_PLR1_SU32_SUM0_SUS256_SKXCCM0_VWA2_VWB2_WGM1_WGMXCC1_WGMXCCGn1
    SolutionIndex: 22
    SolutionNameMin: Cijk_Alik_Bljk_HHS_BH_UserArgs_MT32x64x64_MI16x16x1_SN_LDSB0_CLR1_GSU0_GSUC0_GSUWGMRR0_K1_LBSPPA128_LBSPPB128_MIWT1_2_PLR1_SU32_SUM0_SUS256_SKXCCM0_VWA1_VWB1_WGM1_WGMXCC1_WGMXCCGn1
    SolutionIndex: 23
    SolutionNameMin: Cijk_Alik_Bljk_HHS_BH_UserArgs_MT32x64x64_MI16x16x1_SN_LDSB0_CLR1_GSU0_GSUC0_GSUWGMRR0_K1_LBSPPA128_LBSPPB256_MIWT1_2_PLR1_SU32_SUM0_SUS256_SKXCCM0_VWA1_VWB2_WGM1_WGMXCC1_WGMXCCGn1
    SolutionIndex: 24
    SolutionNameMin: Cijk_Alik_Bljk_HHS_BH_UserArgs_MT64x32x64_MI16x16x1_SN_LDSB0_CLR1_GSU0_GSUC0_GSUWGMRR0_K1_LBSPPA256_LBSPPB128_MIWT2_1_PLR1_SU32_SUM0_SUS256_SKXCCM0_VWA2_VWB1_WGM1_WGMXCC1_WGMXCCGn1
    SolutionIndex: 25
    SolutionNameMin: Cijk_Alik_Bljk_HHS_BH_UserArgs_MT32x32x64_MI16x16x1_SN_LDSB0_CLR1_GSU0_GSUC0_GSUWGMRR0_K1_LBSPPA128_LBSPPB128_MIWT1_1_PLR1_SU32_SUM0_SUS256_SKXCCM0_VWA1_VWB1_WGM1_WGMXCC1_WGMXCCGn1
    SolutionIndex: 26
    SolutionNameMin: Cijk_Alik_Bljk_HHS_BH_UserArgs_MT32x32x64_MI16x16x1_SN_LDSB0_CLR1_GSU0_GSUC0_GSUWGMRR0_K1_LBSPPA128_LBSPPB128_MIWT1_1_PLR1_SU32_SUM0_SUS256_SKXCCM0_VWA1_VWB1_WGM4_WGMXCC1_WGMXCCGn1
    SolutionIndex: 27
    SolutionNameMin: Cijk_Alik_Bljk_HHS_BH_UserArgs_MT32x32x64_MI16x16x1_SN_LDSB0_CLR1_GSU0_GSUC0_GSUWGMRR0_K1_LBSPPA128_LBSPPB128_MIWT1_1_PLR1_SU32_SUM0_SUS256_SKXCCM0_VWA1_VWB1_WGM8_WGMXCC1_WGMXCCGn1
    SolutionIndex: 28
    SolutionNameMin: Cijk_Alik_Bljk_HHS_BH_UserArgs_MT64x64x128_MI16x16x1_SN_LDSB1_CLR1_GSU0_GSUC0_GSUWGMRR0_K1_LBSPPA512_LBSPPB256_MIWT2_2_PLR1_SU32_SUM0_SUS256_SKXCCM0_VWA2_VWB1_WGM1_WGMXCC1_WGMXCCGn1
    SolutionIndex: 29
    SolutionNameMin: Cijk_Alik_Bljk_HHS_BH_UserArgs_MT64x64x128_MI16x16x1_SN_LDSB1_CLR1_GSU0_GSUC0_GSUWGMRR0_K1_LBSPPA512_LBSPPB512_MIWT2_2_PLR1_SU32_SUM0_SUS256_SKXCCM0_VWA2_VWB2_WGM1_WGMXCC1_WGMXCCGn1
    SolutionIndex: 30
    SolutionNameMin: Cijk_Alik_Bljk_HHS_BH_UserArgs_MT64x64x128_MI16x16x1_SN_LDSB1_CLR1_GSU0_GSUC0_GSUWGMRR0_K1_LBSPPA512_LBSPPB512_MIWT2_2_PLR1_SU32_SUM0_SUS256_SKXCCM0_VWA2_VWB2_WGM8_WGMXCC1_WGMXCCGn1
    SolutionIndex: 31
    SolutionNameMin: Cijk_Alik_Bljk_HHS_BH_UserArgs_MT32x64x128_MI16x16x1_SN_LDSB1_CLR1_GSU0_GSUC0_GSUWGMRR0_K1_LBSPPA256_LBSPPB256_MIWT1_2_PLR1_SU32_SUM0_SUS256_SKXCCM0_VWA1_VWB1_WGM1_WGMXCC1_WGMXCCGn1
    SolutionIndex: 32
    SolutionNameMin: Cijk_Alik_Bljk_HHS_BH_UserArgs_MT32x64x128_MI16x16x1_SN_LDSB1_CLR1_GSU0_GSUC0_GSUWGMRR0_K1_LBSPPA256_LBSPPB512_MIWT1_2_PLR1_SU32_SUM0_SUS256_SKXCCM0_VWA1_VWB2_WGM1_WGMXCC1_WGMXCCGn1
    SolutionIndex: 33
    SolutionNameMin: Cijk_Alik_Bljk_HHS_BH_UserArgs_MT32x64x128_MI16x16x1_SN_LDSB1_CLR1_GSU0_GSUC0_GSUWGMRR0_K1_LBSPPA256_LBSPPB256_MIWT1_2_PLR2_SU32_SUM0_SUS256_SKXCCM0_VWA1_VWB1_WGM1_WGMXCC1_WGMXCCGn1
    SolutionIndex: 34
    SolutionNameMin: Cijk_Alik_Bljk_HHS_BH_UserArgs_MT64x32x128_MI16x16x1_SN_LDSB1_CLR1_GSU0_GSUC0_GSUWGMRR0_K1_LBSPPA512_LBSPPB256_MIWT2_1_PLR2_SU32_SUM0_SUS256_SKXCCM0_VWA2_VWB1_WGM1_WGMXCC1_WGMXCCGn1
    SolutionIndex: 35
    SolutionNameMin: Cijk_Alik_Bljk_HHS_BH_UserArgs_MT32x32x128_MI16x16x1_SN_LDSB1_CLR1_GSU0_GSUC0_GSUWGMRR0_K1_LBSPPA256_LBSPPB256_MIWT1_1_PLR1_SU32_SUM0_SUS256_SKXCCM0_VWA1_VWB1_WGM1_WGMXCC1_WGMXCCGn1
    SolutionIndex: 36
    SolutionNameMin: Cijk_Alik_Bljk_HHS_BH_UserArgs_MT32x32x128_MI16x16x1_SN_LDSB1_CLR1_GSU0_GSUC0_GSUWGMRR0_K1_LBSPPA256_LBSPPB256_MIWT1_1_PLR2_SU32_SUM0_SUS256_SKXCCM0_VWA1_VWB1_WGM1_WGMXCC1_WGMXCCGn1
    SolutionIndex: 37
    SolutionNameMin: Cijk_Alik_Bljk_HHS_BH_UserArgs_MT32x32x128_MI16x16x1_SN_LDSB1_CLR1_GSU0_GSUC0_GSUWGMRR0_K1_LBSPPA256_LBSPPB256_MIWT1_1_PLR1_SU32_SUM0_SUS256_SKXCCM0_VWA1_VWB1_WGM4_WGMXCC1_WGMXCCGn1
    SolutionIndex: 38
    SolutionNameMin: Cijk_Alik_Bljk_HHS_BH_UserArgs_MT64x256x64_MI16x16x1_SN_LDSB1_CLR1_GSU0_GSUC0_GSUWGMRR0_K1_LBSPPA256_LBSPPB256_MIWT2_8_PLR1_SU32_SUM0_SUS256_SKXCCM6_VWA2_VWB2_WGM1_WGMXCC1_WGMXCCGn1
    SolutionIndex: 39
    SolutionNameMin: Cijk_Alik_Bljk_HHS_BH_UserArgs_MT64x256x64_MI16x16x1_SN_LDSB1_CLR1_GSU0_GSUC0_GSUWGMRR0_K1_LBSPPA256_LBSPPB512_MIWT2_8_PLR1_SU32_SUM0_SUS256_SKXCCM6_VWA2_VWB4_WGM1_WGMXCC1_WGMXCCGn1
    SolutionIndex: 40
    SolutionNameMin: Cijk_Alik_Bljk_HHS_BH_UserArgs_MT256x64x64_MI16x16x1_SN_LDSB1_CLR1_GSU0_GSUC0_GSUWGMRR0_K1_LBSPPA512_LBSPPB256_MIWT8_2_PLR1_SU32_SUM0_SUS256_SKXCCM6_VWA4_VWB2_WGM1_WGMXCC1_WGMXCCGn1
    SolutionIndex: 41
    SolutionNameMin: Cijk_Alik_Bljk_HHS_BH_UserArgs_MT256x64x64_MI16x16x1_SN_LDSB1_CLR1_GSU0_GSUC0_GSUWGMRR0_K1_LBSPPA1024_LBSPPB256_MIWT8_2_PLR1_SU32_SUM0_SUS256_SKXCCM6_VWA8_VWB2_WGM1_WGMXCC1_WGMXCCGn1
    SolutionIndex: 42
    SolutionNameMin: Cijk_Alik_Bljk_HHS_BH_UserArgs_MT256x64x64_MI16x16x1_SN_LDSB1_CLR1_GSU0_GSUC0_GSUWGMRR0_K1_LBSPPA128_LBSPPB128_MIWT8_2_PLR1_SU32_SUM0_SUS256_SKXCCM6_VWA1_VWB1_WGM4_WGMXCC1_WGMXCCGn1
    SolutionIndex: 43
    SolutionNameMin: Cijk_Alik_Bljk_HHS_BH_UserArgs_MT128x128x64_MI16x16x1_SN_LDSB1_CLR1_GSU0_GSUC0_GSUWGMRR0_K1_LBSPPA128_LBSPPB128_MIWT4_4_PLR1_SU32_SUM0_SUS256_SKXCCM6_VWA1_VWB1_WGM1_WGMXCC1_WGMXCCGn1
    SolutionIndex: 44
    SolutionNameMin: Cijk_Alik_Bljk_HHS_BH_UserArgs_MT128x128x64_MI16x16x1_SN_LDSB1_CLR1_GSU0_GSUC0_GSUWGMRR0_K1_LBSPPA256_LBSPPB128_MIWT4_4_PLR1_SU32_SUM0_SUS256_SKXCCM6_VWA2_VWB1_WGM1_WGMXCC1_WGMXCCGn1
    SolutionIndex: 45
    SolutionNameMin: Cijk_Alik_Bljk_HHS_BH_UserArgs_MT128x128x64_MI16x16x1_SN_LDSB1_CLR1_GSU0_GSUC0_GSUWGMRR0_K1_LBSPPA512_LBSPPB128_MIWT4_4_PLR1_SU32_SUM0_SUS256_SKXCCM6_VWA4_VWB1_WGM1_WGMXCC1_WGMXCCGn1
    SolutionIndex: 46
    SolutionNameMin: Cijk_Alik_Bljk_HHS_BH_UserArgs_MT128x128x64_MI16x16x1_SN_LDSB1_CLR1_GSU0_GSUC0_GSUWGMRR0_K1_LBSPPA256_LBSPPB256_MIWT4_4_PLR1_SU32_SUM0_SUS256_SKXCCM6_VWA2_VWB2_WGM1_WGMXCC1_WGMXCCGn1
    SolutionIndex: 47
    SolutionNameMin: Cijk_Alik_Bljk_HHS_BH_UserArgs_MT128x128x64_MI16x16x1_SN_LDSB1_CLR1_GSU0_GSUC0_GSUWGMRR0_K1_LBSPPA512_LBSPPB256_MIWT4_4_PLR1_SU32_SUM0_SUS256_SKXCCM6_VWA4_VWB2_WGM1_WGMXCC1_WGMXCCGn1
    SolutionIndex: 48
    SolutionNameMin: Cijk_Alik_Bljk_HHS_BH_UserArgs_MT128x128x64_MI16x16x1_SN_LDSB1_CLR1_GSU0_GSUC0_GSUWGMRR0_K1_LBSPPA256_LBSPPB512_MIWT4_4_PLR1_SU32_SUM0_SUS256_SKXCCM6_VWA2_VWB4_WGM1_WGMXCC1_WGMXCCGn1
    SolutionIndex: 49
    SolutionNameMin: Cijk_Alik_Bljk_HHS_BH_UserArgs_MT128x128x64_MI16x16x1_SN_LDSB1_CLR1_GSU0_GSUC0_GSUWGMRR0_K1_LBSPPA512_LBSPPB512_MIWT4_4_PLR1_SU32_SUM0_SUS256_SKXCCM6_VWA4_VWB4_WGM1_WGMXCC1_WGMXCCGn1
    SolutionIndex: 50
    SolutionNameMin: Cijk_Alik_Bljk_HHS_BH_UserArgs_MT128x128x64_MI16x16x1_SN_LDSB1_CLR1_GSU0_GSUC0_GSUWGMRR0_K1_LBSPPA256_LBSPPB128_MIWT4_4_PLR2_SU32_SUM0_SUS256_SKXCCM6_VWA2_VWB1_WGM1_WGMXCC1_WGMXCCGn1
    SolutionIndex: 51
    SolutionNameMin: Cijk_Alik_Bljk_HHS_BH_UserArgs_MT128x128x64_MI16x16x1_SN_LDSB1_CLR1_GSU0_GSUC0_GSUWGMRR0_K1_LBSPPA512_LBSPPB128_MIWT4_4_PLR2_SU32_SUM0_SUS256_SKXCCM6_VWA4_VWB1_WGM1_WGMXCC1_WGMXCCGn1
    SolutionIndex: 52
    SolutionNameMin: Cijk_Alik_Bljk_HHS_BH_UserArgs_MT128x128x64_MI16x16x1_SN_LDSB1_CLR1_GSU0_GSUC0_GSUWGMRR0_K1_LBSPPA512_LBSPPB256_MIWT4_4_PLR2_SU32_SUM0_SUS256_SKXCCM6_VWA4_VWB2_WGM1_WGMXCC1_WGMXCCGn1
    SolutionIndex: 53
    SolutionNameMin: Cijk_Alik_Bljk_HHS_BH_UserArgs_MT128x128x64_MI16x16x1_SN_LDSB1_CLR1_GSU0_GSUC0_GSUWGMRR0_K1_LBSPPA256_LBSPPB128_MIWT4_4_PLR1_SU32_SUM0_SUS256_SKXCCM6_VWA2_VWB1_WGM4_WGMXCC1_WGMXCCGn1
    SolutionIndex: 54
    SolutionNameMin: Cijk_Alik_Bljk_HHS_BH_UserArgs_MT128x128x64_MI16x16x1_SN_LDSB1_CLR1_GSU0_GSUC0_GSUWGMRR0_K1_LBSPPA512_LBSPPB128_MIWT4_4_PLR1_SU32_SUM0_SUS256_SKXCCM6_VWA4_VWB1_WGM4_WGMXCC1_WGMXCCGn1
    SolutionIndex: 55
    SolutionNameMin: Cijk_Alik_Bljk_HHS_BH_UserArgs_MT128x128x64_MI16x16x1_SN_LDSB1_CLR1_GSU0_GSUC0_GSUWGMRR0_K1_LBSPPA256_LBSPPB256_MIWT4_4_PLR1_SU32_SUM0_SUS256_SKXCCM6_VWA2_VWB2_WGM4_WGMXCC1_WGMXCCGn1
    SolutionIndex: 56
    SolutionNameMin: Cijk_Alik_Bljk_HHS_BH_UserArgs_MT128x128x64_MI16x16x1_SN_LDSB1_CLR1_GSU0_GSUC0_GSUWGMRR0_K1_LBSPPA512_LBSPPB256_MIWT4_4_PLR1_SU32_SUM0_SUS256_SKXCCM6_VWA4_VWB2_WGM4_WGMXCC1_WGMXCCGn1
    SolutionIndex: 57
    SolutionNameMin: Cijk_Alik_Bljk_HHS_BH_UserArgs_MT128x128x64_MI16x16x1_SN_LDSB1_CLR1_GSU0_GSUC0_GSUWGMRR0_K1_LBSPPA256_LBSPPB512_MIWT4_4_PLR1_SU32_SUM0_SUS256_SKXCCM6_VWA2_VWB4_WGM4_WGMXCC1_WGMXCCGn1
    SolutionIndex: 58
    SolutionNameMin: Cijk_Alik_Bljk_HHS_BH_UserArgs_MT128x128x64_MI16x16x1_SN_LDSB1_CLR1_GSU0_GSUC0_GSUWGMRR0_K1_LBSPPA256_LBSPPB128_MIWT4_4_PLR2_SU32_SUM0_SUS256_SKXCCM6_VWA2_VWB1_WGM4_WGMXCC1_WGMXCCGn1
    SolutionIndex: 59
    SolutionNameMin: Cijk_Alik_Bljk_HHS_BH_UserArgs_MT128x128x64_MI16x16x1_SN_LDSB1_CLR1_GSU0_GSUC0_GSUWGMRR0_K1_LBSPPA512_LBSPPB128_MIWT4_4_PLR2_SU32_SUM0_SUS256_SKXCCM6_VWA4_VWB1_WGM4_WGMXCC1_WGMXCCGn1
    SolutionIndex: 60
    SolutionNameMin: Cijk_Alik_Bljk_HHS_BH_UserArgs_MT128x128x64_MI16x16x1_SN_LDSB1_CLR1_GSU0_GSUC0_GSUWGMRR0_K1_LBSPPA256_LBSPPB256_MIWT4_4_PLR2_SU32_SUM0_SUS256_SKXCCM6_VWA2_VWB2_WGM4_WGMXCC1_WGMXCCGn1
    SolutionIndex: 61
    SolutionNameMin: Cijk_Alik_Bljk_HHS_BH_UserArgs_MT128x128x64_MI16x16x1_SN_LDSB1_CLR1_GSU0_GSUC0_GSUWGMRR0_K1_LBSPPA512_LBSPPB512_MIWT4_4_PLR2_SU32_SUM0_SUS256_SKXCCM6_VWA4_VWB4_WGM4_WGMXCC1_WGMXCCGn1
    SolutionIndex: 62
    SolutionNameMin: Cijk_Alik_Bljk_HHS_BH_UserArgs_MT128x128x64_MI16x16x1_SN_LDSB1_CLR1_GSU0_GSUC0_GSUWGMRR0_K1_LBSPPA128_LBSPPB128_MIWT4_4_PLR1_SU32_SUM0_SUS256_SKXCCM6_VWA1_VWB1_WGM8_WGMXCC1_WGMXCCGn1
    SolutionIndex: 63
    SolutionNameMin: Cijk_Alik_Bljk_HHS_BH_UserArgs_MT128x128x64_MI16x16x1_SN_LDSB1_CLR1_GSU0_GSUC0_GSUWGMRR0_K1_LBSPPA256_LBSPPB128_MIWT4_4_PLR1_SU32_SUM0_SUS256_SKXCCM6_VWA2_VWB1_WGM8_WGMXCC1_WGMXCCGn1
    SolutionIndex: 64
    SolutionNameMin: Cijk_Alik_Bljk_HHS_BH_UserArgs_MT128x128x64_MI16x16x1_SN_LDSB1_CLR1_GSU0_GSUC0_GSUWGMRR0_K1_LBSPPA512_LBSPPB128_MIWT4_4_PLR1_SU32_SUM0_SUS256_SKXCCM6_VWA4_VWB1_WGM8_WGMXCC1_WGMXCCGn1
    SolutionIndex: 65
    SolutionNameMin: Cijk_Alik_Bljk_HHS_BH_UserArgs_MT128x128x64_MI16x16x1_SN_LDSB1_CLR1_GSU0_GSUC0_GSUWGMRR0_K1_LBSPPA256_LBSPPB256_MIWT4_4_PLR1_SU32_SUM0_SUS256_SKXCCM6_VWA2_VWB2_WGM8_WGMXCC1_WGMXCCGn1
    SolutionIndex: 66
    SolutionNameMin: Cijk_Alik_Bljk_HHS_BH_UserArgs_MT128x128x64_MI16x16x1_SN_LDSB1_CLR1_GSU0_GSUC0_GSUWGMRR0_K1_LBSPPA512_LBSPPB256_MIWT4_4_PLR1_SU32_SUM0_SUS256_SKXCCM6_VWA4_VWB2_WGM8_WGMXCC1_WGMXCCGn1
    SolutionIndex: 67
    SolutionNameMin: Cijk_Alik_Bljk_HHS_BH_UserArgs_MT128x128x64_MI16x16x1_SN_LDSB1_CLR1_GSU0_GSUC0_GSUWGMRR0_K1_LBSPPA128_LBSPPB512_MIWT4_4_PLR1_SU32_SUM0_SUS256_SKXCCM6_VWA1_VWB4_WGM8_WGMXCC1_WGMXCCGn1
    SolutionIndex: 68
    SolutionNameMin: Cijk_Alik_Bljk_HHS_BH_UserArgs_MT128x128x64_MI16x16x1_SN_LDSB1_CLR1_GSU0_GSUC0_GSUWGMRR0_K1_LBSPPA256_LBSPPB512_MIWT4_4_PLR1_SU32_SUM0_SUS256_SKXCCM6_VWA2_VWB4_WGM8_WGMXCC1_WGMXCCGn1
    SolutionIndex: 69
    SolutionNameMin: Cijk_Alik_Bljk_HHS_BH_UserArgs_MT128x128x64_MI16x16x1_SN_LDSB1_CLR1_GSU0_GSUC0_GSUWGMRR0_K1_LBSPPA512_LBSPPB512_MIWT4_4_PLR1_SU32_SUM0_SUS256_SKXCCM6_VWA4_VWB4_WGM8_WGMXCC1_WGMXCCGn1
    SolutionIndex: 70
    SolutionNameMin: Cijk_Alik_Bljk_HHS_BH_UserArgs_MT128x128x64_MI16x16x1_SN_LDSB1_CLR1_GSU0_GSUC0_GSUWGMRR0_K1_LBSPPA256_LBSPPB256_MIWT4_4_PLR2_SU32_SUM0_SUS256_SKXCCM6_VWA2_VWB2_WGM8_WGMXCC1_WGMXCCGn1
    SolutionIndex: 71
    SolutionNameMin: Cijk_Alik_Bljk_HHS_BH_UserArgs_MT128x128x64_MI16x16x1_SN_LDSB1_CLR1_GSU0_GSUC0_GSUWGMRR0_K1_LBSPPA512_LBSPPB512_MIWT4_4_PLR2_SU32_SUM0_SUS256_SKXCCM6_VWA4_VWB4_WGM8_WGMXCC1_WGMXCCGn1
    SolutionIndex: 72
    SolutionNameMin: Cijk_Alik_Bljk_HHS_BH_UserArgs_MT64x128x64_MI16x16x1_SN_LDSB1_CLR1_GSU0_GSUC0_GSUWGMRR0_K1_LBSPPA256_LBSPPB256_MIWT2_4_PLR1_SU32_SUM0_SUS256_SKXCCM6_VWA2_VWB2_WGM1_WGMXCC1_WGMXCCGn1
    SolutionIndex: 73
    SolutionNameMin: Cijk_Alik_Bljk_HHS_BH_UserArgs_MT64x128x64_MI16x16x1_SN_LDSB1_CLR1_GSU0_GSUC0_GSUWGMRR0_K1_LBSPPA256_LBSPPB512_MIWT2_4_PLR2_SU32_SUM0_SUS256_SKXCCM6_VWA2_VWB4_WGM1_WGMXCC1_WGMXCCGn1
    SolutionIndex: 74
    SolutionNameMin: Cijk_Alik_Bljk_HHS_BH_UserArgs_MT64x128x64_MI16x16x1_SN_LDSB1_CLR1_GSU0_GSUC0_GSUWGMRR0_K1_LBSPPA256_LBSPPB256_MIWT2_4_PLR1_SU32_SUM0_SUS256_SKXCCM6_VWA2_VWB2_WGM4_WGMXCC1_WGMXCCGn1
    SolutionIndex: 75
    SolutionNameMin: Cijk_Alik_Bljk_HHS_BH_UserArgs_MT64x128x64_MI16x16x1_SN_LDSB1_CLR1_GSU0_GSUC0_GSUWGMRR0_K1_LBSPPA256_LBSPPB128_MIWT2_4_PLR2_SU32_SUM0_SUS256_SKXCCM6_VWA2_VWB1_WGM4_WGMXCC1_WGMXCCGn1
    SolutionIndex: 76
    SolutionNameMin: Cijk_Alik_Bljk_HHS_BH_UserArgs_MT64x128x64_MI16x16x1_SN_LDSB1_CLR1_GSU0_GSUC0_GSUWGMRR0_K1_LBSPPA256_LBSPPB512_MIWT2_4_PLR2_SU32_SUM0_SUS256_SKXCCM6_VWA2_VWB4_WGM4_WGMXCC1_WGMXCCGn1
    SolutionIndex: 77
    SolutionNameMin: Cijk_Alik_Bljk_HHS_BH_UserArgs_MT128x64x64_MI16x16x1_SN_LDSB1_CLR1_GSU0_GSUC0_GSUWGMRR0_K1_LBSPPA128_LBSPPB128_MIWT4_2_PLR1_SU32_SUM0_SUS256_SKXCCM6_VWA1_VWB1_WGM1_WGMXCC1_WGMXCCGn1
    SolutionIndex: 78
    SolutionNameMin: Cijk_Alik_Bljk_HHS_BH_UserArgs_MT128x64x64_MI16x16x1_SN_LDSB1_CLR1_GSU0_GSUC0_GSUWGMRR0_K1_LBSPPA256_LBSPPB128_MIWT4_2_PLR1_SU32_SUM0_SUS256_SKXCCM6_VWA2_VWB1_WGM1_WGMXCC1_WGMXCCGn1
    SolutionIndex: 79
    SolutionNameMin: Cijk_Alik_Bljk_HHS_BH_UserArgs_MT128x64x64_MI16x16x1_SN_LDSB1_CLR1_GSU0_GSUC0_GSUWGMRR0_K1_LBSPPA512_LBSPPB128_MIWT4_2_PLR1_SU32_SUM0_SUS256_SKXCCM6_VWA4_VWB1_WGM1_WGMXCC1_WGMXCCGn1
    SolutionIndex: 80
    SolutionNameMin: Cijk_Alik_Bljk_HHS_BH_UserArgs_MT128x64x64_MI16x16x1_SN_LDSB1_CLR1_GSU0_GSUC0_GSUWGMRR0_K1_LBSPPA256_LBSPPB256_MIWT4_2_PLR1_SU32_SUM0_SUS256_SKXCCM6_VWA2_VWB2_WGM1_WGMXCC1_WGMXCCGn1
    SolutionIndex: 81
    SolutionNameMin: Cijk_Alik_Bljk_HHS_BH_UserArgs_MT128x64x64_MI16x16x1_SN_LDSB1_CLR1_GSU0_GSUC0_GSUWGMRR0_K1_LBSPPA512_LBSPPB256_MIWT4_2_PLR1_SU32_SUM0_SUS256_SKXCCM6_VWA4_VWB2_WGM1_WGMXCC1_WGMXCCGn1
    SolutionIndex: 82
    SolutionNameMin: Cijk_Alik_Bljk_HHS_BH_UserArgs_MT128x64x64_MI16x16x1_SN_LDSB1_CLR1_GSU0_GSUC0_GSUWGMRR0_K1_LBSPPA256_LBSPPB256_MIWT4_2_PLR2_SU32_SUM0_SUS256_SKXCCM6_VWA2_VWB2_WGM1_WGMXCC1_WGMXCCGn1
    SolutionIndex: 83
    SolutionNameMin: Cijk_Alik_Bljk_HHS_BH_UserArgs_MT128x64x64_MI16x16x1_SN_LDSB1_CLR1_GSU0_GSUC0_GSUWGMRR0_K1_LBSPPA512_LBSPPB256_MIWT4_2_PLR2_SU32_SUM0_SUS256_SKXCCM6_VWA4_VWB2_WGM1_WGMXCC1_WGMXCCGn1
    SolutionIndex: 84
    SolutionNameMin: Cijk_Alik_Bljk_HHS_BH_UserArgs_MT128x64x64_MI16x16x1_SN_LDSB1_CLR1_GSU0_GSUC0_GSUWGMRR0_K1_LBSPPA256_LBSPPB128_MIWT4_2_PLR1_SU32_SUM0_SUS256_SKXCCM6_VWA2_VWB1_WGM4_WGMXCC1_WGMXCCGn1
    SolutionIndex: 85
    SolutionNameMin: Cijk_Alik_Bljk_HHS_BH_UserArgs_MT128x64x64_MI16x16x1_SN_LDSB1_CLR1_GSU0_GSUC0_GSUWGMRR0_K1_LBSPPA256_LBSPPB256_MIWT4_2_PLR1_SU32_SUM0_SUS256_SKXCCM6_VWA2_VWB2_WGM4_WGMXCC1_WGMXCCGn1
    SolutionIndex: 86
    SolutionNameMin: Cijk_Alik_Bljk_HHS_BH_UserArgs_MT128x64x64_MI16x16x1_SN_LDSB1_CLR1_GSU0_GSUC0_GSUWGMRR0_K1_LBSPPA512_LBSPPB256_MIWT4_2_PLR2_SU32_SUM0_SUS256_SKXCCM6_VWA4_VWB2_WGM4_WGMXCC1_WGMXCCGn1
    SolutionIndex: 87
    SolutionNameMin: Cijk_Alik_Bljk_HHS_BH_UserArgs_MT128x64x64_MI16x16x1_SN_LDSB1_CLR1_GSU0_GSUC0_GSUWGMRR0_K1_LBSPPA256_LBSPPB128_MIWT4_2_PLR1_SU32_SUM0_SUS256_SKXCCM6_VWA2_VWB1_WGM8_WGMXCC1_WGMXCCGn1
    SolutionIndex: 88
    SolutionNameMin: Cijk_Alik_Bljk_HHS_BH_UserArgs_MT128x64x64_MI16x16x1_SN_LDSB1_CLR1_GSU0_GSUC0_GSUWGMRR0_K1_LBSPPA512_LBSPPB128_MIWT4_2_PLR1_SU32_SUM0_SUS256_SKXCCM6_VWA4_VWB1_WGM8_WGMXCC1_WGMXCCGn1
    SolutionIndex: 89
    SolutionNameMin: Cijk_Alik_Bljk_HHS_BH_UserArgs_MT128x64x64_MI16x16x1_SN_LDSB1_CLR1_GSU0_GSUC0_GSUWGMRR0_K1_LBSPPA256_LBSPPB256_MIWT4_2_PLR1_SU32_SUM0_SUS256_SKXCCM6_VWA2_VWB2_WGM8_WGMXCC1_WGMXCCGn1
    SolutionIndex: 90
    SolutionNameMin: Cijk_Alik_Bljk_HHS_BH_UserArgs_MT128x64x64_MI16x16x1_SN_LDSB1_CLR1_GSU0_GSUC0_GSUWGMRR0_K1_LBSPPA512_LBSPPB256_MIWT4_2_PLR1_SU32_SUM0_SUS256_SKXCCM6_VWA4_VWB2_WGM8_WGMXCC1_WGMXCCGn1
    SolutionIndex: 91
    SolutionNameMin: Cijk_Alik_Bljk_HHS_BH_UserArgs_MT128x64x64_MI16x16x1_SN_LDSB1_CLR1_GSU0_GSUC0_GSUWGMRR0_K1_LBSPPA512_LBSPPB128_MIWT4_2_PLR2_SU32_SUM0_SUS256_SKXCCM6_VWA4_VWB1_WGM8_WGMXCC1_WGMXCCGn1
    SolutionIndex: 92
    SolutionNameMin: Cijk_Alik_Bljk_HHS_BH_UserArgs_MT64x64x64_MI16x16x1_SN_LDSB1_CLR1_GSU0_GSUC0_GSUWGMRR0_K1_LBSPPA256_LBSPPB128_MIWT2_2_PLR1_SU32_SUM0_SUS256_SKXCCM6_VWA2_VWB1_WGM1_WGMXCC1_WGMXCCGn1
    SolutionIndex: 93
    SolutionNameMin: Cijk_Alik_Bljk_HHS_BH_UserArgs_MT64x64x64_MI16x16x1_SN_LDSB1_CLR1_GSU0_GSUC0_GSUWGMRR0_K1_LBSPPA256_LBSPPB256_MIWT2_2_PLR1_SU32_SUM0_SUS256_SKXCCM6_VWA2_VWB2_WGM1_WGMXCC1_WGMXCCGn1
    SolutionIndex: 94
    SolutionNameMin: Cijk_Alik_Bljk_HHS_BH_UserArgs_MT64x64x64_MI16x16x1_SN_LDSB1_CLR1_GSU0_GSUC0_GSUWGMRR0_K1_LBSPPA256_LBSPPB128_MIWT2_2_PLR1_SU32_SUM0_SUS256_SKXCCM6_VWA2_VWB1_WGM4_WGMXCC1_WGMXCCGn1
    SolutionIndex: 95
    SolutionNameMin: Cijk_Alik_Bljk_HHS_BH_UserArgs_MT64x64x64_MI16x16x1_SN_LDSB1_CLR1_GSU0_GSUC0_GSUWGMRR0_K1_LBSPPA256_LBSPPB128_MIWT2_2_PLR1_SU32_SUM0_SUS256_SKXCCM6_VWA2_VWB1_WGM8_WGMXCC1_WGMXCCGn1
    SolutionIndex: 96
    SolutionNameMin: Cijk_Alik_Bljk_HHS_BH_UserArgs_MT32x64x64_MI16x16x1_SN_LDSB0_CLR1_GSU0_GSUC0_GSUWGMRR0_K1_LBSPPA128_LBSPPB128_MIWT1_2_PLR1_SU32_SUM0_SUS256_SKXCCM6_VWA1_VWB1_WGM1_WGMXCC1_WGMXCCGn1
    SolutionIndex: 97
    SolutionNameMin: Cijk_Alik_Bljk_HHS_BH_UserArgs_MT32x64x64_MI16x16x1_SN_LDSB0_CLR1_GSU0_GSUC0_GSUWGMRR0_K1_LBSPPA128_LBSPPB256_MIWT1_2_PLR1_SU32_SUM0_SUS256_SKXCCM6_VWA1_VWB2_WGM1_WGMXCC1_WGMXCCGn1
    SolutionIndex: 98
    SolutionNameMin: Cijk_Alik_Bljk_HHS_BH_UserArgs_MT32x32x64_MI16x16x1_SN_LDSB0_CLR1_GSU0_GSUC0_GSUWGMRR0_K1_LBSPPA128_LBSPPB128_MIWT1_1_PLR1_SU32_SUM0_SUS256_SKXCCM6_VWA1_VWB1_WGM1_WGMXCC1_WGMXCCGn1
    SolutionIndex: 99
    SolutionNameMin: Cijk_Alik_Bljk_HHS_BH_UserArgs_MT32x128x128_MI16x16x1_SN_LDSB1_CLR1_GSU0_GSUC0_GSUWGMRR0_K1_LBSPPA256_LBSPPB256_MIWT1_4_PLR1_SU32_SUM0_SUS256_SKXCCM6_VWA1_VWB1_WGM1_WGMXCC1_WGMXCCGn1
    SolutionIndex: 100
    SolutionNameMin: Cijk_Alik_Bljk_HHS_BH_UserArgs_MT32x128x128_MI16x16x1_SN_LDSB1_CLR1_GSU0_GSUC0_GSUWGMRR0_K1_LBSPPA256_LBSPPB256_MIWT1_4_PLR2_SU32_SUM0_SUS256_SKXCCM6_VWA1_VWB1_WGM1_WGMXCC1_WGMXCCGn1
    SolutionIndex: 101
    SolutionNameMin: Cijk_Alik_Bljk_HHS_BH_UserArgs_MT64x64x128_MI16x16x1_SN_LDSB1_CLR1_GSU0_GSUC0_GSUWGMRR0_K1_LBSPPA256_LBSPPB256_MIWT2_2_PLR1_SU32_SUM0_SUS256_SKXCCM6_VWA1_VWB1_WGM1_WGMXCC1_WGMXCCGn1
    SolutionIndex: 102
    SolutionNameMin: Cijk_Alik_Bljk_HHS_BH_UserArgs_MT64x64x128_MI16x16x1_SN_LDSB1_CLR1_GSU0_GSUC0_GSUWGMRR0_K1_LBSPPA512_LBSPPB256_MIWT2_2_PLR1_SU32_SUM0_SUS256_SKXCCM6_VWA2_VWB1_WGM1_WGMXCC1_WGMXCCGn1
    SolutionIndex: 103
    SolutionNameMin: Cijk_Alik_Bljk_HHS_BH_UserArgs_MT64x64x128_MI16x16x1_SN_LDSB1_CLR1_GSU0_GSUC0_GSUWGMRR0_K1_LBSPPA512_LBSPPB512_MIWT2_2_PLR1_SU32_SUM0_SUS256_SKXCCM6_VWA2_VWB2_WGM1_WGMXCC1_WGMXCCGn1
    SolutionIndex: 104
    SolutionNameMin: Cijk_Alik_Bljk_HHS_BH_UserArgs_MT64x64x128_MI16x16x1_SN_LDSB1_CLR1_GSU0_GSUC0_GSUWGMRR0_K1_LBSPPA512_LBSPPB256_MIWT2_2_PLR2_SU32_SUM0_SUS256_SKXCCM6_VWA2_VWB1_WGM1_WGMXCC1_WGMXCCGn1
    SolutionIndex: 105
    SolutionNameMin: Cijk_Alik_Bljk_HHS_BH_UserArgs_MT64x64x128_MI16x16x1_SN_LDSB1_CLR1_GSU0_GSUC0_GSUWGMRR0_K1_LBSPPA512_LBSPPB512_MIWT2_2_PLR2_SU32_SUM0_SUS256_SKXCCM6_VWA2_VWB2_WGM1_WGMXCC1_WGMXCCGn1
    SolutionIndex: 106
    SolutionNameMin: Cijk_Alik_Bljk_HHS_BH_UserArgs_MT64x64x128_MI16x16x1_SN_LDSB1_CLR1_GSU0_GSUC0_GSUWGMRR0_K1_LBSPPA512_LBSPPB512_MIWT2_2_PLR1_SU32_SUM0_SUS256_SKXCCM6_VWA2_VWB2_WGM4_WGMXCC1_WGMXCCGn1
    SolutionIndex: 107
    SolutionNameMin: Cijk_Alik_Bljk_HHS_BH_UserArgs_MT64x64x128_MI16x16x1_SN_LDSB1_CLR1_GSU0_GSUC0_GSUWGMRR0_K1_LBSPPA512_LBSPPB256_MIWT2_2_PLR2_SU32_SUM0_SUS256_SKXCCM6_VWA2_VWB1_WGM4_WGMXCC1_WGMXCCGn1
    SolutionIndex: 108
    SolutionNameMin: Cijk_Alik_Bljk_HHS_BH_UserArgs_MT64x64x128_MI16x16x1_SN_LDSB1_CLR1_GSU0_GSUC0_GSUWGMRR0_K1_LBSPPA512_LBSPPB512_MIWT2_2_PLR2_SU32_SUM0_SUS256_SKXCCM6_VWA2_VWB2_WGM4_WGMXCC1_WGMXCCGn1
    SolutionIndex: 109
    SolutionNameMin: Cijk_Alik_Bljk_HHS_BH_UserArgs_MT64x64x128_MI16x16x1_SN_LDSB1_CLR1_GSU0_GSUC0_GSUWGMRR0_K1_LBSPPA512_LBSPPB256_MIWT2_2_PLR1_SU32_SUM0_SUS256_SKXCCM6_VWA2_VWB1_WGM8_WGMXCC1_WGMXCCGn1
    SolutionIndex: 110
    SolutionNameMin: Cijk_Alik_Bljk_HHS_BH_UserArgs_MT64x64x128_MI16x16x1_SN_LDSB1_CLR1_GSU0_GSUC0_GSUWGMRR0_K1_LBSPPA512_LBSPPB512_MIWT2_2_PLR1_SU32_SUM0_SUS256_SKXCCM6_VWA2_VWB2_WGM8_WGMXCC1_WGMXCCGn1
    SolutionIndex: 111
    SolutionNameMin: Cijk_Alik_Bljk_HHS_BH_UserArgs_MT64x64x128_MI16x16x1_SN_LDSB1_CLR1_GSU0_GSUC0_GSUWGMRR0_K1_LBSPPA256_LBSPPB256_MIWT2_2_PLR2_SU32_SUM0_SUS256_SKXCCM6_VWA1_VWB1_WGM8_WGMXCC1_WGMXCCGn1
    SolutionIndex: 112
    SolutionNameMin: Cijk_Alik_Bljk_HHS_BH_UserArgs_MT64x64x128_MI16x16x1_SN_LDSB1_CLR1_GSU0_GSUC0_GSUWGMRR0_K1_LBSPPA512_LBSPPB256_MIWT2_2_PLR2_SU32_SUM0_SUS256_SKXCCM6_VWA2_VWB1_WGM8_WGMXCC1_WGMXCCGn1
    SolutionIndex: 113
    SolutionNameMin: Cijk_Alik_Bljk_HHS_BH_UserArgs_MT64x64x128_MI16x16x1_SN_LDSB1_CLR1_GSU0_GSUC0_GSUWGMRR0_K1_LBSPPA256_LBSPPB512_MIWT2_2_PLR2_SU32_SUM0_SUS256_SKXCCM6_VWA1_VWB2_WGM8_WGMXCC1_WGMXCCGn1
    SolutionIndex: 114
    SolutionNameMin: Cijk_Alik_Bljk_HHS_BH_UserArgs_MT64x64x128_MI16x16x1_SN_LDSB1_CLR1_GSU0_GSUC0_GSUWGMRR0_K1_LBSPPA512_LBSPPB512_MIWT2_2_PLR2_SU32_SUM0_SUS256_SKXCCM6_VWA2_VWB2_WGM8_WGMXCC1_WGMXCCGn1
    SolutionIndex: 115
    SolutionNameMin: Cijk_Alik_Bljk_HHS_BH_UserArgs_MT32x64x128_MI16x16x1_SN_LDSB1_CLR1_GSU0_GSUC0_GSUWGMRR0_K1_LBSPPA256_LBSPPB512_MIWT1_2_PLR1_SU32_SUM0_SUS256_SKXCCM6_VWA1_VWB2_WGM1_WGMXCC1_WGMXCCGn1
    SolutionIndex: 116
    SolutionNameMin: Cijk_Alik_Bljk_HHS_BH_UserArgs_MT32x64x128_MI16x16x1_SN_LDSB1_CLR1_GSU0_GSUC0_GSUWGMRR0_K1_LBSPPA256_LBSPPB512_MIWT1_2_PLR2_SU32_SUM0_SUS256_SKXCCM6_VWA1_VWB2_WGM1_WGMXCC1_WGMXCCGn1
    SolutionIndex: 117
    SolutionNameMin: Cijk_Alik_Bljk_HHS_BH_UserArgs_MT32x64x128_MI16x16x1_SN_LDSB1_CLR1_GSU0_GSUC0_GSUWGMRR0_K1_LBSPPA256_LBSPPB512_MIWT1_2_PLR1_SU32_SUM0_SUS256_SKXCCM6_VWA1_VWB2_WGM4_WGMXCC1_WGMXCCGn1
    SolutionIndex: 118
    SolutionNameMin: Cijk_Alik_Bljk_HHS_BH_UserArgs_MT32x64x128_MI16x16x1_SN_LDSB1_CLR1_GSU0_GSUC0_GSUWGMRR0_K1_LBSPPA256_LBSPPB512_MIWT1_2_PLR2_SU32_SUM0_SUS256_SKXCCM6_VWA1_VWB2_WGM4_WGMXCC1_WGMXCCGn1
    SolutionIndex: 119
    SolutionNameMin: Cijk_Alik_Bljk_HHS_BH_UserArgs_MT32x64x128_MI16x16x1_SN_LDSB1_CLR1_GSU0_GSUC0_GSUWGMRR0_K1_LBSPPA256_LBSPPB512_MIWT1_2_PLR1_SU32_SUM0_SUS256_SKXCCM6_VWA1_VWB2_WGM8_WGMXCC1_WGMXCCGn1
    SolutionIndex: 120
    SolutionNameMin: Cijk_Alik_Bljk_HHS_BH_UserArgs_MT64x32x128_MI16x16x1_SN_LDSB1_CLR1_GSU0_GSUC0_GSUWGMRR0_K1_LBSPPA512_LBSPPB256_MIWT2_1_PLR2_SU32_SUM0_SUS256_SKXCCM6_VWA2_VWB1_WGM1_WGMXCC1_WGMXCCGn1
    SolutionIndex: 121
    SolutionNameMin: Cijk_Alik_Bljk_HHS_BH_UserArgs_MT32x32x128_MI16x16x1_SN_LDSB1_CLR1_GSU0_GSUC0_GSUWGMRR0_K1_LBSPPA256_LBSPPB256_MIWT1_1_PLR1_SU32_SUM0_SUS256_SKXCCM6_VWA1_VWB1_WGM1_WGMXCC1_WGMXCCGn1
    SolutionIndex: 122
    SolutionNameMin: Cijk_Alik_Bljk_HHS_BH_UserArgs_MT32x32x128_MI16x16x1_SN_LDSB1_CLR1_GSU0_GSUC0_GSUWGMRR0_K1_LBSPPA256_LBSPPB256_MIWT1_1_PLR2_SU32_SUM0_SUS256_SKXCCM6_VWA1_VWB1_WGM1_WGMXCC1_WGMXCCGn1
    SolutionIndex: 123
    SolutionNameMin: Cijk_Alik_Bljk_HHS_BH_UserArgs_MT32x32x128_MI16x16x1_SN_LDSB1_CLR1_GSU0_GSUC0_GSUWGMRR0_K1_LBSPPA256_LBSPPB256_MIWT1_1_PLR2_SU32_SUM0_SUS256_SKXCCM6_VWA1_VWB1_WGM4_WGMXCC1_WGMXCCGn1
    SolutionIndex: 124
    SolutionNameMin: Cijk_Alik_Bljk_HHS_BH_UserArgs_MT32x32x32_MI16x16x1_SN_LDSB0_CLR1_GSU0_GSUC0_GSUWGMRR0_K1_LBSPPA128_LBSPPB128_MIWT1_1_PLR1_SU32_SUM0_SUS256_SKXCCM0_VWA1_VWB1_WGM4_WGMXCC1_WGMXCCGn1
- - - [128, 128, 1, 128, 128, 128, 128, 128]
    - [26, 0.089]
  - - [128, 128, 1, 256, 128, 128, 256, 256]
    - [27, 0.167]
  - - [128, 128, 1, 512, 128, 128, 512, 512]
    - [27, 0.288]
  - - [128, 128, 1, 1024, 128, 128, 1024, 1024]
    - [37, 0.463]
  - - [128, 128, 1, 2048, 128, 128, 2048, 2048]
    - [35, 0.686]
  - - [128, 128, 1, 4096, 128, 128, 4096, 4096]
    - [98, 1.172]
  - - [128, 128, 1, 8192, 128, 128, 8192, 8192]
    - [35, 1.862]
  - - [128, 256, 1, 128, 128, 128, 128, 128]
    - [36, 0.185]
  - - [128, 256, 1, 256, 128, 128, 256, 256]
    - [35, 0.341]
  - - [128, 256, 1, 512, 128, 128, 512, 512]
    - [35, 0.597]
  - - [128, 256, 1, 1024, 128, 128, 1024, 1024]
    - [121, 0.926]
  - - [128, 256, 1, 2048, 128, 128, 2048, 2048]
    - [36, 1.334]
  - - [128, 256, 1, 4096, 128, 128, 4096, 4096]
    - [98, 2.325]
  - - [128, 256, 1, 8192, 128, 128, 8192, 8192]
    - [122, 3.695]
  - - [128, 512, 1, 128, 128, 128, 128, 128]
    - [25, 0.37]
  - - [128, 512, 1, 256, 128, 128, 256, 256]
    - [25, 0.687]
  - - [128, 512, 1, 512, 128, 128, 512, 512]
    - [25, 1.193]
  - - [128, 512, 1, 1024, 128, 128, 1024, 1024]
    - [35, 1.864]
  - - [128, 512, 1, 2048, 128, 128, 2048, 2048]
    - [36, 2.633]
  - - [128, 512, 1, 4096, 128, 128, 4096, 4096]
    - [96, 3.967]
  - - [128, 512, 1, 8192, 128, 128, 8192, 8192]
    - [120, 6.0]
  - - [128, 1024, 1, 128, 128, 128, 128, 128]
    - [98, 0.696]
  - - [128, 1024, 1, 256, 128, 128, 256, 256]
    - [25, 1.321]
  - - [128, 1024, 1, 512, 128, 128, 512, 512]
    - [25, 2.311]
  - - [128, 1024, 1, 1024, 128, 128, 1024, 1024]
    - [36, 3.638]
  - - [128, 1024, 1, 2048, 128, 128, 2048, 2048]
    - [32, 4.422]
  - - [128, 1024, 1, 4096, 128, 128, 4096, 4096]
    - [121, 6.667]
  - - [128, 1024, 1, 8192, 128, 128, 8192, 8192]
    - [104, 9.44]
  - - [128, 2048, 1, 128, 128, 128, 128, 128]
    - [24, 1.357]
  - - [128, 2048, 1, 256, 128, 128, 256, 256]
    - [24, 2.436]
  - - [128, 2048, 1, 512, 128, 128, 512, 512]
    - [22, 4.053]
  - - [128, 2048, 1, 1024, 128, 128, 1024, 1024]
    - [33, 6.056]
  - - [128, 2048, 1, 2048, 128, 128, 2048, 2048]
    - [105, 7.247]
  - - [128, 2048, 1, 4096, 128, 128, 4096, 4096]
    - [120, 10.478]
  - - [128, 2048, 1, 8192, 128, 128, 8192, 8192]
    - [105, 13.276]
  - - [128, 4096, 1, 128, 128, 128, 128, 128]
    - [21, 2.448]
  - - [128, 4096, 1, 256, 128, 128, 256, 256]
    - [20, 4.265]
  - - [128, 4096, 1, 512, 128, 128, 512, 512]
    - [20, 6.847]
  - - [128, 4096, 1, 1024, 128, 128, 1024, 1024]
    - [29, 9.947]
  - - [128, 4096, 1, 2048, 128, 128, 2048, 2048]
    - [101, 11.671]
  - - [128, 4096, 1, 4096, 128, 128, 4096, 4096]
    - [107, 13.695]
  - - [128, 4096, 1, 8192, 128, 128, 8192, 8192]
    - [83, 15.798]
  - - [128, 8192, 1, 128, 128, 128, 128, 128]
    - [14, 3.901]
  - - [128, 8192, 1, 256, 128, 128, 256, 256]
    - [14, 6.707]
  - - [128, 8192, 1, 512, 128, 128, 512, 512]
    - [16, 10.54]
  - - [128, 8192, 1, 1024, 128, 128, 1024, 1024]
    - [92, 11.786]
  - - [128, 8192, 1, 2048, 128, 128, 2048, 2048]
    - [18, 13.822]
  - - [128, 8192, 1, 4096, 128, 128, 4096, 4096]
    - [91, 17.213]
  - - [128, 8192, 1, 8192, 128, 128, 8192, 8192]
    - [7, 19.675]
  - - [256, 128, 1, 128, 256, 256, 128, 128]
    - [98, 0.184]
  - - [256, 128, 1, 256, 256, 256, 256, 256]
    - [25, 0.346]
  - - [256, 128, 1, 512, 256, 256, 512, 512]
    - [25, 0.603]
  - - [256, 128, 1, 1024, 256, 256, 1024, 1024]
    - [35, 0.95]
  - - [256, 128, 1, 2048, 256, 256, 2048, 2048]
    - [36, 1.337]
  - - [256, 128, 1, 4096, 256, 256, 4096, 4096]
    - [98, 2.341]
  - - [256, 128, 1, 8192, 256, 256, 8192, 8192]
    - [122, 3.704]
  - - [256, 256, 1, 128, 256, 256, 128, 128]
    - [25, 0.371]
  - - [256, 256, 1, 256, 256, 256, 256, 256]
    - [25, 0.688]
  - - [256, 256, 1, 512, 256, 256, 512, 512]
    - [25, 1.162]
  - - [256, 256, 1, 1024, 256, 256, 1024, 1024]
    - [35, 1.831]
  - - [256, 256, 1, 2048, 256, 256, 2048, 2048]
    - [36, 2.636]
  - - [256, 256, 1, 4096, 256, 256, 4096, 4096]
    - [97, 3.975]
  - - [256, 256, 1, 8192, 256, 256, 8192, 8192]
    - [31, 6.032]
  - - [256, 512, 1, 128, 256, 256, 128, 128]
    - [25, 0.729]
  - - [256, 512, 1, 256, 256, 256, 256, 256]
    - [25, 1.36]
  - - [256, 512, 1, 512, 256, 256, 512, 512]
    - [25, 2.291]
  - - [256, 512, 1, 1024, 256, 256, 1024, 1024]
    - [35, 3.675]
  - - [256, 512, 1, 2048, 256, 256, 2048, 2048]
    - [120, 4.414]
  - - [256, 512, 1, 4096, 256, 256, 4096, 4096]
    - [122, 6.733]
  - - [256, 512, 1, 8192, 256, 256, 8192, 8192]
    - [28, 9.32]
  - - [256, 1024, 1, 128, 256, 256, 128, 128]
    - [24, 1.385]
  - - [256, 1024, 1, 256, 256, 256, 256, 256]
    - [24, 2.439]
  - - [256, 1024, 1, 512, 256, 256, 512, 512]
    - [22, 4.034]
  - - [256, 1024, 1, 1024, 256, 256, 1024, 1024]
    - [34, 6.089]
  - - [256, 1024, 1, 2048, 256, 256, 2048, 2048]
    - [103, 7.285]
  - - [256, 1024, 1, 4096, 256, 256, 4096, 4096]
    - [115, 10.626]
  - - [256, 1024, 1, 8192, 256, 256, 8192, 8192]
    - [81, 11.823]
  - - [256, 2048, 1, 128, 256, 256, 128, 128]
    - [21, 2.451]
  - - [256, 2048, 1, 256, 256, 256, 256, 256]
    - [20, 4.281]
  - - [256, 2048, 1, 512, 256, 256, 512, 512]
    - [28, 6.807]
  - - [256, 2048, 1, 1024, 256, 256, 1024, 1024]
    - [28, 9.895]
  - - [256, 2048, 1, 2048, 256, 256, 2048, 2048]
    - [105, 11.767]
  - - [256, 2048, 1, 4096, 256, 256, 4096, 4096]
    - [102, 13.743]
  - - [256, 2048, 1, 8192, 256, 256, 8192, 8192]
    - [49, 15.834]
  - - [256, 4096, 1, 128, 256, 256, 128, 128]
    - [17, 3.956]
  - - [256, 4096, 1, 256, 256, 256, 256, 256]
    - [17, 6.786]
  - - [256, 4096, 1, 512, 256, 256, 512, 512]
    - [17, 10.473]
  - - [256, 4096, 1, 1024, 256, 256, 1024, 1024]
    - [92, 11.954]
  - - [256, 4096, 1, 2048, 256, 256, 2048, 2048]
    - [105, 15.302]
  - - [256, 4096, 1, 4096, 256, 256, 4096, 4096]
    - [86, 17.127]
  - - [256, 4096, 1, 8192, 256, 256, 8192, 8192]
    - [1, 18.665]
  - - [256, 8192, 1, 128, 256, 256, 128, 128]
    - [6, 5.928]
  - - [256, 8192, 1, 256, 256, 256, 256, 256]
    - [44, 9.958]
  - - [256, 8192, 1, 512, 256, 256, 512, 512]
    - [44, 15.452]
  - - [256, 8192, 1, 1024, 256, 256, 1024, 1024]
    - [81, 14.978]
  - - [256, 8192, 1, 2048, 256, 256, 2048, 2048]
    - [77, 17.905]
  - - [256, 8192, 1, 4096, 256, 256, 4096, 4096]
    - [60, 20.89]
  - - [256, 8192, 1, 8192, 256, 256, 8192, 8192]
    - [3, 22.77]
  - - [512, 128, 1, 128, 512, 512, 128, 128]
    - [35, 0.368]
  - - [512, 128, 1, 256, 512, 512, 256, 256]
    - [25, 0.684]
  - - [512, 128, 1, 512, 512, 512, 512, 512]
    - [25, 1.194]
  - - [512, 128, 1, 1024, 512, 512, 1024, 1024]
    - [35, 1.883]
  - - [512, 128, 1, 2048, 512, 512, 2048, 2048]
    - [36, 2.628]
  - - [512, 128, 1, 4096, 512, 512, 4096, 4096]
    - [98, 3.984]
  - - [512, 128, 1, 8192, 512, 512, 8192, 8192]
    - [116, 6.03]
  - - [512, 256, 1, 128, 512, 512, 128, 128]
    - [25, 0.719]
  - - [512, 256, 1, 256, 512, 512, 256, 256]
    - [25, 1.335]
  - - [512, 256, 1, 512, 512, 512, 512, 512]
    - [25, 2.305]
  - - [512, 256, 1, 1024, 512, 512, 1024, 1024]
    - [36, 3.652]
  - - [512, 256, 1, 2048, 512, 512, 2048, 2048]
    - [31, 4.409]
  - - [512, 256, 1, 4096, 512, 512, 4096, 4096]
    - [123, 6.576]
  - - [512, 256, 1, 8192, 512, 512, 8192, 8192]
    - [28, 9.272]
  - - [512, 512, 1, 128, 512, 512, 128, 128]
    - [24, 1.366]
  - - [512, 512, 1, 256, 512, 512, 256, 256]
    - [23, 2.431]
  - - [512, 512, 1, 512, 512, 512, 512, 512]
    - [23, 4.045]
  - - [512, 512, 1, 1024, 512, 512, 1024, 1024]
    - [34, 6.013]
  - - [512, 512, 1, 2048, 512, 512, 2048, 2048]
    - [104, 7.239]
  - - [512, 512, 1, 4096, 512, 512, 4096, 4096]
    - [117, 10.409]
  - - [512, 512, 1, 8192, 512, 512, 8192, 8192]
    - [99, 11.723]
  - - [512, 1024, 1, 128, 512, 512, 128, 128]
    - [21, 2.439]
  - - [512, 1024, 1, 256, 512, 512, 256, 256]
    - [21, 4.313]
  - - [512, 1024, 1, 512, 512, 512, 512, 512]
    - [21, 6.917]
  - - [512, 1024, 1, 1024, 512, 512, 1024, 1024]
    - [29, 9.991]
  - - [512, 1024, 1, 2048, 512, 512, 2048, 2048]
    - [105, 11.695]
  - - [512, 1024, 1, 4096, 512, 512, 4096, 4096]
    - [113, 13.493]
  - - [512, 1024, 1, 8192, 512, 512, 8192, 8192]
    - [66, 15.39]
  - - [512, 2048, 1, 128, 512, 512, 128, 128]
    - [80, 3.871]
  - - [512, 2048, 1, 256, 512, 512, 256, 256]
    - [78, 6.673]
  - - [512, 2048, 1, 512, 512, 512, 512, 512]
    - [80, 10.409]
  - - [512, 2048, 1, 1024, 512, 512, 1024, 1024]
    - [93, 12.015]
  - - [512, 2048, 1, 2048, 512, 512, 2048, 2048]
    - [105, 15.587]
  - - [512, 2048, 1, 4096, 512, 512, 4096, 4096]
    - [52, 16.04]
  - - [512, 2048, 1, 8192, 512, 512, 8192, 8192]
    - [69, 17.384]
  - - [512, 4096, 1, 128, 512, 512, 128, 128]
    - [6, 6.008]
  - - [512, 4096, 1, 256, 512, 512, 256, 256]
    - [12, 9.967]
  - - [512, 4096, 1, 512, 512, 512, 512, 512]
    - [53, 15.267]
  - - [512, 4096, 1, 1024, 512, 512, 1024, 1024]
    - [79, 15.343]
  - - [512, 4096, 1, 2048, 512, 512, 2048, 2048]
    - [82, 17.454]
  - - [512, 4096, 1, 4096, 512, 512, 4096, 4096]
    - [42, 19.314]
  - - [512, 4096, 1, 8192, 512, 512, 8192, 8192]
    - [0, 21.112]
  - - [512, 8192, 1, 128, 512, 512, 128, 128]
    - [80, 5.802]
  - - [512, 8192, 1, 256, 512, 512, 256, 256]
    - [79, 9.114]
  - - [512, 8192, 1, 512, 512, 512, 512, 512]
    - [83, 13.845]
  - - [512, 8192, 1, 1024, 512, 512, 1024, 1024]
    - [88, 18.018]
  - - [512, 8192, 1, 2048, 512, 512, 2048, 2048]
    - [48, 20.947]
  - - [512, 8192, 1, 4096, 512, 512, 4096, 4096]
    - [3, 22.29]
  - - [512, 8192, 1, 8192, 512, 512, 8192, 8192]
    - [2, 22.371]
  - - [1024, 128, 1, 128, 1024, 1024, 128, 128]
    - [25, 0.716]
  - - [1024, 128, 1, 256, 1024, 1024, 256, 256]
    - [25, 1.34]
  - - [1024, 128, 1, 512, 1024, 1024, 512, 512]
    - [25, 2.299]
  - - [1024, 128, 1, 1024, 1024, 1024, 1024, 1024]
    - [36, 3.683]
  - - [1024, 128, 1, 2048, 1024, 1024, 2048, 2048]
    - [34, 4.43]
  - - [1024, 128, 1, 4096, 1024, 1024, 4096, 4096]
    - [96, 6.585]
  - - [1024, 128, 1, 8192, 1024, 1024, 8192, 8192]
    - [107, 9.323]
  - - [1024, 256, 1, 128, 1024, 1024, 128, 128]
    - [24, 1.342]
  - - [1024, 256, 1, 256, 1024, 1024, 256, 256]
    - [24, 2.443]
  - - [1024, 256, 1, 512, 1024, 1024, 512, 512]
    - [22, 4.093]
  - - [1024, 256, 1, 1024, 1024, 1024, 1024, 1024]
    - [34, 6.078]
  - - [1024, 256, 1, 2048, 1024, 1024, 2048, 2048]
    - [23, 7.322]
  - - [1024, 256, 1, 4096, 1024, 1024, 4096, 4096]
    - [118, 10.435]
  - - [1024, 256, 1, 8192, 1024, 1024, 8192, 8192]
    - [100, 11.932]
  - - [1024, 512, 1, 128, 1024, 1024, 128, 128]
    - [20, 2.415]
  - - [1024, 512, 1, 256, 1024, 1024, 256, 256]
    - [92, 4.154]
  - - [1024, 512, 1, 512, 1024, 1024, 512, 512]
    - [20, 6.725]
  - - [1024, 512, 1, 1024, 1024, 1024, 1024, 1024]
    - [28, 9.893]
  - - [1024, 512, 1, 2048, 1024, 1024, 2048, 2048]
    - [106, 11.457]
  - - [1024, 512, 1, 4096, 1024, 1024, 4096, 4096]
    - [107, 13.728]
  - - [1024, 512, 1, 8192, 1024, 1024, 8192, 8192]
    - [47, 15.169]
  - - [1024, 1024, 1, 128, 1024, 1024, 128, 128]
    - [16, 3.955]
  - - [1024, 1024, 1, 256, 1024, 1024, 256, 256]
    - [17, 6.695]
  - - [1024, 1024, 1, 512, 1024, 1024, 512, 512]
    - [16, 10.328]
  - - [1024, 1024, 1, 1024, 1024, 1024, 1024, 1024]
    - [92, 11.961]
  - - [1024, 1024, 1, 2048, 1024, 1024, 2048, 2048]
    - [114, 15.219]
  - - [1024, 1024, 1, 4096, 1024, 1024, 4096, 4096]
    - [45, 16.284]
  - - [1024, 1024, 1, 8192, 1024, 1024, 8192, 8192]
    - [47, 17.213]
  - - [1024, 2048, 1, 128, 1024, 1024, 128, 128]
    - [4, 5.831]
  - - [1024, 2048, 1, 256, 1024, 1024, 256, 256]
    - [48, 9.792]
  - - [1024, 2048, 1, 512, 1024, 1024, 512, 512]
    - [46, 15.184]
  - - [1024, 2048, 1, 1024, 1024, 1024, 1024, 1024]
    - [79, 15.265]
  - - [1024, 2048, 1, 2048, 1024, 1024, 2048, 2048]
    - [73, 17.113]
  - - [1024, 2048, 1, 4096, 1024, 1024, 4096, 4096]
    - [56, 17.905]
  - - [1024, 2048, 1, 8192, 1024, 1024, 8192, 8192]
    - [10, 18.557]
  - - [1024, 4096, 1, 128, 1024, 1024, 128, 128]
    - [79, 5.802]
  - - [1024, 4096, 1, 256, 1024, 1024, 256, 256]
    - [79, 9.071]
  - - [1024, 4096, 1, 512, 1024, 1024, 512, 512]
    - [79, 14.483]
  - - [1024, 4096, 1, 1024, 1024, 1024, 1024, 1024]
    - [77, 17.877]
  - - [1024, 4096, 1, 2048, 1024, 1024, 2048, 2048]
    - [48, 20.068]
  - - [1024, 4096, 1, 4096, 1024, 1024, 4096, 4096]
    - [47, 20.673]
  - - [1024, 4096, 1, 8192, 1024, 1024, 8192, 8192]
    - [9, 19.952]
  - - [1024, 8192, 1, 128, 1024, 1024, 128, 128]
    - [78, 7.366]
  - - [1024, 8192, 1, 256, 1024, 1024, 256, 256]
    - [87, 11.643]
  - - [1024, 8192, 1, 512, 1024, 1024, 512, 512]
    - [45, 17.344]
  - - [1024, 8192, 1, 1024, 1024, 1024, 1024, 1024]
    - [45, 21.63]
  - - [1024, 8192, 1, 2048, 1024, 1024, 2048, 2048]
    - [49, 22.095]
  - - [1024, 8192, 1, 4096, 1024, 1024, 4096, 4096]
    - [46, 23.324]
  - - [1024, 8192, 1, 8192, 1024, 1024, 8192, 8192]
    - [64, 24.192]
  - - [2048, 128, 1, 128, 2048, 2048, 128, 128]
    - [24, 1.373]
  - - [2048, 128, 1, 256, 2048, 2048, 256, 256]
    - [24, 2.487]
  - - [2048, 128, 1, 512, 2048, 2048, 512, 512]
    - [22, 4.089]
  - - [2048, 128, 1, 1024, 2048, 2048, 1024, 1024]
    - [31, 6.003]
  - - [2048, 128, 1, 2048, 2048, 2048, 2048, 2048]
    - [22, 7.319]
  - - [2048, 128, 1, 4096, 2048, 2048, 4096, 4096]
    - [119, 10.443]
  - - [2048, 128, 1, 8192, 2048, 2048, 8192, 8192]
    - [106, 13.064]
  - - [2048, 256, 1, 128, 2048, 2048, 128, 128]
    - [20, 2.434]
  - - [2048, 256, 1, 256, 2048, 2048, 256, 256]
    - [21, 4.316]
  - - [2048, 256, 1, 512, 2048, 2048, 512, 512]
    - [20, 6.859]
  - - [2048, 256, 1, 1024, 2048, 2048, 1024, 1024]
    - [30, 9.67]
  - - [2048, 256, 1, 2048, 2048, 2048, 2048, 2048]
    - [94, 11.546]
  - - [2048, 256, 1, 4096, 2048, 2048, 4096, 4096]
    - [114, 13.685]
  - - [2048, 256, 1, 8192, 2048, 2048, 8192, 8192]
    - [71, 15.811]
  - - [2048, 512, 1, 128, 2048, 2048, 128, 128]
    - [16, 3.972]
  - - [2048, 512, 1, 256, 2048, 2048, 256, 256]
    - [16, 6.78]
  - - [2048, 512, 1, 512, 2048, 2048, 512, 512]
    - [16, 10.473]
  - - [2048, 512, 1, 1024, 2048, 2048, 1024, 1024]
    - [106, 11.819]
  - - [2048, 512, 1, 2048, 2048, 2048, 2048, 2048]
    - [109, 15.513]
  - - [2048, 512, 1, 4096, 2048, 2048, 4096, 4096]
    - [52, 16.584]
  - - [2048, 512, 1, 8192, 2048, 2048, 8192, 8192]
    - [49, 17.219]
  - - [2048, 1024, 1, 128, 2048, 2048, 128, 128]
    - [48, 5.847]
  - - [2048, 1024, 1, 256, 2048, 2048, 256, 256]
    - [13, 10.005]
  - - [2048, 1024, 1, 512, 2048, 2048, 512, 512]
    - [44, 15.421]
  - - [2048, 1024, 1, 1024, 2048, 2048, 1024, 1024]
    - [90, 15.428]
  - - [2048, 1024, 1, 2048, 2048, 2048, 2048, 2048]
    - [76, 17.494]
  - - [2048, 1024, 1, 4096, 2048, 2048, 4096, 4096]
    - [51, 19.354]
  - - [2048, 1024, 1, 8192, 2048, 2048, 8192, 8192]
    - [49, 20.202]
  - - [2048, 2048, 1, 128, 2048, 2048, 128, 128]
    - [78, 5.831]
  - - [2048, 2048, 1, 256, 2048, 2048, 256, 256]
    - [19, 8.901]
  - - [2048, 2048, 1, 512, 2048, 2048, 512, 512]
    - [81, 14.206]
  - - [2048, 2048, 1, 1024, 2048, 2048, 1024, 1024]
    - [71, 17.615]
  - - [2048, 2048, 1, 2048, 2048, 2048, 2048, 2048]
    - [45, 20.317]
  - - [2048, 2048, 1, 4096, 2048, 2048, 4096, 4096]
    - [45, 22.161]
  - - [2048, 2048, 1, 8192, 2048, 2048, 8192, 8192]
    - [45, 20.806]
  - - [2048, 4096, 1, 128, 2048, 2048, 128, 128]
    - [80, 7.39]
  - - [2048, 4096, 1, 256, 2048, 2048, 256, 256]
    - [78, 11.903]
  - - [2048, 4096, 1, 512, 2048, 2048, 512, 512]
    - [49, 16.612]
  - - [2048, 4096, 1, 1024, 2048, 2048, 1024, 1024]
    - [44, 20.417]
  - - [2048, 4096, 1, 2048, 2048, 2048, 2048, 2048]
    - [46, 22.613]
  - - [2048, 4096, 1, 4096, 2048, 2048, 4096, 4096]
    - [45, 24.657]
  - - [2048, 4096, 1, 8192, 2048, 2048, 8192, 8192]
    - [47, 25.308]
  - - [2048, 8192, 1, 128, 2048, 2048, 128, 128]
    - [78, 9.138]
  - - [2048, 8192, 1, 256, 2048, 2048, 256, 256]
    - [47, 14.339]
  - - [2048, 8192, 1, 512, 2048, 2048, 512, 512]
    - [47, 19.467]
  - - [2048, 8192, 1, 1024, 2048, 2048, 1024, 1024]
    - [64, 22.303]
  - - [2048, 8192, 1, 2048, 2048, 2048, 2048, 2048]
    - [69, 22.806]
  - - [2048, 8192, 1, 4096, 2048, 2048, 4096, 4096]
    - [45, 27.951]
  - - [2048, 8192, 1, 8192, 2048, 2048, 8192, 8192]
    - [67, 28.687]
  - - [4096, 128, 1, 128, 4096, 4096, 128, 128]
    - [20, 2.457]
  - - [4096, 128, 1, 256, 4096, 4096, 256, 256]
    - [21, 4.293]
  - - [4096, 128, 1, 512, 4096, 4096, 512, 512]
    - [21, 6.913]
  - - [4096, 128, 1, 1024, 4096, 4096, 1024, 1024]
    - [28, 10.012]
  - - [4096, 128, 1, 2048, 4096, 4096, 2048, 2048]
    - [108, 11.374]
  - - [4096, 128, 1, 4096, 4096, 4096, 4096, 4096]
    - [112, 13.784]
  - - [4096, 128, 1, 8192, 4096, 4096, 8192, 8192]
    - [47, 15.498]
  - - [4096, 256, 1, 128, 4096, 4096, 128, 128]
    - [16, 3.959]
  - - [4096, 256, 1, 256, 4096, 4096, 256, 256]
    - [16, 6.788]
  - - [4096, 256, 1, 512, 4096, 4096, 512, 512]
    - [78, 10.437]
  - - [4096, 256, 1, 1024, 4096, 4096, 1024, 1024]
    - [95, 11.852]
  - - [4096, 256, 1, 2048, 4096, 4096, 2048, 2048]
    - [106, 15.284]
  - - [4096, 256, 1, 4096, 4096, 4096, 4096, 4096]
    - [61, 16.887]
  - - [4096, 256, 1, 8192, 4096, 4096, 8192, 8192]
    - [72, 18.562]
  - - [4096, 512, 1, 128, 4096, 4096, 128, 128]
    - [4, 5.801]
  - - [4096, 512, 1, 256, 4096, 4096, 256, 256]
    - [44, 9.969]
  - - [4096, 512, 1, 512, 4096, 4096, 512, 512]
    - [63, 15.189]
  - - [4096, 512, 1, 1024, 4096, 4096, 1024, 1024]
    - [74, 14.977]
  - - [4096, 512, 1, 2048, 4096, 4096, 2048, 2048]
    - [76, 17.686]
  - - [4096, 512, 1, 4096, 4096, 4096, 4096, 4096]
    - [39, 20.516]
  - - [4096, 512, 1, 8192, 4096, 4096, 8192, 8192]
    - [39, 21.416]
  - - [4096, 1024, 1, 128, 4096, 4096, 128, 128]
    - [103, 5.721]
  - - [4096, 1024, 1, 256, 4096, 4096, 256, 256]
    - [79, 9.169]
  - - [4096, 1024, 1, 512, 4096, 4096, 512, 512]
    - [90, 14.124]
  - - [4096, 1024, 1, 1024, 4096, 4096, 1024, 1024]
    - [57, 17.796]
  - - [4096, 1024, 1, 2048, 4096, 4096, 2048, 2048]
    - [55, 20.76]
  - - [4096, 1024, 1, 4096, 4096, 4096, 4096, 4096]
    - [49, 22.689]
  - - [4096, 1024, 1, 8192, 4096, 4096, 8192, 8192]
    - [49, 22.795]
  - - [4096, 2048, 1, 128, 4096, 4096, 128, 128]
    - [80, 7.491]
  - - [4096, 2048, 1, 256, 4096, 4096, 256, 256]
    - [78, 11.756]
  - - [4096, 2048, 1, 512, 4096, 4096, 512, 512]
    - [64, 16.879]
  - - [4096, 2048, 1, 1024, 4096, 4096, 1024, 1024]
    - [54, 20.996]
  - - [4096, 2048, 1, 2048, 4096, 4096, 2048, 2048]
    - [46, 23.055]
  - - [4096, 2048, 1, 4096, 4096, 4096, 4096, 4096]
    - [46, 24.478]
  - - [4096, 2048, 1, 8192, 4096, 4096, 8192, 8192]
    - [45, 25.177]
  - - [4096, 4096, 1, 128, 4096, 4096, 128, 128]
    - [80, 9.188]
  - - [4096, 4096, 1, 256, 4096, 4096, 256, 256]
    - [3, 13.958]
  - - [4096, 4096, 1, 512, 4096, 4096, 512, 512]
    - [63, 19.381]
  - - [4096, 4096, 1, 1024, 4096, 4096, 1024, 1024]
    - [63, 22.276]
  - - [4096, 4096, 1, 2048, 4096, 4096, 2048, 2048]
    - [9, 22.613]
  - - [4096, 4096, 1, 4096, 4096, 4096, 4096, 4096]
    - [50, 25.531]
  - - [4096, 4096, 1, 8192, 4096, 4096, 8192, 8192]
    - [63, 29.095]
  - - [4096, 8192, 1, 128, 4096, 4096, 128, 128]
    - [49, 11.022]
  - - [4096, 8192, 1, 256, 4096, 4096, 256, 256]
    - [45, 15.494]
  - - [4096, 8192, 1, 512, 4096, 4096, 512, 512]
    - [54, 19.704]
  - - [4096, 8192, 1, 1024, 4096, 4096, 1024, 1024]
    - [68, 22.307]
  - - [4096, 8192, 1, 2048, 4096, 4096, 2048, 2048]
    - [64, 24.175]
  - - [4096, 8192, 1, 4096, 4096, 4096, 4096, 4096]
    - [56, 28.594]
  - - [4096, 8192, 1, 8192, 4096, 4096, 8192, 8192]
    - [64, 32.458]
  - - [8192, 128, 1, 128, 8192, 8192, 128, 128]
    - [78, 3.944]
  - - [8192, 128, 1, 256, 8192, 8192, 256, 256]
    - [78, 6.769]
  - - [8192, 128, 1, 512, 8192, 8192, 512, 512]
    - [14, 10.487]
  - - [8192, 128, 1, 1024, 8192, 8192, 1024, 1024]
    - [110, 11.447]
  - - [8192, 128, 1, 2048, 8192, 8192, 2048, 2048]
    - [111, 13.993]
  - - [8192, 128, 1, 4096, 8192, 8192, 4096, 4096]
    - [73, 16.748]
  - - [8192, 128, 1, 8192, 8192, 8192, 8192, 8192]
    - [15, 19.027]
  - - [8192, 256, 1, 128, 8192, 8192, 128, 128]
    - [8, 5.723]
  - - [8192, 256, 1, 256, 8192, 8192, 256, 256]
    - [11, 9.817]
  - - [8192, 256, 1, 512, 8192, 8192, 512, 512]
    - [55, 14.903]
  - - [8192, 256, 1, 1024, 8192, 8192, 1024, 1024]
    - [87, 14.86]
  - - [8192, 256, 1, 2048, 8192, 8192, 2048, 2048]
    - [75, 17.656]
  - - [8192, 256, 1, 4096, 8192, 8192, 4096, 4096]
    - [47, 21.257]
  - - [8192, 256, 1, 8192, 8192, 8192, 8192, 8192]
    - [47, 22.877]
  - - [8192, 512, 1, 128, 8192, 8192, 128, 128]
    - [85, 5.495]
  - - [8192, 512, 1, 256, 8192, 8192, 256, 256]
    - [90, 8.785]
  - - [8192, 512, 1, 512, 8192, 8192, 512, 512]
    - [84, 13.911]
  - - [8192, 512, 1, 1024, 8192, 8192, 1024, 1024]
    - [58, 17.871]
  - - [8192, 512, 1, 2048, 8192, 8192, 2048, 2048]
    - [56, 21.216]
  - - [8192, 512, 1, 4096, 8192, 8192, 4096, 4096]
    - [47, 23.763]
  - - [8192, 512, 1, 8192, 8192, 8192, 8192, 8192]
    - [38, 23.318]
  - - [8192, 1024, 1, 128, 8192, 8192, 128, 128]
    - [40, 7.277]
  - - [8192, 1024, 1, 256, 8192, 8192, 256, 256]
    - [89, 11.426]
  - - [8192, 1024, 1, 512, 8192, 8192, 512, 512]
    - [70, 16.521]
  - - [8192, 1024, 1, 1024, 8192, 8192, 1024, 1024]
    - [64, 21.683]
  - - [8192, 1024, 1, 2048, 8192, 8192, 2048, 2048]
    - [63, 21.99]
  - - [8192, 1024, 1, 4096, 8192, 8192, 4096, 4096]
    - [43, 24.086]
  - - [8192, 1024, 1, 8192, 8192, 8192, 8192, 8192]
    - [48, 25.356]
  - - [8192, 2048, 1, 128, 8192, 8192, 128, 128]
    - [17, 9.03]
  - - [8192, 2048, 1, 256, 8192, 8192, 256, 256]
    - [3, 13.836]
  - - [8192, 2048, 1, 512, 8192, 8192, 512, 512]
    - [66, 19.359]
  - - [8192, 2048, 1, 1024, 8192, 8192, 1024, 1024]
    - [69, 22.31]
  - - [8192, 2048, 1, 2048, 8192, 8192, 2048, 2048]
    - [64, 22.332]
  - - [8192, 2048, 1, 4096, 8192, 8192, 4096, 4096]
    - [49, 25.367]
  - - [8192, 2048, 1, 8192, 8192, 8192, 8192, 8192]
    - [63, 29.265]
  - - [8192, 4096, 1, 128, 8192, 8192, 128, 128]
    - [5, 10.624]
  - - [8192, 4096, 1, 256, 8192, 8192, 256, 256]
    - [63, 15.022]
  - - [8192, 4096, 1, 512, 8192, 8192, 512, 512]
    - [64, 19.385]
  - - [8192, 4096, 1, 1024, 8192, 8192, 1024, 1024]
    - [65, 21.774]
  - - [8192, 4096, 1, 2048, 8192, 8192, 2048, 2048]
    - [59, 24.211]
  - - [8192, 4096, 1, 4096, 8192, 8192, 4096, 4096]
    - [66, 29.278]
  - - [8192, 4096, 1, 8192, 8192, 8192, 8192, 8192]
    - [68, 31.114]
  - - [8192, 8192, 1, 128, 8192, 8192, 128, 128]
    - [41, 9.099]
  - - [8192, 8192, 1, 256, 8192, 8192, 256, 256]
    - [3, 13.821]
  - - [8192, 8192, 1, 512, 8192, 8192, 512, 512]
    - [5, 18.487]
  - - [8192, 8192, 1, 1024, 8192, 8192, 1024, 1024]
    - [62, 22.537]
  - - [8192, 8192, 1, 2048, 8192, 8192, 2048, 2048]
    - [69, 26.25]
  - - [8192, 8192, 1, 4096, 8192, 8192, 4096, 4096]
    - [56, 29.484]
  - - [8192, 8192, 1, 8192, 8192, 8192, 8192, 8192]
    - [63, 30.16]
  - - [1, 1, 1, 32, 1, 1, 32, 32]
    - [124, 0.0]
- null
- null
- ExperimentalStreamK
- GridBased
