library/src/amd_detail/rocblaslt/src/Tensile/Logic/asm_full/aquavanjaram/gfx942_228cu/StreamK/aquavanjaram942_Cijk_Alik_Bjlk_BBS_BH_UserArgs.yaml
- {MinimumRequiredVersion: 4.33.0}
- aquavanjaram942
- {Architecture: gfx942, CUCount: 228}
- [Device 0049, Device 0050]
    SolutionIndex: 0
    SolutionNameMin: Cijk_Alik_Bjlk_BBS_BH_UserArgs_MT256x256x32_MI16x16x1_SN_LDSB1_CLR1_GSU0_GSUC0_GSUWGMRR0_K1_LBSPPA512_LBSPPB2048_LPB32_MIWT8_8_PLR1_SU32_SUM0_SUS256_SKXCCM0_VWA8_VWB2_WGM1_WGMXCC1_WGMXCCGn1
    SolutionIndex: 1
    SolutionNameMin: Cijk_Alik_Bjlk_BBS_BH_UserArgs_MT256x256x32_MI16x16x1_SN_LDSB1_CLR1_GSU0_GSUC0_GSUWGMRR0_K1_LBSPPA128_LBSPPB2048_LPB0_MIWT8_8_PLR1_SU32_SUM0_SUS256_SKXCCM0_VWA2_VWB8_WGM1_WGMXCC1_WGMXCCGn1
    SolutionIndex: 2
    SolutionNameMin: Cijk_Alik_Bjlk_BBS_BH_UserArgs_MT256x256x32_MI16x16x1_SN_LDSB1_CLR1_GSU0_GSUC0_GSUWGMRR0_K1_LBSPPA256_LBSPPB2048_LPB0_MIWT8_8_PLR1_SU32_SUM0_SUS256_SKXCCM0_VWA4_VWB8_WGM8_WGMXCC1_WGMXCCGn1
    SolutionIndex: 3
    SolutionNameMin: Cijk_Alik_Bjlk_BBS_BH_UserArgs_MT128x256x32_MI16x16x1_SN_LDSB1_CLR1_GSU0_GSUC0_GSUWGMRR0_K1_LBSPPA256_LBSPPB2048_LPB0_MIWT4_8_PLR1_SU32_SUM0_SUS256_SKXCCM0_VWA4_VWB8_WGM1_WGMXCC1_WGMXCCGn1
    SolutionIndex: 4
    SolutionNameMin: Cijk_Alik_Bjlk_BBS_BH_UserArgs_MT256x128x32_MI16x16x1_SN_LDSB1_CLR1_GSU0_GSUC0_GSUWGMRR0_K1_LBSPPA512_LBSPPB1024_LPB0_MIWT8_4_PLR1_SU32_SUM0_SUS256_SKXCCM0_VWA8_VWB4_WGM4_WGMXCC1_WGMXCCGn1
    SolutionIndex: 5
    SolutionNameMin: Cijk_Alik_Bjlk_BBS_BH_UserArgs_MT256x128x32_MI16x16x1_SN_LDSB1_CLR1_GSU0_GSUC0_GSUWGMRR0_K1_LBSPPA512_LBSPPB1024_LPB32_MIWT8_4_PLR1_SU32_SUM0_SUS256_SKXCCM0_VWA8_VWB2_WGM8_WGMXCC1_WGMXCCGn1
    SolutionIndex: 6
    SolutionNameMin: Cijk_Alik_Bjlk_BBS_BH_UserArgs_MT64x128x32_MI16x16x1_SN_LDSB0_CLR1_GSU0_GSUC0_GSUWGMRR0_K1_LBSPPA128_LBSPPB1024_LPB0_MIWT2_4_PLR1_SU32_SUM0_SUS256_SKXCCM0_VWA2_VWB4_WGM1_WGMXCC1_WGMXCCGn1
    SolutionIndex: 7
    SolutionNameMin: Cijk_Alik_Bjlk_BBS_BH_UserArgs_MT64x64x32_MI16x16x1_SN_LDSB0_CLR1_GSU0_GSUC0_GSUWGMRR0_K1_LBSPPA128_LBSPPB512_LPB32_MIWT2_2_PLR1_SU32_SUM0_SUS256_SKXCCM0_VWA2_VWB2_WGM1_WGMXCC1_WGMXCCGn1
    SolutionIndex: 8
    SolutionNameMin: Cijk_Alik_Bjlk_BBS_BH_UserArgs_MT128x256x64_MI16x16x1_SN_LDSB1_CLR1_GSU0_GSUC0_GSUWGMRR0_K1_LBSPPA512_LBSPPB4096_LPB0_MIWT4_8_PLR1_SU32_SUM0_SUS256_SKXCCM0_VWA4_VWB4_WGM1_WGMXCC1_WGMXCCGn1
    SolutionIndex: 9
    SolutionNameMin: Cijk_Alik_Bjlk_BBS_BH_UserArgs_MT128x256x64_MI16x16x1_SN_LDSB1_CLR1_GSU0_GSUC0_GSUWGMRR0_K1_LBSPPA512_LBSPPB4096_LPB0_MIWT4_8_PLR1_SU32_SUM0_SUS256_SKXCCM0_VWA4_VWB8_WGM1_WGMXCC1_WGMXCCGn1
    SolutionIndex: 10
    SolutionNameMin: Cijk_Alik_Bjlk_BBS_BH_UserArgs_MT128x256x64_MI16x16x1_SN_LDSB1_CLR1_GSU0_GSUC0_GSUWGMRR0_K1_LBSPPA512_LBSPPB4096_LPB0_MIWT4_8_PLR1_SU32_SUM0_SUS256_SKXCCM0_VWA4_VWB4_WGM4_WGMXCC1_WGMXCCGn1
    SolutionIndex: 11
    SolutionNameMin: Cijk_Alik_Bjlk_BBS_BH_UserArgs_MT256x128x64_MI16x16x1_SN_LDSB1_CLR1_GSU0_GSUC0_GSUWGMRR0_K1_LBSPPA1024_LBSPPB2048_LPB16_MIWT8_4_PLR1_SU32_SUM0_SUS256_SKXCCM0_VWA8_VWB1_WGM1_WGMXCC1_WGMXCCGn1
    SolutionIndex: 12
    SolutionNameMin: Cijk_Alik_Bjlk_BBS_BH_UserArgs_MT256x128x64_MI16x16x1_SN_LDSB1_CLR1_GSU0_GSUC0_GSUWGMRR0_K1_LBSPPA1024_LBSPPB2048_LPB32_MIWT8_4_PLR1_SU32_SUM0_SUS256_SKXCCM0_VWA8_VWB2_WGM1_WGMXCC1_WGMXCCGn1
    SolutionIndex: 13
    SolutionNameMin: Cijk_Alik_Bjlk_BBS_BH_UserArgs_MT256x128x64_MI16x16x1_SN_LDSB1_CLR1_GSU0_GSUC0_GSUWGMRR0_K1_LBSPPA512_LBSPPB2048_LPB0_MIWT8_4_PLR1_SU32_SUM0_SUS256_SKXCCM0_VWA4_VWB4_WGM1_WGMXCC1_WGMXCCGn1
    SolutionIndex: 14
    SolutionNameMin: Cijk_Alik_Bjlk_BBS_BH_UserArgs_MT256x128x64_MI16x16x1_SN_LDSB1_CLR1_GSU0_GSUC0_GSUWGMRR0_K1_LBSPPA1024_LBSPPB2048_LPB0_MIWT8_4_PLR1_SU32_SUM0_SUS256_SKXCCM0_VWA8_VWB4_WGM1_WGMXCC1_WGMXCCGn1
    SolutionIndex: 15
    SolutionNameMin: Cijk_Alik_Bjlk_BBS_BH_UserArgs_MT256x128x64_MI16x16x1_SN_LDSB1_CLR1_GSU0_GSUC0_GSUWGMRR0_K1_LBSPPA512_LBSPPB2048_LPB32_MIWT8_4_PLR1_SU32_SUM0_SUS256_SKXCCM0_VWA4_VWB2_WGM4_WGMXCC1_WGMXCCGn1
    SolutionIndex: 16
    SolutionNameMin: Cijk_Alik_Bjlk_BBS_BH_UserArgs_MT256x128x64_MI16x16x1_SN_LDSB1_CLR1_GSU0_GSUC0_GSUWGMRR0_K1_LBSPPA512_LBSPPB2048_LPB0_MIWT8_4_PLR1_SU32_SUM0_SUS256_SKXCCM0_VWA4_VWB4_WGM4_WGMXCC1_WGMXCCGn1
    SolutionIndex: 17
    SolutionNameMin: Cijk_Alik_Bjlk_BBS_BH_UserArgs_MT256x128x64_MI16x16x1_SN_LDSB1_CLR1_GSU0_GSUC0_GSUWGMRR0_K1_LBSPPA512_LBSPPB2048_LPB32_MIWT8_4_PLR1_SU32_SUM0_SUS256_SKXCCM0_VWA4_VWB2_WGM8_WGMXCC1_WGMXCCGn1
    SolutionIndex: 18
    SolutionNameMin: Cijk_Alik_Bjlk_BBS_BH_UserArgs_MT256x128x64_MI16x16x1_SN_LDSB1_CLR1_GSU0_GSUC0_GSUWGMRR0_K1_LBSPPA512_LBSPPB2048_LPB0_MIWT8_4_PLR1_SU32_SUM0_SUS256_SKXCCM0_VWA4_VWB4_WGM8_WGMXCC1_WGMXCCGn1
    SolutionIndex: 19
    SolutionNameMin: Cijk_Alik_Bjlk_BBS_BH_UserArgs_MT64x256x64_MI16x16x1_SN_LDSB1_CLR1_GSU0_GSUC0_GSUWGMRR0_K1_LBSPPA128_LBSPPB4096_LPB0_MIWT2_8_PLR1_SU32_SUM0_SUS256_SKXCCM0_VWA1_VWB8_WGM4_WGMXCC1_WGMXCCGn1
    SolutionIndex: 20
    SolutionNameMin: Cijk_Alik_Bjlk_BBS_BH_UserArgs_MT256x64x64_MI16x16x1_SN_LDSB1_CLR1_GSU0_GSUC0_GSUWGMRR0_K1_LBSPPA512_LBSPPB1024_LPB32_MIWT8_2_PLR1_SU32_SUM0_SUS256_SKXCCM0_VWA4_VWB2_WGM4_WGMXCC1_WGMXCCGn1
    SolutionIndex: 21
    SolutionNameMin: Cijk_Alik_Bjlk_BBS_BH_UserArgs_MT128x128x64_MI16x16x1_SN_LDSB1_CLR1_GSU0_GSUC0_GSUWGMRR0_K1_LBSPPA512_LBSPPB2048_LPB32_MIWT4_4_PLR1_SU32_SUM0_SUS256_SKXCCM0_VWA4_VWB2_WGM1_WGMXCC1_WGMXCCGn1
    SolutionIndex: 22
    SolutionNameMin: Cijk_Alik_Bjlk_BBS_BH_UserArgs_MT128x128x64_MI16x16x1_SN_LDSB1_CLR1_GSU0_GSUC0_GSUWGMRR0_K1_LBSPPA256_LBSPPB2048_LPB0_MIWT4_4_PLR1_SU32_SUM0_SUS256_SKXCCM0_VWA2_VWB4_WGM1_WGMXCC1_WGMXCCGn1
    SolutionIndex: 23
    SolutionNameMin: Cijk_Alik_Bjlk_BBS_BH_UserArgs_MT128x128x64_MI16x16x1_SN_LDSB1_CLR1_GSU0_GSUC0_GSUWGMRR0_K1_LBSPPA512_LBSPPB2048_LPB0_MIWT4_4_PLR2_SU32_SUM0_SUS256_SKXCCM0_VWA4_VWB4_WGM4_WGMXCC1_WGMXCCGn1
    SolutionIndex: 24
    SolutionNameMin: Cijk_Alik_Bjlk_BBS_BH_UserArgs_MT128x128x64_MI16x16x1_SN_LDSB1_CLR1_GSU0_GSUC0_GSUWGMRR0_K1_LBSPPA256_LBSPPB2048_LPB0_MIWT4_4_PLR1_SU32_SUM0_SUS256_SKXCCM0_VWA2_VWB4_WGM8_WGMXCC1_WGMXCCGn1
    SolutionIndex: 25
    SolutionNameMin: Cijk_Alik_Bjlk_BBS_BH_UserArgs_MT128x128x64_MI16x16x1_SN_LDSB1_CLR1_GSU0_GSUC0_GSUWGMRR0_K1_LBSPPA512_LBSPPB2048_LPB0_MIWT4_4_PLR1_SU32_SUM0_SUS256_SKXCCM0_VWA4_VWB4_WGM8_WGMXCC1_WGMXCCGn1
    SolutionIndex: 26
    SolutionNameMin: Cijk_Alik_Bjlk_BBS_BH_UserArgs_MT64x128x64_MI16x16x1_SN_LDSB1_CLR1_GSU0_GSUC0_GSUWGMRR0_K1_LBSPPA256_LBSPPB2048_LPB0_MIWT2_4_PLR1_SU32_SUM0_SUS256_SKXCCM0_VWA2_VWB4_WGM1_WGMXCC1_WGMXCCGn1
    SolutionIndex: 27
    SolutionNameMin: Cijk_Alik_Bjlk_BBS_BH_UserArgs_MT128x64x64_MI16x16x1_SN_LDSB1_CLR1_GSU0_GSUC0_GSUWGMRR0_K1_LBSPPA256_LBSPPB1024_LPB32_MIWT4_2_PLR1_SU32_SUM0_SUS256_SKXCCM0_VWA2_VWB2_WGM1_WGMXCC1_WGMXCCGn1
    SolutionIndex: 28
    SolutionNameMin: Cijk_Alik_Bjlk_BBS_BH_UserArgs_MT128x64x64_MI16x16x1_SN_LDSB1_CLR1_GSU0_GSUC0_GSUWGMRR0_K1_LBSPPA512_LBSPPB1024_LPB32_MIWT4_2_PLR1_SU32_SUM0_SUS256_SKXCCM0_VWA4_VWB2_WGM4_WGMXCC1_WGMXCCGn1
    SolutionIndex: 29
    SolutionNameMin: Cijk_Alik_Bjlk_BBS_BH_UserArgs_MT64x64x64_MI16x16x1_SN_LDSB1_CLR1_GSU0_GSUC0_GSUWGMRR0_K1_LBSPPA256_LBSPPB1024_LPB32_MIWT2_2_PLR1_SU32_SUM0_SUS256_SKXCCM0_VWA2_VWB2_WGM1_WGMXCC1_WGMXCCGn1
    SolutionIndex: 30
    SolutionNameMin: Cijk_Alik_Bjlk_BBS_BH_UserArgs_MT32x64x64_MI16x16x1_SN_LDSB0_CLR1_GSU0_GSUC0_GSUWGMRR0_K1_LBSPPA128_LBSPPB1024_LPB32_MIWT1_2_PLR1_SU32_SUM0_SUS256_SKXCCM0_VWA1_VWB2_WGM1_WGMXCC1_WGMXCCGn1
    SolutionIndex: 31
    SolutionNameMin: Cijk_Alik_Bjlk_BBS_BH_UserArgs_MT64x32x64_MI16x16x1_SN_LDSB0_CLR1_GSU0_GSUC0_GSUWGMRR0_K1_LBSPPA256_LBSPPB512_LPB16_MIWT2_1_PLR1_SU32_SUM0_SUS256_SKXCCM0_VWA2_VWB1_WGM1_WGMXCC1_WGMXCCGn1
    SolutionIndex: 32
    SolutionNameMin: Cijk_Alik_Bjlk_BBS_BH_UserArgs_MT32x32x64_MI16x16x1_SN_LDSB0_CLR1_GSU0_GSUC0_GSUWGMRR0_K1_LBSPPA128_LBSPPB512_LPB16_MIWT1_1_PLR1_SU32_SUM0_SUS256_SKXCCM0_VWA1_VWB1_WGM1_WGMXCC1_WGMXCCGn1
    SolutionIndex: 33
    SolutionNameMin: Cijk_Alik_Bjlk_BBS_BH_UserArgs_MT32x32x64_MI16x16x1_SN_LDSB0_CLR1_GSU0_GSUC0_GSUWGMRR0_K1_LBSPPA128_LBSPPB512_LPB16_MIWT1_1_PLR1_SU32_SUM0_SUS256_SKXCCM0_VWA1_VWB1_WGM8_WGMXCC1_WGMXCCGn1
    SolutionIndex: 34
    SolutionNameMin: Cijk_Alik_Bjlk_BBS_BH_UserArgs_MT64x128x128_MI16x16x1_SN_LDSB1_CLR1_GSU0_GSUC0_GSUWGMRR0_K1_LBSPPA512_LBSPPB2048_LPB0_MIWT2_4_PLR2_SU32_SUM0_SUS256_SKXCCM0_VWA2_VWB4_WGM1_WGMXCC1_WGMXCCGn1
    SolutionIndex: 35
    SolutionNameMin: Cijk_Alik_Bjlk_BBS_BH_UserArgs_MT128x64x128_MI16x16x1_SN_LDSB1_CLR1_GSU0_GSUC0_GSUWGMRR0_K1_LBSPPA512_LBSPPB1024_LPB32_MIWT4_2_PLR2_SU32_SUM0_SUS256_SKXCCM0_VWA2_VWB2_WGM1_WGMXCC1_WGMXCCGn1
    SolutionIndex: 36
    SolutionNameMin: Cijk_Alik_Bjlk_BBS_BH_UserArgs_MT128x64x128_MI16x16x1_SN_LDSB1_CLR1_GSU0_GSUC0_GSUWGMRR0_K1_LBSPPA1024_LBSPPB1024_LPB32_MIWT4_2_PLR2_SU32_SUM0_SUS256_SKXCCM0_VWA4_VWB2_WGM1_WGMXCC1_WGMXCCGn1
    SolutionIndex: 37
    SolutionNameMin: Cijk_Alik_Bjlk_BBS_BH_UserArgs_MT128x64x128_MI16x16x1_SN_LDSB1_CLR1_GSU0_GSUC0_GSUWGMRR0_K1_LBSPPA1024_LBSPPB1024_LPB32_MIWT4_2_PLR2_SU32_SUM0_SUS256_SKXCCM0_VWA4_VWB2_WGM4_WGMXCC1_WGMXCCGn1
    SolutionIndex: 38
    SolutionNameMin: Cijk_Alik_Bjlk_BBS_BH_UserArgs_MT128x64x128_MI16x16x1_SN_LDSB1_CLR1_GSU0_GSUC0_GSUWGMRR0_K1_LBSPPA1024_LBSPPB1024_LPB32_MIWT4_2_PLR2_SU32_SUM0_SUS256_SKXCCM0_VWA4_VWB2_WGM8_WGMXCC1_WGMXCCGn1
    SolutionIndex: 39
    SolutionNameMin: Cijk_Alik_Bjlk_BBS_BH_UserArgs_MT64x64x128_MI16x16x1_SN_LDSB1_CLR1_GSU0_GSUC0_GSUWGMRR0_K1_LBSPPA256_LBSPPB1024_LPB32_MIWT2_2_PLR2_SU32_SUM0_SUS256_SKXCCM0_VWA1_VWB2_WGM1_WGMXCC1_WGMXCCGn1
    SolutionIndex: 40
    SolutionNameMin: Cijk_Alik_Bjlk_BBS_BH_UserArgs_MT64x64x128_MI16x16x1_SN_LDSB1_CLR1_GSU0_GSUC0_GSUWGMRR0_K1_LBSPPA512_LBSPPB1024_LPB32_MIWT2_2_PLR2_SU32_SUM0_SUS256_SKXCCM0_VWA2_VWB2_WGM1_WGMXCC1_WGMXCCGn1
    SolutionIndex: 41
    SolutionNameMin: Cijk_Alik_Bjlk_BBS_BH_UserArgs_MT64x64x128_MI16x16x1_SN_LDSB1_CLR1_GSU0_GSUC0_GSUWGMRR0_K1_LBSPPA256_LBSPPB1024_LPB32_MIWT2_2_PLR2_SU32_SUM0_SUS256_SKXCCM0_VWA1_VWB2_WGM4_WGMXCC1_WGMXCCGn1
    SolutionIndex: 42
    SolutionNameMin: Cijk_Alik_Bjlk_BBS_BH_UserArgs_MT64x64x128_MI16x16x1_SN_LDSB1_CLR1_GSU0_GSUC0_GSUWGMRR0_K1_LBSPPA512_LBSPPB1024_LPB32_MIWT2_2_PLR2_SU32_SUM0_SUS256_SKXCCM0_VWA2_VWB2_WGM4_WGMXCC1_WGMXCCGn1
    SolutionIndex: 43
    SolutionNameMin: Cijk_Alik_Bjlk_BBS_BH_UserArgs_MT32x64x128_MI16x16x1_SN_LDSB1_CLR1_GSU0_GSUC0_GSUWGMRR0_K1_LBSPPA256_LBSPPB1024_LPB32_MIWT1_2_PLR2_SU32_SUM0_SUS256_SKXCCM0_VWA1_VWB2_WGM1_WGMXCC1_WGMXCCGn1
    SolutionIndex: 44
    SolutionNameMin: Cijk_Alik_Bjlk_BBS_BH_UserArgs_MT32x64x128_MI16x16x1_SN_LDSB1_CLR1_GSU0_GSUC0_GSUWGMRR0_K1_LBSPPA256_LBSPPB1024_LPB32_MIWT1_2_PLR2_SU32_SUM0_SUS256_SKXCCM0_VWA1_VWB2_WGM4_WGMXCC1_WGMXCCGn1
    SolutionIndex: 45
    SolutionNameMin: Cijk_Alik_Bjlk_BBS_BH_UserArgs_MT32x32x128_MI16x16x1_SN_LDSB1_CLR1_GSU0_GSUC0_GSUWGMRR0_K1_LBSPPA256_LBSPPB512_LPB16_MIWT1_1_PLR1_SU32_SUM0_SUS256_SKXCCM0_VWA1_VWB1_WGM1_WGMXCC1_WGMXCCGn1
    SolutionIndex: 46
    SolutionNameMin: Cijk_Alik_Bjlk_BBS_BH_UserArgs_MT32x32x128_MI16x16x1_SN_LDSB1_CLR1_GSU0_GSUC0_GSUWGMRR0_K1_LBSPPA256_LBSPPB512_LPB16_MIWT1_1_PLR2_SU32_SUM0_SUS256_SKXCCM0_VWA1_VWB1_WGM1_WGMXCC1_WGMXCCGn1
    SolutionIndex: 47
    SolutionNameMin: Cijk_Alik_Bjlk_BBS_BH_UserArgs_MT32x32x128_MI16x16x1_SN_LDSB1_CLR1_GSU0_GSUC0_GSUWGMRR0_K1_LBSPPA256_LBSPPB512_LPB16_MIWT1_1_PLR1_SU32_SUM0_SUS256_SKXCCM0_VWA1_VWB1_WGM4_WGMXCC1_WGMXCCGn1
    SolutionIndex: 48
    SolutionNameMin: Cijk_Alik_Bjlk_BBS_BH_UserArgs_MT32x32x128_MI16x16x1_SN_LDSB1_CLR1_GSU0_GSUC0_GSUWGMRR0_K1_LBSPPA256_LBSPPB512_LPB16_MIWT1_1_PLR2_SU32_SUM0_SUS256_SKXCCM0_VWA1_VWB1_WGM8_WGMXCC1_WGMXCCGn1
    SolutionIndex: 49
    SolutionNameMin: Cijk_Alik_Bjlk_BBS_BH_UserArgs_MT256x256x32_MI16x16x1_SN_LDSB1_CLR1_GSU0_GSUC0_GSUWGMRR0_K1_LBSPPA128_LBSPPB2048_LPB0_MIWT8_8_PLR1_SU32_SUM0_SUS256_SKXCCM6_VWA2_VWB4_WGM1_WGMXCC1_WGMXCCGn1
    SolutionIndex: 50
    SolutionNameMin: Cijk_Alik_Bjlk_BBS_BH_UserArgs_MT256x256x32_MI16x16x1_SN_LDSB1_CLR1_GSU0_GSUC0_GSUWGMRR0_K1_LBSPPA128_LBSPPB2048_LPB0_MIWT8_8_PLR1_SU32_SUM0_SUS256_SKXCCM6_VWA1_VWB8_WGM1_WGMXCC1_WGMXCCGn1
    SolutionIndex: 51
    SolutionNameMin: Cijk_Alik_Bjlk_BBS_BH_UserArgs_MT256x256x32_MI16x16x1_SN_LDSB1_CLR1_GSU0_GSUC0_GSUWGMRR0_K1_LBSPPA128_LBSPPB2048_LPB0_MIWT8_8_PLR1_SU32_SUM0_SUS256_SKXCCM6_VWA2_VWB8_WGM1_WGMXCC1_WGMXCCGn1
    SolutionIndex: 52
    SolutionNameMin: Cijk_Alik_Bjlk_BBS_BH_UserArgs_MT256x256x32_MI16x16x1_SN_LDSB1_CLR1_GSU0_GSUC0_GSUWGMRR0_K1_LBSPPA256_LBSPPB2048_LPB0_MIWT8_8_PLR1_SU32_SUM0_SUS256_SKXCCM6_VWA4_VWB8_WGM1_WGMXCC1_WGMXCCGn1
    SolutionIndex: 53
    SolutionNameMin: Cijk_Alik_Bjlk_BBS_BH_UserArgs_MT256x256x32_MI16x16x1_SN_LDSB1_CLR1_GSU0_GSUC0_GSUWGMRR0_K1_LBSPPA512_LBSPPB2048_LPB32_MIWT8_8_PLR1_SU32_SUM0_SUS256_SKXCCM6_VWA8_VWB2_WGM4_WGMXCC1_WGMXCCGn1
    SolutionIndex: 54
    SolutionNameMin: Cijk_Alik_Bjlk_BBS_BH_UserArgs_MT256x256x32_MI16x16x1_SN_LDSB1_CLR1_GSU0_GSUC0_GSUWGMRR0_K1_LBSPPA512_LBSPPB2048_LPB0_MIWT8_8_PLR1_SU32_SUM0_SUS256_SKXCCM6_VWA8_VWB4_WGM4_WGMXCC1_WGMXCCGn1
    SolutionIndex: 55
    SolutionNameMin: Cijk_Alik_Bjlk_BBS_BH_UserArgs_MT256x256x32_MI16x16x1_SN_LDSB1_CLR1_GSU0_GSUC0_GSUWGMRR0_K1_LBSPPA128_LBSPPB2048_LPB0_MIWT8_8_PLR1_SU32_SUM0_SUS256_SKXCCM6_VWA2_VWB8_WGM4_WGMXCC1_WGMXCCGn1
    SolutionIndex: 56
    SolutionNameMin: Cijk_Alik_Bjlk_BBS_BH_UserArgs_MT256x256x32_MI16x16x1_SN_LDSB1_CLR1_GSU0_GSUC0_GSUWGMRR0_K1_LBSPPA256_LBSPPB2048_LPB0_MIWT8_8_PLR1_SU32_SUM0_SUS256_SKXCCM6_VWA4_VWB8_WGM4_WGMXCC1_WGMXCCGn1
    SolutionIndex: 57
    SolutionNameMin: Cijk_Alik_Bjlk_BBS_BH_UserArgs_MT256x256x32_MI16x16x1_SN_LDSB1_CLR1_GSU0_GSUC0_GSUWGMRR0_K1_LBSPPA512_LBSPPB2048_LPB32_MIWT8_8_PLR1_SU32_SUM0_SUS256_SKXCCM6_VWA8_VWB2_WGM8_WGMXCC1_WGMXCCGn1
    SolutionIndex: 58
    SolutionNameMin: Cijk_Alik_Bjlk_BBS_BH_UserArgs_MT256x256x32_MI16x16x1_SN_LDSB1_CLR1_GSU0_GSUC0_GSUWGMRR0_K1_LBSPPA128_LBSPPB2048_LPB0_MIWT8_8_PLR1_SU32_SUM0_SUS256_SKXCCM6_VWA2_VWB4_WGM8_WGMXCC1_WGMXCCGn1
    SolutionIndex: 59
    SolutionNameMin: Cijk_Alik_Bjlk_BBS_BH_UserArgs_MT256x256x32_MI16x16x1_SN_LDSB1_CLR1_GSU0_GSUC0_GSUWGMRR0_K1_LBSPPA256_LBSPPB2048_LPB0_MIWT8_8_PLR1_SU32_SUM0_SUS256_SKXCCM6_VWA4_VWB4_WGM8_WGMXCC1_WGMXCCGn1
    SolutionIndex: 60
    SolutionNameMin: Cijk_Alik_Bjlk_BBS_BH_UserArgs_MT256x256x32_MI16x16x1_SN_LDSB1_CLR1_GSU0_GSUC0_GSUWGMRR0_K1_LBSPPA256_LBSPPB2048_LPB0_MIWT8_8_PLR1_SU32_SUM0_SUS256_SKXCCM6_VWA4_VWB8_WGM8_WGMXCC1_WGMXCCGn1
    SolutionIndex: 61
    SolutionNameMin: Cijk_Alik_Bjlk_BBS_BH_UserArgs_MT128x256x32_MI16x16x1_SN_LDSB1_CLR1_GSU0_GSUC0_GSUWGMRR0_K1_LBSPPA256_LBSPPB2048_LPB32_MIWT4_8_PLR1_SU32_SUM0_SUS256_SKXCCM6_VWA4_VWB2_WGM1_WGMXCC1_WGMXCCGn1
    SolutionIndex: 62
    SolutionNameMin: Cijk_Alik_Bjlk_BBS_BH_UserArgs_MT128x256x32_MI16x16x1_SN_LDSB1_CLR1_GSU0_GSUC0_GSUWGMRR0_K1_LBSPPA128_LBSPPB2048_LPB0_MIWT4_8_PLR1_SU32_SUM0_SUS256_SKXCCM6_VWA1_VWB8_WGM1_WGMXCC1_WGMXCCGn1
    SolutionIndex: 63
    SolutionNameMin: Cijk_Alik_Bjlk_BBS_BH_UserArgs_MT128x256x32_MI16x16x1_SN_LDSB1_CLR1_GSU0_GSUC0_GSUWGMRR0_K1_LBSPPA128_LBSPPB2048_LPB0_MIWT4_8_PLR1_SU32_SUM0_SUS256_SKXCCM6_VWA2_VWB8_WGM1_WGMXCC1_WGMXCCGn1
    SolutionIndex: 64
    SolutionNameMin: Cijk_Alik_Bjlk_BBS_BH_UserArgs_MT128x256x32_MI16x16x1_SN_LDSB1_CLR1_GSU0_GSUC0_GSUWGMRR0_K1_LBSPPA256_LBSPPB2048_LPB0_MIWT4_8_PLR1_SU32_SUM0_SUS256_SKXCCM6_VWA4_VWB8_WGM1_WGMXCC1_WGMXCCGn1
    SolutionIndex: 65
    SolutionNameMin: Cijk_Alik_Bjlk_BBS_BH_UserArgs_MT128x256x32_MI16x16x1_SN_LDSB1_CLR1_GSU0_GSUC0_GSUWGMRR0_K1_LBSPPA128_LBSPPB2048_LPB0_MIWT4_8_PLR1_SU32_SUM0_SUS256_SKXCCM6_VWA2_VWB4_WGM4_WGMXCC1_WGMXCCGn1
    SolutionIndex: 66
    SolutionNameMin: Cijk_Alik_Bjlk_BBS_BH_UserArgs_MT128x256x32_MI16x16x1_SN_LDSB1_CLR1_GSU0_GSUC0_GSUWGMRR0_K1_LBSPPA256_LBSPPB2048_LPB0_MIWT4_8_PLR1_SU32_SUM0_SUS256_SKXCCM6_VWA4_VWB8_WGM4_WGMXCC1_WGMXCCGn1
    SolutionIndex: 67
    SolutionNameMin: Cijk_Alik_Bjlk_BBS_BH_UserArgs_MT128x256x32_MI16x16x1_SN_LDSB1_CLR1_GSU0_GSUC0_GSUWGMRR0_K1_LBSPPA256_LBSPPB2048_LPB0_MIWT4_8_PLR1_SU32_SUM0_SUS256_SKXCCM6_VWA4_VWB4_WGM8_WGMXCC1_WGMXCCGn1
    SolutionIndex: 68
    SolutionNameMin: Cijk_Alik_Bjlk_BBS_BH_UserArgs_MT256x128x32_MI16x16x1_SN_LDSB1_CLR1_GSU0_GSUC0_GSUWGMRR0_K1_LBSPPA512_LBSPPB1024_LPB0_MIWT8_4_PLR1_SU32_SUM0_SUS256_SKXCCM6_VWA8_VWB4_WGM1_WGMXCC1_WGMXCCGn1
    SolutionIndex: 69
    SolutionNameMin: Cijk_Alik_Bjlk_BBS_BH_UserArgs_MT256x128x32_MI16x16x1_SN_LDSB1_CLR1_GSU0_GSUC0_GSUWGMRR0_K1_LBSPPA512_LBSPPB1024_LPB32_MIWT8_4_PLR1_SU32_SUM0_SUS256_SKXCCM6_VWA8_VWB2_WGM8_WGMXCC1_WGMXCCGn1
    SolutionIndex: 70
    SolutionNameMin: Cijk_Alik_Bjlk_BBS_BH_UserArgs_MT256x128x32_MI16x16x1_SN_LDSB1_CLR1_GSU0_GSUC0_GSUWGMRR0_K1_LBSPPA512_LBSPPB1024_LPB0_MIWT8_4_PLR1_SU32_SUM0_SUS256_SKXCCM6_VWA8_VWB4_WGM8_WGMXCC1_WGMXCCGn1
    SolutionIndex: 71
    SolutionNameMin: Cijk_Alik_Bjlk_BBS_BH_UserArgs_MT128x256x64_MI16x16x1_SN_LDSB1_CLR1_GSU0_GSUC0_GSUWGMRR0_K1_LBSPPA512_LBSPPB4096_LPB32_MIWT4_8_PLR1_SU32_SUM0_SUS256_SKXCCM6_VWA4_VWB2_WGM1_WGMXCC1_WGMXCCGn1
    SolutionIndex: 72
    SolutionNameMin: Cijk_Alik_Bjlk_BBS_BH_UserArgs_MT128x256x64_MI16x16x1_SN_LDSB1_CLR1_GSU0_GSUC0_GSUWGMRR0_K1_LBSPPA256_LBSPPB4096_LPB0_MIWT4_8_PLR1_SU32_SUM0_SUS256_SKXCCM6_VWA2_VWB4_WGM1_WGMXCC1_WGMXCCGn1
    SolutionIndex: 73
    SolutionNameMin: Cijk_Alik_Bjlk_BBS_BH_UserArgs_MT128x256x64_MI16x16x1_SN_LDSB1_CLR1_GSU0_GSUC0_GSUWGMRR0_K1_LBSPPA512_LBSPPB4096_LPB0_MIWT4_8_PLR1_SU32_SUM0_SUS256_SKXCCM6_VWA4_VWB4_WGM1_WGMXCC1_WGMXCCGn1
    SolutionIndex: 74
    SolutionNameMin: Cijk_Alik_Bjlk_BBS_BH_UserArgs_MT128x256x64_MI16x16x1_SN_LDSB1_CLR1_GSU0_GSUC0_GSUWGMRR0_K1_LBSPPA512_LBSPPB4096_LPB0_MIWT4_8_PLR1_SU32_SUM0_SUS256_SKXCCM6_VWA4_VWB8_WGM1_WGMXCC1_WGMXCCGn1
    SolutionIndex: 75
    SolutionNameMin: Cijk_Alik_Bjlk_BBS_BH_UserArgs_MT128x256x64_MI16x16x1_SN_LDSB1_CLR1_GSU0_GSUC0_GSUWGMRR0_K1_LBSPPA256_LBSPPB4096_LPB0_MIWT4_8_PLR1_SU32_SUM0_SUS256_SKXCCM6_VWA2_VWB4_WGM4_WGMXCC1_WGMXCCGn1
    SolutionIndex: 76
    SolutionNameMin: Cijk_Alik_Bjlk_BBS_BH_UserArgs_MT128x256x64_MI16x16x1_SN_LDSB1_CLR1_GSU0_GSUC0_GSUWGMRR0_K1_LBSPPA512_LBSPPB4096_LPB0_MIWT4_8_PLR1_SU32_SUM0_SUS256_SKXCCM6_VWA4_VWB4_WGM4_WGMXCC1_WGMXCCGn1
    SolutionIndex: 77
    SolutionNameMin: Cijk_Alik_Bjlk_BBS_BH_UserArgs_MT256x128x64_MI16x16x1_SN_LDSB1_CLR1_GSU0_GSUC0_GSUWGMRR0_K1_LBSPPA256_LBSPPB2048_LPB0_MIWT8_4_PLR1_SU32_SUM0_SUS256_SKXCCM6_VWA2_VWB4_WGM1_WGMXCC1_WGMXCCGn1
    SolutionIndex: 78
    SolutionNameMin: Cijk_Alik_Bjlk_BBS_BH_UserArgs_MT256x128x64_MI16x16x1_SN_LDSB1_CLR1_GSU0_GSUC0_GSUWGMRR0_K1_LBSPPA1024_LBSPPB2048_LPB0_MIWT8_4_PLR1_SU32_SUM0_SUS256_SKXCCM6_VWA8_VWB4_WGM1_WGMXCC1_WGMXCCGn1
    SolutionIndex: 79
    SolutionNameMin: Cijk_Alik_Bjlk_BBS_BH_UserArgs_MT256x128x64_MI16x16x1_SN_LDSB1_CLR1_GSU0_GSUC0_GSUWGMRR0_K1_LBSPPA512_LBSPPB2048_LPB32_MIWT8_4_PLR1_SU32_SUM0_SUS256_SKXCCM6_VWA4_VWB2_WGM4_WGMXCC1_WGMXCCGn1
    SolutionIndex: 80
    SolutionNameMin: Cijk_Alik_Bjlk_BBS_BH_UserArgs_MT256x128x64_MI16x16x1_SN_LDSB1_CLR1_GSU0_GSUC0_GSUWGMRR0_K1_LBSPPA512_LBSPPB2048_LPB0_MIWT8_4_PLR1_SU32_SUM0_SUS256_SKXCCM6_VWA4_VWB4_WGM4_WGMXCC1_WGMXCCGn1
    SolutionIndex: 81
    SolutionNameMin: Cijk_Alik_Bjlk_BBS_BH_UserArgs_MT256x128x64_MI16x16x1_SN_LDSB1_CLR1_GSU0_GSUC0_GSUWGMRR0_K1_LBSPPA512_LBSPPB2048_LPB0_MIWT8_4_PLR1_SU32_SUM0_SUS256_SKXCCM6_VWA4_VWB4_WGM8_WGMXCC1_WGMXCCGn1
    SolutionIndex: 82
    SolutionNameMin: Cijk_Alik_Bjlk_BBS_BH_UserArgs_MT256x64x64_MI16x16x1_SN_LDSB1_CLR1_GSU0_GSUC0_GSUWGMRR0_K1_LBSPPA1024_LBSPPB1024_LPB32_MIWT8_2_PLR1_SU32_SUM0_SUS256_SKXCCM6_VWA8_VWB2_WGM1_WGMXCC1_WGMXCCGn1
    SolutionIndex: 83
    SolutionNameMin: Cijk_Alik_Bjlk_BBS_BH_UserArgs_MT128x128x64_MI16x16x1_SN_LDSB1_CLR1_GSU0_GSUC0_GSUWGMRR0_K1_LBSPPA512_LBSPPB2048_LPB32_MIWT4_4_PLR1_SU32_SUM0_SUS256_SKXCCM6_VWA4_VWB2_WGM1_WGMXCC1_WGMXCCGn1
    SolutionIndex: 84
    SolutionNameMin: Cijk_Alik_Bjlk_BBS_BH_UserArgs_MT128x128x64_MI16x16x1_SN_LDSB1_CLR1_GSU0_GSUC0_GSUWGMRR0_K1_LBSPPA256_LBSPPB2048_LPB0_MIWT4_4_PLR1_SU32_SUM0_SUS256_SKXCCM6_VWA2_VWB4_WGM1_WGMXCC1_WGMXCCGn1
    SolutionIndex: 85
    SolutionNameMin: Cijk_Alik_Bjlk_BBS_BH_UserArgs_MT128x128x64_MI16x16x1_SN_LDSB1_CLR1_GSU0_GSUC0_GSUWGMRR0_K1_LBSPPA512_LBSPPB2048_LPB0_MIWT4_4_PLR1_SU32_SUM0_SUS256_SKXCCM6_VWA4_VWB4_WGM1_WGMXCC1_WGMXCCGn1
    SolutionIndex: 86
    SolutionNameMin: Cijk_Alik_Bjlk_BBS_BH_UserArgs_MT128x128x64_MI16x16x1_SN_LDSB1_CLR1_GSU0_GSUC0_GSUWGMRR0_K1_LBSPPA512_LBSPPB2048_LPB32_MIWT4_4_PLR1_SU32_SUM0_SUS256_SKXCCM6_VWA4_VWB2_WGM4_WGMXCC1_WGMXCCGn1
    SolutionIndex: 87
    SolutionNameMin: Cijk_Alik_Bjlk_BBS_BH_UserArgs_MT128x128x64_MI16x16x1_SN_LDSB1_CLR1_GSU0_GSUC0_GSUWGMRR0_K1_LBSPPA256_LBSPPB2048_LPB0_MIWT4_4_PLR1_SU32_SUM0_SUS256_SKXCCM6_VWA2_VWB4_WGM4_WGMXCC1_WGMXCCGn1
    SolutionIndex: 88
    SolutionNameMin: Cijk_Alik_Bjlk_BBS_BH_UserArgs_MT128x128x64_MI16x16x1_SN_LDSB1_CLR1_GSU0_GSUC0_GSUWGMRR0_K1_LBSPPA512_LBSPPB2048_LPB0_MIWT4_4_PLR1_SU32_SUM0_SUS256_SKXCCM6_VWA4_VWB4_WGM4_WGMXCC1_WGMXCCGn1
    SolutionIndex: 89
    SolutionNameMin: Cijk_Alik_Bjlk_BBS_BH_UserArgs_MT128x128x64_MI16x16x1_SN_LDSB1_CLR1_GSU0_GSUC0_GSUWGMRR0_K1_LBSPPA512_LBSPPB2048_LPB32_MIWT4_4_PLR1_SU32_SUM0_SUS256_SKXCCM6_VWA4_VWB2_WGM8_WGMXCC1_WGMXCCGn1
    SolutionIndex: 90
    SolutionNameMin: Cijk_Alik_Bjlk_BBS_BH_UserArgs_MT128x128x64_MI16x16x1_SN_LDSB1_CLR1_GSU0_GSUC0_GSUWGMRR0_K1_LBSPPA256_LBSPPB2048_LPB0_MIWT4_4_PLR1_SU32_SUM0_SUS256_SKXCCM6_VWA2_VWB4_WGM8_WGMXCC1_WGMXCCGn1
    SolutionIndex: 91
    SolutionNameMin: Cijk_Alik_Bjlk_BBS_BH_UserArgs_MT128x128x64_MI16x16x1_SN_LDSB1_CLR1_GSU0_GSUC0_GSUWGMRR0_K1_LBSPPA512_LBSPPB2048_LPB0_MIWT4_4_PLR1_SU32_SUM0_SUS256_SKXCCM6_VWA4_VWB4_WGM8_WGMXCC1_WGMXCCGn1
    SolutionIndex: 92
    SolutionNameMin: Cijk_Alik_Bjlk_BBS_BH_UserArgs_MT128x128x64_MI16x16x1_SN_LDSB1_CLR1_GSU0_GSUC0_GSUWGMRR0_K1_LBSPPA512_LBSPPB2048_LPB0_MIWT4_4_PLR2_SU32_SUM0_SUS256_SKXCCM6_VWA4_VWB4_WGM8_WGMXCC1_WGMXCCGn1
    SolutionIndex: 93
    SolutionNameMin: Cijk_Alik_Bjlk_BBS_BH_UserArgs_MT64x128x64_MI16x16x1_SN_LDSB1_CLR1_GSU0_GSUC0_GSUWGMRR0_K1_LBSPPA128_LBSPPB2048_LPB0_MIWT2_4_PLR1_SU32_SUM0_SUS256_SKXCCM6_VWA1_VWB4_WGM8_WGMXCC1_WGMXCCGn1
    SolutionIndex: 94
    SolutionNameMin: Cijk_Alik_Bjlk_BBS_BH_UserArgs_MT64x128x64_MI16x16x1_SN_LDSB1_CLR1_GSU0_GSUC0_GSUWGMRR0_K1_LBSPPA256_LBSPPB2048_LPB0_MIWT2_4_PLR1_SU32_SUM0_SUS256_SKXCCM6_VWA2_VWB4_WGM8_WGMXCC1_WGMXCCGn1
    SolutionIndex: 95
    SolutionNameMin: Cijk_Alik_Bjlk_BBS_BH_UserArgs_MT128x64x64_MI16x16x1_SN_LDSB1_CLR1_GSU0_GSUC0_GSUWGMRR0_K1_LBSPPA512_LBSPPB1024_LPB32_MIWT4_2_PLR1_SU32_SUM0_SUS256_SKXCCM6_VWA4_VWB2_WGM1_WGMXCC1_WGMXCCGn1
    SolutionIndex: 96
    SolutionNameMin: Cijk_Alik_Bjlk_BBS_BH_UserArgs_MT128x64x64_MI16x16x1_SN_LDSB1_CLR1_GSU0_GSUC0_GSUWGMRR0_K1_LBSPPA512_LBSPPB1024_LPB32_MIWT4_2_PLR1_SU32_SUM0_SUS256_SKXCCM6_VWA4_VWB2_WGM8_WGMXCC1_WGMXCCGn1
    SolutionIndex: 97
    SolutionNameMin: Cijk_Alik_Bjlk_BBS_BH_UserArgs_MT64x64x64_MI16x16x1_SN_LDSB1_CLR1_GSU0_GSUC0_GSUWGMRR0_K1_LBSPPA256_LBSPPB1024_LPB32_MIWT2_2_PLR1_SU32_SUM0_SUS256_SKXCCM6_VWA2_VWB2_WGM1_WGMXCC1_WGMXCCGn1
    SolutionIndex: 98
    SolutionNameMin: Cijk_Alik_Bjlk_BBS_BH_UserArgs_MT32x64x64_MI16x16x1_SN_LDSB0_CLR1_GSU0_GSUC0_GSUWGMRR0_K1_LBSPPA128_LBSPPB1024_LPB32_MIWT1_2_PLR1_SU32_SUM0_SUS256_SKXCCM6_VWA1_VWB2_WGM1_WGMXCC1_WGMXCCGn1
    SolutionIndex: 99
    SolutionNameMin: Cijk_Alik_Bjlk_BBS_BH_UserArgs_MT32x32x64_MI16x16x1_SN_LDSB0_CLR1_GSU0_GSUC0_GSUWGMRR0_K1_LBSPPA128_LBSPPB512_LPB16_MIWT1_1_PLR1_SU32_SUM0_SUS256_SKXCCM6_VWA1_VWB1_WGM1_WGMXCC1_WGMXCCGn1
    SolutionIndex: 100
    SolutionNameMin: Cijk_Alik_Bjlk_BBS_BH_UserArgs_MT32x32x64_MI16x16x1_SN_LDSB0_CLR1_GSU0_GSUC0_GSUWGMRR0_K1_LBSPPA128_LBSPPB512_LPB16_MIWT1_1_PLR1_SU32_SUM0_SUS256_SKXCCM6_VWA1_VWB1_WGM4_WGMXCC1_WGMXCCGn1
    SolutionIndex: 101
    SolutionNameMin: Cijk_Alik_Bjlk_BBS_BH_UserArgs_MT64x128x128_MI16x16x1_SN_LDSB1_CLR1_GSU0_GSUC0_GSUWGMRR0_K1_LBSPPA512_LBSPPB2048_LPB0_MIWT2_4_PLR2_SU32_SUM0_SUS256_SKXCCM6_VWA2_VWB4_WGM1_WGMXCC1_WGMXCCGn1
    SolutionIndex: 102
    SolutionNameMin: Cijk_Alik_Bjlk_BBS_BH_UserArgs_MT64x128x128_MI16x16x1_SN_LDSB1_CLR1_GSU0_GSUC0_GSUWGMRR0_K1_LBSPPA256_LBSPPB2048_LPB0_MIWT2_4_PLR2_SU32_SUM0_SUS256_SKXCCM6_VWA1_VWB4_WGM4_WGMXCC1_WGMXCCGn1
    SolutionIndex: 103
    SolutionNameMin: Cijk_Alik_Bjlk_BBS_BH_UserArgs_MT64x128x128_MI16x16x1_SN_LDSB1_CLR1_GSU0_GSUC0_GSUWGMRR0_K1_LBSPPA512_LBSPPB2048_LPB0_MIWT2_4_PLR2_SU32_SUM0_SUS256_SKXCCM6_VWA2_VWB4_WGM8_WGMXCC1_WGMXCCGn1
    SolutionIndex: 104
    SolutionNameMin: Cijk_Alik_Bjlk_BBS_BH_UserArgs_MT128x64x128_MI16x16x1_SN_LDSB1_CLR1_GSU0_GSUC0_GSUWGMRR0_K1_LBSPPA256_LBSPPB1024_LPB32_MIWT4_2_PLR2_SU32_SUM0_SUS256_SKXCCM6_VWA1_VWB2_WGM1_WGMXCC1_WGMXCCGn1
    SolutionIndex: 105
    SolutionNameMin: Cijk_Alik_Bjlk_BBS_BH_UserArgs_MT128x64x128_MI16x16x1_SN_LDSB1_CLR1_GSU0_GSUC0_GSUWGMRR0_K1_LBSPPA512_LBSPPB1024_LPB32_MIWT4_2_PLR2_SU32_SUM0_SUS256_SKXCCM6_VWA2_VWB2_WGM1_WGMXCC1_WGMXCCGn1
    SolutionIndex: 106
    SolutionNameMin: Cijk_Alik_Bjlk_BBS_BH_UserArgs_MT128x64x128_MI16x16x1_SN_LDSB1_CLR1_GSU0_GSUC0_GSUWGMRR0_K1_LBSPPA1024_LBSPPB1024_LPB32_MIWT4_2_PLR2_SU32_SUM0_SUS256_SKXCCM6_VWA4_VWB2_WGM1_WGMXCC1_WGMXCCGn1
    SolutionIndex: 107
    SolutionNameMin: Cijk_Alik_Bjlk_BBS_BH_UserArgs_MT128x64x128_MI16x16x1_SN_LDSB1_CLR1_GSU0_GSUC0_GSUWGMRR0_K1_LBSPPA1024_LBSPPB1024_LPB32_MIWT4_2_PLR1_SU32_SUM0_SUS256_SKXCCM6_VWA4_VWB2_WGM4_WGMXCC1_WGMXCCGn1
    SolutionIndex: 108
    SolutionNameMin: Cijk_Alik_Bjlk_BBS_BH_UserArgs_MT128x64x128_MI16x16x1_SN_LDSB1_CLR1_GSU0_GSUC0_GSUWGMRR0_K1_LBSPPA512_LBSPPB1024_LPB32_MIWT4_2_PLR2_SU32_SUM0_SUS256_SKXCCM6_VWA2_VWB2_WGM4_WGMXCC1_WGMXCCGn1
    SolutionIndex: 109
    SolutionNameMin: Cijk_Alik_Bjlk_BBS_BH_UserArgs_MT128x64x128_MI16x16x1_SN_LDSB1_CLR1_GSU0_GSUC0_GSUWGMRR0_K1_LBSPPA1024_LBSPPB1024_LPB32_MIWT4_2_PLR2_SU32_SUM0_SUS256_SKXCCM6_VWA4_VWB2_WGM4_WGMXCC1_WGMXCCGn1
    SolutionIndex: 110
    SolutionNameMin: Cijk_Alik_Bjlk_BBS_BH_UserArgs_MT128x64x128_MI16x16x1_SN_LDSB1_CLR1_GSU0_GSUC0_GSUWGMRR0_K1_LBSPPA256_LBSPPB1024_LPB32_MIWT4_2_PLR1_SU32_SUM0_SUS256_SKXCCM6_VWA1_VWB2_WGM8_WGMXCC1_WGMXCCGn1
    SolutionIndex: 111
    SolutionNameMin: Cijk_Alik_Bjlk_BBS_BH_UserArgs_MT128x64x128_MI16x16x1_SN_LDSB1_CLR1_GSU0_GSUC0_GSUWGMRR0_K1_LBSPPA1024_LBSPPB1024_LPB32_MIWT4_2_PLR1_SU32_SUM0_SUS256_SKXCCM6_VWA4_VWB2_WGM8_WGMXCC1_WGMXCCGn1
    SolutionIndex: 112
    SolutionNameMin: Cijk_Alik_Bjlk_BBS_BH_UserArgs_MT128x64x128_MI16x16x1_SN_LDSB1_CLR1_GSU0_GSUC0_GSUWGMRR0_K1_LBSPPA512_LBSPPB1024_LPB32_MIWT4_2_PLR2_SU32_SUM0_SUS256_SKXCCM6_VWA2_VWB2_WGM8_WGMXCC1_WGMXCCGn1
    SolutionIndex: 113
    SolutionNameMin: Cijk_Alik_Bjlk_BBS_BH_UserArgs_MT128x64x128_MI16x16x1_SN_LDSB1_CLR1_GSU0_GSUC0_GSUWGMRR0_K1_LBSPPA1024_LBSPPB1024_LPB32_MIWT4_2_PLR2_SU32_SUM0_SUS256_SKXCCM6_VWA4_VWB2_WGM8_WGMXCC1_WGMXCCGn1
    SolutionIndex: 114
    SolutionNameMin: Cijk_Alik_Bjlk_BBS_BH_UserArgs_MT64x64x128_MI16x16x1_SN_LDSB1_CLR1_GSU0_GSUC0_GSUWGMRR0_K1_LBSPPA256_LBSPPB1024_LPB32_MIWT2_2_PLR2_SU32_SUM0_SUS256_SKXCCM6_VWA1_VWB2_WGM1_WGMXCC1_WGMXCCGn1
    SolutionIndex: 115
    SolutionNameMin: Cijk_Alik_Bjlk_BBS_BH_UserArgs_MT64x64x128_MI16x16x1_SN_LDSB1_CLR1_GSU0_GSUC0_GSUWGMRR0_K1_LBSPPA512_LBSPPB1024_LPB32_MIWT2_2_PLR2_SU32_SUM0_SUS256_SKXCCM6_VWA2_VWB2_WGM1_WGMXCC1_WGMXCCGn1
    SolutionIndex: 116
    SolutionNameMin: Cijk_Alik_Bjlk_BBS_BH_UserArgs_MT64x64x128_MI16x16x1_SN_LDSB1_CLR1_GSU0_GSUC0_GSUWGMRR0_K1_LBSPPA256_LBSPPB1024_LPB32_MIWT2_2_PLR2_SU32_SUM0_SUS256_SKXCCM6_VWA1_VWB2_WGM4_WGMXCC1_WGMXCCGn1
    SolutionIndex: 117
    SolutionNameMin: Cijk_Alik_Bjlk_BBS_BH_UserArgs_MT64x64x128_MI16x16x1_SN_LDSB1_CLR1_GSU0_GSUC0_GSUWGMRR0_K1_LBSPPA512_LBSPPB1024_LPB32_MIWT2_2_PLR2_SU32_SUM0_SUS256_SKXCCM6_VWA2_VWB2_WGM4_WGMXCC1_WGMXCCGn1
    SolutionIndex: 118
    SolutionNameMin: Cijk_Alik_Bjlk_BBS_BH_UserArgs_MT64x64x128_MI16x16x1_SN_LDSB1_CLR1_GSU0_GSUC0_GSUWGMRR0_K1_LBSPPA256_LBSPPB1024_LPB32_MIWT2_2_PLR2_SU32_SUM0_SUS256_SKXCCM6_VWA1_VWB2_WGM8_WGMXCC1_WGMXCCGn1
    SolutionIndex: 119
    SolutionNameMin: Cijk_Alik_Bjlk_BBS_BH_UserArgs_MT64x64x128_MI16x16x1_SN_LDSB1_CLR1_GSU0_GSUC0_GSUWGMRR0_K1_LBSPPA512_LBSPPB1024_LPB32_MIWT2_2_PLR2_SU32_SUM0_SUS256_SKXCCM6_VWA2_VWB2_WGM8_WGMXCC1_WGMXCCGn1
    SolutionIndex: 120
    SolutionNameMin: Cijk_Alik_Bjlk_BBS_BH_UserArgs_MT32x64x128_MI16x16x1_SN_LDSB1_CLR1_GSU0_GSUC0_GSUWGMRR0_K1_LBSPPA256_LBSPPB1024_LPB32_MIWT1_2_PLR2_SU32_SUM0_SUS256_SKXCCM6_VWA1_VWB2_WGM1_WGMXCC1_WGMXCCGn1
    SolutionIndex: 121
    SolutionNameMin: Cijk_Alik_Bjlk_BBS_BH_UserArgs_MT32x64x128_MI16x16x1_SN_LDSB1_CLR1_GSU0_GSUC0_GSUWGMRR0_K1_LBSPPA256_LBSPPB1024_LPB32_MIWT1_2_PLR2_SU32_SUM0_SUS256_SKXCCM6_VWA1_VWB2_WGM4_WGMXCC1_WGMXCCGn1
    SolutionIndex: 122
    SolutionNameMin: Cijk_Alik_Bjlk_BBS_BH_UserArgs_MT32x32x128_MI16x16x1_SN_LDSB1_CLR1_GSU0_GSUC0_GSUWGMRR0_K1_LBSPPA256_LBSPPB512_LPB16_MIWT1_1_PLR2_SU32_SUM0_SUS256_SKXCCM6_VWA1_VWB1_WGM1_WGMXCC1_WGMXCCGn1
    SolutionIndex: 123
    SolutionNameMin: Cijk_Alik_Bjlk_BBS_BH_UserArgs_MT32x32x32_MI16x16x1_SN_LDSB0_CLR1_GSU0_GSUC0_GSUWGMRR0_K1_LBSPPA128_LBSPPB256_LPB16_MIWT1_1_PLR1_SU32_SUM0_SUS256_SKXCCM6_VWA1_VWB1_WGM4_WGMXCC1_WGMXCCGn1
- - - [128, 128, 1, 128, 128, 128, 128, 128]
    - [100, 0.081]
  - - [128, 128, 1, 256, 128, 128, 256, 128]
    - [33, 0.146]
  - - [128, 128, 1, 512, 128, 128, 512, 128]
    - [47, 0.25]
  - - [128, 128, 1, 1024, 128, 128, 1024, 128]
    - [48, 0.379]
  - - [128, 128, 1, 2048, 128, 128, 2048, 128]
    - [46, 0.598]
  - - [128, 128, 1, 4096, 128, 128, 4096, 128]
    - [99, 1.043]
  - - [128, 128, 1, 8192, 128, 128, 8192, 128]
    - [122, 1.596]
  - - [128, 256, 1, 128, 128, 128, 128, 256]
    - [32, 0.167]
  - - [128, 256, 1, 256, 128, 128, 256, 256]
    - [45, 0.304]
  - - [128, 256, 1, 512, 128, 128, 512, 256]
    - [45, 0.51]
  - - [128, 256, 1, 1024, 128, 128, 1024, 256]
    - [46, 0.78]
  - - [128, 256, 1, 2048, 128, 128, 2048, 256]
    - [45, 1.177]
  - - [128, 256, 1, 4096, 128, 128, 4096, 256]
    - [99, 2.02]
  - - [128, 256, 1, 8192, 128, 128, 8192, 256]
    - [46, 3.107]
  - - [128, 512, 1, 128, 128, 128, 128, 512]
    - [99, 0.331]
  - - [128, 512, 1, 256, 128, 128, 256, 512]
    - [32, 0.602]
  - - [128, 512, 1, 512, 128, 128, 512, 512]
    - [46, 1.004]
  - - [128, 512, 1, 1024, 128, 128, 1024, 512]
    - [45, 1.539]
  - - [128, 512, 1, 2048, 128, 128, 2048, 512]
    - [46, 2.266]
  - - [128, 512, 1, 4096, 128, 128, 4096, 512]
    - [45, 3.413]
  - - [128, 512, 1, 8192, 128, 128, 8192, 512]
    - [120, 5.108]
  - - [128, 1024, 1, 128, 128, 128, 128, 1024]
    - [46, 0.647]
  - - [128, 1024, 1, 256, 128, 128, 256, 1024]
    - [32, 1.181]
  - - [128, 1024, 1, 512, 128, 128, 512, 1024]
    - [45, 1.982]
  - - [128, 1024, 1, 1024, 128, 128, 1024, 1024]
    - [46, 3.025]
  - - [128, 1024, 1, 2048, 128, 128, 2048, 1024]
    - [43, 4.025]
  - - [128, 1024, 1, 4096, 128, 128, 4096, 1024]
    - [44, 5.666]
  - - [128, 1024, 1, 8192, 128, 128, 8192, 1024]
    - [114, 8.613]
  - - [128, 2048, 1, 128, 128, 128, 128, 2048]
    - [31, 1.223]
  - - [128, 2048, 1, 256, 128, 128, 256, 2048]
    - [30, 2.135]
  - - [128, 2048, 1, 512, 128, 128, 512, 2048]
    - [43, 3.526]
  - - [128, 2048, 1, 1024, 128, 128, 1024, 2048]
    - [120, 5.351]
  - - [128, 2048, 1, 2048, 128, 128, 2048, 2048]
    - [40, 6.608]
  - - [128, 2048, 1, 4096, 128, 128, 4096, 2048]
    - [114, 9.401]
  - - [128, 2048, 1, 8192, 128, 128, 8192, 2048]
    - [106, 13.183]
  - - [128, 4096, 1, 128, 128, 128, 128, 4096]
    - [7, 2.155]
  - - [128, 4096, 1, 256, 128, 128, 256, 4096]
    - [97, 3.732]
  - - [128, 4096, 1, 512, 128, 128, 512, 4096]
    - [40, 6.101]
  - - [128, 4096, 1, 1024, 128, 128, 1024, 4096]
    - [115, 8.8]
  - - [128, 4096, 1, 2048, 128, 128, 2048, 4096]
    - [115, 10.524]
  - - [128, 4096, 1, 4096, 128, 128, 4096, 4096]
    - [28, 13.72]
  - - [128, 4096, 1, 8192, 128, 128, 8192, 4096]
    - [37, 16.318]
  - - [128, 8192, 1, 128, 128, 128, 128, 8192]
    - [26, 3.509]
  - - [128, 8192, 1, 256, 128, 128, 256, 8192]
    - [26, 6.048]
  - - [128, 8192, 1, 512, 128, 128, 512, 8192]
    - [36, 9.496]
  - - [128, 8192, 1, 1024, 128, 128, 1024, 8192]
    - [35, 13.134]
  - - [128, 8192, 1, 2048, 128, 128, 2048, 8192]
    - [28, 14.32]
  - - [128, 8192, 1, 4096, 128, 128, 4096, 8192]
    - [96, 17.348]
  - - [128, 8192, 1, 8192, 128, 128, 8192, 8192]
    - [38, 20.28]
  - - [256, 128, 1, 128, 256, 256, 128, 128]
    - [32, 0.17]
  - - [256, 128, 1, 256, 256, 256, 256, 128]
    - [99, 0.305]
  - - [256, 128, 1, 512, 256, 256, 512, 128]
    - [46, 0.512]
  - - [256, 128, 1, 1024, 256, 256, 1024, 128]
    - [46, 0.784]
  - - [256, 128, 1, 2048, 256, 256, 2048, 128]
    - [46, 1.173]
  - - [256, 128, 1, 4096, 256, 256, 4096, 128]
    - [99, 2.042]
  - - [256, 128, 1, 8192, 256, 256, 8192, 128]
    - [46, 3.11]
  - - [256, 256, 1, 128, 256, 256, 128, 256]
    - [32, 0.328]
  - - [256, 256, 1, 256, 256, 256, 256, 256]
    - [32, 0.611]
  - - [256, 256, 1, 512, 256, 256, 512, 256]
    - [45, 1.02]
  - - [256, 256, 1, 1024, 256, 256, 1024, 256]
    - [45, 1.551]
  - - [256, 256, 1, 2048, 256, 256, 2048, 256]
    - [46, 2.273]
  - - [256, 256, 1, 4096, 256, 256, 4096, 256]
    - [98, 3.453]
  - - [256, 256, 1, 8192, 256, 256, 8192, 256]
    - [43, 5.412]
  - - [256, 512, 1, 128, 256, 256, 128, 512]
    - [32, 0.657]
  - - [256, 512, 1, 256, 256, 256, 256, 512]
    - [45, 1.173]
  - - [256, 512, 1, 512, 256, 256, 512, 512]
    - [45, 2.009]
  - - [256, 512, 1, 1024, 256, 256, 1024, 512]
    - [46, 3.043]
  - - [256, 512, 1, 2048, 256, 256, 2048, 512]
    - [120, 4.038]
  - - [256, 512, 1, 4096, 256, 256, 4096, 512]
    - [44, 5.74]
  - - [256, 512, 1, 8192, 256, 256, 8192, 512]
    - [39, 8.467]
  - - [256, 1024, 1, 128, 256, 256, 128, 1024]
    - [31, 1.198]
  - - [256, 1024, 1, 256, 256, 256, 256, 1024]
    - [30, 2.129]
  - - [256, 1024, 1, 512, 256, 256, 512, 1024]
    - [43, 3.584]
  - - [256, 1024, 1, 1024, 256, 256, 1024, 1024]
    - [43, 5.356]
  - - [256, 1024, 1, 2048, 256, 256, 2048, 1024]
    - [40, 6.657]
  - - [256, 1024, 1, 4096, 256, 256, 4096, 1024]
    - [114, 9.463]
  - - [256, 1024, 1, 8192, 256, 256, 8192, 1024]
    - [106, 12.865]
  - - [256, 2048, 1, 128, 256, 256, 128, 2048]
    - [29, 2.138]
  - - [256, 2048, 1, 256, 256, 256, 256, 2048]
    - [29, 3.726]
  - - [256, 2048, 1, 512, 256, 256, 512, 2048]
    - [40, 6.082]
  - - [256, 2048, 1, 1024, 256, 256, 1024, 2048]
    - [42, 8.771]
  - - [256, 2048, 1, 2048, 256, 256, 2048, 2048]
    - [114, 10.393]
  - - [256, 2048, 1, 4096, 256, 256, 4096, 2048]
    - [106, 14.073]
  - - [256, 2048, 1, 8192, 256, 256, 8192, 2048]
    - [112, 15.377]
  - - [256, 4096, 1, 128, 256, 256, 128, 4096]
    - [26, 3.503]
  - - [256, 4096, 1, 256, 256, 256, 256, 4096]
    - [26, 5.99]
  - - [256, 4096, 1, 512, 256, 256, 512, 4096]
    - [35, 9.427]
  - - [256, 4096, 1, 1024, 256, 256, 1024, 4096]
    - [106, 13.592]
  - - [256, 4096, 1, 2048, 256, 256, 2048, 4096]
    - [106, 14.795]
  - - [256, 4096, 1, 4096, 256, 256, 4096, 4096]
    - [108, 17.5]
  - - [256, 4096, 1, 8192, 256, 256, 8192, 4096]
    - [20, 19.577]
  - - [256, 8192, 1, 128, 256, 256, 128, 8192]
    - [84, 5.239]
  - - [256, 8192, 1, 256, 256, 256, 256, 8192]
    - [84, 8.985]
  - - [256, 8192, 1, 512, 256, 256, 512, 8192]
    - [84, 14.048]
  - - [256, 8192, 1, 1024, 256, 256, 1024, 8192]
    - [95, 14.567]
  - - [256, 8192, 1, 2048, 256, 256, 2048, 8192]
    - [110, 17.81]
  - - [256, 8192, 1, 4096, 256, 256, 4096, 8192]
    - [88, 20.933]
  - - [256, 8192, 1, 8192, 256, 256, 8192, 8192]
    - [13, 23.951]
  - - [512, 128, 1, 128, 512, 512, 128, 128]
    - [32, 0.335]
  - - [512, 128, 1, 256, 512, 512, 256, 128]
    - [45, 0.602]
  - - [512, 128, 1, 512, 512, 512, 512, 128]
    - [45, 1.015]
  - - [512, 128, 1, 1024, 512, 512, 1024, 128]
    - [46, 1.55]
  - - [512, 128, 1, 2048, 512, 512, 2048, 128]
    - [46, 2.29]
  - - [512, 128, 1, 4096, 512, 512, 4096, 128]
    - [98, 3.47]
  - - [512, 128, 1, 8192, 512, 512, 8192, 128]
    - [120, 5.453]
  - - [512, 256, 1, 128, 512, 512, 128, 256]
    - [32, 0.655]
  - - [512, 256, 1, 256, 512, 512, 256, 256]
    - [32, 1.189]
  - - [512, 256, 1, 512, 512, 512, 512, 256]
    - [45, 1.969]
  - - [512, 256, 1, 1024, 512, 512, 1024, 256]
    - [45, 3.034]
  - - [512, 256, 1, 2048, 512, 512, 2048, 256]
    - [120, 4.043]
  - - [512, 256, 1, 4096, 512, 512, 4096, 256]
    - [121, 5.941]
  - - [512, 256, 1, 8192, 512, 512, 8192, 256]
    - [118, 8.511]
  - - [512, 512, 1, 128, 512, 512, 128, 512]
    - [30, 1.218]
  - - [512, 512, 1, 256, 512, 512, 256, 512]
    - [43, 2.144]
  - - [512, 512, 1, 512, 512, 512, 512, 512]
    - [43, 3.547]
  - - [512, 512, 1, 1024, 512, 512, 1024, 512]
    - [43, 5.392]
  - - [512, 512, 1, 2048, 512, 512, 2048, 512]
    - [119, 6.729]
  - - [512, 512, 1, 4096, 512, 512, 4096, 512]
    - [41, 9.231]
  - - [512, 512, 1, 8192, 512, 512, 8192, 512]
    - [36, 12.879]
  - - [512, 1024, 1, 128, 512, 512, 128, 1024]
    - [7, 2.14]
  - - [512, 1024, 1, 256, 512, 512, 256, 1024]
    - [29, 3.717]
  - - [512, 1024, 1, 512, 512, 512, 512, 1024]
    - [40, 6.119]
  - - [512, 1024, 1, 1024, 512, 512, 1024, 1024]
    - [40, 8.907]
  - - [512, 1024, 1, 2048, 512, 512, 2048, 1024]
    - [114, 10.495]
  - - [512, 1024, 1, 4096, 512, 512, 4096, 1024]
    - [113, 13.163]
  - - [512, 1024, 1, 8192, 512, 512, 8192, 1024]
    - [113, 15.792]
  - - [512, 2048, 1, 128, 512, 512, 128, 2048]
    - [27, 3.495]
  - - [512, 2048, 1, 256, 512, 512, 256, 2048]
    - [26, 6.064]
  - - [512, 2048, 1, 512, 512, 512, 512, 2048]
    - [35, 9.431]
  - - [512, 2048, 1, 1024, 512, 512, 1024, 2048]
    - [105, 13.467]
  - - [512, 2048, 1, 2048, 512, 512, 2048, 2048]
    - [107, 14.253]
  - - [512, 2048, 1, 4096, 512, 512, 4096, 2048]
    - [91, 16.266]
  - - [512, 2048, 1, 8192, 512, 512, 8192, 2048]
    - [81, 17.688]
  - - [512, 4096, 1, 128, 512, 512, 128, 4096]
    - [84, 5.221]
  - - [512, 4096, 1, 256, 512, 512, 256, 4096]
    - [84, 8.962]
  - - [512, 4096, 1, 512, 512, 512, 512, 4096]
    - [84, 13.988]
  - - [512, 4096, 1, 1024, 512, 512, 1024, 4096]
    - [106, 15.239]
  - - [512, 4096, 1, 2048, 512, 512, 2048, 4096]
    - [104, 17.739]
  - - [512, 4096, 1, 4096, 512, 512, 4096, 4096]
    - [18, 19.791]
  - - [512, 4096, 1, 8192, 512, 512, 8192, 4096]
    - [15, 21.466]
  - - [512, 8192, 1, 128, 512, 512, 128, 8192]
    - [68, 7.153]
  - - [512, 8192, 1, 256, 512, 512, 256, 8192]
    - [68, 11.763]
  - - [512, 8192, 1, 512, 512, 512, 512, 8192]
    - [78, 16.72]
  - - [512, 8192, 1, 1024, 512, 512, 1024, 8192]
    - [95, 17.773]
  - - [512, 8192, 1, 2048, 512, 512, 2048, 8192]
    - [80, 21.141]
  - - [512, 8192, 1, 4096, 512, 512, 4096, 8192]
    - [13, 24.326]
  - - [512, 8192, 1, 8192, 512, 512, 8192, 8192]
    - [13, 26.535]
  - - [1024, 128, 1, 128, 1024, 1024, 128, 128]
    - [32, 0.639]
  - - [1024, 128, 1, 256, 1024, 1024, 256, 128]
    - [32, 1.166]
  - - [1024, 128, 1, 512, 1024, 1024, 512, 128]
    - [46, 1.994]
  - - [1024, 128, 1, 1024, 1024, 1024, 1024, 128]
    - [46, 3.026]
  - - [1024, 128, 1, 2048, 1024, 1024, 2048, 128]
    - [120, 4.003]
  - - [1024, 128, 1, 4096, 1024, 1024, 4096, 128]
    - [120, 6.002]
  - - [1024, 128, 1, 8192, 1024, 1024, 8192, 128]
    - [116, 8.529]
  - - [1024, 256, 1, 128, 1024, 1024, 128, 256]
    - [30, 1.205]
  - - [1024, 256, 1, 256, 1024, 1024, 256, 256]
    - [30, 2.128]
  - - [1024, 256, 1, 512, 1024, 1024, 512, 256]
    - [43, 3.567]
  - - [1024, 256, 1, 1024, 1024, 1024, 1024, 256]
    - [43, 5.337]
  - - [1024, 256, 1, 2048, 1024, 1024, 2048, 256]
    - [117, 6.687]
  - - [1024, 256, 1, 4096, 1024, 1024, 4096, 256]
    - [121, 9.53]
  - - [1024, 256, 1, 8192, 1024, 1024, 8192, 256]
    - [113, 12.658]
  - - [1024, 512, 1, 128, 1024, 1024, 128, 512]
    - [40, 2.127]
  - - [1024, 512, 1, 256, 1024, 1024, 256, 512]
    - [40, 3.715]
  - - [1024, 512, 1, 512, 1024, 1024, 512, 512]
    - [40, 6.111]
  - - [1024, 512, 1, 1024, 1024, 1024, 1024, 512]
    - [40, 8.952]
  - - [1024, 512, 1, 2048, 1024, 1024, 2048, 512]
    - [119, 10.742]
  - - [1024, 512, 1, 4096, 1024, 1024, 4096, 512]
    - [116, 13.113]
  - - [1024, 512, 1, 8192, 1024, 1024, 8192, 512]
    - [113, 15.729]
  - - [1024, 1024, 1, 128, 1024, 1024, 128, 1024]
    - [6, 3.498]
  - - [1024, 1024, 1, 256, 1024, 1024, 256, 1024]
    - [26, 6.026]
  - - [1024, 1024, 1, 512, 1024, 1024, 512, 1024]
    - [36, 9.415]
  - - [1024, 1024, 1, 1024, 1024, 1024, 1024, 1024]
    - [34, 13.311]
  - - [1024, 1024, 1, 2048, 1024, 1024, 2048, 1024]
    - [113, 14.187]
  - - [1024, 1024, 1, 4096, 1024, 1024, 4096, 1024]
    - [23, 16.039]
  - - [1024, 1024, 1, 8192, 1024, 1024, 8192, 1024]
    - [81, 17.6]
  - - [1024, 2048, 1, 128, 1024, 1024, 128, 2048]
    - [22, 5.221]
  - - [1024, 2048, 1, 256, 1024, 1024, 256, 2048]
    - [84, 8.948]
  - - [1024, 2048, 1, 512, 1024, 1024, 512, 2048]
    - [84, 13.911]
  - - [1024, 2048, 1, 1024, 1024, 1024, 1024, 2048]
    - [106, 14.882]
  - - [1024, 2048, 1, 2048, 1024, 1024, 2048, 2048]
    - [108, 16.803]
  - - [1024, 2048, 1, 4096, 1024, 1024, 4096, 2048]
    - [17, 19.559]
  - - [1024, 2048, 1, 8192, 1024, 1024, 8192, 2048]
    - [18, 21.252]
  - - [1024, 4096, 1, 128, 1024, 1024, 128, 4096]
    - [70, 7.392]
  - - [1024, 4096, 1, 256, 1024, 1024, 256, 4096]
    - [68, 11.914]
  - - [1024, 4096, 1, 512, 1024, 1024, 512, 4096]
    - [78, 16.699]
  - - [1024, 4096, 1, 1024, 1024, 1024, 1024, 4096]
    - [105, 17.8]
  - - [1024, 4096, 1, 2048, 1024, 1024, 2048, 4096]
    - [88, 20.517]
  - - [1024, 4096, 1, 4096, 1024, 1024, 4096, 4096]
    - [18, 22.391]
  - - [1024, 4096, 1, 8192, 1024, 1024, 8192, 4096]
    - [17, 25.286]
  - - [1024, 8192, 1, 128, 1024, 1024, 128, 8192]
    - [54, 8.571]
  - - [1024, 8192, 1, 256, 1024, 1024, 256, 8192]
    - [54, 13.484]
  - - [1024, 8192, 1, 512, 1024, 1024, 512, 8192]
    - [88, 16.554]
  - - [1024, 8192, 1, 1024, 1024, 1024, 1024, 8192]
    - [85, 21.116]
  - - [1024, 8192, 1, 2048, 1024, 1024, 2048, 8192]
    - [77, 23.223]
  - - [1024, 8192, 1, 4096, 1024, 1024, 4096, 8192]
    - [13, 25.0]
  - - [1024, 8192, 1, 8192, 1024, 1024, 8192, 8192]
    - [2, 27.134]
  - - [2048, 128, 1, 128, 2048, 2048, 128, 128]
    - [43, 1.209]
  - - [2048, 128, 1, 256, 2048, 2048, 256, 128]
    - [43, 2.139]
  - - [2048, 128, 1, 512, 2048, 2048, 512, 128]
    - [43, 3.562]
  - - [2048, 128, 1, 1024, 2048, 2048, 1024, 128]
    - [43, 5.328]
  - - [2048, 128, 1, 2048, 2048, 2048, 2048, 128]
    - [115, 6.756]
  - - [2048, 128, 1, 4096, 2048, 2048, 4096, 128]
    - [116, 9.548]
  - - [2048, 128, 1, 8192, 2048, 2048, 8192, 128]
    - [119, 12.694]
  - - [2048, 256, 1, 128, 2048, 2048, 128, 256]
    - [7, 2.168]
  - - [2048, 256, 1, 256, 2048, 2048, 256, 256]
    - [29, 3.722]
  - - [2048, 256, 1, 512, 2048, 2048, 512, 256]
    - [40, 6.108]
  - - [2048, 256, 1, 1024, 2048, 2048, 1024, 256]
    - [42, 8.825]
  - - [2048, 256, 1, 2048, 2048, 2048, 2048, 256]
    - [117, 10.803]
  - - [2048, 256, 1, 4096, 2048, 2048, 4096, 256]
    - [103, 13.631]
  - - [2048, 256, 1, 8192, 2048, 2048, 8192, 256]
    - [88, 15.903]
  - - [2048, 512, 1, 128, 2048, 2048, 128, 512]
    - [27, 3.521]
  - - [2048, 512, 1, 256, 2048, 2048, 256, 512]
    - [26, 6.034]
  - - [2048, 512, 1, 512, 2048, 2048, 512, 512]
    - [36, 9.492]
  - - [2048, 512, 1, 1024, 2048, 2048, 1024, 512]
    - [113, 13.424]
  - - [2048, 512, 1, 2048, 2048, 2048, 2048, 512]
    - [113, 15.05]
  - - [2048, 512, 1, 4096, 2048, 2048, 4096, 512]
    - [92, 16.008]
  - - [2048, 512, 1, 8192, 2048, 2048, 8192, 512]
    - [79, 17.743]
  - - [2048, 1024, 1, 128, 2048, 2048, 128, 1024]
    - [22, 5.253]
  - - [2048, 1024, 1, 256, 2048, 2048, 256, 1024]
    - [84, 8.954]
  - - [2048, 1024, 1, 512, 2048, 2048, 512, 1024]
    - [88, 13.761]
  - - [2048, 1024, 1, 1024, 2048, 2048, 1024, 1024]
    - [94, 15.048]
  - - [2048, 1024, 1, 2048, 2048, 2048, 2048, 1024]
    - [112, 16.973]
  - - [2048, 1024, 1, 4096, 2048, 2048, 4096, 1024]
    - [16, 19.348]
  - - [2048, 1024, 1, 8192, 2048, 2048, 8192, 1024]
    - [3, 20.681]
  - - [2048, 2048, 1, 128, 2048, 2048, 128, 2048]
    - [4, 7.438]
  - - [2048, 2048, 1, 256, 2048, 2048, 256, 2048]
    - [65, 11.603]
  - - [2048, 2048, 1, 512, 2048, 2048, 512, 2048]
    - [14, 16.483]
  - - [2048, 2048, 1, 1024, 2048, 2048, 1024, 2048]
    - [111, 17.42]
  - - [2048, 2048, 1, 2048, 2048, 2048, 2048, 2048]
    - [90, 20.335]
  - - [2048, 2048, 1, 4096, 2048, 2048, 4096, 2048]
    - [74, 21.235]
  - - [2048, 2048, 1, 8192, 2048, 2048, 8192, 2048]
    - [59, 24.003]
  - - [2048, 4096, 1, 128, 2048, 2048, 128, 4096]
    - [54, 8.562]
  - - [2048, 4096, 1, 256, 2048, 2048, 256, 4096]
    - [0, 13.47]
  - - [2048, 4096, 1, 512, 2048, 2048, 512, 4096]
    - [86, 16.428]
  - - [2048, 4096, 1, 1024, 2048, 2048, 1024, 4096]
    - [85, 20.792]
  - - [2048, 4096, 1, 2048, 2048, 2048, 2048, 4096]
    - [73, 23.603]
  - - [2048, 4096, 1, 4096, 2048, 2048, 4096, 4096]
    - [85, 25.246]
  - - [2048, 4096, 1, 8192, 2048, 2048, 8192, 4096]
    - [51, 26.836]
  - - [2048, 8192, 1, 128, 2048, 2048, 128, 8192]
    - [85, 8.489]
  - - [2048, 8192, 1, 256, 2048, 2048, 256, 8192]
    - [83, 13.557]
  - - [2048, 8192, 1, 512, 2048, 2048, 512, 8192]
    - [63, 18.274]
  - - [2048, 8192, 1, 1024, 2048, 2048, 1024, 8192]
    - [84, 21.657]
  - - [2048, 8192, 1, 2048, 2048, 2048, 2048, 8192]
    - [64, 24.661]
  - - [2048, 8192, 1, 4096, 2048, 2048, 4096, 8192]
    - [64, 28.589]
  - - [2048, 8192, 1, 8192, 2048, 2048, 8192, 8192]
    - [62, 29.691]
  - - [4096, 128, 1, 128, 4096, 4096, 128, 128]
    - [97, 2.133]
  - - [4096, 128, 1, 256, 4096, 4096, 256, 128]
    - [29, 3.742]
  - - [4096, 128, 1, 512, 4096, 4096, 512, 128]
    - [115, 6.057]
  - - [4096, 128, 1, 1024, 4096, 4096, 1024, 128]
    - [115, 8.832]
  - - [4096, 128, 1, 2048, 4096, 4096, 2048, 128]
    - [116, 10.609]
  - - [4096, 128, 1, 4096, 4096, 4096, 4096, 128]
    - [113, 13.487]
  - - [4096, 128, 1, 8192, 4096, 4096, 8192, 128]
    - [101, 16.435]
  - - [4096, 256, 1, 128, 4096, 4096, 128, 256]
    - [6, 3.523]
  - - [4096, 256, 1, 256, 4096, 4096, 256, 256]
    - [26, 6.046]
  - - [4096, 256, 1, 512, 4096, 4096, 512, 256]
    - [37, 9.316]
  - - [4096, 256, 1, 1024, 4096, 4096, 1024, 256]
    - [108, 13.351]
  - - [4096, 256, 1, 2048, 4096, 4096, 2048, 256]
    - [119, 14.468]
  - - [4096, 256, 1, 4096, 4096, 4096, 4096, 256]
    - [91, 17.277]
  - - [4096, 256, 1, 8192, 4096, 4096, 8192, 256]
    - [19, 18.668]
  - - [4096, 512, 1, 128, 4096, 4096, 128, 512]
    - [84, 5.189]
  - - [4096, 512, 1, 256, 4096, 4096, 256, 512]
    - [24, 8.928]
  - - [4096, 512, 1, 512, 4096, 4096, 512, 512]
    - [87, 13.864]
  - - [4096, 512, 1, 1024, 4096, 4096, 1024, 512]
    - [113, 14.819]
  - - [4096, 512, 1, 2048, 4096, 4096, 2048, 512]
    - [93, 17.919]
  - - [4096, 512, 1, 4096, 4096, 4096, 4096, 512]
    - [80, 19.738]
  - - [4096, 512, 1, 8192, 4096, 4096, 8192, 512]
    - [67, 21.073]
  - - [4096, 1024, 1, 128, 4096, 4096, 128, 1024]
    - [69, 7.407]
  - - [4096, 1024, 1, 256, 4096, 4096, 256, 1024]
    - [69, 11.326]
  - - [4096, 1024, 1, 512, 4096, 4096, 512, 1024]
    - [14, 16.225]
  - - [4096, 1024, 1, 1024, 4096, 4096, 1024, 1024]
    - [90, 17.81]
  - - [4096, 1024, 1, 2048, 4096, 4096, 2048, 1024]
    - [91, 20.891]
  - - [4096, 1024, 1, 4096, 4096, 4096, 4096, 1024]
    - [84, 21.371]
  - - [4096, 1024, 1, 8192, 4096, 4096, 8192, 1024]
    - [56, 24.424]
  - - [4096, 2048, 1, 128, 4096, 4096, 128, 2048]
    - [54, 8.542]
  - - [4096, 2048, 1, 256, 4096, 4096, 256, 2048]
    - [0, 13.574]
  - - [4096, 2048, 1, 512, 4096, 4096, 512, 2048]
    - [91, 16.371]
  - - [4096, 2048, 1, 1024, 4096, 4096, 1024, 2048]
    - [89, 20.571]
  - - [4096, 2048, 1, 2048, 4096, 4096, 2048, 2048]
    - [71, 23.13]
  - - [4096, 2048, 1, 4096, 4096, 4096, 4096, 2048]
    - [73, 25.767]
  - - [4096, 2048, 1, 8192, 4096, 4096, 8192, 2048]
    - [52, 26.497]
  - - [4096, 4096, 1, 128, 4096, 4096, 128, 4096]
    - [85, 8.578]
  - - [4096, 4096, 1, 256, 4096, 4096, 256, 4096]
    - [83, 13.491]
  - - [4096, 4096, 1, 512, 4096, 4096, 512, 4096]
    - [88, 18.16]
  - - [4096, 4096, 1, 1024, 4096, 4096, 1024, 4096]
    - [91, 21.862]
  - - [4096, 4096, 1, 2048, 4096, 4096, 2048, 4096]
    - [10, 25.241]
  - - [4096, 4096, 1, 4096, 4096, 4096, 4096, 4096]
    - [72, 28.279]
  - - [4096, 4096, 1, 8192, 4096, 4096, 8192, 4096]
    - [50, 29.957]
  - - [4096, 8192, 1, 128, 4096, 4096, 128, 8192]
    - [82, 10.014]
  - - [4096, 8192, 1, 256, 4096, 4096, 256, 8192]
    - [73, 14.584]
  - - [4096, 8192, 1, 512, 4096, 4096, 512, 8192]
    - [72, 18.794]
  - - [4096, 8192, 1, 1024, 4096, 4096, 1024, 8192]
    - [76, 23.945]
  - - [4096, 8192, 1, 2048, 4096, 4096, 2048, 8192]
    - [60, 29.169]
  - - [4096, 8192, 1, 4096, 4096, 4096, 4096, 8192]
    - [49, 31.925]
  - - [4096, 8192, 1, 8192, 4096, 4096, 8192, 8192]
    - [58, 35.409]
  - - [8192, 128, 1, 128, 8192, 8192, 128, 128]
    - [6, 3.507]
  - - [8192, 128, 1, 256, 8192, 8192, 256, 128]
    - [26, 5.985]
  - - [8192, 128, 1, 512, 8192, 8192, 512, 128]
    - [26, 9.331]
  - - [8192, 128, 1, 1024, 8192, 8192, 1024, 128]
    - [34, 13.447]
  - - [8192, 128, 1, 2048, 8192, 8192, 2048, 128]
    - [26, 13.674]
  - - [8192, 128, 1, 4096, 8192, 8192, 4096, 128]
    - [101, 17.244]
  - - [8192, 128, 1, 8192, 8192, 8192, 8192, 128]
    - [25, 19.953]
  - - [8192, 256, 1, 128, 8192, 8192, 128, 256]
    - [82, 5.119]
  - - [8192, 256, 1, 256, 8192, 8192, 256, 256]
    - [90, 8.83]
  - - [8192, 256, 1, 512, 8192, 8192, 512, 256]
    - [90, 13.891]
  - - [8192, 256, 1, 1024, 8192, 8192, 1024, 256]
    - [109, 14.776]
  - - [8192, 256, 1, 2048, 8192, 8192, 2048, 256]
    - [102, 18.217]
  - - [8192, 256, 1, 4096, 8192, 8192, 4096, 256]
    - [85, 20.703]
  - - [8192, 256, 1, 8192, 8192, 8192, 8192, 256]
    - [8, 24.006]
  - - [8192, 512, 1, 128, 8192, 8192, 128, 512]
    - [5, 7.169]
  - - [8192, 512, 1, 256, 8192, 8192, 256, 512]
    - [66, 11.319]
  - - [8192, 512, 1, 512, 8192, 8192, 512, 512]
    - [75, 16.175]
  - - [8192, 512, 1, 1024, 8192, 8192, 1024, 512]
    - [86, 17.959]
  - - [8192, 512, 1, 2048, 8192, 8192, 2048, 512]
    - [90, 21.946]
  - - [8192, 512, 1, 4096, 8192, 8192, 4096, 512]
    - [8, 24.484]
  - - [8192, 512, 1, 8192, 8192, 8192, 8192, 512]
    - [10, 26.608]
  - - [8192, 1024, 1, 128, 8192, 8192, 128, 1024]
    - [53, 8.608]
  - - [8192, 1024, 1, 256, 8192, 8192, 256, 1024]
    - [57, 13.476]
  - - [8192, 1024, 1, 512, 8192, 8192, 512, 1024]
    - [91, 16.732]
  - - [8192, 1024, 1, 1024, 8192, 8192, 1024, 1024]
    - [91, 21.271]
  - - [8192, 1024, 1, 2048, 8192, 8192, 2048, 1024]
    - [71, 23.828]
  - - [8192, 1024, 1, 4096, 8192, 8192, 4096, 1024]
    - [72, 25.333]
  - - [8192, 1024, 1, 8192, 8192, 8192, 8192, 1024]
    - [8, 27.213]
  - - [8192, 2048, 1, 128, 8192, 8192, 128, 2048]
    - [91, 8.468]
  - - [8192, 2048, 1, 256, 8192, 8192, 256, 2048]
    - [88, 13.632]
  - - [8192, 2048, 1, 512, 8192, 8192, 512, 2048]
    - [91, 18.832]
  - - [8192, 2048, 1, 1024, 8192, 8192, 1024, 2048]
    - [73, 22.003]
  - - [8192, 2048, 1, 2048, 8192, 8192, 2048, 2048]
    - [74, 26.095]
  - - [8192, 2048, 1, 4096, 8192, 8192, 4096, 2048]
    - [8, 28.931]
  - - [8192, 2048, 1, 8192, 8192, 8192, 8192, 2048]
    - [1, 29.308]
  - - [8192, 4096, 1, 128, 8192, 8192, 128, 4096]
    - [21, 9.633]
  - - [8192, 4096, 1, 256, 8192, 8192, 256, 4096]
    - [61, 14.015]
  - - [8192, 4096, 1, 512, 8192, 8192, 512, 4096]
    - [64, 18.815]
  - - [8192, 4096, 1, 1024, 8192, 8192, 1024, 4096]
    - [9, 23.502]
  - - [8192, 4096, 1, 2048, 8192, 8192, 2048, 4096]
    - [8, 28.512]
  - - [8192, 4096, 1, 4096, 8192, 8192, 4096, 4096]
    - [8, 31.024]
  - - [8192, 4096, 1, 8192, 8192, 8192, 8192, 4096]
    - [59, 34.3]
  - - [8192, 8192, 1, 128, 8192, 8192, 128, 8192]
    - [11, 9.583]
  - - [8192, 8192, 1, 256, 8192, 8192, 256, 8192]
    - [73, 14.354]
  - - [8192, 8192, 1, 512, 8192, 8192, 512, 8192]
    - [12, 19.633]
  - - [8192, 8192, 1, 1024, 8192, 8192, 1024, 8192]
    - [8, 25.993]
  - - [8192, 8192, 1, 2048, 8192, 8192, 2048, 8192]
    - [59, 30.963]
  - - [8192, 8192, 1, 4096, 8192, 8192, 4096, 8192]
    - [55, 34.044]
  - - [8192, 8192, 1, 8192, 8192, 8192, 8192, 8192]
    - [60, 36.719]
  - - [1, 1, 1, 32, 1, 1, 32, 1]
    - [123, 0.0]
- null
- null
- ExperimentalStreamK
- GridBased
