library/src/amd_detail/rocblaslt/src/Tensile/Logic/asm_full/aquavanjaram/gfx942_228cu/StreamK/aquavanjaram942_Cijk_Ailk_Bljk_BSS_BH_UserArgs.yaml
- {MinimumRequiredVersion: 4.33.0}
- aquavanjaram942
- {Architecture: gfx942, CUCount: 228}
- [Device 0049, Device 0050]
    SolutionIndex: 0
    SolutionNameMin: Cijk_Ailk_Bljk_BSS_BH_UserArgs_MT256x256x32_MI16x16x1_SN_LDSB1_CLR1_GSU0_GSUC0_GSUWGMRR0_K1_LBSPPA2048_LBSPPB128_LPA0_MIWT8_8_PLR1_SU32_SUM0_SUS256_SKXCCM0_VWA4_VWB1_WGM1_WGMXCC1_WGMXCCGn1
    SolutionIndex: 1
    SolutionNameMin: Cijk_Ailk_Bljk_BSS_BH_UserArgs_MT256x256x32_MI16x16x1_SN_LDSB1_CLR1_GSU0_GSUC0_GSUWGMRR0_K1_LBSPPA2048_LBSPPB128_LPA0_MIWT8_8_PLR1_SU32_SUM0_SUS256_SKXCCM0_VWA4_VWB2_WGM1_WGMXCC1_WGMXCCGn1
    SolutionIndex: 2
    SolutionNameMin: Cijk_Ailk_Bljk_BSS_BH_UserArgs_MT256x256x32_MI16x16x1_SN_LDSB1_CLR1_GSU0_GSUC0_GSUWGMRR0_K1_LBSPPA2048_LBSPPB256_LPA0_MIWT8_8_PLR1_SU32_SUM0_SUS256_SKXCCM0_VWA4_VWB4_WGM1_WGMXCC1_WGMXCCGn1
    SolutionIndex: 3
    SolutionNameMin: Cijk_Ailk_Bljk_BSS_BH_UserArgs_MT256x256x32_MI16x16x1_SN_LDSB1_CLR1_GSU0_GSUC0_GSUWGMRR0_K1_LBSPPA2048_LBSPPB512_LPA0_MIWT8_8_PLR1_SU32_SUM0_SUS256_SKXCCM0_VWA4_VWB8_WGM1_WGMXCC1_WGMXCCGn1
    SolutionIndex: 4
    SolutionNameMin: Cijk_Ailk_Bljk_BSS_BH_UserArgs_MT256x128x32_MI16x16x1_SN_LDSB1_CLR1_GSU0_GSUC0_GSUWGMRR0_K1_LBSPPA2048_LBSPPB128_LPA0_MIWT8_4_PLR1_SU32_SUM0_SUS256_SKXCCM0_VWA4_VWB2_WGM1_WGMXCC1_WGMXCCGn1
    SolutionIndex: 5
    SolutionNameMin: Cijk_Ailk_Bljk_BSS_BH_UserArgs_MT256x128x32_MI16x16x1_SN_LDSB1_CLR1_GSU0_GSUC0_GSUWGMRR0_K1_LBSPPA2048_LBSPPB256_LPA0_MIWT8_4_PLR1_SU32_SUM0_SUS256_SKXCCM0_VWA4_VWB4_WGM4_WGMXCC1_WGMXCCGn1
    SolutionIndex: 6
    SolutionNameMin: Cijk_Ailk_Bljk_BSS_BH_UserArgs_MT256x128x32_MI16x16x1_SN_LDSB1_CLR1_GSU0_GSUC0_GSUWGMRR0_K1_LBSPPA2048_LBSPPB128_LPA0_MIWT8_4_PLR1_SU32_SUM0_SUS256_SKXCCM0_VWA4_VWB1_WGM8_WGMXCC1_WGMXCCGn1
    SolutionIndex: 7
    SolutionNameMin: Cijk_Ailk_Bljk_BSS_BH_UserArgs_MT256x64x32_MI16x16x1_SN_LDSB1_CLR1_GSU0_GSUC0_GSUWGMRR0_K1_LBSPPA2048_LBSPPB128_LPA0_MIWT8_2_PLR1_SU32_SUM0_SUS256_SKXCCM0_VWA4_VWB1_WGM1_WGMXCC1_WGMXCCGn1
    SolutionIndex: 8
    SolutionNameMin: Cijk_Ailk_Bljk_BSS_BH_UserArgs_MT128x128x32_MI16x16x1_SN_LDSB1_CLR1_GSU0_GSUC0_GSUWGMRR0_K1_LBSPPA1024_LBSPPB128_LPA0_MIWT4_4_PLR1_SU32_SUM0_SUS256_SKXCCM0_VWA4_VWB1_WGM8_WGMXCC1_WGMXCCGn1
    SolutionIndex: 9
    SolutionNameMin: Cijk_Ailk_Bljk_BSS_BH_UserArgs_MT128x64x32_MI16x16x1_SN_LDSB0_CLR1_GSU0_GSUC0_GSUWGMRR0_K1_LBSPPA1024_LBSPPB128_LPA0_MIWT4_2_PLR1_SU32_SUM0_SUS256_SKXCCM0_VWA4_VWB1_WGM1_WGMXCC1_WGMXCCGn1
    SolutionIndex: 10
    SolutionNameMin: Cijk_Ailk_Bljk_BSS_BH_UserArgs_MT128x64x32_MI16x16x1_SN_LDSB0_CLR1_GSU0_GSUC0_GSUWGMRR0_K1_LBSPPA1024_LBSPPB128_LPA0_MIWT4_2_PLR1_SU32_SUM0_SUS256_SKXCCM0_VWA4_VWB2_WGM1_WGMXCC1_WGMXCCGn1
    SolutionIndex: 11
    SolutionNameMin: Cijk_Ailk_Bljk_BSS_BH_UserArgs_MT128x64x32_MI16x16x1_SN_LDSB0_CLR1_GSU0_GSUC0_GSUWGMRR0_K1_LBSPPA1024_LBSPPB128_LPA0_MIWT4_2_PLR1_SU32_SUM0_SUS256_SKXCCM0_VWA4_VWB1_WGM8_WGMXCC1_WGMXCCGn1
    SolutionIndex: 12
    SolutionNameMin: Cijk_Ailk_Bljk_BSS_BH_UserArgs_MT128x256x64_MI16x16x1_SN_LDSB1_CLR1_GSU0_GSUC0_GSUWGMRR0_K1_LBSPPA2048_LBSPPB128_LPA0_MIWT4_8_PLR1_SU32_SUM0_SUS256_SKXCCM0_VWA4_VWB1_WGM1_WGMXCC1_WGMXCCGn1
    SolutionIndex: 13
    SolutionNameMin: Cijk_Ailk_Bljk_BSS_BH_UserArgs_MT128x256x64_MI16x16x1_SN_LDSB1_CLR1_GSU0_GSUC0_GSUWGMRR0_K1_LBSPPA2048_LBSPPB256_LPA0_MIWT4_8_PLR1_SU32_SUM0_SUS256_SKXCCM0_VWA4_VWB2_WGM1_WGMXCC1_WGMXCCGn1
    SolutionIndex: 14
    SolutionNameMin: Cijk_Ailk_Bljk_BSS_BH_UserArgs_MT128x256x64_MI16x16x1_SN_LDSB1_CLR1_GSU0_GSUC0_GSUWGMRR0_K1_LBSPPA2048_LBSPPB512_LPA0_MIWT4_8_PLR1_SU32_SUM0_SUS256_SKXCCM0_VWA4_VWB4_WGM1_WGMXCC1_WGMXCCGn1
    SolutionIndex: 15
    SolutionNameMin: Cijk_Ailk_Bljk_BSS_BH_UserArgs_MT128x256x64_MI16x16x1_SN_LDSB1_CLR1_GSU0_GSUC0_GSUWGMRR0_K1_LBSPPA2048_LBSPPB128_LPA0_MIWT4_8_PLR1_SU32_SUM0_SUS256_SKXCCM0_VWA4_VWB1_WGM4_WGMXCC1_WGMXCCGn1
    SolutionIndex: 16
    SolutionNameMin: Cijk_Ailk_Bljk_BSS_BH_UserArgs_MT128x256x64_MI16x16x1_SN_LDSB1_CLR1_GSU0_GSUC0_GSUWGMRR0_K1_LBSPPA2048_LBSPPB256_LPA0_MIWT4_8_PLR1_SU32_SUM0_SUS256_SKXCCM0_VWA4_VWB2_WGM4_WGMXCC1_WGMXCCGn1
    SolutionIndex: 17
    SolutionNameMin: Cijk_Ailk_Bljk_BSS_BH_UserArgs_MT256x128x64_MI16x16x1_SN_LDSB1_CLR1_GSU0_GSUC0_GSUWGMRR0_K1_LBSPPA4096_LBSPPB128_LPA0_MIWT8_4_PLR1_SU32_SUM0_SUS256_SKXCCM0_VWA4_VWB1_WGM1_WGMXCC1_WGMXCCGn1
    SolutionIndex: 18
    SolutionNameMin: Cijk_Ailk_Bljk_BSS_BH_UserArgs_MT256x128x64_MI16x16x1_SN_LDSB1_CLR1_GSU0_GSUC0_GSUWGMRR0_K1_LBSPPA4096_LBSPPB512_LPA0_MIWT8_4_PLR1_SU32_SUM0_SUS256_SKXCCM0_VWA4_VWB4_WGM1_WGMXCC1_WGMXCCGn1
    SolutionIndex: 19
    SolutionNameMin: Cijk_Ailk_Bljk_BSS_BH_UserArgs_MT256x128x64_MI16x16x1_SN_LDSB1_CLR1_GSU0_GSUC0_GSUWGMRR0_K1_LBSPPA4096_LBSPPB128_LPA0_MIWT8_4_PLR1_SU32_SUM0_SUS256_SKXCCM0_VWA4_VWB1_WGM4_WGMXCC1_WGMXCCGn1
    SolutionIndex: 20
    SolutionNameMin: Cijk_Ailk_Bljk_BSS_BH_UserArgs_MT256x128x64_MI16x16x1_SN_LDSB1_CLR1_GSU0_GSUC0_GSUWGMRR0_K1_LBSPPA4096_LBSPPB256_LPA0_MIWT8_4_PLR1_SU32_SUM0_SUS256_SKXCCM0_VWA4_VWB2_WGM4_WGMXCC1_WGMXCCGn1
    SolutionIndex: 21
    SolutionNameMin: Cijk_Ailk_Bljk_BSS_BH_UserArgs_MT256x128x64_MI16x16x1_SN_LDSB1_CLR1_GSU0_GSUC0_GSUWGMRR0_K1_LBSPPA4096_LBSPPB512_LPA0_MIWT8_4_PLR1_SU32_SUM0_SUS256_SKXCCM0_VWA4_VWB4_WGM4_WGMXCC1_WGMXCCGn1
    SolutionIndex: 22
    SolutionNameMin: Cijk_Ailk_Bljk_BSS_BH_UserArgs_MT256x128x64_MI16x16x1_SN_LDSB1_CLR1_GSU0_GSUC0_GSUWGMRR0_K1_LBSPPA4096_LBSPPB128_LPA0_MIWT8_4_PLR1_SU32_SUM0_SUS256_SKXCCM0_VWA4_VWB1_WGM8_WGMXCC1_WGMXCCGn1
    SolutionIndex: 23
    SolutionNameMin: Cijk_Ailk_Bljk_BSS_BH_UserArgs_MT256x128x64_MI16x16x1_SN_LDSB1_CLR1_GSU0_GSUC0_GSUWGMRR0_K1_LBSPPA4096_LBSPPB256_LPA32_MIWT8_4_PLR1_SU32_SUM0_SUS256_SKXCCM0_VWA2_VWB2_WGM8_WGMXCC1_WGMXCCGn1
    SolutionIndex: 24
    SolutionNameMin: Cijk_Ailk_Bljk_BSS_BH_UserArgs_MT256x128x64_MI16x16x1_SN_LDSB1_CLR1_GSU0_GSUC0_GSUWGMRR0_K1_LBSPPA4096_LBSPPB256_LPA0_MIWT8_4_PLR1_SU32_SUM0_SUS256_SKXCCM0_VWA4_VWB2_WGM8_WGMXCC1_WGMXCCGn1
    SolutionIndex: 25
    SolutionNameMin: Cijk_Ailk_Bljk_BSS_BH_UserArgs_MT256x128x64_MI16x16x1_SN_LDSB1_CLR1_GSU0_GSUC0_GSUWGMRR0_K1_LBSPPA4096_LBSPPB512_LPA0_MIWT8_4_PLR1_SU32_SUM0_SUS256_SKXCCM0_VWA4_VWB4_WGM8_WGMXCC1_WGMXCCGn1
    SolutionIndex: 26
    SolutionNameMin: Cijk_Ailk_Bljk_BSS_BH_UserArgs_MT256x64x64_MI16x16x1_SN_LDSB1_CLR1_GSU0_GSUC0_GSUWGMRR0_K1_LBSPPA4096_LBSPPB128_LPA0_MIWT8_2_PLR1_SU32_SUM0_SUS256_SKXCCM0_VWA4_VWB1_WGM1_WGMXCC1_WGMXCCGn1
    SolutionIndex: 27
    SolutionNameMin: Cijk_Ailk_Bljk_BSS_BH_UserArgs_MT256x64x64_MI16x16x1_SN_LDSB1_CLR1_GSU0_GSUC0_GSUWGMRR0_K1_LBSPPA4096_LBSPPB256_LPA0_MIWT8_2_PLR1_SU32_SUM0_SUS256_SKXCCM0_VWA4_VWB2_WGM4_WGMXCC1_WGMXCCGn1
    SolutionIndex: 28
    SolutionNameMin: Cijk_Ailk_Bljk_BSS_BH_UserArgs_MT128x128x64_MI16x16x1_SN_LDSB1_CLR1_GSU0_GSUC0_GSUWGMRR0_K1_LBSPPA2048_LBSPPB128_LPA0_MIWT4_4_PLR1_SU32_SUM0_SUS256_SKXCCM0_VWA4_VWB1_WGM1_WGMXCC1_WGMXCCGn1
    SolutionIndex: 29
    SolutionNameMin: Cijk_Ailk_Bljk_BSS_BH_UserArgs_MT128x128x64_MI16x16x1_SN_LDSB1_CLR1_GSU0_GSUC0_GSUWGMRR0_K1_LBSPPA2048_LBSPPB256_LPA0_MIWT4_4_PLR1_SU32_SUM0_SUS256_SKXCCM0_VWA4_VWB2_WGM1_WGMXCC1_WGMXCCGn1
    SolutionIndex: 30
    SolutionNameMin: Cijk_Ailk_Bljk_BSS_BH_UserArgs_MT64x128x64_MI16x16x1_SN_LDSB1_CLR1_GSU0_GSUC0_GSUWGMRR0_K1_LBSPPA1024_LBSPPB256_LPA32_MIWT2_4_PLR1_SU32_SUM0_SUS256_SKXCCM0_VWA2_VWB2_WGM1_WGMXCC1_WGMXCCGn1
    SolutionIndex: 31
    SolutionNameMin: Cijk_Ailk_Bljk_BSS_BH_UserArgs_MT64x128x64_MI16x16x1_SN_LDSB1_CLR1_GSU0_GSUC0_GSUWGMRR0_K1_LBSPPA1024_LBSPPB512_LPA32_MIWT2_4_PLR1_SU32_SUM0_SUS256_SKXCCM0_VWA2_VWB4_WGM1_WGMXCC1_WGMXCCGn1
    SolutionIndex: 32
    SolutionNameMin: Cijk_Ailk_Bljk_BSS_BH_UserArgs_MT128x64x64_MI16x16x1_SN_LDSB1_CLR1_GSU0_GSUC0_GSUWGMRR0_K1_LBSPPA2048_LBSPPB128_LPA0_MIWT4_2_PLR1_SU32_SUM0_SUS256_SKXCCM0_VWA4_VWB1_WGM1_WGMXCC1_WGMXCCGn1
    SolutionIndex: 33
    SolutionNameMin: Cijk_Ailk_Bljk_BSS_BH_UserArgs_MT128x64x64_MI16x16x1_SN_LDSB1_CLR1_GSU0_GSUC0_GSUWGMRR0_K1_LBSPPA2048_LBSPPB256_LPA0_MIWT4_2_PLR1_SU32_SUM0_SUS256_SKXCCM0_VWA4_VWB2_WGM1_WGMXCC1_WGMXCCGn1
    SolutionIndex: 34
    SolutionNameMin: Cijk_Ailk_Bljk_BSS_BH_UserArgs_MT128x64x64_MI16x16x1_SN_LDSB1_CLR1_GSU0_GSUC0_GSUWGMRR0_K1_LBSPPA2048_LBSPPB128_LPA0_MIWT4_2_PLR1_SU32_SUM0_SUS256_SKXCCM0_VWA4_VWB1_WGM8_WGMXCC1_WGMXCCGn1
    SolutionIndex: 35
    SolutionNameMin: Cijk_Ailk_Bljk_BSS_BH_UserArgs_MT128x64x64_MI16x16x1_SN_LDSB1_CLR1_GSU0_GSUC0_GSUWGMRR0_K1_LBSPPA2048_LBSPPB256_LPA0_MIWT4_2_PLR1_SU32_SUM0_SUS256_SKXCCM0_VWA4_VWB2_WGM8_WGMXCC1_WGMXCCGn1
    SolutionIndex: 36
    SolutionNameMin: Cijk_Ailk_Bljk_BSS_BH_UserArgs_MT64x64x64_MI16x16x1_SN_LDSB1_CLR1_GSU0_GSUC0_GSUWGMRR0_K1_LBSPPA1024_LBSPPB128_LPA16_MIWT2_2_PLR1_SU32_SUM0_SUS256_SKXCCM0_VWA1_VWB1_WGM1_WGMXCC1_WGMXCCGn1
    SolutionIndex: 37
    SolutionNameMin: Cijk_Ailk_Bljk_BSS_BH_UserArgs_MT64x64x64_MI16x16x1_SN_LDSB1_CLR1_GSU0_GSUC0_GSUWGMRR0_K1_LBSPPA1024_LBSPPB128_LPA32_MIWT2_2_PLR1_SU32_SUM0_SUS256_SKXCCM0_VWA2_VWB1_WGM1_WGMXCC1_WGMXCCGn1
    SolutionIndex: 38
    SolutionNameMin: Cijk_Ailk_Bljk_BSS_BH_UserArgs_MT64x64x64_MI16x16x1_SN_LDSB1_CLR1_GSU0_GSUC0_GSUWGMRR0_K1_LBSPPA1024_LBSPPB256_LPA16_MIWT2_2_PLR1_SU32_SUM0_SUS256_SKXCCM0_VWA1_VWB2_WGM1_WGMXCC1_WGMXCCGn1
    SolutionIndex: 39
    SolutionNameMin: Cijk_Ailk_Bljk_BSS_BH_UserArgs_MT64x64x64_MI16x16x1_SN_LDSB1_CLR1_GSU0_GSUC0_GSUWGMRR0_K1_LBSPPA1024_LBSPPB256_LPA32_MIWT2_2_PLR1_SU32_SUM0_SUS256_SKXCCM0_VWA2_VWB2_WGM1_WGMXCC1_WGMXCCGn1
    SolutionIndex: 40
    SolutionNameMin: Cijk_Ailk_Bljk_BSS_BH_UserArgs_MT32x64x64_MI16x16x1_SN_LDSB0_CLR1_GSU0_GSUC0_GSUWGMRR0_K1_LBSPPA512_LBSPPB256_LPA16_MIWT1_2_PLR1_SU32_SUM0_SUS256_SKXCCM0_VWA1_VWB2_WGM1_WGMXCC1_WGMXCCGn1
    SolutionIndex: 41
    SolutionNameMin: Cijk_Ailk_Bljk_BSS_BH_UserArgs_MT64x32x64_MI16x16x1_SN_LDSB0_CLR1_GSU0_GSUC0_GSUWGMRR0_K1_LBSPPA1024_LBSPPB128_LPA32_MIWT2_1_PLR1_SU32_SUM0_SUS256_SKXCCM0_VWA2_VWB1_WGM1_WGMXCC1_WGMXCCGn1
    SolutionIndex: 42
    SolutionNameMin: Cijk_Ailk_Bljk_BSS_BH_UserArgs_MT32x32x64_MI16x16x1_SN_LDSB0_CLR1_GSU0_GSUC0_GSUWGMRR0_K1_LBSPPA512_LBSPPB128_LPA16_MIWT1_1_PLR1_SU32_SUM0_SUS256_SKXCCM0_VWA1_VWB1_WGM1_WGMXCC1_WGMXCCGn1
    SolutionIndex: 43
    SolutionNameMin: Cijk_Ailk_Bljk_BSS_BH_UserArgs_MT32x32x64_MI16x16x1_SN_LDSB0_CLR1_GSU0_GSUC0_GSUWGMRR0_K1_LBSPPA512_LBSPPB128_LPA16_MIWT1_1_PLR1_SU32_SUM0_SUS256_SKXCCM0_VWA1_VWB1_WGM4_WGMXCC1_WGMXCCGn1
    SolutionIndex: 44
    SolutionNameMin: Cijk_Ailk_Bljk_BSS_BH_UserArgs_MT128x64x128_MI16x16x1_SN_LDSB1_CLR1_GSU0_GSUC0_GSUWGMRR0_K1_LBSPPA2048_LBSPPB512_LPA0_MIWT4_2_PLR2_SU32_SUM0_SUS256_SKXCCM0_VWA4_VWB2_WGM1_WGMXCC1_WGMXCCGn1
    SolutionIndex: 45
    SolutionNameMin: Cijk_Ailk_Bljk_BSS_BH_UserArgs_MT128x64x128_MI16x16x1_SN_LDSB1_CLR1_GSU0_GSUC0_GSUWGMRR0_K1_LBSPPA2048_LBSPPB256_LPA0_MIWT4_2_PLR1_SU32_SUM0_SUS256_SKXCCM0_VWA4_VWB1_WGM4_WGMXCC1_WGMXCCGn1
    SolutionIndex: 46
    SolutionNameMin: Cijk_Ailk_Bljk_BSS_BH_UserArgs_MT128x32x128_MI16x16x1_SN_LDSB1_CLR1_GSU0_GSUC0_GSUWGMRR0_K1_LBSPPA2048_LBSPPB256_LPA0_MIWT4_1_PLR2_SU32_SUM0_SUS256_SKXCCM0_VWA4_VWB1_WGM1_WGMXCC1_WGMXCCGn1
    SolutionIndex: 47
    SolutionNameMin: Cijk_Ailk_Bljk_BSS_BH_UserArgs_MT64x64x128_MI16x16x1_SN_LDSB1_CLR1_GSU0_GSUC0_GSUWGMRR0_K1_LBSPPA1024_LBSPPB256_LPA32_MIWT2_2_PLR2_SU32_SUM0_SUS256_SKXCCM0_VWA2_VWB1_WGM1_WGMXCC1_WGMXCCGn1
    SolutionIndex: 48
    SolutionNameMin: Cijk_Ailk_Bljk_BSS_BH_UserArgs_MT64x64x128_MI16x16x1_SN_LDSB1_CLR1_GSU0_GSUC0_GSUWGMRR0_K1_LBSPPA1024_LBSPPB512_LPA32_MIWT2_2_PLR2_SU32_SUM0_SUS256_SKXCCM0_VWA2_VWB2_WGM1_WGMXCC1_WGMXCCGn1
    SolutionIndex: 49
    SolutionNameMin: Cijk_Ailk_Bljk_BSS_BH_UserArgs_MT64x64x128_MI16x16x1_SN_LDSB1_CLR1_GSU0_GSUC0_GSUWGMRR0_K1_LBSPPA1024_LBSPPB256_LPA32_MIWT2_2_PLR2_SU32_SUM0_SUS256_SKXCCM0_VWA2_VWB1_WGM4_WGMXCC1_WGMXCCGn1
    SolutionIndex: 50
    SolutionNameMin: Cijk_Ailk_Bljk_BSS_BH_UserArgs_MT64x64x128_MI16x16x1_SN_LDSB1_CLR1_GSU0_GSUC0_GSUWGMRR0_K1_LBSPPA1024_LBSPPB256_LPA32_MIWT2_2_PLR2_SU32_SUM0_SUS256_SKXCCM0_VWA2_VWB1_WGM8_WGMXCC1_WGMXCCGn1
    SolutionIndex: 51
    SolutionNameMin: Cijk_Ailk_Bljk_BSS_BH_UserArgs_MT64x32x128_MI16x16x1_SN_LDSB1_CLR1_GSU0_GSUC0_GSUWGMRR0_K1_LBSPPA1024_LBSPPB256_LPA32_MIWT2_1_PLR2_SU32_SUM0_SUS256_SKXCCM0_VWA2_VWB1_WGM1_WGMXCC1_WGMXCCGn1
    SolutionIndex: 52
    SolutionNameMin: Cijk_Ailk_Bljk_BSS_BH_UserArgs_MT64x32x128_MI16x16x1_SN_LDSB1_CLR1_GSU0_GSUC0_GSUWGMRR0_K1_LBSPPA1024_LBSPPB256_LPA32_MIWT2_1_PLR2_SU32_SUM0_SUS256_SKXCCM0_VWA2_VWB1_WGM4_WGMXCC1_WGMXCCGn1
    SolutionIndex: 53
    SolutionNameMin: Cijk_Ailk_Bljk_BSS_BH_UserArgs_MT32x32x128_MI16x16x1_SN_LDSB1_CLR1_GSU0_GSUC0_GSUWGMRR0_K1_LBSPPA512_LBSPPB256_LPA16_MIWT1_1_PLR1_SU32_SUM0_SUS256_SKXCCM0_VWA1_VWB1_WGM1_WGMXCC1_WGMXCCGn1
    SolutionIndex: 54
    SolutionNameMin: Cijk_Ailk_Bljk_BSS_BH_UserArgs_MT32x32x128_MI16x16x1_SN_LDSB1_CLR1_GSU0_GSUC0_GSUWGMRR0_K1_LBSPPA512_LBSPPB256_LPA16_MIWT1_1_PLR2_SU32_SUM0_SUS256_SKXCCM0_VWA1_VWB1_WGM1_WGMXCC1_WGMXCCGn1
    SolutionIndex: 55
    SolutionNameMin: Cijk_Ailk_Bljk_BSS_BH_UserArgs_MT32x32x128_MI16x16x1_SN_LDSB1_CLR1_GSU0_GSUC0_GSUWGMRR0_K1_LBSPPA512_LBSPPB256_LPA16_MIWT1_1_PLR2_SU32_SUM0_SUS256_SKXCCM0_VWA1_VWB1_WGM4_WGMXCC1_WGMXCCGn1
    SolutionIndex: 56
    SolutionNameMin: Cijk_Ailk_Bljk_BSS_BH_UserArgs_MT32x32x128_MI16x16x1_SN_LDSB1_CLR1_GSU0_GSUC0_GSUWGMRR0_K1_LBSPPA512_LBSPPB256_LPA16_MIWT1_1_PLR1_SU32_SUM0_SUS256_SKXCCM0_VWA1_VWB1_WGM8_WGMXCC1_WGMXCCGn1
    SolutionIndex: 57
    SolutionNameMin: Cijk_Ailk_Bljk_BSS_BH_UserArgs_MT256x256x32_MI16x16x1_SN_LDSB1_CLR1_GSU0_GSUC0_GSUWGMRR0_K1_LBSPPA2048_LBSPPB128_LPA0_MIWT8_8_PLR1_SU32_SUM0_SUS256_SKXCCM6_VWA4_VWB1_WGM1_WGMXCC1_WGMXCCGn1
    SolutionIndex: 58
    SolutionNameMin: Cijk_Ailk_Bljk_BSS_BH_UserArgs_MT256x256x32_MI16x16x1_SN_LDSB1_CLR1_GSU0_GSUC0_GSUWGMRR0_K1_LBSPPA2048_LBSPPB128_LPA0_MIWT8_8_PLR1_SU32_SUM0_SUS256_SKXCCM6_VWA4_VWB2_WGM1_WGMXCC1_WGMXCCGn1
    SolutionIndex: 59
    SolutionNameMin: Cijk_Ailk_Bljk_BSS_BH_UserArgs_MT256x256x32_MI16x16x1_SN_LDSB1_CLR1_GSU0_GSUC0_GSUWGMRR0_K1_LBSPPA2048_LBSPPB512_LPA32_MIWT8_8_PLR1_SU32_SUM0_SUS256_SKXCCM6_VWA2_VWB8_WGM1_WGMXCC1_WGMXCCGn1
    SolutionIndex: 60
    SolutionNameMin: Cijk_Ailk_Bljk_BSS_BH_UserArgs_MT256x256x32_MI16x16x1_SN_LDSB1_CLR1_GSU0_GSUC0_GSUWGMRR0_K1_LBSPPA2048_LBSPPB512_LPA0_MIWT8_8_PLR1_SU32_SUM0_SUS256_SKXCCM6_VWA4_VWB8_WGM1_WGMXCC1_WGMXCCGn1
    SolutionIndex: 61
    SolutionNameMin: Cijk_Ailk_Bljk_BSS_BH_UserArgs_MT256x256x32_MI16x16x1_SN_LDSB1_CLR1_GSU0_GSUC0_GSUWGMRR0_K1_LBSPPA2048_LBSPPB128_LPA0_MIWT8_8_PLR1_SU32_SUM0_SUS256_SKXCCM6_VWA4_VWB1_WGM8_WGMXCC1_WGMXCCGn1
    SolutionIndex: 62
    SolutionNameMin: Cijk_Ailk_Bljk_BSS_BH_UserArgs_MT256x256x32_MI16x16x1_SN_LDSB1_CLR1_GSU0_GSUC0_GSUWGMRR0_K1_LBSPPA2048_LBSPPB128_LPA0_MIWT8_8_PLR1_SU32_SUM0_SUS256_SKXCCM6_VWA4_VWB2_WGM8_WGMXCC1_WGMXCCGn1
    SolutionIndex: 63
    SolutionNameMin: Cijk_Ailk_Bljk_BSS_BH_UserArgs_MT256x256x32_MI16x16x1_SN_LDSB1_CLR1_GSU0_GSUC0_GSUWGMRR0_K1_LBSPPA2048_LBSPPB512_LPA0_MIWT8_8_PLR1_SU32_SUM0_SUS256_SKXCCM6_VWA4_VWB8_WGM8_WGMXCC1_WGMXCCGn1
    SolutionIndex: 64
    SolutionNameMin: Cijk_Ailk_Bljk_BSS_BH_UserArgs_MT128x256x32_MI16x16x1_SN_LDSB1_CLR1_GSU0_GSUC0_GSUWGMRR0_K1_LBSPPA1024_LBSPPB128_LPA0_MIWT4_8_PLR1_SU32_SUM0_SUS256_SKXCCM6_VWA4_VWB2_WGM4_WGMXCC1_WGMXCCGn1
    SolutionIndex: 65
    SolutionNameMin: Cijk_Ailk_Bljk_BSS_BH_UserArgs_MT128x256x32_MI16x16x1_SN_LDSB1_CLR1_GSU0_GSUC0_GSUWGMRR0_K1_LBSPPA1024_LBSPPB256_LPA0_MIWT4_8_PLR1_SU32_SUM0_SUS256_SKXCCM6_VWA4_VWB4_WGM4_WGMXCC1_WGMXCCGn1
    SolutionIndex: 66
    SolutionNameMin: Cijk_Ailk_Bljk_BSS_BH_UserArgs_MT128x256x32_MI16x16x1_SN_LDSB1_CLR1_GSU0_GSUC0_GSUWGMRR0_K1_LBSPPA1024_LBSPPB512_LPA0_MIWT4_8_PLR1_SU32_SUM0_SUS256_SKXCCM6_VWA4_VWB8_WGM4_WGMXCC1_WGMXCCGn1
    SolutionIndex: 67
    SolutionNameMin: Cijk_Ailk_Bljk_BSS_BH_UserArgs_MT256x128x32_MI16x16x1_SN_LDSB1_CLR1_GSU0_GSUC0_GSUWGMRR0_K1_LBSPPA2048_LBSPPB128_LPA0_MIWT8_4_PLR1_SU32_SUM0_SUS256_SKXCCM6_VWA4_VWB1_WGM1_WGMXCC1_WGMXCCGn1
    SolutionIndex: 68
    SolutionNameMin: Cijk_Ailk_Bljk_BSS_BH_UserArgs_MT256x128x32_MI16x16x1_SN_LDSB1_CLR1_GSU0_GSUC0_GSUWGMRR0_K1_LBSPPA2048_LBSPPB256_LPA0_MIWT8_4_PLR1_SU32_SUM0_SUS256_SKXCCM6_VWA4_VWB4_WGM1_WGMXCC1_WGMXCCGn1
    SolutionIndex: 69
    SolutionNameMin: Cijk_Ailk_Bljk_BSS_BH_UserArgs_MT256x128x32_MI16x16x1_SN_LDSB1_CLR1_GSU0_GSUC0_GSUWGMRR0_K1_LBSPPA2048_LBSPPB128_LPA0_MIWT8_4_PLR1_SU32_SUM0_SUS256_SKXCCM6_VWA4_VWB1_WGM4_WGMXCC1_WGMXCCGn1
    SolutionIndex: 70
    SolutionNameMin: Cijk_Ailk_Bljk_BSS_BH_UserArgs_MT256x128x32_MI16x16x1_SN_LDSB1_CLR1_GSU0_GSUC0_GSUWGMRR0_K1_LBSPPA2048_LBSPPB128_LPA0_MIWT8_4_PLR1_SU32_SUM0_SUS256_SKXCCM6_VWA4_VWB1_WGM8_WGMXCC1_WGMXCCGn1
    SolutionIndex: 71
    SolutionNameMin: Cijk_Ailk_Bljk_BSS_BH_UserArgs_MT256x128x32_MI16x16x1_SN_LDSB1_CLR1_GSU0_GSUC0_GSUWGMRR0_K1_LBSPPA2048_LBSPPB128_LPA0_MIWT8_4_PLR1_SU32_SUM0_SUS256_SKXCCM6_VWA4_VWB2_WGM8_WGMXCC1_WGMXCCGn1
    SolutionIndex: 72
    SolutionNameMin: Cijk_Ailk_Bljk_BSS_BH_UserArgs_MT128x128x32_MI16x16x1_SN_LDSB1_CLR1_GSU0_GSUC0_GSUWGMRR0_K1_LBSPPA1024_LBSPPB128_LPA0_MIWT4_4_PLR1_SU32_SUM0_SUS256_SKXCCM6_VWA4_VWB1_WGM1_WGMXCC1_WGMXCCGn1
    SolutionIndex: 73
    SolutionNameMin: Cijk_Ailk_Bljk_BSS_BH_UserArgs_MT128x128x32_MI16x16x1_SN_LDSB1_CLR1_GSU0_GSUC0_GSUWGMRR0_K1_LBSPPA1024_LBSPPB256_LPA0_MIWT4_4_PLR1_SU32_SUM0_SUS256_SKXCCM6_VWA4_VWB4_WGM1_WGMXCC1_WGMXCCGn1
    SolutionIndex: 74
    SolutionNameMin: Cijk_Ailk_Bljk_BSS_BH_UserArgs_MT128x128x32_MI16x16x1_SN_LDSB1_CLR1_GSU0_GSUC0_GSUWGMRR0_K1_LBSPPA1024_LBSPPB256_LPA0_MIWT4_4_PLR1_SU32_SUM0_SUS256_SKXCCM6_VWA4_VWB4_WGM8_WGMXCC1_WGMXCCGn1
    SolutionIndex: 75
    SolutionNameMin: Cijk_Ailk_Bljk_BSS_BH_UserArgs_MT128x64x32_MI16x16x1_SN_LDSB0_CLR1_GSU0_GSUC0_GSUWGMRR0_K1_LBSPPA1024_LBSPPB128_LPA0_MIWT4_2_PLR1_SU32_SUM0_SUS256_SKXCCM6_VWA4_VWB1_WGM1_WGMXCC1_WGMXCCGn1
    SolutionIndex: 76
    SolutionNameMin: Cijk_Ailk_Bljk_BSS_BH_UserArgs_MT128x256x64_MI16x16x1_SN_LDSB1_CLR1_GSU0_GSUC0_GSUWGMRR0_K1_LBSPPA2048_LBSPPB128_LPA32_MIWT4_8_PLR1_SU32_SUM0_SUS256_SKXCCM6_VWA2_VWB1_WGM1_WGMXCC1_WGMXCCGn1
    SolutionIndex: 77
    SolutionNameMin: Cijk_Ailk_Bljk_BSS_BH_UserArgs_MT128x256x64_MI16x16x1_SN_LDSB1_CLR1_GSU0_GSUC0_GSUWGMRR0_K1_LBSPPA2048_LBSPPB128_LPA0_MIWT4_8_PLR1_SU32_SUM0_SUS256_SKXCCM6_VWA4_VWB1_WGM1_WGMXCC1_WGMXCCGn1
    SolutionIndex: 78
    SolutionNameMin: Cijk_Ailk_Bljk_BSS_BH_UserArgs_MT128x256x64_MI16x16x1_SN_LDSB1_CLR1_GSU0_GSUC0_GSUWGMRR0_K1_LBSPPA2048_LBSPPB256_LPA32_MIWT4_8_PLR1_SU32_SUM0_SUS256_SKXCCM6_VWA2_VWB2_WGM1_WGMXCC1_WGMXCCGn1
    SolutionIndex: 79
    SolutionNameMin: Cijk_Ailk_Bljk_BSS_BH_UserArgs_MT128x256x64_MI16x16x1_SN_LDSB1_CLR1_GSU0_GSUC0_GSUWGMRR0_K1_LBSPPA2048_LBSPPB256_LPA0_MIWT4_8_PLR1_SU32_SUM0_SUS256_SKXCCM6_VWA4_VWB2_WGM1_WGMXCC1_WGMXCCGn1
    SolutionIndex: 80
    SolutionNameMin: Cijk_Ailk_Bljk_BSS_BH_UserArgs_MT128x256x64_MI16x16x1_SN_LDSB1_CLR1_GSU0_GSUC0_GSUWGMRR0_K1_LBSPPA2048_LBSPPB512_LPA0_MIWT4_8_PLR1_SU32_SUM0_SUS256_SKXCCM6_VWA4_VWB4_WGM1_WGMXCC1_WGMXCCGn1
    SolutionIndex: 81
    SolutionNameMin: Cijk_Ailk_Bljk_BSS_BH_UserArgs_MT128x256x64_MI16x16x1_SN_LDSB1_CLR1_GSU0_GSUC0_GSUWGMRR0_K1_LBSPPA2048_LBSPPB1024_LPA0_MIWT4_8_PLR1_SU32_SUM0_SUS256_SKXCCM6_VWA4_VWB8_WGM1_WGMXCC1_WGMXCCGn1
    SolutionIndex: 82
    SolutionNameMin: Cijk_Ailk_Bljk_BSS_BH_UserArgs_MT128x256x64_MI16x16x1_SN_LDSB1_CLR1_GSU0_GSUC0_GSUWGMRR0_K1_LBSPPA2048_LBSPPB128_LPA0_MIWT4_8_PLR1_SU32_SUM0_SUS256_SKXCCM6_VWA4_VWB1_WGM4_WGMXCC1_WGMXCCGn1
    SolutionIndex: 83
    SolutionNameMin: Cijk_Ailk_Bljk_BSS_BH_UserArgs_MT256x128x64_MI16x16x1_SN_LDSB1_CLR1_GSU0_GSUC0_GSUWGMRR0_K1_LBSPPA4096_LBSPPB256_LPA0_MIWT8_4_PLR1_SU32_SUM0_SUS256_SKXCCM6_VWA4_VWB2_WGM4_WGMXCC1_WGMXCCGn1
    SolutionIndex: 84
    SolutionNameMin: Cijk_Ailk_Bljk_BSS_BH_UserArgs_MT256x128x64_MI16x16x1_SN_LDSB1_CLR1_GSU0_GSUC0_GSUWGMRR0_K1_LBSPPA4096_LBSPPB512_LPA0_MIWT8_4_PLR1_SU32_SUM0_SUS256_SKXCCM6_VWA4_VWB4_WGM4_WGMXCC1_WGMXCCGn1
    SolutionIndex: 85
    SolutionNameMin: Cijk_Ailk_Bljk_BSS_BH_UserArgs_MT256x128x64_MI16x16x1_SN_LDSB1_CLR1_GSU0_GSUC0_GSUWGMRR0_K1_LBSPPA4096_LBSPPB256_LPA0_MIWT8_4_PLR1_SU32_SUM0_SUS256_SKXCCM6_VWA4_VWB2_WGM8_WGMXCC1_WGMXCCGn1
    SolutionIndex: 86
    SolutionNameMin: Cijk_Ailk_Bljk_BSS_BH_UserArgs_MT64x256x64_MI16x16x1_SN_LDSB1_CLR1_GSU0_GSUC0_GSUWGMRR0_K1_LBSPPA1024_LBSPPB512_LPA32_MIWT2_8_PLR1_SU32_SUM0_SUS256_SKXCCM6_VWA2_VWB4_WGM1_WGMXCC1_WGMXCCGn1
    SolutionIndex: 87
    SolutionNameMin: Cijk_Ailk_Bljk_BSS_BH_UserArgs_MT256x64x64_MI16x16x1_SN_LDSB1_CLR1_GSU0_GSUC0_GSUWGMRR0_K1_LBSPPA4096_LBSPPB256_LPA0_MIWT8_2_PLR1_SU32_SUM0_SUS256_SKXCCM6_VWA4_VWB2_WGM4_WGMXCC1_WGMXCCGn1
    SolutionIndex: 88
    SolutionNameMin: Cijk_Ailk_Bljk_BSS_BH_UserArgs_MT128x128x64_MI16x16x1_SN_LDSB1_CLR1_GSU0_GSUC0_GSUWGMRR0_K1_LBSPPA2048_LBSPPB128_LPA0_MIWT4_4_PLR1_SU32_SUM0_SUS256_SKXCCM6_VWA4_VWB1_WGM1_WGMXCC1_WGMXCCGn1
    SolutionIndex: 89
    SolutionNameMin: Cijk_Ailk_Bljk_BSS_BH_UserArgs_MT128x128x64_MI16x16x1_SN_LDSB1_CLR1_GSU0_GSUC0_GSUWGMRR0_K1_LBSPPA2048_LBSPPB256_LPA0_MIWT4_4_PLR1_SU32_SUM0_SUS256_SKXCCM6_VWA4_VWB2_WGM1_WGMXCC1_WGMXCCGn1
    SolutionIndex: 90
    SolutionNameMin: Cijk_Ailk_Bljk_BSS_BH_UserArgs_MT128x128x64_MI16x16x1_SN_LDSB1_CLR1_GSU0_GSUC0_GSUWGMRR0_K1_LBSPPA2048_LBSPPB512_LPA0_MIWT4_4_PLR1_SU32_SUM0_SUS256_SKXCCM6_VWA4_VWB4_WGM1_WGMXCC1_WGMXCCGn1
    SolutionIndex: 91
    SolutionNameMin: Cijk_Ailk_Bljk_BSS_BH_UserArgs_MT128x128x64_MI16x16x1_SN_LDSB1_CLR1_GSU0_GSUC0_GSUWGMRR0_K1_LBSPPA2048_LBSPPB256_LPA0_MIWT4_4_PLR2_SU32_SUM0_SUS256_SKXCCM6_VWA4_VWB2_WGM1_WGMXCC1_WGMXCCGn1
    SolutionIndex: 92
    SolutionNameMin: Cijk_Ailk_Bljk_BSS_BH_UserArgs_MT128x128x64_MI16x16x1_SN_LDSB1_CLR1_GSU0_GSUC0_GSUWGMRR0_K1_LBSPPA2048_LBSPPB512_LPA0_MIWT4_4_PLR2_SU32_SUM0_SUS256_SKXCCM6_VWA4_VWB4_WGM1_WGMXCC1_WGMXCCGn1
    SolutionIndex: 93
    SolutionNameMin: Cijk_Ailk_Bljk_BSS_BH_UserArgs_MT128x128x64_MI16x16x1_SN_LDSB1_CLR1_GSU0_GSUC0_GSUWGMRR0_K1_LBSPPA2048_LBSPPB128_LPA0_MIWT4_4_PLR1_SU32_SUM0_SUS256_SKXCCM6_VWA4_VWB1_WGM4_WGMXCC1_WGMXCCGn1
    SolutionIndex: 94
    SolutionNameMin: Cijk_Ailk_Bljk_BSS_BH_UserArgs_MT128x128x64_MI16x16x1_SN_LDSB1_CLR1_GSU0_GSUC0_GSUWGMRR0_K1_LBSPPA2048_LBSPPB256_LPA0_MIWT4_4_PLR1_SU32_SUM0_SUS256_SKXCCM6_VWA4_VWB2_WGM4_WGMXCC1_WGMXCCGn1
    SolutionIndex: 95
    SolutionNameMin: Cijk_Ailk_Bljk_BSS_BH_UserArgs_MT128x128x64_MI16x16x1_SN_LDSB1_CLR1_GSU0_GSUC0_GSUWGMRR0_K1_LBSPPA2048_LBSPPB512_LPA0_MIWT4_4_PLR1_SU32_SUM0_SUS256_SKXCCM6_VWA4_VWB4_WGM4_WGMXCC1_WGMXCCGn1
    SolutionIndex: 96
    SolutionNameMin: Cijk_Ailk_Bljk_BSS_BH_UserArgs_MT128x128x64_MI16x16x1_SN_LDSB1_CLR1_GSU0_GSUC0_GSUWGMRR0_K1_LBSPPA2048_LBSPPB256_LPA0_MIWT4_4_PLR2_SU32_SUM0_SUS256_SKXCCM6_VWA4_VWB2_WGM4_WGMXCC1_WGMXCCGn1
    SolutionIndex: 97
    SolutionNameMin: Cijk_Ailk_Bljk_BSS_BH_UserArgs_MT128x128x64_MI16x16x1_SN_LDSB1_CLR1_GSU0_GSUC0_GSUWGMRR0_K1_LBSPPA2048_LBSPPB128_LPA0_MIWT4_4_PLR1_SU32_SUM0_SUS256_SKXCCM6_VWA4_VWB1_WGM8_WGMXCC1_WGMXCCGn1
    SolutionIndex: 98
    SolutionNameMin: Cijk_Ailk_Bljk_BSS_BH_UserArgs_MT128x128x64_MI16x16x1_SN_LDSB1_CLR1_GSU0_GSUC0_GSUWGMRR0_K1_LBSPPA2048_LBSPPB256_LPA0_MIWT4_4_PLR1_SU32_SUM0_SUS256_SKXCCM6_VWA4_VWB2_WGM8_WGMXCC1_WGMXCCGn1
    SolutionIndex: 99
    SolutionNameMin: Cijk_Ailk_Bljk_BSS_BH_UserArgs_MT128x128x64_MI16x16x1_SN_LDSB1_CLR1_GSU0_GSUC0_GSUWGMRR0_K1_LBSPPA2048_LBSPPB512_LPA0_MIWT4_4_PLR1_SU32_SUM0_SUS256_SKXCCM6_VWA4_VWB4_WGM8_WGMXCC1_WGMXCCGn1
    SolutionIndex: 100
    SolutionNameMin: Cijk_Ailk_Bljk_BSS_BH_UserArgs_MT64x128x64_MI16x16x1_SN_LDSB1_CLR1_GSU0_GSUC0_GSUWGMRR0_K1_LBSPPA1024_LBSPPB128_LPA32_MIWT2_4_PLR1_SU32_SUM0_SUS256_SKXCCM6_VWA2_VWB1_WGM1_WGMXCC1_WGMXCCGn1
    SolutionIndex: 101
    SolutionNameMin: Cijk_Ailk_Bljk_BSS_BH_UserArgs_MT64x128x64_MI16x16x1_SN_LDSB1_CLR1_GSU0_GSUC0_GSUWGMRR0_K1_LBSPPA1024_LBSPPB512_LPA32_MIWT2_4_PLR1_SU32_SUM0_SUS256_SKXCCM6_VWA2_VWB4_WGM1_WGMXCC1_WGMXCCGn1
    SolutionIndex: 102
    SolutionNameMin: Cijk_Ailk_Bljk_BSS_BH_UserArgs_MT64x128x64_MI16x16x1_SN_LDSB1_CLR1_GSU0_GSUC0_GSUWGMRR0_K1_LBSPPA1024_LBSPPB128_LPA32_MIWT2_4_PLR1_SU32_SUM0_SUS256_SKXCCM6_VWA2_VWB1_WGM4_WGMXCC1_WGMXCCGn1
    SolutionIndex: 103
    SolutionNameMin: Cijk_Ailk_Bljk_BSS_BH_UserArgs_MT64x128x64_MI16x16x1_SN_LDSB1_CLR1_GSU0_GSUC0_GSUWGMRR0_K1_LBSPPA1024_LBSPPB128_LPA32_MIWT2_4_PLR1_SU32_SUM0_SUS256_SKXCCM6_VWA2_VWB1_WGM8_WGMXCC1_WGMXCCGn1
    SolutionIndex: 104
    SolutionNameMin: Cijk_Ailk_Bljk_BSS_BH_UserArgs_MT128x64x64_MI16x16x1_SN_LDSB1_CLR1_GSU0_GSUC0_GSUWGMRR0_K1_LBSPPA2048_LBSPPB128_LPA0_MIWT4_2_PLR1_SU32_SUM0_SUS256_SKXCCM6_VWA4_VWB1_WGM1_WGMXCC1_WGMXCCGn1
    SolutionIndex: 105
    SolutionNameMin: Cijk_Ailk_Bljk_BSS_BH_UserArgs_MT128x64x64_MI16x16x1_SN_LDSB1_CLR1_GSU0_GSUC0_GSUWGMRR0_K1_LBSPPA2048_LBSPPB256_LPA0_MIWT4_2_PLR1_SU32_SUM0_SUS256_SKXCCM6_VWA4_VWB2_WGM1_WGMXCC1_WGMXCCGn1
    SolutionIndex: 106
    SolutionNameMin: Cijk_Ailk_Bljk_BSS_BH_UserArgs_MT128x64x64_MI16x16x1_SN_LDSB1_CLR1_GSU0_GSUC0_GSUWGMRR0_K1_LBSPPA2048_LBSPPB256_LPA0_MIWT4_2_PLR1_SU32_SUM0_SUS256_SKXCCM6_VWA4_VWB2_WGM4_WGMXCC1_WGMXCCGn1
    SolutionIndex: 107
    SolutionNameMin: Cijk_Ailk_Bljk_BSS_BH_UserArgs_MT128x64x64_MI16x16x1_SN_LDSB1_CLR1_GSU0_GSUC0_GSUWGMRR0_K1_LBSPPA2048_LBSPPB256_LPA0_MIWT4_2_PLR2_SU32_SUM0_SUS256_SKXCCM6_VWA4_VWB2_WGM4_WGMXCC1_WGMXCCGn1
    SolutionIndex: 108
    SolutionNameMin: Cijk_Ailk_Bljk_BSS_BH_UserArgs_MT128x64x64_MI16x16x1_SN_LDSB1_CLR1_GSU0_GSUC0_GSUWGMRR0_K1_LBSPPA2048_LBSPPB128_LPA0_MIWT4_2_PLR1_SU32_SUM0_SUS256_SKXCCM6_VWA4_VWB1_WGM8_WGMXCC1_WGMXCCGn1
    SolutionIndex: 109
    SolutionNameMin: Cijk_Ailk_Bljk_BSS_BH_UserArgs_MT128x64x64_MI16x16x1_SN_LDSB1_CLR1_GSU0_GSUC0_GSUWGMRR0_K1_LBSPPA2048_LBSPPB256_LPA0_MIWT4_2_PLR1_SU32_SUM0_SUS256_SKXCCM6_VWA4_VWB2_WGM8_WGMXCC1_WGMXCCGn1
    SolutionIndex: 110
    SolutionNameMin: Cijk_Ailk_Bljk_BSS_BH_UserArgs_MT64x64x64_MI16x16x1_SN_LDSB1_CLR1_GSU0_GSUC0_GSUWGMRR0_K1_LBSPPA1024_LBSPPB256_LPA32_MIWT2_2_PLR1_SU32_SUM0_SUS256_SKXCCM6_VWA2_VWB2_WGM1_WGMXCC1_WGMXCCGn1
    SolutionIndex: 111
    SolutionNameMin: Cijk_Ailk_Bljk_BSS_BH_UserArgs_MT32x64x64_MI16x16x1_SN_LDSB0_CLR1_GSU0_GSUC0_GSUWGMRR0_K1_LBSPPA512_LBSPPB128_LPA16_MIWT1_2_PLR1_SU32_SUM0_SUS256_SKXCCM6_VWA1_VWB1_WGM1_WGMXCC1_WGMXCCGn1
    SolutionIndex: 112
    SolutionNameMin: Cijk_Ailk_Bljk_BSS_BH_UserArgs_MT32x32x64_MI16x16x1_SN_LDSB0_CLR1_GSU0_GSUC0_GSUWGMRR0_K1_LBSPPA512_LBSPPB128_LPA16_MIWT1_1_PLR1_SU32_SUM0_SUS256_SKXCCM6_VWA1_VWB1_WGM1_WGMXCC1_WGMXCCGn1
    SolutionIndex: 113
    SolutionNameMin: Cijk_Ailk_Bljk_BSS_BH_UserArgs_MT32x32x64_MI16x16x1_SN_LDSB0_CLR1_GSU0_GSUC0_GSUWGMRR0_K1_LBSPPA512_LBSPPB128_LPA16_MIWT1_1_PLR1_SU32_SUM0_SUS256_SKXCCM6_VWA1_VWB1_WGM8_WGMXCC1_WGMXCCGn1
    SolutionIndex: 114
    SolutionNameMin: Cijk_Ailk_Bljk_BSS_BH_UserArgs_MT64x128x128_MI16x16x1_SN_LDSB1_CLR1_GSU0_GSUC0_GSUWGMRR0_K1_LBSPPA1024_LBSPPB256_LPA32_MIWT2_4_PLR2_SU32_SUM0_SUS256_SKXCCM6_VWA2_VWB1_WGM1_WGMXCC1_WGMXCCGn1
    SolutionIndex: 115
    SolutionNameMin: Cijk_Ailk_Bljk_BSS_BH_UserArgs_MT64x128x128_MI16x16x1_SN_LDSB1_CLR1_GSU0_GSUC0_GSUWGMRR0_K1_LBSPPA1024_LBSPPB256_LPA32_MIWT2_4_PLR2_SU32_SUM0_SUS256_SKXCCM6_VWA2_VWB1_WGM4_WGMXCC1_WGMXCCGn1
    SolutionIndex: 116
    SolutionNameMin: Cijk_Ailk_Bljk_BSS_BH_UserArgs_MT64x128x128_MI16x16x1_SN_LDSB1_CLR1_GSU0_GSUC0_GSUWGMRR0_K1_LBSPPA1024_LBSPPB256_LPA32_MIWT2_4_PLR2_SU32_SUM0_SUS256_SKXCCM6_VWA2_VWB1_WGM8_WGMXCC1_WGMXCCGn1
    SolutionIndex: 117
    SolutionNameMin: Cijk_Ailk_Bljk_BSS_BH_UserArgs_MT128x64x128_MI16x16x1_SN_LDSB1_CLR1_GSU0_GSUC0_GSUWGMRR0_K1_LBSPPA2048_LBSPPB256_LPA0_MIWT4_2_PLR1_SU32_SUM0_SUS256_SKXCCM6_VWA4_VWB1_WGM1_WGMXCC1_WGMXCCGn1
    SolutionIndex: 118
    SolutionNameMin: Cijk_Ailk_Bljk_BSS_BH_UserArgs_MT128x64x128_MI16x16x1_SN_LDSB1_CLR1_GSU0_GSUC0_GSUWGMRR0_K1_LBSPPA2048_LBSPPB512_LPA0_MIWT4_2_PLR1_SU32_SUM0_SUS256_SKXCCM6_VWA4_VWB2_WGM1_WGMXCC1_WGMXCCGn1
    SolutionIndex: 119
    SolutionNameMin: Cijk_Ailk_Bljk_BSS_BH_UserArgs_MT128x64x128_MI16x16x1_SN_LDSB1_CLR1_GSU0_GSUC0_GSUWGMRR0_K1_LBSPPA2048_LBSPPB256_LPA0_MIWT4_2_PLR2_SU32_SUM0_SUS256_SKXCCM6_VWA4_VWB1_WGM1_WGMXCC1_WGMXCCGn1
    SolutionIndex: 120
    SolutionNameMin: Cijk_Ailk_Bljk_BSS_BH_UserArgs_MT128x64x128_MI16x16x1_SN_LDSB1_CLR1_GSU0_GSUC0_GSUWGMRR0_K1_LBSPPA2048_LBSPPB512_LPA0_MIWT4_2_PLR2_SU32_SUM0_SUS256_SKXCCM6_VWA4_VWB2_WGM1_WGMXCC1_WGMXCCGn1
    SolutionIndex: 121
    SolutionNameMin: Cijk_Ailk_Bljk_BSS_BH_UserArgs_MT128x64x128_MI16x16x1_SN_LDSB1_CLR1_GSU0_GSUC0_GSUWGMRR0_K1_LBSPPA2048_LBSPPB256_LPA0_MIWT4_2_PLR1_SU32_SUM0_SUS256_SKXCCM6_VWA4_VWB1_WGM4_WGMXCC1_WGMXCCGn1
    SolutionIndex: 122
    SolutionNameMin: Cijk_Ailk_Bljk_BSS_BH_UserArgs_MT128x64x128_MI16x16x1_SN_LDSB1_CLR1_GSU0_GSUC0_GSUWGMRR0_K1_LBSPPA2048_LBSPPB256_LPA0_MIWT4_2_PLR2_SU32_SUM0_SUS256_SKXCCM6_VWA4_VWB1_WGM4_WGMXCC1_WGMXCCGn1
    SolutionIndex: 123
    SolutionNameMin: Cijk_Ailk_Bljk_BSS_BH_UserArgs_MT128x64x128_MI16x16x1_SN_LDSB1_CLR1_GSU0_GSUC0_GSUWGMRR0_K1_LBSPPA2048_LBSPPB256_LPA0_MIWT4_2_PLR1_SU32_SUM0_SUS256_SKXCCM6_VWA4_VWB1_WGM8_WGMXCC1_WGMXCCGn1
    SolutionIndex: 124
    SolutionNameMin: Cijk_Ailk_Bljk_BSS_BH_UserArgs_MT128x64x128_MI16x16x1_SN_LDSB1_CLR1_GSU0_GSUC0_GSUWGMRR0_K1_LBSPPA2048_LBSPPB256_LPA0_MIWT4_2_PLR2_SU32_SUM0_SUS256_SKXCCM6_VWA4_VWB1_WGM8_WGMXCC1_WGMXCCGn1
    SolutionIndex: 125
    SolutionNameMin: Cijk_Ailk_Bljk_BSS_BH_UserArgs_MT128x64x128_MI16x16x1_SN_LDSB1_CLR1_GSU0_GSUC0_GSUWGMRR0_K1_LBSPPA2048_LBSPPB512_LPA0_MIWT4_2_PLR2_SU32_SUM0_SUS256_SKXCCM6_VWA4_VWB2_WGM8_WGMXCC1_WGMXCCGn1
    SolutionIndex: 126
    SolutionNameMin: Cijk_Ailk_Bljk_BSS_BH_UserArgs_MT64x64x128_MI16x16x1_SN_LDSB1_CLR1_GSU0_GSUC0_GSUWGMRR0_K1_LBSPPA1024_LBSPPB256_LPA32_MIWT2_2_PLR2_SU32_SUM0_SUS256_SKXCCM6_VWA2_VWB1_WGM1_WGMXCC1_WGMXCCGn1
    SolutionIndex: 127
    SolutionNameMin: Cijk_Ailk_Bljk_BSS_BH_UserArgs_MT64x64x128_MI16x16x1_SN_LDSB1_CLR1_GSU0_GSUC0_GSUWGMRR0_K1_LBSPPA1024_LBSPPB512_LPA32_MIWT2_2_PLR2_SU32_SUM0_SUS256_SKXCCM6_VWA2_VWB2_WGM1_WGMXCC1_WGMXCCGn1
    SolutionIndex: 128
    SolutionNameMin: Cijk_Ailk_Bljk_BSS_BH_UserArgs_MT64x64x128_MI16x16x1_SN_LDSB1_CLR1_GSU0_GSUC0_GSUWGMRR0_K1_LBSPPA1024_LBSPPB256_LPA32_MIWT2_2_PLR2_SU32_SUM0_SUS256_SKXCCM6_VWA2_VWB1_WGM4_WGMXCC1_WGMXCCGn1
    SolutionIndex: 129
    SolutionNameMin: Cijk_Ailk_Bljk_BSS_BH_UserArgs_MT64x64x128_MI16x16x1_SN_LDSB1_CLR1_GSU0_GSUC0_GSUWGMRR0_K1_LBSPPA1024_LBSPPB256_LPA32_MIWT2_2_PLR2_SU32_SUM0_SUS256_SKXCCM6_VWA2_VWB1_WGM8_WGMXCC1_WGMXCCGn1
    SolutionIndex: 130
    SolutionNameMin: Cijk_Ailk_Bljk_BSS_BH_UserArgs_MT64x64x128_MI16x16x1_SN_LDSB1_CLR1_GSU0_GSUC0_GSUWGMRR0_K1_LBSPPA1024_LBSPPB512_LPA32_MIWT2_2_PLR2_SU32_SUM0_SUS256_SKXCCM6_VWA2_VWB2_WGM8_WGMXCC1_WGMXCCGn1
    SolutionIndex: 131
    SolutionNameMin: Cijk_Ailk_Bljk_BSS_BH_UserArgs_MT64x32x128_MI16x16x1_SN_LDSB1_CLR1_GSU0_GSUC0_GSUWGMRR0_K1_LBSPPA1024_LBSPPB256_LPA32_MIWT2_1_PLR2_SU32_SUM0_SUS256_SKXCCM6_VWA2_VWB1_WGM1_WGMXCC1_WGMXCCGn1
    SolutionIndex: 132
    SolutionNameMin: Cijk_Ailk_Bljk_BSS_BH_UserArgs_MT64x32x128_MI16x16x1_SN_LDSB1_CLR1_GSU0_GSUC0_GSUWGMRR0_K1_LBSPPA1024_LBSPPB256_LPA32_MIWT2_1_PLR2_SU32_SUM0_SUS256_SKXCCM6_VWA2_VWB1_WGM8_WGMXCC1_WGMXCCGn1
    SolutionIndex: 133
    SolutionNameMin: Cijk_Ailk_Bljk_BSS_BH_UserArgs_MT32x32x128_MI16x16x1_SN_LDSB1_CLR1_GSU0_GSUC0_GSUWGMRR0_K1_LBSPPA512_LBSPPB256_LPA16_MIWT1_1_PLR1_SU32_SUM0_SUS256_SKXCCM6_VWA1_VWB1_WGM1_WGMXCC1_WGMXCCGn1
    SolutionIndex: 134
    SolutionNameMin: Cijk_Ailk_Bljk_BSS_BH_UserArgs_MT32x32x128_MI16x16x1_SN_LDSB1_CLR1_GSU0_GSUC0_GSUWGMRR0_K1_LBSPPA512_LBSPPB256_LPA16_MIWT1_1_PLR2_SU32_SUM0_SUS256_SKXCCM6_VWA1_VWB1_WGM1_WGMXCC1_WGMXCCGn1
    SolutionIndex: 135
    SolutionNameMin: Cijk_Ailk_Bljk_BSS_BH_UserArgs_MT32x32x32_MI16x16x1_SN_LDSB0_CLR0_GSU0_GSUC0_GSUWGMRR0_K1_LBSPPA256_LBSPPB128_LPA16_MIWT1_1_PLR0_SU32_SUM0_SUS256_SKXCCM0_VWA1_VWB1_WGM8_WGMXCC1_WGMXCCGn1
- - - [128, 128, 1, 128, 128, 128, 128, 128]
    - [113, 0.082]
  - - [128, 128, 1, 256, 128, 128, 128, 256]
    - [56, 0.15]
  - - [128, 128, 1, 512, 128, 128, 128, 512]
    - [43, 0.252]
  - - [128, 128, 1, 1024, 128, 128, 128, 1024]
    - [55, 0.387]
  - - [128, 128, 1, 2048, 128, 128, 128, 2048]
    - [53, 0.6]
  - - [128, 128, 1, 4096, 128, 128, 128, 4096]
    - [112, 1.023]
  - - [128, 128, 1, 8192, 128, 128, 128, 8192]
    - [53, 1.575]
  - - [128, 256, 1, 128, 128, 128, 128, 128]
    - [42, 0.173]
  - - [128, 256, 1, 256, 128, 128, 128, 256]
    - [42, 0.307]
  - - [128, 256, 1, 512, 128, 128, 128, 512]
    - [54, 0.52]
  - - [128, 256, 1, 1024, 128, 128, 128, 1024]
    - [54, 0.792]
  - - [128, 256, 1, 2048, 128, 128, 128, 2048]
    - [54, 1.179]
  - - [128, 256, 1, 4096, 128, 128, 128, 4096]
    - [112, 1.989]
  - - [128, 256, 1, 8192, 128, 128, 128, 8192]
    - [133, 3.079]
  - - [128, 512, 1, 128, 128, 128, 128, 128]
    - [42, 0.338]
  - - [128, 512, 1, 256, 128, 128, 128, 256]
    - [42, 0.619]
  - - [128, 512, 1, 512, 128, 128, 128, 512]
    - [53, 1.036]
  - - [128, 512, 1, 1024, 128, 128, 128, 1024]
    - [53, 1.559]
  - - [128, 512, 1, 2048, 128, 128, 128, 2048]
    - [54, 2.293]
  - - [128, 512, 1, 4096, 128, 128, 128, 4096]
    - [111, 3.437]
  - - [128, 512, 1, 8192, 128, 128, 128, 8192]
    - [131, 5.465]
  - - [128, 1024, 1, 128, 128, 128, 128, 128]
    - [42, 0.653]
  - - [128, 1024, 1, 256, 128, 128, 128, 256]
    - [42, 1.2]
  - - [128, 1024, 1, 512, 128, 128, 128, 512]
    - [53, 1.979]
  - - [128, 1024, 1, 1024, 128, 128, 128, 1024]
    - [54, 3.078]
  - - [128, 1024, 1, 2048, 128, 128, 128, 2048]
    - [131, 4.037]
  - - [128, 1024, 1, 4096, 128, 128, 128, 4096]
    - [131, 5.976]
  - - [128, 1024, 1, 8192, 128, 128, 128, 8192]
    - [126, 8.766]
  - - [128, 2048, 1, 128, 128, 128, 128, 128]
    - [40, 1.198]
  - - [128, 2048, 1, 256, 128, 128, 128, 256]
    - [51, 2.104]
  - - [128, 2048, 1, 512, 128, 128, 128, 512]
    - [51, 3.526]
  - - [128, 2048, 1, 1024, 128, 128, 128, 1024]
    - [51, 5.361]
  - - [128, 2048, 1, 2048, 128, 128, 128, 2048]
    - [126, 6.73]
  - - [128, 2048, 1, 4096, 128, 128, 128, 4096]
    - [127, 9.574]
  - - [128, 2048, 1, 8192, 128, 128, 128, 8192]
    - [117, 13.226]
  - - [128, 4096, 1, 128, 128, 128, 128, 128]
    - [38, 2.052]
  - - [128, 4096, 1, 256, 128, 128, 128, 256]
    - [37, 3.578]
  - - [128, 4096, 1, 512, 128, 128, 128, 512]
    - [47, 5.896]
  - - [128, 4096, 1, 1024, 128, 128, 128, 1024]
    - [126, 8.56]
  - - [128, 4096, 1, 2048, 128, 128, 128, 2048]
    - [119, 10.724]
  - - [128, 4096, 1, 4096, 128, 128, 128, 4096]
    - [108, 13.748]
  - - [128, 4096, 1, 8192, 128, 128, 128, 8192]
    - [124, 16.905]
  - - [128, 8192, 1, 128, 128, 128, 128, 128]
    - [10, 3.245]
  - - [128, 8192, 1, 256, 128, 128, 128, 256]
    - [32, 5.624]
  - - [128, 8192, 1, 512, 128, 128, 128, 512]
    - [32, 8.873]
  - - [128, 8192, 1, 1024, 128, 128, 128, 1024]
    - [119, 12.862]
  - - [128, 8192, 1, 2048, 128, 128, 128, 2048]
    - [45, 13.883]
  - - [128, 8192, 1, 4096, 128, 128, 128, 4096]
    - [35, 17.371]
  - - [128, 8192, 1, 8192, 128, 128, 128, 8192]
    - [45, 20.35]
  - - [256, 128, 1, 128, 256, 256, 256, 128]
    - [42, 0.169]
  - - [256, 128, 1, 256, 256, 256, 256, 256]
    - [42, 0.306]
  - - [256, 128, 1, 512, 256, 256, 256, 512]
    - [42, 0.519]
  - - [256, 128, 1, 1024, 256, 256, 256, 1024]
    - [54, 0.784]
  - - [256, 128, 1, 2048, 256, 256, 256, 2048]
    - [53, 1.18]
  - - [256, 128, 1, 4096, 256, 256, 256, 4096]
    - [112, 1.987]
  - - [256, 128, 1, 8192, 256, 256, 256, 8192]
    - [54, 3.043]
  - - [256, 256, 1, 128, 256, 256, 256, 128]
    - [42, 0.331]
  - - [256, 256, 1, 256, 256, 256, 256, 256]
    - [42, 0.606]
  - - [256, 256, 1, 512, 256, 256, 256, 512]
    - [134, 1.011]
  - - [256, 256, 1, 1024, 256, 256, 256, 1024]
    - [54, 1.541]
  - - [256, 256, 1, 2048, 256, 256, 256, 2048]
    - [54, 2.297]
  - - [256, 256, 1, 4096, 256, 256, 256, 4096]
    - [111, 3.443]
  - - [256, 256, 1, 8192, 256, 256, 256, 8192]
    - [51, 5.415]
  - - [256, 512, 1, 128, 256, 256, 256, 128]
    - [42, 0.658]
  - - [256, 512, 1, 256, 256, 256, 256, 256]
    - [42, 1.194]
  - - [256, 512, 1, 512, 256, 256, 256, 512]
    - [54, 1.965]
  - - [256, 512, 1, 1024, 256, 256, 256, 1024]
    - [54, 3.063]
  - - [256, 512, 1, 2048, 256, 256, 256, 2048]
    - [131, 4.074]
  - - [256, 512, 1, 4096, 256, 256, 256, 4096]
    - [131, 5.993]
  - - [256, 512, 1, 8192, 256, 256, 256, 8192]
    - [46, 8.02]
  - - [256, 1024, 1, 128, 256, 256, 256, 128]
    - [41, 1.194]
  - - [256, 1024, 1, 256, 256, 256, 256, 256]
    - [41, 2.136]
  - - [256, 1024, 1, 512, 256, 256, 256, 512]
    - [51, 3.523]
  - - [256, 1024, 1, 1024, 256, 256, 256, 1024]
    - [131, 5.357]
  - - [256, 1024, 1, 2048, 256, 256, 256, 2048]
    - [126, 6.752]
  - - [256, 1024, 1, 4096, 256, 256, 256, 4096]
    - [131, 9.62]
  - - [256, 1024, 1, 8192, 256, 256, 256, 8192]
    - [119, 12.679]
  - - [256, 2048, 1, 128, 256, 256, 256, 128]
    - [38, 1.998]
  - - [256, 2048, 1, 256, 256, 256, 256, 256]
    - [110, 3.51]
  - - [256, 2048, 1, 512, 256, 256, 256, 512]
    - [50, 5.838]
  - - [256, 2048, 1, 1024, 256, 256, 256, 1024]
    - [127, 8.669]
  - - [256, 2048, 1, 2048, 256, 256, 256, 2048]
    - [127, 10.787]
  - - [256, 2048, 1, 4096, 256, 256, 256, 4096]
    - [105, 14.32]
  - - [256, 2048, 1, 8192, 256, 256, 256, 8192]
    - [89, 16.453]
  - - [256, 4096, 1, 128, 256, 256, 256, 128]
    - [9, 3.24]
  - - [256, 4096, 1, 256, 256, 256, 256, 256]
    - [33, 5.587]
  - - [256, 4096, 1, 512, 256, 256, 256, 512]
    - [109, 8.782]
  - - [256, 4096, 1, 1024, 256, 256, 256, 1024]
    - [119, 12.909]
  - - [256, 4096, 1, 2048, 256, 256, 256, 2048]
    - [120, 14.476]
  - - [256, 4096, 1, 4096, 256, 256, 256, 4096]
    - [107, 17.394]
  - - [256, 4096, 1, 8192, 256, 256, 256, 8192]
    - [26, 19.987]
  - - [256, 8192, 1, 128, 256, 256, 256, 128]
    - [7, 4.602]
  - - [256, 8192, 1, 256, 256, 256, 256, 256]
    - [90, 7.847]
  - - [256, 8192, 1, 512, 256, 256, 256, 512]
    - [90, 12.191]
  - - [256, 8192, 1, 1024, 256, 256, 256, 1024]
    - [119, 13.494]
  - - [256, 8192, 1, 2048, 256, 256, 256, 2048]
    - [118, 17.408]
  - - [256, 8192, 1, 4096, 256, 256, 256, 4096]
    - [27, 21.433]
  - - [256, 8192, 1, 8192, 256, 256, 256, 8192]
    - [19, 24.431]
  - - [512, 128, 1, 128, 512, 512, 512, 128]
    - [112, 0.332]
  - - [512, 128, 1, 256, 512, 512, 512, 256]
    - [42, 0.602]
  - - [512, 128, 1, 512, 512, 512, 512, 512]
    - [42, 1.016]
  - - [512, 128, 1, 1024, 512, 512, 512, 1024]
    - [53, 1.551]
  - - [512, 128, 1, 2048, 512, 512, 512, 2048]
    - [54, 2.294]
  - - [512, 128, 1, 4096, 512, 512, 512, 4096]
    - [40, 3.4]
  - - [512, 128, 1, 8192, 512, 512, 512, 8192]
    - [132, 5.014]
  - - [512, 256, 1, 128, 512, 512, 512, 128]
    - [42, 0.66]
  - - [512, 256, 1, 256, 512, 512, 512, 256]
    - [42, 1.183]
  - - [512, 256, 1, 512, 512, 512, 512, 512]
    - [54, 1.97]
  - - [512, 256, 1, 1024, 512, 512, 512, 1024]
    - [53, 3.058]
  - - [512, 256, 1, 2048, 512, 512, 512, 2048]
    - [51, 4.032]
  - - [512, 256, 1, 4096, 512, 512, 512, 4096]
    - [52, 5.893]
  - - [512, 256, 1, 8192, 512, 512, 512, 8192]
    - [47, 7.964]
  - - [512, 512, 1, 128, 512, 512, 512, 128]
    - [40, 1.195]
  - - [512, 512, 1, 256, 512, 512, 512, 256]
    - [51, 2.111]
  - - [512, 512, 1, 512, 512, 512, 512, 512]
    - [51, 3.504]
  - - [512, 512, 1, 1024, 512, 512, 512, 1024]
    - [51, 5.31]
  - - [512, 512, 1, 2048, 512, 512, 512, 2048]
    - [127, 6.671]
  - - [512, 512, 1, 4096, 512, 512, 512, 4096]
    - [33, 9.305]
  - - [512, 512, 1, 8192, 512, 512, 512, 8192]
    - [121, 12.679]
  - - [512, 1024, 1, 128, 512, 512, 512, 128]
    - [37, 2.022]
  - - [512, 1024, 1, 256, 512, 512, 512, 256]
    - [39, 3.528]
  - - [512, 1024, 1, 512, 512, 512, 512, 512]
    - [47, 5.887]
  - - [512, 1024, 1, 1024, 512, 512, 512, 1024]
    - [47, 8.756]
  - - [512, 1024, 1, 2048, 512, 512, 512, 2048]
    - [126, 10.418]
  - - [512, 1024, 1, 4096, 512, 512, 512, 4096]
    - [88, 13.4]
  - - [512, 1024, 1, 8192, 512, 512, 512, 8192]
    - [95, 15.602]
  - - [512, 2048, 1, 128, 512, 512, 512, 128]
    - [10, 3.194]
  - - [512, 2048, 1, 256, 512, 512, 512, 256]
    - [105, 5.516]
  - - [512, 2048, 1, 512, 512, 512, 512, 512]
    - [106, 8.82]
  - - [512, 2048, 1, 1024, 512, 512, 512, 1024]
    - [120, 12.961]
  - - [512, 2048, 1, 2048, 512, 512, 512, 2048]
    - [120, 14.429]
  - - [512, 2048, 1, 4096, 512, 512, 512, 4096]
    - [92, 16.589]
  - - [512, 2048, 1, 8192, 512, 512, 512, 8192]
    - [84, 18.265]
  - - [512, 4096, 1, 128, 512, 512, 512, 128]
    - [74, 4.652]
  - - [512, 4096, 1, 256, 512, 512, 512, 256]
    - [90, 7.928]
  - - [512, 4096, 1, 512, 512, 512, 512, 512]
    - [90, 12.542]
  - - [512, 4096, 1, 1024, 512, 512, 512, 1024]
    - [117, 13.826]
  - - [512, 4096, 1, 2048, 512, 512, 512, 2048]
    - [118, 17.302]
  - - [512, 4096, 1, 4096, 512, 512, 512, 4096]
    - [87, 20.247]
  - - [512, 4096, 1, 8192, 512, 512, 512, 8192]
    - [21, 22.128]
  - - [512, 8192, 1, 128, 512, 512, 512, 128]
    - [66, 5.572]
  - - [512, 8192, 1, 256, 512, 512, 512, 256]
    - [5, 9.286]
  - - [512, 8192, 1, 512, 512, 512, 512, 512]
    - [18, 14.167]
  - - [512, 8192, 1, 1024, 512, 512, 512, 1024]
    - [119, 17.14]
  - - [512, 8192, 1, 2048, 512, 512, 512, 2048]
    - [90, 21.701]
  - - [512, 8192, 1, 4096, 512, 512, 512, 4096]
    - [83, 24.469]
  - - [512, 8192, 1, 8192, 512, 512, 512, 8192]
    - [22, 26.405]
  - - [1024, 128, 1, 128, 1024, 1024, 1024, 128]
    - [42, 0.659]
  - - [1024, 128, 1, 256, 1024, 1024, 1024, 256]
    - [53, 1.171]
  - - [1024, 128, 1, 512, 1024, 1024, 1024, 512]
    - [54, 1.975]
  - - [1024, 128, 1, 1024, 1024, 1024, 1024, 1024]
    - [53, 3.035]
  - - [1024, 128, 1, 2048, 1024, 1024, 1024, 2048]
    - [51, 4.008]
  - - [1024, 128, 1, 4096, 1024, 1024, 1024, 4096]
    - [39, 5.623]
  - - [1024, 128, 1, 8192, 1024, 1024, 1024, 8192]
    - [129, 7.954]
  - - [1024, 256, 1, 128, 1024, 1024, 1024, 128]
    - [40, 1.189]
  - - [1024, 256, 1, 256, 1024, 1024, 1024, 256]
    - [41, 2.101]
  - - [1024, 256, 1, 512, 1024, 1024, 1024, 512]
    - [51, 3.463]
  - - [1024, 256, 1, 1024, 1024, 1024, 1024, 1024]
    - [51, 5.324]
  - - [1024, 256, 1, 2048, 1024, 1024, 1024, 2048]
    - [47, 6.586]
  - - [1024, 256, 1, 4096, 1024, 1024, 1024, 4096]
    - [108, 9.06]
  - - [1024, 256, 1, 8192, 1024, 1024, 1024, 8192]
    - [125, 12.617]
  - - [1024, 512, 1, 128, 1024, 1024, 1024, 128]
    - [38, 2.035]
  - - [1024, 512, 1, 256, 1024, 1024, 1024, 256]
    - [37, 3.54]
  - - [1024, 512, 1, 512, 1024, 1024, 1024, 512]
    - [48, 5.833]
  - - [1024, 512, 1, 1024, 1024, 1024, 1024, 1024]
    - [47, 8.747]
  - - [1024, 512, 1, 2048, 1024, 1024, 1024, 2048]
    - [44, 10.161]
  - - [1024, 512, 1, 4096, 1024, 1024, 1024, 4096]
    - [94, 13.232]
  - - [1024, 512, 1, 8192, 1024, 1024, 1024, 8192]
    - [88, 15.558]
  - - [1024, 1024, 1, 128, 1024, 1024, 1024, 128]
    - [10, 3.252]
  - - [1024, 1024, 1, 256, 1024, 1024, 1024, 256]
    - [32, 5.64]
  - - [1024, 1024, 1, 512, 1024, 1024, 1024, 512]
    - [35, 8.9]
  - - [1024, 1024, 1, 1024, 1024, 1024, 1024, 1024]
    - [120, 12.844]
  - - [1024, 1024, 1, 2048, 1024, 1024, 1024, 2048]
    - [100, 13.312]
  - - [1024, 1024, 1, 4096, 1024, 1024, 1024, 4096]
    - [91, 16.4]
  - - [1024, 1024, 1, 8192, 1024, 1024, 1024, 8192]
    - [81, 18.513]
  - - [1024, 2048, 1, 128, 1024, 1024, 1024, 128]
    - [73, 4.637]
  - - [1024, 2048, 1, 256, 1024, 1024, 1024, 256]
    - [90, 7.935]
  - - [1024, 2048, 1, 512, 1024, 1024, 1024, 512]
    - [90, 12.325]
  - - [1024, 2048, 1, 1024, 1024, 1024, 1024, 1024]
    - [105, 13.49]
  - - [1024, 2048, 1, 2048, 1024, 1024, 1024, 2048]
    - [114, 16.935]
  - - [1024, 2048, 1, 4096, 1024, 1024, 1024, 4096]
    - [80, 19.905]
  - - [1024, 2048, 1, 8192, 1024, 1024, 1024, 8192]
    - [6, 21.619]
  - - [1024, 4096, 1, 128, 1024, 1024, 1024, 128]
    - [65, 5.67]
  - - [1024, 4096, 1, 256, 1024, 1024, 1024, 256]
    - [68, 9.262]
  - - [1024, 4096, 1, 512, 1024, 1024, 1024, 512]
    - [13, 14.226]
  - - [1024, 4096, 1, 1024, 1024, 1024, 1024, 1024]
    - [114, 16.87]
  - - [1024, 4096, 1, 2048, 1024, 1024, 1024, 2048]
    - [88, 20.823]
  - - [1024, 4096, 1, 4096, 1024, 1024, 1024, 4096]
    - [20, 22.982]
  - - [1024, 4096, 1, 8192, 1024, 1024, 1024, 8192]
    - [23, 24.681]
  - - [1024, 8192, 1, 128, 1024, 1024, 1024, 128]
    - [3, 6.309]
  - - [1024, 8192, 1, 256, 1024, 1024, 1024, 256]
    - [3, 10.577]
  - - [1024, 8192, 1, 512, 1024, 1024, 1024, 512]
    - [88, 14.627]
  - - [1024, 8192, 1, 1024, 1024, 1024, 1024, 1024]
    - [88, 19.57]
  - - [1024, 8192, 1, 2048, 1024, 1024, 1024, 2048]
    - [24, 22.748]
  - - [1024, 8192, 1, 4096, 1024, 1024, 1024, 4096]
    - [25, 25.086]
  - - [1024, 8192, 1, 8192, 1024, 1024, 1024, 8192]
    - [57, 26.87]
  - - [2048, 128, 1, 128, 2048, 2048, 2048, 128]
    - [41, 1.207]
  - - [2048, 128, 1, 256, 2048, 2048, 2048, 256]
    - [51, 2.122]
  - - [2048, 128, 1, 512, 2048, 2048, 2048, 512]
    - [51, 3.543]
  - - [2048, 128, 1, 1024, 2048, 2048, 2048, 1024]
    - [51, 5.392]
  - - [2048, 128, 1, 2048, 2048, 2048, 2048, 2048]
    - [49, 6.209]
  - - [2048, 128, 1, 4096, 2048, 2048, 2048, 4096]
    - [106, 9.17]
  - - [2048, 128, 1, 8192, 2048, 2048, 2048, 8192]
    - [122, 12.672]
  - - [2048, 256, 1, 128, 2048, 2048, 2048, 128]
    - [36, 2.044]
  - - [2048, 256, 1, 256, 2048, 2048, 2048, 256]
    - [37, 3.535]
  - - [2048, 256, 1, 512, 2048, 2048, 2048, 512]
    - [47, 5.921]
  - - [2048, 256, 1, 1024, 2048, 2048, 2048, 1024]
    - [47, 8.805]
  - - [2048, 256, 1, 2048, 2048, 2048, 2048, 2048]
    - [122, 10.17]
  - - [2048, 256, 1, 4096, 2048, 2048, 2048, 4096]
    - [95, 13.249]
  - - [2048, 256, 1, 8192, 2048, 2048, 2048, 8192]
    - [93, 15.781]
  - - [2048, 512, 1, 128, 2048, 2048, 2048, 128]
    - [10, 3.275]
  - - [2048, 512, 1, 256, 2048, 2048, 2048, 256]
    - [105, 5.584]
  - - [2048, 512, 1, 512, 2048, 2048, 2048, 512]
    - [34, 8.945]
  - - [2048, 512, 1, 1024, 2048, 2048, 2048, 1024]
    - [125, 12.763]
  - - [2048, 512, 1, 2048, 2048, 2048, 2048, 2048]
    - [128, 13.478]
  - - [2048, 512, 1, 4096, 2048, 2048, 2048, 4096]
    - [96, 16.754]
  - - [2048, 512, 1, 8192, 2048, 2048, 2048, 8192]
    - [80, 18.515]
  - - [2048, 1024, 1, 128, 2048, 2048, 2048, 128]
    - [72, 4.61]
  - - [2048, 1024, 1, 256, 2048, 2048, 2048, 256]
    - [90, 7.739]
  - - [2048, 1024, 1, 512, 2048, 2048, 2048, 512]
    - [29, 12.24]
  - - [2048, 1024, 1, 1024, 2048, 2048, 2048, 1024]
    - [124, 13.908]
  - - [2048, 1024, 1, 2048, 2048, 2048, 2048, 2048]
    - [102, 17.003]
  - - [2048, 1024, 1, 4096, 2048, 2048, 2048, 4096]
    - [91, 19.593]
  - - [2048, 1024, 1, 8192, 2048, 2048, 2048, 8192]
    - [12, 20.896]
  - - [2048, 2048, 1, 128, 2048, 2048, 2048, 128]
    - [64, 5.713]
  - - [2048, 2048, 1, 256, 2048, 2048, 2048, 256]
    - [68, 9.478]
  - - [2048, 2048, 1, 512, 2048, 2048, 2048, 512]
    - [13, 14.598]
  - - [2048, 2048, 1, 1024, 2048, 2048, 2048, 1024]
    - [123, 16.614]
  - - [2048, 2048, 1, 2048, 2048, 2048, 2048, 2048]
    - [77, 20.328]
  - - [2048, 2048, 1, 4096, 2048, 2048, 2048, 4096]
    - [77, 22.751]
  - - [2048, 2048, 1, 8192, 2048, 2048, 2048, 8192]
    - [79, 25.061]
  - - [2048, 4096, 1, 128, 2048, 2048, 2048, 128]
    - [2, 6.324]
  - - [2048, 4096, 1, 256, 2048, 2048, 2048, 256]
    - [2, 10.554]
  - - [2048, 4096, 1, 512, 2048, 2048, 2048, 512]
    - [120, 14.48]
  - - [2048, 4096, 1, 1024, 2048, 2048, 2048, 1024]
    - [76, 19.314]
  - - [2048, 4096, 1, 2048, 2048, 2048, 2048, 2048]
    - [76, 22.921]
  - - [2048, 4096, 1, 4096, 2048, 2048, 2048, 4096]
    - [77, 24.935]
  - - [2048, 4096, 1, 8192, 2048, 2048, 2048, 8192]
    - [63, 26.775]
  - - [2048, 8192, 1, 128, 2048, 2048, 2048, 128]
    - [105, 6.764]
  - - [2048, 8192, 1, 256, 2048, 2048, 2048, 256]
    - [89, 10.871]
  - - [2048, 8192, 1, 512, 2048, 2048, 2048, 512]
    - [94, 16.058]
  - - [2048, 8192, 1, 1024, 2048, 2048, 2048, 1024]
    - [77, 20.398]
  - - [2048, 8192, 1, 2048, 2048, 2048, 2048, 2048]
    - [77, 24.959]
  - - [2048, 8192, 1, 4096, 2048, 2048, 2048, 4096]
    - [79, 28.893]
  - - [2048, 8192, 1, 8192, 2048, 2048, 2048, 8192]
    - [81, 29.301]
  - - [4096, 128, 1, 128, 4096, 4096, 4096, 128]
    - [38, 2.044]
  - - [4096, 128, 1, 256, 4096, 4096, 4096, 256]
    - [39, 3.553]
  - - [4096, 128, 1, 512, 4096, 4096, 4096, 512]
    - [48, 5.829]
  - - [4096, 128, 1, 1024, 4096, 4096, 4096, 1024]
    - [130, 8.549]
  - - [4096, 128, 1, 2048, 4096, 4096, 4096, 2048]
    - [39, 10.158]
  - - [4096, 128, 1, 4096, 4096, 4096, 4096, 4096]
    - [109, 13.486]
  - - [4096, 128, 1, 8192, 4096, 4096, 4096, 8192]
    - [90, 16.084]
  - - [4096, 256, 1, 128, 4096, 4096, 4096, 128]
    - [75, 3.233]
  - - [4096, 256, 1, 256, 4096, 4096, 4096, 256]
    - [34, 5.565]
  - - [4096, 256, 1, 512, 4096, 4096, 4096, 512]
    - [106, 8.703]
  - - [4096, 256, 1, 1024, 4096, 4096, 4096, 1024]
    - [122, 12.718]
  - - [4096, 256, 1, 2048, 4096, 4096, 4096, 2048]
    - [31, 14.097]
  - - [4096, 256, 1, 4096, 4096, 4096, 4096, 4096]
    - [98, 17.131]
  - - [4096, 256, 1, 8192, 4096, 4096, 4096, 8192]
    - [101, 19.034]
  - - [4096, 512, 1, 128, 4096, 4096, 4096, 128]
    - [8, 4.583]
  - - [4096, 512, 1, 256, 4096, 4096, 4096, 256]
    - [28, 7.612]
  - - [4096, 512, 1, 512, 4096, 4096, 4096, 512]
    - [28, 12.127]
  - - [4096, 512, 1, 1024, 4096, 4096, 4096, 1024]
    - [103, 13.592]
  - - [4096, 512, 1, 2048, 4096, 4096, 4096, 2048]
    - [115, 17.203]
  - - [4096, 512, 1, 4096, 4096, 4096, 4096, 4096]
    - [86, 20.2]
  - - [4096, 512, 1, 8192, 4096, 4096, 4096, 8192]
    - [81, 22.239]
  - - [4096, 1024, 1, 128, 4096, 4096, 4096, 128]
    - [71, 5.773]
  - - [4096, 1024, 1, 256, 4096, 4096, 4096, 256]
    - [71, 9.503]
  - - [4096, 1024, 1, 512, 4096, 4096, 4096, 512]
    - [82, 14.214]
  - - [4096, 1024, 1, 1024, 4096, 4096, 4096, 1024]
    - [97, 16.517]
  - - [4096, 1024, 1, 2048, 4096, 4096, 4096, 2048]
    - [95, 20.998]
  - - [4096, 1024, 1, 4096, 4096, 4096, 4096, 4096]
    - [79, 23.048]
  - - [4096, 1024, 1, 8192, 4096, 4096, 4096, 8192]
    - [79, 25.144]
  - - [4096, 2048, 1, 128, 4096, 4096, 4096, 128]
    - [1, 6.23]
  - - [4096, 2048, 1, 256, 4096, 4096, 4096, 256]
    - [1, 10.559]
  - - [4096, 2048, 1, 512, 4096, 4096, 4096, 512]
    - [93, 14.496]
  - - [4096, 2048, 1, 1024, 4096, 4096, 4096, 1024]
    - [99, 19.669]
  - - [4096, 2048, 1, 2048, 4096, 4096, 4096, 2048]
    - [77, 23.35]
  - - [4096, 2048, 1, 4096, 4096, 4096, 4096, 4096]
    - [79, 25.999]
  - - [4096, 2048, 1, 8192, 4096, 4096, 4096, 8192]
    - [81, 28.119]
  - - [4096, 4096, 1, 128, 4096, 4096, 4096, 128]
    - [32, 6.532]
  - - [4096, 4096, 1, 256, 4096, 4096, 4096, 256]
    - [97, 10.822]
  - - [4096, 4096, 1, 512, 4096, 4096, 4096, 512]
    - [97, 15.945]
  - - [4096, 4096, 1, 1024, 4096, 4096, 4096, 1024]
    - [77, 20.418]
  - - [4096, 4096, 1, 2048, 4096, 4096, 4096, 2048]
    - [79, 25.368]
  - - [4096, 4096, 1, 4096, 4096, 4096, 4096, 4096]
    - [78, 29.497]
  - - [4096, 4096, 1, 8192, 4096, 4096, 4096, 8192]
    - [60, 29.226]
  - - [4096, 8192, 1, 128, 4096, 4096, 4096, 128]
    - [28, 6.809]
  - - [4096, 8192, 1, 256, 4096, 4096, 4096, 256]
    - [29, 10.979]
  - - [4096, 8192, 1, 512, 4096, 4096, 4096, 512]
    - [88, 15.663]
  - - [4096, 8192, 1, 1024, 4096, 4096, 4096, 1024]
    - [94, 21.097]
  - - [4096, 8192, 1, 2048, 4096, 4096, 4096, 2048]
    - [15, 26.096]
  - - [4096, 8192, 1, 4096, 4096, 4096, 4096, 4096]
    - [62, 30.099]
  - - [4096, 8192, 1, 8192, 4096, 4096, 4096, 8192]
    - [61, 33.599]
  - - [8192, 128, 1, 128, 8192, 8192, 8192, 128]
    - [11, 3.218]
  - - [8192, 128, 1, 256, 8192, 8192, 8192, 256]
    - [104, 5.563]
  - - [8192, 128, 1, 512, 8192, 8192, 8192, 512]
    - [106, 8.74]
  - - [8192, 128, 1, 1024, 8192, 8192, 8192, 1024]
    - [122, 12.228]
  - - [8192, 128, 1, 2048, 8192, 8192, 8192, 2048]
    - [31, 13.498]
  - - [8192, 128, 1, 4096, 8192, 8192, 8192, 4096]
    - [30, 17.154]
  - - [8192, 128, 1, 8192, 8192, 8192, 8192, 8192]
    - [29, 19.876]
  - - [8192, 256, 1, 128, 8192, 8192, 8192, 128]
    - [8, 4.553]
  - - [8192, 256, 1, 256, 8192, 8192, 8192, 256]
    - [97, 7.67]
  - - [8192, 256, 1, 512, 8192, 8192, 8192, 512]
    - [98, 12.055]
  - - [8192, 256, 1, 1024, 8192, 8192, 8192, 1024]
    - [108, 13.42]
  - - [8192, 256, 1, 2048, 8192, 8192, 8192, 2048]
    - [103, 17.418]
  - - [8192, 256, 1, 4096, 8192, 8192, 8192, 4096]
    - [89, 21.287]
  - - [8192, 256, 1, 8192, 8192, 8192, 8192, 8192]
    - [28, 23.404]
  - - [8192, 512, 1, 128, 8192, 8192, 8192, 128]
    - [70, 5.6]
  - - [8192, 512, 1, 256, 8192, 8192, 8192, 256]
    - [69, 9.317]
  - - [8192, 512, 1, 512, 8192, 8192, 8192, 512]
    - [17, 13.844]
  - - [8192, 512, 1, 1024, 8192, 8192, 8192, 1024]
    - [116, 16.586]
  - - [8192, 512, 1, 2048, 8192, 8192, 8192, 2048]
    - [97, 20.816]
  - - [8192, 512, 1, 4096, 8192, 8192, 8192, 4096]
    - [12, 24.784]
  - - [8192, 512, 1, 8192, 8192, 8192, 8192, 8192]
    - [81, 26.014]
  - - [8192, 1024, 1, 128, 8192, 8192, 8192, 128]
    - [0, 6.19]
  - - [8192, 1024, 1, 256, 8192, 8192, 8192, 256]
    - [61, 10.236]
  - - [8192, 1024, 1, 512, 8192, 8192, 8192, 512]
    - [98, 14.333]
  - - [8192, 1024, 1, 1024, 8192, 8192, 8192, 1024]
    - [97, 19.218]
  - - [8192, 1024, 1, 2048, 8192, 8192, 8192, 2048]
    - [81, 23.072]
  - - [8192, 1024, 1, 4096, 8192, 8192, 8192, 4096]
    - [79, 26.787]
  - - [8192, 1024, 1, 8192, 8192, 8192, 8192, 8192]
    - [59, 27.941]
  - - [8192, 2048, 1, 128, 8192, 8192, 8192, 128]
    - [33, 6.445]
  - - [8192, 2048, 1, 256, 8192, 8192, 8192, 256]
    - [94, 10.626]
  - - [8192, 2048, 1, 512, 8192, 8192, 8192, 512]
    - [99, 16.052]
  - - [8192, 2048, 1, 1024, 8192, 8192, 8192, 1024]
    - [16, 20.291]
  - - [8192, 2048, 1, 2048, 8192, 8192, 8192, 2048]
    - [14, 24.736]
  - - [8192, 2048, 1, 4096, 8192, 8192, 8192, 4096]
    - [12, 28.374]
  - - [8192, 2048, 1, 8192, 8192, 8192, 8192, 8192]
    - [57, 29.728]
  - - [8192, 4096, 1, 128, 8192, 8192, 8192, 128]
    - [28, 6.794]
  - - [8192, 4096, 1, 256, 8192, 8192, 8192, 256]
    - [28, 10.84]
  - - [8192, 4096, 1, 512, 8192, 8192, 8192, 512]
    - [94, 15.392]
  - - [8192, 4096, 1, 1024, 8192, 8192, 8192, 1024]
    - [83, 20.405]
  - - [8192, 4096, 1, 2048, 8192, 8192, 8192, 2048]
    - [58, 26.25]
  - - [8192, 4096, 1, 4096, 8192, 8192, 8192, 4096]
    - [57, 32.001]
  - - [8192, 4096, 1, 8192, 8192, 8192, 8192, 8192]
    - [60, 34.776]
  - - [8192, 8192, 1, 128, 8192, 8192, 8192, 128]
    - [4, 6.07]
  - - [8192, 8192, 1, 256, 8192, 8192, 8192, 256]
    - [67, 9.968]
  - - [8192, 8192, 1, 512, 8192, 8192, 8192, 512]
    - [85, 16.0]
  - - [8192, 8192, 1, 1024, 8192, 8192, 8192, 1024]
    - [57, 22.422]
  - - [8192, 8192, 1, 2048, 8192, 8192, 8192, 2048]
    - [0, 28.346]
  - - [8192, 8192, 1, 4096, 8192, 8192, 8192, 4096]
    - [57, 33.17]
  - - [8192, 8192, 1, 8192, 8192, 8192, 8192, 8192]
    - [57, 36.22]
  - - [1, 1, 1, 32, 1, 1, 1, 32]
    - [135, 0.0]
- null
- null
- ExperimentalStreamK
- GridBased
