library/src/amd_detail/rocblaslt/src/Tensile/Logic/asm_full/aquavanjaram/gfx942_228cu/StreamK/aquavanjaram942_Cijk_Alik_Bljk_HSS_BH_UserArgs.yaml
- {MinimumRequiredVersion: 4.33.0}
- aquavanjaram942
- {Architecture: gfx942, CUCount: 228}
- [Device 0049, Device 0050]
    SolutionIndex: 0
    SolutionNameMin: Cijk_Alik_Bljk_HSS_BH_UserArgs_MT128x128x32_MI16x16x1_SN_LDSB1_CLR1_GSU0_GSUC0_GSUWGMRR0_K1_LBSPPA256_LBSPPB256_MIWT4_4_PLR1_SU32_SUM0_SUS256_SKXCCM0_VWA4_VWB4_WGM4_WGMXCC1_WGMXCCGn1
    SolutionIndex: 1
    SolutionNameMin: Cijk_Alik_Bljk_HSS_BH_UserArgs_MT256x64x64_MI16x16x1_SN_LDSB1_CLR1_GSU0_GSUC0_GSUWGMRR0_K1_LBSPPA512_LBSPPB256_MIWT8_2_PLR1_SU32_SUM0_SUS256_SKXCCM0_VWA4_VWB2_WGM1_WGMXCC1_WGMXCCGn1
    SolutionIndex: 2
    SolutionNameMin: Cijk_Alik_Bljk_HSS_BH_UserArgs_MT256x64x64_MI16x16x1_SN_LDSB1_CLR1_GSU0_GSUC0_GSUWGMRR0_K1_LBSPPA512_LBSPPB128_MIWT8_2_PLR1_SU32_SUM0_SUS256_SKXCCM0_VWA4_VWB1_WGM4_WGMXCC1_WGMXCCGn1
    SolutionIndex: 3
    SolutionNameMin: Cijk_Alik_Bljk_HSS_BH_UserArgs_MT256x64x64_MI16x16x1_SN_LDSB1_CLR1_GSU0_GSUC0_GSUWGMRR0_K1_LBSPPA512_LBSPPB256_MIWT8_2_PLR1_SU32_SUM0_SUS256_SKXCCM0_VWA4_VWB2_WGM4_WGMXCC1_WGMXCCGn1
    SolutionIndex: 4
    SolutionNameMin: Cijk_Alik_Bljk_HSS_BH_UserArgs_MT256x64x64_MI16x16x1_SN_LDSB1_CLR1_GSU0_GSUC0_GSUWGMRR0_K1_LBSPPA512_LBSPPB256_MIWT8_2_PLR1_SU32_SUM0_SUS256_SKXCCM0_VWA4_VWB2_WGM8_WGMXCC1_WGMXCCGn1
    SolutionIndex: 5
    SolutionNameMin: Cijk_Alik_Bljk_HSS_BH_UserArgs_MT128x128x64_MI16x16x1_SN_LDSB1_CLR1_GSU0_GSUC0_GSUWGMRR0_K1_LBSPPA128_LBSPPB128_MIWT4_4_PLR1_SU32_SUM0_SUS256_SKXCCM0_VWA1_VWB1_WGM1_WGMXCC1_WGMXCCGn1
    SolutionIndex: 6
    SolutionNameMin: Cijk_Alik_Bljk_HSS_BH_UserArgs_MT128x128x64_MI16x16x1_SN_LDSB1_CLR1_GSU0_GSUC0_GSUWGMRR0_K1_LBSPPA512_LBSPPB128_MIWT4_4_PLR1_SU32_SUM0_SUS256_SKXCCM0_VWA4_VWB1_WGM1_WGMXCC1_WGMXCCGn1
    SolutionIndex: 7
    SolutionNameMin: Cijk_Alik_Bljk_HSS_BH_UserArgs_MT128x128x64_MI16x16x1_SN_LDSB1_CLR1_GSU0_GSUC0_GSUWGMRR0_K1_LBSPPA128_LBSPPB256_MIWT4_4_PLR1_SU32_SUM0_SUS256_SKXCCM0_VWA1_VWB2_WGM1_WGMXCC1_WGMXCCGn1
    SolutionIndex: 8
    SolutionNameMin: Cijk_Alik_Bljk_HSS_BH_UserArgs_MT128x128x64_MI16x16x1_SN_LDSB1_CLR1_GSU0_GSUC0_GSUWGMRR0_K1_LBSPPA512_LBSPPB256_MIWT4_4_PLR1_SU32_SUM0_SUS256_SKXCCM0_VWA4_VWB2_WGM1_WGMXCC1_WGMXCCGn1
    SolutionIndex: 9
    SolutionNameMin: Cijk_Alik_Bljk_HSS_BH_UserArgs_MT128x128x64_MI16x16x1_SN_LDSB1_CLR1_GSU0_GSUC0_GSUWGMRR0_K1_LBSPPA128_LBSPPB512_MIWT4_4_PLR1_SU32_SUM0_SUS256_SKXCCM0_VWA1_VWB4_WGM1_WGMXCC1_WGMXCCGn1
    SolutionIndex: 10
    SolutionNameMin: Cijk_Alik_Bljk_HSS_BH_UserArgs_MT128x128x64_MI16x16x1_SN_LDSB1_CLR1_GSU0_GSUC0_GSUWGMRR0_K1_LBSPPA512_LBSPPB512_MIWT4_4_PLR1_SU32_SUM0_SUS256_SKXCCM0_VWA4_VWB4_WGM1_WGMXCC1_WGMXCCGn1
    SolutionIndex: 11
    SolutionNameMin: Cijk_Alik_Bljk_HSS_BH_UserArgs_MT128x128x64_MI16x16x1_SN_LDSB1_CLR1_GSU0_GSUC0_GSUWGMRR0_K1_LBSPPA128_LBSPPB128_MIWT4_4_PLR1_SU32_SUM0_SUS256_SKXCCM0_VWA1_VWB1_WGM4_WGMXCC1_WGMXCCGn1
    SolutionIndex: 12
    SolutionNameMin: Cijk_Alik_Bljk_HSS_BH_UserArgs_MT128x128x64_MI16x16x1_SN_LDSB1_CLR1_GSU0_GSUC0_GSUWGMRR0_K1_LBSPPA512_LBSPPB512_MIWT4_4_PLR1_SU32_SUM0_SUS256_SKXCCM0_VWA4_VWB4_WGM4_WGMXCC1_WGMXCCGn1
    SolutionIndex: 13
    SolutionNameMin: Cijk_Alik_Bljk_HSS_BH_UserArgs_MT128x128x64_MI16x16x1_SN_LDSB1_CLR1_GSU0_GSUC0_GSUWGMRR0_K1_LBSPPA512_LBSPPB512_MIWT4_4_PLR2_SU32_SUM0_SUS256_SKXCCM0_VWA4_VWB4_WGM8_WGMXCC1_WGMXCCGn1
    SolutionIndex: 14
    SolutionNameMin: Cijk_Alik_Bljk_HSS_BH_UserArgs_MT64x128x64_MI16x16x1_SN_LDSB1_CLR1_GSU0_GSUC0_GSUWGMRR0_K1_LBSPPA128_LBSPPB128_MIWT2_4_PLR1_SU32_SUM0_SUS256_SKXCCM0_VWA1_VWB1_WGM1_WGMXCC1_WGMXCCGn1
    SolutionIndex: 15
    SolutionNameMin: Cijk_Alik_Bljk_HSS_BH_UserArgs_MT64x128x64_MI16x16x1_SN_LDSB1_CLR1_GSU0_GSUC0_GSUWGMRR0_K1_LBSPPA128_LBSPPB256_MIWT2_4_PLR1_SU32_SUM0_SUS256_SKXCCM0_VWA1_VWB2_WGM1_WGMXCC1_WGMXCCGn1
    SolutionIndex: 16
    SolutionNameMin: Cijk_Alik_Bljk_HSS_BH_UserArgs_MT64x128x64_MI16x16x1_SN_LDSB1_CLR1_GSU0_GSUC0_GSUWGMRR0_K1_LBSPPA128_LBSPPB512_MIWT2_4_PLR1_SU32_SUM0_SUS256_SKXCCM0_VWA1_VWB4_WGM1_WGMXCC1_WGMXCCGn1
    SolutionIndex: 17
    SolutionNameMin: Cijk_Alik_Bljk_HSS_BH_UserArgs_MT64x128x64_MI16x16x1_SN_LDSB1_CLR1_GSU0_GSUC0_GSUWGMRR0_K1_LBSPPA128_LBSPPB128_MIWT2_4_PLR1_SU32_SUM0_SUS256_SKXCCM0_VWA1_VWB1_WGM4_WGMXCC1_WGMXCCGn1
    SolutionIndex: 18
    SolutionNameMin: Cijk_Alik_Bljk_HSS_BH_UserArgs_MT128x64x64_MI16x16x1_SN_LDSB1_CLR1_GSU0_GSUC0_GSUWGMRR0_K1_LBSPPA128_LBSPPB128_MIWT4_2_PLR1_SU32_SUM0_SUS256_SKXCCM0_VWA1_VWB1_WGM1_WGMXCC1_WGMXCCGn1
    SolutionIndex: 19
    SolutionNameMin: Cijk_Alik_Bljk_HSS_BH_UserArgs_MT128x64x64_MI16x16x1_SN_LDSB1_CLR1_GSU0_GSUC0_GSUWGMRR0_K1_LBSPPA512_LBSPPB128_MIWT4_2_PLR1_SU32_SUM0_SUS256_SKXCCM0_VWA4_VWB1_WGM1_WGMXCC1_WGMXCCGn1
    SolutionIndex: 20
    SolutionNameMin: Cijk_Alik_Bljk_HSS_BH_UserArgs_MT128x64x64_MI16x16x1_SN_LDSB1_CLR1_GSU0_GSUC0_GSUWGMRR0_K1_LBSPPA128_LBSPPB256_MIWT4_2_PLR1_SU32_SUM0_SUS256_SKXCCM0_VWA1_VWB2_WGM1_WGMXCC1_WGMXCCGn1
    SolutionIndex: 21
    SolutionNameMin: Cijk_Alik_Bljk_HSS_BH_UserArgs_MT128x64x64_MI16x16x1_SN_LDSB1_CLR1_GSU0_GSUC0_GSUWGMRR0_K1_LBSPPA512_LBSPPB256_MIWT4_2_PLR1_SU32_SUM0_SUS256_SKXCCM0_VWA4_VWB2_WGM1_WGMXCC1_WGMXCCGn1
    SolutionIndex: 22
    SolutionNameMin: Cijk_Alik_Bljk_HSS_BH_UserArgs_MT128x64x64_MI16x16x1_SN_LDSB1_CLR1_GSU0_GSUC0_GSUWGMRR0_K1_LBSPPA512_LBSPPB128_MIWT4_2_PLR1_SU32_SUM0_SUS256_SKXCCM0_VWA4_VWB1_WGM8_WGMXCC1_WGMXCCGn1
    SolutionIndex: 23
    SolutionNameMin: Cijk_Alik_Bljk_HSS_BH_UserArgs_MT128x64x64_MI16x16x1_SN_LDSB1_CLR1_GSU0_GSUC0_GSUWGMRR0_K1_LBSPPA512_LBSPPB256_MIWT4_2_PLR1_SU32_SUM0_SUS256_SKXCCM0_VWA4_VWB2_WGM8_WGMXCC1_WGMXCCGn1
    SolutionIndex: 24
    SolutionNameMin: Cijk_Alik_Bljk_HSS_BH_UserArgs_MT128x64x64_MI16x16x1_SN_LDSB1_CLR1_GSU0_GSUC0_GSUWGMRR0_K1_LBSPPA512_LBSPPB128_MIWT4_2_PLR2_SU32_SUM0_SUS256_SKXCCM0_VWA4_VWB1_WGM8_WGMXCC1_WGMXCCGn1
    SolutionIndex: 25
    SolutionNameMin: Cijk_Alik_Bljk_HSS_BH_UserArgs_MT64x64x64_MI16x16x1_SN_LDSB1_CLR1_GSU0_GSUC0_GSUWGMRR0_K1_LBSPPA128_LBSPPB128_MIWT2_2_PLR1_SU32_SUM0_SUS256_SKXCCM0_VWA1_VWB1_WGM1_WGMXCC1_WGMXCCGn1
    SolutionIndex: 26
    SolutionNameMin: Cijk_Alik_Bljk_HSS_BH_UserArgs_MT64x64x64_MI16x16x1_SN_LDSB1_CLR1_GSU0_GSUC0_GSUWGMRR0_K1_LBSPPA256_LBSPPB128_MIWT2_2_PLR1_SU32_SUM0_SUS256_SKXCCM0_VWA2_VWB1_WGM1_WGMXCC1_WGMXCCGn1
    SolutionIndex: 27
    SolutionNameMin: Cijk_Alik_Bljk_HSS_BH_UserArgs_MT64x64x64_MI16x16x1_SN_LDSB1_CLR1_GSU0_GSUC0_GSUWGMRR0_K1_LBSPPA128_LBSPPB256_MIWT2_2_PLR1_SU32_SUM0_SUS256_SKXCCM0_VWA1_VWB2_WGM1_WGMXCC1_WGMXCCGn1
    SolutionIndex: 28
    SolutionNameMin: Cijk_Alik_Bljk_HSS_BH_UserArgs_MT32x64x64_MI16x16x1_SN_LDSB0_CLR1_GSU0_GSUC0_GSUWGMRR0_K1_LBSPPA128_LBSPPB128_MIWT1_2_PLR1_SU32_SUM0_SUS256_SKXCCM0_VWA1_VWB1_WGM1_WGMXCC1_WGMXCCGn1
    SolutionIndex: 29
    SolutionNameMin: Cijk_Alik_Bljk_HSS_BH_UserArgs_MT32x64x64_MI16x16x1_SN_LDSB0_CLR1_GSU0_GSUC0_GSUWGMRR0_K1_LBSPPA128_LBSPPB256_MIWT1_2_PLR1_SU32_SUM0_SUS256_SKXCCM0_VWA1_VWB2_WGM1_WGMXCC1_WGMXCCGn1
    SolutionIndex: 30
    SolutionNameMin: Cijk_Alik_Bljk_HSS_BH_UserArgs_MT64x32x64_MI16x16x1_SN_LDSB0_CLR1_GSU0_GSUC0_GSUWGMRR0_K1_LBSPPA128_LBSPPB128_MIWT2_1_PLR1_SU32_SUM0_SUS256_SKXCCM0_VWA1_VWB1_WGM1_WGMXCC1_WGMXCCGn1
    SolutionIndex: 31
    SolutionNameMin: Cijk_Alik_Bljk_HSS_BH_UserArgs_MT64x32x64_MI16x16x1_SN_LDSB0_CLR1_GSU0_GSUC0_GSUWGMRR0_K1_LBSPPA256_LBSPPB128_MIWT2_1_PLR1_SU32_SUM0_SUS256_SKXCCM0_VWA2_VWB1_WGM1_WGMXCC1_WGMXCCGn1
    SolutionIndex: 32
    SolutionNameMin: Cijk_Alik_Bljk_HSS_BH_UserArgs_MT32x32x64_MI16x16x1_SN_LDSB0_CLR1_GSU0_GSUC0_GSUWGMRR0_K1_LBSPPA128_LBSPPB128_MIWT1_1_PLR1_SU32_SUM0_SUS256_SKXCCM0_VWA1_VWB1_WGM1_WGMXCC1_WGMXCCGn1
    SolutionIndex: 33
    SolutionNameMin: Cijk_Alik_Bljk_HSS_BH_UserArgs_MT32x32x64_MI16x16x1_SN_LDSB0_CLR1_GSU0_GSUC0_GSUWGMRR0_K1_LBSPPA128_LBSPPB128_MIWT1_1_PLR2_SU32_SUM0_SUS256_SKXCCM0_VWA1_VWB1_WGM1_WGMXCC1_WGMXCCGn1
    SolutionIndex: 34
    SolutionNameMin: Cijk_Alik_Bljk_HSS_BH_UserArgs_MT32x32x64_MI16x16x1_SN_LDSB0_CLR1_GSU0_GSUC0_GSUWGMRR0_K1_LBSPPA128_LBSPPB128_MIWT1_1_PLR1_SU32_SUM0_SUS256_SKXCCM0_VWA1_VWB1_WGM4_WGMXCC1_WGMXCCGn1
    SolutionIndex: 35
    SolutionNameMin: Cijk_Alik_Bljk_HSS_BH_UserArgs_MT32x32x64_MI16x16x1_SN_LDSB0_CLR1_GSU0_GSUC0_GSUWGMRR0_K1_LBSPPA128_LBSPPB128_MIWT1_1_PLR1_SU32_SUM0_SUS256_SKXCCM0_VWA1_VWB1_WGM8_WGMXCC1_WGMXCCGn1
    SolutionIndex: 36
    SolutionNameMin: Cijk_Alik_Bljk_HSS_BH_UserArgs_MT64x64x128_MI16x16x1_SN_LDSB1_CLR1_GSU0_GSUC0_GSUWGMRR0_K1_LBSPPA256_LBSPPB256_MIWT2_2_PLR1_SU32_SUM0_SUS256_SKXCCM0_VWA1_VWB1_WGM1_WGMXCC1_WGMXCCGn1
    SolutionIndex: 37
    SolutionNameMin: Cijk_Alik_Bljk_HSS_BH_UserArgs_MT64x64x128_MI16x16x1_SN_LDSB1_CLR1_GSU0_GSUC0_GSUWGMRR0_K1_LBSPPA256_LBSPPB512_MIWT2_2_PLR1_SU32_SUM0_SUS256_SKXCCM0_VWA1_VWB2_WGM1_WGMXCC1_WGMXCCGn1
    SolutionIndex: 38
    SolutionNameMin: Cijk_Alik_Bljk_HSS_BH_UserArgs_MT64x64x128_MI16x16x1_SN_LDSB1_CLR1_GSU0_GSUC0_GSUWGMRR0_K1_LBSPPA256_LBSPPB512_MIWT2_2_PLR1_SU32_SUM0_SUS256_SKXCCM0_VWA1_VWB2_WGM8_WGMXCC1_WGMXCCGn1
    SolutionIndex: 39
    SolutionNameMin: Cijk_Alik_Bljk_HSS_BH_UserArgs_MT32x64x128_MI16x16x1_SN_LDSB1_CLR1_GSU0_GSUC0_GSUWGMRR0_K1_LBSPPA256_LBSPPB512_MIWT1_2_PLR1_SU32_SUM0_SUS256_SKXCCM0_VWA1_VWB2_WGM1_WGMXCC1_WGMXCCGn1
    SolutionIndex: 40
    SolutionNameMin: Cijk_Alik_Bljk_HSS_BH_UserArgs_MT32x64x128_MI16x16x1_SN_LDSB1_CLR1_GSU0_GSUC0_GSUWGMRR0_K1_LBSPPA256_LBSPPB256_MIWT1_2_PLR2_SU32_SUM0_SUS256_SKXCCM0_VWA1_VWB1_WGM1_WGMXCC1_WGMXCCGn1
    SolutionIndex: 41
    SolutionNameMin: Cijk_Alik_Bljk_HSS_BH_UserArgs_MT32x64x128_MI16x16x1_SN_LDSB1_CLR1_GSU0_GSUC0_GSUWGMRR0_K1_LBSPPA256_LBSPPB512_MIWT1_2_PLR2_SU32_SUM0_SUS256_SKXCCM0_VWA1_VWB2_WGM1_WGMXCC1_WGMXCCGn1
    SolutionIndex: 42
    SolutionNameMin: Cijk_Alik_Bljk_HSS_BH_UserArgs_MT64x32x128_MI16x16x1_SN_LDSB1_CLR1_GSU0_GSUC0_GSUWGMRR0_K1_LBSPPA256_LBSPPB256_MIWT2_1_PLR2_SU32_SUM0_SUS256_SKXCCM0_VWA1_VWB1_WGM1_WGMXCC1_WGMXCCGn1
    SolutionIndex: 43
    SolutionNameMin: Cijk_Alik_Bljk_HSS_BH_UserArgs_MT32x32x128_MI16x16x1_SN_LDSB1_CLR1_GSU0_GSUC0_GSUWGMRR0_K1_LBSPPA256_LBSPPB256_MIWT1_1_PLR1_SU32_SUM0_SUS256_SKXCCM0_VWA1_VWB1_WGM1_WGMXCC1_WGMXCCGn1
    SolutionIndex: 44
    SolutionNameMin: Cijk_Alik_Bljk_HSS_BH_UserArgs_MT32x32x128_MI16x16x1_SN_LDSB1_CLR1_GSU0_GSUC0_GSUWGMRR0_K1_LBSPPA256_LBSPPB256_MIWT1_1_PLR2_SU32_SUM0_SUS256_SKXCCM0_VWA1_VWB1_WGM1_WGMXCC1_WGMXCCGn1
    SolutionIndex: 45
    SolutionNameMin: Cijk_Alik_Bljk_HSS_BH_UserArgs_MT32x32x128_MI16x16x1_SN_LDSB1_CLR1_GSU0_GSUC0_GSUWGMRR0_K1_LBSPPA256_LBSPPB256_MIWT1_1_PLR2_SU32_SUM0_SUS256_SKXCCM0_VWA1_VWB1_WGM8_WGMXCC1_WGMXCCGn1
    SolutionIndex: 46
    SolutionNameMin: Cijk_Alik_Bljk_HSS_BH_UserArgs_MT128x128x32_MI16x16x1_SN_LDSB1_CLR1_GSU0_GSUC0_GSUWGMRR0_K1_LBSPPA256_LBSPPB128_MIWT4_4_PLR1_SU32_SUM0_SUS256_SKXCCM6_VWA4_VWB2_WGM8_WGMXCC1_WGMXCCGn1
    SolutionIndex: 47
    SolutionNameMin: Cijk_Alik_Bljk_HSS_BH_UserArgs_MT128x128x32_MI16x16x1_SN_LDSB1_CLR1_GSU0_GSUC0_GSUWGMRR0_K1_LBSPPA256_LBSPPB256_MIWT4_4_PLR1_SU32_SUM0_SUS256_SKXCCM6_VWA4_VWB4_WGM8_WGMXCC1_WGMXCCGn1
    SolutionIndex: 48
    SolutionNameMin: Cijk_Alik_Bljk_HSS_BH_UserArgs_MT64x256x64_MI16x16x1_SN_LDSB1_CLR1_GSU0_GSUC0_GSUWGMRR0_K1_LBSPPA128_LBSPPB128_MIWT2_8_PLR1_SU32_SUM0_SUS256_SKXCCM6_VWA1_VWB1_WGM1_WGMXCC1_WGMXCCGn1
    SolutionIndex: 49
    SolutionNameMin: Cijk_Alik_Bljk_HSS_BH_UserArgs_MT64x256x64_MI16x16x1_SN_LDSB1_CLR1_GSU0_GSUC0_GSUWGMRR0_K1_LBSPPA256_LBSPPB512_MIWT2_8_PLR1_SU32_SUM0_SUS256_SKXCCM6_VWA2_VWB4_WGM1_WGMXCC1_WGMXCCGn1
    SolutionIndex: 50
    SolutionNameMin: Cijk_Alik_Bljk_HSS_BH_UserArgs_MT64x256x64_MI16x16x1_SN_LDSB1_CLR1_GSU0_GSUC0_GSUWGMRR0_K1_LBSPPA256_LBSPPB1024_MIWT2_8_PLR1_SU32_SUM0_SUS256_SKXCCM6_VWA2_VWB8_WGM1_WGMXCC1_WGMXCCGn1
    SolutionIndex: 51
    SolutionNameMin: Cijk_Alik_Bljk_HSS_BH_UserArgs_MT128x128x64_MI16x16x1_SN_LDSB1_CLR1_GSU0_GSUC0_GSUWGMRR0_K1_LBSPPA128_LBSPPB128_MIWT4_4_PLR1_SU32_SUM0_SUS256_SKXCCM6_VWA1_VWB1_WGM1_WGMXCC1_WGMXCCGn1
    SolutionIndex: 52
    SolutionNameMin: Cijk_Alik_Bljk_HSS_BH_UserArgs_MT128x128x64_MI16x16x1_SN_LDSB1_CLR1_GSU0_GSUC0_GSUWGMRR0_K1_LBSPPA512_LBSPPB128_MIWT4_4_PLR1_SU32_SUM0_SUS256_SKXCCM6_VWA4_VWB1_WGM1_WGMXCC1_WGMXCCGn1
    SolutionIndex: 53
    SolutionNameMin: Cijk_Alik_Bljk_HSS_BH_UserArgs_MT128x128x64_MI16x16x1_SN_LDSB1_CLR1_GSU0_GSUC0_GSUWGMRR0_K1_LBSPPA128_LBSPPB256_MIWT4_4_PLR1_SU32_SUM0_SUS256_SKXCCM6_VWA1_VWB2_WGM1_WGMXCC1_WGMXCCGn1
    SolutionIndex: 54
    SolutionNameMin: Cijk_Alik_Bljk_HSS_BH_UserArgs_MT128x128x64_MI16x16x1_SN_LDSB1_CLR1_GSU0_GSUC0_GSUWGMRR0_K1_LBSPPA512_LBSPPB256_MIWT4_4_PLR1_SU32_SUM0_SUS256_SKXCCM6_VWA4_VWB2_WGM1_WGMXCC1_WGMXCCGn1
    SolutionIndex: 55
    SolutionNameMin: Cijk_Alik_Bljk_HSS_BH_UserArgs_MT128x128x64_MI16x16x1_SN_LDSB1_CLR1_GSU0_GSUC0_GSUWGMRR0_K1_LBSPPA512_LBSPPB512_MIWT4_4_PLR1_SU32_SUM0_SUS256_SKXCCM6_VWA4_VWB4_WGM1_WGMXCC1_WGMXCCGn1
    SolutionIndex: 56
    SolutionNameMin: Cijk_Alik_Bljk_HSS_BH_UserArgs_MT128x128x64_MI16x16x1_SN_LDSB1_CLR1_GSU0_GSUC0_GSUWGMRR0_K1_LBSPPA128_LBSPPB128_MIWT4_4_PLR2_SU32_SUM0_SUS256_SKXCCM6_VWA1_VWB1_WGM1_WGMXCC1_WGMXCCGn1
    SolutionIndex: 57
    SolutionNameMin: Cijk_Alik_Bljk_HSS_BH_UserArgs_MT128x128x64_MI16x16x1_SN_LDSB1_CLR1_GSU0_GSUC0_GSUWGMRR0_K1_LBSPPA512_LBSPPB128_MIWT4_4_PLR2_SU32_SUM0_SUS256_SKXCCM6_VWA4_VWB1_WGM1_WGMXCC1_WGMXCCGn1
    SolutionIndex: 58
    SolutionNameMin: Cijk_Alik_Bljk_HSS_BH_UserArgs_MT128x128x64_MI16x16x1_SN_LDSB1_CLR1_GSU0_GSUC0_GSUWGMRR0_K1_LBSPPA512_LBSPPB256_MIWT4_4_PLR2_SU32_SUM0_SUS256_SKXCCM6_VWA4_VWB2_WGM1_WGMXCC1_WGMXCCGn1
    SolutionIndex: 59
    SolutionNameMin: Cijk_Alik_Bljk_HSS_BH_UserArgs_MT128x128x64_MI16x16x1_SN_LDSB1_CLR1_GSU0_GSUC0_GSUWGMRR0_K1_LBSPPA512_LBSPPB512_MIWT4_4_PLR2_SU32_SUM0_SUS256_SKXCCM6_VWA4_VWB4_WGM1_WGMXCC1_WGMXCCGn1
    SolutionIndex: 60
    SolutionNameMin: Cijk_Alik_Bljk_HSS_BH_UserArgs_MT128x128x64_MI16x16x1_SN_LDSB1_CLR1_GSU0_GSUC0_GSUWGMRR0_K1_LBSPPA128_LBSPPB128_MIWT4_4_PLR1_SU32_SUM0_SUS256_SKXCCM6_VWA1_VWB1_WGM4_WGMXCC1_WGMXCCGn1
    SolutionIndex: 61
    SolutionNameMin: Cijk_Alik_Bljk_HSS_BH_UserArgs_MT128x128x64_MI16x16x1_SN_LDSB1_CLR1_GSU0_GSUC0_GSUWGMRR0_K1_LBSPPA256_LBSPPB128_MIWT4_4_PLR1_SU32_SUM0_SUS256_SKXCCM6_VWA2_VWB1_WGM4_WGMXCC1_WGMXCCGn1
    SolutionIndex: 62
    SolutionNameMin: Cijk_Alik_Bljk_HSS_BH_UserArgs_MT128x128x64_MI16x16x1_SN_LDSB1_CLR1_GSU0_GSUC0_GSUWGMRR0_K1_LBSPPA512_LBSPPB128_MIWT4_4_PLR1_SU32_SUM0_SUS256_SKXCCM6_VWA4_VWB1_WGM4_WGMXCC1_WGMXCCGn1
    SolutionIndex: 63
    SolutionNameMin: Cijk_Alik_Bljk_HSS_BH_UserArgs_MT128x128x64_MI16x16x1_SN_LDSB1_CLR1_GSU0_GSUC0_GSUWGMRR0_K1_LBSPPA256_LBSPPB256_MIWT4_4_PLR1_SU32_SUM0_SUS256_SKXCCM6_VWA2_VWB2_WGM4_WGMXCC1_WGMXCCGn1
    SolutionIndex: 64
    SolutionNameMin: Cijk_Alik_Bljk_HSS_BH_UserArgs_MT128x128x64_MI16x16x1_SN_LDSB1_CLR1_GSU0_GSUC0_GSUWGMRR0_K1_LBSPPA512_LBSPPB256_MIWT4_4_PLR1_SU32_SUM0_SUS256_SKXCCM6_VWA4_VWB2_WGM4_WGMXCC1_WGMXCCGn1
    SolutionIndex: 65
    SolutionNameMin: Cijk_Alik_Bljk_HSS_BH_UserArgs_MT128x128x64_MI16x16x1_SN_LDSB1_CLR1_GSU0_GSUC0_GSUWGMRR0_K1_LBSPPA128_LBSPPB512_MIWT4_4_PLR1_SU32_SUM0_SUS256_SKXCCM6_VWA1_VWB4_WGM4_WGMXCC1_WGMXCCGn1
    SolutionIndex: 66
    SolutionNameMin: Cijk_Alik_Bljk_HSS_BH_UserArgs_MT128x128x64_MI16x16x1_SN_LDSB1_CLR1_GSU0_GSUC0_GSUWGMRR0_K1_LBSPPA256_LBSPPB512_MIWT4_4_PLR1_SU32_SUM0_SUS256_SKXCCM6_VWA2_VWB4_WGM4_WGMXCC1_WGMXCCGn1
    SolutionIndex: 67
    SolutionNameMin: Cijk_Alik_Bljk_HSS_BH_UserArgs_MT128x128x64_MI16x16x1_SN_LDSB1_CLR1_GSU0_GSUC0_GSUWGMRR0_K1_LBSPPA512_LBSPPB512_MIWT4_4_PLR1_SU32_SUM0_SUS256_SKXCCM6_VWA4_VWB4_WGM4_WGMXCC1_WGMXCCGn1
    SolutionIndex: 68
    SolutionNameMin: Cijk_Alik_Bljk_HSS_BH_UserArgs_MT128x128x64_MI16x16x1_SN_LDSB1_CLR1_GSU0_GSUC0_GSUWGMRR0_K1_LBSPPA512_LBSPPB128_MIWT4_4_PLR2_SU32_SUM0_SUS256_SKXCCM6_VWA4_VWB1_WGM4_WGMXCC1_WGMXCCGn1
    SolutionIndex: 69
    SolutionNameMin: Cijk_Alik_Bljk_HSS_BH_UserArgs_MT128x128x64_MI16x16x1_SN_LDSB1_CLR1_GSU0_GSUC0_GSUWGMRR0_K1_LBSPPA512_LBSPPB512_MIWT4_4_PLR2_SU32_SUM0_SUS256_SKXCCM6_VWA4_VWB4_WGM4_WGMXCC1_WGMXCCGn1
    SolutionIndex: 70
    SolutionNameMin: Cijk_Alik_Bljk_HSS_BH_UserArgs_MT128x128x64_MI16x16x1_SN_LDSB1_CLR1_GSU0_GSUC0_GSUWGMRR0_K1_LBSPPA128_LBSPPB128_MIWT4_4_PLR1_SU32_SUM0_SUS256_SKXCCM6_VWA1_VWB1_WGM8_WGMXCC1_WGMXCCGn1
    SolutionIndex: 71
    SolutionNameMin: Cijk_Alik_Bljk_HSS_BH_UserArgs_MT128x128x64_MI16x16x1_SN_LDSB1_CLR1_GSU0_GSUC0_GSUWGMRR0_K1_LBSPPA256_LBSPPB128_MIWT4_4_PLR1_SU32_SUM0_SUS256_SKXCCM6_VWA2_VWB1_WGM8_WGMXCC1_WGMXCCGn1
    SolutionIndex: 72
    SolutionNameMin: Cijk_Alik_Bljk_HSS_BH_UserArgs_MT128x128x64_MI16x16x1_SN_LDSB1_CLR1_GSU0_GSUC0_GSUWGMRR0_K1_LBSPPA512_LBSPPB128_MIWT4_4_PLR1_SU32_SUM0_SUS256_SKXCCM6_VWA4_VWB1_WGM8_WGMXCC1_WGMXCCGn1
    SolutionIndex: 73
    SolutionNameMin: Cijk_Alik_Bljk_HSS_BH_UserArgs_MT128x128x64_MI16x16x1_SN_LDSB1_CLR1_GSU0_GSUC0_GSUWGMRR0_K1_LBSPPA128_LBSPPB256_MIWT4_4_PLR1_SU32_SUM0_SUS256_SKXCCM6_VWA1_VWB2_WGM8_WGMXCC1_WGMXCCGn1
    SolutionIndex: 74
    SolutionNameMin: Cijk_Alik_Bljk_HSS_BH_UserArgs_MT128x128x64_MI16x16x1_SN_LDSB1_CLR1_GSU0_GSUC0_GSUWGMRR0_K1_LBSPPA256_LBSPPB256_MIWT4_4_PLR1_SU32_SUM0_SUS256_SKXCCM6_VWA2_VWB2_WGM8_WGMXCC1_WGMXCCGn1
    SolutionIndex: 75
    SolutionNameMin: Cijk_Alik_Bljk_HSS_BH_UserArgs_MT128x128x64_MI16x16x1_SN_LDSB1_CLR1_GSU0_GSUC0_GSUWGMRR0_K1_LBSPPA512_LBSPPB256_MIWT4_4_PLR1_SU32_SUM0_SUS256_SKXCCM6_VWA4_VWB2_WGM8_WGMXCC1_WGMXCCGn1
    SolutionIndex: 76
    SolutionNameMin: Cijk_Alik_Bljk_HSS_BH_UserArgs_MT128x128x64_MI16x16x1_SN_LDSB1_CLR1_GSU0_GSUC0_GSUWGMRR0_K1_LBSPPA128_LBSPPB512_MIWT4_4_PLR1_SU32_SUM0_SUS256_SKXCCM6_VWA1_VWB4_WGM8_WGMXCC1_WGMXCCGn1
    SolutionIndex: 77
    SolutionNameMin: Cijk_Alik_Bljk_HSS_BH_UserArgs_MT128x128x64_MI16x16x1_SN_LDSB1_CLR1_GSU0_GSUC0_GSUWGMRR0_K1_LBSPPA256_LBSPPB512_MIWT4_4_PLR1_SU32_SUM0_SUS256_SKXCCM6_VWA2_VWB4_WGM8_WGMXCC1_WGMXCCGn1
    SolutionIndex: 78
    SolutionNameMin: Cijk_Alik_Bljk_HSS_BH_UserArgs_MT128x128x64_MI16x16x1_SN_LDSB1_CLR1_GSU0_GSUC0_GSUWGMRR0_K1_LBSPPA512_LBSPPB512_MIWT4_4_PLR1_SU32_SUM0_SUS256_SKXCCM6_VWA4_VWB4_WGM8_WGMXCC1_WGMXCCGn1
    SolutionIndex: 79
    SolutionNameMin: Cijk_Alik_Bljk_HSS_BH_UserArgs_MT128x128x64_MI16x16x1_SN_LDSB1_CLR1_GSU0_GSUC0_GSUWGMRR0_K1_LBSPPA128_LBSPPB256_MIWT4_4_PLR2_SU32_SUM0_SUS256_SKXCCM6_VWA1_VWB2_WGM8_WGMXCC1_WGMXCCGn1
    SolutionIndex: 80
    SolutionNameMin: Cijk_Alik_Bljk_HSS_BH_UserArgs_MT128x128x64_MI16x16x1_SN_LDSB1_CLR1_GSU0_GSUC0_GSUWGMRR0_K1_LBSPPA512_LBSPPB256_MIWT4_4_PLR2_SU32_SUM0_SUS256_SKXCCM6_VWA4_VWB2_WGM8_WGMXCC1_WGMXCCGn1
    SolutionIndex: 81
    SolutionNameMin: Cijk_Alik_Bljk_HSS_BH_UserArgs_MT128x128x64_MI16x16x1_SN_LDSB1_CLR1_GSU0_GSUC0_GSUWGMRR0_K1_LBSPPA128_LBSPPB512_MIWT4_4_PLR2_SU32_SUM0_SUS256_SKXCCM6_VWA1_VWB4_WGM8_WGMXCC1_WGMXCCGn1
    SolutionIndex: 82
    SolutionNameMin: Cijk_Alik_Bljk_HSS_BH_UserArgs_MT64x128x64_MI16x16x1_SN_LDSB1_CLR1_GSU0_GSUC0_GSUWGMRR0_K1_LBSPPA128_LBSPPB256_MIWT2_4_PLR1_SU32_SUM0_SUS256_SKXCCM6_VWA1_VWB2_WGM1_WGMXCC1_WGMXCCGn1
    SolutionIndex: 83
    SolutionNameMin: Cijk_Alik_Bljk_HSS_BH_UserArgs_MT64x128x64_MI16x16x1_SN_LDSB1_CLR1_GSU0_GSUC0_GSUWGMRR0_K1_LBSPPA256_LBSPPB256_MIWT2_4_PLR1_SU32_SUM0_SUS256_SKXCCM6_VWA2_VWB2_WGM1_WGMXCC1_WGMXCCGn1
    SolutionIndex: 84
    SolutionNameMin: Cijk_Alik_Bljk_HSS_BH_UserArgs_MT64x128x64_MI16x16x1_SN_LDSB1_CLR1_GSU0_GSUC0_GSUWGMRR0_K1_LBSPPA128_LBSPPB512_MIWT2_4_PLR1_SU32_SUM0_SUS256_SKXCCM6_VWA1_VWB4_WGM1_WGMXCC1_WGMXCCGn1
    SolutionIndex: 85
    SolutionNameMin: Cijk_Alik_Bljk_HSS_BH_UserArgs_MT64x128x64_MI16x16x1_SN_LDSB1_CLR1_GSU0_GSUC0_GSUWGMRR0_K1_LBSPPA128_LBSPPB128_MIWT2_4_PLR1_SU32_SUM0_SUS256_SKXCCM6_VWA1_VWB1_WGM4_WGMXCC1_WGMXCCGn1
    SolutionIndex: 86
    SolutionNameMin: Cijk_Alik_Bljk_HSS_BH_UserArgs_MT64x128x64_MI16x16x1_SN_LDSB1_CLR1_GSU0_GSUC0_GSUWGMRR0_K1_LBSPPA128_LBSPPB256_MIWT2_4_PLR1_SU32_SUM0_SUS256_SKXCCM6_VWA1_VWB2_WGM4_WGMXCC1_WGMXCCGn1
    SolutionIndex: 87
    SolutionNameMin: Cijk_Alik_Bljk_HSS_BH_UserArgs_MT64x128x64_MI16x16x1_SN_LDSB1_CLR1_GSU0_GSUC0_GSUWGMRR0_K1_LBSPPA256_LBSPPB256_MIWT2_4_PLR1_SU32_SUM0_SUS256_SKXCCM6_VWA2_VWB2_WGM4_WGMXCC1_WGMXCCGn1
    SolutionIndex: 88
    SolutionNameMin: Cijk_Alik_Bljk_HSS_BH_UserArgs_MT64x128x64_MI16x16x1_SN_LDSB1_CLR1_GSU0_GSUC0_GSUWGMRR0_K1_LBSPPA128_LBSPPB128_MIWT2_4_PLR2_SU32_SUM0_SUS256_SKXCCM6_VWA1_VWB1_WGM4_WGMXCC1_WGMXCCGn1
    SolutionIndex: 89
    SolutionNameMin: Cijk_Alik_Bljk_HSS_BH_UserArgs_MT64x128x64_MI16x16x1_SN_LDSB1_CLR1_GSU0_GSUC0_GSUWGMRR0_K1_LBSPPA128_LBSPPB256_MIWT2_4_PLR2_SU32_SUM0_SUS256_SKXCCM6_VWA1_VWB2_WGM4_WGMXCC1_WGMXCCGn1
    SolutionIndex: 90
    SolutionNameMin: Cijk_Alik_Bljk_HSS_BH_UserArgs_MT64x128x64_MI16x16x1_SN_LDSB1_CLR1_GSU0_GSUC0_GSUWGMRR0_K1_LBSPPA256_LBSPPB256_MIWT2_4_PLR1_SU32_SUM0_SUS256_SKXCCM6_VWA2_VWB2_WGM8_WGMXCC1_WGMXCCGn1
    SolutionIndex: 91
    SolutionNameMin: Cijk_Alik_Bljk_HSS_BH_UserArgs_MT128x64x64_MI16x16x1_SN_LDSB1_CLR1_GSU0_GSUC0_GSUWGMRR0_K1_LBSPPA512_LBSPPB128_MIWT4_2_PLR1_SU32_SUM0_SUS256_SKXCCM6_VWA4_VWB1_WGM1_WGMXCC1_WGMXCCGn1
    SolutionIndex: 92
    SolutionNameMin: Cijk_Alik_Bljk_HSS_BH_UserArgs_MT128x64x64_MI16x16x1_SN_LDSB1_CLR1_GSU0_GSUC0_GSUWGMRR0_K1_LBSPPA128_LBSPPB256_MIWT4_2_PLR1_SU32_SUM0_SUS256_SKXCCM6_VWA1_VWB2_WGM1_WGMXCC1_WGMXCCGn1
    SolutionIndex: 93
    SolutionNameMin: Cijk_Alik_Bljk_HSS_BH_UserArgs_MT128x64x64_MI16x16x1_SN_LDSB1_CLR1_GSU0_GSUC0_GSUWGMRR0_K1_LBSPPA512_LBSPPB256_MIWT4_2_PLR1_SU32_SUM0_SUS256_SKXCCM6_VWA4_VWB2_WGM1_WGMXCC1_WGMXCCGn1
    SolutionIndex: 94
    SolutionNameMin: Cijk_Alik_Bljk_HSS_BH_UserArgs_MT128x64x64_MI16x16x1_SN_LDSB1_CLR1_GSU0_GSUC0_GSUWGMRR0_K1_LBSPPA512_LBSPPB128_MIWT4_2_PLR2_SU32_SUM0_SUS256_SKXCCM6_VWA4_VWB1_WGM1_WGMXCC1_WGMXCCGn1
    SolutionIndex: 95
    SolutionNameMin: Cijk_Alik_Bljk_HSS_BH_UserArgs_MT128x64x64_MI16x16x1_SN_LDSB1_CLR1_GSU0_GSUC0_GSUWGMRR0_K1_LBSPPA512_LBSPPB256_MIWT4_2_PLR2_SU32_SUM0_SUS256_SKXCCM6_VWA4_VWB2_WGM1_WGMXCC1_WGMXCCGn1
    SolutionIndex: 96
    SolutionNameMin: Cijk_Alik_Bljk_HSS_BH_UserArgs_MT128x64x64_MI16x16x1_SN_LDSB1_CLR1_GSU0_GSUC0_GSUWGMRR0_K1_LBSPPA512_LBSPPB128_MIWT4_2_PLR1_SU32_SUM0_SUS256_SKXCCM6_VWA4_VWB1_WGM4_WGMXCC1_WGMXCCGn1
    SolutionIndex: 97
    SolutionNameMin: Cijk_Alik_Bljk_HSS_BH_UserArgs_MT128x64x64_MI16x16x1_SN_LDSB1_CLR1_GSU0_GSUC0_GSUWGMRR0_K1_LBSPPA512_LBSPPB256_MIWT4_2_PLR1_SU32_SUM0_SUS256_SKXCCM6_VWA4_VWB2_WGM4_WGMXCC1_WGMXCCGn1
    SolutionIndex: 98
    SolutionNameMin: Cijk_Alik_Bljk_HSS_BH_UserArgs_MT128x64x64_MI16x16x1_SN_LDSB1_CLR1_GSU0_GSUC0_GSUWGMRR0_K1_LBSPPA128_LBSPPB256_MIWT4_2_PLR2_SU32_SUM0_SUS256_SKXCCM6_VWA1_VWB2_WGM4_WGMXCC1_WGMXCCGn1
    SolutionIndex: 99
    SolutionNameMin: Cijk_Alik_Bljk_HSS_BH_UserArgs_MT128x64x64_MI16x16x1_SN_LDSB1_CLR1_GSU0_GSUC0_GSUWGMRR0_K1_LBSPPA512_LBSPPB256_MIWT4_2_PLR1_SU32_SUM0_SUS256_SKXCCM6_VWA4_VWB2_WGM8_WGMXCC1_WGMXCCGn1
    SolutionIndex: 100
    SolutionNameMin: Cijk_Alik_Bljk_HSS_BH_UserArgs_MT128x64x64_MI16x16x1_SN_LDSB1_CLR1_GSU0_GSUC0_GSUWGMRR0_K1_LBSPPA512_LBSPPB256_MIWT4_2_PLR2_SU32_SUM0_SUS256_SKXCCM6_VWA4_VWB2_WGM8_WGMXCC1_WGMXCCGn1
    SolutionIndex: 101
    SolutionNameMin: Cijk_Alik_Bljk_HSS_BH_UserArgs_MT64x64x64_MI16x16x1_SN_LDSB1_CLR1_GSU0_GSUC0_GSUWGMRR0_K1_LBSPPA128_LBSPPB128_MIWT2_2_PLR1_SU32_SUM0_SUS256_SKXCCM6_VWA1_VWB1_WGM1_WGMXCC1_WGMXCCGn1
    SolutionIndex: 102
    SolutionNameMin: Cijk_Alik_Bljk_HSS_BH_UserArgs_MT64x64x64_MI16x16x1_SN_LDSB1_CLR1_GSU0_GSUC0_GSUWGMRR0_K1_LBSPPA128_LBSPPB256_MIWT2_2_PLR1_SU32_SUM0_SUS256_SKXCCM6_VWA1_VWB2_WGM1_WGMXCC1_WGMXCCGn1
    SolutionIndex: 103
    SolutionNameMin: Cijk_Alik_Bljk_HSS_BH_UserArgs_MT64x64x64_MI16x16x1_SN_LDSB1_CLR1_GSU0_GSUC0_GSUWGMRR0_K1_LBSPPA128_LBSPPB128_MIWT2_2_PLR1_SU32_SUM0_SUS256_SKXCCM6_VWA1_VWB1_WGM8_WGMXCC1_WGMXCCGn1
    SolutionIndex: 104
    SolutionNameMin: Cijk_Alik_Bljk_HSS_BH_UserArgs_MT32x32x64_MI16x16x1_SN_LDSB0_CLR1_GSU0_GSUC0_GSUWGMRR0_K1_LBSPPA128_LBSPPB128_MIWT1_1_PLR1_SU32_SUM0_SUS256_SKXCCM6_VWA1_VWB1_WGM1_WGMXCC1_WGMXCCGn1
    SolutionIndex: 105
    SolutionNameMin: Cijk_Alik_Bljk_HSS_BH_UserArgs_MT32x128x128_MI16x16x1_SN_LDSB1_CLR1_GSU0_GSUC0_GSUWGMRR0_K1_LBSPPA256_LBSPPB512_MIWT1_4_PLR1_SU32_SUM0_SUS256_SKXCCM6_VWA1_VWB2_WGM1_WGMXCC1_WGMXCCGn1
    SolutionIndex: 106
    SolutionNameMin: Cijk_Alik_Bljk_HSS_BH_UserArgs_MT64x64x128_MI16x16x1_SN_LDSB1_CLR1_GSU0_GSUC0_GSUWGMRR0_K1_LBSPPA256_LBSPPB256_MIWT2_2_PLR1_SU32_SUM0_SUS256_SKXCCM6_VWA1_VWB1_WGM1_WGMXCC1_WGMXCCGn1
    SolutionIndex: 107
    SolutionNameMin: Cijk_Alik_Bljk_HSS_BH_UserArgs_MT64x64x128_MI16x16x1_SN_LDSB1_CLR1_GSU0_GSUC0_GSUWGMRR0_K1_LBSPPA256_LBSPPB512_MIWT2_2_PLR1_SU32_SUM0_SUS256_SKXCCM6_VWA1_VWB2_WGM1_WGMXCC1_WGMXCCGn1
    SolutionIndex: 108
    SolutionNameMin: Cijk_Alik_Bljk_HSS_BH_UserArgs_MT64x64x128_MI16x16x1_SN_LDSB1_CLR1_GSU0_GSUC0_GSUWGMRR0_K1_LBSPPA512_LBSPPB512_MIWT2_2_PLR1_SU32_SUM0_SUS256_SKXCCM6_VWA2_VWB2_WGM1_WGMXCC1_WGMXCCGn1
    SolutionIndex: 109
    SolutionNameMin: Cijk_Alik_Bljk_HSS_BH_UserArgs_MT64x64x128_MI16x16x1_SN_LDSB1_CLR1_GSU0_GSUC0_GSUWGMRR0_K1_LBSPPA256_LBSPPB256_MIWT2_2_PLR2_SU32_SUM0_SUS256_SKXCCM6_VWA1_VWB1_WGM1_WGMXCC1_WGMXCCGn1
    SolutionIndex: 110
    SolutionNameMin: Cijk_Alik_Bljk_HSS_BH_UserArgs_MT64x64x128_MI16x16x1_SN_LDSB1_CLR1_GSU0_GSUC0_GSUWGMRR0_K1_LBSPPA512_LBSPPB256_MIWT2_2_PLR2_SU32_SUM0_SUS256_SKXCCM6_VWA2_VWB1_WGM1_WGMXCC1_WGMXCCGn1
    SolutionIndex: 111
    SolutionNameMin: Cijk_Alik_Bljk_HSS_BH_UserArgs_MT64x64x128_MI16x16x1_SN_LDSB1_CLR1_GSU0_GSUC0_GSUWGMRR0_K1_LBSPPA256_LBSPPB512_MIWT2_2_PLR2_SU32_SUM0_SUS256_SKXCCM6_VWA1_VWB2_WGM1_WGMXCC1_WGMXCCGn1
    SolutionIndex: 112
    SolutionNameMin: Cijk_Alik_Bljk_HSS_BH_UserArgs_MT64x64x128_MI16x16x1_SN_LDSB1_CLR1_GSU0_GSUC0_GSUWGMRR0_K1_LBSPPA256_LBSPPB256_MIWT2_2_PLR1_SU32_SUM0_SUS256_SKXCCM6_VWA1_VWB1_WGM4_WGMXCC1_WGMXCCGn1
    SolutionIndex: 113
    SolutionNameMin: Cijk_Alik_Bljk_HSS_BH_UserArgs_MT64x64x128_MI16x16x1_SN_LDSB1_CLR1_GSU0_GSUC0_GSUWGMRR0_K1_LBSPPA512_LBSPPB256_MIWT2_2_PLR1_SU32_SUM0_SUS256_SKXCCM6_VWA2_VWB1_WGM4_WGMXCC1_WGMXCCGn1
    SolutionIndex: 114
    SolutionNameMin: Cijk_Alik_Bljk_HSS_BH_UserArgs_MT64x64x128_MI16x16x1_SN_LDSB1_CLR1_GSU0_GSUC0_GSUWGMRR0_K1_LBSPPA512_LBSPPB512_MIWT2_2_PLR1_SU32_SUM0_SUS256_SKXCCM6_VWA2_VWB2_WGM4_WGMXCC1_WGMXCCGn1
    SolutionIndex: 115
    SolutionNameMin: Cijk_Alik_Bljk_HSS_BH_UserArgs_MT64x64x128_MI16x16x1_SN_LDSB1_CLR1_GSU0_GSUC0_GSUWGMRR0_K1_LBSPPA256_LBSPPB256_MIWT2_2_PLR2_SU32_SUM0_SUS256_SKXCCM6_VWA1_VWB1_WGM4_WGMXCC1_WGMXCCGn1
    SolutionIndex: 116
    SolutionNameMin: Cijk_Alik_Bljk_HSS_BH_UserArgs_MT64x64x128_MI16x16x1_SN_LDSB1_CLR1_GSU0_GSUC0_GSUWGMRR0_K1_LBSPPA256_LBSPPB512_MIWT2_2_PLR2_SU32_SUM0_SUS256_SKXCCM6_VWA1_VWB2_WGM4_WGMXCC1_WGMXCCGn1
    SolutionIndex: 117
    SolutionNameMin: Cijk_Alik_Bljk_HSS_BH_UserArgs_MT64x64x128_MI16x16x1_SN_LDSB1_CLR1_GSU0_GSUC0_GSUWGMRR0_K1_LBSPPA256_LBSPPB256_MIWT2_2_PLR1_SU32_SUM0_SUS256_SKXCCM6_VWA1_VWB1_WGM8_WGMXCC1_WGMXCCGn1
    SolutionIndex: 118
    SolutionNameMin: Cijk_Alik_Bljk_HSS_BH_UserArgs_MT64x64x128_MI16x16x1_SN_LDSB1_CLR1_GSU0_GSUC0_GSUWGMRR0_K1_LBSPPA256_LBSPPB512_MIWT2_2_PLR1_SU32_SUM0_SUS256_SKXCCM6_VWA1_VWB2_WGM8_WGMXCC1_WGMXCCGn1
    SolutionIndex: 119
    SolutionNameMin: Cijk_Alik_Bljk_HSS_BH_UserArgs_MT64x64x128_MI16x16x1_SN_LDSB1_CLR1_GSU0_GSUC0_GSUWGMRR0_K1_LBSPPA512_LBSPPB256_MIWT2_2_PLR2_SU32_SUM0_SUS256_SKXCCM6_VWA2_VWB1_WGM8_WGMXCC1_WGMXCCGn1
    SolutionIndex: 120
    SolutionNameMin: Cijk_Alik_Bljk_HSS_BH_UserArgs_MT64x64x128_MI16x16x1_SN_LDSB1_CLR1_GSU0_GSUC0_GSUWGMRR0_K1_LBSPPA256_LBSPPB512_MIWT2_2_PLR2_SU32_SUM0_SUS256_SKXCCM6_VWA1_VWB2_WGM8_WGMXCC1_WGMXCCGn1
    SolutionIndex: 121
    SolutionNameMin: Cijk_Alik_Bljk_HSS_BH_UserArgs_MT32x64x128_MI16x16x1_SN_LDSB1_CLR1_GSU0_GSUC0_GSUWGMRR0_K1_LBSPPA256_LBSPPB512_MIWT1_2_PLR1_SU32_SUM0_SUS256_SKXCCM6_VWA1_VWB2_WGM1_WGMXCC1_WGMXCCGn1
    SolutionIndex: 122
    SolutionNameMin: Cijk_Alik_Bljk_HSS_BH_UserArgs_MT32x64x128_MI16x16x1_SN_LDSB1_CLR1_GSU0_GSUC0_GSUWGMRR0_K1_LBSPPA256_LBSPPB256_MIWT1_2_PLR2_SU32_SUM0_SUS256_SKXCCM6_VWA1_VWB1_WGM1_WGMXCC1_WGMXCCGn1
    SolutionIndex: 123
    SolutionNameMin: Cijk_Alik_Bljk_HSS_BH_UserArgs_MT32x64x128_MI16x16x1_SN_LDSB1_CLR1_GSU0_GSUC0_GSUWGMRR0_K1_LBSPPA256_LBSPPB512_MIWT1_2_PLR2_SU32_SUM0_SUS256_SKXCCM6_VWA1_VWB2_WGM4_WGMXCC1_WGMXCCGn1
    SolutionIndex: 124
    SolutionNameMin: Cijk_Alik_Bljk_HSS_BH_UserArgs_MT32x64x128_MI16x16x1_SN_LDSB1_CLR1_GSU0_GSUC0_GSUWGMRR0_K1_LBSPPA256_LBSPPB256_MIWT1_2_PLR2_SU32_SUM0_SUS256_SKXCCM6_VWA1_VWB1_WGM8_WGMXCC1_WGMXCCGn1
    SolutionIndex: 125
    SolutionNameMin: Cijk_Alik_Bljk_HSS_BH_UserArgs_MT64x32x128_MI16x16x1_SN_LDSB1_CLR1_GSU0_GSUC0_GSUWGMRR0_K1_LBSPPA256_LBSPPB256_MIWT2_1_PLR2_SU32_SUM0_SUS256_SKXCCM6_VWA1_VWB1_WGM1_WGMXCC1_WGMXCCGn1
    SolutionIndex: 126
    SolutionNameMin: Cijk_Alik_Bljk_HSS_BH_UserArgs_MT32x32x128_MI16x16x1_SN_LDSB1_CLR1_GSU0_GSUC0_GSUWGMRR0_K1_LBSPPA256_LBSPPB256_MIWT1_1_PLR1_SU32_SUM0_SUS256_SKXCCM6_VWA1_VWB1_WGM1_WGMXCC1_WGMXCCGn1
    SolutionIndex: 127
    SolutionNameMin: Cijk_Alik_Bljk_HSS_BH_UserArgs_MT32x32x128_MI16x16x1_SN_LDSB1_CLR1_GSU0_GSUC0_GSUWGMRR0_K1_LBSPPA256_LBSPPB256_MIWT1_1_PLR2_SU32_SUM0_SUS256_SKXCCM6_VWA1_VWB1_WGM1_WGMXCC1_WGMXCCGn1
    SolutionIndex: 128
    SolutionNameMin: Cijk_Alik_Bljk_HSS_BH_UserArgs_MT32x32x128_MI16x16x1_SN_LDSB1_CLR1_GSU0_GSUC0_GSUWGMRR0_K1_LBSPPA256_LBSPPB256_MIWT1_1_PLR2_SU32_SUM0_SUS256_SKXCCM6_VWA1_VWB1_WGM4_WGMXCC1_WGMXCCGn1
    SolutionIndex: 129
    SolutionNameMin: Cijk_Alik_Bljk_HSS_BH_UserArgs_MT32x32x32_MI16x16x1_SN_LDSB0_CLR1_GSU0_GSUC0_GSUWGMRR0_K1_LBSPPA128_LBSPPB128_MIWT1_1_PLR1_SU32_SUM0_SUS256_SKXCCM6_VWA1_VWB1_WGM8_WGMXCC1_WGMXCCGn1
- - - [128, 128, 1, 128, 128, 128, 128, 128]
    - [34, 0.087]
  - - [128, 128, 1, 256, 128, 128, 256, 256]
    - [35, 0.164]
  - - [128, 128, 1, 512, 128, 128, 512, 512]
    - [35, 0.287]
  - - [128, 128, 1, 1024, 128, 128, 1024, 1024]
    - [45, 0.461]
  - - [128, 128, 1, 2048, 128, 128, 2048, 2048]
    - [44, 0.68]
  - - [128, 128, 1, 4096, 128, 128, 4096, 4096]
    - [32, 1.191]
  - - [128, 128, 1, 8192, 128, 128, 8192, 8192]
    - [43, 1.901]
  - - [128, 256, 1, 128, 128, 128, 128, 128]
    - [32, 0.183]
  - - [128, 256, 1, 256, 128, 128, 256, 256]
    - [32, 0.338]
  - - [128, 256, 1, 512, 128, 128, 512, 512]
    - [32, 0.597]
  - - [128, 256, 1, 1024, 128, 128, 1024, 1024]
    - [126, 0.928]
  - - [128, 256, 1, 2048, 128, 128, 2048, 2048]
    - [44, 1.344]
  - - [128, 256, 1, 4096, 128, 128, 4096, 4096]
    - [104, 2.324]
  - - [128, 256, 1, 8192, 128, 128, 8192, 8192]
    - [43, 3.693]
  - - [128, 512, 1, 128, 128, 128, 128, 128]
    - [32, 0.359]
  - - [128, 512, 1, 256, 128, 128, 256, 256]
    - [32, 0.669]
  - - [128, 512, 1, 512, 128, 128, 512, 512]
    - [32, 1.183]
  - - [128, 512, 1, 1024, 128, 128, 1024, 1024]
    - [44, 1.844]
  - - [128, 512, 1, 2048, 128, 128, 2048, 2048]
    - [43, 2.607]
  - - [128, 512, 1, 4096, 128, 128, 4096, 4096]
    - [104, 3.929]
  - - [128, 512, 1, 8192, 128, 128, 8192, 8192]
    - [125, 5.978]
  - - [128, 1024, 1, 128, 128, 128, 128, 128]
    - [32, 0.698]
  - - [128, 1024, 1, 256, 128, 128, 256, 256]
    - [32, 1.316]
  - - [128, 1024, 1, 512, 128, 128, 512, 512]
    - [32, 2.246]
  - - [128, 1024, 1, 1024, 128, 128, 1024, 1024]
    - [43, 3.636]
  - - [128, 1024, 1, 2048, 128, 128, 2048, 2048]
    - [121, 4.302]
  - - [128, 1024, 1, 4096, 128, 128, 4096, 4096]
    - [127, 6.587]
  - - [128, 1024, 1, 8192, 128, 128, 8192, 8192]
    - [111, 9.309]
  - - [128, 2048, 1, 128, 128, 128, 128, 128]
    - [28, 1.293]
  - - [128, 2048, 1, 256, 128, 128, 256, 256]
    - [31, 2.297]
  - - [128, 2048, 1, 512, 128, 128, 512, 512]
    - [29, 3.871]
  - - [128, 2048, 1, 1024, 128, 128, 1024, 1024]
    - [42, 5.883]
  - - [128, 2048, 1, 2048, 128, 128, 2048, 2048]
    - [106, 7.121]
  - - [128, 2048, 1, 4096, 128, 128, 4096, 4096]
    - [109, 10.261]
  - - [128, 2048, 1, 8192, 128, 128, 8192, 8192]
    - [106, 13.04]
  - - [128, 4096, 1, 128, 128, 128, 128, 128]
    - [27, 2.193]
  - - [128, 4096, 1, 256, 128, 128, 256, 256]
    - [25, 3.851]
  - - [128, 4096, 1, 512, 128, 128, 512, 512]
    - [27, 6.378]
  - - [128, 4096, 1, 1024, 128, 128, 1024, 1024]
    - [36, 9.316]
  - - [128, 4096, 1, 2048, 128, 128, 2048, 2048]
    - [111, 11.144]
  - - [128, 4096, 1, 4096, 128, 128, 4096, 4096]
    - [24, 13.453]
  - - [128, 4096, 1, 8192, 128, 128, 8192, 8192]
    - [52, 15.749]
  - - [128, 8192, 1, 128, 128, 128, 128, 128]
    - [21, 3.33]
  - - [128, 8192, 1, 256, 128, 128, 256, 256]
    - [19, 5.839]
  - - [128, 8192, 1, 512, 128, 128, 512, 512]
    - [91, 9.276]
  - - [128, 8192, 1, 1024, 128, 128, 1024, 1024]
    - [110, 11.013]
  - - [128, 8192, 1, 2048, 128, 128, 2048, 2048]
    - [93, 13.599]
  - - [128, 8192, 1, 4096, 128, 128, 4096, 4096]
    - [100, 16.817]
  - - [128, 8192, 1, 8192, 128, 128, 8192, 8192]
    - [96, 19.292]
  - - [256, 128, 1, 128, 256, 256, 128, 128]
    - [104, 0.183]
  - - [256, 128, 1, 256, 256, 256, 256, 256]
    - [32, 0.338]
  - - [256, 128, 1, 512, 256, 256, 512, 512]
    - [32, 0.593]
  - - [256, 128, 1, 1024, 256, 256, 1024, 1024]
    - [43, 0.939]
  - - [256, 128, 1, 2048, 256, 256, 2048, 2048]
    - [44, 1.343]
  - - [256, 128, 1, 4096, 256, 256, 4096, 4096]
    - [104, 2.326]
  - - [256, 128, 1, 8192, 256, 256, 8192, 8192]
    - [44, 3.669]
  - - [256, 256, 1, 128, 256, 256, 128, 128]
    - [33, 0.353]
  - - [256, 256, 1, 256, 256, 256, 256, 256]
    - [32, 0.674]
  - - [256, 256, 1, 512, 256, 256, 512, 512]
    - [32, 1.151]
  - - [256, 256, 1, 1024, 256, 256, 1024, 1024]
    - [43, 1.851]
  - - [256, 256, 1, 2048, 256, 256, 2048, 2048]
    - [43, 2.598]
  - - [256, 256, 1, 4096, 256, 256, 4096, 4096]
    - [104, 3.942]
  - - [256, 256, 1, 8192, 256, 256, 8192, 8192]
    - [41, 5.914]
  - - [256, 512, 1, 128, 256, 256, 128, 128]
    - [32, 0.7]
  - - [256, 512, 1, 256, 256, 256, 256, 256]
    - [32, 1.315]
  - - [256, 512, 1, 512, 256, 256, 512, 512]
    - [104, 2.197]
  - - [256, 512, 1, 1024, 256, 256, 1024, 1024]
    - [43, 3.594]
  - - [256, 512, 1, 2048, 256, 256, 2048, 2048]
    - [125, 4.33]
  - - [256, 512, 1, 4096, 256, 256, 4096, 4096]
    - [127, 6.572]
  - - [256, 512, 1, 8192, 256, 256, 8192, 8192]
    - [36, 9.164]
  - - [256, 1024, 1, 128, 256, 256, 128, 128]
    - [28, 1.279]
  - - [256, 1024, 1, 256, 256, 256, 256, 256]
    - [29, 2.328]
  - - [256, 1024, 1, 512, 256, 256, 512, 512]
    - [29, 3.942]
  - - [256, 1024, 1, 1024, 256, 256, 1024, 1024]
    - [40, 5.898]
  - - [256, 1024, 1, 2048, 256, 256, 2048, 2048]
    - [107, 7.168]
  - - [256, 1024, 1, 4096, 256, 256, 4096, 4096]
    - [125, 10.308]
  - - [256, 1024, 1, 8192, 256, 256, 8192, 8192]
    - [96, 11.6]
  - - [256, 2048, 1, 128, 256, 256, 128, 128]
    - [27, 2.123]
  - - [256, 2048, 1, 256, 256, 256, 256, 256]
    - [27, 3.806]
  - - [256, 2048, 1, 512, 256, 256, 512, 512]
    - [102, 6.22]
  - - [256, 2048, 1, 1024, 256, 256, 1024, 1024]
    - [111, 9.255]
  - - [256, 2048, 1, 2048, 256, 256, 2048, 2048]
    - [111, 11.534]
  - - [256, 2048, 1, 4096, 256, 256, 4096, 4096]
    - [116, 13.405]
  - - [256, 2048, 1, 8192, 256, 256, 8192, 8192]
    - [57, 15.305]
  - - [256, 4096, 1, 128, 256, 256, 128, 128]
    - [19, 3.325]
  - - [256, 4096, 1, 256, 256, 256, 256, 256]
    - [18, 5.823]
  - - [256, 4096, 1, 512, 256, 256, 512, 512]
    - [84, 9.228]
  - - [256, 4096, 1, 1024, 256, 256, 1024, 1024]
    - [101, 11.451]
  - - [256, 4096, 1, 2048, 256, 256, 2048, 2048]
    - [109, 14.633]
  - - [256, 4096, 1, 4096, 256, 256, 4096, 4096]
    - [98, 16.679]
  - - [256, 4096, 1, 8192, 256, 256, 8192, 8192]
    - [4, 19.193]
  - - [256, 8192, 1, 128, 256, 256, 128, 128]
    - [0, 4.571]
  - - [256, 8192, 1, 256, 256, 256, 256, 256]
    - [55, 7.996]
  - - [256, 8192, 1, 512, 256, 256, 512, 512]
    - [10, 12.436]
  - - [256, 8192, 1, 1024, 256, 256, 1024, 1024]
    - [108, 13.442]
  - - [256, 8192, 1, 2048, 256, 256, 2048, 2048]
    - [95, 17.379]
  - - [256, 8192, 1, 4096, 256, 256, 4096, 4096]
    - [62, 20.322]
  - - [256, 8192, 1, 8192, 256, 256, 8192, 8192]
    - [10, 22.543]
  - - [512, 128, 1, 128, 512, 512, 128, 128]
    - [32, 0.358]
  - - [512, 128, 1, 256, 512, 512, 256, 256]
    - [32, 0.669]
  - - [512, 128, 1, 512, 512, 512, 512, 512]
    - [32, 1.184]
  - - [512, 128, 1, 1024, 512, 512, 1024, 1024]
    - [44, 1.859]
  - - [512, 128, 1, 2048, 512, 512, 2048, 2048]
    - [43, 2.593]
  - - [512, 128, 1, 4096, 512, 512, 4096, 4096]
    - [104, 3.921]
  - - [512, 128, 1, 8192, 512, 512, 8192, 8192]
    - [121, 5.867]
  - - [512, 256, 1, 128, 512, 512, 128, 128]
    - [33, 0.687]
  - - [512, 256, 1, 256, 512, 512, 256, 256]
    - [32, 1.294]
  - - [512, 256, 1, 512, 512, 512, 512, 512]
    - [32, 2.227]
  - - [512, 256, 1, 1024, 512, 512, 1024, 1024]
    - [43, 3.614]
  - - [512, 256, 1, 2048, 512, 512, 2048, 2048]
    - [125, 4.305]
  - - [512, 256, 1, 4096, 512, 512, 4096, 4096]
    - [128, 6.482]
  - - [512, 256, 1, 8192, 512, 512, 8192, 8192]
    - [112, 9.139]
  - - [512, 512, 1, 128, 512, 512, 128, 128]
    - [28, 1.287]
  - - [512, 512, 1, 256, 512, 512, 256, 256]
    - [29, 2.32]
  - - [512, 512, 1, 512, 512, 512, 512, 512]
    - [28, 3.919]
  - - [512, 512, 1, 1024, 512, 512, 1024, 1024]
    - [40, 5.882]
  - - [512, 512, 1, 2048, 512, 512, 2048, 2048]
    - [106, 7.108]
  - - [512, 512, 1, 4096, 512, 512, 4096, 4096]
    - [123, 10.164]
  - - [512, 512, 1, 8192, 512, 512, 8192, 8192]
    - [99, 11.467]
  - - [512, 1024, 1, 128, 512, 512, 128, 128]
    - [27, 2.162]
  - - [512, 1024, 1, 256, 512, 512, 256, 256]
    - [27, 3.909]
  - - [512, 1024, 1, 512, 512, 512, 512, 512]
    - [25, 6.349]
  - - [512, 1024, 1, 1024, 512, 512, 1024, 1024]
    - [37, 9.406]
  - - [512, 1024, 1, 2048, 512, 512, 2048, 2048]
    - [106, 11.336]
  - - [512, 1024, 1, 4096, 512, 512, 4096, 4096]
    - [117, 13.083]
  - - [512, 1024, 1, 8192, 512, 512, 8192, 8192]
    - [72, 15.369]
  - - [512, 2048, 1, 128, 512, 512, 128, 128]
    - [16, 3.334]
  - - [512, 2048, 1, 256, 512, 512, 256, 256]
    - [20, 5.798]
  - - [512, 2048, 1, 512, 512, 512, 512, 512]
    - [82, 9.251]
  - - [512, 2048, 1, 1024, 512, 512, 1024, 1024]
    - [101, 11.394]
  - - [512, 2048, 1, 2048, 512, 512, 2048, 2048]
    - [109, 15.172]
  - - [512, 2048, 1, 4096, 512, 512, 4096, 4096]
    - [80, 15.928]
  - - [512, 2048, 1, 8192, 512, 512, 8192, 8192]
    - [75, 17.083]
  - - [512, 4096, 1, 128, 512, 512, 128, 128]
    - [47, 4.598]
  - - [512, 4096, 1, 256, 512, 512, 256, 256]
    - [55, 8.076]
  - - [512, 4096, 1, 512, 512, 512, 512, 512]
    - [55, 12.619]
  - - [512, 4096, 1, 1024, 512, 512, 1024, 1024]
    - [106, 13.732]
  - - [512, 4096, 1, 2048, 512, 512, 2048, 2048]
    - [59, 16.72]
  - - [512, 4096, 1, 4096, 512, 512, 4096, 4096]
    - [3, 19.11]
  - - [512, 4096, 1, 8192, 512, 512, 8192, 8192]
    - [2, 20.896]
  - - [512, 8192, 1, 128, 512, 512, 128, 128]
    - [107, 4.498]
  - - [512, 8192, 1, 256, 512, 512, 256, 256]
    - [91, 7.64]
  - - [512, 8192, 1, 512, 512, 512, 512, 512]
    - [91, 12.266]
  - - [512, 8192, 1, 1024, 512, 512, 1024, 1024]
    - [96, 16.963]
  - - [512, 8192, 1, 2048, 512, 512, 2048, 2048]
    - [54, 19.986]
  - - [512, 8192, 1, 4096, 512, 512, 4096, 4096]
    - [9, 21.66]
  - - [512, 8192, 1, 8192, 512, 512, 8192, 8192]
    - [5, 21.952]
  - - [1024, 128, 1, 128, 1024, 1024, 128, 128]
    - [32, 0.692]
  - - [1024, 128, 1, 256, 1024, 1024, 256, 256]
    - [32, 1.314]
  - - [1024, 128, 1, 512, 1024, 1024, 512, 512]
    - [32, 2.263]
  - - [1024, 128, 1, 1024, 1024, 1024, 1024, 1024]
    - [43, 3.585]
  - - [1024, 128, 1, 2048, 1024, 1024, 2048, 2048]
    - [125, 4.3]
  - - [1024, 128, 1, 4096, 1024, 1024, 4096, 4096]
    - [122, 6.461]
  - - [1024, 128, 1, 8192, 1024, 1024, 8192, 8192]
    - [117, 9.245]
  - - [1024, 256, 1, 128, 1024, 1024, 128, 128]
    - [29, 1.288]
  - - [1024, 256, 1, 256, 1024, 1024, 256, 256]
    - [29, 2.37]
  - - [1024, 256, 1, 512, 1024, 1024, 512, 512]
    - [28, 3.896]
  - - [1024, 256, 1, 1024, 1024, 1024, 1024, 1024]
    - [39, 5.906]
  - - [1024, 256, 1, 2048, 1024, 1024, 2048, 2048]
    - [29, 7.252]
  - - [1024, 256, 1, 4096, 1024, 1024, 4096, 4096]
    - [123, 10.285]
  - - [1024, 256, 1, 8192, 1024, 1024, 8192, 8192]
    - [105, 11.591]
  - - [1024, 512, 1, 128, 1024, 1024, 128, 128]
    - [27, 2.205]
  - - [1024, 512, 1, 256, 1024, 1024, 256, 256]
    - [27, 3.858]
  - - [1024, 512, 1, 512, 1024, 1024, 512, 512]
    - [27, 6.347]
  - - [1024, 512, 1, 1024, 1024, 1024, 1024, 1024]
    - [38, 9.306]
  - - [1024, 512, 1, 2048, 1024, 1024, 2048, 2048]
    - [118, 11.279]
  - - [1024, 512, 1, 4096, 1024, 1024, 4096, 4096]
    - [115, 13.567]
  - - [1024, 512, 1, 8192, 1024, 1024, 8192, 8192]
    - [55, 15.142]
  - - [1024, 1024, 1, 128, 1024, 1024, 128, 128]
    - [19, 3.317]
  - - [1024, 1024, 1, 256, 1024, 1024, 256, 256]
    - [15, 5.91]
  - - [1024, 1024, 1, 512, 1024, 1024, 512, 512]
    - [84, 9.325]
  - - [1024, 1024, 1, 1024, 1024, 1024, 1024, 1024]
    - [120, 11.221]
  - - [1024, 1024, 1, 2048, 1024, 1024, 2048, 2048]
    - [117, 15.06]
  - - [1024, 1024, 1, 4096, 1024, 1024, 4096, 4096]
    - [58, 16.262]
  - - [1024, 1024, 1, 8192, 1024, 1024, 8192, 8192]
    - [78, 17.486]
  - - [1024, 2048, 1, 128, 1024, 1024, 128, 128]
    - [12, 4.637]
  - - [1024, 2048, 1, 256, 1024, 1024, 256, 256]
    - [55, 8.123]
  - - [1024, 2048, 1, 512, 1024, 1024, 512, 512]
    - [8, 12.48]
  - - [1024, 2048, 1, 1024, 1024, 1024, 1024, 1024]
    - [106, 13.682]
  - - [1024, 2048, 1, 2048, 1024, 1024, 2048, 2048]
    - [82, 16.505]
  - - [1024, 2048, 1, 4096, 1024, 1024, 4096, 4096]
    - [55, 17.68]
  - - [1024, 2048, 1, 8192, 1024, 1024, 8192, 8192]
    - [4, 18.472]
  - - [1024, 4096, 1, 128, 1024, 1024, 128, 128]
    - [107, 4.515]
  - - [1024, 4096, 1, 256, 1024, 1024, 256, 256]
    - [91, 7.558]
  - - [1024, 4096, 1, 512, 1024, 1024, 512, 512]
    - [94, 12.204]
  - - [1024, 4096, 1, 1024, 1024, 1024, 1024, 1024]
    - [56, 16.31]
  - - [1024, 4096, 1, 2048, 1024, 1024, 2048, 2048]
    - [81, 19.219]
  - - [1024, 4096, 1, 4096, 1024, 1024, 4096, 4096]
    - [12, 19.847]
  - - [1024, 4096, 1, 8192, 1024, 1024, 8192, 8192]
    - [1, 20.122]
  - - [1024, 8192, 1, 128, 1024, 1024, 128, 128]
    - [93, 5.711]
  - - [1024, 8192, 1, 256, 1024, 1024, 256, 256]
    - [91, 9.434]
  - - [1024, 8192, 1, 512, 1024, 1024, 512, 512]
    - [54, 14.376]
  - - [1024, 8192, 1, 1024, 1024, 1024, 1024, 1024]
    - [51, 19.573]
  - - [1024, 8192, 1, 2048, 1024, 1024, 2048, 2048]
    - [67, 20.61]
  - - [1024, 8192, 1, 4096, 1024, 1024, 4096, 4096]
    - [64, 23.137]
  - - [1024, 8192, 1, 8192, 1024, 1024, 8192, 8192]
    - [70, 23.749]
  - - [2048, 128, 1, 128, 2048, 2048, 128, 128]
    - [28, 1.304]
  - - [2048, 128, 1, 256, 2048, 2048, 256, 256]
    - [30, 2.332]
  - - [2048, 128, 1, 512, 2048, 2048, 512, 512]
    - [28, 3.949]
  - - [2048, 128, 1, 1024, 2048, 2048, 1024, 1024]
    - [41, 5.914]
  - - [2048, 128, 1, 2048, 2048, 2048, 2048, 2048]
    - [28, 7.32]
  - - [2048, 128, 1, 4096, 2048, 2048, 4096, 4096]
    - [124, 10.199]
  - - [2048, 128, 1, 8192, 2048, 2048, 8192, 8192]
    - [117, 13.071]
  - - [2048, 256, 1, 128, 2048, 2048, 128, 128]
    - [25, 2.194]
  - - [2048, 256, 1, 256, 2048, 2048, 256, 256]
    - [25, 3.912]
  - - [2048, 256, 1, 512, 2048, 2048, 512, 512]
    - [25, 6.476]
  - - [2048, 256, 1, 1024, 2048, 2048, 1024, 1024]
    - [106, 9.37]
  - - [2048, 256, 1, 2048, 2048, 2048, 2048, 2048]
    - [112, 11.276]
  - - [2048, 256, 1, 4096, 2048, 2048, 4096, 4096]
    - [116, 13.471]
  - - [2048, 256, 1, 8192, 2048, 2048, 8192, 8192]
    - [62, 15.591]
  - - [2048, 512, 1, 128, 2048, 2048, 128, 128]
    - [18, 3.362]
  - - [2048, 512, 1, 256, 2048, 2048, 256, 256]
    - [18, 5.892]
  - - [2048, 512, 1, 512, 2048, 2048, 512, 512]
    - [91, 9.327]
  - - [2048, 512, 1, 1024, 2048, 2048, 1024, 1024]
    - [115, 11.142]
  - - [2048, 512, 1, 2048, 2048, 2048, 2048, 2048]
    - [119, 14.778]
  - - [2048, 512, 1, 4096, 2048, 2048, 4096, 4096]
    - [58, 16.316]
  - - [2048, 512, 1, 8192, 2048, 2048, 8192, 8192]
    - [57, 17.197]
  - - [2048, 1024, 1, 128, 2048, 2048, 128, 128]
    - [46, 4.632]
  - - [2048, 1024, 1, 256, 2048, 2048, 256, 256]
    - [54, 7.779]
  - - [2048, 1024, 1, 512, 2048, 2048, 512, 512]
    - [7, 12.536]
  - - [2048, 1024, 1, 1024, 2048, 2048, 1024, 1024]
    - [85, 13.846]
  - - [2048, 1024, 1, 2048, 2048, 2048, 2048, 2048]
    - [88, 16.621]
  - - [2048, 1024, 1, 4096, 2048, 2048, 4096, 4096]
    - [55, 18.994]
  - - [2048, 1024, 1, 8192, 2048, 2048, 8192, 8192]
    - [54, 20.02]
  - - [2048, 2048, 1, 128, 2048, 2048, 128, 128]
    - [37, 4.624]
  - - [2048, 2048, 1, 256, 2048, 2048, 256, 256]
    - [93, 7.895]
  - - [2048, 2048, 1, 512, 2048, 2048, 512, 512]
    - [92, 11.943]
  - - [2048, 2048, 1, 1024, 2048, 2048, 1024, 1024]
    - [52, 16.412]
  - - [2048, 2048, 1, 2048, 2048, 2048, 2048, 2048]
    - [76, 19.806]
  - - [2048, 2048, 1, 4096, 2048, 2048, 4096, 4096]
    - [54, 21.425]
  - - [2048, 2048, 1, 8192, 2048, 2048, 8192, 8192]
    - [52, 20.614]
  - - [2048, 4096, 1, 128, 2048, 2048, 128, 128]
    - [91, 5.814]
  - - [2048, 4096, 1, 256, 2048, 2048, 256, 256]
    - [91, 10.022]
  - - [2048, 4096, 1, 512, 2048, 2048, 512, 512]
    - [62, 14.291]
  - - [2048, 4096, 1, 1024, 2048, 2048, 1024, 1024]
    - [52, 18.946]
  - - [2048, 4096, 1, 2048, 2048, 2048, 2048, 2048]
    - [54, 21.476]
  - - [2048, 4096, 1, 4096, 2048, 2048, 4096, 4096]
    - [55, 24.246]
  - - [2048, 4096, 1, 8192, 2048, 2048, 8192, 8192]
    - [52, 25.06]
  - - [2048, 8192, 1, 128, 2048, 2048, 128, 128]
    - [23, 6.928]
  - - [2048, 8192, 1, 256, 2048, 2048, 256, 256]
    - [64, 10.93]
  - - [2048, 8192, 1, 512, 2048, 2048, 512, 512]
    - [52, 16.441]
  - - [2048, 8192, 1, 1024, 2048, 2048, 1024, 1024]
    - [70, 20.059]
  - - [2048, 8192, 1, 2048, 2048, 2048, 2048, 2048]
    - [55, 22.553]
  - - [2048, 8192, 1, 4096, 2048, 2048, 4096, 4096]
    - [54, 26.597]
  - - [2048, 8192, 1, 8192, 2048, 2048, 8192, 8192]
    - [72, 27.632]
  - - [4096, 128, 1, 128, 4096, 4096, 128, 128]
    - [101, 2.196]
  - - [4096, 128, 1, 256, 4096, 4096, 256, 256]
    - [26, 3.868]
  - - [4096, 128, 1, 512, 4096, 4096, 512, 512]
    - [101, 6.333]
  - - [4096, 128, 1, 1024, 4096, 4096, 1024, 1024]
    - [106, 9.295]
  - - [4096, 128, 1, 2048, 4096, 4096, 2048, 2048]
    - [118, 10.854]
  - - [4096, 128, 1, 4096, 4096, 4096, 4096, 4096]
    - [118, 13.379]
  - - [4096, 128, 1, 8192, 4096, 4096, 8192, 8192]
    - [52, 15.619]
  - - [4096, 256, 1, 128, 4096, 4096, 128, 128]
    - [19, 3.341]
  - - [4096, 256, 1, 256, 4096, 4096, 256, 256]
    - [93, 5.793]
  - - [4096, 256, 1, 512, 4096, 4096, 512, 512]
    - [17, 9.248]
  - - [4096, 256, 1, 1024, 4096, 4096, 1024, 1024]
    - [103, 11.159]
  - - [4096, 256, 1, 2048, 4096, 4096, 2048, 2048]
    - [113, 14.505]
  - - [4096, 256, 1, 4096, 4096, 4096, 4096, 4096]
    - [69, 16.901]
  - - [4096, 256, 1, 8192, 4096, 4096, 8192, 8192]
    - [83, 18.832]
  - - [4096, 512, 1, 128, 4096, 4096, 128, 128]
    - [11, 4.567]
  - - [4096, 512, 1, 256, 4096, 4096, 256, 256]
    - [48, 7.812]
  - - [4096, 512, 1, 512, 4096, 4096, 512, 512]
    - [62, 12.148]
  - - [4096, 512, 1, 1024, 4096, 4096, 1024, 1024]
    - [90, 13.71]
  - - [4096, 512, 1, 2048, 4096, 4096, 2048, 2048]
    - [87, 17.018]
  - - [4096, 512, 1, 4096, 4096, 4096, 4096, 4096]
    - [49, 19.822]
  - - [4096, 512, 1, 8192, 4096, 4096, 8192, 8192]
    - [50, 20.963]
  - - [4096, 1024, 1, 128, 4096, 4096, 128, 128]
    - [91, 4.625]
  - - [4096, 1024, 1, 256, 4096, 4096, 256, 256]
    - [96, 7.6]
  - - [4096, 1024, 1, 512, 4096, 4096, 512, 512]
    - [99, 12.009]
  - - [4096, 1024, 1, 1024, 4096, 4096, 1024, 1024]
    - [68, 16.555]
  - - [4096, 1024, 1, 2048, 4096, 4096, 2048, 2048]
    - [70, 19.8]
  - - [4096, 1024, 1, 4096, 4096, 4096, 4096, 4096]
    - [52, 22.162]
  - - [4096, 1024, 1, 8192, 4096, 4096, 8192, 8192]
    - [51, 22.638]
  - - [4096, 2048, 1, 128, 4096, 4096, 128, 128]
    - [91, 5.743]
  - - [4096, 2048, 1, 256, 4096, 4096, 256, 256]
    - [97, 9.353]
  - - [4096, 2048, 1, 512, 4096, 4096, 512, 512]
    - [60, 14.296]
  - - [4096, 2048, 1, 1024, 4096, 4096, 1024, 1024]
    - [72, 19.513]
  - - [4096, 2048, 1, 2048, 4096, 4096, 2048, 2048]
    - [53, 21.569]
  - - [4096, 2048, 1, 4096, 4096, 4096, 4096, 4096]
    - [55, 23.813]
  - - [4096, 2048, 1, 8192, 4096, 4096, 8192, 8192]
    - [53, 24.942]
  - - [4096, 4096, 1, 128, 4096, 4096, 128, 128]
    - [22, 6.667]
  - - [4096, 4096, 1, 256, 4096, 4096, 256, 256]
    - [58, 10.82]
  - - [4096, 4096, 1, 512, 4096, 4096, 512, 512]
    - [72, 16.144]
  - - [4096, 4096, 1, 1024, 4096, 4096, 1024, 1024]
    - [72, 19.676]
  - - [4096, 4096, 1, 2048, 4096, 4096, 2048, 2048]
    - [55, 22.032]
  - - [4096, 4096, 1, 4096, 4096, 4096, 4096, 4096]
    - [55, 24.682]
  - - [4096, 4096, 1, 8192, 4096, 4096, 8192, 8192]
    - [60, 27.415]
  - - [4096, 8192, 1, 128, 4096, 4096, 128, 128]
    - [8, 6.984]
  - - [4096, 8192, 1, 256, 4096, 4096, 256, 256]
    - [54, 10.874]
  - - [4096, 8192, 1, 512, 4096, 4096, 512, 512]
    - [60, 15.469]
  - - [4096, 8192, 1, 1024, 4096, 4096, 1024, 1024]
    - [8, 18.516]
  - - [4096, 8192, 1, 2048, 4096, 4096, 2048, 2048]
    - [66, 22.104]
  - - [4096, 8192, 1, 4096, 4096, 4096, 4096, 4096]
    - [77, 26.68]
  - - [4096, 8192, 1, 8192, 4096, 4096, 8192, 8192]
    - [73, 28.711]
  - - [8192, 128, 1, 128, 8192, 8192, 128, 128]
    - [14, 3.331]
  - - [8192, 128, 1, 256, 8192, 8192, 256, 256]
    - [22, 5.799]
  - - [8192, 128, 1, 512, 8192, 8192, 512, 512]
    - [82, 9.292]
  - - [8192, 128, 1, 1024, 8192, 8192, 1024, 1024]
    - [103, 10.981]
  - - [8192, 128, 1, 2048, 8192, 8192, 2048, 2048]
    - [114, 13.433]
  - - [8192, 128, 1, 4096, 8192, 8192, 4096, 4096]
    - [89, 17.021]
  - - [8192, 128, 1, 8192, 8192, 8192, 8192, 8192]
    - [13, 19.396]
  - - [8192, 256, 1, 128, 8192, 8192, 128, 128]
    - [51, 4.582]
  - - [8192, 256, 1, 256, 8192, 8192, 256, 256]
    - [70, 7.885]
  - - [8192, 256, 1, 512, 8192, 8192, 512, 512]
    - [72, 12.175]
  - - [8192, 256, 1, 1024, 8192, 8192, 1024, 1024]
    - [86, 13.354]
  - - [8192, 256, 1, 2048, 8192, 8192, 2048, 2048]
    - [85, 17.019]
  - - [8192, 256, 1, 4096, 8192, 8192, 4096, 4096]
    - [52, 20.523]
  - - [8192, 256, 1, 8192, 8192, 8192, 8192, 8192]
    - [8, 22.865]
  - - [8192, 512, 1, 128, 8192, 8192, 128, 128]
    - [117, 4.457]
  - - [8192, 512, 1, 256, 8192, 8192, 256, 256]
    - [97, 7.617]
  - - [8192, 512, 1, 512, 8192, 8192, 512, 512]
    - [99, 11.981]
  - - [8192, 512, 1, 1024, 8192, 8192, 1024, 1024]
    - [64, 16.531]
  - - [8192, 512, 1, 2048, 8192, 8192, 2048, 2048]
    - [65, 20.439]
  - - [8192, 512, 1, 4096, 8192, 8192, 4096, 4096]
    - [52, 22.465]
  - - [8192, 512, 1, 8192, 8192, 8192, 8192, 8192]
    - [50, 22.748]
  - - [8192, 1024, 1, 128, 8192, 8192, 128, 128]
    - [97, 5.541]
  - - [8192, 1024, 1, 256, 8192, 8192, 256, 256]
    - [97, 9.302]
  - - [8192, 1024, 1, 512, 8192, 8192, 512, 512]
    - [72, 14.203]
  - - [8192, 1024, 1, 1024, 8192, 8192, 1024, 1024]
    - [72, 19.452]
  - - [8192, 1024, 1, 2048, 8192, 8192, 2048, 2048]
    - [10, 20.66]
  - - [8192, 1024, 1, 4096, 8192, 8192, 4096, 4096]
    - [54, 23.092]
  - - [8192, 1024, 1, 8192, 8192, 8192, 8192, 8192]
    - [55, 24.859]
  - - [8192, 2048, 1, 128, 8192, 8192, 128, 128]
    - [19, 6.585]
  - - [8192, 2048, 1, 256, 8192, 8192, 256, 256]
    - [75, 10.516]
  - - [8192, 2048, 1, 512, 8192, 8192, 512, 512]
    - [62, 16.109]
  - - [8192, 2048, 1, 1024, 8192, 8192, 1024, 1024]
    - [75, 20.478]
  - - [8192, 2048, 1, 2048, 8192, 8192, 2048, 2048]
    - [10, 21.153]
  - - [8192, 2048, 1, 4096, 8192, 8192, 4096, 4096]
    - [65, 25.701]
  - - [8192, 2048, 1, 8192, 8192, 8192, 8192, 8192]
    - [65, 26.654]
  - - [8192, 4096, 1, 128, 8192, 8192, 128, 128]
    - [6, 7.138]
  - - [8192, 4096, 1, 256, 8192, 8192, 256, 256]
    - [52, 10.482]
  - - [8192, 4096, 1, 512, 8192, 8192, 512, 512]
    - [5, 15.761]
  - - [8192, 4096, 1, 1024, 8192, 8192, 1024, 1024]
    - [72, 18.231]
  - - [8192, 4096, 1, 2048, 8192, 8192, 2048, 2048]
    - [71, 21.821]
  - - [8192, 4096, 1, 4096, 8192, 8192, 4096, 4096]
    - [74, 27.286]
  - - [8192, 4096, 1, 8192, 8192, 8192, 8192, 8192]
    - [63, 30.358]
  - - [8192, 8192, 1, 128, 8192, 8192, 128, 128]
    - [5, 5.742]
  - - [8192, 8192, 1, 256, 8192, 8192, 256, 256]
    - [75, 9.348]
  - - [8192, 8192, 1, 512, 8192, 8192, 512, 512]
    - [61, 14.841]
  - - [8192, 8192, 1, 1024, 8192, 8192, 1024, 1024]
    - [70, 18.553]
  - - [8192, 8192, 1, 2048, 8192, 8192, 2048, 2048]
    - [79, 22.517]
  - - [8192, 8192, 1, 4096, 8192, 8192, 4096, 4096]
    - [74, 28.751]
  - - [8192, 8192, 1, 8192, 8192, 8192, 8192, 8192]
    - [72, 29.216]
  - - [1, 1, 1, 32, 1, 1, 32, 32]
    - [129, 0.0]
- null
- null
- ExperimentalStreamK
- GridBased
