library/src/amd_detail/rocblaslt/src/Tensile/Logic/asm_full/aquavanjaram/gfx942_228cu/StreamK/aquavanjaram942_Cijk_Alik_Bjlk_HHS_BH_UserArgs.yaml
- {MinimumRequiredVersion: 4.33.0}
- aquavanjaram942
- {Architecture: gfx942, CUCount: 228}
- [Device 0049, Device 0050]
    SolutionIndex: 0
    SolutionNameMin: Cijk_Alik_Bjlk_HHS_BH_UserArgs_MT256x256x32_MI16x16x1_SN_LDSB1_CLR1_GSU0_GSUC0_GSUWGMRR0_K1_LBSPPA256_LBSPPB2048_LPB0_MIWT8_8_PLR1_SU32_SUM0_SUS256_SKXCCM0_VWA4_VWB8_WGM1_WGMXCC1_WGMXCCGn1
    SolutionIndex: 1
    SolutionNameMin: Cijk_Alik_Bjlk_HHS_BH_UserArgs_MT256x128x32_MI16x16x1_SN_LDSB1_CLR1_GSU0_GSUC0_GSUWGMRR0_K1_LBSPPA512_LBSPPB1024_LPB0_MIWT8_4_PLR1_SU32_SUM0_SUS256_SKXCCM0_VWA8_VWB4_WGM4_WGMXCC1_WGMXCCGn1
    SolutionIndex: 2
    SolutionNameMin: Cijk_Alik_Bjlk_HHS_BH_UserArgs_MT64x128x32_MI16x16x1_SN_LDSB0_CLR1_GSU0_GSUC0_GSUWGMRR0_K1_LBSPPA128_LBSPPB1024_LPB0_MIWT2_4_PLR1_SU32_SUM0_SUS256_SKXCCM0_VWA2_VWB4_WGM1_WGMXCC1_WGMXCCGn1
    SolutionIndex: 3
    SolutionNameMin: Cijk_Alik_Bjlk_HHS_BH_UserArgs_MT128x64x32_MI16x16x1_SN_LDSB0_CLR1_GSU0_GSUC0_GSUWGMRR0_K1_LBSPPA128_LBSPPB512_LPB16_MIWT4_2_PLR1_SU32_SUM0_SUS256_SKXCCM0_VWA2_VWB1_WGM1_WGMXCC1_WGMXCCGn1
    SolutionIndex: 4
    SolutionNameMin: Cijk_Alik_Bjlk_HHS_BH_UserArgs_MT64x64x32_MI16x16x1_SN_LDSB0_CLR1_GSU0_GSUC0_GSUWGMRR0_K1_LBSPPA128_LBSPPB512_LPB32_MIWT2_2_PLR1_SU32_SUM0_SUS256_SKXCCM0_VWA2_VWB2_WGM1_WGMXCC1_WGMXCCGn1
    SolutionIndex: 5
    SolutionNameMin: Cijk_Alik_Bjlk_HHS_BH_UserArgs_MT128x256x64_MI16x16x1_SN_LDSB1_CLR1_GSU0_GSUC0_GSUWGMRR0_K1_LBSPPA512_LBSPPB4096_LPB32_MIWT4_8_PLR1_SU32_SUM0_SUS256_SKXCCM0_VWA4_VWB2_WGM1_WGMXCC1_WGMXCCGn1
    SolutionIndex: 6
    SolutionNameMin: Cijk_Alik_Bjlk_HHS_BH_UserArgs_MT128x256x64_MI16x16x1_SN_LDSB1_CLR1_GSU0_GSUC0_GSUWGMRR0_K1_LBSPPA256_LBSPPB4096_LPB0_MIWT4_8_PLR1_SU32_SUM0_SUS256_SKXCCM0_VWA2_VWB4_WGM1_WGMXCC1_WGMXCCGn1
    SolutionIndex: 7
    SolutionNameMin: Cijk_Alik_Bjlk_HHS_BH_UserArgs_MT128x256x64_MI16x16x1_SN_LDSB1_CLR1_GSU0_GSUC0_GSUWGMRR0_K1_LBSPPA512_LBSPPB4096_LPB0_MIWT4_8_PLR1_SU32_SUM0_SUS256_SKXCCM0_VWA4_VWB4_WGM1_WGMXCC1_WGMXCCGn1
    SolutionIndex: 8
    SolutionNameMin: Cijk_Alik_Bjlk_HHS_BH_UserArgs_MT128x256x64_MI16x16x1_SN_LDSB1_CLR1_GSU0_GSUC0_GSUWGMRR0_K1_LBSPPA256_LBSPPB4096_LPB0_MIWT4_8_PLR1_SU32_SUM0_SUS256_SKXCCM0_VWA2_VWB8_WGM1_WGMXCC1_WGMXCCGn1
    SolutionIndex: 9
    SolutionNameMin: Cijk_Alik_Bjlk_HHS_BH_UserArgs_MT128x256x64_MI16x16x1_SN_LDSB1_CLR1_GSU0_GSUC0_GSUWGMRR0_K1_LBSPPA512_LBSPPB4096_LPB0_MIWT4_8_PLR1_SU32_SUM0_SUS256_SKXCCM0_VWA4_VWB8_WGM1_WGMXCC1_WGMXCCGn1
    SolutionIndex: 10
    SolutionNameMin: Cijk_Alik_Bjlk_HHS_BH_UserArgs_MT128x256x64_MI16x16x1_SN_LDSB1_CLR1_GSU0_GSUC0_GSUWGMRR0_K1_LBSPPA256_LBSPPB4096_LPB0_MIWT4_8_PLR1_SU32_SUM0_SUS256_SKXCCM0_VWA2_VWB4_WGM4_WGMXCC1_WGMXCCGn1
    SolutionIndex: 11
    SolutionNameMin: Cijk_Alik_Bjlk_HHS_BH_UserArgs_MT128x256x64_MI16x16x1_SN_LDSB1_CLR1_GSU0_GSUC0_GSUWGMRR0_K1_LBSPPA512_LBSPPB4096_LPB0_MIWT4_8_PLR1_SU32_SUM0_SUS256_SKXCCM0_VWA4_VWB4_WGM8_WGMXCC1_WGMXCCGn1
    SolutionIndex: 12
    SolutionNameMin: Cijk_Alik_Bjlk_HHS_BH_UserArgs_MT256x128x64_MI16x16x1_SN_LDSB1_CLR1_GSU0_GSUC0_GSUWGMRR0_K1_LBSPPA256_LBSPPB2048_LPB32_MIWT8_4_PLR1_SU32_SUM0_SUS256_SKXCCM0_VWA2_VWB2_WGM1_WGMXCC1_WGMXCCGn1
    SolutionIndex: 13
    SolutionNameMin: Cijk_Alik_Bjlk_HHS_BH_UserArgs_MT256x128x64_MI16x16x1_SN_LDSB1_CLR1_GSU0_GSUC0_GSUWGMRR0_K1_LBSPPA512_LBSPPB2048_LPB0_MIWT8_4_PLR1_SU32_SUM0_SUS256_SKXCCM0_VWA4_VWB4_WGM1_WGMXCC1_WGMXCCGn1
    SolutionIndex: 14
    SolutionNameMin: Cijk_Alik_Bjlk_HHS_BH_UserArgs_MT256x128x64_MI16x16x1_SN_LDSB1_CLR1_GSU0_GSUC0_GSUWGMRR0_K1_LBSPPA1024_LBSPPB2048_LPB0_MIWT8_4_PLR1_SU32_SUM0_SUS256_SKXCCM0_VWA8_VWB4_WGM1_WGMXCC1_WGMXCCGn1
    SolutionIndex: 15
    SolutionNameMin: Cijk_Alik_Bjlk_HHS_BH_UserArgs_MT256x128x64_MI16x16x1_SN_LDSB1_CLR1_GSU0_GSUC0_GSUWGMRR0_K1_LBSPPA512_LBSPPB2048_LPB0_MIWT8_4_PLR1_SU32_SUM0_SUS256_SKXCCM0_VWA4_VWB4_WGM4_WGMXCC1_WGMXCCGn1
    SolutionIndex: 16
    SolutionNameMin: Cijk_Alik_Bjlk_HHS_BH_UserArgs_MT256x128x64_MI16x16x1_SN_LDSB1_CLR1_GSU0_GSUC0_GSUWGMRR0_K1_LBSPPA256_LBSPPB2048_LPB32_MIWT8_4_PLR1_SU32_SUM0_SUS256_SKXCCM0_VWA2_VWB2_WGM8_WGMXCC1_WGMXCCGn1
    SolutionIndex: 17
    SolutionNameMin: Cijk_Alik_Bjlk_HHS_BH_UserArgs_MT256x128x64_MI16x16x1_SN_LDSB1_CLR1_GSU0_GSUC0_GSUWGMRR0_K1_LBSPPA512_LBSPPB2048_LPB32_MIWT8_4_PLR1_SU32_SUM0_SUS256_SKXCCM0_VWA4_VWB2_WGM8_WGMXCC1_WGMXCCGn1
    SolutionIndex: 18
    SolutionNameMin: Cijk_Alik_Bjlk_HHS_BH_UserArgs_MT256x128x64_MI16x16x1_SN_LDSB1_CLR1_GSU0_GSUC0_GSUWGMRR0_K1_LBSPPA512_LBSPPB2048_LPB0_MIWT8_4_PLR1_SU32_SUM0_SUS256_SKXCCM0_VWA4_VWB4_WGM8_WGMXCC1_WGMXCCGn1
    SolutionIndex: 19
    SolutionNameMin: Cijk_Alik_Bjlk_HHS_BH_UserArgs_MT256x64x64_MI16x16x1_SN_LDSB1_CLR1_GSU0_GSUC0_GSUWGMRR0_K1_LBSPPA512_LBSPPB1024_LPB16_MIWT8_2_PLR1_SU32_SUM0_SUS256_SKXCCM0_VWA4_VWB1_WGM1_WGMXCC1_WGMXCCGn1
    SolutionIndex: 20
    SolutionNameMin: Cijk_Alik_Bjlk_HHS_BH_UserArgs_MT256x64x64_MI16x16x1_SN_LDSB1_CLR1_GSU0_GSUC0_GSUWGMRR0_K1_LBSPPA512_LBSPPB1024_LPB32_MIWT8_2_PLR1_SU32_SUM0_SUS256_SKXCCM0_VWA4_VWB2_WGM1_WGMXCC1_WGMXCCGn1
    SolutionIndex: 21
    SolutionNameMin: Cijk_Alik_Bjlk_HHS_BH_UserArgs_MT128x128x64_MI16x16x1_SN_LDSB1_CLR1_GSU0_GSUC0_GSUWGMRR0_K1_LBSPPA512_LBSPPB2048_LPB32_MIWT4_4_PLR1_SU32_SUM0_SUS256_SKXCCM0_VWA4_VWB2_WGM1_WGMXCC1_WGMXCCGn1
    SolutionIndex: 22
    SolutionNameMin: Cijk_Alik_Bjlk_HHS_BH_UserArgs_MT128x128x64_MI16x16x1_SN_LDSB1_CLR1_GSU0_GSUC0_GSUWGMRR0_K1_LBSPPA256_LBSPPB2048_LPB0_MIWT4_4_PLR1_SU32_SUM0_SUS256_SKXCCM0_VWA2_VWB4_WGM1_WGMXCC1_WGMXCCGn1
    SolutionIndex: 23
    SolutionNameMin: Cijk_Alik_Bjlk_HHS_BH_UserArgs_MT128x128x64_MI16x16x1_SN_LDSB1_CLR1_GSU0_GSUC0_GSUWGMRR0_K1_LBSPPA512_LBSPPB2048_LPB0_MIWT4_4_PLR1_SU32_SUM0_SUS256_SKXCCM0_VWA4_VWB4_WGM1_WGMXCC1_WGMXCCGn1
    SolutionIndex: 24
    SolutionNameMin: Cijk_Alik_Bjlk_HHS_BH_UserArgs_MT128x128x64_MI16x16x1_SN_LDSB1_CLR1_GSU0_GSUC0_GSUWGMRR0_K1_LBSPPA512_LBSPPB2048_LPB0_MIWT4_4_PLR2_SU32_SUM0_SUS256_SKXCCM0_VWA4_VWB4_WGM1_WGMXCC1_WGMXCCGn1
    SolutionIndex: 25
    SolutionNameMin: Cijk_Alik_Bjlk_HHS_BH_UserArgs_MT128x128x64_MI16x16x1_SN_LDSB1_CLR1_GSU0_GSUC0_GSUWGMRR0_K1_LBSPPA512_LBSPPB2048_LPB0_MIWT4_4_PLR1_SU32_SUM0_SUS256_SKXCCM0_VWA4_VWB4_WGM8_WGMXCC1_WGMXCCGn1
    SolutionIndex: 26
    SolutionNameMin: Cijk_Alik_Bjlk_HHS_BH_UserArgs_MT64x128x64_MI16x16x1_SN_LDSB1_CLR1_GSU0_GSUC0_GSUWGMRR0_K1_LBSPPA256_LBSPPB2048_LPB0_MIWT2_4_PLR1_SU32_SUM0_SUS256_SKXCCM0_VWA2_VWB4_WGM1_WGMXCC1_WGMXCCGn1
    SolutionIndex: 27
    SolutionNameMin: Cijk_Alik_Bjlk_HHS_BH_UserArgs_MT64x128x64_MI16x16x1_SN_LDSB1_CLR1_GSU0_GSUC0_GSUWGMRR0_K1_LBSPPA256_LBSPPB2048_LPB0_MIWT2_4_PLR1_SU32_SUM0_SUS256_SKXCCM0_VWA2_VWB4_WGM8_WGMXCC1_WGMXCCGn1
    SolutionIndex: 28
    SolutionNameMin: Cijk_Alik_Bjlk_HHS_BH_UserArgs_MT128x64x64_MI16x16x1_SN_LDSB1_CLR1_GSU0_GSUC0_GSUWGMRR0_K1_LBSPPA256_LBSPPB1024_LPB32_MIWT4_2_PLR1_SU32_SUM0_SUS256_SKXCCM0_VWA2_VWB2_WGM1_WGMXCC1_WGMXCCGn1
    SolutionIndex: 29
    SolutionNameMin: Cijk_Alik_Bjlk_HHS_BH_UserArgs_MT128x64x64_MI16x16x1_SN_LDSB1_CLR1_GSU0_GSUC0_GSUWGMRR0_K1_LBSPPA512_LBSPPB1024_LPB32_MIWT4_2_PLR2_SU32_SUM0_SUS256_SKXCCM0_VWA4_VWB2_WGM1_WGMXCC1_WGMXCCGn1
    SolutionIndex: 30
    SolutionNameMin: Cijk_Alik_Bjlk_HHS_BH_UserArgs_MT128x64x64_MI16x16x1_SN_LDSB1_CLR1_GSU0_GSUC0_GSUWGMRR0_K1_LBSPPA512_LBSPPB1024_LPB32_MIWT4_2_PLR1_SU32_SUM0_SUS256_SKXCCM0_VWA4_VWB2_WGM4_WGMXCC1_WGMXCCGn1
    SolutionIndex: 31
    SolutionNameMin: Cijk_Alik_Bjlk_HHS_BH_UserArgs_MT128x64x64_MI16x16x1_SN_LDSB1_CLR1_GSU0_GSUC0_GSUWGMRR0_K1_LBSPPA512_LBSPPB1024_LPB32_MIWT4_2_PLR1_SU32_SUM0_SUS256_SKXCCM0_VWA4_VWB2_WGM8_WGMXCC1_WGMXCCGn1
    SolutionIndex: 32
    SolutionNameMin: Cijk_Alik_Bjlk_HHS_BH_UserArgs_MT64x64x64_MI16x16x1_SN_LDSB1_CLR1_GSU0_GSUC0_GSUWGMRR0_K1_LBSPPA256_LBSPPB1024_LPB32_MIWT2_2_PLR1_SU32_SUM0_SUS256_SKXCCM0_VWA2_VWB2_WGM1_WGMXCC1_WGMXCCGn1
    SolutionIndex: 33
    SolutionNameMin: Cijk_Alik_Bjlk_HHS_BH_UserArgs_MT32x64x64_MI16x16x1_SN_LDSB0_CLR1_GSU0_GSUC0_GSUWGMRR0_K1_LBSPPA128_LBSPPB1024_LPB32_MIWT1_2_PLR1_SU32_SUM0_SUS256_SKXCCM0_VWA1_VWB2_WGM1_WGMXCC1_WGMXCCGn1
    SolutionIndex: 34
    SolutionNameMin: Cijk_Alik_Bjlk_HHS_BH_UserArgs_MT64x32x64_MI16x16x1_SN_LDSB0_CLR1_GSU0_GSUC0_GSUWGMRR0_K1_LBSPPA256_LBSPPB512_LPB16_MIWT2_1_PLR1_SU32_SUM0_SUS256_SKXCCM0_VWA2_VWB1_WGM1_WGMXCC1_WGMXCCGn1
    SolutionIndex: 35
    SolutionNameMin: Cijk_Alik_Bjlk_HHS_BH_UserArgs_MT32x32x64_MI16x16x1_SN_LDSB0_CLR1_GSU0_GSUC0_GSUWGMRR0_K1_LBSPPA128_LBSPPB512_LPB16_MIWT1_1_PLR1_SU32_SUM0_SUS256_SKXCCM0_VWA1_VWB1_WGM1_WGMXCC1_WGMXCCGn1
    SolutionIndex: 36
    SolutionNameMin: Cijk_Alik_Bjlk_HHS_BH_UserArgs_MT32x32x64_MI16x16x1_SN_LDSB0_CLR1_GSU0_GSUC0_GSUWGMRR0_K1_LBSPPA128_LBSPPB512_LPB16_MIWT1_1_PLR1_SU32_SUM0_SUS256_SKXCCM0_VWA1_VWB1_WGM4_WGMXCC1_WGMXCCGn1
    SolutionIndex: 37
    SolutionNameMin: Cijk_Alik_Bjlk_HHS_BH_UserArgs_MT64x128x128_MI16x16x1_SN_LDSB1_CLR1_GSU0_GSUC0_GSUWGMRR0_K1_LBSPPA512_LBSPPB2048_LPB0_MIWT2_4_PLR2_SU32_SUM0_SUS256_SKXCCM0_VWA2_VWB4_WGM1_WGMXCC1_WGMXCCGn1
    SolutionIndex: 38
    SolutionNameMin: Cijk_Alik_Bjlk_HHS_BH_UserArgs_MT128x64x128_MI16x16x1_SN_LDSB1_CLR1_GSU0_GSUC0_GSUWGMRR0_K1_LBSPPA256_LBSPPB1024_LPB32_MIWT4_2_PLR2_SU32_SUM0_SUS256_SKXCCM0_VWA1_VWB2_WGM1_WGMXCC1_WGMXCCGn1
    SolutionIndex: 39
    SolutionNameMin: Cijk_Alik_Bjlk_HHS_BH_UserArgs_MT128x64x128_MI16x16x1_SN_LDSB1_CLR1_GSU0_GSUC0_GSUWGMRR0_K1_LBSPPA512_LBSPPB1024_LPB32_MIWT4_2_PLR2_SU32_SUM0_SUS256_SKXCCM0_VWA2_VWB2_WGM1_WGMXCC1_WGMXCCGn1
    SolutionIndex: 40
    SolutionNameMin: Cijk_Alik_Bjlk_HHS_BH_UserArgs_MT128x64x128_MI16x16x1_SN_LDSB1_CLR1_GSU0_GSUC0_GSUWGMRR0_K1_LBSPPA1024_LBSPPB1024_LPB32_MIWT4_2_PLR2_SU32_SUM0_SUS256_SKXCCM0_VWA4_VWB2_WGM1_WGMXCC1_WGMXCCGn1
    SolutionIndex: 41
    SolutionNameMin: Cijk_Alik_Bjlk_HHS_BH_UserArgs_MT128x64x128_MI16x16x1_SN_LDSB1_CLR1_GSU0_GSUC0_GSUWGMRR0_K1_LBSPPA512_LBSPPB1024_LPB32_MIWT4_2_PLR2_SU32_SUM0_SUS256_SKXCCM0_VWA2_VWB2_WGM4_WGMXCC1_WGMXCCGn1
    SolutionIndex: 42
    SolutionNameMin: Cijk_Alik_Bjlk_HHS_BH_UserArgs_MT128x64x128_MI16x16x1_SN_LDSB1_CLR1_GSU0_GSUC0_GSUWGMRR0_K1_LBSPPA1024_LBSPPB1024_LPB32_MIWT4_2_PLR2_SU32_SUM0_SUS256_SKXCCM0_VWA4_VWB2_WGM8_WGMXCC1_WGMXCCGn1
    SolutionIndex: 43
    SolutionNameMin: Cijk_Alik_Bjlk_HHS_BH_UserArgs_MT64x64x128_MI16x16x1_SN_LDSB1_CLR1_GSU0_GSUC0_GSUWGMRR0_K1_LBSPPA512_LBSPPB1024_LPB32_MIWT2_2_PLR2_SU32_SUM0_SUS256_SKXCCM0_VWA2_VWB2_WGM1_WGMXCC1_WGMXCCGn1
    SolutionIndex: 44
    SolutionNameMin: Cijk_Alik_Bjlk_HHS_BH_UserArgs_MT64x64x128_MI16x16x1_SN_LDSB1_CLR1_GSU0_GSUC0_GSUWGMRR0_K1_LBSPPA256_LBSPPB1024_LPB32_MIWT2_2_PLR2_SU32_SUM0_SUS256_SKXCCM0_VWA1_VWB2_WGM4_WGMXCC1_WGMXCCGn1
    SolutionIndex: 45
    SolutionNameMin: Cijk_Alik_Bjlk_HHS_BH_UserArgs_MT64x64x128_MI16x16x1_SN_LDSB1_CLR1_GSU0_GSUC0_GSUWGMRR0_K1_LBSPPA512_LBSPPB1024_LPB32_MIWT2_2_PLR2_SU32_SUM0_SUS256_SKXCCM0_VWA2_VWB2_WGM4_WGMXCC1_WGMXCCGn1
    SolutionIndex: 46
    SolutionNameMin: Cijk_Alik_Bjlk_HHS_BH_UserArgs_MT64x64x128_MI16x16x1_SN_LDSB1_CLR1_GSU0_GSUC0_GSUWGMRR0_K1_LBSPPA512_LBSPPB1024_LPB32_MIWT2_2_PLR2_SU32_SUM0_SUS256_SKXCCM0_VWA2_VWB2_WGM8_WGMXCC1_WGMXCCGn1
    SolutionIndex: 47
    SolutionNameMin: Cijk_Alik_Bjlk_HHS_BH_UserArgs_MT32x64x128_MI16x16x1_SN_LDSB1_CLR1_GSU0_GSUC0_GSUWGMRR0_K1_LBSPPA256_LBSPPB1024_LPB32_MIWT1_2_PLR2_SU32_SUM0_SUS256_SKXCCM0_VWA1_VWB2_WGM1_WGMXCC1_WGMXCCGn1
    SolutionIndex: 48
    SolutionNameMin: Cijk_Alik_Bjlk_HHS_BH_UserArgs_MT32x64x128_MI16x16x1_SN_LDSB1_CLR1_GSU0_GSUC0_GSUWGMRR0_K1_LBSPPA256_LBSPPB1024_LPB32_MIWT1_2_PLR2_SU32_SUM0_SUS256_SKXCCM0_VWA1_VWB2_WGM4_WGMXCC1_WGMXCCGn1
    SolutionIndex: 49
    SolutionNameMin: Cijk_Alik_Bjlk_HHS_BH_UserArgs_MT32x32x128_MI16x16x1_SN_LDSB1_CLR1_GSU0_GSUC0_GSUWGMRR0_K1_LBSPPA256_LBSPPB512_LPB16_MIWT1_1_PLR1_SU32_SUM0_SUS256_SKXCCM0_VWA1_VWB1_WGM1_WGMXCC1_WGMXCCGn1
    SolutionIndex: 50
    SolutionNameMin: Cijk_Alik_Bjlk_HHS_BH_UserArgs_MT32x32x128_MI16x16x1_SN_LDSB1_CLR1_GSU0_GSUC0_GSUWGMRR0_K1_LBSPPA256_LBSPPB512_LPB16_MIWT1_1_PLR2_SU32_SUM0_SUS256_SKXCCM0_VWA1_VWB1_WGM1_WGMXCC1_WGMXCCGn1
    SolutionIndex: 51
    SolutionNameMin: Cijk_Alik_Bjlk_HHS_BH_UserArgs_MT32x32x128_MI16x16x1_SN_LDSB1_CLR1_GSU0_GSUC0_GSUWGMRR0_K1_LBSPPA256_LBSPPB512_LPB16_MIWT1_1_PLR2_SU32_SUM0_SUS256_SKXCCM0_VWA1_VWB1_WGM4_WGMXCC1_WGMXCCGn1
    SolutionIndex: 52
    SolutionNameMin: Cijk_Alik_Bjlk_HHS_BH_UserArgs_MT256x256x32_MI16x16x1_SN_LDSB1_CLR1_GSU0_GSUC0_GSUWGMRR0_K1_LBSPPA128_LBSPPB2048_LPB0_MIWT8_8_PLR1_SU32_SUM0_SUS256_SKXCCM6_VWA1_VWB8_WGM1_WGMXCC1_WGMXCCGn1
    SolutionIndex: 53
    SolutionNameMin: Cijk_Alik_Bjlk_HHS_BH_UserArgs_MT256x256x32_MI16x16x1_SN_LDSB1_CLR1_GSU0_GSUC0_GSUWGMRR0_K1_LBSPPA256_LBSPPB2048_LPB0_MIWT8_8_PLR1_SU32_SUM0_SUS256_SKXCCM6_VWA4_VWB8_WGM1_WGMXCC1_WGMXCCGn1
    SolutionIndex: 54
    SolutionNameMin: Cijk_Alik_Bjlk_HHS_BH_UserArgs_MT256x256x32_MI16x16x1_SN_LDSB1_CLR1_GSU0_GSUC0_GSUWGMRR0_K1_LBSPPA512_LBSPPB2048_LPB0_MIWT8_8_PLR1_SU32_SUM0_SUS256_SKXCCM6_VWA8_VWB8_WGM1_WGMXCC1_WGMXCCGn1
    SolutionIndex: 55
    SolutionNameMin: Cijk_Alik_Bjlk_HHS_BH_UserArgs_MT256x256x32_MI16x16x1_SN_LDSB1_CLR1_GSU0_GSUC0_GSUWGMRR0_K1_LBSPPA512_LBSPPB2048_LPB32_MIWT8_8_PLR1_SU32_SUM0_SUS256_SKXCCM6_VWA8_VWB2_WGM4_WGMXCC1_WGMXCCGn1
    SolutionIndex: 56
    SolutionNameMin: Cijk_Alik_Bjlk_HHS_BH_UserArgs_MT256x256x32_MI16x16x1_SN_LDSB1_CLR1_GSU0_GSUC0_GSUWGMRR0_K1_LBSPPA512_LBSPPB2048_LPB0_MIWT8_8_PLR1_SU32_SUM0_SUS256_SKXCCM6_VWA8_VWB4_WGM4_WGMXCC1_WGMXCCGn1
    SolutionIndex: 57
    SolutionNameMin: Cijk_Alik_Bjlk_HHS_BH_UserArgs_MT256x256x32_MI16x16x1_SN_LDSB1_CLR1_GSU0_GSUC0_GSUWGMRR0_K1_LBSPPA256_LBSPPB2048_LPB0_MIWT8_8_PLR1_SU32_SUM0_SUS256_SKXCCM6_VWA4_VWB8_WGM4_WGMXCC1_WGMXCCGn1
    SolutionIndex: 58
    SolutionNameMin: Cijk_Alik_Bjlk_HHS_BH_UserArgs_MT256x256x32_MI16x16x1_SN_LDSB1_CLR1_GSU0_GSUC0_GSUWGMRR0_K1_LBSPPA512_LBSPPB2048_LPB0_MIWT8_8_PLR1_SU32_SUM0_SUS256_SKXCCM6_VWA8_VWB8_WGM4_WGMXCC1_WGMXCCGn1
    SolutionIndex: 59
    SolutionNameMin: Cijk_Alik_Bjlk_HHS_BH_UserArgs_MT256x256x32_MI16x16x1_SN_LDSB1_CLR1_GSU0_GSUC0_GSUWGMRR0_K1_LBSPPA512_LBSPPB2048_LPB16_MIWT8_8_PLR1_SU32_SUM0_SUS256_SKXCCM6_VWA8_VWB1_WGM8_WGMXCC1_WGMXCCGn1
    SolutionIndex: 60
    SolutionNameMin: Cijk_Alik_Bjlk_HHS_BH_UserArgs_MT256x256x32_MI16x16x1_SN_LDSB1_CLR1_GSU0_GSUC0_GSUWGMRR0_K1_LBSPPA256_LBSPPB2048_LPB0_MIWT8_8_PLR1_SU32_SUM0_SUS256_SKXCCM6_VWA4_VWB4_WGM8_WGMXCC1_WGMXCCGn1
    SolutionIndex: 61
    SolutionNameMin: Cijk_Alik_Bjlk_HHS_BH_UserArgs_MT256x256x32_MI16x16x1_SN_LDSB1_CLR1_GSU0_GSUC0_GSUWGMRR0_K1_LBSPPA128_LBSPPB2048_LPB0_MIWT8_8_PLR1_SU32_SUM0_SUS256_SKXCCM6_VWA1_VWB8_WGM8_WGMXCC1_WGMXCCGn1
    SolutionIndex: 62
    SolutionNameMin: Cijk_Alik_Bjlk_HHS_BH_UserArgs_MT256x256x32_MI16x16x1_SN_LDSB1_CLR1_GSU0_GSUC0_GSUWGMRR0_K1_LBSPPA256_LBSPPB2048_LPB0_MIWT8_8_PLR1_SU32_SUM0_SUS256_SKXCCM6_VWA4_VWB8_WGM8_WGMXCC1_WGMXCCGn1
    SolutionIndex: 63
    SolutionNameMin: Cijk_Alik_Bjlk_HHS_BH_UserArgs_MT128x256x32_MI16x16x1_SN_LDSB1_CLR1_GSU0_GSUC0_GSUWGMRR0_K1_LBSPPA256_LBSPPB2048_LPB0_MIWT4_8_PLR1_SU32_SUM0_SUS256_SKXCCM6_VWA4_VWB4_WGM1_WGMXCC1_WGMXCCGn1
    SolutionIndex: 64
    SolutionNameMin: Cijk_Alik_Bjlk_HHS_BH_UserArgs_MT128x256x32_MI16x16x1_SN_LDSB1_CLR1_GSU0_GSUC0_GSUWGMRR0_K1_LBSPPA128_LBSPPB2048_LPB0_MIWT4_8_PLR1_SU32_SUM0_SUS256_SKXCCM6_VWA1_VWB8_WGM1_WGMXCC1_WGMXCCGn1
    SolutionIndex: 65
    SolutionNameMin: Cijk_Alik_Bjlk_HHS_BH_UserArgs_MT128x256x32_MI16x16x1_SN_LDSB1_CLR1_GSU0_GSUC0_GSUWGMRR0_K1_LBSPPA128_LBSPPB2048_LPB0_MIWT4_8_PLR1_SU32_SUM0_SUS256_SKXCCM6_VWA2_VWB4_WGM4_WGMXCC1_WGMXCCGn1
    SolutionIndex: 66
    SolutionNameMin: Cijk_Alik_Bjlk_HHS_BH_UserArgs_MT128x256x32_MI16x16x1_SN_LDSB1_CLR1_GSU0_GSUC0_GSUWGMRR0_K1_LBSPPA128_LBSPPB2048_LPB0_MIWT4_8_PLR1_SU32_SUM0_SUS256_SKXCCM6_VWA2_VWB8_WGM4_WGMXCC1_WGMXCCGn1
    SolutionIndex: 67
    SolutionNameMin: Cijk_Alik_Bjlk_HHS_BH_UserArgs_MT128x256x32_MI16x16x1_SN_LDSB1_CLR1_GSU0_GSUC0_GSUWGMRR0_K1_LBSPPA256_LBSPPB2048_LPB0_MIWT4_8_PLR1_SU32_SUM0_SUS256_SKXCCM6_VWA4_VWB8_WGM8_WGMXCC1_WGMXCCGn1
    SolutionIndex: 68
    SolutionNameMin: Cijk_Alik_Bjlk_HHS_BH_UserArgs_MT256x128x32_MI16x16x1_SN_LDSB1_CLR1_GSU0_GSUC0_GSUWGMRR0_K1_LBSPPA512_LBSPPB1024_LPB32_MIWT8_4_PLR1_SU32_SUM0_SUS256_SKXCCM6_VWA8_VWB2_WGM1_WGMXCC1_WGMXCCGn1
    SolutionIndex: 69
    SolutionNameMin: Cijk_Alik_Bjlk_HHS_BH_UserArgs_MT256x128x32_MI16x16x1_SN_LDSB1_CLR1_GSU0_GSUC0_GSUWGMRR0_K1_LBSPPA512_LBSPPB1024_LPB0_MIWT8_4_PLR1_SU32_SUM0_SUS256_SKXCCM6_VWA8_VWB4_WGM1_WGMXCC1_WGMXCCGn1
    SolutionIndex: 70
    SolutionNameMin: Cijk_Alik_Bjlk_HHS_BH_UserArgs_MT256x128x32_MI16x16x1_SN_LDSB1_CLR1_GSU0_GSUC0_GSUWGMRR0_K1_LBSPPA512_LBSPPB1024_LPB32_MIWT8_4_PLR1_SU32_SUM0_SUS256_SKXCCM6_VWA8_VWB2_WGM4_WGMXCC1_WGMXCCGn1
    SolutionIndex: 71
    SolutionNameMin: Cijk_Alik_Bjlk_HHS_BH_UserArgs_MT256x128x32_MI16x16x1_SN_LDSB1_CLR1_GSU0_GSUC0_GSUWGMRR0_K1_LBSPPA512_LBSPPB1024_LPB0_MIWT8_4_PLR1_SU32_SUM0_SUS256_SKXCCM6_VWA8_VWB4_WGM8_WGMXCC1_WGMXCCGn1
    SolutionIndex: 72
    SolutionNameMin: Cijk_Alik_Bjlk_HHS_BH_UserArgs_MT128x256x64_MI16x16x1_SN_LDSB1_CLR1_GSU0_GSUC0_GSUWGMRR0_K1_LBSPPA512_LBSPPB4096_LPB32_MIWT4_8_PLR1_SU32_SUM0_SUS256_SKXCCM6_VWA4_VWB2_WGM1_WGMXCC1_WGMXCCGn1
    SolutionIndex: 73
    SolutionNameMin: Cijk_Alik_Bjlk_HHS_BH_UserArgs_MT128x256x64_MI16x16x1_SN_LDSB1_CLR1_GSU0_GSUC0_GSUWGMRR0_K1_LBSPPA256_LBSPPB4096_LPB0_MIWT4_8_PLR1_SU32_SUM0_SUS256_SKXCCM6_VWA2_VWB4_WGM1_WGMXCC1_WGMXCCGn1
    SolutionIndex: 74
    SolutionNameMin: Cijk_Alik_Bjlk_HHS_BH_UserArgs_MT128x256x64_MI16x16x1_SN_LDSB1_CLR1_GSU0_GSUC0_GSUWGMRR0_K1_LBSPPA512_LBSPPB4096_LPB0_MIWT4_8_PLR1_SU32_SUM0_SUS256_SKXCCM6_VWA4_VWB4_WGM1_WGMXCC1_WGMXCCGn1
    SolutionIndex: 75
    SolutionNameMin: Cijk_Alik_Bjlk_HHS_BH_UserArgs_MT128x256x64_MI16x16x1_SN_LDSB1_CLR1_GSU0_GSUC0_GSUWGMRR0_K1_LBSPPA512_LBSPPB4096_LPB0_MIWT4_8_PLR1_SU32_SUM0_SUS256_SKXCCM6_VWA4_VWB8_WGM1_WGMXCC1_WGMXCCGn1
    SolutionIndex: 76
    SolutionNameMin: Cijk_Alik_Bjlk_HHS_BH_UserArgs_MT128x256x64_MI16x16x1_SN_LDSB1_CLR1_GSU0_GSUC0_GSUWGMRR0_K1_LBSPPA256_LBSPPB4096_LPB0_MIWT4_8_PLR1_SU32_SUM0_SUS256_SKXCCM6_VWA2_VWB4_WGM4_WGMXCC1_WGMXCCGn1
    SolutionIndex: 77
    SolutionNameMin: Cijk_Alik_Bjlk_HHS_BH_UserArgs_MT128x256x64_MI16x16x1_SN_LDSB1_CLR1_GSU0_GSUC0_GSUWGMRR0_K1_LBSPPA512_LBSPPB4096_LPB0_MIWT4_8_PLR1_SU32_SUM0_SUS256_SKXCCM6_VWA4_VWB4_WGM4_WGMXCC1_WGMXCCGn1
    SolutionIndex: 78
    SolutionNameMin: Cijk_Alik_Bjlk_HHS_BH_UserArgs_MT128x256x64_MI16x16x1_SN_LDSB1_CLR1_GSU0_GSUC0_GSUWGMRR0_K1_LBSPPA512_LBSPPB4096_LPB0_MIWT4_8_PLR1_SU32_SUM0_SUS256_SKXCCM6_VWA4_VWB8_WGM4_WGMXCC1_WGMXCCGn1
    SolutionIndex: 79
    SolutionNameMin: Cijk_Alik_Bjlk_HHS_BH_UserArgs_MT256x128x64_MI16x16x1_SN_LDSB1_CLR1_GSU0_GSUC0_GSUWGMRR0_K1_LBSPPA1024_LBSPPB2048_LPB16_MIWT8_4_PLR1_SU32_SUM0_SUS256_SKXCCM6_VWA8_VWB1_WGM1_WGMXCC1_WGMXCCGn1
    SolutionIndex: 80
    SolutionNameMin: Cijk_Alik_Bjlk_HHS_BH_UserArgs_MT256x128x64_MI16x16x1_SN_LDSB1_CLR1_GSU0_GSUC0_GSUWGMRR0_K1_LBSPPA1024_LBSPPB2048_LPB0_MIWT8_4_PLR1_SU32_SUM0_SUS256_SKXCCM6_VWA8_VWB4_WGM1_WGMXCC1_WGMXCCGn1
    SolutionIndex: 81
    SolutionNameMin: Cijk_Alik_Bjlk_HHS_BH_UserArgs_MT256x128x64_MI16x16x1_SN_LDSB1_CLR1_GSU0_GSUC0_GSUWGMRR0_K1_LBSPPA512_LBSPPB2048_LPB0_MIWT8_4_PLR1_SU32_SUM0_SUS256_SKXCCM6_VWA4_VWB4_WGM4_WGMXCC1_WGMXCCGn1
    SolutionIndex: 82
    SolutionNameMin: Cijk_Alik_Bjlk_HHS_BH_UserArgs_MT256x128x64_MI16x16x1_SN_LDSB1_CLR1_GSU0_GSUC0_GSUWGMRR0_K1_LBSPPA512_LBSPPB2048_LPB32_MIWT8_4_PLR1_SU32_SUM0_SUS256_SKXCCM6_VWA4_VWB2_WGM8_WGMXCC1_WGMXCCGn1
    SolutionIndex: 83
    SolutionNameMin: Cijk_Alik_Bjlk_HHS_BH_UserArgs_MT256x128x64_MI16x16x1_SN_LDSB1_CLR1_GSU0_GSUC0_GSUWGMRR0_K1_LBSPPA512_LBSPPB2048_LPB0_MIWT8_4_PLR1_SU32_SUM0_SUS256_SKXCCM6_VWA4_VWB4_WGM8_WGMXCC1_WGMXCCGn1
    SolutionIndex: 84
    SolutionNameMin: Cijk_Alik_Bjlk_HHS_BH_UserArgs_MT64x256x64_MI16x16x1_SN_LDSB1_CLR1_GSU0_GSUC0_GSUWGMRR0_K1_LBSPPA256_LBSPPB4096_LPB0_MIWT2_8_PLR1_SU32_SUM0_SUS256_SKXCCM6_VWA2_VWB8_WGM1_WGMXCC1_WGMXCCGn1
    SolutionIndex: 85
    SolutionNameMin: Cijk_Alik_Bjlk_HHS_BH_UserArgs_MT64x256x64_MI16x16x1_SN_LDSB1_CLR1_GSU0_GSUC0_GSUWGMRR0_K1_LBSPPA256_LBSPPB4096_LPB0_MIWT2_8_PLR1_SU32_SUM0_SUS256_SKXCCM6_VWA2_VWB4_WGM8_WGMXCC1_WGMXCCGn1
    SolutionIndex: 86
    SolutionNameMin: Cijk_Alik_Bjlk_HHS_BH_UserArgs_MT128x128x64_MI16x16x1_SN_LDSB1_CLR1_GSU0_GSUC0_GSUWGMRR0_K1_LBSPPA256_LBSPPB2048_LPB32_MIWT4_4_PLR1_SU32_SUM0_SUS256_SKXCCM6_VWA2_VWB2_WGM1_WGMXCC1_WGMXCCGn1
    SolutionIndex: 87
    SolutionNameMin: Cijk_Alik_Bjlk_HHS_BH_UserArgs_MT128x128x64_MI16x16x1_SN_LDSB1_CLR1_GSU0_GSUC0_GSUWGMRR0_K1_LBSPPA512_LBSPPB2048_LPB32_MIWT4_4_PLR1_SU32_SUM0_SUS256_SKXCCM6_VWA4_VWB2_WGM1_WGMXCC1_WGMXCCGn1
    SolutionIndex: 88
    SolutionNameMin: Cijk_Alik_Bjlk_HHS_BH_UserArgs_MT128x128x64_MI16x16x1_SN_LDSB1_CLR1_GSU0_GSUC0_GSUWGMRR0_K1_LBSPPA256_LBSPPB2048_LPB0_MIWT4_4_PLR1_SU32_SUM0_SUS256_SKXCCM6_VWA2_VWB4_WGM1_WGMXCC1_WGMXCCGn1
    SolutionIndex: 89
    SolutionNameMin: Cijk_Alik_Bjlk_HHS_BH_UserArgs_MT128x128x64_MI16x16x1_SN_LDSB1_CLR1_GSU0_GSUC0_GSUWGMRR0_K1_LBSPPA512_LBSPPB2048_LPB0_MIWT4_4_PLR1_SU32_SUM0_SUS256_SKXCCM6_VWA4_VWB4_WGM1_WGMXCC1_WGMXCCGn1
    SolutionIndex: 90
    SolutionNameMin: Cijk_Alik_Bjlk_HHS_BH_UserArgs_MT128x128x64_MI16x16x1_SN_LDSB1_CLR1_GSU0_GSUC0_GSUWGMRR0_K1_LBSPPA512_LBSPPB2048_LPB32_MIWT4_4_PLR2_SU32_SUM0_SUS256_SKXCCM6_VWA4_VWB2_WGM1_WGMXCC1_WGMXCCGn1
    SolutionIndex: 91
    SolutionNameMin: Cijk_Alik_Bjlk_HHS_BH_UserArgs_MT128x128x64_MI16x16x1_SN_LDSB1_CLR1_GSU0_GSUC0_GSUWGMRR0_K1_LBSPPA256_LBSPPB2048_LPB0_MIWT4_4_PLR2_SU32_SUM0_SUS256_SKXCCM6_VWA2_VWB4_WGM1_WGMXCC1_WGMXCCGn1
    SolutionIndex: 92
    SolutionNameMin: Cijk_Alik_Bjlk_HHS_BH_UserArgs_MT128x128x64_MI16x16x1_SN_LDSB1_CLR1_GSU0_GSUC0_GSUWGMRR0_K1_LBSPPA512_LBSPPB2048_LPB0_MIWT4_4_PLR2_SU32_SUM0_SUS256_SKXCCM6_VWA4_VWB4_WGM1_WGMXCC1_WGMXCCGn1
    SolutionIndex: 93
    SolutionNameMin: Cijk_Alik_Bjlk_HHS_BH_UserArgs_MT128x128x64_MI16x16x1_SN_LDSB1_CLR1_GSU0_GSUC0_GSUWGMRR0_K1_LBSPPA256_LBSPPB2048_LPB32_MIWT4_4_PLR1_SU32_SUM0_SUS256_SKXCCM6_VWA2_VWB2_WGM4_WGMXCC1_WGMXCCGn1
    SolutionIndex: 94
    SolutionNameMin: Cijk_Alik_Bjlk_HHS_BH_UserArgs_MT128x128x64_MI16x16x1_SN_LDSB1_CLR1_GSU0_GSUC0_GSUWGMRR0_K1_LBSPPA512_LBSPPB2048_LPB32_MIWT4_4_PLR1_SU32_SUM0_SUS256_SKXCCM6_VWA4_VWB2_WGM4_WGMXCC1_WGMXCCGn1
    SolutionIndex: 95
    SolutionNameMin: Cijk_Alik_Bjlk_HHS_BH_UserArgs_MT128x128x64_MI16x16x1_SN_LDSB1_CLR1_GSU0_GSUC0_GSUWGMRR0_K1_LBSPPA256_LBSPPB2048_LPB0_MIWT4_4_PLR1_SU32_SUM0_SUS256_SKXCCM6_VWA2_VWB4_WGM4_WGMXCC1_WGMXCCGn1
    SolutionIndex: 96
    SolutionNameMin: Cijk_Alik_Bjlk_HHS_BH_UserArgs_MT128x128x64_MI16x16x1_SN_LDSB1_CLR1_GSU0_GSUC0_GSUWGMRR0_K1_LBSPPA512_LBSPPB2048_LPB0_MIWT4_4_PLR1_SU32_SUM0_SUS256_SKXCCM6_VWA4_VWB4_WGM4_WGMXCC1_WGMXCCGn1
    SolutionIndex: 97
    SolutionNameMin: Cijk_Alik_Bjlk_HHS_BH_UserArgs_MT128x128x64_MI16x16x1_SN_LDSB1_CLR1_GSU0_GSUC0_GSUWGMRR0_K1_LBSPPA512_LBSPPB2048_LPB0_MIWT4_4_PLR2_SU32_SUM0_SUS256_SKXCCM6_VWA4_VWB4_WGM4_WGMXCC1_WGMXCCGn1
    SolutionIndex: 98
    SolutionNameMin: Cijk_Alik_Bjlk_HHS_BH_UserArgs_MT128x128x64_MI16x16x1_SN_LDSB1_CLR1_GSU0_GSUC0_GSUWGMRR0_K1_LBSPPA512_LBSPPB2048_LPB32_MIWT4_4_PLR1_SU32_SUM0_SUS256_SKXCCM6_VWA4_VWB2_WGM8_WGMXCC1_WGMXCCGn1
    SolutionIndex: 99
    SolutionNameMin: Cijk_Alik_Bjlk_HHS_BH_UserArgs_MT128x128x64_MI16x16x1_SN_LDSB1_CLR1_GSU0_GSUC0_GSUWGMRR0_K1_LBSPPA256_LBSPPB2048_LPB0_MIWT4_4_PLR1_SU32_SUM0_SUS256_SKXCCM6_VWA2_VWB4_WGM8_WGMXCC1_WGMXCCGn1
    SolutionIndex: 100
    SolutionNameMin: Cijk_Alik_Bjlk_HHS_BH_UserArgs_MT128x128x64_MI16x16x1_SN_LDSB1_CLR1_GSU0_GSUC0_GSUWGMRR0_K1_LBSPPA512_LBSPPB2048_LPB0_MIWT4_4_PLR1_SU32_SUM0_SUS256_SKXCCM6_VWA4_VWB4_WGM8_WGMXCC1_WGMXCCGn1
    SolutionIndex: 101
    SolutionNameMin: Cijk_Alik_Bjlk_HHS_BH_UserArgs_MT128x128x64_MI16x16x1_SN_LDSB1_CLR1_GSU0_GSUC0_GSUWGMRR0_K1_LBSPPA512_LBSPPB2048_LPB0_MIWT4_4_PLR2_SU32_SUM0_SUS256_SKXCCM6_VWA4_VWB4_WGM8_WGMXCC1_WGMXCCGn1
    SolutionIndex: 102
    SolutionNameMin: Cijk_Alik_Bjlk_HHS_BH_UserArgs_MT64x128x64_MI16x16x1_SN_LDSB1_CLR1_GSU0_GSUC0_GSUWGMRR0_K1_LBSPPA256_LBSPPB2048_LPB0_MIWT2_4_PLR1_SU32_SUM0_SUS256_SKXCCM6_VWA2_VWB4_WGM1_WGMXCC1_WGMXCCGn1
    SolutionIndex: 103
    SolutionNameMin: Cijk_Alik_Bjlk_HHS_BH_UserArgs_MT64x128x64_MI16x16x1_SN_LDSB1_CLR1_GSU0_GSUC0_GSUWGMRR0_K1_LBSPPA256_LBSPPB2048_LPB0_MIWT2_4_PLR2_SU32_SUM0_SUS256_SKXCCM6_VWA2_VWB4_WGM8_WGMXCC1_WGMXCCGn1
    SolutionIndex: 104
    SolutionNameMin: Cijk_Alik_Bjlk_HHS_BH_UserArgs_MT128x64x64_MI16x16x1_SN_LDSB1_CLR1_GSU0_GSUC0_GSUWGMRR0_K1_LBSPPA128_LBSPPB1024_LPB32_MIWT4_2_PLR1_SU32_SUM0_SUS256_SKXCCM6_VWA1_VWB2_WGM1_WGMXCC1_WGMXCCGn1
    SolutionIndex: 105
    SolutionNameMin: Cijk_Alik_Bjlk_HHS_BH_UserArgs_MT128x64x64_MI16x16x1_SN_LDSB1_CLR1_GSU0_GSUC0_GSUWGMRR0_K1_LBSPPA256_LBSPPB1024_LPB32_MIWT4_2_PLR1_SU32_SUM0_SUS256_SKXCCM6_VWA2_VWB2_WGM1_WGMXCC1_WGMXCCGn1
    SolutionIndex: 106
    SolutionNameMin: Cijk_Alik_Bjlk_HHS_BH_UserArgs_MT128x64x64_MI16x16x1_SN_LDSB1_CLR1_GSU0_GSUC0_GSUWGMRR0_K1_LBSPPA512_LBSPPB1024_LPB32_MIWT4_2_PLR1_SU32_SUM0_SUS256_SKXCCM6_VWA4_VWB2_WGM1_WGMXCC1_WGMXCCGn1
    SolutionIndex: 107
    SolutionNameMin: Cijk_Alik_Bjlk_HHS_BH_UserArgs_MT128x64x64_MI16x16x1_SN_LDSB1_CLR1_GSU0_GSUC0_GSUWGMRR0_K1_LBSPPA256_LBSPPB1024_LPB32_MIWT4_2_PLR2_SU32_SUM0_SUS256_SKXCCM6_VWA2_VWB2_WGM1_WGMXCC1_WGMXCCGn1
    SolutionIndex: 108
    SolutionNameMin: Cijk_Alik_Bjlk_HHS_BH_UserArgs_MT128x64x64_MI16x16x1_SN_LDSB1_CLR1_GSU0_GSUC0_GSUWGMRR0_K1_LBSPPA512_LBSPPB1024_LPB32_MIWT4_2_PLR1_SU32_SUM0_SUS256_SKXCCM6_VWA4_VWB2_WGM4_WGMXCC1_WGMXCCGn1
    SolutionIndex: 109
    SolutionNameMin: Cijk_Alik_Bjlk_HHS_BH_UserArgs_MT128x64x64_MI16x16x1_SN_LDSB1_CLR1_GSU0_GSUC0_GSUWGMRR0_K1_LBSPPA512_LBSPPB1024_LPB32_MIWT4_2_PLR2_SU32_SUM0_SUS256_SKXCCM6_VWA4_VWB2_WGM8_WGMXCC1_WGMXCCGn1
    SolutionIndex: 110
    SolutionNameMin: Cijk_Alik_Bjlk_HHS_BH_UserArgs_MT32x64x64_MI16x16x1_SN_LDSB0_CLR1_GSU0_GSUC0_GSUWGMRR0_K1_LBSPPA128_LBSPPB1024_LPB32_MIWT1_2_PLR1_SU32_SUM0_SUS256_SKXCCM6_VWA1_VWB2_WGM1_WGMXCC1_WGMXCCGn1
    SolutionIndex: 111
    SolutionNameMin: Cijk_Alik_Bjlk_HHS_BH_UserArgs_MT64x32x64_MI16x16x1_SN_LDSB0_CLR1_GSU0_GSUC0_GSUWGMRR0_K1_LBSPPA128_LBSPPB512_LPB16_MIWT2_1_PLR1_SU32_SUM0_SUS256_SKXCCM6_VWA1_VWB1_WGM1_WGMXCC1_WGMXCCGn1
    SolutionIndex: 112
    SolutionNameMin: Cijk_Alik_Bjlk_HHS_BH_UserArgs_MT32x32x64_MI16x16x1_SN_LDSB0_CLR1_GSU0_GSUC0_GSUWGMRR0_K1_LBSPPA128_LBSPPB512_LPB16_MIWT1_1_PLR1_SU32_SUM0_SUS256_SKXCCM6_VWA1_VWB1_WGM1_WGMXCC1_WGMXCCGn1
    SolutionIndex: 113
    SolutionNameMin: Cijk_Alik_Bjlk_HHS_BH_UserArgs_MT64x128x128_MI16x16x1_SN_LDSB1_CLR1_GSU0_GSUC0_GSUWGMRR0_K1_LBSPPA512_LBSPPB2048_LPB0_MIWT2_4_PLR2_SU32_SUM0_SUS256_SKXCCM6_VWA2_VWB4_WGM1_WGMXCC1_WGMXCCGn1
    SolutionIndex: 114
    SolutionNameMin: Cijk_Alik_Bjlk_HHS_BH_UserArgs_MT64x128x128_MI16x16x1_SN_LDSB1_CLR1_GSU0_GSUC0_GSUWGMRR0_K1_LBSPPA512_LBSPPB2048_LPB0_MIWT2_4_PLR1_SU32_SUM0_SUS256_SKXCCM6_VWA2_VWB4_WGM8_WGMXCC1_WGMXCCGn1
    SolutionIndex: 115
    SolutionNameMin: Cijk_Alik_Bjlk_HHS_BH_UserArgs_MT64x128x128_MI16x16x1_SN_LDSB1_CLR1_GSU0_GSUC0_GSUWGMRR0_K1_LBSPPA512_LBSPPB2048_LPB32_MIWT2_4_PLR2_SU32_SUM0_SUS256_SKXCCM6_VWA2_VWB2_WGM8_WGMXCC1_WGMXCCGn1
    SolutionIndex: 116
    SolutionNameMin: Cijk_Alik_Bjlk_HHS_BH_UserArgs_MT128x64x128_MI16x16x1_SN_LDSB1_CLR1_GSU0_GSUC0_GSUWGMRR0_K1_LBSPPA1024_LBSPPB1024_LPB32_MIWT4_2_PLR1_SU32_SUM0_SUS256_SKXCCM6_VWA4_VWB2_WGM1_WGMXCC1_WGMXCCGn1
    SolutionIndex: 117
    SolutionNameMin: Cijk_Alik_Bjlk_HHS_BH_UserArgs_MT128x64x128_MI16x16x1_SN_LDSB1_CLR1_GSU0_GSUC0_GSUWGMRR0_K1_LBSPPA512_LBSPPB1024_LPB32_MIWT4_2_PLR2_SU32_SUM0_SUS256_SKXCCM6_VWA2_VWB2_WGM1_WGMXCC1_WGMXCCGn1
    SolutionIndex: 118
    SolutionNameMin: Cijk_Alik_Bjlk_HHS_BH_UserArgs_MT128x64x128_MI16x16x1_SN_LDSB1_CLR1_GSU0_GSUC0_GSUWGMRR0_K1_LBSPPA1024_LBSPPB1024_LPB32_MIWT4_2_PLR2_SU32_SUM0_SUS256_SKXCCM6_VWA4_VWB2_WGM1_WGMXCC1_WGMXCCGn1
    SolutionIndex: 119
    SolutionNameMin: Cijk_Alik_Bjlk_HHS_BH_UserArgs_MT128x64x128_MI16x16x1_SN_LDSB1_CLR1_GSU0_GSUC0_GSUWGMRR0_K1_LBSPPA512_LBSPPB1024_LPB32_MIWT4_2_PLR2_SU32_SUM0_SUS256_SKXCCM6_VWA2_VWB2_WGM4_WGMXCC1_WGMXCCGn1
    SolutionIndex: 120
    SolutionNameMin: Cijk_Alik_Bjlk_HHS_BH_UserArgs_MT128x64x128_MI16x16x1_SN_LDSB1_CLR1_GSU0_GSUC0_GSUWGMRR0_K1_LBSPPA1024_LBSPPB1024_LPB32_MIWT4_2_PLR2_SU32_SUM0_SUS256_SKXCCM6_VWA4_VWB2_WGM4_WGMXCC1_WGMXCCGn1
    SolutionIndex: 121
    SolutionNameMin: Cijk_Alik_Bjlk_HHS_BH_UserArgs_MT128x64x128_MI16x16x1_SN_LDSB1_CLR1_GSU0_GSUC0_GSUWGMRR0_K1_LBSPPA1024_LBSPPB1024_LPB32_MIWT4_2_PLR1_SU32_SUM0_SUS256_SKXCCM6_VWA4_VWB2_WGM8_WGMXCC1_WGMXCCGn1
    SolutionIndex: 122
    SolutionNameMin: Cijk_Alik_Bjlk_HHS_BH_UserArgs_MT128x64x128_MI16x16x1_SN_LDSB1_CLR1_GSU0_GSUC0_GSUWGMRR0_K1_LBSPPA512_LBSPPB1024_LPB32_MIWT4_2_PLR2_SU32_SUM0_SUS256_SKXCCM6_VWA2_VWB2_WGM8_WGMXCC1_WGMXCCGn1
    SolutionIndex: 123
    SolutionNameMin: Cijk_Alik_Bjlk_HHS_BH_UserArgs_MT128x64x128_MI16x16x1_SN_LDSB1_CLR1_GSU0_GSUC0_GSUWGMRR0_K1_LBSPPA1024_LBSPPB1024_LPB32_MIWT4_2_PLR2_SU32_SUM0_SUS256_SKXCCM6_VWA4_VWB2_WGM8_WGMXCC1_WGMXCCGn1
    SolutionIndex: 124
    SolutionNameMin: Cijk_Alik_Bjlk_HHS_BH_UserArgs_MT64x64x128_MI16x16x1_SN_LDSB1_CLR1_GSU0_GSUC0_GSUWGMRR0_K1_LBSPPA256_LBSPPB1024_LPB32_MIWT2_2_PLR2_SU32_SUM0_SUS256_SKXCCM6_VWA1_VWB2_WGM1_WGMXCC1_WGMXCCGn1
    SolutionIndex: 125
    SolutionNameMin: Cijk_Alik_Bjlk_HHS_BH_UserArgs_MT64x64x128_MI16x16x1_SN_LDSB1_CLR1_GSU0_GSUC0_GSUWGMRR0_K1_LBSPPA512_LBSPPB1024_LPB32_MIWT2_2_PLR2_SU32_SUM0_SUS256_SKXCCM6_VWA2_VWB2_WGM1_WGMXCC1_WGMXCCGn1
    SolutionIndex: 126
    SolutionNameMin: Cijk_Alik_Bjlk_HHS_BH_UserArgs_MT64x64x128_MI16x16x1_SN_LDSB1_CLR1_GSU0_GSUC0_GSUWGMRR0_K1_LBSPPA512_LBSPPB1024_LPB32_MIWT2_2_PLR2_SU32_SUM0_SUS256_SKXCCM6_VWA2_VWB2_WGM4_WGMXCC1_WGMXCCGn1
    SolutionIndex: 127
    SolutionNameMin: Cijk_Alik_Bjlk_HHS_BH_UserArgs_MT64x64x128_MI16x16x1_SN_LDSB1_CLR1_GSU0_GSUC0_GSUWGMRR0_K1_LBSPPA512_LBSPPB1024_LPB32_MIWT2_2_PLR2_SU32_SUM0_SUS256_SKXCCM6_VWA2_VWB2_WGM8_WGMXCC1_WGMXCCGn1
    SolutionIndex: 128
    SolutionNameMin: Cijk_Alik_Bjlk_HHS_BH_UserArgs_MT32x64x128_MI16x16x1_SN_LDSB1_CLR1_GSU0_GSUC0_GSUWGMRR0_K1_LBSPPA256_LBSPPB1024_LPB32_MIWT1_2_PLR2_SU32_SUM0_SUS256_SKXCCM6_VWA1_VWB2_WGM1_WGMXCC1_WGMXCCGn1
    SolutionIndex: 129
    SolutionNameMin: Cijk_Alik_Bjlk_HHS_BH_UserArgs_MT32x64x128_MI16x16x1_SN_LDSB1_CLR1_GSU0_GSUC0_GSUWGMRR0_K1_LBSPPA256_LBSPPB1024_LPB32_MIWT1_2_PLR2_SU32_SUM0_SUS256_SKXCCM6_VWA1_VWB2_WGM8_WGMXCC1_WGMXCCGn1
    SolutionIndex: 130
    SolutionNameMin: Cijk_Alik_Bjlk_HHS_BH_UserArgs_MT32x32x32_MI16x16x1_SN_LDSB0_CLR1_GSU0_GSUC0_GSUWGMRR0_K1_LBSPPA128_LBSPPB256_LPB16_MIWT1_1_PLR1_SU32_SUM0_SUS256_SKXCCM0_VWA1_VWB1_WGM8_WGMXCC1_WGMXCCGn1
- - - [128, 128, 1, 128, 128, 128, 128, 128]
    - [51, 0.079]
  - - [128, 128, 1, 256, 128, 128, 256, 128]
    - [36, 0.146]
  - - [128, 128, 1, 512, 128, 128, 512, 128]
    - [51, 0.251]
  - - [128, 128, 1, 1024, 128, 128, 1024, 128]
    - [51, 0.384]
  - - [128, 128, 1, 2048, 128, 128, 2048, 128]
    - [50, 0.594]
  - - [128, 128, 1, 4096, 128, 128, 4096, 128]
    - [112, 1.026]
  - - [128, 128, 1, 8192, 128, 128, 8192, 128]
    - [50, 1.587]
  - - [128, 256, 1, 128, 128, 128, 128, 256]
    - [35, 0.168]
  - - [128, 256, 1, 256, 128, 128, 256, 256]
    - [35, 0.305]
  - - [128, 256, 1, 512, 128, 128, 512, 256]
    - [49, 0.515]
  - - [128, 256, 1, 1024, 128, 128, 1024, 256]
    - [50, 0.784]
  - - [128, 256, 1, 2048, 128, 128, 2048, 256]
    - [50, 1.182]
  - - [128, 256, 1, 4096, 128, 128, 4096, 256]
    - [112, 1.98]
  - - [128, 256, 1, 8192, 128, 128, 8192, 256]
    - [50, 3.094]
  - - [128, 512, 1, 128, 128, 128, 128, 512]
    - [35, 0.335]
  - - [128, 512, 1, 256, 128, 128, 256, 512]
    - [35, 0.606]
  - - [128, 512, 1, 512, 128, 128, 512, 512]
    - [49, 1.03]
  - - [128, 512, 1, 1024, 128, 128, 1024, 512]
    - [50, 1.564]
  - - [128, 512, 1, 2048, 128, 128, 2048, 512]
    - [50, 2.298]
  - - [128, 512, 1, 4096, 128, 128, 4096, 512]
    - [49, 3.427]
  - - [128, 512, 1, 8192, 128, 128, 8192, 512]
    - [128, 5.17]
  - - [128, 1024, 1, 128, 128, 128, 128, 1024]
    - [49, 0.653]
  - - [128, 1024, 1, 256, 128, 128, 256, 1024]
    - [35, 1.195]
  - - [128, 1024, 1, 512, 128, 128, 512, 1024]
    - [49, 2.019]
  - - [128, 1024, 1, 1024, 128, 128, 1024, 1024]
    - [50, 3.061]
  - - [128, 1024, 1, 2048, 128, 128, 2048, 1024]
    - [47, 4.046]
  - - [128, 1024, 1, 4096, 128, 128, 4096, 1024]
    - [48, 5.71]
  - - [128, 1024, 1, 8192, 128, 128, 8192, 1024]
    - [124, 8.765]
  - - [128, 2048, 1, 128, 128, 128, 128, 2048]
    - [34, 1.249]
  - - [128, 2048, 1, 256, 128, 128, 256, 2048]
    - [33, 2.206]
  - - [128, 2048, 1, 512, 128, 128, 512, 2048]
    - [47, 3.576]
  - - [128, 2048, 1, 1024, 128, 128, 1024, 2048]
    - [128, 5.317]
  - - [128, 2048, 1, 2048, 128, 128, 2048, 2048]
    - [43, 6.672]
  - - [128, 2048, 1, 4096, 128, 128, 4096, 2048]
    - [124, 9.254]
  - - [128, 2048, 1, 8192, 128, 128, 8192, 2048]
    - [118, 12.925]
  - - [128, 4096, 1, 128, 128, 128, 128, 4096]
    - [43, 2.248]
  - - [128, 4096, 1, 256, 128, 128, 256, 4096]
    - [32, 3.817]
  - - [128, 4096, 1, 512, 128, 128, 512, 4096]
    - [43, 6.223]
  - - [128, 4096, 1, 1024, 128, 128, 1024, 4096]
    - [125, 8.965]
  - - [128, 4096, 1, 2048, 128, 128, 2048, 4096]
    - [124, 10.164]
  - - [128, 4096, 1, 4096, 128, 128, 4096, 4096]
    - [30, 13.053]
  - - [128, 4096, 1, 8192, 128, 128, 8192, 4096]
    - [38, 15.246]
  - - [128, 8192, 1, 128, 128, 128, 128, 8192]
    - [26, 3.712]
  - - [128, 8192, 1, 256, 128, 128, 256, 8192]
    - [26, 6.283]
  - - [128, 8192, 1, 512, 128, 128, 512, 8192]
    - [39, 9.792]
  - - [128, 8192, 1, 1024, 128, 128, 1024, 8192]
    - [39, 13.407]
  - - [128, 8192, 1, 2048, 128, 128, 2048, 8192]
    - [29, 13.203]
  - - [128, 8192, 1, 4096, 128, 128, 4096, 8192]
    - [107, 16.122]
  - - [128, 8192, 1, 8192, 128, 128, 8192, 8192]
    - [31, 19.135]
  - - [256, 128, 1, 128, 256, 256, 128, 128]
    - [35, 0.167]
  - - [256, 128, 1, 256, 256, 256, 256, 128]
    - [35, 0.31]
  - - [256, 128, 1, 512, 256, 256, 512, 128]
    - [49, 0.521]
  - - [256, 128, 1, 1024, 256, 256, 1024, 128]
    - [50, 0.786]
  - - [256, 128, 1, 2048, 256, 256, 2048, 128]
    - [50, 1.174]
  - - [256, 128, 1, 4096, 256, 256, 4096, 128]
    - [112, 1.996]
  - - [256, 128, 1, 8192, 256, 256, 8192, 128]
    - [50, 3.084]
  - - [256, 256, 1, 128, 256, 256, 128, 256]
    - [35, 0.337]
  - - [256, 256, 1, 256, 256, 256, 256, 256]
    - [49, 0.602]
  - - [256, 256, 1, 512, 256, 256, 512, 256]
    - [49, 1.01]
  - - [256, 256, 1, 1024, 256, 256, 1024, 256]
    - [49, 1.545]
  - - [256, 256, 1, 2048, 256, 256, 2048, 256]
    - [49, 2.289]
  - - [256, 256, 1, 4096, 256, 256, 4096, 256]
    - [110, 3.458]
  - - [256, 256, 1, 8192, 256, 256, 8192, 256]
    - [47, 5.392]
  - - [256, 512, 1, 128, 256, 256, 128, 512]
    - [35, 0.655]
  - - [256, 512, 1, 256, 256, 256, 256, 512]
    - [35, 1.198]
  - - [256, 512, 1, 512, 256, 256, 512, 512]
    - [50, 2.002]
  - - [256, 512, 1, 1024, 256, 256, 1024, 512]
    - [50, 3.077]
  - - [256, 512, 1, 2048, 256, 256, 2048, 512]
    - [47, 4.022]
  - - [256, 512, 1, 4096, 256, 256, 4096, 512]
    - [48, 5.715]
  - - [256, 512, 1, 8192, 256, 256, 8192, 512]
    - [125, 8.503]
  - - [256, 1024, 1, 128, 256, 256, 128, 1024]
    - [34, 1.248]
  - - [256, 1024, 1, 256, 256, 256, 256, 1024]
    - [34, 2.161]
  - - [256, 1024, 1, 512, 256, 256, 512, 1024]
    - [47, 3.599]
  - - [256, 1024, 1, 1024, 256, 256, 1024, 1024]
    - [47, 5.369]
  - - [256, 1024, 1, 2048, 256, 256, 2048, 1024]
    - [43, 6.764]
  - - [256, 1024, 1, 4096, 256, 256, 4096, 1024]
    - [125, 9.221]
  - - [256, 1024, 1, 8192, 256, 256, 8192, 1024]
    - [118, 12.72]
  - - [256, 2048, 1, 128, 256, 256, 128, 2048]
    - [32, 2.209]
  - - [256, 2048, 1, 256, 256, 256, 256, 2048]
    - [43, 3.775]
  - - [256, 2048, 1, 512, 256, 256, 512, 2048]
    - [43, 6.184]
  - - [256, 2048, 1, 1024, 256, 256, 1024, 2048]
    - [45, 8.937]
  - - [256, 2048, 1, 2048, 256, 256, 2048, 2048]
    - [118, 10.408]
  - - [256, 2048, 1, 4096, 256, 256, 4096, 2048]
    - [106, 13.463]
  - - [256, 2048, 1, 8192, 256, 256, 8192, 2048]
    - [89, 14.912]
  - - [256, 4096, 1, 128, 256, 256, 128, 4096]
    - [2, 3.713]
  - - [256, 4096, 1, 256, 256, 256, 256, 4096]
    - [26, 6.269]
  - - [256, 4096, 1, 512, 256, 256, 512, 4096]
    - [39, 9.67]
  - - [256, 4096, 1, 1024, 256, 256, 1024, 4096]
    - [118, 13.813]
  - - [256, 4096, 1, 2048, 256, 256, 2048, 4096]
    - [105, 14.177]
  - - [256, 4096, 1, 4096, 256, 256, 4096, 4096]
    - [120, 16.259]
  - - [256, 4096, 1, 8192, 256, 256, 8192, 4096]
    - [19, 18.505]
  - - [256, 8192, 1, 128, 256, 256, 128, 8192]
    - [88, 5.637]
  - - [256, 8192, 1, 256, 256, 256, 256, 8192]
    - [88, 9.546]
  - - [256, 8192, 1, 512, 256, 256, 512, 8192]
    - [88, 14.716]
  - - [256, 8192, 1, 1024, 256, 256, 1024, 8192]
    - [102, 13.905]
  - - [256, 8192, 1, 2048, 256, 256, 2048, 8192]
    - [121, 16.992]
  - - [256, 8192, 1, 4096, 256, 256, 4096, 8192]
    - [20, 19.889]
  - - [256, 8192, 1, 8192, 256, 256, 8192, 8192]
    - [15, 22.966]
  - - [512, 128, 1, 128, 512, 512, 128, 128]
    - [35, 0.328]
  - - [512, 128, 1, 256, 512, 512, 256, 128]
    - [35, 0.61]
  - - [512, 128, 1, 512, 512, 512, 512, 128]
    - [49, 1.029]
  - - [512, 128, 1, 1024, 512, 512, 1024, 128]
    - [49, 1.562]
  - - [512, 128, 1, 2048, 512, 512, 2048, 128]
    - [50, 2.274]
  - - [512, 128, 1, 4096, 512, 512, 4096, 128]
    - [111, 3.436]
  - - [512, 128, 1, 8192, 512, 512, 8192, 128]
    - [128, 5.419]
  - - [512, 256, 1, 128, 512, 512, 128, 256]
    - [35, 0.661]
  - - [512, 256, 1, 256, 512, 512, 256, 256]
    - [35, 1.192]
  - - [512, 256, 1, 512, 512, 512, 512, 256]
    - [49, 2.017]
  - - [512, 256, 1, 1024, 512, 512, 1024, 256]
    - [50, 3.039]
  - - [512, 256, 1, 2048, 512, 512, 2048, 256]
    - [47, 4.03]
  - - [512, 256, 1, 4096, 512, 512, 4096, 256]
    - [129, 5.869]
  - - [512, 256, 1, 8192, 512, 512, 8192, 256]
    - [126, 8.421]
  - - [512, 512, 1, 128, 512, 512, 128, 512]
    - [34, 1.224]
  - - [512, 512, 1, 256, 512, 512, 256, 512]
    - [34, 2.166]
  - - [512, 512, 1, 512, 512, 512, 512, 512]
    - [47, 3.595]
  - - [512, 512, 1, 1024, 512, 512, 1024, 512]
    - [47, 5.366]
  - - [512, 512, 1, 2048, 512, 512, 2048, 512]
    - [126, 6.774]
  - - [512, 512, 1, 4096, 512, 512, 4096, 512]
    - [44, 9.256]
  - - [512, 512, 1, 8192, 512, 512, 8192, 512]
    - [42, 12.618]
  - - [512, 1024, 1, 128, 512, 512, 128, 1024]
    - [4, 2.232]
  - - [512, 1024, 1, 256, 512, 512, 256, 1024]
    - [32, 3.818]
  - - [512, 1024, 1, 512, 512, 512, 512, 1024]
    - [43, 6.188]
  - - [512, 1024, 1, 1024, 512, 512, 1024, 1024]
    - [43, 9.107]
  - - [512, 1024, 1, 2048, 512, 512, 2048, 1024]
    - [40, 10.629]
  - - [512, 1024, 1, 4096, 512, 512, 4096, 1024]
    - [89, 12.988]
  - - [512, 1024, 1, 8192, 512, 512, 8192, 1024]
    - [98, 14.818]
  - - [512, 2048, 1, 128, 512, 512, 128, 2048]
    - [2, 3.679]
  - - [512, 2048, 1, 256, 512, 512, 256, 2048]
    - [26, 6.164]
  - - [512, 2048, 1, 512, 512, 512, 512, 2048]
    - [37, 9.649]
  - - [512, 2048, 1, 1024, 512, 512, 1024, 2048]
    - [117, 13.829]
  - - [512, 2048, 1, 2048, 512, 512, 2048, 2048]
    - [108, 13.73]
  - - [512, 2048, 1, 4096, 512, 512, 4096, 2048]
    - [100, 15.285]
  - - [512, 2048, 1, 8192, 512, 512, 8192, 2048]
    - [25, 17.317]
  - - [512, 4096, 1, 128, 512, 512, 128, 4096]
    - [22, 5.637]
  - - [512, 4096, 1, 256, 512, 512, 256, 4096]
    - [88, 9.631]
  - - [512, 4096, 1, 512, 512, 512, 512, 4096]
    - [88, 14.733]
  - - [512, 4096, 1, 1024, 512, 512, 1024, 4096]
    - [116, 14.585]
  - - [512, 4096, 1, 2048, 512, 512, 2048, 4096]
    - [104, 16.611]
  - - [512, 4096, 1, 4096, 512, 512, 4096, 4096]
    - [18, 19.078]
  - - [512, 4096, 1, 8192, 512, 512, 8192, 4096]
    - [17, 21.671]
  - - [512, 8192, 1, 128, 512, 512, 128, 8192]
    - [1, 8.185]
  - - [512, 8192, 1, 256, 512, 512, 256, 8192]
    - [68, 12.752]
  - - [512, 8192, 1, 512, 512, 512, 512, 8192]
    - [73, 17.397]
  - - [512, 8192, 1, 1024, 512, 512, 1024, 8192]
    - [106, 16.662]
  - - [512, 8192, 1, 2048, 512, 512, 2048, 8192]
    - [95, 20.144]
  - - [512, 8192, 1, 4096, 512, 512, 4096, 8192]
    - [13, 23.689]
  - - [512, 8192, 1, 8192, 512, 512, 8192, 8192]
    - [12, 25.976]
  - - [1024, 128, 1, 128, 1024, 1024, 128, 128]
    - [35, 0.667]
  - - [1024, 128, 1, 256, 1024, 1024, 256, 128]
    - [112, 1.185]
  - - [1024, 128, 1, 512, 1024, 1024, 512, 128]
    - [50, 2.01]
  - - [1024, 128, 1, 1024, 1024, 1024, 1024, 128]
    - [49, 3.046]
  - - [1024, 128, 1, 2048, 1024, 1024, 2048, 128]
    - [47, 4.028]
  - - [1024, 128, 1, 4096, 1024, 1024, 4096, 128]
    - [128, 5.993]
  - - [1024, 128, 1, 8192, 1024, 1024, 8192, 128]
    - [127, 8.618]
  - - [1024, 256, 1, 128, 1024, 1024, 128, 256]
    - [33, 1.234]
  - - [1024, 256, 1, 256, 1024, 1024, 256, 256]
    - [34, 2.169]
  - - [1024, 256, 1, 512, 1024, 1024, 512, 256]
    - [47, 3.584]
  - - [1024, 256, 1, 1024, 1024, 1024, 1024, 256]
    - [47, 5.357]
  - - [1024, 256, 1, 2048, 1024, 1024, 2048, 256]
    - [127, 6.812]
  - - [1024, 256, 1, 4096, 1024, 1024, 4096, 256]
    - [126, 9.532]
  - - [1024, 256, 1, 8192, 1024, 1024, 8192, 256]
    - [123, 12.575]
  - - [1024, 512, 1, 128, 1024, 1024, 128, 512]
    - [32, 2.215]
  - - [1024, 512, 1, 256, 1024, 1024, 256, 512]
    - [43, 3.833]
  - - [1024, 512, 1, 512, 1024, 1024, 512, 512]
    - [43, 6.219]
  - - [1024, 512, 1, 1024, 1024, 1024, 1024, 512]
    - [43, 9.074]
  - - [1024, 512, 1, 2048, 1024, 1024, 2048, 512]
    - [127, 10.615]
  - - [1024, 512, 1, 4096, 1024, 1024, 4096, 512]
    - [23, 12.812]
  - - [1024, 512, 1, 8192, 1024, 1024, 8192, 512]
    - [123, 14.737]
  - - [1024, 1024, 1, 128, 1024, 1024, 128, 1024]
    - [28, 3.693]
  - - [1024, 1024, 1, 256, 1024, 1024, 256, 1024]
    - [28, 6.27]
  - - [1024, 1024, 1, 512, 1024, 1024, 512, 1024]
    - [40, 9.764]
  - - [1024, 1024, 1, 1024, 1024, 1024, 1024, 1024]
    - [41, 13.779]
  - - [1024, 1024, 1, 2048, 1024, 1024, 2048, 1024]
    - [109, 13.361]
  - - [1024, 1024, 1, 4096, 1024, 1024, 4096, 1024]
    - [101, 15.651]
  - - [1024, 1024, 1, 8192, 1024, 1024, 8192, 1024]
    - [83, 17.763]
  - - [1024, 2048, 1, 128, 1024, 1024, 128, 2048]
    - [22, 5.655]
  - - [1024, 2048, 1, 256, 1024, 1024, 256, 2048]
    - [88, 9.554]
  - - [1024, 2048, 1, 512, 1024, 1024, 512, 2048]
    - [88, 14.603]
  - - [1024, 2048, 1, 1024, 1024, 1024, 1024, 2048]
    - [105, 14.366]
  - - [1024, 2048, 1, 2048, 1024, 1024, 2048, 2048]
    - [122, 16.108]
  - - [1024, 2048, 1, 4096, 1024, 1024, 4096, 2048]
    - [81, 18.946]
  - - [1024, 2048, 1, 8192, 1024, 1024, 8192, 2048]
    - [18, 21.215]
  - - [1024, 4096, 1, 128, 1024, 1024, 128, 4096]
    - [71, 8.14]
  - - [1024, 4096, 1, 256, 1024, 1024, 256, 4096]
    - [69, 12.723]
  - - [1024, 4096, 1, 512, 1024, 1024, 512, 4096]
    - [80, 17.259]
  - - [1024, 4096, 1, 1024, 1024, 1024, 1024, 4096]
    - [90, 17.066]
  - - [1024, 4096, 1, 2048, 1024, 1024, 2048, 4096]
    - [100, 19.778]
  - - [1024, 4096, 1, 4096, 1024, 1024, 4096, 4096]
    - [18, 22.31]
  - - [1024, 4096, 1, 8192, 1024, 1024, 8192, 4096]
    - [16, 24.294]
  - - [1024, 8192, 1, 128, 1024, 1024, 128, 8192]
    - [58, 9.399]
  - - [1024, 8192, 1, 256, 1024, 1024, 256, 8192]
    - [58, 14.542]
  - - [1024, 8192, 1, 512, 1024, 1024, 512, 8192]
    - [97, 15.815]
  - - [1024, 8192, 1, 1024, 1024, 1024, 1024, 8192]
    - [89, 20.567]
  - - [1024, 8192, 1, 2048, 1024, 1024, 2048, 8192]
    - [81, 23.721]
  - - [1024, 8192, 1, 4096, 1024, 1024, 4096, 8192]
    - [13, 24.9]
  - - [1024, 8192, 1, 8192, 1024, 1024, 8192, 8192]
    - [57, 26.246]
  - - [2048, 128, 1, 128, 2048, 2048, 128, 128]
    - [34, 1.243]
  - - [2048, 128, 1, 256, 2048, 2048, 256, 128]
    - [34, 2.181]
  - - [2048, 128, 1, 512, 2048, 2048, 512, 128]
    - [47, 3.631]
  - - [2048, 128, 1, 1024, 2048, 2048, 1024, 128]
    - [47, 5.381]
  - - [2048, 128, 1, 2048, 2048, 2048, 2048, 128]
    - [125, 6.823]
  - - [2048, 128, 1, 4096, 2048, 2048, 4096, 128]
    - [127, 9.467]
  - - [2048, 128, 1, 8192, 2048, 2048, 8192, 128]
    - [120, 12.417]
  - - [2048, 256, 1, 128, 2048, 2048, 128, 256]
    - [4, 2.213]
  - - [2048, 256, 1, 256, 2048, 2048, 256, 256]
    - [43, 3.874]
  - - [2048, 256, 1, 512, 2048, 2048, 512, 256]
    - [43, 6.215]
  - - [2048, 256, 1, 1024, 2048, 2048, 1024, 256]
    - [46, 8.947]
  - - [2048, 256, 1, 2048, 2048, 2048, 2048, 256]
    - [126, 10.562]
  - - [2048, 256, 1, 4096, 2048, 2048, 4096, 256]
    - [114, 13.089]
  - - [2048, 256, 1, 8192, 2048, 2048, 8192, 256]
    - [96, 15.499]
  - - [2048, 512, 1, 128, 2048, 2048, 128, 512]
    - [26, 3.712]
  - - [2048, 512, 1, 256, 2048, 2048, 256, 512]
    - [26, 6.262]
  - - [2048, 512, 1, 512, 2048, 2048, 512, 512]
    - [39, 9.793]
  - - [2048, 512, 1, 1024, 2048, 2048, 1024, 512]
    - [119, 13.734]
  - - [2048, 512, 1, 2048, 2048, 2048, 2048, 512]
    - [127, 14.252]
  - - [2048, 512, 1, 4096, 2048, 2048, 4096, 512]
    - [101, 15.82]
  - - [2048, 512, 1, 8192, 2048, 2048, 8192, 512]
    - [82, 17.687]
  - - [2048, 1024, 1, 128, 2048, 2048, 128, 1024]
    - [88, 5.633]
  - - [2048, 1024, 1, 256, 2048, 2048, 256, 1024]
    - [88, 9.639]
  - - [2048, 1024, 1, 512, 2048, 2048, 512, 1024]
    - [95, 14.633]
  - - [2048, 1024, 1, 1024, 2048, 2048, 1024, 1024]
    - [121, 14.257]
  - - [2048, 1024, 1, 2048, 2048, 2048, 2048, 1024]
    - [103, 15.651]
  - - [2048, 1024, 1, 4096, 2048, 2048, 4096, 1024]
    - [81, 18.678]
  - - [2048, 1024, 1, 8192, 2048, 2048, 8192, 1024]
    - [15, 20.371]
  - - [2048, 2048, 1, 128, 2048, 2048, 128, 2048]
    - [65, 7.944]
  - - [2048, 2048, 1, 256, 2048, 2048, 256, 2048]
    - [65, 12.528]
  - - [2048, 2048, 1, 512, 2048, 2048, 512, 2048]
    - [14, 17.268]
  - - [2048, 2048, 1, 1024, 2048, 2048, 1024, 2048]
    - [101, 16.825]
  - - [2048, 2048, 1, 2048, 2048, 2048, 2048, 2048]
    - [99, 20.277]
  - - [2048, 2048, 1, 4096, 2048, 2048, 4096, 2048]
    - [74, 21.133]
  - - [2048, 2048, 1, 8192, 2048, 2048, 8192, 2048]
    - [62, 23.548]
  - - [2048, 4096, 1, 128, 2048, 2048, 128, 4096]
    - [56, 9.372]
  - - [2048, 4096, 1, 256, 2048, 2048, 256, 4096]
    - [56, 14.367]
  - - [2048, 4096, 1, 512, 2048, 2048, 512, 4096]
    - [91, 15.757]
  - - [2048, 4096, 1, 1024, 2048, 2048, 1024, 4096]
    - [89, 20.396]
  - - [2048, 4096, 1, 2048, 2048, 2048, 2048, 4096]
    - [74, 23.359]
  - - [2048, 4096, 1, 4096, 2048, 2048, 4096, 4096]
    - [89, 24.746]
  - - [2048, 4096, 1, 8192, 2048, 2048, 8192, 4096]
    - [60, 25.84]
  - - [2048, 8192, 1, 128, 2048, 2048, 128, 8192]
    - [87, 8.791]
  - - [2048, 8192, 1, 256, 2048, 2048, 256, 8192]
    - [92, 13.381]
  - - [2048, 8192, 1, 512, 2048, 2048, 512, 8192]
    - [96, 18.35]
  - - [2048, 8192, 1, 1024, 2048, 2048, 1024, 8192]
    - [75, 22.311]
  - - [2048, 8192, 1, 2048, 2048, 2048, 2048, 8192]
    - [77, 24.405]
  - - [2048, 8192, 1, 4096, 2048, 2048, 4096, 8192]
    - [63, 27.803]
  - - [2048, 8192, 1, 8192, 2048, 2048, 8192, 8192]
    - [64, 28.463]
  - - [4096, 128, 1, 128, 4096, 4096, 128, 128]
    - [43, 2.226]
  - - [4096, 128, 1, 256, 4096, 4096, 256, 128]
    - [32, 3.902]
  - - [4096, 128, 1, 512, 4096, 4096, 512, 128]
    - [43, 6.223]
  - - [4096, 128, 1, 1024, 4096, 4096, 1024, 128]
    - [46, 8.989]
  - - [4096, 128, 1, 2048, 4096, 4096, 2048, 128]
    - [123, 10.641]
  - - [4096, 128, 1, 4096, 4096, 4096, 4096, 128]
    - [23, 13.147]
  - - [4096, 128, 1, 8192, 4096, 4096, 8192, 128]
    - [113, 15.445]
  - - [4096, 256, 1, 128, 4096, 4096, 128, 256]
    - [117, 3.657]
  - - [4096, 256, 1, 256, 4096, 4096, 256, 256]
    - [105, 6.287]
  - - [4096, 256, 1, 512, 4096, 4096, 512, 256]
    - [117, 9.712]
  - - [4096, 256, 1, 1024, 4096, 4096, 1024, 256]
    - [122, 13.673]
  - - [4096, 256, 1, 2048, 4096, 4096, 2048, 256]
    - [123, 13.96]
  - - [4096, 256, 1, 4096, 4096, 4096, 4096, 256]
    - [101, 16.37]
  - - [4096, 256, 1, 8192, 4096, 4096, 8192, 256]
    - [75, 17.958]
  - - [4096, 512, 1, 128, 4096, 4096, 128, 512]
    - [86, 5.554]
  - - [4096, 512, 1, 256, 4096, 4096, 256, 512]
    - [95, 9.434]
  - - [4096, 512, 1, 512, 4096, 4096, 512, 512]
    - [99, 14.592]
  - - [4096, 512, 1, 1024, 4096, 4096, 1024, 512]
    - [122, 14.597]
  - - [4096, 512, 1, 2048, 4096, 4096, 2048, 512]
    - [115, 17.103]
  - - [4096, 512, 1, 4096, 4096, 4096, 4096, 512]
    - [84, 19.16]
  - - [4096, 512, 1, 8192, 4096, 4096, 8192, 512]
    - [67, 20.503]
  - - [4096, 1024, 1, 128, 4096, 4096, 128, 1024]
    - [71, 8.078]
  - - [4096, 1024, 1, 256, 4096, 4096, 256, 1024]
    - [71, 12.41]
  - - [4096, 1024, 1, 512, 4096, 4096, 512, 1024]
    - [14, 17.197]
  - - [4096, 1024, 1, 1024, 4096, 4096, 1024, 1024]
    - [96, 16.932]
  - - [4096, 1024, 1, 2048, 4096, 4096, 2048, 1024]
    - [99, 20.305]
  - - [4096, 1024, 1, 4096, 4096, 4096, 4096, 1024]
    - [63, 21.466]
  - - [4096, 1024, 1, 8192, 4096, 4096, 8192, 1024]
    - [57, 23.672]
  - - [4096, 2048, 1, 128, 4096, 4096, 128, 2048]
    - [56, 9.314]
  - - [4096, 2048, 1, 256, 4096, 4096, 256, 2048]
    - [56, 14.416]
  - - [4096, 2048, 1, 512, 4096, 4096, 512, 2048]
    - [94, 15.862]
  - - [4096, 2048, 1, 1024, 4096, 4096, 1024, 2048]
    - [100, 20.321]
  - - [4096, 2048, 1, 2048, 4096, 4096, 2048, 2048]
    - [75, 23.493]
  - - [4096, 2048, 1, 4096, 4096, 4096, 4096, 2048]
    - [53, 24.54]
  - - [4096, 2048, 1, 8192, 4096, 4096, 8192, 2048]
    - [52, 25.784]
  - - [4096, 4096, 1, 128, 4096, 4096, 128, 4096]
    - [28, 8.671]
  - - [4096, 4096, 1, 256, 4096, 4096, 256, 4096]
    - [86, 13.467]
  - - [4096, 4096, 1, 512, 4096, 4096, 512, 4096]
    - [93, 18.688]
  - - [4096, 4096, 1, 1024, 4096, 4096, 1024, 4096]
    - [75, 22.01]
  - - [4096, 4096, 1, 2048, 4096, 4096, 2048, 4096]
    - [10, 24.857]
  - - [4096, 4096, 1, 4096, 4096, 4096, 4096, 4096]
    - [73, 28.208]
  - - [4096, 4096, 1, 8192, 4096, 4096, 8192, 4096]
    - [54, 28.836]
  - - [4096, 8192, 1, 128, 4096, 4096, 128, 8192]
    - [89, 10.303]
  - - [4096, 8192, 1, 256, 4096, 4096, 256, 8192]
    - [74, 14.885]
  - - [4096, 8192, 1, 512, 4096, 4096, 512, 8192]
    - [72, 19.512]
  - - [4096, 8192, 1, 1024, 4096, 4096, 1024, 8192]
    - [77, 23.737]
  - - [4096, 8192, 1, 2048, 4096, 4096, 2048, 8192]
    - [7, 27.722]
  - - [4096, 8192, 1, 4096, 4096, 4096, 4096, 8192]
    - [53, 31.052]
  - - [4096, 8192, 1, 8192, 4096, 4096, 8192, 8192]
    - [62, 33.522]
  - - [8192, 128, 1, 128, 8192, 8192, 128, 128]
    - [3, 3.677]
  - - [8192, 128, 1, 256, 8192, 8192, 256, 128]
    - [105, 6.203]
  - - [8192, 128, 1, 512, 8192, 8192, 512, 128]
    - [117, 9.575]
  - - [8192, 128, 1, 1024, 8192, 8192, 1024, 128]
    - [120, 13.369]
  - - [8192, 128, 1, 2048, 8192, 8192, 2048, 128]
    - [108, 13.186]
  - - [8192, 128, 1, 4096, 8192, 8192, 4096, 128]
    - [27, 16.281]
  - - [8192, 128, 1, 8192, 8192, 8192, 8192, 128]
    - [24, 18.841]
  - - [8192, 256, 1, 128, 8192, 8192, 128, 256]
    - [22, 5.518]
  - - [8192, 256, 1, 256, 8192, 8192, 256, 256]
    - [95, 9.413]
  - - [8192, 256, 1, 512, 8192, 8192, 512, 256]
    - [99, 14.498]
  - - [8192, 256, 1, 1024, 8192, 8192, 1024, 256]
    - [108, 14.422]
  - - [8192, 256, 1, 2048, 8192, 8192, 2048, 256]
    - [115, 16.997]
  - - [8192, 256, 1, 4096, 8192, 8192, 4096, 256]
    - [85, 20.215]
  - - [8192, 256, 1, 8192, 8192, 8192, 8192, 256]
    - [7, 23.196]
  - - [8192, 512, 1, 128, 8192, 8192, 128, 512]
    - [70, 7.852]
  - - [8192, 512, 1, 256, 8192, 8192, 256, 512]
    - [66, 12.151]
  - - [8192, 512, 1, 512, 8192, 8192, 512, 512]
    - [76, 17.087]
  - - [8192, 512, 1, 1024, 8192, 8192, 1024, 512]
    - [97, 17.292]
  - - [8192, 512, 1, 2048, 8192, 8192, 2048, 512]
    - [96, 21.046]
  - - [8192, 512, 1, 4096, 8192, 8192, 4096, 512]
    - [8, 23.953]
  - - [8192, 512, 1, 8192, 8192, 8192, 8192, 512]
    - [6, 25.267]
  - - [8192, 1024, 1, 128, 8192, 8192, 128, 1024]
    - [59, 9.342]
  - - [8192, 1024, 1, 256, 8192, 8192, 256, 1024]
    - [55, 14.094]
  - - [8192, 1024, 1, 512, 8192, 8192, 512, 1024]
    - [97, 15.732]
  - - [8192, 1024, 1, 1024, 8192, 8192, 1024, 1024]
    - [95, 20.292]
  - - [8192, 1024, 1, 2048, 8192, 8192, 2048, 1024]
    - [11, 23.105]
  - - [8192, 1024, 1, 4096, 8192, 8192, 4096, 1024]
    - [7, 25.081]
  - - [8192, 1024, 1, 8192, 8192, 8192, 8192, 1024]
    - [7, 26.323]
  - - [8192, 2048, 1, 128, 8192, 8192, 128, 2048]
    - [21, 8.561]
  - - [8192, 2048, 1, 256, 8192, 8192, 256, 2048]
    - [95, 13.12]
  - - [8192, 2048, 1, 512, 8192, 8192, 512, 2048]
    - [67, 18.131]
  - - [8192, 2048, 1, 1024, 8192, 8192, 1024, 2048]
    - [99, 22.017]
  - - [8192, 2048, 1, 2048, 8192, 8192, 2048, 2048]
    - [9, 24.966]
  - - [8192, 2048, 1, 4096, 8192, 8192, 4096, 2048]
    - [7, 28.359]
  - - [8192, 2048, 1, 8192, 8192, 8192, 8192, 2048]
    - [7, 28.558]
  - - [8192, 4096, 1, 128, 8192, 8192, 128, 4096]
    - [21, 10.228]
  - - [8192, 4096, 1, 256, 8192, 8192, 256, 4096]
    - [73, 14.57]
  - - [8192, 4096, 1, 512, 8192, 8192, 512, 4096]
    - [75, 19.145]
  - - [8192, 4096, 1, 1024, 8192, 8192, 1024, 4096]
    - [77, 23.725]
  - - [8192, 4096, 1, 2048, 8192, 8192, 2048, 4096]
    - [6, 28.355]
  - - [8192, 4096, 1, 4096, 8192, 8192, 4096, 4096]
    - [0, 31.073]
  - - [8192, 4096, 1, 8192, 8192, 8192, 8192, 4096]
    - [57, 32.487]
  - - [8192, 8192, 1, 128, 8192, 8192, 128, 8192]
    - [79, 10.396]
  - - [8192, 8192, 1, 256, 8192, 8192, 256, 8192]
    - [5, 14.813]
  - - [8192, 8192, 1, 512, 8192, 8192, 512, 8192]
    - [74, 20.382]
  - - [8192, 8192, 1, 1024, 8192, 8192, 1024, 8192]
    - [78, 25.237]
  - - [8192, 8192, 1, 2048, 8192, 8192, 2048, 8192]
    - [60, 31.155]
  - - [8192, 8192, 1, 4096, 8192, 8192, 4096, 8192]
    - [60, 33.035]
  - - [8192, 8192, 1, 8192, 8192, 8192, 8192, 8192]
    - [61, 36.461]
  - - [1, 1, 1, 32, 1, 1, 32, 1]
    - [130, 0.0]
- null
- null
- ExperimentalStreamK
- GridBased
