library/src/amd_detail/rocblaslt/src/Tensile/Logic/asm_full/aquavanjaram/gfx942_228cu/StreamK/aquavanjaram942_Cijk_Ailk_Bljk_BBS_BH_UserArgs.yaml
- {MinimumRequiredVersion: 4.33.0}
- aquavanjaram942
- {Architecture: gfx942, CUCount: 228}
- [Device 0049, Device 0050]
    SolutionIndex: 0
    SolutionNameMin: Cijk_Ailk_Bljk_BBS_BH_UserArgs_MT256x256x32_MI16x16x1_SN_LDSB1_CLR1_GSU0_GSUC0_GSUWGMRR0_K1_LBSPPA2048_LBSPPB256_LPA0_MIWT8_8_PLR1_SU32_SUM0_SUS256_SKXCCM0_VWA8_VWB4_WGM1_WGMXCC1_WGMXCCGn1
    SolutionIndex: 1
    SolutionNameMin: Cijk_Ailk_Bljk_BBS_BH_UserArgs_MT256x256x32_MI16x16x1_SN_LDSB1_CLR1_GSU0_GSUC0_GSUWGMRR0_K1_LBSPPA2048_LBSPPB512_LPA0_MIWT8_8_PLR1_SU32_SUM0_SUS256_SKXCCM0_VWA8_VWB8_WGM1_WGMXCC1_WGMXCCGn1
    SolutionIndex: 2
    SolutionNameMin: Cijk_Ailk_Bljk_BBS_BH_UserArgs_MT256x256x32_MI16x16x1_SN_LDSB1_CLR1_GSU0_GSUC0_GSUWGMRR0_K1_LBSPPA2048_LBSPPB512_LPA32_MIWT8_8_PLR1_SU32_SUM0_SUS256_SKXCCM0_VWA2_VWB8_WGM8_WGMXCC1_WGMXCCGn1
    SolutionIndex: 3
    SolutionNameMin: Cijk_Ailk_Bljk_BBS_BH_UserArgs_MT256x128x32_MI16x16x1_SN_LDSB1_CLR1_GSU0_GSUC0_GSUWGMRR0_K1_LBSPPA2048_LBSPPB256_LPA0_MIWT8_4_PLR1_SU32_SUM0_SUS256_SKXCCM0_VWA8_VWB4_WGM4_WGMXCC1_WGMXCCGn1
    SolutionIndex: 4
    SolutionNameMin: Cijk_Ailk_Bljk_BBS_BH_UserArgs_MT256x128x32_MI16x16x1_SN_LDSB1_CLR1_GSU0_GSUC0_GSUWGMRR0_K1_LBSPPA2048_LBSPPB128_LPA0_MIWT8_4_PLR1_SU32_SUM0_SUS256_SKXCCM0_VWA8_VWB2_WGM8_WGMXCC1_WGMXCCGn1
    SolutionIndex: 5
    SolutionNameMin: Cijk_Ailk_Bljk_BBS_BH_UserArgs_MT256x128x32_MI16x16x1_SN_LDSB1_CLR1_GSU0_GSUC0_GSUWGMRR0_K1_LBSPPA2048_LBSPPB256_LPA0_MIWT8_4_PLR1_SU32_SUM0_SUS256_SKXCCM0_VWA8_VWB4_WGM8_WGMXCC1_WGMXCCGn1
    SolutionIndex: 6
    SolutionNameMin: Cijk_Ailk_Bljk_BBS_BH_UserArgs_MT256x64x32_MI16x16x1_SN_LDSB1_CLR1_GSU0_GSUC0_GSUWGMRR0_K1_LBSPPA2048_LBSPPB128_LPA0_MIWT8_2_PLR1_SU32_SUM0_SUS256_SKXCCM0_VWA8_VWB1_WGM8_WGMXCC1_WGMXCCGn1
    SolutionIndex: 7
    SolutionNameMin: Cijk_Ailk_Bljk_BBS_BH_UserArgs_MT128x64x32_MI16x16x1_SN_LDSB0_CLR1_GSU0_GSUC0_GSUWGMRR0_K1_LBSPPA1024_LBSPPB128_LPA0_MIWT4_2_PLR1_SU32_SUM0_SUS256_SKXCCM0_VWA4_VWB2_WGM1_WGMXCC1_WGMXCCGn1
    SolutionIndex: 8
    SolutionNameMin: Cijk_Ailk_Bljk_BBS_BH_UserArgs_MT128x256x64_MI16x16x1_SN_LDSB1_CLR1_GSU0_GSUC0_GSUWGMRR0_K1_LBSPPA2048_LBSPPB128_LPA0_MIWT4_8_PLR1_SU32_SUM0_SUS256_SKXCCM0_VWA4_VWB1_WGM1_WGMXCC1_WGMXCCGn1
    SolutionIndex: 9
    SolutionNameMin: Cijk_Ailk_Bljk_BBS_BH_UserArgs_MT128x256x64_MI16x16x1_SN_LDSB1_CLR1_GSU0_GSUC0_GSUWGMRR0_K1_LBSPPA2048_LBSPPB256_LPA0_MIWT4_8_PLR1_SU32_SUM0_SUS256_SKXCCM0_VWA4_VWB2_WGM1_WGMXCC1_WGMXCCGn1
    SolutionIndex: 10
    SolutionNameMin: Cijk_Ailk_Bljk_BBS_BH_UserArgs_MT128x256x64_MI16x16x1_SN_LDSB1_CLR1_GSU0_GSUC0_GSUWGMRR0_K1_LBSPPA2048_LBSPPB512_LPA0_MIWT4_8_PLR1_SU32_SUM0_SUS256_SKXCCM0_VWA4_VWB4_WGM1_WGMXCC1_WGMXCCGn1
    SolutionIndex: 11
    SolutionNameMin: Cijk_Ailk_Bljk_BBS_BH_UserArgs_MT128x256x64_MI16x16x1_SN_LDSB1_CLR1_GSU0_GSUC0_GSUWGMRR0_K1_LBSPPA2048_LBSPPB256_LPA0_MIWT4_8_PLR1_SU32_SUM0_SUS256_SKXCCM0_VWA4_VWB2_WGM8_WGMXCC1_WGMXCCGn1
    SolutionIndex: 12
    SolutionNameMin: Cijk_Ailk_Bljk_BBS_BH_UserArgs_MT256x128x64_MI16x16x1_SN_LDSB1_CLR1_GSU0_GSUC0_GSUWGMRR0_K1_LBSPPA4096_LBSPPB256_LPA0_MIWT8_4_PLR1_SU32_SUM0_SUS256_SKXCCM0_VWA4_VWB2_WGM1_WGMXCC1_WGMXCCGn1
    SolutionIndex: 13
    SolutionNameMin: Cijk_Ailk_Bljk_BBS_BH_UserArgs_MT256x128x64_MI16x16x1_SN_LDSB1_CLR1_GSU0_GSUC0_GSUWGMRR0_K1_LBSPPA4096_LBSPPB512_LPA0_MIWT8_4_PLR1_SU32_SUM0_SUS256_SKXCCM0_VWA8_VWB4_WGM1_WGMXCC1_WGMXCCGn1
    SolutionIndex: 14
    SolutionNameMin: Cijk_Ailk_Bljk_BBS_BH_UserArgs_MT256x128x64_MI16x16x1_SN_LDSB1_CLR1_GSU0_GSUC0_GSUWGMRR0_K1_LBSPPA4096_LBSPPB128_LPA0_MIWT8_4_PLR1_SU32_SUM0_SUS256_SKXCCM0_VWA4_VWB1_WGM4_WGMXCC1_WGMXCCGn1
    SolutionIndex: 15
    SolutionNameMin: Cijk_Ailk_Bljk_BBS_BH_UserArgs_MT256x128x64_MI16x16x1_SN_LDSB1_CLR1_GSU0_GSUC0_GSUWGMRR0_K1_LBSPPA4096_LBSPPB256_LPA32_MIWT8_4_PLR1_SU32_SUM0_SUS256_SKXCCM0_VWA2_VWB2_WGM4_WGMXCC1_WGMXCCGn1
    SolutionIndex: 16
    SolutionNameMin: Cijk_Ailk_Bljk_BBS_BH_UserArgs_MT256x128x64_MI16x16x1_SN_LDSB1_CLR1_GSU0_GSUC0_GSUWGMRR0_K1_LBSPPA4096_LBSPPB512_LPA0_MIWT8_4_PLR1_SU32_SUM0_SUS256_SKXCCM0_VWA4_VWB4_WGM4_WGMXCC1_WGMXCCGn1
    SolutionIndex: 17
    SolutionNameMin: Cijk_Ailk_Bljk_BBS_BH_UserArgs_MT256x128x64_MI16x16x1_SN_LDSB1_CLR1_GSU0_GSUC0_GSUWGMRR0_K1_LBSPPA4096_LBSPPB128_LPA0_MIWT8_4_PLR1_SU32_SUM0_SUS256_SKXCCM0_VWA4_VWB1_WGM8_WGMXCC1_WGMXCCGn1
    SolutionIndex: 18
    SolutionNameMin: Cijk_Ailk_Bljk_BBS_BH_UserArgs_MT256x128x64_MI16x16x1_SN_LDSB1_CLR1_GSU0_GSUC0_GSUWGMRR0_K1_LBSPPA4096_LBSPPB256_LPA0_MIWT8_4_PLR1_SU32_SUM0_SUS256_SKXCCM0_VWA4_VWB2_WGM8_WGMXCC1_WGMXCCGn1
    SolutionIndex: 19
    SolutionNameMin: Cijk_Ailk_Bljk_BBS_BH_UserArgs_MT256x128x64_MI16x16x1_SN_LDSB1_CLR1_GSU0_GSUC0_GSUWGMRR0_K1_LBSPPA4096_LBSPPB512_LPA0_MIWT8_4_PLR1_SU32_SUM0_SUS256_SKXCCM0_VWA4_VWB4_WGM8_WGMXCC1_WGMXCCGn1
    SolutionIndex: 20
    SolutionNameMin: Cijk_Ailk_Bljk_BBS_BH_UserArgs_MT64x256x64_MI16x16x1_SN_LDSB1_CLR1_GSU0_GSUC0_GSUWGMRR0_K1_LBSPPA1024_LBSPPB1024_LPA32_MIWT2_8_PLR1_SU32_SUM0_SUS256_SKXCCM0_VWA2_VWB8_WGM4_WGMXCC1_WGMXCCGn1
    SolutionIndex: 21
    SolutionNameMin: Cijk_Ailk_Bljk_BBS_BH_UserArgs_MT64x256x64_MI16x16x1_SN_LDSB1_CLR1_GSU0_GSUC0_GSUWGMRR0_K1_LBSPPA1024_LBSPPB1024_LPA32_MIWT2_8_PLR1_SU32_SUM0_SUS256_SKXCCM0_VWA2_VWB8_WGM8_WGMXCC1_WGMXCCGn1
    SolutionIndex: 22
    SolutionNameMin: Cijk_Ailk_Bljk_BBS_BH_UserArgs_MT256x64x64_MI16x16x1_SN_LDSB1_CLR1_GSU0_GSUC0_GSUWGMRR0_K1_LBSPPA4096_LBSPPB128_LPA0_MIWT8_2_PLR1_SU32_SUM0_SUS256_SKXCCM0_VWA4_VWB1_WGM1_WGMXCC1_WGMXCCGn1
    SolutionIndex: 23
    SolutionNameMin: Cijk_Ailk_Bljk_BBS_BH_UserArgs_MT256x64x64_MI16x16x1_SN_LDSB1_CLR1_GSU0_GSUC0_GSUWGMRR0_K1_LBSPPA4096_LBSPPB256_LPA0_MIWT8_2_PLR1_SU32_SUM0_SUS256_SKXCCM0_VWA8_VWB2_WGM4_WGMXCC1_WGMXCCGn1
    SolutionIndex: 24
    SolutionNameMin: Cijk_Ailk_Bljk_BBS_BH_UserArgs_MT128x128x64_MI16x16x1_SN_LDSB1_CLR1_GSU0_GSUC0_GSUWGMRR0_K1_LBSPPA2048_LBSPPB256_LPA32_MIWT4_4_PLR1_SU32_SUM0_SUS256_SKXCCM0_VWA2_VWB2_WGM1_WGMXCC1_WGMXCCGn1
    SolutionIndex: 25
    SolutionNameMin: Cijk_Ailk_Bljk_BBS_BH_UserArgs_MT128x128x64_MI16x16x1_SN_LDSB1_CLR1_GSU0_GSUC0_GSUWGMRR0_K1_LBSPPA2048_LBSPPB512_LPA32_MIWT4_4_PLR1_SU32_SUM0_SUS256_SKXCCM0_VWA2_VWB4_WGM1_WGMXCC1_WGMXCCGn1
    SolutionIndex: 26
    SolutionNameMin: Cijk_Ailk_Bljk_BBS_BH_UserArgs_MT128x128x64_MI16x16x1_SN_LDSB1_CLR1_GSU0_GSUC0_GSUWGMRR0_K1_LBSPPA2048_LBSPPB256_LPA0_MIWT4_4_PLR1_SU32_SUM0_SUS256_SKXCCM0_VWA4_VWB2_WGM4_WGMXCC1_WGMXCCGn1
    SolutionIndex: 27
    SolutionNameMin: Cijk_Ailk_Bljk_BBS_BH_UserArgs_MT128x128x64_MI16x16x1_SN_LDSB1_CLR1_GSU0_GSUC0_GSUWGMRR0_K1_LBSPPA2048_LBSPPB128_LPA0_MIWT4_4_PLR2_SU32_SUM0_SUS256_SKXCCM0_VWA4_VWB1_WGM4_WGMXCC1_WGMXCCGn1
    SolutionIndex: 28
    SolutionNameMin: Cijk_Ailk_Bljk_BBS_BH_UserArgs_MT128x128x64_MI16x16x1_SN_LDSB1_CLR1_GSU0_GSUC0_GSUWGMRR0_K1_LBSPPA2048_LBSPPB512_LPA32_MIWT4_4_PLR1_SU32_SUM0_SUS256_SKXCCM0_VWA2_VWB4_WGM8_WGMXCC1_WGMXCCGn1
    SolutionIndex: 29
    SolutionNameMin: Cijk_Ailk_Bljk_BBS_BH_UserArgs_MT64x128x64_MI16x16x1_SN_LDSB1_CLR1_GSU0_GSUC0_GSUWGMRR0_K1_LBSPPA1024_LBSPPB256_LPA32_MIWT2_4_PLR1_SU32_SUM0_SUS256_SKXCCM0_VWA2_VWB2_WGM1_WGMXCC1_WGMXCCGn1
    SolutionIndex: 30
    SolutionNameMin: Cijk_Ailk_Bljk_BBS_BH_UserArgs_MT64x128x64_MI16x16x1_SN_LDSB1_CLR1_GSU0_GSUC0_GSUWGMRR0_K1_LBSPPA1024_LBSPPB512_LPA32_MIWT2_4_PLR1_SU32_SUM0_SUS256_SKXCCM0_VWA2_VWB4_WGM1_WGMXCC1_WGMXCCGn1
    SolutionIndex: 31
    SolutionNameMin: Cijk_Ailk_Bljk_BBS_BH_UserArgs_MT128x64x64_MI16x16x1_SN_LDSB1_CLR1_GSU0_GSUC0_GSUWGMRR0_K1_LBSPPA2048_LBSPPB128_LPA0_MIWT4_2_PLR1_SU32_SUM0_SUS256_SKXCCM0_VWA4_VWB1_WGM1_WGMXCC1_WGMXCCGn1
    SolutionIndex: 32
    SolutionNameMin: Cijk_Ailk_Bljk_BBS_BH_UserArgs_MT128x64x64_MI16x16x1_SN_LDSB1_CLR1_GSU0_GSUC0_GSUWGMRR0_K1_LBSPPA2048_LBSPPB256_LPA0_MIWT4_2_PLR1_SU32_SUM0_SUS256_SKXCCM0_VWA4_VWB2_WGM1_WGMXCC1_WGMXCCGn1
    SolutionIndex: 33
    SolutionNameMin: Cijk_Ailk_Bljk_BBS_BH_UserArgs_MT128x64x64_MI16x16x1_SN_LDSB1_CLR1_GSU0_GSUC0_GSUWGMRR0_K1_LBSPPA2048_LBSPPB128_LPA0_MIWT4_2_PLR1_SU32_SUM0_SUS256_SKXCCM0_VWA4_VWB1_WGM4_WGMXCC1_WGMXCCGn1
    SolutionIndex: 34
    SolutionNameMin: Cijk_Ailk_Bljk_BBS_BH_UserArgs_MT64x64x64_MI16x16x1_SN_LDSB1_CLR1_GSU0_GSUC0_GSUWGMRR0_K1_LBSPPA1024_LBSPPB128_LPA32_MIWT2_2_PLR1_SU32_SUM0_SUS256_SKXCCM0_VWA2_VWB1_WGM1_WGMXCC1_WGMXCCGn1
    SolutionIndex: 35
    SolutionNameMin: Cijk_Ailk_Bljk_BBS_BH_UserArgs_MT64x64x64_MI16x16x1_SN_LDSB1_CLR1_GSU0_GSUC0_GSUWGMRR0_K1_LBSPPA1024_LBSPPB256_LPA32_MIWT2_2_PLR1_SU32_SUM0_SUS256_SKXCCM0_VWA2_VWB2_WGM1_WGMXCC1_WGMXCCGn1
    SolutionIndex: 36
    SolutionNameMin: Cijk_Ailk_Bljk_BBS_BH_UserArgs_MT32x64x64_MI16x16x1_SN_LDSB0_CLR1_GSU0_GSUC0_GSUWGMRR0_K1_LBSPPA512_LBSPPB256_LPA16_MIWT1_2_PLR1_SU32_SUM0_SUS256_SKXCCM0_VWA1_VWB2_WGM1_WGMXCC1_WGMXCCGn1
    SolutionIndex: 37
    SolutionNameMin: Cijk_Ailk_Bljk_BBS_BH_UserArgs_MT64x32x64_MI16x16x1_SN_LDSB0_CLR1_GSU0_GSUC0_GSUWGMRR0_K1_LBSPPA1024_LBSPPB128_LPA32_MIWT2_1_PLR1_SU32_SUM0_SUS256_SKXCCM0_VWA2_VWB1_WGM1_WGMXCC1_WGMXCCGn1
    SolutionIndex: 38
    SolutionNameMin: Cijk_Ailk_Bljk_BBS_BH_UserArgs_MT32x32x64_MI16x16x1_SN_LDSB0_CLR1_GSU0_GSUC0_GSUWGMRR0_K1_LBSPPA512_LBSPPB128_LPA16_MIWT1_1_PLR1_SU32_SUM0_SUS256_SKXCCM0_VWA1_VWB1_WGM1_WGMXCC1_WGMXCCGn1
    SolutionIndex: 39
    SolutionNameMin: Cijk_Ailk_Bljk_BBS_BH_UserArgs_MT32x32x64_MI16x16x1_SN_LDSB0_CLR1_GSU0_GSUC0_GSUWGMRR0_K1_LBSPPA512_LBSPPB128_LPA16_MIWT1_1_PLR1_SU32_SUM0_SUS256_SKXCCM0_VWA1_VWB1_WGM8_WGMXCC1_WGMXCCGn1
    SolutionIndex: 40
    SolutionNameMin: Cijk_Ailk_Bljk_BBS_BH_UserArgs_MT64x128x128_MI16x16x1_SN_LDSB1_CLR1_GSU0_GSUC0_GSUWGMRR0_K1_LBSPPA1024_LBSPPB256_LPA32_MIWT2_4_PLR2_SU32_SUM0_SUS256_SKXCCM0_VWA2_VWB1_WGM1_WGMXCC1_WGMXCCGn1
    SolutionIndex: 41
    SolutionNameMin: Cijk_Ailk_Bljk_BBS_BH_UserArgs_MT128x64x128_MI16x16x1_SN_LDSB1_CLR1_GSU0_GSUC0_GSUWGMRR0_K1_LBSPPA2048_LBSPPB256_LPA0_MIWT4_2_PLR1_SU32_SUM0_SUS256_SKXCCM0_VWA4_VWB1_WGM1_WGMXCC1_WGMXCCGn1
    SolutionIndex: 42
    SolutionNameMin: Cijk_Ailk_Bljk_BBS_BH_UserArgs_MT128x64x128_MI16x16x1_SN_LDSB1_CLR1_GSU0_GSUC0_GSUWGMRR0_K1_LBSPPA2048_LBSPPB256_LPA0_MIWT4_2_PLR2_SU32_SUM0_SUS256_SKXCCM0_VWA4_VWB1_WGM1_WGMXCC1_WGMXCCGn1
    SolutionIndex: 43
    SolutionNameMin: Cijk_Ailk_Bljk_BBS_BH_UserArgs_MT128x64x128_MI16x16x1_SN_LDSB1_CLR1_GSU0_GSUC0_GSUWGMRR0_K1_LBSPPA2048_LBSPPB512_LPA0_MIWT4_2_PLR2_SU32_SUM0_SUS256_SKXCCM0_VWA4_VWB2_WGM1_WGMXCC1_WGMXCCGn1
    SolutionIndex: 44
    SolutionNameMin: Cijk_Ailk_Bljk_BBS_BH_UserArgs_MT128x64x128_MI16x16x1_SN_LDSB1_CLR1_GSU0_GSUC0_GSUWGMRR0_K1_LBSPPA2048_LBSPPB256_LPA0_MIWT4_2_PLR2_SU32_SUM0_SUS256_SKXCCM0_VWA4_VWB1_WGM4_WGMXCC1_WGMXCCGn1
    SolutionIndex: 45
    SolutionNameMin: Cijk_Ailk_Bljk_BBS_BH_UserArgs_MT128x64x128_MI16x16x1_SN_LDSB1_CLR1_GSU0_GSUC0_GSUWGMRR0_K1_LBSPPA2048_LBSPPB256_LPA0_MIWT4_2_PLR2_SU32_SUM0_SUS256_SKXCCM0_VWA4_VWB1_WGM8_WGMXCC1_WGMXCCGn1
    SolutionIndex: 46
    SolutionNameMin: Cijk_Ailk_Bljk_BBS_BH_UserArgs_MT128x32x128_MI16x16x1_SN_LDSB1_CLR1_GSU0_GSUC0_GSUWGMRR0_K1_LBSPPA2048_LBSPPB256_LPA0_MIWT4_1_PLR2_SU32_SUM0_SUS256_SKXCCM0_VWA4_VWB1_WGM1_WGMXCC1_WGMXCCGn1
    SolutionIndex: 47
    SolutionNameMin: Cijk_Ailk_Bljk_BBS_BH_UserArgs_MT64x64x128_MI16x16x1_SN_LDSB1_CLR1_GSU0_GSUC0_GSUWGMRR0_K1_LBSPPA1024_LBSPPB256_LPA32_MIWT2_2_PLR2_SU32_SUM0_SUS256_SKXCCM0_VWA2_VWB1_WGM1_WGMXCC1_WGMXCCGn1
    SolutionIndex: 48
    SolutionNameMin: Cijk_Ailk_Bljk_BBS_BH_UserArgs_MT64x64x128_MI16x16x1_SN_LDSB1_CLR1_GSU0_GSUC0_GSUWGMRR0_K1_LBSPPA1024_LBSPPB512_LPA32_MIWT2_2_PLR2_SU32_SUM0_SUS256_SKXCCM0_VWA2_VWB2_WGM1_WGMXCC1_WGMXCCGn1
    SolutionIndex: 49
    SolutionNameMin: Cijk_Ailk_Bljk_BBS_BH_UserArgs_MT64x64x128_MI16x16x1_SN_LDSB1_CLR1_GSU0_GSUC0_GSUWGMRR0_K1_LBSPPA1024_LBSPPB512_LPA32_MIWT2_2_PLR2_SU32_SUM0_SUS256_SKXCCM0_VWA2_VWB2_WGM8_WGMXCC1_WGMXCCGn1
    SolutionIndex: 50
    SolutionNameMin: Cijk_Ailk_Bljk_BBS_BH_UserArgs_MT64x32x128_MI16x16x1_SN_LDSB1_CLR1_GSU0_GSUC0_GSUWGMRR0_K1_LBSPPA1024_LBSPPB256_LPA32_MIWT2_1_PLR2_SU32_SUM0_SUS256_SKXCCM0_VWA2_VWB1_WGM1_WGMXCC1_WGMXCCGn1
    SolutionIndex: 51
    SolutionNameMin: Cijk_Ailk_Bljk_BBS_BH_UserArgs_MT64x32x128_MI16x16x1_SN_LDSB1_CLR1_GSU0_GSUC0_GSUWGMRR0_K1_LBSPPA1024_LBSPPB256_LPA32_MIWT2_1_PLR2_SU32_SUM0_SUS256_SKXCCM0_VWA2_VWB1_WGM4_WGMXCC1_WGMXCCGn1
    SolutionIndex: 52
    SolutionNameMin: Cijk_Ailk_Bljk_BBS_BH_UserArgs_MT32x32x128_MI16x16x1_SN_LDSB1_CLR1_GSU0_GSUC0_GSUWGMRR0_K1_LBSPPA512_LBSPPB256_LPA16_MIWT1_1_PLR1_SU32_SUM0_SUS256_SKXCCM0_VWA1_VWB1_WGM1_WGMXCC1_WGMXCCGn1
    SolutionIndex: 53
    SolutionNameMin: Cijk_Ailk_Bljk_BBS_BH_UserArgs_MT32x32x128_MI16x16x1_SN_LDSB1_CLR1_GSU0_GSUC0_GSUWGMRR0_K1_LBSPPA512_LBSPPB256_LPA16_MIWT1_1_PLR2_SU32_SUM0_SUS256_SKXCCM0_VWA1_VWB1_WGM1_WGMXCC1_WGMXCCGn1
    SolutionIndex: 54
    SolutionNameMin: Cijk_Ailk_Bljk_BBS_BH_UserArgs_MT32x32x128_MI16x16x1_SN_LDSB1_CLR1_GSU0_GSUC0_GSUWGMRR0_K1_LBSPPA512_LBSPPB256_LPA16_MIWT1_1_PLR1_SU32_SUM0_SUS256_SKXCCM0_VWA1_VWB1_WGM8_WGMXCC1_WGMXCCGn1
    SolutionIndex: 55
    SolutionNameMin: Cijk_Ailk_Bljk_BBS_BH_UserArgs_MT32x32x128_MI16x16x1_SN_LDSB1_CLR1_GSU0_GSUC0_GSUWGMRR0_K1_LBSPPA512_LBSPPB256_LPA16_MIWT1_1_PLR2_SU32_SUM0_SUS256_SKXCCM0_VWA1_VWB1_WGM8_WGMXCC1_WGMXCCGn1
    SolutionIndex: 56
    SolutionNameMin: Cijk_Ailk_Bljk_BBS_BH_UserArgs_MT256x256x32_MI16x16x1_SN_LDSB1_CLR1_GSU0_GSUC0_GSUWGMRR0_K1_LBSPPA2048_LBSPPB128_LPA32_MIWT8_8_PLR1_SU32_SUM0_SUS256_SKXCCM6_VWA2_VWB1_WGM1_WGMXCC1_WGMXCCGn1
    SolutionIndex: 57
    SolutionNameMin: Cijk_Ailk_Bljk_BBS_BH_UserArgs_MT256x256x32_MI16x16x1_SN_LDSB1_CLR1_GSU0_GSUC0_GSUWGMRR0_K1_LBSPPA2048_LBSPPB128_LPA32_MIWT8_8_PLR1_SU32_SUM0_SUS256_SKXCCM6_VWA2_VWB2_WGM1_WGMXCC1_WGMXCCGn1
    SolutionIndex: 58
    SolutionNameMin: Cijk_Ailk_Bljk_BBS_BH_UserArgs_MT256x256x32_MI16x16x1_SN_LDSB1_CLR1_GSU0_GSUC0_GSUWGMRR0_K1_LBSPPA2048_LBSPPB128_LPA0_MIWT8_8_PLR1_SU32_SUM0_SUS256_SKXCCM6_VWA4_VWB2_WGM1_WGMXCC1_WGMXCCGn1
    SolutionIndex: 59
    SolutionNameMin: Cijk_Ailk_Bljk_BBS_BH_UserArgs_MT256x256x32_MI16x16x1_SN_LDSB1_CLR1_GSU0_GSUC0_GSUWGMRR0_K1_LBSPPA2048_LBSPPB256_LPA0_MIWT8_8_PLR1_SU32_SUM0_SUS256_SKXCCM6_VWA4_VWB4_WGM1_WGMXCC1_WGMXCCGn1
    SolutionIndex: 60
    SolutionNameMin: Cijk_Ailk_Bljk_BBS_BH_UserArgs_MT256x256x32_MI16x16x1_SN_LDSB1_CLR1_GSU0_GSUC0_GSUWGMRR0_K1_LBSPPA2048_LBSPPB512_LPA0_MIWT8_8_PLR1_SU32_SUM0_SUS256_SKXCCM6_VWA4_VWB8_WGM1_WGMXCC1_WGMXCCGn1
    SolutionIndex: 61
    SolutionNameMin: Cijk_Ailk_Bljk_BBS_BH_UserArgs_MT256x256x32_MI16x16x1_SN_LDSB1_CLR1_GSU0_GSUC0_GSUWGMRR0_K1_LBSPPA2048_LBSPPB128_LPA0_MIWT8_8_PLR1_SU32_SUM0_SUS256_SKXCCM6_VWA8_VWB1_WGM4_WGMXCC1_WGMXCCGn1
    SolutionIndex: 62
    SolutionNameMin: Cijk_Ailk_Bljk_BBS_BH_UserArgs_MT256x256x32_MI16x16x1_SN_LDSB1_CLR1_GSU0_GSUC0_GSUWGMRR0_K1_LBSPPA2048_LBSPPB128_LPA0_MIWT8_8_PLR1_SU32_SUM0_SUS256_SKXCCM6_VWA8_VWB2_WGM4_WGMXCC1_WGMXCCGn1
    SolutionIndex: 63
    SolutionNameMin: Cijk_Ailk_Bljk_BBS_BH_UserArgs_MT256x256x32_MI16x16x1_SN_LDSB1_CLR1_GSU0_GSUC0_GSUWGMRR0_K1_LBSPPA2048_LBSPPB256_LPA0_MIWT8_8_PLR1_SU32_SUM0_SUS256_SKXCCM6_VWA4_VWB4_WGM4_WGMXCC1_WGMXCCGn1
    SolutionIndex: 64
    SolutionNameMin: Cijk_Ailk_Bljk_BBS_BH_UserArgs_MT256x256x32_MI16x16x1_SN_LDSB1_CLR1_GSU0_GSUC0_GSUWGMRR0_K1_LBSPPA2048_LBSPPB256_LPA0_MIWT8_8_PLR1_SU32_SUM0_SUS256_SKXCCM6_VWA8_VWB4_WGM4_WGMXCC1_WGMXCCGn1
    SolutionIndex: 65
    SolutionNameMin: Cijk_Ailk_Bljk_BBS_BH_UserArgs_MT256x256x32_MI16x16x1_SN_LDSB1_CLR1_GSU0_GSUC0_GSUWGMRR0_K1_LBSPPA2048_LBSPPB128_LPA0_MIWT8_8_PLR1_SU32_SUM0_SUS256_SKXCCM6_VWA4_VWB1_WGM8_WGMXCC1_WGMXCCGn1
    SolutionIndex: 66
    SolutionNameMin: Cijk_Ailk_Bljk_BBS_BH_UserArgs_MT256x256x32_MI16x16x1_SN_LDSB1_CLR1_GSU0_GSUC0_GSUWGMRR0_K1_LBSPPA2048_LBSPPB128_LPA0_MIWT8_8_PLR1_SU32_SUM0_SUS256_SKXCCM6_VWA8_VWB1_WGM8_WGMXCC1_WGMXCCGn1
    SolutionIndex: 67
    SolutionNameMin: Cijk_Ailk_Bljk_BBS_BH_UserArgs_MT256x128x32_MI16x16x1_SN_LDSB1_CLR1_GSU0_GSUC0_GSUWGMRR0_K1_LBSPPA2048_LBSPPB256_LPA0_MIWT8_4_PLR1_SU32_SUM0_SUS256_SKXCCM6_VWA8_VWB4_WGM1_WGMXCC1_WGMXCCGn1
    SolutionIndex: 68
    SolutionNameMin: Cijk_Ailk_Bljk_BBS_BH_UserArgs_MT256x128x32_MI16x16x1_SN_LDSB1_CLR1_GSU0_GSUC0_GSUWGMRR0_K1_LBSPPA2048_LBSPPB128_LPA0_MIWT8_4_PLR1_SU32_SUM0_SUS256_SKXCCM6_VWA4_VWB2_WGM4_WGMXCC1_WGMXCCGn1
    SolutionIndex: 69
    SolutionNameMin: Cijk_Ailk_Bljk_BBS_BH_UserArgs_MT256x128x32_MI16x16x1_SN_LDSB1_CLR1_GSU0_GSUC0_GSUWGMRR0_K1_LBSPPA2048_LBSPPB128_LPA0_MIWT8_4_PLR1_SU32_SUM0_SUS256_SKXCCM6_VWA8_VWB2_WGM4_WGMXCC1_WGMXCCGn1
    SolutionIndex: 70
    SolutionNameMin: Cijk_Ailk_Bljk_BBS_BH_UserArgs_MT256x128x32_MI16x16x1_SN_LDSB1_CLR1_GSU0_GSUC0_GSUWGMRR0_K1_LBSPPA2048_LBSPPB256_LPA0_MIWT8_4_PLR1_SU32_SUM0_SUS256_SKXCCM6_VWA4_VWB4_WGM4_WGMXCC1_WGMXCCGn1
    SolutionIndex: 71
    SolutionNameMin: Cijk_Ailk_Bljk_BBS_BH_UserArgs_MT256x128x32_MI16x16x1_SN_LDSB1_CLR1_GSU0_GSUC0_GSUWGMRR0_K1_LBSPPA2048_LBSPPB128_LPA0_MIWT8_4_PLR1_SU32_SUM0_SUS256_SKXCCM6_VWA8_VWB2_WGM8_WGMXCC1_WGMXCCGn1
    SolutionIndex: 72
    SolutionNameMin: Cijk_Ailk_Bljk_BBS_BH_UserArgs_MT256x128x32_MI16x16x1_SN_LDSB1_CLR1_GSU0_GSUC0_GSUWGMRR0_K1_LBSPPA2048_LBSPPB256_LPA0_MIWT8_4_PLR1_SU32_SUM0_SUS256_SKXCCM6_VWA8_VWB4_WGM8_WGMXCC1_WGMXCCGn1
    SolutionIndex: 73
    SolutionNameMin: Cijk_Ailk_Bljk_BBS_BH_UserArgs_MT128x256x64_MI16x16x1_SN_LDSB1_CLR1_GSU0_GSUC0_GSUWGMRR0_K1_LBSPPA2048_LBSPPB128_LPA32_MIWT4_8_PLR1_SU32_SUM0_SUS256_SKXCCM6_VWA2_VWB1_WGM1_WGMXCC1_WGMXCCGn1
    SolutionIndex: 74
    SolutionNameMin: Cijk_Ailk_Bljk_BBS_BH_UserArgs_MT128x256x64_MI16x16x1_SN_LDSB1_CLR1_GSU0_GSUC0_GSUWGMRR0_K1_LBSPPA2048_LBSPPB128_LPA0_MIWT4_8_PLR1_SU32_SUM0_SUS256_SKXCCM6_VWA4_VWB1_WGM1_WGMXCC1_WGMXCCGn1
    SolutionIndex: 75
    SolutionNameMin: Cijk_Ailk_Bljk_BBS_BH_UserArgs_MT128x256x64_MI16x16x1_SN_LDSB1_CLR1_GSU0_GSUC0_GSUWGMRR0_K1_LBSPPA2048_LBSPPB256_LPA32_MIWT4_8_PLR1_SU32_SUM0_SUS256_SKXCCM6_VWA2_VWB2_WGM1_WGMXCC1_WGMXCCGn1
    SolutionIndex: 76
    SolutionNameMin: Cijk_Ailk_Bljk_BBS_BH_UserArgs_MT128x256x64_MI16x16x1_SN_LDSB1_CLR1_GSU0_GSUC0_GSUWGMRR0_K1_LBSPPA2048_LBSPPB256_LPA0_MIWT4_8_PLR1_SU32_SUM0_SUS256_SKXCCM6_VWA4_VWB2_WGM1_WGMXCC1_WGMXCCGn1
    SolutionIndex: 77
    SolutionNameMin: Cijk_Ailk_Bljk_BBS_BH_UserArgs_MT128x256x64_MI16x16x1_SN_LDSB1_CLR1_GSU0_GSUC0_GSUWGMRR0_K1_LBSPPA2048_LBSPPB512_LPA0_MIWT4_8_PLR1_SU32_SUM0_SUS256_SKXCCM6_VWA4_VWB4_WGM1_WGMXCC1_WGMXCCGn1
    SolutionIndex: 78
    SolutionNameMin: Cijk_Ailk_Bljk_BBS_BH_UserArgs_MT128x256x64_MI16x16x1_SN_LDSB1_CLR1_GSU0_GSUC0_GSUWGMRR0_K1_LBSPPA2048_LBSPPB1024_LPA32_MIWT4_8_PLR1_SU32_SUM0_SUS256_SKXCCM6_VWA2_VWB8_WGM1_WGMXCC1_WGMXCCGn1
    SolutionIndex: 79
    SolutionNameMin: Cijk_Ailk_Bljk_BBS_BH_UserArgs_MT128x256x64_MI16x16x1_SN_LDSB1_CLR1_GSU0_GSUC0_GSUWGMRR0_K1_LBSPPA2048_LBSPPB1024_LPA0_MIWT4_8_PLR1_SU32_SUM0_SUS256_SKXCCM6_VWA4_VWB8_WGM1_WGMXCC1_WGMXCCGn1
    SolutionIndex: 80
    SolutionNameMin: Cijk_Ailk_Bljk_BBS_BH_UserArgs_MT128x256x64_MI16x16x1_SN_LDSB1_CLR1_GSU0_GSUC0_GSUWGMRR0_K1_LBSPPA2048_LBSPPB256_LPA0_MIWT4_8_PLR1_SU32_SUM0_SUS256_SKXCCM6_VWA4_VWB2_WGM4_WGMXCC1_WGMXCCGn1
    SolutionIndex: 81
    SolutionNameMin: Cijk_Ailk_Bljk_BBS_BH_UserArgs_MT128x256x64_MI16x16x1_SN_LDSB1_CLR1_GSU0_GSUC0_GSUWGMRR0_K1_LBSPPA2048_LBSPPB512_LPA0_MIWT4_8_PLR1_SU32_SUM0_SUS256_SKXCCM6_VWA4_VWB4_WGM4_WGMXCC1_WGMXCCGn1
    SolutionIndex: 82
    SolutionNameMin: Cijk_Ailk_Bljk_BBS_BH_UserArgs_MT256x128x64_MI16x16x1_SN_LDSB1_CLR1_GSU0_GSUC0_GSUWGMRR0_K1_LBSPPA4096_LBSPPB128_LPA32_MIWT8_4_PLR1_SU32_SUM0_SUS256_SKXCCM6_VWA2_VWB1_WGM1_WGMXCC1_WGMXCCGn1
    SolutionIndex: 83
    SolutionNameMin: Cijk_Ailk_Bljk_BBS_BH_UserArgs_MT256x128x64_MI16x16x1_SN_LDSB1_CLR1_GSU0_GSUC0_GSUWGMRR0_K1_LBSPPA4096_LBSPPB128_LPA32_MIWT8_4_PLR1_SU32_SUM0_SUS256_SKXCCM6_VWA2_VWB1_WGM4_WGMXCC1_WGMXCCGn1
    SolutionIndex: 84
    SolutionNameMin: Cijk_Ailk_Bljk_BBS_BH_UserArgs_MT256x128x64_MI16x16x1_SN_LDSB1_CLR1_GSU0_GSUC0_GSUWGMRR0_K1_LBSPPA4096_LBSPPB128_LPA0_MIWT8_4_PLR1_SU32_SUM0_SUS256_SKXCCM6_VWA4_VWB1_WGM4_WGMXCC1_WGMXCCGn1
    SolutionIndex: 85
    SolutionNameMin: Cijk_Ailk_Bljk_BBS_BH_UserArgs_MT256x128x64_MI16x16x1_SN_LDSB1_CLR1_GSU0_GSUC0_GSUWGMRR0_K1_LBSPPA4096_LBSPPB128_LPA32_MIWT8_4_PLR1_SU32_SUM0_SUS256_SKXCCM6_VWA2_VWB1_WGM8_WGMXCC1_WGMXCCGn1
    SolutionIndex: 86
    SolutionNameMin: Cijk_Ailk_Bljk_BBS_BH_UserArgs_MT256x128x64_MI16x16x1_SN_LDSB1_CLR1_GSU0_GSUC0_GSUWGMRR0_K1_LBSPPA4096_LBSPPB128_LPA0_MIWT8_4_PLR1_SU32_SUM0_SUS256_SKXCCM6_VWA4_VWB1_WGM8_WGMXCC1_WGMXCCGn1
    SolutionIndex: 87
    SolutionNameMin: Cijk_Ailk_Bljk_BBS_BH_UserArgs_MT256x128x64_MI16x16x1_SN_LDSB1_CLR1_GSU0_GSUC0_GSUWGMRR0_K1_LBSPPA4096_LBSPPB256_LPA32_MIWT8_4_PLR1_SU32_SUM0_SUS256_SKXCCM6_VWA2_VWB2_WGM8_WGMXCC1_WGMXCCGn1
    SolutionIndex: 88
    SolutionNameMin: Cijk_Ailk_Bljk_BBS_BH_UserArgs_MT256x128x64_MI16x16x1_SN_LDSB1_CLR1_GSU0_GSUC0_GSUWGMRR0_K1_LBSPPA4096_LBSPPB512_LPA0_MIWT8_4_PLR1_SU32_SUM0_SUS256_SKXCCM6_VWA4_VWB4_WGM8_WGMXCC1_WGMXCCGn1
    SolutionIndex: 89
    SolutionNameMin: Cijk_Ailk_Bljk_BBS_BH_UserArgs_MT64x256x64_MI16x16x1_SN_LDSB1_CLR1_GSU0_GSUC0_GSUWGMRR0_K1_LBSPPA1024_LBSPPB1024_LPA32_MIWT2_8_PLR1_SU32_SUM0_SUS256_SKXCCM6_VWA2_VWB8_WGM1_WGMXCC1_WGMXCCGn1
    SolutionIndex: 90
    SolutionNameMin: Cijk_Ailk_Bljk_BBS_BH_UserArgs_MT128x128x64_MI16x16x1_SN_LDSB1_CLR1_GSU0_GSUC0_GSUWGMRR0_K1_LBSPPA2048_LBSPPB128_LPA32_MIWT4_4_PLR1_SU32_SUM0_SUS256_SKXCCM6_VWA2_VWB1_WGM1_WGMXCC1_WGMXCCGn1
    SolutionIndex: 91
    SolutionNameMin: Cijk_Ailk_Bljk_BBS_BH_UserArgs_MT128x128x64_MI16x16x1_SN_LDSB1_CLR1_GSU0_GSUC0_GSUWGMRR0_K1_LBSPPA2048_LBSPPB128_LPA0_MIWT4_4_PLR1_SU32_SUM0_SUS256_SKXCCM6_VWA4_VWB1_WGM1_WGMXCC1_WGMXCCGn1
    SolutionIndex: 92
    SolutionNameMin: Cijk_Ailk_Bljk_BBS_BH_UserArgs_MT128x128x64_MI16x16x1_SN_LDSB1_CLR1_GSU0_GSUC0_GSUWGMRR0_K1_LBSPPA2048_LBSPPB256_LPA0_MIWT4_4_PLR1_SU32_SUM0_SUS256_SKXCCM6_VWA4_VWB2_WGM1_WGMXCC1_WGMXCCGn1
    SolutionIndex: 93
    SolutionNameMin: Cijk_Ailk_Bljk_BBS_BH_UserArgs_MT128x128x64_MI16x16x1_SN_LDSB1_CLR1_GSU0_GSUC0_GSUWGMRR0_K1_LBSPPA2048_LBSPPB512_LPA0_MIWT4_4_PLR1_SU32_SUM0_SUS256_SKXCCM6_VWA4_VWB4_WGM1_WGMXCC1_WGMXCCGn1
    SolutionIndex: 94
    SolutionNameMin: Cijk_Ailk_Bljk_BBS_BH_UserArgs_MT128x128x64_MI16x16x1_SN_LDSB1_CLR1_GSU0_GSUC0_GSUWGMRR0_K1_LBSPPA2048_LBSPPB128_LPA32_MIWT4_4_PLR1_SU32_SUM0_SUS256_SKXCCM6_VWA2_VWB1_WGM4_WGMXCC1_WGMXCCGn1
    SolutionIndex: 95
    SolutionNameMin: Cijk_Ailk_Bljk_BBS_BH_UserArgs_MT128x128x64_MI16x16x1_SN_LDSB1_CLR1_GSU0_GSUC0_GSUWGMRR0_K1_LBSPPA2048_LBSPPB128_LPA0_MIWT4_4_PLR1_SU32_SUM0_SUS256_SKXCCM6_VWA4_VWB1_WGM4_WGMXCC1_WGMXCCGn1
    SolutionIndex: 96
    SolutionNameMin: Cijk_Ailk_Bljk_BBS_BH_UserArgs_MT128x128x64_MI16x16x1_SN_LDSB1_CLR1_GSU0_GSUC0_GSUWGMRR0_K1_LBSPPA2048_LBSPPB256_LPA0_MIWT4_4_PLR1_SU32_SUM0_SUS256_SKXCCM6_VWA4_VWB2_WGM4_WGMXCC1_WGMXCCGn1
    SolutionIndex: 97
    SolutionNameMin: Cijk_Ailk_Bljk_BBS_BH_UserArgs_MT128x128x64_MI16x16x1_SN_LDSB1_CLR1_GSU0_GSUC0_GSUWGMRR0_K1_LBSPPA2048_LBSPPB512_LPA0_MIWT4_4_PLR1_SU32_SUM0_SUS256_SKXCCM6_VWA4_VWB4_WGM4_WGMXCC1_WGMXCCGn1
    SolutionIndex: 98
    SolutionNameMin: Cijk_Ailk_Bljk_BBS_BH_UserArgs_MT128x128x64_MI16x16x1_SN_LDSB1_CLR1_GSU0_GSUC0_GSUWGMRR0_K1_LBSPPA2048_LBSPPB512_LPA0_MIWT4_4_PLR2_SU32_SUM0_SUS256_SKXCCM6_VWA4_VWB4_WGM4_WGMXCC1_WGMXCCGn1
    SolutionIndex: 99
    SolutionNameMin: Cijk_Ailk_Bljk_BBS_BH_UserArgs_MT128x128x64_MI16x16x1_SN_LDSB1_CLR1_GSU0_GSUC0_GSUWGMRR0_K1_LBSPPA2048_LBSPPB128_LPA32_MIWT4_4_PLR1_SU32_SUM0_SUS256_SKXCCM6_VWA2_VWB1_WGM8_WGMXCC1_WGMXCCGn1
    SolutionIndex: 100
    SolutionNameMin: Cijk_Ailk_Bljk_BBS_BH_UserArgs_MT128x128x64_MI16x16x1_SN_LDSB1_CLR1_GSU0_GSUC0_GSUWGMRR0_K1_LBSPPA2048_LBSPPB128_LPA0_MIWT4_4_PLR1_SU32_SUM0_SUS256_SKXCCM6_VWA4_VWB1_WGM8_WGMXCC1_WGMXCCGn1
    SolutionIndex: 101
    SolutionNameMin: Cijk_Ailk_Bljk_BBS_BH_UserArgs_MT128x128x64_MI16x16x1_SN_LDSB1_CLR1_GSU0_GSUC0_GSUWGMRR0_K1_LBSPPA2048_LBSPPB256_LPA0_MIWT4_4_PLR1_SU32_SUM0_SUS256_SKXCCM6_VWA4_VWB2_WGM8_WGMXCC1_WGMXCCGn1
    SolutionIndex: 102
    SolutionNameMin: Cijk_Ailk_Bljk_BBS_BH_UserArgs_MT128x128x64_MI16x16x1_SN_LDSB1_CLR1_GSU0_GSUC0_GSUWGMRR0_K1_LBSPPA2048_LBSPPB512_LPA0_MIWT4_4_PLR1_SU32_SUM0_SUS256_SKXCCM6_VWA4_VWB4_WGM8_WGMXCC1_WGMXCCGn1
    SolutionIndex: 103
    SolutionNameMin: Cijk_Ailk_Bljk_BBS_BH_UserArgs_MT128x128x64_MI16x16x1_SN_LDSB1_CLR1_GSU0_GSUC0_GSUWGMRR0_K1_LBSPPA2048_LBSPPB128_LPA0_MIWT4_4_PLR2_SU32_SUM0_SUS256_SKXCCM6_VWA4_VWB1_WGM8_WGMXCC1_WGMXCCGn1
    SolutionIndex: 104
    SolutionNameMin: Cijk_Ailk_Bljk_BBS_BH_UserArgs_MT64x128x64_MI16x16x1_SN_LDSB1_CLR1_GSU0_GSUC0_GSUWGMRR0_K1_LBSPPA1024_LBSPPB128_LPA32_MIWT2_4_PLR1_SU32_SUM0_SUS256_SKXCCM6_VWA2_VWB1_WGM4_WGMXCC1_WGMXCCGn1
    SolutionIndex: 105
    SolutionNameMin: Cijk_Ailk_Bljk_BBS_BH_UserArgs_MT64x128x64_MI16x16x1_SN_LDSB1_CLR1_GSU0_GSUC0_GSUWGMRR0_K1_LBSPPA1024_LBSPPB256_LPA32_MIWT2_4_PLR1_SU32_SUM0_SUS256_SKXCCM6_VWA2_VWB2_WGM4_WGMXCC1_WGMXCCGn1
    SolutionIndex: 106
    SolutionNameMin: Cijk_Ailk_Bljk_BBS_BH_UserArgs_MT64x128x64_MI16x16x1_SN_LDSB1_CLR1_GSU0_GSUC0_GSUWGMRR0_K1_LBSPPA1024_LBSPPB512_LPA32_MIWT2_4_PLR1_SU32_SUM0_SUS256_SKXCCM6_VWA2_VWB4_WGM8_WGMXCC1_WGMXCCGn1
    SolutionIndex: 107
    SolutionNameMin: Cijk_Ailk_Bljk_BBS_BH_UserArgs_MT128x64x64_MI16x16x1_SN_LDSB1_CLR1_GSU0_GSUC0_GSUWGMRR0_K1_LBSPPA2048_LBSPPB128_LPA32_MIWT4_2_PLR1_SU32_SUM0_SUS256_SKXCCM6_VWA2_VWB1_WGM1_WGMXCC1_WGMXCCGn1
    SolutionIndex: 108
    SolutionNameMin: Cijk_Ailk_Bljk_BBS_BH_UserArgs_MT128x64x64_MI16x16x1_SN_LDSB1_CLR1_GSU0_GSUC0_GSUWGMRR0_K1_LBSPPA2048_LBSPPB128_LPA0_MIWT4_2_PLR1_SU32_SUM0_SUS256_SKXCCM6_VWA4_VWB1_WGM1_WGMXCC1_WGMXCCGn1
    SolutionIndex: 109
    SolutionNameMin: Cijk_Ailk_Bljk_BBS_BH_UserArgs_MT128x64x64_MI16x16x1_SN_LDSB1_CLR1_GSU0_GSUC0_GSUWGMRR0_K1_LBSPPA2048_LBSPPB256_LPA0_MIWT4_2_PLR1_SU32_SUM0_SUS256_SKXCCM6_VWA4_VWB2_WGM1_WGMXCC1_WGMXCCGn1
    SolutionIndex: 110
    SolutionNameMin: Cijk_Ailk_Bljk_BBS_BH_UserArgs_MT128x64x64_MI16x16x1_SN_LDSB1_CLR1_GSU0_GSUC0_GSUWGMRR0_K1_LBSPPA2048_LBSPPB128_LPA0_MIWT4_2_PLR1_SU32_SUM0_SUS256_SKXCCM6_VWA4_VWB1_WGM4_WGMXCC1_WGMXCCGn1
    SolutionIndex: 111
    SolutionNameMin: Cijk_Ailk_Bljk_BBS_BH_UserArgs_MT128x64x64_MI16x16x1_SN_LDSB1_CLR1_GSU0_GSUC0_GSUWGMRR0_K1_LBSPPA2048_LBSPPB256_LPA0_MIWT4_2_PLR1_SU32_SUM0_SUS256_SKXCCM6_VWA4_VWB2_WGM4_WGMXCC1_WGMXCCGn1
    SolutionIndex: 112
    SolutionNameMin: Cijk_Ailk_Bljk_BBS_BH_UserArgs_MT128x64x64_MI16x16x1_SN_LDSB1_CLR1_GSU0_GSUC0_GSUWGMRR0_K1_LBSPPA2048_LBSPPB256_LPA0_MIWT4_2_PLR1_SU32_SUM0_SUS256_SKXCCM6_VWA4_VWB2_WGM8_WGMXCC1_WGMXCCGn1
    SolutionIndex: 113
    SolutionNameMin: Cijk_Ailk_Bljk_BBS_BH_UserArgs_MT64x64x64_MI16x16x1_SN_LDSB1_CLR1_GSU0_GSUC0_GSUWGMRR0_K1_LBSPPA1024_LBSPPB256_LPA32_MIWT2_2_PLR1_SU32_SUM0_SUS256_SKXCCM6_VWA2_VWB2_WGM1_WGMXCC1_WGMXCCGn1
    SolutionIndex: 114
    SolutionNameMin: Cijk_Ailk_Bljk_BBS_BH_UserArgs_MT64x64x64_MI16x16x1_SN_LDSB1_CLR1_GSU0_GSUC0_GSUWGMRR0_K1_LBSPPA1024_LBSPPB256_LPA32_MIWT2_2_PLR1_SU32_SUM0_SUS256_SKXCCM6_VWA2_VWB2_WGM8_WGMXCC1_WGMXCCGn1
    SolutionIndex: 115
    SolutionNameMin: Cijk_Ailk_Bljk_BBS_BH_UserArgs_MT32x64x64_MI16x16x1_SN_LDSB0_CLR1_GSU0_GSUC0_GSUWGMRR0_K1_LBSPPA512_LBSPPB128_LPA16_MIWT1_2_PLR1_SU32_SUM0_SUS256_SKXCCM6_VWA1_VWB1_WGM1_WGMXCC1_WGMXCCGn1
    SolutionIndex: 116
    SolutionNameMin: Cijk_Ailk_Bljk_BBS_BH_UserArgs_MT32x64x64_MI16x16x1_SN_LDSB0_CLR1_GSU0_GSUC0_GSUWGMRR0_K1_LBSPPA512_LBSPPB256_LPA16_MIWT1_2_PLR1_SU32_SUM0_SUS256_SKXCCM6_VWA1_VWB2_WGM1_WGMXCC1_WGMXCCGn1
    SolutionIndex: 117
    SolutionNameMin: Cijk_Ailk_Bljk_BBS_BH_UserArgs_MT32x32x64_MI16x16x1_SN_LDSB0_CLR1_GSU0_GSUC0_GSUWGMRR0_K1_LBSPPA512_LBSPPB128_LPA16_MIWT1_1_PLR1_SU32_SUM0_SUS256_SKXCCM6_VWA1_VWB1_WGM1_WGMXCC1_WGMXCCGn1
    SolutionIndex: 118
    SolutionNameMin: Cijk_Ailk_Bljk_BBS_BH_UserArgs_MT64x128x128_MI16x16x1_SN_LDSB1_CLR1_GSU0_GSUC0_GSUWGMRR0_K1_LBSPPA1024_LBSPPB256_LPA32_MIWT2_4_PLR1_SU32_SUM0_SUS256_SKXCCM6_VWA2_VWB1_WGM1_WGMXCC1_WGMXCCGn1
    SolutionIndex: 119
    SolutionNameMin: Cijk_Ailk_Bljk_BBS_BH_UserArgs_MT64x128x128_MI16x16x1_SN_LDSB1_CLR1_GSU0_GSUC0_GSUWGMRR0_K1_LBSPPA1024_LBSPPB256_LPA32_MIWT2_4_PLR2_SU32_SUM0_SUS256_SKXCCM6_VWA2_VWB1_WGM1_WGMXCC1_WGMXCCGn1
    SolutionIndex: 120
    SolutionNameMin: Cijk_Ailk_Bljk_BBS_BH_UserArgs_MT64x128x128_MI16x16x1_SN_LDSB1_CLR1_GSU0_GSUC0_GSUWGMRR0_K1_LBSPPA1024_LBSPPB512_LPA32_MIWT2_4_PLR2_SU32_SUM0_SUS256_SKXCCM6_VWA2_VWB2_WGM1_WGMXCC1_WGMXCCGn1
    SolutionIndex: 121
    SolutionNameMin: Cijk_Ailk_Bljk_BBS_BH_UserArgs_MT64x128x128_MI16x16x1_SN_LDSB1_CLR1_GSU0_GSUC0_GSUWGMRR0_K1_LBSPPA1024_LBSPPB512_LPA32_MIWT2_4_PLR2_SU32_SUM0_SUS256_SKXCCM6_VWA2_VWB2_WGM4_WGMXCC1_WGMXCCGn1
    SolutionIndex: 122
    SolutionNameMin: Cijk_Ailk_Bljk_BBS_BH_UserArgs_MT64x128x128_MI16x16x1_SN_LDSB1_CLR1_GSU0_GSUC0_GSUWGMRR0_K1_LBSPPA1024_LBSPPB512_LPA32_MIWT2_4_PLR2_SU32_SUM0_SUS256_SKXCCM6_VWA2_VWB2_WGM8_WGMXCC1_WGMXCCGn1
    SolutionIndex: 123
    SolutionNameMin: Cijk_Ailk_Bljk_BBS_BH_UserArgs_MT64x128x128_MI16x16x1_SN_LDSB1_CLR1_GSU0_GSUC0_GSUWGMRR0_K1_LBSPPA1024_LBSPPB1024_LPA32_MIWT2_4_PLR2_SU32_SUM0_SUS256_SKXCCM6_VWA2_VWB4_WGM8_WGMXCC1_WGMXCCGn1
    SolutionIndex: 124
    SolutionNameMin: Cijk_Ailk_Bljk_BBS_BH_UserArgs_MT128x64x128_MI16x16x1_SN_LDSB1_CLR1_GSU0_GSUC0_GSUWGMRR0_K1_LBSPPA2048_LBSPPB512_LPA0_MIWT4_2_PLR1_SU32_SUM0_SUS256_SKXCCM6_VWA4_VWB2_WGM1_WGMXCC1_WGMXCCGn1
    SolutionIndex: 125
    SolutionNameMin: Cijk_Ailk_Bljk_BBS_BH_UserArgs_MT128x64x128_MI16x16x1_SN_LDSB1_CLR1_GSU0_GSUC0_GSUWGMRR0_K1_LBSPPA2048_LBSPPB256_LPA0_MIWT4_2_PLR2_SU32_SUM0_SUS256_SKXCCM6_VWA4_VWB1_WGM1_WGMXCC1_WGMXCCGn1
    SolutionIndex: 126
    SolutionNameMin: Cijk_Ailk_Bljk_BBS_BH_UserArgs_MT128x64x128_MI16x16x1_SN_LDSB1_CLR1_GSU0_GSUC0_GSUWGMRR0_K1_LBSPPA2048_LBSPPB512_LPA0_MIWT4_2_PLR2_SU32_SUM0_SUS256_SKXCCM6_VWA4_VWB2_WGM1_WGMXCC1_WGMXCCGn1
    SolutionIndex: 127
    SolutionNameMin: Cijk_Ailk_Bljk_BBS_BH_UserArgs_MT128x64x128_MI16x16x1_SN_LDSB1_CLR1_GSU0_GSUC0_GSUWGMRR0_K1_LBSPPA2048_LBSPPB512_LPA0_MIWT4_2_PLR2_SU32_SUM0_SUS256_SKXCCM6_VWA4_VWB2_WGM4_WGMXCC1_WGMXCCGn1
    SolutionIndex: 128
    SolutionNameMin: Cijk_Ailk_Bljk_BBS_BH_UserArgs_MT128x64x128_MI16x16x1_SN_LDSB1_CLR1_GSU0_GSUC0_GSUWGMRR0_K1_LBSPPA2048_LBSPPB512_LPA0_MIWT4_2_PLR1_SU32_SUM0_SUS256_SKXCCM6_VWA4_VWB2_WGM8_WGMXCC1_WGMXCCGn1
    SolutionIndex: 129
    SolutionNameMin: Cijk_Ailk_Bljk_BBS_BH_UserArgs_MT128x64x128_MI16x16x1_SN_LDSB1_CLR1_GSU0_GSUC0_GSUWGMRR0_K1_LBSPPA2048_LBSPPB256_LPA0_MIWT4_2_PLR2_SU32_SUM0_SUS256_SKXCCM6_VWA4_VWB1_WGM8_WGMXCC1_WGMXCCGn1
    SolutionIndex: 130
    SolutionNameMin: Cijk_Ailk_Bljk_BBS_BH_UserArgs_MT128x64x128_MI16x16x1_SN_LDSB1_CLR1_GSU0_GSUC0_GSUWGMRR0_K1_LBSPPA2048_LBSPPB512_LPA0_MIWT4_2_PLR2_SU32_SUM0_SUS256_SKXCCM6_VWA4_VWB2_WGM8_WGMXCC1_WGMXCCGn1
    SolutionIndex: 131
    SolutionNameMin: Cijk_Ailk_Bljk_BBS_BH_UserArgs_MT64x64x128_MI16x16x1_SN_LDSB1_CLR1_GSU0_GSUC0_GSUWGMRR0_K1_LBSPPA1024_LBSPPB256_LPA32_MIWT2_2_PLR2_SU32_SUM0_SUS256_SKXCCM6_VWA2_VWB1_WGM1_WGMXCC1_WGMXCCGn1
    SolutionIndex: 132
    SolutionNameMin: Cijk_Ailk_Bljk_BBS_BH_UserArgs_MT64x64x128_MI16x16x1_SN_LDSB1_CLR1_GSU0_GSUC0_GSUWGMRR0_K1_LBSPPA1024_LBSPPB512_LPA32_MIWT2_2_PLR2_SU32_SUM0_SUS256_SKXCCM6_VWA2_VWB2_WGM1_WGMXCC1_WGMXCCGn1
    SolutionIndex: 133
    SolutionNameMin: Cijk_Ailk_Bljk_BBS_BH_UserArgs_MT64x64x128_MI16x16x1_SN_LDSB1_CLR1_GSU0_GSUC0_GSUWGMRR0_K1_LBSPPA1024_LBSPPB256_LPA32_MIWT2_2_PLR2_SU32_SUM0_SUS256_SKXCCM6_VWA2_VWB1_WGM4_WGMXCC1_WGMXCCGn1
    SolutionIndex: 134
    SolutionNameMin: Cijk_Ailk_Bljk_BBS_BH_UserArgs_MT64x64x128_MI16x16x1_SN_LDSB1_CLR1_GSU0_GSUC0_GSUWGMRR0_K1_LBSPPA1024_LBSPPB256_LPA32_MIWT2_2_PLR2_SU32_SUM0_SUS256_SKXCCM6_VWA2_VWB1_WGM8_WGMXCC1_WGMXCCGn1
    SolutionIndex: 135
    SolutionNameMin: Cijk_Ailk_Bljk_BBS_BH_UserArgs_MT64x64x128_MI16x16x1_SN_LDSB1_CLR1_GSU0_GSUC0_GSUWGMRR0_K1_LBSPPA1024_LBSPPB512_LPA32_MIWT2_2_PLR2_SU32_SUM0_SUS256_SKXCCM6_VWA2_VWB2_WGM8_WGMXCC1_WGMXCCGn1
    SolutionIndex: 136
    SolutionNameMin: Cijk_Ailk_Bljk_BBS_BH_UserArgs_MT64x32x128_MI16x16x1_SN_LDSB1_CLR1_GSU0_GSUC0_GSUWGMRR0_K1_LBSPPA1024_LBSPPB256_LPA32_MIWT2_1_PLR2_SU32_SUM0_SUS256_SKXCCM6_VWA2_VWB1_WGM1_WGMXCC1_WGMXCCGn1
    SolutionIndex: 137
    SolutionNameMin: Cijk_Ailk_Bljk_BBS_BH_UserArgs_MT64x32x128_MI16x16x1_SN_LDSB1_CLR1_GSU0_GSUC0_GSUWGMRR0_K1_LBSPPA1024_LBSPPB256_LPA32_MIWT2_1_PLR2_SU32_SUM0_SUS256_SKXCCM6_VWA2_VWB1_WGM4_WGMXCC1_WGMXCCGn1
    SolutionIndex: 138
    SolutionNameMin: Cijk_Ailk_Bljk_BBS_BH_UserArgs_MT32x32x128_MI16x16x1_SN_LDSB1_CLR1_GSU0_GSUC0_GSUWGMRR0_K1_LBSPPA512_LBSPPB256_LPA16_MIWT1_1_PLR1_SU32_SUM0_SUS256_SKXCCM6_VWA1_VWB1_WGM1_WGMXCC1_WGMXCCGn1
    SolutionIndex: 139
    SolutionNameMin: Cijk_Ailk_Bljk_BBS_BH_UserArgs_MT32x32x128_MI16x16x1_SN_LDSB1_CLR1_GSU0_GSUC0_GSUWGMRR0_K1_LBSPPA512_LBSPPB256_LPA16_MIWT1_1_PLR2_SU32_SUM0_SUS256_SKXCCM6_VWA1_VWB1_WGM1_WGMXCC1_WGMXCCGn1
    SolutionIndex: 140
    SolutionNameMin: Cijk_Ailk_Bljk_BBS_BH_UserArgs_MT32x32x32_MI16x16x1_SN_LDSB0_CLR0_GSU0_GSUC0_GSUWGMRR0_K1_LBSPPA256_LBSPPB128_LPA16_MIWT1_1_PLR0_SU32_SUM0_SUS256_SKXCCM0_VWA1_VWB1_WGM8_WGMXCC1_WGMXCCGn1
- - - [128, 128, 1, 128, 128, 128, 128, 128]
    - [39, 0.083]
  - - [128, 128, 1, 256, 128, 128, 128, 256]
    - [39, 0.151]
  - - [128, 128, 1, 512, 128, 128, 128, 512]
    - [54, 0.257]
  - - [128, 128, 1, 1024, 128, 128, 128, 1024]
    - [55, 0.389]
  - - [128, 128, 1, 2048, 128, 128, 128, 2048]
    - [53, 0.598]
  - - [128, 128, 1, 4096, 128, 128, 128, 4096]
    - [38, 1.057]
  - - [128, 128, 1, 8192, 128, 128, 128, 8192]
    - [53, 1.61]
  - - [128, 256, 1, 128, 128, 128, 128, 128]
    - [38, 0.176]
  - - [128, 256, 1, 256, 128, 128, 128, 256]
    - [38, 0.315]
  - - [128, 256, 1, 512, 128, 128, 128, 512]
    - [52, 0.524]
  - - [128, 256, 1, 1024, 128, 128, 128, 1024]
    - [53, 0.795]
  - - [128, 256, 1, 2048, 128, 128, 128, 2048]
    - [52, 1.193]
  - - [128, 256, 1, 4096, 128, 128, 128, 4096]
    - [117, 2.06]
  - - [128, 256, 1, 8192, 128, 128, 128, 8192]
    - [139, 3.166]
  - - [128, 512, 1, 128, 128, 128, 128, 128]
    - [38, 0.345]
  - - [128, 512, 1, 256, 128, 128, 128, 256]
    - [38, 0.625]
  - - [128, 512, 1, 512, 128, 128, 128, 512]
    - [38, 1.041]
  - - [128, 512, 1, 1024, 128, 128, 128, 1024]
    - [52, 1.576]
  - - [128, 512, 1, 2048, 128, 128, 128, 2048]
    - [53, 2.325]
  - - [128, 512, 1, 4096, 128, 128, 128, 4096]
    - [116, 3.544]
  - - [128, 512, 1, 8192, 128, 128, 128, 8192]
    - [136, 5.494]
  - - [128, 1024, 1, 128, 128, 128, 128, 128]
    - [38, 0.675]
  - - [128, 1024, 1, 256, 128, 128, 128, 256]
    - [38, 1.228]
  - - [128, 1024, 1, 512, 128, 128, 128, 512]
    - [53, 2.028]
  - - [128, 1024, 1, 1024, 128, 128, 128, 1024]
    - [53, 3.109]
  - - [128, 1024, 1, 2048, 128, 128, 128, 2048]
    - [50, 4.119]
  - - [128, 1024, 1, 4096, 128, 128, 128, 4096]
    - [136, 6.144]
  - - [128, 1024, 1, 8192, 128, 128, 128, 8192]
    - [48, 8.904]
  - - [128, 2048, 1, 128, 128, 128, 128, 128]
    - [37, 1.272]
  - - [128, 2048, 1, 256, 128, 128, 128, 256]
    - [37, 2.225]
  - - [128, 2048, 1, 512, 128, 128, 128, 512]
    - [136, 3.664]
  - - [128, 2048, 1, 1024, 128, 128, 128, 1024]
    - [50, 5.523]
  - - [128, 2048, 1, 2048, 128, 128, 128, 2048]
    - [131, 6.856]
  - - [128, 2048, 1, 4096, 128, 128, 128, 4096]
    - [131, 9.89]
  - - [128, 2048, 1, 8192, 128, 128, 128, 8192]
    - [42, 13.413]
  - - [128, 4096, 1, 128, 128, 128, 128, 128]
    - [113, 2.211]
  - - [128, 4096, 1, 256, 128, 128, 128, 256]
    - [113, 3.834]
  - - [128, 4096, 1, 512, 128, 128, 128, 512]
    - [47, 6.26]
  - - [128, 4096, 1, 1024, 128, 128, 128, 1024]
    - [48, 9.17]
  - - [128, 4096, 1, 2048, 128, 128, 128, 2048]
    - [131, 11.06]
  - - [128, 4096, 1, 4096, 128, 128, 128, 4096]
    - [32, 14.106]
  - - [128, 4096, 1, 8192, 128, 128, 128, 8192]
    - [45, 16.245]
  - - [128, 8192, 1, 128, 128, 128, 128, 128]
    - [7, 3.666]
  - - [128, 8192, 1, 256, 128, 128, 128, 256]
    - [31, 6.209]
  - - [128, 8192, 1, 512, 128, 128, 128, 512]
    - [32, 9.706]
  - - [128, 8192, 1, 1024, 128, 128, 128, 1024]
    - [42, 13.883]
  - - [128, 8192, 1, 2048, 128, 128, 128, 2048]
    - [32, 14.042]
  - - [128, 8192, 1, 4096, 128, 128, 128, 4096]
    - [31, 17.287]
  - - [128, 8192, 1, 8192, 128, 128, 128, 8192]
    - [26, 20.259]
  - - [256, 128, 1, 128, 256, 256, 256, 128]
    - [52, 0.172]
  - - [256, 128, 1, 256, 256, 256, 256, 256]
    - [38, 0.312]
  - - [256, 128, 1, 512, 256, 256, 256, 512]
    - [138, 0.524]
  - - [256, 128, 1, 1024, 256, 256, 256, 1024]
    - [52, 0.793]
  - - [256, 128, 1, 2048, 256, 256, 256, 2048]
    - [53, 1.183]
  - - [256, 128, 1, 4096, 256, 256, 256, 4096]
    - [38, 2.034]
  - - [256, 128, 1, 8192, 256, 256, 256, 8192]
    - [53, 3.119]
  - - [256, 256, 1, 128, 256, 256, 256, 128]
    - [38, 0.345]
  - - [256, 256, 1, 256, 256, 256, 256, 256]
    - [52, 0.616]
  - - [256, 256, 1, 512, 256, 256, 256, 512]
    - [53, 1.047]
  - - [256, 256, 1, 1024, 256, 256, 256, 1024]
    - [52, 1.567]
  - - [256, 256, 1, 2048, 256, 256, 256, 2048]
    - [53, 2.325]
  - - [256, 256, 1, 4096, 256, 256, 256, 4096]
    - [115, 3.538]
  - - [256, 256, 1, 8192, 256, 256, 256, 8192]
    - [50, 5.523]
  - - [256, 512, 1, 128, 256, 256, 256, 128]
    - [38, 0.677]
  - - [256, 512, 1, 256, 256, 256, 256, 256]
    - [38, 1.225]
  - - [256, 512, 1, 512, 256, 256, 256, 512]
    - [52, 2.011]
  - - [256, 512, 1, 1024, 256, 256, 256, 1024]
    - [53, 3.107]
  - - [256, 512, 1, 2048, 256, 256, 256, 2048]
    - [50, 4.143]
  - - [256, 512, 1, 4096, 256, 256, 256, 4096]
    - [136, 6.184]
  - - [256, 512, 1, 8192, 256, 256, 256, 8192]
    - [46, 8.326]
  - - [256, 1024, 1, 128, 256, 256, 256, 128]
    - [37, 1.256]
  - - [256, 1024, 1, 256, 256, 256, 256, 256]
    - [50, 2.219]
  - - [256, 1024, 1, 512, 256, 256, 256, 512]
    - [50, 3.656]
  - - [256, 1024, 1, 1024, 256, 256, 256, 1024]
    - [50, 5.569]
  - - [256, 1024, 1, 2048, 256, 256, 256, 2048]
    - [131, 6.854]
  - - [256, 1024, 1, 4096, 256, 256, 256, 4096]
    - [136, 9.97]
  - - [256, 1024, 1, 8192, 256, 256, 256, 8192]
    - [126, 12.54]
  - - [256, 2048, 1, 128, 256, 256, 256, 128]
    - [34, 2.213]
  - - [256, 2048, 1, 256, 256, 256, 256, 256]
    - [34, 3.862]
  - - [256, 2048, 1, 512, 256, 256, 256, 512]
    - [48, 6.278]
  - - [256, 2048, 1, 1024, 256, 256, 256, 1024]
    - [48, 9.204]
  - - [256, 2048, 1, 2048, 256, 256, 256, 2048]
    - [132, 11.218]
  - - [256, 2048, 1, 4096, 256, 256, 256, 4096]
    - [109, 14.356]
  - - [256, 2048, 1, 8192, 256, 256, 256, 8192]
    - [91, 15.895]
  - - [256, 4096, 1, 128, 256, 256, 256, 128]
    - [7, 3.668]
  - - [256, 4096, 1, 256, 256, 256, 256, 256]
    - [109, 6.133]
  - - [256, 4096, 1, 512, 256, 256, 256, 512]
    - [42, 9.643]
  - - [256, 4096, 1, 1024, 256, 256, 256, 1024]
    - [125, 13.792]
  - - [256, 4096, 1, 2048, 256, 256, 256, 2048]
    - [109, 15.174]
  - - [256, 4096, 1, 4096, 256, 256, 256, 4096]
    - [93, 17.457]
  - - [256, 4096, 1, 8192, 256, 256, 256, 8192]
    - [22, 19.369]
  - - [256, 8192, 1, 128, 256, 256, 256, 128]
    - [25, 5.353]
  - - [256, 8192, 1, 256, 256, 256, 256, 256]
    - [91, 9.058]
  - - [256, 8192, 1, 512, 256, 256, 256, 512]
    - [93, 14.021]
  - - [256, 8192, 1, 1024, 256, 256, 256, 1024]
    - [119, 15.097]
  - - [256, 8192, 1, 2048, 256, 256, 256, 2048]
    - [124, 17.708]
  - - [256, 8192, 1, 4096, 256, 256, 256, 4096]
    - [96, 21.396]
  - - [256, 8192, 1, 8192, 256, 256, 256, 8192]
    - [12, 24.409]
  - - [512, 128, 1, 128, 512, 512, 512, 128]
    - [38, 0.34]
  - - [512, 128, 1, 256, 512, 512, 512, 256]
    - [38, 0.624]
  - - [512, 128, 1, 512, 512, 512, 512, 512]
    - [53, 1.047]
  - - [512, 128, 1, 1024, 512, 512, 512, 1024]
    - [53, 1.575]
  - - [512, 128, 1, 2048, 512, 512, 512, 2048]
    - [52, 2.341]
  - - [512, 128, 1, 4096, 512, 512, 512, 4096]
    - [36, 3.481]
  - - [512, 128, 1, 8192, 512, 512, 512, 8192]
    - [137, 5.022]
  - - [512, 256, 1, 128, 512, 512, 512, 128]
    - [38, 0.669]
  - - [512, 256, 1, 256, 512, 512, 512, 256]
    - [38, 1.208]
  - - [512, 256, 1, 512, 512, 512, 512, 512]
    - [38, 2.027]
  - - [512, 256, 1, 1024, 512, 512, 512, 1024]
    - [53, 3.08]
  - - [512, 256, 1, 2048, 512, 512, 512, 2048]
    - [136, 4.128]
  - - [512, 256, 1, 4096, 512, 512, 512, 4096]
    - [51, 5.969]
  - - [512, 256, 1, 8192, 512, 512, 512, 8192]
    - [47, 8.014]
  - - [512, 512, 1, 128, 512, 512, 512, 128]
    - [37, 1.258]
  - - [512, 512, 1, 256, 512, 512, 512, 256]
    - [37, 2.231]
  - - [512, 512, 1, 512, 512, 512, 512, 512]
    - [50, 3.641]
  - - [512, 512, 1, 1024, 512, 512, 512, 1024]
    - [50, 5.5]
  - - [512, 512, 1, 2048, 512, 512, 512, 2048]
    - [131, 6.805]
  - - [512, 512, 1, 4096, 512, 512, 512, 4096]
    - [32, 9.36]
  - - [512, 512, 1, 8192, 512, 512, 512, 8192]
    - [41, 12.616]
  - - [512, 1024, 1, 128, 512, 512, 512, 128]
    - [35, 2.174]
  - - [512, 1024, 1, 256, 512, 512, 512, 256]
    - [35, 3.789]
  - - [512, 1024, 1, 512, 512, 512, 512, 512]
    - [48, 6.344]
  - - [512, 1024, 1, 1024, 512, 512, 512, 1024]
    - [47, 9.093]
  - - [512, 1024, 1, 2048, 512, 512, 512, 2048]
    - [131, 11.026]
  - - [512, 1024, 1, 4096, 512, 512, 512, 4096]
    - [33, 13.57]
  - - [512, 1024, 1, 8192, 512, 512, 512, 8192]
    - [91, 15.335]
  - - [512, 2048, 1, 128, 512, 512, 512, 128]
    - [7, 3.638]
  - - [512, 2048, 1, 256, 512, 512, 512, 256]
    - [32, 6.196]
  - - [512, 2048, 1, 512, 512, 512, 512, 512]
    - [43, 9.682]
  - - [512, 2048, 1, 1024, 512, 512, 512, 1024]
    - [126, 13.759]
  - - [512, 2048, 1, 2048, 512, 512, 512, 2048]
    - [108, 15.165]
  - - [512, 2048, 1, 4096, 512, 512, 512, 4096]
    - [98, 16.676]
  - - [512, 2048, 1, 8192, 512, 512, 512, 8192]
    - [74, 18.397]
  - - [512, 4096, 1, 128, 512, 512, 512, 128]
    - [25, 5.378]
  - - [512, 4096, 1, 256, 512, 512, 512, 256]
    - [92, 8.909]
  - - [512, 4096, 1, 512, 512, 512, 512, 512]
    - [93, 13.857]
  - - [512, 4096, 1, 1024, 512, 512, 512, 1024]
    - [108, 15.296]
  - - [512, 4096, 1, 2048, 512, 512, 512, 2048]
    - [107, 17.913]
  - - [512, 4096, 1, 4096, 512, 512, 512, 4096]
    - [18, 20.386]
  - - [512, 4096, 1, 8192, 512, 512, 512, 8192]
    - [16, 22.035]
  - - [512, 8192, 1, 128, 512, 512, 512, 128]
    - [5, 7.476]
  - - [512, 8192, 1, 256, 512, 512, 512, 256]
    - [5, 11.872]
  - - [512, 8192, 1, 512, 512, 512, 512, 512]
    - [82, 16.812]
  - - [512, 8192, 1, 1024, 512, 512, 512, 1024]
    - [126, 18.572]
  - - [512, 8192, 1, 2048, 512, 512, 512, 2048]
    - [91, 22.297]
  - - [512, 8192, 1, 4096, 512, 512, 512, 4096]
    - [19, 25.31]
  - - [512, 8192, 1, 8192, 512, 512, 512, 8192]
    - [15, 26.828]
  - - [1024, 128, 1, 128, 1024, 1024, 1024, 128]
    - [38, 0.669]
  - - [1024, 128, 1, 256, 1024, 1024, 1024, 256]
    - [38, 1.202]
  - - [1024, 128, 1, 512, 1024, 1024, 1024, 512]
    - [53, 1.927]
  - - [1024, 128, 1, 1024, 1024, 1024, 1024, 1024]
    - [53, 3.089]
  - - [1024, 128, 1, 2048, 1024, 1024, 1024, 2048]
    - [50, 4.112]
  - - [1024, 128, 1, 4096, 1024, 1024, 1024, 4096]
    - [35, 5.682]
  - - [1024, 128, 1, 8192, 1024, 1024, 1024, 8192]
    - [134, 8.046]
  - - [1024, 256, 1, 128, 1024, 1024, 1024, 128]
    - [37, 1.263]
  - - [1024, 256, 1, 256, 1024, 1024, 1024, 256]
    - [37, 2.219]
  - - [1024, 256, 1, 512, 1024, 1024, 1024, 512]
    - [50, 3.677]
  - - [1024, 256, 1, 1024, 1024, 1024, 1024, 1024]
    - [50, 5.536]
  - - [1024, 256, 1, 2048, 1024, 1024, 1024, 2048]
    - [47, 6.774]
  - - [1024, 256, 1, 4096, 1024, 1024, 1024, 4096]
    - [112, 9.063]
  - - [1024, 256, 1, 8192, 1024, 1024, 1024, 8192]
    - [129, 12.576]
  - - [1024, 512, 1, 128, 1024, 1024, 1024, 128]
    - [48, 2.193]
  - - [1024, 512, 1, 256, 1024, 1024, 1024, 256]
    - [48, 3.833]
  - - [1024, 512, 1, 512, 1024, 1024, 1024, 512]
    - [48, 6.251]
  - - [1024, 512, 1, 1024, 1024, 1024, 1024, 1024]
    - [48, 9.061]
  - - [1024, 512, 1, 2048, 1024, 1024, 1024, 2048]
    - [42, 10.418]
  - - [1024, 512, 1, 4096, 1024, 1024, 1024, 4096]
    - [33, 13.33]
  - - [1024, 512, 1, 8192, 1024, 1024, 1024, 8192]
    - [91, 15.521]
  - - [1024, 1024, 1, 128, 1024, 1024, 1024, 128]
    - [7, 3.67]
  - - [1024, 1024, 1, 256, 1024, 1024, 1024, 256]
    - [31, 6.241]
  - - [1024, 1024, 1, 512, 1024, 1024, 1024, 512]
    - [42, 9.705]
  - - [1024, 1024, 1, 1024, 1024, 1024, 1024, 1024]
    - [125, 13.764]
  - - [1024, 1024, 1, 2048, 1024, 1024, 1024, 2048]
    - [133, 13.932]
  - - [1024, 1024, 1, 4096, 1024, 1024, 1024, 4096]
    - [27, 16.55]
  - - [1024, 1024, 1, 8192, 1024, 1024, 1024, 8192]
    - [74, 18.085]
  - - [1024, 2048, 1, 128, 1024, 1024, 1024, 128]
    - [24, 5.41]
  - - [1024, 2048, 1, 256, 1024, 1024, 1024, 256]
    - [92, 9.083]
  - - [1024, 2048, 1, 512, 1024, 1024, 1024, 512]
    - [93, 14.136]
  - - [1024, 2048, 1, 1024, 1024, 1024, 1024, 1024]
    - [108, 14.986]
  - - [1024, 2048, 1, 2048, 1024, 1024, 1024, 2048]
    - [120, 17.455]
  - - [1024, 2048, 1, 4096, 1024, 1024, 1024, 4096]
    - [76, 20.029]
  - - [1024, 2048, 1, 8192, 1024, 1024, 1024, 8192]
    - [17, 21.856]
  - - [1024, 4096, 1, 128, 1024, 1024, 1024, 128]
    - [72, 7.596]
  - - [1024, 4096, 1, 256, 1024, 1024, 1024, 256]
    - [72, 12.193]
  - - [1024, 4096, 1, 512, 1024, 1024, 1024, 512]
    - [82, 16.832]
  - - [1024, 4096, 1, 1024, 1024, 1024, 1024, 1024]
    - [126, 18.638]
  - - [1024, 4096, 1, 2048, 1024, 1024, 1024, 2048]
    - [93, 21.266]
  - - [1024, 4096, 1, 4096, 1024, 1024, 1024, 4096]
    - [14, 22.753]
  - - [1024, 4096, 1, 8192, 1024, 1024, 1024, 8192]
    - [19, 25.567]
  - - [1024, 8192, 1, 128, 1024, 1024, 1024, 128]
    - [1, 8.813]
  - - [1024, 8192, 1, 256, 1024, 1024, 1024, 256]
    - [1, 13.799]
  - - [1024, 8192, 1, 512, 1024, 1024, 1024, 512]
    - [91, 17.616]
  - - [1024, 8192, 1, 1024, 1024, 1024, 1024, 1024]
    - [90, 22.19]
  - - [1024, 8192, 1, 2048, 1024, 1024, 1024, 2048]
    - [86, 24.43]
  - - [1024, 8192, 1, 4096, 1024, 1024, 1024, 4096]
    - [12, 26.077]
  - - [1024, 8192, 1, 8192, 1024, 1024, 1024, 8192]
    - [2, 27.3]
  - - [2048, 128, 1, 128, 2048, 2048, 2048, 128]
    - [37, 1.254]
  - - [2048, 128, 1, 256, 2048, 2048, 2048, 256]
    - [50, 2.219]
  - - [2048, 128, 1, 512, 2048, 2048, 2048, 512]
    - [50, 3.637]
  - - [2048, 128, 1, 1024, 2048, 2048, 2048, 1024]
    - [50, 5.488]
  - - [2048, 128, 1, 2048, 2048, 2048, 2048, 2048]
    - [49, 6.407]
  - - [2048, 128, 1, 4096, 2048, 2048, 2048, 4096]
    - [114, 9.087]
  - - [2048, 128, 1, 8192, 2048, 2048, 2048, 8192]
    - [128, 12.533]
  - - [2048, 256, 1, 128, 2048, 2048, 2048, 128]
    - [34, 2.202]
  - - [2048, 256, 1, 256, 2048, 2048, 2048, 256]
    - [34, 3.839]
  - - [2048, 256, 1, 512, 2048, 2048, 2048, 512]
    - [48, 6.229]
  - - [2048, 256, 1, 1024, 2048, 2048, 2048, 1024]
    - [47, 9.203]
  - - [2048, 256, 1, 2048, 2048, 2048, 2048, 2048]
    - [34, 10.142]
  - - [2048, 256, 1, 4096, 2048, 2048, 2048, 4096]
    - [105, 13.289]
  - - [2048, 256, 1, 8192, 2048, 2048, 2048, 8192]
    - [97, 15.611]
  - - [2048, 512, 1, 128, 2048, 2048, 2048, 128]
    - [7, 3.647]
  - - [2048, 512, 1, 256, 2048, 2048, 2048, 256]
    - [32, 6.166]
  - - [2048, 512, 1, 512, 2048, 2048, 2048, 512]
    - [44, 9.391]
  - - [2048, 512, 1, 1024, 2048, 2048, 2048, 1024]
    - [40, 13.486]
  - - [2048, 512, 1, 2048, 2048, 2048, 2048, 2048]
    - [133, 13.814]
  - - [2048, 512, 1, 4096, 2048, 2048, 2048, 4096]
    - [119, 16.576]
  - - [2048, 512, 1, 8192, 2048, 2048, 2048, 8192]
    - [77, 18.332]
  - - [2048, 1024, 1, 128, 2048, 2048, 2048, 128]
    - [25, 5.339]
  - - [2048, 1024, 1, 256, 2048, 2048, 2048, 256]
    - [92, 9.095]
  - - [2048, 1024, 1, 512, 2048, 2048, 2048, 512]
    - [92, 14.125]
  - - [2048, 1024, 1, 1024, 2048, 2048, 2048, 1024]
    - [110, 14.643]
  - - [2048, 1024, 1, 2048, 2048, 2048, 2048, 2048]
    - [121, 17.538]
  - - [2048, 1024, 1, 4096, 2048, 2048, 2048, 4096]
    - [74, 20.165]
  - - [2048, 1024, 1, 8192, 2048, 2048, 2048, 8192]
    - [8, 20.67]
  - - [2048, 2048, 1, 128, 2048, 2048, 2048, 128]
    - [3, 7.498]
  - - [2048, 2048, 1, 256, 2048, 2048, 2048, 256]
    - [67, 11.885]
  - - [2048, 2048, 1, 512, 2048, 2048, 2048, 512]
    - [82, 16.547]
  - - [2048, 2048, 1, 1024, 2048, 2048, 2048, 1024]
    - [99, 17.648]
  - - [2048, 2048, 1, 2048, 2048, 2048, 2048, 2048]
    - [102, 20.847]
  - - [2048, 2048, 1, 4096, 2048, 2048, 2048, 4096]
    - [73, 23.244]
  - - [2048, 2048, 1, 8192, 2048, 2048, 2048, 8192]
    - [77, 25.08]
  - - [2048, 4096, 1, 128, 2048, 2048, 2048, 128]
    - [64, 8.711]
  - - [2048, 4096, 1, 256, 2048, 2048, 2048, 256]
    - [0, 13.617]
  - - [2048, 4096, 1, 512, 2048, 2048, 2048, 512]
    - [91, 16.885]
  - - [2048, 4096, 1, 1024, 2048, 2048, 2048, 1024]
    - [92, 21.547]
  - - [2048, 4096, 1, 2048, 2048, 2048, 2048, 2048]
    - [78, 25.118]
  - - [2048, 4096, 1, 4096, 2048, 2048, 2048, 4096]
    - [76, 25.876]
  - - [2048, 4096, 1, 8192, 2048, 2048, 2048, 8192]
    - [63, 27.232]
  - - [2048, 8192, 1, 128, 2048, 2048, 2048, 128]
    - [92, 8.986]
  - - [2048, 8192, 1, 256, 2048, 2048, 2048, 256]
    - [93, 14.39]
  - - [2048, 8192, 1, 512, 2048, 2048, 2048, 512]
    - [92, 19.492]
  - - [2048, 8192, 1, 1024, 2048, 2048, 2048, 1024]
    - [96, 23.459]
  - - [2048, 8192, 1, 2048, 2048, 2048, 2048, 2048]
    - [77, 27.223]
  - - [2048, 8192, 1, 4096, 2048, 2048, 2048, 4096]
    - [76, 28.53]
  - - [2048, 8192, 1, 8192, 2048, 2048, 2048, 8192]
    - [76, 29.765]
  - - [4096, 128, 1, 128, 4096, 4096, 4096, 128]
    - [34, 2.204]
  - - [4096, 128, 1, 256, 4096, 4096, 4096, 256]
    - [113, 3.819]
  - - [4096, 128, 1, 512, 4096, 4096, 4096, 512]
    - [47, 6.334]
  - - [4096, 128, 1, 1024, 4096, 4096, 4096, 1024]
    - [135, 8.761]
  - - [4096, 128, 1, 2048, 4096, 4096, 4096, 2048]
    - [35, 10.371]
  - - [4096, 128, 1, 4096, 4096, 4096, 4096, 4096]
    - [111, 13.561]
  - - [4096, 128, 1, 8192, 4096, 4096, 4096, 8192]
    - [119, 15.789]
  - - [4096, 256, 1, 128, 4096, 4096, 4096, 128]
    - [32, 3.647]
  - - [4096, 256, 1, 256, 4096, 4096, 4096, 256]
    - [109, 6.166]
  - - [4096, 256, 1, 512, 4096, 4096, 4096, 512]
    - [111, 9.406]
  - - [4096, 256, 1, 1024, 4096, 4096, 4096, 1024]
    - [130, 13.566]
  - - [4096, 256, 1, 2048, 4096, 4096, 4096, 2048]
    - [104, 14.851]
  - - [4096, 256, 1, 4096, 4096, 4096, 4096, 4096]
    - [120, 17.792]
  - - [4096, 256, 1, 8192, 4096, 4096, 4096, 8192]
    - [21, 19.147]
  - - [4096, 512, 1, 128, 4096, 4096, 4096, 128]
    - [6, 5.283]
  - - [4096, 512, 1, 256, 4096, 4096, 4096, 256]
    - [28, 8.972]
  - - [4096, 512, 1, 512, 4096, 4096, 4096, 512]
    - [101, 13.955]
  - - [4096, 512, 1, 1024, 4096, 4096, 4096, 1024]
    - [121, 14.752]
  - - [4096, 512, 1, 2048, 4096, 4096, 4096, 2048]
    - [105, 17.683]
  - - [4096, 512, 1, 4096, 4096, 4096, 4096, 4096]
    - [89, 21.237]
  - - [4096, 512, 1, 8192, 4096, 4096, 4096, 8192]
    - [76, 22.056]
  - - [4096, 1024, 1, 128, 4096, 4096, 4096, 128]
    - [71, 7.623]
  - - [4096, 1024, 1, 256, 4096, 4096, 4096, 256]
    - [71, 12.177]
  - - [4096, 1024, 1, 512, 4096, 4096, 4096, 512]
    - [85, 16.411]
  - - [4096, 1024, 1, 1024, 4096, 4096, 4096, 1024]
    - [103, 18.209]
  - - [4096, 1024, 1, 2048, 4096, 4096, 4096, 2048]
    - [94, 21.484]
  - - [4096, 1024, 1, 4096, 4096, 4096, 4096, 4096]
    - [74, 23.55]
  - - [4096, 1024, 1, 8192, 4096, 4096, 4096, 8192]
    - [79, 25.235]
  - - [4096, 2048, 1, 128, 4096, 4096, 4096, 128]
    - [62, 8.639]
  - - [4096, 2048, 1, 256, 4096, 4096, 4096, 256]
    - [62, 13.739]
  - - [4096, 2048, 1, 512, 4096, 4096, 4096, 512]
    - [101, 16.761]
  - - [4096, 2048, 1, 1024, 4096, 4096, 4096, 1024]
    - [100, 20.899]
  - - [4096, 2048, 1, 2048, 4096, 4096, 4096, 2048]
    - [79, 25.093]
  - - [4096, 2048, 1, 4096, 4096, 4096, 4096, 4096]
    - [76, 27.635]
  - - [4096, 2048, 1, 8192, 4096, 4096, 4096, 8192]
    - [59, 29.963]
  - - [4096, 4096, 1, 128, 4096, 4096, 4096, 128]
    - [91, 8.717]
  - - [4096, 4096, 1, 256, 4096, 4096, 4096, 256]
    - [95, 13.867]
  - - [4096, 4096, 1, 512, 4096, 4096, 4096, 512]
    - [101, 19.504]
  - - [4096, 4096, 1, 1024, 4096, 4096, 4096, 1024]
    - [9, 23.123]
  - - [4096, 4096, 1, 2048, 4096, 4096, 4096, 2048]
    - [75, 27.796]
  - - [4096, 4096, 1, 4096, 4096, 4096, 4096, 4096]
    - [76, 31.072]
  - - [4096, 4096, 1, 8192, 4096, 4096, 4096, 8192]
    - [60, 30.572]
  - - [4096, 8192, 1, 128, 4096, 4096, 4096, 128]
    - [23, 10.297]
  - - [4096, 8192, 1, 256, 4096, 4096, 4096, 256]
    - [70, 15.112]
  - - [4096, 8192, 1, 512, 4096, 4096, 4096, 512]
    - [81, 19.811]
  - - [4096, 8192, 1, 1024, 4096, 4096, 4096, 1024]
    - [87, 25.239]
  - - [4096, 8192, 1, 2048, 4096, 4096, 4096, 2048]
    - [88, 29.064]
  - - [4096, 8192, 1, 4096, 4096, 4096, 4096, 4096]
    - [56, 34.023]
  - - [4096, 8192, 1, 8192, 4096, 4096, 4096, 8192]
    - [60, 36.276]
  - - [8192, 128, 1, 128, 8192, 8192, 8192, 128]
    - [31, 3.684]
  - - [8192, 128, 1, 256, 8192, 8192, 8192, 256]
    - [33, 6.157]
  - - [8192, 128, 1, 512, 8192, 8192, 8192, 512]
    - [29, 9.361]
  - - [8192, 128, 1, 1024, 8192, 8192, 8192, 1024]
    - [127, 12.73]
  - - [8192, 128, 1, 2048, 8192, 8192, 8192, 2048]
    - [106, 14.017]
  - - [8192, 128, 1, 4096, 8192, 8192, 8192, 4096]
    - [118, 17.168]
  - - [8192, 128, 1, 8192, 8192, 8192, 8192, 8192]
    - [30, 20.031]
  - - [8192, 256, 1, 128, 8192, 8192, 8192, 128]
    - [28, 5.181]
  - - [8192, 256, 1, 256, 8192, 8192, 8192, 256]
    - [28, 9.042]
  - - [8192, 256, 1, 512, 8192, 8192, 8192, 512]
    - [96, 13.708]
  - - [8192, 256, 1, 1024, 8192, 8192, 8192, 1024]
    - [110, 15.097]
  - - [8192, 256, 1, 2048, 8192, 8192, 8192, 2048]
    - [123, 18.797]
  - - [8192, 256, 1, 4096, 8192, 8192, 8192, 4096]
    - [20, 21.201]
  - - [8192, 256, 1, 8192, 8192, 8192, 8192, 8192]
    - [9, 24.496]
  - - [8192, 512, 1, 128, 8192, 8192, 8192, 128]
    - [4, 7.296]
  - - [8192, 512, 1, 256, 8192, 8192, 8192, 256]
    - [69, 11.778]
  - - [8192, 512, 1, 512, 8192, 8192, 8192, 512]
    - [85, 16.341]
  - - [8192, 512, 1, 1024, 8192, 8192, 8192, 1024]
    - [122, 18.079]
  - - [8192, 512, 1, 2048, 8192, 8192, 8192, 2048]
    - [96, 22.085]
  - - [8192, 512, 1, 4096, 8192, 8192, 8192, 4096]
    - [11, 25.71]
  - - [8192, 512, 1, 8192, 8192, 8192, 8192, 8192]
    - [77, 26.95]
  - - [8192, 1024, 1, 128, 8192, 8192, 8192, 128]
    - [66, 8.756]
  - - [8192, 1024, 1, 256, 8192, 8192, 8192, 256]
    - [61, 13.862]
  - - [8192, 1024, 1, 512, 8192, 8192, 8192, 512]
    - [101, 16.749]
  - - [8192, 1024, 1, 1024, 8192, 8192, 8192, 1024]
    - [100, 21.629]
  - - [8192, 1024, 1, 2048, 8192, 8192, 8192, 2048]
    - [77, 24.363]
  - - [8192, 1024, 1, 4096, 8192, 8192, 8192, 4096]
    - [77, 28.561]
  - - [8192, 1024, 1, 8192, 8192, 8192, 8192, 8192]
    - [60, 28.347]
  - - [8192, 2048, 1, 128, 8192, 8192, 8192, 128]
    - [97, 8.633]
  - - [8192, 2048, 1, 256, 8192, 8192, 8192, 256]
    - [100, 13.916]
  - - [8192, 2048, 1, 512, 8192, 8192, 8192, 512]
    - [101, 19.931]
  - - [8192, 2048, 1, 1024, 8192, 8192, 8192, 1024]
    - [100, 22.41]
  - - [8192, 2048, 1, 2048, 8192, 8192, 8192, 2048]
    - [8, 26.129]
  - - [8192, 2048, 1, 4096, 8192, 8192, 8192, 4096]
    - [10, 29.975]
  - - [8192, 2048, 1, 8192, 8192, 8192, 8192, 8192]
    - [60, 32.028]
  - - [8192, 4096, 1, 128, 8192, 8192, 8192, 128]
    - [102, 9.98]
  - - [8192, 4096, 1, 256, 8192, 8192, 8192, 256]
    - [101, 15.099]
  - - [8192, 4096, 1, 512, 8192, 8192, 8192, 512]
    - [84, 20.034]
  - - [8192, 4096, 1, 1024, 8192, 8192, 8192, 1024]
    - [83, 25.617]
  - - [8192, 4096, 1, 2048, 8192, 8192, 8192, 2048]
    - [9, 29.6]
  - - [8192, 4096, 1, 4096, 8192, 8192, 8192, 4096]
    - [58, 34.567]
  - - [8192, 4096, 1, 8192, 8192, 8192, 8192, 8192]
    - [57, 36.093]
  - - [8192, 8192, 1, 128, 8192, 8192, 8192, 128]
    - [13, 9.796]
  - - [8192, 8192, 1, 256, 8192, 8192, 8192, 256]
    - [68, 14.997]
  - - [8192, 8192, 1, 512, 8192, 8192, 8192, 512]
    - [58, 20.804]
  - - [8192, 8192, 1, 1024, 8192, 8192, 8192, 1024]
    - [85, 27.133]
  - - [8192, 8192, 1, 2048, 8192, 8192, 8192, 2048]
    - [63, 32.787]
  - - [8192, 8192, 1, 4096, 8192, 8192, 8192, 4096]
    - [80, 35.255]
  - - [8192, 8192, 1, 8192, 8192, 8192, 8192, 8192]
    - [65, 38.745]
  - - [1, 1, 1, 32, 1, 1, 1, 32]
    - [140, 0.0]
- null
- null
- ExperimentalStreamK
- GridBased
