library/src/amd_detail/rocblaslt/src/Tensile/Logic/asm_full/aquavanjaram/gfx942_228cu/StreamK/aquavanjaram942_Cijk_Alik_Bljk_BBS_BH_UserArgs.yaml
- {MinimumRequiredVersion: 4.33.0}
- aquavanjaram942
- {Architecture: gfx942, CUCount: 228}
- [Device 0049, Device 0050]
    SolutionIndex: 0
    SolutionNameMin: Cijk_Alik_Bljk_BBS_BH_UserArgs_MT256x64x64_MI16x16x1_SN_LDSB1_CLR1_GSU0_GSUC0_GSUWGMRR0_K1_LBSPPA256_LBSPPB256_MIWT8_2_PLR1_SU32_SUM0_SUS256_SKXCCM0_VWA2_VWB2_WGM1_WGMXCC1_WGMXCCGn1
    SolutionIndex: 1
    SolutionNameMin: Cijk_Alik_Bljk_BBS_BH_UserArgs_MT256x64x64_MI16x16x1_SN_LDSB1_CLR1_GSU0_GSUC0_GSUWGMRR0_K1_LBSPPA512_LBSPPB256_MIWT8_2_PLR1_SU32_SUM0_SUS256_SKXCCM0_VWA4_VWB2_WGM1_WGMXCC1_WGMXCCGn1
    SolutionIndex: 2
    SolutionNameMin: Cijk_Alik_Bljk_BBS_BH_UserArgs_MT256x64x64_MI16x16x1_SN_LDSB1_CLR1_GSU0_GSUC0_GSUWGMRR0_K1_LBSPPA512_LBSPPB256_MIWT8_2_PLR1_SU32_SUM0_SUS256_SKXCCM0_VWA4_VWB2_WGM4_WGMXCC1_WGMXCCGn1
    SolutionIndex: 3
    SolutionNameMin: Cijk_Alik_Bljk_BBS_BH_UserArgs_MT256x64x64_MI16x16x1_SN_LDSB1_CLR1_GSU0_GSUC0_GSUWGMRR0_K1_LBSPPA256_LBSPPB128_MIWT8_2_PLR1_SU32_SUM0_SUS256_SKXCCM0_VWA2_VWB1_WGM8_WGMXCC1_WGMXCCGn1
    SolutionIndex: 4
    SolutionNameMin: Cijk_Alik_Bljk_BBS_BH_UserArgs_MT256x64x64_MI16x16x1_SN_LDSB1_CLR1_GSU0_GSUC0_GSUWGMRR0_K1_LBSPPA512_LBSPPB256_MIWT8_2_PLR1_SU32_SUM0_SUS256_SKXCCM0_VWA4_VWB2_WGM8_WGMXCC1_WGMXCCGn1
    SolutionIndex: 5
    SolutionNameMin: Cijk_Alik_Bljk_BBS_BH_UserArgs_MT128x128x64_MI16x16x1_SN_LDSB1_CLR1_GSU0_GSUC0_GSUWGMRR0_K1_LBSPPA512_LBSPPB128_MIWT4_4_PLR1_SU32_SUM0_SUS256_SKXCCM0_VWA4_VWB1_WGM1_WGMXCC1_WGMXCCGn1
    SolutionIndex: 6
    SolutionNameMin: Cijk_Alik_Bljk_BBS_BH_UserArgs_MT128x128x64_MI16x16x1_SN_LDSB1_CLR1_GSU0_GSUC0_GSUWGMRR0_K1_LBSPPA512_LBSPPB256_MIWT4_4_PLR1_SU32_SUM0_SUS256_SKXCCM0_VWA4_VWB2_WGM1_WGMXCC1_WGMXCCGn1
    SolutionIndex: 7
    SolutionNameMin: Cijk_Alik_Bljk_BBS_BH_UserArgs_MT128x128x64_MI16x16x1_SN_LDSB1_CLR1_GSU0_GSUC0_GSUWGMRR0_K1_LBSPPA256_LBSPPB512_MIWT4_4_PLR1_SU32_SUM0_SUS256_SKXCCM0_VWA2_VWB4_WGM1_WGMXCC1_WGMXCCGn1
    SolutionIndex: 8
    SolutionNameMin: Cijk_Alik_Bljk_BBS_BH_UserArgs_MT128x128x64_MI16x16x1_SN_LDSB1_CLR1_GSU0_GSUC0_GSUWGMRR0_K1_LBSPPA512_LBSPPB512_MIWT4_4_PLR1_SU32_SUM0_SUS256_SKXCCM0_VWA4_VWB4_WGM1_WGMXCC1_WGMXCCGn1
    SolutionIndex: 9
    SolutionNameMin: Cijk_Alik_Bljk_BBS_BH_UserArgs_MT128x128x64_MI16x16x1_SN_LDSB1_CLR1_GSU0_GSUC0_GSUWGMRR0_K1_LBSPPA256_LBSPPB512_MIWT4_4_PLR1_SU32_SUM0_SUS256_SKXCCM0_VWA2_VWB4_WGM4_WGMXCC1_WGMXCCGn1
    SolutionIndex: 10
    SolutionNameMin: Cijk_Alik_Bljk_BBS_BH_UserArgs_MT128x128x64_MI16x16x1_SN_LDSB1_CLR1_GSU0_GSUC0_GSUWGMRR0_K1_LBSPPA512_LBSPPB256_MIWT4_4_PLR1_SU32_SUM0_SUS256_SKXCCM0_VWA4_VWB2_WGM8_WGMXCC1_WGMXCCGn1
    SolutionIndex: 11
    SolutionNameMin: Cijk_Alik_Bljk_BBS_BH_UserArgs_MT128x128x64_MI16x16x1_SN_LDSB1_CLR1_GSU0_GSUC0_GSUWGMRR0_K1_LBSPPA256_LBSPPB512_MIWT4_4_PLR1_SU32_SUM0_SUS256_SKXCCM0_VWA2_VWB4_WGM8_WGMXCC1_WGMXCCGn1
    SolutionIndex: 12
    SolutionNameMin: Cijk_Alik_Bljk_BBS_BH_UserArgs_MT64x128x64_MI16x16x1_SN_LDSB1_CLR1_GSU0_GSUC0_GSUWGMRR0_K1_LBSPPA256_LBSPPB128_MIWT2_4_PLR1_SU32_SUM0_SUS256_SKXCCM0_VWA2_VWB1_WGM1_WGMXCC1_WGMXCCGn1
    SolutionIndex: 13
    SolutionNameMin: Cijk_Alik_Bljk_BBS_BH_UserArgs_MT64x128x64_MI16x16x1_SN_LDSB1_CLR1_GSU0_GSUC0_GSUWGMRR0_K1_LBSPPA256_LBSPPB256_MIWT2_4_PLR1_SU32_SUM0_SUS256_SKXCCM0_VWA2_VWB2_WGM1_WGMXCC1_WGMXCCGn1
    SolutionIndex: 14
    SolutionNameMin: Cijk_Alik_Bljk_BBS_BH_UserArgs_MT64x128x64_MI16x16x1_SN_LDSB1_CLR1_GSU0_GSUC0_GSUWGMRR0_K1_LBSPPA256_LBSPPB512_MIWT2_4_PLR1_SU32_SUM0_SUS256_SKXCCM0_VWA2_VWB4_WGM1_WGMXCC1_WGMXCCGn1
    SolutionIndex: 15
    SolutionNameMin: Cijk_Alik_Bljk_BBS_BH_UserArgs_MT64x128x64_MI16x16x1_SN_LDSB1_CLR1_GSU0_GSUC0_GSUWGMRR0_K1_LBSPPA256_LBSPPB128_MIWT2_4_PLR1_SU32_SUM0_SUS256_SKXCCM0_VWA2_VWB1_WGM8_WGMXCC1_WGMXCCGn1
    SolutionIndex: 16
    SolutionNameMin: Cijk_Alik_Bljk_BBS_BH_UserArgs_MT128x64x64_MI16x16x1_SN_LDSB1_CLR1_GSU0_GSUC0_GSUWGMRR0_K1_LBSPPA512_LBSPPB128_MIWT4_2_PLR1_SU32_SUM0_SUS256_SKXCCM0_VWA4_VWB1_WGM1_WGMXCC1_WGMXCCGn1
    SolutionIndex: 17
    SolutionNameMin: Cijk_Alik_Bljk_BBS_BH_UserArgs_MT128x64x64_MI16x16x1_SN_LDSB1_CLR1_GSU0_GSUC0_GSUWGMRR0_K1_LBSPPA512_LBSPPB256_MIWT4_2_PLR1_SU32_SUM0_SUS256_SKXCCM0_VWA4_VWB2_WGM1_WGMXCC1_WGMXCCGn1
    SolutionIndex: 18
    SolutionNameMin: Cijk_Alik_Bljk_BBS_BH_UserArgs_MT128x64x64_MI16x16x1_SN_LDSB1_CLR1_GSU0_GSUC0_GSUWGMRR0_K1_LBSPPA512_LBSPPB256_MIWT4_2_PLR2_SU32_SUM0_SUS256_SKXCCM0_VWA4_VWB2_WGM1_WGMXCC1_WGMXCCGn1
    SolutionIndex: 19
    SolutionNameMin: Cijk_Alik_Bljk_BBS_BH_UserArgs_MT64x64x64_MI16x16x1_SN_LDSB1_CLR1_GSU0_GSUC0_GSUWGMRR0_K1_LBSPPA256_LBSPPB128_MIWT2_2_PLR1_SU32_SUM0_SUS256_SKXCCM0_VWA2_VWB1_WGM1_WGMXCC1_WGMXCCGn1
    SolutionIndex: 20
    SolutionNameMin: Cijk_Alik_Bljk_BBS_BH_UserArgs_MT64x64x64_MI16x16x1_SN_LDSB1_CLR1_GSU0_GSUC0_GSUWGMRR0_K1_LBSPPA256_LBSPPB256_MIWT2_2_PLR1_SU32_SUM0_SUS256_SKXCCM0_VWA2_VWB2_WGM1_WGMXCC1_WGMXCCGn1
    SolutionIndex: 21
    SolutionNameMin: Cijk_Alik_Bljk_BBS_BH_UserArgs_MT32x64x64_MI16x16x1_SN_LDSB0_CLR1_GSU0_GSUC0_GSUWGMRR0_K1_LBSPPA128_LBSPPB128_MIWT1_2_PLR1_SU32_SUM0_SUS256_SKXCCM0_VWA1_VWB1_WGM1_WGMXCC1_WGMXCCGn1
    SolutionIndex: 22
    SolutionNameMin: Cijk_Alik_Bljk_BBS_BH_UserArgs_MT32x64x64_MI16x16x1_SN_LDSB0_CLR1_GSU0_GSUC0_GSUWGMRR0_K1_LBSPPA128_LBSPPB256_MIWT1_2_PLR1_SU32_SUM0_SUS256_SKXCCM0_VWA1_VWB2_WGM1_WGMXCC1_WGMXCCGn1
    SolutionIndex: 23
    SolutionNameMin: Cijk_Alik_Bljk_BBS_BH_UserArgs_MT64x32x64_MI16x16x1_SN_LDSB0_CLR1_GSU0_GSUC0_GSUWGMRR0_K1_LBSPPA256_LBSPPB128_MIWT2_1_PLR1_SU32_SUM0_SUS256_SKXCCM0_VWA2_VWB1_WGM1_WGMXCC1_WGMXCCGn1
    SolutionIndex: 24
    SolutionNameMin: Cijk_Alik_Bljk_BBS_BH_UserArgs_MT32x32x64_MI16x16x1_SN_LDSB0_CLR1_GSU0_GSUC0_GSUWGMRR0_K1_LBSPPA128_LBSPPB128_MIWT1_1_PLR1_SU32_SUM0_SUS256_SKXCCM0_VWA1_VWB1_WGM1_WGMXCC1_WGMXCCGn1
    SolutionIndex: 25
    SolutionNameMin: Cijk_Alik_Bljk_BBS_BH_UserArgs_MT32x32x64_MI16x16x1_SN_LDSB0_CLR1_GSU0_GSUC0_GSUWGMRR0_K1_LBSPPA128_LBSPPB128_MIWT1_1_PLR2_SU32_SUM0_SUS256_SKXCCM0_VWA1_VWB1_WGM1_WGMXCC1_WGMXCCGn1
    SolutionIndex: 26
    SolutionNameMin: Cijk_Alik_Bljk_BBS_BH_UserArgs_MT32x32x64_MI16x16x1_SN_LDSB0_CLR1_GSU0_GSUC0_GSUWGMRR0_K1_LBSPPA128_LBSPPB128_MIWT1_1_PLR1_SU32_SUM0_SUS256_SKXCCM0_VWA1_VWB1_WGM4_WGMXCC1_WGMXCCGn1
    SolutionIndex: 27
    SolutionNameMin: Cijk_Alik_Bljk_BBS_BH_UserArgs_MT32x32x64_MI16x16x1_SN_LDSB0_CLR1_GSU0_GSUC0_GSUWGMRR0_K1_LBSPPA128_LBSPPB128_MIWT1_1_PLR1_SU32_SUM0_SUS256_SKXCCM0_VWA1_VWB1_WGM8_WGMXCC1_WGMXCCGn1
    SolutionIndex: 28
    SolutionNameMin: Cijk_Alik_Bljk_BBS_BH_UserArgs_MT64x64x128_MI16x16x1_SN_LDSB1_CLR1_GSU0_GSUC0_GSUWGMRR0_K1_LBSPPA512_LBSPPB256_MIWT2_2_PLR1_SU32_SUM0_SUS256_SKXCCM0_VWA2_VWB1_WGM1_WGMXCC1_WGMXCCGn1
    SolutionIndex: 29
    SolutionNameMin: Cijk_Alik_Bljk_BBS_BH_UserArgs_MT64x64x128_MI16x16x1_SN_LDSB1_CLR1_GSU0_GSUC0_GSUWGMRR0_K1_LBSPPA512_LBSPPB512_MIWT2_2_PLR1_SU32_SUM0_SUS256_SKXCCM0_VWA2_VWB2_WGM1_WGMXCC1_WGMXCCGn1
    SolutionIndex: 30
    SolutionNameMin: Cijk_Alik_Bljk_BBS_BH_UserArgs_MT64x64x128_MI16x16x1_SN_LDSB1_CLR1_GSU0_GSUC0_GSUWGMRR0_K1_LBSPPA512_LBSPPB256_MIWT2_2_PLR2_SU32_SUM0_SUS256_SKXCCM0_VWA2_VWB1_WGM1_WGMXCC1_WGMXCCGn1
    SolutionIndex: 31
    SolutionNameMin: Cijk_Alik_Bljk_BBS_BH_UserArgs_MT64x64x128_MI16x16x1_SN_LDSB1_CLR1_GSU0_GSUC0_GSUWGMRR0_K1_LBSPPA512_LBSPPB512_MIWT2_2_PLR1_SU32_SUM0_SUS256_SKXCCM0_VWA2_VWB2_WGM8_WGMXCC1_WGMXCCGn1
    SolutionIndex: 32
    SolutionNameMin: Cijk_Alik_Bljk_BBS_BH_UserArgs_MT32x64x128_MI16x16x1_SN_LDSB1_CLR1_GSU0_GSUC0_GSUWGMRR0_K1_LBSPPA256_LBSPPB256_MIWT1_2_PLR1_SU32_SUM0_SUS256_SKXCCM0_VWA1_VWB1_WGM1_WGMXCC1_WGMXCCGn1
    SolutionIndex: 33
    SolutionNameMin: Cijk_Alik_Bljk_BBS_BH_UserArgs_MT32x64x128_MI16x16x1_SN_LDSB1_CLR1_GSU0_GSUC0_GSUWGMRR0_K1_LBSPPA256_LBSPPB512_MIWT1_2_PLR1_SU32_SUM0_SUS256_SKXCCM0_VWA1_VWB2_WGM1_WGMXCC1_WGMXCCGn1
    SolutionIndex: 34
    SolutionNameMin: Cijk_Alik_Bljk_BBS_BH_UserArgs_MT32x64x128_MI16x16x1_SN_LDSB1_CLR1_GSU0_GSUC0_GSUWGMRR0_K1_LBSPPA256_LBSPPB256_MIWT1_2_PLR2_SU32_SUM0_SUS256_SKXCCM0_VWA1_VWB1_WGM1_WGMXCC1_WGMXCCGn1
    SolutionIndex: 35
    SolutionNameMin: Cijk_Alik_Bljk_BBS_BH_UserArgs_MT64x32x128_MI16x16x1_SN_LDSB1_CLR1_GSU0_GSUC0_GSUWGMRR0_K1_LBSPPA256_LBSPPB256_MIWT2_1_PLR2_SU32_SUM0_SUS256_SKXCCM0_VWA1_VWB1_WGM1_WGMXCC1_WGMXCCGn1
    SolutionIndex: 36
    SolutionNameMin: Cijk_Alik_Bljk_BBS_BH_UserArgs_MT64x32x128_MI16x16x1_SN_LDSB1_CLR1_GSU0_GSUC0_GSUWGMRR0_K1_LBSPPA512_LBSPPB256_MIWT2_1_PLR2_SU32_SUM0_SUS256_SKXCCM0_VWA2_VWB1_WGM1_WGMXCC1_WGMXCCGn1
    SolutionIndex: 37
    SolutionNameMin: Cijk_Alik_Bljk_BBS_BH_UserArgs_MT32x32x128_MI16x16x1_SN_LDSB1_CLR1_GSU0_GSUC0_GSUWGMRR0_K1_LBSPPA256_LBSPPB256_MIWT1_1_PLR1_SU32_SUM0_SUS256_SKXCCM0_VWA1_VWB1_WGM1_WGMXCC1_WGMXCCGn1
    SolutionIndex: 38
    SolutionNameMin: Cijk_Alik_Bljk_BBS_BH_UserArgs_MT32x32x128_MI16x16x1_SN_LDSB1_CLR1_GSU0_GSUC0_GSUWGMRR0_K1_LBSPPA256_LBSPPB256_MIWT1_1_PLR2_SU32_SUM0_SUS256_SKXCCM0_VWA1_VWB1_WGM1_WGMXCC1_WGMXCCGn1
    SolutionIndex: 39
    SolutionNameMin: Cijk_Alik_Bljk_BBS_BH_UserArgs_MT32x32x128_MI16x16x1_SN_LDSB1_CLR1_GSU0_GSUC0_GSUWGMRR0_K1_LBSPPA256_LBSPPB256_MIWT1_1_PLR2_SU32_SUM0_SUS256_SKXCCM0_VWA1_VWB1_WGM4_WGMXCC1_WGMXCCGn1
    SolutionIndex: 40
    SolutionNameMin: Cijk_Alik_Bljk_BBS_BH_UserArgs_MT32x32x128_MI16x16x1_SN_LDSB1_CLR1_GSU0_GSUC0_GSUWGMRR0_K1_LBSPPA256_LBSPPB256_MIWT1_1_PLR1_SU32_SUM0_SUS256_SKXCCM0_VWA1_VWB1_WGM8_WGMXCC1_WGMXCCGn1
    SolutionIndex: 41
    SolutionNameMin: Cijk_Alik_Bljk_BBS_BH_UserArgs_MT64x256x64_MI16x16x1_SN_LDSB1_CLR1_GSU0_GSUC0_GSUWGMRR0_K1_LBSPPA256_LBSPPB256_MIWT2_8_PLR1_SU32_SUM0_SUS256_SKXCCM6_VWA2_VWB2_WGM1_WGMXCC1_WGMXCCGn1
    SolutionIndex: 42
    SolutionNameMin: Cijk_Alik_Bljk_BBS_BH_UserArgs_MT64x256x64_MI16x16x1_SN_LDSB1_CLR1_GSU0_GSUC0_GSUWGMRR0_K1_LBSPPA256_LBSPPB512_MIWT2_8_PLR1_SU32_SUM0_SUS256_SKXCCM6_VWA2_VWB4_WGM1_WGMXCC1_WGMXCCGn1
    SolutionIndex: 43
    SolutionNameMin: Cijk_Alik_Bljk_BBS_BH_UserArgs_MT256x64x64_MI16x16x1_SN_LDSB1_CLR1_GSU0_GSUC0_GSUWGMRR0_K1_LBSPPA1024_LBSPPB128_MIWT8_2_PLR1_SU32_SUM0_SUS256_SKXCCM6_VWA8_VWB1_WGM1_WGMXCC1_WGMXCCGn1
    SolutionIndex: 44
    SolutionNameMin: Cijk_Alik_Bljk_BBS_BH_UserArgs_MT256x64x64_MI16x16x1_SN_LDSB1_CLR1_GSU0_GSUC0_GSUWGMRR0_K1_LBSPPA1024_LBSPPB256_MIWT8_2_PLR1_SU32_SUM0_SUS256_SKXCCM6_VWA8_VWB2_WGM1_WGMXCC1_WGMXCCGn1
    SolutionIndex: 45
    SolutionNameMin: Cijk_Alik_Bljk_BBS_BH_UserArgs_MT256x64x64_MI16x16x1_SN_LDSB1_CLR1_GSU0_GSUC0_GSUWGMRR0_K1_LBSPPA1024_LBSPPB128_MIWT8_2_PLR1_SU32_SUM0_SUS256_SKXCCM6_VWA8_VWB1_WGM8_WGMXCC1_WGMXCCGn1
    SolutionIndex: 46
    SolutionNameMin: Cijk_Alik_Bljk_BBS_BH_UserArgs_MT128x128x64_MI16x16x1_SN_LDSB1_CLR1_GSU0_GSUC0_GSUWGMRR0_K1_LBSPPA256_LBSPPB128_MIWT4_4_PLR1_SU32_SUM0_SUS256_SKXCCM6_VWA2_VWB1_WGM1_WGMXCC1_WGMXCCGn1
    SolutionIndex: 47
    SolutionNameMin: Cijk_Alik_Bljk_BBS_BH_UserArgs_MT128x128x64_MI16x16x1_SN_LDSB1_CLR1_GSU0_GSUC0_GSUWGMRR0_K1_LBSPPA512_LBSPPB128_MIWT4_4_PLR1_SU32_SUM0_SUS256_SKXCCM6_VWA4_VWB1_WGM1_WGMXCC1_WGMXCCGn1
    SolutionIndex: 48
    SolutionNameMin: Cijk_Alik_Bljk_BBS_BH_UserArgs_MT128x128x64_MI16x16x1_SN_LDSB1_CLR1_GSU0_GSUC0_GSUWGMRR0_K1_LBSPPA256_LBSPPB256_MIWT4_4_PLR1_SU32_SUM0_SUS256_SKXCCM6_VWA2_VWB2_WGM1_WGMXCC1_WGMXCCGn1
    SolutionIndex: 49
    SolutionNameMin: Cijk_Alik_Bljk_BBS_BH_UserArgs_MT128x128x64_MI16x16x1_SN_LDSB1_CLR1_GSU0_GSUC0_GSUWGMRR0_K1_LBSPPA512_LBSPPB256_MIWT4_4_PLR1_SU32_SUM0_SUS256_SKXCCM6_VWA4_VWB2_WGM1_WGMXCC1_WGMXCCGn1
    SolutionIndex: 50
    SolutionNameMin: Cijk_Alik_Bljk_BBS_BH_UserArgs_MT128x128x64_MI16x16x1_SN_LDSB1_CLR1_GSU0_GSUC0_GSUWGMRR0_K1_LBSPPA256_LBSPPB512_MIWT4_4_PLR1_SU32_SUM0_SUS256_SKXCCM6_VWA2_VWB4_WGM1_WGMXCC1_WGMXCCGn1
    SolutionIndex: 51
    SolutionNameMin: Cijk_Alik_Bljk_BBS_BH_UserArgs_MT128x128x64_MI16x16x1_SN_LDSB1_CLR1_GSU0_GSUC0_GSUWGMRR0_K1_LBSPPA512_LBSPPB512_MIWT4_4_PLR1_SU32_SUM0_SUS256_SKXCCM6_VWA4_VWB4_WGM1_WGMXCC1_WGMXCCGn1
    SolutionIndex: 52
    SolutionNameMin: Cijk_Alik_Bljk_BBS_BH_UserArgs_MT128x128x64_MI16x16x1_SN_LDSB1_CLR1_GSU0_GSUC0_GSUWGMRR0_K1_LBSPPA512_LBSPPB128_MIWT4_4_PLR2_SU32_SUM0_SUS256_SKXCCM6_VWA4_VWB1_WGM1_WGMXCC1_WGMXCCGn1
    SolutionIndex: 53
    SolutionNameMin: Cijk_Alik_Bljk_BBS_BH_UserArgs_MT128x128x64_MI16x16x1_SN_LDSB1_CLR1_GSU0_GSUC0_GSUWGMRR0_K1_LBSPPA256_LBSPPB128_MIWT4_4_PLR1_SU32_SUM0_SUS256_SKXCCM6_VWA2_VWB1_WGM4_WGMXCC1_WGMXCCGn1
    SolutionIndex: 54
    SolutionNameMin: Cijk_Alik_Bljk_BBS_BH_UserArgs_MT128x128x64_MI16x16x1_SN_LDSB1_CLR1_GSU0_GSUC0_GSUWGMRR0_K1_LBSPPA512_LBSPPB128_MIWT4_4_PLR1_SU32_SUM0_SUS256_SKXCCM6_VWA4_VWB1_WGM4_WGMXCC1_WGMXCCGn1
    SolutionIndex: 55
    SolutionNameMin: Cijk_Alik_Bljk_BBS_BH_UserArgs_MT128x128x64_MI16x16x1_SN_LDSB1_CLR1_GSU0_GSUC0_GSUWGMRR0_K1_LBSPPA512_LBSPPB256_MIWT4_4_PLR1_SU32_SUM0_SUS256_SKXCCM6_VWA4_VWB2_WGM4_WGMXCC1_WGMXCCGn1
    SolutionIndex: 56
    SolutionNameMin: Cijk_Alik_Bljk_BBS_BH_UserArgs_MT128x128x64_MI16x16x1_SN_LDSB1_CLR1_GSU0_GSUC0_GSUWGMRR0_K1_LBSPPA512_LBSPPB512_MIWT4_4_PLR1_SU32_SUM0_SUS256_SKXCCM6_VWA4_VWB4_WGM4_WGMXCC1_WGMXCCGn1
    SolutionIndex: 57
    SolutionNameMin: Cijk_Alik_Bljk_BBS_BH_UserArgs_MT128x128x64_MI16x16x1_SN_LDSB1_CLR1_GSU0_GSUC0_GSUWGMRR0_K1_LBSPPA512_LBSPPB128_MIWT4_4_PLR2_SU32_SUM0_SUS256_SKXCCM6_VWA4_VWB1_WGM4_WGMXCC1_WGMXCCGn1
    SolutionIndex: 58
    SolutionNameMin: Cijk_Alik_Bljk_BBS_BH_UserArgs_MT128x128x64_MI16x16x1_SN_LDSB1_CLR1_GSU0_GSUC0_GSUWGMRR0_K1_LBSPPA512_LBSPPB256_MIWT4_4_PLR2_SU32_SUM0_SUS256_SKXCCM6_VWA4_VWB2_WGM4_WGMXCC1_WGMXCCGn1
    SolutionIndex: 59
    SolutionNameMin: Cijk_Alik_Bljk_BBS_BH_UserArgs_MT128x128x64_MI16x16x1_SN_LDSB1_CLR1_GSU0_GSUC0_GSUWGMRR0_K1_LBSPPA128_LBSPPB128_MIWT4_4_PLR1_SU32_SUM0_SUS256_SKXCCM6_VWA1_VWB1_WGM8_WGMXCC1_WGMXCCGn1
    SolutionIndex: 60
    SolutionNameMin: Cijk_Alik_Bljk_BBS_BH_UserArgs_MT128x128x64_MI16x16x1_SN_LDSB1_CLR1_GSU0_GSUC0_GSUWGMRR0_K1_LBSPPA256_LBSPPB128_MIWT4_4_PLR1_SU32_SUM0_SUS256_SKXCCM6_VWA2_VWB1_WGM8_WGMXCC1_WGMXCCGn1
    SolutionIndex: 61
    SolutionNameMin: Cijk_Alik_Bljk_BBS_BH_UserArgs_MT128x128x64_MI16x16x1_SN_LDSB1_CLR1_GSU0_GSUC0_GSUWGMRR0_K1_LBSPPA512_LBSPPB128_MIWT4_4_PLR1_SU32_SUM0_SUS256_SKXCCM6_VWA4_VWB1_WGM8_WGMXCC1_WGMXCCGn1
    SolutionIndex: 62
    SolutionNameMin: Cijk_Alik_Bljk_BBS_BH_UserArgs_MT128x128x64_MI16x16x1_SN_LDSB1_CLR1_GSU0_GSUC0_GSUWGMRR0_K1_LBSPPA256_LBSPPB256_MIWT4_4_PLR1_SU32_SUM0_SUS256_SKXCCM6_VWA2_VWB2_WGM8_WGMXCC1_WGMXCCGn1
    SolutionIndex: 63
    SolutionNameMin: Cijk_Alik_Bljk_BBS_BH_UserArgs_MT128x128x64_MI16x16x1_SN_LDSB1_CLR1_GSU0_GSUC0_GSUWGMRR0_K1_LBSPPA512_LBSPPB256_MIWT4_4_PLR1_SU32_SUM0_SUS256_SKXCCM6_VWA4_VWB2_WGM8_WGMXCC1_WGMXCCGn1
    SolutionIndex: 64
    SolutionNameMin: Cijk_Alik_Bljk_BBS_BH_UserArgs_MT128x128x64_MI16x16x1_SN_LDSB1_CLR1_GSU0_GSUC0_GSUWGMRR0_K1_LBSPPA128_LBSPPB512_MIWT4_4_PLR1_SU32_SUM0_SUS256_SKXCCM6_VWA1_VWB4_WGM8_WGMXCC1_WGMXCCGn1
    SolutionIndex: 65
    SolutionNameMin: Cijk_Alik_Bljk_BBS_BH_UserArgs_MT128x128x64_MI16x16x1_SN_LDSB1_CLR1_GSU0_GSUC0_GSUWGMRR0_K1_LBSPPA256_LBSPPB512_MIWT4_4_PLR1_SU32_SUM0_SUS256_SKXCCM6_VWA2_VWB4_WGM8_WGMXCC1_WGMXCCGn1
    SolutionIndex: 66
    SolutionNameMin: Cijk_Alik_Bljk_BBS_BH_UserArgs_MT128x128x64_MI16x16x1_SN_LDSB1_CLR1_GSU0_GSUC0_GSUWGMRR0_K1_LBSPPA512_LBSPPB512_MIWT4_4_PLR1_SU32_SUM0_SUS256_SKXCCM6_VWA4_VWB4_WGM8_WGMXCC1_WGMXCCGn1
    SolutionIndex: 67
    SolutionNameMin: Cijk_Alik_Bljk_BBS_BH_UserArgs_MT128x128x64_MI16x16x1_SN_LDSB1_CLR1_GSU0_GSUC0_GSUWGMRR0_K1_LBSPPA512_LBSPPB512_MIWT4_4_PLR2_SU32_SUM0_SUS256_SKXCCM6_VWA4_VWB4_WGM8_WGMXCC1_WGMXCCGn1
    SolutionIndex: 68
    SolutionNameMin: Cijk_Alik_Bljk_BBS_BH_UserArgs_MT64x128x64_MI16x16x1_SN_LDSB1_CLR1_GSU0_GSUC0_GSUWGMRR0_K1_LBSPPA256_LBSPPB128_MIWT2_4_PLR1_SU32_SUM0_SUS256_SKXCCM6_VWA2_VWB1_WGM1_WGMXCC1_WGMXCCGn1
    SolutionIndex: 69
    SolutionNameMin: Cijk_Alik_Bljk_BBS_BH_UserArgs_MT64x128x64_MI16x16x1_SN_LDSB1_CLR1_GSU0_GSUC0_GSUWGMRR0_K1_LBSPPA256_LBSPPB256_MIWT2_4_PLR1_SU32_SUM0_SUS256_SKXCCM6_VWA2_VWB2_WGM1_WGMXCC1_WGMXCCGn1
    SolutionIndex: 70
    SolutionNameMin: Cijk_Alik_Bljk_BBS_BH_UserArgs_MT64x128x64_MI16x16x1_SN_LDSB1_CLR1_GSU0_GSUC0_GSUWGMRR0_K1_LBSPPA256_LBSPPB128_MIWT2_4_PLR2_SU32_SUM0_SUS256_SKXCCM6_VWA2_VWB1_WGM1_WGMXCC1_WGMXCCGn1
    SolutionIndex: 71
    SolutionNameMin: Cijk_Alik_Bljk_BBS_BH_UserArgs_MT64x128x64_MI16x16x1_SN_LDSB1_CLR1_GSU0_GSUC0_GSUWGMRR0_K1_LBSPPA128_LBSPPB256_MIWT2_4_PLR2_SU32_SUM0_SUS256_SKXCCM6_VWA1_VWB2_WGM1_WGMXCC1_WGMXCCGn1
    SolutionIndex: 72
    SolutionNameMin: Cijk_Alik_Bljk_BBS_BH_UserArgs_MT64x128x64_MI16x16x1_SN_LDSB1_CLR1_GSU0_GSUC0_GSUWGMRR0_K1_LBSPPA256_LBSPPB256_MIWT2_4_PLR2_SU32_SUM0_SUS256_SKXCCM6_VWA2_VWB2_WGM1_WGMXCC1_WGMXCCGn1
    SolutionIndex: 73
    SolutionNameMin: Cijk_Alik_Bljk_BBS_BH_UserArgs_MT64x128x64_MI16x16x1_SN_LDSB1_CLR1_GSU0_GSUC0_GSUWGMRR0_K1_LBSPPA256_LBSPPB512_MIWT2_4_PLR2_SU32_SUM0_SUS256_SKXCCM6_VWA2_VWB4_WGM1_WGMXCC1_WGMXCCGn1
    SolutionIndex: 74
    SolutionNameMin: Cijk_Alik_Bljk_BBS_BH_UserArgs_MT64x128x64_MI16x16x1_SN_LDSB1_CLR1_GSU0_GSUC0_GSUWGMRR0_K1_LBSPPA256_LBSPPB256_MIWT2_4_PLR1_SU32_SUM0_SUS256_SKXCCM6_VWA2_VWB2_WGM4_WGMXCC1_WGMXCCGn1
    SolutionIndex: 75
    SolutionNameMin: Cijk_Alik_Bljk_BBS_BH_UserArgs_MT64x128x64_MI16x16x1_SN_LDSB1_CLR1_GSU0_GSUC0_GSUWGMRR0_K1_LBSPPA256_LBSPPB512_MIWT2_4_PLR1_SU32_SUM0_SUS256_SKXCCM6_VWA2_VWB4_WGM4_WGMXCC1_WGMXCCGn1
    SolutionIndex: 76
    SolutionNameMin: Cijk_Alik_Bljk_BBS_BH_UserArgs_MT64x128x64_MI16x16x1_SN_LDSB1_CLR1_GSU0_GSUC0_GSUWGMRR0_K1_LBSPPA256_LBSPPB256_MIWT2_4_PLR2_SU32_SUM0_SUS256_SKXCCM6_VWA2_VWB2_WGM4_WGMXCC1_WGMXCCGn1
    SolutionIndex: 77
    SolutionNameMin: Cijk_Alik_Bljk_BBS_BH_UserArgs_MT64x128x64_MI16x16x1_SN_LDSB1_CLR1_GSU0_GSUC0_GSUWGMRR0_K1_LBSPPA256_LBSPPB128_MIWT2_4_PLR1_SU32_SUM0_SUS256_SKXCCM6_VWA2_VWB1_WGM8_WGMXCC1_WGMXCCGn1
    SolutionIndex: 78
    SolutionNameMin: Cijk_Alik_Bljk_BBS_BH_UserArgs_MT64x128x64_MI16x16x1_SN_LDSB1_CLR1_GSU0_GSUC0_GSUWGMRR0_K1_LBSPPA256_LBSPPB256_MIWT2_4_PLR1_SU32_SUM0_SUS256_SKXCCM6_VWA2_VWB2_WGM8_WGMXCC1_WGMXCCGn1
    SolutionIndex: 79
    SolutionNameMin: Cijk_Alik_Bljk_BBS_BH_UserArgs_MT64x128x64_MI16x16x1_SN_LDSB1_CLR1_GSU0_GSUC0_GSUWGMRR0_K1_LBSPPA256_LBSPPB512_MIWT2_4_PLR1_SU32_SUM0_SUS256_SKXCCM6_VWA2_VWB4_WGM8_WGMXCC1_WGMXCCGn1
    SolutionIndex: 80
    SolutionNameMin: Cijk_Alik_Bljk_BBS_BH_UserArgs_MT64x128x64_MI16x16x1_SN_LDSB1_CLR1_GSU0_GSUC0_GSUWGMRR0_K1_LBSPPA128_LBSPPB512_MIWT2_4_PLR2_SU32_SUM0_SUS256_SKXCCM6_VWA1_VWB4_WGM8_WGMXCC1_WGMXCCGn1
    SolutionIndex: 81
    SolutionNameMin: Cijk_Alik_Bljk_BBS_BH_UserArgs_MT128x64x64_MI16x16x1_SN_LDSB1_CLR1_GSU0_GSUC0_GSUWGMRR0_K1_LBSPPA256_LBSPPB128_MIWT4_2_PLR1_SU32_SUM0_SUS256_SKXCCM6_VWA2_VWB1_WGM1_WGMXCC1_WGMXCCGn1
    SolutionIndex: 82
    SolutionNameMin: Cijk_Alik_Bljk_BBS_BH_UserArgs_MT128x64x64_MI16x16x1_SN_LDSB1_CLR1_GSU0_GSUC0_GSUWGMRR0_K1_LBSPPA512_LBSPPB128_MIWT4_2_PLR1_SU32_SUM0_SUS256_SKXCCM6_VWA4_VWB1_WGM1_WGMXCC1_WGMXCCGn1
    SolutionIndex: 83
    SolutionNameMin: Cijk_Alik_Bljk_BBS_BH_UserArgs_MT128x64x64_MI16x16x1_SN_LDSB1_CLR1_GSU0_GSUC0_GSUWGMRR0_K1_LBSPPA256_LBSPPB256_MIWT4_2_PLR1_SU32_SUM0_SUS256_SKXCCM6_VWA2_VWB2_WGM1_WGMXCC1_WGMXCCGn1
    SolutionIndex: 84
    SolutionNameMin: Cijk_Alik_Bljk_BBS_BH_UserArgs_MT128x64x64_MI16x16x1_SN_LDSB1_CLR1_GSU0_GSUC0_GSUWGMRR0_K1_LBSPPA512_LBSPPB256_MIWT4_2_PLR1_SU32_SUM0_SUS256_SKXCCM6_VWA4_VWB2_WGM1_WGMXCC1_WGMXCCGn1
    SolutionIndex: 85
    SolutionNameMin: Cijk_Alik_Bljk_BBS_BH_UserArgs_MT128x64x64_MI16x16x1_SN_LDSB1_CLR1_GSU0_GSUC0_GSUWGMRR0_K1_LBSPPA512_LBSPPB128_MIWT4_2_PLR1_SU32_SUM0_SUS256_SKXCCM6_VWA4_VWB1_WGM4_WGMXCC1_WGMXCCGn1
    SolutionIndex: 86
    SolutionNameMin: Cijk_Alik_Bljk_BBS_BH_UserArgs_MT128x64x64_MI16x16x1_SN_LDSB1_CLR1_GSU0_GSUC0_GSUWGMRR0_K1_LBSPPA512_LBSPPB256_MIWT4_2_PLR1_SU32_SUM0_SUS256_SKXCCM6_VWA4_VWB2_WGM4_WGMXCC1_WGMXCCGn1
    SolutionIndex: 87
    SolutionNameMin: Cijk_Alik_Bljk_BBS_BH_UserArgs_MT128x64x64_MI16x16x1_SN_LDSB1_CLR1_GSU0_GSUC0_GSUWGMRR0_K1_LBSPPA256_LBSPPB128_MIWT4_2_PLR2_SU32_SUM0_SUS256_SKXCCM6_VWA2_VWB1_WGM4_WGMXCC1_WGMXCCGn1
    SolutionIndex: 88
    SolutionNameMin: Cijk_Alik_Bljk_BBS_BH_UserArgs_MT128x64x64_MI16x16x1_SN_LDSB1_CLR1_GSU0_GSUC0_GSUWGMRR0_K1_LBSPPA512_LBSPPB128_MIWT4_2_PLR1_SU32_SUM0_SUS256_SKXCCM6_VWA4_VWB1_WGM8_WGMXCC1_WGMXCCGn1
    SolutionIndex: 89
    SolutionNameMin: Cijk_Alik_Bljk_BBS_BH_UserArgs_MT64x64x64_MI16x16x1_SN_LDSB1_CLR1_GSU0_GSUC0_GSUWGMRR0_K1_LBSPPA256_LBSPPB128_MIWT2_2_PLR1_SU32_SUM0_SUS256_SKXCCM6_VWA2_VWB1_WGM1_WGMXCC1_WGMXCCGn1
    SolutionIndex: 90
    SolutionNameMin: Cijk_Alik_Bljk_BBS_BH_UserArgs_MT64x64x64_MI16x16x1_SN_LDSB1_CLR1_GSU0_GSUC0_GSUWGMRR0_K1_LBSPPA128_LBSPPB256_MIWT2_2_PLR1_SU32_SUM0_SUS256_SKXCCM6_VWA1_VWB2_WGM1_WGMXCC1_WGMXCCGn1
    SolutionIndex: 91
    SolutionNameMin: Cijk_Alik_Bljk_BBS_BH_UserArgs_MT64x64x64_MI16x16x1_SN_LDSB1_CLR1_GSU0_GSUC0_GSUWGMRR0_K1_LBSPPA128_LBSPPB128_MIWT2_2_PLR1_SU32_SUM0_SUS256_SKXCCM6_VWA1_VWB1_WGM4_WGMXCC1_WGMXCCGn1
    SolutionIndex: 92
    SolutionNameMin: Cijk_Alik_Bljk_BBS_BH_UserArgs_MT32x64x64_MI16x16x1_SN_LDSB0_CLR1_GSU0_GSUC0_GSUWGMRR0_K1_LBSPPA128_LBSPPB128_MIWT1_2_PLR1_SU32_SUM0_SUS256_SKXCCM6_VWA1_VWB1_WGM1_WGMXCC1_WGMXCCGn1
    SolutionIndex: 93
    SolutionNameMin: Cijk_Alik_Bljk_BBS_BH_UserArgs_MT32x32x64_MI16x16x1_SN_LDSB0_CLR1_GSU0_GSUC0_GSUWGMRR0_K1_LBSPPA128_LBSPPB128_MIWT1_1_PLR1_SU32_SUM0_SUS256_SKXCCM6_VWA1_VWB1_WGM1_WGMXCC1_WGMXCCGn1
    SolutionIndex: 94
    SolutionNameMin: Cijk_Alik_Bljk_BBS_BH_UserArgs_MT32x32x64_MI16x16x1_SN_LDSB0_CLR1_GSU0_GSUC0_GSUWGMRR0_K1_LBSPPA128_LBSPPB128_MIWT1_1_PLR1_SU32_SUM0_SUS256_SKXCCM6_VWA1_VWB1_WGM4_WGMXCC1_WGMXCCGn1
    SolutionIndex: 95
    SolutionNameMin: Cijk_Alik_Bljk_BBS_BH_UserArgs_MT32x128x128_MI16x16x1_SN_LDSB1_CLR1_GSU0_GSUC0_GSUWGMRR0_K1_LBSPPA256_LBSPPB1024_MIWT1_4_PLR2_SU32_SUM0_SUS256_SKXCCM6_VWA1_VWB4_WGM1_WGMXCC1_WGMXCCGn1
    SolutionIndex: 96
    SolutionNameMin: Cijk_Alik_Bljk_BBS_BH_UserArgs_MT64x64x128_MI16x16x1_SN_LDSB1_CLR1_GSU0_GSUC0_GSUWGMRR0_K1_LBSPPA256_LBSPPB256_MIWT2_2_PLR1_SU32_SUM0_SUS256_SKXCCM6_VWA1_VWB1_WGM1_WGMXCC1_WGMXCCGn1
    SolutionIndex: 97
    SolutionNameMin: Cijk_Alik_Bljk_BBS_BH_UserArgs_MT64x64x128_MI16x16x1_SN_LDSB1_CLR1_GSU0_GSUC0_GSUWGMRR0_K1_LBSPPA512_LBSPPB256_MIWT2_2_PLR1_SU32_SUM0_SUS256_SKXCCM6_VWA2_VWB1_WGM1_WGMXCC1_WGMXCCGn1
    SolutionIndex: 98
    SolutionNameMin: Cijk_Alik_Bljk_BBS_BH_UserArgs_MT64x64x128_MI16x16x1_SN_LDSB1_CLR1_GSU0_GSUC0_GSUWGMRR0_K1_LBSPPA256_LBSPPB512_MIWT2_2_PLR1_SU32_SUM0_SUS256_SKXCCM6_VWA1_VWB2_WGM1_WGMXCC1_WGMXCCGn1
    SolutionIndex: 99
    SolutionNameMin: Cijk_Alik_Bljk_BBS_BH_UserArgs_MT64x64x128_MI16x16x1_SN_LDSB1_CLR1_GSU0_GSUC0_GSUWGMRR0_K1_LBSPPA512_LBSPPB512_MIWT2_2_PLR1_SU32_SUM0_SUS256_SKXCCM6_VWA2_VWB2_WGM1_WGMXCC1_WGMXCCGn1
    SolutionIndex: 100
    SolutionNameMin: Cijk_Alik_Bljk_BBS_BH_UserArgs_MT64x64x128_MI16x16x1_SN_LDSB1_CLR1_GSU0_GSUC0_GSUWGMRR0_K1_LBSPPA256_LBSPPB256_MIWT2_2_PLR2_SU32_SUM0_SUS256_SKXCCM6_VWA1_VWB1_WGM1_WGMXCC1_WGMXCCGn1
    SolutionIndex: 101
    SolutionNameMin: Cijk_Alik_Bljk_BBS_BH_UserArgs_MT64x64x128_MI16x16x1_SN_LDSB1_CLR1_GSU0_GSUC0_GSUWGMRR0_K1_LBSPPA512_LBSPPB256_MIWT2_2_PLR2_SU32_SUM0_SUS256_SKXCCM6_VWA2_VWB1_WGM1_WGMXCC1_WGMXCCGn1
    SolutionIndex: 102
    SolutionNameMin: Cijk_Alik_Bljk_BBS_BH_UserArgs_MT64x64x128_MI16x16x1_SN_LDSB1_CLR1_GSU0_GSUC0_GSUWGMRR0_K1_LBSPPA512_LBSPPB512_MIWT2_2_PLR2_SU32_SUM0_SUS256_SKXCCM6_VWA2_VWB2_WGM1_WGMXCC1_WGMXCCGn1
    SolutionIndex: 103
    SolutionNameMin: Cijk_Alik_Bljk_BBS_BH_UserArgs_MT64x64x128_MI16x16x1_SN_LDSB1_CLR1_GSU0_GSUC0_GSUWGMRR0_K1_LBSPPA256_LBSPPB256_MIWT2_2_PLR1_SU32_SUM0_SUS256_SKXCCM6_VWA1_VWB1_WGM4_WGMXCC1_WGMXCCGn1
    SolutionIndex: 104
    SolutionNameMin: Cijk_Alik_Bljk_BBS_BH_UserArgs_MT64x64x128_MI16x16x1_SN_LDSB1_CLR1_GSU0_GSUC0_GSUWGMRR0_K1_LBSPPA512_LBSPPB256_MIWT2_2_PLR1_SU32_SUM0_SUS256_SKXCCM6_VWA2_VWB1_WGM4_WGMXCC1_WGMXCCGn1
    SolutionIndex: 105
    SolutionNameMin: Cijk_Alik_Bljk_BBS_BH_UserArgs_MT64x64x128_MI16x16x1_SN_LDSB1_CLR1_GSU0_GSUC0_GSUWGMRR0_K1_LBSPPA512_LBSPPB512_MIWT2_2_PLR1_SU32_SUM0_SUS256_SKXCCM6_VWA2_VWB2_WGM4_WGMXCC1_WGMXCCGn1
    SolutionIndex: 106
    SolutionNameMin: Cijk_Alik_Bljk_BBS_BH_UserArgs_MT64x64x128_MI16x16x1_SN_LDSB1_CLR1_GSU0_GSUC0_GSUWGMRR0_K1_LBSPPA512_LBSPPB256_MIWT2_2_PLR2_SU32_SUM0_SUS256_SKXCCM6_VWA2_VWB1_WGM4_WGMXCC1_WGMXCCGn1
    SolutionIndex: 107
    SolutionNameMin: Cijk_Alik_Bljk_BBS_BH_UserArgs_MT64x64x128_MI16x16x1_SN_LDSB1_CLR1_GSU0_GSUC0_GSUWGMRR0_K1_LBSPPA256_LBSPPB512_MIWT2_2_PLR2_SU32_SUM0_SUS256_SKXCCM6_VWA1_VWB2_WGM4_WGMXCC1_WGMXCCGn1
    SolutionIndex: 108
    SolutionNameMin: Cijk_Alik_Bljk_BBS_BH_UserArgs_MT64x64x128_MI16x16x1_SN_LDSB1_CLR1_GSU0_GSUC0_GSUWGMRR0_K1_LBSPPA512_LBSPPB512_MIWT2_2_PLR2_SU32_SUM0_SUS256_SKXCCM6_VWA2_VWB2_WGM4_WGMXCC1_WGMXCCGn1
    SolutionIndex: 109
    SolutionNameMin: Cijk_Alik_Bljk_BBS_BH_UserArgs_MT64x64x128_MI16x16x1_SN_LDSB1_CLR1_GSU0_GSUC0_GSUWGMRR0_K1_LBSPPA256_LBSPPB256_MIWT2_2_PLR1_SU32_SUM0_SUS256_SKXCCM6_VWA1_VWB1_WGM8_WGMXCC1_WGMXCCGn1
    SolutionIndex: 110
    SolutionNameMin: Cijk_Alik_Bljk_BBS_BH_UserArgs_MT64x64x128_MI16x16x1_SN_LDSB1_CLR1_GSU0_GSUC0_GSUWGMRR0_K1_LBSPPA256_LBSPPB512_MIWT2_2_PLR1_SU32_SUM0_SUS256_SKXCCM6_VWA1_VWB2_WGM8_WGMXCC1_WGMXCCGn1
    SolutionIndex: 111
    SolutionNameMin: Cijk_Alik_Bljk_BBS_BH_UserArgs_MT64x64x128_MI16x16x1_SN_LDSB1_CLR1_GSU0_GSUC0_GSUWGMRR0_K1_LBSPPA512_LBSPPB512_MIWT2_2_PLR1_SU32_SUM0_SUS256_SKXCCM6_VWA2_VWB2_WGM8_WGMXCC1_WGMXCCGn1
    SolutionIndex: 112
    SolutionNameMin: Cijk_Alik_Bljk_BBS_BH_UserArgs_MT32x64x128_MI16x16x1_SN_LDSB1_CLR1_GSU0_GSUC0_GSUWGMRR0_K1_LBSPPA256_LBSPPB256_MIWT1_2_PLR1_SU32_SUM0_SUS256_SKXCCM6_VWA1_VWB1_WGM1_WGMXCC1_WGMXCCGn1
    SolutionIndex: 113
    SolutionNameMin: Cijk_Alik_Bljk_BBS_BH_UserArgs_MT32x64x128_MI16x16x1_SN_LDSB1_CLR1_GSU0_GSUC0_GSUWGMRR0_K1_LBSPPA256_LBSPPB512_MIWT1_2_PLR1_SU32_SUM0_SUS256_SKXCCM6_VWA1_VWB2_WGM4_WGMXCC1_WGMXCCGn1
    SolutionIndex: 114
    SolutionNameMin: Cijk_Alik_Bljk_BBS_BH_UserArgs_MT32x64x128_MI16x16x1_SN_LDSB1_CLR1_GSU0_GSUC0_GSUWGMRR0_K1_LBSPPA256_LBSPPB512_MIWT1_2_PLR2_SU32_SUM0_SUS256_SKXCCM6_VWA1_VWB2_WGM4_WGMXCC1_WGMXCCGn1
    SolutionIndex: 115
    SolutionNameMin: Cijk_Alik_Bljk_BBS_BH_UserArgs_MT32x64x128_MI16x16x1_SN_LDSB1_CLR1_GSU0_GSUC0_GSUWGMRR0_K1_LBSPPA256_LBSPPB512_MIWT1_2_PLR2_SU32_SUM0_SUS256_SKXCCM6_VWA1_VWB2_WGM8_WGMXCC1_WGMXCCGn1
    SolutionIndex: 116
    SolutionNameMin: Cijk_Alik_Bljk_BBS_BH_UserArgs_MT64x32x128_MI16x16x1_SN_LDSB1_CLR1_GSU0_GSUC0_GSUWGMRR0_K1_LBSPPA256_LBSPPB256_MIWT2_1_PLR2_SU32_SUM0_SUS256_SKXCCM6_VWA1_VWB1_WGM1_WGMXCC1_WGMXCCGn1
    SolutionIndex: 117
    SolutionNameMin: Cijk_Alik_Bljk_BBS_BH_UserArgs_MT64x32x128_MI16x16x1_SN_LDSB1_CLR1_GSU0_GSUC0_GSUWGMRR0_K1_LBSPPA512_LBSPPB256_MIWT2_1_PLR2_SU32_SUM0_SUS256_SKXCCM6_VWA2_VWB1_WGM1_WGMXCC1_WGMXCCGn1
    SolutionIndex: 118
    SolutionNameMin: Cijk_Alik_Bljk_BBS_BH_UserArgs_MT32x32x128_MI16x16x1_SN_LDSB1_CLR1_GSU0_GSUC0_GSUWGMRR0_K1_LBSPPA256_LBSPPB256_MIWT1_1_PLR1_SU32_SUM0_SUS256_SKXCCM6_VWA1_VWB1_WGM1_WGMXCC1_WGMXCCGn1
    SolutionIndex: 119
    SolutionNameMin: Cijk_Alik_Bljk_BBS_BH_UserArgs_MT32x32x128_MI16x16x1_SN_LDSB1_CLR1_GSU0_GSUC0_GSUWGMRR0_K1_LBSPPA256_LBSPPB256_MIWT1_1_PLR2_SU32_SUM0_SUS256_SKXCCM6_VWA1_VWB1_WGM1_WGMXCC1_WGMXCCGn1
    SolutionIndex: 120
    SolutionNameMin: Cijk_Alik_Bljk_BBS_BH_UserArgs_MT32x32x32_MI16x16x1_SN_LDSB0_CLR1_GSU0_GSUC0_GSUWGMRR0_K1_LBSPPA128_LBSPPB128_MIWT1_1_PLR1_SU32_SUM0_SUS256_SKXCCM0_VWA1_VWB1_WGM8_WGMXCC1_WGMXCCGn1
- - - [128, 128, 1, 128, 128, 128, 128, 128]
    - [27, 0.085]
  - - [128, 128, 1, 256, 128, 128, 256, 256]
    - [26, 0.161]
  - - [128, 128, 1, 512, 128, 128, 512, 512]
    - [27, 0.281]
  - - [128, 128, 1, 1024, 128, 128, 1024, 1024]
    - [40, 0.451]
  - - [128, 128, 1, 2048, 128, 128, 2048, 2048]
    - [37, 0.671]
  - - [128, 128, 1, 4096, 128, 128, 4096, 4096]
    - [93, 1.189]
  - - [128, 128, 1, 8192, 128, 128, 8192, 8192]
    - [119, 1.881]
  - - [128, 256, 1, 128, 128, 128, 128, 128]
    - [24, 0.181]
  - - [128, 256, 1, 256, 128, 128, 256, 256]
    - [24, 0.339]
  - - [128, 256, 1, 512, 128, 128, 512, 512]
    - [24, 0.585]
  - - [128, 256, 1, 1024, 128, 128, 1024, 1024]
    - [37, 0.936]
  - - [128, 256, 1, 2048, 128, 128, 2048, 2048]
    - [37, 1.327]
  - - [128, 256, 1, 4096, 128, 128, 4096, 4096]
    - [93, 2.33]
  - - [128, 256, 1, 8192, 128, 128, 8192, 8192]
    - [119, 3.712]
  - - [128, 512, 1, 128, 128, 128, 128, 128]
    - [37, 0.358]
  - - [128, 512, 1, 256, 128, 128, 256, 256]
    - [24, 0.67]
  - - [128, 512, 1, 512, 128, 128, 512, 512]
    - [38, 1.166]
  - - [128, 512, 1, 1024, 128, 128, 1024, 1024]
    - [38, 1.857]
  - - [128, 512, 1, 2048, 128, 128, 2048, 2048]
    - [37, 2.619]
  - - [128, 512, 1, 4096, 128, 128, 4096, 4096]
    - [93, 3.987]
  - - [128, 512, 1, 8192, 128, 128, 8192, 8192]
    - [119, 6.059]
  - - [128, 1024, 1, 128, 128, 128, 128, 128]
    - [24, 0.697]
  - - [128, 1024, 1, 256, 128, 128, 256, 256]
    - [24, 1.33]
  - - [128, 1024, 1, 512, 128, 128, 512, 512]
    - [24, 2.262]
  - - [128, 1024, 1, 1024, 128, 128, 1024, 1024]
    - [38, 3.65]
  - - [128, 1024, 1, 2048, 128, 128, 2048, 2048]
    - [36, 4.398]
  - - [128, 1024, 1, 4096, 128, 128, 4096, 4096]
    - [118, 6.812]
  - - [128, 1024, 1, 8192, 128, 128, 8192, 8192]
    - [116, 9.505]
  - - [128, 2048, 1, 128, 128, 128, 128, 128]
    - [23, 1.318]
  - - [128, 2048, 1, 256, 128, 128, 256, 256]
    - [23, 2.389]
  - - [128, 2048, 1, 512, 128, 128, 512, 512]
    - [22, 4.013]
  - - [128, 2048, 1, 1024, 128, 128, 1024, 1024]
    - [36, 6.037]
  - - [128, 2048, 1, 2048, 128, 128, 2048, 2048]
    - [92, 7.329]
  - - [128, 2048, 1, 4096, 128, 128, 4096, 4096]
    - [112, 10.662]
  - - [128, 2048, 1, 8192, 128, 128, 8192, 8192]
    - [102, 13.43]
  - - [128, 4096, 1, 128, 128, 128, 128, 128]
    - [20, 2.337]
  - - [128, 4096, 1, 256, 128, 128, 256, 256]
    - [19, 4.119]
  - - [128, 4096, 1, 512, 128, 128, 512, 512]
    - [20, 6.671]
  - - [128, 4096, 1, 1024, 128, 128, 1024, 1024]
    - [28, 9.785]
  - - [128, 4096, 1, 2048, 128, 128, 2048, 2048]
    - [102, 11.687]
  - - [128, 4096, 1, 4096, 128, 128, 4096, 4096]
    - [100, 14.447]
  - - [128, 4096, 1, 8192, 128, 128, 8192, 8192]
    - [17, 15.991]
  - - [128, 8192, 1, 128, 128, 128, 128, 128]
    - [16, 3.742]
  - - [128, 8192, 1, 256, 128, 128, 256, 256]
    - [16, 6.479]
  - - [128, 8192, 1, 512, 128, 128, 512, 512]
    - [16, 10.189]
  - - [128, 8192, 1, 1024, 128, 128, 1024, 1024]
    - [90, 11.913]
  - - [128, 8192, 1, 2048, 128, 128, 2048, 2048]
    - [101, 14.834]
  - - [128, 8192, 1, 4096, 128, 128, 4096, 4096]
    - [18, 17.607]
  - - [128, 8192, 1, 8192, 128, 128, 8192, 8192]
    - [18, 19.844]
  - - [256, 128, 1, 128, 256, 256, 128, 128]
    - [24, 0.178]
  - - [256, 128, 1, 256, 256, 256, 256, 256]
    - [24, 0.335]
  - - [256, 128, 1, 512, 256, 256, 512, 512]
    - [24, 0.592]
  - - [256, 128, 1, 1024, 256, 256, 1024, 1024]
    - [37, 0.921]
  - - [256, 128, 1, 2048, 256, 256, 2048, 2048]
    - [38, 1.328]
  - - [256, 128, 1, 4096, 256, 256, 4096, 4096]
    - [93, 2.332]
  - - [256, 128, 1, 8192, 256, 256, 8192, 8192]
    - [119, 3.712]
  - - [256, 256, 1, 128, 256, 256, 128, 128]
    - [24, 0.364]
  - - [256, 256, 1, 256, 256, 256, 256, 256]
    - [24, 0.671]
  - - [256, 256, 1, 512, 256, 256, 512, 512]
    - [24, 1.169]
  - - [256, 256, 1, 1024, 256, 256, 1024, 1024]
    - [37, 1.852]
  - - [256, 256, 1, 2048, 256, 256, 2048, 2048]
    - [38, 2.604]
  - - [256, 256, 1, 4096, 256, 256, 4096, 4096]
    - [93, 3.988]
  - - [256, 256, 1, 8192, 256, 256, 8192, 8192]
    - [36, 6.021]
  - - [256, 512, 1, 128, 256, 256, 128, 128]
    - [24, 0.714]
  - - [256, 512, 1, 256, 256, 256, 256, 256]
    - [24, 1.332]
  - - [256, 512, 1, 512, 256, 256, 512, 512]
    - [24, 2.261]
  - - [256, 512, 1, 1024, 256, 256, 1024, 1024]
    - [38, 3.667]
  - - [256, 512, 1, 2048, 256, 256, 2048, 2048]
    - [35, 4.416]
  - - [256, 512, 1, 4096, 256, 256, 4096, 4096]
    - [93, 6.783]
  - - [256, 512, 1, 8192, 256, 256, 8192, 8192]
    - [29, 9.377]
  - - [256, 1024, 1, 128, 256, 256, 128, 128]
    - [23, 1.319]
  - - [256, 1024, 1, 256, 256, 256, 256, 256]
    - [23, 2.373]
  - - [256, 1024, 1, 512, 256, 256, 512, 512]
    - [22, 4.003]
  - - [256, 1024, 1, 1024, 256, 256, 1024, 1024]
    - [36, 6.022]
  - - [256, 1024, 1, 2048, 256, 256, 2048, 2048]
    - [92, 7.284]
  - - [256, 1024, 1, 4096, 256, 256, 4096, 4096]
    - [117, 10.803]
  - - [256, 1024, 1, 8192, 256, 256, 8192, 8192]
    - [109, 11.836]
  - - [256, 2048, 1, 128, 256, 256, 128, 128]
    - [20, 2.338]
  - - [256, 2048, 1, 256, 256, 256, 256, 256]
    - [20, 4.137]
  - - [256, 2048, 1, 512, 256, 256, 512, 512]
    - [20, 6.662]
  - - [256, 2048, 1, 1024, 256, 256, 1024, 1024]
    - [28, 9.794]
  - - [256, 2048, 1, 2048, 256, 256, 2048, 2048]
    - [99, 11.98]
  - - [256, 2048, 1, 4096, 256, 256, 4096, 4096]
    - [98, 14.655]
  - - [256, 2048, 1, 8192, 256, 256, 8192, 8192]
    - [47, 15.71]
  - - [256, 4096, 1, 128, 256, 256, 128, 128]
    - [12, 3.719]
  - - [256, 4096, 1, 256, 256, 256, 256, 256]
    - [12, 6.454]
  - - [256, 4096, 1, 512, 256, 256, 512, 512]
    - [17, 10.216]
  - - [256, 4096, 1, 1024, 256, 256, 1024, 1024]
    - [89, 12.099]
  - - [256, 4096, 1, 2048, 256, 256, 2048, 2048]
    - [100, 15.971]
  - - [256, 4096, 1, 4096, 256, 256, 4096, 4096]
    - [87, 17.512]
  - - [256, 4096, 1, 8192, 256, 256, 8192, 8192]
    - [1, 19.52]
  - - [256, 8192, 1, 128, 256, 256, 128, 128]
    - [7, 5.478]
  - - [256, 8192, 1, 256, 256, 256, 256, 256]
    - [11, 9.335]
  - - [256, 8192, 1, 512, 256, 256, 512, 512]
    - [46, 14.787]
  - - [256, 8192, 1, 1024, 256, 256, 1024, 1024]
    - [84, 15.692]
  - - [256, 8192, 1, 2048, 256, 256, 2048, 2048]
    - [83, 18.97]
  - - [256, 8192, 1, 4096, 256, 256, 4096, 4096]
    - [55, 21.384]
  - - [256, 8192, 1, 8192, 256, 256, 8192, 8192]
    - [0, 22.881]
  - - [512, 128, 1, 128, 512, 512, 128, 128]
    - [24, 0.362]
  - - [512, 128, 1, 256, 512, 512, 256, 256]
    - [24, 0.673]
  - - [512, 128, 1, 512, 512, 512, 512, 512]
    - [24, 1.165]
  - - [512, 128, 1, 1024, 512, 512, 1024, 1024]
    - [37, 1.851]
  - - [512, 128, 1, 2048, 512, 512, 2048, 2048]
    - [39, 2.586]
  - - [512, 128, 1, 4096, 512, 512, 4096, 4096]
    - [93, 3.99]
  - - [512, 128, 1, 8192, 512, 512, 8192, 8192]
    - [33, 5.985]
  - - [512, 256, 1, 128, 512, 512, 128, 128]
    - [25, 0.709]
  - - [512, 256, 1, 256, 512, 512, 256, 256]
    - [24, 1.316]
  - - [512, 256, 1, 512, 512, 512, 512, 512]
    - [38, 2.261]
  - - [512, 256, 1, 1024, 512, 512, 1024, 1024]
    - [37, 3.648]
  - - [512, 256, 1, 2048, 512, 512, 2048, 2048]
    - [36, 4.401]
  - - [512, 256, 1, 4096, 512, 512, 4096, 4096]
    - [94, 6.656]
  - - [512, 256, 1, 8192, 512, 512, 8192, 8192]
    - [29, 9.311]
  - - [512, 512, 1, 128, 512, 512, 128, 128]
    - [23, 1.322]
  - - [512, 512, 1, 256, 512, 512, 256, 256]
    - [22, 2.395]
  - - [512, 512, 1, 512, 512, 512, 512, 512]
    - [21, 4.024]
  - - [512, 512, 1, 1024, 512, 512, 1024, 1024]
    - [36, 6.031]
  - - [512, 512, 1, 2048, 512, 512, 2048, 2048]
    - [92, 7.244]
  - - [512, 512, 1, 4096, 512, 512, 4096, 4096]
    - [114, 10.618]
  - - [512, 512, 1, 8192, 512, 512, 8192, 8192]
    - [95, 11.942]
  - - [512, 1024, 1, 128, 512, 512, 128, 128]
    - [20, 2.311]
  - - [512, 1024, 1, 256, 512, 512, 256, 256]
    - [20, 4.139]
  - - [512, 1024, 1, 512, 512, 512, 512, 512]
    - [20, 6.632]
  - - [512, 1024, 1, 1024, 512, 512, 1024, 1024]
    - [28, 9.801]
  - - [512, 1024, 1, 2048, 512, 512, 2048, 2048]
    - [96, 11.902]
  - - [512, 1024, 1, 4096, 512, 512, 4096, 4096]
    - [102, 14.329]
  - - [512, 1024, 1, 8192, 512, 512, 8192, 8192]
    - [54, 15.367]
  - - [512, 2048, 1, 128, 512, 512, 128, 128]
    - [12, 3.692]
  - - [512, 2048, 1, 256, 512, 512, 256, 256]
    - [12, 6.405]
  - - [512, 2048, 1, 512, 512, 512, 512, 512]
    - [13, 10.114]
  - - [512, 2048, 1, 1024, 512, 512, 1024, 1024]
    - [97, 11.993]
  - - [512, 2048, 1, 2048, 512, 512, 2048, 2048]
    - [100, 15.989]
  - - [512, 2048, 1, 4096, 512, 512, 4096, 4096]
    - [67, 16.621]
  - - [512, 2048, 1, 8192, 512, 512, 8192, 8192]
    - [10, 17.719]
  - - [512, 4096, 1, 128, 512, 512, 128, 128]
    - [7, 5.493]
  - - [512, 4096, 1, 256, 512, 512, 256, 256]
    - [46, 9.366]
  - - [512, 4096, 1, 512, 512, 512, 512, 512]
    - [48, 14.713]
  - - [512, 4096, 1, 1024, 512, 512, 1024, 1024]
    - [82, 16.385]
  - - [512, 4096, 1, 2048, 512, 512, 2048, 2048]
    - [101, 18.321]
  - - [512, 4096, 1, 4096, 512, 512, 4096, 4096]
    - [2, 19.807]
  - - [512, 4096, 1, 8192, 512, 512, 8192, 8192]
    - [4, 21.627]
  - - [512, 8192, 1, 128, 512, 512, 128, 128]
    - [82, 5.641]
  - - [512, 8192, 1, 256, 512, 512, 256, 256]
    - [82, 9.013]
  - - [512, 8192, 1, 512, 512, 512, 512, 512]
    - [82, 14.226]
  - - [512, 8192, 1, 1024, 512, 512, 1024, 1024]
    - [84, 19.011]
  - - [512, 8192, 1, 2048, 512, 512, 2048, 2048]
    - [51, 21.342]
  - - [512, 8192, 1, 4096, 512, 512, 4096, 4096]
    - [8, 22.685]
  - - [512, 8192, 1, 8192, 512, 512, 8192, 8192]
    - [7, 22.79]
  - - [1024, 128, 1, 128, 1024, 1024, 128, 128]
    - [24, 0.708]
  - - [1024, 128, 1, 256, 1024, 1024, 256, 256]
    - [24, 1.34]
  - - [1024, 128, 1, 512, 1024, 1024, 512, 512]
    - [24, 2.273]
  - - [1024, 128, 1, 1024, 1024, 1024, 1024, 1024]
    - [37, 3.658]
  - - [1024, 128, 1, 2048, 1024, 1024, 2048, 2048]
    - [35, 4.407]
  - - [1024, 128, 1, 4096, 1024, 1024, 4096, 4096]
    - [92, 6.655]
  - - [1024, 128, 1, 8192, 1024, 1024, 8192, 8192]
    - [105, 9.384]
  - - [1024, 256, 1, 128, 1024, 1024, 128, 128]
    - [36, 1.307]
  - - [1024, 256, 1, 256, 1024, 1024, 256, 256]
    - [21, 2.366]
  - - [1024, 256, 1, 512, 1024, 1024, 512, 512]
    - [22, 4.01]
  - - [1024, 256, 1, 1024, 1024, 1024, 1024, 1024]
    - [34, 6.009]
  - - [1024, 256, 1, 2048, 1024, 1024, 2048, 2048]
    - [21, 7.411]
  - - [1024, 256, 1, 4096, 1024, 1024, 4096, 4096]
    - [115, 10.621]
  - - [1024, 256, 1, 8192, 1024, 1024, 8192, 8192]
    - [95, 12.209]
  - - [1024, 512, 1, 128, 1024, 1024, 128, 128]
    - [20, 2.346]
  - - [1024, 512, 1, 256, 1024, 1024, 256, 256]
    - [20, 4.053]
  - - [1024, 512, 1, 512, 1024, 1024, 512, 512]
    - [20, 6.652]
  - - [1024, 512, 1, 1024, 1024, 1024, 1024, 1024]
    - [28, 9.795]
  - - [1024, 512, 1, 2048, 1024, 1024, 2048, 2048]
    - [104, 11.671]
  - - [1024, 512, 1, 4096, 1024, 1024, 4096, 4096]
    - [108, 14.424]
  - - [1024, 512, 1, 8192, 1024, 1024, 8192, 8192]
    - [66, 15.561]
  - - [1024, 1024, 1, 128, 1024, 1024, 128, 128]
    - [14, 3.745]
  - - [1024, 1024, 1, 256, 1024, 1024, 256, 256]
    - [16, 6.468]
  - - [1024, 1024, 1, 512, 1024, 1024, 512, 512]
    - [16, 10.151]
  - - [1024, 1024, 1, 1024, 1024, 1024, 1024, 1024]
    - [89, 12.008]
  - - [1024, 1024, 1, 2048, 1024, 1024, 2048, 2048]
    - [111, 15.94]
  - - [1024, 1024, 1, 4096, 1024, 1024, 4096, 4096]
    - [57, 16.537]
  - - [1024, 1024, 1, 8192, 1024, 1024, 8192, 8192]
    - [66, 17.798]
  - - [1024, 2048, 1, 128, 1024, 1024, 128, 128]
    - [7, 5.478]
  - - [1024, 2048, 1, 256, 1024, 1024, 256, 256]
    - [11, 9.359]
  - - [1024, 2048, 1, 512, 1024, 1024, 512, 512]
    - [46, 14.72]
  - - [1024, 2048, 1, 1024, 1024, 1024, 1024, 1024]
    - [82, 15.81]
  - - [1024, 2048, 1, 2048, 1024, 1024, 2048, 2048]
    - [70, 17.8]
  - - [1024, 2048, 1, 4096, 1024, 1024, 4096, 4096]
    - [63, 18.005]
  - - [1024, 2048, 1, 8192, 1024, 1024, 8192, 8192]
    - [3, 18.663]
  - - [1024, 4096, 1, 128, 1024, 1024, 128, 128]
    - [82, 5.791]
  - - [1024, 4096, 1, 256, 1024, 1024, 256, 256]
    - [82, 8.778]
  - - [1024, 4096, 1, 512, 1024, 1024, 512, 512]
    - [81, 14.516]
  - - [1024, 4096, 1, 1024, 1024, 1024, 1024, 1024]
    - [82, 18.73]
  - - [1024, 4096, 1, 2048, 1024, 1024, 2048, 2048]
    - [52, 21.092]
  - - [1024, 4096, 1, 4096, 1024, 1024, 4096, 4096]
    - [47, 20.635]
  - - [1024, 4096, 1, 8192, 1024, 1024, 8192, 8192]
    - [69, 21.096]
  - - [1024, 8192, 1, 128, 1024, 1024, 128, 128]
    - [82, 7.18]
  - - [1024, 8192, 1, 256, 1024, 1024, 256, 256]
    - [81, 11.902]
  - - [1024, 8192, 1, 512, 1024, 1024, 512, 512]
    - [49, 17.512]
  - - [1024, 8192, 1, 1024, 1024, 1024, 1024, 1024]
    - [47, 22.28]
  - - [1024, 8192, 1, 2048, 1024, 1024, 2048, 2048]
    - [56, 23.434]
  - - [1024, 8192, 1, 4096, 1024, 1024, 4096, 4096]
    - [55, 24.711]
  - - [1024, 8192, 1, 8192, 1024, 1024, 8192, 8192]
    - [50, 25.263]
  - - [2048, 128, 1, 128, 2048, 2048, 128, 128]
    - [23, 1.318]
  - - [2048, 128, 1, 256, 2048, 2048, 256, 256]
    - [23, 2.391]
  - - [2048, 128, 1, 512, 2048, 2048, 512, 512]
    - [22, 3.981]
  - - [2048, 128, 1, 1024, 2048, 2048, 1024, 1024]
    - [32, 6.004]
  - - [2048, 128, 1, 2048, 2048, 2048, 2048, 2048]
    - [22, 7.535]
  - - [2048, 128, 1, 4096, 2048, 2048, 4096, 4096]
    - [113, 10.469]
  - - [2048, 128, 1, 8192, 2048, 2048, 8192, 8192]
    - [107, 13.475]
  - - [2048, 256, 1, 128, 2048, 2048, 128, 128]
    - [20, 2.337]
  - - [2048, 256, 1, 256, 2048, 2048, 256, 256]
    - [20, 4.1]
  - - [2048, 256, 1, 512, 2048, 2048, 512, 512]
    - [20, 6.691]
  - - [2048, 256, 1, 1024, 2048, 2048, 1024, 1024]
    - [31, 9.556]
  - - [2048, 256, 1, 2048, 2048, 2048, 2048, 2048]
    - [105, 11.723]
  - - [2048, 256, 1, 4096, 2048, 2048, 4096, 4096]
    - [105, 14.651]
  - - [2048, 256, 1, 8192, 2048, 2048, 8192, 8192]
    - [73, 16.025]
  - - [2048, 512, 1, 128, 2048, 2048, 128, 128]
    - [16, 3.731]
  - - [2048, 512, 1, 256, 2048, 2048, 256, 256]
    - [16, 6.467]
  - - [2048, 512, 1, 512, 2048, 2048, 512, 512]
    - [13, 10.115]
  - - [2048, 512, 1, 1024, 2048, 2048, 1024, 1024]
    - [91, 11.932]
  - - [2048, 512, 1, 2048, 2048, 2048, 2048, 2048]
    - [110, 15.961]
  - - [2048, 512, 1, 4096, 2048, 2048, 4096, 4096]
    - [72, 16.878]
  - - [2048, 512, 1, 8192, 2048, 2048, 8192, 8192]
    - [42, 17.649]
  - - [2048, 1024, 1, 128, 2048, 2048, 128, 128]
    - [7, 5.487]
  - - [2048, 1024, 1, 256, 2048, 2048, 256, 256]
    - [46, 9.383]
  - - [2048, 1024, 1, 512, 2048, 2048, 512, 512]
    - [47, 14.754]
  - - [2048, 1024, 1, 1024, 2048, 2048, 1024, 1024]
    - [75, 15.718]
  - - [2048, 1024, 1, 2048, 2048, 2048, 2048, 2048]
    - [76, 18.377]
  - - [2048, 1024, 1, 4096, 2048, 2048, 4096, 4096]
    - [47, 19.881]
  - - [2048, 1024, 1, 8192, 2048, 2048, 8192, 8192]
    - [51, 20.217]
  - - [2048, 2048, 1, 128, 2048, 2048, 128, 128]
    - [84, 5.574]
  - - [2048, 2048, 1, 256, 2048, 2048, 256, 256]
    - [84, 8.829]
  - - [2048, 2048, 1, 512, 2048, 2048, 512, 512]
    - [82, 14.45]
  - - [2048, 2048, 1, 1024, 2048, 2048, 1024, 1024]
    - [58, 18.094]
  - - [2048, 2048, 1, 2048, 2048, 2048, 2048, 2048]
    - [52, 20.898]
  - - [2048, 2048, 1, 4096, 2048, 2048, 4096, 4096]
    - [49, 21.963]
  - - [2048, 2048, 1, 8192, 2048, 2048, 8192, 8192]
    - [42, 21.275]
  - - [2048, 4096, 1, 128, 2048, 2048, 128, 128]
    - [84, 7.247]
  - - [2048, 4096, 1, 256, 2048, 2048, 256, 256]
    - [82, 11.88]
  - - [2048, 4096, 1, 512, 2048, 2048, 512, 512]
    - [47, 17.338]
  - - [2048, 4096, 1, 1024, 2048, 2048, 1024, 1024]
    - [66, 22.21]
  - - [2048, 4096, 1, 2048, 2048, 2048, 2048, 2048]
    - [46, 22.711]
  - - [2048, 4096, 1, 4096, 2048, 2048, 4096, 4096]
    - [49, 26.524]
  - - [2048, 4096, 1, 8192, 2048, 2048, 8192, 8192]
    - [47, 26.641]
  - - [2048, 8192, 1, 128, 2048, 2048, 128, 128]
    - [51, 9.156]
  - - [2048, 8192, 1, 256, 2048, 2048, 256, 256]
    - [51, 14.549]
  - - [2048, 8192, 1, 512, 2048, 2048, 512, 512]
    - [47, 19.605]
  - - [2048, 8192, 1, 1024, 2048, 2048, 1024, 1024]
    - [63, 22.993]
  - - [2048, 8192, 1, 2048, 2048, 2048, 2048, 2048]
    - [7, 23.169]
  - - [2048, 8192, 1, 4096, 2048, 2048, 4096, 4096]
    - [62, 28.404]
  - - [2048, 8192, 1, 8192, 2048, 2048, 8192, 8192]
    - [61, 29.467]
  - - [4096, 128, 1, 128, 4096, 4096, 128, 128]
    - [20, 2.328]
  - - [4096, 128, 1, 256, 4096, 4096, 256, 256]
    - [20, 4.135]
  - - [4096, 128, 1, 512, 4096, 4096, 512, 512]
    - [19, 6.682]
  - - [4096, 128, 1, 1024, 4096, 4096, 1024, 1024]
    - [30, 9.788]
  - - [4096, 128, 1, 2048, 4096, 4096, 2048, 2048]
    - [103, 11.558]
  - - [4096, 128, 1, 4096, 4096, 4096, 4096, 4096]
    - [103, 14.543]
  - - [4096, 128, 1, 8192, 4096, 4096, 8192, 8192]
    - [61, 15.813]
  - - [4096, 256, 1, 128, 4096, 4096, 128, 128]
    - [16, 3.77]
  - - [4096, 256, 1, 256, 4096, 4096, 256, 256]
    - [12, 6.453]
  - - [4096, 256, 1, 512, 4096, 4096, 512, 512]
    - [84, 10.116]
  - - [4096, 256, 1, 1024, 4096, 4096, 1024, 1024]
    - [104, 11.856]
  - - [4096, 256, 1, 2048, 4096, 4096, 2048, 2048]
    - [107, 15.845]
  - - [4096, 256, 1, 4096, 4096, 4096, 4096, 4096]
    - [67, 17.405]
  - - [4096, 256, 1, 8192, 4096, 4096, 8192, 8192]
    - [68, 19.449]
  - - [4096, 512, 1, 128, 4096, 4096, 128, 128]
    - [43, 5.408]
  - - [4096, 512, 1, 256, 4096, 4096, 256, 256]
    - [11, 9.35]
  - - [4096, 512, 1, 512, 4096, 4096, 512, 512]
    - [53, 14.535]
  - - [4096, 512, 1, 1024, 4096, 4096, 1024, 1024]
    - [88, 15.612]
  - - [4096, 512, 1, 2048, 4096, 4096, 2048, 2048]
    - [80, 18.115]
  - - [4096, 512, 1, 4096, 4096, 4096, 4096, 4096]
    - [41, 21.04]
  - - [4096, 512, 1, 8192, 4096, 4096, 8192, 8192]
    - [41, 22.034]
  - - [4096, 1024, 1, 128, 4096, 4096, 128, 128]
    - [99, 5.385]
  - - [4096, 1024, 1, 256, 4096, 4096, 256, 256]
    - [82, 9.29]
  - - [4096, 1024, 1, 512, 4096, 4096, 512, 512]
    - [86, 13.929]
  - - [4096, 1024, 1, 1024, 4096, 4096, 1024, 1024]
    - [77, 18.201]
  - - [4096, 1024, 1, 2048, 4096, 4096, 2048, 2048]
    - [54, 21.567]
  - - [4096, 1024, 1, 4096, 4096, 4096, 4096, 4096]
    - [47, 23.384]
  - - [4096, 1024, 1, 8192, 4096, 4096, 8192, 8192]
    - [48, 23.166]
  - - [4096, 2048, 1, 128, 4096, 4096, 128, 128]
    - [83, 7.339]
  - - [4096, 2048, 1, 256, 4096, 4096, 256, 256]
    - [82, 12.096]
  - - [4096, 2048, 1, 512, 4096, 4096, 512, 512]
    - [61, 17.386]
  - - [4096, 2048, 1, 1024, 4096, 4096, 1024, 1024]
    - [61, 22.259]
  - - [4096, 2048, 1, 2048, 4096, 4096, 2048, 2048]
    - [51, 23.159]
  - - [4096, 2048, 1, 4096, 4096, 4096, 4096, 4096]
    - [49, 26.107]
  - - [4096, 2048, 1, 8192, 4096, 4096, 8192, 8192]
    - [46, 26.329]
  - - [4096, 4096, 1, 128, 4096, 4096, 128, 128]
    - [84, 9.079]
  - - [4096, 4096, 1, 256, 4096, 4096, 256, 256]
    - [61, 14.304]
  - - [4096, 4096, 1, 512, 4096, 4096, 512, 512]
    - [63, 19.796]
  - - [4096, 4096, 1, 1024, 4096, 4096, 1024, 1024]
    - [61, 22.894]
  - - [4096, 4096, 1, 2048, 4096, 4096, 2048, 2048]
    - [55, 23.944]
  - - [4096, 4096, 1, 4096, 4096, 4096, 4096, 4096]
    - [64, 27.66]
  - - [4096, 4096, 1, 8192, 4096, 4096, 8192, 8192]
    - [60, 29.912]
  - - [4096, 8192, 1, 128, 4096, 4096, 128, 128]
    - [44, 10.808]
  - - [4096, 8192, 1, 256, 4096, 4096, 256, 256]
    - [60, 15.137]
  - - [4096, 8192, 1, 512, 4096, 4096, 512, 512]
    - [61, 19.156]
  - - [4096, 8192, 1, 1024, 4096, 4096, 1024, 1024]
    - [61, 22.814]
  - - [4096, 8192, 1, 2048, 4096, 4096, 2048, 2048]
    - [61, 26.867]
  - - [4096, 8192, 1, 4096, 4096, 4096, 4096, 4096]
    - [63, 29.744]
  - - [4096, 8192, 1, 8192, 4096, 4096, 8192, 8192]
    - [61, 34.856]
  - - [8192, 128, 1, 128, 8192, 8192, 128, 128]
    - [16, 3.785]
  - - [8192, 128, 1, 256, 8192, 8192, 256, 256]
    - [12, 6.38]
  - - [8192, 128, 1, 512, 8192, 8192, 512, 512]
    - [12, 9.988]
  - - [8192, 128, 1, 1024, 8192, 8192, 1024, 1024]
    - [109, 11.773]
  - - [8192, 128, 1, 2048, 8192, 8192, 2048, 2048]
    - [106, 15.072]
  - - [8192, 128, 1, 4096, 8192, 8192, 4096, 4096]
    - [71, 17.546]
  - - [8192, 128, 1, 8192, 8192, 8192, 8192, 8192]
    - [15, 19.992]
  - - [8192, 256, 1, 128, 8192, 8192, 128, 128]
    - [9, 5.432]
  - - [8192, 256, 1, 256, 8192, 8192, 256, 256]
    - [9, 9.37]
  - - [8192, 256, 1, 512, 8192, 8192, 512, 512]
    - [60, 14.535]
  - - [8192, 256, 1, 1024, 8192, 8192, 1024, 1024]
    - [74, 15.524]
  - - [8192, 256, 1, 2048, 8192, 8192, 2048, 2048]
    - [79, 18.765]
  - - [8192, 256, 1, 4096, 8192, 8192, 4096, 4096]
    - [41, 21.508]
  - - [8192, 256, 1, 8192, 8192, 8192, 8192, 8192]
    - [49, 23.903]
  - - [8192, 512, 1, 128, 8192, 8192, 128, 128]
    - [86, 5.33]
  - - [8192, 512, 1, 256, 8192, 8192, 256, 256]
    - [16, 8.868]
  - - [8192, 512, 1, 512, 8192, 8192, 512, 512]
    - [78, 13.982]
  - - [8192, 512, 1, 1024, 8192, 8192, 1024, 1024]
    - [77, 18.56]
  - - [8192, 512, 1, 2048, 8192, 8192, 2048, 2048]
    - [55, 21.594]
  - - [8192, 512, 1, 4096, 8192, 8192, 4096, 4096]
    - [48, 23.79]
  - - [8192, 512, 1, 8192, 8192, 8192, 8192, 8192]
    - [5, 23.684]
  - - [8192, 1024, 1, 128, 8192, 8192, 128, 128]
    - [51, 7.106]
  - - [8192, 1024, 1, 256, 8192, 8192, 256, 256]
    - [85, 11.527]
  - - [8192, 1024, 1, 512, 8192, 8192, 512, 512]
    - [61, 17.486]
  - - [8192, 1024, 1, 1024, 8192, 8192, 1024, 1024]
    - [60, 22.451]
  - - [8192, 1024, 1, 2048, 8192, 8192, 2048, 2048]
    - [61, 22.57]
  - - [8192, 1024, 1, 4096, 8192, 8192, 4096, 4096]
    - [47, 25.392]
  - - [8192, 1024, 1, 8192, 8192, 8192, 8192, 8192]
    - [48, 26.105]
  - - [8192, 2048, 1, 128, 8192, 8192, 128, 128]
    - [55, 8.834]
  - - [8192, 2048, 1, 256, 8192, 8192, 256, 256]
    - [55, 14.101]
  - - [8192, 2048, 1, 512, 8192, 8192, 512, 512]
    - [61, 19.919]
  - - [8192, 2048, 1, 1024, 8192, 8192, 1024, 1024]
    - [66, 22.692]
  - - [8192, 2048, 1, 2048, 8192, 8192, 2048, 2048]
    - [65, 23.756]
  - - [8192, 2048, 1, 4096, 8192, 8192, 4096, 4096]
    - [60, 27.643]
  - - [8192, 2048, 1, 8192, 8192, 8192, 8192, 8192]
    - [59, 28.881]
  - - [8192, 4096, 1, 128, 8192, 8192, 128, 128]
    - [45, 10.302]
  - - [8192, 4096, 1, 256, 8192, 8192, 256, 256]
    - [63, 15.042]
  - - [8192, 4096, 1, 512, 8192, 8192, 512, 512]
    - [66, 19.502]
  - - [8192, 4096, 1, 1024, 8192, 8192, 1024, 1024]
    - [61, 23.216]
  - - [8192, 4096, 1, 2048, 8192, 8192, 2048, 2048]
    - [60, 26.847]
  - - [8192, 4096, 1, 4096, 8192, 8192, 4096, 4096]
    - [60, 30.094]
  - - [8192, 4096, 1, 8192, 8192, 8192, 8192, 8192]
    - [53, 34.195]
  - - [8192, 8192, 1, 128, 8192, 8192, 128, 128]
    - [6, 8.794]
  - - [8192, 8192, 1, 256, 8192, 8192, 256, 256]
    - [5, 13.062]
  - - [8192, 8192, 1, 512, 8192, 8192, 512, 512]
    - [60, 18.357]
  - - [8192, 8192, 1, 1024, 8192, 8192, 1024, 1024]
    - [60, 24.153]
  - - [8192, 8192, 1, 2048, 8192, 8192, 2048, 2048]
    - [65, 27.284]
  - - [8192, 8192, 1, 4096, 8192, 8192, 4096, 4096]
    - [61, 31.992]
  - - [8192, 8192, 1, 8192, 8192, 8192, 8192, 8192]
    - [62, 33.047]
  - - [1, 1, 1, 32, 1, 1, 32, 32]
    - [120, 0.0]
- null
- null
- ExperimentalStreamK
- GridBased
