library/src/amd_detail/rocblaslt/src/Tensile/Logic/asm_full/aquavanjaram/gfx942_228cu/StreamK/aquavanjaram942_Cijk_Ailk_Bjlk_BBS_BH_UserArgs.yaml
- {MinimumRequiredVersion: 4.33.0}
- aquavanjaram942
- {Architecture: gfx942, CUCount: 228}
- [Device 0049, Device 0050]
    SolutionIndex: 0
    SolutionNameMin: Cijk_Ailk_Bjlk_BBS_BH_UserArgs_MT256x256x32_MI16x16x1_SN_LDSB1_CLR1_GSU0_GSUC0_GSUWGMRR0_K1_LBSPPA2048_LBSPPB2048_LPA0_LPB32_MIWT8_8_PLR1_SU32_SUM0_SUS256_SKXCCM0_VWA4_VWB2_WGM1_WGMXCC1_WGMXCCGn1
    SolutionIndex: 1
    SolutionNameMin: Cijk_Ailk_Bjlk_BBS_BH_UserArgs_MT256x256x32_MI16x16x1_SN_LDSB0_CLR1_GSU0_GSUC0_GSUWGMRR0_K1_LBSPPA2048_LBSPPB2048_LPA0_LPB0_MIWT8_8_PLR1_SU32_SUM0_SUS256_SKXCCM0_VWA4_VWB8_WGM1_WGMXCC1_WGMXCCGn1
    SolutionIndex: 2
    SolutionNameMin: Cijk_Ailk_Bjlk_BBS_BH_UserArgs_MT256x256x32_MI16x16x1_SN_LDSB0_CLR1_GSU0_GSUC0_GSUWGMRR0_K1_LBSPPA2048_LBSPPB2048_LPA0_LPB0_MIWT8_8_PLR1_SU32_SUM0_SUS256_SKXCCM0_VWA4_VWB8_WGM8_WGMXCC1_WGMXCCGn1
    SolutionIndex: 3
    SolutionNameMin: Cijk_Ailk_Bjlk_BBS_BH_UserArgs_MT128x256x32_MI16x16x1_SN_LDSB1_CLR1_GSU0_GSUC0_GSUWGMRR0_K1_LBSPPA1024_LBSPPB2048_LPA0_LPB32_MIWT4_8_PLR1_SU32_SUM0_SUS256_SKXCCM0_VWA4_VWB2_WGM1_WGMXCC1_WGMXCCGn1
    SolutionIndex: 4
    SolutionNameMin: Cijk_Ailk_Bjlk_BBS_BH_UserArgs_MT128x256x32_MI16x16x1_SN_LDSB1_CLR1_GSU0_GSUC0_GSUWGMRR0_K1_LBSPPA1024_LBSPPB2048_LPA0_LPB0_MIWT4_8_PLR1_SU32_SUM0_SUS256_SKXCCM0_VWA4_VWB8_WGM1_WGMXCC1_WGMXCCGn1
    SolutionIndex: 5
    SolutionNameMin: Cijk_Ailk_Bjlk_BBS_BH_UserArgs_MT256x128x32_MI16x16x1_SN_LDSB1_CLR1_GSU0_GSUC0_GSUWGMRR0_K1_LBSPPA2048_LBSPPB1024_LPA0_LPB32_MIWT8_4_PLR1_SU32_SUM0_SUS256_SKXCCM0_VWA8_VWB2_WGM1_WGMXCC1_WGMXCCGn1
    SolutionIndex: 6
    SolutionNameMin: Cijk_Ailk_Bjlk_BBS_BH_UserArgs_MT256x128x32_MI16x16x1_SN_LDSB1_CLR1_GSU0_GSUC0_GSUWGMRR0_K1_LBSPPA2048_LBSPPB1024_LPA0_LPB0_MIWT8_4_PLR1_SU32_SUM0_SUS256_SKXCCM0_VWA8_VWB4_WGM4_WGMXCC1_WGMXCCGn1
    SolutionIndex: 7
    SolutionNameMin: Cijk_Ailk_Bjlk_BBS_BH_UserArgs_MT256x128x32_MI16x16x1_SN_LDSB1_CLR1_GSU0_GSUC0_GSUWGMRR0_K1_LBSPPA2048_LBSPPB1024_LPA0_LPB16_MIWT8_4_PLR1_SU32_SUM0_SUS256_SKXCCM0_VWA4_VWB1_WGM8_WGMXCC1_WGMXCCGn1
    SolutionIndex: 8
    SolutionNameMin: Cijk_Ailk_Bjlk_BBS_BH_UserArgs_MT256x128x32_MI16x16x1_SN_LDSB1_CLR1_GSU0_GSUC0_GSUWGMRR0_K1_LBSPPA2048_LBSPPB1024_LPA0_LPB32_MIWT8_4_PLR1_SU32_SUM0_SUS256_SKXCCM0_VWA4_VWB2_WGM8_WGMXCC1_WGMXCCGn1
    SolutionIndex: 9
    SolutionNameMin: Cijk_Ailk_Bjlk_BBS_BH_UserArgs_MT256x128x32_MI16x16x1_SN_LDSB1_CLR1_GSU0_GSUC0_GSUWGMRR0_K1_LBSPPA2048_LBSPPB1024_LPA0_LPB0_MIWT8_4_PLR1_SU32_SUM0_SUS256_SKXCCM0_VWA4_VWB4_WGM8_WGMXCC1_WGMXCCGn1
    SolutionIndex: 10
    SolutionNameMin: Cijk_Ailk_Bjlk_BBS_BH_UserArgs_MT64x256x32_MI16x16x1_SN_LDSB1_CLR1_GSU0_GSUC0_GSUWGMRR0_K1_LBSPPA512_LBSPPB2048_LPA32_LPB0_MIWT2_8_PLR1_SU32_SUM0_SUS256_SKXCCM0_VWA2_VWB8_WGM1_WGMXCC1_WGMXCCGn1
    SolutionIndex: 11
    SolutionNameMin: Cijk_Ailk_Bjlk_BBS_BH_UserArgs_MT256x64x32_MI16x16x1_SN_LDSB1_CLR1_GSU0_GSUC0_GSUWGMRR0_K1_LBSPPA2048_LBSPPB512_LPA0_LPB32_MIWT8_2_PLR1_SU32_SUM0_SUS256_SKXCCM0_VWA8_VWB2_WGM1_WGMXCC1_WGMXCCGn1
    SolutionIndex: 12
    SolutionNameMin: Cijk_Ailk_Bjlk_BBS_BH_UserArgs_MT128x128x32_MI16x16x1_SN_LDSB0_CLR1_GSU0_GSUC0_GSUWGMRR0_K1_LBSPPA1024_LBSPPB1024_LPA0_LPB0_MIWT4_4_PLR1_SU32_SUM0_SUS256_SKXCCM0_VWA4_VWB4_WGM1_WGMXCC1_WGMXCCGn1
    SolutionIndex: 13
    SolutionNameMin: Cijk_Ailk_Bjlk_BBS_BH_UserArgs_MT128x128x32_MI16x16x1_SN_LDSB0_CLR1_GSU0_GSUC0_GSUWGMRR0_K1_LBSPPA1024_LBSPPB1024_LPA0_LPB0_MIWT4_4_PLR1_SU32_SUM0_SUS256_SKXCCM0_VWA4_VWB4_WGM4_WGMXCC1_WGMXCCGn1
    SolutionIndex: 14
    SolutionNameMin: Cijk_Ailk_Bjlk_BBS_BH_UserArgs_MT128x128x32_MI16x16x1_SN_LDSB1_CLR1_GSU0_GSUC0_GSUWGMRR0_K1_LBSPPA1024_LBSPPB1024_LPA0_LPB32_MIWT4_4_PLR1_SU32_SUM0_SUS256_SKXCCM0_VWA4_VWB2_WGM8_WGMXCC1_WGMXCCGn1
    SolutionIndex: 15
    SolutionNameMin: Cijk_Ailk_Bjlk_BBS_BH_UserArgs_MT64x128x32_MI16x16x1_SN_LDSB0_CLR1_GSU0_GSUC0_GSUWGMRR0_K1_LBSPPA512_LBSPPB1024_LPA32_LPB32_MIWT2_4_PLR1_SU32_SUM0_SUS256_SKXCCM0_VWA2_VWB2_WGM1_WGMXCC1_WGMXCCGn1
    SolutionIndex: 16
    SolutionNameMin: Cijk_Ailk_Bjlk_BBS_BH_UserArgs_MT128x64x32_MI16x16x1_SN_LDSB0_CLR1_GSU0_GSUC0_GSUWGMRR0_K1_LBSPPA1024_LBSPPB512_LPA0_LPB32_MIWT4_2_PLR1_SU32_SUM0_SUS256_SKXCCM0_VWA4_VWB2_WGM1_WGMXCC1_WGMXCCGn1
    SolutionIndex: 17
    SolutionNameMin: Cijk_Ailk_Bjlk_BBS_BH_UserArgs_MT32x32x32_MI16x16x1_SN_LDSB0_CLR1_GSU0_GSUC0_GSUWGMRR0_K1_LBSPPA256_LBSPPB256_LPA16_LPB16_MIWT1_1_PLR1_SU32_SUM0_SUS256_SKXCCM0_VWA1_VWB1_WGM1_WGMXCC1_WGMXCCGn1
    SolutionIndex: 18
    SolutionNameMin: Cijk_Ailk_Bjlk_BBS_BH_UserArgs_MT256x256x64_MI16x16x1_SN_LDSB1_CLR1_GSU0_GSUC0_GSUWGMRR0_K1_LBSPPA2048_LBSPPB2048_LPA0_LPB0_MIWT8_8_PLR1_SU32_SUM0_SUS256_SKXCCM0_VWA4_VWB4_WGM1_WGMXCC1_WGMXCCGn1
    SolutionIndex: 19
    SolutionNameMin: Cijk_Ailk_Bjlk_BBS_BH_UserArgs_MT256x256x64_MI16x16x1_SN_LDSB1_CLR1_GSU0_GSUC0_GSUWGMRR0_K1_LBSPPA2048_LBSPPB2048_LPA0_LPB0_MIWT8_8_PLR2_SU32_SUM0_SUS256_SKXCCM0_VWA4_VWB4_WGM1_WGMXCC1_WGMXCCGn1
    SolutionIndex: 20
    SolutionNameMin: Cijk_Ailk_Bjlk_BBS_BH_UserArgs_MT256x256x64_MI16x16x1_SN_LDSB1_CLR1_GSU0_GSUC0_GSUWGMRR0_K1_LBSPPA2048_LBSPPB2048_LPA0_LPB0_MIWT8_8_PLR2_SU32_SUM0_SUS256_SKXCCM0_VWA8_VWB8_WGM1_WGMXCC1_WGMXCCGn1
    SolutionIndex: 21
    SolutionNameMin: Cijk_Ailk_Bjlk_BBS_BH_UserArgs_MT256x256x64_MI16x16x1_SN_LDSB1_CLR1_GSU0_GSUC0_GSUWGMRR0_K1_LBSPPA2048_LBSPPB2048_LPA0_LPB0_MIWT8_8_PLR1_SU32_SUM0_SUS256_SKXCCM0_VWA4_VWB4_WGM4_WGMXCC1_WGMXCCGn1
    SolutionIndex: 22
    SolutionNameMin: Cijk_Ailk_Bjlk_BBS_BH_UserArgs_MT256x128x64_MI16x16x1_SN_LDSB1_CLR1_GSU0_GSUC0_GSUWGMRR0_K1_LBSPPA2048_LBSPPB1024_LPA0_LPB32_MIWT8_4_PLR1_SU32_SUM0_SUS256_SKXCCM0_VWA4_VWB2_WGM1_WGMXCC1_WGMXCCGn1
    SolutionIndex: 23
    SolutionNameMin: Cijk_Ailk_Bjlk_BBS_BH_UserArgs_MT256x128x64_MI16x16x1_SN_LDSB1_CLR1_GSU0_GSUC0_GSUWGMRR0_K1_LBSPPA2048_LBSPPB1024_LPA0_LPB0_MIWT8_4_PLR1_SU32_SUM0_SUS256_SKXCCM0_VWA4_VWB4_WGM1_WGMXCC1_WGMXCCGn1
    SolutionIndex: 24
    SolutionNameMin: Cijk_Ailk_Bjlk_BBS_BH_UserArgs_MT256x128x64_MI16x16x1_SN_LDSB1_CLR1_GSU0_GSUC0_GSUWGMRR0_K1_LBSPPA2048_LBSPPB1024_LPA0_LPB0_MIWT8_4_PLR1_SU32_SUM0_SUS256_SKXCCM0_VWA4_VWB4_WGM4_WGMXCC1_WGMXCCGn1
    SolutionIndex: 25
    SolutionNameMin: Cijk_Ailk_Bjlk_BBS_BH_UserArgs_MT256x128x64_MI16x16x1_SN_LDSB1_CLR1_GSU0_GSUC0_GSUWGMRR0_K1_LBSPPA2048_LBSPPB1024_LPA0_LPB0_MIWT8_4_PLR1_SU32_SUM0_SUS256_SKXCCM0_VWA4_VWB4_WGM8_WGMXCC1_WGMXCCGn1
    SolutionIndex: 26
    SolutionNameMin: Cijk_Ailk_Bjlk_BBS_BH_UserArgs_MT256x64x64_MI16x16x1_SN_LDSB1_CLR1_GSU0_GSUC0_GSUWGMRR0_K1_LBSPPA2048_LBSPPB512_LPA0_LPB32_MIWT8_2_PLR1_SU32_SUM0_SUS256_SKXCCM0_VWA4_VWB2_WGM8_WGMXCC1_WGMXCCGn1
    SolutionIndex: 27
    SolutionNameMin: Cijk_Ailk_Bjlk_BBS_BH_UserArgs_MT128x128x64_MI16x16x1_SN_LDSB1_CLR1_GSU0_GSUC0_GSUWGMRR0_K1_LBSPPA1024_LBSPPB1024_LPA0_LPB32_MIWT4_4_PLR1_SU32_SUM0_SUS256_SKXCCM0_VWA4_VWB2_WGM1_WGMXCC1_WGMXCCGn1
    SolutionIndex: 28
    SolutionNameMin: Cijk_Ailk_Bjlk_BBS_BH_UserArgs_MT128x128x64_MI16x16x1_SN_LDSB1_CLR1_GSU0_GSUC0_GSUWGMRR0_K1_LBSPPA1024_LBSPPB1024_LPA0_LPB0_MIWT4_4_PLR1_SU32_SUM0_SUS256_SKXCCM0_VWA4_VWB4_WGM1_WGMXCC1_WGMXCCGn1
    SolutionIndex: 29
    SolutionNameMin: Cijk_Ailk_Bjlk_BBS_BH_UserArgs_MT128x128x64_MI16x16x1_SN_LDSB1_CLR1_GSU0_GSUC0_GSUWGMRR0_K1_LBSPPA1024_LBSPPB1024_LPA0_LPB0_MIWT4_4_PLR1_SU32_SUM0_SUS256_SKXCCM0_VWA4_VWB4_WGM4_WGMXCC1_WGMXCCGn1
    SolutionIndex: 30
    SolutionNameMin: Cijk_Ailk_Bjlk_BBS_BH_UserArgs_MT128x128x64_MI16x16x1_SN_LDSB1_CLR1_GSU0_GSUC0_GSUWGMRR0_K1_LBSPPA1024_LBSPPB1024_LPA0_LPB0_MIWT4_4_PLR2_SU32_SUM0_SUS256_SKXCCM0_VWA4_VWB4_WGM4_WGMXCC1_WGMXCCGn1
    SolutionIndex: 31
    SolutionNameMin: Cijk_Ailk_Bjlk_BBS_BH_UserArgs_MT128x128x64_MI16x16x1_SN_LDSB1_CLR1_GSU0_GSUC0_GSUWGMRR0_K1_LBSPPA1024_LBSPPB1024_LPA0_LPB0_MIWT4_4_PLR1_SU32_SUM0_SUS256_SKXCCM0_VWA4_VWB4_WGM8_WGMXCC1_WGMXCCGn1
    SolutionIndex: 32
    SolutionNameMin: Cijk_Ailk_Bjlk_BBS_BH_UserArgs_MT64x128x64_MI16x16x1_SN_LDSB1_CLR1_GSU0_GSUC0_GSUWGMRR0_K1_LBSPPA512_LBSPPB1024_LPA32_LPB32_MIWT2_4_PLR1_SU32_SUM0_SUS256_SKXCCM0_VWA2_VWB2_WGM1_WGMXCC1_WGMXCCGn1
    SolutionIndex: 33
    SolutionNameMin: Cijk_Ailk_Bjlk_BBS_BH_UserArgs_MT128x64x64_MI16x16x1_SN_LDSB1_CLR1_GSU0_GSUC0_GSUWGMRR0_K1_LBSPPA1024_LBSPPB512_LPA0_LPB32_MIWT4_2_PLR1_SU32_SUM0_SUS256_SKXCCM0_VWA4_VWB2_WGM1_WGMXCC1_WGMXCCGn1
    SolutionIndex: 34
    SolutionNameMin: Cijk_Ailk_Bjlk_BBS_BH_UserArgs_MT128x64x64_MI16x16x1_SN_LDSB1_CLR1_GSU0_GSUC0_GSUWGMRR0_K1_LBSPPA1024_LBSPPB512_LPA0_LPB32_MIWT4_2_PLR2_SU32_SUM0_SUS256_SKXCCM0_VWA4_VWB2_WGM1_WGMXCC1_WGMXCCGn1
    SolutionIndex: 35
    SolutionNameMin: Cijk_Ailk_Bjlk_BBS_BH_UserArgs_MT128x64x64_MI16x16x1_SN_LDSB1_CLR1_GSU0_GSUC0_GSUWGMRR0_K1_LBSPPA1024_LBSPPB512_LPA0_LPB32_MIWT4_2_PLR2_SU32_SUM0_SUS256_SKXCCM0_VWA4_VWB2_WGM4_WGMXCC1_WGMXCCGn1
    SolutionIndex: 36
    SolutionNameMin: Cijk_Ailk_Bjlk_BBS_BH_UserArgs_MT64x64x64_MI16x16x1_SN_LDSB1_CLR1_GSU0_GSUC0_GSUWGMRR0_K1_LBSPPA512_LBSPPB512_LPA32_LPB32_MIWT2_2_PLR1_SU32_SUM0_SUS256_SKXCCM0_VWA2_VWB2_WGM1_WGMXCC1_WGMXCCGn1
    SolutionIndex: 37
    SolutionNameMin: Cijk_Ailk_Bjlk_BBS_BH_UserArgs_MT64x64x64_MI16x16x1_SN_LDSB1_CLR1_GSU0_GSUC0_GSUWGMRR0_K1_LBSPPA512_LBSPPB512_LPA32_LPB32_MIWT2_2_PLR2_SU32_SUM0_SUS256_SKXCCM0_VWA2_VWB2_WGM1_WGMXCC1_WGMXCCGn1
    SolutionIndex: 38
    SolutionNameMin: Cijk_Ailk_Bjlk_BBS_BH_UserArgs_MT32x64x64_MI16x16x1_SN_LDSB0_CLR1_GSU0_GSUC0_GSUWGMRR0_K1_LBSPPA256_LBSPPB512_LPA16_LPB32_MIWT1_2_PLR2_SU32_SUM0_SUS256_SKXCCM0_VWA1_VWB2_WGM1_WGMXCC1_WGMXCCGn1
    SolutionIndex: 39
    SolutionNameMin: Cijk_Ailk_Bjlk_BBS_BH_UserArgs_MT64x32x64_MI16x16x1_SN_LDSB0_CLR1_GSU0_GSUC0_GSUWGMRR0_K1_LBSPPA512_LBSPPB256_LPA32_LPB16_MIWT2_1_PLR2_SU32_SUM0_SUS256_SKXCCM0_VWA2_VWB1_WGM1_WGMXCC1_WGMXCCGn1
    SolutionIndex: 40
    SolutionNameMin: Cijk_Ailk_Bjlk_BBS_BH_UserArgs_MT32x32x64_MI16x16x1_SN_LDSB0_CLR1_GSU0_GSUC0_GSUWGMRR0_K1_LBSPPA256_LBSPPB256_LPA16_LPB16_MIWT1_1_PLR1_SU32_SUM0_SUS256_SKXCCM0_VWA1_VWB1_WGM1_WGMXCC1_WGMXCCGn1
    SolutionIndex: 41
    SolutionNameMin: Cijk_Ailk_Bjlk_BBS_BH_UserArgs_MT32x32x64_MI16x16x1_SN_LDSB0_CLR1_GSU0_GSUC0_GSUWGMRR0_K1_LBSPPA256_LBSPPB256_LPA16_LPB16_MIWT1_1_PLR2_SU32_SUM0_SUS256_SKXCCM0_VWA1_VWB1_WGM1_WGMXCC1_WGMXCCGn1
    SolutionIndex: 42
    SolutionNameMin: Cijk_Ailk_Bjlk_BBS_BH_UserArgs_MT32x32x64_MI16x16x1_SN_LDSB0_CLR1_GSU0_GSUC0_GSUWGMRR0_K1_LBSPPA256_LBSPPB256_LPA16_LPB16_MIWT1_1_PLR2_SU32_SUM0_SUS256_SKXCCM0_VWA1_VWB1_WGM8_WGMXCC1_WGMXCCGn1
    SolutionIndex: 43
    SolutionNameMin: Cijk_Ailk_Bjlk_BBS_BH_UserArgs_MT128x128x128_MI16x16x1_SN_LDSB1_CLR1_GSU0_GSUC0_GSUWGMRR0_K1_LBSPPA1024_LBSPPB1024_LPA0_LPB0_MIWT4_4_PLR1_SU32_SUM0_SUS256_SKXCCM0_VWA4_VWB4_WGM1_WGMXCC1_WGMXCCGn1
    SolutionIndex: 44
    SolutionNameMin: Cijk_Ailk_Bjlk_BBS_BH_UserArgs_MT128x128x128_MI16x16x1_SN_LDSB1_CLR1_GSU0_GSUC0_GSUWGMRR0_K1_LBSPPA1024_LBSPPB1024_LPA0_LPB0_MIWT4_4_PLR1_SU32_SUM0_SUS256_SKXCCM0_VWA4_VWB4_WGM4_WGMXCC1_WGMXCCGn1
    SolutionIndex: 45
    SolutionNameMin: Cijk_Ailk_Bjlk_BBS_BH_UserArgs_MT128x128x128_MI16x16x1_SN_LDSB1_CLR1_GSU0_GSUC0_GSUWGMRR0_K1_LBSPPA1024_LBSPPB1024_LPA0_LPB0_MIWT4_4_PLR1_SU32_SUM0_SUS256_SKXCCM0_VWA4_VWB4_WGM8_WGMXCC1_WGMXCCGn1
    SolutionIndex: 46
    SolutionNameMin: Cijk_Ailk_Bjlk_BBS_BH_UserArgs_MT64x128x128_MI16x16x1_SN_LDSB1_CLR1_GSU0_GSUC0_GSUWGMRR0_K1_LBSPPA512_LBSPPB1024_LPA32_LPB0_MIWT2_4_PLR2_SU32_SUM0_SUS256_SKXCCM0_VWA2_VWB4_WGM1_WGMXCC1_WGMXCCGn1
    SolutionIndex: 47
    SolutionNameMin: Cijk_Ailk_Bjlk_BBS_BH_UserArgs_MT128x64x128_MI16x16x1_SN_LDSB1_CLR1_GSU0_GSUC0_GSUWGMRR0_K1_LBSPPA1024_LBSPPB512_LPA0_LPB32_MIWT4_2_PLR2_SU32_SUM0_SUS256_SKXCCM0_VWA4_VWB2_WGM1_WGMXCC1_WGMXCCGn1
    SolutionIndex: 48
    SolutionNameMin: Cijk_Ailk_Bjlk_BBS_BH_UserArgs_MT128x64x128_MI16x16x1_SN_LDSB1_CLR1_GSU0_GSUC0_GSUWGMRR0_K1_LBSPPA1024_LBSPPB512_LPA0_LPB32_MIWT4_2_PLR2_SU32_SUM0_SUS256_SKXCCM0_VWA4_VWB2_WGM4_WGMXCC1_WGMXCCGn1
    SolutionIndex: 49
    SolutionNameMin: Cijk_Ailk_Bjlk_BBS_BH_UserArgs_MT128x64x128_MI16x16x1_SN_LDSB1_CLR1_GSU0_GSUC0_GSUWGMRR0_K1_LBSPPA1024_LBSPPB512_LPA0_LPB32_MIWT4_2_PLR2_SU32_SUM0_SUS256_SKXCCM0_VWA4_VWB2_WGM8_WGMXCC1_WGMXCCGn1
    SolutionIndex: 50
    SolutionNameMin: Cijk_Ailk_Bjlk_BBS_BH_UserArgs_MT64x64x128_MI16x16x1_SN_LDSB1_CLR1_GSU0_GSUC0_GSUWGMRR0_K1_LBSPPA512_LBSPPB512_LPA32_LPB32_MIWT2_2_PLR2_SU32_SUM0_SUS256_SKXCCM0_VWA2_VWB2_WGM1_WGMXCC1_WGMXCCGn1
    SolutionIndex: 51
    SolutionNameMin: Cijk_Ailk_Bjlk_BBS_BH_UserArgs_MT64x64x128_MI16x16x1_SN_LDSB1_CLR1_GSU0_GSUC0_GSUWGMRR0_K1_LBSPPA512_LBSPPB512_LPA32_LPB32_MIWT2_2_PLR2_SU32_SUM0_SUS256_SKXCCM0_VWA2_VWB2_WGM4_WGMXCC1_WGMXCCGn1
    SolutionIndex: 52
    SolutionNameMin: Cijk_Ailk_Bjlk_BBS_BH_UserArgs_MT32x64x128_MI16x16x1_SN_LDSB1_CLR1_GSU0_GSUC0_GSUWGMRR0_K1_LBSPPA256_LBSPPB512_LPA16_LPB32_MIWT1_2_PLR2_SU32_SUM0_SUS256_SKXCCM0_VWA1_VWB2_WGM1_WGMXCC1_WGMXCCGn1
    SolutionIndex: 53
    SolutionNameMin: Cijk_Ailk_Bjlk_BBS_BH_UserArgs_MT64x32x128_MI16x16x1_SN_LDSB1_CLR1_GSU0_GSUC0_GSUWGMRR0_K1_LBSPPA512_LBSPPB256_LPA32_LPB16_MIWT2_1_PLR2_SU32_SUM0_SUS256_SKXCCM0_VWA2_VWB1_WGM1_WGMXCC1_WGMXCCGn1
    SolutionIndex: 54
    SolutionNameMin: Cijk_Ailk_Bjlk_BBS_BH_UserArgs_MT32x32x128_MI16x16x1_SN_LDSB1_CLR1_GSU0_GSUC0_GSUWGMRR0_K1_LBSPPA256_LBSPPB256_LPA16_LPB16_MIWT1_1_PLR1_SU32_SUM0_SUS256_SKXCCM0_VWA1_VWB1_WGM1_WGMXCC1_WGMXCCGn1
    SolutionIndex: 55
    SolutionNameMin: Cijk_Ailk_Bjlk_BBS_BH_UserArgs_MT32x32x128_MI16x16x1_SN_LDSB1_CLR1_GSU0_GSUC0_GSUWGMRR0_K1_LBSPPA256_LBSPPB256_LPA16_LPB16_MIWT1_1_PLR2_SU32_SUM0_SUS256_SKXCCM0_VWA1_VWB1_WGM1_WGMXCC1_WGMXCCGn1
    SolutionIndex: 56
    SolutionNameMin: Cijk_Ailk_Bjlk_BBS_BH_UserArgs_MT32x32x128_MI16x16x1_SN_LDSB1_CLR1_GSU0_GSUC0_GSUWGMRR0_K1_LBSPPA256_LBSPPB256_LPA16_LPB16_MIWT1_1_PLR2_SU32_SUM0_SUS256_SKXCCM0_VWA1_VWB1_WGM8_WGMXCC1_WGMXCCGn1
    SolutionIndex: 57
    SolutionNameMin: Cijk_Ailk_Bjlk_BBS_BH_UserArgs_MT256x256x32_MI16x16x1_SN_LDSB0_CLR1_GSU0_GSUC0_GSUWGMRR0_K1_LBSPPA2048_LBSPPB2048_LPA0_LPB0_MIWT8_8_PLR1_SU32_SUM0_SUS256_SKXCCM6_VWA4_VWB4_WGM1_WGMXCC1_WGMXCCGn1
    SolutionIndex: 58
    SolutionNameMin: Cijk_Ailk_Bjlk_BBS_BH_UserArgs_MT256x256x32_MI16x16x1_SN_LDSB0_CLR1_GSU0_GSUC0_GSUWGMRR0_K1_LBSPPA2048_LBSPPB2048_LPA0_LPB0_MIWT8_8_PLR1_SU32_SUM0_SUS256_SKXCCM6_VWA4_VWB8_WGM1_WGMXCC1_WGMXCCGn1
    SolutionIndex: 59
    SolutionNameMin: Cijk_Ailk_Bjlk_BBS_BH_UserArgs_MT256x256x32_MI16x16x1_SN_LDSB0_CLR1_GSU0_GSUC0_GSUWGMRR0_K1_LBSPPA2048_LBSPPB2048_LPA0_LPB0_MIWT8_8_PLR1_SU32_SUM0_SUS256_SKXCCM6_VWA8_VWB8_WGM1_WGMXCC1_WGMXCCGn1
    SolutionIndex: 60
    SolutionNameMin: Cijk_Ailk_Bjlk_BBS_BH_UserArgs_MT256x256x32_MI16x16x1_SN_LDSB1_CLR1_GSU0_GSUC0_GSUWGMRR0_K1_LBSPPA2048_LBSPPB2048_LPA0_LPB32_MIWT8_8_PLR1_SU32_SUM0_SUS256_SKXCCM6_VWA8_VWB2_WGM4_WGMXCC1_WGMXCCGn1
    SolutionIndex: 61
    SolutionNameMin: Cijk_Ailk_Bjlk_BBS_BH_UserArgs_MT256x256x32_MI16x16x1_SN_LDSB0_CLR1_GSU0_GSUC0_GSUWGMRR0_K1_LBSPPA2048_LBSPPB2048_LPA0_LPB0_MIWT8_8_PLR1_SU32_SUM0_SUS256_SKXCCM6_VWA4_VWB8_WGM4_WGMXCC1_WGMXCCGn1
    SolutionIndex: 62
    SolutionNameMin: Cijk_Ailk_Bjlk_BBS_BH_UserArgs_MT256x256x32_MI16x16x1_SN_LDSB0_CLR1_GSU0_GSUC0_GSUWGMRR0_K1_LBSPPA2048_LBSPPB2048_LPA0_LPB0_MIWT8_8_PLR1_SU32_SUM0_SUS256_SKXCCM6_VWA8_VWB8_WGM4_WGMXCC1_WGMXCCGn1
    SolutionIndex: 63
    SolutionNameMin: Cijk_Ailk_Bjlk_BBS_BH_UserArgs_MT256x256x32_MI16x16x1_SN_LDSB1_CLR1_GSU0_GSUC0_GSUWGMRR0_K1_LBSPPA2048_LBSPPB2048_LPA0_LPB32_MIWT8_8_PLR1_SU32_SUM0_SUS256_SKXCCM6_VWA8_VWB2_WGM8_WGMXCC1_WGMXCCGn1
    SolutionIndex: 64
    SolutionNameMin: Cijk_Ailk_Bjlk_BBS_BH_UserArgs_MT256x256x32_MI16x16x1_SN_LDSB0_CLR1_GSU0_GSUC0_GSUWGMRR0_K1_LBSPPA2048_LBSPPB2048_LPA0_LPB0_MIWT8_8_PLR1_SU32_SUM0_SUS256_SKXCCM6_VWA8_VWB8_WGM8_WGMXCC1_WGMXCCGn1
    SolutionIndex: 65
    SolutionNameMin: Cijk_Ailk_Bjlk_BBS_BH_UserArgs_MT128x256x32_MI16x16x1_SN_LDSB1_CLR1_GSU0_GSUC0_GSUWGMRR0_K1_LBSPPA1024_LBSPPB2048_LPA0_LPB32_MIWT4_8_PLR1_SU32_SUM0_SUS256_SKXCCM6_VWA4_VWB2_WGM1_WGMXCC1_WGMXCCGn1
    SolutionIndex: 66
    SolutionNameMin: Cijk_Ailk_Bjlk_BBS_BH_UserArgs_MT128x256x32_MI16x16x1_SN_LDSB1_CLR1_GSU0_GSUC0_GSUWGMRR0_K1_LBSPPA1024_LBSPPB2048_LPA0_LPB0_MIWT4_8_PLR1_SU32_SUM0_SUS256_SKXCCM6_VWA4_VWB4_WGM1_WGMXCC1_WGMXCCGn1
    SolutionIndex: 67
    SolutionNameMin: Cijk_Ailk_Bjlk_BBS_BH_UserArgs_MT128x256x32_MI16x16x1_SN_LDSB1_CLR1_GSU0_GSUC0_GSUWGMRR0_K1_LBSPPA1024_LBSPPB2048_LPA0_LPB0_MIWT4_8_PLR1_SU32_SUM0_SUS256_SKXCCM6_VWA4_VWB8_WGM1_WGMXCC1_WGMXCCGn1
    SolutionIndex: 68
    SolutionNameMin: Cijk_Ailk_Bjlk_BBS_BH_UserArgs_MT128x256x32_MI16x16x1_SN_LDSB1_CLR1_GSU0_GSUC0_GSUWGMRR0_K1_LBSPPA1024_LBSPPB2048_LPA0_LPB0_MIWT4_8_PLR1_SU32_SUM0_SUS256_SKXCCM6_VWA4_VWB8_WGM4_WGMXCC1_WGMXCCGn1
    SolutionIndex: 69
    SolutionNameMin: Cijk_Ailk_Bjlk_BBS_BH_UserArgs_MT256x128x32_MI16x16x1_SN_LDSB1_CLR1_GSU0_GSUC0_GSUWGMRR0_K1_LBSPPA2048_LBSPPB1024_LPA32_LPB0_MIWT8_4_PLR1_SU32_SUM0_SUS256_SKXCCM6_VWA2_VWB4_WGM1_WGMXCC1_WGMXCCGn1
    SolutionIndex: 70
    SolutionNameMin: Cijk_Ailk_Bjlk_BBS_BH_UserArgs_MT256x128x32_MI16x16x1_SN_LDSB1_CLR1_GSU0_GSUC0_GSUWGMRR0_K1_LBSPPA2048_LBSPPB1024_LPA0_LPB0_MIWT8_4_PLR1_SU32_SUM0_SUS256_SKXCCM6_VWA8_VWB4_WGM1_WGMXCC1_WGMXCCGn1
    SolutionIndex: 71
    SolutionNameMin: Cijk_Ailk_Bjlk_BBS_BH_UserArgs_MT256x128x32_MI16x16x1_SN_LDSB1_CLR1_GSU0_GSUC0_GSUWGMRR0_K1_LBSPPA2048_LBSPPB1024_LPA0_LPB32_MIWT8_4_PLR1_SU32_SUM0_SUS256_SKXCCM6_VWA4_VWB2_WGM4_WGMXCC1_WGMXCCGn1
    SolutionIndex: 72
    SolutionNameMin: Cijk_Ailk_Bjlk_BBS_BH_UserArgs_MT256x128x32_MI16x16x1_SN_LDSB1_CLR1_GSU0_GSUC0_GSUWGMRR0_K1_LBSPPA2048_LBSPPB1024_LPA0_LPB32_MIWT8_4_PLR1_SU32_SUM0_SUS256_SKXCCM6_VWA8_VWB2_WGM4_WGMXCC1_WGMXCCGn1
    SolutionIndex: 73
    SolutionNameMin: Cijk_Ailk_Bjlk_BBS_BH_UserArgs_MT256x128x32_MI16x16x1_SN_LDSB1_CLR1_GSU0_GSUC0_GSUWGMRR0_K1_LBSPPA2048_LBSPPB1024_LPA32_LPB32_MIWT8_4_PLR1_SU32_SUM0_SUS256_SKXCCM6_VWA2_VWB2_WGM8_WGMXCC1_WGMXCCGn1
    SolutionIndex: 74
    SolutionNameMin: Cijk_Ailk_Bjlk_BBS_BH_UserArgs_MT256x128x32_MI16x16x1_SN_LDSB1_CLR1_GSU0_GSUC0_GSUWGMRR0_K1_LBSPPA2048_LBSPPB1024_LPA0_LPB32_MIWT8_4_PLR1_SU32_SUM0_SUS256_SKXCCM6_VWA8_VWB2_WGM8_WGMXCC1_WGMXCCGn1
    SolutionIndex: 75
    SolutionNameMin: Cijk_Ailk_Bjlk_BBS_BH_UserArgs_MT256x128x32_MI16x16x1_SN_LDSB1_CLR1_GSU0_GSUC0_GSUWGMRR0_K1_LBSPPA2048_LBSPPB1024_LPA0_LPB0_MIWT8_4_PLR1_SU32_SUM0_SUS256_SKXCCM6_VWA8_VWB4_WGM8_WGMXCC1_WGMXCCGn1
    SolutionIndex: 76
    SolutionNameMin: Cijk_Ailk_Bjlk_BBS_BH_UserArgs_MT128x128x32_MI16x16x1_SN_LDSB0_CLR1_GSU0_GSUC0_GSUWGMRR0_K1_LBSPPA1024_LBSPPB1024_LPA0_LPB0_MIWT4_4_PLR1_SU32_SUM0_SUS256_SKXCCM6_VWA4_VWB4_WGM1_WGMXCC1_WGMXCCGn1
    SolutionIndex: 77
    SolutionNameMin: Cijk_Ailk_Bjlk_BBS_BH_UserArgs_MT128x128x32_MI16x16x1_SN_LDSB0_CLR0_GSU0_GSUC0_GSUWGMRR0_K1_LBSPPA1024_LBSPPB1024_LPA0_LPB0_MIWT4_4_PLR0_SU32_SUM0_SUS256_SKXCCM6_VWA4_VWB4_WGM1_WGMXCC1_WGMXCCGn1
    SolutionIndex: 78
    SolutionNameMin: Cijk_Ailk_Bjlk_BBS_BH_UserArgs_MT128x128x32_MI16x16x1_SN_LDSB1_CLR1_GSU0_GSUC0_GSUWGMRR0_K1_LBSPPA1024_LBSPPB1024_LPA0_LPB32_MIWT4_4_PLR1_SU32_SUM0_SUS256_SKXCCM6_VWA4_VWB2_WGM8_WGMXCC1_WGMXCCGn1
    SolutionIndex: 79
    SolutionNameMin: Cijk_Ailk_Bjlk_BBS_BH_UserArgs_MT32x32x32_MI16x16x1_SN_LDSB0_CLR1_GSU0_GSUC0_GSUWGMRR0_K1_LBSPPA256_LBSPPB256_LPA16_LPB16_MIWT1_1_PLR1_SU32_SUM0_SUS256_SKXCCM6_VWA1_VWB1_WGM1_WGMXCC1_WGMXCCGn1
    SolutionIndex: 80
    SolutionNameMin: Cijk_Ailk_Bjlk_BBS_BH_UserArgs_MT32x32x32_MI16x16x1_SN_LDSB0_CLR0_GSU0_GSUC0_GSUWGMRR0_K1_LBSPPA256_LBSPPB256_LPA16_LPB16_MIWT1_1_PLR0_SU32_SUM0_SUS256_SKXCCM6_VWA1_VWB1_WGM1_WGMXCC1_WGMXCCGn1
    SolutionIndex: 81
    SolutionNameMin: Cijk_Ailk_Bjlk_BBS_BH_UserArgs_MT256x256x64_MI16x16x1_SN_LDSB1_CLR1_GSU0_GSUC0_GSUWGMRR0_K1_LBSPPA2048_LBSPPB2048_LPA0_LPB0_MIWT8_8_PLR1_SU32_SUM0_SUS256_SKXCCM6_VWA4_VWB4_WGM1_WGMXCC1_WGMXCCGn1
    SolutionIndex: 82
    SolutionNameMin: Cijk_Ailk_Bjlk_BBS_BH_UserArgs_MT256x256x64_MI16x16x1_SN_LDSB1_CLR1_GSU0_GSUC0_GSUWGMRR0_K1_LBSPPA2048_LBSPPB2048_LPA0_LPB0_MIWT8_8_PLR1_SU32_SUM0_SUS256_SKXCCM6_VWA4_VWB8_WGM1_WGMXCC1_WGMXCCGn1
    SolutionIndex: 83
    SolutionNameMin: Cijk_Ailk_Bjlk_BBS_BH_UserArgs_MT256x256x64_MI16x16x1_SN_LDSB1_CLR1_GSU0_GSUC0_GSUWGMRR0_K1_LBSPPA2048_LBSPPB2048_LPA0_LPB0_MIWT8_8_PLR2_SU32_SUM0_SUS256_SKXCCM6_VWA4_VWB4_WGM1_WGMXCC1_WGMXCCGn1
    SolutionIndex: 84
    SolutionNameMin: Cijk_Ailk_Bjlk_BBS_BH_UserArgs_MT256x256x64_MI16x16x1_SN_LDSB1_CLR1_GSU0_GSUC0_GSUWGMRR0_K1_LBSPPA2048_LBSPPB2048_LPA0_LPB0_MIWT8_8_PLR2_SU32_SUM0_SUS256_SKXCCM6_VWA4_VWB8_WGM1_WGMXCC1_WGMXCCGn1
    SolutionIndex: 85
    SolutionNameMin: Cijk_Ailk_Bjlk_BBS_BH_UserArgs_MT256x256x64_MI16x16x1_SN_LDSB1_CLR1_GSU0_GSUC0_GSUWGMRR0_K1_LBSPPA2048_LBSPPB2048_LPA0_LPB0_MIWT8_8_PLR2_SU32_SUM0_SUS256_SKXCCM6_VWA8_VWB8_WGM1_WGMXCC1_WGMXCCGn1
    SolutionIndex: 86
    SolutionNameMin: Cijk_Ailk_Bjlk_BBS_BH_UserArgs_MT256x256x64_MI16x16x1_SN_LDSB1_CLR1_GSU0_GSUC0_GSUWGMRR0_K1_LBSPPA2048_LBSPPB2048_LPA0_LPB0_MIWT8_8_PLR1_SU32_SUM0_SUS256_SKXCCM6_VWA4_VWB4_WGM4_WGMXCC1_WGMXCCGn1
    SolutionIndex: 87
    SolutionNameMin: Cijk_Ailk_Bjlk_BBS_BH_UserArgs_MT256x256x64_MI16x16x1_SN_LDSB1_CLR1_GSU0_GSUC0_GSUWGMRR0_K1_LBSPPA2048_LBSPPB2048_LPA0_LPB0_MIWT8_8_PLR2_SU32_SUM0_SUS256_SKXCCM6_VWA4_VWB8_WGM4_WGMXCC1_WGMXCCGn1
    SolutionIndex: 88
    SolutionNameMin: Cijk_Ailk_Bjlk_BBS_BH_UserArgs_MT256x256x64_MI16x16x1_SN_LDSB1_CLR1_GSU0_GSUC0_GSUWGMRR0_K1_LBSPPA2048_LBSPPB2048_LPA0_LPB0_MIWT8_8_PLR1_SU32_SUM0_SUS256_SKXCCM6_VWA4_VWB4_WGM8_WGMXCC1_WGMXCCGn1
    SolutionIndex: 89
    SolutionNameMin: Cijk_Ailk_Bjlk_BBS_BH_UserArgs_MT128x256x64_MI16x16x1_SN_LDSB1_CLR1_GSU0_GSUC0_GSUWGMRR0_K1_LBSPPA1024_LBSPPB2048_LPA0_LPB0_MIWT4_8_PLR1_SU32_SUM0_SUS256_SKXCCM6_VWA4_VWB4_WGM1_WGMXCC1_WGMXCCGn1
    SolutionIndex: 90
    SolutionNameMin: Cijk_Ailk_Bjlk_BBS_BH_UserArgs_MT128x256x64_MI16x16x1_SN_LDSB1_CLR1_GSU0_GSUC0_GSUWGMRR0_K1_LBSPPA1024_LBSPPB2048_LPA0_LPB32_MIWT4_8_PLR2_SU32_SUM0_SUS256_SKXCCM6_VWA4_VWB2_WGM1_WGMXCC1_WGMXCCGn1
    SolutionIndex: 91
    SolutionNameMin: Cijk_Ailk_Bjlk_BBS_BH_UserArgs_MT128x256x64_MI16x16x1_SN_LDSB1_CLR1_GSU0_GSUC0_GSUWGMRR0_K1_LBSPPA1024_LBSPPB2048_LPA0_LPB0_MIWT4_8_PLR2_SU32_SUM0_SUS256_SKXCCM6_VWA4_VWB8_WGM1_WGMXCC1_WGMXCCGn1
    SolutionIndex: 92
    SolutionNameMin: Cijk_Ailk_Bjlk_BBS_BH_UserArgs_MT128x256x64_MI16x16x1_SN_LDSB1_CLR1_GSU0_GSUC0_GSUWGMRR0_K1_LBSPPA1024_LBSPPB2048_LPA0_LPB0_MIWT4_8_PLR1_SU32_SUM0_SUS256_SKXCCM6_VWA4_VWB4_WGM4_WGMXCC1_WGMXCCGn1
    SolutionIndex: 93
    SolutionNameMin: Cijk_Ailk_Bjlk_BBS_BH_UserArgs_MT128x256x64_MI16x16x1_SN_LDSB1_CLR1_GSU0_GSUC0_GSUWGMRR0_K1_LBSPPA1024_LBSPPB2048_LPA0_LPB0_MIWT4_8_PLR1_SU32_SUM0_SUS256_SKXCCM6_VWA4_VWB8_WGM8_WGMXCC1_WGMXCCGn1
    SolutionIndex: 94
    SolutionNameMin: Cijk_Ailk_Bjlk_BBS_BH_UserArgs_MT256x128x64_MI16x16x1_SN_LDSB1_CLR1_GSU0_GSUC0_GSUWGMRR0_K1_LBSPPA2048_LBSPPB1024_LPA32_LPB0_MIWT8_4_PLR1_SU32_SUM0_SUS256_SKXCCM6_VWA2_VWB4_WGM1_WGMXCC1_WGMXCCGn1
    SolutionIndex: 95
    SolutionNameMin: Cijk_Ailk_Bjlk_BBS_BH_UserArgs_MT256x128x64_MI16x16x1_SN_LDSB1_CLR1_GSU0_GSUC0_GSUWGMRR0_K1_LBSPPA2048_LBSPPB1024_LPA0_LPB0_MIWT8_4_PLR1_SU32_SUM0_SUS256_SKXCCM6_VWA4_VWB4_WGM1_WGMXCC1_WGMXCCGn1
    SolutionIndex: 96
    SolutionNameMin: Cijk_Ailk_Bjlk_BBS_BH_UserArgs_MT256x128x64_MI16x16x1_SN_LDSB1_CLR1_GSU0_GSUC0_GSUWGMRR0_K1_LBSPPA2048_LBSPPB1024_LPA32_LPB0_MIWT8_4_PLR1_SU32_SUM0_SUS256_SKXCCM6_VWA2_VWB4_WGM4_WGMXCC1_WGMXCCGn1
    SolutionIndex: 97
    SolutionNameMin: Cijk_Ailk_Bjlk_BBS_BH_UserArgs_MT256x128x64_MI16x16x1_SN_LDSB1_CLR1_GSU0_GSUC0_GSUWGMRR0_K1_LBSPPA2048_LBSPPB1024_LPA0_LPB0_MIWT8_4_PLR2_SU32_SUM0_SUS256_SKXCCM6_VWA4_VWB4_WGM4_WGMXCC1_WGMXCCGn1
    SolutionIndex: 98
    SolutionNameMin: Cijk_Ailk_Bjlk_BBS_BH_UserArgs_MT256x128x64_MI16x16x1_SN_LDSB1_CLR1_GSU0_GSUC0_GSUWGMRR0_K1_LBSPPA2048_LBSPPB1024_LPA0_LPB16_MIWT8_4_PLR1_SU32_SUM0_SUS256_SKXCCM6_VWA4_VWB1_WGM8_WGMXCC1_WGMXCCGn1
    SolutionIndex: 99
    SolutionNameMin: Cijk_Ailk_Bjlk_BBS_BH_UserArgs_MT256x128x64_MI16x16x1_SN_LDSB1_CLR1_GSU0_GSUC0_GSUWGMRR0_K1_LBSPPA2048_LBSPPB1024_LPA0_LPB32_MIWT8_4_PLR1_SU32_SUM0_SUS256_SKXCCM6_VWA4_VWB2_WGM8_WGMXCC1_WGMXCCGn1
    SolutionIndex: 100
    SolutionNameMin: Cijk_Ailk_Bjlk_BBS_BH_UserArgs_MT256x128x64_MI16x16x1_SN_LDSB1_CLR1_GSU0_GSUC0_GSUWGMRR0_K1_LBSPPA2048_LBSPPB1024_LPA32_LPB0_MIWT8_4_PLR1_SU32_SUM0_SUS256_SKXCCM6_VWA2_VWB4_WGM8_WGMXCC1_WGMXCCGn1
    SolutionIndex: 101
    SolutionNameMin: Cijk_Ailk_Bjlk_BBS_BH_UserArgs_MT128x128x64_MI16x16x1_SN_LDSB1_CLR1_GSU0_GSUC0_GSUWGMRR0_K1_LBSPPA1024_LBSPPB1024_LPA0_LPB32_MIWT4_4_PLR1_SU32_SUM0_SUS256_SKXCCM6_VWA4_VWB2_WGM1_WGMXCC1_WGMXCCGn1
    SolutionIndex: 102
    SolutionNameMin: Cijk_Ailk_Bjlk_BBS_BH_UserArgs_MT128x128x64_MI16x16x1_SN_LDSB1_CLR1_GSU0_GSUC0_GSUWGMRR0_K1_LBSPPA1024_LBSPPB1024_LPA0_LPB0_MIWT4_4_PLR1_SU32_SUM0_SUS256_SKXCCM6_VWA4_VWB4_WGM1_WGMXCC1_WGMXCCGn1
    SolutionIndex: 103
    SolutionNameMin: Cijk_Ailk_Bjlk_BBS_BH_UserArgs_MT128x128x64_MI16x16x1_SN_LDSB1_CLR1_GSU0_GSUC0_GSUWGMRR0_K1_LBSPPA1024_LBSPPB1024_LPA0_LPB32_MIWT4_4_PLR2_SU32_SUM0_SUS256_SKXCCM6_VWA4_VWB2_WGM1_WGMXCC1_WGMXCCGn1
    SolutionIndex: 104
    SolutionNameMin: Cijk_Ailk_Bjlk_BBS_BH_UserArgs_MT128x128x64_MI16x16x1_SN_LDSB1_CLR1_GSU0_GSUC0_GSUWGMRR0_K1_LBSPPA1024_LBSPPB1024_LPA0_LPB0_MIWT4_4_PLR1_SU32_SUM0_SUS256_SKXCCM6_VWA4_VWB4_WGM4_WGMXCC1_WGMXCCGn1
    SolutionIndex: 105
    SolutionNameMin: Cijk_Ailk_Bjlk_BBS_BH_UserArgs_MT128x128x64_MI16x16x1_SN_LDSB1_CLR1_GSU0_GSUC0_GSUWGMRR0_K1_LBSPPA1024_LBSPPB1024_LPA0_LPB0_MIWT4_4_PLR2_SU32_SUM0_SUS256_SKXCCM6_VWA4_VWB4_WGM4_WGMXCC1_WGMXCCGn1
    SolutionIndex: 106
    SolutionNameMin: Cijk_Ailk_Bjlk_BBS_BH_UserArgs_MT128x128x64_MI16x16x1_SN_LDSB1_CLR1_GSU0_GSUC0_GSUWGMRR0_K1_LBSPPA1024_LBSPPB1024_LPA0_LPB32_MIWT4_4_PLR1_SU32_SUM0_SUS256_SKXCCM6_VWA4_VWB2_WGM8_WGMXCC1_WGMXCCGn1
    SolutionIndex: 107
    SolutionNameMin: Cijk_Ailk_Bjlk_BBS_BH_UserArgs_MT128x128x64_MI16x16x1_SN_LDSB1_CLR1_GSU0_GSUC0_GSUWGMRR0_K1_LBSPPA1024_LBSPPB1024_LPA0_LPB0_MIWT4_4_PLR1_SU32_SUM0_SUS256_SKXCCM6_VWA4_VWB4_WGM8_WGMXCC1_WGMXCCGn1
    SolutionIndex: 108
    SolutionNameMin: Cijk_Ailk_Bjlk_BBS_BH_UserArgs_MT128x128x64_MI16x16x1_SN_LDSB1_CLR1_GSU0_GSUC0_GSUWGMRR0_K1_LBSPPA1024_LBSPPB1024_LPA0_LPB32_MIWT4_4_PLR2_SU32_SUM0_SUS256_SKXCCM6_VWA4_VWB2_WGM8_WGMXCC1_WGMXCCGn1
    SolutionIndex: 109
    SolutionNameMin: Cijk_Ailk_Bjlk_BBS_BH_UserArgs_MT128x128x64_MI16x16x1_SN_LDSB1_CLR1_GSU0_GSUC0_GSUWGMRR0_K1_LBSPPA1024_LBSPPB1024_LPA0_LPB0_MIWT4_4_PLR2_SU32_SUM0_SUS256_SKXCCM6_VWA4_VWB4_WGM8_WGMXCC1_WGMXCCGn1
    SolutionIndex: 110
    SolutionNameMin: Cijk_Ailk_Bjlk_BBS_BH_UserArgs_MT64x128x64_MI16x16x1_SN_LDSB1_CLR1_GSU0_GSUC0_GSUWGMRR0_K1_LBSPPA512_LBSPPB1024_LPA32_LPB0_MIWT2_4_PLR2_SU32_SUM0_SUS256_SKXCCM6_VWA2_VWB4_WGM8_WGMXCC1_WGMXCCGn1
    SolutionIndex: 111
    SolutionNameMin: Cijk_Ailk_Bjlk_BBS_BH_UserArgs_MT128x64x64_MI16x16x1_SN_LDSB1_CLR1_GSU0_GSUC0_GSUWGMRR0_K1_LBSPPA1024_LBSPPB512_LPA0_LPB32_MIWT4_2_PLR1_SU32_SUM0_SUS256_SKXCCM6_VWA4_VWB2_WGM1_WGMXCC1_WGMXCCGn1
    SolutionIndex: 112
    SolutionNameMin: Cijk_Ailk_Bjlk_BBS_BH_UserArgs_MT128x64x64_MI16x16x1_SN_LDSB1_CLR1_GSU0_GSUC0_GSUWGMRR0_K1_LBSPPA1024_LBSPPB512_LPA0_LPB32_MIWT4_2_PLR2_SU32_SUM0_SUS256_SKXCCM6_VWA4_VWB2_WGM1_WGMXCC1_WGMXCCGn1
    SolutionIndex: 113
    SolutionNameMin: Cijk_Ailk_Bjlk_BBS_BH_UserArgs_MT128x64x64_MI16x16x1_SN_LDSB1_CLR1_GSU0_GSUC0_GSUWGMRR0_K1_LBSPPA1024_LBSPPB512_LPA0_LPB32_MIWT4_2_PLR2_SU32_SUM0_SUS256_SKXCCM6_VWA4_VWB2_WGM4_WGMXCC1_WGMXCCGn1
    SolutionIndex: 114
    SolutionNameMin: Cijk_Ailk_Bjlk_BBS_BH_UserArgs_MT64x64x64_MI16x16x1_SN_LDSB1_CLR1_GSU0_GSUC0_GSUWGMRR0_K1_LBSPPA512_LBSPPB512_LPA32_LPB32_MIWT2_2_PLR1_SU32_SUM0_SUS256_SKXCCM6_VWA2_VWB2_WGM1_WGMXCC1_WGMXCCGn1
    SolutionIndex: 115
    SolutionNameMin: Cijk_Ailk_Bjlk_BBS_BH_UserArgs_MT64x64x64_MI16x16x1_SN_LDSB1_CLR1_GSU0_GSUC0_GSUWGMRR0_K1_LBSPPA512_LBSPPB512_LPA32_LPB32_MIWT2_2_PLR1_SU32_SUM0_SUS256_SKXCCM6_VWA2_VWB2_WGM4_WGMXCC1_WGMXCCGn1
    SolutionIndex: 116
    SolutionNameMin: Cijk_Ailk_Bjlk_BBS_BH_UserArgs_MT32x64x64_MI16x16x1_SN_LDSB0_CLR1_GSU0_GSUC0_GSUWGMRR0_K1_LBSPPA256_LBSPPB512_LPA16_LPB32_MIWT1_2_PLR2_SU32_SUM0_SUS256_SKXCCM6_VWA1_VWB2_WGM1_WGMXCC1_WGMXCCGn1
    SolutionIndex: 117
    SolutionNameMin: Cijk_Ailk_Bjlk_BBS_BH_UserArgs_MT64x32x64_MI16x16x1_SN_LDSB0_CLR1_GSU0_GSUC0_GSUWGMRR0_K1_LBSPPA512_LBSPPB256_LPA32_LPB16_MIWT2_1_PLR2_SU32_SUM0_SUS256_SKXCCM6_VWA2_VWB1_WGM1_WGMXCC1_WGMXCCGn1
    SolutionIndex: 118
    SolutionNameMin: Cijk_Ailk_Bjlk_BBS_BH_UserArgs_MT128x128x128_MI16x16x1_SN_LDSB1_CLR1_GSU0_GSUC0_GSUWGMRR0_K1_LBSPPA1024_LBSPPB1024_LPA0_LPB0_MIWT4_4_PLR1_SU32_SUM0_SUS256_SKXCCM6_VWA4_VWB4_WGM1_WGMXCC1_WGMXCCGn1
    SolutionIndex: 119
    SolutionNameMin: Cijk_Ailk_Bjlk_BBS_BH_UserArgs_MT128x128x128_MI16x16x1_SN_LDSB1_CLR1_GSU0_GSUC0_GSUWGMRR0_K1_LBSPPA1024_LBSPPB1024_LPA0_LPB0_MIWT4_4_PLR2_SU32_SUM0_SUS256_SKXCCM6_VWA4_VWB4_WGM1_WGMXCC1_WGMXCCGn1
    SolutionIndex: 120
    SolutionNameMin: Cijk_Ailk_Bjlk_BBS_BH_UserArgs_MT128x128x128_MI16x16x1_SN_LDSB1_CLR1_GSU0_GSUC0_GSUWGMRR0_K1_LBSPPA1024_LBSPPB1024_LPA0_LPB0_MIWT4_4_PLR1_SU32_SUM0_SUS256_SKXCCM6_VWA4_VWB4_WGM4_WGMXCC1_WGMXCCGn1
    SolutionIndex: 121
    SolutionNameMin: Cijk_Ailk_Bjlk_BBS_BH_UserArgs_MT128x128x128_MI16x16x1_SN_LDSB1_CLR1_GSU0_GSUC0_GSUWGMRR0_K1_LBSPPA1024_LBSPPB1024_LPA0_LPB0_MIWT4_4_PLR2_SU32_SUM0_SUS256_SKXCCM6_VWA4_VWB4_WGM4_WGMXCC1_WGMXCCGn1
    SolutionIndex: 122
    SolutionNameMin: Cijk_Ailk_Bjlk_BBS_BH_UserArgs_MT128x128x128_MI16x16x1_SN_LDSB1_CLR1_GSU0_GSUC0_GSUWGMRR0_K1_LBSPPA1024_LBSPPB1024_LPA0_LPB0_MIWT4_4_PLR1_SU32_SUM0_SUS256_SKXCCM6_VWA4_VWB4_WGM8_WGMXCC1_WGMXCCGn1
    SolutionIndex: 123
    SolutionNameMin: Cijk_Ailk_Bjlk_BBS_BH_UserArgs_MT128x64x128_MI16x16x1_SN_LDSB1_CLR1_GSU0_GSUC0_GSUWGMRR0_K1_LBSPPA1024_LBSPPB512_LPA0_LPB32_MIWT4_2_PLR2_SU32_SUM0_SUS256_SKXCCM6_VWA4_VWB2_WGM1_WGMXCC1_WGMXCCGn1
    SolutionIndex: 124
    SolutionNameMin: Cijk_Ailk_Bjlk_BBS_BH_UserArgs_MT128x64x128_MI16x16x1_SN_LDSB1_CLR1_GSU0_GSUC0_GSUWGMRR0_K1_LBSPPA1024_LBSPPB512_LPA0_LPB32_MIWT4_2_PLR2_SU32_SUM0_SUS256_SKXCCM6_VWA4_VWB2_WGM4_WGMXCC1_WGMXCCGn1
    SolutionIndex: 125
    SolutionNameMin: Cijk_Ailk_Bjlk_BBS_BH_UserArgs_MT128x64x128_MI16x16x1_SN_LDSB1_CLR1_GSU0_GSUC0_GSUWGMRR0_K1_LBSPPA1024_LBSPPB512_LPA0_LPB32_MIWT4_2_PLR2_SU32_SUM0_SUS256_SKXCCM6_VWA4_VWB2_WGM8_WGMXCC1_WGMXCCGn1
    SolutionIndex: 126
    SolutionNameMin: Cijk_Ailk_Bjlk_BBS_BH_UserArgs_MT64x64x128_MI16x16x1_SN_LDSB1_CLR1_GSU0_GSUC0_GSUWGMRR0_K1_LBSPPA512_LBSPPB512_LPA32_LPB32_MIWT2_2_PLR2_SU32_SUM0_SUS256_SKXCCM6_VWA2_VWB2_WGM1_WGMXCC1_WGMXCCGn1
    SolutionIndex: 127
    SolutionNameMin: Cijk_Ailk_Bjlk_BBS_BH_UserArgs_MT64x64x128_MI16x16x1_SN_LDSB1_CLR1_GSU0_GSUC0_GSUWGMRR0_K1_LBSPPA512_LBSPPB512_LPA32_LPB32_MIWT2_2_PLR2_SU32_SUM0_SUS256_SKXCCM6_VWA2_VWB2_WGM8_WGMXCC1_WGMXCCGn1
    SolutionIndex: 128
    SolutionNameMin: Cijk_Ailk_Bjlk_BBS_BH_UserArgs_MT64x32x128_MI16x16x1_SN_LDSB1_CLR1_GSU0_GSUC0_GSUWGMRR0_K1_LBSPPA512_LBSPPB256_LPA32_LPB16_MIWT2_1_PLR2_SU32_SUM0_SUS256_SKXCCM6_VWA2_VWB1_WGM1_WGMXCC1_WGMXCCGn1
    SolutionIndex: 129
    SolutionNameMin: Cijk_Ailk_Bjlk_BBS_BH_UserArgs_MT64x32x128_MI16x16x1_SN_LDSB1_CLR1_GSU0_GSUC0_GSUWGMRR0_K1_LBSPPA512_LBSPPB256_LPA32_LPB16_MIWT2_1_PLR2_SU32_SUM0_SUS256_SKXCCM6_VWA2_VWB1_WGM4_WGMXCC1_WGMXCCGn1
    SolutionIndex: 130
    SolutionNameMin: Cijk_Ailk_Bjlk_BBS_BH_UserArgs_MT32x32x128_MI16x16x1_SN_LDSB1_CLR1_GSU0_GSUC0_GSUWGMRR0_K1_LBSPPA256_LBSPPB256_LPA16_LPB16_MIWT1_1_PLR2_SU32_SUM0_SUS256_SKXCCM6_VWA1_VWB1_WGM1_WGMXCC1_WGMXCCGn1
    SolutionIndex: 131
    SolutionNameMin: Cijk_Ailk_Bjlk_BBS_BH_UserArgs_MT32x32x32_MI16x16x1_SN_LDSB0_CLR1_GSU0_GSUC0_GSUWGMRR0_K1_LBSPPA256_LBSPPB256_LPA16_LPB16_MIWT1_1_PLR1_SU32_SUM0_SUS256_SKXCCM6_VWA1_VWB1_WGM4_WGMXCC1_WGMXCCGn1
- - - [128, 128, 1, 128, 128, 128, 128, 128]
    - [42, 0.073]
  - - [128, 128, 1, 256, 128, 128, 128, 128]
    - [42, 0.134]
  - - [128, 128, 1, 512, 128, 128, 128, 128]
    - [56, 0.222]
  - - [128, 128, 1, 1024, 128, 128, 128, 128]
    - [40, 0.33]
  - - [128, 128, 1, 2048, 128, 128, 128, 128]
    - [79, 0.552]
  - - [128, 128, 1, 4096, 128, 128, 128, 128]
    - [40, 0.934]
  - - [128, 128, 1, 8192, 128, 128, 128, 128]
    - [79, 1.419]
  - - [128, 256, 1, 128, 128, 128, 128, 256]
    - [17, 0.158]
  - - [128, 256, 1, 256, 128, 128, 128, 256]
    - [41, 0.279]
  - - [128, 256, 1, 512, 128, 128, 128, 256]
    - [40, 0.451]
  - - [128, 256, 1, 1024, 128, 128, 128, 256]
    - [55, 0.654]
  - - [128, 256, 1, 2048, 128, 128, 128, 256]
    - [79, 1.077]
  - - [128, 256, 1, 4096, 128, 128, 128, 256]
    - [40, 1.826]
  - - [128, 256, 1, 8192, 128, 128, 128, 256]
    - [54, 2.652]
  - - [128, 512, 1, 128, 128, 128, 128, 512]
    - [41, 0.309]
  - - [128, 512, 1, 256, 128, 128, 128, 512]
    - [40, 0.553]
  - - [128, 512, 1, 512, 128, 128, 128, 512]
    - [40, 0.899]
  - - [128, 512, 1, 1024, 128, 128, 128, 512]
    - [55, 1.304]
  - - [128, 512, 1, 2048, 128, 128, 128, 512]
    - [55, 2.013]
  - - [128, 512, 1, 4096, 128, 128, 128, 512]
    - [116, 3.186]
  - - [128, 512, 1, 8192, 128, 128, 128, 512]
    - [52, 4.719]
  - - [128, 1024, 1, 128, 128, 128, 128, 1024]
    - [17, 0.622]
  - - [128, 1024, 1, 256, 128, 128, 128, 1024]
    - [41, 1.092]
  - - [128, 1024, 1, 512, 128, 128, 128, 1024]
    - [40, 1.771]
  - - [128, 1024, 1, 1024, 128, 128, 128, 1024]
    - [54, 2.577]
  - - [128, 1024, 1, 2048, 128, 128, 128, 1024]
    - [53, 3.664]
  - - [128, 1024, 1, 4096, 128, 128, 128, 1024]
    - [114, 5.369]
  - - [128, 1024, 1, 8192, 128, 128, 128, 1024]
    - [126, 7.948]
  - - [128, 2048, 1, 128, 128, 128, 128, 2048]
    - [39, 1.153]
  - - [128, 2048, 1, 256, 128, 128, 128, 2048]
    - [39, 2.025]
  - - [128, 2048, 1, 512, 128, 128, 128, 2048]
    - [52, 3.242]
  - - [128, 2048, 1, 1024, 128, 128, 128, 2048]
    - [128, 4.658]
  - - [128, 2048, 1, 2048, 128, 128, 128, 2048]
    - [50, 6.179]
  - - [128, 2048, 1, 4096, 128, 128, 128, 2048]
    - [126, 8.725]
  - - [128, 2048, 1, 8192, 128, 128, 128, 2048]
    - [48, 11.747]
  - - [128, 4096, 1, 128, 128, 128, 128, 4096]
    - [36, 2.064]
  - - [128, 4096, 1, 256, 128, 128, 128, 4096]
    - [37, 3.557]
  - - [128, 4096, 1, 512, 128, 128, 128, 4096]
    - [50, 5.585]
  - - [128, 4096, 1, 1024, 128, 128, 128, 4096]
    - [126, 8.055]
  - - [128, 4096, 1, 2048, 128, 128, 128, 4096]
    - [126, 9.732]
  - - [128, 4096, 1, 4096, 128, 128, 128, 4096]
    - [34, 13.227]
  - - [128, 4096, 1, 8192, 128, 128, 128, 4096]
    - [44, 16.772]
  - - [128, 8192, 1, 128, 128, 128, 128, 8192]
    - [16, 3.404]
  - - [128, 8192, 1, 256, 128, 128, 128, 8192]
    - [16, 5.681]
  - - [128, 8192, 1, 512, 128, 128, 128, 8192]
    - [34, 8.7]
  - - [128, 8192, 1, 1024, 128, 128, 128, 8192]
    - [47, 11.599]
  - - [128, 8192, 1, 2048, 128, 128, 128, 8192]
    - [33, 13.785]
  - - [128, 8192, 1, 4096, 128, 128, 128, 8192]
    - [103, 16.741]
  - - [128, 8192, 1, 8192, 128, 128, 128, 8192]
    - [119, 19.27]
  - - [256, 128, 1, 128, 256, 256, 256, 128]
    - [41, 0.159]
  - - [256, 128, 1, 256, 256, 256, 256, 128]
    - [54, 0.273]
  - - [256, 128, 1, 512, 256, 256, 256, 128]
    - [41, 0.453]
  - - [256, 128, 1, 1024, 256, 256, 256, 128]
    - [54, 0.656]
  - - [256, 128, 1, 2048, 256, 256, 256, 128]
    - [80, 1.082]
  - - [256, 128, 1, 4096, 256, 256, 256, 128]
    - [40, 1.821]
  - - [256, 128, 1, 8192, 256, 256, 256, 128]
    - [54, 2.639]
  - - [256, 256, 1, 128, 256, 256, 256, 256]
    - [40, 0.312]
  - - [256, 256, 1, 256, 256, 256, 256, 256]
    - [40, 0.546]
  - - [256, 256, 1, 512, 256, 256, 256, 256]
    - [40, 0.899]
  - - [256, 256, 1, 1024, 256, 256, 256, 256]
    - [55, 1.306]
  - - [256, 256, 1, 2048, 256, 256, 256, 256]
    - [55, 2.011]
  - - [256, 256, 1, 4096, 256, 256, 256, 256]
    - [117, 3.195]
  - - [256, 256, 1, 8192, 256, 256, 256, 256]
    - [53, 4.794]
  - - [256, 512, 1, 128, 256, 256, 256, 512]
    - [17, 0.623]
  - - [256, 512, 1, 256, 256, 256, 256, 512]
    - [40, 1.092]
  - - [256, 512, 1, 512, 256, 256, 256, 512]
    - [41, 1.759]
  - - [256, 512, 1, 1024, 256, 256, 256, 512]
    - [54, 2.565]
  - - [256, 512, 1, 2048, 256, 256, 256, 512]
    - [53, 3.663]
  - - [256, 512, 1, 4096, 256, 256, 256, 512]
    - [114, 5.398]
  - - [256, 512, 1, 8192, 256, 256, 256, 512]
    - [50, 7.414]
  - - [256, 1024, 1, 128, 256, 256, 256, 1024]
    - [117, 1.14]
  - - [256, 1024, 1, 256, 256, 256, 256, 1024]
    - [39, 2.015]
  - - [256, 1024, 1, 512, 256, 256, 256, 1024]
    - [53, 3.241]
  - - [256, 1024, 1, 1024, 256, 256, 256, 1024]
    - [53, 4.71]
  - - [256, 1024, 1, 2048, 256, 256, 256, 1024]
    - [50, 6.2]
  - - [256, 1024, 1, 4096, 256, 256, 256, 1024]
    - [34, 8.589]
  - - [256, 1024, 1, 8192, 256, 256, 256, 1024]
    - [123, 11.352]
  - - [256, 2048, 1, 128, 256, 256, 256, 2048]
    - [37, 2.058]
  - - [256, 2048, 1, 256, 256, 256, 256, 2048]
    - [37, 3.571]
  - - [256, 2048, 1, 512, 256, 256, 256, 2048]
    - [50, 5.646]
  - - [256, 2048, 1, 1024, 256, 256, 256, 2048]
    - [126, 8.016]
  - - [256, 2048, 1, 2048, 256, 256, 256, 2048]
    - [35, 9.465]
  - - [256, 2048, 1, 4096, 256, 256, 256, 2048]
    - [112, 13.299]
  - - [256, 2048, 1, 8192, 256, 256, 256, 2048]
    - [44, 16.668]
  - - [256, 4096, 1, 128, 256, 256, 256, 4096]
    - [16, 3.419]
  - - [256, 4096, 1, 256, 256, 256, 256, 4096]
    - [34, 5.675]
  - - [256, 4096, 1, 512, 256, 256, 256, 4096]
    - [34, 8.655]
  - - [256, 4096, 1, 1024, 256, 256, 256, 4096]
    - [123, 11.965]
  - - [256, 4096, 1, 2048, 256, 256, 256, 4096]
    - [113, 14.164]
  - - [256, 4096, 1, 4096, 256, 256, 256, 4096]
    - [101, 16.768]
  - - [256, 4096, 1, 8192, 256, 256, 256, 4096]
    - [26, 18.931]
  - - [256, 8192, 1, 128, 256, 256, 256, 8192]
    - [76, 5.099]
  - - [256, 8192, 1, 256, 256, 256, 256, 8192]
    - [102, 8.517]
  - - [256, 8192, 1, 512, 256, 256, 256, 8192]
    - [102, 13.226]
  - - [256, 8192, 1, 1024, 256, 256, 256, 8192]
    - [118, 17.381]
  - - [256, 8192, 1, 2048, 256, 256, 256, 8192]
    - [77, 17.09]
  - - [256, 8192, 1, 4096, 256, 256, 256, 8192]
    - [105, 20.616]
  - - [256, 8192, 1, 8192, 256, 256, 256, 8192]
    - [9, 23.613]
  - - [512, 128, 1, 128, 512, 512, 512, 128]
    - [41, 0.314]
  - - [512, 128, 1, 256, 512, 512, 512, 128]
    - [40, 0.555]
  - - [512, 128, 1, 512, 512, 512, 512, 128]
    - [41, 0.896]
  - - [512, 128, 1, 1024, 512, 512, 512, 128]
    - [130, 1.295]
  - - [512, 128, 1, 2048, 512, 512, 512, 128]
    - [55, 2.019]
  - - [512, 128, 1, 4096, 512, 512, 512, 128]
    - [38, 3.177]
  - - [512, 128, 1, 8192, 512, 512, 512, 128]
    - [129, 4.595]
  - - [512, 256, 1, 128, 512, 512, 512, 256]
    - [17, 0.62]
  - - [512, 256, 1, 256, 512, 512, 512, 256]
    - [41, 1.082]
  - - [512, 256, 1, 512, 512, 512, 512, 256]
    - [41, 1.766]
  - - [512, 256, 1, 1024, 512, 512, 512, 256]
    - [55, 2.575]
  - - [512, 256, 1, 2048, 512, 512, 512, 256]
    - [52, 3.673]
  - - [512, 256, 1, 4096, 512, 512, 512, 256]
    - [115, 5.363]
  - - [512, 256, 1, 8192, 512, 512, 512, 256]
    - [50, 7.388]
  - - [512, 512, 1, 128, 512, 512, 512, 512]
    - [38, 1.143]
  - - [512, 512, 1, 256, 512, 512, 512, 512]
    - [39, 1.991]
  - - [512, 512, 1, 512, 512, 512, 512, 512]
    - [53, 3.21]
  - - [512, 512, 1, 1024, 512, 512, 512, 512]
    - [53, 4.722]
  - - [512, 512, 1, 2048, 512, 512, 512, 512]
    - [50, 6.23]
  - - [512, 512, 1, 4096, 512, 512, 512, 512]
    - [34, 8.584]
  - - [512, 512, 1, 8192, 512, 512, 512, 512]
    - [49, 11.256]
  - - [512, 1024, 1, 128, 512, 512, 512, 1024]
    - [37, 2.08]
  - - [512, 1024, 1, 256, 512, 512, 512, 1024]
    - [37, 3.569]
  - - [512, 1024, 1, 512, 512, 512, 512, 1024]
    - [50, 5.679]
  - - [512, 1024, 1, 1024, 512, 512, 512, 1024]
    - [50, 8.125]
  - - [512, 1024, 1, 2048, 512, 512, 512, 1024]
    - [123, 9.519]
  - - [512, 1024, 1, 4096, 512, 512, 512, 1024]
    - [102, 12.517]
  - - [512, 1024, 1, 8192, 512, 512, 512, 1024]
    - [45, 16.748]
  - - [512, 2048, 1, 128, 512, 512, 512, 2048]
    - [15, 3.371]
  - - [512, 2048, 1, 256, 512, 512, 512, 2048]
    - [34, 5.707]
  - - [512, 2048, 1, 512, 512, 512, 512, 2048]
    - [34, 8.721]
  - - [512, 2048, 1, 1024, 512, 512, 512, 2048]
    - [123, 11.952]
  - - [512, 2048, 1, 2048, 512, 512, 512, 2048]
    - [118, 14.004]
  - - [512, 2048, 1, 4096, 512, 512, 512, 2048]
    - [30, 15.978]
  - - [512, 2048, 1, 8192, 512, 512, 512, 2048]
    - [45, 17.85]
  - - [512, 4096, 1, 128, 512, 512, 512, 4096]
    - [12, 5.118]
  - - [512, 4096, 1, 256, 512, 512, 512, 4096]
    - [102, 8.593]
  - - [512, 4096, 1, 512, 512, 512, 512, 4096]
    - [102, 13.22]
  - - [512, 4096, 1, 1024, 512, 512, 512, 4096]
    - [118, 17.494]
  - - [512, 4096, 1, 2048, 512, 512, 512, 4096]
    - [111, 17.006]
  - - [512, 4096, 1, 4096, 512, 512, 512, 4096]
    - [25, 20.02]
  - - [512, 4096, 1, 8192, 512, 512, 512, 4096]
    - [7, 21.519]
  - - [512, 8192, 1, 128, 512, 512, 512, 8192]
    - [6, 7.424]
  - - [512, 8192, 1, 256, 512, 512, 512, 8192]
    - [6, 11.84]
  - - [512, 8192, 1, 512, 512, 512, 512, 8192]
    - [94, 16.151]
  - - [512, 8192, 1, 1024, 512, 512, 512, 8192]
    - [103, 17.624]
  - - [512, 8192, 1, 2048, 512, 512, 512, 8192]
    - [71, 21.194]
  - - [512, 8192, 1, 4096, 512, 512, 512, 8192]
    - [23, 24.306]
  - - [512, 8192, 1, 8192, 512, 512, 512, 8192]
    - [22, 26.935]
  - - [1024, 128, 1, 128, 1024, 1024, 1024, 128]
    - [17, 0.61]
  - - [1024, 128, 1, 256, 1024, 1024, 1024, 128]
    - [41, 1.084]
  - - [1024, 128, 1, 512, 1024, 1024, 1024, 128]
    - [41, 1.769]
  - - [1024, 128, 1, 1024, 1024, 1024, 1024, 128]
    - [54, 2.554]
  - - [1024, 128, 1, 2048, 1024, 1024, 1024, 128]
    - [52, 3.64]
  - - [1024, 128, 1, 4096, 1024, 1024, 1024, 128]
    - [37, 5.358]
  - - [1024, 128, 1, 8192, 1024, 1024, 1024, 128]
    - [50, 7.291]
  - - [1024, 256, 1, 128, 1024, 1024, 1024, 256]
    - [39, 1.162]
  - - [1024, 256, 1, 256, 1024, 1024, 1024, 256]
    - [39, 1.997]
  - - [1024, 256, 1, 512, 1024, 1024, 1024, 256]
    - [53, 3.223]
  - - [1024, 256, 1, 1024, 1024, 1024, 1024, 256]
    - [53, 4.698]
  - - [1024, 256, 1, 2048, 1024, 1024, 1024, 256]
    - [50, 6.227]
  - - [1024, 256, 1, 4096, 1024, 1024, 1024, 256]
    - [34, 8.457]
  - - [1024, 256, 1, 8192, 1024, 1024, 1024, 256]
    - [125, 11.102]
  - - [1024, 512, 1, 128, 1024, 1024, 1024, 512]
    - [37, 2.058]
  - - [1024, 512, 1, 256, 1024, 1024, 1024, 512]
    - [37, 3.583]
  - - [1024, 512, 1, 512, 1024, 1024, 1024, 512]
    - [50, 5.643]
  - - [1024, 512, 1, 1024, 1024, 1024, 1024, 512]
    - [50, 8.115]
  - - [1024, 512, 1, 2048, 1024, 1024, 1024, 512]
    - [47, 9.415]
  - - [1024, 512, 1, 4096, 1024, 1024, 1024, 512]
    - [107, 12.619]
  - - [1024, 512, 1, 8192, 1024, 1024, 1024, 512]
    - [120, 16.954]
  - - [1024, 1024, 1, 128, 1024, 1024, 1024, 1024]
    - [16, 3.419]
  - - [1024, 1024, 1, 256, 1024, 1024, 1024, 1024]
    - [34, 5.698]
  - - [1024, 1024, 1, 512, 1024, 1024, 1024, 1024]
    - [34, 8.722]
  - - [1024, 1024, 1, 1024, 1024, 1024, 1024, 1024]
    - [46, 11.866]
  - - [1024, 1024, 1, 2048, 1024, 1024, 1024, 1024]
    - [122, 14.112]
  - - [1024, 1024, 1, 4096, 1024, 1024, 1024, 1024]
    - [29, 15.591]
  - - [1024, 1024, 1, 8192, 1024, 1024, 1024, 1024]
    - [44, 17.672]
  - - [1024, 2048, 1, 128, 1024, 1024, 1024, 2048]
    - [28, 5.106]
  - - [1024, 2048, 1, 256, 1024, 1024, 1024, 2048]
    - [102, 8.507]
  - - [1024, 2048, 1, 512, 1024, 1024, 1024, 2048]
    - [102, 13.187]
  - - [1024, 2048, 1, 1024, 1024, 1024, 1024, 2048]
    - [43, 16.912]
  - - [1024, 2048, 1, 2048, 1024, 1024, 1024, 2048]
    - [110, 15.828]
  - - [1024, 2048, 1, 4096, 1024, 1024, 1024, 2048]
    - [25, 19.269]
  - - [1024, 2048, 1, 8192, 1024, 1024, 1024, 2048]
    - [8, 21.025]
  - - [1024, 4096, 1, 128, 1024, 1024, 1024, 4096]
    - [75, 7.448]
  - - [1024, 4096, 1, 256, 1024, 1024, 1024, 4096]
    - [75, 11.789]
  - - [1024, 4096, 1, 512, 1024, 1024, 1024, 4096]
    - [94, 16.219]
  - - [1024, 4096, 1, 1024, 1024, 1024, 1024, 4096]
    - [103, 17.491]
  - - [1024, 4096, 1, 2048, 1024, 1024, 1024, 4096]
    - [102, 20.072]
  - - [1024, 4096, 1, 4096, 1024, 1024, 1024, 4096]
    - [8, 22.354]
  - - [1024, 4096, 1, 8192, 1024, 1024, 1024, 4096]
    - [2, 25.082]
  - - [1024, 8192, 1, 128, 1024, 1024, 1024, 8192]
    - [64, 8.615]
  - - [1024, 8192, 1, 256, 1024, 1024, 1024, 8192]
    - [64, 13.821]
  - - [1024, 8192, 1, 512, 1024, 1024, 1024, 8192]
    - [20, 18.5]
  - - [1024, 8192, 1, 1024, 1024, 1024, 1024, 8192]
    - [118, 21.187]
  - - [1024, 8192, 1, 2048, 1024, 1024, 1024, 8192]
    - [97, 23.311]
  - - [1024, 8192, 1, 4096, 1024, 1024, 1024, 8192]
    - [2, 25.665]
  - - [1024, 8192, 1, 8192, 1024, 1024, 1024, 8192]
    - [2, 29.685]
  - - [2048, 128, 1, 128, 2048, 2048, 2048, 128]
    - [39, 1.163]
  - - [2048, 128, 1, 256, 2048, 2048, 2048, 128]
    - [39, 2.015]
  - - [2048, 128, 1, 512, 2048, 2048, 2048, 128]
    - [53, 3.199]
  - - [2048, 128, 1, 1024, 2048, 2048, 2048, 128]
    - [53, 4.742]
  - - [2048, 128, 1, 2048, 2048, 2048, 2048, 128]
    - [51, 5.883]
  - - [2048, 128, 1, 4096, 2048, 2048, 2048, 128]
    - [127, 8.26]
  - - [2048, 128, 1, 8192, 2048, 2048, 2048, 128]
    - [113, 11.217]
  - - [2048, 256, 1, 128, 2048, 2048, 2048, 256]
    - [36, 2.061]
  - - [2048, 256, 1, 256, 2048, 2048, 2048, 256]
    - [37, 3.603]
  - - [2048, 256, 1, 512, 2048, 2048, 2048, 256]
    - [50, 5.643]
  - - [2048, 256, 1, 1024, 2048, 2048, 2048, 256]
    - [50, 8.082]
  - - [2048, 256, 1, 2048, 2048, 2048, 2048, 256]
    - [37, 9.323]
  - - [2048, 256, 1, 4096, 2048, 2048, 2048, 256]
    - [107, 12.536]
  - - [2048, 256, 1, 8192, 2048, 2048, 2048, 256]
    - [122, 16.813]
  - - [2048, 512, 1, 128, 2048, 2048, 2048, 512]
    - [16, 3.391]
  - - [2048, 512, 1, 256, 2048, 2048, 2048, 512]
    - [34, 5.665]
  - - [2048, 512, 1, 512, 2048, 2048, 2048, 512]
    - [34, 8.615]
  - - [2048, 512, 1, 1024, 2048, 2048, 2048, 512]
    - [46, 11.83]
  - - [2048, 512, 1, 2048, 2048, 2048, 2048, 512]
    - [120, 14.104]
  - - [2048, 512, 1, 4096, 2048, 2048, 2048, 512]
    - [28, 15.885]
  - - [2048, 512, 1, 8192, 2048, 2048, 2048, 512]
    - [93, 17.321]
  - - [2048, 1024, 1, 128, 2048, 2048, 2048, 1024]
    - [12, 5.092]
  - - [2048, 1024, 1, 256, 2048, 2048, 2048, 1024]
    - [31, 8.542]
  - - [2048, 1024, 1, 512, 2048, 2048, 2048, 1024]
    - [102, 12.926]
  - - [2048, 1024, 1, 1024, 2048, 2048, 2048, 1024]
    - [120, 16.677]
  - - [2048, 1024, 1, 2048, 2048, 2048, 2048, 1024]
    - [121, 15.769]
  - - [2048, 1024, 1, 4096, 2048, 2048, 2048, 1024]
    - [24, 18.787]
  - - [2048, 1024, 1, 8192, 2048, 2048, 2048, 1024]
    - [3, 21.168]
  - - [2048, 2048, 1, 128, 2048, 2048, 2048, 2048]
    - [70, 7.34]
  - - [2048, 2048, 1, 256, 2048, 2048, 2048, 2048]
    - [70, 11.692]
  - - [2048, 2048, 1, 512, 2048, 2048, 2048, 2048]
    - [95, 15.752]
  - - [2048, 2048, 1, 1024, 2048, 2048, 2048, 2048]
    - [109, 17.454]
  - - [2048, 2048, 1, 2048, 2048, 2048, 2048, 2048]
    - [122, 20.376]
  - - [2048, 2048, 1, 4096, 2048, 2048, 2048, 2048]
    - [67, 21.642]
  - - [2048, 2048, 1, 8192, 2048, 2048, 2048, 2048]
    - [21, 24.788]
  - - [2048, 4096, 1, 128, 2048, 2048, 2048, 4096]
    - [62, 8.67]
  - - [2048, 4096, 1, 256, 2048, 2048, 2048, 4096]
    - [62, 13.834]
  - - [2048, 4096, 1, 512, 2048, 2048, 2048, 4096]
    - [85, 18.236]
  - - [2048, 4096, 1, 1024, 2048, 2048, 2048, 4096]
    - [102, 20.291]
  - - [2048, 4096, 1, 2048, 2048, 2048, 2048, 4096]
    - [90, 22.902]
  - - [2048, 4096, 1, 4096, 2048, 2048, 2048, 4096]
    - [61, 24.912]
  - - [2048, 4096, 1, 8192, 2048, 2048, 2048, 4096]
    - [81, 28.124]
  - - [2048, 8192, 1, 128, 2048, 2048, 2048, 8192]
    - [118, 8.854]
  - - [2048, 8192, 1, 256, 2048, 2048, 2048, 8192]
    - [104, 13.604]
  - - [2048, 8192, 1, 512, 2048, 2048, 2048, 8192]
    - [68, 19.068]
  - - [2048, 8192, 1, 1024, 2048, 2048, 2048, 8192]
    - [68, 21.788]
  - - [2048, 8192, 1, 2048, 2048, 2048, 2048, 8192]
    - [67, 25.399]
  - - [2048, 8192, 1, 4096, 2048, 2048, 2048, 8192]
    - [67, 29.046]
  - - [2048, 8192, 1, 8192, 2048, 2048, 2048, 8192]
    - [1, 30.558]
  - - [4096, 128, 1, 128, 4096, 4096, 4096, 128]
    - [37, 2.065]
  - - [4096, 128, 1, 256, 4096, 4096, 4096, 128]
    - [37, 3.579]
  - - [4096, 128, 1, 512, 4096, 4096, 4096, 128]
    - [50, 5.64]
  - - [4096, 128, 1, 1024, 4096, 4096, 4096, 128]
    - [127, 7.93]
  - - [4096, 128, 1, 2048, 4096, 4096, 4096, 128]
    - [36, 9.846]
  - - [4096, 128, 1, 4096, 4096, 4096, 4096, 128]
    - [113, 12.701]
  - - [4096, 128, 1, 8192, 4096, 4096, 4096, 128]
    - [45, 16.372]
  - - [4096, 256, 1, 128, 4096, 4096, 4096, 256]
    - [16, 3.429]
  - - [4096, 256, 1, 256, 4096, 4096, 4096, 256]
    - [34, 5.724]
  - - [4096, 256, 1, 512, 4096, 4096, 4096, 256]
    - [112, 8.651]
  - - [4096, 256, 1, 1024, 4096, 4096, 4096, 256]
    - [124, 11.849]
  - - [4096, 256, 1, 2048, 4096, 4096, 4096, 256]
    - [120, 13.847]
  - - [4096, 256, 1, 4096, 4096, 4096, 4096, 256]
    - [106, 17.188]
  - - [4096, 256, 1, 8192, 4096, 4096, 4096, 256]
    - [122, 18.247]
  - - [4096, 512, 1, 128, 4096, 4096, 4096, 512]
    - [11, 5.124]
  - - [4096, 512, 1, 256, 4096, 4096, 4096, 512]
    - [102, 8.556]
  - - [4096, 512, 1, 512, 4096, 4096, 4096, 512]
    - [107, 13.042]
  - - [4096, 512, 1, 1024, 4096, 4096, 4096, 512]
    - [122, 17.164]
  - - [4096, 512, 1, 2048, 4096, 4096, 4096, 512]
    - [10, 16.869]
  - - [4096, 512, 1, 4096, 4096, 4096, 4096, 512]
    - [98, 19.599]
  - - [4096, 512, 1, 8192, 4096, 4096, 4096, 512]
    - [4, 21.449]
  - - [4096, 1024, 1, 128, 4096, 4096, 4096, 1024]
    - [74, 7.374]
  - - [4096, 1024, 1, 256, 4096, 4096, 4096, 1024]
    - [74, 11.882]
  - - [4096, 1024, 1, 512, 4096, 4096, 4096, 1024]
    - [100, 15.942]
  - - [4096, 1024, 1, 1024, 4096, 4096, 4096, 1024]
    - [106, 17.459]
  - - [4096, 1024, 1, 2048, 4096, 4096, 4096, 1024]
    - [104, 20.151]
  - - [4096, 1024, 1, 4096, 4096, 4096, 4096, 1024]
    - [67, 22.37]
  - - [4096, 1024, 1, 8192, 4096, 4096, 4096, 1024]
    - [57, 25.286]
  - - [4096, 2048, 1, 128, 4096, 4096, 4096, 2048]
    - [60, 8.537]
  - - [4096, 2048, 1, 256, 4096, 4096, 4096, 2048]
    - [60, 13.645]
  - - [4096, 2048, 1, 512, 4096, 4096, 4096, 2048]
    - [88, 18.494]
  - - [4096, 2048, 1, 1024, 4096, 4096, 4096, 2048]
    - [67, 20.306]
  - - [4096, 2048, 1, 2048, 4096, 4096, 4096, 2048]
    - [66, 23.488]
  - - [4096, 2048, 1, 4096, 4096, 4096, 4096, 2048]
    - [2, 25.186]
  - - [4096, 2048, 1, 8192, 4096, 4096, 4096, 2048]
    - [58, 28.678]
  - - [4096, 4096, 1, 128, 4096, 4096, 4096, 4096]
    - [45, 8.875]
  - - [4096, 4096, 1, 256, 4096, 4096, 4096, 4096]
    - [108, 13.181]
  - - [4096, 4096, 1, 512, 4096, 4096, 4096, 4096]
    - [104, 18.64]
  - - [4096, 4096, 1, 1024, 4096, 4096, 4096, 4096]
    - [58, 22.013]
  - - [4096, 4096, 1, 2048, 4096, 4096, 4096, 4096]
    - [65, 25.483]
  - - [4096, 4096, 1, 4096, 4096, 4096, 4096, 4096]
    - [81, 29.553]
  - - [4096, 4096, 1, 8192, 4096, 4096, 4096, 4096]
    - [58, 31.41]
  - - [4096, 8192, 1, 128, 4096, 4096, 4096, 8192]
    - [102, 9.856]
  - - [4096, 8192, 1, 256, 4096, 4096, 4096, 8192]
    - [73, 14.468]
  - - [4096, 8192, 1, 512, 4096, 4096, 4096, 8192]
    - [65, 19.364]
  - - [4096, 8192, 1, 1024, 4096, 4096, 4096, 8192]
    - [86, 24.523]
  - - [4096, 8192, 1, 2048, 4096, 4096, 4096, 8192]
    - [87, 29.629]
  - - [4096, 8192, 1, 4096, 4096, 4096, 4096, 8192]
    - [88, 33.457]
  - - [4096, 8192, 1, 8192, 4096, 4096, 4096, 8192]
    - [59, 35.188]
  - - [8192, 128, 1, 128, 8192, 8192, 8192, 128]
    - [16, 3.424]
  - - [8192, 128, 1, 256, 8192, 8192, 8192, 128]
    - [112, 5.696]
  - - [8192, 128, 1, 512, 8192, 8192, 8192, 128]
    - [112, 8.481]
  - - [8192, 128, 1, 1024, 8192, 8192, 8192, 128]
    - [124, 10.976]
  - - [8192, 128, 1, 2048, 8192, 8192, 8192, 128]
    - [32, 13.304]
  - - [8192, 128, 1, 4096, 8192, 8192, 8192, 128]
    - [27, 16.682]
  - - [8192, 128, 1, 8192, 8192, 8192, 8192, 128]
    - [14, 19.515]
  - - [8192, 256, 1, 128, 8192, 8192, 8192, 256]
    - [13, 5.051]
  - - [8192, 256, 1, 256, 8192, 8192, 8192, 256]
    - [104, 8.525]
  - - [8192, 256, 1, 512, 8192, 8192, 8192, 256]
    - [31, 12.912]
  - - [8192, 256, 1, 1024, 8192, 8192, 8192, 256]
    - [120, 17.011]
  - - [8192, 256, 1, 2048, 8192, 8192, 8192, 256]
    - [28, 17.352]
  - - [8192, 256, 1, 4096, 8192, 8192, 8192, 256]
    - [102, 20.427]
  - - [8192, 256, 1, 8192, 8192, 8192, 8192, 256]
    - [3, 23.635]
  - - [8192, 512, 1, 128, 8192, 8192, 8192, 512]
    - [74, 7.175]
  - - [8192, 512, 1, 256, 8192, 8192, 8192, 512]
    - [72, 11.594]
  - - [8192, 512, 1, 512, 8192, 8192, 8192, 512]
    - [96, 15.936]
  - - [8192, 512, 1, 1024, 8192, 8192, 8192, 512]
    - [78, 17.37]
  - - [8192, 512, 1, 2048, 8192, 8192, 8192, 512]
    - [107, 21.118]
  - - [8192, 512, 1, 4096, 8192, 8192, 8192, 512]
    - [67, 24.425]
  - - [8192, 512, 1, 8192, 8192, 8192, 8192, 512]
    - [89, 25.404]
  - - [8192, 1024, 1, 128, 8192, 8192, 8192, 1024]
    - [60, 8.446]
  - - [8192, 1024, 1, 256, 8192, 8192, 8192, 1024]
    - [63, 13.343]
  - - [8192, 1024, 1, 512, 8192, 8192, 8192, 1024]
    - [88, 18.166]
  - - [8192, 1024, 1, 1024, 8192, 8192, 8192, 1024]
    - [92, 20.674]
  - - [8192, 1024, 1, 2048, 8192, 8192, 8192, 1024]
    - [91, 23.597]
  - - [8192, 1024, 1, 4096, 8192, 8192, 8192, 1024]
    - [82, 26.052]
  - - [8192, 1024, 1, 8192, 8192, 8192, 8192, 1024]
    - [81, 28.858]
  - - [8192, 2048, 1, 128, 8192, 8192, 8192, 2048]
    - [102, 8.451]
  - - [8192, 2048, 1, 256, 8192, 8192, 8192, 2048]
    - [104, 13.17]
  - - [8192, 2048, 1, 512, 8192, 8192, 8192, 2048]
    - [99, 18.215]
  - - [8192, 2048, 1, 1024, 8192, 8192, 8192, 2048]
    - [67, 22.196]
  - - [8192, 2048, 1, 2048, 8192, 8192, 8192, 2048]
    - [84, 26.067]
  - - [8192, 2048, 1, 4096, 8192, 8192, 8192, 2048]
    - [83, 30.365]
  - - [8192, 2048, 1, 8192, 8192, 8192, 8192, 2048]
    - [84, 31.868]
  - - [8192, 4096, 1, 128, 8192, 8192, 8192, 4096]
    - [69, 9.697]
  - - [8192, 4096, 1, 256, 8192, 8192, 8192, 4096]
    - [3, 14.419]
  - - [8192, 4096, 1, 512, 8192, 8192, 8192, 4096]
    - [71, 18.972]
  - - [8192, 4096, 1, 1024, 8192, 8192, 8192, 4096]
    - [88, 24.317]
  - - [8192, 4096, 1, 2048, 8192, 8192, 8192, 4096]
    - [58, 30.201]
  - - [8192, 4096, 1, 4096, 8192, 8192, 8192, 4096]
    - [83, 34.026]
  - - [8192, 4096, 1, 8192, 8192, 8192, 8192, 4096]
    - [19, 35.74]
  - - [8192, 8192, 1, 128, 8192, 8192, 8192, 8192]
    - [5, 9.587]
  - - [8192, 8192, 1, 256, 8192, 8192, 8192, 8192]
    - [97, 14.044]
  - - [8192, 8192, 1, 512, 8192, 8192, 8192, 8192]
    - [58, 20.199]
  - - [8192, 8192, 1, 1024, 8192, 8192, 8192, 8192]
    - [0, 26.049]
  - - [8192, 8192, 1, 2048, 8192, 8192, 8192, 8192]
    - [18, 31.914]
  - - [8192, 8192, 1, 4096, 8192, 8192, 8192, 8192]
    - [18, 35.332]
  - - [8192, 8192, 1, 8192, 8192, 8192, 8192, 8192]
    - [58, 38.204]
  - - [1, 1, 1, 32, 1, 1, 1, 1]
    - [131, 0.0]
- null
- null
- ExperimentalStreamK
- GridBased
