library/src/amd_detail/rocblaslt/src/Tensile/Logic/asm_full/aquavanjaram/gfx942_228cu/StreamK/aquavanjaram942_Cijk_Ailk_Bljk_HHS_BH_UserArgs.yaml
- {MinimumRequiredVersion: 4.33.0}
- aquavanjaram942
- {Architecture: gfx942, CUCount: 228}
- [Device 0049, Device 0050]
    SolutionIndex: 0
    SolutionNameMin: Cijk_Ailk_Bljk_HHS_BH_UserArgs_MT256x256x32_MI16x16x1_SN_LDSB1_CLR1_GSU0_GSUC0_GSUWGMRR0_K1_LBSPPA2048_LBSPPB128_LPA0_MIWT8_8_PLR1_SU32_SUM0_SUS256_SKXCCM0_VWA4_VWB1_WGM1_WGMXCC1_WGMXCCGn1
    SolutionIndex: 1
    SolutionNameMin: Cijk_Ailk_Bljk_HHS_BH_UserArgs_MT256x256x32_MI16x16x1_SN_LDSB1_CLR1_GSU0_GSUC0_GSUWGMRR0_K1_LBSPPA2048_LBSPPB128_LPA0_MIWT8_8_PLR1_SU32_SUM0_SUS256_SKXCCM0_VWA4_VWB2_WGM1_WGMXCC1_WGMXCCGn1
    SolutionIndex: 2
    SolutionNameMin: Cijk_Ailk_Bljk_HHS_BH_UserArgs_MT256x128x32_MI16x16x1_SN_LDSB1_CLR1_GSU0_GSUC0_GSUWGMRR0_K1_LBSPPA2048_LBSPPB256_LPA0_MIWT8_4_PLR1_SU32_SUM0_SUS256_SKXCCM0_VWA8_VWB4_WGM4_WGMXCC1_WGMXCCGn1
    SolutionIndex: 3
    SolutionNameMin: Cijk_Ailk_Bljk_HHS_BH_UserArgs_MT256x128x32_MI16x16x1_SN_LDSB1_CLR1_GSU0_GSUC0_GSUWGMRR0_K1_LBSPPA2048_LBSPPB128_LPA0_MIWT8_4_PLR1_SU32_SUM0_SUS256_SKXCCM0_VWA4_VWB2_WGM8_WGMXCC1_WGMXCCGn1
    SolutionIndex: 4
    SolutionNameMin: Cijk_Ailk_Bljk_HHS_BH_UserArgs_MT256x128x32_MI16x16x1_SN_LDSB1_CLR1_GSU0_GSUC0_GSUWGMRR0_K1_LBSPPA2048_LBSPPB256_LPA0_MIWT8_4_PLR1_SU32_SUM0_SUS256_SKXCCM0_VWA8_VWB4_WGM8_WGMXCC1_WGMXCCGn1
    SolutionIndex: 5
    SolutionNameMin: Cijk_Ailk_Bljk_HHS_BH_UserArgs_MT128x64x32_MI16x16x1_SN_LDSB0_CLR1_GSU0_GSUC0_GSUWGMRR0_K1_LBSPPA1024_LBSPPB128_LPA0_MIWT4_2_PLR1_SU32_SUM0_SUS256_SKXCCM0_VWA4_VWB1_WGM1_WGMXCC1_WGMXCCGn1
    SolutionIndex: 6
    SolutionNameMin: Cijk_Ailk_Bljk_HHS_BH_UserArgs_MT128x64x32_MI16x16x1_SN_LDSB0_CLR1_GSU0_GSUC0_GSUWGMRR0_K1_LBSPPA1024_LBSPPB128_LPA0_MIWT4_2_PLR1_SU32_SUM0_SUS256_SKXCCM0_VWA4_VWB2_WGM1_WGMXCC1_WGMXCCGn1
    SolutionIndex: 7
    SolutionNameMin: Cijk_Ailk_Bljk_HHS_BH_UserArgs_MT64x64x32_MI16x16x1_SN_LDSB0_CLR1_GSU0_GSUC0_GSUWGMRR0_K1_LBSPPA512_LBSPPB128_LPA32_MIWT2_2_PLR1_SU32_SUM0_SUS256_SKXCCM0_VWA2_VWB2_WGM1_WGMXCC1_WGMXCCGn1
    SolutionIndex: 8
    SolutionNameMin: Cijk_Ailk_Bljk_HHS_BH_UserArgs_MT32x32x32_MI16x16x1_SN_LDSB0_CLR1_GSU0_GSUC0_GSUWGMRR0_K1_LBSPPA256_LBSPPB128_LPA16_MIWT1_1_PLR1_SU32_SUM0_SUS256_SKXCCM0_VWA1_VWB1_WGM4_WGMXCC1_WGMXCCGn1
    SolutionIndex: 9
    SolutionNameMin: Cijk_Ailk_Bljk_HHS_BH_UserArgs_MT128x256x64_MI16x16x1_SN_LDSB1_CLR1_GSU0_GSUC0_GSUWGMRR0_K1_LBSPPA2048_LBSPPB128_LPA32_MIWT4_8_PLR1_SU32_SUM0_SUS256_SKXCCM0_VWA2_VWB1_WGM1_WGMXCC1_WGMXCCGn1
    SolutionIndex: 10
    SolutionNameMin: Cijk_Ailk_Bljk_HHS_BH_UserArgs_MT128x256x64_MI16x16x1_SN_LDSB1_CLR1_GSU0_GSUC0_GSUWGMRR0_K1_LBSPPA2048_LBSPPB256_LPA0_MIWT4_8_PLR1_SU32_SUM0_SUS256_SKXCCM0_VWA4_VWB2_WGM1_WGMXCC1_WGMXCCGn1
    SolutionIndex: 11
    SolutionNameMin: Cijk_Ailk_Bljk_HHS_BH_UserArgs_MT128x256x64_MI16x16x1_SN_LDSB1_CLR1_GSU0_GSUC0_GSUWGMRR0_K1_LBSPPA2048_LBSPPB1024_LPA0_MIWT4_8_PLR1_SU32_SUM0_SUS256_SKXCCM0_VWA4_VWB8_WGM1_WGMXCC1_WGMXCCGn1
    SolutionIndex: 12
    SolutionNameMin: Cijk_Ailk_Bljk_HHS_BH_UserArgs_MT128x256x64_MI16x16x1_SN_LDSB1_CLR1_GSU0_GSUC0_GSUWGMRR0_K1_LBSPPA2048_LBSPPB128_LPA0_MIWT4_8_PLR1_SU32_SUM0_SUS256_SKXCCM0_VWA4_VWB1_WGM8_WGMXCC1_WGMXCCGn1
    SolutionIndex: 13
    SolutionNameMin: Cijk_Ailk_Bljk_HHS_BH_UserArgs_MT256x128x64_MI16x16x1_SN_LDSB1_CLR1_GSU0_GSUC0_GSUWGMRR0_K1_LBSPPA4096_LBSPPB128_LPA0_MIWT8_4_PLR1_SU32_SUM0_SUS256_SKXCCM0_VWA4_VWB1_WGM1_WGMXCC1_WGMXCCGn1
    SolutionIndex: 14
    SolutionNameMin: Cijk_Ailk_Bljk_HHS_BH_UserArgs_MT256x128x64_MI16x16x1_SN_LDSB1_CLR1_GSU0_GSUC0_GSUWGMRR0_K1_LBSPPA4096_LBSPPB512_LPA32_MIWT8_4_PLR1_SU32_SUM0_SUS256_SKXCCM0_VWA2_VWB4_WGM1_WGMXCC1_WGMXCCGn1
    SolutionIndex: 15
    SolutionNameMin: Cijk_Ailk_Bljk_HHS_BH_UserArgs_MT256x128x64_MI16x16x1_SN_LDSB1_CLR1_GSU0_GSUC0_GSUWGMRR0_K1_LBSPPA4096_LBSPPB128_LPA0_MIWT8_4_PLR1_SU32_SUM0_SUS256_SKXCCM0_VWA4_VWB1_WGM4_WGMXCC1_WGMXCCGn1
    SolutionIndex: 16
    SolutionNameMin: Cijk_Ailk_Bljk_HHS_BH_UserArgs_MT256x128x64_MI16x16x1_SN_LDSB1_CLR1_GSU0_GSUC0_GSUWGMRR0_K1_LBSPPA4096_LBSPPB128_LPA0_MIWT8_4_PLR1_SU32_SUM0_SUS256_SKXCCM0_VWA8_VWB1_WGM4_WGMXCC1_WGMXCCGn1
    SolutionIndex: 17
    SolutionNameMin: Cijk_Ailk_Bljk_HHS_BH_UserArgs_MT256x128x64_MI16x16x1_SN_LDSB1_CLR1_GSU0_GSUC0_GSUWGMRR0_K1_LBSPPA4096_LBSPPB256_LPA0_MIWT8_4_PLR1_SU32_SUM0_SUS256_SKXCCM0_VWA4_VWB2_WGM4_WGMXCC1_WGMXCCGn1
    SolutionIndex: 18
    SolutionNameMin: Cijk_Ailk_Bljk_HHS_BH_UserArgs_MT256x128x64_MI16x16x1_SN_LDSB1_CLR1_GSU0_GSUC0_GSUWGMRR0_K1_LBSPPA4096_LBSPPB512_LPA32_MIWT8_4_PLR1_SU32_SUM0_SUS256_SKXCCM0_VWA2_VWB4_WGM4_WGMXCC1_WGMXCCGn1
    SolutionIndex: 19
    SolutionNameMin: Cijk_Ailk_Bljk_HHS_BH_UserArgs_MT256x128x64_MI16x16x1_SN_LDSB1_CLR1_GSU0_GSUC0_GSUWGMRR0_K1_LBSPPA4096_LBSPPB256_LPA0_MIWT8_4_PLR1_SU32_SUM0_SUS256_SKXCCM0_VWA4_VWB2_WGM8_WGMXCC1_WGMXCCGn1
    SolutionIndex: 20
    SolutionNameMin: Cijk_Ailk_Bljk_HHS_BH_UserArgs_MT256x128x64_MI16x16x1_SN_LDSB1_CLR1_GSU0_GSUC0_GSUWGMRR0_K1_LBSPPA4096_LBSPPB512_LPA0_MIWT8_4_PLR1_SU32_SUM0_SUS256_SKXCCM0_VWA4_VWB4_WGM8_WGMXCC1_WGMXCCGn1
    SolutionIndex: 21
    SolutionNameMin: Cijk_Ailk_Bljk_HHS_BH_UserArgs_MT64x256x64_MI16x16x1_SN_LDSB1_CLR1_GSU0_GSUC0_GSUWGMRR0_K1_LBSPPA1024_LBSPPB256_LPA32_MIWT2_8_PLR1_SU32_SUM0_SUS256_SKXCCM0_VWA2_VWB2_WGM1_WGMXCC1_WGMXCCGn1
    SolutionIndex: 22
    SolutionNameMin: Cijk_Ailk_Bljk_HHS_BH_UserArgs_MT256x64x64_MI16x16x1_SN_LDSB1_CLR1_GSU0_GSUC0_GSUWGMRR0_K1_LBSPPA4096_LBSPPB128_LPA0_MIWT8_2_PLR1_SU32_SUM0_SUS256_SKXCCM0_VWA4_VWB1_WGM1_WGMXCC1_WGMXCCGn1
    SolutionIndex: 23
    SolutionNameMin: Cijk_Ailk_Bljk_HHS_BH_UserArgs_MT256x64x64_MI16x16x1_SN_LDSB1_CLR1_GSU0_GSUC0_GSUWGMRR0_K1_LBSPPA4096_LBSPPB128_LPA0_MIWT8_2_PLR1_SU32_SUM0_SUS256_SKXCCM0_VWA4_VWB1_WGM4_WGMXCC1_WGMXCCGn1
    SolutionIndex: 24
    SolutionNameMin: Cijk_Ailk_Bljk_HHS_BH_UserArgs_MT128x128x64_MI16x16x1_SN_LDSB1_CLR1_GSU0_GSUC0_GSUWGMRR0_K1_LBSPPA2048_LBSPPB128_LPA0_MIWT4_4_PLR1_SU32_SUM0_SUS256_SKXCCM0_VWA4_VWB1_WGM1_WGMXCC1_WGMXCCGn1
    SolutionIndex: 25
    SolutionNameMin: Cijk_Ailk_Bljk_HHS_BH_UserArgs_MT128x128x64_MI16x16x1_SN_LDSB1_CLR1_GSU0_GSUC0_GSUWGMRR0_K1_LBSPPA2048_LBSPPB256_LPA32_MIWT4_4_PLR1_SU32_SUM0_SUS256_SKXCCM0_VWA2_VWB2_WGM1_WGMXCC1_WGMXCCGn1
    SolutionIndex: 26
    SolutionNameMin: Cijk_Ailk_Bljk_HHS_BH_UserArgs_MT128x128x64_MI16x16x1_SN_LDSB1_CLR1_GSU0_GSUC0_GSUWGMRR0_K1_LBSPPA2048_LBSPPB256_LPA0_MIWT4_4_PLR1_SU32_SUM0_SUS256_SKXCCM0_VWA4_VWB2_WGM1_WGMXCC1_WGMXCCGn1
    SolutionIndex: 27
    SolutionNameMin: Cijk_Ailk_Bljk_HHS_BH_UserArgs_MT128x128x64_MI16x16x1_SN_LDSB1_CLR1_GSU0_GSUC0_GSUWGMRR0_K1_LBSPPA2048_LBSPPB512_LPA32_MIWT4_4_PLR1_SU32_SUM0_SUS256_SKXCCM0_VWA2_VWB4_WGM1_WGMXCC1_WGMXCCGn1
    SolutionIndex: 28
    SolutionNameMin: Cijk_Ailk_Bljk_HHS_BH_UserArgs_MT128x128x64_MI16x16x1_SN_LDSB1_CLR1_GSU0_GSUC0_GSUWGMRR0_K1_LBSPPA2048_LBSPPB256_LPA0_MIWT4_4_PLR2_SU32_SUM0_SUS256_SKXCCM0_VWA4_VWB2_WGM1_WGMXCC1_WGMXCCGn1
    SolutionIndex: 29
    SolutionNameMin: Cijk_Ailk_Bljk_HHS_BH_UserArgs_MT128x128x64_MI16x16x1_SN_LDSB1_CLR1_GSU0_GSUC0_GSUWGMRR0_K1_LBSPPA2048_LBSPPB512_LPA0_MIWT4_4_PLR2_SU32_SUM0_SUS256_SKXCCM0_VWA4_VWB4_WGM4_WGMXCC1_WGMXCCGn1
    SolutionIndex: 30
    SolutionNameMin: Cijk_Ailk_Bljk_HHS_BH_UserArgs_MT128x128x64_MI16x16x1_SN_LDSB1_CLR1_GSU0_GSUC0_GSUWGMRR0_K1_LBSPPA2048_LBSPPB128_LPA32_MIWT4_4_PLR1_SU32_SUM0_SUS256_SKXCCM0_VWA2_VWB1_WGM8_WGMXCC1_WGMXCCGn1
    SolutionIndex: 31
    SolutionNameMin: Cijk_Ailk_Bljk_HHS_BH_UserArgs_MT128x128x64_MI16x16x1_SN_LDSB1_CLR1_GSU0_GSUC0_GSUWGMRR0_K1_LBSPPA2048_LBSPPB512_LPA0_MIWT4_4_PLR1_SU32_SUM0_SUS256_SKXCCM0_VWA4_VWB4_WGM8_WGMXCC1_WGMXCCGn1
    SolutionIndex: 32
    SolutionNameMin: Cijk_Ailk_Bljk_HHS_BH_UserArgs_MT64x128x64_MI16x16x1_SN_LDSB1_CLR1_GSU0_GSUC0_GSUWGMRR0_K1_LBSPPA1024_LBSPPB256_LPA32_MIWT2_4_PLR1_SU32_SUM0_SUS256_SKXCCM0_VWA2_VWB2_WGM1_WGMXCC1_WGMXCCGn1
    SolutionIndex: 33
    SolutionNameMin: Cijk_Ailk_Bljk_HHS_BH_UserArgs_MT64x128x64_MI16x16x1_SN_LDSB1_CLR1_GSU0_GSUC0_GSUWGMRR0_K1_LBSPPA1024_LBSPPB128_LPA32_MIWT2_4_PLR2_SU32_SUM0_SUS256_SKXCCM0_VWA2_VWB1_WGM1_WGMXCC1_WGMXCCGn1
    SolutionIndex: 34
    SolutionNameMin: Cijk_Ailk_Bljk_HHS_BH_UserArgs_MT64x128x64_MI16x16x1_SN_LDSB1_CLR1_GSU0_GSUC0_GSUWGMRR0_K1_LBSPPA1024_LBSPPB256_LPA32_MIWT2_4_PLR2_SU32_SUM0_SUS256_SKXCCM0_VWA2_VWB2_WGM1_WGMXCC1_WGMXCCGn1
    SolutionIndex: 35
    SolutionNameMin: Cijk_Ailk_Bljk_HHS_BH_UserArgs_MT64x128x64_MI16x16x1_SN_LDSB1_CLR1_GSU0_GSUC0_GSUWGMRR0_K1_LBSPPA1024_LBSPPB512_LPA32_MIWT2_4_PLR2_SU32_SUM0_SUS256_SKXCCM0_VWA2_VWB4_WGM1_WGMXCC1_WGMXCCGn1
    SolutionIndex: 36
    SolutionNameMin: Cijk_Ailk_Bljk_HHS_BH_UserArgs_MT128x64x64_MI16x16x1_SN_LDSB1_CLR1_GSU0_GSUC0_GSUWGMRR0_K1_LBSPPA2048_LBSPPB128_LPA0_MIWT4_2_PLR1_SU32_SUM0_SUS256_SKXCCM0_VWA4_VWB1_WGM1_WGMXCC1_WGMXCCGn1
    SolutionIndex: 37
    SolutionNameMin: Cijk_Ailk_Bljk_HHS_BH_UserArgs_MT128x64x64_MI16x16x1_SN_LDSB1_CLR1_GSU0_GSUC0_GSUWGMRR0_K1_LBSPPA2048_LBSPPB256_LPA0_MIWT4_2_PLR1_SU32_SUM0_SUS256_SKXCCM0_VWA4_VWB2_WGM1_WGMXCC1_WGMXCCGn1
    SolutionIndex: 38
    SolutionNameMin: Cijk_Ailk_Bljk_HHS_BH_UserArgs_MT128x64x64_MI16x16x1_SN_LDSB1_CLR1_GSU0_GSUC0_GSUWGMRR0_K1_LBSPPA2048_LBSPPB256_LPA0_MIWT4_2_PLR1_SU32_SUM0_SUS256_SKXCCM0_VWA4_VWB2_WGM8_WGMXCC1_WGMXCCGn1
    SolutionIndex: 39
    SolutionNameMin: Cijk_Ailk_Bljk_HHS_BH_UserArgs_MT64x64x64_MI16x16x1_SN_LDSB1_CLR1_GSU0_GSUC0_GSUWGMRR0_K1_LBSPPA1024_LBSPPB128_LPA32_MIWT2_2_PLR1_SU32_SUM0_SUS256_SKXCCM0_VWA2_VWB1_WGM1_WGMXCC1_WGMXCCGn1
    SolutionIndex: 40
    SolutionNameMin: Cijk_Ailk_Bljk_HHS_BH_UserArgs_MT64x64x64_MI16x16x1_SN_LDSB1_CLR1_GSU0_GSUC0_GSUWGMRR0_K1_LBSPPA1024_LBSPPB256_LPA32_MIWT2_2_PLR1_SU32_SUM0_SUS256_SKXCCM0_VWA2_VWB2_WGM1_WGMXCC1_WGMXCCGn1
    SolutionIndex: 41
    SolutionNameMin: Cijk_Ailk_Bljk_HHS_BH_UserArgs_MT64x32x64_MI16x16x1_SN_LDSB0_CLR1_GSU0_GSUC0_GSUWGMRR0_K1_LBSPPA1024_LBSPPB128_LPA32_MIWT2_1_PLR1_SU32_SUM0_SUS256_SKXCCM0_VWA2_VWB1_WGM1_WGMXCC1_WGMXCCGn1
    SolutionIndex: 42
    SolutionNameMin: Cijk_Ailk_Bljk_HHS_BH_UserArgs_MT32x32x64_MI16x16x1_SN_LDSB0_CLR1_GSU0_GSUC0_GSUWGMRR0_K1_LBSPPA512_LBSPPB128_LPA16_MIWT1_1_PLR1_SU32_SUM0_SUS256_SKXCCM0_VWA1_VWB1_WGM1_WGMXCC1_WGMXCCGn1
    SolutionIndex: 43
    SolutionNameMin: Cijk_Ailk_Bljk_HHS_BH_UserArgs_MT64x128x128_MI16x16x1_SN_LDSB1_CLR1_GSU0_GSUC0_GSUWGMRR0_K1_LBSPPA1024_LBSPPB512_LPA32_MIWT2_4_PLR2_SU32_SUM0_SUS256_SKXCCM0_VWA2_VWB2_WGM1_WGMXCC1_WGMXCCGn1
    SolutionIndex: 44
    SolutionNameMin: Cijk_Ailk_Bljk_HHS_BH_UserArgs_MT128x64x128_MI16x16x1_SN_LDSB1_CLR1_GSU0_GSUC0_GSUWGMRR0_K1_LBSPPA2048_LBSPPB256_LPA0_MIWT4_2_PLR2_SU32_SUM0_SUS256_SKXCCM0_VWA4_VWB1_WGM1_WGMXCC1_WGMXCCGn1
    SolutionIndex: 45
    SolutionNameMin: Cijk_Ailk_Bljk_HHS_BH_UserArgs_MT128x64x128_MI16x16x1_SN_LDSB1_CLR1_GSU0_GSUC0_GSUWGMRR0_K1_LBSPPA2048_LBSPPB256_LPA0_MIWT4_2_PLR2_SU32_SUM0_SUS256_SKXCCM0_VWA4_VWB1_WGM4_WGMXCC1_WGMXCCGn1
    SolutionIndex: 46
    SolutionNameMin: Cijk_Ailk_Bljk_HHS_BH_UserArgs_MT128x64x128_MI16x16x1_SN_LDSB1_CLR1_GSU0_GSUC0_GSUWGMRR0_K1_LBSPPA2048_LBSPPB256_LPA0_MIWT4_2_PLR2_SU32_SUM0_SUS256_SKXCCM0_VWA4_VWB1_WGM8_WGMXCC1_WGMXCCGn1
    SolutionIndex: 47
    SolutionNameMin: Cijk_Ailk_Bljk_HHS_BH_UserArgs_MT128x32x128_MI16x16x1_SN_LDSB1_CLR1_GSU0_GSUC0_GSUWGMRR0_K1_LBSPPA2048_LBSPPB256_LPA0_MIWT4_1_PLR2_SU32_SUM0_SUS256_SKXCCM0_VWA4_VWB1_WGM1_WGMXCC1_WGMXCCGn1
    SolutionIndex: 48
    SolutionNameMin: Cijk_Ailk_Bljk_HHS_BH_UserArgs_MT64x64x128_MI16x16x1_SN_LDSB1_CLR1_GSU0_GSUC0_GSUWGMRR0_K1_LBSPPA1024_LBSPPB256_LPA32_MIWT2_2_PLR2_SU32_SUM0_SUS256_SKXCCM0_VWA2_VWB1_WGM1_WGMXCC1_WGMXCCGn1
    SolutionIndex: 49
    SolutionNameMin: Cijk_Ailk_Bljk_HHS_BH_UserArgs_MT64x64x128_MI16x16x1_SN_LDSB1_CLR1_GSU0_GSUC0_GSUWGMRR0_K1_LBSPPA1024_LBSPPB512_LPA32_MIWT2_2_PLR2_SU32_SUM0_SUS256_SKXCCM0_VWA2_VWB2_WGM1_WGMXCC1_WGMXCCGn1
    SolutionIndex: 50
    SolutionNameMin: Cijk_Ailk_Bljk_HHS_BH_UserArgs_MT64x64x128_MI16x16x1_SN_LDSB1_CLR1_GSU0_GSUC0_GSUWGMRR0_K1_LBSPPA1024_LBSPPB256_LPA32_MIWT2_2_PLR2_SU32_SUM0_SUS256_SKXCCM0_VWA2_VWB1_WGM4_WGMXCC1_WGMXCCGn1
    SolutionIndex: 51
    SolutionNameMin: Cijk_Ailk_Bljk_HHS_BH_UserArgs_MT64x64x128_MI16x16x1_SN_LDSB1_CLR1_GSU0_GSUC0_GSUWGMRR0_K1_LBSPPA1024_LBSPPB512_LPA32_MIWT2_2_PLR2_SU32_SUM0_SUS256_SKXCCM0_VWA2_VWB2_WGM8_WGMXCC1_WGMXCCGn1
    SolutionIndex: 52
    SolutionNameMin: Cijk_Ailk_Bljk_HHS_BH_UserArgs_MT64x32x128_MI16x16x1_SN_LDSB1_CLR1_GSU0_GSUC0_GSUWGMRR0_K1_LBSPPA1024_LBSPPB256_LPA32_MIWT2_1_PLR2_SU32_SUM0_SUS256_SKXCCM0_VWA2_VWB1_WGM1_WGMXCC1_WGMXCCGn1
    SolutionIndex: 53
    SolutionNameMin: Cijk_Ailk_Bljk_HHS_BH_UserArgs_MT64x32x128_MI16x16x1_SN_LDSB1_CLR1_GSU0_GSUC0_GSUWGMRR0_K1_LBSPPA1024_LBSPPB256_LPA32_MIWT2_1_PLR2_SU32_SUM0_SUS256_SKXCCM0_VWA2_VWB1_WGM4_WGMXCC1_WGMXCCGn1
    SolutionIndex: 54
    SolutionNameMin: Cijk_Ailk_Bljk_HHS_BH_UserArgs_MT32x32x128_MI16x16x1_SN_LDSB1_CLR1_GSU0_GSUC0_GSUWGMRR0_K1_LBSPPA512_LBSPPB256_LPA16_MIWT1_1_PLR1_SU32_SUM0_SUS256_SKXCCM0_VWA1_VWB1_WGM1_WGMXCC1_WGMXCCGn1
    SolutionIndex: 55
    SolutionNameMin: Cijk_Ailk_Bljk_HHS_BH_UserArgs_MT32x32x128_MI16x16x1_SN_LDSB1_CLR1_GSU0_GSUC0_GSUWGMRR0_K1_LBSPPA512_LBSPPB256_LPA16_MIWT1_1_PLR2_SU32_SUM0_SUS256_SKXCCM0_VWA1_VWB1_WGM1_WGMXCC1_WGMXCCGn1
    SolutionIndex: 56
    SolutionNameMin: Cijk_Ailk_Bljk_HHS_BH_UserArgs_MT32x32x128_MI16x16x1_SN_LDSB1_CLR1_GSU0_GSUC0_GSUWGMRR0_K1_LBSPPA512_LBSPPB256_LPA16_MIWT1_1_PLR1_SU32_SUM0_SUS256_SKXCCM0_VWA1_VWB1_WGM8_WGMXCC1_WGMXCCGn1
    SolutionIndex: 57
    SolutionNameMin: Cijk_Ailk_Bljk_HHS_BH_UserArgs_MT32x32x128_MI16x16x1_SN_LDSB1_CLR1_GSU0_GSUC0_GSUWGMRR0_K1_LBSPPA512_LBSPPB256_LPA16_MIWT1_1_PLR2_SU32_SUM0_SUS256_SKXCCM0_VWA1_VWB1_WGM8_WGMXCC1_WGMXCCGn1
    SolutionIndex: 58
    SolutionNameMin: Cijk_Ailk_Bljk_HHS_BH_UserArgs_MT256x256x32_MI16x16x1_SN_LDSB1_CLR1_GSU0_GSUC0_GSUWGMRR0_K1_LBSPPA2048_LBSPPB128_LPA0_MIWT8_8_PLR1_SU32_SUM0_SUS256_SKXCCM6_VWA4_VWB1_WGM1_WGMXCC1_WGMXCCGn1
    SolutionIndex: 59
    SolutionNameMin: Cijk_Ailk_Bljk_HHS_BH_UserArgs_MT256x256x32_MI16x16x1_SN_LDSB1_CLR1_GSU0_GSUC0_GSUWGMRR0_K1_LBSPPA2048_LBSPPB256_LPA0_MIWT8_8_PLR1_SU32_SUM0_SUS256_SKXCCM6_VWA4_VWB4_WGM1_WGMXCC1_WGMXCCGn1
    SolutionIndex: 60
    SolutionNameMin: Cijk_Ailk_Bljk_HHS_BH_UserArgs_MT256x256x32_MI16x16x1_SN_LDSB1_CLR1_GSU0_GSUC0_GSUWGMRR0_K1_LBSPPA2048_LBSPPB512_LPA32_MIWT8_8_PLR1_SU32_SUM0_SUS256_SKXCCM6_VWA2_VWB8_WGM1_WGMXCC1_WGMXCCGn1
    SolutionIndex: 61
    SolutionNameMin: Cijk_Ailk_Bljk_HHS_BH_UserArgs_MT256x256x32_MI16x16x1_SN_LDSB1_CLR1_GSU0_GSUC0_GSUWGMRR0_K1_LBSPPA2048_LBSPPB512_LPA0_MIWT8_8_PLR1_SU32_SUM0_SUS256_SKXCCM6_VWA4_VWB8_WGM1_WGMXCC1_WGMXCCGn1
    SolutionIndex: 62
    SolutionNameMin: Cijk_Ailk_Bljk_HHS_BH_UserArgs_MT256x256x32_MI16x16x1_SN_LDSB1_CLR1_GSU0_GSUC0_GSUWGMRR0_K1_LBSPPA2048_LBSPPB128_LPA32_MIWT8_8_PLR1_SU32_SUM0_SUS256_SKXCCM6_VWA2_VWB1_WGM4_WGMXCC1_WGMXCCGn1
    SolutionIndex: 63
    SolutionNameMin: Cijk_Ailk_Bljk_HHS_BH_UserArgs_MT256x256x32_MI16x16x1_SN_LDSB1_CLR1_GSU0_GSUC0_GSUWGMRR0_K1_LBSPPA2048_LBSPPB128_LPA0_MIWT8_8_PLR1_SU32_SUM0_SUS256_SKXCCM6_VWA8_VWB2_WGM4_WGMXCC1_WGMXCCGn1
    SolutionIndex: 64
    SolutionNameMin: Cijk_Ailk_Bljk_HHS_BH_UserArgs_MT256x256x32_MI16x16x1_SN_LDSB1_CLR1_GSU0_GSUC0_GSUWGMRR0_K1_LBSPPA2048_LBSPPB256_LPA0_MIWT8_8_PLR1_SU32_SUM0_SUS256_SKXCCM6_VWA4_VWB4_WGM4_WGMXCC1_WGMXCCGn1
    SolutionIndex: 65
    SolutionNameMin: Cijk_Ailk_Bljk_HHS_BH_UserArgs_MT256x256x32_MI16x16x1_SN_LDSB1_CLR1_GSU0_GSUC0_GSUWGMRR0_K1_LBSPPA2048_LBSPPB256_LPA0_MIWT8_8_PLR1_SU32_SUM0_SUS256_SKXCCM6_VWA8_VWB4_WGM4_WGMXCC1_WGMXCCGn1
    SolutionIndex: 66
    SolutionNameMin: Cijk_Ailk_Bljk_HHS_BH_UserArgs_MT256x256x32_MI16x16x1_SN_LDSB1_CLR1_GSU0_GSUC0_GSUWGMRR0_K1_LBSPPA2048_LBSPPB512_LPA0_MIWT8_8_PLR1_SU32_SUM0_SUS256_SKXCCM6_VWA8_VWB8_WGM4_WGMXCC1_WGMXCCGn1
    SolutionIndex: 67
    SolutionNameMin: Cijk_Ailk_Bljk_HHS_BH_UserArgs_MT256x256x32_MI16x16x1_SN_LDSB1_CLR1_GSU0_GSUC0_GSUWGMRR0_K1_LBSPPA2048_LBSPPB128_LPA32_MIWT8_8_PLR1_SU32_SUM0_SUS256_SKXCCM6_VWA2_VWB1_WGM8_WGMXCC1_WGMXCCGn1
    SolutionIndex: 68
    SolutionNameMin: Cijk_Ailk_Bljk_HHS_BH_UserArgs_MT256x256x32_MI16x16x1_SN_LDSB1_CLR1_GSU0_GSUC0_GSUWGMRR0_K1_LBSPPA2048_LBSPPB128_LPA0_MIWT8_8_PLR1_SU32_SUM0_SUS256_SKXCCM6_VWA4_VWB1_WGM8_WGMXCC1_WGMXCCGn1
    SolutionIndex: 69
    SolutionNameMin: Cijk_Ailk_Bljk_HHS_BH_UserArgs_MT256x256x32_MI16x16x1_SN_LDSB1_CLR1_GSU0_GSUC0_GSUWGMRR0_K1_LBSPPA2048_LBSPPB128_LPA0_MIWT8_8_PLR1_SU32_SUM0_SUS256_SKXCCM6_VWA8_VWB1_WGM8_WGMXCC1_WGMXCCGn1
    SolutionIndex: 70
    SolutionNameMin: Cijk_Ailk_Bljk_HHS_BH_UserArgs_MT256x256x32_MI16x16x1_SN_LDSB1_CLR1_GSU0_GSUC0_GSUWGMRR0_K1_LBSPPA2048_LBSPPB128_LPA0_MIWT8_8_PLR1_SU32_SUM0_SUS256_SKXCCM6_VWA4_VWB2_WGM8_WGMXCC1_WGMXCCGn1
    SolutionIndex: 71
    SolutionNameMin: Cijk_Ailk_Bljk_HHS_BH_UserArgs_MT256x256x32_MI16x16x1_SN_LDSB1_CLR1_GSU0_GSUC0_GSUWGMRR0_K1_LBSPPA2048_LBSPPB256_LPA0_MIWT8_8_PLR1_SU32_SUM0_SUS256_SKXCCM6_VWA4_VWB4_WGM8_WGMXCC1_WGMXCCGn1
    SolutionIndex: 72
    SolutionNameMin: Cijk_Ailk_Bljk_HHS_BH_UserArgs_MT256x128x32_MI16x16x1_SN_LDSB1_CLR1_GSU0_GSUC0_GSUWGMRR0_K1_LBSPPA2048_LBSPPB128_LPA0_MIWT8_4_PLR1_SU32_SUM0_SUS256_SKXCCM6_VWA8_VWB2_WGM1_WGMXCC1_WGMXCCGn1
    SolutionIndex: 73
    SolutionNameMin: Cijk_Ailk_Bljk_HHS_BH_UserArgs_MT256x128x32_MI16x16x1_SN_LDSB1_CLR1_GSU0_GSUC0_GSUWGMRR0_K1_LBSPPA2048_LBSPPB256_LPA0_MIWT8_4_PLR1_SU32_SUM0_SUS256_SKXCCM6_VWA8_VWB4_WGM1_WGMXCC1_WGMXCCGn1
    SolutionIndex: 74
    SolutionNameMin: Cijk_Ailk_Bljk_HHS_BH_UserArgs_MT256x128x32_MI16x16x1_SN_LDSB1_CLR1_GSU0_GSUC0_GSUWGMRR0_K1_LBSPPA2048_LBSPPB128_LPA0_MIWT8_4_PLR1_SU32_SUM0_SUS256_SKXCCM6_VWA4_VWB1_WGM8_WGMXCC1_WGMXCCGn1
    SolutionIndex: 75
    SolutionNameMin: Cijk_Ailk_Bljk_HHS_BH_UserArgs_MT256x128x32_MI16x16x1_SN_LDSB1_CLR1_GSU0_GSUC0_GSUWGMRR0_K1_LBSPPA2048_LBSPPB128_LPA0_MIWT8_4_PLR1_SU32_SUM0_SUS256_SKXCCM6_VWA8_VWB2_WGM8_WGMXCC1_WGMXCCGn1
    SolutionIndex: 76
    SolutionNameMin: Cijk_Ailk_Bljk_HHS_BH_UserArgs_MT256x128x32_MI16x16x1_SN_LDSB1_CLR1_GSU0_GSUC0_GSUWGMRR0_K1_LBSPPA2048_LBSPPB256_LPA0_MIWT8_4_PLR1_SU32_SUM0_SUS256_SKXCCM6_VWA8_VWB4_WGM8_WGMXCC1_WGMXCCGn1
    SolutionIndex: 77
    SolutionNameMin: Cijk_Ailk_Bljk_HHS_BH_UserArgs_MT128x64x32_MI16x16x1_SN_LDSB0_CLR1_GSU0_GSUC0_GSUWGMRR0_K1_LBSPPA1024_LBSPPB128_LPA0_MIWT4_2_PLR1_SU32_SUM0_SUS256_SKXCCM6_VWA4_VWB1_WGM1_WGMXCC1_WGMXCCGn1
    SolutionIndex: 78
    SolutionNameMin: Cijk_Ailk_Bljk_HHS_BH_UserArgs_MT128x256x64_MI16x16x1_SN_LDSB1_CLR1_GSU0_GSUC0_GSUWGMRR0_K1_LBSPPA2048_LBSPPB128_LPA32_MIWT4_8_PLR1_SU32_SUM0_SUS256_SKXCCM6_VWA2_VWB1_WGM1_WGMXCC1_WGMXCCGn1
    SolutionIndex: 79
    SolutionNameMin: Cijk_Ailk_Bljk_HHS_BH_UserArgs_MT128x256x64_MI16x16x1_SN_LDSB1_CLR1_GSU0_GSUC0_GSUWGMRR0_K1_LBSPPA2048_LBSPPB128_LPA0_MIWT4_8_PLR1_SU32_SUM0_SUS256_SKXCCM6_VWA4_VWB1_WGM1_WGMXCC1_WGMXCCGn1
    SolutionIndex: 80
    SolutionNameMin: Cijk_Ailk_Bljk_HHS_BH_UserArgs_MT128x256x64_MI16x16x1_SN_LDSB1_CLR1_GSU0_GSUC0_GSUWGMRR0_K1_LBSPPA2048_LBSPPB256_LPA32_MIWT4_8_PLR1_SU32_SUM0_SUS256_SKXCCM6_VWA2_VWB2_WGM1_WGMXCC1_WGMXCCGn1
    SolutionIndex: 81
    SolutionNameMin: Cijk_Ailk_Bljk_HHS_BH_UserArgs_MT128x256x64_MI16x16x1_SN_LDSB1_CLR1_GSU0_GSUC0_GSUWGMRR0_K1_LBSPPA2048_LBSPPB256_LPA0_MIWT4_8_PLR1_SU32_SUM0_SUS256_SKXCCM6_VWA4_VWB2_WGM1_WGMXCC1_WGMXCCGn1
    SolutionIndex: 82
    SolutionNameMin: Cijk_Ailk_Bljk_HHS_BH_UserArgs_MT128x256x64_MI16x16x1_SN_LDSB1_CLR1_GSU0_GSUC0_GSUWGMRR0_K1_LBSPPA2048_LBSPPB512_LPA32_MIWT4_8_PLR1_SU32_SUM0_SUS256_SKXCCM6_VWA2_VWB4_WGM1_WGMXCC1_WGMXCCGn1
    SolutionIndex: 83
    SolutionNameMin: Cijk_Ailk_Bljk_HHS_BH_UserArgs_MT128x256x64_MI16x16x1_SN_LDSB1_CLR1_GSU0_GSUC0_GSUWGMRR0_K1_LBSPPA2048_LBSPPB512_LPA0_MIWT4_8_PLR1_SU32_SUM0_SUS256_SKXCCM6_VWA4_VWB4_WGM1_WGMXCC1_WGMXCCGn1
    SolutionIndex: 84
    SolutionNameMin: Cijk_Ailk_Bljk_HHS_BH_UserArgs_MT128x256x64_MI16x16x1_SN_LDSB1_CLR1_GSU0_GSUC0_GSUWGMRR0_K1_LBSPPA2048_LBSPPB1024_LPA32_MIWT4_8_PLR1_SU32_SUM0_SUS256_SKXCCM6_VWA2_VWB8_WGM1_WGMXCC1_WGMXCCGn1
    SolutionIndex: 85
    SolutionNameMin: Cijk_Ailk_Bljk_HHS_BH_UserArgs_MT128x256x64_MI16x16x1_SN_LDSB1_CLR1_GSU0_GSUC0_GSUWGMRR0_K1_LBSPPA2048_LBSPPB1024_LPA0_MIWT4_8_PLR1_SU32_SUM0_SUS256_SKXCCM6_VWA4_VWB8_WGM1_WGMXCC1_WGMXCCGn1
    SolutionIndex: 86
    SolutionNameMin: Cijk_Ailk_Bljk_HHS_BH_UserArgs_MT128x256x64_MI16x16x1_SN_LDSB1_CLR1_GSU0_GSUC0_GSUWGMRR0_K1_LBSPPA2048_LBSPPB128_LPA32_MIWT4_8_PLR1_SU32_SUM0_SUS256_SKXCCM6_VWA2_VWB1_WGM4_WGMXCC1_WGMXCCGn1
    SolutionIndex: 87
    SolutionNameMin: Cijk_Ailk_Bljk_HHS_BH_UserArgs_MT128x256x64_MI16x16x1_SN_LDSB1_CLR1_GSU0_GSUC0_GSUWGMRR0_K1_LBSPPA2048_LBSPPB128_LPA0_MIWT4_8_PLR1_SU32_SUM0_SUS256_SKXCCM6_VWA4_VWB1_WGM4_WGMXCC1_WGMXCCGn1
    SolutionIndex: 88
    SolutionNameMin: Cijk_Ailk_Bljk_HHS_BH_UserArgs_MT128x256x64_MI16x16x1_SN_LDSB1_CLR1_GSU0_GSUC0_GSUWGMRR0_K1_LBSPPA2048_LBSPPB256_LPA0_MIWT4_8_PLR1_SU32_SUM0_SUS256_SKXCCM6_VWA4_VWB2_WGM4_WGMXCC1_WGMXCCGn1
    SolutionIndex: 89
    SolutionNameMin: Cijk_Ailk_Bljk_HHS_BH_UserArgs_MT128x256x64_MI16x16x1_SN_LDSB1_CLR1_GSU0_GSUC0_GSUWGMRR0_K1_LBSPPA2048_LBSPPB128_LPA32_MIWT4_8_PLR1_SU32_SUM0_SUS256_SKXCCM6_VWA2_VWB1_WGM8_WGMXCC1_WGMXCCGn1
    SolutionIndex: 90
    SolutionNameMin: Cijk_Ailk_Bljk_HHS_BH_UserArgs_MT256x128x64_MI16x16x1_SN_LDSB1_CLR1_GSU0_GSUC0_GSUWGMRR0_K1_LBSPPA4096_LBSPPB128_LPA32_MIWT8_4_PLR1_SU32_SUM0_SUS256_SKXCCM6_VWA2_VWB1_WGM1_WGMXCC1_WGMXCCGn1
    SolutionIndex: 91
    SolutionNameMin: Cijk_Ailk_Bljk_HHS_BH_UserArgs_MT256x128x64_MI16x16x1_SN_LDSB1_CLR1_GSU0_GSUC0_GSUWGMRR0_K1_LBSPPA4096_LBSPPB256_LPA32_MIWT8_4_PLR1_SU32_SUM0_SUS256_SKXCCM6_VWA2_VWB2_WGM1_WGMXCC1_WGMXCCGn1
    SolutionIndex: 92
    SolutionNameMin: Cijk_Ailk_Bljk_HHS_BH_UserArgs_MT256x128x64_MI16x16x1_SN_LDSB1_CLR1_GSU0_GSUC0_GSUWGMRR0_K1_LBSPPA4096_LBSPPB512_LPA0_MIWT8_4_PLR1_SU32_SUM0_SUS256_SKXCCM6_VWA4_VWB4_WGM1_WGMXCC1_WGMXCCGn1
    SolutionIndex: 93
    SolutionNameMin: Cijk_Ailk_Bljk_HHS_BH_UserArgs_MT256x128x64_MI16x16x1_SN_LDSB1_CLR1_GSU0_GSUC0_GSUWGMRR0_K1_LBSPPA4096_LBSPPB128_LPA32_MIWT8_4_PLR1_SU32_SUM0_SUS256_SKXCCM6_VWA2_VWB1_WGM4_WGMXCC1_WGMXCCGn1
    SolutionIndex: 94
    SolutionNameMin: Cijk_Ailk_Bljk_HHS_BH_UserArgs_MT256x128x64_MI16x16x1_SN_LDSB1_CLR1_GSU0_GSUC0_GSUWGMRR0_K1_LBSPPA4096_LBSPPB128_LPA32_MIWT8_4_PLR1_SU32_SUM0_SUS256_SKXCCM6_VWA2_VWB1_WGM8_WGMXCC1_WGMXCCGn1
    SolutionIndex: 95
    SolutionNameMin: Cijk_Ailk_Bljk_HHS_BH_UserArgs_MT64x256x64_MI16x16x1_SN_LDSB1_CLR1_GSU0_GSUC0_GSUWGMRR0_K1_LBSPPA1024_LBSPPB512_LPA32_MIWT2_8_PLR1_SU32_SUM0_SUS256_SKXCCM6_VWA2_VWB4_WGM1_WGMXCC1_WGMXCCGn1
    SolutionIndex: 96
    SolutionNameMin: Cijk_Ailk_Bljk_HHS_BH_UserArgs_MT64x256x64_MI16x16x1_SN_LDSB1_CLR1_GSU0_GSUC0_GSUWGMRR0_K1_LBSPPA1024_LBSPPB1024_LPA32_MIWT2_8_PLR1_SU32_SUM0_SUS256_SKXCCM6_VWA2_VWB8_WGM1_WGMXCC1_WGMXCCGn1
    SolutionIndex: 97
    SolutionNameMin: Cijk_Ailk_Bljk_HHS_BH_UserArgs_MT256x64x64_MI16x16x1_SN_LDSB1_CLR1_GSU0_GSUC0_GSUWGMRR0_K1_LBSPPA4096_LBSPPB256_LPA0_MIWT8_2_PLR1_SU32_SUM0_SUS256_SKXCCM6_VWA4_VWB2_WGM1_WGMXCC1_WGMXCCGn1
    SolutionIndex: 98
    SolutionNameMin: Cijk_Ailk_Bljk_HHS_BH_UserArgs_MT128x128x64_MI16x16x1_SN_LDSB1_CLR1_GSU0_GSUC0_GSUWGMRR0_K1_LBSPPA2048_LBSPPB128_LPA32_MIWT4_4_PLR1_SU32_SUM0_SUS256_SKXCCM6_VWA2_VWB1_WGM1_WGMXCC1_WGMXCCGn1
    SolutionIndex: 99
    SolutionNameMin: Cijk_Ailk_Bljk_HHS_BH_UserArgs_MT128x128x64_MI16x16x1_SN_LDSB1_CLR1_GSU0_GSUC0_GSUWGMRR0_K1_LBSPPA2048_LBSPPB128_LPA0_MIWT4_4_PLR1_SU32_SUM0_SUS256_SKXCCM6_VWA4_VWB1_WGM1_WGMXCC1_WGMXCCGn1
    SolutionIndex: 100
    SolutionNameMin: Cijk_Ailk_Bljk_HHS_BH_UserArgs_MT128x128x64_MI16x16x1_SN_LDSB1_CLR1_GSU0_GSUC0_GSUWGMRR0_K1_LBSPPA2048_LBSPPB256_LPA32_MIWT4_4_PLR1_SU32_SUM0_SUS256_SKXCCM6_VWA2_VWB2_WGM1_WGMXCC1_WGMXCCGn1
    SolutionIndex: 101
    SolutionNameMin: Cijk_Ailk_Bljk_HHS_BH_UserArgs_MT128x128x64_MI16x16x1_SN_LDSB1_CLR1_GSU0_GSUC0_GSUWGMRR0_K1_LBSPPA2048_LBSPPB256_LPA0_MIWT4_4_PLR1_SU32_SUM0_SUS256_SKXCCM6_VWA4_VWB2_WGM1_WGMXCC1_WGMXCCGn1
    SolutionIndex: 102
    SolutionNameMin: Cijk_Ailk_Bljk_HHS_BH_UserArgs_MT128x128x64_MI16x16x1_SN_LDSB1_CLR1_GSU0_GSUC0_GSUWGMRR0_K1_LBSPPA2048_LBSPPB512_LPA0_MIWT4_4_PLR1_SU32_SUM0_SUS256_SKXCCM6_VWA4_VWB4_WGM1_WGMXCC1_WGMXCCGn1
    SolutionIndex: 103
    SolutionNameMin: Cijk_Ailk_Bljk_HHS_BH_UserArgs_MT128x128x64_MI16x16x1_SN_LDSB1_CLR1_GSU0_GSUC0_GSUWGMRR0_K1_LBSPPA2048_LBSPPB256_LPA0_MIWT4_4_PLR2_SU32_SUM0_SUS256_SKXCCM6_VWA4_VWB2_WGM1_WGMXCC1_WGMXCCGn1
    SolutionIndex: 104
    SolutionNameMin: Cijk_Ailk_Bljk_HHS_BH_UserArgs_MT128x128x64_MI16x16x1_SN_LDSB1_CLR1_GSU0_GSUC0_GSUWGMRR0_K1_LBSPPA2048_LBSPPB512_LPA0_MIWT4_4_PLR2_SU32_SUM0_SUS256_SKXCCM6_VWA4_VWB4_WGM1_WGMXCC1_WGMXCCGn1
    SolutionIndex: 105
    SolutionNameMin: Cijk_Ailk_Bljk_HHS_BH_UserArgs_MT128x128x64_MI16x16x1_SN_LDSB1_CLR1_GSU0_GSUC0_GSUWGMRR0_K1_LBSPPA2048_LBSPPB128_LPA32_MIWT4_4_PLR1_SU32_SUM0_SUS256_SKXCCM6_VWA2_VWB1_WGM4_WGMXCC1_WGMXCCGn1
    SolutionIndex: 106
    SolutionNameMin: Cijk_Ailk_Bljk_HHS_BH_UserArgs_MT128x128x64_MI16x16x1_SN_LDSB1_CLR1_GSU0_GSUC0_GSUWGMRR0_K1_LBSPPA2048_LBSPPB128_LPA0_MIWT4_4_PLR1_SU32_SUM0_SUS256_SKXCCM6_VWA4_VWB1_WGM4_WGMXCC1_WGMXCCGn1
    SolutionIndex: 107
    SolutionNameMin: Cijk_Ailk_Bljk_HHS_BH_UserArgs_MT128x128x64_MI16x16x1_SN_LDSB1_CLR1_GSU0_GSUC0_GSUWGMRR0_K1_LBSPPA2048_LBSPPB256_LPA0_MIWT4_4_PLR1_SU32_SUM0_SUS256_SKXCCM6_VWA4_VWB2_WGM4_WGMXCC1_WGMXCCGn1
    SolutionIndex: 108
    SolutionNameMin: Cijk_Ailk_Bljk_HHS_BH_UserArgs_MT128x128x64_MI16x16x1_SN_LDSB1_CLR1_GSU0_GSUC0_GSUWGMRR0_K1_LBSPPA2048_LBSPPB512_LPA0_MIWT4_4_PLR1_SU32_SUM0_SUS256_SKXCCM6_VWA4_VWB4_WGM4_WGMXCC1_WGMXCCGn1
    SolutionIndex: 109
    SolutionNameMin: Cijk_Ailk_Bljk_HHS_BH_UserArgs_MT128x128x64_MI16x16x1_SN_LDSB1_CLR1_GSU0_GSUC0_GSUWGMRR0_K1_LBSPPA2048_LBSPPB128_LPA0_MIWT4_4_PLR2_SU32_SUM0_SUS256_SKXCCM6_VWA4_VWB1_WGM4_WGMXCC1_WGMXCCGn1
    SolutionIndex: 110
    SolutionNameMin: Cijk_Ailk_Bljk_HHS_BH_UserArgs_MT128x128x64_MI16x16x1_SN_LDSB1_CLR1_GSU0_GSUC0_GSUWGMRR0_K1_LBSPPA2048_LBSPPB256_LPA0_MIWT4_4_PLR2_SU32_SUM0_SUS256_SKXCCM6_VWA4_VWB2_WGM4_WGMXCC1_WGMXCCGn1
    SolutionIndex: 111
    SolutionNameMin: Cijk_Ailk_Bljk_HHS_BH_UserArgs_MT128x128x64_MI16x16x1_SN_LDSB1_CLR1_GSU0_GSUC0_GSUWGMRR0_K1_LBSPPA2048_LBSPPB512_LPA0_MIWT4_4_PLR2_SU32_SUM0_SUS256_SKXCCM6_VWA4_VWB4_WGM4_WGMXCC1_WGMXCCGn1
    SolutionIndex: 112
    SolutionNameMin: Cijk_Ailk_Bljk_HHS_BH_UserArgs_MT128x128x64_MI16x16x1_SN_LDSB1_CLR1_GSU0_GSUC0_GSUWGMRR0_K1_LBSPPA2048_LBSPPB128_LPA32_MIWT4_4_PLR1_SU32_SUM0_SUS256_SKXCCM6_VWA2_VWB1_WGM8_WGMXCC1_WGMXCCGn1
    SolutionIndex: 113
    SolutionNameMin: Cijk_Ailk_Bljk_HHS_BH_UserArgs_MT128x128x64_MI16x16x1_SN_LDSB1_CLR1_GSU0_GSUC0_GSUWGMRR0_K1_LBSPPA2048_LBSPPB128_LPA0_MIWT4_4_PLR1_SU32_SUM0_SUS256_SKXCCM6_VWA4_VWB1_WGM8_WGMXCC1_WGMXCCGn1
    SolutionIndex: 114
    SolutionNameMin: Cijk_Ailk_Bljk_HHS_BH_UserArgs_MT128x128x64_MI16x16x1_SN_LDSB1_CLR1_GSU0_GSUC0_GSUWGMRR0_K1_LBSPPA2048_LBSPPB256_LPA0_MIWT4_4_PLR1_SU32_SUM0_SUS256_SKXCCM6_VWA4_VWB2_WGM8_WGMXCC1_WGMXCCGn1
    SolutionIndex: 115
    SolutionNameMin: Cijk_Ailk_Bljk_HHS_BH_UserArgs_MT128x128x64_MI16x16x1_SN_LDSB1_CLR1_GSU0_GSUC0_GSUWGMRR0_K1_LBSPPA2048_LBSPPB512_LPA0_MIWT4_4_PLR1_SU32_SUM0_SUS256_SKXCCM6_VWA4_VWB4_WGM8_WGMXCC1_WGMXCCGn1
    SolutionIndex: 116
    SolutionNameMin: Cijk_Ailk_Bljk_HHS_BH_UserArgs_MT128x128x64_MI16x16x1_SN_LDSB1_CLR1_GSU0_GSUC0_GSUWGMRR0_K1_LBSPPA2048_LBSPPB128_LPA0_MIWT4_4_PLR2_SU32_SUM0_SUS256_SKXCCM6_VWA4_VWB1_WGM8_WGMXCC1_WGMXCCGn1
    SolutionIndex: 117
    SolutionNameMin: Cijk_Ailk_Bljk_HHS_BH_UserArgs_MT128x128x64_MI16x16x1_SN_LDSB1_CLR1_GSU0_GSUC0_GSUWGMRR0_K1_LBSPPA2048_LBSPPB256_LPA0_MIWT4_4_PLR2_SU32_SUM0_SUS256_SKXCCM6_VWA4_VWB2_WGM8_WGMXCC1_WGMXCCGn1
    SolutionIndex: 118
    SolutionNameMin: Cijk_Ailk_Bljk_HHS_BH_UserArgs_MT128x128x64_MI16x16x1_SN_LDSB1_CLR1_GSU0_GSUC0_GSUWGMRR0_K1_LBSPPA2048_LBSPPB512_LPA0_MIWT4_4_PLR2_SU32_SUM0_SUS256_SKXCCM6_VWA4_VWB4_WGM8_WGMXCC1_WGMXCCGn1
    SolutionIndex: 119
    SolutionNameMin: Cijk_Ailk_Bljk_HHS_BH_UserArgs_MT64x128x64_MI16x16x1_SN_LDSB1_CLR1_GSU0_GSUC0_GSUWGMRR0_K1_LBSPPA1024_LBSPPB128_LPA32_MIWT2_4_PLR1_SU32_SUM0_SUS256_SKXCCM6_VWA2_VWB1_WGM1_WGMXCC1_WGMXCCGn1
    SolutionIndex: 120
    SolutionNameMin: Cijk_Ailk_Bljk_HHS_BH_UserArgs_MT64x128x64_MI16x16x1_SN_LDSB1_CLR1_GSU0_GSUC0_GSUWGMRR0_K1_LBSPPA1024_LBSPPB128_LPA32_MIWT2_4_PLR1_SU32_SUM0_SUS256_SKXCCM6_VWA2_VWB1_WGM4_WGMXCC1_WGMXCCGn1
    SolutionIndex: 121
    SolutionNameMin: Cijk_Ailk_Bljk_HHS_BH_UserArgs_MT64x128x64_MI16x16x1_SN_LDSB1_CLR1_GSU0_GSUC0_GSUWGMRR0_K1_LBSPPA1024_LBSPPB256_LPA32_MIWT2_4_PLR1_SU32_SUM0_SUS256_SKXCCM6_VWA2_VWB2_WGM4_WGMXCC1_WGMXCCGn1
    SolutionIndex: 122
    SolutionNameMin: Cijk_Ailk_Bljk_HHS_BH_UserArgs_MT64x128x64_MI16x16x1_SN_LDSB1_CLR1_GSU0_GSUC0_GSUWGMRR0_K1_LBSPPA1024_LBSPPB128_LPA32_MIWT2_4_PLR2_SU32_SUM0_SUS256_SKXCCM6_VWA2_VWB1_WGM4_WGMXCC1_WGMXCCGn1
    SolutionIndex: 123
    SolutionNameMin: Cijk_Ailk_Bljk_HHS_BH_UserArgs_MT64x128x64_MI16x16x1_SN_LDSB1_CLR1_GSU0_GSUC0_GSUWGMRR0_K1_LBSPPA1024_LBSPPB256_LPA32_MIWT2_4_PLR1_SU32_SUM0_SUS256_SKXCCM6_VWA2_VWB2_WGM8_WGMXCC1_WGMXCCGn1
    SolutionIndex: 124
    SolutionNameMin: Cijk_Ailk_Bljk_HHS_BH_UserArgs_MT128x64x64_MI16x16x1_SN_LDSB1_CLR1_GSU0_GSUC0_GSUWGMRR0_K1_LBSPPA2048_LBSPPB128_LPA0_MIWT4_2_PLR1_SU32_SUM0_SUS256_SKXCCM6_VWA4_VWB1_WGM1_WGMXCC1_WGMXCCGn1
    SolutionIndex: 125
    SolutionNameMin: Cijk_Ailk_Bljk_HHS_BH_UserArgs_MT128x64x64_MI16x16x1_SN_LDSB1_CLR1_GSU0_GSUC0_GSUWGMRR0_K1_LBSPPA2048_LBSPPB256_LPA0_MIWT4_2_PLR1_SU32_SUM0_SUS256_SKXCCM6_VWA4_VWB2_WGM1_WGMXCC1_WGMXCCGn1
    SolutionIndex: 126
    SolutionNameMin: Cijk_Ailk_Bljk_HHS_BH_UserArgs_MT128x64x64_MI16x16x1_SN_LDSB1_CLR1_GSU0_GSUC0_GSUWGMRR0_K1_LBSPPA2048_LBSPPB256_LPA0_MIWT4_2_PLR1_SU32_SUM0_SUS256_SKXCCM6_VWA4_VWB2_WGM4_WGMXCC1_WGMXCCGn1
    SolutionIndex: 127
    SolutionNameMin: Cijk_Ailk_Bljk_HHS_BH_UserArgs_MT128x64x64_MI16x16x1_SN_LDSB1_CLR1_GSU0_GSUC0_GSUWGMRR0_K1_LBSPPA2048_LBSPPB256_LPA0_MIWT4_2_PLR1_SU32_SUM0_SUS256_SKXCCM6_VWA4_VWB2_WGM8_WGMXCC1_WGMXCCGn1
    SolutionIndex: 128
    SolutionNameMin: Cijk_Ailk_Bljk_HHS_BH_UserArgs_MT32x64x64_MI16x16x1_SN_LDSB0_CLR1_GSU0_GSUC0_GSUWGMRR0_K1_LBSPPA512_LBSPPB256_LPA16_MIWT1_2_PLR1_SU32_SUM0_SUS256_SKXCCM6_VWA1_VWB2_WGM1_WGMXCC1_WGMXCCGn1
    SolutionIndex: 129
    SolutionNameMin: Cijk_Ailk_Bljk_HHS_BH_UserArgs_MT32x32x64_MI16x16x1_SN_LDSB0_CLR1_GSU0_GSUC0_GSUWGMRR0_K1_LBSPPA512_LBSPPB128_LPA16_MIWT1_1_PLR1_SU32_SUM0_SUS256_SKXCCM6_VWA1_VWB1_WGM1_WGMXCC1_WGMXCCGn1
    SolutionIndex: 130
    SolutionNameMin: Cijk_Ailk_Bljk_HHS_BH_UserArgs_MT32x32x64_MI16x16x1_SN_LDSB0_CLR1_GSU0_GSUC0_GSUWGMRR0_K1_LBSPPA512_LBSPPB128_LPA16_MIWT1_1_PLR1_SU32_SUM0_SUS256_SKXCCM6_VWA1_VWB1_WGM8_WGMXCC1_WGMXCCGn1
    SolutionIndex: 131
    SolutionNameMin: Cijk_Ailk_Bljk_HHS_BH_UserArgs_MT64x128x128_MI16x16x1_SN_LDSB1_CLR1_GSU0_GSUC0_GSUWGMRR0_K1_LBSPPA1024_LBSPPB512_LPA32_MIWT2_4_PLR2_SU32_SUM0_SUS256_SKXCCM6_VWA2_VWB2_WGM1_WGMXCC1_WGMXCCGn1
    SolutionIndex: 132
    SolutionNameMin: Cijk_Ailk_Bljk_HHS_BH_UserArgs_MT64x128x128_MI16x16x1_SN_LDSB1_CLR1_GSU0_GSUC0_GSUWGMRR0_K1_LBSPPA1024_LBSPPB1024_LPA32_MIWT2_4_PLR1_SU32_SUM0_SUS256_SKXCCM6_VWA2_VWB4_WGM4_WGMXCC1_WGMXCCGn1
    SolutionIndex: 133
    SolutionNameMin: Cijk_Ailk_Bljk_HHS_BH_UserArgs_MT64x128x128_MI16x16x1_SN_LDSB1_CLR1_GSU0_GSUC0_GSUWGMRR0_K1_LBSPPA1024_LBSPPB1024_LPA32_MIWT2_4_PLR2_SU32_SUM0_SUS256_SKXCCM6_VWA2_VWB4_WGM4_WGMXCC1_WGMXCCGn1
    SolutionIndex: 134
    SolutionNameMin: Cijk_Ailk_Bljk_HHS_BH_UserArgs_MT128x64x128_MI16x16x1_SN_LDSB1_CLR1_GSU0_GSUC0_GSUWGMRR0_K1_LBSPPA2048_LBSPPB256_LPA0_MIWT4_2_PLR2_SU32_SUM0_SUS256_SKXCCM6_VWA4_VWB1_WGM1_WGMXCC1_WGMXCCGn1
    SolutionIndex: 135
    SolutionNameMin: Cijk_Ailk_Bljk_HHS_BH_UserArgs_MT128x64x128_MI16x16x1_SN_LDSB1_CLR1_GSU0_GSUC0_GSUWGMRR0_K1_LBSPPA2048_LBSPPB512_LPA0_MIWT4_2_PLR2_SU32_SUM0_SUS256_SKXCCM6_VWA4_VWB2_WGM1_WGMXCC1_WGMXCCGn1
    SolutionIndex: 136
    SolutionNameMin: Cijk_Ailk_Bljk_HHS_BH_UserArgs_MT128x64x128_MI16x16x1_SN_LDSB1_CLR1_GSU0_GSUC0_GSUWGMRR0_K1_LBSPPA2048_LBSPPB512_LPA0_MIWT4_2_PLR1_SU32_SUM0_SUS256_SKXCCM6_VWA4_VWB2_WGM4_WGMXCC1_WGMXCCGn1
    SolutionIndex: 137
    SolutionNameMin: Cijk_Ailk_Bljk_HHS_BH_UserArgs_MT128x64x128_MI16x16x1_SN_LDSB1_CLR1_GSU0_GSUC0_GSUWGMRR0_K1_LBSPPA2048_LBSPPB256_LPA0_MIWT4_2_PLR2_SU32_SUM0_SUS256_SKXCCM6_VWA4_VWB1_WGM4_WGMXCC1_WGMXCCGn1
    SolutionIndex: 138
    SolutionNameMin: Cijk_Ailk_Bljk_HHS_BH_UserArgs_MT128x64x128_MI16x16x1_SN_LDSB1_CLR1_GSU0_GSUC0_GSUWGMRR0_K1_LBSPPA2048_LBSPPB256_LPA0_MIWT4_2_PLR1_SU32_SUM0_SUS256_SKXCCM6_VWA4_VWB1_WGM8_WGMXCC1_WGMXCCGn1
    SolutionIndex: 139
    SolutionNameMin: Cijk_Ailk_Bljk_HHS_BH_UserArgs_MT128x64x128_MI16x16x1_SN_LDSB1_CLR1_GSU0_GSUC0_GSUWGMRR0_K1_LBSPPA2048_LBSPPB512_LPA0_MIWT4_2_PLR2_SU32_SUM0_SUS256_SKXCCM6_VWA4_VWB2_WGM8_WGMXCC1_WGMXCCGn1
    SolutionIndex: 140
    SolutionNameMin: Cijk_Ailk_Bljk_HHS_BH_UserArgs_MT64x64x128_MI16x16x1_SN_LDSB1_CLR1_GSU0_GSUC0_GSUWGMRR0_K1_LBSPPA1024_LBSPPB256_LPA32_MIWT2_2_PLR2_SU32_SUM0_SUS256_SKXCCM6_VWA2_VWB1_WGM1_WGMXCC1_WGMXCCGn1
    SolutionIndex: 141
    SolutionNameMin: Cijk_Ailk_Bljk_HHS_BH_UserArgs_MT64x64x128_MI16x16x1_SN_LDSB1_CLR1_GSU0_GSUC0_GSUWGMRR0_K1_LBSPPA1024_LBSPPB512_LPA32_MIWT2_2_PLR2_SU32_SUM0_SUS256_SKXCCM6_VWA2_VWB2_WGM1_WGMXCC1_WGMXCCGn1
    SolutionIndex: 142
    SolutionNameMin: Cijk_Ailk_Bljk_HHS_BH_UserArgs_MT64x64x128_MI16x16x1_SN_LDSB1_CLR1_GSU0_GSUC0_GSUWGMRR0_K1_LBSPPA1024_LBSPPB256_LPA32_MIWT2_2_PLR2_SU32_SUM0_SUS256_SKXCCM6_VWA2_VWB1_WGM4_WGMXCC1_WGMXCCGn1
    SolutionIndex: 143
    SolutionNameMin: Cijk_Ailk_Bljk_HHS_BH_UserArgs_MT64x64x128_MI16x16x1_SN_LDSB1_CLR1_GSU0_GSUC0_GSUWGMRR0_K1_LBSPPA1024_LBSPPB512_LPA32_MIWT2_2_PLR2_SU32_SUM0_SUS256_SKXCCM6_VWA2_VWB2_WGM4_WGMXCC1_WGMXCCGn1
    SolutionIndex: 144
    SolutionNameMin: Cijk_Ailk_Bljk_HHS_BH_UserArgs_MT64x32x128_MI16x16x1_SN_LDSB1_CLR1_GSU0_GSUC0_GSUWGMRR0_K1_LBSPPA1024_LBSPPB256_LPA32_MIWT2_1_PLR2_SU32_SUM0_SUS256_SKXCCM6_VWA2_VWB1_WGM1_WGMXCC1_WGMXCCGn1
    SolutionIndex: 145
    SolutionNameMin: Cijk_Ailk_Bljk_HHS_BH_UserArgs_MT64x32x128_MI16x16x1_SN_LDSB1_CLR1_GSU0_GSUC0_GSUWGMRR0_K1_LBSPPA1024_LBSPPB256_LPA32_MIWT2_1_PLR2_SU32_SUM0_SUS256_SKXCCM6_VWA2_VWB1_WGM8_WGMXCC1_WGMXCCGn1
    SolutionIndex: 146
    SolutionNameMin: Cijk_Ailk_Bljk_HHS_BH_UserArgs_MT32x32x128_MI16x16x1_SN_LDSB1_CLR1_GSU0_GSUC0_GSUWGMRR0_K1_LBSPPA512_LBSPPB256_LPA16_MIWT1_1_PLR1_SU32_SUM0_SUS256_SKXCCM6_VWA1_VWB1_WGM1_WGMXCC1_WGMXCCGn1
    SolutionIndex: 147
    SolutionNameMin: Cijk_Ailk_Bljk_HHS_BH_UserArgs_MT32x32x128_MI16x16x1_SN_LDSB1_CLR1_GSU0_GSUC0_GSUWGMRR0_K1_LBSPPA512_LBSPPB256_LPA16_MIWT1_1_PLR2_SU32_SUM0_SUS256_SKXCCM6_VWA1_VWB1_WGM1_WGMXCC1_WGMXCCGn1
    SolutionIndex: 148
    SolutionNameMin: Cijk_Ailk_Bljk_HHS_BH_UserArgs_MT32x32x32_MI16x16x1_SN_LDSB0_CLR1_GSU0_GSUC0_GSUWGMRR0_K1_LBSPPA256_LBSPPB128_LPA16_MIWT1_1_PLR1_SU32_SUM0_SUS256_SKXCCM0_VWA1_VWB1_WGM8_WGMXCC1_WGMXCCGn1
- - - [128, 128, 1, 128, 128, 128, 128, 128]
    - [8, 0.081]
  - - [128, 128, 1, 256, 128, 128, 128, 256]
    - [130, 0.153]
  - - [128, 128, 1, 512, 128, 128, 128, 512]
    - [56, 0.259]
  - - [128, 128, 1, 1024, 128, 128, 128, 1024]
    - [57, 0.394]
  - - [128, 128, 1, 2048, 128, 128, 128, 2048]
    - [55, 0.598]
  - - [128, 128, 1, 4096, 128, 128, 128, 4096]
    - [42, 1.026]
  - - [128, 128, 1, 8192, 128, 128, 128, 8192]
    - [146, 1.581]
  - - [128, 256, 1, 128, 128, 128, 128, 128]
    - [54, 0.174]
  - - [128, 256, 1, 256, 128, 128, 128, 256]
    - [55, 0.316]
  - - [128, 256, 1, 512, 128, 128, 128, 512]
    - [55, 0.533]
  - - [128, 256, 1, 1024, 128, 128, 128, 1024]
    - [55, 0.799]
  - - [128, 256, 1, 2048, 128, 128, 128, 2048]
    - [147, 1.173]
  - - [128, 256, 1, 4096, 128, 128, 128, 4096]
    - [129, 2.027]
  - - [128, 256, 1, 8192, 128, 128, 128, 8192]
    - [147, 3.119]
  - - [128, 512, 1, 128, 128, 128, 128, 128]
    - [42, 0.344]
  - - [128, 512, 1, 256, 128, 128, 128, 256]
    - [42, 0.625]
  - - [128, 512, 1, 512, 128, 128, 128, 512]
    - [55, 1.048]
  - - [128, 512, 1, 1024, 128, 128, 128, 1024]
    - [54, 1.588]
  - - [128, 512, 1, 2048, 128, 128, 128, 2048]
    - [54, 2.302]
  - - [128, 512, 1, 4096, 128, 128, 128, 4096]
    - [128, 3.484]
  - - [128, 512, 1, 8192, 128, 128, 128, 8192]
    - [144, 5.531]
  - - [128, 1024, 1, 128, 128, 128, 128, 128]
    - [42, 0.679]
  - - [128, 1024, 1, 256, 128, 128, 128, 256]
    - [42, 1.239]
  - - [128, 1024, 1, 512, 128, 128, 128, 512]
    - [54, 2.022]
  - - [128, 1024, 1, 1024, 128, 128, 128, 1024]
    - [55, 3.085]
  - - [128, 1024, 1, 2048, 128, 128, 128, 2048]
    - [144, 4.092]
  - - [128, 1024, 1, 4096, 128, 128, 128, 4096]
    - [144, 6.041]
  - - [128, 1024, 1, 8192, 128, 128, 128, 8192]
    - [51, 8.835]
  - - [128, 2048, 1, 128, 128, 128, 128, 128]
    - [41, 1.282]
  - - [128, 2048, 1, 256, 128, 128, 128, 256]
    - [41, 2.287]
  - - [128, 2048, 1, 512, 128, 128, 128, 512]
    - [52, 3.708]
  - - [128, 2048, 1, 1024, 128, 128, 128, 1024]
    - [52, 5.62]
  - - [128, 2048, 1, 2048, 128, 128, 128, 2048]
    - [140, 6.925]
  - - [128, 2048, 1, 4096, 128, 128, 128, 4096]
    - [140, 9.712]
  - - [128, 2048, 1, 8192, 128, 128, 128, 8192]
    - [44, 13.004]
  - - [128, 4096, 1, 128, 128, 128, 128, 128]
    - [49, 2.283]
  - - [128, 4096, 1, 256, 128, 128, 128, 256]
    - [39, 3.967]
  - - [128, 4096, 1, 512, 128, 128, 128, 512]
    - [48, 6.405]
  - - [128, 4096, 1, 1024, 128, 128, 128, 1024]
    - [48, 9.333]
  - - [128, 4096, 1, 2048, 128, 128, 128, 2048]
    - [135, 10.801]
  - - [128, 4096, 1, 4096, 128, 128, 128, 4096]
    - [124, 13.316]
  - - [128, 4096, 1, 8192, 128, 128, 128, 8192]
    - [46, 15.35]
  - - [128, 8192, 1, 128, 128, 128, 128, 128]
    - [6, 3.824]
  - - [128, 8192, 1, 256, 128, 128, 128, 256]
    - [37, 6.476]
  - - [128, 8192, 1, 512, 128, 128, 128, 512]
    - [37, 9.931]
  - - [128, 8192, 1, 1024, 128, 128, 128, 1024]
    - [134, 13.962]
  - - [128, 8192, 1, 2048, 128, 128, 128, 2048]
    - [124, 13.216]
  - - [128, 8192, 1, 4096, 128, 128, 128, 4096]
    - [28, 16.537]
  - - [128, 8192, 1, 8192, 128, 128, 128, 8192]
    - [45, 19.238]
  - - [256, 128, 1, 128, 256, 256, 256, 128]
    - [54, 0.174]
  - - [256, 128, 1, 256, 256, 256, 256, 256]
    - [129, 0.31]
  - - [256, 128, 1, 512, 256, 256, 256, 512]
    - [55, 0.53]
  - - [256, 128, 1, 1024, 256, 256, 256, 1024]
    - [55, 0.797]
  - - [256, 128, 1, 2048, 256, 256, 256, 2048]
    - [55, 1.186]
  - - [256, 128, 1, 4096, 256, 256, 256, 4096]
    - [129, 2.009]
  - - [256, 128, 1, 8192, 256, 256, 256, 8192]
    - [55, 3.067]
  - - [256, 256, 1, 128, 256, 256, 256, 128]
    - [42, 0.343]
  - - [256, 256, 1, 256, 256, 256, 256, 256]
    - [42, 0.627]
  - - [256, 256, 1, 512, 256, 256, 256, 512]
    - [54, 1.031]
  - - [256, 256, 1, 1024, 256, 256, 256, 1024]
    - [55, 1.565]
  - - [256, 256, 1, 2048, 256, 256, 256, 2048]
    - [54, 2.324]
  - - [256, 256, 1, 4096, 256, 256, 256, 4096]
    - [128, 3.473]
  - - [256, 256, 1, 8192, 256, 256, 256, 8192]
    - [52, 5.494]
  - - [256, 512, 1, 128, 256, 256, 256, 128]
    - [42, 0.677]
  - - [256, 512, 1, 256, 256, 256, 256, 256]
    - [42, 1.227]
  - - [256, 512, 1, 512, 256, 256, 256, 512]
    - [54, 2.019]
  - - [256, 512, 1, 1024, 256, 256, 256, 1024]
    - [54, 3.117]
  - - [256, 512, 1, 2048, 256, 256, 256, 2048]
    - [144, 4.088]
  - - [256, 512, 1, 4096, 256, 256, 256, 4096]
    - [144, 6.052]
  - - [256, 512, 1, 8192, 256, 256, 256, 8192]
    - [47, 8.113]
  - - [256, 1024, 1, 128, 256, 256, 256, 128]
    - [41, 1.294]
  - - [256, 1024, 1, 256, 256, 256, 256, 256]
    - [41, 2.272]
  - - [256, 1024, 1, 512, 256, 256, 256, 512]
    - [52, 3.735]
  - - [256, 1024, 1, 1024, 256, 256, 256, 1024]
    - [52, 5.595]
  - - [256, 1024, 1, 2048, 256, 256, 256, 2048]
    - [140, 6.928]
  - - [256, 1024, 1, 4096, 256, 256, 256, 4096]
    - [125, 9.641]
  - - [256, 1024, 1, 8192, 256, 256, 256, 8192]
    - [135, 12.541]
  - - [256, 2048, 1, 128, 256, 256, 256, 128]
    - [49, 2.273]
  - - [256, 2048, 1, 256, 256, 256, 256, 256]
    - [48, 3.915]
  - - [256, 2048, 1, 512, 256, 256, 256, 512]
    - [48, 6.384]
  - - [256, 2048, 1, 1024, 256, 256, 256, 1024]
    - [49, 9.281]
  - - [256, 2048, 1, 2048, 256, 256, 256, 2048]
    - [141, 10.857]
  - - [256, 2048, 1, 4096, 256, 256, 256, 4096]
    - [124, 13.854]
  - - [256, 2048, 1, 8192, 256, 256, 256, 8192]
    - [103, 15.418]
  - - [256, 4096, 1, 128, 256, 256, 256, 128]
    - [6, 3.781]
  - - [256, 4096, 1, 256, 256, 256, 256, 256]
    - [36, 6.402]
  - - [256, 4096, 1, 512, 256, 256, 256, 512]
    - [44, 9.942]
  - - [256, 4096, 1, 1024, 256, 256, 256, 1024]
    - [134, 14.031]
  - - [256, 4096, 1, 2048, 256, 256, 256, 2048]
    - [124, 14.25]
  - - [256, 4096, 1, 4096, 256, 256, 256, 4096]
    - [104, 16.496]
  - - [256, 4096, 1, 8192, 256, 256, 256, 8192]
    - [22, 18.606]
  - - [256, 8192, 1, 128, 256, 256, 256, 128]
    - [27, 5.732]
  - - [256, 8192, 1, 256, 256, 256, 256, 256]
    - [98, 9.51]
  - - [256, 8192, 1, 512, 256, 256, 256, 512]
    - [99, 14.575]
  - - [256, 8192, 1, 1024, 256, 256, 256, 1024]
    - [131, 14.097]
  - - [256, 8192, 1, 2048, 256, 256, 256, 2048]
    - [111, 16.867]
  - - [256, 8192, 1, 4096, 256, 256, 256, 4096]
    - [97, 20.639]
  - - [256, 8192, 1, 8192, 256, 256, 256, 8192]
    - [13, 23.605]
  - - [512, 128, 1, 128, 512, 512, 512, 128]
    - [54, 0.341]
  - - [512, 128, 1, 256, 512, 512, 512, 256]
    - [42, 0.626]
  - - [512, 128, 1, 512, 512, 512, 512, 512]
    - [42, 1.028]
  - - [512, 128, 1, 1024, 512, 512, 512, 1024]
    - [55, 1.572]
  - - [512, 128, 1, 2048, 512, 512, 512, 2048]
    - [54, 2.305]
  - - [512, 128, 1, 4096, 512, 512, 512, 4096]
    - [41, 3.412]
  - - [512, 128, 1, 8192, 512, 512, 512, 8192]
    - [145, 5.031]
  - - [512, 256, 1, 128, 512, 512, 512, 128]
    - [42, 0.657]
  - - [512, 256, 1, 256, 512, 512, 512, 256]
    - [54, 1.199]
  - - [512, 256, 1, 512, 512, 512, 512, 512]
    - [54, 2.022]
  - - [512, 256, 1, 1024, 512, 512, 512, 1024]
    - [146, 3.018]
  - - [512, 256, 1, 2048, 512, 512, 512, 2048]
    - [144, 4.053]
  - - [512, 256, 1, 4096, 512, 512, 512, 4096]
    - [53, 5.909]
  - - [512, 256, 1, 8192, 512, 512, 512, 8192]
    - [50, 8.045]
  - - [512, 512, 1, 128, 512, 512, 512, 128]
    - [41, 1.261]
  - - [512, 512, 1, 256, 512, 512, 512, 256]
    - [41, 2.247]
  - - [512, 512, 1, 512, 512, 512, 512, 512]
    - [52, 3.7]
  - - [512, 512, 1, 1024, 512, 512, 512, 1024]
    - [52, 5.573]
  - - [512, 512, 1, 2048, 512, 512, 512, 2048]
    - [141, 6.889]
  - - [512, 512, 1, 4096, 512, 512, 512, 4096]
    - [37, 9.573]
  - - [512, 512, 1, 8192, 512, 512, 512, 8192]
    - [136, 12.366]
  - - [512, 1024, 1, 128, 512, 512, 512, 128]
    - [40, 2.265]
  - - [512, 1024, 1, 256, 512, 512, 512, 256]
    - [49, 3.932]
  - - [512, 1024, 1, 512, 512, 512, 512, 512]
    - [49, 6.386]
  - - [512, 1024, 1, 1024, 512, 512, 512, 1024]
    - [49, 9.264]
  - - [512, 1024, 1, 2048, 512, 512, 512, 2048]
    - [141, 10.864]
  - - [512, 1024, 1, 4096, 512, 512, 512, 4096]
    - [99, 13.181]
  - - [512, 1024, 1, 8192, 512, 512, 512, 8192]
    - [99, 15.271]
  - - [512, 2048, 1, 128, 512, 512, 512, 128]
    - [77, 3.721]
  - - [512, 2048, 1, 256, 512, 512, 512, 256]
    - [32, 6.311]
  - - [512, 2048, 1, 512, 512, 512, 512, 512]
    - [45, 9.82]
  - - [512, 2048, 1, 1024, 512, 512, 512, 1024]
    - [134, 13.971]
  - - [512, 2048, 1, 2048, 512, 512, 512, 2048]
    - [125, 14.535]
  - - [512, 2048, 1, 4096, 512, 512, 512, 4096]
    - [29, 15.838]
  - - [512, 2048, 1, 8192, 512, 512, 512, 8192]
    - [79, 18.0]
  - - [512, 4096, 1, 128, 512, 512, 512, 128]
    - [27, 5.782]
  - - [512, 4096, 1, 256, 512, 512, 512, 256]
    - [102, 9.545]
  - - [512, 4096, 1, 512, 512, 512, 512, 512]
    - [102, 14.591]
  - - [512, 4096, 1, 1024, 512, 512, 512, 1024]
    - [124, 14.806]
  - - [512, 4096, 1, 2048, 512, 512, 512, 2048]
    - [125, 17.026]
  - - [512, 4096, 1, 4096, 512, 512, 512, 4096]
    - [23, 19.101]
  - - [512, 4096, 1, 8192, 512, 512, 512, 8192]
    - [20, 21.497]
  - - [512, 8192, 1, 128, 512, 512, 512, 128]
    - [2, 8.124]
  - - [512, 8192, 1, 256, 512, 512, 512, 256]
    - [73, 12.774]
  - - [512, 8192, 1, 512, 512, 512, 512, 512]
    - [90, 17.654]
  - - [512, 8192, 1, 1024, 512, 512, 512, 1024]
    - [99, 17.403]
  - - [512, 8192, 1, 2048, 512, 512, 512, 2048]
    - [102, 20.795]
  - - [512, 8192, 1, 4096, 512, 512, 512, 4096]
    - [15, 24.238]
  - - [512, 8192, 1, 8192, 512, 512, 512, 8192]
    - [18, 26.058]
  - - [1024, 128, 1, 128, 1024, 1024, 1024, 128]
    - [42, 0.664]
  - - [1024, 128, 1, 256, 1024, 1024, 1024, 256]
    - [54, 1.205]
  - - [1024, 128, 1, 512, 1024, 1024, 1024, 512]
    - [54, 2.011]
  - - [1024, 128, 1, 1024, 1024, 1024, 1024, 1024]
    - [54, 3.087]
  - - [1024, 128, 1, 2048, 1024, 1024, 1024, 2048]
    - [52, 4.071]
  - - [1024, 128, 1, 4096, 1024, 1024, 1024, 4096]
    - [40, 5.666]
  - - [1024, 128, 1, 8192, 1024, 1024, 1024, 8192]
    - [143, 8.057]
  - - [1024, 256, 1, 128, 1024, 1024, 1024, 128]
    - [41, 1.274]
  - - [1024, 256, 1, 256, 1024, 1024, 1024, 256]
    - [52, 2.203]
  - - [1024, 256, 1, 512, 1024, 1024, 1024, 512]
    - [52, 3.67]
  - - [1024, 256, 1, 1024, 1024, 1024, 1024, 1024]
    - [52, 5.56]
  - - [1024, 256, 1, 2048, 1024, 1024, 1024, 2048]
    - [49, 6.82]
  - - [1024, 256, 1, 4096, 1024, 1024, 1024, 4096]
    - [127, 9.114]
  - - [1024, 256, 1, 8192, 1024, 1024, 1024, 8192]
    - [137, 12.397]
  - - [1024, 512, 1, 128, 1024, 1024, 1024, 128]
    - [39, 2.265]
  - - [1024, 512, 1, 256, 1024, 1024, 1024, 256]
    - [49, 3.868]
  - - [1024, 512, 1, 512, 1024, 1024, 1024, 512]
    - [48, 6.394]
  - - [1024, 512, 1, 1024, 1024, 1024, 1024, 1024]
    - [48, 9.277]
  - - [1024, 512, 1, 2048, 1024, 1024, 1024, 2048]
    - [44, 10.653]
  - - [1024, 512, 1, 4096, 1024, 1024, 1024, 4096]
    - [108, 13.219]
  - - [1024, 512, 1, 8192, 1024, 1024, 1024, 8192]
    - [102, 14.955]
  - - [1024, 1024, 1, 128, 1024, 1024, 1024, 128]
    - [6, 3.794]
  - - [1024, 1024, 1, 256, 1024, 1024, 1024, 256]
    - [36, 6.43]
  - - [1024, 1024, 1, 512, 1024, 1024, 1024, 512]
    - [37, 9.976]
  - - [1024, 1024, 1, 1024, 1024, 1024, 1024, 1024]
    - [135, 13.965]
  - - [1024, 1024, 1, 2048, 1024, 1024, 1024, 2048]
    - [142, 13.257]
  - - [1024, 1024, 1, 4096, 1024, 1024, 1024, 4096]
    - [101, 15.466]
  - - [1024, 1024, 1, 8192, 1024, 1024, 1024, 8192]
    - [85, 17.934]
  - - [1024, 2048, 1, 128, 1024, 1024, 1024, 128]
    - [27, 5.786]
  - - [1024, 2048, 1, 256, 1024, 1024, 1024, 256]
    - [102, 9.538]
  - - [1024, 2048, 1, 512, 1024, 1024, 1024, 512]
    - [102, 14.562]
  - - [1024, 2048, 1, 1024, 1024, 1024, 1024, 1024]
    - [124, 14.357]
  - - [1024, 2048, 1, 2048, 1024, 1024, 1024, 2048]
    - [119, 16.604]
  - - [1024, 2048, 1, 4096, 1024, 1024, 1024, 4096]
    - [19, 19.184]
  - - [1024, 2048, 1, 8192, 1024, 1024, 1024, 8192]
    - [19, 20.953]
  - - [1024, 4096, 1, 128, 1024, 1024, 1024, 128]
    - [76, 8.299]
  - - [1024, 4096, 1, 256, 1024, 1024, 1024, 256]
    - [76, 12.867]
  - - [1024, 4096, 1, 512, 1024, 1024, 1024, 512]
    - [90, 17.573]
  - - [1024, 4096, 1, 1024, 1024, 1024, 1024, 1024]
    - [99, 17.409]
  - - [1024, 4096, 1, 2048, 1024, 1024, 1024, 2048]
    - [101, 19.987]
  - - [1024, 4096, 1, 4096, 1024, 1024, 1024, 4096]
    - [20, 22.313]
  - - [1024, 4096, 1, 8192, 1024, 1024, 1024, 8192]
    - [15, 24.252]
  - - [1024, 8192, 1, 128, 1024, 1024, 1024, 128]
    - [66, 9.321]
  - - [1024, 8192, 1, 256, 1024, 1024, 1024, 256]
    - [66, 14.521]
  - - [1024, 8192, 1, 512, 1024, 1024, 1024, 512]
    - [101, 16.402]
  - - [1024, 8192, 1, 1024, 1024, 1024, 1024, 1024]
    - [105, 20.783]
  - - [1024, 8192, 1, 2048, 1024, 1024, 1024, 2048]
    - [17, 23.527]
  - - [1024, 8192, 1, 4096, 1024, 1024, 1024, 4096]
    - [14, 25.196]
  - - [1024, 8192, 1, 8192, 1024, 1024, 1024, 8192]
    - [64, 25.912]
  - - [2048, 128, 1, 128, 2048, 2048, 2048, 128]
    - [41, 1.269]
  - - [2048, 128, 1, 256, 2048, 2048, 2048, 256]
    - [41, 2.25]
  - - [2048, 128, 1, 512, 2048, 2048, 2048, 512]
    - [52, 3.681]
  - - [2048, 128, 1, 1024, 2048, 2048, 2048, 1024]
    - [52, 5.518]
  - - [2048, 128, 1, 2048, 2048, 2048, 2048, 2048]
    - [51, 6.395]
  - - [2048, 128, 1, 4096, 2048, 2048, 2048, 4096]
    - [126, 9.182]
  - - [2048, 128, 1, 8192, 2048, 2048, 2048, 8192]
    - [139, 12.263]
  - - [2048, 256, 1, 128, 2048, 2048, 2048, 128]
    - [7, 2.26]
  - - [2048, 256, 1, 256, 2048, 2048, 2048, 256]
    - [40, 3.928]
  - - [2048, 256, 1, 512, 2048, 2048, 2048, 512]
    - [49, 6.361]
  - - [2048, 256, 1, 1024, 2048, 2048, 2048, 1024]
    - [48, 9.309]
  - - [2048, 256, 1, 2048, 2048, 2048, 2048, 2048]
    - [137, 10.158]
  - - [2048, 256, 1, 4096, 2048, 2048, 2048, 4096]
    - [106, 13.182]
  - - [2048, 256, 1, 8192, 2048, 2048, 2048, 8192]
    - [106, 14.992]
  - - [2048, 512, 1, 128, 2048, 2048, 2048, 128]
    - [6, 3.79]
  - - [2048, 512, 1, 256, 2048, 2048, 2048, 256]
    - [32, 6.354]
  - - [2048, 512, 1, 512, 2048, 2048, 2048, 512]
    - [38, 9.768]
  - - [2048, 512, 1, 1024, 2048, 2048, 2048, 1024]
    - [43, 13.881]
  - - [2048, 512, 1, 2048, 2048, 2048, 2048, 2048]
    - [35, 13.038]
  - - [2048, 512, 1, 4096, 2048, 2048, 2048, 4096]
    - [117, 15.956]
  - - [2048, 512, 1, 8192, 2048, 2048, 2048, 8192]
    - [85, 18.354]
  - - [2048, 1024, 1, 128, 2048, 2048, 2048, 128]
    - [25, 5.729]
  - - [2048, 1024, 1, 256, 2048, 2048, 2048, 256]
    - [100, 9.59]
  - - [2048, 1024, 1, 512, 2048, 2048, 2048, 512]
    - [101, 14.592]
  - - [2048, 1024, 1, 1024, 2048, 2048, 2048, 1024]
    - [121, 14.215]
  - - [2048, 1024, 1, 2048, 2048, 2048, 2048, 2048]
    - [132, 17.091]
  - - [2048, 1024, 1, 4096, 2048, 2048, 2048, 4096]
    - [83, 19.409]
  - - [2048, 1024, 1, 8192, 2048, 2048, 2048, 8192]
    - [12, 20.364]
  - - [2048, 2048, 1, 128, 2048, 2048, 2048, 128]
    - [4, 7.984]
  - - [2048, 2048, 1, 256, 2048, 2048, 2048, 256]
    - [72, 12.69]
  - - [2048, 2048, 1, 512, 2048, 2048, 2048, 512]
    - [91, 17.308]
  - - [2048, 2048, 1, 1024, 2048, 2048, 2048, 1024]
    - [118, 17.251]
  - - [2048, 2048, 1, 2048, 2048, 2048, 2048, 2048]
    - [108, 19.922]
  - - [2048, 2048, 1, 4096, 2048, 2048, 2048, 4096]
    - [81, 22.229]
  - - [2048, 2048, 1, 8192, 2048, 2048, 2048, 8192]
    - [85, 24.779]
  - - [2048, 4096, 1, 128, 2048, 2048, 2048, 128]
    - [65, 9.387]
  - - [2048, 4096, 1, 256, 2048, 2048, 2048, 256]
    - [65, 14.426]
  - - [2048, 4096, 1, 512, 2048, 2048, 2048, 512]
    - [99, 16.526]
  - - [2048, 4096, 1, 1024, 2048, 2048, 2048, 1024]
    - [85, 20.468]
  - - [2048, 4096, 1, 2048, 2048, 2048, 2048, 2048]
    - [78, 23.721]
  - - [2048, 4096, 1, 4096, 2048, 2048, 2048, 4096]
    - [81, 24.583]
  - - [2048, 4096, 1, 8192, 2048, 2048, 2048, 8192]
    - [71, 26.825]
  - - [2048, 8192, 1, 128, 2048, 2048, 2048, 128]
    - [101, 9.064]
  - - [2048, 8192, 1, 256, 2048, 2048, 2048, 256]
    - [99, 14.038]
  - - [2048, 8192, 1, 512, 2048, 2048, 2048, 512]
    - [102, 19.057]
  - - [2048, 8192, 1, 1024, 2048, 2048, 2048, 1024]
    - [82, 22.635]
  - - [2048, 8192, 1, 2048, 2048, 2048, 2048, 2048]
    - [87, 24.728]
  - - [2048, 8192, 1, 4096, 2048, 2048, 2048, 4096]
    - [92, 26.718]
  - - [2048, 8192, 1, 8192, 2048, 2048, 2048, 8192]
    - [84, 28.768]
  - - [4096, 128, 1, 128, 4096, 4096, 4096, 128]
    - [39, 2.278]
  - - [4096, 128, 1, 256, 4096, 4096, 4096, 256]
    - [39, 3.937]
  - - [4096, 128, 1, 512, 4096, 4096, 4096, 512]
    - [49, 6.395]
  - - [4096, 128, 1, 1024, 4096, 4096, 4096, 1024]
    - [142, 9.064]
  - - [4096, 128, 1, 2048, 4096, 4096, 4096, 2048]
    - [39, 10.273]
  - - [4096, 128, 1, 4096, 4096, 4096, 4096, 4096]
    - [24, 12.865]
  - - [4096, 128, 1, 8192, 4096, 4096, 4096, 8192]
    - [108, 15.573]
  - - [4096, 256, 1, 128, 4096, 4096, 4096, 128]
    - [5, 3.801]
  - - [4096, 256, 1, 256, 4096, 4096, 4096, 256]
    - [125, 6.344]
  - - [4096, 256, 1, 512, 4096, 4096, 4096, 512]
    - [126, 9.716]
  - - [4096, 256, 1, 1024, 4096, 4096, 4096, 1024]
    - [139, 13.837]
  - - [4096, 256, 1, 2048, 4096, 4096, 4096, 2048]
    - [33, 13.698]
  - - [4096, 256, 1, 4096, 4096, 4096, 4096, 4096]
    - [111, 16.67]
  - - [4096, 256, 1, 8192, 4096, 4096, 4096, 8192]
    - [85, 18.668]
  - - [4096, 512, 1, 128, 4096, 4096, 4096, 128]
    - [30, 5.628]
  - - [4096, 512, 1, 256, 4096, 4096, 4096, 256]
    - [30, 9.546]
  - - [4096, 512, 1, 512, 4096, 4096, 4096, 512]
    - [114, 14.429]
  - - [4096, 512, 1, 1024, 4096, 4096, 4096, 1024]
    - [138, 14.186]
  - - [4096, 512, 1, 2048, 4096, 4096, 4096, 2048]
    - [123, 17.152]
  - - [4096, 512, 1, 4096, 4096, 4096, 4096, 4096]
    - [95, 20.245]
  - - [4096, 512, 1, 8192, 4096, 4096, 4096, 8192]
    - [83, 21.698]
  - - [4096, 1024, 1, 128, 4096, 4096, 4096, 128]
    - [75, 8.257]
  - - [4096, 1024, 1, 256, 4096, 4096, 4096, 256]
    - [75, 13.009]
  - - [4096, 1024, 1, 512, 4096, 4096, 4096, 512]
    - [93, 17.267]
  - - [4096, 1024, 1, 1024, 4096, 4096, 4096, 1024]
    - [109, 17.812]
  - - [4096, 1024, 1, 2048, 4096, 4096, 4096, 2048]
    - [106, 20.578]
  - - [4096, 1024, 1, 4096, 4096, 4096, 4096, 4096]
    - [81, 23.305]
  - - [4096, 1024, 1, 8192, 4096, 4096, 4096, 8192]
    - [85, 25.063]
  - - [4096, 2048, 1, 128, 4096, 4096, 4096, 128]
    - [63, 9.521]
  - - [4096, 2048, 1, 256, 4096, 4096, 4096, 256]
    - [63, 14.814]
  - - [4096, 2048, 1, 512, 4096, 4096, 4096, 512]
    - [116, 16.064]
  - - [4096, 2048, 1, 1024, 4096, 4096, 4096, 1024]
    - [87, 20.742]
  - - [4096, 2048, 1, 2048, 4096, 4096, 4096, 2048]
    - [79, 25.214]
  - - [4096, 2048, 1, 4096, 4096, 4096, 4096, 4096]
    - [82, 26.742]
  - - [4096, 2048, 1, 8192, 4096, 4096, 4096, 8192]
    - [83, 27.981]
  - - [4096, 4096, 1, 128, 4096, 4096, 4096, 128]
    - [101, 9.093]
  - - [4096, 4096, 1, 256, 4096, 4096, 4096, 256]
    - [107, 13.639]
  - - [4096, 4096, 1, 512, 4096, 4096, 4096, 512]
    - [112, 18.452]
  - - [4096, 4096, 1, 1024, 4096, 4096, 4096, 1024]
    - [86, 23.246]
  - - [4096, 4096, 1, 2048, 4096, 4096, 4096, 2048]
    - [80, 25.29]
  - - [4096, 4096, 1, 4096, 4096, 4096, 4096, 4096]
    - [79, 30.551]
  - - [4096, 4096, 1, 8192, 4096, 4096, 4096, 8192]
    - [58, 29.775]
  - - [4096, 8192, 1, 128, 4096, 4096, 4096, 128]
    - [99, 10.913]
  - - [4096, 8192, 1, 256, 4096, 4096, 4096, 256]
    - [79, 15.442]
  - - [4096, 8192, 1, 512, 4096, 4096, 4096, 512]
    - [79, 20.223]
  - - [4096, 8192, 1, 1024, 4096, 4096, 4096, 1024]
    - [93, 24.151]
  - - [4096, 8192, 1, 2048, 4096, 4096, 4096, 2048]
    - [71, 28.047]
  - - [4096, 8192, 1, 4096, 4096, 4096, 4096, 4096]
    - [70, 31.205]
  - - [4096, 8192, 1, 8192, 4096, 4096, 4096, 8192]
    - [85, 33.786]
  - - [8192, 128, 1, 128, 8192, 8192, 8192, 128]
    - [77, 3.818]
  - - [8192, 128, 1, 256, 8192, 8192, 8192, 256]
    - [124, 6.362]
  - - [8192, 128, 1, 512, 8192, 8192, 8192, 512]
    - [43, 9.73]
  - - [8192, 128, 1, 1024, 8192, 8192, 8192, 1024]
    - [137, 12.733]
  - - [8192, 128, 1, 2048, 8192, 8192, 8192, 2048]
    - [34, 13.383]
  - - [8192, 128, 1, 4096, 8192, 8192, 8192, 4096]
    - [122, 16.268]
  - - [8192, 128, 1, 8192, 8192, 8192, 8192, 8192]
    - [31, 18.768]
  - - [8192, 256, 1, 128, 8192, 8192, 8192, 128]
    - [30, 5.631]
  - - [8192, 256, 1, 256, 8192, 8192, 8192, 256]
    - [30, 9.509]
  - - [8192, 256, 1, 512, 8192, 8192, 8192, 512]
    - [107, 14.262]
  - - [8192, 256, 1, 1024, 8192, 8192, 8192, 1024]
    - [120, 14.607]
  - - [8192, 256, 1, 2048, 8192, 8192, 8192, 2048]
    - [133, 17.611]
  - - [8192, 256, 1, 4096, 8192, 8192, 8192, 4096]
    - [21, 20.438]
  - - [8192, 256, 1, 8192, 8192, 8192, 8192, 8192]
    - [10, 23.777]
  - - [8192, 512, 1, 128, 8192, 8192, 8192, 128]
    - [2, 7.932]
  - - [8192, 512, 1, 256, 8192, 8192, 8192, 256]
    - [75, 12.429]
  - - [8192, 512, 1, 512, 8192, 8192, 8192, 512]
    - [94, 17.262]
  - - [8192, 512, 1, 1024, 8192, 8192, 8192, 1024]
    - [116, 16.916]
  - - [8192, 512, 1, 2048, 8192, 8192, 8192, 2048]
    - [96, 20.784]
  - - [8192, 512, 1, 4096, 8192, 8192, 8192, 4096]
    - [79, 26.017]
  - - [8192, 512, 1, 8192, 8192, 8192, 8192, 8192]
    - [85, 27.573]
  - - [8192, 1024, 1, 128, 8192, 8192, 8192, 128]
    - [69, 9.032]
  - - [8192, 1024, 1, 256, 8192, 8192, 8192, 256]
    - [66, 14.046]
  - - [8192, 1024, 1, 512, 8192, 8192, 8192, 512]
    - [110, 16.083]
  - - [8192, 1024, 1, 1024, 8192, 8192, 8192, 1024]
    - [112, 20.343]
  - - [8192, 1024, 1, 2048, 8192, 8192, 8192, 2048]
    - [85, 24.201]
  - - [8192, 1024, 1, 4096, 8192, 8192, 8192, 4096]
    - [84, 26.947]
  - - [8192, 1024, 1, 8192, 8192, 8192, 8192, 8192]
    - [60, 28.118]
  - - [8192, 2048, 1, 128, 8192, 8192, 8192, 128]
    - [115, 8.643]
  - - [8192, 2048, 1, 256, 8192, 8192, 8192, 256]
    - [114, 13.524]
  - - [8192, 2048, 1, 512, 8192, 8192, 8192, 512]
    - [113, 19.881]
  - - [8192, 2048, 1, 1024, 8192, 8192, 8192, 1024]
    - [88, 22.442]
  - - [8192, 2048, 1, 2048, 8192, 8192, 8192, 2048]
    - [11, 26.094]
  - - [8192, 2048, 1, 4096, 8192, 8192, 8192, 4096]
    - [61, 30.11]
  - - [8192, 2048, 1, 8192, 8192, 8192, 8192, 8192]
    - [59, 30.615]
  - - [8192, 4096, 1, 128, 8192, 8192, 8192, 128]
    - [26, 10.311]
  - - [8192, 4096, 1, 256, 8192, 8192, 8192, 256]
    - [89, 15.324]
  - - [8192, 4096, 1, 512, 8192, 8192, 8192, 512]
    - [74, 20.368]
  - - [8192, 4096, 1, 1024, 8192, 8192, 8192, 1024]
    - [68, 24.752]
  - - [8192, 4096, 1, 2048, 8192, 8192, 8192, 2048]
    - [59, 29.539]
  - - [8192, 4096, 1, 4096, 8192, 8192, 8192, 4096]
    - [58, 34.117]
  - - [8192, 4096, 1, 8192, 8192, 8192, 8192, 8192]
    - [70, 34.327]
  - - [8192, 8192, 1, 128, 8192, 8192, 8192, 128]
    - [16, 10.686]
  - - [8192, 8192, 1, 256, 8192, 8192, 8192, 256]
    - [3, 14.862]
  - - [8192, 8192, 1, 512, 8192, 8192, 8192, 512]
    - [9, 20.523]
  - - [8192, 8192, 1, 1024, 8192, 8192, 8192, 1024]
    - [0, 26.682]
  - - [8192, 8192, 1, 2048, 8192, 8192, 8192, 2048]
    - [67, 31.216]
  - - [8192, 8192, 1, 4096, 8192, 8192, 8192, 4096]
    - [1, 33.905]
  - - [8192, 8192, 1, 8192, 8192, 8192, 8192, 8192]
    - [62, 36.424]
  - - [1, 1, 1, 32, 1, 1, 1, 32]
    - [148, 0.0]
- null
- null
- ExperimentalStreamK
- GridBased
