library/src/amd_detail/rocblaslt/src/Tensile/Logic/asm_full/aquavanjaram/gfx942_228cu/StreamK/aquavanjaram942_Cijk_Alik_Bljk_BSS_BH_UserArgs.yaml
- {MinimumRequiredVersion: 4.33.0}
- aquavanjaram942
- {Architecture: gfx942, CUCount: 228}
- [Device 0049, Device 0050]
    SolutionIndex: 0
    SolutionNameMin: Cijk_Alik_Bljk_BSS_BH_UserArgs_MT128x128x32_MI16x16x1_SN_LDSB1_CLR1_GSU0_GSUC0_GSUWGMRR0_K1_LBSPPA256_LBSPPB128_MIWT4_4_PLR1_SU32_SUM0_SUS256_SKXCCM0_VWA4_VWB1_WGM8_WGMXCC1_WGMXCCGn1
    SolutionIndex: 1
    SolutionNameMin: Cijk_Alik_Bljk_BSS_BH_UserArgs_MT256x64x64_MI16x16x1_SN_LDSB1_CLR1_GSU0_GSUC0_GSUWGMRR0_K1_LBSPPA512_LBSPPB128_MIWT8_2_PLR1_SU32_SUM0_SUS256_SKXCCM0_VWA4_VWB1_WGM1_WGMXCC1_WGMXCCGn1
    SolutionIndex: 2
    SolutionNameMin: Cijk_Alik_Bljk_BSS_BH_UserArgs_MT256x64x64_MI16x16x1_SN_LDSB1_CLR1_GSU0_GSUC0_GSUWGMRR0_K1_LBSPPA256_LBSPPB256_MIWT8_2_PLR1_SU32_SUM0_SUS256_SKXCCM0_VWA2_VWB2_WGM1_WGMXCC1_WGMXCCGn1
    SolutionIndex: 3
    SolutionNameMin: Cijk_Alik_Bljk_BSS_BH_UserArgs_MT256x64x64_MI16x16x1_SN_LDSB1_CLR1_GSU0_GSUC0_GSUWGMRR0_K1_LBSPPA512_LBSPPB256_MIWT8_2_PLR1_SU32_SUM0_SUS256_SKXCCM0_VWA4_VWB2_WGM1_WGMXCC1_WGMXCCGn1
    SolutionIndex: 4
    SolutionNameMin: Cijk_Alik_Bljk_BSS_BH_UserArgs_MT256x64x64_MI16x16x1_SN_LDSB1_CLR1_GSU0_GSUC0_GSUWGMRR0_K1_LBSPPA512_LBSPPB128_MIWT8_2_PLR1_SU32_SUM0_SUS256_SKXCCM0_VWA4_VWB1_WGM4_WGMXCC1_WGMXCCGn1
    SolutionIndex: 5
    SolutionNameMin: Cijk_Alik_Bljk_BSS_BH_UserArgs_MT256x64x64_MI16x16x1_SN_LDSB1_CLR1_GSU0_GSUC0_GSUWGMRR0_K1_LBSPPA512_LBSPPB256_MIWT8_2_PLR1_SU32_SUM0_SUS256_SKXCCM0_VWA4_VWB2_WGM8_WGMXCC1_WGMXCCGn1
    SolutionIndex: 6
    SolutionNameMin: Cijk_Alik_Bljk_BSS_BH_UserArgs_MT128x128x64_MI16x16x1_SN_LDSB1_CLR1_GSU0_GSUC0_GSUWGMRR0_K1_LBSPPA128_LBSPPB128_MIWT4_4_PLR1_SU32_SUM0_SUS256_SKXCCM0_VWA1_VWB1_WGM1_WGMXCC1_WGMXCCGn1
    SolutionIndex: 7
    SolutionNameMin: Cijk_Alik_Bljk_BSS_BH_UserArgs_MT128x128x64_MI16x16x1_SN_LDSB1_CLR1_GSU0_GSUC0_GSUWGMRR0_K1_LBSPPA512_LBSPPB128_MIWT4_4_PLR1_SU32_SUM0_SUS256_SKXCCM0_VWA4_VWB1_WGM1_WGMXCC1_WGMXCCGn1
    SolutionIndex: 8
    SolutionNameMin: Cijk_Alik_Bljk_BSS_BH_UserArgs_MT128x128x64_MI16x16x1_SN_LDSB1_CLR1_GSU0_GSUC0_GSUWGMRR0_K1_LBSPPA128_LBSPPB256_MIWT4_4_PLR1_SU32_SUM0_SUS256_SKXCCM0_VWA1_VWB2_WGM1_WGMXCC1_WGMXCCGn1
    SolutionIndex: 9
    SolutionNameMin: Cijk_Alik_Bljk_BSS_BH_UserArgs_MT128x128x64_MI16x16x1_SN_LDSB1_CLR1_GSU0_GSUC0_GSUWGMRR0_K1_LBSPPA512_LBSPPB256_MIWT4_4_PLR1_SU32_SUM0_SUS256_SKXCCM0_VWA4_VWB2_WGM1_WGMXCC1_WGMXCCGn1
    SolutionIndex: 10
    SolutionNameMin: Cijk_Alik_Bljk_BSS_BH_UserArgs_MT128x128x64_MI16x16x1_SN_LDSB1_CLR1_GSU0_GSUC0_GSUWGMRR0_K1_LBSPPA512_LBSPPB512_MIWT4_4_PLR1_SU32_SUM0_SUS256_SKXCCM0_VWA4_VWB4_WGM1_WGMXCC1_WGMXCCGn1
    SolutionIndex: 11
    SolutionNameMin: Cijk_Alik_Bljk_BSS_BH_UserArgs_MT128x128x64_MI16x16x1_SN_LDSB1_CLR1_GSU0_GSUC0_GSUWGMRR0_K1_LBSPPA128_LBSPPB128_MIWT4_4_PLR2_SU32_SUM0_SUS256_SKXCCM0_VWA1_VWB1_WGM1_WGMXCC1_WGMXCCGn1
    SolutionIndex: 12
    SolutionNameMin: Cijk_Alik_Bljk_BSS_BH_UserArgs_MT128x128x64_MI16x16x1_SN_LDSB1_CLR1_GSU0_GSUC0_GSUWGMRR0_K1_LBSPPA512_LBSPPB128_MIWT4_4_PLR1_SU32_SUM0_SUS256_SKXCCM0_VWA4_VWB1_WGM8_WGMXCC1_WGMXCCGn1
    SolutionIndex: 13
    SolutionNameMin: Cijk_Alik_Bljk_BSS_BH_UserArgs_MT128x128x64_MI16x16x1_SN_LDSB1_CLR1_GSU0_GSUC0_GSUWGMRR0_K1_LBSPPA512_LBSPPB256_MIWT4_4_PLR1_SU32_SUM0_SUS256_SKXCCM0_VWA4_VWB2_WGM8_WGMXCC1_WGMXCCGn1
    SolutionIndex: 14
    SolutionNameMin: Cijk_Alik_Bljk_BSS_BH_UserArgs_MT64x128x64_MI16x16x1_SN_LDSB1_CLR1_GSU0_GSUC0_GSUWGMRR0_K1_LBSPPA128_LBSPPB128_MIWT2_4_PLR1_SU32_SUM0_SUS256_SKXCCM0_VWA1_VWB1_WGM1_WGMXCC1_WGMXCCGn1
    SolutionIndex: 15
    SolutionNameMin: Cijk_Alik_Bljk_BSS_BH_UserArgs_MT64x128x64_MI16x16x1_SN_LDSB1_CLR1_GSU0_GSUC0_GSUWGMRR0_K1_LBSPPA128_LBSPPB256_MIWT2_4_PLR1_SU32_SUM0_SUS256_SKXCCM0_VWA1_VWB2_WGM1_WGMXCC1_WGMXCCGn1
    SolutionIndex: 16
    SolutionNameMin: Cijk_Alik_Bljk_BSS_BH_UserArgs_MT64x128x64_MI16x16x1_SN_LDSB1_CLR1_GSU0_GSUC0_GSUWGMRR0_K1_LBSPPA128_LBSPPB512_MIWT2_4_PLR1_SU32_SUM0_SUS256_SKXCCM0_VWA1_VWB4_WGM1_WGMXCC1_WGMXCCGn1
    SolutionIndex: 17
    SolutionNameMin: Cijk_Alik_Bljk_BSS_BH_UserArgs_MT64x128x64_MI16x16x1_SN_LDSB1_CLR1_GSU0_GSUC0_GSUWGMRR0_K1_LBSPPA128_LBSPPB128_MIWT2_4_PLR1_SU32_SUM0_SUS256_SKXCCM0_VWA1_VWB1_WGM8_WGMXCC1_WGMXCCGn1
    SolutionIndex: 18
    SolutionNameMin: Cijk_Alik_Bljk_BSS_BH_UserArgs_MT64x128x64_MI16x16x1_SN_LDSB1_CLR1_GSU0_GSUC0_GSUWGMRR0_K1_LBSPPA128_LBSPPB512_MIWT2_4_PLR1_SU32_SUM0_SUS256_SKXCCM0_VWA1_VWB4_WGM8_WGMXCC1_WGMXCCGn1
    SolutionIndex: 19
    SolutionNameMin: Cijk_Alik_Bljk_BSS_BH_UserArgs_MT128x64x64_MI16x16x1_SN_LDSB1_CLR1_GSU0_GSUC0_GSUWGMRR0_K1_LBSPPA512_LBSPPB128_MIWT4_2_PLR1_SU32_SUM0_SUS256_SKXCCM0_VWA4_VWB1_WGM1_WGMXCC1_WGMXCCGn1
    SolutionIndex: 20
    SolutionNameMin: Cijk_Alik_Bljk_BSS_BH_UserArgs_MT128x64x64_MI16x16x1_SN_LDSB1_CLR1_GSU0_GSUC0_GSUWGMRR0_K1_LBSPPA128_LBSPPB256_MIWT4_2_PLR1_SU32_SUM0_SUS256_SKXCCM0_VWA1_VWB2_WGM1_WGMXCC1_WGMXCCGn1
    SolutionIndex: 21
    SolutionNameMin: Cijk_Alik_Bljk_BSS_BH_UserArgs_MT128x64x64_MI16x16x1_SN_LDSB1_CLR1_GSU0_GSUC0_GSUWGMRR0_K1_LBSPPA512_LBSPPB256_MIWT4_2_PLR1_SU32_SUM0_SUS256_SKXCCM0_VWA4_VWB2_WGM1_WGMXCC1_WGMXCCGn1
    SolutionIndex: 22
    SolutionNameMin: Cijk_Alik_Bljk_BSS_BH_UserArgs_MT128x64x64_MI16x16x1_SN_LDSB1_CLR1_GSU0_GSUC0_GSUWGMRR0_K1_LBSPPA512_LBSPPB256_MIWT4_2_PLR2_SU32_SUM0_SUS256_SKXCCM0_VWA4_VWB2_WGM1_WGMXCC1_WGMXCCGn1
    SolutionIndex: 23
    SolutionNameMin: Cijk_Alik_Bljk_BSS_BH_UserArgs_MT128x64x64_MI16x16x1_SN_LDSB1_CLR1_GSU0_GSUC0_GSUWGMRR0_K1_LBSPPA512_LBSPPB128_MIWT4_2_PLR1_SU32_SUM0_SUS256_SKXCCM0_VWA4_VWB1_WGM8_WGMXCC1_WGMXCCGn1
    SolutionIndex: 24
    SolutionNameMin: Cijk_Alik_Bljk_BSS_BH_UserArgs_MT128x64x64_MI16x16x1_SN_LDSB1_CLR1_GSU0_GSUC0_GSUWGMRR0_K1_LBSPPA512_LBSPPB256_MIWT4_2_PLR1_SU32_SUM0_SUS256_SKXCCM0_VWA4_VWB2_WGM8_WGMXCC1_WGMXCCGn1
    SolutionIndex: 25
    SolutionNameMin: Cijk_Alik_Bljk_BSS_BH_UserArgs_MT64x64x64_MI16x16x1_SN_LDSB1_CLR1_GSU0_GSUC0_GSUWGMRR0_K1_LBSPPA128_LBSPPB128_MIWT2_2_PLR1_SU32_SUM0_SUS256_SKXCCM0_VWA1_VWB1_WGM1_WGMXCC1_WGMXCCGn1
    SolutionIndex: 26
    SolutionNameMin: Cijk_Alik_Bljk_BSS_BH_UserArgs_MT64x64x64_MI16x16x1_SN_LDSB1_CLR1_GSU0_GSUC0_GSUWGMRR0_K1_LBSPPA128_LBSPPB256_MIWT2_2_PLR1_SU32_SUM0_SUS256_SKXCCM0_VWA1_VWB2_WGM1_WGMXCC1_WGMXCCGn1
    SolutionIndex: 27
    SolutionNameMin: Cijk_Alik_Bljk_BSS_BH_UserArgs_MT64x64x64_MI16x16x1_SN_LDSB1_CLR1_GSU0_GSUC0_GSUWGMRR0_K1_LBSPPA256_LBSPPB256_MIWT2_2_PLR1_SU32_SUM0_SUS256_SKXCCM0_VWA2_VWB2_WGM1_WGMXCC1_WGMXCCGn1
    SolutionIndex: 28
    SolutionNameMin: Cijk_Alik_Bljk_BSS_BH_UserArgs_MT64x64x64_MI16x16x1_SN_LDSB1_CLR1_GSU0_GSUC0_GSUWGMRR0_K1_LBSPPA128_LBSPPB128_MIWT2_2_PLR1_SU32_SUM0_SUS256_SKXCCM0_VWA1_VWB1_WGM4_WGMXCC1_WGMXCCGn1
    SolutionIndex: 29
    SolutionNameMin: Cijk_Alik_Bljk_BSS_BH_UserArgs_MT32x64x64_MI16x16x1_SN_LDSB0_CLR1_GSU0_GSUC0_GSUWGMRR0_K1_LBSPPA128_LBSPPB128_MIWT1_2_PLR1_SU32_SUM0_SUS256_SKXCCM0_VWA1_VWB1_WGM1_WGMXCC1_WGMXCCGn1
    SolutionIndex: 30
    SolutionNameMin: Cijk_Alik_Bljk_BSS_BH_UserArgs_MT32x64x64_MI16x16x1_SN_LDSB0_CLR1_GSU0_GSUC0_GSUWGMRR0_K1_LBSPPA128_LBSPPB256_MIWT1_2_PLR1_SU32_SUM0_SUS256_SKXCCM0_VWA1_VWB2_WGM1_WGMXCC1_WGMXCCGn1
    SolutionIndex: 31
    SolutionNameMin: Cijk_Alik_Bljk_BSS_BH_UserArgs_MT64x32x64_MI16x16x1_SN_LDSB0_CLR1_GSU0_GSUC0_GSUWGMRR0_K1_LBSPPA128_LBSPPB128_MIWT2_1_PLR1_SU32_SUM0_SUS256_SKXCCM0_VWA1_VWB1_WGM1_WGMXCC1_WGMXCCGn1
    SolutionIndex: 32
    SolutionNameMin: Cijk_Alik_Bljk_BSS_BH_UserArgs_MT64x32x64_MI16x16x1_SN_LDSB0_CLR1_GSU0_GSUC0_GSUWGMRR0_K1_LBSPPA256_LBSPPB128_MIWT2_1_PLR1_SU32_SUM0_SUS256_SKXCCM0_VWA2_VWB1_WGM1_WGMXCC1_WGMXCCGn1
    SolutionIndex: 33
    SolutionNameMin: Cijk_Alik_Bljk_BSS_BH_UserArgs_MT32x32x64_MI16x16x1_SN_LDSB0_CLR1_GSU0_GSUC0_GSUWGMRR0_K1_LBSPPA128_LBSPPB128_MIWT1_1_PLR1_SU32_SUM0_SUS256_SKXCCM0_VWA1_VWB1_WGM1_WGMXCC1_WGMXCCGn1
    SolutionIndex: 34
    SolutionNameMin: Cijk_Alik_Bljk_BSS_BH_UserArgs_MT32x32x64_MI16x16x1_SN_LDSB0_CLR1_GSU0_GSUC0_GSUWGMRR0_K1_LBSPPA128_LBSPPB128_MIWT1_1_PLR2_SU32_SUM0_SUS256_SKXCCM0_VWA1_VWB1_WGM1_WGMXCC1_WGMXCCGn1
    SolutionIndex: 35
    SolutionNameMin: Cijk_Alik_Bljk_BSS_BH_UserArgs_MT32x32x64_MI16x16x1_SN_LDSB0_CLR1_GSU0_GSUC0_GSUWGMRR0_K1_LBSPPA128_LBSPPB128_MIWT1_1_PLR1_SU32_SUM0_SUS256_SKXCCM0_VWA1_VWB1_WGM4_WGMXCC1_WGMXCCGn1
    SolutionIndex: 36
    SolutionNameMin: Cijk_Alik_Bljk_BSS_BH_UserArgs_MT32x32x64_MI16x16x1_SN_LDSB0_CLR1_GSU0_GSUC0_GSUWGMRR0_K1_LBSPPA128_LBSPPB128_MIWT1_1_PLR1_SU32_SUM0_SUS256_SKXCCM0_VWA1_VWB1_WGM8_WGMXCC1_WGMXCCGn1
    SolutionIndex: 37
    SolutionNameMin: Cijk_Alik_Bljk_BSS_BH_UserArgs_MT64x64x128_MI16x16x1_SN_LDSB1_CLR1_GSU0_GSUC0_GSUWGMRR0_K1_LBSPPA256_LBSPPB512_MIWT2_2_PLR1_SU32_SUM0_SUS256_SKXCCM0_VWA1_VWB2_WGM1_WGMXCC1_WGMXCCGn1
    SolutionIndex: 38
    SolutionNameMin: Cijk_Alik_Bljk_BSS_BH_UserArgs_MT64x64x128_MI16x16x1_SN_LDSB1_CLR1_GSU0_GSUC0_GSUWGMRR0_K1_LBSPPA256_LBSPPB512_MIWT2_2_PLR2_SU32_SUM0_SUS256_SKXCCM0_VWA1_VWB2_WGM1_WGMXCC1_WGMXCCGn1
    SolutionIndex: 39
    SolutionNameMin: Cijk_Alik_Bljk_BSS_BH_UserArgs_MT64x64x128_MI16x16x1_SN_LDSB1_CLR1_GSU0_GSUC0_GSUWGMRR0_K1_LBSPPA256_LBSPPB256_MIWT2_2_PLR2_SU32_SUM0_SUS256_SKXCCM0_VWA1_VWB1_WGM4_WGMXCC1_WGMXCCGn1
    SolutionIndex: 40
    SolutionNameMin: Cijk_Alik_Bljk_BSS_BH_UserArgs_MT64x64x128_MI16x16x1_SN_LDSB1_CLR1_GSU0_GSUC0_GSUWGMRR0_K1_LBSPPA512_LBSPPB256_MIWT2_2_PLR1_SU32_SUM0_SUS256_SKXCCM0_VWA2_VWB1_WGM8_WGMXCC1_WGMXCCGn1
    SolutionIndex: 41
    SolutionNameMin: Cijk_Alik_Bljk_BSS_BH_UserArgs_MT32x64x128_MI16x16x1_SN_LDSB1_CLR1_GSU0_GSUC0_GSUWGMRR0_K1_LBSPPA256_LBSPPB512_MIWT1_2_PLR1_SU32_SUM0_SUS256_SKXCCM0_VWA1_VWB2_WGM1_WGMXCC1_WGMXCCGn1
    SolutionIndex: 42
    SolutionNameMin: Cijk_Alik_Bljk_BSS_BH_UserArgs_MT32x64x128_MI16x16x1_SN_LDSB1_CLR1_GSU0_GSUC0_GSUWGMRR0_K1_LBSPPA256_LBSPPB256_MIWT1_2_PLR2_SU32_SUM0_SUS256_SKXCCM0_VWA1_VWB1_WGM1_WGMXCC1_WGMXCCGn1
    SolutionIndex: 43
    SolutionNameMin: Cijk_Alik_Bljk_BSS_BH_UserArgs_MT32x64x128_MI16x16x1_SN_LDSB1_CLR1_GSU0_GSUC0_GSUWGMRR0_K1_LBSPPA256_LBSPPB512_MIWT1_2_PLR2_SU32_SUM0_SUS256_SKXCCM0_VWA1_VWB2_WGM1_WGMXCC1_WGMXCCGn1
    SolutionIndex: 44
    SolutionNameMin: Cijk_Alik_Bljk_BSS_BH_UserArgs_MT64x32x128_MI16x16x1_SN_LDSB1_CLR1_GSU0_GSUC0_GSUWGMRR0_K1_LBSPPA256_LBSPPB256_MIWT2_1_PLR2_SU32_SUM0_SUS256_SKXCCM0_VWA1_VWB1_WGM1_WGMXCC1_WGMXCCGn1
    SolutionIndex: 45
    SolutionNameMin: Cijk_Alik_Bljk_BSS_BH_UserArgs_MT32x32x128_MI16x16x1_SN_LDSB1_CLR1_GSU0_GSUC0_GSUWGMRR0_K1_LBSPPA256_LBSPPB256_MIWT1_1_PLR1_SU32_SUM0_SUS256_SKXCCM0_VWA1_VWB1_WGM1_WGMXCC1_WGMXCCGn1
    SolutionIndex: 46
    SolutionNameMin: Cijk_Alik_Bljk_BSS_BH_UserArgs_MT32x32x128_MI16x16x1_SN_LDSB1_CLR1_GSU0_GSUC0_GSUWGMRR0_K1_LBSPPA256_LBSPPB256_MIWT1_1_PLR2_SU32_SUM0_SUS256_SKXCCM0_VWA1_VWB1_WGM1_WGMXCC1_WGMXCCGn1
    SolutionIndex: 47
    SolutionNameMin: Cijk_Alik_Bljk_BSS_BH_UserArgs_MT32x32x128_MI16x16x1_SN_LDSB1_CLR1_GSU0_GSUC0_GSUWGMRR0_K1_LBSPPA256_LBSPPB256_MIWT1_1_PLR1_SU32_SUM0_SUS256_SKXCCM0_VWA1_VWB1_WGM8_WGMXCC1_WGMXCCGn1
    SolutionIndex: 48
    SolutionNameMin: Cijk_Alik_Bljk_BSS_BH_UserArgs_MT128x128x32_MI16x16x1_SN_LDSB1_CLR1_GSU0_GSUC0_GSUWGMRR0_K1_LBSPPA256_LBSPPB256_MIWT4_4_PLR1_SU32_SUM0_SUS256_SKXCCM6_VWA4_VWB4_WGM1_WGMXCC1_WGMXCCGn1
    SolutionIndex: 49
    SolutionNameMin: Cijk_Alik_Bljk_BSS_BH_UserArgs_MT128x128x32_MI16x16x1_SN_LDSB1_CLR1_GSU0_GSUC0_GSUWGMRR0_K1_LBSPPA256_LBSPPB128_MIWT4_4_PLR1_SU32_SUM0_SUS256_SKXCCM6_VWA4_VWB2_WGM8_WGMXCC1_WGMXCCGn1
    SolutionIndex: 50
    SolutionNameMin: Cijk_Alik_Bljk_BSS_BH_UserArgs_MT128x128x32_MI16x16x1_SN_LDSB1_CLR1_GSU0_GSUC0_GSUWGMRR0_K1_LBSPPA256_LBSPPB256_MIWT4_4_PLR1_SU32_SUM0_SUS256_SKXCCM6_VWA4_VWB4_WGM8_WGMXCC1_WGMXCCGn1
    SolutionIndex: 51
    SolutionNameMin: Cijk_Alik_Bljk_BSS_BH_UserArgs_MT64x256x64_MI16x16x1_SN_LDSB1_CLR1_GSU0_GSUC0_GSUWGMRR0_K1_LBSPPA128_LBSPPB128_MIWT2_8_PLR1_SU32_SUM0_SUS256_SKXCCM6_VWA1_VWB1_WGM1_WGMXCC1_WGMXCCGn1
    SolutionIndex: 52
    SolutionNameMin: Cijk_Alik_Bljk_BSS_BH_UserArgs_MT64x256x64_MI16x16x1_SN_LDSB1_CLR1_GSU0_GSUC0_GSUWGMRR0_K1_LBSPPA256_LBSPPB256_MIWT2_8_PLR1_SU32_SUM0_SUS256_SKXCCM6_VWA2_VWB2_WGM1_WGMXCC1_WGMXCCGn1
    SolutionIndex: 53
    SolutionNameMin: Cijk_Alik_Bljk_BSS_BH_UserArgs_MT64x256x64_MI16x16x1_SN_LDSB1_CLR1_GSU0_GSUC0_GSUWGMRR0_K1_LBSPPA256_LBSPPB512_MIWT2_8_PLR1_SU32_SUM0_SUS256_SKXCCM6_VWA2_VWB4_WGM1_WGMXCC1_WGMXCCGn1
    SolutionIndex: 54
    SolutionNameMin: Cijk_Alik_Bljk_BSS_BH_UserArgs_MT256x64x64_MI16x16x1_SN_LDSB1_CLR1_GSU0_GSUC0_GSUWGMRR0_K1_LBSPPA512_LBSPPB128_MIWT8_2_PLR1_SU32_SUM0_SUS256_SKXCCM6_VWA4_VWB1_WGM4_WGMXCC1_WGMXCCGn1
    SolutionIndex: 55
    SolutionNameMin: Cijk_Alik_Bljk_BSS_BH_UserArgs_MT128x128x64_MI16x16x1_SN_LDSB1_CLR1_GSU0_GSUC0_GSUWGMRR0_K1_LBSPPA128_LBSPPB128_MIWT4_4_PLR1_SU32_SUM0_SUS256_SKXCCM6_VWA1_VWB1_WGM1_WGMXCC1_WGMXCCGn1
    SolutionIndex: 56
    SolutionNameMin: Cijk_Alik_Bljk_BSS_BH_UserArgs_MT128x128x64_MI16x16x1_SN_LDSB1_CLR1_GSU0_GSUC0_GSUWGMRR0_K1_LBSPPA512_LBSPPB128_MIWT4_4_PLR1_SU32_SUM0_SUS256_SKXCCM6_VWA4_VWB1_WGM1_WGMXCC1_WGMXCCGn1
    SolutionIndex: 57
    SolutionNameMin: Cijk_Alik_Bljk_BSS_BH_UserArgs_MT128x128x64_MI16x16x1_SN_LDSB1_CLR1_GSU0_GSUC0_GSUWGMRR0_K1_LBSPPA128_LBSPPB256_MIWT4_4_PLR1_SU32_SUM0_SUS256_SKXCCM6_VWA1_VWB2_WGM1_WGMXCC1_WGMXCCGn1
    SolutionIndex: 58
    SolutionNameMin: Cijk_Alik_Bljk_BSS_BH_UserArgs_MT128x128x64_MI16x16x1_SN_LDSB1_CLR1_GSU0_GSUC0_GSUWGMRR0_K1_LBSPPA512_LBSPPB256_MIWT4_4_PLR1_SU32_SUM0_SUS256_SKXCCM6_VWA4_VWB2_WGM1_WGMXCC1_WGMXCCGn1
    SolutionIndex: 59
    SolutionNameMin: Cijk_Alik_Bljk_BSS_BH_UserArgs_MT128x128x64_MI16x16x1_SN_LDSB1_CLR1_GSU0_GSUC0_GSUWGMRR0_K1_LBSPPA128_LBSPPB512_MIWT4_4_PLR1_SU32_SUM0_SUS256_SKXCCM6_VWA1_VWB4_WGM1_WGMXCC1_WGMXCCGn1
    SolutionIndex: 60
    SolutionNameMin: Cijk_Alik_Bljk_BSS_BH_UserArgs_MT128x128x64_MI16x16x1_SN_LDSB1_CLR1_GSU0_GSUC0_GSUWGMRR0_K1_LBSPPA256_LBSPPB512_MIWT4_4_PLR1_SU32_SUM0_SUS256_SKXCCM6_VWA2_VWB4_WGM1_WGMXCC1_WGMXCCGn1
    SolutionIndex: 61
    SolutionNameMin: Cijk_Alik_Bljk_BSS_BH_UserArgs_MT128x128x64_MI16x16x1_SN_LDSB1_CLR1_GSU0_GSUC0_GSUWGMRR0_K1_LBSPPA512_LBSPPB512_MIWT4_4_PLR1_SU32_SUM0_SUS256_SKXCCM6_VWA4_VWB4_WGM1_WGMXCC1_WGMXCCGn1
    SolutionIndex: 62
    SolutionNameMin: Cijk_Alik_Bljk_BSS_BH_UserArgs_MT128x128x64_MI16x16x1_SN_LDSB1_CLR1_GSU0_GSUC0_GSUWGMRR0_K1_LBSPPA512_LBSPPB128_MIWT4_4_PLR2_SU32_SUM0_SUS256_SKXCCM6_VWA4_VWB1_WGM1_WGMXCC1_WGMXCCGn1
    SolutionIndex: 63
    SolutionNameMin: Cijk_Alik_Bljk_BSS_BH_UserArgs_MT128x128x64_MI16x16x1_SN_LDSB1_CLR1_GSU0_GSUC0_GSUWGMRR0_K1_LBSPPA128_LBSPPB256_MIWT4_4_PLR2_SU32_SUM0_SUS256_SKXCCM6_VWA1_VWB2_WGM1_WGMXCC1_WGMXCCGn1
    SolutionIndex: 64
    SolutionNameMin: Cijk_Alik_Bljk_BSS_BH_UserArgs_MT128x128x64_MI16x16x1_SN_LDSB1_CLR1_GSU0_GSUC0_GSUWGMRR0_K1_LBSPPA512_LBSPPB256_MIWT4_4_PLR2_SU32_SUM0_SUS256_SKXCCM6_VWA4_VWB2_WGM1_WGMXCC1_WGMXCCGn1
    SolutionIndex: 65
    SolutionNameMin: Cijk_Alik_Bljk_BSS_BH_UserArgs_MT128x128x64_MI16x16x1_SN_LDSB1_CLR1_GSU0_GSUC0_GSUWGMRR0_K1_LBSPPA512_LBSPPB512_MIWT4_4_PLR2_SU32_SUM0_SUS256_SKXCCM6_VWA4_VWB4_WGM1_WGMXCC1_WGMXCCGn1
    SolutionIndex: 66
    SolutionNameMin: Cijk_Alik_Bljk_BSS_BH_UserArgs_MT128x128x64_MI16x16x1_SN_LDSB1_CLR1_GSU0_GSUC0_GSUWGMRR0_K1_LBSPPA128_LBSPPB128_MIWT4_4_PLR1_SU32_SUM0_SUS256_SKXCCM6_VWA1_VWB1_WGM4_WGMXCC1_WGMXCCGn1
    SolutionIndex: 67
    SolutionNameMin: Cijk_Alik_Bljk_BSS_BH_UserArgs_MT128x128x64_MI16x16x1_SN_LDSB1_CLR1_GSU0_GSUC0_GSUWGMRR0_K1_LBSPPA512_LBSPPB128_MIWT4_4_PLR1_SU32_SUM0_SUS256_SKXCCM6_VWA4_VWB1_WGM4_WGMXCC1_WGMXCCGn1
    SolutionIndex: 68
    SolutionNameMin: Cijk_Alik_Bljk_BSS_BH_UserArgs_MT128x128x64_MI16x16x1_SN_LDSB1_CLR1_GSU0_GSUC0_GSUWGMRR0_K1_LBSPPA512_LBSPPB256_MIWT4_4_PLR1_SU32_SUM0_SUS256_SKXCCM6_VWA4_VWB2_WGM4_WGMXCC1_WGMXCCGn1
    SolutionIndex: 69
    SolutionNameMin: Cijk_Alik_Bljk_BSS_BH_UserArgs_MT128x128x64_MI16x16x1_SN_LDSB1_CLR1_GSU0_GSUC0_GSUWGMRR0_K1_LBSPPA128_LBSPPB512_MIWT4_4_PLR1_SU32_SUM0_SUS256_SKXCCM6_VWA1_VWB4_WGM4_WGMXCC1_WGMXCCGn1
    SolutionIndex: 70
    SolutionNameMin: Cijk_Alik_Bljk_BSS_BH_UserArgs_MT128x128x64_MI16x16x1_SN_LDSB1_CLR1_GSU0_GSUC0_GSUWGMRR0_K1_LBSPPA512_LBSPPB512_MIWT4_4_PLR1_SU32_SUM0_SUS256_SKXCCM6_VWA4_VWB4_WGM4_WGMXCC1_WGMXCCGn1
    SolutionIndex: 71
    SolutionNameMin: Cijk_Alik_Bljk_BSS_BH_UserArgs_MT128x128x64_MI16x16x1_SN_LDSB1_CLR1_GSU0_GSUC0_GSUWGMRR0_K1_LBSPPA512_LBSPPB256_MIWT4_4_PLR2_SU32_SUM0_SUS256_SKXCCM6_VWA4_VWB2_WGM4_WGMXCC1_WGMXCCGn1
    SolutionIndex: 72
    SolutionNameMin: Cijk_Alik_Bljk_BSS_BH_UserArgs_MT128x128x64_MI16x16x1_SN_LDSB1_CLR1_GSU0_GSUC0_GSUWGMRR0_K1_LBSPPA128_LBSPPB128_MIWT4_4_PLR1_SU32_SUM0_SUS256_SKXCCM6_VWA1_VWB1_WGM8_WGMXCC1_WGMXCCGn1
    SolutionIndex: 73
    SolutionNameMin: Cijk_Alik_Bljk_BSS_BH_UserArgs_MT128x128x64_MI16x16x1_SN_LDSB1_CLR1_GSU0_GSUC0_GSUWGMRR0_K1_LBSPPA256_LBSPPB128_MIWT4_4_PLR1_SU32_SUM0_SUS256_SKXCCM6_VWA2_VWB1_WGM8_WGMXCC1_WGMXCCGn1
    SolutionIndex: 74
    SolutionNameMin: Cijk_Alik_Bljk_BSS_BH_UserArgs_MT128x128x64_MI16x16x1_SN_LDSB1_CLR1_GSU0_GSUC0_GSUWGMRR0_K1_LBSPPA512_LBSPPB128_MIWT4_4_PLR1_SU32_SUM0_SUS256_SKXCCM6_VWA4_VWB1_WGM8_WGMXCC1_WGMXCCGn1
    SolutionIndex: 75
    SolutionNameMin: Cijk_Alik_Bljk_BSS_BH_UserArgs_MT128x128x64_MI16x16x1_SN_LDSB1_CLR1_GSU0_GSUC0_GSUWGMRR0_K1_LBSPPA256_LBSPPB256_MIWT4_4_PLR1_SU32_SUM0_SUS256_SKXCCM6_VWA2_VWB2_WGM8_WGMXCC1_WGMXCCGn1
    SolutionIndex: 76
    SolutionNameMin: Cijk_Alik_Bljk_BSS_BH_UserArgs_MT128x128x64_MI16x16x1_SN_LDSB1_CLR1_GSU0_GSUC0_GSUWGMRR0_K1_LBSPPA512_LBSPPB256_MIWT4_4_PLR1_SU32_SUM0_SUS256_SKXCCM6_VWA4_VWB2_WGM8_WGMXCC1_WGMXCCGn1
    SolutionIndex: 77
    SolutionNameMin: Cijk_Alik_Bljk_BSS_BH_UserArgs_MT128x128x64_MI16x16x1_SN_LDSB1_CLR1_GSU0_GSUC0_GSUWGMRR0_K1_LBSPPA128_LBSPPB512_MIWT4_4_PLR1_SU32_SUM0_SUS256_SKXCCM6_VWA1_VWB4_WGM8_WGMXCC1_WGMXCCGn1
    SolutionIndex: 78
    SolutionNameMin: Cijk_Alik_Bljk_BSS_BH_UserArgs_MT128x128x64_MI16x16x1_SN_LDSB1_CLR1_GSU0_GSUC0_GSUWGMRR0_K1_LBSPPA256_LBSPPB512_MIWT4_4_PLR1_SU32_SUM0_SUS256_SKXCCM6_VWA2_VWB4_WGM8_WGMXCC1_WGMXCCGn1
    SolutionIndex: 79
    SolutionNameMin: Cijk_Alik_Bljk_BSS_BH_UserArgs_MT128x128x64_MI16x16x1_SN_LDSB1_CLR1_GSU0_GSUC0_GSUWGMRR0_K1_LBSPPA512_LBSPPB512_MIWT4_4_PLR1_SU32_SUM0_SUS256_SKXCCM6_VWA4_VWB4_WGM8_WGMXCC1_WGMXCCGn1
    SolutionIndex: 80
    SolutionNameMin: Cijk_Alik_Bljk_BSS_BH_UserArgs_MT128x128x64_MI16x16x1_SN_LDSB1_CLR1_GSU0_GSUC0_GSUWGMRR0_K1_LBSPPA512_LBSPPB128_MIWT4_4_PLR2_SU32_SUM0_SUS256_SKXCCM6_VWA4_VWB1_WGM8_WGMXCC1_WGMXCCGn1
    SolutionIndex: 81
    SolutionNameMin: Cijk_Alik_Bljk_BSS_BH_UserArgs_MT64x128x64_MI16x16x1_SN_LDSB1_CLR1_GSU0_GSUC0_GSUWGMRR0_K1_LBSPPA128_LBSPPB128_MIWT2_4_PLR1_SU32_SUM0_SUS256_SKXCCM6_VWA1_VWB1_WGM1_WGMXCC1_WGMXCCGn1
    SolutionIndex: 82
    SolutionNameMin: Cijk_Alik_Bljk_BSS_BH_UserArgs_MT64x128x64_MI16x16x1_SN_LDSB1_CLR1_GSU0_GSUC0_GSUWGMRR0_K1_LBSPPA128_LBSPPB256_MIWT2_4_PLR1_SU32_SUM0_SUS256_SKXCCM6_VWA1_VWB2_WGM1_WGMXCC1_WGMXCCGn1
    SolutionIndex: 83
    SolutionNameMin: Cijk_Alik_Bljk_BSS_BH_UserArgs_MT64x128x64_MI16x16x1_SN_LDSB1_CLR1_GSU0_GSUC0_GSUWGMRR0_K1_LBSPPA128_LBSPPB512_MIWT2_4_PLR1_SU32_SUM0_SUS256_SKXCCM6_VWA1_VWB4_WGM1_WGMXCC1_WGMXCCGn1
    SolutionIndex: 84
    SolutionNameMin: Cijk_Alik_Bljk_BSS_BH_UserArgs_MT64x128x64_MI16x16x1_SN_LDSB1_CLR1_GSU0_GSUC0_GSUWGMRR0_K1_LBSPPA256_LBSPPB256_MIWT2_4_PLR2_SU32_SUM0_SUS256_SKXCCM6_VWA2_VWB2_WGM1_WGMXCC1_WGMXCCGn1
    SolutionIndex: 85
    SolutionNameMin: Cijk_Alik_Bljk_BSS_BH_UserArgs_MT64x128x64_MI16x16x1_SN_LDSB1_CLR1_GSU0_GSUC0_GSUWGMRR0_K1_LBSPPA128_LBSPPB128_MIWT2_4_PLR1_SU32_SUM0_SUS256_SKXCCM6_VWA1_VWB1_WGM4_WGMXCC1_WGMXCCGn1
    SolutionIndex: 86
    SolutionNameMin: Cijk_Alik_Bljk_BSS_BH_UserArgs_MT64x128x64_MI16x16x1_SN_LDSB1_CLR1_GSU0_GSUC0_GSUWGMRR0_K1_LBSPPA256_LBSPPB512_MIWT2_4_PLR1_SU32_SUM0_SUS256_SKXCCM6_VWA2_VWB4_WGM4_WGMXCC1_WGMXCCGn1
    SolutionIndex: 87
    SolutionNameMin: Cijk_Alik_Bljk_BSS_BH_UserArgs_MT64x128x64_MI16x16x1_SN_LDSB1_CLR1_GSU0_GSUC0_GSUWGMRR0_K1_LBSPPA128_LBSPPB128_MIWT2_4_PLR1_SU32_SUM0_SUS256_SKXCCM6_VWA1_VWB1_WGM8_WGMXCC1_WGMXCCGn1
    SolutionIndex: 88
    SolutionNameMin: Cijk_Alik_Bljk_BSS_BH_UserArgs_MT64x128x64_MI16x16x1_SN_LDSB1_CLR1_GSU0_GSUC0_GSUWGMRR0_K1_LBSPPA256_LBSPPB512_MIWT2_4_PLR1_SU32_SUM0_SUS256_SKXCCM6_VWA2_VWB4_WGM8_WGMXCC1_WGMXCCGn1
    SolutionIndex: 89
    SolutionNameMin: Cijk_Alik_Bljk_BSS_BH_UserArgs_MT128x64x64_MI16x16x1_SN_LDSB1_CLR1_GSU0_GSUC0_GSUWGMRR0_K1_LBSPPA512_LBSPPB128_MIWT4_2_PLR1_SU32_SUM0_SUS256_SKXCCM6_VWA4_VWB1_WGM1_WGMXCC1_WGMXCCGn1
    SolutionIndex: 90
    SolutionNameMin: Cijk_Alik_Bljk_BSS_BH_UserArgs_MT128x64x64_MI16x16x1_SN_LDSB1_CLR1_GSU0_GSUC0_GSUWGMRR0_K1_LBSPPA128_LBSPPB256_MIWT4_2_PLR1_SU32_SUM0_SUS256_SKXCCM6_VWA1_VWB2_WGM1_WGMXCC1_WGMXCCGn1
    SolutionIndex: 91
    SolutionNameMin: Cijk_Alik_Bljk_BSS_BH_UserArgs_MT128x64x64_MI16x16x1_SN_LDSB1_CLR1_GSU0_GSUC0_GSUWGMRR0_K1_LBSPPA512_LBSPPB256_MIWT4_2_PLR1_SU32_SUM0_SUS256_SKXCCM6_VWA4_VWB2_WGM1_WGMXCC1_WGMXCCGn1
    SolutionIndex: 92
    SolutionNameMin: Cijk_Alik_Bljk_BSS_BH_UserArgs_MT128x64x64_MI16x16x1_SN_LDSB1_CLR1_GSU0_GSUC0_GSUWGMRR0_K1_LBSPPA512_LBSPPB128_MIWT4_2_PLR2_SU32_SUM0_SUS256_SKXCCM6_VWA4_VWB1_WGM1_WGMXCC1_WGMXCCGn1
    SolutionIndex: 93
    SolutionNameMin: Cijk_Alik_Bljk_BSS_BH_UserArgs_MT128x64x64_MI16x16x1_SN_LDSB1_CLR1_GSU0_GSUC0_GSUWGMRR0_K1_LBSPPA512_LBSPPB128_MIWT4_2_PLR1_SU32_SUM0_SUS256_SKXCCM6_VWA4_VWB1_WGM4_WGMXCC1_WGMXCCGn1
    SolutionIndex: 94
    SolutionNameMin: Cijk_Alik_Bljk_BSS_BH_UserArgs_MT128x64x64_MI16x16x1_SN_LDSB1_CLR1_GSU0_GSUC0_GSUWGMRR0_K1_LBSPPA512_LBSPPB256_MIWT4_2_PLR1_SU32_SUM0_SUS256_SKXCCM6_VWA4_VWB2_WGM4_WGMXCC1_WGMXCCGn1
    SolutionIndex: 95
    SolutionNameMin: Cijk_Alik_Bljk_BSS_BH_UserArgs_MT128x64x64_MI16x16x1_SN_LDSB1_CLR1_GSU0_GSUC0_GSUWGMRR0_K1_LBSPPA512_LBSPPB128_MIWT4_2_PLR2_SU32_SUM0_SUS256_SKXCCM6_VWA4_VWB1_WGM4_WGMXCC1_WGMXCCGn1
    SolutionIndex: 96
    SolutionNameMin: Cijk_Alik_Bljk_BSS_BH_UserArgs_MT128x64x64_MI16x16x1_SN_LDSB1_CLR1_GSU0_GSUC0_GSUWGMRR0_K1_LBSPPA128_LBSPPB256_MIWT4_2_PLR2_SU32_SUM0_SUS256_SKXCCM6_VWA1_VWB2_WGM4_WGMXCC1_WGMXCCGn1
    SolutionIndex: 97
    SolutionNameMin: Cijk_Alik_Bljk_BSS_BH_UserArgs_MT128x64x64_MI16x16x1_SN_LDSB1_CLR1_GSU0_GSUC0_GSUWGMRR0_K1_LBSPPA512_LBSPPB128_MIWT4_2_PLR1_SU32_SUM0_SUS256_SKXCCM6_VWA4_VWB1_WGM8_WGMXCC1_WGMXCCGn1
    SolutionIndex: 98
    SolutionNameMin: Cijk_Alik_Bljk_BSS_BH_UserArgs_MT128x64x64_MI16x16x1_SN_LDSB1_CLR1_GSU0_GSUC0_GSUWGMRR0_K1_LBSPPA512_LBSPPB256_MIWT4_2_PLR1_SU32_SUM0_SUS256_SKXCCM6_VWA4_VWB2_WGM8_WGMXCC1_WGMXCCGn1
    SolutionIndex: 99
    SolutionNameMin: Cijk_Alik_Bljk_BSS_BH_UserArgs_MT64x64x64_MI16x16x1_SN_LDSB1_CLR1_GSU0_GSUC0_GSUWGMRR0_K1_LBSPPA128_LBSPPB128_MIWT2_2_PLR1_SU32_SUM0_SUS256_SKXCCM6_VWA1_VWB1_WGM1_WGMXCC1_WGMXCCGn1
    SolutionIndex: 100
    SolutionNameMin: Cijk_Alik_Bljk_BSS_BH_UserArgs_MT64x64x64_MI16x16x1_SN_LDSB1_CLR1_GSU0_GSUC0_GSUWGMRR0_K1_LBSPPA128_LBSPPB256_MIWT2_2_PLR1_SU32_SUM0_SUS256_SKXCCM6_VWA1_VWB2_WGM1_WGMXCC1_WGMXCCGn1
    SolutionIndex: 101
    SolutionNameMin: Cijk_Alik_Bljk_BSS_BH_UserArgs_MT32x64x64_MI16x16x1_SN_LDSB0_CLR1_GSU0_GSUC0_GSUWGMRR0_K1_LBSPPA128_LBSPPB128_MIWT1_2_PLR1_SU32_SUM0_SUS256_SKXCCM6_VWA1_VWB1_WGM1_WGMXCC1_WGMXCCGn1
    SolutionIndex: 102
    SolutionNameMin: Cijk_Alik_Bljk_BSS_BH_UserArgs_MT32x64x64_MI16x16x1_SN_LDSB0_CLR1_GSU0_GSUC0_GSUWGMRR0_K1_LBSPPA128_LBSPPB256_MIWT1_2_PLR1_SU32_SUM0_SUS256_SKXCCM6_VWA1_VWB2_WGM1_WGMXCC1_WGMXCCGn1
    SolutionIndex: 103
    SolutionNameMin: Cijk_Alik_Bljk_BSS_BH_UserArgs_MT32x32x64_MI16x16x1_SN_LDSB0_CLR1_GSU0_GSUC0_GSUWGMRR0_K1_LBSPPA128_LBSPPB128_MIWT1_1_PLR1_SU32_SUM0_SUS256_SKXCCM6_VWA1_VWB1_WGM1_WGMXCC1_WGMXCCGn1
    SolutionIndex: 104
    SolutionNameMin: Cijk_Alik_Bljk_BSS_BH_UserArgs_MT32x32x64_MI16x16x1_SN_LDSB0_CLR1_GSU0_GSUC0_GSUWGMRR0_K1_LBSPPA128_LBSPPB128_MIWT1_1_PLR1_SU32_SUM0_SUS256_SKXCCM6_VWA1_VWB1_WGM4_WGMXCC1_WGMXCCGn1
    SolutionIndex: 105
    SolutionNameMin: Cijk_Alik_Bljk_BSS_BH_UserArgs_MT32x128x128_MI16x16x1_SN_LDSB1_CLR1_GSU0_GSUC0_GSUWGMRR0_K1_LBSPPA256_LBSPPB256_MIWT1_4_PLR2_SU32_SUM0_SUS256_SKXCCM6_VWA1_VWB1_WGM1_WGMXCC1_WGMXCCGn1
    SolutionIndex: 106
    SolutionNameMin: Cijk_Alik_Bljk_BSS_BH_UserArgs_MT64x64x128_MI16x16x1_SN_LDSB1_CLR1_GSU0_GSUC0_GSUWGMRR0_K1_LBSPPA256_LBSPPB256_MIWT2_2_PLR1_SU32_SUM0_SUS256_SKXCCM6_VWA1_VWB1_WGM1_WGMXCC1_WGMXCCGn1
    SolutionIndex: 107
    SolutionNameMin: Cijk_Alik_Bljk_BSS_BH_UserArgs_MT64x64x128_MI16x16x1_SN_LDSB1_CLR1_GSU0_GSUC0_GSUWGMRR0_K1_LBSPPA512_LBSPPB256_MIWT2_2_PLR1_SU32_SUM0_SUS256_SKXCCM6_VWA2_VWB1_WGM1_WGMXCC1_WGMXCCGn1
    SolutionIndex: 108
    SolutionNameMin: Cijk_Alik_Bljk_BSS_BH_UserArgs_MT64x64x128_MI16x16x1_SN_LDSB1_CLR1_GSU0_GSUC0_GSUWGMRR0_K1_LBSPPA256_LBSPPB512_MIWT2_2_PLR1_SU32_SUM0_SUS256_SKXCCM6_VWA1_VWB2_WGM1_WGMXCC1_WGMXCCGn1
    SolutionIndex: 109
    SolutionNameMin: Cijk_Alik_Bljk_BSS_BH_UserArgs_MT64x64x128_MI16x16x1_SN_LDSB1_CLR1_GSU0_GSUC0_GSUWGMRR0_K1_LBSPPA256_LBSPPB256_MIWT2_2_PLR2_SU32_SUM0_SUS256_SKXCCM6_VWA1_VWB1_WGM1_WGMXCC1_WGMXCCGn1
    SolutionIndex: 110
    SolutionNameMin: Cijk_Alik_Bljk_BSS_BH_UserArgs_MT64x64x128_MI16x16x1_SN_LDSB1_CLR1_GSU0_GSUC0_GSUWGMRR0_K1_LBSPPA256_LBSPPB512_MIWT2_2_PLR2_SU32_SUM0_SUS256_SKXCCM6_VWA1_VWB2_WGM1_WGMXCC1_WGMXCCGn1
    SolutionIndex: 111
    SolutionNameMin: Cijk_Alik_Bljk_BSS_BH_UserArgs_MT64x64x128_MI16x16x1_SN_LDSB1_CLR1_GSU0_GSUC0_GSUWGMRR0_K1_LBSPPA512_LBSPPB512_MIWT2_2_PLR2_SU32_SUM0_SUS256_SKXCCM6_VWA2_VWB2_WGM1_WGMXCC1_WGMXCCGn1
    SolutionIndex: 112
    SolutionNameMin: Cijk_Alik_Bljk_BSS_BH_UserArgs_MT64x64x128_MI16x16x1_SN_LDSB1_CLR1_GSU0_GSUC0_GSUWGMRR0_K1_LBSPPA256_LBSPPB256_MIWT2_2_PLR1_SU32_SUM0_SUS256_SKXCCM6_VWA1_VWB1_WGM4_WGMXCC1_WGMXCCGn1
    SolutionIndex: 113
    SolutionNameMin: Cijk_Alik_Bljk_BSS_BH_UserArgs_MT64x64x128_MI16x16x1_SN_LDSB1_CLR1_GSU0_GSUC0_GSUWGMRR0_K1_LBSPPA256_LBSPPB512_MIWT2_2_PLR1_SU32_SUM0_SUS256_SKXCCM6_VWA1_VWB2_WGM4_WGMXCC1_WGMXCCGn1
    SolutionIndex: 114
    SolutionNameMin: Cijk_Alik_Bljk_BSS_BH_UserArgs_MT64x64x128_MI16x16x1_SN_LDSB1_CLR1_GSU0_GSUC0_GSUWGMRR0_K1_LBSPPA256_LBSPPB256_MIWT2_2_PLR2_SU32_SUM0_SUS256_SKXCCM6_VWA1_VWB1_WGM4_WGMXCC1_WGMXCCGn1
    SolutionIndex: 115
    SolutionNameMin: Cijk_Alik_Bljk_BSS_BH_UserArgs_MT64x64x128_MI16x16x1_SN_LDSB1_CLR1_GSU0_GSUC0_GSUWGMRR0_K1_LBSPPA512_LBSPPB256_MIWT2_2_PLR2_SU32_SUM0_SUS256_SKXCCM6_VWA2_VWB1_WGM4_WGMXCC1_WGMXCCGn1
    SolutionIndex: 116
    SolutionNameMin: Cijk_Alik_Bljk_BSS_BH_UserArgs_MT64x64x128_MI16x16x1_SN_LDSB1_CLR1_GSU0_GSUC0_GSUWGMRR0_K1_LBSPPA256_LBSPPB256_MIWT2_2_PLR1_SU32_SUM0_SUS256_SKXCCM6_VWA1_VWB1_WGM8_WGMXCC1_WGMXCCGn1
    SolutionIndex: 117
    SolutionNameMin: Cijk_Alik_Bljk_BSS_BH_UserArgs_MT64x64x128_MI16x16x1_SN_LDSB1_CLR1_GSU0_GSUC0_GSUWGMRR0_K1_LBSPPA512_LBSPPB256_MIWT2_2_PLR1_SU32_SUM0_SUS256_SKXCCM6_VWA2_VWB1_WGM8_WGMXCC1_WGMXCCGn1
    SolutionIndex: 118
    SolutionNameMin: Cijk_Alik_Bljk_BSS_BH_UserArgs_MT64x64x128_MI16x16x1_SN_LDSB1_CLR1_GSU0_GSUC0_GSUWGMRR0_K1_LBSPPA256_LBSPPB512_MIWT2_2_PLR1_SU32_SUM0_SUS256_SKXCCM6_VWA1_VWB2_WGM8_WGMXCC1_WGMXCCGn1
    SolutionIndex: 119
    SolutionNameMin: Cijk_Alik_Bljk_BSS_BH_UserArgs_MT64x64x128_MI16x16x1_SN_LDSB1_CLR1_GSU0_GSUC0_GSUWGMRR0_K1_LBSPPA256_LBSPPB256_MIWT2_2_PLR2_SU32_SUM0_SUS256_SKXCCM6_VWA1_VWB1_WGM8_WGMXCC1_WGMXCCGn1
    SolutionIndex: 120
    SolutionNameMin: Cijk_Alik_Bljk_BSS_BH_UserArgs_MT64x64x128_MI16x16x1_SN_LDSB1_CLR1_GSU0_GSUC0_GSUWGMRR0_K1_LBSPPA512_LBSPPB512_MIWT2_2_PLR2_SU32_SUM0_SUS256_SKXCCM6_VWA2_VWB2_WGM8_WGMXCC1_WGMXCCGn1
    SolutionIndex: 121
    SolutionNameMin: Cijk_Alik_Bljk_BSS_BH_UserArgs_MT32x64x128_MI16x16x1_SN_LDSB1_CLR1_GSU0_GSUC0_GSUWGMRR0_K1_LBSPPA256_LBSPPB256_MIWT1_2_PLR2_SU32_SUM0_SUS256_SKXCCM6_VWA1_VWB1_WGM4_WGMXCC1_WGMXCCGn1
    SolutionIndex: 122
    SolutionNameMin: Cijk_Alik_Bljk_BSS_BH_UserArgs_MT32x64x128_MI16x16x1_SN_LDSB1_CLR1_GSU0_GSUC0_GSUWGMRR0_K1_LBSPPA256_LBSPPB512_MIWT1_2_PLR2_SU32_SUM0_SUS256_SKXCCM6_VWA1_VWB2_WGM4_WGMXCC1_WGMXCCGn1
    SolutionIndex: 123
    SolutionNameMin: Cijk_Alik_Bljk_BSS_BH_UserArgs_MT32x64x128_MI16x16x1_SN_LDSB1_CLR1_GSU0_GSUC0_GSUWGMRR0_K1_LBSPPA256_LBSPPB512_MIWT1_2_PLR2_SU32_SUM0_SUS256_SKXCCM6_VWA1_VWB2_WGM8_WGMXCC1_WGMXCCGn1
    SolutionIndex: 124
    SolutionNameMin: Cijk_Alik_Bljk_BSS_BH_UserArgs_MT64x32x128_MI16x16x1_SN_LDSB1_CLR1_GSU0_GSUC0_GSUWGMRR0_K1_LBSPPA256_LBSPPB256_MIWT2_1_PLR2_SU32_SUM0_SUS256_SKXCCM6_VWA1_VWB1_WGM1_WGMXCC1_WGMXCCGn1
    SolutionIndex: 125
    SolutionNameMin: Cijk_Alik_Bljk_BSS_BH_UserArgs_MT32x32x128_MI16x16x1_SN_LDSB1_CLR1_GSU0_GSUC0_GSUWGMRR0_K1_LBSPPA256_LBSPPB256_MIWT1_1_PLR1_SU32_SUM0_SUS256_SKXCCM6_VWA1_VWB1_WGM1_WGMXCC1_WGMXCCGn1
    SolutionIndex: 126
    SolutionNameMin: Cijk_Alik_Bljk_BSS_BH_UserArgs_MT32x32x128_MI16x16x1_SN_LDSB1_CLR1_GSU0_GSUC0_GSUWGMRR0_K1_LBSPPA256_LBSPPB256_MIWT1_1_PLR2_SU32_SUM0_SUS256_SKXCCM6_VWA1_VWB1_WGM1_WGMXCC1_WGMXCCGn1
    SolutionIndex: 127
    SolutionNameMin: Cijk_Alik_Bljk_BSS_BH_UserArgs_MT32x32x128_MI16x16x1_SN_LDSB1_CLR1_GSU0_GSUC0_GSUWGMRR0_K1_LBSPPA256_LBSPPB256_MIWT1_1_PLR2_SU32_SUM0_SUS256_SKXCCM6_VWA1_VWB1_WGM8_WGMXCC1_WGMXCCGn1
    SolutionIndex: 128
    SolutionNameMin: Cijk_Alik_Bljk_BSS_BH_UserArgs_MT32x32x32_MI16x16x1_SN_LDSB0_CLR1_GSU0_GSUC0_GSUWGMRR0_K1_LBSPPA128_LBSPPB128_MIWT1_1_PLR1_SU32_SUM0_SUS256_SKXCCM0_VWA1_VWB1_WGM4_WGMXCC1_WGMXCCGn1
- - - [128, 128, 1, 128, 128, 128, 128, 128]
    - [36, 0.088]
  - - [128, 128, 1, 256, 128, 128, 256, 256]
    - [36, 0.164]
  - - [128, 128, 1, 512, 128, 128, 512, 512]
    - [35, 0.286]
  - - [128, 128, 1, 1024, 128, 128, 1024, 1024]
    - [47, 0.458]
  - - [128, 128, 1, 2048, 128, 128, 2048, 2048]
    - [45, 0.678]
  - - [128, 128, 1, 4096, 128, 128, 4096, 4096]
    - [103, 1.205]
  - - [128, 128, 1, 8192, 128, 128, 8192, 8192]
    - [126, 1.9]
  - - [128, 256, 1, 128, 128, 128, 128, 128]
    - [33, 0.182]
  - - [128, 256, 1, 256, 128, 128, 256, 256]
    - [33, 0.343]
  - - [128, 256, 1, 512, 128, 128, 512, 512]
    - [33, 0.592]
  - - [128, 256, 1, 1024, 128, 128, 1024, 1024]
    - [45, 0.938]
  - - [128, 256, 1, 2048, 128, 128, 2048, 2048]
    - [46, 1.339]
  - - [128, 256, 1, 4096, 128, 128, 4096, 4096]
    - [103, 2.371]
  - - [128, 256, 1, 8192, 128, 128, 8192, 8192]
    - [126, 3.737]
  - - [128, 512, 1, 128, 128, 128, 128, 128]
    - [103, 0.355]
  - - [128, 512, 1, 256, 128, 128, 256, 256]
    - [46, 0.656]
  - - [128, 512, 1, 512, 128, 128, 512, 512]
    - [33, 1.177]
  - - [128, 512, 1, 1024, 128, 128, 1024, 1024]
    - [46, 1.862]
  - - [128, 512, 1, 2048, 128, 128, 2048, 2048]
    - [46, 2.597]
  - - [128, 512, 1, 4096, 128, 128, 4096, 4096]
    - [103, 3.983]
  - - [128, 512, 1, 8192, 128, 128, 8192, 8192]
    - [124, 6.003]
  - - [128, 1024, 1, 128, 128, 128, 128, 128]
    - [33, 0.713]
  - - [128, 1024, 1, 256, 128, 128, 256, 256]
    - [33, 1.328]
  - - [128, 1024, 1, 512, 128, 128, 512, 512]
    - [103, 2.243]
  - - [128, 1024, 1, 1024, 128, 128, 1024, 1024]
    - [45, 3.633]
  - - [128, 1024, 1, 2048, 128, 128, 2048, 2048]
    - [124, 4.37]
  - - [128, 1024, 1, 4096, 128, 128, 4096, 4096]
    - [103, 6.742]
  - - [128, 1024, 1, 8192, 128, 128, 8192, 8192]
    - [124, 9.475]
  - - [128, 2048, 1, 128, 128, 128, 128, 128]
    - [32, 1.279]
  - - [128, 2048, 1, 256, 128, 128, 256, 256]
    - [29, 2.339]
  - - [128, 2048, 1, 512, 128, 128, 512, 512]
    - [29, 3.954]
  - - [128, 2048, 1, 1024, 128, 128, 1024, 1024]
    - [44, 5.929]
  - - [128, 2048, 1, 2048, 128, 128, 2048, 2048]
    - [102, 7.248]
  - - [128, 2048, 1, 4096, 128, 128, 4096, 4096]
    - [106, 10.491]
  - - [128, 2048, 1, 8192, 128, 128, 8192, 8192]
    - [106, 13.372]
  - - [128, 4096, 1, 128, 128, 128, 128, 128]
    - [26, 2.188]
  - - [128, 4096, 1, 256, 128, 128, 256, 256]
    - [26, 3.92]
  - - [128, 4096, 1, 512, 128, 128, 512, 512]
    - [26, 6.4]
  - - [128, 4096, 1, 1024, 128, 128, 1024, 1024]
    - [40, 9.294]
  - - [128, 4096, 1, 2048, 128, 128, 2048, 2048]
    - [110, 11.492]
  - - [128, 4096, 1, 4096, 128, 128, 4096, 4096]
    - [110, 14.398]
  - - [128, 4096, 1, 8192, 128, 128, 8192, 8192]
    - [95, 16.494]
  - - [128, 8192, 1, 128, 128, 128, 128, 128]
    - [19, 3.367]
  - - [128, 8192, 1, 256, 128, 128, 256, 256]
    - [89, 5.905]
  - - [128, 8192, 1, 512, 128, 128, 512, 512]
    - [19, 9.388]
  - - [128, 8192, 1, 1024, 128, 128, 1024, 1024]
    - [106, 11.28]
  - - [128, 8192, 1, 2048, 128, 128, 2048, 2048]
    - [111, 14.343]
  - - [128, 8192, 1, 4096, 128, 128, 4096, 4096]
    - [22, 17.562]
  - - [128, 8192, 1, 8192, 128, 128, 8192, 8192]
    - [13, 19.81]
  - - [256, 128, 1, 128, 256, 256, 128, 128]
    - [45, 0.183]
  - - [256, 128, 1, 256, 256, 256, 256, 256]
    - [33, 0.346]
  - - [256, 128, 1, 512, 256, 256, 512, 512]
    - [33, 0.584]
  - - [256, 128, 1, 1024, 256, 256, 1024, 1024]
    - [126, 0.93]
  - - [256, 128, 1, 2048, 256, 256, 2048, 2048]
    - [46, 1.329]
  - - [256, 128, 1, 4096, 256, 256, 4096, 4096]
    - [103, 2.361]
  - - [256, 128, 1, 8192, 256, 256, 8192, 8192]
    - [127, 3.697]
  - - [256, 256, 1, 128, 256, 256, 128, 128]
    - [33, 0.358]
  - - [256, 256, 1, 256, 256, 256, 256, 256]
    - [103, 0.664]
  - - [256, 256, 1, 512, 256, 256, 512, 512]
    - [33, 1.16]
  - - [256, 256, 1, 1024, 256, 256, 1024, 1024]
    - [45, 1.848]
  - - [256, 256, 1, 2048, 256, 256, 2048, 2048]
    - [45, 2.603]
  - - [256, 256, 1, 4096, 256, 256, 4096, 4096]
    - [126, 4.005]
  - - [256, 256, 1, 8192, 256, 256, 8192, 8192]
    - [43, 6.037]
  - - [256, 512, 1, 128, 256, 256, 128, 128]
    - [33, 0.7]
  - - [256, 512, 1, 256, 256, 256, 256, 256]
    - [33, 1.309]
  - - [256, 512, 1, 512, 256, 256, 512, 512]
    - [33, 2.279]
  - - [256, 512, 1, 1024, 256, 256, 1024, 1024]
    - [46, 3.647]
  - - [256, 512, 1, 2048, 256, 256, 2048, 2048]
    - [124, 4.35]
  - - [256, 512, 1, 4096, 256, 256, 4096, 4096]
    - [126, 6.759]
  - - [256, 512, 1, 8192, 256, 256, 8192, 8192]
    - [37, 9.295]
  - - [256, 1024, 1, 128, 256, 256, 128, 128]
    - [30, 1.288]
  - - [256, 1024, 1, 256, 256, 256, 256, 256]
    - [31, 2.326]
  - - [256, 1024, 1, 512, 256, 256, 512, 512]
    - [30, 3.938]
  - - [256, 1024, 1, 1024, 256, 256, 1024, 1024]
    - [42, 5.979]
  - - [256, 1024, 1, 2048, 256, 256, 2048, 2048]
    - [101, 7.257]
  - - [256, 1024, 1, 4096, 256, 256, 4096, 4096]
    - [124, 10.677]
  - - [256, 1024, 1, 8192, 256, 256, 8192, 8192]
    - [89, 11.902]
  - - [256, 2048, 1, 128, 256, 256, 128, 128]
    - [99, 2.144]
  - - [256, 2048, 1, 256, 256, 256, 256, 256]
    - [26, 3.826]
  - - [256, 2048, 1, 512, 256, 256, 512, 512]
    - [100, 6.258]
  - - [256, 2048, 1, 1024, 256, 256, 1024, 1024]
    - [108, 9.316]
  - - [256, 2048, 1, 2048, 256, 256, 2048, 2048]
    - [108, 11.721]
  - - [256, 2048, 1, 4096, 256, 256, 4096, 4096]
    - [107, 14.447]
  - - [256, 2048, 1, 8192, 256, 256, 8192, 8192]
    - [62, 15.915]
  - - [256, 4096, 1, 128, 256, 256, 128, 128]
    - [19, 3.342]
  - - [256, 4096, 1, 256, 256, 256, 256, 256]
    - [21, 5.878]
  - - [256, 4096, 1, 512, 256, 256, 512, 512]
    - [83, 9.286]
  - - [256, 4096, 1, 1024, 256, 256, 1024, 1024]
    - [99, 11.691]
  - - [256, 4096, 1, 2048, 256, 256, 2048, 2048]
    - [106, 15.374]
  - - [256, 4096, 1, 4096, 256, 256, 4096, 4096]
    - [96, 17.711]
  - - [256, 4096, 1, 8192, 256, 256, 8192, 8192]
    - [4, 19.632]
  - - [256, 8192, 1, 128, 256, 256, 128, 128]
    - [48, 4.565]
  - - [256, 8192, 1, 256, 256, 256, 256, 256]
    - [61, 8.077]
  - - [256, 8192, 1, 512, 256, 256, 512, 512]
    - [10, 12.477]
  - - [256, 8192, 1, 1024, 256, 256, 1024, 1024]
    - [89, 14.16]
  - - [256, 8192, 1, 2048, 256, 256, 2048, 2048]
    - [90, 17.996]
  - - [256, 8192, 1, 4096, 256, 256, 4096, 4096]
    - [66, 21.357]
  - - [256, 8192, 1, 8192, 256, 256, 8192, 8192]
    - [2, 23.071]
  - - [512, 128, 1, 128, 512, 512, 128, 128]
    - [33, 0.361]
  - - [512, 128, 1, 256, 512, 512, 256, 256]
    - [33, 0.674]
  - - [512, 128, 1, 512, 512, 512, 512, 512]
    - [33, 1.188]
  - - [512, 128, 1, 1024, 512, 512, 1024, 1024]
    - [45, 1.846]
  - - [512, 128, 1, 2048, 512, 512, 2048, 2048]
    - [46, 2.626]
  - - [512, 128, 1, 4096, 512, 512, 4096, 4096]
    - [103, 4.001]
  - - [512, 128, 1, 8192, 512, 512, 8192, 8192]
    - [43, 6.012]
  - - [512, 256, 1, 128, 512, 512, 128, 128]
    - [34, 0.7]
  - - [512, 256, 1, 256, 512, 512, 256, 256]
    - [33, 1.318]
  - - [512, 256, 1, 512, 512, 512, 512, 512]
    - [33, 2.262]
  - - [512, 256, 1, 1024, 512, 512, 1024, 1024]
    - [45, 3.598]
  - - [512, 256, 1, 2048, 512, 512, 2048, 2048]
    - [124, 4.361]
  - - [512, 256, 1, 4096, 512, 512, 4096, 4096]
    - [104, 6.619]
  - - [512, 256, 1, 8192, 512, 512, 8192, 8192]
    - [38, 9.294]
  - - [512, 512, 1, 128, 512, 512, 128, 128]
    - [29, 1.285]
  - - [512, 512, 1, 256, 512, 512, 256, 256]
    - [30, 2.306]
  - - [512, 512, 1, 512, 512, 512, 512, 512]
    - [29, 3.913]
  - - [512, 512, 1, 1024, 512, 512, 1024, 1024]
    - [42, 5.918]
  - - [512, 512, 1, 2048, 512, 512, 2048, 2048]
    - [102, 7.178]
  - - [512, 512, 1, 4096, 512, 512, 4096, 4096]
    - [121, 10.435]
  - - [512, 512, 1, 8192, 512, 512, 8192, 8192]
    - [105, 11.801]
  - - [512, 1024, 1, 128, 512, 512, 128, 128]
    - [26, 2.179]
  - - [512, 1024, 1, 256, 512, 512, 256, 256]
    - [26, 3.917]
  - - [512, 1024, 1, 512, 512, 512, 512, 512]
    - [26, 6.383]
  - - [512, 1024, 1, 1024, 512, 512, 1024, 1024]
    - [38, 9.401]
  - - [512, 1024, 1, 2048, 512, 512, 2048, 2048]
    - [106, 11.596]
  - - [512, 1024, 1, 4096, 512, 512, 4096, 4096]
    - [108, 13.99]
  - - [512, 1024, 1, 8192, 512, 512, 8192, 8192]
    - [74, 15.682]
  - - [512, 2048, 1, 128, 512, 512, 128, 128]
    - [16, 3.323]
  - - [512, 2048, 1, 256, 512, 512, 256, 256]
    - [20, 5.794]
  - - [512, 2048, 1, 512, 512, 512, 512, 512]
    - [83, 9.362]
  - - [512, 2048, 1, 1024, 512, 512, 1024, 1024]
    - [100, 11.749]
  - - [512, 2048, 1, 2048, 512, 512, 2048, 2048]
    - [112, 15.269]
  - - [512, 2048, 1, 4096, 512, 512, 4096, 4096]
    - [76, 16.946]
  - - [512, 2048, 1, 8192, 512, 512, 8192, 8192]
    - [76, 17.602]
  - - [512, 4096, 1, 128, 512, 512, 128, 128]
    - [50, 4.669]
  - - [512, 4096, 1, 256, 512, 512, 256, 256]
    - [59, 8.109]
  - - [512, 4096, 1, 512, 512, 512, 512, 512]
    - [61, 12.693]
  - - [512, 4096, 1, 1024, 512, 512, 1024, 1024]
    - [89, 14.326]
  - - [512, 4096, 1, 2048, 512, 512, 2048, 2048]
    - [109, 17.748]
  - - [512, 4096, 1, 4096, 512, 512, 4096, 4096]
    - [54, 20.276]
  - - [512, 4096, 1, 8192, 512, 512, 8192, 8192]
    - [5, 21.617]
  - - [512, 8192, 1, 128, 512, 512, 128, 128]
    - [108, 4.535]
  - - [512, 8192, 1, 256, 512, 512, 256, 256]
    - [89, 7.817]
  - - [512, 8192, 1, 512, 512, 512, 512, 512]
    - [91, 12.657]
  - - [512, 8192, 1, 1024, 512, 512, 1024, 1024]
    - [97, 17.335]
  - - [512, 8192, 1, 2048, 512, 512, 2048, 2048]
    - [74, 20.837]
  - - [512, 8192, 1, 4096, 512, 512, 4096, 4096]
    - [9, 22.577]
  - - [512, 8192, 1, 8192, 512, 512, 8192, 8192]
    - [10, 22.395]
  - - [1024, 128, 1, 128, 1024, 1024, 128, 128]
    - [33, 0.698]
  - - [1024, 128, 1, 256, 1024, 1024, 256, 256]
    - [33, 1.316]
  - - [1024, 128, 1, 512, 1024, 1024, 512, 512]
    - [125, 2.173]
  - - [1024, 128, 1, 1024, 1024, 1024, 1024, 1024]
    - [45, 3.641]
  - - [1024, 128, 1, 2048, 1024, 1024, 2048, 2048]
    - [43, 4.371]
  - - [1024, 128, 1, 4096, 1024, 1024, 4096, 4096]
    - [101, 6.618]
  - - [1024, 128, 1, 8192, 1024, 1024, 8192, 8192]
    - [117, 9.319]
  - - [1024, 256, 1, 128, 1024, 1024, 128, 128]
    - [30, 1.268]
  - - [1024, 256, 1, 256, 1024, 1024, 256, 256]
    - [30, 2.34]
  - - [1024, 256, 1, 512, 1024, 1024, 512, 512]
    - [29, 3.95]
  - - [1024, 256, 1, 1024, 1024, 1024, 1024, 1024]
    - [41, 5.968]
  - - [1024, 256, 1, 2048, 1024, 1024, 2048, 2048]
    - [30, 7.3]
  - - [1024, 256, 1, 4096, 1024, 1024, 4096, 4096]
    - [122, 10.47]
  - - [1024, 256, 1, 8192, 1024, 1024, 8192, 8192]
    - [94, 12.014]
  - - [1024, 512, 1, 128, 1024, 1024, 128, 128]
    - [26, 2.186]
  - - [1024, 512, 1, 256, 1024, 1024, 256, 256]
    - [25, 3.923]
  - - [1024, 512, 1, 512, 1024, 1024, 512, 512]
    - [27, 6.33]
  - - [1024, 512, 1, 1024, 1024, 1024, 1024, 1024]
    - [38, 9.379]
  - - [1024, 512, 1, 2048, 1024, 1024, 2048, 2048]
    - [113, 11.606]
  - - [1024, 512, 1, 4096, 1024, 1024, 4096, 4096]
    - [113, 14.295]
  - - [1024, 512, 1, 8192, 1024, 1024, 8192, 8192]
    - [56, 15.993]
  - - [1024, 1024, 1, 128, 1024, 1024, 128, 128]
    - [21, 3.342]
  - - [1024, 1024, 1, 256, 1024, 1024, 256, 256]
    - [83, 5.854]
  - - [1024, 1024, 1, 512, 1024, 1024, 512, 512]
    - [83, 9.362]
  - - [1024, 1024, 1, 1024, 1024, 1024, 1024, 1024]
    - [113, 11.43]
  - - [1024, 1024, 1, 2048, 1024, 1024, 2048, 2048]
    - [119, 15.31]
  - - [1024, 1024, 1, 4096, 1024, 1024, 4096, 4096]
    - [79, 16.693]
  - - [1024, 1024, 1, 8192, 1024, 1024, 8192, 8192]
    - [79, 17.742]
  - - [1024, 2048, 1, 128, 1024, 1024, 128, 128]
    - [48, 4.65]
  - - [1024, 2048, 1, 256, 1024, 1024, 256, 256]
    - [57, 8.163]
  - - [1024, 2048, 1, 512, 1024, 1024, 512, 512]
    - [10, 12.575]
  - - [1024, 2048, 1, 1024, 1024, 1024, 1024, 1024]
    - [110, 14.24]
  - - [1024, 2048, 1, 2048, 1024, 1024, 2048, 2048]
    - [64, 16.974]
  - - [1024, 2048, 1, 4096, 1024, 1024, 4096, 4096]
    - [70, 18.198]
  - - [1024, 2048, 1, 8192, 1024, 1024, 8192, 8192]
    - [70, 18.55]
  - - [1024, 4096, 1, 128, 1024, 1024, 128, 128]
    - [108, 4.504]
  - - [1024, 4096, 1, 256, 1024, 1024, 256, 256]
    - [91, 7.779]
  - - [1024, 4096, 1, 512, 1024, 1024, 512, 512]
    - [93, 12.628]
  - - [1024, 4096, 1, 1024, 1024, 1024, 1024, 1024]
    - [72, 16.893]
  - - [1024, 4096, 1, 2048, 1024, 1024, 2048, 2048]
    - [63, 20.292]
  - - [1024, 4096, 1, 4096, 1024, 1024, 4096, 4096]
    - [3, 20.516]
  - - [1024, 4096, 1, 8192, 1024, 1024, 8192, 8192]
    - [1, 20.383]
  - - [1024, 8192, 1, 128, 1024, 1024, 128, 128]
    - [89, 5.772]
  - - [1024, 8192, 1, 256, 1024, 1024, 256, 256]
    - [91, 9.635]
  - - [1024, 8192, 1, 512, 1024, 1024, 512, 512]
    - [55, 14.877]
  - - [1024, 8192, 1, 1024, 1024, 1024, 1024, 1024]
    - [56, 21.002]
  - - [1024, 8192, 1, 2048, 1024, 1024, 2048, 2048]
    - [68, 22.158]
  - - [1024, 8192, 1, 4096, 1024, 1024, 4096, 4096]
    - [70, 24.15]
  - - [1024, 8192, 1, 8192, 1024, 1024, 8192, 8192]
    - [56, 25.079]
  - - [2048, 128, 1, 128, 2048, 2048, 128, 128]
    - [29, 1.3]
  - - [2048, 128, 1, 256, 2048, 2048, 256, 256]
    - [31, 2.332]
  - - [2048, 128, 1, 512, 2048, 2048, 512, 512]
    - [30, 3.976]
  - - [2048, 128, 1, 1024, 2048, 2048, 1024, 1024]
    - [43, 5.935]
  - - [2048, 128, 1, 2048, 2048, 2048, 2048, 2048]
    - [29, 7.413]
  - - [2048, 128, 1, 4096, 2048, 2048, 4096, 4096]
    - [123, 10.464]
  - - [2048, 128, 1, 8192, 2048, 2048, 8192, 8192]
    - [115, 13.492]
  - - [2048, 256, 1, 128, 2048, 2048, 128, 128]
    - [25, 2.148]
  - - [2048, 256, 1, 256, 2048, 2048, 256, 256]
    - [25, 3.912]
  - - [2048, 256, 1, 512, 2048, 2048, 512, 512]
    - [100, 6.327]
  - - [2048, 256, 1, 1024, 2048, 2048, 1024, 1024]
    - [106, 9.357]
  - - [2048, 256, 1, 2048, 2048, 2048, 2048, 2048]
    - [118, 11.586]
  - - [2048, 256, 1, 4096, 2048, 2048, 4096, 4096]
    - [120, 14.324]
  - - [2048, 256, 1, 8192, 2048, 2048, 8192, 8192]
    - [56, 16.29]
  - - [2048, 512, 1, 128, 2048, 2048, 128, 128]
    - [20, 3.379]
  - - [2048, 512, 1, 256, 2048, 2048, 256, 256]
    - [91, 5.828]
  - - [2048, 512, 1, 512, 2048, 2048, 512, 512]
    - [18, 9.328]
  - - [2048, 512, 1, 1024, 2048, 2048, 1024, 1024]
    - [112, 11.507]
  - - [2048, 512, 1, 2048, 2048, 2048, 2048, 2048]
    - [118, 15.36]
  - - [2048, 512, 1, 4096, 2048, 2048, 4096, 4096]
    - [65, 16.852]
  - - [2048, 512, 1, 8192, 2048, 2048, 8192, 8192]
    - [56, 17.626]
  - - [2048, 1024, 1, 128, 2048, 2048, 128, 128]
    - [49, 4.663]
  - - [2048, 1024, 1, 256, 2048, 2048, 256, 256]
    - [58, 7.866]
  - - [2048, 1024, 1, 512, 2048, 2048, 512, 512]
    - [8, 12.611]
  - - [2048, 1024, 1, 1024, 2048, 2048, 1024, 1024]
    - [85, 14.181]
  - - [2048, 1024, 1, 2048, 2048, 2048, 2048, 2048]
    - [71, 17.085]
  - - [2048, 1024, 1, 4096, 2048, 2048, 4096, 4096]
    - [64, 19.842]
  - - [2048, 1024, 1, 8192, 2048, 2048, 8192, 8192]
    - [61, 20.205]
  - - [2048, 2048, 1, 128, 2048, 2048, 128, 128]
    - [106, 4.642]
  - - [2048, 2048, 1, 256, 2048, 2048, 256, 256]
    - [89, 8.104]
  - - [2048, 2048, 1, 512, 2048, 2048, 512, 512]
    - [98, 12.516]
  - - [2048, 2048, 1, 1024, 2048, 2048, 1024, 1024]
    - [79, 16.742]
  - - [2048, 2048, 1, 2048, 2048, 2048, 2048, 2048]
    - [56, 20.326]
  - - [2048, 2048, 1, 4096, 2048, 2048, 4096, 4096]
    - [58, 21.911]
  - - [2048, 2048, 1, 8192, 2048, 2048, 8192, 8192]
    - [51, 20.754]
  - - [2048, 4096, 1, 128, 2048, 2048, 128, 128]
    - [89, 5.894]
  - - [2048, 4096, 1, 256, 2048, 2048, 256, 256]
    - [89, 10.102]
  - - [2048, 4096, 1, 512, 2048, 2048, 512, 512]
    - [56, 14.817]
  - - [2048, 4096, 1, 1024, 2048, 2048, 1024, 1024]
    - [74, 19.517]
  - - [2048, 4096, 1, 2048, 2048, 2048, 2048, 2048]
    - [60, 22.119]
  - - [2048, 4096, 1, 4096, 2048, 2048, 4096, 4096]
    - [56, 26.006]
  - - [2048, 4096, 1, 8192, 2048, 2048, 8192, 8192]
    - [56, 26.249]
  - - [2048, 8192, 1, 128, 2048, 2048, 128, 128]
    - [24, 7.015]
  - - [2048, 8192, 1, 256, 2048, 2048, 256, 256]
    - [56, 11.162]
  - - [2048, 8192, 1, 512, 2048, 2048, 512, 512]
    - [61, 16.883]
  - - [2048, 8192, 1, 1024, 2048, 2048, 1024, 1024]
    - [56, 20.532]
  - - [2048, 8192, 1, 2048, 2048, 2048, 2048, 2048]
    - [76, 23.491]
  - - [2048, 8192, 1, 4096, 2048, 2048, 4096, 4096]
    - [56, 27.465]
  - - [2048, 8192, 1, 8192, 2048, 2048, 8192, 8192]
    - [74, 27.471]
  - - [4096, 128, 1, 128, 4096, 4096, 128, 128]
    - [26, 2.194]
  - - [4096, 128, 1, 256, 4096, 4096, 256, 256]
    - [26, 3.899]
  - - [4096, 128, 1, 512, 4096, 4096, 512, 512]
    - [28, 6.257]
  - - [4096, 128, 1, 1024, 4096, 4096, 1024, 1024]
    - [39, 9.265]
  - - [4096, 128, 1, 2048, 4096, 4096, 2048, 2048]
    - [112, 11.221]
  - - [4096, 128, 1, 4096, 4096, 4096, 4096, 4096]
    - [119, 14.149]
  - - [4096, 128, 1, 8192, 4096, 4096, 8192, 8192]
    - [74, 16.171]
  - - [4096, 256, 1, 128, 4096, 4096, 128, 128]
    - [19, 3.349]
  - - [4096, 256, 1, 256, 4096, 4096, 256, 256]
    - [89, 5.881]
  - - [4096, 256, 1, 512, 4096, 4096, 512, 512]
    - [17, 9.323]
  - - [4096, 256, 1, 1024, 4096, 4096, 1024, 1024]
    - [112, 11.551]
  - - [4096, 256, 1, 2048, 4096, 4096, 2048, 2048]
    - [119, 15.25]
  - - [4096, 256, 1, 4096, 4096, 4096, 4096, 4096]
    - [80, 17.764]
  - - [4096, 256, 1, 8192, 4096, 4096, 8192, 8192]
    - [81, 19.636]
  - - [4096, 512, 1, 128, 4096, 4096, 128, 128]
    - [0, 4.566]
  - - [4096, 512, 1, 256, 4096, 4096, 256, 256]
    - [51, 7.837]
  - - [4096, 512, 1, 512, 4096, 4096, 512, 512]
    - [67, 12.17]
  - - [4096, 512, 1, 1024, 4096, 4096, 1024, 1024]
    - [85, 14.497]
  - - [4096, 512, 1, 2048, 4096, 4096, 2048, 2048]
    - [88, 17.278]
  - - [4096, 512, 1, 4096, 4096, 4096, 4096, 4096]
    - [52, 21.157]
  - - [4096, 512, 1, 8192, 4096, 4096, 8192, 8192]
    - [53, 22.37]
  - - [4096, 1024, 1, 128, 4096, 4096, 128, 128]
    - [91, 4.649]
  - - [4096, 1024, 1, 256, 4096, 4096, 256, 256]
    - [93, 7.817]
  - - [4096, 1024, 1, 512, 4096, 4096, 512, 512]
    - [98, 12.409]
  - - [4096, 1024, 1, 1024, 4096, 4096, 1024, 1024]
    - [70, 16.772]
  - - [4096, 1024, 1, 2048, 4096, 4096, 2048, 2048]
    - [66, 20.843]
  - - [4096, 1024, 1, 4096, 4096, 4096, 4096, 4096]
    - [57, 22.976]
  - - [4096, 1024, 1, 8192, 4096, 4096, 8192, 8192]
    - [58, 23.459]
  - - [4096, 2048, 1, 128, 4096, 4096, 128, 128]
    - [89, 5.838]
  - - [4096, 2048, 1, 256, 4096, 4096, 256, 256]
    - [92, 9.475]
  - - [4096, 2048, 1, 512, 4096, 4096, 512, 512]
    - [74, 14.692]
  - - [4096, 2048, 1, 1024, 4096, 4096, 1024, 1024]
    - [74, 19.764]
  - - [4096, 2048, 1, 2048, 4096, 4096, 2048, 2048]
    - [58, 21.67]
  - - [4096, 2048, 1, 4096, 4096, 4096, 4096, 4096]
    - [57, 25.021]
  - - [4096, 2048, 1, 8192, 4096, 4096, 8192, 8192]
    - [56, 26.237]
  - - [4096, 4096, 1, 128, 4096, 4096, 128, 128]
    - [23, 6.816]
  - - [4096, 4096, 1, 256, 4096, 4096, 256, 256]
    - [56, 10.945]
  - - [4096, 4096, 1, 512, 4096, 4096, 512, 512]
    - [67, 16.69]
  - - [4096, 4096, 1, 1024, 4096, 4096, 1024, 1024]
    - [72, 20.647]
  - - [4096, 4096, 1, 2048, 4096, 4096, 2048, 2048]
    - [78, 23.064]
  - - [4096, 4096, 1, 4096, 4096, 4096, 4096, 4096]
    - [73, 26.768]
  - - [4096, 4096, 1, 8192, 4096, 4096, 8192, 8192]
    - [73, 29.073]
  - - [4096, 8192, 1, 128, 4096, 4096, 128, 128]
    - [7, 6.769]
  - - [4096, 8192, 1, 256, 4096, 4096, 256, 256]
    - [56, 10.554]
  - - [4096, 8192, 1, 512, 4096, 4096, 512, 512]
    - [76, 16.086]
  - - [4096, 8192, 1, 1024, 4096, 4096, 1024, 1024]
    - [6, 19.698]
  - - [4096, 8192, 1, 2048, 4096, 4096, 2048, 2048]
    - [72, 24.386]
  - - [4096, 8192, 1, 4096, 4096, 4096, 4096, 4096]
    - [73, 28.251]
  - - [4096, 8192, 1, 8192, 4096, 4096, 8192, 8192]
    - [74, 31.569]
  - - [8192, 128, 1, 128, 8192, 8192, 128, 128]
    - [14, 3.357]
  - - [8192, 128, 1, 256, 8192, 8192, 256, 256]
    - [89, 5.823]
  - - [8192, 128, 1, 512, 8192, 8192, 512, 512]
    - [82, 9.346]
  - - [8192, 128, 1, 1024, 8192, 8192, 1024, 1024]
    - [114, 11.215]
  - - [8192, 128, 1, 2048, 8192, 8192, 2048, 2048]
    - [113, 14.382]
  - - [8192, 128, 1, 4096, 8192, 8192, 4096, 4096]
    - [84, 17.491]
  - - [8192, 128, 1, 8192, 8192, 8192, 8192, 8192]
    - [15, 19.753]
  - - [8192, 256, 1, 128, 8192, 8192, 128, 128]
    - [56, 4.571]
  - - [8192, 256, 1, 256, 8192, 8192, 256, 256]
    - [74, 7.967]
  - - [8192, 256, 1, 512, 8192, 8192, 512, 512]
    - [74, 12.201]
  - - [8192, 256, 1, 1024, 8192, 8192, 1024, 1024]
    - [87, 13.921]
  - - [8192, 256, 1, 2048, 8192, 8192, 2048, 2048]
    - [86, 18.114]
  - - [8192, 256, 1, 4096, 8192, 8192, 4096, 4096]
    - [64, 21.328]
  - - [8192, 256, 1, 8192, 8192, 8192, 8192, 8192]
    - [58, 23.759]
  - - [8192, 512, 1, 128, 8192, 8192, 128, 128]
    - [116, 4.523]
  - - [8192, 512, 1, 256, 8192, 8192, 256, 256]
    - [93, 7.815]
  - - [8192, 512, 1, 512, 8192, 8192, 512, 512]
    - [97, 12.43]
  - - [8192, 512, 1, 1024, 8192, 8192, 1024, 1024]
    - [67, 17.48]
  - - [8192, 512, 1, 2048, 8192, 8192, 2048, 2048]
    - [66, 21.421]
  - - [8192, 512, 1, 4096, 8192, 8192, 4096, 4096]
    - [55, 23.27]
  - - [8192, 512, 1, 8192, 8192, 8192, 8192, 8192]
    - [7, 23.729]
  - - [8192, 1024, 1, 128, 8192, 8192, 128, 128]
    - [94, 5.644]
  - - [8192, 1024, 1, 256, 8192, 8192, 256, 256]
    - [93, 9.643]
  - - [8192, 1024, 1, 512, 8192, 8192, 512, 512]
    - [76, 14.812]
  - - [8192, 1024, 1, 1024, 8192, 8192, 1024, 1024]
    - [77, 19.866]
  - - [8192, 1024, 1, 2048, 8192, 8192, 2048, 2048]
    - [79, 21.431]
  - - [8192, 1024, 1, 4096, 8192, 8192, 4096, 4096]
    - [74, 23.93]
  - - [8192, 1024, 1, 8192, 8192, 8192, 8192, 8192]
    - [61, 25.61]
  - - [8192, 2048, 1, 128, 8192, 8192, 128, 128]
    - [19, 6.665]
  - - [8192, 2048, 1, 256, 8192, 8192, 256, 256]
    - [70, 10.875]
  - - [8192, 2048, 1, 512, 8192, 8192, 512, 512]
    - [79, 17.198]
  - - [8192, 2048, 1, 1024, 8192, 8192, 1024, 1024]
    - [79, 21.003]
  - - [8192, 2048, 1, 2048, 8192, 8192, 2048, 2048]
    - [69, 23.411]
  - - [8192, 2048, 1, 4096, 8192, 8192, 4096, 4096]
    - [78, 27.395]
  - - [8192, 2048, 1, 8192, 8192, 8192, 8192, 8192]
    - [78, 28.955]
  - - [8192, 4096, 1, 128, 8192, 8192, 128, 128]
    - [10, 6.862]
  - - [8192, 4096, 1, 256, 8192, 8192, 256, 256]
    - [7, 10.307]
  - - [8192, 4096, 1, 512, 8192, 8192, 512, 512]
    - [67, 15.766]
  - - [8192, 4096, 1, 1024, 8192, 8192, 1024, 1024]
    - [77, 19.42]
  - - [8192, 4096, 1, 2048, 8192, 8192, 2048, 2048]
    - [77, 24.234]
  - - [8192, 4096, 1, 4096, 8192, 8192, 4096, 4096]
    - [73, 28.684]
  - - [8192, 4096, 1, 8192, 8192, 8192, 8192, 8192]
    - [74, 32.466]
  - - [8192, 8192, 1, 128, 8192, 8192, 128, 128]
    - [11, 5.858]
  - - [8192, 8192, 1, 256, 8192, 8192, 256, 256]
    - [12, 9.677]
  - - [8192, 8192, 1, 512, 8192, 8192, 512, 512]
    - [72, 14.377]
  - - [8192, 8192, 1, 1024, 8192, 8192, 1024, 1024]
    - [76, 20.847]
  - - [8192, 8192, 1, 2048, 8192, 8192, 2048, 2048]
    - [74, 25.86]
  - - [8192, 8192, 1, 4096, 8192, 8192, 4096, 4096]
    - [75, 30.226]
  - - [8192, 8192, 1, 8192, 8192, 8192, 8192, 8192]
    - [73, 33.051]
  - - [1, 1, 1, 32, 1, 1, 32, 32]
    - [128, 0.0]
- null
- null
- ExperimentalStreamK
- GridBased
