library/src/amd_detail/rocblaslt/src/Tensile/Logic/asm_full/aquavanjaram/gfx942_228cu/StreamK/aquavanjaram942_Cijk_Ailk_Bjlk_HSS_BH_UserArgs.yaml
- {MinimumRequiredVersion: 4.33.0}
- aquavanjaram942
- {Architecture: gfx942, CUCount: 228}
- [Device 0049, Device 0050]
    SolutionIndex: 0
    SolutionNameMin: Cijk_Ailk_Bjlk_HSS_BH_UserArgs_MT256x256x32_MI16x16x1_SN_LDSB1_CLR1_GSU0_GSUC0_GSUWGMRR0_K1_LBSPPA2048_LBSPPB2048_LPA0_LPB32_MIWT8_8_PLR1_SU32_SUM0_SUS256_SKXCCM0_VWA4_VWB2_WGM1_WGMXCC1_WGMXCCGn1
    SolutionIndex: 1
    SolutionNameMin: Cijk_Ailk_Bjlk_HSS_BH_UserArgs_MT256x256x32_MI16x16x1_SN_LDSB1_CLR1_GSU0_GSUC0_GSUWGMRR0_K1_LBSPPA2048_LBSPPB2048_LPA32_LPB0_MIWT8_8_PLR1_SU32_SUM0_SUS256_SKXCCM0_VWA2_VWB4_WGM1_WGMXCC1_WGMXCCGn1
    SolutionIndex: 2
    SolutionNameMin: Cijk_Ailk_Bjlk_HSS_BH_UserArgs_MT256x256x32_MI16x16x1_SN_LDSB0_CLR1_GSU0_GSUC0_GSUWGMRR0_K1_LBSPPA2048_LBSPPB2048_LPA0_LPB0_MIWT8_8_PLR1_SU32_SUM0_SUS256_SKXCCM0_VWA4_VWB4_WGM1_WGMXCC1_WGMXCCGn1
    SolutionIndex: 3
    SolutionNameMin: Cijk_Ailk_Bjlk_HSS_BH_UserArgs_MT256x256x32_MI16x16x1_SN_LDSB1_CLR1_GSU0_GSUC0_GSUWGMRR0_K1_LBSPPA2048_LBSPPB2048_LPA32_LPB0_MIWT8_8_PLR1_SU32_SUM0_SUS256_SKXCCM0_VWA2_VWB8_WGM1_WGMXCC1_WGMXCCGn1
    SolutionIndex: 4
    SolutionNameMin: Cijk_Ailk_Bjlk_HSS_BH_UserArgs_MT256x256x32_MI16x16x1_SN_LDSB0_CLR1_GSU0_GSUC0_GSUWGMRR0_K1_LBSPPA2048_LBSPPB2048_LPA0_LPB0_MIWT8_8_PLR1_SU32_SUM0_SUS256_SKXCCM0_VWA4_VWB8_WGM1_WGMXCC1_WGMXCCGn1
    SolutionIndex: 5
    SolutionNameMin: Cijk_Ailk_Bjlk_HSS_BH_UserArgs_MT256x256x32_MI16x16x1_SN_LDSB1_CLR1_GSU0_GSUC0_GSUWGMRR0_K1_LBSPPA2048_LBSPPB2048_LPA0_LPB16_MIWT8_8_PLR1_SU32_SUM0_SUS256_SKXCCM0_VWA4_VWB1_WGM8_WGMXCC1_WGMXCCGn1
    SolutionIndex: 6
    SolutionNameMin: Cijk_Ailk_Bjlk_HSS_BH_UserArgs_MT256x256x32_MI16x16x1_SN_LDSB1_CLR1_GSU0_GSUC0_GSUWGMRR0_K1_LBSPPA2048_LBSPPB2048_LPA0_LPB32_MIWT8_8_PLR1_SU32_SUM0_SUS256_SKXCCM0_VWA4_VWB2_WGM8_WGMXCC1_WGMXCCGn1
    SolutionIndex: 7
    SolutionNameMin: Cijk_Ailk_Bjlk_HSS_BH_UserArgs_MT256x256x32_MI16x16x1_SN_LDSB0_CLR1_GSU0_GSUC0_GSUWGMRR0_K1_LBSPPA2048_LBSPPB2048_LPA0_LPB0_MIWT8_8_PLR1_SU32_SUM0_SUS256_SKXCCM0_VWA4_VWB8_WGM8_WGMXCC1_WGMXCCGn1
    SolutionIndex: 8
    SolutionNameMin: Cijk_Ailk_Bjlk_HSS_BH_UserArgs_MT128x256x32_MI16x16x1_SN_LDSB1_CLR1_GSU0_GSUC0_GSUWGMRR0_K1_LBSPPA1024_LBSPPB2048_LPA0_LPB0_MIWT4_8_PLR1_SU32_SUM0_SUS256_SKXCCM0_VWA4_VWB4_WGM1_WGMXCC1_WGMXCCGn1
    SolutionIndex: 9
    SolutionNameMin: Cijk_Ailk_Bjlk_HSS_BH_UserArgs_MT128x256x32_MI16x16x1_SN_LDSB1_CLR1_GSU0_GSUC0_GSUWGMRR0_K1_LBSPPA1024_LBSPPB2048_LPA0_LPB0_MIWT4_8_PLR1_SU32_SUM0_SUS256_SKXCCM0_VWA4_VWB8_WGM1_WGMXCC1_WGMXCCGn1
    SolutionIndex: 10
    SolutionNameMin: Cijk_Ailk_Bjlk_HSS_BH_UserArgs_MT256x128x32_MI16x16x1_SN_LDSB1_CLR1_GSU0_GSUC0_GSUWGMRR0_K1_LBSPPA2048_LBSPPB1024_LPA0_LPB32_MIWT8_4_PLR1_SU32_SUM0_SUS256_SKXCCM0_VWA4_VWB2_WGM1_WGMXCC1_WGMXCCGn1
    SolutionIndex: 11
    SolutionNameMin: Cijk_Ailk_Bjlk_HSS_BH_UserArgs_MT256x128x32_MI16x16x1_SN_LDSB1_CLR1_GSU0_GSUC0_GSUWGMRR0_K1_LBSPPA2048_LBSPPB1024_LPA0_LPB0_MIWT8_4_PLR1_SU32_SUM0_SUS256_SKXCCM0_VWA4_VWB4_WGM1_WGMXCC1_WGMXCCGn1
    SolutionIndex: 12
    SolutionNameMin: Cijk_Ailk_Bjlk_HSS_BH_UserArgs_MT256x128x32_MI16x16x1_SN_LDSB1_CLR1_GSU0_GSUC0_GSUWGMRR0_K1_LBSPPA2048_LBSPPB1024_LPA0_LPB0_MIWT8_4_PLR1_SU32_SUM0_SUS256_SKXCCM0_VWA4_VWB4_WGM8_WGMXCC1_WGMXCCGn1
    SolutionIndex: 13
    SolutionNameMin: Cijk_Ailk_Bjlk_HSS_BH_UserArgs_MT256x64x32_MI16x16x1_SN_LDSB1_CLR1_GSU0_GSUC0_GSUWGMRR0_K1_LBSPPA2048_LBSPPB512_LPA0_LPB32_MIWT8_2_PLR1_SU32_SUM0_SUS256_SKXCCM0_VWA4_VWB2_WGM1_WGMXCC1_WGMXCCGn1
    SolutionIndex: 14
    SolutionNameMin: Cijk_Ailk_Bjlk_HSS_BH_UserArgs_MT128x128x32_MI16x16x1_SN_LDSB1_CLR1_GSU0_GSUC0_GSUWGMRR0_K1_LBSPPA1024_LBSPPB1024_LPA0_LPB32_MIWT4_4_PLR1_SU32_SUM0_SUS256_SKXCCM0_VWA4_VWB2_WGM1_WGMXCC1_WGMXCCGn1
    SolutionIndex: 15
    SolutionNameMin: Cijk_Ailk_Bjlk_HSS_BH_UserArgs_MT128x128x32_MI16x16x1_SN_LDSB1_CLR1_GSU0_GSUC0_GSUWGMRR0_K1_LBSPPA1024_LBSPPB1024_LPA0_LPB32_MIWT4_4_PLR1_SU32_SUM0_SUS256_SKXCCM0_VWA4_VWB2_WGM4_WGMXCC1_WGMXCCGn1
    SolutionIndex: 16
    SolutionNameMin: Cijk_Ailk_Bjlk_HSS_BH_UserArgs_MT128x64x32_MI16x16x1_SN_LDSB0_CLR1_GSU0_GSUC0_GSUWGMRR0_K1_LBSPPA1024_LBSPPB512_LPA0_LPB32_MIWT4_2_PLR1_SU32_SUM0_SUS256_SKXCCM0_VWA4_VWB2_WGM1_WGMXCC1_WGMXCCGn1
    SolutionIndex: 17
    SolutionNameMin: Cijk_Ailk_Bjlk_HSS_BH_UserArgs_MT128x64x32_MI16x16x1_SN_LDSB0_CLR1_GSU0_GSUC0_GSUWGMRR0_K1_LBSPPA1024_LBSPPB512_LPA0_LPB32_MIWT4_2_PLR1_SU32_SUM0_SUS256_SKXCCM0_VWA4_VWB2_WGM8_WGMXCC1_WGMXCCGn1
    SolutionIndex: 18
    SolutionNameMin: Cijk_Ailk_Bjlk_HSS_BH_UserArgs_MT64x64x32_MI16x16x1_SN_LDSB0_CLR1_GSU0_GSUC0_GSUWGMRR0_K1_LBSPPA512_LBSPPB512_LPA32_LPB32_MIWT2_2_PLR1_SU32_SUM0_SUS256_SKXCCM0_VWA2_VWB2_WGM1_WGMXCC1_WGMXCCGn1
    SolutionIndex: 19
    SolutionNameMin: Cijk_Ailk_Bjlk_HSS_BH_UserArgs_MT32x32x32_MI16x16x1_SN_LDSB0_CLR1_GSU0_GSUC0_GSUWGMRR0_K1_LBSPPA256_LBSPPB256_LPA16_LPB16_MIWT1_1_PLR1_SU32_SUM0_SUS256_SKXCCM0_VWA1_VWB1_WGM1_WGMXCC1_WGMXCCGn1
    SolutionIndex: 20
    SolutionNameMin: Cijk_Ailk_Bjlk_HSS_BH_UserArgs_MT256x256x64_MI16x16x1_SN_LDSB1_CLR1_GSU0_GSUC0_GSUWGMRR0_K1_LBSPPA2048_LBSPPB2048_LPA0_LPB0_MIWT8_8_PLR1_SU32_SUM0_SUS256_SKXCCM0_VWA4_VWB4_WGM1_WGMXCC1_WGMXCCGn1
    SolutionIndex: 21
    SolutionNameMin: Cijk_Ailk_Bjlk_HSS_BH_UserArgs_MT256x256x64_MI16x16x1_SN_LDSB1_CLR1_GSU0_GSUC0_GSUWGMRR0_K1_LBSPPA2048_LBSPPB2048_LPA0_LPB0_MIWT8_8_PLR2_SU32_SUM0_SUS256_SKXCCM0_VWA4_VWB4_WGM1_WGMXCC1_WGMXCCGn1
    SolutionIndex: 22
    SolutionNameMin: Cijk_Ailk_Bjlk_HSS_BH_UserArgs_MT256x256x64_MI16x16x1_SN_LDSB1_CLR1_GSU0_GSUC0_GSUWGMRR0_K1_LBSPPA2048_LBSPPB2048_LPA0_LPB0_MIWT8_8_PLR1_SU32_SUM0_SUS256_SKXCCM0_VWA4_VWB4_WGM8_WGMXCC1_WGMXCCGn1
    SolutionIndex: 23
    SolutionNameMin: Cijk_Ailk_Bjlk_HSS_BH_UserArgs_MT128x256x64_MI16x16x1_SN_LDSB1_CLR1_GSU0_GSUC0_GSUWGMRR0_K1_LBSPPA1024_LBSPPB2048_LPA0_LPB0_MIWT4_8_PLR1_SU32_SUM0_SUS256_SKXCCM0_VWA4_VWB8_WGM1_WGMXCC1_WGMXCCGn1
    SolutionIndex: 24
    SolutionNameMin: Cijk_Ailk_Bjlk_HSS_BH_UserArgs_MT128x256x64_MI16x16x1_SN_LDSB1_CLR1_GSU0_GSUC0_GSUWGMRR0_K1_LBSPPA1024_LBSPPB2048_LPA0_LPB0_MIWT4_8_PLR1_SU32_SUM0_SUS256_SKXCCM0_VWA4_VWB8_WGM8_WGMXCC1_WGMXCCGn1
    SolutionIndex: 25
    SolutionNameMin: Cijk_Ailk_Bjlk_HSS_BH_UserArgs_MT256x128x64_MI16x16x1_SN_LDSB1_CLR1_GSU0_GSUC0_GSUWGMRR0_K1_LBSPPA2048_LBSPPB1024_LPA0_LPB32_MIWT8_4_PLR1_SU32_SUM0_SUS256_SKXCCM0_VWA4_VWB2_WGM1_WGMXCC1_WGMXCCGn1
    SolutionIndex: 26
    SolutionNameMin: Cijk_Ailk_Bjlk_HSS_BH_UserArgs_MT256x128x64_MI16x16x1_SN_LDSB1_CLR1_GSU0_GSUC0_GSUWGMRR0_K1_LBSPPA2048_LBSPPB1024_LPA32_LPB0_MIWT8_4_PLR1_SU32_SUM0_SUS256_SKXCCM0_VWA2_VWB4_WGM1_WGMXCC1_WGMXCCGn1
    SolutionIndex: 27
    SolutionNameMin: Cijk_Ailk_Bjlk_HSS_BH_UserArgs_MT256x128x64_MI16x16x1_SN_LDSB1_CLR1_GSU0_GSUC0_GSUWGMRR0_K1_LBSPPA2048_LBSPPB1024_LPA0_LPB0_MIWT8_4_PLR1_SU32_SUM0_SUS256_SKXCCM0_VWA4_VWB4_WGM1_WGMXCC1_WGMXCCGn1
    SolutionIndex: 28
    SolutionNameMin: Cijk_Ailk_Bjlk_HSS_BH_UserArgs_MT256x128x64_MI16x16x1_SN_LDSB1_CLR1_GSU0_GSUC0_GSUWGMRR0_K1_LBSPPA2048_LBSPPB1024_LPA0_LPB0_MIWT8_4_PLR2_SU32_SUM0_SUS256_SKXCCM0_VWA4_VWB4_WGM1_WGMXCC1_WGMXCCGn1
    SolutionIndex: 29
    SolutionNameMin: Cijk_Ailk_Bjlk_HSS_BH_UserArgs_MT256x128x64_MI16x16x1_SN_LDSB1_CLR1_GSU0_GSUC0_GSUWGMRR0_K1_LBSPPA2048_LBSPPB1024_LPA0_LPB0_MIWT8_4_PLR2_SU32_SUM0_SUS256_SKXCCM0_VWA4_VWB4_WGM4_WGMXCC1_WGMXCCGn1
    SolutionIndex: 30
    SolutionNameMin: Cijk_Ailk_Bjlk_HSS_BH_UserArgs_MT256x128x64_MI16x16x1_SN_LDSB1_CLR1_GSU0_GSUC0_GSUWGMRR0_K1_LBSPPA2048_LBSPPB1024_LPA0_LPB16_MIWT8_4_PLR1_SU32_SUM0_SUS256_SKXCCM0_VWA4_VWB1_WGM8_WGMXCC1_WGMXCCGn1
    SolutionIndex: 31
    SolutionNameMin: Cijk_Ailk_Bjlk_HSS_BH_UserArgs_MT256x128x64_MI16x16x1_SN_LDSB1_CLR1_GSU0_GSUC0_GSUWGMRR0_K1_LBSPPA2048_LBSPPB1024_LPA0_LPB0_MIWT8_4_PLR1_SU32_SUM0_SUS256_SKXCCM0_VWA4_VWB4_WGM8_WGMXCC1_WGMXCCGn1
    SolutionIndex: 32
    SolutionNameMin: Cijk_Ailk_Bjlk_HSS_BH_UserArgs_MT256x64x64_MI16x16x1_SN_LDSB1_CLR1_GSU0_GSUC0_GSUWGMRR0_K1_LBSPPA2048_LBSPPB512_LPA0_LPB32_MIWT8_2_PLR1_SU32_SUM0_SUS256_SKXCCM0_VWA4_VWB2_WGM1_WGMXCC1_WGMXCCGn1
    SolutionIndex: 33
    SolutionNameMin: Cijk_Ailk_Bjlk_HSS_BH_UserArgs_MT128x128x64_MI16x16x1_SN_LDSB1_CLR1_GSU0_GSUC0_GSUWGMRR0_K1_LBSPPA1024_LBSPPB1024_LPA0_LPB0_MIWT4_4_PLR1_SU32_SUM0_SUS256_SKXCCM0_VWA4_VWB4_WGM1_WGMXCC1_WGMXCCGn1
    SolutionIndex: 34
    SolutionNameMin: Cijk_Ailk_Bjlk_HSS_BH_UserArgs_MT128x128x64_MI16x16x1_SN_LDSB1_CLR1_GSU0_GSUC0_GSUWGMRR0_K1_LBSPPA1024_LBSPPB1024_LPA0_LPB32_MIWT4_4_PLR2_SU32_SUM0_SUS256_SKXCCM0_VWA4_VWB2_WGM4_WGMXCC1_WGMXCCGn1
    SolutionIndex: 35
    SolutionNameMin: Cijk_Ailk_Bjlk_HSS_BH_UserArgs_MT128x128x64_MI16x16x1_SN_LDSB1_CLR1_GSU0_GSUC0_GSUWGMRR0_K1_LBSPPA1024_LBSPPB1024_LPA0_LPB32_MIWT4_4_PLR1_SU32_SUM0_SUS256_SKXCCM0_VWA4_VWB2_WGM8_WGMXCC1_WGMXCCGn1
    SolutionIndex: 36
    SolutionNameMin: Cijk_Ailk_Bjlk_HSS_BH_UserArgs_MT128x64x64_MI16x16x1_SN_LDSB1_CLR1_GSU0_GSUC0_GSUWGMRR0_K1_LBSPPA1024_LBSPPB512_LPA0_LPB16_MIWT4_2_PLR1_SU32_SUM0_SUS256_SKXCCM0_VWA4_VWB1_WGM1_WGMXCC1_WGMXCCGn1
    SolutionIndex: 37
    SolutionNameMin: Cijk_Ailk_Bjlk_HSS_BH_UserArgs_MT128x64x64_MI16x16x1_SN_LDSB1_CLR1_GSU0_GSUC0_GSUWGMRR0_K1_LBSPPA1024_LBSPPB512_LPA0_LPB32_MIWT4_2_PLR2_SU32_SUM0_SUS256_SKXCCM0_VWA4_VWB2_WGM1_WGMXCC1_WGMXCCGn1
    SolutionIndex: 38
    SolutionNameMin: Cijk_Ailk_Bjlk_HSS_BH_UserArgs_MT128x64x64_MI16x16x1_SN_LDSB1_CLR1_GSU0_GSUC0_GSUWGMRR0_K1_LBSPPA1024_LBSPPB512_LPA0_LPB32_MIWT4_2_PLR2_SU32_SUM0_SUS256_SKXCCM0_VWA4_VWB2_WGM4_WGMXCC1_WGMXCCGn1
    SolutionIndex: 39
    SolutionNameMin: Cijk_Ailk_Bjlk_HSS_BH_UserArgs_MT128x64x64_MI16x16x1_SN_LDSB1_CLR1_GSU0_GSUC0_GSUWGMRR0_K1_LBSPPA1024_LBSPPB512_LPA0_LPB32_MIWT4_2_PLR2_SU32_SUM0_SUS256_SKXCCM0_VWA4_VWB2_WGM8_WGMXCC1_WGMXCCGn1
    SolutionIndex: 40
    SolutionNameMin: Cijk_Ailk_Bjlk_HSS_BH_UserArgs_MT64x64x64_MI16x16x1_SN_LDSB1_CLR1_GSU0_GSUC0_GSUWGMRR0_K1_LBSPPA512_LBSPPB512_LPA32_LPB32_MIWT2_2_PLR1_SU32_SUM0_SUS256_SKXCCM0_VWA2_VWB2_WGM1_WGMXCC1_WGMXCCGn1
    SolutionIndex: 41
    SolutionNameMin: Cijk_Ailk_Bjlk_HSS_BH_UserArgs_MT64x64x64_MI16x16x1_SN_LDSB1_CLR1_GSU0_GSUC0_GSUWGMRR0_K1_LBSPPA512_LBSPPB512_LPA32_LPB32_MIWT2_2_PLR2_SU32_SUM0_SUS256_SKXCCM0_VWA2_VWB2_WGM1_WGMXCC1_WGMXCCGn1
    SolutionIndex: 42
    SolutionNameMin: Cijk_Ailk_Bjlk_HSS_BH_UserArgs_MT64x64x64_MI16x16x1_SN_LDSB1_CLR1_GSU0_GSUC0_GSUWGMRR0_K1_LBSPPA512_LBSPPB512_LPA32_LPB32_MIWT2_2_PLR2_SU32_SUM0_SUS256_SKXCCM0_VWA2_VWB2_WGM8_WGMXCC1_WGMXCCGn1
    SolutionIndex: 43
    SolutionNameMin: Cijk_Ailk_Bjlk_HSS_BH_UserArgs_MT32x64x64_MI16x16x1_SN_LDSB0_CLR1_GSU0_GSUC0_GSUWGMRR0_K1_LBSPPA256_LBSPPB512_LPA16_LPB32_MIWT1_2_PLR2_SU32_SUM0_SUS256_SKXCCM0_VWA1_VWB2_WGM1_WGMXCC1_WGMXCCGn1
    SolutionIndex: 44
    SolutionNameMin: Cijk_Ailk_Bjlk_HSS_BH_UserArgs_MT64x32x64_MI16x16x1_SN_LDSB0_CLR1_GSU0_GSUC0_GSUWGMRR0_K1_LBSPPA512_LBSPPB256_LPA32_LPB16_MIWT2_1_PLR2_SU32_SUM0_SUS256_SKXCCM0_VWA2_VWB1_WGM1_WGMXCC1_WGMXCCGn1
    SolutionIndex: 45
    SolutionNameMin: Cijk_Ailk_Bjlk_HSS_BH_UserArgs_MT32x32x64_MI16x16x1_SN_LDSB0_CLR1_GSU0_GSUC0_GSUWGMRR0_K1_LBSPPA256_LBSPPB256_LPA16_LPB16_MIWT1_1_PLR1_SU32_SUM0_SUS256_SKXCCM0_VWA1_VWB1_WGM1_WGMXCC1_WGMXCCGn1
    SolutionIndex: 46
    SolutionNameMin: Cijk_Ailk_Bjlk_HSS_BH_UserArgs_MT32x32x64_MI16x16x1_SN_LDSB0_CLR1_GSU0_GSUC0_GSUWGMRR0_K1_LBSPPA256_LBSPPB256_LPA16_LPB16_MIWT1_1_PLR2_SU32_SUM0_SUS256_SKXCCM0_VWA1_VWB1_WGM1_WGMXCC1_WGMXCCGn1
    SolutionIndex: 47
    SolutionNameMin: Cijk_Ailk_Bjlk_HSS_BH_UserArgs_MT32x32x64_MI16x16x1_SN_LDSB0_CLR1_GSU0_GSUC0_GSUWGMRR0_K1_LBSPPA256_LBSPPB256_LPA16_LPB16_MIWT1_1_PLR1_SU32_SUM0_SUS256_SKXCCM0_VWA1_VWB1_WGM4_WGMXCC1_WGMXCCGn1
    SolutionIndex: 48
    SolutionNameMin: Cijk_Ailk_Bjlk_HSS_BH_UserArgs_MT32x32x64_MI16x16x1_SN_LDSB0_CLR1_GSU0_GSUC0_GSUWGMRR0_K1_LBSPPA256_LBSPPB256_LPA16_LPB16_MIWT1_1_PLR1_SU32_SUM0_SUS256_SKXCCM0_VWA1_VWB1_WGM8_WGMXCC1_WGMXCCGn1
    SolutionIndex: 49
    SolutionNameMin: Cijk_Ailk_Bjlk_HSS_BH_UserArgs_MT128x128x128_MI16x16x1_SN_LDSB1_CLR1_GSU0_GSUC0_GSUWGMRR0_K1_LBSPPA1024_LBSPPB1024_LPA0_LPB0_MIWT4_4_PLR1_SU32_SUM0_SUS256_SKXCCM0_VWA4_VWB4_WGM1_WGMXCC1_WGMXCCGn1
    SolutionIndex: 50
    SolutionNameMin: Cijk_Ailk_Bjlk_HSS_BH_UserArgs_MT128x128x128_MI16x16x1_SN_LDSB1_CLR1_GSU0_GSUC0_GSUWGMRR0_K1_LBSPPA1024_LBSPPB1024_LPA0_LPB0_MIWT4_4_PLR2_SU32_SUM0_SUS256_SKXCCM0_VWA4_VWB4_WGM1_WGMXCC1_WGMXCCGn1
    SolutionIndex: 51
    SolutionNameMin: Cijk_Ailk_Bjlk_HSS_BH_UserArgs_MT128x128x128_MI16x16x1_SN_LDSB1_CLR1_GSU0_GSUC0_GSUWGMRR0_K1_LBSPPA1024_LBSPPB1024_LPA0_LPB0_MIWT4_4_PLR1_SU32_SUM0_SUS256_SKXCCM0_VWA4_VWB4_WGM4_WGMXCC1_WGMXCCGn1
    SolutionIndex: 52
    SolutionNameMin: Cijk_Ailk_Bjlk_HSS_BH_UserArgs_MT128x64x128_MI16x16x1_SN_LDSB1_CLR1_GSU0_GSUC0_GSUWGMRR0_K1_LBSPPA1024_LBSPPB512_LPA0_LPB32_MIWT4_2_PLR2_SU32_SUM0_SUS256_SKXCCM0_VWA4_VWB2_WGM1_WGMXCC1_WGMXCCGn1
    SolutionIndex: 53
    SolutionNameMin: Cijk_Ailk_Bjlk_HSS_BH_UserArgs_MT128x64x128_MI16x16x1_SN_LDSB1_CLR1_GSU0_GSUC0_GSUWGMRR0_K1_LBSPPA1024_LBSPPB512_LPA0_LPB32_MIWT4_2_PLR2_SU32_SUM0_SUS256_SKXCCM0_VWA4_VWB2_WGM4_WGMXCC1_WGMXCCGn1
    SolutionIndex: 54
    SolutionNameMin: Cijk_Ailk_Bjlk_HSS_BH_UserArgs_MT64x64x128_MI16x16x1_SN_LDSB1_CLR1_GSU0_GSUC0_GSUWGMRR0_K1_LBSPPA512_LBSPPB512_LPA32_LPB32_MIWT2_2_PLR2_SU32_SUM0_SUS256_SKXCCM0_VWA2_VWB2_WGM1_WGMXCC1_WGMXCCGn1
    SolutionIndex: 55
    SolutionNameMin: Cijk_Ailk_Bjlk_HSS_BH_UserArgs_MT64x64x128_MI16x16x1_SN_LDSB1_CLR1_GSU0_GSUC0_GSUWGMRR0_K1_LBSPPA512_LBSPPB512_LPA32_LPB32_MIWT2_2_PLR2_SU32_SUM0_SUS256_SKXCCM0_VWA2_VWB2_WGM8_WGMXCC1_WGMXCCGn1
    SolutionIndex: 56
    SolutionNameMin: Cijk_Ailk_Bjlk_HSS_BH_UserArgs_MT32x64x128_MI16x16x1_SN_LDSB1_CLR1_GSU0_GSUC0_GSUWGMRR0_K1_LBSPPA256_LBSPPB512_LPA16_LPB32_MIWT1_2_PLR2_SU32_SUM0_SUS256_SKXCCM0_VWA1_VWB2_WGM1_WGMXCC1_WGMXCCGn1
    SolutionIndex: 57
    SolutionNameMin: Cijk_Ailk_Bjlk_HSS_BH_UserArgs_MT32x64x128_MI16x16x1_SN_LDSB1_CLR1_GSU0_GSUC0_GSUWGMRR0_K1_LBSPPA256_LBSPPB512_LPA16_LPB32_MIWT1_2_PLR2_SU32_SUM0_SUS256_SKXCCM0_VWA1_VWB2_WGM4_WGMXCC1_WGMXCCGn1
    SolutionIndex: 58
    SolutionNameMin: Cijk_Ailk_Bjlk_HSS_BH_UserArgs_MT64x32x128_MI16x16x1_SN_LDSB1_CLR1_GSU0_GSUC0_GSUWGMRR0_K1_LBSPPA512_LBSPPB256_LPA32_LPB16_MIWT2_1_PLR2_SU32_SUM0_SUS256_SKXCCM0_VWA2_VWB1_WGM1_WGMXCC1_WGMXCCGn1
    SolutionIndex: 59
    SolutionNameMin: Cijk_Ailk_Bjlk_HSS_BH_UserArgs_MT32x32x128_MI16x16x1_SN_LDSB1_CLR1_GSU0_GSUC0_GSUWGMRR0_K1_LBSPPA256_LBSPPB256_LPA16_LPB16_MIWT1_1_PLR1_SU32_SUM0_SUS256_SKXCCM0_VWA1_VWB1_WGM1_WGMXCC1_WGMXCCGn1
    SolutionIndex: 60
    SolutionNameMin: Cijk_Ailk_Bjlk_HSS_BH_UserArgs_MT32x32x128_MI16x16x1_SN_LDSB1_CLR1_GSU0_GSUC0_GSUWGMRR0_K1_LBSPPA256_LBSPPB256_LPA16_LPB16_MIWT1_1_PLR2_SU32_SUM0_SUS256_SKXCCM0_VWA1_VWB1_WGM1_WGMXCC1_WGMXCCGn1
    SolutionIndex: 61
    SolutionNameMin: Cijk_Ailk_Bjlk_HSS_BH_UserArgs_MT256x256x32_MI16x16x1_SN_LDSB1_CLR1_GSU0_GSUC0_GSUWGMRR0_K1_LBSPPA2048_LBSPPB2048_LPA32_LPB32_MIWT8_8_PLR1_SU32_SUM0_SUS256_SKXCCM6_VWA2_VWB2_WGM1_WGMXCC1_WGMXCCGn1
    SolutionIndex: 62
    SolutionNameMin: Cijk_Ailk_Bjlk_HSS_BH_UserArgs_MT256x256x32_MI16x16x1_SN_LDSB1_CLR1_GSU0_GSUC0_GSUWGMRR0_K1_LBSPPA2048_LBSPPB2048_LPA0_LPB32_MIWT8_8_PLR1_SU32_SUM0_SUS256_SKXCCM6_VWA4_VWB2_WGM1_WGMXCC1_WGMXCCGn1
    SolutionIndex: 63
    SolutionNameMin: Cijk_Ailk_Bjlk_HSS_BH_UserArgs_MT256x256x32_MI16x16x1_SN_LDSB1_CLR1_GSU0_GSUC0_GSUWGMRR0_K1_LBSPPA2048_LBSPPB2048_LPA32_LPB0_MIWT8_8_PLR1_SU32_SUM0_SUS256_SKXCCM6_VWA2_VWB4_WGM1_WGMXCC1_WGMXCCGn1
    SolutionIndex: 64
    SolutionNameMin: Cijk_Ailk_Bjlk_HSS_BH_UserArgs_MT256x256x32_MI16x16x1_SN_LDSB0_CLR1_GSU0_GSUC0_GSUWGMRR0_K1_LBSPPA2048_LBSPPB2048_LPA0_LPB0_MIWT8_8_PLR1_SU32_SUM0_SUS256_SKXCCM6_VWA4_VWB8_WGM1_WGMXCC1_WGMXCCGn1
    SolutionIndex: 65
    SolutionNameMin: Cijk_Ailk_Bjlk_HSS_BH_UserArgs_MT256x256x32_MI16x16x1_SN_LDSB0_CLR1_GSU0_GSUC0_GSUWGMRR0_K1_LBSPPA2048_LBSPPB2048_LPA0_LPB0_MIWT8_8_PLR1_SU32_SUM0_SUS256_SKXCCM6_VWA4_VWB4_WGM4_WGMXCC1_WGMXCCGn1
    SolutionIndex: 66
    SolutionNameMin: Cijk_Ailk_Bjlk_HSS_BH_UserArgs_MT256x256x32_MI16x16x1_SN_LDSB0_CLR1_GSU0_GSUC0_GSUWGMRR0_K1_LBSPPA2048_LBSPPB2048_LPA0_LPB0_MIWT8_8_PLR1_SU32_SUM0_SUS256_SKXCCM6_VWA4_VWB8_WGM8_WGMXCC1_WGMXCCGn1
    SolutionIndex: 67
    SolutionNameMin: Cijk_Ailk_Bjlk_HSS_BH_UserArgs_MT128x256x32_MI16x16x1_SN_LDSB1_CLR1_GSU0_GSUC0_GSUWGMRR0_K1_LBSPPA1024_LBSPPB2048_LPA0_LPB32_MIWT4_8_PLR1_SU32_SUM0_SUS256_SKXCCM6_VWA4_VWB2_WGM1_WGMXCC1_WGMXCCGn1
    SolutionIndex: 68
    SolutionNameMin: Cijk_Ailk_Bjlk_HSS_BH_UserArgs_MT128x256x32_MI16x16x1_SN_LDSB1_CLR1_GSU0_GSUC0_GSUWGMRR0_K1_LBSPPA1024_LBSPPB2048_LPA0_LPB0_MIWT4_8_PLR1_SU32_SUM0_SUS256_SKXCCM6_VWA4_VWB4_WGM1_WGMXCC1_WGMXCCGn1
    SolutionIndex: 69
    SolutionNameMin: Cijk_Ailk_Bjlk_HSS_BH_UserArgs_MT128x256x32_MI16x16x1_SN_LDSB1_CLR1_GSU0_GSUC0_GSUWGMRR0_K1_LBSPPA1024_LBSPPB2048_LPA0_LPB0_MIWT4_8_PLR1_SU32_SUM0_SUS256_SKXCCM6_VWA4_VWB8_WGM1_WGMXCC1_WGMXCCGn1
    SolutionIndex: 70
    SolutionNameMin: Cijk_Ailk_Bjlk_HSS_BH_UserArgs_MT128x256x32_MI16x16x1_SN_LDSB1_CLR1_GSU0_GSUC0_GSUWGMRR0_K1_LBSPPA1024_LBSPPB2048_LPA0_LPB32_MIWT4_8_PLR1_SU32_SUM0_SUS256_SKXCCM6_VWA4_VWB2_WGM4_WGMXCC1_WGMXCCGn1
    SolutionIndex: 71
    SolutionNameMin: Cijk_Ailk_Bjlk_HSS_BH_UserArgs_MT128x256x32_MI16x16x1_SN_LDSB1_CLR1_GSU0_GSUC0_GSUWGMRR0_K1_LBSPPA1024_LBSPPB2048_LPA0_LPB0_MIWT4_8_PLR1_SU32_SUM0_SUS256_SKXCCM6_VWA4_VWB4_WGM4_WGMXCC1_WGMXCCGn1
    SolutionIndex: 72
    SolutionNameMin: Cijk_Ailk_Bjlk_HSS_BH_UserArgs_MT128x256x32_MI16x16x1_SN_LDSB1_CLR1_GSU0_GSUC0_GSUWGMRR0_K1_LBSPPA1024_LBSPPB2048_LPA0_LPB0_MIWT4_8_PLR1_SU32_SUM0_SUS256_SKXCCM6_VWA4_VWB8_WGM4_WGMXCC1_WGMXCCGn1
    SolutionIndex: 73
    SolutionNameMin: Cijk_Ailk_Bjlk_HSS_BH_UserArgs_MT128x256x32_MI16x16x1_SN_LDSB1_CLR1_GSU0_GSUC0_GSUWGMRR0_K1_LBSPPA1024_LBSPPB2048_LPA0_LPB0_MIWT4_8_PLR1_SU32_SUM0_SUS256_SKXCCM6_VWA4_VWB8_WGM8_WGMXCC1_WGMXCCGn1
    SolutionIndex: 74
    SolutionNameMin: Cijk_Ailk_Bjlk_HSS_BH_UserArgs_MT256x128x32_MI16x16x1_SN_LDSB1_CLR1_GSU0_GSUC0_GSUWGMRR0_K1_LBSPPA2048_LBSPPB1024_LPA0_LPB32_MIWT8_4_PLR1_SU32_SUM0_SUS256_SKXCCM6_VWA4_VWB2_WGM1_WGMXCC1_WGMXCCGn1
    SolutionIndex: 75
    SolutionNameMin: Cijk_Ailk_Bjlk_HSS_BH_UserArgs_MT256x128x32_MI16x16x1_SN_LDSB1_CLR1_GSU0_GSUC0_GSUWGMRR0_K1_LBSPPA2048_LBSPPB1024_LPA0_LPB0_MIWT8_4_PLR1_SU32_SUM0_SUS256_SKXCCM6_VWA4_VWB4_WGM1_WGMXCC1_WGMXCCGn1
    SolutionIndex: 76
    SolutionNameMin: Cijk_Ailk_Bjlk_HSS_BH_UserArgs_MT256x128x32_MI16x16x1_SN_LDSB1_CLR1_GSU0_GSUC0_GSUWGMRR0_K1_LBSPPA2048_LBSPPB1024_LPA0_LPB0_MIWT8_4_PLR1_SU32_SUM0_SUS256_SKXCCM6_VWA4_VWB4_WGM4_WGMXCC1_WGMXCCGn1
    SolutionIndex: 77
    SolutionNameMin: Cijk_Ailk_Bjlk_HSS_BH_UserArgs_MT256x128x32_MI16x16x1_SN_LDSB1_CLR1_GSU0_GSUC0_GSUWGMRR0_K1_LBSPPA2048_LBSPPB1024_LPA0_LPB32_MIWT8_4_PLR1_SU32_SUM0_SUS256_SKXCCM6_VWA4_VWB2_WGM8_WGMXCC1_WGMXCCGn1
    SolutionIndex: 78
    SolutionNameMin: Cijk_Ailk_Bjlk_HSS_BH_UserArgs_MT128x128x32_MI16x16x1_SN_LDSB1_CLR1_GSU0_GSUC0_GSUWGMRR0_K1_LBSPPA1024_LBSPPB1024_LPA0_LPB16_MIWT4_4_PLR1_SU32_SUM0_SUS256_SKXCCM6_VWA4_VWB1_WGM1_WGMXCC1_WGMXCCGn1
    SolutionIndex: 79
    SolutionNameMin: Cijk_Ailk_Bjlk_HSS_BH_UserArgs_MT128x128x32_MI16x16x1_SN_LDSB1_CLR1_GSU0_GSUC0_GSUWGMRR0_K1_LBSPPA1024_LBSPPB1024_LPA0_LPB32_MIWT4_4_PLR1_SU32_SUM0_SUS256_SKXCCM6_VWA4_VWB2_WGM1_WGMXCC1_WGMXCCGn1
    SolutionIndex: 80
    SolutionNameMin: Cijk_Ailk_Bjlk_HSS_BH_UserArgs_MT128x128x32_MI16x16x1_SN_LDSB0_CLR1_GSU0_GSUC0_GSUWGMRR0_K1_LBSPPA1024_LBSPPB1024_LPA0_LPB0_MIWT4_4_PLR1_SU32_SUM0_SUS256_SKXCCM6_VWA4_VWB4_WGM1_WGMXCC1_WGMXCCGn1
    SolutionIndex: 81
    SolutionNameMin: Cijk_Ailk_Bjlk_HSS_BH_UserArgs_MT128x128x32_MI16x16x1_SN_LDSB1_CLR1_GSU0_GSUC0_GSUWGMRR0_K1_LBSPPA1024_LBSPPB1024_LPA0_LPB32_MIWT4_4_PLR1_SU32_SUM0_SUS256_SKXCCM6_VWA4_VWB2_WGM4_WGMXCC1_WGMXCCGn1
    SolutionIndex: 82
    SolutionNameMin: Cijk_Ailk_Bjlk_HSS_BH_UserArgs_MT128x128x32_MI16x16x1_SN_LDSB0_CLR0_GSU0_GSUC0_GSUWGMRR0_K1_LBSPPA1024_LBSPPB1024_LPA0_LPB0_MIWT4_4_PLR0_SU32_SUM0_SUS256_SKXCCM6_VWA4_VWB4_WGM4_WGMXCC1_WGMXCCGn1
    SolutionIndex: 83
    SolutionNameMin: Cijk_Ailk_Bjlk_HSS_BH_UserArgs_MT128x128x32_MI16x16x1_SN_LDSB1_CLR1_GSU0_GSUC0_GSUWGMRR0_K1_LBSPPA1024_LBSPPB1024_LPA0_LPB32_MIWT4_4_PLR1_SU32_SUM0_SUS256_SKXCCM6_VWA4_VWB2_WGM8_WGMXCC1_WGMXCCGn1
    SolutionIndex: 84
    SolutionNameMin: Cijk_Ailk_Bjlk_HSS_BH_UserArgs_MT128x128x32_MI16x16x1_SN_LDSB0_CLR1_GSU0_GSUC0_GSUWGMRR0_K1_LBSPPA1024_LBSPPB1024_LPA0_LPB0_MIWT4_4_PLR1_SU32_SUM0_SUS256_SKXCCM6_VWA4_VWB4_WGM8_WGMXCC1_WGMXCCGn1
    SolutionIndex: 85
    SolutionNameMin: Cijk_Ailk_Bjlk_HSS_BH_UserArgs_MT128x128x32_MI16x16x1_SN_LDSB0_CLR0_GSU0_GSUC0_GSUWGMRR0_K1_LBSPPA1024_LBSPPB1024_LPA0_LPB0_MIWT4_4_PLR0_SU32_SUM0_SUS256_SKXCCM6_VWA4_VWB4_WGM8_WGMXCC1_WGMXCCGn1
    SolutionIndex: 86
    SolutionNameMin: Cijk_Ailk_Bjlk_HSS_BH_UserArgs_MT128x64x32_MI16x16x1_SN_LDSB0_CLR1_GSU0_GSUC0_GSUWGMRR0_K1_LBSPPA1024_LBSPPB512_LPA0_LPB16_MIWT4_2_PLR1_SU32_SUM0_SUS256_SKXCCM6_VWA4_VWB1_WGM1_WGMXCC1_WGMXCCGn1
    SolutionIndex: 87
    SolutionNameMin: Cijk_Ailk_Bjlk_HSS_BH_UserArgs_MT128x64x32_MI16x16x1_SN_LDSB0_CLR1_GSU0_GSUC0_GSUWGMRR0_K1_LBSPPA1024_LBSPPB512_LPA0_LPB32_MIWT4_2_PLR1_SU32_SUM0_SUS256_SKXCCM6_VWA4_VWB2_WGM1_WGMXCC1_WGMXCCGn1
    SolutionIndex: 88
    SolutionNameMin: Cijk_Ailk_Bjlk_HSS_BH_UserArgs_MT32x32x32_MI16x16x1_SN_LDSB0_CLR1_GSU0_GSUC0_GSUWGMRR0_K1_LBSPPA256_LBSPPB256_LPA16_LPB16_MIWT1_1_PLR1_SU32_SUM0_SUS256_SKXCCM6_VWA1_VWB1_WGM1_WGMXCC1_WGMXCCGn1
    SolutionIndex: 89
    SolutionNameMin: Cijk_Ailk_Bjlk_HSS_BH_UserArgs_MT32x32x32_MI16x16x1_SN_LDSB0_CLR0_GSU0_GSUC0_GSUWGMRR0_K1_LBSPPA256_LBSPPB256_LPA16_LPB16_MIWT1_1_PLR0_SU32_SUM0_SUS256_SKXCCM6_VWA1_VWB1_WGM1_WGMXCC1_WGMXCCGn1
    SolutionIndex: 90
    SolutionNameMin: Cijk_Ailk_Bjlk_HSS_BH_UserArgs_MT256x256x64_MI16x16x1_SN_LDSB1_CLR1_GSU0_GSUC0_GSUWGMRR0_K1_LBSPPA2048_LBSPPB2048_LPA0_LPB0_MIWT8_8_PLR1_SU32_SUM0_SUS256_SKXCCM6_VWA4_VWB4_WGM1_WGMXCC1_WGMXCCGn1
    SolutionIndex: 91
    SolutionNameMin: Cijk_Ailk_Bjlk_HSS_BH_UserArgs_MT256x256x64_MI16x16x1_SN_LDSB1_CLR1_GSU0_GSUC0_GSUWGMRR0_K1_LBSPPA2048_LBSPPB2048_LPA0_LPB0_MIWT8_8_PLR1_SU32_SUM0_SUS256_SKXCCM6_VWA4_VWB8_WGM1_WGMXCC1_WGMXCCGn1
    SolutionIndex: 92
    SolutionNameMin: Cijk_Ailk_Bjlk_HSS_BH_UserArgs_MT256x256x64_MI16x16x1_SN_LDSB1_CLR1_GSU0_GSUC0_GSUWGMRR0_K1_LBSPPA2048_LBSPPB2048_LPA0_LPB0_MIWT8_8_PLR2_SU32_SUM0_SUS256_SKXCCM6_VWA4_VWB4_WGM1_WGMXCC1_WGMXCCGn1
    SolutionIndex: 93
    SolutionNameMin: Cijk_Ailk_Bjlk_HSS_BH_UserArgs_MT256x256x64_MI16x16x1_SN_LDSB1_CLR1_GSU0_GSUC0_GSUWGMRR0_K1_LBSPPA2048_LBSPPB2048_LPA0_LPB0_MIWT8_8_PLR2_SU32_SUM0_SUS256_SKXCCM6_VWA4_VWB8_WGM1_WGMXCC1_WGMXCCGn1
    SolutionIndex: 94
    SolutionNameMin: Cijk_Ailk_Bjlk_HSS_BH_UserArgs_MT256x256x64_MI16x16x1_SN_LDSB1_CLR1_GSU0_GSUC0_GSUWGMRR0_K1_LBSPPA2048_LBSPPB2048_LPA0_LPB0_MIWT8_8_PLR1_SU32_SUM0_SUS256_SKXCCM6_VWA4_VWB4_WGM8_WGMXCC1_WGMXCCGn1
    SolutionIndex: 95
    SolutionNameMin: Cijk_Ailk_Bjlk_HSS_BH_UserArgs_MT256x256x64_MI16x16x1_SN_LDSB1_CLR1_GSU0_GSUC0_GSUWGMRR0_K1_LBSPPA2048_LBSPPB2048_LPA0_LPB0_MIWT8_8_PLR2_SU32_SUM0_SUS256_SKXCCM6_VWA4_VWB8_WGM8_WGMXCC1_WGMXCCGn1
    SolutionIndex: 96
    SolutionNameMin: Cijk_Ailk_Bjlk_HSS_BH_UserArgs_MT128x256x64_MI16x16x1_SN_LDSB1_CLR1_GSU0_GSUC0_GSUWGMRR0_K1_LBSPPA1024_LBSPPB2048_LPA0_LPB32_MIWT4_8_PLR1_SU32_SUM0_SUS256_SKXCCM6_VWA4_VWB2_WGM1_WGMXCC1_WGMXCCGn1
    SolutionIndex: 97
    SolutionNameMin: Cijk_Ailk_Bjlk_HSS_BH_UserArgs_MT128x256x64_MI16x16x1_SN_LDSB1_CLR1_GSU0_GSUC0_GSUWGMRR0_K1_LBSPPA1024_LBSPPB2048_LPA0_LPB0_MIWT4_8_PLR1_SU32_SUM0_SUS256_SKXCCM6_VWA4_VWB4_WGM1_WGMXCC1_WGMXCCGn1
    SolutionIndex: 98
    SolutionNameMin: Cijk_Ailk_Bjlk_HSS_BH_UserArgs_MT128x256x64_MI16x16x1_SN_LDSB1_CLR1_GSU0_GSUC0_GSUWGMRR0_K1_LBSPPA1024_LBSPPB2048_LPA0_LPB0_MIWT4_8_PLR2_SU32_SUM0_SUS256_SKXCCM6_VWA4_VWB4_WGM1_WGMXCC1_WGMXCCGn1
    SolutionIndex: 99
    SolutionNameMin: Cijk_Ailk_Bjlk_HSS_BH_UserArgs_MT128x256x64_MI16x16x1_SN_LDSB1_CLR1_GSU0_GSUC0_GSUWGMRR0_K1_LBSPPA1024_LBSPPB2048_LPA0_LPB0_MIWT4_8_PLR2_SU32_SUM0_SUS256_SKXCCM6_VWA4_VWB8_WGM1_WGMXCC1_WGMXCCGn1
    SolutionIndex: 100
    SolutionNameMin: Cijk_Ailk_Bjlk_HSS_BH_UserArgs_MT128x256x64_MI16x16x1_SN_LDSB1_CLR1_GSU0_GSUC0_GSUWGMRR0_K1_LBSPPA1024_LBSPPB2048_LPA0_LPB32_MIWT4_8_PLR1_SU32_SUM0_SUS256_SKXCCM6_VWA4_VWB2_WGM4_WGMXCC1_WGMXCCGn1
    SolutionIndex: 101
    SolutionNameMin: Cijk_Ailk_Bjlk_HSS_BH_UserArgs_MT128x256x64_MI16x16x1_SN_LDSB1_CLR1_GSU0_GSUC0_GSUWGMRR0_K1_LBSPPA1024_LBSPPB2048_LPA0_LPB0_MIWT4_8_PLR1_SU32_SUM0_SUS256_SKXCCM6_VWA4_VWB4_WGM4_WGMXCC1_WGMXCCGn1
    SolutionIndex: 102
    SolutionNameMin: Cijk_Ailk_Bjlk_HSS_BH_UserArgs_MT128x256x64_MI16x16x1_SN_LDSB1_CLR1_GSU0_GSUC0_GSUWGMRR0_K1_LBSPPA1024_LBSPPB2048_LPA0_LPB32_MIWT4_8_PLR1_SU32_SUM0_SUS256_SKXCCM6_VWA4_VWB2_WGM8_WGMXCC1_WGMXCCGn1
    SolutionIndex: 103
    SolutionNameMin: Cijk_Ailk_Bjlk_HSS_BH_UserArgs_MT128x256x64_MI16x16x1_SN_LDSB1_CLR1_GSU0_GSUC0_GSUWGMRR0_K1_LBSPPA1024_LBSPPB2048_LPA0_LPB0_MIWT4_8_PLR1_SU32_SUM0_SUS256_SKXCCM6_VWA4_VWB4_WGM8_WGMXCC1_WGMXCCGn1
    SolutionIndex: 104
    SolutionNameMin: Cijk_Ailk_Bjlk_HSS_BH_UserArgs_MT256x128x64_MI16x16x1_SN_LDSB1_CLR1_GSU0_GSUC0_GSUWGMRR0_K1_LBSPPA2048_LBSPPB1024_LPA0_LPB32_MIWT8_4_PLR1_SU32_SUM0_SUS256_SKXCCM6_VWA4_VWB2_WGM4_WGMXCC1_WGMXCCGn1
    SolutionIndex: 105
    SolutionNameMin: Cijk_Ailk_Bjlk_HSS_BH_UserArgs_MT256x128x64_MI16x16x1_SN_LDSB1_CLR1_GSU0_GSUC0_GSUWGMRR0_K1_LBSPPA2048_LBSPPB1024_LPA0_LPB0_MIWT8_4_PLR2_SU32_SUM0_SUS256_SKXCCM6_VWA4_VWB4_WGM4_WGMXCC1_WGMXCCGn1
    SolutionIndex: 106
    SolutionNameMin: Cijk_Ailk_Bjlk_HSS_BH_UserArgs_MT256x128x64_MI16x16x1_SN_LDSB1_CLR1_GSU0_GSUC0_GSUWGMRR0_K1_LBSPPA2048_LBSPPB1024_LPA0_LPB32_MIWT8_4_PLR1_SU32_SUM0_SUS256_SKXCCM6_VWA4_VWB2_WGM8_WGMXCC1_WGMXCCGn1
    SolutionIndex: 107
    SolutionNameMin: Cijk_Ailk_Bjlk_HSS_BH_UserArgs_MT256x128x64_MI16x16x1_SN_LDSB1_CLR1_GSU0_GSUC0_GSUWGMRR0_K1_LBSPPA2048_LBSPPB1024_LPA0_LPB32_MIWT8_4_PLR2_SU32_SUM0_SUS256_SKXCCM6_VWA4_VWB2_WGM8_WGMXCC1_WGMXCCGn1
    SolutionIndex: 108
    SolutionNameMin: Cijk_Ailk_Bjlk_HSS_BH_UserArgs_MT128x128x64_MI16x16x1_SN_LDSB1_CLR1_GSU0_GSUC0_GSUWGMRR0_K1_LBSPPA1024_LBSPPB1024_LPA0_LPB32_MIWT4_4_PLR1_SU32_SUM0_SUS256_SKXCCM6_VWA4_VWB2_WGM1_WGMXCC1_WGMXCCGn1
    SolutionIndex: 109
    SolutionNameMin: Cijk_Ailk_Bjlk_HSS_BH_UserArgs_MT128x128x64_MI16x16x1_SN_LDSB1_CLR1_GSU0_GSUC0_GSUWGMRR0_K1_LBSPPA1024_LBSPPB1024_LPA0_LPB0_MIWT4_4_PLR1_SU32_SUM0_SUS256_SKXCCM6_VWA4_VWB4_WGM1_WGMXCC1_WGMXCCGn1
    SolutionIndex: 110
    SolutionNameMin: Cijk_Ailk_Bjlk_HSS_BH_UserArgs_MT128x128x64_MI16x16x1_SN_LDSB1_CLR1_GSU0_GSUC0_GSUWGMRR0_K1_LBSPPA1024_LBSPPB1024_LPA0_LPB0_MIWT4_4_PLR2_SU32_SUM0_SUS256_SKXCCM6_VWA4_VWB4_WGM1_WGMXCC1_WGMXCCGn1
    SolutionIndex: 111
    SolutionNameMin: Cijk_Ailk_Bjlk_HSS_BH_UserArgs_MT128x128x64_MI16x16x1_SN_LDSB1_CLR1_GSU0_GSUC0_GSUWGMRR0_K1_LBSPPA1024_LBSPPB1024_LPA0_LPB0_MIWT4_4_PLR1_SU32_SUM0_SUS256_SKXCCM6_VWA4_VWB4_WGM4_WGMXCC1_WGMXCCGn1
    SolutionIndex: 112
    SolutionNameMin: Cijk_Ailk_Bjlk_HSS_BH_UserArgs_MT128x128x64_MI16x16x1_SN_LDSB1_CLR1_GSU0_GSUC0_GSUWGMRR0_K1_LBSPPA1024_LBSPPB1024_LPA0_LPB32_MIWT4_4_PLR2_SU32_SUM0_SUS256_SKXCCM6_VWA4_VWB2_WGM4_WGMXCC1_WGMXCCGn1
    SolutionIndex: 113
    SolutionNameMin: Cijk_Ailk_Bjlk_HSS_BH_UserArgs_MT128x128x64_MI16x16x1_SN_LDSB1_CLR1_GSU0_GSUC0_GSUWGMRR0_K1_LBSPPA1024_LBSPPB1024_LPA0_LPB0_MIWT4_4_PLR2_SU32_SUM0_SUS256_SKXCCM6_VWA4_VWB4_WGM4_WGMXCC1_WGMXCCGn1
    SolutionIndex: 114
    SolutionNameMin: Cijk_Ailk_Bjlk_HSS_BH_UserArgs_MT128x128x64_MI16x16x1_SN_LDSB1_CLR1_GSU0_GSUC0_GSUWGMRR0_K1_LBSPPA1024_LBSPPB1024_LPA0_LPB0_MIWT4_4_PLR1_SU32_SUM0_SUS256_SKXCCM6_VWA4_VWB4_WGM8_WGMXCC1_WGMXCCGn1
    SolutionIndex: 115
    SolutionNameMin: Cijk_Ailk_Bjlk_HSS_BH_UserArgs_MT128x128x64_MI16x16x1_SN_LDSB1_CLR1_GSU0_GSUC0_GSUWGMRR0_K1_LBSPPA1024_LBSPPB1024_LPA0_LPB32_MIWT4_4_PLR2_SU32_SUM0_SUS256_SKXCCM6_VWA4_VWB2_WGM8_WGMXCC1_WGMXCCGn1
    SolutionIndex: 116
    SolutionNameMin: Cijk_Ailk_Bjlk_HSS_BH_UserArgs_MT128x128x64_MI16x16x1_SN_LDSB1_CLR1_GSU0_GSUC0_GSUWGMRR0_K1_LBSPPA1024_LBSPPB1024_LPA0_LPB0_MIWT4_4_PLR2_SU32_SUM0_SUS256_SKXCCM6_VWA4_VWB4_WGM8_WGMXCC1_WGMXCCGn1
    SolutionIndex: 117
    SolutionNameMin: Cijk_Ailk_Bjlk_HSS_BH_UserArgs_MT64x128x64_MI16x16x1_SN_LDSB1_CLR1_GSU0_GSUC0_GSUWGMRR0_K1_LBSPPA512_LBSPPB1024_LPA32_LPB0_MIWT2_4_PLR2_SU32_SUM0_SUS256_SKXCCM6_VWA2_VWB4_WGM4_WGMXCC1_WGMXCCGn1
    SolutionIndex: 118
    SolutionNameMin: Cijk_Ailk_Bjlk_HSS_BH_UserArgs_MT128x64x64_MI16x16x1_SN_LDSB1_CLR1_GSU0_GSUC0_GSUWGMRR0_K1_LBSPPA1024_LBSPPB512_LPA0_LPB32_MIWT4_2_PLR2_SU32_SUM0_SUS256_SKXCCM6_VWA4_VWB2_WGM1_WGMXCC1_WGMXCCGn1
    SolutionIndex: 119
    SolutionNameMin: Cijk_Ailk_Bjlk_HSS_BH_UserArgs_MT128x64x64_MI16x16x1_SN_LDSB1_CLR1_GSU0_GSUC0_GSUWGMRR0_K1_LBSPPA1024_LBSPPB512_LPA0_LPB32_MIWT4_2_PLR2_SU32_SUM0_SUS256_SKXCCM6_VWA4_VWB2_WGM4_WGMXCC1_WGMXCCGn1
    SolutionIndex: 120
    SolutionNameMin: Cijk_Ailk_Bjlk_HSS_BH_UserArgs_MT128x64x64_MI16x16x1_SN_LDSB1_CLR1_GSU0_GSUC0_GSUWGMRR0_K1_LBSPPA1024_LBSPPB512_LPA0_LPB32_MIWT4_2_PLR2_SU32_SUM0_SUS256_SKXCCM6_VWA4_VWB2_WGM8_WGMXCC1_WGMXCCGn1
    SolutionIndex: 121
    SolutionNameMin: Cijk_Ailk_Bjlk_HSS_BH_UserArgs_MT64x64x64_MI16x16x1_SN_LDSB1_CLR1_GSU0_GSUC0_GSUWGMRR0_K1_LBSPPA512_LBSPPB512_LPA32_LPB32_MIWT2_2_PLR2_SU32_SUM0_SUS256_SKXCCM6_VWA2_VWB2_WGM1_WGMXCC1_WGMXCCGn1
    SolutionIndex: 122
    SolutionNameMin: Cijk_Ailk_Bjlk_HSS_BH_UserArgs_MT64x64x64_MI16x16x1_SN_LDSB1_CLR1_GSU0_GSUC0_GSUWGMRR0_K1_LBSPPA512_LBSPPB512_LPA32_LPB32_MIWT2_2_PLR1_SU32_SUM0_SUS256_SKXCCM6_VWA2_VWB2_WGM8_WGMXCC1_WGMXCCGn1
    SolutionIndex: 123
    SolutionNameMin: Cijk_Ailk_Bjlk_HSS_BH_UserArgs_MT32x64x64_MI16x16x1_SN_LDSB0_CLR1_GSU0_GSUC0_GSUWGMRR0_K1_LBSPPA256_LBSPPB512_LPA16_LPB32_MIWT1_2_PLR2_SU32_SUM0_SUS256_SKXCCM6_VWA1_VWB2_WGM1_WGMXCC1_WGMXCCGn1
    SolutionIndex: 124
    SolutionNameMin: Cijk_Ailk_Bjlk_HSS_BH_UserArgs_MT32x32x64_MI16x16x1_SN_LDSB0_CLR1_GSU0_GSUC0_GSUWGMRR0_K1_LBSPPA256_LBSPPB256_LPA16_LPB16_MIWT1_1_PLR1_SU32_SUM0_SUS256_SKXCCM6_VWA1_VWB1_WGM1_WGMXCC1_WGMXCCGn1
    SolutionIndex: 125
    SolutionNameMin: Cijk_Ailk_Bjlk_HSS_BH_UserArgs_MT128x128x128_MI16x16x1_SN_LDSB1_CLR1_GSU0_GSUC0_GSUWGMRR0_K1_LBSPPA1024_LBSPPB1024_LPA0_LPB0_MIWT4_4_PLR1_SU32_SUM0_SUS256_SKXCCM6_VWA4_VWB4_WGM1_WGMXCC1_WGMXCCGn1
    SolutionIndex: 126
    SolutionNameMin: Cijk_Ailk_Bjlk_HSS_BH_UserArgs_MT128x128x128_MI16x16x1_SN_LDSB1_CLR1_GSU0_GSUC0_GSUWGMRR0_K1_LBSPPA1024_LBSPPB1024_LPA0_LPB0_MIWT4_4_PLR1_SU32_SUM0_SUS256_SKXCCM6_VWA4_VWB4_WGM4_WGMXCC1_WGMXCCGn1
    SolutionIndex: 127
    SolutionNameMin: Cijk_Ailk_Bjlk_HSS_BH_UserArgs_MT128x128x128_MI16x16x1_SN_LDSB1_CLR1_GSU0_GSUC0_GSUWGMRR0_K1_LBSPPA1024_LBSPPB1024_LPA0_LPB0_MIWT4_4_PLR2_SU32_SUM0_SUS256_SKXCCM6_VWA4_VWB4_WGM4_WGMXCC1_WGMXCCGn1
    SolutionIndex: 128
    SolutionNameMin: Cijk_Ailk_Bjlk_HSS_BH_UserArgs_MT128x128x128_MI16x16x1_SN_LDSB1_CLR1_GSU0_GSUC0_GSUWGMRR0_K1_LBSPPA1024_LBSPPB1024_LPA0_LPB0_MIWT4_4_PLR1_SU32_SUM0_SUS256_SKXCCM6_VWA4_VWB4_WGM8_WGMXCC1_WGMXCCGn1
    SolutionIndex: 129
    SolutionNameMin: Cijk_Ailk_Bjlk_HSS_BH_UserArgs_MT128x128x128_MI16x16x1_SN_LDSB1_CLR1_GSU0_GSUC0_GSUWGMRR0_K1_LBSPPA1024_LBSPPB1024_LPA0_LPB0_MIWT4_4_PLR2_SU32_SUM0_SUS256_SKXCCM6_VWA4_VWB4_WGM8_WGMXCC1_WGMXCCGn1
    SolutionIndex: 130
    SolutionNameMin: Cijk_Ailk_Bjlk_HSS_BH_UserArgs_MT128x64x128_MI16x16x1_SN_LDSB1_CLR1_GSU0_GSUC0_GSUWGMRR0_K1_LBSPPA1024_LBSPPB512_LPA0_LPB32_MIWT4_2_PLR2_SU32_SUM0_SUS256_SKXCCM6_VWA4_VWB2_WGM1_WGMXCC1_WGMXCCGn1
    SolutionIndex: 131
    SolutionNameMin: Cijk_Ailk_Bjlk_HSS_BH_UserArgs_MT128x64x128_MI16x16x1_SN_LDSB1_CLR1_GSU0_GSUC0_GSUWGMRR0_K1_LBSPPA1024_LBSPPB512_LPA0_LPB32_MIWT4_2_PLR2_SU32_SUM0_SUS256_SKXCCM6_VWA4_VWB2_WGM4_WGMXCC1_WGMXCCGn1
    SolutionIndex: 132
    SolutionNameMin: Cijk_Ailk_Bjlk_HSS_BH_UserArgs_MT128x64x128_MI16x16x1_SN_LDSB1_CLR1_GSU0_GSUC0_GSUWGMRR0_K1_LBSPPA1024_LBSPPB512_LPA0_LPB32_MIWT4_2_PLR2_SU32_SUM0_SUS256_SKXCCM6_VWA4_VWB2_WGM8_WGMXCC1_WGMXCCGn1
    SolutionIndex: 133
    SolutionNameMin: Cijk_Ailk_Bjlk_HSS_BH_UserArgs_MT64x64x128_MI16x16x1_SN_LDSB1_CLR1_GSU0_GSUC0_GSUWGMRR0_K1_LBSPPA512_LBSPPB512_LPA32_LPB32_MIWT2_2_PLR2_SU32_SUM0_SUS256_SKXCCM6_VWA2_VWB2_WGM1_WGMXCC1_WGMXCCGn1
    SolutionIndex: 134
    SolutionNameMin: Cijk_Ailk_Bjlk_HSS_BH_UserArgs_MT64x64x128_MI16x16x1_SN_LDSB1_CLR1_GSU0_GSUC0_GSUWGMRR0_K1_LBSPPA512_LBSPPB512_LPA32_LPB32_MIWT2_2_PLR2_SU32_SUM0_SUS256_SKXCCM6_VWA2_VWB2_WGM4_WGMXCC1_WGMXCCGn1
    SolutionIndex: 135
    SolutionNameMin: Cijk_Ailk_Bjlk_HSS_BH_UserArgs_MT64x64x128_MI16x16x1_SN_LDSB1_CLR1_GSU0_GSUC0_GSUWGMRR0_K1_LBSPPA512_LBSPPB512_LPA32_LPB32_MIWT2_2_PLR2_SU32_SUM0_SUS256_SKXCCM6_VWA2_VWB2_WGM8_WGMXCC1_WGMXCCGn1
    SolutionIndex: 136
    SolutionNameMin: Cijk_Ailk_Bjlk_HSS_BH_UserArgs_MT64x32x128_MI16x16x1_SN_LDSB1_CLR1_GSU0_GSUC0_GSUWGMRR0_K1_LBSPPA512_LBSPPB256_LPA32_LPB16_MIWT2_1_PLR2_SU32_SUM0_SUS256_SKXCCM6_VWA2_VWB1_WGM1_WGMXCC1_WGMXCCGn1
    SolutionIndex: 137
    SolutionNameMin: Cijk_Ailk_Bjlk_HSS_BH_UserArgs_MT64x32x128_MI16x16x1_SN_LDSB1_CLR1_GSU0_GSUC0_GSUWGMRR0_K1_LBSPPA512_LBSPPB256_LPA32_LPB16_MIWT2_1_PLR2_SU32_SUM0_SUS256_SKXCCM6_VWA2_VWB1_WGM8_WGMXCC1_WGMXCCGn1
    SolutionIndex: 138
    SolutionNameMin: Cijk_Ailk_Bjlk_HSS_BH_UserArgs_MT32x32x128_MI16x16x1_SN_LDSB1_CLR1_GSU0_GSUC0_GSUWGMRR0_K1_LBSPPA256_LBSPPB256_LPA16_LPB16_MIWT1_1_PLR1_SU32_SUM0_SUS256_SKXCCM6_VWA1_VWB1_WGM1_WGMXCC1_WGMXCCGn1
    SolutionIndex: 139
    SolutionNameMin: Cijk_Ailk_Bjlk_HSS_BH_UserArgs_MT64x32x128_MI16x16x1_SN_LDSB1_CLR1_GSU0_GSUC0_GSUWGMRR0_K1_LBSPPA512_LBSPPB256_LPA16_LPB16_MIWT2_1_PLR2_SU32_SUM0_SUS256_SKXCCM0_VWA1_VWB1_WGM8_WGMXCC1_WGMXCCGn1
- - - [128, 128, 1, 128, 128, 128, 128, 128]
    - [48, 0.079]
  - - [128, 128, 1, 256, 128, 128, 128, 128]
    - [48, 0.14]
  - - [128, 128, 1, 512, 128, 128, 128, 128]
    - [47, 0.227]
  - - [128, 128, 1, 1024, 128, 128, 128, 128]
    - [45, 0.337]
  - - [128, 128, 1, 2048, 128, 128, 128, 128]
    - [19, 0.552]
  - - [128, 128, 1, 4096, 128, 128, 128, 128]
    - [45, 0.934]
  - - [128, 128, 1, 8192, 128, 128, 128, 128]
    - [88, 1.406]
  - - [128, 256, 1, 128, 128, 128, 128, 256]
    - [46, 0.162]
  - - [128, 256, 1, 256, 128, 128, 128, 256]
    - [46, 0.287]
  - - [128, 256, 1, 512, 128, 128, 128, 256]
    - [60, 0.46]
  - - [128, 256, 1, 1024, 128, 128, 128, 256]
    - [60, 0.672]
  - - [128, 256, 1, 2048, 128, 128, 128, 256]
    - [89, 1.076]
  - - [128, 256, 1, 4096, 128, 128, 128, 256]
    - [45, 1.82]
  - - [128, 256, 1, 8192, 128, 128, 128, 256]
    - [60, 2.638]
  - - [128, 512, 1, 128, 128, 128, 128, 512]
    - [19, 0.318]
  - - [128, 512, 1, 256, 128, 128, 128, 512]
    - [46, 0.57]
  - - [128, 512, 1, 512, 128, 128, 128, 512]
    - [60, 0.916]
  - - [128, 512, 1, 1024, 128, 128, 128, 512]
    - [60, 1.328]
  - - [128, 512, 1, 2048, 128, 128, 128, 512]
    - [60, 2.031]
  - - [128, 512, 1, 4096, 128, 128, 128, 512]
    - [43, 3.167]
  - - [128, 512, 1, 8192, 128, 128, 128, 512]
    - [56, 4.715]
  - - [128, 1024, 1, 128, 128, 128, 128, 1024]
    - [19, 0.631]
  - - [128, 1024, 1, 256, 128, 128, 128, 1024]
    - [46, 1.112]
  - - [128, 1024, 1, 512, 128, 128, 128, 1024]
    - [46, 1.797]
  - - [128, 1024, 1, 1024, 128, 128, 128, 1024]
    - [60, 2.591]
  - - [128, 1024, 1, 2048, 128, 128, 128, 1024]
    - [58, 3.627]
  - - [128, 1024, 1, 4096, 128, 128, 128, 1024]
    - [42, 5.292]
  - - [128, 1024, 1, 8192, 128, 128, 128, 1024]
    - [133, 7.84]
  - - [128, 2048, 1, 128, 128, 128, 128, 2048]
    - [44, 1.146]
  - - [128, 2048, 1, 256, 128, 128, 128, 2048]
    - [44, 1.994]
  - - [128, 2048, 1, 512, 128, 128, 128, 2048]
    - [56, 3.192]
  - - [128, 2048, 1, 1024, 128, 128, 128, 2048]
    - [57, 4.628]
  - - [128, 2048, 1, 2048, 128, 128, 128, 2048]
    - [133, 6.077]
  - - [128, 2048, 1, 4096, 128, 128, 128, 2048]
    - [133, 8.587]
  - - [128, 2048, 1, 8192, 128, 128, 128, 2048]
    - [130, 11.507]
  - - [128, 4096, 1, 128, 128, 128, 128, 4096]
    - [41, 1.971]
  - - [128, 4096, 1, 256, 128, 128, 128, 4096]
    - [41, 3.434]
  - - [128, 4096, 1, 512, 128, 128, 128, 4096]
    - [54, 5.494]
  - - [128, 4096, 1, 1024, 128, 128, 128, 4096]
    - [133, 7.764]
  - - [128, 4096, 1, 2048, 128, 128, 128, 4096]
    - [133, 9.394]
  - - [128, 4096, 1, 4096, 128, 128, 128, 4096]
    - [36, 12.546]
  - - [128, 4096, 1, 8192, 128, 128, 128, 4096]
    - [126, 15.966]
  - - [128, 8192, 1, 128, 128, 128, 128, 8192]
    - [16, 3.15]
  - - [128, 8192, 1, 256, 128, 128, 128, 8192]
    - [37, 5.223]
  - - [128, 8192, 1, 512, 128, 128, 128, 8192]
    - [118, 8.111]
  - - [128, 8192, 1, 1024, 128, 128, 128, 8192]
    - [52, 11.162]
  - - [128, 8192, 1, 2048, 128, 128, 128, 8192]
    - [127, 12.814]
  - - [128, 8192, 1, 4096, 128, 128, 128, 8192]
    - [118, 15.624]
  - - [128, 8192, 1, 8192, 128, 128, 128, 8192]
    - [49, 18.553]
  - - [256, 128, 1, 128, 256, 256, 256, 128]
    - [45, 0.163]
  - - [256, 128, 1, 256, 256, 256, 256, 128]
    - [46, 0.288]
  - - [256, 128, 1, 512, 256, 256, 256, 128]
    - [124, 0.452]
  - - [256, 128, 1, 1024, 256, 256, 256, 128]
    - [59, 0.667]
  - - [256, 128, 1, 2048, 256, 256, 256, 128]
    - [88, 1.068]
  - - [256, 128, 1, 4096, 256, 256, 256, 128]
    - [46, 1.807]
  - - [256, 128, 1, 8192, 256, 256, 256, 128]
    - [60, 2.616]
  - - [256, 256, 1, 128, 256, 256, 256, 256]
    - [19, 0.318]
  - - [256, 256, 1, 256, 256, 256, 256, 256]
    - [46, 0.568]
  - - [256, 256, 1, 512, 256, 256, 256, 256]
    - [59, 0.909]
  - - [256, 256, 1, 1024, 256, 256, 256, 256]
    - [59, 1.324]
  - - [256, 256, 1, 2048, 256, 256, 256, 256]
    - [138, 2.018]
  - - [256, 256, 1, 4096, 256, 256, 256, 256]
    - [123, 3.18]
  - - [256, 256, 1, 8192, 256, 256, 256, 256]
    - [58, 4.759]
  - - [256, 512, 1, 128, 256, 256, 256, 512]
    - [19, 0.625]
  - - [256, 512, 1, 256, 256, 256, 256, 512]
    - [46, 1.095]
  - - [256, 512, 1, 512, 256, 256, 256, 512]
    - [45, 1.746]
  - - [256, 512, 1, 1024, 256, 256, 256, 512]
    - [60, 2.59]
  - - [256, 512, 1, 2048, 256, 256, 256, 512]
    - [136, 3.64]
  - - [256, 512, 1, 4096, 256, 256, 256, 512]
    - [122, 5.323]
  - - [256, 512, 1, 8192, 256, 256, 256, 512]
    - [133, 7.378]
  - - [256, 1024, 1, 128, 256, 256, 256, 1024]
    - [43, 1.137]
  - - [256, 1024, 1, 256, 256, 256, 256, 1024]
    - [43, 1.991]
  - - [256, 1024, 1, 512, 256, 256, 256, 1024]
    - [58, 3.226]
  - - [256, 1024, 1, 1024, 256, 256, 256, 1024]
    - [56, 4.707]
  - - [256, 1024, 1, 2048, 256, 256, 256, 1024]
    - [54, 6.069]
  - - [256, 1024, 1, 4096, 256, 256, 256, 1024]
    - [37, 8.631]
  - - [256, 1024, 1, 8192, 256, 256, 256, 1024]
    - [53, 11.049]
  - - [256, 2048, 1, 128, 256, 256, 256, 2048]
    - [18, 1.93]
  - - [256, 2048, 1, 256, 256, 256, 256, 2048]
    - [121, 3.341]
  - - [256, 2048, 1, 512, 256, 256, 256, 2048]
    - [133, 5.391]
  - - [256, 2048, 1, 1024, 256, 256, 256, 2048]
    - [133, 7.814]
  - - [256, 2048, 1, 2048, 256, 256, 256, 2048]
    - [118, 9.29]
  - - [256, 2048, 1, 4096, 256, 256, 256, 2048]
    - [109, 12.839]
  - - [256, 2048, 1, 8192, 256, 256, 256, 2048]
    - [125, 16.323]
  - - [256, 4096, 1, 128, 256, 256, 256, 4096]
    - [16, 3.128]
  - - [256, 4096, 1, 256, 256, 256, 256, 4096]
    - [37, 5.269]
  - - [256, 4096, 1, 512, 256, 256, 256, 4096]
    - [39, 8.129]
  - - [256, 4096, 1, 1024, 256, 256, 256, 4096]
    - [131, 11.415]
  - - [256, 4096, 1, 2048, 256, 256, 256, 4096]
    - [127, 13.455]
  - - [256, 4096, 1, 4096, 256, 256, 256, 4096]
    - [108, 15.874]
  - - [256, 4096, 1, 8192, 256, 256, 256, 4096]
    - [32, 18.385]
  - - [256, 8192, 1, 128, 256, 256, 256, 8192]
    - [13, 4.502]
  - - [256, 8192, 1, 256, 256, 256, 256, 8192]
    - [109, 7.565]
  - - [256, 8192, 1, 512, 256, 256, 256, 8192]
    - [109, 11.703]
  - - [256, 8192, 1, 1024, 256, 256, 256, 8192]
    - [125, 15.831]
  - - [256, 8192, 1, 2048, 256, 256, 256, 8192]
    - [85, 16.075]
  - - [256, 8192, 1, 4096, 256, 256, 256, 8192]
    - [112, 19.825]
  - - [256, 8192, 1, 8192, 256, 256, 256, 8192]
    - [11, 22.686]
  - - [512, 128, 1, 128, 512, 512, 512, 128]
    - [46, 0.321]
  - - [512, 128, 1, 256, 512, 512, 512, 128]
    - [46, 0.57]
  - - [512, 128, 1, 512, 512, 512, 512, 128]
    - [46, 0.913]
  - - [512, 128, 1, 1024, 512, 512, 512, 128]
    - [60, 1.32]
  - - [512, 128, 1, 2048, 512, 512, 512, 128]
    - [59, 2.033]
  - - [512, 128, 1, 4096, 512, 512, 512, 128]
    - [43, 3.155]
  - - [512, 128, 1, 8192, 512, 512, 512, 128]
    - [137, 4.571]
  - - [512, 256, 1, 128, 512, 512, 512, 256]
    - [19, 0.624]
  - - [512, 256, 1, 256, 512, 512, 512, 256]
    - [46, 1.098]
  - - [512, 256, 1, 512, 512, 512, 512, 256]
    - [59, 1.768]
  - - [512, 256, 1, 1024, 512, 512, 512, 256]
    - [60, 2.575]
  - - [512, 256, 1, 2048, 512, 512, 512, 256]
    - [136, 3.632]
  - - [512, 256, 1, 4096, 512, 512, 512, 256]
    - [122, 5.308]
  - - [512, 256, 1, 8192, 512, 512, 512, 256]
    - [54, 7.307]
  - - [512, 512, 1, 128, 512, 512, 512, 512]
    - [43, 1.133]
  - - [512, 512, 1, 256, 512, 512, 512, 512]
    - [43, 1.989]
  - - [512, 512, 1, 512, 512, 512, 512, 512]
    - [56, 3.199]
  - - [512, 512, 1, 1024, 512, 512, 512, 512]
    - [56, 4.701]
  - - [512, 512, 1, 2048, 512, 512, 512, 512]
    - [133, 6.116]
  - - [512, 512, 1, 4096, 512, 512, 512, 512]
    - [37, 8.59]
  - - [512, 512, 1, 8192, 512, 512, 512, 512]
    - [131, 11.086]
  - - [512, 1024, 1, 128, 512, 512, 512, 1024]
    - [40, 1.974]
  - - [512, 1024, 1, 256, 512, 512, 512, 1024]
    - [41, 3.405]
  - - [512, 1024, 1, 512, 512, 512, 512, 1024]
    - [54, 5.45]
  - - [512, 1024, 1, 1024, 512, 512, 512, 1024]
    - [54, 7.882]
  - - [512, 1024, 1, 2048, 512, 512, 512, 1024]
    - [130, 9.51]
  - - [512, 1024, 1, 4096, 512, 512, 512, 1024]
    - [109, 12.396]
  - - [512, 1024, 1, 8192, 512, 512, 512, 1024]
    - [129, 16.122]
  - - [512, 2048, 1, 128, 512, 512, 512, 2048]
    - [17, 3.091]
  - - [512, 2048, 1, 256, 512, 512, 512, 2048]
    - [39, 5.218]
  - - [512, 2048, 1, 512, 512, 512, 512, 2048]
    - [130, 8.053]
  - - [512, 2048, 1, 1024, 512, 512, 512, 2048]
    - [130, 11.157]
  - - [512, 2048, 1, 2048, 512, 512, 512, 2048]
    - [125, 13.586]
  - - [512, 2048, 1, 4096, 512, 512, 512, 2048]
    - [35, 15.679]
  - - [512, 2048, 1, 8192, 512, 512, 512, 2048]
    - [107, 17.349]
  - - [512, 4096, 1, 128, 512, 512, 512, 4096]
    - [15, 4.502]
  - - [512, 4096, 1, 256, 512, 512, 512, 4096]
    - [109, 7.597]
  - - [512, 4096, 1, 512, 512, 512, 512, 4096]
    - [109, 11.932]
  - - [512, 4096, 1, 1024, 512, 512, 512, 4096]
    - [125, 15.852]
  - - [512, 4096, 1, 2048, 512, 512, 512, 4096]
    - [82, 16.146]
  - - [512, 4096, 1, 4096, 512, 512, 512, 4096]
    - [31, 18.696]
  - - [512, 4096, 1, 8192, 512, 512, 512, 4096]
    - [12, 21.015]
  - - [512, 8192, 1, 128, 512, 512, 512, 8192]
    - [72, 5.665]
  - - [512, 8192, 1, 256, 512, 512, 512, 8192]
    - [72, 9.417]
  - - [512, 8192, 1, 512, 512, 512, 512, 8192]
    - [27, 13.752]
  - - [512, 8192, 1, 1024, 512, 512, 512, 8192]
    - [79, 15.925]
  - - [512, 8192, 1, 2048, 512, 512, 512, 8192]
    - [126, 19.624]
  - - [512, 8192, 1, 4096, 512, 512, 512, 8192]
    - [31, 23.229]
  - - [512, 8192, 1, 8192, 512, 512, 512, 8192]
    - [25, 25.061]
  - - [1024, 128, 1, 128, 1024, 1024, 1024, 128]
    - [46, 0.627]
  - - [1024, 128, 1, 256, 1024, 1024, 1024, 128]
    - [46, 1.095]
  - - [1024, 128, 1, 512, 1024, 1024, 1024, 128]
    - [46, 1.777]
  - - [1024, 128, 1, 1024, 1024, 1024, 1024, 128]
    - [59, 2.598]
  - - [1024, 128, 1, 2048, 1024, 1024, 1024, 128]
    - [56, 3.647]
  - - [1024, 128, 1, 4096, 1024, 1024, 1024, 128]
    - [41, 5.363]
  - - [1024, 128, 1, 8192, 1024, 1024, 1024, 128]
    - [135, 7.254]
  - - [1024, 256, 1, 128, 1024, 1024, 1024, 256]
    - [43, 1.154]
  - - [1024, 256, 1, 256, 1024, 1024, 1024, 256]
    - [43, 2.011]
  - - [1024, 256, 1, 512, 1024, 1024, 1024, 256]
    - [56, 3.248]
  - - [1024, 256, 1, 1024, 1024, 1024, 1024, 256]
    - [56, 4.696]
  - - [1024, 256, 1, 2048, 1024, 1024, 1024, 256]
    - [54, 6.074]
  - - [1024, 256, 1, 4096, 1024, 1024, 1024, 256]
    - [39, 8.441]
  - - [1024, 256, 1, 8192, 1024, 1024, 1024, 256]
    - [131, 11.01]
  - - [1024, 512, 1, 128, 1024, 1024, 1024, 512]
    - [40, 1.982]
  - - [1024, 512, 1, 256, 1024, 1024, 1024, 512]
    - [41, 3.414]
  - - [1024, 512, 1, 512, 1024, 1024, 1024, 512]
    - [54, 5.472]
  - - [1024, 512, 1, 1024, 1024, 1024, 1024, 512]
    - [54, 7.946]
  - - [1024, 512, 1, 2048, 1024, 1024, 1024, 512]
    - [53, 9.085]
  - - [1024, 512, 1, 4096, 1024, 1024, 1024, 512]
    - [111, 12.556]
  - - [1024, 512, 1, 8192, 1024, 1024, 1024, 512]
    - [126, 16.288]
  - - [1024, 1024, 1, 128, 1024, 1024, 1024, 1024]
    - [16, 3.15]
  - - [1024, 1024, 1, 256, 1024, 1024, 1024, 1024]
    - [37, 5.315]
  - - [1024, 1024, 1, 512, 1024, 1024, 1024, 1024]
    - [39, 8.167]
  - - [1024, 1024, 1, 1024, 1024, 1024, 1024, 1024]
    - [53, 11.165]
  - - [1024, 1024, 1, 2048, 1024, 1024, 1024, 1024]
    - [126, 13.646]
  - - [1024, 1024, 1, 4096, 1024, 1024, 1024, 1024]
    - [34, 15.106]
  - - [1024, 1024, 1, 8192, 1024, 1024, 1024, 1024]
    - [51, 18.092]
  - - [1024, 2048, 1, 128, 1024, 1024, 1024, 2048]
    - [79, 4.485]
  - - [1024, 2048, 1, 256, 1024, 1024, 1024, 2048]
    - [109, 7.611]
  - - [1024, 2048, 1, 512, 1024, 1024, 1024, 2048]
    - [109, 11.893]
  - - [1024, 2048, 1, 1024, 1024, 1024, 1024, 2048]
    - [125, 15.762]
  - - [1024, 2048, 1, 2048, 1024, 1024, 1024, 2048]
    - [128, 14.849]
  - - [1024, 2048, 1, 4096, 1024, 1024, 1024, 2048]
    - [30, 18.765]
  - - [1024, 2048, 1, 8192, 1024, 1024, 1024, 2048]
    - [31, 20.887]
  - - [1024, 4096, 1, 128, 1024, 1024, 1024, 4096]
    - [69, 5.687]
  - - [1024, 4096, 1, 256, 1024, 1024, 1024, 4096]
    - [69, 9.553]
  - - [1024, 4096, 1, 512, 1024, 1024, 1024, 4096]
    - [26, 13.873]
  - - [1024, 4096, 1, 1024, 1024, 1024, 1024, 4096]
    - [113, 16.034]
  - - [1024, 4096, 1, 2048, 1024, 1024, 1024, 4096]
    - [129, 18.992]
  - - [1024, 4096, 1, 4096, 1024, 1024, 1024, 4096]
    - [12, 21.398]
  - - [1024, 4096, 1, 8192, 1024, 1024, 1024, 4096]
    - [7, 24.144]
  - - [1024, 8192, 1, 128, 1024, 1024, 1024, 8192]
    - [4, 6.386]
  - - [1024, 8192, 1, 256, 1024, 1024, 1024, 8192]
    - [3, 10.674]
  - - [1024, 8192, 1, 512, 1024, 1024, 1024, 8192]
    - [21, 15.399]
  - - [1024, 8192, 1, 1024, 1024, 1024, 1024, 8192]
    - [110, 18.474]
  - - [1024, 8192, 1, 2048, 1024, 1024, 1024, 8192]
    - [105, 21.735]
  - - [1024, 8192, 1, 4096, 1024, 1024, 1024, 8192]
    - [5, 24.543]
  - - [1024, 8192, 1, 8192, 1024, 1024, 1024, 8192]
    - [6, 28.106]
  - - [2048, 128, 1, 128, 2048, 2048, 2048, 128]
    - [43, 1.156]
  - - [2048, 128, 1, 256, 2048, 2048, 2048, 128]
    - [44, 2.019]
  - - [2048, 128, 1, 512, 2048, 2048, 2048, 128]
    - [56, 3.242]
  - - [2048, 128, 1, 1024, 2048, 2048, 2048, 128]
    - [58, 4.715]
  - - [2048, 128, 1, 2048, 2048, 2048, 2048, 128]
    - [55, 5.782]
  - - [2048, 128, 1, 4096, 2048, 2048, 2048, 128]
    - [119, 8.513]
  - - [2048, 128, 1, 8192, 2048, 2048, 2048, 128]
    - [132, 11.126]
  - - [2048, 256, 1, 128, 2048, 2048, 2048, 256]
    - [41, 1.954]
  - - [2048, 256, 1, 256, 2048, 2048, 2048, 256]
    - [41, 3.395]
  - - [2048, 256, 1, 512, 2048, 2048, 2048, 256]
    - [54, 5.421]
  - - [2048, 256, 1, 1024, 2048, 2048, 2048, 256]
    - [135, 7.742]
  - - [2048, 256, 1, 2048, 2048, 2048, 2048, 256]
    - [120, 9.127]
  - - [2048, 256, 1, 4096, 2048, 2048, 2048, 256]
    - [111, 12.69]
  - - [2048, 256, 1, 8192, 2048, 2048, 2048, 256]
    - [128, 16.301]
  - - [2048, 512, 1, 128, 2048, 2048, 2048, 512]
    - [16, 3.14]
  - - [2048, 512, 1, 256, 2048, 2048, 2048, 512]
    - [38, 5.268]
  - - [2048, 512, 1, 512, 2048, 2048, 2048, 512]
    - [39, 8.093]
  - - [2048, 512, 1, 1024, 2048, 2048, 2048, 512]
    - [132, 11.014]
  - - [2048, 512, 1, 2048, 2048, 2048, 2048, 512]
    - [126, 13.966]
  - - [2048, 512, 1, 4096, 2048, 2048, 2048, 512]
    - [115, 15.607]
  - - [2048, 512, 1, 8192, 2048, 2048, 2048, 512]
    - [98, 17.5]
  - - [2048, 1024, 1, 128, 2048, 2048, 2048, 1024]
    - [79, 4.493]
  - - [2048, 1024, 1, 256, 2048, 2048, 2048, 1024]
    - [109, 7.528]
  - - [2048, 1024, 1, 512, 2048, 2048, 2048, 1024]
    - [109, 11.682]
  - - [2048, 1024, 1, 1024, 2048, 2048, 2048, 1024]
    - [126, 15.71]
  - - [2048, 1024, 1, 2048, 2048, 2048, 2048, 1024]
    - [82, 15.179]
  - - [2048, 1024, 1, 4096, 2048, 2048, 2048, 1024]
    - [29, 18.742]
  - - [2048, 1024, 1, 8192, 2048, 2048, 2048, 1024]
    - [8, 20.205]
  - - [2048, 2048, 1, 128, 2048, 2048, 2048, 2048]
    - [75, 5.732]
  - - [2048, 2048, 1, 256, 2048, 2048, 2048, 2048]
    - [71, 9.592]
  - - [2048, 2048, 1, 512, 2048, 2048, 2048, 2048]
    - [28, 13.875]
  - - [2048, 2048, 1, 1024, 2048, 2048, 2048, 2048]
    - [116, 15.412]
  - - [2048, 2048, 1, 2048, 2048, 2048, 2048, 2048]
    - [128, 19.13]
  - - [2048, 2048, 1, 4096, 2048, 2048, 2048, 2048]
    - [67, 21.51]
  - - [2048, 2048, 1, 8192, 2048, 2048, 2048, 2048]
    - [92, 24.822]
  - - [2048, 4096, 1, 128, 2048, 2048, 2048, 4096]
    - [1, 6.291]
  - - [2048, 4096, 1, 256, 2048, 2048, 2048, 4096]
    - [2, 10.536]
  - - [2048, 4096, 1, 512, 2048, 2048, 2048, 4096]
    - [21, 15.672]
  - - [2048, 4096, 1, 1024, 2048, 2048, 2048, 4096]
    - [114, 18.112]
  - - [2048, 4096, 1, 2048, 2048, 2048, 2048, 4096]
    - [97, 21.627]
  - - [2048, 4096, 1, 4096, 2048, 2048, 2048, 4096]
    - [22, 24.592]
  - - [2048, 4096, 1, 8192, 2048, 2048, 2048, 4096]
    - [94, 27.397]
  - - [2048, 8192, 1, 128, 2048, 2048, 2048, 8192]
    - [118, 6.342]
  - - [2048, 8192, 1, 256, 2048, 2048, 2048, 8192]
    - [113, 10.553]
  - - [2048, 8192, 1, 512, 2048, 2048, 2048, 8192]
    - [74, 14.988]
  - - [2048, 8192, 1, 1024, 2048, 2048, 2048, 8192]
    - [99, 19.401]
  - - [2048, 8192, 1, 2048, 2048, 2048, 2048, 8192]
    - [98, 23.834]
  - - [2048, 8192, 1, 4096, 2048, 2048, 2048, 8192]
    - [69, 27.318]
  - - [2048, 8192, 1, 8192, 2048, 2048, 2048, 8192]
    - [64, 29.015]
  - - [4096, 128, 1, 128, 4096, 4096, 4096, 128]
    - [40, 1.972]
  - - [4096, 128, 1, 256, 4096, 4096, 4096, 128]
    - [41, 3.437]
  - - [4096, 128, 1, 512, 4096, 4096, 4096, 128]
    - [54, 5.439]
  - - [4096, 128, 1, 1024, 4096, 4096, 4096, 128]
    - [134, 7.747]
  - - [4096, 128, 1, 2048, 4096, 4096, 4096, 128]
    - [41, 9.381]
  - - [4096, 128, 1, 4096, 4096, 4096, 4096, 128]
    - [111, 12.614]
  - - [4096, 128, 1, 8192, 4096, 4096, 4096, 128]
    - [125, 15.838]
  - - [4096, 256, 1, 128, 4096, 4096, 4096, 256]
    - [87, 3.135]
  - - [4096, 256, 1, 256, 4096, 4096, 4096, 256]
    - [118, 5.242]
  - - [4096, 256, 1, 512, 4096, 4096, 4096, 256]
    - [119, 8.124]
  - - [4096, 256, 1, 1024, 4096, 4096, 4096, 256]
    - [132, 11.035]
  - - [4096, 256, 1, 2048, 4096, 4096, 4096, 256]
    - [126, 13.522]
  - - [4096, 256, 1, 4096, 4096, 4096, 4096, 256]
    - [116, 16.223]
  - - [4096, 256, 1, 8192, 4096, 4096, 4096, 256]
    - [96, 17.766]
  - - [4096, 512, 1, 128, 4096, 4096, 4096, 512]
    - [79, 4.47]
  - - [4096, 512, 1, 256, 4096, 4096, 4096, 512]
    - [81, 7.402]
  - - [4096, 512, 1, 512, 4096, 4096, 4096, 512]
    - [114, 11.626]
  - - [4096, 512, 1, 1024, 4096, 4096, 4096, 512]
    - [128, 15.688]
  - - [4096, 512, 1, 2048, 4096, 4096, 4096, 512]
    - [117, 15.857]
  - - [4096, 512, 1, 4096, 4096, 4096, 4096, 512]
    - [104, 18.88]
  - - [4096, 512, 1, 8192, 4096, 4096, 4096, 512]
    - [69, 21.091]
  - - [4096, 1024, 1, 128, 4096, 4096, 4096, 1024]
    - [70, 5.678]
  - - [4096, 1024, 1, 256, 4096, 4096, 4096, 1024]
    - [70, 9.403]
  - - [4096, 1024, 1, 512, 4096, 4096, 4096, 1024]
    - [100, 13.665]
  - - [4096, 1024, 1, 1024, 4096, 4096, 4096, 1024]
    - [83, 15.457]
  - - [4096, 1024, 1, 2048, 4096, 4096, 4096, 1024]
    - [129, 18.909]
  - - [4096, 1024, 1, 4096, 4096, 4096, 4096, 1024]
    - [68, 21.383]
  - - [4096, 1024, 1, 8192, 4096, 4096, 4096, 1024]
    - [90, 24.966]
  - - [4096, 2048, 1, 128, 4096, 4096, 4096, 2048]
    - [0, 6.213]
  - - [4096, 2048, 1, 256, 4096, 4096, 4096, 2048]
    - [0, 10.427]
  - - [4096, 2048, 1, 512, 4096, 4096, 4096, 2048]
    - [21, 15.448]
  - - [4096, 2048, 1, 1024, 4096, 4096, 4096, 2048]
    - [114, 18.282]
  - - [4096, 2048, 1, 2048, 4096, 4096, 4096, 2048]
    - [68, 22.001]
  - - [4096, 2048, 1, 4096, 4096, 4096, 4096, 2048]
    - [92, 24.992]
  - - [4096, 2048, 1, 8192, 4096, 4096, 4096, 2048]
    - [92, 28.08]
  - - [4096, 4096, 1, 128, 4096, 4096, 4096, 4096]
    - [49, 6.327]
  - - [4096, 4096, 1, 256, 4096, 4096, 4096, 4096]
    - [80, 10.415]
  - - [4096, 4096, 1, 512, 4096, 4096, 4096, 4096]
    - [69, 15.011]
  - - [4096, 4096, 1, 1024, 4096, 4096, 4096, 4096]
    - [76, 19.71]
  - - [4096, 4096, 1, 2048, 4096, 4096, 4096, 4096]
    - [68, 23.803]
  - - [4096, 4096, 1, 4096, 4096, 4096, 4096, 4096]
    - [91, 27.855]
  - - [4096, 4096, 1, 8192, 4096, 4096, 4096, 4096]
    - [90, 29.99]
  - - [4096, 8192, 1, 128, 4096, 4096, 4096, 8192]
    - [14, 6.647]
  - - [4096, 8192, 1, 256, 4096, 4096, 4096, 8192]
    - [74, 10.519]
  - - [4096, 8192, 1, 512, 4096, 4096, 4096, 8192]
    - [101, 15.26]
  - - [4096, 8192, 1, 1024, 4096, 4096, 4096, 8192]
    - [106, 20.905]
  - - [4096, 8192, 1, 2048, 4096, 4096, 4096, 8192]
    - [66, 26.627]
  - - [4096, 8192, 1, 4096, 4096, 4096, 4096, 8192]
    - [64, 31.787]
  - - [4096, 8192, 1, 8192, 4096, 4096, 4096, 8192]
    - [62, 33.819]
  - - [8192, 128, 1, 128, 8192, 8192, 8192, 128]
    - [86, 3.077]
  - - [8192, 128, 1, 256, 8192, 8192, 8192, 128]
    - [87, 5.156]
  - - [8192, 128, 1, 512, 8192, 8192, 8192, 128]
    - [119, 8.011]
  - - [8192, 128, 1, 1024, 8192, 8192, 8192, 128]
    - [131, 10.889]
  - - [8192, 128, 1, 2048, 8192, 8192, 8192, 128]
    - [126, 12.976]
  - - [8192, 128, 1, 4096, 8192, 8192, 8192, 128]
    - [115, 16.038]
  - - [8192, 128, 1, 8192, 8192, 8192, 8192, 128]
    - [35, 18.475]
  - - [8192, 256, 1, 128, 8192, 8192, 8192, 256]
    - [78, 4.38]
  - - [8192, 256, 1, 256, 8192, 8192, 8192, 256]
    - [83, 7.317]
  - - [8192, 256, 1, 512, 8192, 8192, 8192, 256]
    - [111, 11.543]
  - - [8192, 256, 1, 1024, 8192, 8192, 8192, 256]
    - [128, 15.776]
  - - [8192, 256, 1, 2048, 8192, 8192, 8192, 256]
    - [84, 16.165]
  - - [8192, 256, 1, 4096, 8192, 8192, 8192, 256]
    - [109, 19.404]
  - - [8192, 256, 1, 8192, 8192, 8192, 8192, 256]
    - [24, 22.392]
  - - [8192, 512, 1, 128, 8192, 8192, 8192, 512]
    - [73, 5.466]
  - - [8192, 512, 1, 256, 8192, 8192, 8192, 512]
    - [72, 9.173]
  - - [8192, 512, 1, 512, 8192, 8192, 8192, 512]
    - [103, 13.269]
  - - [8192, 512, 1, 1024, 8192, 8192, 8192, 512]
    - [113, 15.829]
  - - [8192, 512, 1, 2048, 8192, 8192, 8192, 512]
    - [72, 20.305]
  - - [8192, 512, 1, 4096, 8192, 8192, 8192, 512]
    - [69, 23.442]
  - - [8192, 512, 1, 8192, 8192, 8192, 8192, 512]
    - [98, 25.425]
  - - [8192, 1024, 1, 128, 8192, 8192, 8192, 1024]
    - [4, 6.13]
  - - [8192, 1024, 1, 256, 8192, 8192, 8192, 1024]
    - [4, 10.255]
  - - [8192, 1024, 1, 512, 8192, 8192, 8192, 1024]
    - [20, 15.175]
  - - [8192, 1024, 1, 1024, 8192, 8192, 8192, 1024]
    - [116, 19.14]
  - - [8192, 1024, 1, 2048, 8192, 8192, 8192, 1024]
    - [98, 22.089]
  - - [8192, 1024, 1, 4096, 8192, 8192, 8192, 1024]
    - [61, 24.552]
  - - [8192, 1024, 1, 8192, 8192, 8192, 8192, 1024]
    - [93, 28.789]
  - - [8192, 2048, 1, 128, 8192, 8192, 8192, 2048]
    - [50, 6.38]
  - - [8192, 2048, 1, 256, 8192, 8192, 8192, 2048]
    - [113, 10.207]
  - - [8192, 2048, 1, 512, 8192, 8192, 8192, 2048]
    - [9, 14.662]
  - - [8192, 2048, 1, 1024, 8192, 8192, 8192, 2048]
    - [97, 18.883]
  - - [8192, 2048, 1, 2048, 8192, 8192, 8192, 2048]
    - [23, 23.035]
  - - [8192, 2048, 1, 4096, 8192, 8192, 8192, 2048]
    - [65, 26.262]
  - - [8192, 2048, 1, 8192, 8192, 8192, 8192, 2048]
    - [91, 31.195]
  - - [8192, 4096, 1, 128, 8192, 8192, 8192, 4096]
    - [33, 6.58]
  - - [8192, 4096, 1, 256, 8192, 8192, 8192, 4096]
    - [107, 10.596]
  - - [8192, 4096, 1, 512, 8192, 8192, 8192, 4096]
    - [77, 15.304]
  - - [8192, 4096, 1, 1024, 8192, 8192, 8192, 4096]
    - [96, 21.092]
  - - [8192, 4096, 1, 2048, 8192, 8192, 8192, 4096]
    - [92, 27.153]
  - - [8192, 4096, 1, 4096, 8192, 8192, 8192, 4096]
    - [95, 31.107]
  - - [8192, 4096, 1, 8192, 8192, 8192, 8192, 4096]
    - [64, 33.972]
  - - [8192, 8192, 1, 128, 8192, 8192, 8192, 8192]
    - [10, 6.003]
  - - [8192, 8192, 1, 256, 8192, 8192, 8192, 8192]
    - [90, 10.205]
  - - [8192, 8192, 1, 512, 8192, 8192, 8192, 8192]
    - [102, 16.058]
  - - [8192, 8192, 1, 1024, 8192, 8192, 8192, 8192]
    - [93, 22.568]
  - - [8192, 8192, 1, 2048, 8192, 8192, 8192, 8192]
    - [63, 28.462]
  - - [8192, 8192, 1, 4096, 8192, 8192, 8192, 8192]
    - [4, 32.302]
  - - [8192, 8192, 1, 8192, 8192, 8192, 8192, 8192]
    - [64, 35.701]
  - - [1, 1, 1, 32, 1, 1, 1, 1]
    - [139, 0.0]
- null
- null
- ExperimentalStreamK
- GridBased
