library/src/amd_detail/rocblaslt/src/Tensile/Logic/asm_full/aquavanjaram/gfx942_20cu/StreamK/aquavanjaram942_Cijk_Alik_Bljk_HHS_BH_UserArgs.yaml
- {MinimumRequiredVersion: 4.33.0}
- aquavanjaram942
- {Architecture: gfx942, CUCount: 20}
- [Device 0049, Device 0050]
    SolutionIndex: 0
    SolutionNameMin: Cijk_Alik_Bljk_HHS_BH_UserArgs_MT32x32x32_MI16x16x1_SN_LDSB0_CLR0_GSU0_GSUC0_GSUWGMRR0_K1_LBSPPA128_LBSPPB128_MIWT1_1_PLR0_SU32_SUM0_SUS256_VWA1_VWB1_WGM1_WGMXCC1_WGMXCCGn1
    SolutionIndex: 1
    SolutionNameMin: Cijk_Alik_Bljk_HHS_BH_UserArgs_MT256x64x64_MI16x16x1_SN_LDSB1_CLR1_GSU0_GSUC0_GSUWGMRR0_K1_LBSPPA1024_LBSPPB256_MIWT8_2_PLR1_SU32_SUM0_SUS256_VWA8_VWB2_WGM1_WGMXCC1_WGMXCCGn1
    SolutionIndex: 2
    SolutionNameMin: Cijk_Alik_Bljk_HHS_BH_UserArgs_MT256x64x64_MI16x16x1_SN_LDSB1_CLR1_GSU0_GSUC0_GSUWGMRR0_K1_LBSPPA1024_LBSPPB256_MIWT8_2_PLR2_SU32_SUM0_SUS256_VWA8_VWB2_WGM1_WGMXCC1_WGMXCCGn1
    SolutionIndex: 3
    SolutionNameMin: Cijk_Alik_Bljk_HHS_BH_UserArgs_MT128x128x64_MI16x16x1_SN_LDSB1_CLR1_GSU0_GSUC0_GSUWGMRR0_K1_LBSPPA128_LBSPPB128_MIWT4_4_PLR1_SU32_SUM0_SUS256_VWA1_VWB1_WGM1_WGMXCC1_WGMXCCGn1
    SolutionIndex: 4
    SolutionNameMin: Cijk_Alik_Bljk_HHS_BH_UserArgs_MT128x128x64_MI16x16x1_SN_LDSB1_CLR1_GSU0_GSUC0_GSUWGMRR0_K1_LBSPPA256_LBSPPB128_MIWT4_4_PLR1_SU32_SUM0_SUS256_VWA2_VWB1_WGM1_WGMXCC1_WGMXCCGn1
    SolutionIndex: 5
    SolutionNameMin: Cijk_Alik_Bljk_HHS_BH_UserArgs_MT128x128x64_MI16x16x1_SN_LDSB1_CLR1_GSU0_GSUC0_GSUWGMRR0_K1_LBSPPA512_LBSPPB128_MIWT4_4_PLR1_SU32_SUM0_SUS256_VWA4_VWB1_WGM1_WGMXCC1_WGMXCCGn1
    SolutionIndex: 6
    SolutionNameMin: Cijk_Alik_Bljk_HHS_BH_UserArgs_MT128x128x64_MI16x16x1_SN_LDSB1_CLR1_GSU0_GSUC0_GSUWGMRR0_K1_LBSPPA256_LBSPPB256_MIWT4_4_PLR1_SU32_SUM0_SUS256_VWA2_VWB2_WGM1_WGMXCC1_WGMXCCGn1
    SolutionIndex: 7
    SolutionNameMin: Cijk_Alik_Bljk_HHS_BH_UserArgs_MT128x128x64_MI16x16x1_SN_LDSB1_CLR1_GSU0_GSUC0_GSUWGMRR0_K1_LBSPPA512_LBSPPB256_MIWT4_4_PLR1_SU32_SUM0_SUS256_VWA4_VWB2_WGM1_WGMXCC1_WGMXCCGn1
    SolutionIndex: 8
    SolutionNameMin: Cijk_Alik_Bljk_HHS_BH_UserArgs_MT128x128x64_MI16x16x1_SN_LDSB1_CLR1_GSU0_GSUC0_GSUWGMRR0_K1_LBSPPA256_LBSPPB512_MIWT4_4_PLR1_SU32_SUM0_SUS256_VWA2_VWB4_WGM1_WGMXCC1_WGMXCCGn1
    SolutionIndex: 9
    SolutionNameMin: Cijk_Alik_Bljk_HHS_BH_UserArgs_MT128x128x64_MI16x16x1_SN_LDSB1_CLR1_GSU0_GSUC0_GSUWGMRR0_K1_LBSPPA512_LBSPPB512_MIWT4_4_PLR1_SU32_SUM0_SUS256_VWA4_VWB4_WGM1_WGMXCC1_WGMXCCGn1
    SolutionIndex: 10
    SolutionNameMin: Cijk_Alik_Bljk_HHS_BH_UserArgs_MT128x128x64_MI16x16x1_SN_LDSB1_CLR1_GSU0_GSUC0_GSUWGMRR0_K1_LBSPPA512_LBSPPB128_MIWT4_4_PLR2_SU32_SUM0_SUS256_VWA4_VWB1_WGM1_WGMXCC1_WGMXCCGn1
    SolutionIndex: 11
    SolutionNameMin: Cijk_Alik_Bljk_HHS_BH_UserArgs_MT128x128x64_MI16x16x1_SN_LDSB1_CLR1_GSU0_GSUC0_GSUWGMRR0_K1_LBSPPA256_LBSPPB512_MIWT4_4_PLR2_SU32_SUM0_SUS256_VWA2_VWB4_WGM1_WGMXCC1_WGMXCCGn1
    SolutionIndex: 12
    SolutionNameMin: Cijk_Alik_Bljk_HHS_BH_UserArgs_MT128x128x64_MI16x16x1_SN_LDSB1_CLR1_GSU0_GSUC0_GSUWGMRR0_K1_LBSPPA256_LBSPPB128_MIWT4_4_PLR1_SU32_SUM0_SUS256_VWA2_VWB1_WGM4_WGMXCC1_WGMXCCGn1
    SolutionIndex: 13
    SolutionNameMin: Cijk_Alik_Bljk_HHS_BH_UserArgs_MT128x128x64_MI16x16x1_SN_LDSB1_CLR1_GSU0_GSUC0_GSUWGMRR0_K1_LBSPPA512_LBSPPB128_MIWT4_4_PLR1_SU32_SUM0_SUS256_VWA4_VWB1_WGM4_WGMXCC1_WGMXCCGn1
    SolutionIndex: 14
    SolutionNameMin: Cijk_Alik_Bljk_HHS_BH_UserArgs_MT128x128x64_MI16x16x1_SN_LDSB1_CLR1_GSU0_GSUC0_GSUWGMRR0_K1_LBSPPA256_LBSPPB256_MIWT4_4_PLR1_SU32_SUM0_SUS256_VWA2_VWB2_WGM4_WGMXCC1_WGMXCCGn1
    SolutionIndex: 15
    SolutionNameMin: Cijk_Alik_Bljk_HHS_BH_UserArgs_MT128x128x64_MI16x16x1_SN_LDSB1_CLR1_GSU0_GSUC0_GSUWGMRR0_K1_LBSPPA512_LBSPPB256_MIWT4_4_PLR1_SU32_SUM0_SUS256_VWA4_VWB2_WGM4_WGMXCC1_WGMXCCGn1
    SolutionIndex: 16
    SolutionNameMin: Cijk_Alik_Bljk_HHS_BH_UserArgs_MT128x128x64_MI16x16x1_SN_LDSB1_CLR1_GSU0_GSUC0_GSUWGMRR0_K1_LBSPPA128_LBSPPB512_MIWT4_4_PLR1_SU32_SUM0_SUS256_VWA1_VWB4_WGM4_WGMXCC1_WGMXCCGn1
    SolutionIndex: 17
    SolutionNameMin: Cijk_Alik_Bljk_HHS_BH_UserArgs_MT128x128x64_MI16x16x1_SN_LDSB1_CLR1_GSU0_GSUC0_GSUWGMRR0_K1_LBSPPA256_LBSPPB512_MIWT4_4_PLR1_SU32_SUM0_SUS256_VWA2_VWB4_WGM4_WGMXCC1_WGMXCCGn1
    SolutionIndex: 18
    SolutionNameMin: Cijk_Alik_Bljk_HHS_BH_UserArgs_MT128x128x64_MI16x16x1_SN_LDSB1_CLR1_GSU0_GSUC0_GSUWGMRR0_K1_LBSPPA512_LBSPPB512_MIWT4_4_PLR1_SU32_SUM0_SUS256_VWA4_VWB4_WGM4_WGMXCC1_WGMXCCGn1
    SolutionIndex: 19
    SolutionNameMin: Cijk_Alik_Bljk_HHS_BH_UserArgs_MT128x128x64_MI16x16x1_SN_LDSB1_CLR1_GSU0_GSUC0_GSUWGMRR0_K1_LBSPPA128_LBSPPB128_MIWT4_4_PLR1_SU32_SUM0_SUS256_VWA1_VWB1_WGM8_WGMXCC1_WGMXCCGn1
    SolutionIndex: 20
    SolutionNameMin: Cijk_Alik_Bljk_HHS_BH_UserArgs_MT128x128x64_MI16x16x1_SN_LDSB1_CLR1_GSU0_GSUC0_GSUWGMRR0_K1_LBSPPA256_LBSPPB128_MIWT4_4_PLR1_SU32_SUM0_SUS256_VWA2_VWB1_WGM8_WGMXCC1_WGMXCCGn1
    SolutionIndex: 21
    SolutionNameMin: Cijk_Alik_Bljk_HHS_BH_UserArgs_MT128x128x64_MI16x16x1_SN_LDSB1_CLR1_GSU0_GSUC0_GSUWGMRR0_K1_LBSPPA512_LBSPPB128_MIWT4_4_PLR1_SU32_SUM0_SUS256_VWA4_VWB1_WGM8_WGMXCC1_WGMXCCGn1
    SolutionIndex: 22
    SolutionNameMin: Cijk_Alik_Bljk_HHS_BH_UserArgs_MT128x128x64_MI16x16x1_SN_LDSB1_CLR1_GSU0_GSUC0_GSUWGMRR0_K1_LBSPPA128_LBSPPB256_MIWT4_4_PLR1_SU32_SUM0_SUS256_VWA1_VWB2_WGM8_WGMXCC1_WGMXCCGn1
    SolutionIndex: 23
    SolutionNameMin: Cijk_Alik_Bljk_HHS_BH_UserArgs_MT128x128x64_MI16x16x1_SN_LDSB1_CLR1_GSU0_GSUC0_GSUWGMRR0_K1_LBSPPA256_LBSPPB256_MIWT4_4_PLR1_SU32_SUM0_SUS256_VWA2_VWB2_WGM8_WGMXCC1_WGMXCCGn1
    SolutionIndex: 24
    SolutionNameMin: Cijk_Alik_Bljk_HHS_BH_UserArgs_MT128x128x64_MI16x16x1_SN_LDSB1_CLR1_GSU0_GSUC0_GSUWGMRR0_K1_LBSPPA512_LBSPPB256_MIWT4_4_PLR1_SU32_SUM0_SUS256_VWA4_VWB2_WGM8_WGMXCC1_WGMXCCGn1
    SolutionIndex: 25
    SolutionNameMin: Cijk_Alik_Bljk_HHS_BH_UserArgs_MT128x128x64_MI16x16x1_SN_LDSB1_CLR1_GSU0_GSUC0_GSUWGMRR0_K1_LBSPPA256_LBSPPB512_MIWT4_4_PLR1_SU32_SUM0_SUS256_VWA2_VWB4_WGM8_WGMXCC1_WGMXCCGn1
    SolutionIndex: 26
    SolutionNameMin: Cijk_Alik_Bljk_HHS_BH_UserArgs_MT128x128x64_MI16x16x1_SN_LDSB1_CLR1_GSU0_GSUC0_GSUWGMRR0_K1_LBSPPA512_LBSPPB512_MIWT4_4_PLR1_SU32_SUM0_SUS256_VWA4_VWB4_WGM8_WGMXCC1_WGMXCCGn1
    SolutionIndex: 27
    SolutionNameMin: Cijk_Alik_Bljk_HHS_BH_UserArgs_MT64x128x64_MI16x16x1_SN_LDSB1_CLR1_GSU0_GSUC0_GSUWGMRR0_K1_LBSPPA256_LBSPPB128_MIWT2_4_PLR1_SU32_SUM0_SUS256_VWA2_VWB1_WGM1_WGMXCC1_WGMXCCGn1
    SolutionIndex: 28
    SolutionNameMin: Cijk_Alik_Bljk_HHS_BH_UserArgs_MT64x128x64_MI16x16x1_SN_LDSB1_CLR1_GSU0_GSUC0_GSUWGMRR0_K1_LBSPPA256_LBSPPB256_MIWT2_4_PLR1_SU32_SUM0_SUS256_VWA2_VWB2_WGM1_WGMXCC1_WGMXCCGn1
    SolutionIndex: 29
    SolutionNameMin: Cijk_Alik_Bljk_HHS_BH_UserArgs_MT128x64x64_MI16x16x1_SN_LDSB1_CLR1_GSU0_GSUC0_GSUWGMRR0_K1_LBSPPA256_LBSPPB128_MIWT4_2_PLR1_SU32_SUM0_SUS256_VWA2_VWB1_WGM1_WGMXCC1_WGMXCCGn1
    SolutionIndex: 30
    SolutionNameMin: Cijk_Alik_Bljk_HHS_BH_UserArgs_MT128x64x64_MI16x16x1_SN_LDSB1_CLR1_GSU0_GSUC0_GSUWGMRR0_K1_LBSPPA512_LBSPPB128_MIWT4_2_PLR1_SU32_SUM0_SUS256_VWA4_VWB1_WGM1_WGMXCC1_WGMXCCGn1
    SolutionIndex: 31
    SolutionNameMin: Cijk_Alik_Bljk_HHS_BH_UserArgs_MT128x64x64_MI16x16x1_SN_LDSB1_CLR1_GSU0_GSUC0_GSUWGMRR0_K1_LBSPPA256_LBSPPB256_MIWT4_2_PLR1_SU32_SUM0_SUS256_VWA2_VWB2_WGM1_WGMXCC1_WGMXCCGn1
    SolutionIndex: 32
    SolutionNameMin: Cijk_Alik_Bljk_HHS_BH_UserArgs_MT128x64x64_MI16x16x1_SN_LDSB1_CLR1_GSU0_GSUC0_GSUWGMRR0_K1_LBSPPA512_LBSPPB256_MIWT4_2_PLR1_SU32_SUM0_SUS256_VWA4_VWB2_WGM1_WGMXCC1_WGMXCCGn1
    SolutionIndex: 33
    SolutionNameMin: Cijk_Alik_Bljk_HHS_BH_UserArgs_MT128x64x64_MI16x16x1_SN_LDSB1_CLR1_GSU0_GSUC0_GSUWGMRR0_K1_LBSPPA256_LBSPPB128_MIWT4_2_PLR2_SU32_SUM0_SUS256_VWA2_VWB1_WGM1_WGMXCC1_WGMXCCGn1
    SolutionIndex: 34
    SolutionNameMin: Cijk_Alik_Bljk_HHS_BH_UserArgs_MT128x64x64_MI16x16x1_SN_LDSB1_CLR1_GSU0_GSUC0_GSUWGMRR0_K1_LBSPPA512_LBSPPB256_MIWT4_2_PLR1_SU32_SUM0_SUS256_VWA4_VWB2_WGM4_WGMXCC1_WGMXCCGn1
    SolutionIndex: 35
    SolutionNameMin: Cijk_Alik_Bljk_HHS_BH_UserArgs_MT128x64x64_MI16x16x1_SN_LDSB1_CLR1_GSU0_GSUC0_GSUWGMRR0_K1_LBSPPA512_LBSPPB128_MIWT4_2_PLR2_SU32_SUM0_SUS256_VWA4_VWB1_WGM4_WGMXCC1_WGMXCCGn1
    SolutionIndex: 36
    SolutionNameMin: Cijk_Alik_Bljk_HHS_BH_UserArgs_MT64x64x64_MI16x16x1_SN_LDSB1_CLR1_GSU0_GSUC0_GSUWGMRR0_K1_LBSPPA256_LBSPPB128_MIWT2_2_PLR1_SU32_SUM0_SUS256_VWA2_VWB1_WGM1_WGMXCC1_WGMXCCGn1
    SolutionIndex: 37
    SolutionNameMin: Cijk_Alik_Bljk_HHS_BH_UserArgs_MT64x64x64_MI16x16x1_SN_LDSB1_CLR1_GSU0_GSUC0_GSUWGMRR0_K1_LBSPPA256_LBSPPB256_MIWT2_2_PLR1_SU32_SUM0_SUS256_VWA2_VWB2_WGM1_WGMXCC1_WGMXCCGn1
    SolutionIndex: 38
    SolutionNameMin: Cijk_Alik_Bljk_HHS_BH_UserArgs_MT32x64x64_MI16x16x1_SN_LDSB0_CLR1_GSU0_GSUC0_GSUWGMRR0_K1_LBSPPA128_LBSPPB256_MIWT1_2_PLR1_SU32_SUM0_SUS256_VWA1_VWB2_WGM1_WGMXCC1_WGMXCCGn1
    SolutionIndex: 39
    SolutionNameMin: Cijk_Alik_Bljk_HHS_BH_UserArgs_MT64x32x64_MI16x16x1_SN_LDSB0_CLR1_GSU0_GSUC0_GSUWGMRR0_K1_LBSPPA256_LBSPPB128_MIWT2_1_PLR1_SU32_SUM0_SUS256_VWA2_VWB1_WGM1_WGMXCC1_WGMXCCGn1
    SolutionIndex: 40
    SolutionNameMin: Cijk_Alik_Bljk_HHS_BH_UserArgs_MT64x32x64_MI16x16x1_SN_LDSB0_CLR1_GSU0_GSUC0_GSUWGMRR0_K1_LBSPPA256_LBSPPB128_MIWT2_1_PLR2_SU32_SUM0_SUS256_VWA2_VWB1_WGM1_WGMXCC1_WGMXCCGn1
    SolutionIndex: 41
    SolutionNameMin: Cijk_Alik_Bljk_HHS_BH_UserArgs_MT64x64x128_MI16x16x1_SN_LDSB1_CLR1_GSU0_GSUC0_GSUWGMRR0_K1_LBSPPA512_LBSPPB256_MIWT2_2_PLR1_SU32_SUM0_SUS256_VWA2_VWB1_WGM1_WGMXCC1_WGMXCCGn1
    SolutionIndex: 42
    SolutionNameMin: Cijk_Alik_Bljk_HHS_BH_UserArgs_MT64x64x128_MI16x16x1_SN_LDSB1_CLR1_GSU0_GSUC0_GSUWGMRR0_K1_LBSPPA512_LBSPPB256_MIWT2_2_PLR2_SU32_SUM0_SUS256_VWA2_VWB1_WGM1_WGMXCC1_WGMXCCGn1
    SolutionIndex: 43
    SolutionNameMin: Cijk_Alik_Bljk_HHS_BH_UserArgs_MT64x64x128_MI16x16x1_SN_LDSB1_CLR1_GSU0_GSUC0_GSUWGMRR0_K1_LBSPPA512_LBSPPB512_MIWT2_2_PLR2_SU32_SUM0_SUS256_VWA2_VWB2_WGM1_WGMXCC1_WGMXCCGn1
    SolutionIndex: 44
    SolutionNameMin: Cijk_Alik_Bljk_HHS_BH_UserArgs_MT32x64x128_MI16x16x1_SN_LDSB1_CLR1_GSU0_GSUC0_GSUWGMRR0_K1_LBSPPA256_LBSPPB256_MIWT1_2_PLR2_SU32_SUM0_SUS256_VWA1_VWB1_WGM1_WGMXCC1_WGMXCCGn1
    SolutionIndex: 45
    SolutionNameMin: Cijk_Alik_Bljk_HHS_BH_UserArgs_MT64x32x128_MI16x16x1_SN_LDSB1_CLR1_GSU0_GSUC0_GSUWGMRR0_K1_LBSPPA256_LBSPPB256_MIWT2_1_PLR1_SU32_SUM0_SUS256_VWA1_VWB1_WGM1_WGMXCC1_WGMXCCGn1
    SolutionIndex: 46
    SolutionNameMin: Cijk_Alik_Bljk_HHS_BH_UserArgs_MT64x32x128_MI16x16x1_SN_LDSB1_CLR1_GSU0_GSUC0_GSUWGMRR0_K1_LBSPPA512_LBSPPB256_MIWT2_1_PLR2_SU32_SUM0_SUS256_VWA2_VWB1_WGM1_WGMXCC1_WGMXCCGn1
    SolutionIndex: 47
    SolutionNameMin: Cijk_Alik_Bljk_HHS_BH_UserArgs_MT32x32x128_MI16x16x1_SN_LDSB1_CLR1_GSU0_GSUC0_GSUWGMRR0_K1_LBSPPA256_LBSPPB256_MIWT1_1_PLR1_SU32_SUM0_SUS256_VWA1_VWB1_WGM1_WGMXCC1_WGMXCCGn1
    SolutionIndex: 48
    SolutionNameMin: Cijk_Alik_Bljk_HHS_BH_UserArgs_MT32x32x128_MI16x16x1_SN_LDSB1_CLR1_GSU0_GSUC0_GSUWGMRR0_K1_LBSPPA256_LBSPPB256_MIWT1_1_PLR2_SU32_SUM0_SUS256_VWA1_VWB1_WGM1_WGMXCC1_WGMXCCGn1
    SolutionIndex: 49
    SolutionNameMin: Cijk_Alik_Bljk_HHS_BH_UserArgs_MT32x32x32_MI16x16x1_SN_LDSB0_CLR1_GSU0_GSUC0_GSUWGMRR0_K1_LBSPPA128_LBSPPB128_MIWT1_1_PLR1_SU32_SUM0_SUS256_VWA1_VWB1_WGM1_WGMXCC1_WGMXCCGn1
- - - [128, 128, 1, 128, 128, 128, 128, 128]
    - [0, 0.0]
  - - [128, 128, 1, 256, 128, 128, 256, 256]
    - [48, 0.0]
  - - [128, 128, 1, 512, 128, 128, 512, 512]
    - [48, 0.001]
  - - [128, 128, 1, 1024, 128, 128, 1024, 1024]
    - [47, 0.001]
  - - [128, 128, 1, 2048, 128, 128, 2048, 2048]
    - [47, 0.001]
  - - [128, 128, 1, 4096, 128, 128, 4096, 4096]
    - [36, 0.002]
  - - [128, 128, 1, 8192, 128, 128, 8192, 8192]
    - [41, 0.002]
  - - [128, 256, 1, 128, 128, 128, 128, 128]
    - [39, 0.0]
  - - [128, 256, 1, 256, 128, 128, 256, 256]
    - [38, 0.001]
  - - [128, 256, 1, 512, 128, 128, 512, 512]
    - [38, 0.001]
  - - [128, 256, 1, 1024, 128, 128, 1024, 1024]
    - [46, 0.002]
  - - [128, 256, 1, 2048, 128, 128, 2048, 2048]
    - [46, 0.002]
  - - [128, 256, 1, 4096, 128, 128, 4096, 4096]
    - [30, 0.003]
  - - [128, 256, 1, 8192, 128, 128, 8192, 8192]
    - [32, 0.004]
  - - [128, 512, 1, 128, 128, 128, 128, 128]
    - [37, 0.001]
  - - [128, 512, 1, 256, 128, 128, 256, 256]
    - [37, 0.001]
  - - [128, 512, 1, 512, 128, 128, 512, 512]
    - [36, 0.002]
  - - [128, 512, 1, 1024, 128, 128, 1024, 1024]
    - [42, 0.003]
  - - [128, 512, 1, 2048, 128, 128, 2048, 2048]
    - [42, 0.003]
  - - [128, 512, 1, 4096, 128, 128, 4096, 4096]
    - [30, 0.004]
  - - [128, 512, 1, 8192, 128, 128, 8192, 8192]
    - [7, 0.005]
  - - [128, 1024, 1, 128, 128, 128, 128, 128]
    - [28, 0.001]
  - - [128, 1024, 1, 256, 128, 128, 256, 256]
    - [32, 0.002]
  - - [128, 1024, 1, 512, 128, 128, 512, 512]
    - [27, 0.003]
  - - [128, 1024, 1, 1024, 128, 128, 1024, 1024]
    - [27, 0.004]
  - - [128, 1024, 1, 2048, 128, 128, 2048, 2048]
    - [26, 0.004]
  - - [128, 1024, 1, 4096, 128, 128, 4096, 4096]
    - [9, 0.006]
  - - [128, 1024, 1, 8192, 128, 128, 8192, 8192]
    - [13, 0.007]
  - - [128, 2048, 1, 128, 128, 128, 128, 128]
    - [6, 0.002]
  - - [128, 2048, 1, 256, 128, 128, 256, 256]
    - [6, 0.003]
  - - [128, 2048, 1, 512, 128, 128, 512, 512]
    - [8, 0.004]
  - - [128, 2048, 1, 1024, 128, 128, 1024, 1024]
    - [8, 0.005]
  - - [128, 2048, 1, 2048, 128, 128, 2048, 2048]
    - [5, 0.006]
  - - [128, 2048, 1, 4096, 128, 128, 4096, 4096]
    - [13, 0.007]
  - - [128, 2048, 1, 8192, 128, 128, 8192, 8192]
    - [24, 0.008]
  - - [128, 4096, 1, 128, 128, 128, 128, 128]
    - [6, 0.002]
  - - [128, 4096, 1, 256, 128, 128, 256, 256]
    - [9, 0.002]
  - - [128, 4096, 1, 512, 128, 128, 512, 512]
    - [5, 0.004]
  - - [128, 4096, 1, 1024, 128, 128, 1024, 1024]
    - [7, 0.005]
  - - [128, 4096, 1, 2048, 128, 128, 2048, 2048]
    - [7, 0.007]
  - - [128, 4096, 1, 4096, 128, 128, 4096, 4096]
    - [9, 0.008]
  - - [128, 4096, 1, 8192, 128, 128, 8192, 8192]
    - [9, 0.007]
  - - [128, 8192, 1, 128, 128, 128, 128, 128]
    - [9, 0.002]
  - - [128, 8192, 1, 256, 128, 128, 256, 256]
    - [26, 0.003]
  - - [128, 8192, 1, 512, 128, 128, 512, 512]
    - [7, 0.005]
  - - [128, 8192, 1, 1024, 128, 128, 1024, 1024]
    - [7, 0.006]
  - - [128, 8192, 1, 2048, 128, 128, 2048, 2048]
    - [7, 0.008]
  - - [128, 8192, 1, 4096, 128, 128, 4096, 4096]
    - [8, 0.007]
  - - [128, 8192, 1, 8192, 128, 128, 8192, 8192]
    - [24, 0.008]
  - - [256, 128, 1, 128, 256, 256, 128, 128]
    - [40, 0.0]
  - - [256, 128, 1, 256, 256, 256, 256, 256]
    - [45, 0.001]
  - - [256, 128, 1, 512, 256, 256, 512, 512]
    - [44, 0.001]
  - - [256, 128, 1, 1024, 256, 256, 1024, 1024]
    - [46, 0.002]
  - - [256, 128, 1, 2048, 256, 256, 2048, 2048]
    - [46, 0.002]
  - - [256, 128, 1, 4096, 256, 256, 4096, 4096]
    - [34, 0.003]
  - - [256, 128, 1, 8192, 256, 256, 8192, 8192]
    - [30, 0.004]
  - - [256, 256, 1, 128, 256, 256, 128, 128]
    - [36, 0.001]
  - - [256, 256, 1, 256, 256, 256, 256, 256]
    - [36, 0.001]
  - - [256, 256, 1, 512, 256, 256, 512, 512]
    - [36, 0.002]
  - - [256, 256, 1, 1024, 256, 256, 1024, 1024]
    - [43, 0.003]
  - - [256, 256, 1, 2048, 256, 256, 2048, 2048]
    - [43, 0.003]
  - - [256, 256, 1, 4096, 256, 256, 4096, 4096]
    - [32, 0.004]
  - - [256, 256, 1, 8192, 256, 256, 8192, 8192]
    - [7, 0.005]
  - - [256, 512, 1, 128, 256, 256, 128, 128]
    - [35, 0.001]
  - - [256, 512, 1, 256, 256, 256, 256, 256]
    - [29, 0.002]
  - - [256, 512, 1, 512, 256, 256, 512, 512]
    - [29, 0.003]
  - - [256, 512, 1, 1024, 256, 256, 1024, 1024]
    - [28, 0.004]
  - - [256, 512, 1, 2048, 256, 256, 2048, 2048]
    - [18, 0.005]
  - - [256, 512, 1, 4096, 256, 256, 4096, 4096]
    - [7, 0.006]
  - - [256, 512, 1, 8192, 256, 256, 8192, 8192]
    - [5, 0.007]
  - - [256, 1024, 1, 128, 256, 256, 128, 128]
    - [6, 0.002]
  - - [256, 1024, 1, 256, 256, 256, 256, 256]
    - [23, 0.003]
  - - [256, 1024, 1, 512, 256, 256, 512, 512]
    - [4, 0.004]
  - - [256, 1024, 1, 1024, 256, 256, 1024, 1024]
    - [4, 0.005]
  - - [256, 1024, 1, 2048, 256, 256, 2048, 2048]
    - [24, 0.006]
  - - [256, 1024, 1, 4096, 256, 256, 4096, 4096]
    - [9, 0.007]
  - - [256, 1024, 1, 8192, 256, 256, 8192, 8192]
    - [7, 0.008]
  - - [256, 2048, 1, 128, 256, 256, 128, 128]
    - [6, 0.002]
  - - [256, 2048, 1, 256, 256, 256, 256, 256]
    - [7, 0.002]
  - - [256, 2048, 1, 512, 256, 256, 512, 512]
    - [5, 0.004]
  - - [256, 2048, 1, 1024, 256, 256, 1024, 1024]
    - [5, 0.006]
  - - [256, 2048, 1, 2048, 256, 256, 2048, 2048]
    - [26, 0.007]
  - - [256, 2048, 1, 4096, 256, 256, 4096, 4096]
    - [7, 0.008]
  - - [256, 2048, 1, 8192, 256, 256, 8192, 8192]
    - [5, 0.009]
  - - [256, 4096, 1, 128, 256, 256, 128, 128]
    - [10, 0.002]
  - - [256, 4096, 1, 256, 256, 256, 256, 256]
    - [21, 0.003]
  - - [256, 4096, 1, 512, 256, 256, 512, 512]
    - [5, 0.005]
  - - [256, 4096, 1, 1024, 256, 256, 1024, 1024]
    - [7, 0.006]
  - - [256, 4096, 1, 2048, 256, 256, 2048, 2048]
    - [5, 0.008]
  - - [256, 4096, 1, 4096, 256, 256, 4096, 4096]
    - [5, 0.009]
  - - [256, 4096, 1, 8192, 256, 256, 8192, 8192]
    - [23, 0.008]
  - - [256, 8192, 1, 128, 256, 256, 128, 128]
    - [2, 0.003]
  - - [256, 8192, 1, 256, 256, 256, 256, 256]
    - [9, 0.004]
  - - [256, 8192, 1, 512, 256, 256, 512, 512]
    - [6, 0.005]
  - - [256, 8192, 1, 1024, 256, 256, 1024, 1024]
    - [9, 0.007]
  - - [256, 8192, 1, 2048, 256, 256, 2048, 2048]
    - [7, 0.008]
  - - [256, 8192, 1, 4096, 256, 256, 4096, 4096]
    - [16, 0.008]
  - - [256, 8192, 1, 8192, 256, 256, 8192, 8192]
    - [20, 0.008]
  - - [512, 128, 1, 128, 512, 512, 128, 128]
    - [37, 0.001]
  - - [512, 128, 1, 256, 512, 512, 256, 256]
    - [37, 0.001]
  - - [512, 128, 1, 512, 512, 512, 512, 512]
    - [41, 0.002]
  - - [512, 128, 1, 1024, 512, 512, 1024, 1024]
    - [42, 0.003]
  - - [512, 128, 1, 2048, 512, 512, 2048, 2048]
    - [43, 0.003]
  - - [512, 128, 1, 4096, 512, 512, 4096, 4096]
    - [32, 0.004]
  - - [512, 128, 1, 8192, 512, 512, 8192, 8192]
    - [7, 0.005]
  - - [512, 256, 1, 128, 512, 512, 128, 128]
    - [32, 0.001]
  - - [512, 256, 1, 256, 512, 512, 256, 256]
    - [31, 0.002]
  - - [512, 256, 1, 512, 512, 512, 512, 512]
    - [30, 0.003]
  - - [512, 256, 1, 1024, 512, 512, 1024, 1024]
    - [30, 0.004]
  - - [512, 256, 1, 2048, 512, 512, 2048, 2048]
    - [7, 0.005]
  - - [512, 256, 1, 4096, 512, 512, 4096, 4096]
    - [7, 0.006]
  - - [512, 256, 1, 8192, 512, 512, 8192, 8192]
    - [7, 0.007]
  - - [512, 512, 1, 128, 512, 512, 128, 128]
    - [11, 0.002]
  - - [512, 512, 1, 256, 512, 512, 256, 256]
    - [8, 0.003]
  - - [512, 512, 1, 512, 512, 512, 512, 512]
    - [8, 0.004]
  - - [512, 512, 1, 1024, 512, 512, 1024, 1024]
    - [25, 0.006]
  - - [512, 512, 1, 2048, 512, 512, 2048, 2048]
    - [7, 0.006]
  - - [512, 512, 1, 4096, 512, 512, 4096, 4096]
    - [26, 0.007]
  - - [512, 512, 1, 8192, 512, 512, 8192, 8192]
    - [9, 0.008]
  - - [512, 1024, 1, 128, 512, 512, 128, 128]
    - [9, 0.002]
  - - [512, 1024, 1, 256, 512, 512, 256, 256]
    - [7, 0.002]
  - - [512, 1024, 1, 512, 512, 512, 512, 512]
    - [9, 0.004]
  - - [512, 1024, 1, 1024, 512, 512, 1024, 1024]
    - [9, 0.006]
  - - [512, 1024, 1, 2048, 512, 512, 2048, 2048]
    - [18, 0.007]
  - - [512, 1024, 1, 4096, 512, 512, 4096, 4096]
    - [15, 0.008]
  - - [512, 1024, 1, 8192, 512, 512, 8192, 8192]
    - [5, 0.009]
  - - [512, 2048, 1, 128, 512, 512, 128, 128]
    - [2, 0.002]
  - - [512, 2048, 1, 256, 512, 512, 256, 256]
    - [7, 0.003]
  - - [512, 2048, 1, 512, 512, 512, 512, 512]
    - [9, 0.005]
  - - [512, 2048, 1, 1024, 512, 512, 1024, 1024]
    - [9, 0.006]
  - - [512, 2048, 1, 2048, 512, 512, 2048, 2048]
    - [9, 0.008]
  - - [512, 2048, 1, 4096, 512, 512, 4096, 4096]
    - [7, 0.009]
  - - [512, 2048, 1, 8192, 512, 512, 8192, 8192]
    - [7, 0.009]
  - - [512, 4096, 1, 128, 512, 512, 128, 128]
    - [1, 0.002]
  - - [512, 4096, 1, 256, 512, 512, 256, 256]
    - [9, 0.004]
  - - [512, 4096, 1, 512, 512, 512, 512, 512]
    - [7, 0.005]
  - - [512, 4096, 1, 1024, 512, 512, 1024, 1024]
    - [9, 0.007]
  - - [512, 4096, 1, 2048, 512, 512, 2048, 2048]
    - [9, 0.008]
  - - [512, 4096, 1, 4096, 512, 512, 4096, 4096]
    - [5, 0.009]
  - - [512, 4096, 1, 8192, 512, 512, 8192, 8192]
    - [24, 0.008]
  - - [512, 8192, 1, 128, 512, 512, 128, 128]
    - [1, 0.003]
  - - [512, 8192, 1, 256, 512, 512, 256, 256]
    - [6, 0.004]
  - - [512, 8192, 1, 512, 512, 512, 512, 512]
    - [7, 0.006]
  - - [512, 8192, 1, 1024, 512, 512, 1024, 1024]
    - [9, 0.007]
  - - [512, 8192, 1, 2048, 512, 512, 2048, 2048]
    - [4, 0.008]
  - - [512, 8192, 1, 4096, 512, 512, 4096, 4096]
    - [19, 0.008]
  - - [512, 8192, 1, 8192, 512, 512, 8192, 8192]
    - [24, 0.008]
  - - [1024, 128, 1, 128, 1024, 1024, 128, 128]
    - [33, 0.001]
  - - [1024, 128, 1, 256, 1024, 1024, 256, 256]
    - [32, 0.002]
  - - [1024, 128, 1, 512, 1024, 1024, 512, 512]
    - [30, 0.003]
  - - [1024, 128, 1, 1024, 1024, 1024, 1024, 1024]
    - [30, 0.004]
  - - [1024, 128, 1, 2048, 1024, 1024, 2048, 2048]
    - [7, 0.005]
  - - [1024, 128, 1, 4096, 1024, 1024, 4096, 4096]
    - [7, 0.006]
  - - [1024, 128, 1, 8192, 1024, 1024, 8192, 8192]
    - [7, 0.007]
  - - [1024, 256, 1, 128, 1024, 1024, 128, 128]
    - [6, 0.002]
  - - [1024, 256, 1, 256, 1024, 1024, 256, 256]
    - [6, 0.003]
  - - [1024, 256, 1, 512, 1024, 1024, 512, 512]
    - [6, 0.004]
  - - [1024, 256, 1, 1024, 1024, 1024, 1024, 1024]
    - [6, 0.006]
  - - [1024, 256, 1, 2048, 1024, 1024, 2048, 2048]
    - [7, 0.006]
  - - [1024, 256, 1, 4096, 1024, 1024, 4096, 4096]
    - [7, 0.007]
  - - [1024, 256, 1, 8192, 1024, 1024, 8192, 8192]
    - [9, 0.008]
  - - [1024, 512, 1, 128, 1024, 1024, 128, 128]
    - [8, 0.002]
  - - [1024, 512, 1, 256, 1024, 1024, 256, 256]
    - [9, 0.003]
  - - [1024, 512, 1, 512, 1024, 1024, 512, 512]
    - [7, 0.004]
  - - [1024, 512, 1, 1024, 1024, 1024, 1024, 1024]
    - [9, 0.006]
  - - [1024, 512, 1, 2048, 1024, 1024, 2048, 2048]
    - [5, 0.007]
  - - [1024, 512, 1, 4096, 1024, 1024, 4096, 4096]
    - [5, 0.008]
  - - [1024, 512, 1, 8192, 1024, 1024, 8192, 8192]
    - [7, 0.009]
  - - [1024, 1024, 1, 128, 1024, 1024, 128, 128]
    - [2, 0.002]
  - - [1024, 1024, 1, 256, 1024, 1024, 256, 256]
    - [7, 0.003]
  - - [1024, 1024, 1, 512, 1024, 1024, 512, 512]
    - [9, 0.005]
  - - [1024, 1024, 1, 1024, 1024, 1024, 1024, 1024]
    - [5, 0.006]
  - - [1024, 1024, 1, 2048, 1024, 1024, 2048, 2048]
    - [9, 0.008]
  - - [1024, 1024, 1, 4096, 1024, 1024, 4096, 4096]
    - [9, 0.009]
  - - [1024, 1024, 1, 8192, 1024, 1024, 8192, 8192]
    - [9, 0.009]
  - - [1024, 2048, 1, 128, 1024, 1024, 128, 128]
    - [2, 0.003]
  - - [1024, 2048, 1, 256, 1024, 1024, 256, 256]
    - [9, 0.004]
  - - [1024, 2048, 1, 512, 1024, 1024, 512, 512]
    - [9, 0.005]
  - - [1024, 2048, 1, 1024, 1024, 1024, 1024, 1024]
    - [7, 0.007]
  - - [1024, 2048, 1, 2048, 1024, 1024, 2048, 2048]
    - [9, 0.008]
  - - [1024, 2048, 1, 4096, 1024, 1024, 4096, 4096]
    - [9, 0.009]
  - - [1024, 2048, 1, 8192, 1024, 1024, 8192, 8192]
    - [7, 0.009]
  - - [1024, 4096, 1, 128, 1024, 1024, 128, 128]
    - [5, 0.003]
  - - [1024, 4096, 1, 256, 1024, 1024, 256, 256]
    - [7, 0.004]
  - - [1024, 4096, 1, 512, 1024, 1024, 512, 512]
    - [9, 0.006]
  - - [1024, 4096, 1, 1024, 1024, 1024, 1024, 1024]
    - [7, 0.007]
  - - [1024, 4096, 1, 2048, 1024, 1024, 2048, 2048]
    - [9, 0.008]
  - - [1024, 4096, 1, 4096, 1024, 1024, 4096, 4096]
    - [6, 0.009]
  - - [1024, 4096, 1, 8192, 1024, 1024, 8192, 8192]
    - [26, 0.009]
  - - [1024, 8192, 1, 128, 1024, 1024, 128, 128]
    - [6, 0.003]
  - - [1024, 8192, 1, 256, 1024, 1024, 256, 256]
    - [5, 0.004]
  - - [1024, 8192, 1, 512, 1024, 1024, 512, 512]
    - [9, 0.006]
  - - [1024, 8192, 1, 1024, 1024, 1024, 1024, 1024]
    - [5, 0.007]
  - - [1024, 8192, 1, 2048, 1024, 1024, 2048, 2048]
    - [21, 0.008]
  - - [1024, 8192, 1, 4096, 1024, 1024, 4096, 4096]
    - [26, 0.009]
  - - [1024, 8192, 1, 8192, 1024, 1024, 8192, 8192]
    - [24, 0.009]
  - - [2048, 128, 1, 128, 2048, 2048, 128, 128]
    - [8, 0.002]
  - - [2048, 128, 1, 256, 2048, 2048, 256, 256]
    - [8, 0.003]
  - - [2048, 128, 1, 512, 2048, 2048, 512, 512]
    - [6, 0.004]
  - - [2048, 128, 1, 1024, 2048, 2048, 1024, 1024]
    - [4, 0.005]
  - - [2048, 128, 1, 2048, 2048, 2048, 2048, 2048]
    - [7, 0.006]
  - - [2048, 128, 1, 4096, 2048, 2048, 4096, 4096]
    - [7, 0.008]
  - - [2048, 128, 1, 8192, 2048, 2048, 8192, 8192]
    - [7, 0.008]
  - - [2048, 256, 1, 128, 2048, 2048, 128, 128]
    - [6, 0.002]
  - - [2048, 256, 1, 256, 2048, 2048, 256, 256]
    - [7, 0.003]
  - - [2048, 256, 1, 512, 2048, 2048, 512, 512]
    - [7, 0.004]
  - - [2048, 256, 1, 1024, 2048, 2048, 1024, 1024]
    - [7, 0.006]
  - - [2048, 256, 1, 2048, 2048, 2048, 2048, 2048]
    - [7, 0.007]
  - - [2048, 256, 1, 4096, 2048, 2048, 4096, 4096]
    - [7, 0.008]
  - - [2048, 256, 1, 8192, 2048, 2048, 8192, 8192]
    - [5, 0.009]
  - - [2048, 512, 1, 128, 2048, 2048, 128, 128]
    - [2, 0.002]
  - - [2048, 512, 1, 256, 2048, 2048, 256, 256]
    - [7, 0.003]
  - - [2048, 512, 1, 512, 2048, 2048, 512, 512]
    - [7, 0.005]
  - - [2048, 512, 1, 1024, 2048, 2048, 1024, 1024]
    - [7, 0.006]
  - - [2048, 512, 1, 2048, 2048, 2048, 2048, 2048]
    - [5, 0.008]
  - - [2048, 512, 1, 4096, 2048, 2048, 4096, 4096]
    - [9, 0.009]
  - - [2048, 512, 1, 8192, 2048, 2048, 8192, 8192]
    - [7, 0.009]
  - - [2048, 1024, 1, 128, 2048, 2048, 128, 128]
    - [2, 0.003]
  - - [2048, 1024, 1, 256, 2048, 2048, 256, 256]
    - [7, 0.004]
  - - [2048, 1024, 1, 512, 2048, 2048, 512, 512]
    - [7, 0.005]
  - - [2048, 1024, 1, 1024, 2048, 2048, 1024, 1024]
    - [9, 0.007]
  - - [2048, 1024, 1, 2048, 2048, 2048, 2048, 2048]
    - [9, 0.008]
  - - [2048, 1024, 1, 4096, 2048, 2048, 4096, 4096]
    - [7, 0.009]
  - - [2048, 1024, 1, 8192, 2048, 2048, 8192, 8192]
    - [7, 0.009]
  - - [2048, 2048, 1, 128, 2048, 2048, 128, 128]
    - [2, 0.003]
  - - [2048, 2048, 1, 256, 2048, 2048, 256, 256]
    - [9, 0.004]
  - - [2048, 2048, 1, 512, 2048, 2048, 512, 512]
    - [7, 0.006]
  - - [2048, 2048, 1, 1024, 2048, 2048, 1024, 1024]
    - [9, 0.007]
  - - [2048, 2048, 1, 2048, 2048, 2048, 2048, 2048]
    - [9, 0.008]
  - - [2048, 2048, 1, 4096, 2048, 2048, 4096, 4096]
    - [7, 0.009]
  - - [2048, 2048, 1, 8192, 2048, 2048, 8192, 8192]
    - [15, 0.008]
  - - [2048, 4096, 1, 128, 2048, 2048, 128, 128]
    - [9, 0.003]
  - - [2048, 4096, 1, 256, 2048, 2048, 256, 256]
    - [9, 0.004]
  - - [2048, 4096, 1, 512, 2048, 2048, 512, 512]
    - [7, 0.006]
  - - [2048, 4096, 1, 1024, 2048, 2048, 1024, 1024]
    - [7, 0.007]
  - - [2048, 4096, 1, 2048, 2048, 2048, 2048, 2048]
    - [6, 0.008]
  - - [2048, 4096, 1, 4096, 2048, 2048, 4096, 4096]
    - [21, 0.009]
  - - [2048, 4096, 1, 8192, 2048, 2048, 8192, 8192]
    - [12, 0.009]
  - - [2048, 8192, 1, 128, 2048, 2048, 128, 128]
    - [9, 0.003]
  - - [2048, 8192, 1, 256, 2048, 2048, 256, 256]
    - [9, 0.004]
  - - [2048, 8192, 1, 512, 2048, 2048, 512, 512]
    - [9, 0.006]
  - - [2048, 8192, 1, 1024, 2048, 2048, 1024, 1024]
    - [26, 0.007]
  - - [2048, 8192, 1, 2048, 2048, 2048, 2048, 2048]
    - [26, 0.008]
  - - [2048, 8192, 1, 4096, 2048, 2048, 4096, 4096]
    - [21, 0.009]
  - - [2048, 8192, 1, 8192, 2048, 2048, 8192, 8192]
    - [18, 0.009]
  - - [4096, 128, 1, 128, 4096, 4096, 128, 128]
    - [8, 0.002]
  - - [4096, 128, 1, 256, 4096, 4096, 256, 256]
    - [7, 0.002]
  - - [4096, 128, 1, 512, 4096, 4096, 512, 512]
    - [7, 0.004]
  - - [4096, 128, 1, 1024, 4096, 4096, 1024, 1024]
    - [5, 0.006]
  - - [4096, 128, 1, 2048, 4096, 4096, 2048, 2048]
    - [9, 0.007]
  - - [4096, 128, 1, 4096, 4096, 4096, 4096, 4096]
    - [9, 0.008]
  - - [4096, 128, 1, 8192, 4096, 4096, 8192, 8192]
    - [7, 0.007]
  - - [4096, 256, 1, 128, 4096, 4096, 128, 128]
    - [2, 0.002]
  - - [4096, 256, 1, 256, 4096, 4096, 256, 256]
    - [7, 0.003]
  - - [4096, 256, 1, 512, 4096, 4096, 512, 512]
    - [7, 0.005]
  - - [4096, 256, 1, 1024, 4096, 4096, 1024, 1024]
    - [7, 0.006]
  - - [4096, 256, 1, 2048, 4096, 4096, 2048, 2048]
    - [7, 0.008]
  - - [4096, 256, 1, 4096, 4096, 4096, 4096, 4096]
    - [7, 0.009]
  - - [4096, 256, 1, 8192, 4096, 4096, 8192, 8192]
    - [15, 0.008]
  - - [4096, 512, 1, 128, 4096, 4096, 128, 128]
    - [2, 0.003]
  - - [4096, 512, 1, 256, 4096, 4096, 256, 256]
    - [5, 0.004]
  - - [4096, 512, 1, 512, 4096, 4096, 512, 512]
    - [7, 0.005]
  - - [4096, 512, 1, 1024, 4096, 4096, 1024, 1024]
    - [7, 0.007]
  - - [4096, 512, 1, 2048, 4096, 4096, 2048, 2048]
    - [7, 0.008]
  - - [4096, 512, 1, 4096, 4096, 4096, 4096, 4096]
    - [7, 0.009]
  - - [4096, 512, 1, 8192, 4096, 4096, 8192, 8192]
    - [5, 0.007]
  - - [4096, 1024, 1, 128, 4096, 4096, 128, 128]
    - [2, 0.003]
  - - [4096, 1024, 1, 256, 4096, 4096, 256, 256]
    - [7, 0.004]
  - - [4096, 1024, 1, 512, 4096, 4096, 512, 512]
    - [8, 0.006]
  - - [4096, 1024, 1, 1024, 4096, 4096, 1024, 1024]
    - [7, 0.007]
  - - [4096, 1024, 1, 2048, 4096, 4096, 2048, 2048]
    - [9, 0.008]
  - - [4096, 1024, 1, 4096, 4096, 4096, 4096, 4096]
    - [5, 0.009]
  - - [4096, 1024, 1, 8192, 4096, 4096, 8192, 8192]
    - [19, 0.008]
  - - [4096, 2048, 1, 128, 4096, 4096, 128, 128]
    - [1, 0.003]
  - - [4096, 2048, 1, 256, 4096, 4096, 256, 256]
    - [9, 0.004]
  - - [4096, 2048, 1, 512, 4096, 4096, 512, 512]
    - [5, 0.006]
  - - [4096, 2048, 1, 1024, 4096, 4096, 1024, 1024]
    - [7, 0.007]
  - - [4096, 2048, 1, 2048, 4096, 4096, 2048, 2048]
    - [9, 0.008]
  - - [4096, 2048, 1, 4096, 4096, 4096, 4096, 4096]
    - [26, 0.009]
  - - [4096, 2048, 1, 8192, 4096, 4096, 8192, 8192]
    - [26, 0.008]
  - - [4096, 4096, 1, 128, 4096, 4096, 128, 128]
    - [2, 0.003]
  - - [4096, 4096, 1, 256, 4096, 4096, 256, 256]
    - [26, 0.004]
  - - [4096, 4096, 1, 512, 4096, 4096, 512, 512]
    - [26, 0.006]
  - - [4096, 4096, 1, 1024, 4096, 4096, 1024, 1024]
    - [18, 0.007]
  - - [4096, 4096, 1, 2048, 4096, 4096, 2048, 2048]
    - [25, 0.008]
  - - [4096, 4096, 1, 4096, 4096, 4096, 4096, 4096]
    - [25, 0.009]
  - - [4096, 4096, 1, 8192, 4096, 4096, 8192, 8192]
    - [24, 0.008]
  - - [4096, 8192, 1, 128, 4096, 4096, 128, 128]
    - [1, 0.003]
  - - [4096, 8192, 1, 256, 4096, 4096, 256, 256]
    - [7, 0.004]
  - - [4096, 8192, 1, 512, 4096, 4096, 512, 512]
    - [26, 0.006]
  - - [4096, 8192, 1, 1024, 4096, 4096, 1024, 1024]
    - [26, 0.007]
  - - [4096, 8192, 1, 2048, 4096, 4096, 2048, 2048]
    - [26, 0.008]
  - - [4096, 8192, 1, 4096, 4096, 4096, 4096, 4096]
    - [17, 0.009]
  - - [4096, 8192, 1, 8192, 4096, 4096, 8192, 8192]
    - [21, 0.008]
  - - [8192, 128, 1, 128, 8192, 8192, 128, 128]
    - [2, 0.002]
  - - [8192, 128, 1, 256, 8192, 8192, 256, 256]
    - [5, 0.003]
  - - [8192, 128, 1, 512, 8192, 8192, 512, 512]
    - [5, 0.005]
  - - [8192, 128, 1, 1024, 8192, 8192, 1024, 1024]
    - [5, 0.006]
  - - [8192, 128, 1, 2048, 8192, 8192, 2048, 2048]
    - [5, 0.008]
  - - [8192, 128, 1, 4096, 8192, 8192, 4096, 4096]
    - [9, 0.007]
  - - [8192, 128, 1, 8192, 8192, 8192, 8192, 8192]
    - [3, 0.008]
  - - [8192, 256, 1, 128, 8192, 8192, 128, 128]
    - [2, 0.003]
  - - [8192, 256, 1, 256, 8192, 8192, 256, 256]
    - [5, 0.004]
  - - [8192, 256, 1, 512, 8192, 8192, 512, 512]
    - [7, 0.005]
  - - [8192, 256, 1, 1024, 8192, 8192, 1024, 1024]
    - [9, 0.007]
  - - [8192, 256, 1, 2048, 8192, 8192, 2048, 2048]
    - [5, 0.008]
  - - [8192, 256, 1, 4096, 8192, 8192, 4096, 4096]
    - [14, 0.008]
  - - [8192, 256, 1, 8192, 8192, 8192, 8192, 8192]
    - [18, 0.007]
  - - [8192, 512, 1, 128, 8192, 8192, 128, 128]
    - [2, 0.003]
  - - [8192, 512, 1, 256, 8192, 8192, 256, 256]
    - [7, 0.004]
  - - [8192, 512, 1, 512, 8192, 8192, 512, 512]
    - [7, 0.006]
  - - [8192, 512, 1, 1024, 8192, 8192, 1024, 1024]
    - [9, 0.007]
  - - [8192, 512, 1, 2048, 8192, 8192, 2048, 2048]
    - [7, 0.008]
  - - [8192, 512, 1, 4096, 8192, 8192, 4096, 4096]
    - [16, 0.008]
  - - [8192, 512, 1, 8192, 8192, 8192, 8192, 8192]
    - [12, 0.008]
  - - [8192, 1024, 1, 128, 8192, 8192, 128, 128]
    - [2, 0.003]
  - - [8192, 1024, 1, 256, 8192, 8192, 256, 256]
    - [4, 0.004]
  - - [8192, 1024, 1, 512, 8192, 8192, 512, 512]
    - [5, 0.006]
  - - [8192, 1024, 1, 1024, 8192, 8192, 1024, 1024]
    - [7, 0.007]
  - - [8192, 1024, 1, 2048, 8192, 8192, 2048, 2048]
    - [9, 0.008]
  - - [8192, 1024, 1, 4096, 8192, 8192, 4096, 4096]
    - [26, 0.008]
  - - [8192, 1024, 1, 8192, 8192, 8192, 8192, 8192]
    - [22, 0.008]
  - - [8192, 2048, 1, 128, 8192, 8192, 128, 128]
    - [1, 0.003]
  - - [8192, 2048, 1, 256, 8192, 8192, 256, 256]
    - [26, 0.004]
  - - [8192, 2048, 1, 512, 8192, 8192, 512, 512]
    - [24, 0.006]
  - - [8192, 2048, 1, 1024, 8192, 8192, 1024, 1024]
    - [18, 0.007]
  - - [8192, 2048, 1, 2048, 8192, 8192, 2048, 2048]
    - [18, 0.008]
  - - [8192, 2048, 1, 4096, 8192, 8192, 4096, 4096]
    - [25, 0.008]
  - - [8192, 2048, 1, 8192, 8192, 8192, 8192, 8192]
    - [23, 0.008]
  - - [8192, 4096, 1, 128, 8192, 8192, 128, 128]
    - [1, 0.003]
  - - [8192, 4096, 1, 256, 8192, 8192, 256, 256]
    - [9, 0.004]
  - - [8192, 4096, 1, 512, 8192, 8192, 512, 512]
    - [7, 0.006]
  - - [8192, 4096, 1, 1024, 8192, 8192, 1024, 1024]
    - [26, 0.007]
  - - [8192, 4096, 1, 2048, 8192, 8192, 2048, 2048]
    - [18, 0.008]
  - - [8192, 4096, 1, 4096, 8192, 8192, 4096, 4096]
    - [21, 0.008]
  - - [8192, 4096, 1, 8192, 8192, 8192, 8192, 8192]
    - [20, 0.008]
  - - [8192, 8192, 1, 128, 8192, 8192, 128, 128]
    - [1, 0.003]
  - - [8192, 8192, 1, 256, 8192, 8192, 256, 256]
    - [9, 0.004]
  - - [8192, 8192, 1, 512, 8192, 8192, 512, 512]
    - [7, 0.006]
  - - [8192, 8192, 1, 1024, 8192, 8192, 1024, 1024]
    - [26, 0.007]
  - - [8192, 8192, 1, 2048, 8192, 8192, 2048, 2048]
    - [15, 0.008]
  - - [8192, 8192, 1, 4096, 8192, 8192, 4096, 4096]
    - [20, 0.008]
  - - [8192, 8192, 1, 8192, 8192, 8192, 8192, 8192]
    - [25, 0.008]
  - - [1, 1, 1, 32, 1, 1, 32, 32]
    - [49, 0.0]
- null
- null
- ExperimentalStreamK
- GridBased
