library/src/amd_detail/rocblaslt/src/Tensile/Logic/asm_full/aquavanjaram/gfx942/Equality/aquavanjaram_Cijk_Ailk_Bjlk_S_MX_B_Bias_HAS_SAV_UserArgs.yaml
- {MinimumRequiredVersion: 4.33.0}
- aquavanjaram
- gfx942
- [Device 0049, Device 0050]
    SolutionIndex: 0
    SolutionNameMin: Cijk_Ailk_Bjlk_S_MX_B_Bias_HAS_SAV_UserArgs_MT144x192x16_MI16x16x1_SN_LDSB0_GRPM0p26_GSU2_GSUC0_GSUWGMRR0_K1_LWPM0p26_MIWT9_3_NEPBS2_SU32_SUM0_SUS256_SPO1_WGM1_WGMXCC32_WGMXCCG0
    SolutionIndex: 1
    SolutionNameMin: Cijk_Ailk_Bjlk_S_MX_B_Bias_HAS_SAV_UserArgs_MT128x208x16_MI16x16x1_SN_LDSB0_GRPM0p27_GSU5_GSUC0_GSUWGMRR0_K1_LWPMn1_MIWT2_13_NEPBS2_SU32_SUM0_SUS256_SPO1_WGM1_WGMXCC4_WGMXCCG0
    SolutionIndex: 2
    SolutionNameMin: Cijk_Ailk_Bjlk_S_MX_B_Bias_HAS_SAV_UserArgs_MT112x128x32_MI16x16x1_SN_GRPM1_GSU114_GSUC0_GSUWGMRR0_K1_LWPM0p50_MIWT7_2_SU32_SUM0_SUS256_WGM32_WGMXCC16_WGMXCCG0
    SolutionIndex: 3
    SolutionNameMin: Cijk_Ailk_Bjlk_S_MX_B_Bias_HAS_SAV_UserArgs_MT80x64x32_MI16x16x1_SN_LDSB0_GRPM0p26_GSU20_GSUC0_GSUWGMRR0_K1_LWPMn1_MIWT5_1_SU32_SUM0_SUS256_WGM38_WGMXCC8_WGMXCCG0
    SolutionIndex: 4
    SolutionNameMin: Cijk_Ailk_Bjlk_S_MX_B_Bias_HAS_SAV_UserArgs_MT256x144x16_MI16x16x1_SN_GRPM0p27_GSU1_GSUC0_GSUWGMRR0_K1_LWPM0p26_MIWT4_9_SU32_SUM0_SUS256_WGM4_WGMXCC8_WGMXCCG0
    SolutionIndex: 5
    SolutionNameMin: Cijk_Ailk_Bjlk_S_MX_B_Bias_HAS_SAV_UserArgs_MT64x96x32_MI16x16x1_SN_LDSB0_GRPM0p27_GSU1_GSUC0_GSUWGMRR0_K1_LWPM0p26_MIWT2_3_NEPBS0_SU32_SUM0_SUS256_SPO0_WGM1_WGMXCC2_WGMXCCG0
    SolutionIndex: 6
    SolutionNameMin: Cijk_Ailk_Bjlk_S_MX_B_Bias_HAS_SAV_UserArgs_MT48x192x16_MI16x16x1_SN_GRPM0p50_GSU1_GSUC0_GSUWGMRR0_K1_LWPMn1_MIWT3_3_NEPBS2_SU32_SUM0_SUS256_SPO1_WGM0_WGMXCC1_WGMXCCG0
    SolutionIndex: 7
    SolutionNameMin: Cijk_Ailk_Bjlk_S_MX_B_Bias_HAS_SAV_UserArgs_MT48x192x16_MI16x16x1_SN_GRPM0p26_GSU1_GSUC0_GSUWGMRR0_K1_LWPMn1_MIWT3_3_NEPBS2_SU32_SUM0_SUS256_SPO1_WGM0_WGMXCC1_WGMXCCG0
    SolutionIndex: 8
    SolutionNameMin: Cijk_Ailk_Bjlk_S_MX_B_Bias_HAS_SAV_UserArgs_MT80x256x16_MI16x16x1_SN_LDSB0_GRPM0p27_GSU5_GSUC0_GSUWGMRR0_K1_LWPM0p50_MIWT5_4_NEPBS2_SU32_SUM0_SUS256_SPO0_WGM1_WGMXCC16_WGMXCCG0
    SolutionIndex: 9
    SolutionNameMin: Cijk_Ailk_Bjlk_S_MX_B_Bias_HAS_SAV_UserArgs_MT192x160x16_MI16x16x1_SN_LDSB1_GRPM0p50_GSU1_GSUC0_GSUWGMRR0_K1_LWPM0p50_MIWT6_5_NEPBS0_SU32_SUM0_SUS256_SPO0_WGM8_WGMXCC8_WGMXCCG304
    SolutionIndex: 10
    SolutionNameMin: Cijk_Ailk_Bjlk_S_MX_B_Bias_HAS_SAV_UserArgs_MT112x192x16_MI16x16x1_SN_LDSB0_GRPM0p50_GSU1_GSUC0_GSUWGMRR0_K1_LWPM0p26_MIWT7_3_NEPBS0_SU32_SUM0_SUS256_SPO0_WGM38_WGMXCC8_WGMXCCG0
    SolutionIndex: 11
    SolutionNameMin: Cijk_Ailk_Bjlk_S_MX_B_Bias_HAS_SAV_UserArgs_MT64x176x32_MI16x16x1_SN_LDSB0_GRPM0p50_GSU1_GSUC0_GSUWGMRR0_K1_LWPMn1_MIWT1_11_NEPBS2_SU32_SUM0_SUS256_SPO0_WGM8_WGMXCC4_WGMXCCG304
    SolutionIndex: 12
    SolutionNameMin: Cijk_Ailk_Bjlk_S_MX_B_Bias_HAS_SAV_UserArgs_MT128x208x16_MI16x16x1_SN_LDSB0_GRPM0p26_GSU1_GSUC0_GSUWGMRR0_K1_LWPM0p27_MIWT2_13_NEPBS2_SU32_SUM0_SUS256_SPO0_WGM1_WGMXCC4_WGMXCCG0
    SolutionIndex: 13
    SolutionNameMin: Cijk_Ailk_Bjlk_S_MX_B_Bias_HAS_SAV_UserArgs_MT112x128x32_MI16x16x1_SN_GRPM1_GSU114_GSUC0_GSUWGMRR0_K1_LWPM0p26_MIWT7_2_SU32_SUM0_SUS256_WGM0_WGMXCC1_WGMXCCG0
    SolutionIndex: 14
    SolutionNameMin: Cijk_Ailk_Bjlk_S_MX_B_Bias_HAS_SAV_UserArgs_MT48x256x32_MI16x16x1_SN_GRPM0p25_GRVWA2_GRVWB4_GSU1_GSUC0_GSUWGMRR0_K1_LPB16_LWPM0p50_MIWT3_4_SU32_SUM0_SUS256_VWB1_WGM4_WGMXCC4_WGMXCCG0
    SolutionIndex: 15
    SolutionNameMin: Cijk_Ailk_Bjlk_S_MX_B_Bias_HAS_SAV_UserArgs_MT224x192x16_MI16x16x1_SN_GRPM0p50_GSU1_GSUC0_GSUWGMRR0_K1_LWPM0p27_MIWT7_6_SU32_SUM0_SUS256_WGM4_WGMXCC8_WGMXCCG0
    SolutionIndex: 16
    SolutionNameMin: Cijk_Ailk_Bjlk_S_MX_B_Bias_HAS_SAV_UserArgs_MT64x80x32_MI16x16x1_SN_GRPM1_GSU15_GSUC0_GSUWGMRR0_K1_LWPM0p26_MIWT1_5_SU32_SUM0_SUS128_WGM1_WGMXCC4_WGMXCCG0
- - - [5120, 768, 1, 4096]
    - [0, 0.0]
  - - [768, 2048, 1, 4096]
    - [1, 0.0]
  - - [1059, 208, 1, 655360]
    - [2, 0.0]
  - - [1059, 57, 1, 655360]
    - [3, 0.0]
  - - [256, 42360, 1, 4096]
    - [4, 0.0]
  - - [2048, 768, 1, 4096]
    - [5, 0.0]
  - - [40, 160, 4096, 1059]
    - [6, 0.0]
  - - [40, 160, 4096, 105]
    - [7, 0.0]
  - - [2068, 512, 1, 4096]
    - [8, 0.0]
  - - [4384, 2048, 1, 4096]
    - [9, 0.0]
  - - [4200, 1536, 1, 4096]
    - [10, 0.0]
  - - [768, 4384, 1, 4096]
    - [11, 0.0]
  - - [2048, 3840, 1, 4096]
    - [12, 0.0]
  - - [105, 121, 1, 655360]
    - [13, 0.0]
  - - [4384, 768, 1, 4096]
    - [14, 0.0]
  - - [42360, 1536, 1, 4096]
    - [15, 0.0]
  - - [512, 160, 1, 4096]
    - [16, 0.0]
- null
- null
- DeviceEfficiency
- Equality
