library/src/amd_detail/rocblaslt/src/Tensile/Logic/asm_full/aquavanjaram/gfx942/Equality/aquavanjaram_Cijk_Alik_Bljk_F8B8BS_BH_BiasSB_HAS_SAB_SAV_UserArgs.yaml
- {MinimumRequiredVersion: 4.33.0}
- aquavanjaram
- gfx942
- [Device 0049, Device 0050]
    SolutionIndex: 0
    SolutionNameMin: Cijk_Alik_Bljk_F8B8BS_BH_BiasSB_HAS_SAB_SAV_UserArgs_MT256x256x64_MI16x16x1_SN_LDSB1_DTVA0_GRVWA8_GRVWB8_GSU1_GSUC0_GSUWGMRR0_K1_LBSPPA512_LBSPPB512_LPA8_LPB8_LRVW8_MIWT8_8_NLCA1_SU8_SUM0_SUS256_SVW8_VWA8_VWB8_WG32_8_1_WGM8_WGMXCC8_WGMXCCGn1
    SolutionIndex: 1
    SolutionNameMin: Cijk_Alik_Bljk_F8B8BS_BH_BiasSB_HAS_SAB_SAV_UserArgs_MT256x192x128_MI16x16x1_SN_GSU1_GSUC0_GSUWGMRR0_K1_MIWT8_6_SU8_SUM0_SUS256_WGM8_WGMXCC8_WGMXCCGn1
    SolutionIndex: 2
    SolutionNameMin: Cijk_Alik_Bljk_F8B8BS_BH_BiasSB_HAS_SAB_SAV_UserArgs_MT256x160x128_MI16x16x1_SN_GSU1_GSUC0_GSUWGMRR0_K1_LBSPPA1024_LBSPPB128_MIWT8_5_SU8_SUM0_SUS256_SVW8_VWA8_WGM8_WGMXCC8_WGMXCCGn1
    SolutionIndex: 3
    SolutionNameMin: Cijk_Alik_Bljk_F8B8BS_BH_BiasSB_HAS_SAB_SAV_UserArgs_MT256x192x64_MI16x16x1_SN_LDSB0_GRVWA8_GRVWB8_GSU1_GSUC0_GSUWGMRR0_K1_LBSPPA512_LBSPPB128_LPA8_LPB8_LRVW8_MIWT8_6_SU8_SUM0_SUS256_VWB2_WGM8_WGMXCC8_WGMXCCGn1
    SolutionIndex: 4
    SolutionNameMin: Cijk_Alik_Bljk_F8B8BS_BH_BiasSB_HAS_SAB_SAV_UserArgs_MT96x96x256_MI16x16x1_SN_GRVWA16_GRVWB16_GSU1_GSUC0_GSUWGMRR0_K1_LBSPPA256_LBSPPB256_LPA32_LPB32_LRVW16_MIWT3_3_SU8_SUM0_SUS256_SVW1_VWA1_VWB1_WG32_8_1_WGM8_WGMXCC8_WGMXCCGn1
    SolutionIndex: 5
    SolutionNameMin: Cijk_Alik_Bljk_F8B8BS_BH_BiasSB_HAS_SAB_SAV_UserArgs_MT224x128x128_MI16x16x1_SN_DTVA0_GRVWB16_GSU1_GSUC0_GSUWGMRR0_K1_LBSPPA128_LBSPPB512_LPA32_MIWT7_4_NLCA1_SU8_SUM0_SUS256_SVW1_VWA1_VWB4_WG32_8_1_WGM8_WGMXCC1_WGMXCCGn1
    SolutionIndex: 6
    SolutionNameMin: Cijk_Alik_Bljk_F8B8BS_BH_BiasSB_HAS_SAB_SAV_UserArgs_MT256x256x64_MI16x16x1_SN_GSU1_GSUC0_GSUWGMRR0_K1_MIWT8_8_SU8_SUM0_SUS256_WGM8_WGMXCC8_WGMXCCGn1
    SolutionIndex: 7
    SolutionNameMin: Cijk_Alik_Bljk_F8B8BS_BH_BiasSB_HAS_SAB_SAV_UserArgs_MT256x160x128_MI16x16x1_SN_GSU1_GSUC0_GSUWGMRR0_K1_MIWT8_5_SU8_SUM0_SUS256_WGM8_WGMXCC8_WGMXCCGn1
    SolutionIndex: 8
    SolutionNameMin: Cijk_Alik_Bljk_F8B8BS_BH_BiasSB_HAS_SAB_SAV_UserArgs_MT256x192x64_MI16x16x1_SN_GSU1_GSUC0_GSUWGMRR0_K1_MIWT8_6_SU8_SUM0_SUS256_WGM8_WGMXCC8_WGMXCCGn1
    SolutionIndex: 9
    SolutionNameMin: Cijk_Alik_Bljk_F8B8BS_BH_BiasSB_HAS_SAB_SAV_UserArgs_MT224x160x128_MI16x16x1_SN_GSU1_GSUC1_GSUWGMRR1_K1_MIWT7_5_NEPBS0_SU8_SUM0_SUS128_WSGRA2_WSGRB2_WGM32_WGMXCC8_WGMXCCGn1
    SolutionIndex: 10
    SolutionNameMin: Cijk_Alik_Bljk_F8B8BS_BH_BiasSB_HAS_SAB_SAV_UserArgs_MT256x192x128_MI16x16x1_SN_GSU1_GSUC0_GSUWGMRR0_K1_MIWT4_12_NEPBS0_SU16_SUM0_SUS256_WSGRA0_WSGRB0_WGM1_WGMXCC1_WGMXCCGn1
    SolutionIndex: 11
    SolutionNameMin: Cijk_Alik_Bljk_F8B8BS_BH_BiasSB_HAS_SAB_SAV_UserArgs_MT192x192x128_MI16x16x1_SN_GSU1_GSUC0_GSUWGMRR0_K1_MIWT3_12_NEPBS0_SU8_SUM1_SUS256_WSGRA0_WSGRB0_WGM6_WGMXCC8_WGMXCCGn1
    SolutionIndex: 12
    SolutionNameMin: Cijk_Alik_Bljk_F8B8BS_BH_BiasSB_HAS_SAB_SAV_UserArgs_MT256x352x64_MI16x16x1_SN_GSU1_GSUC0_GSUWGMRR0_K1_MIWT8_11_NEPBS0_SU0_SUM0_SUS0_WSGRA2_WSGRB0_WGM4_WGMXCC1_WGMXCCGn1
    SolutionIndex: 13
    SolutionNameMin: Cijk_Alik_Bljk_F8B8BS_BH_BiasSB_HAS_SAB_SAV_UserArgs_MT256x192x128_MI16x16x1_SN_GSU1_GSUC1_GSUWGMRR1_K1_MIWT8_6_NEPBS16_SU8_SUM1_SUS256_WSGRA2_WSGRB2_WGM4_WGMXCC8_WGMXCCG304
    SolutionIndex: 14
    SolutionNameMin: Cijk_Alik_Bljk_F8B8BS_BH_BiasSB_HAS_SAB_SAV_UserArgs_MT208x256x128_MI16x16x1_SN_GSU2_GSUC1_GSUWGMRR1_K1_MIWT13_4_NEPBS0_SU0_SUM0_SUS0_WSGRA0_WSGRB2_WGM1_WGMXCC8_WGMXCCGn1
    SolutionIndex: 15
    SolutionNameMin: Cijk_Alik_Bljk_F8B8BS_BH_BiasSB_HAS_SAB_SAV_UserArgs_MT320x288x64_MI16x16x1_SN_GSU1_GSUC0_GSUWGMRR0_K1_MIWT10_9_NEPBS0_SU8_SUM0_SUS64_WSGRA2_WSGRB0_WGM8_WGMXCC1_WGMXCCGn1
    SolutionIndex: 16
    SolutionNameMin: Cijk_Alik_Bljk_F8B8BS_BH_BiasSB_HAS_SAB_SAV_UserArgs_MT144x256x128_MI16x16x1_SN_GSU1_GSUC1_GSUWGMRR0_K1_MIWT9_4_NEPBS0_SU16_SUM0_SUS128_WSGRA2_WSGRB2_WGM8_WGMXCC1_WGMXCCGn1
    SolutionIndex: 17
    SolutionNameMin: Cijk_Alik_Bljk_F8B8BS_BH_BiasSB_HAS_SAB_SAV_UserArgs_MT256x288x64_MI16x16x1_SN_GSU1_GSUC0_GSUWGMRR0_K1_MIWT4_18_NEPBS0_SU16_SUM0_SUS256_WSGRA2_WSGRB2_WGM32_WGMXCC1_WGMXCCGn1
    SolutionIndex: 18
    SolutionNameMin: Cijk_Alik_Bljk_F8B8BS_BH_BiasSB_HAS_SAB_SAV_UserArgs_MT320x288x64_MI16x16x1_SN_GSU1_GSUC0_GSUWGMRR1_K1_MIWT10_9_NEPBS0_SU16_SUM0_SUS64_WSGRA0_WSGRB0_WGM8_WGMXCC1_WGMXCCGn1
    SolutionIndex: 19
    SolutionNameMin: Cijk_Alik_Bljk_F8B8BS_BH_BiasSB_HAS_SAB_SAV_UserArgs_MT256x192x128_MI16x16x1_SN_GSU1_GSUC0_GSUWGMRR0_K1_MIWT8_6_NEPBS0_SU16_SUM0_SUS128_WSGRA2_WSGRB0_WGM1_WGMXCC1_WGMXCCGn1
    SolutionIndex: 20
    SolutionNameMin: Cijk_Alik_Bljk_F8B8BS_BH_BiasSB_HAS_SAB_SAV_UserArgs_MT96x96x256_MI16x16x1_SN_GSU1_GSUC1_GSUWGMRR0_K1_MIWT3_3_NEPBS0_SU0_SUM0_SUS0_WSGRA2_WSGRB0_WGM6_WGMXCC8_WGMXCCG304
    SolutionIndex: 21
    SolutionNameMin: Cijk_Alik_Bljk_F8B8BS_BH_BiasSB_HAS_SAB_SAV_UserArgs_MT256x192x128_MI16x16x1_SN_GSU1_GSUC0_GSUWGMRR0_K1_MIWT8_6_NEPBS0_SU0_SUM0_SUS0_WSGRA2_WSGRB2_WGM1_WGMXCC1_WGMXCCGn1
    SolutionIndex: 22
    SolutionNameMin: Cijk_Alik_Bljk_F8B8BS_BH_BiasSB_HAS_SAB_SAV_UserArgs_MT224x256x128_MI16x16x1_SN_GSU1_GSUC0_GSUWGMRR1_K1_MIWT14_4_NEPBS0_SU16_SUM1_SUS128_WSGRA0_WSGRB0_WGM4_WGMXCC8_WGMXCCGn1
    SolutionIndex: 23
    SolutionNameMin: Cijk_Alik_Bljk_F8B8BS_BH_BiasSB_HAS_SAB_SAV_UserArgs_MT320x288x64_MI16x16x1_SN_GSU1_GSUC1_GSUWGMRR1_K1_MIWT5_18_NEPBS0_SU8_SUM0_SUS128_WSGRA2_WSGRB2_WGM8_WGMXCC1_WGMXCCGn1
    SolutionIndex: 24
    SolutionNameMin: Cijk_Alik_Bljk_F8B8BS_BH_BiasSB_HAS_SAB_SAV_UserArgs_MT256x192x128_MI16x16x1_SN_GSU1_GSUC1_GSUWGMRR1_K1_MIWT8_6_NEPBS0_SU8_SUM1_SUS128_WSGRA0_WSGRB2_WGM4_WGMXCC1_WGMXCCGn1
    SolutionIndex: 25
    SolutionNameMin: Cijk_Alik_Bljk_F8B8BS_BH_BiasSB_HAS_SAB_SAV_UserArgs_MT192x256x128_MI16x16x1_SN_GSU1_GSUC1_GSUWGMRR0_K1_MIWT12_4_NEPBS0_SU8_SUM1_SUS256_WSGRA0_WSGRB0_WGM6_WGMXCC8_WGMXCCG0
    SolutionIndex: 26
    SolutionNameMin: Cijk_Alik_Bljk_F8B8BS_BH_BiasSB_HAS_SAB_SAV_UserArgs_MT256x192x128_MI16x16x1_SN_GSU1_GSUC0_GSUWGMRR0_K1_MIWT4_12_NEPBS0_SU16_SUM0_SUS256_WSGRA2_WSGRB0_WGM1_WGMXCC1_WGMXCCGn1
    SolutionIndex: 27
    SolutionNameMin: Cijk_Alik_Bljk_F8B8_F8BS_BH_BiasSB_HAS_SAV_UserArgs_MT192x256x128_MI16x16x1_SN_LDSB1_DTVA0_GRVWA16_GRVWB16_GSU1_GSUC0_GSUWGMRR0_K1_LBSPPA256_LBSPPB1024_LPA32_LPB32_LRVW16_MIWT6_8_NLCA1_SU8_SUM0_SUS256_SVW2_ULSGRO1_USFGROn1_VWA2_VWB8_WSGRA0_WSGRB1_WG32_8_1_WGM32_WGMXCC1_WGMXCCGn1
    SolutionIndex: 28
    SolutionNameMin: Cijk_Alik_Bljk_F8B8_F8BS_BH_BiasSB_HAS_SAV_UserArgs_MT192x256x128_MI16x16x1_SN_LDSB1_DTVA0_GRVWA16_GRVWB16_GSU1_GSUC0_GSUWGMRR0_K1_LBSPPA256_LBSPPB1024_LPA32_LPB32_LRVW16_MIWT6_8_NLCA1_SU4_SUM1_SUS256_SVW2_ULSGRO0_USFGRO1_VWA2_VWB8_WSGRA1_WSGRB1_WG32_8_1_WGM32_WGMXCC1_WGMXCCGn1
    SolutionIndex: 29
    SolutionNameMin: Cijk_Alik_Bljk_F8B8_F8BS_BH_BiasSB_HAS_SAV_UserArgs_MT256x224x128_MI16x16x1_SN_LDSB1_DTVA0_GRVWA8_GRVWB8_GSU1_GSUC0_GSUWGMRR0_K1_LBSPPA1024_LBSPPB128_LPA8_LPB8_LRVW8_MIWT8_7_NLCA1_SU16_SUM0_SUS128_SVW8_ULSGRO1_USFGROn1_VWA8_VWB1_WSGRA1_WSGRB1_WG32_8_1_WGM1_WGMXCC1_WGMXCCGn1
    SolutionIndex: 30
    SolutionNameMin: Cijk_Alik_Bljk_F8B8_F8BS_BH_BiasSB_HAS_SAV_UserArgs_MT256x224x128_MI16x16x1_SN_LDSB1_DTVA0_GRVWA8_GRVWB8_GSU1_GSUC0_GSUWGMRR0_K1_LBSPPA1024_LBSPPB128_LPA8_LPB8_LRVW8_MIWT8_7_NLCA1_SU16_SUM0_SUS128_SVW8_ULSGRO1_USFGRO1_VWA8_VWB1_WSGRA1_WSGRB0_WG32_8_1_WGM1_WGMXCC1_WGMXCCGn1
    SolutionIndex: 31
    SolutionNameMin: Cijk_Alik_Bljk_F8B8_F8BS_BH_BiasSB_HAS_SAV_UserArgs_MT256x160x128_MI16x16x1_SN_LDSB1_DTVA0_GRVWA16_GRVWB16_GSU1_GSUC0_GSUWGMRR0_K1_LBSPPA1024_LBSPPB128_LPA32_LPB32_LRVW16_MIWT8_5_NLCA1_SU4_SUM1_SUS256_SVW8_ULSGRO0_USFGROn1_VWA8_VWB1_WSGRA0_WSGRB0_WG32_8_1_WGM1_WGMXCC1_WGMXCCGn1
    SolutionIndex: 32
    SolutionNameMin: Cijk_Alik_Bljk_F8B8_F8BS_BH_BiasSB_HAS_SAV_UserArgs_MT256x160x128_MI16x16x1_SN_LDSB1_DTVA0_GRVWA16_GRVWB16_GSU1_GSUC0_GSUWGMRR0_K1_LBSPPA1024_LBSPPB128_LPA32_LPB32_LRVW16_MIWT8_5_NLCA1_SU8_SUM1_SUS256_SVW8_ULSGRO1_USFGRO1_VWA8_VWB1_WSGRA1_WSGRB1_WG32_8_1_WGM1_WGMXCC1_WGMXCCGn1
    SolutionIndex: 33
    SolutionNameMin: Cijk_Alik_Bljk_F8B8_F8BS_BH_BiasSB_HAS_SAV_UserArgs_MT256x192x128_MI16x16x1_SN_LDSB1_DTVA0_GRVWA16_GRVWB16_GSU1_GSUC0_GSUWGMRR0_K1_LBSPPA1024_LBSPPB256_LPA32_LPB32_LRVW16_MIWT8_6_NLCA1_SU4_SUM0_SUS256_SVW8_ULSGRO1_USFGROn1_VWA8_VWB2_WSGRA1_WSGRB1_WG32_8_1_WGM1_WGMXCC1_WGMXCCGn1
    SolutionIndex: 34
    SolutionNameMin: Cijk_Alik_Bljk_F8B8_F8BS_BH_BiasSB_HAS_SAV_UserArgs_MT256x256x128_MI16x16x1_SN_LDSB1_DTVA1_GRVWA16_GRVWB16_GSU1_GSUC0_GSUWGMRR0_K1_LBSPPA0_LBSPPB2048_LPA0_LPB32_LRVW16_MIWT4_16_NLCA2_SU4_SUM0_SUS256_SVW4_ULSGRO0_USFGRO1_VWA4_VWB16_WSGRA0_WSGRB1_WG64_4_1_WGM1_WGMXCC1_WGMXCCGn1
    SolutionIndex: 35
    SolutionNameMin: Cijk_Alik_Bljk_F8B8_F8BS_BH_BiasSB_HAS_SAV_UserArgs_MT256x224x128_MI16x16x1_SN_LDSB1_DTVA0_GRVWA8_GRVWB8_GSU1_GSUC0_GSUWGMRR0_K1_LBSPPA1024_LBSPPB128_LPA8_LPB8_LRVW8_MIWT8_7_NLCA1_SU16_SUM0_SUS128_SVW8_ULSGRO1_USFGRO1_VWA8_VWB1_WSGRA0_WSGRB1_WG32_8_1_WGM1_WGMXCC1_WGMXCCGn1
    SolutionIndex: 36
    SolutionNameMin: Cijk_Alik_Bljk_F8B8_F8BS_BH_BiasSB_HAS_SAV_UserArgs_MT192x256x128_MI16x16x1_SN_LDSB1_DTVA0_GRVWA16_GRVWB16_GSU1_GSUC0_GSUWGMRR0_K1_LBSPPA256_LBSPPB1024_LPA32_LPB32_LRVW16_MIWT6_8_NLCA1_SU8_SUM0_SUS256_SVW2_ULSGRO1_USFGRO1_VWA2_VWB8_WSGRA0_WSGRB1_WG32_8_1_WGM32_WGMXCC1_WGMXCCGn1
    SolutionIndex: 37
    SolutionNameMin: Cijk_Alik_Bljk_F8B8_F8BS_BH_BiasSB_HAS_SAV_UserArgs_MT256x192x128_MI16x16x1_SN_LDSB1_DTVA0_GRVWA16_GRVWB16_GSU1_GSUC0_GSUWGMRR0_K1_LBSPPA1024_LBSPPB256_LPA32_LPB32_LRVW16_MIWT8_6_NLCA1_SU4_SUM0_SUS128_SVW8_ULSGRO1_USFGROn1_VWA8_VWB2_WSGRA0_WSGRB0_WG32_8_1_WGM32_WGMXCC1_WGMXCCGn1
    SolutionIndex: 38
    SolutionNameMin: Cijk_Alik_Bljk_F8B8_F8BS_BH_BiasSB_HAS_SAV_UserArgs_MT192x256x128_MI16x16x1_SN_LDSB1_DTVA0_GRVWA16_GRVWB16_GSU1_GSUC0_GSUWGMRR0_K1_LBSPPA256_LBSPPB1024_LPA32_LPB32_LRVW16_MIWT6_8_NLCA1_SU8_SUM1_SUS128_SVW2_ULSGRO0_USFGRO1_VWA2_VWB8_WSGRA0_WSGRB0_WG32_8_1_WGM32_WGMXCC1_WGMXCCGn1
    SolutionIndex: 39
    SolutionNameMin: Cijk_Alik_Bljk_F8B8_F8BS_BH_BiasSB_HAS_SAV_UserArgs_MT192x256x128_MI16x16x1_SN_LDSB1_DTVA0_GRVWA16_GRVWB16_GSU1_GSUC0_GSUWGMRR0_K1_LBSPPA256_LBSPPB1024_LPA32_LPB32_LRVW16_MIWT6_8_NLCA1_SU4_SUM1_SUS256_SVW2_ULSGRO0_USFGRO1_VWA2_VWB8_WSGRA0_WSGRB1_WG32_8_1_WGM32_WGMXCC1_WGMXCCGn1
    SolutionIndex: 40
    SolutionNameMin: Cijk_Alik_Bljk_F8B8_F8BS_BH_BiasSB_HAS_SAV_UserArgs_MT256x192x128_MI16x16x1_SN_LDSB1_DTVA0_GRVWA16_GRVWB16_GSU1_GSUC0_GSUWGMRR0_K1_LBSPPA1024_LBSPPB256_LPA32_LPB32_LRVW16_MIWT8_6_NLCA1_SU4_SUM0_SUS128_SVW8_ULSGRO1_USFGRO1_VWA8_VWB2_WSGRA1_WSGRB1_WG32_8_1_WGM1_WGMXCC1_WGMXCCGn1
    SolutionIndex: 41
    SolutionNameMin: Cijk_Alik_Bljk_F8B8_F8BS_BH_BiasSB_HAS_SAV_UserArgs_MT192x256x128_MI16x16x1_SN_LDSB1_DTVA0_GRVWA16_GRVWB16_GSU1_GSUC0_GSUWGMRR0_K1_LBSPPA256_LBSPPB1024_LPA32_LPB32_LRVW16_MIWT6_8_NLCA1_SU16_SUM1_SUS128_SVW2_ULSGRO1_USFGRO1_VWA2_VWB8_WSGRA0_WSGRB0_WG32_8_1_WGM32_WGMXCC1_WGMXCCGn1
    SolutionIndex: 42
    SolutionNameMin: Cijk_Alik_Bljk_F8B8_F8BS_BH_BiasSB_HAS_SAV_UserArgs_MT256x192x128_MI16x16x1_SN_LDSB1_DTVA0_GRVWA16_GRVWB16_GSU1_GSUC0_GSUWGMRR0_K1_LBSPPA1024_LBSPPB256_LPA32_LPB32_LRVW16_MIWT8_6_NLCA1_SU8_SUM0_SUS128_SVW8_ULSGRO1_USFGRO1_VWA8_VWB2_WSGRA0_WSGRB1_WG32_8_1_WGM1_WGMXCC1_WGMXCCGn1
    SolutionIndex: 43
    SolutionNameMin: Cijk_Alik_Bljk_F8B8_F8BS_BH_BiasSB_HAS_SAV_UserArgs_MT256x192x128_MI16x16x1_SN_LDSB1_DTVA0_GRVWA16_GRVWB16_GSU1_GSUC0_GSUWGMRR0_K1_LBSPPA1024_LBSPPB256_LPA32_LPB32_LRVW16_MIWT8_6_NLCA1_SU16_SUM0_SUS128_SVW8_ULSGRO1_USFGROn1_VWA8_VWB2_WSGRA0_WSGRB0_WG32_8_1_WGM1_WGMXCC1_WGMXCCGn1
    SolutionIndex: 44
    SolutionNameMin: Cijk_Alik_Bljk_F8B8_F8BS_BH_BiasSB_HAS_SAV_UserArgs_MT192x256x128_MI16x16x1_SN_LDSB1_DTVA0_GRVWA16_GRVWB16_GSU1_GSUC0_GSUWGMRR0_K1_LBSPPA256_LBSPPB1024_LPA32_LPB32_LRVW16_MIWT6_8_NLCA1_SU8_SUM0_SUS256_SVW2_ULSGRO0_USFGRO1_VWA2_VWB8_WSGRA0_WSGRB1_WG32_8_1_WGM32_WGMXCC1_WGMXCCGn1
    SolutionIndex: 45
    SolutionNameMin: Cijk_Alik_Bljk_F8B8_F8BS_BH_BiasSB_HAS_SAV_UserArgs_MT192x256x128_MI16x16x1_SN_LDSB1_DTVA0_GRVWA16_GRVWB16_GSU1_GSUC0_GSUWGMRR0_K1_LBSPPA256_LBSPPB1024_LPA32_LPB32_LRVW16_MIWT6_8_NLCA1_SU8_SUM1_SUS128_SVW2_ULSGRO1_USFGROn1_VWA2_VWB8_WSGRA0_WSGRB1_WG32_8_1_WGM32_WGMXCC1_WGMXCCGn1
    SolutionIndex: 46
    SolutionNameMin: Cijk_Alik_Bljk_F8B8_F8BS_BH_BiasSB_HAS_SAV_UserArgs_MT256x192x128_MI16x16x1_SN_LDSB1_DTVA0_GRVWA16_GRVWB16_GSU1_GSUC0_GSUWGMRR0_K1_LBSPPA1024_LBSPPB256_LPA32_LPB32_LRVW16_MIWT8_6_NLCA1_SU8_SUM1_SUS128_SVW8_ULSGRO0_USFGROn1_VWA8_VWB2_WSGRA1_WSGRB0_WG32_8_1_WGM1_WGMXCC1_WGMXCCGn1
    SolutionIndex: 47
    SolutionNameMin: Cijk_Alik_Bljk_F8B8_F8BS_BH_BiasSB_HAS_SAV_UserArgs_MT192x256x128_MI16x16x1_SN_LDSB1_DTVA0_GRVWA16_GRVWB16_GSU1_GSUC0_GSUWGMRR0_K1_LBSPPA256_LBSPPB1024_LPA32_LPB32_LRVW16_MIWT6_8_NLCA1_SU4_SUM0_SUS128_SVW2_ULSGRO1_USFGRO1_VWA2_VWB8_WSGRA0_WSGRB0_WG32_8_1_WGM32_WGMXCC1_WGMXCCGn1
    SolutionIndex: 48
    SolutionNameMin: Cijk_Alik_Bljk_F8B8_F8BS_BH_BiasSB_HAS_SAV_UserArgs_MT256x192x128_MI16x16x1_SN_LDSB1_DTVA0_GRVWA16_GRVWB16_GSU1_GSUC0_GSUWGMRR0_K1_LBSPPA1024_LBSPPB256_LPA32_LPB32_LRVW16_MIWT8_6_NLCA1_SU4_SUM1_SUS128_SVW8_ULSGRO1_USFGROn1_VWA8_VWB2_WSGRA1_WSGRB1_WG32_8_1_WGM1_WGMXCC1_WGMXCCGn1
    SolutionIndex: 49
    SolutionNameMin: Cijk_Alik_Bljk_F8B8_F8BS_BH_BiasSB_HAS_SAV_UserArgs_MT256x256x128_MI16x16x1_SN_LDSB1_DTVA1_GRVWA16_GRVWB16_GSU1_GSUC0_GSUWGMRR0_K1_LBSPPA0_LBSPPB2048_LPA0_LPB32_LRVW16_MIWT4_16_NLCA2_SU4_SUM0_SUS256_SVW4_ULSGRO0_USFGROn1_VWA4_VWB16_WSGRA0_WSGRB0_WG64_4_1_WGM1_WGMXCC1_WGMXCCGn1
    SolutionIndex: 50
    SolutionNameMin: Cijk_Alik_Bljk_F8B8_F8BS_BH_BiasSB_HAS_SAV_UserArgs_MT256x192x128_MI16x16x1_SN_LDSB1_DTVA0_GRVWA16_GRVWB16_GSU1_GSUC0_GSUWGMRR0_K1_LBSPPA1024_LBSPPB256_LPA32_LPB32_LRVW16_MIWT8_6_NLCA1_SU4_SUM1_SUS256_SVW8_ULSGRO0_USFGRO1_VWA8_VWB2_WSGRA0_WSGRB0_WG32_8_1_WGM1_WGMXCC1_WGMXCCGn1
    SolutionIndex: 51
    SolutionNameMin: Cijk_Alik_Bljk_F8B8_F8BS_BH_BiasSB_HAS_SAV_UserArgs_MT256x192x128_MI16x16x1_SN_LDSB1_DTVA0_GRVWA16_GRVWB16_GSU1_GSUC0_GSUWGMRR0_K1_LBSPPA1024_LBSPPB256_LPA32_LPB32_LRVW16_MIWT8_6_NLCA1_SU4_SUM1_SUS256_SVW8_ULSGRO0_USFGROn1_VWA8_VWB2_WSGRA1_WSGRB0_WG32_8_1_WGM1_WGMXCC1_WGMXCCGn1
    SolutionIndex: 52
    SolutionNameMin: Cijk_Alik_Bljk_F8B8_F8BS_BH_BiasSB_HAS_SAV_UserArgs_MT256x224x128_MI16x16x1_SN_LDSB1_DTVA0_GRVWA8_GRVWB8_GSU1_GSUC0_GSUWGMRR0_K1_LBSPPA1024_LBSPPB128_LPA8_LPB8_LRVW8_MIWT8_7_NLCA1_SU8_SUM1_SUS128_SVW8_ULSGRO1_USFGROn1_VWA8_VWB1_WSGRA1_WSGRB1_WG32_8_1_WGM1_WGMXCC1_WGMXCCGn1
    SolutionIndex: 53
    SolutionNameMin: Cijk_Alik_Bljk_F8B8_F8BS_BH_BiasSB_HAS_SAV_UserArgs_MT256x192x128_MI16x16x1_SN_LDSB1_DTVA0_GRVWA16_GRVWB16_GSU1_GSUC0_GSUWGMRR0_K1_LBSPPA1024_LBSPPB256_LPA32_LPB32_LRVW16_MIWT8_6_NLCA1_SU8_SUM0_SUS256_SVW8_ULSGRO1_USFGRO1_VWA8_VWB2_WSGRA1_WSGRB1_WG32_8_1_WGM1_WGMXCC1_WGMXCCGn1
    SolutionIndex: 54
    SolutionNameMin: Cijk_Alik_Bljk_F8B8_F8BS_BH_BiasSB_HAS_SAV_UserArgs_MT256x256x128_MI16x16x1_SN_LDSB1_DTVA1_GRVWA16_GRVWB16_GSU1_GSUC0_GSUWGMRR0_K1_LBSPPA0_LBSPPB2048_LPA0_LPB32_LRVW16_MIWT4_16_NLCA2_SU4_SUM0_SUS256_SVW4_ULSGRO0_USFGRO1_VWA4_VWB16_WSGRA0_WSGRB0_WG64_4_1_WGM1_WGMXCC1_WGMXCCGn1
    SolutionIndex: 55
    SolutionNameMin: Cijk_Alik_Bljk_F8B8_F8BS_BH_BiasSB_HAS_SAV_UserArgs_MT256x192x128_MI16x16x1_SN_LDSB1_DTVA0_GRVWA16_GRVWB16_GSU1_GSUC0_GSUWGMRR0_K1_LBSPPA1024_LBSPPB256_LPA32_LPB32_LRVW16_MIWT8_6_NLCA1_SU16_SUM0_SUS128_SVW8_ULSGRO1_USFGRO1_VWA8_VWB2_WSGRA1_WSGRB1_WG32_8_1_WGM1_WGMXCC1_WGMXCCGn1
    SolutionIndex: 56
    SolutionNameMin: Cijk_Alik_Bljk_F8B8_F8BS_BH_BiasSB_HAS_SAV_UserArgs_MT192x256x128_MI16x16x1_SN_LDSB1_DTVA0_GRVWA16_GRVWB16_GSU1_GSUC0_GSUWGMRR0_K1_LBSPPA256_LBSPPB1024_LPA32_LPB32_LRVW16_MIWT6_8_NLCA1_SU4_SUM0_SUS128_SVW2_ULSGRO0_USFGROn1_VWA2_VWB8_WSGRA0_WSGRB0_WG32_8_1_WGM32_WGMXCC1_WGMXCCGn1
    SolutionIndex: 57
    SolutionNameMin: Cijk_Alik_Bljk_F8B8_F8BS_BH_BiasSB_HAS_SAV_UserArgs_MT256x192x128_MI16x16x1_SN_LDSB1_DTVA0_GRVWA16_GRVWB16_GSU1_GSUC0_GSUWGMRR0_K1_LBSPPA1024_LBSPPB256_LPA32_LPB32_LRVW16_MIWT8_6_NLCA1_SU8_SUM0_SUS256_SVW8_ULSGRO1_USFGRO1_VWA8_VWB2_WSGRA0_WSGRB0_WG32_8_1_WGM1_WGMXCC1_WGMXCCGn1
    SolutionIndex: 58
    SolutionNameMin: Cijk_Alik_Bljk_F8B8_F8BS_BH_BiasSB_HAS_SAV_UserArgs_MT224x256x128_MI16x16x1_SN_LDSB1_DTVA0_GRVWA8_GRVWB8_GSU1_GSUC0_GSUWGMRR0_K1_LBSPPA128_LBSPPB1024_LPA8_LPB8_LRVW8_MIWT7_8_NLCA1_SU8_SUM1_SUS128_SVW1_ULSGRO1_USFGRO1_VWA1_VWB8_WSGRA1_WSGRB0_WG32_8_1_WGM32_WGMXCC1_WGMXCCGn1
    SolutionIndex: 59
    SolutionNameMin: Cijk_Alik_Bljk_F8B8_F8BS_BH_BiasSB_HAS_SAV_UserArgs_MT256x224x128_MI16x16x1_SN_LDSB1_DTVA0_GRVWA8_GRVWB8_GSU1_GSUC0_GSUWGMRR0_K1_LBSPPA1024_LBSPPB128_LPA8_LPB8_LRVW8_MIWT8_7_NLCA1_SU8_SUM0_SUS128_SVW8_ULSGRO1_USFGROn1_VWA8_VWB1_WSGRA0_WSGRB1_WG32_8_1_WGM1_WGMXCC1_WGMXCCGn1
    SolutionIndex: 60
    SolutionNameMin: Cijk_Alik_Bljk_F8B8_F8BS_BH_BiasSB_HAS_SAV_UserArgs_MT192x256x128_MI16x16x1_SN_LDSB1_DTVA0_GRVWA16_GRVWB16_GSU1_GSUC0_GSUWGMRR0_K1_LBSPPA256_LBSPPB1024_LPA32_LPB32_LRVW16_MIWT6_8_NLCA1_SU8_SUM1_SUS128_SVW2_ULSGRO1_USFGRO1_VWA2_VWB8_WSGRA1_WSGRB0_WG32_8_1_WGM32_WGMXCC1_WGMXCCGn1
    SolutionIndex: 61
    SolutionNameMin: Cijk_Alik_Bljk_F8B8_F8BS_BH_BiasSB_HAS_SAV_UserArgs_MT192x256x128_MI16x16x1_SN_LDSB1_DTVA0_GRVWA16_GRVWB16_GSU1_GSUC0_GSUWGMRR0_K1_LBSPPA256_LBSPPB1024_LPA32_LPB32_LRVW16_MIWT6_8_NLCA1_SU8_SUM0_SUS256_SVW2_ULSGRO1_USFGROn1_VWA2_VWB8_WSGRA1_WSGRB1_WG32_8_1_WGM32_WGMXCC1_WGMXCCGn1
    SolutionIndex: 62
    SolutionNameMin: Cijk_Alik_Bljk_F8B8_F8BS_BH_BiasSB_HAS_SAV_UserArgs_MT256x192x128_MI16x16x1_SN_LDSB1_DTVA0_GRVWA16_GRVWB16_GSU1_GSUC0_GSUWGMRR0_K1_LBSPPA1024_LBSPPB256_LPA32_LPB32_LRVW16_MIWT8_6_NLCA1_SU4_SUM0_SUS256_SVW8_ULSGRO1_USFGRO1_VWA8_VWB2_WSGRA0_WSGRB1_WG32_8_1_WGM1_WGMXCC1_WGMXCCGn1
    SolutionIndex: 63
    SolutionNameMin: Cijk_Alik_Bljk_F8B8_F8BS_BH_BiasSB_HAS_SAV_UserArgs_MT256x224x128_MI16x16x1_SN_LDSB1_DTVA0_GRVWA8_GRVWB8_GSU1_GSUC0_GSUWGMRR0_K1_LBSPPA1024_LBSPPB128_LPA8_LPB8_LRVW8_MIWT8_7_NLCA1_SU4_SUM1_SUS256_SVW8_ULSGRO1_USFGRO1_VWA8_VWB1_WSGRA0_WSGRB1_WG32_8_1_WGM1_WGMXCC1_WGMXCCGn1
    SolutionIndex: 64
    SolutionNameMin: Cijk_Alik_Bljk_F8B8_F8BS_BH_BiasSB_HAS_SAV_UserArgs_MT256x192x128_MI16x16x1_SN_LDSB1_DTVA0_GRVWA16_GRVWB16_GSU1_GSUC0_GSUWGMRR0_K1_LBSPPA1024_LBSPPB256_LPA32_LPB32_LRVW16_MIWT8_6_NLCA1_SU16_SUM0_SUS256_SVW8_ULSGRO0_USFGROn1_VWA8_VWB2_WSGRA1_WSGRB0_WG32_8_1_WGM1_WGMXCC1_WGMXCCGn1
    SolutionIndex: 65
    SolutionNameMin: Cijk_Alik_Bljk_F8B8_F8BS_BH_BiasSB_HAS_SAV_UserArgs_MT256x224x128_MI16x16x1_SN_LDSB1_DTVA0_GRVWA8_GRVWB8_GSU1_GSUC0_GSUWGMRR0_K1_LBSPPA1024_LBSPPB128_LPA8_LPB8_LRVW8_MIWT8_7_NLCA1_SU4_SUM1_SUS256_SVW8_ULSGRO1_USFGRO1_VWA8_VWB1_WSGRA1_WSGRB1_WG32_8_1_WGM1_WGMXCC1_WGMXCCGn1
    SolutionIndex: 66
    SolutionNameMin: Cijk_Alik_Bljk_F8B8_F8BS_BH_BiasSB_HAS_SAV_UserArgs_MT256x160x128_MI16x16x1_SN_LDSB1_DTVA0_GRVWA16_GRVWB16_GSU1_GSUC0_GSUWGMRR0_K1_LBSPPA1024_LBSPPB128_LPA32_LPB32_LRVW16_MIWT8_5_NLCA1_SU4_SUM0_SUS128_SVW8_ULSGRO0_USFGROn1_VWA8_VWB1_WSGRA0_WSGRB0_WG32_8_1_WGM1_WGMXCC1_WGMXCCGn1
    SolutionIndex: 67
    SolutionNameMin: Cijk_Alik_Bljk_F8B8_F8BS_BH_BiasSB_HAS_SAV_UserArgs_MT256x224x128_MI16x16x1_SN_LDSB1_DTVA0_GRVWA8_GRVWB8_GSU1_GSUC0_GSUWGMRR0_K1_LBSPPA1024_LBSPPB128_LPA8_LPB8_LRVW8_MIWT8_7_NLCA1_SU8_SUM1_SUS128_SVW8_ULSGRO1_USFGRO1_VWA8_VWB1_WSGRA0_WSGRB0_WG32_8_1_WGM1_WGMXCC1_WGMXCCGn1
    SolutionIndex: 68
    SolutionNameMin: Cijk_Alik_Bljk_F8B8_F8BS_BH_BiasSB_HAS_SAV_UserArgs_MT256x192x128_MI16x16x1_SN_LDSB1_DTVA0_GRVWA16_GRVWB16_GSU1_GSUC0_GSUWGMRR0_K1_LBSPPA1024_LBSPPB256_LPA32_LPB32_LRVW16_MIWT8_6_NLCA1_SU4_SUM1_SUS128_SVW8_ULSGRO0_USFGROn1_VWA8_VWB2_WSGRA1_WSGRB0_WG32_8_1_WGM1_WGMXCC1_WGMXCCGn1
- - - [1600, 1600, 1, 51200]
    - [20, 0.0]
  - - [1600, 4800, 1, 51200]
    - [14, 0.0]
  - - [1600, 51200, 1, 1600]
    - [18, 0.0]
  - - [1600, 51200, 1, 4800]
    - [23, 0.0]
  - - [1600, 51200, 1, 6400]
    - [15, 0.0]
  - - [1600, 6400, 1, 51200]
    - [16, 0.0]
  - - [4800, 51200, 1, 1600]
    - [6, 0.0]
  - - [6400, 1600, 1, 51200]
    - [9, 0.0]
  - - [6400, 51200, 1, 1600]
    - [17, 0.0]
  - - [6400, 8192, 1, 1600]
    - [0, 0.0]
  - - [6400, 1600, 1, 8192]
    - [7, 0.0]
  - - [1600, 8192, 1, 6400]
    - [1, 0.0]
  - - [1600, 6400, 1, 8192]
    - [2, 0.0]
  - - [1600, 8192, 1, 1600]
    - [3, 0.0]
  - - [1600, 1600, 1, 8192]
    - [4, 0.0]
  - - [1600, 8192, 1, 4800]
    - [8, 0.0]
  - - [1600, 4800, 1, 8192]
    - [5, 0.0]
  - - [4096, 32000, 1, 32768]
    - [10, 0.0]
  - - [4096, 5120, 1, 32768]
    - [11, 0.0]
  - - [4096, 32768, 1, 32000]
    - [12, 0.0]
  - - [4096, 32768, 1, 28672]
    - [13, 0.0]
  - - [4096, 32768, 1, 4096]
    - [19, 0.0]
  - - [14336, 32768, 1, 4096]
    - [21, 0.0]
  - - [4096, 4096, 1, 32768]
    - [22, 0.0]
  - - [4096, 32768, 1, 5120]
    - [24, 0.0]
  - - [14336, 4096, 1, 32768]
    - [25, 0.0]
  - - [4096, 28672, 1, 32768]
    - [26, 0.0]
  - - [28672, 40960, 1, 8192]
    - [27, 0.0]
  - - [28672, 8192, 1, 40960]
    - [28, 0.0]
  - - [8192, 10240, 1, 40960]
    - [29, 0.0]
  - - [8192, 128256, 1, 40960]
    - [30, 0.0]
  - - [8192, 40960, 1, 10240]
    - [31, 0.0]
  - - [8192, 40960, 1, 128256]
    - [32, 0.0]
  - - [8192, 40960, 1, 57344]
    - [33, 0.0]
  - - [8192, 40960, 1, 8192]
    - [34, 0.0]
  - - [8192, 57344, 1, 40960]
    - [30, 0.0]
  - - [8192, 8192, 1, 40960]
    - [35, 0.0]
  - - [28672, 45056, 1, 8192]
    - [36, 0.0]
  - - [28672, 49152, 1, 8192]
    - [36, 0.0]
  - - [28672, 53248, 1, 8192]
    - [36, 0.0]
  - - [28672, 8192, 1, 45056]
    - [37, 0.0]
  - - [28672, 8192, 1, 49152]
    - [38, 0.0]
  - - [28672, 8192, 1, 53248]
    - [39, 0.0]
  - - [8192, 10240, 1, 45056]
    - [40, 0.0]
  - - [8192, 10240, 1, 49152]
    - [41, 0.0]
  - - [8192, 10240, 1, 53248]
    - [42, 0.0]
  - - [8192, 128256, 1, 45056]
    - [43, 0.0]
  - - [8192, 128256, 1, 49152]
    - [44, 0.0]
  - - [8192, 128256, 1, 53248]
    - [45, 0.0]
  - - [8192, 45056, 1, 10240]
    - [46, 0.0]
  - - [8192, 45056, 1, 128256]
    - [47, 0.0]
  - - [8192, 45056, 1, 57344]
    - [48, 0.0]
  - - [8192, 45056, 1, 8192]
    - [49, 0.0]
  - - [8192, 49152, 1, 10240]
    - [50, 0.0]
  - - [8192, 49152, 1, 128256]
    - [46, 0.0]
  - - [8192, 49152, 1, 57344]
    - [48, 0.0]
  - - [8192, 53248, 1, 10240]
    - [51, 0.0]
  - - [8192, 53248, 1, 128256]
    - [52, 0.0]
  - - [8192, 53248, 1, 57344]
    - [53, 0.0]
  - - [8192, 53248, 1, 8192]
    - [54, 0.0]
  - - [8192, 57344, 1, 45056]
    - [55, 0.0]
  - - [8192, 57344, 1, 49152]
    - [56, 0.0]
  - - [8192, 57344, 1, 53248]
    - [57, 0.0]
  - - [8192, 8192, 1, 45056]
    - [55, 0.0]
  - - [8192, 8192, 1, 49152]
    - [58, 0.0]
  - - [8192, 8192, 1, 53248]
    - [59, 0.0]
  - - [14336, 4096, 1, 20480]
    - [60, 0.0]
  - - [14336, 4096, 1, 24576]
    - [61, 0.0]
  - - [4096, 128256, 1, 24576]
    - [62, 0.0]
  - - [4096, 16384, 1, 128256]
    - [63, 0.0]
  - - [4096, 16384, 1, 4096]
    - [64, 0.0]
  - - [4096, 20480, 1, 128256]
    - [65, 0.0]
  - - [4096, 20480, 1, 28672]
    - [66, 0.0]
  - - [4096, 24576, 1, 128256]
    - [67, 0.0]
  - - [4096, 28672, 1, 20480]
    - [68, 0.0]
- null
- null
- DeviceEfficiency
- Equality
