library/src/amd_detail/rocblaslt/src/Tensile/Logic/asm_full/aquavanjaram/gfx942/Equality/aquavanjaram_Cijk_Alik_Bljk_F8B8BS_BH_SAB_UserArgs.yaml
- {MinimumRequiredVersion: 4.33.0}
- aquavanjaram
- gfx942
- [Device 0049, Device 0050]
    SolutionIndex: 0
    SolutionNameMin: Cijk_Alik_Bljk_F8B8BS_BH_SAB_UserArgs_MT256x256x64_MI32x32x1_SN_AFEM8_AFEM1_ASEM1_GRVWA16_GRVWB16_GSU1_GSUC0_GSUWGMRR0_K1_LBSPPA256_LBSPPB256_LPA16_LPB16_LRVW16_MIWT4_4_SU8_SUM0_SUS256_VWB4_WGM1_WGMXCC1_WGMXCCGn1
    SolutionIndex: 1
    SolutionNameMin: Cijk_Alik_Bljk_F8B8BS_BH_SAB_UserArgs_MT256x144x128_MI16x16x1_SN_AFEM8_AFEM8_ASEM64_GRVWA16_GRVWB8_GSU1_GSUC0_GSUWGMRR0_K1_LBSPPA512_LBSPPB128_LPA32_LPB32_LRVW16_MIWT4_9_SU0_SUM0_SUS0_VWB1_WGM1_WGMXCC1_WGMXCCGn1
    SolutionIndex: 2
    SolutionNameMin: Cijk_Alik_Bljk_F8B8BS_BH_SAB_UserArgs_MT256x144x128_MI16x16x1_SN_AFEM1_AFEM1_ASEM64_GRVWA16_GRVWB8_GSU1_GSUC0_GSUWGMRR0_K1_LBSPPA512_LBSPPB128_LPA32_LPB32_LRVW16_MIWT4_9_SU8_SUM0_SUS256_VWB1_WGM1_WGMXCC1_WGMXCCGn1
    SolutionIndex: 3
    SolutionNameMin: Cijk_Alik_Bljk_F8B8BS_BH_SAB_UserArgs_MT256x144x128_MI16x16x1_SN_AFEM8_AFEM1_ASEM1_GRVWA16_GRVWB8_GSU1_GSUC0_GSUWGMRR0_K1_LBSPPA512_LBSPPB128_LPA32_LPB32_LRVW16_MIWT4_9_SU8_SUM0_SUS256_VWB1_WGM1_WGMXCC1_WGMXCCGn1
    SolutionIndex: 4
    SolutionNameMin: Cijk_Alik_Bljk_F8B8BS_BH_SAB_UserArgs_MT256x144x128_MI16x16x1_SN_AFEM8_AFEM8_ASEM1_GRVWA16_GRVWB8_GSU1_GSUC0_GSUWGMRR0_K1_LBSPPA512_LBSPPB128_LPA32_LPB32_LRVW16_MIWT4_9_SU8_SUM0_SUS256_VWB1_WGM1_WGMXCC1_WGMXCCGn1
    SolutionIndex: 5
    SolutionNameMin: Cijk_Alik_Bljk_F8B8BS_BH_SAB_UserArgs_MT256x208x128_MI16x16x1_SN_AFEM8_AFEM1_ASEM32_GRVWA16_GRVWB8_GSU1_GSUC0_GSUWGMRR0_K1_LBSPPA512_LBSPPB128_LPA16_LPB8_LRVW8_MIWT4_13_SU4_SUM0_SUS256_VWB1_WGM1_WGMXCC1_WGMXCCGn1
    SolutionIndex: 6
    SolutionNameMin: Cijk_Alik_Bljk_F8B8BS_BH_SAB_UserArgs_MT256x208x128_MI16x16x1_SN_AFEM8_AFEM1_ASEM64_GRVWA16_GRVWB8_GSU1_GSUC0_GSUWGMRR0_K1_LBSPPA512_LBSPPB128_LPA16_LPB8_LRVW8_MIWT4_13_SU8_SUM0_SUS256_VWB1_WGM1_WGMXCC1_WGMXCCGn1
    SolutionIndex: 7
    SolutionNameMin: Cijk_Alik_Bljk_F8B8BS_BH_SAB_UserArgs_MT256x208x128_MI16x16x1_SN_AFEM8_AFEM8_ASEM1_GRVWA8_GRVWB8_GSU1_GSUC0_GSUWGMRR0_K1_LBSPPA512_LBSPPB128_LPA8_LPB8_LRVW8_MIWT4_13_SU8_SUM0_SUS256_VWB1_WGM1_WGMXCC1_WGMXCCGn1
    SolutionIndex: 8
    SolutionNameMin: Cijk_Alik_Bljk_F8B8BS_BH_SAB_UserArgs_MT256x128x128_MI32x32x1_SN_AFEM8_AFEM1_ASEM64_GRVWA16_GRVWB16_GSU1_GSUC0_GSUWGMRR0_K1_LBSPPA512_LBSPPB128_LPA16_LPB16_LRVW16_MIWT4_2_SU8_SUM0_SUS256_VWB1_WGM1_WGMXCC1_WGMXCCGn1
    SolutionIndex: 9
    SolutionNameMin: Cijk_Alik_Bljk_F8B8BS_BH_SAB_UserArgs_MT256x128x128_MI32x32x1_SN_AFEM1_AFEM8_ASEM64_GRVWA16_GRVWB16_GSU1_GSUC0_GSUWGMRR0_K1_LBSPPA512_LBSPPB128_LPA16_LPB16_LRVW16_MIWT4_2_SU8_SUM0_SUS256_VWB1_WGM1_WGMXCC1_WGMXCCGn1
    SolutionIndex: 10
    SolutionNameMin: Cijk_Alik_Bljk_F8B8BS_BH_SAB_UserArgs_MT256x208x128_MI16x16x1_SN_AFEM8_AFEM1_ASEM1_GRVWA8_GRVWB8_GSU1_GSUC0_GSUWGMRR0_K1_LBSPPA512_LBSPPB128_LPA8_LPB8_LRVW8_MIWT4_13_SU8_SUM0_SUS256_VWB1_WGM1_WGMXCC1_WGMXCCGn1
    SolutionIndex: 11
    SolutionNameMin: Cijk_Alik_Bljk_F8B8BS_BH_SAB_UserArgs_MT256x208x128_MI16x16x1_SN_AFEM1_AFEM8_ASEM32_GRVWA8_GRVWB8_GSU1_GSUC0_GSUWGMRR0_K1_LBSPPA512_LBSPPB128_LPA8_LPB8_LRVW8_MIWT4_13_SU4_SUM0_SUS256_VWB1_WGM1_WGMXCC1_WGMXCCGn1
    SolutionIndex: 12
    SolutionNameMin: Cijk_Alik_Bljk_F8B8BS_BH_SAB_UserArgs_MT256x208x128_MI16x16x1_SN_AFEM1_AFEM1_ASEM32_GRVWA16_GRVWB8_GSU1_GSUC0_GSUWGMRR0_K1_LBSPPA512_LBSPPB128_LPA16_LPB8_LRVW8_MIWT4_13_SU8_SUM0_SUS256_VWB1_WGM1_WGMXCC1_WGMXCCGn1
    SolutionIndex: 13
    SolutionNameMin: Cijk_Alik_Bljk_F8B8BS_BH_SAB_UserArgs_MT256x128x128_MI32x32x1_SN_AFEM1_AFEM1_ASEM64_GRVWA16_GRVWB16_GSU1_GSUC0_GSUWGMRR0_K1_LBSPPA512_LBSPPB128_LPA16_LPB16_LRVW16_MIWT4_2_SU8_SUM0_SUS256_VWB1_WGM1_WGMXCC1_WGMXCCGn1
    SolutionIndex: 14
    SolutionNameMin: Cijk_Alik_Bljk_F8B8BS_BH_SAB_UserArgs_MT256x208x128_MI16x16x1_SN_AFEM8_AFEM8_ASEM32_GRVWA8_GRVWB8_GSU1_GSUC0_GSUWGMRR0_K1_LBSPPA512_LBSPPB128_LPA8_LPB8_LRVW8_MIWT4_13_SU4_SUM0_SUS256_VWB1_WGM1_WGMXCC1_WGMXCCGn1
    SolutionIndex: 15
    SolutionNameMin: Cijk_Alik_Bljk_F8B8BS_BH_SAB_UserArgs_MT256x208x128_MI16x16x1_SN_AFEM1_AFEM1_ASEM64_GRVWA8_GRVWB8_GSU1_GSUC0_GSUWGMRR0_K1_LBSPPA512_LBSPPB128_LPA8_LPB8_LRVW8_MIWT4_13_SU8_SUM0_SUS256_VWB1_WGM1_WGMXCC1_WGMXCCGn1
    SolutionIndex: 16
    SolutionNameMin: Cijk_Alik_Bljk_F8B8BS_BH_SAB_UserArgs_MT256x208x128_MI16x16x1_SN_AFEM8_AFEM8_ASEM1_GRVWA8_GRVWB8_GSU1_GSUC0_GSUWGMRR0_K1_LBSPPA512_LBSPPB128_LPA8_LPB8_LRVW8_MIWT4_13_SU4_SUM0_SUS256_VWB1_WGM1_WGMXCC1_WGMXCCGn1
- - - [14336, 16384, 1, 4096]
    - [7, 0.0]
  - - [14336, 4096, 1, 16384]
    - [9, 0.0]
  - - [4096, 16384, 1, 28672]
    - [8, 0.0]
  - - [4096, 28672, 1, 16384]
    - [6, 0.0]
  - - [4096, 16384, 1, 4096]
    - [2, 0.0]
  - - [4096, 4096, 1, 16384]
    - [0, 0.0]
  - - [4096, 16384, 1, 5120]
    - [4, 0.0]
  - - [4096, 5120, 1, 16384]
    - [3, 0.0]
  - - [4096, 16384, 1, 128256]
    - [1, 0.0]
  - - [4096, 128256, 1, 16384]
    - [5, 0.0]
  - - [28672, 40960, 1, 8192]
    - [10, 0.0]
  - - [28672, 8192, 1, 40960]
    - [11, 0.0]
  - - [8192, 40960, 1, 57344]
    - [12, 0.0]
  - - [8192, 57344, 1, 40960]
    - [13, 0.0]
  - - [8192, 40960, 1, 8192]
    - [5, 0.0]
  - - [8192, 8192, 1, 40960]
    - [7, 0.0]
  - - [8192, 40960, 1, 10240]
    - [14, 0.0]
  - - [4096, 10240, 1, 40960]
    - [15, 0.0]
  - - [8192, 40960, 1, 128256]
    - [16, 0.0]
  - - [8192, 128256, 1, 40960]
    - [7, 0.0]
- null
- null
- DeviceEfficiency
- Equality
