library/src/amd_detail/rocblaslt/src/Tensile/Logic/asm_full/aquavanjaram/gfx942/Equality/aquavanjaram_Cijk_Alik_Bljk_F8F8S_BH_BiasSH_HAS_SAB_SCD_SAV_UserArgs.yaml
- {MinimumRequiredVersion: 4.33.0}
- aquavanjaram
- gfx942
- [Device 0049, Device 0050]
    SolutionIndex: 0
    SolutionNameMin: Cijk_Alik_Bljk_F8F8S_BH_BiasSH_HAS_SAB_SCD_SAV_UserArgs_MT256x256x128_MI16x16x1_SN_GSU1_GSUC0_GSUWGMRR0_K1_MIWT4_16_SU32_SUM0_SUS256_WGM8_WGMXCC1_WGMXCCG0
    SolutionIndex: 1
    SolutionNameMin: Cijk_Alik_Bljk_F8F8S_BH_BiasSH_HAS_SAB_SCD_SAV_UserArgs_MT256x256x128_MI16x16x1_SN_GSU1_GSUC1_GSUWGMRR0_K1_MIWT4_16_SU64_SUM0_SUS256_WGM8_WGMXCC4_WGMXCCG0
    SolutionIndex: 2
    SolutionNameMin: Cijk_Alik_Bljk_F8F8S_BH_BiasSH_HAS_SAB_SCD_SAV_UserArgs_MT256x256x128_MI16x16x1_SN_GSU1_GSUC0_GSUWGMRR0_K1_MIWT4_16_SU2_SUM0_SUS512_WGM0_WGMXCC8_WGMXCCG0
    SolutionIndex: 3
    SolutionNameMin: Cijk_Alik_Bljk_F8F8S_BH_BiasSH_HAS_SAB_SCD_SAV_UserArgs_MT256x256x128_MI16x16x1_SN_GSU1_GSUC0_GSUWGMRR1_K1_MIWT4_16_SU8_SUM3_SUS256_WGM2_WGMXCC4_WGMXCCG0
    SolutionIndex: 4
    SolutionNameMin: Cijk_Alik_Bljk_F8F8S_BH_BiasSH_HAS_SAB_SCD_SAV_UserArgs_MT256x256x128_MI16x16x1_SN_GSU1_GSUC1_GSUWGMRR0_K1_MIWT4_16_SU4_SUM0_SUS256_WGM0_WGMXCC1_WGMXCCG0
    SolutionIndex: 5
    SolutionNameMin: Cijk_Alik_Bljk_F8F8S_BH_BiasSH_HAS_SAB_SCD_SAV_UserArgs_MT128x64x256_MI16x16x1_SN_GSU8_GSUC1_GSUWGMRR0_K1_MIWT4_2_SU8_SUM4_SUS256_WGM0_WGMXCC1_WGMXCCG4
    SolutionIndex: 6
    SolutionNameMin: Cijk_Alik_Bljk_F8F8S_BH_BiasSH_HAS_SAB_SCD_SAV_UserArgs_MT256x224x128_MI16x16x1_SN_GSU1_GSUC0_GSUWGMRR1_K1_MIWT8_7_SU4_SUM1_SUS256_WGM48_WGMXCC1_WGMXCCGn1
    SolutionIndex: 7
    SolutionNameMin: Cijk_Alik_Bljk_F8F8S_BH_BiasSH_HAS_SAB_SCD_SAV_UserArgs_MT256x224x128_MI16x16x1_SN_GSU1_GSUC0_GSUWGMRR0_K1_MIWT8_7_SU2_SUM0_SUS128_WGM0_WGMXCC1_WGMXCCGn1
    SolutionIndex: 8
    SolutionNameMin: Cijk_Alik_Bljk_F8F8S_BH_BiasSH_HAS_SAB_SCD_SAV_UserArgs_MT256x224x128_MI16x16x1_SN_GSU1_GSUC0_GSUWGMRR0_K1_MIWT8_7_SU0_SUM0_SUS0_WGM0_WGMXCC1_WGMXCCGn1
    SolutionIndex: 9
    SolutionNameMin: Cijk_Alik_Bljk_F8F8S_BH_BiasSH_HAS_SAB_SCD_SAV_UserArgs_MT64x128x256_MI16x16x1_SN_GSU1_GSUC0_GSUWGMRR1_K1_MIWT4_2_SU2_SUM3_SUS512_WGM0_WGMXCC1_WGMXCCGn1
    SolutionIndex: 10
    SolutionNameMin: Cijk_Alik_Bljk_F8F8S_BH_BiasSH_HAS_SAB_SCD_SAV_UserArgs_MT256x224x128_MI16x16x1_SN_GSU1_GSUC1_GSUWGMRR1_K1_MIWT8_7_SU8_SUM1_SUS512_WGM32_WGMXCC1_WGMXCCGn1
    SolutionIndex: 11
    SolutionNameMin: Cijk_Alik_Bljk_F8F8S_BH_BiasSH_HAS_SAB_SCD_SAV_UserArgs_MT192x256x128_MI16x16x1_SN_GSU1_GSUC1_GSUWGMRR0_K1_MIWT6_8_SU0_SUM0_SUS0_WGM4_WGMXCC8_WGMXCCGn1
    SolutionIndex: 12
    SolutionNameMin: Cijk_Alik_Bljk_F8F8S_BH_BiasSH_HAS_SAB_SCD_SAV_UserArgs_MT64x16x512_MI16x16x1_SN_GSU4_GSUC0_GSUWGMRR0_K1_MIWT1_1_SU4_SUM0_SUS2048_WGM1_WGMXCC32_WGMXCCG0
    SolutionIndex: 13
    SolutionNameMin: Cijk_Alik_Bljk_F8F8S_BH_BiasSH_HAS_SAB_SCD_SAV_UserArgs_MT64x16x512_MI16x16x1_SN_GSU1_GSUC0_GSUWGMRR1_K1_MIWT1_1_SU4_SUM3_SUS1024_WGM1_WGMXCC1_WGMXCCG190
    SolutionIndex: 14
    SolutionNameMin: Cijk_Alik_Bljk_F8F8S_BH_BiasSH_HAS_SAB_SCD_SAV_UserArgs_MT96x128x256_MI16x16x1_SN_GSU3_GSUC0_GSUWGMRR1_K1_MIWT3_4_SU2_SUM1_SUS1024_WGM1_WGMXCC1_WGMXCCG0
    SolutionIndex: 15
    SolutionNameMin: Cijk_Alik_Bljk_F8F8S_BH_BiasSH_HAS_SAB_SCD_SAV_UserArgs_MT256x128x128_MI16x16x1_SN_GSU1_GSUC0_GSUWGMRR1_K1_MIWT8_4_SU16_SUM4_SUS128_WGM1_WGMXCC32_WGMXCCG0
    SolutionIndex: 16
    SolutionNameMin: Cijk_Alik_Bljk_F8F8S_BH_BiasSH_HAS_SAB_SCD_SAV_UserArgs_MT192x256x128_MI16x16x1_SN_GSU1_GSUC1_GSUWGMRR0_K1_MIWT6_8_SU16_SUM4_SUS2048_WGM0_WGMXCC1_WGMXCCGn1
    SolutionIndex: 17
    SolutionNameMin: Cijk_Alik_Bljk_F8F8S_BH_BiasSH_HAS_SAB_SCD_SAV_UserArgs_MT192x128x128_MI16x16x1_SN_GSU1_GSUC0_GSUWGMRR1_K1_MIWT3_8_SU16_SUM2_SUS128_WGM32_WGMXCC16_WGMXCCG0
    SolutionIndex: 18
    SolutionNameMin: Cijk_Alik_Bljk_F8F8S_BH_BiasSH_HAS_SAB_SCD_SAV_UserArgs_MT64x16x512_MI16x16x1_SN_GSU1_GSUC0_GSUWGMRR0_K1_MIWT1_1_SU16_SUM4_SUS1024_WGM152_WGMXCC16_WGMXCCG0
    SolutionIndex: 19
    SolutionNameMin: Cijk_Alik_Bljk_F8F8S_BH_BiasSH_HAS_SAB_SCD_SAV_UserArgs_MT128x256x128_MI16x16x1_SN_GSU1_GSUC1_GSUWGMRR0_K1_MIWT8_4_SU2_SUM2_SUS256_WGM12_WGMXCC8_WGMXCCGn1
    SolutionIndex: 20
    SolutionNameMin: Cijk_Alik_Bljk_F8F8S_BH_BiasSH_HAS_SAB_SCD_SAV_UserArgs_MT256x224x128_MI16x16x1_SN_GSU1_GSUC0_GSUWGMRR1_K1_MIWT8_7_SU2_SUM0_SUS128_WGM48_WGMXCC1_WGMXCCGn1
    SolutionIndex: 21
    SolutionNameMin: Cijk_Alik_Bljk_F8F8S_BH_BiasSH_HAS_SAB_SCD_SAV_UserArgs_MT192x256x128_MI16x16x1_SN_GSU1_GSUC0_GSUWGMRR1_K1_MIWT6_8_SU0_SUM0_SUS0_WGM4_WGMXCC1_WGMXCCGn1
    SolutionIndex: 22
    SolutionNameMin: Cijk_Alik_Bljk_F8F8S_BH_BiasSH_HAS_SAB_SCD_SAV_UserArgs_MT16x32x1024_MI16x16x1_SN_GSU1_GSUC0_GSUWGMRR1_K1_MIWT1_1_SU64_SUM0_SUS1024_WGM1_WGMXCC8_WGMXCCG0
    SolutionIndex: 23
    SolutionNameMin: Cijk_Alik_Bljk_F8F8S_BH_BiasSH_HAS_SAB_SCD_SAV_UserArgs_MT192x256x128_MI16x16x1_SN_GSU1_GSUC1_GSUWGMRR1_K1_MIWT6_8_SU4_SUM0_SUS512_WGM16_WGMXCC2_WGMXCCGn1
    SolutionIndex: 24
    SolutionNameMin: Cijk_Alik_Bljk_F8F8S_BH_BiasSH_HAS_SAB_SCD_SAV_UserArgs_MT192x256x128_MI16x16x1_SN_GSU1_GSUC0_GSUWGMRR1_K1_MIWT6_8_SU0_SUM0_SUS0_WGM4_WGMXCC1_WGMXCCGn1
    SolutionIndex: 25
    SolutionNameMin: Cijk_Alik_Bljk_F8F8S_BH_BiasSH_HAS_SAB_SCD_SAV_UserArgs_MT96x64x256_MI16x16x1_SN_GSU1_GSUC0_GSUWGMRR1_K1_MIWT3_2_SU4_SUM4_SUS1024_WGM48_WGMXCC16_WGMXCCGn1
    SolutionIndex: 26
    SolutionNameMin: Cijk_Alik_Bljk_F8F8S_BH_BiasSH_HAS_SAB_SCD_SAV_UserArgs_MT256x224x128_MI16x16x1_SN_GSU1_GSUC0_GSUWGMRR0_K1_MIWT8_7_SU2_SUM0_SUS128_WGM0_WGMXCC1_WGMXCCGn1
    SolutionIndex: 27
    SolutionNameMin: Cijk_Alik_Bljk_F8F8S_BH_BiasSH_HAS_SAB_SCD_SAV_UserArgs_MT64x128x256_MI16x16x1_SN_GSU1_GSUC0_GSUWGMRR0_K1_MIWT2_4_SU8_SUM2_SUS256_WGM0_WGMXCC8_WGMXCCG48
    SolutionIndex: 28
    SolutionNameMin: Cijk_Alik_Bljk_F8F8S_BH_BiasSH_HAS_SAB_SCD_SAV_UserArgs_MT192x256x128_MI16x16x1_SN_GSU1_GSUC0_GSUWGMRR0_K1_MIWT6_8_SU0_SUM0_SUS0_WGM48_WGMXCC1_WGMXCCGn1
- - - [8192, 8192, 1, 8192]
    - [0, 0.0]
  - - [1024, 16384, 1, 8192]
    - [1, 0.0]
  - - [8192, 16384, 1, 1280]
    - [2, 0.0]
  - - [3584, 16384, 1, 8192]
    - [3, 0.0]
  - - [8192, 16384, 1, 7168]
    - [4, 0.0]
  - - [2304, 128, 1, 16384]
    - [5, 0.0]
  - - [16384, 32768, 1, 2048]
    - [6, 0.0]
  - - [16384, 32768, 1, 6656]
    - [7, 0.0]
  - - [16384, 16384, 1, 6656]
    - [8, 0.0]
  - - [16384, 128, 1, 6656]
    - [9, 0.0]
  - - [16384, 16384, 1, 2048]
    - [10, 0.0]
  - - [13312, 16384, 1, 16384]
    - [11, 0.0]
  - - [16384, 1, 1, 2048]
    - [12, 0.0]
  - - [16384, 1, 1, 6656]
    - [13, 0.0]
  - - [2304, 512, 1, 16384]
    - [14, 0.0]
  - - [16384, 512, 1, 2048]
    - [15, 0.0]
  - - [2304, 16384, 1, 16384]
    - [16, 0.0]
  - - [13312, 512, 1, 16384]
    - [17, 0.0]
  - - [13312, 1, 1, 16384]
    - [18, 0.0]
  - - [16384, 512, 1, 6656]
    - [19, 0.0]
  - - [16384, 65536, 1, 2048]
    - [20, 0.0]
  - - [2304, 65536, 1, 16384]
    - [21, 0.0]
  - - [2304, 1, 1, 16384]
    - [22, 0.0]
  - - [13312, 65536, 1, 16384]
    - [23, 0.0]
  - - [2304, 32768, 1, 16384]
    - [24, 0.0]
  - - [13312, 128, 1, 16384]
    - [25, 0.0]
  - - [16384, 65536, 1, 6656]
    - [26, 0.0]
  - - [16384, 128, 1, 2048]
    - [27, 0.0]
  - - [13312, 32768, 1, 16384]
    - [28, 0.0]
- null
- null
- DeviceEfficiency
- Equality
