library/src/amd_detail/rocblaslt/src/Tensile/Logic/asm_full/aquavanjaram/gfx942/Equality/aquavanjaram_Cijk_Ailk_Bljk_S_MX_B_Bias_HAS_SAV_UserArgs.yaml
- {MinimumRequiredVersion: 4.33.0}
- aquavanjaram
- gfx942
- [Device 0049, Device 0050]
    SolutionIndex: 0
    SolutionNameMin: Cijk_Ailk_Bljk_S_MX_B_Bias_HAS_SAV_UserArgs_MT48x192x16_MI16x16x1_SN_GRPM1_GSU1_GSUC0_GSUWGMRR0_K1_LWPMn1_MIWT3_3_SU4_SUM0_SUS256_WGM0_WGMXCC1_WGMXCCG0
    SolutionIndex: 1
    SolutionNameMin: Cijk_Ailk_Bljk_S_MX_B_Bias_HAS_SAV_UserArgs_MT256x112x16_MI16x16x1_SN_GRPM0p26_GSU1_GSUC0_GSUWGMRR0_K1_LWPM0p25_MIWT4_7_SU16_SUM1_SUS128_WGM4_WGMXCC1_WGMXCCG0
    SolutionIndex: 2
    SolutionNameMin: Cijk_Ailk_Bljk_S_MX_B_Bias_HAS_SAV_UserArgs_MT192x160x16_MI16x16x1_SN_LDSB1_GRPM0p26_GSU1_GSUC0_GSUWGMRR0_K1_LWPM0p27_MIWT6_5_NEPBS0_SU4_SUM0_SUS256_SPO1_WGM304_WGMXCC4_WGMXCCG0
    SolutionIndex: 3
    SolutionNameMin: Cijk_Ailk_Bljk_S_MX_B_Bias_HAS_SAV_UserArgs_MT160x128x16_MI32x32x1_SN_LDSB1_GRPM0p50_GSU1_GSUC0_GSUWGMRR0_K1_LWPMn1_MIWT5_1_NEPBS0_SU4_SUM0_SUS256_SPO0_WGM38_WGMXCC4_WGMXCCG0
    SolutionIndex: 4
    SolutionNameMin: Cijk_Ailk_Bljk_S_MX_B_Bias_HAS_SAV_UserArgs_MT48x64x16_MI16x16x1_SN_GRPM0p27_GSU1_GSUC0_GSUWGMRR0_K1_LWPMn1_MIWT3_1_SU4_SUM0_SUS256_WGM1_WGMXCC1_WGMXCCG0
    SolutionIndex: 5
    SolutionNameMin: Cijk_Ailk_Bljk_S_MX_B_Bias_HAS_SAV_UserArgs_MT112x256x16_MI16x16x1_SN_GRPM1_GRVWB4_GSU1_GSUC0_GSUWGMRR0_K1_LBSPPA896_LBSPPB128_LPB4_LRVW2_LWPMn1_MIWT7_4_SU4_SUM0_SUS256_VWB1_WGM32_WGMXCC2_WGMXCCG0
    SolutionIndex: 6
    SolutionNameMin: Cijk_Ailk_Bljk_S_MX_B_Bias_HAS_SAV_UserArgs_MT96x224x32_MI16x16x1_SN_GRPM0p26_GSU2_GSUC0_GSUWGMRR0_K1_LWPM0p27_MIWT3_7_SU2_SUM0_SUS128_WGM8_WGMXCC16_WGMXCCG32
    SolutionIndex: 7
    SolutionNameMin: Cijk_Ailk_Bljk_S_MX_B_Bias_HAS_SAV_UserArgs_MT160x224x32_MI16x16x1_SN_GRPM0p50_GSU1_GSUC0_GSUWGMRR0_K1_LWPMn1_MIWT5_7_SU4_SUM0_SUS256_WGM0_WGMXCC1_WGMXCCG0
    SolutionIndex: 8
    SolutionNameMin: Cijk_Ailk_Bljk_S_MX_B_Bias_HAS_SAV_UserArgs_MT176x256x32_MI16x16x1_SN_GRPM1_GSU1_GSUC0_GSUWGMRR0_K1_LWPM0p25_MIWT11_4_SU4_SUM0_SUS256_WGM38_WGMXCC2_WGMXCCG0
    SolutionIndex: 9
    SolutionNameMin: Cijk_Ailk_Bljk_S_MX_B_Bias_HAS_SAV_UserArgs_MT192x160x16_MI16x16x1_SN_LDSB1_GRPM0p27_GSU1_GSUC0_GSUWGMRR0_K1_LWPM0p26_MIWT6_5_NEPBS0_SU4_SUM0_SUS256_SPO1_WGM32_WGMXCC4_WGMXCCG0
    SolutionIndex: 10
    SolutionNameMin: Cijk_Ailk_Bljk_S_MX_B_Bias_HAS_SAV_UserArgs_MT224x96x16_MI16x16x1_SN_LDSB1_GRPM1_GSU1_GSUC0_GSUWGMRR0_K1_LWPMn1_MIWT7_3_NEPBS2_SU4_SUM0_SUS256_SPO0_WGM8_WGMXCC1_WGMXCCG0
    SolutionIndex: 11
    SolutionNameMin: Cijk_Ailk_Bljk_S_MX_B_Bias_HAS_SAV_UserArgs_MT128x256x32_MI16x16x1_SN_GRPM0p50_GSU9_GSUC0_GSUWGMRR0_K1_LWPM0p26_MIWT2_16_SU16_SUM0_SUS256_WGM1_WGMXCC8_WGMXCCG304
    SolutionIndex: 12
    SolutionNameMin: Cijk_Ailk_Bljk_S_MX_B_Bias_HAS_SAV_UserArgs_MT256x112x16_MI16x16x1_SN_GRVWA4_GSU1_GSUC0_GSUWGMRR0_K1_LWPM0p50_MIWT4_7_NTD4_SU0_SUM0_SUS0_ULSGRO0_WGM9_WGMXCC8_WGMXCCG304
    SolutionIndex: 13
    SolutionNameMin: Cijk_Ailk_Bljk_S_MX_B_Bias_HAS_SAV_UserArgs_MT64x128x32_MI16x16x1_SN_GRPM0p26_GSU2_GSUC0_GSUWGMRR0_K1_LWPM0p26_MIWT1_8_SU2_SUM0_SUS128_WGM32_WGMXCC1_WGMXCCG0
- - - [40, 1059, 4096, 160]
    - [0, 0.0]
  - - [2048, 4096, 1, 3840]
    - [1, 0.0]
  - - [4384, 4096, 1, 768]
    - [2, 0.0]
  - - [1059, 655360, 1, 57]
    - [3, 0.0]
  - - [40, 105, 4096, 160]
    - [4, 0.0]
  - - [4200, 4096, 1, 1536]
    - [5, 0.0]
  - - [768, 4096, 1, 4384]
    - [6, 0.0]
  - - [5120, 4096, 1, 768]
    - [7, 0.0]
  - - [42360, 4096, 1, 1536]
    - [8, 0.0]
  - - [4384, 4096, 1, 2048]
    - [9, 0.0]
  - - [1059, 655360, 1, 208]
    - [10, 0.0]
  - - [256, 4096, 1, 42360]
    - [11, 0.0]
  - - [2048, 4096, 1, 1024]
    - [12, 0.0]
  - - [256, 4096, 1, 6400]
    - [13, 0.0]
- null
- null
- DeviceEfficiency
- Equality
