library/src/amd_detail/rocblaslt/src/Tensile/Logic/asm_full/aquavanjaram/gfx942/Equality/aquavanjaram_Cijk_Ailk_Bljk_BBS_BH_Bias_HAS_SAV_UserArgs.yaml
- {MinimumRequiredVersion: 4.33.0}
- aquavanjaram
- gfx942
- [Device 0049, Device 0050]
    SolutionIndex: 0
    SolutionNameMin: Cijk_Ailk_Bljk_BBS_BH_Bias_HAS_SAV_UserArgs_MT48x64x32_MI16x16x1_SN_LDSB0_GRVWA2_GRVWB4_GSU1_LBSPPA384_LBSPPB128_LPA16_LPB4_LRVW4_MIWT3_1_NEPBS0_NLCA3_SU8_SUM0_SUS256_SVW1_VWA1_VWB1_WG16_16_1_WGM1_WGMXCC8
    SolutionIndex: 1
    SolutionNameMin: Cijk_Ailk_Bljk_BBS_BH_Bias_HAS_SAV_UserArgs_MT256x96x32_MI16x16x1_SN_LDSB1_GRVWA8_GRVWB4_GSU1_LBSPPA2048_LBSPPB128_LPA0_LPB4_LRVW4_MIWT4_6_NEPBS0_NLCA1_SU8_SUM0_SUS256_SVW4_VWA4_VWB2_WG64_4_1_WGM1_WGMXCC8
    SolutionIndex: 2
    SolutionNameMin: Cijk_Ailk_Bljk_BBS_BH_Bias_HAS_SAV_UserArgs_MT128x256x32_MI16x16x1_SN_LDSB1_GRVWA8_GRVWB4_GSU1_LBSPPA1024_LBSPPB512_LPA0_LPB4_LRVW4_MIWT4_8_NEPBS0_NLCA1_SU8_SUM0_SUS256_SVW4_VWA4_VWB8_WG32_8_1_WGM1_WGMXCC1
    SolutionIndex: 3
    SolutionNameMin: Cijk_Ailk_Bljk_BBS_BH_Bias_HAS_SAV_UserArgs_MT16x128x64_MI16x16x1_SN_LDSB1_GRVWA4_GRVWB8_GSU1_LBSPPA256_LBSPPB256_LPA16_LPB16_LRVW8_MIWT1_2_NEPBS0_NLCA1_SU8_SUM0_SUS256_SVW1_VWA1_VWB2_WG16_16_1_WGM1_WGMXCC8
    SolutionIndex: 4
    SolutionNameMin: Cijk_Ailk_Bljk_BBS_BH_Bias_HAS_SAV_UserArgs_MT128x192x64_MI16x16x1_SN_LDSB1_GRVWA8_GRVWB8_GSU1_LBSPPA2048_LBSPPB256_LPA0_LPB16_LRVW8_MIWT4_6_NEPBS0_NLCA1_SU8_SUM0_SUS256_SVW4_VWA4_VWB2_WG32_8_1_WGM1_WGMXCC8
    SolutionIndex: 5
    SolutionNameMin: Cijk_Ailk_Bljk_BBS_BH_Bias_HAS_SAV_UserArgs_MT128x128x32_MI16x16x1_SN_LDSB1_GRVWA8_GRVWB4_GSU1_LBSPPA1024_LBSPPB256_LPA0_LPB4_LRVW4_MIWT4_4_NEPBS16_NLCA1_SU8_SUM0_SUS256_SVW4_VWA4_VWB4_WG32_8_1_WGM1_WGMXCC8
    SolutionIndex: 6
    SolutionNameMin: Cijk_Ailk_Bljk_BBS_BH_Bias_HAS_SAV_UserArgs_MT128x256x64_MI16x16x1_SN_LDSB1_GRVWA8_GRVWB8_GSU1_LBSPPA2048_LBSPPB1024_LPA0_LPB16_LRVW8_MIWT4_8_NEPBS16_NLCA1_SU8_SUM0_SUS256_SVW4_VWA4_VWB8_WG32_8_1_WGM1_WGMXCC1
    SolutionIndex: 7
    SolutionNameMin: Cijk_Ailk_Bljk_BBS_BH_Bias_HAS_SAV_UserArgs_MT256x256x32_MI16x16x1_SN_GRVWB4_GSU1_LBSPPA2048_LBSPPB512_LPB4_LRVW4_MIWT8_8_NTA0_NTB0_NTC0_NTD0_NEPBS0_SU8_SUM0_SUS256_SVW8_VWA8_VWB8_WGM4_WGMXCC8_WGMXCCG0
    SolutionIndex: 8
    SolutionNameMin: Cijk_Ailk_Bljk_BBS_BH_Bias_HAS_SAV_UserArgs_MT128x128x64_MI16x16x1_SN_GRVWB8_GSU1_LBSPPA2048_LBSPPB512_LPB16_LRVW8_MIWT4_4_NTA0_NTB0_NTC4_NTD4_NEPBS0_SU8_SUM0_SUS256_SVW4_VWA4_VWB4_WGM32_WGMXCC4_WGMXCCG0
    SolutionIndex: 9
    SolutionNameMin: Cijk_Ailk_Bljk_BBS_BH_Bias_HAS_SAV_UserArgs_MT128x128x32_MI16x16x1_SN_GRVWB4_GSU1_LBSPPA1024_LBSPPB256_LPB4_LRVW4_MIWT4_4_NTA0_NTB0_NTC0_NTD4_NEPBS16_SU8_SUM0_SUS256_SVW4_VWA4_VWB4_WGM4_WGMXCC8_WGMXCCG304
    SolutionIndex: 10
    SolutionNameMin: Cijk_Ailk_Bljk_BBS_BH_Bias_HAS_SAV_UserArgs_MT128x256x32_MI16x16x1_SN_GRVWA8_GRVWB4_GSU1_LBSPPA1024_LBSPPB512_LPB4_LRVW4_MIWT4_8_NTC4_NTD4_NEPBS0_SU8_SUM0_SUS256_ULSGRO0_VWB8_WGM1_WGMXCC8_WGMXCCG304
    SolutionIndex: 11
    SolutionNameMin: Cijk_Ailk_Bljk_BBS_BH_Bias_HAS_SAV_UserArgs_MT128x128x64_MI16x16x1_SN_GRVWA8_GRVWB8_GSU1_LBSPPA2048_LBSPPB512_LPB16_LRVW8_MIWT4_4_NTC0_NTD4_NEPBS0_SU8_SUM0_SUS256_ULSGRO0_VWB4_WGM38_WGMXCC8_WGMXCCG32
    SolutionIndex: 12
    SolutionNameMin: Cijk_Ailk_Bljk_BBS_BH_Bias_HAS_SAV_UserArgs_MT128x128x64_MI16x16x1_SN_GSU1_GSUC0_GSUWGMRR0_K1_MIWT4_4_SU8_SUM1_SUS128_WGM32_WGMXCC8_WGMXCCG0
    SolutionIndex: 13
    SolutionNameMin: Cijk_Ailk_Bljk_BBS_BH_Bias_HAS_SAV_UserArgs_MT320x96x32_MI16x16x1_SN_GSU1_GSUC0_GSUWGMRR0_K1_LBSPPA2560_LBSPPB128_LPA16_MIWT5_6_NTC4_NTD0_NEPBS0_NLCA5_SU16_SUM0_SUS256_SVW1_VWA1_VWB2_WG64_4_1_WGM1_WGMXCC1_WGMXCCG0
    SolutionIndex: 14
    SolutionNameMin: Cijk_Ailk_Bljk_BBS_BH_Bias_HAS_SAV_UserArgs_MT192x192x64_MI16x16x1_SN_GRVWA8_GRVWB8_GSU1_GSUC0_GSUWGMRR0_K1_LBSPPA3072_LBSPPB128_LPA0_LPB16_LRVW8_MIWT12_3_NTB0_NTC0_NTD4_NEPBS16_NLCA3_SU8_SUM0_SUS128_SVW4_ULSGRO1_VWA4_VWB1_WG16_16_1_WGM8_WGMXCC8_WGMXCCG304
    SolutionIndex: 15
    SolutionNameMin: Cijk_Ailk_Bljk_BBS_BH_Bias_HAS_SAV_UserArgs_MT256x128x64_MI16x16x1_SN_GRVWA8_GRVWB8_GSU1_GSUC0_GSUWGMRR0_K1_LBSPPA4096_LBSPPB1024_LPA0_LPB16_LRVW8_MIWT4_8_NTB0_NTC4_NTD4_NEPBS0_NLCA1_SU16_SUM0_SUS128_SVW4_ULSGRO0_VWA4_VWB8_WG64_4_1_WGM8_WGMXCC8_WGMXCCG0
    SolutionIndex: 16
    SolutionNameMin: Cijk_Ailk_Bljk_BBS_BH_Bias_HAS_SAV_UserArgs_MT256x128x32_MI16x16x1_SN_GRVWA8_GRVWB4_GSU1_GSUC0_GSUWGMRR0_K1_LBSPPA2048_LBSPPB512_LPA0_LPB4_LRVW4_MIWT4_8_NTB0_NTC4_NTD0_NEPBS16_NLCA1_SU16_SUM1_SUS64_SVW4_ULSGRO0_VWA4_VWB8_WG64_4_1_WGM8_WGMXCC8_WGMXCCG0
    SolutionIndex: 17
    SolutionNameMin: Cijk_Ailk_Bljk_BBS_BH_Bias_HAS_SAV_UserArgs_MT512x128x32_MI16x16x1_SN_GRVWA8_GRVWB4_GSU1_GSUC0_GSUWGMRR0_K1_LBSPPA4096_LBSPPB512_LPA0_LPB4_LRVW4_MIWT8_8_NTB0_NTC0_NTD0_NEPBS16_NLCA1_SU16_SUM1_SUS64_SVW8_ULSGRO0_VWA8_VWB8_WG64_4_1_WGM8_WGMXCC8_WGMXCCG0
    SolutionIndex: 18
    SolutionNameMin: Cijk_Ailk_Bljk_BBS_BH_Bias_AS_SAV_UserArgs_MT256x112x32_MI16x16x1_SN_GRVWA8_GRVWB2_GSU1_GSUC0_GSUWGMRR0_K1_LBSPPA2048_LBSPPB128_MIWT4_7_NTC4_NTD4_NEPBS0_SU8_SUM0_SUS64_SVW4_ULSGRO0_VWA4_VWB1_WG64_4_1_WGM32_WGMXCC1_WGMXCCG0
    SolutionIndex: 19
    SolutionNameMin: Cijk_Ailk_Bljk_BBS_BH_Bias_AS_SAV_UserArgs_MT128x256x32_MI16x16x1_SN_GRVWA8_GSU1_GSUC0_GSUWGMRR0_K1_MIWT4_8_NTC4_NTD4_SU8_SUM0_SUS256_ULSGRO0_USL0_UIOFGRO1_USFGRO0_WGM32_WGMXCC1_WGMXCCG4
    SolutionIndex: 20
    SolutionNameMin: Cijk_Ailk_Bljk_BBS_BH_Bias_AS_SAV_UserArgs_MT256x112x32_MI16x16x1_SN_GRVWA8_GRVWB2_GSU1_GSUC0_GSUWGMRR0_K1_LBSPPA2048_LBSPPB128_MIWT4_7_NTC0_NTD4_NEPBS16_SU0_SUM0_SUS0_SVW4_ULSGRO0_VWA4_VWB1_WG64_4_1_WGM1_WGMXCC8_WGMXCCG0
    SolutionIndex: 21
    SolutionNameMin: Cijk_Ailk_Bljk_BBS_BH_Bias_AS_SAV_UserArgs_MT256x112x32_MI16x16x1_SN_GRVWA8_GRVWB2_GSU1_GSUC0_GSUWGMRR0_K1_LBSPPA2048_LBSPPB128_MIWT4_7_NTC0_NTD4_NEPBS0_SU8_SUM1_SUS256_SVW4_ULSGRO0_VWA4_VWB1_WG64_4_1_WGM1_WGMXCC8_WGMXCCG304
    SolutionIndex: 22
    SolutionNameMin: Cijk_Ailk_Bljk_BBS_BH_Bias_AS_SAV_UserArgs_MT256x112x32_MI16x16x1_SN_GRVWA8_GRVWB2_GSU1_GSUC0_GSUWGMRR0_K1_LBSPPA2048_LBSPPB128_MIWT4_7_NTC0_NTD4_NEPBS16_SU8_SUM0_SUS256_SVW4_ULSGRO0_VWA4_VWB1_WG64_4_1_WGM1_WGMXCC8_WGMXCCG0
    SolutionIndex: 23
    SolutionNameMin: Cijk_Ailk_Bljk_BBS_BH_Bias_AS_SAV_UserArgs_MT256x112x32_MI16x16x1_SN_GRVWA8_GRVWB2_GSU1_GSUC0_GSUWGMRR0_K1_LBSPPA2048_LBSPPB128_MIWT4_7_NTC0_NTD4_NEPBS16_SU16_SUM1_SUS256_SVW4_ULSGRO0_VWA4_VWB1_WG64_4_1_WGM1_WGMXCC8_WGMXCCG304
    SolutionIndex: 24
    SolutionNameMin: Cijk_Ailk_Bljk_BBS_BH_Bias_AS_SAV_UserArgs_MT128x256x32_MI16x16x1_SN_GRVWA8_GRVWB4_GSU1_GSUC0_GSUWGMRR0_K1_LBSPPA1024_LBSPPB512_MIWT4_8_NTC4_NTD4_NEPBS0_SU8_SUM1_SUS64_SVW4_ULSGRO0_VWA4_VWB8_WG32_8_1_WGM0_WGMXCC8_WGMXCCG0
    SolutionIndex: 25
    SolutionNameMin: Cijk_Ailk_Bljk_BBS_BH_Bias_AS_SAV_UserArgs_MT128x128x64_MI16x16x1_SN_GRVWB8_GSU1_GSUC0_GSUWGMRR0_K1_LBSPPA2048_LBSPPB512_LPA0_LPB16_LRVW8_MIWT4_4_NTC0_NTD4_NEPBS16_NLCA1_SU16_SUM0_SUS128_SVW4_VWA4_VWB4_WG32_8_1_WGM8_WGMXCC8_WGMXCCG304
    SolutionIndex: 26
    SolutionNameMin: Cijk_Ailk_Bljk_BBS_BH_Bias_AS_SAV_UserArgs_MT128x256x32_MI16x16x1_SN_GRVWB4_GSU1_GSUC0_GSUWGMRR0_K1_LBSPPA1024_LBSPPB512_LPA0_LPB4_LRVW4_MIWT4_8_NTC4_NTD4_NEPBS0_NLCA1_SU16_SUM1_SUS128_SVW4_VWA4_VWB8_WG32_8_1_WGM1_WGMXCC8_WGMXCCG0
    SolutionIndex: 27
    SolutionNameMin: Cijk_Ailk_Bljk_BBS_BH_Bias_HAS_SAV_UserArgs_MT32x320x64_MI16x16x1_SN_GRPM0p50_GSU1_GSUAMBSK_GSUC0_GSUWGMRR1_K1_LBSPPB128_LPA32_LWPM0p50_MIWT2_5_NTB4_SU0_SUM0_SUS0_SVW2_VWA2_VWB1_WG16_16_1_WGM1_WGMXCC8_WGMXCCG0
    SolutionIndex: 28
    SolutionNameMin: Cijk_Ailk_Bljk_BBS_BH_Bias_HAS_SAV_UserArgs_MT128x128x32_MI16x16x1_SN_GRPM0p50_GRVWA8_GRVWB4_GSU1_GSUAMBSK_GSUC0_GSUWGMRR1_K1_LBSPPA1024_LBSPPB256_LPA0_LPB4_LRVW4_LWPMn1_MIWT4_4_NTD4_SU16_SUM0_SUS64_SVW4_ULSGRO0_VWA4_VWB4_WG32_8_1_WGM8_WGMXCC8_WGMXCCG304
    SolutionIndex: 29
    SolutionNameMin: Cijk_Ailk_Bljk_BBS_BH_Bias_HAS_SAV_UserArgs_MT32x96x64_MI16x16x1_SN_GRPM0p50_GSU1_GSUAMBSK_GSUC0_GSUWGMRR1_K1_LBSPPA512_LPA16_LPB16_LWPMn1_MIWT1_3_NTB7_SU16_SUM1_SUS128_WG32_8_1_WGM1_WGMXCC8_WGMXCCG0
    SolutionIndex: 30
    SolutionNameMin: Cijk_Ailk_Bljk_BBS_BH_Bias_HAS_SAV_UserArgs_MT320x240x32_MI16x16x1_SN_GSU1_GSUC1_GSUWGMRR1_K1_MIWT5_15_NEPBS0_SU16_SUM0_SUS64_WSGRA0_WSGRB2_WGM8_WGMXCC1_WGMXCCGn1
    SolutionIndex: 31
    SolutionNameMin: Cijk_Ailk_Bljk_BBS_BH_Bias_HAS_SAV_UserArgs_MT256x224x64_MI16x16x1_SN_GSU1_GSUC0_GSUWGMRR1_K1_MIWT4_14_NEPBS0_SU8_SUM1_SUS128_WSGRA0_WSGRB0_WGM6_WGMXCC8_WGMXCCG0
    SolutionIndex: 32
    SolutionNameMin: Cijk_Ailk_Bljk_BBS_BH_Bias_HAS_SAV_UserArgs_MT320x256x32_MI16x16x1_SN_GSU1_GSUC0_GSUWGMRR0_K1_MIWT10_8_NEPBS0_SU0_SUM0_SUS0_WSGRA0_WSGRB0_WGM1_WGMXCC8_WGMXCCGn1
    SolutionIndex: 33
    SolutionNameMin: Cijk_Ailk_Bljk_BBS_BH_Bias_HAS_SAV_UserArgs_MT256x240x64_MI16x16x1_SN_GSU1_GSUC0_GSUWGMRR0_K1_MIWT4_15_NEPBS0_SU0_SUM0_SUS0_WSGRA0_WSGRB0_WGM1_WGMXCC1_WGMXCCGn1
    SolutionIndex: 34
    SolutionNameMin: Cijk_Ailk_Bljk_BBS_BH_Bias_HAS_SAV_UserArgs_MT256x224x64_MI16x16x1_SN_GSU1_GSUC0_GSUWGMRR0_K1_MIWT4_14_NEPBS0_SU0_SUM0_SUS0_WSGRB0_WGM4_WGMXCC1_WGMXCCGn1
    SolutionIndex: 35
    SolutionNameMin: Cijk_Ailk_Bljk_BBS_BH_Bias_HAS_SAV_UserArgs_MT320x192x32_MI16x16x1_SN_GSU1_GSUC0_GSUWGMRR0_K1_MIWT10_6_NEPBS0_SU8_SUM0_SUS64_WSGRA2_WSGRB0_WGM32_WGMXCC1_WGMXCCGn1
    SolutionIndex: 36
    SolutionNameMin: Cijk_Ailk_Bljk_BBS_BH_Bias_HAS_SAV_UserArgs_MT320x224x32_MI16x16x1_SN_GSU1_GSUC0_GSUWGMRR0_K1_MIWT5_14_NEPBS0_SU0_SUM0_SUS0_WSGRA0_WSGRB0_WGM1_WGMXCC8_WGMXCCG304
    SolutionIndex: 37
    SolutionNameMin: Cijk_Ailk_Bljk_BBS_BH_Bias_HAS_SAV_UserArgs_MT256x224x64_MI16x16x1_SN_GSU1_GSUC0_GSUWGMRR0_K1_MIWT4_14_NEPBS0_SU0_SUM0_SUS0_WSGRA2_WSGRB2_WGM6_WGMXCC8_WGMXCCGn1
    SolutionIndex: 38
    SolutionNameMin: Cijk_Ailk_Bljk_BBS_BH_Bias_HAS_SAV_UserArgs_MT256x224x64_MI16x16x1_SN_GSU1_GSUC0_GSUWGMRR1_K1_MIWT4_14_NEPBS0_SU0_SUM0_SUS0_WSGRB0_WGM4_WGMXCC1_WGMXCCGn1
    SolutionIndex: 39
    SolutionNameMin: Cijk_Ailk_Bljk_BBS_BH_Bias_HAS_SAV_UserArgs_MT256x224x64_MI16x16x1_SN_GSU1_GSUC1_GSUWGMRR1_K1_MIWT4_14_NEPBS0_SU16_SUM1_SUS128_WSGRB0_WGM4_WGMXCC8_WGMXCCGn1
    SolutionIndex: 40
    SolutionNameMin: Cijk_Ailk_Bljk_BBS_BH_Bias_HAS_SAV_UserArgs_MT320x256x32_MI16x16x1_SN_GSU1_GSUC1_GSUWGMRR1_K1_MIWT10_8_NEPBS0_SU0_SUM0_SUS0_WSGRA2_WSGRB0_WGM1_WGMXCC8_WGMXCCG304
    SolutionIndex: 41
    SolutionNameMin: Cijk_Ailk_Bljk_BBS_BH_HAS_SAB_UserArgs_MT256x320x32_MI16x16x1_SN_LDSB1_DTVA0_GRVWA8_GRVWB4_GSU1_GSUC0_GSUWGMRR0_K1_LBSPPA2048_LBSPPB128_LPA0_LPB4_LRVW4_MIWT8_10_NLCA1_SU16_SUM1_SUS256_SVW8_ULSGRO0_VWA8_VWB2_WSGRA2_WSGRB0_WG32_8_1_WGM32_WGMXCC1_WGMXCCGn1
    SolutionIndex: 42
    SolutionNameMin: Cijk_Ailk_Bljk_BBS_BH_HAS_SAB_UserArgs_MT512x112x64_MI16x16x1_SN_LDSB0_DTVA1_GRVWA8_GRVWB4_GSU1_GSUC0_GSUWGMRR0_K1_LBSPPA0_LBSPPB128_LPA0_LPB16_LRVW8_MIWT8_7_NLCA1_SU0_SUM0_SUS0_SVW8_ULSGRO0_VWA8_VWB1_WSGRA0_WSGRB2_WG64_4_1_WGM1_WGMXCC1_WGMXCCGn1
    SolutionIndex: 43
    SolutionNameMin: Cijk_Ailk_Bljk_BBS_BH_HAS_SAB_UserArgs_MT512x128x64_MI16x16x1_SN_LDSB0_DTVA1_GRVWA8_GRVWB8_GSU1_GSUC0_GSUWGMRR0_K1_LBSPPA0_LBSPPB1024_LPA0_LPB16_LRVW8_MIWT8_8_NLCA1_SU8_SUM1_SUS256_SVW8_ULSGRO0_VWA8_VWB8_WSGRA0_WSGRB0_WG64_4_1_WGM1_WGMXCC1_WGMXCCGn1
    SolutionIndex: 44
    SolutionNameMin: Cijk_Ailk_Bljk_BBS_BH_HAS_SAB_UserArgs_MT512x112x64_MI16x16x1_SN_LDSB0_DTVA1_GRVWA8_GRVWB4_GSU1_GSUC0_GSUWGMRR0_K1_LBSPPA0_LBSPPB128_LPA0_LPB16_LRVW8_MIWT8_7_NLCA1_SU8_SUM1_SUS256_SVW8_ULSGRO0_VWA8_VWB1_WSGRA0_WSGRB2_WG64_4_1_WGM1_WGMXCC1_WGMXCCGn1
    SolutionIndex: 45
    SolutionNameMin: Cijk_Ailk_Bljk_BBS_BH_HAS_SAB_UserArgs_MT512x128x64_MI16x16x1_SN_LDSB0_DTVA1_GRVWA8_GRVWB8_GSU1_GSUC0_GSUWGMRR0_K1_LBSPPA0_LBSPPB1024_LPA0_LPB16_LRVW8_MIWT8_8_NLCA1_SU8_SUM1_SUS256_SVW8_ULSGRO0_VWA8_VWB8_WSGRA0_WSGRB2_WG64_4_1_WGM1_WGMXCC1_WGMXCCGn1
    SolutionIndex: 46
    SolutionNameMin: Cijk_Ailk_Bljk_BBS_BH_HAS_SAB_UserArgs_MT512x112x64_MI16x16x1_SN_LDSB0_DTVA1_GRVWA8_GRVWB4_GSU1_GSUC0_GSUWGMRR0_K1_LBSPPA0_LBSPPB128_LPA0_LPB16_LRVW8_MIWT8_7_NLCA1_SU0_SUM0_SUS0_SVW8_ULSGRO0_VWA8_VWB1_WSGRA0_WSGRB0_WG64_4_1_WGM1_WGMXCC1_WGMXCCGn1
    SolutionIndex: 47
    SolutionNameMin: Cijk_Ailk_Bljk_BBS_BH_HAS_SAB_UserArgs_MT512x112x64_MI16x16x1_SN_LDSB0_DTVA1_GRVWA8_GRVWB4_GSU1_GSUC0_GSUWGMRR0_K1_LBSPPA0_LBSPPB128_LPA0_LPB16_LRVW8_MIWT8_7_NLCA1_SU16_SUM1_SUS256_SVW8_ULSGRO0_VWA8_VWB1_WSGRA0_WSGRB2_WG64_4_1_WGM1_WGMXCC1_WGMXCCGn1
    SolutionIndex: 48
    SolutionNameMin: Cijk_Ailk_Bljk_BBS_BH_HAS_SAB_UserArgs_MT512x112x64_MI16x16x1_SN_LDSB0_DTVA1_GRVWA8_GRVWB4_GSU1_GSUC0_GSUWGMRR0_K1_LBSPPA0_LBSPPB128_LPA0_LPB16_LRVW8_MIWT8_7_NLCA1_SU16_SUM1_SUS128_SVW8_ULSGRO0_VWA8_VWB1_WSGRA0_WSGRB2_WG64_4_1_WGM8_WGMXCC1_WGMXCCGn1
    SolutionIndex: 49
    SolutionNameMin: Cijk_Ailk_Bljk_BBS_BH_HAS_SAB_UserArgs_MT512x112x64_MI16x16x1_SN_LDSB0_DTVA1_GRVWA8_GRVWB4_GSU1_GSUC0_GSUWGMRR0_K1_LBSPPA0_LBSPPB128_LPA0_LPB16_LRVW8_MIWT8_7_NLCA1_SU0_SUM0_SUS0_SVW8_ULSGRO0_VWA8_VWB1_WSGRA0_WSGRB2_WG64_4_1_WGM8_WGMXCC1_WGMXCCGn1
    SolutionIndex: 50
    SolutionNameMin: Cijk_Ailk_Bljk_BBS_BH_HAS_SAB_UserArgs_MT512x112x64_MI16x16x1_SN_LDSB0_DTVA1_GRVWA8_GRVWB4_GSU1_GSUC0_GSUWGMRR0_K1_LBSPPA0_LBSPPB128_LPA0_LPB16_LRVW8_MIWT8_7_NLCA1_SU8_SUM1_SUS256_SVW8_ULSGRO0_VWA8_VWB1_WSGRA0_WSGRB0_WG64_4_1_WGM8_WGMXCC1_WGMXCCGn1
- - - [35, 128, 5940, 8]
    - [0, 0.0]
  - - [512, 2540, 16, 120]
    - [5, 0.0]
  - - [512, 2540, 16, 512]
    - [1, 0.0]
  - - [8, 5940, 35, 1024]
    - [3, 0.0]
  - - [128, 5940, 8, 128]
    - [6, 0.0]
  - - [128, 5940, 34, 128]
    - [2, 0.0]
  - - [128, 5940, 8, 1024]
    - [4, 0.0]
  - - [208448, 1792, 1, 2048]
    - [7, 0.0]
  - - [2304, 1792, 1, 4800]
    - [8, 0.0]
  - - [384, 128, 1792, 200]
    - [9, 0.0]
  - - [384, 204800, 1, 384]
    - [10, 0.0]
  - - [2304, 1024, 1, 4800]
    - [11, 0.0]
  - - [4800, 1024, 1, 24576]
    - [12, 0.0]
  - - [32, 257, 2048, 192]
    - [29, 0.0]
  - - [32, 6514, 2048, 192]
    - [27, 0.0]
  - - [257, 393216, 1, 384]
    - [13, 0.0]
  - - [384, 128, 2048, 200]
    - [28, 0.0]
  - - [384, 409600, 1, 384]
    - [26, 0.0]
  - - [2304, 2048, 1, 4800]
    - [25, 0.0]
  - - [4800, 2048, 1, 2304]
    - [14, 0.0]
  - - [4800, 2048, 1, 24576]
    - [15, 0.0]
  - - [6514, 393216, 1, 641]
    - [16, 0.0]
  - - [208448, 2048, 1, 2048]
    - [17, 0.0]
  - - [512, 365802, 1, 256]
    - [18, 0.0]
  - - [512, 401179, 1, 256]
    - [19, 0.0]
  - - [1024, 395225, 1, 256]
    - [20, 0.0]
  - - [1024, 395225, 1, 512]
    - [21, 0.0]
  - - [1536, 331051, 1, 256]
    - [22, 0.0]
  - - [1536, 331051, 1, 512]
    - [23, 0.0]
  - - [1664, 141098, 1, 512]
    - [24, 0.0]
  - - [1600, 43008, 1, 4800]
    - [30, 0.0]
  - - [6400, 43008, 1, 1600]
    - [31, 0.0]
  - - [1600, 43008, 1, 6400]
    - [32, 0.0]
  - - [14336, 24576, 1, 4096]
    - [33, 0.0]
  - - [4096, 24576, 1, 14336]
    - [34, 0.0]
  - - [1600, 43008, 1, 1600]
    - [35, 0.0]
  - - [1600, 51200, 1, 50304]
    - [36, 0.0]
  - - [4096, 24576, 1, 4096]
    - [37, 0.0]
  - - [4096, 24576, 1, 32000]
    - [38, 0.0]
  - - [4096, 24576, 1, 6144]
    - [39, 0.0]
  - - [1600, 43008, 1, 50304]
    - [40, 0.0]
  - - [28672, 61440, 1, 8192]
    - [41, 296.62]
  - - [8192, 57344, 1, 10240]
    - [42, 333.42]
  - - [8192, 57344, 1, 128256]
    - [43, 304.01]
  - - [8192, 57344, 1, 28672]
    - [44, 309.73]
  - - [8192, 57344, 1, 8192]
    - [45, 324.1]
  - - [8192, 61440, 1, 10240]
    - [42, 334.66]
  - - [8192, 61440, 1, 128256]
    - [45, 305.46]
  - - [8192, 61440, 1, 28672]
    - [42, 308.34]
  - - [8192, 61440, 1, 8192]
    - [46, 320.29]
  - - [14336, 20480, 1, 4096]
    - [43, 316.74]
  - - [4096, 20480, 1, 128256]
    - [47, 299.35]
  - - [4096, 20480, 1, 14336]
    - [48, 312.03]
  - - [4096, 20480, 1, 4096]
    - [49, 300.14]
  - - [4096, 20480, 1, 6144]
    - [50, 307.43]
- null
- null
- DeviceEfficiency
- Equality
