library/src/amd_detail/rocblaslt/src/Tensile/Logic/asm_full/aquavanjaram/gfx942/Equality/aquavanjaram_Cijk_Alik_Bljk_F8B8BS_BH_BiasSB_HAS_SAB_SAV_UserArgs.yaml
- {MinimumRequiredVersion: 4.33.0}
- aquavanjaram
- gfx942
- [Device 0049, Device 0050]
    SolutionIndex: 0
    SolutionNameMin: Cijk_Alik_Bljk_F8B8BS_BH_BiasSB_HAS_SAB_SAV_UserArgs_MT256x256x64_MI16x16x1_SN_LDSB1_DTVA0_GRVWA8_GRVWB8_GSU1_GSUC0_GSUWGMRR0_K1_LBSPPA512_LBSPPB512_LPA8_LPB8_LRVW8_MIWT8_8_NLCA1_SU8_SUM0_SUS256_SVW8_VWA8_VWB8_WG32_8_1_WGM8_WGMXCC8_WGMXCCGn1
    SolutionIndex: 1
    SolutionNameMin: Cijk_Alik_Bljk_F8B8BS_BH_BiasSB_HAS_SAB_SAV_UserArgs_MT256x192x128_MI16x16x1_SN_GSU1_GSUC0_GSUWGMRR0_K1_MIWT8_6_SU8_SUM0_SUS256_WGM8_WGMXCC8_WGMXCCGn1
    SolutionIndex: 2
    SolutionNameMin: Cijk_Alik_Bljk_F8B8BS_BH_BiasSB_HAS_SAB_SAV_UserArgs_MT256x160x128_MI16x16x1_SN_GSU1_GSUC0_GSUWGMRR0_K1_LBSPPA1024_LBSPPB128_MIWT8_5_SU8_SUM0_SUS256_SVW8_VWA8_WGM8_WGMXCC8_WGMXCCGn1
    SolutionIndex: 3
    SolutionNameMin: Cijk_Alik_Bljk_F8B8BS_BH_BiasSB_HAS_SAB_SAV_UserArgs_MT256x192x64_MI16x16x1_SN_LDSB0_GRVWA8_GRVWB8_GSU1_GSUC0_GSUWGMRR0_K1_LBSPPA512_LBSPPB128_LPA8_LPB8_LRVW8_MIWT8_6_SU8_SUM0_SUS256_VWB2_WGM8_WGMXCC8_WGMXCCGn1
    SolutionIndex: 4
    SolutionNameMin: Cijk_Alik_Bljk_F8B8BS_BH_BiasSB_HAS_SAB_SAV_UserArgs_MT96x96x256_MI16x16x1_SN_GRVWA16_GRVWB16_GSU1_GSUC0_GSUWGMRR0_K1_LBSPPA256_LBSPPB256_LPA32_LPB32_LRVW16_MIWT3_3_SU8_SUM0_SUS256_SVW1_VWA1_VWB1_WG32_8_1_WGM8_WGMXCC8_WGMXCCGn1
    SolutionIndex: 5
    SolutionNameMin: Cijk_Alik_Bljk_F8B8BS_BH_BiasSB_HAS_SAB_SAV_UserArgs_MT224x128x128_MI16x16x1_SN_DTVA0_GRVWB16_GSU1_GSUC0_GSUWGMRR0_K1_LBSPPA128_LBSPPB512_LPA32_MIWT7_4_NLCA1_SU8_SUM0_SUS256_SVW1_VWA1_VWB4_WG32_8_1_WGM8_WGMXCC1_WGMXCCGn1
    SolutionIndex: 6
    SolutionNameMin: Cijk_Alik_Bljk_F8B8BS_BH_BiasSB_HAS_SAB_SAV_UserArgs_MT256x256x64_MI16x16x1_SN_GSU1_GSUC0_GSUWGMRR0_K1_MIWT8_8_SU8_SUM0_SUS256_WGM8_WGMXCC8_WGMXCCGn1
    SolutionIndex: 7
    SolutionNameMin: Cijk_Alik_Bljk_F8B8BS_BH_BiasSB_HAS_SAB_SAV_UserArgs_MT256x160x128_MI16x16x1_SN_GSU1_GSUC0_GSUWGMRR0_K1_MIWT8_5_SU8_SUM0_SUS256_WGM8_WGMXCC8_WGMXCCGn1
    SolutionIndex: 8
    SolutionNameMin: Cijk_Alik_Bljk_F8B8BS_BH_BiasSB_HAS_SAB_SAV_UserArgs_MT256x192x64_MI16x16x1_SN_GSU1_GSUC0_GSUWGMRR0_K1_MIWT8_6_SU8_SUM0_SUS256_WGM8_WGMXCC8_WGMXCCGn1
    SolutionIndex: 9
    SolutionNameMin: Cijk_Alik_Bljk_F8B8BS_BH_BiasSB_HAS_SAB_SAV_UserArgs_MT256x256x64_MI16x16x1_SN_LDSB1_GRVWA8_GRVWB8_GSU1_GSUC0_GSUWGMRR0_K1_LBSPPA512_LBSPPB512_LPA8_LPB8_LRVW8_MIWT8_8_SU8_SUM0_SUS256_SVW8_VWA8_VWB8_WG32_8_1_WGM8_WGMXCC8_WGMXCCGn1
    SolutionIndex: 10
    SolutionNameMin: Cijk_Alik_Bljk_F8B8BS_BH_BiasSB_HAS_SAB_SAV_UserArgs_MT160x256x128_MI16x16x1_SN_LDSB1_DTVA0_GRVWB16_GSU1_GSUC0_GSUWGMRR0_K1_LBSPPA128_LBSPPB1024_LPA32_MIWT5_8_NLCA1_SU8_SUM0_SUS256_SVW1_VWA1_VWB8_WG32_8_1_WGM8_WGMXCC8_WGMXCCGn1
    SolutionIndex: 11
    SolutionNameMin: Cijk_Alik_Bljk_F8B8BS_BH_BiasSB_HAS_SAB_SAV_UserArgs_MT256x160x128_MI16x16x1_SN_GSU1_GSUC0_GSUWGMRR0_K1_LBSPPA1024_LBSPPB128_MIWT8_5_SU8_SUM0_SUS256_SVW8_VWA8_WGM1_WGMXCC8_WGMXCCGn1
    SolutionIndex: 12
    SolutionNameMin: Cijk_Alik_Bljk_F8B8BS_BH_BiasSB_HAS_SAB_SAV_UserArgs_MT256x240x64_MI16x16x1_SN_LDSB1_DTVA0_GRVWA8_GRVWB4_GSU1_GSUC0_GSUWGMRR0_K1_LBSPPA256_LBSPPB128_LPA8_LPB8_LRVW8_MIWT4_15_NLCA1_SU0_SUM0_SUS0_SVW4_VWA4_VWB1_WG64_4_1_WGM8_WGMXCC1_WGMXCCGn1
    SolutionIndex: 13
    SolutionNameMin: Cijk_Alik_Bljk_F8B8BS_BH_BiasSB_HAS_SAB_SAV_UserArgs_MT96x96x256_MI16x16x1_SN_GSU1_GSUC0_GSUWGMRR0_K1_MIWT3_3_SU8_SUM0_SUS256_WGM8_WGMXCC8_WGMXCCGn1
    SolutionIndex: 14
    SolutionNameMin: Cijk_Alik_Bljk_F8B8BS_BH_BiasSB_HAS_SAB_SAV_UserArgs_MT256x240x64_MI16x16x1_SN_LDSB1_DTVA0_GRVWA8_GRVWB4_GSU1_GSUC0_GSUWGMRR0_K1_LBSPPA256_LBSPPB128_LPA8_LPB8_LRVW8_MIWT4_15_NLCA1_SU8_SUM0_SUS256_VWB1_WGM8_WGMXCC1_WGMXCCGn1
    SolutionIndex: 15
    SolutionNameMin: Cijk_Alik_Bljk_F8B8BS_BH_BiasSB_HAS_SAB_SAV_UserArgs_MT224x256x128_MI16x16x1_SN_LDSB1_DTVA0_GRVWA8_GRVWB8_GSU2_GSUC0_GSUWGMRR0_K1_LBSPPA128_LBSPPB1024_LPA8_LPB8_LRVW8_MIWT7_8_NLCA1_SU8_SUM0_SUS256_SVW1_VWA1_VWB8_WG32_8_1_WGM8_WGMXCC1_WGMXCCGn1
- - - [1600, 1600, 1, 51200]
    - [13, 0.0]
  - - [1600, 4800, 1, 51200]
    - [15, 0.0]
  - - [1600, 51200, 1, 1600]
    - [12, 0.0]
  - - [1600, 51200, 1, 4800]
    - [14, 0.0]
  - - [1600, 51200, 1, 6400]
    - [10, 0.0]
  - - [1600, 6400, 1, 51200]
    - [11, 0.0]
  - - [4800, 51200, 1, 1600]
    - [6, 0.0]
  - - [6400, 1600, 1, 51200]
    - [10, 0.0]
  - - [6400, 51200, 1, 1600]
    - [9, 0.0]
  - - [6400, 8192, 1, 1600]
    - [0, 0.0]
  - - [6400, 1600, 1, 8192]
    - [7, 0.0]
  - - [1600, 8192, 1, 6400]
    - [1, 0.0]
  - - [1600, 6400, 1, 8192]
    - [2, 0.0]
  - - [1600, 8192, 1, 1600]
    - [3, 0.0]
  - - [1600, 1600, 1, 8192]
    - [4, 0.0]
  - - [1600, 8192, 1, 4800]
    - [8, 0.0]
  - - [1600, 4800, 1, 8192]
    - [5, 0.0]
- null
- null
- DeviceEfficiency
- Equality
